================================================================================
                        FULL GAME - Team_045 vs Team_039                        
================================================================================

================================================================================
                       1ST QUARTER - Team_045 vs Team_039                       
================================================================================

[12:00] Team_045 possession (Score: 0-0)
Trae Russell drives to the basket... Trae Russell loses control! Ball rolls out of bounds! TURNOVER! (dead ball)

[11:47] Team_039 possession (Score: 0-0)
Klay Wade throws a bad pass! Stolen by Zion Butler! TURNOVER! (live ball)

[11:34] Team_045 possession (Score: 0-0)
DeMar Turner attempts a 3Pt. Contested by Jrue Bridges (3.4 feet, ZONE). DeMar Turner misses. Rebound secured by Donovan Markkanen.

[11:19] Team_039 possession (Score: 0-0)
Jrue Bridges attempts a Midrange. Contested by Rudy Antetokounmpo (4.7 feet, MAN). Jrue Bridges misses. Rebound secured by Cole Simons.

[11:00] Team_045 possession (Score: 0-0)
Cole Simons drives and kicks out. Rudy Antetokounmpo attempts a 3Pt. Contested by Jrue Bridges (3.1 feet, MAN). Rudy Antetokounmpo misses. Rebound secured by Donovan Markkanen.

[10:44] Team_039 possession (Score: 0-0)
FOUL! Shooting foul on Zion Butler. Jrue Bridges to the line for 2 free throws. [Team fouls: 1] (Zion Butler: 1 personal fouls)   FT 1/2: GOOD   FT 2/2: GOOD Jrue Bridges makes 2/2 from the line.
Score: 0-2

[10:27] Team_045 possession (Score: 0-2)
Zion Butler makes the Layup and draws the foul on Donovan Markkanen! And-1! Zion Butler to the line for 1. [Team fouls: 1] (Donovan Markkanen: 1 personal fouls)   FT 1/1: GOOD Zion Butler makes 1/1 from the line.
Score: 3-2

[10:16] Team_039 possession (Score: 3-2)
Donovan Markkanen attempts a Layup. BLOCKED BY ZION BUTLER! Ball is loose! Offensive rebound by Klay Wade! Klay Wade kicks it out.

[10:05] Team_039 possession (Score: 3-2)
Austin O'Neal attempts a 3Pt. Contested by Cole Simons (3.4 feet, MAN). Austin O'Neal misses. Rebound secured by Zion Butler.

[09:50] Team_045 possession (Score: 3-2)
Zion Butler attempts a 3Pt. Contested by Jrue Bridges (3.4 feet, ZONE). ZION BUTLER MAKES IT! Assist: Trae Russell
Score: 6-2

[09:35] Team_039 possession (Score: 6-2)
Anfernee Carter throws a bad pass! Stolen by Zion Butler! TURNOVER! (live ball)

[09:23] Team_045 possession (Score: 6-2)
DeMar Turner attempts a Layup. Contested by Klay Wade (4.3 feet, ZONE). DEMAR TURNER MAKES IT!
Score: 8-2

[09:05] Team_039 possession (Score: 8-2)
Jrue Bridges makes the Layup and draws the foul on Zion Butler! And-1! Jrue Bridges to the line for 1. [Team fouls: 2] (Zion Butler: 2 personal fouls)   FT 1/1: GOOD Jrue Bridges makes 1/1 from the line.
Score: 8-5

[08:55] Team_045 possession (Score: 8-5)
DeMar Turner attempts a 3Pt. Contested by Jrue Bridges (3.4 feet, ZONE). DeMar Turner misses. Rebound secured by Donovan Markkanen.

[08:42] Team_039 possession (Score: 8-5)
Austin O'Neal drives and kicks out. FOUL! Shooting foul on Cole Simons. Donovan Markkanen to the line for 3 free throws. [Team fouls: 3] (Cole Simons: 1 personal fouls)   FT 1/3: GOOD   FT 2/3: MISS   FT 3/3: GOOD Donovan Markkanen makes 2/3 from the line.
Score: 8-7

[08:30] Team_045 possession (Score: 8-7)
DeMar Turner attempts a 3Pt. Contested by Jrue Bridges (3.4 feet, ZONE). DeMar Turner misses. Rebound secured by Austin O'Neal.

[08:16] Team_039 possession (Score: 8-7)
Donovan Markkanen attempts a Layup. Contested by Cole Simons (3.5 feet, MAN). DONOVAN MARKKANEN MAKES IT! Assist: Jrue Bridges
Score: 8-9

[08:03] Team_045 possession (Score: 8-9)
Rudy Antetokounmpo attempts a 3Pt. Contested by Jrue Bridges (3.4 feet, ZONE). RUDY ANTETOKOUNMPO MAKES IT! Assist: Zion Butler
Score: 11-9

[07:48] Team_039 possession (Score: 11-9)
Klay Wade makes the Layup and draws the foul on Zion Butler! And-1! Klay Wade to the line for 1. [Team fouls: 4] (Zion Butler: 3 personal fouls)   FT 1/1: GOOD Klay Wade makes 1/1 from the line.
Score: 11-12

[07:36] Team_045 possession (Score: 11-12)
Trae Russell attempts a Midrange. Contested by Donovan Markkanen (4.3 feet, MAN). Trae Russell misses. Rebound secured by Klay Wade.

[07:24] Team_039 possession (Score: 11-12)
Austin O'Neal makes the Dunk and draws the foul on Zion Butler! And-1! Austin O'Neal to the line for 1. [BONUS: 5 team fouls] (Zion Butler: 4 personal fouls)   FT 1/1: GOOD Austin O'Neal makes 1/1 from the line.
Score: 11-15

[07:13] Team_045 possession (Score: 11-15)
FOUL! Holding foul on Klay Wade. [Team fouls: 2] No free throws, side out. (Klay Wade: 1 personal fouls)

[06:58] Team_045 possession (Score: 11-15)
Trae Russell drives to the basket... FOUL! Offensive foul on Trae Russell! Klay Wade drew the charge! [Team fouls: 6] (Trae Russell: 1 personal fouls) TURNOVER! (dead ball)

[06:45] Team_039 possession (Score: 11-15)
FOUL! Holding foul on Zion Butler. [IN THE BONUS! 7 team fouls] Anfernee Carter to the line for 2 free throws. (Zion Butler: 5 personal fouls)   FT 1/2: GOOD   FT 2/2: MISS Anfernee Carter makes 1/2 from the line. Rebound secured by DeMar Turner.
Score: 11-16

[06:27] Team_045 possession (Score: 11-16)
Trae Russell attempts a 3Pt. Contested by Donovan Markkanen (4.3 feet, MAN). Trae Russell misses. Offensive rebound by Zion Butler! Zion Butler's putback is no good. Offensive rebound by DeMar Turner! DeMar Turner kicks it out.

[06:15] Team_045 possession (Score: 11-16)
Cole Simons attempts a 3Pt. Contested by Austin O'Neal (4.5 feet, MAN). Cole Simons misses. Rebound secured by Klay Wade.

[06:00] Team_039 possession (Score: 11-16)
Anfernee Carter attempts a 3Pt. Contested by Zion Butler (3.5 feet, MAN). ANFERNEE CARTER MAKES IT! Assist: Klay Wade
Score: 11-19

[05:43] Team_045 possession (Score: 11-19)
FOUL! Shooting foul on Donovan Markkanen. DeMar Turner to the line for 2 free throws. [Team fouls: 3] (Donovan Markkanen: 2 personal fouls)   FT 1/2: MISS   FT 2/2: GOOD DeMar Turner makes 1/2 from the line.
Score: 12-19

[05:33] Team_039 possession (Score: 12-19)
Donovan Markkanen attempts a 3Pt. Contested by Cole Simons (3.5 feet, ZONE). Donovan Markkanen misses. Rebound secured by Zion Butler.

[05:19] Team_045 possession (Score: 12-19)
FOUL! Reach-in foul on Jrue Bridges during the drive. [Team fouls: 4] No free throws, side out. (Jrue Bridges: 1 personal fouls)

[05:07] Team_045 possession (Score: 12-19)
Rudy Antetokounmpo drives, Jrue Bridges stays with him. Rudy Antetokounmpo attempts a Layup. Contested by Jrue Bridges (3.5 feet, MAN). Rudy Antetokounmpo misses. Rebound secured by Donovan Markkanen.

[04:57] Team_039 possession (Score: 12-19)
FOUL! Shooting foul on Zion Butler. Klay Wade to the line for 2 free throws. [BONUS: 8 team fouls] (Zion Butler: 6 personal fouls) Zion Butler FOULS OUT!   FT 1/2: GOOD   FT 2/2: GOOD Klay Wade makes 2/2 from the line.
Score: 12-21

[04:57] Substitution (Team_045): Zion Butler OUT (stamina: 74) → John Wagner IN (foul_out)

[04:40] Team_045 possession (Score: 12-21)
Trae Russell attempts a Midrange. Contested by Donovan Markkanen (4.3 feet, ZONE). TRAE RUSSELL MAKES IT!
Score: 14-21

[04:23] Team_039 possession (Score: 14-21)
Klay Wade attempts a Midrange. Contested by Cole Simons (4.0 feet, ZONE). Klay Wade misses. FOUL! Loose ball foul on Cole Simons during the rebound battle. [IN THE BONUS! 9 team fouls] Austin O'Neal to the line for 2 free throws. (Cole Simons: 2 personal fouls)   FT 1/2: GOOD   FT 2/2: MISS Austin O'Neal makes 1/2 from the line. Rebound secured by Cole Simons.
Score: 14-22

[04:07] Team_045 possession (Score: 14-22)
FOUL! Holding foul on Jrue Bridges. [IN THE BONUS! 5 team fouls] Rudy Antetokounmpo to the line for 2 free throws. (Jrue Bridges: 2 personal fouls)   FT 1/2: GOOD   FT 2/2: MISS Rudy Antetokounmpo makes 1/2 from the line. Rebound secured by Donovan Markkanen.
Score: 15-22

[03:51] Team_039 possession (Score: 15-22)
Austin O'Neal attempts a Midrange. Contested by Cole Simons (3.6 feet, MAN). AUSTIN O'NEAL MAKES IT! Assist: Jrue Bridges
Score: 15-24

[03:39] Team_045 possession (Score: 15-24)
Cole Simons attempts a Midrange. Contested by Austin O'Neal (4.7 feet, MAN). Cole Simons misses. Rebound secured by Donovan Markkanen.

[03:21] Team_039 possession (Score: 15-24)
FOUL! Reach-in foul on Cole Simons during the drive. [IN THE BONUS! 10 team fouls] Donovan Markkanen to the line for 2 free throws. (Cole Simons: 3 personal fouls)   FT 1/2: GOOD   FT 2/2: GOOD Donovan Markkanen makes 2/2 from the line.
Score: 15-26

[03:04] Team_045 possession (Score: 15-26)
DeMar Turner attempts a Layup. BLOCKED BY KLAY WADE! Ball deflects out of bounds off DeMar Turner.

[02:48] Team_039 possession (Score: 15-26)
Austin O'Neal attempts a 3Pt. Contested by Cole Simons (3.7 feet, ZONE). Austin O'Neal misses. Rebound secured by DeMar Turner.

[02:30] Team_045 possession (Score: 15-26)
FOUL! Shooting foul on Donovan Markkanen. Trae Russell to the line for 2 free throws. [BONUS: 6 team fouls] (Donovan Markkanen: 3 personal fouls)   FT 1/2: MISS   FT 2/2: GOOD Trae Russell makes 1/2 from the line.
Score: 16-26

[02:12] Team_039 possession (Score: 16-26)
Anfernee Carter makes the Dunk and draws the foul on DeMar Turner! And-1! Anfernee Carter to the line for 1. [BONUS: 11 team fouls] (DeMar Turner: 1 personal fouls)   FT 1/1: GOOD Anfernee Carter makes 1/1 from the line.
Score: 16-29

[01:56] Team_045 possession (Score: 16-29)
Cole Simons attempts a 3Pt. Contested by Austin O'Neal (4.9 feet, MAN). Cole Simons misses. Offensive rebound by Cole Simons! Cole Simons kicks it out.

[01:45] Team_045 possession (Score: 16-29)
John Wagner attempts a Midrange. Contested by Austin O'Neal (4.5 feet, ZONE). JOHN WAGNER MAKES IT! Assist: Rudy Antetokounmpo
Score: 18-29

[01:33] Team_039 possession (Score: 18-29)
FOUL! Shooting foul on Rudy Antetokounmpo. Anfernee Carter to the line for 2 free throws. [BONUS: 12 team fouls] (Rudy Antetokounmpo: 1 personal fouls)   FT 1/2: GOOD   FT 2/2: GOOD Anfernee Carter makes 2/2 from the line.
Score: 18-31

[01:18] Team_045 possession (Score: 18-31)
Cole Simons attempts a Layup. Contested by Austin O'Neal (5.0 feet, MAN). Cole Simons misses. Rebound secured by Donovan Markkanen.

[01:04] Team_039 possession (Score: 18-31)
Klay Wade makes the Layup and draws the foul on DeMar Turner! And-1! Klay Wade to the line for 1. [BONUS: 13 team fouls] (DeMar Turner: 2 personal fouls)   FT 1/1: GOOD Klay Wade makes 1/1 from the line.
Score: 18-34

[00:50] Team_045 possession (Score: 18-34)
John Wagner drives and kicks out. DeMar Turner attempts a Midrange. Contested by Klay Wade (4.5 feet, MAN). DEMAR TURNER MAKES IT! Assist: John Wagner
Score: 20-34

[00:32] Team_039 possession (Score: 20-34)
Klay Wade attempts a Midrange. Contested by DeMar Turner (5.8 feet, ZONE). KLAY WADE MAKES IT! Assist: Donovan Markkanen
Score: 20-36

[00:14] Team_045 possession (Score: 20-36)
Cole Simons attempts a 3Pt. Contested by Jrue Bridges (4.3 feet, ZONE). Cole Simons misses. Offensive rebound by Cole Simons! Cole Simons kicks it out.

[00:02] Team_045 possession (Score: 20-36)
Rudy Antetokounmpo attempts a Midrange. Contested by Austin O'Neal (4.9 feet, ZONE). Rudy Antetokounmpo misses. Rebound secured by Donovan Markkanen.

================================================================================
                              1ST QUARTER COMPLETE                              
================================================================================

1ST QUARTER SCORE: Team_045 20, Team_039 36

BOX SCORE:
================================================================================

Team_045
--------------------------------------------------------------------------------
Player                MIN  PTS  REB  AST  TO      FG   FG%      3P   3P%
--------------------------------------------------------------------------------
Zion Butler             7    6    2    1   0   2/2   100.0     0/0   0.0
DeMar Turner           12    5    3    0   0   3/7    42.9     0/0   0.0
Trae Russell           12    3    0    1   0   2/3    66.7     0/0   0.0
Rudy Antetokounmpo     12    3    0    1   0   1/3    33.3     0/0   0.0
John Wagner             5    2    0    1   0   1/1   100.0     0/0   0.0
Cole Simons            12    0    4    0   0   0/4     0.0     0/0   0.0

TEAM: FG: 9/21 (42.9%), 3PT: 2/6 (33.3%), REB: 8 (3 off, 5 def), AST: 4, TO: 2
TEAM FOULS: 13 [Team_039 in BONUS]


Team_039
--------------------------------------------------------------------------------
Player                MIN  PTS  REB  AST  TO      FG   FG%      3P   3P%
--------------------------------------------------------------------------------
Klay Wade              12   10    3    1   0   4/5    80.0     0/0   0.0
Anfernee Carter        12    8    0    0   0   3/3   100.0     0/0   0.0
Donovan Markkanen      12    6    8    1   0   3/4    75.0     0/0   0.0
Jrue Bridges           12    5    0    2   0   2/3    66.7     0/0   0.0
Austin O'Neal          12    5    1    0   0   2/4    50.0     0/0   0.0

TEAM: FG: 14/20 (70.0%), 3PT: 1/4 (25.0%), REB: 13 (2 off, 11 def), AST: 4, TO: 2
TEAM FOULS: 6 [Team_045 in BONUS]

================================================================================

================================================================================
                       2ND QUARTER - Team_045 vs Team_039                       
================================================================================

[12:00] Team_045 possession (Score: 20-36)
FOUL! Holding foul on Jrue Bridges. [Team fouls: 1] No free throws, side out. (Jrue Bridges: 1 personal fouls)

[11:44] Team_045 possession (Score: 20-36)
DeMar Turner makes the Dunk and draws the foul on Klay Wade! And-1! DeMar Turner to the line for 1. [Team fouls: 2] (Klay Wade: 1 personal fouls)   FT 1/1: GOOD DeMar Turner makes 1/1 from the line.
Score: 23-36

[11:30] Team_039 possession (Score: 23-36)
Klay Wade drives to the basket... FOUL! Offensive foul on Klay Wade! Zion Butler drew the charge! [Team fouls: 3] (Klay Wade: 2 personal fouls) TURNOVER! (dead ball)

[11:18] Team_045 possession (Score: 23-36)
Zion Butler attempts a Midrange. Contested by Klay Wade (4.7 feet, MAN). ZION BUTLER MAKES IT!
Score: 25-36

[11:00] Team_039 possession (Score: 25-36)
Donovan Markkanen makes the 3Pt and draws the foul on Cole Simons! And-1! Donovan Markkanen to the line for 1. [Team fouls: 1] (Cole Simons: 1 personal fouls)   FT 1/1: GOOD Donovan Markkanen makes 1/1 from the line.
Score: 25-40

[10:44] Team_045 possession (Score: 25-40)
Cole Simons attempts a Midrange. Contested by Austin O'Neal (5.1 feet, MAN). Cole Simons misses. Rebound secured by Donovan Markkanen.

[10:30] Team_039 possession (Score: 25-40)
Anfernee Carter attempts a Midrange. Contested by Rudy Antetokounmpo (5.0 feet, ZONE). Anfernee Carter misses. Rebound secured by Cole Simons.

[10:15] Team_045 possession (Score: 25-40)
DeMar Turner attempts a 3Pt. Contested by Donovan Markkanen (4.5 feet, ZONE). DeMar Turner misses. Rebound secured by Klay Wade.

[10:05] Team_039 possession (Score: 25-40)
FOUL! Shooting foul on Zion Butler. Anfernee Carter to the line for 2 free throws. [Team fouls: 2] (Zion Butler: 1 personal fouls)   FT 1/2: GOOD   FT 2/2: GOOD Anfernee Carter makes 2/2 from the line.
Score: 25-42

[09:55] Team_045 possession (Score: 25-42)
Trae Russell attempts a Midrange. Contested by Donovan Markkanen (4.7 feet, ZONE). Trae Russell misses. Rebound secured by Klay Wade.

[09:37] Team_039 possession (Score: 25-42)
Jrue Bridges attempts a Midrange. Contested by Rudy Antetokounmpo (5.1 feet, MAN). JRUE BRIDGES MAKES IT! Assist: Donovan Markkanen
Score: 25-44

[09:25] Team_045 possession (Score: 25-44)
Trae Russell attempts a Midrange. Contested by Austin O'Neal (5.2 feet, ZONE). TRAE RUSSELL MAKES IT! Assist: Zion Butler
Score: 27-44

[09:11] Team_039 possession (Score: 27-44)
FOUL! Shooting foul on DeMar Turner. Klay Wade to the line for 2 free throws. [Team fouls: 3] (DeMar Turner: 1 personal fouls)   FT 1/2: MISS   FT 2/2: GOOD Klay Wade makes 1/2 from the line.
Score: 27-45

[08:59] Team_045 possession (Score: 27-45)
Trae Russell attempts a 3Pt. Contested by Donovan Markkanen (4.8 feet, MAN). Trae Russell misses. Rebound secured by Donovan Markkanen.

[08:46] Team_039 possession (Score: 27-45)
Austin O'Neal attempts a Layup. Contested by Zion Butler (3.4 feet, ZONE). Austin O'Neal misses. FOUL! Loose ball foul on DeMar Turner during the rebound battle. [Team fouls: 4] No free throws, side out. (DeMar Turner: 2 personal fouls)

[08:31] Team_039 possession (Score: 27-45)
Jrue Bridges attempts a 3Pt. Contested by Rudy Antetokounmpo (5.2 feet, MAN). Jrue Bridges misses. Rebound secured by Cole Simons.

[08:18] Team_045 possession (Score: 27-45)
Zion Butler attempts a Layup. Contested by Klay Wade (5.1 feet, MAN). ZION BUTLER MAKES IT!
Score: 29-45

[08:04] Team_039 possession (Score: 29-45)
Anfernee Carter makes the Dunk and draws the foul on Rudy Antetokounmpo! And-1! Anfernee Carter to the line for 1. [BONUS: 5 team fouls] (Rudy Antetokounmpo: 1 personal fouls)   FT 1/1: GOOD Anfernee Carter makes 1/1 from the line.
Score: 29-48

[07:49] Team_045 possession (Score: 29-48)
Trae Russell drives to the basket... FOUL! Offensive foul on Trae Russell! Klay Wade drew the charge! [Team fouls: 6] (Trae Russell: 1 personal fouls) TURNOVER! (dead ball)

[07:35] Team_039 possession (Score: 29-48)
Austin O'Neal attempts a Layup. Contested by Zion Butler (3.5 feet, ZONE). AUSTIN O'NEAL MAKES IT!
Score: 29-50

[07:17] Team_045 possession (Score: 29-50)
Trae Russell attempts a Midrange. Contested by Donovan Markkanen (5.0 feet, MAN). Trae Russell misses. Rebound secured by Donovan Markkanen.

[07:01] Team_039 possession (Score: 29-50)
Jrue Bridges attempts a Midrange. Contested by Rudy Antetokounmpo (5.4 feet, MAN). JRUE BRIDGES MAKES IT! Assist: Anfernee Carter
Score: 29-52

[06:50] Team_045 possession (Score: 29-52)
Zion Butler attempts a Layup. Contested by Klay Wade (5.3 feet, MAN). ZION BUTLER MAKES IT! Assist: Cole Simons
Score: 31-52

[06:35] Team_039 possession (Score: 31-52)
Klay Wade loses control! Ball rolls out of bounds! TURNOVER! (dead ball)

[06:35] Substitution (Team_045): Rudy Antetokounmpo OUT → John Wagner IN (stamina_rule2)

[06:35] Substitution (Team_045): Trae Russell OUT → Julius James IN (stamina_rule2)

[06:35] Substitution (Team_045): Cole Simons OUT → Gary Towns IN (stamina_rule2)

[06:35] Substitution (Team_045): DeMar Turner OUT → Tim Sexton IN (stamina_rule2)

[06:35] Substitution (Team_045): Zion Butler OUT → Stephen Paul IN (stamina_rule2)

[06:35] Substitution (Team_039): Jrue Bridges OUT → Tracy Mitchell IN (stamina_rule2)

[06:35] Substitution (Team_039): Donovan Markkanen OUT → Jayson Cunningham IN (stamina_rule2)

[06:35] Substitution (Team_039): Austin O'Neal OUT → Yao Carter IN (stamina_rule2)

[06:35] Substitution (Team_039): Anfernee Carter OUT → Victor Gasol IN (stamina_rule2)

[06:35] Substitution (Team_039): Klay Wade OUT → Bam Booker IN (stamina_rule2)

[06:22] Team_045 possession (Score: 31-52)
John Wagner drives, Victor Gasol stays with him. John Wagner attempts a Layup. Contested by Victor Gasol (3.4 feet, ZONE). JOHN WAGNER MAKES IT! Assist: Gary Towns
Score: 33-52

[06:08] Team_039 possession (Score: 33-52)
Victor Gasol loses the ball! Stripped by Tim Sexton! TURNOVER! (live ball)

[05:55] Team_045 possession (Score: 33-52)
John Wagner attempts a 3Pt. Contested by Tracy Mitchell (5.8 feet, ZONE). John Wagner misses. Rebound secured by Victor Gasol.

[05:42] Team_039 possession (Score: 33-52)
Bam Booker drives, picks up Stephen Paul. Help arrives from Julius James! Bam Booker attempts a Layup. Contested by Julius James (4.8 feet, MAN). BAM BOOKER MAKES IT!
Score: 33-54

[05:24] Team_045 possession (Score: 33-54)
FOUL! Reach-in foul on Victor Gasol during the drive. [Team fouls: 4] No free throws, side out. (Victor Gasol: 1 personal fouls)

[05:08] Team_045 possession (Score: 33-54)
Tim Sexton drives and kicks out. Julius James attempts a 3Pt. Contested by Tracy Mitchell (5.6 feet, ZONE). Julius James misses. Offensive rebound by Tim Sexton! Tim Sexton kicks it out.

[04:50] Team_045 possession (Score: 33-54)
Stephen Paul drives and kicks out. Tim Sexton attempts a Midrange. Contested by Victor Gasol (3.3 feet, ZONE). Tim Sexton misses. Rebound secured by Victor Gasol.

[04:35] Team_039 possession (Score: 33-54)
Jayson Cunningham attempts a 3Pt. Contested by John Wagner (4.3 feet, ZONE). Jayson Cunningham misses. Rebound secured by Julius James.

[04:21] Team_045 possession (Score: 33-54)
Tim Sexton drives to the basket... Tim Sexton throws a bad pass out of bounds! TURNOVER! (dead ball)

[04:05] Team_039 possession (Score: 33-54)
Jayson Cunningham attempts a 3Pt. Contested by John Wagner (4.3 feet, ZONE). Jayson Cunningham misses. Rebound secured by Stephen Paul.

[03:51] Team_045 possession (Score: 33-54)
Stephen Paul throws a bad pass! Stolen by Bam Booker! TURNOVER! (live ball)

[03:39] Team_039 possession (Score: 33-54)
FOUL! Holding foul on Julius James. [IN THE BONUS! 7 team fouls] Jayson Cunningham to the line for 2 free throws. (Julius James: 1 personal fouls)   FT 1/2: GOOD   FT 2/2: GOOD Jayson Cunningham makes 2/2 from the line.
Score: 33-56

[03:23] Team_045 possession (Score: 33-56)
FOUL! Offensive foul on Stephen Paul! Bam Booker drew the charge! [Team fouls: 8] (Stephen Paul: 1 personal fouls) TURNOVER! (dead ball)

[03:13] Team_039 possession (Score: 33-56)
Jayson Cunningham makes the Dunk and draws the foul on Julius James! And-1! Jayson Cunningham to the line for 1. [BONUS: 9 team fouls] (Julius James: 2 personal fouls)   FT 1/1: GOOD Jayson Cunningham makes 1/1 from the line.
Score: 33-59

[03:02] Team_045 possession (Score: 33-59)
Gary Towns drives, picks up Yao Carter. Help arrives from Tracy Mitchell! Gary Towns attempts a Layup. Contested by Tracy Mitchell (3.9 feet, MAN). GARY TOWNS MAKES IT! Assist: John Wagner
Score: 35-59

[02:52] Team_039 possession (Score: 35-59)
Yao Carter throws a bad pass out of bounds! TURNOVER! (dead ball)

[02:39] Team_045 possession (Score: 35-59)
Tim Sexton attempts a 3Pt. Wide open! Tracy Mitchell is 6.0 feet away. [ZONE] Tim Sexton misses. Rebound secured by Yao Carter.

[02:21] Team_039 possession (Score: 35-59)
FOUL! Reach-in foul on Stephen Paul during the drive. [IN THE BONUS! 10 team fouls] Tracy Mitchell to the line for 2 free throws. (Stephen Paul: 2 personal fouls)   FT 1/2: GOOD   FT 2/2: GOOD Tracy Mitchell makes 2/2 from the line.
Score: 35-61

[02:06] Team_045 possession (Score: 35-61)
Tim Sexton makes the Layup and draws the foul on Victor Gasol! And-1! Tim Sexton to the line for 1. [BONUS: 5 team fouls] (Victor Gasol: 2 personal fouls)   FT 1/1: GOOD Tim Sexton makes 1/1 from the line.
Score: 38-61

[01:52] Team_039 possession (Score: 38-61)
Jayson Cunningham drives, picks up Stephen Paul. Help arrives from Julius James! Jayson Cunningham attempts a Dunk. Contested by Julius James (4.7 feet, ZONE). JAYSON CUNNINGHAM MAKES IT! Assist: Tracy Mitchell
Score: 38-63

[01:35] Team_045 possession (Score: 38-63)
Tim Sexton attempts a 3Pt. Contested by Victor Gasol (3.7 feet, MAN). Tim Sexton misses. Rebound secured by Bam Booker.

[01:24] Team_039 possession (Score: 38-63)
Victor Gasol drives and kicks out. Tracy Mitchell attempts a 3Pt. Contested by John Wagner (4.2 feet, ZONE). Tracy Mitchell misses. Rebound secured by Julius James.

[01:06] Team_045 possession (Score: 38-63)
Julius James attempts a Midrange. Contested by Jayson Cunningham (5.8 feet, MAN). JULIUS JAMES MAKES IT!
Score: 40-63

[00:50] Team_039 possession (Score: 40-63)
Jayson Cunningham attempts a 3Pt. Contested by John Wagner (4.5 feet, ZONE). Jayson Cunningham misses. Offensive rebound by Yao Carter! Yao Carter kicks it out.

[00:31] Team_039 possession (Score: 40-63)
Jayson Cunningham drives, picks up Julius James. Help arrives from John Wagner! Jayson Cunningham attempts a Layup. Contested by John Wagner (4.2 feet, MAN). JAYSON CUNNINGHAM MAKES IT!
Score: 40-65

[00:18] Team_045 possession (Score: 40-65)
John Wagner throws a bad pass out of bounds! TURNOVER! (dead ball)

[00:05] Team_039 possession (Score: 40-65)
Yao Carter attempts a 3Pt. Contested by Gary Towns (5.1 feet, MAN). Yao Carter misses. Rebound secured by Stephen Paul.

================================================================================
                              2ND QUARTER COMPLETE                              
================================================================================

2ND QUARTER SCORE: Team_045 20, Team_039 29

BOX SCORE:
================================================================================

Team_045
--------------------------------------------------------------------------------
Player                MIN  PTS  REB  AST  TO      FG   FG%      3P   3P%
--------------------------------------------------------------------------------
Zion Butler            13    6    0    1   0   3/3   100.0     0/0   0.0
DeMar Turner           18    3    0    0   0   1/2    50.0     0/0   0.0
Tim Sexton              7    3    1    0   0   1/3    33.3     0/0   0.0
Trae Russell           18    2    0    0   0   1/4    25.0     0/0   0.0
John Wagner            11    2    0    1   0   1/2    50.0     0/0   0.0
Gary Towns              7    2    0    1   0   1/1   100.0     0/0   0.0
Julius James            7    2    2    0   0   1/1   100.0     0/0   0.0
Cole Simons            18    0    2    1   0   0/1     0.0     0/0   0.0
Stephen Paul            7    0    2    0   0   0/1     0.0     0/0   0.0

TEAM: FG: 9/18 (50.0%), 3PT: 0/5 (0.0%), REB: 7 (1 off, 6 def), AST: 4, TO: 5
TEAM FOULS: 10 [Team_039 in BONUS]


Team_039
--------------------------------------------------------------------------------
Player                MIN  PTS  REB  AST  TO      FG   FG%      3P   3P%
--------------------------------------------------------------------------------
Jayson Cunningham       7    9    0    0   0   4/6    66.7     0/0   0.0
Anfernee Carter        18    5    0    1   0   2/3    66.7     0/0   0.0
Donovan Markkanen      18    4    3    1   0   1/1   100.0     0/0   0.0
Jrue Bridges           18    4    0    0   0   2/3    66.7     0/0   0.0
Austin O'Neal          18    2    1    0   0   1/1   100.0     0/0   0.0
Bam Booker              7    2    1    0   0   1/1   100.0     0/0   0.0
Tracy Mitchell          7    2    0    1   0   1/1   100.0     0/0   0.0
Klay Wade              18    1    2    0   0   1/1   100.0     0/0   0.0
Victor Gasol            7    0    2    0   0   0/1     0.0     0/0   0.0
Yao Carter              7    0    2    0   0   0/1     0.0     0/0   0.0

TEAM: FG: 13/19 (68.4%), 3PT: 1/5 (20.0%), REB: 11 (2 off, 9 def), AST: 3, TO: 4
TEAM FOULS: 5 [Team_045 in BONUS]

================================================================================

================================================================================
                       3RD QUARTER - Team_045 vs Team_039                       
================================================================================

[12:00] Team_045 possession (Score: 40-65)
FOUL! Reach-in foul on Klay Wade during the drive. [Team fouls: 1] No free throws, side out. (Klay Wade: 1 personal fouls)

[11:46] Team_045 possession (Score: 40-65)
Zion Butler attempts a Layup. Wide open! Anfernee Carter is 7.0 feet away. [ZONE] ZION BUTLER MAKES IT! Assist: Trae Russell
Score: 42-65

[11:32] Team_039 possession (Score: 42-65)
Austin O'Neal attempts a 3Pt. Contested by Cole Simons (3.4 feet, MAN). Austin O'Neal misses. Rebound secured by Cole Simons.

[11:13] Team_045 possession (Score: 42-65)
DeMar Turner drives and kicks out. Zion Butler attempts a 3Pt. Contested by Klay Wade (4.0 feet, MAN). ZION BUTLER MAKES IT!
Score: 45-65

[10:59] Team_039 possession (Score: 45-65)
Anfernee Carter attempts a Midrange. Contested by Zion Butler (3.5 feet, MAN). Anfernee Carter misses. Rebound secured by Zion Butler.

[10:44] Team_045 possession (Score: 45-65)
DeMar Turner attempts a 3Pt. Contested by Jrue Bridges (3.4 feet, ZONE). DeMar Turner misses. Rebound secured by Klay Wade.

[10:32] Team_039 possession (Score: 45-65)
Austin O'Neal drives and kicks out. Klay Wade attempts a Midrange. Contested by Zion Butler (3.2 feet, MAN). Klay Wade misses. Rebound secured by Cole Simons.

[10:22] Team_045 possession (Score: 45-65)
DeMar Turner attempts a Midrange. Contested by Donovan Markkanen (4.0 feet, ZONE). DEMAR TURNER MAKES IT! Assist: Zion Butler
Score: 47-65

[10:09] Team_039 possession (Score: 47-65)
Austin O'Neal attempts a 3Pt. Contested by Cole Simons (3.4 feet, ZONE). AUSTIN O'NEAL MAKES IT! Assist: Donovan Markkanen
Score: 47-68

[09:56] Team_045 possession (Score: 47-68)
DeMar Turner attempts a 3Pt. Contested by Jrue Bridges (3.4 feet, ZONE). DeMar Turner misses. Rebound secured by Austin O'Neal.

[09:47] Team_039 possession (Score: 47-68)
Donovan Markkanen drives, Cole Simons stays with him. Donovan Markkanen attempts a Dunk. Contested by Cole Simons (3.5 feet, MAN). DONOVAN MARKKANEN MAKES IT!
Score: 47-70

[09:31] Team_045 possession (Score: 47-70)
Zion Butler attempts a Midrange. BLOCKED BY KLAY WADE! Ball is loose! Offensive rebound by DeMar Turner! DeMar Turner kicks it out.

[09:18] Team_045 possession (Score: 47-70)
Rudy Antetokounmpo attempts a Layup. Contested by Jrue Bridges (3.4 feet, MAN). RUDY ANTETOKOUNMPO MAKES IT! Assist: Zion Butler
Score: 49-70

[09:05] Team_039 possession (Score: 49-70)
Klay Wade attempts a Midrange. Contested by Zion Butler (3.8 feet, MAN). Klay Wade misses. Rebound secured by Cole Simons.

[08:52] Team_045 possession (Score: 49-70)
Trae Russell attempts a 3Pt. Contested by Donovan Markkanen (4.3 feet, MAN). TRAE RUSSELL MAKES IT! Assist: Rudy Antetokounmpo
Score: 52-70

[08:38] Team_039 possession (Score: 52-70)
FOUL! Shooting foul on Cole Simons. Austin O'Neal to the line for 2 free throws. [Team fouls: 1] (Cole Simons: 1 personal fouls)   FT 1/2: GOOD   FT 2/2: GOOD Austin O'Neal makes 2/2 from the line.
Score: 52-72

[08:25] Team_045 possession (Score: 52-72)
Cole Simons attempts a 3Pt. Contested by Jrue Bridges (3.7 feet, ZONE). COLE SIMONS MAKES IT! Assist: Trae Russell
Score: 55-72

[08:10] Team_039 possession (Score: 55-72)
Donovan Markkanen attempts a 3Pt. Contested by Cole Simons (3.5 feet, MAN). Donovan Markkanen misses. Rebound secured by Zion Butler.

[07:52] Team_045 possession (Score: 55-72)
Cole Simons attempts a 3Pt. Contested by Jrue Bridges (3.7 feet, ZONE). COLE SIMONS MAKES IT! Assist: Trae Russell
Score: 58-72

[07:40] Team_039 possession (Score: 58-72)
Donovan Markkanen drives and kicks out. Jrue Bridges attempts a Midrange. Contested by Rudy Antetokounmpo (4.4 feet, MAN). Jrue Bridges misses. Rebound secured by Cole Simons.

[07:25] Team_045 possession (Score: 58-72)
FOUL! Shooting foul on Klay Wade. DeMar Turner to the line for 2 free throws. [Team fouls: 3] (Klay Wade: 2 personal fouls)   FT 1/2: GOOD   FT 2/2: GOOD DeMar Turner makes 2/2 from the line.
Score: 60-72

[07:09] Team_039 possession (Score: 60-72)
FOUL! Reach-in foul on Cole Simons during the drive. [Team fouls: 2] No free throws, side out. (Cole Simons: 2 personal fouls)

[06:55] Team_039 possession (Score: 60-72)
Klay Wade drives to the basket... Klay Wade throws a bad pass! Stolen by Zion Butler! TURNOVER! (live ball)

[06:42] Team_045 possession (Score: 60-72)
Rudy Antetokounmpo attempts a 3Pt. Contested by Jrue Bridges (3.4 feet, ZONE). RUDY ANTETOKOUNMPO MAKES IT! Assist: Trae Russell
Score: 63-72

[06:25] Team_039 possession (Score: 63-72)
Austin O'Neal makes the Layup and draws the foul on Zion Butler! And-1! Austin O'Neal to the line for 1. [Team fouls: 3] (Zion Butler: 1 personal fouls)   FT 1/1: GOOD Austin O'Neal makes 1/1 from the line.
Score: 63-75

[06:10] Team_045 possession (Score: 63-75)
Zion Butler drives and kicks out. DeMar Turner attempts a 3Pt. Contested by Jrue Bridges (3.1 feet, ZONE). DeMar Turner misses. Rebound secured by Donovan Markkanen.

[05:50] Team_039 possession (Score: 63-75)
Klay Wade attempts a Midrange. Contested by Zion Butler (3.8 feet, MAN). Klay Wade misses. Rebound secured by Zion Butler.

[05:36] Team_045 possession (Score: 63-75)
Cole Simons attempts a Midrange. Contested by Jrue Bridges (3.7 feet, ZONE). COLE SIMONS MAKES IT!
Score: 65-75

[05:22] Team_039 possession (Score: 65-75)
Jrue Bridges attempts a Midrange. Contested by Cole Simons (3.5 feet, ZONE). JRUE BRIDGES MAKES IT! Assist: Austin O'Neal
Score: 65-77

[05:10] Team_045 possession (Score: 65-77)
Trae Russell attempts a Midrange. Wide open! Anfernee Carter is 7.2 feet away. [ZONE] TRAE RUSSELL MAKES IT!
Score: 67-77

[04:53] Team_039 possession (Score: 67-77)
Klay Wade attempts a Midrange. Contested by DeMar Turner (5.5 feet, ZONE). Klay Wade misses. Rebound secured by Zion Butler.

[04:40] Team_045 possession (Score: 67-77)
DeMar Turner attempts a Layup. Contested by Klay Wade (4.3 feet, MAN). DEMAR TURNER MAKES IT!
Score: 69-77

[04:25] Team_039 possession (Score: 69-77)
Donovan Markkanen attempts a 3Pt. Contested by Cole Simons (3.6 feet, ZONE). DONOVAN MARKKANEN MAKES IT! Assist: Jrue Bridges
Score: 69-80

[04:10] Team_045 possession (Score: 69-80)
Rudy Antetokounmpo attempts a 3Pt. Contested by Donovan Markkanen (4.2 feet, ZONE). Rudy Antetokounmpo misses. Rebound secured by Donovan Markkanen.

[03:54] Team_039 possession (Score: 69-80)
Austin O'Neal drives and kicks out. Austin O'Neal attempts a Midrange. Contested by DeMar Turner (5.0 feet, ZONE). AUSTIN O'NEAL MAKES IT!
Score: 69-82

[03:39] Team_045 possession (Score: 69-82)
Trae Russell attempts a Midrange. Wide open! Anfernee Carter is 7.3 feet away. [ZONE] Trae Russell misses. Rebound secured by Klay Wade.

[03:23] Team_039 possession (Score: 69-82)
Donovan Markkanen drives and kicks out. Anfernee Carter attempts a 3Pt. Contested by Cole Simons (3.5 feet, ZONE). Anfernee Carter misses. Rebound secured by Zion Butler.

[03:08] Team_045 possession (Score: 69-82)
Zion Butler attempts a Layup. Contested by Klay Wade (4.4 feet, ZONE). ZION BUTLER MAKES IT! Assist: Trae Russell
Score: 71-82

[02:59] Team_039 possession (Score: 71-82)
Anfernee Carter drives, picks up Zion Butler. Help arrives from Rudy Antetokounmpo! Anfernee Carter attempts a Layup. Contested by Rudy Antetokounmpo (3.8 feet, ZONE). ANFERNEE CARTER MAKES IT! Assist: Jrue Bridges
Score: 71-84

[02:45] Team_045 possession (Score: 71-84)
Rudy Antetokounmpo drives to the basket... Rudy Antetokounmpo loses the ball! Stripped by Klay Wade! TURNOVER! (live ball)

[02:31] Team_039 possession (Score: 71-84)
Donovan Markkanen attempts a Layup. Contested by Zion Butler (3.9 feet, ZONE). DONOVAN MARKKANEN MAKES IT! Assist: Klay Wade
Score: 71-86

[02:17] Team_045 possession (Score: 71-86)
Trae Russell attempts a 3Pt. Contested by Donovan Markkanen (4.5 feet, MAN). Trae Russell misses. Rebound secured by Austin O'Neal.

[02:03] Team_039 possession (Score: 71-86)
Jrue Bridges attempts a 3Pt. Contested by Cole Simons (3.9 feet, ZONE). JRUE BRIDGES MAKES IT! Assist: Donovan Markkanen
Score: 71-89

[01:46] Team_045 possession (Score: 71-89)
Rudy Antetokounmpo attempts a 3Pt. Contested by Jrue Bridges (3.9 feet, MAN). Rudy Antetokounmpo misses. Offensive rebound by DeMar Turner! DeMar Turner kicks it out.

[01:31] Team_045 possession (Score: 71-89)
Cole Simons attempts a Midrange. Wide open! Anfernee Carter is 7.5 feet away. [ZONE] Cole Simons misses. Rebound secured by Austin O'Neal.

[01:16] Team_039 possession (Score: 71-89)
FOUL! Holding foul on DeMar Turner. [Team fouls: 4] No free throws, side out. (DeMar Turner: 1 personal fouls)

[01:00] Team_039 possession (Score: 71-89)
Austin O'Neal attempts a 3Pt. Contested by Cole Simons (3.9 feet, MAN). Austin O'Neal misses. FOUL! Loose ball foul on Zion Butler during the rebound battle. [IN THE BONUS! 5 team fouls] Austin O'Neal to the line for 2 free throws. (Zion Butler: 2 personal fouls)   FT 1/2: GOOD   FT 2/2: GOOD Austin O'Neal makes 2/2 from the line.
Score: 71-91

[00:46] Team_045 possession (Score: 71-91)
Rudy Antetokounmpo drives to the basket... Rudy Antetokounmpo loses the ball! Stripped by Klay Wade! TURNOVER! (live ball)

[00:32] Team_039 possession (Score: 71-91)
Anfernee Carter throws a bad pass! Stolen by DeMar Turner! TURNOVER! (live ball)

[00:19] Team_045 possession (Score: 71-91)
Cole Simons attempts a 3Pt. Contested by Jrue Bridges (4.3 feet, ZONE). Cole Simons misses. Rebound secured by Klay Wade.

================================================================================
                              3RD QUARTER COMPLETE                              
================================================================================

3RD QUARTER SCORE: Team_045 31, Team_039 26

BOX SCORE:
================================================================================

Team_045
--------------------------------------------------------------------------------
Player                MIN  PTS  REB  AST  TO      FG   FG%      3P   3P%
--------------------------------------------------------------------------------
Cole Simons            30    8    4    0   0   3/5    60.0     0/0   0.0
Zion Butler            25    7    5    2   0   3/4    75.0     0/0   0.0
DeMar Turner           30    6    2    0   0   3/5    60.0     0/0   0.0
Trae Russell           30    5    0    5   0   2/4    50.0     0/0   0.0
Rudy Antetokounmpo     30    5    0    1   0   2/3    66.7     0/0   0.0

TEAM: FG: 13/21 (61.9%), 3PT: 4/9 (44.4%), REB: 11 (2 off, 9 def), AST: 8, TO: 2
TEAM FOULS: 5 [Team_039 in BONUS]


Team_039
--------------------------------------------------------------------------------
Player                MIN  PTS  REB  AST  TO      FG   FG%      3P   3P%
--------------------------------------------------------------------------------
Austin O'Neal          30   12    3    1   0   5/7    71.4     0/0   0.0
Donovan Markkanen      30    7    2    2   0   3/6    50.0     0/0   0.0
Jrue Bridges           30    5    0    2   0   2/2   100.0     0/0   0.0
Anfernee Carter        30    2    0    0   0   1/2    50.0     0/0   0.0
Klay Wade              30    0    3    1   0   0/3     0.0     0/0   0.0

TEAM: FG: 11/20 (55.0%), 3PT: 4/6 (66.7%), REB: 8 (0 off, 8 def), AST: 6, TO: 2
TEAM FOULS: 3

================================================================================

================================================================================
                       4TH QUARTER - Team_045 vs Team_039                       
================================================================================

[12:00] Substitution (Team_045): Rudy Antetokounmpo OUT (stamina: 70) → John Wagner IN (comeback_detected)

[12:00] Substitution (Team_039): Jrue Bridges OUT (stamina: 68) → Tracy Mitchell IN (comeback_detected)

[12:00] Team_045 possession (Score: 71-91)
DeMar Turner drives and kicks out. DeMar Turner attempts a Midrange. Contested by Klay Wade (4.3 feet, ZONE). DeMar Turner misses. Rebound secured by Donovan Markkanen.

[11:48] Team_039 possession (Score: 71-91)
Anfernee Carter attempts a Midrange. Contested by John Wagner (4.3 feet, ZONE). Anfernee Carter misses. Rebound secured by Zion Butler.

[11:36] Team_045 possession (Score: 71-91)
John Wagner attempts a Midrange. Contested by Tracy Mitchell (5.8 feet, MAN). John Wagner misses. Rebound secured by Donovan Markkanen.

[11:21] Team_039 possession (Score: 71-91)
Austin O'Neal attempts a Layup. BLOCKED BY JOHN WAGNER! Ball goes out off John Wagner. Austin O'Neal's ball!

[11:06] Team_039 possession (Score: 71-91)
Anfernee Carter attempts a 3Pt. Contested by Cole Simons (4.0 feet, ZONE). Anfernee Carter misses. Rebound secured by Cole Simons.

[10:49] Team_045 possession (Score: 71-91)
Trae Russell drives and kicks out. Cole Simons attempts a 3Pt. Contested by Tracy Mitchell (5.6 feet, ZONE). Cole Simons misses. Offensive rebound by Zion Butler! Zion Butler puts it back in!
Score: 73-91

[10:29] Team_039 possession (Score: 73-91)
Donovan Markkanen attempts a Layup. Contested by Cole Simons (4.1 feet, MAN). DONOVAN MARKKANEN MAKES IT! Assist: Klay Wade
Score: 73-93

[10:20] Team_045 possession (Score: 73-93)
Cole Simons makes the Dunk and draws the foul on Donovan Markkanen! And-1! Cole Simons to the line for 1. [Team fouls: 1] (Donovan Markkanen: 1 personal fouls)   FT 1/1: GOOD Cole Simons makes 1/1 from the line.
Score: 76-93

[10:07] Team_039 possession (Score: 76-93)
Tracy Mitchell attempts a 3Pt. Contested by John Wagner (4.6 feet, ZONE). Tracy Mitchell misses. Rebound secured by Cole Simons.

[09:53] Team_045 possession (Score: 76-93)
Cole Simons attempts a 3Pt. Contested by Austin O'Neal (5.1 feet, MAN). COLE SIMONS MAKES IT! Assist: John Wagner
Score: 79-93

[09:38] Team_039 possession (Score: 79-93)
Anfernee Carter attempts a 3Pt. Contested by Cole Simons (4.2 feet, ZONE). Anfernee Carter misses. Rebound secured by DeMar Turner.

[09:22] Team_045 possession (Score: 79-93)
Zion Butler makes the Layup and draws the foul on Klay Wade! And-1! Zion Butler to the line for 1. [Team fouls: 2] (Klay Wade: 1 personal fouls)   FT 1/1: GOOD Zion Butler makes 1/1 from the line.
Score: 82-93

[09:13] Team_039 possession (Score: 82-93)
Donovan Markkanen attempts a 3Pt. Contested by Cole Simons (4.3 feet, ZONE). Donovan Markkanen misses. Offensive rebound by Austin O'Neal! Austin O'Neal kicks it out.

[08:58] Team_039 possession (Score: 82-93)
Anfernee Carter attempts a 3Pt. Contested by Cole Simons (4.3 feet, ZONE). Anfernee Carter misses. Offensive rebound by Austin O'Neal! Austin O'Neal kicks it out.

[08:42] Team_039 possession (Score: 82-93)
Anfernee Carter attempts a Layup. Contested by DeMar Turner (5.6 feet, MAN). ANFERNEE CARTER MAKES IT! Assist: Austin O'Neal
Score: 82-95

[08:25] Team_045 possession (Score: 82-95)
Cole Simons makes the Midrange and draws the foul on Austin O'Neal! And-1! Cole Simons to the line for 1. [Team fouls: 3] (Austin O'Neal: 1 personal fouls)   FT 1/1: GOOD Cole Simons makes 1/1 from the line.
Score: 85-95

[08:11] Team_039 possession (Score: 85-95)
Klay Wade drives to the basket... Klay Wade throws a bad pass! Stolen by Zion Butler! TURNOVER! (live ball)

[07:59] Team_045 possession (Score: 85-95)
John Wagner makes the Layup and draws the foul on Tracy Mitchell! And-1! John Wagner to the line for 1. [Team fouls: 4] (Tracy Mitchell: 1 personal fouls)   FT 1/1: GOOD John Wagner makes 1/1 from the line.
Score: 88-95

[07:46] Team_039 possession (Score: 88-95)
FOUL! Shooting foul on Zion Butler. Anfernee Carter to the line for 2 free throws. [Team fouls: 1] (Zion Butler: 1 personal fouls)   FT 1/2: GOOD   FT 2/2: GOOD Anfernee Carter makes 2/2 from the line.
Score: 88-97

[07:31] Team_045 possession (Score: 88-97)
DeMar Turner drives to the basket... DeMar Turner throws a bad pass! Stolen by Klay Wade! TURNOVER! (live ball)

[07:19] Team_039 possession (Score: 88-97)
Donovan Markkanen throws a bad pass out of bounds! TURNOVER! (dead ball)

[07:19] Substitution (Team_045): Trae Russell OUT → Julius James IN (stamina_rule2)

[07:19] Substitution (Team_045): Cole Simons OUT → Gary Towns IN (stamina_rule2)

[07:19] Substitution (Team_045): DeMar Turner OUT → Tim Sexton IN (stamina_rule2)

[07:19] Substitution (Team_045): Zion Butler OUT → Stephen Paul IN (stamina_rule2)

[07:19] Substitution (Team_039): Donovan Markkanen OUT → Jayson Cunningham IN (stamina_rule2)

[07:19] Substitution (Team_039): Austin O'Neal OUT → Yao Carter IN (stamina_rule2)

[07:19] Substitution (Team_039): Anfernee Carter OUT → Victor Gasol IN (stamina_rule2)

[07:19] Substitution (Team_039): Klay Wade OUT → Bam Booker IN (stamina_rule2)

[07:05] Team_045 possession (Score: 88-97)
Tim Sexton attempts a 3Pt. Contested by Victor Gasol (3.7 feet, MAN). TIM SEXTON MAKES IT! Assist: John Wagner
Score: 91-97

[06:48] Team_039 possession (Score: 91-97)
Tracy Mitchell throws a bad pass out of bounds! TURNOVER! (dead ball)

[06:36] Team_045 possession (Score: 91-97)
FOUL! Shooting foul on Victor Gasol. Gary Towns to the line for 2 free throws. [BONUS: 5 team fouls] (Victor Gasol: 1 personal fouls)   FT 1/2: GOOD   FT 2/2: GOOD Gary Towns makes 2/2 from the line.
Score: 93-97

[06:17] Team_039 possession (Score: 93-97)
Yao Carter attempts a Midrange. Contested by Tim Sexton (4.7 feet, ZONE). Yao Carter misses. Rebound secured by Stephen Paul.

[06:06] Team_045 possession (Score: 93-97)
Stephen Paul attempts a Layup. BLOCKED BY VICTOR GASOL! Ball goes out off Victor Gasol. Stephen Paul's ball!

[05:52] Team_045 possession (Score: 93-97)
Gary Towns attempts a Midrange. Contested by Yao Carter (3.9 feet, MAN). Gary Towns misses. Rebound secured by Bam Booker.

[05:36] Team_039 possession (Score: 93-97)
FOUL! Shooting foul on Stephen Paul. Bam Booker to the line for 2 free throws. [Team fouls: 2] (Stephen Paul: 1 personal fouls)   FT 1/2: MISS   FT 2/2: MISS Bam Booker makes 0/2 from the line. Rebound secured by Stephen Paul.

[05:25] Team_045 possession (Score: 93-97)
Stephen Paul throws a bad pass out of bounds! TURNOVER! (dead ball)

[05:10] Team_039 possession (Score: 93-97)
Tracy Mitchell attempts a 3Pt. Contested by Tim Sexton (5.1 feet, ZONE). Tracy Mitchell misses. Offensive rebound by Yao Carter! Yao Carter kicks it out.

[04:55] Team_039 possession (Score: 93-97)
Victor Gasol drives, Stephen Paul stays with him. Victor Gasol attempts a Dunk. Contested by Stephen Paul (4.7 feet, ZONE). VICTOR GASOL MAKES IT! Assist: Bam Booker
Score: 93-99

[04:41] Team_045 possession (Score: 93-99)
Gary Towns drives, picks up Yao Carter. Help arrives from Tracy Mitchell! Gary Towns attempts a Layup. Contested by Tracy Mitchell (3.9 feet, MAN). GARY TOWNS MAKES IT!
Score: 95-99

[04:26] Team_039 possession (Score: 95-99)
Jayson Cunningham attempts a Midrange. Contested by Gary Towns (5.2 feet, ZONE). JAYSON CUNNINGHAM MAKES IT!
Score: 95-101

[04:10] Team_045 possession (Score: 95-101)
Gary Towns drives to the basket... Gary Towns loses the ball! Stripped by Victor Gasol! TURNOVER! (live ball)

[03:56] Team_039 possession (Score: 95-101)
Jayson Cunningham attempts a 3Pt. Contested by John Wagner (4.5 feet, ZONE). Jayson Cunningham misses. Rebound secured by Tim Sexton.

[03:44] Team_045 possession (Score: 95-101)
John Wagner attempts a 3Pt. Contested by Tracy Mitchell (5.9 feet, ZONE). JOHN WAGNER MAKES IT!
Score: 98-101

[03:29] Team_039 possession (Score: 98-101)
Tracy Mitchell drives and kicks out. Tracy Mitchell attempts a 3Pt. Contested by John Wagner (4.3 feet, ZONE). Tracy Mitchell misses. Offensive rebound by Victor Gasol! Victor Gasol kicks it out.

[03:14] Team_039 possession (Score: 98-101)
Tracy Mitchell makes the 3Pt and draws the foul on John Wagner! And-1! Tracy Mitchell to the line for 1. [Team fouls: 3] (John Wagner: 1 personal fouls)   FT 1/1: GOOD Tracy Mitchell makes 1/1 from the line.
Score: 98-105

[02:59] Team_045 possession (Score: 98-105)
Julius James attempts a Layup. Contested by Victor Gasol (3.4 feet, ZONE). JULIUS JAMES MAKES IT! Assist: John Wagner
Score: 100-105

[02:45] Team_039 possession (Score: 100-105)
Yao Carter attempts a 3Pt. Contested by John Wagner (4.6 feet, ZONE). Yao Carter misses. Offensive rebound by Yao Carter! Yao Carter kicks it out.

[02:30] Team_039 possession (Score: 100-105)
Victor Gasol drives and kicks out. Victor Gasol attempts a 3Pt. Contested by John Wagner (4.5 feet, ZONE). Victor Gasol misses. Rebound secured by Tim Sexton.

[02:16] Team_045 possession (Score: 100-105)
Gary Towns attempts a Midrange. Contested by Yao Carter (3.9 feet, MAN). GARY TOWNS MAKES IT!
Score: 102-105

[02:04] Team_039 possession (Score: 102-105)
Jayson Cunningham drives and kicks out. Victor Gasol attempts a 3Pt. Contested by John Wagner (4.5 feet, ZONE). Victor Gasol misses. Offensive rebound by Victor Gasol! Victor Gasol kicks it out.

[01:49] Team_039 possession (Score: 102-105)
Tracy Mitchell attempts a 3Pt. Contested by John Wagner (5.0 feet, MAN). TRACY MITCHELL MAKES IT! Assist: Jayson Cunningham
Score: 102-108

[01:35] Team_045 possession (Score: 102-108)
Julius James attempts a 3Pt. Wide open! Tracy Mitchell is 6.1 feet away. [ZONE] Julius James misses. Offensive rebound by Julius James! Julius James kicks it out.

[01:17] Team_045 possession (Score: 102-108)
Gary Towns attempts a 3Pt. Contested by Yao Carter (3.9 feet, MAN). GARY TOWNS MAKES IT! Assist: Stephen Paul
Score: 105-108

[01:01] Team_039 possession (Score: 105-108)
Bam Booker loses control! Ball rolls out of bounds! TURNOVER! (dead ball)

[00:45] Team_045 possession (Score: 105-108)
Stephen Paul attempts a Midrange. Contested by Bam Booker (4.5 feet, MAN). STEPHEN PAUL MAKES IT! Assist: Julius James
Score: 107-108

[00:34] Team_039 possession (Score: 107-108)
Jayson Cunningham attempts a Layup. BLOCKED BY JOHN WAGNER! Ball deflects out of bounds off Jayson Cunningham.

[00:18] Team_045 possession (Score: 107-108)
Tim Sexton attempts a Midrange. Wide open! Jayson Cunningham is 6.1 feet away. [ZONE] TIM SEXTON MAKES IT! Assist: Gary Towns
Score: 109-108

[00:02] Team_039 possession (Score: 109-108)
Jayson Cunningham attempts a 3Pt. Contested by Julius James (4.2 feet, MAN). Jayson Cunningham misses. Rebound secured by Tim Sexton.

================================================================================
                              4TH QUARTER COMPLETE                              
================================================================================

4TH QUARTER SCORE: Team_045 38, Team_039 17

BOX SCORE:
================================================================================

Team_045
--------------------------------------------------------------------------------
Player                MIN  PTS  REB  AST  TO      FG   FG%      3P   3P%
--------------------------------------------------------------------------------
Cole Simons            35    9    2    0   0   3/3   100.0     0/0   0.0
Gary Towns             14    9    0    1   0   4/5    80.0     0/0   0.0
John Wagner            24    6    0    3   0   2/3    66.7     0/0   0.0
Zion Butler            30    5    2    0   0   2/2   100.0     0/0   0.0
Tim Sexton             14    5    3    0   0   2/2   100.0     0/0   0.0
Stephen Paul           14    2    2    1   0   1/1   100.0     0/0   0.0
Julius James           14    2    1    1   0   1/1   100.0     0/0   0.0
DeMar Turner           35    0    1    0   0   0/1     0.0     0/0   0.0

TEAM: FG: 15/18 (83.3%), 3PT: 4/4 (100.0%), REB: 11 (2 off, 9 def), AST: 6, TO: 3
TEAM FOULS: 3


Team_039
--------------------------------------------------------------------------------
Player                MIN  PTS  REB  AST  TO      FG   FG%      3P   3P%
--------------------------------------------------------------------------------
Tracy Mitchell         19    7    0    0   0   2/3    66.7     0/0   0.0
Anfernee Carter        35    4    0    0   0   2/5    40.0     0/0   0.0
Donovan Markkanen      35    2    2    0   0   1/1   100.0     0/0   0.0
Victor Gasol           14    2    2    0   0   1/2    50.0     0/0   0.0
Jayson Cunningham      14    2    0    1   0   1/4    25.0     0/0   0.0
Klay Wade              35    0    0    1   0   0/0     0.0     0/0   0.0
Austin O'Neal          35    0    2    1   0   0/0     0.0     0/0   0.0
Yao Carter             14    0    2    0   0   0/1     0.0     0/0   0.0
Bam Booker             14    0    1    1   0   0/1     0.0     0/0   0.0

TEAM: FG: 7/17 (41.2%), 3PT: 2/7 (28.6%), REB: 9 (6 off, 3 def), AST: 4, TO: 4
TEAM FOULS: 5 [Team_045 in BONUS]

================================================================================

================================================================================
                               FULL GAME COMPLETE                               
================================================================================

FINAL SCORE: Team_045 109, Team_039 108

SCORING BY QUARTER:
--------------------------------------------------------------------------------
Team                     Q1     Q2     Q3     Q4    FINAL
--------------------------------------------------------------------------------
Team_045                 20     20     31     38      109
Team_039                 36     29     26     17      108
--------------------------------------------------------------------------------

FULL GAME BOX SCORE:
================================================================================

Team_045
--------------------------------------------------------------------------------
Player                MIN  PTS  REB  AST  TO      FG   FG%      3P   3P%      FT STL BLK
--------------------------------------------------------------------------------
Trae Russell           35   10    0    6   1   6/12   50.0   1/3    33.3   1/2     0   0
Cole Simons            35   17   12    1   1   6/13   46.2   3/5    60.0   2/2     0   0
DeMar Turner           35   14    6    0   2   7/15   46.7   0/6     0.0   4/5     1   0
Zion Butler            30   24    9    4   1   8/9    88.9   1/1   100.0   2/2     4   1
Rudy Antetokounmpo     30    8    0    2   1   3/6    50.0   2/3    66.7   1/2     0   0
John Wagner            24   10    0    5   1   5/7    71.4   1/2    50.0   1/1     0   2
Julius James           14    4    3    1   1   2/2   100.0   0/0     0.0   0/0     0   0
Gary Towns             14   11    0    2   0   5/6    83.3   1/1   100.0   2/2     0   0
Tim Sexton             14    8    4    0   0   3/5    60.0   1/3    33.3   1/1     1   0
Stephen Paul           14    2    4    1   4   1/2    50.0   0/0     0.0   0/0     0   0

TEAM: FG: 46/78 (59.0%), 3PT: 10/24 (41.7%), REB: 37 (8 off, 29 def), AST: 22, TO: 12


Team_039
--------------------------------------------------------------------------------
Player                MIN  PTS  REB  AST  TO      FG   FG%      3P   3P%      FT STL BLK
--------------------------------------------------------------------------------
Donovan Markkanen      35   19   15    4   1   7/11   63.6   2/4    50.0   5/6     0   0
Austin O'Neal          35   19    7    2   0   9/13   69.2   2/5    40.0   7/8     0   0
Anfernee Carter        35   19    0    1   3   8/13   61.5   1/3    33.3   9/10    0   0
Klay Wade              35   11    8    3   2   5/9    55.6   0/0     0.0   5/6     3   2
Jrue Bridges           30   14    0    4   1   6/8    75.0   1/2    50.0   3/3     0   0
Tracy Mitchell         19    9    0    1   2   3/4    75.0   2/3    66.7   3/3     0   0
Jayson Cunningham      14   11    0    1   0   4/9    44.4   0/4     0.0   3/3     0   0
Yao Carter             14    0    4    0   1   0/2     0.0   0/1     0.0   0/0     0   0
Victor Gasol           14    2    4    0   1   1/3    33.3   0/0     0.0   0/0     1   1
Bam Booker             14    2    2    1   1   1/2    50.0   0/0     0.0   0/2     1   0

TEAM: FG: 45/76 (59.2%), 3PT: 8/22 (36.4%), REB: 41 (10 off, 31 def), AST: 17, TO: 12

================================================================================
