================================================================================
                        FULL GAME - Team_016 vs Team_045                        
================================================================================

================================================================================
                       1ST QUARTER - Team_016 vs Team_045                       
================================================================================

[12:00] Team_016 possession (Score: 0-0)
Giannis Ginobili makes the Midrange and draws the foul on DeMar Turner! And-1! Giannis Ginobili to the line for 1. [Team fouls: 1] (DeMar Turner: 1 personal fouls)   FT 1/1: GOOD Giannis Ginobili makes 1/1 from the line.
Score: 3-0

[11:48] Team_045 possession (Score: 3-0)
Rudy Antetokounmpo drives and kicks out. Cole Simons attempts a 3Pt. Contested by Vince Quickley (4.2 feet, MAN). Cole Simons misses. Rebound secured by Vince Quickley.

[11:34] Team_016 possession (Score: 3-0)
Giannis Ginobili attempts a Midrange. Contested by Trae Russell (5.5 feet, ZONE). Giannis Ginobili misses. Offensive rebound by Vince Duncan! Vince Duncan puts it back in!
Score: 5-0

[11:20] Team_045 possession (Score: 5-0)
FOUL! Reach-in foul on Vince Duncan during the drive. [Team fouls: 1] No free throws, side out. (Vince Duncan: 1 personal fouls)

[11:06] Team_045 possession (Score: 5-0)
FOUL! Reach-in foul on Vince Duncan during the drive. [Team fouls: 2] No free throws, side out. (Vince Duncan: 2 personal fouls)

[10:50] Team_045 possession (Score: 5-0)
DeMar Turner drives and kicks out. Trae Russell attempts a Midrange. Contested by Giannis Ginobili (5.6 feet, MAN). Trae Russell misses. Rebound secured by Ben Barrett.

[10:38] Team_016 possession (Score: 5-0)
Vince Duncan drives, picks up Zion Butler. Help arrives from Rudy Antetokounmpo! Vince Duncan attempts a Dunk. Contested by Rudy Antetokounmpo (3.6 feet, MAN). VINCE DUNCAN MAKES IT! Assist: Vince Quickley
Score: 7-0

[10:23] Team_045 possession (Score: 7-0)
Rudy Antetokounmpo attempts a Midrange. Contested by Collin Barnes (4.4 feet, MAN). Rudy Antetokounmpo misses. Rebound secured by Vince Duncan.

[10:07] Team_016 possession (Score: 7-0)
Vince Duncan drives to the basket... Vince Duncan throws a bad pass out of bounds! TURNOVER! (dead ball)

[09:50] Team_045 possession (Score: 7-0)
Trae Russell throws a bad pass! Stolen by Giannis Ginobili! TURNOVER! (live ball)

[09:35] Team_016 possession (Score: 7-0)
FOUL! Shooting foul on Zion Butler. Ben Barrett to the line for 2 free throws. [Team fouls: 2] (Zion Butler: 1 personal fouls)   FT 1/2: GOOD   FT 2/2: GOOD Ben Barrett makes 2/2 from the line.
Score: 9-0

[09:19] Team_045 possession (Score: 9-0)
Cole Simons attempts a 3Pt. Contested by Collin Barnes (4.6 feet, ZONE). Cole Simons misses. Offensive rebound by Zion Butler! Zion Butler puts it back in!
Score: 9-2

[09:03] Team_016 possession (Score: 9-2)
Vince Duncan drives, Zion Butler stays with him. Vince Duncan attempts a Dunk. Contested by Zion Butler (3.6 feet, ZONE). VINCE DUNCAN MAKES IT! Assist: Vince Quickley
Score: 11-2

[08:52] Team_045 possession (Score: 11-2)
FOUL! Shooting foul on Collin Barnes. Zion Butler to the line for 2 free throws. [Team fouls: 3] (Collin Barnes: 1 personal fouls)   FT 1/2: GOOD   FT 2/2: GOOD Zion Butler makes 2/2 from the line.
Score: 11-4

[08:35] Team_016 possession (Score: 11-4)
Giannis Ginobili drives, picks up Zion Butler. Help arrives from Rudy Antetokounmpo! Giannis Ginobili attempts a Layup. Contested by Rudy Antetokounmpo (3.3 feet, ZONE). GIANNIS GINOBILI MAKES IT! Assist: Vince Duncan
Score: 13-4

[08:19] Team_045 possession (Score: 13-4)
Rudy Antetokounmpo attempts a Midrange. Contested by Collin Barnes (4.4 feet, MAN). Rudy Antetokounmpo misses. Rebound secured by Vince Duncan.

[08:07] Team_016 possession (Score: 13-4)
Vince Quickley attempts a Layup. Contested by Cole Simons (2.8 feet, MAN). VINCE QUICKLEY MAKES IT!
Score: 15-4

[07:51] Team_045 possession (Score: 15-4)
Trae Russell attempts a 3Pt. Contested by Collin Barnes (4.5 feet, ZONE). Trae Russell misses. Rebound secured by Ben Barrett.

[07:41] Team_016 possession (Score: 15-4)
Ben Barrett drives, Zion Butler stays with him. Ben Barrett attempts a Layup. Contested by Zion Butler (3.8 feet, MAN). BEN BARRETT MAKES IT! Assist: Collin Barnes
Score: 17-4

[07:27] Team_045 possession (Score: 17-4)
Zion Butler attempts a 3Pt. Contested by Collin Barnes (4.3 feet, ZONE). Zion Butler misses. Rebound secured by Ben Barrett.

[07:13] Team_016 possession (Score: 17-4)
FOUL! Offensive foul on Vince Duncan! Zion Butler drew the charge! [Team fouls: 4] (Vince Duncan: 3 personal fouls) TURNOVER! (dead ball)

[06:56] Team_045 possession (Score: 17-4)
Trae Russell attempts a 3Pt. Contested by Collin Barnes (4.5 feet, ZONE). Trae Russell misses. Rebound secured by Vince Duncan.

[06:46] Team_016 possession (Score: 17-4)
Vince Duncan makes the Layup and draws the foul on Zion Butler! And-1! Vince Duncan to the line for 1. [Team fouls: 3] (Zion Butler: 2 personal fouls)   FT 1/1: GOOD Vince Duncan makes 1/1 from the line.
Score: 20-4

[06:27] Team_045 possession (Score: 20-4)
DeMar Turner throws a bad pass! Stolen by Ben Barrett! TURNOVER! (live ball)

[06:08] Team_016 possession (Score: 20-4)
Vince Duncan attempts a 3Pt. Contested by Zion Butler (3.6 feet, MAN). VINCE DUNCAN MAKES IT! Assist: Ben Barrett
Score: 23-4

[05:57] Team_045 possession (Score: 23-4)
Zion Butler attempts a 3Pt. Contested by Collin Barnes (4.3 feet, ZONE). Zion Butler misses. Rebound secured by Vince Duncan.

[05:42] Team_016 possession (Score: 23-4)
FOUL! Shooting foul on Zion Butler. Ben Barrett to the line for 2 free throws. [Team fouls: 4] (Zion Butler: 3 personal fouls)   FT 1/2: GOOD   FT 2/2: GOOD Ben Barrett makes 2/2 from the line.
Score: 25-4

[05:26] Team_045 possession (Score: 25-4)
Cole Simons attempts a 3Pt. Contested by Collin Barnes (4.7 feet, ZONE). Cole Simons misses. Rebound secured by Vince Duncan.

[05:09] Team_016 possession (Score: 25-4)
Giannis Ginobili attempts a Midrange. Contested by Cole Simons (3.4 feet, ZONE). Giannis Ginobili misses. Rebound secured by Cole Simons.

[04:55] Team_045 possession (Score: 25-4)
DeMar Turner makes the Layup and draws the foul on Ben Barrett! And-1! DeMar Turner to the line for 1. [BONUS: 5 team fouls] (Ben Barrett: 1 personal fouls)   FT 1/1: GOOD DeMar Turner makes 1/1 from the line.
Score: 25-7

[04:36] Team_016 possession (Score: 25-7)
FOUL! Reach-in foul on DeMar Turner during the drive. [IN THE BONUS! 5 team fouls] Ben Barrett to the line for 2 free throws. (DeMar Turner: 2 personal fouls)   FT 1/2: GOOD   FT 2/2: GOOD Ben Barrett makes 2/2 from the line.
Score: 27-7

[04:21] Team_045 possession (Score: 27-7)
Cole Simons attempts a 3Pt. Contested by Collin Barnes (4.7 feet, ZONE). Cole Simons misses. Rebound secured by Vince Duncan.

[04:03] Team_016 possession (Score: 27-7)
Ben Barrett drives, Zion Butler stays with him. Ben Barrett attempts a Layup. Contested by Zion Butler (4.0 feet, ZONE). BEN BARRETT MAKES IT!
Score: 29-7

[03:47] Team_045 possession (Score: 29-7)
Zion Butler attempts a Midrange. Contested by Vince Duncan (3.6 feet, ZONE). ZION BUTLER MAKES IT!
Score: 29-9

[03:33] Team_016 possession (Score: 29-9)
Vince Duncan makes the Layup and draws the foul on Zion Butler! And-1! Vince Duncan to the line for 1. [BONUS: 6 team fouls] (Zion Butler: 4 personal fouls)   FT 1/1: GOOD Vince Duncan makes 1/1 from the line.
Score: 32-9

[03:18] Team_045 possession (Score: 32-9)
Zion Butler drives, Vince Duncan stays with him. Zion Butler attempts a Dunk. Contested by Vince Duncan (3.6 feet, ZONE). ZION BUTLER MAKES IT! Assist: Rudy Antetokounmpo
Score: 32-11

[02:59] Team_016 possession (Score: 32-11)
Vince Duncan drives and kicks out. Vince Duncan attempts a 3Pt. Contested by Zion Butler (3.6 feet, MAN). Vince Duncan misses. Rebound secured by Zion Butler.

[02:46] Team_045 possession (Score: 32-11)
FOUL! Holding foul on Vince Quickley. [IN THE BONUS! 6 team fouls] Cole Simons to the line for 2 free throws. (Vince Quickley: 1 personal fouls)   FT 1/2: GOOD   FT 2/2: MISS Cole Simons makes 1/2 from the line. Rebound secured by Vince Duncan.
Score: 32-12

[02:34] Team_016 possession (Score: 32-12)
Vince Quickley attempts a Midrange. Contested by Cole Simons (3.1 feet, MAN). Vince Quickley misses. Rebound secured by Cole Simons.

[02:20] Team_045 possession (Score: 32-12)
Trae Russell attempts a Midrange. Wide open! Giannis Ginobili is 6.3 feet away. [MAN] Trae Russell misses. Offensive rebound by Zion Butler! Zion Butler's putback is no good. Offensive rebound by Zion Butler! Zion Butler kicks it out.

[02:08] Team_045 possession (Score: 32-12)
Rudy Antetokounmpo drives and kicks out. Trae Russell attempts a 3Pt. Contested by Collin Barnes (4.4 feet, ZONE). Trae Russell misses. Rebound secured by Vince Quickley.

[01:54] Team_016 possession (Score: 32-12)
Ben Barrett attempts a 3Pt. Wide open! Trae Russell is 6.1 feet away. [ZONE] BEN BARRETT MAKES IT! Assist: Vince Quickley
Score: 35-12

[01:39] Team_045 possession (Score: 35-12)
Cole Simons attempts a 3Pt. Contested by Collin Barnes (5.0 feet, ZONE). COLE SIMONS MAKES IT! Assist: DeMar Turner
Score: 35-15

[01:23] Team_016 possession (Score: 35-15)
Vince Quickley drives and kicks out. Vince Quickley attempts a Midrange. Contested by Cole Simons (3.7 feet, ZONE). VINCE QUICKLEY MAKES IT!
Score: 37-15

[01:05] Team_045 possession (Score: 37-15)
DeMar Turner attempts a Midrange. Contested by Ben Barrett (4.3 feet, MAN). DEMAR TURNER MAKES IT!
Score: 37-17

[00:53] Team_016 possession (Score: 37-17)
Vince Quickley attempts a 3Pt. Contested by Cole Simons (3.3 feet, ZONE). VINCE QUICKLEY MAKES IT! Assist: Collin Barnes
Score: 40-17

[00:40] Team_045 possession (Score: 40-17)
Zion Butler attempts a Midrange. Contested by Vince Duncan (3.9 feet, MAN). Zion Butler misses. Rebound secured by Vince Duncan.

[00:28] Team_016 possession (Score: 40-17)
Vince Duncan drives, Zion Butler stays with him. Vince Duncan attempts a Dunk. Contested by Zion Butler (4.3 feet, ZONE). VINCE DUNCAN MAKES IT! Assist: Ben Barrett
Score: 42-17

[00:12] Team_045 possession (Score: 42-17)
Cole Simons attempts a 3Pt. Contested by Collin Barnes (5.1 feet, ZONE). Cole Simons misses. Offensive rebound by DeMar Turner! DeMar Turner kicks it out.

================================================================================
                              1ST QUARTER COMPLETE                              
================================================================================

1ST QUARTER SCORE: Team_016 42, Team_045 17

BOX SCORE:
================================================================================

Team_016
--------------------------------------------------------------------------------
Player                MIN  PTS  REB  AST  TO      FG   FG%      3P   3P%
--------------------------------------------------------------------------------
Vince Duncan           12   17    9    1   0   7/8    87.5     0/0   0.0
Ben Barrett            12   13    3    2   0   6/6   100.0     0/0   0.0
Vince Quickley         12    7    2    3   0   3/4    75.0     0/0   0.0
Giannis Ginobili       12    5    0    0   0   2/3    66.7     0/0   0.0
Collin Barnes          12    0    0    2   0   0/0     0.0     0/0   0.0

TEAM: FG: 18/21 (85.7%), 3PT: 3/3 (100.0%), REB: 14 (1 off, 13 def), AST: 8, TO: 2
TEAM FOULS: 6 [Team_045 in BONUS]


Team_045
--------------------------------------------------------------------------------
Player                MIN  PTS  REB  AST  TO      FG   FG%      3P   3P%
--------------------------------------------------------------------------------
Zion Butler            12    8    3    0   0   4/7    57.1     0/0   0.0
DeMar Turner           12    5    1    1   0   2/3    66.7     0/0   0.0
Cole Simons            12    3    2    0   0   1/3    33.3     0/0   0.0
Rudy Antetokounmpo     12    0    0    1   0   0/4     0.0     0/0   0.0
Trae Russell           12    0    0    0   0   0/2     0.0     0/0   0.0

TEAM: FG: 7/20 (35.0%), 3PT: 2/8 (25.0%), REB: 6 (3 off, 3 def), AST: 2, TO: 2
TEAM FOULS: 6 [Team_016 in BONUS]

================================================================================

================================================================================
                       2ND QUARTER - Team_016 vs Team_045                       
================================================================================

[12:00] Team_016 possession (Score: 42-17)
Collin Barnes attempts a Midrange. Contested by DeMar Turner (5.1 feet, ZONE). Collin Barnes misses. Rebound secured by DeMar Turner.

[11:44] Team_045 possession (Score: 42-17)
Trae Russell drives, picks up Ben Barrett. Help arrives from Collin Barnes! Trae Russell attempts a Layup. Contested by Collin Barnes (4.4 feet, ZONE). TRAE RUSSELL MAKES IT!
Score: 42-19

[11:30] Team_016 possession (Score: 42-19)
Collin Barnes attempts a Midrange. Contested by Rudy Antetokounmpo (4.7 feet, MAN). COLLIN BARNES MAKES IT!
Score: 44-19

[11:14] Team_045 possession (Score: 44-19)
Cole Simons drives, picks up Ben Barrett. Help arrives from Collin Barnes! Cole Simons attempts a Layup. Contested by Collin Barnes (4.6 feet, ZONE). Cole Simons misses. Rebound secured by Vince Duncan.

[10:57] Team_016 possession (Score: 44-19)
Ben Barrett attempts a 3Pt. Contested by Cole Simons (4.3 feet, ZONE). Ben Barrett misses. Rebound secured by DeMar Turner.

[10:39] Team_045 possession (Score: 44-19)
Trae Russell makes the Layup and draws the foul on Giannis Ginobili! And-1! Trae Russell to the line for 1. [Team fouls: 1] (Giannis Ginobili: 1 personal fouls)   FT 1/1: GOOD Trae Russell makes 1/1 from the line.
Score: 44-22

[10:22] Team_016 possession (Score: 44-22)
Ben Barrett drives and kicks out. Collin Barnes attempts a Midrange. Contested by DeMar Turner (5.3 feet, ZONE). Collin Barnes misses. Offensive rebound by Vince Duncan! Vince Duncan kicks it out.

[10:08] Team_016 possession (Score: 44-22)
Giannis Ginobili attempts a 3Pt. Contested by Cole Simons (3.9 feet, ZONE). GIANNIS GINOBILI MAKES IT! Assist: Ben Barrett
Score: 47-22

[09:50] Team_045 possession (Score: 47-22)
Cole Simons drives, Vince Quickley stays with him. Cole Simons attempts a Dunk. Contested by Vince Quickley (5.1 feet, MAN). COLE SIMONS MAKES IT!
Score: 47-24

[09:34] Team_016 possession (Score: 47-24)
Vince Duncan attempts a Dunk. BLOCKED BY DEMAR TURNER! Ball is loose! Rebound secured by DeMar Turner.

[09:16] Team_045 possession (Score: 47-24)
Zion Butler drives to the basket... FOUL! Offensive foul on Zion Butler! Vince Duncan drew the charge! [Team fouls: 1] (Zion Butler: 1 personal fouls) TURNOVER! (dead ball)

[09:01] Team_016 possession (Score: 47-24)
Collin Barnes attempts a Midrange. Contested by Rudy Antetokounmpo (4.9 feet, MAN). Collin Barnes misses. Rebound secured by Zion Butler.

[08:50] Team_045 possession (Score: 47-24)
Rudy Antetokounmpo attempts a Midrange. Contested by Collin Barnes (5.1 feet, MAN). Rudy Antetokounmpo misses. Rebound secured by Vince Duncan.

[08:40] Team_016 possession (Score: 47-24)
FOUL! Shooting foul on Zion Butler. Vince Duncan to the line for 2 free throws. [Team fouls: 2] (Zion Butler: 2 personal fouls)   FT 1/2: GOOD   FT 2/2: GOOD Vince Duncan makes 2/2 from the line.
Score: 49-24

[08:28] Team_045 possession (Score: 49-24)
FOUL! Shooting foul on Vince Duncan. DeMar Turner to the line for 2 free throws. [Team fouls: 2] (Vince Duncan: 1 personal fouls)   FT 1/2: GOOD   FT 2/2: GOOD DeMar Turner makes 2/2 from the line.
Score: 49-26

[08:16] Team_016 possession (Score: 49-26)
Ben Barrett attempts a Layup. Contested by DeMar Turner (6.0 feet, MAN). BEN BARRETT MAKES IT! Assist: Vince Duncan
Score: 51-26

[07:57] Team_045 possession (Score: 51-26)
Cole Simons attempts a 3Pt. Contested by Vince Quickley (5.3 feet, ZONE). Cole Simons misses. Rebound secured by Ben Barrett.

[07:39] Team_016 possession (Score: 51-26)
FOUL! Offensive foul on Collin Barnes! Rudy Antetokounmpo drew the charge! [Team fouls: 3] (Collin Barnes: 1 personal fouls) TURNOVER! (dead ball)

[07:23] Team_045 possession (Score: 51-26)
Rudy Antetokounmpo attempts a 3Pt. Contested by Collin Barnes (5.3 feet, ZONE). Rudy Antetokounmpo misses. Rebound secured by Vince Quickley.

[07:08] Team_016 possession (Score: 51-26)
Vince Quickley attempts a 3Pt. Contested by Cole Simons (3.9 feet, MAN). Vince Quickley misses. Rebound secured by Cole Simons.

[06:50] Team_045 possession (Score: 51-26)
Zion Butler attempts a 3Pt. Contested by Collin Barnes (5.2 feet, ZONE). Zion Butler misses. Rebound secured by Ben Barrett.

[06:38] Team_016 possession (Score: 51-26)
Vince Quickley drives and kicks out. Giannis Ginobili attempts a 3Pt. Wide open! Trae Russell is 6.2 feet away. [MAN] Giannis Ginobili misses. Rebound secured by DeMar Turner.

[06:27] Team_045 possession (Score: 51-26)
Rudy Antetokounmpo attempts a 3Pt. Contested by Collin Barnes (5.4 feet, MAN). Rudy Antetokounmpo misses. Rebound secured by Vince Duncan.

[06:10] Team_016 possession (Score: 51-26)
FOUL! Shooting foul on Cole Simons. Collin Barnes to the line for 3 free throws. [Team fouls: 3] (Cole Simons: 1 personal fouls)   FT 1/3: GOOD   FT 2/3: GOOD   FT 3/3: GOOD Collin Barnes makes 3/3 from the line.
Score: 54-26

[05:58] Team_045 possession (Score: 54-26)
DeMar Turner attempts a 3Pt. Contested by Collin Barnes (5.4 feet, ZONE). DeMar Turner misses. Rebound secured by Ben Barrett.

[05:43] Team_016 possession (Score: 54-26)
Vince Quickley attempts a 3Pt. Contested by Rudy Antetokounmpo (5.0 feet, ZONE). VINCE QUICKLEY MAKES IT! Assist: Vince Duncan
Score: 57-26

[05:26] Team_045 possession (Score: 57-26)
FOUL! Shooting foul on Collin Barnes. Trae Russell to the line for 2 free throws. [Team fouls: 4] (Collin Barnes: 2 personal fouls)   FT 1/2: GOOD   FT 2/2: GOOD Trae Russell makes 2/2 from the line.
Score: 57-28

[05:11] Team_016 possession (Score: 57-28)
Collin Barnes attempts a 3Pt. Contested by Rudy Antetokounmpo (5.4 feet, MAN). Collin Barnes misses. Rebound secured by DeMar Turner.

[04:56] Team_045 possession (Score: 57-28)
Rudy Antetokounmpo drives, picks up Collin Barnes. Help arrives from Vince Quickley! Rudy Antetokounmpo attempts a Dunk. Contested by Vince Quickley (5.6 feet, MAN). RUDY ANTETOKOUNMPO MAKES IT!
Score: 57-30

[04:43] Team_016 possession (Score: 57-30)
Ben Barrett attempts a 3Pt. Contested by Cole Simons (5.1 feet, ZONE). Ben Barrett misses. Rebound secured by Zion Butler.

[04:27] Team_045 possession (Score: 57-30)
Cole Simons throws a bad pass out of bounds! TURNOVER! (dead ball)

[04:27] Substitution (Team_016): Collin Barnes OUT → Lamelo Herro IN (stamina_rule2)

[04:27] Substitution (Team_016): Giannis Ginobili OUT → Immanuel Nowitzki IN (stamina_rule2)

[04:27] Substitution (Team_016): Vince Quickley OUT → Kevin Butler IN (stamina_rule2)

[04:27] Substitution (Team_016): Ben Barrett OUT → Giannis Doncic IN (stamina_rule2)

[04:27] Substitution (Team_016): Vince Duncan OUT → Trae Barnes IN (stamina_rule2)

[04:27] Substitution (Team_045): Rudy Antetokounmpo OUT → John Wagner IN (stamina_rule2)

[04:27] Substitution (Team_045): Trae Russell OUT → Julius James IN (stamina_rule2)

[04:27] Substitution (Team_045): Cole Simons OUT → Gary Towns IN (stamina_rule2)

[04:27] Substitution (Team_045): DeMar Turner OUT → Tim Sexton IN (stamina_rule2)

[04:27] Substitution (Team_045): Zion Butler OUT → Stephen Paul IN (stamina_rule2)

[04:12] Team_016 possession (Score: 57-30)
Giannis Doncic attempts a Layup. Contested by Tim Sexton (4.6 feet, MAN). GIANNIS DONCIC MAKES IT!
Score: 59-30

[03:59] Team_045 possession (Score: 59-30)
Julius James attempts a 3Pt. Contested by Immanuel Nowitzki (4.8 feet, MAN). Julius James misses. Rebound secured by Lamelo Herro.

[03:41] Team_016 possession (Score: 59-30)
Giannis Doncic attempts a Midrange. Contested by Tim Sexton (4.6 feet, ZONE). GIANNIS DONCIC MAKES IT! Assist: Kevin Butler
Score: 61-30

[03:28] Team_045 possession (Score: 61-30)
Stephen Paul drives and kicks out. Stephen Paul attempts a 3Pt. Contested by Trae Barnes (5.7 feet, MAN). Stephen Paul misses. Offensive rebound by Julius James! Julius James kicks it out.

[03:10] Team_045 possession (Score: 61-30)
FOUL! Reach-in foul on Trae Barnes during the drive. [IN THE BONUS! 5 team fouls] Stephen Paul to the line for 2 free throws. (Trae Barnes: 1 personal fouls)   FT 1/2: GOOD   FT 2/2: GOOD Stephen Paul makes 2/2 from the line.
Score: 61-32

[02:52] Team_016 possession (Score: 61-32)
Trae Barnes makes the Midrange and draws the foul on Stephen Paul! And-1! Trae Barnes to the line for 1. [Team fouls: 4] (Stephen Paul: 1 personal fouls)   FT 1/1: GOOD Trae Barnes makes 1/1 from the line.
Score: 64-32

[02:39] Team_045 possession (Score: 64-32)
Stephen Paul attempts a 3Pt. Contested by Trae Barnes (5.6 feet, MAN). Stephen Paul misses. Offensive rebound by Tim Sexton! Tim Sexton kicks it out.

[02:27] Team_045 possession (Score: 64-32)
Tim Sexton attempts a Midrange. Contested by Kevin Butler (4.8 feet, ZONE). TIM SEXTON MAKES IT!
Score: 64-34

[02:10] Team_016 possession (Score: 64-34)
FOUL! Holding foul on Tim Sexton. [IN THE BONUS! 5 team fouls] Giannis Doncic to the line for 2 free throws. (Tim Sexton: 1 personal fouls)   FT 1/2: GOOD   FT 2/2: GOOD Giannis Doncic makes 2/2 from the line.
Score: 66-34

[01:56] Team_045 possession (Score: 66-34)
Tim Sexton attempts a Midrange. Contested by Giannis Doncic (4.2 feet, ZONE). Tim Sexton misses. FOUL! Loose ball foul on Giannis Doncic during the rebound battle. [IN THE BONUS! 6 team fouls] Tim Sexton to the line for 2 free throws. (Giannis Doncic: 1 personal fouls)   FT 1/2: GOOD   FT 2/2: GOOD Tim Sexton makes 2/2 from the line.
Score: 66-36

[01:44] Team_016 possession (Score: 66-36)
Giannis Doncic attempts a Midrange. Contested by Tim Sexton (4.6 feet, ZONE). Giannis Doncic misses. Rebound secured by Julius James.

[01:26] Team_045 possession (Score: 66-36)
Gary Towns attempts a 3Pt. Contested by Kevin Butler (4.2 feet, MAN). Gary Towns misses. Rebound secured by Giannis Doncic.

[01:10] Team_016 possession (Score: 66-36)
Kevin Butler drives and kicks out. Giannis Doncic attempts a 3Pt. Contested by Tim Sexton (4.6 feet, MAN). Giannis Doncic misses. Rebound secured by Tim Sexton.

[00:56] Team_045 possession (Score: 66-36)
FOUL! Reach-in foul on Kevin Butler during the drive. [IN THE BONUS! 7 team fouls] Gary Towns to the line for 2 free throws. (Kevin Butler: 1 personal fouls)   FT 1/2: GOOD   FT 2/2: GOOD Gary Towns makes 2/2 from the line.
Score: 66-38

[00:40] Team_016 possession (Score: 66-38)
Giannis Doncic attempts a Layup. Contested by Tim Sexton (4.6 feet, MAN). GIANNIS DONCIC MAKES IT! Assist: Immanuel Nowitzki
Score: 68-38

[00:31] Team_045 possession (Score: 68-38)
FOUL! Shooting foul on Immanuel Nowitzki. Julius James to the line for 2 free throws. [BONUS: 8 team fouls] (Immanuel Nowitzki: 1 personal fouls)   FT 1/2: GOOD   FT 2/2: GOOD Julius James makes 2/2 from the line.
Score: 68-40

[00:18] Team_016 possession (Score: 68-40)
Immanuel Nowitzki attempts a Midrange. Contested by John Wagner (4.2 feet, ZONE). Immanuel Nowitzki misses. Rebound secured by Stephen Paul.

[00:04] Team_045 possession (Score: 68-40)
Stephen Paul drives to the basket... FOUL! Offensive foul on Stephen Paul! Giannis Doncic drew the charge! [Team fouls: 6] (Stephen Paul: 2 personal fouls) TURNOVER! (dead ball)

================================================================================
                              2ND QUARTER COMPLETE                              
================================================================================

2ND QUARTER SCORE: Team_016 26, Team_045 23

BOX SCORE:
================================================================================

Team_016
--------------------------------------------------------------------------------
Player                MIN  PTS  REB  AST  TO      FG   FG%      3P   3P%
--------------------------------------------------------------------------------
Giannis Doncic          4    8    1    0   0   4/5    80.0     0/0   0.0
Collin Barnes          20    5    0    0   0   2/5    40.0     0/0   0.0
Giannis Ginobili       20    3    0    0   0   1/1   100.0     0/0   0.0
Vince Quickley         20    3    1    0   0   1/3    33.3     0/0   0.0
Trae Barnes             4    3    0    0   0   1/1   100.0     0/0   0.0
Vince Duncan           20    2    4    2   0   1/2    50.0     0/0   0.0
Ben Barrett            20    2    3    1   0   1/3    33.3     0/0   0.0
Lamelo Herro            4    0    1    0   0   0/0     0.0     0/0   0.0
Kevin Butler            4    0    0    1   0   0/1     0.0     0/0   0.0
Immanuel Nowitzki       4    0    0    1   0   0/1     0.0     0/0   0.0

TEAM: FG: 11/22 (50.0%), 3PT: 3/7 (42.9%), REB: 10 (1 off, 9 def), AST: 5, TO: 1
TEAM FOULS: 8 [Team_045 in BONUS]


Team_045
--------------------------------------------------------------------------------
Player                MIN  PTS  REB  AST  TO      FG   FG%      3P   3P%
--------------------------------------------------------------------------------
Trae Russell           20    7    0    0   0   3/3   100.0     0/0   0.0
Tim Sexton              4    4    2    0   0   2/2   100.0     0/0   0.0
DeMar Turner           20    2    5    0   0   1/2    50.0     0/0   0.0
Cole Simons            20    2    1    0   0   1/3    33.3     0/0   0.0
Rudy Antetokounmpo     20    2    0    0   0   1/4    25.0     0/0   0.0
Julius James            4    2    2    0   0   1/2    50.0     0/0   0.0
Stephen Paul            4    2    1    0   0   1/1   100.0     0/0   0.0
Gary Towns              4    2    0    0   0   1/2    50.0     0/0   0.0
Zion Butler            20    0    2    0   0   0/1     0.0     0/0   0.0

TEAM: FG: 11/20 (55.0%), 3PT: 0/7 (0.0%), REB: 13 (2 off, 11 def), AST: 0, TO: 3
TEAM FOULS: 6 [Team_016 in BONUS]

================================================================================

================================================================================
                       3RD QUARTER - Team_016 vs Team_045                       
================================================================================

[12:00] Team_016 possession (Score: 68-40)
Ben Barrett attempts a Layup. Contested by Zion Butler (3.8 feet, MAN). Ben Barrett misses. Rebound secured by Zion Butler.

[11:48] Team_045 possession (Score: 68-40)
Trae Russell commits a violation (traveling/carry)! TURNOVER! (dead ball)

[11:29] Team_016 possession (Score: 68-40)
Collin Barnes attempts a 3Pt. Contested by Cole Simons (3.3 feet, ZONE). Collin Barnes misses. Rebound secured by Cole Simons.

[11:14] Team_045 possession (Score: 68-40)
Trae Russell drives and kicks out. DeMar Turner attempts a Midrange. Contested by Giannis Ginobili (5.6 feet, ZONE). DEMAR TURNER MAKES IT!
Score: 68-42

[11:01] Team_016 possession (Score: 68-42)
Ben Barrett attempts a Layup. Contested by Zion Butler (3.8 feet, ZONE). Ben Barrett misses. Offensive rebound by Vince Duncan! Vince Duncan's putback is no good. Rebound secured by Cole Simons.

[10:49] Team_045 possession (Score: 68-42)
Trae Russell attempts a 3Pt. Contested by Collin Barnes (4.5 feet, ZONE). Trae Russell misses. Rebound secured by Ben Barrett.

[10:33] Team_016 possession (Score: 68-42)
Collin Barnes attempts a 3Pt. Contested by DeMar Turner (5.0 feet, ZONE). Collin Barnes misses. Rebound secured by Cole Simons.

[10:17] Team_045 possession (Score: 68-42)
Rudy Antetokounmpo attempts a Midrange. Contested by Collin Barnes (4.4 feet, MAN). Rudy Antetokounmpo misses. Rebound secured by Ben Barrett.

[10:03] Team_016 possession (Score: 68-42)
Collin Barnes makes the Layup and draws the foul on Rudy Antetokounmpo! And-1! Collin Barnes to the line for 1. [Team fouls: 1] (Rudy Antetokounmpo: 1 personal fouls)   FT 1/1: MISS Collin Barnes makes 0/1 from the line. Rebound secured by Zion Butler.
Score: 70-42

[09:50] Team_045 possession (Score: 70-42)
Cole Simons attempts a 3Pt. Contested by Collin Barnes (4.6 feet, ZONE). COLE SIMONS MAKES IT! Assist: Zion Butler
Score: 70-45

[09:32] Team_016 possession (Score: 70-45)
Vince Quickley attempts a Midrange. Contested by Cole Simons (2.8 feet, MAN). Vince Quickley misses. Rebound secured by Zion Butler.

[09:19] Team_045 possession (Score: 70-45)
Rudy Antetokounmpo attempts a 3Pt. Contested by Collin Barnes (4.4 feet, MAN). Rudy Antetokounmpo misses. Rebound secured by Vince Duncan.

[09:01] Team_016 possession (Score: 70-45)
Collin Barnes attempts a 3Pt. Contested by Cole Simons (3.3 feet, ZONE). Collin Barnes misses. Rebound secured by DeMar Turner.

[08:51] Team_045 possession (Score: 70-45)
DeMar Turner attempts a Layup. Contested by Ben Barrett (3.9 feet, MAN). DEMAR TURNER MAKES IT! Assist: Cole Simons
Score: 70-47

[08:38] Team_016 possession (Score: 70-47)
Vince Quickley loses control! Ball rolls out of bounds! TURNOVER! (dead ball)

[08:27] Team_045 possession (Score: 70-47)
Trae Russell drives to the basket... Trae Russell commits a violation (traveling/carry)! TURNOVER! (dead ball)

[08:11] Team_016 possession (Score: 70-47)
Collin Barnes attempts a 3Pt. Contested by Cole Simons (3.3 feet, ZONE). Collin Barnes misses. Rebound secured by DeMar Turner.

[07:55] Team_045 possession (Score: 70-47)
FOUL! Shooting foul on Collin Barnes. Rudy Antetokounmpo to the line for 2 free throws. [Team fouls: 1] (Collin Barnes: 1 personal fouls)   FT 1/2: GOOD   FT 2/2: GOOD Rudy Antetokounmpo makes 2/2 from the line.
Score: 70-49

[07:39] Team_016 possession (Score: 70-49)
Collin Barnes attempts a 3Pt. Contested by Rudy Antetokounmpo (4.5 feet, MAN). Collin Barnes misses. Rebound secured by DeMar Turner.

[07:25] Team_045 possession (Score: 70-49)
Cole Simons attempts a 3Pt. Contested by Vince Quickley (4.9 feet, MAN). Cole Simons misses. Rebound secured by Vince Quickley.

[07:08] Team_016 possession (Score: 70-49)
Collin Barnes drives, Rudy Antetokounmpo stays with him. Collin Barnes attempts a Layup. Contested by Rudy Antetokounmpo (4.5 feet, MAN). COLLIN BARNES MAKES IT!
Score: 72-49

[06:57] Team_045 possession (Score: 72-49)
Rudy Antetokounmpo attempts a Midrange. Contested by Collin Barnes (4.4 feet, MAN). RUDY ANTETOKOUNMPO MAKES IT!
Score: 72-51

[06:39] Team_016 possession (Score: 72-51)
Vince Quickley attempts a Midrange. Contested by Trae Russell (4.9 feet, ZONE). Vince Quickley misses. Offensive rebound by Vince Duncan! Vince Duncan puts it back in!
Score: 74-51

[06:23] Team_045 possession (Score: 74-51)
Trae Russell drives to the basket... Trae Russell throws a bad pass out of bounds! TURNOVER! (dead ball)

[06:08] Team_016 possession (Score: 74-51)
Collin Barnes attempts a 3Pt. Contested by Rudy Antetokounmpo (4.5 feet, MAN). Collin Barnes misses. Rebound secured by Cole Simons.

[05:55] Team_045 possession (Score: 74-51)
DeMar Turner attempts a Midrange. Contested by Ben Barrett (3.9 feet, MAN). DeMar Turner misses. Rebound secured by Vince Quickley.

[05:36] Team_016 possession (Score: 74-51)
Vince Quickley attempts a 3Pt. Contested by Cole Simons (2.8 feet, ZONE). Vince Quickley misses. Rebound secured by DeMar Turner.

[05:22] Team_045 possession (Score: 74-51)
DeMar Turner drives to the basket... DeMar Turner throws a bad pass out of bounds! TURNOVER! (dead ball)

[05:07] Team_016 possession (Score: 74-51)
Vince Duncan throws a bad pass! Stolen by Zion Butler! TURNOVER! (live ball)

[04:51] Team_045 possession (Score: 74-51)
Rudy Antetokounmpo drives and kicks out. Rudy Antetokounmpo attempts a 3Pt. Contested by Vince Quickley (4.2 feet, ZONE). Rudy Antetokounmpo misses. Rebound secured by Ben Barrett.

[04:39] Team_016 possession (Score: 74-51)
Collin Barnes throws a bad pass out of bounds! TURNOVER! (dead ball)

[04:25] Team_045 possession (Score: 74-51)
Cole Simons attempts a 3Pt. Contested by Vince Quickley (4.9 feet, MAN). COLE SIMONS MAKES IT! Assist: Trae Russell
Score: 74-54

[04:11] Team_016 possession (Score: 74-54)
Vince Quickley attempts a Midrange. Contested by Cole Simons (2.9 feet, ZONE). Vince Quickley misses. Rebound secured by Zion Butler.

[03:57] Team_045 possession (Score: 74-54)
Trae Russell attempts a 3Pt. Contested by Collin Barnes (4.7 feet, ZONE). Trae Russell misses. Rebound secured by Vince Duncan.

[03:40] Team_016 possession (Score: 74-54)
Ben Barrett drives, picks up DeMar Turner. Help arrives from Rudy Antetokounmpo! Ben Barrett attempts a Dunk. Contested by Rudy Antetokounmpo (5.6 feet, MAN). BEN BARRETT MAKES IT!
Score: 76-54

[03:26] Team_045 possession (Score: 76-54)
Cole Simons attempts a 3Pt. Contested by Collin Barnes (4.8 feet, ZONE). Cole Simons misses. Rebound secured by Vince Quickley.

[03:11] Team_016 possession (Score: 76-54)
Vince Quickley drives, Zion Butler stays with him. Vince Quickley attempts a Dunk. Contested by Zion Butler (3.1 feet, ZONE). VINCE QUICKLEY MAKES IT!
Score: 78-54

[02:57] Team_045 possession (Score: 78-54)
Rudy Antetokounmpo attempts a 3Pt. Contested by Collin Barnes (4.6 feet, MAN). Rudy Antetokounmpo misses. Rebound secured by Vince Duncan.

[02:44] Team_016 possession (Score: 78-54)
Vince Quickley attempts a 3Pt. Contested by Cole Simons (3.1 feet, MAN). Vince Quickley misses. Rebound secured by DeMar Turner.

[02:29] Team_045 possession (Score: 78-54)
Rudy Antetokounmpo throws a bad pass out of bounds! TURNOVER! (dead ball)

[02:29] Substitution (Team_016): Collin Barnes OUT → Lamelo Herro IN (stamina_rule2)

[02:29] Substitution (Team_016): Ben Barrett OUT → Giannis Doncic IN (stamina_rule2)

[02:29] Substitution (Team_016): Vince Duncan OUT → Trae Barnes IN (stamina_rule2)

[02:29] Substitution (Team_045): Cole Simons OUT → Gary Towns IN (stamina_rule2)

[02:29] Substitution (Team_045): Zion Butler OUT → Stephen Paul IN (stamina_rule2)

[02:16] Team_016 possession (Score: 78-54)
Lamelo Herro attempts a Midrange. Contested by Rudy Antetokounmpo (4.6 feet, MAN). Lamelo Herro misses. FOUL! Loose ball foul on DeMar Turner during the rebound battle. [Team fouls: 2] No free throws, side out. (DeMar Turner: 1 personal fouls)

[02:01] Team_016 possession (Score: 78-54)
Vince Quickley attempts a Layup. Contested by Stephen Paul (4.0 feet, ZONE). Vince Quickley misses. Rebound secured by Stephen Paul.

[01:47] Team_045 possession (Score: 78-54)
Gary Towns drives, Vince Quickley stays with him. Gary Towns attempts a Layup. Contested by Vince Quickley (4.3 feet, MAN). GARY TOWNS MAKES IT!
Score: 78-56

[01:31] Team_016 possession (Score: 78-56)
Trae Barnes attempts a Midrange. Contested by Stephen Paul (4.3 feet, MAN). Trae Barnes misses. Rebound secured by Gary Towns.

[01:17] Team_045 possession (Score: 78-56)
Rudy Antetokounmpo attempts a Midrange. Contested by Lamelo Herro (4.1 feet, MAN). Rudy Antetokounmpo misses. Rebound secured by Vince Quickley.

[01:01] Team_016 possession (Score: 78-56)
Giannis Doncic attempts a Midrange. Contested by DeMar Turner (5.3 feet, MAN). Giannis Doncic misses. Rebound secured by Stephen Paul.

[00:49] Team_045 possession (Score: 78-56)
Gary Towns attempts a 3Pt. Contested by Lamelo Herro (3.6 feet, ZONE). Gary Towns misses. Rebound secured by Trae Barnes.

[00:30] Team_016 possession (Score: 78-56)
FOUL! Shooting foul on DeMar Turner. Trae Barnes to the line for 2 free throws. [Team fouls: 3] (DeMar Turner: 2 personal fouls)   FT 1/2: GOOD   FT 2/2: MISS Trae Barnes makes 1/2 from the line. FOUL! Loose ball foul on Stephen Paul during the free throw rebound! [Team fouls: 4] No free throws, side out. (Stephen Paul: 1 personal fouls)
Score: 79-56

[00:16] Team_016 possession (Score: 79-56)
FOUL! Shooting foul on Rudy Antetokounmpo. Lamelo Herro to the line for 2 free throws. [BONUS: 5 team fouls] (Rudy Antetokounmpo: 2 personal fouls)   FT 1/2: GOOD   FT 2/2: GOOD Lamelo Herro makes 2/2 from the line.
Score: 81-56

================================================================================
                              3RD QUARTER COMPLETE                              
================================================================================

3RD QUARTER SCORE: Team_016 13, Team_045 16

BOX SCORE:
================================================================================

Team_016
--------------------------------------------------------------------------------
Player                MIN  PTS  REB  AST  TO      FG   FG%      3P   3P%
--------------------------------------------------------------------------------
Ben Barrett            30    2    3    0   0   1/3    33.3     0/0   0.0
Collin Barnes          30    2    0    0   0   1/8    12.5     0/0   0.0
Vince Quickley         32    2    4    0   0   1/6    16.7     0/0   0.0
Vince Duncan           30    2    4    0   0   1/1   100.0     0/0   0.0
Lamelo Herro            7    2    0    0   0   1/1   100.0     0/0   0.0
Trae Barnes             7    0    2    0   0   0/1     0.0     0/0   0.0
Giannis Doncic          7    0    1    0   0   0/1     0.0     0/0   0.0

TEAM: FG: 5/21 (23.8%), 3PT: 0/8 (0.0%), REB: 15 (4 off, 11 def), AST: 0, TO: 3
TEAM FOULS: 1


Team_045
--------------------------------------------------------------------------------
Player                MIN  PTS  REB  AST  TO      FG   FG%      3P   3P%
--------------------------------------------------------------------------------
Cole Simons            30    6    4    1   0   2/4    50.0     0/0   0.0
DeMar Turner           32    4    5    0   0   2/3    66.7     0/0   0.0
Rudy Antetokounmpo     32    4    0    0   0   2/7    28.6     0/0   0.0
Gary Towns              7    2    1    0   0   1/2    50.0     0/0   0.0
Zion Butler            30    0    4    1   0   0/0     0.0     0/0   0.0
Trae Russell           32    0    0    1   0   0/2     0.0     0/0   0.0
Stephen Paul            7    0    2    0   0   0/0     0.0     0/0   0.0

TEAM: FG: 7/18 (38.9%), 3PT: 2/9 (22.2%), REB: 15 (0 off, 15 def), AST: 3, TO: 5
TEAM FOULS: 5 [Team_016 in BONUS]

================================================================================

================================================================================
                       4TH QUARTER - Team_016 vs Team_045                       
================================================================================

[12:00] Team_016 possession (Score: 81-56)
Giannis Ginobili drives and kicks out. Ben Barrett attempts a 3Pt. BLOCKED BY ZION BUTLER! Ball is loose! Offensive rebound by Ben Barrett! Ben Barrett kicks it out.

[11:44] Team_016 possession (Score: 81-56)
Ben Barrett attempts a 3Pt. Contested by Cole Simons (3.8 feet, ZONE). Ben Barrett misses. Rebound secured by DeMar Turner.

[11:28] Team_045 possession (Score: 81-56)
Cole Simons attempts a 3Pt. Contested by Collin Barnes (4.7 feet, ZONE). Cole Simons misses. Rebound secured by Ben Barrett.

[11:14] Team_016 possession (Score: 81-56)
Ben Barrett drives, picks up Zion Butler. Help arrives from Rudy Antetokounmpo! Ben Barrett attempts a Dunk. Contested by Rudy Antetokounmpo (4.0 feet, MAN). BEN BARRETT MAKES IT! Assist: Collin Barnes
Score: 83-56

[11:00] Team_045 possession (Score: 83-56)
Zion Butler attempts a Midrange. Contested by Vince Quickley (4.8 feet, ZONE). ZION BUTLER MAKES IT!
Score: 83-58

[10:44] Team_016 possession (Score: 83-58)
FOUL! Shooting foul on Zion Butler. Vince Quickley to the line for 2 free throws. [Team fouls: 1] (Zion Butler: 1 personal fouls)   FT 1/2: GOOD   FT 2/2: GOOD Vince Quickley makes 2/2 from the line.
Score: 85-58

[10:28] Team_045 possession (Score: 85-58)
Rudy Antetokounmpo drives and kicks out. Cole Simons attempts a 3Pt. Contested by Vince Quickley (4.6 feet, MAN). COLE SIMONS MAKES IT! Assist: Trae Russell
Score: 85-61

[10:17] Team_016 possession (Score: 85-61)
FOUL! Reach-in foul on Zion Butler during the drive. [Team fouls: 2] No free throws, side out. (Zion Butler: 2 personal fouls)

[10:07] Team_016 possession (Score: 85-61)
FOUL! Shooting foul on Trae Russell. Giannis Ginobili to the line for 2 free throws. [Team fouls: 3] (Trae Russell: 1 personal fouls)   FT 1/2: GOOD   FT 2/2: GOOD Giannis Ginobili makes 2/2 from the line.
Score: 87-61

[09:49] Team_045 possession (Score: 87-61)
Cole Simons attempts a 3Pt. Contested by Vince Quickley (5.3 feet, MAN). Cole Simons misses. Offensive rebound by Cole Simons! Cole Simons kicks it out.

[09:32] Team_045 possession (Score: 87-61)
Rudy Antetokounmpo attempts a 3Pt. Contested by Collin Barnes (4.6 feet, ZONE). Rudy Antetokounmpo misses. Offensive rebound by Zion Butler! Zion Butler puts it back in!
Score: 87-63

[09:15] Team_016 possession (Score: 87-63)
Giannis Ginobili attempts a 3Pt. Contested by Cole Simons (3.6 feet, MAN). Giannis Ginobili misses. Rebound secured by DeMar Turner.

[09:04] Team_045 possession (Score: 87-63)
Cole Simons attempts a Midrange. Contested by Vince Quickley (5.3 feet, MAN). Cole Simons misses. Rebound secured by Vince Duncan.

[08:47] Team_016 possession (Score: 87-63)
Vince Duncan drives, Zion Butler stays with him. Vince Duncan attempts a Dunk. Contested by Zion Butler (4.1 feet, MAN). VINCE DUNCAN MAKES IT!
Score: 89-63

[08:28] Team_045 possession (Score: 89-63)
Zion Butler attempts a Midrange. Contested by Vince Duncan (3.8 feet, MAN). Zion Butler misses. Rebound secured by Vince Duncan.

[08:12] Team_016 possession (Score: 89-63)
Giannis Ginobili loses the ball! Stripped by Cole Simons! TURNOVER! (live ball)

[08:01] Team_045 possession (Score: 89-63)
FOUL! Holding foul on Vince Duncan. [Team fouls: 1] No free throws, side out. (Vince Duncan: 1 personal fouls)

[07:48] Team_045 possession (Score: 89-63)
DeMar Turner attempts a 3Pt. Contested by Collin Barnes (4.7 feet, ZONE). DeMar Turner misses. Rebound secured by Vince Quickley.

[07:34] Team_016 possession (Score: 89-63)
FOUL! Holding foul on Zion Butler. [Team fouls: 4] No free throws, side out. (Zion Butler: 3 personal fouls)

[07:20] Team_016 possession (Score: 89-63)
Collin Barnes attempts a 3Pt. Contested by Rudy Antetokounmpo (5.2 feet, MAN). COLLIN BARNES MAKES IT!
Score: 92-63

[07:08] Team_045 possession (Score: 92-63)
DeMar Turner makes the Midrange and draws the foul on Ben Barrett! And-1! DeMar Turner to the line for 1. [Team fouls: 2] (Ben Barrett: 1 personal fouls)   FT 1/1: GOOD DeMar Turner makes 1/1 from the line.
Score: 92-66

[06:51] Team_016 possession (Score: 92-66)
Giannis Ginobili drives, Zion Butler stays with him. Giannis Ginobili attempts a Layup. Contested by Zion Butler (4.1 feet, ZONE). Giannis Ginobili misses. Rebound secured by DeMar Turner.

[06:32] Team_045 possession (Score: 92-66)
Cole Simons attempts a Layup. Contested by Vince Duncan (4.3 feet, ZONE). COLE SIMONS MAKES IT! Assist: DeMar Turner
Score: 92-68

[06:22] Team_016 possession (Score: 92-68)
FOUL! Reach-in foul on Zion Butler during the drive. [IN THE BONUS! 5 team fouls] Vince Quickley to the line for 2 free throws. (Zion Butler: 4 personal fouls)   FT 1/2: MISS   FT 2/2: GOOD Vince Quickley makes 1/2 from the line.
Score: 93-68

[06:11] Team_045 possession (Score: 93-68)
FOUL! Reach-in foul on Vince Duncan during the drive. [Team fouls: 3] No free throws, side out. (Vince Duncan: 2 personal fouls)

[05:52] Team_045 possession (Score: 93-68)
Zion Butler drives, Vince Duncan stays with him. Zion Butler attempts a Layup. Contested by Vince Duncan (4.1 feet, MAN). Zion Butler misses. Rebound secured by Ben Barrett.

[05:40] Team_016 possession (Score: 93-68)
Ben Barrett drives to the basket... Ben Barrett commits a violation (traveling/carry)! TURNOVER! (dead ball)

[05:40] Substitution (Team_016): Collin Barnes OUT → Lamelo Herro IN (stamina_rule2)

[05:40] Substitution (Team_016): Giannis Ginobili OUT → Immanuel Nowitzki IN (stamina_rule2)

[05:40] Substitution (Team_016): Vince Quickley OUT → Kevin Butler IN (stamina_rule2)

[05:40] Substitution (Team_016): Ben Barrett OUT → Giannis Doncic IN (stamina_rule2)

[05:40] Substitution (Team_016): Vince Duncan OUT → Trae Barnes IN (stamina_rule2)

[05:40] Substitution (Team_045): Rudy Antetokounmpo OUT → John Wagner IN (stamina_rule2)

[05:40] Substitution (Team_045): Trae Russell OUT → Julius James IN (stamina_rule2)

[05:40] Substitution (Team_045): Cole Simons OUT → Gary Towns IN (stamina_rule2)

[05:40] Substitution (Team_045): DeMar Turner OUT → Tim Sexton IN (stamina_rule2)

[05:40] Substitution (Team_045): Zion Butler OUT → Stephen Paul IN (stamina_rule2)

[05:21] Team_045 possession (Score: 93-68)
FOUL! Holding foul on Kevin Butler. [Team fouls: 4] No free throws, side out. (Kevin Butler: 1 personal fouls)

[05:05] Team_045 possession (Score: 93-68)
John Wagner attempts a 3Pt. Contested by Lamelo Herro (4.0 feet, MAN). John Wagner misses. Rebound secured by Giannis Doncic.

[04:48] Team_016 possession (Score: 93-68)
Trae Barnes attempts a 3Pt. Contested by Stephen Paul (4.3 feet, MAN). Trae Barnes misses. Rebound secured by Julius James.

[04:35] Team_045 possession (Score: 93-68)
Julius James attempts a Midrange. Contested by Kevin Butler (4.6 feet, ZONE). Julius James misses. Rebound secured by Giannis Doncic.

[04:20] Team_016 possession (Score: 93-68)
Lamelo Herro attempts a Layup. Contested by Stephen Paul (4.5 feet, ZONE). LAMELO HERRO MAKES IT! Assist: Giannis Doncic
Score: 95-68

[04:03] Team_045 possession (Score: 95-68)
Stephen Paul makes the Layup and draws the foul on Trae Barnes! And-1! Stephen Paul to the line for 1. [BONUS: 5 team fouls] (Trae Barnes: 1 personal fouls)   FT 1/1: GOOD Stephen Paul makes 1/1 from the line.
Score: 95-71

[03:49] Team_016 possession (Score: 95-71)
Trae Barnes drives to the basket... Trae Barnes throws a bad pass! Stolen by Stephen Paul! TURNOVER! (live ball)

[03:34] Team_045 possession (Score: 95-71)
John Wagner drives and kicks out. Gary Towns attempts a Midrange. Contested by Trae Barnes (5.7 feet, ZONE). GARY TOWNS MAKES IT! Assist: John Wagner
Score: 95-73

[03:22] Team_016 possession (Score: 95-73)
FOUL! Shooting foul on John Wagner. Lamelo Herro to the line for 2 free throws. [BONUS: 6 team fouls] (John Wagner: 1 personal fouls)   FT 1/2: GOOD   FT 2/2: GOOD Lamelo Herro makes 2/2 from the line.
Score: 97-73

[03:05] Team_045 possession (Score: 97-73)
John Wagner attempts a 3Pt. Contested by Lamelo Herro (4.0 feet, ZONE). John Wagner misses. Rebound secured by Lamelo Herro.

[02:51] Team_016 possession (Score: 97-73)
Immanuel Nowitzki attempts a 3Pt. Contested by Julius James (4.1 feet, MAN). Immanuel Nowitzki misses. Rebound secured by Stephen Paul.

[02:37] Team_045 possession (Score: 97-73)
Stephen Paul attempts a Midrange. Contested by Trae Barnes (5.6 feet, MAN). Stephen Paul misses. Rebound secured by Giannis Doncic.

[02:24] Team_016 possession (Score: 97-73)
Giannis Doncic attempts a Midrange. Contested by Tim Sexton (4.6 feet, MAN). Giannis Doncic misses. Rebound secured by Stephen Paul.

[02:08] Team_045 possession (Score: 97-73)
Tim Sexton attempts a 3Pt. Contested by Giannis Doncic (4.2 feet, MAN). TIM SEXTON MAKES IT! Assist: Julius James
Score: 97-76

[01:52] Team_016 possession (Score: 97-76)
Lamelo Herro drives, John Wagner stays with him. Lamelo Herro attempts a Dunk. Contested by John Wagner (4.1 feet, MAN). LAMELO HERRO MAKES IT! Assist: Immanuel Nowitzki
Score: 99-76

[01:39] Team_045 possession (Score: 99-76)
Julius James drives, Immanuel Nowitzki stays with him. Julius James attempts a Layup. Contested by Immanuel Nowitzki (4.8 feet, MAN). JULIUS JAMES MAKES IT! Assist: John Wagner
Score: 99-78

[01:22] Team_016 possession (Score: 99-78)
Trae Barnes drives, Stephen Paul stays with him. Trae Barnes attempts a Layup. Contested by Stephen Paul (4.3 feet, ZONE). Trae Barnes misses. Rebound secured by Tim Sexton.

[01:08] Team_045 possession (Score: 99-78)
Stephen Paul makes the Dunk and draws the foul on Lamelo Herro! And-1! Stephen Paul to the line for 1. [BONUS: 6 team fouls] (Lamelo Herro: 1 personal fouls)   FT 1/1: GOOD Stephen Paul makes 1/1 from the line.
Score: 99-81

[00:54] Team_016 possession (Score: 99-81)
FOUL! Shooting foul on Julius James. Kevin Butler to the line for 2 free throws. [BONUS: 7 team fouls] (Julius James: 1 personal fouls)   FT 1/2: GOOD   FT 2/2: GOOD Kevin Butler makes 2/2 from the line.
Score: 101-81

[00:38] Team_045 possession (Score: 101-81)
John Wagner attempts a Midrange. Contested by Giannis Doncic (3.9 feet, ZONE). John Wagner misses. Rebound secured by Trae Barnes.

[00:21] Team_016 possession (Score: 101-81)
Giannis Doncic attempts a 3Pt. Contested by Tim Sexton (4.6 feet, MAN). Giannis Doncic misses. Rebound secured by Julius James.

[00:07] Team_045 possession (Score: 101-81)
John Wagner drives, Giannis Doncic stays with him. John Wagner attempts a Layup. Contested by Giannis Doncic (3.9 feet, ZONE). JOHN WAGNER MAKES IT! Assist: Tim Sexton
Score: 101-83

================================================================================
                              4TH QUARTER COMPLETE                              
================================================================================

4TH QUARTER SCORE: Team_016 20, Team_045 27

BOX SCORE:
================================================================================

Team_016
--------------------------------------------------------------------------------
Player                MIN  PTS  REB  AST  TO      FG   FG%      3P   3P%
--------------------------------------------------------------------------------
Lamelo Herro           12    6    1    0   0   3/3   100.0     0/0   0.0
Collin Barnes          36    3    0    1   0   1/1   100.0     0/0   0.0
Vince Quickley         39    3    1    0   0   2/2   100.0     0/0   0.0
Ben Barrett            36    2    3    0   0   1/2    50.0     0/0   0.0
Giannis Ginobili       39    2    0    0   0   1/3    33.3     0/0   0.0
Vince Duncan           36    2    2    0   0   1/1   100.0     0/0   0.0
Kevin Butler           10    2    0    0   0   1/1   100.0     0/0   0.0
Giannis Doncic         12    0    3    1   0   0/2     0.0     0/0   0.0
Trae Barnes            12    0    1    0   0   0/2     0.0     0/0   0.0
Immanuel Nowitzki      10    0    0    1   0   0/1     0.0     0/0   0.0

TEAM: FG: 10/18 (55.6%), 3PT: 1/6 (16.7%), REB: 11 (1 off, 10 def), AST: 3, TO: 3
TEAM FOULS: 6 [Team_045 in BONUS]


Team_045
--------------------------------------------------------------------------------
Player                MIN  PTS  REB  AST  TO      FG   FG%      3P   3P%
--------------------------------------------------------------------------------
Stephen Paul           12    6    2    0   0   2/3    66.7     0/0   0.0
Cole Simons            36    5    1    0   0   2/4    50.0     0/0   0.0
Zion Butler            36    4    1    0   0   2/4    50.0     0/0   0.0
DeMar Turner           39    3    3    1   0   1/2    50.0     0/0   0.0
Tim Sexton             10    3    1    1   0   1/1   100.0     0/0   0.0
John Wagner            10    2    0    2   0   1/4    25.0     0/0   0.0
Julius James           10    2    2    1   0   1/2    50.0     0/0   0.0
Gary Towns             12    2    0    0   0   1/1   100.0     0/0   0.0
Trae Russell           39    0    0    1   0   0/0     0.0     0/0   0.0

TEAM: FG: 11/21 (52.4%), 3PT: 2/6 (33.3%), REB: 10 (2 off, 8 def), AST: 6, TO: 0
TEAM FOULS: 7 [Team_016 in BONUS]

================================================================================

================================================================================
                               FULL GAME COMPLETE                               
================================================================================

FINAL SCORE: Team_016 101, Team_045 83

SCORING BY QUARTER:
--------------------------------------------------------------------------------
Team                     Q1     Q2     Q3     Q4    FINAL
--------------------------------------------------------------------------------
Team_016                 42     26     13     20      101
Team_045                 17     23     16     27       83
--------------------------------------------------------------------------------

FULL GAME BOX SCORE:
================================================================================

Team_016
--------------------------------------------------------------------------------
Player                MIN  PTS  REB  AST  TO      FG   FG%      3P   3P%      FT STL BLK
--------------------------------------------------------------------------------
Giannis Ginobili       39   10    0    0   2   5/8    62.5   1/2    50.0   3/3     1   0
Vince Quickley         39   15    8    3   1   8/16   50.0   2/5    40.0   3/4     0   0
Collin Barnes          36   10    0    3   2   4/14   28.6   2/9    22.2   3/4     0   0
Ben Barrett            36   19   12    3   1   9/14   64.3   1/4    25.0   6/6     1   0
Vince Duncan           36   23   19    3   2   8/10   80.0   1/1   100.0   4/4     0   0
Lamelo Herro           12    8    2    0   0   4/4   100.0   0/0     0.0   4/4     0   0
Giannis Doncic         12    8    5    1   0   3/7    42.9   0/1     0.0   2/2     0   0
Trae Barnes            12    3    3    0   0   1/4    25.0   0/1     0.0   2/3     0   0
Immanuel Nowitzki      10    0    0    2   0   0/2     0.0   0/1     0.0   0/0     0   0
Kevin Butler           10    2    0    1   1   1/2    50.0   0/0     0.0   2/2     0   0

TEAM: FG: 44/82 (53.7%), 3PT: 7/24 (29.2%), REB: 50 (7 off, 43 def), AST: 16, TO: 9


Team_045
--------------------------------------------------------------------------------
Player                MIN  PTS  REB  AST  TO      FG   FG%      3P   3P%      FT STL BLK
--------------------------------------------------------------------------------
Rudy Antetokounmpo     39    6    0    1   2   5/17   29.4   1/5    20.0   2/2     0   0
Trae Russell           39    7    0    2   3   4/8    50.0   0/4     0.0   3/3     0   0
DeMar Turner           39   14   14    2   1   5/9    55.6   0/2     0.0   4/4     0   1
Cole Simons            36   16    8    1   2   6/14   42.9   4/10   40.0   1/2     1   0
Zion Butler            36   12   10    1   1   4/10   40.0   0/3     0.0   2/2     1   1
Gary Towns             12    6    1    0   0   2/4    50.0   0/2     0.0   2/2     0   0
Stephen Paul           12    8    5    0   1   3/4    75.0   0/0     0.0   4/4     1   0
John Wagner            10    2    0    2   0   2/5    40.0   0/2     0.0   0/0     0   0
Julius James           10    4    4    1   0   2/4    50.0   0/1     0.0   2/2     0   0
Tim Sexton             10    7    3    1   0   3/3   100.0   1/1   100.0   2/2     0   0

TEAM: FG: 36/79 (45.6%), 3PT: 6/30 (20.0%), REB: 44 (7 off, 37 def), AST: 11, TO: 10

================================================================================
