================================================================================
                        FULL GAME - Team_003 vs Team_028                        
================================================================================

================================================================================
                       1ST QUARTER - Team_003 vs Team_028                       
================================================================================

[12:00] Team_003 possession (Score: 0-0)
Ayo Jackson drives and kicks out. Victor O'Neal attempts a 3Pt. Contested by Jimmy Brogdon (4.2 feet, MAN). Victor O'Neal misses. Rebound secured by Jimmy Brogdon.

[11:42] Team_028 possession (Score: 0-0)
Kawhi Ball attempts a Dunk. BLOCKED BY GIANNIS TURNER! Ball is loose! Rebound secured by Rudy Haliburton.

[11:25] Team_003 possession (Score: 0-0)
Victor O'Neal drives and kicks out. Nikola Bryant attempts a Midrange. Contested by Carmelo Carter (4.4 feet, MAN). Nikola Bryant misses. Offensive rebound by Rudy Haliburton! Rudy Haliburton's putback is no good. Rebound secured by Jimmy Brogdon.

[11:13] Team_028 possession (Score: 0-0)
Carmelo Carter attempts a 3Pt. Contested by Ayo Jackson (5.6 feet, ZONE). CARMELO CARTER MAKES IT! Assist: Jimmy Brogdon
Score: 0-3

[10:58] Team_003 possession (Score: 0-3)
Nikola Bryant attempts a 3Pt. Contested by Carmelo Carter (4.7 feet, MAN). Nikola Bryant misses. Rebound secured by Carmelo Carter.

[10:46] Team_028 possession (Score: 0-3)
Myles Haliburton makes the Midrange and draws the foul on Rudy Haliburton! And-1! Myles Haliburton to the line for 1. [Team fouls: 1] (Rudy Haliburton: 1 personal fouls)   FT 1/1: GOOD Myles Haliburton makes 1/1 from the line.
Score: 0-6

[10:34] Team_003 possession (Score: 0-6)
Giannis Turner drives to the basket... FOUL! Offensive foul on Giannis Turner! Kawhi Ball drew the charge! [Team fouls: 2] (Giannis Turner: 1 personal fouls) TURNOVER! (dead ball)

[10:21] Team_028 possession (Score: 0-6)
Austin Russell attempts a Layup. Contested by Giannis Turner (2.7 feet, ZONE). Austin Russell misses. Rebound secured by Giannis Turner.

[10:10] Team_003 possession (Score: 0-6)
Ayo Jackson attempts a Midrange. Contested by Austin Russell (4.7 feet, MAN). AYO JACKSON MAKES IT!
Score: 2-6

[09:57] Team_028 possession (Score: 2-6)
Austin Russell attempts a Layup. Contested by Giannis Turner (2.7 feet, ZONE). AUSTIN RUSSELL MAKES IT!
Score: 2-8

[09:39] Team_003 possession (Score: 2-8)
Giannis Turner throws a bad pass! Stolen by Kawhi Ball! TURNOVER! (live ball)

[09:23] Team_028 possession (Score: 2-8)
Jimmy Brogdon drives, Giannis Turner stays with him. Jimmy Brogdon attempts a Layup. Contested by Giannis Turner (3.3 feet, ZONE). JIMMY BROGDON MAKES IT! Assist: Myles Haliburton
Score: 2-10

[09:10] Team_003 possession (Score: 2-10)
Victor O'Neal drives, picks up Jimmy Brogdon. Help arrives from Carmelo Carter! Victor O'Neal attempts a Dunk. Contested by Carmelo Carter (4.2 feet, MAN). VICTOR O'NEAL MAKES IT! Assist: Rudy Haliburton
Score: 4-10

[08:51] Team_028 possession (Score: 4-10)
Jimmy Brogdon attempts a 3Pt. Contested by Giannis Turner (3.3 feet, ZONE). Jimmy Brogdon misses. Rebound secured by Rudy Haliburton.

[08:37] Team_003 possession (Score: 4-10)
Rudy Haliburton drives, picks up Kawhi Ball. Help arrives from Carmelo Carter! Rudy Haliburton attempts a Layup. Contested by Carmelo Carter (4.3 feet, ZONE). RUDY HALIBURTON MAKES IT!
Score: 6-10

[08:20] Team_028 possession (Score: 6-10)
Carmelo Carter makes the Layup and draws the foul on Nikola Bryant! And-1! Carmelo Carter to the line for 1. [Team fouls: 3] (Nikola Bryant: 1 personal fouls)   FT 1/1: GOOD Carmelo Carter makes 1/1 from the line.
Score: 6-13

[08:07] Team_003 possession (Score: 6-13)
Victor O'Neal drives to the basket... Victor O'Neal throws a bad pass! Stolen by Jimmy Brogdon! TURNOVER! (live ball)

[07:54] Team_028 possession (Score: 6-13)
Jimmy Brogdon drives, Giannis Turner stays with him. Jimmy Brogdon attempts a Dunk. Contested by Giannis Turner (3.3 feet, ZONE). JIMMY BROGDON MAKES IT! Assist: Kawhi Ball
Score: 6-15

[07:40] Team_003 possession (Score: 6-15)
Victor O'Neal drives to the basket... FOUL! Offensive foul on Victor O'Neal! Kawhi Ball drew the charge! [Team fouls: 4] (Victor O'Neal: 1 personal fouls) TURNOVER! (dead ball)

[07:26] Team_028 possession (Score: 6-15)
Myles Haliburton makes the 3Pt and draws the foul on Giannis Turner! And-1! Myles Haliburton to the line for 1. [BONUS: 5 team fouls] (Giannis Turner: 2 personal fouls)   FT 1/1: MISS Myles Haliburton makes 0/1 from the line. Rebound secured by Victor O'Neal.
Score: 6-18

[07:12] Team_003 possession (Score: 6-18)
Nikola Bryant drives to the basket... Nikola Bryant loses control! Ball rolls out of bounds! TURNOVER! (dead ball)

[06:58] Team_028 possession (Score: 6-18)
Myles Haliburton drives to the basket... Myles Haliburton loses the ball! Stripped by Giannis Turner! TURNOVER! (live ball)

[06:47] Team_003 possession (Score: 6-18)
FOUL! Shooting foul on Myles Haliburton. Rudy Haliburton to the line for 2 free throws. [Team fouls: 1] (Myles Haliburton: 1 personal fouls)   FT 1/2: GOOD   FT 2/2: GOOD Rudy Haliburton makes 2/2 from the line.
Score: 8-18

[06:32] Team_028 possession (Score: 8-18)
Jimmy Brogdon attempts a Midrange. Contested by Giannis Turner (3.3 feet, MAN). JIMMY BROGDON MAKES IT! Assist: Kawhi Ball
Score: 8-20

[06:18] Team_003 possession (Score: 8-20)
Ayo Jackson makes the Dunk and draws the foul on Austin Russell! And-1! Ayo Jackson to the line for 1. [Team fouls: 2] (Austin Russell: 1 personal fouls)   FT 1/1: MISS Ayo Jackson makes 0/1 from the line. Offensive rebound by Victor O'Neal! Victor O'Neal kicks it out.
Score: 10-20

[06:08] Team_003 possession (Score: 10-20)
Victor O'Neal attempts a Midrange. Contested by Myles Haliburton (3.6 feet, ZONE). VICTOR O'NEAL MAKES IT! Assist: Rudy Haliburton
Score: 12-20

[05:53] Team_028 possession (Score: 12-20)
Myles Haliburton attempts a Layup. Contested by Rudy Haliburton (3.4 feet, MAN). Myles Haliburton misses. Rebound secured by Rudy Haliburton.

[05:40] Team_003 possession (Score: 12-20)
Rudy Haliburton attempts a Layup. Contested by Kawhi Ball (4.3 feet, ZONE). RUDY HALIBURTON MAKES IT! Assist: Ayo Jackson
Score: 14-20

[05:31] Team_028 possession (Score: 14-20)
FOUL! Reach-in foul on Giannis Turner during the drive. [IN THE BONUS! 6 team fouls] Austin Russell to the line for 2 free throws. (Giannis Turner: 3 personal fouls)   FT 1/2: GOOD   FT 2/2: GOOD Austin Russell makes 2/2 from the line.
Score: 14-22

[05:19] Team_003 possession (Score: 14-22)
Ayo Jackson attempts a Layup. Contested by Jimmy Brogdon (4.6 feet, ZONE). AYO JACKSON MAKES IT!
Score: 16-22

[05:05] Team_028 possession (Score: 16-22)
FOUL! Holding foul on Giannis Turner. [IN THE BONUS! 7 team fouls] Kawhi Ball to the line for 2 free throws. (Giannis Turner: 4 personal fouls)   FT 1/2: GOOD   FT 2/2: GOOD Kawhi Ball makes 2/2 from the line.
Score: 16-24

[04:51] Team_003 possession (Score: 16-24)
Giannis Turner drives to the basket... Giannis Turner throws a bad pass out of bounds! TURNOVER! (dead ball)

[04:37] Team_028 possession (Score: 16-24)
Austin Russell attempts a Midrange. Contested by Ayo Jackson (5.2 feet, MAN). Austin Russell misses. Rebound secured by Giannis Turner.

[04:22] Team_003 possession (Score: 16-24)
Giannis Turner attempts a 3Pt. Contested by Carmelo Carter (4.8 feet, ZONE). GIANNIS TURNER MAKES IT! Assist: Rudy Haliburton
Score: 19-24

[04:10] Team_028 possession (Score: 19-24)
Austin Russell attempts a Midrange. Contested by Giannis Turner (2.8 feet, ZONE). Austin Russell misses. Rebound secured by Victor O'Neal.

[03:57] Team_003 possession (Score: 19-24)
Ayo Jackson attempts a 3Pt. Contested by Austin Russell (4.8 feet, MAN). Ayo Jackson misses. Rebound secured by Carmelo Carter.

[03:41] Team_028 possession (Score: 19-24)
Carmelo Carter attempts a 3Pt. Contested by Nikola Bryant (4.5 feet, MAN). Carmelo Carter misses. Offensive rebound by Kawhi Ball! Kawhi Ball kicks it out.

[03:29] Team_028 possession (Score: 19-24)
FOUL! Offensive foul on Carmelo Carter! Nikola Bryant drew the charge! [Team fouls: 3] (Carmelo Carter: 1 personal fouls) TURNOVER! (dead ball)

[03:14] Team_003 possession (Score: 19-24)
Victor O'Neal attempts a Layup. Contested by Kawhi Ball (4.4 feet, ZONE). Victor O'Neal misses. Rebound secured by Kawhi Ball.

[02:59] Team_028 possession (Score: 19-24)
Kawhi Ball drives to the basket... Kawhi Ball throws a bad pass! Stolen by Giannis Turner! TURNOVER! (live ball)

[02:42] Team_003 possession (Score: 19-24)
Rudy Haliburton attempts a Layup. Contested by Myles Haliburton (3.9 feet, MAN). RUDY HALIBURTON MAKES IT! Assist: Nikola Bryant
Score: 21-24

[02:28] Team_028 possession (Score: 21-24)
Carmelo Carter makes the Midrange and draws the foul on Nikola Bryant! And-1! Carmelo Carter to the line for 1. [BONUS: 8 team fouls] (Nikola Bryant: 2 personal fouls)   FT 1/1: GOOD Carmelo Carter makes 1/1 from the line.
Score: 21-27

[02:17] Team_003 possession (Score: 21-27)
Ayo Jackson attempts a 3Pt. Contested by Austin Russell (5.0 feet, MAN). Ayo Jackson misses. Rebound secured by Kawhi Ball.

[02:04] Team_028 possession (Score: 21-27)
Kawhi Ball attempts a Midrange. Contested by Giannis Turner (3.3 feet, MAN). KAWHI BALL MAKES IT!
Score: 21-29

[01:47] Team_003 possession (Score: 21-29)
Victor O'Neal attempts a 3Pt. Contested by Carmelo Carter (4.7 feet, ZONE). Victor O'Neal misses. FOUL! Loose ball foul on Kawhi Ball during the rebound battle. [Team fouls: 4] No free throws, side out. (Kawhi Ball: 1 personal fouls)

[01:35] Team_003 possession (Score: 21-29)
Ayo Jackson attempts a Layup. Contested by Kawhi Ball (5.0 feet, ZONE). Ayo Jackson misses. Rebound secured by Carmelo Carter.

[01:24] Team_028 possession (Score: 21-29)
Myles Haliburton attempts a Midrange. Contested by Rudy Haliburton (3.7 feet, MAN). MYLES HALIBURTON MAKES IT!
Score: 21-31

[01:15] Team_003 possession (Score: 21-31)
FOUL! Shooting foul on Kawhi Ball. Ayo Jackson to the line for 2 free throws. [BONUS: 5 team fouls] (Kawhi Ball: 2 personal fouls)   FT 1/2: MISS   FT 2/2: GOOD Ayo Jackson makes 1/2 from the line.
Score: 22-31

[01:03] Team_028 possession (Score: 22-31)
Myles Haliburton drives, Giannis Turner stays with him. Myles Haliburton attempts a Dunk. Contested by Giannis Turner (3.4 feet, ZONE). Myles Haliburton misses. Rebound secured by Giannis Turner.

[00:52] Team_003 possession (Score: 22-31)
Victor O'Neal drives, Jimmy Brogdon stays with him. Victor O'Neal attempts a Layup. Contested by Jimmy Brogdon (4.8 feet, MAN). VICTOR O'NEAL MAKES IT! Assist: Giannis Turner
Score: 24-31

[00:35] Team_028 possession (Score: 24-31)
FOUL! Shooting foul on Giannis Turner. Jimmy Brogdon to the line for 2 free throws. [BONUS: 9 team fouls] (Giannis Turner: 5 personal fouls)   FT 1/2: GOOD   FT 2/2: GOOD Jimmy Brogdon makes 2/2 from the line.
Score: 24-33

[00:21] Team_003 possession (Score: 24-33)
Victor O'Neal attempts a 3Pt. Contested by Jimmy Brogdon (4.9 feet, MAN). Victor O'Neal misses. Rebound secured by Kawhi Ball.

[00:10] Team_028 possession (Score: 24-33)
Myles Haliburton attempts a 3Pt. Contested by Giannis Turner (3.6 feet, ZONE). Myles Haliburton misses. Rebound secured by Giannis Turner.

================================================================================
                              1ST QUARTER COMPLETE                              
================================================================================

1ST QUARTER SCORE: Team_003 24, Team_028 33

BOX SCORE:
================================================================================

Team_003
--------------------------------------------------------------------------------
Player                MIN  PTS  REB  AST  TO      FG   FG%      3P   3P%
--------------------------------------------------------------------------------
Rudy Haliburton        12    8    4    3   0   4/4   100.0     0/0   0.0
Victor O'Neal          12    6    3    0   0   3/6    50.0     0/0   0.0
Ayo Jackson            12    5    0    1   0   3/7    42.9     0/0   0.0
Giannis Turner         12    3    4    1   0   1/1   100.0     0/0   0.0
Nikola Bryant          12    0    0    1   0   0/1     0.0     0/0   0.0

TEAM: FG: 11/19 (57.9%), 3PT: 1/5 (20.0%), REB: 12 (3 off, 9 def), AST: 6, TO: 6
TEAM FOULS: 9 [Team_028 in BONUS]


Team_028
--------------------------------------------------------------------------------
Player                MIN  PTS  REB  AST  TO      FG   FG%      3P   3P%
--------------------------------------------------------------------------------
Carmelo Carter         12    9    3    0   0   3/3   100.0     0/0   0.0
Jimmy Brogdon          12    8    2    1   0   4/5    80.0     0/0   0.0
Myles Haliburton       12    5    0    1   0   2/6    33.3     0/0   0.0
Kawhi Ball             12    4    4    2   0   2/3    66.7     0/0   0.0
Austin Russell         12    4    0    0   0   2/5    40.0     0/0   0.0

TEAM: FG: 13/22 (59.1%), 3PT: 1/4 (25.0%), REB: 8 (1 off, 7 def), AST: 4, TO: 3
TEAM FOULS: 5 [Team_003 in BONUS]

================================================================================

================================================================================
                       2ND QUARTER - Team_003 vs Team_028                       
================================================================================

[12:00] Substitution (Team_003): Ayo Jackson OUT → Miles Towns IN (stamina_rule2)

[12:00] Substitution (Team_003): Nikola Bryant OUT → Pau Williamson IN (stamina_rule2)

[12:00] Substitution (Team_003): Rudy Haliburton OUT → Collin Mitchell IN (stamina_rule2)

[12:00] Substitution (Team_003): Giannis Turner OUT → Anfernee Jordan IN (stamina_rule2)

[12:00] Substitution (Team_003): Victor O'Neal OUT → Bam Gilgeous-Alexander IN (stamina_rule2)

[12:00] Substitution (Team_028): Austin Russell OUT → Scottie Ingram IN (stamina_rule2)

[12:00] Substitution (Team_028): Carmelo Carter OUT → Tyrese Quickley IN (stamina_rule2)

[12:00] Substitution (Team_028): Myles Haliburton OUT → Miles Booker IN (stamina_rule2)

[12:00] Substitution (Team_028): Kawhi Ball OUT → Bam Towns IN (stamina_rule2)

[12:00] Substitution (Team_028): Jimmy Brogdon OUT → Collin Bridges IN (stamina_rule2)

[12:00] Team_003 possession (Score: 24-33)
Victor O'Neal drives to the basket... Victor O'Neal loses control! Ball rolls out of bounds! TURNOVER! (dead ball)

[11:48] Team_028 possession (Score: 24-33)
Scottie Ingram drives to the basket... Scottie Ingram throws a bad pass! Stolen by Miles Towns! TURNOVER! (live ball)

[11:35] Team_003 possession (Score: 24-33)
Pau Williamson attempts a 3Pt. Contested by Scottie Ingram (5.4 feet, ZONE). PAU WILLIAMSON MAKES IT! Assist: Miles Towns
Score: 27-33

[11:22] Team_028 possession (Score: 27-33)
FOUL! Shooting foul on Bam Gilgeous-Alexander. Scottie Ingram to the line for 2 free throws. [Team fouls: 1] (Bam Gilgeous-Alexander: 1 personal fouls)   FT 1/2: GOOD   FT 2/2: GOOD Scottie Ingram makes 2/2 from the line.
Score: 27-35

[11:09] Team_003 possession (Score: 27-35)
Miles Towns attempts a 3Pt. Contested by Scottie Ingram (5.4 feet, ZONE). Miles Towns misses. Offensive rebound by Bam Gilgeous-Alexander! Bam Gilgeous-Alexander puts it back in!
Score: 29-35

[10:56] Team_028 possession (Score: 29-35)
Miles Booker attempts a Layup. Contested by Bam Gilgeous-Alexander (2.9 feet, ZONE). Miles Booker misses. Rebound secured by Anfernee Jordan.

[10:45] Team_003 possession (Score: 29-35)
Pau Williamson attempts a 3Pt. Contested by Tyrese Quickley (4.3 feet, ZONE). Pau Williamson misses. Rebound secured by Tyrese Quickley.

[10:34] Team_028 possession (Score: 29-35)
Collin Bridges attempts a Midrange. Contested by Bam Gilgeous-Alexander (3.2 feet, MAN). COLLIN BRIDGES MAKES IT!
Score: 29-37

[10:20] Team_003 possession (Score: 29-37)
Collin Mitchell attempts a Midrange. Contested by Scottie Ingram (5.7 feet, ZONE). Collin Mitchell misses. Offensive rebound by Collin Mitchell! Collin Mitchell kicks it out.

[10:02] Team_003 possession (Score: 29-37)
Bam Gilgeous-Alexander attempts a 3Pt. Wide open! Scottie Ingram is 6.2 feet away. [ZONE] BAM GILGEOUS-ALEXANDER MAKES IT! Assist: Miles Towns
Score: 32-37

[09:48] Team_028 possession (Score: 32-37)
FOUL! Reach-in foul on Bam Gilgeous-Alexander during the drive. [Team fouls: 2] No free throws, side out. (Bam Gilgeous-Alexander: 2 personal fouls)

[09:35] Team_028 possession (Score: 32-37)
Tyrese Quickley commits a violation (traveling/carry)! TURNOVER! (dead ball)

[09:21] Team_003 possession (Score: 32-37)
Bam Gilgeous-Alexander attempts a Midrange. Contested by Collin Bridges (4.5 feet, MAN). Bam Gilgeous-Alexander misses. Rebound secured by Collin Bridges.

[09:06] Team_028 possession (Score: 32-37)
Tyrese Quickley attempts a Layup. BLOCKED BY COLLIN MITCHELL! Ball is loose! Rebound secured by Bam Gilgeous-Alexander.

[08:51] Team_003 possession (Score: 32-37)
Miles Towns attempts a Layup. BLOCKED BY SCOTTIE INGRAM! Ball is loose! Offensive rebound by Collin Mitchell! Collin Mitchell kicks it out.

[08:38] Team_003 possession (Score: 32-37)
Pau Williamson drives, Tyrese Quickley stays with him. Pau Williamson attempts a Layup. Contested by Tyrese Quickley (4.3 feet, MAN). Pau Williamson misses. FOUL! Loose ball foul on Collin Bridges during the rebound battle. [Team fouls: 1] No free throws, side out. (Collin Bridges: 1 personal fouls)

[08:21] Team_003 possession (Score: 32-37)
Anfernee Jordan drives to the basket... Anfernee Jordan loses the ball! Stripped by Collin Bridges! TURNOVER! (live ball)

[08:04] Team_028 possession (Score: 32-37)
Miles Booker attempts a Layup. Contested by Collin Mitchell (4.0 feet, MAN). MILES BOOKER MAKES IT!
Score: 32-39

[07:48] Team_003 possession (Score: 32-39)
Anfernee Jordan loses the ball! Stripped by Collin Bridges! TURNOVER! (live ball)

[07:30] Team_028 possession (Score: 32-39)
Tyrese Quickley attempts a Midrange. Contested by Pau Williamson (5.3 feet, MAN). TYRESE QUICKLEY MAKES IT! Assist: Scottie Ingram
Score: 32-41

[07:16] Team_003 possession (Score: 32-41)
Collin Mitchell drives and kicks out. Anfernee Jordan attempts a Midrange. Contested by Collin Bridges (3.8 feet, MAN). Anfernee Jordan misses. Rebound secured by Collin Bridges.

[07:03] Team_028 possession (Score: 32-41)
Miles Booker drives, Collin Mitchell stays with him. Miles Booker attempts a Dunk. Contested by Collin Mitchell (4.0 feet, MAN). Miles Booker misses. Rebound secured by Anfernee Jordan.

[06:46] Team_003 possession (Score: 32-41)
Bam Gilgeous-Alexander attempts a Layup. Contested by Collin Bridges (4.5 feet, ZONE). BAM GILGEOUS-ALEXANDER MAKES IT! Assist: Pau Williamson
Score: 34-41

[06:31] Team_028 possession (Score: 34-41)
Collin Bridges attempts a Midrange. Contested by Bam Gilgeous-Alexander (3.2 feet, MAN). Collin Bridges misses. Rebound secured by Bam Gilgeous-Alexander.

[06:14] Team_003 possession (Score: 34-41)
Miles Towns drives and kicks out. Collin Mitchell attempts a 3Pt. Contested by Scottie Ingram (5.5 feet, ZONE). COLLIN MITCHELL MAKES IT!
Score: 37-41

[05:59] Team_028 possession (Score: 37-41)
Bam Towns makes the Layup and draws the foul on Anfernee Jordan! And-1! Bam Towns to the line for 1. [Team fouls: 3] (Anfernee Jordan: 1 personal fouls)   FT 1/1: GOOD Bam Towns makes 1/1 from the line.
Score: 37-44

[05:42] Team_003 possession (Score: 37-44)
Anfernee Jordan attempts a Layup. Contested by Collin Bridges (3.6 feet, MAN). Anfernee Jordan misses. Offensive rebound by Bam Gilgeous-Alexander! Bam Gilgeous-Alexander puts it back in!
Score: 39-44

[05:27] Team_028 possession (Score: 39-44)
Scottie Ingram attempts a Layup. BLOCKED BY BAM GILGEOUS-ALEXANDER! Ball is loose! Rebound secured by Anfernee Jordan.

[05:11] Team_003 possession (Score: 39-44)
Miles Towns drives and kicks out. Anfernee Jordan attempts a Midrange. Contested by Bam Towns (5.1 feet, ZONE). ANFERNEE JORDAN MAKES IT! Assist: Pau Williamson
Score: 41-44

[04:55] Team_028 possession (Score: 41-44)
Bam Towns attempts a Layup. Contested by Bam Gilgeous-Alexander (3.0 feet, MAN). BAM TOWNS MAKES IT! Assist: Scottie Ingram
Score: 41-46

[04:41] Team_003 possession (Score: 41-46)
Collin Mitchell attempts a 3Pt. Wide open! Miles Booker is 6.2 feet away. [MAN] Collin Mitchell misses. Rebound secured by Bam Towns.

[04:28] Team_028 possession (Score: 41-46)
Collin Bridges makes the Layup and draws the foul on Bam Gilgeous-Alexander! And-1! Collin Bridges to the line for 1. [Team fouls: 4] (Bam Gilgeous-Alexander: 3 personal fouls)   FT 1/1: MISS Collin Bridges makes 0/1 from the line. Rebound secured by Bam Gilgeous-Alexander.
Score: 41-48

[04:11] Team_003 possession (Score: 41-48)
FOUL! Shooting foul on Tyrese Quickley. Anfernee Jordan to the line for 2 free throws. [Team fouls: 2] (Tyrese Quickley: 1 personal fouls)   FT 1/2: GOOD   FT 2/2: GOOD Anfernee Jordan makes 2/2 from the line.
Score: 43-48

[03:58] Team_028 possession (Score: 43-48)
Miles Booker attempts a 3Pt. Contested by Collin Mitchell (4.0 feet, MAN). Miles Booker misses. Rebound secured by Anfernee Jordan.

[03:44] Team_003 possession (Score: 43-48)
Collin Mitchell attempts a 3Pt. Wide open! Miles Booker is 6.2 feet away. [MAN] Collin Mitchell misses. Rebound secured by Tyrese Quickley.

[03:31] Team_028 possession (Score: 43-48)
Scottie Ingram attempts a Layup. Contested by Miles Towns (5.3 feet, MAN). SCOTTIE INGRAM MAKES IT! Assist: Collin Bridges
Score: 43-50

[03:15] Team_003 possession (Score: 43-50)
Bam Gilgeous-Alexander makes the Layup and draws the foul on Collin Bridges! And-1! Bam Gilgeous-Alexander to the line for 1. [Team fouls: 3] (Collin Bridges: 2 personal fouls)   FT 1/1: GOOD Bam Gilgeous-Alexander makes 1/1 from the line.
Score: 46-50

[03:01] Team_028 possession (Score: 46-50)
Bam Towns drives, Bam Gilgeous-Alexander stays with him. Bam Towns attempts a Layup. Contested by Bam Gilgeous-Alexander (3.2 feet, MAN). Bam Towns misses. Rebound secured by Collin Mitchell.

[02:49] Team_003 possession (Score: 46-50)
Pau Williamson attempts a 3Pt. Contested by Scottie Ingram (5.6 feet, ZONE). PAU WILLIAMSON MAKES IT! Assist: Collin Mitchell
Score: 49-50

[02:33] Team_028 possession (Score: 49-50)
FOUL! Shooting foul on Collin Mitchell. Miles Booker to the line for 2 free throws. [BONUS: 5 team fouls] (Collin Mitchell: 1 personal fouls)   FT 1/2: GOOD   FT 2/2: GOOD Miles Booker makes 2/2 from the line.
Score: 49-52

[02:18] Team_003 possession (Score: 49-52)
Bam Gilgeous-Alexander attempts a Midrange. Contested by Collin Bridges (4.8 feet, MAN). Bam Gilgeous-Alexander misses. Rebound secured by Bam Towns.

[02:07] Team_028 possession (Score: 49-52)
Collin Bridges attempts a Layup. Contested by Bam Gilgeous-Alexander (3.5 feet, ZONE). COLLIN BRIDGES MAKES IT! Assist: Tyrese Quickley
Score: 49-54

[01:52] Team_003 possession (Score: 49-54)
Pau Williamson drives and kicks out. Collin Mitchell attempts a 3Pt. Contested by Scottie Ingram (5.8 feet, ZONE). Collin Mitchell misses. Rebound secured by Tyrese Quickley.

[01:36] Team_028 possession (Score: 49-54)
Tyrese Quickley drives to the basket... Tyrese Quickley throws a bad pass out of bounds! TURNOVER! (dead ball)

[01:24] Team_003 possession (Score: 49-54)
Anfernee Jordan attempts a Layup. Contested by Collin Bridges (4.1 feet, MAN). Anfernee Jordan misses. Rebound secured by Collin Bridges.

[01:08] Team_028 possession (Score: 49-54)
Scottie Ingram drives, Miles Towns stays with him. Scottie Ingram attempts a Layup. Contested by Miles Towns (5.5 feet, MAN). SCOTTIE INGRAM MAKES IT! Assist: Collin Bridges
Score: 49-56

[00:55] Team_003 possession (Score: 49-56)
Bam Gilgeous-Alexander attempts a Midrange. Contested by Collin Bridges (4.9 feet, MAN). Bam Gilgeous-Alexander misses. Rebound secured by Tyrese Quickley.

[00:40] Team_028 possession (Score: 49-56)
Scottie Ingram attempts a 3Pt. Contested by Miles Towns (5.5 feet, ZONE). Scottie Ingram misses. Rebound secured by Anfernee Jordan.

[00:27] Team_003 possession (Score: 49-56)
FOUL! Shooting foul on Collin Bridges. Bam Gilgeous-Alexander to the line for 2 free throws. [Team fouls: 4] (Collin Bridges: 3 personal fouls)   FT 1/2: GOOD   FT 2/2: GOOD Bam Gilgeous-Alexander makes 2/2 from the line.
Score: 51-56

[00:10] Team_028 possession (Score: 51-56)
Tyrese Quickley drives, Pau Williamson stays with him. Tyrese Quickley attempts a Layup. Contested by Pau Williamson (5.7 feet, MAN). Tyrese Quickley misses. Rebound secured by Bam Gilgeous-Alexander.

================================================================================
                              2ND QUARTER COMPLETE                              
================================================================================

2ND QUARTER SCORE: Team_003 27, Team_028 23

BOX SCORE:
================================================================================

Team_003
--------------------------------------------------------------------------------
Player                MIN  PTS  REB  AST  TO      FG   FG%      3P   3P%
--------------------------------------------------------------------------------
Bam Gilgeous-Alexander   12   14    7    0   0   6/9    66.7     0/0   0.0
Pau Williamson         12    6    0    2   0   2/4    50.0     0/0   0.0
Anfernee Jordan        12    4    5    0   0   2/3    66.7     0/0   0.0
Collin Mitchell        12    3    3    1   0   1/4    25.0     0/0   0.0
Miles Towns            12    0    0    2   0   0/0     0.0     0/0   0.0

TEAM: FG: 11/20 (55.0%), 3PT: 4/7 (57.1%), REB: 15 (5 off, 10 def), AST: 5, TO: 3
TEAM FOULS: 5 [Team_028 in BONUS]


Team_028
--------------------------------------------------------------------------------
Player                MIN  PTS  REB  AST  TO      FG   FG%      3P   3P%
--------------------------------------------------------------------------------
Scottie Ingram         12    6    0    2   0   3/5    60.0     0/0   0.0
Bam Towns              12    5    2    0   0   2/3    66.7     0/0   0.0
Miles Booker           12    4    0    0   0   2/5    40.0     0/0   0.0
Collin Bridges         12    4    3    2   0   2/4    50.0     0/0   0.0
Tyrese Quickley        12    2    4    1   0   1/3    33.3     0/0   0.0

TEAM: FG: 10/20 (50.0%), 3PT: 0/2 (0.0%), REB: 9 (0 off, 9 def), AST: 5, TO: 3
TEAM FOULS: 4

================================================================================

================================================================================
                       3RD QUARTER - Team_003 vs Team_028                       
================================================================================

[12:00] Team_003 possession (Score: 51-56)
Giannis Turner makes the Layup and draws the foul on Kawhi Ball! And-1! Giannis Turner to the line for 1. [Team fouls: 1] (Kawhi Ball: 1 personal fouls)   FT 1/1: MISS Giannis Turner makes 0/1 from the line. Rebound secured by Jimmy Brogdon.
Score: 53-56

[11:43] Team_028 possession (Score: 53-56)
Kawhi Ball attempts a Midrange. Contested by Giannis Turner (3.0 feet, MAN). KAWHI BALL MAKES IT! Assist: Myles Haliburton
Score: 53-58

[11:26] Team_003 possession (Score: 53-58)
FOUL! Offensive foul on Ayo Jackson! Austin Russell drew the charge! [Team fouls: 1] (Ayo Jackson: 1 personal fouls) TURNOVER! (dead ball)

[11:12] Team_028 possession (Score: 53-58)
FOUL! Holding foul on Rudy Haliburton. [Team fouls: 2] No free throws, side out. (Rudy Haliburton: 1 personal fouls)

[10:54] Team_028 possession (Score: 53-58)
Carmelo Carter attempts a 3Pt. Contested by Nikola Bryant (4.3 feet, MAN). Carmelo Carter misses. Rebound secured by Giannis Turner.

[10:40] Team_003 possession (Score: 53-58)
Rudy Haliburton attempts a 3Pt. Contested by Austin Russell (4.5 feet, ZONE). Rudy Haliburton misses. Rebound secured by Kawhi Ball.

[10:28] Team_028 possession (Score: 53-58)
Kawhi Ball drives, Victor O'Neal stays with him. Kawhi Ball attempts a Dunk. Contested by Victor O'Neal (4.4 feet, ZONE). KAWHI BALL MAKES IT!
Score: 53-60

[10:13] Team_003 possession (Score: 53-60)
Rudy Haliburton attempts a 3Pt. Contested by Myles Haliburton (3.7 feet, MAN). Rudy Haliburton misses. Offensive rebound by Rudy Haliburton! Rudy Haliburton's putback is no good. Rebound secured by Kawhi Ball.

[10:02] Team_028 possession (Score: 53-60)
Myles Haliburton makes the Midrange and draws the foul on Victor O'Neal! And-1! Myles Haliburton to the line for 1. [Team fouls: 3] (Victor O'Neal: 1 personal fouls)   FT 1/1: GOOD Myles Haliburton makes 1/1 from the line.
Score: 53-63

[09:48] Team_003 possession (Score: 53-63)
Nikola Bryant attempts a Midrange. Contested by Carmelo Carter (4.7 feet, MAN). Nikola Bryant misses. Rebound secured by Kawhi Ball.

[09:33] Team_028 possession (Score: 53-63)
Jimmy Brogdon drives and kicks out. Jimmy Brogdon attempts a 3Pt. Contested by Giannis Turner (2.8 feet, MAN). JIMMY BROGDON MAKES IT! Assist: Austin Russell
Score: 53-66

[09:15] Team_003 possession (Score: 53-66)
Nikola Bryant attempts a 3Pt. Contested by Austin Russell (4.7 feet, ZONE). Nikola Bryant misses. Offensive rebound by Victor O'Neal! Victor O'Neal kicks it out.

[09:00] Team_003 possession (Score: 53-66)
Nikola Bryant attempts a 3Pt. Contested by Carmelo Carter (4.7 feet, MAN). Nikola Bryant misses. Rebound secured by Kawhi Ball.

[08:46] Team_028 possession (Score: 53-66)
Kawhi Ball drives and kicks out. Myles Haliburton attempts a 3Pt. Contested by Giannis Turner (2.8 feet, ZONE). Myles Haliburton misses. FOUL! Loose ball foul on Rudy Haliburton during the rebound battle. [Team fouls: 4] No free throws, side out. (Rudy Haliburton: 2 personal fouls)

[08:28] Team_028 possession (Score: 53-66)
FOUL! Reach-in foul on Giannis Turner during the drive. [IN THE BONUS! 5 team fouls] Carmelo Carter to the line for 2 free throws. (Giannis Turner: 1 personal fouls)   FT 1/2: GOOD   FT 2/2: GOOD Carmelo Carter makes 2/2 from the line.
Score: 53-68

[08:15] Team_003 possession (Score: 53-68)
Giannis Turner drives, Kawhi Ball stays with him. Giannis Turner attempts a Layup. Contested by Kawhi Ball (4.5 feet, MAN). Giannis Turner misses. Rebound secured by Carmelo Carter.

[08:00] Team_028 possession (Score: 53-68)
Carmelo Carter drives and kicks out. Jimmy Brogdon attempts a Midrange. Contested by Giannis Turner (2.8 feet, MAN). Jimmy Brogdon misses. Rebound secured by Giannis Turner.

[07:42] Team_003 possession (Score: 53-68)
Victor O'Neal drives to the basket... Victor O'Neal commits a violation (traveling/carry)! TURNOVER! (dead ball)

[07:29] Team_028 possession (Score: 53-68)
FOUL! Shooting foul on Giannis Turner. Jimmy Brogdon to the line for 2 free throws. [BONUS: 6 team fouls] (Giannis Turner: 2 personal fouls)   FT 1/2: GOOD   FT 2/2: GOOD Jimmy Brogdon makes 2/2 from the line.
Score: 53-70

[07:13] Team_003 possession (Score: 53-70)
Nikola Bryant attempts a 3Pt. Contested by Carmelo Carter (4.7 feet, MAN). Nikola Bryant misses. Rebound secured by Carmelo Carter.

[07:00] Team_028 possession (Score: 53-70)
Carmelo Carter attempts a 3Pt. Contested by Nikola Bryant (4.3 feet, MAN). Carmelo Carter misses. Rebound secured by Rudy Haliburton.

[06:49] Team_003 possession (Score: 53-70)
FOUL! Holding foul on Myles Haliburton. [Team fouls: 2] No free throws, side out. (Myles Haliburton: 1 personal fouls)

[06:36] Team_003 possession (Score: 53-70)
Rudy Haliburton attempts a 3Pt. Contested by Austin Russell (4.5 feet, ZONE). Rudy Haliburton misses. Rebound secured by Kawhi Ball.

[06:24] Team_028 possession (Score: 53-70)
FOUL! Reach-in foul on Nikola Bryant during the drive. [IN THE BONUS! 7 team fouls] Carmelo Carter to the line for 2 free throws. (Nikola Bryant: 1 personal fouls)   FT 1/2: GOOD   FT 2/2: GOOD Carmelo Carter makes 2/2 from the line.
Score: 53-72

[06:09] Team_003 possession (Score: 53-72)
Nikola Bryant attempts a 3Pt. Contested by Carmelo Carter (4.7 feet, MAN). Nikola Bryant misses. Rebound secured by Carmelo Carter.

[05:49] Team_028 possession (Score: 53-72)
Carmelo Carter attempts a Layup. Contested by Nikola Bryant (4.3 feet, MAN). Carmelo Carter misses. Offensive rebound by Jimmy Brogdon! Jimmy Brogdon kicks it out.

[05:29] Team_028 possession (Score: 53-72)
Austin Russell attempts a 3Pt. Contested by Giannis Turner (2.7 feet, ZONE). Austin Russell misses. Rebound secured by Giannis Turner.

[05:18] Team_003 possession (Score: 53-72)
Nikola Bryant attempts a 3Pt. Contested by Austin Russell (4.7 feet, ZONE). NIKOLA BRYANT MAKES IT! Assist: Ayo Jackson
Score: 56-72

[05:06] Team_028 possession (Score: 56-72)
Myles Haliburton attempts a Midrange. Contested by Nikola Bryant (4.1 feet, ZONE). MYLES HALIBURTON MAKES IT! Assist: Austin Russell
Score: 56-74

[04:52] Team_003 possession (Score: 56-74)
Giannis Turner drives and kicks out. Victor O'Neal attempts a Midrange. Contested by Jimmy Brogdon (4.3 feet, MAN). Victor O'Neal misses. Rebound secured by Jimmy Brogdon.

[04:34] Team_028 possession (Score: 56-74)
Carmelo Carter attempts a Midrange. BLOCKED BY NIKOLA BRYANT! Ball is loose! Offensive rebound by Jimmy Brogdon! Jimmy Brogdon kicks it out.

[04:19] Team_028 possession (Score: 56-74)
Austin Russell attempts a 3Pt. Contested by Ayo Jackson (5.2 feet, ZONE). AUSTIN RUSSELL MAKES IT! Assist: Kawhi Ball
Score: 56-77

[04:04] Team_003 possession (Score: 56-77)
Nikola Bryant attempts a 3Pt. Contested by Kawhi Ball (4.6 feet, ZONE). NIKOLA BRYANT MAKES IT! Assist: Ayo Jackson
Score: 59-77

[03:51] Team_028 possession (Score: 59-77)
Jimmy Brogdon drives to the basket... Jimmy Brogdon loses control! Ball rolls out of bounds! TURNOVER! (dead ball)

[03:42] Team_003 possession (Score: 59-77)
Rudy Haliburton attempts a 3Pt. Contested by Myles Haliburton (3.8 feet, MAN). Rudy Haliburton misses. Rebound secured by Kawhi Ball.

[03:32] Team_028 possession (Score: 59-77)
Myles Haliburton drives and kicks out. Myles Haliburton attempts a 3Pt. Contested by Giannis Turner (3.0 feet, ZONE). Myles Haliburton misses. Offensive rebound by Kawhi Ball! Kawhi Ball kicks it out.

[03:22] Team_028 possession (Score: 59-77)
Jimmy Brogdon attempts a Layup. BLOCKED BY GIANNIS TURNER! Ball is loose! Rebound secured by Victor O'Neal.

[03:11] Team_003 possession (Score: 59-77)
Victor O'Neal makes the Midrange and draws the foul on Jimmy Brogdon! And-1! Victor O'Neal to the line for 1. [Team fouls: 3] (Jimmy Brogdon: 1 personal fouls)   FT 1/1: MISS Victor O'Neal makes 0/1 from the line. Rebound secured by Carmelo Carter.
Score: 61-77

[02:59] Team_028 possession (Score: 61-77)
Carmelo Carter drives to the basket... Carmelo Carter loses the ball! Stripped by Giannis Turner! TURNOVER! (live ball)

[02:44] Team_003 possession (Score: 61-77)
Rudy Haliburton attempts a 3Pt. Contested by Austin Russell (4.7 feet, ZONE). RUDY HALIBURTON MAKES IT! Assist: Nikola Bryant
Score: 64-77

[02:26] Team_028 possession (Score: 64-77)
Myles Haliburton attempts a 3Pt. Contested by Rudy Haliburton (3.6 feet, MAN). MYLES HALIBURTON MAKES IT! Assist: Carmelo Carter
Score: 64-80

[02:07] Team_003 possession (Score: 64-80)
Ayo Jackson attempts a 3Pt. Contested by Myles Haliburton (4.1 feet, ZONE). AYO JACKSON MAKES IT! Assist: Rudy Haliburton
Score: 67-80

[01:58] Team_028 possession (Score: 67-80)
Kawhi Ball drives to the basket... Kawhi Ball loses the ball! Stripped by Giannis Turner! TURNOVER! (live ball)

[01:46] Team_003 possession (Score: 67-80)
Nikola Bryant loses control! Ball rolls out of bounds! TURNOVER! (dead ball)

[01:46] Substitution (Team_003): Ayo Jackson OUT → Miles Towns IN (stamina_rule2)

[01:46] Substitution (Team_003): Nikola Bryant OUT → Pau Williamson IN (stamina_rule2)

[01:46] Substitution (Team_003): Rudy Haliburton OUT → Collin Mitchell IN (stamina_rule2)

[01:46] Substitution (Team_003): Giannis Turner OUT → Anfernee Jordan IN (stamina_rule2)

[01:46] Substitution (Team_003): Victor O'Neal OUT → Bam Gilgeous-Alexander IN (stamina_rule2)

[01:46] Substitution (Team_028): Austin Russell OUT → Scottie Ingram IN (stamina_rule2)

[01:46] Substitution (Team_028): Carmelo Carter OUT → Tyrese Quickley IN (stamina_rule2)

[01:46] Substitution (Team_028): Myles Haliburton OUT → Miles Booker IN (stamina_rule2)

[01:46] Substitution (Team_028): Kawhi Ball OUT → Bam Towns IN (stamina_rule2)

[01:46] Substitution (Team_028): Jimmy Brogdon OUT → Collin Bridges IN (stamina_rule2)

[01:34] Team_028 possession (Score: 67-80)
FOUL! Shooting foul on Bam Gilgeous-Alexander. Bam Towns to the line for 2 free throws. [BONUS: 8 team fouls] (Bam Gilgeous-Alexander: 1 personal fouls)   FT 1/2: GOOD   FT 2/2: GOOD Bam Towns makes 2/2 from the line.
Score: 67-82

[01:18] Team_003 possession (Score: 67-82)
Miles Towns attempts a 3Pt. Contested by Scottie Ingram (5.4 feet, MAN). Miles Towns misses. Rebound secured by Collin Bridges.

[01:07] Team_028 possession (Score: 67-82)
Miles Booker attempts a 3Pt. Contested by Collin Mitchell (4.0 feet, MAN). Miles Booker misses. Rebound secured by Collin Mitchell.

[00:52] Team_003 possession (Score: 67-82)
Anfernee Jordan attempts a Layup. Contested by Collin Bridges (3.6 feet, MAN). ANFERNEE JORDAN MAKES IT!
Score: 69-82

[00:36] Team_028 possession (Score: 69-82)
Collin Bridges drives and kicks out. Bam Towns attempts a 3Pt. Contested by Bam Gilgeous-Alexander (3.0 feet, MAN). Bam Towns misses. Rebound secured by Collin Mitchell.

[00:25] Team_003 possession (Score: 69-82)
FOUL! Holding foul on Scottie Ingram. [Team fouls: 4] No free throws, side out. (Scottie Ingram: 1 personal fouls)

[00:09] Team_003 possession (Score: 69-82)
Collin Mitchell drives, Miles Booker stays with him. Collin Mitchell attempts a Layup. Wide open! Miles Booker is 6.1 feet away. [MAN] COLLIN MITCHELL MAKES IT! Assist: Bam Gilgeous-Alexander
Score: 71-82

================================================================================
                              3RD QUARTER COMPLETE                              
================================================================================

3RD QUARTER SCORE: Team_003 20, Team_028 26

BOX SCORE:
================================================================================

Team_003
--------------------------------------------------------------------------------
Player                MIN  PTS  REB  AST  TO      FG   FG%      3P   3P%
--------------------------------------------------------------------------------
Nikola Bryant          23    6    0    1   0   2/6    33.3     0/0   0.0
Rudy Haliburton        23    3    1    1   0   1/5    20.0     0/0   0.0
Ayo Jackson            23    3    0    2   0   1/1   100.0     0/0   0.0
Collin Mitchell        14    2    2    0   0   1/1   100.0     0/0   0.0
Anfernee Jordan        14    2    0    0   0   1/1   100.0     0/0   0.0
Giannis Turner         23    0    3    0   0   0/3     0.0     0/0   0.0
Victor O'Neal          23    0    2    0   0   0/1     0.0     0/0   0.0
Miles Towns            14    0    0    0   0   0/1     0.0     0/0   0.0
Bam Gilgeous-Alexander   14    0    0    1   0   0/0     0.0     0/0   0.0

TEAM: FG: 6/19 (31.6%), 3PT: 4/12 (33.3%), REB: 9 (2 off, 7 def), AST: 5, TO: 3
TEAM FOULS: 8 [Team_028 in BONUS]


Team_028
--------------------------------------------------------------------------------
Player                MIN  PTS  REB  AST  TO      FG   FG%      3P   3P%
--------------------------------------------------------------------------------
Myles Haliburton       23    8    0    1   0   3/3   100.0     0/0   0.0
Jimmy Brogdon          23    5    4    0   0   2/3    66.7     0/0   0.0
Kawhi Ball             23    4    8    1   0   2/2   100.0     0/0   0.0
Carmelo Carter         23    4    4    1   0   2/5    40.0     0/0   0.0
Austin Russell         23    3    0    2   0   1/2    50.0     0/0   0.0
Bam Towns              14    2    0    0   0   1/1   100.0     0/0   0.0
Collin Bridges         14    0    1    0   0   0/1     0.0     0/0   0.0
Miles Booker           14    0    0    0   0   0/1     0.0     0/0   0.0

TEAM: FG: 11/18 (61.1%), 3PT: 2/6 (33.3%), REB: 16 (4 off, 12 def), AST: 5, TO: 3
TEAM FOULS: 4

================================================================================

================================================================================
                       4TH QUARTER - Team_003 vs Team_028                       
================================================================================

[12:00] Substitution (Team_003): Ayo Jackson OUT (stamina: 76) → Miles Towns IN (comeback_detected)

[12:00] Substitution (Team_028): Austin Russell OUT (stamina: 77) → Scottie Ingram IN (comeback_detected)

[12:00] Team_003 possession (Score: 71-82)
Miles Towns attempts a 3Pt. Contested by Scottie Ingram (5.4 feet, MAN). MILES TOWNS MAKES IT! Assist: Nikola Bryant
Score: 74-82

[11:46] Team_028 possession (Score: 74-82)
FOUL! Shooting foul on Nikola Bryant. Myles Haliburton to the line for 2 free throws. [Team fouls: 1] (Nikola Bryant: 1 personal fouls)   FT 1/2: MISS   FT 2/2: GOOD Myles Haliburton makes 1/2 from the line.
Score: 74-83

[11:29] Team_003 possession (Score: 74-83)
Miles Towns attempts a 3Pt. Contested by Carmelo Carter (4.5 feet, ZONE). Miles Towns misses. Rebound secured by Jimmy Brogdon.

[11:17] Team_028 possession (Score: 74-83)
Carmelo Carter drives, Nikola Bryant stays with him. Carmelo Carter attempts a Dunk. Contested by Nikola Bryant (4.4 feet, MAN). CARMELO CARTER MAKES IT! Assist: Jimmy Brogdon
Score: 74-85

[11:01] Team_003 possession (Score: 74-85)
Nikola Bryant attempts a Layup. Contested by Kawhi Ball (4.7 feet, ZONE). Nikola Bryant misses. Rebound secured by Kawhi Ball.

[10:45] Team_028 possession (Score: 74-85)
Kawhi Ball drives and kicks out. Myles Haliburton attempts a Midrange. Contested by Giannis Turner (3.0 feet, ZONE). Myles Haliburton misses. Rebound secured by Giannis Turner.

[10:32] Team_003 possession (Score: 74-85)
Nikola Bryant attempts a 3Pt. Contested by Carmelo Carter (4.9 feet, ZONE). Nikola Bryant misses. Rebound secured by Kawhi Ball.

[10:21] Team_028 possession (Score: 74-85)
Kawhi Ball drives and kicks out. Scottie Ingram attempts a 3Pt. Contested by Giannis Turner (3.1 feet, ZONE). SCOTTIE INGRAM MAKES IT! Assist: Jimmy Brogdon
Score: 74-88

[10:08] Team_003 possession (Score: 74-88)
Miles Towns drives and kicks out. Nikola Bryant attempts a 3Pt. Contested by Carmelo Carter (4.7 feet, MAN). Nikola Bryant misses. Rebound secured by Jimmy Brogdon.

[09:52] Team_028 possession (Score: 74-88)
Jimmy Brogdon attempts a 3Pt. Contested by Giannis Turner (3.6 feet, MAN). Jimmy Brogdon misses. Offensive rebound by Kawhi Ball! Kawhi Ball kicks it out.

[09:35] Team_028 possession (Score: 74-88)
Myles Haliburton loses the ball! Stripped by Rudy Haliburton! TURNOVER! (live ball)

[09:23] Team_003 possession (Score: 74-88)
Rudy Haliburton attempts a 3Pt. Contested by Scottie Ingram (5.5 feet, ZONE). RUDY HALIBURTON MAKES IT!
Score: 77-88

[09:11] Team_028 possession (Score: 77-88)
FOUL! Shooting foul on Giannis Turner. Kawhi Ball to the line for 2 free throws. [Team fouls: 2] (Giannis Turner: 1 personal fouls)   FT 1/2: GOOD   FT 2/2: GOOD Kawhi Ball makes 2/2 from the line.
Score: 77-90

[08:59] Team_003 possession (Score: 77-90)
Victor O'Neal attempts a Layup. Contested by Jimmy Brogdon (4.7 feet, MAN). VICTOR O'NEAL MAKES IT! Assist: Rudy Haliburton
Score: 79-90

[08:49] Team_028 possession (Score: 79-90)
FOUL! Shooting foul on Miles Towns. Scottie Ingram to the line for 2 free throws. [Team fouls: 3] (Miles Towns: 1 personal fouls)   FT 1/2: GOOD   FT 2/2: GOOD Scottie Ingram makes 2/2 from the line.
Score: 79-92

[08:37] Team_003 possession (Score: 79-92)
Nikola Bryant attempts a Layup. Contested by Kawhi Ball (5.0 feet, ZONE). Nikola Bryant misses. Rebound secured by Jimmy Brogdon.

[08:26] Team_028 possession (Score: 79-92)
Jimmy Brogdon attempts a Midrange. Contested by Giannis Turner (3.8 feet, MAN). Jimmy Brogdon misses. Rebound secured by Giannis Turner.

[08:10] Team_003 possession (Score: 79-92)
Miles Towns attempts a 3Pt. Contested by Carmelo Carter (4.9 feet, ZONE). Miles Towns misses. Rebound secured by Carmelo Carter.

[07:58] Team_028 possession (Score: 79-92)
Scottie Ingram attempts a Midrange. Contested by Giannis Turner (3.4 feet, ZONE). Scottie Ingram misses. Offensive rebound by Jimmy Brogdon! Jimmy Brogdon kicks it out.

[07:42] Team_028 possession (Score: 79-92)
Jimmy Brogdon attempts a Layup. BLOCKED BY GIANNIS TURNER! Ball is loose! Rebound secured by Victor O'Neal.

[07:28] Team_003 possession (Score: 79-92)
Victor O'Neal attempts a Layup. Contested by Jimmy Brogdon (4.9 feet, MAN). VICTOR O'NEAL MAKES IT! Assist: Rudy Haliburton
Score: 81-92

[07:12] Team_028 possession (Score: 81-92)
Scottie Ingram attempts a 3Pt. Contested by Miles Towns (5.3 feet, MAN). Scottie Ingram misses. Rebound secured by Victor O'Neal.

[06:53] Team_003 possession (Score: 81-92)
FOUL! Reach-in foul on Kawhi Ball during the drive. [Team fouls: 1] No free throws, side out. (Kawhi Ball: 1 personal fouls)

[06:36] Team_003 possession (Score: 81-92)
Giannis Turner attempts a Layup. BLOCKED BY CARMELO CARTER! Ball is loose! Rebound secured by Kawhi Ball.

[06:23] Team_028 possession (Score: 81-92)
Kawhi Ball attempts a Midrange. Contested by Giannis Turner (3.7 feet, MAN). Kawhi Ball misses. FOUL! Loose ball foul on Victor O'Neal during the rebound battle. [Team fouls: 4] No free throws, side out. (Victor O'Neal: 1 personal fouls)

[06:09] Team_028 possession (Score: 81-92)
Carmelo Carter loses control! Ball rolls out of bounds! TURNOVER! (dead ball)

[06:09] Substitution (Team_003): Nikola Bryant OUT → Pau Williamson IN (stamina_rule2)

[06:09] Substitution (Team_003): Rudy Haliburton OUT → Collin Mitchell IN (stamina_rule2)

[06:09] Substitution (Team_003): Giannis Turner OUT → Anfernee Jordan IN (stamina_rule2)

[06:09] Substitution (Team_003): Victor O'Neal OUT → Bam Gilgeous-Alexander IN (stamina_rule2)

[06:09] Substitution (Team_028): Carmelo Carter OUT → Tyrese Quickley IN (stamina_rule2)

[06:09] Substitution (Team_028): Myles Haliburton OUT → Miles Booker IN (stamina_rule2)

[06:09] Substitution (Team_028): Kawhi Ball OUT → Bam Towns IN (stamina_rule2)

[06:09] Substitution (Team_028): Jimmy Brogdon OUT → Collin Bridges IN (stamina_rule2)

[05:56] Team_003 possession (Score: 81-92)
Miles Towns attempts a Layup. BLOCKED BY BAM TOWNS! Ball is loose! Rebound secured by Tyrese Quickley.

[05:43] Team_028 possession (Score: 81-92)
Bam Towns attempts a Layup. Contested by Bam Gilgeous-Alexander (3.0 feet, MAN). Bam Towns misses. Rebound secured by Bam Gilgeous-Alexander.

[05:30] Team_003 possession (Score: 81-92)
FOUL! Shooting foul on Tyrese Quickley. Pau Williamson to the line for 2 free throws. [Team fouls: 2] (Tyrese Quickley: 1 personal fouls)   FT 1/2: GOOD   FT 2/2: GOOD Pau Williamson makes 2/2 from the line.
Score: 83-92

[05:18] Team_028 possession (Score: 83-92)
Miles Booker attempts a 3Pt. Contested by Collin Mitchell (4.0 feet, MAN). Miles Booker misses. Rebound secured by Anfernee Jordan.

[05:07] Team_003 possession (Score: 83-92)
Miles Towns attempts a Midrange. Contested by Tyrese Quickley (4.3 feet, ZONE). Miles Towns misses. Offensive rebound by Collin Mitchell! Collin Mitchell kicks it out.

[04:54] Team_003 possession (Score: 83-92)
Miles Towns attempts a Layup. Contested by Collin Bridges (3.6 feet, ZONE). MILES TOWNS MAKES IT! Assist: Pau Williamson
Score: 85-92

[04:43] Team_028 possession (Score: 85-92)
Bam Towns attempts a 3Pt. Contested by Miles Towns (5.5 feet, ZONE). Bam Towns misses. Rebound secured by Bam Gilgeous-Alexander.

[04:29] Team_003 possession (Score: 85-92)
Miles Towns attempts a 3Pt. Contested by Scottie Ingram (5.7 feet, MAN). Miles Towns misses. Rebound secured by Collin Bridges.

[04:15] Team_028 possession (Score: 85-92)
Collin Bridges drives to the basket... FOUL! Offensive foul on Collin Bridges! Bam Gilgeous-Alexander drew the charge! [Team fouls: 3] (Collin Bridges: 1 personal fouls) TURNOVER! (dead ball)

[04:01] Team_003 possession (Score: 85-92)
Collin Mitchell attempts a Midrange. Wide open! Miles Booker is 6.1 feet away. [MAN] COLLIN MITCHELL MAKES IT!
Score: 87-92

[03:47] Team_028 possession (Score: 87-92)
Tyrese Quickley attempts a 3Pt. Contested by Pau Williamson (5.3 feet, MAN). Tyrese Quickley misses. Rebound secured by Collin Mitchell.

[03:34] Team_003 possession (Score: 87-92)
Miles Towns drives to the basket... Miles Towns throws a bad pass out of bounds! TURNOVER! (dead ball)

[03:20] Team_028 possession (Score: 87-92)
Collin Bridges drives to the basket... Collin Bridges loses control! Ball rolls out of bounds! TURNOVER! (dead ball)

[03:11] Team_003 possession (Score: 87-92)
Collin Mitchell attempts a Midrange. Wide open! Miles Booker is 6.1 feet away. [MAN] COLLIN MITCHELL MAKES IT!
Score: 89-92

[03:01] Team_028 possession (Score: 89-92)
Tyrese Quickley drives to the basket... Tyrese Quickley throws a bad pass out of bounds! TURNOVER! (dead ball)

[02:42] Team_003 possession (Score: 89-92)
Anfernee Jordan attempts a Midrange. Contested by Collin Bridges (3.6 feet, MAN). Anfernee Jordan misses. Offensive rebound by Collin Mitchell! Collin Mitchell kicks it out.

[02:27] Team_003 possession (Score: 89-92)
Anfernee Jordan attempts a Layup. Contested by Collin Bridges (3.6 feet, ZONE). Anfernee Jordan misses. Rebound secured by Tyrese Quickley.

[02:12] Team_028 possession (Score: 89-92)
Miles Booker drives and kicks out. Bam Towns attempts a Midrange. Contested by Bam Gilgeous-Alexander (3.0 feet, MAN). Bam Towns misses. Rebound secured by Bam Gilgeous-Alexander.

[02:01] Team_003 possession (Score: 89-92)
Miles Towns attempts a Layup. Contested by Collin Bridges (3.6 feet, ZONE). MILES TOWNS MAKES IT! Assist: Anfernee Jordan
Score: 91-92

[01:48] Team_028 possession (Score: 91-92)
Miles Booker attempts a 3Pt. Contested by Collin Mitchell (4.0 feet, ZONE). Miles Booker misses. Rebound secured by Anfernee Jordan.

[01:30] Team_003 possession (Score: 91-92)
Anfernee Jordan attempts a Midrange. Contested by Collin Bridges (3.6 feet, MAN). ANFERNEE JORDAN MAKES IT!
Score: 93-92

[01:12] Team_028 possession (Score: 93-92)
Collin Bridges attempts a Midrange. Contested by Bam Gilgeous-Alexander (3.2 feet, MAN). COLLIN BRIDGES MAKES IT! Assist: Tyrese Quickley
Score: 93-94

[00:59] Team_003 possession (Score: 93-94)
Miles Towns throws a bad pass out of bounds! TURNOVER! (dead ball)

[00:59] Substitution (Team_003): Miles Towns OUT → Ayo Jackson IN (starter_return_rule1)

[00:59] Substitution (Team_028): Scottie Ingram OUT → Austin Russell IN (starter_return_rule1)

[00:45] Team_028 possession (Score: 93-94)
Collin Bridges makes the Dunk and draws the foul on Bam Gilgeous-Alexander! And-1! Collin Bridges to the line for 1. [BONUS: 5 team fouls] (Bam Gilgeous-Alexander: 1 personal fouls)   FT 1/1: GOOD Collin Bridges makes 1/1 from the line.
Score: 93-97

[00:28] Team_003 possession (Score: 93-97)
Pau Williamson attempts a 3Pt. Contested by Miles Booker (5.8 feet, ZONE). PAU WILLIAMSON MAKES IT! Assist: Ayo Jackson
Score: 96-97

[00:11] Team_028 possession (Score: 96-97)
Collin Bridges attempts a 3Pt. Contested by Collin Mitchell (4.3 feet, ZONE). Collin Bridges misses. Rebound secured by Collin Mitchell.

================================================================================
                              4TH QUARTER COMPLETE                              
================================================================================

4TH QUARTER SCORE: Team_003 25, Team_028 15

BOX SCORE:
================================================================================

Team_003
--------------------------------------------------------------------------------
Player                MIN  PTS  REB  AST  TO      FG   FG%      3P   3P%
--------------------------------------------------------------------------------
Miles Towns            25    7    0    0   0   3/8    37.5     0/0   0.0
Pau Williamson         20    5    0    1   0   2/2   100.0     0/0   0.0
Victor O'Neal          29    4    2    0   0   2/2   100.0     0/0   0.0
Collin Mitchell        20    4    4    0   0   2/2   100.0     0/0   0.0
Rudy Haliburton        29    3    0    2   0   1/1   100.0     0/0   0.0
Anfernee Jordan        20    2    2    1   0   1/2    50.0     0/0   0.0
Nikola Bryant          29    0    0    1   0   0/3     0.0     0/0   0.0
Giannis Turner         29    0    2    0   0   0/1     0.0     0/0   0.0
Bam Gilgeous-Alexander   20    0    3    0   0   0/0     0.0     0/0   0.0
Ayo Jackson            24    0    0    1   0   0/0     0.0     0/0   0.0

TEAM: FG: 11/21 (52.4%), 3PT: 3/7 (42.9%), REB: 13 (2 off, 11 def), AST: 6, TO: 2
TEAM FOULS: 5 [Team_028 in BONUS]


Team_028
--------------------------------------------------------------------------------
Player                MIN  PTS  REB  AST  TO      FG   FG%      3P   3P%
--------------------------------------------------------------------------------
Scottie Ingram         25    5    0    0   0   2/3    66.7     0/0   0.0
Collin Bridges         20    5    1    0   0   2/3    66.7     0/0   0.0
Carmelo Carter         29    2    1    0   0   1/1   100.0     0/0   0.0
Kawhi Ball             29    2    4    0   0   1/2    50.0     0/0   0.0
Myles Haliburton       29    1    0    0   0   1/1   100.0     0/0   0.0
Jimmy Brogdon          29    0    5    2   0   0/2     0.0     0/0   0.0
Tyrese Quickley        20    0    2    1   0   0/1     0.0     0/0   0.0
Bam Towns              20    0    0    0   0   0/2     0.0     0/0   0.0
Miles Booker           20    0    0    0   0   0/3     0.0     0/0   0.0

TEAM: FG: 7/18 (38.9%), 3PT: 0/6 (0.0%), REB: 13 (3 off, 10 def), AST: 3, TO: 5
TEAM FOULS: 3

================================================================================

================================================================================
                               FULL GAME COMPLETE                               
================================================================================

FINAL SCORE: Team_003 96, Team_028 97

SCORING BY QUARTER:
--------------------------------------------------------------------------------
Team                     Q1     Q2     Q3     Q4    FINAL
--------------------------------------------------------------------------------
Team_003                 24     27     20     25       96
Team_028                 33     23     26     15       97
--------------------------------------------------------------------------------

FULL GAME BOX SCORE:
================================================================================

Team_003
--------------------------------------------------------------------------------
Player                MIN  PTS  REB  AST  TO      FG   FG%      3P   3P%      FT STL BLK
--------------------------------------------------------------------------------
Nikola Bryant          29    6    0    3   1   2/10   20.0   2/7    28.6   0/0     0   1
Rudy Haliburton        29   14    5    6   2   6/10   60.0   2/6    33.3   2/2     1   0
Giannis Turner         29    3    9    1   4   1/5    20.0   1/1   100.0   0/1     4   3
Victor O'Neal          29   10    7    0   0   5/9    55.6   0/1     0.0   0/1     0   0
Miles Towns            25    7    0    2   1   6/12   50.0   2/6    33.3   0/0     1   0
Ayo Jackson            24    8    0    4   3   4/8    50.0   1/3    33.3   1/3     0   0
Pau Williamson         20   11    0    3   0   4/6    66.7   3/4    75.0   2/2     0   0
Collin Mitchell        20    9    9    1   1   3/6    50.0   0/2     0.0   0/0     0   1
Anfernee Jordan        20    8    7    1   2   4/6    66.7   0/0     0.0   2/2     0   0
Bam Gilgeous-Alexander   20   14   10    1   0   4/7    57.1   1/1   100.0   3/3     0   1

TEAM: FG: 39/79 (49.4%), 3PT: 12/31 (38.7%), REB: 49 (12 off, 37 def), AST: 22, TO: 14


Team_028
--------------------------------------------------------------------------------
Player                MIN  PTS  REB  AST  TO      FG   FG%      3P   3P%      FT STL BLK
--------------------------------------------------------------------------------
Carmelo Carter         29   15    8    1   3   6/9    66.7   1/3    33.3   6/6     0   1
Myles Haliburton       29   14    0    2   2   6/10   60.0   1/3    33.3   3/5     0   0
Kawhi Ball             29   10   16    3   1   5/7    71.4   0/0     0.0   4/4     1   0
Jimmy Brogdon          29   13   11    3   1   6/10   60.0   0/1     0.0   4/4     1   0
Scottie Ingram         25   11    0    2   1   4/7    57.1   0/2     0.0   4/4     0   1
Austin Russell         24    7    0    2   1   3/7    42.9   1/2    50.0   2/2     0   0
Tyrese Quickley        20    2    6    2   2   1/4    25.0   0/1     0.0   0/0     0   0
Miles Booker           20    4    0    0   0   2/9    22.2   0/4     0.0   2/2     0   0
Bam Towns              20    7    2    0   1   3/6    50.0   0/1     0.0   3/3     0   1
Collin Bridges         20    9    5    2   2   4/8    50.0   0/1     0.0   1/2     2   0

TEAM: FG: 41/78 (52.6%), 3PT: 3/18 (16.7%), REB: 46 (8 off, 38 def), AST: 17, TO: 14

================================================================================
