================================================================================
                        FULL GAME - Team_030 vs Team_007                        
================================================================================

================================================================================
                       1ST QUARTER - Team_030 vs Team_007                       
================================================================================

[12:00] Team_030 possession (Score: 0-0)
Tim Barrett attempts a Midrange. Contested by Jaren Dosunmu (4.4 feet, MAN). Tim Barrett misses. Rebound secured by John Quickley.

[11:46] Team_007 possession (Score: 0-0)
Bones Siakam commits a violation (traveling/carry)! TURNOVER! (dead ball)

[11:31] Team_030 possession (Score: 0-0)
Jaren Green attempts a Layup. Contested by John Quickley (3.8 feet, MAN). Jaren Green misses. Rebound secured by Bones Siakam.

[11:17] Team_007 possession (Score: 0-0)
Tobias Johnson attempts a Midrange. Contested by Tim Barrett (5.1 feet, ZONE). TOBIAS JOHNSON MAKES IT! Assist: Carmelo Siakam
Score: 0-2

[11:00] Team_030 possession (Score: 0-2)
FOUL! Holding foul on John Quickley. [Team fouls: 1] No free throws, side out. (John Quickley: 1 personal fouls)

[10:43] Team_030 possession (Score: 0-2)
Jordan Nowitzki attempts a Layup. Contested by John Quickley (3.5 feet, ZONE). JORDAN NOWITZKI MAKES IT!
Score: 2-2

[10:25] Team_007 possession (Score: 2-2)
Carmelo Siakam attempts a Midrange. Contested by Joel Anunoby (3.9 feet, ZONE). Carmelo Siakam misses. Rebound secured by Joel Anunoby.

[10:08] Team_030 possession (Score: 2-2)
Tyler Beal attempts a Layup. Contested by Tobias Johnson (5.1 feet, MAN). TYLER BEAL MAKES IT! Assist: Joel Anunoby
Score: 4-2

[09:51] Team_007 possession (Score: 4-2)
Jaren Dosunmu attempts a Midrange. Contested by Tim Barrett (4.8 feet, MAN). Jaren Dosunmu misses. Rebound secured by Jordan Nowitzki.

[09:38] Team_030 possession (Score: 4-2)
Tyler Beal drives and kicks out. Tim Barrett attempts a 3Pt. Contested by Jaren Dosunmu (4.4 feet, MAN). Tim Barrett misses. Offensive rebound by Jordan Nowitzki! Jordan Nowitzki puts it back in!
Score: 6-2

[09:27] Team_007 possession (Score: 6-2)
Jaren Dosunmu attempts a Midrange. Contested by Joel Anunoby (3.5 feet, ZONE). JAREN DOSUNMU MAKES IT!
Score: 6-4

[09:09] Team_030 possession (Score: 6-4)
Jaren Green attempts a Layup. Contested by John Quickley (3.8 feet, ZONE). Jaren Green misses. Rebound secured by John Quickley.

[08:53] Team_007 possession (Score: 6-4)
Jaren Dosunmu attempts a Midrange. Contested by Tim Barrett (4.8 feet, ZONE). Jaren Dosunmu misses. Rebound secured by Joel Anunoby.

[08:42] Team_030 possession (Score: 6-4)
Jordan Nowitzki attempts a Layup. Contested by John Quickley (3.5 feet, MAN). Jordan Nowitzki misses. Rebound secured by Carmelo Siakam.

[08:25] Team_007 possession (Score: 6-4)
Jaren Dosunmu attempts a 3Pt. Contested by Tim Barrett (4.8 feet, MAN). Jaren Dosunmu misses. Rebound secured by Joel Anunoby.

[08:13] Team_030 possession (Score: 6-4)
Jordan Nowitzki attempts a Midrange. Contested by John Quickley (3.5 feet, MAN). Jordan Nowitzki misses. FOUL! Loose ball foul on Carmelo Siakam during the rebound battle. [Team fouls: 2] No free throws, side out. (Carmelo Siakam: 1 personal fouls)

[07:56] Team_030 possession (Score: 6-4)
FOUL! Shooting foul on Bones Siakam. Joel Anunoby to the line for 3 free throws. [Team fouls: 3] (Bones Siakam: 1 personal fouls)   FT 1/3: GOOD   FT 2/3: GOOD   FT 3/3: GOOD Joel Anunoby makes 3/3 from the line.
Score: 9-4

[07:42] Team_007 possession (Score: 9-4)
Carmelo Siakam attempts a 3Pt. Contested by Tyler Beal (4.6 feet, ZONE). Carmelo Siakam misses. Rebound secured by Jaren Green.

[07:27] Team_030 possession (Score: 9-4)
Joel Anunoby drives and kicks out. Jaren Green attempts a 3Pt. Contested by John Quickley (3.0 feet, MAN). Jaren Green misses. Offensive rebound by Jordan Nowitzki! Jordan Nowitzki puts it back in!
Score: 11-4

[07:14] Team_007 possession (Score: 11-4)
Carmelo Siakam attempts a 3Pt. Contested by Jaren Green (4.4 feet, MAN). Carmelo Siakam misses. Offensive rebound by Bones Siakam! Bones Siakam puts it back in!
Score: 11-6

[06:59] Team_030 possession (Score: 11-6)
Jaren Green attempts a Midrange. Contested by John Quickley (3.8 feet, ZONE). JAREN GREEN MAKES IT! Assist: Joel Anunoby
Score: 13-6

[06:43] Team_007 possession (Score: 13-6)
Tobias Johnson makes the Dunk and draws the foul on Tyler Beal! And-1! Tobias Johnson to the line for 1. [Team fouls: 1] (Tyler Beal: 1 personal fouls)   FT 1/1: GOOD Tobias Johnson makes 1/1 from the line.
Score: 13-9

[06:29] Team_030 possession (Score: 13-9)
Jaren Green drives and kicks out. Tim Barrett attempts a 3Pt. Contested by Jaren Dosunmu (4.4 feet, MAN). TIM BARRETT MAKES IT! Assist: Jaren Green
Score: 16-9

[06:16] Team_007 possession (Score: 16-9)
John Quickley attempts a 3Pt. Contested by Jordan Nowitzki (5.0 feet, MAN). JOHN QUICKLEY MAKES IT! Assist: Carmelo Siakam
Score: 16-12

[05:59] Team_030 possession (Score: 16-12)
Tyler Beal attempts a 3Pt. Contested by John Quickley (3.3 feet, ZONE). Tyler Beal misses. Rebound secured by Carmelo Siakam.

[05:48] Team_007 possession (Score: 16-12)
Carmelo Siakam drives, picks up Jaren Green. Help arrives from Tyler Beal! Carmelo Siakam attempts a Dunk. Contested by Tyler Beal (4.4 feet, MAN). CARMELO SIAKAM MAKES IT!
Score: 16-14

[05:34] Team_030 possession (Score: 16-14)
Jordan Nowitzki drives, John Quickley stays with him. Jordan Nowitzki attempts a Layup. Contested by John Quickley (3.6 feet, ZONE). Jordan Nowitzki misses. Rebound secured by John Quickley.

[05:20] Team_007 possession (Score: 16-14)
John Quickley attempts a 3Pt. Contested by Jordan Nowitzki (5.0 feet, MAN). John Quickley misses. Rebound secured by Jaren Green.

[05:05] Team_030 possession (Score: 16-14)
Tyler Beal attempts a 3Pt. Contested by John Quickley (3.3 feet, ZONE). Tyler Beal misses. FOUL! Loose ball foul on Bones Siakam during the rebound battle. [Team fouls: 4] No free throws, side out. (Bones Siakam: 2 personal fouls)

[04:53] Team_030 possession (Score: 16-14)
Tyler Beal attempts a Midrange. Contested by Tobias Johnson (5.1 feet, MAN). Tyler Beal misses. Rebound secured by John Quickley.

[04:37] Team_007 possession (Score: 16-14)
Bones Siakam attempts a Layup. Contested by Joel Anunoby (3.6 feet, MAN). Bones Siakam misses. Rebound secured by Jaren Green.

[04:24] Team_030 possession (Score: 16-14)
FOUL! Shooting foul on John Quickley. Jaren Green to the line for 2 free throws. [BONUS: 5 team fouls] (John Quickley: 2 personal fouls)   FT 1/2: GOOD   FT 2/2: GOOD Jaren Green makes 2/2 from the line.
Score: 18-14

[04:12] Team_007 possession (Score: 18-14)
FOUL! Shooting foul on Jordan Nowitzki. John Quickley to the line for 2 free throws. [Team fouls: 2] (Jordan Nowitzki: 1 personal fouls)   FT 1/2: GOOD   FT 2/2: MISS John Quickley makes 1/2 from the line. Rebound secured by Joel Anunoby.
Score: 18-15

[04:02] Team_030 possession (Score: 18-15)
Joel Anunoby attempts a Midrange. Contested by Jaren Dosunmu (4.8 feet, ZONE). Joel Anunoby misses. Rebound secured by John Quickley.

[03:49] Team_007 possession (Score: 18-15)
Carmelo Siakam drives to the basket... Carmelo Siakam throws a bad pass out of bounds! TURNOVER! (dead ball)

[03:35] Team_030 possession (Score: 18-15)
Tim Barrett attempts a Midrange. Contested by Jaren Dosunmu (4.5 feet, MAN). Tim Barrett misses. Rebound secured by Bones Siakam.

[03:26] Team_007 possession (Score: 18-15)
FOUL! Holding foul on Tyler Beal. [Team fouls: 3] No free throws, side out. (Tyler Beal: 2 personal fouls)

[03:10] Team_007 possession (Score: 18-15)
Bones Siakam attempts a 3Pt. Contested by Joel Anunoby (3.7 feet, MAN). Bones Siakam misses. Offensive rebound by Bones Siakam! Bones Siakam kicks it out.

[02:54] Team_007 possession (Score: 18-15)
Carmelo Siakam attempts a Midrange. Contested by Joel Anunoby (4.0 feet, ZONE). Carmelo Siakam misses. Rebound secured by Jaren Green.

[02:44] Team_030 possession (Score: 18-15)
Tim Barrett makes the Dunk and draws the foul on John Quickley! And-1! Tim Barrett to the line for 1. [BONUS: 6 team fouls] (John Quickley: 3 personal fouls)   FT 1/1: MISS Tim Barrett makes 0/1 from the line. Rebound secured by Carmelo Siakam.
Score: 20-15

[02:28] Team_007 possession (Score: 20-15)
Bones Siakam attempts a 3Pt. Contested by Joel Anunoby (3.8 feet, MAN). BONES SIAKAM MAKES IT! Assist: John Quickley
Score: 20-18

[02:13] Team_030 possession (Score: 20-18)
Tim Barrett drives, picks up John Quickley. Help arrives from Jaren Dosunmu! Tim Barrett attempts a Layup. Contested by Jaren Dosunmu (3.4 feet, ZONE). Tim Barrett misses. Rebound secured by Carmelo Siakam.

[01:59] Team_007 possession (Score: 20-18)
Carmelo Siakam makes the Layup and draws the foul on Jaren Green! And-1! Carmelo Siakam to the line for 1. [Team fouls: 4] (Jaren Green: 1 personal fouls)   FT 1/1: GOOD Carmelo Siakam makes 1/1 from the line.
Score: 20-21

[01:43] Team_030 possession (Score: 20-21)
FOUL! Shooting foul on John Quickley. Joel Anunoby to the line for 2 free throws. [BONUS: 7 team fouls] (John Quickley: 4 personal fouls)   FT 1/2: GOOD   FT 2/2: GOOD Joel Anunoby makes 2/2 from the line.
Score: 22-21

[01:29] Team_007 possession (Score: 22-21)
FOUL! Reach-in foul on Jaren Green during the drive. [IN THE BONUS! 5 team fouls] John Quickley to the line for 2 free throws. (Jaren Green: 2 personal fouls)   FT 1/2: GOOD   FT 2/2: GOOD John Quickley makes 2/2 from the line.
Score: 22-23

[01:15] Team_030 possession (Score: 22-23)
Tim Barrett attempts a 3Pt. Contested by John Quickley (3.6 feet, ZONE). Tim Barrett misses. Rebound secured by Carmelo Siakam.

[01:01] Team_007 possession (Score: 22-23)
John Quickley attempts a Layup. Contested by Jordan Nowitzki (5.3 feet, MAN). JOHN QUICKLEY MAKES IT!
Score: 22-25

[00:44] Team_030 possession (Score: 22-25)
Tyler Beal drives and kicks out. Joel Anunoby attempts a 3Pt. Contested by Jaren Dosunmu (4.8 feet, ZONE). JOEL ANUNOBY MAKES IT! Assist: Jordan Nowitzki
Score: 25-25

[00:27] Team_007 possession (Score: 25-25)
Carmelo Siakam drives to the basket... FOUL! Offensive foul on Carmelo Siakam! Jaren Green drew the charge! [Team fouls: 8] (Carmelo Siakam: 2 personal fouls) TURNOVER! (dead ball)

[00:10] Team_030 possession (Score: 25-25)
Jordan Nowitzki attempts a 3Pt. Contested by John Quickley (4.2 feet, MAN). Jordan Nowitzki misses. Rebound secured by Carmelo Siakam.

[00:01] Team_007 possession (Score: 25-25)
Tobias Johnson attempts a 3Pt. Contested by Tyler Beal (5.0 feet, ZONE). Tobias Johnson misses. Rebound secured by Joel Anunoby.

================================================================================
                              1ST QUARTER COMPLETE                              
================================================================================

1ST QUARTER SCORE: Team_030 25, Team_007 25

BOX SCORE:
================================================================================

Team_030
--------------------------------------------------------------------------------
Player                MIN  PTS  REB  AST  TO      FG   FG%      3P   3P%
--------------------------------------------------------------------------------
Joel Anunoby           12    8    6    2   0   3/4    75.0     0/0   0.0
Jordan Nowitzki        12    6    4    1   0   3/6    50.0     0/0   0.0
Jaren Green            12    4    4    1   0   2/4    50.0     0/0   0.0
Tim Barrett            12    3    0    0   0   1/6    16.7     0/0   0.0
Tyler Beal             12    2    0    0   0   1/3    33.3     0/0   0.0

TEAM: FG: 10/23 (43.5%), 3PT: 1/4 (25.0%), REB: 14 (4 off, 10 def), AST: 4, TO: 0
TEAM FOULS: 5 [Team_007 in BONUS]


Team_007
--------------------------------------------------------------------------------
Player                MIN  PTS  REB  AST  TO      FG   FG%      3P   3P%
--------------------------------------------------------------------------------
John Quickley          12    7    5    1   0   3/5    60.0     0/0   0.0
Bones Siakam           12    5    4    0   0   2/3    66.7     0/0   0.0
Tobias Johnson         12    5    0    0   0   2/3    66.7     0/0   0.0
Carmelo Siakam         12    5    6    2   0   2/5    40.0     0/0   0.0
Jaren Dosunmu          12    2    0    0   0   1/4    25.0     0/0   0.0

TEAM: FG: 10/20 (50.0%), 3PT: 3/7 (42.9%), REB: 15 (2 off, 13 def), AST: 3, TO: 3
TEAM FOULS: 8 [Team_030 in BONUS]

================================================================================

================================================================================
                       2ND QUARTER - Team_030 vs Team_007                       
================================================================================

[12:00] Team_030 possession (Score: 25-25)
Jordan Nowitzki attempts a 3Pt. Contested by John Quickley (4.0 feet, ZONE). JORDAN NOWITZKI MAKES IT! Assist: Jaren Green
Score: 28-25

[11:44] Team_007 possession (Score: 28-25)
Tobias Johnson attempts a 3Pt. Contested by Tyler Beal (4.8 feet, ZONE). Tobias Johnson misses. Rebound secured by Jordan Nowitzki.

[11:26] Team_030 possession (Score: 28-25)
Jordan Nowitzki drives, John Quickley stays with him. Jordan Nowitzki attempts a Layup. Contested by John Quickley (4.1 feet, ZONE). Jordan Nowitzki misses. Rebound secured by John Quickley.

[11:15] Team_007 possession (Score: 28-25)
Jaren Dosunmu attempts a Midrange. Contested by Tim Barrett (5.1 feet, MAN). JAREN DOSUNMU MAKES IT!
Score: 28-27

[10:59] Team_030 possession (Score: 28-27)
Joel Anunoby attempts a Midrange. Contested by Bones Siakam (4.5 feet, MAN). Joel Anunoby misses. Rebound secured by John Quickley.

[10:45] Team_007 possession (Score: 28-27)
John Quickley attempts a Midrange. Contested by Joel Anunoby (4.4 feet, ZONE). John Quickley misses. Offensive rebound by Carmelo Siakam! Carmelo Siakam puts it back in!
Score: 28-29

[10:33] Team_030 possession (Score: 28-29)
Tim Barrett attempts a Midrange. Contested by Jaren Dosunmu (4.7 feet, ZONE). Tim Barrett misses. Rebound secured by John Quickley.

[10:15] Team_007 possession (Score: 28-29)
FOUL! Holding foul on Tim Barrett. [Team fouls: 1] No free throws, side out. (Tim Barrett: 1 personal fouls)

[09:59] Team_007 possession (Score: 28-29)
Tobias Johnson attempts a 3Pt. Contested by Tyler Beal (5.0 feet, ZONE). Tobias Johnson misses. Rebound secured by Jaren Green.

[09:41] Team_030 possession (Score: 28-29)
Tim Barrett attempts a Layup. BLOCKED BY JAREN DOSUNMU! Ball is loose! Rebound secured by John Quickley.

[09:32] Team_007 possession (Score: 28-29)
FOUL! Shooting foul on Jordan Nowitzki. John Quickley to the line for 2 free throws. [Team fouls: 2] (Jordan Nowitzki: 1 personal fouls)   FT 1/2: MISS   FT 2/2: GOOD John Quickley makes 1/2 from the line.
Score: 28-30

[09:21] Team_030 possession (Score: 28-30)
Jaren Green drives to the basket... Jaren Green commits a violation (traveling/carry)! TURNOVER! (dead ball)

[09:21] Substitution (Team_030): Tyler Beal OUT → RJ Carter IN (stamina_rule2)

[09:21] Substitution (Team_030): Tim Barrett OUT → Josh Smith IN (stamina_rule2)

[09:21] Substitution (Team_030): Joel Anunoby OUT → Pau James IN (stamina_rule2)

[09:21] Substitution (Team_030): Jordan Nowitzki OUT → Damian Green IN (stamina_rule2)

[09:21] Substitution (Team_030): Jaren Green OUT → Franz Anunoby IN (stamina_rule2)

[09:21] Substitution (Team_007): Tobias Johnson OUT → Wendell Poole IN (stamina_rule2)

[09:21] Substitution (Team_007): Jaren Dosunmu OUT → OG Porzingis IN (stamina_rule2)

[09:21] Substitution (Team_007): Bones Siakam OUT → Gary LaVine IN (stamina_rule2)

[09:21] Substitution (Team_007): John Quickley OUT → Austin Simons IN (stamina_rule2)

[09:21] Substitution (Team_007): Carmelo Siakam OUT → Draymond Harris IN (stamina_rule2)

[09:04] Team_007 possession (Score: 28-30)
Austin Simons attempts a Midrange. BLOCKED BY PAU JAMES! Ball is loose! Offensive rebound by Draymond Harris! Draymond Harris kicks it out.

[08:52] Team_007 possession (Score: 28-30)
Draymond Harris attempts a Midrange. Contested by Franz Anunoby (4.4 feet, MAN). Draymond Harris misses. Rebound secured by Damian Green.

[08:41] Team_030 possession (Score: 28-30)
RJ Carter makes the 3Pt and draws the foul on Wendell Poole! And-1! RJ Carter to the line for 1. [Team fouls: 1] (Wendell Poole: 1 personal fouls)   FT 1/1: GOOD RJ Carter makes 1/1 from the line.
Score: 32-30

[08:24] Team_007 possession (Score: 32-30)
Austin Simons attempts a Layup. Contested by Damian Green (5.5 feet, ZONE). AUSTIN SIMONS MAKES IT!
Score: 32-32

[08:07] Team_030 possession (Score: 32-32)
Josh Smith attempts a Midrange. Contested by Gary LaVine (4.5 feet, ZONE). JOSH SMITH MAKES IT!
Score: 34-32

[07:53] Team_007 possession (Score: 34-32)
Draymond Harris attempts a Midrange. Contested by Josh Smith (4.6 feet, ZONE). Draymond Harris misses. Rebound secured by Franz Anunoby.

[07:37] Team_030 possession (Score: 34-32)
Josh Smith attempts a 3Pt. Contested by OG Porzingis (4.4 feet, MAN). Josh Smith misses. Rebound secured by Austin Simons.

[07:19] Team_007 possession (Score: 34-32)
Draymond Harris attempts a Midrange. Contested by Franz Anunoby (4.4 feet, MAN). DRAYMOND HARRIS MAKES IT!
Score: 34-34

[07:05] Team_030 possession (Score: 34-34)
RJ Carter throws a bad pass! Stolen by Wendell Poole! TURNOVER! (live ball)

[06:53] Team_007 possession (Score: 34-34)
Gary LaVine drives and kicks out. Gary LaVine attempts a 3Pt. Contested by Pau James (4.4 feet, MAN). Gary LaVine misses. Rebound secured by Franz Anunoby.

[06:38] Team_030 possession (Score: 34-34)
Franz Anunoby drives, Draymond Harris stays with him. Franz Anunoby attempts a Dunk. Contested by Draymond Harris (5.2 feet, MAN). FRANZ ANUNOBY MAKES IT! Assist: Pau James
Score: 36-34

[06:22] Team_007 possession (Score: 36-34)
FOUL! Holding foul on Damian Green. [Team fouls: 3] No free throws, side out. (Damian Green: 1 personal fouls)

[06:10] Team_007 possession (Score: 36-34)
FOUL! Shooting foul on Damian Green. Austin Simons to the line for 2 free throws. [Team fouls: 4] (Damian Green: 2 personal fouls)   FT 1/2: GOOD   FT 2/2: MISS Austin Simons makes 1/2 from the line. Offensive rebound by Draymond Harris! Draymond Harris kicks it out.
Score: 36-35

[05:57] Team_007 possession (Score: 36-35)
OG Porzingis drives and kicks out. Gary LaVine attempts a 3Pt. Contested by Pau James (4.4 feet, MAN). Gary LaVine misses. Offensive rebound by Draymond Harris! Draymond Harris kicks it out.

[05:47] Team_007 possession (Score: 36-35)
Gary LaVine attempts a 3Pt. Contested by RJ Carter (5.8 feet, ZONE). Gary LaVine misses. Rebound secured by Damian Green.

[05:32] Team_030 possession (Score: 36-35)
FOUL! Shooting foul on Draymond Harris. Franz Anunoby to the line for 2 free throws. [Team fouls: 2] (Draymond Harris: 1 personal fouls)   FT 1/2: GOOD   FT 2/2: GOOD Franz Anunoby makes 2/2 from the line.
Score: 38-35

[05:20] Team_007 possession (Score: 38-35)
Wendell Poole attempts a Midrange. Contested by Damian Green (5.4 feet, ZONE). WENDELL POOLE MAKES IT! Assist: Austin Simons
Score: 38-37

[05:08] Team_030 possession (Score: 38-37)
Josh Smith attempts a 3Pt. Contested by OG Porzingis (4.4 feet, ZONE). Josh Smith misses. Rebound secured by Austin Simons.

[04:50] Team_007 possession (Score: 38-37)
Gary LaVine drives and kicks out. Wendell Poole attempts a 3Pt. Contested by RJ Carter (5.7 feet, MAN). Wendell Poole misses. Rebound secured by Pau James.

[04:40] Team_030 possession (Score: 38-37)
Josh Smith drives and kicks out. RJ Carter attempts a 3Pt. Contested by Wendell Poole (5.2 feet, MAN). RJ Carter misses. Rebound secured by Gary LaVine.

[04:23] Team_007 possession (Score: 38-37)
Draymond Harris drives and kicks out. Wendell Poole attempts a 3Pt. Contested by RJ Carter (5.7 feet, ZONE). WENDELL POOLE MAKES IT! Assist: Austin Simons
Score: 38-40

[04:09] Team_030 possession (Score: 38-40)
FOUL! Reach-in foul on Austin Simons during the drive. [Team fouls: 3] No free throws, side out. (Austin Simons: 1 personal fouls)

[03:53] Team_030 possession (Score: 38-40)
Josh Smith attempts a Midrange. Contested by Draymond Harris (5.1 feet, ZONE). Josh Smith misses. Rebound secured by Gary LaVine.

[03:40] Team_007 possession (Score: 38-40)
Austin Simons attempts a 3Pt. Wide open! RJ Carter is 6.0 feet away. [ZONE] Austin Simons misses. Offensive rebound by Austin Simons! Austin Simons puts it back in!
Score: 38-42

[03:20] Team_030 possession (Score: 38-42)
Damian Green throws a bad pass! Stolen by Austin Simons! TURNOVER! (live ball)

[03:08] Team_007 possession (Score: 38-42)
Austin Simons loses the ball! Stripped by Damian Green! TURNOVER! (live ball)

[02:52] Team_030 possession (Score: 38-42)
Pau James attempts a 3Pt. Contested by Gary LaVine (4.3 feet, MAN). Pau James misses. Rebound secured by Draymond Harris.

[02:42] Team_007 possession (Score: 38-42)
OG Porzingis attempts a Layup. Contested by Damian Green (4.7 feet, ZONE). OG PORZINGIS MAKES IT! Assist: Wendell Poole
Score: 38-44

[02:29] Team_030 possession (Score: 38-44)
Damian Green drives and kicks out. Franz Anunoby attempts a Midrange. Contested by Draymond Harris (5.0 feet, MAN). Franz Anunoby misses. Offensive rebound by Damian Green! Damian Green kicks it out.

[02:13] Team_030 possession (Score: 38-44)
Josh Smith attempts a 3Pt. Contested by OG Porzingis (4.4 feet, ZONE). JOSH SMITH MAKES IT! Assist: Pau James
Score: 41-44

[01:58] Team_007 possession (Score: 41-44)
Wendell Poole attempts a Layup. BLOCKED BY RJ CARTER! Ball is loose! Rebound secured by Franz Anunoby.

[01:42] Team_030 possession (Score: 41-44)
RJ Carter makes the Dunk and draws the foul on Austin Simons! And-1! RJ Carter to the line for 1. [Team fouls: 4] (Austin Simons: 2 personal fouls)   FT 1/1: GOOD RJ Carter makes 1/1 from the line.
Score: 44-44

[01:29] Team_007 possession (Score: 44-44)
Draymond Harris throws a bad pass out of bounds! TURNOVER! (dead ball)

[01:16] Team_030 possession (Score: 44-44)
Josh Smith drives and kicks out. Damian Green attempts a 3Pt. Contested by OG Porzingis (4.3 feet, ZONE). Damian Green misses. Rebound secured by Austin Simons.

[01:01] Team_007 possession (Score: 44-44)
Austin Simons drives and kicks out. Wendell Poole attempts a 3Pt. Contested by RJ Carter (5.8 feet, ZONE). Wendell Poole misses. Offensive rebound by Draymond Harris! Draymond Harris kicks it out.

[00:49] Team_007 possession (Score: 44-44)
Wendell Poole makes the Layup and draws the foul on Pau James! And-1! Wendell Poole to the line for 1. [BONUS: 5 team fouls] (Pau James: 1 personal fouls)   FT 1/1: GOOD Wendell Poole makes 1/1 from the line.
Score: 44-47

[00:35] Team_030 possession (Score: 44-47)
Josh Smith attempts a 3Pt. Contested by Gary LaVine (4.6 feet, ZONE). JOSH SMITH MAKES IT! Assist: Pau James
Score: 47-47

[00:20] Team_007 possession (Score: 47-47)
FOUL! Shooting foul on Damian Green. OG Porzingis to the line for 2 free throws. [BONUS: 6 team fouls] (Damian Green: 3 personal fouls)   FT 1/2: GOOD   FT 2/2: GOOD OG Porzingis makes 2/2 from the line.
Score: 47-49

[00:06] Team_030 possession (Score: 47-49)
FOUL! Holding foul on Gary LaVine. [IN THE BONUS! 5 team fouls] Pau James to the line for 2 free throws. (Gary LaVine: 1 personal fouls)   FT 1/2: MISS   FT 2/2: MISS Pau James makes 0/2 from the line. Rebound secured by Draymond Harris.

================================================================================
                              2ND QUARTER COMPLETE                              
================================================================================

2ND QUARTER SCORE: Team_030 22, Team_007 24

BOX SCORE:
================================================================================

Team_030
--------------------------------------------------------------------------------
Player                MIN  PTS  REB  AST  TO      FG   FG%      3P   3P%
--------------------------------------------------------------------------------
Josh Smith              9    8    0    0   0   3/8    37.5     0/0   0.0
RJ Carter               9    7    0    0   0   2/2   100.0     0/0   0.0
Franz Anunoby           9    4    3    0   0   2/2   100.0     0/0   0.0
Jordan Nowitzki        15    3    1    0   0   1/2    50.0     0/0   0.0
Jaren Green            15    0    1    1   0   0/0     0.0     0/0   0.0
Joel Anunoby           15    0    0    0   0   0/1     0.0     0/0   0.0
Tim Barrett            15    0    0    0   0   0/2     0.0     0/0   0.0
Damian Green            9    0    3    0   0   0/0     0.0     0/0   0.0
Pau James               9    0    1    3   0   0/1     0.0     0/0   0.0

TEAM: FG: 8/19 (42.1%), 3PT: 4/7 (57.1%), REB: 9 (1 off, 8 def), AST: 4, TO: 3
TEAM FOULS: 6 [Team_007 in BONUS]


Team_007
--------------------------------------------------------------------------------
Player                MIN  PTS  REB  AST  TO      FG   FG%      3P   3P%
--------------------------------------------------------------------------------
Wendell Poole           9    8    0    1   0   3/4    75.0     0/0   0.0
Austin Simons           9    4    4    2   0   2/2   100.0     0/0   0.0
OG Porzingis            9    4    0    0   0   2/2   100.0     0/0   0.0
Jaren Dosunmu          15    2    0    0   0   1/1   100.0     0/0   0.0
Carmelo Siakam         15    2    1    0   0   1/1   100.0     0/0   0.0
Draymond Harris         9    2    6    0   0   1/3    33.3     0/0   0.0
John Quickley          15    1    4    0   0   1/1   100.0     0/0   0.0
Tobias Johnson         15    0    0    0   0   0/2     0.0     0/0   0.0
Gary LaVine             9    0    2    0   0   0/3     0.0     0/0   0.0

TEAM: FG: 11/19 (57.9%), 3PT: 1/4 (25.0%), REB: 17 (6 off, 11 def), AST: 3, TO: 2
TEAM FOULS: 5 [Team_030 in BONUS]

================================================================================

================================================================================
                       3RD QUARTER - Team_030 vs Team_007                       
================================================================================

[12:00] Team_030 possession (Score: 47-49)
Joel Anunoby attempts a 3Pt. Contested by John Quickley (3.4 feet, ZONE). Joel Anunoby misses. Rebound secured by Bones Siakam.

[11:49] Team_007 possession (Score: 47-49)
Jaren Dosunmu attempts a 3Pt. Contested by Tyler Beal (4.2 feet, ZONE). JAREN DOSUNMU MAKES IT! Assist: Tobias Johnson
Score: 47-52

[11:30] Team_030 possession (Score: 47-52)
Tim Barrett attempts a 3Pt. Contested by Jaren Dosunmu (4.4 feet, MAN). Tim Barrett misses. Rebound secured by John Quickley.

[11:15] Team_007 possession (Score: 47-52)
FOUL! Offensive foul on Carmelo Siakam! Jaren Green drew the charge! [Team fouls: 1] (Carmelo Siakam: 1 personal fouls) TURNOVER! (dead ball)

[10:57] Team_030 possession (Score: 47-52)
Jordan Nowitzki drives, John Quickley stays with him. Jordan Nowitzki attempts a Layup. Contested by John Quickley (3.5 feet, MAN). Jordan Nowitzki misses. Offensive rebound by Joel Anunoby! Joel Anunoby kicks it out.

[10:43] Team_030 possession (Score: 47-52)
FOUL! Offensive foul on Tim Barrett! Jaren Dosunmu drew the charge! [Team fouls: 1] (Tim Barrett: 1 personal fouls) TURNOVER! (dead ball)

[10:32] Team_007 possession (Score: 47-52)
Carmelo Siakam attempts a Layup. Contested by Jaren Green (4.4 feet, ZONE). CARMELO SIAKAM MAKES IT! Assist: Tobias Johnson
Score: 47-54

[10:22] Team_030 possession (Score: 47-54)
Jaren Green drives to the basket... Jaren Green loses the ball! Stripped by John Quickley! TURNOVER! (live ball)

[10:08] Team_007 possession (Score: 47-54)
Jaren Dosunmu attempts a 3Pt. Contested by Tim Barrett (4.8 feet, MAN). Jaren Dosunmu misses. Rebound secured by Jaren Green.

[09:51] Team_030 possession (Score: 47-54)
Jordan Nowitzki drives, picks up John Quickley. Help arrives from Jaren Dosunmu! Jordan Nowitzki attempts a Dunk. Contested by Jaren Dosunmu (3.5 feet, MAN). JORDAN NOWITZKI MAKES IT!
Score: 49-54

[09:37] Team_007 possession (Score: 49-54)
John Quickley attempts a Midrange. Contested by Jordan Nowitzki (5.0 feet, MAN). John Quickley misses. Rebound secured by Jordan Nowitzki.

[09:25] Team_030 possession (Score: 49-54)
Tim Barrett attempts a Midrange. Contested by Jaren Dosunmu (4.4 feet, MAN). Tim Barrett misses. Rebound secured by Carmelo Siakam.

[09:10] Team_007 possession (Score: 49-54)
Bones Siakam drives to the basket... Bones Siakam throws a bad pass out of bounds! TURNOVER! (dead ball)

[08:53] Team_030 possession (Score: 49-54)
Jaren Green drives to the basket... Jaren Green loses control! Ball rolls out of bounds! TURNOVER! (dead ball)

[08:42] Team_007 possession (Score: 49-54)
Jaren Dosunmu attempts a 3Pt. Contested by Tyler Beal (4.2 feet, ZONE). Jaren Dosunmu misses. Offensive rebound by Carmelo Siakam! Carmelo Siakam's putback is no good. Offensive rebound by Carmelo Siakam! Carmelo Siakam kicks it out.

[08:23] Team_007 possession (Score: 49-54)
Jaren Dosunmu attempts a 3Pt. Contested by Tim Barrett (4.8 feet, ZONE). JAREN DOSUNMU MAKES IT! Assist: Carmelo Siakam
Score: 49-57

[08:10] Team_030 possession (Score: 49-57)
Tim Barrett attempts a 3Pt. Contested by Jaren Dosunmu (4.4 feet, MAN). Tim Barrett misses. Offensive rebound by Jordan Nowitzki! Jordan Nowitzki's putback is no good. Offensive rebound by Jordan Nowitzki! Jordan Nowitzki kicks it out.

[08:00] Team_030 possession (Score: 49-57)
Jordan Nowitzki attempts a Layup. BLOCKED BY JOHN QUICKLEY! Ball is loose! Rebound secured by John Quickley.

[07:46] Team_007 possession (Score: 49-57)
Carmelo Siakam makes the Dunk and draws the foul on Jaren Green! And-1! Carmelo Siakam to the line for 1. [Team fouls: 2] (Jaren Green: 1 personal fouls)   FT 1/1: GOOD Carmelo Siakam makes 1/1 from the line.
Score: 49-60

[07:31] Team_030 possession (Score: 49-60)
Tim Barrett attempts a 3Pt. Contested by Jaren Dosunmu (4.4 feet, MAN). Tim Barrett misses. Rebound secured by John Quickley.

[07:18] Team_007 possession (Score: 49-60)
Jaren Dosunmu attempts a 3Pt. Contested by Tyler Beal (4.2 feet, ZONE). Jaren Dosunmu misses. Rebound secured by Jaren Green.

[07:05] Team_030 possession (Score: 49-60)
Tim Barrett drives and kicks out. Tim Barrett attempts a Midrange. Contested by Jaren Dosunmu (4.4 feet, MAN). TIM BARRETT MAKES IT!
Score: 51-60

[06:49] Team_007 possession (Score: 51-60)
John Quickley attempts a Layup. BLOCKED BY TYLER BEAL! Ball is loose! Rebound secured by Joel Anunoby.

[06:35] Team_030 possession (Score: 51-60)
Tim Barrett attempts a 3Pt. Contested by John Quickley (3.0 feet, ZONE). Tim Barrett misses. Rebound secured by John Quickley.

[06:18] Team_007 possession (Score: 51-60)
Carmelo Siakam attempts a Layup. Contested by Jaren Green (4.4 feet, ZONE). CARMELO SIAKAM MAKES IT! Assist: Jaren Dosunmu
Score: 51-62

[05:59] Team_030 possession (Score: 51-62)
Jordan Nowitzki drives to the basket... Jordan Nowitzki loses control! Ball rolls out of bounds! TURNOVER! (dead ball)

[05:47] Team_007 possession (Score: 51-62)
John Quickley attempts a Midrange. Contested by Tim Barrett (5.4 feet, ZONE). JOHN QUICKLEY MAKES IT! Assist: Jaren Dosunmu
Score: 51-64

[05:33] Team_030 possession (Score: 51-64)
Tim Barrett attempts a 3Pt. Contested by John Quickley (3.0 feet, ZONE). Tim Barrett misses. Rebound secured by Bones Siakam.

[05:16] Team_007 possession (Score: 51-64)
Jaren Dosunmu attempts a 3Pt. Contested by Tim Barrett (4.8 feet, MAN). JAREN DOSUNMU MAKES IT! Assist: Tobias Johnson
Score: 51-67

[04:59] Team_030 possession (Score: 51-67)
Jordan Nowitzki attempts a Layup. BLOCKED BY JAREN DOSUNMU! Ball is loose! Rebound secured by Bones Siakam.

[04:46] Team_007 possession (Score: 51-67)
FOUL! Reach-in foul on Tyler Beal during the drive. [Team fouls: 3] No free throws, side out. (Tyler Beal: 1 personal fouls)

[04:32] Team_007 possession (Score: 51-67)
John Quickley drives and kicks out. Jaren Dosunmu makes the 3Pt and draws the foul on Tim Barrett! And-1! Jaren Dosunmu to the line for 1. [Team fouls: 4] (Tim Barrett: 2 personal fouls)   FT 1/1: GOOD Jaren Dosunmu makes 1/1 from the line.
Score: 51-71

[04:18] Team_030 possession (Score: 51-71)
Jaren Green makes the Dunk and draws the foul on John Quickley! And-1! Jaren Green to the line for 1. [Team fouls: 2] (John Quickley: 1 personal fouls)   FT 1/1: GOOD Jaren Green makes 1/1 from the line.
Score: 54-71

[04:02] Team_007 possession (Score: 54-71)
Carmelo Siakam makes the Midrange and draws the foul on Jaren Green! And-1! Carmelo Siakam to the line for 1. [BONUS: 5 team fouls] (Jaren Green: 2 personal fouls)   FT 1/1: GOOD Carmelo Siakam makes 1/1 from the line.
Score: 54-74

[03:45] Team_030 possession (Score: 54-74)
Tim Barrett drives to the basket... FOUL! Offensive foul on Tim Barrett! Jaren Dosunmu drew the charge! [Team fouls: 6] (Tim Barrett: 3 personal fouls) TURNOVER! (dead ball)

[03:30] Team_007 possession (Score: 54-74)
Tobias Johnson attempts a 3Pt. Contested by Tyler Beal (4.6 feet, MAN). Tobias Johnson misses. Rebound secured by Jordan Nowitzki.

[03:18] Team_030 possession (Score: 54-74)
Tyler Beal attempts a Layup. Contested by John Quickley (3.5 feet, ZONE). Tyler Beal misses. Rebound secured by Bones Siakam.

[03:00] Team_007 possession (Score: 54-74)
Tobias Johnson attempts a 3Pt. Contested by Tyler Beal (4.7 feet, MAN). Tobias Johnson misses. Rebound secured by Jaren Green.

[02:47] Team_030 possession (Score: 54-74)
Jaren Green attempts a 3Pt. Contested by Bones Siakam (4.7 feet, ZONE). Jaren Green misses. Rebound secured by Carmelo Siakam.

[02:29] Team_007 possession (Score: 54-74)
Jaren Dosunmu attempts a 3Pt. Contested by Tim Barrett (5.0 feet, MAN). Jaren Dosunmu misses. Offensive rebound by Bones Siakam! Bones Siakam kicks it out.

[02:14] Team_007 possession (Score: 54-74)
Jaren Dosunmu loses control! Ball rolls out of bounds! TURNOVER! (dead ball)

[02:14] Substitution (Team_030): Tim Barrett OUT → Josh Smith IN (stamina_rule2)

[02:14] Substitution (Team_030): Jordan Nowitzki OUT → Damian Green IN (stamina_rule2)

[02:14] Substitution (Team_030): Jaren Green OUT → Franz Anunoby IN (stamina_rule2)

[02:14] Substitution (Team_007): Bones Siakam OUT → Gary LaVine IN (stamina_rule2)

[02:14] Substitution (Team_007): John Quickley OUT → Austin Simons IN (stamina_rule2)

[02:14] Substitution (Team_007): Carmelo Siakam OUT → Draymond Harris IN (stamina_rule2)

[02:00] Team_030 possession (Score: 54-74)
Joel Anunoby drives to the basket... Joel Anunoby throws a bad pass out of bounds! TURNOVER! (dead ball)

[02:00] Substitution (Team_030): Tyler Beal OUT → RJ Carter IN (stamina_rule2)

[02:00] Substitution (Team_007): Tobias Johnson OUT → Wendell Poole IN (stamina_rule2)

[01:45] Team_007 possession (Score: 54-74)
Gary LaVine attempts a 3Pt. Contested by Joel Anunoby (3.9 feet, MAN). Gary LaVine misses. Rebound secured by Joel Anunoby.

[01:25] Team_030 possession (Score: 54-74)
Franz Anunoby attempts a Layup. Contested by Draymond Harris (5.2 feet, MAN). FRANZ ANUNOBY MAKES IT! Assist: Josh Smith
Score: 56-74

[01:11] Team_007 possession (Score: 56-74)
Jaren Dosunmu attempts a 3Pt. Contested by Josh Smith (4.6 feet, MAN). JAREN DOSUNMU MAKES IT! Assist: Gary LaVine
Score: 56-77

[00:54] Team_030 possession (Score: 56-77)
Joel Anunoby makes the Midrange and draws the foul on Gary LaVine! And-1! Joel Anunoby to the line for 1. [Team fouls: 3] (Gary LaVine: 1 personal fouls)   FT 1/1: GOOD Joel Anunoby makes 1/1 from the line.
Score: 59-77

[00:42] Team_007 possession (Score: 59-77)
FOUL! Reach-in foul on Joel Anunoby during the drive. [IN THE BONUS! 7 team fouls] Gary LaVine to the line for 2 free throws. (Joel Anunoby: 1 personal fouls)   FT 1/2: GOOD   FT 2/2: GOOD Gary LaVine makes 2/2 from the line.
Score: 59-79

[00:25] Team_030 possession (Score: 59-79)
FOUL! Shooting foul on Gary LaVine. Joel Anunoby to the line for 2 free throws. [Team fouls: 4] (Gary LaVine: 2 personal fouls)   FT 1/2: GOOD   FT 2/2: GOOD Joel Anunoby makes 2/2 from the line.
Score: 61-79

[00:13] Team_007 possession (Score: 61-79)
FOUL! Holding foul on Franz Anunoby. [IN THE BONUS! 8 team fouls] Draymond Harris to the line for 2 free throws. (Franz Anunoby: 1 personal fouls)   FT 1/2: GOOD   FT 2/2: GOOD Draymond Harris makes 2/2 from the line.
Score: 61-81

================================================================================
                              3RD QUARTER COMPLETE                              
================================================================================

3RD QUARTER SCORE: Team_030 14, Team_007 32

BOX SCORE:
================================================================================

Team_030
--------------------------------------------------------------------------------
Player                MIN  PTS  REB  AST  TO      FG   FG%      3P   3P%
--------------------------------------------------------------------------------
Joel Anunoby           27    5    3    0   0   2/3    66.7     0/0   0.0
Jaren Green            25    3    3    0   0   1/2    50.0     0/0   0.0
Tim Barrett            25    2    0    0   0   1/6    16.7     0/0   0.0
Jordan Nowitzki        25    2    3    0   0   1/3    33.3     0/0   0.0
Franz Anunoby          11    2    0    0   0   1/1   100.0     0/0   0.0
Tyler Beal             25    0    0    0   0   0/1     0.0     0/0   0.0
Josh Smith             11    0    0    1   0   0/0     0.0     0/0   0.0

TEAM: FG: 6/16 (37.5%), 3PT: 0/6 (0.0%), REB: 9 (2 off, 7 def), AST: 1, TO: 6
TEAM FOULS: 8 [Team_007 in BONUS]


Team_007
--------------------------------------------------------------------------------
Player                MIN  PTS  REB  AST  TO      FG   FG%      3P   3P%
--------------------------------------------------------------------------------
Jaren Dosunmu          27   16    0    2   0   5/7    71.4     0/0   0.0
Carmelo Siakam         25   10    3    1   0   4/4   100.0     0/0   0.0
John Quickley          25    2    4    0   0   1/3    33.3     0/0   0.0
Gary LaVine            11    2    0    1   0   1/2    50.0     0/0   0.0
Draymond Harris        11    2    0    0   0   1/1   100.0     0/0   0.0
Bones Siakam           25    0    5    0   0   0/0     0.0     0/0   0.0
Tobias Johnson         25    0    0    3   0   0/2     0.0     0/0   0.0

TEAM: FG: 12/19 (63.2%), 3PT: 4/9 (44.4%), REB: 12 (2 off, 10 def), AST: 7, TO: 3
TEAM FOULS: 4

================================================================================

================================================================================
                       4TH QUARTER - Team_030 vs Team_007                       
================================================================================

[12:00] Substitution (Team_030): Tyler Beal OUT (stamina: 79) → RJ Carter IN (comeback_detected)

[12:00] Substitution (Team_007): Tobias Johnson OUT (stamina: 79) → Wendell Poole IN (comeback_detected)

[12:00] Team_030 possession (Score: 61-81)
Tim Barrett attempts a 3Pt. Contested by John Quickley (3.1 feet, ZONE). Tim Barrett misses. Rebound secured by Bones Siakam.

[11:48] Team_007 possession (Score: 61-81)
John Quickley drives, picks up Jaren Green. Help arrives from RJ Carter! John Quickley attempts a Layup. Contested by RJ Carter (4.7 feet, ZONE). JOHN QUICKLEY MAKES IT! Assist: Bones Siakam
Score: 61-83

[11:35] Team_030 possession (Score: 61-83)
Jaren Green attempts a 3Pt. Contested by John Quickley (4.0 feet, MAN). Jaren Green misses. Rebound secured by Carmelo Siakam.

[11:17] Team_007 possession (Score: 61-83)
Carmelo Siakam makes the Dunk and draws the foul on Jaren Green! And-1! Carmelo Siakam to the line for 1. [Team fouls: 1] (Jaren Green: 1 personal fouls)   FT 1/1: GOOD Carmelo Siakam makes 1/1 from the line.
Score: 61-86

[11:04] Team_030 possession (Score: 61-86)
FOUL! Offensive foul on Jaren Green! John Quickley drew the charge! [Team fouls: 2] (Jaren Green: 2 personal fouls) TURNOVER! (dead ball)

[10:54] Team_007 possession (Score: 61-86)
FOUL! Shooting foul on Jaren Green. Carmelo Siakam to the line for 3 free throws. [Team fouls: 3] (Jaren Green: 3 personal fouls)   FT 1/3: GOOD   FT 2/3: GOOD   FT 3/3: GOOD Carmelo Siakam makes 3/3 from the line.
Score: 61-89

[10:42] Team_030 possession (Score: 61-89)
RJ Carter attempts a Layup. Contested by John Quickley (3.4 feet, ZONE). RJ Carter misses. Rebound secured by Carmelo Siakam.

[10:29] Team_007 possession (Score: 61-89)
Wendell Poole throws a bad pass out of bounds! TURNOVER! (dead ball)

[10:29] Substitution (Team_030): Joel Anunoby OUT → Pau James IN (stamina_rule2)

[10:29] Substitution (Team_007): Jaren Dosunmu OUT → OG Porzingis IN (stamina_rule2)

[10:18] Team_030 possession (Score: 61-89)
Jaren Green attempts a Midrange. Contested by John Quickley (4.1 feet, MAN). Jaren Green misses. Rebound secured by Bones Siakam.

[10:07] Team_007 possession (Score: 61-89)
Carmelo Siakam attempts a Midrange. Contested by Jordan Nowitzki (4.9 feet, ZONE). CARMELO SIAKAM MAKES IT!
Score: 61-91

[09:50] Team_030 possession (Score: 61-91)
Jaren Green attempts a Layup. Contested by Carmelo Siakam (5.2 feet, ZONE). JAREN GREEN MAKES IT!
Score: 63-91

[09:36] Team_007 possession (Score: 63-91)
Bones Siakam drives and kicks out. John Quickley attempts a Midrange. Contested by Jordan Nowitzki (4.6 feet, ZONE). JOHN QUICKLEY MAKES IT! Assist: Wendell Poole
Score: 63-93

[09:22] Team_030 possession (Score: 63-93)
Pau James attempts a Midrange. Contested by John Quickley (3.5 feet, ZONE). PAU JAMES MAKES IT! Assist: RJ Carter
Score: 65-93

[09:06] Team_007 possession (Score: 65-93)
Bones Siakam drives and kicks out. John Quickley attempts a 3Pt. Contested by Tim Barrett (5.0 feet, ZONE). John Quickley misses. Offensive rebound by Carmelo Siakam! Carmelo Siakam puts it back in!
Score: 65-95

[08:51] Team_030 possession (Score: 65-95)
Pau James attempts a Layup. Contested by John Quickley (3.6 feet, ZONE). PAU JAMES MAKES IT!
Score: 67-95

[08:41] Team_007 possession (Score: 67-95)
Carmelo Siakam drives and kicks out. Carmelo Siakam attempts a 3Pt. Contested by Tim Barrett (5.1 feet, ZONE). Carmelo Siakam misses. Rebound secured by Jordan Nowitzki.

[08:26] Team_030 possession (Score: 67-95)
Tim Barrett attempts a Layup. Contested by OG Porzingis (4.2 feet, MAN). TIM BARRETT MAKES IT! Assist: RJ Carter
Score: 69-95

[08:15] Team_007 possession (Score: 69-95)
John Quickley drives, Jordan Nowitzki stays with him. John Quickley attempts a Dunk. Contested by Jordan Nowitzki (5.3 feet, MAN). JOHN QUICKLEY MAKES IT! Assist: Wendell Poole
Score: 69-97

[07:57] Team_030 possession (Score: 69-97)
FOUL! Shooting foul on John Quickley. Jordan Nowitzki to the line for 2 free throws. [Team fouls: 1] (John Quickley: 1 personal fouls)   FT 1/2: GOOD   FT 2/2: MISS Jordan Nowitzki makes 1/2 from the line. Rebound secured by Bones Siakam.
Score: 70-97

[07:45] Team_007 possession (Score: 70-97)
Carmelo Siakam drives, Jaren Green stays with him. Carmelo Siakam attempts a Dunk. Contested by Jaren Green (4.8 feet, MAN). CARMELO SIAKAM MAKES IT!
Score: 70-99

[07:30] Team_030 possession (Score: 70-99)
Pau James attempts a Layup. Contested by Bones Siakam (4.3 feet, MAN). PAU JAMES MAKES IT! Assist: Jordan Nowitzki
Score: 72-99

[07:16] Team_007 possession (Score: 72-99)
OG Porzingis attempts a 3Pt. Contested by Tim Barrett (4.9 feet, ZONE). OG Porzingis misses. Rebound secured by Jaren Green.

[07:00] Team_030 possession (Score: 72-99)
RJ Carter attempts a Layup. Contested by John Quickley (4.0 feet, ZONE). RJ Carter misses. Offensive rebound by Jordan Nowitzki! Jordan Nowitzki kicks it out.

[06:41] Team_030 possession (Score: 72-99)
Tim Barrett attempts a Layup. Contested by John Quickley (3.8 feet, ZONE). TIM BARRETT MAKES IT! Assist: RJ Carter
Score: 74-99

[06:27] Team_007 possession (Score: 74-99)
John Quickley attempts a Midrange. Contested by Jordan Nowitzki (5.5 feet, MAN). John Quickley misses. Rebound secured by Jaren Green.

[06:12] Team_030 possession (Score: 74-99)
Jordan Nowitzki attempts a Midrange. Contested by John Quickley (4.4 feet, MAN). Jordan Nowitzki misses. Rebound secured by John Quickley.

[06:03] Team_007 possession (Score: 74-99)
Carmelo Siakam loses control! Ball rolls out of bounds! TURNOVER! (dead ball)

[06:03] Substitution (Team_030): Tim Barrett OUT → Josh Smith IN (stamina_rule2)

[06:03] Substitution (Team_030): Jordan Nowitzki OUT → Damian Green IN (stamina_rule2)

[06:03] Substitution (Team_030): Jaren Green OUT → Franz Anunoby IN (stamina_rule2)

[06:03] Substitution (Team_007): Bones Siakam OUT → Gary LaVine IN (stamina_rule2)

[06:03] Substitution (Team_007): John Quickley OUT → Austin Simons IN (stamina_rule2)

[06:03] Substitution (Team_007): Carmelo Siakam OUT → Draymond Harris IN (stamina_rule2)

[05:44] Team_030 possession (Score: 74-99)
Pau James attempts a 3Pt. Contested by Gary LaVine (4.3 feet, MAN). Pau James misses. Offensive rebound by Pau James! Pau James kicks it out.

[05:32] Team_030 possession (Score: 74-99)
Franz Anunoby attempts a Midrange. Contested by Austin Simons (4.1 feet, ZONE). Franz Anunoby misses. Rebound secured by Draymond Harris.

[05:16] Team_007 possession (Score: 74-99)
OG Porzingis attempts a 3Pt. Contested by Josh Smith (4.2 feet, MAN). OG PORZINGIS MAKES IT! Assist: Gary LaVine
Score: 74-102

[05:04] Team_030 possession (Score: 74-102)
Franz Anunoby attempts a Midrange. Contested by Draymond Harris (5.2 feet, MAN). Franz Anunoby misses. FOUL! Loose ball foul on Gary LaVine during the rebound battle. [Team fouls: 2] No free throws, side out. (Gary LaVine: 1 personal fouls)

[04:53] Team_030 possession (Score: 74-102)
Josh Smith drives, Austin Simons stays with him. Josh Smith attempts a Dunk. Contested by Austin Simons (4.0 feet, ZONE). JOSH SMITH MAKES IT! Assist: RJ Carter
Score: 76-102

[04:40] Team_007 possession (Score: 76-102)
FOUL! Shooting foul on Damian Green. Austin Simons to the line for 2 free throws. [Team fouls: 4] (Damian Green: 1 personal fouls)   FT 1/2: GOOD   FT 2/2: MISS Austin Simons makes 1/2 from the line. Rebound secured by Franz Anunoby.
Score: 76-103

[04:26] Team_030 possession (Score: 76-103)
Pau James commits a violation (traveling/carry)! TURNOVER! (dead ball)

[04:12] Team_007 possession (Score: 76-103)
OG Porzingis attempts a 3Pt. Contested by RJ Carter (5.5 feet, ZONE). OG Porzingis misses. Rebound secured by Damian Green.

[03:57] Team_030 possession (Score: 76-103)
RJ Carter attempts a Midrange. Contested by Wendell Poole (5.5 feet, MAN). RJ CARTER MAKES IT! Assist: Franz Anunoby
Score: 78-103

[03:44] Team_007 possession (Score: 78-103)
Draymond Harris drives, Damian Green stays with him. Draymond Harris attempts a Dunk. Contested by Damian Green (5.1 feet, ZONE). Draymond Harris misses. Rebound secured by Franz Anunoby.

[03:30] Team_030 possession (Score: 78-103)
Josh Smith drives and kicks out. Franz Anunoby attempts a 3Pt. Contested by Draymond Harris (5.0 feet, MAN). Franz Anunoby misses. Rebound secured by Draymond Harris.

[03:17] Team_007 possession (Score: 78-103)
Austin Simons attempts a Midrange. Contested by Josh Smith (5.0 feet, ZONE). AUSTIN SIMONS MAKES IT! Assist: OG Porzingis
Score: 78-105

[03:03] Team_030 possession (Score: 78-105)
FOUL! Holding foul on Gary LaVine. [Team fouls: 3] No free throws, side out. (Gary LaVine: 2 personal fouls)

[02:47] Team_030 possession (Score: 78-105)
Damian Green makes the Dunk and draws the foul on Austin Simons! And-1! Damian Green to the line for 1. [Team fouls: 4] (Austin Simons: 1 personal fouls)   FT 1/1: GOOD Damian Green makes 1/1 from the line.
Score: 81-105

[02:36] Team_007 possession (Score: 81-105)
Gary LaVine attempts a Midrange. Contested by Damian Green (5.3 feet, ZONE). GARY LAVINE MAKES IT! Assist: Austin Simons
Score: 81-107

[02:24] Team_030 possession (Score: 81-107)
Josh Smith drives, picks up OG Porzingis. Help arrives from Gary LaVine! Josh Smith attempts a Layup. Contested by Gary LaVine (4.5 feet, MAN). JOSH SMITH MAKES IT! Assist: RJ Carter
Score: 83-107

[02:06] Team_007 possession (Score: 83-107)
Wendell Poole attempts a 3Pt. Contested by Josh Smith (4.8 feet, ZONE). WENDELL POOLE MAKES IT! Assist: Gary LaVine
Score: 83-110

[01:48] Team_030 possession (Score: 83-110)
Damian Green attempts a Midrange. Contested by Austin Simons (3.6 feet, MAN). Damian Green misses. Rebound secured by Draymond Harris.

[01:33] Team_007 possession (Score: 83-110)
Austin Simons drives and kicks out. Austin Simons attempts a 3Pt. Contested by Damian Green (5.1 feet, MAN). Austin Simons misses. Offensive rebound by Austin Simons! Austin Simons puts it back in!
Score: 83-112

[01:20] Team_030 possession (Score: 83-112)
FOUL! Holding foul on Gary LaVine. [IN THE BONUS! 5 team fouls] Pau James to the line for 2 free throws. (Gary LaVine: 3 personal fouls)   FT 1/2: GOOD   FT 2/2: GOOD Pau James makes 2/2 from the line.
Score: 85-112

[01:05] Team_007 possession (Score: 85-112)
Austin Simons drives to the basket... Austin Simons throws a bad pass! Stolen by Franz Anunoby! TURNOVER! (live ball)

[00:53] Team_030 possession (Score: 85-112)
Josh Smith attempts a 3Pt. Contested by OG Porzingis (4.7 feet, MAN). Josh Smith misses. Rebound secured by Draymond Harris.

[00:43] Team_007 possession (Score: 85-112)
Austin Simons drives and kicks out. Gary LaVine attempts a 3Pt. Contested by Josh Smith (4.6 feet, ZONE). Gary LaVine misses. Rebound secured by Damian Green.

[00:30] Team_030 possession (Score: 85-112)
Pau James drives to the basket... FOUL! Offensive foul on Pau James! Gary LaVine drew the charge! [Team fouls: 5] (Pau James: 1 personal fouls) TURNOVER! (dead ball)

[00:16] Team_007 possession (Score: 85-112)
Wendell Poole attempts a 3Pt. Contested by Josh Smith (4.8 feet, ZONE). WENDELL POOLE MAKES IT! Assist: Austin Simons
Score: 85-115

[00:02] Team_030 possession (Score: 85-115)
FOUL! Shooting foul on OG Porzingis. Josh Smith to the line for 2 free throws. [BONUS: 6 team fouls] (OG Porzingis: 1 personal fouls)   FT 1/2: GOOD   FT 2/2: GOOD Josh Smith makes 2/2 from the line.
Score: 87-115

================================================================================
                              4TH QUARTER COMPLETE                              
================================================================================

4TH QUARTER SCORE: Team_030 26, Team_007 34

BOX SCORE:
================================================================================

Team_030
--------------------------------------------------------------------------------
Player                MIN  PTS  REB  AST  TO      FG   FG%      3P   3P%
--------------------------------------------------------------------------------
Pau James              20    8    1    0   0   4/4   100.0     0/0   0.0
Josh Smith             17    6    0    0   0   3/5    60.0     0/0   0.0
Tim Barrett            31    4    0    0   0   2/3    66.7     0/0   0.0
Damian Green           17    3    3    0   0   1/2    50.0     0/0   0.0
Jaren Green            31    2    2    0   0   1/3    33.3     0/0   0.0
RJ Carter              23    2    0    5   0   1/2    50.0     0/0   0.0
Jordan Nowitzki        31    0    2    1   0   0/2     0.0     0/0   0.0
Franz Anunoby          17    0    2    1   0   0/1     0.0     0/0   0.0

TEAM: FG: 12/22 (54.5%), 3PT: 0/3 (0.0%), REB: 10 (3 off, 7 def), AST: 7, TO: 3
TEAM FOULS: 5 [Team_007 in BONUS]


Team_007
--------------------------------------------------------------------------------
Player                MIN  PTS  REB  AST  TO      FG   FG%      3P   3P%
--------------------------------------------------------------------------------
Carmelo Siakam         31   12    3    0   0   5/6    83.3     0/0   0.0
John Quickley          31    6    1    0   0   3/4    75.0     0/0   0.0
Wendell Poole          23    6    0    2   0   2/2   100.0     0/0   0.0
Austin Simons          17    4    1    2   0   2/4    50.0     0/0   0.0
OG Porzingis           20    3    0    1   0   1/3    33.3     0/0   0.0
Gary LaVine            17    2    0    2   0   1/1   100.0     0/0   0.0
Bones Siakam           31    0    3    1   0   0/0     0.0     0/0   0.0
Draymond Harris        17    0    4    0   0   0/1     0.0     0/0   0.0

TEAM: FG: 14/21 (66.7%), 3PT: 4/6 (66.7%), REB: 12 (2 off, 10 def), AST: 8, TO: 3
TEAM FOULS: 6 [Team_030 in BONUS]

================================================================================

================================================================================
                               FULL GAME COMPLETE                               
================================================================================

FINAL SCORE: Team_030 87, Team_007 115

SCORING BY QUARTER:
--------------------------------------------------------------------------------
Team                     Q1     Q2     Q3     Q4    FINAL
--------------------------------------------------------------------------------
Team_030                 25     22     14     26       87
Team_007                 25     24     32     34      115
--------------------------------------------------------------------------------

FULL GAME BOX SCORE:
================================================================================

Team_030
--------------------------------------------------------------------------------
Player                MIN  PTS  REB  AST  TO      FG   FG%      3P   3P%      FT STL BLK
--------------------------------------------------------------------------------
Tim Barrett            31    9    0    0   2   3/16   18.8   0/6     0.0   0/1     0   0
Jordan Nowitzki        31   11   10    2   2   3/11   27.3   1/2    50.0   1/2     0   0
Jaren Green            31    9   10    2   3   5/10   50.0   0/2     0.0   3/3     0   0
Joel Anunoby           29   13    9    2   0   5/8    62.5   1/2    50.0   8/8     0   0
Tyler Beal             25    2    0    0   0   3/6    50.0   0/1     0.0   0/0     0   1
RJ Carter              23    9    0    5   2   3/4    75.0   1/1   100.0   2/2     0   1
Pau James              20    8    2    3   1   3/4    75.0   0/1     0.0   2/4     0   1
Josh Smith             17   14    0    1   0   6/13   46.2   2/5    40.0   2/2     0   0
Damian Green           17    3    6    0   1   1/2    50.0   0/0     0.0   1/1     1   0
Franz Anunoby          17    6    5    1   1   3/4    75.0   0/0     0.0   2/2     1   0

TEAM: FG: 36/80 (45.0%), 3PT: 5/20 (25.0%), REB: 42 (10 off, 32 def), AST: 16, TO: 12


Team_007
--------------------------------------------------------------------------------
Player                MIN  PTS  REB  AST  TO      FG   FG%      3P   3P%      FT STL BLK
--------------------------------------------------------------------------------
Bones Siakam           31    5   12    1   1   3/4    75.0   1/1   100.0   0/0     0   0
John Quickley          31   16   14    1   1   9/14   64.3   1/2    50.0   4/6     1   1
Carmelo Siakam         31   29   13    3   2  11/15   73.3   2/3    66.7   7/7     0   0
Jaren Dosunmu          29   20    0    2   3   6/11   54.5   4/7    57.1   1/1     0   2
Tobias Johnson         25    5    0    3   0   2/7    28.6   0/5     0.0   1/1     0   0
Wendell Poole          23   14    0    3   1   4/5    80.0   2/2   100.0   1/1     1   0
OG Porzingis           20    7    0    1   0   3/5    60.0   1/3    33.3   2/2     0   0
Gary LaVine            17    4    2    3   1   2/6    33.3   0/2     0.0   2/2     0   0
Austin Simons          17    8    5    4   1   4/6    66.7   1/1   100.0   2/4     1   0
Draymond Harris        17    4   10    0   1   2/5    40.0   0/0     0.0   2/2     0   0

TEAM: FG: 47/79 (59.5%), 3PT: 12/26 (46.2%), REB: 56 (12 off, 44 def), AST: 21, TO: 11

================================================================================
