================================================================================
                        FULL GAME - Team_082 vs Team_015                        
================================================================================

================================================================================
                       1ST QUARTER - Team_082 vs Team_015                       
================================================================================

[12:00] Team_082 possession (Score: 0-0)
FOUL! Shooting foul on Manu Anthony. Julius Carter to the line for 3 free throws. [Team fouls: 1] (Manu Anthony: 1 personal fouls)   FT 1/3: GOOD   FT 2/3: GOOD   FT 3/3: MISS Julius Carter makes 2/3 from the line. Offensive rebound by Jrue Green! Jrue Green kicks it out.
Score: 2-0

[11:48] Team_082 possession (Score: 2-0)
Dwyane O'Neal attempts a 3Pt. Contested by Manu Anthony (3.7 feet, ZONE). DWYANE O'NEAL MAKES IT! Assist: Julius Carter
Score: 5-0

[11:34] Team_015 possession (Score: 5-0)
FOUL! Shooting foul on Jrue Green. Trae Turner to the line for 2 free throws. [Team fouls: 1] (Jrue Green: 1 personal fouls)   FT 1/2: GOOD   FT 2/2: GOOD Trae Turner makes 2/2 from the line.
Score: 5-2

[11:21] Team_082 possession (Score: 5-2)
Julius Anthony attempts a Layup. Contested by Manu Anthony (4.0 feet, MAN). Julius Anthony misses. Rebound secured by Michael Simmons.

[11:06] Team_015 possession (Score: 5-2)
CJ Banchero attempts a Midrange. Contested by Dwyane O'Neal (3.1 feet, ZONE). CJ BANCHERO MAKES IT!
Score: 5-4

[10:52] Team_082 possession (Score: 5-4)
Julius Carter attempts a 3Pt. Contested by Manu Anthony (4.0 feet, ZONE). Julius Carter misses. Offensive rebound by Julius Carter! Julius Carter kicks it out.

[10:35] Team_082 possession (Score: 5-4)
Dwyane O'Neal drives and kicks out. Kristaps Fox attempts a Midrange. Contested by CJ Banchero (4.2 feet, MAN). KRISTAPS FOX MAKES IT!
Score: 7-4

[10:18] Team_015 possession (Score: 7-4)
CJ Banchero attempts a 3Pt. Contested by Dwyane O'Neal (3.1 feet, ZONE). CJ Banchero misses. Rebound secured by Dwyane O'Neal.

[10:02] Team_082 possession (Score: 7-4)
FOUL! Shooting foul on Manu Anthony. Kristaps Fox to the line for 3 free throws. [Team fouls: 2] (Manu Anthony: 2 personal fouls)   FT 1/3: GOOD   FT 2/3: GOOD   FT 3/3: GOOD Kristaps Fox makes 3/3 from the line.
Score: 10-4

[09:49] Team_015 possession (Score: 10-4)
Michael Simmons attempts a Midrange. Contested by Dwyane O'Neal (3.3 feet, MAN). MICHAEL SIMMONS MAKES IT!
Score: 10-6

[09:38] Team_082 possession (Score: 10-6)
Julius Anthony attempts a 3Pt. Contested by Manu Anthony (4.0 feet, MAN). JULIUS ANTHONY MAKES IT! Assist: Dwyane O'Neal
Score: 13-6

[09:21] Team_015 possession (Score: 13-6)
Trae Turner throws a bad pass! Stolen by Julius Carter! TURNOVER! (live ball)

[09:07] Team_082 possession (Score: 13-6)
Kristaps Fox throws a bad pass out of bounds! TURNOVER! (dead ball)

[08:54] Team_015 possession (Score: 13-6)
Manu Anthony attempts a 3Pt. Contested by Julius Anthony (4.8 feet, MAN). MANU ANTHONY MAKES IT! Assist: Scottie Gasol
Score: 13-9

[08:36] Team_082 possession (Score: 13-9)
Julius Anthony makes the Layup and draws the foul on Scottie Gasol! And-1! Julius Anthony to the line for 1. [Team fouls: 3] (Scottie Gasol: 1 personal fouls)   FT 1/1: GOOD Julius Anthony makes 1/1 from the line.
Score: 16-9

[08:23] Team_015 possession (Score: 16-9)
Scottie Gasol attempts a Midrange. Contested by Jrue Green (5.1 feet, MAN). Scottie Gasol misses. Offensive rebound by CJ Banchero! CJ Banchero's putback is no good. Rebound secured by Dwyane O'Neal.

[08:08] Team_082 possession (Score: 16-9)
FOUL! Holding foul on Trae Turner. [Team fouls: 4] No free throws, side out. (Trae Turner: 1 personal fouls)

[07:51] Team_082 possession (Score: 16-9)
Julius Anthony attempts a Midrange. Contested by Manu Anthony (4.0 feet, MAN). JULIUS ANTHONY MAKES IT! Assist: Kristaps Fox
Score: 18-9

[07:33] Team_015 possession (Score: 18-9)
FOUL! Offensive foul on Trae Turner! Julius Carter drew the charge! [Team fouls: 5] (Trae Turner: 2 personal fouls) TURNOVER! (dead ball)

[07:18] Team_082 possession (Score: 18-9)
Dwyane O'Neal throws a bad pass out of bounds! TURNOVER! (dead ball)

[07:03] Team_015 possession (Score: 18-9)
Trae Turner makes the Layup and draws the foul on Julius Carter! And-1! Trae Turner to the line for 1. [Team fouls: 2] (Julius Carter: 1 personal fouls)   FT 1/1: MISS Trae Turner makes 0/1 from the line. Rebound secured by Dwyane O'Neal.
Score: 18-11

[06:46] Team_082 possession (Score: 18-11)
Julius Carter drives, Scottie Gasol stays with him. Julius Carter attempts a Dunk. Contested by Scottie Gasol (3.8 feet, ZONE). Julius Carter misses. FOUL! Loose ball foul on Trae Turner during the rebound battle. [IN THE BONUS! 6 team fouls] Jrue Green to the line for 2 free throws. (Trae Turner: 3 personal fouls)   FT 1/2: GOOD   FT 2/2: MISS Jrue Green makes 1/2 from the line. Rebound secured by CJ Banchero.
Score: 19-11

[06:28] Team_015 possession (Score: 19-11)
Manu Anthony attempts a Midrange. Contested by Julius Anthony (4.8 feet, MAN). Manu Anthony misses. Rebound secured by Jrue Green.

[06:10] Team_082 possession (Score: 19-11)
Julius Anthony drives to the basket... FOUL! Offensive foul on Julius Anthony! Manu Anthony drew the charge! [Team fouls: 3] (Julius Anthony: 1 personal fouls) TURNOVER! (dead ball)

[05:57] Team_015 possession (Score: 19-11)
CJ Banchero makes the Layup and draws the foul on Jrue Green! And-1! CJ Banchero to the line for 1. [Team fouls: 4] (Jrue Green: 2 personal fouls)   FT 1/1: GOOD CJ Banchero makes 1/1 from the line.
Score: 19-14

[05:42] Team_082 possession (Score: 19-14)
Julius Carter drives and kicks out. Dwyane O'Neal attempts a Midrange. Contested by CJ Banchero (4.2 feet, ZONE). DWYANE O'NEAL MAKES IT!
Score: 21-14

[05:31] Team_015 possession (Score: 21-14)
Michael Simmons drives and kicks out. Manu Anthony attempts a 3Pt. Contested by Julius Anthony (4.5 feet, MAN). Manu Anthony misses. Rebound secured by Julius Carter.

[05:16] Team_082 possession (Score: 21-14)
Julius Carter makes the Layup and draws the foul on Trae Turner! And-1! Julius Carter to the line for 1. [BONUS: 7 team fouls] (Trae Turner: 4 personal fouls)   FT 1/1: GOOD Julius Carter makes 1/1 from the line.
Score: 24-14

[05:01] Team_015 possession (Score: 24-14)
Michael Simmons attempts a Midrange. Contested by Dwyane O'Neal (3.3 feet, ZONE). Michael Simmons misses. Rebound secured by Julius Carter.

[04:45] Team_082 possession (Score: 24-14)
Julius Carter attempts a Midrange. Contested by CJ Banchero (4.6 feet, ZONE). Julius Carter misses. Rebound secured by Michael Simmons.

[04:28] Team_015 possession (Score: 24-14)
FOUL! Reach-in foul on Julius Carter during the drive. [IN THE BONUS! 5 team fouls] Trae Turner to the line for 2 free throws. (Julius Carter: 2 personal fouls)   FT 1/2: MISS   FT 2/2: GOOD Trae Turner makes 1/2 from the line.
Score: 24-15

[04:15] Team_082 possession (Score: 24-15)
Kristaps Fox attempts a Layup. BLOCKED BY SCOTTIE GASOL! Ball goes out off Scottie Gasol. Kristaps Fox's ball!

[04:03] Team_082 possession (Score: 24-15)
Julius Carter drives, Trae Turner stays with him. Julius Carter attempts a Dunk. Contested by Trae Turner (4.1 feet, MAN). JULIUS CARTER MAKES IT!
Score: 26-15

[03:47] Team_015 possession (Score: 26-15)
FOUL! Shooting foul on Jrue Green. CJ Banchero to the line for 2 free throws. [BONUS: 6 team fouls] (Jrue Green: 3 personal fouls)   FT 1/2: GOOD   FT 2/2: GOOD CJ Banchero makes 2/2 from the line.
Score: 26-17

[03:31] Team_082 possession (Score: 26-17)
Jrue Green attempts a 3Pt. Contested by Manu Anthony (4.0 feet, ZONE). Jrue Green misses. Rebound secured by CJ Banchero.

[03:16] Team_015 possession (Score: 26-17)
CJ Banchero attempts a 3Pt. Contested by Kristaps Fox (4.2 feet, MAN). CJ Banchero misses. FOUL! Loose ball foul on Julius Carter during the rebound battle. [IN THE BONUS! 7 team fouls] CJ Banchero to the line for 2 free throws. (Julius Carter: 3 personal fouls)   FT 1/2: GOOD   FT 2/2: GOOD CJ Banchero makes 2/2 from the line.
Score: 26-19

[03:03] Team_082 possession (Score: 26-19)
Julius Anthony drives and kicks out. Jrue Green attempts a 3Pt. Contested by Scottie Gasol (3.6 feet, MAN). Jrue Green misses. Rebound secured by CJ Banchero.

[02:43] Team_015 possession (Score: 26-19)
Scottie Gasol attempts a Midrange. Contested by Dwyane O'Neal (3.5 feet, ZONE). Scottie Gasol misses. Rebound secured by Julius Carter.

[02:30] Team_082 possession (Score: 26-19)
FOUL! Reach-in foul on Scottie Gasol during the drive. [IN THE BONUS! 8 team fouls] Julius Carter to the line for 2 free throws. (Scottie Gasol: 2 personal fouls)   FT 1/2: GOOD   FT 2/2: MISS Julius Carter makes 1/2 from the line. Rebound secured by CJ Banchero.
Score: 27-19

[02:19] Team_015 possession (Score: 27-19)
Trae Turner attempts a 3Pt. Contested by Dwyane O'Neal (3.7 feet, ZONE). Trae Turner misses. Rebound secured by Dwyane O'Neal.

[02:06] Team_082 possession (Score: 27-19)
Dwyane O'Neal makes the Dunk and draws the foul on CJ Banchero! And-1! Dwyane O'Neal to the line for 1. [BONUS: 9 team fouls] (CJ Banchero: 1 personal fouls)   FT 1/1: GOOD Dwyane O'Neal makes 1/1 from the line.
Score: 30-19

[01:52] Team_015 possession (Score: 30-19)
Trae Turner drives to the basket... FOUL! Offensive foul on Trae Turner! Julius Carter drew the charge! [Team fouls: 10] (Trae Turner: 5 personal fouls) TURNOVER! (dead ball)

[01:41] Team_082 possession (Score: 30-19)
Julius Anthony makes the Layup and draws the foul on Scottie Gasol! And-1! Julius Anthony to the line for 1. [BONUS: 11 team fouls] (Scottie Gasol: 3 personal fouls)   FT 1/1: GOOD Julius Anthony makes 1/1 from the line.
Score: 33-19

[01:28] Team_015 possession (Score: 33-19)
FOUL! Reach-in foul on Julius Carter during the drive. [IN THE BONUS! 8 team fouls] Trae Turner to the line for 2 free throws. (Julius Carter: 4 personal fouls)   FT 1/2: GOOD   FT 2/2: MISS Trae Turner makes 1/2 from the line. Offensive rebound by Trae Turner! Trae Turner kicks it out.
Score: 33-20

[01:14] Team_015 possession (Score: 33-20)
CJ Banchero attempts a Layup. BLOCKED BY JRUE GREEN! Ball is loose! Rebound secured by Dwyane O'Neal.

[01:05] Team_082 possession (Score: 33-20)
Kristaps Fox attempts a 3Pt. Contested by Manu Anthony (4.1 feet, ZONE). Kristaps Fox misses. Rebound secured by CJ Banchero.

[00:53] Team_015 possession (Score: 33-20)
CJ Banchero attempts a 3Pt. Contested by Kristaps Fox (4.5 feet, MAN). CJ Banchero misses. Rebound secured by Julius Carter.

[00:39] Team_082 possession (Score: 33-20)
Jrue Green attempts a Midrange. Contested by Scottie Gasol (4.2 feet, MAN). JRUE GREEN MAKES IT!
Score: 35-20

[00:19] Team_015 possession (Score: 35-20)
CJ Banchero attempts a Midrange. Contested by Dwyane O'Neal (3.6 feet, ZONE). CJ Banchero misses. Rebound secured by Julius Carter.

================================================================================
                              1ST QUARTER COMPLETE                              
================================================================================

1ST QUARTER SCORE: Team_082 35, Team_015 20

BOX SCORE:
================================================================================

Team_082
--------------------------------------------------------------------------------
Player                MIN  PTS  REB  AST  TO      FG   FG%      3P   3P%
--------------------------------------------------------------------------------
Julius Anthony         12   11    0    0   0   4/6    66.7     0/0   0.0
Dwyane O'Neal          12    8    5    1   0   3/3   100.0     0/0   0.0
Julius Carter          12    5    6    1   0   2/5    40.0     0/0   0.0
Kristaps Fox           12    5    0    1   0   2/3    66.7     0/0   0.0
Jrue Green             12    2    2    0   0   1/2    50.0     0/0   0.0

TEAM: FG: 12/19 (63.2%), 3PT: 3/5 (60.0%), REB: 13 (3 off, 10 def), AST: 3, TO: 3
TEAM FOULS: 8 [Team_015 in BONUS]


Team_015
--------------------------------------------------------------------------------
Player                MIN  PTS  REB  AST  TO      FG   FG%      3P   3P%
--------------------------------------------------------------------------------
CJ Banchero            12    9    5    0   0   4/8    50.0     0/0   0.0
Trae Turner            12    3    1    0   0   2/4    50.0     0/0   0.0
Manu Anthony           12    3    0    0   0   1/2    50.0     0/0   0.0
Michael Simmons        12    2    2    0   0   1/3    33.3     0/0   0.0
Scottie Gasol          12    0    0    1   0   0/2     0.0     0/0   0.0

TEAM: FG: 8/19 (42.1%), 3PT: 2/5 (40.0%), REB: 8 (2 off, 6 def), AST: 1, TO: 3
TEAM FOULS: 11 [Team_082 in BONUS]

================================================================================

================================================================================
                       2ND QUARTER - Team_082 vs Team_015                       
================================================================================

[12:00] Team_082 possession (Score: 35-20)
FOUL! Shooting foul on Trae Turner. Julius Carter to the line for 2 free throws. [Team fouls: 1] (Trae Turner: 1 personal fouls)   FT 1/2: MISS   FT 2/2: GOOD Julius Carter makes 1/2 from the line.
Score: 36-20

[11:44] Team_015 possession (Score: 36-20)
Scottie Gasol attempts a Layup. Contested by Jrue Green (5.4 feet, MAN). SCOTTIE GASOL MAKES IT! Assist: Manu Anthony
Score: 36-22

[11:28] Team_082 possession (Score: 36-22)
Jrue Green attempts a 3Pt. Contested by Manu Anthony (4.2 feet, ZONE). Jrue Green misses. Rebound secured by Trae Turner.

[11:12] Team_015 possession (Score: 36-22)
CJ Banchero attempts a Midrange. Contested by Jrue Green (5.3 feet, ZONE). CJ Banchero misses. Rebound secured by Julius Carter.

[10:57] Team_082 possession (Score: 36-22)
Dwyane O'Neal attempts a Midrange. Contested by Scottie Gasol (3.9 feet, ZONE). DWYANE O'NEAL MAKES IT! Assist: Julius Anthony
Score: 38-22

[10:40] Team_015 possession (Score: 38-22)
Trae Turner drives, picks up Julius Carter. Help arrives from Dwyane O'Neal! Trae Turner attempts a Dunk. Wide open! Dwyane O'Neal is 6.2 feet away. [MAN] Trae Turner misses. Rebound secured by Julius Carter.

[10:30] Team_082 possession (Score: 38-22)
Dwyane O'Neal attempts a 3Pt. Contested by Manu Anthony (4.1 feet, ZONE). Dwyane O'Neal misses. Rebound secured by Trae Turner.

[10:11] Team_015 possession (Score: 38-22)
Scottie Gasol attempts a 3Pt. Contested by Jrue Green (5.6 feet, MAN). Scottie Gasol misses. FOUL! Loose ball foul on Julius Carter during the rebound battle. [Team fouls: 1] No free throws, side out. (Julius Carter: 1 personal fouls)

[09:56] Team_015 possession (Score: 38-22)
Trae Turner attempts a Midrange. Wide open! Julius Carter is 6.2 feet away. [MAN] Trae Turner misses. Rebound secured by Dwyane O'Neal.

[09:38] Team_082 possession (Score: 38-22)
Kristaps Fox attempts a 3Pt. Contested by Michael Simmons (4.0 feet, ZONE). Kristaps Fox misses. Rebound secured by Trae Turner.

[09:23] Team_015 possession (Score: 38-22)
Michael Simmons attempts a 3Pt. Contested by Kristaps Fox (4.8 feet, ZONE). Michael Simmons misses. Offensive rebound by CJ Banchero! CJ Banchero kicks it out.

[09:08] Team_015 possession (Score: 38-22)
Michael Simmons drives, Jrue Green stays with him. Michael Simmons attempts a Dunk. Contested by Jrue Green (5.7 feet, ZONE). MICHAEL SIMMONS MAKES IT!
Score: 38-24

[08:53] Team_082 possession (Score: 38-24)
Jrue Green attempts a Layup. BLOCKED BY MICHAEL SIMMONS! Ball is loose! Rebound secured by Trae Turner.

[08:43] Team_015 possession (Score: 38-24)
FOUL! Shooting foul on Julius Anthony. Manu Anthony to the line for 2 free throws. [Team fouls: 2] (Julius Anthony: 1 personal fouls)   FT 1/2: GOOD   FT 2/2: GOOD Manu Anthony makes 2/2 from the line.
Score: 38-26

[08:28] Team_082 possession (Score: 38-26)
Jrue Green attempts a 3Pt. Contested by Manu Anthony (4.5 feet, ZONE). Jrue Green misses. Rebound secured by Trae Turner.

[08:14] Team_015 possession (Score: 38-26)
Scottie Gasol attempts a Midrange. Contested by Dwyane O'Neal (4.0 feet, ZONE). Scottie Gasol misses. Rebound secured by Jrue Green.

[07:59] Team_082 possession (Score: 38-26)
Dwyane O'Neal drives, picks up Michael Simmons. Help arrives from CJ Banchero! Dwyane O'Neal attempts a Dunk. Contested by CJ Banchero (4.1 feet, MAN). Dwyane O'Neal misses. Rebound secured by Scottie Gasol.

[07:46] Team_015 possession (Score: 38-26)
FOUL! Offensive foul on Manu Anthony! Julius Anthony drew the charge! [Team fouls: 2] (Manu Anthony: 1 personal fouls) TURNOVER! (dead ball)

[07:31] Team_082 possession (Score: 38-26)
Dwyane O'Neal attempts a 3Pt. Contested by Manu Anthony (4.4 feet, ZONE). Dwyane O'Neal misses. Offensive rebound by Jrue Green! Jrue Green kicks it out.

[07:15] Team_082 possession (Score: 38-26)
Jrue Green attempts a 3Pt. Contested by Scottie Gasol (4.6 feet, MAN). Jrue Green misses. Rebound secured by Michael Simmons.

[07:06] Team_015 possession (Score: 38-26)
Manu Anthony drives, Jrue Green stays with him. Manu Anthony attempts a Layup. Wide open! Jrue Green is 6.2 feet away. [ZONE] MANU ANTHONY MAKES IT! Assist: Michael Simmons
Score: 38-28

[06:48] Team_082 possession (Score: 38-28)
Julius Anthony attempts a 3Pt. Contested by Manu Anthony (4.8 feet, MAN). Julius Anthony misses. Rebound secured by CJ Banchero.

[06:33] Team_015 possession (Score: 38-28)
Manu Anthony attempts a Midrange. Wide open! Jrue Green is 6.3 feet away. [ZONE] MANU ANTHONY MAKES IT!
Score: 38-30

[06:21] Team_082 possession (Score: 38-30)
Julius Anthony drives and kicks out. Jrue Green attempts a Midrange. Contested by Scottie Gasol (4.7 feet, ZONE). Jrue Green misses. Rebound secured by Michael Simmons.

[06:08] Team_015 possession (Score: 38-30)
Trae Turner drives and kicks out. Trae Turner attempts a 3Pt. Contested by Dwyane O'Neal (4.5 feet, ZONE). TRAE TURNER MAKES IT! Assist: Scottie Gasol
Score: 38-33

[05:55] Team_082 possession (Score: 38-33)
Kristaps Fox attempts a Midrange. Contested by CJ Banchero (5.3 feet, MAN). Kristaps Fox misses. Rebound secured by Michael Simmons.

[05:41] Team_015 possession (Score: 38-33)
FOUL! Shooting foul on Julius Anthony. Manu Anthony to the line for 2 free throws. [Team fouls: 3] (Julius Anthony: 2 personal fouls)   FT 1/2: GOOD   FT 2/2: GOOD Manu Anthony makes 2/2 from the line.
Score: 38-35

[05:28] Team_082 possession (Score: 38-35)
FOUL! Reach-in foul on Manu Anthony during the drive. [Team fouls: 3] No free throws, side out. (Manu Anthony: 2 personal fouls)

[05:15] Team_082 possession (Score: 38-35)
Julius Anthony attempts a 3Pt. Contested by Manu Anthony (5.0 feet, ZONE). Julius Anthony misses. Rebound secured by CJ Banchero.

[04:58] Team_015 possession (Score: 38-35)
Scottie Gasol attempts a 3Pt. Wide open! Jrue Green is 6.2 feet away. [MAN] SCOTTIE GASOL MAKES IT! Assist: CJ Banchero
Score: 38-38

[04:45] Team_082 possession (Score: 38-38)
Julius Carter drives to the basket... FOUL! Offensive foul on Julius Carter! Scottie Gasol drew the charge! [Team fouls: 4] (Julius Carter: 2 personal fouls) TURNOVER! (dead ball)

[04:28] Team_015 possession (Score: 38-38)
Manu Anthony drives, Julius Carter stays with him. Manu Anthony attempts a Layup. Wide open! Julius Carter is 6.9 feet away. [ZONE] MANU ANTHONY MAKES IT!
Score: 38-40

[04:11] Team_082 possession (Score: 38-40)
Julius Anthony attempts a 3Pt. Contested by Manu Anthony (5.2 feet, ZONE). Julius Anthony misses. Offensive rebound by Dwyane O'Neal! Dwyane O'Neal kicks it out.

[03:57] Team_082 possession (Score: 38-40)
FOUL! Holding foul on Scottie Gasol. [Team fouls: 4] No free throws, side out. (Scottie Gasol: 1 personal fouls)

[03:45] Team_082 possession (Score: 38-40)
Dwyane O'Neal attempts a 3Pt. Contested by Michael Simmons (4.8 feet, MAN). Dwyane O'Neal misses. Rebound secured by Michael Simmons.

[03:30] Team_015 possession (Score: 38-40)
FOUL! Holding foul on Jrue Green. [IN THE BONUS! 5 team fouls] Scottie Gasol to the line for 2 free throws. (Jrue Green: 1 personal fouls)   FT 1/2: GOOD   FT 2/2: GOOD Scottie Gasol makes 2/2 from the line.
Score: 38-42

[03:15] Team_082 possession (Score: 38-42)
Julius Anthony drives, Manu Anthony stays with him. Julius Anthony attempts a Layup. Contested by Manu Anthony (5.3 feet, MAN). JULIUS ANTHONY MAKES IT! Assist: Jrue Green
Score: 40-42

[02:59] Team_015 possession (Score: 40-42)
Scottie Gasol drives and kicks out. Trae Turner attempts a 3Pt. Contested by Dwyane O'Neal (5.1 feet, ZONE). Trae Turner misses. FOUL! Loose ball foul on Dwyane O'Neal during the rebound battle. [IN THE BONUS! 6 team fouls] Michael Simmons to the line for 2 free throws. (Dwyane O'Neal: 1 personal fouls)   FT 1/2: GOOD   FT 2/2: GOOD Michael Simmons makes 2/2 from the line.
Score: 40-44

[02:44] Team_082 possession (Score: 40-44)
Julius Carter attempts a Midrange. Contested by Trae Turner (5.7 feet, MAN). Julius Carter misses. Offensive rebound by Dwyane O'Neal! Dwyane O'Neal kicks it out.

[02:32] Team_082 possession (Score: 40-44)
Jrue Green attempts a 3Pt. Contested by Manu Anthony (5.3 feet, ZONE). Jrue Green misses. Rebound secured by Michael Simmons.

[02:18] Team_015 possession (Score: 40-44)
FOUL! Shooting foul on Dwyane O'Neal. CJ Banchero to the line for 3 free throws. [BONUS: 7 team fouls] (Dwyane O'Neal: 2 personal fouls)   FT 1/3: GOOD   FT 2/3: GOOD   FT 3/3: GOOD CJ Banchero makes 3/3 from the line.
Score: 40-47

[02:04] Team_082 possession (Score: 40-47)
Kristaps Fox attempts a Layup. Contested by Scottie Gasol (5.3 feet, ZONE). Kristaps Fox misses. Rebound secured by CJ Banchero.

[01:52] Team_015 possession (Score: 40-47)
Scottie Gasol drives, picks up Jrue Green. Help arrives from Dwyane O'Neal! Scottie Gasol attempts a Layup. Wide open! Dwyane O'Neal is 6.7 feet away. [MAN] Scottie Gasol misses. Rebound secured by Jrue Green.

[01:39] Team_082 possession (Score: 40-47)
Julius Anthony drives, Scottie Gasol stays with him. Julius Anthony attempts a Layup. Contested by Scottie Gasol (5.6 feet, ZONE). JULIUS ANTHONY MAKES IT! Assist: Kristaps Fox
Score: 42-47

[01:24] Team_015 possession (Score: 42-47)
Manu Anthony attempts a Midrange. Wide open! Julius Anthony is 6.4 feet away. [MAN] Manu Anthony misses. Offensive rebound by CJ Banchero! CJ Banchero kicks it out.

[01:11] Team_015 possession (Score: 42-47)
Scottie Gasol attempts a 3Pt. Contested by Dwyane O'Neal (5.2 feet, ZONE). SCOTTIE GASOL MAKES IT!
Score: 42-50

[00:58] Team_082 possession (Score: 42-50)
Jrue Green attempts a 3Pt. Contested by Manu Anthony (5.6 feet, ZONE). JRUE GREEN MAKES IT! Assist: Kristaps Fox
Score: 45-50

[00:45] Team_015 possession (Score: 45-50)
Manu Anthony attempts a 3Pt. Wide open! Julius Anthony is 6.5 feet away. [MAN] MANU ANTHONY MAKES IT! Assist: CJ Banchero
Score: 45-53

[00:26] Team_082 possession (Score: 45-53)
Dwyane O'Neal attempts a 3Pt. Contested by Manu Anthony (5.5 feet, ZONE). Dwyane O'Neal misses. Rebound secured by Scottie Gasol.

[00:14] Team_015 possession (Score: 45-53)
Manu Anthony attempts a 3Pt. Wide open! Julius Anthony is 6.6 feet away. [MAN] MANU ANTHONY MAKES IT! Assist: CJ Banchero
Score: 45-56

================================================================================
                              2ND QUARTER COMPLETE                              
================================================================================

2ND QUARTER SCORE: Team_082 10, Team_015 36

BOX SCORE:
================================================================================

Team_082
--------------------------------------------------------------------------------
Player                MIN  PTS  REB  AST  TO      FG   FG%      3P   3P%
--------------------------------------------------------------------------------
Julius Anthony         24    4    0    1   0   2/5    40.0     0/0   0.0
Jrue Green             24    3    3    1   0   1/6    16.7     0/0   0.0
Dwyane O'Neal          24    2    3    0   0   1/5    20.0     0/0   0.0
Julius Carter          24    1    2    0   0   1/1   100.0     0/0   0.0
Kristaps Fox           24    0    0    2   0   0/3     0.0     0/0   0.0

TEAM: FG: 5/20 (25.0%), 3PT: 1/11 (9.1%), REB: 8 (3 off, 5 def), AST: 4, TO: 1
TEAM FOULS: 7 [Team_015 in BONUS]


Team_015
--------------------------------------------------------------------------------
Player                MIN  PTS  REB  AST  TO      FG   FG%      3P   3P%
--------------------------------------------------------------------------------
Manu Anthony           24   16    0    1   0   7/7   100.0     0/0   0.0
Scottie Gasol          24   10    2    1   0   4/6    66.7     0/0   0.0
Michael Simmons        24    4    5    1   0   2/2   100.0     0/0   0.0
Trae Turner            24    3    5    0   0   1/3    33.3     0/0   0.0
CJ Banchero            24    3    6    3   0   1/2    50.0     0/0   0.0

TEAM: FG: 15/20 (75.0%), 3PT: 5/5 (100.0%), REB: 18 (3 off, 15 def), AST: 6, TO: 1
TEAM FOULS: 4

================================================================================

================================================================================
                       3RD QUARTER - Team_082 vs Team_015                       
================================================================================

[12:00] Team_082 possession (Score: 45-56)
Julius Anthony attempts a 3Pt. Contested by Manu Anthony (4.0 feet, MAN). JULIUS ANTHONY MAKES IT! Assist: Kristaps Fox
Score: 48-56

[11:47] Team_015 possession (Score: 48-56)
Scottie Gasol attempts a 3Pt. Contested by Dwyane O'Neal (3.3 feet, ZONE). Scottie Gasol misses. FOUL! Loose ball foul on Dwyane O'Neal during the rebound battle. [Team fouls: 1] No free throws, side out. (Dwyane O'Neal: 1 personal fouls)

[11:37] Team_015 possession (Score: 48-56)
Manu Anthony drives and kicks out. Trae Turner attempts a 3Pt. Contested by Julius Carter (5.8 feet, MAN). Trae Turner misses. Rebound secured by Jrue Green.

[11:23] Team_082 possession (Score: 48-56)
Dwyane O'Neal attempts a Layup. Contested by Michael Simmons (3.4 feet, MAN). DWYANE O'NEAL MAKES IT! Assist: Jrue Green
Score: 50-56

[11:07] Team_015 possession (Score: 50-56)
Manu Anthony attempts a Midrange. Contested by Julius Anthony (4.8 feet, MAN). Manu Anthony misses. Rebound secured by Jrue Green.

[10:54] Team_082 possession (Score: 50-56)
Dwyane O'Neal attempts a 3Pt. Contested by Michael Simmons (3.4 feet, MAN). Dwyane O'Neal misses. Rebound secured by Trae Turner.

[10:36] Team_015 possession (Score: 50-56)
CJ Banchero attempts a Midrange. Contested by Kristaps Fox (4.0 feet, MAN). CJ Banchero misses. Rebound secured by Dwyane O'Neal.

[10:23] Team_082 possession (Score: 50-56)
Kristaps Fox attempts a 3Pt. Contested by CJ Banchero (4.3 feet, MAN). Kristaps Fox misses. Rebound secured by Michael Simmons.

[10:11] Team_015 possession (Score: 50-56)
Manu Anthony drives to the basket... Manu Anthony loses control! Ball rolls out of bounds! TURNOVER! (dead ball)

[09:58] Team_082 possession (Score: 50-56)
Jrue Green attempts a Layup. Contested by Scottie Gasol (3.7 feet, MAN). JRUE GREEN MAKES IT!
Score: 52-56

[09:44] Team_015 possession (Score: 52-56)
Manu Anthony attempts a Midrange. Contested by Julius Anthony (4.8 feet, MAN). Manu Anthony misses. Rebound secured by Jrue Green.

[09:33] Team_082 possession (Score: 52-56)
Jrue Green drives to the basket... FOUL! Offensive foul on Jrue Green! Scottie Gasol drew the charge! [Team fouls: 2] (Jrue Green: 1 personal fouls) TURNOVER! (dead ball)

[09:19] Team_015 possession (Score: 52-56)
Michael Simmons attempts a 3Pt. Contested by Dwyane O'Neal (3.3 feet, MAN). Michael Simmons misses. Rebound secured by Dwyane O'Neal.

[09:08] Team_082 possession (Score: 52-56)
Jrue Green attempts a Midrange. Contested by CJ Banchero (4.5 feet, ZONE). Jrue Green misses. Rebound secured by Michael Simmons.

[08:52] Team_015 possession (Score: 52-56)
Scottie Gasol drives to the basket... Scottie Gasol throws a bad pass out of bounds! TURNOVER! (dead ball)

[08:40] Team_082 possession (Score: 52-56)
FOUL! Shooting foul on Scottie Gasol. Jrue Green to the line for 2 free throws. [Team fouls: 1] (Scottie Gasol: 1 personal fouls)   FT 1/2: MISS   FT 2/2: GOOD Jrue Green makes 1/2 from the line.
Score: 53-56

[08:23] Team_015 possession (Score: 53-56)
Trae Turner drives, picks up Julius Carter. Help arrives from Dwyane O'Neal! Trae Turner attempts a Dunk. Contested by Dwyane O'Neal (5.9 feet, MAN). Trae Turner misses. Rebound secured by Dwyane O'Neal.

[08:09] Team_082 possession (Score: 53-56)
Julius Anthony makes the Midrange and draws the foul on Manu Anthony! And-1! Julius Anthony to the line for 1. [Team fouls: 2] (Manu Anthony: 1 personal fouls)   FT 1/1: GOOD Julius Anthony makes 1/1 from the line.
Score: 56-56

[07:54] Team_015 possession (Score: 56-56)
Trae Turner makes the Layup and draws the foul on Julius Carter! And-1! Trae Turner to the line for 1. [Team fouls: 3] (Julius Carter: 1 personal fouls)   FT 1/1: GOOD Trae Turner makes 1/1 from the line.
Score: 56-59

[07:38] Team_082 possession (Score: 56-59)
Julius Carter attempts a 3Pt. Contested by Trae Turner (4.0 feet, MAN). Julius Carter misses. Rebound secured by Trae Turner.

[07:23] Team_015 possession (Score: 56-59)
Trae Turner drives to the basket... Trae Turner loses the ball! Stripped by Jrue Green! TURNOVER! (live ball)

[07:09] Team_082 possession (Score: 56-59)
Dwyane O'Neal makes the Layup and draws the foul on Scottie Gasol! And-1! Dwyane O'Neal to the line for 1. [Team fouls: 3] (Scottie Gasol: 2 personal fouls)   FT 1/1: GOOD Dwyane O'Neal makes 1/1 from the line.
Score: 59-59

[06:54] Team_015 possession (Score: 59-59)
Michael Simmons drives, Dwyane O'Neal stays with him. Michael Simmons attempts a Dunk. Contested by Dwyane O'Neal (3.3 feet, MAN). MICHAEL SIMMONS MAKES IT! Assist: Trae Turner
Score: 59-61

[06:44] Team_082 possession (Score: 59-61)
Dwyane O'Neal drives and kicks out. Jrue Green attempts a 3Pt. Contested by Scottie Gasol (3.4 feet, MAN). Jrue Green misses. Rebound secured by Michael Simmons.

[06:26] Team_015 possession (Score: 59-61)
Michael Simmons drives, Jrue Green stays with him. Michael Simmons attempts a Layup. Contested by Jrue Green (5.1 feet, ZONE). Michael Simmons misses. Rebound secured by Julius Carter.

[06:14] Team_082 possession (Score: 59-61)
Kristaps Fox drives to the basket... Kristaps Fox loses the ball! Stripped by Scottie Gasol! TURNOVER! (live ball)

[05:57] Team_015 possession (Score: 59-61)
FOUL! Holding foul on Dwyane O'Neal. [Team fouls: 4] No free throws, side out. (Dwyane O'Neal: 2 personal fouls)

[05:43] Team_015 possession (Score: 59-61)
CJ Banchero attempts a 3Pt. Contested by Kristaps Fox (4.0 feet, MAN). CJ Banchero misses. Rebound secured by Dwyane O'Neal.

[05:26] Team_082 possession (Score: 59-61)
Kristaps Fox drives, Scottie Gasol stays with him. Kristaps Fox attempts a Layup. Contested by Scottie Gasol (3.6 feet, ZONE). Kristaps Fox misses. Rebound secured by CJ Banchero.

[05:12] Team_015 possession (Score: 59-61)
Michael Simmons attempts a Layup. Contested by Dwyane O'Neal (3.3 feet, MAN). MICHAEL SIMMONS MAKES IT!
Score: 59-63

[04:57] Team_082 possession (Score: 59-63)
Jrue Green attempts a 3Pt. Contested by Scottie Gasol (3.8 feet, MAN). JRUE GREEN MAKES IT! Assist: Julius Carter
Score: 62-63

[04:39] Team_015 possession (Score: 62-63)
CJ Banchero attempts a 3Pt. Contested by Kristaps Fox (4.1 feet, MAN). CJ Banchero misses. Rebound secured by Jrue Green.

[04:28] Team_082 possession (Score: 62-63)
Jrue Green drives and kicks out. Dwyane O'Neal attempts a 3Pt. Contested by Michael Simmons (3.4 feet, MAN). Dwyane O'Neal misses. Rebound secured by CJ Banchero.

[04:12] Team_015 possession (Score: 62-63)
CJ Banchero drives and kicks out. CJ Banchero attempts a 3Pt. Contested by Dwyane O'Neal (3.4 feet, ZONE). CJ Banchero misses. Offensive rebound by CJ Banchero! CJ Banchero kicks it out.

[03:57] Team_015 possession (Score: 62-63)
Michael Simmons attempts a 3Pt. Contested by Dwyane O'Neal (3.4 feet, ZONE). Michael Simmons misses. Rebound secured by Julius Carter.

[03:45] Team_082 possession (Score: 62-63)
Julius Carter attempts a Midrange. Contested by Scottie Gasol (4.0 feet, ZONE). Julius Carter misses. Rebound secured by Michael Simmons.

[03:31] Team_015 possession (Score: 62-63)
Manu Anthony attempts a Midrange. Contested by Jrue Green (5.5 feet, ZONE). Manu Anthony misses. Offensive rebound by CJ Banchero! CJ Banchero kicks it out.

[03:15] Team_015 possession (Score: 62-63)
CJ Banchero attempts a 3Pt. Contested by Dwyane O'Neal (3.3 feet, ZONE). CJ Banchero misses. FOUL! Loose ball foul on Dwyane O'Neal during the rebound battle. [IN THE BONUS! 5 team fouls] CJ Banchero to the line for 2 free throws. (Dwyane O'Neal: 3 personal fouls)   FT 1/2: GOOD   FT 2/2: GOOD CJ Banchero makes 2/2 from the line.
Score: 62-65

[02:57] Team_082 possession (Score: 62-65)
Kristaps Fox makes the Layup and draws the foul on Scottie Gasol! And-1! Kristaps Fox to the line for 1. [Team fouls: 4] (Scottie Gasol: 3 personal fouls)   FT 1/1: GOOD Kristaps Fox makes 1/1 from the line.
Score: 65-65

[02:42] Team_015 possession (Score: 65-65)
Scottie Gasol attempts a 3Pt. Contested by Jrue Green (5.3 feet, ZONE). Scottie Gasol misses. Rebound secured by Julius Carter.

[02:30] Team_082 possession (Score: 65-65)
Dwyane O'Neal attempts a Layup. Contested by Scottie Gasol (3.8 feet, ZONE). DWYANE O'NEAL MAKES IT! Assist: Julius Anthony
Score: 67-65

[02:18] Team_015 possession (Score: 67-65)
Scottie Gasol attempts a Midrange. Contested by Jrue Green (5.4 feet, MAN). Scottie Gasol misses. Rebound secured by Dwyane O'Neal.

[02:07] Team_082 possession (Score: 67-65)
Dwyane O'Neal drives and kicks out. Jrue Green attempts a 3Pt. Contested by Scottie Gasol (3.8 feet, MAN). Jrue Green misses. Rebound secured by Michael Simmons.

[01:54] Team_015 possession (Score: 67-65)
CJ Banchero attempts a Midrange. Contested by Kristaps Fox (4.4 feet, ZONE). CJ Banchero misses. Rebound secured by Julius Carter.

[01:44] Team_082 possession (Score: 67-65)
Kristaps Fox attempts a Midrange. Contested by CJ Banchero (4.7 feet, ZONE). Kristaps Fox misses. Rebound secured by CJ Banchero.

[01:28] Team_015 possession (Score: 67-65)
Michael Simmons attempts a Midrange. Contested by Dwyane O'Neal (3.7 feet, MAN). Michael Simmons misses. Rebound secured by Julius Carter.

[01:15] Team_082 possession (Score: 67-65)
Julius Carter attempts a 3Pt. Contested by Michael Simmons (4.1 feet, ZONE). Julius Carter misses. Rebound secured by CJ Banchero.

[01:03] Team_015 possession (Score: 67-65)
Scottie Gasol attempts a Midrange. Contested by Jrue Green (5.5 feet, ZONE). Scottie Gasol misses. Rebound secured by Dwyane O'Neal.

[00:50] Team_082 possession (Score: 67-65)
Kristaps Fox attempts a 3Pt. Contested by CJ Banchero (4.8 feet, MAN). Kristaps Fox misses. Offensive rebound by Jrue Green! Jrue Green kicks it out.

[00:32] Team_082 possession (Score: 67-65)
Kristaps Fox drives, Scottie Gasol stays with him. Kristaps Fox attempts a Dunk. Contested by Scottie Gasol (4.1 feet, ZONE). Kristaps Fox misses. Rebound secured by Michael Simmons.

[00:22] Team_015 possession (Score: 67-65)
FOUL! Holding foul on Jrue Green. [IN THE BONUS! 6 team fouls] Scottie Gasol to the line for 2 free throws. (Jrue Green: 2 personal fouls)   FT 1/2: GOOD   FT 2/2: MISS Scottie Gasol makes 1/2 from the line. Rebound secured by Dwyane O'Neal.
Score: 67-66

[00:05] Team_082 possession (Score: 67-66)
Julius Anthony makes the Layup and draws the foul on Scottie Gasol! And-1! Julius Anthony to the line for 1. [BONUS: 5 team fouls] (Scottie Gasol: 4 personal fouls)   FT 1/1: GOOD Julius Anthony makes 1/1 from the line.
Score: 70-66

================================================================================
                              3RD QUARTER COMPLETE                              
================================================================================

3RD QUARTER SCORE: Team_082 25, Team_015 10

BOX SCORE:
================================================================================

Team_082
--------------------------------------------------------------------------------
Player                MIN  PTS  REB  AST  TO      FG   FG%      3P   3P%
--------------------------------------------------------------------------------
Julius Anthony         36    9    0    1   0   3/3   100.0     0/0   0.0
Dwyane O'Neal          36    7    7    0   0   3/6    50.0     0/0   0.0
Jrue Green             36    6    5    1   0   3/5    60.0     0/0   0.0
Kristaps Fox           36    3    0    1   0   1/5    20.0     0/0   0.0
Julius Carter          36    0    5    1   0   0/3     0.0     0/0   0.0

TEAM: FG: 10/22 (45.5%), 3PT: 2/6 (33.3%), REB: 17 (1 off, 16 def), AST: 4, TO: 2
TEAM FOULS: 6 [Team_015 in BONUS]


Team_015
--------------------------------------------------------------------------------
Player                MIN  PTS  REB  AST  TO      FG   FG%      3P   3P%
--------------------------------------------------------------------------------
Michael Simmons        36    4    6    0   0   2/6    33.3     0/0   0.0
Trae Turner            36    3    2    1   0   1/2    50.0     0/0   0.0
CJ Banchero            36    2    7    0   0   1/5    20.0     0/0   0.0
Manu Anthony           36    0    0    0   0   0/3     0.0     0/0   0.0
Scottie Gasol          36    0    0    0   0   0/3     0.0     0/0   0.0

TEAM: FG: 4/20 (20.0%), 3PT: 1/6 (16.7%), REB: 15 (3 off, 12 def), AST: 1, TO: 3
TEAM FOULS: 5 [Team_082 in BONUS]

================================================================================

================================================================================
                       4TH QUARTER - Team_082 vs Team_015                       
================================================================================

[12:00] Team_082 possession (Score: 70-66)
Jrue Green attempts a Midrange. Contested by Michael Simmons (4.0 feet, ZONE). Jrue Green misses. Rebound secured by CJ Banchero.

[11:45] Team_015 possession (Score: 70-66)
Manu Anthony attempts a Midrange. Contested by Julius Anthony (5.1 feet, MAN). MANU ANTHONY MAKES IT!
Score: 70-68

[11:31] Team_082 possession (Score: 70-68)
Kristaps Fox attempts a Midrange. Contested by Scottie Gasol (4.0 feet, ZONE). KRISTAPS FOX MAKES IT! Assist: Dwyane O'Neal
Score: 72-68

[11:16] Team_015 possession (Score: 72-68)
Scottie Gasol attempts a 3Pt. Contested by Jrue Green (5.5 feet, MAN). Scottie Gasol misses. Rebound secured by Jrue Green.

[11:02] Team_082 possession (Score: 72-68)
Julius Carter drives and kicks out. Kristaps Fox attempts a 3Pt. Contested by Manu Anthony (4.1 feet, ZONE). KRISTAPS FOX MAKES IT!
Score: 75-68

[10:43] Team_015 possession (Score: 75-68)
Scottie Gasol attempts a Midrange. Contested by Dwyane O'Neal (3.8 feet, ZONE). Scottie Gasol misses. FOUL! Loose ball foul on Jrue Green during the rebound battle. [Team fouls: 1] No free throws, side out. (Jrue Green: 1 personal fouls)

[10:31] Team_015 possession (Score: 75-68)
Michael Simmons attempts a 3Pt. Contested by Dwyane O'Neal (3.8 feet, ZONE). MICHAEL SIMMONS MAKES IT! Assist: CJ Banchero
Score: 75-71

[10:16] Team_082 possession (Score: 75-71)
Julius Anthony drives to the basket... FOUL! Offensive foul on Julius Anthony! Manu Anthony drew the charge! [Team fouls: 2] (Julius Anthony: 1 personal fouls) TURNOVER! (dead ball)

[10:00] Team_015 possession (Score: 75-71)
FOUL! Holding foul on Julius Anthony. [Team fouls: 3] No free throws, side out. (Julius Anthony: 2 personal fouls)

[09:43] Team_015 possession (Score: 75-71)
Trae Turner attempts a 3Pt. Contested by Jrue Green (5.8 feet, ZONE). Trae Turner misses. Rebound secured by Dwyane O'Neal.

[09:31] Team_082 possession (Score: 75-71)
Dwyane O'Neal drives, picks up Michael Simmons. Help arrives from CJ Banchero! Dwyane O'Neal attempts a Dunk. Contested by CJ Banchero (4.0 feet, MAN). Dwyane O'Neal misses. Rebound secured by Michael Simmons.

[09:15] Team_015 possession (Score: 75-71)
FOUL! Holding foul on Julius Anthony. [Team fouls: 4] No free throws, side out. (Julius Anthony: 3 personal fouls)

[09:00] Team_015 possession (Score: 75-71)
FOUL! Holding foul on Jrue Green. [IN THE BONUS! 5 team fouls] Scottie Gasol to the line for 2 free throws. (Jrue Green: 2 personal fouls)   FT 1/2: GOOD   FT 2/2: GOOD Scottie Gasol makes 2/2 from the line.
Score: 75-73

[08:47] Team_082 possession (Score: 75-73)
Julius Anthony attempts a 3Pt. Contested by Manu Anthony (4.6 feet, MAN). Julius Anthony misses. Rebound secured by CJ Banchero.

[08:35] Team_015 possession (Score: 75-73)
Michael Simmons attempts a 3Pt. Contested by Dwyane O'Neal (4.1 feet, ZONE). Michael Simmons misses. Rebound secured by Dwyane O'Neal.

[08:24] Team_082 possession (Score: 75-73)
Jrue Green attempts a Midrange. Contested by Michael Simmons (4.4 feet, ZONE). Jrue Green misses. Rebound secured by CJ Banchero.

[08:11] Team_015 possession (Score: 75-73)
CJ Banchero loses control! Ball rolls out of bounds! TURNOVER! (dead ball)

[08:11] Substitution (Team_082): Julius Anthony OUT → Jordan Rozier IN (stamina_rule2)

[08:11] Substitution (Team_082): Dwyane O'Neal OUT → Kawhi Poole IN (stamina_rule2)

[08:11] Substitution (Team_082): Kristaps Fox OUT → Shaquille Griffin IN (stamina_rule2)

[08:11] Substitution (Team_082): Jrue Green OUT → Tony Jokic IN (stamina_rule2)

[08:11] Substitution (Team_082): Julius Carter OUT → D'Angelo Parker IN (stamina_rule2)

[08:11] Substitution (Team_015): Manu Anthony OUT → Dwyane Sabonis IN (stamina_rule2)

[08:11] Substitution (Team_015): Michael Simmons OUT → Paolo Jokic IN (stamina_rule2)

[08:11] Substitution (Team_015): CJ Banchero OUT → Magic Wagner IN (stamina_rule2)

[08:11] Substitution (Team_015): Scottie Gasol OUT → Rudy Paul IN (stamina_rule2)

[08:11] Substitution (Team_015): Trae Turner OUT → Allen Curry IN (stamina_rule2)

[07:58] Team_082 possession (Score: 75-73)
D'Angelo Parker attempts a Midrange. Contested by Rudy Paul (3.7 feet, MAN). D'Angelo Parker misses. Rebound secured by Rudy Paul.

[07:43] Team_015 possession (Score: 75-73)
Allen Curry attempts a 3Pt. Contested by Tony Jokic (5.5 feet, ZONE). ALLEN CURRY MAKES IT! Assist: Paolo Jokic
Score: 75-76

[07:31] Team_082 possession (Score: 75-76)
Kawhi Poole attempts a Midrange. Wide open! Paolo Jokic is 6.2 feet away. [MAN] KAWHI POOLE MAKES IT! Assist: D'Angelo Parker
Score: 77-76

[07:16] Team_015 possession (Score: 77-76)
Paolo Jokic attempts a Midrange. Contested by Kawhi Poole (6.0 feet, MAN). PAOLO JOKIC MAKES IT! Assist: Magic Wagner
Score: 77-78

[06:58] Team_082 possession (Score: 77-78)
D'Angelo Parker drives to the basket... D'Angelo Parker commits a violation (traveling/carry)! TURNOVER! (dead ball)

[06:47] Team_015 possession (Score: 77-78)
Allen Curry drives and kicks out. Allen Curry attempts a 3Pt. Contested by Kawhi Poole (5.4 feet, ZONE). Allen Curry misses. Rebound secured by Shaquille Griffin.

[06:36] Team_082 possession (Score: 77-78)
FOUL! Shooting foul on Rudy Paul. Kawhi Poole to the line for 3 free throws. [Team fouls: 1] (Rudy Paul: 1 personal fouls)   FT 1/3: MISS   FT 2/3: MISS   FT 3/3: MISS Kawhi Poole makes 0/3 from the line. Rebound secured by Rudy Paul.

[06:24] Team_015 possession (Score: 77-78)
Dwyane Sabonis drives and kicks out. Paolo Jokic attempts a 3Pt. Contested by Kawhi Poole (5.4 feet, MAN). Paolo Jokic misses. FOUL! Loose ball foul on D'Angelo Parker during the rebound battle. [IN THE BONUS! 6 team fouls] Allen Curry to the line for 2 free throws. (D'Angelo Parker: 1 personal fouls)   FT 1/2: MISS   FT 2/2: GOOD Allen Curry makes 1/2 from the line.
Score: 77-79

[06:09] Team_082 possession (Score: 77-79)
Jordan Rozier makes the Layup and draws the foul on Rudy Paul! And-1! Jordan Rozier to the line for 1. [Team fouls: 2] (Rudy Paul: 2 personal fouls)   FT 1/1: GOOD Jordan Rozier makes 1/1 from the line.
Score: 80-79

[05:56] Team_015 possession (Score: 80-79)
FOUL! Reach-in foul on D'Angelo Parker during the drive. [IN THE BONUS! 7 team fouls] Allen Curry to the line for 2 free throws. (D'Angelo Parker: 2 personal fouls)   FT 1/2: MISS   FT 2/2: GOOD Allen Curry makes 1/2 from the line.
Score: 80-80

[05:44] Team_082 possession (Score: 80-80)
Jordan Rozier attempts a 3Pt. Contested by Dwyane Sabonis (5.0 feet, MAN). Jordan Rozier misses. FOUL! Loose ball foul on Magic Wagner during the rebound battle. [Team fouls: 3] No free throws, side out. (Magic Wagner: 1 personal fouls)

[05:26] Team_082 possession (Score: 80-80)
Jordan Rozier makes the Layup and draws the foul on Dwyane Sabonis! And-1! Jordan Rozier to the line for 1. [Team fouls: 4] (Dwyane Sabonis: 1 personal fouls)   FT 1/1: GOOD Jordan Rozier makes 1/1 from the line.
Score: 83-80

[05:09] Team_015 possession (Score: 83-80)
Rudy Paul attempts a 3Pt. Contested by Kawhi Poole (5.9 feet, ZONE). RUDY PAUL MAKES IT! Assist: Paolo Jokic
Score: 83-83

[04:55] Team_082 possession (Score: 83-83)
Kawhi Poole attempts a Midrange. Contested by Magic Wagner (5.9 feet, ZONE). KAWHI POOLE MAKES IT! Assist: Tony Jokic
Score: 85-83

[04:38] Team_015 possession (Score: 85-83)
Magic Wagner drives and kicks out. Paolo Jokic attempts a 3Pt. Contested by Kawhi Poole (5.4 feet, MAN). PAOLO JOKIC MAKES IT! Assist: Rudy Paul
Score: 85-86

[04:19] Team_082 possession (Score: 85-86)
Kawhi Poole attempts a 3Pt. Wide open! Paolo Jokic is 6.2 feet away. [MAN] KAWHI POOLE MAKES IT! Assist: D'Angelo Parker
Score: 88-86

[04:07] Team_015 possession (Score: 88-86)
Magic Wagner attempts a Midrange. Contested by D'Angelo Parker (5.0 feet, ZONE). Magic Wagner misses. Rebound secured by Shaquille Griffin.

[03:51] Team_082 possession (Score: 88-86)
Shaquille Griffin attempts a 3Pt. Contested by Magic Wagner (5.3 feet, MAN). Shaquille Griffin misses. Offensive rebound by Shaquille Griffin! Shaquille Griffin kicks it out.

[03:35] Team_082 possession (Score: 88-86)
D'Angelo Parker drives, picks up Rudy Paul. Help arrives from Dwyane Sabonis! D'Angelo Parker attempts a Layup. Contested by Dwyane Sabonis (3.7 feet, MAN). D'ANGELO PARKER MAKES IT! Assist: Tony Jokic
Score: 90-86

[03:21] Team_015 possession (Score: 90-86)
Paolo Jokic makes the Layup and draws the foul on D'Angelo Parker! And-1! Paolo Jokic to the line for 1. [BONUS: 8 team fouls] (D'Angelo Parker: 3 personal fouls)   FT 1/1: GOOD Paolo Jokic makes 1/1 from the line.
Score: 90-89

[03:09] Team_082 possession (Score: 90-89)
D'Angelo Parker attempts a Midrange. Contested by Rudy Paul (3.7 feet, MAN). D'Angelo Parker misses. FOUL! Loose ball foul on Magic Wagner during the rebound battle. [IN THE BONUS! 5 team fouls] Tony Jokic to the line for 2 free throws. (Magic Wagner: 2 personal fouls)   FT 1/2: GOOD   FT 2/2: MISS Tony Jokic makes 1/2 from the line. Rebound secured by Magic Wagner.
Score: 91-89

[02:53] Team_015 possession (Score: 91-89)
Allen Curry drives, picks up D'Angelo Parker. Help arrives from Kawhi Poole! Allen Curry attempts a Layup. Contested by Kawhi Poole (5.4 feet, ZONE). ALLEN CURRY MAKES IT! Assist: Magic Wagner
Score: 91-91

[02:44] Team_082 possession (Score: 91-91)
Shaquille Griffin attempts a Midrange. Contested by Magic Wagner (5.3 feet, MAN). Shaquille Griffin misses. Rebound secured by Allen Curry.

[02:27] Team_015 possession (Score: 91-91)
Dwyane Sabonis drives, Jordan Rozier stays with him. Dwyane Sabonis attempts a Dunk. Wide open! Jordan Rozier is 6.2 feet away. [MAN] DWYANE SABONIS MAKES IT!
Score: 91-93

[02:09] Team_082 possession (Score: 91-93)
Tony Jokic makes the Layup and draws the foul on Rudy Paul! And-1! Tony Jokic to the line for 1. [BONUS: 6 team fouls] (Rudy Paul: 3 personal fouls)   FT 1/1: GOOD Tony Jokic makes 1/1 from the line.
Score: 94-93

[01:57] Team_015 possession (Score: 94-93)
Rudy Paul makes the Layup and draws the foul on D'Angelo Parker! And-1! Rudy Paul to the line for 1. [BONUS: 9 team fouls] (D'Angelo Parker: 4 personal fouls)   FT 1/1: MISS Rudy Paul makes 0/1 from the line. Rebound secured by Shaquille Griffin.
Score: 94-95

[01:45] Team_082 possession (Score: 94-95)
Shaquille Griffin attempts a Midrange. Contested by Magic Wagner (5.3 feet, MAN). Shaquille Griffin misses. Rebound secured by Allen Curry.

[01:30] Team_015 possession (Score: 94-95)
Allen Curry makes the Layup and draws the foul on D'Angelo Parker! And-1! Allen Curry to the line for 1. [BONUS: 10 team fouls] (D'Angelo Parker: 5 personal fouls)   FT 1/1: MISS Allen Curry makes 0/1 from the line. Rebound secured by Tony Jokic.
Score: 94-97

[01:14] Team_082 possession (Score: 94-97)
Shaquille Griffin makes the Midrange and draws the foul on Magic Wagner! And-1! Shaquille Griffin to the line for 1. [BONUS: 7 team fouls] (Magic Wagner: 3 personal fouls)   FT 1/1: GOOD Shaquille Griffin makes 1/1 from the line.
Score: 97-97

[01:02] Team_015 possession (Score: 97-97)
Dwyane Sabonis attempts a 3Pt. Wide open! Jordan Rozier is 6.2 feet away. [MAN] DWYANE SABONIS MAKES IT! Assist: Magic Wagner
Score: 97-100

[00:46] Team_082 possession (Score: 97-100)
D'Angelo Parker attempts a Layup. Contested by Rudy Paul (3.7 feet, ZONE). D'ANGELO PARKER MAKES IT! Assist: Shaquille Griffin
Score: 99-100

[00:31] Team_015 possession (Score: 99-100)
Paolo Jokic attempts a Midrange. Wide open! Kawhi Poole is 6.0 feet away. [ZONE] PAOLO JOKIC MAKES IT! Assist: Magic Wagner
Score: 99-102

[00:16] Team_082 possession (Score: 99-102)
Tony Jokic drives to the basket... Tony Jokic throws a bad pass! Stolen by Rudy Paul! TURNOVER! (live ball)

[00:05] Team_015 possession (Score: 99-102)
Paolo Jokic drives, D'Angelo Parker stays with him. Paolo Jokic attempts a Dunk. Contested by D'Angelo Parker (5.6 feet, ZONE). Paolo Jokic misses. Rebound secured by Shaquille Griffin.

================================================================================
                              4TH QUARTER COMPLETE                              
================================================================================

4TH QUARTER SCORE: Team_082 29, Team_015 36

BOX SCORE:
================================================================================

Team_082
--------------------------------------------------------------------------------
Player                MIN  PTS  REB  AST  TO      FG   FG%      3P   3P%
--------------------------------------------------------------------------------
Kawhi Poole             8    7    0    0   0   3/4    75.0     0/0   0.0
Jordan Rozier           8    6    0    0   0   2/2   100.0     0/0   0.0
Kristaps Fox           40    5    0    0   0   2/2   100.0     0/0   0.0
D'Angelo Parker         8    4    0    2   0   2/4    50.0     0/0   0.0
Shaquille Griffin       8    3    6    1   0   1/3    33.3     0/0   0.0
Tony Jokic              8    3    1    2   0   1/1   100.0     0/0   0.0
Jrue Green             40    0    1    0   0   0/2     0.0     0/0   0.0
Dwyane O'Neal          40    0    2    1   0   0/1     0.0     0/0   0.0
Julius Anthony         40    0    0    0   0   0/1     0.0     0/0   0.0

TEAM: FG: 11/20 (55.0%), 3PT: 1/3 (33.3%), REB: 11 (3 off, 8 def), AST: 6, TO: 3
TEAM FOULS: 10 [Team_015 in BONUS]


Team_015
--------------------------------------------------------------------------------
Player                MIN  PTS  REB  AST  TO      FG   FG%      3P   3P%
--------------------------------------------------------------------------------
Paolo Jokic             8   10    0    2   0   4/5    80.0     0/0   0.0
Allen Curry             8    7    2    0   0   4/6    66.7     0/0   0.0
Dwyane Sabonis          8    5    0    0   0   2/2   100.0     0/0   0.0
Michael Simmons        40    3    1    0   0   1/2    50.0     0/0   0.0
Rudy Paul               8    3    2    1   0   1/2    50.0     0/0   0.0
Manu Anthony           40    2    0    0   0   1/1   100.0     0/0   0.0
Scottie Gasol          40    2    0    0   0   1/2    50.0     0/0   0.0
CJ Banchero            40    0    4    1   0   0/0     0.0     0/0   0.0
Trae Turner            40    0    0    0   0   0/1     0.0     0/0   0.0
Magic Wagner            8    0    1    4   0   0/1     0.0     0/0   0.0

TEAM: FG: 14/22 (63.6%), 3PT: 4/7 (57.1%), REB: 9 (1 off, 8 def), AST: 8, TO: 1
TEAM FOULS: 7 [Team_082 in BONUS]

================================================================================

================================================================================
                               FULL GAME COMPLETE                               
================================================================================

FINAL SCORE: Team_082 99, Team_015 102

SCORING BY QUARTER:
--------------------------------------------------------------------------------
Team                     Q1     Q2     Q3     Q4    FINAL
--------------------------------------------------------------------------------
Team_082                 35     10     25     29       99
Team_015                 20     36     10     36      102
--------------------------------------------------------------------------------

FULL GAME BOX SCORE:
================================================================================

Team_082
--------------------------------------------------------------------------------
Player                MIN  PTS  REB  AST  TO      FG   FG%      3P   3P%      FT STL BLK
--------------------------------------------------------------------------------
Julius Anthony         40   24    0    2   1   9/15   60.0   2/5    40.0   4/4     0   0
Dwyane O'Neal          40   17   17    2   2   7/15   46.7   1/5    20.0   2/2     0   0
Kristaps Fox           40   13    0    4   2   3/11   27.3   1/4    25.0   4/4     0   0
Jrue Green             40   11   11    2   1   5/15   33.3   2/7    28.6   2/4     1   1
Julius Carter          40    6   13    2   1   5/11   45.5   0/2     0.0   5/8     1   0
Jordan Rozier           8    6    0    0   0   2/2   100.0   0/0     0.0   2/2     0   0
Kawhi Poole             8    7    0    0   0   3/4    75.0   1/2    50.0   0/3     0   0
Shaquille Griffin       8    3    6    1   1   1/3    33.3   0/0     0.0   1/1     0   0
Tony Jokic              8    3    1    2   1   1/1   100.0   0/0     0.0   2/3     0   0
D'Angelo Parker         8    4    0    2   0   2/4    50.0   0/0     0.0   0/0     0   0

TEAM: FG: 38/81 (46.9%), 3PT: 7/25 (28.0%), REB: 49 (10 off, 39 def), AST: 17, TO: 9


Team_015
--------------------------------------------------------------------------------
Player                MIN  PTS  REB  AST  TO      FG   FG%      3P   3P%      FT STL BLK
--------------------------------------------------------------------------------
Manu Anthony           40   21    0    1   1   9/13   69.2   3/3   100.0   4/4     0   0
Michael Simmons        40   13   14    1   2   5/12   41.7   1/4    25.0   2/2     0   1
CJ Banchero            40   14   22    4   1   6/15   40.0   3/7    42.9  10/10    0   0
Scottie Gasol          40   12    2    2   1   4/12   33.3   2/4    50.0   5/6     1   1
Trae Turner            40    9    8    1   3   4/10   40.0   0/2     0.0   5/8     0   0
Dwyane Sabonis          8    5    0    0   0   3/3   100.0   1/1   100.0   0/0     0   0
Paolo Jokic             8   10    0    2   0   3/4    75.0   0/0     0.0   1/1     0   0
Magic Wagner            8    0    1    4   0   1/2    50.0   0/0     0.0   0/0     0   0
Rudy Paul               8    3    2    1   0   1/2    50.0   1/1   100.0   0/1     1   0
Allen Curry             8    7    2    0   0   3/5    60.0   1/1   100.0   2/5     0   0

TEAM: FG: 41/81 (50.6%), 3PT: 12/23 (52.2%), REB: 50 (9 off, 41 def), AST: 16, TO: 8

================================================================================
