================================================================================
                        FULL GAME - Team_031 vs Team_033                        
================================================================================

================================================================================
                       1ST QUARTER - Team_031 vs Team_033                       
================================================================================

[12:00] Team_031 possession (Score: 0-0)
Gary Morant makes the 3Pt and draws the foul on Joel Green! And-1! Gary Morant to the line for 1. [Team fouls: 1] (Joel Green: 1 personal fouls)   FT 1/1: GOOD Gary Morant makes 1/1 from the line.
Score: 4-0

[11:44] Team_033 possession (Score: 4-0)
Desmond DeRozan drives, picks up Immanuel James. Help arrives from Shai Durant! Desmond DeRozan attempts a Dunk. Contested by Shai Durant (3.0 feet, MAN). Desmond DeRozan misses. Offensive rebound by Bradley Simmons! Bradley Simmons puts it back in!
Score: 4-2

[11:29] Team_031 possession (Score: 4-2)
Shai Durant drives and kicks out. Shai Durant attempts a 3Pt. Contested by Joel Green (4.3 feet, MAN). Shai Durant misses. Rebound secured by Bradley Simmons.

[11:12] Team_033 possession (Score: 4-2)
Desmond DeRozan drives, Immanuel James stays with him. Desmond DeRozan attempts a Dunk. Contested by Immanuel James (3.0 feet, ZONE). DESMOND DEROZAN MAKES IT! Assist: Bradley Simmons
Score: 4-4

[10:55] Team_031 possession (Score: 4-4)
Immanuel James drives and kicks out. Gary Morant attempts a 3Pt. Contested by Chris Anunoby (3.8 feet, MAN). GARY MORANT MAKES IT! Assist: Pau Irving
Score: 7-4

[10:39] Team_033 possession (Score: 7-4)
Desmond DeRozan drives, Immanuel James stays with him. Desmond DeRozan attempts a Layup. Contested by Immanuel James (3.0 feet, ZONE). DESMOND DEROZAN MAKES IT!
Score: 7-6

[10:29] Team_031 possession (Score: 7-6)
Immanuel James attempts a 3Pt. Contested by Joel Green (4.7 feet, ZONE). IMMANUEL JAMES MAKES IT!
Score: 10-6

[10:16] Team_033 possession (Score: 10-6)
Desmond DeRozan attempts a Layup. BLOCKED BY IMMANUEL JAMES! Ball deflects out of bounds off Desmond DeRozan.

[09:57] Team_031 possession (Score: 10-6)
Shai Durant attempts a 3Pt. Contested by Joel Green (4.4 feet, ZONE). SHAI DURANT MAKES IT!
Score: 13-6

[09:42] Team_033 possession (Score: 13-6)
Desmond DeRozan attempts a Layup. Contested by Immanuel James (3.0 feet, MAN). Desmond DeRozan misses. Rebound secured by Immanuel James.

[09:27] Team_031 possession (Score: 13-6)
Pau Irving drives, Bradley Simmons stays with him. Pau Irving attempts a Dunk. Contested by Bradley Simmons (3.1 feet, ZONE). Pau Irving misses. Rebound secured by Desmond DeRozan.

[09:09] Team_033 possession (Score: 13-6)
Joel Green drives, Shai Durant stays with him. Joel Green attempts a Dunk. Contested by Shai Durant (4.2 feet, MAN). JOEL GREEN MAKES IT!
Score: 13-8

[08:56] Team_031 possession (Score: 13-8)
Shai Durant attempts a Layup. BLOCKED BY BRADLEY SIMMONS! Ball is loose! Rebound secured by Bradley Simmons.

[08:40] Team_033 possession (Score: 13-8)
FOUL! Reach-in foul on Immanuel James during the drive. [Team fouls: 1] No free throws, side out. (Immanuel James: 1 personal fouls)

[08:28] Team_033 possession (Score: 13-8)
FOUL! Offensive foul on Chris Anunoby! Gary Morant drew the charge! [Team fouls: 2] (Chris Anunoby: 1 personal fouls) TURNOVER! (dead ball)

[08:16] Team_031 possession (Score: 13-8)
Pau Irving attempts a Layup. BLOCKED BY BRADLEY SIMMONS! Ball is loose! Rebound secured by Bradley Simmons.

[08:00] Team_033 possession (Score: 13-8)
Cade Randle attempts a Midrange. Contested by Pau Irving (4.1 feet, MAN). Cade Randle misses. Offensive rebound by Desmond DeRozan! Desmond DeRozan kicks it out.

[07:47] Team_033 possession (Score: 13-8)
Chris Anunoby drives, Gary Morant stays with him. Chris Anunoby attempts a Dunk. Contested by Gary Morant (3.7 feet, MAN). Chris Anunoby misses. Offensive rebound by Bradley Simmons! Bradley Simmons puts it back in!
Score: 13-10

[07:29] Team_031 possession (Score: 13-10)
Shai Durant attempts a Midrange. Contested by Bradley Simmons (3.2 feet, ZONE). SHAI DURANT MAKES IT! Assist: Gary Morant
Score: 15-10

[07:16] Team_033 possession (Score: 15-10)
Joel Green makes the 3Pt and draws the foul on Gary Morant! And-1! Joel Green to the line for 1. [Team fouls: 2] (Gary Morant: 1 personal fouls)   FT 1/1: GOOD Joel Green makes 1/1 from the line.
Score: 15-14

[06:59] Team_031 possession (Score: 15-14)
Gary Morant attempts a 3Pt. Contested by Joel Green (4.9 feet, ZONE). Gary Morant misses. Rebound secured by Cade Randle.

[06:50] Team_033 possession (Score: 15-14)
Chris Anunoby drives and kicks out. FOUL! Shooting foul on Immanuel James. Desmond DeRozan to the line for 3 free throws. [Team fouls: 3] (Immanuel James: 2 personal fouls)   FT 1/3: GOOD   FT 2/3: GOOD   FT 3/3: MISS Desmond DeRozan makes 2/3 from the line. Offensive rebound by Bradley Simmons! Bradley Simmons puts it back in!
Score: 15-18

[06:35] Team_031 possession (Score: 15-18)
Shai Durant attempts a 3Pt. Contested by Joel Green (4.4 feet, MAN). Shai Durant misses. Offensive rebound by Luka Sabonis! Luka Sabonis puts it back in!
Score: 17-18

[06:26] Team_033 possession (Score: 17-18)
Chris Anunoby attempts a Midrange. Contested by Luka Sabonis (3.1 feet, ZONE). CHRIS ANUNOBY MAKES IT! Assist: Joel Green
Score: 17-20

[06:13] Team_031 possession (Score: 17-20)
Shai Durant drives, Joel Green stays with him. Shai Durant attempts a Layup. Contested by Joel Green (4.4 feet, MAN). SHAI DURANT MAKES IT! Assist: Luka Sabonis
Score: 19-20

[06:02] Team_033 possession (Score: 19-20)
Chris Anunoby attempts a 3Pt. Contested by Pau Irving (3.5 feet, ZONE). CHRIS ANUNOBY MAKES IT! Assist: Bradley Simmons
Score: 19-23

[05:43] Team_031 possession (Score: 19-23)
Immanuel James attempts a 3Pt. Contested by Joel Green (4.7 feet, ZONE). Immanuel James misses. Rebound secured by Cade Randle.

[05:28] Team_033 possession (Score: 19-23)
Desmond DeRozan drives and kicks out. Chris Anunoby attempts a 3Pt. Contested by Gary Morant (3.8 feet, ZONE). Chris Anunoby misses. Rebound secured by Immanuel James.

[05:12] Team_031 possession (Score: 19-23)
Immanuel James attempts a 3Pt. Contested by Desmond DeRozan (5.3 feet, MAN). Immanuel James misses. Rebound secured by Cade Randle.

[04:57] Team_033 possession (Score: 19-23)
Chris Anunoby drives and kicks out. Chris Anunoby attempts a 3Pt. Contested by Pau Irving (3.6 feet, ZONE). Chris Anunoby misses. Offensive rebound by Cade Randle! Cade Randle puts it back in!
Score: 19-25

[04:44] Team_031 possession (Score: 19-25)
Immanuel James attempts a Midrange. Contested by Desmond DeRozan (5.3 feet, ZONE). Immanuel James misses. Rebound secured by Desmond DeRozan.

[04:31] Team_033 possession (Score: 19-25)
Joel Green attempts a Layup. Contested by Luka Sabonis (3.6 feet, ZONE). JOEL GREEN MAKES IT! Assist: Cade Randle
Score: 19-27

[04:21] Team_031 possession (Score: 19-27)
Pau Irving attempts a 3Pt. Contested by Joel Green (4.4 feet, ZONE). Pau Irving misses. Rebound secured by Bradley Simmons.

[04:08] Team_033 possession (Score: 19-27)
Desmond DeRozan attempts a 3Pt. Contested by Pau Irving (3.7 feet, ZONE). Desmond DeRozan misses. Rebound secured by Immanuel James.

[03:54] Team_031 possession (Score: 19-27)
Luka Sabonis attempts a Layup. Contested by Bradley Simmons (3.8 feet, MAN). LUKA SABONIS MAKES IT! Assist: Pau Irving
Score: 21-27

[03:40] Team_033 possession (Score: 21-27)
Bradley Simmons makes the Dunk and draws the foul on Shai Durant! And-1! Bradley Simmons to the line for 1. [Team fouls: 4] (Shai Durant: 1 personal fouls)   FT 1/1: GOOD Bradley Simmons makes 1/1 from the line.
Score: 21-30

[03:26] Team_031 possession (Score: 21-30)
Pau Irving attempts a Midrange. Contested by Chris Anunoby (4.1 feet, ZONE). PAU IRVING MAKES IT!
Score: 23-30

[03:16] Team_033 possession (Score: 23-30)
Bradley Simmons attempts a Midrange. Contested by Shai Durant (4.0 feet, ZONE). Bradley Simmons misses. Offensive rebound by Bradley Simmons! Bradley Simmons puts it back in!
Score: 23-32

[02:59] Team_031 possession (Score: 23-32)
Gary Morant attempts a Midrange. Contested by Chris Anunoby (4.7 feet, MAN). Gary Morant misses. Rebound secured by Desmond DeRozan.

[02:45] Team_033 possession (Score: 23-32)
Cade Randle attempts a 3Pt. Contested by Pau Irving (4.4 feet, MAN). Cade Randle misses. Rebound secured by Gary Morant.

[02:33] Team_031 possession (Score: 23-32)
Luka Sabonis drives and kicks out. Immanuel James attempts a 3Pt. Contested by Joel Green (4.6 feet, ZONE). Immanuel James misses. Rebound secured by Desmond DeRozan.

[02:19] Team_033 possession (Score: 23-32)
Chris Anunoby attempts a Midrange. Contested by Gary Morant (4.0 feet, MAN). CHRIS ANUNOBY MAKES IT! Assist: Bradley Simmons
Score: 23-34

[02:10] Team_031 possession (Score: 23-34)
FOUL! Reach-in foul on Bradley Simmons during the drive. [Team fouls: 3] No free throws, side out. (Bradley Simmons: 1 personal fouls)

[01:58] Team_031 possession (Score: 23-34)
Luka Sabonis drives to the basket... Luka Sabonis commits a violation (traveling/carry)! TURNOVER! (dead ball)

[01:58] Substitution (Team_031): Shai Durant OUT → Kevin Morant IN (stamina_rule2)

[01:58] Substitution (Team_031): Gary Morant OUT → Isaiah Ingram IN (stamina_rule2)

[01:58] Substitution (Team_031): Pau Irving OUT → Miles Stewart IN (stamina_rule2)

[01:58] Substitution (Team_031): Immanuel James OUT → Kobe Randle IN (stamina_rule2)

[01:58] Substitution (Team_031): Luka Sabonis OUT → Jimmy Poole IN (stamina_rule2)

[01:58] Substitution (Team_033): Joel Green OUT → Ben Anthony IN (stamina_rule2)

[01:58] Substitution (Team_033): Chris Anunoby OUT → Manu Irving IN (stamina_rule2)

[01:58] Substitution (Team_033): Cade Randle OUT → Terry Jokic IN (stamina_rule2)

[01:58] Substitution (Team_033): Desmond DeRozan OUT → Zion Adebayo IN (stamina_rule2)

[01:58] Substitution (Team_033): Bradley Simmons OUT → Tim Griffin IN (stamina_rule2)

[01:44] Team_033 possession (Score: 23-34)
FOUL! Shooting foul on Isaiah Ingram. Zion Adebayo to the line for 2 free throws. [BONUS: 5 team fouls] (Isaiah Ingram: 1 personal fouls)   FT 1/2: GOOD   FT 2/2: GOOD Zion Adebayo makes 2/2 from the line.
Score: 23-36

[01:29] Team_031 possession (Score: 23-36)
Kevin Morant makes the Layup and draws the foul on Ben Anthony! And-1! Kevin Morant to the line for 1. [Team fouls: 4] (Ben Anthony: 1 personal fouls)   FT 1/1: GOOD Kevin Morant makes 1/1 from the line.
Score: 26-36

[01:13] Team_033 possession (Score: 26-36)
Zion Adebayo attempts a 3Pt. Contested by Miles Stewart (5.5 feet, ZONE). ZION ADEBAYO MAKES IT! Assist: Ben Anthony
Score: 26-39

[01:03] Team_031 possession (Score: 26-39)
Kevin Morant drives to the basket... Kevin Morant loses control! Ball rolls out of bounds! TURNOVER! (dead ball)

[00:51] Team_033 possession (Score: 26-39)
FOUL! Reach-in foul on Miles Stewart during the drive. [IN THE BONUS! 6 team fouls] Terry Jokic to the line for 2 free throws. (Miles Stewart: 1 personal fouls)   FT 1/2: GOOD   FT 2/2: GOOD Terry Jokic makes 2/2 from the line.
Score: 26-41

[00:38] Team_031 possession (Score: 26-41)
Miles Stewart attempts a 3Pt. Contested by Terry Jokic (3.8 feet, MAN). Miles Stewart misses. Rebound secured by Tim Griffin.

[00:24] Team_033 possession (Score: 26-41)
Terry Jokic attempts a 3Pt. Contested by Miles Stewart (5.8 feet, ZONE). Terry Jokic misses. FOUL! Loose ball foul on Kobe Randle during the rebound battle. [IN THE BONUS! 7 team fouls] Terry Jokic to the line for 2 free throws. (Kobe Randle: 1 personal fouls)   FT 1/2: GOOD   FT 2/2: MISS Terry Jokic makes 1/2 from the line. Rebound secured by Kobe Randle.
Score: 26-42

[00:10] Team_031 possession (Score: 26-42)
Kobe Randle drives and kicks out. Kobe Randle attempts a Midrange. Contested by Terry Jokic (3.8 feet, ZONE). KOBE RANDLE MAKES IT! Assist: Miles Stewart
Score: 28-42

================================================================================
                              1ST QUARTER COMPLETE                              
================================================================================

1ST QUARTER SCORE: Team_031 28, Team_033 42

BOX SCORE:
================================================================================

Team_031
--------------------------------------------------------------------------------
Player                MIN  PTS  REB  AST  TO      FG   FG%      3P   3P%
--------------------------------------------------------------------------------
Gary Morant            10    7    1    1   0   2/4    50.0     0/0   0.0
Shai Durant            10    7    0    0   0   3/5    60.0     0/0   0.0
Luka Sabonis           10    4    1    1   0   2/3    66.7     0/0   0.0
Immanuel James         10    3    3    0   0   1/4    25.0     0/0   0.0
Kevin Morant            2    3    0    0   0   1/1   100.0     0/0   0.0
Pau Irving             10    2    0    2   0   1/4    25.0     0/0   0.0
Kobe Randle             2    2    1    0   0   1/1   100.0     0/0   0.0
Miles Stewart           2    0    0    1   0   0/1     0.0     0/0   0.0

TEAM: FG: 11/23 (47.8%), 3PT: 4/9 (44.4%), REB: 5 (1 off, 4 def), AST: 5, TO: 2
TEAM FOULS: 7 [Team_033 in BONUS]


Team_033
--------------------------------------------------------------------------------
Player                MIN  PTS  REB  AST  TO      FG   FG%      3P   3P%
--------------------------------------------------------------------------------
Bradley Simmons        10   13    7    3   0   5/5   100.0     0/0   0.0
Joel Green             10    8    0    1   0   3/3   100.0     0/0   0.0
Chris Anunoby          10    7    0    0   0   3/3   100.0     0/0   0.0
Zion Adebayo            2    5    0    0   0   2/2   100.0     0/0   0.0
Desmond DeRozan        10    4    5    0   0   2/6    33.3     0/0   0.0
Cade Randle            10    2    4    1   0   1/2    50.0     0/0   0.0
Terry Jokic             2    2    0    0   0   1/2    50.0     0/0   0.0
Ben Anthony             2    0    0    1   0   0/0     0.0     0/0   0.0
Tim Griffin             2    0    1    0   0   0/0     0.0     0/0   0.0

TEAM: FG: 17/23 (73.9%), 3PT: 3/6 (50.0%), REB: 18 (6 off, 12 def), AST: 6, TO: 1
TEAM FOULS: 4

================================================================================

================================================================================
                       2ND QUARTER - Team_031 vs Team_033                       
================================================================================

[12:00] Team_031 possession (Score: 28-42)
Gary Morant attempts a 3Pt. Contested by Joel Green (4.9 feet, ZONE). GARY MORANT MAKES IT!
Score: 31-42

[11:46] Team_033 possession (Score: 31-42)
Chris Anunoby attempts a Midrange. Contested by Gary Morant (3.8 feet, MAN). Chris Anunoby misses. Offensive rebound by Bradley Simmons! Bradley Simmons puts it back in!
Score: 31-44

[11:31] Team_031 possession (Score: 31-44)
Shai Durant attempts a 3Pt. Contested by Joel Green (4.5 feet, MAN). Shai Durant misses. Rebound secured by Bradley Simmons.

[11:20] Team_033 possession (Score: 31-44)
Chris Anunoby loses the ball! Stripped by Gary Morant! TURNOVER! (live ball)

[11:04] Team_031 possession (Score: 31-44)
FOUL! Holding foul on Chris Anunoby. [Team fouls: 1] No free throws, side out. (Chris Anunoby: 1 personal fouls)

[10:51] Team_031 possession (Score: 31-44)
FOUL! Shooting foul on Desmond DeRozan. Immanuel James to the line for 2 free throws. [Team fouls: 2] (Desmond DeRozan: 1 personal fouls)   FT 1/2: GOOD   FT 2/2: GOOD Immanuel James makes 2/2 from the line.
Score: 33-44

[10:33] Team_033 possession (Score: 33-44)
Desmond DeRozan throws a bad pass! Stolen by Immanuel James! TURNOVER! (live ball)

[10:16] Team_031 possession (Score: 33-44)
Pau Irving attempts a 3Pt. Contested by Joel Green (4.6 feet, ZONE). Pau Irving misses. Rebound secured by Bradley Simmons.

[09:57] Team_033 possession (Score: 33-44)
Chris Anunoby attempts a Midrange. Contested by Gary Morant (3.9 feet, MAN). Chris Anunoby misses. Rebound secured by Luka Sabonis.

[09:45] Team_031 possession (Score: 33-44)
Luka Sabonis drives and kicks out. Luka Sabonis attempts a 3Pt. Contested by Joel Green (4.6 feet, ZONE). Luka Sabonis misses. Rebound secured by Cade Randle.

[09:30] Team_033 possession (Score: 33-44)
Joel Green attempts a 3Pt. BLOCKED BY PAU IRVING! Ball is loose! Rebound secured by Immanuel James.

[09:13] Team_031 possession (Score: 33-44)
Pau Irving attempts a 3Pt. Contested by Cade Randle (3.3 feet, MAN). Pau Irving misses. Rebound secured by Desmond DeRozan.

[08:57] Team_033 possession (Score: 33-44)
Joel Green attempts a 3Pt. Contested by Pau Irving (4.3 feet, ZONE). JOEL GREEN MAKES IT! Assist: Cade Randle
Score: 33-47

[08:40] Team_031 possession (Score: 33-47)
Luka Sabonis attempts a Midrange. Contested by Chris Anunoby (4.8 feet, ZONE). LUKA SABONIS MAKES IT! Assist: Gary Morant
Score: 35-47

[08:23] Team_033 possession (Score: 35-47)
Desmond DeRozan attempts a Layup. Contested by Immanuel James (3.7 feet, MAN). DESMOND DEROZAN MAKES IT!
Score: 35-49

[08:12] Team_031 possession (Score: 35-49)
Pau Irving attempts a 3Pt. Contested by Cade Randle (3.4 feet, ZONE). PAU IRVING MAKES IT! Assist: Shai Durant
Score: 38-49

[07:54] Team_033 possession (Score: 38-49)
Bradley Simmons drives, Luka Sabonis stays with him. Bradley Simmons attempts a Dunk. Contested by Luka Sabonis (3.7 feet, MAN). BRADLEY SIMMONS MAKES IT!
Score: 38-51

[07:38] Team_031 possession (Score: 38-51)
Luka Sabonis attempts a Midrange. Contested by Desmond DeRozan (5.9 feet, ZONE). Luka Sabonis misses. Rebound secured by Cade Randle.

[07:25] Team_033 possession (Score: 38-51)
Cade Randle drives, Immanuel James stays with him. Cade Randle attempts a Dunk. Contested by Immanuel James (4.3 feet, ZONE). Cade Randle misses. Rebound secured by Immanuel James.

[07:12] Team_031 possession (Score: 38-51)
Pau Irving makes the 3Pt and draws the foul on Cade Randle! And-1! Pau Irving to the line for 1. [Team fouls: 3] (Cade Randle: 1 personal fouls)   FT 1/1: MISS Pau Irving makes 0/1 from the line. Rebound secured by Cade Randle.
Score: 41-51

[06:54] Team_033 possession (Score: 41-51)
FOUL! Reach-in foul on Gary Morant during the drive. [Team fouls: 1] No free throws, side out. (Gary Morant: 1 personal fouls)

[06:38] Team_033 possession (Score: 41-51)
FOUL! Holding foul on Gary Morant. [Team fouls: 2] No free throws, side out. (Gary Morant: 2 personal fouls)

[06:21] Team_033 possession (Score: 41-51)
Desmond DeRozan drives and kicks out. Joel Green attempts a 3Pt. Contested by Shai Durant (4.6 feet, MAN). Joel Green misses. Offensive rebound by Bradley Simmons! Bradley Simmons's putback is no good. Rebound secured by Luka Sabonis.

[06:07] Team_031 possession (Score: 41-51)
FOUL! Reach-in foul on Desmond DeRozan during the drive. [Team fouls: 4] No free throws, side out. (Desmond DeRozan: 2 personal fouls)

[05:51] Team_031 possession (Score: 41-51)
Shai Durant attempts a Layup. Contested by Bradley Simmons (4.0 feet, ZONE). Shai Durant misses. Offensive rebound by Immanuel James! Immanuel James kicks it out.

[05:35] Team_031 possession (Score: 41-51)
Gary Morant attempts a Midrange. Contested by Cade Randle (4.2 feet, ZONE). Gary Morant misses. Rebound secured by Desmond DeRozan.

[05:17] Team_033 possession (Score: 41-51)
Chris Anunoby attempts a 3Pt. Contested by Pau Irving (4.3 feet, ZONE). CHRIS ANUNOBY MAKES IT! Assist: Desmond DeRozan
Score: 41-54

[05:04] Team_031 possession (Score: 41-54)
Immanuel James attempts a Layup. Contested by Bradley Simmons (4.3 feet, ZONE). Immanuel James misses. Offensive rebound by Immanuel James! Immanuel James kicks it out.

[04:49] Team_031 possession (Score: 41-54)
Gary Morant attempts a 3Pt. Contested by Cade Randle (4.3 feet, ZONE). Gary Morant misses. Rebound secured by Bradley Simmons.

[04:34] Team_033 possession (Score: 41-54)
Desmond DeRozan drives to the basket... Desmond DeRozan throws a bad pass out of bounds! TURNOVER! (dead ball)

[04:34] Substitution (Team_031): Shai Durant OUT → Kevin Morant IN (stamina_rule2)

[04:34] Substitution (Team_031): Gary Morant OUT → Isaiah Ingram IN (stamina_rule2)

[04:34] Substitution (Team_031): Pau Irving OUT → Miles Stewart IN (stamina_rule2)

[04:34] Substitution (Team_031): Immanuel James OUT → Kobe Randle IN (stamina_rule2)

[04:34] Substitution (Team_031): Luka Sabonis OUT → Jimmy Poole IN (stamina_rule2)

[04:34] Substitution (Team_033): Joel Green OUT → Ben Anthony IN (stamina_rule2)

[04:34] Substitution (Team_033): Chris Anunoby OUT → Manu Irving IN (stamina_rule2)

[04:34] Substitution (Team_033): Cade Randle OUT → Terry Jokic IN (stamina_rule2)

[04:34] Substitution (Team_033): Desmond DeRozan OUT → Zion Adebayo IN (stamina_rule2)

[04:34] Substitution (Team_033): Bradley Simmons OUT → Tim Griffin IN (stamina_rule2)

[04:15] Team_031 possession (Score: 41-54)
Isaiah Ingram attempts a 3Pt. Contested by Manu Irving (5.1 feet, MAN). ISAIAH INGRAM MAKES IT! Assist: Miles Stewart
Score: 44-54

[03:58] Team_033 possession (Score: 44-54)
FOUL! Reach-in foul on Kobe Randle during the drive. [Team fouls: 3] No free throws, side out. (Kobe Randle: 1 personal fouls)

[03:43] Team_033 possession (Score: 44-54)
Manu Irving attempts a Midrange. Contested by Miles Stewart (5.5 feet, ZONE). MANU IRVING MAKES IT! Assist: Terry Jokic
Score: 44-56

[03:29] Team_031 possession (Score: 44-56)
Kobe Randle makes the Midrange and draws the foul on Terry Jokic! And-1! Kobe Randle to the line for 1. [BONUS: 5 team fouls] (Terry Jokic: 1 personal fouls)   FT 1/1: GOOD Kobe Randle makes 1/1 from the line.
Score: 47-56

[03:14] Team_033 possession (Score: 47-56)
Tim Griffin drives to the basket... Tim Griffin throws a bad pass out of bounds! TURNOVER! (dead ball)

[02:58] Team_031 possession (Score: 47-56)
Kevin Morant attempts a 3Pt. Contested by Manu Irving (4.8 feet, ZONE). Kevin Morant misses. Rebound secured by Tim Griffin.

[02:48] Team_033 possession (Score: 47-56)
Zion Adebayo drives and kicks out. Tim Griffin attempts a Midrange. Contested by Jimmy Poole (5.7 feet, MAN). Tim Griffin misses. Rebound secured by Isaiah Ingram.

[02:34] Team_031 possession (Score: 47-56)
Kevin Morant throws a bad pass! Stolen by Ben Anthony! TURNOVER! (live ball)

[02:21] Team_033 possession (Score: 47-56)
Manu Irving attempts a Midrange. Contested by Isaiah Ingram (4.4 feet, MAN). MANU IRVING MAKES IT! Assist: Zion Adebayo
Score: 47-58

[02:06] Team_031 possession (Score: 47-58)
Miles Stewart drives to the basket... Miles Stewart loses the ball! Stripped by Terry Jokic! TURNOVER! (live ball)

[01:53] Team_033 possession (Score: 47-58)
Tim Griffin drives and kicks out. Manu Irving attempts a Midrange. Contested by Isaiah Ingram (4.3 feet, MAN). Manu Irving misses. Rebound secured by Jimmy Poole.

[01:35] Team_031 possession (Score: 47-58)
Kobe Randle attempts a 3Pt. Contested by Zion Adebayo (5.1 feet, MAN). Kobe Randle misses. Rebound secured by Terry Jokic.

[01:20] Team_033 possession (Score: 47-58)
Ben Anthony throws a bad pass! Stolen by Kevin Morant! TURNOVER! (live ball)

[01:05] Team_031 possession (Score: 47-58)
Kevin Morant drives and kicks out. Kevin Morant attempts a 3Pt. Contested by Ben Anthony (4.8 feet, ZONE). Kevin Morant misses. Rebound secured by Tim Griffin.

[00:54] Team_033 possession (Score: 47-58)
Manu Irving drives and kicks out. Terry Jokic attempts a Midrange. Contested by Miles Stewart (5.3 feet, MAN). Terry Jokic misses. Rebound secured by Kobe Randle.

[00:44] Team_031 possession (Score: 47-58)
Miles Stewart drives to the basket... Miles Stewart throws a bad pass! Stolen by Terry Jokic! TURNOVER! (live ball)

[00:30] Team_033 possession (Score: 47-58)
Tim Griffin drives and kicks out. FOUL! Shooting foul on Miles Stewart. Terry Jokic to the line for 3 free throws. [Team fouls: 4] (Miles Stewart: 1 personal fouls)   FT 1/3: GOOD   FT 2/3: GOOD   FT 3/3: GOOD Terry Jokic makes 3/3 from the line.
Score: 47-61

[00:12] Team_031 possession (Score: 47-61)
Jimmy Poole commits a violation (traveling/carry)! TURNOVER! (dead ball)

[00:02] Team_033 possession (Score: 47-61)
Zion Adebayo makes the Layup and draws the foul on Isaiah Ingram! And-1! Zion Adebayo to the line for 1. [BONUS: 5 team fouls] (Isaiah Ingram: 1 personal fouls)   FT 1/1: GOOD Zion Adebayo makes 1/1 from the line.
Score: 47-64

================================================================================
                              2ND QUARTER COMPLETE                              
================================================================================

2ND QUARTER SCORE: Team_031 19, Team_033 22

BOX SCORE:
================================================================================

Team_031
--------------------------------------------------------------------------------
Player                MIN  PTS  REB  AST  TO      FG   FG%      3P   3P%
--------------------------------------------------------------------------------
Gary Morant            18    3    0    1   0   1/3    33.3     0/0   0.0
Pau Irving             18    3    0    0   0   1/4    25.0     0/0   0.0
Isaiah Ingram           6    3    1    0   0   1/1   100.0     0/0   0.0
Kobe Randle             6    3    1    0   0   1/2    50.0     0/0   0.0
Immanuel James         18    2    4    0   0   1/1   100.0     0/0   0.0
Shai Durant            18    0    0    1   0   0/1     0.0     0/0   0.0
Miles Stewart           6    0    0    1   0   0/0     0.0     0/0   0.0
Kevin Morant            6    0    0    0   0   0/2     0.0     0/0   0.0
Jimmy Poole             6    0    1    0   0   0/0     0.0     0/0   0.0

TEAM: FG: 6/17 (35.3%), 3PT: 3/10 (30.0%), REB: 8 (2 off, 6 def), AST: 3, TO: 4
TEAM FOULS: 5 [Team_033 in BONUS]


Team_033
--------------------------------------------------------------------------------
Player                MIN  PTS  REB  AST  TO      FG   FG%      3P   3P%
--------------------------------------------------------------------------------
Bradley Simmons        18    4    4    0   0   2/2   100.0     0/0   0.0
Manu Irving             6    4    0    0   0   2/3    66.7     0/0   0.0
Chris Anunoby          18    3    0    0   0   1/2    50.0     0/0   0.0
Joel Green             18    3    0    0   0   1/2    50.0     0/0   0.0
Terry Jokic             6    3    1    1   0   1/1   100.0     0/0   0.0
Zion Adebayo            6    3    0    1   0   1/2    50.0     0/0   0.0
Luka Sabonis           18    2    2    0   0   1/3    33.3     0/0   0.0
Desmond DeRozan        18    2    2    1   0   1/2    50.0     0/0   0.0
Cade Randle            18    0    3    1   0   0/1     0.0     0/0   0.0
Tim Griffin             6    0    2    0   0   0/1     0.0     0/0   0.0

TEAM: FG: 9/16 (56.2%), 3PT: 2/3 (66.7%), REB: 13 (2 off, 11 def), AST: 4, TO: 5
TEAM FOULS: 5 [Team_031 in BONUS]

================================================================================

================================================================================
                       3RD QUARTER - Team_031 vs Team_033                       
================================================================================

[12:00] Team_031 possession (Score: 47-64)
Shai Durant drives to the basket... Shai Durant throws a bad pass out of bounds! TURNOVER! (dead ball)

[11:46] Team_033 possession (Score: 47-64)
Chris Anunoby drives, picks up Gary Morant. Help arrives from Pau Irving! Chris Anunoby attempts a Layup. Contested by Pau Irving (3.7 feet, MAN). CHRIS ANUNOBY MAKES IT!
Score: 47-66

[11:32] Team_031 possession (Score: 47-66)
Shai Durant attempts a 3Pt. Contested by Joel Green (4.4 feet, MAN). SHAI DURANT MAKES IT! Assist: Luka Sabonis
Score: 50-66

[11:13] Team_033 possession (Score: 50-66)
Bradley Simmons drives to the basket... Bradley Simmons throws a bad pass! Stolen by Luka Sabonis! TURNOVER! (live ball)

[10:59] Team_031 possession (Score: 50-66)
Immanuel James drives, picks up Desmond DeRozan. Help arrives from Chris Anunoby! Immanuel James attempts a Layup. Contested by Chris Anunoby (5.2 feet, MAN). IMMANUEL JAMES MAKES IT! Assist: Shai Durant
Score: 52-66

[10:42] Team_033 possession (Score: 52-66)
Joel Green attempts a 3Pt. Contested by Pau Irving (3.9 feet, ZONE). Joel Green misses. Rebound secured by Luka Sabonis.

[10:24] Team_031 possession (Score: 52-66)
Immanuel James drives to the basket... Immanuel James throws a bad pass out of bounds! TURNOVER! (dead ball)

[10:07] Team_033 possession (Score: 52-66)
Joel Green drives, Immanuel James stays with him. Joel Green attempts a Layup. Contested by Immanuel James (3.3 feet, ZONE). JOEL GREEN MAKES IT! Assist: Bradley Simmons
Score: 52-68

[09:54] Team_031 possession (Score: 52-68)
Gary Morant attempts a 3Pt. Contested by Chris Anunoby (4.4 feet, MAN). Gary Morant misses. Rebound secured by Bradley Simmons.

[09:40] Team_033 possession (Score: 52-68)
FOUL! Shooting foul on Immanuel James. Cade Randle to the line for 2 free throws. [Team fouls: 1] (Immanuel James: 1 personal fouls)   FT 1/2: GOOD   FT 2/2: GOOD Cade Randle makes 2/2 from the line.
Score: 52-70

[09:24] Team_031 possession (Score: 52-70)
Shai Durant makes the Layup and draws the foul on Cade Randle! And-1! Shai Durant to the line for 1. [Team fouls: 1] (Cade Randle: 1 personal fouls)   FT 1/1: GOOD Shai Durant makes 1/1 from the line.
Score: 55-70

[09:13] Team_033 possession (Score: 55-70)
Chris Anunoby drives and kicks out. Joel Green attempts a 3Pt. Contested by Shai Durant (3.9 feet, MAN). Joel Green misses. Rebound secured by Luka Sabonis.

[09:01] Team_031 possession (Score: 55-70)
Shai Durant attempts a 3Pt. Contested by Joel Green (4.4 feet, MAN). Shai Durant misses. Rebound secured by Desmond DeRozan.

[08:46] Team_033 possession (Score: 55-70)
Bradley Simmons drives, picks up Luka Sabonis. Help arrives from Shai Durant! Bradley Simmons attempts a Layup. Contested by Shai Durant (3.1 feet, MAN). BRADLEY SIMMONS MAKES IT! Assist: Cade Randle
Score: 55-72

[08:27] Team_031 possession (Score: 55-72)
Shai Durant attempts a 3Pt. Contested by Joel Green (4.4 feet, ZONE). SHAI DURANT MAKES IT! Assist: Gary Morant
Score: 58-72

[08:15] Team_033 possession (Score: 58-72)
FOUL! Shooting foul on Gary Morant. Chris Anunoby to the line for 3 free throws. [Team fouls: 2] (Gary Morant: 1 personal fouls)   FT 1/3: GOOD   FT 2/3: GOOD   FT 3/3: GOOD Chris Anunoby makes 3/3 from the line.
Score: 58-75

[08:00] Team_031 possession (Score: 58-75)
Shai Durant attempts a 3Pt. Contested by Joel Green (4.4 feet, MAN). Shai Durant misses. Rebound secured by Bradley Simmons.

[07:45] Team_033 possession (Score: 58-75)
Bradley Simmons attempts a Layup. Contested by Luka Sabonis (3.1 feet, MAN). Bradley Simmons misses. Rebound secured by Immanuel James.

[07:35] Team_031 possession (Score: 58-75)
Immanuel James attempts a Midrange. Contested by Desmond DeRozan (5.2 feet, MAN). IMMANUEL JAMES MAKES IT!
Score: 60-75

[07:17] Team_033 possession (Score: 60-75)
Joel Green attempts a 3Pt. Contested by Pau Irving (3.9 feet, ZONE). Joel Green misses. FOUL! Loose ball foul on Luka Sabonis during the rebound battle. [Team fouls: 3] No free throws, side out. (Luka Sabonis: 1 personal fouls)

[07:07] Team_033 possession (Score: 60-75)
FOUL! Reach-in foul on Immanuel James during the drive. [Team fouls: 4] No free throws, side out. (Immanuel James: 2 personal fouls)

[06:50] Team_033 possession (Score: 60-75)
Chris Anunoby drives, Immanuel James stays with him. Chris Anunoby attempts a Dunk. Contested by Immanuel James (3.0 feet, ZONE). CHRIS ANUNOBY MAKES IT! Assist: Bradley Simmons
Score: 60-77

[06:38] Team_031 possession (Score: 60-77)
Luka Sabonis attempts a Dunk. BLOCKED BY BRADLEY SIMMONS! Ball is loose! Rebound secured by Desmond DeRozan.

[06:24] Team_033 possession (Score: 60-77)
Chris Anunoby makes the Dunk and draws the foul on Gary Morant! And-1! Chris Anunoby to the line for 1. [BONUS: 5 team fouls] (Gary Morant: 2 personal fouls)   FT 1/1: GOOD Chris Anunoby makes 1/1 from the line.
Score: 60-80

[06:13] Team_031 possession (Score: 60-80)
Gary Morant drives to the basket... Gary Morant commits a violation (traveling/carry)! TURNOVER! (dead ball)

[05:54] Team_033 possession (Score: 60-80)
Cade Randle attempts a 3Pt. Contested by Pau Irving (4.1 feet, MAN). Cade Randle misses. Offensive rebound by Bradley Simmons! Bradley Simmons puts it back in!
Score: 60-82

[05:41] Team_031 possession (Score: 60-82)
Pau Irving attempts a 3Pt. Contested by Cade Randle (3.1 feet, MAN). Pau Irving misses. Rebound secured by Cade Randle.

[05:25] Team_033 possession (Score: 60-82)
Bradley Simmons throws a bad pass out of bounds! TURNOVER! (dead ball)

[05:07] Team_031 possession (Score: 60-82)
FOUL! Reach-in foul on Desmond DeRozan during the drive. [Team fouls: 2] No free throws, side out. (Desmond DeRozan: 1 personal fouls)

[04:56] Team_031 possession (Score: 60-82)
Shai Durant attempts a Midrange. Contested by Cade Randle (3.1 feet, ZONE). Shai Durant misses. Rebound secured by Desmond DeRozan.

[04:39] Team_033 possession (Score: 60-82)
Bradley Simmons makes the Layup and draws the foul on Immanuel James! And-1! Bradley Simmons to the line for 1. [BONUS: 6 team fouls] (Immanuel James: 3 personal fouls)   FT 1/1: GOOD Bradley Simmons makes 1/1 from the line.
Score: 60-85

[04:22] Team_031 possession (Score: 60-85)
Gary Morant drives, Bradley Simmons stays with him. Gary Morant attempts a Dunk. Contested by Bradley Simmons (3.7 feet, ZONE). Gary Morant misses. Rebound secured by Cade Randle.

[04:04] Team_033 possession (Score: 60-85)
Chris Anunoby attempts a 3Pt. Contested by Gary Morant (3.8 feet, MAN). Chris Anunoby misses. Offensive rebound by Cade Randle! Cade Randle puts it back in!
Score: 60-87

[03:50] Team_031 possession (Score: 60-87)
Gary Morant attempts a 3Pt. Contested by Chris Anunoby (4.6 feet, MAN). Gary Morant misses. Rebound secured by Bradley Simmons.

[03:34] Team_033 possession (Score: 60-87)
Desmond DeRozan attempts a Midrange. Contested by Immanuel James (3.3 feet, MAN). Desmond DeRozan misses. Rebound secured by Luka Sabonis.

[03:20] Team_031 possession (Score: 60-87)
Shai Durant attempts a 3Pt. Contested by Joel Green (4.6 feet, MAN). SHAI DURANT MAKES IT! Assist: Gary Morant
Score: 63-87

[03:05] Team_033 possession (Score: 63-87)
Joel Green attempts a Midrange. Contested by Shai Durant (4.3 feet, MAN). Joel Green misses. Offensive rebound by Cade Randle! Cade Randle's putback is no good. Rebound secured by Luka Sabonis.

[02:54] Team_031 possession (Score: 63-87)
Pau Irving attempts a Midrange. Contested by Cade Randle (3.2 feet, ZONE). PAU IRVING MAKES IT! Assist: Immanuel James
Score: 65-87

[02:38] Team_033 possession (Score: 65-87)
Bradley Simmons attempts a 3Pt. Contested by Luka Sabonis (3.4 feet, MAN). BRADLEY SIMMONS MAKES IT! Assist: Joel Green
Score: 65-90

[02:25] Team_031 possession (Score: 65-90)
Luka Sabonis makes the Layup and draws the foul on Bradley Simmons! And-1! Luka Sabonis to the line for 1. [Team fouls: 3] (Bradley Simmons: 1 personal fouls)   FT 1/1: GOOD Luka Sabonis makes 1/1 from the line.
Score: 68-90

[02:11] Team_033 possession (Score: 68-90)
Bradley Simmons attempts a Midrange. Contested by Luka Sabonis (3.5 feet, MAN). Bradley Simmons misses. Rebound secured by Immanuel James.

[01:58] Team_031 possession (Score: 68-90)
Pau Irving drives, picks up Cade Randle. Help arrives from Chris Anunoby! Pau Irving attempts a Dunk. Contested by Chris Anunoby (3.3 feet, MAN). Pau Irving misses. Offensive rebound by Luka Sabonis! Luka Sabonis puts it back in!
Score: 70-90

[01:41] Team_033 possession (Score: 70-90)
Joel Green attempts a Layup. Contested by Shai Durant (4.5 feet, MAN). Joel Green misses. Rebound secured by Gary Morant.

[01:27] Team_031 possession (Score: 70-90)
Shai Durant attempts a 3Pt. Contested by Joel Green (4.7 feet, ZONE). Shai Durant misses. Rebound secured by Bradley Simmons.

[01:13] Team_033 possession (Score: 70-90)
Bradley Simmons attempts a Midrange. Contested by Immanuel James (3.5 feet, ZONE). BRADLEY SIMMONS MAKES IT!
Score: 70-92

[00:57] Team_031 possession (Score: 70-92)
Shai Durant attempts a 3Pt. Contested by Joel Green (4.8 feet, ZONE). Shai Durant misses. Rebound secured by Bradley Simmons.

[00:46] Team_033 possession (Score: 70-92)
Joel Green attempts a 3Pt. Contested by Pau Irving (4.3 feet, ZONE). JOEL GREEN MAKES IT! Assist: Cade Randle
Score: 70-95

[00:35] Team_031 possession (Score: 70-95)
Shai Durant attempts a Midrange. Contested by Joel Green (4.8 feet, MAN). Shai Durant misses. Rebound secured by Cade Randle.

[00:22] Team_033 possession (Score: 70-95)
Chris Anunoby attempts a 3Pt. Contested by Shai Durant (4.3 feet, ZONE). Chris Anunoby misses. Rebound secured by Gary Morant.

[00:08] Team_031 possession (Score: 70-95)
Immanuel James loses the ball! Stripped by Desmond DeRozan! TURNOVER! (live ball)

================================================================================
                              3RD QUARTER COMPLETE                              
================================================================================

3RD QUARTER SCORE: Team_031 23, Team_033 31

BOX SCORE:
================================================================================

Team_031
--------------------------------------------------------------------------------
Player                MIN  PTS  REB  AST  TO      FG   FG%      3P   3P%
--------------------------------------------------------------------------------
Shai Durant            30   12    0    1   0   4/10   40.0     0/0   0.0
Luka Sabonis           30    5    5    1   0   2/3    66.7     0/0   0.0
Immanuel James         30    4    2    1   0   2/2   100.0     0/0   0.0
Pau Irving             30    2    0    0   0   1/2    50.0     0/0   0.0
Gary Morant            30    0    2    2   0   0/3     0.0     0/0   0.0

TEAM: FG: 9/20 (45.0%), 3PT: 3/10 (30.0%), REB: 8 (1 off, 7 def), AST: 5, TO: 4
TEAM FOULS: 6 [Team_033 in BONUS]


Team_033
--------------------------------------------------------------------------------
Player                MIN  PTS  REB  AST  TO      FG   FG%      3P   3P%
--------------------------------------------------------------------------------
Bradley Simmons        30   12    6    2   0   5/7    71.4     0/0   0.0
Chris Anunoby          30   10    0    0   0   4/6    66.7     0/0   0.0
Joel Green             30    5    0    1   0   2/5    40.0     0/0   0.0
Cade Randle            30    4    4    2   0   2/2   100.0     0/0   0.0
Desmond DeRozan        30    0    4    0   0   0/1     0.0     0/0   0.0

TEAM: FG: 13/21 (61.9%), 3PT: 5/7 (71.4%), REB: 15 (4 off, 11 def), AST: 5, TO: 2
TEAM FOULS: 3

================================================================================

================================================================================
                       4TH QUARTER - Team_031 vs Team_033                       
================================================================================

[12:00] Substitution (Team_031): Shai Durant OUT (stamina: 70) → Kevin Morant IN (comeback_detected)

[12:00] Substitution (Team_033): Joel Green OUT (stamina: 70) → Ben Anthony IN (comeback_detected)

[12:00] Team_031 possession (Score: 70-95)
Luka Sabonis attempts a Midrange. Contested by Bradley Simmons (4.0 feet, MAN). Luka Sabonis misses. Rebound secured by Desmond DeRozan.

[11:42] Team_033 possession (Score: 70-95)
Desmond DeRozan attempts a Layup. Contested by Immanuel James (3.6 feet, MAN). DESMOND DEROZAN MAKES IT! Assist: Bradley Simmons
Score: 70-97

[11:28] Team_031 possession (Score: 70-97)
Gary Morant attempts a 3Pt. Contested by Cade Randle (3.8 feet, ZONE). Gary Morant misses. Rebound secured by Bradley Simmons.

[11:14] Team_033 possession (Score: 70-97)
Cade Randle attempts a 3Pt. Contested by Pau Irving (4.5 feet, MAN). Cade Randle misses. Offensive rebound by Bradley Simmons! Bradley Simmons's putback is no good. Rebound secured by Immanuel James.

[11:02] Team_031 possession (Score: 70-97)
Luka Sabonis drives, Bradley Simmons stays with him. Luka Sabonis attempts a Dunk. Contested by Bradley Simmons (4.1 feet, MAN). LUKA SABONIS MAKES IT! Assist: Pau Irving
Score: 72-97

[10:50] Team_033 possession (Score: 72-97)
FOUL! Shooting foul on Pau Irving. Ben Anthony to the line for 3 free throws. [Team fouls: 1] (Pau Irving: 1 personal fouls)   FT 1/3: GOOD   FT 2/3: GOOD   FT 3/3: GOOD Ben Anthony makes 3/3 from the line.
Score: 72-100

[10:37] Team_031 possession (Score: 72-100)
FOUL! Holding foul on Bradley Simmons. [Team fouls: 1] No free throws, side out. (Bradley Simmons: 1 personal fouls)

[10:22] Team_031 possession (Score: 72-100)
Pau Irving makes the Layup and draws the foul on Bradley Simmons! And-1! Pau Irving to the line for 1. [Team fouls: 2] (Bradley Simmons: 2 personal fouls)   FT 1/1: GOOD Pau Irving makes 1/1 from the line.
Score: 75-100

[10:09] Team_033 possession (Score: 75-100)
Chris Anunoby attempts a Layup. BLOCKED BY IMMANUEL JAMES! Ball deflects out of bounds off Chris Anunoby.

[09:53] Team_031 possession (Score: 75-100)
Gary Morant attempts a Layup. Contested by Chris Anunoby (5.0 feet, MAN). GARY MORANT MAKES IT! Assist: Luka Sabonis
Score: 77-100

[09:39] Team_033 possession (Score: 77-100)
Chris Anunoby attempts a 3Pt. Contested by Pau Irving (4.1 feet, ZONE). Chris Anunoby misses. Rebound secured by Luka Sabonis.

[09:21] Team_031 possession (Score: 77-100)
Kevin Morant attempts a 3Pt. Contested by Ben Anthony (4.8 feet, MAN). KEVIN MORANT MAKES IT!
Score: 80-100

[09:08] Team_033 possession (Score: 80-100)
FOUL! Shooting foul on Immanuel James. Chris Anunoby to the line for 2 free throws. [Team fouls: 2] (Immanuel James: 1 personal fouls)   FT 1/2: MISS   FT 2/2: GOOD Chris Anunoby makes 1/2 from the line.
Score: 80-101

[08:55] Team_031 possession (Score: 80-101)
Immanuel James attempts a Midrange. Contested by Chris Anunoby (4.9 feet, ZONE). Immanuel James misses. Offensive rebound by Luka Sabonis! Luka Sabonis puts it back in!
Score: 82-101

[08:37] Team_033 possession (Score: 82-101)
Desmond DeRozan throws a bad pass out of bounds! TURNOVER! (dead ball)

[08:37] Substitution (Team_031): Gary Morant OUT → Isaiah Ingram IN (stamina_rule2)

[08:37] Substitution (Team_031): Pau Irving OUT → Miles Stewart IN (stamina_rule2)

[08:37] Substitution (Team_031): Immanuel James OUT → Kobe Randle IN (stamina_rule2)

[08:37] Substitution (Team_031): Luka Sabonis OUT → Jimmy Poole IN (stamina_rule2)

[08:37] Substitution (Team_033): Chris Anunoby OUT → Manu Irving IN (stamina_rule2)

[08:37] Substitution (Team_033): Cade Randle OUT → Terry Jokic IN (stamina_rule2)

[08:37] Substitution (Team_033): Desmond DeRozan OUT → Zion Adebayo IN (stamina_rule2)

[08:37] Substitution (Team_033): Bradley Simmons OUT → Tim Griffin IN (stamina_rule2)

[08:19] Team_031 possession (Score: 82-101)
Miles Stewart attempts a Midrange. Contested by Manu Irving (4.7 feet, ZONE). Miles Stewart misses. Rebound secured by Zion Adebayo.

[08:05] Team_033 possession (Score: 82-101)
Tim Griffin drives to the basket... Tim Griffin commits a violation (traveling/carry)! TURNOVER! (dead ball)

[07:52] Team_031 possession (Score: 82-101)
Isaiah Ingram attempts a 3Pt. Contested by Ben Anthony (5.2 feet, ZONE). Isaiah Ingram misses. Offensive rebound by Jimmy Poole! Jimmy Poole kicks it out.

[07:36] Team_031 possession (Score: 82-101)
FOUL! Shooting foul on Zion Adebayo. Kobe Randle to the line for 2 free throws. [Team fouls: 3] (Zion Adebayo: 1 personal fouls)   FT 1/2: GOOD   FT 2/2: GOOD Kobe Randle makes 2/2 from the line.
Score: 84-101

[07:18] Team_033 possession (Score: 84-101)
Terry Jokic drives, Kobe Randle stays with him. Terry Jokic attempts a Layup. Contested by Kobe Randle (4.8 feet, ZONE). Terry Jokic misses. Rebound secured by Isaiah Ingram.

[07:02] Team_031 possession (Score: 84-101)
Isaiah Ingram attempts a Midrange. Contested by Manu Irving (5.1 feet, MAN). Isaiah Ingram misses. Rebound secured by Zion Adebayo.

[06:48] Team_033 possession (Score: 84-101)
Ben Anthony attempts a 3Pt. Contested by Miles Stewart (5.8 feet, ZONE). Ben Anthony misses. Rebound secured by Kobe Randle.

[06:31] Team_031 possession (Score: 84-101)
FOUL! Offensive foul on Kobe Randle! Zion Adebayo drew the charge! [Team fouls: 3] (Kobe Randle: 1 personal fouls) TURNOVER! (dead ball)

[06:13] Team_033 possession (Score: 84-101)
Ben Anthony drives, picks up Kobe Randle. Help arrives from Isaiah Ingram! Ben Anthony attempts a Layup. Contested by Isaiah Ingram (4.9 feet, ZONE). BEN ANTHONY MAKES IT!
Score: 84-103

[05:56] Team_031 possession (Score: 84-103)
Jimmy Poole attempts a 3Pt. Contested by Tim Griffin (4.8 feet, MAN). Jimmy Poole misses. Rebound secured by Tim Griffin.

[05:44] Team_033 possession (Score: 84-103)
Zion Adebayo drives and kicks out. Manu Irving attempts a Midrange. Contested by Isaiah Ingram (4.3 feet, MAN). Manu Irving misses. Rebound secured by Isaiah Ingram.

[05:24] Team_031 possession (Score: 84-103)
Kevin Morant attempts a Midrange. Contested by Terry Jokic (3.9 feet, ZONE). Kevin Morant misses. Rebound secured by Terry Jokic.

[05:09] Team_033 possession (Score: 84-103)
Ben Anthony makes the Layup and draws the foul on Isaiah Ingram! And-1! Ben Anthony to the line for 1. [Team fouls: 4] (Isaiah Ingram: 1 personal fouls)   FT 1/1: GOOD Ben Anthony makes 1/1 from the line.
Score: 84-106

[04:58] Team_031 possession (Score: 84-106)
Miles Stewart attempts a 3Pt. Contested by Ben Anthony (4.8 feet, ZONE). Miles Stewart misses. Rebound secured by Terry Jokic.

[04:40] Team_033 possession (Score: 84-106)
Manu Irving attempts a 3Pt. Contested by Isaiah Ingram (4.4 feet, MAN). Manu Irving misses. Rebound secured by Isaiah Ingram.

[04:28] Team_031 possession (Score: 84-106)
Isaiah Ingram attempts a 3Pt. Contested by Ben Anthony (5.3 feet, ZONE). ISAIAH INGRAM MAKES IT! Assist: Kobe Randle
Score: 87-106

[04:14] Team_033 possession (Score: 87-106)
Ben Anthony throws a bad pass out of bounds! TURNOVER! (dead ball)

[04:01] Team_031 possession (Score: 87-106)
Miles Stewart throws a bad pass! Stolen by Terry Jokic! TURNOVER! (live ball)

[03:47] Team_033 possession (Score: 87-106)
Terry Jokic attempts a 3Pt. Contested by Miles Stewart (5.8 feet, ZONE). TERRY JOKIC MAKES IT! Assist: Tim Griffin
Score: 87-109

[03:34] Team_031 possession (Score: 87-109)
Isaiah Ingram attempts a 3Pt. Contested by Ben Anthony (5.4 feet, ZONE). Isaiah Ingram misses. Rebound secured by Terry Jokic.

[03:17] Team_033 possession (Score: 87-109)
Manu Irving throws a bad pass! Stolen by Isaiah Ingram! TURNOVER! (live ball)

[03:03] Team_031 possession (Score: 87-109)
Kobe Randle drives, picks up Tim Griffin. Help arrives from Manu Irving! Kobe Randle attempts a Dunk. Contested by Manu Irving (5.5 feet, ZONE). Kobe Randle misses. Rebound secured by Terry Jokic.

[02:50] Team_033 possession (Score: 87-109)
Terry Jokic drives, picks up Miles Stewart. Help arrives from Isaiah Ingram! Terry Jokic attempts a Layup. Contested by Isaiah Ingram (5.8 feet, MAN). Terry Jokic misses. Offensive rebound by Tim Griffin! Tim Griffin's putback is no good. Rebound secured by Isaiah Ingram.

[02:33] Team_031 possession (Score: 87-109)
Kobe Randle attempts a 3Pt. Contested by Ben Anthony (5.7 feet, ZONE). KOBE RANDLE MAKES IT! Assist: Jimmy Poole
Score: 90-109

[02:16] Team_033 possession (Score: 90-109)
Tim Griffin attempts a Layup. Contested by Kobe Randle (4.5 feet, ZONE). Tim Griffin misses. Offensive rebound by Terry Jokic! Terry Jokic kicks it out.

[02:05] Team_033 possession (Score: 90-109)
FOUL! Holding foul on Jimmy Poole. [IN THE BONUS! 5 team fouls] Tim Griffin to the line for 2 free throws. (Jimmy Poole: 1 personal fouls)   FT 1/2: GOOD   FT 2/2: GOOD Tim Griffin makes 2/2 from the line.
Score: 90-111

[01:55] Team_031 possession (Score: 90-111)
Miles Stewart drives to the basket... FOUL! Offensive foul on Miles Stewart! Terry Jokic drew the charge! [Team fouls: 6] (Miles Stewart: 1 personal fouls) TURNOVER! (dead ball)

[01:44] Team_033 possession (Score: 90-111)
Ben Anthony attempts a Midrange. Contested by Kevin Morant (5.7 feet, MAN). Ben Anthony misses. Rebound secured by Isaiah Ingram.

[01:26] Team_031 possession (Score: 90-111)
Miles Stewart makes the Layup and draws the foul on Tim Griffin! And-1! Miles Stewart to the line for 1. [Team fouls: 4] (Tim Griffin: 1 personal fouls)   FT 1/1: MISS Miles Stewart makes 0/1 from the line. Rebound secured by Terry Jokic.
Score: 92-111

[01:11] Team_033 possession (Score: 92-111)
Tim Griffin makes the Layup and draws the foul on Kobe Randle! And-1! Tim Griffin to the line for 1. [BONUS: 7 team fouls] (Kobe Randle: 2 personal fouls)   FT 1/1: GOOD Tim Griffin makes 1/1 from the line.
Score: 92-114

[01:01] Team_031 possession (Score: 92-114)
Jimmy Poole drives to the basket... Jimmy Poole loses the ball! Stripped by Tim Griffin! TURNOVER! (live ball)

[00:45] Team_033 possession (Score: 92-114)
Zion Adebayo attempts a 3Pt. Contested by Miles Stewart (5.6 feet, ZONE). Zion Adebayo misses. FOUL! Loose ball foul on Jimmy Poole during the rebound battle. [IN THE BONUS! 8 team fouls] Terry Jokic to the line for 2 free throws. (Jimmy Poole: 2 personal fouls)   FT 1/2: MISS   FT 2/2: MISS Terry Jokic makes 0/2 from the line. Rebound secured by Kobe Randle.

[00:26] Team_031 possession (Score: 92-114)
Miles Stewart attempts a 3Pt. Contested by Ben Anthony (5.2 feet, ZONE). Miles Stewart misses. Rebound secured by Tim Griffin.

[00:11] Team_033 possession (Score: 92-114)
Terry Jokic drives, Jimmy Poole stays with him. Terry Jokic attempts a Dunk. Wide open! Jimmy Poole is 6.2 feet away. [ZONE] TERRY JOKIC MAKES IT! Assist: Tim Griffin
Score: 92-116

================================================================================
                              4TH QUARTER COMPLETE                              
================================================================================

4TH QUARTER SCORE: Team_031 22, Team_033 21

BOX SCORE:
================================================================================

Team_031
--------------------------------------------------------------------------------
Player                MIN  PTS  REB  AST  TO      FG   FG%      3P   3P%
--------------------------------------------------------------------------------
Luka Sabonis           34    4    2    1   0   2/3    66.7     0/0   0.0
Pau Irving             34    3    0    1   0   1/1   100.0     0/0   0.0
Kevin Morant           18    3    0    0   0   1/2    50.0     0/0   0.0
Isaiah Ingram          15    3    5    0   0   1/3    33.3     0/0   0.0
Gary Morant            34    2    0    0   0   1/2    50.0     0/0   0.0
Miles Stewart          15    0    0    0   0   0/4     0.0     0/0   0.0
Jimmy Poole            15    0    1    1   0   0/1     0.0     0/0   0.0

TEAM: FG: 8/19 (42.1%), 3PT: 3/8 (37.5%), REB: 8 (2 off, 6 def), AST: 4, TO: 4
TEAM FOULS: 8 [Team_033 in BONUS]


Team_033
--------------------------------------------------------------------------------
Player                MIN  PTS  REB  AST  TO      FG   FG%      3P   3P%
--------------------------------------------------------------------------------
Ben Anthony            18    8    0    0   0   3/5    60.0     0/0   0.0
Kobe Randle            15    5    2    1   0   2/3    66.7     0/0   0.0
Terry Jokic            15    5    6    0   0   2/4    50.0     0/0   0.0
Tim Griffin            15    5    2    2   0   2/2   100.0     0/0   0.0
Desmond DeRozan        34    2    1    0   0   1/1   100.0     0/0   0.0
Chris Anunoby          34    1    0    0   0   1/3    33.3     0/0   0.0
Bradley Simmons        34    0    1    1   0   0/0     0.0     0/0   0.0
Cade Randle            34    0    0    0   0   0/1     0.0     0/0   0.0
Immanuel James         34    0    1    0   0   0/0     0.0     0/0   0.0
Zion Adebayo           15    0    2    0   0   0/2     0.0     0/0   0.0
Manu Irving            15    0    0    0   0   0/1     0.0     0/0   0.0

TEAM: FG: 9/19 (47.4%), 3PT: 2/7 (28.6%), REB: 15 (4 off, 11 def), AST: 3, TO: 4
TEAM FOULS: 4

================================================================================

================================================================================
                               FULL GAME COMPLETE                               
================================================================================

FINAL SCORE: Team_031 92, Team_033 116

SCORING BY QUARTER:
--------------------------------------------------------------------------------
Team                     Q1     Q2     Q3     Q4    FINAL
--------------------------------------------------------------------------------
Team_031                 28     19     23     22       92
Team_033                 42     22     31     21      116
--------------------------------------------------------------------------------

FULL GAME BOX SCORE:
================================================================================

Team_031
--------------------------------------------------------------------------------
Player                MIN  PTS  REB  AST  TO      FG   FG%      3P   3P%      FT STL BLK
--------------------------------------------------------------------------------
Gary Morant            34   12    3    4   1   3/11   27.3   2/7    28.6   1/1     1   0
Pau Irving             34   10    0    3   1   5/12   41.7   1/6    16.7   1/2     0   1
Immanuel James         34    9   10    1   2   6/9    66.7   1/3    33.3   2/2     1   2
Luka Sabonis           34   15   10    3   1   4/9    44.4   0/0     0.0   1/1     1   0
Shai Durant            30   19    0    2   0   8/17   47.1   5/10   50.0   1/1     0   0
Kevin Morant           18    6    0    0   2   2/5    40.0   1/2    50.0   1/1     1   0
Isaiah Ingram          15    6    6    0   2   2/4    50.0   2/3    66.7   0/0     1   0
Miles Stewart          15    0    0    2   2   0/5     0.0   0/3     0.0   0/1     0   0
Kobe Randle            15   10    4    1   2   4/6    66.7   1/2    50.0   3/3     0   0
Jimmy Poole            15    0    2    1   1   0/1     0.0   0/1     0.0   0/0     0   0

TEAM: FG: 34/79 (43.0%), 3PT: 13/37 (35.1%), REB: 29 (6 off, 23 def), AST: 17, TO: 14


Team_033
--------------------------------------------------------------------------------
Player                MIN  PTS  REB  AST  TO      FG   FG%      3P   3P%      FT STL BLK
--------------------------------------------------------------------------------
Chris Anunoby          34   21    0    0   2  14/19   73.7   4/6    66.7   5/6     0   0
Cade Randle            34    6   11    4   0   2/5    40.0   1/3    33.3   2/2     0   0
Desmond DeRozan        34    8   12    1   3   5/11   45.5   0/1     0.0   2/3     1   0
Bradley Simmons        34   29   19    6   1   7/9    77.8   1/1   100.0   2/2     0   3
Joel Green             30   16    0    2   1   6/10   60.0   3/5    60.0   1/1     0   0
Ben Anthony            18    8    0    1   2   3/5    60.0   1/2    50.0   4/4     1   0
Manu Irving            15    4    0    0   2   2/4    50.0   0/1     0.0   0/0     0   0
Terry Jokic            15   10    7    1   0   3/6    50.0   1/2    50.0   6/9     3   0
Zion Adebayo           15    8    2    1   0   3/6    50.0   1/2    50.0   3/3     0   0
Tim Griffin            15    5    5    2   1   2/3    66.7   0/0     0.0   3/3     1   0

TEAM: FG: 48/79 (60.8%), 3PT: 12/23 (52.2%), REB: 61 (16 off, 45 def), AST: 18, TO: 12

================================================================================
