================================================================================
                        FULL GAME - Team_017 vs Team_071                        
================================================================================

================================================================================
                       1ST QUARTER - Team_017 vs Team_071                       
================================================================================

[12:00] Team_017 possession (Score: 0-0)
Vince Banchero loses control! Ball rolls out of bounds! TURNOVER! (dead ball)

[11:41] Team_071 possession (Score: 0-0)
Victor Anunoby makes the Layup and draws the foul on Kyrie Middleton! And-1! Victor Anunoby to the line for 1. [Team fouls: 1] (Kyrie Middleton: 1 personal fouls)   FT 1/1: GOOD Victor Anunoby makes 1/1 from the line.
Score: 0-3

[11:30] Team_017 possession (Score: 0-3)
Tony Smith attempts a Layup. Contested by Dejounte Paul (4.7 feet, ZONE). TONY SMITH MAKES IT! Assist: Kyrie Middleton
Score: 2-3

[11:13] Team_071 possession (Score: 2-3)
FOUL! Shooting foul on Kyrie Middleton. Jimmy Simons to the line for 2 free throws. [Team fouls: 2] (Kyrie Middleton: 2 personal fouls)   FT 1/2: GOOD   FT 2/2: GOOD Jimmy Simons makes 2/2 from the line.
Score: 2-5

[11:00] Team_017 possession (Score: 2-5)
Desmond Reaves drives and kicks out. Kyrie Middleton attempts a 3Pt. Contested by Jimmy Simons (4.1 feet, MAN). KYRIE MIDDLETON MAKES IT! Assist: Desmond Reaves
Score: 5-5

[10:46] Team_071 possession (Score: 5-5)
Jimmy Simons loses control! Ball rolls out of bounds! TURNOVER! (dead ball)

[10:30] Team_017 possession (Score: 5-5)
Bam Williamson drives, Dejounte Paul stays with him. Bam Williamson attempts a Layup. Contested by Dejounte Paul (4.8 feet, ZONE). BAM WILLIAMSON MAKES IT!
Score: 7-5

[10:16] Team_071 possession (Score: 7-5)
Allen Williamson attempts a 3Pt. Contested by Desmond Reaves (4.4 feet, ZONE). Allen Williamson misses. Rebound secured by Kyrie Middleton.

[09:59] Team_017 possession (Score: 7-5)
FOUL! Holding foul on Jimmy Simons. [Team fouls: 1] No free throws, side out. (Jimmy Simons: 1 personal fouls)

[09:47] Team_017 possession (Score: 7-5)
Kyrie Middleton drives and kicks out. Desmond Reaves attempts a Midrange. Contested by Allen Williamson (3.9 feet, MAN). DESMOND REAVES MAKES IT!
Score: 9-5

[09:32] Team_071 possession (Score: 9-5)
Bam Iverson drives and kicks out. FOUL! Shooting foul on Desmond Reaves. Allen Williamson to the line for 2 free throws. [Team fouls: 3] (Desmond Reaves: 1 personal fouls)   FT 1/2: GOOD   FT 2/2: GOOD Allen Williamson makes 2/2 from the line.
Score: 9-7

[09:13] Team_017 possession (Score: 9-7)
Desmond Reaves attempts a Midrange. Contested by Allen Williamson (4.4 feet, ZONE). Desmond Reaves misses. Rebound secured by Dejounte Paul.

[08:57] Team_071 possession (Score: 9-7)
Allen Williamson drives to the basket... Allen Williamson loses the ball! Stripped by Desmond Reaves! TURNOVER! (live ball)

[08:48] Team_017 possession (Score: 9-7)
Tony Smith attempts a Layup. Contested by Dejounte Paul (4.7 feet, ZONE). TONY SMITH MAKES IT! Assist: Vince Banchero
Score: 11-7

[08:35] Team_071 possession (Score: 11-7)
Jimmy Simons drives to the basket... FOUL! Offensive foul on Jimmy Simons! Kyrie Middleton drew the charge! [Team fouls: 2] (Jimmy Simons: 2 personal fouls) TURNOVER! (dead ball)

[08:20] Team_017 possession (Score: 11-7)
Vince Banchero attempts a Midrange. Contested by Victor Anunoby (4.1 feet, MAN). VINCE BANCHERO MAKES IT! Assist: Bam Williamson
Score: 13-7

[08:03] Team_071 possession (Score: 13-7)
Victor Anunoby drives and kicks out. Victor Anunoby attempts a Midrange. Contested by Vince Banchero (4.0 feet, MAN). Victor Anunoby misses. Rebound secured by Bam Williamson.

[07:49] Team_017 possession (Score: 13-7)
Tony Smith drives and kicks out. Bam Williamson attempts a 3Pt. Contested by Victor Anunoby (4.2 feet, ZONE). Bam Williamson misses. Rebound secured by Jimmy Simons.

[07:32] Team_071 possession (Score: 13-7)
Dejounte Paul attempts a 3Pt. Contested by Bam Williamson (4.4 feet, MAN). Dejounte Paul misses. Rebound secured by Tony Smith.

[07:20] Team_017 possession (Score: 13-7)
Bam Williamson attempts a Midrange. Contested by Dejounte Paul (4.8 feet, MAN). Bam Williamson misses. Offensive rebound by Bam Williamson! Bam Williamson puts it back in!
Score: 15-7

[07:04] Team_071 possession (Score: 15-7)
Dejounte Paul attempts a 3Pt. Contested by Desmond Reaves (4.4 feet, ZONE). Dejounte Paul misses. Rebound secured by Bam Williamson.

[06:51] Team_017 possession (Score: 15-7)
FOUL! Reach-in foul on Dejounte Paul during the drive. [Team fouls: 3] No free throws, side out. (Dejounte Paul: 1 personal fouls)

[06:40] Team_017 possession (Score: 15-7)
Desmond Reaves drives, Allen Williamson stays with him. Desmond Reaves attempts a Dunk. Contested by Allen Williamson (4.4 feet, MAN). Desmond Reaves misses. Rebound secured by Dejounte Paul.

[06:28] Team_071 possession (Score: 15-7)
Jimmy Simons attempts a Midrange. Contested by Tony Smith (2.8 feet, ZONE). JIMMY SIMONS MAKES IT!
Score: 15-9

[06:13] Team_017 possession (Score: 15-9)
Bam Williamson attempts a 3Pt. Contested by Victor Anunoby (4.9 feet, ZONE). Bam Williamson misses. FOUL! Loose ball foul on Jimmy Simons during the rebound battle. [Team fouls: 4] No free throws, side out. (Jimmy Simons: 3 personal fouls)

[05:55] Team_017 possession (Score: 15-9)
FOUL! Reach-in foul on Dejounte Paul during the drive. [IN THE BONUS! 5 team fouls] Bam Williamson to the line for 2 free throws. (Dejounte Paul: 2 personal fouls)   FT 1/2: GOOD   FT 2/2: GOOD Bam Williamson makes 2/2 from the line.
Score: 17-9

[05:40] Team_071 possession (Score: 17-9)
Dejounte Paul drives to the basket... Dejounte Paul loses the ball! Stripped by Bam Williamson! TURNOVER! (live ball)

[05:28] Team_017 possession (Score: 17-9)
Kyrie Middleton attempts a 3Pt. Contested by Jimmy Simons (4.4 feet, MAN). Kyrie Middleton misses. Rebound secured by Dejounte Paul.

[05:09] Team_071 possession (Score: 17-9)
Victor Anunoby attempts a Midrange. Contested by Vince Banchero (4.1 feet, MAN). Victor Anunoby misses. FOUL! Loose ball foul on Bam Williamson during the rebound battle. [Team fouls: 4] No free throws, side out. (Bam Williamson: 1 personal fouls)

[04:56] Team_071 possession (Score: 17-9)
Allen Williamson attempts a Midrange. Contested by Kyrie Middleton (5.4 feet, ZONE). ALLEN WILLIAMSON MAKES IT! Assist: Jimmy Simons
Score: 17-11

[04:45] Team_017 possession (Score: 17-11)
Desmond Reaves attempts a Layup. BLOCKED BY DEJOUNTE PAUL! Ball is loose! Rebound secured by Jimmy Simons.

[04:26] Team_071 possession (Score: 17-11)
Dejounte Paul attempts a Layup. Contested by Bam Williamson (4.5 feet, MAN). DEJOUNTE PAUL MAKES IT! Assist: Jimmy Simons
Score: 17-13

[04:15] Team_017 possession (Score: 17-13)
Desmond Reaves attempts a 3Pt. Contested by Allen Williamson (4.4 feet, MAN). Desmond Reaves misses. Rebound secured by Bam Iverson.

[04:00] Team_071 possession (Score: 17-13)
Victor Anunoby attempts a Midrange. Contested by Vince Banchero (4.1 feet, MAN). Victor Anunoby misses. Rebound secured by Kyrie Middleton.

[03:48] Team_017 possession (Score: 17-13)
Bam Williamson drives, Dejounte Paul stays with him. Bam Williamson attempts a Layup. Contested by Dejounte Paul (4.9 feet, MAN). BAM WILLIAMSON MAKES IT! Assist: Vince Banchero
Score: 19-13

[03:33] Team_071 possession (Score: 19-13)
FOUL! Shooting foul on Vince Banchero. Dejounte Paul to the line for 2 free throws. [BONUS: 5 team fouls] (Vince Banchero: 1 personal fouls)   FT 1/2: GOOD   FT 2/2: MISS Dejounte Paul makes 1/2 from the line. Offensive rebound by Jimmy Simons! Jimmy Simons kicks it out.
Score: 19-14

[03:19] Team_071 possession (Score: 19-14)
FOUL! Shooting foul on Bam Williamson. Dejounte Paul to the line for 2 free throws. [BONUS: 6 team fouls] (Bam Williamson: 2 personal fouls)   FT 1/2: GOOD   FT 2/2: GOOD Dejounte Paul makes 2/2 from the line.
Score: 19-16

[03:05] Team_017 possession (Score: 19-16)
Tony Smith drives and kicks out. Desmond Reaves attempts a 3Pt. Contested by Allen Williamson (4.1 feet, MAN). Desmond Reaves misses. FOUL! Loose ball foul on Jimmy Simons during the rebound battle. [IN THE BONUS! 6 team fouls] Bam Williamson to the line for 2 free throws. (Jimmy Simons: 4 personal fouls)   FT 1/2: GOOD   FT 2/2: GOOD Bam Williamson makes 2/2 from the line.
Score: 21-16

[02:54] Team_071 possession (Score: 21-16)
Bam Iverson loses the ball! Stripped by Tony Smith! TURNOVER! (live ball)

[02:41] Team_017 possession (Score: 21-16)
Bam Williamson drives to the basket... Bam Williamson throws a bad pass! Stolen by Jimmy Simons! TURNOVER! (live ball)

[02:24] Team_071 possession (Score: 21-16)
Jimmy Simons attempts a Midrange. Contested by Kyrie Middleton (5.2 feet, MAN). JIMMY SIMONS MAKES IT!
Score: 21-18

[02:13] Team_017 possession (Score: 21-18)
Bam Williamson drives and kicks out. Desmond Reaves attempts a 3Pt. Contested by Victor Anunoby (4.5 feet, ZONE). Desmond Reaves misses. Rebound secured by Dejounte Paul.

[02:00] Team_071 possession (Score: 21-18)
Jimmy Simons attempts a Layup. Contested by Bam Williamson (4.4 feet, ZONE). Jimmy Simons misses. Rebound secured by Bam Williamson.

[01:47] Team_017 possession (Score: 21-18)
Desmond Reaves attempts a 3Pt. Contested by Allen Williamson (4.7 feet, MAN). Desmond Reaves misses. Rebound secured by Jimmy Simons.

[01:34] Team_071 possession (Score: 21-18)
Dejounte Paul drives, picks up Bam Williamson. Help arrives from Vince Banchero! Dejounte Paul attempts a Dunk. Contested by Vince Banchero (4.8 feet, ZONE). DEJOUNTE PAUL MAKES IT! Assist: Allen Williamson
Score: 21-20

[01:23] Team_017 possession (Score: 21-20)
Vince Banchero attempts a 3Pt. Contested by Bam Iverson (3.9 feet, ZONE). Vince Banchero misses. Offensive rebound by Bam Williamson! Bam Williamson puts it back in!
Score: 23-20

[01:09] Team_071 possession (Score: 23-20)
FOUL! Reach-in foul on Kyrie Middleton during the drive. [IN THE BONUS! 7 team fouls] Jimmy Simons to the line for 2 free throws. (Kyrie Middleton: 3 personal fouls)   FT 1/2: MISS   FT 2/2: GOOD Jimmy Simons makes 1/2 from the line.
Score: 23-21

[00:55] Team_017 possession (Score: 23-21)
Vince Banchero drives, Victor Anunoby stays with him. Vince Banchero attempts a Layup. Contested by Victor Anunoby (4.6 feet, MAN). Vince Banchero misses. Rebound secured by Dejounte Paul.

[00:40] Team_071 possession (Score: 23-21)
Victor Anunoby drives and kicks out. FOUL! Shooting foul on Tony Smith. Bam Iverson to the line for 2 free throws. [BONUS: 8 team fouls] (Tony Smith: 1 personal fouls)   FT 1/2: GOOD   FT 2/2: GOOD Bam Iverson makes 2/2 from the line.
Score: 23-23

[00:26] Team_017 possession (Score: 23-23)
FOUL! Shooting foul on Dejounte Paul. Bam Williamson to the line for 2 free throws. [BONUS: 7 team fouls] (Dejounte Paul: 3 personal fouls)   FT 1/2: MISS   FT 2/2: GOOD Bam Williamson makes 1/2 from the line.
Score: 24-23

[00:08] Team_071 possession (Score: 24-23)
Bam Iverson loses control! Ball rolls out of bounds! TURNOVER! (dead ball)

[00:08] Substitution (Team_017): Desmond Reaves OUT → Blake Reaves IN (stamina_rule2)

[00:08] Substitution (Team_017): Vince Banchero OUT → Tobias Bridges IN (stamina_rule2)

[00:08] Substitution (Team_017): Tony Smith OUT → Shaquille Stewart IN (stamina_rule2)

[00:08] Substitution (Team_017): Kyrie Middleton OUT → Ja Stewart IN (stamina_rule2)

[00:08] Substitution (Team_017): Bam Williamson OUT → Klay Holiday IN (stamina_rule2)

[00:08] Substitution (Team_071): Allen Williamson OUT → Evan Sexton IN (stamina_rule2)

[00:08] Substitution (Team_071): Victor Anunoby OUT → Paul Ball IN (stamina_rule2)

[00:08] Substitution (Team_071): Bam Iverson OUT → Immanuel Ginobili IN (stamina_rule2)

[00:08] Substitution (Team_071): Jimmy Simons OUT → Jordan Durant IN (stamina_rule2)

[00:08] Substitution (Team_071): Dejounte Paul OUT → Tyrese Brogdon IN (stamina_rule2)

================================================================================
                              1ST QUARTER COMPLETE                              
================================================================================

1ST QUARTER SCORE: Team_017 24, Team_071 23

BOX SCORE:
================================================================================

Team_017
--------------------------------------------------------------------------------
Player                MIN  PTS  REB  AST  TO      FG   FG%      3P   3P%
--------------------------------------------------------------------------------
Bam Williamson         12   13    5    1   0   7/8    87.5     0/0   0.0
Tony Smith             12    4    1    0   0   2/3    66.7     0/0   0.0
Kyrie Middleton        12    3    3    1   0   1/2    50.0     0/0   0.0
Desmond Reaves         12    2    0    1   0   1/6    16.7     0/0   0.0
Vince Banchero         12    2    0    2   0   1/2    50.0     0/0   0.0

TEAM: FG: 12/21 (57.1%), 3PT: 1/4 (25.0%), REB: 9 (3 off, 6 def), AST: 5, TO: 2
TEAM FOULS: 8 [Team_071 in BONUS]


Team_071
--------------------------------------------------------------------------------
Player                MIN  PTS  REB  AST  TO      FG   FG%      3P   3P%
--------------------------------------------------------------------------------
Jimmy Simons           12    7    5    2   0   4/5    80.0     0/0   0.0
Dejounte Paul          12    6    5    0   0   3/5    60.0     0/0   0.0
Allen Williamson       12    4    0    1   0   2/3    66.7     0/0   0.0
Victor Anunoby         12    3    0    0   0   1/3    33.3     0/0   0.0
Bam Iverson            12    2    1    0   0   1/1   100.0     0/0   0.0

TEAM: FG: 11/17 (64.7%), 3PT: 0/3 (0.0%), REB: 11 (2 off, 9 def), AST: 3, TO: 6
TEAM FOULS: 7 [Team_017 in BONUS]

================================================================================

================================================================================
                       2ND QUARTER - Team_017 vs Team_071                       
================================================================================

[12:00] Team_017 possession (Score: 24-23)
Vince Banchero attempts a Midrange. Contested by Victor Anunoby (4.5 feet, MAN). Vince Banchero misses. Rebound secured by Dejounte Paul.

[11:48] Team_071 possession (Score: 24-23)
Bam Iverson attempts a Midrange. Contested by Tony Smith (3.2 feet, MAN). Bam Iverson misses. Rebound secured by Tony Smith.

[11:35] Team_017 possession (Score: 24-23)
Desmond Reaves attempts a 3Pt. Contested by Allen Williamson (4.7 feet, MAN). Desmond Reaves misses. Offensive rebound by Kyrie Middleton! Kyrie Middleton kicks it out.

[11:21] Team_017 possession (Score: 24-23)
Tony Smith attempts a 3Pt. BLOCKED BY VICTOR ANUNOBY! Ball is loose! Rebound secured by Dejounte Paul.

[11:09] Team_071 possession (Score: 24-23)
Dejounte Paul attempts a 3Pt. Contested by Desmond Reaves (4.8 feet, ZONE). Dejounte Paul misses. FOUL! Loose ball foul on Bam Williamson during the rebound battle. [Team fouls: 1] No free throws, side out. (Bam Williamson: 1 personal fouls)

[10:55] Team_071 possession (Score: 24-23)
Jimmy Simons makes the Dunk and draws the foul on Bam Williamson! And-1! Jimmy Simons to the line for 1. [Team fouls: 2] (Bam Williamson: 2 personal fouls)   FT 1/1: GOOD Jimmy Simons makes 1/1 from the line.
Score: 24-26

[10:42] Team_017 possession (Score: 24-26)
Desmond Reaves attempts a Layup. Contested by Dejounte Paul (5.0 feet, ZONE). DESMOND REAVES MAKES IT!
Score: 26-26

[10:33] Team_071 possession (Score: 26-26)
Allen Williamson attempts a 3Pt. Contested by Desmond Reaves (5.0 feet, MAN). Allen Williamson misses. Rebound secured by Bam Williamson.

[10:20] Team_017 possession (Score: 26-26)
Vince Banchero drives, Victor Anunoby stays with him. Vince Banchero attempts a Layup. Contested by Victor Anunoby (4.7 feet, MAN). VINCE BANCHERO MAKES IT! Assist: Tony Smith
Score: 28-26

[10:11] Team_071 possession (Score: 28-26)
Dejounte Paul attempts a Midrange. Contested by Bam Williamson (5.0 feet, MAN). DEJOUNTE PAUL MAKES IT! Assist: Jimmy Simons
Score: 28-28

[09:58] Team_017 possession (Score: 28-28)
Kyrie Middleton commits a violation (traveling/carry)! TURNOVER! (dead ball)

[09:58] Substitution (Team_017): Desmond Reaves OUT → Blake Reaves IN (stamina_rule2)

[09:58] Substitution (Team_017): Vince Banchero OUT → Tobias Bridges IN (stamina_rule2)

[09:58] Substitution (Team_017): Tony Smith OUT → Shaquille Stewart IN (stamina_rule2)

[09:58] Substitution (Team_017): Kyrie Middleton OUT → Ja Stewart IN (stamina_rule2)

[09:58] Substitution (Team_017): Bam Williamson OUT → Klay Holiday IN (stamina_rule2)

[09:58] Substitution (Team_071): Allen Williamson OUT → Evan Sexton IN (stamina_rule2)

[09:58] Substitution (Team_071): Victor Anunoby OUT → Paul Ball IN (stamina_rule2)

[09:58] Substitution (Team_071): Bam Iverson OUT → Immanuel Ginobili IN (stamina_rule2)

[09:58] Substitution (Team_071): Jimmy Simons OUT → Jordan Durant IN (stamina_rule2)

[09:58] Substitution (Team_071): Dejounte Paul OUT → Tyrese Brogdon IN (stamina_rule2)

[09:44] Team_071 possession (Score: 28-28)
FOUL! Shooting foul on Klay Holiday. Immanuel Ginobili to the line for 2 free throws. [Team fouls: 3] (Klay Holiday: 1 personal fouls)   FT 1/2: GOOD   FT 2/2: GOOD Immanuel Ginobili makes 2/2 from the line.
Score: 28-30

[09:34] Team_017 possession (Score: 28-30)
Shaquille Stewart drives, Immanuel Ginobili stays with him. Shaquille Stewart attempts a Layup. Contested by Immanuel Ginobili (4.6 feet, MAN). SHAQUILLE STEWART MAKES IT! Assist: Klay Holiday
Score: 30-30

[09:18] Team_071 possession (Score: 30-30)
Tyrese Brogdon drives to the basket... Tyrese Brogdon commits a violation (traveling/carry)! TURNOVER! (dead ball)

[09:01] Team_017 possession (Score: 30-30)
Klay Holiday drives and kicks out. Klay Holiday attempts a 3Pt. Contested by Tyrese Brogdon (5.7 feet, MAN). Klay Holiday misses. Rebound secured by Immanuel Ginobili.

[08:47] Team_071 possession (Score: 30-30)
Immanuel Ginobili attempts a 3Pt. Contested by Ja Stewart (4.7 feet, ZONE). Immanuel Ginobili misses. Rebound secured by Shaquille Stewart.

[08:37] Team_017 possession (Score: 30-30)
FOUL! Reach-in foul on Immanuel Ginobili during the drive. [Team fouls: 1] No free throws, side out. (Immanuel Ginobili: 1 personal fouls)

[08:19] Team_017 possession (Score: 30-30)
Shaquille Stewart attempts a Midrange. Contested by Immanuel Ginobili (4.6 feet, MAN). SHAQUILLE STEWART MAKES IT!
Score: 32-30

[08:08] Team_071 possession (Score: 32-30)
FOUL! Shooting foul on Tobias Bridges. Tyrese Brogdon to the line for 3 free throws. [Team fouls: 4] (Tobias Bridges: 1 personal fouls)   FT 1/3: GOOD   FT 2/3: GOOD   FT 3/3: MISS Tyrese Brogdon makes 2/3 from the line. Rebound secured by Klay Holiday.
Score: 32-32

[07:56] Team_017 possession (Score: 32-32)
Ja Stewart attempts a Midrange. Contested by Jordan Durant (4.4 feet, ZONE). Ja Stewart misses. Rebound secured by Jordan Durant.

[07:37] Team_071 possession (Score: 32-32)
Jordan Durant attempts a 3Pt. Contested by Tobias Bridges (4.0 feet, ZONE). Jordan Durant misses. Rebound secured by Ja Stewart.

[07:22] Team_017 possession (Score: 32-32)
Ja Stewart attempts a Midrange. Contested by Jordan Durant (4.4 feet, MAN). JA STEWART MAKES IT! Assist: Klay Holiday
Score: 34-32

[07:09] Team_071 possession (Score: 34-32)
Evan Sexton attempts a 3Pt. Contested by Blake Reaves (5.7 feet, MAN). Evan Sexton misses. Rebound secured by Ja Stewart.

[06:55] Team_017 possession (Score: 34-32)
Blake Reaves attempts a 3Pt. Contested by Paul Ball (4.3 feet, ZONE). Blake Reaves misses. FOUL! Loose ball foul on Immanuel Ginobili during the rebound battle. [Team fouls: 2] No free throws, side out. (Immanuel Ginobili: 2 personal fouls)

[06:42] Team_017 possession (Score: 34-32)
Ja Stewart attempts a Midrange. Contested by Jordan Durant (4.4 feet, MAN). JA STEWART MAKES IT!
Score: 36-32

[06:27] Team_071 possession (Score: 36-32)
Tyrese Brogdon drives to the basket... Tyrese Brogdon loses control! Ball rolls out of bounds! TURNOVER! (dead ball)

[06:10] Team_017 possession (Score: 36-32)
Klay Holiday attempts a Midrange. Contested by Tyrese Brogdon (5.9 feet, MAN). Klay Holiday misses. Rebound secured by Evan Sexton.

[05:54] Team_071 possession (Score: 36-32)
FOUL! Reach-in foul on Ja Stewart during the drive. [IN THE BONUS! 5 team fouls] Jordan Durant to the line for 2 free throws. (Ja Stewart: 1 personal fouls)   FT 1/2: GOOD   FT 2/2: GOOD Jordan Durant makes 2/2 from the line.
Score: 36-34

[05:43] Team_017 possession (Score: 36-34)
Tobias Bridges attempts a 3Pt. Contested by Paul Ball (4.4 feet, ZONE). Tobias Bridges misses. Rebound secured by Jordan Durant.

[05:27] Team_071 possession (Score: 36-34)
Tyrese Brogdon drives, picks up Ja Stewart. Help arrives from Tobias Bridges! Tyrese Brogdon attempts a Layup. Contested by Tobias Bridges (5.1 feet, ZONE). TYRESE BROGDON MAKES IT!
Score: 36-36

[05:12] Team_017 possession (Score: 36-36)
Shaquille Stewart drives, Tyrese Brogdon stays with him. Shaquille Stewart attempts a Layup. Wide open! Tyrese Brogdon is 6.1 feet away. [ZONE] SHAQUILLE STEWART MAKES IT! Assist: Tobias Bridges
Score: 38-36

[04:58] Team_071 possession (Score: 38-36)
Evan Sexton attempts a Layup. Contested by Ja Stewart (5.2 feet, ZONE). Evan Sexton misses. Rebound secured by Klay Holiday.

[04:45] Team_017 possession (Score: 38-36)
Klay Holiday loses the ball! Stripped by Tyrese Brogdon! TURNOVER! (live ball)

[04:28] Team_071 possession (Score: 38-36)
FOUL! Shooting foul on Tobias Bridges. Tyrese Brogdon to the line for 2 free throws. [BONUS: 6 team fouls] (Tobias Bridges: 2 personal fouls)   FT 1/2: GOOD   FT 2/2: GOOD Tyrese Brogdon makes 2/2 from the line.
Score: 38-38

[04:12] Team_017 possession (Score: 38-38)
Shaquille Stewart attempts a 3Pt. Contested by Paul Ball (4.7 feet, ZONE). Shaquille Stewart misses. Rebound secured by Immanuel Ginobili.

[03:59] Team_071 possession (Score: 38-38)
Paul Ball attempts a Layup. Contested by Tobias Bridges (4.0 feet, MAN). Paul Ball misses. Rebound secured by Ja Stewart.

[03:42] Team_017 possession (Score: 38-38)
Blake Reaves drives, picks up Evan Sexton. Help arrives from Immanuel Ginobili! Blake Reaves attempts a Dunk. Contested by Immanuel Ginobili (5.2 feet, MAN). BLAKE REAVES MAKES IT! Assist: Tobias Bridges
Score: 40-38

[03:32] Team_071 possession (Score: 40-38)
Evan Sexton attempts a 3Pt. Contested by Blake Reaves (5.7 feet, MAN). Evan Sexton misses. Rebound secured by Klay Holiday.

[03:16] Team_017 possession (Score: 40-38)
Blake Reaves attempts a 3Pt. Contested by Evan Sexton (5.2 feet, MAN). Blake Reaves misses. Rebound secured by Immanuel Ginobili.

[03:02] Team_071 possession (Score: 40-38)
Tyrese Brogdon attempts a Layup. Contested by Klay Holiday (5.5 feet, MAN). TYRESE BROGDON MAKES IT!
Score: 40-40

[02:45] Team_017 possession (Score: 40-40)
Blake Reaves attempts a Layup. Contested by Tyrese Brogdon (5.7 feet, ZONE). BLAKE REAVES MAKES IT! Assist: Tobias Bridges
Score: 42-40

[02:32] Team_071 possession (Score: 42-40)
Paul Ball attempts a 3Pt. Contested by Tobias Bridges (4.1 feet, MAN). Paul Ball misses. Rebound secured by Shaquille Stewart.

[02:18] Team_017 possession (Score: 42-40)
Tobias Bridges makes the Layup and draws the foul on Paul Ball! And-1! Tobias Bridges to the line for 1. [Team fouls: 3] (Paul Ball: 1 personal fouls)   FT 1/1: GOOD Tobias Bridges makes 1/1 from the line.
Score: 45-40

[01:59] Team_071 possession (Score: 45-40)
Jordan Durant drives and kicks out. FOUL! Shooting foul on Tobias Bridges. Paul Ball to the line for 2 free throws. [BONUS: 7 team fouls] (Tobias Bridges: 3 personal fouls)   FT 1/2: GOOD   FT 2/2: GOOD Paul Ball makes 2/2 from the line.
Score: 45-42

[01:42] Team_017 possession (Score: 45-42)
Blake Reaves attempts a Midrange. Contested by Jordan Durant (4.8 feet, ZONE). BLAKE REAVES MAKES IT! Assist: Klay Holiday
Score: 47-42

[01:31] Team_071 possession (Score: 47-42)
Evan Sexton attempts a Layup. Contested by Blake Reaves (5.8 feet, MAN). Evan Sexton misses. Rebound secured by Shaquille Stewart.

[01:14] Team_017 possession (Score: 47-42)
Shaquille Stewart drives and kicks out. Blake Reaves attempts a 3Pt. Contested by Evan Sexton (5.4 feet, MAN). BLAKE REAVES MAKES IT! Assist: Ja Stewart
Score: 50-42

[00:59] Team_071 possession (Score: 50-42)
Immanuel Ginobili throws a bad pass! Stolen by Shaquille Stewart! TURNOVER! (live ball)

[00:47] Team_017 possession (Score: 50-42)
Klay Holiday attempts a Midrange. Contested by Immanuel Ginobili (4.6 feet, ZONE). Klay Holiday misses. Rebound secured by Jordan Durant.

[00:36] Team_071 possession (Score: 50-42)
Immanuel Ginobili loses control! Ball rolls out of bounds! TURNOVER! (dead ball)

[00:24] Team_017 possession (Score: 50-42)
Blake Reaves makes the Dunk and draws the foul on Tyrese Brogdon! And-1! Blake Reaves to the line for 1. [Team fouls: 4] (Tyrese Brogdon: 1 personal fouls)   FT 1/1: GOOD Blake Reaves makes 1/1 from the line.
Score: 53-42

[00:09] Team_071 possession (Score: 53-42)
Immanuel Ginobili attempts a Layup. BLOCKED BY SHAQUILLE STEWART! Ball is loose! Rebound secured by Shaquille Stewart.

================================================================================
                              2ND QUARTER COMPLETE                              
================================================================================

2ND QUARTER SCORE: Team_017 29, Team_071 19

BOX SCORE:
================================================================================

Team_017
--------------------------------------------------------------------------------
Player                MIN  PTS  REB  AST  TO      FG   FG%      3P   3P%
--------------------------------------------------------------------------------
Blake Reaves           10   12    0    0   0   5/6    83.3     0/0   0.0
Shaquille Stewart      10    6    5    0   0   3/4    75.0     0/0   0.0
Ja Stewart             10    4    3    1   0   2/3    66.7     0/0   0.0
Tobias Bridges         10    3    0    3   0   1/2    50.0     0/0   0.0
Vince Banchero         14    2    0    0   0   1/2    50.0     0/0   0.0
Desmond Reaves         14    2    0    0   0   1/1   100.0     0/0   0.0
Tony Smith             14    0    1    1   0   0/1     0.0     0/0   0.0
Kyrie Middleton        14    0    1    0   0   0/0     0.0     0/0   0.0
Bam Williamson         14    0    1    0   0   0/0     0.0     0/0   0.0
Klay Holiday           10    0    3    3   0   0/3     0.0     0/0   0.0

TEAM: FG: 13/22 (59.1%), 3PT: 0/4 (0.0%), REB: 14 (2 off, 12 def), AST: 8, TO: 2
TEAM FOULS: 7 [Team_071 in BONUS]


Team_071
--------------------------------------------------------------------------------
Player                MIN  PTS  REB  AST  TO      FG   FG%      3P   3P%
--------------------------------------------------------------------------------
Tyrese Brogdon         10    6    0    0   0   3/4    75.0     0/0   0.0
Jimmy Simons           14    3    1    1   0   1/1   100.0     0/0   0.0
Dejounte Paul          14    2    2    0   0   1/1   100.0     0/0   0.0
Immanuel Ginobili      10    2    3    0   0   1/3    33.3     0/0   0.0
Jordan Durant          10    2    3    0   0   1/2    50.0     0/0   0.0
Paul Ball              10    2    0    0   0   1/3    33.3     0/0   0.0
Bam Iverson            14    0    0    0   0   0/1     0.0     0/0   0.0
Allen Williamson       14    0    0    0   0   0/1     0.0     0/0   0.0
Evan Sexton            10    0    1    0   0   0/4     0.0     0/0   0.0

TEAM: FG: 8/20 (40.0%), 3PT: 0/7 (0.0%), REB: 10 (1 off, 9 def), AST: 1, TO: 4
TEAM FOULS: 4

================================================================================

================================================================================
                       3RD QUARTER - Team_017 vs Team_071                       
================================================================================

[12:00] Team_017 possession (Score: 53-42)
FOUL! Holding foul on Allen Williamson. [Team fouls: 1] No free throws, side out. (Allen Williamson: 1 personal fouls)

[11:46] Team_017 possession (Score: 53-42)
Bam Williamson drives and kicks out. Tony Smith attempts a Midrange. Contested by Victor Anunoby (4.2 feet, ZONE). TONY SMITH MAKES IT! Assist: Bam Williamson
Score: 55-42

[11:29] Team_071 possession (Score: 55-42)
FOUL! Shooting foul on Kyrie Middleton. Jimmy Simons to the line for 2 free throws. [Team fouls: 1] (Kyrie Middleton: 1 personal fouls)   FT 1/2: GOOD   FT 2/2: GOOD Jimmy Simons makes 2/2 from the line.
Score: 55-44

[11:15] Team_017 possession (Score: 55-44)
Vince Banchero throws a bad pass! Stolen by Victor Anunoby! TURNOVER! (live ball)

[11:00] Team_071 possession (Score: 55-44)
Allen Williamson attempts a 3Pt. Contested by Desmond Reaves (4.4 feet, MAN). Allen Williamson misses. FOUL! Loose ball foul on Kyrie Middleton during the rebound battle. [Team fouls: 2] No free throws, side out. (Kyrie Middleton: 2 personal fouls)

[10:47] Team_071 possession (Score: 55-44)
Jimmy Simons drives, picks up Kyrie Middleton. Help arrives from Vince Banchero! Jimmy Simons attempts a Dunk. Contested by Vince Banchero (5.0 feet, MAN). JIMMY SIMONS MAKES IT! Assist: Dejounte Paul
Score: 55-46

[10:37] Team_017 possession (Score: 55-46)
Tony Smith attempts a 3Pt. Contested by Victor Anunoby (4.7 feet, ZONE). Tony Smith misses. Rebound secured by Bam Iverson.

[10:25] Team_071 possession (Score: 55-46)
Dejounte Paul attempts a Midrange. Contested by Bam Williamson (4.4 feet, MAN). Dejounte Paul misses. Rebound secured by Bam Williamson.

[10:11] Team_017 possession (Score: 55-46)
Kyrie Middleton attempts a Layup. Contested by Jimmy Simons (4.4 feet, MAN). KYRIE MIDDLETON MAKES IT!
Score: 57-46

[10:00] Team_071 possession (Score: 57-46)
Jimmy Simons attempts a Midrange. Contested by Kyrie Middleton (5.0 feet, ZONE). JIMMY SIMONS MAKES IT!
Score: 57-48

[09:49] Team_017 possession (Score: 57-48)
Desmond Reaves attempts a 3Pt. Contested by Allen Williamson (4.4 feet, MAN). Desmond Reaves misses. Offensive rebound by Bam Williamson! Bam Williamson puts it back in!
Score: 59-48

[09:33] Team_071 possession (Score: 59-48)
Victor Anunoby attempts a Midrange. Contested by Vince Banchero (4.1 feet, MAN). VICTOR ANUNOBY MAKES IT! Assist: Jimmy Simons
Score: 59-50

[09:20] Team_017 possession (Score: 59-50)
Vince Banchero attempts a 3Pt. Contested by Victor Anunoby (4.1 feet, ZONE). Vince Banchero misses. Rebound secured by Jimmy Simons.

[09:02] Team_071 possession (Score: 59-50)
Jimmy Simons makes the Layup and draws the foul on Bam Williamson! And-1! Jimmy Simons to the line for 1. [Team fouls: 3] (Bam Williamson: 1 personal fouls)   FT 1/1: GOOD Jimmy Simons makes 1/1 from the line.
Score: 59-53

[08:49] Team_017 possession (Score: 59-53)
Vince Banchero attempts a Midrange. Contested by Victor Anunoby (4.1 feet, MAN). VINCE BANCHERO MAKES IT!
Score: 61-53

[08:34] Team_071 possession (Score: 61-53)
Dejounte Paul drives, Bam Williamson stays with him. Dejounte Paul attempts a Dunk. Contested by Bam Williamson (4.4 feet, MAN). DEJOUNTE PAUL MAKES IT! Assist: Victor Anunoby
Score: 61-55

[08:22] Team_017 possession (Score: 61-55)
Desmond Reaves drives, picks up Dejounte Paul. Help arrives from Allen Williamson! Desmond Reaves attempts a Layup. Contested by Allen Williamson (4.6 feet, ZONE). DESMOND REAVES MAKES IT!
Score: 63-55

[08:10] Team_071 possession (Score: 63-55)
Allen Williamson attempts a 3Pt. Contested by Desmond Reaves (4.4 feet, ZONE). ALLEN WILLIAMSON MAKES IT! Assist: Dejounte Paul
Score: 63-58

[07:53] Team_017 possession (Score: 63-58)
Kyrie Middleton drives, Dejounte Paul stays with him. Kyrie Middleton attempts a Dunk. Contested by Dejounte Paul (4.4 feet, ZONE). Kyrie Middleton misses. Rebound secured by Bam Iverson.

[07:37] Team_071 possession (Score: 63-58)
Dejounte Paul drives to the basket... FOUL! Offensive foul on Dejounte Paul! Bam Williamson drew the charge! [Team fouls: 2] (Dejounte Paul: 1 personal fouls) TURNOVER! (dead ball)

[07:27] Team_017 possession (Score: 63-58)
Bam Williamson attempts a Layup. Contested by Dejounte Paul (4.8 feet, MAN). BAM WILLIAMSON MAKES IT!
Score: 65-58

[07:10] Team_071 possession (Score: 65-58)
Dejounte Paul drives, Kyrie Middleton stays with him. Dejounte Paul attempts a Layup. Contested by Kyrie Middleton (5.4 feet, ZONE). DEJOUNTE PAUL MAKES IT! Assist: Jimmy Simons
Score: 65-60

[06:55] Team_017 possession (Score: 65-60)
Desmond Reaves attempts a 3Pt. Contested by Allen Williamson (4.4 feet, MAN). Desmond Reaves misses. Rebound secured by Dejounte Paul.

[06:41] Team_071 possession (Score: 65-60)
FOUL! Shooting foul on Kyrie Middleton. Jimmy Simons to the line for 2 free throws. [Team fouls: 4] (Kyrie Middleton: 3 personal fouls)   FT 1/2: GOOD   FT 2/2: GOOD Jimmy Simons makes 2/2 from the line.
Score: 65-62

[06:24] Team_017 possession (Score: 65-62)
Tony Smith attempts a 3Pt. Contested by Bam Iverson (4.1 feet, MAN). Tony Smith misses. Rebound secured by Bam Iverson.

[06:06] Team_071 possession (Score: 65-62)
Victor Anunoby attempts a 3Pt. Contested by Desmond Reaves (4.1 feet, ZONE). Victor Anunoby misses. Rebound secured by Tony Smith.

[05:52] Team_017 possession (Score: 65-62)
Kyrie Middleton drives and kicks out. Vince Banchero attempts a Midrange. Contested by Victor Anunoby (4.2 feet, MAN). Vince Banchero misses. Rebound secured by Dejounte Paul.

[05:39] Team_071 possession (Score: 65-62)
Dejounte Paul attempts a 3Pt. Contested by Tony Smith (3.1 feet, ZONE). Dejounte Paul misses. Rebound secured by Tony Smith.

[05:21] Team_017 possession (Score: 65-62)
Vince Banchero attempts a Midrange. BLOCKED BY JIMMY SIMONS! Ball is loose! Rebound secured by Bam Iverson.

[05:09] Team_071 possession (Score: 65-62)
Bam Iverson drives, Tony Smith stays with him. Bam Iverson attempts a Layup. Contested by Tony Smith (2.9 feet, MAN). Bam Iverson misses. Rebound secured by Kyrie Middleton.

[04:52] Team_017 possession (Score: 65-62)
Vince Banchero drives, Victor Anunoby stays with him. Vince Banchero attempts a Dunk. Contested by Victor Anunoby (4.2 feet, MAN). VINCE BANCHERO MAKES IT! Assist: Desmond Reaves
Score: 67-62

[04:37] Team_071 possession (Score: 67-62)
FOUL! Reach-in foul on Vince Banchero during the drive. [IN THE BONUS! 5 team fouls] Victor Anunoby to the line for 2 free throws. (Vince Banchero: 1 personal fouls)   FT 1/2: MISS   FT 2/2: GOOD Victor Anunoby makes 1/2 from the line.
Score: 67-63

[04:20] Team_017 possession (Score: 67-63)
FOUL! Holding foul on Victor Anunoby. [Team fouls: 3] No free throws, side out. (Victor Anunoby: 1 personal fouls)

[04:04] Team_017 possession (Score: 67-63)
FOUL! Reach-in foul on Dejounte Paul during the drive. [Team fouls: 4] No free throws, side out. (Dejounte Paul: 2 personal fouls)

[03:47] Team_017 possession (Score: 67-63)
Vince Banchero attempts a Midrange. Contested by Jimmy Simons (4.2 feet, ZONE). Vince Banchero misses. Rebound secured by Bam Iverson.

[03:28] Team_071 possession (Score: 67-63)
Allen Williamson attempts a Midrange. Contested by Desmond Reaves (4.6 feet, MAN). Allen Williamson misses. Rebound secured by Bam Williamson.

[03:10] Team_017 possession (Score: 67-63)
Desmond Reaves attempts a 3Pt. Contested by Allen Williamson (4.5 feet, MAN). DESMOND REAVES MAKES IT!
Score: 70-63

[03:00] Team_071 possession (Score: 70-63)
Jimmy Simons drives and kicks out. Dejounte Paul attempts a 3Pt. Contested by Tony Smith (3.0 feet, ZONE). Dejounte Paul misses. Offensive rebound by Dejounte Paul! Dejounte Paul kicks it out.

[02:47] Team_071 possession (Score: 70-63)
Allen Williamson attempts a 3Pt. Contested by Desmond Reaves (4.7 feet, MAN). ALLEN WILLIAMSON MAKES IT! Assist: Jimmy Simons
Score: 70-66

[02:31] Team_017 possession (Score: 70-66)
Tony Smith drives, picks up Dejounte Paul. Help arrives from Allen Williamson! Tony Smith attempts a Layup. Contested by Allen Williamson (4.9 feet, ZONE). TONY SMITH MAKES IT! Assist: Desmond Reaves
Score: 72-66

[02:19] Team_071 possession (Score: 72-66)
Dejounte Paul attempts a Layup. Contested by Bam Williamson (4.7 feet, ZONE). DEJOUNTE PAUL MAKES IT!
Score: 72-68

[02:05] Team_017 possession (Score: 72-68)
Kyrie Middleton throws a bad pass! Stolen by Jimmy Simons! TURNOVER! (live ball)

[01:53] Team_071 possession (Score: 72-68)
FOUL! Holding foul on Desmond Reaves. [IN THE BONUS! 6 team fouls] Allen Williamson to the line for 2 free throws. (Desmond Reaves: 1 personal fouls)   FT 1/2: GOOD   FT 2/2: GOOD Allen Williamson makes 2/2 from the line.
Score: 72-70

[01:42] Team_017 possession (Score: 72-70)
FOUL! Reach-in foul on Dejounte Paul during the drive. [IN THE BONUS! 5 team fouls] Tony Smith to the line for 2 free throws. (Dejounte Paul: 3 personal fouls)   FT 1/2: GOOD   FT 2/2: GOOD Tony Smith makes 2/2 from the line.
Score: 74-70

[01:29] Team_071 possession (Score: 74-70)
Victor Anunoby attempts a Midrange. Contested by Vince Banchero (4.4 feet, MAN). VICTOR ANUNOBY MAKES IT!
Score: 74-72

[01:09] Team_017 possession (Score: 74-72)
Desmond Reaves attempts a 3Pt. Contested by Allen Williamson (4.7 feet, MAN). Desmond Reaves misses. Rebound secured by Dejounte Paul.

[00:54] Team_071 possession (Score: 74-72)
Dejounte Paul attempts a Layup. BLOCKED BY BAM WILLIAMSON! Ball deflects out of bounds off Dejounte Paul.

[00:39] Team_017 possession (Score: 74-72)
Desmond Reaves drives, Dejounte Paul stays with him. Desmond Reaves attempts a Layup. Contested by Dejounte Paul (5.0 feet, ZONE). DESMOND REAVES MAKES IT! Assist: Bam Williamson
Score: 76-72

[00:28] Team_071 possession (Score: 76-72)
Jimmy Simons attempts a Midrange. Contested by Kyrie Middleton (5.4 feet, MAN). JIMMY SIMONS MAKES IT!
Score: 76-74

[00:13] Team_017 possession (Score: 76-74)
Tony Smith drives, Dejounte Paul stays with him. Tony Smith attempts a Dunk. Contested by Dejounte Paul (5.2 feet, ZONE). Tony Smith misses. Rebound secured by Dejounte Paul.

================================================================================
                              3RD QUARTER COMPLETE                              
================================================================================

3RD QUARTER SCORE: Team_017 23, Team_071 32

BOX SCORE:
================================================================================

Team_017
--------------------------------------------------------------------------------
Player                MIN  PTS  REB  AST  TO      FG   FG%      3P   3P%
--------------------------------------------------------------------------------
Desmond Reaves         26    7    0    2   0   3/5    60.0     0/0   0.0
Tony Smith             26    6    2    0   0   3/6    50.0     0/0   0.0
Bam Williamson         26    4    3    2   0   2/2   100.0     0/0   0.0
Vince Banchero         26    4    0    0   0   2/5    40.0     0/0   0.0
Kyrie Middleton        26    2    1    0   0   1/3    33.3     0/0   0.0

TEAM: FG: 11/21 (52.4%), 3PT: 2/7 (28.6%), REB: 6 (1 off, 5 def), AST: 4, TO: 2
TEAM FOULS: 6 [Team_071 in BONUS]


Team_071
--------------------------------------------------------------------------------
Player                MIN  PTS  REB  AST  TO      FG   FG%      3P   3P%
--------------------------------------------------------------------------------
Jimmy Simons           26   13    1    3   0   6/6   100.0     0/0   0.0
Allen Williamson       26    8    0    0   0   3/4    75.0     0/0   0.0
Dejounte Paul          26    6    6    2   0   3/6    50.0     0/0   0.0
Victor Anunoby         26    5    0    1   0   3/4    75.0     0/0   0.0
Bam Iverson            26    0    5    0   0   0/1     0.0     0/0   0.0

TEAM: FG: 15/21 (71.4%), 3PT: 2/4 (50.0%), REB: 12 (2 off, 10 def), AST: 6, TO: 1
TEAM FOULS: 5 [Team_017 in BONUS]

================================================================================

================================================================================
                       4TH QUARTER - Team_017 vs Team_071                       
================================================================================

[12:00] Team_017 possession (Score: 76-74)
Bam Williamson attempts a Layup. Contested by Dejounte Paul (5.1 feet, ZONE). BAM WILLIAMSON MAKES IT!
Score: 78-74

[11:46] Team_071 possession (Score: 78-74)
Victor Anunoby attempts a 3Pt. Contested by Tony Smith (3.1 feet, ZONE). Victor Anunoby misses. Rebound secured by Bam Williamson.

[11:33] Team_017 possession (Score: 78-74)
Kyrie Middleton throws a bad pass! Stolen by Jimmy Simons! TURNOVER! (live ball)

[11:22] Team_071 possession (Score: 78-74)
Victor Anunoby drives and kicks out. Bam Iverson attempts a Midrange. Contested by Vince Banchero (4.4 feet, ZONE). Bam Iverson misses. Rebound secured by Bam Williamson.

[11:12] Team_017 possession (Score: 78-74)
Vince Banchero loses the ball! Stripped by Victor Anunoby! TURNOVER! (live ball)

[10:54] Team_071 possession (Score: 78-74)
Jimmy Simons attempts a Layup. Contested by Kyrie Middleton (5.4 feet, MAN). Jimmy Simons misses. Rebound secured by Kyrie Middleton.

[10:37] Team_017 possession (Score: 78-74)
Tony Smith drives, picks up Bam Iverson. Help arrives from Allen Williamson! Tony Smith attempts a Dunk. Contested by Allen Williamson (4.5 feet, MAN). TONY SMITH MAKES IT!
Score: 80-74

[10:22] Team_071 possession (Score: 80-74)
Dejounte Paul attempts a Layup. Contested by Bam Williamson (4.9 feet, MAN). DEJOUNTE PAUL MAKES IT! Assist: Allen Williamson
Score: 80-76

[10:05] Team_017 possession (Score: 80-76)
Tony Smith makes the Dunk and draws the foul on Allen Williamson! And-1! Tony Smith to the line for 1. [Team fouls: 1] (Allen Williamson: 1 personal fouls)   FT 1/1: GOOD Tony Smith makes 1/1 from the line.
Score: 83-76

[09:51] Team_071 possession (Score: 83-76)
Victor Anunoby attempts a 3Pt. Contested by Vince Banchero (4.6 feet, MAN). Victor Anunoby misses. Offensive rebound by Jimmy Simons! Jimmy Simons kicks it out.

[09:36] Team_071 possession (Score: 83-76)
Allen Williamson attempts a 3Pt. Contested by Tony Smith (3.7 feet, ZONE). Allen Williamson misses. Rebound secured by Kyrie Middleton.

[09:18] Team_017 possession (Score: 83-76)
Desmond Reaves throws a bad pass out of bounds! TURNOVER! (dead ball)

[09:18] Substitution (Team_017): Desmond Reaves OUT → Blake Reaves IN (stamina_rule2)

[09:18] Substitution (Team_017): Vince Banchero OUT → Tobias Bridges IN (stamina_rule2)

[09:18] Substitution (Team_017): Tony Smith OUT → Shaquille Stewart IN (stamina_rule2)

[09:18] Substitution (Team_017): Kyrie Middleton OUT → Ja Stewart IN (stamina_rule2)

[09:18] Substitution (Team_017): Bam Williamson OUT → Klay Holiday IN (stamina_rule2)

[09:18] Substitution (Team_071): Allen Williamson OUT → Evan Sexton IN (stamina_rule2)

[09:18] Substitution (Team_071): Victor Anunoby OUT → Paul Ball IN (stamina_rule2)

[09:18] Substitution (Team_071): Bam Iverson OUT → Immanuel Ginobili IN (stamina_rule2)

[09:18] Substitution (Team_071): Jimmy Simons OUT → Jordan Durant IN (stamina_rule2)

[09:18] Substitution (Team_071): Dejounte Paul OUT → Tyrese Brogdon IN (stamina_rule2)

[09:04] Team_071 possession (Score: 83-76)
Tyrese Brogdon throws a bad pass! Stolen by Klay Holiday! TURNOVER! (live ball)

[08:53] Team_017 possession (Score: 83-76)
FOUL! Shooting foul on Jordan Durant. Ja Stewart to the line for 2 free throws. [Team fouls: 2] (Jordan Durant: 1 personal fouls)   FT 1/2: GOOD   FT 2/2: GOOD Ja Stewart makes 2/2 from the line.
Score: 85-76

[08:39] Team_071 possession (Score: 85-76)
Evan Sexton attempts a Layup. Contested by Ja Stewart (5.2 feet, ZONE). EVAN SEXTON MAKES IT!
Score: 85-78

[08:24] Team_017 possession (Score: 85-78)
FOUL! Holding foul on Tyrese Brogdon. [Team fouls: 3] No free throws, side out. (Tyrese Brogdon: 1 personal fouls)

[08:12] Team_017 possession (Score: 85-78)
FOUL! Holding foul on Evan Sexton. [Team fouls: 4] No free throws, side out. (Evan Sexton: 1 personal fouls)

[07:59] Team_017 possession (Score: 85-78)
Tobias Bridges attempts a 3Pt. Contested by Paul Ball (4.4 feet, MAN). Tobias Bridges misses. Rebound secured by Evan Sexton.

[07:43] Team_071 possession (Score: 85-78)
Immanuel Ginobili attempts a 3Pt. Contested by Shaquille Stewart (4.3 feet, MAN). Immanuel Ginobili misses. Rebound secured by Shaquille Stewart.

[07:30] Team_017 possession (Score: 85-78)
Shaquille Stewart attempts a 3Pt. Contested by Immanuel Ginobili (4.6 feet, MAN). Shaquille Stewart misses. Rebound secured by Jordan Durant.

[07:17] Team_071 possession (Score: 85-78)
Paul Ball makes the Layup and draws the foul on Tobias Bridges! And-1! Paul Ball to the line for 1. [Team fouls: 1] (Tobias Bridges: 1 personal fouls)   FT 1/1: MISS Paul Ball makes 0/1 from the line. Rebound secured by Klay Holiday.
Score: 85-80

[07:04] Team_017 possession (Score: 85-80)
Klay Holiday drives, Tyrese Brogdon stays with him. Klay Holiday attempts a Dunk. Contested by Tyrese Brogdon (5.9 feet, MAN). Klay Holiday misses. Rebound secured by Evan Sexton.

[06:51] Team_071 possession (Score: 85-80)
Jordan Durant attempts a 3Pt. Contested by Tobias Bridges (4.0 feet, ZONE). Jordan Durant misses. Rebound secured by Shaquille Stewart.

[06:38] Team_017 possession (Score: 85-80)
Blake Reaves attempts a 3Pt. Contested by Evan Sexton (5.2 feet, MAN). Blake Reaves misses. Rebound secured by Evan Sexton.

[06:27] Team_071 possession (Score: 85-80)
Paul Ball attempts a Midrange. Contested by Tobias Bridges (4.0 feet, ZONE). Paul Ball misses. Rebound secured by Klay Holiday.

[06:10] Team_017 possession (Score: 85-80)
Ja Stewart attempts a 3Pt. Contested by Paul Ball (4.0 feet, ZONE). Ja Stewart misses. Rebound secured by Immanuel Ginobili.

[05:57] Team_071 possession (Score: 85-80)
Paul Ball drives, Tobias Bridges stays with him. Paul Ball attempts a Dunk. Contested by Tobias Bridges (4.0 feet, MAN). PAUL BALL MAKES IT! Assist: Tyrese Brogdon
Score: 85-82

[05:42] Team_017 possession (Score: 85-82)
Shaquille Stewart attempts a 3Pt. Contested by Jordan Durant (5.1 feet, ZONE). Shaquille Stewart misses. Rebound secured by Immanuel Ginobili.

[05:26] Team_071 possession (Score: 85-82)
Immanuel Ginobili attempts a Layup. Contested by Ja Stewart (4.7 feet, ZONE). IMMANUEL GINOBILI MAKES IT! Assist: Tyrese Brogdon
Score: 85-84

[05:10] Team_017 possession (Score: 85-84)
Shaquille Stewart attempts a 3Pt. Contested by Immanuel Ginobili (4.6 feet, MAN). Shaquille Stewart misses. Rebound secured by Immanuel Ginobili.

[04:51] Team_071 possession (Score: 85-84)
Immanuel Ginobili attempts a 3Pt. Contested by Tobias Bridges (4.0 feet, ZONE). Immanuel Ginobili misses. Rebound secured by Shaquille Stewart.

[04:41] Team_017 possession (Score: 85-84)
Shaquille Stewart drives and kicks out. Ja Stewart attempts a 3Pt. Contested by Paul Ball (4.3 feet, ZONE). Ja Stewart misses. Offensive rebound by Ja Stewart! Ja Stewart kicks it out.

[04:26] Team_017 possession (Score: 85-84)
Blake Reaves attempts a 3Pt. Contested by Evan Sexton (5.2 feet, MAN). BLAKE REAVES MAKES IT! Assist: Tobias Bridges
Score: 88-84

[04:12] Team_071 possession (Score: 88-84)
Paul Ball drives and kicks out. Immanuel Ginobili attempts a 3Pt. Contested by Tobias Bridges (4.0 feet, ZONE). Immanuel Ginobili misses. Rebound secured by Shaquille Stewart.

[03:57] Team_017 possession (Score: 88-84)
Shaquille Stewart attempts a 3Pt. Contested by Paul Ball (4.7 feet, ZONE). Shaquille Stewart misses. Rebound secured by Evan Sexton.

[03:43] Team_071 possession (Score: 88-84)
Evan Sexton attempts a Midrange. Contested by Blake Reaves (5.7 feet, MAN). Evan Sexton misses. Offensive rebound by Jordan Durant! Jordan Durant kicks it out.

[03:31] Team_071 possession (Score: 88-84)
Jordan Durant makes the 3Pt and draws the foul on Ja Stewart! And-1! Jordan Durant to the line for 1. [Team fouls: 2] (Ja Stewart: 1 personal fouls)   FT 1/1: MISS Jordan Durant makes 0/1 from the line. Offensive rebound by Immanuel Ginobili! Immanuel Ginobili kicks it out.
Score: 88-87

[03:18] Team_071 possession (Score: 88-87)
Tyrese Brogdon drives, Ja Stewart stays with him. Tyrese Brogdon attempts a Layup. Contested by Ja Stewart (5.1 feet, ZONE). Tyrese Brogdon misses. Rebound secured by Ja Stewart.

[03:07] Team_017 possession (Score: 88-87)
Tobias Bridges commits a violation (traveling/carry)! TURNOVER! (dead ball)

[02:50] Team_071 possession (Score: 88-87)
Jordan Durant attempts a Midrange. Contested by Ja Stewart (4.7 feet, MAN). JORDAN DURANT MAKES IT!
Score: 88-89

[02:35] Team_017 possession (Score: 88-89)
Ja Stewart attempts a 3Pt. Contested by Paul Ball (4.0 feet, ZONE). Ja Stewart misses. Rebound secured by Jordan Durant.

[02:20] Team_071 possession (Score: 88-89)
Immanuel Ginobili attempts a 3Pt. Contested by Shaquille Stewart (4.3 feet, MAN). Immanuel Ginobili misses. Rebound secured by Ja Stewart.

[02:02] Team_017 possession (Score: 88-89)
Shaquille Stewart attempts a Midrange. Contested by Jordan Durant (5.2 feet, ZONE). Shaquille Stewart misses. Rebound secured by Evan Sexton.

[01:50] Team_071 possession (Score: 88-89)
Tyrese Brogdon drives to the basket... Tyrese Brogdon loses the ball! Stripped by Ja Stewart! TURNOVER! (live ball)

[01:35] Team_017 possession (Score: 88-89)
Klay Holiday drives and kicks out. Ja Stewart attempts a 3Pt. Contested by Paul Ball (4.4 feet, ZONE). Ja Stewart misses. Rebound secured by Immanuel Ginobili.

[01:22] Team_071 possession (Score: 88-89)
Jordan Durant loses the ball! Stripped by Ja Stewart! TURNOVER! (live ball)

[01:12] Team_017 possession (Score: 88-89)
Ja Stewart attempts a Midrange. Contested by Jordan Durant (4.6 feet, ZONE). JA STEWART MAKES IT! Assist: Tobias Bridges
Score: 90-89

[00:57] Team_071 possession (Score: 90-89)
FOUL! Shooting foul on Tobias Bridges. Immanuel Ginobili to the line for 2 free throws. [Team fouls: 3] (Tobias Bridges: 2 personal fouls)   FT 1/2: GOOD   FT 2/2: MISS Immanuel Ginobili makes 1/2 from the line. Rebound secured by Shaquille Stewart.
Score: 90-90

[00:46] Team_017 possession (Score: 90-90)
Tobias Bridges makes the Layup and draws the foul on Paul Ball! And-1! Tobias Bridges to the line for 1. [BONUS: 5 team fouls] (Paul Ball: 1 personal fouls)   FT 1/1: GOOD Tobias Bridges makes 1/1 from the line.
Score: 93-90

[00:32] Team_071 possession (Score: 93-90)
FOUL! Reach-in foul on Tobias Bridges during the drive. [Team fouls: 4] No free throws, side out. (Tobias Bridges: 3 personal fouls)

[00:14] Team_071 possession (Score: 93-90)
Tyrese Brogdon drives to the basket... FOUL! Offensive foul on Tyrese Brogdon! Klay Holiday drew the charge! [Team fouls: 6] (Tyrese Brogdon: 2 personal fouls) TURNOVER! (dead ball)

[00:01] Team_017 possession (Score: 93-90)
Blake Reaves attempts a 3Pt. Contested by Paul Ball (4.5 feet, ZONE). Blake Reaves misses. Offensive rebound by Shaquille Stewart! Shaquille Stewart kicks it out.

================================================================================
                              4TH QUARTER COMPLETE                              
================================================================================

4TH QUARTER SCORE: Team_017 17, Team_071 16

BOX SCORE:
================================================================================

Team_017
--------------------------------------------------------------------------------
Player                MIN  PTS  REB  AST  TO      FG   FG%      3P   3P%
--------------------------------------------------------------------------------
Tony Smith             29    5    0    0   0   2/2   100.0     0/0   0.0
Ja Stewart             19    4    3    0   0   2/4    50.0     0/0   0.0
Tobias Bridges         19    3    0    2   0   1/2    50.0     0/0   0.0
Blake Reaves           19    3    0    0   0   1/2    50.0     0/0   0.0
Bam Williamson         29    2    2    0   0   1/1   100.0     0/0   0.0
Kyrie Middleton        29    0    2    0   0   0/0     0.0     0/0   0.0
Shaquille Stewart      19    0    6    0   0   0/5     0.0     0/0   0.0
Klay Holiday           19    0    2    0   0   0/2     0.0     0/0   0.0

TEAM: FG: 7/18 (38.9%), 3PT: 1/9 (11.1%), REB: 15 (2 off, 13 def), AST: 2, TO: 4
TEAM FOULS: 4


Team_071
--------------------------------------------------------------------------------
Player                MIN  PTS  REB  AST  TO      FG   FG%      3P   3P%
--------------------------------------------------------------------------------
Dejounte Paul          29    2    0    0   0   1/1   100.0     0/0   0.0
Evan Sexton            19    2    5    0   0   1/1   100.0     0/0   0.0
Immanuel Ginobili      19    2    5    0   0   1/5    20.0     0/0   0.0
Jordan Durant          19    2    3    0   0   1/2    50.0     0/0   0.0
Paul Ball              19    2    0    0   0   1/4    25.0     0/0   0.0
Victor Anunoby         29    0    0    0   0   0/2     0.0     0/0   0.0
Jimmy Simons           29    0    1    0   0   0/1     0.0     0/0   0.0
Allen Williamson       29    0    0    1   0   0/1     0.0     0/0   0.0
Tyrese Brogdon         19    0    0    2   0   0/1     0.0     0/0   0.0

TEAM: FG: 5/18 (27.8%), 3PT: 0/6 (0.0%), REB: 14 (3 off, 11 def), AST: 3, TO: 4
TEAM FOULS: 6 [Team_017 in BONUS]

================================================================================

================================================================================
                               FULL GAME COMPLETE                               
================================================================================

FINAL SCORE: Team_017 93, Team_071 90

SCORING BY QUARTER:
--------------------------------------------------------------------------------
Team                     Q1     Q2     Q3     Q4    FINAL
--------------------------------------------------------------------------------
Team_017                 24     29     23     17       93
Team_071                 23     19     32     16       90
--------------------------------------------------------------------------------

FULL GAME BOX SCORE:
================================================================================

Team_017
--------------------------------------------------------------------------------
Player                MIN  PTS  REB  AST  TO      FG   FG%      3P   3P%      FT STL BLK
--------------------------------------------------------------------------------
Desmond Reaves         29   11    0    3   1   6/13   46.2   2/6    33.3   0/0     1   0
Vince Banchero         29    8    0    2   3   5/10   50.0   1/2    50.0   0/0     0   0
Tony Smith             29   15    4    1   0   7/12   58.3   0/3     0.0   3/3     1   0
Kyrie Middleton        29    5    7    1   4   2/5    40.0   0/1     0.0   0/0     0   0
Bam Williamson         29   19   11    3   0   8/9    88.9   0/0     0.0   5/6     1   1
Blake Reaves           19   15    0    0   0   5/7    71.4   1/3    33.3   1/1     0   0
Tobias Bridges         19    6    0    5   1   2/4    50.0   0/2     0.0   2/2     0   0
Shaquille Stewart      19    6   11    0   0   4/10   40.0   0/5     0.0   0/0     1   1
Ja Stewart             19    8    6    1   0   4/7    57.1   0/2     0.0   2/2     2   0
Klay Holiday           19    0    5    3   1   0/5     0.0   0/0     0.0   0/0     1   0

TEAM: FG: 43/82 (52.4%), 3PT: 4/24 (16.7%), REB: 44 (8 off, 36 def), AST: 19, TO: 10


Team_071
--------------------------------------------------------------------------------
Player                MIN  PTS  REB  AST  TO      FG   FG%      3P   3P%      FT STL BLK
--------------------------------------------------------------------------------
Allen Williamson       29   12    0    2   2   3/7    42.9   2/5    40.0   4/4     0   0
Victor Anunoby         29    8    0    1   0   5/10   50.0   0/2     0.0   2/3     2   1
Bam Iverson            29    2    6    0   3   1/3    33.3   0/0     0.0   2/2     0   0
Jimmy Simons           29   23    8    6   1  11/13   84.6   0/0     0.0   9/10    3   1
Dejounte Paul          29   16   13    2   1   8/13   61.5   0/3     0.0   3/4     0   1
Evan Sexton            19    2    6    0   1   1/5    20.0   0/2     0.0   0/0     0   0
Paul Ball              19    4    0    0   1   1/6    16.7   0/1     0.0   2/3     0   0
Immanuel Ginobili      19    4    8    0   2   2/8    25.0   0/4     0.0   3/4     0   0
Jordan Durant          19    4    6    0   3   3/5    60.0   0/2     0.0   2/3     0   0
Tyrese Brogdon         19    6    0    2   1   3/5    60.0   0/1     0.0   4/5     1   0

TEAM: FG: 39/76 (51.3%), 3PT: 2/20 (10.0%), REB: 47 (8 off, 39 def), AST: 13, TO: 15

================================================================================
