================================================================================
                        FULL GAME - Team_026 vs Team_060                        
================================================================================

================================================================================
                       1ST QUARTER - Team_026 vs Team_060                       
================================================================================

[12:00] Team_026 possession (Score: 0-0)
Immanuel Hyland attempts a Midrange. Contested by Joel Morant (5.4 feet, ZONE). Immanuel Hyland misses. FOUL! Loose ball foul on Immanuel Ming during the rebound battle. [Team fouls: 1] No free throws, side out. (Immanuel Ming: 1 personal fouls)

[11:46] Team_026 possession (Score: 0-0)
Wendell Gasol attempts a Layup. Contested by Joel Morant (5.6 feet, MAN). Wendell Gasol misses. Offensive rebound by Kobe Booker! Kobe Booker kicks it out.

[11:36] Team_026 possession (Score: 0-0)
Klay Giddey attempts a 3Pt. Contested by Julius Green (3.7 feet, ZONE). Klay Giddey misses. Rebound secured by Immanuel Ming.

[11:23] Team_060 possession (Score: 0-0)
Larry Westbrook attempts a Midrange. Contested by Klay Giddey (6.0 feet, ZONE). Larry Westbrook misses. Rebound secured by Kobe Booker.

[11:06] Team_026 possession (Score: 0-0)
Kobe Booker attempts a 3Pt. Contested by Immanuel Ming (3.9 feet, ZONE). Kobe Booker misses. Rebound secured by Jaren George.

[10:52] Team_060 possession (Score: 0-0)
Larry Westbrook attempts a 3Pt. Wide open! Shaquille Trent is 6.1 feet away. [MAN] Larry Westbrook misses. Rebound secured by Shaquille Trent.

[10:33] Team_026 possession (Score: 0-0)
Wendell Gasol attempts a 3Pt. Contested by Joel Morant (5.6 feet, ZONE). Wendell Gasol misses. Rebound secured by Larry Westbrook.

[10:16] Team_060 possession (Score: 0-0)
Jaren George drives and kicks out. Joel Morant attempts a Midrange. Contested by Shaquille Trent (5.6 feet, ZONE). Joel Morant misses. Rebound secured by Kobe Booker.

[09:58] Team_026 possession (Score: 0-0)
Wendell Gasol attempts a 3Pt. Contested by Julius Green (4.1 feet, ZONE). Wendell Gasol misses. Offensive rebound by Kobe Booker! Kobe Booker kicks it out.

[09:45] Team_026 possession (Score: 0-0)
Immanuel Hyland attempts a 3Pt. Contested by Julius Green (3.9 feet, ZONE). Immanuel Hyland misses. Rebound secured by Jaren George.

[09:34] Team_060 possession (Score: 0-0)
Jaren George attempts a 3Pt. Contested by Immanuel Hyland (4.1 feet, ZONE). Jaren George misses. Offensive rebound by Immanuel Ming! Immanuel Ming kicks it out.

[09:20] Team_060 possession (Score: 0-0)
Larry Westbrook drives and kicks out. Larry Westbrook attempts a 3Pt. Contested by Wendell Gasol (4.6 feet, ZONE). LARRY WESTBROOK MAKES IT! Assist: Joel Morant
Score: 0-3

[09:07] Team_026 possession (Score: 0-3)
Immanuel Hyland attempts a Layup. Contested by Julius Green (3.9 feet, MAN). Immanuel Hyland misses. Rebound secured by Larry Westbrook.

[08:54] Team_060 possession (Score: 0-3)
Julius Green attempts a 3Pt. Contested by Immanuel Hyland (3.8 feet, ZONE). JULIUS GREEN MAKES IT! Assist: Jaren George
Score: 0-6

[08:40] Team_026 possession (Score: 0-6)
Kobe Booker throws a bad pass! Stolen by Jaren George! TURNOVER! (live ball)

[08:24] Team_060 possession (Score: 0-6)
Jaren George drives to the basket... Jaren George commits a violation (traveling/carry)! TURNOVER! (dead ball)

[08:09] Team_026 possession (Score: 0-6)
Kobe Booker attempts a Layup. Contested by Jaren George (5.4 feet, ZONE). Kobe Booker misses. Rebound secured by Immanuel Ming.

[07:56] Team_060 possession (Score: 0-6)
Julius Green attempts a 3Pt. Contested by Immanuel Hyland (3.8 feet, ZONE). JULIUS GREEN MAKES IT! Assist: Immanuel Ming
Score: 0-9

[07:42] Team_026 possession (Score: 0-9)
Klay Giddey attempts a 3Pt. Contested by Immanuel Ming (3.6 feet, MAN). KLAY GIDDEY MAKES IT!
Score: 3-9

[07:29] Team_060 possession (Score: 3-9)
FOUL! Reach-in foul on Kobe Booker during the drive. [Team fouls: 1] No free throws, side out. (Kobe Booker: 1 personal fouls)

[07:13] Team_060 possession (Score: 3-9)
Immanuel Ming makes the Midrange and draws the foul on Klay Giddey! And-1! Immanuel Ming to the line for 1. [Team fouls: 2] (Klay Giddey: 1 personal fouls)   FT 1/1: GOOD Immanuel Ming makes 1/1 from the line.
Score: 3-12

[06:59] Team_026 possession (Score: 3-12)
FOUL! Holding foul on Immanuel Ming. [Team fouls: 2] No free throws, side out. (Immanuel Ming: 2 personal fouls)

[06:49] Team_026 possession (Score: 3-12)
Shaquille Trent attempts a 3Pt. Contested by Larry Westbrook (4.5 feet, MAN). Shaquille Trent misses. Rebound secured by Larry Westbrook.

[06:33] Team_060 possession (Score: 3-12)
Immanuel Ming attempts a 3Pt. Contested by Klay Giddey (5.4 feet, MAN). Immanuel Ming misses. Rebound secured by Shaquille Trent.

[06:21] Team_026 possession (Score: 3-12)
Wendell Gasol attempts a 3Pt. Contested by Joel Morant (5.6 feet, MAN). Wendell Gasol misses. Rebound secured by Immanuel Ming.

[06:08] Team_060 possession (Score: 3-12)
Larry Westbrook loses the ball! Stripped by Shaquille Trent! TURNOVER! (live ball)

[05:54] Team_026 possession (Score: 3-12)
Shaquille Trent attempts a Midrange. Contested by Larry Westbrook (4.5 feet, MAN). Shaquille Trent misses. Offensive rebound by Kobe Booker! Kobe Booker kicks it out.

[05:39] Team_026 possession (Score: 3-12)
FOUL! Offensive foul on Klay Giddey! Immanuel Ming drew the charge! [Team fouls: 3] (Klay Giddey: 2 personal fouls) TURNOVER! (dead ball)

[05:22] Team_060 possession (Score: 3-12)
Immanuel Ming makes the 3Pt and draws the foul on Wendell Gasol! And-1! Immanuel Ming to the line for 1. [Team fouls: 4] (Wendell Gasol: 1 personal fouls)   FT 1/1: GOOD Immanuel Ming makes 1/1 from the line.
Score: 3-16

[05:04] Team_026 possession (Score: 3-16)
Shaquille Trent drives and kicks out. Wendell Gasol attempts a Midrange. Contested by Joel Morant (5.3 feet, MAN). WENDELL GASOL MAKES IT!
Score: 5-16

[04:49] Team_060 possession (Score: 5-16)
Julius Green drives to the basket... Julius Green throws a bad pass! Stolen by Shaquille Trent! TURNOVER! (live ball)

[04:35] Team_026 possession (Score: 5-16)
FOUL! Holding foul on Jaren George. [Team fouls: 3] No free throws, side out. (Jaren George: 1 personal fouls)

[04:18] Team_026 possession (Score: 5-16)
Klay Giddey attempts a 3Pt. Contested by Julius Green (3.8 feet, ZONE). Klay Giddey misses. Rebound secured by Immanuel Ming.

[04:04] Team_060 possession (Score: 5-16)
Immanuel Ming drives and kicks out. Jaren George attempts a Midrange. Contested by Kobe Booker (4.3 feet, MAN). Jaren George misses. Rebound secured by Kobe Booker.

[03:54] Team_026 possession (Score: 5-16)
Kobe Booker makes the 3Pt and draws the foul on Jaren George! And-1! Kobe Booker to the line for 1. [Team fouls: 4] (Jaren George: 2 personal fouls)   FT 1/1: MISS Kobe Booker makes 0/1 from the line. Rebound secured by Larry Westbrook.
Score: 8-16

[03:39] Team_060 possession (Score: 8-16)
Jaren George attempts a Midrange. Contested by Kobe Booker (4.5 feet, MAN). Jaren George misses. Rebound secured by Kobe Booker.

[03:22] Team_026 possession (Score: 8-16)
Klay Giddey attempts a Layup. BLOCKED BY JULIUS GREEN! Ball is loose! Offensive rebound by Shaquille Trent! Shaquille Trent kicks it out.

[03:04] Team_026 possession (Score: 8-16)
Shaquille Trent drives and kicks out. Wendell Gasol attempts a 3Pt. Contested by Joel Morant (5.5 feet, MAN). Wendell Gasol misses. Rebound secured by Larry Westbrook.

[02:50] Team_060 possession (Score: 8-16)
Immanuel Ming attempts a Midrange. Contested by Immanuel Hyland (4.2 feet, ZONE). Immanuel Ming misses. Offensive rebound by Immanuel Ming! Immanuel Ming kicks it out.

[02:35] Team_060 possession (Score: 8-16)
Joel Morant attempts a 3Pt. Contested by Immanuel Hyland (4.0 feet, ZONE). Joel Morant misses. Rebound secured by Kobe Booker.

[02:19] Team_026 possession (Score: 8-16)
FOUL! Shooting foul on Julius Green. Klay Giddey to the line for 2 free throws. [BONUS: 5 team fouls] (Julius Green: 1 personal fouls)   FT 1/2: GOOD   FT 2/2: GOOD Klay Giddey makes 2/2 from the line.
Score: 10-16

[02:06] Team_060 possession (Score: 10-16)
Immanuel Ming drives to the basket... Immanuel Ming throws a bad pass! Stolen by Klay Giddey! TURNOVER! (live ball)

[01:51] Team_026 possession (Score: 10-16)
FOUL! Shooting foul on Immanuel Ming. Klay Giddey to the line for 3 free throws. [BONUS: 6 team fouls] (Immanuel Ming: 3 personal fouls)   FT 1/3: GOOD   FT 2/3: GOOD   FT 3/3: GOOD Klay Giddey makes 3/3 from the line.
Score: 13-16

[01:36] Team_060 possession (Score: 13-16)
FOUL! Shooting foul on Immanuel Hyland. Joel Morant to the line for 3 free throws. [BONUS: 5 team fouls] (Immanuel Hyland: 1 personal fouls)   FT 1/3: GOOD   FT 2/3: GOOD   FT 3/3: GOOD Joel Morant makes 3/3 from the line.
Score: 13-19

[01:21] Team_026 possession (Score: 13-19)
Kobe Booker attempts a 3Pt. Contested by Julius Green (4.4 feet, ZONE). Kobe Booker misses. Rebound secured by Larry Westbrook.

[01:04] Team_060 possession (Score: 13-19)
Immanuel Ming attempts a Midrange. Contested by Klay Giddey (5.8 feet, ZONE). Immanuel Ming misses. Rebound secured by Immanuel Hyland.

[00:51] Team_026 possession (Score: 13-19)
Shaquille Trent makes the Dunk and draws the foul on Larry Westbrook! And-1! Shaquille Trent to the line for 1. [BONUS: 7 team fouls] (Larry Westbrook: 1 personal fouls)   FT 1/1: GOOD Shaquille Trent makes 1/1 from the line.
Score: 16-19

[00:37] Team_060 possession (Score: 16-19)
Julius Green attempts a 3Pt. Contested by Immanuel Hyland (4.3 feet, ZONE). JULIUS GREEN MAKES IT! Assist: Jaren George
Score: 16-22

[00:23] Team_026 possession (Score: 16-22)
Klay Giddey attempts a Midrange. Contested by Immanuel Ming (4.0 feet, MAN). Klay Giddey misses. Rebound secured by Larry Westbrook.

[00:08] Team_060 possession (Score: 16-22)
Joel Morant drives and kicks out. Jaren George attempts a Midrange. Wide open! Shaquille Trent is 6.1 feet away. [ZONE] Jaren George misses. FOUL! Loose ball foul on Kobe Booker during the rebound battle. [IN THE BONUS! 6 team fouls] Immanuel Ming to the line for 2 free throws. (Kobe Booker: 2 personal fouls)   FT 1/2: GOOD   FT 2/2: GOOD Immanuel Ming makes 2/2 from the line.
Score: 16-24

================================================================================
                              1ST QUARTER COMPLETE                              
================================================================================

1ST QUARTER SCORE: Team_026 16, Team_060 24

BOX SCORE:
================================================================================

Team_026
--------------------------------------------------------------------------------
Player                MIN  PTS  REB  AST  TO      FG   FG%      3P   3P%
--------------------------------------------------------------------------------
Klay Giddey            12    8    0    0   0   3/6    50.0     0/0   0.0
Shaquille Trent        12    3    3    0   0   1/3    33.3     0/0   0.0
Wendell Gasol          12    2    0    0   0   1/3    33.3     0/0   0.0
Kobe Booker            12    0    9    0   0   0/4     0.0     0/0   0.0
Immanuel Hyland        12    0    1    0   0   0/2     0.0     0/0   0.0

TEAM: FG: 5/18 (27.8%), 3PT: 2/11 (18.2%), REB: 13 (5 off, 8 def), AST: 0, TO: 2
TEAM FOULS: 6 [Team_060 in BONUS]


Team_060
--------------------------------------------------------------------------------
Player                MIN  PTS  REB  AST  TO      FG   FG%      3P   3P%
--------------------------------------------------------------------------------
Immanuel Ming          12    9    6    1   0   3/6    50.0     0/0   0.0
Julius Green           12    9    0    0   0   3/3   100.0     0/0   0.0
Larry Westbrook        12    3    7    0   0   1/3    33.3     0/0   0.0
Joel Morant            12    3    0    1   0   1/2    50.0     0/0   0.0
Jaren George           12    0    2    2   0   0/2     0.0     0/0   0.0

TEAM: FG: 8/16 (50.0%), 3PT: 5/8 (62.5%), REB: 15 (2 off, 13 def), AST: 4, TO: 4
TEAM FOULS: 7 [Team_026 in BONUS]

================================================================================

================================================================================
                       2ND QUARTER - Team_026 vs Team_060                       
================================================================================

[12:00] Team_026 possession (Score: 16-24)
FOUL! Reach-in foul on Jaren George during the drive. [Team fouls: 1] No free throws, side out. (Jaren George: 1 personal fouls)

[11:50] Team_026 possession (Score: 16-24)
Shaquille Trent attempts a 3Pt. Contested by Julius Green (3.9 feet, ZONE). Shaquille Trent misses. Offensive rebound by Kobe Booker! Kobe Booker kicks it out.

[11:36] Team_026 possession (Score: 16-24)
Shaquille Trent loses the ball! Stripped by Larry Westbrook! TURNOVER! (live ball)

[11:26] Team_060 possession (Score: 16-24)
Jaren George attempts a Midrange. Wide open! Shaquille Trent is 6.0 feet away. [ZONE] JAREN GEORGE MAKES IT! Assist: Immanuel Ming
Score: 16-26

[11:13] Team_026 possession (Score: 16-26)
Immanuel Hyland makes the Midrange and draws the foul on Julius Green! And-1! Immanuel Hyland to the line for 1. [Team fouls: 2] (Julius Green: 1 personal fouls)   FT 1/1: GOOD Immanuel Hyland makes 1/1 from the line.
Score: 19-26

[10:56] Team_060 possession (Score: 19-26)
Jaren George attempts a Layup. Contested by Kobe Booker (4.8 feet, MAN). JAREN GEORGE MAKES IT!
Score: 19-28

[10:42] Team_026 possession (Score: 19-28)
Shaquille Trent attempts a 3Pt. Contested by Larry Westbrook (5.0 feet, MAN). SHAQUILLE TRENT MAKES IT! Assist: Immanuel Hyland
Score: 22-28

[10:28] Team_060 possession (Score: 22-28)
Jaren George attempts a 3Pt. Contested by Immanuel Hyland (4.6 feet, ZONE). Jaren George misses. Rebound secured by Kobe Booker.

[10:16] Team_026 possession (Score: 22-28)
Immanuel Hyland attempts a 3Pt. Contested by Julius Green (4.4 feet, MAN). Immanuel Hyland misses. Rebound secured by Jaren George.

[10:05] Team_060 possession (Score: 22-28)
Larry Westbrook attempts a Midrange. Wide open! Shaquille Trent is 6.5 feet away. [MAN] LARRY WESTBROOK MAKES IT! Assist: Immanuel Ming
Score: 22-30

[09:51] Team_026 possession (Score: 22-30)
Immanuel Hyland drives, picks up Jaren George. Help arrives from Julius Green! Immanuel Hyland attempts a Layup. Contested by Julius Green (5.9 feet, ZONE). Immanuel Hyland misses. Offensive rebound by Shaquille Trent! Shaquille Trent kicks it out.

[09:35] Team_026 possession (Score: 22-30)
Wendell Gasol attempts a 3Pt. Contested by Julius Green (4.7 feet, ZONE). Wendell Gasol misses. Rebound secured by Larry Westbrook.

[09:20] Team_060 possession (Score: 22-30)
Jaren George drives to the basket... Jaren George loses control! Ball rolls out of bounds! TURNOVER! (dead ball)

[09:20] Substitution (Team_026): Wendell Gasol OUT → Myles Tatum IN (stamina_rule2)

[09:20] Substitution (Team_026): Immanuel Hyland OUT → Karl Barrett IN (stamina_rule2)

[09:20] Substitution (Team_026): Klay Giddey OUT → Josh Simons IN (stamina_rule2)

[09:20] Substitution (Team_026): Shaquille Trent OUT → Damian Doncic IN (stamina_rule2)

[09:20] Substitution (Team_026): Kobe Booker OUT → Dirk Randle IN (stamina_rule2)

[09:20] Substitution (Team_060): Joel Morant OUT → Domantas Barnes IN (stamina_rule2)

[09:20] Substitution (Team_060): Julius Green OUT → Rudy Ginobili IN (stamina_rule2)

[09:20] Substitution (Team_060): Immanuel Ming OUT → Jarrett Wagner IN (stamina_rule2)

[09:20] Substitution (Team_060): Larry Westbrook OUT → Yao Tatum IN (stamina_rule2)

[09:20] Substitution (Team_060): Jaren George OUT → Klay Haliburton IN (stamina_rule2)

[09:10] Team_026 possession (Score: 22-30)
Karl Barrett attempts a 3Pt. Contested by Rudy Ginobili (4.4 feet, MAN). Karl Barrett misses. Offensive rebound by Damian Doncic! Damian Doncic kicks it out.

[08:55] Team_026 possession (Score: 22-30)
Josh Simons attempts a 3Pt. Contested by Domantas Barnes (4.4 feet, ZONE). Josh Simons misses. Rebound secured by Domantas Barnes.

[08:40] Team_060 possession (Score: 22-30)
Rudy Ginobili makes the Layup and draws the foul on Damian Doncic! And-1! Rudy Ginobili to the line for 1. [Team fouls: 1] (Damian Doncic: 1 personal fouls)   FT 1/1: MISS Rudy Ginobili makes 0/1 from the line. Offensive rebound by Domantas Barnes! Domantas Barnes kicks it out.
Score: 22-32

[08:25] Team_060 possession (Score: 22-32)
Domantas Barnes drives, picks up Damian Doncic. Help arrives from Karl Barrett! Domantas Barnes attempts a Dunk. Contested by Karl Barrett (5.5 feet, ZONE). Domantas Barnes misses. Rebound secured by Josh Simons.

[08:10] Team_026 possession (Score: 22-32)
Dirk Randle makes the Layup and draws the foul on Klay Haliburton! And-1! Dirk Randle to the line for 1. [Team fouls: 3] (Klay Haliburton: 1 personal fouls)   FT 1/1: GOOD Dirk Randle makes 1/1 from the line.
Score: 25-32

[07:53] Team_060 possession (Score: 25-32)
Jarrett Wagner drives and kicks out. Jarrett Wagner attempts a 3Pt. Contested by Josh Simons (5.1 feet, MAN). Jarrett Wagner misses. Offensive rebound by Domantas Barnes! Domantas Barnes kicks it out.

[07:36] Team_060 possession (Score: 25-32)
Domantas Barnes drives and kicks out. FOUL! Shooting foul on Karl Barrett. Yao Tatum to the line for 3 free throws. [Team fouls: 2] (Karl Barrett: 1 personal fouls)   FT 1/3: GOOD   FT 2/3: GOOD   FT 3/3: GOOD Yao Tatum makes 3/3 from the line.
Score: 25-35

[07:19] Team_026 possession (Score: 25-35)
Damian Doncic drives, Klay Haliburton stays with him. Damian Doncic attempts a Layup. Contested by Klay Haliburton (4.0 feet, ZONE). Damian Doncic misses. Rebound secured by Klay Haliburton.

[07:05] Team_060 possession (Score: 25-35)
Domantas Barnes attempts a 3Pt. Contested by Myles Tatum (5.3 feet, MAN). DOMANTAS BARNES MAKES IT!
Score: 25-38

[06:49] Team_026 possession (Score: 25-38)
Dirk Randle attempts a Midrange. Contested by Jarrett Wagner (5.2 feet, ZONE). Dirk Randle misses. Rebound secured by Rudy Ginobili.

[06:37] Team_060 possession (Score: 25-38)
Klay Haliburton attempts a Layup. Contested by Damian Doncic (5.8 feet, ZONE). Klay Haliburton misses. Offensive rebound by Domantas Barnes! Domantas Barnes kicks it out.

[06:22] Team_060 possession (Score: 25-38)
FOUL! Shooting foul on Damian Doncic. Klay Haliburton to the line for 2 free throws. [Team fouls: 3] (Damian Doncic: 2 personal fouls)   FT 1/2: GOOD   FT 2/2: GOOD Klay Haliburton makes 2/2 from the line.
Score: 25-40

[06:07] Team_026 possession (Score: 25-40)
Karl Barrett drives, picks up Klay Haliburton. Help arrives from Domantas Barnes! Karl Barrett attempts a Dunk. Contested by Domantas Barnes (4.3 feet, ZONE). Karl Barrett misses. Rebound secured by Klay Haliburton.

[05:50] Team_060 possession (Score: 25-40)
Domantas Barnes attempts a Midrange. Contested by Damian Doncic (5.5 feet, ZONE). Domantas Barnes misses. Offensive rebound by Klay Haliburton! Klay Haliburton puts it back in!
Score: 25-42

[05:36] Team_026 possession (Score: 25-42)
Myles Tatum attempts a Layup. Contested by Klay Haliburton (4.1 feet, ZONE). MYLES TATUM MAKES IT!
Score: 27-42

[05:23] Team_060 possession (Score: 27-42)
Rudy Ginobili attempts a 3Pt. Contested by Karl Barrett (5.0 feet, MAN). RUDY GINOBILI MAKES IT! Assist: Yao Tatum
Score: 27-45

[05:06] Team_026 possession (Score: 27-45)
Karl Barrett attempts a 3Pt. Contested by Domantas Barnes (4.7 feet, ZONE). Karl Barrett misses. Offensive rebound by Damian Doncic! Damian Doncic kicks it out.

[04:52] Team_026 possession (Score: 27-45)
FOUL! Shooting foul on Jarrett Wagner. Josh Simons to the line for 2 free throws. [Team fouls: 4] (Jarrett Wagner: 1 personal fouls)   FT 1/2: GOOD   FT 2/2: GOOD Josh Simons makes 2/2 from the line.
Score: 29-45

[04:35] Team_060 possession (Score: 29-45)
Rudy Ginobili attempts a Layup. Contested by Damian Doncic (5.9 feet, ZONE). RUDY GINOBILI MAKES IT!
Score: 29-47

[04:22] Team_026 possession (Score: 29-47)
Dirk Randle drives and kicks out. Myles Tatum attempts a 3Pt. Contested by Domantas Barnes (4.6 feet, ZONE). Myles Tatum misses. Offensive rebound by Damian Doncic! Damian Doncic kicks it out.

[04:06] Team_026 possession (Score: 29-47)
Josh Simons loses control! Ball rolls out of bounds! TURNOVER! (dead ball)

[03:49] Team_060 possession (Score: 29-47)
Yao Tatum makes the 3Pt and draws the foul on Karl Barrett! And-1! Yao Tatum to the line for 1. [Team fouls: 4] (Karl Barrett: 2 personal fouls)   FT 1/1: GOOD Yao Tatum makes 1/1 from the line.
Score: 29-51

[03:36] Team_026 possession (Score: 29-51)
Josh Simons attempts a Midrange. Contested by Jarrett Wagner (4.7 feet, MAN). JOSH SIMONS MAKES IT!
Score: 31-51

[03:22] Team_060 possession (Score: 31-51)
Klay Haliburton drives and kicks out. Rudy Ginobili attempts a 3Pt. Contested by Karl Barrett (4.7 feet, MAN). Rudy Ginobili misses. Rebound secured by Damian Doncic.

[03:07] Team_026 possession (Score: 31-51)
Damian Doncic attempts a Midrange. Contested by Jarrett Wagner (4.5 feet, ZONE). Damian Doncic misses. Rebound secured by Rudy Ginobili.

[02:48] Team_060 possession (Score: 31-51)
Rudy Ginobili drives and kicks out. Yao Tatum attempts a Midrange. Contested by Damian Doncic (5.6 feet, MAN). Yao Tatum misses. Rebound secured by Damian Doncic.

[02:37] Team_026 possession (Score: 31-51)
Karl Barrett drives and kicks out. Myles Tatum attempts a 3Pt. Contested by Domantas Barnes (4.6 feet, MAN). MYLES TATUM MAKES IT! Assist: Karl Barrett
Score: 34-51

[02:22] Team_060 possession (Score: 34-51)
Domantas Barnes drives, picks up Myles Tatum. Help arrives from Josh Simons! Domantas Barnes attempts a Layup. Contested by Josh Simons (5.3 feet, MAN). DOMANTAS BARNES MAKES IT! Assist: Rudy Ginobili
Score: 34-53

[02:07] Team_026 possession (Score: 34-53)
Damian Doncic makes the Dunk and draws the foul on Domantas Barnes! And-1! Damian Doncic to the line for 1. [BONUS: 5 team fouls] (Domantas Barnes: 1 personal fouls)   FT 1/1: MISS Damian Doncic makes 0/1 from the line. Rebound secured by Domantas Barnes.
Score: 36-53

[01:57] Team_060 possession (Score: 36-53)
FOUL! Shooting foul on Josh Simons. Rudy Ginobili to the line for 2 free throws. [BONUS: 5 team fouls] (Josh Simons: 1 personal fouls)   FT 1/2: MISS   FT 2/2: GOOD Rudy Ginobili makes 1/2 from the line.
Score: 36-54

[01:42] Team_026 possession (Score: 36-54)
Myles Tatum attempts a Layup. Contested by Klay Haliburton (4.2 feet, ZONE). MYLES TATUM MAKES IT! Assist: Dirk Randle
Score: 38-54

[01:26] Team_060 possession (Score: 38-54)
FOUL! Holding foul on Karl Barrett. [IN THE BONUS! 6 team fouls] Rudy Ginobili to the line for 2 free throws. (Karl Barrett: 3 personal fouls)   FT 1/2: GOOD   FT 2/2: MISS Rudy Ginobili makes 1/2 from the line. Offensive rebound by Domantas Barnes! Domantas Barnes kicks it out.
Score: 38-55

[01:12] Team_060 possession (Score: 38-55)
Rudy Ginobili attempts a Midrange. Contested by Damian Doncic (6.0 feet, ZONE). Rudy Ginobili misses. Rebound secured by Karl Barrett.

[00:58] Team_026 possession (Score: 38-55)
Karl Barrett drives to the basket... Karl Barrett loses the ball! Stripped by Rudy Ginobili! TURNOVER! (live ball)

[00:46] Team_060 possession (Score: 38-55)
Jarrett Wagner attempts a 3Pt. Contested by Karl Barrett (5.0 feet, ZONE). Jarrett Wagner misses. Rebound secured by Karl Barrett.

[00:32] Team_026 possession (Score: 38-55)
Dirk Randle drives and kicks out. Josh Simons attempts a 3Pt. Contested by Domantas Barnes (4.7 feet, ZONE). Josh Simons misses. Rebound secured by Rudy Ginobili.

[00:17] Team_060 possession (Score: 38-55)
Klay Haliburton drives and kicks out. Rudy Ginobili attempts a Midrange. Contested by Karl Barrett (4.9 feet, MAN). Rudy Ginobili misses. Rebound secured by Karl Barrett.

[00:03] Team_026 possession (Score: 38-55)
Josh Simons attempts a Midrange. Contested by Jarrett Wagner (4.9 feet, MAN). JOSH SIMONS MAKES IT!
Score: 40-55

================================================================================
                              2ND QUARTER COMPLETE                              
================================================================================

2ND QUARTER SCORE: Team_026 24, Team_060 31

BOX SCORE:
================================================================================

Team_026
--------------------------------------------------------------------------------
Player                MIN  PTS  REB  AST  TO      FG   FG%      3P   3P%
--------------------------------------------------------------------------------
Myles Tatum             9    7    0    0   0   3/3   100.0     0/0   0.0
Josh Simons             9    6    1    0   0   3/4    75.0     0/0   0.0
Immanuel Hyland        15    3    0    1   0   1/2    50.0     0/0   0.0
Shaquille Trent        15    3    1    0   0   1/1   100.0     0/0   0.0
Dirk Randle             9    3    0    1   0   1/3    33.3     0/0   0.0
Kobe Booker            15    0    2    0   0   0/0     0.0     0/0   0.0
Wendell Gasol          15    0    0    0   0   0/1     0.0     0/0   0.0
Damian Doncic           9    0    5    0   0   0/3     0.0     0/0   0.0
Karl Barrett            9    0    3    1   0   0/1     0.0     0/0   0.0

TEAM: FG: 9/18 (50.0%), 3PT: 1/4 (25.0%), REB: 12 (5 off, 7 def), AST: 3, TO: 3
TEAM FOULS: 6 [Team_060 in BONUS]


Team_060
--------------------------------------------------------------------------------
Player                MIN  PTS  REB  AST  TO      FG   FG%      3P   3P%
--------------------------------------------------------------------------------
Yao Tatum               9    7    0    1   0   2/2   100.0     0/0   0.0
Rudy Ginobili           9    6    3    1   0   3/5    60.0     0/0   0.0
Domantas Barnes         9    5    6    0   0   2/3    66.7     0/0   0.0
Jaren George           15    4    1    0   0   2/3    66.7     0/0   0.0
Klay Haliburton         9    4    3    0   0   2/4    50.0     0/0   0.0
Larry Westbrook        15    2    1    0   0   1/1   100.0     0/0   0.0
Immanuel Ming          15    0    0    2   0   0/0     0.0     0/0   0.0
Jarrett Wagner          9    0    0    0   0   0/1     0.0     0/0   0.0

TEAM: FG: 12/19 (63.2%), 3PT: 3/5 (60.0%), REB: 14 (5 off, 9 def), AST: 4, TO: 1
TEAM FOULS: 5 [Team_026 in BONUS]

================================================================================

================================================================================
                       3RD QUARTER - Team_026 vs Team_060                       
================================================================================

[12:00] Team_026 possession (Score: 40-55)
Klay Giddey attempts a 3Pt. Contested by Immanuel Ming (3.6 feet, MAN). Klay Giddey misses. FOUL! Loose ball foul on Larry Westbrook during the rebound battle. [Team fouls: 1] No free throws, side out. (Larry Westbrook: 1 personal fouls)

[11:46] Team_026 possession (Score: 40-55)
Shaquille Trent drives to the basket... FOUL! Offensive foul on Shaquille Trent! Larry Westbrook drew the charge! [Team fouls: 1] (Shaquille Trent: 1 personal fouls) TURNOVER! (dead ball)

[11:31] Team_060 possession (Score: 40-55)
Larry Westbrook attempts a Midrange. BLOCKED BY WENDELL GASOL! Ball is loose! Offensive rebound by Jaren George! Jaren George kicks it out.

[11:17] Team_060 possession (Score: 40-55)
Jaren George drives and kicks out. Larry Westbrook makes the Midrange and draws the foul on Shaquille Trent! And-1! Larry Westbrook to the line for 1. [Team fouls: 3] (Shaquille Trent: 2 personal fouls)   FT 1/1: GOOD Larry Westbrook makes 1/1 from the line.
Score: 40-58

[11:01] Team_026 possession (Score: 40-58)
Klay Giddey attempts a 3Pt. Contested by Julius Green (3.7 feet, ZONE). Klay Giddey misses. Rebound secured by Larry Westbrook.

[10:47] Team_060 possession (Score: 40-58)
Jaren George attempts a 3Pt. Contested by Kobe Booker (4.3 feet, MAN). Jaren George misses. Rebound secured by Shaquille Trent.

[10:31] Team_026 possession (Score: 40-58)
Kobe Booker drives and kicks out. Wendell Gasol attempts a 3Pt. Contested by Larry Westbrook (4.6 feet, ZONE). Wendell Gasol misses. Rebound secured by Immanuel Ming.

[10:16] Team_060 possession (Score: 40-58)
Julius Green attempts a 3Pt. Contested by Shaquille Trent (5.4 feet, ZONE). Julius Green misses. Rebound secured by Kobe Booker.

[10:01] Team_026 possession (Score: 40-58)
Wendell Gasol attempts a Layup. Contested by Joel Morant (5.6 feet, MAN). WENDELL GASOL MAKES IT! Assist: Klay Giddey
Score: 42-58

[09:47] Team_060 possession (Score: 42-58)
Joel Morant loses the ball! Stripped by Wendell Gasol! TURNOVER! (live ball)

[09:31] Team_026 possession (Score: 42-58)
Kobe Booker attempts a Midrange. Contested by Julius Green (4.0 feet, ZONE). Kobe Booker misses. Rebound secured by Immanuel Ming.

[09:19] Team_060 possession (Score: 42-58)
Immanuel Ming attempts a Midrange. Contested by Shaquille Trent (5.6 feet, ZONE). IMMANUEL MING MAKES IT!
Score: 42-60

[09:06] Team_026 possession (Score: 42-60)
Wendell Gasol attempts a Midrange. Contested by Joel Morant (5.6 feet, MAN). Wendell Gasol misses. Rebound secured by Jaren George.

[08:51] Team_060 possession (Score: 42-60)
Joel Morant throws a bad pass! Stolen by Wendell Gasol! TURNOVER! (live ball)

[08:37] Team_026 possession (Score: 42-60)
Shaquille Trent drives, picks up Larry Westbrook. Help arrives from Julius Green! Shaquille Trent attempts a Layup. Contested by Julius Green (4.5 feet, MAN). Shaquille Trent misses. Rebound secured by Jaren George.

[08:21] Team_060 possession (Score: 42-60)
Joel Morant drives to the basket... Joel Morant loses control! Ball rolls out of bounds! TURNOVER! (dead ball)

[08:05] Team_026 possession (Score: 42-60)
Wendell Gasol drives and kicks out. Kobe Booker attempts a 3Pt. Contested by Julius Green (3.8 feet, ZONE). Kobe Booker misses. Rebound secured by Immanuel Ming.

[07:55] Team_060 possession (Score: 42-60)
Julius Green drives, picks up Immanuel Hyland. Help arrives from Klay Giddey! Julius Green attempts a Dunk. Contested by Klay Giddey (3.8 feet, MAN). Julius Green misses. Offensive rebound by Jaren George! Jaren George's putback is no good. Rebound secured by Kobe Booker.

[07:39] Team_026 possession (Score: 42-60)
Shaquille Trent drives and kicks out. Kobe Booker attempts a 3Pt. Contested by Jaren George (5.2 feet, MAN). Kobe Booker misses. Rebound secured by Larry Westbrook.

[07:24] Team_060 possession (Score: 42-60)
Julius Green drives and kicks out. Jaren George attempts a 3Pt. Contested by Immanuel Hyland (4.0 feet, ZONE). Jaren George misses. Rebound secured by Shaquille Trent.

[07:07] Team_026 possession (Score: 42-60)
Wendell Gasol throws a bad pass! Stolen by Joel Morant! TURNOVER! (live ball)

[06:49] Team_060 possession (Score: 42-60)
Joel Morant drives and kicks out. Julius Green attempts a 3Pt. Contested by Immanuel Hyland (4.0 feet, MAN). JULIUS GREEN MAKES IT!
Score: 42-63

[06:30] Team_026 possession (Score: 42-63)
Wendell Gasol attempts a 3Pt. Contested by Julius Green (4.1 feet, ZONE). Wendell Gasol misses. Rebound secured by Larry Westbrook.

[06:16] Team_060 possession (Score: 42-63)
Larry Westbrook attempts a Midrange. Contested by Immanuel Hyland (4.5 feet, ZONE). Larry Westbrook misses. Rebound secured by Kobe Booker.

[06:06] Team_026 possession (Score: 42-63)
Immanuel Hyland attempts a 3Pt. Contested by Julius Green (3.9 feet, MAN). Immanuel Hyland misses. Rebound secured by Immanuel Ming.

[05:49] Team_060 possession (Score: 42-63)
Immanuel Ming commits a violation (traveling/carry)! TURNOVER! (dead ball)

[05:37] Team_026 possession (Score: 42-63)
Kobe Booker drives, Jaren George stays with him. Kobe Booker attempts a Layup. Contested by Jaren George (5.5 feet, ZONE). KOBE BOOKER MAKES IT!
Score: 44-63

[05:24] Team_060 possession (Score: 44-63)
Joel Morant drives, picks up Wendell Gasol. Help arrives from Immanuel Hyland! Joel Morant attempts a Layup. Contested by Immanuel Hyland (4.3 feet, MAN). JOEL MORANT MAKES IT!
Score: 44-65

[05:08] Team_026 possession (Score: 44-65)
Wendell Gasol attempts a Midrange. Contested by Jaren George (5.6 feet, ZONE). WENDELL GASOL MAKES IT!
Score: 46-65

[04:51] Team_060 possession (Score: 46-65)
Jaren George attempts a Midrange. Contested by Kobe Booker (4.4 feet, MAN). Jaren George misses. Rebound secured by Kobe Booker.

[04:34] Team_026 possession (Score: 46-65)
Kobe Booker drives and kicks out. Wendell Gasol attempts a Midrange. Contested by Joel Morant (5.3 feet, MAN). Wendell Gasol misses. Rebound secured by Immanuel Ming.

[04:21] Team_060 possession (Score: 46-65)
Julius Green attempts a 3Pt. Contested by Immanuel Hyland (3.9 feet, ZONE). JULIUS GREEN MAKES IT! Assist: Joel Morant
Score: 46-68

[04:08] Team_026 possession (Score: 46-68)
Shaquille Trent attempts a 3Pt. Contested by Larry Westbrook (4.6 feet, MAN). Shaquille Trent misses. Rebound secured by Immanuel Ming.

[03:55] Team_060 possession (Score: 46-68)
Julius Green attempts a Layup. Contested by Kobe Booker (4.1 feet, ZONE). Julius Green misses. Rebound secured by Immanuel Hyland.

[03:41] Team_026 possession (Score: 46-68)
Shaquille Trent throws a bad pass out of bounds! TURNOVER! (dead ball)

[03:27] Team_060 possession (Score: 46-68)
Julius Green drives to the basket... Julius Green throws a bad pass! Stolen by Kobe Booker! TURNOVER! (live ball)

[03:12] Team_026 possession (Score: 46-68)
Klay Giddey drives to the basket... Klay Giddey commits a violation (traveling/carry)! TURNOVER! (dead ball)

[03:12] Substitution (Team_060): Joel Morant OUT → Domantas Barnes IN (stamina_rule2)

[03:12] Substitution (Team_060): Larry Westbrook OUT → Yao Tatum IN (stamina_rule2)

[03:12] Substitution (Team_060): Jaren George OUT → Klay Haliburton IN (stamina_rule2)

[03:00] Team_060 possession (Score: 46-68)
Julius Green attempts a 3Pt. Contested by Immanuel Hyland (4.0 feet, MAN). Julius Green misses. FOUL! Loose ball foul on Immanuel Hyland during the rebound battle. [Team fouls: 4] No free throws, side out. (Immanuel Hyland: 2 personal fouls)

[02:43] Team_060 possession (Score: 46-68)
FOUL! Reach-in foul on Kobe Booker during the drive. [IN THE BONUS! 5 team fouls] Immanuel Ming to the line for 2 free throws. (Kobe Booker: 1 personal fouls)   FT 1/2: GOOD   FT 2/2: GOOD Immanuel Ming makes 2/2 from the line.
Score: 46-70

[02:31] Team_026 possession (Score: 46-70)
Wendell Gasol attempts a 3Pt. Contested by Domantas Barnes (4.9 feet, MAN). WENDELL GASOL MAKES IT! Assist: Immanuel Hyland
Score: 49-70

[02:14] Team_060 possession (Score: 49-70)
Domantas Barnes makes the Layup and draws the foul on Kobe Booker! And-1! Domantas Barnes to the line for 1. [BONUS: 6 team fouls] (Kobe Booker: 2 personal fouls)   FT 1/1: MISS Domantas Barnes makes 0/1 from the line. Offensive rebound by Klay Haliburton! Klay Haliburton's putback is no good.
Score: 49-72

[02:04] Team_026 possession (Score: 49-72)
Shaquille Trent attempts a 3Pt. Contested by Domantas Barnes (4.4 feet, ZONE). SHAQUILLE TRENT MAKES IT! Assist: Kobe Booker
Score: 52-72

[01:50] Team_060 possession (Score: 52-72)
Julius Green attempts a 3Pt. Contested by Immanuel Hyland (4.2 feet, ZONE). Julius Green misses. Rebound secured by Immanuel Hyland.

[01:35] Team_026 possession (Score: 52-72)
Klay Giddey attempts a Midrange. Contested by Julius Green (4.0 feet, ZONE). Klay Giddey misses. Rebound secured by Immanuel Ming.

[01:20] Team_060 possession (Score: 52-72)
Immanuel Ming makes the Layup and draws the foul on Klay Giddey! And-1! Immanuel Ming to the line for 1. [BONUS: 7 team fouls] (Klay Giddey: 1 personal fouls)   FT 1/1: MISS Immanuel Ming makes 0/1 from the line. Rebound secured by Kobe Booker.
Score: 52-74

[01:02] Team_026 possession (Score: 52-74)
Immanuel Hyland throws a bad pass out of bounds! TURNOVER! (dead ball)

[01:02] Substitution (Team_026): Wendell Gasol OUT → Myles Tatum IN (stamina_rule2)

[01:02] Substitution (Team_026): Immanuel Hyland OUT → Karl Barrett IN (stamina_rule2)

[01:02] Substitution (Team_026): Klay Giddey OUT → Josh Simons IN (stamina_rule2)

[01:02] Substitution (Team_026): Shaquille Trent OUT → Damian Doncic IN (stamina_rule2)

[01:02] Substitution (Team_026): Kobe Booker OUT → Dirk Randle IN (stamina_rule2)

[01:02] Substitution (Team_060): Julius Green OUT → Rudy Ginobili IN (stamina_rule2)

[01:02] Substitution (Team_060): Immanuel Ming OUT → Jarrett Wagner IN (stamina_rule2)

[00:45] Team_060 possession (Score: 52-74)
Yao Tatum attempts a Layup. Contested by Damian Doncic (5.6 feet, ZONE). YAO TATUM MAKES IT! Assist: Rudy Ginobili
Score: 52-76

[00:34] Team_026 possession (Score: 52-76)
Josh Simons attempts a Midrange. Contested by Jarrett Wagner (4.7 feet, MAN). Josh Simons misses. Rebound secured by Klay Haliburton.

[00:24] Team_060 possession (Score: 52-76)
Yao Tatum loses the ball! Stripped by Damian Doncic! TURNOVER! (live ball)

[00:06] Team_026 possession (Score: 52-76)
Damian Doncic attempts a Midrange. Contested by Jarrett Wagner (4.5 feet, ZONE). Damian Doncic misses. Offensive rebound by Josh Simons! Josh Simons kicks it out.

================================================================================
                              3RD QUARTER COMPLETE                              
================================================================================

3RD QUARTER SCORE: Team_026 12, Team_060 21

BOX SCORE:
================================================================================

Team_026
--------------------------------------------------------------------------------
Player                MIN  PTS  REB  AST  TO      FG   FG%      3P   3P%
--------------------------------------------------------------------------------
Wendell Gasol          26    7    0    0   0   3/6    50.0     0/0   0.0
Shaquille Trent        26    3    2    0   0   1/4    25.0     0/0   0.0
Kobe Booker            26    2    6    1   0   1/4    25.0     0/0   0.0
Klay Giddey            26    0    0    1   0   0/2     0.0     0/0   0.0
Immanuel Hyland        26    0    2    1   0   0/1     0.0     0/0   0.0
Josh Simons            10    0    1    0   0   0/1     0.0     0/0   0.0

TEAM: FG: 5/18 (27.8%), 3PT: 2/6 (33.3%), REB: 11 (2 off, 9 def), AST: 3, TO: 5
TEAM FOULS: 7 [Team_060 in BONUS]


Team_060
--------------------------------------------------------------------------------
Player                MIN  PTS  REB  AST  TO      FG   FG%      3P   3P%
--------------------------------------------------------------------------------
Julius Green           26    6    0    0   0   2/7    28.6     0/0   0.0
Immanuel Ming          26    4    7    0   0   2/3    66.7     0/0   0.0
Larry Westbrook        24    3    3    0   0   1/2    50.0     0/0   0.0
Joel Morant            24    2    0    1   0   1/1   100.0     0/0   0.0
Yao Tatum              12    2    0    0   0   1/1   100.0     0/0   0.0
Jaren George           24    0    3    0   0   0/2     0.0     0/0   0.0
Klay Haliburton        12    0    3    0   0   0/0     0.0     0/0   0.0
Domantas Barnes        12    0    0    0   0   0/1     0.0     0/0   0.0
Rudy Ginobili          10    0    0    1   0   0/0     0.0     0/0   0.0

TEAM: FG: 7/17 (41.2%), 3PT: 1/4 (25.0%), REB: 16 (3 off, 13 def), AST: 2, TO: 6
TEAM FOULS: 1

================================================================================

================================================================================
                       4TH QUARTER - Team_026 vs Team_060                       
================================================================================

[12:00] Substitution (Team_026): Wendell Gasol OUT (stamina: 74) → Myles Tatum IN (comeback_detected)

[12:00] Substitution (Team_060): Joel Morant OUT (stamina: 80) → Domantas Barnes IN (comeback_detected)

[12:00] Team_026 possession (Score: 52-76)
Kobe Booker drives and kicks out. Klay Giddey attempts a 3Pt. Contested by Immanuel Ming (3.7 feet, MAN). Klay Giddey misses. Rebound secured by Immanuel Ming.

[11:44] Team_060 possession (Score: 52-76)
Domantas Barnes attempts a 3Pt. Contested by Immanuel Hyland (4.2 feet, ZONE). Domantas Barnes misses. Rebound secured by Kobe Booker.

[11:29] Team_026 possession (Score: 52-76)
Shaquille Trent attempts a 3Pt. Contested by Larry Westbrook (4.5 feet, MAN). SHAQUILLE TRENT MAKES IT! Assist: Immanuel Hyland
Score: 55-76

[11:19] Team_060 possession (Score: 55-76)
FOUL! Reach-in foul on Kobe Booker during the drive. [Team fouls: 1] No free throws, side out. (Kobe Booker: 1 personal fouls)

[11:07] Team_060 possession (Score: 55-76)
Domantas Barnes attempts a 3Pt. Contested by Immanuel Hyland (4.3 feet, ZONE). Domantas Barnes misses. Rebound secured by Shaquille Trent.

[10:53] Team_026 possession (Score: 55-76)
Immanuel Hyland attempts a 3Pt. Contested by Domantas Barnes (4.7 feet, ZONE). Immanuel Hyland misses. Rebound secured by Larry Westbrook.

[10:40] Team_060 possession (Score: 55-76)
Larry Westbrook drives, Shaquille Trent stays with him. Larry Westbrook attempts a Dunk. Wide open! Shaquille Trent is 6.4 feet away. [MAN] LARRY WESTBROOK MAKES IT! Assist: Jaren George
Score: 55-78

[10:24] Team_026 possession (Score: 55-78)
Klay Giddey attempts a 3Pt. Contested by Domantas Barnes (4.5 feet, ZONE). KLAY GIDDEY MAKES IT! Assist: Myles Tatum
Score: 58-78

[10:06] Team_060 possession (Score: 58-78)
Larry Westbrook attempts a Midrange. Wide open! Shaquille Trent is 6.4 feet away. [MAN] Larry Westbrook misses. Rebound secured by Shaquille Trent.

[09:56] Team_026 possession (Score: 58-78)
Shaquille Trent attempts a 3Pt. Contested by Domantas Barnes (4.4 feet, ZONE). Shaquille Trent misses. Rebound secured by Immanuel Ming.

[09:43] Team_060 possession (Score: 58-78)
Immanuel Ming drives, Klay Giddey stays with him. Immanuel Ming attempts a Dunk. Contested by Klay Giddey (5.8 feet, MAN). IMMANUEL MING MAKES IT!
Score: 58-80

[09:30] Team_026 possession (Score: 58-80)
Klay Giddey attempts a 3Pt. Contested by Domantas Barnes (4.5 feet, ZONE). Klay Giddey misses. Rebound secured by Immanuel Ming.

[09:14] Team_060 possession (Score: 58-80)
Jaren George drives, Kobe Booker stays with him. Jaren George attempts a Layup. Contested by Kobe Booker (4.9 feet, ZONE). JAREN GEORGE MAKES IT! Assist: Julius Green
Score: 58-82

[09:00] Team_026 possession (Score: 58-82)
Myles Tatum attempts a 3Pt. Contested by Domantas Barnes (4.5 feet, ZONE). MYLES TATUM MAKES IT! Assist: Kobe Booker
Score: 61-82

[08:45] Team_060 possession (Score: 61-82)
FOUL! Reach-in foul on Kobe Booker during the drive. [Team fouls: 2] No free throws, side out. (Kobe Booker: 2 personal fouls)

[08:31] Team_060 possession (Score: 61-82)
Immanuel Ming attempts a 3Pt. Contested by Immanuel Hyland (4.6 feet, ZONE). Immanuel Ming misses. Rebound secured by Shaquille Trent.

[08:14] Team_026 possession (Score: 61-82)
Shaquille Trent drives, Larry Westbrook stays with him. Shaquille Trent attempts a Dunk. Contested by Larry Westbrook (4.8 feet, MAN). SHAQUILLE TRENT MAKES IT!
Score: 63-82

[08:04] Team_060 possession (Score: 63-82)
Jaren George attempts a Layup. Contested by Kobe Booker (5.0 feet, MAN). JAREN GEORGE MAKES IT! Assist: Immanuel Ming
Score: 63-84

[07:51] Team_026 possession (Score: 63-84)
Shaquille Trent attempts a Layup. Contested by Jaren George (5.4 feet, ZONE). SHAQUILLE TRENT MAKES IT! Assist: Klay Giddey
Score: 65-84

[07:39] Team_060 possession (Score: 65-84)
Julius Green attempts a 3Pt. Contested by Immanuel Hyland (4.6 feet, MAN). Julius Green misses. Offensive rebound by Domantas Barnes! Domantas Barnes kicks it out.

[07:23] Team_060 possession (Score: 65-84)
Larry Westbrook attempts a Midrange. Wide open! Klay Giddey is 6.6 feet away. [ZONE] LARRY WESTBROOK MAKES IT! Assist: Jaren George
Score: 65-86

[07:07] Team_026 possession (Score: 65-86)
Immanuel Hyland attempts a 3Pt. Contested by Domantas Barnes (4.6 feet, ZONE). Immanuel Hyland misses. Offensive rebound by Kobe Booker! Kobe Booker kicks it out.

[06:52] Team_026 possession (Score: 65-86)
Klay Giddey makes the Layup and draws the foul on Immanuel Ming! And-1! Klay Giddey to the line for 1. [Team fouls: 1] (Immanuel Ming: 1 personal fouls)   FT 1/1: GOOD Klay Giddey makes 1/1 from the line.
Score: 68-86

[06:38] Team_060 possession (Score: 68-86)
FOUL! Shooting foul on Kobe Booker. Larry Westbrook to the line for 2 free throws. [Team fouls: 3] (Kobe Booker: 3 personal fouls)   FT 1/2: GOOD   FT 2/2: GOOD Larry Westbrook makes 2/2 from the line.
Score: 68-88

[06:19] Team_026 possession (Score: 68-88)
Shaquille Trent attempts a 3Pt. Contested by Larry Westbrook (5.0 feet, MAN). SHAQUILLE TRENT MAKES IT! Assist: Myles Tatum
Score: 71-88

[06:07] Team_060 possession (Score: 71-88)
Larry Westbrook attempts a Midrange. Wide open! Shaquille Trent is 6.8 feet away. [MAN] Larry Westbrook misses. Offensive rebound by Domantas Barnes! Domantas Barnes kicks it out.

[05:57] Team_060 possession (Score: 71-88)
Julius Green attempts a Midrange. Contested by Immanuel Hyland (4.8 feet, ZONE). Julius Green misses. Offensive rebound by Domantas Barnes! Domantas Barnes kicks it out.

[05:41] Team_060 possession (Score: 71-88)
Domantas Barnes attempts a 3Pt. Contested by Myles Tatum (5.3 feet, MAN). Domantas Barnes misses. Offensive rebound by Jaren George! Jaren George kicks it out.

[05:28] Team_060 possession (Score: 71-88)
FOUL! Holding foul on Immanuel Hyland. [Team fouls: 4] No free throws, side out. (Immanuel Hyland: 1 personal fouls)

[05:13] Team_060 possession (Score: 71-88)
Larry Westbrook attempts a 3Pt. Wide open! Shaquille Trent is 6.9 feet away. [MAN] Larry Westbrook misses. Rebound secured by Immanuel Hyland.

[04:59] Team_026 possession (Score: 71-88)
Immanuel Hyland attempts a Midrange. Contested by Julius Green (4.9 feet, MAN). IMMANUEL HYLAND MAKES IT!
Score: 73-88

[04:43] Team_060 possession (Score: 73-88)
Larry Westbrook attempts a 3Pt. Wide open! Shaquille Trent is 6.9 feet away. [MAN] LARRY WESTBROOK MAKES IT! Assist: Immanuel Ming
Score: 73-91

[04:26] Team_026 possession (Score: 73-91)
Immanuel Hyland commits a violation (traveling/carry)! TURNOVER! (dead ball)

[04:26] Substitution (Team_026): Immanuel Hyland OUT → Karl Barrett IN (stamina_rule2)

[04:26] Substitution (Team_026): Klay Giddey OUT → Josh Simons IN (stamina_rule2)

[04:26] Substitution (Team_026): Shaquille Trent OUT → Damian Doncic IN (stamina_rule2)

[04:26] Substitution (Team_026): Kobe Booker OUT → Dirk Randle IN (stamina_rule2)

[04:26] Substitution (Team_060): Julius Green OUT → Rudy Ginobili IN (stamina_rule2)

[04:26] Substitution (Team_060): Immanuel Ming OUT → Jarrett Wagner IN (stamina_rule2)

[04:26] Substitution (Team_060): Larry Westbrook OUT → Yao Tatum IN (stamina_rule2)

[04:26] Substitution (Team_060): Jaren George OUT → Klay Haliburton IN (stamina_rule2)

[04:14] Team_060 possession (Score: 73-91)
Jarrett Wagner attempts a 3Pt. Contested by Karl Barrett (4.9 feet, ZONE). Jarrett Wagner misses. Rebound secured by Josh Simons.

[04:01] Team_026 possession (Score: 73-91)
Myles Tatum attempts a Midrange. Contested by Rudy Ginobili (4.2 feet, ZONE). MYLES TATUM MAKES IT! Assist: Dirk Randle
Score: 75-91

[03:46] Team_060 possession (Score: 75-91)
Jarrett Wagner attempts a 3Pt. Contested by Josh Simons (5.3 feet, MAN). Jarrett Wagner misses. Offensive rebound by Domantas Barnes! Domantas Barnes kicks it out.

[03:32] Team_060 possession (Score: 75-91)
Jarrett Wagner attempts a Layup. Contested by Josh Simons (5.3 feet, MAN). JARRETT WAGNER MAKES IT! Assist: Rudy Ginobili
Score: 75-93

[03:21] Team_026 possession (Score: 75-93)
Dirk Randle drives to the basket... Dirk Randle loses the ball! Stripped by Klay Haliburton! TURNOVER! (live ball)

[03:06] Team_060 possession (Score: 75-93)
Jarrett Wagner attempts a 3Pt. Contested by Karl Barrett (4.9 feet, ZONE). Jarrett Wagner misses. Offensive rebound by Klay Haliburton! Klay Haliburton's putback is no good. Rebound secured by Josh Simons.

[02:49] Team_026 possession (Score: 75-93)
Karl Barrett attempts a 3Pt. Contested by Domantas Barnes (5.2 feet, ZONE). Karl Barrett misses. Rebound secured by Klay Haliburton.

[02:35] Team_060 possession (Score: 75-93)
Domantas Barnes drives and kicks out. Rudy Ginobili attempts a Midrange. Contested by Karl Barrett (4.7 feet, MAN). RUDY GINOBILI MAKES IT!
Score: 75-95

[02:20] Team_026 possession (Score: 75-95)
Karl Barrett attempts a 3Pt. Contested by Domantas Barnes (5.2 feet, ZONE). Karl Barrett misses. Rebound secured by Rudy Ginobili.

[02:04] Team_060 possession (Score: 75-95)
Klay Haliburton attempts a 3Pt. Contested by Josh Simons (5.4 feet, ZONE). Klay Haliburton misses. Rebound secured by Karl Barrett.

[01:49] Team_026 possession (Score: 75-95)
Josh Simons attempts a 3Pt. Contested by Jarrett Wagner (4.7 feet, MAN). Josh Simons misses. Rebound secured by Rudy Ginobili.

[01:30] Team_060 possession (Score: 75-95)
Klay Haliburton attempts a Midrange. Wide open! Dirk Randle is 6.4 feet away. [ZONE] KLAY HALIBURTON MAKES IT! Assist: Rudy Ginobili
Score: 75-97

[01:18] Team_026 possession (Score: 75-97)
Damian Doncic attempts a 3Pt. Contested by Domantas Barnes (5.0 feet, ZONE). DAMIAN DONCIC MAKES IT! Assist: Myles Tatum
Score: 78-97

[01:02] Team_060 possession (Score: 78-97)
Domantas Barnes makes the Layup and draws the foul on Damian Doncic! And-1! Domantas Barnes to the line for 1. [BONUS: 5 team fouls] (Damian Doncic: 1 personal fouls)   FT 1/1: GOOD Domantas Barnes makes 1/1 from the line.
Score: 78-100

[00:45] Team_026 possession (Score: 78-100)
FOUL! Shooting foul on Yao Tatum. Damian Doncic to the line for 2 free throws. [Team fouls: 2] (Yao Tatum: 1 personal fouls)   FT 1/2: GOOD   FT 2/2: GOOD Damian Doncic makes 2/2 from the line.
Score: 80-100

[00:31] Team_060 possession (Score: 80-100)
Jarrett Wagner attempts a 3Pt. Contested by Karl Barrett (4.9 feet, ZONE). Jarrett Wagner misses. FOUL! Loose ball foul on Josh Simons during the rebound battle. [IN THE BONUS! 6 team fouls] Rudy Ginobili to the line for 2 free throws. (Josh Simons: 1 personal fouls)   FT 1/2: GOOD   FT 2/2: GOOD Rudy Ginobili makes 2/2 from the line.
Score: 80-102

[00:21] Team_026 possession (Score: 80-102)
Damian Doncic drives and kicks out. Damian Doncic attempts a 3Pt. Contested by Yao Tatum (5.2 feet, MAN). Damian Doncic misses. Rebound secured by Klay Haliburton.

[00:02] Team_060 possession (Score: 80-102)
FOUL! Shooting foul on Myles Tatum. Domantas Barnes to the line for 2 free throws. [BONUS: 7 team fouls] (Myles Tatum: 1 personal fouls)   FT 1/2: GOOD   FT 2/2: MISS Domantas Barnes makes 1/2 from the line. Rebound secured by Josh Simons.
Score: 80-103

================================================================================
                              4TH QUARTER COMPLETE                              
================================================================================

4TH QUARTER SCORE: Team_026 28, Team_060 27

BOX SCORE:
================================================================================

Team_026
--------------------------------------------------------------------------------
Player                MIN  PTS  REB  AST  TO      FG   FG%      3P   3P%
--------------------------------------------------------------------------------
Shaquille Trent        34   10    3    0   0   4/5    80.0     0/0   0.0
Klay Giddey            34    6    0    1   0   2/3    66.7     0/0   0.0
Myles Tatum            22    5    0    3   0   2/2   100.0     0/0   0.0
Damian Doncic          15    5    0    0   0   2/3    66.7     0/0   0.0
Immanuel Hyland        34    2    1    1   0   1/2    50.0     0/0   0.0
Kobe Booker            34    0    2    1   0   0/1     0.0     0/0   0.0
Josh Simons            15    0    3    0   0   0/1     0.0     0/0   0.0
Dirk Randle            15    0    0    1   0   0/0     0.0     0/0   0.0
Karl Barrett           15    0    1    0   0   0/2     0.0     0/0   0.0

TEAM: FG: 11/19 (57.9%), 3PT: 5/11 (45.5%), REB: 9 (1 off, 8 def), AST: 7, TO: 2
TEAM FOULS: 7 [Team_060 in BONUS]


Team_060
--------------------------------------------------------------------------------
Player                MIN  PTS  REB  AST  TO      FG   FG%      3P   3P%
--------------------------------------------------------------------------------
Larry Westbrook        32    9    1    0   0   4/6    66.7     0/0   0.0
Jaren George           32    4    1    2   0   2/2   100.0     0/0   0.0
Rudy Ginobili          15    4    2    2   0   2/2   100.0     0/0   0.0
Domantas Barnes        25    3    4    0   0   1/4    25.0     0/0   0.0
Immanuel Ming          34    2    3    2   0   1/2    50.0     0/0   0.0
Jarrett Wagner         15    2    0    0   0   1/3    33.3     0/0   0.0
Klay Haliburton        17    2    2    0   0   1/2    50.0     0/0   0.0
Julius Green           34    0    0    1   0   0/0     0.0     0/0   0.0

TEAM: FG: 12/21 (57.1%), 3PT: 2/9 (22.2%), REB: 14 (6 off, 8 def), AST: 7, TO: 0
TEAM FOULS: 2

================================================================================

================================================================================
                               FULL GAME COMPLETE                               
================================================================================

FINAL SCORE: Team_026 80, Team_060 103

SCORING BY QUARTER:
--------------------------------------------------------------------------------
Team                     Q1     Q2     Q3     Q4    FINAL
--------------------------------------------------------------------------------
Team_026                 16     24     12     28       80
Team_060                 24     31     21     27      103
--------------------------------------------------------------------------------

FULL GAME BOX SCORE:
================================================================================

Team_026
--------------------------------------------------------------------------------
Player                MIN  PTS  REB  AST  TO      FG   FG%      3P   3P%      FT STL BLK
--------------------------------------------------------------------------------
Immanuel Hyland        34    5    4    3   2   2/7    28.6   0/4     0.0   1/1     0   0
Klay Giddey            34   14    0    2   3   5/11   45.5   3/7    42.9   6/6     1   0
Shaquille Trent        34   19    9    0   2   8/14   57.1   4/7    57.1   1/1     2   0
Kobe Booker            34    2   19    2   1   1/9    11.1   0/3     0.0   0/1     1   0
Wendell Gasol          26    9    0    0   1   3/9    33.3   1/5    20.0   0/0     2   1
Myles Tatum            22   12    0    3   0   4/4   100.0   1/1   100.0   0/0     0   0
Karl Barrett           15    0    4    1   0   1/4    25.0   0/2     0.0   0/0     0   0
Josh Simons            15    6    5    0   2   3/6    50.0   0/2     0.0   2/2     0   0
Damian Doncic          15    5    5    0   0   2/6    33.3   1/1   100.0   2/3     1   0
Dirk Randle            15    3    0    2   1   1/3    33.3   0/0     0.0   1/1     0   0

TEAM: FG: 30/73 (41.1%), 3PT: 10/32 (31.2%), REB: 45 (13 off, 32 def), AST: 13, TO: 12


Team_060
--------------------------------------------------------------------------------
Player                MIN  PTS  REB  AST  TO      FG   FG%      3P   3P%      FT STL BLK
--------------------------------------------------------------------------------
Julius Green           34   15    0    1   0   4/9    44.4   4/6    66.7   0/0     0   1
Immanuel Ming          34   15   16    5   4   5/10   50.0   1/3    33.3   6/7     0   0
Larry Westbrook        32   17   12    0   3   6/11   54.5   1/3    33.3   3/3     1   0
Jaren George           32    8    7    4   0   5/10   50.0   0/2     0.0   0/0     1   0
Domantas Barnes        25    8   10    0   0   6/11   54.5   1/3    33.3   2/4     0   0
Joel Morant            24    5    0    2   3   4/5    80.0   1/2    50.0   3/3     1   0
Yao Tatum              17    9    0    1   1   2/2   100.0   1/1   100.0   4/4     0   0
Klay Haliburton        17    6    8    0   0   2/5    40.0   0/1     0.0   2/2     1   0
Rudy Ginobili          15   10    5    4   0   3/5    60.0   1/1   100.0   4/7     1   0
Jarrett Wagner         15    2    0    0   0   2/5    40.0   1/4    25.0   0/0     0   0

TEAM: FG: 39/73 (53.4%), 3PT: 11/26 (42.3%), REB: 59 (16 off, 43 def), AST: 17, TO: 11

================================================================================
