================================================================================
                        FULL GAME - Team_001 vs Team_027                        
================================================================================

================================================================================
                       1ST QUARTER - Team_001 vs Team_027                       
================================================================================

[12:00] Team_001 possession (Score: 0-0)
Klay Harden attempts a Layup. BLOCKED BY BRADLEY DOSUNMU! Ball is loose! Offensive rebound by Miles Griffin! Miles Griffin kicks it out.

[11:43] Team_001 possession (Score: 0-0)
Cole Ball attempts a 3Pt. Contested by Tim Johnson (4.6 feet, ZONE). Cole Ball misses. Rebound secured by John Russell.

[11:29] Team_027 possession (Score: 0-0)
Tony Doncic drives, Miles Griffin stays with him. Tony Doncic attempts a Dunk. Contested by Miles Griffin (4.1 feet, ZONE). Tony Doncic misses. Rebound secured by Dejounte McCollum.

[11:17] Team_001 possession (Score: 0-0)
Miles Griffin attempts a Layup. BLOCKED BY JOHN RUSSELL! Ball deflects out of bounds off Miles Griffin.

[11:05] Team_027 possession (Score: 0-0)
FOUL! Holding foul on Dirk Young. [Team fouls: 1] No free throws, side out. (Dirk Young: 1 personal fouls)

[10:47] Team_027 possession (Score: 0-0)
Scottie Harden attempts a 3Pt. Contested by Cole Ball (3.2 feet, MAN). SCOTTIE HARDEN MAKES IT! Assist: John Russell
Score: 0-3

[10:34] Team_001 possession (Score: 0-3)
Dejounte McCollum drives and kicks out. Miles Griffin attempts a 3Pt. Contested by John Russell (3.9 feet, MAN). Miles Griffin misses. Rebound secured by Bradley Dosunmu.

[10:18] Team_027 possession (Score: 0-3)
FOUL! Offensive foul on Bradley Dosunmu! Dejounte McCollum drew the charge! [Team fouls: 1] (Bradley Dosunmu: 1 personal fouls) TURNOVER! (dead ball)

[10:05] Team_001 possession (Score: 0-3)
Dejounte McCollum attempts a Midrange. Contested by Bradley Dosunmu (4.3 feet, MAN). Dejounte McCollum misses. Rebound secured by Tony Doncic.

[09:53] Team_027 possession (Score: 0-3)
Tony Doncic makes the Layup and draws the foul on Miles Griffin! And-1! Tony Doncic to the line for 1. [Team fouls: 2] (Miles Griffin: 1 personal fouls)   FT 1/1: GOOD Tony Doncic makes 1/1 from the line.
Score: 0-6

[09:42] Team_001 possession (Score: 0-6)
Miles Griffin drives to the basket... Miles Griffin loses the ball! Stripped by John Russell! TURNOVER! (live ball)

[09:27] Team_027 possession (Score: 0-6)
Tony Doncic makes the Dunk and draws the foul on Miles Griffin! And-1! Tony Doncic to the line for 1. [Team fouls: 3] (Miles Griffin: 2 personal fouls)   FT 1/1: GOOD Tony Doncic makes 1/1 from the line.
Score: 0-9

[09:11] Team_001 possession (Score: 0-9)
Klay Harden attempts a 3Pt. Contested by Scottie Harden (4.4 feet, ZONE). KLAY HARDEN MAKES IT! Assist: Cole Ball
Score: 3-9

[08:52] Team_027 possession (Score: 3-9)
FOUL! Shooting foul on Miles Griffin. John Russell to the line for 2 free throws. [Team fouls: 4] (Miles Griffin: 3 personal fouls)   FT 1/2: MISS   FT 2/2: GOOD John Russell makes 1/2 from the line.
Score: 3-10

[08:37] Team_001 possession (Score: 3-10)
Dejounte McCollum throws a bad pass out of bounds! TURNOVER! (dead ball)

[08:24] Team_027 possession (Score: 3-10)
Tony Doncic makes the 3Pt and draws the foul on Klay Harden! And-1! Tony Doncic to the line for 1. [BONUS: 5 team fouls] (Klay Harden: 1 personal fouls)   FT 1/1: GOOD Tony Doncic makes 1/1 from the line.
Score: 3-14

[08:10] Team_001 possession (Score: 3-14)
Cole Ball attempts a Layup. Contested by John Russell (3.7 feet, ZONE). COLE BALL MAKES IT!
Score: 5-14

[07:55] Team_027 possession (Score: 5-14)
Scottie Harden attempts a Layup. Contested by Cole Ball (3.2 feet, MAN). Scottie Harden misses. Offensive rebound by Bradley Dosunmu! Bradley Dosunmu kicks it out.

[07:42] Team_027 possession (Score: 5-14)
Tim Johnson attempts a 3Pt. Contested by Klay Harden (4.2 feet, MAN). Tim Johnson misses. Rebound secured by Miles Griffin.

[07:29] Team_001 possession (Score: 5-14)
Cole Ball attempts a 3Pt. Contested by Tim Johnson (4.6 feet, ZONE). COLE BALL MAKES IT! Assist: Dirk Young
Score: 8-14

[07:09] Team_027 possession (Score: 8-14)
FOUL! Shooting foul on Miles Griffin. John Russell to the line for 2 free throws. [BONUS: 6 team fouls] (Miles Griffin: 4 personal fouls)   FT 1/2: GOOD   FT 2/2: GOOD John Russell makes 2/2 from the line.
Score: 8-16

[07:00] Team_001 possession (Score: 8-16)
Dejounte McCollum makes the Dunk and draws the foul on Tony Doncic! And-1! Dejounte McCollum to the line for 1. [Team fouls: 2] (Tony Doncic: 1 personal fouls)   FT 1/1: GOOD Dejounte McCollum makes 1/1 from the line.
Score: 11-16

[06:45] Team_027 possession (Score: 11-16)
Tony Doncic attempts a 3Pt. Contested by Dejounte McCollum (3.9 feet, ZONE). Tony Doncic misses. Rebound secured by Miles Griffin.

[06:30] Team_001 possession (Score: 11-16)
Dirk Young attempts a 3Pt. Contested by Tim Johnson (5.1 feet, ZONE). DIRK YOUNG MAKES IT! Assist: Dejounte McCollum
Score: 14-16

[06:20] Team_027 possession (Score: 14-16)
Tony Doncic commits a violation (traveling/carry)! TURNOVER! (dead ball)

[06:08] Team_001 possession (Score: 14-16)
Dirk Young drives, picks up John Russell. Help arrives from Tony Doncic! Dirk Young attempts a Dunk. Contested by Tony Doncic (4.1 feet, ZONE). Dirk Young misses. Offensive rebound by Miles Griffin! Miles Griffin kicks it out.

[05:53] Team_001 possession (Score: 14-16)
Dejounte McCollum attempts a 3Pt. Contested by Scottie Harden (4.4 feet, ZONE). DEJOUNTE MCCOLLUM MAKES IT!
Score: 17-16

[05:37] Team_027 possession (Score: 17-16)
Tim Johnson attempts a 3Pt. Contested by Klay Harden (4.2 feet, MAN). Tim Johnson misses. Rebound secured by Dejounte McCollum.

[05:23] Team_001 possession (Score: 17-16)
Dejounte McCollum makes the Layup and draws the foul on John Russell! And-1! Dejounte McCollum to the line for 1. [Team fouls: 3] (John Russell: 1 personal fouls)   FT 1/1: GOOD Dejounte McCollum makes 1/1 from the line.
Score: 20-16

[05:06] Team_027 possession (Score: 20-16)
Tim Johnson attempts a Midrange. Contested by Klay Harden (4.2 feet, MAN). Tim Johnson misses. Rebound secured by Dejounte McCollum.

[04:53] Team_001 possession (Score: 20-16)
FOUL! Reach-in foul on Scottie Harden during the drive. [Team fouls: 4] No free throws, side out. (Scottie Harden: 1 personal fouls)

[04:36] Team_001 possession (Score: 20-16)
Klay Harden drives to the basket... Klay Harden throws a bad pass out of bounds! TURNOVER! (dead ball)

[04:20] Team_027 possession (Score: 20-16)
Tony Doncic attempts a 3Pt. Contested by Dirk Young (3.8 feet, MAN). Tony Doncic misses. Offensive rebound by Bradley Dosunmu! Bradley Dosunmu kicks it out.

[04:09] Team_027 possession (Score: 20-16)
Bradley Dosunmu drives, Dejounte McCollum stays with him. Bradley Dosunmu attempts a Layup. Contested by Dejounte McCollum (3.9 feet, MAN). Bradley Dosunmu misses. Offensive rebound by John Russell! John Russell's putback is no good. Offensive rebound by Bradley Dosunmu! Bradley Dosunmu kicks it out.

[03:58] Team_027 possession (Score: 20-16)
FOUL! Reach-in foul on Miles Griffin during the drive. [IN THE BONUS! 7 team fouls] John Russell to the line for 2 free throws. (Miles Griffin: 5 personal fouls)   FT 1/2: GOOD   FT 2/2: GOOD John Russell makes 2/2 from the line.
Score: 20-18

[03:44] Team_001 possession (Score: 20-18)
Dirk Young attempts a 3Pt. Contested by Tony Doncic (4.2 feet, MAN). DIRK YOUNG MAKES IT! Assist: Klay Harden
Score: 23-18

[03:31] Team_027 possession (Score: 23-18)
Bradley Dosunmu drives and kicks out. Scottie Harden attempts a 3Pt. Contested by Cole Ball (3.2 feet, MAN). Scottie Harden misses. Rebound secured by Miles Griffin.

[03:15] Team_001 possession (Score: 23-18)
Cole Ball loses control! Ball rolls out of bounds! TURNOVER! (dead ball)

[03:15] Substitution (Team_001): Miles Griffin OUT → Kristaps Ming IN (stamina_rule2)

[02:57] Team_027 possession (Score: 23-18)
Tim Johnson attempts a Layup. BLOCKED BY KLAY HARDEN! Ball is loose! Offensive rebound by Bradley Dosunmu! Bradley Dosunmu kicks it out.

[02:46] Team_027 possession (Score: 23-18)
Scottie Harden attempts a 3Pt. Contested by Klay Harden (4.2 feet, ZONE). Scottie Harden misses. Offensive rebound by Bradley Dosunmu! Bradley Dosunmu kicks it out.

[02:28] Team_027 possession (Score: 23-18)
Tony Doncic attempts a Layup. Contested by Kristaps Ming (5.5 feet, ZONE). TONY DONCIC MAKES IT!
Score: 23-20

[02:16] Team_001 possession (Score: 23-20)
Dirk Young attempts a 3Pt. Contested by Tony Doncic (4.4 feet, MAN). DIRK YOUNG MAKES IT! Assist: Cole Ball
Score: 26-20

[01:57] Team_027 possession (Score: 26-20)
Tony Doncic drives, Dirk Young stays with him. Tony Doncic attempts a Layup. Contested by Dirk Young (4.0 feet, MAN). Tony Doncic misses. Rebound secured by Dejounte McCollum.

[01:44] Team_001 possession (Score: 26-20)
Klay Harden attempts a Midrange. Contested by Scottie Harden (4.8 feet, ZONE). Klay Harden misses. Offensive rebound by Cole Ball! Cole Ball kicks it out.

[01:29] Team_001 possession (Score: 26-20)
FOUL! Holding foul on Tim Johnson. [IN THE BONUS! 5 team fouls] Klay Harden to the line for 2 free throws. (Tim Johnson: 1 personal fouls)   FT 1/2: GOOD   FT 2/2: GOOD Klay Harden makes 2/2 from the line.
Score: 28-20

[01:19] Team_027 possession (Score: 28-20)
Scottie Harden attempts a 3Pt. Contested by Cole Ball (3.5 feet, MAN). SCOTTIE HARDEN MAKES IT!
Score: 28-23

[01:06] Team_001 possession (Score: 28-23)
Cole Ball drives, picks up Scottie Harden. Help arrives from Tony Doncic! Cole Ball attempts a Dunk. Contested by Tony Doncic (4.7 feet, MAN). Cole Ball misses. Rebound secured by John Russell.

[00:50] Team_027 possession (Score: 28-23)
Tony Doncic attempts a Layup. BLOCKED BY DEJOUNTE MCCOLLUM! Ball is loose! Rebound secured by Dejounte McCollum.

[00:38] Team_001 possession (Score: 28-23)
Dirk Young attempts a 3Pt. Contested by Tony Doncic (4.5 feet, MAN). Dirk Young misses. Rebound secured by Bradley Dosunmu.

[00:20] Team_027 possession (Score: 28-23)
FOUL! Shooting foul on Dirk Young. Tony Doncic to the line for 2 free throws. [BONUS: 8 team fouls] (Dirk Young: 2 personal fouls)   FT 1/2: GOOD   FT 2/2: GOOD Tony Doncic makes 2/2 from the line.
Score: 28-25

[00:07] Team_001 possession (Score: 28-25)
Cole Ball drives and kicks out. Dejounte McCollum attempts a Midrange. Contested by Bradley Dosunmu (4.9 feet, MAN). Dejounte McCollum misses. Rebound secured by John Russell.

================================================================================
                              1ST QUARTER COMPLETE                              
================================================================================

1ST QUARTER SCORE: Team_001 28, Team_027 25

BOX SCORE:
================================================================================

Team_001
--------------------------------------------------------------------------------
Player                MIN  PTS  REB  AST  TO      FG   FG%      3P   3P%
--------------------------------------------------------------------------------
Dejounte McCollum      12    9    5    1   0   3/5    60.0     0/0   0.0
Dirk Young             12    9    0    1   0   3/4    75.0     0/0   0.0
Cole Ball              12    5    1    2   0   2/5    40.0     0/0   0.0
Klay Harden            12    5    0    1   0   2/2   100.0     0/0   0.0
Miles Griffin           9    0    5    0   0   0/1     0.0     0/0   0.0

TEAM: FG: 10/17 (58.8%), 3PT: 6/8 (75.0%), REB: 11 (3 off, 8 def), AST: 5, TO: 4
TEAM FOULS: 8 [Team_027 in BONUS]


Team_027
--------------------------------------------------------------------------------
Player                MIN  PTS  REB  AST  TO      FG   FG%      3P   3P%
--------------------------------------------------------------------------------
Tony Doncic            12   14    1    0   0   5/9    55.6     0/0   0.0
Scottie Harden         12    6    0    0   0   2/2   100.0     0/0   0.0
John Russell           12    5    3    1   0   3/3   100.0     0/0   0.0
Bradley Dosunmu        12    0    7    0   0   0/1     0.0     0/0   0.0
Tim Johnson            12    0    0    0   0   0/3     0.0     0/0   0.0

TEAM: FG: 10/18 (55.6%), 3PT: 3/6 (50.0%), REB: 11 (5 off, 6 def), AST: 1, TO: 2
TEAM FOULS: 5 [Team_001 in BONUS]

================================================================================

================================================================================
                       2ND QUARTER - Team_001 vs Team_027                       
================================================================================

[12:00] Team_001 possession (Score: 28-25)
Miles Griffin makes the Layup and draws the foul on John Russell! And-1! Miles Griffin to the line for 1. [Team fouls: 1] (John Russell: 1 personal fouls)   FT 1/1: GOOD Miles Griffin makes 1/1 from the line.
Score: 31-25

[11:49] Team_027 possession (Score: 31-25)
FOUL! Offensive foul on Tony Doncic! Dirk Young drew the charge! [Team fouls: 2] (Tony Doncic: 1 personal fouls) TURNOVER! (dead ball)

[11:32] Team_001 possession (Score: 31-25)
Dejounte McCollum attempts a Midrange. Contested by Bradley Dosunmu (4.6 feet, MAN). Dejounte McCollum misses. Rebound secured by Bradley Dosunmu.

[11:19] Team_027 possession (Score: 31-25)
FOUL! Holding foul on Miles Griffin. [Team fouls: 1] No free throws, side out. (Miles Griffin: 1 personal fouls)

[11:05] Team_027 possession (Score: 31-25)
Bradley Dosunmu attempts a Midrange. Contested by Dejounte McCollum (4.2 feet, MAN). Bradley Dosunmu misses. Rebound secured by Cole Ball.

[10:48] Team_001 possession (Score: 31-25)
Klay Harden attempts a 3Pt. Contested by Tim Johnson (5.3 feet, MAN). Klay Harden misses. Rebound secured by John Russell.

[10:34] Team_027 possession (Score: 31-25)
John Russell drives to the basket... John Russell throws a bad pass! Stolen by Miles Griffin! TURNOVER! (live ball)

[10:17] Team_001 possession (Score: 31-25)
Dejounte McCollum drives to the basket... Dejounte McCollum loses control! Ball rolls out of bounds! TURNOVER! (dead ball)

[10:17] Substitution (Team_001): Klay Harden OUT → Ja Dosunmu IN (stamina_rule2)

[10:17] Substitution (Team_001): Dirk Young OUT → Rudy George IN (stamina_rule2)

[10:17] Substitution (Team_001): Cole Ball OUT → Larry Trent IN (stamina_rule2)

[10:17] Substitution (Team_001): Dejounte McCollum OUT → Franz Bryant IN (stamina_rule2)

[10:17] Substitution (Team_027): Tim Johnson OUT → CJ Green IN (stamina_rule2)

[10:17] Substitution (Team_027): Tony Doncic OUT → Dirk Lillard IN (stamina_rule2)

[10:17] Substitution (Team_027): Scottie Harden OUT → Rudy Quickley IN (stamina_rule2)

[10:17] Substitution (Team_027): Bradley Dosunmu OUT → LeBron Russell IN (stamina_rule2)

[10:17] Substitution (Team_027): John Russell OUT → Ben Stewart IN (stamina_rule2)

[10:02] Team_027 possession (Score: 31-25)
Dirk Lillard attempts a 3Pt. Contested by Rudy George (4.4 feet, MAN). Dirk Lillard misses. FOUL! Loose ball foul on Miles Griffin during the rebound battle. [Team fouls: 2] No free throws, side out. (Miles Griffin: 2 personal fouls)

[09:46] Team_027 possession (Score: 31-25)
Dirk Lillard attempts a 3Pt. Contested by Rudy George (4.4 feet, MAN). Dirk Lillard misses. Rebound secured by Miles Griffin.

[09:36] Team_001 possession (Score: 31-25)
Rudy George attempts a 3Pt. BLOCKED BY RUDY QUICKLEY! Ball deflects out of bounds off Rudy George.

[09:26] Team_027 possession (Score: 31-25)
Dirk Lillard attempts a 3Pt. Contested by Ja Dosunmu (4.1 feet, ZONE). Dirk Lillard misses. Rebound secured by Miles Griffin.

[09:11] Team_001 possession (Score: 31-25)
Rudy George drives, Ben Stewart stays with him. Rudy George attempts a Layup. Contested by Ben Stewart (4.8 feet, ZONE). Rudy George misses. FOUL! Loose ball foul on LeBron Russell during the rebound battle. [Team fouls: 3] No free throws, side out. (LeBron Russell: 1 personal fouls)

[08:57] Team_001 possession (Score: 31-25)
Larry Trent attempts a 3Pt. Contested by CJ Green (5.6 feet, ZONE). Larry Trent misses. Rebound secured by LeBron Russell.

[08:42] Team_027 possession (Score: 31-25)
LeBron Russell drives and kicks out. CJ Green attempts a 3Pt. Contested by Ja Dosunmu (4.0 feet, ZONE). CJ Green misses. Offensive rebound by Dirk Lillard! Dirk Lillard kicks it out.

[08:31] Team_027 possession (Score: 31-25)
Rudy Quickley attempts a 3Pt. Contested by Ja Dosunmu (4.5 feet, ZONE). RUDY QUICKLEY MAKES IT! Assist: Dirk Lillard
Score: 31-28

[08:22] Team_001 possession (Score: 31-28)
Miles Griffin attempts a 3Pt. Contested by Rudy Quickley (3.7 feet, ZONE). Miles Griffin misses. Rebound secured by Ben Stewart.

[08:06] Team_027 possession (Score: 31-28)
FOUL! Holding foul on Rudy George. [Team fouls: 3] No free throws, side out. (Rudy George: 1 personal fouls)

[07:53] Team_027 possession (Score: 31-28)
CJ Green drives and kicks out. Ben Stewart attempts a 3Pt. Contested by Ja Dosunmu (4.0 feet, ZONE). Ben Stewart misses. Rebound secured by Miles Griffin.

[07:41] Team_001 possession (Score: 31-28)
Franz Bryant attempts a Layup. Contested by Ben Stewart (4.8 feet, ZONE). Franz Bryant misses. Offensive rebound by Larry Trent! Larry Trent kicks it out.

[07:30] Team_001 possession (Score: 31-28)
Rudy George throws a bad pass out of bounds! TURNOVER! (dead ball)

[07:30] Substitution (Team_001): Miles Griffin OUT → Kristaps Ming IN (stamina_rule2)

[07:15] Team_027 possession (Score: 31-28)
CJ Green attempts a Layup. Contested by Franz Bryant (4.3 feet, ZONE). CJ Green misses. Offensive rebound by Ben Stewart! Ben Stewart's putback is no good. Rebound secured by Rudy George.

[07:01] Team_001 possession (Score: 31-28)
Larry Trent attempts a Midrange. Contested by Rudy Quickley (3.8 feet, MAN). Larry Trent misses. Rebound secured by LeBron Russell.

[06:47] Team_027 possession (Score: 31-28)
FOUL! Shooting foul on Larry Trent. CJ Green to the line for 2 free throws. [Team fouls: 4] (Larry Trent: 1 personal fouls)   FT 1/2: GOOD   FT 2/2: GOOD CJ Green makes 2/2 from the line.
Score: 31-30

[06:36] Team_001 possession (Score: 31-30)
Larry Trent attempts a 3Pt. Contested by Rudy Quickley (3.8 feet, MAN). Larry Trent misses. Rebound secured by Dirk Lillard.

[06:25] Team_027 possession (Score: 31-30)
Ben Stewart drives to the basket... FOUL! Offensive foul on Ben Stewart! Franz Bryant drew the charge! [Team fouls: 4] (Ben Stewart: 1 personal fouls) TURNOVER! (dead ball)

[06:08] Team_001 possession (Score: 31-30)
Ja Dosunmu attempts a Midrange. Contested by Rudy Quickley (3.6 feet, ZONE). Ja Dosunmu misses. Rebound secured by Ben Stewart.

[05:52] Team_027 possession (Score: 31-30)
FOUL! Reach-in foul on Franz Bryant during the drive. [IN THE BONUS! 5 team fouls] Dirk Lillard to the line for 2 free throws. (Franz Bryant: 1 personal fouls)   FT 1/2: GOOD   FT 2/2: GOOD Dirk Lillard makes 2/2 from the line.
Score: 31-32

[05:36] Team_001 possession (Score: 31-32)
FOUL! Shooting foul on Rudy Quickley. Ja Dosunmu to the line for 3 free throws. [BONUS: 5 team fouls] (Rudy Quickley: 1 personal fouls)   FT 1/3: GOOD   FT 2/3: GOOD   FT 3/3: GOOD Ja Dosunmu makes 3/3 from the line.
Score: 34-32

[05:22] Team_027 possession (Score: 34-32)
LeBron Russell attempts a Layup. Contested by Franz Bryant (4.1 feet, MAN). LeBron Russell misses. Rebound secured by Rudy George.

[05:10] Team_001 possession (Score: 34-32)
Kristaps Ming attempts a Midrange. Contested by Dirk Lillard (4.2 feet, ZONE). Kristaps Ming misses. Rebound secured by Dirk Lillard.

[04:51] Team_027 possession (Score: 34-32)
FOUL! Shooting foul on Franz Bryant. LeBron Russell to the line for 2 free throws. [BONUS: 6 team fouls] (Franz Bryant: 2 personal fouls)   FT 1/2: MISS   FT 2/2: GOOD LeBron Russell makes 1/2 from the line.
Score: 34-33

[04:38] Team_001 possession (Score: 34-33)
Ja Dosunmu attempts a 3Pt. Contested by CJ Green (5.3 feet, MAN). Ja Dosunmu misses. Rebound secured by LeBron Russell.

[04:22] Team_027 possession (Score: 34-33)
Rudy Quickley attempts a 3Pt. Contested by Ja Dosunmu (4.5 feet, ZONE). Rudy Quickley misses. Rebound secured by Kristaps Ming.

[04:04] Team_001 possession (Score: 34-33)
Franz Bryant attempts a Midrange. Contested by LeBron Russell (5.6 feet, MAN). Franz Bryant misses. Rebound secured by Dirk Lillard.

[03:51] Team_027 possession (Score: 34-33)
Ben Stewart drives, picks up Kristaps Ming. Help arrives from Rudy George! Ben Stewart attempts a Dunk. Contested by Rudy George (5.3 feet, ZONE). BEN STEWART MAKES IT! Assist: LeBron Russell
Score: 34-35

[03:38] Team_001 possession (Score: 34-35)
Larry Trent drives to the basket... Larry Trent loses control! Ball rolls out of bounds! TURNOVER! (dead ball)

[03:27] Team_027 possession (Score: 34-35)
Dirk Lillard attempts a 3Pt. Contested by Ja Dosunmu (4.1 feet, ZONE). Dirk Lillard misses. Rebound secured by Larry Trent.

[03:07] Team_001 possession (Score: 34-35)
Larry Trent attempts a Midrange. Contested by Rudy Quickley (3.9 feet, MAN). Larry Trent misses. Rebound secured by LeBron Russell.

[02:53] Team_027 possession (Score: 34-35)
LeBron Russell makes the Layup and draws the foul on Franz Bryant! And-1! LeBron Russell to the line for 1. [BONUS: 7 team fouls] (Franz Bryant: 3 personal fouls)   FT 1/1: GOOD LeBron Russell makes 1/1 from the line.
Score: 34-38

[02:43] Team_001 possession (Score: 34-38)
Kristaps Ming attempts a 3Pt. Contested by LeBron Russell (5.6 feet, ZONE). KRISTAPS MING MAKES IT! Assist: Ja Dosunmu
Score: 37-38

[02:31] Team_027 possession (Score: 37-38)
CJ Green attempts a 3Pt. Contested by Ja Dosunmu (4.3 feet, MAN). CJ Green misses. Rebound secured by Kristaps Ming.

[02:18] Team_001 possession (Score: 37-38)
Kristaps Ming attempts a 3Pt. Contested by Rudy Quickley (3.5 feet, ZONE). KRISTAPS MING MAKES IT! Assist: Rudy George
Score: 40-38

[02:03] Team_027 possession (Score: 40-38)
Rudy Quickley attempts a Midrange. Contested by Larry Trent (4.8 feet, MAN). Rudy Quickley misses. Rebound secured by Kristaps Ming.

[01:49] Team_001 possession (Score: 40-38)
Franz Bryant attempts a 3Pt. Contested by Dirk Lillard (4.4 feet, ZONE). Franz Bryant misses. FOUL! Loose ball foul on LeBron Russell during the rebound battle. [IN THE BONUS! 6 team fouls] Larry Trent to the line for 2 free throws. (LeBron Russell: 2 personal fouls)   FT 1/2: GOOD   FT 2/2: GOOD Larry Trent makes 2/2 from the line.
Score: 42-38

[01:32] Team_027 possession (Score: 42-38)
Dirk Lillard drives, Franz Bryant stays with him. Dirk Lillard attempts a Dunk. Contested by Franz Bryant (4.4 feet, ZONE). DIRK LILLARD MAKES IT! Assist: LeBron Russell
Score: 42-40

[01:13] Team_001 possession (Score: 42-40)
Rudy George drives, Dirk Lillard stays with him. Rudy George attempts a Dunk. Contested by Dirk Lillard (4.4 feet, MAN). RUDY GEORGE MAKES IT! Assist: Larry Trent
Score: 44-40

[00:57] Team_027 possession (Score: 44-40)
LeBron Russell attempts a 3Pt. Contested by Franz Bryant (4.5 feet, MAN). LeBron Russell misses. Offensive rebound by Ben Stewart! Ben Stewart puts it back in!
Score: 44-42

[00:42] Team_001 possession (Score: 44-42)
Kristaps Ming attempts a 3Pt. Contested by Dirk Lillard (4.4 feet, ZONE). Kristaps Ming misses. Rebound secured by LeBron Russell.

[00:25] Team_027 possession (Score: 44-42)
FOUL! Shooting foul on Franz Bryant. Dirk Lillard to the line for 2 free throws. [BONUS: 8 team fouls] (Franz Bryant: 4 personal fouls)   FT 1/2: GOOD   FT 2/2: GOOD Dirk Lillard makes 2/2 from the line.
Score: 44-44

[00:07] Team_001 possession (Score: 44-44)
Franz Bryant makes the Layup and draws the foul on LeBron Russell! And-1! Franz Bryant to the line for 1. [BONUS: 7 team fouls] (LeBron Russell: 3 personal fouls)   FT 1/1: GOOD Franz Bryant makes 1/1 from the line.
Score: 47-44

================================================================================
                              2ND QUARTER COMPLETE                              
================================================================================

2ND QUARTER SCORE: Team_001 19, Team_027 19

BOX SCORE:
================================================================================

Team_001
--------------------------------------------------------------------------------
Player                MIN  PTS  REB  AST  TO      FG   FG%      3P   3P%
--------------------------------------------------------------------------------
Kristaps Ming          10    6    3    0   0   2/4    50.0     0/0   0.0
Miles Griffin          14    3    4    0   0   1/2    50.0     0/0   0.0
Ja Dosunmu             10    3    0    1   0   1/3    33.3     0/0   0.0
Franz Bryant           10    3    0    0   0   1/2    50.0     0/0   0.0
Rudy George            10    2    2    1   0   1/2    50.0     0/0   0.0
Larry Trent            10    2    2    1   0   1/5    20.0     0/0   0.0
Dejounte McCollum      14    0    0    0   0   0/1     0.0     0/0   0.0
Cole Ball              14    0    1    0   0   0/0     0.0     0/0   0.0
Klay Harden            14    0    0    0   0   0/1     0.0     0/0   0.0

TEAM: FG: 7/20 (35.0%), 3PT: 4/11 (36.4%), REB: 11 (2 off, 9 def), AST: 3, TO: 3
TEAM FOULS: 8 [Team_027 in BONUS]


Team_027
--------------------------------------------------------------------------------
Player                MIN  PTS  REB  AST  TO      FG   FG%      3P   3P%
--------------------------------------------------------------------------------
Dirk Lillard           10    6    5    1   0   3/6    50.0     0/0   0.0
LeBron Russell         10    4    5    2   0   2/3    66.7     0/0   0.0
Ben Stewart            10    4    3    0   0   2/2   100.0     0/0   0.0
Rudy Quickley          10    3    0    0   0   1/3    33.3     0/0   0.0
CJ Green               10    2    0    0   0   1/4    25.0     0/0   0.0
Bradley Dosunmu        14    0    1    0   0   0/1     0.0     0/0   0.0
John Russell           14    0    1    0   0   0/0     0.0     0/0   0.0

TEAM: FG: 9/19 (47.4%), 3PT: 2/7 (28.6%), REB: 16 (4 off, 12 def), AST: 3, TO: 3
TEAM FOULS: 7 [Team_001 in BONUS]

================================================================================

================================================================================
                       3RD QUARTER - Team_001 vs Team_027                       
================================================================================

[12:00] Team_001 possession (Score: 47-44)
Dirk Young attempts a 3Pt. Contested by Tony Doncic (4.1 feet, MAN). DIRK YOUNG MAKES IT! Assist: Klay Harden
Score: 50-44

[11:50] Team_027 possession (Score: 50-44)
Bradley Dosunmu attempts a 3Pt. Contested by Dejounte McCollum (3.8 feet, MAN). BRADLEY DOSUNMU MAKES IT! Assist: John Russell
Score: 50-47

[11:31] Team_001 possession (Score: 50-47)
Dirk Young throws a bad pass out of bounds! TURNOVER! (dead ball)

[11:17] Team_027 possession (Score: 50-47)
Bradley Dosunmu attempts a Midrange. Contested by Cole Ball (3.2 feet, ZONE). BRADLEY DOSUNMU MAKES IT!
Score: 50-49

[10:58] Team_001 possession (Score: 50-49)
Dejounte McCollum attempts a Layup. Contested by John Russell (3.8 feet, ZONE). Dejounte McCollum misses. Rebound secured by Tony Doncic.

[10:44] Team_027 possession (Score: 50-49)
John Russell drives, picks up Miles Griffin. Help arrives from Klay Harden! John Russell attempts a Layup. Contested by Klay Harden (4.8 feet, ZONE). JOHN RUSSELL MAKES IT!
Score: 50-51

[10:32] Team_001 possession (Score: 50-51)
Miles Griffin attempts a Layup. BLOCKED BY JOHN RUSSELL! Ball deflects out of bounds off Miles Griffin.

[10:17] Team_027 possession (Score: 50-51)
Scottie Harden attempts a 3Pt. Contested by Klay Harden (3.9 feet, ZONE). Scottie Harden misses. Rebound secured by Dejounte McCollum.

[10:02] Team_001 possession (Score: 50-51)
Cole Ball drives, Scottie Harden stays with him. Cole Ball attempts a Dunk. Contested by Scottie Harden (4.3 feet, MAN). COLE BALL MAKES IT! Assist: Miles Griffin
Score: 52-51

[09:50] Team_027 possession (Score: 52-51)
FOUL! Shooting foul on Miles Griffin. Tony Doncic to the line for 2 free throws. [Team fouls: 1] (Miles Griffin: 1 personal fouls)   FT 1/2: GOOD   FT 2/2: GOOD Tony Doncic makes 2/2 from the line.
Score: 52-53

[09:35] Team_001 possession (Score: 52-53)
Cole Ball drives, Scottie Harden stays with him. Cole Ball attempts a Dunk. Contested by Scottie Harden (4.3 feet, MAN). COLE BALL MAKES IT! Assist: Klay Harden
Score: 54-53

[09:23] Team_027 possession (Score: 54-53)
Bradley Dosunmu makes the Layup and draws the foul on Klay Harden! And-1! Bradley Dosunmu to the line for 1. [Team fouls: 2] (Klay Harden: 1 personal fouls)   FT 1/1: GOOD Bradley Dosunmu makes 1/1 from the line.
Score: 54-56

[09:08] Team_001 possession (Score: 54-56)
Dejounte McCollum loses the ball! Stripped by Bradley Dosunmu! TURNOVER! (live ball)

[08:49] Team_027 possession (Score: 54-56)
FOUL! Holding foul on Dirk Young. [Team fouls: 3] No free throws, side out. (Dirk Young: 1 personal fouls)

[08:33] Team_027 possession (Score: 54-56)
Tim Johnson attempts a 3Pt. Contested by Klay Harden (4.2 feet, MAN). TIM JOHNSON MAKES IT! Assist: John Russell
Score: 54-59

[08:17] Team_001 possession (Score: 54-59)
FOUL! Offensive foul on Klay Harden! Tim Johnson drew the charge! [Team fouls: 4] (Klay Harden: 2 personal fouls) TURNOVER! (dead ball)

[07:59] Team_027 possession (Score: 54-59)
Tony Doncic attempts a 3Pt. Contested by Klay Harden (4.0 feet, ZONE). TONY DONCIC MAKES IT! Assist: Bradley Dosunmu
Score: 54-62

[07:40] Team_001 possession (Score: 54-62)
Dirk Young attempts a 3Pt. Contested by Tim Johnson (5.1 feet, ZONE). Dirk Young misses. Rebound secured by John Russell.

[07:23] Team_027 possession (Score: 54-62)
Tony Doncic drives and kicks out. Tony Doncic attempts a 3Pt. Contested by Klay Harden (3.9 feet, ZONE). TONY DONCIC MAKES IT! Assist: Tim Johnson
Score: 54-65

[07:12] Team_001 possession (Score: 54-65)
Cole Ball attempts a 3Pt. Contested by Tim Johnson (4.6 feet, ZONE). Cole Ball misses. Rebound secured by John Russell.

[06:57] Team_027 possession (Score: 54-65)
Tim Johnson drives and kicks out. Bradley Dosunmu attempts a 3Pt. Contested by Klay Harden (3.9 feet, ZONE). Bradley Dosunmu misses. Rebound secured by Miles Griffin.

[06:48] Team_001 possession (Score: 54-65)
Klay Harden drives, picks up John Russell. Help arrives from Tony Doncic! Klay Harden attempts a Dunk. Contested by Tony Doncic (3.8 feet, ZONE). KLAY HARDEN MAKES IT! Assist: Miles Griffin
Score: 56-65

[06:37] Team_027 possession (Score: 56-65)
Tim Johnson attempts a 3Pt. Contested by Klay Harden (4.2 feet, MAN). Tim Johnson misses. Rebound secured by Cole Ball.

[06:23] Team_001 possession (Score: 56-65)
Dirk Young attempts a Midrange. Contested by Tony Doncic (4.1 feet, MAN). DIRK YOUNG MAKES IT!
Score: 58-65

[06:07] Team_027 possession (Score: 58-65)
John Russell loses control! Ball rolls out of bounds! TURNOVER! (dead ball)

[05:49] Team_001 possession (Score: 58-65)
Cole Ball drives and kicks out. Dejounte McCollum attempts a 3Pt. Contested by Bradley Dosunmu (4.4 feet, MAN). Dejounte McCollum misses. Rebound secured by Tony Doncic.

[05:34] Team_027 possession (Score: 58-65)
FOUL! Holding foul on Cole Ball. [IN THE BONUS! 5 team fouls] Scottie Harden to the line for 2 free throws. (Cole Ball: 1 personal fouls)   FT 1/2: MISS   FT 2/2: MISS Scottie Harden makes 0/2 from the line. FOUL! Loose ball foul on Miles Griffin during the free throw rebound! [IN THE BONUS! 6 team fouls] Bradley Dosunmu to the line for 2 free throws. (Miles Griffin: 2 personal fouls)   FT 1/2: GOOD   FT 2/2: GOOD Bradley Dosunmu makes 2/2 from the line.
Score: 58-67

[05:18] Team_001 possession (Score: 58-67)
Dejounte McCollum drives and kicks out. Dejounte McCollum attempts a 3Pt. Contested by Bradley Dosunmu (4.4 feet, MAN). Dejounte McCollum misses. Offensive rebound by Cole Ball! Cole Ball kicks it out.

[05:02] Team_001 possession (Score: 58-67)
Cole Ball attempts a 3Pt. Contested by Scottie Harden (4.3 feet, MAN). COLE BALL MAKES IT! Assist: Klay Harden
Score: 61-67

[04:45] Team_027 possession (Score: 61-67)
Tim Johnson attempts a Layup. Contested by Miles Griffin (4.3 feet, ZONE). Tim Johnson misses. Rebound secured by Dejounte McCollum.

[04:28] Team_001 possession (Score: 61-67)
Miles Griffin attempts a Midrange. BLOCKED BY JOHN RUSSELL! Ball is loose! Offensive rebound by Miles Griffin! Miles Griffin kicks it out.

[04:12] Team_001 possession (Score: 61-67)
Dirk Young attempts a Midrange. Contested by John Russell (4.2 feet, ZONE). DIRK YOUNG MAKES IT! Assist: Klay Harden
Score: 63-67

[04:01] Team_027 possession (Score: 63-67)
John Russell attempts a Midrange. Contested by Miles Griffin (4.9 feet, MAN). John Russell misses. Rebound secured by Cole Ball.

[03:48] Team_001 possession (Score: 63-67)
Klay Harden attempts a 3Pt. Contested by Tim Johnson (4.9 feet, ZONE). Klay Harden misses. Rebound secured by Bradley Dosunmu.

[03:35] Team_027 possession (Score: 63-67)
Scottie Harden attempts a 3Pt. Contested by Klay Harden (4.1 feet, ZONE). Scottie Harden misses. Offensive rebound by John Russell! John Russell puts it back in!
Score: 63-69

[03:22] Team_001 possession (Score: 63-69)
Miles Griffin drives, John Russell stays with him. Miles Griffin attempts a Dunk. Contested by John Russell (4.5 feet, ZONE). Miles Griffin misses. Rebound secured by Bradley Dosunmu.

[03:07] Team_027 possession (Score: 63-69)
Bradley Dosunmu attempts a Midrange. Contested by Cole Ball (3.3 feet, ZONE). Bradley Dosunmu misses. Offensive rebound by John Russell! John Russell puts it back in!
Score: 63-71

[02:51] Team_001 possession (Score: 63-71)
Miles Griffin drives and kicks out. Cole Ball attempts a 3Pt. Contested by Tim Johnson (5.1 feet, ZONE). Cole Ball misses. Rebound secured by Tony Doncic.

[02:38] Team_027 possession (Score: 63-71)
Tony Doncic drives, Miles Griffin stays with him. Tony Doncic attempts a Dunk. Contested by Miles Griffin (4.4 feet, ZONE). TONY DONCIC MAKES IT! Assist: John Russell
Score: 63-73

[02:23] Team_001 possession (Score: 63-73)
Klay Harden drives to the basket... Klay Harden commits a violation (traveling/carry)! TURNOVER! (dead ball)

[02:23] Substitution (Team_001): Klay Harden OUT → Ja Dosunmu IN (stamina_rule2)

[02:23] Substitution (Team_001): Miles Griffin OUT → Kristaps Ming IN (stamina_rule2)

[02:23] Substitution (Team_027): Tim Johnson OUT → CJ Green IN (stamina_rule2)

[02:23] Substitution (Team_027): Scottie Harden OUT → Rudy Quickley IN (stamina_rule2)

[02:23] Substitution (Team_027): John Russell OUT → Ben Stewart IN (stamina_rule2)

[02:08] Team_027 possession (Score: 63-73)
FOUL! Reach-in foul on Kristaps Ming during the drive. [IN THE BONUS! 7 team fouls] Ben Stewart to the line for 2 free throws. (Kristaps Ming: 1 personal fouls)   FT 1/2: GOOD   FT 2/2: GOOD Ben Stewart makes 2/2 from the line.
Score: 63-75

[01:56] Team_001 possession (Score: 63-75)
FOUL! Shooting foul on Rudy Quickley. Dejounte McCollum to the line for 2 free throws. [Team fouls: 1] (Rudy Quickley: 1 personal fouls)   FT 1/2: GOOD   FT 2/2: MISS Dejounte McCollum makes 1/2 from the line. Offensive rebound by Cole Ball! Cole Ball kicks it out.
Score: 64-75

[01:39] Team_001 possession (Score: 64-75)
FOUL! Holding foul on CJ Green. [Team fouls: 2] No free throws, side out. (CJ Green: 1 personal fouls)

[01:29] Team_001 possession (Score: 64-75)
Dejounte McCollum attempts a 3Pt. Contested by Bradley Dosunmu (4.6 feet, MAN). Dejounte McCollum misses. Rebound secured by Bradley Dosunmu.

[01:15] Team_027 possession (Score: 64-75)
Ben Stewart attempts a Midrange. Contested by Cole Ball (3.4 feet, ZONE). Ben Stewart misses. Rebound secured by Kristaps Ming.

[01:05] Team_001 possession (Score: 64-75)
Ja Dosunmu makes the Layup and draws the foul on Ben Stewart! And-1! Ja Dosunmu to the line for 1. [Team fouls: 3] (Ben Stewart: 1 personal fouls)   FT 1/1: GOOD Ja Dosunmu makes 1/1 from the line.
Score: 67-75

[00:49] Team_027 possession (Score: 67-75)
FOUL! Reach-in foul on Cole Ball during the drive. [IN THE BONUS! 8 team fouls] Rudy Quickley to the line for 2 free throws. (Cole Ball: 2 personal fouls)   FT 1/2: GOOD   FT 2/2: GOOD Rudy Quickley makes 2/2 from the line.
Score: 67-77

[00:33] Team_001 possession (Score: 67-77)
Kristaps Ming makes the Layup and draws the foul on Ben Stewart! And-1! Kristaps Ming to the line for 1. [Team fouls: 4] (Ben Stewart: 2 personal fouls)   FT 1/1: GOOD Kristaps Ming makes 1/1 from the line.
Score: 70-77

[00:15] Team_027 possession (Score: 70-77)
Tony Doncic attempts a 3Pt. Contested by Dirk Young (4.2 feet, MAN). Tony Doncic misses. Rebound secured by Cole Ball.

[00:01] Team_001 possession (Score: 70-77)
Ja Dosunmu attempts a 3Pt. Contested by CJ Green (5.3 feet, MAN). Ja Dosunmu misses. Rebound secured by Ben Stewart.

================================================================================
                              3RD QUARTER COMPLETE                              
================================================================================

3RD QUARTER SCORE: Team_001 23, Team_027 33

BOX SCORE:
================================================================================

Team_001
--------------------------------------------------------------------------------
Player                MIN  PTS  REB  AST  TO      FG   FG%      3P   3P%
--------------------------------------------------------------------------------
Dirk Young             26    7    0    0   0   3/4    75.0     0/0   0.0
Cole Ball              26    7    5    0   0   3/5    60.0     0/0   0.0
Kristaps Ming          13    3    1    0   0   1/1   100.0     0/0   0.0
Ja Dosunmu             12    3    0    0   0   1/2    50.0     0/0   0.0
Klay Harden            24    2    0    4   0   1/2    50.0     0/0   0.0
Dejounte McCollum      26    0    2    0   0   0/2     0.0     0/0   0.0
Miles Griffin          24    0    2    2   0   0/3     0.0     0/0   0.0

TEAM: FG: 9/19 (47.4%), 3PT: 2/7 (28.6%), REB: 10 (3 off, 7 def), AST: 6, TO: 4
TEAM FOULS: 8 [Team_027 in BONUS]


Team_027
--------------------------------------------------------------------------------
Player                MIN  PTS  REB  AST  TO      FG   FG%      3P   3P%
--------------------------------------------------------------------------------
Bradley Dosunmu        26   10    3    1   0   4/4   100.0     0/0   0.0
Tony Doncic            26   10    3    0   0   4/5    80.0     0/0   0.0
John Russell           24    6    4    3   0   3/4    75.0     0/0   0.0
Tim Johnson            24    3    0    1   0   1/4    25.0     0/0   0.0
Ben Stewart            12    2    1    0   0   1/2    50.0     0/0   0.0
Rudy Quickley          12    2    0    0   0   1/1   100.0     0/0   0.0
Scottie Harden         24    0    0    0   0   0/1     0.0     0/0   0.0

TEAM: FG: 14/21 (66.7%), 3PT: 4/7 (57.1%), REB: 11 (2 off, 9 def), AST: 5, TO: 1
TEAM FOULS: 4

================================================================================

================================================================================
                       4TH QUARTER - Team_001 vs Team_027                       
================================================================================

[12:00] Team_001 possession (Score: 70-77)
Cole Ball attempts a 3Pt. Contested by Tim Johnson (4.6 feet, ZONE). Cole Ball misses. Rebound secured by Bradley Dosunmu.

[11:48] Team_027 possession (Score: 70-77)
Tony Doncic attempts a 3Pt. Contested by Dirk Young (4.0 feet, MAN). Tony Doncic misses. Rebound secured by Cole Ball.

[11:31] Team_001 possession (Score: 70-77)
Miles Griffin drives, John Russell stays with him. Miles Griffin attempts a Dunk. Contested by John Russell (4.4 feet, ZONE). MILES GRIFFIN MAKES IT!
Score: 72-77

[11:15] Team_027 possession (Score: 72-77)
Tim Johnson attempts a 3Pt. Contested by Klay Harden (4.2 feet, ZONE). Tim Johnson misses. Offensive rebound by John Russell! John Russell's putback is no good. Offensive rebound by Bradley Dosunmu! Bradley Dosunmu kicks it out.

[11:05] Team_027 possession (Score: 72-77)
Scottie Harden attempts a 3Pt. Contested by Klay Harden (4.0 feet, ZONE). Scottie Harden misses. Rebound secured by Dejounte McCollum.

[10:52] Team_001 possession (Score: 72-77)
FOUL! Shooting foul on Tony Doncic. Miles Griffin to the line for 2 free throws. [Team fouls: 1] (Tony Doncic: 1 personal fouls)   FT 1/2: GOOD   FT 2/2: MISS Miles Griffin makes 1/2 from the line. Rebound secured by Bradley Dosunmu.
Score: 73-77

[10:35] Team_027 possession (Score: 73-77)
Scottie Harden attempts a 3Pt. Contested by Cole Ball (3.6 feet, MAN). Scottie Harden misses. Rebound secured by Dejounte McCollum.

[10:19] Team_001 possession (Score: 73-77)
Dirk Young attempts a Midrange. Contested by Tony Doncic (4.5 feet, MAN). DIRK YOUNG MAKES IT! Assist: Klay Harden
Score: 75-77

[10:09] Team_027 possession (Score: 75-77)
Tony Doncic attempts a 3Pt. Contested by Dirk Young (4.2 feet, MAN). Tony Doncic misses. Rebound secured by Miles Griffin.

[09:55] Team_001 possession (Score: 75-77)
Dejounte McCollum loses the ball! Stripped by Bradley Dosunmu! TURNOVER! (live ball)

[09:37] Team_027 possession (Score: 75-77)
Bradley Dosunmu drives, Miles Griffin stays with him. Bradley Dosunmu attempts a Layup. Contested by Miles Griffin (4.3 feet, ZONE). BRADLEY DOSUNMU MAKES IT! Assist: Tim Johnson
Score: 75-79

[09:23] Team_001 possession (Score: 75-79)
FOUL! Shooting foul on Tony Doncic. Dirk Young to the line for 2 free throws. [Team fouls: 2] (Tony Doncic: 2 personal fouls)   FT 1/2: MISS   FT 2/2: GOOD Dirk Young makes 1/2 from the line.
Score: 76-79

[09:05] Team_027 possession (Score: 76-79)
Bradley Dosunmu attempts a 3Pt. Contested by Dejounte McCollum (4.4 feet, MAN). BRADLEY DOSUNMU MAKES IT!
Score: 76-82

[08:49] Team_001 possession (Score: 76-82)
Dirk Young attempts a Midrange. Contested by Scottie Harden (5.0 feet, ZONE). Dirk Young misses. Offensive rebound by Miles Griffin! Miles Griffin kicks it out.

[08:33] Team_001 possession (Score: 76-82)
Dirk Young drives and kicks out. Klay Harden attempts a 3Pt. Contested by Tim Johnson (5.2 feet, MAN). Klay Harden misses. Rebound secured by John Russell.

[08:21] Team_027 possession (Score: 76-82)
John Russell attempts a Midrange. Contested by Dejounte McCollum (5.2 feet, ZONE). John Russell misses. Rebound secured by Dejounte McCollum.

[08:07] Team_001 possession (Score: 76-82)
Miles Griffin attempts a Layup. BLOCKED BY JOHN RUSSELL! Ball is loose! Rebound secured by John Russell.

[07:51] Team_027 possession (Score: 76-82)
Tony Doncic drives to the basket... Tony Doncic throws a bad pass out of bounds! TURNOVER! (dead ball)

[07:51] Substitution (Team_001): Klay Harden OUT → Ja Dosunmu IN (stamina_rule2)

[07:51] Substitution (Team_001): Dirk Young OUT → Rudy George IN (stamina_rule2)

[07:51] Substitution (Team_001): Cole Ball OUT → Larry Trent IN (stamina_rule2)

[07:51] Substitution (Team_001): Dejounte McCollum OUT → Franz Bryant IN (stamina_rule2)

[07:51] Substitution (Team_001): Miles Griffin OUT → Kristaps Ming IN (stamina_rule2)

[07:51] Substitution (Team_027): Tim Johnson OUT → CJ Green IN (stamina_rule2)

[07:51] Substitution (Team_027): Tony Doncic OUT → Dirk Lillard IN (stamina_rule2)

[07:51] Substitution (Team_027): Scottie Harden OUT → Rudy Quickley IN (stamina_rule2)

[07:51] Substitution (Team_027): Bradley Dosunmu OUT → LeBron Russell IN (stamina_rule2)

[07:51] Substitution (Team_027): John Russell OUT → Ben Stewart IN (stamina_rule2)

[07:39] Team_001 possession (Score: 76-82)
Franz Bryant attempts a Midrange. Contested by LeBron Russell (5.6 feet, MAN). Franz Bryant misses. Rebound secured by Dirk Lillard.

[07:23] Team_027 possession (Score: 76-82)
LeBron Russell makes the Layup and draws the foul on Franz Bryant! And-1! LeBron Russell to the line for 1. [Team fouls: 1] (Franz Bryant: 1 personal fouls)   FT 1/1: GOOD LeBron Russell makes 1/1 from the line.
Score: 76-85

[07:07] Team_001 possession (Score: 76-85)
Ja Dosunmu attempts a 3Pt. Contested by Rudy Quickley (3.6 feet, ZONE). Ja Dosunmu misses. Rebound secured by Ben Stewart.

[06:50] Team_027 possession (Score: 76-85)
Dirk Lillard attempts a Layup. BLOCKED BY RUDY GEORGE! Ball is loose! Rebound secured by Larry Trent.

[06:35] Team_001 possession (Score: 76-85)
FOUL! Holding foul on Ben Stewart. [Team fouls: 3] No free throws, side out. (Ben Stewart: 1 personal fouls)

[06:22] Team_001 possession (Score: 76-85)
Kristaps Ming drives and kicks out. FOUL! Shooting foul on Dirk Lillard. Rudy George to the line for 2 free throws. [Team fouls: 4] (Dirk Lillard: 1 personal fouls)   FT 1/2: GOOD   FT 2/2: GOOD Rudy George makes 2/2 from the line.
Score: 78-85

[06:04] Team_027 possession (Score: 78-85)
Dirk Lillard drives, Rudy George stays with him. Dirk Lillard attempts a Dunk. Contested by Rudy George (4.4 feet, MAN). DIRK LILLARD MAKES IT! Assist: CJ Green
Score: 78-87

[05:49] Team_001 possession (Score: 78-87)
Kristaps Ming drives and kicks out. Rudy George attempts a 3Pt. Contested by Dirk Lillard (4.1 feet, MAN). Rudy George misses. Rebound secured by LeBron Russell.

[05:36] Team_027 possession (Score: 78-87)
Rudy Quickley attempts a Midrange. Contested by Larry Trent (4.6 feet, MAN). RUDY QUICKLEY MAKES IT!
Score: 78-89

[05:18] Team_001 possession (Score: 78-89)
Larry Trent attempts a 3Pt. Contested by Rudy Quickley (3.8 feet, MAN). Larry Trent misses. Offensive rebound by Larry Trent! Larry Trent kicks it out.

[05:01] Team_001 possession (Score: 78-89)
FOUL! Holding foul on Rudy Quickley. [IN THE BONUS! 5 team fouls] Larry Trent to the line for 2 free throws. (Rudy Quickley: 1 personal fouls)   FT 1/2: GOOD   FT 2/2: GOOD Larry Trent makes 2/2 from the line.
Score: 80-89

[04:50] Team_027 possession (Score: 80-89)
Dirk Lillard attempts a 3Pt. Contested by Ja Dosunmu (4.1 feet, ZONE). Dirk Lillard misses. Rebound secured by Kristaps Ming.

[04:38] Team_001 possession (Score: 80-89)
Franz Bryant drives to the basket... Franz Bryant throws a bad pass out of bounds! TURNOVER! (dead ball)

[04:23] Team_027 possession (Score: 80-89)
Ben Stewart attempts a 3Pt. Contested by Ja Dosunmu (3.9 feet, ZONE). Ben Stewart misses. Rebound secured by Rudy George.

[04:07] Team_001 possession (Score: 80-89)
Rudy George attempts a 3Pt. Contested by Dirk Lillard (4.2 feet, MAN). Rudy George misses. Offensive rebound by Larry Trent! Larry Trent kicks it out.

[03:50] Team_001 possession (Score: 80-89)
Kristaps Ming drives to the basket... Kristaps Ming throws a bad pass! Stolen by Ben Stewart! TURNOVER! (live ball)

[03:36] Team_027 possession (Score: 80-89)
Ben Stewart attempts a Midrange. Contested by Kristaps Ming (5.3 feet, MAN). Ben Stewart misses. Rebound secured by Larry Trent.

[03:22] Team_001 possession (Score: 80-89)
Rudy George attempts a 3Pt. Contested by Rudy Quickley (3.4 feet, ZONE). Rudy George misses. Rebound secured by Ben Stewart.

[03:07] Team_027 possession (Score: 80-89)
Rudy Quickley makes the Layup and draws the foul on Franz Bryant! And-1! Rudy Quickley to the line for 1. [Team fouls: 2] (Franz Bryant: 2 personal fouls)   FT 1/1: MISS Rudy Quickley makes 0/1 from the line. Offensive rebound by Ben Stewart! Ben Stewart's putback is no good.
Score: 80-91

[02:48] Team_001 possession (Score: 80-91)
Rudy George attempts a Layup. Contested by Ben Stewart (4.8 feet, ZONE). RUDY GEORGE MAKES IT!
Score: 82-91

[02:32] Team_027 possession (Score: 82-91)
Ben Stewart drives to the basket... Ben Stewart throws a bad pass! Stolen by Kristaps Ming! TURNOVER! (live ball)

[02:17] Team_001 possession (Score: 82-91)
Rudy George drives, picks up Dirk Lillard. Help arrives from Rudy Quickley! Rudy George attempts a Layup. Contested by Rudy Quickley (4.2 feet, MAN). Rudy George misses. Rebound secured by Dirk Lillard.

[02:06] Team_027 possession (Score: 82-91)
FOUL! Shooting foul on Franz Bryant. LeBron Russell to the line for 2 free throws. [Team fouls: 3] (Franz Bryant: 3 personal fouls)   FT 1/2: MISS   FT 2/2: GOOD LeBron Russell makes 1/2 from the line.
Score: 82-92

[01:53] Team_001 possession (Score: 82-92)
Kristaps Ming attempts a Layup. Contested by Ben Stewart (4.7 feet, ZONE). Kristaps Ming misses. Rebound secured by Ben Stewart.

[01:44] Team_027 possession (Score: 82-92)
LeBron Russell drives to the basket... LeBron Russell throws a bad pass! Stolen by Franz Bryant! TURNOVER! (live ball)

[01:28] Team_001 possession (Score: 82-92)
Kristaps Ming drives and kicks out. Franz Bryant attempts a Midrange. Contested by LeBron Russell (5.5 feet, ZONE). Franz Bryant misses. Rebound secured by Dirk Lillard.

[01:12] Team_027 possession (Score: 82-92)
Dirk Lillard attempts a 3Pt. Contested by Rudy George (4.4 feet, MAN). Dirk Lillard misses. Rebound secured by Franz Bryant.

[01:02] Team_001 possession (Score: 82-92)
Kristaps Ming attempts a Midrange. Contested by Ben Stewart (4.8 feet, MAN). Kristaps Ming misses. Rebound secured by LeBron Russell.

[00:43] Team_027 possession (Score: 82-92)
Ben Stewart makes the Layup and draws the foul on Franz Bryant! And-1! Ben Stewart to the line for 1. [Team fouls: 4] (Franz Bryant: 4 personal fouls)   FT 1/1: GOOD Ben Stewart makes 1/1 from the line.
Score: 82-95

[00:24] Team_001 possession (Score: 82-95)
Ja Dosunmu attempts a 3Pt. Contested by LeBron Russell (5.7 feet, ZONE). JA DOSUNMU MAKES IT! Assist: Franz Bryant
Score: 85-95

[00:11] Team_027 possession (Score: 85-95)
Rudy Quickley attempts a 3Pt. Contested by Rudy George (4.8 feet, ZONE). Rudy Quickley misses. Offensive rebound by Ben Stewart! Ben Stewart puts it back in!
Score: 85-97

================================================================================
                              4TH QUARTER COMPLETE                              
================================================================================

4TH QUARTER SCORE: Team_001 15, Team_027 20

BOX SCORE:
================================================================================

Team_001
--------------------------------------------------------------------------------
Player                MIN  PTS  REB  AST  TO      FG   FG%      3P   3P%
--------------------------------------------------------------------------------
Rudy George            18    4    1    0   0   2/4    50.0     0/0   0.0
Dirk Young             31    3    0    0   0   2/3    66.7     0/0   0.0
Ja Dosunmu             20    3    0    0   0   1/2    50.0     0/0   0.0
Miles Griffin          28    2    2    0   0   1/3    33.3     0/0   0.0
Larry Trent            18    2    4    0   0   1/1   100.0     0/0   0.0
Cole Ball              31    0    1    0   0   0/1     0.0     0/0   0.0
Dejounte McCollum      31    0    3    0   0   0/0     0.0     0/0   0.0
Klay Harden            28    0    0    1   0   0/0     0.0     0/0   0.0
Franz Bryant           18    0    1    1   0   0/1     0.0     0/0   0.0
Kristaps Ming          20    0    1    0   0   0/4     0.0     0/0   0.0

TEAM: FG: 7/19 (36.8%), 3PT: 1/4 (25.0%), REB: 14 (3 off, 11 def), AST: 2, TO: 3
TEAM FOULS: 4


Team_027
--------------------------------------------------------------------------------
Player                MIN  PTS  REB  AST  TO      FG   FG%      3P   3P%
--------------------------------------------------------------------------------
Bradley Dosunmu        31    5    3    0   0   2/2   100.0     0/0   0.0
Ben Stewart            20    5    5    0   0   2/4    50.0     0/0   0.0
LeBron Russell         18    4    2    0   0   2/2   100.0     0/0   0.0
Dirk Lillard           18    2    3    0   0   1/4    25.0     0/0   0.0
Rudy Quickley          20    2    0    0   0   1/2    50.0     0/0   0.0
Tony Doncic            31    0    0    0   0   0/2     0.0     0/0   0.0
Scottie Harden         28    0    0    0   0   0/2     0.0     0/0   0.0
Tim Johnson            28    0    0    1   0   0/0     0.0     0/0   0.0
John Russell           28    0    2    0   0   0/1     0.0     0/0   0.0
CJ Green               20    0    0    1   0   0/0     0.0     0/0   0.0

TEAM: FG: 8/19 (42.1%), 3PT: 2/9 (22.2%), REB: 14 (2 off, 12 def), AST: 2, TO: 3
TEAM FOULS: 5 [Team_001 in BONUS]

================================================================================

================================================================================
                               FULL GAME COMPLETE                               
================================================================================

FINAL SCORE: Team_001 85, Team_027 97

SCORING BY QUARTER:
--------------------------------------------------------------------------------
Team                     Q1     Q2     Q3     Q4    FINAL
--------------------------------------------------------------------------------
Team_001                 28     19     23     15       85
Team_027                 25     19     33     20       97
--------------------------------------------------------------------------------

FULL GAME BOX SCORE:
================================================================================

Team_001
--------------------------------------------------------------------------------
Player                MIN  PTS  REB  AST  TO      FG   FG%      3P   3P%      FT STL BLK
--------------------------------------------------------------------------------
Dirk Young             31   19    0    1   1   8/11   72.7   4/6    66.7   1/2     0   0
Cole Ball              31   12    8    2   2   5/11   45.5   2/5    40.0   0/0     0   0
Dejounte McCollum      31    9   10    1   3   3/8    37.5   1/2    50.0   3/4     0   1
Klay Harden            28    7    0    6   2   2/4    50.0   1/3    33.3   2/2     0   1
Miles Griffin          28    5   13    2   2   2/9    22.2   0/1     0.0   2/3     1   0
Kristaps Ming          20    9    5    0   0   4/10   40.0   2/3    66.7   1/1     1   0
Ja Dosunmu             20    9    0    1   0   3/7    42.9   2/5    40.0   4/4     0   0
Rudy George            18    6    3    1   1   2/5    40.0   0/2     0.0   2/2     0   1
Larry Trent            18    4    6    1   1   0/4     0.0   0/2     0.0   4/4     0   0
Franz Bryant           18    3    1    1   2   2/4    50.0   1/1   100.0   1/1     1   0

TEAM: FG: 33/75 (44.0%), 3PT: 13/30 (43.3%), REB: 46 (11 off, 35 def), AST: 16, TO: 14


Team_027
--------------------------------------------------------------------------------
Player                MIN  PTS  REB  AST  TO      FG   FG%      3P   3P%      FT STL BLK
--------------------------------------------------------------------------------
Tony Doncic            31   24    4    0   2   9/16   56.2   2/6    33.3   7/7     0   0
Bradley Dosunmu        31   15   14    1   1   6/8    75.0   2/2   100.0   1/1     2   1
Tim Johnson            28    3    0    2   0   1/7    14.3   1/4    25.0   0/0     0   0
Scottie Harden         28    6    0    0   1   3/6    50.0   3/6    50.0   0/2     0   0
John Russell           28   11   10    4   2   4/6    66.7   0/0     0.0   5/6     1   4
CJ Green               20    2    0    1   0   1/4    25.0   0/1     0.0   2/2     0   0
Rudy Quickley          20    7    0    0   0   4/7    57.1   2/3    66.7   2/3     0   1
Ben Stewart            20   11    9    0   1   3/6    50.0   0/1     0.0   3/3     1   0
Dirk Lillard           18    8    8    1   1   4/10   40.0   0/5     0.0   4/4     0   0
LeBron Russell         18    8    7    2   1   5/6    83.3   1/1   100.0   4/6     0   0

TEAM: FG: 41/77 (53.2%), 3PT: 11/29 (37.9%), REB: 52 (13 off, 39 def), AST: 11, TO: 9

================================================================================
