================================================================================
                        FULL GAME - Team_004 vs Team_083                        
================================================================================

================================================================================
                       1ST QUARTER - Team_004 vs Team_083                       
================================================================================

[12:00] Team_004 possession (Score: 0-0)
Jabari Wade attempts a 3Pt. Contested by Karl Jokic (5.3 feet, MAN). JABARI WADE MAKES IT! Assist: Draymond Fox
Score: 3-0

[11:41] Team_083 possession (Score: 3-0)
Bradley Thompson drives and kicks out. Bradley Thompson attempts a Midrange. Contested by Jabari Wade (4.7 feet, ZONE). Bradley Thompson misses. Offensive rebound by Kyrie Griffin! Kyrie Griffin kicks it out.

[11:26] Team_083 possession (Score: 3-0)
Bradley Thompson attempts a 3Pt. Contested by Jabari Wade (4.8 feet, ZONE). Bradley Thompson misses. Rebound secured by Anthony Lillard.

[11:12] Team_004 possession (Score: 3-0)
Anthony Lillard attempts a 3Pt. Contested by Malcolm Brogdon (5.2 feet, ZONE). ANTHONY LILLARD MAKES IT! Assist: Michael Curry
Score: 6-0

[10:52] Team_083 possession (Score: 6-0)
FOUL! Holding foul on Anthony Lillard. [Team fouls: 1] No free throws, side out. (Anthony Lillard: 1 personal fouls)

[10:38] Team_083 possession (Score: 6-0)
Kyrie Griffin drives, picks up Draymond Fox. Help arrives from Jabari Wade! Kyrie Griffin attempts a Dunk. Contested by Jabari Wade (4.5 feet, MAN). KYRIE GRIFFIN MAKES IT!
Score: 6-2

[10:22] Team_004 possession (Score: 6-2)
FOUL! Reach-in foul on Karl Jokic during the drive. [Team fouls: 1] No free throws, side out. (Karl Jokic: 1 personal fouls)

[10:09] Team_004 possession (Score: 6-2)
Jabari Wade attempts a 3Pt. Contested by Yao Oladipo (4.1 feet, ZONE). Jabari Wade misses. Rebound secured by Bradley Thompson.

[09:55] Team_083 possession (Score: 6-2)
Karl Jokic attempts a 3Pt. Contested by Michael Curry (5.5 feet, ZONE). Karl Jokic misses. Rebound secured by Anthony Lillard.

[09:41] Team_004 possession (Score: 6-2)
Anthony Lillard drives, picks up Kyrie Griffin. Help arrives from Karl Jokic! Anthony Lillard attempts a Dunk. Contested by Karl Jokic (3.8 feet, ZONE). ANTHONY LILLARD MAKES IT! Assist: Draymond Fox
Score: 8-2

[09:24] Team_083 possession (Score: 8-2)
Malcolm Brogdon throws a bad pass! Stolen by Michael Curry! TURNOVER! (live ball)

[09:15] Team_004 possession (Score: 8-2)
Draymond Fox attempts a 3Pt. Contested by Kyrie Griffin (3.8 feet, MAN). Draymond Fox misses. Rebound secured by Bradley Thompson.

[08:57] Team_083 possession (Score: 8-2)
Kyrie Griffin drives to the basket... Kyrie Griffin commits a violation (traveling/carry)! TURNOVER! (dead ball)

[08:41] Team_004 possession (Score: 8-2)
Michael Curry attempts a Layup. Contested by Kyrie Griffin (3.5 feet, ZONE). MICHAEL CURRY MAKES IT!
Score: 10-2

[08:29] Team_083 possession (Score: 10-2)
Bradley Thompson attempts a Midrange. Contested by Anthony Lillard (4.2 feet, MAN). BRADLEY THOMPSON MAKES IT! Assist: Karl Jokic
Score: 10-4

[08:16] Team_004 possession (Score: 10-4)
Jabari Wade attempts a 3Pt. Contested by Yao Oladipo (4.1 feet, ZONE). Jabari Wade misses. Offensive rebound by Anthony Lillard! Anthony Lillard kicks it out.

[08:03] Team_004 possession (Score: 10-4)
Jabari Wade attempts a Midrange. BLOCKED BY YAO OLADIPO! Ball deflects out of bounds off Jabari Wade.

[07:51] Team_083 possession (Score: 10-4)
Kyrie Griffin drives to the basket... Kyrie Griffin loses control! Ball rolls out of bounds! TURNOVER! (dead ball)

[07:35] Team_004 possession (Score: 10-4)
Michael Curry drives, Bradley Thompson stays with him. Michael Curry attempts a Layup. Contested by Bradley Thompson (3.8 feet, ZONE). MICHAEL CURRY MAKES IT!
Score: 12-4

[07:21] Team_083 possession (Score: 12-4)
Malcolm Brogdon throws a bad pass out of bounds! TURNOVER! (dead ball)

[07:06] Team_004 possession (Score: 12-4)
Michael Curry attempts a Midrange. Contested by Malcolm Brogdon (5.0 feet, MAN). Michael Curry misses. Rebound secured by Kyrie Griffin.

[06:52] Team_083 possession (Score: 12-4)
Malcolm Brogdon throws a bad pass! Stolen by Michael Curry! TURNOVER! (live ball)

[06:37] Team_004 possession (Score: 12-4)
FOUL! Offensive foul on Dwyane Irving! Yao Oladipo drew the charge! [Team fouls: 2] (Dwyane Irving: 1 personal fouls) TURNOVER! (dead ball)

[06:21] Team_083 possession (Score: 12-4)
Karl Jokic attempts a Layup. Contested by Anthony Lillard (4.6 feet, ZONE). KARL JOKIC MAKES IT! Assist: Yao Oladipo
Score: 12-6

[06:05] Team_004 possession (Score: 12-6)
Michael Curry attempts a 3Pt. Contested by Malcolm Brogdon (5.0 feet, MAN). Michael Curry misses. Rebound secured by Bradley Thompson.

[05:55] Team_083 possession (Score: 12-6)
Kyrie Griffin attempts a Layup. Contested by Draymond Fox (4.5 feet, MAN). KYRIE GRIFFIN MAKES IT!
Score: 12-8

[05:45] Team_004 possession (Score: 12-8)
Jabari Wade attempts a Midrange. Contested by Kyrie Griffin (4.1 feet, ZONE). JABARI WADE MAKES IT!
Score: 14-8

[05:31] Team_083 possession (Score: 14-8)
Yao Oladipo attempts a Layup. Contested by Dwyane Irving (3.8 feet, MAN). YAO OLADIPO MAKES IT!
Score: 14-10

[05:14] Team_004 possession (Score: 14-10)
Anthony Lillard makes the Layup and draws the foul on Karl Jokic! And-1! Anthony Lillard to the line for 1. [Team fouls: 2] (Karl Jokic: 2 personal fouls)   FT 1/1: GOOD Anthony Lillard makes 1/1 from the line.
Score: 17-10

[04:59] Team_083 possession (Score: 17-10)
Bradley Thompson drives, Anthony Lillard stays with him. Bradley Thompson attempts a Layup. Contested by Anthony Lillard (4.3 feet, ZONE). BRADLEY THOMPSON MAKES IT! Assist: Malcolm Brogdon
Score: 17-12

[04:42] Team_004 possession (Score: 17-12)
Jabari Wade makes the Layup and draws the foul on Bradley Thompson! And-1! Jabari Wade to the line for 1. [Team fouls: 3] (Bradley Thompson: 1 personal fouls)   FT 1/1: GOOD Jabari Wade makes 1/1 from the line.
Score: 20-12

[04:28] Team_083 possession (Score: 20-12)
Malcolm Brogdon attempts a Layup. Contested by Anthony Lillard (3.9 feet, ZONE). Malcolm Brogdon misses. Rebound secured by Draymond Fox.

[04:14] Team_004 possession (Score: 20-12)
Jabari Wade attempts a 3Pt. Contested by Yao Oladipo (4.1 feet, ZONE). Jabari Wade misses. Rebound secured by Kyrie Griffin.

[04:00] Team_083 possession (Score: 20-12)
Kyrie Griffin attempts a Layup. Contested by Anthony Lillard (4.6 feet, ZONE). Kyrie Griffin misses. Rebound secured by Anthony Lillard.

[03:46] Team_004 possession (Score: 20-12)
Michael Curry attempts a 3Pt. Contested by Malcolm Brogdon (5.1 feet, MAN). Michael Curry misses. Rebound secured by Yao Oladipo.

[03:35] Team_083 possession (Score: 20-12)
Yao Oladipo attempts a Layup. Contested by Dwyane Irving (3.9 feet, MAN). YAO OLADIPO MAKES IT!
Score: 20-14

[03:18] Team_004 possession (Score: 20-14)
Draymond Fox drives and kicks out. Dwyane Irving attempts a 3Pt. Contested by Yao Oladipo (3.5 feet, MAN). Dwyane Irving misses. Rebound secured by Yao Oladipo.

[03:03] Team_083 possession (Score: 20-14)
Bradley Thompson drives, Anthony Lillard stays with him. Bradley Thompson attempts a Dunk. Contested by Anthony Lillard (4.5 feet, MAN). Bradley Thompson misses. Rebound secured by Draymond Fox.

[02:51] Team_004 possession (Score: 20-14)
Draymond Fox drives and kicks out. Draymond Fox attempts a 3Pt. Contested by Kyrie Griffin (3.7 feet, MAN). DRAYMOND FOX MAKES IT! Assist: Jabari Wade
Score: 23-14

[02:32] Team_083 possession (Score: 23-14)
FOUL! Reach-in foul on Anthony Lillard during the drive. [Team fouls: 3] No free throws, side out. (Anthony Lillard: 2 personal fouls)

[02:20] Team_083 possession (Score: 23-14)
Kyrie Griffin attempts a 3Pt. Contested by Draymond Fox (4.7 feet, MAN). Kyrie Griffin misses. Rebound secured by Draymond Fox.

[02:09] Team_004 possession (Score: 23-14)
Jabari Wade attempts a 3Pt. Contested by Yao Oladipo (4.3 feet, ZONE). Jabari Wade misses. Rebound secured by Bradley Thompson.

[01:52] Team_083 possession (Score: 23-14)
Karl Jokic attempts a Layup. Contested by Jabari Wade (5.5 feet, MAN). KARL JOKIC MAKES IT! Assist: Kyrie Griffin
Score: 23-16

[01:37] Team_004 possession (Score: 23-16)
Draymond Fox attempts a Midrange. Contested by Kyrie Griffin (4.2 feet, MAN). Draymond Fox misses. Rebound secured by Kyrie Griffin.

[01:24] Team_083 possession (Score: 23-16)
Karl Jokic attempts a 3Pt. Contested by Michael Curry (5.8 feet, ZONE). KARL JOKIC MAKES IT! Assist: Yao Oladipo
Score: 23-19

[01:07] Team_004 possession (Score: 23-19)
Jabari Wade drives, picks up Karl Jokic. Help arrives from Yao Oladipo! Jabari Wade attempts a Layup. Contested by Yao Oladipo (5.5 feet, MAN). Jabari Wade misses. Rebound secured by Kyrie Griffin.

[00:58] Team_083 possession (Score: 23-19)
Kyrie Griffin attempts a Midrange. Contested by Draymond Fox (4.9 feet, MAN). Kyrie Griffin misses. Offensive rebound by Kyrie Griffin! Kyrie Griffin kicks it out.

[00:48] Team_083 possession (Score: 23-19)
Karl Jokic attempts a Midrange. Contested by Jabari Wade (5.7 feet, MAN). KARL JOKIC MAKES IT! Assist: Malcolm Brogdon
Score: 23-21

[00:33] Team_004 possession (Score: 23-21)
Dwyane Irving drives to the basket... Dwyane Irving throws a bad pass out of bounds! TURNOVER! (dead ball)

[00:33] Substitution (Team_004): Michael Curry OUT → Karl Reaves IN (stamina_rule2)

[00:33] Substitution (Team_004): Jabari Wade OUT → Russell Barnes IN (stamina_rule2)

[00:33] Substitution (Team_004): Dwyane Irving OUT → Kristaps Green IN (stamina_rule2)

[00:33] Substitution (Team_004): Draymond Fox OUT → Michael Sabonis IN (stamina_rule2)

[00:33] Substitution (Team_004): Anthony Lillard OUT → Shai Beal IN (stamina_rule2)

[00:33] Substitution (Team_083): Malcolm Brogdon OUT → Zion Markkanen IN (stamina_rule2)

[00:33] Substitution (Team_083): Karl Jokic OUT → Damian Towns IN (stamina_rule2)

[00:33] Substitution (Team_083): Yao Oladipo OUT → Domantas Doncic IN (stamina_rule2)

[00:33] Substitution (Team_083): Kyrie Griffin OUT → Cole Simmons IN (stamina_rule2)

[00:33] Substitution (Team_083): Bradley Thompson OUT → Victor McCollum IN (stamina_rule2)

[00:19] Team_083 possession (Score: 23-21)
Damian Towns attempts a Midrange. Contested by Russell Barnes (5.1 feet, MAN). Damian Towns misses. Rebound secured by Russell Barnes.

[00:06] Team_004 possession (Score: 23-21)
Russell Barnes attempts a 3Pt. Contested by Damian Towns (5.5 feet, MAN). Russell Barnes misses. Rebound secured by Victor McCollum.

================================================================================
                              1ST QUARTER COMPLETE                              
================================================================================

1ST QUARTER SCORE: Team_004 23, Team_083 21

BOX SCORE:
================================================================================

Team_004
--------------------------------------------------------------------------------
Player                MIN  PTS  REB  AST  TO      FG   FG%      3P   3P%
--------------------------------------------------------------------------------
Jabari Wade            12    8    0    1   0   3/8    37.5     0/0   0.0
Anthony Lillard        12    8    4    0   0   3/3   100.0     0/0   0.0
Michael Curry          12    4    0    1   0   2/5    40.0     0/0   0.0
Draymond Fox           12    3    3    2   0   1/4    25.0     0/0   0.0
Russell Barnes          0    0    1    0   0   0/1     0.0     0/0   0.0

TEAM: FG: 9/21 (42.9%), 3PT: 2/9 (22.2%), REB: 8 (1 off, 7 def), AST: 4, TO: 2
TEAM FOULS: 3


Team_083
--------------------------------------------------------------------------------
Player                MIN  PTS  REB  AST  TO      FG   FG%      3P   3P%
--------------------------------------------------------------------------------
Karl Jokic             12    9    0    1   0   4/5    80.0     0/0   0.0
Kyrie Griffin          12    4    6    1   0   2/4    50.0     0/0   0.0
Bradley Thompson       12    4    4    0   0   2/4    50.0     0/0   0.0
Yao Oladipo            12    4    2    2   0   2/2   100.0     0/0   0.0
Malcolm Brogdon        12    0    0    2   0   0/1     0.0     0/0   0.0
Damian Towns            0    0    0    0   0   0/1     0.0     0/0   0.0
Victor McCollum         0    0    1    0   0   0/0     0.0     0/0   0.0

TEAM: FG: 10/17 (58.8%), 3PT: 1/4 (25.0%), REB: 13 (2 off, 11 def), AST: 6, TO: 5
TEAM FOULS: 3

================================================================================

================================================================================
                       2ND QUARTER - Team_004 vs Team_083                       
================================================================================

[12:00] Team_004 possession (Score: 23-21)
Draymond Fox attempts a 3Pt. Contested by Kyrie Griffin (4.0 feet, MAN). Draymond Fox misses. Rebound secured by Kyrie Griffin.

[11:46] Team_083 possession (Score: 23-21)
Malcolm Brogdon attempts a Layup. Contested by Anthony Lillard (4.1 feet, ZONE). MALCOLM BROGDON MAKES IT!
Score: 23-23

[11:33] Team_004 possession (Score: 23-23)
Jabari Wade attempts a 3Pt. Contested by Yao Oladipo (4.3 feet, ZONE). Jabari Wade misses. Rebound secured by Kyrie Griffin.

[11:17] Team_083 possession (Score: 23-23)
Malcolm Brogdon drives, Michael Curry stays with him. Malcolm Brogdon attempts a Layup. Contested by Michael Curry (4.9 feet, MAN). MALCOLM BROGDON MAKES IT!
Score: 23-25

[11:02] Team_004 possession (Score: 23-25)
Draymond Fox drives, Kyrie Griffin stays with him. Draymond Fox attempts a Dunk. Contested by Kyrie Griffin (4.2 feet, MAN). Draymond Fox misses. Rebound secured by Bradley Thompson.

[10:46] Team_083 possession (Score: 23-25)
Yao Oladipo attempts a Layup. Contested by Anthony Lillard (4.9 feet, ZONE). Yao Oladipo misses. Rebound secured by Dwyane Irving.

[10:30] Team_004 possession (Score: 23-25)
FOUL! Holding foul on Bradley Thompson. [Team fouls: 1] No free throws, side out. (Bradley Thompson: 1 personal fouls)

[10:16] Team_004 possession (Score: 23-25)
Michael Curry attempts a Layup. Contested by Malcolm Brogdon (5.3 feet, MAN). MICHAEL CURRY MAKES IT! Assist: Dwyane Irving
Score: 25-25

[09:57] Team_083 possession (Score: 25-25)
Kyrie Griffin attempts a 3Pt. Contested by Draymond Fox (4.9 feet, MAN). KYRIE GRIFFIN MAKES IT! Assist: Yao Oladipo
Score: 25-28

[09:41] Team_004 possession (Score: 25-28)
Draymond Fox makes the Layup and draws the foul on Kyrie Griffin! And-1! Draymond Fox to the line for 1. [Team fouls: 2] (Kyrie Griffin: 1 personal fouls)   FT 1/1: MISS Draymond Fox makes 0/1 from the line. Rebound secured by Kyrie Griffin.
Score: 27-28

[09:23] Team_083 possession (Score: 27-28)
Bradley Thompson attempts a Midrange. Contested by Jabari Wade (5.3 feet, ZONE). Bradley Thompson misses. Rebound secured by Draymond Fox.

[09:11] Team_004 possession (Score: 27-28)
Michael Curry drives and kicks out. Michael Curry attempts a Midrange. Contested by Karl Jokic (5.0 feet, ZONE). MICHAEL CURRY MAKES IT!
Score: 29-28

[08:56] Team_083 possession (Score: 29-28)
Malcolm Brogdon loses control! Ball rolls out of bounds! TURNOVER! (dead ball)

[08:56] Substitution (Team_004): Michael Curry OUT → Karl Reaves IN (stamina_rule2)

[08:56] Substitution (Team_004): Jabari Wade OUT → Russell Barnes IN (stamina_rule2)

[08:56] Substitution (Team_004): Dwyane Irving OUT → Kristaps Green IN (stamina_rule2)

[08:56] Substitution (Team_004): Draymond Fox OUT → Michael Sabonis IN (stamina_rule2)

[08:56] Substitution (Team_004): Anthony Lillard OUT → Shai Beal IN (stamina_rule2)

[08:56] Substitution (Team_083): Malcolm Brogdon OUT → Zion Markkanen IN (stamina_rule2)

[08:56] Substitution (Team_083): Karl Jokic OUT → Damian Towns IN (stamina_rule2)

[08:56] Substitution (Team_083): Yao Oladipo OUT → Domantas Doncic IN (stamina_rule2)

[08:56] Substitution (Team_083): Kyrie Griffin OUT → Cole Simmons IN (stamina_rule2)

[08:56] Substitution (Team_083): Bradley Thompson OUT → Victor McCollum IN (stamina_rule2)

[08:39] Team_004 possession (Score: 29-28)
Kristaps Green attempts a Midrange. Contested by Domantas Doncic (4.5 feet, MAN). KRISTAPS GREEN MAKES IT! Assist: Michael Sabonis
Score: 31-28

[08:23] Team_083 possession (Score: 31-28)
FOUL! Shooting foul on Russell Barnes. Domantas Doncic to the line for 2 free throws. [Team fouls: 1] (Russell Barnes: 1 personal fouls)   FT 1/2: GOOD   FT 2/2: GOOD Domantas Doncic makes 2/2 from the line.
Score: 31-30

[08:09] Team_004 possession (Score: 31-30)
Russell Barnes drives, picks up Damian Towns. Help arrives from Domantas Doncic! Russell Barnes attempts a Layup. Contested by Domantas Doncic (5.5 feet, MAN). RUSSELL BARNES MAKES IT! Assist: Kristaps Green
Score: 33-30

[07:54] Team_083 possession (Score: 33-30)
Cole Simmons attempts a 3Pt. Contested by Michael Sabonis (4.9 feet, MAN). Cole Simmons misses. Offensive rebound by Victor McCollum! Victor McCollum puts it back in!
Score: 33-32

[07:38] Team_004 possession (Score: 33-32)
Michael Sabonis attempts a Layup. BLOCKED BY COLE SIMMONS! Ball deflects out of bounds off Michael Sabonis.

[07:28] Team_083 possession (Score: 33-32)
Domantas Doncic drives to the basket... Domantas Doncic throws a bad pass out of bounds! TURNOVER! (dead ball)

[07:16] Team_004 possession (Score: 33-32)
Russell Barnes attempts a Layup. Contested by Damian Towns (5.5 feet, MAN). RUSSELL BARNES MAKES IT!
Score: 35-32

[07:00] Team_083 possession (Score: 35-32)
Cole Simmons attempts a Layup. BLOCKED BY MICHAEL SABONIS! Ball deflects out of bounds off Cole Simmons.

[06:40] Team_004 possession (Score: 35-32)
Russell Barnes drives and kicks out. Karl Reaves attempts a 3Pt. Contested by Zion Markkanen (5.4 feet, ZONE). Karl Reaves misses. Offensive rebound by Shai Beal! Shai Beal kicks it out.

[06:31] Team_004 possession (Score: 35-32)
Kristaps Green drives, picks up Domantas Doncic. Help arrives from Damian Towns! Kristaps Green attempts a Layup. Contested by Damian Towns (4.5 feet, MAN). Kristaps Green misses. Rebound secured by Victor McCollum.

[06:18] Team_083 possession (Score: 35-32)
Victor McCollum attempts a Midrange. Contested by Shai Beal (5.7 feet, ZONE). VICTOR MCCOLLUM MAKES IT!
Score: 35-34

[06:08] Team_004 possession (Score: 35-34)
Russell Barnes attempts a Midrange. Contested by Cole Simmons (5.4 feet, ZONE). Russell Barnes misses. Rebound secured by Victor McCollum.

[05:53] Team_083 possession (Score: 35-34)
Domantas Doncic attempts a 3Pt. Contested by Michael Sabonis (5.0 feet, ZONE). DOMANTAS DONCIC MAKES IT! Assist: Damian Towns
Score: 35-37

[05:37] Team_004 possession (Score: 35-37)
Russell Barnes drives, picks up Damian Towns. Help arrives from Domantas Doncic! Russell Barnes attempts a Layup. Contested by Domantas Doncic (5.5 feet, MAN). Russell Barnes misses. Rebound secured by Victor McCollum.

[05:19] Team_083 possession (Score: 35-37)
Domantas Doncic attempts a 3Pt. Contested by Kristaps Green (4.5 feet, MAN). Domantas Doncic misses. Offensive rebound by Victor McCollum! Victor McCollum's putback is no good. Rebound secured by Michael Sabonis.

[05:04] Team_004 possession (Score: 35-37)
Karl Reaves attempts a 3Pt. Contested by Zion Markkanen (4.9 feet, MAN). Karl Reaves misses. Rebound secured by Victor McCollum.

[04:52] Team_083 possession (Score: 35-37)
Victor McCollum drives, Shai Beal stays with him. Victor McCollum attempts a Dunk. Contested by Shai Beal (5.7 feet, ZONE). VICTOR MCCOLLUM MAKES IT! Assist: Damian Towns
Score: 35-39

[04:38] Team_004 possession (Score: 35-39)
FOUL! Holding foul on Zion Markkanen. [Team fouls: 3] No free throws, side out. (Zion Markkanen: 1 personal fouls)

[04:24] Team_004 possession (Score: 35-39)
Shai Beal drives and kicks out. Karl Reaves attempts a Midrange. Contested by Zion Markkanen (5.4 feet, MAN). Karl Reaves misses. Rebound secured by Damian Towns.

[04:13] Team_083 possession (Score: 35-39)
Zion Markkanen attempts a Layup. Contested by Shai Beal (5.3 feet, ZONE). Zion Markkanen misses. Rebound secured by Shai Beal.

[04:00] Team_004 possession (Score: 35-39)
Michael Sabonis attempts a 3Pt. Contested by Cole Simmons (4.8 feet, MAN). Michael Sabonis misses. Rebound secured by Damian Towns.

[03:49] Team_083 possession (Score: 35-39)
Zion Markkanen attempts a 3Pt. Contested by Karl Reaves (5.2 feet, MAN). Zion Markkanen misses. Rebound secured by Shai Beal.

[03:30] Team_004 possession (Score: 35-39)
Russell Barnes attempts a 3Pt. Contested by Domantas Doncic (5.1 feet, ZONE). RUSSELL BARNES MAKES IT! Assist: Kristaps Green
Score: 38-39

[03:13] Team_083 possession (Score: 38-39)
Cole Simmons drives and kicks out. Victor McCollum attempts a Midrange. Contested by Michael Sabonis (4.9 feet, ZONE). Victor McCollum misses. Rebound secured by Russell Barnes.

[02:58] Team_004 possession (Score: 38-39)
Michael Sabonis makes the Layup and draws the foul on Victor McCollum! And-1! Michael Sabonis to the line for 1. [Team fouls: 4] (Victor McCollum: 1 personal fouls)   FT 1/1: GOOD Michael Sabonis makes 1/1 from the line.
Score: 41-39

[02:41] Team_083 possession (Score: 41-39)
Zion Markkanen attempts a 3Pt. Contested by Michael Sabonis (5.1 feet, ZONE). Zion Markkanen misses. Rebound secured by Shai Beal.

[02:25] Team_004 possession (Score: 41-39)
Kristaps Green drives and kicks out. FOUL! Shooting foul on Cole Simmons. Michael Sabonis to the line for 2 free throws. [BONUS: 5 team fouls] (Cole Simmons: 1 personal fouls)   FT 1/2: GOOD   FT 2/2: GOOD Michael Sabonis makes 2/2 from the line.
Score: 43-39

[02:12] Team_083 possession (Score: 43-39)
Damian Towns attempts a 3Pt. Contested by Karl Reaves (5.6 feet, ZONE). Damian Towns misses. Offensive rebound by Victor McCollum! Victor McCollum's putback is no good. Rebound secured by Russell Barnes.

[02:00] Team_004 possession (Score: 43-39)
Kristaps Green attempts a 3Pt. Contested by Zion Markkanen (5.4 feet, ZONE). Kristaps Green misses. Rebound secured by Victor McCollum.

[01:48] Team_083 possession (Score: 43-39)
FOUL! Shooting foul on Russell Barnes. Victor McCollum to the line for 2 free throws. [Team fouls: 2] (Russell Barnes: 2 personal fouls)   FT 1/2: GOOD   FT 2/2: GOOD Victor McCollum makes 2/2 from the line.
Score: 43-41

[01:34] Team_004 possession (Score: 43-41)
Kristaps Green attempts a Midrange. Contested by Cole Simmons (4.9 feet, ZONE). KRISTAPS GREEN MAKES IT! Assist: Russell Barnes
Score: 45-41

[01:17] Team_083 possession (Score: 45-41)
Damian Towns attempts a 3Pt. Contested by Karl Reaves (5.7 feet, ZONE). Damian Towns misses. Rebound secured by Michael Sabonis.

[01:06] Team_004 possession (Score: 45-41)
Shai Beal attempts a 3Pt. Contested by Victor McCollum (4.2 feet, MAN). SHAI BEAL MAKES IT! Assist: Russell Barnes
Score: 48-41

[00:47] Team_083 possession (Score: 48-41)
Domantas Doncic attempts a 3Pt. Contested by Karl Reaves (5.3 feet, ZONE). Domantas Doncic misses. Rebound secured by Russell Barnes.

[00:34] Team_004 possession (Score: 48-41)
Michael Sabonis attempts a 3Pt. Contested by Cole Simmons (4.9 feet, MAN). MICHAEL SABONIS MAKES IT! Assist: Karl Reaves
Score: 51-41

[00:23] Team_083 possession (Score: 51-41)
Zion Markkanen attempts a 3Pt. Contested by Karl Reaves (5.4 feet, MAN). Zion Markkanen misses. Rebound secured by Russell Barnes.

[00:09] Team_004 possession (Score: 51-41)
Russell Barnes attempts a Layup. BLOCKED BY VICTOR MCCOLLUM! Ball deflects out of bounds off Russell Barnes.

================================================================================
                              2ND QUARTER COMPLETE                              
================================================================================

2ND QUARTER SCORE: Team_004 28, Team_083 20

BOX SCORE:
================================================================================

Team_004
--------------------------------------------------------------------------------
Player                MIN  PTS  REB  AST  TO      FG   FG%      3P   3P%
--------------------------------------------------------------------------------
Michael Sabonis         9    8    2    1   0   3/5    60.0     0/0   0.0
Russell Barnes          9    7    4    2   0   3/6    50.0     0/0   0.0
Michael Curry          15    4    0    0   0   2/2   100.0     0/0   0.0
Kristaps Green          9    4    0    2   0   2/4    50.0     0/0   0.0
Shai Beal               9    3    4    0   0   1/2    50.0     0/0   0.0
Draymond Fox           15    0    1    0   0   0/3     0.0     0/0   0.0
Jabari Wade            15    0    0    0   0   0/1     0.0     0/0   0.0
Dwyane Irving          15    0    1    1   0   0/0     0.0     0/0   0.0
Karl Reaves             9    0    0    1   0   0/1     0.0     0/0   0.0

TEAM: FG: 11/24 (45.8%), 3PT: 3/8 (37.5%), REB: 10 (1 off, 9 def), AST: 7, TO: 0
TEAM FOULS: 2


Team_083
--------------------------------------------------------------------------------
Player                MIN  PTS  REB  AST  TO      FG   FG%      3P   3P%
--------------------------------------------------------------------------------
Victor McCollum         9    8    6    0   0   4/4   100.0     0/0   0.0
Domantas Doncic         9    5    0    0   0   2/4    50.0     0/0   0.0
Malcolm Brogdon        15    4    0    0   0   2/2   100.0     0/0   0.0
Kyrie Griffin          15    3    3    0   0   1/1   100.0     0/0   0.0
Bradley Thompson       15    0    1    0   0   0/1     0.0     0/0   0.0
Yao Oladipo            15    0    0    1   0   0/1     0.0     0/0   0.0
Cole Simmons            9    0    0    0   0   0/2     0.0     0/0   0.0
Damian Towns            9    0    2    2   0   0/2     0.0     0/0   0.0
Zion Markkanen          9    0    0    0   0   0/4     0.0     0/0   0.0

TEAM: FG: 9/21 (42.9%), 3PT: 3/10 (30.0%), REB: 14 (3 off, 11 def), AST: 3, TO: 2
TEAM FOULS: 5 [Team_004 in BONUS]

================================================================================

================================================================================
                       3RD QUARTER - Team_004 vs Team_083                       
================================================================================

[12:00] Team_004 possession (Score: 51-41)
FOUL! Shooting foul on Karl Jokic. Draymond Fox to the line for 2 free throws. [Team fouls: 1] (Karl Jokic: 1 personal fouls)   FT 1/2: MISS   FT 2/2: GOOD Draymond Fox makes 1/2 from the line.
Score: 52-41

[11:46] Team_083 possession (Score: 52-41)
Bradley Thompson attempts a 3Pt. Contested by Michael Curry (5.1 feet, ZONE). Bradley Thompson misses. Rebound secured by Anthony Lillard.

[11:32] Team_004 possession (Score: 52-41)
Michael Curry attempts a Midrange. Contested by Malcolm Brogdon (5.0 feet, MAN). Michael Curry misses. Rebound secured by Bradley Thompson.

[11:14] Team_083 possession (Score: 52-41)
Bradley Thompson attempts a Midrange. Contested by Michael Curry (5.1 feet, ZONE). Bradley Thompson misses. Rebound secured by Dwyane Irving.

[11:00] Team_004 possession (Score: 52-41)
Anthony Lillard attempts a Midrange. Contested by Karl Jokic (5.0 feet, ZONE). Anthony Lillard misses. Rebound secured by Kyrie Griffin.

[10:47] Team_083 possession (Score: 52-41)
Malcolm Brogdon drives and kicks out. Karl Jokic attempts a Midrange. Contested by Jabari Wade (4.7 feet, MAN). Karl Jokic misses. Offensive rebound by Kyrie Griffin! Kyrie Griffin kicks it out.

[10:32] Team_083 possession (Score: 52-41)
Kyrie Griffin commits a violation (traveling/carry)! TURNOVER! (dead ball)

[10:15] Team_004 possession (Score: 52-41)
Draymond Fox drives to the basket... Draymond Fox throws a bad pass! Stolen by Kyrie Griffin! TURNOVER! (live ball)

[09:58] Team_083 possession (Score: 52-41)
Bradley Thompson drives, Anthony Lillard stays with him. Bradley Thompson attempts a Layup. Contested by Anthony Lillard (4.2 feet, ZONE). Bradley Thompson misses. Rebound secured by Dwyane Irving.

[09:45] Team_004 possession (Score: 52-41)
Michael Curry attempts a 3Pt. Contested by Yao Oladipo (3.5 feet, ZONE). Michael Curry misses. Offensive rebound by Draymond Fox! Draymond Fox kicks it out.

[09:29] Team_004 possession (Score: 52-41)
Michael Curry attempts a Midrange. Contested by Malcolm Brogdon (5.0 feet, MAN). MICHAEL CURRY MAKES IT!
Score: 54-41

[09:17] Team_083 possession (Score: 54-41)
Yao Oladipo makes the Layup and draws the foul on Dwyane Irving! And-1! Yao Oladipo to the line for 1. [Team fouls: 1] (Dwyane Irving: 1 personal fouls)   FT 1/1: GOOD Yao Oladipo makes 1/1 from the line.
Score: 54-44

[09:03] Team_004 possession (Score: 54-44)
Jabari Wade attempts a Midrange. Contested by Karl Jokic (5.3 feet, MAN). JABARI WADE MAKES IT! Assist: Michael Curry
Score: 56-44

[08:53] Team_083 possession (Score: 56-44)
Yao Oladipo makes the Layup and draws the foul on Anthony Lillard! And-1! Yao Oladipo to the line for 1. [Team fouls: 2] (Anthony Lillard: 1 personal fouls)   FT 1/1: GOOD Yao Oladipo makes 1/1 from the line.
Score: 56-47

[08:37] Team_004 possession (Score: 56-47)
Jabari Wade attempts a 3Pt. Contested by Yao Oladipo (4.1 feet, ZONE). Jabari Wade misses. Rebound secured by Kyrie Griffin.

[08:20] Team_083 possession (Score: 56-47)
Bradley Thompson drives and kicks out. FOUL! Shooting foul on Michael Curry. Malcolm Brogdon to the line for 2 free throws. [Team fouls: 3] (Michael Curry: 1 personal fouls)   FT 1/2: GOOD   FT 2/2: GOOD Malcolm Brogdon makes 2/2 from the line.
Score: 56-49

[08:05] Team_004 possession (Score: 56-49)
Michael Curry attempts a 3Pt. Contested by Malcolm Brogdon (5.0 feet, MAN). MICHAEL CURRY MAKES IT! Assist: Anthony Lillard
Score: 59-49

[07:53] Team_083 possession (Score: 59-49)
Kyrie Griffin makes the Layup and draws the foul on Anthony Lillard! And-1! Kyrie Griffin to the line for 1. [Team fouls: 4] (Anthony Lillard: 2 personal fouls)   FT 1/1: GOOD Kyrie Griffin makes 1/1 from the line.
Score: 59-52

[07:38] Team_004 possession (Score: 59-52)
Jabari Wade attempts a 3Pt. Contested by Karl Jokic (5.3 feet, MAN). Jabari Wade misses. Offensive rebound by Draymond Fox! Draymond Fox kicks it out.

[07:25] Team_004 possession (Score: 59-52)
Anthony Lillard attempts a 3Pt. Contested by Yao Oladipo (3.8 feet, ZONE). Anthony Lillard misses. Rebound secured by Kyrie Griffin.

[07:11] Team_083 possession (Score: 59-52)
Yao Oladipo drives, Dwyane Irving stays with him. Yao Oladipo attempts a Layup. Contested by Dwyane Irving (3.8 feet, MAN). Yao Oladipo misses. Rebound secured by Draymond Fox.

[06:55] Team_004 possession (Score: 59-52)
Michael Curry drives and kicks out. Dwyane Irving attempts a Midrange. Contested by Yao Oladipo (3.4 feet, MAN). Dwyane Irving misses. Rebound secured by Kyrie Griffin.

[06:39] Team_083 possession (Score: 59-52)
Yao Oladipo attempts a Midrange. Contested by Dwyane Irving (3.8 feet, MAN). Yao Oladipo misses. Offensive rebound by Bradley Thompson! Bradley Thompson's putback is no good. Rebound secured by Anthony Lillard.

[06:23] Team_004 possession (Score: 59-52)
Dwyane Irving attempts a 3Pt. Contested by Yao Oladipo (3.7 feet, MAN). Dwyane Irving misses. Rebound secured by Bradley Thompson.

[06:09] Team_083 possession (Score: 59-52)
Karl Jokic attempts a 3Pt. Contested by Michael Curry (5.5 feet, ZONE). KARL JOKIC MAKES IT!
Score: 59-55

[05:54] Team_004 possession (Score: 59-55)
Michael Curry attempts a 3Pt. Contested by Malcolm Brogdon (5.0 feet, MAN). Michael Curry misses. Rebound secured by Yao Oladipo.

[05:42] Team_083 possession (Score: 59-55)
Kyrie Griffin attempts a 3Pt. Contested by Jabari Wade (5.0 feet, ZONE). Kyrie Griffin misses. Rebound secured by Dwyane Irving.

[05:29] Team_004 possession (Score: 59-55)
Dwyane Irving attempts a Layup. Contested by Yao Oladipo (3.7 feet, MAN). Dwyane Irving misses. Offensive rebound by Anthony Lillard! Anthony Lillard kicks it out.

[05:18] Team_004 possession (Score: 59-55)
FOUL! Reach-in foul on Kyrie Griffin during the drive. [Team fouls: 2] No free throws, side out. (Kyrie Griffin: 1 personal fouls)

[05:01] Team_004 possession (Score: 59-55)
Draymond Fox makes the Dunk and draws the foul on Karl Jokic! And-1! Draymond Fox to the line for 1. [Team fouls: 3] (Karl Jokic: 2 personal fouls)   FT 1/1: GOOD Draymond Fox makes 1/1 from the line.
Score: 62-55

[04:45] Team_083 possession (Score: 62-55)
Kyrie Griffin attempts a 3Pt. Contested by Draymond Fox (4.5 feet, MAN). KYRIE GRIFFIN MAKES IT! Assist: Karl Jokic
Score: 62-58

[04:30] Team_004 possession (Score: 62-58)
Anthony Lillard drives and kicks out. Draymond Fox attempts a 3Pt. Contested by Kyrie Griffin (3.5 feet, MAN). Draymond Fox misses. Offensive rebound by Anthony Lillard! Anthony Lillard kicks it out.

[04:11] Team_004 possession (Score: 62-58)
Draymond Fox attempts a Layup. BLOCKED BY KYRIE GRIFFIN! Ball is loose! Rebound secured by Bradley Thompson.

[03:57] Team_083 possession (Score: 62-58)
Kyrie Griffin attempts a 3Pt. Contested by Michael Curry (5.4 feet, ZONE). KYRIE GRIFFIN MAKES IT! Assist: Malcolm Brogdon
Score: 62-61

[03:41] Team_004 possession (Score: 62-61)
Dwyane Irving attempts a 3Pt. Contested by Yao Oladipo (3.8 feet, ZONE). Dwyane Irving misses. Rebound secured by Yao Oladipo.

[03:27] Team_083 possession (Score: 62-61)
Malcolm Brogdon makes the Layup and draws the foul on Dwyane Irving! And-1! Malcolm Brogdon to the line for 1. [BONUS: 5 team fouls] (Dwyane Irving: 2 personal fouls)   FT 1/1: MISS Malcolm Brogdon makes 0/1 from the line. Rebound secured by Draymond Fox.
Score: 62-63

[03:14] Team_004 possession (Score: 62-63)
Dwyane Irving attempts a 3Pt. Contested by Yao Oladipo (3.8 feet, ZONE). Dwyane Irving misses. Offensive rebound by Anthony Lillard! Anthony Lillard kicks it out.

[02:58] Team_004 possession (Score: 62-63)
Anthony Lillard attempts a 3Pt. Contested by Malcolm Brogdon (5.4 feet, ZONE). Anthony Lillard misses. Rebound secured by Yao Oladipo.

[02:46] Team_083 possession (Score: 62-63)
Bradley Thompson throws a bad pass! Stolen by Anthony Lillard! TURNOVER! (live ball)

[02:31] Team_004 possession (Score: 62-63)
Jabari Wade attempts a Midrange. Contested by Karl Jokic (5.4 feet, MAN). JABARI WADE MAKES IT!
Score: 64-63

[02:14] Team_083 possession (Score: 64-63)
Yao Oladipo throws a bad pass! Stolen by Dwyane Irving! TURNOVER! (live ball)

[01:57] Team_004 possession (Score: 64-63)
Anthony Lillard attempts a Midrange. Contested by Bradley Thompson (4.4 feet, MAN). ANTHONY LILLARD MAKES IT! Assist: Michael Curry
Score: 66-63

[01:45] Team_083 possession (Score: 66-63)
Karl Jokic attempts a 3Pt. Contested by Michael Curry (5.8 feet, ZONE). Karl Jokic misses. Rebound secured by Anthony Lillard.

[01:32] Team_004 possession (Score: 66-63)
Jabari Wade makes the Layup and draws the foul on Kyrie Griffin! And-1! Jabari Wade to the line for 1. [Team fouls: 4] (Kyrie Griffin: 2 personal fouls)   FT 1/1: GOOD Jabari Wade makes 1/1 from the line.
Score: 69-63

[01:14] Team_083 possession (Score: 69-63)
Malcolm Brogdon drives, picks up Michael Curry. Help arrives from Dwyane Irving! Malcolm Brogdon attempts a Dunk. Contested by Dwyane Irving (5.0 feet, MAN). MALCOLM BROGDON MAKES IT! Assist: Kyrie Griffin
Score: 69-65

[00:58] Team_004 possession (Score: 69-65)
Draymond Fox attempts a Midrange. Contested by Kyrie Griffin (4.2 feet, MAN). Draymond Fox misses. Rebound secured by Yao Oladipo.

[00:45] Team_083 possession (Score: 69-65)
FOUL! Shooting foul on Dwyane Irving. Yao Oladipo to the line for 2 free throws. [BONUS: 6 team fouls] (Dwyane Irving: 3 personal fouls)   FT 1/2: GOOD   FT 2/2: GOOD Yao Oladipo makes 2/2 from the line.
Score: 69-67

[00:30] Team_004 possession (Score: 69-67)
Dwyane Irving attempts a Layup. Contested by Kyrie Griffin (4.2 feet, ZONE). DWYANE IRVING MAKES IT! Assist: Jabari Wade
Score: 71-67

[00:17] Team_083 possession (Score: 71-67)
Kyrie Griffin makes the Layup and draws the foul on Draymond Fox! And-1! Kyrie Griffin to the line for 1. [BONUS: 7 team fouls] (Draymond Fox: 1 personal fouls)   FT 1/1: GOOD Kyrie Griffin makes 1/1 from the line.
Score: 71-70

[00:04] Team_004 possession (Score: 71-70)
Draymond Fox attempts a 3Pt. Contested by Kyrie Griffin (4.3 feet, MAN). Draymond Fox misses. Rebound secured by Kyrie Griffin.

================================================================================
                              3RD QUARTER COMPLETE                              
================================================================================

3RD QUARTER SCORE: Team_004 20, Team_083 29

BOX SCORE:
================================================================================

Team_004
--------------------------------------------------------------------------------
Player                MIN  PTS  REB  AST  TO      FG   FG%      3P   3P%
--------------------------------------------------------------------------------
Jabari Wade            27    7    0    1   0   3/4    75.0     0/0   0.0
Michael Curry          27    5    0    2   0   2/5    40.0     0/0   0.0
Draymond Fox           27    4    4    0   0   2/5    40.0     0/0   0.0
Anthony Lillard        27    2    6    1   0   1/4    25.0     0/0   0.0
Dwyane Irving          27    2    3    0   0   1/3    33.3     0/0   0.0

TEAM: FG: 9/21 (42.9%), 3PT: 1/8 (12.5%), REB: 12 (5 off, 7 def), AST: 4, TO: 1
TEAM FOULS: 7 [Team_083 in BONUS]


Team_083
--------------------------------------------------------------------------------
Player                MIN  PTS  REB  AST  TO      FG   FG%      3P   3P%
--------------------------------------------------------------------------------
Kyrie Griffin          27   12    6    1   0   4/5    80.0     0/0   0.0
Yao Oladipo            27    8    4    0   0   3/5    60.0     0/0   0.0
Malcolm Brogdon        27    4    0    1   0   2/3    66.7     0/0   0.0
Karl Jokic             27    3    0    1   0   1/2    50.0     0/0   0.0
Bradley Thompson       27    0    3    0   0   0/3     0.0     0/0   0.0

TEAM: FG: 10/18 (55.6%), 3PT: 3/6 (50.0%), REB: 14 (2 off, 12 def), AST: 3, TO: 3
TEAM FOULS: 4

================================================================================

================================================================================
                       4TH QUARTER - Team_004 vs Team_083                       
================================================================================

[12:00] Substitution (Team_004): Michael Curry OUT → Karl Reaves IN (stamina_rule2)

[12:00] Substitution (Team_004): Jabari Wade OUT → Russell Barnes IN (stamina_rule2)

[12:00] Substitution (Team_004): Draymond Fox OUT → Michael Sabonis IN (stamina_rule2)

[12:00] Substitution (Team_004): Anthony Lillard OUT → Shai Beal IN (stamina_rule2)

[12:00] Substitution (Team_083): Malcolm Brogdon OUT → Zion Markkanen IN (stamina_rule2)

[12:00] Substitution (Team_083): Yao Oladipo OUT → Domantas Doncic IN (stamina_rule2)

[12:00] Substitution (Team_083): Kyrie Griffin OUT → Cole Simmons IN (stamina_rule2)

[12:00] Substitution (Team_083): Bradley Thompson OUT → Victor McCollum IN (stamina_rule2)

[12:00] Team_004 possession (Score: 71-70)
Michael Curry throws a bad pass out of bounds! TURNOVER! (dead ball)

[11:48] Team_083 possession (Score: 71-70)
Cole Simmons drives and kicks out. Karl Jokic attempts a 3Pt. Contested by Russell Barnes (4.6 feet, MAN). Karl Jokic misses. Rebound secured by Dwyane Irving.

[11:32] Team_004 possession (Score: 71-70)
Dwyane Irving attempts a Midrange. Contested by Karl Jokic (5.1 feet, ZONE). Dwyane Irving misses. Rebound secured by Karl Jokic.

[11:17] Team_083 possession (Score: 71-70)
FOUL! Holding foul on Russell Barnes. [Team fouls: 1] No free throws, side out. (Russell Barnes: 1 personal fouls)

[11:04] Team_083 possession (Score: 71-70)
Zion Markkanen attempts a 3Pt. Contested by Karl Reaves (5.2 feet, MAN). Zion Markkanen misses. Rebound secured by Shai Beal.

[10:46] Team_004 possession (Score: 71-70)
Russell Barnes attempts a 3Pt. Contested by Karl Jokic (5.5 feet, MAN). RUSSELL BARNES MAKES IT! Assist: Karl Reaves
Score: 74-70

[10:27] Team_083 possession (Score: 74-70)
Domantas Doncic attempts a Layup. Contested by Dwyane Irving (4.1 feet, MAN). DOMANTAS DONCIC MAKES IT! Assist: Cole Simmons
Score: 74-72

[10:11] Team_004 possession (Score: 74-72)
Russell Barnes attempts a Midrange. Contested by Karl Jokic (5.6 feet, MAN). RUSSELL BARNES MAKES IT! Assist: Dwyane Irving
Score: 76-72

[10:00] Team_083 possession (Score: 76-72)
FOUL! Reach-in foul on Shai Beal during the drive. [Team fouls: 2] No free throws, side out. (Shai Beal: 1 personal fouls)

[09:42] Team_083 possession (Score: 76-72)
Domantas Doncic drives, picks up Dwyane Irving. Help arrives from Russell Barnes! Domantas Doncic attempts a Layup. Contested by Russell Barnes (4.2 feet, MAN). Domantas Doncic misses. Rebound secured by Michael Sabonis.

[09:26] Team_004 possession (Score: 76-72)
FOUL! Reach-in foul on Victor McCollum during the drive. [Team fouls: 1] No free throws, side out. (Victor McCollum: 1 personal fouls)

[09:15] Team_004 possession (Score: 76-72)
Michael Sabonis attempts a Midrange. Contested by Domantas Doncic (4.5 feet, ZONE). MICHAEL SABONIS MAKES IT!
Score: 78-72

[09:02] Team_083 possession (Score: 78-72)
Cole Simmons attempts a Layup. BLOCKED BY SHAI BEAL! Ball deflects out of bounds off Cole Simmons.

[08:46] Team_004 possession (Score: 78-72)
FOUL! Shooting foul on Victor McCollum. Michael Sabonis to the line for 2 free throws. [Team fouls: 2] (Victor McCollum: 2 personal fouls)   FT 1/2: GOOD   FT 2/2: GOOD Michael Sabonis makes 2/2 from the line.
Score: 80-72

[08:30] Team_083 possession (Score: 80-72)
Karl Jokic makes the Layup and draws the foul on Russell Barnes! And-1! Karl Jokic to the line for 1. [Team fouls: 3] (Russell Barnes: 2 personal fouls)   FT 1/1: GOOD Karl Jokic makes 1/1 from the line.
Score: 80-75

[08:13] Team_004 possession (Score: 80-75)
Karl Reaves drives and kicks out. Michael Sabonis attempts a 3Pt. Contested by Zion Markkanen (5.4 feet, ZONE). Michael Sabonis misses. Rebound secured by Victor McCollum.

[08:00] Team_083 possession (Score: 80-75)
Domantas Doncic drives and kicks out. Zion Markkanen attempts a 3Pt. Contested by Karl Reaves (5.1 feet, MAN). Zion Markkanen misses. Offensive rebound by Victor McCollum! Victor McCollum's putback is no good. Rebound secured by Shai Beal.

[07:44] Team_004 possession (Score: 80-75)
FOUL! Reach-in foul on Domantas Doncic during the drive. [Team fouls: 3] No free throws, side out. (Domantas Doncic: 1 personal fouls)

[07:28] Team_004 possession (Score: 80-75)
FOUL! Shooting foul on Victor McCollum. Russell Barnes to the line for 2 free throws. [Team fouls: 4] (Victor McCollum: 3 personal fouls)   FT 1/2: MISS   FT 2/2: GOOD Russell Barnes makes 1/2 from the line.
Score: 81-75

[07:11] Team_083 possession (Score: 81-75)
Karl Jokic drives to the basket... FOUL! Offensive foul on Karl Jokic! Shai Beal drew the charge! [Team fouls: 5] (Karl Jokic: 1 personal fouls) TURNOVER! (dead ball)

[06:52] Team_004 possession (Score: 81-75)
FOUL! Reach-in foul on Victor McCollum during the drive. [IN THE BONUS! 6 team fouls] Shai Beal to the line for 2 free throws. (Victor McCollum: 4 personal fouls)   FT 1/2: GOOD   FT 2/2: GOOD Shai Beal makes 2/2 from the line.
Score: 83-75

[06:35] Team_083 possession (Score: 83-75)
Cole Simmons attempts a Layup. Contested by Michael Sabonis (4.9 feet, MAN). Cole Simmons misses. Rebound secured by Shai Beal.

[06:23] Team_004 possession (Score: 83-75)
FOUL! Reach-in foul on Victor McCollum during the drive. [IN THE BONUS! 7 team fouls] Shai Beal to the line for 2 free throws. (Victor McCollum: 5 personal fouls)   FT 1/2: GOOD   FT 2/2: GOOD Shai Beal makes 2/2 from the line.
Score: 85-75

[06:11] Team_083 possession (Score: 85-75)
Victor McCollum drives and kicks out. Karl Jokic attempts a Midrange. Contested by Russell Barnes (4.6 feet, MAN). KARL JOKIC MAKES IT!
Score: 85-77

[05:57] Team_004 possession (Score: 85-77)
FOUL! Shooting foul on Zion Markkanen. Michael Sabonis to the line for 3 free throws. [BONUS: 8 team fouls] (Zion Markkanen: 1 personal fouls)   FT 1/3: GOOD   FT 2/3: GOOD   FT 3/3: GOOD Michael Sabonis makes 3/3 from the line.
Score: 88-77

[05:41] Team_083 possession (Score: 88-77)
Karl Jokic attempts a 3Pt. Contested by Karl Reaves (5.4 feet, ZONE). KARL JOKIC MAKES IT! Assist: Zion Markkanen
Score: 88-80

[05:27] Team_004 possession (Score: 88-80)
FOUL! Shooting foul on Victor McCollum. Shai Beal to the line for 2 free throws. [BONUS: 9 team fouls] (Victor McCollum: 6 personal fouls) Victor McCollum FOULS OUT!   FT 1/2: GOOD   FT 2/2: MISS Shai Beal makes 1/2 from the line. Rebound secured by Victor McCollum.
Score: 89-80

[05:27] Substitution (Team_083): Victor McCollum OUT (stamina: 81) → Damian Towns IN (foul_out)

[05:14] Team_083 possession (Score: 89-80)
Karl Jokic attempts a 3Pt. Contested by Russell Barnes (4.9 feet, MAN). Karl Jokic misses. Rebound secured by Shai Beal.

[04:58] Team_004 possession (Score: 89-80)
Karl Reaves attempts a 3Pt. Contested by Zion Markkanen (4.9 feet, MAN). Karl Reaves misses. Rebound secured by Cole Simmons.

[04:46] Team_083 possession (Score: 89-80)
Domantas Doncic attempts a 3Pt. Contested by Dwyane Irving (4.9 feet, MAN). Domantas Doncic misses. Rebound secured by Shai Beal.

[04:34] Team_004 possession (Score: 89-80)
Dwyane Irving attempts a Midrange. Contested by Domantas Doncic (4.6 feet, MAN). DWYANE IRVING MAKES IT! Assist: Karl Reaves
Score: 91-80

[04:22] Team_083 possession (Score: 91-80)
Cole Simmons attempts a Midrange. Contested by Michael Sabonis (4.9 feet, MAN). Cole Simmons misses. Rebound secured by Shai Beal.

[04:06] Team_004 possession (Score: 91-80)
Russell Barnes makes the Layup and draws the foul on Damian Towns! And-1! Russell Barnes to the line for 1. [BONUS: 10 team fouls] (Damian Towns: 1 personal fouls)   FT 1/1: GOOD Russell Barnes makes 1/1 from the line.
Score: 94-80

[03:51] Team_083 possession (Score: 94-80)
Cole Simmons attempts a Midrange. Contested by Michael Sabonis (5.0 feet, MAN). Cole Simmons misses. Rebound secured by Michael Sabonis.

[03:32] Team_004 possession (Score: 94-80)
Karl Reaves attempts a 3Pt. Contested by Zion Markkanen (5.0 feet, ZONE). Karl Reaves misses. Rebound secured by Domantas Doncic.

[03:16] Team_083 possession (Score: 94-80)
Cole Simmons makes the 3Pt and draws the foul on Karl Reaves! And-1! Cole Simmons to the line for 1. [Team fouls: 4] (Karl Reaves: 1 personal fouls)   FT 1/1: GOOD Cole Simmons makes 1/1 from the line.
Score: 94-84

[02:58] Team_004 possession (Score: 94-84)
Michael Sabonis drives, Cole Simmons stays with him. Michael Sabonis attempts a Dunk. Contested by Cole Simmons (4.9 feet, ZONE). Michael Sabonis misses. Offensive rebound by Shai Beal! Shai Beal kicks it out.

[02:47] Team_004 possession (Score: 94-84)
Dwyane Irving attempts a 3Pt. Contested by Domantas Doncic (4.7 feet, MAN). Dwyane Irving misses. FOUL! Loose ball foul on Damian Towns during the rebound battle. [IN THE BONUS! 11 team fouls] Russell Barnes to the line for 2 free throws. (Damian Towns: 2 personal fouls)   FT 1/2: GOOD   FT 2/2: GOOD Russell Barnes makes 2/2 from the line.
Score: 96-84

[02:33] Team_083 possession (Score: 96-84)
Damian Towns attempts a Midrange. Contested by Dwyane Irving (5.7 feet, ZONE). DAMIAN TOWNS MAKES IT!
Score: 96-86

[02:15] Team_004 possession (Score: 96-86)
Michael Sabonis attempts a 3Pt. Contested by Cole Simmons (5.0 feet, MAN). Michael Sabonis misses. Rebound secured by Cole Simmons.

[02:02] Team_083 possession (Score: 96-86)
Domantas Doncic attempts a Layup. Contested by Dwyane Irving (5.4 feet, MAN). DOMANTAS DONCIC MAKES IT!
Score: 96-88

[01:47] Team_004 possession (Score: 96-88)
FOUL! Holding foul on Damian Towns. [IN THE BONUS! 12 team fouls] Russell Barnes to the line for 2 free throws. (Damian Towns: 3 personal fouls)   FT 1/2: GOOD   FT 2/2: GOOD Russell Barnes makes 2/2 from the line.
Score: 98-88

[01:29] Team_083 possession (Score: 98-88)
Domantas Doncic attempts a 3Pt. Contested by Karl Reaves (5.5 feet, ZONE). DOMANTAS DONCIC MAKES IT! Assist: Damian Towns
Score: 98-91

[01:17] Team_004 possession (Score: 98-91)
Karl Reaves attempts a 3Pt. Contested by Zion Markkanen (5.1 feet, MAN). Karl Reaves misses. Offensive rebound by Russell Barnes! Russell Barnes kicks it out.

[01:08] Team_004 possession (Score: 98-91)
Dwyane Irving attempts a 3Pt. Contested by Domantas Doncic (4.8 feet, MAN). Dwyane Irving misses. Offensive rebound by Russell Barnes! Russell Barnes kicks it out.

[00:50] Team_004 possession (Score: 98-91)
Dwyane Irving attempts a Midrange. Contested by Domantas Doncic (4.9 feet, MAN). Dwyane Irving misses. Rebound secured by Cole Simmons.

[00:35] Team_083 possession (Score: 98-91)
Cole Simmons makes the Midrange and draws the foul on Dwyane Irving! And-1! Cole Simmons to the line for 1. [BONUS: 5 team fouls] (Dwyane Irving: 1 personal fouls)   FT 1/1: GOOD Cole Simmons makes 1/1 from the line.
Score: 98-94

[00:22] Team_004 possession (Score: 98-94)
Shai Beal attempts a Midrange. Contested by Cole Simmons (5.3 feet, MAN). SHAI BEAL MAKES IT! Assist: Russell Barnes
Score: 100-94

[00:08] Team_083 possession (Score: 100-94)
Domantas Doncic attempts a Layup. Contested by Shai Beal (5.6 feet, ZONE). Domantas Doncic misses. Rebound secured by Russell Barnes.

================================================================================
                              4TH QUARTER COMPLETE                              
================================================================================

4TH QUARTER SCORE: Team_004 29, Team_083 24

BOX SCORE:
================================================================================

Team_004
--------------------------------------------------------------------------------
Player                MIN  PTS  REB  AST  TO      FG   FG%      3P   3P%
--------------------------------------------------------------------------------
Russell Barnes         21   13    3    1   0   6/6   100.0     0/0   0.0
Michael Sabonis        21    7    2    0   0   3/4    75.0     0/0   0.0
Shai Beal              21    6    7    0   0   3/4    75.0     0/0   0.0
Dwyane Irving          39    2    1    1   0   1/3    33.3     0/0   0.0
Karl Reaves            21    0    0    2   0   0/3     0.0     0/0   0.0

TEAM: FG: 13/20 (65.0%), 3PT: 3/6 (50.0%), REB: 12 (3 off, 9 def), AST: 4, TO: 1
TEAM FOULS: 5 [Team_083 in BONUS]


Team_083
--------------------------------------------------------------------------------
Player                MIN  PTS  REB  AST  TO      FG   FG%      3P   3P%
--------------------------------------------------------------------------------
Karl Jokic             39    8    1    0   0   3/4    75.0     0/0   0.0
Cole Simmons           21    7    3    1   0   2/7    28.6     0/0   0.0
Domantas Doncic        21    7    1    0   0   3/7    42.9     0/0   0.0
Damian Towns           15    2    0    1   0   1/1   100.0     0/0   0.0
Zion Markkanen         21    0    0    1   0   0/1     0.0     0/0   0.0
Victor McCollum        16    0    2    0   0   0/0     0.0     0/0   0.0

TEAM: FG: 9/20 (45.0%), 3PT: 3/6 (50.0%), REB: 8 (1 off, 7 def), AST: 3, TO: 1
TEAM FOULS: 12 [Team_004 in BONUS]

================================================================================

================================================================================
                               FULL GAME COMPLETE                               
================================================================================

FINAL SCORE: Team_004 100, Team_083 94

SCORING BY QUARTER:
--------------------------------------------------------------------------------
Team                     Q1     Q2     Q3     Q4    FINAL
--------------------------------------------------------------------------------
Team_004                 23     28     20     29      100
Team_083                 21     20     29     24       94
--------------------------------------------------------------------------------

FULL GAME BOX SCORE:
================================================================================

Team_004
--------------------------------------------------------------------------------
Player                MIN  PTS  REB  AST  TO      FG   FG%      3P   3P%      FT STL BLK
--------------------------------------------------------------------------------
Dwyane Irving          39    4    5    2   2   3/7    42.9   1/3    33.3   0/0     1   0
Michael Curry          27   13    0    3   1   6/12   50.0   1/4    25.0   0/0     2   0
Jabari Wade            27   15    0    2   0   6/13   46.2   1/6    16.7   2/2     0   0
Draymond Fox           27    7    8    2   1   3/12   25.0   0/3     0.0   2/4     0   0
Anthony Lillard        27   10   10    1   0   4/7    57.1   1/3    33.3   1/1     1   0
Karl Reaves            21    0    0    3   0   0/4     0.0   0/3     0.0   0/0     0   0
Russell Barnes         21   20    8    3   0   7/11   63.6   2/3    66.7   6/7     0   0
Michael Sabonis        21   15    4    1   0   5/8    62.5   2/4    50.0   8/8     0   1
Shai Beal              21    9   11    0   0   4/6    66.7   1/1   100.0   5/6     0   1
Kristaps Green          9    4    0    2   0   3/5    60.0   0/1     0.0   0/0     0   0

TEAM: FG: 42/86 (48.8%), 3PT: 9/31 (29.0%), REB: 42 (10 off, 32 def), AST: 19, TO: 4


Team_083
--------------------------------------------------------------------------------
Player                MIN  PTS  REB  AST  TO      FG   FG%      3P   3P%      FT STL BLK
--------------------------------------------------------------------------------
Karl Jokic             39   20    1    2   0   7/10   70.0   3/6    50.0   1/1     0   0
Malcolm Brogdon        27    8    0    3   4   3/5    60.0   0/0     0.0   2/3     0   0
Yao Oladipo            27   12    6    3   1   5/8    62.5   0/0     0.0   4/4     0   1
Kyrie Griffin          27   19   15    2   1   7/10   70.0   3/5    60.0   2/2     1   1
Bradley Thompson       27    4    8    0   3   3/9    33.3   0/2     0.0   0/0     0   0
Zion Markkanen         21    0    0    1   0   0/5     0.0   0/4     0.0   0/0     0   0
Domantas Doncic        21   12    1    0   1   5/11   45.5   2/5    40.0   2/2     0   0
Cole Simmons           21    7    3    1   1   3/10   30.0   2/2   100.0   2/2     0   1
Victor McCollum        16    8    9    0   0   4/4   100.0   0/0     0.0   2/2     0   1
Damian Towns           15    2    2    3   0   1/4    25.0   0/2     0.0   0/0     0   0

TEAM: FG: 38/76 (50.0%), 3PT: 10/26 (38.5%), REB: 49 (8 off, 41 def), AST: 15, TO: 11

================================================================================
