================================================================================
                        FULL GAME - Team_061 vs Team_006                        
================================================================================

================================================================================
                       1ST QUARTER - Team_061 vs Team_006                       
================================================================================

[12:00] Team_061 possession (Score: 0-0)
Michael Russell drives to the basket... Michael Russell throws a bad pass out of bounds! TURNOVER! (dead ball)

[11:43] Team_006 possession (Score: 0-0)
Bradley Gobert drives and kicks out. Shai Westbrook attempts a 3Pt. Contested by Brandon Russell (3.9 feet, MAN). Shai Westbrook misses. Offensive rebound by Bradley Gobert! Bradley Gobert kicks it out.

[11:32] Team_006 possession (Score: 0-0)
Bradley Gobert drives and kicks out. Shai Westbrook attempts a 3Pt. Contested by Brandon Russell (3.9 feet, MAN). Shai Westbrook misses. Rebound secured by Bam Sexton.

[11:19] Team_061 possession (Score: 0-0)
FOUL! Shooting foul on Franz Wagner. Bam Sexton to the line for 2 free throws. [Team fouls: 1] (Franz Wagner: 1 personal fouls)   FT 1/2: GOOD   FT 2/2: GOOD Bam Sexton makes 2/2 from the line.
Score: 2-0

[11:05] Team_006 possession (Score: 2-0)
Bradley Gobert attempts a Midrange. Contested by Draymond Banchero (2.5 feet, MAN). Bradley Gobert misses. Rebound secured by Draymond Banchero.

[10:51] Team_061 possession (Score: 2-0)
Jayson Holiday attempts a 3Pt. Contested by Shai Westbrook (4.2 feet, ZONE). Jayson Holiday misses. Offensive rebound by Draymond Banchero! Draymond Banchero puts it back in!
Score: 4-0

[10:39] Team_006 possession (Score: 4-0)
Bradley Gobert attempts a 3Pt. Contested by Brandon Russell (3.8 feet, ZONE). Bradley Gobert misses. Rebound secured by Draymond Banchero.

[10:25] Team_061 possession (Score: 4-0)
FOUL! Shooting foul on Bradley Gobert. Draymond Banchero to the line for 2 free throws. [Team fouls: 2] (Bradley Gobert: 1 personal fouls)   FT 1/2: GOOD   FT 2/2: MISS Draymond Banchero makes 1/2 from the line. Rebound secured by Bradley Gobert.
Score: 5-0

[10:08] Team_006 possession (Score: 5-0)
FOUL! Offensive foul on Shai Westbrook! Brandon Russell drew the charge! [Team fouls: 3] (Shai Westbrook: 1 personal fouls) TURNOVER! (dead ball)

[09:53] Team_061 possession (Score: 5-0)
Jayson Holiday attempts a Midrange. Contested by Shai Westbrook (4.2 feet, ZONE). JAYSON HOLIDAY MAKES IT! Assist: Bam Sexton
Score: 7-0

[09:43] Team_006 possession (Score: 7-0)
Shai Westbrook attempts a 3Pt. Contested by Brandon Russell (3.9 feet, MAN). Shai Westbrook misses. Rebound secured by Michael Russell.

[09:28] Team_061 possession (Score: 7-0)
Draymond Banchero drives and kicks out. Michael Russell attempts a 3Pt. Contested by Jayson Young (4.6 feet, MAN). Michael Russell misses. Rebound secured by Shai Westbrook.

[09:12] Team_006 possession (Score: 7-0)
FOUL! Reach-in foul on Draymond Banchero during the drive. [Team fouls: 1] No free throws, side out. (Draymond Banchero: 1 personal fouls)

[08:58] Team_006 possession (Score: 7-0)
FOUL! Reach-in foul on Bam Sexton during the drive. [Team fouls: 2] No free throws, side out. (Bam Sexton: 1 personal fouls)

[08:48] Team_006 possession (Score: 7-0)
Ja Butler attempts a Layup. Contested by Draymond Banchero (2.7 feet, ZONE). Ja Butler misses. Rebound secured by Draymond Banchero.

[08:34] Team_061 possession (Score: 7-0)
Michael Russell throws a bad pass out of bounds! TURNOVER! (dead ball)

[08:17] Team_006 possession (Score: 7-0)
Franz Wagner attempts a 3Pt. Contested by Brandon Russell (4.0 feet, ZONE). Franz Wagner misses. Rebound secured by Michael Russell.

[08:04] Team_061 possession (Score: 7-0)
Jayson Holiday drives, picks up Franz Wagner. Help arrives from Shai Westbrook! Jayson Holiday attempts a Layup. Contested by Shai Westbrook (5.2 feet, MAN). Jayson Holiday misses. Offensive rebound by Draymond Banchero! Draymond Banchero puts it back in!
Score: 9-0

[07:53] Team_006 possession (Score: 9-0)
Ja Butler attempts a Midrange. Contested by Bam Sexton (5.0 feet, MAN). Ja Butler misses. Offensive rebound by Bradley Gobert! Bradley Gobert kicks it out.

[07:35] Team_006 possession (Score: 9-0)
Franz Wagner attempts a Midrange. Contested by Jayson Holiday (4.1 feet, ZONE). Franz Wagner misses. Rebound secured by Michael Russell.

[07:21] Team_061 possession (Score: 9-0)
Bam Sexton attempts a Midrange. Contested by Shai Westbrook (4.3 feet, ZONE). Bam Sexton misses. FOUL! Loose ball foul on Shai Westbrook during the rebound battle. [Team fouls: 4] No free throws, side out. (Shai Westbrook: 2 personal fouls)

[07:03] Team_061 possession (Score: 9-0)
Brandon Russell attempts a 3Pt. Contested by Shai Westbrook (4.0 feet, ZONE). BRANDON RUSSELL MAKES IT!
Score: 12-0

[06:48] Team_006 possession (Score: 12-0)
Shai Westbrook attempts a Midrange. Contested by Michael Russell (3.7 feet, ZONE). SHAI WESTBROOK MAKES IT! Assist: Ja Butler
Score: 12-2

[06:32] Team_061 possession (Score: 12-2)
Michael Russell attempts a Midrange. Contested by Jayson Young (4.9 feet, MAN). Michael Russell misses. Rebound secured by Bradley Gobert.

[06:17] Team_006 possession (Score: 12-2)
FOUL! Shooting foul on Bam Sexton. Ja Butler to the line for 2 free throws. [Team fouls: 3] (Bam Sexton: 2 personal fouls)   FT 1/2: GOOD   FT 2/2: MISS Ja Butler makes 1/2 from the line. Offensive rebound by Ja Butler! Ja Butler puts it back in!
Score: 12-5

[06:05] Team_061 possession (Score: 12-5)
Draymond Banchero drives to the basket... Draymond Banchero loses the ball! Stripped by Bradley Gobert! TURNOVER! (live ball)

[05:50] Team_006 possession (Score: 12-5)
Ja Butler drives and kicks out. Bradley Gobert attempts a 3Pt. Contested by Brandon Russell (3.9 feet, ZONE). Bradley Gobert misses. Rebound secured by Bam Sexton.

[05:39] Team_061 possession (Score: 12-5)
Bam Sexton attempts a 3Pt. Contested by Shai Westbrook (4.3 feet, ZONE). Bam Sexton misses. Rebound secured by Bradley Gobert.

[05:29] Team_006 possession (Score: 12-5)
Shai Westbrook attempts a Midrange. Contested by Brandon Russell (3.9 feet, MAN). Shai Westbrook misses. Rebound secured by Draymond Banchero.

[05:19] Team_061 possession (Score: 12-5)
Jayson Holiday attempts a Midrange. Contested by Franz Wagner (5.3 feet, MAN). Jayson Holiday misses. Rebound secured by Bradley Gobert.

[05:06] Team_006 possession (Score: 12-5)
Shai Westbrook attempts a 3Pt. Contested by Brandon Russell (3.9 feet, ZONE). Shai Westbrook misses. Rebound secured by Bam Sexton.

[04:51] Team_061 possession (Score: 12-5)
Draymond Banchero drives, picks up Bradley Gobert. Help arrives from Shai Westbrook! Draymond Banchero attempts a Dunk. Contested by Shai Westbrook (3.6 feet, MAN). Draymond Banchero misses. Rebound secured by Ja Butler.

[04:37] Team_006 possession (Score: 12-5)
Ja Butler drives and kicks out. Shai Westbrook makes the Midrange and draws the foul on Draymond Banchero! And-1! Shai Westbrook to the line for 1. [Team fouls: 4] (Draymond Banchero: 2 personal fouls)   FT 1/1: GOOD Shai Westbrook makes 1/1 from the line.
Score: 12-8

[04:23] Team_061 possession (Score: 12-8)
Michael Russell attempts a 3Pt. Contested by Jayson Young (4.9 feet, MAN). Michael Russell misses. Rebound secured by Ja Butler.

[04:09] Team_006 possession (Score: 12-8)
Shai Westbrook attempts a 3Pt. Contested by Brandon Russell (3.9 feet, ZONE). Shai Westbrook misses. Rebound secured by Draymond Banchero.

[03:51] Team_061 possession (Score: 12-8)
Draymond Banchero attempts a Layup. Contested by Bradley Gobert (3.7 feet, ZONE). DRAYMOND BANCHERO MAKES IT! Assist: Bam Sexton
Score: 14-8

[03:35] Team_006 possession (Score: 14-8)
Franz Wagner attempts a 3Pt. Contested by Brandon Russell (4.1 feet, ZONE). FRANZ WAGNER MAKES IT!
Score: 14-11

[03:20] Team_061 possession (Score: 14-11)
Bam Sexton attempts a 3Pt. Contested by Ja Butler (3.6 feet, MAN). Bam Sexton misses. Rebound secured by Shai Westbrook.

[03:07] Team_006 possession (Score: 14-11)
Franz Wagner loses control! Ball rolls out of bounds! TURNOVER! (dead ball)

[03:07] Substitution (Team_061): Michael Russell OUT → Desmond Morant IN (stamina_rule2)

[03:07] Substitution (Team_006): Franz Wagner OUT → Lamelo Westbrook IN (stamina_rule2)

[03:07] Substitution (Team_006): Ja Butler OUT → Cade Ball IN (stamina_rule2)

[03:07] Substitution (Team_006): Bradley Gobert OUT → Shaquille Sexton IN (stamina_rule2)

[02:53] Team_061 possession (Score: 14-11)
Jayson Holiday attempts a 3Pt. Contested by Lamelo Westbrook (3.9 feet, ZONE). Jayson Holiday misses. Rebound secured by Shaquille Sexton.

[02:38] Team_006 possession (Score: 14-11)
Jayson Young attempts a Layup. Contested by Desmond Morant (4.8 feet, MAN). JAYSON YOUNG MAKES IT!
Score: 14-13

[02:23] Team_061 possession (Score: 14-13)
Desmond Morant drives, Cade Ball stays with him. Desmond Morant attempts a Layup. Contested by Cade Ball (4.5 feet, ZONE). Desmond Morant misses. Rebound secured by Shai Westbrook.

[02:06] Team_006 possession (Score: 14-13)
Shaquille Sexton attempts a Layup. Contested by Draymond Banchero (2.9 feet, ZONE). Shaquille Sexton misses. Rebound secured by Bam Sexton.

[01:51] Team_061 possession (Score: 14-13)
Brandon Russell attempts a 3Pt. Contested by Shai Westbrook (4.3 feet, ZONE). Brandon Russell misses. Rebound secured by Cade Ball.

[01:37] Team_006 possession (Score: 14-13)
Cade Ball commits a violation (traveling/carry)! TURNOVER! (dead ball)

[01:37] Substitution (Team_061): Brandon Russell OUT → Evan Rose IN (stamina_rule2)

[01:37] Substitution (Team_061): Jayson Holiday OUT → Gary Fox IN (stamina_rule2)

[01:37] Substitution (Team_061): Bam Sexton OUT → Stephen Towns IN (stamina_rule2)

[01:37] Substitution (Team_061): Draymond Banchero OUT → Tim Durant IN (stamina_rule2)

[01:37] Substitution (Team_006): Shai Westbrook OUT → Miles Harris IN (stamina_rule2)

[01:37] Substitution (Team_006): Jayson Young OUT → Vince Sabonis IN (stamina_rule2)

[01:25] Team_061 possession (Score: 14-13)
Desmond Morant drives, picks up Vince Sabonis. Help arrives from Lamelo Westbrook! Desmond Morant attempts a Layup. Contested by Lamelo Westbrook (5.1 feet, MAN). DESMOND MORANT MAKES IT! Assist: Evan Rose
Score: 16-13

[01:11] Team_006 possession (Score: 16-13)
Vince Sabonis attempts a Midrange. Contested by Desmond Morant (4.4 feet, ZONE). Vince Sabonis misses. Rebound secured by Tim Durant.

[00:55] Team_061 possession (Score: 16-13)
Tim Durant attempts a 3Pt. Contested by Lamelo Westbrook (4.2 feet, ZONE). Tim Durant misses. FOUL! Loose ball foul on Vince Sabonis during the rebound battle. [IN THE BONUS! 5 team fouls] Stephen Towns to the line for 2 free throws. (Vince Sabonis: 1 personal fouls)   FT 1/2: GOOD   FT 2/2: MISS Stephen Towns makes 1/2 from the line. Rebound secured by Cade Ball.
Score: 17-13

[00:46] Team_006 possession (Score: 17-13)
Vince Sabonis attempts a Midrange. Contested by Desmond Morant (4.4 feet, MAN). Vince Sabonis misses. Rebound secured by Desmond Morant.

[00:28] Team_061 possession (Score: 17-13)
Evan Rose attempts a 3Pt. Contested by Miles Harris (5.5 feet, MAN). Evan Rose misses. Offensive rebound by Tim Durant! Tim Durant's putback is no good. Rebound secured by Vince Sabonis.

[00:16] Team_006 possession (Score: 17-13)
Shaquille Sexton attempts a Midrange. Contested by Tim Durant (4.1 feet, MAN). Shaquille Sexton misses. Rebound secured by Stephen Towns.

[00:01] Team_061 possession (Score: 17-13)
Gary Fox attempts a Layup. BLOCKED BY LAMELO WESTBROOK! Ball deflects out of bounds off Gary Fox.

================================================================================
                              1ST QUARTER COMPLETE                              
================================================================================

1ST QUARTER SCORE: Team_061 17, Team_006 13

BOX SCORE:
================================================================================

Team_061
--------------------------------------------------------------------------------
Player                MIN  PTS  REB  AST  TO      FG   FG%      3P   3P%
--------------------------------------------------------------------------------
Draymond Banchero      11    6    8    0   0   3/6    50.0     0/0   0.0
Brandon Russell        11    3    0    0   0   1/2    50.0     0/0   0.0
Bam Sexton             11    2    4    2   0   1/3    33.3     0/0   0.0
Jayson Holiday         11    2    0    0   0   1/3    33.3     0/0   0.0
Desmond Morant          3    2    1    0   0   1/2    50.0     0/0   0.0
Michael Russell         9    0    3    0   0   0/2     0.0     0/0   0.0
Cade Ball               3    0    2    0   0   0/0     0.0     0/0   0.0
Evan Rose               2    0    0    1   0   0/1     0.0     0/0   0.0
Vince Sabonis           2    0    1    0   0   0/2     0.0     0/0   0.0
Tim Durant              2    0    1    0   0   0/1     0.0     0/0   0.0
Stephen Towns           2    0    1    0   0   0/0     0.0     0/0   0.0
Gary Fox                2    0    0    0   0   0/1     0.0     0/0   0.0

TEAM: FG: 7/21 (33.3%), 3PT: 2/9 (22.2%), REB: 20 (5 off, 15 def), AST: 3, TO: 3
TEAM FOULS: 4


Team_006
--------------------------------------------------------------------------------
Player                MIN  PTS  REB  AST  TO      FG   FG%      3P   3P%
--------------------------------------------------------------------------------
Shai Westbrook         11    5    3    0   0   2/6    33.3     0/0   0.0
Ja Butler               9    3    2    1   0   1/3    33.3     0/0   0.0
Franz Wagner            9    3    0    0   0   1/3    33.3     0/0   0.0
Jayson Young           11    2    0    0   0   1/1   100.0     0/0   0.0
Bradley Gobert          9    0    6    0   0   0/3     0.0     0/0   0.0
Shaquille Sexton        3    0    1    0   0   0/2     0.0     0/0   0.0

TEAM: FG: 5/20 (25.0%), 3PT: 1/6 (16.7%), REB: 13 (2 off, 11 def), AST: 1, TO: 3
TEAM FOULS: 5 [Team_061 in BONUS]

================================================================================

================================================================================
                       2ND QUARTER - Team_061 vs Team_006                       
================================================================================

[12:00] Team_061 possession (Score: 17-13)
Bam Sexton attempts a Layup. Contested by Bradley Gobert (3.3 feet, ZONE). BAM SEXTON MAKES IT! Assist: Draymond Banchero
Score: 19-13

[11:47] Team_006 possession (Score: 19-13)
Shai Westbrook attempts a 3Pt. Contested by Brandon Russell (3.9 feet, MAN). Shai Westbrook misses. Rebound secured by Bam Sexton.

[11:31] Team_061 possession (Score: 19-13)
Bam Sexton attempts a Midrange. Contested by Ja Butler (3.3 feet, ZONE). Bam Sexton misses. Rebound secured by Bradley Gobert.

[11:21] Team_006 possession (Score: 19-13)
FOUL! Shooting foul on Michael Russell. Shai Westbrook to the line for 2 free throws. [Team fouls: 1] (Michael Russell: 1 personal fouls)   FT 1/2: GOOD   FT 2/2: GOOD Shai Westbrook makes 2/2 from the line.
Score: 19-15

[11:06] Team_061 possession (Score: 19-15)
Draymond Banchero attempts a 3Pt. Contested by Shai Westbrook (4.6 feet, ZONE). DRAYMOND BANCHERO MAKES IT!
Score: 22-15

[10:54] Team_006 possession (Score: 22-15)
Bradley Gobert attempts a Midrange. Contested by Draymond Banchero (2.6 feet, MAN). Bradley Gobert misses. FOUL! Loose ball foul on Michael Russell during the rebound battle. [Team fouls: 2] No free throws, side out. (Michael Russell: 2 personal fouls)

[10:42] Team_006 possession (Score: 22-15)
FOUL! Shooting foul on Jayson Holiday. Franz Wagner to the line for 3 free throws. [Team fouls: 3] (Jayson Holiday: 1 personal fouls)   FT 1/3: MISS   FT 2/3: GOOD   FT 3/3: GOOD Franz Wagner makes 2/3 from the line.
Score: 22-17

[10:25] Team_061 possession (Score: 22-17)
Michael Russell attempts a 3Pt. Contested by Shai Westbrook (4.3 feet, ZONE). Michael Russell misses. Rebound secured by Shai Westbrook.

[10:12] Team_006 possession (Score: 22-17)
Jayson Young attempts a Midrange. Contested by Michael Russell (4.2 feet, MAN). Jayson Young misses. Offensive rebound by Ja Butler! Ja Butler puts it back in!
Score: 22-19

[09:56] Team_061 possession (Score: 22-19)
Michael Russell attempts a 3Pt. Contested by Shai Westbrook (4.4 feet, ZONE). Michael Russell misses. Rebound secured by Shai Westbrook.

[09:41] Team_006 possession (Score: 22-19)
Bradley Gobert drives to the basket... FOUL! Offensive foul on Bradley Gobert! Draymond Banchero drew the charge! [Team fouls: 1] (Bradley Gobert: 1 personal fouls) TURNOVER! (dead ball)

[09:29] Team_061 possession (Score: 22-19)
Draymond Banchero attempts a 3Pt. Contested by Bradley Gobert (3.7 feet, MAN). Draymond Banchero misses. Rebound secured by Bradley Gobert.

[09:14] Team_006 possession (Score: 22-19)
Franz Wagner attempts a 3Pt. Contested by Brandon Russell (4.3 feet, ZONE). Franz Wagner misses. Rebound secured by Draymond Banchero.

[09:01] Team_061 possession (Score: 22-19)
Bam Sexton drives to the basket... Bam Sexton loses the ball! Stripped by Bradley Gobert! TURNOVER! (live ball)

[08:46] Team_006 possession (Score: 22-19)
Jayson Young attempts a 3Pt. Contested by Michael Russell (4.3 feet, MAN). JAYSON YOUNG MAKES IT! Assist: Ja Butler
Score: 22-22

[08:36] Team_061 possession (Score: 22-22)
Brandon Russell attempts a Midrange. Contested by Bradley Gobert (3.4 feet, ZONE). BRANDON RUSSELL MAKES IT!
Score: 24-22

[08:24] Team_006 possession (Score: 24-22)
Shai Westbrook attempts a Layup. Contested by Draymond Banchero (3.0 feet, ZONE). Shai Westbrook misses. Rebound secured by Draymond Banchero.

[08:05] Team_061 possession (Score: 24-22)
Jayson Holiday attempts a Midrange. Contested by Franz Wagner (5.5 feet, MAN). JAYSON HOLIDAY MAKES IT!
Score: 26-22

[07:51] Team_006 possession (Score: 26-22)
Jayson Young attempts a 3Pt. Contested by Michael Russell (4.4 feet, MAN). Jayson Young misses. FOUL! Loose ball foul on Draymond Banchero during the rebound battle. [Team fouls: 4] No free throws, side out. (Draymond Banchero: 1 personal fouls)

[07:37] Team_006 possession (Score: 26-22)
Ja Butler drives and kicks out. Ja Butler attempts a Midrange. Contested by Bam Sexton (5.3 feet, ZONE). Ja Butler misses. Offensive rebound by Ja Butler! Ja Butler puts it back in!
Score: 26-24

[07:22] Team_061 possession (Score: 26-24)
Draymond Banchero drives to the basket... Draymond Banchero throws a bad pass! Stolen by Bradley Gobert! TURNOVER! (live ball)

[07:12] Team_006 possession (Score: 26-24)
Bradley Gobert attempts a 3Pt. Contested by Jayson Holiday (4.6 feet, ZONE). Bradley Gobert misses. Rebound secured by Draymond Banchero.

[06:58] Team_061 possession (Score: 26-24)
FOUL! Shooting foul on Jayson Young. Michael Russell to the line for 2 free throws. [Team fouls: 2] (Jayson Young: 1 personal fouls)   FT 1/2: GOOD   FT 2/2: GOOD Michael Russell makes 2/2 from the line.
Score: 28-24

[06:48] Team_006 possession (Score: 28-24)
Shai Westbrook loses control! Ball rolls out of bounds! TURNOVER! (dead ball)

[06:48] Substitution (Team_061): Brandon Russell OUT → Evan Rose IN (stamina_rule2)

[06:48] Substitution (Team_061): Jayson Holiday OUT → Gary Fox IN (stamina_rule2)

[06:48] Substitution (Team_061): Michael Russell OUT → Desmond Morant IN (stamina_rule2)

[06:48] Substitution (Team_061): Bam Sexton OUT → Stephen Towns IN (stamina_rule2)

[06:48] Substitution (Team_061): Draymond Banchero OUT → Tim Durant IN (stamina_rule2)

[06:48] Substitution (Team_006): Shai Westbrook OUT → Miles Harris IN (stamina_rule2)

[06:48] Substitution (Team_006): Franz Wagner OUT → Lamelo Westbrook IN (stamina_rule2)

[06:48] Substitution (Team_006): Jayson Young OUT → Vince Sabonis IN (stamina_rule2)

[06:48] Substitution (Team_006): Ja Butler OUT → Cade Ball IN (stamina_rule2)

[06:48] Substitution (Team_006): Bradley Gobert OUT → Shaquille Sexton IN (stamina_rule2)

[06:36] Team_061 possession (Score: 28-24)
Tim Durant attempts a 3Pt. Contested by Shaquille Sexton (5.9 feet, MAN). Tim Durant misses. Offensive rebound by Tim Durant! Tim Durant puts it back in!
Score: 30-24

[06:18] Team_006 possession (Score: 30-24)
Miles Harris attempts a Layup. Contested by Evan Rose (5.0 feet, MAN). MILES HARRIS MAKES IT! Assist: Cade Ball
Score: 30-26

[06:02] Team_061 possession (Score: 30-26)
Evan Rose attempts a 3Pt. Contested by Lamelo Westbrook (3.8 feet, ZONE). Evan Rose misses. Rebound secured by Vince Sabonis.

[05:47] Team_006 possession (Score: 30-26)
Vince Sabonis attempts a Layup. Contested by Desmond Morant (4.4 feet, MAN). VINCE SABONIS MAKES IT! Assist: Shaquille Sexton
Score: 30-28

[05:36] Team_061 possession (Score: 30-28)
Desmond Morant attempts a Midrange. Contested by Vince Sabonis (5.1 feet, MAN). DESMOND MORANT MAKES IT!
Score: 32-28

[05:21] Team_006 possession (Score: 32-28)
Cade Ball drives and kicks out. Cade Ball attempts a 3Pt. Contested by Desmond Morant (4.5 feet, ZONE). Cade Ball misses. Rebound secured by Desmond Morant.

[05:05] Team_061 possession (Score: 32-28)
Evan Rose drives to the basket... Evan Rose throws a bad pass out of bounds! TURNOVER! (dead ball)

[04:48] Team_006 possession (Score: 32-28)
FOUL! Holding foul on Gary Fox. [IN THE BONUS! 5 team fouls] Lamelo Westbrook to the line for 2 free throws. (Gary Fox: 1 personal fouls)   FT 1/2: GOOD   FT 2/2: GOOD Lamelo Westbrook makes 2/2 from the line.
Score: 32-30

[04:34] Team_061 possession (Score: 32-30)
Desmond Morant makes the Layup and draws the foul on Lamelo Westbrook! And-1! Desmond Morant to the line for 1. [Team fouls: 3] (Lamelo Westbrook: 1 personal fouls)   FT 1/1: GOOD Desmond Morant makes 1/1 from the line.
Score: 35-30

[04:22] Team_006 possession (Score: 35-30)
FOUL! Offensive foul on Miles Harris! Evan Rose drew the charge! [Team fouls: 4] (Miles Harris: 1 personal fouls) TURNOVER! (dead ball)

[04:09] Team_061 possession (Score: 35-30)
FOUL! Shooting foul on Shaquille Sexton. Tim Durant to the line for 2 free throws. [BONUS: 5 team fouls] (Shaquille Sexton: 1 personal fouls)   FT 1/2: GOOD   FT 2/2: GOOD Tim Durant makes 2/2 from the line.
Score: 37-30

[03:56] Team_006 possession (Score: 37-30)
Lamelo Westbrook attempts a 3Pt. Contested by Desmond Morant (4.6 feet, ZONE). Lamelo Westbrook misses. Rebound secured by Tim Durant.

[03:43] Team_061 possession (Score: 37-30)
Tim Durant drives, Cade Ball stays with him. Tim Durant attempts a Dunk. Contested by Cade Ball (4.8 feet, ZONE). TIM DURANT MAKES IT!
Score: 39-30

[03:30] Team_006 possession (Score: 39-30)
Cade Ball drives and kicks out. Vince Sabonis attempts a Midrange. Contested by Desmond Morant (4.5 feet, MAN). Vince Sabonis misses. Offensive rebound by Shaquille Sexton! Shaquille Sexton kicks it out.

[03:17] Team_006 possession (Score: 39-30)
Lamelo Westbrook attempts a Midrange. Wide open! Gary Fox is 6.0 feet away. [MAN] LAMELO WESTBROOK MAKES IT!
Score: 39-32

[03:07] Team_061 possession (Score: 39-32)
Desmond Morant drives and kicks out. Stephen Towns attempts a 3Pt. Contested by Lamelo Westbrook (3.6 feet, ZONE). Stephen Towns misses. Offensive rebound by Tim Durant! Tim Durant puts it back in!
Score: 41-32

[02:49] Team_006 possession (Score: 41-32)
FOUL! Shooting foul on Desmond Morant. Cade Ball to the line for 2 free throws. [BONUS: 6 team fouls] (Desmond Morant: 1 personal fouls)   FT 1/2: GOOD   FT 2/2: MISS Cade Ball makes 1/2 from the line. Offensive rebound by Shaquille Sexton! Shaquille Sexton kicks it out.
Score: 41-33

[02:34] Team_006 possession (Score: 41-33)
FOUL! Shooting foul on Desmond Morant. Miles Harris to the line for 3 free throws. [BONUS: 7 team fouls] (Desmond Morant: 2 personal fouls)   FT 1/3: GOOD   FT 2/3: GOOD   FT 3/3: GOOD Miles Harris makes 3/3 from the line.
Score: 41-36

[02:21] Team_061 possession (Score: 41-36)
Stephen Towns attempts a Layup. BLOCKED BY LAMELO WESTBROOK! Ball deflects out of bounds off Stephen Towns.

[02:04] Team_006 possession (Score: 41-36)
Lamelo Westbrook attempts a Layup. Contested by Tim Durant (4.2 feet, ZONE). LAMELO WESTBROOK MAKES IT! Assist: Shaquille Sexton
Score: 41-38

[01:53] Team_061 possession (Score: 41-38)
Stephen Towns attempts a Midrange. Contested by Cade Ball (4.6 feet, MAN). Stephen Towns misses. Rebound secured by Vince Sabonis.

[01:37] Team_006 possession (Score: 41-38)
Lamelo Westbrook attempts a 3Pt. Wide open! Gary Fox is 6.0 feet away. [MAN] LAMELO WESTBROOK MAKES IT! Assist: Vince Sabonis
Score: 41-41

[01:21] Team_061 possession (Score: 41-41)
FOUL! Shooting foul on Cade Ball. Desmond Morant to the line for 3 free throws. [BONUS: 6 team fouls] (Cade Ball: 1 personal fouls)   FT 1/3: GOOD   FT 2/3: GOOD   FT 3/3: GOOD Desmond Morant makes 3/3 from the line.
Score: 44-41

[01:06] Team_006 possession (Score: 44-41)
FOUL! Shooting foul on Evan Rose. Miles Harris to the line for 2 free throws. [BONUS: 8 team fouls] (Evan Rose: 1 personal fouls)   FT 1/2: GOOD   FT 2/2: GOOD Miles Harris makes 2/2 from the line.
Score: 44-43

[00:52] Team_061 possession (Score: 44-43)
Gary Fox makes the 3Pt and draws the foul on Vince Sabonis! And-1! Gary Fox to the line for 1. [BONUS: 7 team fouls] (Vince Sabonis: 1 personal fouls)   FT 1/1: GOOD Gary Fox makes 1/1 from the line.
Score: 48-43

[00:37] Team_006 possession (Score: 48-43)
Lamelo Westbrook attempts a 3Pt. Wide open! Gary Fox is 6.0 feet away. [MAN] Lamelo Westbrook misses. Offensive rebound by Shaquille Sexton! Shaquille Sexton kicks it out.

[00:24] Team_006 possession (Score: 48-43)
Vince Sabonis throws a bad pass! Stolen by Desmond Morant! TURNOVER! (live ball)

[00:11] Team_061 possession (Score: 48-43)
Desmond Morant loses control! Ball rolls out of bounds! TURNOVER! (dead ball)

================================================================================
                              2ND QUARTER COMPLETE                              
================================================================================

2ND QUARTER SCORE: Team_061 31, Team_006 30

BOX SCORE:
================================================================================

Team_061
--------------------------------------------------------------------------------
Player                MIN  PTS  REB  AST  TO      FG   FG%      3P   3P%
--------------------------------------------------------------------------------
Tim Durant              8    8    3    0   0   4/4   100.0     0/0   0.0
Desmond Morant         10    8    1    0   0   3/3   100.0     0/0   0.0
Gary Fox                8    4    0    0   0   1/1   100.0     0/0   0.0
Draymond Banchero      16    3    3    1   0   1/2    50.0     0/0   0.0
Bam Sexton             16    2    1    0   0   1/2    50.0     0/0   0.0
Michael Russell        15    2    0    0   0   1/3    33.3     0/0   0.0
Brandon Russell        16    2    0    0   0   1/1   100.0     0/0   0.0
Jayson Holiday         16    2    0    0   0   1/1   100.0     0/0   0.0
Evan Rose               8    0    0    0   0   0/1     0.0     0/0   0.0
Stephen Towns           8    0    0    0   0   0/2     0.0     0/0   0.0

TEAM: FG: 13/20 (65.0%), 3PT: 4/8 (50.0%), REB: 8 (2 off, 6 def), AST: 1, TO: 4
TEAM FOULS: 8 [Team_006 in BONUS]


Team_006
--------------------------------------------------------------------------------
Player                MIN  PTS  REB  AST  TO      FG   FG%      3P   3P%
--------------------------------------------------------------------------------
Lamelo Westbrook       10    9    0    0   0   4/5    80.0     0/0   0.0
Miles Harris            8    7    0    0   0   3/3   100.0     0/0   0.0
Ja Butler              15    4    3    1   0   2/2   100.0     0/0   0.0
Jayson Young           16    3    0    0   0   1/1   100.0     0/0   0.0
Shai Westbrook         16    2    2    0   0   1/3    33.3     0/0   0.0
Franz Wagner           15    2    0    0   0   1/2    50.0     0/0   0.0
Vince Sabonis           8    2    2    1   0   1/1   100.0     0/0   0.0
Bradley Gobert         15    0    3    0   0   0/1     0.0     0/0   0.0
Cade Ball              10    0    0    1   0   0/1     0.0     0/0   0.0
Shaquille Sexton       10    0    3    2   0   0/0     0.0     0/0   0.0

TEAM: FG: 13/19 (68.4%), 3PT: 4/8 (50.0%), REB: 13 (7 off, 6 def), AST: 5, TO: 4
TEAM FOULS: 7 [Team_061 in BONUS]

================================================================================

================================================================================
                       3RD QUARTER - Team_061 vs Team_006                       
================================================================================

[12:00] Team_061 possession (Score: 48-43)
Jayson Holiday drives, Bradley Gobert stays with him. Jayson Holiday attempts a Layup. Contested by Bradley Gobert (3.2 feet, ZONE). JAYSON HOLIDAY MAKES IT!
Score: 50-43

[11:42] Team_006 possession (Score: 50-43)
Shai Westbrook makes the Dunk and draws the foul on Brandon Russell! And-1! Shai Westbrook to the line for 1. [Team fouls: 1] (Brandon Russell: 1 personal fouls)   FT 1/1: MISS Shai Westbrook makes 0/1 from the line. Rebound secured by Bam Sexton.
Score: 50-45

[11:31] Team_061 possession (Score: 50-45)
Jayson Holiday attempts a Layup. Contested by Ja Butler (3.3 feet, ZONE). Jayson Holiday misses. Offensive rebound by Draymond Banchero! Draymond Banchero puts it back in!
Score: 52-45

[11:15] Team_006 possession (Score: 52-45)
Jayson Young attempts a 3Pt. Contested by Brandon Russell (4.3 feet, ZONE). JAYSON YOUNG MAKES IT! Assist: Bradley Gobert
Score: 52-48

[11:01] Team_061 possession (Score: 52-48)
FOUL! Shooting foul on Bradley Gobert. Draymond Banchero to the line for 2 free throws. [Team fouls: 1] (Bradley Gobert: 1 personal fouls)   FT 1/2: MISS   FT 2/2: GOOD Draymond Banchero makes 1/2 from the line.
Score: 53-48

[10:47] Team_006 possession (Score: 53-48)
FOUL! Offensive foul on Shai Westbrook! Brandon Russell drew the charge! [Team fouls: 2] (Shai Westbrook: 1 personal fouls) TURNOVER! (dead ball)

[10:33] Team_061 possession (Score: 53-48)
Draymond Banchero drives and kicks out. Brandon Russell attempts a Midrange. Contested by Franz Wagner (4.8 feet, ZONE). Brandon Russell misses. Rebound secured by Ja Butler.

[10:19] Team_006 possession (Score: 53-48)
Bradley Gobert drives to the basket... Bradley Gobert loses control! Ball rolls out of bounds! TURNOVER! (dead ball)

[10:05] Team_061 possession (Score: 53-48)
Bam Sexton attempts a 3Pt. Contested by Franz Wagner (5.3 feet, ZONE). Bam Sexton misses. Rebound secured by Ja Butler.

[09:50] Team_006 possession (Score: 53-48)
Franz Wagner attempts a 3Pt. Contested by Jayson Holiday (4.1 feet, MAN). FRANZ WAGNER MAKES IT! Assist: Jayson Young
Score: 53-51

[09:35] Team_061 possession (Score: 53-51)
Brandon Russell drives, picks up Bradley Gobert. Help arrives from Shai Westbrook! Brandon Russell attempts a Dunk. Contested by Shai Westbrook (3.0 feet, ZONE). BRANDON RUSSELL MAKES IT! Assist: Jayson Holiday
Score: 55-51

[09:19] Team_006 possession (Score: 55-51)
Bradley Gobert drives and kicks out. Shai Westbrook attempts a 3Pt. Contested by Brandon Russell (3.9 feet, MAN). Shai Westbrook misses. Rebound secured by Draymond Banchero.

[09:03] Team_061 possession (Score: 55-51)
FOUL! Shooting foul on Bradley Gobert. Brandon Russell to the line for 2 free throws. [Team fouls: 3] (Bradley Gobert: 2 personal fouls)   FT 1/2: GOOD   FT 2/2: GOOD Brandon Russell makes 2/2 from the line.
Score: 57-51

[08:43] Team_006 possession (Score: 57-51)
Shai Westbrook attempts a Layup. BLOCKED BY DRAYMOND BANCHERO! Ball is loose! Rebound secured by Draymond Banchero.

[08:31] Team_061 possession (Score: 57-51)
Brandon Russell drives, Shai Westbrook stays with him. Brandon Russell attempts a Dunk. Contested by Shai Westbrook (4.0 feet, MAN). BRANDON RUSSELL MAKES IT!
Score: 59-51

[08:16] Team_006 possession (Score: 59-51)
Shai Westbrook attempts a Layup. BLOCKED BY BRANDON RUSSELL! Ball is loose! Rebound secured by Bam Sexton.

[07:59] Team_061 possession (Score: 59-51)
Draymond Banchero drives and kicks out. Michael Russell attempts a Midrange. Contested by Jayson Young (4.6 feet, MAN). MICHAEL RUSSELL MAKES IT!
Score: 61-51

[07:44] Team_006 possession (Score: 61-51)
Ja Butler drives, Draymond Banchero stays with him. Ja Butler attempts a Dunk. Contested by Draymond Banchero (2.7 feet, ZONE). Ja Butler misses. Rebound secured by Michael Russell.

[07:30] Team_061 possession (Score: 61-51)
Brandon Russell makes the Midrange and draws the foul on Shai Westbrook! And-1! Brandon Russell to the line for 1. [Team fouls: 4] (Shai Westbrook: 2 personal fouls)   FT 1/1: GOOD Brandon Russell makes 1/1 from the line.
Score: 64-51

[07:11] Team_006 possession (Score: 64-51)
Shai Westbrook attempts a 3Pt. Contested by Brandon Russell (3.9 feet, MAN). Shai Westbrook misses. Rebound secured by Draymond Banchero.

[06:53] Team_061 possession (Score: 64-51)
Jayson Holiday drives to the basket... Jayson Holiday throws a bad pass! Stolen by Franz Wagner! TURNOVER! (live ball)

[06:38] Team_006 possession (Score: 64-51)
Bradley Gobert attempts a Layup. Contested by Draymond Banchero (2.5 feet, MAN). Bradley Gobert misses. Rebound secured by Michael Russell.

[06:20] Team_061 possession (Score: 64-51)
Bam Sexton attempts a 3Pt. Contested by Ja Butler (3.3 feet, MAN). Bam Sexton misses. Rebound secured by Bradley Gobert.

[06:04] Team_006 possession (Score: 64-51)
Shai Westbrook drives and kicks out. Ja Butler attempts a 3Pt. Contested by Bam Sexton (4.9 feet, MAN). Ja Butler misses. Rebound secured by Bam Sexton.

[05:50] Team_061 possession (Score: 64-51)
Jayson Holiday drives and kicks out. Brandon Russell attempts a Midrange. Contested by Jayson Young (4.6 feet, ZONE). Brandon Russell misses. Offensive rebound by Michael Russell! Michael Russell puts it back in!
Score: 66-51

[05:33] Team_006 possession (Score: 66-51)
Shai Westbrook throws a bad pass! Stolen by Brandon Russell! TURNOVER! (live ball)

[05:19] Team_061 possession (Score: 66-51)
Brandon Russell drives to the basket... FOUL! Offensive foul on Brandon Russell! Shai Westbrook drew the charge! [Team fouls: 2] (Brandon Russell: 2 personal fouls) TURNOVER! (dead ball)

[05:06] Team_006 possession (Score: 66-51)
Ja Butler attempts a Layup. Contested by Draymond Banchero (2.7 feet, ZONE). JA BUTLER MAKES IT!
Score: 66-53

[04:50] Team_061 possession (Score: 66-53)
FOUL! Offensive foul on Bam Sexton! Ja Butler drew the charge! [Team fouls: 3] (Bam Sexton: 1 personal fouls) TURNOVER! (dead ball)

[04:38] Team_006 possession (Score: 66-53)
FOUL! Reach-in foul on Bam Sexton during the drive. [Team fouls: 4] No free throws, side out. (Bam Sexton: 2 personal fouls)

[04:22] Team_006 possession (Score: 66-53)
Bradley Gobert makes the Midrange and draws the foul on Bam Sexton! And-1! Bradley Gobert to the line for 1. [BONUS: 5 team fouls] (Bam Sexton: 3 personal fouls)   FT 1/1: GOOD Bradley Gobert makes 1/1 from the line.
Score: 66-56

[04:05] Team_061 possession (Score: 66-56)
Bam Sexton makes the Layup and draws the foul on Ja Butler! And-1! Bam Sexton to the line for 1. [BONUS: 5 team fouls] (Ja Butler: 1 personal fouls)   FT 1/1: GOOD Bam Sexton makes 1/1 from the line.
Score: 69-56

[03:51] Team_006 possession (Score: 69-56)
Jayson Young drives and kicks out. Ja Butler attempts a 3Pt. Contested by Bam Sexton (4.9 feet, MAN). JA BUTLER MAKES IT! Assist: Jayson Young
Score: 69-59

[03:33] Team_061 possession (Score: 69-59)
Bam Sexton drives, Ja Butler stays with him. Bam Sexton attempts a Layup. Contested by Ja Butler (3.5 feet, MAN). BAM SEXTON MAKES IT!
Score: 71-59

[03:15] Team_006 possession (Score: 71-59)
Shai Westbrook drives, picks up Brandon Russell. Help arrives from Michael Russell! Shai Westbrook attempts a Dunk. Contested by Michael Russell (3.9 feet, MAN). SHAI WESTBROOK MAKES IT!
Score: 71-61

[02:58] Team_061 possession (Score: 71-61)
Michael Russell attempts a 3Pt. Contested by Shai Westbrook (4.2 feet, ZONE). Michael Russell misses. Offensive rebound by Draymond Banchero! Draymond Banchero puts it back in!
Score: 73-61

[02:43] Team_006 possession (Score: 73-61)
Bradley Gobert attempts a Midrange. Contested by Draymond Banchero (2.6 feet, MAN). Bradley Gobert misses. FOUL! Loose ball foul on Michael Russell during the rebound battle. [IN THE BONUS! 6 team fouls] Bradley Gobert to the line for 2 free throws. (Michael Russell: 1 personal fouls)   FT 1/2: GOOD   FT 2/2: GOOD Bradley Gobert makes 2/2 from the line.
Score: 73-63

[02:32] Team_061 possession (Score: 73-63)
Jayson Holiday makes the Layup and draws the foul on Shai Westbrook! And-1! Jayson Holiday to the line for 1. [BONUS: 6 team fouls] (Shai Westbrook: 3 personal fouls)   FT 1/1: GOOD Jayson Holiday makes 1/1 from the line.
Score: 76-63

[02:19] Team_006 possession (Score: 76-63)
Franz Wagner attempts a 3Pt. Contested by Jayson Holiday (4.3 feet, MAN). Franz Wagner misses. Rebound secured by Michael Russell.

[02:09] Team_061 possession (Score: 76-63)
Draymond Banchero attempts a Layup. Contested by Bradley Gobert (3.8 feet, MAN). DRAYMOND BANCHERO MAKES IT! Assist: Bam Sexton
Score: 78-63

[01:58] Team_006 possession (Score: 78-63)
Franz Wagner attempts a 3Pt. Contested by Jayson Holiday (4.4 feet, MAN). FRANZ WAGNER MAKES IT! Assist: Jayson Young
Score: 78-66

[01:44] Team_061 possession (Score: 78-66)
FOUL! Reach-in foul on Shai Westbrook during the drive. [IN THE BONUS! 7 team fouls] Brandon Russell to the line for 2 free throws. (Shai Westbrook: 4 personal fouls)   FT 1/2: GOOD   FT 2/2: MISS Brandon Russell makes 1/2 from the line. Rebound secured by Ja Butler.
Score: 79-66

[01:33] Team_006 possession (Score: 79-66)
Ja Butler drives, picks up Draymond Banchero. Help arrives from Jayson Holiday! Ja Butler attempts a Layup. Contested by Jayson Holiday (3.0 feet, ZONE). JA BUTLER MAKES IT! Assist: Bradley Gobert
Score: 79-68

[01:16] Team_061 possession (Score: 79-68)
Jayson Holiday attempts a 3Pt. Contested by Franz Wagner (5.5 feet, MAN). Jayson Holiday misses. Rebound secured by Ja Butler.

[01:02] Team_006 possession (Score: 79-68)
Shai Westbrook attempts a 3Pt. Contested by Brandon Russell (4.1 feet, ZONE). Shai Westbrook misses. Rebound secured by Michael Russell.

[00:51] Team_061 possession (Score: 79-68)
Jayson Holiday attempts a 3Pt. Contested by Franz Wagner (5.6 feet, MAN). Jayson Holiday misses. Rebound secured by Shai Westbrook.

[00:33] Team_006 possession (Score: 79-68)
FOUL! Reach-in foul on Michael Russell during the drive. [IN THE BONUS! 7 team fouls] Jayson Young to the line for 2 free throws. (Michael Russell: 2 personal fouls)   FT 1/2: GOOD   FT 2/2: GOOD Jayson Young makes 2/2 from the line.
Score: 79-70

[00:18] Team_061 possession (Score: 79-70)
FOUL! Holding foul on Shai Westbrook. [IN THE BONUS! 8 team fouls] Brandon Russell to the line for 2 free throws. (Shai Westbrook: 5 personal fouls)   FT 1/2: GOOD   FT 2/2: GOOD Brandon Russell makes 2/2 from the line.
Score: 81-70

[00:03] Team_006 possession (Score: 81-70)
Bradley Gobert attempts a Layup. Contested by Draymond Banchero (3.0 feet, MAN). Bradley Gobert misses. Offensive rebound by Bradley Gobert! Bradley Gobert kicks it out.

================================================================================
                              3RD QUARTER COMPLETE                              
================================================================================

3RD QUARTER SCORE: Team_061 33, Team_006 27

BOX SCORE:
================================================================================

Team_061
--------------------------------------------------------------------------------
Player                MIN  PTS  REB  AST  TO      FG   FG%      3P   3P%
--------------------------------------------------------------------------------
Brandon Russell        28   11    0    0   0   5/6    83.3     0/0   0.0
Draymond Banchero      28    7    5    0   0   4/5    80.0     0/0   0.0
Jayson Holiday         28    5    0    1   0   2/4    50.0     0/0   0.0
Bam Sexton             28    5    3    1   0   2/4    50.0     0/0   0.0
Michael Russell        27    4    5    0   0   2/2   100.0     0/0   0.0

TEAM: FG: 15/21 (71.4%), 3PT: 1/5 (20.0%), REB: 13 (3 off, 10 def), AST: 2, TO: 3
TEAM FOULS: 7 [Team_006 in BONUS]


Team_006
--------------------------------------------------------------------------------
Player                MIN  PTS  REB  AST  TO      FG   FG%      3P   3P%
--------------------------------------------------------------------------------
Ja Butler              27    7    4    0   0   3/4    75.0     0/0   0.0
Franz Wagner           27    6    0    0   0   2/3    66.7     0/0   0.0
Jayson Young           28    5    0    3   0   2/2   100.0     0/0   0.0
Bradley Gobert         27    5    2    2   0   2/4    50.0     0/0   0.0
Shai Westbrook         28    2    1    0   0   1/7    14.3     0/0   0.0

TEAM: FG: 10/20 (50.0%), 3PT: 3/6 (50.0%), REB: 7 (1 off, 6 def), AST: 5, TO: 3
TEAM FOULS: 8 [Team_061 in BONUS]

================================================================================

================================================================================
                       4TH QUARTER - Team_061 vs Team_006                       
================================================================================

[12:00] Team_061 possession (Score: 81-70)
Draymond Banchero attempts a Midrange. Contested by Jayson Young (5.4 feet, ZONE). Draymond Banchero misses. Offensive rebound by Michael Russell! Michael Russell's putback is no good. Offensive rebound by Draymond Banchero! Draymond Banchero kicks it out.

[11:47] Team_061 possession (Score: 81-70)
Brandon Russell attempts a Midrange. Contested by Shai Westbrook (4.3 feet, MAN). BRANDON RUSSELL MAKES IT! Assist: Draymond Banchero
Score: 83-70

[11:38] Team_006 possession (Score: 83-70)
Shai Westbrook attempts a 3Pt. Contested by Brandon Russell (4.1 feet, MAN). Shai Westbrook misses. Offensive rebound by Bradley Gobert! Bradley Gobert kicks it out.

[11:24] Team_006 possession (Score: 83-70)
Shai Westbrook attempts a Midrange. Contested by Brandon Russell (4.1 feet, MAN). SHAI WESTBROOK MAKES IT! Assist: Ja Butler
Score: 83-72

[11:09] Team_061 possession (Score: 83-72)
Bam Sexton attempts a Midrange. Contested by Ja Butler (3.8 feet, MAN). BAM SEXTON MAKES IT!
Score: 85-72

[10:55] Team_006 possession (Score: 85-72)
Franz Wagner attempts a Midrange. Contested by Jayson Holiday (4.5 feet, MAN). FRANZ WAGNER MAKES IT! Assist: Jayson Young
Score: 85-74

[10:44] Team_061 possession (Score: 85-74)
Bam Sexton drives and kicks out. Brandon Russell attempts a Midrange. Contested by Franz Wagner (5.3 feet, ZONE). BRANDON RUSSELL MAKES IT! Assist: Bam Sexton
Score: 87-74

[10:30] Team_006 possession (Score: 87-74)
Bradley Gobert drives to the basket... Bradley Gobert loses control! Ball rolls out of bounds! TURNOVER! (dead ball)

[10:30] Substitution (Team_061): Brandon Russell OUT → Evan Rose IN (stamina_rule2)

[10:30] Substitution (Team_061): Jayson Holiday OUT → Gary Fox IN (stamina_rule2)

[10:30] Substitution (Team_061): Michael Russell OUT → Desmond Morant IN (stamina_rule2)

[10:30] Substitution (Team_061): Bam Sexton OUT → Stephen Towns IN (stamina_rule2)

[10:30] Substitution (Team_061): Draymond Banchero OUT → Tim Durant IN (stamina_rule2)

[10:30] Substitution (Team_006): Shai Westbrook OUT → Miles Harris IN (stamina_rule2)

[10:30] Substitution (Team_006): Franz Wagner OUT → Lamelo Westbrook IN (stamina_rule2)

[10:30] Substitution (Team_006): Jayson Young OUT → Vince Sabonis IN (stamina_rule2)

[10:30] Substitution (Team_006): Ja Butler OUT → Cade Ball IN (stamina_rule2)

[10:30] Substitution (Team_006): Bradley Gobert OUT → Shaquille Sexton IN (stamina_rule2)

[10:15] Team_061 possession (Score: 87-74)
Tim Durant attempts a Midrange. Contested by Shaquille Sexton (5.9 feet, MAN). Tim Durant misses. Offensive rebound by Stephen Towns! Stephen Towns kicks it out.

[09:58] Team_061 possession (Score: 87-74)
Gary Fox drives, Cade Ball stays with him. Gary Fox attempts a Layup. Contested by Cade Ball (4.3 feet, ZONE). GARY FOX MAKES IT!
Score: 89-74

[09:45] Team_006 possession (Score: 89-74)
Lamelo Westbrook attempts a Midrange. Wide open! Gary Fox is 6.0 feet away. [MAN] Lamelo Westbrook misses. Rebound secured by Desmond Morant.

[09:27] Team_061 possession (Score: 89-74)
Tim Durant attempts a Midrange. Contested by Shaquille Sexton (5.9 feet, MAN). Tim Durant misses. Rebound secured by Vince Sabonis.

[09:16] Team_006 possession (Score: 89-74)
Miles Harris attempts a 3Pt. Contested by Desmond Morant (4.5 feet, ZONE). Miles Harris misses. Rebound secured by Stephen Towns.

[09:03] Team_061 possession (Score: 89-74)
Evan Rose attempts a 3Pt. Contested by Lamelo Westbrook (3.8 feet, ZONE). Evan Rose misses. Offensive rebound by Stephen Towns! Stephen Towns kicks it out.

[08:45] Team_061 possession (Score: 89-74)
Evan Rose drives, Cade Ball stays with him. Evan Rose attempts a Dunk. Contested by Cade Ball (4.5 feet, ZONE). EVAN ROSE MAKES IT! Assist: Desmond Morant
Score: 91-74

[08:33] Team_006 possession (Score: 91-74)
Miles Harris attempts a 3Pt. Contested by Desmond Morant (4.5 feet, ZONE). Miles Harris misses. Offensive rebound by Shaquille Sexton! Shaquille Sexton kicks it out.

[08:14] Team_006 possession (Score: 91-74)
Lamelo Westbrook attempts a Midrange. Wide open! Gary Fox is 6.0 feet away. [MAN] Lamelo Westbrook misses. Rebound secured by Stephen Towns.

[07:56] Team_061 possession (Score: 91-74)
Stephen Towns makes the Layup and draws the foul on Cade Ball! And-1! Stephen Towns to the line for 1. [Team fouls: 1] (Cade Ball: 1 personal fouls)   FT 1/1: GOOD Stephen Towns makes 1/1 from the line.
Score: 94-74

[07:39] Team_006 possession (Score: 94-74)
Shaquille Sexton drives to the basket... Shaquille Sexton loses the ball! Stripped by Tim Durant! TURNOVER! (live ball)

[07:23] Team_061 possession (Score: 94-74)
Evan Rose attempts a 3Pt. Contested by Miles Harris (5.5 feet, MAN). Evan Rose misses. Offensive rebound by Tim Durant! Tim Durant's putback is no good. Offensive rebound by Tim Durant! Tim Durant kicks it out.

[07:11] Team_061 possession (Score: 94-74)
FOUL! Offensive foul on Stephen Towns! Cade Ball drew the charge! [Team fouls: 1] (Stephen Towns: 1 personal fouls) TURNOVER! (dead ball)

[06:56] Team_006 possession (Score: 94-74)
Lamelo Westbrook attempts a Midrange. Wide open! Gary Fox is 6.0 feet away. [MAN] LAMELO WESTBROOK MAKES IT!
Score: 94-76

[06:39] Team_061 possession (Score: 94-76)
FOUL! Holding foul on Vince Sabonis. [Team fouls: 3] No free throws, side out. (Vince Sabonis: 1 personal fouls)

[06:25] Team_061 possession (Score: 94-76)
Desmond Morant drives and kicks out. Gary Fox attempts a Midrange. Contested by Vince Sabonis (4.7 feet, ZONE). Gary Fox misses. Offensive rebound by Stephen Towns! Stephen Towns kicks it out.

[06:13] Team_061 possession (Score: 94-76)
Evan Rose makes the Dunk and draws the foul on Cade Ball! And-1! Evan Rose to the line for 1. [Team fouls: 4] (Cade Ball: 3 personal fouls)   FT 1/1: GOOD Evan Rose makes 1/1 from the line.
Score: 97-76

[05:59] Team_006 possession (Score: 97-76)
FOUL! Holding foul on Gary Fox. [Team fouls: 2] No free throws, side out. (Gary Fox: 1 personal fouls)

[05:45] Team_006 possession (Score: 97-76)
Lamelo Westbrook attempts a Midrange. Wide open! Gary Fox is 6.0 feet away. [MAN] LAMELO WESTBROOK MAKES IT! Assist: Vince Sabonis
Score: 97-78

[05:33] Team_061 possession (Score: 97-78)
FOUL! Shooting foul on Miles Harris. Evan Rose to the line for 3 free throws. [BONUS: 5 team fouls] (Miles Harris: 1 personal fouls)   FT 1/3: MISS   FT 2/3: GOOD   FT 3/3: GOOD Evan Rose makes 2/3 from the line.
Score: 99-78

[05:17] Team_006 possession (Score: 99-78)
Shaquille Sexton throws a bad pass out of bounds! TURNOVER! (dead ball)

[05:01] Team_061 possession (Score: 99-78)
Tim Durant drives, Cade Ball stays with him. Tim Durant attempts a Layup. Contested by Cade Ball (4.8 feet, ZONE). TIM DURANT MAKES IT! Assist: Stephen Towns
Score: 101-78

[04:45] Team_006 possession (Score: 101-78)
Shaquille Sexton attempts a Midrange. Contested by Tim Durant (4.1 feet, MAN). SHAQUILLE SEXTON MAKES IT! Assist: Lamelo Westbrook
Score: 101-80

[04:30] Team_061 possession (Score: 101-80)
Evan Rose attempts a 3Pt. Contested by Miles Harris (5.5 feet, MAN). Evan Rose misses. Rebound secured by Shaquille Sexton.

[04:15] Team_006 possession (Score: 101-80)
FOUL! Shooting foul on Tim Durant. Vince Sabonis to the line for 2 free throws. [Team fouls: 3] (Tim Durant: 1 personal fouls)   FT 1/2: MISS   FT 2/2: MISS Vince Sabonis makes 0/2 from the line. Rebound secured by Desmond Morant.

[04:01] Team_061 possession (Score: 101-80)
Stephen Towns attempts a 3Pt. Contested by Cade Ball (4.5 feet, MAN). Stephen Towns misses. Offensive rebound by Tim Durant! Tim Durant's putback is no good. Rebound secured by Cade Ball.

[03:51] Team_006 possession (Score: 101-80)
Lamelo Westbrook attempts a Midrange. Contested by Stephen Towns (4.9 feet, ZONE). Lamelo Westbrook misses. Rebound secured by Desmond Morant.

[03:36] Team_061 possession (Score: 101-80)
Gary Fox attempts a Layup. BLOCKED BY LAMELO WESTBROOK! Ball is loose! Rebound secured by Shaquille Sexton.

[03:20] Team_006 possession (Score: 101-80)
Lamelo Westbrook attempts a 3Pt. Contested by Desmond Morant (4.6 feet, ZONE). Lamelo Westbrook misses. Rebound secured by Desmond Morant.

[03:07] Team_061 possession (Score: 101-80)
Desmond Morant attempts a Layup. BLOCKED BY VINCE SABONIS! Ball is loose! Rebound secured by Cade Ball.

[02:49] Team_006 possession (Score: 101-80)
FOUL! Shooting foul on Desmond Morant. Lamelo Westbrook to the line for 3 free throws. [Team fouls: 4] (Desmond Morant: 1 personal fouls)   FT 1/3: GOOD   FT 2/3: GOOD   FT 3/3: GOOD Lamelo Westbrook makes 3/3 from the line.
Score: 101-83

[02:35] Team_061 possession (Score: 101-83)
Tim Durant attempts a Midrange. Wide open! Shaquille Sexton is 6.0 feet away. [MAN] Tim Durant misses. Rebound secured by Shaquille Sexton.

[02:22] Team_006 possession (Score: 101-83)
Vince Sabonis drives to the basket... Vince Sabonis throws a bad pass! Stolen by Desmond Morant! TURNOVER! (live ball)

[02:06] Team_061 possession (Score: 101-83)
FOUL! Reach-in foul on Lamelo Westbrook during the drive. [IN THE BONUS! 6 team fouls] Gary Fox to the line for 2 free throws. (Lamelo Westbrook: 1 personal fouls)   FT 1/2: MISS   FT 2/2: MISS Gary Fox makes 0/2 from the line. Rebound secured by Vince Sabonis.

[01:54] Team_006 possession (Score: 101-83)
Vince Sabonis drives, picks up Desmond Morant. Help arrives from Evan Rose! Vince Sabonis attempts a Dunk. Contested by Evan Rose (4.5 feet, MAN). Vince Sabonis misses. Rebound secured by Desmond Morant.

[01:43] Team_061 possession (Score: 101-83)
FOUL! Shooting foul on Vince Sabonis. Tim Durant to the line for 2 free throws. [BONUS: 7 team fouls] (Vince Sabonis: 2 personal fouls)   FT 1/2: MISS   FT 2/2: GOOD Tim Durant makes 1/2 from the line.
Score: 102-83

[01:24] Team_006 possession (Score: 102-83)
Cade Ball drives and kicks out. Miles Harris attempts a Midrange. Wide open! Gary Fox is 6.0 feet away. [ZONE] MILES HARRIS MAKES IT!
Score: 102-85

[01:12] Team_061 possession (Score: 102-85)
Gary Fox attempts a 3Pt. Contested by Lamelo Westbrook (3.8 feet, MAN). Gary Fox misses. Rebound secured by Vince Sabonis.

[00:55] Team_006 possession (Score: 102-85)
Vince Sabonis attempts a Layup. Contested by Desmond Morant (4.6 feet, MAN). VINCE SABONIS MAKES IT!
Score: 102-87

[00:36] Team_061 possession (Score: 102-87)
Gary Fox drives and kicks out. Gary Fox attempts a Midrange. Contested by Cade Ball (4.6 feet, ZONE). Gary Fox misses. Rebound secured by Vince Sabonis.

[00:22] Team_006 possession (Score: 102-87)
FOUL! Shooting foul on Evan Rose. Miles Harris to the line for 2 free throws. [BONUS: 5 team fouls] (Evan Rose: 1 personal fouls)   FT 1/2: GOOD   FT 2/2: GOOD Miles Harris makes 2/2 from the line.
Score: 102-89

[00:10] Team_061 possession (Score: 102-89)
Evan Rose attempts a 3Pt. Contested by Miles Harris (5.7 feet, MAN). EVAN ROSE MAKES IT! Assist: Desmond Morant
Score: 105-89

================================================================================
                              4TH QUARTER COMPLETE                              
================================================================================

4TH QUARTER SCORE: Team_061 24, Team_006 19

BOX SCORE:
================================================================================

Team_061
--------------------------------------------------------------------------------
Player                MIN  PTS  REB  AST  TO      FG   FG%      3P   3P%
--------------------------------------------------------------------------------
Evan Rose              19   10    0    0   0   4/5    80.0     0/0   0.0
Brandon Russell        30    4    0    0   0   2/2   100.0     0/0   0.0
Stephen Towns          19    3    5    1   0   1/2    50.0     0/0   0.0
Tim Durant             19    3    1    0   0   2/4    50.0     0/0   0.0
Bam Sexton             30    2    0    1   0   1/1   100.0     0/0   0.0
Gary Fox               19    2    0    0   0   1/5    20.0     0/0   0.0
Draymond Banchero      30    0    1    1   0   0/0     0.0     0/0   0.0
Desmond Morant         20    0    5    2   0   0/1     0.0     0/0   0.0

TEAM: FG: 11/20 (55.0%), 3PT: 2/5 (40.0%), REB: 13 (6 off, 7 def), AST: 5, TO: 1
TEAM FOULS: 5 [Team_006 in BONUS]


Team_006
--------------------------------------------------------------------------------
Player                MIN  PTS  REB  AST  TO      FG   FG%      3P   3P%
--------------------------------------------------------------------------------
Lamelo Westbrook       20    7    0    1   0   3/7    42.9     0/0   0.0
Miles Harris           19    4    0    0   0   2/3    66.7     0/0   0.0
Shai Westbrook         30    2    0    0   0   1/1   100.0     0/0   0.0
Franz Wagner           28    2    0    0   0   1/1   100.0     0/0   0.0
Vince Sabonis          19    2    4    1   0   1/3    33.3     0/0   0.0
Shaquille Sexton       20    2    4    0   0   1/1   100.0     0/0   0.0
Bradley Gobert         28    0    1    0   0   0/0     0.0     0/0   0.0
Ja Butler              28    0    0    1   0   0/0     0.0     0/0   0.0
Jayson Young           30    0    0    1   0   0/0     0.0     0/0   0.0
Cade Ball              20    0    2    0   0   0/0     0.0     0/0   0.0

TEAM: FG: 9/16 (56.2%), 3PT: 1/3 (33.3%), REB: 10 (2 off, 8 def), AST: 4, TO: 4
TEAM FOULS: 7 [Team_061 in BONUS]

================================================================================

================================================================================
                               FULL GAME COMPLETE                               
================================================================================

FINAL SCORE: Team_061 105, Team_006 89

SCORING BY QUARTER:
--------------------------------------------------------------------------------
Team                     Q1     Q2     Q3     Q4    FINAL
--------------------------------------------------------------------------------
Team_061                 17     31     33     24      105
Team_006                 13     30     27     19       89
--------------------------------------------------------------------------------

FULL GAME BOX SCORE:
================================================================================

Team_061
--------------------------------------------------------------------------------
Player                MIN  PTS  REB  AST  TO      FG   FG%      3P   3P%      FT STL BLK
--------------------------------------------------------------------------------
Brandon Russell        30   20    0    0   2   7/9    77.8   1/2    50.0   6/7     1   1
Jayson Holiday         30    9    0    1   0   8/12   66.7   1/4    25.0   1/1     0   0
Bam Sexton             30   11    8    4   4   6/11   54.5   0/4     0.0   3/3     0   0
Draymond Banchero      30   16   17    2   0   5/10   50.0   1/2    50.0   2/4     0   1
Michael Russell        28    6    8    0   2   2/6    33.3   1/4    25.0   2/2     0   0
Desmond Morant         20   10    7    2   1   5/7    71.4   1/1   100.0   4/4     2   0
Evan Rose              19   10    0    1   1   4/7    57.1   2/5    40.0   3/4     0   0
Gary Fox               19    6    0    0   0   2/7    28.6   1/2    50.0   1/3     0   0
Stephen Towns          19    3    6    1   1   1/4    25.0   0/1     0.0   2/3     0   0
Tim Durant             19   11    5    0   0   5/8    62.5   1/2    50.0   3/4     1   0

TEAM: FG: 46/82 (56.1%), 3PT: 9/27 (33.3%), REB: 54 (16 off, 38 def), AST: 11, TO: 11


Team_006
--------------------------------------------------------------------------------
Player                MIN  PTS  REB  AST  TO      FG   FG%      3P   3P%      FT STL BLK
--------------------------------------------------------------------------------
Shai Westbrook         30   11    6    0   4   4/16   25.0   0/6     0.0   3/4     0   0
Jayson Young           30   10    0    4   1   6/6   100.0   2/2   100.0   2/2     0   0
Franz Wagner           28   13    0    0   1   5/9    55.6   4/7    57.1   2/3     1   0
Ja Butler              28   14   10    3   1   5/8    62.5   0/0     0.0   1/2     0   0
Bradley Gobert         28    5   12    2   1   2/8    25.0   0/2     0.0   3/3     3   0
Lamelo Westbrook       20   16    0    1   1   6/11   54.5   2/4    50.0   5/5     0   3
Cade Ball              20    0    4    1   1   1/2    50.0   0/0     0.0   1/2     0   0
Shaquille Sexton       20    2    8    2   1   1/3    33.3   0/0     0.0   0/0     0   0
Miles Harris           19   11    0    0   1   4/5    80.0   1/2    50.0   7/7     0   0
Vince Sabonis          19    4    7    2   2   2/6    33.3   0/0     0.0   0/2     0   1

TEAM: FG: 37/75 (49.3%), 3PT: 9/23 (39.1%), REB: 43 (12 off, 31 def), AST: 15, TO: 14

================================================================================
