================================================================================
                        FULL GAME - Team_054 vs Team_059                        
================================================================================

================================================================================
                       1ST QUARTER - Team_054 vs Team_059                       
================================================================================

[12:00] Team_054 possession (Score: 0-0)
FOUL! Shooting foul on Jarrett Smith. Blake Russell to the line for 2 free throws. [Team fouls: 1] (Jarrett Smith: 1 personal fouls)   FT 1/2: GOOD   FT 2/2: GOOD Blake Russell makes 2/2 from the line.
Score: 2-0

[11:45] Team_059 possession (Score: 2-0)
FOUL! Holding foul on Vince Ball. [Team fouls: 1] No free throws, side out. (Vince Ball: 1 personal fouls)

[11:28] Team_059 possession (Score: 2-0)
Blake Tatum commits a violation (traveling/carry)! TURNOVER! (dead ball)

[11:13] Team_054 possession (Score: 2-0)
Vince Ball attempts a 3Pt. Contested by John Iverson (5.4 feet, MAN). VINCE BALL MAKES IT! Assist: Malcolm Harden
Score: 5-0

[10:59] Team_059 possession (Score: 5-0)
Blake Tatum drives and kicks out. Jarrett Smith attempts a Midrange. Contested by Luka Brogdon (4.0 feet, ZONE). Jarrett Smith misses. Rebound secured by Lauri Irving.

[10:42] Team_054 possession (Score: 5-0)
Luka Brogdon drives, picks up Jarrett Smith. Help arrives from Bam Wade! Luka Brogdon attempts a Layup. Contested by Bam Wade (4.8 feet, ZONE). LUKA BROGDON MAKES IT! Assist: Lauri Irving
Score: 7-0

[10:26] Team_059 possession (Score: 7-0)
John Iverson attempts a 3Pt. Contested by Vince Ball (4.2 feet, MAN). JOHN IVERSON MAKES IT! Assist: Bam Wade
Score: 7-3

[10:09] Team_054 possession (Score: 7-3)
Luka Brogdon drives and kicks out. Vince Ball attempts a 3Pt. Contested by John Iverson (5.3 feet, MAN). Vince Ball misses. Rebound secured by John Iverson.

[09:54] Team_059 possession (Score: 7-3)
Blake Tatum attempts a Layup. Contested by Lauri Irving (3.3 feet, MAN). Blake Tatum misses. Offensive rebound by John Iverson! John Iverson kicks it out.

[09:43] Team_059 possession (Score: 7-3)
Nikola Jokic attempts a 3Pt. Contested by Luka Brogdon (4.2 feet, MAN). Nikola Jokic misses. Offensive rebound by Jarrett Smith! Jarrett Smith kicks it out.

[09:29] Team_059 possession (Score: 7-3)
Blake Tatum attempts a 3Pt. Contested by Lauri Irving (3.3 feet, MAN). Blake Tatum misses. Offensive rebound by Jarrett Smith! Jarrett Smith kicks it out.

[09:11] Team_059 possession (Score: 7-3)
Bam Wade drives to the basket... Bam Wade throws a bad pass! Stolen by Malcolm Harden! TURNOVER! (live ball)

[09:00] Team_054 possession (Score: 7-3)
Malcolm Harden attempts a 3Pt. Contested by Bam Wade (4.0 feet, MAN). Malcolm Harden misses. Rebound secured by Jarrett Smith.

[08:48] Team_059 possession (Score: 7-3)
Bam Wade attempts a Midrange. Contested by Malcolm Harden (4.6 feet, MAN). Bam Wade misses. Rebound secured by Blake Russell.

[08:33] Team_054 possession (Score: 7-3)
Luka Brogdon attempts a 3Pt. Contested by Nikola Jokic (5.7 feet, MAN). LUKA BROGDON MAKES IT! Assist: Vince Ball
Score: 10-3

[08:21] Team_059 possession (Score: 10-3)
Blake Tatum drives and kicks out. Jarrett Smith attempts a 3Pt. Contested by Lauri Irving (3.4 feet, ZONE). Jarrett Smith misses. Rebound secured by Luka Brogdon.

[08:07] Team_054 possession (Score: 10-3)
Blake Russell attempts a Midrange. Contested by Jarrett Smith (4.9 feet, MAN). Blake Russell misses. Offensive rebound by Luka Brogdon! Luka Brogdon kicks it out.

[07:53] Team_054 possession (Score: 10-3)
Malcolm Harden drives to the basket... FOUL! Offensive foul on Malcolm Harden! Jarrett Smith drew the charge! [Team fouls: 2] (Malcolm Harden: 1 personal fouls) TURNOVER! (dead ball)

[07:42] Team_059 possession (Score: 10-3)
Blake Tatum attempts a 3Pt. Contested by Malcolm Harden (4.1 feet, ZONE). Blake Tatum misses. Rebound secured by Luka Brogdon.

[07:27] Team_054 possession (Score: 10-3)
Luka Brogdon makes the Layup and draws the foul on Nikola Jokic! And-1! Luka Brogdon to the line for 1. [Team fouls: 2] (Nikola Jokic: 1 personal fouls)   FT 1/1: GOOD Luka Brogdon makes 1/1 from the line.
Score: 13-3

[07:11] Team_059 possession (Score: 13-3)
Jarrett Smith attempts a Midrange. BLOCKED BY LUKA BROGDON! Ball is loose! Rebound secured by Lauri Irving.

[06:59] Team_054 possession (Score: 13-3)
Blake Russell drives to the basket... FOUL! Offensive foul on Blake Russell! Jarrett Smith drew the charge! [Team fouls: 3] (Blake Russell: 1 personal fouls) TURNOVER! (dead ball)

[06:46] Team_059 possession (Score: 13-3)
Bam Wade attempts a 3Pt. Contested by Malcolm Harden (4.6 feet, MAN). Bam Wade misses. Offensive rebound by Jarrett Smith! Jarrett Smith kicks it out.

[06:33] Team_059 possession (Score: 13-3)
John Iverson attempts a Midrange. Contested by Vince Ball (4.2 feet, ZONE). John Iverson misses. Rebound secured by Lauri Irving.

[06:18] Team_054 possession (Score: 13-3)
Luka Brogdon drives and kicks out. Blake Russell attempts a Midrange. Contested by Bam Wade (3.7 feet, ZONE). Blake Russell misses. FOUL! Loose ball foul on Jarrett Smith during the rebound battle. [Team fouls: 3] No free throws, side out. (Jarrett Smith: 2 personal fouls)

[06:03] Team_054 possession (Score: 13-3)
Lauri Irving drives to the basket... Lauri Irving loses the ball! Stripped by Jarrett Smith! TURNOVER! (live ball)

[05:51] Team_059 possession (Score: 13-3)
Bam Wade attempts a 3Pt. Contested by Lauri Irving (3.9 feet, ZONE). BAM WADE MAKES IT! Assist: Jarrett Smith
Score: 13-6

[05:39] Team_054 possession (Score: 13-6)
Lauri Irving attempts a Midrange. Contested by Blake Tatum (4.8 feet, ZONE). LAURI IRVING MAKES IT! Assist: Blake Russell
Score: 15-6

[05:24] Team_059 possession (Score: 15-6)
Blake Tatum drives to the basket... Blake Tatum commits a violation (traveling/carry)! TURNOVER! (dead ball)

[05:07] Team_054 possession (Score: 15-6)
FOUL! Holding foul on Bam Wade. [Team fouls: 4] No free throws, side out. (Bam Wade: 1 personal fouls)

[04:53] Team_054 possession (Score: 15-6)
Vince Ball attempts a Midrange. Contested by Nikola Jokic (5.5 feet, ZONE). Vince Ball misses. Rebound secured by Bam Wade.

[04:33] Team_059 possession (Score: 15-6)
Nikola Jokic loses control! Ball rolls out of bounds! TURNOVER! (dead ball)

[04:16] Team_054 possession (Score: 15-6)
Blake Russell attempts a 3Pt. Contested by Blake Tatum (4.7 feet, ZONE). Blake Russell misses. Offensive rebound by Luka Brogdon! Luka Brogdon kicks it out.

[04:04] Team_054 possession (Score: 15-6)
Vince Ball throws a bad pass! Stolen by John Iverson! TURNOVER! (live ball)

[03:47] Team_059 possession (Score: 15-6)
FOUL! Reach-in foul on Blake Russell during the drive. [Team fouls: 4] No free throws, side out. (Blake Russell: 2 personal fouls)

[03:32] Team_059 possession (Score: 15-6)
Bam Wade attempts a 3Pt. Contested by Malcolm Harden (4.7 feet, MAN). BAM WADE MAKES IT! Assist: John Iverson
Score: 15-9

[03:22] Team_054 possession (Score: 15-9)
Malcolm Harden drives to the basket... Malcolm Harden throws a bad pass! Stolen by Bam Wade! TURNOVER! (live ball)

[03:08] Team_059 possession (Score: 15-9)
Bam Wade makes the Dunk and draws the foul on Lauri Irving! And-1! Bam Wade to the line for 1. [BONUS: 5 team fouls] (Lauri Irving: 1 personal fouls)   FT 1/1: GOOD Bam Wade makes 1/1 from the line.
Score: 15-12

[02:57] Team_054 possession (Score: 15-12)
FOUL! Holding foul on Nikola Jokic. [IN THE BONUS! 5 team fouls] Luka Brogdon to the line for 2 free throws. (Nikola Jokic: 2 personal fouls)   FT 1/2: MISS   FT 2/2: GOOD Luka Brogdon makes 1/2 from the line.
Score: 16-12

[02:46] Team_059 possession (Score: 16-12)
Jarrett Smith attempts a Midrange. Contested by Luka Brogdon (4.5 feet, ZONE). Jarrett Smith misses. Rebound secured by Vince Ball.

[02:31] Team_054 possession (Score: 16-12)
Luka Brogdon attempts a 3Pt. Contested by John Iverson (6.0 feet, ZONE). Luka Brogdon misses. Rebound secured by John Iverson.

[02:19] Team_059 possession (Score: 16-12)
Blake Tatum attempts a Midrange. Contested by Lauri Irving (3.6 feet, MAN). Blake Tatum misses. Rebound secured by Vince Ball.

[02:03] Team_054 possession (Score: 16-12)
Malcolm Harden throws a bad pass! Stolen by Bam Wade! TURNOVER! (live ball)

[01:50] Team_059 possession (Score: 16-12)
Nikola Jokic attempts a 3Pt. Contested by Malcolm Harden (4.6 feet, ZONE). NIKOLA JOKIC MAKES IT!
Score: 16-15

[01:36] Team_054 possession (Score: 16-15)
Lauri Irving attempts a Midrange. Contested by Blake Tatum (5.1 feet, MAN). Lauri Irving misses. Offensive rebound by Luka Brogdon! Luka Brogdon kicks it out.

[01:26] Team_054 possession (Score: 16-15)
Vince Ball commits a violation (traveling/carry)! TURNOVER! (dead ball)

[01:26] Substitution (Team_054): Malcolm Harden OUT → Shaquille Irving IN (stamina_rule2)

[01:26] Substitution (Team_054): Lauri Irving OUT → Bradley Quickley IN (stamina_rule2)

[01:26] Substitution (Team_054): Vince Ball OUT → Vince James IN (stamina_rule2)

[01:26] Substitution (Team_054): Luka Brogdon OUT → Tobias Nowitzki IN (stamina_rule2)

[01:26] Substitution (Team_054): Blake Russell OUT → Devin Jackson IN (stamina_rule2)

[01:26] Substitution (Team_059): Bam Wade OUT → Russell Quickley IN (stamina_rule2)

[01:26] Substitution (Team_059): Blake Tatum OUT → Scottie Ginobili IN (stamina_rule2)

[01:26] Substitution (Team_059): John Iverson OUT → Allen Giddey IN (stamina_rule2)

[01:26] Substitution (Team_059): Nikola Jokic OUT → Bones Middleton IN (stamina_rule2)

[01:26] Substitution (Team_059): Jarrett Smith OUT → LeBron Lowry IN (stamina_rule2)

[01:09] Team_059 possession (Score: 16-15)
Allen Giddey attempts a Layup. Contested by Vince James (4.7 feet, MAN). Allen Giddey misses. Offensive rebound by Scottie Ginobili! Scottie Ginobili kicks it out.

[00:54] Team_059 possession (Score: 16-15)
FOUL! Offensive foul on LeBron Lowry! Devin Jackson drew the charge! [Team fouls: 6] (LeBron Lowry: 1 personal fouls) TURNOVER! (dead ball)

[00:39] Team_054 possession (Score: 16-15)
Tobias Nowitzki attempts a Midrange. Contested by Scottie Ginobili (4.5 feet, ZONE). Tobias Nowitzki misses. Rebound secured by LeBron Lowry.

[00:25] Team_059 possession (Score: 16-15)
Scottie Ginobili attempts a Layup. Contested by Bradley Quickley (4.7 feet, MAN). SCOTTIE GINOBILI MAKES IT! Assist: Russell Quickley
Score: 16-17

[00:07] Team_054 possession (Score: 16-17)
Vince James attempts a 3Pt. Wide open! Allen Giddey is 7.4 feet away. [MAN] Vince James misses. Offensive rebound by Vince James! Vince James kicks it out.

================================================================================
                              1ST QUARTER COMPLETE                              
================================================================================

1ST QUARTER SCORE: Team_054 16, Team_059 17

BOX SCORE:
================================================================================

Team_054
--------------------------------------------------------------------------------
Player                MIN  PTS  REB  AST  TO      FG   FG%      3P   3P%
--------------------------------------------------------------------------------
Luka Brogdon           11    9    5    0   0   4/6    66.7     0/0   0.0
Vince Ball             11    3    2    1   0   1/2    50.0     0/0   0.0
Blake Russell          11    2    2    1   0   1/1   100.0     0/0   0.0
Lauri Irving           11    2    3    1   0   1/1   100.0     0/0   0.0
Malcolm Harden         11    0    0    1   0   0/1     0.0     0/0   0.0
Tobias Nowitzki         1    0    0    0   0   0/1     0.0     0/0   0.0
Vince James             1    0    1    0   0   0/0     0.0     0/0   0.0

TEAM: FG: 7/12 (58.3%), 3PT: 2/4 (50.0%), REB: 13 (5 off, 8 def), AST: 4, TO: 7
TEAM FOULS: 5 [Team_059 in BONUS]


Team_059
--------------------------------------------------------------------------------
Player                MIN  PTS  REB  AST  TO      FG   FG%      3P   3P%
--------------------------------------------------------------------------------
Bam Wade               11    9    1    1   0   3/4    75.0     0/0   0.0
John Iverson           11    3    3    1   0   1/2    50.0     0/0   0.0
Nikola Jokic           11    3    0    0   0   1/1   100.0     0/0   0.0
Scottie Ginobili        1    2    1    0   0   1/1   100.0     0/0   0.0
Blake Tatum            11    0    0    0   0   0/4     0.0     0/0   0.0
Jarrett Smith          11    0    4    1   0   0/2     0.0     0/0   0.0
LeBron Lowry            1    0    1    0   0   0/0     0.0     0/0   0.0
Russell Quickley        1    0    0    1   0   0/0     0.0     0/0   0.0

TEAM: FG: 6/14 (42.9%), 3PT: 4/5 (80.0%), REB: 10 (5 off, 5 def), AST: 4, TO: 5
TEAM FOULS: 6 [Team_054 in BONUS]

================================================================================

================================================================================
                       2ND QUARTER - Team_054 vs Team_059                       
================================================================================

[12:00] Team_054 possession (Score: 16-17)
FOUL! Shooting foul on John Iverson. Vince Ball to the line for 2 free throws. [Team fouls: 1] (John Iverson: 1 personal fouls)   FT 1/2: GOOD   FT 2/2: MISS Vince Ball makes 1/2 from the line. Rebound secured by Bam Wade.
Score: 17-17

[11:43] Team_059 possession (Score: 17-17)
FOUL! Holding foul on Malcolm Harden. [Team fouls: 1] No free throws, side out. (Malcolm Harden: 1 personal fouls)

[11:30] Team_059 possession (Score: 17-17)
Nikola Jokic attempts a 3Pt. Contested by Lauri Irving (3.7 feet, ZONE). Nikola Jokic misses. Rebound secured by Blake Russell.

[11:14] Team_054 possession (Score: 17-17)
Luka Brogdon drives, picks up Jarrett Smith. Help arrives from Bam Wade! Luka Brogdon attempts a Layup. Contested by Bam Wade (5.0 feet, ZONE). Luka Brogdon misses. Offensive rebound by Luka Brogdon! Luka Brogdon kicks it out.

[10:58] Team_054 possession (Score: 17-17)
Blake Russell drives, Jarrett Smith stays with him. Blake Russell attempts a Dunk. Contested by Jarrett Smith (5.1 feet, MAN). BLAKE RUSSELL MAKES IT!
Score: 19-17

[10:40] Team_059 possession (Score: 19-17)
Blake Tatum attempts a 3Pt. Contested by Lauri Irving (3.6 feet, MAN). BLAKE TATUM MAKES IT! Assist: Jarrett Smith
Score: 19-20

[10:28] Team_054 possession (Score: 19-20)
Malcolm Harden attempts a 3Pt. Contested by Bam Wade (4.3 feet, MAN). Malcolm Harden misses. Rebound secured by John Iverson.

[10:16] Team_059 possession (Score: 19-20)
John Iverson attempts a 3Pt. Contested by Vince Ball (4.3 feet, MAN). JOHN IVERSON MAKES IT! Assist: Nikola Jokic
Score: 19-23

[10:01] Team_054 possession (Score: 19-23)
Lauri Irving attempts a 3Pt. Contested by Bam Wade (4.6 feet, ZONE). Lauri Irving misses. Rebound secured by Nikola Jokic.

[09:44] Team_059 possession (Score: 19-23)
Jarrett Smith drives, Blake Russell stays with him. Jarrett Smith attempts a Dunk. Contested by Blake Russell (3.8 feet, ZONE). JARRETT SMITH MAKES IT! Assist: Nikola Jokic
Score: 19-25

[09:26] Team_054 possession (Score: 19-25)
Blake Russell drives, Jarrett Smith stays with him. Blake Russell attempts a Dunk. Contested by Jarrett Smith (5.2 feet, ZONE). BLAKE RUSSELL MAKES IT!
Score: 21-25

[09:15] Team_059 possession (Score: 21-25)
FOUL! Shooting foul on Blake Russell. Jarrett Smith to the line for 2 free throws. [Team fouls: 2] (Blake Russell: 1 personal fouls)   FT 1/2: GOOD   FT 2/2: GOOD Jarrett Smith makes 2/2 from the line.
Score: 21-27

[09:02] Team_054 possession (Score: 21-27)
Malcolm Harden attempts a Midrange. Contested by Nikola Jokic (5.9 feet, ZONE). Malcolm Harden misses. Rebound secured by John Iverson.

[08:49] Team_059 possession (Score: 21-27)
Nikola Jokic attempts a Midrange. Contested by Vince Ball (4.5 feet, ZONE). Nikola Jokic misses. Rebound secured by Vince Ball.

[08:37] Team_054 possession (Score: 21-27)
Vince Ball attempts a Layup. Contested by John Iverson (6.0 feet, MAN). Vince Ball misses. Rebound secured by John Iverson.

[08:22] Team_059 possession (Score: 21-27)
John Iverson attempts a 3Pt. Contested by Lauri Irving (4.0 feet, ZONE). John Iverson misses. Offensive rebound by Jarrett Smith! Jarrett Smith kicks it out.

[08:08] Team_059 possession (Score: 21-27)
FOUL! Shooting foul on Vince Ball. John Iverson to the line for 2 free throws. [Team fouls: 3] (Vince Ball: 1 personal fouls)   FT 1/2: GOOD   FT 2/2: GOOD John Iverson makes 2/2 from the line.
Score: 21-29

[07:53] Team_054 possession (Score: 21-29)
Blake Russell throws a bad pass out of bounds! TURNOVER! (dead ball)

[07:53] Substitution (Team_054): Malcolm Harden OUT → Shaquille Irving IN (stamina_rule2)

[07:53] Substitution (Team_054): Lauri Irving OUT → Bradley Quickley IN (stamina_rule2)

[07:53] Substitution (Team_054): Vince Ball OUT → Vince James IN (stamina_rule2)

[07:53] Substitution (Team_054): Luka Brogdon OUT → Tobias Nowitzki IN (stamina_rule2)

[07:53] Substitution (Team_054): Blake Russell OUT → Devin Jackson IN (stamina_rule2)

[07:53] Substitution (Team_059): Bam Wade OUT → Russell Quickley IN (stamina_rule2)

[07:53] Substitution (Team_059): Blake Tatum OUT → Scottie Ginobili IN (stamina_rule2)

[07:53] Substitution (Team_059): John Iverson OUT → Allen Giddey IN (stamina_rule2)

[07:53] Substitution (Team_059): Nikola Jokic OUT → Bones Middleton IN (stamina_rule2)

[07:53] Substitution (Team_059): Jarrett Smith OUT → LeBron Lowry IN (stamina_rule2)

[07:42] Team_059 possession (Score: 21-29)
Bones Middleton drives, Devin Jackson stays with him. Bones Middleton attempts a Dunk. Contested by Devin Jackson (5.7 feet, ZONE). BONES MIDDLETON MAKES IT! Assist: Allen Giddey
Score: 21-31

[07:29] Team_054 possession (Score: 21-31)
Shaquille Irving drives, Bones Middleton stays with him. Shaquille Irving attempts a Dunk. Contested by Bones Middleton (5.0 feet, ZONE). Shaquille Irving misses. Rebound secured by LeBron Lowry.

[07:11] Team_059 possession (Score: 21-31)
Bones Middleton attempts a 3Pt. Contested by Shaquille Irving (5.0 feet, ZONE). Bones Middleton misses. Offensive rebound by Scottie Ginobili! Scottie Ginobili kicks it out.

[06:57] Team_059 possession (Score: 21-31)
Scottie Ginobili attempts a Midrange. Contested by Devin Jackson (5.8 feet, ZONE). SCOTTIE GINOBILI MAKES IT!
Score: 21-33

[06:39] Team_054 possession (Score: 21-33)
Tobias Nowitzki attempts a Midrange. Wide open! Allen Giddey is 6.6 feet away. [ZONE] TOBIAS NOWITZKI MAKES IT!
Score: 23-33

[06:24] Team_059 possession (Score: 23-33)
LeBron Lowry attempts a Layup. Contested by Devin Jackson (5.4 feet, MAN). LeBron Lowry misses. Rebound secured by Tobias Nowitzki.

[06:10] Team_054 possession (Score: 23-33)
Tobias Nowitzki attempts a 3Pt. Contested by Russell Quickley (4.4 feet, ZONE). TOBIAS NOWITZKI MAKES IT! Assist: Shaquille Irving
Score: 26-33

[05:54] Team_059 possession (Score: 26-33)
Russell Quickley attempts a Midrange. Contested by Vince James (5.2 feet, ZONE). Russell Quickley misses. Rebound secured by Tobias Nowitzki.

[05:35] Team_054 possession (Score: 26-33)
FOUL! Holding foul on LeBron Lowry. [Team fouls: 2] No free throws, side out. (LeBron Lowry: 1 personal fouls)

[05:20] Team_054 possession (Score: 26-33)
Shaquille Irving attempts a 3Pt. Contested by Russell Quickley (4.9 feet, MAN). Shaquille Irving misses. Rebound secured by Scottie Ginobili.

[05:02] Team_059 possession (Score: 26-33)
Russell Quickley attempts a 3Pt. Contested by Shaquille Irving (5.0 feet, MAN). Russell Quickley misses. Rebound secured by Tobias Nowitzki.

[04:46] Team_054 possession (Score: 26-33)
FOUL! Shooting foul on Scottie Ginobili. Bradley Quickley to the line for 3 free throws. [Team fouls: 3] (Scottie Ginobili: 1 personal fouls)   FT 1/3: GOOD   FT 2/3: GOOD   FT 3/3: MISS Bradley Quickley makes 2/3 from the line. Rebound secured by Bones Middleton.
Score: 28-33

[04:31] Team_059 possession (Score: 28-33)
LeBron Lowry drives to the basket... LeBron Lowry throws a bad pass! Stolen by Devin Jackson! TURNOVER! (live ball)

[04:13] Team_054 possession (Score: 28-33)
Devin Jackson drives and kicks out. Tobias Nowitzki attempts a 3Pt. Contested by Bones Middleton (4.6 feet, MAN). TOBIAS NOWITZKI MAKES IT! Assist: Vince James
Score: 31-33

[04:04] Team_059 possession (Score: 31-33)
LeBron Lowry drives and kicks out. LeBron Lowry attempts a 3Pt. Contested by Devin Jackson (5.3 feet, MAN). LeBron Lowry misses. Offensive rebound by Bones Middleton! Bones Middleton kicks it out.

[03:48] Team_059 possession (Score: 31-33)
LeBron Lowry attempts a 3Pt. Contested by Vince James (5.0 feet, ZONE). LeBron Lowry misses. Rebound secured by Tobias Nowitzki.

[03:38] Team_054 possession (Score: 31-33)
Bradley Quickley attempts a 3Pt. Contested by Scottie Ginobili (4.2 feet, MAN). BRADLEY QUICKLEY MAKES IT!
Score: 34-33

[03:25] Team_059 possession (Score: 34-33)
Bones Middleton attempts a 3Pt. Wide open! Tobias Nowitzki is 6.1 feet away. [ZONE] BONES MIDDLETON MAKES IT! Assist: Russell Quickley
Score: 34-36

[03:07] Team_054 possession (Score: 34-36)
Devin Jackson attempts a Midrange. Contested by LeBron Lowry (4.8 feet, MAN). Devin Jackson misses. Rebound secured by LeBron Lowry.

[02:51] Team_059 possession (Score: 34-36)
Allen Giddey drives, picks up Tobias Nowitzki. Help arrives from Bradley Quickley! Allen Giddey attempts a Layup. Contested by Bradley Quickley (5.5 feet, ZONE). ALLEN GIDDEY MAKES IT! Assist: Russell Quickley
Score: 34-38

[02:33] Team_054 possession (Score: 34-38)
Tobias Nowitzki attempts a 3Pt. Contested by Russell Quickley (4.4 feet, ZONE). Tobias Nowitzki misses. Offensive rebound by Vince James! Vince James kicks it out.

[02:20] Team_054 possession (Score: 34-38)
FOUL! Holding foul on LeBron Lowry. [Team fouls: 4] No free throws, side out. (LeBron Lowry: 2 personal fouls)

[02:04] Team_054 possession (Score: 34-38)
Shaquille Irving drives and kicks out. Tobias Nowitzki attempts a 3Pt. Contested by Russell Quickley (4.4 feet, ZONE). Tobias Nowitzki misses. Rebound secured by Scottie Ginobili.

[01:46] Team_059 possession (Score: 34-38)
Scottie Ginobili attempts a Midrange. BLOCKED BY BRADLEY QUICKLEY! Ball deflects out of bounds off Scottie Ginobili.

[01:32] Team_054 possession (Score: 34-38)
Shaquille Irving attempts a 3Pt. Contested by Russell Quickley (4.9 feet, MAN). SHAQUILLE IRVING MAKES IT! Assist: Bradley Quickley
Score: 37-38

[01:20] Team_059 possession (Score: 37-38)
LeBron Lowry drives to the basket... LeBron Lowry throws a bad pass! Stolen by Devin Jackson! TURNOVER! (live ball)

[01:04] Team_054 possession (Score: 37-38)
FOUL! Shooting foul on Bones Middleton. Vince James to the line for 2 free throws. [BONUS: 5 team fouls] (Bones Middleton: 1 personal fouls)   FT 1/2: MISS   FT 2/2: MISS Vince James makes 0/2 from the line. Rebound secured by Bones Middleton.

[00:48] Team_059 possession (Score: 37-38)
Russell Quickley attempts a 3Pt. Contested by Shaquille Irving (5.0 feet, MAN). Russell Quickley misses. Rebound secured by Tobias Nowitzki.

[00:31] Team_054 possession (Score: 37-38)
Shaquille Irving attempts a 3Pt. Contested by Russell Quickley (5.0 feet, MAN). Shaquille Irving misses. Rebound secured by Bones Middleton.

[00:15] Team_059 possession (Score: 37-38)
Allen Giddey attempts a 3Pt. Contested by Shaquille Irving (4.5 feet, ZONE). Allen Giddey misses. Rebound secured by Vince James.

[00:03] Team_054 possession (Score: 37-38)
Shaquille Irving attempts a 3Pt. Contested by Russell Quickley (5.0 feet, MAN). Shaquille Irving misses. Rebound secured by Bones Middleton.

================================================================================
                              2ND QUARTER COMPLETE                              
================================================================================

2ND QUARTER SCORE: Team_054 21, Team_059 21

BOX SCORE:
================================================================================

Team_054
--------------------------------------------------------------------------------
Player                MIN  PTS  REB  AST  TO      FG   FG%      3P   3P%
--------------------------------------------------------------------------------
Tobias Nowitzki         9    8    5    0   0   3/3   100.0     0/0   0.0
Blake Russell          15    4    1    0   0   2/2   100.0     0/0   0.0
Shaquille Irving        9    3    0    1   0   1/6    16.7     0/0   0.0
Bradley Quickley        9    3    0    1   0   1/2    50.0     0/0   0.0
Vince Ball             15    0    1    0   0   0/2     0.0     0/0   0.0
Luka Brogdon           15    0    1    0   0   0/0     0.0     0/0   0.0
Malcolm Harden         15    0    0    0   0   0/2     0.0     0/0   0.0
Lauri Irving           15    0    0    0   0   0/1     0.0     0/0   0.0
Vince James             9    0    2    1   0   0/1     0.0     0/0   0.0
Devin Jackson           9    0    0    0   0   0/1     0.0     0/0   0.0

TEAM: FG: 7/20 (35.0%), 3PT: 3/9 (33.3%), REB: 10 (2 off, 8 def), AST: 3, TO: 1
TEAM FOULS: 3


Team_059
--------------------------------------------------------------------------------
Player                MIN  PTS  REB  AST  TO      FG   FG%      3P   3P%
--------------------------------------------------------------------------------
John Iverson           15    5    3    0   0   2/2   100.0     0/0   0.0
Bones Middleton         9    5    5    0   0   2/2   100.0     0/0   0.0
Jarrett Smith          15    4    1    1   0   2/2   100.0     0/0   0.0
Blake Tatum            15    3    0    0   0   1/1   100.0     0/0   0.0
Allen Giddey            9    2    0    1   0   1/2    50.0     0/0   0.0
Scottie Ginobili        9    2    3    0   0   1/2    50.0     0/0   0.0
Bam Wade               15    0    1    0   0   0/0     0.0     0/0   0.0
Nikola Jokic           15    0    1    2   0   0/2     0.0     0/0   0.0
LeBron Lowry            9    0    2    0   0   0/2     0.0     0/0   0.0
Russell Quickley        9    0    0    2   0   0/3     0.0     0/0   0.0

TEAM: FG: 9/18 (50.0%), 3PT: 3/8 (37.5%), REB: 16 (3 off, 13 def), AST: 6, TO: 2
TEAM FOULS: 5 [Team_054 in BONUS]

================================================================================

================================================================================
                       3RD QUARTER - Team_054 vs Team_059                       
================================================================================

[12:00] Team_054 possession (Score: 37-38)
Vince Ball attempts a 3Pt. Contested by Bam Wade (3.9 feet, ZONE). Vince Ball misses. Rebound secured by Jarrett Smith.

[11:48] Team_059 possession (Score: 37-38)
Nikola Jokic attempts a 3Pt. Contested by Lauri Irving (3.6 feet, ZONE). Nikola Jokic misses. Rebound secured by Blake Russell.

[11:30] Team_054 possession (Score: 37-38)
Blake Russell attempts a Midrange. Contested by John Iverson (5.8 feet, ZONE). Blake Russell misses. Rebound secured by Jarrett Smith.

[11:17] Team_059 possession (Score: 37-38)
Jarrett Smith loses the ball! Stripped by Blake Russell! TURNOVER! (live ball)

[11:01] Team_054 possession (Score: 37-38)
Malcolm Harden attempts a Midrange. Contested by Nikola Jokic (5.7 feet, ZONE). Malcolm Harden misses. Rebound secured by John Iverson.

[10:48] Team_059 possession (Score: 37-38)
Nikola Jokic attempts a Midrange. Contested by Luka Brogdon (4.2 feet, MAN). NIKOLA JOKIC MAKES IT! Assist: Blake Tatum
Score: 37-40

[10:32] Team_054 possession (Score: 37-40)
Malcolm Harden attempts a 3Pt. Contested by Blake Tatum (4.5 feet, ZONE). Malcolm Harden misses. Rebound secured by Bam Wade.

[10:19] Team_059 possession (Score: 37-40)
Nikola Jokic attempts a 3Pt. Contested by Lauri Irving (3.6 feet, ZONE). Nikola Jokic misses. Rebound secured by Lauri Irving.

[10:03] Team_054 possession (Score: 37-40)
Blake Russell attempts a Layup. Contested by Jarrett Smith (4.9 feet, ZONE). BLAKE RUSSELL MAKES IT! Assist: Lauri Irving
Score: 39-40

[09:48] Team_059 possession (Score: 39-40)
Jarrett Smith drives to the basket... FOUL! Offensive foul on Jarrett Smith! Blake Russell drew the charge! [Team fouls: 1] (Jarrett Smith: 1 personal fouls) TURNOVER! (dead ball)

[09:38] Team_054 possession (Score: 39-40)
Luka Brogdon drives, Nikola Jokic stays with him. Luka Brogdon attempts a Dunk. Contested by Nikola Jokic (5.7 feet, MAN). Luka Brogdon misses. Rebound secured by Bam Wade.

[09:24] Team_059 possession (Score: 39-40)
Nikola Jokic drives and kicks out. Jarrett Smith attempts a 3Pt. Contested by Lauri Irving (3.4 feet, ZONE). Jarrett Smith misses. Rebound secured by Luka Brogdon.

[09:10] Team_054 possession (Score: 39-40)
FOUL! Reach-in foul on Blake Tatum during the drive. [Team fouls: 2] No free throws, side out. (Blake Tatum: 1 personal fouls)

[08:56] Team_054 possession (Score: 39-40)
Lauri Irving attempts a Midrange. Contested by Blake Tatum (4.8 feet, MAN). Lauri Irving misses. Rebound secured by Jarrett Smith.

[08:40] Team_059 possession (Score: 39-40)
Jarrett Smith attempts a 3Pt. Contested by Lauri Irving (3.8 feet, ZONE). Jarrett Smith misses. Rebound secured by Blake Russell.

[08:26] Team_054 possession (Score: 39-40)
Blake Russell makes the Layup and draws the foul on Jarrett Smith! And-1! Blake Russell to the line for 1. [Team fouls: 3] (Jarrett Smith: 2 personal fouls)   FT 1/1: GOOD Blake Russell makes 1/1 from the line.
Score: 42-40

[08:09] Team_059 possession (Score: 42-40)
John Iverson attempts a 3Pt. Contested by Lauri Irving (3.5 feet, ZONE). John Iverson misses. Rebound secured by Luka Brogdon.

[07:51] Team_054 possession (Score: 42-40)
Lauri Irving attempts a 3Pt. Contested by Bam Wade (4.3 feet, ZONE). Lauri Irving misses. Rebound secured by Jarrett Smith.

[07:33] Team_059 possession (Score: 42-40)
Nikola Jokic attempts a Layup. Contested by Luka Brogdon (4.2 feet, MAN). Nikola Jokic misses. Rebound secured by Lauri Irving.

[07:20] Team_054 possession (Score: 42-40)
Luka Brogdon drives, picks up Jarrett Smith. Help arrives from Bam Wade! Luka Brogdon attempts a Dunk. Contested by Bam Wade (4.8 feet, ZONE). Luka Brogdon misses. Offensive rebound by Luka Brogdon! Luka Brogdon kicks it out.

[07:04] Team_054 possession (Score: 42-40)
Luka Brogdon attempts a 3Pt. Contested by Bam Wade (4.1 feet, ZONE). Luka Brogdon misses. Rebound secured by John Iverson.

[06:51] Team_059 possession (Score: 42-40)
Jarrett Smith drives to the basket... FOUL! Offensive foul on Jarrett Smith! Blake Russell drew the charge! [Team fouls: 4] (Jarrett Smith: 3 personal fouls) TURNOVER! (dead ball)

[06:34] Team_054 possession (Score: 42-40)
Vince Ball attempts a Layup. Contested by John Iverson (5.4 feet, MAN). Vince Ball misses. Rebound secured by Jarrett Smith.

[06:22] Team_059 possession (Score: 42-40)
John Iverson attempts a Midrange. Contested by Lauri Irving (3.5 feet, ZONE). John Iverson misses. Rebound secured by Luka Brogdon.

[06:08] Team_054 possession (Score: 42-40)
Luka Brogdon makes the Layup and draws the foul on Nikola Jokic! And-1! Luka Brogdon to the line for 1. [BONUS: 5 team fouls] (Nikola Jokic: 1 personal fouls)   FT 1/1: GOOD Luka Brogdon makes 1/1 from the line.
Score: 45-40

[05:55] Team_059 possession (Score: 45-40)
Nikola Jokic attempts a Midrange. Contested by Luka Brogdon (4.2 feet, MAN). Nikola Jokic misses. Rebound secured by Lauri Irving.

[05:39] Team_054 possession (Score: 45-40)
Vince Ball attempts a Midrange. Contested by John Iverson (5.5 feet, MAN). Vince Ball misses. Offensive rebound by Luka Brogdon! Luka Brogdon kicks it out.

[05:25] Team_054 possession (Score: 45-40)
Lauri Irving attempts a Midrange. Contested by Blake Tatum (4.8 feet, MAN). Lauri Irving misses. Rebound secured by Bam Wade.

[05:09] Team_059 possession (Score: 45-40)
Bam Wade makes the Midrange and draws the foul on Malcolm Harden! And-1! Bam Wade to the line for 1. [Team fouls: 1] (Malcolm Harden: 1 personal fouls)   FT 1/1: GOOD Bam Wade makes 1/1 from the line.
Score: 45-43

[04:53] Team_054 possession (Score: 45-43)
Vince Ball attempts a 3Pt. Contested by Bam Wade (3.9 feet, ZONE). VINCE BALL MAKES IT! Assist: Luka Brogdon
Score: 48-43

[04:43] Team_059 possession (Score: 48-43)
Jarrett Smith attempts a 3Pt. Contested by Lauri Irving (3.8 feet, ZONE). Jarrett Smith misses. Rebound secured by Blake Russell.

[04:28] Team_054 possession (Score: 48-43)
Blake Russell drives, picks up Jarrett Smith. Help arrives from Bam Wade! Blake Russell attempts a Dunk. Contested by Bam Wade (5.0 feet, ZONE). BLAKE RUSSELL MAKES IT! Assist: Malcolm Harden
Score: 50-43

[04:15] Team_059 possession (Score: 50-43)
Bam Wade attempts a Midrange. Contested by Lauri Irving (4.0 feet, ZONE). Bam Wade misses. Rebound secured by Blake Russell.

[04:00] Team_054 possession (Score: 50-43)
Blake Russell attempts a Midrange. Contested by Nikola Jokic (5.9 feet, ZONE). BLAKE RUSSELL MAKES IT! Assist: Malcolm Harden
Score: 52-43

[03:47] Team_059 possession (Score: 52-43)
Nikola Jokic attempts a 3Pt. Contested by Lauri Irving (3.7 feet, ZONE). Nikola Jokic misses. Rebound secured by Blake Russell.

[03:32] Team_054 possession (Score: 52-43)
Malcolm Harden drives and kicks out. Lauri Irving attempts a 3Pt. Contested by Blake Tatum (4.4 feet, MAN). Lauri Irving misses. Rebound secured by John Iverson.

[03:13] Team_059 possession (Score: 52-43)
Bam Wade attempts a Layup. Contested by Luka Brogdon (4.6 feet, ZONE). BAM WADE MAKES IT!
Score: 52-45

[03:00] Team_054 possession (Score: 52-45)
Malcolm Harden attempts a Layup. BLOCKED BY BAM WADE! Ball is loose! Offensive rebound by Blake Russell! Blake Russell kicks it out.

[02:50] Team_054 possession (Score: 52-45)
Vince Ball attempts a 3Pt. Contested by Bam Wade (4.1 feet, ZONE). Vince Ball misses. Rebound secured by John Iverson.

[02:38] Team_059 possession (Score: 52-45)
Blake Tatum attempts a 3Pt. Contested by Lauri Irving (3.6 feet, MAN). Blake Tatum misses. Rebound secured by Luka Brogdon.

[02:20] Team_054 possession (Score: 52-45)
FOUL! Reach-in foul on Bam Wade during the drive. [IN THE BONUS! 6 team fouls] Malcolm Harden to the line for 2 free throws. (Bam Wade: 1 personal fouls)   FT 1/2: GOOD   FT 2/2: GOOD Malcolm Harden makes 2/2 from the line.
Score: 54-45

[02:05] Team_059 possession (Score: 54-45)
Bam Wade throws a bad pass out of bounds! TURNOVER! (dead ball)

[02:05] Substitution (Team_054): Malcolm Harden OUT → Shaquille Irving IN (stamina_rule2)

[02:05] Substitution (Team_054): Lauri Irving OUT → Bradley Quickley IN (stamina_rule2)

[02:05] Substitution (Team_054): Blake Russell OUT → Devin Jackson IN (stamina_rule2)

[02:05] Substitution (Team_059): Bam Wade OUT → Russell Quickley IN (stamina_rule2)

[02:05] Substitution (Team_059): Blake Tatum OUT → Scottie Ginobili IN (stamina_rule2)

[02:05] Substitution (Team_059): John Iverson OUT → Allen Giddey IN (stamina_rule2)

[02:05] Substitution (Team_059): Nikola Jokic OUT → Bones Middleton IN (stamina_rule2)

[02:05] Substitution (Team_059): Jarrett Smith OUT → LeBron Lowry IN (stamina_rule2)

[01:48] Team_054 possession (Score: 54-45)
Devin Jackson attempts a Midrange. Contested by Scottie Ginobili (4.7 feet, ZONE). Devin Jackson misses. Rebound secured by Scottie Ginobili.

[01:37] Team_059 possession (Score: 54-45)
Allen Giddey attempts a Midrange. Contested by Devin Jackson (5.1 feet, ZONE). Allen Giddey misses. Rebound secured by Vince Ball.

[01:25] Team_054 possession (Score: 54-45)
Luka Brogdon drives, Bones Middleton stays with him. Luka Brogdon attempts a Dunk. Contested by Bones Middleton (4.9 feet, ZONE). Luka Brogdon misses. Rebound secured by LeBron Lowry.

[01:14] Team_059 possession (Score: 54-45)
Bones Middleton throws a bad pass out of bounds! TURNOVER! (dead ball)

[01:14] Substitution (Team_054): Vince Ball OUT → Vince James IN (stamina_rule2)

[01:14] Substitution (Team_054): Luka Brogdon OUT → Tobias Nowitzki IN (stamina_rule2)

[01:03] Team_054 possession (Score: 54-45)
Shaquille Irving attempts a 3Pt. Contested by Russell Quickley (4.9 feet, MAN). Shaquille Irving misses. Rebound secured by LeBron Lowry.

[00:52] Team_059 possession (Score: 54-45)
LeBron Lowry attempts a Midrange. Contested by Devin Jackson (5.4 feet, MAN). LeBron Lowry misses. Rebound secured by Vince James.

[00:38] Team_054 possession (Score: 54-45)
Devin Jackson attempts a Layup. BLOCKED BY LEBRON LOWRY! Ball is loose! Offensive rebound by Vince James! Vince James kicks it out.

[00:25] Team_054 possession (Score: 54-45)
Devin Jackson attempts a Layup. Contested by Bones Middleton (4.7 feet, ZONE). Devin Jackson misses. Rebound secured by Scottie Ginobili.

[00:12] Team_059 possession (Score: 54-45)
FOUL! Reach-in foul on Devin Jackson during the drive. [Team fouls: 2] No free throws, side out. (Devin Jackson: 1 personal fouls)

================================================================================
                              3RD QUARTER COMPLETE                              
================================================================================

3RD QUARTER SCORE: Team_054 17, Team_059 7

BOX SCORE:
================================================================================

Team_054
--------------------------------------------------------------------------------
Player                MIN  PTS  REB  AST  TO      FG   FG%      3P   3P%
--------------------------------------------------------------------------------
Blake Russell          25    9    6    0   0   4/5    80.0     0/0   0.0
Vince Ball             26    3    1    0   0   1/4    25.0     0/0   0.0
Luka Brogdon           26    3    6    1   0   1/4    25.0     0/0   0.0
Malcolm Harden         25    2    0    2   0   1/4    25.0     0/0   0.0
Lauri Irving           25    0    3    1   0   0/3     0.0     0/0   0.0
Devin Jackson          11    0    0    0   0   0/2     0.0     0/0   0.0
Shaquille Irving       11    0    0    0   0   0/1     0.0     0/0   0.0
Vince James            10    0    2    0   0   0/0     0.0     0/0   0.0

TEAM: FG: 7/23 (30.4%), 3PT: 1/7 (14.3%), REB: 18 (4 off, 14 def), AST: 4, TO: 0
TEAM FOULS: 2


Team_059
--------------------------------------------------------------------------------
Player                MIN  PTS  REB  AST  TO      FG   FG%      3P   3P%
--------------------------------------------------------------------------------
Bam Wade               25    5    3    0   0   2/3    66.7     0/0   0.0
Nikola Jokic           25    2    0    0   0   1/7    14.3     0/0   0.0
Jarrett Smith          25    0    5    0   0   0/2     0.0     0/0   0.0
John Iverson           25    0    4    0   0   0/2     0.0     0/0   0.0
Blake Tatum            25    0    0    1   0   0/1     0.0     0/0   0.0
Scottie Ginobili       11    0    2    0   0   0/0     0.0     0/0   0.0
Allen Giddey           11    0    0    0   0   0/1     0.0     0/0   0.0
LeBron Lowry           11    0    2    0   0   0/1     0.0     0/0   0.0

TEAM: FG: 3/17 (17.6%), 3PT: 0/7 (0.0%), REB: 16 (0 off, 16 def), AST: 1, TO: 5
TEAM FOULS: 7 [Team_054 in BONUS]

================================================================================

================================================================================
                       4TH QUARTER - Team_054 vs Team_059                       
================================================================================

[12:00] Team_054 possession (Score: 54-45)
Malcolm Harden attempts a 3Pt. Contested by Bam Wade (4.1 feet, MAN). Malcolm Harden misses. Rebound secured by John Iverson.

[11:47] Team_059 possession (Score: 54-45)
Bam Wade attempts a 3Pt. Contested by Lauri Irving (3.9 feet, ZONE). Bam Wade misses. Rebound secured by Luka Brogdon.

[11:34] Team_054 possession (Score: 54-45)
Vince Ball attempts a Layup. BLOCKED BY BAM WADE! Ball is loose! Offensive rebound by Blake Russell! Blake Russell kicks it out.

[11:19] Team_054 possession (Score: 54-45)
Malcolm Harden attempts a Midrange. Contested by Blake Tatum (4.6 feet, ZONE). Malcolm Harden misses. Rebound secured by Bam Wade.

[11:06] Team_059 possession (Score: 54-45)
John Iverson attempts a 3Pt. Contested by Vince Ball (4.3 feet, ZONE). John Iverson misses. Rebound secured by Lauri Irving.

[10:48] Team_054 possession (Score: 54-45)
Luka Brogdon drives and kicks out. Blake Russell attempts a 3Pt. Contested by Bam Wade (3.9 feet, ZONE). Blake Russell misses. Offensive rebound by Blake Russell! Blake Russell's putback is no good. Rebound secured by John Iverson.

[10:34] Team_059 possession (Score: 54-45)
FOUL! Reach-in foul on Blake Russell during the drive. [Team fouls: 1] No free throws, side out. (Blake Russell: 1 personal fouls)

[10:19] Team_059 possession (Score: 54-45)
Bam Wade attempts a 3Pt. Contested by Lauri Irving (4.0 feet, ZONE). Bam Wade misses. Offensive rebound by John Iverson! John Iverson kicks it out.

[10:04] Team_059 possession (Score: 54-45)
FOUL! Shooting foul on Luka Brogdon. Nikola Jokic to the line for 3 free throws. [Team fouls: 2] (Luka Brogdon: 1 personal fouls)   FT 1/3: GOOD   FT 2/3: GOOD   FT 3/3: GOOD Nikola Jokic makes 3/3 from the line.
Score: 54-48

[09:47] Team_054 possession (Score: 54-48)
Vince Ball drives to the basket... Vince Ball commits a violation (traveling/carry)! TURNOVER! (dead ball)

[09:47] Substitution (Team_054): Luka Brogdon OUT → Tobias Nowitzki IN (stamina_rule2)

[09:47] Substitution (Team_054): Blake Russell OUT → Devin Jackson IN (stamina_rule2)

[09:47] Substitution (Team_059): John Iverson OUT → Allen Giddey IN (stamina_rule2)

[09:33] Team_059 possession (Score: 54-48)
Blake Tatum attempts a 3Pt. Contested by Lauri Irving (3.6 feet, ZONE). Blake Tatum misses. Rebound secured by Vince Ball.

[09:17] Team_054 possession (Score: 54-48)
Malcolm Harden commits a violation (traveling/carry)! TURNOVER! (dead ball)

[09:17] Substitution (Team_054): Malcolm Harden OUT → Shaquille Irving IN (stamina_rule2)

[09:17] Substitution (Team_054): Lauri Irving OUT → Bradley Quickley IN (stamina_rule2)

[09:17] Substitution (Team_054): Vince Ball OUT → Vince James IN (stamina_rule2)

[09:17] Substitution (Team_059): Bam Wade OUT → Russell Quickley IN (stamina_rule2)

[09:17] Substitution (Team_059): Blake Tatum OUT → Scottie Ginobili IN (stamina_rule2)

[09:17] Substitution (Team_059): Nikola Jokic OUT → Bones Middleton IN (stamina_rule2)

[09:17] Substitution (Team_059): Jarrett Smith OUT → LeBron Lowry IN (stamina_rule2)

[09:03] Team_059 possession (Score: 54-48)
Scottie Ginobili drives and kicks out. Bones Middleton attempts a 3Pt. Contested by Tobias Nowitzki (5.7 feet, MAN). Bones Middleton misses. Rebound secured by Devin Jackson.

[08:46] Team_054 possession (Score: 54-48)
Tobias Nowitzki drives and kicks out. Bradley Quickley attempts a 3Pt. Contested by Russell Quickley (4.4 feet, ZONE). Bradley Quickley misses. Offensive rebound by Tobias Nowitzki! Tobias Nowitzki kicks it out.

[08:35] Team_054 possession (Score: 54-48)
FOUL! Shooting foul on LeBron Lowry. Devin Jackson to the line for 3 free throws. [Team fouls: 2] (LeBron Lowry: 1 personal fouls)   FT 1/3: GOOD   FT 2/3: GOOD   FT 3/3: GOOD Devin Jackson makes 3/3 from the line.
Score: 57-48

[08:20] Team_059 possession (Score: 57-48)
LeBron Lowry loses control! Ball rolls out of bounds! TURNOVER! (dead ball)

[08:08] Team_054 possession (Score: 57-48)
Tobias Nowitzki attempts a 3Pt. BLOCKED BY RUSSELL QUICKLEY! Ball is loose! Rebound secured by Bones Middleton.

[07:54] Team_059 possession (Score: 57-48)
Scottie Ginobili attempts a 3Pt. Contested by Bradley Quickley (4.7 feet, MAN). Scottie Ginobili misses. Offensive rebound by Scottie Ginobili! Scottie Ginobili kicks it out.

[07:39] Team_059 possession (Score: 57-48)
Allen Giddey attempts a Midrange. Contested by Tobias Nowitzki (5.5 feet, ZONE). ALLEN GIDDEY MAKES IT! Assist: LeBron Lowry
Score: 57-50

[07:24] Team_054 possession (Score: 57-50)
Shaquille Irving drives and kicks out. Shaquille Irving attempts a 3Pt. Contested by Russell Quickley (4.4 feet, ZONE). Shaquille Irving misses. Rebound secured by Scottie Ginobili.

[07:09] Team_059 possession (Score: 57-50)
LeBron Lowry attempts a 3Pt. Contested by Shaquille Irving (4.8 feet, ZONE). LeBron Lowry misses. Rebound secured by Devin Jackson.

[06:58] Team_054 possession (Score: 57-50)
Tobias Nowitzki attempts a Layup. Contested by Bones Middleton (4.6 feet, MAN). Tobias Nowitzki misses. Offensive rebound by Vince James! Vince James kicks it out.

[06:44] Team_054 possession (Score: 57-50)
Tobias Nowitzki drives to the basket... Tobias Nowitzki throws a bad pass! Stolen by Bones Middleton! TURNOVER! (live ball)

[06:30] Team_059 possession (Score: 57-50)
LeBron Lowry attempts a 3Pt. Contested by Devin Jackson (5.4 feet, MAN). LeBron Lowry misses. Rebound secured by Devin Jackson.

[06:18] Team_054 possession (Score: 57-50)
Shaquille Irving attempts a 3Pt. Contested by Russell Quickley (4.9 feet, MAN). SHAQUILLE IRVING MAKES IT! Assist: Devin Jackson
Score: 60-50

[06:03] Team_059 possession (Score: 60-50)
Bones Middleton makes the Dunk and draws the foul on Devin Jackson! And-1! Bones Middleton to the line for 1. [Team fouls: 3] (Devin Jackson: 1 personal fouls)   FT 1/1: MISS Bones Middleton makes 0/1 from the line. Rebound secured by Vince James.
Score: 60-52

[05:48] Team_054 possession (Score: 60-52)
Devin Jackson drives, LeBron Lowry stays with him. Devin Jackson attempts a Layup. Contested by LeBron Lowry (4.8 feet, MAN). DEVIN JACKSON MAKES IT!
Score: 62-52

[05:33] Team_059 possession (Score: 62-52)
Scottie Ginobili attempts a 3Pt. Contested by Shaquille Irving (5.1 feet, ZONE). Scottie Ginobili misses. Offensive rebound by Bones Middleton! Bones Middleton kicks it out.

[05:16] Team_059 possession (Score: 62-52)
Bones Middleton drives, picks up Tobias Nowitzki. Help arrives from Bradley Quickley! Bones Middleton attempts a Layup. Wide open! Bradley Quickley is 6.1 feet away. [MAN] BONES MIDDLETON MAKES IT! Assist: Russell Quickley
Score: 62-54

[05:03] Team_054 possession (Score: 62-54)
Tobias Nowitzki makes the Layup and draws the foul on Bones Middleton! And-1! Tobias Nowitzki to the line for 1. [Team fouls: 3] (Bones Middleton: 1 personal fouls)   FT 1/1: MISS Tobias Nowitzki makes 0/1 from the line. Rebound secured by Scottie Ginobili.
Score: 64-54

[04:50] Team_059 possession (Score: 64-54)
Bones Middleton attempts a Midrange. Contested by Vince James (5.2 feet, ZONE). Bones Middleton misses. FOUL! Loose ball foul on Devin Jackson during the rebound battle. [Team fouls: 4] No free throws, side out. (Devin Jackson: 2 personal fouls)

[04:34] Team_059 possession (Score: 64-54)
Scottie Ginobili attempts a Midrange. Contested by Bradley Quickley (4.7 feet, MAN). Scottie Ginobili misses. Rebound secured by Tobias Nowitzki.

[04:21] Team_054 possession (Score: 64-54)
Vince James drives, picks up Bones Middleton. Help arrives from Scottie Ginobili! Vince James attempts a Layup. Contested by Scottie Ginobili (5.3 feet, ZONE). VINCE JAMES MAKES IT!
Score: 66-54

[04:06] Team_059 possession (Score: 66-54)
Allen Giddey attempts a 3Pt. Contested by Shaquille Irving (4.5 feet, ZONE). Allen Giddey misses. Rebound secured by Tobias Nowitzki.

[03:54] Team_054 possession (Score: 66-54)
Shaquille Irving attempts a 3Pt. Contested by Russell Quickley (4.9 feet, ZONE). Shaquille Irving misses. Rebound secured by Scottie Ginobili.

[03:43] Team_059 possession (Score: 66-54)
Allen Giddey drives, Devin Jackson stays with him. Allen Giddey attempts a Dunk. Contested by Devin Jackson (5.2 feet, ZONE). ALLEN GIDDEY MAKES IT! Assist: Russell Quickley
Score: 66-56

[03:28] Team_054 possession (Score: 66-56)
Tobias Nowitzki attempts a Midrange. Contested by Bones Middleton (4.7 feet, ZONE). TOBIAS NOWITZKI MAKES IT! Assist: Bradley Quickley
Score: 68-56

[03:16] Team_059 possession (Score: 68-56)
FOUL! Holding foul on Vince James. [IN THE BONUS! 5 team fouls] Allen Giddey to the line for 2 free throws. (Vince James: 1 personal fouls)   FT 1/2: GOOD   FT 2/2: GOOD Allen Giddey makes 2/2 from the line.
Score: 68-58

[03:00] Team_054 possession (Score: 68-58)
Devin Jackson attempts a Midrange. Contested by LeBron Lowry (5.0 feet, MAN). DEVIN JACKSON MAKES IT! Assist: Shaquille Irving
Score: 70-58

[02:43] Team_059 possession (Score: 70-58)
Russell Quickley attempts a 3Pt. Contested by Shaquille Irving (5.0 feet, ZONE). Russell Quickley misses. Offensive rebound by Bones Middleton! Bones Middleton kicks it out.

[02:30] Team_059 possession (Score: 70-58)
LeBron Lowry attempts a Midrange. BLOCKED BY BRADLEY QUICKLEY! Ball is loose! Rebound secured by Tobias Nowitzki.

[02:15] Team_054 possession (Score: 70-58)
Vince James drives, picks up Bones Middleton. Help arrives from Scottie Ginobili! Vince James attempts a Layup. Contested by Scottie Ginobili (5.5 feet, ZONE). Vince James misses. Rebound secured by Bones Middleton.

[01:56] Team_059 possession (Score: 70-58)
FOUL! Reach-in foul on Devin Jackson during the drive. [IN THE BONUS! 6 team fouls] Allen Giddey to the line for 2 free throws. (Devin Jackson: 3 personal fouls)   FT 1/2: GOOD   FT 2/2: GOOD Allen Giddey makes 2/2 from the line.
Score: 70-60

[01:39] Team_054 possession (Score: 70-60)
Tobias Nowitzki attempts a 3Pt. Contested by Russell Quickley (4.7 feet, ZONE). TOBIAS NOWITZKI MAKES IT! Assist: Vince James
Score: 73-60

[01:26] Team_059 possession (Score: 73-60)
LeBron Lowry attempts a 3Pt. Contested by Shaquille Irving (4.9 feet, ZONE). LeBron Lowry misses. Rebound secured by Vince James.

[01:12] Team_054 possession (Score: 73-60)
Shaquille Irving loses control! Ball rolls out of bounds! TURNOVER! (dead ball)

[00:54] Team_059 possession (Score: 73-60)
Allen Giddey attempts a 3Pt. Contested by Shaquille Irving (4.7 feet, ZONE). Allen Giddey misses. Offensive rebound by Scottie Ginobili! Scottie Ginobili kicks it out.

[00:44] Team_059 possession (Score: 73-60)
Russell Quickley attempts a 3Pt. Wide open! Tobias Nowitzki is 6.3 feet away. [ZONE] RUSSELL QUICKLEY MAKES IT! Assist: Scottie Ginobili
Score: 73-63

[00:28] Team_054 possession (Score: 73-63)
Vince James drives to the basket... Vince James commits a violation (traveling/carry)! TURNOVER! (dead ball)

[00:16] Team_059 possession (Score: 73-63)
Bones Middleton attempts a 3Pt. Wide open! Tobias Nowitzki is 6.3 feet away. [MAN] BONES MIDDLETON MAKES IT! Assist: Allen Giddey
Score: 73-66

================================================================================
                              4TH QUARTER COMPLETE                              
================================================================================

4TH QUARTER SCORE: Team_054 19, Team_059 21

BOX SCORE:
================================================================================

Team_054
--------------------------------------------------------------------------------
Player                MIN  PTS  REB  AST  TO      FG   FG%      3P   3P%
--------------------------------------------------------------------------------
Devin Jackson          20    7    3    1   0   3/3   100.0     0/0   0.0
Tobias Nowitzki        20    5    4    0   0   2/4    50.0     0/0   0.0
Shaquille Irving       20    3    0    1   0   1/3    33.3     0/0   0.0
Vince James            19    2    3    1   0   1/2    50.0     0/0   0.0
Malcolm Harden         28    0    0    0   0   0/2     0.0     0/0   0.0
Luka Brogdon           29    0    1    0   0   0/1     0.0     0/0   0.0
Blake Russell          28    0    1    0   0   0/0     0.0     0/0   0.0
Lauri Irving           28    0    1    0   0   0/0     0.0     0/0   0.0
Vince Ball             29    0    1    0   0   0/0     0.0     0/0   0.0
Bradley Quickley       20    0    0    1   0   0/0     0.0     0/0   0.0

TEAM: FG: 7/15 (46.7%), 3PT: 3/6 (50.0%), REB: 15 (4 off, 11 def), AST: 4, TO: 5
TEAM FOULS: 6 [Team_059 in BONUS]


Team_059
--------------------------------------------------------------------------------
Player                MIN  PTS  REB  AST  TO      FG   FG%      3P   3P%
--------------------------------------------------------------------------------
Allen Giddey           20    8    0    1   0   4/5    80.0     0/0   0.0
Bones Middleton        20    5    4    0   0   2/3    66.7     0/0   0.0
Nikola Jokic           28    3    0    0   0   1/1   100.0     0/0   0.0
Russell Quickley       20    3    0    2   0   1/1   100.0     0/0   0.0
John Iverson           28    0    3    0   0   0/1     0.0     0/0   0.0
Bam Wade               28    0    1    0   0   0/1     0.0     0/0   0.0
Blake Tatum            28    0    0    0   0   0/1     0.0     0/0   0.0
Scottie Ginobili       20    0    6    1   0   0/2     0.0     0/0   0.0
LeBron Lowry           20    0    0    1   0   0/4     0.0     0/0   0.0

TEAM: FG: 8/19 (42.1%), 3PT: 3/10 (30.0%), REB: 13 (6 off, 7 def), AST: 5, TO: 1
TEAM FOULS: 3

================================================================================

================================================================================
                               FULL GAME COMPLETE                               
================================================================================

FINAL SCORE: Team_054 73, Team_059 66

SCORING BY QUARTER:
--------------------------------------------------------------------------------
Team                     Q1     Q2     Q3     Q4    FINAL
--------------------------------------------------------------------------------
Team_054                 16     21     17     19       73
Team_059                 17     21      7     21       66
--------------------------------------------------------------------------------

FULL GAME BOX SCORE:
================================================================================

Team_054
--------------------------------------------------------------------------------
Player                MIN  PTS  REB  AST  TO      FG   FG%      3P   3P%      FT STL BLK
--------------------------------------------------------------------------------
Vince Ball             29    6    5    1   3   2/8    25.0   2/4    50.0   1/2     0   0
Luka Brogdon           29   12   13    1   0   4/10   40.0   1/3    33.3   3/4     0   1
Malcolm Harden         28    2    0    3   2   1/9    11.1   0/4     0.0   2/2     1   0
Lauri Irving           28    2    7    2   3   1/5    20.0   0/2     0.0   0/0     0   0
Blake Russell          28   15   10    1   2   7/8    87.5   0/0     0.0   3/3     1   0
Devin Jackson          20    7    3    1   1   4/7    57.1   1/1   100.0   3/3     2   0
Shaquille Irving       20    6    0    2   1   2/10   20.0   2/7    28.6   0/0     0   0
Bradley Quickley       20    3    0    2   0   1/2    50.0   1/2    50.0   2/3     0   2
Tobias Nowitzki        20   13    9    0   1   4/7    57.1   2/3    66.7   0/1     0   0
Vince James            19    2    8    2   0   1/3    33.3   0/0     0.0   0/2     0   0

TEAM: FG: 28/70 (40.0%), 3PT: 9/26 (34.6%), REB: 56 (15 off, 41 def), AST: 15, TO: 13


Team_059
--------------------------------------------------------------------------------
Player                MIN  PTS  REB  AST  TO      FG   FG%      3P   3P%      FT STL BLK
--------------------------------------------------------------------------------
Bam Wade               28   14    6    1   1   5/8    62.5   2/3    66.7   2/2     2   2
Blake Tatum            28    3    0    1   1   1/7    14.3   1/4    25.0   0/0     0   0
Nikola Jokic           28    8    1    2   1   3/11   27.3   2/6    33.3   3/3     0   0
Jarrett Smith          28    4   10    2   2   2/6    33.3   0/2     0.0   2/2     1   0
John Iverson           28    8   13    1   3   3/7    42.9   2/4    50.0   2/2     1   0
Allen Giddey           20   10    0    2   1   4/7    57.1   0/2     0.0   4/4     0   0
Russell Quickley       20    3    0    5   0   1/4    25.0   1/3    33.3   0/0     0   1
Scottie Ginobili       20    4   12    1   0   2/5    40.0   0/0     0.0   0/0     0   0
Bones Middleton        20   10    9    0   2   4/5    80.0   2/2   100.0   0/1     1   0
LeBron Lowry           20    0    5    1   2   0/7     0.0   0/4     0.0   0/0     0   1

TEAM: FG: 26/68 (38.2%), 3PT: 10/30 (33.3%), REB: 55 (14 off, 41 def), AST: 16, TO: 13

================================================================================
