================================================================================
                        FULL GAME - Team_099 vs Team_036                        
================================================================================

================================================================================
                       1ST QUARTER - Team_099 vs Team_036                       
================================================================================

[12:00] Team_099 possession (Score: 0-0)
Damian Ginobili drives and kicks out. Larry James attempts a 3Pt. Contested by Giannis Booker (4.5 feet, MAN). LARRY JAMES MAKES IT! Assist: Ayo Barrett
Score: 3-0

[11:46] Team_036 possession (Score: 3-0)
Anthony Poole attempts a Midrange. Contested by Damian Ginobili (4.3 feet, MAN). Anthony Poole misses. Rebound secured by Damian Ginobili.

[11:36] Team_099 possession (Score: 3-0)
Larry Wade drives and kicks out. Damian Ginobili attempts a 3Pt. Contested by Michael Westbrook (4.6 feet, ZONE). Damian Ginobili misses. Rebound secured by Terry Durant.

[11:22] Team_036 possession (Score: 3-0)
Terry Durant attempts a Midrange. Contested by Damian Ginobili (4.0 feet, ZONE). TERRY DURANT MAKES IT!
Score: 3-2

[11:05] Team_099 possession (Score: 3-2)
FOUL! Shooting foul on Kobe Simmons. Vince Lillard to the line for 2 free throws. [Team fouls: 1] (Kobe Simmons: 1 personal fouls)   FT 1/2: GOOD   FT 2/2: GOOD Vince Lillard makes 2/2 from the line.
Score: 5-2

[10:50] Team_036 possession (Score: 5-2)
Giannis Booker attempts a 3Pt. Contested by Ayo Barrett (4.1 feet, ZONE). Giannis Booker misses. Rebound secured by Vince Lillard.

[10:37] Team_099 possession (Score: 5-2)
Damian Ginobili attempts a 3Pt. Contested by Anthony Poole (5.1 feet, MAN). DAMIAN GINOBILI MAKES IT! Assist: Larry James
Score: 8-2

[10:23] Team_036 possession (Score: 8-2)
Terry Durant attempts a Midrange. Contested by Vince Lillard (2.9 feet, MAN). Terry Durant misses. Rebound secured by Vince Lillard.

[10:07] Team_099 possession (Score: 8-2)
FOUL! Shooting foul on Kobe Simmons. Larry Wade to the line for 2 free throws. [Team fouls: 2] (Kobe Simmons: 2 personal fouls)   FT 1/2: GOOD   FT 2/2: GOOD Larry Wade makes 2/2 from the line.
Score: 10-2

[09:50] Team_036 possession (Score: 10-2)
Anthony Poole attempts a Layup. Contested by Damian Ginobili (4.3 feet, MAN). Anthony Poole misses. Rebound secured by Damian Ginobili.

[09:39] Team_099 possession (Score: 10-2)
Ayo Barrett attempts a 3Pt. Contested by Terry Durant (4.6 feet, ZONE). Ayo Barrett misses. Offensive rebound by Vince Lillard! Vince Lillard puts it back in!
Score: 12-2

[09:25] Team_036 possession (Score: 12-2)
Giannis Booker attempts a 3Pt. Contested by Larry James (5.5 feet, MAN). GIANNIS BOOKER MAKES IT! Assist: Kobe Simmons
Score: 12-5

[09:13] Team_099 possession (Score: 12-5)
Ayo Barrett throws a bad pass out of bounds! TURNOVER! (dead ball)

[08:59] Team_036 possession (Score: 12-5)
Giannis Booker makes the Layup and draws the foul on Damian Ginobili! And-1! Giannis Booker to the line for 1. [Team fouls: 1] (Damian Ginobili: 1 personal fouls)   FT 1/1: GOOD Giannis Booker makes 1/1 from the line.
Score: 12-8

[08:47] Team_099 possession (Score: 12-8)
Damian Ginobili attempts a Layup. Contested by Anthony Poole (5.1 feet, MAN). DAMIAN GINOBILI MAKES IT! Assist: Larry Wade
Score: 14-8

[08:30] Team_036 possession (Score: 14-8)
Kobe Simmons attempts a Layup. Contested by Larry Wade (4.6 feet, MAN). KOBE SIMMONS MAKES IT!
Score: 14-10

[08:17] Team_099 possession (Score: 14-10)
Larry Wade drives and kicks out. Larry James attempts a 3Pt. Contested by Michael Westbrook (4.6 feet, ZONE). Larry James misses. Offensive rebound by Larry Wade! Larry Wade's putback is no good. Rebound secured by Terry Durant.

[08:00] Team_036 possession (Score: 14-10)
Anthony Poole attempts a Midrange. Contested by Larry Wade (5.0 feet, ZONE). Anthony Poole misses. Rebound secured by Vince Lillard.

[07:43] Team_099 possession (Score: 14-10)
Ayo Barrett attempts a 3Pt. Contested by Michael Westbrook (4.8 feet, ZONE). Ayo Barrett misses. Rebound secured by Terry Durant.

[07:29] Team_036 possession (Score: 14-10)
Terry Durant attempts a 3Pt. Contested by Vince Lillard (2.9 feet, MAN). TERRY DURANT MAKES IT! Assist: Kobe Simmons
Score: 14-13

[07:14] Team_099 possession (Score: 14-13)
Vince Lillard attempts a Layup. Contested by Terry Durant (4.5 feet, MAN). VINCE LILLARD MAKES IT! Assist: Larry James
Score: 16-13

[06:57] Team_036 possession (Score: 16-13)
Kobe Simmons makes the Layup and draws the foul on Larry Wade! And-1! Kobe Simmons to the line for 1. [Team fouls: 2] (Larry Wade: 1 personal fouls)   FT 1/1: GOOD Kobe Simmons makes 1/1 from the line.
Score: 16-16

[06:44] Team_099 possession (Score: 16-16)
Damian Ginobili drives to the basket... Damian Ginobili loses control! Ball rolls out of bounds! TURNOVER! (dead ball)

[06:28] Team_036 possession (Score: 16-16)
Kobe Simmons drives to the basket... Kobe Simmons loses the ball! Stripped by Larry Wade! TURNOVER! (live ball)

[06:16] Team_099 possession (Score: 16-16)
Ayo Barrett makes the Layup and draws the foul on Michael Westbrook! And-1! Ayo Barrett to the line for 1. [Team fouls: 3] (Michael Westbrook: 1 personal fouls)   FT 1/1: GOOD Ayo Barrett makes 1/1 from the line.
Score: 19-16

[06:02] Team_036 possession (Score: 19-16)
Kobe Simmons attempts a Midrange. Contested by Larry James (5.5 feet, ZONE). Kobe Simmons misses. Rebound secured by Damian Ginobili.

[05:49] Team_099 possession (Score: 19-16)
FOUL! Reach-in foul on Kobe Simmons during the drive. [Team fouls: 4] No free throws, side out. (Kobe Simmons: 3 personal fouls)

[05:35] Team_099 possession (Score: 19-16)
Larry Wade loses the ball! Stripped by Kobe Simmons! TURNOVER! (live ball)

[05:18] Team_036 possession (Score: 19-16)
Anthony Poole attempts a 3Pt. Contested by Ayo Barrett (4.5 feet, ZONE). Anthony Poole misses. Rebound secured by Larry Wade.

[05:06] Team_099 possession (Score: 19-16)
Damian Ginobili attempts a 3Pt. Contested by Anthony Poole (5.1 feet, MAN). Damian Ginobili misses. Rebound secured by Terry Durant.

[04:47] Team_036 possession (Score: 19-16)
Kobe Simmons attempts a Midrange. Contested by Larry Wade (4.7 feet, MAN). Kobe Simmons misses. Rebound secured by Damian Ginobili.

[04:29] Team_099 possession (Score: 19-16)
Damian Ginobili attempts a 3Pt. Contested by Michael Westbrook (4.9 feet, ZONE). Damian Ginobili misses. Rebound secured by Kobe Simmons.

[04:18] Team_036 possession (Score: 19-16)
Michael Westbrook attempts a Layup. Contested by Ayo Barrett (4.3 feet, MAN). MICHAEL WESTBROOK MAKES IT!
Score: 19-18

[04:02] Team_099 possession (Score: 19-18)
Ayo Barrett drives and kicks out. Vince Lillard attempts a 3Pt. Contested by Michael Westbrook (4.7 feet, ZONE). Vince Lillard misses. Offensive rebound by Vince Lillard! Vince Lillard puts it back in!
Score: 21-18

[03:44] Team_036 possession (Score: 21-18)
Anthony Poole attempts a Midrange. Contested by Damian Ginobili (4.4 feet, MAN). ANTHONY POOLE MAKES IT! Assist: Terry Durant
Score: 21-20

[03:30] Team_099 possession (Score: 21-20)
Ayo Barrett attempts a 3Pt. Contested by Michael Westbrook (4.9 feet, MAN). Ayo Barrett misses. Rebound secured by Giannis Booker.

[03:11] Team_036 possession (Score: 21-20)
Giannis Booker drives and kicks out. Kobe Simmons attempts a 3Pt. Contested by Ayo Barrett (3.9 feet, ZONE). Kobe Simmons misses. Offensive rebound by Terry Durant! Terry Durant's putback is no good. Rebound secured by Vince Lillard.

[02:57] Team_099 possession (Score: 21-20)
Larry Wade attempts a Midrange. Contested by Kobe Simmons (4.0 feet, MAN). Larry Wade misses. Rebound secured by Kobe Simmons.

[02:42] Team_036 possession (Score: 21-20)
FOUL! Reach-in foul on Larry Wade during the drive. [Team fouls: 3] No free throws, side out. (Larry Wade: 2 personal fouls)

[02:28] Team_036 possession (Score: 21-20)
Michael Westbrook attempts a Layup. Contested by Vince Lillard (3.3 feet, ZONE). Michael Westbrook misses. Offensive rebound by Kobe Simmons! Kobe Simmons puts it back in!
Score: 21-22

[02:14] Team_099 possession (Score: 21-22)
Larry Wade drives, Kobe Simmons stays with him. Larry Wade attempts a Layup. Contested by Kobe Simmons (4.1 feet, ZONE). LARRY WADE MAKES IT! Assist: Ayo Barrett
Score: 23-22

[02:02] Team_036 possession (Score: 23-22)
Giannis Booker attempts a 3Pt. Contested by Ayo Barrett (4.4 feet, ZONE). Giannis Booker misses. Rebound secured by Vince Lillard.

[01:48] Team_099 possession (Score: 23-22)
Vince Lillard drives to the basket... Vince Lillard throws a bad pass! Stolen by Terry Durant! TURNOVER! (live ball)

[01:30] Team_036 possession (Score: 23-22)
Michael Westbrook attempts a 3Pt. Contested by Ayo Barrett (4.5 feet, ZONE). Michael Westbrook misses. Rebound secured by Vince Lillard.

[01:18] Team_099 possession (Score: 23-22)
Vince Lillard drives, picks up Terry Durant. Help arrives from Giannis Booker! Vince Lillard attempts a Layup. Contested by Giannis Booker (4.9 feet, MAN). VINCE LILLARD MAKES IT! Assist: Larry Wade
Score: 25-22

[01:05] Team_036 possession (Score: 25-22)
Anthony Poole attempts a 3Pt. Contested by Vince Lillard (3.7 feet, ZONE). ANTHONY POOLE MAKES IT!
Score: 25-25

[00:50] Team_099 possession (Score: 25-25)
Ayo Barrett attempts a Layup. Contested by Michael Westbrook (5.2 feet, MAN). AYO BARRETT MAKES IT! Assist: Larry Wade
Score: 27-25

[00:36] Team_036 possession (Score: 27-25)
FOUL! Reach-in foul on Larry Wade during the drive. [Team fouls: 4] No free throws, side out. (Larry Wade: 3 personal fouls)

[00:25] Team_036 possession (Score: 27-25)
Giannis Booker throws a bad pass out of bounds! TURNOVER! (dead ball)

[00:25] Substitution (Team_099): Ayo Barrett OUT → CJ Cunningham IN (stamina_rule2)

[00:25] Substitution (Team_099): Larry James OUT → Manu Johnson IN (stamina_rule2)

[00:25] Substitution (Team_099): Damian Ginobili OUT → Scottie Quickley IN (stamina_rule2)

[00:25] Substitution (Team_099): Vince Lillard OUT → Donovan Green IN (stamina_rule2)

[00:25] Substitution (Team_099): Larry Wade OUT → Jarrett Fox IN (stamina_rule2)

[00:25] Substitution (Team_036): Michael Westbrook OUT → Dirk Anunoby IN (stamina_rule2)

[00:25] Substitution (Team_036): Giannis Booker OUT → Tobias Fox IN (stamina_rule2)

[00:25] Substitution (Team_036): Anthony Poole OUT → Pascal Antetokounmpo IN (stamina_rule2)

[00:25] Substitution (Team_036): Terry Durant OUT → Devin Simmons IN (stamina_rule2)

[00:25] Substitution (Team_036): Kobe Simmons OUT → Bradley Murray IN (stamina_rule2)

[00:13] Team_099 possession (Score: 27-25)
Manu Johnson attempts a Layup. Contested by Devin Simmons (5.3 feet, ZONE). MANU JOHNSON MAKES IT!
Score: 29-25

================================================================================
                              1ST QUARTER COMPLETE                              
================================================================================

1ST QUARTER SCORE: Team_099 29, Team_036 25

BOX SCORE:
================================================================================

Team_099
--------------------------------------------------------------------------------
Player                MIN  PTS  REB  AST  TO      FG   FG%      3P   3P%
--------------------------------------------------------------------------------
Vince Lillard          12   10    8    0   0   5/5   100.0     0/0   0.0
Ayo Barrett            12    5    0    2   0   2/4    50.0     0/0   0.0
Damian Ginobili        12    5    4    0   0   2/4    50.0     0/0   0.0
Larry Wade             12    4    1    3   0   2/5    40.0     0/0   0.0
Larry James            12    3    0    2   0   1/1   100.0     0/0   0.0
Manu Johnson            0    2    0    0   0   1/1   100.0     0/0   0.0

TEAM: FG: 13/20 (65.0%), 3PT: 2/6 (33.3%), REB: 13 (3 off, 10 def), AST: 7, TO: 4
TEAM FOULS: 4


Team_036
--------------------------------------------------------------------------------
Player                MIN  PTS  REB  AST  TO      FG   FG%      3P   3P%
--------------------------------------------------------------------------------
Kobe Simmons           12    7    3    2   0   3/5    60.0     0/0   0.0
Giannis Booker         12    6    1    0   0   2/5    40.0     0/0   0.0
Anthony Poole          12    5    0    0   0   2/6    33.3     0/0   0.0
Terry Durant           12    5    4    1   0   2/3    66.7     0/0   0.0
Michael Westbrook      12    2    0    0   0   1/2    50.0     0/0   0.0

TEAM: FG: 10/21 (47.6%), 3PT: 3/7 (42.9%), REB: 8 (2 off, 6 def), AST: 3, TO: 2
TEAM FOULS: 4

================================================================================

================================================================================
                       2ND QUARTER - Team_099 vs Team_036                       
================================================================================

[12:00] Team_099 possession (Score: 29-25)
Larry James attempts a Layup. BLOCKED BY ANTHONY POOLE! Ball is loose! Offensive rebound by Larry Wade! Larry Wade kicks it out.

[11:44] Team_099 possession (Score: 29-25)
Ayo Barrett attempts a 3Pt. Contested by Michael Westbrook (5.0 feet, ZONE). Ayo Barrett misses. Rebound secured by Kobe Simmons.

[11:29] Team_036 possession (Score: 29-25)
Anthony Poole attempts a Midrange. Contested by Damian Ginobili (4.6 feet, MAN). Anthony Poole misses. FOUL! Loose ball foul on Larry Wade during the rebound battle. [Team fouls: 1] No free throws, side out. (Larry Wade: 1 personal fouls)

[11:11] Team_036 possession (Score: 29-25)
Terry Durant attempts a Midrange. Contested by Vince Lillard (3.4 feet, MAN). Terry Durant misses. Rebound secured by Vince Lillard.

[10:54] Team_099 possession (Score: 29-25)
FOUL! Shooting foul on Giannis Booker. Larry James to the line for 2 free throws. [Team fouls: 1] (Giannis Booker: 1 personal fouls)   FT 1/2: GOOD   FT 2/2: GOOD Larry James makes 2/2 from the line.
Score: 31-25

[10:38] Team_036 possession (Score: 31-25)
Kobe Simmons makes the Layup and draws the foul on Larry Wade! And-1! Kobe Simmons to the line for 1. [Team fouls: 2] (Larry Wade: 2 personal fouls)   FT 1/1: GOOD Kobe Simmons makes 1/1 from the line.
Score: 31-28

[10:22] Team_099 possession (Score: 31-28)
Damian Ginobili drives to the basket... FOUL! Offensive foul on Damian Ginobili! Kobe Simmons drew the charge! [Team fouls: 3] (Damian Ginobili: 1 personal fouls) TURNOVER! (dead ball)

[10:08] Team_036 possession (Score: 31-28)
Michael Westbrook throws a bad pass! Stolen by Ayo Barrett! TURNOVER! (live ball)

[09:53] Team_099 possession (Score: 31-28)
Vince Lillard makes the Layup and draws the foul on Terry Durant! And-1! Vince Lillard to the line for 1. [Team fouls: 2] (Terry Durant: 1 personal fouls)   FT 1/1: MISS Vince Lillard makes 0/1 from the line. Rebound secured by Terry Durant.
Score: 33-28

[09:36] Team_036 possession (Score: 33-28)
Kobe Simmons attempts a Midrange. Contested by Larry Wade (5.1 feet, MAN). Kobe Simmons misses. Rebound secured by Larry Wade.

[09:19] Team_099 possession (Score: 33-28)
FOUL! Reach-in foul on Kobe Simmons during the drive. [Team fouls: 3] No free throws, side out. (Kobe Simmons: 1 personal fouls)

[09:04] Team_099 possession (Score: 33-28)
Larry James attempts a Midrange. Contested by Giannis Booker (5.1 feet, ZONE). Larry James misses. Offensive rebound by Larry Wade! Larry Wade kicks it out.

[08:52] Team_099 possession (Score: 33-28)
Ayo Barrett drives, Kobe Simmons stays with him. Ayo Barrett attempts a Layup. Contested by Kobe Simmons (4.3 feet, ZONE). Ayo Barrett misses. Offensive rebound by Larry Wade! Larry Wade kicks it out.

[08:35] Team_099 possession (Score: 33-28)
Larry Wade drives, picks up Kobe Simmons. Help arrives from Giannis Booker! Larry Wade attempts a Layup. Contested by Giannis Booker (4.5 feet, MAN). Larry Wade misses. Rebound secured by Kobe Simmons.

[08:21] Team_036 possession (Score: 33-28)
Terry Durant drives and kicks out. Terry Durant attempts a 3Pt. Contested by Ayo Barrett (4.4 feet, ZONE). Terry Durant misses. Rebound secured by Larry Wade.

[08:08] Team_099 possession (Score: 33-28)
Larry James makes the Layup and draws the foul on Giannis Booker! And-1! Larry James to the line for 1. [Team fouls: 4] (Giannis Booker: 2 personal fouls)   FT 1/1: GOOD Larry James makes 1/1 from the line.
Score: 36-28

[07:52] Team_036 possession (Score: 36-28)
Anthony Poole attempts a Midrange. Contested by Damian Ginobili (4.9 feet, MAN). Anthony Poole misses. Rebound secured by Vince Lillard.

[07:38] Team_099 possession (Score: 36-28)
Larry Wade drives, Kobe Simmons stays with him. Larry Wade attempts a Dunk. Contested by Kobe Simmons (4.6 feet, MAN). Larry Wade misses. FOUL! Loose ball foul on Kobe Simmons during the rebound battle. [IN THE BONUS! 5 team fouls] Larry Wade to the line for 2 free throws. (Kobe Simmons: 2 personal fouls)   FT 1/2: GOOD   FT 2/2: MISS Larry Wade makes 1/2 from the line. Offensive rebound by Vince Lillard! Vince Lillard puts it back in!
Score: 39-28

[07:23] Team_036 possession (Score: 39-28)
Kobe Simmons drives to the basket... Kobe Simmons commits a violation (traveling/carry)! TURNOVER! (dead ball)

[07:23] Substitution (Team_099): Ayo Barrett OUT → CJ Cunningham IN (stamina_rule2)

[07:23] Substitution (Team_099): Larry James OUT → Manu Johnson IN (stamina_rule2)

[07:23] Substitution (Team_099): Damian Ginobili OUT → Scottie Quickley IN (stamina_rule2)

[07:23] Substitution (Team_099): Vince Lillard OUT → Donovan Green IN (stamina_rule2)

[07:23] Substitution (Team_099): Larry Wade OUT → Jarrett Fox IN (stamina_rule2)

[07:23] Substitution (Team_036): Michael Westbrook OUT → Dirk Anunoby IN (stamina_rule2)

[07:23] Substitution (Team_036): Giannis Booker OUT → Tobias Fox IN (stamina_rule2)

[07:23] Substitution (Team_036): Anthony Poole OUT → Pascal Antetokounmpo IN (stamina_rule2)

[07:23] Substitution (Team_036): Terry Durant OUT → Devin Simmons IN (stamina_rule2)

[07:23] Substitution (Team_036): Kobe Simmons OUT → Bradley Murray IN (stamina_rule2)

[07:11] Team_099 possession (Score: 39-28)
Manu Johnson drives, Tobias Fox stays with him. Manu Johnson attempts a Dunk. Contested by Tobias Fox (4.6 feet, MAN). MANU JOHNSON MAKES IT! Assist: Scottie Quickley
Score: 41-28

[06:56] Team_036 possession (Score: 41-28)
Pascal Antetokounmpo drives, picks up Scottie Quickley. Help arrives from Manu Johnson! Pascal Antetokounmpo attempts a Dunk. Contested by Manu Johnson (4.3 feet, MAN). Pascal Antetokounmpo misses. Rebound secured by Donovan Green.

[06:45] Team_099 possession (Score: 41-28)
Jarrett Fox drives, Bradley Murray stays with him. Jarrett Fox attempts a Layup. Contested by Bradley Murray (5.1 feet, MAN). JARRETT FOX MAKES IT!
Score: 43-28

[06:28] Team_036 possession (Score: 43-28)
Pascal Antetokounmpo attempts a Layup. Contested by Jarrett Fox (4.2 feet, ZONE). PASCAL ANTETOKOUNMPO MAKES IT!
Score: 43-30

[06:10] Team_099 possession (Score: 43-30)
Manu Johnson attempts a 3Pt. Contested by Tobias Fox (4.6 feet, ZONE). Manu Johnson misses. Rebound secured by Devin Simmons.

[06:01] Team_036 possession (Score: 43-30)
Bradley Murray attempts a Layup. Contested by Jarrett Fox (3.9 feet, ZONE). Bradley Murray misses. FOUL! Loose ball foul on Scottie Quickley during the rebound battle. [Team fouls: 4] No free throws, side out. (Scottie Quickley: 1 personal fouls)

[05:43] Team_036 possession (Score: 43-30)
Pascal Antetokounmpo throws a bad pass out of bounds! TURNOVER! (dead ball)

[05:33] Team_099 possession (Score: 43-30)
FOUL! Reach-in foul on Pascal Antetokounmpo during the drive. [IN THE BONUS! 6 team fouls] Scottie Quickley to the line for 2 free throws. (Pascal Antetokounmpo: 1 personal fouls)   FT 1/2: GOOD   FT 2/2: MISS Scottie Quickley makes 1/2 from the line. Rebound secured by Bradley Murray.
Score: 44-30

[05:21] Team_036 possession (Score: 44-30)
Dirk Anunoby attempts a 3Pt. Wide open! CJ Cunningham is 6.2 feet away. [MAN] Dirk Anunoby misses. Offensive rebound by Bradley Murray! Bradley Murray kicks it out.

[05:07] Team_036 possession (Score: 44-30)
Bradley Murray attempts a Layup. Contested by Jarrett Fox (3.9 feet, MAN). BRADLEY MURRAY MAKES IT!
Score: 44-32

[04:56] Team_099 possession (Score: 44-32)
FOUL! Reach-in foul on Devin Simmons during the drive. [IN THE BONUS! 7 team fouls] Jarrett Fox to the line for 2 free throws. (Devin Simmons: 1 personal fouls)   FT 1/2: GOOD   FT 2/2: GOOD Jarrett Fox makes 2/2 from the line.
Score: 46-32

[04:40] Team_036 possession (Score: 46-32)
Bradley Murray attempts a Layup. Contested by Jarrett Fox (3.9 feet, ZONE). BRADLEY MURRAY MAKES IT! Assist: Pascal Antetokounmpo
Score: 46-34

[04:28] Team_099 possession (Score: 46-34)
Manu Johnson attempts a 3Pt. Contested by Tobias Fox (4.6 feet, MAN). Manu Johnson misses. Rebound secured by Devin Simmons.

[04:15] Team_036 possession (Score: 46-34)
Dirk Anunoby throws a bad pass out of bounds! TURNOVER! (dead ball)

[04:04] Team_099 possession (Score: 46-34)
Scottie Quickley attempts a 3Pt. Contested by Tobias Fox (4.8 feet, ZONE). Scottie Quickley misses. Offensive rebound by Donovan Green! Donovan Green kicks it out.

[03:49] Team_099 possession (Score: 46-34)
Jarrett Fox drives to the basket... Jarrett Fox loses control! Ball rolls out of bounds! TURNOVER! (dead ball)

[03:35] Team_036 possession (Score: 46-34)
Bradley Murray drives and kicks out. Bradley Murray attempts a Midrange. Contested by Jarrett Fox (4.0 feet, MAN). Bradley Murray misses. Rebound secured by Donovan Green.

[03:21] Team_099 possession (Score: 46-34)
CJ Cunningham drives, picks up Dirk Anunoby. Help arrives from Pascal Antetokounmpo! CJ Cunningham attempts a Layup. Contested by Pascal Antetokounmpo (5.8 feet, MAN). CJ CUNNINGHAM MAKES IT! Assist: Manu Johnson
Score: 48-34

[03:10] Team_036 possession (Score: 48-34)
Tobias Fox drives and kicks out. Devin Simmons attempts a 3Pt. Contested by Donovan Green (3.9 feet, MAN). Devin Simmons misses. Rebound secured by Scottie Quickley.

[02:54] Team_099 possession (Score: 48-34)
Manu Johnson attempts a Layup. Contested by Bradley Murray (4.7 feet, ZONE). MANU JOHNSON MAKES IT! Assist: Jarrett Fox
Score: 50-34

[02:38] Team_036 possession (Score: 50-34)
Bradley Murray drives to the basket... Bradley Murray loses the ball! Stripped by Jarrett Fox! TURNOVER! (live ball)

[02:22] Team_099 possession (Score: 50-34)
Scottie Quickley drives, Pascal Antetokounmpo stays with him. Scottie Quickley attempts a Layup. Contested by Pascal Antetokounmpo (5.1 feet, MAN). SCOTTIE QUICKLEY MAKES IT! Assist: CJ Cunningham
Score: 52-34

[02:08] Team_036 possession (Score: 52-34)
Dirk Anunoby drives, Jarrett Fox stays with him. Dirk Anunoby attempts a Dunk. Contested by Jarrett Fox (4.4 feet, ZONE). DIRK ANUNOBY MAKES IT! Assist: Devin Simmons
Score: 52-36

[01:54] Team_099 possession (Score: 52-36)
Manu Johnson attempts a 3Pt. Contested by Tobias Fox (4.6 feet, MAN). MANU JOHNSON MAKES IT! Assist: Donovan Green
Score: 55-36

[01:38] Team_036 possession (Score: 55-36)
Devin Simmons drives, Donovan Green stays with him. Devin Simmons attempts a Layup. Contested by Donovan Green (4.0 feet, MAN). DEVIN SIMMONS MAKES IT! Assist: Dirk Anunoby
Score: 55-38

[01:26] Team_099 possession (Score: 55-38)
Donovan Green attempts a Midrange. Contested by Tobias Fox (4.7 feet, ZONE). Donovan Green misses. Rebound secured by Devin Simmons.

[01:11] Team_036 possession (Score: 55-38)
Bradley Murray drives and kicks out. Tobias Fox attempts a 3Pt. Contested by Manu Johnson (4.9 feet, MAN). Tobias Fox misses. Rebound secured by Jarrett Fox.

[01:01] Team_099 possession (Score: 55-38)
Jarrett Fox attempts a Midrange. Contested by Bradley Murray (5.1 feet, MAN). Jarrett Fox misses. Rebound secured by Pascal Antetokounmpo.

[00:49] Team_036 possession (Score: 55-38)
Devin Simmons drives and kicks out. Bradley Murray attempts a 3Pt. Contested by Manu Johnson (4.9 feet, ZONE). Bradley Murray misses. Rebound secured by Donovan Green.

[00:35] Team_099 possession (Score: 55-38)
Donovan Green attempts a Layup. BLOCKED BY DEVIN SIMMONS! Ball is loose! Rebound secured by Bradley Murray.

[00:19] Team_036 possession (Score: 55-38)
Devin Simmons attempts a Midrange. Contested by Donovan Green (4.1 feet, MAN). Devin Simmons misses. Rebound secured by Scottie Quickley.

[00:02] Team_099 possession (Score: 55-38)
CJ Cunningham attempts a 3Pt. Contested by Dirk Anunoby (5.8 feet, MAN). CJ CUNNINGHAM MAKES IT! Assist: Manu Johnson
Score: 58-38

================================================================================
                              2ND QUARTER COMPLETE                              
================================================================================

2ND QUARTER SCORE: Team_099 29, Team_036 13

BOX SCORE:
================================================================================

Team_099
--------------------------------------------------------------------------------
Player                MIN  PTS  REB  AST  TO      FG   FG%      3P   3P%
--------------------------------------------------------------------------------
Manu Johnson            8    7    0    2   0   3/5    60.0     0/0   0.0
Larry James            17    5    0    0   0   2/2   100.0     0/0   0.0
CJ Cunningham           8    5    0    1   0   2/2   100.0     0/0   0.0
Jarrett Fox             8    4    1    1   0   2/3    66.7     0/0   0.0
Vince Lillard          17    3    3    0   0   1/2    50.0     0/0   0.0
Scottie Quickley        8    2    2    1   0   1/2    50.0     0/0   0.0
Larry Wade             17    0    5    0   0   0/1     0.0     0/0   0.0
Ayo Barrett            17    0    0    0   0   0/1     0.0     0/0   0.0
Donovan Green           8    0    4    1   0   0/2     0.0     0/0   0.0

TEAM: FG: 11/20 (55.0%), 3PT: 2/5 (40.0%), REB: 15 (5 off, 10 def), AST: 6, TO: 2
TEAM FOULS: 4


Team_036
--------------------------------------------------------------------------------
Player                MIN  PTS  REB  AST  TO      FG   FG%      3P   3P%
--------------------------------------------------------------------------------
Bradley Murray          8    4    3    0   0   2/4    50.0     0/0   0.0
Kobe Simmons           17    3    2    0   0   1/2    50.0     0/0   0.0
Pascal Antetokounmpo    8    2    1    1   0   1/2    50.0     0/0   0.0
Devin Simmons           8    2    4    1   0   1/3    33.3     0/0   0.0
Dirk Anunoby            8    2    0    1   0   1/1   100.0     0/0   0.0
Terry Durant           17    0    2    0   0   0/2     0.0     0/0   0.0
Anthony Poole          17    0    0    0   0   0/1     0.0     0/0   0.0
Tobias Fox              8    0    0    0   0   0/1     0.0     0/0   0.0

TEAM: FG: 6/16 (37.5%), 3PT: 0/0 (0.0%), REB: 12 (3 off, 9 def), AST: 3, TO: 5
TEAM FOULS: 7 [Team_099 in BONUS]

================================================================================

================================================================================
                       3RD QUARTER - Team_099 vs Team_036                       
================================================================================

[12:00] Team_099 possession (Score: 58-38)
Larry Wade makes the Layup and draws the foul on Kobe Simmons! And-1! Larry Wade to the line for 1. [Team fouls: 1] (Kobe Simmons: 1 personal fouls)   FT 1/1: GOOD Larry Wade makes 1/1 from the line.
Score: 61-38

[11:43] Team_036 possession (Score: 61-38)
FOUL! Holding foul on Larry Wade. [Team fouls: 1] No free throws, side out. (Larry Wade: 1 personal fouls)

[11:30] Team_036 possession (Score: 61-38)
FOUL! Reach-in foul on Vince Lillard during the drive. [Team fouls: 2] No free throws, side out. (Vince Lillard: 1 personal fouls)

[11:20] Team_036 possession (Score: 61-38)
Giannis Booker drives, Larry James stays with him. Giannis Booker attempts a Dunk. Contested by Larry James (5.5 feet, MAN). Giannis Booker misses. Rebound secured by Larry Wade.

[11:05] Team_099 possession (Score: 61-38)
Ayo Barrett attempts a 3Pt. Contested by Michael Westbrook (4.8 feet, ZONE). Ayo Barrett misses. Offensive rebound by Larry Wade! Larry Wade's putback is no good. Offensive rebound by Larry Wade! Larry Wade kicks it out.

[10:47] Team_099 possession (Score: 61-38)
Vince Lillard drives, picks up Kobe Simmons. Help arrives from Giannis Booker! Vince Lillard attempts a Dunk. Contested by Giannis Booker (3.5 feet, ZONE). VINCE LILLARD MAKES IT! Assist: Larry Wade
Score: 63-38

[10:33] Team_036 possession (Score: 63-38)
Anthony Poole attempts a Midrange. Contested by Damian Ginobili (4.3 feet, MAN). Anthony Poole misses. Rebound secured by Larry Wade.

[10:18] Team_099 possession (Score: 63-38)
FOUL! Reach-in foul on Giannis Booker during the drive. [Team fouls: 2] No free throws, side out. (Giannis Booker: 1 personal fouls)

[10:07] Team_099 possession (Score: 63-38)
Vince Lillard attempts a Midrange. Contested by Terry Durant (4.5 feet, MAN). VINCE LILLARD MAKES IT! Assist: Larry James
Score: 65-38

[09:53] Team_036 possession (Score: 65-38)
FOUL! Holding foul on Ayo Barrett. [Team fouls: 3] No free throws, side out. (Ayo Barrett: 1 personal fouls)

[09:37] Team_036 possession (Score: 65-38)
Anthony Poole attempts a 3Pt. Contested by Damian Ginobili (4.3 feet, MAN). Anthony Poole misses. Rebound secured by Damian Ginobili.

[09:23] Team_099 possession (Score: 65-38)
Larry Wade drives, picks up Kobe Simmons. Help arrives from Giannis Booker! Larry Wade attempts a Dunk. Contested by Giannis Booker (3.8 feet, MAN). LARRY WADE MAKES IT!
Score: 67-38

[09:09] Team_036 possession (Score: 67-38)
Giannis Booker attempts a Midrange. Contested by Ayo Barrett (4.1 feet, ZONE). GIANNIS BOOKER MAKES IT! Assist: Terry Durant
Score: 67-40

[08:54] Team_099 possession (Score: 67-40)
Larry Wade loses the ball! Stripped by Kobe Simmons! TURNOVER! (live ball)

[08:40] Team_036 possession (Score: 67-40)
Anthony Poole drives to the basket... Anthony Poole commits a violation (traveling/carry)! TURNOVER! (dead ball)

[08:23] Team_099 possession (Score: 67-40)
Damian Ginobili attempts a 3Pt. Contested by Anthony Poole (5.1 feet, MAN). Damian Ginobili misses. Rebound secured by Kobe Simmons.

[08:06] Team_036 possession (Score: 67-40)
Giannis Booker attempts a 3Pt. Contested by Larry James (5.5 feet, MAN). Giannis Booker misses. Rebound secured by Vince Lillard.

[07:54] Team_099 possession (Score: 67-40)
Larry Wade loses control! Ball rolls out of bounds! TURNOVER! (dead ball)

[07:37] Team_036 possession (Score: 67-40)
Kobe Simmons attempts a 3Pt. Contested by Ayo Barrett (4.1 feet, ZONE). Kobe Simmons misses. Offensive rebound by Kobe Simmons! Kobe Simmons puts it back in!
Score: 67-42

[07:19] Team_099 possession (Score: 67-42)
Damian Ginobili attempts a 3Pt. Contested by Michael Westbrook (4.9 feet, ZONE). Damian Ginobili misses. Rebound secured by Kobe Simmons.

[07:05] Team_036 possession (Score: 67-42)
FOUL! Shooting foul on Larry James. Kobe Simmons to the line for 2 free throws. [Team fouls: 4] (Larry James: 1 personal fouls)   FT 1/2: GOOD   FT 2/2: GOOD Kobe Simmons makes 2/2 from the line.
Score: 67-44

[06:48] Team_099 possession (Score: 67-44)
Larry James drives, Giannis Booker stays with him. Larry James attempts a Layup. Contested by Giannis Booker (4.7 feet, MAN). LARRY JAMES MAKES IT! Assist: Ayo Barrett
Score: 69-44

[06:36] Team_036 possession (Score: 69-44)
Giannis Booker drives, Vince Lillard stays with him. Giannis Booker attempts a Layup. Contested by Vince Lillard (2.9 feet, ZONE). Giannis Booker misses. Offensive rebound by Kobe Simmons! Kobe Simmons puts it back in!
Score: 69-46

[06:17] Team_099 possession (Score: 69-46)
Larry Wade attempts a Layup. Contested by Kobe Simmons (3.8 feet, MAN). Larry Wade misses. Offensive rebound by Vince Lillard! Vince Lillard puts it back in!
Score: 71-46

[06:03] Team_036 possession (Score: 71-46)
Michael Westbrook drives, Vince Lillard stays with him. Michael Westbrook attempts a Layup. Contested by Vince Lillard (3.0 feet, ZONE). MICHAEL WESTBROOK MAKES IT! Assist: Terry Durant
Score: 71-48

[05:48] Team_099 possession (Score: 71-48)
Larry Wade throws a bad pass! Stolen by Kobe Simmons! TURNOVER! (live ball)

[05:30] Team_036 possession (Score: 71-48)
Giannis Booker attempts a Layup. BLOCKED BY VINCE LILLARD! Ball goes out off Vince Lillard. Giannis Booker's ball!

[05:18] Team_036 possession (Score: 71-48)
Terry Durant attempts a Midrange. Contested by Larry James (5.5 feet, ZONE). Terry Durant misses. Rebound secured by Vince Lillard.

[05:01] Team_099 possession (Score: 71-48)
Larry Wade attempts a Midrange. Contested by Giannis Booker (4.9 feet, ZONE). Larry Wade misses. Rebound secured by Kobe Simmons.

[04:43] Team_036 possession (Score: 71-48)
Giannis Booker attempts a Layup. Contested by Larry James (5.5 feet, MAN). Giannis Booker misses. Rebound secured by Larry Wade.

[04:27] Team_099 possession (Score: 71-48)
Larry James attempts a Midrange. Contested by Giannis Booker (4.7 feet, ZONE). LARRY JAMES MAKES IT!
Score: 73-48

[04:16] Team_036 possession (Score: 73-48)
Giannis Booker attempts a Layup. BLOCKED BY LARRY JAMES! Ball is loose! Rebound secured by Vince Lillard.

[04:03] Team_099 possession (Score: 73-48)
Larry Wade drives to the basket... FOUL! Offensive foul on Larry Wade! Kobe Simmons drew the charge! [Team fouls: 5] (Larry Wade: 2 personal fouls) TURNOVER! (dead ball)

[03:48] Team_036 possession (Score: 73-48)
Michael Westbrook attempts a 3Pt. Contested by Ayo Barrett (4.3 feet, MAN). Michael Westbrook misses. Rebound secured by Vince Lillard.

[03:34] Team_099 possession (Score: 73-48)
Damian Ginobili attempts a 3Pt. Contested by Anthony Poole (5.2 feet, MAN). Damian Ginobili misses. Offensive rebound by Vince Lillard! Vince Lillard puts it back in!
Score: 75-48

[03:19] Team_036 possession (Score: 75-48)
Michael Westbrook attempts a 3Pt. Contested by Ayo Barrett (4.3 feet, MAN). Michael Westbrook misses. Rebound secured by Damian Ginobili.

[03:06] Team_099 possession (Score: 75-48)
Vince Lillard drives and kicks out. Damian Ginobili attempts a 3Pt. Contested by Anthony Poole (5.0 feet, MAN). DAMIAN GINOBILI MAKES IT! Assist: Larry Wade
Score: 78-48

[02:49] Team_036 possession (Score: 78-48)
Anthony Poole attempts a 3Pt. Contested by Ayo Barrett (4.6 feet, ZONE). Anthony Poole misses. Rebound secured by Vince Lillard.

[02:33] Team_099 possession (Score: 78-48)
Ayo Barrett drives, Michael Westbrook stays with him. Ayo Barrett attempts a Dunk. Contested by Michael Westbrook (5.0 feet, MAN). Ayo Barrett misses. Offensive rebound by Larry Wade! Larry Wade kicks it out.

[02:19] Team_099 possession (Score: 78-48)
Larry Wade attempts a Midrange. Contested by Terry Durant (5.0 feet, ZONE). Larry Wade misses. Rebound secured by Terry Durant.

[02:02] Team_036 possession (Score: 78-48)
FOUL! Holding foul on Damian Ginobili. [IN THE BONUS! 6 team fouls] Anthony Poole to the line for 2 free throws. (Damian Ginobili: 1 personal fouls)   FT 1/2: GOOD   FT 2/2: GOOD Anthony Poole makes 2/2 from the line.
Score: 78-50

[01:51] Team_099 possession (Score: 78-50)
Larry Wade drives to the basket... Larry Wade throws a bad pass out of bounds! TURNOVER! (dead ball)

[01:51] Substitution (Team_099): Damian Ginobili OUT → Scottie Quickley IN (stamina_rule2)

[01:51] Substitution (Team_099): Vince Lillard OUT → Donovan Green IN (stamina_rule2)

[01:51] Substitution (Team_099): Larry Wade OUT → Jarrett Fox IN (stamina_rule2)

[01:51] Substitution (Team_036): Michael Westbrook OUT → Dirk Anunoby IN (stamina_rule2)

[01:51] Substitution (Team_036): Anthony Poole OUT → Pascal Antetokounmpo IN (stamina_rule2)

[01:51] Substitution (Team_036): Terry Durant OUT → Devin Simmons IN (stamina_rule2)

[01:51] Substitution (Team_036): Kobe Simmons OUT → Bradley Murray IN (stamina_rule2)

[01:37] Team_036 possession (Score: 78-50)
Dirk Anunoby drives, Jarrett Fox stays with him. Dirk Anunoby attempts a Layup. Contested by Jarrett Fox (4.4 feet, ZONE). DIRK ANUNOBY MAKES IT! Assist: Devin Simmons
Score: 78-52

[01:20] Team_099 possession (Score: 78-52)
Donovan Green attempts a 3Pt. Contested by Devin Simmons (5.4 feet, MAN). DONOVAN GREEN MAKES IT! Assist: Jarrett Fox
Score: 81-52

[01:04] Team_036 possession (Score: 81-52)
Dirk Anunoby attempts a 3Pt. Contested by Ayo Barrett (4.5 feet, MAN). Dirk Anunoby misses. Rebound secured by Jarrett Fox.

[00:47] Team_099 possession (Score: 81-52)
FOUL! Reach-in foul on Bradley Murray during the drive. [Team fouls: 3] No free throws, side out. (Bradley Murray: 1 personal fouls)

[00:32] Team_099 possession (Score: 81-52)
Ayo Barrett drives, picks up Devin Simmons. Help arrives from Giannis Booker! Ayo Barrett attempts a Layup. Contested by Giannis Booker (5.3 feet, ZONE). Ayo Barrett misses. Offensive rebound by Donovan Green! Donovan Green kicks it out.

[00:16] Team_099 possession (Score: 81-52)
Ayo Barrett attempts a Midrange. Contested by Dirk Anunoby (5.6 feet, MAN). AYO BARRETT MAKES IT!
Score: 83-52

[00:01] Team_036 possession (Score: 83-52)
Giannis Booker attempts a 3Pt. Contested by Ayo Barrett (4.5 feet, ZONE). Giannis Booker misses. Rebound secured by Jarrett Fox.

================================================================================
                              3RD QUARTER COMPLETE                              
================================================================================

3RD QUARTER SCORE: Team_099 25, Team_036 14

BOX SCORE:
================================================================================

Team_099
--------------------------------------------------------------------------------
Player                MIN  PTS  REB  AST  TO      FG   FG%      3P   3P%
--------------------------------------------------------------------------------
Vince Lillard          27    8    7    0   0   4/4   100.0     0/0   0.0
Larry Wade             27    5    5    2   0   2/4    50.0     0/0   0.0
Larry James            29    4    0    1   0   2/2   100.0     0/0   0.0
Damian Ginobili        27    3    2    0   0   1/3    33.3     0/0   0.0
Donovan Green           9    3    1    0   0   1/1   100.0     0/0   0.0
Ayo Barrett            29    2    0    1   0   1/1   100.0     0/0   0.0
Jarrett Fox             9    0    2    1   0   0/0     0.0     0/0   0.0

TEAM: FG: 11/15 (73.3%), 3PT: 2/4 (50.0%), REB: 17 (5 off, 12 def), AST: 5, TO: 5
TEAM FOULS: 6 [Team_036 in BONUS]


Team_036
--------------------------------------------------------------------------------
Player                MIN  PTS  REB  AST  TO      FG   FG%      3P   3P%
--------------------------------------------------------------------------------
Kobe Simmons           27    6    5    0   0   3/3   100.0     0/0   0.0
Giannis Booker         29    2    0    0   0   1/6    16.7     0/0   0.0
Anthony Poole          27    2    0    0   0   1/4    25.0     0/0   0.0
Michael Westbrook      27    2    0    0   0   1/3    33.3     0/0   0.0
Dirk Anunoby            9    2    0    0   0   1/2    50.0     0/0   0.0
Terry Durant           27    0    1    2   0   0/1     0.0     0/0   0.0
Devin Simmons           9    0    0    1   0   0/0     0.0     0/0   0.0

TEAM: FG: 7/19 (36.8%), 3PT: 1/8 (12.5%), REB: 6 (2 off, 4 def), AST: 3, TO: 1
TEAM FOULS: 3

================================================================================

================================================================================
                       4TH QUARTER - Team_099 vs Team_036                       
================================================================================

[12:00] Team_099 possession (Score: 83-52)
Larry Wade drives and kicks out. Damian Ginobili attempts a 3Pt. Contested by Anthony Poole (4.9 feet, MAN). Damian Ginobili misses. Rebound secured by Terry Durant.

[11:45] Team_036 possession (Score: 83-52)
Giannis Booker attempts a Layup. BLOCKED BY DAMIAN GINOBILI! Ball is loose! Rebound secured by Damian Ginobili.

[11:30] Team_099 possession (Score: 83-52)
Larry James attempts a 3Pt. Contested by Giannis Booker (4.9 feet, ZONE). Larry James misses. Rebound secured by Terry Durant.

[11:15] Team_036 possession (Score: 83-52)
Giannis Booker attempts a 3Pt. Contested by Ayo Barrett (4.4 feet, ZONE). GIANNIS BOOKER MAKES IT! Assist: Terry Durant
Score: 83-55

[10:57] Team_099 possession (Score: 83-55)
Vince Lillard attempts a Midrange. Contested by Anthony Poole (5.0 feet, ZONE). Vince Lillard misses. Rebound secured by Anthony Poole.

[10:44] Team_036 possession (Score: 83-55)
Michael Westbrook attempts a 3Pt. Contested by Ayo Barrett (4.6 feet, MAN). Michael Westbrook misses. Rebound secured by Damian Ginobili.

[10:30] Team_099 possession (Score: 83-55)
Ayo Barrett attempts a Midrange. Contested by Giannis Booker (5.0 feet, ZONE). Ayo Barrett misses. Rebound secured by Anthony Poole.

[10:12] Team_036 possession (Score: 83-55)
Anthony Poole attempts a Midrange. Contested by Larry Wade (5.1 feet, ZONE). Anthony Poole misses. Rebound secured by Damian Ginobili.

[09:58] Team_099 possession (Score: 83-55)
FOUL! Shooting foul on Terry Durant. Vince Lillard to the line for 3 free throws. [Team fouls: 1] (Terry Durant: 1 personal fouls)   FT 1/3: GOOD   FT 2/3: GOOD   FT 3/3: GOOD Vince Lillard makes 3/3 from the line.
Score: 86-55

[09:46] Team_036 possession (Score: 86-55)
Kobe Simmons attempts a Layup. Contested by Larry Wade (4.8 feet, MAN). KOBE SIMMONS MAKES IT! Assist: Anthony Poole
Score: 86-57

[09:29] Team_099 possession (Score: 86-57)
Larry James attempts a 3Pt. Contested by Giannis Booker (5.1 feet, MAN). Larry James misses. Rebound secured by Kobe Simmons.

[09:14] Team_036 possession (Score: 86-57)
Terry Durant attempts a Midrange. Contested by Larry James (6.0 feet, ZONE). Terry Durant misses. Offensive rebound by Kobe Simmons! Kobe Simmons's putback is no good. Rebound secured by Larry Wade.

[08:57] Team_099 possession (Score: 86-57)
Larry James drives, picks up Kobe Simmons. Help arrives from Giannis Booker! Larry James attempts a Layup. Contested by Giannis Booker (3.9 feet, ZONE). Larry James misses. Rebound secured by Terry Durant.

[08:42] Team_036 possession (Score: 86-57)
Giannis Booker attempts a 3Pt. Contested by Damian Ginobili (4.2 feet, ZONE). GIANNIS BOOKER MAKES IT! Assist: Anthony Poole
Score: 86-60

[08:27] Team_099 possession (Score: 86-60)
Larry James attempts a Midrange. Contested by Giannis Booker (5.2 feet, MAN). LARRY JAMES MAKES IT!
Score: 88-60

[08:11] Team_036 possession (Score: 88-60)
Terry Durant drives, picks up Vince Lillard. Help arrives from Ayo Barrett! Terry Durant attempts a Dunk. Contested by Ayo Barrett (3.4 feet, ZONE). TERRY DURANT MAKES IT! Assist: Anthony Poole
Score: 88-62

[07:57] Team_099 possession (Score: 88-62)
Larry James attempts a Midrange. Contested by Giannis Booker (5.2 feet, MAN). Larry James misses. Rebound secured by Kobe Simmons.

[07:42] Team_036 possession (Score: 88-62)
Anthony Poole drives to the basket... Anthony Poole throws a bad pass out of bounds! TURNOVER! (dead ball)

[07:42] Substitution (Team_099): Ayo Barrett OUT → CJ Cunningham IN (stamina_rule2)

[07:42] Substitution (Team_099): Larry James OUT → Manu Johnson IN (stamina_rule2)

[07:42] Substitution (Team_099): Damian Ginobili OUT → Scottie Quickley IN (stamina_rule2)

[07:42] Substitution (Team_099): Vince Lillard OUT → Donovan Green IN (stamina_rule2)

[07:42] Substitution (Team_099): Larry Wade OUT → Jarrett Fox IN (stamina_rule2)

[07:42] Substitution (Team_036): Michael Westbrook OUT → Dirk Anunoby IN (stamina_rule2)

[07:42] Substitution (Team_036): Giannis Booker OUT → Tobias Fox IN (stamina_rule2)

[07:42] Substitution (Team_036): Anthony Poole OUT → Pascal Antetokounmpo IN (stamina_rule2)

[07:42] Substitution (Team_036): Terry Durant OUT → Devin Simmons IN (stamina_rule2)

[07:42] Substitution (Team_036): Kobe Simmons OUT → Bradley Murray IN (stamina_rule2)

[07:28] Team_099 possession (Score: 88-62)
FOUL! Shooting foul on Devin Simmons. Manu Johnson to the line for 2 free throws. [Team fouls: 2] (Devin Simmons: 1 personal fouls)   FT 1/2: GOOD   FT 2/2: GOOD Manu Johnson makes 2/2 from the line.
Score: 90-62

[07:12] Team_036 possession (Score: 90-62)
FOUL! Holding foul on Scottie Quickley. [Team fouls: 1] No free throws, side out. (Scottie Quickley: 1 personal fouls)

[06:55] Team_036 possession (Score: 90-62)
FOUL! Reach-in foul on Jarrett Fox during the drive. [Team fouls: 2] No free throws, side out. (Jarrett Fox: 1 personal fouls)

[06:43] Team_036 possession (Score: 90-62)
Devin Simmons drives, picks up Jarrett Fox. Help arrives from Manu Johnson! Devin Simmons attempts a Layup. Contested by Manu Johnson (4.1 feet, ZONE). DEVIN SIMMONS MAKES IT!
Score: 90-64

[06:32] Team_099 possession (Score: 90-64)
Donovan Green attempts a 3Pt. Contested by Tobias Fox (4.7 feet, ZONE). Donovan Green misses. Rebound secured by Bradley Murray.

[06:17] Team_036 possession (Score: 90-64)
Devin Simmons attempts a Layup. Contested by Jarrett Fox (4.1 feet, ZONE). Devin Simmons misses. Rebound secured by Scottie Quickley.

[06:03] Team_099 possession (Score: 90-64)
Manu Johnson drives and kicks out. Manu Johnson attempts a Midrange. Contested by Tobias Fox (4.5 feet, MAN). Manu Johnson misses. Rebound secured by Devin Simmons.

[05:54] Team_036 possession (Score: 90-64)
Tobias Fox drives, picks up Jarrett Fox. Help arrives from Manu Johnson! Tobias Fox attempts a Dunk. Contested by Manu Johnson (4.4 feet, ZONE). TOBIAS FOX MAKES IT! Assist: Bradley Murray
Score: 90-66

[05:36] Team_099 possession (Score: 90-66)
Jarrett Fox drives, Devin Simmons stays with him. Jarrett Fox attempts a Layup. Contested by Devin Simmons (5.7 feet, ZONE). JARRETT FOX MAKES IT! Assist: Donovan Green
Score: 92-66

[05:24] Team_036 possession (Score: 92-66)
Tobias Fox attempts a Layup. Contested by Jarrett Fox (4.4 feet, ZONE). Tobias Fox misses. Rebound secured by Jarrett Fox.

[05:09] Team_099 possession (Score: 92-66)
Jarrett Fox attempts a Midrange. Contested by Tobias Fox (5.0 feet, ZONE). JARRETT FOX MAKES IT! Assist: CJ Cunningham
Score: 94-66

[04:56] Team_036 possession (Score: 94-66)
Dirk Anunoby attempts a Layup. Contested by Jarrett Fox (4.4 feet, ZONE). Dirk Anunoby misses. Rebound secured by Donovan Green.

[04:39] Team_099 possession (Score: 94-66)
Scottie Quickley attempts a Midrange. Contested by Pascal Antetokounmpo (5.1 feet, ZONE). SCOTTIE QUICKLEY MAKES IT! Assist: Manu Johnson
Score: 96-66

[04:27] Team_036 possession (Score: 96-66)
FOUL! Holding foul on Manu Johnson. [Team fouls: 3] No free throws, side out. (Manu Johnson: 1 personal fouls)

[04:11] Team_036 possession (Score: 96-66)
Tobias Fox attempts a Layup. Contested by Jarrett Fox (4.4 feet, ZONE). TOBIAS FOX MAKES IT!
Score: 96-68

[04:00] Team_099 possession (Score: 96-68)
Scottie Quickley makes the Midrange and draws the foul on Devin Simmons! And-1! Scottie Quickley to the line for 1. [Team fouls: 3] (Devin Simmons: 2 personal fouls)   FT 1/1: GOOD Scottie Quickley makes 1/1 from the line.
Score: 99-68

[03:46] Team_036 possession (Score: 99-68)
Pascal Antetokounmpo drives and kicks out. Bradley Murray attempts a Midrange. Contested by Jarrett Fox (4.0 feet, MAN). Bradley Murray misses. Rebound secured by Donovan Green.

[03:31] Team_099 possession (Score: 99-68)
Jarrett Fox attempts a 3Pt. Contested by Tobias Fox (5.0 feet, ZONE). Jarrett Fox misses. Rebound secured by Devin Simmons.

[03:19] Team_036 possession (Score: 99-68)
Tobias Fox drives, picks up Manu Johnson. Help arrives from Scottie Quickley! Tobias Fox attempts a Layup. Contested by Scottie Quickley (5.2 feet, MAN). Tobias Fox misses. Rebound secured by Scottie Quickley.

[03:03] Team_099 possession (Score: 99-68)
Manu Johnson attempts a 3Pt. Contested by Tobias Fox (4.6 feet, ZONE). Manu Johnson misses. Rebound secured by Pascal Antetokounmpo.

[02:51] Team_036 possession (Score: 99-68)
Pascal Antetokounmpo attempts a Layup. BLOCKED BY JARRETT FOX! Ball is loose! Offensive rebound by Devin Simmons! Devin Simmons kicks it out.

[02:31] Team_036 possession (Score: 99-68)
FOUL! Reach-in foul on Jarrett Fox during the drive. [Team fouls: 4] No free throws, side out. (Jarrett Fox: 2 personal fouls)

[02:16] Team_036 possession (Score: 99-68)
Pascal Antetokounmpo attempts a 3Pt. Contested by Scottie Quickley (4.3 feet, MAN). Pascal Antetokounmpo misses. Rebound secured by Scottie Quickley.

[02:03] Team_099 possession (Score: 99-68)
Scottie Quickley attempts a 3Pt. Contested by Dirk Anunoby (5.8 feet, ZONE). Scottie Quickley misses. Rebound secured by Bradley Murray.

[01:50] Team_036 possession (Score: 99-68)
Dirk Anunoby attempts a Midrange. Wide open! CJ Cunningham is 6.2 feet away. [MAN] DIRK ANUNOBY MAKES IT!
Score: 99-70

[01:31] Team_099 possession (Score: 99-70)
CJ Cunningham drives, Dirk Anunoby stays with him. CJ Cunningham attempts a Layup. Contested by Dirk Anunoby (5.8 feet, MAN). CJ Cunningham misses. Rebound secured by Devin Simmons.

[01:16] Team_036 possession (Score: 99-70)
Tobias Fox attempts a Midrange. Contested by Manu Johnson (5.3 feet, MAN). Tobias Fox misses. Rebound secured by Donovan Green.

[01:05] Team_099 possession (Score: 99-70)
Manu Johnson attempts a 3Pt. Contested by Tobias Fox (4.6 feet, ZONE). MANU JOHNSON MAKES IT! Assist: Scottie Quickley
Score: 102-70

[00:52] Team_036 possession (Score: 102-70)
FOUL! Shooting foul on Manu Johnson. Tobias Fox to the line for 2 free throws. [BONUS: 5 team fouls] (Manu Johnson: 2 personal fouls)   FT 1/2: GOOD   FT 2/2: GOOD Tobias Fox makes 2/2 from the line.
Score: 102-72

[00:40] Team_099 possession (Score: 102-72)
Manu Johnson attempts a 3Pt. Contested by Tobias Fox (4.6 feet, ZONE). Manu Johnson misses. Rebound secured by Bradley Murray.

[00:24] Team_036 possession (Score: 102-72)
Tobias Fox attempts a Midrange. Contested by Manu Johnson (5.3 feet, MAN). TOBIAS FOX MAKES IT!
Score: 102-74

[00:08] Team_099 possession (Score: 102-74)
Donovan Green drives and kicks out. Jarrett Fox attempts a 3Pt. Contested by Devin Simmons (5.4 feet, ZONE). Jarrett Fox misses. Rebound secured by Devin Simmons.

================================================================================
                              4TH QUARTER COMPLETE                              
================================================================================

4TH QUARTER SCORE: Team_099 19, Team_036 22

BOX SCORE:
================================================================================

Team_099
--------------------------------------------------------------------------------
Player                MIN  PTS  REB  AST  TO      FG   FG%      3P   3P%
--------------------------------------------------------------------------------
Manu Johnson           15    5    0    1   0   2/5    40.0     0/0   0.0
Scottie Quickley       17    5    3    1   0   2/3    66.7     0/0   0.0
Jarrett Fox            17    4    1    0   0   2/3    66.7     0/0   0.0
Vince Lillard          32    3    0    0   0   1/2    50.0     0/0   0.0
Larry James            33    2    0    0   0   1/5    20.0     0/0   0.0
Damian Ginobili        32    0    3    0   0   0/0     0.0     0/0   0.0
Ayo Barrett            33    0    0    0   0   0/1     0.0     0/0   0.0
Donovan Green          17    0    3    1   0   0/2     0.0     0/0   0.0
CJ Cunningham          15    0    0    1   0   0/1     0.0     0/0   0.0

TEAM: FG: 8/23 (34.8%), 3PT: 2/9 (22.2%), REB: 10 (0 off, 10 def), AST: 4, TO: 0
TEAM FOULS: 5 [Team_036 in BONUS]


Team_036
--------------------------------------------------------------------------------
Player                MIN  PTS  REB  AST  TO      FG   FG%      3P   3P%
--------------------------------------------------------------------------------
Tobias Fox             15    8    0    0   0   4/7    57.1     0/0   0.0
Giannis Booker         33    6    0    0   0   2/3    66.7     0/0   0.0
Terry Durant           32    2    3    1   0   1/2    50.0     0/0   0.0
Kobe Simmons           32    2    2    0   0   1/1   100.0     0/0   0.0
Devin Simmons          17    2    5    0   0   1/2    50.0     0/0   0.0
Dirk Anunoby           17    2    0    0   0   1/2    50.0     0/0   0.0
Larry Wade             32    0    1    0   0   0/1     0.0     0/0   0.0
Anthony Poole          32    0    2    3   0   0/1     0.0     0/0   0.0
Michael Westbrook      32    0    0    0   0   0/1     0.0     0/0   0.0
Bradley Murray         17    0    3    1   0   0/0     0.0     0/0   0.0
Pascal Antetokounmpo   17    0    1    0   0   0/2     0.0     0/0   0.0

TEAM: FG: 10/21 (47.6%), 3PT: 2/4 (50.0%), REB: 17 (2 off, 15 def), AST: 5, TO: 1
TEAM FOULS: 3

================================================================================

================================================================================
                               FULL GAME COMPLETE                               
================================================================================

FINAL SCORE: Team_099 102, Team_036 74

SCORING BY QUARTER:
--------------------------------------------------------------------------------
Team                     Q1     Q2     Q3     Q4    FINAL
--------------------------------------------------------------------------------
Team_099                 29     29     25     19      102
Team_036                 25     13     14     22       74
--------------------------------------------------------------------------------

FULL GAME BOX SCORE:
================================================================================

Team_099
--------------------------------------------------------------------------------
Player                MIN  PTS  REB  AST  TO      FG   FG%      3P   3P%      FT STL BLK
--------------------------------------------------------------------------------
Ayo Barrett            33    7    0    3   2   5/9    55.6   1/4    25.0   1/1     1   0
Larry James            33   14    0    3   1   5/9    55.6   0/2     0.0   3/3     0   1
Damian Ginobili        32    8    9    0   2   4/8    50.0   2/6    33.3   0/0     0   1
Vince Lillard          32   24   18    0   0   7/9    77.8   1/1   100.0   5/6     0   1
Larry Wade             32    9   12    5   5   6/13   46.2   0/0     0.0   4/5     1   0
Scottie Quickley       17    7    5    2   0   3/5    60.0   0/1     0.0   2/3     0   0
Donovan Green          17    3    8    2   0   1/5    20.0   1/2    50.0   0/0     0   0
Jarrett Fox            17    8    4    2   0   4/6    66.7   0/1     0.0   2/2     1   1
CJ Cunningham          15    5    0    2   0   2/3    66.7   1/1   100.0   0/0     0   0
Manu Johnson           15   14    0    3   1   6/11   54.5   2/6    33.3   2/2     0   0

TEAM: FG: 43/78 (55.1%), 3PT: 8/24 (33.3%), REB: 55 (13 off, 42 def), AST: 22, TO: 11


Team_036
--------------------------------------------------------------------------------
Player                MIN  PTS  REB  AST  TO      FG   FG%      3P   3P%      FT STL BLK
--------------------------------------------------------------------------------
Giannis Booker         33   14    1    0   1   6/15   40.0   3/7    42.9   1/1     0   0
Michael Westbrook      32    4    0    0   1   3/7    42.9   0/4     0.0   0/0     0   0
Anthony Poole          32    7    2    3   1   2/11   18.2   1/4    25.0   2/2     0   1
Terry Durant           32    7   10    4   2   3/8    37.5   1/1   100.0   0/0     1   0
Kobe Simmons           32   18   12    2   1   6/9    66.7   1/1   100.0   4/4     3   0
Dirk Anunoby           17    6    0    1   1   3/5    60.0   0/1     0.0   0/0     0   0
Pascal Antetokounmpo   17    2    2    1   2   1/4    25.0   0/1     0.0   0/0     0   0
Devin Simmons          17    4    9    2   0   2/5    40.0   0/0     0.0   0/0     0   1
Bradley Murray         17    4    6    1   0   2/4    50.0   0/0     0.0   0/0     0   0
Tobias Fox             15    8    0    0   0   4/8    50.0   0/0     0.0   2/2     0   0

TEAM: FG: 33/77 (42.9%), 3PT: 6/19 (31.6%), REB: 43 (9 off, 34 def), AST: 14, TO: 9

================================================================================
