================================================================================
                        FULL GAME - Team_096 vs Team_019                        
================================================================================

================================================================================
                       1ST QUARTER - Team_096 vs Team_019                       
================================================================================

[12:00] Team_096 possession (Score: 0-0)
Cole Griffin drives, picks up DeMar James. Help arrives from Brandon James! Cole Griffin attempts a Dunk. Contested by Brandon James (4.5 feet, ZONE). COLE GRIFFIN MAKES IT!
Score: 2-0

[11:46] Team_019 possession (Score: 2-0)
Rudy Giddey attempts a 3Pt. Contested by Cole Griffin (3.5 feet, ZONE). Rudy Giddey misses. Rebound secured by Scottie Herro.

[11:36] Team_096 possession (Score: 2-0)
Lamelo Quickley attempts a 3Pt. Contested by Brandon James (4.6 feet, MAN). Lamelo Quickley misses. Rebound secured by DeMar James.

[11:23] Team_019 possession (Score: 2-0)
Brandon James attempts a Layup. Contested by Lamelo Quickley (4.0 feet, MAN). Brandon James misses. Rebound secured by Scottie Herro.

[11:11] Team_096 possession (Score: 2-0)
Cole Griffin attempts a Layup. BLOCKED BY D'ANGELO RANDLE! Ball is loose! Offensive rebound by Scottie Herro! Scottie Herro kicks it out.

[10:56] Team_096 possession (Score: 2-0)
Kyrie Adebayo attempts a Layup. Contested by DeMar James (4.9 feet, ZONE). KYRIE ADEBAYO MAKES IT! Assist: Cole Griffin
Score: 4-0

[10:46] Team_019 possession (Score: 4-0)
Rudy Giddey attempts a 3Pt. Contested by Terry Mobley (4.8 feet, MAN). RUDY GIDDEY MAKES IT! Assist: Tobias Hyland
Score: 4-3

[10:30] Team_096 possession (Score: 4-3)
Cole Griffin attempts a Midrange. Contested by D'Angelo Randle (3.9 feet, MAN). COLE GRIFFIN MAKES IT! Assist: Scottie Herro
Score: 6-3

[10:11] Team_019 possession (Score: 6-3)
DeMar James drives and kicks out. Brandon James attempts a Midrange. Contested by Lamelo Quickley (3.9 feet, ZONE). BRANDON JAMES MAKES IT! Assist: Tobias Hyland
Score: 6-5

[10:00] Team_096 possession (Score: 6-5)
Kyrie Adebayo drives to the basket... Kyrie Adebayo commits a violation (traveling/carry)! TURNOVER! (dead ball)

[09:46] Team_019 possession (Score: 6-5)
FOUL! Shooting foul on Terry Mobley. Rudy Giddey to the line for 2 free throws. [Team fouls: 1] (Terry Mobley: 1 personal fouls)   FT 1/2: GOOD   FT 2/2: GOOD Rudy Giddey makes 2/2 from the line.
Score: 6-7

[09:34] Team_096 possession (Score: 6-7)
Cole Griffin loses control! Ball rolls out of bounds! TURNOVER! (dead ball)

[09:19] Team_019 possession (Score: 6-7)
D'Angelo Randle attempts a 3Pt. Contested by Cole Griffin (3.6 feet, MAN). D'ANGELO RANDLE MAKES IT! Assist: Tobias Hyland
Score: 6-10

[09:06] Team_096 possession (Score: 6-10)
Scottie Herro attempts a Layup. Contested by Tobias Hyland (5.7 feet, ZONE). SCOTTIE HERRO MAKES IT!
Score: 8-10

[08:52] Team_019 possession (Score: 8-10)
D'Angelo Randle drives, Kyrie Adebayo stays with him. D'Angelo Randle attempts a Dunk. Contested by Kyrie Adebayo (4.2 feet, ZONE). D'ANGELO RANDLE MAKES IT! Assist: DeMar James
Score: 8-12

[08:41] Team_096 possession (Score: 8-12)
Scottie Herro drives, DeMar James stays with him. Scottie Herro attempts a Dunk. Contested by DeMar James (4.3 feet, ZONE). SCOTTIE HERRO MAKES IT! Assist: Lamelo Quickley
Score: 10-12

[08:25] Team_019 possession (Score: 10-12)
FOUL! Holding foul on Terry Mobley. [Team fouls: 2] No free throws, side out. (Terry Mobley: 2 personal fouls)

[08:12] Team_019 possession (Score: 10-12)
Tobias Hyland drives and kicks out. Brandon James attempts a Midrange. BLOCKED BY LAMELO QUICKLEY! Ball goes out off Lamelo Quickley. Brandon James's ball!

[07:57] Team_019 possession (Score: 10-12)
FOUL! Reach-in foul on Scottie Herro during the drive. [Team fouls: 3] No free throws, side out. (Scottie Herro: 1 personal fouls)

[07:41] Team_019 possession (Score: 10-12)
Rudy Giddey loses the ball! Stripped by Terry Mobley! TURNOVER! (live ball)

[07:29] Team_096 possession (Score: 10-12)
Terry Mobley attempts a 3Pt. Contested by D'Angelo Randle (3.7 feet, ZONE). Terry Mobley misses. Rebound secured by DeMar James.

[07:13] Team_019 possession (Score: 10-12)
Tobias Hyland drives and kicks out. Brandon James attempts a 3Pt. Contested by Lamelo Quickley (3.9 feet, MAN). Brandon James misses. Rebound secured by Cole Griffin.

[07:00] Team_096 possession (Score: 10-12)
Terry Mobley attempts a 3Pt. Contested by Rudy Giddey (5.5 feet, MAN). Terry Mobley misses. Rebound secured by Tobias Hyland.

[06:44] Team_019 possession (Score: 10-12)
Brandon James attempts a Midrange. Contested by Terry Mobley (4.6 feet, ZONE). BRANDON JAMES MAKES IT!
Score: 10-14

[06:31] Team_096 possession (Score: 10-14)
FOUL! Holding foul on D'Angelo Randle. [Team fouls: 1] No free throws, side out. (D'Angelo Randle: 1 personal fouls)

[06:16] Team_096 possession (Score: 10-14)
Kyrie Adebayo drives, DeMar James stays with him. Kyrie Adebayo attempts a Layup. Contested by DeMar James (4.9 feet, MAN). KYRIE ADEBAYO MAKES IT! Assist: Scottie Herro
Score: 12-14

[06:02] Team_019 possession (Score: 12-14)
DeMar James attempts a Midrange. Contested by Kyrie Adebayo (4.3 feet, MAN). DeMar James misses. Rebound secured by Scottie Herro.

[05:43] Team_096 possession (Score: 12-14)
Terry Mobley drives and kicks out. FOUL! Shooting foul on DeMar James. Scottie Herro to the line for 2 free throws. [Team fouls: 2] (DeMar James: 1 personal fouls)   FT 1/2: GOOD   FT 2/2: GOOD Scottie Herro makes 2/2 from the line.
Score: 14-14

[05:26] Team_019 possession (Score: 14-14)
Rudy Giddey attempts a 3Pt. Contested by Cole Griffin (3.5 feet, ZONE). Rudy Giddey misses. Rebound secured by Kyrie Adebayo.

[05:12] Team_096 possession (Score: 14-14)
Kyrie Adebayo attempts a Midrange. Contested by DeMar James (4.9 feet, MAN). Kyrie Adebayo misses. Rebound secured by Tobias Hyland.

[04:56] Team_019 possession (Score: 14-14)
Tobias Hyland drives to the basket... Tobias Hyland loses the ball! Stripped by Scottie Herro! TURNOVER! (live ball)

[04:37] Team_096 possession (Score: 14-14)
Scottie Herro throws a bad pass out of bounds! TURNOVER! (dead ball)

[04:17] Team_019 possession (Score: 14-14)
FOUL! Reach-in foul on Kyrie Adebayo during the drive. [Team fouls: 4] No free throws, side out. (Kyrie Adebayo: 1 personal fouls)

[04:02] Team_019 possession (Score: 14-14)
DeMar James throws a bad pass out of bounds! TURNOVER! (dead ball)

[03:45] Team_096 possession (Score: 14-14)
Scottie Herro drives to the basket... Scottie Herro loses the ball! Stripped by Tobias Hyland! TURNOVER! (live ball)

[03:29] Team_019 possession (Score: 14-14)
Rudy Giddey drives and kicks out. Rudy Giddey attempts a Midrange. Contested by Terry Mobley (4.7 feet, MAN). RUDY GIDDEY MAKES IT! Assist: DeMar James
Score: 14-16

[03:18] Team_096 possession (Score: 14-16)
Lamelo Quickley makes the Dunk and draws the foul on DeMar James! And-1! Lamelo Quickley to the line for 1. [Team fouls: 3] (DeMar James: 2 personal fouls)   FT 1/1: GOOD Lamelo Quickley makes 1/1 from the line.
Score: 17-16

[03:06] Team_019 possession (Score: 17-16)
DeMar James attempts a Layup. Contested by Kyrie Adebayo (4.4 feet, MAN). DEMAR JAMES MAKES IT!
Score: 17-18

[02:48] Team_096 possession (Score: 17-18)
Cole Griffin attempts a 3Pt. Contested by D'Angelo Randle (4.1 feet, MAN). Cole Griffin misses. Rebound secured by DeMar James.

[02:33] Team_019 possession (Score: 17-18)
D'Angelo Randle attempts a 3Pt. Contested by Scottie Herro (5.4 feet, ZONE). D'Angelo Randle misses. Rebound secured by Cole Griffin.

[02:18] Team_096 possession (Score: 17-18)
Terry Mobley drives, DeMar James stays with him. Terry Mobley attempts a Dunk. Contested by DeMar James (4.7 feet, ZONE). TERRY MOBLEY MAKES IT!
Score: 19-18

[02:08] Team_019 possession (Score: 19-18)
Brandon James drives to the basket... Brandon James throws a bad pass out of bounds! TURNOVER! (dead ball)

[02:08] Substitution (Team_096): Terry Mobley OUT → Cade Jokic IN (stamina_rule2)

[02:08] Substitution (Team_096): Lamelo Quickley OUT → Jarrett Markkanen IN (stamina_rule2)

[02:08] Substitution (Team_096): Scottie Herro OUT → Tyler Haliburton IN (stamina_rule2)

[02:08] Substitution (Team_019): Rudy Giddey OUT → Gary Ginobili IN (stamina_rule2)

[02:08] Substitution (Team_019): Brandon James OUT → Jalen Turner IN (stamina_rule2)

[02:08] Substitution (Team_019): D'Angelo Randle OUT → Blake LaVine IN (stamina_rule2)

[02:08] Substitution (Team_019): Tobias Hyland OUT → Shai Ingram IN (stamina_rule2)

[02:08] Substitution (Team_019): DeMar James OUT → Tim Jordan IN (stamina_rule2)

[01:49] Team_096 possession (Score: 19-18)
Tyler Haliburton drives, picks up Shai Ingram. Help arrives from Jalen Turner! Tyler Haliburton attempts a Layup. Contested by Jalen Turner (4.5 feet, ZONE). Tyler Haliburton misses. Rebound secured by Shai Ingram.

[01:34] Team_019 possession (Score: 19-18)
Blake LaVine attempts a 3Pt. Contested by Cole Griffin (3.8 feet, MAN). Blake LaVine misses. Rebound secured by Kyrie Adebayo.

[01:20] Team_096 possession (Score: 19-18)
Kyrie Adebayo drives to the basket... Kyrie Adebayo commits a violation (traveling/carry)! TURNOVER! (dead ball)

[01:20] Substitution (Team_096): Cole Griffin OUT → Cole Holiday IN (stamina_rule2)

[01:20] Substitution (Team_096): Kyrie Adebayo OUT → Devin Griffin IN (stamina_rule2)

[01:08] Team_019 possession (Score: 19-18)
Jalen Turner attempts a 3Pt. Contested by Cade Jokic (5.6 feet, ZONE). Jalen Turner misses. Rebound secured by Tyler Haliburton.

[00:55] Team_096 possession (Score: 19-18)
Tyler Haliburton drives, Shai Ingram stays with him. Tyler Haliburton attempts a Dunk. Contested by Shai Ingram (4.5 feet, MAN). TYLER HALIBURTON MAKES IT! Assist: Cole Holiday
Score: 21-18

[00:42] Team_019 possession (Score: 21-18)
Shai Ingram attempts a 3Pt. Contested by Cole Holiday (4.5 feet, ZONE). Shai Ingram misses. Offensive rebound by Tim Jordan! Tim Jordan kicks it out.

[00:28] Team_019 possession (Score: 21-18)
Blake LaVine makes the Midrange and draws the foul on Cole Holiday! And-1! Blake LaVine to the line for 1. [BONUS: 5 team fouls] (Cole Holiday: 1 personal fouls)   FT 1/1: GOOD Blake LaVine makes 1/1 from the line.
Score: 21-21

[00:15] Team_096 possession (Score: 21-21)
Cole Holiday attempts a 3Pt. Contested by Blake LaVine (5.0 feet, ZONE). Cole Holiday misses. Offensive rebound by Devin Griffin! Devin Griffin kicks it out.

================================================================================
                              1ST QUARTER COMPLETE                              
================================================================================

1ST QUARTER SCORE: Team_096 21, Team_019 21

BOX SCORE:
================================================================================

Team_096
--------------------------------------------------------------------------------
Player                MIN  PTS  REB  AST  TO      FG   FG%      3P   3P%
--------------------------------------------------------------------------------
Scottie Herro          10    6    4    2   0   3/3   100.0     0/0   0.0
Cole Griffin           11    4    2    1   0   2/3    66.7     0/0   0.0
Kyrie Adebayo          11    4    2    0   0   2/3    66.7     0/0   0.0
Lamelo Quickley        10    3    0    1   0   1/2    50.0     0/0   0.0
Terry Mobley           10    2    0    0   0   1/3    33.3     0/0   0.0
Tyler Haliburton        2    2    1    0   0   1/2    50.0     0/0   0.0
Cole Holiday            1    0    0    1   0   0/0     0.0     0/0   0.0
Devin Griffin           1    0    1    0   0   0/0     0.0     0/0   0.0

TEAM: FG: 10/16 (62.5%), 3PT: 0/4 (0.0%), REB: 10 (2 off, 8 def), AST: 5, TO: 5
TEAM FOULS: 5 [Team_019 in BONUS]


Team_019
--------------------------------------------------------------------------------
Player                MIN  PTS  REB  AST  TO      FG   FG%      3P   3P%
--------------------------------------------------------------------------------
Rudy Giddey            10    7    0    0   0   3/5    60.0     0/0   0.0
D'Angelo Randle        10    5    0    0   0   2/3    66.7     0/0   0.0
Brandon James          10    4    0    0   0   2/3    66.7     0/0   0.0
Blake LaVine            2    3    0    0   0   1/2    50.0     0/0   0.0
DeMar James            10    2    3    2   0   1/2    50.0     0/0   0.0
Tobias Hyland          10    0    2    3   0   0/1     0.0     0/0   0.0
Shai Ingram             2    0    1    0   0   0/0     0.0     0/0   0.0
Jalen Turner            2    0    0    0   0   0/1     0.0     0/0   0.0
Tim Jordan              2    0    1    0   0   0/0     0.0     0/0   0.0

TEAM: FG: 9/17 (52.9%), 3PT: 2/7 (28.6%), REB: 7 (1 off, 6 def), AST: 5, TO: 4
TEAM FOULS: 3

================================================================================

================================================================================
                       2ND QUARTER - Team_096 vs Team_019                       
================================================================================

[12:00] Team_096 possession (Score: 21-21)
Lamelo Quickley attempts a 3Pt. Contested by Brandon James (4.6 feet, MAN). Lamelo Quickley misses. Rebound secured by DeMar James.

[11:47] Team_019 possession (Score: 21-21)
D'Angelo Randle attempts a 3Pt. Contested by Cole Griffin (3.6 feet, MAN). D'Angelo Randle misses. Offensive rebound by D'Angelo Randle! D'Angelo Randle's putback is no good. Offensive rebound by D'Angelo Randle! D'Angelo Randle kicks it out.

[11:29] Team_019 possession (Score: 21-21)
Brandon James attempts a Midrange. Contested by Lamelo Quickley (4.0 feet, MAN). Brandon James misses. Offensive rebound by DeMar James! DeMar James's putback is no good. Rebound secured by Scottie Herro.

[11:16] Team_096 possession (Score: 21-21)
FOUL! Shooting foul on D'Angelo Randle. Cole Griffin to the line for 2 free throws. [Team fouls: 1] (D'Angelo Randle: 1 personal fouls)   FT 1/2: GOOD   FT 2/2: GOOD Cole Griffin makes 2/2 from the line.
Score: 23-21

[11:05] Team_019 possession (Score: 23-21)
FOUL! Shooting foul on Kyrie Adebayo. DeMar James to the line for 2 free throws. [Team fouls: 1] (Kyrie Adebayo: 1 personal fouls)   FT 1/2: GOOD   FT 2/2: GOOD DeMar James makes 2/2 from the line.
Score: 23-23

[10:54] Team_096 possession (Score: 23-23)
Lamelo Quickley drives and kicks out. Kyrie Adebayo attempts a 3Pt. Contested by DeMar James (4.4 feet, MAN). Kyrie Adebayo misses. Offensive rebound by Scottie Herro! Scottie Herro kicks it out.

[10:37] Team_096 possession (Score: 23-23)
Cole Griffin drives, D'Angelo Randle stays with him. Cole Griffin attempts a Layup. Contested by D'Angelo Randle (4.1 feet, MAN). COLE GRIFFIN MAKES IT! Assist: Terry Mobley
Score: 25-23

[10:26] Team_019 possession (Score: 25-23)
Rudy Giddey drives to the basket... Rudy Giddey commits a violation (traveling/carry)! TURNOVER! (dead ball)

[10:26] Substitution (Team_019): Tobias Hyland OUT → Shai Ingram IN (stamina_rule2)

[10:26] Substitution (Team_019): DeMar James OUT → Tim Jordan IN (stamina_rule2)

[10:16] Team_096 possession (Score: 25-23)
Lamelo Quickley attempts a Midrange. Contested by Brandon James (4.8 feet, MAN). LAMELO QUICKLEY MAKES IT!
Score: 27-23

[10:01] Team_019 possession (Score: 27-23)
Rudy Giddey attempts a 3Pt. Contested by Terry Mobley (5.0 feet, MAN). RUDY GIDDEY MAKES IT! Assist: Brandon James
Score: 27-26

[09:46] Team_096 possession (Score: 27-26)
Cole Griffin loses the ball! Stripped by D'Angelo Randle! TURNOVER! (live ball)

[09:33] Team_019 possession (Score: 27-26)
D'Angelo Randle loses the ball! Stripped by Cole Griffin! TURNOVER! (live ball)

[09:21] Team_096 possession (Score: 27-26)
Cole Griffin attempts a 3Pt. Contested by D'Angelo Randle (4.2 feet, ZONE). COLE GRIFFIN MAKES IT! Assist: Lamelo Quickley
Score: 30-26

[09:10] Team_019 possession (Score: 30-26)
Rudy Giddey drives and kicks out. Shai Ingram attempts a Midrange. Contested by Lamelo Quickley (4.3 feet, ZONE). SHAI INGRAM MAKES IT!
Score: 30-28

[08:58] Team_096 possession (Score: 30-28)
Terry Mobley attempts a 3Pt. Contested by Rudy Giddey (5.7 feet, MAN). TERRY MOBLEY MAKES IT! Assist: Scottie Herro
Score: 33-28

[08:46] Team_019 possession (Score: 33-28)
Shai Ingram attempts a 3Pt. Contested by Terry Mobley (4.9 feet, ZONE). Shai Ingram misses. Rebound secured by Kyrie Adebayo.

[08:32] Team_096 possession (Score: 33-28)
Terry Mobley drives, picks up Shai Ingram. Help arrives from Brandon James! Terry Mobley attempts a Layup. Contested by Brandon James (4.6 feet, ZONE). Terry Mobley misses. Offensive rebound by Scottie Herro! Scottie Herro kicks it out.

[08:16] Team_096 possession (Score: 33-28)
Cole Griffin loses the ball! Stripped by D'Angelo Randle! TURNOVER! (live ball)

[08:02] Team_019 possession (Score: 33-28)
Rudy Giddey attempts a Midrange. Contested by Terry Mobley (5.2 feet, MAN). RUDY GIDDEY MAKES IT!
Score: 33-30

[07:50] Team_096 possession (Score: 33-30)
Kyrie Adebayo attempts a 3Pt. Contested by D'Angelo Randle (4.8 feet, ZONE). Kyrie Adebayo misses. Offensive rebound by Kyrie Adebayo! Kyrie Adebayo puts it back in!
Score: 35-30

[07:37] Team_019 possession (Score: 35-30)
Rudy Giddey drives, picks up Terry Mobley. Help arrives from Cole Griffin! Rudy Giddey attempts a Layup. Contested by Cole Griffin (5.2 feet, MAN). Rudy Giddey misses. Rebound secured by Kyrie Adebayo.

[07:23] Team_096 possession (Score: 35-30)
FOUL! Holding foul on Shai Ingram. [Team fouls: 2] No free throws, side out. (Shai Ingram: 1 personal fouls)

[07:11] Team_096 possession (Score: 35-30)
Terry Mobley attempts a 3Pt. Contested by Shai Ingram (4.6 feet, ZONE). Terry Mobley misses. Rebound secured by Tim Jordan.

[06:56] Team_019 possession (Score: 35-30)
Brandon James drives to the basket... Brandon James throws a bad pass! Stolen by Kyrie Adebayo! TURNOVER! (live ball)

[06:42] Team_096 possession (Score: 35-30)
FOUL! Holding foul on Shai Ingram. [Team fouls: 3] No free throws, side out. (Shai Ingram: 2 personal fouls)

[06:32] Team_096 possession (Score: 35-30)
Scottie Herro attempts a 3Pt. Contested by Shai Ingram (4.5 feet, MAN). Scottie Herro misses. Rebound secured by Tim Jordan.

[06:16] Team_019 possession (Score: 35-30)
Brandon James drives, Lamelo Quickley stays with him. Brandon James attempts a Layup. Contested by Lamelo Quickley (4.6 feet, MAN). BRANDON JAMES MAKES IT! Assist: Shai Ingram
Score: 35-32

[06:05] Team_096 possession (Score: 35-32)
Scottie Herro attempts a 3Pt. Contested by Rudy Giddey (6.0 feet, ZONE). SCOTTIE HERRO MAKES IT! Assist: Cole Griffin
Score: 38-32

[05:46] Team_019 possession (Score: 38-32)
Tim Jordan attempts a Layup. Contested by Kyrie Adebayo (4.8 feet, ZONE). Tim Jordan misses. Rebound secured by Scottie Herro.

[05:32] Team_096 possession (Score: 38-32)
Terry Mobley attempts a 3Pt. Wide open! Rudy Giddey is 6.1 feet away. [MAN] TERRY MOBLEY MAKES IT! Assist: Cole Griffin
Score: 41-32

[05:14] Team_019 possession (Score: 41-32)
D'Angelo Randle drives and kicks out. Tim Jordan attempts a 3Pt. Contested by Cole Griffin (4.4 feet, ZONE). TIM JORDAN MAKES IT! Assist: Rudy Giddey
Score: 41-35

[04:58] Team_096 possession (Score: 41-35)
FOUL! Offensive foul on Lamelo Quickley! Brandon James drew the charge! [Team fouls: 2] (Lamelo Quickley: 1 personal fouls) TURNOVER! (dead ball)

[04:49] Team_019 possession (Score: 41-35)
D'Angelo Randle attempts a 3Pt. Contested by Cole Griffin (4.5 feet, ZONE). D'ANGELO RANDLE MAKES IT! Assist: Shai Ingram
Score: 41-38

[04:35] Team_096 possession (Score: 41-38)
Cole Griffin attempts a 3Pt. Contested by Shai Ingram (4.8 feet, ZONE). COLE GRIFFIN MAKES IT! Assist: Kyrie Adebayo
Score: 44-38

[04:24] Team_019 possession (Score: 44-38)
Tim Jordan drives, Kyrie Adebayo stays with him. Tim Jordan attempts a Layup. Contested by Kyrie Adebayo (5.0 feet, ZONE). TIM JORDAN MAKES IT! Assist: Shai Ingram
Score: 44-40

[04:11] Team_096 possession (Score: 44-40)
Cole Griffin drives and kicks out. Scottie Herro attempts a 3Pt. Contested by Shai Ingram (4.7 feet, ZONE). SCOTTIE HERRO MAKES IT! Assist: Cole Griffin
Score: 47-40

[03:58] Team_019 possession (Score: 47-40)
Rudy Giddey attempts a 3Pt. Contested by Terry Mobley (5.7 feet, MAN). Rudy Giddey misses. Rebound secured by Kyrie Adebayo.

[03:49] Team_096 possession (Score: 47-40)
Cole Griffin attempts a Layup. Contested by D'Angelo Randle (5.1 feet, MAN). Cole Griffin misses. Offensive rebound by Kyrie Adebayo! Kyrie Adebayo kicks it out.

[03:38] Team_096 possession (Score: 47-40)
Lamelo Quickley drives, Brandon James stays with him. Lamelo Quickley attempts a Dunk. Contested by Brandon James (5.6 feet, MAN). LAMELO QUICKLEY MAKES IT! Assist: Terry Mobley
Score: 49-40

[03:23] Team_019 possession (Score: 49-40)
D'Angelo Randle attempts a Midrange. Contested by Cole Griffin (4.7 feet, ZONE). D'ANGELO RANDLE MAKES IT! Assist: Rudy Giddey
Score: 49-42

[03:07] Team_096 possession (Score: 49-42)
Cole Griffin attempts a 3Pt. Contested by Shai Ingram (4.9 feet, ZONE). Cole Griffin misses. Rebound secured by Tim Jordan.

[02:57] Team_019 possession (Score: 49-42)
Shai Ingram throws a bad pass out of bounds! TURNOVER! (dead ball)

[02:57] Substitution (Team_096): Terry Mobley OUT → Cade Jokic IN (stamina_rule2)

[02:57] Substitution (Team_096): Lamelo Quickley OUT → Jarrett Markkanen IN (stamina_rule2)

[02:57] Substitution (Team_096): Cole Griffin OUT → Cole Holiday IN (stamina_rule2)

[02:57] Substitution (Team_096): Scottie Herro OUT → Tyler Haliburton IN (stamina_rule2)

[02:57] Substitution (Team_096): Kyrie Adebayo OUT → Devin Griffin IN (stamina_rule2)

[02:57] Substitution (Team_019): Rudy Giddey OUT → Gary Ginobili IN (stamina_rule2)

[02:57] Substitution (Team_019): Brandon James OUT → Jalen Turner IN (stamina_rule2)

[02:57] Substitution (Team_019): D'Angelo Randle OUT → Blake LaVine IN (stamina_rule2)

[02:41] Team_096 possession (Score: 49-42)
Cade Jokic attempts a Midrange. Contested by Shai Ingram (4.9 feet, ZONE). CADE JOKIC MAKES IT!
Score: 51-42

[02:27] Team_019 possession (Score: 51-42)
FOUL! Shooting foul on Cade Jokic. Blake LaVine to the line for 3 free throws. [Team fouls: 3] (Cade Jokic: 1 personal fouls)   FT 1/3: GOOD   FT 2/3: GOOD   FT 3/3: GOOD Blake LaVine makes 3/3 from the line.
Score: 51-45

[02:14] Team_096 possession (Score: 51-45)
Cade Jokic attempts a Layup. Contested by Shai Ingram (5.0 feet, ZONE). CADE JOKIC MAKES IT!
Score: 53-45

[02:01] Team_019 possession (Score: 53-45)
FOUL! Reach-in foul on Devin Griffin during the drive. [Team fouls: 4] No free throws, side out. (Devin Griffin: 1 personal fouls)

[01:48] Team_019 possession (Score: 53-45)
Blake LaVine attempts a Midrange. Contested by Cole Holiday (4.7 feet, MAN). Blake LaVine misses. Offensive rebound by Blake LaVine! Blake LaVine kicks it out.

[01:32] Team_019 possession (Score: 53-45)
Shai Ingram drives to the basket... Shai Ingram commits a violation (traveling/carry)! TURNOVER! (dead ball)

[01:17] Team_096 possession (Score: 53-45)
Cole Holiday drives, Blake LaVine stays with him. Cole Holiday attempts a Dunk. Contested by Blake LaVine (5.0 feet, MAN). Cole Holiday misses. Rebound secured by Blake LaVine.

[01:00] Team_019 possession (Score: 53-45)
Jalen Turner drives, picks up Jarrett Markkanen. Help arrives from Cole Holiday! Jalen Turner attempts a Layup. Contested by Cole Holiday (4.5 feet, MAN). JALEN TURNER MAKES IT! Assist: Blake LaVine
Score: 53-47

[00:48] Team_096 possession (Score: 53-47)
Jarrett Markkanen attempts a 3Pt. Contested by Jalen Turner (3.6 feet, MAN). Jarrett Markkanen misses. Rebound secured by Blake LaVine.

[00:32] Team_019 possession (Score: 53-47)
Jalen Turner attempts a 3Pt. Contested by Cade Jokic (5.6 feet, ZONE). Jalen Turner misses. Rebound secured by Jarrett Markkanen.

[00:19] Team_096 possession (Score: 53-47)
Cade Jokic throws a bad pass out of bounds! TURNOVER! (dead ball)

[00:09] Team_019 possession (Score: 53-47)
Shai Ingram attempts a Layup. Contested by Devin Griffin (4.5 feet, ZONE). SHAI INGRAM MAKES IT! Assist: Tim Jordan
Score: 53-49

================================================================================
                              2ND QUARTER COMPLETE                              
================================================================================

2ND QUARTER SCORE: Team_096 32, Team_019 28

BOX SCORE:
================================================================================

Team_096
--------------------------------------------------------------------------------
Player                MIN  PTS  REB  AST  TO      FG   FG%      3P   3P%
--------------------------------------------------------------------------------
Cole Griffin           20   10    0    3   0   4/5    80.0     0/0   0.0
Scottie Herro          19    6    4    1   0   2/3    66.7     0/0   0.0
Terry Mobley           19    6    0    2   0   2/3    66.7     0/0   0.0
Lamelo Quickley        19    4    0    1   0   2/3    66.7     0/0   0.0
Cade Jokic              5    4    0    0   0   2/2   100.0     0/0   0.0
Kyrie Adebayo          20    2    5    1   0   1/1   100.0     0/0   0.0
Cole Holiday            4    0    0    0   0   0/1     0.0     0/0   0.0
Jarrett Markkanen       5    0    1    0   0   0/1     0.0     0/0   0.0

TEAM: FG: 13/19 (68.4%), 3PT: 6/11 (54.5%), REB: 9 (4 off, 5 def), AST: 8, TO: 4
TEAM FOULS: 4


Team_019
--------------------------------------------------------------------------------
Player                MIN  PTS  REB  AST  TO      FG   FG%      3P   3P%
--------------------------------------------------------------------------------
D'Angelo Randle        19    5    1    0   0   2/2   100.0     0/0   0.0
Rudy Giddey            19    5    0    2   0   2/4    50.0     0/0   0.0
Tim Jordan             12    5    3    1   0   2/3    66.7     0/0   0.0
Shai Ingram            12    4    0    3   0   2/3    66.7     0/0   0.0
Blake LaVine            5    3    3    1   0   1/1   100.0     0/0   0.0
DeMar James            12    2    1    0   0   1/1   100.0     0/0   0.0
Brandon James          19    2    0    1   0   1/2    50.0     0/0   0.0
Jalen Turner            5    2    0    0   0   1/2    50.0     0/0   0.0

TEAM: FG: 12/18 (66.7%), 3PT: 3/6 (50.0%), REB: 9 (3 off, 6 def), AST: 8, TO: 5
TEAM FOULS: 3

================================================================================

================================================================================
                       3RD QUARTER - Team_096 vs Team_019                       
================================================================================

[12:00] Team_096 possession (Score: 53-49)
Scottie Herro loses the ball! Stripped by Tobias Hyland! TURNOVER! (live ball)

[11:50] Team_019 possession (Score: 53-49)
D'Angelo Randle attempts a Layup. Contested by Cole Griffin (3.6 feet, MAN). D'ANGELO RANDLE MAKES IT! Assist: Rudy Giddey
Score: 53-51

[11:35] Team_096 possession (Score: 53-51)
FOUL! Reach-in foul on Rudy Giddey during the drive. [Team fouls: 1] No free throws, side out. (Rudy Giddey: 1 personal fouls)

[11:18] Team_096 possession (Score: 53-51)
Lamelo Quickley attempts a Layup. Contested by Brandon James (4.6 feet, MAN). Lamelo Quickley misses. Rebound secured by Tobias Hyland.

[11:08] Team_019 possession (Score: 53-51)
D'Angelo Randle attempts a Midrange. Contested by Cole Griffin (3.6 feet, MAN). D'ANGELO RANDLE MAKES IT!
Score: 53-53

[10:56] Team_096 possession (Score: 53-53)
Cole Griffin attempts a 3Pt. Contested by D'Angelo Randle (3.9 feet, MAN). COLE GRIFFIN MAKES IT! Assist: Lamelo Quickley
Score: 56-53

[10:43] Team_019 possession (Score: 56-53)
Rudy Giddey attempts a 3Pt. Contested by Cole Griffin (3.5 feet, ZONE). Rudy Giddey misses. Rebound secured by Cole Griffin.

[10:24] Team_096 possession (Score: 56-53)
Cole Griffin attempts a 3Pt. Contested by Brandon James (5.4 feet, ZONE). Cole Griffin misses. Offensive rebound by Scottie Herro! Scottie Herro kicks it out.

[10:08] Team_096 possession (Score: 56-53)
Kyrie Adebayo attempts a Midrange. Contested by DeMar James (4.9 feet, MAN). KYRIE ADEBAYO MAKES IT!
Score: 58-53

[09:58] Team_019 possession (Score: 58-53)
Brandon James attempts a 3Pt. Contested by Cole Griffin (3.3 feet, ZONE). Brandon James misses. Rebound secured by Cole Griffin.

[09:44] Team_096 possession (Score: 58-53)
Lamelo Quickley attempts a Layup. Contested by DeMar James (3.7 feet, ZONE). LAMELO QUICKLEY MAKES IT!
Score: 60-53

[09:33] Team_019 possession (Score: 60-53)
D'Angelo Randle throws a bad pass out of bounds! TURNOVER! (dead ball)

[09:16] Team_096 possession (Score: 60-53)
Lamelo Quickley attempts a Layup. Contested by Brandon James (4.6 feet, MAN). LAMELO QUICKLEY MAKES IT! Assist: Kyrie Adebayo
Score: 62-53

[09:02] Team_019 possession (Score: 62-53)
Rudy Giddey attempts a 3Pt. Contested by Cole Griffin (3.5 feet, ZONE). Rudy Giddey misses. Rebound secured by Scottie Herro.

[08:44] Team_096 possession (Score: 62-53)
Cole Griffin drives, D'Angelo Randle stays with him. Cole Griffin attempts a Dunk. Contested by D'Angelo Randle (3.9 feet, MAN). Cole Griffin misses. Rebound secured by Tobias Hyland.

[08:25] Team_019 possession (Score: 62-53)
Rudy Giddey drives and kicks out. DeMar James attempts a 3Pt. Contested by Kyrie Adebayo (4.0 feet, MAN). DEMAR JAMES MAKES IT! Assist: Rudy Giddey
Score: 62-56

[08:10] Team_096 possession (Score: 62-56)
Terry Mobley attempts a 3Pt. Contested by D'Angelo Randle (3.7 feet, ZONE). Terry Mobley misses. Rebound secured by D'Angelo Randle.

[07:55] Team_019 possession (Score: 62-56)
D'Angelo Randle attempts a 3Pt. Contested by Cole Griffin (3.6 feet, MAN). D'Angelo Randle misses. FOUL! Loose ball foul on Kyrie Adebayo during the rebound battle. [Team fouls: 1] No free throws, side out. (Kyrie Adebayo: 1 personal fouls)

[07:42] Team_019 possession (Score: 62-56)
Tobias Hyland attempts a Layup. BLOCKED BY KYRIE ADEBAYO! Ball is loose! Rebound secured by Kyrie Adebayo.

[07:31] Team_096 possession (Score: 62-56)
Kyrie Adebayo attempts a 3Pt. Contested by D'Angelo Randle (4.2 feet, ZONE). Kyrie Adebayo misses. Offensive rebound by Kyrie Adebayo! Kyrie Adebayo's putback is no good. Rebound secured by DeMar James.

[07:16] Team_019 possession (Score: 62-56)
D'Angelo Randle attempts a Midrange. Contested by Kyrie Adebayo (4.2 feet, ZONE). D'Angelo Randle misses. Offensive rebound by DeMar James! DeMar James puts it back in!
Score: 62-58

[06:59] Team_096 possession (Score: 62-58)
Terry Mobley attempts a Midrange. Contested by Rudy Giddey (5.5 feet, MAN). Terry Mobley misses. Rebound secured by DeMar James.

[06:42] Team_019 possession (Score: 62-58)
Rudy Giddey drives and kicks out. Tobias Hyland attempts a 3Pt. Contested by Scottie Herro (5.0 feet, MAN). Tobias Hyland misses. FOUL! Loose ball foul on Kyrie Adebayo during the rebound battle. [Team fouls: 2] No free throws, side out. (Kyrie Adebayo: 2 personal fouls)

[06:28] Team_019 possession (Score: 62-58)
DeMar James attempts a Midrange. Contested by Kyrie Adebayo (4.3 feet, MAN). DEMAR JAMES MAKES IT!
Score: 62-60

[06:13] Team_096 possession (Score: 62-60)
Scottie Herro attempts a 3Pt. Contested by Tobias Hyland (5.7 feet, MAN). Scottie Herro misses. Rebound secured by Tobias Hyland.

[05:59] Team_019 possession (Score: 62-60)
Tobias Hyland throws a bad pass out of bounds! TURNOVER! (dead ball)

[05:47] Team_096 possession (Score: 62-60)
Lamelo Quickley drives to the basket... Lamelo Quickley throws a bad pass! Stolen by DeMar James! TURNOVER! (live ball)

[05:35] Team_019 possession (Score: 62-60)
D'Angelo Randle attempts a 3Pt. Contested by Cole Griffin (3.6 feet, ZONE). D'ANGELO RANDLE MAKES IT! Assist: Rudy Giddey
Score: 62-63

[05:20] Team_096 possession (Score: 62-63)
Scottie Herro drives, DeMar James stays with him. Scottie Herro attempts a Dunk. Contested by DeMar James (4.4 feet, ZONE). SCOTTIE HERRO MAKES IT! Assist: Cole Griffin
Score: 64-63

[05:05] Team_019 possession (Score: 64-63)
D'Angelo Randle attempts a 3Pt. Contested by Cole Griffin (3.6 feet, MAN). D'ANGELO RANDLE MAKES IT! Assist: Rudy Giddey
Score: 64-66

[04:50] Team_096 possession (Score: 64-66)
Lamelo Quickley drives and kicks out. Terry Mobley attempts a Midrange. Contested by Tobias Hyland (5.7 feet, ZONE). Terry Mobley misses. Offensive rebound by Scottie Herro! Scottie Herro kicks it out.

[04:34] Team_096 possession (Score: 64-66)
FOUL! Holding foul on D'Angelo Randle. [Team fouls: 2] No free throws, side out. (D'Angelo Randle: 1 personal fouls)

[04:19] Team_096 possession (Score: 64-66)
Scottie Herro drives and kicks out. Scottie Herro attempts a Midrange. Contested by Tobias Hyland (5.7 feet, ZONE). Scottie Herro misses. Rebound secured by D'Angelo Randle.

[04:03] Team_019 possession (Score: 64-66)
Brandon James makes the Dunk and draws the foul on Lamelo Quickley! And-1! Brandon James to the line for 1. [Team fouls: 3] (Lamelo Quickley: 1 personal fouls)   FT 1/1: GOOD Brandon James makes 1/1 from the line.
Score: 64-69

[03:49] Team_096 possession (Score: 64-69)
Scottie Herro attempts a Layup. Contested by Tobias Hyland (5.9 feet, MAN). SCOTTIE HERRO MAKES IT!
Score: 66-69

[03:38] Team_019 possession (Score: 66-69)
DeMar James makes the Midrange and draws the foul on Lamelo Quickley! And-1! DeMar James to the line for 1. [Team fouls: 4] (Lamelo Quickley: 2 personal fouls)   FT 1/1: GOOD DeMar James makes 1/1 from the line.
Score: 66-72

[03:20] Team_096 possession (Score: 66-72)
Cole Griffin attempts a Layup. Contested by D'Angelo Randle (4.1 feet, MAN). Cole Griffin misses. Rebound secured by D'Angelo Randle.

[03:09] Team_019 possession (Score: 66-72)
DeMar James attempts a 3Pt. Contested by Cole Griffin (3.8 feet, ZONE). DeMar James misses. Offensive rebound by DeMar James! DeMar James's putback is no good. Rebound secured by Scottie Herro.

[02:54] Team_096 possession (Score: 66-72)
Cole Griffin drives to the basket... Cole Griffin loses the ball! Stripped by D'Angelo Randle! TURNOVER! (live ball)

[02:41] Team_019 possession (Score: 66-72)
Tobias Hyland attempts a Layup. Contested by Scottie Herro (5.2 feet, MAN). Tobias Hyland misses. Rebound secured by Cole Griffin.

[02:28] Team_096 possession (Score: 66-72)
Kyrie Adebayo drives, picks up DeMar James. Help arrives from Brandon James! Kyrie Adebayo attempts a Layup. Contested by Brandon James (5.2 feet, MAN). KYRIE ADEBAYO MAKES IT!
Score: 68-72

[02:10] Team_019 possession (Score: 68-72)
DeMar James drives, Kyrie Adebayo stays with him. DeMar James attempts a Dunk. Contested by Kyrie Adebayo (4.5 feet, MAN). DEMAR JAMES MAKES IT! Assist: Brandon James
Score: 68-74

[01:52] Team_096 possession (Score: 68-74)
Terry Mobley attempts a 3Pt. Contested by Brandon James (5.5 feet, ZONE). Terry Mobley misses. Rebound secured by Tobias Hyland.

[01:38] Team_019 possession (Score: 68-74)
FOUL! Shooting foul on Lamelo Quickley. DeMar James to the line for 2 free throws. [BONUS: 5 team fouls] (Lamelo Quickley: 3 personal fouls)   FT 1/2: GOOD   FT 2/2: GOOD DeMar James makes 2/2 from the line.
Score: 68-76

[01:24] Team_096 possession (Score: 68-76)
Cole Griffin makes the Layup and draws the foul on D'Angelo Randle! And-1! Cole Griffin to the line for 1. [Team fouls: 3] (D'Angelo Randle: 2 personal fouls)   FT 1/1: GOOD Cole Griffin makes 1/1 from the line.
Score: 71-76

[01:11] Team_019 possession (Score: 71-76)
Brandon James throws a bad pass out of bounds! TURNOVER! (dead ball)

[01:11] Substitution (Team_096): Terry Mobley OUT → Cade Jokic IN (stamina_rule2)

[01:11] Substitution (Team_096): Lamelo Quickley OUT → Jarrett Markkanen IN (stamina_rule2)

[01:11] Substitution (Team_096): Cole Griffin OUT → Cole Holiday IN (stamina_rule2)

[01:11] Substitution (Team_096): Scottie Herro OUT → Tyler Haliburton IN (stamina_rule2)

[01:11] Substitution (Team_096): Kyrie Adebayo OUT → Devin Griffin IN (stamina_rule2)

[01:11] Substitution (Team_019): Rudy Giddey OUT → Gary Ginobili IN (stamina_rule2)

[01:11] Substitution (Team_019): Brandon James OUT → Jalen Turner IN (stamina_rule2)

[01:11] Substitution (Team_019): D'Angelo Randle OUT → Blake LaVine IN (stamina_rule2)

[01:11] Substitution (Team_019): Tobias Hyland OUT → Shai Ingram IN (stamina_rule2)

[01:11] Substitution (Team_019): DeMar James OUT → Tim Jordan IN (stamina_rule2)

[01:00] Team_096 possession (Score: 71-76)
Tyler Haliburton attempts a 3Pt. Contested by Shai Ingram (4.5 feet, MAN). TYLER HALIBURTON MAKES IT! Assist: Cole Holiday
Score: 74-76

[00:44] Team_019 possession (Score: 74-76)
Shai Ingram attempts a 3Pt. Contested by Tyler Haliburton (5.0 feet, MAN). Shai Ingram misses. Rebound secured by Tyler Haliburton.

[00:30] Team_096 possession (Score: 74-76)
Tyler Haliburton attempts a Midrange. Contested by Shai Ingram (4.5 feet, MAN). TYLER HALIBURTON MAKES IT!
Score: 76-76

[00:17] Team_019 possession (Score: 76-76)
Shai Ingram loses the ball! Stripped by Tyler Haliburton! TURNOVER! (live ball)

================================================================================
                              3RD QUARTER COMPLETE                              
================================================================================

3RD QUARTER SCORE: Team_096 23, Team_019 27

BOX SCORE:
================================================================================

Team_096
--------------------------------------------------------------------------------
Player                MIN  PTS  REB  AST  TO      FG   FG%      3P   3P%
--------------------------------------------------------------------------------
Cole Griffin           31    6    3    1   0   2/4    50.0     0/0   0.0
Tyler Haliburton        6    5    1    0   0   2/2   100.0     0/0   0.0
Lamelo Quickley        30    4    0    1   0   2/3    66.7     0/0   0.0
Kyrie Adebayo          31    4    1    1   0   2/3    66.7     0/0   0.0
Terry Mobley           30    0    0    0   0   0/3     0.0     0/0   0.0
Cole Holiday            5    0    0    1   0   0/0     0.0     0/0   0.0

TEAM: FG: 10/19 (52.6%), 3PT: 2/6 (33.3%), REB: 9 (3 off, 6 def), AST: 4, TO: 3
TEAM FOULS: 5 [Team_019 in BONUS]


Team_019
--------------------------------------------------------------------------------
Player                MIN  PTS  REB  AST  TO      FG   FG%      3P   3P%
--------------------------------------------------------------------------------
DeMar James            23   14    4    0   0   6/7    85.7     0/0   0.0
D'Angelo Randle        30   10    4    0   0   4/4   100.0     0/0   0.0
Scottie Herro          30    4    4    0   0   2/4    50.0     0/0   0.0
Brandon James          30    3    0    1   0   1/2    50.0     0/0   0.0
Rudy Giddey            30    0    0    4   0   0/2     0.0     0/0   0.0
Tobias Hyland          23    0    4    0   0   0/2     0.0     0/0   0.0
Shai Ingram            13    0    0    0   0   0/1     0.0     0/0   0.0

TEAM: FG: 11/18 (61.1%), 3PT: 2/7 (28.6%), REB: 12 (4 off, 8 def), AST: 5, TO: 4
TEAM FOULS: 3

================================================================================

================================================================================
                       4TH QUARTER - Team_096 vs Team_019                       
================================================================================

[12:00] Team_096 possession (Score: 76-76)
Kyrie Adebayo drives to the basket... FOUL! Offensive foul on Kyrie Adebayo! DeMar James drew the charge! [Team fouls: 1] (Kyrie Adebayo: 1 personal fouls) TURNOVER! (dead ball)

[11:51] Team_019 possession (Score: 76-76)
Rudy Giddey drives and kicks out. DeMar James attempts a 3Pt. Contested by Cole Griffin (3.4 feet, ZONE). DeMar James misses. Rebound secured by Kyrie Adebayo.

[11:37] Team_096 possession (Score: 76-76)
Cole Griffin attempts a 3Pt. Contested by D'Angelo Randle (4.1 feet, MAN). Cole Griffin misses. Rebound secured by DeMar James.

[11:26] Team_019 possession (Score: 76-76)
D'Angelo Randle makes the Layup and draws the foul on Cole Griffin! And-1! D'Angelo Randle to the line for 1. [Team fouls: 2] (Cole Griffin: 1 personal fouls)   FT 1/1: GOOD D'Angelo Randle makes 1/1 from the line.
Score: 76-79

[11:16] Team_096 possession (Score: 76-79)
FOUL! Shooting foul on D'Angelo Randle. Cole Griffin to the line for 2 free throws. [Team fouls: 1] (D'Angelo Randle: 1 personal fouls)   FT 1/2: GOOD   FT 2/2: GOOD Cole Griffin makes 2/2 from the line.
Score: 78-79

[11:00] Team_019 possession (Score: 78-79)
Rudy Giddey attempts a Layup. BLOCKED BY KYRIE ADEBAYO! Ball is loose! Offensive rebound by DeMar James! DeMar James kicks it out.

[10:41] Team_019 possession (Score: 78-79)
Rudy Giddey attempts a 3Pt. Contested by Terry Mobley (5.0 feet, MAN). Rudy Giddey misses. Offensive rebound by DeMar James! DeMar James puts it back in!
Score: 78-81

[10:29] Team_096 possession (Score: 78-81)
Terry Mobley attempts a 3Pt. Wide open! Tobias Hyland is 6.1 feet away. [ZONE] Terry Mobley misses. Rebound secured by Tobias Hyland.

[10:14] Team_019 possession (Score: 78-81)
D'Angelo Randle attempts a 3Pt. Contested by Cole Griffin (3.8 feet, ZONE). D'Angelo Randle misses. Rebound secured by Scottie Herro.

[10:02] Team_096 possession (Score: 78-81)
Cole Griffin attempts a 3Pt. Wide open! Tobias Hyland is 6.3 feet away. [ZONE] COLE GRIFFIN MAKES IT! Assist: Terry Mobley
Score: 81-81

[09:47] Team_019 possession (Score: 81-81)
D'Angelo Randle attempts a 3Pt. Contested by Cole Griffin (3.8 feet, MAN). D'Angelo Randle misses. FOUL! Loose ball foul on Kyrie Adebayo during the rebound battle. [Team fouls: 3] No free throws, side out. (Kyrie Adebayo: 2 personal fouls)

[09:36] Team_019 possession (Score: 81-81)
Rudy Giddey attempts a 3Pt. Contested by Terry Mobley (5.1 feet, MAN). Rudy Giddey misses. Offensive rebound by D'Angelo Randle! D'Angelo Randle kicks it out.

[09:18] Team_019 possession (Score: 81-81)
Rudy Giddey attempts a 3Pt. Contested by Terry Mobley (5.2 feet, MAN). Rudy Giddey misses. Rebound secured by Cole Griffin.

[09:02] Team_096 possession (Score: 81-81)
FOUL! Shooting foul on Brandon James. Lamelo Quickley to the line for 2 free throws. [Team fouls: 2] (Brandon James: 1 personal fouls)   FT 1/2: GOOD   FT 2/2: GOOD Lamelo Quickley makes 2/2 from the line.
Score: 83-81

[08:49] Team_019 possession (Score: 83-81)
Tobias Hyland attempts a Midrange. Contested by Lamelo Quickley (4.4 feet, ZONE). TOBIAS HYLAND MAKES IT!
Score: 83-83

[08:30] Team_096 possession (Score: 83-83)
Terry Mobley attempts a 3Pt. Contested by D'Angelo Randle (4.3 feet, ZONE). Terry Mobley misses. Rebound secured by DeMar James.

[08:14] Team_019 possession (Score: 83-83)
Rudy Giddey attempts a 3Pt. Contested by Terry Mobley (5.3 feet, MAN). Rudy Giddey misses. Rebound secured by Scottie Herro.

[07:59] Team_096 possession (Score: 83-83)
Scottie Herro attempts a 3Pt. Wide open! Tobias Hyland is 6.3 feet away. [MAN] Scottie Herro misses. Offensive rebound by Kyrie Adebayo! Kyrie Adebayo puts it back in!
Score: 85-83

[07:47] Team_019 possession (Score: 85-83)
DeMar James attempts a Layup. Contested by Kyrie Adebayo (4.8 feet, MAN). DeMar James misses. Rebound secured by Kyrie Adebayo.

[07:35] Team_096 possession (Score: 85-83)
Kyrie Adebayo drives to the basket... Kyrie Adebayo throws a bad pass! Stolen by DeMar James! TURNOVER! (live ball)

[07:21] Team_019 possession (Score: 85-83)
D'Angelo Randle attempts a 3Pt. Contested by Cole Griffin (4.1 feet, MAN). D'Angelo Randle misses. Rebound secured by Scottie Herro.

[07:07] Team_096 possession (Score: 85-83)
Cole Griffin drives and kicks out. Kyrie Adebayo attempts a 3Pt. Contested by DeMar James (5.1 feet, MAN). Kyrie Adebayo misses. Rebound secured by Tobias Hyland.

[06:49] Team_019 possession (Score: 85-83)
D'Angelo Randle drives, Cole Griffin stays with him. D'Angelo Randle attempts a Dunk. Contested by Cole Griffin (4.2 feet, MAN). D'ANGELO RANDLE MAKES IT! Assist: DeMar James
Score: 85-85

[06:33] Team_096 possession (Score: 85-85)
Terry Mobley attempts a Layup. Wide open! Rudy Giddey is 6.0 feet away. [MAN] Terry Mobley misses. Rebound secured by D'Angelo Randle.

[06:17] Team_019 possession (Score: 85-85)
FOUL! Shooting foul on Kyrie Adebayo. DeMar James to the line for 2 free throws. [Team fouls: 4] (Kyrie Adebayo: 3 personal fouls)   FT 1/2: GOOD   FT 2/2: GOOD DeMar James makes 2/2 from the line.
Score: 85-87

[06:02] Team_096 possession (Score: 85-87)
Cole Griffin attempts a Midrange. Contested by D'Angelo Randle (4.9 feet, MAN). Cole Griffin misses. Rebound secured by D'Angelo Randle.

[05:47] Team_019 possession (Score: 85-87)
Tobias Hyland attempts a 3Pt. Contested by Cole Griffin (4.1 feet, ZONE). TOBIAS HYLAND MAKES IT! Assist: Rudy Giddey
Score: 85-90

[05:31] Team_096 possession (Score: 85-90)
Scottie Herro attempts a 3Pt. Wide open! Tobias Hyland is 6.6 feet away. [MAN] Scottie Herro misses. Rebound secured by D'Angelo Randle.

[05:21] Team_019 possession (Score: 85-90)
Tobias Hyland makes the Layup and draws the foul on Scottie Herro! And-1! Tobias Hyland to the line for 1. [BONUS: 5 team fouls] (Scottie Herro: 1 personal fouls)   FT 1/1: GOOD Tobias Hyland makes 1/1 from the line.
Score: 85-93

[05:08] Team_096 possession (Score: 85-93)
Lamelo Quickley attempts a 3Pt. Contested by Brandon James (5.5 feet, MAN). Lamelo Quickley misses. Rebound secured by Tobias Hyland.

[04:57] Team_019 possession (Score: 85-93)
Brandon James attempts a 3Pt. Contested by Cole Griffin (4.3 feet, ZONE). Brandon James misses. Rebound secured by Kyrie Adebayo.

[04:42] Team_096 possession (Score: 85-93)
Terry Mobley attempts a 3Pt. Wide open! Rudy Giddey is 6.2 feet away. [MAN] Terry Mobley misses. Rebound secured by DeMar James.

[04:28] Team_019 possession (Score: 85-93)
Rudy Giddey attempts a 3Pt. Contested by Cole Griffin (4.5 feet, ZONE). RUDY GIDDEY MAKES IT! Assist: Brandon James
Score: 85-96

[04:13] Team_096 possession (Score: 85-96)
Scottie Herro drives and kicks out. Terry Mobley attempts a 3Pt. Wide open! Brandon James is 6.2 feet away. [ZONE] TERRY MOBLEY MAKES IT! Assist: Lamelo Quickley
Score: 88-96

[03:54] Team_019 possession (Score: 88-96)
Rudy Giddey drives and kicks out. D'Angelo Randle attempts a Midrange. Wide open! Scottie Herro is 6.1 feet away. [ZONE] D'ANGELO RANDLE MAKES IT! Assist: Tobias Hyland
Score: 88-98

[03:43] Team_096 possession (Score: 88-98)
Kyrie Adebayo drives, picks up DeMar James. Help arrives from Brandon James! Kyrie Adebayo attempts a Dunk. Wide open! Brandon James is 6.1 feet away. [MAN] KYRIE ADEBAYO MAKES IT!
Score: 90-98

[03:28] Team_019 possession (Score: 90-98)
Tobias Hyland attempts a 3Pt. Wide open! Scottie Herro is 6.0 feet away. [MAN] Tobias Hyland misses. Rebound secured by Scottie Herro.

[03:16] Team_096 possession (Score: 90-98)
Terry Mobley attempts a 3Pt. Wide open! Rudy Giddey is 6.4 feet away. [MAN] Terry Mobley misses. Rebound secured by DeMar James.

[03:05] Team_019 possession (Score: 90-98)
Brandon James attempts a Midrange. Contested by Lamelo Quickley (5.2 feet, ZONE). Brandon James misses. FOUL! Loose ball foul on Scottie Herro during the rebound battle. [IN THE BONUS! 6 team fouls] D'Angelo Randle to the line for 2 free throws. (Scottie Herro: 2 personal fouls)   FT 1/2: GOOD   FT 2/2: GOOD D'Angelo Randle makes 2/2 from the line.
Score: 90-100

[02:48] Team_096 possession (Score: 90-100)
Cole Griffin attempts a 3Pt. Contested by D'Angelo Randle (5.4 feet, ZONE). Cole Griffin misses. Offensive rebound by Scottie Herro! Scottie Herro kicks it out.

[02:29] Team_096 possession (Score: 90-100)
Lamelo Quickley attempts a 3Pt. Contested by Brandon James (5.9 feet, MAN). Lamelo Quickley misses. Rebound secured by D'Angelo Randle.

[02:15] Team_019 possession (Score: 90-100)
FOUL! Holding foul on Cole Griffin. [IN THE BONUS! 7 team fouls] D'Angelo Randle to the line for 2 free throws. (Cole Griffin: 2 personal fouls)   FT 1/2: GOOD   FT 2/2: GOOD D'Angelo Randle makes 2/2 from the line.
Score: 90-102

[01:59] Team_096 possession (Score: 90-102)
Scottie Herro attempts a Midrange. Wide open! Brandon James is 6.4 feet away. [ZONE] Scottie Herro misses. Rebound secured by Tobias Hyland.

[01:43] Team_019 possession (Score: 90-102)
D'Angelo Randle attempts a Midrange. Contested by Lamelo Quickley (5.5 feet, ZONE). D'Angelo Randle misses. Rebound secured by Scottie Herro.

[01:31] Team_096 possession (Score: 90-102)
Kyrie Adebayo drives, DeMar James stays with him. Kyrie Adebayo attempts a Dunk. Wide open! DeMar James is 6.5 feet away. [MAN] KYRIE ADEBAYO MAKES IT!
Score: 92-102

[01:19] Team_019 possession (Score: 92-102)
D'Angelo Randle makes the Layup and draws the foul on Cole Griffin! And-1! D'Angelo Randle to the line for 1. [BONUS: 8 team fouls] (Cole Griffin: 3 personal fouls)   FT 1/1: GOOD D'Angelo Randle makes 1/1 from the line.
Score: 92-105

[01:04] Team_096 possession (Score: 92-105)
Scottie Herro attempts a Layup. Wide open! Tobias Hyland is 7.2 feet away. [MAN] Scottie Herro misses. Offensive rebound by Kyrie Adebayo! Kyrie Adebayo kicks it out.

[00:51] Team_096 possession (Score: 92-105)
Kyrie Adebayo drives to the basket... FOUL! Offensive foul on Kyrie Adebayo! DeMar James drew the charge! [Team fouls: 9] (Kyrie Adebayo: 4 personal fouls) TURNOVER! (dead ball)

[00:37] Team_019 possession (Score: 92-105)
Rudy Giddey attempts a 3Pt. Contested by Cole Griffin (5.1 feet, ZONE). Rudy Giddey misses. Offensive rebound by D'Angelo Randle! D'Angelo Randle kicks it out.

[00:21] Team_019 possession (Score: 92-105)
DeMar James makes the Dunk and draws the foul on Kyrie Adebayo! And-1! DeMar James to the line for 1. [BONUS: 10 team fouls] (Kyrie Adebayo: 5 personal fouls)   FT 1/1: MISS DeMar James makes 0/1 from the line. Rebound secured by Scottie Herro.
Score: 92-107

[00:09] Team_096 possession (Score: 92-107)
FOUL! Shooting foul on DeMar James. Cole Griffin to the line for 2 free throws. [Team fouls: 3] (DeMar James: 1 personal fouls)   FT 1/2: GOOD   FT 2/2: GOOD Cole Griffin makes 2/2 from the line.
Score: 94-107

================================================================================
                              4TH QUARTER COMPLETE                              
================================================================================

4TH QUARTER SCORE: Team_096 18, Team_019 31

BOX SCORE:
================================================================================

Team_096
--------------------------------------------------------------------------------
Player                MIN  PTS  REB  AST  TO      FG   FG%      3P   3P%
--------------------------------------------------------------------------------
Cole Griffin           43    7    1    0   0   3/6    50.0     0/0   0.0
Kyrie Adebayo          43    6    5    0   0   3/3   100.0     0/0   0.0
Terry Mobley           43    3    0    1   0   1/6    16.7     0/0   0.0
Lamelo Quickley        43    2    0    1   0   1/3    33.3     0/0   0.0
Scottie Herro          43    0    7    0   0   0/2     0.0     0/0   0.0

TEAM: FG: 8/20 (40.0%), 3PT: 2/10 (20.0%), REB: 13 (3 off, 10 def), AST: 2, TO: 3
TEAM FOULS: 10 [Team_019 in BONUS]


Team_019
--------------------------------------------------------------------------------
Player                MIN  PTS  REB  AST  TO      FG   FG%      3P   3P%
--------------------------------------------------------------------------------
D'Angelo Randle        43   14    7    0   0   6/9    66.7     0/0   0.0
Tobias Hyland          35    8    4    1   0   3/4    75.0     0/0   0.0
DeMar James            35    4    6    1   0   2/4    50.0     0/0   0.0
Rudy Giddey            43    3    0    1   0   1/4    25.0     0/0   0.0
Brandon James          43    0    0    1   0   0/1     0.0     0/0   0.0

TEAM: FG: 12/22 (54.5%), 3PT: 3/9 (33.3%), REB: 17 (5 off, 12 def), AST: 4, TO: 0
TEAM FOULS: 3

================================================================================

================================================================================
                               FULL GAME COMPLETE                               
================================================================================

FINAL SCORE: Team_096 94, Team_019 107

SCORING BY QUARTER:
--------------------------------------------------------------------------------
Team                     Q1     Q2     Q3     Q4    FINAL
--------------------------------------------------------------------------------
Team_096                 21     32     23     18       94
Team_019                 21     28     27     31      107
--------------------------------------------------------------------------------

FULL GAME BOX SCORE:
================================================================================

Team_096
--------------------------------------------------------------------------------
Player                MIN  PTS  REB  AST  TO      FG   FG%      3P   3P%      FT STL BLK
--------------------------------------------------------------------------------
Cole Griffin           43   27    6    5   5  12/19   63.2   4/7    57.1   7/7     1   0
Kyrie Adebayo          43   16   13    2   3   7/9    77.8   1/2    50.0   0/0     1   2
Terry Mobley           43   11    0    3   1   4/15   26.7   2/11   18.2   0/0     1   0
Lamelo Quickley        43   13    0    4   1   6/11   54.5   0/4     0.0   3/3     0   1
Scottie Herro          43   16   19    3   4   7/12   58.3   2/5    40.0   2/2     1   0
Cade Jokic              6    4    0    0   1   2/2   100.0   0/0     0.0   0/0     0   0
Jarrett Markkanen       6    0    1    0   0   0/1     0.0   0/1     0.0   0/0     0   0
Tyler Haliburton        6    7    2    0   0   3/4    75.0   1/1   100.0   0/0     1   0
Cole Holiday            5    0    0    2   0   0/1     0.0   0/0     0.0   0/0     0   0
Devin Griffin           5    0    1    0   0   0/0     0.0   0/0     0.0   0/0     0   0

TEAM: FG: 41/74 (55.4%), 3PT: 10/31 (32.3%), REB: 41 (12 off, 29 def), AST: 19, TO: 15


Team_019
--------------------------------------------------------------------------------
Player                MIN  PTS  REB  AST  TO      FG   FG%      3P   3P%      FT STL BLK
--------------------------------------------------------------------------------
Rudy Giddey            43   15    0    7   3  10/19   52.6   4/11   36.4   2/2     0   0
Brandon James          43    9    0    3   1   4/8    50.0   0/2     0.0   1/1     0   0
D'Angelo Randle        43   34   12    0   2  13/17   76.5   4/7    57.1   6/6     3   1
Tobias Hyland          35    8   10    4   1   3/7    42.9   1/2    50.0   1/1     2   0
DeMar James            35   22   14    3   2   8/12   66.7   0/1     0.0   7/8     2   0
Shai Ingram            13    4    1    3   4   1/3    33.3   0/2     0.0   0/0     0   0
Tim Jordan             13    5    4    1   0   1/2    50.0   0/0     0.0   0/0     0   0
Gary Ginobili           6    0    0    0   0   0/0     0.0   0/0     0.0   0/0     0   0
Jalen Turner            6    2    0    0   0   1/3    33.3   0/2     0.0   0/0     0   0
Blake LaVine            6    6    3    1   0   2/3    66.7   1/2    50.0   4/4     0   0

TEAM: FG: 44/75 (58.7%), 3PT: 10/29 (34.5%), REB: 45 (13 off, 32 def), AST: 22, TO: 13

================================================================================
