================================================================================
                        FULL GAME - Team_004 vs Team_073                        
================================================================================

================================================================================
                       1ST QUARTER - Team_004 vs Team_073                       
================================================================================

[12:00] Team_004 possession (Score: 0-0)
Anthony Lillard drives, Bradley Morant stays with him. Anthony Lillard attempts a Dunk. Contested by Bradley Morant (4.3 feet, MAN). ANTHONY LILLARD MAKES IT! Assist: Jabari Wade
Score: 2-0

[11:49] Team_073 possession (Score: 2-0)
Isaiah Smith drives, Anthony Lillard stays with him. Isaiah Smith attempts a Dunk. Contested by Anthony Lillard (4.3 feet, ZONE). Isaiah Smith misses. Rebound secured by Draymond Fox.

[11:35] Team_004 possession (Score: 2-0)
Anthony Lillard attempts a 3Pt. Contested by Bradley Morant (4.3 feet, MAN). Anthony Lillard misses. Rebound secured by Carmelo Porzingis.

[11:22] Team_073 possession (Score: 2-0)
Isaiah Smith drives, picks up Jabari Wade. Help arrives from Dwyane Irving! Isaiah Smith attempts a Dunk. Contested by Dwyane Irving (4.9 feet, MAN). Isaiah Smith misses. Rebound secured by Dwyane Irving.

[11:11] Team_004 possession (Score: 2-0)
FOUL! Shooting foul on Bradley Morant. Dwyane Irving to the line for 2 free throws. [Team fouls: 1] (Bradley Morant: 1 personal fouls)   FT 1/2: GOOD   FT 2/2: MISS Dwyane Irving makes 1/2 from the line. Offensive rebound by Anthony Lillard! Anthony Lillard kicks it out.
Score: 3-0

[10:58] Team_004 possession (Score: 3-0)
Dwyane Irving attempts a Midrange. Contested by Karl Williamson (3.4 feet, MAN). DWYANE IRVING MAKES IT!
Score: 5-0

[10:43] Team_073 possession (Score: 5-0)
Carmelo Porzingis attempts a Midrange. Contested by Draymond Fox (4.2 feet, MAN). Carmelo Porzingis misses. Rebound secured by Anthony Lillard.

[10:26] Team_004 possession (Score: 5-0)
Anthony Lillard attempts a Midrange. Contested by Carmelo Porzingis (4.1 feet, ZONE). ANTHONY LILLARD MAKES IT! Assist: Dwyane Irving
Score: 7-0

[10:09] Team_073 possession (Score: 7-0)
Carmelo Porzingis attempts a Layup. BLOCKED BY ANTHONY LILLARD! Ball is loose! Rebound secured by Anthony Lillard.

[09:57] Team_004 possession (Score: 7-0)
Jabari Wade attempts a Layup. Contested by Bradley Morant (4.6 feet, ZONE). JABARI WADE MAKES IT! Assist: Anthony Lillard
Score: 9-0

[09:41] Team_073 possession (Score: 9-0)
Karl Williamson attempts a 3Pt. Contested by Michael Curry (5.3 feet, ZONE). Karl Williamson misses. Rebound secured by Draymond Fox.

[09:30] Team_004 possession (Score: 9-0)
Dwyane Irving attempts a 3Pt. Contested by Karl Williamson (3.4 feet, ZONE). DWYANE IRVING MAKES IT! Assist: Draymond Fox
Score: 12-0

[09:15] Team_073 possession (Score: 12-0)
Karl Williamson drives and kicks out. Karl Williamson attempts a 3Pt. Contested by Dwyane Irving (3.5 feet, MAN). Karl Williamson misses. Rebound secured by Draymond Fox.

[09:00] Team_004 possession (Score: 12-0)
Anthony Lillard attempts a Layup. Contested by Bradley Morant (4.3 feet, ZONE). ANTHONY LILLARD MAKES IT!
Score: 14-0

[08:42] Team_073 possession (Score: 14-0)
Karl Williamson attempts a Midrange. Contested by Dwyane Irving (3.8 feet, MAN). Karl Williamson misses. Offensive rebound by Bradley Morant! Bradley Morant kicks it out.

[08:22] Team_073 possession (Score: 14-0)
FOUL! Offensive foul on Karl Williamson! Dwyane Irving drew the charge! [Team fouls: 2] (Karl Williamson: 1 personal fouls) TURNOVER! (dead ball)

[08:08] Team_004 possession (Score: 14-0)
Michael Curry drives, Bradley Morant stays with him. Michael Curry attempts a Dunk. Contested by Bradley Morant (4.0 feet, ZONE). Michael Curry misses. Rebound secured by Isaiah Smith.

[07:59] Team_073 possession (Score: 14-0)
Bradley Morant drives, Anthony Lillard stays with him. Bradley Morant attempts a Dunk. Contested by Anthony Lillard (4.5 feet, ZONE). BRADLEY MORANT MAKES IT!
Score: 14-2

[07:49] Team_004 possession (Score: 14-2)
FOUL! Shooting foul on Bradley Morant. Draymond Fox to the line for 2 free throws. [Team fouls: 3] (Bradley Morant: 2 personal fouls)   FT 1/2: GOOD   FT 2/2: GOOD Draymond Fox makes 2/2 from the line.
Score: 16-2

[07:34] Team_073 possession (Score: 16-2)
Bradley Morant attempts a Layup. Contested by Anthony Lillard (4.5 feet, ZONE). BRADLEY MORANT MAKES IT! Assist: Karl Williamson
Score: 16-4

[07:17] Team_004 possession (Score: 16-4)
Jabari Wade makes the Layup and draws the foul on Isaiah Smith! And-1! Jabari Wade to the line for 1. [Team fouls: 4] (Isaiah Smith: 1 personal fouls)   FT 1/1: GOOD Jabari Wade makes 1/1 from the line.
Score: 19-4

[07:03] Team_073 possession (Score: 19-4)
Karl Williamson attempts a Midrange. Contested by Dwyane Irving (3.8 feet, MAN). Karl Williamson misses. FOUL! Loose ball foul on Draymond Fox during the rebound battle. [Team fouls: 1] No free throws, side out. (Draymond Fox: 1 personal fouls)

[06:51] Team_073 possession (Score: 19-4)
Karl Williamson attempts a Midrange. Contested by Dwyane Irving (3.8 feet, MAN). KARL WILLIAMSON MAKES IT! Assist: Carmelo Porzingis
Score: 19-6

[06:35] Team_004 possession (Score: 19-6)
Jabari Wade drives to the basket... Jabari Wade throws a bad pass! Stolen by Bradley Morant! TURNOVER! (live ball)

[06:19] Team_073 possession (Score: 19-6)
Carmelo Young attempts a 3Pt. Contested by Michael Curry (5.2 feet, MAN). Carmelo Young misses. Rebound secured by Draymond Fox.

[06:05] Team_004 possession (Score: 19-6)
Michael Curry drives, Bradley Morant stays with him. Michael Curry attempts a Layup. Contested by Bradley Morant (4.0 feet, ZONE). MICHAEL CURRY MAKES IT!
Score: 21-6

[05:48] Team_073 possession (Score: 21-6)
Isaiah Smith makes the Layup and draws the foul on Jabari Wade! And-1! Isaiah Smith to the line for 1. [Team fouls: 2] (Jabari Wade: 1 personal fouls)   FT 1/1: GOOD Isaiah Smith makes 1/1 from the line.
Score: 21-9

[05:33] Team_004 possession (Score: 21-9)
Draymond Fox drives and kicks out. Draymond Fox attempts a 3Pt. Contested by Carmelo Porzingis (3.7 feet, MAN). Draymond Fox misses. Rebound secured by Carmelo Porzingis.

[05:17] Team_073 possession (Score: 21-9)
Isaiah Smith attempts a 3Pt. Contested by Michael Curry (5.2 feet, ZONE). Isaiah Smith misses. Rebound secured by Anthony Lillard.

[05:01] Team_004 possession (Score: 21-9)
Dwyane Irving attempts a 3Pt. Contested by Karl Williamson (3.4 feet, ZONE). Dwyane Irving misses. Rebound secured by Bradley Morant.

[04:45] Team_073 possession (Score: 21-9)
Carmelo Porzingis attempts a 3Pt. Contested by Michael Curry (5.2 feet, ZONE). Carmelo Porzingis misses. Rebound secured by Draymond Fox.

[04:26] Team_004 possession (Score: 21-9)
Jabari Wade attempts a 3Pt. Contested by Karl Williamson (3.8 feet, ZONE). Jabari Wade misses. Rebound secured by Bradley Morant.

[04:13] Team_073 possession (Score: 21-9)
Carmelo Porzingis attempts a 3Pt. Contested by Draymond Fox (4.3 feet, MAN). Carmelo Porzingis misses. Offensive rebound by Bradley Morant! Bradley Morant kicks it out.

[04:00] Team_073 possession (Score: 21-9)
Carmelo Porzingis drives, Anthony Lillard stays with him. Carmelo Porzingis attempts a Dunk. Contested by Anthony Lillard (4.4 feet, ZONE). Carmelo Porzingis misses. Rebound secured by Draymond Fox.

[03:50] Team_004 possession (Score: 21-9)
Michael Curry attempts a Midrange. Contested by Isaiah Smith (4.5 feet, ZONE). Michael Curry misses. Rebound secured by Isaiah Smith.

[03:34] Team_073 possession (Score: 21-9)
Bradley Morant drives, Anthony Lillard stays with him. Bradley Morant attempts a Layup. Contested by Anthony Lillard (4.7 feet, MAN). BRADLEY MORANT MAKES IT!
Score: 21-11

[03:17] Team_004 possession (Score: 21-11)
Michael Curry attempts a 3Pt. Contested by Carmelo Porzingis (4.0 feet, ZONE). Michael Curry misses. Rebound secured by Carmelo Porzingis.

[03:02] Team_073 possession (Score: 21-11)
Bradley Morant attempts a Dunk. BLOCKED BY ANTHONY LILLARD! Ball is loose! Offensive rebound by Carmelo Porzingis! Carmelo Porzingis kicks it out.

[02:49] Team_073 possession (Score: 21-11)
Carmelo Porzingis attempts a 3Pt. Contested by Michael Curry (5.3 feet, ZONE). Carmelo Porzingis misses. FOUL! Loose ball foul on Dwyane Irving during the rebound battle. [Team fouls: 3] No free throws, side out. (Dwyane Irving: 1 personal fouls)

[02:39] Team_073 possession (Score: 21-11)
Karl Williamson attempts a Layup. Contested by Dwyane Irving (4.0 feet, MAN). KARL WILLIAMSON MAKES IT!
Score: 21-13

[02:29] Team_004 possession (Score: 21-13)
Michael Curry drives, Bradley Morant stays with him. Michael Curry attempts a Dunk. Contested by Bradley Morant (4.3 feet, ZONE). Michael Curry misses. Rebound secured by Bradley Morant.

[02:15] Team_073 possession (Score: 21-13)
Isaiah Smith attempts a 3Pt. Contested by Jabari Wade (5.2 feet, MAN). Isaiah Smith misses. Rebound secured by Anthony Lillard.

[02:01] Team_004 possession (Score: 21-13)
Michael Curry attempts a 3Pt. Contested by Carmelo Young (5.0 feet, MAN). MICHAEL CURRY MAKES IT!
Score: 24-13

[01:49] Team_073 possession (Score: 24-13)
FOUL! Shooting foul on Draymond Fox. Carmelo Porzingis to the line for 2 free throws. [Team fouls: 4] (Draymond Fox: 2 personal fouls)   FT 1/2: GOOD   FT 2/2: GOOD Carmelo Porzingis makes 2/2 from the line.
Score: 24-15

[01:36] Team_004 possession (Score: 24-15)
Jabari Wade attempts a Layup. Contested by Bradley Morant (4.9 feet, ZONE). JABARI WADE MAKES IT! Assist: Draymond Fox
Score: 26-15

[01:25] Team_073 possession (Score: 26-15)
Karl Williamson drives and kicks out. Carmelo Porzingis attempts a Midrange. Contested by Dwyane Irving (3.9 feet, ZONE). CARMELO PORZINGIS MAKES IT! Assist: Carmelo Young
Score: 26-17

[01:14] Team_004 possession (Score: 26-17)
Anthony Lillard attempts a Layup. Contested by Bradley Morant (4.7 feet, ZONE). ANTHONY LILLARD MAKES IT! Assist: Dwyane Irving
Score: 28-17

[01:02] Team_073 possession (Score: 28-17)
Isaiah Smith drives and kicks out. Karl Williamson attempts a Midrange. Contested by Jabari Wade (5.2 feet, ZONE). Karl Williamson misses. Rebound secured by Dwyane Irving.

[00:51] Team_004 possession (Score: 28-17)
Draymond Fox throws a bad pass! Stolen by Carmelo Porzingis! TURNOVER! (live ball)

[00:36] Team_073 possession (Score: 28-17)
Bradley Morant makes the Layup and draws the foul on Anthony Lillard! And-1! Bradley Morant to the line for 1. [BONUS: 5 team fouls] (Anthony Lillard: 1 personal fouls)   FT 1/1: GOOD Bradley Morant makes 1/1 from the line.
Score: 28-20

[00:20] Team_004 possession (Score: 28-20)
Anthony Lillard attempts a 3Pt. Contested by Bradley Morant (4.8 feet, MAN). Anthony Lillard misses. FOUL! Loose ball foul on Bradley Morant during the rebound battle. [IN THE BONUS! 5 team fouls] Anthony Lillard to the line for 2 free throws. (Bradley Morant: 3 personal fouls)   FT 1/2: GOOD   FT 2/2: GOOD Anthony Lillard makes 2/2 from the line.
Score: 30-20

[00:06] Team_073 possession (Score: 30-20)
Carmelo Porzingis drives, Anthony Lillard stays with him. Carmelo Porzingis attempts a Layup. Contested by Anthony Lillard (4.9 feet, ZONE). Carmelo Porzingis misses. Rebound secured by Draymond Fox.

================================================================================
                              1ST QUARTER COMPLETE                              
================================================================================

1ST QUARTER SCORE: Team_004 30, Team_073 20

BOX SCORE:
================================================================================

Team_004
--------------------------------------------------------------------------------
Player                MIN  PTS  REB  AST  TO      FG   FG%      3P   3P%
--------------------------------------------------------------------------------
Anthony Lillard        12   10    5    1   0   5/6    83.3     0/0   0.0
Jabari Wade            12    7    0    1   0   3/4    75.0     0/0   0.0
Dwyane Irving          12    5    2    2   0   2/3    66.7     0/0   0.0
Michael Curry          12    5    0    0   0   2/6    33.3     0/0   0.0
Draymond Fox           12    2    7    2   0   1/2    50.0     0/0   0.0

TEAM: FG: 13/21 (61.9%), 3PT: 3/7 (42.9%), REB: 14 (1 off, 13 def), AST: 6, TO: 2
TEAM FOULS: 5 [Team_073 in BONUS]


Team_073
--------------------------------------------------------------------------------
Player                MIN  PTS  REB  AST  TO      FG   FG%      3P   3P%
--------------------------------------------------------------------------------
Bradley Morant         12    9    7    0   0   4/4   100.0     0/0   0.0
Carmelo Porzingis      12    4    4    1   0   2/7    28.6     0/0   0.0
Karl Williamson        12    4    0    1   0   2/4    50.0     0/0   0.0
Isaiah Smith           12    3    2    0   0   1/6    16.7     0/0   0.0
Carmelo Young          12    0    0    1   0   0/1     0.0     0/0   0.0

TEAM: FG: 9/22 (40.9%), 3PT: 0/5 (0.0%), REB: 13 (5 off, 8 def), AST: 3, TO: 1
TEAM FOULS: 5 [Team_004 in BONUS]

================================================================================

================================================================================
                       2ND QUARTER - Team_004 vs Team_073                       
================================================================================

[12:00] Team_004 possession (Score: 30-20)
Dwyane Irving attempts a 3Pt. Contested by Karl Williamson (3.7 feet, MAN). Dwyane Irving misses. Rebound secured by Carmelo Porzingis.

[11:45] Team_073 possession (Score: 30-20)
Karl Williamson drives to the basket... Karl Williamson throws a bad pass! Stolen by Anthony Lillard! TURNOVER! (live ball)

[11:32] Team_004 possession (Score: 30-20)
Anthony Lillard attempts a Layup. BLOCKED BY BRADLEY MORANT! Ball is loose! Rebound secured by Isaiah Smith.

[11:20] Team_073 possession (Score: 30-20)
Bradley Morant drives and kicks out. Karl Williamson attempts a 3Pt. Contested by Michael Curry (5.4 feet, ZONE). Karl Williamson misses. Rebound secured by Draymond Fox.

[11:09] Team_004 possession (Score: 30-20)
Anthony Lillard attempts a Midrange. Contested by Bradley Morant (4.7 feet, MAN). ANTHONY LILLARD MAKES IT! Assist: Dwyane Irving
Score: 32-20

[10:56] Team_073 possession (Score: 32-20)
Karl Williamson attempts a 3Pt. Contested by Michael Curry (5.7 feet, ZONE). Karl Williamson misses. Rebound secured by Anthony Lillard.

[10:40] Team_004 possession (Score: 32-20)
Anthony Lillard attempts a Layup. Contested by Bradley Morant (4.7 feet, ZONE). Anthony Lillard misses. Rebound secured by Isaiah Smith.

[10:25] Team_073 possession (Score: 32-20)
Karl Williamson attempts a Layup. BLOCKED BY ANTHONY LILLARD! Ball goes out off Anthony Lillard. Karl Williamson's ball!

[10:14] Team_073 possession (Score: 32-20)
FOUL! Shooting foul on Michael Curry. Carmelo Porzingis to the line for 3 free throws. [Team fouls: 1] (Michael Curry: 1 personal fouls)   FT 1/3: GOOD   FT 2/3: MISS   FT 3/3: GOOD Carmelo Porzingis makes 2/3 from the line.
Score: 32-22

[10:03] Team_004 possession (Score: 32-22)
Jabari Wade attempts a Midrange. Contested by Isaiah Smith (5.4 feet, ZONE). Jabari Wade misses. Rebound secured by Isaiah Smith.

[09:53] Team_073 possession (Score: 32-22)
Karl Williamson attempts a 3Pt. Contested by Michael Curry (5.8 feet, ZONE). Karl Williamson misses. Rebound secured by Dwyane Irving.

[09:41] Team_004 possession (Score: 32-22)
Dwyane Irving drives to the basket... Dwyane Irving throws a bad pass out of bounds! TURNOVER! (dead ball)

[09:41] Substitution (Team_004): Michael Curry OUT → Karl Reaves IN (stamina_rule2)

[09:41] Substitution (Team_004): Jabari Wade OUT → Russell Barnes IN (stamina_rule2)

[09:41] Substitution (Team_004): Dwyane Irving OUT → Kristaps Green IN (stamina_rule2)

[09:41] Substitution (Team_004): Draymond Fox OUT → Michael Sabonis IN (stamina_rule2)

[09:41] Substitution (Team_004): Anthony Lillard OUT → Shai Beal IN (stamina_rule2)

[09:41] Substitution (Team_073): Carmelo Young OUT → Zach Quickley IN (stamina_rule2)

[09:41] Substitution (Team_073): Isaiah Smith OUT → Luka Butler IN (stamina_rule2)

[09:41] Substitution (Team_073): Karl Williamson OUT → Dwyane McCollum IN (stamina_rule2)

[09:41] Substitution (Team_073): Carmelo Porzingis OUT → Shai Thompson IN (stamina_rule2)

[09:41] Substitution (Team_073): Bradley Morant OUT → Ja Rose IN (stamina_rule2)

[09:23] Team_073 possession (Score: 32-22)
Luka Butler attempts a 3Pt. Contested by Karl Reaves (5.6 feet, ZONE). Luka Butler misses. Offensive rebound by Ja Rose! Ja Rose kicks it out.

[09:05] Team_073 possession (Score: 32-22)
Zach Quickley attempts a 3Pt. Contested by Karl Reaves (5.4 feet, ZONE). ZACH QUICKLEY MAKES IT! Assist: Shai Thompson
Score: 32-25

[08:51] Team_004 possession (Score: 32-25)
Karl Reaves attempts a 3Pt. Contested by Zach Quickley (4.0 feet, MAN). KARL REAVES MAKES IT! Assist: Kristaps Green
Score: 35-25

[08:40] Team_073 possession (Score: 35-25)
Dwyane McCollum attempts a Midrange. Contested by Shai Beal (5.1 feet, ZONE). Dwyane McCollum misses. FOUL! Loose ball foul on Michael Sabonis during the rebound battle. [Team fouls: 2] No free throws, side out. (Michael Sabonis: 1 personal fouls)

[08:30] Team_073 possession (Score: 35-25)
Zach Quickley attempts a 3Pt. Contested by Karl Reaves (5.4 feet, ZONE). Zach Quickley misses. Offensive rebound by Dwyane McCollum! Dwyane McCollum's putback is no good. Offensive rebound by Ja Rose! Ja Rose kicks it out.

[08:11] Team_073 possession (Score: 35-25)
Luka Butler attempts a Layup. BLOCKED BY SHAI BEAL! Ball is loose! Offensive rebound by Ja Rose! Ja Rose kicks it out.

[07:56] Team_073 possession (Score: 35-25)
Dwyane McCollum attempts a Layup. Contested by Shai Beal (5.1 feet, ZONE). Dwyane McCollum misses. Rebound secured by Michael Sabonis.

[07:40] Team_004 possession (Score: 35-25)
Kristaps Green attempts a Midrange. Contested by Shai Thompson (3.8 feet, ZONE). Kristaps Green misses. Rebound secured by Shai Thompson.

[07:21] Team_073 possession (Score: 35-25)
Ja Rose attempts a 3Pt. Contested by Shai Beal (5.2 feet, MAN). Ja Rose misses. FOUL! Loose ball foul on Russell Barnes during the rebound battle. [Team fouls: 3] No free throws, side out. (Russell Barnes: 1 personal fouls)

[07:09] Team_073 possession (Score: 35-25)
Zach Quickley attempts a 3Pt. Contested by Karl Reaves (5.4 feet, MAN). Zach Quickley misses. Rebound secured by Michael Sabonis.

[06:58] Team_004 possession (Score: 35-25)
Shai Beal makes the Layup and draws the foul on Shai Thompson! And-1! Shai Beal to the line for 1. [Team fouls: 1] (Shai Thompson: 1 personal fouls)   FT 1/1: GOOD Shai Beal makes 1/1 from the line.
Score: 38-25

[06:44] Team_073 possession (Score: 38-25)
Shai Thompson attempts a 3Pt. Contested by Karl Reaves (5.2 feet, ZONE). Shai Thompson misses. Rebound secured by Russell Barnes.

[06:32] Team_004 possession (Score: 38-25)
Karl Reaves attempts a 3Pt. Contested by Zach Quickley (4.0 feet, MAN). Karl Reaves misses. Rebound secured by Dwyane McCollum.

[06:15] Team_073 possession (Score: 38-25)
Ja Rose attempts a 3Pt. Contested by Karl Reaves (5.2 feet, ZONE). JA ROSE MAKES IT! Assist: Dwyane McCollum
Score: 38-28

[06:00] Team_004 possession (Score: 38-28)
Kristaps Green drives, picks up Dwyane McCollum. Help arrives from Luka Butler! Kristaps Green attempts a Layup. Contested by Luka Butler (4.1 feet, MAN). Kristaps Green misses. Rebound secured by Ja Rose.

[05:47] Team_073 possession (Score: 38-28)
Zach Quickley drives and kicks out. Ja Rose attempts a Midrange. Contested by Shai Beal (5.1 feet, MAN). Ja Rose misses. Rebound secured by Shai Beal.

[05:33] Team_004 possession (Score: 38-28)
Kristaps Green attempts a Midrange. Contested by Dwyane McCollum (4.1 feet, MAN). KRISTAPS GREEN MAKES IT! Assist: Karl Reaves
Score: 40-28

[05:22] Team_073 possession (Score: 40-28)
Shai Thompson attempts a 3Pt. Contested by Karl Reaves (5.2 feet, ZONE). SHAI THOMPSON MAKES IT! Assist: Ja Rose
Score: 40-31

[05:08] Team_004 possession (Score: 40-31)
Karl Reaves attempts a Midrange. Contested by Shai Thompson (3.3 feet, ZONE). Karl Reaves misses. Offensive rebound by Russell Barnes! Russell Barnes kicks it out.

[04:49] Team_004 possession (Score: 40-31)
Russell Barnes attempts a Midrange. Contested by Luka Butler (5.0 feet, MAN). Russell Barnes misses. Rebound secured by Dwyane McCollum.

[04:33] Team_073 possession (Score: 40-31)
Shai Thompson attempts a Midrange. Contested by Russell Barnes (4.8 feet, ZONE). Shai Thompson misses. FOUL! Loose ball foul on Russell Barnes during the rebound battle. [Team fouls: 4] No free throws, side out. (Russell Barnes: 2 personal fouls)

[04:22] Team_073 possession (Score: 40-31)
Dwyane McCollum drives, Shai Beal stays with him. Dwyane McCollum attempts a Layup. Contested by Shai Beal (5.1 feet, ZONE). Dwyane McCollum misses. Rebound secured by Michael Sabonis.

[04:04] Team_004 possession (Score: 40-31)
FOUL! Shooting foul on Ja Rose. Shai Beal to the line for 2 free throws. [Team fouls: 2] (Ja Rose: 1 personal fouls)   FT 1/2: GOOD   FT 2/2: GOOD Shai Beal makes 2/2 from the line.
Score: 42-31

[03:52] Team_073 possession (Score: 42-31)
Dwyane McCollum attempts a Midrange. Contested by Kristaps Green (4.4 feet, ZONE). Dwyane McCollum misses. Rebound secured by Russell Barnes.

[03:41] Team_004 possession (Score: 42-31)
Kristaps Green attempts a Midrange. Contested by Zach Quickley (4.5 feet, ZONE). Kristaps Green misses. Rebound secured by Ja Rose.

[03:27] Team_073 possession (Score: 42-31)
Luka Butler attempts a 3Pt. Contested by Russell Barnes (5.1 feet, MAN). LUKA BUTLER MAKES IT! Assist: Dwyane McCollum
Score: 42-34

[03:12] Team_004 possession (Score: 42-34)
Michael Sabonis attempts a Midrange. Contested by Shai Thompson (3.9 feet, ZONE). Michael Sabonis misses. Rebound secured by Dwyane McCollum.

[02:56] Team_073 possession (Score: 42-34)
Ja Rose attempts a 3Pt. Contested by Shai Beal (5.2 feet, MAN). Ja Rose misses. Rebound secured by Michael Sabonis.

[02:41] Team_004 possession (Score: 42-34)
Shai Beal drives and kicks out. Kristaps Green attempts a 3Pt. Contested by Shai Thompson (3.9 feet, ZONE). Kristaps Green misses. Rebound secured by Ja Rose.

[02:26] Team_073 possession (Score: 42-34)
Dwyane McCollum throws a bad pass out of bounds! TURNOVER! (dead ball)

[02:12] Team_004 possession (Score: 42-34)
FOUL! Reach-in foul on Shai Thompson during the drive. [Team fouls: 3] No free throws, side out. (Shai Thompson: 2 personal fouls)

[01:59] Team_004 possession (Score: 42-34)
Kristaps Green attempts a 3Pt. Contested by Luka Butler (4.6 feet, ZONE). KRISTAPS GREEN MAKES IT! Assist: Shai Beal
Score: 45-34

[01:46] Team_073 possession (Score: 45-34)
FOUL! Shooting foul on Shai Beal. Ja Rose to the line for 2 free throws. [BONUS: 5 team fouls] (Shai Beal: 1 personal fouls)   FT 1/2: GOOD   FT 2/2: GOOD Ja Rose makes 2/2 from the line.
Score: 45-36

[01:37] Team_004 possession (Score: 45-36)
Karl Reaves attempts a 3Pt. Contested by Luka Butler (4.1 feet, ZONE). Karl Reaves misses. Rebound secured by Shai Thompson.

[01:18] Team_073 possession (Score: 45-36)
Zach Quickley drives and kicks out. Shai Thompson attempts a Midrange. Contested by Kristaps Green (4.5 feet, ZONE). Shai Thompson misses. FOUL! Loose ball foul on Russell Barnes during the rebound battle. [IN THE BONUS! 6 team fouls] Dwyane McCollum to the line for 2 free throws. (Russell Barnes: 3 personal fouls)   FT 1/2: GOOD   FT 2/2: GOOD Dwyane McCollum makes 2/2 from the line.
Score: 45-38

[01:04] Team_004 possession (Score: 45-38)
Kristaps Green attempts a 3Pt. Contested by Shai Thompson (4.0 feet, ZONE). KRISTAPS GREEN MAKES IT! Assist: Shai Beal
Score: 48-38

[00:48] Team_073 possession (Score: 48-38)
Luka Butler drives to the basket... Luka Butler throws a bad pass out of bounds! TURNOVER! (dead ball)

[00:33] Team_004 possession (Score: 48-38)
Shai Beal attempts a Midrange. Contested by Ja Rose (5.9 feet, MAN). Shai Beal misses. Rebound secured by Dwyane McCollum.

[00:19] Team_073 possession (Score: 48-38)
Dwyane McCollum drives, Kristaps Green stays with him. Dwyane McCollum attempts a Layup. Contested by Kristaps Green (4.6 feet, MAN). DWYANE MCCOLLUM MAKES IT! Assist: Shai Thompson
Score: 48-40

================================================================================
                              2ND QUARTER COMPLETE                              
================================================================================

2ND QUARTER SCORE: Team_004 18, Team_073 20

BOX SCORE:
================================================================================

Team_004
--------------------------------------------------------------------------------
Player                MIN  PTS  REB  AST  TO      FG   FG%      3P   3P%
--------------------------------------------------------------------------------
Kristaps Green          9    8    0    1   0   3/6    50.0     0/0   0.0
Shai Beal               9    5    1    2   0   2/4    50.0     0/0   0.0
Karl Reaves             9    3    0    1   0   1/3    33.3     0/0   0.0
Anthony Lillard        15    2    1    0   0   1/3    33.3     0/0   0.0
Dwyane Irving          15    0    1    1   0   0/1     0.0     0/0   0.0
Draymond Fox           15    0    1    0   0   0/0     0.0     0/0   0.0
Jabari Wade            15    0    0    0   0   0/1     0.0     0/0   0.0
Michael Sabonis         9    0    4    0   0   0/1     0.0     0/0   0.0
Russell Barnes          9    0    3    0   0   0/1     0.0     0/0   0.0

TEAM: FG: 7/20 (35.0%), 3PT: 3/6 (50.0%), REB: 11 (1 off, 10 def), AST: 5, TO: 1
TEAM FOULS: 6 [Team_073 in BONUS]


Team_073
--------------------------------------------------------------------------------
Player                MIN  PTS  REB  AST  TO      FG   FG%      3P   3P%
--------------------------------------------------------------------------------
Ja Rose                 9    5    7    1   0   2/3    66.7     0/0   0.0
Dwyane McCollum         9    4    6    2   0   2/5    40.0     0/0   0.0
Zach Quickley           9    3    0    0   0   1/3    33.3     0/0   0.0
Shai Thompson           9    3    2    2   0   1/2    50.0     0/0   0.0
Luka Butler             9    3    0    0   0   1/1   100.0     0/0   0.0
Carmelo Porzingis      15    2    1    0   0   1/1   100.0     0/0   0.0
Isaiah Smith           15    0    3    0   0   0/0     0.0     0/0   0.0
Bradley Morant         15    0    0    0   0   0/1     0.0     0/0   0.0
Karl Williamson        15    0    0    0   0   0/2     0.0     0/0   0.0

TEAM: FG: 8/18 (44.4%), 3PT: 5/10 (50.0%), REB: 19 (6 off, 13 def), AST: 5, TO: 3
TEAM FOULS: 3

================================================================================

================================================================================
                       3RD QUARTER - Team_004 vs Team_073                       
================================================================================

[12:00] Team_004 possession (Score: 48-40)
Jabari Wade drives and kicks out. Jabari Wade attempts a 3Pt. Contested by Isaiah Smith (4.2 feet, MAN). Jabari Wade misses. Offensive rebound by Anthony Lillard! Anthony Lillard kicks it out.

[11:49] Team_004 possession (Score: 48-40)
Michael Curry attempts a 3Pt. Contested by Carmelo Porzingis (3.8 feet, ZONE). Michael Curry misses. Rebound secured by Isaiah Smith.

[11:30] Team_073 possession (Score: 48-40)
Carmelo Young attempts a Layup. Contested by Michael Curry (5.2 feet, MAN). Carmelo Young misses. Rebound secured by Draymond Fox.

[11:16] Team_004 possession (Score: 48-40)
FOUL! Shooting foul on Isaiah Smith. Dwyane Irving to the line for 2 free throws. [Team fouls: 1] (Isaiah Smith: 1 personal fouls)   FT 1/2: GOOD   FT 2/2: GOOD Dwyane Irving makes 2/2 from the line.
Score: 50-40

[11:01] Team_073 possession (Score: 50-40)
Isaiah Smith loses control! Ball rolls out of bounds! TURNOVER! (dead ball)

[10:50] Team_004 possession (Score: 50-40)
Dwyane Irving attempts a 3Pt. Contested by Karl Williamson (3.4 feet, MAN). Dwyane Irving misses. Rebound secured by Carmelo Porzingis.

[10:37] Team_073 possession (Score: 50-40)
Karl Williamson throws a bad pass out of bounds! TURNOVER! (dead ball)

[10:23] Team_004 possession (Score: 50-40)
FOUL! Shooting foul on Carmelo Porzingis. Jabari Wade to the line for 2 free throws. [Team fouls: 2] (Carmelo Porzingis: 1 personal fouls)   FT 1/2: GOOD   FT 2/2: MISS Jabari Wade makes 1/2 from the line. Rebound secured by Bradley Morant.
Score: 51-40

[10:08] Team_073 possession (Score: 51-40)
FOUL! Reach-in foul on Draymond Fox during the drive. [Team fouls: 1] No free throws, side out. (Draymond Fox: 1 personal fouls)

[09:54] Team_073 possession (Score: 51-40)
Bradley Morant makes the Layup and draws the foul on Anthony Lillard! And-1! Bradley Morant to the line for 1. [Team fouls: 2] (Anthony Lillard: 1 personal fouls)   FT 1/1: GOOD Bradley Morant makes 1/1 from the line.
Score: 51-43

[09:38] Team_004 possession (Score: 51-43)
Dwyane Irving attempts a Midrange. Contested by Karl Williamson (3.4 feet, MAN). DWYANE IRVING MAKES IT!
Score: 53-43

[09:25] Team_073 possession (Score: 53-43)
FOUL! Holding foul on Draymond Fox. [Team fouls: 3] No free throws, side out. (Draymond Fox: 2 personal fouls)

[09:10] Team_073 possession (Score: 53-43)
Bradley Morant drives and kicks out. Carmelo Porzingis attempts a Midrange. Contested by Michael Curry (5.0 feet, ZONE). Carmelo Porzingis misses. Rebound secured by Anthony Lillard.

[08:57] Team_004 possession (Score: 53-43)
Michael Curry drives, Bradley Morant stays with him. Michael Curry attempts a Layup. Contested by Bradley Morant (4.0 feet, ZONE). MICHAEL CURRY MAKES IT!
Score: 55-43

[08:41] Team_073 possession (Score: 55-43)
Karl Williamson makes the 3Pt and draws the foul on Dwyane Irving! And-1! Karl Williamson to the line for 1. [Team fouls: 4] (Dwyane Irving: 1 personal fouls)   FT 1/1: GOOD Karl Williamson makes 1/1 from the line.
Score: 55-47

[08:27] Team_004 possession (Score: 55-47)
Jabari Wade attempts a 3Pt. Contested by Karl Williamson (3.8 feet, ZONE). JABARI WADE MAKES IT! Assist: Michael Curry
Score: 58-47

[08:12] Team_073 possession (Score: 58-47)
FOUL! Shooting foul on Jabari Wade. Isaiah Smith to the line for 3 free throws. [BONUS: 5 team fouls] (Jabari Wade: 1 personal fouls)   FT 1/3: GOOD   FT 2/3: GOOD   FT 3/3: GOOD Isaiah Smith makes 3/3 from the line.
Score: 58-50

[07:55] Team_004 possession (Score: 58-50)
Dwyane Irving attempts a Midrange. Contested by Isaiah Smith (4.5 feet, ZONE). DWYANE IRVING MAKES IT! Assist: Draymond Fox
Score: 60-50

[07:37] Team_073 possession (Score: 60-50)
Isaiah Smith attempts a Layup. Contested by Jabari Wade (4.9 feet, MAN). ISAIAH SMITH MAKES IT! Assist: Carmelo Porzingis
Score: 60-52

[07:20] Team_004 possession (Score: 60-52)
Dwyane Irving attempts a 3Pt. Contested by Karl Williamson (3.4 feet, ZONE). Dwyane Irving misses. Rebound secured by Bradley Morant.

[07:07] Team_073 possession (Score: 60-52)
Carmelo Porzingis attempts a Midrange. Contested by Draymond Fox (4.2 feet, ZONE). Carmelo Porzingis misses. Rebound secured by Anthony Lillard.

[06:53] Team_004 possession (Score: 60-52)
Michael Curry attempts a 3Pt. Contested by Carmelo Young (4.7 feet, MAN). Michael Curry misses. Offensive rebound by Anthony Lillard! Anthony Lillard kicks it out.

[06:38] Team_004 possession (Score: 60-52)
Dwyane Irving attempts a Midrange. Contested by Carmelo Porzingis (4.0 feet, ZONE). Dwyane Irving misses. Rebound secured by Bradley Morant.

[06:21] Team_073 possession (Score: 60-52)
FOUL! Shooting foul on Draymond Fox. Bradley Morant to the line for 2 free throws. [BONUS: 6 team fouls] (Draymond Fox: 3 personal fouls)   FT 1/2: GOOD   FT 2/2: GOOD Bradley Morant makes 2/2 from the line.
Score: 60-54

[06:06] Team_004 possession (Score: 60-54)
Draymond Fox drives, Carmelo Porzingis stays with him. Draymond Fox attempts a Layup. Contested by Carmelo Porzingis (4.1 feet, MAN). DRAYMOND FOX MAKES IT! Assist: Dwyane Irving
Score: 62-54

[05:50] Team_073 possession (Score: 62-54)
Carmelo Young loses the ball! Stripped by Michael Curry! TURNOVER! (live ball)

[05:34] Team_004 possession (Score: 62-54)
Anthony Lillard attempts a Layup. Contested by Bradley Morant (4.3 feet, MAN). ANTHONY LILLARD MAKES IT!
Score: 64-54

[05:19] Team_073 possession (Score: 64-54)
Isaiah Smith attempts a 3Pt. Contested by Jabari Wade (4.9 feet, MAN). Isaiah Smith misses. Rebound secured by Anthony Lillard.

[05:05] Team_004 possession (Score: 64-54)
FOUL! Reach-in foul on Carmelo Young during the drive. [Team fouls: 3] No free throws, side out. (Carmelo Young: 1 personal fouls)

[04:53] Team_004 possession (Score: 64-54)
Dwyane Irving attempts a 3Pt. Contested by Karl Williamson (3.4 feet, ZONE). Dwyane Irving misses. Offensive rebound by Anthony Lillard! Anthony Lillard kicks it out.

[04:43] Team_004 possession (Score: 64-54)
Draymond Fox attempts a Midrange. Contested by Carmelo Porzingis (4.1 feet, MAN). DRAYMOND FOX MAKES IT! Assist: Anthony Lillard
Score: 66-54

[04:31] Team_073 possession (Score: 66-54)
Carmelo Porzingis attempts a 3Pt. Contested by Draymond Fox (4.3 feet, MAN). Carmelo Porzingis misses. Rebound secured by Draymond Fox.

[04:17] Team_004 possession (Score: 66-54)
Draymond Fox drives, picks up Bradley Morant. Help arrives from Isaiah Smith! Draymond Fox attempts a Layup. Contested by Isaiah Smith (4.3 feet, ZONE). DRAYMOND FOX MAKES IT! Assist: Michael Curry
Score: 68-54

[04:07] Team_073 possession (Score: 68-54)
Isaiah Smith makes the Dunk and draws the foul on Draymond Fox! And-1! Isaiah Smith to the line for 1. [BONUS: 7 team fouls] (Draymond Fox: 4 personal fouls)   FT 1/1: GOOD Isaiah Smith makes 1/1 from the line.
Score: 68-57

[03:48] Team_004 possession (Score: 68-57)
Jabari Wade drives to the basket... FOUL! Offensive foul on Jabari Wade! Bradley Morant drew the charge! [Team fouls: 8] (Jabari Wade: 2 personal fouls) TURNOVER! (dead ball)

[03:32] Team_073 possession (Score: 68-57)
Karl Williamson drives and kicks out. Carmelo Porzingis attempts a 3Pt. Contested by Draymond Fox (4.3 feet, MAN). Carmelo Porzingis misses. Rebound secured by Draymond Fox.

[03:21] Team_004 possession (Score: 68-57)
Draymond Fox makes the Layup and draws the foul on Carmelo Porzingis! And-1! Draymond Fox to the line for 1. [Team fouls: 4] (Carmelo Porzingis: 2 personal fouls)   FT 1/1: MISS Draymond Fox makes 0/1 from the line. Rebound secured by Carmelo Porzingis.
Score: 70-57

[03:05] Team_073 possession (Score: 70-57)
FOUL! Holding foul on Michael Curry. [IN THE BONUS! 9 team fouls] Carmelo Young to the line for 2 free throws. (Michael Curry: 1 personal fouls)   FT 1/2: GOOD   FT 2/2: GOOD Carmelo Young makes 2/2 from the line.
Score: 70-59

[02:52] Team_004 possession (Score: 70-59)
Dwyane Irving drives to the basket... Dwyane Irving throws a bad pass! Stolen by Bradley Morant! TURNOVER! (live ball)

[02:38] Team_073 possession (Score: 70-59)
Carmelo Young drives to the basket... FOUL! Offensive foul on Carmelo Young! Michael Curry drew the charge! [Team fouls: 5] (Carmelo Young: 2 personal fouls) TURNOVER! (dead ball)

[02:23] Team_004 possession (Score: 70-59)
Draymond Fox attempts a Layup. Contested by Carmelo Porzingis (4.3 feet, MAN). Draymond Fox misses. Rebound secured by Isaiah Smith.

[02:07] Team_073 possession (Score: 70-59)
Karl Williamson makes the 3Pt and draws the foul on Michael Curry! And-1! Karl Williamson to the line for 1. [BONUS: 10 team fouls] (Michael Curry: 2 personal fouls)   FT 1/1: MISS Karl Williamson makes 0/1 from the line. Offensive rebound by Carmelo Porzingis! Carmelo Porzingis kicks it out.
Score: 70-62

[01:54] Team_073 possession (Score: 70-62)
FOUL! Reach-in foul on Anthony Lillard during the drive. [IN THE BONUS! 11 team fouls] Bradley Morant to the line for 2 free throws. (Anthony Lillard: 2 personal fouls)   FT 1/2: GOOD   FT 2/2: GOOD Bradley Morant makes 2/2 from the line.
Score: 70-64

[01:39] Team_004 possession (Score: 70-64)
Jabari Wade attempts a Layup. Contested by Isaiah Smith (5.2 feet, MAN). JABARI WADE MAKES IT! Assist: Draymond Fox
Score: 72-64

[01:21] Team_073 possession (Score: 72-64)
Isaiah Smith makes the Dunk and draws the foul on Anthony Lillard! And-1! Isaiah Smith to the line for 1. [BONUS: 12 team fouls] (Anthony Lillard: 3 personal fouls)   FT 1/1: MISS Isaiah Smith makes 0/1 from the line. Rebound secured by Draymond Fox.
Score: 72-66

[01:03] Team_004 possession (Score: 72-66)
Draymond Fox drives to the basket... Draymond Fox loses the ball! Stripped by Carmelo Porzingis! TURNOVER! (live ball)

[00:52] Team_073 possession (Score: 72-66)
Carmelo Young attempts a Midrange. Contested by Michael Curry (5.6 feet, MAN). Carmelo Young misses. Offensive rebound by Carmelo Porzingis! Carmelo Porzingis kicks it out.

[00:35] Team_073 possession (Score: 72-66)
Isaiah Smith attempts a Midrange. Contested by Jabari Wade (5.3 feet, MAN). Isaiah Smith misses. Rebound secured by Dwyane Irving.

[00:24] Team_004 possession (Score: 72-66)
Draymond Fox attempts a 3Pt. Contested by Isaiah Smith (5.0 feet, ZONE). DRAYMOND FOX MAKES IT! Assist: Dwyane Irving
Score: 75-66

[00:09] Team_073 possession (Score: 75-66)
FOUL! Shooting foul on Michael Curry. Carmelo Young to the line for 2 free throws. [BONUS: 13 team fouls] (Michael Curry: 3 personal fouls)   FT 1/2: MISS   FT 2/2: GOOD Carmelo Young makes 1/2 from the line.
Score: 75-67

================================================================================
                              3RD QUARTER COMPLETE                              
================================================================================

3RD QUARTER SCORE: Team_004 27, Team_073 27

BOX SCORE:
================================================================================

Team_004
--------------------------------------------------------------------------------
Player                MIN  PTS  REB  AST  TO      FG   FG%      3P   3P%
--------------------------------------------------------------------------------
Draymond Fox           27    9    4    2   0   4/6    66.7     0/0   0.0
Dwyane Irving          27    6    1    2   0   3/6    50.0     0/0   0.0
Jabari Wade            27    5    0    0   0   2/3    66.7     0/0   0.0
Anthony Lillard        27    2    6    1   0   1/1   100.0     0/0   0.0
Michael Curry          27    2    0    2   0   1/2    50.0     0/0   0.0

TEAM: FG: 11/18 (61.1%), 3PT: 2/5 (40.0%), REB: 11 (3 off, 8 def), AST: 7, TO: 3
TEAM FOULS: 13 [Team_073 in BONUS]


Team_073
--------------------------------------------------------------------------------
Player                MIN  PTS  REB  AST  TO      FG   FG%      3P   3P%
--------------------------------------------------------------------------------
Isaiah Smith           27    8    2    0   0   3/6    50.0     0/0   0.0
Bradley Morant         27    7    3    0   0   3/4    75.0     0/0   0.0
Karl Williamson        27    4    0    0   0   1/2    50.0     0/0   0.0
Carmelo Young          27    3    0    0   0   2/3    66.7     0/0   0.0
Carmelo Porzingis      27    0    4    1   0   0/2     0.0     0/0   0.0

TEAM: FG: 9/17 (52.9%), 3PT: 2/4 (50.0%), REB: 9 (2 off, 7 def), AST: 1, TO: 4
TEAM FOULS: 5 [Team_004 in BONUS]

================================================================================

================================================================================
                       4TH QUARTER - Team_004 vs Team_073                       
================================================================================

[12:00] Team_004 possession (Score: 75-67)
Dwyane Irving attempts a 3Pt. Contested by Karl Williamson (3.7 feet, MAN). DWYANE IRVING MAKES IT! Assist: Jabari Wade
Score: 78-67

[11:43] Team_073 possession (Score: 78-67)
Carmelo Porzingis drives to the basket... Carmelo Porzingis loses control! Ball rolls out of bounds! TURNOVER! (dead ball)

[11:43] Substitution (Team_004): Michael Curry OUT → Karl Reaves IN (stamina_rule2)

[11:43] Substitution (Team_004): Jabari Wade OUT → Russell Barnes IN (stamina_rule2)

[11:43] Substitution (Team_004): Dwyane Irving OUT → Kristaps Green IN (stamina_rule2)

[11:43] Substitution (Team_004): Draymond Fox OUT → Michael Sabonis IN (stamina_rule2)

[11:43] Substitution (Team_004): Anthony Lillard OUT → Shai Beal IN (stamina_rule2)

[11:43] Substitution (Team_073): Carmelo Young OUT → Zach Quickley IN (stamina_rule2)

[11:43] Substitution (Team_073): Isaiah Smith OUT → Luka Butler IN (stamina_rule2)

[11:43] Substitution (Team_073): Karl Williamson OUT → Dwyane McCollum IN (stamina_rule2)

[11:43] Substitution (Team_073): Carmelo Porzingis OUT → Shai Thompson IN (stamina_rule2)

[11:43] Substitution (Team_073): Bradley Morant OUT → Ja Rose IN (stamina_rule2)

[11:28] Team_004 possession (Score: 78-67)
Russell Barnes attempts a Midrange. Contested by Shai Thompson (4.4 feet, ZONE). Russell Barnes misses. Rebound secured by Dwyane McCollum.

[11:11] Team_073 possession (Score: 78-67)
Shai Thompson drives to the basket... Shai Thompson loses control! Ball rolls out of bounds! TURNOVER! (dead ball)

[11:00] Team_004 possession (Score: 78-67)
Russell Barnes attempts a 3Pt. Contested by Luka Butler (5.0 feet, ZONE). Russell Barnes misses. Rebound secured by Ja Rose.

[10:42] Team_073 possession (Score: 78-67)
Luka Butler attempts a Midrange. Contested by Russell Barnes (5.1 feet, MAN). LUKA BUTLER MAKES IT! Assist: Zach Quickley
Score: 78-69

[10:32] Team_004 possession (Score: 78-69)
Russell Barnes attempts a Midrange. Contested by Luka Butler (5.0 feet, MAN). Russell Barnes misses. Rebound secured by Dwyane McCollum.

[10:18] Team_073 possession (Score: 78-69)
Shai Thompson drives and kicks out. Ja Rose attempts a Midrange. Contested by Shai Beal (5.1 feet, MAN). JA ROSE MAKES IT!
Score: 78-71

[10:03] Team_004 possession (Score: 78-71)
Karl Reaves attempts a Midrange. Contested by Zach Quickley (4.0 feet, MAN). Karl Reaves misses. Rebound secured by Dwyane McCollum.

[09:49] Team_073 possession (Score: 78-71)
Zach Quickley attempts a 3Pt. Contested by Kristaps Green (4.7 feet, ZONE). ZACH QUICKLEY MAKES IT!
Score: 78-74

[09:36] Team_004 possession (Score: 78-74)
Kristaps Green drives, Shai Thompson stays with him. Kristaps Green attempts a Dunk. Contested by Shai Thompson (3.8 feet, ZONE). KRISTAPS GREEN MAKES IT!
Score: 80-74

[09:20] Team_073 possession (Score: 80-74)
Zach Quickley makes the Layup and draws the foul on Shai Beal! And-1! Zach Quickley to the line for 1. [Team fouls: 1] (Shai Beal: 1 personal fouls)   FT 1/1: GOOD Zach Quickley makes 1/1 from the line.
Score: 80-77

[09:08] Team_004 possession (Score: 80-77)
Karl Reaves commits a violation (traveling/carry)! TURNOVER! (dead ball)

[08:50] Team_073 possession (Score: 80-77)
Luka Butler attempts a 3Pt. Contested by Russell Barnes (5.1 feet, MAN). LUKA BUTLER MAKES IT! Assist: Ja Rose
Score: 80-80

[08:37] Team_004 possession (Score: 80-80)
Shai Beal drives, Ja Rose stays with him. Shai Beal attempts a Layup. Contested by Ja Rose (5.6 feet, MAN). SHAI BEAL MAKES IT! Assist: Karl Reaves
Score: 82-80

[08:26] Team_073 possession (Score: 82-80)
FOUL! Holding foul on Kristaps Green. [Team fouls: 2] No free throws, side out. (Kristaps Green: 1 personal fouls)

[08:07] Team_073 possession (Score: 82-80)
Zach Quickley attempts a Layup. Contested by Shai Beal (5.4 feet, ZONE). ZACH QUICKLEY MAKES IT!
Score: 82-82

[07:58] Team_004 possession (Score: 82-82)
Karl Reaves drives and kicks out. Karl Reaves attempts a 3Pt. Contested by Luka Butler (4.4 feet, ZONE). Karl Reaves misses. Rebound secured by Dwyane McCollum.

[07:43] Team_073 possession (Score: 82-82)
Zach Quickley attempts a 3Pt. Contested by Karl Reaves (5.4 feet, MAN). Zach Quickley misses. Offensive rebound by Ja Rose! Ja Rose kicks it out.

[07:31] Team_073 possession (Score: 82-82)
Dwyane McCollum makes the Dunk and draws the foul on Kristaps Green! And-1! Dwyane McCollum to the line for 1. [Team fouls: 3] (Kristaps Green: 2 personal fouls)   FT 1/1: GOOD Dwyane McCollum makes 1/1 from the line.
Score: 82-85

[07:15] Team_004 possession (Score: 82-85)
Shai Beal drives, picks up Shai Thompson. Help arrives from Luka Butler! Shai Beal attempts a Dunk. Contested by Luka Butler (3.9 feet, ZONE). Shai Beal misses. Offensive rebound by Russell Barnes! Russell Barnes kicks it out.

[06:57] Team_004 possession (Score: 82-85)
Michael Sabonis drives, Shai Thompson stays with him. Michael Sabonis attempts a Layup. Contested by Shai Thompson (3.9 feet, MAN). Michael Sabonis misses. Rebound secured by Dwyane McCollum.

[06:42] Team_073 possession (Score: 82-85)
FOUL! Reach-in foul on Shai Beal during the drive. [Team fouls: 4] No free throws, side out. (Shai Beal: 2 personal fouls)

[06:26] Team_073 possession (Score: 82-85)
FOUL! Shooting foul on Michael Sabonis. Shai Thompson to the line for 2 free throws. [BONUS: 5 team fouls] (Michael Sabonis: 1 personal fouls)   FT 1/2: GOOD   FT 2/2: GOOD Shai Thompson makes 2/2 from the line.
Score: 82-87

[06:10] Team_004 possession (Score: 82-87)
Michael Sabonis drives, picks up Shai Thompson. Help arrives from Luka Butler! Michael Sabonis attempts a Dunk. Contested by Luka Butler (3.9 feet, ZONE). Michael Sabonis misses. Offensive rebound by Shai Beal! Shai Beal kicks it out.

[05:57] Team_004 possession (Score: 82-87)
Karl Reaves makes the Layup and draws the foul on Shai Thompson! And-1! Karl Reaves to the line for 1. [Team fouls: 1] (Shai Thompson: 1 personal fouls)   FT 1/1: MISS Karl Reaves makes 0/1 from the line. Rebound secured by Dwyane McCollum.
Score: 84-87

[05:42] Team_073 possession (Score: 84-87)
Shai Thompson throws a bad pass out of bounds! TURNOVER! (dead ball)

[05:25] Team_004 possession (Score: 84-87)
FOUL! Shooting foul on Shai Thompson. Michael Sabonis to the line for 2 free throws. [Team fouls: 2] (Shai Thompson: 2 personal fouls)   FT 1/2: MISS   FT 2/2: GOOD Michael Sabonis makes 1/2 from the line.
Score: 85-87

[05:12] Team_073 possession (Score: 85-87)
Ja Rose drives, picks up Michael Sabonis. Help arrives from Russell Barnes! Ja Rose attempts a Dunk. Contested by Russell Barnes (5.0 feet, ZONE). JA ROSE MAKES IT! Assist: Shai Thompson
Score: 85-89

[04:54] Team_004 possession (Score: 85-89)
Kristaps Green drives and kicks out. Shai Beal attempts a Midrange. Contested by Ja Rose (5.6 feet, MAN). Shai Beal misses. Rebound secured by Shai Thompson.

[04:39] Team_073 possession (Score: 85-89)
Luka Butler drives, Shai Beal stays with him. Luka Butler attempts a Dunk. Contested by Shai Beal (5.6 feet, ZONE). Luka Butler misses. Rebound secured by Michael Sabonis.

[04:25] Team_004 possession (Score: 85-89)
Michael Sabonis drives and kicks out. Russell Barnes attempts a 3Pt. Contested by Luka Butler (4.5 feet, MAN). Russell Barnes misses. Rebound secured by Ja Rose.

[04:09] Team_073 possession (Score: 85-89)
Ja Rose attempts a 3Pt. Contested by Karl Reaves (5.2 feet, ZONE). JA ROSE MAKES IT! Assist: Luka Butler
Score: 85-92

[03:53] Team_004 possession (Score: 85-92)
Kristaps Green attempts a Midrange. Contested by Luka Butler (4.6 feet, ZONE). Kristaps Green misses. Rebound secured by Dwyane McCollum.

[03:42] Team_073 possession (Score: 85-92)
FOUL! Holding foul on Shai Beal. [IN THE BONUS! 6 team fouls] Ja Rose to the line for 2 free throws. (Shai Beal: 3 personal fouls)   FT 1/2: GOOD   FT 2/2: GOOD Ja Rose makes 2/2 from the line.
Score: 85-94

[03:28] Team_004 possession (Score: 85-94)
Shai Beal attempts a 3Pt. Contested by Ja Rose (5.8 feet, MAN). Shai Beal misses. Offensive rebound by Russell Barnes! Russell Barnes kicks it out.

[03:10] Team_004 possession (Score: 85-94)
Shai Beal drives, picks up Shai Thompson. Help arrives from Luka Butler! Shai Beal attempts a Dunk. Contested by Luka Butler (4.1 feet, ZONE). SHAI BEAL MAKES IT! Assist: Russell Barnes
Score: 87-94

[02:54] Team_073 possession (Score: 87-94)
Luka Butler attempts a 3Pt. Contested by Russell Barnes (5.3 feet, MAN). Luka Butler misses. Offensive rebound by Dwyane McCollum! Dwyane McCollum puts it back in!
Score: 87-96

[02:37] Team_004 possession (Score: 87-96)
Karl Reaves drives and kicks out. Karl Reaves attempts a Midrange. Contested by Ja Rose (5.8 feet, ZONE). Karl Reaves misses. Rebound secured by Ja Rose.

[02:27] Team_073 possession (Score: 87-96)
Shai Thompson attempts a 3Pt. Contested by Karl Reaves (5.4 feet, ZONE). SHAI THOMPSON MAKES IT! Assist: Zach Quickley
Score: 87-99

[02:11] Team_004 possession (Score: 87-99)
Karl Reaves drives to the basket... Karl Reaves throws a bad pass out of bounds! TURNOVER! (dead ball)

[01:58] Team_073 possession (Score: 87-99)
Dwyane McCollum attempts a Midrange. Contested by Kristaps Green (4.6 feet, MAN). Dwyane McCollum misses. Offensive rebound by Ja Rose! Ja Rose kicks it out.

[01:46] Team_073 possession (Score: 87-99)
Zach Quickley attempts a Midrange. Contested by Karl Reaves (5.6 feet, MAN). Zach Quickley misses. Rebound secured by Russell Barnes.

[01:32] Team_004 possession (Score: 87-99)
FOUL! Shooting foul on Shai Thompson. Kristaps Green to the line for 2 free throws. [Team fouls: 3] (Shai Thompson: 3 personal fouls)   FT 1/2: GOOD   FT 2/2: GOOD Kristaps Green makes 2/2 from the line.
Score: 89-99

[01:17] Team_073 possession (Score: 89-99)
Zach Quickley drives, picks up Shai Beal. Help arrives from Russell Barnes! Zach Quickley attempts a Dunk. Contested by Russell Barnes (5.7 feet, ZONE). Zach Quickley misses. Rebound secured by Shai Beal.

[00:59] Team_004 possession (Score: 89-99)
Michael Sabonis attempts a Midrange. Contested by Luka Butler (4.9 feet, ZONE). Michael Sabonis misses. Rebound secured by Ja Rose.

[00:40] Team_073 possession (Score: 89-99)
FOUL! Shooting foul on Michael Sabonis. Shai Thompson to the line for 2 free throws. [BONUS: 7 team fouls] (Michael Sabonis: 2 personal fouls)   FT 1/2: GOOD   FT 2/2: GOOD Shai Thompson makes 2/2 from the line.
Score: 89-101

[00:22] Team_004 possession (Score: 89-101)
Kristaps Green drives and kicks out. Karl Reaves attempts a Midrange. Contested by Zach Quickley (4.8 feet, MAN). Karl Reaves misses. Rebound secured by Ja Rose.

[00:04] Team_073 possession (Score: 89-101)
Dwyane McCollum attempts a 3Pt. Contested by Kristaps Green (4.8 feet, MAN). Dwyane McCollum misses. FOUL! Loose ball foul on Michael Sabonis during the rebound battle. [IN THE BONUS! 8 team fouls] Dwyane McCollum to the line for 2 free throws. (Michael Sabonis: 3 personal fouls)   FT 1/2: GOOD   FT 2/2: GOOD Dwyane McCollum makes 2/2 from the line.
Score: 89-103

================================================================================
                              4TH QUARTER COMPLETE                              
================================================================================

4TH QUARTER SCORE: Team_004 14, Team_073 36

BOX SCORE:
================================================================================

Team_004
--------------------------------------------------------------------------------
Player                MIN  PTS  REB  AST  TO      FG   FG%      3P   3P%
--------------------------------------------------------------------------------
Kristaps Green         21    4    0    0   0   2/5    40.0     0/0   0.0
Shai Beal              21    4    2    0   0   2/2   100.0     0/0   0.0
Dwyane Irving          27    3    0    0   0   1/1   100.0     0/0   0.0
Michael Sabonis        21    1    1    0   0   1/4    25.0     0/0   0.0
Jabari Wade            27    0    0    1   0   0/0     0.0     0/0   0.0
Russell Barnes         21    0    3    1   0   0/3     0.0     0/0   0.0
Karl Reaves            21    0    0    1   0   0/4     0.0     0/0   0.0

TEAM: FG: 6/19 (31.6%), 3PT: 1/2 (50.0%), REB: 6 (3 off, 3 def), AST: 3, TO: 2
TEAM FOULS: 8 [Team_073 in BONUS]


Team_073
--------------------------------------------------------------------------------
Player                MIN  PTS  REB  AST  TO      FG   FG%      3P   3P%
--------------------------------------------------------------------------------
Ja Rose                21    9    7    1   0   4/4   100.0     0/0   0.0
Zach Quickley          21    8    0    2   0   3/5    60.0     0/0   0.0
Dwyane McCollum        21    7    8    0   0   3/3   100.0     0/0   0.0
Shai Thompson          21    7    1    1   0   3/3   100.0     0/0   0.0
Luka Butler            21    5    0    1   0   2/3    66.7     0/0   0.0

TEAM: FG: 15/18 (83.3%), 3PT: 6/6 (100.0%), REB: 16 (3 off, 13 def), AST: 5, TO: 3
TEAM FOULS: 3

================================================================================

================================================================================
                               FULL GAME COMPLETE                               
================================================================================

FINAL SCORE: Team_004 89, Team_073 103

SCORING BY QUARTER:
--------------------------------------------------------------------------------
Team                     Q1     Q2     Q3     Q4    FINAL
--------------------------------------------------------------------------------
Team_004                 30     18     27     14       89
Team_073                 20     20     27     36      103
--------------------------------------------------------------------------------

FULL GAME BOX SCORE:
================================================================================

Team_004
--------------------------------------------------------------------------------
Player                MIN  PTS  REB  AST  TO      FG   FG%      3P   3P%      FT STL BLK
--------------------------------------------------------------------------------
Michael Curry          27    7    0    2   0   3/8    37.5   1/3    33.3   0/0     1   0
Jabari Wade            27   12    0    2   3   5/8    62.5   1/2    50.0   2/3     0   0
Dwyane Irving          27   14    4    5   1   6/11   54.5   2/6    33.3   3/4     0   0
Draymond Fox           27   11   12    4   1   5/8    62.5   1/1   100.0   2/3     0   0
Anthony Lillard        27   14   12    2   1   7/10   70.0   1/2    50.0   2/2     1   3
Karl Reaves            21    3    0    2   1   1/7    14.3   1/3    33.3   0/1     0   0
Russell Barnes         21    0    6    1   0   0/4     0.0   0/1     0.0   0/0     0   0
Kristaps Green         21   12    0    1   0   5/11   45.5   2/2   100.0   2/2     0   0
Michael Sabonis        21    1    5    0   0   1/5    20.0   0/0     0.0   1/2     0   0
Shai Beal              21    9    3    2   1   4/6    66.7   0/0     0.0   3/3     0   1

TEAM: FG: 37/78 (47.4%), 3PT: 9/20 (45.0%), REB: 42 (8 off, 34 def), AST: 21, TO: 8


Team_073
--------------------------------------------------------------------------------
Player                MIN  PTS  REB  AST  TO      FG   FG%      3P   3P%      FT STL BLK
--------------------------------------------------------------------------------
Carmelo Young          27    3    0    1   1   1/3    33.3   0/1     0.0   3/4     0   0
Isaiah Smith           27   11    7    0   2   4/12   33.3   1/4    25.0   5/6     0   0
Karl Williamson        27    8    0    1   2   4/9    44.4   1/4    25.0   1/2     0   0
Carmelo Porzingis      27    6    9    2   1   2/9    22.2   1/3    33.3   4/5     2   0
Bradley Morant         27   16   10    0   1   7/9    77.8   0/0     0.0   6/6     2   1
Zach Quickley          21   11    0    2   0   5/9    55.6   2/3    66.7   1/1     0   0
Luka Butler            21    8    0    1   1   4/5    80.0   3/3   100.0   0/0     0   0
Dwyane McCollum        21   11   14    2   1   3/6    50.0   1/1   100.0   5/5     0   0
Shai Thompson          21   10    3    3   1   5/6    83.3   2/3    66.7   4/4     0   0
Ja Rose                21   14   14    2   1   4/5    80.0   2/3    66.7   4/4     0   0

TEAM: FG: 41/75 (54.7%), 3PT: 13/25 (52.0%), REB: 57 (16 off, 41 def), AST: 14, TO: 11

================================================================================
