================================================================================
                        FULL GAME - Team_046 vs Team_013                        
================================================================================

================================================================================
                       1ST QUARTER - Team_046 vs Team_013                       
================================================================================

[12:00] Team_046 possession (Score: 0-0)
Kevin Allen drives to the basket... Kevin Allen throws a bad pass out of bounds! TURNOVER! (dead ball)

[11:43] Team_013 possession (Score: 0-0)
Desmond Ginobili loses the ball! Stripped by Cade Wall! TURNOVER! (live ball)

[11:25] Team_046 possession (Score: 0-0)
Kevin Allen makes the 3Pt and draws the foul on Pau Mobley! And-1! Kevin Allen to the line for 1. [Team fouls: 1] (Pau Mobley: 1 personal fouls)   FT 1/1: GOOD Kevin Allen makes 1/1 from the line.
Score: 4-0

[11:11] Team_013 possession (Score: 4-0)
FOUL! Shooting foul on D'Angelo O'Neal. Desmond Ginobili to the line for 2 free throws. [Team fouls: 1] (D'Angelo O'Neal: 1 personal fouls)   FT 1/2: GOOD   FT 2/2: MISS Desmond Ginobili makes 1/2 from the line. Offensive rebound by Nikola Curry! Nikola Curry kicks it out.
Score: 4-1

[10:56] Team_013 possession (Score: 4-1)
Pau Mobley loses control! Ball rolls out of bounds! TURNOVER! (dead ball)

[10:44] Team_046 possession (Score: 4-1)
Cade Wall drives, Desmond Ginobili stays with him. Cade Wall attempts a Dunk. Contested by Desmond Ginobili (5.5 feet, ZONE). Cade Wall misses. Offensive rebound by Kevin Allen! Kevin Allen kicks it out.

[10:30] Team_046 possession (Score: 4-1)
Cade Wall attempts a 3Pt. Contested by Pau Mobley (4.4 feet, ZONE). Cade Wall misses. Rebound secured by Pau Mobley.

[10:13] Team_013 possession (Score: 4-1)
Pau Mobley attempts a Layup. BLOCKED BY LAURI CARTER! Ball deflects out of bounds off Pau Mobley.

[09:54] Team_046 possession (Score: 4-1)
D'Angelo O'Neal makes the Midrange and draws the foul on Jayson Morant! And-1! D'Angelo O'Neal to the line for 1. [Team fouls: 2] (Jayson Morant: 1 personal fouls)   FT 1/1: GOOD D'Angelo O'Neal makes 1/1 from the line.
Score: 7-1

[09:34] Team_013 possession (Score: 7-1)
Pau Mobley attempts a 3Pt. Contested by Lauri Carter (3.2 feet, ZONE). Pau Mobley misses. Rebound secured by Cade Wall.

[09:24] Team_046 possession (Score: 7-1)
D'Angelo O'Neal attempts a 3Pt. Contested by Manu Smith (5.0 feet, MAN). D'Angelo O'Neal misses. Rebound secured by Pau Mobley.

[09:08] Team_013 possession (Score: 7-1)
Nikola Curry makes the Layup and draws the foul on Kevin Allen! And-1! Nikola Curry to the line for 1. [Team fouls: 2] (Kevin Allen: 1 personal fouls)   FT 1/1: GOOD Nikola Curry makes 1/1 from the line.
Score: 7-4

[08:52] Team_046 possession (Score: 7-4)
Lauri Carter attempts a 3Pt. Contested by Jayson Morant (4.2 feet, MAN). Lauri Carter misses. Rebound secured by Nikola Curry.

[08:37] Team_013 possession (Score: 7-4)
FOUL! Reach-in foul on Lauri Carter during the drive. [Team fouls: 3] No free throws, side out. (Lauri Carter: 1 personal fouls)

[08:22] Team_013 possession (Score: 7-4)
Manu Smith attempts a Layup. Contested by D'Angelo O'Neal (4.5 feet, MAN). Manu Smith misses. Rebound secured by Lauri Carter.

[08:09] Team_046 possession (Score: 7-4)
Kevin Allen makes the Dunk and draws the foul on Pau Mobley! And-1! Kevin Allen to the line for 1. [Team fouls: 3] (Pau Mobley: 2 personal fouls)   FT 1/1: MISS Kevin Allen makes 0/1 from the line. Rebound secured by Nikola Curry.
Score: 9-4

[07:50] Team_013 possession (Score: 9-4)
Pau Mobley loses the ball! Stripped by Victor Nowitzki! TURNOVER! (live ball)

[07:40] Team_046 possession (Score: 9-4)
Kevin Allen attempts a Layup. Contested by Nikola Curry (5.3 feet, MAN). Kevin Allen misses. Rebound secured by Nikola Curry.

[07:26] Team_013 possession (Score: 9-4)
Nikola Curry attempts a Midrange. Contested by Kevin Allen (5.1 feet, MAN). Nikola Curry misses. Rebound secured by Cade Wall.

[07:11] Team_046 possession (Score: 9-4)
FOUL! Shooting foul on Jayson Morant. Cade Wall to the line for 2 free throws. [Team fouls: 4] (Jayson Morant: 2 personal fouls)   FT 1/2: GOOD   FT 2/2: GOOD Cade Wall makes 2/2 from the line.
Score: 11-4

[06:59] Team_013 possession (Score: 11-4)
Pau Mobley attempts a Midrange. Contested by Victor Nowitzki (5.5 feet, MAN). Pau Mobley misses. Rebound secured by Cade Wall.

[06:46] Team_046 possession (Score: 11-4)
D'Angelo O'Neal attempts a Layup. BLOCKED BY DESMOND GINOBILI! Ball is loose! Rebound secured by Desmond Ginobili.

[06:34] Team_013 possession (Score: 11-4)
Nikola Curry attempts a Midrange. Contested by Kevin Allen (5.1 feet, MAN). NIKOLA CURRY MAKES IT!
Score: 11-6

[06:21] Team_046 possession (Score: 11-6)
D'Angelo O'Neal drives, picks up Manu Smith. Help arrives from Pau Mobley! D'Angelo O'Neal attempts a Layup. Contested by Pau Mobley (5.0 feet, MAN). D'ANGELO O'NEAL MAKES IT!
Score: 13-6

[06:04] Team_013 possession (Score: 13-6)
Manu Smith attempts a 3Pt. Contested by Lauri Carter (3.7 feet, ZONE). Manu Smith misses. Rebound secured by Cade Wall.

[05:53] Team_046 possession (Score: 13-6)
Lauri Carter attempts a Midrange. Contested by Jayson Morant (4.2 feet, MAN). Lauri Carter misses. Offensive rebound by Cade Wall! Cade Wall kicks it out.

[05:42] Team_046 possession (Score: 13-6)
Victor Nowitzki drives, Pau Mobley stays with him. Victor Nowitzki attempts a Layup. Contested by Pau Mobley (3.9 feet, MAN). Victor Nowitzki misses. Rebound secured by Pau Mobley.

[05:23] Team_013 possession (Score: 13-6)
Pau Mobley attempts a 3Pt. Contested by Victor Nowitzki (5.5 feet, MAN). Pau Mobley misses. Rebound secured by Cade Wall.

[05:08] Team_046 possession (Score: 13-6)
Kevin Allen attempts a Layup. Contested by Nikola Curry (5.3 feet, MAN). Kevin Allen misses. FOUL! Loose ball foul on Nikola Curry during the rebound battle. [IN THE BONUS! 5 team fouls] Cade Wall to the line for 2 free throws. (Nikola Curry: 1 personal fouls)   FT 1/2: MISS   FT 2/2: GOOD Cade Wall makes 1/2 from the line.
Score: 14-6

[04:53] Team_013 possession (Score: 14-6)
Desmond Ginobili attempts a Midrange. Contested by Cade Wall (4.1 feet, MAN). Desmond Ginobili misses. Rebound secured by Kevin Allen.

[04:35] Team_046 possession (Score: 14-6)
Cade Wall drives and kicks out. Victor Nowitzki attempts a Midrange. Contested by Pau Mobley (3.8 feet, MAN). VICTOR NOWITZKI MAKES IT! Assist: D'Angelo O'Neal
Score: 16-6

[04:21] Team_013 possession (Score: 16-6)
Jayson Morant attempts a 3Pt. Contested by Lauri Carter (3.6 feet, MAN). Jayson Morant misses. Rebound secured by Kevin Allen.

[04:08] Team_046 possession (Score: 16-6)
Cade Wall attempts a 3Pt. Contested by Desmond Ginobili (5.5 feet, ZONE). Cade Wall misses. Rebound secured by Desmond Ginobili.

[03:55] Team_013 possession (Score: 16-6)
Pau Mobley makes the Dunk and draws the foul on Lauri Carter! And-1! Pau Mobley to the line for 1. [Team fouls: 4] (Lauri Carter: 2 personal fouls)   FT 1/1: MISS Pau Mobley makes 0/1 from the line. Offensive rebound by Nikola Curry! Nikola Curry kicks it out.
Score: 16-8

[03:38] Team_013 possession (Score: 16-8)
Manu Smith attempts a 3Pt. Contested by Lauri Carter (3.9 feet, ZONE). Manu Smith misses. Rebound secured by Cade Wall.

[03:24] Team_046 possession (Score: 16-8)
Lauri Carter makes the Midrange and draws the foul on Jayson Morant! And-1! Lauri Carter to the line for 1. [BONUS: 6 team fouls] (Jayson Morant: 3 personal fouls)   FT 1/1: GOOD Lauri Carter makes 1/1 from the line.
Score: 19-8

[03:13] Team_013 possession (Score: 19-8)
Pau Mobley attempts a 3Pt. Contested by Victor Nowitzki (5.6 feet, MAN). PAU MOBLEY MAKES IT! Assist: Jayson Morant
Score: 19-11

[03:00] Team_046 possession (Score: 19-11)
Kevin Allen attempts a Midrange. Contested by Jayson Morant (4.5 feet, ZONE). KEVIN ALLEN MAKES IT! Assist: D'Angelo O'Neal
Score: 21-11

[02:46] Team_013 possession (Score: 21-11)
Pau Mobley attempts a Midrange. Contested by Victor Nowitzki (5.7 feet, MAN). PAU MOBLEY MAKES IT!
Score: 21-13

[02:34] Team_046 possession (Score: 21-13)
Cade Wall attempts a Layup. Contested by Desmond Ginobili (5.7 feet, MAN). Cade Wall misses. Rebound secured by Nikola Curry.

[02:19] Team_013 possession (Score: 21-13)
Jayson Morant attempts a 3Pt. Contested by Lauri Carter (3.8 feet, ZONE). JAYSON MORANT MAKES IT! Assist: Manu Smith
Score: 21-16

[02:06] Team_046 possession (Score: 21-16)
Cade Wall drives, Desmond Ginobili stays with him. Cade Wall attempts a Layup. Contested by Desmond Ginobili (5.7 feet, ZONE). CADE WALL MAKES IT! Assist: D'Angelo O'Neal
Score: 23-16

[01:49] Team_013 possession (Score: 23-16)
Manu Smith makes the Layup and draws the foul on Cade Wall! And-1! Manu Smith to the line for 1. [BONUS: 5 team fouls] (Cade Wall: 1 personal fouls)   FT 1/1: GOOD Manu Smith makes 1/1 from the line.
Score: 23-19

[01:36] Team_046 possession (Score: 23-19)
Cade Wall attempts a Midrange. Contested by Desmond Ginobili (5.7 feet, MAN). CADE WALL MAKES IT!
Score: 25-19

[01:22] Team_013 possession (Score: 25-19)
FOUL! Shooting foul on Victor Nowitzki. Pau Mobley to the line for 2 free throws. [BONUS: 6 team fouls] (Victor Nowitzki: 1 personal fouls)   FT 1/2: MISS   FT 2/2: GOOD Pau Mobley makes 1/2 from the line.
Score: 25-20

[01:11] Team_046 possession (Score: 25-20)
Kevin Allen attempts a Midrange. Contested by Nikola Curry (5.6 feet, MAN). Kevin Allen misses. Rebound secured by Nikola Curry.

[00:56] Team_013 possession (Score: 25-20)
Pau Mobley attempts a Midrange. Contested by Victor Nowitzki (5.8 feet, MAN). Pau Mobley misses. Rebound secured by Cade Wall.

[00:43] Team_046 possession (Score: 25-20)
Lauri Carter drives, Desmond Ginobili stays with him. Lauri Carter attempts a Layup. Contested by Desmond Ginobili (5.4 feet, ZONE). LAURI CARTER MAKES IT! Assist: Victor Nowitzki
Score: 27-20

[00:28] Team_013 possession (Score: 27-20)
Jayson Morant makes the Dunk and draws the foul on D'Angelo O'Neal! And-1! Jayson Morant to the line for 1. [BONUS: 7 team fouls] (D'Angelo O'Neal: 2 personal fouls)   FT 1/1: GOOD Jayson Morant makes 1/1 from the line.
Score: 27-23

[00:15] Team_046 possession (Score: 27-23)
Lauri Carter loses control! Ball rolls out of bounds! TURNOVER! (dead ball)

[00:15] Substitution (Team_046): D'Angelo O'Neal OUT → Collin Butler IN (stamina_rule2)

[00:15] Substitution (Team_046): Victor Nowitzki OUT → Manu Dosunmu IN (stamina_rule2)

[00:15] Substitution (Team_046): Lauri Carter OUT → Josh Barrett IN (stamina_rule2)

[00:15] Substitution (Team_046): Cade Wall OUT → Chris LaVine IN (stamina_rule2)

[00:15] Substitution (Team_046): Kevin Allen OUT → Paul DeRozan IN (stamina_rule2)

[00:15] Substitution (Team_013): Manu Smith OUT → Gary Iverson IN (stamina_rule2)

[00:15] Substitution (Team_013): Pau Mobley OUT → Chris Bryant IN (stamina_rule2)

[00:15] Substitution (Team_013): Jayson Morant OUT → Vince Nowitzki IN (stamina_rule2)

[00:15] Substitution (Team_013): Desmond Ginobili OUT → Dirk Booker IN (stamina_rule2)

[00:15] Substitution (Team_013): Nikola Curry OUT → Jayson Nowitzki IN (stamina_rule2)

[00:02] Team_013 possession (Score: 27-23)
FOUL! Holding foul on Collin Butler. [IN THE BONUS! 8 team fouls] Gary Iverson to the line for 2 free throws. (Collin Butler: 1 personal fouls)   FT 1/2: GOOD   FT 2/2: GOOD Gary Iverson makes 2/2 from the line.
Score: 27-25

================================================================================
                              1ST QUARTER COMPLETE                              
================================================================================

1ST QUARTER SCORE: Team_046 27, Team_013 25

BOX SCORE:
================================================================================

Team_046
--------------------------------------------------------------------------------
Player                MIN  PTS  REB  AST  TO      FG   FG%      3P   3P%
--------------------------------------------------------------------------------
Cade Wall              12    7    8    0   0   4/7    57.1     0/0   0.0
Kevin Allen            12    6    3    0   0   2/5    40.0     0/0   0.0
D'Angelo O'Neal        12    5    0    3   0   2/4    50.0     0/0   0.0
Lauri Carter           12    5    1    0   0   2/3    66.7     0/0   0.0
Victor Nowitzki        12    2    0    1   0   1/2    50.0     0/0   0.0

TEAM: FG: 11/21 (52.4%), 3PT: 1/5 (20.0%), REB: 12 (2 off, 10 def), AST: 4, TO: 2
TEAM FOULS: 8 [Team_013 in BONUS]


Team_013
--------------------------------------------------------------------------------
Player                MIN  PTS  REB  AST  TO      FG   FG%      3P   3P%
--------------------------------------------------------------------------------
Pau Mobley             12    6    3    0   0   3/8    37.5     0/0   0.0
Jayson Morant          12    6    0    1   0   2/3    66.7     0/0   0.0
Nikola Curry           12    5    7    0   0   2/3    66.7     0/0   0.0
Manu Smith             12    3    0    1   0   1/4    25.0     0/0   0.0
Gary Iverson            0    2    0    0   0   1/1   100.0     0/0   0.0
Desmond Ginobili       12    0    2    0   0   0/1     0.0     0/0   0.0

TEAM: FG: 9/20 (45.0%), 3PT: 2/7 (28.6%), REB: 12 (2 off, 10 def), AST: 2, TO: 3
TEAM FOULS: 6 [Team_046 in BONUS]

================================================================================

================================================================================
                       2ND QUARTER - Team_046 vs Team_013                       
================================================================================

[12:00] Team_046 possession (Score: 27-25)
Cade Wall attempts a 3Pt. Contested by Pau Mobley (4.6 feet, ZONE). Cade Wall misses. Rebound secured by Desmond Ginobili.

[11:45] Team_013 possession (Score: 27-25)
Pau Mobley drives and kicks out. Desmond Ginobili attempts a 3Pt. Contested by Cade Wall (4.2 feet, MAN). Desmond Ginobili misses. Offensive rebound by Nikola Curry! Nikola Curry kicks it out.

[11:29] Team_013 possession (Score: 27-25)
Nikola Curry attempts a Layup. Contested by Kevin Allen (5.5 feet, MAN). NIKOLA CURRY MAKES IT!
Score: 27-27

[11:17] Team_046 possession (Score: 27-27)
Victor Nowitzki drives and kicks out. Lauri Carter attempts a Midrange. Contested by Pau Mobley (4.1 feet, ZONE). Lauri Carter misses. Offensive rebound by Lauri Carter! Lauri Carter kicks it out.

[11:03] Team_046 possession (Score: 27-27)
D'Angelo O'Neal makes the Dunk and draws the foul on Pau Mobley! And-1! D'Angelo O'Neal to the line for 1. [Team fouls: 1] (Pau Mobley: 1 personal fouls)   FT 1/1: GOOD D'Angelo O'Neal makes 1/1 from the line.
Score: 30-27

[10:46] Team_013 possession (Score: 30-27)
Nikola Curry attempts a Layup. Contested by Kevin Allen (5.6 feet, ZONE). Nikola Curry misses. Rebound secured by Kevin Allen.

[10:33] Team_046 possession (Score: 30-27)
Lauri Carter attempts a 3Pt. Contested by Jayson Morant (4.7 feet, MAN). Lauri Carter misses. Rebound secured by Desmond Ginobili.

[10:21] Team_013 possession (Score: 30-27)
Pau Mobley drives and kicks out. Nikola Curry attempts a 3Pt. Contested by Lauri Carter (3.8 feet, ZONE). Nikola Curry misses. Rebound secured by Cade Wall.

[10:10] Team_046 possession (Score: 30-27)
Cade Wall drives, Desmond Ginobili stays with him. Cade Wall attempts a Dunk. Contested by Desmond Ginobili (5.8 feet, MAN). CADE WALL MAKES IT! Assist: D'Angelo O'Neal
Score: 32-27

[09:56] Team_013 possession (Score: 32-27)
Pau Mobley drives to the basket... FOUL! Offensive foul on Pau Mobley! Victor Nowitzki drew the charge! [Team fouls: 2] (Pau Mobley: 2 personal fouls) TURNOVER! (dead ball)

[09:40] Team_046 possession (Score: 32-27)
Cade Wall drives, Desmond Ginobili stays with him. Cade Wall attempts a Layup. Contested by Desmond Ginobili (5.9 feet, MAN). CADE WALL MAKES IT!
Score: 34-27

[09:27] Team_013 possession (Score: 34-27)
Nikola Curry attempts a Layup. Contested by Kevin Allen (5.8 feet, MAN). NIKOLA CURRY MAKES IT! Assist: Pau Mobley
Score: 34-29

[09:12] Team_046 possession (Score: 34-29)
FOUL! Holding foul on Nikola Curry. [Team fouls: 3] No free throws, side out. (Nikola Curry: 1 personal fouls)

[08:54] Team_046 possession (Score: 34-29)
Victor Nowitzki drives, Desmond Ginobili stays with him. Victor Nowitzki attempts a Layup. Contested by Desmond Ginobili (5.5 feet, ZONE). VICTOR NOWITZKI MAKES IT! Assist: Cade Wall
Score: 36-29

[08:40] Team_013 possession (Score: 36-29)
FOUL! Shooting foul on Cade Wall. Desmond Ginobili to the line for 2 free throws. [Team fouls: 1] (Cade Wall: 1 personal fouls)   FT 1/2: GOOD   FT 2/2: GOOD Desmond Ginobili makes 2/2 from the line.
Score: 36-31

[08:27] Team_046 possession (Score: 36-31)
Lauri Carter attempts a Midrange. Contested by Jayson Morant (5.0 feet, MAN). Lauri Carter misses. Rebound secured by Pau Mobley.

[08:12] Team_013 possession (Score: 36-31)
Jayson Morant attempts a 3Pt. Contested by Lauri Carter (4.3 feet, MAN). Jayson Morant misses. Offensive rebound by Nikola Curry! Nikola Curry kicks it out.

[07:57] Team_013 possession (Score: 36-31)
Nikola Curry drives, picks up Kevin Allen. Help arrives from D'Angelo O'Neal! Nikola Curry attempts a Layup. Contested by D'Angelo O'Neal (5.9 feet, MAN). NIKOLA CURRY MAKES IT!
Score: 36-33

[07:48] Team_046 possession (Score: 36-33)
D'Angelo O'Neal attempts a Layup. Contested by Manu Smith (5.5 feet, MAN). D'ANGELO O'NEAL MAKES IT! Assist: Lauri Carter
Score: 38-33

[07:33] Team_013 possession (Score: 38-33)
Jayson Morant attempts a Midrange. Contested by Lauri Carter (4.4 feet, MAN). Jayson Morant misses. FOUL! Loose ball foul on Cade Wall during the rebound battle. [Team fouls: 2] No free throws, side out. (Cade Wall: 2 personal fouls)

[07:18] Team_013 possession (Score: 38-33)
Jayson Morant attempts a 3Pt. Wide open! Victor Nowitzki is 6.5 feet away. [ZONE] Jayson Morant misses. Rebound secured by Lauri Carter.

[07:02] Team_046 possession (Score: 38-33)
Kevin Allen attempts a Layup. Wide open! Nikola Curry is 6.0 feet away. [MAN] KEVIN ALLEN MAKES IT! Assist: Cade Wall
Score: 40-33

[06:48] Team_013 possession (Score: 40-33)
Pau Mobley attempts a Midrange. Contested by Lauri Carter (4.2 feet, ZONE). PAU MOBLEY MAKES IT! Assist: Manu Smith
Score: 40-35

[06:31] Team_046 possession (Score: 40-35)
Cade Wall attempts a Layup. Wide open! Desmond Ginobili is 6.2 feet away. [ZONE] CADE WALL MAKES IT!
Score: 42-35

[06:17] Team_013 possession (Score: 42-35)
Desmond Ginobili attempts a 3Pt. Contested by Cade Wall (5.2 feet, MAN). DESMOND GINOBILI MAKES IT! Assist: Pau Mobley
Score: 42-38

[06:06] Team_046 possession (Score: 42-38)
Lauri Carter makes the Layup and draws the foul on Desmond Ginobili! And-1! Lauri Carter to the line for 1. [Team fouls: 4] (Desmond Ginobili: 1 personal fouls)   FT 1/1: GOOD Lauri Carter makes 1/1 from the line.
Score: 45-38

[05:51] Team_013 possession (Score: 45-38)
FOUL! Offensive foul on Desmond Ginobili! Cade Wall drew the charge! [Team fouls: 5] (Desmond Ginobili: 2 personal fouls) TURNOVER! (dead ball)

[05:41] Team_046 possession (Score: 45-38)
Cade Wall drives to the basket... Cade Wall loses the ball! Stripped by Desmond Ginobili! TURNOVER! (live ball)

[05:25] Team_013 possession (Score: 45-38)
Desmond Ginobili makes the Midrange and draws the foul on Cade Wall! And-1! Desmond Ginobili to the line for 1. [Team fouls: 3] (Cade Wall: 3 personal fouls)   FT 1/1: GOOD Desmond Ginobili makes 1/1 from the line.
Score: 45-41

[05:13] Team_046 possession (Score: 45-41)
FOUL! Holding foul on Pau Mobley. [IN THE BONUS! 6 team fouls] Victor Nowitzki to the line for 2 free throws. (Pau Mobley: 3 personal fouls)   FT 1/2: GOOD   FT 2/2: GOOD Victor Nowitzki makes 2/2 from the line.
Score: 47-41

[05:02] Team_013 possession (Score: 47-41)
Nikola Curry attempts a Midrange. Wide open! Kevin Allen is 6.4 feet away. [MAN] Nikola Curry misses. Rebound secured by Cade Wall.

[04:47] Team_046 possession (Score: 47-41)
Kevin Allen attempts a 3Pt. Wide open! Desmond Ginobili is 6.1 feet away. [ZONE] Kevin Allen misses. Rebound secured by Desmond Ginobili.

[04:32] Team_013 possession (Score: 47-41)
Jayson Morant attempts a 3Pt. Contested by Lauri Carter (4.9 feet, ZONE). Jayson Morant misses. FOUL! Loose ball foul on Cade Wall during the rebound battle. [Team fouls: 4] No free throws, side out. (Cade Wall: 4 personal fouls)

[04:17] Team_013 possession (Score: 47-41)
Desmond Ginobili attempts a 3Pt. Contested by Lauri Carter (4.9 feet, ZONE). DESMOND GINOBILI MAKES IT! Assist: Nikola Curry
Score: 47-44

[04:05] Team_046 possession (Score: 47-44)
Lauri Carter attempts a 3Pt. Contested by Jayson Morant (5.6 feet, MAN). Lauri Carter misses. Rebound secured by Nikola Curry.

[03:47] Team_013 possession (Score: 47-44)
Manu Smith attempts a 3Pt. Wide open! D'Angelo O'Neal is 6.0 feet away. [MAN] MANU SMITH MAKES IT! Assist: Nikola Curry
Score: 47-47

[03:31] Team_046 possession (Score: 47-47)
FOUL! Holding foul on Desmond Ginobili. [IN THE BONUS! 7 team fouls] Cade Wall to the line for 2 free throws. (Desmond Ginobili: 3 personal fouls)   FT 1/2: GOOD   FT 2/2: GOOD Cade Wall makes 2/2 from the line.
Score: 49-47

[03:14] Team_013 possession (Score: 49-47)
Manu Smith attempts a 3Pt. Contested by Lauri Carter (5.3 feet, ZONE). MANU SMITH MAKES IT! Assist: Pau Mobley
Score: 49-50

[03:01] Team_046 possession (Score: 49-50)
FOUL! Shooting foul on Manu Smith. Victor Nowitzki to the line for 3 free throws. [BONUS: 8 team fouls] (Manu Smith: 1 personal fouls)   FT 1/3: GOOD   FT 2/3: GOOD   FT 3/3: GOOD Victor Nowitzki makes 3/3 from the line.
Score: 52-50

[02:42] Team_013 possession (Score: 52-50)
Pau Mobley attempts a 3Pt. Contested by D'Angelo O'Neal (5.7 feet, ZONE). Pau Mobley misses. Offensive rebound by Nikola Curry! Nikola Curry kicks it out.

[02:29] Team_013 possession (Score: 52-50)
Pau Mobley drives, Kevin Allen stays with him. Pau Mobley attempts a Dunk. Wide open! Kevin Allen is 6.3 feet away. [ZONE] PAU MOBLEY MAKES IT!
Score: 52-52

[02:11] Team_046 possession (Score: 52-52)
Victor Nowitzki drives and kicks out. Victor Nowitzki attempts a 3Pt. Contested by Pau Mobley (5.7 feet, MAN). VICTOR NOWITZKI MAKES IT! Assist: Cade Wall
Score: 55-52

[01:55] Team_013 possession (Score: 55-52)
Pau Mobley attempts a 3Pt. Wide open! Victor Nowitzki is 6.8 feet away. [MAN] Pau Mobley misses. Offensive rebound by Desmond Ginobili! Desmond Ginobili kicks it out.

[01:42] Team_013 possession (Score: 55-52)
FOUL! Shooting foul on Lauri Carter. Manu Smith to the line for 3 free throws. [BONUS: 5 team fouls] (Lauri Carter: 1 personal fouls)   FT 1/3: GOOD   FT 2/3: MISS   FT 3/3: GOOD Manu Smith makes 2/3 from the line.
Score: 55-54

[01:24] Team_046 possession (Score: 55-54)
Lauri Carter drives and kicks out. Lauri Carter attempts a Midrange. Wide open! Jayson Morant is 6.1 feet away. [MAN] Lauri Carter misses. Offensive rebound by Lauri Carter! Lauri Carter kicks it out.

[01:14] Team_046 possession (Score: 55-54)
Lauri Carter attempts a Layup. Wide open! Jayson Morant is 6.0 feet away. [MAN] Lauri Carter misses. Rebound secured by Nikola Curry.

[00:54] Team_013 possession (Score: 55-54)
FOUL! Reach-in foul on Lauri Carter during the drive. [IN THE BONUS! 6 team fouls] Jayson Morant to the line for 2 free throws. (Lauri Carter: 2 personal fouls)   FT 1/2: GOOD   FT 2/2: MISS Jayson Morant makes 1/2 from the line. Rebound secured by Cade Wall.
Score: 55-55

[00:41] Team_046 possession (Score: 55-55)
Cade Wall attempts a Midrange. Wide open! Jayson Morant is 6.4 feet away. [ZONE] CADE WALL MAKES IT! Assist: Victor Nowitzki
Score: 57-55

[00:24] Team_013 possession (Score: 57-55)
Desmond Ginobili attempts a 3Pt. Contested by Lauri Carter (5.5 feet, ZONE). Desmond Ginobili misses. Rebound secured by Lauri Carter.

[00:12] Team_046 possession (Score: 57-55)
D'Angelo O'Neal attempts a Midrange. Wide open! Manu Smith is 6.3 feet away. [MAN] D'ANGELO O'NEAL MAKES IT!
Score: 59-55

================================================================================
                              2ND QUARTER COMPLETE                              
================================================================================

2ND QUARTER SCORE: Team_046 32, Team_013 30

BOX SCORE:
================================================================================

Team_046
--------------------------------------------------------------------------------
Player                MIN  PTS  REB  AST  TO      FG   FG%      3P   3P%
--------------------------------------------------------------------------------
Cade Wall              24   10    3    3   0   5/6    83.3     0/0   0.0
Victor Nowitzki        24   10    0    1   0   4/4   100.0     0/0   0.0
D'Angelo O'Neal        24    7    0    1   0   3/3   100.0     0/0   0.0
Lauri Carter           24    3    4    1   0   1/5    20.0     0/0   0.0
Kevin Allen            24    2    1    0   0   1/2    50.0     0/0   0.0

TEAM: FG: 14/20 (70.0%), 3PT: 1/5 (20.0%), REB: 8 (2 off, 6 def), AST: 6, TO: 1
TEAM FOULS: 6 [Team_013 in BONUS]


Team_013
--------------------------------------------------------------------------------
Player                MIN  PTS  REB  AST  TO      FG   FG%      3P   3P%
--------------------------------------------------------------------------------
Desmond Ginobili       24   11    6    0   0   4/5    80.0     0/0   0.0
Manu Smith             24    8    0    1   0   3/3   100.0     0/0   0.0
Nikola Curry           24    6    5    2   0   3/5    60.0     0/0   0.0
Pau Mobley             24    4    1    3   0   2/3    66.7     0/0   0.0
Jayson Morant          24    0    0    0   0   0/2     0.0     0/0   0.0

TEAM: FG: 12/18 (66.7%), 3PT: 5/7 (71.4%), REB: 12 (6 off, 6 def), AST: 6, TO: 2
TEAM FOULS: 8 [Team_046 in BONUS]

================================================================================

================================================================================
                       3RD QUARTER - Team_046 vs Team_013                       
================================================================================

[12:00] Team_046 possession (Score: 59-55)
Victor Nowitzki attempts a 3Pt. Contested by Pau Mobley (3.9 feet, ZONE). Victor Nowitzki misses. Rebound secured by Desmond Ginobili.

[11:45] Team_013 possession (Score: 59-55)
Jayson Morant attempts a 3Pt. Contested by Lauri Carter (3.6 feet, MAN). Jayson Morant misses. Rebound secured by Kevin Allen.

[11:33] Team_046 possession (Score: 59-55)
D'Angelo O'Neal loses control! Ball rolls out of bounds! TURNOVER! (dead ball)

[11:21] Team_013 possession (Score: 59-55)
Jayson Morant throws a bad pass! Stolen by Lauri Carter! TURNOVER! (live ball)

[11:02] Team_046 possession (Score: 59-55)
Lauri Carter attempts a 3Pt. Contested by Jayson Morant (4.2 feet, MAN). LAURI CARTER MAKES IT! Assist: D'Angelo O'Neal
Score: 62-55

[10:44] Team_013 possession (Score: 62-55)
Desmond Ginobili attempts a 3Pt. Contested by Cade Wall (4.1 feet, MAN). DESMOND GINOBILI MAKES IT! Assist: Manu Smith
Score: 62-58

[10:27] Team_046 possession (Score: 62-58)
Lauri Carter attempts a 3Pt. Contested by Pau Mobley (3.9 feet, ZONE). Lauri Carter misses. Rebound secured by Desmond Ginobili.

[10:13] Team_013 possession (Score: 62-58)
Jayson Morant attempts a Layup. Contested by Kevin Allen (4.9 feet, ZONE). JAYSON MORANT MAKES IT! Assist: Manu Smith
Score: 62-60

[10:00] Team_046 possession (Score: 62-60)
D'Angelo O'Neal attempts a Layup. Contested by Desmond Ginobili (5.1 feet, ZONE). D'ANGELO O'NEAL MAKES IT!
Score: 64-60

[09:49] Team_013 possession (Score: 64-60)
Desmond Ginobili attempts a Midrange. Contested by Victor Nowitzki (5.8 feet, ZONE). Desmond Ginobili misses. Offensive rebound by Desmond Ginobili! Desmond Ginobili kicks it out.

[09:36] Team_013 possession (Score: 64-60)
Nikola Curry attempts a 3Pt. Contested by Kevin Allen (5.1 feet, MAN). Nikola Curry misses. Rebound secured by Kevin Allen.

[09:25] Team_046 possession (Score: 64-60)
Victor Nowitzki attempts a 3Pt. Contested by Pau Mobley (3.9 feet, MAN). Victor Nowitzki misses. Rebound secured by Nikola Curry.

[09:10] Team_013 possession (Score: 64-60)
FOUL! Reach-in foul on Cade Wall during the drive. [Team fouls: 1] No free throws, side out. (Cade Wall: 1 personal fouls)

[08:51] Team_013 possession (Score: 64-60)
FOUL! Offensive foul on Pau Mobley! Victor Nowitzki drew the charge! [Team fouls: 1] (Pau Mobley: 1 personal fouls) TURNOVER! (dead ball)

[08:40] Team_046 possession (Score: 64-60)
Kevin Allen attempts a Layup. Contested by Nikola Curry (5.3 feet, MAN). Kevin Allen misses. Offensive rebound by Kevin Allen! Kevin Allen kicks it out.

[08:27] Team_046 possession (Score: 64-60)
Kevin Allen loses control! Ball rolls out of bounds! TURNOVER! (dead ball)

[08:16] Team_013 possession (Score: 64-60)
Nikola Curry makes the Dunk and draws the foul on Kevin Allen! And-1! Nikola Curry to the line for 1. [Team fouls: 2] (Kevin Allen: 1 personal fouls)   FT 1/1: GOOD Nikola Curry makes 1/1 from the line.
Score: 64-63

[08:06] Team_046 possession (Score: 64-63)
FOUL! Reach-in foul on Jayson Morant during the drive. [Team fouls: 2] No free throws, side out. (Jayson Morant: 1 personal fouls)

[07:50] Team_046 possession (Score: 64-63)
Victor Nowitzki attempts a 3Pt. Contested by Pau Mobley (3.9 feet, ZONE). VICTOR NOWITZKI MAKES IT! Assist: Cade Wall
Score: 67-63

[07:40] Team_013 possession (Score: 67-63)
FOUL! Shooting foul on D'Angelo O'Neal. Manu Smith to the line for 2 free throws. [Team fouls: 3] (D'Angelo O'Neal: 1 personal fouls)   FT 1/2: MISS   FT 2/2: MISS Manu Smith makes 0/2 from the line. Rebound secured by Kevin Allen.

[07:25] Team_046 possession (Score: 67-63)
Lauri Carter attempts a 3Pt. Contested by Jayson Morant (4.2 feet, MAN). Lauri Carter misses. Rebound secured by Nikola Curry.

[07:12] Team_013 possession (Score: 67-63)
Nikola Curry attempts a Layup. Contested by Kevin Allen (5.1 feet, ZONE). Nikola Curry misses. Rebound secured by Lauri Carter.

[06:58] Team_046 possession (Score: 67-63)
Victor Nowitzki attempts a Layup. Contested by Desmond Ginobili (5.0 feet, ZONE). Victor Nowitzki misses. Rebound secured by Pau Mobley.

[06:47] Team_013 possession (Score: 67-63)
Jayson Morant attempts a Midrange. Contested by Victor Nowitzki (5.8 feet, ZONE). JAYSON MORANT MAKES IT! Assist: Manu Smith
Score: 67-65

[06:32] Team_046 possession (Score: 67-65)
Cade Wall drives and kicks out. Lauri Carter attempts a 3Pt. Contested by Pau Mobley (3.7 feet, ZONE). LAURI CARTER MAKES IT! Assist: Cade Wall
Score: 70-65

[06:17] Team_013 possession (Score: 70-65)
FOUL! Reach-in foul on Lauri Carter during the drive. [Team fouls: 4] No free throws, side out. (Lauri Carter: 1 personal fouls)

[06:01] Team_013 possession (Score: 70-65)
Nikola Curry attempts a 3Pt. Contested by Kevin Allen (5.2 feet, MAN). Nikola Curry misses. Rebound secured by Cade Wall.

[05:47] Team_046 possession (Score: 70-65)
Victor Nowitzki attempts a 3Pt. Contested by Pau Mobley (3.9 feet, MAN). Victor Nowitzki misses. Rebound secured by Desmond Ginobili.

[05:32] Team_013 possession (Score: 70-65)
Pau Mobley attempts a Midrange. Contested by Victor Nowitzki (5.5 feet, MAN). PAU MOBLEY MAKES IT!
Score: 70-67

[05:13] Team_046 possession (Score: 70-67)
FOUL! Shooting foul on Manu Smith. Lauri Carter to the line for 2 free throws. [Team fouls: 3] (Manu Smith: 1 personal fouls)   FT 1/2: GOOD   FT 2/2: GOOD Lauri Carter makes 2/2 from the line.
Score: 72-67

[05:01] Team_013 possession (Score: 72-67)
FOUL! Holding foul on Lauri Carter. [IN THE BONUS! 5 team fouls] Jayson Morant to the line for 2 free throws. (Lauri Carter: 2 personal fouls)   FT 1/2: GOOD   FT 2/2: GOOD Jayson Morant makes 2/2 from the line.
Score: 72-69

[04:49] Team_046 possession (Score: 72-69)
Victor Nowitzki attempts a Layup. BLOCKED BY PAU MOBLEY! Ball is loose! Offensive rebound by Cade Wall! Cade Wall kicks it out.

[04:32] Team_046 possession (Score: 72-69)
Cade Wall attempts a 3Pt. Contested by Desmond Ginobili (5.5 feet, MAN). Cade Wall misses. Rebound secured by Pau Mobley.

[04:19] Team_013 possession (Score: 72-69)
Desmond Ginobili attempts a Midrange. BLOCKED BY CADE WALL! Ball is loose! Offensive rebound by Nikola Curry! Nikola Curry kicks it out.

[04:08] Team_013 possession (Score: 72-69)
Pau Mobley attempts a 3Pt. Contested by Lauri Carter (3.3 feet, ZONE). Pau Mobley misses. Rebound secured by Cade Wall.

[03:54] Team_046 possession (Score: 72-69)
FOUL! Reach-in foul on Desmond Ginobili during the drive. [Team fouls: 4] No free throws, side out. (Desmond Ginobili: 1 personal fouls)

[03:40] Team_046 possession (Score: 72-69)
Cade Wall drives, Desmond Ginobili stays with him. Cade Wall attempts a Layup. Contested by Desmond Ginobili (5.6 feet, MAN). CADE WALL MAKES IT! Assist: Victor Nowitzki
Score: 74-69

[03:25] Team_013 possession (Score: 74-69)
Manu Smith makes the Dunk and draws the foul on D'Angelo O'Neal! And-1! Manu Smith to the line for 1. [BONUS: 7 team fouls] (D'Angelo O'Neal: 2 personal fouls)   FT 1/1: GOOD Manu Smith makes 1/1 from the line.
Score: 74-72

[03:11] Team_046 possession (Score: 74-72)
Cade Wall attempts a Midrange. Contested by Desmond Ginobili (5.6 feet, MAN). Cade Wall misses. Rebound secured by Pau Mobley.

[02:59] Team_013 possession (Score: 74-72)
Pau Mobley drives and kicks out. Jayson Morant attempts a 3Pt. Contested by Lauri Carter (3.5 feet, MAN). Jayson Morant misses. Rebound secured by Cade Wall.

[02:39] Team_046 possession (Score: 74-72)
Victor Nowitzki drives, picks up Desmond Ginobili. Help arrives from Pau Mobley! Victor Nowitzki attempts a Dunk. Contested by Pau Mobley (5.2 feet, ZONE). Victor Nowitzki misses. Rebound secured by Nikola Curry.

[02:24] Team_013 possession (Score: 74-72)
Pau Mobley attempts a 3Pt. Contested by Lauri Carter (3.5 feet, ZONE). Pau Mobley misses. Offensive rebound by Desmond Ginobili! Desmond Ginobili kicks it out.

[02:07] Team_013 possession (Score: 74-72)
Nikola Curry makes the Layup and draws the foul on D'Angelo O'Neal! And-1! Nikola Curry to the line for 1. [BONUS: 8 team fouls] (D'Angelo O'Neal: 3 personal fouls)   FT 1/1: GOOD Nikola Curry makes 1/1 from the line.
Score: 74-75

[01:54] Team_046 possession (Score: 74-75)
Lauri Carter attempts a 3Pt. Contested by Pau Mobley (4.3 feet, ZONE). Lauri Carter misses. Rebound secured by Pau Mobley.

[01:38] Team_013 possession (Score: 74-75)
Manu Smith attempts a Midrange. Contested by D'Angelo O'Neal (5.0 feet, MAN). MANU SMITH MAKES IT! Assist: Desmond Ginobili
Score: 74-77

[01:23] Team_046 possession (Score: 74-77)
Kevin Allen attempts a Midrange. Contested by Nikola Curry (5.6 feet, MAN). KEVIN ALLEN MAKES IT! Assist: Victor Nowitzki
Score: 76-77

[01:12] Team_013 possession (Score: 76-77)
Desmond Ginobili attempts a Midrange. Contested by Cade Wall (4.5 feet, ZONE). DESMOND GINOBILI MAKES IT!
Score: 76-79

[01:00] Team_046 possession (Score: 76-79)
Cade Wall drives, picks up Desmond Ginobili. Help arrives from Pau Mobley! Cade Wall attempts a Dunk. Contested by Pau Mobley (5.8 feet, MAN). CADE WALL MAKES IT! Assist: D'Angelo O'Neal
Score: 78-79

[00:48] Team_013 possession (Score: 78-79)
Nikola Curry makes the Layup and draws the foul on Kevin Allen! And-1! Nikola Curry to the line for 1. [BONUS: 9 team fouls] (Kevin Allen: 2 personal fouls)   FT 1/1: GOOD Nikola Curry makes 1/1 from the line.
Score: 78-82

[00:38] Team_046 possession (Score: 78-82)
FOUL! Holding foul on Pau Mobley. [IN THE BONUS! 5 team fouls] Victor Nowitzki to the line for 2 free throws. (Pau Mobley: 2 personal fouls)   FT 1/2: GOOD   FT 2/2: GOOD Victor Nowitzki makes 2/2 from the line.
Score: 80-82

[00:22] Team_013 possession (Score: 80-82)
FOUL! Shooting foul on Cade Wall. Desmond Ginobili to the line for 2 free throws. [BONUS: 10 team fouls] (Cade Wall: 3 personal fouls)   FT 1/2: MISS   FT 2/2: MISS Desmond Ginobili makes 0/2 from the line. Offensive rebound by Desmond Ginobili! Desmond Ginobili kicks it out.

[00:06] Team_013 possession (Score: 80-82)
Jayson Morant attempts a 3Pt. Contested by Lauri Carter (4.1 feet, MAN). Jayson Morant misses. Rebound secured by Lauri Carter.

================================================================================
                              3RD QUARTER COMPLETE                              
================================================================================

3RD QUARTER SCORE: Team_046 21, Team_013 27

BOX SCORE:
================================================================================

Team_046
--------------------------------------------------------------------------------
Player                MIN  PTS  REB  AST  TO      FG   FG%      3P   3P%
--------------------------------------------------------------------------------
Lauri Carter           36    8    2    0   0   3/6    50.0     0/0   0.0
Victor Nowitzki        36    5    0    2   0   2/7    28.6     0/0   0.0
Cade Wall              36    4    4    2   0   2/4    50.0     0/0   0.0
Kevin Allen            36    2    4    0   0   1/1   100.0     0/0   0.0
D'Angelo O'Neal        36    2    0    2   0   1/1   100.0     0/0   0.0

TEAM: FG: 9/19 (47.4%), 3PT: 2/9 (22.2%), REB: 10 (2 off, 8 def), AST: 6, TO: 2
TEAM FOULS: 10 [Team_013 in BONUS]


Team_013
--------------------------------------------------------------------------------
Player                MIN  PTS  REB  AST  TO      FG   FG%      3P   3P%
--------------------------------------------------------------------------------
Nikola Curry           36    9    4    0   0   3/6    50.0     0/0   0.0
Jayson Morant          36    6    0    0   0   3/5    60.0     0/0   0.0
Desmond Ginobili       36    5    6    1   0   2/2   100.0     0/0   0.0
Manu Smith             36    5    0    3   0   2/3    66.7     0/0   0.0
Pau Mobley             36    2    4    0   0   1/3    33.3     0/0   0.0

TEAM: FG: 11/19 (57.9%), 3PT: 1/6 (16.7%), REB: 14 (4 off, 10 def), AST: 4, TO: 2
TEAM FOULS: 5 [Team_046 in BONUS]

================================================================================

================================================================================
                       4TH QUARTER - Team_046 vs Team_013                       
================================================================================

[12:00] Team_046 possession (Score: 80-82)
Victor Nowitzki drives, picks up Desmond Ginobili. Help arrives from Pau Mobley! Victor Nowitzki attempts a Layup. Contested by Pau Mobley (5.3 feet, ZONE). Victor Nowitzki misses. Rebound secured by Pau Mobley.

[11:41] Team_013 possession (Score: 80-82)
Pau Mobley attempts a Midrange. Contested by Victor Nowitzki (5.8 feet, MAN). PAU MOBLEY MAKES IT!
Score: 80-84

[11:28] Team_046 possession (Score: 80-84)
D'Angelo O'Neal makes the Layup and draws the foul on Desmond Ginobili! And-1! D'Angelo O'Neal to the line for 1. [Team fouls: 1] (Desmond Ginobili: 1 personal fouls)   FT 1/1: GOOD D'Angelo O'Neal makes 1/1 from the line.
Score: 83-84

[11:14] Team_013 possession (Score: 83-84)
Jayson Morant throws a bad pass! Stolen by Lauri Carter! TURNOVER! (live ball)

[10:58] Team_046 possession (Score: 83-84)
Victor Nowitzki attempts a Layup. Contested by Desmond Ginobili (5.4 feet, ZONE). VICTOR NOWITZKI MAKES IT!
Score: 85-84

[10:44] Team_013 possession (Score: 85-84)
Jayson Morant attempts a Midrange. Contested by Lauri Carter (4.0 feet, MAN). Jayson Morant misses. Rebound secured by Lauri Carter.

[10:26] Team_046 possession (Score: 85-84)
D'Angelo O'Neal attempts a 3Pt. Contested by Pau Mobley (4.4 feet, ZONE). D'ANGELO O'NEAL MAKES IT! Assist: Lauri Carter
Score: 88-84

[10:11] Team_013 possession (Score: 88-84)
Pau Mobley makes the Layup and draws the foul on Lauri Carter! And-1! Pau Mobley to the line for 1. [Team fouls: 1] (Lauri Carter: 1 personal fouls)   FT 1/1: GOOD Pau Mobley makes 1/1 from the line.
Score: 88-87

[09:55] Team_046 possession (Score: 88-87)
Kevin Allen makes the Layup and draws the foul on Nikola Curry! And-1! Kevin Allen to the line for 1. [Team fouls: 2] (Nikola Curry: 1 personal fouls)   FT 1/1: GOOD Kevin Allen makes 1/1 from the line.
Score: 91-87

[09:41] Team_013 possession (Score: 91-87)
Desmond Ginobili attempts a 3Pt. Contested by Lauri Carter (4.1 feet, ZONE). Desmond Ginobili misses. Rebound secured by Cade Wall.

[09:31] Team_046 possession (Score: 91-87)
D'Angelo O'Neal drives and kicks out. Lauri Carter attempts a Midrange. Contested by Jayson Morant (4.8 feet, MAN). LAURI CARTER MAKES IT! Assist: Kevin Allen
Score: 93-87

[09:17] Team_013 possession (Score: 93-87)
Manu Smith attempts a 3Pt. Contested by D'Angelo O'Neal (5.3 feet, MAN). MANU SMITH MAKES IT! Assist: Nikola Curry
Score: 93-90

[09:03] Team_046 possession (Score: 93-90)
D'Angelo O'Neal drives and kicks out. D'Angelo O'Neal attempts a 3Pt. Contested by Manu Smith (5.3 feet, MAN). D'ANGELO O'NEAL MAKES IT! Assist: Cade Wall
Score: 96-90

[08:52] Team_013 possession (Score: 96-90)
Pau Mobley drives, Victor Nowitzki stays with him. Pau Mobley attempts a Dunk. Wide open! Victor Nowitzki is 6.1 feet away. [MAN] PAU MOBLEY MAKES IT!
Score: 96-92

[08:35] Team_046 possession (Score: 96-92)
Cade Wall attempts a Layup. Wide open! Desmond Ginobili is 6.0 feet away. [MAN] CADE WALL MAKES IT! Assist: D'Angelo O'Neal
Score: 98-92

[08:20] Team_013 possession (Score: 98-92)
Nikola Curry attempts a 3Pt. Contested by Lauri Carter (4.5 feet, ZONE). Nikola Curry misses. Offensive rebound by Desmond Ginobili! Desmond Ginobili kicks it out.

[08:08] Team_013 possession (Score: 98-92)
FOUL! Holding foul on D'Angelo O'Neal. [Team fouls: 2] No free throws, side out. (D'Angelo O'Neal: 1 personal fouls)

[07:55] Team_013 possession (Score: 98-92)
Pau Mobley throws a bad pass! Stolen by Victor Nowitzki! TURNOVER! (live ball)

[07:39] Team_046 possession (Score: 98-92)
Cade Wall drives, Desmond Ginobili stays with him. Cade Wall attempts a Layup. Wide open! Desmond Ginobili is 6.1 feet away. [MAN] CADE WALL MAKES IT! Assist: Kevin Allen
Score: 100-92

[07:24] Team_013 possession (Score: 100-92)
Manu Smith attempts a 3Pt. Contested by D'Angelo O'Neal (5.5 feet, MAN). MANU SMITH MAKES IT! Assist: Jayson Morant
Score: 100-95

[07:09] Team_046 possession (Score: 100-95)
Cade Wall attempts a Midrange. Wide open! Desmond Ginobili is 6.2 feet away. [ZONE] Cade Wall misses. FOUL! Loose ball foul on Pau Mobley during the rebound battle. [Team fouls: 3] No free throws, side out. (Pau Mobley: 1 personal fouls)

[06:57] Team_046 possession (Score: 100-95)
Victor Nowitzki attempts a 3Pt. Contested by Pau Mobley (4.8 feet, MAN). Victor Nowitzki misses. Rebound secured by Desmond Ginobili.

[06:42] Team_013 possession (Score: 100-95)
Pau Mobley attempts a Layup. Wide open! Victor Nowitzki is 6.3 feet away. [MAN] PAU MOBLEY MAKES IT! Assist: Jayson Morant
Score: 100-97

[06:31] Team_046 possession (Score: 100-97)
D'Angelo O'Neal drives, Manu Smith stays with him. D'Angelo O'Neal attempts a Layup. Contested by Manu Smith (5.7 feet, MAN). D'ANGELO O'NEAL MAKES IT!
Score: 102-97

[06:19] Team_013 possession (Score: 102-97)
Nikola Curry drives, picks up Kevin Allen. Help arrives from D'Angelo O'Neal! Nikola Curry attempts a Layup. Wide open! D'Angelo O'Neal is 6.3 feet away. [ZONE] NIKOLA CURRY MAKES IT! Assist: Manu Smith
Score: 102-99

[06:03] Team_046 possession (Score: 102-99)
D'Angelo O'Neal throws a bad pass! Stolen by Manu Smith! TURNOVER! (live ball)

[05:51] Team_013 possession (Score: 102-99)
Jayson Morant attempts a Midrange. Contested by Lauri Carter (4.7 feet, ZONE). JAYSON MORANT MAKES IT! Assist: Manu Smith
Score: 102-101

[05:37] Team_046 possession (Score: 102-101)
Lauri Carter attempts a 3Pt. Contested by Jayson Morant (5.5 feet, MAN). Lauri Carter misses. Rebound secured by Nikola Curry.

[05:26] Team_013 possession (Score: 102-101)
Desmond Ginobili attempts a 3Pt. Contested by Lauri Carter (4.8 feet, ZONE). Desmond Ginobili misses. Offensive rebound by Nikola Curry! Nikola Curry kicks it out.

[05:09] Team_013 possession (Score: 102-101)
Nikola Curry attempts a Layup. Wide open! Kevin Allen is 6.4 feet away. [ZONE] NIKOLA CURRY MAKES IT! Assist: Pau Mobley
Score: 102-103

[04:58] Team_046 possession (Score: 102-103)
Lauri Carter attempts a 3Pt. Contested by Jayson Morant (5.6 feet, MAN). Lauri Carter misses. Rebound secured by Desmond Ginobili.

[04:42] Team_013 possession (Score: 102-103)
Jayson Morant attempts a Midrange. Wide open! Victor Nowitzki is 6.8 feet away. [ZONE] Jayson Morant misses. Rebound secured by Cade Wall.

[04:29] Team_046 possession (Score: 102-103)
Victor Nowitzki attempts a 3Pt. Contested by Pau Mobley (5.2 feet, ZONE). Victor Nowitzki misses. Rebound secured by Nikola Curry.

[04:15] Team_013 possession (Score: 102-103)
Nikola Curry attempts a Midrange. Contested by Lauri Carter (5.1 feet, ZONE). Nikola Curry misses. Rebound secured by Lauri Carter.

[03:57] Team_046 possession (Score: 102-103)
D'Angelo O'Neal drives, Desmond Ginobili stays with him. D'Angelo O'Neal attempts a Layup. Wide open! Desmond Ginobili is 6.3 feet away. [ZONE] D'ANGELO O'NEAL MAKES IT! Assist: Kevin Allen
Score: 104-103

[03:42] Team_013 possession (Score: 104-103)
Pau Mobley attempts a Layup. Wide open! Victor Nowitzki is 6.7 feet away. [MAN] PAU MOBLEY MAKES IT!
Score: 104-105

[03:29] Team_046 possession (Score: 104-105)
D'Angelo O'Neal attempts a 3Pt. Contested by Pau Mobley (5.5 feet, ZONE). D'Angelo O'Neal misses. Rebound secured by Nikola Curry.

[03:15] Team_013 possession (Score: 104-105)
Manu Smith drives, D'Angelo O'Neal stays with him. Manu Smith attempts a Layup. Wide open! D'Angelo O'Neal is 6.2 feet away. [MAN] MANU SMITH MAKES IT! Assist: Nikola Curry
Score: 104-107

[02:58] Team_046 possession (Score: 104-107)
Lauri Carter attempts a Midrange. Contested by Jayson Morant (5.9 feet, MAN). Lauri Carter misses. Rebound secured by Pau Mobley.

[02:44] Team_013 possession (Score: 104-107)
Pau Mobley drives, picks up Victor Nowitzki. Help arrives from Lauri Carter! Pau Mobley attempts a Layup. Wide open! Lauri Carter is 6.8 feet away. [MAN] Pau Mobley misses. Rebound secured by Cade Wall.

[02:28] Team_046 possession (Score: 104-107)
Victor Nowitzki attempts a Midrange. Contested by Pau Mobley (5.6 feet, MAN). VICTOR NOWITZKI MAKES IT! Assist: Cade Wall
Score: 106-107

[02:11] Team_013 possession (Score: 106-107)
Desmond Ginobili attempts a Midrange. Wide open! Victor Nowitzki is 7.1 feet away. [ZONE] DESMOND GINOBILI MAKES IT! Assist: Nikola Curry
Score: 106-109

[01:56] Team_046 possession (Score: 106-109)
Cade Wall attempts a Layup. Wide open! Desmond Ginobili is 6.8 feet away. [MAN] CADE WALL MAKES IT! Assist: Victor Nowitzki
Score: 108-109

[01:41] Team_013 possession (Score: 108-109)
Jayson Morant attempts a 3Pt. Contested by Lauri Carter (5.4 feet, MAN). Jayson Morant misses. Offensive rebound by Nikola Curry! Nikola Curry kicks it out.

[01:29] Team_013 possession (Score: 108-109)
Desmond Ginobili attempts a 3Pt. Contested by Lauri Carter (5.4 feet, ZONE). Desmond Ginobili misses. Rebound secured by D'Angelo O'Neal.

[01:17] Team_046 possession (Score: 108-109)
Victor Nowitzki attempts a Midrange. Contested by Pau Mobley (5.8 feet, MAN). Victor Nowitzki misses. Rebound secured by Nikola Curry.

[01:03] Team_013 possession (Score: 108-109)
Desmond Ginobili attempts a 3Pt. Wide open! Cade Wall is 6.1 feet away. [MAN] Desmond Ginobili misses. Rebound secured by Cade Wall.

[00:54] Team_046 possession (Score: 108-109)
D'Angelo O'Neal drives to the basket... D'Angelo O'Neal loses the ball! Stripped by Manu Smith! TURNOVER! (live ball)

[00:41] Team_013 possession (Score: 108-109)
Nikola Curry attempts a Midrange. Wide open! Cade Wall is 6.3 feet away. [ZONE] Nikola Curry misses. Rebound secured by D'Angelo O'Neal.

[00:23] Team_046 possession (Score: 108-109)
D'Angelo O'Neal throws a bad pass! Stolen by Manu Smith! TURNOVER! (live ball)

[00:10] Team_013 possession (Score: 108-109)
Jayson Morant attempts a Layup. Contested by Lauri Carter (5.7 feet, MAN). Jayson Morant misses. Rebound secured by Lauri Carter.

================================================================================
                              4TH QUARTER COMPLETE                              
================================================================================

4TH QUARTER SCORE: Team_046 28, Team_013 27

BOX SCORE:
================================================================================

Team_046
--------------------------------------------------------------------------------
Player                MIN  PTS  REB  AST  TO      FG   FG%      3P   3P%
--------------------------------------------------------------------------------
D'Angelo O'Neal        48   13    2    1   0   5/6    83.3     0/0   0.0
Cade Wall              48    6    4    2   0   3/3   100.0     0/0   0.0
Victor Nowitzki        48    4    0    1   0   2/6    33.3     0/0   0.0
Kevin Allen            48    3    0    3   0   1/1   100.0     0/0   0.0
Lauri Carter           48    2    4    1   0   1/4    25.0     0/0   0.0

TEAM: FG: 12/20 (60.0%), 3PT: 1/6 (16.7%), REB: 10 (1 off, 9 def), AST: 8, TO: 3
TEAM FOULS: 2


Team_013
--------------------------------------------------------------------------------
Player                MIN  PTS  REB  AST  TO      FG   FG%      3P   3P%
--------------------------------------------------------------------------------
Pau Mobley             48   11    2    1   0   5/6    83.3     0/0   0.0
Manu Smith             48    8    0    2   0   3/3   100.0     0/0   0.0
Nikola Curry           48    4    6    3   0   2/4    50.0     0/0   0.0
Jayson Morant          48    2    0    2   0   1/4    25.0     0/0   0.0
Desmond Ginobili       48    2    3    0   0   1/4    25.0     0/0   0.0

TEAM: FG: 12/21 (57.1%), 3PT: 2/5 (40.0%), REB: 11 (3 off, 8 def), AST: 8, TO: 2
TEAM FOULS: 3

================================================================================

================================================================================
                               FULL GAME COMPLETE                               
================================================================================

FINAL SCORE: Team_046 108, Team_013 109

SCORING BY QUARTER:
--------------------------------------------------------------------------------
Team                     Q1     Q2     Q3     Q4    FINAL
--------------------------------------------------------------------------------
Team_046                 27     32     21     28      108
Team_013                 25     30     27     27      109
--------------------------------------------------------------------------------

FULL GAME BOX SCORE:
================================================================================

Team_046
--------------------------------------------------------------------------------
Player                MIN  PTS  REB  AST  TO      FG   FG%      3P   3P%      FT STL BLK
--------------------------------------------------------------------------------
D'Angelo O'Neal        48   27    2    7   3  12/15   80.0   1/3    33.3   3/3     0   0
Victor Nowitzki        48   21    0    5   0   6/16   37.5   2/7    28.6   7/7     2   0
Lauri Carter           48   18   11    2   1   5/16   31.2   1/9    11.1   4/4     2   1
Cade Wall              48   27   19    7   1  14/20   70.0   0/4     0.0   5/6     1   1
Kevin Allen            48   13    8    3   3   6/10   60.0   1/2    50.0   2/3     0   0
Collin Butler           0    0    0    0   0   0/0     0.0   0/0     0.0   0/0     0   0
Manu Dosunmu            0    0    0    0   0   0/0     0.0   0/0     0.0   0/0     0   0
Josh Barrett            0    0    0    0   0   0/0     0.0   0/0     0.0   0/0     0   0
Chris LaVine            0    0    0    0   0   0/0     0.0   0/0     0.0   0/0     0   0
Paul DeRozan            0    0    0    0   0   0/0     0.0   0/0     0.0   0/0     0   0

TEAM: FG: 46/80 (57.5%), 3PT: 5/25 (20.0%), REB: 40 (7 off, 33 def), AST: 24, TO: 8


Team_013
--------------------------------------------------------------------------------
Player                MIN  PTS  REB  AST  TO      FG   FG%      3P   3P%      FT STL BLK
--------------------------------------------------------------------------------
Manu Smith             48   24    0    7   0   9/13   69.2   5/7    71.4   4/7     3   0
Pau Mobley             48   23   10    4   4  11/20   55.0   1/4    25.0   2/4     0   1
Jayson Morant          48   14    0    3   2   5/13   38.5   1/5    20.0   4/5     0   0
Desmond Ginobili       48   18   17    1   3   7/12   58.3   3/7    42.9   4/7     1   1
Nikola Curry           48   24   22    5   0  10/18   55.6   0/2     0.0   4/4     0   0
Gary Iverson            0    2    0    0   0   0/0     0.0   0/0     0.0   2/2     0   0
Chris Bryant            0    0    0    0   0   0/0     0.0   0/0     0.0   0/0     0   0
Vince Nowitzki          0    0    0    0   0   0/0     0.0   0/0     0.0   0/0     0   0
Dirk Booker             0    0    0    0   0   0/0     0.0   0/0     0.0   0/0     0   0
Jayson Nowitzki         0    0    0    0   0   0/0     0.0   0/0     0.0   0/0     0   0

TEAM: FG: 44/78 (56.4%), 3PT: 10/25 (40.0%), REB: 49 (15 off, 34 def), AST: 20, TO: 9

================================================================================
