================================================================================
                        FULL GAME - Team_034 vs Team_082                        
================================================================================

================================================================================
                       1ST QUARTER - Team_034 vs Team_082                       
================================================================================

[12:00] Team_034 possession (Score: 0-0)
Terry Doncic attempts a Midrange. Contested by Jrue Green (5.1 feet, MAN). Terry Doncic misses. Rebound secured by Jrue Green.

[11:42] Team_082 possession (Score: 0-0)
Kristaps Fox drives to the basket... Kristaps Fox loses control! Ball rolls out of bounds! TURNOVER! (dead ball)

[11:29] Team_034 possession (Score: 0-0)
Cole Antetokounmpo makes the Midrange and draws the foul on Kristaps Fox! And-1! Cole Antetokounmpo to the line for 1. [Team fouls: 1] (Kristaps Fox: 1 personal fouls)   FT 1/1: GOOD Cole Antetokounmpo makes 1/1 from the line.
Score: 3-0

[11:13] Team_082 possession (Score: 3-0)
Julius Carter attempts a Midrange. Contested by Ben Hyland (4.0 feet, ZONE). Julius Carter misses. Offensive rebound by Julius Carter! Julius Carter kicks it out.

[11:00] Team_082 possession (Score: 3-0)
Julius Anthony attempts a Midrange. Contested by Cole Antetokounmpo (4.9 feet, ZONE). JULIUS ANTHONY MAKES IT!
Score: 3-2

[10:44] Team_034 possession (Score: 3-2)
Terry Doncic drives and kicks out. Terry Doncic attempts a 3Pt. Contested by Jrue Green (5.0 feet, MAN). Terry Doncic misses. Rebound secured by Dwyane O'Neal.

[10:28] Team_082 possession (Score: 3-2)
Julius Anthony attempts a Layup. BLOCKED BY TERRY DONCIC! Ball goes out off Terry Doncic. Julius Anthony's ball!

[10:16] Team_082 possession (Score: 3-2)
FOUL! Holding foul on Cole Antetokounmpo. [Team fouls: 1] No free throws, side out. (Cole Antetokounmpo: 1 personal fouls)

[10:01] Team_082 possession (Score: 3-2)
Jrue Green attempts a Layup. Contested by Terry Doncic (4.4 feet, ZONE). JRUE GREEN MAKES IT! Assist: Dwyane O'Neal
Score: 3-4

[09:47] Team_034 possession (Score: 3-4)
Devin Poole throws a bad pass! Stolen by Julius Anthony! TURNOVER! (live ball)

[09:36] Team_082 possession (Score: 3-4)
Dwyane O'Neal drives to the basket... Dwyane O'Neal throws a bad pass out of bounds! TURNOVER! (dead ball)

[09:23] Team_034 possession (Score: 3-4)
Anthony Bane loses the ball! Stripped by Julius Carter! TURNOVER! (live ball)

[09:08] Team_082 possession (Score: 3-4)
FOUL! Reach-in foul on Terry Doncic during the drive. [Team fouls: 2] No free throws, side out. (Terry Doncic: 1 personal fouls)

[08:54] Team_082 possession (Score: 3-4)
Julius Anthony attempts a 3Pt. Contested by Devin Poole (4.3 feet, ZONE). Julius Anthony misses. Rebound secured by Anthony Bane.

[08:39] Team_034 possession (Score: 3-4)
Cole Antetokounmpo attempts a 3Pt. Contested by Kristaps Fox (4.7 feet, MAN). Cole Antetokounmpo misses. Rebound secured by Jrue Green.

[08:22] Team_082 possession (Score: 3-4)
Kristaps Fox drives, picks up Cole Antetokounmpo. Help arrives from Ben Hyland! Kristaps Fox attempts a Layup. Contested by Ben Hyland (4.6 feet, MAN). Kristaps Fox misses. Rebound secured by Terry Doncic.

[08:03] Team_034 possession (Score: 3-4)
Ben Hyland attempts a 3Pt. Contested by Dwyane O'Neal (3.3 feet, MAN). Ben Hyland misses. Rebound secured by Julius Carter.

[07:47] Team_082 possession (Score: 3-4)
Kristaps Fox attempts a 3Pt. Contested by Devin Poole (4.0 feet, ZONE). KRISTAPS FOX MAKES IT!
Score: 3-7

[07:33] Team_034 possession (Score: 3-7)
Cole Antetokounmpo attempts a 3Pt. Contested by Kristaps Fox (4.7 feet, MAN). COLE ANTETOKOUNMPO MAKES IT!
Score: 6-7

[07:18] Team_082 possession (Score: 6-7)
Julius Carter attempts a Midrange. Contested by Ben Hyland (4.0 feet, ZONE). JULIUS CARTER MAKES IT!
Score: 6-9

[07:07] Team_034 possession (Score: 6-9)
Terry Doncic makes the Layup and draws the foul on Dwyane O'Neal! And-1! Terry Doncic to the line for 1. [Team fouls: 2] (Dwyane O'Neal: 1 personal fouls)   FT 1/1: GOOD Terry Doncic makes 1/1 from the line.
Score: 9-9

[06:54] Team_082 possession (Score: 9-9)
Julius Anthony attempts a 3Pt. Contested by Devin Poole (4.3 feet, ZONE). JULIUS ANTHONY MAKES IT! Assist: Kristaps Fox
Score: 9-12

[06:41] Team_034 possession (Score: 9-12)
Terry Doncic attempts a Layup. Contested by Jrue Green (5.1 feet, MAN). TERRY DONCIC MAKES IT!
Score: 11-12

[06:27] Team_082 possession (Score: 11-12)
Julius Anthony drives, Devin Poole stays with him. Julius Anthony attempts a Dunk. Contested by Devin Poole (4.3 feet, MAN). Julius Anthony misses. Offensive rebound by Julius Carter! Julius Carter kicks it out.

[06:08] Team_082 possession (Score: 11-12)
FOUL! Shooting foul on Terry Doncic. Dwyane O'Neal to the line for 2 free throws. [Team fouls: 3] (Terry Doncic: 2 personal fouls)   FT 1/2: GOOD   FT 2/2: GOOD Dwyane O'Neal makes 2/2 from the line.
Score: 11-14

[05:55] Team_034 possession (Score: 11-14)
Anthony Bane attempts a 3Pt. Contested by Julius Carter (5.9 feet, MAN). ANTHONY BANE MAKES IT! Assist: Ben Hyland
Score: 14-14

[05:40] Team_082 possession (Score: 14-14)
Dwyane O'Neal attempts a Layup. Contested by Terry Doncic (4.1 feet, ZONE). Dwyane O'Neal misses. FOUL! Loose ball foul on Anthony Bane during the rebound battle. [Team fouls: 4] No free throws, side out. (Anthony Bane: 1 personal fouls)

[05:25] Team_082 possession (Score: 14-14)
Julius Carter attempts a Midrange. Contested by Terry Doncic (4.4 feet, ZONE). Julius Carter misses. Rebound secured by Anthony Bane.

[05:16] Team_034 possession (Score: 14-14)
Devin Poole drives and kicks out. Terry Doncic attempts a Midrange. Contested by Dwyane O'Neal (3.3 feet, ZONE). Terry Doncic misses. Rebound secured by Dwyane O'Neal.

[04:59] Team_082 possession (Score: 14-14)
Julius Anthony drives to the basket... FOUL! Offensive foul on Julius Anthony! Devin Poole drew the charge! [Team fouls: 3] (Julius Anthony: 1 personal fouls) TURNOVER! (dead ball)

[04:43] Team_034 possession (Score: 14-14)
FOUL! Shooting foul on Jrue Green. Cole Antetokounmpo to the line for 2 free throws. [Team fouls: 4] (Jrue Green: 1 personal fouls)   FT 1/2: GOOD   FT 2/2: MISS Cole Antetokounmpo makes 1/2 from the line. Offensive rebound by Terry Doncic! Terry Doncic puts it back in!
Score: 17-14

[04:24] Team_082 possession (Score: 17-14)
Dwyane O'Neal attempts a 3Pt. Contested by Ben Hyland (3.7 feet, MAN). Dwyane O'Neal misses. Rebound secured by Terry Doncic.

[04:09] Team_034 possession (Score: 17-14)
Anthony Bane drives, Julius Carter stays with him. Anthony Bane attempts a Layup. Contested by Julius Carter (5.9 feet, MAN). ANTHONY BANE MAKES IT! Assist: Cole Antetokounmpo
Score: 19-14

[03:50] Team_082 possession (Score: 19-14)
Jrue Green attempts a 3Pt. Contested by Devin Poole (4.3 feet, ZONE). Jrue Green misses. Rebound secured by Anthony Bane.

[03:39] Team_034 possession (Score: 19-14)
Cole Antetokounmpo attempts a 3Pt. Contested by Kristaps Fox (4.8 feet, MAN). Cole Antetokounmpo misses. Offensive rebound by Terry Doncic! Terry Doncic puts it back in!
Score: 21-14

[03:22] Team_082 possession (Score: 21-14)
Kristaps Fox attempts a 3Pt. Contested by Devin Poole (4.2 feet, ZONE). Kristaps Fox misses. Rebound secured by Cole Antetokounmpo.

[03:08] Team_034 possession (Score: 21-14)
Terry Doncic drives, picks up Jrue Green. Help arrives from Dwyane O'Neal! Terry Doncic attempts a Dunk. Contested by Dwyane O'Neal (5.3 feet, MAN). TERRY DONCIC MAKES IT!
Score: 23-14

[02:51] Team_082 possession (Score: 23-14)
Dwyane O'Neal attempts a Midrange. Contested by Ben Hyland (3.8 feet, ZONE). Dwyane O'Neal misses. Rebound secured by Terry Doncic.

[02:38] Team_034 possession (Score: 23-14)
Devin Poole attempts a 3Pt. Contested by Julius Anthony (4.6 feet, MAN). DEVIN POOLE MAKES IT! Assist: Terry Doncic
Score: 26-14

[02:24] Team_082 possession (Score: 26-14)
Julius Anthony attempts a Layup. Contested by Devin Poole (4.6 feet, MAN). Julius Anthony misses. Rebound secured by Anthony Bane.

[02:05] Team_034 possession (Score: 26-14)
Ben Hyland drives to the basket... Ben Hyland throws a bad pass! Stolen by Jrue Green! TURNOVER! (live ball)

[01:51] Team_082 possession (Score: 26-14)
Kristaps Fox attempts a Midrange. Contested by Ben Hyland (4.0 feet, ZONE). KRISTAPS FOX MAKES IT! Assist: Julius Anthony
Score: 26-16

[01:35] Team_034 possession (Score: 26-16)
Cole Antetokounmpo attempts a Midrange. Contested by Kristaps Fox (5.0 feet, MAN). COLE ANTETOKOUNMPO MAKES IT! Assist: Devin Poole
Score: 28-16

[01:16] Team_082 possession (Score: 28-16)
Dwyane O'Neal attempts a Midrange. Contested by Cole Antetokounmpo (4.9 feet, ZONE). Dwyane O'Neal misses. Offensive rebound by Julius Carter! Julius Carter kicks it out.

[01:01] Team_082 possession (Score: 28-16)
Jrue Green makes the Dunk and draws the foul on Terry Doncic! And-1! Jrue Green to the line for 1. [BONUS: 5 team fouls] (Terry Doncic: 3 personal fouls)   FT 1/1: GOOD Jrue Green makes 1/1 from the line.
Score: 28-19

[00:46] Team_034 possession (Score: 28-19)
Terry Doncic attempts a Midrange. Contested by Jrue Green (5.5 feet, MAN). TERRY DONCIC MAKES IT!
Score: 30-19

[00:32] Team_082 possession (Score: 30-19)
Julius Anthony attempts a Midrange. Contested by Devin Poole (4.8 feet, MAN). Julius Anthony misses. Offensive rebound by Jrue Green! Jrue Green kicks it out.

[00:15] Team_082 possession (Score: 30-19)
Julius Carter drives, Terry Doncic stays with him. Julius Carter attempts a Layup. Contested by Terry Doncic (4.9 feet, ZONE). JULIUS CARTER MAKES IT! Assist: Julius Anthony
Score: 30-21

[00:01] Team_034 possession (Score: 30-21)
Cole Antetokounmpo throws a bad pass out of bounds! TURNOVER! (dead ball)

[00:01] Substitution (Team_034): Devin Poole OUT → Manu Jokic IN (stamina_rule2)

[00:01] Substitution (Team_034): Ben Hyland OUT → Damian Turner IN (stamina_rule2)

[00:01] Substitution (Team_034): Cole Antetokounmpo OUT → Vince Paul IN (stamina_rule2)

[00:01] Substitution (Team_034): Terry Doncic OUT → Nikola Wagner IN (stamina_rule2)

[00:01] Substitution (Team_034): Anthony Bane OUT → Carmelo Anunoby IN (stamina_rule2)

[00:01] Substitution (Team_082): Julius Anthony OUT → Jordan Rozier IN (stamina_rule2)

[00:01] Substitution (Team_082): Dwyane O'Neal OUT → Kawhi Poole IN (stamina_rule2)

[00:01] Substitution (Team_082): Kristaps Fox OUT → Shaquille Griffin IN (stamina_rule2)

[00:01] Substitution (Team_082): Jrue Green OUT → Tony Jokic IN (stamina_rule2)

[00:01] Substitution (Team_082): Julius Carter OUT → D'Angelo Parker IN (stamina_rule2)

================================================================================
                              1ST QUARTER COMPLETE                              
================================================================================

1ST QUARTER SCORE: Team_034 30, Team_082 21

BOX SCORE:
================================================================================

Team_034
--------------------------------------------------------------------------------
Player                MIN  PTS  REB  AST  TO      FG   FG%      3P   3P%
--------------------------------------------------------------------------------
Terry Doncic           12   14    4    1   0   6/8    75.0     0/0   0.0
Cole Antetokounmpo     12    8    1    1   0   3/4    75.0     0/0   0.0
Anthony Bane           12    5    4    0   0   2/2   100.0     0/0   0.0
Devin Poole            12    3    0    1   0   1/2    50.0     0/0   0.0
Ben Hyland             12    0    0    1   0   0/1     0.0     0/0   0.0

TEAM: FG: 12/17 (70.6%), 3PT: 4/6 (66.7%), REB: 9 (1 off, 8 def), AST: 4, TO: 4
TEAM FOULS: 5 [Team_082 in BONUS]


Team_082
--------------------------------------------------------------------------------
Player                MIN  PTS  REB  AST  TO      FG   FG%      3P   3P%
--------------------------------------------------------------------------------
Jrue Green             12    5    3    0   0   2/3    66.7     0/0   0.0
Julius Anthony         12    5    0    2   0   2/4    50.0     0/0   0.0
Kristaps Fox           12    5    0    1   0   2/4    50.0     0/0   0.0
Julius Carter          12    4    5    0   0   2/3    66.7     0/0   0.0
Dwyane O'Neal          12    2    2    1   0   1/3    33.3     0/0   0.0

TEAM: FG: 9/17 (52.9%), 3PT: 2/6 (33.3%), REB: 10 (5 off, 5 def), AST: 4, TO: 3
TEAM FOULS: 4

================================================================================

================================================================================
                       2ND QUARTER - Team_034 vs Team_082                       
================================================================================

[12:00] Team_034 possession (Score: 30-21)
Devin Poole attempts a Midrange. Contested by Jrue Green (5.3 feet, ZONE). DEVIN POOLE MAKES IT! Assist: Ben Hyland
Score: 32-21

[11:46] Team_082 possession (Score: 32-21)
Julius Anthony attempts a 3Pt. Contested by Devin Poole (4.7 feet, MAN). JULIUS ANTHONY MAKES IT! Assist: Julius Carter
Score: 32-24

[11:30] Team_034 possession (Score: 32-24)
Devin Poole attempts a Midrange. Contested by Julius Anthony (4.7 feet, MAN). DEVIN POOLE MAKES IT! Assist: Terry Doncic
Score: 34-24

[11:14] Team_082 possession (Score: 34-24)
Kristaps Fox attempts a 3Pt. Contested by Devin Poole (4.5 feet, ZONE). KRISTAPS FOX MAKES IT! Assist: Jrue Green
Score: 34-27

[11:00] Team_034 possession (Score: 34-27)
Ben Hyland attempts a Layup. Contested by Jrue Green (5.5 feet, ZONE). BEN HYLAND MAKES IT! Assist: Devin Poole
Score: 36-27

[10:46] Team_082 possession (Score: 36-27)
Jrue Green attempts a Midrange. Contested by Terry Doncic (4.7 feet, MAN). Jrue Green misses. FOUL! Loose ball foul on Cole Antetokounmpo during the rebound battle. [Team fouls: 1] No free throws, side out. (Cole Antetokounmpo: 1 personal fouls)

[10:33] Team_082 possession (Score: 36-27)
Jrue Green attempts a Midrange. Contested by Terry Doncic (4.8 feet, MAN). JRUE GREEN MAKES IT!
Score: 36-29

[10:20] Team_034 possession (Score: 36-29)
Anthony Bane attempts a 3Pt. Contested by Dwyane O'Neal (3.8 feet, ZONE). Anthony Bane misses. Rebound secured by Dwyane O'Neal.

[10:07] Team_082 possession (Score: 36-29)
Dwyane O'Neal attempts a Layup. Contested by Terry Doncic (4.6 feet, ZONE). DWYANE O'NEAL MAKES IT!
Score: 36-31

[09:55] Team_034 possession (Score: 36-31)
Terry Doncic drives, Jrue Green stays with him. Terry Doncic attempts a Layup. Contested by Jrue Green (5.7 feet, ZONE). TERRY DONCIC MAKES IT! Assist: Devin Poole
Score: 38-31

[09:38] Team_082 possession (Score: 38-31)
Julius Carter drives and kicks out. Kristaps Fox attempts a 3Pt. Contested by Devin Poole (4.7 feet, ZONE). Kristaps Fox misses. Rebound secured by Cole Antetokounmpo.

[09:28] Team_034 possession (Score: 38-31)
Cole Antetokounmpo attempts a Midrange. Contested by Kristaps Fox (5.2 feet, MAN). Cole Antetokounmpo misses. Rebound secured by Dwyane O'Neal.

[09:18] Team_082 possession (Score: 38-31)
Julius Anthony attempts a 3Pt. Contested by Devin Poole (5.0 feet, MAN). JULIUS ANTHONY MAKES IT! Assist: Julius Carter
Score: 38-34

[09:06] Team_034 possession (Score: 38-34)
Ben Hyland drives to the basket... Ben Hyland loses control! Ball rolls out of bounds! TURNOVER! (dead ball)

[09:06] Substitution (Team_034): Devin Poole OUT → Manu Jokic IN (stamina_rule2)

[09:06] Substitution (Team_034): Ben Hyland OUT → Damian Turner IN (stamina_rule2)

[09:06] Substitution (Team_034): Cole Antetokounmpo OUT → Vince Paul IN (stamina_rule2)

[09:06] Substitution (Team_034): Terry Doncic OUT → Nikola Wagner IN (stamina_rule2)

[09:06] Substitution (Team_034): Anthony Bane OUT → Carmelo Anunoby IN (stamina_rule2)

[09:06] Substitution (Team_082): Julius Anthony OUT → Jordan Rozier IN (stamina_rule2)

[09:06] Substitution (Team_082): Dwyane O'Neal OUT → Kawhi Poole IN (stamina_rule2)

[09:06] Substitution (Team_082): Kristaps Fox OUT → Shaquille Griffin IN (stamina_rule2)

[09:06] Substitution (Team_082): Jrue Green OUT → Tony Jokic IN (stamina_rule2)

[09:06] Substitution (Team_082): Julius Carter OUT → D'Angelo Parker IN (stamina_rule2)

[08:54] Team_082 possession (Score: 38-34)
Kawhi Poole attempts a Midrange. Contested by Damian Turner (6.0 feet, MAN). KAWHI POOLE MAKES IT! Assist: D'Angelo Parker
Score: 38-36

[08:42] Team_034 possession (Score: 38-36)
Vince Paul throws a bad pass out of bounds! TURNOVER! (dead ball)

[08:29] Team_082 possession (Score: 38-36)
Kawhi Poole drives, Damian Turner stays with him. Kawhi Poole attempts a Layup. Contested by Damian Turner (6.0 feet, MAN). KAWHI POOLE MAKES IT! Assist: Jordan Rozier
Score: 38-38

[08:19] Team_034 possession (Score: 38-38)
Damian Turner makes the Layup and draws the foul on Kawhi Poole! And-1! Damian Turner to the line for 1. [Team fouls: 1] (Kawhi Poole: 1 personal fouls)   FT 1/1: GOOD Damian Turner makes 1/1 from the line.
Score: 41-38

[08:06] Team_082 possession (Score: 41-38)
D'Angelo Parker drives and kicks out. Shaquille Griffin attempts a 3Pt. Contested by Vince Paul (4.2 feet, ZONE). SHAQUILLE GRIFFIN MAKES IT! Assist: Tony Jokic
Score: 41-41

[07:49] Team_034 possession (Score: 41-41)
Vince Paul attempts a 3Pt. Contested by Kawhi Poole (5.8 feet, ZONE). Vince Paul misses. Offensive rebound by Vince Paul! Vince Paul puts it back in!
Score: 43-41

[07:33] Team_082 possession (Score: 43-41)
Jordan Rozier attempts a 3Pt. Contested by Vince Paul (4.3 feet, ZONE). Jordan Rozier misses. Rebound secured by Nikola Wagner.

[07:23] Team_034 possession (Score: 43-41)
Vince Paul attempts a Midrange. Contested by Shaquille Griffin (5.0 feet, MAN). VINCE PAUL MAKES IT! Assist: Damian Turner
Score: 45-41

[07:07] Team_082 possession (Score: 45-41)
FOUL! Reach-in foul on Damian Turner during the drive. [Team fouls: 2] No free throws, side out. (Damian Turner: 1 personal fouls)

[06:53] Team_082 possession (Score: 45-41)
D'Angelo Parker attempts a Midrange. Contested by Carmelo Anunoby (5.8 feet, MAN). D'Angelo Parker misses. Rebound secured by Nikola Wagner.

[06:36] Team_034 possession (Score: 45-41)
Nikola Wagner attempts a Midrange. Contested by Tony Jokic (5.2 feet, MAN). NIKOLA WAGNER MAKES IT! Assist: Carmelo Anunoby
Score: 47-41

[06:22] Team_082 possession (Score: 47-41)
Kawhi Poole drives, picks up Damian Turner. Help arrives from Vince Paul! Kawhi Poole attempts a Layup. Contested by Vince Paul (6.0 feet, MAN). KAWHI POOLE MAKES IT!
Score: 47-43

[06:11] Team_034 possession (Score: 47-43)
Nikola Wagner drives, D'Angelo Parker stays with him. Nikola Wagner attempts a Dunk. Contested by D'Angelo Parker (5.1 feet, ZONE). Nikola Wagner misses. Offensive rebound by Vince Paul! Vince Paul's putback is no good. Rebound secured by Shaquille Griffin.

[05:56] Team_082 possession (Score: 47-43)
Tony Jokic drives and kicks out. Tony Jokic attempts a Midrange. Wide open! Nikola Wagner is 6.0 feet away. [MAN] TONY JOKIC MAKES IT! Assist: Jordan Rozier
Score: 47-45

[05:43] Team_034 possession (Score: 47-45)
Vince Paul drives, picks up Shaquille Griffin. Help arrives from Kawhi Poole! Vince Paul attempts a Layup. Contested by Kawhi Poole (5.0 feet, MAN). Vince Paul misses. Rebound secured by Shaquille Griffin.

[05:26] Team_082 possession (Score: 47-45)
FOUL! Holding foul on Vince Paul. [Team fouls: 3] No free throws, side out. (Vince Paul: 1 personal fouls)

[05:11] Team_082 possession (Score: 47-45)
Kawhi Poole attempts a 3Pt. Contested by Vince Paul (4.8 feet, ZONE). KAWHI POOLE MAKES IT! Assist: Shaquille Griffin
Score: 47-48

[04:54] Team_034 possession (Score: 47-48)
Vince Paul attempts a 3Pt. Contested by Kawhi Poole (5.8 feet, ZONE). Vince Paul misses. Rebound secured by D'Angelo Parker.

[04:38] Team_082 possession (Score: 47-48)
Shaquille Griffin attempts a Midrange. Contested by Damian Turner (5.4 feet, ZONE). Shaquille Griffin misses. Rebound secured by Vince Paul.

[04:22] Team_034 possession (Score: 47-48)
Nikola Wagner drives and kicks out. Vince Paul attempts a Midrange. Contested by Shaquille Griffin (4.6 feet, MAN). VINCE PAUL MAKES IT! Assist: Manu Jokic
Score: 49-48

[04:12] Team_082 possession (Score: 49-48)
Kawhi Poole attempts a 3Pt. Contested by Manu Jokic (5.3 feet, ZONE). Kawhi Poole misses. Rebound secured by Carmelo Anunoby.

[03:57] Team_034 possession (Score: 49-48)
Carmelo Anunoby attempts a Midrange. Contested by Kawhi Poole (5.6 feet, ZONE). Carmelo Anunoby misses. Rebound secured by Shaquille Griffin.

[03:38] Team_082 possession (Score: 49-48)
Kawhi Poole attempts a 3Pt. Contested by Vince Paul (4.8 feet, ZONE). Kawhi Poole misses. Rebound secured by Nikola Wagner.

[03:26] Team_034 possession (Score: 49-48)
Nikola Wagner drives and kicks out. Nikola Wagner attempts a 3Pt. Contested by Kawhi Poole (5.4 feet, ZONE). NIKOLA WAGNER MAKES IT! Assist: Carmelo Anunoby
Score: 52-48

[03:07] Team_082 possession (Score: 52-48)
Shaquille Griffin attempts a 3Pt. Contested by Vince Paul (4.2 feet, MAN). Shaquille Griffin misses. Rebound secured by Nikola Wagner.

[02:54] Team_034 possession (Score: 52-48)
FOUL! Reach-in foul on D'Angelo Parker during the drive. [Team fouls: 2] No free throws, side out. (D'Angelo Parker: 1 personal fouls)

[02:41] Team_034 possession (Score: 52-48)
Manu Jokic attempts a Midrange. Contested by Shaquille Griffin (4.7 feet, ZONE). Manu Jokic misses. Rebound secured by D'Angelo Parker.

[02:25] Team_082 possession (Score: 52-48)
Shaquille Griffin attempts a 3Pt. Contested by Vince Paul (4.2 feet, ZONE). Shaquille Griffin misses. Rebound secured by Carmelo Anunoby.

[02:12] Team_034 possession (Score: 52-48)
Manu Jokic attempts a Midrange. Contested by Tony Jokic (5.1 feet, ZONE). MANU JOKIC MAKES IT! Assist: Damian Turner
Score: 54-48

[01:58] Team_082 possession (Score: 54-48)
Shaquille Griffin makes the Layup and draws the foul on Carmelo Anunoby! And-1! Shaquille Griffin to the line for 1. [Team fouls: 4] (Carmelo Anunoby: 1 personal fouls)   FT 1/1: GOOD Shaquille Griffin makes 1/1 from the line.
Score: 54-51

[01:44] Team_034 possession (Score: 54-51)
Carmelo Anunoby drives, picks up D'Angelo Parker. Help arrives from Kawhi Poole! Carmelo Anunoby attempts a Dunk. Contested by Kawhi Poole (5.1 feet, ZONE). Carmelo Anunoby misses. Rebound secured by Shaquille Griffin.

[01:27] Team_082 possession (Score: 54-51)
Shaquille Griffin drives, Carmelo Anunoby stays with him. Shaquille Griffin attempts a Dunk. Contested by Carmelo Anunoby (5.5 feet, ZONE). Shaquille Griffin misses. Rebound secured by Carmelo Anunoby.

[01:13] Team_034 possession (Score: 54-51)
Carmelo Anunoby makes the Midrange and draws the foul on Tony Jokic! And-1! Carmelo Anunoby to the line for 1. [Team fouls: 3] (Tony Jokic: 1 personal fouls)   FT 1/1: MISS Carmelo Anunoby makes 0/1 from the line. FOUL! Loose ball foul on Shaquille Griffin during the free throw rebound! [Team fouls: 4] No free throws, side out. (Shaquille Griffin: 1 personal fouls)
Score: 56-51

[00:58] Team_034 possession (Score: 56-51)
Manu Jokic attempts a 3Pt. Wide open! Jordan Rozier is 6.2 feet away. [MAN] Manu Jokic misses. Offensive rebound by Vince Paul! Vince Paul puts it back in!
Score: 58-51

[00:43] Team_082 possession (Score: 58-51)
D'Angelo Parker attempts a Midrange. Contested by Vince Paul (4.7 feet, ZONE). D'Angelo Parker misses. Rebound secured by Nikola Wagner.

[00:29] Team_034 possession (Score: 58-51)
Manu Jokic attempts a Midrange. Contested by Kawhi Poole (5.6 feet, ZONE). Manu Jokic misses. Rebound secured by D'Angelo Parker.

[00:15] Team_082 possession (Score: 58-51)
Tony Jokic attempts a Layup. Contested by Nikola Wagner (5.9 feet, MAN). Tony Jokic misses. Rebound secured by Carmelo Anunoby.

[00:02] Team_034 possession (Score: 58-51)
Vince Paul attempts a 3Pt. Contested by Kawhi Poole (6.0 feet, ZONE). Vince Paul misses. FOUL! Loose ball foul on Shaquille Griffin during the rebound battle. [IN THE BONUS! 5 team fouls] Carmelo Anunoby to the line for 2 free throws. (Shaquille Griffin: 2 personal fouls)   FT 1/2: GOOD   FT 2/2: GOOD Carmelo Anunoby makes 2/2 from the line.
Score: 60-51

================================================================================
                              2ND QUARTER COMPLETE                              
================================================================================

2ND QUARTER SCORE: Team_034 30, Team_082 30

BOX SCORE:
================================================================================

Team_034
--------------------------------------------------------------------------------
Player                MIN  PTS  REB  AST  TO      FG   FG%      3P   3P%
--------------------------------------------------------------------------------
Vince Paul              9    8    3    0   0   4/6    66.7     0/0   0.0
Nikola Wagner           9    5    5    0   0   2/3    66.7     0/0   0.0
Devin Poole            15    4    0    2   0   2/2   100.0     0/0   0.0
Damian Turner           9    3    0    2   0   1/1   100.0     0/0   0.0
Ben Hyland             15    2    0    1   0   1/1   100.0     0/0   0.0
Terry Doncic           15    2    0    1   0   1/1   100.0     0/0   0.0
Carmelo Anunoby         9    2    5    2   0   1/3    33.3     0/0   0.0
Manu Jokic              9    2    0    1   0   1/3    33.3     0/0   0.0
Anthony Bane           15    0    0    0   0   0/1     0.0     0/0   0.0
Cole Antetokounmpo     15    0    1    0   0   0/1     0.0     0/0   0.0

TEAM: FG: 13/22 (59.1%), 3PT: 3/5 (60.0%), REB: 15 (4 off, 11 def), AST: 9, TO: 2
TEAM FOULS: 4


Team_082
--------------------------------------------------------------------------------
Player                MIN  PTS  REB  AST  TO      FG   FG%      3P   3P%
--------------------------------------------------------------------------------
Kawhi Poole             9    9    0    0   0   4/6    66.7     0/0   0.0
Julius Anthony         15    6    0    0   0   2/2   100.0     0/0   0.0
Shaquille Griffin       9    6    4    1   0   2/6    33.3     0/0   0.0
Kristaps Fox           15    3    0    0   0   1/1   100.0     0/0   0.0
Jrue Green             15    2    0    1   0   1/1   100.0     0/0   0.0
Dwyane O'Neal          15    2    2    0   0   1/1   100.0     0/0   0.0
Tony Jokic              9    2    0    1   0   1/2    50.0     0/0   0.0
Julius Carter          15    0    1    2   0   0/1     0.0     0/0   0.0
D'Angelo Parker         9    0    3    1   0   0/2     0.0     0/0   0.0
Jordan Rozier           9    0    0    2   0   0/1     0.0     0/0   0.0

TEAM: FG: 12/23 (52.2%), 3PT: 4/9 (44.4%), REB: 9 (1 off, 8 def), AST: 8, TO: 0
TEAM FOULS: 5 [Team_034 in BONUS]

================================================================================

================================================================================
                       3RD QUARTER - Team_034 vs Team_082                       
================================================================================

[12:00] Team_034 possession (Score: 60-51)
Ben Hyland attempts a 3Pt. Contested by Dwyane O'Neal (3.3 feet, ZONE). BEN HYLAND MAKES IT! Assist: Devin Poole
Score: 63-51

[11:46] Team_082 possession (Score: 63-51)
Jrue Green drives, picks up Terry Doncic. Help arrives from Ben Hyland! Jrue Green attempts a Layup. Contested by Ben Hyland (4.4 feet, ZONE). Jrue Green misses. Rebound secured by Terry Doncic.

[11:31] Team_034 possession (Score: 63-51)
Cole Antetokounmpo drives, picks up Kristaps Fox. Help arrives from Dwyane O'Neal! Cole Antetokounmpo attempts a Layup. Contested by Dwyane O'Neal (4.7 feet, MAN). Cole Antetokounmpo misses. Rebound secured by Jrue Green.

[11:16] Team_082 possession (Score: 63-51)
Julius Anthony drives and kicks out. Dwyane O'Neal attempts a 3Pt. Contested by Ben Hyland (3.6 feet, MAN). Dwyane O'Neal misses. Offensive rebound by Jrue Green! Jrue Green kicks it out.

[11:02] Team_082 possession (Score: 63-51)
Julius Carter attempts a Layup. BLOCKED BY ANTHONY BANE! Ball goes out off Anthony Bane. Julius Carter's ball!

[10:52] Team_082 possession (Score: 63-51)
Julius Carter drives and kicks out. Jrue Green attempts a Midrange. Contested by Ben Hyland (3.6 feet, ZONE). JRUE GREEN MAKES IT!
Score: 63-53

[10:37] Team_034 possession (Score: 63-53)
Ben Hyland attempts a Midrange. Contested by Kristaps Fox (4.3 feet, ZONE). BEN HYLAND MAKES IT!
Score: 65-53

[10:24] Team_082 possession (Score: 65-53)
Jrue Green attempts a 3Pt. Contested by Devin Poole (4.2 feet, ZONE). Jrue Green misses. Rebound secured by Anthony Bane.

[10:11] Team_034 possession (Score: 65-53)
Cole Antetokounmpo attempts a 3Pt. Contested by Kristaps Fox (4.7 feet, MAN). COLE ANTETOKOUNMPO MAKES IT!
Score: 68-53

[09:56] Team_082 possession (Score: 68-53)
FOUL! Shooting foul on Ben Hyland. Julius Carter to the line for 2 free throws. [Team fouls: 1] (Ben Hyland: 1 personal fouls)   FT 1/2: GOOD   FT 2/2: MISS Julius Carter makes 1/2 from the line. Rebound secured by Anthony Bane.
Score: 68-54

[09:44] Team_034 possession (Score: 68-54)
Devin Poole attempts a 3Pt. Contested by Dwyane O'Neal (3.2 feet, ZONE). Devin Poole misses. Rebound secured by Jrue Green.

[09:33] Team_082 possession (Score: 68-54)
Dwyane O'Neal attempts a 3Pt. Contested by Ben Hyland (3.6 feet, MAN). DWYANE O'NEAL MAKES IT! Assist: Julius Anthony
Score: 68-57

[09:21] Team_034 possession (Score: 68-57)
Cole Antetokounmpo attempts a 3Pt. Contested by Kristaps Fox (4.7 feet, MAN). Cole Antetokounmpo misses. Rebound secured by Julius Carter.

[09:07] Team_082 possession (Score: 68-57)
Jrue Green attempts a Layup. BLOCKED BY TERRY DONCIC! Ball is loose! Rebound secured by Cole Antetokounmpo.

[08:51] Team_034 possession (Score: 68-57)
Terry Doncic attempts a 3Pt. Contested by Jrue Green (5.1 feet, MAN). Terry Doncic misses. Offensive rebound by Anthony Bane! Anthony Bane kicks it out.

[08:36] Team_034 possession (Score: 68-57)
Ben Hyland attempts a 3Pt. BLOCKED BY KRISTAPS FOX! Ball goes out off Kristaps Fox. Ben Hyland's ball!

[08:25] Team_034 possession (Score: 68-57)
Terry Doncic makes the Layup and draws the foul on Jrue Green! And-1! Terry Doncic to the line for 1. [Team fouls: 1] (Jrue Green: 1 personal fouls)   FT 1/1: GOOD Terry Doncic makes 1/1 from the line.
Score: 71-57

[08:12] Team_082 possession (Score: 71-57)
FOUL! Offensive foul on Julius Anthony! Devin Poole drew the charge! [Team fouls: 2] (Julius Anthony: 1 personal fouls) TURNOVER! (dead ball)

[08:00] Team_034 possession (Score: 71-57)
Anthony Bane attempts a Layup. Contested by Jrue Green (5.1 feet, ZONE). ANTHONY BANE MAKES IT! Assist: Cole Antetokounmpo
Score: 73-57

[07:43] Team_082 possession (Score: 73-57)
Kristaps Fox attempts a 3Pt. Contested by Devin Poole (4.0 feet, ZONE). Kristaps Fox misses. Rebound secured by Anthony Bane.

[07:28] Team_034 possession (Score: 73-57)
FOUL! Shooting foul on Kristaps Fox. Cole Antetokounmpo to the line for 2 free throws. [Team fouls: 3] (Kristaps Fox: 1 personal fouls)   FT 1/2: GOOD   FT 2/2: GOOD Cole Antetokounmpo makes 2/2 from the line.
Score: 75-57

[07:15] Team_082 possession (Score: 75-57)
FOUL! Offensive foul on Kristaps Fox! Cole Antetokounmpo drew the charge! [Team fouls: 4] (Kristaps Fox: 2 personal fouls) TURNOVER! (dead ball)

[07:03] Team_034 possession (Score: 75-57)
FOUL! Holding foul on Dwyane O'Neal. [IN THE BONUS! 5 team fouls] Ben Hyland to the line for 2 free throws. (Dwyane O'Neal: 1 personal fouls)   FT 1/2: GOOD   FT 2/2: GOOD Ben Hyland makes 2/2 from the line.
Score: 77-57

[06:49] Team_082 possession (Score: 77-57)
Julius Anthony drives, picks up Terry Doncic. Help arrives from Ben Hyland! Julius Anthony attempts a Layup. Contested by Ben Hyland (4.4 feet, ZONE). JULIUS ANTHONY MAKES IT! Assist: Julius Carter
Score: 77-59

[06:35] Team_034 possession (Score: 77-59)
Cole Antetokounmpo attempts a 3Pt. Contested by Kristaps Fox (4.7 feet, MAN). Cole Antetokounmpo misses. Rebound secured by Jrue Green.

[06:16] Team_082 possession (Score: 77-59)
Kristaps Fox attempts a 3Pt. Contested by Devin Poole (4.0 feet, ZONE). Kristaps Fox misses. FOUL! Loose ball foul on Anthony Bane during the rebound battle. [Team fouls: 2] No free throws, side out. (Anthony Bane: 1 personal fouls)

[05:59] Team_082 possession (Score: 77-59)
Julius Carter attempts a Layup. Contested by Terry Doncic (4.4 feet, ZONE). JULIUS CARTER MAKES IT!
Score: 77-61

[05:46] Team_034 possession (Score: 77-61)
Anthony Bane drives to the basket... Anthony Bane throws a bad pass out of bounds! TURNOVER! (dead ball)

[05:34] Team_082 possession (Score: 77-61)
Kristaps Fox attempts a 3Pt. Contested by Cole Antetokounmpo (4.6 feet, MAN). Kristaps Fox misses. Rebound secured by Cole Antetokounmpo.

[05:18] Team_034 possession (Score: 77-61)
Devin Poole attempts a Midrange. Contested by Kristaps Fox (4.1 feet, ZONE). DEVIN POOLE MAKES IT!
Score: 79-61

[05:03] Team_082 possession (Score: 79-61)
Julius Carter attempts a Midrange. Contested by Ben Hyland (4.0 feet, ZONE). Julius Carter misses. Rebound secured by Cole Antetokounmpo.

[04:47] Team_034 possession (Score: 79-61)
Cole Antetokounmpo attempts a 3Pt. Contested by Kristaps Fox (4.7 feet, MAN). Cole Antetokounmpo misses. Rebound secured by Dwyane O'Neal.

[04:37] Team_082 possession (Score: 79-61)
Julius Carter attempts a Layup. Contested by Anthony Bane (5.6 feet, MAN). JULIUS CARTER MAKES IT! Assist: Dwyane O'Neal
Score: 79-63

[04:23] Team_034 possession (Score: 79-63)
Ben Hyland attempts a Midrange. Contested by Dwyane O'Neal (3.5 feet, MAN). Ben Hyland misses. Rebound secured by Julius Carter.

[04:07] Team_082 possession (Score: 79-63)
Julius Carter attempts a Midrange. Contested by Anthony Bane (5.6 feet, MAN). Julius Carter misses. Rebound secured by Cole Antetokounmpo.

[03:49] Team_034 possession (Score: 79-63)
Ben Hyland drives to the basket... Ben Hyland loses the ball! Stripped by Dwyane O'Neal! TURNOVER! (live ball)

[03:34] Team_082 possession (Score: 79-63)
Julius Anthony attempts a Midrange. Contested by Devin Poole (4.5 feet, MAN). JULIUS ANTHONY MAKES IT!
Score: 79-65

[03:20] Team_034 possession (Score: 79-65)
Devin Poole attempts a 3Pt. Contested by Dwyane O'Neal (3.4 feet, ZONE). Devin Poole misses. Rebound secured by Dwyane O'Neal.

[03:03] Team_082 possession (Score: 79-65)
Julius Anthony attempts a 3Pt. Contested by Devin Poole (4.5 feet, MAN). Julius Anthony misses. Rebound secured by Cole Antetokounmpo.

[02:50] Team_034 possession (Score: 79-65)
Ben Hyland attempts a Layup. BLOCKED BY KRISTAPS FOX! Ball goes out off Kristaps Fox. Ben Hyland's ball!

[02:35] Team_034 possession (Score: 79-65)
Terry Doncic makes the Dunk and draws the foul on Jrue Green! And-1! Terry Doncic to the line for 1. [BONUS: 6 team fouls] (Jrue Green: 2 personal fouls)   FT 1/1: GOOD Terry Doncic makes 1/1 from the line.
Score: 82-65

[02:20] Team_082 possession (Score: 82-65)
Jrue Green drives, picks up Terry Doncic. Help arrives from Ben Hyland! Jrue Green attempts a Dunk. Contested by Ben Hyland (4.6 feet, ZONE). JRUE GREEN MAKES IT! Assist: Julius Carter
Score: 82-67

[02:08] Team_034 possession (Score: 82-67)
Ben Hyland drives, picks up Jrue Green. Help arrives from Dwyane O'Neal! Ben Hyland attempts a Dunk. Contested by Dwyane O'Neal (5.5 feet, ZONE). BEN HYLAND MAKES IT!
Score: 84-67

[01:53] Team_082 possession (Score: 84-67)
Kristaps Fox attempts a 3Pt. Contested by Devin Poole (4.4 feet, ZONE). KRISTAPS FOX MAKES IT! Assist: Julius Carter
Score: 84-70

[01:40] Team_034 possession (Score: 84-70)
FOUL! Holding foul on Dwyane O'Neal. [IN THE BONUS! 7 team fouls] Ben Hyland to the line for 2 free throws. (Dwyane O'Neal: 2 personal fouls)   FT 1/2: GOOD   FT 2/2: GOOD Ben Hyland makes 2/2 from the line.
Score: 86-70

[01:23] Team_082 possession (Score: 86-70)
FOUL! Shooting foul on Terry Doncic. Jrue Green to the line for 2 free throws. [Team fouls: 3] (Terry Doncic: 1 personal fouls)   FT 1/2: GOOD   FT 2/2: GOOD Jrue Green makes 2/2 from the line.
Score: 86-72

[01:08] Team_034 possession (Score: 86-72)
Devin Poole attempts a Midrange. Contested by Julius Anthony (4.8 feet, MAN). Devin Poole misses. Rebound secured by Dwyane O'Neal.

[00:48] Team_082 possession (Score: 86-72)
FOUL! Holding foul on Ben Hyland. [Team fouls: 4] No free throws, side out. (Ben Hyland: 2 personal fouls)

[00:31] Team_082 possession (Score: 86-72)
Julius Anthony drives to the basket... Julius Anthony commits a violation (traveling/carry)! TURNOVER! (dead ball)

[00:31] Substitution (Team_034): Devin Poole OUT → Manu Jokic IN (stamina_rule2)

[00:31] Substitution (Team_034): Ben Hyland OUT → Damian Turner IN (stamina_rule2)

[00:31] Substitution (Team_034): Cole Antetokounmpo OUT → Vince Paul IN (stamina_rule2)

[00:31] Substitution (Team_034): Terry Doncic OUT → Nikola Wagner IN (stamina_rule2)

[00:31] Substitution (Team_034): Anthony Bane OUT → Carmelo Anunoby IN (stamina_rule2)

[00:31] Substitution (Team_082): Julius Anthony OUT → Jordan Rozier IN (stamina_rule2)

[00:31] Substitution (Team_082): Dwyane O'Neal OUT → Kawhi Poole IN (stamina_rule2)

[00:31] Substitution (Team_082): Kristaps Fox OUT → Shaquille Griffin IN (stamina_rule2)

[00:31] Substitution (Team_082): Jrue Green OUT → Tony Jokic IN (stamina_rule2)

[00:31] Substitution (Team_082): Julius Carter OUT → D'Angelo Parker IN (stamina_rule2)

[00:18] Team_034 possession (Score: 86-72)
Vince Paul attempts a 3Pt. Contested by Tony Jokic (5.5 feet, ZONE). Vince Paul misses. Offensive rebound by Vince Paul! Vince Paul puts it back in!
Score: 88-72

[00:01] Team_082 possession (Score: 88-72)
Jordan Rozier drives, picks up Carmelo Anunoby. Help arrives from Damian Turner! Jordan Rozier attempts a Dunk. Contested by Damian Turner (5.5 feet, ZONE). Jordan Rozier misses. Rebound secured by Vince Paul.

================================================================================
                              3RD QUARTER COMPLETE                              
================================================================================

3RD QUARTER SCORE: Team_034 28, Team_082 21

BOX SCORE:
================================================================================

Team_034
--------------------------------------------------------------------------------
Player                MIN  PTS  REB  AST  TO      FG   FG%      3P   3P%
--------------------------------------------------------------------------------
Ben Hyland             27   11    0    0   0   5/6    83.3     0/0   0.0
Terry Doncic           27    6    1    0   0   2/2   100.0     0/0   0.0
Cole Antetokounmpo     27    5    5    1   0   2/6    33.3     0/0   0.0
Devin Poole            27    2    0    1   0   1/4    25.0     0/0   0.0
Anthony Bane           27    2    4    0   0   1/1   100.0     0/0   0.0
Vince Paul             10    2    2    0   0   1/1   100.0     0/0   0.0

TEAM: FG: 12/20 (60.0%), 3PT: 3/8 (37.5%), REB: 12 (2 off, 10 def), AST: 2, TO: 2
TEAM FOULS: 4


Team_082
--------------------------------------------------------------------------------
Player                MIN  PTS  REB  AST  TO      FG   FG%      3P   3P%
--------------------------------------------------------------------------------
Jrue Green             27    6    5    0   0   3/6    50.0     0/0   0.0
Julius Carter          27    4    2    3   0   2/5    40.0     0/0   0.0
Julius Anthony         27    4    0    1   0   2/3    66.7     0/0   0.0
Dwyane O'Neal          27    3    3    1   0   1/1   100.0     0/0   0.0
Kristaps Fox           27    3    0    0   0   1/3    33.3     0/0   0.0
Jordan Rozier          10    0    0    0   0   0/1     0.0     0/0   0.0

TEAM: FG: 9/19 (47.4%), 3PT: 2/6 (33.3%), REB: 10 (2 off, 8 def), AST: 5, TO: 3
TEAM FOULS: 7 [Team_034 in BONUS]

================================================================================

================================================================================
                       4TH QUARTER - Team_034 vs Team_082                       
================================================================================

[12:00] Team_034 possession (Score: 88-72)
Terry Doncic attempts a Midrange. Contested by Dwyane O'Neal (3.6 feet, ZONE). Terry Doncic misses. Rebound secured by Julius Carter.

[11:45] Team_082 possession (Score: 88-72)
Dwyane O'Neal attempts a 3Pt. Contested by Terry Doncic (4.3 feet, ZONE). DWYANE O'NEAL MAKES IT! Assist: Julius Anthony
Score: 88-75

[11:33] Team_034 possession (Score: 88-75)
Cole Antetokounmpo makes the 3Pt and draws the foul on Kristaps Fox! And-1! Cole Antetokounmpo to the line for 1. [Team fouls: 1] (Kristaps Fox: 1 personal fouls)   FT 1/1: MISS Cole Antetokounmpo makes 0/1 from the line. Rebound secured by Jrue Green.
Score: 91-75

[11:18] Team_082 possession (Score: 91-75)
Julius Anthony attempts a 3Pt. Contested by Devin Poole (4.7 feet, MAN). Julius Anthony misses. Rebound secured by Anthony Bane.

[11:06] Team_034 possession (Score: 91-75)
Devin Poole attempts a 3Pt. Contested by Dwyane O'Neal (3.5 feet, ZONE). DEVIN POOLE MAKES IT!
Score: 94-75

[10:55] Team_082 possession (Score: 94-75)
Julius Carter attempts a 3Pt. Contested by Devin Poole (4.7 feet, ZONE). Julius Carter misses. Rebound secured by Cole Antetokounmpo.

[10:37] Team_034 possession (Score: 94-75)
Anthony Bane drives, Julius Carter stays with him. Anthony Bane attempts a Layup. Wide open! Julius Carter is 6.1 feet away. [MAN] ANTHONY BANE MAKES IT!
Score: 96-75

[10:26] Team_082 possession (Score: 96-75)
Dwyane O'Neal attempts a Layup. Contested by Ben Hyland (4.0 feet, MAN). Dwyane O'Neal misses. Rebound secured by Anthony Bane.

[10:12] Team_034 possession (Score: 96-75)
Anthony Bane attempts a Midrange. Wide open! Julius Carter is 6.2 feet away. [MAN] Anthony Bane misses. FOUL! Loose ball foul on Dwyane O'Neal during the rebound battle. [Team fouls: 2] No free throws, side out. (Dwyane O'Neal: 1 personal fouls)

[09:57] Team_034 possession (Score: 96-75)
Cole Antetokounmpo attempts a Midrange. Contested by Kristaps Fox (5.1 feet, ZONE). COLE ANTETOKOUNMPO MAKES IT!
Score: 98-75

[09:41] Team_082 possession (Score: 98-75)
Julius Carter attempts a Midrange. Contested by Devin Poole (4.9 feet, ZONE). Julius Carter misses. Rebound secured by Terry Doncic.

[09:30] Team_034 possession (Score: 98-75)
Devin Poole drives, Jrue Green stays with him. Devin Poole attempts a Layup. Contested by Jrue Green (5.5 feet, ZONE). DEVIN POOLE MAKES IT! Assist: Ben Hyland
Score: 100-75

[09:18] Team_082 possession (Score: 100-75)
Dwyane O'Neal attempts a 3Pt. Contested by Devin Poole (4.6 feet, ZONE). DWYANE O'NEAL MAKES IT! Assist: Kristaps Fox
Score: 100-78

[09:05] Team_034 possession (Score: 100-78)
Cole Antetokounmpo drives to the basket... FOUL! Offensive foul on Cole Antetokounmpo! Kristaps Fox drew the charge! [Team fouls: 1] (Cole Antetokounmpo: 1 personal fouls) TURNOVER! (dead ball)

[08:52] Team_082 possession (Score: 100-78)
Dwyane O'Neal attempts a Midrange. Contested by Ben Hyland (4.2 feet, MAN). Dwyane O'Neal misses. Rebound secured by Cole Antetokounmpo.

[08:36] Team_034 possession (Score: 100-78)
Terry Doncic drives and kicks out. Devin Poole attempts a Midrange. Wide open! Julius Carter is 6.3 feet away. [ZONE] DEVIN POOLE MAKES IT!
Score: 102-78

[08:20] Team_082 possession (Score: 102-78)
FOUL! Holding foul on Ben Hyland. [Team fouls: 2] No free throws, side out. (Ben Hyland: 1 personal fouls)

[08:05] Team_082 possession (Score: 102-78)
Julius Anthony attempts a 3Pt. Contested by Devin Poole (5.1 feet, ZONE). JULIUS ANTHONY MAKES IT! Assist: Dwyane O'Neal
Score: 102-81

[07:51] Team_034 possession (Score: 102-81)
Anthony Bane attempts a Midrange. Contested by Kristaps Fox (5.1 feet, ZONE). Anthony Bane misses. Offensive rebound by Anthony Bane! Anthony Bane kicks it out.

[07:37] Team_034 possession (Score: 102-81)
Ben Hyland attempts a 3Pt. Contested by Dwyane O'Neal (4.2 feet, MAN). Ben Hyland misses. Rebound secured by Julius Carter.

[07:19] Team_082 possession (Score: 102-81)
Jrue Green drives and kicks out. Kristaps Fox attempts a 3Pt. Contested by Cole Antetokounmpo (5.4 feet, MAN). Kristaps Fox misses. FOUL! Loose ball foul on Anthony Bane during the rebound battle. [Team fouls: 3] No free throws, side out. (Anthony Bane: 1 personal fouls)

[07:05] Team_082 possession (Score: 102-81)
Julius Carter attempts a 3Pt. Wide open! Anthony Bane is 6.2 feet away. [MAN] Julius Carter misses. Rebound secured by Cole Antetokounmpo.

[06:47] Team_034 possession (Score: 102-81)
Ben Hyland attempts a Midrange. Contested by Dwyane O'Neal (4.3 feet, MAN). BEN HYLAND MAKES IT!
Score: 104-81

[06:36] Team_082 possession (Score: 104-81)
Dwyane O'Neal attempts a Layup. Contested by Terry Doncic (5.0 feet, ZONE). DWYANE O'NEAL MAKES IT! Assist: Jrue Green
Score: 104-83

[06:21] Team_034 possession (Score: 104-83)
Devin Poole drives and kicks out. Devin Poole attempts a 3Pt. Contested by Julius Anthony (5.5 feet, MAN). Devin Poole misses. Rebound secured by Dwyane O'Neal.

[06:03] Team_082 possession (Score: 104-83)
Jrue Green attempts a Layup. Wide open! Anthony Bane is 6.2 feet away. [ZONE] Jrue Green misses. Rebound secured by Terry Doncic.

[05:51] Team_034 possession (Score: 104-83)
Ben Hyland attempts a 3Pt. Contested by Dwyane O'Neal (4.4 feet, ZONE). Ben Hyland misses. Rebound secured by Dwyane O'Neal.

[05:37] Team_082 possession (Score: 104-83)
Julius Anthony attempts a 3Pt. Contested by Terry Doncic (5.4 feet, ZONE). Julius Anthony misses. Rebound secured by Cole Antetokounmpo.

[05:22] Team_034 possession (Score: 104-83)
Anthony Bane drives to the basket... Anthony Bane throws a bad pass out of bounds! TURNOVER! (dead ball)

[05:22] Substitution (Team_034): Devin Poole OUT → Manu Jokic IN (stamina_rule2)

[05:22] Substitution (Team_034): Ben Hyland OUT → Damian Turner IN (stamina_rule2)

[05:22] Substitution (Team_034): Cole Antetokounmpo OUT → Vince Paul IN (stamina_rule2)

[05:22] Substitution (Team_034): Terry Doncic OUT → Nikola Wagner IN (stamina_rule2)

[05:22] Substitution (Team_034): Anthony Bane OUT → Carmelo Anunoby IN (stamina_rule2)

[05:22] Substitution (Team_082): Julius Anthony OUT → Jordan Rozier IN (stamina_rule2)

[05:22] Substitution (Team_082): Dwyane O'Neal OUT → Kawhi Poole IN (stamina_rule2)

[05:22] Substitution (Team_082): Kristaps Fox OUT → Shaquille Griffin IN (stamina_rule2)

[05:22] Substitution (Team_082): Jrue Green OUT → Tony Jokic IN (stamina_rule2)

[05:22] Substitution (Team_082): Julius Carter OUT → D'Angelo Parker IN (stamina_rule2)

[05:04] Team_082 possession (Score: 104-83)
D'Angelo Parker makes the Dunk and draws the foul on Carmelo Anunoby! And-1! D'Angelo Parker to the line for 1. [Team fouls: 4] (Carmelo Anunoby: 1 personal fouls)   FT 1/1: GOOD D'Angelo Parker makes 1/1 from the line.
Score: 104-86

[04:49] Team_034 possession (Score: 104-86)
FOUL! Holding foul on Kawhi Poole. [Team fouls: 3] No free throws, side out. (Kawhi Poole: 1 personal fouls)

[04:33] Team_034 possession (Score: 104-86)
Manu Jokic attempts a 3Pt. Contested by Kawhi Poole (5.5 feet, ZONE). Manu Jokic misses. Rebound secured by Shaquille Griffin.

[04:18] Team_082 possession (Score: 104-86)
FOUL! Holding foul on Manu Jokic. [IN THE BONUS! 5 team fouls] Jordan Rozier to the line for 2 free throws. (Manu Jokic: 1 personal fouls)   FT 1/2: GOOD   FT 2/2: MISS Jordan Rozier makes 1/2 from the line. Rebound secured by Vince Paul.
Score: 104-87

[04:00] Team_034 possession (Score: 104-87)
Carmelo Anunoby attempts a Midrange. Contested by Kawhi Poole (5.6 feet, ZONE). Carmelo Anunoby misses. Rebound secured by Tony Jokic.

[03:46] Team_082 possession (Score: 104-87)
Shaquille Griffin attempts a 3Pt. Contested by Vince Paul (4.2 feet, MAN). Shaquille Griffin misses. Rebound secured by Vince Paul.

[03:33] Team_034 possession (Score: 104-87)
Vince Paul attempts a 3Pt. Contested by Kawhi Poole (5.8 feet, ZONE). Vince Paul misses. Rebound secured by D'Angelo Parker.

[03:18] Team_082 possession (Score: 104-87)
Kawhi Poole attempts a 3Pt. Contested by Damian Turner (6.0 feet, MAN). Kawhi Poole misses. Rebound secured by Carmelo Anunoby.

[03:03] Team_034 possession (Score: 104-87)
Damian Turner drives and kicks out. Carmelo Anunoby attempts a 3Pt. Contested by D'Angelo Parker (5.0 feet, MAN). Carmelo Anunoby misses. Rebound secured by Tony Jokic.

[02:51] Team_082 possession (Score: 104-87)
Jordan Rozier loses control! Ball rolls out of bounds! TURNOVER! (dead ball)

[02:41] Team_034 possession (Score: 104-87)
Carmelo Anunoby drives and kicks out. FOUL! Shooting foul on Tony Jokic. Nikola Wagner to the line for 2 free throws. [Team fouls: 4] (Tony Jokic: 1 personal fouls)   FT 1/2: GOOD   FT 2/2: GOOD Nikola Wagner makes 2/2 from the line.
Score: 106-87

[02:24] Team_082 possession (Score: 106-87)
D'Angelo Parker attempts a 3Pt. Contested by Vince Paul (4.6 feet, ZONE). D'ANGELO PARKER MAKES IT!
Score: 106-90

[02:08] Team_034 possession (Score: 106-90)
Carmelo Anunoby attempts a Layup. Contested by D'Angelo Parker (5.1 feet, ZONE). CARMELO ANUNOBY MAKES IT! Assist: Manu Jokic
Score: 108-90

[01:52] Team_082 possession (Score: 108-90)
Jordan Rozier attempts a 3Pt. Contested by Manu Jokic (4.8 feet, MAN). JORDAN ROZIER MAKES IT! Assist: Tony Jokic
Score: 108-93

[01:33] Team_034 possession (Score: 108-93)
Carmelo Anunoby attempts a Layup. Contested by D'Angelo Parker (5.1 feet, MAN). CARMELO ANUNOBY MAKES IT! Assist: Nikola Wagner
Score: 110-93

[01:15] Team_082 possession (Score: 110-93)
Kawhi Poole drives, picks up Carmelo Anunoby. Help arrives from Damian Turner! Kawhi Poole attempts a Layup. Contested by Damian Turner (6.0 feet, ZONE). Kawhi Poole misses. Rebound secured by Carmelo Anunoby.

[01:00] Team_034 possession (Score: 110-93)
Vince Paul attempts a 3Pt. Contested by Kawhi Poole (5.8 feet, ZONE). Vince Paul misses. Rebound secured by Tony Jokic.

[00:47] Team_082 possession (Score: 110-93)
FOUL! Reach-in foul on Damian Turner during the drive. [IN THE BONUS! 6 team fouls] Kawhi Poole to the line for 2 free throws. (Damian Turner: 1 personal fouls)   FT 1/2: GOOD   FT 2/2: GOOD Kawhi Poole makes 2/2 from the line.
Score: 110-95

[00:34] Team_034 possession (Score: 110-95)
FOUL! Shooting foul on D'Angelo Parker. Vince Paul to the line for 2 free throws. [BONUS: 5 team fouls] (D'Angelo Parker: 1 personal fouls)   FT 1/2: MISS   FT 2/2: GOOD Vince Paul makes 1/2 from the line.
Score: 111-95

[00:24] Team_082 possession (Score: 111-95)
Jordan Rozier throws a bad pass out of bounds! TURNOVER! (dead ball)

[00:11] Team_034 possession (Score: 111-95)
Carmelo Anunoby attempts a Layup. Contested by D'Angelo Parker (5.1 feet, MAN). CARMELO ANUNOBY MAKES IT! Assist: Manu Jokic
Score: 113-95

================================================================================
                              4TH QUARTER COMPLETE                              
================================================================================

4TH QUARTER SCORE: Team_034 25, Team_082 23

BOX SCORE:
================================================================================

Team_034
--------------------------------------------------------------------------------
Player                MIN  PTS  REB  AST  TO      FG   FG%      3P   3P%
--------------------------------------------------------------------------------
Devin Poole            34    7    0    0   0   3/4    75.0     0/0   0.0
Carmelo Anunoby        15    6    2    0   0   3/4    75.0     0/0   0.0
Cole Antetokounmpo     34    2    4    0   0   1/2    50.0     0/0   0.0
Anthony Bane           34    2    4    0   0   1/1   100.0     0/0   0.0
Ben Hyland             34    2    0    1   0   1/3    33.3     0/0   0.0
Nikola Wagner          15    2    0    1   0   1/1   100.0     0/0   0.0
Vince Paul             15    1    2    0   0   1/3    33.3     0/0   0.0
Terry Doncic           34    0    2    0   0   0/1     0.0     0/0   0.0
Manu Jokic             15    0    0    2   0   0/1     0.0     0/0   0.0
Damian Turner          15    0    0    0   0   0/1     0.0     0/0   0.0

TEAM: FG: 11/21 (52.4%), 3PT: 1/7 (14.3%), REB: 14 (2 off, 12 def), AST: 4, TO: 2
TEAM FOULS: 6 [Team_082 in BONUS]


Team_082
--------------------------------------------------------------------------------
Player                MIN  PTS  REB  AST  TO      FG   FG%      3P   3P%
--------------------------------------------------------------------------------
Dwyane O'Neal          34    8    2    1   0   3/5    60.0     0/0   0.0
D'Angelo Parker        15    6    1    0   0   2/2   100.0     0/0   0.0
Julius Anthony         34    3    0    1   0   1/3    33.3     0/0   0.0
Jordan Rozier          15    3    0    0   0   1/1   100.0     0/0   0.0
Kawhi Poole            15    2    0    0   0   1/3    33.3     0/0   0.0
Julius Carter          34    0    2    0   0   0/3     0.0     0/0   0.0
Jrue Green             34    0    2    1   0   0/1     0.0     0/0   0.0
Kristaps Fox           34    0    0    1   0   0/0     0.0     0/0   0.0
Shaquille Griffin      15    0    1    0   0   0/1     0.0     0/0   0.0
Tony Jokic             15    0    3    1   0   0/0     0.0     0/0   0.0

TEAM: FG: 8/20 (40.0%), 3PT: 5/11 (45.5%), REB: 11 (1 off, 10 def), AST: 5, TO: 2
TEAM FOULS: 5 [Team_034 in BONUS]

================================================================================

================================================================================
                               FULL GAME COMPLETE                               
================================================================================

FINAL SCORE: Team_034 113, Team_082 95

SCORING BY QUARTER:
--------------------------------------------------------------------------------
Team                     Q1     Q2     Q3     Q4    FINAL
--------------------------------------------------------------------------------
Team_034                 30     30     28     25      113
Team_082                 21     30     21     23       95
--------------------------------------------------------------------------------

FULL GAME BOX SCORE:
================================================================================

Team_034
--------------------------------------------------------------------------------
Player                MIN  PTS  REB  AST  TO      FG   FG%      3P   3P%      FT STL BLK
--------------------------------------------------------------------------------
Devin Poole            34   16    0    4   1   6/11   54.5   2/4    50.0   0/0     0   0
Ben Hyland             34   15    0    3   2   5/9    55.6   1/4    25.0   4/4     0   0
Cole Antetokounmpo     34   15   11    2   2   8/15   53.3   3/8    37.5   4/6     0   0
Terry Doncic           34   22    8    2   1   8/11   72.7   0/0     0.0   3/3     0   2
Anthony Bane           34    9   12    0   3   4/5    80.0   1/2    50.0   0/0     0   1
Manu Jokic             15    2    0    3   0   2/5    40.0   1/2    50.0   0/0     0   0
Damian Turner          15    3    0    2   0   1/2    50.0   0/0     0.0   1/1     0   0
Vince Paul             15   11    7    0   1   5/9    55.6   3/6    50.0   1/2     0   0
Nikola Wagner          15    7    5    1   0   3/4    75.0   0/0     0.0   2/2     0   0
Carmelo Anunoby        15    8    7    2   0   4/7    57.1   0/0     0.0   2/3     0   0

TEAM: FG: 48/80 (60.0%), 3PT: 11/26 (42.3%), REB: 50 (9 off, 41 def), AST: 19, TO: 10


Team_082
--------------------------------------------------------------------------------
Player                MIN  PTS  REB  AST  TO      FG   FG%      3P   3P%      FT STL BLK
--------------------------------------------------------------------------------
Julius Anthony         34   18    0    4   3   7/12   58.3   4/8    50.0   0/0     1   0
Dwyane O'Neal          34   15    9    3   1   6/10   60.0   3/4    75.0   2/2     1   0
Kristaps Fox           34   11    0    2   2   4/8    50.0   3/6    50.0   0/0     0   2
Jrue Green             34   13   10    2   0   5/10   50.0   0/2     0.0   3/3     1   0
Julius Carter          34    8   10    5   0   5/13   38.5   0/2     0.0   1/2     1   0
Jordan Rozier          15    3    0    2   2   1/3    33.3   1/2    50.0   1/2     0   0
Kawhi Poole            15   11    0    0   0   5/9    55.6   1/4    25.0   2/2     0   0
Shaquille Griffin      15    6    5    1   0   1/6    16.7   0/3     0.0   1/1     0   0
Tony Jokic             15    2    3    2   0   1/2    50.0   0/0     0.0   0/0     0   0
D'Angelo Parker        15    6    4    1   0   3/5    60.0   1/1   100.0   1/1     0   0

TEAM: FG: 38/79 (48.1%), 3PT: 13/32 (40.6%), REB: 40 (9 off, 31 def), AST: 22, TO: 8

================================================================================
