================================================================================
                        FULL GAME - Team_027 vs Team_095                        
================================================================================

================================================================================
                       1ST QUARTER - Team_027 vs Team_095                       
================================================================================

[12:00] Team_027 possession (Score: 0-0)
Tim Johnson attempts a 3Pt. Contested by Evan Carter (4.1 feet, ZONE). Tim Johnson misses. Rebound secured by Evan Carter.

[11:47] Team_095 possession (Score: 0-0)
Immanuel Middleton throws a bad pass! Stolen by Bradley Dosunmu! TURNOVER! (live ball)

[11:33] Team_027 possession (Score: 0-0)
FOUL! Reach-in foul on Immanuel Middleton during the drive. [Team fouls: 1] No free throws, side out. (Immanuel Middleton: 1 personal fouls)

[11:17] Team_027 possession (Score: 0-0)
Tony Doncic drives and kicks out. John Russell attempts a Midrange. Contested by Immanuel Middleton (4.8 feet, ZONE). John Russell misses. Offensive rebound by Bradley Dosunmu! Bradley Dosunmu kicks it out.

[11:02] Team_027 possession (Score: 0-0)
Scottie Harden attempts a Layup. Contested by Evan Carter (3.9 feet, MAN). SCOTTIE HARDEN MAKES IT!
Score: 2-0

[10:48] Team_095 possession (Score: 2-0)
Kyrie Ming drives, John Russell stays with him. Kyrie Ming attempts a Dunk. Contested by John Russell (4.1 feet, MAN). KYRIE MING MAKES IT! Assist: Evan Carter
Score: 2-2

[10:33] Team_027 possession (Score: 2-2)
Tim Johnson throws a bad pass out of bounds! TURNOVER! (dead ball)

[10:19] Team_095 possession (Score: 2-2)
Immanuel Middleton drives and kicks out. Evan Carter attempts a Midrange. Contested by Tim Johnson (4.9 feet, ZONE). EVAN CARTER MAKES IT! Assist: Shaquille Ball
Score: 2-4

[10:05] Team_027 possession (Score: 2-4)
Tony Doncic attempts a Midrange. Contested by Shaquille Ball (4.5 feet, ZONE). TONY DONCIC MAKES IT! Assist: Scottie Harden
Score: 4-4

[09:47] Team_095 possession (Score: 4-4)
Evan Carter drives, John Russell stays with him. Evan Carter attempts a Dunk. Contested by John Russell (4.1 feet, ZONE). EVAN CARTER MAKES IT! Assist: Kyrie Ming
Score: 4-6

[09:31] Team_027 possession (Score: 4-6)
Tony Doncic attempts a 3Pt. Contested by Evan Carter (4.0 feet, ZONE). Tony Doncic misses. Offensive rebound by Bradley Dosunmu! Bradley Dosunmu kicks it out.

[09:16] Team_027 possession (Score: 4-6)
Scottie Harden attempts a Midrange. Contested by Evan Carter (3.9 feet, MAN). SCOTTIE HARDEN MAKES IT! Assist: John Russell
Score: 6-6

[09:02] Team_095 possession (Score: 6-6)
FOUL! Reach-in foul on John Russell during the drive. [Team fouls: 1] No free throws, side out. (John Russell: 1 personal fouls)

[08:47] Team_095 possession (Score: 6-6)
FOUL! Holding foul on Scottie Harden. [Team fouls: 2] No free throws, side out. (Scottie Harden: 1 personal fouls)

[08:30] Team_095 possession (Score: 6-6)
Immanuel Middleton attempts a 3Pt. Contested by Tim Johnson (4.9 feet, ZONE). Immanuel Middleton misses. Offensive rebound by Evan Carter! Evan Carter's putback is no good. Rebound secured by Bradley Dosunmu.

[08:11] Team_027 possession (Score: 6-6)
FOUL! Reach-in foul on Immanuel Middleton during the drive. [Team fouls: 2] No free throws, side out. (Immanuel Middleton: 2 personal fouls)

[07:59] Team_027 possession (Score: 6-6)
FOUL! Shooting foul on Immanuel Middleton. Bradley Dosunmu to the line for 2 free throws. [Team fouls: 3] (Immanuel Middleton: 3 personal fouls)   FT 1/2: GOOD   FT 2/2: GOOD Bradley Dosunmu makes 2/2 from the line.
Score: 8-6

[07:43] Team_095 possession (Score: 8-6)
Kyrie Ming attempts a Layup. Contested by John Russell (4.1 feet, ZONE). Kyrie Ming misses. Offensive rebound by Evan Carter! Evan Carter puts it back in!
Score: 8-8

[07:31] Team_027 possession (Score: 8-8)
Tim Johnson attempts a 3Pt. BLOCKED BY DEJOUNTE HYLAND! Ball is loose! Rebound secured by Evan Carter.

[07:21] Team_095 possession (Score: 8-8)
Shaquille Ball drives, picks up John Russell. Help arrives from Tony Doncic! Shaquille Ball attempts a Layup. Contested by Tony Doncic (3.9 feet, ZONE). Shaquille Ball misses. Rebound secured by Bradley Dosunmu.

[07:07] Team_027 possession (Score: 8-8)
Scottie Harden attempts a Midrange. Contested by Shaquille Ball (4.4 feet, ZONE). Scottie Harden misses. Rebound secured by Evan Carter.

[06:49] Team_095 possession (Score: 8-8)
FOUL! Holding foul on Tim Johnson. [Team fouls: 3] No free throws, side out. (Tim Johnson: 1 personal fouls)

[06:30] Team_095 possession (Score: 8-8)
Immanuel Middleton attempts a 3Pt. Contested by Bradley Dosunmu (4.4 feet, MAN). Immanuel Middleton misses. Rebound secured by Bradley Dosunmu.

[06:20] Team_027 possession (Score: 8-8)
Tony Doncic attempts a 3Pt. Contested by Evan Carter (4.0 feet, ZONE). Tony Doncic misses. Rebound secured by Evan Carter.

[06:07] Team_095 possession (Score: 8-8)
Kyrie Ming drives, John Russell stays with him. Kyrie Ming attempts a Layup. Contested by John Russell (4.1 feet, MAN). Kyrie Ming misses. Rebound secured by Tony Doncic.

[05:55] Team_027 possession (Score: 8-8)
John Russell attempts a Midrange. Contested by Shaquille Ball (5.1 feet, ZONE). John Russell misses. Rebound secured by Shaquille Ball.

[05:43] Team_095 possession (Score: 8-8)
Evan Carter drives to the basket... Evan Carter loses the ball! Stripped by John Russell! TURNOVER! (live ball)

[05:29] Team_027 possession (Score: 8-8)
Tim Johnson attempts a 3Pt. Contested by Dejounte Hyland (5.2 feet, MAN). Tim Johnson misses. Rebound secured by Dejounte Hyland.

[05:14] Team_095 possession (Score: 8-8)
Evan Carter attempts a Midrange. Contested by Scottie Harden (4.8 feet, MAN). EVAN CARTER MAKES IT!
Score: 8-10

[04:59] Team_027 possession (Score: 8-10)
Bradley Dosunmu drives, picks up Immanuel Middleton. Help arrives from Dejounte Hyland! Bradley Dosunmu attempts a Dunk. Contested by Dejounte Hyland (5.0 feet, MAN). BRADLEY DOSUNMU MAKES IT!
Score: 10-10

[04:46] Team_095 possession (Score: 10-10)
Kyrie Ming drives, John Russell stays with him. Kyrie Ming attempts a Layup. Contested by John Russell (4.2 feet, ZONE). Kyrie Ming misses. Rebound secured by John Russell.

[04:30] Team_027 possession (Score: 10-10)
FOUL! Shooting foul on Shaquille Ball. John Russell to the line for 2 free throws. [Team fouls: 4] (Shaquille Ball: 1 personal fouls)   FT 1/2: GOOD   FT 2/2: GOOD John Russell makes 2/2 from the line.
Score: 12-10

[04:16] Team_095 possession (Score: 12-10)
Shaquille Ball attempts a Midrange. Contested by Scottie Harden (4.6 feet, ZONE). SHAQUILLE BALL MAKES IT!
Score: 12-12

[04:03] Team_027 possession (Score: 12-12)
FOUL! Holding foul on Immanuel Middleton. [IN THE BONUS! 5 team fouls] Bradley Dosunmu to the line for 2 free throws. (Immanuel Middleton: 4 personal fouls)   FT 1/2: MISS   FT 2/2: MISS Bradley Dosunmu makes 0/2 from the line. Rebound secured by Evan Carter.

[03:51] Team_095 possession (Score: 12-12)
Dejounte Hyland drives and kicks out. Evan Carter attempts a 3Pt. Contested by Tim Johnson (5.0 feet, ZONE). Evan Carter misses. Rebound secured by John Russell.

[03:37] Team_027 possession (Score: 12-12)
Bradley Dosunmu drives and kicks out. Bradley Dosunmu attempts a 3Pt. Contested by Immanuel Middleton (5.1 feet, MAN). BRADLEY DOSUNMU MAKES IT!
Score: 15-12

[03:28] Team_095 possession (Score: 15-12)
Immanuel Middleton attempts a 3Pt. Contested by Scottie Harden (4.7 feet, ZONE). IMMANUEL MIDDLETON MAKES IT! Assist: Dejounte Hyland
Score: 15-15

[03:16] Team_027 possession (Score: 15-15)
Tony Doncic attempts a 3Pt. Contested by Shaquille Ball (4.6 feet, MAN). Tony Doncic misses. Rebound secured by Dejounte Hyland.

[03:06] Team_095 possession (Score: 15-15)
Immanuel Middleton makes the Dunk and draws the foul on John Russell! And-1! Immanuel Middleton to the line for 1. [Team fouls: 4] (John Russell: 2 personal fouls)   FT 1/1: GOOD Immanuel Middleton makes 1/1 from the line.
Score: 15-18

[02:53] Team_027 possession (Score: 15-18)
Tim Johnson attempts a 3Pt. Contested by Dejounte Hyland (5.4 feet, MAN). Tim Johnson misses. Rebound secured by Dejounte Hyland.

[02:39] Team_095 possession (Score: 15-18)
Immanuel Middleton attempts a Midrange. Contested by Bradley Dosunmu (4.6 feet, MAN). Immanuel Middleton misses. Rebound secured by Tony Doncic.

[02:27] Team_027 possession (Score: 15-18)
Tony Doncic attempts a Midrange. Contested by Shaquille Ball (4.7 feet, MAN). Tony Doncic misses. Rebound secured by Dejounte Hyland.

[02:11] Team_095 possession (Score: 15-18)
Evan Carter drives, Scottie Harden stays with him. Evan Carter attempts a Layup. Contested by Scottie Harden (5.1 feet, MAN). EVAN CARTER MAKES IT! Assist: Kyrie Ming
Score: 15-20

[01:54] Team_027 possession (Score: 15-20)
John Russell makes the Layup and draws the foul on Kyrie Ming! And-1! John Russell to the line for 1. [BONUS: 6 team fouls] (Kyrie Ming: 1 personal fouls)   FT 1/1: GOOD John Russell makes 1/1 from the line.
Score: 18-20

[01:35] Team_095 possession (Score: 18-20)
Kyrie Ming attempts a Midrange. Contested by John Russell (4.5 feet, MAN). Kyrie Ming misses. Rebound secured by Tony Doncic.

[01:20] Team_027 possession (Score: 18-20)
Tim Johnson attempts a 3Pt. Contested by Dejounte Hyland (5.5 feet, MAN). TIM JOHNSON MAKES IT! Assist: John Russell
Score: 21-20

[01:05] Team_095 possession (Score: 21-20)
Evan Carter attempts a 3Pt. Contested by Scottie Harden (5.2 feet, MAN). Evan Carter misses. Rebound secured by Tony Doncic.

[00:47] Team_027 possession (Score: 21-20)
Scottie Harden attempts a 3Pt. Contested by Evan Carter (4.3 feet, ZONE). Scottie Harden misses. Rebound secured by Evan Carter.

[00:31] Team_095 possession (Score: 21-20)
Kyrie Ming attempts a 3Pt. Contested by Tim Johnson (5.5 feet, ZONE). Kyrie Ming misses. Rebound secured by Bradley Dosunmu.

[00:13] Team_027 possession (Score: 21-20)
John Russell attempts a Midrange. Contested by Evan Carter (5.0 feet, ZONE). John Russell misses. Rebound secured by Dejounte Hyland.

================================================================================
                              1ST QUARTER COMPLETE                              
================================================================================

1ST QUARTER SCORE: Team_027 21, Team_095 20

BOX SCORE:
================================================================================

Team_027
--------------------------------------------------------------------------------
Player                MIN  PTS  REB  AST  TO      FG   FG%      3P   3P%
--------------------------------------------------------------------------------
Bradley Dosunmu        12    7    6    0   0   3/3   100.0     0/0   0.0
John Russell           12    5    2    2   0   2/4    50.0     0/0   0.0
Scottie Harden         12    4    0    1   0   2/4    50.0     0/0   0.0
Tim Johnson            12    3    0    0   0   1/5    20.0     0/0   0.0
Tony Doncic            12    2    4    0   0   1/4    25.0     0/0   0.0

TEAM: FG: 9/21 (42.9%), 3PT: 1/8 (12.5%), REB: 11 (2 off, 9 def), AST: 3, TO: 1
TEAM FOULS: 4


Team_095
--------------------------------------------------------------------------------
Player                MIN  PTS  REB  AST  TO      FG   FG%      3P   3P%
--------------------------------------------------------------------------------
Evan Carter            12   10    7    1   0   5/6    83.3     0/0   0.0
Immanuel Middleton     12    6    0    0   0   2/5    40.0     0/0   0.0
Kyrie Ming             12    2    0    2   0   1/5    20.0     0/0   0.0
Shaquille Ball         12    2    1    1   0   1/2    50.0     0/0   0.0
Dejounte Hyland        12    0    5    1   0   0/1     0.0     0/0   0.0

TEAM: FG: 9/19 (47.4%), 3PT: 1/5 (20.0%), REB: 14 (2 off, 12 def), AST: 5, TO: 2
TEAM FOULS: 6 [Team_027 in BONUS]

================================================================================

================================================================================
                       2ND QUARTER - Team_027 vs Team_095                       
================================================================================

[12:00] Team_027 possession (Score: 21-20)
John Russell attempts a Midrange. Contested by Shaquille Ball (5.3 feet, ZONE). John Russell misses. Rebound secured by Evan Carter.

[11:45] Team_095 possession (Score: 21-20)
FOUL! Offensive foul on Immanuel Middleton! Bradley Dosunmu drew the charge! [Team fouls: 1] (Immanuel Middleton: 1 personal fouls) TURNOVER! (dead ball)

[11:34] Team_027 possession (Score: 21-20)
Tim Johnson throws a bad pass out of bounds! TURNOVER! (dead ball)

[11:34] Substitution (Team_027): Tim Johnson OUT → CJ Green IN (stamina_rule2)

[11:34] Substitution (Team_027): Tony Doncic OUT → Dirk Lillard IN (stamina_rule2)

[11:34] Substitution (Team_027): Scottie Harden OUT → Rudy Quickley IN (stamina_rule2)

[11:34] Substitution (Team_027): Bradley Dosunmu OUT → LeBron Russell IN (stamina_rule2)

[11:34] Substitution (Team_027): John Russell OUT → Ben Stewart IN (stamina_rule2)

[11:34] Substitution (Team_095): Dejounte Hyland OUT → Kyle Poole IN (stamina_rule2)

[11:34] Substitution (Team_095): Shaquille Ball OUT → Cade Beal IN (stamina_rule2)

[11:34] Substitution (Team_095): Evan Carter OUT → Tobias Wagner IN (stamina_rule2)

[11:34] Substitution (Team_095): Immanuel Middleton OUT → Gary Davis IN (stamina_rule2)

[11:34] Substitution (Team_095): Kyrie Ming OUT → DeMar McCollum IN (stamina_rule2)

[11:14] Team_095 possession (Score: 21-20)
Kyle Poole drives and kicks out. Cade Beal makes the Midrange and draws the foul on Dirk Lillard! And-1! Cade Beal to the line for 1. [Team fouls: 1] (Dirk Lillard: 1 personal fouls)   FT 1/1: GOOD Cade Beal makes 1/1 from the line.
Score: 21-23

[10:59] Team_027 possession (Score: 21-23)
LeBron Russell drives to the basket... LeBron Russell throws a bad pass out of bounds! TURNOVER! (dead ball)

[10:47] Team_095 possession (Score: 21-23)
Gary Davis drives, Ben Stewart stays with him. Gary Davis attempts a Layup. Contested by Ben Stewart (4.5 feet, ZONE). Gary Davis misses. Rebound secured by LeBron Russell.

[10:33] Team_027 possession (Score: 21-23)
Dirk Lillard attempts a 3Pt. Contested by Cade Beal (4.4 feet, ZONE). DIRK LILLARD MAKES IT! Assist: CJ Green
Score: 24-23

[10:18] Team_095 possession (Score: 24-23)
DeMar McCollum makes the Layup and draws the foul on Ben Stewart! And-1! DeMar McCollum to the line for 1. [Team fouls: 2] (Ben Stewart: 1 personal fouls)   FT 1/1: GOOD DeMar McCollum makes 1/1 from the line.
Score: 24-26

[10:01] Team_027 possession (Score: 24-26)
CJ Green attempts a 3Pt. Contested by Kyle Poole (4.9 feet, MAN). CJ Green misses. Rebound secured by DeMar McCollum.

[09:46] Team_095 possession (Score: 24-26)
Cade Beal drives, picks up Ben Stewart. Help arrives from Dirk Lillard! Cade Beal attempts a Dunk. Contested by Dirk Lillard (4.6 feet, ZONE). Cade Beal misses. Rebound secured by Dirk Lillard.

[09:33] Team_027 possession (Score: 24-26)
FOUL! Reach-in foul on DeMar McCollum during the drive. [Team fouls: 2] No free throws, side out. (DeMar McCollum: 1 personal fouls)

[09:14] Team_027 possession (Score: 24-26)
Rudy Quickley attempts a 3Pt. Contested by Tobias Wagner (4.2 feet, MAN). Rudy Quickley misses. Rebound secured by DeMar McCollum.

[09:01] Team_095 possession (Score: 24-26)
DeMar McCollum attempts a Midrange. Contested by Ben Stewart (5.3 feet, MAN). DEMAR MCCOLLUM MAKES IT!
Score: 24-28

[08:45] Team_027 possession (Score: 24-28)
CJ Green attempts a Midrange. Contested by Kyle Poole (4.9 feet, MAN). CJ Green misses. Offensive rebound by Ben Stewart! Ben Stewart's putback is no good. Rebound secured by Gary Davis.

[08:31] Team_095 possession (Score: 24-28)
Gary Davis drives to the basket... Gary Davis throws a bad pass out of bounds! TURNOVER! (dead ball)

[08:14] Team_027 possession (Score: 24-28)
LeBron Russell drives and kicks out. FOUL! Shooting foul on DeMar McCollum. Ben Stewart to the line for 2 free throws. [Team fouls: 3] (DeMar McCollum: 2 personal fouls)   FT 1/2: GOOD   FT 2/2: GOOD Ben Stewart makes 2/2 from the line.
Score: 26-28

[07:55] Team_095 possession (Score: 26-28)
DeMar McCollum attempts a 3Pt. Contested by CJ Green (5.7 feet, ZONE). DeMar McCollum misses. Rebound secured by Ben Stewart.

[07:39] Team_027 possession (Score: 26-28)
Dirk Lillard attempts a Midrange. Contested by Cade Beal (4.4 feet, MAN). Dirk Lillard misses. Offensive rebound by Ben Stewart! Ben Stewart puts it back in!
Score: 28-28

[07:21] Team_095 possession (Score: 28-28)
FOUL! Reach-in foul on LeBron Russell during the drive. [Team fouls: 3] No free throws, side out. (LeBron Russell: 1 personal fouls)

[07:03] Team_095 possession (Score: 28-28)
DeMar McCollum attempts a Layup. BLOCKED BY BEN STEWART! Ball deflects out of bounds off DeMar McCollum.

[06:47] Team_027 possession (Score: 28-28)
FOUL! Offensive foul on LeBron Russell! Gary Davis drew the charge! [Team fouls: 4] (LeBron Russell: 2 personal fouls) TURNOVER! (dead ball)

[06:31] Team_095 possession (Score: 28-28)
Kyle Poole attempts a 3Pt. Contested by CJ Green (5.4 feet, MAN). Kyle Poole misses. Rebound secured by Dirk Lillard.

[06:16] Team_027 possession (Score: 28-28)
FOUL! Shooting foul on DeMar McCollum. Ben Stewart to the line for 2 free throws. [Team fouls: 4] (DeMar McCollum: 3 personal fouls)   FT 1/2: GOOD   FT 2/2: GOOD Ben Stewart makes 2/2 from the line.
Score: 30-28

[06:01] Team_095 possession (Score: 30-28)
Kyle Poole attempts a Midrange. Contested by Rudy Quickley (3.7 feet, ZONE). KYLE POOLE MAKES IT! Assist: Cade Beal
Score: 30-30

[05:48] Team_027 possession (Score: 30-30)
LeBron Russell attempts a 3Pt. Contested by Cade Beal (4.4 feet, ZONE). LeBron Russell misses. Rebound secured by Tobias Wagner.

[05:32] Team_095 possession (Score: 30-30)
Kyle Poole drives, picks up CJ Green. Help arrives from Dirk Lillard! Kyle Poole attempts a Dunk. Contested by Dirk Lillard (5.4 feet, MAN). Kyle Poole misses. Offensive rebound by DeMar McCollum! DeMar McCollum kicks it out.

[05:19] Team_095 possession (Score: 30-30)
Gary Davis attempts a Midrange. Contested by LeBron Russell (5.3 feet, MAN). Gary Davis misses. Rebound secured by Dirk Lillard.

[05:00] Team_027 possession (Score: 30-30)
Rudy Quickley attempts a 3Pt. Contested by Cade Beal (4.8 feet, ZONE). Rudy Quickley misses. Rebound secured by Tobias Wagner.

[04:47] Team_095 possession (Score: 30-30)
Cade Beal throws a bad pass! Stolen by Dirk Lillard! TURNOVER! (live ball)

[04:34] Team_027 possession (Score: 30-30)
Rudy Quickley drives and kicks out. LeBron Russell attempts a 3Pt. Contested by Gary Davis (5.4 feet, MAN). LeBron Russell misses. Rebound secured by Gary Davis.

[04:19] Team_095 possession (Score: 30-30)
Tobias Wagner attempts a Midrange. Contested by Rudy Quickley (3.7 feet, ZONE). Tobias Wagner misses. Rebound secured by Dirk Lillard.

[04:02] Team_027 possession (Score: 30-30)
Rudy Quickley attempts a 3Pt. Contested by Cade Beal (4.8 feet, ZONE). Rudy Quickley misses. Rebound secured by Tobias Wagner.

[03:50] Team_095 possession (Score: 30-30)
Gary Davis attempts a 3Pt. Contested by LeBron Russell (5.3 feet, MAN). Gary Davis misses. Rebound secured by Dirk Lillard.

[03:33] Team_027 possession (Score: 30-30)
FOUL! Reach-in foul on DeMar McCollum during the drive. [IN THE BONUS! 5 team fouls] Dirk Lillard to the line for 2 free throws. (DeMar McCollum: 4 personal fouls)   FT 1/2: GOOD   FT 2/2: MISS Dirk Lillard makes 1/2 from the line. Rebound secured by Tobias Wagner.
Score: 31-30

[03:20] Team_095 possession (Score: 31-30)
Kyle Poole drives to the basket... Kyle Poole loses control! Ball rolls out of bounds! TURNOVER! (dead ball)

[03:06] Team_027 possession (Score: 31-30)
LeBron Russell loses control! Ball rolls out of bounds! TURNOVER! (dead ball)

[02:57] Team_095 possession (Score: 31-30)
Cade Beal makes the Layup and draws the foul on Dirk Lillard! And-1! Cade Beal to the line for 1. [BONUS: 5 team fouls] (Dirk Lillard: 2 personal fouls)   FT 1/1: GOOD Cade Beal makes 1/1 from the line.
Score: 31-33

[02:42] Team_027 possession (Score: 31-33)
CJ Green attempts a 3Pt. Contested by Cade Beal (4.6 feet, ZONE). CJ Green misses. FOUL! Loose ball foul on Gary Davis during the rebound battle. [IN THE BONUS! 6 team fouls] Dirk Lillard to the line for 2 free throws. (Gary Davis: 1 personal fouls)   FT 1/2: GOOD   FT 2/2: GOOD Dirk Lillard makes 2/2 from the line.
Score: 33-33

[02:25] Team_095 possession (Score: 33-33)
DeMar McCollum attempts a Layup. Contested by Ben Stewart (5.3 feet, MAN). DEMAR MCCOLLUM MAKES IT! Assist: Gary Davis
Score: 33-35

[02:14] Team_027 possession (Score: 33-35)
Ben Stewart drives and kicks out. Rudy Quickley attempts a 3Pt. Contested by Tobias Wagner (4.0 feet, MAN). Rudy Quickley misses. Rebound secured by Gary Davis.

[01:57] Team_095 possession (Score: 33-35)
Cade Beal drives, Dirk Lillard stays with him. Cade Beal attempts a Layup. Contested by Dirk Lillard (4.3 feet, MAN). Cade Beal misses. Rebound secured by Ben Stewart.

[01:43] Team_027 possession (Score: 33-35)
Rudy Quickley throws a bad pass out of bounds! TURNOVER! (dead ball)

[01:26] Team_095 possession (Score: 33-35)
Cade Beal attempts a 3Pt. Contested by CJ Green (5.3 feet, ZONE). Cade Beal misses. Offensive rebound by Tobias Wagner! Tobias Wagner kicks it out.

[01:11] Team_095 possession (Score: 33-35)
Gary Davis drives and kicks out. DeMar McCollum attempts a 3Pt. Contested by Ben Stewart (4.9 feet, MAN). DeMar McCollum misses. Rebound secured by Dirk Lillard.

[00:54] Team_027 possession (Score: 33-35)
CJ Green attempts a Midrange. Contested by Cade Beal (4.7 feet, ZONE). CJ Green misses. Rebound secured by DeMar McCollum.

[00:39] Team_095 possession (Score: 33-35)
Gary Davis attempts a Midrange. Contested by LeBron Russell (5.5 feet, MAN). Gary Davis misses. Rebound secured by LeBron Russell.

[00:25] Team_027 possession (Score: 33-35)
Dirk Lillard makes the Midrange and draws the foul on Cade Beal! And-1! Dirk Lillard to the line for 1. [BONUS: 7 team fouls] (Cade Beal: 1 personal fouls)   FT 1/1: GOOD Dirk Lillard makes 1/1 from the line.
Score: 36-35

[00:08] Team_095 possession (Score: 36-35)
Cade Beal attempts a Layup. Contested by Dirk Lillard (4.4 feet, MAN). CADE BEAL MAKES IT!
Score: 36-37

================================================================================
                              2ND QUARTER COMPLETE                              
================================================================================

2ND QUARTER SCORE: Team_027 15, Team_095 17

BOX SCORE:
================================================================================

Team_027
--------------------------------------------------------------------------------
Player                MIN  PTS  REB  AST  TO      FG   FG%      3P   3P%
--------------------------------------------------------------------------------
Dirk Lillard           11    8    6    0   0   3/4    75.0     0/0   0.0
Ben Stewart            11    6    3    0   0   3/4    75.0     0/0   0.0
John Russell           13    0    0    0   0   0/1     0.0     0/0   0.0
LeBron Russell         11    0    2    0   0   0/1     0.0     0/0   0.0
CJ Green               11    0    0    1   0   0/3     0.0     0/0   0.0
Rudy Quickley          11    0    0    0   0   0/4     0.0     0/0   0.0

TEAM: FG: 6/17 (35.3%), 3PT: 2/7 (28.6%), REB: 12 (2 off, 10 def), AST: 1, TO: 5
TEAM FOULS: 5 [Team_095 in BONUS]


Team_095
--------------------------------------------------------------------------------
Player                MIN  PTS  REB  AST  TO      FG   FG%      3P   3P%
--------------------------------------------------------------------------------
Cade Beal              11    8    0    1   0   3/5    60.0     0/0   0.0
DeMar McCollum         11    7    4    0   0   3/5    60.0     0/0   0.0
Kyle Poole             11    2    0    0   0   1/2    50.0     0/0   0.0
Evan Carter            13    0    1    0   0   0/0     0.0     0/0   0.0
Gary Davis             11    0    3    1   0   0/5     0.0     0/0   0.0
Tobias Wagner          11    0    5    0   0   0/1     0.0     0/0   0.0

TEAM: FG: 7/18 (38.9%), 3PT: 0/3 (0.0%), REB: 12 (2 off, 10 def), AST: 2, TO: 4
TEAM FOULS: 7 [Team_027 in BONUS]

================================================================================

================================================================================
                       3RD QUARTER - Team_027 vs Team_095                       
================================================================================

[12:00] Team_027 possession (Score: 36-37)
Tony Doncic drives, picks up Immanuel Middleton. Help arrives from Dejounte Hyland! Tony Doncic attempts a Dunk. Contested by Dejounte Hyland (5.0 feet, ZONE). TONY DONCIC MAKES IT! Assist: Tim Johnson
Score: 38-37

[11:50] Team_095 possession (Score: 38-37)
FOUL! Holding foul on Tony Doncic. [Team fouls: 1] No free throws, side out. (Tony Doncic: 1 personal fouls)

[11:34] Team_095 possession (Score: 38-37)
Evan Carter attempts a Midrange. Contested by John Russell (4.1 feet, ZONE). EVAN CARTER MAKES IT!
Score: 38-39

[11:20] Team_027 possession (Score: 38-39)
Scottie Harden attempts a Midrange. Contested by Evan Carter (3.9 feet, MAN). Scottie Harden misses. Rebound secured by Evan Carter.

[11:11] Team_095 possession (Score: 38-39)
Shaquille Ball attempts a 3Pt. Contested by Tony Doncic (3.9 feet, MAN). SHAQUILLE BALL MAKES IT! Assist: Immanuel Middleton
Score: 38-42

[10:56] Team_027 possession (Score: 38-42)
Scottie Harden attempts a Midrange. Contested by Evan Carter (3.9 feet, MAN). Scottie Harden misses. Rebound secured by Dejounte Hyland.

[10:43] Team_095 possession (Score: 38-42)
Immanuel Middleton attempts a Midrange. Contested by Tony Doncic (3.9 feet, ZONE). IMMANUEL MIDDLETON MAKES IT! Assist: Kyrie Ming
Score: 38-44

[10:26] Team_027 possession (Score: 38-44)
Bradley Dosunmu attempts a Midrange. Contested by Immanuel Middleton (4.9 feet, MAN). BRADLEY DOSUNMU MAKES IT!
Score: 40-44

[10:09] Team_095 possession (Score: 40-44)
Shaquille Ball drives, picks up John Russell. Help arrives from Tony Doncic! Shaquille Ball attempts a Dunk. Contested by Tony Doncic (3.9 feet, ZONE). SHAQUILLE BALL MAKES IT! Assist: Evan Carter
Score: 40-46

[09:51] Team_027 possession (Score: 40-46)
Scottie Harden drives to the basket... Scottie Harden throws a bad pass! Stolen by Immanuel Middleton! TURNOVER! (live ball)

[09:37] Team_095 possession (Score: 40-46)
Immanuel Middleton attempts a Midrange. Contested by Scottie Harden (4.5 feet, ZONE). Immanuel Middleton misses. Rebound secured by Bradley Dosunmu.

[09:21] Team_027 possession (Score: 40-46)
Bradley Dosunmu drives, picks up Immanuel Middleton. Help arrives from Dejounte Hyland! Bradley Dosunmu attempts a Layup. Contested by Dejounte Hyland (4.9 feet, MAN). BRADLEY DOSUNMU MAKES IT! Assist: Tony Doncic
Score: 42-46

[09:09] Team_095 possession (Score: 42-46)
FOUL! Shooting foul on Tony Doncic. Kyrie Ming to the line for 2 free throws. [Team fouls: 2] (Tony Doncic: 2 personal fouls)   FT 1/2: GOOD   FT 2/2: GOOD Kyrie Ming makes 2/2 from the line.
Score: 42-48

[09:00] Team_027 possession (Score: 42-48)
Scottie Harden attempts a 3Pt. Contested by Evan Carter (3.9 feet, ZONE). Scottie Harden misses. Rebound secured by Dejounte Hyland.

[08:44] Team_095 possession (Score: 42-48)
Evan Carter attempts a Midrange. Contested by Scottie Harden (4.7 feet, MAN). Evan Carter misses. Offensive rebound by Dejounte Hyland! Dejounte Hyland kicks it out.

[08:29] Team_095 possession (Score: 42-48)
Shaquille Ball attempts a 3Pt. Contested by Tony Doncic (3.9 feet, MAN). Shaquille Ball misses. Rebound secured by John Russell.

[08:11] Team_027 possession (Score: 42-48)
Tony Doncic drives to the basket... FOUL! Offensive foul on Tony Doncic! Immanuel Middleton drew the charge! [Team fouls: 3] (Tony Doncic: 3 personal fouls) TURNOVER! (dead ball)

[07:57] Team_095 possession (Score: 42-48)
Shaquille Ball drives, John Russell stays with him. Shaquille Ball attempts a Dunk. Contested by John Russell (3.9 feet, ZONE). SHAQUILLE BALL MAKES IT! Assist: Dejounte Hyland
Score: 42-50

[07:42] Team_027 possession (Score: 42-50)
FOUL! Shooting foul on Immanuel Middleton. Bradley Dosunmu to the line for 2 free throws. [Team fouls: 1] (Immanuel Middleton: 1 personal fouls)   FT 1/2: GOOD   FT 2/2: GOOD Bradley Dosunmu makes 2/2 from the line.
Score: 44-50

[07:26] Team_095 possession (Score: 44-50)
FOUL! Reach-in foul on John Russell during the drive. [Team fouls: 4] No free throws, side out. (John Russell: 1 personal fouls)

[07:13] Team_095 possession (Score: 44-50)
FOUL! Offensive foul on Kyrie Ming! John Russell drew the charge! [Team fouls: 2] (Kyrie Ming: 1 personal fouls) TURNOVER! (dead ball)

[07:02] Team_027 possession (Score: 44-50)
FOUL! Reach-in foul on Dejounte Hyland during the drive. [Team fouls: 3] No free throws, side out. (Dejounte Hyland: 1 personal fouls)

[06:43] Team_027 possession (Score: 44-50)
Tony Doncic attempts a 3Pt. Contested by Evan Carter (4.0 feet, ZONE). TONY DONCIC MAKES IT! Assist: Tim Johnson
Score: 47-50

[06:29] Team_095 possession (Score: 47-50)
Immanuel Middleton drives, John Russell stays with him. Immanuel Middleton attempts a Layup. Contested by John Russell (3.9 feet, ZONE). IMMANUEL MIDDLETON MAKES IT! Assist: Evan Carter
Score: 47-52

[06:18] Team_027 possession (Score: 47-52)
John Russell drives, Kyrie Ming stays with him. John Russell attempts a Dunk. Contested by Kyrie Ming (5.9 feet, MAN). JOHN RUSSELL MAKES IT! Assist: Scottie Harden
Score: 49-52

[06:00] Team_095 possession (Score: 49-52)
Immanuel Middleton attempts a Midrange. Contested by Tony Doncic (3.9 feet, ZONE). Immanuel Middleton misses. FOUL! Loose ball foul on Tony Doncic during the rebound battle. [IN THE BONUS! 5 team fouls] Evan Carter to the line for 2 free throws. (Tony Doncic: 4 personal fouls)   FT 1/2: GOOD   FT 2/2: MISS Evan Carter makes 1/2 from the line. Rebound secured by Bradley Dosunmu.
Score: 49-53

[05:47] Team_027 possession (Score: 49-53)
Tony Doncic attempts a 3Pt. Contested by Evan Carter (4.0 feet, ZONE). Tony Doncic misses. Rebound secured by Dejounte Hyland.

[05:29] Team_095 possession (Score: 49-53)
FOUL! Shooting foul on Tony Doncic. Shaquille Ball to the line for 3 free throws. [BONUS: 6 team fouls] (Tony Doncic: 5 personal fouls)   FT 1/3: GOOD   FT 2/3: GOOD   FT 3/3: GOOD Shaquille Ball makes 3/3 from the line.
Score: 49-56

[05:14] Team_027 possession (Score: 49-56)
Bradley Dosunmu attempts a 3Pt. Contested by Evan Carter (3.9 feet, ZONE). Bradley Dosunmu misses. Rebound secured by Dejounte Hyland.

[04:56] Team_095 possession (Score: 49-56)
Shaquille Ball drives, John Russell stays with him. Shaquille Ball attempts a Layup. Contested by John Russell (3.9 feet, ZONE). SHAQUILLE BALL MAKES IT!
Score: 49-58

[04:38] Team_027 possession (Score: 49-58)
FOUL! Shooting foul on Kyrie Ming. John Russell to the line for 2 free throws. [Team fouls: 4] (Kyrie Ming: 2 personal fouls)   FT 1/2: GOOD   FT 2/2: GOOD John Russell makes 2/2 from the line.
Score: 51-58

[04:22] Team_095 possession (Score: 51-58)
Shaquille Ball commits a violation (traveling/carry)! TURNOVER! (dead ball)

[04:08] Team_027 possession (Score: 51-58)
Tim Johnson attempts a Midrange. Contested by Shaquille Ball (4.7 feet, ZONE). Tim Johnson misses. Rebound secured by Evan Carter.

[03:57] Team_095 possession (Score: 51-58)
Immanuel Middleton attempts a Layup. Contested by Bradley Dosunmu (4.4 feet, MAN). Immanuel Middleton misses. Rebound secured by Tony Doncic.

[03:42] Team_027 possession (Score: 51-58)
Tim Johnson drives, picks up Dejounte Hyland. Help arrives from Evan Carter! Tim Johnson attempts a Layup. Contested by Evan Carter (5.3 feet, MAN). TIM JOHNSON MAKES IT!
Score: 53-58

[03:28] Team_095 possession (Score: 53-58)
Kyrie Ming makes the Layup and draws the foul on John Russell! And-1! Kyrie Ming to the line for 1. [BONUS: 7 team fouls] (John Russell: 2 personal fouls)   FT 1/1: MISS Kyrie Ming makes 0/1 from the line. Rebound secured by John Russell.
Score: 53-60

[03:13] Team_027 possession (Score: 53-60)
Tim Johnson makes the Layup and draws the foul on Dejounte Hyland! And-1! Tim Johnson to the line for 1. [BONUS: 5 team fouls] (Dejounte Hyland: 2 personal fouls)   FT 1/1: MISS Tim Johnson makes 0/1 from the line. Offensive rebound by Bradley Dosunmu! Bradley Dosunmu kicks it out.
Score: 55-60

[02:59] Team_027 possession (Score: 55-60)
Tim Johnson attempts a Midrange. Contested by Shaquille Ball (4.8 feet, ZONE). TIM JOHNSON MAKES IT!
Score: 57-60

[02:44] Team_095 possession (Score: 57-60)
Evan Carter attempts a Midrange. Contested by Scottie Harden (5.0 feet, MAN). EVAN CARTER MAKES IT! Assist: Shaquille Ball
Score: 57-62

[02:32] Team_027 possession (Score: 57-62)
Tim Johnson attempts a 3Pt. Contested by Dejounte Hyland (5.4 feet, MAN). TIM JOHNSON MAKES IT! Assist: Bradley Dosunmu
Score: 60-62

[02:16] Team_095 possession (Score: 60-62)
Evan Carter attempts a 3Pt. Contested by Scottie Harden (5.0 feet, MAN). Evan Carter misses. Rebound secured by Tony Doncic.

[02:04] Team_027 possession (Score: 60-62)
Tim Johnson attempts a 3Pt. Contested by Evan Carter (4.4 feet, ZONE). Tim Johnson misses. FOUL! Loose ball foul on Shaquille Ball during the rebound battle. [IN THE BONUS! 6 team fouls] John Russell to the line for 2 free throws. (Shaquille Ball: 1 personal fouls)   FT 1/2: GOOD   FT 2/2: GOOD John Russell makes 2/2 from the line.
Score: 62-62

[01:50] Team_095 possession (Score: 62-62)
Immanuel Middleton attempts a 3Pt. Contested by Bradley Dosunmu (4.6 feet, MAN). IMMANUEL MIDDLETON MAKES IT!
Score: 62-65

[01:34] Team_027 possession (Score: 62-65)
John Russell attempts a Layup. Wide open! Kyrie Ming is 6.2 feet away. [MAN] JOHN RUSSELL MAKES IT! Assist: Bradley Dosunmu
Score: 64-65

[01:20] Team_095 possession (Score: 64-65)
Immanuel Middleton attempts a Layup. Contested by Bradley Dosunmu (4.7 feet, MAN). IMMANUEL MIDDLETON MAKES IT!
Score: 64-67

[01:02] Team_027 possession (Score: 64-67)
Scottie Harden attempts a 3Pt. Contested by Evan Carter (4.3 feet, MAN). Scottie Harden misses. Rebound secured by Dejounte Hyland.

[00:46] Team_095 possession (Score: 64-67)
Kyrie Ming attempts a Midrange. Contested by John Russell (4.6 feet, ZONE). KYRIE MING MAKES IT! Assist: Shaquille Ball
Score: 64-69

[00:27] Team_027 possession (Score: 64-69)
Tony Doncic attempts a Midrange. Contested by Shaquille Ball (4.8 feet, MAN). TONY DONCIC MAKES IT! Assist: Bradley Dosunmu
Score: 66-69

[00:16] Team_095 possession (Score: 66-69)
Kyrie Ming attempts a Midrange. Contested by John Russell (4.6 feet, MAN). KYRIE MING MAKES IT!
Score: 66-71

[00:02] Team_027 possession (Score: 66-71)
Bradley Dosunmu drives and kicks out. Tim Johnson attempts a Midrange. Contested by Dejounte Hyland (5.4 feet, MAN). Tim Johnson misses. FOUL! Loose ball foul on Evan Carter during the rebound battle. [IN THE BONUS! 7 team fouls] Bradley Dosunmu to the line for 2 free throws. (Evan Carter: 1 personal fouls)   FT 1/2: GOOD   FT 2/2: GOOD Bradley Dosunmu makes 2/2 from the line.
Score: 68-71

================================================================================
                              3RD QUARTER COMPLETE                              
================================================================================

3RD QUARTER SCORE: Team_027 32, Team_095 34

BOX SCORE:
================================================================================

Team_027
--------------------------------------------------------------------------------
Player                MIN  PTS  REB  AST  TO      FG   FG%      3P   3P%
--------------------------------------------------------------------------------
Bradley Dosunmu        25    8    3    3   0   4/5    80.0     0/0   0.0
John Russell           25    8    2    0   0   4/4   100.0     0/0   0.0
Tony Doncic            25    7    2    1   0   3/4    75.0     0/0   0.0
Tim Johnson            25    7    0    2   0   3/4    75.0     0/0   0.0
Scottie Harden         25    0    0    1   0   0/4     0.0     0/0   0.0

TEAM: FG: 14/21 (66.7%), 3PT: 3/7 (42.9%), REB: 6 (1 off, 5 def), AST: 7, TO: 2
TEAM FOULS: 7 [Team_095 in BONUS]


Team_095
--------------------------------------------------------------------------------
Player                MIN  PTS  REB  AST  TO      FG   FG%      3P   3P%
--------------------------------------------------------------------------------
Shaquille Ball         25   12    0    2   0   5/6    83.3     0/0   0.0
Immanuel Middleton     25    9    0    1   0   4/7    57.1     0/0   0.0
Kyrie Ming             25    6    0    1   0   3/4    75.0     0/0   0.0
Evan Carter            25    4    2    2   0   2/3    66.7     0/0   0.0
Dejounte Hyland        25    0    6    1   0   0/0     0.0     0/0   0.0

TEAM: FG: 14/20 (70.0%), 3PT: 3/5 (60.0%), REB: 9 (2 off, 7 def), AST: 7, TO: 2
TEAM FOULS: 7 [Team_027 in BONUS]

================================================================================

================================================================================
                       4TH QUARTER - Team_027 vs Team_095                       
================================================================================

[12:00] Team_027 possession (Score: 68-71)
Bradley Dosunmu drives, Immanuel Middleton stays with him. Bradley Dosunmu attempts a Layup. Contested by Immanuel Middleton (5.3 feet, ZONE). BRADLEY DOSUNMU MAKES IT! Assist: John Russell
Score: 70-71

[11:41] Team_095 possession (Score: 70-71)
Kyrie Ming drives, picks up Bradley Dosunmu. Help arrives from Tony Doncic! Kyrie Ming attempts a Dunk. Contested by Tony Doncic (4.8 feet, ZONE). Kyrie Ming misses. Rebound secured by John Russell.

[11:28] Team_027 possession (Score: 70-71)
Tim Johnson attempts a 3Pt. Contested by Evan Carter (4.4 feet, ZONE). Tim Johnson misses. Rebound secured by Evan Carter.

[11:17] Team_095 possession (Score: 70-71)
Kyrie Ming drives and kicks out. Immanuel Middleton attempts a 3Pt. Contested by Bradley Dosunmu (4.8 feet, MAN). IMMANUEL MIDDLETON MAKES IT! Assist: Evan Carter
Score: 70-74

[11:04] Team_027 possession (Score: 70-74)
Bradley Dosunmu attempts a 3Pt. Contested by Immanuel Middleton (5.4 feet, MAN). Bradley Dosunmu misses. Rebound secured by Evan Carter.

[10:48] Team_095 possession (Score: 70-74)
Kyrie Ming drives to the basket... Kyrie Ming throws a bad pass out of bounds! TURNOVER! (dead ball)

[10:48] Substitution (Team_027): Tim Johnson OUT → CJ Green IN (stamina_rule2)

[10:48] Substitution (Team_027): Tony Doncic OUT → Dirk Lillard IN (stamina_rule2)

[10:48] Substitution (Team_027): Scottie Harden OUT → Rudy Quickley IN (stamina_rule2)

[10:48] Substitution (Team_027): Bradley Dosunmu OUT → LeBron Russell IN (stamina_rule2)

[10:48] Substitution (Team_027): John Russell OUT → Ben Stewart IN (stamina_rule2)

[10:48] Substitution (Team_095): Dejounte Hyland OUT → Kyle Poole IN (stamina_rule2)

[10:48] Substitution (Team_095): Shaquille Ball OUT → Cade Beal IN (stamina_rule2)

[10:48] Substitution (Team_095): Evan Carter OUT → Tobias Wagner IN (stamina_rule2)

[10:48] Substitution (Team_095): Immanuel Middleton OUT → Gary Davis IN (stamina_rule2)

[10:48] Substitution (Team_095): Kyrie Ming OUT → DeMar McCollum IN (stamina_rule2)

[10:36] Team_027 possession (Score: 70-74)
CJ Green attempts a 3Pt. Contested by Kyle Poole (4.9 feet, MAN). CJ GREEN MAKES IT! Assist: Dirk Lillard
Score: 73-74

[10:21] Team_095 possession (Score: 73-74)
Kyle Poole attempts a Midrange. Contested by Dirk Lillard (4.5 feet, ZONE). Kyle Poole misses. Rebound secured by Dirk Lillard.

[10:10] Team_027 possession (Score: 73-74)
Rudy Quickley attempts a Layup. BLOCKED BY TOBIAS WAGNER! Ball is loose! Rebound secured by Gary Davis.

[09:56] Team_095 possession (Score: 73-74)
Tobias Wagner attempts a Midrange. Contested by Rudy Quickley (3.7 feet, MAN). Tobias Wagner misses. Rebound secured by Ben Stewart.

[09:39] Team_027 possession (Score: 73-74)
FOUL! Holding foul on DeMar McCollum. [Team fouls: 1] No free throws, side out. (DeMar McCollum: 1 personal fouls)

[09:20] Team_027 possession (Score: 73-74)
Rudy Quickley attempts a 3Pt. Contested by Tobias Wagner (4.2 feet, MAN). Rudy Quickley misses. Offensive rebound by Dirk Lillard! Dirk Lillard kicks it out.

[09:08] Team_027 possession (Score: 73-74)
Dirk Lillard attempts a 3Pt. Contested by Cade Beal (4.4 feet, ZONE). Dirk Lillard misses. Rebound secured by Tobias Wagner.

[08:50] Team_095 possession (Score: 73-74)
Gary Davis drives, picks up LeBron Russell. Help arrives from Dirk Lillard! Gary Davis attempts a Dunk. Contested by Dirk Lillard (5.3 feet, MAN). Gary Davis misses. Rebound secured by LeBron Russell.

[08:36] Team_027 possession (Score: 73-74)
LeBron Russell attempts a 3Pt. Contested by Cade Beal (4.4 feet, ZONE). LeBron Russell misses. Rebound secured by Gary Davis.

[08:18] Team_095 possession (Score: 73-74)
Kyle Poole attempts a 3Pt. Contested by CJ Green (5.4 feet, MAN). Kyle Poole misses. Rebound secured by LeBron Russell.

[08:08] Team_027 possession (Score: 73-74)
Rudy Quickley drives to the basket... FOUL! Offensive foul on Rudy Quickley! DeMar McCollum drew the charge! [Team fouls: 1] (Rudy Quickley: 1 personal fouls) TURNOVER! (dead ball)

[07:53] Team_095 possession (Score: 73-74)
DeMar McCollum drives, picks up Ben Stewart. Help arrives from Dirk Lillard! DeMar McCollum attempts a Layup. Contested by Dirk Lillard (5.3 feet, MAN). DEMAR MCCOLLUM MAKES IT! Assist: Kyle Poole
Score: 73-76

[07:35] Team_027 possession (Score: 73-76)
LeBron Russell drives, DeMar McCollum stays with him. LeBron Russell attempts a Layup. Contested by DeMar McCollum (4.9 feet, ZONE). LeBron Russell misses. Rebound secured by DeMar McCollum.

[07:20] Team_095 possession (Score: 73-76)
Kyle Poole attempts a 3Pt. Contested by Rudy Quickley (3.7 feet, ZONE). Kyle Poole misses. Rebound secured by Ben Stewart.

[07:05] Team_027 possession (Score: 73-76)
Rudy Quickley attempts a 3Pt. Contested by Tobias Wagner (4.2 feet, MAN). Rudy Quickley misses. Rebound secured by Gary Davis.

[06:52] Team_095 possession (Score: 73-76)
DeMar McCollum attempts a 3Pt. Contested by Rudy Quickley (3.9 feet, ZONE). DeMar McCollum misses. Rebound secured by Dirk Lillard.

[06:36] Team_027 possession (Score: 73-76)
Rudy Quickley loses the ball! Stripped by Tobias Wagner! TURNOVER! (live ball)

[06:23] Team_095 possession (Score: 73-76)
Cade Beal attempts a 3Pt. Contested by Rudy Quickley (3.3 feet, ZONE). Cade Beal misses. Offensive rebound by DeMar McCollum! DeMar McCollum kicks it out.

[06:07] Team_095 possession (Score: 73-76)
Gary Davis drives to the basket... Gary Davis throws a bad pass! Stolen by Ben Stewart! TURNOVER! (live ball)

[05:55] Team_027 possession (Score: 73-76)
Rudy Quickley drives to the basket... Rudy Quickley commits a violation (traveling/carry)! TURNOVER! (dead ball)

[05:42] Team_095 possession (Score: 73-76)
Kyle Poole attempts a 3Pt. Contested by Rudy Quickley (3.7 feet, ZONE). Kyle Poole misses. Rebound secured by LeBron Russell.

[05:28] Team_027 possession (Score: 73-76)
LeBron Russell makes the Layup and draws the foul on DeMar McCollum! And-1! LeBron Russell to the line for 1. [Team fouls: 2] (DeMar McCollum: 2 personal fouls)   FT 1/1: GOOD LeBron Russell makes 1/1 from the line.
Score: 76-76

[05:16] Team_095 possession (Score: 76-76)
Tobias Wagner attempts a 3Pt. Contested by Rudy Quickley (3.7 feet, ZONE). TOBIAS WAGNER MAKES IT! Assist: Gary Davis
Score: 76-79

[05:02] Team_027 possession (Score: 76-79)
Ben Stewart attempts a Midrange. Contested by DeMar McCollum (4.8 feet, MAN). BEN STEWART MAKES IT!
Score: 78-79

[04:49] Team_095 possession (Score: 78-79)
Kyle Poole attempts a Midrange. Contested by CJ Green (5.4 feet, MAN). KYLE POOLE MAKES IT! Assist: DeMar McCollum
Score: 78-81

[04:30] Team_027 possession (Score: 78-81)
Rudy Quickley drives, picks up Tobias Wagner. Help arrives from Kyle Poole! Rudy Quickley attempts a Layup. Contested by Kyle Poole (4.2 feet, MAN). RUDY QUICKLEY MAKES IT!
Score: 80-81

[04:14] Team_095 possession (Score: 80-81)
FOUL! Reach-in foul on Ben Stewart during the drive. [Team fouls: 2] No free throws, side out. (Ben Stewart: 1 personal fouls)

[04:03] Team_095 possession (Score: 80-81)
Gary Davis drives, LeBron Russell stays with him. Gary Davis attempts a Layup. Contested by LeBron Russell (5.3 feet, MAN). GARY DAVIS MAKES IT! Assist: DeMar McCollum
Score: 80-83

[03:50] Team_027 possession (Score: 80-83)
CJ Green attempts a 3Pt. Contested by Kyle Poole (4.9 feet, MAN). CJ Green misses. Offensive rebound by Dirk Lillard! Dirk Lillard kicks it out.

[03:35] Team_027 possession (Score: 80-83)
LeBron Russell drives, picks up Gary Davis. Help arrives from Kyle Poole! LeBron Russell attempts a Dunk. Contested by Kyle Poole (5.5 feet, MAN). LEBRON RUSSELL MAKES IT! Assist: Dirk Lillard
Score: 82-83

[03:18] Team_095 possession (Score: 82-83)
DeMar McCollum makes the Dunk and draws the foul on Ben Stewart! And-1! DeMar McCollum to the line for 1. [Team fouls: 3] (Ben Stewart: 2 personal fouls)   FT 1/1: GOOD DeMar McCollum makes 1/1 from the line.
Score: 82-86

[03:05] Team_027 possession (Score: 82-86)
Dirk Lillard drives to the basket... FOUL! Offensive foul on Dirk Lillard! DeMar McCollum drew the charge! [Team fouls: 4] (Dirk Lillard: 1 personal fouls) TURNOVER! (dead ball)

[02:54] Team_095 possession (Score: 82-86)
Gary Davis drives to the basket... Gary Davis loses the ball! Stripped by Ben Stewart! TURNOVER! (live ball)

[02:40] Team_027 possession (Score: 82-86)
CJ Green attempts a Midrange. Contested by Kyle Poole (5.0 feet, MAN). CJ Green misses. Rebound secured by Tobias Wagner.

[02:28] Team_095 possession (Score: 82-86)
FOUL! Holding foul on Rudy Quickley. [IN THE BONUS! 5 team fouls] Tobias Wagner to the line for 2 free throws. (Rudy Quickley: 2 personal fouls)   FT 1/2: GOOD   FT 2/2: MISS Tobias Wagner makes 1/2 from the line. Rebound secured by Ben Stewart.
Score: 82-87

[02:15] Team_027 possession (Score: 82-87)
CJ Green attempts a Midrange. Contested by Kyle Poole (5.1 feet, MAN). CJ Green misses. Offensive rebound by Dirk Lillard! Dirk Lillard kicks it out.

[02:00] Team_027 possession (Score: 82-87)
Rudy Quickley drives, DeMar McCollum stays with him. Rudy Quickley attempts a Dunk. Contested by DeMar McCollum (5.5 feet, ZONE). Rudy Quickley misses. Rebound secured by DeMar McCollum.

[01:44] Team_095 possession (Score: 82-87)
Tobias Wagner drives and kicks out. Tobias Wagner attempts a 3Pt. Contested by Rudy Quickley (3.6 feet, ZONE). Tobias Wagner misses. Rebound secured by Ben Stewart.

[01:31] Team_027 possession (Score: 82-87)
Ben Stewart makes the Layup and draws the foul on DeMar McCollum! And-1! Ben Stewart to the line for 1. [Team fouls: 3] (DeMar McCollum: 3 personal fouls)   FT 1/1: GOOD Ben Stewart makes 1/1 from the line.
Score: 85-87

[01:19] Team_095 possession (Score: 85-87)
Gary Davis attempts a 3Pt. Contested by LeBron Russell (5.5 feet, MAN). Gary Davis misses. Rebound secured by LeBron Russell.

[01:06] Team_027 possession (Score: 85-87)
CJ Green attempts a 3Pt. Contested by Kyle Poole (5.2 feet, ZONE). CJ Green misses. Rebound secured by DeMar McCollum.

[00:53] Team_095 possession (Score: 85-87)
Tobias Wagner attempts a 3Pt. Contested by Rudy Quickley (4.0 feet, ZONE). TOBIAS WAGNER MAKES IT! Assist: Gary Davis
Score: 85-90

[00:40] Team_027 possession (Score: 85-90)
Rudy Quickley attempts a 3Pt. Contested by Tobias Wagner (4.6 feet, MAN). Rudy Quickley misses. Offensive rebound by Ben Stewart! Ben Stewart puts it back in!
Score: 87-90

[00:24] Team_095 possession (Score: 87-90)
FOUL! Shooting foul on Dirk Lillard. Cade Beal to the line for 3 free throws. [BONUS: 6 team fouls] (Dirk Lillard: 2 personal fouls)   FT 1/3: GOOD   FT 2/3: MISS   FT 3/3: GOOD Cade Beal makes 2/3 from the line.
Score: 87-92

[00:12] Team_027 possession (Score: 87-92)
Rudy Quickley attempts a 3Pt. Contested by Cade Beal (5.1 feet, ZONE). Rudy Quickley misses. Rebound secured by DeMar McCollum.

================================================================================
                              4TH QUARTER COMPLETE                              
================================================================================

4TH QUARTER SCORE: Team_027 19, Team_095 21

BOX SCORE:
================================================================================

Team_027
--------------------------------------------------------------------------------
Player                MIN  PTS  REB  AST  TO      FG   FG%      3P   3P%
--------------------------------------------------------------------------------
Ben Stewart            22    7    5    0   0   3/3   100.0     0/0   0.0
LeBron Russell         22    5    4    0   0   2/4    50.0     0/0   0.0
CJ Green               22    3    0    0   0   1/3    33.3     0/0   0.0
Bradley Dosunmu        26    2    0    0   0   1/2    50.0     0/0   0.0
Rudy Quickley          22    2    0    0   0   1/5    20.0     0/0   0.0
John Russell           26    0    1    1   0   0/0     0.0     0/0   0.0
Tim Johnson            26    0    0    0   0   0/1     0.0     0/0   0.0
Dirk Lillard           22    0    5    2   0   0/1     0.0     0/0   0.0

TEAM: FG: 8/19 (42.1%), 3PT: 2/9 (22.2%), REB: 15 (4 off, 11 def), AST: 3, TO: 4
TEAM FOULS: 6 [Team_095 in BONUS]


Team_095
--------------------------------------------------------------------------------
Player                MIN  PTS  REB  AST  TO      FG   FG%      3P   3P%
--------------------------------------------------------------------------------
Tobias Wagner          22    6    2    0   0   2/4    50.0     0/0   0.0
DeMar McCollum         22    5    5    2   0   2/3    66.7     0/0   0.0
Immanuel Middleton     26    3    0    0   0   1/1   100.0     0/0   0.0
Kyle Poole             22    2    0    1   0   1/5    20.0     0/0   0.0
Gary Davis             22    2    3    2   0   1/3    33.3     0/0   0.0
Cade Beal              22    2    0    0   0   1/1   100.0     0/0   0.0
Kyrie Ming             26    0    0    0   0   0/1     0.0     0/0   0.0
Evan Carter            26    0    2    1   0   0/0     0.0     0/0   0.0

TEAM: FG: 8/19 (42.1%), 3PT: 3/8 (37.5%), REB: 12 (1 off, 11 def), AST: 6, TO: 3
TEAM FOULS: 3

================================================================================

================================================================================
                               FULL GAME COMPLETE                               
================================================================================

FINAL SCORE: Team_027 87, Team_095 92

SCORING BY QUARTER:
--------------------------------------------------------------------------------
Team                     Q1     Q2     Q3     Q4    FINAL
--------------------------------------------------------------------------------
Team_027                 21     15     32     19       87
Team_095                 20     17     34     21       92
--------------------------------------------------------------------------------

FULL GAME BOX SCORE:
================================================================================

Team_027
--------------------------------------------------------------------------------
Player                MIN  PTS  REB  AST  TO      FG   FG%      3P   3P%      FT STL BLK
--------------------------------------------------------------------------------
Tim Johnson            26   10    0    2   3   5/11   45.5   3/8    37.5   0/1     0   0
Tony Doncic            26    9    6    1   0   4/8    50.0   1/4    25.0   0/0     0   0
Scottie Harden         26    4    0    2   0   2/8    25.0   0/3     0.0   0/0     0   0
Bradley Dosunmu        26   17    9    3   1   8/10   80.0   0/2     0.0   6/8     1   0
John Russell           26   13    5    3   0   5/8    62.5   0/0     0.0   7/7     1   0
CJ Green               22    3    0    1   0   2/7    28.6   2/4    50.0   0/0     0   0
Dirk Lillard           22    8   11    2   1   3/5    60.0   1/2    50.0   4/5     1   0
Rudy Quickley          22    2    0    0   2   2/10   20.0   1/6    16.7   0/0     0   0
LeBron Russell         22    5    6    0   3   3/6    50.0   0/2     0.0   1/1     0   0
Ben Stewart            22   13    8    0   2   3/4    75.0   0/0     0.0   5/5     2   1

TEAM: FG: 37/78 (47.4%), 3PT: 8/31 (25.8%), REB: 44 (9 off, 35 def), AST: 14, TO: 12


Team_095
--------------------------------------------------------------------------------
Player                MIN  PTS  REB  AST  TO      FG   FG%      3P   3P%      FT STL BLK
--------------------------------------------------------------------------------
Dejounte Hyland        26    0   11    2   0   0/1     0.0   0/0     0.0   0/0     0   1
Shaquille Ball         26   14    1    3   2   6/8    75.0   2/3    66.7   3/3     0   0
Evan Carter            26   14   12    4   0   5/7    71.4   0/2     0.0   1/2     0   0
Immanuel Middleton     26   18    0    1   2   7/13   53.8   2/4    50.0   1/1     1   0
Kyrie Ming             26    8    0    3   2   6/12   50.0   0/1     0.0   2/3     0   0
Kyle Poole             22    4    0    1   1   3/8    37.5   0/4     0.0   0/0     0   0
Cade Beal              22   10    0    1   2   3/5    60.0   1/1   100.0   4/5     0   0
Tobias Wagner          22    6    7    0   0   2/5    40.0   2/2   100.0   1/2     1   1
Gary Davis             22    2    6    3   1   1/8    12.5   0/2     0.0   0/0     0   0
DeMar McCollum         22   12    9    2   1   5/8    62.5   0/2     0.0   2/2     0   0

TEAM: FG: 38/76 (50.0%), 3PT: 7/21 (33.3%), REB: 47 (7 off, 40 def), AST: 20, TO: 11

================================================================================
