================================================================================
                        FULL GAME - Team_062 vs Team_054                        
================================================================================

================================================================================
                       1ST QUARTER - Team_062 vs Team_054                       
================================================================================

[12:00] Team_062 possession (Score: 0-0)
Chris Bird attempts a Midrange. Contested by Malcolm Harden (4.3 feet, MAN). Chris Bird misses. FOUL! Loose ball foul on Blake Russell during the rebound battle. [Team fouls: 1] No free throws, side out. (Blake Russell: 1 personal fouls)

[11:48] Team_062 possession (Score: 0-0)
Chris Bird attempts a 3Pt. Contested by Malcolm Harden (4.3 feet, MAN). CHRIS BIRD MAKES IT!
Score: 3-0

[11:33] Team_054 possession (Score: 3-0)
Malcolm Harden attempts a 3Pt. Contested by Chris Bird (4.5 feet, MAN). Malcolm Harden misses. Rebound secured by Jalen Reaves.

[11:19] Team_062 possession (Score: 3-0)
Chris Bird drives, Blake Russell stays with him. Chris Bird attempts a Dunk. Contested by Blake Russell (3.2 feet, ZONE). CHRIS BIRD MAKES IT! Assist: Kawhi Thompson
Score: 5-0

[11:00] Team_054 possession (Score: 5-0)
Lauri Irving drives, RJ Williamson stays with him. Lauri Irving attempts a Dunk. Contested by RJ Williamson (4.9 feet, MAN). Lauri Irving misses. Offensive rebound by Luka Brogdon! Luka Brogdon kicks it out.

[10:50] Team_054 possession (Score: 5-0)
Blake Russell drives to the basket... Blake Russell throws a bad pass! Stolen by Jalen Reaves! TURNOVER! (live ball)

[10:34] Team_062 possession (Score: 5-0)
Chris Bird drives, Blake Russell stays with him. Chris Bird attempts a Dunk. Contested by Blake Russell (3.2 feet, ZONE). Chris Bird misses. Offensive rebound by Jalen Reaves! Jalen Reaves puts it back in!
Score: 7-0

[10:20] Team_054 possession (Score: 7-0)
Vince Ball makes the Midrange and draws the foul on Michael Hyland! And-1! Vince Ball to the line for 1. [Team fouls: 1] (Michael Hyland: 1 personal fouls)   FT 1/1: GOOD Vince Ball makes 1/1 from the line.
Score: 7-3

[10:10] Team_062 possession (Score: 7-3)
Jalen Reaves attempts a 3Pt. Contested by Lauri Irving (3.6 feet, ZONE). Jalen Reaves misses. Offensive rebound by Kawhi Thompson! Kawhi Thompson kicks it out.

[09:54] Team_062 possession (Score: 7-3)
Jalen Reaves attempts a Layup. Contested by Blake Russell (3.2 feet, MAN). Jalen Reaves misses. Rebound secured by Luka Brogdon.

[09:40] Team_054 possession (Score: 7-3)
Malcolm Harden commits a violation (traveling/carry)! TURNOVER! (dead ball)

[09:21] Team_062 possession (Score: 7-3)
Chris Bird attempts a 3Pt. Contested by Malcolm Harden (4.3 feet, MAN). Chris Bird misses. Rebound secured by Lauri Irving.

[09:11] Team_054 possession (Score: 7-3)
Malcolm Harden attempts a 3Pt. Contested by RJ Williamson (4.7 feet, ZONE). MALCOLM HARDEN MAKES IT! Assist: Lauri Irving
Score: 7-6

[08:55] Team_062 possession (Score: 7-6)
Jalen Reaves attempts a Layup. Contested by Blake Russell (3.2 feet, ZONE). Jalen Reaves misses. Rebound secured by Luka Brogdon.

[08:37] Team_054 possession (Score: 7-6)
Lauri Irving attempts a Layup. Contested by RJ Williamson (4.9 feet, MAN). LAURI IRVING MAKES IT! Assist: Vince Ball
Score: 7-8

[08:21] Team_062 possession (Score: 7-8)
Michael Hyland makes the Layup and draws the foul on Blake Russell! And-1! Michael Hyland to the line for 1. [Team fouls: 2] (Blake Russell: 2 personal fouls)   FT 1/1: GOOD Michael Hyland makes 1/1 from the line.
Score: 10-8

[08:08] Team_054 possession (Score: 10-8)
FOUL! Reach-in foul on Jalen Reaves during the drive. [Team fouls: 2] No free throws, side out. (Jalen Reaves: 1 personal fouls)

[07:51] Team_054 possession (Score: 10-8)
Luka Brogdon drives and kicks out. Vince Ball attempts a Midrange. Contested by Michael Hyland (4.6 feet, MAN). Vince Ball misses. Rebound secured by Jalen Reaves.

[07:35] Team_062 possession (Score: 10-8)
FOUL! Shooting foul on Lauri Irving. Jalen Reaves to the line for 2 free throws. [Team fouls: 3] (Lauri Irving: 1 personal fouls)   FT 1/2: GOOD   FT 2/2: GOOD Jalen Reaves makes 2/2 from the line.
Score: 12-8

[07:21] Team_054 possession (Score: 12-8)
Luka Brogdon loses the ball! Stripped by Kawhi Thompson! TURNOVER! (live ball)

[07:05] Team_062 possession (Score: 12-8)
Kawhi Thompson attempts a Midrange. Contested by Luka Brogdon (4.0 feet, MAN). Kawhi Thompson misses. Rebound secured by Blake Russell.

[06:50] Team_054 possession (Score: 12-8)
Blake Russell attempts a Dunk. BLOCKED BY JALEN REAVES! Ball is loose! Rebound secured by Michael Hyland.

[06:33] Team_062 possession (Score: 12-8)
RJ Williamson drives and kicks out. Chris Bird attempts a 3Pt. Contested by Malcolm Harden (4.1 feet, MAN). Chris Bird misses. Offensive rebound by Kawhi Thompson! Kawhi Thompson kicks it out.

[06:19] Team_062 possession (Score: 12-8)
Michael Hyland attempts a Midrange. Contested by Vince Ball (4.0 feet, MAN). Michael Hyland misses. Rebound secured by Luka Brogdon.

[06:04] Team_054 possession (Score: 12-8)
Blake Russell drives and kicks out. Vince Ball attempts a Midrange. Contested by RJ Williamson (4.4 feet, ZONE). Vince Ball misses. Rebound secured by Michael Hyland.

[05:50] Team_062 possession (Score: 12-8)
FOUL! Holding foul on Blake Russell. [Team fouls: 4] No free throws, side out. (Blake Russell: 3 personal fouls)

[05:30] Team_062 possession (Score: 12-8)
Chris Bird attempts a 3Pt. Contested by Lauri Irving (3.6 feet, ZONE). CHRIS BIRD MAKES IT! Assist: RJ Williamson
Score: 15-8

[05:15] Team_054 possession (Score: 15-8)
Malcolm Harden makes the Dunk and draws the foul on Chris Bird! And-1! Malcolm Harden to the line for 1. [Team fouls: 3] (Chris Bird: 1 personal fouls)   FT 1/1: GOOD Malcolm Harden makes 1/1 from the line.
Score: 15-11

[05:00] Team_062 possession (Score: 15-11)
Chris Bird drives, Blake Russell stays with him. Chris Bird attempts a Layup. Contested by Blake Russell (3.2 feet, ZONE). Chris Bird misses. Rebound secured by Lauri Irving.

[04:42] Team_054 possession (Score: 15-11)
Blake Russell drives, picks up Jalen Reaves. Help arrives from Chris Bird! Blake Russell attempts a Layup. Contested by Chris Bird (5.4 feet, ZONE). BLAKE RUSSELL MAKES IT!
Score: 15-13

[04:27] Team_062 possession (Score: 15-13)
Jalen Reaves makes the Layup and draws the foul on Blake Russell! And-1! Jalen Reaves to the line for 1. [BONUS: 5 team fouls] (Blake Russell: 4 personal fouls)   FT 1/1: GOOD Jalen Reaves makes 1/1 from the line.
Score: 18-13

[04:14] Team_054 possession (Score: 18-13)
FOUL! Holding foul on Chris Bird. [Team fouls: 4] No free throws, side out. (Chris Bird: 2 personal fouls)

[03:58] Team_054 possession (Score: 18-13)
Vince Ball drives, picks up Jalen Reaves. Help arrives from Chris Bird! Vince Ball attempts a Dunk. Contested by Chris Bird (5.2 feet, ZONE). Vince Ball misses. FOUL! Loose ball foul on Kawhi Thompson during the rebound battle. [IN THE BONUS! 5 team fouls] Luka Brogdon to the line for 2 free throws. (Kawhi Thompson: 1 personal fouls)   FT 1/2: GOOD   FT 2/2: GOOD Luka Brogdon makes 2/2 from the line.
Score: 18-15

[03:44] Team_062 possession (Score: 18-15)
RJ Williamson attempts a 3Pt. Contested by Lauri Irving (3.2 feet, ZONE). RJ Williamson misses. Rebound secured by Blake Russell.

[03:28] Team_054 possession (Score: 18-15)
Blake Russell makes the Layup and draws the foul on Jalen Reaves! And-1! Blake Russell to the line for 1. [BONUS: 6 team fouls] (Jalen Reaves: 2 personal fouls)   FT 1/1: GOOD Blake Russell makes 1/1 from the line.
Score: 18-18

[03:18] Team_062 possession (Score: 18-18)
Chris Bird drives and kicks out. Kawhi Thompson attempts a Midrange. Contested by Vince Ball (4.2 feet, ZONE). Kawhi Thompson misses. Rebound secured by Vince Ball.

[03:08] Team_054 possession (Score: 18-18)
Blake Russell attempts a Midrange. Contested by Jalen Reaves (5.6 feet, MAN). Blake Russell misses. Rebound secured by Jalen Reaves.

[02:56] Team_062 possession (Score: 18-18)
Jalen Reaves drives and kicks out. Chris Bird attempts a 3Pt. Contested by Malcolm Harden (4.3 feet, MAN). Chris Bird misses. Rebound secured by Blake Russell.

[02:39] Team_054 possession (Score: 18-18)
Lauri Irving attempts a 3Pt. Contested by RJ Williamson (5.1 feet, ZONE). Lauri Irving misses. Rebound secured by Michael Hyland.

[02:27] Team_062 possession (Score: 18-18)
Chris Bird loses the ball! Stripped by Malcolm Harden! TURNOVER! (live ball)

[02:13] Team_054 possession (Score: 18-18)
Vince Ball drives and kicks out. Luka Brogdon attempts a 3Pt. Contested by Kawhi Thompson (5.1 feet, MAN). Luka Brogdon misses. Rebound secured by Jalen Reaves.

[02:02] Team_062 possession (Score: 18-18)
RJ Williamson attempts a 3Pt. Contested by Lauri Irving (3.4 feet, ZONE). RJ Williamson misses. Rebound secured by Luka Brogdon.

[01:46] Team_054 possession (Score: 18-18)
Vince Ball attempts a 3Pt. Contested by Michael Hyland (5.1 feet, MAN). VINCE BALL MAKES IT! Assist: Malcolm Harden
Score: 18-21

[01:29] Team_062 possession (Score: 18-21)
Chris Bird drives to the basket... Chris Bird loses control! Ball rolls out of bounds! TURNOVER! (dead ball)

[01:29] Substitution (Team_062): Chris Bird OUT → Paolo McCollum IN (stamina_rule2)

[01:29] Substitution (Team_062): RJ Williamson OUT → Tony LaVine IN (stamina_rule2)

[01:29] Substitution (Team_062): Michael Hyland OUT → Paul Poole IN (stamina_rule2)

[01:29] Substitution (Team_062): Kawhi Thompson OUT → RJ Wall IN (stamina_rule2)

[01:29] Substitution (Team_062): Jalen Reaves OUT → Devin Young IN (stamina_rule2)

[01:29] Substitution (Team_054): Malcolm Harden OUT → Shaquille Irving IN (stamina_rule2)

[01:29] Substitution (Team_054): Lauri Irving OUT → Bradley Quickley IN (stamina_rule2)

[01:29] Substitution (Team_054): Luka Brogdon OUT → Tobias Nowitzki IN (stamina_rule2)

[01:29] Substitution (Team_054): Blake Russell OUT → Devin Jackson IN (stamina_rule2)

[01:15] Team_054 possession (Score: 18-21)
Shaquille Irving drives to the basket... Shaquille Irving throws a bad pass! Stolen by RJ Wall! TURNOVER! (live ball)

[01:00] Team_062 possession (Score: 18-21)
RJ Wall drives, Tobias Nowitzki stays with him. RJ Wall attempts a Layup. Contested by Tobias Nowitzki (5.6 feet, MAN). RJ WALL MAKES IT!
Score: 20-21

[00:46] Team_054 possession (Score: 20-21)
Devin Jackson attempts a Layup. Wide open! Devin Young is 6.1 feet away. [MAN] DEVIN JACKSON MAKES IT! Assist: Tobias Nowitzki
Score: 20-23

[00:33] Team_062 possession (Score: 20-23)
Paul Poole attempts a 3Pt. Contested by Shaquille Irving (4.7 feet, ZONE). PAUL POOLE MAKES IT!
Score: 23-23

[00:15] Team_054 possession (Score: 23-23)
Shaquille Irving attempts a Layup. Contested by RJ Wall (5.6 feet, ZONE). SHAQUILLE IRVING MAKES IT! Assist: Devin Jackson
Score: 23-25

================================================================================
                              1ST QUARTER COMPLETE                              
================================================================================

1ST QUARTER SCORE: Team_062 23, Team_054 25

BOX SCORE:
================================================================================

Team_062
--------------------------------------------------------------------------------
Player                MIN  PTS  REB  AST  TO      FG   FG%      3P   3P%
--------------------------------------------------------------------------------
Chris Bird             11    8    0    0   0   3/6    50.0     0/0   0.0
Jalen Reaves           11    7    6    0   0   3/6    50.0     0/0   0.0
Michael Hyland         11    3    3    0   0   1/2    50.0     0/0   0.0
Paul Poole              1    3    0    0   0   1/1   100.0     0/0   0.0
RJ Wall                 1    2    0    0   0   1/1   100.0     0/0   0.0
Kawhi Thompson         11    0    2    1   0   0/1     0.0     0/0   0.0
RJ Williamson          11    0    0    1   0   0/2     0.0     0/0   0.0

TEAM: FG: 9/19 (47.4%), 3PT: 3/6 (50.0%), REB: 11 (4 off, 7 def), AST: 2, TO: 2
TEAM FOULS: 6 [Team_054 in BONUS]


Team_054
--------------------------------------------------------------------------------
Player                MIN  PTS  REB  AST  TO      FG   FG%      3P   3P%
--------------------------------------------------------------------------------
Malcolm Harden         11    6    0    1   0   2/3    66.7     0/0   0.0
Vince Ball             12    6    1    1   0   2/3    66.7     0/0   0.0
Blake Russell          11    5    3    0   0   2/5    40.0     0/0   0.0
Luka Brogdon           11    2    5    0   0   1/2    50.0     0/0   0.0
Lauri Irving           11    2    2    1   0   1/2    50.0     0/0   0.0
Devin Jackson           1    2    0    1   0   1/1   100.0     0/0   0.0
Shaquille Irving        1    2    0    0   0   1/1   100.0     0/0   0.0
Tobias Nowitzki         1    0    0    1   0   0/0     0.0     0/0   0.0

TEAM: FG: 10/17 (58.8%), 3PT: 2/4 (50.0%), REB: 11 (1 off, 10 def), AST: 5, TO: 4
TEAM FOULS: 5 [Team_062 in BONUS]

================================================================================

================================================================================
                       2ND QUARTER - Team_062 vs Team_054                       
================================================================================

[12:00] Team_062 possession (Score: 23-25)
Jalen Reaves attempts a Midrange. Contested by Blake Russell (3.4 feet, MAN). Jalen Reaves misses. Rebound secured by Luka Brogdon.

[11:50] Team_054 possession (Score: 23-25)
Luka Brogdon attempts a Midrange. Contested by RJ Williamson (4.8 feet, ZONE). Luka Brogdon misses. Rebound secured by Michael Hyland.

[11:35] Team_062 possession (Score: 23-25)
Chris Bird attempts a Midrange. Contested by Luka Brogdon (4.2 feet, ZONE). Chris Bird misses. Rebound secured by Lauri Irving.

[11:20] Team_054 possession (Score: 23-25)
Luka Brogdon drives, Kawhi Thompson stays with him. Luka Brogdon attempts a Dunk. Contested by Kawhi Thompson (5.3 feet, MAN). LUKA BROGDON MAKES IT! Assist: Lauri Irving
Score: 23-27

[11:05] Team_062 possession (Score: 23-27)
Kawhi Thompson attempts a Midrange. Contested by Luka Brogdon (4.1 feet, MAN). KAWHI THOMPSON MAKES IT! Assist: Jalen Reaves
Score: 25-27

[10:53] Team_054 possession (Score: 25-27)
Blake Russell drives, Jalen Reaves stays with him. Blake Russell attempts a Layup. Contested by Jalen Reaves (5.6 feet, ZONE). BLAKE RUSSELL MAKES IT!
Score: 25-29

[10:37] Team_062 possession (Score: 25-29)
Chris Bird attempts a Layup. BLOCKED BY MALCOLM HARDEN! Ball is loose! Rebound secured by Blake Russell.

[10:22] Team_054 possession (Score: 25-29)
Vince Ball loses control! Ball rolls out of bounds! TURNOVER! (dead ball)

[10:22] Substitution (Team_062): Chris Bird OUT → Paolo McCollum IN (stamina_rule2)

[10:22] Substitution (Team_062): RJ Williamson OUT → Tony LaVine IN (stamina_rule2)

[10:22] Substitution (Team_062): Michael Hyland OUT → Paul Poole IN (stamina_rule2)

[10:22] Substitution (Team_062): Kawhi Thompson OUT → RJ Wall IN (stamina_rule2)

[10:22] Substitution (Team_062): Jalen Reaves OUT → Devin Young IN (stamina_rule2)

[10:22] Substitution (Team_054): Malcolm Harden OUT → Shaquille Irving IN (stamina_rule2)

[10:22] Substitution (Team_054): Vince Ball OUT → Vince James IN (stamina_rule2)

[10:22] Substitution (Team_054): Blake Russell OUT → Devin Jackson IN (stamina_rule2)

[10:10] Team_062 possession (Score: 25-29)
Devin Young attempts a Layup. Contested by Devin Jackson (5.7 feet, MAN). Devin Young misses. Rebound secured by Lauri Irving.

[09:55] Team_054 possession (Score: 25-29)
Vince James drives, Paul Poole stays with him. Vince James attempts a Layup. Wide open! Paul Poole is 7.0 feet away. [MAN] VINCE JAMES MAKES IT! Assist: Shaquille Irving
Score: 25-31

[09:38] Team_062 possession (Score: 25-31)
Paolo McCollum attempts a 3Pt. Contested by Shaquille Irving (4.8 feet, ZONE). Paolo McCollum misses. Offensive rebound by RJ Wall! RJ Wall kicks it out.

[09:23] Team_062 possession (Score: 25-31)
FOUL! Holding foul on Devin Jackson. [Team fouls: 1] No free throws, side out. (Devin Jackson: 1 personal fouls)

[09:08] Team_062 possession (Score: 25-31)
RJ Wall attempts a Midrange. Contested by Luka Brogdon (4.2 feet, MAN). RJ WALL MAKES IT! Assist: Devin Young
Score: 27-31

[08:50] Team_054 possession (Score: 27-31)
Vince James drives and kicks out. Vince James attempts a Midrange. Wide open! Paul Poole is 6.3 feet away. [MAN] VINCE JAMES MAKES IT!
Score: 27-33

[08:35] Team_062 possession (Score: 27-33)
Paolo McCollum throws a bad pass! Stolen by Shaquille Irving! TURNOVER! (live ball)

[08:23] Team_054 possession (Score: 27-33)
FOUL! Reach-in foul on RJ Wall during the drive. [Team fouls: 1] No free throws, side out. (RJ Wall: 1 personal fouls)

[08:13] Team_054 possession (Score: 27-33)
Shaquille Irving attempts a Midrange. Wide open! Paul Poole is 6.8 feet away. [ZONE] Shaquille Irving misses. Rebound secured by Devin Young.

[07:54] Team_062 possession (Score: 27-33)
Paul Poole drives and kicks out. Tony LaVine attempts a Midrange. Contested by Lauri Irving (4.0 feet, ZONE). TONY LAVINE MAKES IT! Assist: RJ Wall
Score: 29-33

[07:40] Team_054 possession (Score: 29-33)
Luka Brogdon drives and kicks out. Lauri Irving attempts a 3Pt. Contested by Paolo McCollum (5.6 feet, ZONE). Lauri Irving misses. FOUL! Loose ball foul on Paul Poole during the rebound battle. [Team fouls: 2] No free throws, side out. (Paul Poole: 1 personal fouls)

[07:27] Team_054 possession (Score: 29-33)
Devin Jackson drives to the basket... Devin Jackson throws a bad pass! Stolen by RJ Wall! TURNOVER! (live ball)

[07:13] Team_062 possession (Score: 29-33)
RJ Wall makes the Layup and draws the foul on Lauri Irving! And-1! RJ Wall to the line for 1. [Team fouls: 2] (Lauri Irving: 1 personal fouls)   FT 1/1: GOOD RJ Wall makes 1/1 from the line.
Score: 32-33

[07:00] Team_054 possession (Score: 32-33)
Vince James drives, picks up Paul Poole. Help arrives from Paolo McCollum! Vince James attempts a Dunk. Wide open! Paolo McCollum is 7.0 feet away. [MAN] VINCE JAMES MAKES IT! Assist: Shaquille Irving
Score: 32-35

[06:48] Team_062 possession (Score: 32-35)
Paul Poole attempts a Layup. BLOCKED BY VINCE JAMES! Ball is loose! Offensive rebound by Devin Young! Devin Young kicks it out.

[06:36] Team_062 possession (Score: 32-35)
Tony LaVine throws a bad pass out of bounds! TURNOVER! (dead ball)

[06:36] Substitution (Team_054): Lauri Irving OUT → Bradley Quickley IN (stamina_rule2)

[06:36] Substitution (Team_054): Luka Brogdon OUT → Tobias Nowitzki IN (stamina_rule2)

[06:20] Team_054 possession (Score: 32-35)
Bradley Quickley drives to the basket... Bradley Quickley throws a bad pass out of bounds! TURNOVER! (dead ball)

[06:07] Team_062 possession (Score: 32-35)
Devin Young attempts a Layup. BLOCKED BY BRADLEY QUICKLEY! Ball is loose! Rebound secured by Devin Jackson.

[05:53] Team_054 possession (Score: 32-35)
Devin Jackson attempts a Midrange. Wide open! Devin Young is 6.1 feet away. [MAN] DEVIN JACKSON MAKES IT!
Score: 32-37

[05:38] Team_062 possession (Score: 32-37)
Paolo McCollum attempts a 3Pt. Contested by Shaquille Irving (4.8 feet, ZONE). Paolo McCollum misses. Offensive rebound by RJ Wall! RJ Wall kicks it out.

[05:27] Team_062 possession (Score: 32-37)
Tony LaVine attempts a Layup. Wide open! Tobias Nowitzki is 6.0 feet away. [ZONE] TONY LAVINE MAKES IT! Assist: Devin Young
Score: 34-37

[05:16] Team_054 possession (Score: 34-37)
Devin Jackson attempts a 3Pt. Contested by Paolo McCollum (5.7 feet, ZONE). Devin Jackson misses. Rebound secured by RJ Wall.

[05:01] Team_062 possession (Score: 34-37)
Paolo McCollum attempts a Midrange. Contested by Vince James (5.1 feet, ZONE). Paolo McCollum misses. Rebound secured by Vince James.

[04:47] Team_054 possession (Score: 34-37)
Shaquille Irving attempts a Midrange. Wide open! Devin Young is 6.5 feet away. [ZONE] SHAQUILLE IRVING MAKES IT!
Score: 34-39

[04:34] Team_062 possession (Score: 34-39)
FOUL! Holding foul on Vince James. [Team fouls: 3] No free throws, side out. (Vince James: 1 personal fouls)

[04:18] Team_062 possession (Score: 34-39)
Paul Poole attempts a Midrange. Contested by Vince James (4.9 feet, ZONE). Paul Poole misses. Rebound secured by Tobias Nowitzki.

[04:02] Team_054 possession (Score: 34-39)
Devin Jackson makes the 3Pt and draws the foul on Paolo McCollum! And-1! Devin Jackson to the line for 1. [Team fouls: 3] (Paolo McCollum: 1 personal fouls)   FT 1/1: GOOD Devin Jackson makes 1/1 from the line.
Score: 34-43

[03:47] Team_062 possession (Score: 34-43)
FOUL! Holding foul on Tobias Nowitzki. [Team fouls: 4] No free throws, side out. (Tobias Nowitzki: 1 personal fouls)

[03:35] Team_062 possession (Score: 34-43)
Tony LaVine attempts a 3Pt. Contested by Shaquille Irving (5.0 feet, ZONE). Tony LaVine misses. Rebound secured by Vince James.

[03:18] Team_054 possession (Score: 34-43)
FOUL! Holding foul on Paul Poole. [Team fouls: 4] No free throws, side out. (Paul Poole: 2 personal fouls)

[03:04] Team_054 possession (Score: 34-43)
Vince James attempts a Layup. Wide open! Devin Young is 6.9 feet away. [ZONE] VINCE JAMES MAKES IT!
Score: 34-45

[02:49] Team_062 possession (Score: 34-45)
FOUL! Shooting foul on Vince James. Devin Young to the line for 2 free throws. [BONUS: 5 team fouls] (Vince James: 2 personal fouls)   FT 1/2: GOOD   FT 2/2: MISS Devin Young makes 1/2 from the line. Rebound secured by Devin Jackson.
Score: 35-45

[02:33] Team_054 possession (Score: 35-45)
Vince James attempts a Midrange. Wide open! Tony LaVine is 6.8 feet away. [ZONE] Vince James misses. Rebound secured by Paul Poole.

[02:18] Team_062 possession (Score: 35-45)
Paolo McCollum attempts a Layup. Contested by Tobias Nowitzki (5.9 feet, ZONE). PAOLO MCCOLLUM MAKES IT! Assist: RJ Wall
Score: 37-45

[02:01] Team_054 possession (Score: 37-45)
Tobias Nowitzki attempts a Midrange. Contested by RJ Wall (5.4 feet, MAN). Tobias Nowitzki misses. Rebound secured by RJ Wall.

[01:49] Team_062 possession (Score: 37-45)
Paolo McCollum attempts a Midrange. Contested by Shaquille Irving (5.0 feet, MAN). PAOLO MCCOLLUM MAKES IT!
Score: 39-45

[01:35] Team_054 possession (Score: 39-45)
Devin Jackson makes the Midrange and draws the foul on RJ Wall! And-1! Devin Jackson to the line for 1. [BONUS: 5 team fouls] (RJ Wall: 2 personal fouls)   FT 1/1: GOOD Devin Jackson makes 1/1 from the line.
Score: 39-48

[01:23] Team_062 possession (Score: 39-48)
Devin Young throws a bad pass out of bounds! TURNOVER! (dead ball)

[01:07] Team_054 possession (Score: 39-48)
Tobias Nowitzki drives, RJ Wall stays with him. Tobias Nowitzki attempts a Layup. Contested by RJ Wall (5.5 feet, MAN). Tobias Nowitzki misses. Offensive rebound by Tobias Nowitzki! Tobias Nowitzki kicks it out.

[00:52] Team_054 possession (Score: 39-48)
Vince James drives, RJ Wall stays with him. Vince James attempts a Dunk. Wide open! RJ Wall is 6.2 feet away. [ZONE] VINCE JAMES MAKES IT! Assist: Shaquille Irving
Score: 39-50

[00:41] Team_062 possession (Score: 39-50)
Devin Young attempts a Midrange. Wide open! Tobias Nowitzki is 6.0 feet away. [ZONE] DEVIN YOUNG MAKES IT!
Score: 41-50

[00:29] Team_054 possession (Score: 41-50)
Tobias Nowitzki attempts a 3Pt. Wide open! Paul Poole is 6.6 feet away. [ZONE] TOBIAS NOWITZKI MAKES IT! Assist: Shaquille Irving
Score: 41-53

[00:12] Team_062 possession (Score: 41-53)
RJ Wall attempts a Layup. Contested by Tobias Nowitzki (5.6 feet, MAN). RJ Wall misses. Offensive rebound by Devin Young! Devin Young kicks it out.

================================================================================
                              2ND QUARTER COMPLETE                              
================================================================================

2ND QUARTER SCORE: Team_062 18, Team_054 28

BOX SCORE:
================================================================================

Team_062
--------------------------------------------------------------------------------
Player                MIN  PTS  REB  AST  TO      FG   FG%      3P   3P%
--------------------------------------------------------------------------------
RJ Wall                11    5    4    2   0   2/2   100.0     0/0   0.0
Tony LaVine            11    4    0    0   0   2/3    66.7     0/0   0.0
Paolo McCollum         11    4    0    0   0   2/3    66.7     0/0   0.0
Kawhi Thompson         13    2    0    0   0   1/1   100.0     0/0   0.0
Devin Young            11    2    3    2   0   1/4    25.0     0/0   0.0
Jalen Reaves           13    0    0    1   0   0/1     0.0     0/0   0.0
Michael Hyland         13    0    1    0   0   0/0     0.0     0/0   0.0
Chris Bird             13    0    0    0   0   0/2     0.0     0/0   0.0
Paul Poole             11    0    1    0   0   0/1     0.0     0/0   0.0

TEAM: FG: 8/17 (47.1%), 3PT: 0/1 (0.0%), REB: 9 (4 off, 5 def), AST: 5, TO: 3
TEAM FOULS: 5 [Team_054 in BONUS]


Team_054
--------------------------------------------------------------------------------
Player                MIN  PTS  REB  AST  TO      FG   FG%      3P   3P%
--------------------------------------------------------------------------------
Vince James            10   10    2    0   0   5/6    83.3     0/0   0.0
Devin Jackson          11    9    2    0   0   3/4    75.0     0/0   0.0
Tobias Nowitzki         8    3    2    0   0   1/2    50.0     0/0   0.0
Luka Brogdon           16    2    1    0   0   1/2    50.0     0/0   0.0
Blake Russell          13    2    1    0   0   1/1   100.0     0/0   0.0
Shaquille Irving       11    2    0    4   0   1/2    50.0     0/0   0.0
Lauri Irving           16    0    3    1   0   0/0     0.0     0/0   0.0

TEAM: FG: 12/17 (70.6%), 3PT: 2/3 (66.7%), REB: 11 (2 off, 9 def), AST: 5, TO: 3
TEAM FOULS: 5 [Team_062 in BONUS]

================================================================================

================================================================================
                       3RD QUARTER - Team_062 vs Team_054                       
================================================================================

[12:00] Team_062 possession (Score: 41-53)
Jalen Reaves drives, Blake Russell stays with him. Jalen Reaves attempts a Layup. Contested by Blake Russell (3.2 feet, MAN). Jalen Reaves misses. Rebound secured by Luka Brogdon.

[11:47] Team_054 possession (Score: 41-53)
FOUL! Shooting foul on Jalen Reaves. Blake Russell to the line for 2 free throws. [Team fouls: 1] (Jalen Reaves: 1 personal fouls)   FT 1/2: GOOD   FT 2/2: GOOD Blake Russell makes 2/2 from the line.
Score: 41-55

[11:32] Team_062 possession (Score: 41-55)
RJ Williamson attempts a Midrange. Contested by Vince Ball (3.8 feet, ZONE). RJ WILLIAMSON MAKES IT!
Score: 43-55

[11:18] Team_054 possession (Score: 43-55)
Vince Ball attempts a 3Pt. Contested by RJ Williamson (4.5 feet, ZONE). Vince Ball misses. Offensive rebound by Blake Russell! Blake Russell's putback is no good. Rebound secured by Jalen Reaves.

[11:01] Team_062 possession (Score: 43-55)
RJ Williamson attempts a 3Pt. Contested by Lauri Irving (3.1 feet, ZONE). RJ WILLIAMSON MAKES IT!
Score: 46-55

[10:45] Team_054 possession (Score: 46-55)
Luka Brogdon attempts a 3Pt. Contested by RJ Williamson (4.7 feet, ZONE). LUKA BROGDON MAKES IT! Assist: Vince Ball
Score: 46-58

[10:26] Team_062 possession (Score: 46-58)
Kawhi Thompson attempts a Midrange. Contested by Luka Brogdon (4.0 feet, MAN). Kawhi Thompson misses. Rebound secured by Luka Brogdon.

[10:12] Team_054 possession (Score: 46-58)
Vince Ball drives to the basket... Vince Ball loses the ball! Stripped by Michael Hyland! TURNOVER! (live ball)

[09:55] Team_062 possession (Score: 46-58)
RJ Williamson attempts a 3Pt. Contested by Malcolm Harden (3.9 feet, ZONE). RJ Williamson misses. Rebound secured by Blake Russell.

[09:40] Team_054 possession (Score: 46-58)
Blake Russell attempts a Midrange. Contested by Michael Hyland (5.1 feet, ZONE). BLAKE RUSSELL MAKES IT!
Score: 46-60

[09:24] Team_062 possession (Score: 46-60)
Chris Bird attempts a Midrange. Contested by Luka Brogdon (4.2 feet, ZONE). Chris Bird misses. Rebound secured by Lauri Irving.

[09:05] Team_054 possession (Score: 46-60)
FOUL! Reach-in foul on Kawhi Thompson during the drive. [Team fouls: 2] No free throws, side out. (Kawhi Thompson: 1 personal fouls)

[08:52] Team_054 possession (Score: 46-60)
Lauri Irving attempts a 3Pt. Contested by RJ Williamson (4.9 feet, MAN). LAURI IRVING MAKES IT! Assist: Vince Ball
Score: 46-63

[08:42] Team_062 possession (Score: 46-63)
Chris Bird attempts a Layup. BLOCKED BY MALCOLM HARDEN! Ball deflects out of bounds off Chris Bird.

[08:28] Team_054 possession (Score: 46-63)
Lauri Irving attempts a 3Pt. Contested by RJ Williamson (4.9 feet, MAN). Lauri Irving misses. Offensive rebound by Luka Brogdon! Luka Brogdon kicks it out.

[08:11] Team_054 possession (Score: 46-63)
Malcolm Harden drives to the basket... Malcolm Harden loses control! Ball rolls out of bounds! TURNOVER! (dead ball)

[07:59] Team_062 possession (Score: 46-63)
Chris Bird attempts a 3Pt. Contested by Lauri Irving (3.6 feet, ZONE). Chris Bird misses. Offensive rebound by Jalen Reaves! Jalen Reaves's putback is no good. Rebound secured by Luka Brogdon.

[07:44] Team_054 possession (Score: 46-63)
FOUL! Reach-in foul on Michael Hyland during the drive. [Team fouls: 3] No free throws, side out. (Michael Hyland: 1 personal fouls)

[07:29] Team_054 possession (Score: 46-63)
FOUL! Shooting foul on Kawhi Thompson. Malcolm Harden to the line for 2 free throws. [Team fouls: 4] (Kawhi Thompson: 2 personal fouls)   FT 1/2: GOOD   FT 2/2: MISS Malcolm Harden makes 1/2 from the line. Rebound secured by Kawhi Thompson.
Score: 46-64

[07:13] Team_062 possession (Score: 46-64)
Michael Hyland drives and kicks out. RJ Williamson attempts a Midrange. Contested by Lauri Irving (3.4 feet, MAN). RJ Williamson misses. Offensive rebound by Kawhi Thompson! Kawhi Thompson kicks it out.

[06:58] Team_062 possession (Score: 46-64)
Kawhi Thompson makes the Midrange and draws the foul on Luka Brogdon! And-1! Kawhi Thompson to the line for 1. [Team fouls: 1] (Luka Brogdon: 1 personal fouls)   FT 1/1: GOOD Kawhi Thompson makes 1/1 from the line.
Score: 49-64

[06:44] Team_054 possession (Score: 49-64)
Blake Russell throws a bad pass! Stolen by Jalen Reaves! TURNOVER! (live ball)

[06:32] Team_062 possession (Score: 49-64)
Kawhi Thompson drives and kicks out. Jalen Reaves attempts a Midrange. Contested by Blake Russell (3.0 feet, MAN). JALEN REAVES MAKES IT!
Score: 51-64

[06:19] Team_054 possession (Score: 51-64)
Lauri Irving attempts a Midrange. Contested by RJ Williamson (4.9 feet, MAN). LAURI IRVING MAKES IT!
Score: 51-66

[06:06] Team_062 possession (Score: 51-66)
Michael Hyland throws a bad pass! Stolen by Vince Ball! TURNOVER! (live ball)

[05:48] Team_054 possession (Score: 51-66)
Malcolm Harden attempts a Layup. Contested by Chris Bird (4.5 feet, MAN). MALCOLM HARDEN MAKES IT! Assist: Blake Russell
Score: 51-68

[05:37] Team_062 possession (Score: 51-68)
Chris Bird attempts a Midrange. Contested by Vince Ball (4.3 feet, ZONE). Chris Bird misses. Rebound secured by Luka Brogdon.

[05:20] Team_054 possession (Score: 51-68)
Blake Russell drives and kicks out. FOUL! Shooting foul on Jalen Reaves. Blake Russell to the line for 3 free throws. [BONUS: 5 team fouls] (Jalen Reaves: 2 personal fouls)   FT 1/3: GOOD   FT 2/3: GOOD   FT 3/3: GOOD Blake Russell makes 3/3 from the line.
Score: 51-71

[05:04] Team_062 possession (Score: 51-71)
Michael Hyland attempts a 3Pt. Contested by Vince Ball (4.0 feet, MAN). Michael Hyland misses. Rebound secured by Lauri Irving.

[04:49] Team_054 possession (Score: 51-71)
Luka Brogdon throws a bad pass! Stolen by Kawhi Thompson! TURNOVER! (live ball)

[04:37] Team_062 possession (Score: 51-71)
FOUL! Holding foul on Malcolm Harden. [Team fouls: 2] No free throws, side out. (Malcolm Harden: 1 personal fouls)

[04:20] Team_062 possession (Score: 51-71)
Michael Hyland attempts a 3Pt. Contested by Malcolm Harden (4.1 feet, ZONE). MICHAEL HYLAND MAKES IT! Assist: Kawhi Thompson
Score: 54-71

[04:04] Team_054 possession (Score: 54-71)
Luka Brogdon drives to the basket... Luka Brogdon loses the ball! Stripped by Kawhi Thompson! TURNOVER! (live ball)

[03:49] Team_062 possession (Score: 54-71)
RJ Williamson attempts a Midrange. Contested by Lauri Irving (3.2 feet, MAN). RJ WILLIAMSON MAKES IT!
Score: 56-71

[03:36] Team_054 possession (Score: 56-71)
Luka Brogdon loses control! Ball rolls out of bounds! TURNOVER! (dead ball)

[03:24] Team_062 possession (Score: 56-71)
Kawhi Thompson throws a bad pass! Stolen by Luka Brogdon! TURNOVER! (live ball)

[03:10] Team_054 possession (Score: 56-71)
FOUL! Offensive foul on Vince Ball! Michael Hyland drew the charge! [Team fouls: 3] (Vince Ball: 1 personal fouls) TURNOVER! (dead ball)

[02:54] Team_062 possession (Score: 56-71)
FOUL! Offensive foul on Jalen Reaves! Blake Russell drew the charge! [Team fouls: 6] (Jalen Reaves: 3 personal fouls) TURNOVER! (dead ball)

[02:43] Team_054 possession (Score: 56-71)
Lauri Irving attempts a 3Pt. Contested by RJ Williamson (5.1 feet, MAN). Lauri Irving misses. Rebound secured by Michael Hyland.

[02:27] Team_062 possession (Score: 56-71)
Kawhi Thompson attempts a 3Pt. Contested by Luka Brogdon (4.2 feet, MAN). Kawhi Thompson misses. Rebound secured by Blake Russell.

[02:09] Team_054 possession (Score: 56-71)
Blake Russell attempts a Layup. Contested by Jalen Reaves (5.6 feet, MAN). BLAKE RUSSELL MAKES IT!
Score: 56-73

[01:55] Team_062 possession (Score: 56-73)
Kawhi Thompson attempts a 3Pt. Contested by Lauri Irving (3.7 feet, ZONE). Kawhi Thompson misses. Offensive rebound by Kawhi Thompson! Kawhi Thompson kicks it out.

[01:40] Team_062 possession (Score: 56-73)
Jalen Reaves attempts a Layup. Contested by Blake Russell (3.6 feet, MAN). Jalen Reaves misses. Rebound secured by Luka Brogdon.

[01:28] Team_054 possession (Score: 56-73)
Lauri Irving drives and kicks out. Blake Russell attempts a 3Pt. Contested by Jalen Reaves (5.3 feet, MAN). Blake Russell misses. Offensive rebound by Luka Brogdon! Luka Brogdon kicks it out.

[01:15] Team_054 possession (Score: 56-73)
Vince Ball drives and kicks out. FOUL! Shooting foul on Michael Hyland. Vince Ball to the line for 2 free throws. [BONUS: 7 team fouls] (Michael Hyland: 2 personal fouls)   FT 1/2: GOOD   FT 2/2: GOOD Vince Ball makes 2/2 from the line.
Score: 56-75

[01:00] Team_062 possession (Score: 56-75)
Michael Hyland attempts a 3Pt. Contested by Lauri Irving (3.7 feet, ZONE). Michael Hyland misses. Offensive rebound by Jalen Reaves! Jalen Reaves kicks it out.

[00:45] Team_062 possession (Score: 56-75)
Michael Hyland attempts a Midrange. Contested by Vince Ball (4.3 feet, MAN). MICHAEL HYLAND MAKES IT! Assist: RJ Williamson
Score: 58-75

[00:32] Team_054 possession (Score: 58-75)
Blake Russell drives, picks up Jalen Reaves. Help arrives from Chris Bird! Blake Russell attempts a Layup. Contested by Chris Bird (5.8 feet, ZONE). BLAKE RUSSELL MAKES IT! Assist: Vince Ball
Score: 58-77

[00:17] Team_062 possession (Score: 58-77)
Chris Bird attempts a Layup. Contested by Malcolm Harden (4.8 feet, MAN). Chris Bird misses. Rebound secured by Blake Russell.

[00:03] Team_054 possession (Score: 58-77)
Luka Brogdon attempts a 3Pt. BLOCKED BY KAWHI THOMPSON! Ball is loose! Offensive rebound by Luka Brogdon! Luka Brogdon kicks it out.

================================================================================
                              3RD QUARTER COMPLETE                              
================================================================================

3RD QUARTER SCORE: Team_062 17, Team_054 24

BOX SCORE:
================================================================================

Team_062
--------------------------------------------------------------------------------
Player                MIN  PTS  REB  AST  TO      FG   FG%      3P   3P%
--------------------------------------------------------------------------------
RJ Williamson          25    7    0    1   0   3/4    75.0     0/0   0.0
Michael Hyland         25    5    1    0   0   2/3    66.7     0/0   0.0
Kawhi Thompson         25    3    3    1   0   1/3    33.3     0/0   0.0
Jalen Reaves           25    2    2    0   0   1/3    33.3     0/0   0.0
Chris Bird             25    0    0    0   0   0/5     0.0     0/0   0.0

TEAM: FG: 7/18 (38.9%), 3PT: 2/6 (33.3%), REB: 6 (4 off, 2 def), AST: 2, TO: 3
TEAM FOULS: 7 [Team_054 in BONUS]


Team_054
--------------------------------------------------------------------------------
Player                MIN  PTS  REB  AST  TO      FG   FG%      3P   3P%
--------------------------------------------------------------------------------
Blake Russell          25   11    3    1   0   5/5   100.0     0/0   0.0
Lauri Irving           29    5    2    0   0   2/3    66.7     0/0   0.0
Luka Brogdon           29    3    8    0   0   1/1   100.0     0/0   0.0
Vince Ball             26    2    0    3   0   1/2    50.0     0/0   0.0
Malcolm Harden         25    2    0    0   0   1/2    50.0     0/0   0.0

TEAM: FG: 10/13 (76.9%), 3PT: 2/4 (50.0%), REB: 13 (4 off, 9 def), AST: 4, TO: 7
TEAM FOULS: 3

================================================================================

================================================================================
                       4TH QUARTER - Team_062 vs Team_054                       
================================================================================

[12:00] Substitution (Team_062): Chris Bird OUT (stamina: 69) → Paolo McCollum IN (comeback_detected)

[12:00] Substitution (Team_054): Malcolm Harden OUT (stamina: 70) → Shaquille Irving IN (comeback_detected)

[12:00] Team_062 possession (Score: 58-77)
RJ Williamson attempts a 3Pt. Contested by Lauri Irving (3.4 feet, MAN). RJ WILLIAMSON MAKES IT! Assist: Michael Hyland
Score: 61-77

[11:48] Team_054 possession (Score: 61-77)
Vince Ball makes the Dunk and draws the foul on Paolo McCollum! And-1! Vince Ball to the line for 1. [Team fouls: 1] (Paolo McCollum: 1 personal fouls)   FT 1/1: GOOD Vince Ball makes 1/1 from the line.
Score: 61-80

[11:38] Team_062 possession (Score: 61-80)
Michael Hyland attempts a 3Pt. Contested by Vince Ball (4.2 feet, MAN). Michael Hyland misses. Rebound secured by Blake Russell.

[11:18] Team_054 possession (Score: 61-80)
Blake Russell makes the Layup and draws the foul on Jalen Reaves! And-1! Blake Russell to the line for 1. [Team fouls: 2] (Jalen Reaves: 1 personal fouls)   FT 1/1: GOOD Blake Russell makes 1/1 from the line.
Score: 61-83

[11:07] Team_062 possession (Score: 61-83)
Kawhi Thompson drives and kicks out. Paolo McCollum attempts a 3Pt. Contested by Shaquille Irving (4.6 feet, MAN). Paolo McCollum misses. Rebound secured by Blake Russell.

[10:52] Team_054 possession (Score: 61-83)
FOUL! Offensive foul on Shaquille Irving! Paolo McCollum drew the charge! [Team fouls: 1] (Shaquille Irving: 1 personal fouls) TURNOVER! (dead ball)

[10:40] Team_062 possession (Score: 61-83)
Jalen Reaves attempts a Layup. BLOCKED BY BLAKE RUSSELL! Ball is loose! Offensive rebound by Kawhi Thompson! Kawhi Thompson kicks it out.

[10:28] Team_062 possession (Score: 61-83)
Jalen Reaves drives to the basket... Jalen Reaves loses the ball! Stripped by Blake Russell! TURNOVER! (live ball)

[10:11] Team_054 possession (Score: 61-83)
Shaquille Irving drives to the basket... FOUL! Offensive foul on Shaquille Irving! Jalen Reaves drew the charge! [Team fouls: 2] (Shaquille Irving: 2 personal fouls) TURNOVER! (dead ball)

[09:55] Team_062 possession (Score: 61-83)
Paolo McCollum attempts a 3Pt. Contested by Shaquille Irving (4.8 feet, MAN). PAOLO MCCOLLUM MAKES IT! Assist: Kawhi Thompson
Score: 64-83

[09:39] Team_054 possession (Score: 64-83)
Blake Russell loses the ball! Stripped by Jalen Reaves! TURNOVER! (live ball)

[09:23] Team_062 possession (Score: 64-83)
Jalen Reaves attempts a Layup. BLOCKED BY BLAKE RUSSELL! Ball is loose! Offensive rebound by Kawhi Thompson! Kawhi Thompson kicks it out.

[09:06] Team_062 possession (Score: 64-83)
Michael Hyland attempts a Layup. Contested by Vince Ball (4.5 feet, MAN). MICHAEL HYLAND MAKES IT! Assist: RJ Williamson
Score: 66-83

[08:52] Team_054 possession (Score: 66-83)
Luka Brogdon attempts a Layup. Contested by Kawhi Thompson (5.8 feet, MAN). LUKA BROGDON MAKES IT! Assist: Lauri Irving
Score: 66-85

[08:41] Team_062 possession (Score: 66-85)
Kawhi Thompson loses the ball! Stripped by Luka Brogdon! TURNOVER! (live ball)

[08:27] Team_054 possession (Score: 66-85)
Luka Brogdon attempts a 3Pt. Contested by Paolo McCollum (5.8 feet, ZONE). Luka Brogdon misses. Offensive rebound by Blake Russell! Blake Russell's putback is no good. Offensive rebound by Luka Brogdon! Luka Brogdon kicks it out.

[08:10] Team_054 possession (Score: 66-85)
Shaquille Irving drives, Jalen Reaves stays with him. Shaquille Irving attempts a Layup. Wide open! Jalen Reaves is 6.3 feet away. [ZONE] SHAQUILLE IRVING MAKES IT! Assist: Lauri Irving
Score: 66-87

[07:57] Team_062 possession (Score: 66-87)
RJ Williamson attempts a 3Pt. Contested by Lauri Irving (4.0 feet, MAN). RJ Williamson misses. Rebound secured by Luka Brogdon.

[07:47] Team_054 possession (Score: 66-87)
Lauri Irving attempts a 3Pt. Contested by RJ Williamson (5.6 feet, MAN). Lauri Irving misses. Rebound secured by Kawhi Thompson.

[07:31] Team_062 possession (Score: 66-87)
Kawhi Thompson attempts a Midrange. Contested by Luka Brogdon (4.7 feet, MAN). KAWHI THOMPSON MAKES IT! Assist: RJ Williamson
Score: 68-87

[07:15] Team_054 possession (Score: 68-87)
FOUL! Holding foul on Kawhi Thompson. [Team fouls: 3] No free throws, side out. (Kawhi Thompson: 1 personal fouls)

[07:04] Team_054 possession (Score: 68-87)
Lauri Irving attempts a 3Pt. Contested by Paolo McCollum (5.9 feet, ZONE). LAURI IRVING MAKES IT! Assist: Shaquille Irving
Score: 68-90

[06:46] Team_062 possession (Score: 68-90)
Michael Hyland attempts a Midrange. Contested by Vince Ball (4.7 feet, MAN). MICHAEL HYLAND MAKES IT! Assist: Paolo McCollum
Score: 70-90

[06:35] Team_054 possession (Score: 70-90)
Luka Brogdon attempts a Midrange. Wide open! Kawhi Thompson is 6.1 feet away. [MAN] LUKA BROGDON MAKES IT! Assist: Blake Russell
Score: 70-92

[06:16] Team_062 possession (Score: 70-92)
Jalen Reaves drives, picks up Blake Russell. Help arrives from Lauri Irving! Jalen Reaves attempts a Dunk. Contested by Lauri Irving (4.5 feet, ZONE). Jalen Reaves misses. Rebound secured by Vince Ball.

[06:05] Team_054 possession (Score: 70-92)
Luka Brogdon drives, Kawhi Thompson stays with him. Luka Brogdon attempts a Layup. Wide open! Kawhi Thompson is 6.1 feet away. [MAN] LUKA BROGDON MAKES IT! Assist: Blake Russell
Score: 70-94

[05:48] Team_062 possession (Score: 70-94)
RJ Williamson drives, picks up Blake Russell. Help arrives from Lauri Irving! RJ Williamson attempts a Dunk. Contested by Lauri Irving (4.2 feet, ZONE). RJ WILLIAMSON MAKES IT! Assist: Paolo McCollum
Score: 72-94

[05:34] Team_054 possession (Score: 72-94)
Lauri Irving attempts a Layup. Wide open! Jalen Reaves is 6.5 feet away. [ZONE] Lauri Irving misses. Rebound secured by Jalen Reaves.

[05:18] Team_062 possession (Score: 72-94)
Jalen Reaves attempts a Midrange. Contested by Blake Russell (4.7 feet, MAN). Jalen Reaves misses. Rebound secured by Blake Russell.

[05:05] Team_054 possession (Score: 72-94)
Vince Ball attempts a 3Pt. Contested by Paolo McCollum (5.6 feet, ZONE). Vince Ball misses. Rebound secured by Kawhi Thompson.

[04:53] Team_062 possession (Score: 72-94)
RJ Williamson attempts a 3Pt. Contested by Lauri Irving (4.5 feet, MAN). RJ Williamson misses. Rebound secured by Vince Ball.

[04:39] Team_054 possession (Score: 72-94)
Lauri Irving attempts a Midrange. Wide open! RJ Williamson is 6.0 feet away. [ZONE] LAURI IRVING MAKES IT! Assist: Blake Russell
Score: 72-96

[04:22] Team_062 possession (Score: 72-96)
FOUL! Holding foul on Luka Brogdon. [Team fouls: 3] No free throws, side out. (Luka Brogdon: 1 personal fouls)

[04:12] Team_062 possession (Score: 72-96)
FOUL! Shooting foul on Shaquille Irving. Paolo McCollum to the line for 2 free throws. [Team fouls: 4] (Shaquille Irving: 3 personal fouls)   FT 1/2: GOOD   FT 2/2: GOOD Paolo McCollum makes 2/2 from the line.
Score: 74-96

[03:54] Team_054 possession (Score: 74-96)
Shaquille Irving drives, Jalen Reaves stays with him. Shaquille Irving attempts a Layup. Wide open! Jalen Reaves is 6.9 feet away. [ZONE] Shaquille Irving misses. Offensive rebound by Blake Russell! Blake Russell kicks it out.

[03:41] Team_054 possession (Score: 74-96)
Luka Brogdon attempts a 3Pt. Wide open! RJ Williamson is 6.1 feet away. [ZONE] Luka Brogdon misses. Offensive rebound by Luka Brogdon! Luka Brogdon kicks it out.

[03:27] Team_054 possession (Score: 74-96)
Shaquille Irving loses the ball! Stripped by Paolo McCollum! TURNOVER! (live ball)

[03:13] Team_062 possession (Score: 74-96)
RJ Williamson drives, Blake Russell stays with him. RJ Williamson attempts a Dunk. Contested by Blake Russell (4.7 feet, ZONE). RJ Williamson misses. Rebound secured by Vince Ball.

[02:58] Team_054 possession (Score: 74-96)
Blake Russell drives to the basket... FOUL! Offensive foul on Blake Russell! Jalen Reaves drew the charge! [Team fouls: 5] (Blake Russell: 1 personal fouls) TURNOVER! (dead ball)

[02:48] Team_062 possession (Score: 74-96)
Jalen Reaves throws a bad pass out of bounds! TURNOVER! (dead ball)

[02:48] Substitution (Team_062): RJ Williamson OUT → Tony LaVine IN (stamina_rule2)

[02:48] Substitution (Team_062): Michael Hyland OUT → Paul Poole IN (stamina_rule2)

[02:48] Substitution (Team_062): Kawhi Thompson OUT → RJ Wall IN (stamina_rule2)

[02:48] Substitution (Team_062): Jalen Reaves OUT → Devin Young IN (stamina_rule2)

[02:48] Substitution (Team_054): Lauri Irving OUT → Bradley Quickley IN (stamina_rule2)

[02:48] Substitution (Team_054): Vince Ball OUT → Vince James IN (stamina_rule2)

[02:48] Substitution (Team_054): Luka Brogdon OUT → Tobias Nowitzki IN (stamina_rule2)

[02:48] Substitution (Team_054): Blake Russell OUT → Devin Jackson IN (stamina_rule2)

[02:36] Team_054 possession (Score: 74-96)
Shaquille Irving drives, Paolo McCollum stays with him. Shaquille Irving attempts a Layup. Wide open! Paolo McCollum is 6.3 feet away. [MAN] SHAQUILLE IRVING MAKES IT!
Score: 74-98

[02:21] Team_062 possession (Score: 74-98)
Devin Young attempts a Midrange. Contested by Vince James (5.3 feet, ZONE). DEVIN YOUNG MAKES IT! Assist: Tony LaVine
Score: 76-98

[02:07] Team_054 possession (Score: 76-98)
Bradley Quickley attempts a Layup. Contested by RJ Wall (4.9 feet, ZONE). Bradley Quickley misses. Rebound secured by Paul Poole.

[01:54] Team_062 possession (Score: 76-98)
Devin Young attempts a Midrange. Contested by Devin Jackson (5.7 feet, MAN). DEVIN YOUNG MAKES IT! Assist: Tony LaVine
Score: 78-98

[01:37] Team_054 possession (Score: 78-98)
Shaquille Irving attempts a 3Pt. Wide open! Paolo McCollum is 6.3 feet away. [ZONE] SHAQUILLE IRVING MAKES IT! Assist: Bradley Quickley
Score: 78-101

[01:24] Team_062 possession (Score: 78-101)
Paolo McCollum attempts a 3Pt. Contested by Shaquille Irving (5.1 feet, ZONE). Paolo McCollum misses. Rebound secured by Tobias Nowitzki.

[01:11] Team_054 possession (Score: 78-101)
FOUL! Holding foul on Tony LaVine. [Team fouls: 4] No free throws, side out. (Tony LaVine: 1 personal fouls)

[00:53] Team_054 possession (Score: 78-101)
Shaquille Irving drives to the basket... Shaquille Irving throws a bad pass out of bounds! TURNOVER! (dead ball)

[00:39] Team_062 possession (Score: 78-101)
Paul Poole attempts a Midrange. Contested by Bradley Quickley (4.2 feet, ZONE). PAUL POOLE MAKES IT! Assist: RJ Wall
Score: 80-101

[00:23] Team_054 possession (Score: 80-101)
Vince James attempts a 3Pt. Wide open! Paul Poole is 7.0 feet away. [MAN] VINCE JAMES MAKES IT! Assist: Bradley Quickley
Score: 80-104

[00:11] Team_062 possession (Score: 80-104)
RJ Wall attempts a Layup. Contested by Devin Jackson (5.2 feet, ZONE). RJ WALL MAKES IT! Assist: Paul Poole
Score: 82-104

================================================================================
                              4TH QUARTER COMPLETE                              
================================================================================

4TH QUARTER SCORE: Team_062 24, Team_054 27

BOX SCORE:
================================================================================

Team_062
--------------------------------------------------------------------------------
Player                MIN  PTS  REB  AST  TO      FG   FG%      3P   3P%
--------------------------------------------------------------------------------
RJ Williamson          34    5    0    2   0   2/5    40.0     0/0   0.0
Paolo McCollum         24    5    0    2   0   2/3    66.7     0/0   0.0
Michael Hyland         34    4    0    1   0   2/3    66.7     0/0   0.0
Devin Young            14    4    0    0   0   2/2   100.0     0/0   0.0
Kawhi Thompson         34    2    4    1   0   1/2    50.0     0/0   0.0
Paul Poole             14    2    1    1   0   1/1   100.0     0/0   0.0
RJ Wall                14    2    0    1   0   1/1   100.0     0/0   0.0
Jalen Reaves           34    0    1    0   0   0/2     0.0     0/0   0.0
Tony LaVine            14    0    0    2   0   0/0     0.0     0/0   0.0

TEAM: FG: 11/19 (57.9%), 3PT: 2/6 (33.3%), REB: 6 (2 off, 4 def), AST: 10, TO: 3
TEAM FOULS: 4


Team_054
--------------------------------------------------------------------------------
Player                MIN  PTS  REB  AST  TO      FG   FG%      3P   3P%
--------------------------------------------------------------------------------
Shaquille Irving       24    7    0    1   0   3/3   100.0     0/0   0.0
Luka Brogdon           38    6    3    0   0   3/3   100.0     0/0   0.0
Lauri Irving           38    5    0    2   0   2/4    50.0     0/0   0.0
Vince Ball             35    3    3    0   0   1/2    50.0     0/0   0.0
Blake Russell          34    3    4    3   0   1/1   100.0     0/0   0.0
Vince James            13    3    0    0   0   1/1   100.0     0/0   0.0
Bradley Quickley       10    0    0    2   0   0/1     0.0     0/0   0.0
Tobias Nowitzki        10    0    1    0   0   0/0     0.0     0/0   0.0

TEAM: FG: 11/15 (73.3%), 3PT: 3/5 (60.0%), REB: 11 (3 off, 8 def), AST: 8, TO: 6
TEAM FOULS: 5 [Team_062 in BONUS]

================================================================================

================================================================================
                               FULL GAME COMPLETE                               
================================================================================

FINAL SCORE: Team_062 82, Team_054 104

SCORING BY QUARTER:
--------------------------------------------------------------------------------
Team                     Q1     Q2     Q3     Q4    FINAL
--------------------------------------------------------------------------------
Team_062                 23     18     17     24       82
Team_054                 25     28     24     27      104
--------------------------------------------------------------------------------

FULL GAME BOX SCORE:
================================================================================

Team_062
--------------------------------------------------------------------------------
Player                MIN  PTS  REB  AST  TO      FG   FG%      3P   3P%      FT STL BLK
--------------------------------------------------------------------------------
RJ Williamson          34   12    0    4   0   5/11   45.5   2/7    28.6   0/0     0   0
Michael Hyland         34   12    5    1   1   5/8    62.5   1/3    33.3   1/1     1   0
Kawhi Thompson         34    7    9    3   2   4/8    50.0   0/1     0.0   1/1     3   1
Jalen Reaves           34    9    9    1   2   2/10   20.0   0/0     0.0   3/3     3   1
Chris Bird             25    8    0    0   2   4/14   28.6   2/4    50.0   0/0     0   0
Paolo McCollum         24    9    0    2   2   4/6    66.7   1/2    50.0   2/2     1   0
Tony LaVine            14    4    0    2   1   1/2    50.0   0/1     0.0   0/0     0   0
Paul Poole             14    5    2    1   0   3/4    75.0   1/1   100.0   0/0     0   0
RJ Wall                14    9    4    3   0   4/4   100.0   0/0     0.0   1/1     2   0
Devin Young            14    6    3    2   1   3/6    50.0   0/0     0.0   1/2     0   0

TEAM: FG: 35/73 (47.9%), 3PT: 7/19 (36.8%), REB: 32 (14 off, 18 def), AST: 19, TO: 11


Team_054
--------------------------------------------------------------------------------
Player                MIN  PTS  REB  AST  TO      FG   FG%      3P   3P%      FT STL BLK
--------------------------------------------------------------------------------
Lauri Irving           38   12    7    4   0   5/9    55.6   2/5    40.0   0/0     0   0
Luka Brogdon           38   13   17    0   6   5/7    71.4   1/1   100.0   2/2     2   0
Vince Ball             35   11    4    4   3   5/8    62.5   1/3    33.3   4/4     1   0
Blake Russell          34   21   11    4   3   9/12   75.0   0/0     0.0   7/7     1   2
Malcolm Harden         25    8    0    1   2   3/5    60.0   1/2    50.0   2/3     1   2
Shaquille Irving       24   11    0    5   4   5/6    83.3   1/1   100.0   0/0     1   0
Devin Jackson          14   11    2    1   2   4/5    80.0   1/2    50.0   2/2     0   0
Vince James            13   13    2    0   0   6/7    85.7   1/1   100.0   0/0     0   1
Bradley Quickley       10    0    0    2   0   0/1     0.0   0/0     0.0   0/0     0   1
Tobias Nowitzki        10    3    3    1   0   1/2    50.0   1/1   100.0   0/0     0   0

TEAM: FG: 43/62 (69.4%), 3PT: 9/16 (56.2%), REB: 46 (10 off, 36 def), AST: 22, TO: 20

================================================================================
