================================================================================
                        FULL GAME - Team_081 vs Team_046                        
================================================================================

================================================================================
                       1ST QUARTER - Team_081 vs Team_046                       
================================================================================

[12:00] Team_081 possession (Score: 0-0)
FOUL! Shooting foul on Victor Nowitzki. Bradley Leonard to the line for 2 free throws. [Team fouls: 1] (Victor Nowitzki: 1 personal fouls)   FT 1/2: MISS   FT 2/2: MISS Bradley Leonard makes 0/2 from the line. Rebound secured by Cade Wall.

[11:48] Team_046 possession (Score: 0-0)
Cade Wall attempts a Midrange. Contested by Bradley Leonard (4.3 feet, ZONE). Cade Wall misses. Rebound secured by Vince Adebayo.

[11:30] Team_081 possession (Score: 0-0)
Julius Durant drives to the basket... FOUL! Offensive foul on Julius Durant! Cade Wall drew the charge! [Team fouls: 1] (Julius Durant: 1 personal fouls) TURNOVER! (dead ball)

[11:15] Team_046 possession (Score: 0-0)
Victor Nowitzki attempts a 3Pt. Contested by Bradley Leonard (3.8 feet, MAN). Victor Nowitzki misses. Offensive rebound by Cade Wall! Cade Wall kicks it out.

[11:00] Team_046 possession (Score: 0-0)
FOUL! Shooting foul on Julius Durant. D'Angelo O'Neal to the line for 2 free throws. [Team fouls: 2] (Julius Durant: 2 personal fouls)   FT 1/2: GOOD   FT 2/2: GOOD D'Angelo O'Neal makes 2/2 from the line.
Score: 0-2

[10:42] Team_081 possession (Score: 0-2)
Vince Adebayo drives, picks up Lauri Carter. Help arrives from D'Angelo O'Neal! Vince Adebayo attempts a Layup. Contested by D'Angelo O'Neal (3.3 feet, MAN). VINCE ADEBAYO MAKES IT! Assist: Bradley Leonard
Score: 2-2

[10:28] Team_046 possession (Score: 2-2)
Cade Wall attempts a Midrange. Contested by Bradley Sabonis (4.6 feet, MAN). Cade Wall misses. Offensive rebound by Cade Wall! Cade Wall kicks it out.

[10:16] Team_046 possession (Score: 2-2)
FOUL! Holding foul on Bradley Sabonis. [Team fouls: 3] No free throws, side out. (Bradley Sabonis: 1 personal fouls)

[09:59] Team_046 possession (Score: 2-2)
Cade Wall drives to the basket... Cade Wall commits a violation (traveling/carry)! TURNOVER! (dead ball)

[09:41] Team_081 possession (Score: 2-2)
Franz Antetokounmpo drives, picks up Kevin Allen. Help arrives from D'Angelo O'Neal! Franz Antetokounmpo attempts a Layup. Contested by D'Angelo O'Neal (4.7 feet, ZONE). FRANZ ANTETOKOUNMPO MAKES IT! Assist: Bradley Leonard
Score: 4-2

[09:22] Team_046 possession (Score: 4-2)
FOUL! Shooting foul on Franz Antetokounmpo. Lauri Carter to the line for 2 free throws. [Team fouls: 4] (Franz Antetokounmpo: 1 personal fouls)   FT 1/2: MISS   FT 2/2: GOOD Lauri Carter makes 1/2 from the line.
Score: 4-3

[09:07] Team_081 possession (Score: 4-3)
FOUL! Holding foul on D'Angelo O'Neal. [Team fouls: 2] No free throws, side out. (D'Angelo O'Neal: 1 personal fouls)

[08:48] Team_081 possession (Score: 4-3)
Vince Adebayo attempts a 3Pt. Contested by Lauri Carter (3.3 feet, MAN). Vince Adebayo misses. Rebound secured by Cade Wall.

[08:32] Team_046 possession (Score: 4-3)
FOUL! Holding foul on Julius Durant. [IN THE BONUS! 5 team fouls] D'Angelo O'Neal to the line for 2 free throws. (Julius Durant: 3 personal fouls)   FT 1/2: GOOD   FT 2/2: MISS D'Angelo O'Neal makes 1/2 from the line. FOUL! Loose ball foul on Bradley Sabonis during the free throw rebound! [IN THE BONUS! 6 team fouls] Cade Wall to the line for 2 free throws. (Bradley Sabonis: 2 personal fouls)   FT 1/2: GOOD   FT 2/2: GOOD Cade Wall makes 2/2 from the line.
Score: 4-6

[08:13] Team_081 possession (Score: 4-6)
Bradley Sabonis drives and kicks out. FOUL! Shooting foul on Kevin Allen. Franz Antetokounmpo to the line for 2 free throws. [Team fouls: 3] (Kevin Allen: 1 personal fouls)   FT 1/2: GOOD   FT 2/2: GOOD Franz Antetokounmpo makes 2/2 from the line.
Score: 6-6

[08:01] Team_046 possession (Score: 6-6)
Cade Wall attempts a 3Pt. Contested by Vince Adebayo (4.1 feet, ZONE). Cade Wall misses. Rebound secured by Bradley Sabonis.

[07:49] Team_081 possession (Score: 6-6)
Julius Durant drives and kicks out. Bradley Leonard attempts a 3Pt. Contested by Victor Nowitzki (5.5 feet, MAN). Bradley Leonard misses. Rebound secured by Lauri Carter.

[07:36] Team_046 possession (Score: 6-6)
Kevin Allen attempts a Layup. Contested by Franz Antetokounmpo (4.5 feet, MAN). KEVIN ALLEN MAKES IT! Assist: Victor Nowitzki
Score: 6-8

[07:18] Team_081 possession (Score: 6-8)
Bradley Sabonis attempts a Layup. Contested by Kevin Allen (4.5 feet, ZONE). Bradley Sabonis misses. Rebound secured by Cade Wall.

[07:08] Team_046 possession (Score: 6-8)
Victor Nowitzki drives to the basket... FOUL! Offensive foul on Victor Nowitzki! Bradley Leonard drew the charge! [Team fouls: 4] (Victor Nowitzki: 2 personal fouls) TURNOVER! (dead ball)

[06:55] Team_081 possession (Score: 6-8)
Julius Durant makes the Dunk and draws the foul on Kevin Allen! And-1! Julius Durant to the line for 1. [BONUS: 5 team fouls] (Kevin Allen: 2 personal fouls)   FT 1/1: GOOD Julius Durant makes 1/1 from the line.
Score: 9-8

[06:38] Team_046 possession (Score: 9-8)
Kevin Allen attempts a 3Pt. Contested by Franz Antetokounmpo (4.5 feet, MAN). Kevin Allen misses. Rebound secured by Franz Antetokounmpo.

[06:23] Team_081 possession (Score: 9-8)
Bradley Sabonis makes the Layup and draws the foul on Cade Wall! And-1! Bradley Sabonis to the line for 1. [BONUS: 6 team fouls] (Cade Wall: 1 personal fouls)   FT 1/1: GOOD Bradley Sabonis makes 1/1 from the line.
Score: 12-8

[06:10] Team_046 possession (Score: 12-8)
Lauri Carter makes the Layup and draws the foul on Vince Adebayo! And-1! Lauri Carter to the line for 1. [BONUS: 7 team fouls] (Vince Adebayo: 1 personal fouls)   FT 1/1: MISS Lauri Carter makes 0/1 from the line. Rebound secured by Franz Antetokounmpo.
Score: 12-10

[05:54] Team_081 possession (Score: 12-10)
Julius Durant drives and kicks out. Franz Antetokounmpo attempts a 3Pt. Contested by Lauri Carter (3.2 feet, ZONE). Franz Antetokounmpo misses. Rebound secured by Cade Wall.

[05:40] Team_046 possession (Score: 12-10)
D'Angelo O'Neal attempts a 3Pt. Contested by Vince Adebayo (3.7 feet, ZONE). D'Angelo O'Neal misses. Rebound secured by Bradley Sabonis.

[05:21] Team_081 possession (Score: 12-10)
Bradley Sabonis attempts a Midrange. Contested by Cade Wall (3.7 feet, MAN). Bradley Sabonis misses. Rebound secured by Cade Wall.

[05:03] Team_046 possession (Score: 12-10)
Cade Wall drives to the basket... Cade Wall loses the ball! Stripped by Bradley Sabonis! TURNOVER! (live ball)

[04:48] Team_081 possession (Score: 12-10)
Vince Adebayo attempts a 3Pt. Contested by Lauri Carter (3.3 feet, ZONE). Vince Adebayo misses. Rebound secured by Cade Wall.

[04:34] Team_046 possession (Score: 12-10)
Victor Nowitzki attempts a 3Pt. Contested by Bradley Leonard (3.8 feet, MAN). Victor Nowitzki misses. Rebound secured by Franz Antetokounmpo.

[04:19] Team_081 possession (Score: 12-10)
Bradley Leonard drives, picks up Victor Nowitzki. Help arrives from Lauri Carter! Bradley Leonard attempts a Dunk. Contested by Lauri Carter (5.7 feet, MAN). BRADLEY LEONARD MAKES IT!
Score: 14-10

[04:04] Team_046 possession (Score: 14-10)
Cade Wall attempts a Layup. BLOCKED BY FRANZ ANTETOKOUNMPO! Ball deflects out of bounds off Cade Wall.

[03:50] Team_081 possession (Score: 14-10)
Bradley Sabonis attempts a 3Pt. Contested by Lauri Carter (3.2 feet, ZONE). Bradley Sabonis misses. Rebound secured by Lauri Carter.

[03:31] Team_046 possession (Score: 14-10)
Kevin Allen makes the Layup and draws the foul on Franz Antetokounmpo! And-1! Kevin Allen to the line for 1. [BONUS: 8 team fouls] (Franz Antetokounmpo: 2 personal fouls)   FT 1/1: GOOD Kevin Allen makes 1/1 from the line.
Score: 14-13

[03:16] Team_081 possession (Score: 14-13)
Bradley Leonard makes the Layup and draws the foul on Kevin Allen! And-1! Bradley Leonard to the line for 1. [BONUS: 7 team fouls] (Kevin Allen: 3 personal fouls)   FT 1/1: MISS Bradley Leonard makes 0/1 from the line. Rebound secured by Lauri Carter.
Score: 16-13

[03:00] Team_046 possession (Score: 16-13)
FOUL! Holding foul on Julius Durant. [IN THE BONUS! 9 team fouls] D'Angelo O'Neal to the line for 2 free throws. (Julius Durant: 4 personal fouls)   FT 1/2: GOOD   FT 2/2: GOOD D'Angelo O'Neal makes 2/2 from the line.
Score: 16-15

[02:48] Team_081 possession (Score: 16-15)
Franz Antetokounmpo drives, picks up Kevin Allen. Help arrives from D'Angelo O'Neal! Franz Antetokounmpo attempts a Dunk. Contested by D'Angelo O'Neal (5.0 feet, ZONE). FRANZ ANTETOKOUNMPO MAKES IT! Assist: Bradley Leonard
Score: 18-15

[02:32] Team_046 possession (Score: 18-15)
Lauri Carter attempts a 3Pt. Contested by Vince Adebayo (3.9 feet, MAN). LAURI CARTER MAKES IT! Assist: D'Angelo O'Neal
Score: 18-18

[02:19] Team_081 possession (Score: 18-18)
Bradley Leonard throws a bad pass out of bounds! TURNOVER! (dead ball)

[02:19] Substitution (Team_081): Vince Adebayo OUT → Larry Adebayo IN (stamina_rule2)

[02:19] Substitution (Team_046): D'Angelo O'Neal OUT → Collin Butler IN (stamina_rule2)

[02:19] Substitution (Team_046): Victor Nowitzki OUT → Manu Dosunmu IN (stamina_rule2)

[02:19] Substitution (Team_046): Cade Wall OUT → Chris LaVine IN (stamina_rule2)

[02:19] Substitution (Team_046): Kevin Allen OUT → Paul DeRozan IN (stamina_rule2)

[02:02] Team_046 possession (Score: 18-18)
Paul DeRozan attempts a Layup. BLOCKED BY FRANZ ANTETOKOUNMPO! Ball is loose! Rebound secured by Bradley Sabonis.

[01:52] Team_081 possession (Score: 18-18)
Franz Antetokounmpo makes the Layup and draws the foul on Chris LaVine! And-1! Franz Antetokounmpo to the line for 1. [BONUS: 8 team fouls] (Chris LaVine: 1 personal fouls)   FT 1/1: GOOD Franz Antetokounmpo makes 1/1 from the line.
Score: 21-18

[01:34] Team_046 possession (Score: 21-18)
Collin Butler attempts a Midrange. Contested by Julius Durant (4.6 feet, MAN). COLLIN BUTLER MAKES IT! Assist: Paul DeRozan
Score: 21-20

[01:23] Team_081 possession (Score: 21-20)
Bradley Sabonis throws a bad pass! Stolen by Chris LaVine! TURNOVER! (live ball)

[01:08] Team_046 possession (Score: 21-20)
Manu Dosunmu attempts a 3Pt. Contested by Bradley Leonard (4.6 feet, ZONE). Manu Dosunmu misses. Offensive rebound by Paul DeRozan! Paul DeRozan's putback is no good. Rebound secured by Franz Antetokounmpo.

[00:57] Team_081 possession (Score: 21-20)
Franz Antetokounmpo attempts a 3Pt. Contested by Collin Butler (3.9 feet, ZONE). Franz Antetokounmpo misses. Rebound secured by Manu Dosunmu.

[00:42] Team_046 possession (Score: 21-20)
Collin Butler attempts a Midrange. Contested by Larry Adebayo (5.6 feet, ZONE). Collin Butler misses. FOUL! Loose ball foul on Larry Adebayo during the rebound battle. [IN THE BONUS! 10 team fouls] Chris LaVine to the line for 2 free throws. (Larry Adebayo: 1 personal fouls)   FT 1/2: GOOD   FT 2/2: GOOD Chris LaVine makes 2/2 from the line.
Score: 21-22

[00:25] Team_081 possession (Score: 21-22)
Franz Antetokounmpo throws a bad pass out of bounds! TURNOVER! (dead ball)

[00:25] Substitution (Team_081): Julius Durant OUT → Dejounte Bane IN (stamina_rule2)

[00:25] Substitution (Team_081): Bradley Leonard OUT → Lamelo Wade IN (stamina_rule2)

[00:25] Substitution (Team_081): Bradley Sabonis OUT → Chris Holiday IN (stamina_rule2)

[00:25] Substitution (Team_081): Franz Antetokounmpo OUT → D'Angelo Markkanen IN (stamina_rule2)

[00:25] Substitution (Team_046): Lauri Carter OUT → Josh Barrett IN (stamina_rule2)

[00:11] Team_046 possession (Score: 21-22)
Chris LaVine attempts a 3Pt. Contested by Chris Holiday (4.7 feet, ZONE). Chris LaVine misses. Rebound secured by Larry Adebayo.

================================================================================
                              1ST QUARTER COMPLETE                              
================================================================================

1ST QUARTER SCORE: Team_081 21, Team_046 22

BOX SCORE:
================================================================================

Team_081
--------------------------------------------------------------------------------
Player                MIN  PTS  REB  AST  TO      FG   FG%      3P   3P%
--------------------------------------------------------------------------------
Franz Antetokounmpo    12    9    4    0   0   4/5    80.0     0/0   0.0
Bradley Sabonis        12    3    3    0   0   1/4    25.0     0/0   0.0
Julius Durant          12    3    0    0   0   1/3    33.3     0/0   0.0
Bradley Leonard        12    2    0    3   0   1/3    33.3     0/0   0.0
Vince Adebayo          10    2    1    0   0   1/3    33.3     0/0   0.0
Larry Adebayo           2    0    1    0   0   0/0     0.0     0/0   0.0

TEAM: FG: 8/18 (44.4%), 3PT: 0/4 (0.0%), REB: 8 (0 off, 8 def), AST: 3, TO: 4
TEAM FOULS: 10 [Team_046 in BONUS]


Team_046
--------------------------------------------------------------------------------
Player                MIN  PTS  REB  AST  TO      FG   FG%      3P   3P%
--------------------------------------------------------------------------------
Kevin Allen            10    5    0    0   0   2/3    66.7     0/0   0.0
D'Angelo O'Neal        10    4    0    1   0   2/3    66.7     0/0   0.0
Lauri Carter           12    4    3    0   0   2/3    66.7     0/0   0.0
Cade Wall              10    3    8    0   0   1/4    25.0     0/0   0.0
Collin Butler           2    2    0    0   0   1/1   100.0     0/0   0.0
Chris LaVine            2    2    0    0   0   1/2    50.0     0/0   0.0
Victor Nowitzki        10    0    0    1   0   0/1     0.0     0/0   0.0
Paul DeRozan            2    0    0    1   0   0/1     0.0     0/0   0.0
Manu Dosunmu            2    0    1    0   0   0/1     0.0     0/0   0.0

TEAM: FG: 9/19 (47.4%), 3PT: 1/7 (14.3%), REB: 13 (3 off, 10 def), AST: 3, TO: 3
TEAM FOULS: 8 [Team_081 in BONUS]

================================================================================

================================================================================
                       2ND QUARTER - Team_081 vs Team_046                       
================================================================================

[12:00] Team_081 possession (Score: 21-22)
Bradley Leonard attempts a Layup. Contested by Kevin Allen (4.8 feet, ZONE). Bradley Leonard misses. Rebound secured by Kevin Allen.

[11:45] Team_046 possession (Score: 21-22)
Lauri Carter attempts a 3Pt. Contested by Vince Adebayo (3.6 feet, MAN). Lauri Carter misses. Rebound secured by Franz Antetokounmpo.

[11:28] Team_081 possession (Score: 21-22)
FOUL! Reach-in foul on Kevin Allen during the drive. [Team fouls: 1] No free throws, side out. (Kevin Allen: 1 personal fouls)

[11:13] Team_081 possession (Score: 21-22)
Vince Adebayo drives to the basket... Vince Adebayo throws a bad pass! Stolen by Kevin Allen! TURNOVER! (live ball)

[10:55] Team_046 possession (Score: 21-22)
D'Angelo O'Neal attempts a 3Pt. Contested by Julius Durant (4.6 feet, MAN). D'Angelo O'Neal misses. Rebound secured by Franz Antetokounmpo.

[10:38] Team_081 possession (Score: 21-22)
Bradley Sabonis drives to the basket... Bradley Sabonis throws a bad pass! Stolen by Cade Wall! TURNOVER! (live ball)

[10:27] Team_046 possession (Score: 21-22)
FOUL! Reach-in foul on Vince Adebayo during the drive. [Team fouls: 1] No free throws, side out. (Vince Adebayo: 1 personal fouls)

[10:13] Team_046 possession (Score: 21-22)
Cade Wall attempts a Midrange. Contested by Bradley Sabonis (5.0 feet, MAN). CADE WALL MAKES IT! Assist: Victor Nowitzki
Score: 21-24

[09:58] Team_081 possession (Score: 21-24)
Bradley Sabonis drives to the basket... Bradley Sabonis throws a bad pass! Stolen by Kevin Allen! TURNOVER! (live ball)

[09:41] Team_046 possession (Score: 21-24)
Lauri Carter loses the ball! Stripped by Vince Adebayo! TURNOVER! (live ball)

[09:27] Team_081 possession (Score: 21-24)
Julius Durant attempts a Midrange. Contested by D'Angelo O'Neal (4.3 feet, MAN). Julius Durant misses. Rebound secured by Kevin Allen.

[09:15] Team_046 possession (Score: 21-24)
D'Angelo O'Neal throws a bad pass! Stolen by Julius Durant! TURNOVER! (live ball)

[09:00] Team_081 possession (Score: 21-24)
Bradley Leonard attempts a 3Pt. Contested by Victor Nowitzki (5.8 feet, MAN). BRADLEY LEONARD MAKES IT! Assist: Franz Antetokounmpo
Score: 24-24

[08:47] Team_046 possession (Score: 24-24)
D'Angelo O'Neal drives and kicks out. Victor Nowitzki attempts a Midrange. Contested by Vince Adebayo (3.8 feet, ZONE). Victor Nowitzki misses. Offensive rebound by Kevin Allen! Kevin Allen kicks it out.

[08:30] Team_046 possession (Score: 24-24)
Kevin Allen drives, picks up Franz Antetokounmpo. Help arrives from Bradley Leonard! Kevin Allen attempts a Layup. Contested by Bradley Leonard (5.1 feet, MAN). KEVIN ALLEN MAKES IT! Assist: Victor Nowitzki
Score: 24-26

[08:14] Team_081 possession (Score: 24-26)
Julius Durant drives to the basket... Julius Durant commits a violation (traveling/carry)! TURNOVER! (dead ball)

[08:14] Substitution (Team_081): Julius Durant OUT → Dejounte Bane IN (stamina_rule2)

[08:14] Substitution (Team_081): Bradley Leonard OUT → Lamelo Wade IN (stamina_rule2)

[08:14] Substitution (Team_081): Vince Adebayo OUT → Larry Adebayo IN (stamina_rule2)

[08:14] Substitution (Team_081): Bradley Sabonis OUT → Chris Holiday IN (stamina_rule2)

[08:14] Substitution (Team_081): Franz Antetokounmpo OUT → D'Angelo Markkanen IN (stamina_rule2)

[08:14] Substitution (Team_046): D'Angelo O'Neal OUT → Collin Butler IN (stamina_rule2)

[08:14] Substitution (Team_046): Victor Nowitzki OUT → Manu Dosunmu IN (stamina_rule2)

[08:14] Substitution (Team_046): Lauri Carter OUT → Josh Barrett IN (stamina_rule2)

[08:14] Substitution (Team_046): Cade Wall OUT → Chris LaVine IN (stamina_rule2)

[08:14] Substitution (Team_046): Kevin Allen OUT → Paul DeRozan IN (stamina_rule2)

[08:03] Team_046 possession (Score: 24-26)
Paul DeRozan drives to the basket... Paul DeRozan loses control! Ball rolls out of bounds! TURNOVER! (dead ball)

[07:44] Team_081 possession (Score: 24-26)
FOUL! Reach-in foul on Josh Barrett during the drive. [Team fouls: 2] No free throws, side out. (Josh Barrett: 1 personal fouls)

[07:28] Team_081 possession (Score: 24-26)
Lamelo Wade attempts a 3Pt. Contested by Collin Butler (3.8 feet, ZONE). LAMELO WADE MAKES IT!
Score: 27-26

[07:16] Team_046 possession (Score: 27-26)
Chris LaVine drives and kicks out. Manu Dosunmu attempts a 3Pt. Contested by Lamelo Wade (4.7 feet, MAN). Manu Dosunmu misses. Rebound secured by Larry Adebayo.

[07:01] Team_081 possession (Score: 27-26)
Larry Adebayo attempts a 3Pt. Contested by Collin Butler (3.8 feet, ZONE). Larry Adebayo misses. Rebound secured by Paul DeRozan.

[06:42] Team_046 possession (Score: 27-26)
Chris LaVine attempts a Midrange. Contested by Chris Holiday (4.7 feet, MAN). Chris LaVine misses. Rebound secured by Larry Adebayo.

[06:26] Team_081 possession (Score: 27-26)
FOUL! Shooting foul on Manu Dosunmu. Lamelo Wade to the line for 3 free throws. [Team fouls: 3] (Manu Dosunmu: 1 personal fouls)   FT 1/3: GOOD   FT 2/3: GOOD   FT 3/3: GOOD Lamelo Wade makes 3/3 from the line.
Score: 30-26

[06:11] Team_046 possession (Score: 30-26)
Paul DeRozan drives and kicks out. Manu Dosunmu attempts a 3Pt. Contested by Lamelo Wade (4.7 feet, MAN). MANU DOSUNMU MAKES IT! Assist: Paul DeRozan
Score: 30-29

[05:55] Team_081 possession (Score: 30-29)
Lamelo Wade makes the Layup and draws the foul on Collin Butler! And-1! Lamelo Wade to the line for 1. [Team fouls: 4] (Collin Butler: 1 personal fouls)   FT 1/1: GOOD Lamelo Wade makes 1/1 from the line.
Score: 33-29

[05:44] Team_046 possession (Score: 33-29)
Manu Dosunmu makes the Layup and draws the foul on Lamelo Wade! And-1! Manu Dosunmu to the line for 1. [Team fouls: 2] (Lamelo Wade: 1 personal fouls)   FT 1/1: GOOD Manu Dosunmu makes 1/1 from the line.
Score: 33-32

[05:29] Team_081 possession (Score: 33-32)
FOUL! Shooting foul on Manu Dosunmu. D'Angelo Markkanen to the line for 3 free throws. [BONUS: 5 team fouls] (Manu Dosunmu: 2 personal fouls)   FT 1/3: GOOD   FT 2/3: GOOD   FT 3/3: GOOD D'Angelo Markkanen makes 3/3 from the line.
Score: 36-32

[05:19] Team_046 possession (Score: 36-32)
Josh Barrett attempts a Layup. BLOCKED BY CHRIS HOLIDAY! Ball deflects out of bounds off Josh Barrett.

[05:09] Team_081 possession (Score: 36-32)
Chris Holiday attempts a 3Pt. Contested by Collin Butler (3.9 feet, ZONE). Chris Holiday misses. Rebound secured by Chris LaVine.

[04:56] Team_046 possession (Score: 36-32)
Manu Dosunmu drives, Lamelo Wade stays with him. Manu Dosunmu attempts a Layup. Contested by Lamelo Wade (5.3 feet, MAN). Manu Dosunmu misses. Rebound secured by Larry Adebayo.

[04:43] Team_081 possession (Score: 36-32)
D'Angelo Markkanen drives and kicks out. Larry Adebayo attempts a Midrange. Contested by Josh Barrett (4.8 feet, MAN). Larry Adebayo misses. Rebound secured by Paul DeRozan.

[04:24] Team_046 possession (Score: 36-32)
FOUL! Shooting foul on Dejounte Bane. Collin Butler to the line for 2 free throws. [Team fouls: 3] (Dejounte Bane: 1 personal fouls)   FT 1/2: MISS   FT 2/2: GOOD Collin Butler makes 1/2 from the line.
Score: 36-33

[04:08] Team_081 possession (Score: 36-33)
FOUL! Holding foul on Collin Butler. [IN THE BONUS! 6 team fouls] Dejounte Bane to the line for 2 free throws. (Collin Butler: 2 personal fouls)   FT 1/2: GOOD   FT 2/2: GOOD Dejounte Bane makes 2/2 from the line.
Score: 38-33

[03:56] Team_046 possession (Score: 38-33)
Collin Butler attempts a 3Pt. Contested by Dejounte Bane (5.8 feet, MAN). Collin Butler misses. Rebound secured by Larry Adebayo.

[03:42] Team_081 possession (Score: 38-33)
Dejounte Bane attempts a 3Pt. Contested by Collin Butler (4.1 feet, MAN). Dejounte Bane misses. Rebound secured by Paul DeRozan.

[03:26] Team_046 possession (Score: 38-33)
Manu Dosunmu attempts a 3Pt. Contested by Larry Adebayo (5.8 feet, ZONE). Manu Dosunmu misses. Rebound secured by Larry Adebayo.

[03:11] Team_081 possession (Score: 38-33)
FOUL! Shooting foul on Collin Butler. Lamelo Wade to the line for 3 free throws. [BONUS: 7 team fouls] (Collin Butler: 3 personal fouls)   FT 1/3: GOOD   FT 2/3: GOOD   FT 3/3: GOOD Lamelo Wade makes 3/3 from the line.
Score: 41-33

[02:55] Team_046 possession (Score: 41-33)
Chris LaVine attempts a Midrange. Contested by Chris Holiday (4.7 feet, MAN). Chris LaVine misses. Rebound secured by Chris Holiday.

[02:42] Team_081 possession (Score: 41-33)
Larry Adebayo attempts a 3Pt. Contested by Collin Butler (3.8 feet, ZONE). Larry Adebayo misses. Offensive rebound by Lamelo Wade! Lamelo Wade kicks it out.

[02:30] Team_081 possession (Score: 41-33)
FOUL! Shooting foul on Manu Dosunmu. Lamelo Wade to the line for 3 free throws. [BONUS: 8 team fouls] (Manu Dosunmu: 3 personal fouls)   FT 1/3: MISS   FT 2/3: GOOD   FT 3/3: MISS Lamelo Wade makes 1/3 from the line. Rebound secured by Chris LaVine.
Score: 42-33

[02:20] Team_046 possession (Score: 42-33)
Chris LaVine attempts a 3Pt. Contested by Chris Holiday (4.7 feet, MAN). Chris LaVine misses. Rebound secured by Lamelo Wade.

[02:06] Team_081 possession (Score: 42-33)
Larry Adebayo attempts a 3Pt. Contested by Josh Barrett (4.8 feet, MAN). Larry Adebayo misses. Rebound secured by Manu Dosunmu.

[01:49] Team_046 possession (Score: 42-33)
Paul DeRozan drives, Chris Holiday stays with him. Paul DeRozan attempts a Layup. Contested by Chris Holiday (4.2 feet, MAN). Paul DeRozan misses. Offensive rebound by Paul DeRozan! Paul DeRozan puts it back in!
Score: 42-35

[01:34] Team_081 possession (Score: 42-35)
FOUL! Reach-in foul on Paul DeRozan during the drive. [IN THE BONUS! 9 team fouls] D'Angelo Markkanen to the line for 2 free throws. (Paul DeRozan: 1 personal fouls)   FT 1/2: GOOD   FT 2/2: GOOD D'Angelo Markkanen makes 2/2 from the line.
Score: 44-35

[01:23] Team_046 possession (Score: 44-35)
Collin Butler makes the Layup and draws the foul on Chris Holiday! And-1! Collin Butler to the line for 1. [Team fouls: 4] (Chris Holiday: 1 personal fouls)   FT 1/1: GOOD Collin Butler makes 1/1 from the line.
Score: 44-38

[01:04] Team_081 possession (Score: 44-38)
Lamelo Wade attempts a Midrange. Contested by Manu Dosunmu (4.9 feet, MAN). Lamelo Wade misses. Offensive rebound by Chris Holiday! Chris Holiday kicks it out.

[00:49] Team_081 possession (Score: 44-38)
D'Angelo Markkanen makes the Layup and draws the foul on Chris LaVine! And-1! D'Angelo Markkanen to the line for 1. [BONUS: 10 team fouls] (Chris LaVine: 1 personal fouls)   FT 1/1: GOOD D'Angelo Markkanen makes 1/1 from the line.
Score: 47-38

[00:34] Team_046 possession (Score: 47-38)
Chris LaVine makes the Layup and draws the foul on Chris Holiday! And-1! Chris LaVine to the line for 1. [BONUS: 5 team fouls] (Chris Holiday: 2 personal fouls)   FT 1/1: MISS Chris LaVine makes 0/1 from the line. Offensive rebound by Chris LaVine! Chris LaVine kicks it out.
Score: 47-40

[00:20] Team_046 possession (Score: 47-40)
Josh Barrett attempts a 3Pt. Contested by Larry Adebayo (5.5 feet, MAN). Josh Barrett misses. FOUL! Loose ball foul on Larry Adebayo during the rebound battle. [IN THE BONUS! 6 team fouls] Paul DeRozan to the line for 2 free throws. (Larry Adebayo: 1 personal fouls)   FT 1/2: GOOD   FT 2/2: GOOD Paul DeRozan makes 2/2 from the line.
Score: 47-42

[00:08] Team_081 possession (Score: 47-42)
Lamelo Wade attempts a Midrange. Contested by Paul DeRozan (5.1 feet, ZONE). LAMELO WADE MAKES IT! Assist: Dejounte Bane
Score: 49-42

================================================================================
                              2ND QUARTER COMPLETE                              
================================================================================

2ND QUARTER SCORE: Team_081 28, Team_046 20

BOX SCORE:
================================================================================

Team_081
--------------------------------------------------------------------------------
Player                MIN  PTS  REB  AST  TO      FG   FG%      3P   3P%
--------------------------------------------------------------------------------
Lamelo Wade             8   14    2    0   0   5/6    83.3     0/0   0.0
D'Angelo Markkanen      8    8    0    0   0   3/4    75.0     0/0   0.0
Bradley Leonard        16    3    0    0   0   1/2    50.0     0/0   0.0
Dejounte Bane           8    2    0    1   0   1/2    50.0     0/0   0.0
Franz Antetokounmpo    16    0    2    1   0   0/0     0.0     0/0   0.0
Julius Durant          16    0    0    0   0   0/1     0.0     0/0   0.0
Larry Adebayo          10    0    5    0   0   0/2     0.0     0/0   0.0
Chris Holiday           8    0    2    0   0   0/1     0.0     0/0   0.0

TEAM: FG: 10/18 (55.6%), 3PT: 5/10 (50.0%), REB: 11 (2 off, 9 def), AST: 2, TO: 4
TEAM FOULS: 6 [Team_046 in BONUS]


Team_046
--------------------------------------------------------------------------------
Player                MIN  PTS  REB  AST  TO      FG   FG%      3P   3P%
--------------------------------------------------------------------------------
Manu Dosunmu           10    6    1    0   0   2/4    50.0     0/0   0.0
Paul DeRozan           10    4    4    1   0   2/2   100.0     0/0   0.0
Collin Butler          10    4    0    0   0   2/3    66.7     0/0   0.0
Kevin Allen            14    2    3    0   0   1/1   100.0     0/0   0.0
Cade Wall              14    2    0    0   0   1/1   100.0     0/0   0.0
Lauri Carter           16    0    0    0   0   0/1     0.0     0/0   0.0
D'Angelo O'Neal        14    0    0    0   0   0/1     0.0     0/0   0.0
Victor Nowitzki        14    0    0    2   0   0/0     0.0     0/0   0.0
Chris LaVine           10    0    3    0   0   0/4     0.0     0/0   0.0
Josh Barrett            8    0    0    0   0   0/1     0.0     0/0   0.0

TEAM: FG: 8/18 (44.4%), 3PT: 1/6 (16.7%), REB: 11 (3 off, 8 def), AST: 3, TO: 3
TEAM FOULS: 10 [Team_081 in BONUS]

================================================================================

================================================================================
                       3RD QUARTER - Team_081 vs Team_046                       
================================================================================

[12:00] Team_081 possession (Score: 49-42)
FOUL! Shooting foul on Kevin Allen. Vince Adebayo to the line for 2 free throws. [Team fouls: 1] (Kevin Allen: 1 personal fouls)   FT 1/2: GOOD   FT 2/2: GOOD Vince Adebayo makes 2/2 from the line.
Score: 51-42

[11:50] Team_046 possession (Score: 51-42)
Victor Nowitzki drives, picks up Bradley Leonard. Help arrives from Vince Adebayo! Victor Nowitzki attempts a Layup. Contested by Vince Adebayo (3.8 feet, MAN). VICTOR NOWITZKI MAKES IT! Assist: D'Angelo O'Neal
Score: 51-44

[11:34] Team_081 possession (Score: 51-44)
Julius Durant drives, D'Angelo O'Neal stays with him. Julius Durant attempts a Layup. Contested by D'Angelo O'Neal (4.1 feet, MAN). JULIUS DURANT MAKES IT!
Score: 53-44

[11:20] Team_046 possession (Score: 53-44)
Cade Wall attempts a Midrange. Contested by Bradley Sabonis (4.6 feet, MAN). Cade Wall misses. Rebound secured by Bradley Sabonis.

[11:03] Team_081 possession (Score: 53-44)
FOUL! Reach-in foul on Kevin Allen during the drive. [Team fouls: 2] No free throws, side out. (Kevin Allen: 2 personal fouls)

[10:46] Team_081 possession (Score: 53-44)
Julius Durant attempts a 3Pt. Contested by D'Angelo O'Neal (4.1 feet, MAN). JULIUS DURANT MAKES IT! Assist: Vince Adebayo
Score: 56-44

[10:31] Team_046 possession (Score: 56-44)
Victor Nowitzki makes the Midrange and draws the foul on Bradley Leonard! And-1! Victor Nowitzki to the line for 1. [Team fouls: 1] (Bradley Leonard: 1 personal fouls)   FT 1/1: GOOD Victor Nowitzki makes 1/1 from the line.
Score: 56-47

[10:15] Team_081 possession (Score: 56-47)
Franz Antetokounmpo attempts a Midrange. Contested by Cade Wall (3.9 feet, ZONE). Franz Antetokounmpo misses. FOUL! Loose ball foul on Cade Wall during the rebound battle. [Team fouls: 3] No free throws, side out. (Cade Wall: 1 personal fouls)

[09:59] Team_081 possession (Score: 56-47)
Bradley Leonard attempts a 3Pt. Contested by Victor Nowitzki (5.7 feet, MAN). Bradley Leonard misses. Rebound secured by Cade Wall.

[09:45] Team_046 possession (Score: 56-47)
Lauri Carter drives, Franz Antetokounmpo stays with him. Lauri Carter attempts a Dunk. Contested by Franz Antetokounmpo (4.5 feet, ZONE). LAURI CARTER MAKES IT! Assist: D'Angelo O'Neal
Score: 56-49

[09:33] Team_081 possession (Score: 56-49)
Bradley Leonard drives, Kevin Allen stays with him. Bradley Leonard attempts a Layup. Contested by Kevin Allen (4.8 feet, ZONE). BRADLEY LEONARD MAKES IT! Assist: Vince Adebayo
Score: 58-49

[09:16] Team_046 possession (Score: 58-49)
Kevin Allen attempts a Midrange. Contested by Franz Antetokounmpo (4.5 feet, MAN). KEVIN ALLEN MAKES IT! Assist: D'Angelo O'Neal
Score: 58-51

[09:02] Team_081 possession (Score: 58-51)
Bradley Leonard attempts a 3Pt. Contested by Victor Nowitzki (5.7 feet, MAN). BRADLEY LEONARD MAKES IT! Assist: Vince Adebayo
Score: 61-51

[08:44] Team_046 possession (Score: 61-51)
Cade Wall drives, picks up Bradley Sabonis. Help arrives from Bradley Leonard! Cade Wall attempts a Layup. Contested by Bradley Leonard (4.6 feet, MAN). Cade Wall misses. Offensive rebound by Cade Wall! Cade Wall kicks it out.

[08:34] Team_046 possession (Score: 61-51)
FOUL! Holding foul on Bradley Sabonis. [Team fouls: 2] No free throws, side out. (Bradley Sabonis: 1 personal fouls)

[08:22] Team_046 possession (Score: 61-51)
D'Angelo O'Neal attempts a 3Pt. Contested by Julius Durant (4.3 feet, MAN). D'Angelo O'Neal misses. Rebound secured by Bradley Sabonis.

[08:04] Team_081 possession (Score: 61-51)
Bradley Leonard attempts a 3Pt. Contested by Lauri Carter (3.4 feet, ZONE). BRADLEY LEONARD MAKES IT! Assist: Franz Antetokounmpo
Score: 64-51

[07:52] Team_046 possession (Score: 64-51)
Lauri Carter attempts a 3Pt. Contested by Vince Adebayo (3.6 feet, MAN). Lauri Carter misses. Rebound secured by Vince Adebayo.

[07:38] Team_081 possession (Score: 64-51)
Bradley Leonard attempts a 3Pt. Contested by Victor Nowitzki (5.7 feet, MAN). BRADLEY LEONARD MAKES IT! Assist: Bradley Sabonis
Score: 67-51

[07:21] Team_046 possession (Score: 67-51)
Victor Nowitzki throws a bad pass! Stolen by Bradley Leonard! TURNOVER! (live ball)

[07:10] Team_081 possession (Score: 67-51)
Franz Antetokounmpo drives to the basket... FOUL! Offensive foul on Franz Antetokounmpo! Kevin Allen drew the charge! [Team fouls: 3] (Franz Antetokounmpo: 1 personal fouls) TURNOVER! (dead ball)

[06:55] Team_046 possession (Score: 67-51)
Lauri Carter throws a bad pass out of bounds! TURNOVER! (dead ball)

[06:40] Team_081 possession (Score: 67-51)
Franz Antetokounmpo attempts a Midrange. Contested by Kevin Allen (4.7 feet, MAN). FRANZ ANTETOKOUNMPO MAKES IT!
Score: 69-51

[06:24] Team_046 possession (Score: 69-51)
D'Angelo O'Neal attempts a 3Pt. Contested by Vince Adebayo (3.7 feet, ZONE). D'Angelo O'Neal misses. Rebound secured by Vince Adebayo.

[06:09] Team_081 possession (Score: 69-51)
Vince Adebayo attempts a 3Pt. Contested by Lauri Carter (3.3 feet, ZONE). Vince Adebayo misses. Rebound secured by Lauri Carter.

[05:56] Team_046 possession (Score: 69-51)
Lauri Carter attempts a 3Pt. Contested by Vince Adebayo (3.6 feet, MAN). Lauri Carter misses. FOUL! Loose ball foul on Vince Adebayo during the rebound battle. [Team fouls: 4] No free throws, side out. (Vince Adebayo: 1 personal fouls)

[05:43] Team_046 possession (Score: 69-51)
Cade Wall drives and kicks out. FOUL! Shooting foul on Franz Antetokounmpo. Kevin Allen to the line for 2 free throws. [BONUS: 5 team fouls] (Franz Antetokounmpo: 2 personal fouls)   FT 1/2: GOOD   FT 2/2: GOOD Kevin Allen makes 2/2 from the line.
Score: 69-53

[05:29] Team_081 possession (Score: 69-53)
Julius Durant attempts a 3Pt. Contested by Victor Nowitzki (5.6 feet, ZONE). Julius Durant misses. Rebound secured by Cade Wall.

[05:14] Team_046 possession (Score: 69-53)
Victor Nowitzki drives to the basket... FOUL! Offensive foul on Victor Nowitzki! Franz Antetokounmpo drew the charge! [Team fouls: 4] (Victor Nowitzki: 1 personal fouls) TURNOVER! (dead ball)

[05:01] Team_081 possession (Score: 69-53)
Franz Antetokounmpo makes the Midrange and draws the foul on Lauri Carter! And-1! Franz Antetokounmpo to the line for 1. [BONUS: 5 team fouls] (Lauri Carter: 1 personal fouls)   FT 1/1: GOOD Franz Antetokounmpo makes 1/1 from the line.
Score: 72-53

[04:47] Team_046 possession (Score: 72-53)
Cade Wall attempts a Layup. Contested by Franz Antetokounmpo (4.9 feet, ZONE). CADE WALL MAKES IT! Assist: Kevin Allen
Score: 72-55

[04:31] Team_081 possession (Score: 72-55)
Julius Durant drives and kicks out. Vince Adebayo attempts a 3Pt. Contested by Lauri Carter (3.3 feet, MAN). Vince Adebayo misses. Rebound secured by Cade Wall.

[04:19] Team_046 possession (Score: 72-55)
FOUL! Reach-in foul on Bradley Sabonis during the drive. [IN THE BONUS! 6 team fouls] Cade Wall to the line for 2 free throws. (Bradley Sabonis: 2 personal fouls)   FT 1/2: GOOD   FT 2/2: GOOD Cade Wall makes 2/2 from the line.
Score: 72-57

[04:07] Team_081 possession (Score: 72-57)
Julius Durant drives and kicks out. Julius Durant attempts a 3Pt. Contested by Lauri Carter (3.4 feet, ZONE). JULIUS DURANT MAKES IT!
Score: 75-57

[03:54] Team_046 possession (Score: 75-57)
Lauri Carter drives and kicks out. FOUL! Shooting foul on Julius Durant. D'Angelo O'Neal to the line for 2 free throws. [BONUS: 7 team fouls] (Julius Durant: 1 personal fouls)   FT 1/2: GOOD   FT 2/2: MISS D'Angelo O'Neal makes 1/2 from the line. FOUL! Loose ball foul on Franz Antetokounmpo during the free throw rebound! [IN THE BONUS! 8 team fouls] Cade Wall to the line for 2 free throws. (Franz Antetokounmpo: 3 personal fouls)   FT 1/2: GOOD   FT 2/2: MISS Cade Wall makes 1/2 from the line. Offensive rebound by Kevin Allen! Kevin Allen kicks it out.
Score: 75-59

[03:41] Team_046 possession (Score: 75-59)
Cade Wall drives to the basket... Cade Wall throws a bad pass! Stolen by Franz Antetokounmpo! TURNOVER! (live ball)

[03:23] Team_081 possession (Score: 75-59)
Franz Antetokounmpo drives and kicks out. Bradley Leonard attempts a 3Pt. Contested by Victor Nowitzki (5.7 feet, MAN). Bradley Leonard misses. Rebound secured by Kevin Allen.

[03:07] Team_046 possession (Score: 75-59)
Lauri Carter drives, Vince Adebayo stays with him. Lauri Carter attempts a Layup. Contested by Vince Adebayo (3.9 feet, MAN). LAURI CARTER MAKES IT! Assist: Victor Nowitzki
Score: 75-61

[02:55] Team_081 possession (Score: 75-61)
Bradley Sabonis drives, Cade Wall stays with him. Bradley Sabonis attempts a Dunk. Contested by Cade Wall (3.9 feet, MAN). BRADLEY SABONIS MAKES IT!
Score: 77-61

[02:38] Team_046 possession (Score: 77-61)
Cade Wall makes the Midrange and draws the foul on Vince Adebayo! And-1! Cade Wall to the line for 1. [BONUS: 9 team fouls] (Vince Adebayo: 2 personal fouls)   FT 1/1: GOOD Cade Wall makes 1/1 from the line.
Score: 77-64

[02:21] Team_081 possession (Score: 77-64)
FOUL! Shooting foul on Kevin Allen. Franz Antetokounmpo to the line for 2 free throws. [BONUS: 6 team fouls] (Kevin Allen: 3 personal fouls)   FT 1/2: GOOD   FT 2/2: MISS Franz Antetokounmpo makes 1/2 from the line. Offensive rebound by Franz Antetokounmpo! Franz Antetokounmpo puts it back in!
Score: 80-64

[02:05] Team_046 possession (Score: 80-64)
Lauri Carter drives and kicks out. Cade Wall attempts a Midrange. Contested by Vince Adebayo (3.8 feet, ZONE). Cade Wall misses. Rebound secured by Franz Antetokounmpo.

[01:48] Team_081 possession (Score: 80-64)
Julius Durant drives, Kevin Allen stays with him. Julius Durant attempts a Dunk. Contested by Kevin Allen (5.1 feet, ZONE). JULIUS DURANT MAKES IT!
Score: 82-64

[01:38] Team_046 possession (Score: 82-64)
Cade Wall drives, Franz Antetokounmpo stays with him. Cade Wall attempts a Dunk. Contested by Franz Antetokounmpo (5.2 feet, ZONE). Cade Wall misses. Rebound secured by Bradley Sabonis.

[01:21] Team_081 possession (Score: 82-64)
Franz Antetokounmpo drives and kicks out. Julius Durant attempts a 3Pt. Contested by Victor Nowitzki (5.9 feet, ZONE). Julius Durant misses. Rebound secured by Lauri Carter.

[01:06] Team_046 possession (Score: 82-64)
Cade Wall drives and kicks out. Kevin Allen makes the Midrange and draws the foul on Franz Antetokounmpo! And-1! Kevin Allen to the line for 1. [BONUS: 10 team fouls] (Franz Antetokounmpo: 4 personal fouls)   FT 1/1: MISS Kevin Allen makes 0/1 from the line. Offensive rebound by Cade Wall! Cade Wall kicks it out.
Score: 82-66

[00:48] Team_046 possession (Score: 82-66)
Kevin Allen attempts a Midrange. Contested by Vince Adebayo (4.2 feet, ZONE). Kevin Allen misses. Offensive rebound by Lauri Carter! Lauri Carter kicks it out.

[00:33] Team_046 possession (Score: 82-66)
Lauri Carter attempts a 3Pt. Contested by Vince Adebayo (4.2 feet, MAN). Lauri Carter misses. Rebound secured by Franz Antetokounmpo.

[00:22] Team_081 possession (Score: 82-66)
Bradley Sabonis attempts a 3Pt. Contested by Cade Wall (4.2 feet, MAN). Bradley Sabonis misses. Rebound secured by Lauri Carter.

[00:06] Team_046 possession (Score: 82-66)
D'Angelo O'Neal attempts a Midrange. Contested by Julius Durant (4.7 feet, MAN). D'Angelo O'Neal misses. Rebound secured by Franz Antetokounmpo.

================================================================================
                              3RD QUARTER COMPLETE                              
================================================================================

3RD QUARTER SCORE: Team_081 33, Team_046 24

BOX SCORE:
================================================================================

Team_081
--------------------------------------------------------------------------------
Player                MIN  PTS  REB  AST  TO      FG   FG%      3P   3P%
--------------------------------------------------------------------------------
Bradley Leonard        28   11    0    0   0   4/5    80.0     0/0   0.0
Julius Durant          28   10    0    0   0   4/6    66.7     0/0   0.0
Franz Antetokounmpo    28    8    3    1   0   3/5    60.0     0/0   0.0
Vince Adebayo          26    2    2    3   0   1/2    50.0     0/0   0.0
Bradley Sabonis        28    2    4    1   0   1/2    50.0     0/0   0.0

TEAM: FG: 13/20 (65.0%), 3PT: 4/8 (50.0%), REB: 9 (1 off, 8 def), AST: 5, TO: 1
TEAM FOULS: 10 [Team_046 in BONUS]


Team_046
--------------------------------------------------------------------------------
Player                MIN  PTS  REB  AST  TO      FG   FG%      3P   3P%
--------------------------------------------------------------------------------
Cade Wall              26    7    5    0   0   3/5    60.0     0/0   0.0
Victor Nowitzki        26    5    0    1   0   2/2   100.0     0/0   0.0
Lauri Carter           28    4    4    0   0   2/5    40.0     0/0   0.0
Kevin Allen            26    4    3    1   0   2/2   100.0     0/0   0.0
D'Angelo O'Neal        26    0    0    3   0   0/3     0.0     0/0   0.0

TEAM: FG: 9/17 (52.9%), 3PT: 0/4 (0.0%), REB: 12 (5 off, 7 def), AST: 5, TO: 4
TEAM FOULS: 6 [Team_081 in BONUS]

================================================================================

================================================================================
                       4TH QUARTER - Team_081 vs Team_046                       
================================================================================

[12:00] Team_081 possession (Score: 82-66)
Bradley Sabonis makes the Dunk and draws the foul on Cade Wall! And-1! Bradley Sabonis to the line for 1. [Team fouls: 1] (Cade Wall: 1 personal fouls)   FT 1/1: GOOD Bradley Sabonis makes 1/1 from the line.
Score: 85-66

[11:45] Team_046 possession (Score: 85-66)
Victor Nowitzki attempts a 3Pt. Contested by Bradley Leonard (4.1 feet, MAN). Victor Nowitzki misses. Rebound secured by Franz Antetokounmpo.

[11:35] Team_081 possession (Score: 85-66)
FOUL! Shooting foul on Victor Nowitzki. Bradley Leonard to the line for 2 free throws. [Team fouls: 2] (Victor Nowitzki: 1 personal fouls)   FT 1/2: GOOD   FT 2/2: GOOD Bradley Leonard makes 2/2 from the line.
Score: 87-66

[11:24] Team_046 possession (Score: 87-66)
Victor Nowitzki attempts a Layup. BLOCKED BY FRANZ ANTETOKOUNMPO! Ball deflects out of bounds off Victor Nowitzki.

[11:06] Team_081 possession (Score: 87-66)
Bradley Leonard throws a bad pass out of bounds! TURNOVER! (dead ball)

[11:06] Substitution (Team_081): Julius Durant OUT → Dejounte Bane IN (stamina_rule2)

[11:06] Substitution (Team_081): Bradley Leonard OUT → Lamelo Wade IN (stamina_rule2)

[11:06] Substitution (Team_081): Vince Adebayo OUT → Larry Adebayo IN (stamina_rule2)

[11:06] Substitution (Team_081): Bradley Sabonis OUT → Chris Holiday IN (stamina_rule2)

[11:06] Substitution (Team_081): Franz Antetokounmpo OUT → D'Angelo Markkanen IN (stamina_rule2)

[11:06] Substitution (Team_046): D'Angelo O'Neal OUT → Collin Butler IN (stamina_rule2)

[11:06] Substitution (Team_046): Victor Nowitzki OUT → Manu Dosunmu IN (stamina_rule2)

[11:06] Substitution (Team_046): Lauri Carter OUT → Josh Barrett IN (stamina_rule2)

[11:06] Substitution (Team_046): Cade Wall OUT → Chris LaVine IN (stamina_rule2)

[11:06] Substitution (Team_046): Kevin Allen OUT → Paul DeRozan IN (stamina_rule2)

[10:49] Team_046 possession (Score: 87-66)
Josh Barrett attempts a 3Pt. Contested by Larry Adebayo (5.4 feet, MAN). Josh Barrett misses. Rebound secured by Larry Adebayo.

[10:31] Team_081 possession (Score: 87-66)
Lamelo Wade attempts a 3Pt. Contested by Collin Butler (3.8 feet, ZONE). Lamelo Wade misses. Rebound secured by Paul DeRozan.

[10:20] Team_046 possession (Score: 87-66)
Manu Dosunmu throws a bad pass! Stolen by Lamelo Wade! TURNOVER! (live ball)

[10:04] Team_081 possession (Score: 87-66)
D'Angelo Markkanen drives, Chris LaVine stays with him. D'Angelo Markkanen attempts a Layup. Contested by Chris LaVine (4.0 feet, MAN). D'Angelo Markkanen misses. Offensive rebound by Lamelo Wade! Lamelo Wade kicks it out.

[09:49] Team_081 possession (Score: 87-66)
Chris Holiday drives and kicks out. Lamelo Wade attempts a 3Pt. Contested by Collin Butler (3.9 feet, ZONE). Lamelo Wade misses. Rebound secured by Paul DeRozan.

[09:35] Team_046 possession (Score: 87-66)
FOUL! Shooting foul on Chris Holiday. Paul DeRozan to the line for 2 free throws. [Team fouls: 1] (Chris Holiday: 1 personal fouls)   FT 1/2: MISS   FT 2/2: MISS Paul DeRozan makes 0/2 from the line. Rebound secured by Chris Holiday.

[09:17] Team_081 possession (Score: 87-66)
Chris Holiday attempts a 3Pt. Contested by Collin Butler (3.9 feet, ZONE). Chris Holiday misses. Rebound secured by Chris LaVine.

[09:02] Team_046 possession (Score: 87-66)
Josh Barrett attempts a 3Pt. Contested by Chris Holiday (4.3 feet, ZONE). JOSH BARRETT MAKES IT! Assist: Chris LaVine
Score: 87-69

[08:47] Team_081 possession (Score: 87-69)
Dejounte Bane attempts a 3Pt. Contested by Collin Butler (4.1 feet, MAN). Dejounte Bane misses. Rebound secured by Paul DeRozan.

[08:34] Team_046 possession (Score: 87-69)
FOUL! Shooting foul on D'Angelo Markkanen. Paul DeRozan to the line for 2 free throws. [Team fouls: 2] (D'Angelo Markkanen: 1 personal fouls)   FT 1/2: GOOD   FT 2/2: GOOD Paul DeRozan makes 2/2 from the line.
Score: 87-71

[08:21] Team_081 possession (Score: 87-71)
D'Angelo Markkanen attempts a 3Pt. Contested by Josh Barrett (5.0 feet, ZONE). D'ANGELO MARKKANEN MAKES IT! Assist: Larry Adebayo
Score: 90-71

[08:09] Team_046 possession (Score: 90-71)
Manu Dosunmu attempts a Midrange. BLOCKED BY CHRIS HOLIDAY! Ball is loose! Offensive rebound by Chris LaVine! Chris LaVine kicks it out.

[07:54] Team_046 possession (Score: 90-71)
Manu Dosunmu attempts a Midrange. Contested by Chris Holiday (4.8 feet, ZONE). Manu Dosunmu misses. Rebound secured by Chris Holiday.

[07:38] Team_081 possession (Score: 90-71)
Dejounte Bane attempts a Midrange. Contested by Chris LaVine (4.1 feet, ZONE). Dejounte Bane misses. Rebound secured by Paul DeRozan.

[07:24] Team_046 possession (Score: 90-71)
Chris LaVine attempts a Midrange. Contested by Chris Holiday (4.7 feet, MAN). Chris LaVine misses. Rebound secured by Larry Adebayo.

[07:06] Team_081 possession (Score: 90-71)
D'Angelo Markkanen attempts a Midrange. Contested by Chris LaVine (4.0 feet, MAN). D'Angelo Markkanen misses. Rebound secured by Chris LaVine.

[06:55] Team_046 possession (Score: 90-71)
Collin Butler attempts a 3Pt. Contested by Chris Holiday (4.6 feet, ZONE). COLLIN BUTLER MAKES IT! Assist: Chris LaVine
Score: 90-74

[06:37] Team_081 possession (Score: 90-74)
Dejounte Bane attempts a 3Pt. Contested by Collin Butler (4.1 feet, ZONE). Dejounte Bane misses. Offensive rebound by Chris Holiday! Chris Holiday kicks it out.

[06:23] Team_081 possession (Score: 90-74)
FOUL! Offensive foul on Chris Holiday! Chris LaVine drew the charge! [Team fouls: 3] (Chris Holiday: 2 personal fouls) TURNOVER! (dead ball)

[06:10] Team_046 possession (Score: 90-74)
Paul DeRozan attempts a Midrange. Contested by Chris Holiday (4.2 feet, MAN). Paul DeRozan misses. Offensive rebound by Chris LaVine! Chris LaVine kicks it out.

[05:56] Team_046 possession (Score: 90-74)
Josh Barrett drives and kicks out. Paul DeRozan attempts a 3Pt. Contested by Chris Holiday (4.3 feet, ZONE). Paul DeRozan misses. Rebound secured by Chris Holiday.

[05:41] Team_081 possession (Score: 90-74)
Dejounte Bane makes the Dunk and draws the foul on Chris LaVine! And-1! Dejounte Bane to the line for 1. [Team fouls: 3] (Chris LaVine: 1 personal fouls)   FT 1/1: GOOD Dejounte Bane makes 1/1 from the line.
Score: 93-74

[05:30] Team_046 possession (Score: 93-74)
Paul DeRozan attempts a Midrange. Contested by Chris Holiday (4.2 feet, MAN). Paul DeRozan misses. Rebound secured by Chris Holiday.

[05:17] Team_081 possession (Score: 93-74)
Chris Holiday attempts a Layup. Contested by Chris LaVine (3.9 feet, MAN). Chris Holiday misses. Rebound secured by Chris LaVine.

[05:05] Team_046 possession (Score: 93-74)
FOUL! Holding foul on Lamelo Wade. [Team fouls: 4] No free throws, side out. (Lamelo Wade: 1 personal fouls)

[04:53] Team_046 possession (Score: 93-74)
Manu Dosunmu attempts a Midrange. Contested by Lamelo Wade (5.3 feet, MAN). MANU DOSUNMU MAKES IT! Assist: Josh Barrett
Score: 93-76

[04:40] Team_081 possession (Score: 93-76)
Chris Holiday drives to the basket... FOUL! Offensive foul on Chris Holiday! Chris LaVine drew the charge! [Team fouls: 5] (Chris Holiday: 3 personal fouls) TURNOVER! (dead ball)

[04:25] Team_046 possession (Score: 93-76)
FOUL! Reach-in foul on Chris Holiday during the drive. [IN THE BONUS! 6 team fouls] Manu Dosunmu to the line for 2 free throws. (Chris Holiday: 4 personal fouls)   FT 1/2: MISS   FT 2/2: GOOD Manu Dosunmu makes 1/2 from the line.
Score: 93-77

[04:10] Team_081 possession (Score: 93-77)
D'Angelo Markkanen attempts a Layup. Contested by Chris LaVine (4.1 feet, ZONE). D'ANGELO MARKKANEN MAKES IT!
Score: 95-77

[03:52] Team_046 possession (Score: 95-77)
Josh Barrett attempts a Layup. BLOCKED BY CHRIS HOLIDAY! Ball is loose! Rebound secured by Larry Adebayo.

[03:40] Team_081 possession (Score: 95-77)
D'Angelo Markkanen attempts a Midrange. Contested by Chris LaVine (4.1 feet, MAN). D'Angelo Markkanen misses. Rebound secured by Paul DeRozan.

[03:26] Team_046 possession (Score: 95-77)
Collin Butler attempts a Midrange. Contested by Larry Adebayo (5.6 feet, ZONE). COLLIN BUTLER MAKES IT! Assist: Chris LaVine
Score: 95-79

[03:10] Team_081 possession (Score: 95-79)
D'Angelo Markkanen attempts a Layup. Contested by Chris LaVine (4.1 feet, MAN). D'ANGELO MARKKANEN MAKES IT! Assist: Lamelo Wade
Score: 97-79

[02:53] Team_046 possession (Score: 97-79)
Manu Dosunmu attempts a Layup. BLOCKED BY LAMELO WADE! Ball is loose! Offensive rebound by Chris LaVine! Chris LaVine kicks it out.

[02:42] Team_046 possession (Score: 97-79)
Chris LaVine attempts a 3Pt. Contested by Chris Holiday (4.8 feet, ZONE). Chris LaVine misses. Rebound secured by Lamelo Wade.

[02:30] Team_081 possession (Score: 97-79)
FOUL! Reach-in foul on Chris LaVine during the drive. [Team fouls: 4] No free throws, side out. (Chris LaVine: 2 personal fouls)

[02:18] Team_081 possession (Score: 97-79)
Larry Adebayo attempts a Midrange. Contested by Josh Barrett (5.0 feet, ZONE). LARRY ADEBAYO MAKES IT! Assist: Chris Holiday
Score: 99-79

[02:07] Team_046 possession (Score: 99-79)
Collin Butler drives and kicks out. Collin Butler attempts a 3Pt. Contested by Dejounte Bane (5.7 feet, MAN). COLLIN BUTLER MAKES IT! Assist: Paul DeRozan
Score: 99-82

[01:54] Team_081 possession (Score: 99-82)
Dejounte Bane drives, picks up Paul DeRozan. Help arrives from Manu Dosunmu! Dejounte Bane attempts a Dunk. Contested by Manu Dosunmu (5.3 feet, ZONE). DEJOUNTE BANE MAKES IT!
Score: 101-82

[01:37] Team_046 possession (Score: 101-82)
Manu Dosunmu attempts a Midrange. Contested by Lamelo Wade (5.4 feet, MAN). MANU DOSUNMU MAKES IT!
Score: 101-84

[01:23] Team_081 possession (Score: 101-84)
Chris Holiday attempts a 3Pt. Contested by Chris LaVine (4.2 feet, MAN). Chris Holiday misses. Rebound secured by Chris LaVine.

[01:08] Team_046 possession (Score: 101-84)
Collin Butler drives and kicks out. Chris LaVine attempts a Midrange. Contested by Larry Adebayo (5.5 feet, ZONE). CHRIS LAVINE MAKES IT! Assist: Paul DeRozan
Score: 101-86

[00:57] Team_081 possession (Score: 101-86)
Larry Adebayo drives, Josh Barrett stays with him. Larry Adebayo attempts a Dunk. Contested by Josh Barrett (5.1 feet, MAN). Larry Adebayo misses. Rebound secured by Paul DeRozan.

[00:44] Team_046 possession (Score: 101-86)
Chris LaVine drives, Chris Holiday stays with him. Chris LaVine attempts a Layup. Contested by Chris Holiday (5.0 feet, ZONE). CHRIS LAVINE MAKES IT!
Score: 101-88

[00:32] Team_081 possession (Score: 101-88)
Dejounte Bane attempts a Layup. Contested by Collin Butler (4.5 feet, MAN). Dejounte Bane misses. Rebound secured by Manu Dosunmu.

[00:13] Team_046 possession (Score: 101-88)
Josh Barrett attempts a Layup. Contested by Chris Holiday (4.7 feet, ZONE). JOSH BARRETT MAKES IT! Assist: Manu Dosunmu
Score: 101-90

================================================================================
                              4TH QUARTER COMPLETE                              
================================================================================

4TH QUARTER SCORE: Team_081 19, Team_046 24

BOX SCORE:
================================================================================

Team_081
--------------------------------------------------------------------------------
Player                MIN  PTS  REB  AST  TO      FG   FG%      3P   3P%
--------------------------------------------------------------------------------
D'Angelo Markkanen     19    7    0    0   0   3/5    60.0     0/0   0.0
Dejounte Bane          19    5    0    0   0   2/5    40.0     0/0   0.0
Bradley Sabonis        29    3    0    0   0   1/1   100.0     0/0   0.0
Bradley Leonard        29    2    0    0   0   1/1   100.0     0/0   0.0
Larry Adebayo          21    2    3    1   0   1/2    50.0     0/0   0.0
Franz Antetokounmpo    29    0    1    0   0   0/0     0.0     0/0   0.0
Lamelo Wade            19    0    2    1   0   0/1     0.0     0/0   0.0
Chris Holiday          19    0    5    1   0   0/4     0.0     0/0   0.0

TEAM: FG: 8/19 (42.1%), 3PT: 1/5 (20.0%), REB: 11 (2 off, 9 def), AST: 3, TO: 3
TEAM FOULS: 6 [Team_046 in BONUS]


Team_046
--------------------------------------------------------------------------------
Player                MIN  PTS  REB  AST  TO      FG   FG%      3P   3P%
--------------------------------------------------------------------------------
Collin Butler          21    8    0    0   0   3/3   100.0     0/0   0.0
Josh Barrett           19    5    0    1   0   2/5    40.0     0/0   0.0
Manu Dosunmu           21    5    1    1   0   3/4    75.0     0/0   0.0
Chris LaVine           21    4    7    3   0   2/4    50.0     0/0   0.0
Paul DeRozan           21    2    6    2   0   1/3    33.3     0/0   0.0
Victor Nowitzki        27    0    0    0   0   0/2     0.0     0/0   0.0

TEAM: FG: 11/21 (52.4%), 3PT: 2/5 (40.0%), REB: 14 (3 off, 11 def), AST: 7, TO: 1
TEAM FOULS: 4

================================================================================

================================================================================
                               FULL GAME COMPLETE                               
================================================================================

FINAL SCORE: Team_081 101, Team_046 90

SCORING BY QUARTER:
--------------------------------------------------------------------------------
Team                     Q1     Q2     Q3     Q4    FINAL
--------------------------------------------------------------------------------
Team_081                 21     28     33     19      101
Team_046                 22     20     24     24       90
--------------------------------------------------------------------------------

FULL GAME BOX SCORE:
================================================================================

Team_081
--------------------------------------------------------------------------------
Player                MIN  PTS  REB  AST  TO      FG   FG%      3P   3P%      FT STL BLK
--------------------------------------------------------------------------------
Julius Durant          29   13    0    0   1   5/10   50.0   1/2    50.0   1/1     1   0
Bradley Leonard        29   18    0    3   4   7/11   63.6   4/5    80.0   2/5     1   0
Bradley Sabonis        29    8    7    1   3   4/8    50.0   0/2     0.0   2/2     1   0
Franz Antetokounmpo    29   17   11    2   2   6/9    66.7   0/1     0.0   5/6     1   3
Vince Adebayo          27    4    3    3   0   2/5    40.0   0/3     0.0   2/2     1   0
Larry Adebayo          21    2    9    1   0   1/4    25.0   0/2     0.0   0/0     0   0
Dejounte Bane          19    7    0    1   1   2/6    33.3   0/2     0.0   3/3     0   0
Lamelo Wade            19   14    4    1   0   5/7    71.4   3/5    60.0   8/10    1   1
Chris Holiday          19    0    7    1   1   0/5     0.0   0/3     0.0   0/0     0   3
D'Angelo Markkanen     19   15    0    0   0   6/9    66.7   2/2   100.0   6/6     0   0

TEAM: FG: 39/75 (52.0%), 3PT: 10/27 (37.0%), REB: 39 (5 off, 34 def), AST: 13, TO: 12


Team_046
--------------------------------------------------------------------------------
Player                MIN  PTS  REB  AST  TO      FG   FG%      3P   3P%      FT STL BLK
--------------------------------------------------------------------------------
Lauri Carter           29    8    7    0   3   4/9    44.4   1/4    25.0   1/3     0   0
D'Angelo O'Neal        27    4    0    4   2   1/6    16.7   0/4     0.0   6/8     0   0
Victor Nowitzki        27    5    0    4   3   2/5    40.0   0/2     0.0   1/1     0   0
Cade Wall              27   12   13    0   0   5/10   50.0   0/1     0.0   3/3     1   0
Kevin Allen            27   11    6    1   1   4/5    80.0   0/1     0.0   3/4     2   0
Collin Butler          21   14    0    0   1   8/9    88.9   1/2    50.0   2/3     0   0
Manu Dosunmu           21   11    3    1   1   4/8    50.0   0/2     0.0   2/3     0   0
Chris LaVine           21    6   10    3   0   1/8    12.5   0/3     0.0   2/3     1   0
Paul DeRozan           21    6   10    4   0   3/6    50.0   0/0     0.0   4/6     0   0
Josh Barrett           19    5    0    1   0   3/7    42.9   2/3    66.7   0/0     0   0

TEAM: FG: 37/75 (49.3%), 3PT: 4/22 (18.2%), REB: 50 (14 off, 36 def), AST: 18, TO: 11

================================================================================
