================================================================================
                        FULL GAME - Team_082 vs Team_054                        
================================================================================

================================================================================
                       1ST QUARTER - Team_082 vs Team_054                       
================================================================================

[12:00] Team_082 possession (Score: 0-0)
Jrue Green drives, Blake Russell stays with him. Jrue Green attempts a Layup. Contested by Blake Russell (3.3 feet, ZONE). JRUE GREEN MAKES IT!
Score: 2-0

[11:49] Team_054 possession (Score: 2-0)
Malcolm Harden drives, picks up Jrue Green. Help arrives from Dwyane O'Neal! Malcolm Harden attempts a Layup. Contested by Dwyane O'Neal (5.3 feet, ZONE). Malcolm Harden misses. Rebound secured by Dwyane O'Neal.

[11:34] Team_082 possession (Score: 2-0)
Julius Anthony drives and kicks out. Julius Carter attempts a 3Pt. Contested by Lauri Irving (3.4 feet, ZONE). Julius Carter misses. Rebound secured by Luka Brogdon.

[11:18] Team_054 possession (Score: 2-0)
Malcolm Harden attempts a Midrange. Contested by Jrue Green (5.3 feet, ZONE). Malcolm Harden misses. Rebound secured by Jrue Green.

[11:04] Team_082 possession (Score: 2-0)
Dwyane O'Neal attempts a Layup. BLOCKED BY LAURI IRVING! Ball is loose! Rebound secured by Lauri Irving.

[10:50] Team_054 possession (Score: 2-0)
Malcolm Harden drives to the basket... Malcolm Harden throws a bad pass out of bounds! TURNOVER! (dead ball)

[10:36] Team_082 possession (Score: 2-0)
FOUL! Reach-in foul on Luka Brogdon during the drive. [Team fouls: 1] No free throws, side out. (Luka Brogdon: 1 personal fouls)

[10:17] Team_082 possession (Score: 2-0)
Jrue Green attempts a Midrange. Contested by Luka Brogdon (4.3 feet, MAN). Jrue Green misses. FOUL! Loose ball foul on Lauri Irving during the rebound battle. [Team fouls: 2] No free throws, side out. (Lauri Irving: 1 personal fouls)

[09:59] Team_082 possession (Score: 2-0)
Jrue Green drives, Blake Russell stays with him. Jrue Green attempts a Layup. Contested by Blake Russell (3.3 feet, ZONE). JRUE GREEN MAKES IT! Assist: Kristaps Fox
Score: 4-0

[09:48] Team_054 possession (Score: 4-0)
Blake Russell attempts a Midrange. Wide open! Julius Carter is 6.2 feet away. [MAN] Blake Russell misses. Offensive rebound by Blake Russell! Blake Russell puts it back in!
Score: 4-2

[09:33] Team_082 possession (Score: 4-2)
Julius Carter attempts a 3Pt. Contested by Lauri Irving (3.8 feet, ZONE). JULIUS CARTER MAKES IT! Assist: Julius Anthony
Score: 7-2

[09:17] Team_054 possession (Score: 7-2)
FOUL! Offensive foul on Lauri Irving! Dwyane O'Neal drew the charge! [Team fouls: 3] (Lauri Irving: 2 personal fouls) TURNOVER! (dead ball)

[09:04] Team_082 possession (Score: 7-2)
Julius Carter attempts a Midrange. Contested by Vince Ball (4.5 feet, ZONE). Julius Carter misses. Offensive rebound by Julius Carter! Julius Carter kicks it out.

[08:52] Team_082 possession (Score: 7-2)
Julius Anthony attempts a Layup. BLOCKED BY MALCOLM HARDEN! Ball is loose! Rebound secured by Luka Brogdon.

[08:38] Team_054 possession (Score: 7-2)
Blake Russell attempts a Midrange. Contested by Jrue Green (5.5 feet, ZONE). Blake Russell misses. Rebound secured by Julius Carter.

[08:21] Team_082 possession (Score: 7-2)
Dwyane O'Neal drives to the basket... Dwyane O'Neal commits a violation (traveling/carry)! TURNOVER! (dead ball)

[08:08] Team_054 possession (Score: 7-2)
Malcolm Harden attempts a Midrange. Contested by Julius Anthony (4.8 feet, MAN). Malcolm Harden misses. Rebound secured by Julius Carter.

[07:55] Team_082 possession (Score: 7-2)
Julius Carter attempts a 3Pt. Contested by Lauri Irving (3.8 feet, ZONE). Julius Carter misses. Rebound secured by Luka Brogdon.

[07:37] Team_054 possession (Score: 7-2)
Malcolm Harden attempts a Midrange. Contested by Kristaps Fox (4.5 feet, ZONE). Malcolm Harden misses. Rebound secured by Jrue Green.

[07:26] Team_082 possession (Score: 7-2)
Kristaps Fox drives and kicks out. Kristaps Fox attempts a 3Pt. Contested by Vince Ball (4.1 feet, MAN). Kristaps Fox misses. Rebound secured by Lauri Irving.

[07:11] Team_054 possession (Score: 7-2)
Lauri Irving attempts a Layup. Contested by Jrue Green (5.6 feet, ZONE). LAURI IRVING MAKES IT! Assist: Blake Russell
Score: 7-4

[06:56] Team_082 possession (Score: 7-4)
Julius Anthony attempts a Midrange. Contested by Malcolm Harden (4.5 feet, MAN). Julius Anthony misses. Rebound secured by Luka Brogdon.

[06:46] Team_054 possession (Score: 7-4)
Lauri Irving attempts a 3Pt. Contested by Julius Anthony (5.0 feet, ZONE). Lauri Irving misses. Rebound secured by Julius Carter.

[06:36] Team_082 possession (Score: 7-4)
Kristaps Fox drives, Blake Russell stays with him. Kristaps Fox attempts a Dunk. Contested by Blake Russell (3.1 feet, ZONE). KRISTAPS FOX MAKES IT!
Score: 9-4

[06:22] Team_054 possession (Score: 9-4)
Blake Russell attempts a Midrange. Wide open! Julius Carter is 6.2 feet away. [MAN] BLAKE RUSSELL MAKES IT!
Score: 9-6

[06:08] Team_082 possession (Score: 9-6)
Julius Anthony attempts a 3Pt. Contested by Lauri Irving (3.8 feet, ZONE). Julius Anthony misses. Offensive rebound by Jrue Green! Jrue Green kicks it out.

[05:55] Team_082 possession (Score: 9-6)
Julius Anthony drives to the basket... Julius Anthony commits a violation (traveling/carry)! TURNOVER! (dead ball)

[05:41] Team_054 possession (Score: 9-6)
Blake Russell attempts a 3Pt. Contested by Dwyane O'Neal (3.7 feet, ZONE). Blake Russell misses. Rebound secured by Jrue Green.

[05:29] Team_082 possession (Score: 9-6)
FOUL! Shooting foul on Lauri Irving. Julius Anthony to the line for 3 free throws. [Team fouls: 4] (Lauri Irving: 3 personal fouls)   FT 1/3: GOOD   FT 2/3: MISS   FT 3/3: GOOD Julius Anthony makes 2/3 from the line.
Score: 11-6

[05:19] Team_054 possession (Score: 11-6)
Vince Ball drives and kicks out. Malcolm Harden attempts a Midrange. Contested by Julius Anthony (4.5 feet, MAN). Malcolm Harden misses. Rebound secured by Julius Carter.

[05:06] Team_082 possession (Score: 11-6)
Dwyane O'Neal attempts a Layup. BLOCKED BY VINCE BALL! Ball deflects out of bounds off Dwyane O'Neal.

[04:50] Team_054 possession (Score: 11-6)
FOUL! Reach-in foul on Kristaps Fox during the drive. [Team fouls: 1] No free throws, side out. (Kristaps Fox: 1 personal fouls)

[04:39] Team_054 possession (Score: 11-6)
Malcolm Harden attempts a 3Pt. Contested by Julius Anthony (4.9 feet, MAN). Malcolm Harden misses. Rebound secured by Julius Carter.

[04:26] Team_082 possession (Score: 11-6)
Jrue Green attempts a 3Pt. Contested by Lauri Irving (3.8 feet, ZONE). Jrue Green misses. Offensive rebound by Julius Carter! Julius Carter kicks it out.

[04:16] Team_082 possession (Score: 11-6)
FOUL! Holding foul on Malcolm Harden. [IN THE BONUS! 5 team fouls] Julius Anthony to the line for 2 free throws. (Malcolm Harden: 1 personal fouls)   FT 1/2: GOOD   FT 2/2: MISS Julius Anthony makes 1/2 from the line. Offensive rebound by Julius Carter! Julius Carter kicks it out.
Score: 12-6

[04:00] Team_082 possession (Score: 12-6)
Julius Carter attempts a Layup. Contested by Blake Russell (3.6 feet, MAN). Julius Carter misses. Rebound secured by Vince Ball.

[03:50] Team_054 possession (Score: 12-6)
Malcolm Harden attempts a 3Pt. Contested by Julius Anthony (4.9 feet, MAN). MALCOLM HARDEN MAKES IT! Assist: Lauri Irving
Score: 12-9

[03:40] Team_082 possession (Score: 12-9)
Julius Anthony attempts a 3Pt. Contested by Lauri Irving (4.0 feet, ZONE). Julius Anthony misses. FOUL! Loose ball foul on Blake Russell during the rebound battle. [IN THE BONUS! 6 team fouls] Jrue Green to the line for 2 free throws. (Blake Russell: 1 personal fouls)   FT 1/2: GOOD   FT 2/2: GOOD Jrue Green makes 2/2 from the line.
Score: 14-9

[03:27] Team_054 possession (Score: 14-9)
Malcolm Harden drives, picks up Jrue Green. Help arrives from Dwyane O'Neal! Malcolm Harden attempts a Layup. Contested by Dwyane O'Neal (5.6 feet, ZONE). MALCOLM HARDEN MAKES IT! Assist: Blake Russell
Score: 14-11

[03:13] Team_082 possession (Score: 14-11)
Julius Carter drives, Blake Russell stays with him. Julius Carter attempts a Dunk. Contested by Blake Russell (3.7 feet, MAN). JULIUS CARTER MAKES IT! Assist: Kristaps Fox
Score: 16-11

[03:00] Team_054 possession (Score: 16-11)
Lauri Irving attempts a Layup. BLOCKED BY JRUE GREEN! Ball is loose! Rebound secured by Jrue Green.

[02:45] Team_082 possession (Score: 16-11)
Kristaps Fox attempts a Layup. Contested by Vince Ball (4.4 feet, MAN). Kristaps Fox misses. Rebound secured by Luka Brogdon.

[02:33] Team_054 possession (Score: 16-11)
Vince Ball throws a bad pass! Stolen by Kristaps Fox! TURNOVER! (live ball)

[02:18] Team_082 possession (Score: 16-11)
FOUL! Shooting foul on Malcolm Harden. Julius Carter to the line for 2 free throws. [BONUS: 7 team fouls] (Malcolm Harden: 2 personal fouls)   FT 1/2: GOOD   FT 2/2: GOOD Julius Carter makes 2/2 from the line.
Score: 18-11

[02:01] Team_054 possession (Score: 18-11)
Lauri Irving attempts a 3Pt. Contested by Jrue Green (5.9 feet, ZONE). Lauri Irving misses. Rebound secured by Dwyane O'Neal.

[01:44] Team_082 possession (Score: 18-11)
Dwyane O'Neal attempts a 3Pt. Contested by Lauri Irving (3.8 feet, MAN). DWYANE O'NEAL MAKES IT! Assist: Jrue Green
Score: 21-11

[01:27] Team_054 possession (Score: 21-11)
FOUL! Shooting foul on Jrue Green. Blake Russell to the line for 2 free throws. [Team fouls: 2] (Jrue Green: 1 personal fouls)   FT 1/2: GOOD   FT 2/2: GOOD Blake Russell makes 2/2 from the line.
Score: 21-13

[01:11] Team_082 possession (Score: 21-13)
Kristaps Fox attempts a 3Pt. Contested by Lauri Irving (4.0 feet, ZONE). KRISTAPS FOX MAKES IT!
Score: 24-13

[01:00] Team_054 possession (Score: 24-13)
Lauri Irving attempts a 3Pt. Contested by Dwyane O'Neal (4.3 feet, MAN). LAURI IRVING MAKES IT! Assist: Vince Ball
Score: 24-16

[00:45] Team_082 possession (Score: 24-16)
FOUL! Holding foul on Luka Brogdon. [IN THE BONUS! 8 team fouls] Jrue Green to the line for 2 free throws. (Luka Brogdon: 2 personal fouls)   FT 1/2: GOOD   FT 2/2: GOOD Jrue Green makes 2/2 from the line.
Score: 26-16

[00:30] Team_054 possession (Score: 26-16)
Malcolm Harden attempts a 3Pt. Contested by Julius Anthony (5.3 feet, MAN). Malcolm Harden misses. Rebound secured by Jrue Green.

[00:14] Team_082 possession (Score: 26-16)
Dwyane O'Neal attempts a 3Pt. Contested by Lauri Irving (4.0 feet, MAN). Dwyane O'Neal misses. Rebound secured by Vince Ball.

================================================================================
                              1ST QUARTER COMPLETE                              
================================================================================

1ST QUARTER SCORE: Team_082 26, Team_054 16

BOX SCORE:
================================================================================

Team_082
--------------------------------------------------------------------------------
Player                MIN  PTS  REB  AST  TO      FG   FG%      3P   3P%
--------------------------------------------------------------------------------
Jrue Green             12    8    6    1   0   4/4   100.0     0/0   0.0
Julius Carter          12    7    9    0   0   3/5    60.0     0/0   0.0
Kristaps Fox           12    5    0    2   0   2/4    50.0     0/0   0.0
Dwyane O'Neal          12    3    2    0   0   1/4    25.0     0/0   0.0
Julius Anthony         12    2    0    1   0   1/4    25.0     0/0   0.0

TEAM: FG: 11/21 (52.4%), 3PT: 5/7 (71.4%), REB: 17 (5 off, 12 def), AST: 4, TO: 2
TEAM FOULS: 2


Team_054
--------------------------------------------------------------------------------
Player                MIN  PTS  REB  AST  TO      FG   FG%      3P   3P%
--------------------------------------------------------------------------------
Blake Russell          12    6    1    2   0   3/5    60.0     0/0   0.0
Malcolm Harden         12    5    0    0   0   2/8    25.0     0/0   0.0
Lauri Irving           12    5    2    1   0   2/5    40.0     0/0   0.0
Luka Brogdon           12    0    5    0   0   0/0     0.0     0/0   0.0
Vince Ball             12    0    2    1   0   0/1     0.0     0/0   0.0

TEAM: FG: 7/19 (36.8%), 3PT: 2/7 (28.6%), REB: 10 (1 off, 9 def), AST: 4, TO: 3
TEAM FOULS: 8 [Team_082 in BONUS]

================================================================================

================================================================================
                       2ND QUARTER - Team_082 vs Team_054                       
================================================================================

[12:00] Team_082 possession (Score: 26-16)
Kristaps Fox drives to the basket... FOUL! Offensive foul on Kristaps Fox! Blake Russell drew the charge! [Team fouls: 1] (Kristaps Fox: 1 personal fouls) TURNOVER! (dead ball)

[11:42] Team_054 possession (Score: 26-16)
Blake Russell drives, Julius Carter stays with him. Blake Russell attempts a Dunk. Wide open! Julius Carter is 6.4 feet away. [MAN] BLAKE RUSSELL MAKES IT! Assist: Lauri Irving
Score: 26-18

[11:26] Team_082 possession (Score: 26-18)
Julius Anthony attempts a Layup. BLOCKED BY BLAKE RUSSELL! Ball goes out off Blake Russell. Julius Anthony's ball!

[11:09] Team_082 possession (Score: 26-18)
FOUL! Shooting foul on Luka Brogdon. Jrue Green to the line for 2 free throws. [Team fouls: 1] (Luka Brogdon: 1 personal fouls)   FT 1/2: MISS   FT 2/2: GOOD Jrue Green makes 1/2 from the line.
Score: 27-18

[10:51] Team_054 possession (Score: 27-18)
Malcolm Harden attempts a 3Pt. Contested by Dwyane O'Neal (4.0 feet, ZONE). Malcolm Harden misses. Rebound secured by Jrue Green.

[10:33] Team_082 possession (Score: 27-18)
Julius Carter drives and kicks out. Julius Anthony attempts a 3Pt. Contested by Lauri Irving (4.0 feet, ZONE). Julius Anthony misses. Rebound secured by Luka Brogdon.

[10:20] Team_054 possession (Score: 27-18)
Blake Russell loses the ball! Stripped by Julius Carter! TURNOVER! (live ball)

[10:05] Team_082 possession (Score: 27-18)
Julius Carter attempts a Layup. Contested by Blake Russell (4.1 feet, ZONE). JULIUS CARTER MAKES IT!
Score: 29-18

[09:51] Team_054 possession (Score: 29-18)
Luka Brogdon attempts a Layup. BLOCKED BY JRUE GREEN! Ball is loose! Offensive rebound by Luka Brogdon! Luka Brogdon kicks it out.

[09:36] Team_054 possession (Score: 29-18)
Vince Ball attempts a 3Pt. Contested by Kristaps Fox (5.0 feet, MAN). VINCE BALL MAKES IT! Assist: Luka Brogdon
Score: 29-21

[09:22] Team_082 possession (Score: 29-21)
Julius Carter drives, Blake Russell stays with him. Julius Carter attempts a Layup. Contested by Blake Russell (4.2 feet, MAN). JULIUS CARTER MAKES IT! Assist: Dwyane O'Neal
Score: 31-21

[09:09] Team_054 possession (Score: 31-21)
Lauri Irving attempts a 3Pt. Wide open! Jrue Green is 6.2 feet away. [ZONE] Lauri Irving misses. Rebound secured by Julius Carter.

[08:53] Team_082 possession (Score: 31-21)
Dwyane O'Neal drives and kicks out. Kristaps Fox attempts a Midrange. Contested by Vince Ball (4.7 feet, ZONE). Kristaps Fox misses. Rebound secured by Luka Brogdon.

[08:37] Team_054 possession (Score: 31-21)
Malcolm Harden attempts a 3Pt. Contested by Dwyane O'Neal (4.3 feet, ZONE). Malcolm Harden misses. Rebound secured by Jrue Green.

[08:21] Team_082 possession (Score: 31-21)
Dwyane O'Neal attempts a 3Pt. Contested by Lauri Irving (4.2 feet, ZONE). Dwyane O'Neal misses. Rebound secured by Vince Ball.

[08:07] Team_054 possession (Score: 31-21)
Lauri Irving drives and kicks out. Luka Brogdon attempts a 3Pt. Contested by Dwyane O'Neal (4.2 feet, ZONE). Luka Brogdon misses. Rebound secured by Jrue Green.

[07:52] Team_082 possession (Score: 31-21)
Dwyane O'Neal attempts a 3Pt. Contested by Lauri Irving (4.3 feet, MAN). Dwyane O'Neal misses. Offensive rebound by Jrue Green! Jrue Green kicks it out.

[07:38] Team_082 possession (Score: 31-21)
Jrue Green drives and kicks out. Julius Anthony attempts a Midrange. Contested by Luka Brogdon (4.8 feet, ZONE). Julius Anthony misses. Offensive rebound by Jrue Green! Jrue Green kicks it out.

[07:21] Team_082 possession (Score: 31-21)
Jrue Green attempts a Midrange. Contested by Luka Brogdon (4.9 feet, ZONE). Jrue Green misses. Rebound secured by Blake Russell.

[07:08] Team_054 possession (Score: 31-21)
Malcolm Harden attempts a Midrange. Contested by Kristaps Fox (5.4 feet, ZONE). Malcolm Harden misses. Rebound secured by Jrue Green.

[06:52] Team_082 possession (Score: 31-21)
FOUL! Reach-in foul on Blake Russell during the drive. [Team fouls: 2] No free throws, side out. (Blake Russell: 1 personal fouls)

[06:37] Team_082 possession (Score: 31-21)
Dwyane O'Neal attempts a Midrange. Contested by Lauri Irving (4.5 feet, MAN). Dwyane O'Neal misses. Rebound secured by Vince Ball.

[06:27] Team_054 possession (Score: 31-21)
Malcolm Harden attempts a Midrange. Contested by Julius Anthony (5.7 feet, MAN). MALCOLM HARDEN MAKES IT!
Score: 31-23

[06:16] Team_082 possession (Score: 31-23)
Jrue Green attempts a 3Pt. Contested by Lauri Irving (4.7 feet, ZONE). Jrue Green misses. Rebound secured by Blake Russell.

[05:58] Team_054 possession (Score: 31-23)
Blake Russell drives and kicks out. Malcolm Harden attempts a Midrange. Contested by Julius Anthony (5.7 feet, MAN). Malcolm Harden misses. Rebound secured by Julius Carter.

[05:42] Team_082 possession (Score: 31-23)
FOUL! Offensive foul on Kristaps Fox! Vince Ball drew the charge! [Team fouls: 2] (Kristaps Fox: 2 personal fouls) TURNOVER! (dead ball)

[05:30] Team_054 possession (Score: 31-23)
Malcolm Harden drives, Julius Anthony stays with him. Malcolm Harden attempts a Layup. Contested by Julius Anthony (5.9 feet, MAN). Malcolm Harden misses. Offensive rebound by Blake Russell! Blake Russell kicks it out.

[05:14] Team_054 possession (Score: 31-23)
Lauri Irving attempts a 3Pt. Wide open! Jrue Green is 6.7 feet away. [ZONE] LAURI IRVING MAKES IT! Assist: Blake Russell
Score: 31-26

[04:58] Team_082 possession (Score: 31-26)
Dwyane O'Neal drives, Lauri Irving stays with him. Dwyane O'Neal attempts a Dunk. Contested by Lauri Irving (4.7 feet, MAN). DWYANE O'NEAL MAKES IT! Assist: Julius Carter
Score: 33-26

[04:44] Team_054 possession (Score: 33-26)
Malcolm Harden attempts a 3Pt. Contested by Dwyane O'Neal (4.9 feet, ZONE). Malcolm Harden misses. Rebound secured by Julius Carter.

[04:27] Team_082 possession (Score: 33-26)
Dwyane O'Neal attempts a 3Pt. Contested by Lauri Irving (4.8 feet, ZONE). Dwyane O'Neal misses. Offensive rebound by Dwyane O'Neal! Dwyane O'Neal kicks it out.

[04:13] Team_082 possession (Score: 33-26)
Julius Carter attempts a Layup. Contested by Blake Russell (5.0 feet, ZONE). JULIUS CARTER MAKES IT! Assist: Dwyane O'Neal
Score: 35-26

[03:55] Team_054 possession (Score: 35-26)
Lauri Irving attempts a 3Pt. Contested by Dwyane O'Neal (5.2 feet, ZONE). Lauri Irving misses. Rebound secured by Julius Carter.

[03:38] Team_082 possession (Score: 35-26)
Dwyane O'Neal attempts a Midrange. Contested by Lauri Irving (4.9 feet, MAN). Dwyane O'Neal misses. Offensive rebound by Julius Carter! Julius Carter kicks it out.

[03:21] Team_082 possession (Score: 35-26)
Dwyane O'Neal drives, Blake Russell stays with him. Dwyane O'Neal attempts a Layup. Contested by Blake Russell (4.9 feet, ZONE). DWYANE O'NEAL MAKES IT! Assist: Jrue Green
Score: 37-26

[03:03] Team_054 possession (Score: 37-26)
Lauri Irving drives to the basket... Lauri Irving commits a violation (traveling/carry)! TURNOVER! (dead ball)

[03:03] Substitution (Team_082): Julius Anthony OUT → Jordan Rozier IN (stamina_rule2)

[03:03] Substitution (Team_082): Dwyane O'Neal OUT → Kawhi Poole IN (stamina_rule2)

[03:03] Substitution (Team_082): Kristaps Fox OUT → Shaquille Griffin IN (stamina_rule2)

[03:03] Substitution (Team_082): Jrue Green OUT → Tony Jokic IN (stamina_rule2)

[03:03] Substitution (Team_082): Julius Carter OUT → D'Angelo Parker IN (stamina_rule2)

[03:03] Substitution (Team_054): Malcolm Harden OUT → Shaquille Irving IN (stamina_rule2)

[03:03] Substitution (Team_054): Lauri Irving OUT → Bradley Quickley IN (stamina_rule2)

[03:03] Substitution (Team_054): Vince Ball OUT → Vince James IN (stamina_rule2)

[03:03] Substitution (Team_054): Luka Brogdon OUT → Tobias Nowitzki IN (stamina_rule2)

[03:03] Substitution (Team_054): Blake Russell OUT → Devin Jackson IN (stamina_rule2)

[02:47] Team_082 possession (Score: 37-26)
D'Angelo Parker attempts a Layup. Contested by Devin Jackson (5.7 feet, ZONE). D'Angelo Parker misses. Offensive rebound by Tony Jokic! Tony Jokic kicks it out.

[02:32] Team_082 possession (Score: 37-26)
Jordan Rozier attempts a Layup. BLOCKED BY DEVIN JACKSON! Ball goes out off Devin Jackson. Jordan Rozier's ball!

[02:20] Team_082 possession (Score: 37-26)
FOUL! Shooting foul on Bradley Quickley. Kawhi Poole to the line for 3 free throws. [Team fouls: 3] (Bradley Quickley: 1 personal fouls)   FT 1/3: GOOD   FT 2/3: GOOD   FT 3/3: MISS Kawhi Poole makes 2/3 from the line. FOUL! Loose ball foul on Vince James during the free throw rebound! [Team fouls: 4] No free throws, side out. (Vince James: 1 personal fouls)
Score: 39-26

[02:01] Team_082 possession (Score: 39-26)
Kawhi Poole attempts a 3Pt. Contested by Shaquille Irving (5.2 feet, ZONE). Kawhi Poole misses. Rebound secured by Tobias Nowitzki.

[01:47] Team_054 possession (Score: 39-26)
Tobias Nowitzki attempts a 3Pt. Contested by Tony Jokic (5.1 feet, MAN). Tobias Nowitzki misses. Offensive rebound by Tobias Nowitzki! Tobias Nowitzki kicks it out.

[01:34] Team_054 possession (Score: 39-26)
Bradley Quickley attempts a 3Pt. Contested by Kawhi Poole (5.1 feet, MAN). Bradley Quickley misses. Rebound secured by Tony Jokic.

[01:19] Team_082 possession (Score: 39-26)
Jordan Rozier attempts a 3Pt. Contested by Shaquille Irving (4.7 feet, ZONE). Jordan Rozier misses. Rebound secured by Vince James.

[01:02] Team_054 possession (Score: 39-26)
Devin Jackson attempts a Midrange. Contested by D'Angelo Parker (5.1 feet, ZONE). Devin Jackson misses. Rebound secured by Tony Jokic.

[00:48] Team_082 possession (Score: 39-26)
D'Angelo Parker makes the Midrange and draws the foul on Devin Jackson! And-1! D'Angelo Parker to the line for 1. [BONUS: 5 team fouls] (Devin Jackson: 1 personal fouls)   FT 1/1: GOOD D'Angelo Parker makes 1/1 from the line.
Score: 42-26

[00:35] Team_054 possession (Score: 42-26)
Tobias Nowitzki throws a bad pass out of bounds! TURNOVER! (dead ball)

[00:20] Team_082 possession (Score: 42-26)
Kawhi Poole attempts a Layup. BLOCKED BY BRADLEY QUICKLEY! Ball is loose! Rebound secured by Vince James.

[00:08] Team_054 possession (Score: 42-26)
Vince James attempts a 3Pt. Wide open! Kawhi Poole is 6.2 feet away. [ZONE] Vince James misses. Rebound secured by D'Angelo Parker.

================================================================================
                              2ND QUARTER COMPLETE                              
================================================================================

2ND QUARTER SCORE: Team_082 16, Team_054 10

BOX SCORE:
================================================================================

Team_082
--------------------------------------------------------------------------------
Player                MIN  PTS  REB  AST  TO      FG   FG%      3P   3P%
--------------------------------------------------------------------------------
Julius Carter          21    6    5    1   0   3/4    75.0     0/0   0.0
Dwyane O'Neal          21    4    1    2   0   2/5    40.0     0/0   0.0
D'Angelo Parker         3    3    1    0   0   1/1   100.0     0/0   0.0
Jrue Green             21    1    6    1   0   1/3    33.3     0/0   0.0
Tony Jokic              3    0    3    0   0   0/0     0.0     0/0   0.0
Shaquille Griffin       3    0    1    0   0   0/0     0.0     0/0   0.0
Kawhi Poole             3    0    0    0   0   0/2     0.0     0/0   0.0
Jordan Rozier           3    0    0    0   0   0/1     0.0     0/0   0.0

TEAM: FG: 7/16 (43.8%), 3PT: 0/4 (0.0%), REB: 17 (6 off, 11 def), AST: 4, TO: 2
TEAM FOULS: 2


Team_054
--------------------------------------------------------------------------------
Player                MIN  PTS  REB  AST  TO      FG   FG%      3P   3P%
--------------------------------------------------------------------------------
Lauri Irving           21    3    0    1   0   1/4    25.0     0/0   0.0
Vince Ball             21    3    2    0   0   1/1   100.0     0/0   0.0
Blake Russell          21    2    3    1   0   1/2    50.0     0/0   0.0
Malcolm Harden         21    2    0    0   0   1/5    20.0     0/0   0.0
Luka Brogdon           21    0    3    1   0   0/0     0.0     0/0   0.0
Tobias Nowitzki         3    0    2    0   0   0/0     0.0     0/0   0.0
Bradley Quickley        3    0    0    0   0   0/1     0.0     0/0   0.0
Vince James             3    0    2    0   0   0/1     0.0     0/0   0.0
Devin Jackson           3    0    0    0   0   0/1     0.0     0/0   0.0

TEAM: FG: 4/15 (26.7%), 3PT: 2/9 (22.2%), REB: 12 (3 off, 9 def), AST: 3, TO: 3
TEAM FOULS: 5 [Team_082 in BONUS]

================================================================================

================================================================================
                       3RD QUARTER - Team_082 vs Team_054                       
================================================================================

[12:00] Team_082 possession (Score: 42-26)
Julius Anthony attempts a 3Pt. Contested by Malcolm Harden (4.5 feet, MAN). Julius Anthony misses. Rebound secured by Luka Brogdon.

[11:49] Team_054 possession (Score: 42-26)
Malcolm Harden attempts a 3Pt. Contested by Dwyane O'Neal (3.6 feet, ZONE). MALCOLM HARDEN MAKES IT!
Score: 42-29

[11:35] Team_082 possession (Score: 42-29)
Julius Carter attempts a Midrange. Contested by Vince Ball (4.5 feet, ZONE). JULIUS CARTER MAKES IT! Assist: Dwyane O'Neal
Score: 44-29

[11:15] Team_054 possession (Score: 44-29)
Vince Ball attempts a Midrange. Contested by Julius Anthony (4.6 feet, ZONE). Vince Ball misses. Rebound secured by Dwyane O'Neal.

[10:56] Team_082 possession (Score: 44-29)
Dwyane O'Neal drives and kicks out. Jrue Green attempts a 3Pt. Contested by Luka Brogdon (4.0 feet, MAN). JRUE GREEN MAKES IT! Assist: Dwyane O'Neal
Score: 47-29

[10:42] Team_054 possession (Score: 47-29)
Malcolm Harden attempts a 3Pt. Contested by Julius Anthony (4.8 feet, MAN). MALCOLM HARDEN MAKES IT! Assist: Blake Russell
Score: 47-32

[10:23] Team_082 possession (Score: 47-32)
Jrue Green attempts a 3Pt. Contested by Lauri Irving (3.7 feet, ZONE). JRUE GREEN MAKES IT! Assist: Dwyane O'Neal
Score: 50-32

[10:06] Team_054 possession (Score: 50-32)
Malcolm Harden attempts a 3Pt. Contested by Dwyane O'Neal (3.6 feet, ZONE). MALCOLM HARDEN MAKES IT! Assist: Blake Russell
Score: 50-35

[09:54] Team_082 possession (Score: 50-35)
Julius Carter attempts a 3Pt. Contested by Blake Russell (3.4 feet, MAN). Julius Carter misses. Rebound secured by Lauri Irving.

[09:42] Team_054 possession (Score: 50-35)
FOUL! Reach-in foul on Kristaps Fox during the drive. [Team fouls: 1] No free throws, side out. (Kristaps Fox: 1 personal fouls)

[09:24] Team_054 possession (Score: 50-35)
Vince Ball attempts a Layup. Contested by Jrue Green (5.2 feet, ZONE). VINCE BALL MAKES IT!
Score: 50-37

[09:09] Team_082 possession (Score: 50-37)
Jrue Green attempts a 3Pt. Contested by Lauri Irving (3.7 feet, ZONE). Jrue Green misses. Rebound secured by Lauri Irving.

[08:54] Team_054 possession (Score: 50-37)
Malcolm Harden attempts a Layup. Contested by Julius Anthony (4.8 feet, MAN). MALCOLM HARDEN MAKES IT!
Score: 50-39

[08:41] Team_082 possession (Score: 50-39)
FOUL! Reach-in foul on Luka Brogdon during the drive. [Team fouls: 1] No free throws, side out. (Luka Brogdon: 1 personal fouls)

[08:27] Team_082 possession (Score: 50-39)
Kristaps Fox attempts a 3Pt. Contested by Lauri Irving (3.5 feet, ZONE). KRISTAPS FOX MAKES IT! Assist: Dwyane O'Neal
Score: 53-39

[08:15] Team_054 possession (Score: 53-39)
Malcolm Harden attempts a 3Pt. Contested by Dwyane O'Neal (3.6 feet, ZONE). MALCOLM HARDEN MAKES IT! Assist: Blake Russell
Score: 53-42

[07:57] Team_082 possession (Score: 53-42)
Julius Carter attempts a Midrange. Contested by Blake Russell (3.4 feet, MAN). JULIUS CARTER MAKES IT!
Score: 55-42

[07:40] Team_054 possession (Score: 55-42)
Lauri Irving attempts a 3Pt. Contested by Dwyane O'Neal (3.8 feet, MAN). Lauri Irving misses. Offensive rebound by Luka Brogdon! Luka Brogdon kicks it out.

[07:24] Team_054 possession (Score: 55-42)
Vince Ball drives to the basket... Vince Ball throws a bad pass! Stolen by Jrue Green! TURNOVER! (live ball)

[07:08] Team_082 possession (Score: 55-42)
Julius Carter attempts a Midrange. Contested by Luka Brogdon (4.4 feet, ZONE). JULIUS CARTER MAKES IT!
Score: 57-42

[06:55] Team_054 possession (Score: 57-42)
Lauri Irving makes the Dunk and draws the foul on Dwyane O'Neal! And-1! Lauri Irving to the line for 1. [Team fouls: 2] (Dwyane O'Neal: 1 personal fouls)   FT 1/1: GOOD Lauri Irving makes 1/1 from the line.
Score: 57-45

[06:45] Team_082 possession (Score: 57-45)
Kristaps Fox attempts a Midrange. Contested by Vince Ball (4.2 feet, MAN). Kristaps Fox misses. Offensive rebound by Jrue Green! Jrue Green kicks it out.

[06:27] Team_082 possession (Score: 57-45)
Dwyane O'Neal drives and kicks out. Kristaps Fox attempts a 3Pt. Contested by Lauri Irving (3.4 feet, ZONE). Kristaps Fox misses. Rebound secured by Lauri Irving.

[06:11] Team_054 possession (Score: 57-45)
Lauri Irving attempts a 3Pt. Contested by Dwyane O'Neal (3.8 feet, ZONE). Lauri Irving misses. Rebound secured by Dwyane O'Neal.

[05:58] Team_082 possession (Score: 57-45)
Julius Carter drives, picks up Blake Russell. Help arrives from Lauri Irving! Julius Carter attempts a Layup. Contested by Lauri Irving (3.4 feet, ZONE). Julius Carter misses. Offensive rebound by Julius Carter! Julius Carter kicks it out.

[05:43] Team_082 possession (Score: 57-45)
Julius Carter drives, picks up Blake Russell. Help arrives from Lauri Irving! Julius Carter attempts a Layup. Contested by Lauri Irving (3.4 feet, ZONE). JULIUS CARTER MAKES IT!
Score: 59-45

[05:31] Team_054 possession (Score: 59-45)
Luka Brogdon drives, picks up Jrue Green. Help arrives from Dwyane O'Neal! Luka Brogdon attempts a Layup. Contested by Dwyane O'Neal (5.4 feet, ZONE). LUKA BROGDON MAKES IT! Assist: Lauri Irving
Score: 59-47

[05:14] Team_082 possession (Score: 59-47)
Dwyane O'Neal drives, Blake Russell stays with him. Dwyane O'Neal attempts a Layup. Contested by Blake Russell (3.1 feet, ZONE). DWYANE O'NEAL MAKES IT!
Score: 61-47

[05:00] Team_054 possession (Score: 61-47)
Vince Ball loses control! Ball rolls out of bounds! TURNOVER! (dead ball)

[04:45] Team_082 possession (Score: 61-47)
FOUL! Shooting foul on Luka Brogdon. Jrue Green to the line for 2 free throws. [Team fouls: 2] (Luka Brogdon: 2 personal fouls)   FT 1/2: GOOD   FT 2/2: MISS Jrue Green makes 1/2 from the line. Rebound secured by Lauri Irving.
Score: 62-47

[04:33] Team_054 possession (Score: 62-47)
Malcolm Harden drives, picks up Julius Anthony. Help arrives from Dwyane O'Neal! Malcolm Harden attempts a Layup. Contested by Dwyane O'Neal (4.8 feet, MAN). MALCOLM HARDEN MAKES IT!
Score: 62-49

[04:20] Team_082 possession (Score: 62-49)
Dwyane O'Neal attempts a 3Pt. Contested by Lauri Irving (3.5 feet, MAN). Dwyane O'Neal misses. Rebound secured by Blake Russell.

[04:09] Team_054 possession (Score: 62-49)
Blake Russell attempts a Layup. Wide open! Julius Carter is 6.3 feet away. [MAN] BLAKE RUSSELL MAKES IT! Assist: Luka Brogdon
Score: 62-51

[03:55] Team_082 possession (Score: 62-51)
FOUL! Holding foul on Blake Russell. [Team fouls: 3] No free throws, side out. (Blake Russell: 1 personal fouls)

[03:38] Team_082 possession (Score: 62-51)
Julius Carter attempts a Layup. BLOCKED BY BLAKE RUSSELL! Ball is loose! Rebound secured by Luka Brogdon.

[03:19] Team_054 possession (Score: 62-51)
Malcolm Harden attempts a 3Pt. Contested by Julius Anthony (4.9 feet, MAN). Malcolm Harden misses. Rebound secured by Dwyane O'Neal.

[03:04] Team_082 possession (Score: 62-51)
Julius Carter attempts a 3Pt. Contested by Blake Russell (3.6 feet, MAN). Julius Carter misses. Rebound secured by Luka Brogdon.

[02:48] Team_054 possession (Score: 62-51)
Vince Ball makes the Dunk and draws the foul on Kristaps Fox! And-1! Vince Ball to the line for 1. [Team fouls: 3] (Kristaps Fox: 2 personal fouls)   FT 1/1: GOOD Vince Ball makes 1/1 from the line.
Score: 62-54

[02:37] Team_082 possession (Score: 62-54)
Jrue Green attempts a Midrange. Contested by Lauri Irving (3.9 feet, ZONE). JRUE GREEN MAKES IT! Assist: Dwyane O'Neal
Score: 64-54

[02:21] Team_054 possession (Score: 64-54)
Malcolm Harden loses the ball! Stripped by Julius Anthony! TURNOVER! (live ball)

[02:02] Team_082 possession (Score: 64-54)
Julius Carter drives, picks up Blake Russell. Help arrives from Lauri Irving! Julius Carter attempts a Dunk. Contested by Lauri Irving (3.8 feet, MAN). JULIUS CARTER MAKES IT! Assist: Julius Anthony
Score: 66-54

[01:47] Team_054 possession (Score: 66-54)
Lauri Irving drives, Dwyane O'Neal stays with him. Lauri Irving attempts a Layup. Contested by Dwyane O'Neal (4.1 feet, MAN). LAURI IRVING MAKES IT! Assist: Luka Brogdon
Score: 66-56

[01:38] Team_082 possession (Score: 66-56)
Dwyane O'Neal drives and kicks out. Kristaps Fox attempts a 3Pt. Contested by Lauri Irving (3.8 feet, ZONE). KRISTAPS FOX MAKES IT! Assist: Julius Carter
Score: 69-56

[01:26] Team_054 possession (Score: 69-56)
Lauri Irving attempts a 3Pt. Contested by Dwyane O'Neal (4.1 feet, ZONE). Lauri Irving misses. Rebound secured by Jrue Green.

[01:11] Team_082 possession (Score: 69-56)
Julius Carter attempts a 3Pt. Contested by Blake Russell (3.9 feet, MAN). Julius Carter misses. Offensive rebound by Jrue Green! Jrue Green kicks it out.

[00:58] Team_082 possession (Score: 69-56)
FOUL! Reach-in foul on Luka Brogdon during the drive. [Team fouls: 4] No free throws, side out. (Luka Brogdon: 3 personal fouls)

[00:45] Team_082 possession (Score: 69-56)
Dwyane O'Neal drives and kicks out. Dwyane O'Neal attempts a Midrange. Contested by Lauri Irving (3.9 feet, ZONE). Dwyane O'Neal misses. Offensive rebound by Jrue Green! Jrue Green kicks it out.

[00:30] Team_082 possession (Score: 69-56)
Julius Anthony attempts a 3Pt. Contested by Malcolm Harden (4.9 feet, MAN). JULIUS ANTHONY MAKES IT! Assist: Dwyane O'Neal
Score: 72-56

[00:15] Team_054 possession (Score: 72-56)
FOUL! Reach-in foul on Julius Anthony during the drive. [Team fouls: 4] No free throws, side out. (Julius Anthony: 1 personal fouls)

[00:06] Team_054 possession (Score: 72-56)
Lauri Irving attempts a 3Pt. Contested by Dwyane O'Neal (4.3 feet, ZONE). LAURI IRVING MAKES IT! Assist: Vince Ball
Score: 72-59

================================================================================
                              3RD QUARTER COMPLETE                              
================================================================================

3RD QUARTER SCORE: Team_082 30, Team_054 33

BOX SCORE:
================================================================================

Team_082
--------------------------------------------------------------------------------
Player                MIN  PTS  REB  AST  TO      FG   FG%      3P   3P%
--------------------------------------------------------------------------------
Julius Carter          33   10    1    1   0   5/8    62.5     0/0   0.0
Jrue Green             33    8    4    0   0   3/5    60.0     0/0   0.0
Kristaps Fox           33    6    0    0   0   2/2   100.0     0/0   0.0
Julius Anthony         33    3    0    1   0   1/2    50.0     0/0   0.0
Dwyane O'Neal          33    2    3    6   0   1/3    33.3     0/0   0.0

TEAM: FG: 12/20 (60.0%), 3PT: 3/8 (37.5%), REB: 8 (4 off, 4 def), AST: 8, TO: 0
TEAM FOULS: 4


Team_054
--------------------------------------------------------------------------------
Player                MIN  PTS  REB  AST  TO      FG   FG%      3P   3P%
--------------------------------------------------------------------------------
Malcolm Harden         33   16    0    0   0   6/7    85.7     0/0   0.0
Lauri Irving           33    8    4    1   0   3/5    60.0     0/0   0.0
Vince Ball             33    5    0    1   0   2/3    66.7     0/0   0.0
Luka Brogdon           33    2    4    2   0   1/1   100.0     0/0   0.0
Blake Russell          33    2    1    3   0   1/1   100.0     0/0   0.0

TEAM: FG: 13/17 (76.5%), 3PT: 5/8 (62.5%), REB: 9 (1 off, 8 def), AST: 7, TO: 3
TEAM FOULS: 4

================================================================================

================================================================================
                       4TH QUARTER - Team_082 vs Team_054                       
================================================================================

[12:00] Team_082 possession (Score: 72-59)
Dwyane O'Neal attempts a 3Pt. Contested by Lauri Irving (3.7 feet, ZONE). DWYANE O'NEAL MAKES IT! Assist: Julius Anthony
Score: 75-59

[11:48] Team_054 possession (Score: 75-59)
Vince Ball makes the Layup and draws the foul on Jrue Green! And-1! Vince Ball to the line for 1. [Team fouls: 1] (Jrue Green: 1 personal fouls)   FT 1/1: MISS Vince Ball makes 0/1 from the line. Offensive rebound by Blake Russell! Blake Russell's putback is no good.
Score: 75-61

[11:35] Team_082 possession (Score: 75-61)
Julius Carter attempts a Layup. Contested by Blake Russell (3.9 feet, MAN). Julius Carter misses. Rebound secured by Blake Russell.

[11:22] Team_054 possession (Score: 75-61)
Vince Ball drives and kicks out. Lauri Irving attempts a 3Pt. Contested by Dwyane O'Neal (3.7 feet, MAN). Lauri Irving misses. Rebound secured by Julius Carter.

[11:06] Team_082 possession (Score: 75-61)
Julius Carter throws a bad pass! Stolen by Blake Russell! TURNOVER! (live ball)

[10:55] Team_054 possession (Score: 75-61)
Vince Ball attempts a 3Pt. Contested by Kristaps Fox (4.8 feet, MAN). Vince Ball misses. Rebound secured by Julius Carter.

[10:39] Team_082 possession (Score: 75-61)
Jrue Green attempts a 3Pt. Contested by Lauri Irving (4.1 feet, ZONE). JRUE GREEN MAKES IT! Assist: Dwyane O'Neal
Score: 78-61

[10:22] Team_054 possession (Score: 78-61)
Malcolm Harden drives and kicks out. Malcolm Harden attempts a Midrange. Contested by Jrue Green (5.6 feet, ZONE). Malcolm Harden misses. Offensive rebound by Blake Russell! Blake Russell puts it back in!
Score: 78-63

[10:07] Team_082 possession (Score: 78-63)
FOUL! Holding foul on Vince Ball. [Team fouls: 1] No free throws, side out. (Vince Ball: 1 personal fouls)

[09:55] Team_082 possession (Score: 78-63)
Julius Carter loses the ball! Stripped by Blake Russell! TURNOVER! (live ball)

[09:42] Team_054 possession (Score: 78-63)
FOUL! Reach-in foul on Jrue Green during the drive. [Team fouls: 2] No free throws, side out. (Jrue Green: 2 personal fouls)

[09:27] Team_054 possession (Score: 78-63)
Malcolm Harden attempts a Midrange. Contested by Jrue Green (5.9 feet, ZONE). MALCOLM HARDEN MAKES IT! Assist: Lauri Irving
Score: 78-65

[09:11] Team_082 possession (Score: 78-65)
FOUL! Reach-in foul on Blake Russell during the drive. [Team fouls: 2] No free throws, side out. (Blake Russell: 1 personal fouls)

[08:58] Team_082 possession (Score: 78-65)
Julius Carter attempts a 3Pt. Contested by Lauri Irving (4.4 feet, ZONE). JULIUS CARTER MAKES IT! Assist: Jrue Green
Score: 81-65

[08:48] Team_054 possession (Score: 81-65)
Vince Ball attempts a 3Pt. Contested by Kristaps Fox (5.1 feet, MAN). Vince Ball misses. Rebound secured by Jrue Green.

[08:34] Team_082 possession (Score: 81-65)
Julius Anthony drives, picks up Malcolm Harden. Help arrives from Lauri Irving! Julius Anthony attempts a Layup. Contested by Lauri Irving (5.2 feet, MAN). JULIUS ANTHONY MAKES IT! Assist: Dwyane O'Neal
Score: 83-65

[08:19] Team_054 possession (Score: 83-65)
Vince Ball drives, picks up Jrue Green. Help arrives from Dwyane O'Neal! Vince Ball attempts a Layup. Contested by Dwyane O'Neal (6.0 feet, ZONE). Vince Ball misses. Rebound secured by Jrue Green.

[08:09] Team_082 possession (Score: 83-65)
Julius Anthony attempts a Midrange. Contested by Luka Brogdon (4.9 feet, ZONE). Julius Anthony misses. Rebound secured by Blake Russell.

[07:54] Team_054 possession (Score: 83-65)
Blake Russell drives and kicks out. Malcolm Harden attempts a 3Pt. Contested by Dwyane O'Neal (4.3 feet, ZONE). MALCOLM HARDEN MAKES IT! Assist: Vince Ball
Score: 83-68

[07:39] Team_082 possession (Score: 83-68)
Jrue Green attempts a Layup. Contested by Luka Brogdon (4.9 feet, MAN). JRUE GREEN MAKES IT!
Score: 85-68

[07:28] Team_054 possession (Score: 85-68)
Vince Ball attempts a Midrange. Contested by Kristaps Fox (5.3 feet, ZONE). Vince Ball misses. Rebound secured by Julius Carter.

[07:11] Team_082 possession (Score: 85-68)
Dwyane O'Neal attempts a Layup. BLOCKED BY LAURI IRVING! Ball is loose! Rebound secured by Blake Russell.

[06:52] Team_054 possession (Score: 85-68)
Malcolm Harden attempts a 3Pt. Contested by Dwyane O'Neal (4.6 feet, ZONE). Malcolm Harden misses. Offensive rebound by Luka Brogdon! Luka Brogdon kicks it out.

[06:35] Team_054 possession (Score: 85-68)
Vince Ball attempts a 3Pt. Contested by Dwyane O'Neal (4.5 feet, ZONE). VINCE BALL MAKES IT! Assist: Luka Brogdon
Score: 85-71

[06:21] Team_082 possession (Score: 85-71)
FOUL! Reach-in foul on Blake Russell during the drive. [Team fouls: 3] No free throws, side out. (Blake Russell: 2 personal fouls)

[06:03] Team_082 possession (Score: 85-71)
Julius Anthony attempts a Layup. BLOCKED BY MALCOLM HARDEN! Ball is loose! Rebound secured by Vince Ball.

[05:51] Team_054 possession (Score: 85-71)
FOUL! Holding foul on Kristaps Fox. [Team fouls: 3] No free throws, side out. (Kristaps Fox: 1 personal fouls)

[05:35] Team_054 possession (Score: 85-71)
Luka Brogdon attempts a 3Pt. Wide open! Jrue Green is 6.5 feet away. [MAN] LUKA BROGDON MAKES IT! Assist: Malcolm Harden
Score: 85-74

[05:23] Team_082 possession (Score: 85-74)
Dwyane O'Neal attempts a Layup. Contested by Blake Russell (4.6 feet, ZONE). Dwyane O'Neal misses. Rebound secured by Blake Russell.

[05:07] Team_054 possession (Score: 85-74)
Blake Russell drives, Julius Carter stays with him. Blake Russell attempts a Dunk. Wide open! Julius Carter is 7.0 feet away. [MAN] Blake Russell misses. Offensive rebound by Blake Russell! Blake Russell kicks it out.

[04:51] Team_054 possession (Score: 85-74)
Lauri Irving attempts a 3Pt. Contested by Dwyane O'Neal (5.0 feet, ZONE). Lauri Irving misses. Rebound secured by Julius Carter.

[04:35] Team_082 possession (Score: 85-74)
Julius Carter loses the ball! Stripped by Blake Russell! TURNOVER! (live ball)

[04:23] Team_054 possession (Score: 85-74)
Luka Brogdon attempts a Midrange. Wide open! Jrue Green is 6.7 feet away. [MAN] Luka Brogdon misses. Offensive rebound by Blake Russell! Blake Russell kicks it out.

[04:10] Team_054 possession (Score: 85-74)
Lauri Irving attempts a 3Pt. Contested by Dwyane O'Neal (5.2 feet, ZONE). Lauri Irving misses. FOUL! Loose ball foul on Dwyane O'Neal during the rebound battle. [Team fouls: 4] No free throws, side out. (Dwyane O'Neal: 1 personal fouls)

[03:58] Team_054 possession (Score: 85-74)
Lauri Irving attempts a Midrange. Wide open! Jrue Green is 6.9 feet away. [ZONE] LAURI IRVING MAKES IT!
Score: 85-76

[03:43] Team_082 possession (Score: 85-76)
FOUL! Shooting foul on Lauri Irving. Jrue Green to the line for 2 free throws. [Team fouls: 4] (Lauri Irving: 1 personal fouls)   FT 1/2: GOOD   FT 2/2: GOOD Jrue Green makes 2/2 from the line.
Score: 87-76

[03:28] Team_054 possession (Score: 87-76)
Lauri Irving drives and kicks out. Luka Brogdon attempts a 3Pt. Wide open! Jrue Green is 6.7 feet away. [MAN] Luka Brogdon misses. Offensive rebound by Blake Russell! Blake Russell kicks it out.

[03:15] Team_054 possession (Score: 87-76)
Blake Russell attempts a Layup. Wide open! Julius Carter is 7.2 feet away. [MAN] BLAKE RUSSELL MAKES IT! Assist: Lauri Irving
Score: 87-78

[03:01] Team_082 possession (Score: 87-78)
FOUL! Shooting foul on Blake Russell. Julius Carter to the line for 2 free throws. [BONUS: 5 team fouls] (Blake Russell: 3 personal fouls)   FT 1/2: GOOD   FT 2/2: GOOD Julius Carter makes 2/2 from the line.
Score: 89-78

[02:46] Team_054 possession (Score: 89-78)
Luka Brogdon attempts a 3Pt. Wide open! Jrue Green is 6.9 feet away. [MAN] LUKA BROGDON MAKES IT! Assist: Blake Russell
Score: 89-81

[02:34] Team_082 possession (Score: 89-81)
Julius Anthony attempts a Midrange. Contested by Vince Ball (5.6 feet, ZONE). Julius Anthony misses. Rebound secured by Vince Ball.

[02:22] Team_054 possession (Score: 89-81)
Vince Ball throws a bad pass out of bounds! TURNOVER! (dead ball)

[02:22] Substitution (Team_082): Julius Anthony OUT → Jordan Rozier IN (stamina_rule2)

[02:22] Substitution (Team_082): Dwyane O'Neal OUT → Kawhi Poole IN (stamina_rule2)

[02:22] Substitution (Team_082): Kristaps Fox OUT → Shaquille Griffin IN (stamina_rule2)

[02:22] Substitution (Team_082): Jrue Green OUT → Tony Jokic IN (stamina_rule2)

[02:22] Substitution (Team_082): Julius Carter OUT → D'Angelo Parker IN (stamina_rule2)

[02:22] Substitution (Team_054): Malcolm Harden OUT → Shaquille Irving IN (stamina_rule2)

[02:22] Substitution (Team_054): Lauri Irving OUT → Bradley Quickley IN (stamina_rule2)

[02:22] Substitution (Team_054): Vince Ball OUT → Vince James IN (stamina_rule2)

[02:22] Substitution (Team_054): Luka Brogdon OUT → Tobias Nowitzki IN (stamina_rule2)

[02:22] Substitution (Team_054): Blake Russell OUT → Devin Jackson IN (stamina_rule2)

[02:07] Team_082 possession (Score: 89-81)
D'Angelo Parker attempts a Midrange. Wide open! Tobias Nowitzki is 6.1 feet away. [ZONE] D'Angelo Parker misses. Rebound secured by Vince James.

[01:53] Team_054 possession (Score: 89-81)
Bradley Quickley drives to the basket... FOUL! Offensive foul on Bradley Quickley! Kawhi Poole drew the charge! [Team fouls: 6] (Bradley Quickley: 1 personal fouls) TURNOVER! (dead ball)

[01:37] Team_082 possession (Score: 89-81)
Kawhi Poole makes the Layup and draws the foul on Vince James! And-1! Kawhi Poole to the line for 1. [BONUS: 7 team fouls] (Vince James: 1 personal fouls)   FT 1/1: MISS Kawhi Poole makes 0/1 from the line. Offensive rebound by Shaquille Griffin! Shaquille Griffin kicks it out.
Score: 91-81

[01:19] Team_082 possession (Score: 91-81)
Kawhi Poole drives to the basket... FOUL! Offensive foul on Kawhi Poole! Devin Jackson drew the charge! [Team fouls: 5] (Kawhi Poole: 1 personal fouls) TURNOVER! (dead ball)

[01:06] Team_054 possession (Score: 91-81)
FOUL! Shooting foul on D'Angelo Parker. Devin Jackson to the line for 2 free throws. [BONUS: 6 team fouls] (D'Angelo Parker: 1 personal fouls)   FT 1/2: GOOD   FT 2/2: GOOD Devin Jackson makes 2/2 from the line.
Score: 91-83

[00:55] Team_082 possession (Score: 91-83)
Shaquille Griffin attempts a 3Pt. Contested by Shaquille Irving (4.6 feet, ZONE). Shaquille Griffin misses. Rebound secured by Devin Jackson.

[00:41] Team_054 possession (Score: 91-83)
FOUL! Reach-in foul on Tony Jokic during the drive. [IN THE BONUS! 7 team fouls] Tobias Nowitzki to the line for 2 free throws. (Tony Jokic: 1 personal fouls)   FT 1/2: GOOD   FT 2/2: GOOD Tobias Nowitzki makes 2/2 from the line.
Score: 91-85

[00:27] Team_082 possession (Score: 91-85)
Shaquille Griffin attempts a 3Pt. Contested by Vince James (4.8 feet, MAN). Shaquille Griffin misses. Rebound secured by Tobias Nowitzki.

[00:12] Team_054 possession (Score: 91-85)
Devin Jackson drives, picks up D'Angelo Parker. Help arrives from Kawhi Poole! Devin Jackson attempts a Dunk. Contested by Kawhi Poole (5.1 feet, MAN). DEVIN JACKSON MAKES IT!
Score: 91-87

================================================================================
                              4TH QUARTER COMPLETE                              
================================================================================

4TH QUARTER SCORE: Team_082 19, Team_054 28

BOX SCORE:
================================================================================

Team_082
--------------------------------------------------------------------------------
Player                MIN  PTS  REB  AST  TO      FG   FG%      3P   3P%
--------------------------------------------------------------------------------
Jrue Green             43    7    2    1   0   3/3   100.0     0/0   0.0
Julius Carter          43    5    4    0   0   2/3    66.7     0/0   0.0
Dwyane O'Neal          43    3    0    2   0   1/3    33.3     0/0   0.0
Julius Anthony         43    2    0    1   0   1/4    25.0     0/0   0.0
D'Angelo Parker         5    0    0    0   0   0/1     0.0     0/0   0.0
Shaquille Griffin       5    0    1    0   0   0/2     0.0     0/0   0.0

TEAM: FG: 7/16 (43.8%), 3PT: 3/5 (60.0%), REB: 8 (1 off, 7 def), AST: 4, TO: 4
TEAM FOULS: 7 [Team_054 in BONUS]


Team_054
--------------------------------------------------------------------------------
Player                MIN  PTS  REB  AST  TO      FG   FG%      3P   3P%
--------------------------------------------------------------------------------
Luka Brogdon           43    6    2    1   0   2/2   100.0     0/0   0.0
Malcolm Harden         43    5    0    1   0   2/2   100.0     0/0   0.0
Blake Russell          43    4    9    1   0   2/2   100.0     0/0   0.0
Devin Jackson           5    4    1    0   0   2/2   100.0     0/0   0.0
Vince Ball             43    3    2    1   0   1/7    14.3     0/0   0.0
Lauri Irving           43    2    0    2   0   1/2    50.0     0/0   0.0
Tobias Nowitzki         5    2    1    0   0   1/1   100.0     0/0   0.0
Vince James             5    0    1    0   0   0/0     0.0     0/0   0.0

TEAM: FG: 11/18 (61.1%), 3PT: 3/6 (50.0%), REB: 15 (6 off, 9 def), AST: 6, TO: 2
TEAM FOULS: 7 [Team_082 in BONUS]

================================================================================

================================================================================
                               FULL GAME COMPLETE                               
================================================================================

FINAL SCORE: Team_082 91, Team_054 87

SCORING BY QUARTER:
--------------------------------------------------------------------------------
Team                     Q1     Q2     Q3     Q4    FINAL
--------------------------------------------------------------------------------
Team_082                 26     16     30     19       91
Team_054                 16     10     33     28       87
--------------------------------------------------------------------------------

FULL GAME BOX SCORE:
================================================================================

Team_082
--------------------------------------------------------------------------------
Player                MIN  PTS  REB  AST  TO      FG   FG%      3P   3P%      FT STL BLK
--------------------------------------------------------------------------------
Julius Anthony         43    7    0    3   0   4/11   36.4   3/4    75.0   3/5     1   0
Dwyane O'Neal          43   12    6   10   2   7/17   41.2   2/5    40.0   0/0     0   0
Kristaps Fox           43   11    0    2   1   3/5    60.0   2/2   100.0   0/0     1   0
Jrue Green             43   24   18    3   0   8/12   66.7   2/4    50.0   8/10    1   2
Julius Carter          43   28   19    2   4  13/20   65.0   2/5    40.0   4/4     1   0
Jordan Rozier           5    0    0    0   1   0/1     0.0   0/1     0.0   0/0     0   0
Kawhi Poole             5    0    0    0   0   0/2     0.0   0/1     0.0   2/4     0   0
Shaquille Griffin       5    0    2    0   0   0/2     0.0   0/2     0.0   0/0     0   0
Tony Jokic              5    0    3    0   0   0/0     0.0   0/0     0.0   0/0     0   0
D'Angelo Parker         5    3    1    0   0   1/2    50.0   0/0     0.0   1/1     0   0

TEAM: FG: 37/73 (50.7%), 3PT: 11/24 (45.8%), REB: 50 (16 off, 34 def), AST: 20, TO: 8


Team_054
--------------------------------------------------------------------------------
Player                MIN  PTS  REB  AST  TO      FG   FG%      3P   3P%      FT STL BLK
--------------------------------------------------------------------------------
Malcolm Harden         43   28    0    1   1  11/22   50.0   5/11   45.5   0/0     0   2
Lauri Irving           43   18    6    5   2   7/16   43.8   3/10   30.0   1/1     0   2
Vince Ball             43   11    6    3   3   4/12   33.3   2/4    50.0   1/2     0   1
Luka Brogdon           43    8   14    4   1   3/3   100.0   2/2   100.0   0/0     0   0
Blake Russell          43   14   14    7   2   7/10   70.0   0/1     0.0   2/2     3   2
Shaquille Irving        5    0    0    0   0   0/0     0.0   0/0     0.0   0/0     0   0
Bradley Quickley        5    0    0    0   0   0/1     0.0   0/1     0.0   0/0     0   1
Vince James             5    0    3    0   0   0/1     0.0   0/1     0.0   0/0     0   0
Tobias Nowitzki         5    2    3    0   2   1/1   100.0   0/0     0.0   2/2     0   0
Devin Jackson           5    4    1    0   0   2/3    66.7   0/0     0.0   2/2     0   1

TEAM: FG: 35/69 (50.7%), 3PT: 12/30 (40.0%), REB: 46 (11 off, 35 def), AST: 20, TO: 11

================================================================================
