================================================================================
                        FULL GAME - Team_057 vs Team_053                        
================================================================================

================================================================================
                       1ST QUARTER - Team_057 vs Team_053                       
================================================================================

[12:00] Team_057 possession (Score: 0-0)
Kobe Ming loses control! Ball rolls out of bounds! TURNOVER! (dead ball)

[11:46] Team_053 possession (Score: 0-0)
Draymond LaVine throws a bad pass out of bounds! TURNOVER! (dead ball)

[11:34] Team_057 possession (Score: 0-0)
Ben Adebayo drives and kicks out. Kobe Ming attempts a 3Pt. Contested by Kobe Ginobili (4.1 feet, ZONE). Kobe Ming misses. Offensive rebound by Miles Middleton! Miles Middleton kicks it out.

[11:19] Team_057 possession (Score: 0-0)
Kobe Ming attempts a 3Pt. Contested by Kobe Ginobili (4.4 feet, MAN). Kobe Ming misses. Offensive rebound by Miles Middleton! Miles Middleton kicks it out.

[11:03] Team_057 possession (Score: 0-0)
Klay Rozier drives, Michael Gasol stays with him. Klay Rozier attempts a Dunk. Contested by Michael Gasol (4.1 feet, ZONE). Klay Rozier misses. Rebound secured by James Murray.

[10:45] Team_053 possession (Score: 0-0)
Immanuel Curry attempts a Layup. Contested by Anfernee Adebayo (5.0 feet, MAN). IMMANUEL CURRY MAKES IT! Assist: James Murray
Score: 0-2

[10:32] Team_057 possession (Score: 0-2)
Miles Middleton attempts a Midrange. Contested by Draymond LaVine (4.1 feet, MAN). Miles Middleton misses. Rebound secured by James Murray.

[10:15] Team_053 possession (Score: 0-2)
Kobe Ginobili attempts a Layup. Contested by Ben Adebayo (4.4 feet, ZONE). Kobe Ginobili misses. Rebound secured by Ben Adebayo.

[09:59] Team_057 possession (Score: 0-2)
Ben Adebayo attempts a 3Pt. Contested by Michael Gasol (4.5 feet, MAN). BEN ADEBAYO MAKES IT! Assist: Anfernee Adebayo
Score: 3-2

[09:47] Team_053 possession (Score: 3-2)
Michael Gasol attempts a Midrange. Contested by Ben Adebayo (4.4 feet, MAN). Michael Gasol misses. Rebound secured by Anfernee Adebayo.

[09:32] Team_057 possession (Score: 3-2)
Klay Rozier attempts a 3Pt. Contested by Kobe Ginobili (4.2 feet, ZONE). Klay Rozier misses. Rebound secured by James Murray.

[09:19] Team_053 possession (Score: 3-2)
Immanuel Curry attempts a 3Pt. Contested by Kobe Ming (4.6 feet, ZONE). Immanuel Curry misses. Offensive rebound by Draymond LaVine! Draymond LaVine kicks it out.

[09:10] Team_053 possession (Score: 3-2)
Kobe Ginobili attempts a 3Pt. Contested by Kobe Ming (4.4 feet, MAN). Kobe Ginobili misses. Rebound secured by Ben Adebayo.

[09:00] Team_057 possession (Score: 3-2)
FOUL! Reach-in foul on Michael Gasol during the drive. [Team fouls: 1] No free throws, side out. (Michael Gasol: 1 personal fouls)

[08:46] Team_057 possession (Score: 3-2)
Anfernee Adebayo makes the Layup and draws the foul on Immanuel Curry! And-1! Anfernee Adebayo to the line for 1. [Team fouls: 2] (Immanuel Curry: 1 personal fouls)   FT 1/1: MISS Anfernee Adebayo makes 0/1 from the line. Rebound secured by Draymond LaVine.
Score: 5-2

[08:32] Team_053 possession (Score: 5-2)
Draymond LaVine attempts a Midrange. Contested by Miles Middleton (4.5 feet, MAN). Draymond LaVine misses. Rebound secured by Ben Adebayo.

[08:23] Team_057 possession (Score: 5-2)
Anfernee Adebayo drives to the basket... FOUL! Offensive foul on Anfernee Adebayo! Michael Gasol drew the charge! [Team fouls: 1] (Anfernee Adebayo: 1 personal fouls) TURNOVER! (dead ball)

[08:08] Team_053 possession (Score: 5-2)
Michael Gasol attempts a Layup. Contested by Ben Adebayo (4.4 feet, MAN). MICHAEL GASOL MAKES IT!
Score: 5-4

[07:52] Team_057 possession (Score: 5-4)
Anfernee Adebayo throws a bad pass! Stolen by Immanuel Curry! TURNOVER! (live ball)

[07:38] Team_053 possession (Score: 5-4)
Kobe Ginobili attempts a Layup. Contested by Ben Adebayo (4.4 feet, ZONE). KOBE GINOBILI MAKES IT! Assist: Draymond LaVine
Score: 5-6

[07:24] Team_057 possession (Score: 5-6)
Klay Rozier attempts a 3Pt. Contested by James Murray (4.4 feet, MAN). KLAY ROZIER MAKES IT! Assist: Kobe Ming
Score: 8-6

[07:13] Team_053 possession (Score: 8-6)
Kobe Ginobili attempts a 3Pt. Contested by Kobe Ming (4.4 feet, MAN). Kobe Ginobili misses. FOUL! Loose ball foul on Miles Middleton during the rebound battle. [Team fouls: 2] No free throws, side out. (Miles Middleton: 1 personal fouls)

[06:56] Team_053 possession (Score: 8-6)
Draymond LaVine attempts a Midrange. Contested by Miles Middleton (4.5 feet, MAN). Draymond LaVine misses. Rebound secured by Ben Adebayo.

[06:42] Team_057 possession (Score: 8-6)
Miles Middleton attempts a Midrange. Contested by Draymond LaVine (4.1 feet, MAN). Miles Middleton misses. Rebound secured by Michael Gasol.

[06:29] Team_053 possession (Score: 8-6)
FOUL! Offensive foul on Kobe Ginobili! Kobe Ming drew the charge! [Team fouls: 3] (Kobe Ginobili: 1 personal fouls) TURNOVER! (dead ball)

[06:15] Team_057 possession (Score: 8-6)
Anfernee Adebayo attempts a 3Pt. Contested by Kobe Ginobili (4.6 feet, ZONE). Anfernee Adebayo misses. Rebound secured by Michael Gasol.

[05:59] Team_053 possession (Score: 8-6)
Immanuel Curry attempts a 3Pt. BLOCKED BY ANFERNEE ADEBAYO! Ball goes out off Anfernee Adebayo. Immanuel Curry's ball!

[05:45] Team_053 possession (Score: 8-6)
Kobe Ginobili makes the Dunk and draws the foul on Kobe Ming! And-1! Kobe Ginobili to the line for 1. [Team fouls: 3] (Kobe Ming: 1 personal fouls)   FT 1/1: GOOD Kobe Ginobili makes 1/1 from the line.
Score: 8-9

[05:31] Team_057 possession (Score: 8-9)
Kobe Ming attempts a Midrange. Contested by Kobe Ginobili (4.4 feet, MAN). KOBE MING MAKES IT!
Score: 10-9

[05:19] Team_053 possession (Score: 10-9)
Immanuel Curry throws a bad pass out of bounds! TURNOVER! (dead ball)

[05:10] Team_057 possession (Score: 10-9)
Ben Adebayo attempts a 3Pt. Contested by Michael Gasol (4.5 feet, MAN). Ben Adebayo misses. Offensive rebound by Miles Middleton! Miles Middleton kicks it out.

[04:55] Team_057 possession (Score: 10-9)
Anfernee Adebayo attempts a 3Pt. Contested by Kobe Ginobili (4.6 feet, ZONE). Anfernee Adebayo misses. Rebound secured by James Murray.

[04:41] Team_053 possession (Score: 10-9)
FOUL! Offensive foul on Michael Gasol! Ben Adebayo drew the charge! [Team fouls: 4] (Michael Gasol: 2 personal fouls) TURNOVER! (dead ball)

[04:28] Team_057 possession (Score: 10-9)
FOUL! Reach-in foul on Michael Gasol during the drive. [IN THE BONUS! 5 team fouls] Kobe Ming to the line for 2 free throws. (Michael Gasol: 3 personal fouls)   FT 1/2: GOOD   FT 2/2: GOOD Kobe Ming makes 2/2 from the line.
Score: 12-9

[04:14] Team_053 possession (Score: 12-9)
FOUL! Reach-in foul on Ben Adebayo during the drive. [Team fouls: 4] No free throws, side out. (Ben Adebayo: 1 personal fouls)

[04:01] Team_053 possession (Score: 12-9)
James Murray makes the Layup and draws the foul on Ben Adebayo! And-1! James Murray to the line for 1. [BONUS: 5 team fouls] (Ben Adebayo: 2 personal fouls)   FT 1/1: GOOD James Murray makes 1/1 from the line.
Score: 12-12

[03:46] Team_057 possession (Score: 12-12)
Ben Adebayo attempts a 3Pt. Contested by Michael Gasol (4.6 feet, MAN). Ben Adebayo misses. Rebound secured by Michael Gasol.

[03:31] Team_053 possession (Score: 12-12)
Immanuel Curry drives, picks up Ben Adebayo. Help arrives from Klay Rozier! Immanuel Curry attempts a Dunk. Contested by Klay Rozier (4.8 feet, ZONE). IMMANUEL CURRY MAKES IT! Assist: James Murray
Score: 12-14

[03:19] Team_057 possession (Score: 12-14)
Kobe Ming attempts a Midrange. Contested by James Murray (4.7 feet, ZONE). KOBE MING MAKES IT!
Score: 14-14

[03:05] Team_053 possession (Score: 14-14)
Michael Gasol drives and kicks out. Michael Gasol attempts a 3Pt. Contested by Ben Adebayo (4.7 feet, ZONE). Michael Gasol misses. Offensive rebound by Draymond LaVine! Draymond LaVine kicks it out.

[02:49] Team_053 possession (Score: 14-14)
Michael Gasol attempts a Layup. BLOCKED BY BEN ADEBAYO! Ball goes out off Ben Adebayo. Michael Gasol's ball!

[02:32] Team_053 possession (Score: 14-14)
Kobe Ginobili attempts a 3Pt. Contested by Kobe Ming (4.7 feet, ZONE). Kobe Ginobili misses. Rebound secured by Ben Adebayo.

[02:13] Team_057 possession (Score: 14-14)
Ben Adebayo drives to the basket... Ben Adebayo throws a bad pass! Stolen by Michael Gasol! TURNOVER! (live ball)

[02:03] Team_053 possession (Score: 14-14)
FOUL! Offensive foul on Immanuel Curry! Anfernee Adebayo drew the charge! [Team fouls: 6] (Immanuel Curry: 2 personal fouls) TURNOVER! (dead ball)

[01:48] Team_057 possession (Score: 14-14)
Miles Middleton attempts a 3Pt. Contested by Draymond LaVine (4.4 feet, MAN). Miles Middleton misses. Rebound secured by Michael Gasol.

[01:33] Team_053 possession (Score: 14-14)
James Murray drives to the basket... FOUL! Offensive foul on James Murray! Klay Rozier drew the charge! [Team fouls: 7] (James Murray: 1 personal fouls) TURNOVER! (dead ball)

[01:17] Team_057 possession (Score: 14-14)
Anfernee Adebayo attempts a 3Pt. Contested by Immanuel Curry (5.4 feet, MAN). ANFERNEE ADEBAYO MAKES IT! Assist: Kobe Ming
Score: 17-14

[01:02] Team_053 possession (Score: 17-14)
Draymond LaVine attempts a Layup. BLOCKED BY BEN ADEBAYO! Ball is loose! Rebound secured by Anfernee Adebayo.

[00:45] Team_057 possession (Score: 17-14)
Anfernee Adebayo attempts a Midrange. Contested by Immanuel Curry (5.5 feet, MAN). Anfernee Adebayo misses. Rebound secured by Michael Gasol.

[00:27] Team_053 possession (Score: 17-14)
Draymond LaVine makes the Layup and draws the foul on Klay Rozier! And-1! Draymond LaVine to the line for 1. [BONUS: 6 team fouls] (Klay Rozier: 1 personal fouls)   FT 1/1: GOOD Draymond LaVine makes 1/1 from the line.
Score: 17-17

[00:09] Team_057 possession (Score: 17-17)
Klay Rozier drives to the basket... FOUL! Offensive foul on Klay Rozier! Michael Gasol drew the charge! [Team fouls: 7] (Klay Rozier: 2 personal fouls) TURNOVER! (dead ball)

================================================================================
                              1ST QUARTER COMPLETE                              
================================================================================

1ST QUARTER SCORE: Team_057 17, Team_053 17

BOX SCORE:
================================================================================

Team_057
--------------------------------------------------------------------------------
Player                MIN  PTS  REB  AST  TO      FG   FG%      3P   3P%
--------------------------------------------------------------------------------
Kobe Ming              12    6    0    2   0   3/3   100.0     0/0   0.0
Klay Rozier            12    3    0    0   0   1/3    33.3     0/0   0.0
Ben Adebayo            12    3    5    0   0   1/2    50.0     0/0   0.0
Anfernee Adebayo       12    3    2    1   0   1/5    20.0     0/0   0.0
Miles Middleton        12    0    3    0   0   0/3     0.0     0/0   0.0

TEAM: FG: 6/16 (37.5%), 3PT: 3/8 (37.5%), REB: 10 (3 off, 7 def), AST: 3, TO: 5
TEAM FOULS: 7 [Team_053 in BONUS]


Team_053
--------------------------------------------------------------------------------
Player                MIN  PTS  REB  AST  TO      FG   FG%      3P   3P%
--------------------------------------------------------------------------------
Kobe Ginobili          12    5    0    0   0   2/5    40.0     0/0   0.0
Immanuel Curry         12    4    0    0   0   2/2   100.0     0/0   0.0
James Murray           12    3    4    2   0   1/1   100.0     0/0   0.0
Draymond LaVine        12    3    3    1   0   1/4    25.0     0/0   0.0
Michael Gasol          12    2    6    0   0   1/2    50.0     0/0   0.0

TEAM: FG: 7/14 (50.0%), 3PT: 0/2 (0.0%), REB: 13 (3 off, 10 def), AST: 3, TO: 6
TEAM FOULS: 7 [Team_057 in BONUS]

================================================================================

================================================================================
                       2ND QUARTER - Team_057 vs Team_053                       
================================================================================

[12:00] Team_057 possession (Score: 17-17)
Anfernee Adebayo attempts a 3Pt. Contested by Immanuel Curry (5.3 feet, MAN). ANFERNEE ADEBAYO MAKES IT! Assist: Kobe Ming
Score: 20-17

[11:48] Team_053 possession (Score: 20-17)
Kobe Ginobili attempts a Midrange. Contested by Anfernee Adebayo (5.1 feet, ZONE). Kobe Ginobili misses. Rebound secured by Ben Adebayo.

[11:32] Team_057 possession (Score: 20-17)
Miles Middleton drives and kicks out. Miles Middleton attempts a 3Pt. Contested by Kobe Ginobili (4.5 feet, ZONE). Miles Middleton misses. Rebound secured by Draymond LaVine.

[11:19] Team_053 possession (Score: 20-17)
Kobe Ginobili attempts a 3Pt. Contested by Kobe Ming (4.8 feet, MAN). KOBE GINOBILI MAKES IT! Assist: Draymond LaVine
Score: 20-20

[11:10] Team_057 possession (Score: 20-20)
Ben Adebayo attempts a Midrange. Contested by Immanuel Curry (5.5 feet, ZONE). Ben Adebayo misses. Rebound secured by Draymond LaVine.

[10:56] Team_053 possession (Score: 20-20)
Immanuel Curry makes the Layup and draws the foul on Anfernee Adebayo! And-1! Immanuel Curry to the line for 1. [Team fouls: 1] (Anfernee Adebayo: 1 personal fouls)   FT 1/1: GOOD Immanuel Curry makes 1/1 from the line.
Score: 20-23

[10:43] Team_057 possession (Score: 20-23)
Miles Middleton attempts a 3Pt. Contested by Kobe Ginobili (4.4 feet, ZONE). Miles Middleton misses. Rebound secured by James Murray.

[10:32] Team_053 possession (Score: 20-23)
Kobe Ginobili makes the Dunk and draws the foul on Kobe Ming! And-1! Kobe Ginobili to the line for 1. [Team fouls: 2] (Kobe Ming: 1 personal fouls)   FT 1/1: MISS Kobe Ginobili makes 0/1 from the line. Rebound secured by Ben Adebayo.
Score: 20-25

[10:15] Team_057 possession (Score: 20-25)
Klay Rozier attempts a 3Pt. Contested by James Murray (4.9 feet, MAN). Klay Rozier misses. Rebound secured by Michael Gasol.

[09:59] Team_053 possession (Score: 20-25)
James Murray makes the Layup and draws the foul on Klay Rozier! And-1! James Murray to the line for 1. [Team fouls: 3] (Klay Rozier: 1 personal fouls)   FT 1/1: GOOD James Murray makes 1/1 from the line.
Score: 20-28

[09:48] Team_057 possession (Score: 20-28)
Kobe Ming drives, picks up Kobe Ginobili. Help arrives from James Murray! Kobe Ming attempts a Layup. Contested by James Murray (4.9 feet, MAN). Kobe Ming misses. Rebound secured by James Murray.

[09:30] Team_053 possession (Score: 20-28)
Immanuel Curry attempts a 3Pt. Contested by Anfernee Adebayo (5.6 feet, MAN). IMMANUEL CURRY MAKES IT! Assist: Michael Gasol
Score: 20-31

[09:16] Team_057 possession (Score: 20-31)
Ben Adebayo drives, Michael Gasol stays with him. Ben Adebayo attempts a Layup. Contested by Michael Gasol (5.1 feet, ZONE). BEN ADEBAYO MAKES IT! Assist: Anfernee Adebayo
Score: 22-31

[09:02] Team_053 possession (Score: 22-31)
Michael Gasol attempts a Midrange. Contested by Ben Adebayo (5.0 feet, MAN). Michael Gasol misses. Rebound secured by Miles Middleton.

[08:48] Team_057 possession (Score: 22-31)
Anfernee Adebayo attempts a 3Pt. Contested by Immanuel Curry (5.7 feet, MAN). Anfernee Adebayo misses. FOUL! Loose ball foul on Draymond LaVine during the rebound battle. [Team fouls: 1] No free throws, side out. (Draymond LaVine: 1 personal fouls)

[08:32] Team_057 possession (Score: 22-31)
Miles Middleton drives, Michael Gasol stays with him. Miles Middleton attempts a Layup. Contested by Michael Gasol (4.6 feet, ZONE). MILES MIDDLETON MAKES IT!
Score: 24-31

[08:18] Team_053 possession (Score: 24-31)
Draymond LaVine drives to the basket... Draymond LaVine loses the ball! Stripped by Ben Adebayo! TURNOVER! (live ball)

[08:04] Team_057 possession (Score: 24-31)
Anfernee Adebayo attempts a Layup. Contested by Immanuel Curry (5.8 feet, MAN). Anfernee Adebayo misses. Offensive rebound by Miles Middleton! Miles Middleton kicks it out.

[07:51] Team_057 possession (Score: 24-31)
Miles Middleton attempts a Layup. Contested by Michael Gasol (4.7 feet, ZONE). MILES MIDDLETON MAKES IT! Assist: Ben Adebayo
Score: 26-31

[07:36] Team_053 possession (Score: 26-31)
James Murray attempts a 3Pt. Contested by Kobe Ming (5.8 feet, ZONE). James Murray misses. Rebound secured by Miles Middleton.

[07:20] Team_057 possession (Score: 26-31)
Klay Rozier attempts a 3Pt. Contested by Kobe Ginobili (5.1 feet, ZONE). KLAY ROZIER MAKES IT! Assist: Kobe Ming
Score: 29-31

[07:10] Team_053 possession (Score: 29-31)
Draymond LaVine attempts a Midrange. Contested by Miles Middleton (5.4 feet, MAN). DRAYMOND LAVINE MAKES IT!
Score: 29-33

[06:53] Team_057 possession (Score: 29-33)
Ben Adebayo drives, Michael Gasol stays with him. Ben Adebayo attempts a Dunk. Contested by Michael Gasol (5.4 feet, MAN). BEN ADEBAYO MAKES IT! Assist: Klay Rozier
Score: 31-33

[06:43] Team_053 possession (Score: 31-33)
James Murray attempts a Midrange. Contested by Ben Adebayo (6.0 feet, ZONE). James Murray misses. Offensive rebound by Draymond LaVine! Draymond LaVine kicks it out.

[06:33] Team_053 possession (Score: 31-33)
Immanuel Curry makes the Layup and draws the foul on Ben Adebayo! And-1! Immanuel Curry to the line for 1. [Team fouls: 4] (Ben Adebayo: 1 personal fouls)   FT 1/1: GOOD Immanuel Curry makes 1/1 from the line.
Score: 31-36

[06:21] Team_057 possession (Score: 31-36)
FOUL! Offensive foul on Anfernee Adebayo! Immanuel Curry drew the charge! [Team fouls: 5] (Anfernee Adebayo: 2 personal fouls) TURNOVER! (dead ball)

[06:10] Team_053 possession (Score: 31-36)
Kobe Ginobili attempts a 3Pt. Contested by Kobe Ming (5.4 feet, MAN). Kobe Ginobili misses. Rebound secured by Miles Middleton.

[05:56] Team_057 possession (Score: 31-36)
FOUL! Holding foul on James Murray. [Team fouls: 2] No free throws, side out. (James Murray: 1 personal fouls)

[05:41] Team_057 possession (Score: 31-36)
Klay Rozier loses control! Ball rolls out of bounds! TURNOVER! (dead ball)

[05:41] Substitution (Team_057): Kobe Ming OUT → Scottie Johnson IN (stamina_rule2)

[05:41] Substitution (Team_057): Klay Rozier OUT → Bradley Ginobili IN (stamina_rule2)

[05:41] Substitution (Team_057): Anfernee Adebayo OUT → Joel Wade IN (stamina_rule2)

[05:41] Substitution (Team_057): Ben Adebayo OUT → Lamelo Irving IN (stamina_rule2)

[05:41] Substitution (Team_057): Miles Middleton OUT → Zion Lillard IN (stamina_rule2)

[05:41] Substitution (Team_053): Kobe Ginobili OUT → Michael DeRozan IN (stamina_rule2)

[05:41] Substitution (Team_053): James Murray OUT → Tyrese Mitchell IN (stamina_rule2)

[05:41] Substitution (Team_053): Immanuel Curry OUT → Brandon Bryant IN (stamina_rule2)

[05:41] Substitution (Team_053): Michael Gasol OUT → Klay Anunoby IN (stamina_rule2)

[05:41] Substitution (Team_053): Draymond LaVine OUT → Devin Green IN (stamina_rule2)

[05:31] Team_053 possession (Score: 31-36)
FOUL! Shooting foul on Lamelo Irving. Klay Anunoby to the line for 2 free throws. [BONUS: 6 team fouls] (Lamelo Irving: 1 personal fouls)   FT 1/2: GOOD   FT 2/2: GOOD Klay Anunoby makes 2/2 from the line.
Score: 31-38

[05:21] Team_057 possession (Score: 31-38)
Lamelo Irving attempts a 3Pt. Contested by Brandon Bryant (4.1 feet, ZONE). Lamelo Irving misses. Rebound secured by Klay Anunoby.

[05:12] Team_053 possession (Score: 31-38)
Brandon Bryant makes the Layup and draws the foul on Joel Wade! And-1! Brandon Bryant to the line for 1. [BONUS: 7 team fouls] (Joel Wade: 1 personal fouls)   FT 1/1: GOOD Brandon Bryant makes 1/1 from the line.
Score: 31-41

[04:57] Team_057 possession (Score: 31-41)
Zion Lillard makes the Layup and draws the foul on Devin Green! And-1! Zion Lillard to the line for 1. [Team fouls: 3] (Devin Green: 1 personal fouls)   FT 1/1: GOOD Zion Lillard makes 1/1 from the line.
Score: 34-41

[04:44] Team_053 possession (Score: 34-41)
Brandon Bryant attempts a 3Pt. Contested by Scottie Johnson (4.8 feet, ZONE). Brandon Bryant misses. Offensive rebound by Devin Green! Devin Green's putback is no good. Rebound secured by Joel Wade.

[04:30] Team_057 possession (Score: 34-41)
Bradley Ginobili attempts a 3Pt. Contested by Tyrese Mitchell (5.3 feet, MAN). Bradley Ginobili misses. Rebound secured by Brandon Bryant.

[04:18] Team_053 possession (Score: 34-41)
Devin Green attempts a Layup. Contested by Zion Lillard (3.9 feet, MAN). Devin Green misses. Rebound secured by Lamelo Irving.

[04:03] Team_057 possession (Score: 34-41)
Bradley Ginobili attempts a 3Pt. Contested by Brandon Bryant (3.7 feet, ZONE). BRADLEY GINOBILI MAKES IT!
Score: 37-41

[03:50] Team_053 possession (Score: 37-41)
Michael DeRozan attempts a Layup. Contested by Lamelo Irving (4.5 feet, ZONE). MICHAEL DEROZAN MAKES IT!
Score: 37-43

[03:38] Team_057 possession (Score: 37-43)
Lamelo Irving attempts a 3Pt. Contested by Klay Anunoby (4.3 feet, MAN). Lamelo Irving misses. Offensive rebound by Lamelo Irving! Lamelo Irving kicks it out.

[03:24] Team_057 possession (Score: 37-43)
Scottie Johnson drives, picks up Klay Anunoby. Help arrives from Tyrese Mitchell! Scottie Johnson attempts a Dunk. Contested by Tyrese Mitchell (3.8 feet, ZONE). SCOTTIE JOHNSON MAKES IT! Assist: Lamelo Irving
Score: 39-43

[03:11] Team_053 possession (Score: 39-43)
Tyrese Mitchell attempts a 3Pt. Contested by Scottie Johnson (4.7 feet, ZONE). TYRESE MITCHELL MAKES IT! Assist: Klay Anunoby
Score: 39-46

[02:56] Team_057 possession (Score: 39-46)
Lamelo Irving attempts a Layup. Contested by Devin Green (5.6 feet, ZONE). Lamelo Irving misses. Rebound secured by Klay Anunoby.

[02:42] Team_053 possession (Score: 39-46)
Devin Green attempts a 3Pt. Contested by Scottie Johnson (5.2 feet, ZONE). DEVIN GREEN MAKES IT! Assist: Tyrese Mitchell
Score: 39-49

[02:29] Team_057 possession (Score: 39-49)
Joel Wade attempts a 3Pt. Contested by Klay Anunoby (3.4 feet, ZONE). Joel Wade misses. Offensive rebound by Zion Lillard! Zion Lillard puts it back in!
Score: 41-49

[02:14] Team_053 possession (Score: 41-49)
Devin Green attempts a 3Pt. Contested by Scottie Johnson (5.2 feet, ZONE). Devin Green misses. Offensive rebound by Klay Anunoby! Klay Anunoby kicks it out.

[02:00] Team_053 possession (Score: 41-49)
Brandon Bryant attempts a 3Pt. Contested by Joel Wade (5.3 feet, MAN). BRANDON BRYANT MAKES IT! Assist: Michael DeRozan
Score: 41-52

[01:45] Team_057 possession (Score: 41-52)
Zion Lillard attempts a Midrange. Contested by Devin Green (5.2 feet, MAN). ZION LILLARD MAKES IT! Assist: Bradley Ginobili
Score: 43-52

[01:30] Team_053 possession (Score: 43-52)
Michael DeRozan drives to the basket... Michael DeRozan throws a bad pass out of bounds! TURNOVER! (dead ball)

[01:19] Team_057 possession (Score: 43-52)
FOUL! Holding foul on Devin Green. [Team fouls: 4] No free throws, side out. (Devin Green: 2 personal fouls)

[01:08] Team_057 possession (Score: 43-52)
Zion Lillard attempts a Layup. Contested by Devin Green (5.2 feet, MAN). ZION LILLARD MAKES IT!
Score: 45-52

[00:50] Team_053 possession (Score: 45-52)
FOUL! Reach-in foul on Lamelo Irving during the drive. [IN THE BONUS! 8 team fouls] Brandon Bryant to the line for 2 free throws. (Lamelo Irving: 2 personal fouls)   FT 1/2: GOOD   FT 2/2: GOOD Brandon Bryant makes 2/2 from the line.
Score: 45-54

[00:38] Team_057 possession (Score: 45-54)
Lamelo Irving drives to the basket... Lamelo Irving throws a bad pass out of bounds! TURNOVER! (dead ball)

[00:22] Team_053 possession (Score: 45-54)
Brandon Bryant drives, Joel Wade stays with him. Brandon Bryant attempts a Layup. Contested by Joel Wade (5.3 feet, MAN). BRANDON BRYANT MAKES IT! Assist: Tyrese Mitchell
Score: 45-56

[00:08] Team_057 possession (Score: 45-56)
Bradley Ginobili throws a bad pass out of bounds! TURNOVER! (dead ball)

================================================================================
                              2ND QUARTER COMPLETE                              
================================================================================

2ND QUARTER SCORE: Team_057 28, Team_053 39

BOX SCORE:
================================================================================

Team_057
--------------------------------------------------------------------------------
Player                MIN  PTS  REB  AST  TO      FG   FG%      3P   3P%
--------------------------------------------------------------------------------
Zion Lillard            6    9    1    0   0   4/4   100.0     0/0   0.0
Ben Adebayo            19    4    3    1   0   2/3    66.7     0/0   0.0
Miles Middleton        19    4    4    0   0   2/4    50.0     0/0   0.0
Anfernee Adebayo       19    3    0    1   0   1/1   100.0     0/0   0.0
Klay Rozier            19    3    0    1   0   1/2    50.0     0/0   0.0
Bradley Ginobili        6    3    0    1   0   1/2    50.0     0/0   0.0
Scottie Johnson         6    2    0    0   0   1/1   100.0     0/0   0.0
Kobe Ming              19    0    0    2   0   0/1     0.0     0/0   0.0
Lamelo Irving           6    0    2    1   0   0/2     0.0     0/0   0.0

TEAM: FG: 12/20 (60.0%), 3PT: 4/8 (50.0%), REB: 10 (4 off, 6 def), AST: 7, TO: 4
TEAM FOULS: 8 [Team_053 in BONUS]


Team_053
--------------------------------------------------------------------------------
Player                MIN  PTS  REB  AST  TO      FG   FG%      3P   3P%
--------------------------------------------------------------------------------
Brandon Bryant          6   10    1    0   0   4/5    80.0     0/0   0.0
Immanuel Curry         19    9    0    0   0   3/3   100.0     0/0   0.0
Kobe Ginobili          19    3    0    0   0   1/4    25.0     0/0   0.0
James Murray           19    3    2    0   0   1/2    50.0     0/0   0.0
Devin Green             6    3    0    0   0   1/2    50.0     0/0   0.0
Tyrese Mitchell         6    3    0    2   0   1/1   100.0     0/0   0.0
Draymond LaVine        19    2    3    1   0   1/1   100.0     0/0   0.0
Klay Anunoby            6    2    3    1   0   1/1   100.0     0/0   0.0
Michael DeRozan         6    2    0    1   0   1/1   100.0     0/0   0.0
Michael Gasol          19    0    1    1   0   0/1     0.0     0/0   0.0
Joel Wade               6    0    1    0   0   0/0     0.0     0/0   0.0

TEAM: FG: 14/21 (66.7%), 3PT: 5/8 (62.5%), REB: 11 (3 off, 8 def), AST: 6, TO: 2
TEAM FOULS: 4

================================================================================

================================================================================
                       3RD QUARTER - Team_057 vs Team_053                       
================================================================================

[12:00] Team_057 possession (Score: 45-56)
Kobe Ming attempts a 3Pt. Contested by Kobe Ginobili (4.4 feet, ZONE). KOBE MING MAKES IT! Assist: Miles Middleton
Score: 48-56

[11:45] Team_053 possession (Score: 48-56)
FOUL! Shooting foul on Miles Middleton. Draymond LaVine to the line for 2 free throws. [Team fouls: 1] (Miles Middleton: 1 personal fouls)   FT 1/2: GOOD   FT 2/2: MISS Draymond LaVine makes 1/2 from the line. Rebound secured by Anfernee Adebayo.
Score: 48-57

[11:28] Team_057 possession (Score: 48-57)
Miles Middleton makes the Layup and draws the foul on Draymond LaVine! And-1! Miles Middleton to the line for 1. [Team fouls: 1] (Draymond LaVine: 1 personal fouls)   FT 1/1: MISS Miles Middleton makes 0/1 from the line. Rebound secured by Michael Gasol.
Score: 50-57

[11:14] Team_053 possession (Score: 50-57)
Immanuel Curry attempts a 3Pt. Contested by Anfernee Adebayo (5.0 feet, MAN). Immanuel Curry misses. FOUL! Loose ball foul on Miles Middleton during the rebound battle. [Team fouls: 2] No free throws, side out. (Miles Middleton: 2 personal fouls)

[11:03] Team_053 possession (Score: 50-57)
Draymond LaVine attempts a Midrange. Contested by Miles Middleton (4.5 feet, MAN). Draymond LaVine misses. Rebound secured by Anfernee Adebayo.

[10:52] Team_057 possession (Score: 50-57)
Miles Middleton drives, Michael Gasol stays with him. Miles Middleton attempts a Dunk. Contested by Michael Gasol (3.9 feet, ZONE). MILES MIDDLETON MAKES IT!
Score: 52-57

[10:36] Team_053 possession (Score: 52-57)
Michael Gasol attempts a Midrange. Contested by Ben Adebayo (4.4 feet, MAN). Michael Gasol misses. Rebound secured by Miles Middleton.

[10:25] Team_057 possession (Score: 52-57)
Klay Rozier attempts a 3Pt. Contested by Kobe Ginobili (4.2 feet, ZONE). Klay Rozier misses. Rebound secured by James Murray.

[10:06] Team_053 possession (Score: 52-57)
Michael Gasol attempts a Midrange. Contested by Ben Adebayo (4.4 feet, MAN). Michael Gasol misses. Rebound secured by Miles Middleton.

[09:51] Team_057 possession (Score: 52-57)
FOUL! Reach-in foul on Michael Gasol during the drive. [Team fouls: 2] No free throws, side out. (Michael Gasol: 1 personal fouls)

[09:39] Team_057 possession (Score: 52-57)
Kobe Ming attempts a 3Pt. Contested by Kobe Ginobili (4.4 feet, ZONE). Kobe Ming misses. Rebound secured by Michael Gasol.

[09:27] Team_053 possession (Score: 52-57)
FOUL! Shooting foul on Klay Rozier. James Murray to the line for 2 free throws. [Team fouls: 3] (Klay Rozier: 1 personal fouls)   FT 1/2: MISS   FT 2/2: GOOD James Murray makes 1/2 from the line.
Score: 52-58

[09:13] Team_057 possession (Score: 52-58)
Miles Middleton attempts a Midrange. Contested by Draymond LaVine (4.1 feet, ZONE). Miles Middleton misses. Rebound secured by Draymond LaVine.

[09:03] Team_053 possession (Score: 52-58)
Kobe Ginobili attempts a 3Pt. Contested by Kobe Ming (4.4 feet, ZONE). Kobe Ginobili misses. Rebound secured by Miles Middleton.

[08:47] Team_057 possession (Score: 52-58)
Ben Adebayo attempts a 3Pt. Contested by Michael Gasol (4.5 feet, MAN). BEN ADEBAYO MAKES IT!
Score: 55-58

[08:33] Team_053 possession (Score: 55-58)
Draymond LaVine makes the Layup and draws the foul on Miles Middleton! And-1! Draymond LaVine to the line for 1. [Team fouls: 4] (Miles Middleton: 3 personal fouls)   FT 1/1: MISS Draymond LaVine makes 0/1 from the line. Rebound secured by Miles Middleton.
Score: 55-60

[08:16] Team_057 possession (Score: 55-60)
Ben Adebayo attempts a 3Pt. Contested by Kobe Ginobili (4.6 feet, ZONE). Ben Adebayo misses. Rebound secured by Draymond LaVine.

[08:02] Team_053 possession (Score: 55-60)
Immanuel Curry makes the Midrange and draws the foul on Anfernee Adebayo! And-1! Immanuel Curry to the line for 1. [BONUS: 5 team fouls] (Anfernee Adebayo: 1 personal fouls)   FT 1/1: GOOD Immanuel Curry makes 1/1 from the line.
Score: 55-63

[07:51] Team_057 possession (Score: 55-63)
Klay Rozier attempts a Midrange. Contested by James Murray (4.4 feet, MAN). Klay Rozier misses. Offensive rebound by Ben Adebayo! Ben Adebayo kicks it out.

[07:38] Team_057 possession (Score: 55-63)
Ben Adebayo drives, picks up Michael Gasol. Help arrives from James Murray! Ben Adebayo attempts a Dunk. Contested by James Murray (4.5 feet, MAN). Ben Adebayo misses. Rebound secured by Michael Gasol.

[07:25] Team_053 possession (Score: 55-63)
Kobe Ginobili attempts a 3Pt. Contested by Kobe Ming (4.4 feet, ZONE). KOBE GINOBILI MAKES IT! Assist: Michael Gasol
Score: 55-66

[07:06] Team_057 possession (Score: 55-66)
Ben Adebayo drives and kicks out. Ben Adebayo attempts a 3Pt. Contested by Kobe Ginobili (4.1 feet, ZONE). Ben Adebayo misses. Rebound secured by Draymond LaVine.

[06:52] Team_053 possession (Score: 55-66)
Immanuel Curry attempts a 3Pt. Contested by Anfernee Adebayo (5.0 feet, MAN). Immanuel Curry misses. Rebound secured by Ben Adebayo.

[06:36] Team_057 possession (Score: 55-66)
Klay Rozier loses the ball! Stripped by James Murray! TURNOVER! (live ball)

[06:22] Team_053 possession (Score: 55-66)
James Murray throws a bad pass! Stolen by Klay Rozier! TURNOVER! (live ball)

[06:04] Team_057 possession (Score: 55-66)
Klay Rozier drives to the basket... Klay Rozier throws a bad pass out of bounds! TURNOVER! (dead ball)

[05:53] Team_053 possession (Score: 55-66)
Michael Gasol drives to the basket... Michael Gasol loses the ball! Stripped by Ben Adebayo! TURNOVER! (live ball)

[05:38] Team_057 possession (Score: 55-66)
Klay Rozier attempts a 3Pt. Contested by James Murray (4.4 feet, MAN). KLAY ROZIER MAKES IT! Assist: Anfernee Adebayo
Score: 58-66

[05:19] Team_053 possession (Score: 58-66)
James Murray attempts a 3Pt. Contested by Klay Rozier (4.3 feet, MAN). James Murray misses. Rebound secured by Anfernee Adebayo.

[05:02] Team_057 possession (Score: 58-66)
Miles Middleton attempts a Midrange. Contested by Draymond LaVine (4.1 feet, MAN). MILES MIDDLETON MAKES IT! Assist: Klay Rozier
Score: 60-66

[04:47] Team_053 possession (Score: 60-66)
Michael Gasol attempts a Midrange. Contested by Ben Adebayo (4.4 feet, MAN). Michael Gasol misses. Rebound secured by Ben Adebayo.

[04:29] Team_057 possession (Score: 60-66)
Miles Middleton drives and kicks out. Ben Adebayo attempts a Midrange. Contested by Michael Gasol (4.0 feet, ZONE). Ben Adebayo misses. Offensive rebound by Miles Middleton! Miles Middleton kicks it out.

[04:13] Team_057 possession (Score: 60-66)
Kobe Ming attempts a 3Pt. Contested by Kobe Ginobili (4.4 feet, MAN). Kobe Ming misses. Rebound secured by Michael Gasol.

[04:02] Team_053 possession (Score: 60-66)
Draymond LaVine drives, Ben Adebayo stays with him. Draymond LaVine attempts a Dunk. Contested by Ben Adebayo (4.6 feet, ZONE). Draymond LaVine misses. Rebound secured by Ben Adebayo.

[03:50] Team_057 possession (Score: 60-66)
Ben Adebayo drives to the basket... Ben Adebayo loses the ball! Stripped by Michael Gasol! TURNOVER! (live ball)

[03:37] Team_053 possession (Score: 60-66)
FOUL! Shooting foul on Klay Rozier. James Murray to the line for 2 free throws. [BONUS: 6 team fouls] (Klay Rozier: 2 personal fouls)   FT 1/2: GOOD   FT 2/2: GOOD James Murray makes 2/2 from the line.
Score: 60-68

[03:23] Team_057 possession (Score: 60-68)
FOUL! Shooting foul on Draymond LaVine. Miles Middleton to the line for 2 free throws. [Team fouls: 3] (Draymond LaVine: 2 personal fouls)   FT 1/2: MISS   FT 2/2: GOOD Miles Middleton makes 1/2 from the line.
Score: 61-68

[03:12] Team_053 possession (Score: 61-68)
Michael Gasol attempts a Midrange. BLOCKED BY BEN ADEBAYO! Ball is loose! Offensive rebound by Draymond LaVine! Draymond LaVine kicks it out.

[02:57] Team_053 possession (Score: 61-68)
Immanuel Curry attempts a 3Pt. Contested by Kobe Ming (4.8 feet, ZONE). Immanuel Curry misses. Offensive rebound by Draymond LaVine! Draymond LaVine kicks it out.

[02:42] Team_053 possession (Score: 61-68)
James Murray attempts a 3Pt. Contested by Klay Rozier (4.5 feet, MAN). James Murray misses. Offensive rebound by Michael Gasol! Michael Gasol's putback is no good. Rebound secured by Miles Middleton.

[02:24] Team_057 possession (Score: 61-68)
Anfernee Adebayo attempts a Layup. Contested by Immanuel Curry (5.3 feet, MAN). ANFERNEE ADEBAYO MAKES IT! Assist: Kobe Ming
Score: 63-68

[02:07] Team_053 possession (Score: 63-68)
FOUL! Shooting foul on Anfernee Adebayo. Immanuel Curry to the line for 2 free throws. [BONUS: 7 team fouls] (Anfernee Adebayo: 2 personal fouls)   FT 1/2: GOOD   FT 2/2: GOOD Immanuel Curry makes 2/2 from the line.
Score: 63-70

[01:53] Team_057 possession (Score: 63-70)
Ben Adebayo attempts a Midrange. Contested by Michael Gasol (4.8 feet, MAN). BEN ADEBAYO MAKES IT!
Score: 65-70

[01:37] Team_053 possession (Score: 65-70)
Draymond LaVine drives, Miles Middleton stays with him. Draymond LaVine attempts a Layup. Contested by Miles Middleton (4.8 feet, MAN). Draymond LaVine misses. Rebound secured by Anfernee Adebayo.

[01:24] Team_057 possession (Score: 65-70)
Miles Middleton drives, Draymond LaVine stays with him. Miles Middleton attempts a Dunk. Contested by Draymond LaVine (4.4 feet, MAN). MILES MIDDLETON MAKES IT! Assist: Ben Adebayo
Score: 67-70

[01:06] Team_053 possession (Score: 67-70)
Immanuel Curry attempts a Layup. Contested by Ben Adebayo (5.0 feet, ZONE). IMMANUEL CURRY MAKES IT! Assist: Kobe Ginobili
Score: 67-72

[00:50] Team_057 possession (Score: 67-72)
Ben Adebayo attempts a Layup. Contested by Michael Gasol (4.9 feet, MAN). BEN ADEBAYO MAKES IT! Assist: Anfernee Adebayo
Score: 69-72

[00:37] Team_053 possession (Score: 69-72)
Immanuel Curry drives to the basket... Immanuel Curry loses control! Ball rolls out of bounds! TURNOVER! (dead ball)

[00:37] Substitution (Team_057): Kobe Ming OUT → Scottie Johnson IN (stamina_rule2)

[00:37] Substitution (Team_057): Klay Rozier OUT → Bradley Ginobili IN (stamina_rule2)

[00:37] Substitution (Team_057): Anfernee Adebayo OUT → Joel Wade IN (stamina_rule2)

[00:37] Substitution (Team_057): Ben Adebayo OUT → Lamelo Irving IN (stamina_rule2)

[00:37] Substitution (Team_057): Miles Middleton OUT → Zion Lillard IN (stamina_rule2)

[00:37] Substitution (Team_053): Kobe Ginobili OUT → Michael DeRozan IN (stamina_rule2)

[00:37] Substitution (Team_053): James Murray OUT → Tyrese Mitchell IN (stamina_rule2)

[00:37] Substitution (Team_053): Immanuel Curry OUT → Brandon Bryant IN (stamina_rule2)

[00:37] Substitution (Team_053): Michael Gasol OUT → Klay Anunoby IN (stamina_rule2)

[00:37] Substitution (Team_053): Draymond LaVine OUT → Devin Green IN (stamina_rule2)

[00:21] Team_057 possession (Score: 69-72)
Bradley Ginobili attempts a 3Pt. Contested by Brandon Bryant (3.7 feet, ZONE). Bradley Ginobili misses. Rebound secured by Devin Green.

[00:03] Team_053 possession (Score: 69-72)
Tyrese Mitchell attempts a Midrange. Contested by Bradley Ginobili (4.8 feet, MAN). Tyrese Mitchell misses. Rebound secured by Lamelo Irving.

================================================================================
                              3RD QUARTER COMPLETE                              
================================================================================

3RD QUARTER SCORE: Team_057 24, Team_053 16

BOX SCORE:
================================================================================

Team_057
--------------------------------------------------------------------------------
Player                MIN  PTS  REB  AST  TO      FG   FG%      3P   3P%
--------------------------------------------------------------------------------
Miles Middleton        30    7    6    1   0   4/6    66.7     0/0   0.0
Ben Adebayo            30    7    4    1   0   3/6    50.0     0/0   0.0
Kobe Ming              30    3    0    1   0   1/3    33.3     0/0   0.0
Klay Rozier            30    3    0    1   0   1/2    50.0     0/0   0.0
Anfernee Adebayo       30    2    4    2   0   1/1   100.0     0/0   0.0
Bradley Ginobili        6    0    0    0   0   0/1     0.0     0/0   0.0
Lamelo Irving           6    0    1    0   0   0/0     0.0     0/0   0.0

TEAM: FG: 10/19 (52.6%), 3PT: 3/8 (37.5%), REB: 14 (2 off, 12 def), AST: 6, TO: 3
TEAM FOULS: 7 [Team_053 in BONUS]


Team_053
--------------------------------------------------------------------------------
Player                MIN  PTS  REB  AST  TO      FG   FG%      3P   3P%
--------------------------------------------------------------------------------
Immanuel Curry         30    7    0    0   0   3/4    75.0     0/0   0.0
James Murray           30    3    1    0   0   2/4    50.0     0/0   0.0
Kobe Ginobili          30    3    0    1   0   1/2    50.0     0/0   0.0
Draymond LaVine        30    0    6    0   0   0/5     0.0     0/0   0.0
Michael Gasol          30    0    4    1   0   0/3     0.0     0/0   0.0
Devin Green             6    0    1    0   0   0/0     0.0     0/0   0.0
Tyrese Mitchell         6    0    0    0   0   0/1     0.0     0/0   0.0

TEAM: FG: 6/19 (31.6%), 3PT: 1/5 (20.0%), REB: 13 (4 off, 9 def), AST: 2, TO: 3
TEAM FOULS: 3

================================================================================

================================================================================
                       4TH QUARTER - Team_057 vs Team_053                       
================================================================================

[12:00] Team_057 possession (Score: 69-72)
Anfernee Adebayo drives and kicks out. Miles Middleton attempts a 3Pt. Contested by Immanuel Curry (4.8 feet, ZONE). MILES MIDDLETON MAKES IT!
Score: 72-72

[11:49] Team_053 possession (Score: 72-72)
Kobe Ginobili attempts a Midrange. Contested by Anfernee Adebayo (5.0 feet, ZONE). Kobe Ginobili misses. Offensive rebound by Michael Gasol! Michael Gasol's putback is no good. Offensive rebound by Michael Gasol! Michael Gasol kicks it out.

[11:30] Team_053 possession (Score: 72-72)
Michael Gasol drives, Ben Adebayo stays with him. Michael Gasol attempts a Layup. Contested by Ben Adebayo (4.6 feet, ZONE). MICHAEL GASOL MAKES IT! Assist: Draymond LaVine
Score: 72-74

[11:18] Team_057 possession (Score: 72-74)
Miles Middleton drives and kicks out. Klay Rozier attempts a 3Pt. Contested by Kobe Ginobili (4.4 feet, ZONE). Klay Rozier misses. Rebound secured by Draymond LaVine.

[11:03] Team_053 possession (Score: 72-74)
Kobe Ginobili attempts a 3Pt. Contested by Kobe Ming (4.7 feet, MAN). Kobe Ginobili misses. Rebound secured by Ben Adebayo.

[10:48] Team_057 possession (Score: 72-74)
Anfernee Adebayo attempts a Layup. Contested by Michael Gasol (4.7 feet, ZONE). ANFERNEE ADEBAYO MAKES IT! Assist: Klay Rozier
Score: 74-74

[10:34] Team_053 possession (Score: 74-74)
Draymond LaVine attempts a Layup. Contested by Miles Middleton (4.8 feet, MAN). DRAYMOND LAVINE MAKES IT! Assist: James Murray
Score: 74-76

[10:17] Team_057 possession (Score: 74-76)
Klay Rozier attempts a Layup. Contested by Michael Gasol (4.5 feet, ZONE). KLAY ROZIER MAKES IT! Assist: Anfernee Adebayo
Score: 76-76

[10:04] Team_053 possession (Score: 76-76)
Kobe Ginobili attempts a Layup. Contested by Ben Adebayo (4.8 feet, ZONE). KOBE GINOBILI MAKES IT!
Score: 76-78

[09:50] Team_057 possession (Score: 76-78)
Miles Middleton attempts a 3Pt. Contested by Draymond LaVine (4.5 feet, MAN). Miles Middleton misses. Rebound secured by Draymond LaVine.

[09:31] Team_053 possession (Score: 76-78)
Michael Gasol attempts a Midrange. Contested by Ben Adebayo (4.8 feet, MAN). Michael Gasol misses. Rebound secured by Anfernee Adebayo.

[09:20] Team_057 possession (Score: 76-78)
FOUL! Shooting foul on Kobe Ginobili. Kobe Ming to the line for 3 free throws. [Team fouls: 1] (Kobe Ginobili: 1 personal fouls)   FT 1/3: MISS   FT 2/3: MISS   FT 3/3: GOOD Kobe Ming makes 1/3 from the line.
Score: 77-78

[09:02] Team_053 possession (Score: 77-78)
James Murray attempts a Midrange. Contested by Klay Rozier (4.8 feet, MAN). James Murray misses. Rebound secured by Ben Adebayo.

[08:47] Team_057 possession (Score: 77-78)
Miles Middleton drives, picks up Michael Gasol. Help arrives from James Murray! Miles Middleton attempts a Layup. Contested by James Murray (4.4 feet, ZONE). MILES MIDDLETON MAKES IT! Assist: Kobe Ming
Score: 79-78

[08:33] Team_053 possession (Score: 79-78)
James Murray attempts a 3Pt. Contested by Klay Rozier (4.8 feet, MAN). James Murray misses. Rebound secured by Miles Middleton.

[08:18] Team_057 possession (Score: 79-78)
Kobe Ming attempts a 3Pt. Contested by Kobe Ginobili (4.9 feet, MAN). KOBE MING MAKES IT!
Score: 82-78

[08:01] Team_053 possession (Score: 82-78)
Kobe Ginobili drives and kicks out. James Murray attempts a 3Pt. Contested by Klay Rozier (4.4 feet, MAN). James Murray misses. Rebound secured by Ben Adebayo.

[07:45] Team_057 possession (Score: 82-78)
FOUL! Shooting foul on Immanuel Curry. Anfernee Adebayo to the line for 2 free throws. [Team fouls: 2] (Immanuel Curry: 1 personal fouls)   FT 1/2: GOOD   FT 2/2: GOOD Anfernee Adebayo makes 2/2 from the line.
Score: 84-78

[07:28] Team_053 possession (Score: 84-78)
Draymond LaVine drives and kicks out. Kobe Ginobili attempts a 3Pt. Contested by Kobe Ming (5.2 feet, ZONE). Kobe Ginobili misses. Rebound secured by Miles Middleton.

[07:15] Team_057 possession (Score: 84-78)
Ben Adebayo attempts a Midrange. Contested by Michael Gasol (5.2 feet, ZONE). BEN ADEBAYO MAKES IT!
Score: 86-78

[06:57] Team_053 possession (Score: 86-78)
Kobe Ginobili attempts a 3Pt. Contested by Kobe Ming (5.1 feet, MAN). Kobe Ginobili misses. Rebound secured by Ben Adebayo.

[06:43] Team_057 possession (Score: 86-78)
Klay Rozier attempts a Layup. Contested by Michael Gasol (4.9 feet, ZONE). KLAY ROZIER MAKES IT! Assist: Kobe Ming
Score: 88-78

[06:29] Team_053 possession (Score: 88-78)
Michael Gasol drives, Ben Adebayo stays with him. Michael Gasol attempts a Dunk. Contested by Ben Adebayo (5.2 feet, MAN). Michael Gasol misses. Offensive rebound by Michael Gasol! Michael Gasol kicks it out.

[06:13] Team_053 possession (Score: 88-78)
Kobe Ginobili attempts a 3Pt. Contested by Anfernee Adebayo (5.7 feet, ZONE). KOBE GINOBILI MAKES IT!
Score: 88-81

[05:58] Team_057 possession (Score: 88-81)
Kobe Ming attempts a Midrange. Contested by James Murray (5.3 feet, ZONE). Kobe Ming misses. Rebound secured by Draymond LaVine.

[05:48] Team_053 possession (Score: 88-81)
Draymond LaVine drives, picks up Miles Middleton. Help arrives from Klay Rozier! Draymond LaVine attempts a Dunk. Contested by Klay Rozier (5.4 feet, MAN). Draymond LaVine misses. Rebound secured by Ben Adebayo.

[05:35] Team_057 possession (Score: 88-81)
Anfernee Adebayo attempts a Midrange. Contested by Immanuel Curry (5.9 feet, MAN). ANFERNEE ADEBAYO MAKES IT! Assist: Kobe Ming
Score: 90-81

[05:20] Team_053 possession (Score: 90-81)
Immanuel Curry drives and kicks out. Immanuel Curry attempts a Midrange. Contested by Anfernee Adebayo (6.0 feet, MAN). Immanuel Curry misses. Offensive rebound by Michael Gasol! Michael Gasol kicks it out.

[05:07] Team_053 possession (Score: 90-81)
FOUL! Shooting foul on Ben Adebayo. Michael Gasol to the line for 3 free throws. [Team fouls: 1] (Ben Adebayo: 1 personal fouls)   FT 1/3: GOOD   FT 2/3: MISS   FT 3/3: GOOD Michael Gasol makes 2/3 from the line.
Score: 90-83

[04:50] Team_057 possession (Score: 90-83)
Anfernee Adebayo attempts a 3Pt. Wide open! Immanuel Curry is 6.0 feet away. [MAN] Anfernee Adebayo misses. Rebound secured by Michael Gasol.

[04:35] Team_053 possession (Score: 90-83)
FOUL! Reach-in foul on Ben Adebayo during the drive. [Team fouls: 2] No free throws, side out. (Ben Adebayo: 2 personal fouls)

[04:17] Team_053 possession (Score: 90-83)
Draymond LaVine attempts a Midrange. Contested by Anfernee Adebayo (6.0 feet, ZONE). DRAYMOND LAVINE MAKES IT!
Score: 90-85

[04:07] Team_057 possession (Score: 90-85)
Ben Adebayo drives to the basket... Ben Adebayo loses control! Ball rolls out of bounds! TURNOVER! (dead ball)

[04:07] Substitution (Team_057): Kobe Ming OUT → Scottie Johnson IN (stamina_rule2)

[04:07] Substitution (Team_057): Klay Rozier OUT → Bradley Ginobili IN (stamina_rule2)

[04:07] Substitution (Team_057): Anfernee Adebayo OUT → Joel Wade IN (stamina_rule2)

[04:07] Substitution (Team_057): Ben Adebayo OUT → Lamelo Irving IN (stamina_rule2)

[04:07] Substitution (Team_057): Miles Middleton OUT → Zion Lillard IN (stamina_rule2)

[04:07] Substitution (Team_053): Kobe Ginobili OUT → Michael DeRozan IN (stamina_rule2)

[04:07] Substitution (Team_053): James Murray OUT → Tyrese Mitchell IN (stamina_rule2)

[04:07] Substitution (Team_053): Immanuel Curry OUT → Brandon Bryant IN (stamina_rule2)

[04:07] Substitution (Team_053): Michael Gasol OUT → Klay Anunoby IN (stamina_rule2)

[04:07] Substitution (Team_053): Draymond LaVine OUT → Devin Green IN (stamina_rule2)

[03:54] Team_053 possession (Score: 90-85)
Brandon Bryant attempts a 3Pt. Contested by Scottie Johnson (4.8 feet, ZONE). Brandon Bryant misses. Rebound secured by Joel Wade.

[03:41] Team_057 possession (Score: 90-85)
Joel Wade attempts a Midrange. Contested by Brandon Bryant (3.3 feet, ZONE). Joel Wade misses. Rebound secured by Devin Green.

[03:28] Team_053 possession (Score: 90-85)
Klay Anunoby throws a bad pass out of bounds! TURNOVER! (dead ball)

[03:14] Team_057 possession (Score: 90-85)
Joel Wade throws a bad pass out of bounds! TURNOVER! (dead ball)

[03:01] Team_053 possession (Score: 90-85)
Klay Anunoby attempts a Midrange. Contested by Lamelo Irving (4.8 feet, ZONE). Klay Anunoby misses. Rebound secured by Joel Wade.

[02:46] Team_057 possession (Score: 90-85)
Bradley Ginobili throws a bad pass! Stolen by Tyrese Mitchell! TURNOVER! (live ball)

[02:30] Team_053 possession (Score: 90-85)
Klay Anunoby attempts a 3Pt. Contested by Scottie Johnson (4.8 feet, ZONE). Klay Anunoby misses. Rebound secured by Lamelo Irving.

[02:15] Team_057 possession (Score: 90-85)
Zion Lillard drives to the basket... Zion Lillard loses the ball! Stripped by Devin Green! TURNOVER! (live ball)

[02:04] Team_053 possession (Score: 90-85)
Michael DeRozan attempts a Layup. Contested by Lamelo Irving (4.5 feet, ZONE). Michael DeRozan misses. Rebound secured by Zion Lillard.

[01:46] Team_057 possession (Score: 90-85)
Lamelo Irving drives to the basket... Lamelo Irving commits a violation (traveling/carry)! TURNOVER! (dead ball)

[01:33] Team_053 possession (Score: 90-85)
Michael DeRozan drives and kicks out. Michael DeRozan attempts a 3Pt. Contested by Scottie Johnson (4.8 feet, MAN). Michael DeRozan misses. Rebound secured by Joel Wade.

[01:19] Team_057 possession (Score: 90-85)
Lamelo Irving drives, picks up Devin Green. Help arrives from Tyrese Mitchell! Lamelo Irving attempts a Layup. Contested by Tyrese Mitchell (5.6 feet, ZONE). LAMELO IRVING MAKES IT! Assist: Zion Lillard
Score: 92-85

[01:03] Team_053 possession (Score: 92-85)
Michael DeRozan attempts a 3Pt. Contested by Scottie Johnson (4.5 feet, MAN). Michael DeRozan misses. Rebound secured by Lamelo Irving.

[00:52] Team_057 possession (Score: 92-85)
Scottie Johnson attempts a Layup. Wide open! Michael DeRozan is 6.7 feet away. [MAN] SCOTTIE JOHNSON MAKES IT! Assist: Zion Lillard
Score: 94-85

[00:37] Team_053 possession (Score: 94-85)
Devin Green attempts a Layup. BLOCKED BY LAMELO IRVING! Ball is loose! Rebound secured by Lamelo Irving.

[00:20] Team_057 possession (Score: 94-85)
Bradley Ginobili attempts a Midrange. Contested by Klay Anunoby (3.9 feet, ZONE). Bradley Ginobili misses. Offensive rebound by Lamelo Irving! Lamelo Irving kicks it out.

[00:03] Team_057 possession (Score: 94-85)
Joel Wade attempts a 3Pt. Contested by Brandon Bryant (3.3 feet, ZONE). JOEL WADE MAKES IT! Assist: Bradley Ginobili
Score: 97-85

================================================================================
                              4TH QUARTER COMPLETE                              
================================================================================

4TH QUARTER SCORE: Team_057 28, Team_053 13

BOX SCORE:
================================================================================

Team_057
--------------------------------------------------------------------------------
Player                MIN  PTS  REB  AST  TO      FG   FG%      3P   3P%
--------------------------------------------------------------------------------
Anfernee Adebayo       38    6    1    1   0   3/4    75.0     0/0   0.0
Miles Middleton        38    5    2    0   0   2/4    50.0     0/0   0.0
Klay Rozier            38    4    0    1   0   2/2   100.0     0/0   0.0
Kobe Ming              38    4    0    3   0   2/3    66.7     0/0   0.0
Joel Wade              10    3    3    0   0   1/2    50.0     0/0   0.0
Ben Adebayo            38    2    5    0   0   1/1   100.0     0/0   0.0
Lamelo Irving          10    2    4    0   0   1/1   100.0     0/0   0.0
Scottie Johnson        10    2    0    0   0   1/1   100.0     0/0   0.0
Zion Lillard           10    0    1    2   0   0/0     0.0     0/0   0.0
Bradley Ginobili       10    0    0    1   0   0/0     0.0     0/0   0.0

TEAM: FG: 13/18 (72.2%), 3PT: 3/5 (60.0%), REB: 16 (1 off, 15 def), AST: 8, TO: 5
TEAM FOULS: 2


Team_053
--------------------------------------------------------------------------------
Player                MIN  PTS  REB  AST  TO      FG   FG%      3P   3P%
--------------------------------------------------------------------------------
Kobe Ginobili          38    5    0    0   0   2/5    40.0     0/0   0.0
Michael Gasol          38    4    4    0   0   2/3    66.7     0/0   0.0
Draymond LaVine        38    4    3    1   0   2/4    50.0     0/0   0.0
James Murray           38    0    0    1   0   0/2     0.0     0/0   0.0
Brandon Bryant         10    0    0    0   0   0/1     0.0     0/0   0.0
Devin Green            10    0    1    0   0   0/1     0.0     0/0   0.0
Klay Anunoby           10    0    0    0   0   0/2     0.0     0/0   0.0
Michael DeRozan        10    0    0    0   0   0/3     0.0     0/0   0.0

TEAM: FG: 6/21 (28.6%), 3PT: 2/8 (25.0%), REB: 8 (3 off, 5 def), AST: 2, TO: 1
TEAM FOULS: 2

================================================================================

================================================================================
                               FULL GAME COMPLETE                               
================================================================================

FINAL SCORE: Team_057 97, Team_053 85

SCORING BY QUARTER:
--------------------------------------------------------------------------------
Team                     Q1     Q2     Q3     Q4    FINAL
--------------------------------------------------------------------------------
Team_057                 17     28     24     28       97
Team_053                 17     39     16     13       85
--------------------------------------------------------------------------------

FULL GAME BOX SCORE:
================================================================================

Team_057
--------------------------------------------------------------------------------
Player                MIN  PTS  REB  AST  TO      FG   FG%      3P   3P%      FT STL BLK
--------------------------------------------------------------------------------
Kobe Ming              38   13    0    8   4   6/10   60.0   3/5    60.0   3/5     0   0
Klay Rozier            38   13    0    3   2   5/9    55.6   3/6    50.0   0/0     1   0
Anfernee Adebayo       38   14    7    5   4   7/12   58.3   2/5    40.0   2/3     0   1
Ben Adebayo            38   16   17    2   1   7/12   58.3   2/4    50.0   0/0     2   3
Miles Middleton        38   16   15    1   0   7/16   43.8   0/3     0.0   1/3     0   0
Scottie Johnson        10    4    0    0   1   2/2   100.0   0/0     0.0   0/0     0   0
Bradley Ginobili       10    3    0    2   3   1/3    33.3   1/3    33.3   0/0     0   0
Joel Wade              10    3    4    0   2   2/3    66.7   2/2   100.0   0/0     0   0
Lamelo Irving          10    2    7    1   0   1/3    33.3   0/1     0.0   0/0     0   1
Zion Lillard           10    9    2    2   0   3/3   100.0   0/0     0.0   1/1     0   0

TEAM: FG: 41/73 (56.2%), 3PT: 13/29 (44.8%), REB: 50 (10 off, 40 def), AST: 24, TO: 17


Team_053
--------------------------------------------------------------------------------
Player                MIN  PTS  REB  AST  TO      FG   FG%      3P   3P%      FT STL BLK
--------------------------------------------------------------------------------
Kobe Ginobili          38   16    0    1   1   6/16   37.5   3/9    33.3   1/2     0   0
James Murray           38    9    7    3   2   4/9    44.4   0/4     0.0   5/6     1   0
Immanuel Curry         38   20    0    0   2   8/9    88.9   1/2    50.0   5/5     1   0
Michael Gasol          38    6   15    2   3   3/9    33.3   1/1   100.0   2/3     2   0
Draymond LaVine        38    9   15    3   2   4/14   28.6   0/0     0.0   2/4     0   0
Michael DeRozan        10    2    0    1   1   1/4    25.0   0/1     0.0   0/0     0   0
Tyrese Mitchell        10    3    0    2   0   1/2    50.0   1/1   100.0   0/0     1   0
Brandon Bryant         10   10    1    0   0   4/6    66.7   1/3    33.3   3/3     0   0
Klay Anunoby           10    2    3    1   1   1/3    33.3   0/1     0.0   2/2     0   0
Devin Green            10    3    2    0   0   1/3    33.3   1/1   100.0   0/0     1   0

TEAM: FG: 33/75 (44.0%), 3PT: 8/23 (34.8%), REB: 45 (13 off, 32 def), AST: 13, TO: 12

================================================================================
