================================================================================
                        FULL GAME - Team_005 vs Team_026                        
================================================================================

================================================================================
                       1ST QUARTER - Team_005 vs Team_026                       
================================================================================

[12:00] Team_005 possession (Score: 0-0)
Brandon George drives, Wendell Gasol stays with him. Brandon George attempts a Dunk. Contested by Wendell Gasol (4.8 feet, MAN). Brandon George misses. Rebound secured by Kobe Booker.

[11:47] Team_026 possession (Score: 0-0)
Wendell Gasol makes the Dunk and draws the foul on Anthony Rozier! And-1! Wendell Gasol to the line for 1. [Team fouls: 1] (Anthony Rozier: 1 personal fouls)   FT 1/1: GOOD Wendell Gasol makes 1/1 from the line.
Score: 0-3

[11:29] Team_005 possession (Score: 0-3)
Brandon George attempts a 3Pt. Contested by Wendell Gasol (4.8 feet, MAN). Brandon George misses. Rebound secured by Kobe Booker.

[11:10] Team_026 possession (Score: 0-3)
Klay Giddey drives, picks up Derrick Allen. Help arrives from Anthony Rozier! Klay Giddey attempts a Layup. Contested by Anthony Rozier (4.2 feet, MAN). Klay Giddey misses. Rebound secured by Derrick Allen.

[10:53] Team_005 possession (Score: 0-3)
Brandon George attempts a 3Pt. Contested by Immanuel Hyland (4.2 feet, ZONE). Brandon George misses. Offensive rebound by Jalen Rozier! Jalen Rozier kicks it out.

[10:38] Team_005 possession (Score: 0-3)
FOUL! Shooting foul on Shaquille Trent. Jalen Rozier to the line for 2 free throws. [Team fouls: 1] (Shaquille Trent: 1 personal fouls)   FT 1/2: GOOD   FT 2/2: GOOD Jalen Rozier makes 2/2 from the line.
Score: 2-3

[10:24] Team_026 possession (Score: 2-3)
Kobe Booker drives to the basket... Kobe Booker loses the ball! Stripped by Cade Markkanen! TURNOVER! (live ball)

[10:13] Team_005 possession (Score: 2-3)
Jalen Rozier attempts a Layup. BLOCKED BY SHAQUILLE TRENT! Ball is loose! Rebound secured by Shaquille Trent.

[09:59] Team_026 possession (Score: 2-3)
Shaquille Trent attempts a 3Pt. Contested by Cade Markkanen (3.1 feet, MAN). Shaquille Trent misses. Rebound secured by Cade Markkanen.

[09:46] Team_005 possession (Score: 2-3)
Anthony Rozier throws a bad pass out of bounds! TURNOVER! (dead ball)

[09:34] Team_026 possession (Score: 2-3)
Wendell Gasol drives, Cade Markkanen stays with him. Wendell Gasol attempts a Layup. Contested by Cade Markkanen (3.6 feet, ZONE). Wendell Gasol misses. Offensive rebound by Kobe Booker! Kobe Booker kicks it out.

[09:23] Team_026 possession (Score: 2-3)
Klay Giddey attempts a 3Pt. Contested by Derrick Allen (4.2 feet, ZONE). Klay Giddey misses. Rebound secured by Cade Markkanen.

[09:13] Team_005 possession (Score: 2-3)
Derrick Allen attempts a 3Pt. Contested by Klay Giddey (5.9 feet, MAN). Derrick Allen misses. Rebound secured by Immanuel Hyland.

[09:00] Team_026 possession (Score: 2-3)
Klay Giddey drives and kicks out. Klay Giddey attempts a 3Pt. Contested by Derrick Allen (4.2 feet, ZONE). KLAY GIDDEY MAKES IT! Assist: Shaquille Trent
Score: 2-6

[08:45] Team_005 possession (Score: 2-6)
Derrick Allen attempts a 3Pt. Contested by Klay Giddey (5.9 feet, MAN). Derrick Allen misses. Rebound secured by Kobe Booker.

[08:29] Team_026 possession (Score: 2-6)
Kobe Booker commits a violation (traveling/carry)! TURNOVER! (dead ball)

[08:10] Team_005 possession (Score: 2-6)
Derrick Allen attempts a Layup. Contested by Klay Giddey (5.9 feet, MAN). DERRICK ALLEN MAKES IT!
Score: 4-6

[07:57] Team_026 possession (Score: 4-6)
Wendell Gasol attempts a 3Pt. Contested by Brandon George (5.5 feet, MAN). Wendell Gasol misses. Rebound secured by Derrick Allen.

[07:42] Team_005 possession (Score: 4-6)
Cade Markkanen attempts a Layup. Contested by Kobe Booker (4.0 feet, MAN). CADE MARKKANEN MAKES IT!
Score: 6-6

[07:26] Team_026 possession (Score: 6-6)
Wendell Gasol attempts a 3Pt. Contested by Brandon George (5.5 feet, MAN). Wendell Gasol misses. Rebound secured by Jalen Rozier.

[07:13] Team_005 possession (Score: 6-6)
FOUL! Shooting foul on Kobe Booker. Jalen Rozier to the line for 2 free throws. [Team fouls: 2] (Kobe Booker: 1 personal fouls)   FT 1/2: GOOD   FT 2/2: GOOD Jalen Rozier makes 2/2 from the line.
Score: 8-6

[07:00] Team_026 possession (Score: 8-6)
Shaquille Trent attempts a 3Pt. Contested by Cade Markkanen (3.1 feet, MAN). Shaquille Trent misses. Rebound secured by Jalen Rozier.

[06:44] Team_005 possession (Score: 8-6)
Jalen Rozier drives to the basket... Jalen Rozier loses the ball! Stripped by Kobe Booker! TURNOVER! (live ball)

[06:27] Team_026 possession (Score: 8-6)
FOUL! Reach-in foul on Cade Markkanen during the drive. [Team fouls: 2] No free throws, side out. (Cade Markkanen: 1 personal fouls)

[06:13] Team_026 possession (Score: 8-6)
Klay Giddey attempts a 3Pt. Contested by Derrick Allen (4.2 feet, ZONE). Klay Giddey misses. Rebound secured by Cade Markkanen.

[05:56] Team_005 possession (Score: 8-6)
Brandon George makes the Dunk and draws the foul on Immanuel Hyland! And-1! Brandon George to the line for 1. [Team fouls: 3] (Immanuel Hyland: 1 personal fouls)   FT 1/1: GOOD Brandon George makes 1/1 from the line.
Score: 11-6

[05:41] Team_026 possession (Score: 11-6)
Immanuel Hyland attempts a 3Pt. Contested by Derrick Allen (4.4 feet, ZONE). Immanuel Hyland misses. Rebound secured by Cade Markkanen.

[05:28] Team_005 possession (Score: 11-6)
Derrick Allen attempts a Midrange. Contested by Klay Giddey (5.9 feet, MAN). DERRICK ALLEN MAKES IT!
Score: 13-6

[05:18] Team_026 possession (Score: 13-6)
FOUL! Reach-in foul on Cade Markkanen during the drive. [Team fouls: 3] No free throws, side out. (Cade Markkanen: 2 personal fouls)

[04:58] Team_026 possession (Score: 13-6)
Wendell Gasol commits a violation (traveling/carry)! TURNOVER! (dead ball)

[04:41] Team_005 possession (Score: 13-6)
Brandon George attempts a 3Pt. Contested by Wendell Gasol (4.8 feet, MAN). BRANDON GEORGE MAKES IT! Assist: Anthony Rozier
Score: 16-6

[04:29] Team_026 possession (Score: 16-6)
Immanuel Hyland attempts a Midrange. Contested by Jalen Rozier (5.1 feet, ZONE). Immanuel Hyland misses. Rebound secured by Cade Markkanen.

[04:14] Team_005 possession (Score: 16-6)
Derrick Allen attempts a 3Pt. Contested by Immanuel Hyland (4.5 feet, ZONE). Derrick Allen misses. Rebound secured by Immanuel Hyland.

[03:58] Team_026 possession (Score: 16-6)
Kobe Booker makes the Dunk and draws the foul on Cade Markkanen! And-1! Kobe Booker to the line for 1. [Team fouls: 4] (Cade Markkanen: 3 personal fouls)   FT 1/1: GOOD Kobe Booker makes 1/1 from the line.
Score: 16-9

[03:43] Team_005 possession (Score: 16-9)
FOUL! Reach-in foul on Wendell Gasol during the drive. [Team fouls: 4] No free throws, side out. (Wendell Gasol: 1 personal fouls)

[03:29] Team_005 possession (Score: 16-9)
Jalen Rozier drives, picks up Kobe Booker. Help arrives from Immanuel Hyland! Jalen Rozier attempts a Layup. Contested by Immanuel Hyland (4.7 feet, ZONE). JALEN ROZIER MAKES IT!
Score: 18-9

[03:10] Team_026 possession (Score: 18-9)
Immanuel Hyland drives to the basket... Immanuel Hyland throws a bad pass! Stolen by Anthony Rozier! TURNOVER! (live ball)

[02:55] Team_005 possession (Score: 18-9)
Brandon George makes the Layup and draws the foul on Wendell Gasol! And-1! Brandon George to the line for 1. [BONUS: 5 team fouls] (Wendell Gasol: 2 personal fouls)   FT 1/1: GOOD Brandon George makes 1/1 from the line.
Score: 21-9

[02:41] Team_026 possession (Score: 21-9)
Wendell Gasol drives to the basket... FOUL! Offensive foul on Wendell Gasol! Brandon George drew the charge! [Team fouls: 6] (Wendell Gasol: 3 personal fouls) TURNOVER! (dead ball)

[02:29] Team_005 possession (Score: 21-9)
Cade Markkanen attempts a Midrange. Contested by Klay Giddey (5.5 feet, ZONE). Cade Markkanen misses. Offensive rebound by Jalen Rozier! Jalen Rozier kicks it out.

[02:15] Team_005 possession (Score: 21-9)
Brandon George attempts a 3Pt. Contested by Immanuel Hyland (4.5 feet, ZONE). BRANDON GEORGE MAKES IT! Assist: Anthony Rozier
Score: 24-9

[01:56] Team_026 possession (Score: 24-9)
Shaquille Trent commits a violation (traveling/carry)! TURNOVER! (dead ball)

[01:56] Substitution (Team_005): Brandon George OUT → Blake O'Neal IN (stamina_rule2)

[01:56] Substitution (Team_005): Anthony Rozier OUT → Draymond Smith IN (stamina_rule2)

[01:56] Substitution (Team_005): Derrick Allen OUT → Lauri Wade IN (stamina_rule2)

[01:56] Substitution (Team_005): Jalen Rozier OUT → Isaiah Durant IN (stamina_rule2)

[01:56] Substitution (Team_005): Cade Markkanen OUT → Zion Parker IN (stamina_rule2)

[01:56] Substitution (Team_026): Wendell Gasol OUT → Myles Tatum IN (stamina_rule2)

[01:56] Substitution (Team_026): Immanuel Hyland OUT → Karl Barrett IN (stamina_rule2)

[01:56] Substitution (Team_026): Klay Giddey OUT → Josh Simons IN (stamina_rule2)

[01:56] Substitution (Team_026): Shaquille Trent OUT → Damian Doncic IN (stamina_rule2)

[01:56] Substitution (Team_026): Kobe Booker OUT → Dirk Randle IN (stamina_rule2)

[01:40] Team_005 possession (Score: 24-9)
FOUL! Reach-in foul on Dirk Randle during the drive. [IN THE BONUS! 7 team fouls] Lauri Wade to the line for 2 free throws. (Dirk Randle: 1 personal fouls)   FT 1/2: GOOD   FT 2/2: MISS Lauri Wade makes 1/2 from the line. Rebound secured by Damian Doncic.
Score: 25-9

[01:29] Team_026 possession (Score: 25-9)
FOUL! Offensive foul on Josh Simons! Lauri Wade drew the charge! [Team fouls: 8] (Josh Simons: 1 personal fouls) TURNOVER! (dead ball)

[01:14] Team_005 possession (Score: 25-9)
FOUL! Reach-in foul on Karl Barrett during the drive. [IN THE BONUS! 9 team fouls] Draymond Smith to the line for 2 free throws. (Karl Barrett: 1 personal fouls)   FT 1/2: GOOD   FT 2/2: GOOD Draymond Smith makes 2/2 from the line.
Score: 27-9

[01:00] Team_026 possession (Score: 27-9)
Dirk Randle drives, Zion Parker stays with him. Dirk Randle attempts a Dunk. Contested by Zion Parker (4.4 feet, MAN). DIRK RANDLE MAKES IT! Assist: Karl Barrett
Score: 27-11

[00:50] Team_005 possession (Score: 27-11)
Blake O'Neal loses control! Ball rolls out of bounds! TURNOVER! (dead ball)

[00:33] Team_026 possession (Score: 27-11)
FOUL! Shooting foul on Zion Parker. Dirk Randle to the line for 2 free throws. [BONUS: 5 team fouls] (Zion Parker: 1 personal fouls)   FT 1/2: MISS   FT 2/2: GOOD Dirk Randle makes 1/2 from the line.
Score: 27-12

[00:19] Team_005 possession (Score: 27-12)
Zion Parker makes the Layup and draws the foul on Karl Barrett! And-1! Zion Parker to the line for 1. [BONUS: 10 team fouls] (Karl Barrett: 2 personal fouls)   FT 1/1: GOOD Zion Parker makes 1/1 from the line.
Score: 30-12

[00:03] Team_026 possession (Score: 30-12)
Damian Doncic attempts a Midrange. Contested by Isaiah Durant (4.1 feet, MAN). Damian Doncic misses. FOUL! Loose ball foul on Draymond Smith during the rebound battle. [IN THE BONUS! 6 team fouls] Josh Simons to the line for 2 free throws. (Draymond Smith: 1 personal fouls)   FT 1/2: MISS   FT 2/2: GOOD Josh Simons makes 1/2 from the line.
Score: 30-13

================================================================================
                              1ST QUARTER COMPLETE                              
================================================================================

1ST QUARTER SCORE: Team_005 30, Team_026 13

BOX SCORE:
================================================================================

Team_005
--------------------------------------------------------------------------------
Player                MIN  PTS  REB  AST  TO      FG   FG%      3P   3P%
--------------------------------------------------------------------------------
Brandon George         10   12    0    0   0   4/6    66.7     0/0   0.0
Jalen Rozier           10    6    4    0   0   3/4    75.0     0/0   0.0
Derrick Allen          10    4    2    0   0   2/5    40.0     0/0   0.0
Zion Parker             2    3    0    0   0   1/1   100.0     0/0   0.0
Cade Markkanen         10    2    5    0   0   1/1   100.0     0/0   0.0
Draymond Smith          2    2    0    0   0   1/1   100.0     0/0   0.0
Anthony Rozier         10    0    0    2   0   0/0     0.0     0/0   0.0
Lauri Wade              2    0    0    0   0   0/1     0.0     0/0   0.0

TEAM: FG: 12/19 (63.2%), 3PT: 2/6 (33.3%), REB: 11 (2 off, 9 def), AST: 2, TO: 3
TEAM FOULS: 6 [Team_026 in BONUS]


Team_026
--------------------------------------------------------------------------------
Player                MIN  PTS  REB  AST  TO      FG   FG%      3P   3P%
--------------------------------------------------------------------------------
Kobe Booker            10    3    4    0   0   1/1   100.0     0/0   0.0
Wendell Gasol          10    3    0    0   0   1/3    33.3     0/0   0.0
Klay Giddey            10    3    0    0   0   1/4    25.0     0/0   0.0
Dirk Randle             2    3    0    0   0   2/2   100.0     0/0   0.0
Josh Simons             2    1    0    0   0   1/1   100.0     0/0   0.0
Shaquille Trent        10    0    1    1   0   0/2     0.0     0/0   0.0
Immanuel Hyland        10    0    2    0   0   0/2     0.0     0/0   0.0
Damian Doncic           2    0    1    0   0   0/0     0.0     0/0   0.0
Karl Barrett            2    0    0    1   0   0/0     0.0     0/0   0.0

TEAM: FG: 6/15 (40.0%), 3PT: 0/7 (0.0%), REB: 8 (1 off, 7 def), AST: 2, TO: 7
TEAM FOULS: 10 [Team_005 in BONUS]

================================================================================

================================================================================
                       2ND QUARTER - Team_005 vs Team_026                       
================================================================================

[12:00] Team_005 possession (Score: 30-13)
Anthony Rozier drives and kicks out. Jalen Rozier attempts a 3Pt. Contested by Shaquille Trent (5.6 feet, MAN). Jalen Rozier misses. Rebound secured by Shaquille Trent.

[11:42] Team_026 possession (Score: 30-13)
Immanuel Hyland drives and kicks out. Shaquille Trent attempts a 3Pt. Contested by Cade Markkanen (3.4 feet, MAN). Shaquille Trent misses. Rebound secured by Jalen Rozier.

[11:28] Team_005 possession (Score: 30-13)
Cade Markkanen attempts a Midrange. BLOCKED BY IMMANUEL HYLAND! Ball is loose! Rebound secured by Shaquille Trent.

[11:14] Team_026 possession (Score: 30-13)
Immanuel Hyland attempts a 3Pt. Contested by Anthony Rozier (4.9 feet, MAN). Immanuel Hyland misses. Rebound secured by Derrick Allen.

[10:56] Team_005 possession (Score: 30-13)
Anthony Rozier attempts a 3Pt. Contested by Immanuel Hyland (4.2 feet, MAN). Anthony Rozier misses. Rebound secured by Immanuel Hyland.

[10:43] Team_026 possession (Score: 30-13)
Kobe Booker makes the Dunk and draws the foul on Anthony Rozier! And-1! Kobe Booker to the line for 1. [Team fouls: 1] (Anthony Rozier: 1 personal fouls)   FT 1/1: GOOD Kobe Booker makes 1/1 from the line.
Score: 30-16

[10:32] Team_005 possession (Score: 30-16)
Cade Markkanen attempts a Layup. Contested by Kobe Booker (4.2 feet, MAN). Cade Markkanen misses. Rebound secured by Kobe Booker.

[10:19] Team_026 possession (Score: 30-16)
Kobe Booker attempts a Layup. Contested by Cade Markkanen (3.8 feet, ZONE). KOBE BOOKER MAKES IT! Assist: Wendell Gasol
Score: 30-18

[10:06] Team_005 possession (Score: 30-18)
Cade Markkanen drives and kicks out. Derrick Allen makes the Midrange and draws the foul on Klay Giddey! And-1! Derrick Allen to the line for 1. [Team fouls: 1] (Klay Giddey: 1 personal fouls)   FT 1/1: GOOD Derrick Allen makes 1/1 from the line.
Score: 33-18

[09:50] Team_026 possession (Score: 33-18)
Wendell Gasol attempts a Midrange. Contested by Brandon George (5.8 feet, MAN). Wendell Gasol misses. Offensive rebound by Kobe Booker! Kobe Booker kicks it out.

[09:34] Team_026 possession (Score: 33-18)
Wendell Gasol drives, Cade Markkanen stays with him. Wendell Gasol attempts a Layup. Contested by Cade Markkanen (4.0 feet, ZONE). WENDELL GASOL MAKES IT! Assist: Klay Giddey
Score: 33-20

[09:19] Team_005 possession (Score: 33-20)
Derrick Allen drives to the basket... Derrick Allen loses control! Ball rolls out of bounds! TURNOVER! (dead ball)

[09:19] Substitution (Team_005): Brandon George OUT → Blake O'Neal IN (stamina_rule2)

[09:19] Substitution (Team_005): Anthony Rozier OUT → Draymond Smith IN (stamina_rule2)

[09:19] Substitution (Team_005): Jalen Rozier OUT → Isaiah Durant IN (stamina_rule2)

[09:19] Substitution (Team_005): Cade Markkanen OUT → Zion Parker IN (stamina_rule2)

[09:19] Substitution (Team_026): Wendell Gasol OUT → Myles Tatum IN (stamina_rule2)

[09:19] Substitution (Team_026): Immanuel Hyland OUT → Karl Barrett IN (stamina_rule2)

[09:19] Substitution (Team_026): Klay Giddey OUT → Josh Simons IN (stamina_rule2)

[09:19] Substitution (Team_026): Shaquille Trent OUT → Damian Doncic IN (stamina_rule2)

[09:19] Substitution (Team_026): Kobe Booker OUT → Dirk Randle IN (stamina_rule2)

[09:05] Team_026 possession (Score: 33-20)
Karl Barrett loses the ball! Stripped by Draymond Smith! TURNOVER! (live ball)

[08:47] Team_005 possession (Score: 33-20)
Zion Parker attempts a Layup. Wide open! Dirk Randle is 6.2 feet away. [MAN] Zion Parker misses. FOUL! Loose ball foul on Josh Simons during the rebound battle. [Team fouls: 2] No free throws, side out. (Josh Simons: 1 personal fouls)

[08:33] Team_005 possession (Score: 33-20)
FOUL! Holding foul on Josh Simons. [Team fouls: 3] No free throws, side out. (Josh Simons: 2 personal fouls)

[08:19] Team_005 possession (Score: 33-20)
Draymond Smith attempts a Midrange. Contested by Damian Doncic (5.3 feet, ZONE). Draymond Smith misses. Rebound secured by Damian Doncic.

[08:06] Team_026 possession (Score: 33-20)
Josh Simons drives and kicks out. Myles Tatum attempts a Midrange. Contested by Zion Parker (4.0 feet, ZONE). Myles Tatum misses. Rebound secured by Derrick Allen.

[07:48] Team_005 possession (Score: 33-20)
FOUL! Shooting foul on Josh Simons. Draymond Smith to the line for 2 free throws. [Team fouls: 4] (Josh Simons: 3 personal fouls)   FT 1/2: GOOD   FT 2/2: MISS Draymond Smith makes 1/2 from the line. FOUL! Loose ball foul on Damian Doncic during the free throw rebound! [IN THE BONUS! 5 team fouls] Zion Parker to the line for 2 free throws. (Damian Doncic: 1 personal fouls)   FT 1/2: GOOD   FT 2/2: MISS Zion Parker makes 1/2 from the line. Rebound secured by Karl Barrett.
Score: 35-20

[07:33] Team_026 possession (Score: 35-20)
Myles Tatum drives, Zion Parker stays with him. Myles Tatum attempts a Dunk. Contested by Zion Parker (3.9 feet, ZONE). MYLES TATUM MAKES IT! Assist: Karl Barrett
Score: 35-22

[07:23] Team_005 possession (Score: 35-22)
Derrick Allen attempts a Midrange. Contested by Damian Doncic (5.9 feet, ZONE). DERRICK ALLEN MAKES IT! Assist: Blake O'Neal
Score: 37-22

[07:07] Team_026 possession (Score: 37-22)
Myles Tatum attempts a 3Pt. Contested by Blake O'Neal (4.0 feet, MAN). MYLES TATUM MAKES IT! Assist: Karl Barrett
Score: 37-25

[06:56] Team_005 possession (Score: 37-25)
Derrick Allen attempts a Layup. Contested by Josh Simons (5.4 feet, MAN). Derrick Allen misses. Offensive rebound by Zion Parker! Zion Parker puts it back in!
Score: 39-25

[06:45] Team_026 possession (Score: 39-25)
Damian Doncic attempts a Layup. Contested by Isaiah Durant (4.1 feet, MAN). DAMIAN DONCIC MAKES IT!
Score: 39-27

[06:25] Team_005 possession (Score: 39-27)
Draymond Smith attempts a Layup. Contested by Karl Barrett (4.5 feet, MAN). Draymond Smith misses. Offensive rebound by Draymond Smith! Draymond Smith kicks it out.

[06:10] Team_005 possession (Score: 39-27)
Isaiah Durant attempts a 3Pt. Contested by Damian Doncic (5.8 feet, MAN). ISAIAH DURANT MAKES IT! Assist: Derrick Allen
Score: 42-27

[05:56] Team_026 possession (Score: 42-27)
Dirk Randle throws a bad pass! Stolen by Zion Parker! TURNOVER! (live ball)

[05:41] Team_005 possession (Score: 42-27)
Draymond Smith attempts a Layup. BLOCKED BY DAMIAN DONCIC! Ball goes out off Damian Doncic. Draymond Smith's ball!

[05:27] Team_005 possession (Score: 42-27)
FOUL! Holding foul on Dirk Randle. [IN THE BONUS! 6 team fouls] Zion Parker to the line for 2 free throws. (Dirk Randle: 1 personal fouls)   FT 1/2: GOOD   FT 2/2: GOOD Zion Parker makes 2/2 from the line.
Score: 44-27

[05:14] Team_026 possession (Score: 44-27)
Dirk Randle attempts a Layup. BLOCKED BY ZION PARKER! Ball is loose! Offensive rebound by Josh Simons! Josh Simons kicks it out.

[04:58] Team_026 possession (Score: 44-27)
Dirk Randle drives and kicks out. Dirk Randle attempts a 3Pt. Contested by Blake O'Neal (4.1 feet, ZONE). Dirk Randle misses. Rebound secured by Blake O'Neal.

[04:44] Team_005 possession (Score: 44-27)
Derrick Allen attempts a Layup. Contested by Josh Simons (5.3 feet, MAN). DERRICK ALLEN MAKES IT! Assist: Draymond Smith
Score: 46-27

[04:26] Team_026 possession (Score: 46-27)
Josh Simons loses control! Ball rolls out of bounds! TURNOVER! (dead ball)

[04:26] Substitution (Team_005): Derrick Allen OUT → Lauri Wade IN (stamina_rule2)

[04:10] Team_005 possession (Score: 46-27)
Lauri Wade attempts a Layup. Contested by Josh Simons (5.1 feet, MAN). Lauri Wade misses. Rebound secured by Josh Simons.

[03:54] Team_026 possession (Score: 46-27)
Damian Doncic attempts a Layup. Contested by Isaiah Durant (4.1 feet, MAN). Damian Doncic misses. Rebound secured by Zion Parker.

[03:43] Team_005 possession (Score: 46-27)
Draymond Smith attempts a 3Pt. Contested by Karl Barrett (4.5 feet, ZONE). Draymond Smith misses. Rebound secured by Damian Doncic.

[03:33] Team_026 possession (Score: 46-27)
Karl Barrett attempts a Midrange. Contested by Draymond Smith (4.4 feet, MAN). KARL BARRETT MAKES IT!
Score: 46-29

[03:16] Team_005 possession (Score: 46-29)
Zion Parker drives and kicks out. Draymond Smith attempts a 3Pt. Contested by Karl Barrett (4.8 feet, MAN). DRAYMOND SMITH MAKES IT! Assist: Isaiah Durant
Score: 49-29

[03:02] Team_026 possession (Score: 49-29)
Myles Tatum attempts a Midrange. Contested by Zion Parker (3.9 feet, ZONE). MYLES TATUM MAKES IT! Assist: Damian Doncic
Score: 49-31

[02:44] Team_005 possession (Score: 49-31)
FOUL! Reach-in foul on Damian Doncic during the drive. [IN THE BONUS! 7 team fouls] Zion Parker to the line for 2 free throws. (Damian Doncic: 2 personal fouls)   FT 1/2: GOOD   FT 2/2: GOOD Zion Parker makes 2/2 from the line.
Score: 51-31

[02:27] Team_026 possession (Score: 51-31)
Damian Doncic attempts a Midrange. Contested by Isaiah Durant (4.2 feet, MAN). Damian Doncic misses. Rebound secured by Zion Parker.

[02:12] Team_005 possession (Score: 51-31)
Blake O'Neal attempts a 3Pt. Contested by Karl Barrett (5.2 feet, ZONE). Blake O'Neal misses. Rebound secured by Damian Doncic.

[01:59] Team_026 possession (Score: 51-31)
Damian Doncic attempts a 3Pt. Contested by Blake O'Neal (3.9 feet, ZONE). DAMIAN DONCIC MAKES IT! Assist: Josh Simons
Score: 51-34

[01:43] Team_005 possession (Score: 51-34)
Isaiah Durant drives to the basket... Isaiah Durant throws a bad pass! Stolen by Damian Doncic! TURNOVER! (live ball)

[01:31] Team_026 possession (Score: 51-34)
FOUL! Shooting foul on Lauri Wade. Josh Simons to the line for 2 free throws. [Team fouls: 2] (Lauri Wade: 1 personal fouls)   FT 1/2: GOOD   FT 2/2: GOOD Josh Simons makes 2/2 from the line.
Score: 51-36

[01:17] Team_005 possession (Score: 51-36)
Zion Parker drives and kicks out. Lauri Wade attempts a Midrange. Contested by Josh Simons (5.4 feet, ZONE). Lauri Wade misses. Rebound secured by Karl Barrett.

[01:03] Team_026 possession (Score: 51-36)
FOUL! Shooting foul on Blake O'Neal. Josh Simons to the line for 2 free throws. [Team fouls: 3] (Blake O'Neal: 1 personal fouls)   FT 1/2: GOOD   FT 2/2: MISS Josh Simons makes 1/2 from the line. Rebound secured by Draymond Smith.
Score: 51-37

[00:47] Team_005 possession (Score: 51-37)
Draymond Smith drives and kicks out. Blake O'Neal attempts a 3Pt. Contested by Myles Tatum (5.6 feet, MAN). Blake O'Neal misses. Rebound secured by Karl Barrett.

[00:36] Team_026 possession (Score: 51-37)
Damian Doncic attempts a Midrange. Contested by Isaiah Durant (4.4 feet, MAN). Damian Doncic misses. Rebound secured by Zion Parker.

[00:24] Team_005 possession (Score: 51-37)
Zion Parker attempts a 3Pt. Wide open! Dirk Randle is 6.5 feet away. [MAN] Zion Parker misses. Offensive rebound by Zion Parker! Zion Parker puts it back in!
Score: 53-37

[00:08] Team_026 possession (Score: 53-37)
Karl Barrett attempts a 3Pt. Contested by Blake O'Neal (4.5 feet, ZONE). Karl Barrett misses. Rebound secured by Zion Parker.

================================================================================
                              2ND QUARTER COMPLETE                              
================================================================================

2ND QUARTER SCORE: Team_005 23, Team_026 24

BOX SCORE:
================================================================================

Team_005
--------------------------------------------------------------------------------
Player                MIN  PTS  REB  AST  TO      FG   FG%      3P   3P%
--------------------------------------------------------------------------------
Zion Parker            11    8    6    0   0   4/5    80.0     0/0   0.0
Derrick Allen          18    7    3    1   0   3/3   100.0     0/0   0.0
Draymond Smith         11    3    2    1   0   1/5    20.0     0/0   0.0
Isaiah Durant          11    3    0    1   0   1/1   100.0     0/0   0.0
Anthony Rozier         13    0    0    0   0   0/2     0.0     0/0   0.0
Jalen Rozier           13    0    1    0   0   0/0     0.0     0/0   0.0
Cade Markkanen         13    0    0    0   0   0/2     0.0     0/0   0.0
Blake O'Neal           11    0    1    1   0   0/1     0.0     0/0   0.0
Lauri Wade              6    0    0    0   0   0/1     0.0     0/0   0.0

TEAM: FG: 9/20 (45.0%), 3PT: 2/5 (40.0%), REB: 13 (4 off, 9 def), AST: 4, TO: 2
TEAM FOULS: 3


Team_026
--------------------------------------------------------------------------------
Player                MIN  PTS  REB  AST  TO      FG   FG%      3P   3P%
--------------------------------------------------------------------------------
Myles Tatum            11    7    0    0   0   3/3   100.0     0/0   0.0
Kobe Booker            13    5    2    0   0   2/2   100.0     0/0   0.0
Damian Doncic          11    5    3    1   0   2/5    40.0     0/0   0.0
Wendell Gasol          13    2    0    1   0   1/1   100.0     0/0   0.0
Josh Simons            11    2    2    1   0   1/3    33.3     0/0   0.0
Karl Barrett           11    2    3    2   0   1/2    50.0     0/0   0.0
Shaquille Trent        13    0    2    0   0   0/0     0.0     0/0   0.0
Immanuel Hyland        13    0    1    0   0   0/2     0.0     0/0   0.0
Klay Giddey            13    0    0    1   0   0/0     0.0     0/0   0.0
Dirk Randle            11    0    0    0   0   0/1     0.0     0/0   0.0

TEAM: FG: 10/19 (52.6%), 3PT: 2/4 (50.0%), REB: 13 (2 off, 11 def), AST: 6, TO: 3
TEAM FOULS: 7 [Team_005 in BONUS]

================================================================================

================================================================================
                       3RD QUARTER - Team_005 vs Team_026                       
================================================================================

[12:00] Team_005 possession (Score: 53-37)
Derrick Allen makes the Layup and draws the foul on Kobe Booker! And-1! Derrick Allen to the line for 1. [Team fouls: 1] (Kobe Booker: 1 personal fouls)   FT 1/1: MISS Derrick Allen makes 0/1 from the line. Rebound secured by Shaquille Trent.
Score: 55-37

[11:44] Team_026 possession (Score: 55-37)
Klay Giddey attempts a 3Pt. Contested by Derrick Allen (4.2 feet, ZONE). Klay Giddey misses. Rebound secured by Cade Markkanen.

[11:28] Team_005 possession (Score: 55-37)
Derrick Allen drives to the basket... FOUL! Offensive foul on Derrick Allen! Klay Giddey drew the charge! [Team fouls: 1] (Derrick Allen: 1 personal fouls) TURNOVER! (dead ball)

[11:14] Team_026 possession (Score: 55-37)
Klay Giddey drives and kicks out. Klay Giddey attempts a Midrange. Contested by Derrick Allen (4.2 feet, MAN). Klay Giddey misses. Rebound secured by Cade Markkanen.

[11:04] Team_005 possession (Score: 55-37)
Cade Markkanen drives, picks up Kobe Booker. Help arrives from Immanuel Hyland! Cade Markkanen attempts a Layup. Contested by Immanuel Hyland (4.0 feet, MAN). Cade Markkanen misses. Rebound secured by Immanuel Hyland.

[10:48] Team_026 possession (Score: 55-37)
Kobe Booker drives and kicks out. Immanuel Hyland attempts a Midrange. Contested by Jalen Rozier (4.9 feet, ZONE). Immanuel Hyland misses. FOUL! Loose ball foul on Cade Markkanen during the rebound battle. [Team fouls: 2] No free throws, side out. (Cade Markkanen: 1 personal fouls)

[10:33] Team_026 possession (Score: 55-37)
Kobe Booker drives, picks up Cade Markkanen. Help arrives from Anthony Rozier! Kobe Booker attempts a Dunk. Contested by Anthony Rozier (3.5 feet, MAN). KOBE BOOKER MAKES IT! Assist: Wendell Gasol
Score: 55-39

[10:17] Team_005 possession (Score: 55-39)
Jalen Rozier attempts a 3Pt. Contested by Shaquille Trent (5.9 feet, MAN). Jalen Rozier misses. Rebound secured by Kobe Booker.

[10:03] Team_026 possession (Score: 55-39)
FOUL! Reach-in foul on Cade Markkanen during the drive. [Team fouls: 3] No free throws, side out. (Cade Markkanen: 2 personal fouls)

[09:49] Team_026 possession (Score: 55-39)
Klay Giddey attempts a 3Pt. Contested by Derrick Allen (4.2 feet, ZONE). KLAY GIDDEY MAKES IT! Assist: Immanuel Hyland
Score: 55-42

[09:30] Team_005 possession (Score: 55-42)
Brandon George attempts a Layup. BLOCKED BY IMMANUEL HYLAND! Ball is loose! Offensive rebound by Jalen Rozier! Jalen Rozier kicks it out.

[09:14] Team_005 possession (Score: 55-42)
Brandon George drives and kicks out. Derrick Allen attempts a 3Pt. Contested by Immanuel Hyland (4.0 feet, ZONE). DERRICK ALLEN MAKES IT! Assist: Jalen Rozier
Score: 58-42

[08:58] Team_026 possession (Score: 58-42)
Wendell Gasol attempts a 3Pt. Contested by Brandon George (5.5 feet, MAN). WENDELL GASOL MAKES IT! Assist: Immanuel Hyland
Score: 58-45

[08:46] Team_005 possession (Score: 58-45)
Brandon George attempts a Layup. Contested by Wendell Gasol (4.8 feet, MAN). BRANDON GEORGE MAKES IT! Assist: Anthony Rozier
Score: 60-45

[08:30] Team_026 possession (Score: 60-45)
Klay Giddey attempts a Midrange. Contested by Anthony Rozier (4.5 feet, ZONE). Klay Giddey misses. Rebound secured by Cade Markkanen.

[08:20] Team_005 possession (Score: 60-45)
Derrick Allen attempts a Midrange. Contested by Klay Giddey (5.9 feet, MAN). DERRICK ALLEN MAKES IT!
Score: 62-45

[08:04] Team_026 possession (Score: 62-45)
Wendell Gasol attempts a 3Pt. Contested by Brandon George (5.5 feet, MAN). Wendell Gasol misses. Rebound secured by Jalen Rozier.

[07:46] Team_005 possession (Score: 62-45)
Cade Markkanen drives, picks up Kobe Booker. Help arrives from Immanuel Hyland! Cade Markkanen attempts a Layup. Contested by Immanuel Hyland (4.0 feet, ZONE). Cade Markkanen misses. Rebound secured by Shaquille Trent.

[07:26] Team_026 possession (Score: 62-45)
Kobe Booker drives, picks up Cade Markkanen. Help arrives from Anthony Rozier! Kobe Booker attempts a Dunk. Contested by Anthony Rozier (3.5 feet, MAN). KOBE BOOKER MAKES IT! Assist: Wendell Gasol
Score: 62-47

[07:14] Team_005 possession (Score: 62-47)
Derrick Allen makes the Layup and draws the foul on Kobe Booker! And-1! Derrick Allen to the line for 1. [Team fouls: 2] (Kobe Booker: 2 personal fouls)   FT 1/1: GOOD Derrick Allen makes 1/1 from the line.
Score: 65-47

[07:02] Team_026 possession (Score: 65-47)
Kobe Booker makes the Layup and draws the foul on Cade Markkanen! And-1! Kobe Booker to the line for 1. [Team fouls: 4] (Cade Markkanen: 3 personal fouls)   FT 1/1: GOOD Kobe Booker makes 1/1 from the line.
Score: 65-50

[06:51] Team_005 possession (Score: 65-50)
FOUL! Holding foul on Shaquille Trent. [Team fouls: 3] No free throws, side out. (Shaquille Trent: 1 personal fouls)

[06:34] Team_005 possession (Score: 65-50)
Anthony Rozier attempts a 3Pt. Contested by Immanuel Hyland (4.0 feet, MAN). Anthony Rozier misses. Rebound secured by Kobe Booker.

[06:15] Team_026 possession (Score: 65-50)
Kobe Booker drives and kicks out. Immanuel Hyland attempts a 3Pt. Contested by Anthony Rozier (4.6 feet, MAN). IMMANUEL HYLAND MAKES IT! Assist: Wendell Gasol
Score: 65-53

[05:56] Team_005 possession (Score: 65-53)
Derrick Allen attempts a 3Pt. Contested by Immanuel Hyland (4.4 feet, ZONE). Derrick Allen misses. Rebound secured by Kobe Booker.

[05:39] Team_026 possession (Score: 65-53)
Wendell Gasol throws a bad pass! Stolen by Brandon George! TURNOVER! (live ball)

[05:27] Team_005 possession (Score: 65-53)
Jalen Rozier attempts a 3Pt. Contested by Shaquille Trent (5.9 feet, MAN). Jalen Rozier misses. Offensive rebound by Cade Markkanen! Cade Markkanen puts it back in!
Score: 67-53

[05:12] Team_026 possession (Score: 67-53)
Klay Giddey attempts a 3Pt. Contested by Derrick Allen (4.2 feet, MAN). KLAY GIDDEY MAKES IT! Assist: Shaquille Trent
Score: 67-56

[04:56] Team_005 possession (Score: 67-56)
Anthony Rozier loses the ball! Stripped by Immanuel Hyland! TURNOVER! (live ball)

[04:45] Team_026 possession (Score: 67-56)
Klay Giddey attempts a Midrange. Contested by Anthony Rozier (4.6 feet, ZONE). KLAY GIDDEY MAKES IT!
Score: 67-58

[04:31] Team_005 possession (Score: 67-58)
Jalen Rozier attempts a Layup. Contested by Shaquille Trent (6.0 feet, MAN). Jalen Rozier misses. Rebound secured by Shaquille Trent.

[04:17] Team_026 possession (Score: 67-58)
Klay Giddey commits a violation (traveling/carry)! TURNOVER! (dead ball)

[04:00] Team_005 possession (Score: 67-58)
Brandon George attempts a Layup. BLOCKED BY WENDELL GASOL! Ball is loose! Rebound secured by Kobe Booker.

[03:50] Team_026 possession (Score: 67-58)
Kobe Booker attempts a Midrange. Contested by Jalen Rozier (5.2 feet, ZONE). KOBE BOOKER MAKES IT!
Score: 67-60

[03:35] Team_005 possession (Score: 67-60)
Brandon George attempts a 3Pt. Contested by Immanuel Hyland (4.3 feet, ZONE). Brandon George misses. Offensive rebound by Cade Markkanen! Cade Markkanen's putback is no good. Rebound secured by Immanuel Hyland.

[03:21] Team_026 possession (Score: 67-60)
Wendell Gasol attempts a 3Pt. Contested by Brandon George (5.7 feet, MAN). Wendell Gasol misses. Offensive rebound by Kobe Booker! Kobe Booker kicks it out.

[03:06] Team_026 possession (Score: 67-60)
Immanuel Hyland makes the Layup and draws the foul on Anthony Rozier! And-1! Immanuel Hyland to the line for 1. [BONUS: 5 team fouls] (Anthony Rozier: 1 personal fouls)   FT 1/1: GOOD Immanuel Hyland makes 1/1 from the line.
Score: 67-63

[02:48] Team_005 possession (Score: 67-63)
Derrick Allen attempts a 3Pt. Wide open! Klay Giddey is 6.0 feet away. [MAN] Derrick Allen misses. Rebound secured by Immanuel Hyland.

[02:37] Team_026 possession (Score: 67-63)
Kobe Booker attempts a Midrange. Contested by Derrick Allen (4.6 feet, ZONE). Kobe Booker misses. Rebound secured by Cade Markkanen.

[02:24] Team_005 possession (Score: 67-63)
Anthony Rozier attempts a Layup. Contested by Kobe Booker (4.5 feet, ZONE). Anthony Rozier misses. Rebound secured by Kobe Booker.

[02:11] Team_026 possession (Score: 67-63)
Wendell Gasol attempts a 3Pt. Contested by Derrick Allen (4.8 feet, ZONE). WENDELL GASOL MAKES IT! Assist: Klay Giddey
Score: 67-66

[01:57] Team_005 possession (Score: 67-66)
Jalen Rozier attempts a Layup. Wide open! Shaquille Trent is 6.2 feet away. [MAN] JALEN ROZIER MAKES IT!
Score: 69-66

[01:41] Team_026 possession (Score: 69-66)
Kobe Booker makes the 3Pt and draws the foul on Derrick Allen! And-1! Kobe Booker to the line for 1. [BONUS: 6 team fouls] (Derrick Allen: 2 personal fouls)   FT 1/1: GOOD Kobe Booker makes 1/1 from the line.
Score: 69-70

[01:26] Team_005 possession (Score: 69-70)
FOUL! Reach-in foul on Kobe Booker during the drive. [Team fouls: 4] No free throws, side out. (Kobe Booker: 3 personal fouls)

[01:09] Team_005 possession (Score: 69-70)
Cade Markkanen drives, Kobe Booker stays with him. Cade Markkanen attempts a Layup. Contested by Kobe Booker (4.4 feet, ZONE). Cade Markkanen misses. Rebound secured by Shaquille Trent.

[00:56] Team_026 possession (Score: 69-70)
Immanuel Hyland attempts a 3Pt. Contested by Anthony Rozier (5.2 feet, MAN). IMMANUEL HYLAND MAKES IT! Assist: Wendell Gasol
Score: 69-73

[00:42] Team_005 possession (Score: 69-73)
Cade Markkanen drives and kicks out. Jalen Rozier attempts a Midrange. Contested by Klay Giddey (5.9 feet, ZONE). Jalen Rozier misses. Offensive rebound by Jalen Rozier! Jalen Rozier kicks it out.

[00:28] Team_005 possession (Score: 69-73)
Derrick Allen drives, picks up Klay Giddey. Help arrives from Immanuel Hyland! Derrick Allen attempts a Dunk. Wide open! Immanuel Hyland is 6.2 feet away. [MAN] DERRICK ALLEN MAKES IT! Assist: Jalen Rozier
Score: 71-73

[00:16] Team_026 possession (Score: 71-73)
Klay Giddey makes the Layup and draws the foul on Jalen Rozier! And-1! Klay Giddey to the line for 1. [BONUS: 7 team fouls] (Jalen Rozier: 1 personal fouls)   FT 1/1: MISS Klay Giddey makes 0/1 from the line. Offensive rebound by Kobe Booker! Kobe Booker kicks it out.
Score: 71-75

[00:06] Team_026 possession (Score: 71-75)
Wendell Gasol attempts a 3Pt. Contested by Derrick Allen (5.0 feet, ZONE). Wendell Gasol misses. Rebound secured by Cade Markkanen.

================================================================================
                              3RD QUARTER COMPLETE                              
================================================================================

3RD QUARTER SCORE: Team_005 18, Team_026 38

BOX SCORE:
================================================================================

Team_005
--------------------------------------------------------------------------------
Player                MIN  PTS  REB  AST  TO      FG   FG%      3P   3P%
--------------------------------------------------------------------------------
Derrick Allen          30   10    0    0   0   4/7    57.1     0/0   0.0
Cade Markkanen         25    2    6    0   0   1/4    25.0     0/0   0.0
Jalen Rozier           25    2    3    2   0   1/3    33.3     0/0   0.0
Brandon George         25    2    0    0   0   1/3    33.3     0/0   0.0
Anthony Rozier         25    0    0    1   0   0/2     0.0     0/0   0.0

TEAM: FG: 7/19 (36.8%), 3PT: 1/6 (16.7%), REB: 10 (4 off, 6 def), AST: 3, TO: 2
TEAM FOULS: 7 [Team_026 in BONUS]


Team_026
--------------------------------------------------------------------------------
Player                MIN  PTS  REB  AST  TO      FG   FG%      3P   3P%
--------------------------------------------------------------------------------
Kobe Booker            25   13    8    0   0   5/6    83.3     0/0   0.0
Immanuel Hyland        25    9    3    2   0   3/3   100.0     0/0   0.0
Klay Giddey            25    8    0    1   0   3/6    50.0     0/0   0.0
Wendell Gasol          25    6    0    4   0   2/4    50.0     0/0   0.0
Shaquille Trent        25    0    4    1   0   0/0     0.0     0/0   0.0

TEAM: FG: 13/19 (68.4%), 3PT: 6/9 (66.7%), REB: 14 (3 off, 11 def), AST: 8, TO: 2
TEAM FOULS: 4

================================================================================

================================================================================
                       4TH QUARTER - Team_005 vs Team_026                       
================================================================================

[12:00] Team_005 possession (Score: 71-75)
Derrick Allen drives and kicks out. Derrick Allen attempts a 3Pt. Contested by Klay Giddey (5.8 feet, MAN). DERRICK ALLEN MAKES IT! Assist: Brandon George
Score: 74-75

[11:44] Team_026 possession (Score: 74-75)
FOUL! Reach-in foul on Brandon George during the drive. [Team fouls: 1] No free throws, side out. (Brandon George: 1 personal fouls)

[11:25] Team_026 possession (Score: 74-75)
Immanuel Hyland attempts a 3Pt. Contested by Anthony Rozier (5.1 feet, MAN). IMMANUEL HYLAND MAKES IT! Assist: Klay Giddey
Score: 74-78

[11:11] Team_005 possession (Score: 74-78)
Cade Markkanen attempts a Layup. Contested by Kobe Booker (4.4 feet, MAN). CADE MARKKANEN MAKES IT! Assist: Jalen Rozier
Score: 76-78

[10:55] Team_026 possession (Score: 76-78)
Kobe Booker attempts a Midrange. Contested by Cade Markkanen (4.1 feet, MAN). KOBE BOOKER MAKES IT! Assist: Klay Giddey
Score: 76-80

[10:40] Team_005 possession (Score: 76-80)
Anthony Rozier drives and kicks out. Cade Markkanen attempts a Midrange. Contested by Wendell Gasol (5.0 feet, ZONE). Cade Markkanen misses. Rebound secured by Shaquille Trent.

[10:23] Team_026 possession (Score: 76-80)
FOUL! Offensive foul on Kobe Booker! Cade Markkanen drew the charge! [Team fouls: 1] (Kobe Booker: 1 personal fouls) TURNOVER! (dead ball)

[10:07] Team_005 possession (Score: 76-80)
Anthony Rozier attempts a 3Pt. Contested by Immanuel Hyland (4.6 feet, MAN). Anthony Rozier misses. Rebound secured by Immanuel Hyland.

[09:54] Team_026 possession (Score: 76-80)
FOUL! Shooting foul on Cade Markkanen. Immanuel Hyland to the line for 2 free throws. [Team fouls: 2] (Cade Markkanen: 1 personal fouls)   FT 1/2: GOOD   FT 2/2: MISS Immanuel Hyland makes 1/2 from the line. Rebound secured by Cade Markkanen.
Score: 76-81

[09:38] Team_005 possession (Score: 76-81)
FOUL! Reach-in foul on Immanuel Hyland during the drive. [Team fouls: 2] No free throws, side out. (Immanuel Hyland: 1 personal fouls)

[09:25] Team_005 possession (Score: 76-81)
Anthony Rozier attempts a 3Pt. Contested by Immanuel Hyland (4.7 feet, MAN). Anthony Rozier misses. Rebound secured by Kobe Booker.

[09:08] Team_026 possession (Score: 76-81)
Immanuel Hyland attempts a Midrange. Contested by Anthony Rozier (5.4 feet, MAN). Immanuel Hyland misses. Rebound secured by Cade Markkanen.

[08:52] Team_005 possession (Score: 76-81)
Jalen Rozier drives, Shaquille Trent stays with him. Jalen Rozier attempts a Layup. Wide open! Shaquille Trent is 6.4 feet away. [MAN] JALEN ROZIER MAKES IT! Assist: Anthony Rozier
Score: 78-81

[08:38] Team_026 possession (Score: 78-81)
Klay Giddey attempts a 3Pt. Contested by Derrick Allen (4.8 feet, MAN). Klay Giddey misses. Rebound secured by Derrick Allen.

[08:23] Team_005 possession (Score: 78-81)
Brandon George attempts a 3Pt. Contested by Immanuel Hyland (4.9 feet, ZONE). Brandon George misses. Rebound secured by Kobe Booker.

[08:06] Team_026 possession (Score: 78-81)
Klay Giddey attempts a 3Pt. Contested by Derrick Allen (4.8 feet, MAN). KLAY GIDDEY MAKES IT! Assist: Wendell Gasol
Score: 78-84

[07:52] Team_005 possession (Score: 78-84)
Derrick Allen attempts a Midrange. Wide open! Klay Giddey is 6.5 feet away. [MAN] Derrick Allen misses. Rebound secured by Kobe Booker.

[07:40] Team_026 possession (Score: 78-84)
Kobe Booker throws a bad pass out of bounds! TURNOVER! (dead ball)

[07:40] Substitution (Team_005): Brandon George OUT → Blake O'Neal IN (stamina_rule2)

[07:40] Substitution (Team_005): Anthony Rozier OUT → Draymond Smith IN (stamina_rule2)

[07:40] Substitution (Team_005): Derrick Allen OUT → Lauri Wade IN (stamina_rule2)

[07:40] Substitution (Team_005): Jalen Rozier OUT → Isaiah Durant IN (stamina_rule2)

[07:40] Substitution (Team_005): Cade Markkanen OUT → Zion Parker IN (stamina_rule2)

[07:40] Substitution (Team_026): Wendell Gasol OUT → Myles Tatum IN (stamina_rule2)

[07:40] Substitution (Team_026): Immanuel Hyland OUT → Karl Barrett IN (stamina_rule2)

[07:40] Substitution (Team_026): Klay Giddey OUT → Josh Simons IN (stamina_rule2)

[07:40] Substitution (Team_026): Shaquille Trent OUT → Damian Doncic IN (stamina_rule2)

[07:40] Substitution (Team_026): Kobe Booker OUT → Dirk Randle IN (stamina_rule2)

[07:26] Team_005 possession (Score: 78-84)
Blake O'Neal attempts a Midrange. Contested by Damian Doncic (6.0 feet, ZONE). Blake O'Neal misses. Offensive rebound by Zion Parker! Zion Parker puts it back in!
Score: 80-84

[07:11] Team_026 possession (Score: 80-84)
Josh Simons attempts a Layup. Contested by Lauri Wade (4.9 feet, MAN). JOSH SIMONS MAKES IT! Assist: Damian Doncic
Score: 80-86

[06:59] Team_005 possession (Score: 80-86)
Isaiah Durant attempts a Midrange. Contested by Damian Doncic (5.8 feet, MAN). ISAIAH DURANT MAKES IT! Assist: Zion Parker
Score: 82-86

[06:46] Team_026 possession (Score: 82-86)
Karl Barrett attempts a 3Pt. Contested by Draymond Smith (4.4 feet, MAN). KARL BARRETT MAKES IT! Assist: Damian Doncic
Score: 82-89

[06:32] Team_005 possession (Score: 82-89)
Draymond Smith attempts a 3Pt. Contested by Karl Barrett (4.5 feet, ZONE). Draymond Smith misses. Offensive rebound by Draymond Smith! Draymond Smith kicks it out.

[06:15] Team_005 possession (Score: 82-89)
Isaiah Durant attempts a 3Pt. Contested by Damian Doncic (5.8 feet, MAN). Isaiah Durant misses. FOUL! Loose ball foul on Damian Doncic during the rebound battle. [Team fouls: 3] No free throws, side out. (Damian Doncic: 1 personal fouls)

[06:02] Team_005 possession (Score: 82-89)
Isaiah Durant throws a bad pass out of bounds! TURNOVER! (dead ball)

[05:47] Team_026 possession (Score: 82-89)
Myles Tatum attempts a Midrange. Contested by Isaiah Durant (4.3 feet, ZONE). Myles Tatum misses. Rebound secured by Lauri Wade.

[05:35] Team_005 possession (Score: 82-89)
Isaiah Durant drives and kicks out. Blake O'Neal attempts a Midrange. Contested by Myles Tatum (5.3 feet, MAN). Blake O'Neal misses. Rebound secured by Damian Doncic.

[05:23] Team_026 possession (Score: 82-89)
Karl Barrett attempts a 3Pt. Contested by Blake O'Neal (4.2 feet, ZONE). Karl Barrett misses. Rebound secured by Zion Parker.

[05:06] Team_005 possession (Score: 82-89)
Lauri Wade attempts a 3Pt. Contested by Josh Simons (5.1 feet, MAN). Lauri Wade misses. Rebound secured by Josh Simons.

[04:51] Team_026 possession (Score: 82-89)
Dirk Randle attempts a Midrange. Contested by Zion Parker (4.4 feet, MAN). Dirk Randle misses. Rebound secured by Draymond Smith.

[04:35] Team_005 possession (Score: 82-89)
Zion Parker attempts a Midrange. Contested by Damian Doncic (5.6 feet, ZONE). ZION PARKER MAKES IT! Assist: Draymond Smith
Score: 84-89

[04:25] Team_026 possession (Score: 84-89)
Myles Tatum attempts a 3Pt. Contested by Blake O'Neal (4.0 feet, ZONE). MYLES TATUM MAKES IT! Assist: Karl Barrett
Score: 84-92

[04:08] Team_005 possession (Score: 84-92)
Draymond Smith makes the Layup and draws the foul on Karl Barrett! And-1! Draymond Smith to the line for 1. [Team fouls: 4] (Karl Barrett: 1 personal fouls)   FT 1/1: GOOD Draymond Smith makes 1/1 from the line.
Score: 87-92

[03:49] Team_026 possession (Score: 87-92)
Josh Simons attempts a 3Pt. Contested by Lauri Wade (4.9 feet, MAN). Josh Simons misses. Rebound secured by Lauri Wade.

[03:34] Team_005 possession (Score: 87-92)
Blake O'Neal attempts a 3Pt. Contested by Myles Tatum (5.7 feet, MAN). Blake O'Neal misses. Rebound secured by Damian Doncic.

[03:21] Team_026 possession (Score: 87-92)
Damian Doncic drives to the basket... Damian Doncic throws a bad pass! Stolen by Isaiah Durant! TURNOVER! (live ball)

[03:06] Team_005 possession (Score: 87-92)
Draymond Smith drives to the basket... Draymond Smith throws a bad pass! Stolen by Damian Doncic! TURNOVER! (live ball)

[02:49] Team_026 possession (Score: 87-92)
Damian Doncic drives, Zion Parker stays with him. Damian Doncic attempts a Dunk. Contested by Zion Parker (3.7 feet, ZONE). Damian Doncic misses. Offensive rebound by Damian Doncic! Damian Doncic kicks it out.

[02:30] Team_026 possession (Score: 87-92)
Dirk Randle makes the Layup and draws the foul on Zion Parker! And-1! Dirk Randle to the line for 1. [Team fouls: 3] (Zion Parker: 1 personal fouls)   FT 1/1: GOOD Dirk Randle makes 1/1 from the line.
Score: 87-95

[02:20] Team_005 possession (Score: 87-95)
Isaiah Durant attempts a 3Pt. Contested by Damian Doncic (5.8 feet, MAN). ISAIAH DURANT MAKES IT! Assist: Draymond Smith
Score: 90-95

[02:05] Team_026 possession (Score: 90-95)
Dirk Randle drives to the basket... FOUL! Offensive foul on Dirk Randle! Zion Parker drew the charge! [Team fouls: 5] (Dirk Randle: 1 personal fouls) TURNOVER! (dead ball)

[01:48] Team_005 possession (Score: 90-95)
Blake O'Neal attempts a 3Pt. Contested by Myles Tatum (5.7 feet, MAN). BLAKE O'NEAL MAKES IT! Assist: Isaiah Durant
Score: 93-95

[01:34] Team_026 possession (Score: 93-95)
Karl Barrett drives and kicks out. Damian Doncic attempts a 3Pt. Contested by Blake O'Neal (4.1 feet, ZONE). Damian Doncic misses. Rebound secured by Lauri Wade.

[01:19] Team_005 possession (Score: 93-95)
Blake O'Neal attempts a 3Pt. Contested by Myles Tatum (5.7 feet, MAN). Blake O'Neal misses. Rebound secured by Damian Doncic.

[01:04] Team_026 possession (Score: 93-95)
FOUL! Shooting foul on Lauri Wade. Myles Tatum to the line for 3 free throws. [Team fouls: 4] (Lauri Wade: 1 personal fouls)   FT 1/3: MISS   FT 2/3: GOOD   FT 3/3: GOOD Myles Tatum makes 2/3 from the line.
Score: 93-97

[00:52] Team_005 possession (Score: 93-97)
Zion Parker attempts a Midrange. BLOCKED BY DAMIAN DONCIC! Ball deflects out of bounds off Zion Parker.

[00:38] Team_026 possession (Score: 93-97)
Karl Barrett makes the 3Pt and draws the foul on Draymond Smith! And-1! Karl Barrett to the line for 1. [BONUS: 5 team fouls] (Draymond Smith: 1 personal fouls)   FT 1/1: MISS Karl Barrett makes 0/1 from the line. Rebound secured by Draymond Smith.
Score: 93-100

[00:21] Team_005 possession (Score: 93-100)
Blake O'Neal attempts a 3Pt. Contested by Karl Barrett (5.1 feet, ZONE). BLAKE O'NEAL MAKES IT! Assist: Isaiah Durant
Score: 96-100

[00:06] Team_026 possession (Score: 96-100)
FOUL! Shooting foul on Zion Parker. Dirk Randle to the line for 2 free throws. [BONUS: 6 team fouls] (Zion Parker: 2 personal fouls)   FT 1/2: GOOD   FT 2/2: MISS Dirk Randle makes 1/2 from the line. Rebound secured by Draymond Smith.
Score: 96-101

================================================================================
                              4TH QUARTER COMPLETE                              
================================================================================

4TH QUARTER SCORE: Team_005 25, Team_026 26

BOX SCORE:
================================================================================

Team_005
--------------------------------------------------------------------------------
Player                MIN  PTS  REB  AST  TO      FG   FG%      3P   3P%
--------------------------------------------------------------------------------
Blake O'Neal           19    6    0    0   0   2/4    50.0     0/0   0.0
Isaiah Durant          19    5    0    2   0   2/3    66.7     0/0   0.0
Zion Parker            19    4    3    1   0   2/3    66.7     0/0   0.0
Derrick Allen          35    3    1    0   0   1/2    50.0     0/0   0.0
Draymond Smith         19    3    4    2   0   1/1   100.0     0/0   0.0
Cade Markkanen         30    2    2    0   0   1/1   100.0     0/0   0.0
Jalen Rozier           30    2    0    1   0   1/1   100.0     0/0   0.0
Brandon George         30    0    0    1   0   0/1     0.0     0/0   0.0
Anthony Rozier         30    0    0    1   0   0/3     0.0     0/0   0.0
Lauri Wade             14    0    3    0   0   0/1     0.0     0/0   0.0

TEAM: FG: 10/20 (50.0%), 3PT: 3/9 (33.3%), REB: 13 (3 off, 10 def), AST: 8, TO: 2
TEAM FOULS: 6 [Team_026 in BONUS]


Team_026
--------------------------------------------------------------------------------
Player                MIN  PTS  REB  AST  TO      FG   FG%      3P   3P%
--------------------------------------------------------------------------------
Myles Tatum            19    5    0    0   0   2/3    66.7     0/0   0.0
Immanuel Hyland        30    3    1    0   0   1/3    33.3     0/0   0.0
Klay Giddey            30    3    0    2   0   1/2    50.0     0/0   0.0
Karl Barrett           19    3    0    1   0   1/4    25.0     0/0   0.0
Dirk Randle            19    3    0    0   0   1/3    33.3     0/0   0.0
Kobe Booker            30    2    3    0   0   1/1   100.0     0/0   0.0
Josh Simons            19    2    1    0   0   1/2    50.0     0/0   0.0
Shaquille Trent        30    0    1    0   0   0/0     0.0     0/0   0.0
Wendell Gasol          30    0    0    1   0   0/0     0.0     0/0   0.0
Damian Doncic          19    0    4    2   0   0/0     0.0     0/0   0.0

TEAM: FG: 8/18 (44.4%), 3PT: 5/9 (55.6%), REB: 10 (1 off, 9 def), AST: 6, TO: 4
TEAM FOULS: 5 [Team_005 in BONUS]

================================================================================

================================================================================
                               FULL GAME COMPLETE                               
================================================================================

FINAL SCORE: Team_005 96, Team_026 101

SCORING BY QUARTER:
--------------------------------------------------------------------------------
Team                     Q1     Q2     Q3     Q4    FINAL
--------------------------------------------------------------------------------
Team_005                 30     23     18     25       96
Team_026                 13     24     38     26      101
--------------------------------------------------------------------------------

FULL GAME BOX SCORE:
================================================================================

Team_005
--------------------------------------------------------------------------------
Player                MIN  PTS  REB  AST  TO      FG   FG%      3P   3P%      FT STL BLK
--------------------------------------------------------------------------------
Derrick Allen          35   24    6    1   1   9/16   56.2   0/5     0.0   2/3     0   0
Brandon George         30   14    0    1   0   6/11   54.5   2/5    40.0   2/2     1   0
Anthony Rozier         30    0    0    4   2   0/7     0.0   0/4     0.0   0/0     1   0
Jalen Rozier           30   10    8    3   1   6/9    66.7   1/2    50.0   4/4     0   0
Cade Markkanen         30    6   13    0   1   3/8    37.5   0/0     0.0   0/0     1   0
Blake O'Neal           19    6    1    1   1   3/6    50.0   2/5    40.0   0/0     0   0
Draymond Smith         19    8    6    3   2   2/6    33.3   0/1     0.0   4/5     1   0
Isaiah Durant          19    8    0    3   1   3/4    75.0   2/2   100.0   0/0     1   0
Zion Parker            19   15    9    1   0   5/7    71.4   1/1   100.0   5/5     1   1
Lauri Wade             14    0    3    0   0   0/3     0.0   0/1     0.0   1/2     0   0

TEAM: FG: 38/78 (48.7%), 3PT: 8/26 (30.8%), REB: 47 (13 off, 34 def), AST: 17, TO: 9


Team_026
--------------------------------------------------------------------------------
Player                MIN  PTS  REB  AST  TO      FG   FG%      3P   3P%      FT STL BLK
--------------------------------------------------------------------------------
Wendell Gasol          30   11    0    6   2   4/8    50.0   2/6    33.3   1/1     0   1
Immanuel Hyland        30   12    7    2   0   3/9    33.3   2/4    50.0   2/3     1   2
Klay Giddey            30   14    0    4   2   5/12   41.7   3/7    42.9   0/1     0   0
Shaquille Trent        30    0    8    2   1   0/2     0.0   0/2     0.0   0/0     0   1
Kobe Booker            30   23   17    0   5  10/11   90.9   1/1   100.0   4/4     1   0
Myles Tatum            19   12    0    0   1   5/6    83.3   3/3   100.0   2/3     0   0
Karl Barrett           19    5    3    4   1   2/6    33.3   1/4    25.0   0/1     0   0
Josh Simons            19    5    3    1   3   2/5    40.0   0/1     0.0   4/6     0   0
Damian Doncic          19    5    8    3   0   3/6    50.0   1/1   100.0   0/0     2   2
Dirk Randle            19    6    0    0   1   3/6    50.0   0/0     0.0   3/5     0   0

TEAM: FG: 37/71 (52.1%), 3PT: 13/29 (44.8%), REB: 45 (7 off, 38 def), AST: 22, TO: 16

================================================================================
