================================================================================
                        FULL GAME - Team_039 vs Team_016                        
================================================================================

================================================================================
                       1ST QUARTER - Team_039 vs Team_016                       
================================================================================

[12:00] Team_039 possession (Score: 0-0)
Klay Wade makes the Layup and draws the foul on Vince Duncan! And-1! Klay Wade to the line for 1. [Team fouls: 1] (Vince Duncan: 1 personal fouls)   FT 1/1: GOOD Klay Wade makes 1/1 from the line.
Score: 3-0

[11:49] Team_016 possession (Score: 3-0)
Vince Duncan drives, picks up Klay Wade. Help arrives from Donovan Markkanen! Vince Duncan attempts a Layup. Contested by Donovan Markkanen (4.3 feet, MAN). VINCE DUNCAN MAKES IT!
Score: 3-2

[11:35] Team_039 possession (Score: 3-2)
Jrue Bridges attempts a 3Pt. Contested by Collin Barnes (4.2 feet, ZONE). Jrue Bridges misses. Rebound secured by Ben Barrett.

[11:21] Team_016 possession (Score: 3-2)
Vince Duncan makes the Layup and draws the foul on Klay Wade! And-1! Vince Duncan to the line for 1. [Team fouls: 1] (Klay Wade: 1 personal fouls)   FT 1/1: GOOD Vince Duncan makes 1/1 from the line.
Score: 3-5

[11:06] Team_039 possession (Score: 3-5)
Austin O'Neal drives to the basket... Austin O'Neal loses control! Ball rolls out of bounds! TURNOVER! (dead ball)

[10:52] Team_016 possession (Score: 3-5)
Ben Barrett attempts a Layup. Contested by Klay Wade (4.5 feet, MAN). BEN BARRETT MAKES IT! Assist: Vince Duncan
Score: 3-7

[10:36] Team_039 possession (Score: 3-7)
FOUL! Shooting foul on Collin Barnes. Anfernee Carter to the line for 2 free throws. [Team fouls: 2] (Collin Barnes: 1 personal fouls)   FT 1/2: GOOD   FT 2/2: GOOD Anfernee Carter makes 2/2 from the line.
Score: 5-7

[10:23] Team_016 possession (Score: 5-7)
Vince Quickley attempts a 3Pt. Contested by Jrue Bridges (2.6 feet, ZONE). Vince Quickley misses. Offensive rebound by Vince Duncan! Vince Duncan's putback is no good. Rebound secured by Austin O'Neal.

[10:11] Team_039 possession (Score: 5-7)
FOUL! Holding foul on Vince Duncan. [Team fouls: 3] No free throws, side out. (Vince Duncan: 2 personal fouls)

[09:56] Team_039 possession (Score: 5-7)
Anfernee Carter attempts a Layup. BLOCKED BY VINCE DUNCAN! Ball deflects out of bounds off Anfernee Carter.

[09:45] Team_016 possession (Score: 5-7)
Ben Barrett makes the Midrange and draws the foul on Klay Wade! And-1! Ben Barrett to the line for 1. [Team fouls: 2] (Klay Wade: 2 personal fouls)   FT 1/1: GOOD Ben Barrett makes 1/1 from the line.
Score: 5-10

[09:28] Team_039 possession (Score: 5-10)
Anfernee Carter attempts a Layup. Contested by Vince Duncan (3.4 feet, ZONE). ANFERNEE CARTER MAKES IT! Assist: Klay Wade
Score: 7-10

[09:14] Team_016 possession (Score: 7-10)
Ben Barrett attempts a Midrange. Contested by Austin O'Neal (4.4 feet, ZONE). Ben Barrett misses. Rebound secured by Donovan Markkanen.

[09:05] Team_039 possession (Score: 7-10)
Donovan Markkanen drives and kicks out. Jrue Bridges attempts a 3Pt. Contested by Collin Barnes (4.0 feet, MAN). Jrue Bridges misses. Offensive rebound by Klay Wade! Klay Wade kicks it out.

[08:52] Team_039 possession (Score: 7-10)
Jrue Bridges attempts a Layup. BLOCKED BY COLLIN BARNES! Ball goes out off Collin Barnes. Jrue Bridges's ball!

[08:37] Team_039 possession (Score: 7-10)
Austin O'Neal attempts a 3Pt. Contested by Collin Barnes (4.1 feet, ZONE). AUSTIN O'NEAL MAKES IT! Assist: Donovan Markkanen
Score: 10-10

[08:23] Team_016 possession (Score: 10-10)
Giannis Ginobili makes the Dunk and draws the foul on Donovan Markkanen! And-1! Giannis Ginobili to the line for 1. [Team fouls: 3] (Donovan Markkanen: 1 personal fouls)   FT 1/1: MISS Giannis Ginobili makes 0/1 from the line. FOUL! Loose ball foul on Donovan Markkanen during the free throw rebound! [Team fouls: 4] No free throws, side out. (Donovan Markkanen: 2 personal fouls)
Score: 10-12

[08:08] Team_016 possession (Score: 10-12)
Vince Duncan attempts a Layup. Contested by Klay Wade (4.3 feet, MAN). Vince Duncan misses. Rebound secured by Austin O'Neal.

[07:57] Team_039 possession (Score: 10-12)
Donovan Markkanen attempts a 3Pt. Contested by Giannis Ginobili (5.9 feet, MAN). Donovan Markkanen misses. Rebound secured by Vince Quickley.

[07:40] Team_016 possession (Score: 10-12)
Collin Barnes attempts a 3Pt. Contested by Donovan Markkanen (3.8 feet, ZONE). Collin Barnes misses. Rebound secured by Donovan Markkanen.

[07:22] Team_039 possession (Score: 10-12)
FOUL! Reach-in foul on Vince Duncan during the drive. [Team fouls: 4] No free throws, side out. (Vince Duncan: 3 personal fouls)

[07:09] Team_039 possession (Score: 10-12)
Donovan Markkanen makes the Layup and draws the foul on Giannis Ginobili! And-1! Donovan Markkanen to the line for 1. [BONUS: 5 team fouls] (Giannis Ginobili: 1 personal fouls)   FT 1/1: MISS Donovan Markkanen makes 0/1 from the line. Offensive rebound by Austin O'Neal! Austin O'Neal kicks it out.
Score: 12-12

[06:51] Team_039 possession (Score: 12-12)
FOUL! Reach-in foul on Vince Duncan during the drive. [IN THE BONUS! 6 team fouls] Klay Wade to the line for 2 free throws. (Vince Duncan: 4 personal fouls)   FT 1/2: GOOD   FT 2/2: MISS Klay Wade makes 1/2 from the line. Rebound secured by Vince Duncan.
Score: 13-12

[06:35] Team_016 possession (Score: 13-12)
Vince Quickley attempts a 3Pt. Contested by Jrue Bridges (2.6 feet, ZONE). Vince Quickley misses. Offensive rebound by Ben Barrett! Ben Barrett puts it back in!
Score: 13-14

[06:21] Team_039 possession (Score: 13-14)
Donovan Markkanen attempts a 3Pt. Contested by Giannis Ginobili (5.9 feet, MAN). DONOVAN MARKKANEN MAKES IT! Assist: Austin O'Neal
Score: 16-14

[06:03] Team_016 possession (Score: 16-14)
Vince Duncan attempts a Midrange. Contested by Klay Wade (4.3 feet, MAN). Vince Duncan misses. Rebound secured by Austin O'Neal.

[05:45] Team_039 possession (Score: 16-14)
FOUL! Offensive foul on Anfernee Carter! Ben Barrett drew the charge! [Team fouls: 5] (Anfernee Carter: 1 personal fouls) TURNOVER! (dead ball)

[05:32] Team_016 possession (Score: 16-14)
Collin Barnes attempts a Midrange. Wide open! Anfernee Carter is 6.7 feet away. [ZONE] COLLIN BARNES MAKES IT! Assist: Vince Quickley
Score: 16-16

[05:19] Team_039 possession (Score: 16-16)
Klay Wade throws a bad pass out of bounds! TURNOVER! (dead ball)

[05:05] Team_016 possession (Score: 16-16)
Ben Barrett drives, Klay Wade stays with him. Ben Barrett attempts a Dunk. Contested by Klay Wade (4.5 feet, MAN). BEN BARRETT MAKES IT!
Score: 16-18

[04:52] Team_039 possession (Score: 16-18)
Jrue Bridges makes the Layup and draws the foul on Vince Duncan! And-1! Jrue Bridges to the line for 1. [BONUS: 7 team fouls] (Vince Duncan: 5 personal fouls)   FT 1/1: MISS Jrue Bridges makes 0/1 from the line. Offensive rebound by Klay Wade! Klay Wade kicks it out.
Score: 18-18

[04:37] Team_039 possession (Score: 18-18)
Donovan Markkanen attempts a Midrange. Contested by Giannis Ginobili (5.9 feet, MAN). Donovan Markkanen misses. Rebound secured by Vince Quickley.

[04:22] Team_016 possession (Score: 18-18)
Collin Barnes attempts a Layup. Contested by Jrue Bridges (3.2 feet, MAN). Collin Barnes misses. Rebound secured by Donovan Markkanen.

[04:03] Team_039 possession (Score: 18-18)
Jrue Bridges commits a violation (traveling/carry)! TURNOVER! (dead ball)

[03:45] Team_016 possession (Score: 18-18)
Vince Quickley attempts a 3Pt. Contested by Austin O'Neal (3.6 feet, MAN). Vince Quickley misses. Rebound secured by Klay Wade.

[03:32] Team_039 possession (Score: 18-18)
Klay Wade attempts a 3Pt. Contested by Vince Duncan (3.9 feet, MAN). Klay Wade misses. Rebound secured by Vince Quickley.

[03:19] Team_016 possession (Score: 18-18)
Vince Duncan attempts a 3Pt. Contested by Jrue Bridges (3.6 feet, ZONE). VINCE DUNCAN MAKES IT! Assist: Vince Quickley
Score: 18-21

[03:08] Team_039 possession (Score: 18-21)
Klay Wade makes the Layup and draws the foul on Vince Duncan! And-1! Klay Wade to the line for 1. [BONUS: 8 team fouls] (Vince Duncan: 6 personal fouls) Vince Duncan FOULS OUT!   FT 1/1: GOOD Klay Wade makes 1/1 from the line.
Score: 21-21

[03:08] Substitution (Team_016): Vince Duncan OUT (stamina: 72) → Lamelo Herro IN (foul_out)

[02:51] Team_016 possession (Score: 21-21)
Giannis Ginobili drives, picks up Donovan Markkanen. Help arrives from Austin O'Neal! Giannis Ginobili attempts a Dunk. Contested by Austin O'Neal (4.0 feet, MAN). GIANNIS GINOBILI MAKES IT! Assist: Vince Quickley
Score: 21-23

[02:37] Team_039 possession (Score: 21-23)
Klay Wade makes the Layup and draws the foul on Ben Barrett! And-1! Klay Wade to the line for 1. [BONUS: 9 team fouls] (Ben Barrett: 1 personal fouls)   FT 1/1: GOOD Klay Wade makes 1/1 from the line.
Score: 24-23

[02:19] Team_016 possession (Score: 24-23)
Collin Barnes makes the Layup and draws the foul on Austin O'Neal! And-1! Collin Barnes to the line for 1. [BONUS: 6 team fouls] (Austin O'Neal: 1 personal fouls)   FT 1/1: GOOD Collin Barnes makes 1/1 from the line.
Score: 24-26

[02:03] Team_039 possession (Score: 24-26)
FOUL! Shooting foul on Vince Quickley. Klay Wade to the line for 2 free throws. [BONUS: 10 team fouls] (Vince Quickley: 1 personal fouls)   FT 1/2: GOOD   FT 2/2: GOOD Klay Wade makes 2/2 from the line.
Score: 26-26

[01:47] Team_016 possession (Score: 26-26)
Lamelo Herro loses the ball! Stripped by Jrue Bridges! TURNOVER! (live ball)

[01:30] Team_039 possession (Score: 26-26)
Jrue Bridges attempts a 3Pt. Contested by Collin Barnes (4.6 feet, ZONE). Jrue Bridges misses. Rebound secured by Lamelo Herro.

[01:17] Team_016 possession (Score: 26-26)
Vince Quickley attempts a Midrange. Contested by Donovan Markkanen (3.6 feet, ZONE). VINCE QUICKLEY MAKES IT! Assist: Lamelo Herro
Score: 26-28

[01:01] Team_039 possession (Score: 26-28)
Austin O'Neal makes the Layup and draws the foul on Ben Barrett! And-1! Austin O'Neal to the line for 1. [BONUS: 11 team fouls] (Ben Barrett: 2 personal fouls)   FT 1/1: GOOD Austin O'Neal makes 1/1 from the line.
Score: 29-28

[00:47] Team_016 possession (Score: 29-28)
Ben Barrett attempts a 3Pt. Contested by Donovan Markkanen (4.6 feet, ZONE). BEN BARRETT MAKES IT! Assist: Lamelo Herro
Score: 29-31

[00:35] Team_039 possession (Score: 29-31)
Austin O'Neal attempts a 3Pt. Contested by Vince Quickley (4.6 feet, MAN). Austin O'Neal misses. Rebound secured by Ben Barrett.

[00:21] Team_016 possession (Score: 29-31)
Collin Barnes attempts a 3Pt. Contested by Donovan Markkanen (4.2 feet, ZONE). Collin Barnes misses. Rebound secured by Donovan Markkanen.

[00:08] Team_039 possession (Score: 29-31)
Donovan Markkanen drives, picks up Giannis Ginobili. Help arrives from Vince Quickley! Donovan Markkanen attempts a Layup. Wide open! Vince Quickley is 6.2 feet away. [MAN] DONOVAN MARKKANEN MAKES IT! Assist: Klay Wade
Score: 31-31

================================================================================
                              1ST QUARTER COMPLETE                              
================================================================================

1ST QUARTER SCORE: Team_039 31, Team_016 31

BOX SCORE:
================================================================================

Team_039
--------------------------------------------------------------------------------
Player                MIN  PTS  REB  AST  TO      FG   FG%      3P   3P%
--------------------------------------------------------------------------------
Klay Wade              12   11    3    2   0   4/6    66.7     0/0   0.0
Austin O'Neal          12    6    4    1   0   2/3    66.7     0/0   0.0
Donovan Markkanen      12    5    4    1   0   2/4    50.0     0/0   0.0
Anfernee Carter        12    4    0    0   0   2/3    66.7     0/0   0.0
Jrue Bridges           12    0    0    0   0   0/2     0.0     0/0   0.0

TEAM: FG: 10/18 (55.6%), 3PT: 2/7 (28.6%), REB: 10 (3 off, 7 def), AST: 4, TO: 4
TEAM FOULS: 6 [Team_016 in BONUS]


Team_016
--------------------------------------------------------------------------------
Player                MIN  PTS  REB  AST  TO      FG   FG%      3P   3P%
--------------------------------------------------------------------------------
Ben Barrett            12   12    4    0   0   5/6    83.3     0/0   0.0
Vince Duncan            9    8    1    1   0   3/5    60.0     0/0   0.0
Collin Barnes          12    5    0    0   0   2/5    40.0     0/0   0.0
Vince Quickley         12    2    3    3   0   1/3    33.3     0/0   0.0
Giannis Ginobili       12    2    0    0   0   1/1   100.0     0/0   0.0
Lamelo Herro            3    0    1    2   0   0/0     0.0     0/0   0.0

TEAM: FG: 12/20 (60.0%), 3PT: 3/7 (42.9%), REB: 10 (3 off, 7 def), AST: 6, TO: 1
TEAM FOULS: 11 [Team_039 in BONUS]

================================================================================

================================================================================
                       2ND QUARTER - Team_039 vs Team_016                       
================================================================================

[12:00] Team_039 possession (Score: 31-31)
Donovan Markkanen attempts a Midrange. Contested by Vince Quickley (4.7 feet, ZONE). Donovan Markkanen misses. Rebound secured by Vince Quickley.

[11:46] Team_016 possession (Score: 31-31)
Giannis Ginobili attempts a Layup. Contested by Donovan Markkanen (4.1 feet, MAN). GIANNIS GINOBILI MAKES IT!
Score: 31-33

[11:28] Team_039 possession (Score: 31-33)
Jrue Bridges attempts a Midrange. Contested by Ben Barrett (4.2 feet, ZONE). Jrue Bridges misses. Rebound secured by Vince Quickley.

[11:12] Team_016 possession (Score: 31-33)
Ben Barrett makes the Layup and draws the foul on Klay Wade! And-1! Ben Barrett to the line for 1. [Team fouls: 1] (Klay Wade: 1 personal fouls)   FT 1/1: GOOD Ben Barrett makes 1/1 from the line.
Score: 31-36

[10:58] Team_039 possession (Score: 31-36)
Anfernee Carter makes the Layup and draws the foul on Ben Barrett! And-1! Anfernee Carter to the line for 1. [Team fouls: 1] (Ben Barrett: 1 personal fouls)   FT 1/1: GOOD Anfernee Carter makes 1/1 from the line.
Score: 34-36

[10:45] Team_016 possession (Score: 34-36)
Vince Quickley attempts a 3Pt. Contested by Austin O'Neal (4.0 feet, MAN). VINCE QUICKLEY MAKES IT!
Score: 34-39

[10:33] Team_039 possession (Score: 34-39)
Donovan Markkanen attempts a Midrange. Contested by Ben Barrett (4.3 feet, ZONE). Donovan Markkanen misses. Offensive rebound by Klay Wade! Klay Wade kicks it out.

[10:22] Team_039 possession (Score: 34-39)
Klay Wade makes the Dunk and draws the foul on Vince Duncan! And-1! Klay Wade to the line for 1. [Team fouls: 2] (Vince Duncan: 1 personal fouls)   FT 1/1: GOOD Klay Wade makes 1/1 from the line.
Score: 37-39

[10:08] Team_016 possession (Score: 37-39)
Vince Quickley attempts a 3Pt. Contested by Austin O'Neal (4.1 feet, MAN). Vince Quickley misses. Rebound secured by Austin O'Neal.

[09:54] Team_039 possession (Score: 37-39)
Donovan Markkanen attempts a 3Pt. Contested by Collin Barnes (4.9 feet, ZONE). Donovan Markkanen misses. Rebound secured by Vince Duncan.

[09:36] Team_016 possession (Score: 37-39)
Ben Barrett attempts a 3Pt. Contested by Jrue Bridges (4.3 feet, ZONE). Ben Barrett misses. Rebound secured by Donovan Markkanen.

[09:21] Team_039 possession (Score: 37-39)
Donovan Markkanen drives and kicks out. Donovan Markkanen attempts a 3Pt. Contested by Collin Barnes (4.8 feet, ZONE). DONOVAN MARKKANEN MAKES IT! Assist: Jrue Bridges
Score: 40-39

[09:09] Team_016 possession (Score: 40-39)
Collin Barnes attempts a Layup. Contested by Klay Wade (4.6 feet, ZONE). COLLIN BARNES MAKES IT! Assist: Vince Quickley
Score: 40-41

[08:54] Team_039 possession (Score: 40-41)
Klay Wade attempts a Midrange. Contested by Vince Duncan (3.8 feet, MAN). KLAY WADE MAKES IT!
Score: 42-41

[08:36] Team_016 possession (Score: 42-41)
Vince Duncan attempts a Midrange. Contested by Klay Wade (5.1 feet, MAN). Vince Duncan misses. Rebound secured by Austin O'Neal.

[08:19] Team_039 possession (Score: 42-41)
Jrue Bridges drives and kicks out. Jrue Bridges attempts a 3Pt. Contested by Collin Barnes (4.9 feet, MAN). JRUE BRIDGES MAKES IT! Assist: Klay Wade
Score: 45-41

[08:04] Team_016 possession (Score: 45-41)
Giannis Ginobili attempts a Midrange. Contested by Donovan Markkanen (4.5 feet, MAN). GIANNIS GINOBILI MAKES IT!
Score: 45-43

[07:49] Team_039 possession (Score: 45-43)
Donovan Markkanen attempts a Layup. Contested by Ben Barrett (4.7 feet, ZONE). DONOVAN MARKKANEN MAKES IT! Assist: Jrue Bridges
Score: 47-43

[07:33] Team_016 possession (Score: 47-43)
Collin Barnes attempts a 3Pt. Contested by Jrue Bridges (4.1 feet, MAN). Collin Barnes misses. Rebound secured by Austin O'Neal.

[07:15] Team_039 possession (Score: 47-43)
Klay Wade attempts a Midrange. Contested by Vince Duncan (4.0 feet, MAN). KLAY WADE MAKES IT! Assist: Jrue Bridges
Score: 49-43

[07:02] Team_016 possession (Score: 49-43)
Vince Quickley makes the 3Pt and draws the foul on Austin O'Neal! And-1! Vince Quickley to the line for 1. [Team fouls: 2] (Austin O'Neal: 1 personal fouls)   FT 1/1: GOOD Vince Quickley makes 1/1 from the line.
Score: 49-47

[06:47] Team_039 possession (Score: 49-47)
Klay Wade attempts a 3Pt. Contested by Vince Duncan (4.0 feet, MAN). Klay Wade misses. Offensive rebound by Austin O'Neal! Austin O'Neal kicks it out.

[06:32] Team_039 possession (Score: 49-47)
Austin O'Neal attempts a 3Pt. Contested by Collin Barnes (5.2 feet, ZONE). Austin O'Neal misses. Rebound secured by Ben Barrett.

[06:21] Team_016 possession (Score: 49-47)
FOUL! Holding foul on Donovan Markkanen. [Team fouls: 3] No free throws, side out. (Donovan Markkanen: 1 personal fouls)

[06:12] Team_016 possession (Score: 49-47)
Vince Duncan attempts a Midrange. Contested by Klay Wade (5.4 feet, MAN). Vince Duncan misses. Rebound secured by Klay Wade.

[05:59] Team_039 possession (Score: 49-47)
Jrue Bridges attempts a 3Pt. Contested by Collin Barnes (5.4 feet, MAN). Jrue Bridges misses. Offensive rebound by Klay Wade! Klay Wade kicks it out.

[05:44] Team_039 possession (Score: 49-47)
Donovan Markkanen attempts a 3Pt. Wide open! Giannis Ginobili is 6.5 feet away. [MAN] DONOVAN MARKKANEN MAKES IT! Assist: Anfernee Carter
Score: 52-47

[05:28] Team_016 possession (Score: 52-47)
Vince Duncan drives, Klay Wade stays with him. Vince Duncan attempts a Layup. Contested by Klay Wade (5.5 feet, MAN). Vince Duncan misses. Rebound secured by Klay Wade.

[05:17] Team_039 possession (Score: 52-47)
Klay Wade makes the Layup and draws the foul on Vince Duncan! And-1! Klay Wade to the line for 1. [Team fouls: 3] (Vince Duncan: 2 personal fouls)   FT 1/1: GOOD Klay Wade makes 1/1 from the line.
Score: 55-47

[05:07] Team_016 possession (Score: 55-47)
Vince Duncan drives, picks up Klay Wade. Help arrives from Donovan Markkanen! Vince Duncan attempts a Layup. Contested by Donovan Markkanen (5.5 feet, MAN). VINCE DUNCAN MAKES IT!
Score: 55-49

[04:52] Team_039 possession (Score: 55-49)
Austin O'Neal attempts a Midrange. Contested by Vince Quickley (5.2 feet, ZONE). Austin O'Neal misses. Offensive rebound by Klay Wade! Klay Wade kicks it out.

[04:35] Team_039 possession (Score: 55-49)
Jrue Bridges attempts a 3Pt. Contested by Collin Barnes (5.6 feet, MAN). Jrue Bridges misses. Rebound secured by Vince Quickley.

[04:24] Team_016 possession (Score: 55-49)
Collin Barnes attempts a 3Pt. Contested by Austin O'Neal (5.5 feet, ZONE). COLLIN BARNES MAKES IT! Assist: Giannis Ginobili
Score: 55-52

[04:12] Team_039 possession (Score: 55-52)
Jrue Bridges drives to the basket... Jrue Bridges commits a violation (traveling/carry)! TURNOVER! (dead ball)

[04:12] Substitution (Team_039): Jrue Bridges OUT → Tracy Mitchell IN (stamina_rule2)

[04:12] Substitution (Team_039): Donovan Markkanen OUT → Jayson Cunningham IN (stamina_rule2)

[04:12] Substitution (Team_039): Austin O'Neal OUT → Yao Carter IN (stamina_rule2)

[04:12] Substitution (Team_039): Anfernee Carter OUT → Victor Gasol IN (stamina_rule2)

[04:12] Substitution (Team_039): Klay Wade OUT → Bam Booker IN (stamina_rule2)

[04:12] Substitution (Team_016): Collin Barnes OUT → Lamelo Herro IN (stamina_rule2)

[04:12] Substitution (Team_016): Giannis Ginobili OUT → Immanuel Nowitzki IN (stamina_rule2)

[04:12] Substitution (Team_016): Vince Quickley OUT → Kevin Butler IN (stamina_rule2)

[04:12] Substitution (Team_016): Ben Barrett OUT → Giannis Doncic IN (stamina_rule2)

[04:12] Substitution (Team_016): Vince Duncan OUT → Trae Barnes IN (stamina_rule2)

[03:57] Team_016 possession (Score: 55-52)
Immanuel Nowitzki attempts a 3Pt. Contested by Jayson Cunningham (5.7 feet, ZONE). Immanuel Nowitzki misses. Rebound secured by Victor Gasol.

[03:45] Team_039 possession (Score: 55-52)
FOUL! Shooting foul on Immanuel Nowitzki. Jayson Cunningham to the line for 3 free throws. [Team fouls: 4] (Immanuel Nowitzki: 1 personal fouls)   FT 1/3: MISS   FT 2/3: GOOD   FT 3/3: GOOD Jayson Cunningham makes 2/3 from the line.
Score: 57-52

[03:32] Team_016 possession (Score: 57-52)
Immanuel Nowitzki attempts a 3Pt. Contested by Jayson Cunningham (5.7 feet, MAN). Immanuel Nowitzki misses. Offensive rebound by Trae Barnes! Trae Barnes kicks it out.

[03:16] Team_016 possession (Score: 57-52)
Lamelo Herro drives to the basket... Lamelo Herro loses the ball! Stripped by Tracy Mitchell! TURNOVER! (live ball)

[03:04] Team_039 possession (Score: 57-52)
Victor Gasol attempts a Dunk. BLOCKED BY LAMELO HERRO! Ball is loose! Rebound secured by Trae Barnes.

[02:53] Team_016 possession (Score: 57-52)
Lamelo Herro attempts a 3Pt. Contested by Tracy Mitchell (5.6 feet, MAN). Lamelo Herro misses. Rebound secured by Yao Carter.

[02:40] Team_039 possession (Score: 57-52)
Victor Gasol throws a bad pass out of bounds! TURNOVER! (dead ball)

[02:21] Team_016 possession (Score: 57-52)
Trae Barnes throws a bad pass out of bounds! TURNOVER! (dead ball)

[02:10] Team_039 possession (Score: 57-52)
Victor Gasol attempts a Midrange. Contested by Trae Barnes (5.9 feet, ZONE). VICTOR GASOL MAKES IT!
Score: 59-52

[01:58] Team_016 possession (Score: 59-52)
Giannis Doncic makes the Layup and draws the foul on Victor Gasol! And-1! Giannis Doncic to the line for 1. [Team fouls: 4] (Victor Gasol: 1 personal fouls)   FT 1/1: GOOD Giannis Doncic makes 1/1 from the line.
Score: 59-55

[01:38] Team_039 possession (Score: 59-55)
Bam Booker drives, picks up Trae Barnes. Help arrives from Lamelo Herro! Bam Booker attempts a Layup. Contested by Lamelo Herro (6.0 feet, MAN). Bam Booker misses. Rebound secured by Giannis Doncic.

[01:20] Team_016 possession (Score: 59-55)
Trae Barnes attempts a 3Pt. Contested by Tracy Mitchell (5.4 feet, ZONE). TRAE BARNES MAKES IT! Assist: Lamelo Herro
Score: 59-58

[01:00] Team_039 possession (Score: 59-58)
Yao Carter attempts a 3Pt. Contested by Lamelo Herro (4.0 feet, ZONE). YAO CARTER MAKES IT! Assist: Victor Gasol
Score: 62-58

[00:49] Team_016 possession (Score: 62-58)
Trae Barnes attempts a Midrange. Contested by Tracy Mitchell (5.4 feet, ZONE). TRAE BARNES MAKES IT! Assist: Lamelo Herro
Score: 62-60

[00:33] Team_039 possession (Score: 62-60)
Yao Carter attempts a 3Pt. Contested by Lamelo Herro (4.0 feet, ZONE). Yao Carter misses. Rebound secured by Trae Barnes.

[00:18] Team_016 possession (Score: 62-60)
Lamelo Herro attempts a 3Pt. Contested by Tracy Mitchell (5.6 feet, MAN). Lamelo Herro misses. Rebound secured by Bam Booker.

[00:03] Team_039 possession (Score: 62-60)
Tracy Mitchell attempts a 3Pt. Contested by Lamelo Herro (4.3 feet, MAN). Tracy Mitchell misses. Rebound secured by Trae Barnes.

================================================================================
                              2ND QUARTER COMPLETE                              
================================================================================

2ND QUARTER SCORE: Team_039 31, Team_016 29

BOX SCORE:
================================================================================

Team_039
--------------------------------------------------------------------------------
Player                MIN  PTS  REB  AST  TO      FG   FG%      3P   3P%
--------------------------------------------------------------------------------
Klay Wade              20   10    5    1   0   4/4   100.0     0/0   0.0
Donovan Markkanen      20    8    1    0   0   3/5    60.0     0/0   0.0
Jrue Bridges           20    3    0    3   0   1/3    33.3     0/0   0.0
Anfernee Carter        20    3    0    1   0   1/1   100.0     0/0   0.0
Yao Carter              4    3    1    0   0   1/2    50.0     0/0   0.0
Victor Gasol            4    2    1    1   0   1/2    50.0     0/0   0.0
Jayson Cunningham       4    2    0    0   0   1/1   100.0     0/0   0.0
Austin O'Neal          20    0    4    0   0   0/1     0.0     0/0   0.0
Bam Booker              4    0    1    0   0   0/1     0.0     0/0   0.0
Tracy Mitchell          4    0    0    0   0   0/1     0.0     0/0   0.0

TEAM: FG: 12/21 (57.1%), 3PT: 3/8 (37.5%), REB: 13 (4 off, 9 def), AST: 6, TO: 2
TEAM FOULS: 4


Team_016
--------------------------------------------------------------------------------
Player                MIN  PTS  REB  AST  TO      FG   FG%      3P   3P%
--------------------------------------------------------------------------------
Vince Quickley         20    7    3    1   0   2/3    66.7     0/0   0.0
Collin Barnes          20    5    0    0   0   2/3    66.7     0/0   0.0
Trae Barnes             4    5    4    0   0   2/2   100.0     0/0   0.0
Giannis Ginobili       20    4    0    1   0   2/2   100.0     0/0   0.0
Ben Barrett            20    3    1    0   0   1/2    50.0     0/0   0.0
Giannis Doncic          4    3    1    0   0   1/1   100.0     0/0   0.0
Vince Duncan           17    2    1    0   0   1/4    25.0     0/0   0.0
Immanuel Nowitzki       4    0    0    0   0   0/1     0.0     0/0   0.0
Lamelo Herro            7    0    0    2   0   0/2     0.0     0/0   0.0

TEAM: FG: 11/20 (55.0%), 3PT: 4/10 (40.0%), REB: 10 (1 off, 9 def), AST: 4, TO: 2
TEAM FOULS: 4

================================================================================

================================================================================
                       3RD QUARTER - Team_039 vs Team_016                       
================================================================================

[12:00] Team_039 possession (Score: 62-60)
Jrue Bridges drives to the basket... Jrue Bridges throws a bad pass out of bounds! TURNOVER! (dead ball)

[11:50] Team_016 possession (Score: 62-60)
Collin Barnes drives to the basket... Collin Barnes throws a bad pass! Stolen by Jrue Bridges! TURNOVER! (live ball)

[11:38] Team_039 possession (Score: 62-60)
FOUL! Reach-in foul on Ben Barrett during the drive. [Team fouls: 1] No free throws, side out. (Ben Barrett: 1 personal fouls)

[11:27] Team_039 possession (Score: 62-60)
Donovan Markkanen drives, Vince Duncan stays with him. Donovan Markkanen attempts a Layup. Contested by Vince Duncan (3.4 feet, ZONE). Donovan Markkanen misses. Rebound secured by Ben Barrett.

[11:16] Team_016 possession (Score: 62-60)
Vince Duncan attempts a Layup. Contested by Klay Wade (4.3 feet, ZONE). VINCE DUNCAN MAKES IT! Assist: Ben Barrett
Score: 62-62

[10:58] Team_039 possession (Score: 62-62)
Austin O'Neal makes the Midrange and draws the foul on Giannis Ginobili! And-1! Austin O'Neal to the line for 1. [Team fouls: 2] (Giannis Ginobili: 1 personal fouls)   FT 1/1: GOOD Austin O'Neal makes 1/1 from the line.
Score: 65-62

[10:49] Team_016 possession (Score: 65-62)
FOUL! Reach-in foul on Klay Wade during the drive. [Team fouls: 1] No free throws, side out. (Klay Wade: 1 personal fouls)

[10:31] Team_016 possession (Score: 65-62)
Ben Barrett attempts a Midrange. Contested by Klay Wade (4.5 feet, ZONE). Ben Barrett misses. Rebound secured by Donovan Markkanen.

[10:14] Team_039 possession (Score: 65-62)
Anfernee Carter drives, Ben Barrett stays with him. Anfernee Carter attempts a Dunk. Contested by Ben Barrett (3.9 feet, MAN). Anfernee Carter misses. Rebound secured by Ben Barrett.

[10:00] Team_016 possession (Score: 65-62)
Ben Barrett attempts a Midrange. Contested by Klay Wade (4.5 feet, MAN). Ben Barrett misses. Rebound secured by Klay Wade.

[09:48] Team_039 possession (Score: 65-62)
Donovan Markkanen attempts a 3Pt. Contested by Giannis Ginobili (5.9 feet, MAN). Donovan Markkanen misses. Rebound secured by Vince Duncan.

[09:32] Team_016 possession (Score: 65-62)
Vince Duncan drives and kicks out. Collin Barnes attempts a 3Pt. Contested by Jrue Bridges (3.1 feet, MAN). Collin Barnes misses. Rebound secured by Klay Wade.

[09:19] Team_039 possession (Score: 65-62)
Jrue Bridges attempts a 3Pt. Contested by Collin Barnes (4.2 feet, MAN). Jrue Bridges misses. Rebound secured by Vince Duncan.

[09:04] Team_016 possession (Score: 65-62)
Ben Barrett attempts a 3Pt. Contested by Klay Wade (4.5 feet, MAN). BEN BARRETT MAKES IT! Assist: Vince Duncan
Score: 65-65

[08:47] Team_039 possession (Score: 65-65)
Austin O'Neal attempts a 3Pt. Contested by Collin Barnes (4.1 feet, ZONE). Austin O'Neal misses. Offensive rebound by Klay Wade! Klay Wade kicks it out.

[08:33] Team_039 possession (Score: 65-65)
Jrue Bridges throws a bad pass out of bounds! TURNOVER! (dead ball)

[08:19] Team_016 possession (Score: 65-65)
Giannis Ginobili throws a bad pass! Stolen by Donovan Markkanen! TURNOVER! (live ball)

[08:06] Team_039 possession (Score: 65-65)
Austin O'Neal attempts a 3Pt. Contested by Collin Barnes (4.1 feet, ZONE). AUSTIN O'NEAL MAKES IT! Assist: Jrue Bridges
Score: 68-65

[07:50] Team_016 possession (Score: 68-65)
Giannis Ginobili drives and kicks out. Vince Quickley attempts a 3Pt. Contested by Jrue Bridges (3.1 feet, ZONE). Vince Quickley misses. Rebound secured by Donovan Markkanen.

[07:33] Team_039 possession (Score: 68-65)
Klay Wade drives, picks up Vince Duncan. Help arrives from Collin Barnes! Klay Wade attempts a Dunk. Contested by Collin Barnes (3.7 feet, ZONE). KLAY WADE MAKES IT! Assist: Donovan Markkanen
Score: 70-65

[07:20] Team_016 possession (Score: 70-65)
Vince Duncan attempts a Layup. Wide open! Anfernee Carter is 7.0 feet away. [ZONE] VINCE DUNCAN MAKES IT! Assist: Collin Barnes
Score: 70-67

[07:07] Team_039 possession (Score: 70-67)
Jrue Bridges attempts a 3Pt. Contested by Collin Barnes (4.2 feet, MAN). JRUE BRIDGES MAKES IT! Assist: Klay Wade
Score: 73-67

[06:49] Team_016 possession (Score: 73-67)
Collin Barnes attempts a Midrange. Contested by Jrue Bridges (3.1 feet, MAN). COLLIN BARNES MAKES IT! Assist: Ben Barrett
Score: 73-69

[06:38] Team_039 possession (Score: 73-69)
Klay Wade makes the Layup and draws the foul on Ben Barrett! And-1! Klay Wade to the line for 1. [Team fouls: 3] (Ben Barrett: 2 personal fouls)   FT 1/1: MISS Klay Wade makes 0/1 from the line. Rebound secured by Ben Barrett.
Score: 75-69

[06:24] Team_016 possession (Score: 75-69)
Giannis Ginobili attempts a 3Pt. Contested by Jrue Bridges (3.2 feet, ZONE). GIANNIS GINOBILI MAKES IT!
Score: 75-72

[06:09] Team_039 possession (Score: 75-72)
Jrue Bridges attempts a 3Pt. Contested by Collin Barnes (4.2 feet, ZONE). JRUE BRIDGES MAKES IT! Assist: Anfernee Carter
Score: 78-72

[05:57] Team_016 possession (Score: 78-72)
Collin Barnes drives and kicks out. Collin Barnes attempts a Midrange. Contested by Jrue Bridges (3.1 feet, MAN). Collin Barnes misses. Offensive rebound by Vince Duncan! Vince Duncan puts it back in!
Score: 78-74

[05:46] Team_039 possession (Score: 78-74)
FOUL! Reach-in foul on Vince Duncan during the drive. [Team fouls: 4] No free throws, side out. (Vince Duncan: 1 personal fouls)

[05:31] Team_039 possession (Score: 78-74)
Klay Wade drives, picks up Vince Duncan. Help arrives from Collin Barnes! Klay Wade attempts a Layup. Contested by Collin Barnes (3.7 feet, ZONE). Klay Wade misses. Rebound secured by Ben Barrett.

[05:20] Team_016 possession (Score: 78-74)
Giannis Ginobili makes the Midrange and draws the foul on Austin O'Neal! And-1! Giannis Ginobili to the line for 1. [Team fouls: 2] (Austin O'Neal: 1 personal fouls)   FT 1/1: GOOD Giannis Ginobili makes 1/1 from the line.
Score: 78-77

[05:07] Team_039 possession (Score: 78-77)
Jrue Bridges attempts a 3Pt. Contested by Giannis Ginobili (5.8 feet, ZONE). Jrue Bridges misses. Rebound secured by Ben Barrett.

[04:54] Team_016 possession (Score: 78-77)
Ben Barrett attempts a Midrange. Contested by Donovan Markkanen (4.3 feet, ZONE). BEN BARRETT MAKES IT! Assist: Collin Barnes
Score: 78-79

[04:41] Team_039 possession (Score: 78-79)
Donovan Markkanen drives, Vince Duncan stays with him. Donovan Markkanen attempts a Dunk. Contested by Vince Duncan (3.5 feet, ZONE). DONOVAN MARKKANEN MAKES IT!
Score: 80-79

[04:26] Team_016 possession (Score: 80-79)
Collin Barnes makes the Layup and draws the foul on Jrue Bridges! And-1! Collin Barnes to the line for 1. [Team fouls: 3] (Jrue Bridges: 1 personal fouls)   FT 1/1: GOOD Collin Barnes makes 1/1 from the line.
Score: 80-82

[04:12] Team_039 possession (Score: 80-82)
Klay Wade makes the Layup and draws the foul on Vince Duncan! And-1! Klay Wade to the line for 1. [BONUS: 5 team fouls] (Vince Duncan: 2 personal fouls)   FT 1/1: GOOD Klay Wade makes 1/1 from the line.
Score: 83-82

[04:03] Team_016 possession (Score: 83-82)
Collin Barnes attempts a 3Pt. Wide open! Anfernee Carter is 6.8 feet away. [ZONE] COLLIN BARNES MAKES IT! Assist: Ben Barrett
Score: 83-85

[03:45] Team_039 possession (Score: 83-85)
Anfernee Carter attempts a 3Pt. Contested by Ben Barrett (4.0 feet, MAN). Anfernee Carter misses. Rebound secured by Vince Quickley.

[03:31] Team_016 possession (Score: 83-85)
Collin Barnes attempts a Midrange. Contested by Jrue Bridges (3.3 feet, MAN). Collin Barnes misses. Rebound secured by Austin O'Neal.

[03:16] Team_039 possession (Score: 83-85)
Anfernee Carter attempts a Midrange. Contested by Ben Barrett (4.1 feet, ZONE). Anfernee Carter misses. Offensive rebound by Klay Wade! Klay Wade kicks it out.

[02:58] Team_039 possession (Score: 83-85)
Austin O'Neal attempts a Midrange. Contested by Giannis Ginobili (5.8 feet, ZONE). AUSTIN O'NEAL MAKES IT!
Score: 85-85

[02:46] Team_016 possession (Score: 85-85)
Vince Quickley drives, Anfernee Carter stays with him. Vince Quickley attempts a Layup. Wide open! Anfernee Carter is 6.4 feet away. [ZONE] VINCE QUICKLEY MAKES IT! Assist: Giannis Ginobili
Score: 85-87

[02:31] Team_039 possession (Score: 85-87)
Klay Wade attempts a Midrange. Contested by Vince Duncan (4.0 feet, MAN). Klay Wade misses. Rebound secured by Vince Duncan.

[02:19] Team_016 possession (Score: 85-87)
Collin Barnes attempts a Midrange. Contested by Austin O'Neal (4.3 feet, ZONE). Collin Barnes misses. Offensive rebound by Ben Barrett! Ben Barrett puts it back in!
Score: 85-89

[02:05] Team_039 possession (Score: 85-89)
FOUL! Holding foul on Collin Barnes. [IN THE BONUS! 6 team fouls] Jrue Bridges to the line for 2 free throws. (Collin Barnes: 1 personal fouls)   FT 1/2: MISS   FT 2/2: GOOD Jrue Bridges makes 1/2 from the line.
Score: 86-89

[01:51] Team_016 possession (Score: 86-89)
Vince Duncan makes the Layup and draws the foul on Klay Wade! And-1! Vince Duncan to the line for 1. [Team fouls: 4] (Klay Wade: 2 personal fouls)   FT 1/1: GOOD Vince Duncan makes 1/1 from the line.
Score: 86-92

[01:35] Team_039 possession (Score: 86-92)
Austin O'Neal attempts a 3Pt. Contested by Vince Quickley (4.6 feet, MAN). AUSTIN O'NEAL MAKES IT! Assist: Klay Wade
Score: 89-92

[01:21] Team_016 possession (Score: 89-92)
Ben Barrett attempts a Midrange. Contested by Klay Wade (4.9 feet, MAN). Ben Barrett misses. Rebound secured by Klay Wade.

[01:08] Team_039 possession (Score: 89-92)
Klay Wade loses control! Ball rolls out of bounds! TURNOVER! (dead ball)

[01:08] Substitution (Team_039): Jrue Bridges OUT → Tracy Mitchell IN (stamina_rule2)

[01:08] Substitution (Team_039): Donovan Markkanen OUT → Jayson Cunningham IN (stamina_rule2)

[01:08] Substitution (Team_039): Austin O'Neal OUT → Yao Carter IN (stamina_rule2)

[01:08] Substitution (Team_039): Anfernee Carter OUT → Victor Gasol IN (stamina_rule2)

[01:08] Substitution (Team_039): Klay Wade OUT → Bam Booker IN (stamina_rule2)

[01:08] Substitution (Team_016): Collin Barnes OUT → Lamelo Herro IN (stamina_rule2)

[01:08] Substitution (Team_016): Giannis Ginobili OUT → Immanuel Nowitzki IN (stamina_rule2)

[01:08] Substitution (Team_016): Vince Quickley OUT → Kevin Butler IN (stamina_rule2)

[01:08] Substitution (Team_016): Ben Barrett OUT → Giannis Doncic IN (stamina_rule2)

[01:08] Substitution (Team_016): Vince Duncan OUT → Trae Barnes IN (stamina_rule2)

[00:52] Team_016 possession (Score: 89-92)
FOUL! Holding foul on Yao Carter. [IN THE BONUS! 5 team fouls] Kevin Butler to the line for 2 free throws. (Yao Carter: 1 personal fouls)   FT 1/2: GOOD   FT 2/2: MISS Kevin Butler makes 1/2 from the line. Rebound secured by Yao Carter.
Score: 89-93

[00:40] Team_039 possession (Score: 89-93)
Tracy Mitchell drives, Lamelo Herro stays with him. Tracy Mitchell attempts a Layup. Contested by Lamelo Herro (4.3 feet, MAN). TRACY MITCHELL MAKES IT!
Score: 91-93

[00:30] Team_016 possession (Score: 91-93)
Giannis Doncic drives, picks up Bam Booker. Help arrives from Tracy Mitchell! Giannis Doncic attempts a Layup. Contested by Tracy Mitchell (4.6 feet, ZONE). GIANNIS DONCIC MAKES IT! Assist: Trae Barnes
Score: 91-95

[00:15] Team_039 possession (Score: 91-95)
Tracy Mitchell attempts a Midrange. Contested by Lamelo Herro (4.3 feet, MAN). Tracy Mitchell misses. Rebound secured by Giannis Doncic.

[00:01] Team_016 possession (Score: 91-95)
Immanuel Nowitzki drives and kicks out. Trae Barnes attempts a 3Pt. Contested by Bam Booker (4.6 feet, MAN). Trae Barnes misses. Offensive rebound by Giannis Doncic! Giannis Doncic kicks it out.

================================================================================
                              3RD QUARTER COMPLETE                              
================================================================================

3RD QUARTER SCORE: Team_039 29, Team_016 35

BOX SCORE:
================================================================================

Team_039
--------------------------------------------------------------------------------
Player                MIN  PTS  REB  AST  TO      FG   FG%      3P   3P%
--------------------------------------------------------------------------------
Austin O'Neal          31   11    1    0   0   4/4   100.0     0/0   0.0
Jrue Bridges           31    7    0    1   0   3/5    60.0     0/0   0.0
Klay Wade              31    5    5    2   0   2/5    40.0     0/0   0.0
Donovan Markkanen      31    2    2    1   0   1/3    33.3     0/0   0.0
Tracy Mitchell          5    2    0    0   0   1/2    50.0     0/0   0.0
Anfernee Carter        31    0    0    1   0   0/2     0.0     0/0   0.0
Yao Carter              5    0    1    0   0   0/0     0.0     0/0   0.0

TEAM: FG: 11/21 (52.4%), 3PT: 4/8 (50.0%), REB: 9 (2 off, 7 def), AST: 5, TO: 3
TEAM FOULS: 5 [Team_016 in BONUS]


Team_016
--------------------------------------------------------------------------------
Player                MIN  PTS  REB  AST  TO      FG   FG%      3P   3P%
--------------------------------------------------------------------------------
Vince Duncan           28    9    4    1   0   4/5    80.0     0/0   0.0
Collin Barnes          31    8    0    2   0   3/4    75.0     0/0   0.0
Ben Barrett            31    7    6    3   0   3/6    50.0     0/0   0.0
Giannis Ginobili       31    6    0    1   0   2/3    66.7     0/0   0.0
Vince Quickley         31    2    1    0   0   1/1   100.0     0/0   0.0
Giannis Doncic          5    2    2    0   0   1/1   100.0     0/0   0.0
Trae Barnes             5    0    0    1   0   0/0     0.0     0/0   0.0

TEAM: FG: 14/21 (66.7%), 3PT: 3/3 (100.0%), REB: 13 (3 off, 10 def), AST: 8, TO: 2
TEAM FOULS: 6 [Team_039 in BONUS]

================================================================================

================================================================================
                       4TH QUARTER - Team_039 vs Team_016                       
================================================================================

[12:00] Team_039 possession (Score: 91-95)
Donovan Markkanen makes the Midrange and draws the foul on Ben Barrett! And-1! Donovan Markkanen to the line for 1. [Team fouls: 1] (Ben Barrett: 1 personal fouls)   FT 1/1: GOOD Donovan Markkanen makes 1/1 from the line.
Score: 94-95

[11:45] Team_016 possession (Score: 94-95)
Vince Quickley attempts a 3Pt. Contested by Austin O'Neal (3.7 feet, MAN). Vince Quickley misses. Offensive rebound by Vince Duncan! Vince Duncan kicks it out.

[11:28] Team_016 possession (Score: 94-95)
Vince Quickley drives and kicks out. Ben Barrett attempts a Midrange. Contested by Klay Wade (4.2 feet, MAN). BEN BARRETT MAKES IT!
Score: 94-97

[11:17] Team_039 possession (Score: 94-97)
FOUL! Reach-in foul on Ben Barrett during the drive. [Team fouls: 2] No free throws, side out. (Ben Barrett: 2 personal fouls)

[11:06] Team_039 possession (Score: 94-97)
Jrue Bridges attempts a Midrange. Contested by Collin Barnes (4.5 feet, MAN). Jrue Bridges misses. Offensive rebound by Klay Wade! Klay Wade kicks it out.

[10:54] Team_039 possession (Score: 94-97)
Klay Wade drives and kicks out. Austin O'Neal attempts a 3Pt. Contested by Collin Barnes (4.4 feet, ZONE). Austin O'Neal misses. Rebound secured by Ben Barrett.

[10:44] Team_016 possession (Score: 94-97)
Collin Barnes attempts a 3Pt. Contested by Jrue Bridges (3.5 feet, MAN). Collin Barnes misses. Rebound secured by Austin O'Neal.

[10:33] Team_039 possession (Score: 94-97)
Klay Wade drives to the basket... Klay Wade throws a bad pass out of bounds! TURNOVER! (dead ball)

[10:33] Substitution (Team_039): Jrue Bridges OUT → Tracy Mitchell IN (stamina_rule2)

[10:33] Substitution (Team_039): Donovan Markkanen OUT → Jayson Cunningham IN (stamina_rule2)

[10:33] Substitution (Team_039): Austin O'Neal OUT → Yao Carter IN (stamina_rule2)

[10:33] Substitution (Team_039): Anfernee Carter OUT → Victor Gasol IN (stamina_rule2)

[10:33] Substitution (Team_039): Klay Wade OUT → Bam Booker IN (stamina_rule2)

[10:33] Substitution (Team_016): Collin Barnes OUT → Lamelo Herro IN (stamina_rule2)

[10:33] Substitution (Team_016): Giannis Ginobili OUT → Immanuel Nowitzki IN (stamina_rule2)

[10:33] Substitution (Team_016): Ben Barrett OUT → Giannis Doncic IN (stamina_rule2)

[10:33] Substitution (Team_016): Vince Duncan OUT → Trae Barnes IN (stamina_rule2)

[10:16] Team_016 possession (Score: 94-97)
Lamelo Herro attempts a Midrange. Contested by Tracy Mitchell (5.6 feet, MAN). LAMELO HERRO MAKES IT! Assist: Giannis Doncic
Score: 94-99

[10:02] Team_039 possession (Score: 94-99)
FOUL! Shooting foul on Giannis Doncic. Victor Gasol to the line for 2 free throws. [Team fouls: 3] (Giannis Doncic: 1 personal fouls)   FT 1/2: GOOD   FT 2/2: GOOD Victor Gasol makes 2/2 from the line.
Score: 96-99

[09:49] Team_016 possession (Score: 96-99)
Giannis Doncic attempts a Midrange. Contested by Victor Gasol (3.3 feet, MAN). Giannis Doncic misses. Rebound secured by Bam Booker.

[09:32] Team_039 possession (Score: 96-99)
Jayson Cunningham attempts a Layup. Contested by Giannis Doncic (4.0 feet, ZONE). JAYSON CUNNINGHAM MAKES IT!
Score: 98-99

[09:17] Team_016 possession (Score: 98-99)
Vince Quickley attempts a Layup. Contested by Bam Booker (4.2 feet, ZONE). Vince Quickley misses. Rebound secured by Bam Booker.

[08:59] Team_039 possession (Score: 98-99)
Tracy Mitchell attempts a 3Pt. Contested by Lamelo Herro (4.3 feet, MAN). Tracy Mitchell misses. Rebound secured by Lamelo Herro.

[08:48] Team_016 possession (Score: 98-99)
Immanuel Nowitzki attempts a 3Pt. Contested by Victor Gasol (3.4 feet, ZONE). Immanuel Nowitzki misses. Rebound secured by Bam Booker.

[08:34] Team_039 possession (Score: 98-99)
Bam Booker drives, Trae Barnes stays with him. Bam Booker attempts a Layup. Contested by Trae Barnes (6.0 feet, MAN). BAM BOOKER MAKES IT! Assist: Tracy Mitchell
Score: 100-99

[08:21] Team_016 possession (Score: 100-99)
Immanuel Nowitzki makes the Layup and draws the foul on Victor Gasol! And-1! Immanuel Nowitzki to the line for 1. [Team fouls: 1] (Victor Gasol: 1 personal fouls)   FT 1/1: GOOD Immanuel Nowitzki makes 1/1 from the line.
Score: 100-102

[08:04] Team_039 possession (Score: 100-102)
Jayson Cunningham drives and kicks out. Tracy Mitchell attempts a 3Pt. Contested by Lamelo Herro (3.8 feet, ZONE). Tracy Mitchell misses. Rebound secured by Trae Barnes.

[07:48] Team_016 possession (Score: 100-102)
Vince Quickley makes the Dunk and draws the foul on Yao Carter! And-1! Vince Quickley to the line for 1. [Team fouls: 2] (Yao Carter: 1 personal fouls)   FT 1/1: GOOD Vince Quickley makes 1/1 from the line.
Score: 100-105

[07:37] Team_039 possession (Score: 100-105)
Jayson Cunningham attempts a 3Pt. Contested by Lamelo Herro (4.0 feet, ZONE). Jayson Cunningham misses. Rebound secured by Giannis Doncic.

[07:19] Team_016 possession (Score: 100-105)
Vince Quickley drives and kicks out. Vince Quickley attempts a Midrange. Contested by Yao Carter (4.1 feet, MAN). Vince Quickley misses. Offensive rebound by Trae Barnes! Trae Barnes kicks it out.

[07:05] Team_016 possession (Score: 100-105)
FOUL! Shooting foul on Victor Gasol. Giannis Doncic to the line for 2 free throws. [Team fouls: 3] (Victor Gasol: 2 personal fouls)   FT 1/2: GOOD   FT 2/2: GOOD Giannis Doncic makes 2/2 from the line.
Score: 100-107

[06:51] Team_039 possession (Score: 100-107)
Jayson Cunningham attempts a Midrange. Contested by Immanuel Nowitzki (4.8 feet, MAN). JAYSON CUNNINGHAM MAKES IT! Assist: Tracy Mitchell
Score: 102-107

[06:41] Team_016 possession (Score: 102-107)
Giannis Doncic attempts a Midrange. Contested by Victor Gasol (3.3 feet, ZONE). Giannis Doncic misses. Offensive rebound by Trae Barnes! Trae Barnes kicks it out.

[06:25] Team_016 possession (Score: 102-107)
FOUL! Offensive foul on Vince Quickley! Yao Carter drew the charge! [Team fouls: 4] (Vince Quickley: 1 personal fouls) TURNOVER! (dead ball)

[06:11] Team_039 possession (Score: 102-107)
Jayson Cunningham attempts a 3Pt. Contested by Immanuel Nowitzki (4.8 feet, MAN). JAYSON CUNNINGHAM MAKES IT! Assist: Bam Booker
Score: 105-107

[05:58] Team_016 possession (Score: 105-107)
Giannis Doncic attempts a Layup. Contested by Victor Gasol (3.3 feet, ZONE). Giannis Doncic misses. Rebound secured by Bam Booker.

[05:47] Team_039 possession (Score: 105-107)
Yao Carter drives to the basket... Yao Carter throws a bad pass out of bounds! TURNOVER! (dead ball)

[05:47] Substitution (Team_016): Vince Quickley OUT → Kevin Butler IN (stamina_rule2)

[05:33] Team_016 possession (Score: 105-107)
Trae Barnes drives and kicks out. Kevin Butler attempts a Midrange. Contested by Yao Carter (4.1 feet, MAN). Kevin Butler misses. Rebound secured by Yao Carter.

[05:22] Team_039 possession (Score: 105-107)
FOUL! Holding foul on Immanuel Nowitzki. [IN THE BONUS! 5 team fouls] Jayson Cunningham to the line for 2 free throws. (Immanuel Nowitzki: 1 personal fouls)   FT 1/2: GOOD   FT 2/2: GOOD Jayson Cunningham makes 2/2 from the line.
Score: 107-107

[05:10] Team_016 possession (Score: 107-107)
Immanuel Nowitzki attempts a Layup. Contested by Victor Gasol (3.4 feet, ZONE). Immanuel Nowitzki misses. Rebound secured by Victor Gasol.

[04:57] Team_039 possession (Score: 107-107)
Jayson Cunningham attempts a 3Pt. Contested by Kevin Butler (4.6 feet, ZONE). Jayson Cunningham misses. Rebound secured by Trae Barnes.

[04:44] Team_016 possession (Score: 107-107)
Giannis Doncic attempts a 3Pt. Contested by Tracy Mitchell (5.6 feet, ZONE). GIANNIS DONCIC MAKES IT! Assist: Trae Barnes
Score: 107-110

[04:29] Team_039 possession (Score: 107-110)
Yao Carter attempts a 3Pt. Contested by Giannis Doncic (3.9 feet, ZONE). YAO CARTER MAKES IT! Assist: Victor Gasol
Score: 110-110

[04:14] Team_016 possession (Score: 110-110)
Kevin Butler throws a bad pass out of bounds! TURNOVER! (dead ball)

[04:00] Team_039 possession (Score: 110-110)
Tracy Mitchell attempts a 3Pt. Contested by Lamelo Herro (4.4 feet, ZONE). Tracy Mitchell misses. Offensive rebound by Yao Carter! Yao Carter kicks it out.

[03:45] Team_039 possession (Score: 110-110)
Bam Booker loses control! Ball rolls out of bounds! TURNOVER! (dead ball)

[03:28] Team_016 possession (Score: 110-110)
Giannis Doncic attempts a 3Pt. Contested by Victor Gasol (3.4 feet, MAN). Giannis Doncic misses. Rebound secured by Yao Carter.

[03:12] Team_039 possession (Score: 110-110)
Bam Booker commits a violation (traveling/carry)! TURNOVER! (dead ball)

[03:00] Team_016 possession (Score: 110-110)
Trae Barnes drives and kicks out. Giannis Doncic attempts a 3Pt. Contested by Victor Gasol (3.5 feet, MAN). Giannis Doncic misses. Rebound secured by Victor Gasol.

[02:47] Team_039 possession (Score: 110-110)
FOUL! Reach-in foul on Trae Barnes during the drive. [IN THE BONUS! 6 team fouls] Bam Booker to the line for 2 free throws. (Trae Barnes: 1 personal fouls)   FT 1/2: MISS   FT 2/2: MISS Bam Booker makes 0/2 from the line. Rebound secured by Giannis Doncic.

[02:32] Team_016 possession (Score: 110-110)
Lamelo Herro attempts a 3Pt. Contested by Tracy Mitchell (5.7 feet, ZONE). Lamelo Herro misses. Rebound secured by Bam Booker.

[02:19] Team_039 possession (Score: 110-110)
Bam Booker attempts a Layup. Contested by Giannis Doncic (4.2 feet, ZONE). Bam Booker misses. Rebound secured by Giannis Doncic.

[02:03] Team_016 possession (Score: 110-110)
Trae Barnes drives to the basket... Trae Barnes commits a violation (traveling/carry)! TURNOVER! (dead ball)

[01:46] Team_039 possession (Score: 110-110)
Yao Carter attempts a 3Pt. Contested by Lamelo Herro (4.2 feet, ZONE). Yao Carter misses. Rebound secured by Lamelo Herro.

[01:29] Team_016 possession (Score: 110-110)
Lamelo Herro drives and kicks out. Lamelo Herro attempts a 3Pt. Contested by Tracy Mitchell (5.9 feet, MAN). Lamelo Herro misses. Rebound secured by Bam Booker.

[01:12] Team_039 possession (Score: 110-110)
Jayson Cunningham drives to the basket... FOUL! Offensive foul on Jayson Cunningham! Giannis Doncic drew the charge! [Team fouls: 4] (Jayson Cunningham: 1 personal fouls) TURNOVER! (dead ball)

[00:56] Team_016 possession (Score: 110-110)
Trae Barnes attempts a 3Pt. Contested by Tracy Mitchell (5.7 feet, ZONE). Trae Barnes misses. Rebound secured by Bam Booker.

[00:42] Team_039 possession (Score: 110-110)
Tracy Mitchell attempts a 3Pt. Contested by Lamelo Herro (4.6 feet, MAN). Tracy Mitchell misses. Offensive rebound by Yao Carter! Yao Carter kicks it out.

[00:26] Team_039 possession (Score: 110-110)
Victor Gasol drives and kicks out. Jayson Cunningham attempts a Midrange. Contested by Immanuel Nowitzki (5.1 feet, MAN). Jayson Cunningham misses. Rebound secured by Giannis Doncic.

[00:08] Team_016 possession (Score: 110-110)
FOUL! Reach-in foul on Victor Gasol during the drive. [IN THE BONUS! 5 team fouls] Lamelo Herro to the line for 2 free throws. (Victor Gasol: 3 personal fouls)   FT 1/2: MISS   FT 2/2: GOOD Lamelo Herro makes 1/2 from the line.
Score: 110-111

================================================================================
                              4TH QUARTER COMPLETE                              
================================================================================

4TH QUARTER SCORE: Team_039 19, Team_016 16

BOX SCORE:
================================================================================

Team_039
--------------------------------------------------------------------------------
Player                MIN  PTS  REB  AST  TO      FG   FG%      3P   3P%
--------------------------------------------------------------------------------
Jayson Cunningham      16    9    0    0   0   4/7    57.1     0/0   0.0
Donovan Markkanen      33    3    0    0   0   1/1   100.0     0/0   0.0
Yao Carter             16    3    4    0   0   1/2    50.0     0/0   0.0
Victor Gasol           16    2    2    1   0   1/2    50.0     0/0   0.0
Bam Booker             16    2    7    1   0   1/3    33.3     0/0   0.0
Klay Wade              33    0    1    0   0   0/1     0.0     0/0   0.0
Austin O'Neal          33    0    1    0   0   0/0     0.0     0/0   0.0
Tracy Mitchell         16    0    0    2   0   0/1     0.0     0/0   0.0

TEAM: FG: 8/17 (47.1%), 3PT: 2/6 (33.3%), REB: 15 (3 off, 12 def), AST: 4, TO: 5
TEAM FOULS: 5 [Team_016 in BONUS]


Team_016
--------------------------------------------------------------------------------
Player                MIN  PTS  REB  AST  TO      FG   FG%      3P   3P%
--------------------------------------------------------------------------------
Giannis Doncic         16    5    4    1   0   2/5    40.0     0/0   0.0
Lamelo Herro           19    3    2    0   0   2/4    50.0     0/0   0.0
Vince Quickley         38    3    0    0   0   1/2    50.0     0/0   0.0
Immanuel Nowitzki      16    3    0    0   0   1/3    33.3     0/0   0.0
Ben Barrett            33    2    1    0   0   1/1   100.0     0/0   0.0
Vince Duncan           30    0    1    0   0   0/0     0.0     0/0   0.0
Collin Barnes          33    0    0    0   0   0/1     0.0     0/0   0.0
Trae Barnes            16    0    4    1   0   0/3     0.0     0/0   0.0

TEAM: FG: 7/19 (36.8%), 3PT: 1/6 (16.7%), REB: 12 (3 off, 9 def), AST: 2, TO: 3
TEAM FOULS: 6 [Team_039 in BONUS]

================================================================================

================================================================================
                               FULL GAME COMPLETE                               
================================================================================

FINAL SCORE: Team_039 110, Team_016 111

SCORING BY QUARTER:
--------------------------------------------------------------------------------
Team                     Q1     Q2     Q3     Q4    FINAL
--------------------------------------------------------------------------------
Team_039                 31     31     29     19      110
Team_016                 31     29     35     16      111
--------------------------------------------------------------------------------

FULL GAME BOX SCORE:
================================================================================

Team_039
--------------------------------------------------------------------------------
Player                MIN  PTS  REB  AST  TO      FG   FG%      3P   3P%      FT STL BLK
--------------------------------------------------------------------------------
Jrue Bridges           33   10    0    4   2   3/9    33.3   2/7    28.6   1/3     2   0
Donovan Markkanen      33   18    7    2   0   7/13   53.8   2/5    40.0   1/2     1   0
Austin O'Neal          33   17   10    1   1   6/8    75.0   3/5    60.0   2/2     0   0
Anfernee Carter        33    7    0    2   1   3/6    50.0   0/1     0.0   3/3     0   0
Klay Wade              33   26   14    5   5  10/16   62.5   0/1     0.0   9/11    0   0
Tracy Mitchell         16    2    0    2   0   1/4    25.0   0/2     0.0   0/0     1   0
Jayson Cunningham      16   11    0    0   0   4/7    57.1   2/4    50.0   4/5     0   0
Yao Carter             16    6    6    0   1   2/4    50.0   2/4    50.0   0/0     0   0
Victor Gasol           16    4    3    2   2   2/4    50.0   0/0     0.0   2/2     0   0
Bam Booker             16    2    8    1   2   1/4    25.0   0/0     0.0   0/2     0   0

TEAM: FG: 41/77 (53.2%), 3PT: 11/29 (37.9%), REB: 47 (12 off, 35 def), AST: 19, TO: 14


Team_016
--------------------------------------------------------------------------------
Player                MIN  PTS  REB  AST  TO      FG   FG%      3P   3P%      FT STL BLK
--------------------------------------------------------------------------------
Vince Quickley         38   14    7    4   1   7/11   63.6   3/6    50.0   2/2     0   0
Collin Barnes          33   18    0    2   1   9/15   60.0   2/6    33.3   2/2     0   1
Giannis Ginobili       33   12    0    2   1   5/6    83.3   1/1   100.0   1/2     0   0
Ben Barrett            33   24   12    3   0   7/12   58.3   2/3    66.7   2/2     0   0
Vince Duncan           30   19    7    2   0   7/13   53.8   1/1   100.0   2/2     0   1
Lamelo Herro           19    3    3    4   2   2/6    33.3   0/3     0.0   1/2     0   1
Immanuel Nowitzki      16    3    0    0   0   1/4    25.0   0/2     0.0   1/1     0   0
Giannis Doncic         16   10    7    1   0   4/7    57.1   1/2    50.0   3/3     0   0
Trae Barnes            16    5    8    2   2   2/5    40.0   1/2    50.0   0/0     0   0
Kevin Butler           11    0    0    0   1   0/0     0.0   0/0     0.0   1/2     0   0

TEAM: FG: 44/80 (55.0%), 3PT: 11/26 (42.3%), REB: 45 (10 off, 35 def), AST: 20, TO: 8

================================================================================
