================================================================================
                        FULL GAME - Team_020 vs Team_095                        
================================================================================

================================================================================
                       1ST QUARTER - Team_020 vs Team_095                       
================================================================================

[12:00] Team_020 possession (Score: 0-0)
James Cunningham attempts a Midrange. Contested by Shaquille Ball (4.7 feet, MAN). James Cunningham misses. Rebound secured by Shaquille Ball.

[11:40] Team_095 possession (Score: 0-0)
FOUL! Reach-in foul on Trae Curry during the drive. [Team fouls: 1] No free throws, side out. (Trae Curry: 1 personal fouls)

[11:25] Team_095 possession (Score: 0-0)
Immanuel Middleton drives and kicks out. Evan Carter attempts a 3Pt. Contested by Bam Leonard (2.3 feet, ZONE). Evan Carter misses. Rebound secured by Terry Simons.

[11:11] Team_020 possession (Score: 0-0)
Trae Curry attempts a Midrange. Contested by Kyrie Ming (5.5 feet, MAN). Trae Curry misses. Offensive rebound by Trae Curry! Trae Curry puts it back in!
Score: 2-0

[10:56] Team_095 possession (Score: 2-0)
Kyrie Ming drives, Trae Curry stays with him. Kyrie Ming attempts a Dunk. Contested by Trae Curry (4.8 feet, ZONE). Kyrie Ming misses. Rebound secured by Terry Simons.

[10:41] Team_020 possession (Score: 2-0)
Bam Leonard makes the Dunk and draws the foul on Immanuel Middleton! And-1! Bam Leonard to the line for 1. [Team fouls: 1] (Immanuel Middleton: 1 personal fouls)   FT 1/1: GOOD Bam Leonard makes 1/1 from the line.
Score: 5-0

[10:25] Team_095 possession (Score: 5-0)
Kyrie Ming attempts a Midrange. Contested by Terry Simons (4.4 feet, ZONE). Kyrie Ming misses. Offensive rebound by Evan Carter! Evan Carter puts it back in!
Score: 5-2

[10:09] Team_020 possession (Score: 5-2)
Trae Curry drives to the basket... Trae Curry loses control! Ball rolls out of bounds! TURNOVER! (dead ball)

[09:54] Team_095 possession (Score: 5-2)
Shaquille Ball attempts a 3Pt. Contested by James Cunningham (5.0 feet, ZONE). Shaquille Ball misses. Rebound secured by Trae Curry.

[09:39] Team_020 possession (Score: 5-2)
Terry Simons drives, Evan Carter stays with him. Terry Simons attempts a Dunk. Contested by Evan Carter (4.5 feet, MAN). Terry Simons misses. Rebound secured by Evan Carter.

[09:24] Team_095 possession (Score: 5-2)
Shaquille Ball attempts a Midrange. Contested by James Cunningham (5.0 feet, MAN). SHAQUILLE BALL MAKES IT!
Score: 5-4

[09:11] Team_020 possession (Score: 5-4)
Trae Curry attempts a Midrange. Contested by Shaquille Ball (4.8 feet, ZONE). TRAE CURRY MAKES IT! Assist: Bam Leonard
Score: 7-4

[08:54] Team_095 possession (Score: 7-4)
Evan Carter attempts a 3Pt. Contested by Terry Simons (4.4 feet, MAN). Evan Carter misses. Rebound secured by Trae Curry.

[08:37] Team_020 possession (Score: 7-4)
Jarrett McCollum drives, Immanuel Middleton stays with him. Jarrett McCollum attempts a Layup. Contested by Immanuel Middleton (5.0 feet, ZONE). JARRETT MCCOLLUM MAKES IT! Assist: Terry Simons
Score: 9-4

[08:19] Team_095 possession (Score: 9-4)
Immanuel Middleton attempts a 3Pt. Contested by Bam Leonard (2.3 feet, MAN). IMMANUEL MIDDLETON MAKES IT! Assist: Evan Carter
Score: 9-7

[08:01] Team_020 possession (Score: 9-7)
Terry Simons attempts a 3Pt. Contested by Evan Carter (4.5 feet, MAN). Terry Simons misses. Rebound secured by Dejounte Hyland.

[07:43] Team_095 possession (Score: 9-7)
Shaquille Ball loses the ball! Stripped by James Cunningham! TURNOVER! (live ball)

[07:29] Team_020 possession (Score: 9-7)
Trae Curry attempts a Midrange. Contested by Immanuel Middleton (5.3 feet, ZONE). Trae Curry misses. Rebound secured by Dejounte Hyland.

[07:14] Team_095 possession (Score: 9-7)
Immanuel Middleton attempts a Layup. Contested by Bam Leonard (2.3 feet, MAN). IMMANUEL MIDDLETON MAKES IT! Assist: Evan Carter
Score: 9-9

[06:59] Team_020 possession (Score: 9-9)
FOUL! Reach-in foul on Dejounte Hyland during the drive. [Team fouls: 2] No free throws, side out. (Dejounte Hyland: 1 personal fouls)

[06:43] Team_020 possession (Score: 9-9)
Bam Leonard attempts a Midrange. Contested by Immanuel Middleton (5.2 feet, MAN). Bam Leonard misses. Rebound secured by Evan Carter.

[06:32] Team_095 possession (Score: 9-9)
Evan Carter attempts a 3Pt. Contested by Bam Leonard (2.5 feet, ZONE). EVAN CARTER MAKES IT! Assist: Shaquille Ball
Score: 9-12

[06:19] Team_020 possession (Score: 9-12)
Terry Simons attempts a Midrange. Contested by Evan Carter (4.5 feet, MAN). TERRY SIMONS MAKES IT! Assist: James Cunningham
Score: 11-12

[06:05] Team_095 possession (Score: 11-12)
Shaquille Ball attempts a Midrange. Contested by James Cunningham (5.0 feet, MAN). SHAQUILLE BALL MAKES IT! Assist: Kyrie Ming
Score: 11-14

[05:51] Team_020 possession (Score: 11-14)
Terry Simons attempts a 3Pt. Contested by Evan Carter (4.5 feet, MAN). Terry Simons misses. Offensive rebound by Trae Curry! Trae Curry puts it back in!
Score: 13-14

[05:36] Team_095 possession (Score: 13-14)
Shaquille Ball attempts a Midrange. Contested by James Cunningham (5.0 feet, MAN). SHAQUILLE BALL MAKES IT!
Score: 13-16

[05:17] Team_020 possession (Score: 13-16)
Terry Simons attempts a 3Pt. Contested by Evan Carter (4.5 feet, MAN). Terry Simons misses. Offensive rebound by Trae Curry! Trae Curry puts it back in!
Score: 15-16

[05:05] Team_095 possession (Score: 15-16)
Kyrie Ming drives to the basket... Kyrie Ming loses control! Ball rolls out of bounds! TURNOVER! (dead ball)

[04:51] Team_020 possession (Score: 15-16)
Jarrett McCollum attempts a 3Pt. Contested by Evan Carter (4.0 feet, ZONE). Jarrett McCollum misses. Rebound secured by Dejounte Hyland.

[04:34] Team_095 possession (Score: 15-16)
Immanuel Middleton drives and kicks out. Dejounte Hyland attempts a 3Pt. Contested by Jarrett McCollum (4.4 feet, MAN). DEJOUNTE HYLAND MAKES IT! Assist: Immanuel Middleton
Score: 15-19

[04:22] Team_020 possession (Score: 15-19)
Trae Curry drives, Kyrie Ming stays with him. Trae Curry attempts a Dunk. Contested by Kyrie Ming (5.6 feet, MAN). TRAE CURRY MAKES IT! Assist: James Cunningham
Score: 17-19

[04:06] Team_095 possession (Score: 17-19)
FOUL! Shooting foul on Jarrett McCollum. Dejounte Hyland to the line for 2 free throws. [Team fouls: 2] (Jarrett McCollum: 1 personal fouls)   FT 1/2: GOOD   FT 2/2: GOOD Dejounte Hyland makes 2/2 from the line.
Score: 17-21

[03:53] Team_020 possession (Score: 17-21)
Trae Curry attempts a Dunk. BLOCKED BY KYRIE MING! Ball is loose! Offensive rebound by Bam Leonard! Bam Leonard kicks it out.

[03:36] Team_020 possession (Score: 17-21)
Jarrett McCollum attempts a Midrange. Contested by Shaquille Ball (4.5 feet, ZONE). Jarrett McCollum misses. Offensive rebound by Trae Curry! Trae Curry's putback is no good. Rebound secured by Dejounte Hyland.

[03:22] Team_095 possession (Score: 17-21)
Evan Carter drives and kicks out. Dejounte Hyland attempts a 3Pt. Contested by Jarrett McCollum (4.5 feet, MAN). DEJOUNTE HYLAND MAKES IT! Assist: Kyrie Ming
Score: 17-24

[03:04] Team_020 possession (Score: 17-24)
Jarrett McCollum attempts a 3Pt. Contested by Dejounte Hyland (5.1 feet, MAN). Jarrett McCollum misses. Rebound secured by Dejounte Hyland.

[02:52] Team_095 possession (Score: 17-24)
Immanuel Middleton attempts a 3Pt. Contested by Bam Leonard (2.5 feet, MAN). Immanuel Middleton misses. Rebound secured by Terry Simons.

[02:39] Team_020 possession (Score: 17-24)
Terry Simons makes the Dunk and draws the foul on Evan Carter! And-1! Terry Simons to the line for 1. [Team fouls: 3] (Evan Carter: 1 personal fouls)   FT 1/1: GOOD Terry Simons makes 1/1 from the line.
Score: 20-24

[02:24] Team_095 possession (Score: 20-24)
Shaquille Ball makes the 3Pt and draws the foul on James Cunningham! And-1! Shaquille Ball to the line for 1. [Team fouls: 3] (James Cunningham: 1 personal fouls)   FT 1/1: GOOD Shaquille Ball makes 1/1 from the line.
Score: 20-28

[02:12] Team_020 possession (Score: 20-28)
Jarrett McCollum makes the Layup and draws the foul on Dejounte Hyland! And-1! Jarrett McCollum to the line for 1. [Team fouls: 4] (Dejounte Hyland: 2 personal fouls)   FT 1/1: MISS Jarrett McCollum makes 0/1 from the line. Offensive rebound by Trae Curry! Trae Curry puts it back in!
Score: 24-28

[01:58] Team_095 possession (Score: 24-28)
Immanuel Middleton attempts a Midrange. Contested by Jarrett McCollum (4.6 feet, ZONE). IMMANUEL MIDDLETON MAKES IT! Assist: Evan Carter
Score: 24-30

[01:39] Team_020 possession (Score: 24-30)
Bam Leonard attempts a Midrange. Contested by Evan Carter (4.4 feet, ZONE). Bam Leonard misses. Offensive rebound by Bam Leonard! Bam Leonard's putback is no good. Rebound secured by Evan Carter.

[01:23] Team_095 possession (Score: 24-30)
Immanuel Middleton makes the Layup and draws the foul on Jarrett McCollum! And-1! Immanuel Middleton to the line for 1. [Team fouls: 4] (Jarrett McCollum: 2 personal fouls)   FT 1/1: GOOD Immanuel Middleton makes 1/1 from the line.
Score: 24-33

[01:12] Team_020 possession (Score: 24-33)
Bam Leonard loses the ball! Stripped by Immanuel Middleton! TURNOVER! (live ball)

[00:58] Team_095 possession (Score: 24-33)
Shaquille Ball attempts a 3Pt. Contested by Terry Simons (4.6 feet, ZONE). Shaquille Ball misses. Rebound secured by Bam Leonard.

[00:46] Team_020 possession (Score: 24-33)
James Cunningham drives to the basket... FOUL! Offensive foul on James Cunningham! Kyrie Ming drew the charge! [Team fouls: 5] (James Cunningham: 2 personal fouls) TURNOVER! (dead ball)

[00:32] Team_095 possession (Score: 24-33)
Immanuel Middleton attempts a 3Pt. Contested by Bam Leonard (2.9 feet, MAN). Immanuel Middleton misses. Rebound secured by Bam Leonard.

[00:21] Team_020 possession (Score: 24-33)
Trae Curry attempts a 3Pt. Contested by Evan Carter (4.6 feet, ZONE). Trae Curry misses. Rebound secured by Dejounte Hyland.

[00:05] Team_095 possession (Score: 24-33)
Dejounte Hyland attempts a 3Pt. Contested by Jarrett McCollum (4.9 feet, MAN). Dejounte Hyland misses. Rebound secured by Trae Curry.

================================================================================
                              1ST QUARTER COMPLETE                              
================================================================================

1ST QUARTER SCORE: Team_020 24, Team_095 33

BOX SCORE:
================================================================================

Team_020
--------------------------------------------------------------------------------
Player                MIN  PTS  REB  AST  TO      FG   FG%      3P   3P%
--------------------------------------------------------------------------------
Trae Curry             12   14    6    0   0   6/8    75.0     0/0   0.0
Terry Simons           12    5    3    1   0   2/4    50.0     0/0   0.0
Evan Carter            12    5    4    3   0   2/3    66.7     0/0   0.0
Bam Leonard            12    3    3    1   0   1/3    33.3     0/0   0.0
Jarrett McCollum       12    2    0    0   0   1/4    25.0     0/0   0.0
James Cunningham       12    0    0    2   0   0/1     0.0     0/0   0.0

TEAM: FG: 10/20 (50.0%), 3PT: 2/6 (33.3%), REB: 14 (6 off, 8 def), AST: 4, TO: 3
TEAM FOULS: 5 [Team_095 in BONUS]


Team_095
--------------------------------------------------------------------------------
Player                MIN  PTS  REB  AST  TO      FG   FG%      3P   3P%
--------------------------------------------------------------------------------
Shaquille Ball         12   10    1    1   0   4/6    66.7     0/0   0.0
Immanuel Middleton     12   10    0    1   0   4/7    57.1     0/0   0.0
Dejounte Hyland        12    8    6    0   0   3/4    75.0     0/0   0.0
Kyrie Ming             12    0    0    2   0   0/1     0.0     0/0   0.0

TEAM: FG: 13/21 (61.9%), 3PT: 3/9 (33.3%), REB: 9 (1 off, 8 def), AST: 7, TO: 2
TEAM FOULS: 4

================================================================================

================================================================================
                       2ND QUARTER - Team_020 vs Team_095                       
================================================================================

[12:00] Team_020 possession (Score: 24-33)
Jarrett McCollum attempts a 3Pt. Contested by Evan Carter (4.2 feet, ZONE). Jarrett McCollum misses. Offensive rebound by Bam Leonard! Bam Leonard puts it back in!
Score: 26-33

[11:46] Team_095 possession (Score: 26-33)
Dejounte Hyland attempts a 3Pt. Contested by Bam Leonard (2.7 feet, ZONE). DEJOUNTE HYLAND MAKES IT! Assist: Kyrie Ming
Score: 26-36

[11:31] Team_020 possession (Score: 26-36)
Terry Simons attempts a 3Pt. Contested by Evan Carter (4.8 feet, MAN). Terry Simons misses. Rebound secured by Dejounte Hyland.

[11:16] Team_095 possession (Score: 26-36)
Immanuel Middleton attempts a Midrange. Contested by James Cunningham (5.2 feet, ZONE). IMMANUEL MIDDLETON MAKES IT!
Score: 26-38

[11:00] Team_020 possession (Score: 26-38)
FOUL! Reach-in foul on Kyrie Ming during the drive. [Team fouls: 1] No free throws, side out. (Kyrie Ming: 1 personal fouls)

[10:44] Team_020 possession (Score: 26-38)
James Cunningham drives, picks up Shaquille Ball. Help arrives from Evan Carter! James Cunningham attempts a Layup. Contested by Evan Carter (4.9 feet, MAN). JAMES CUNNINGHAM MAKES IT!
Score: 28-38

[10:30] Team_095 possession (Score: 28-38)
Immanuel Middleton attempts a 3Pt. Contested by Bam Leonard (2.9 feet, ZONE). IMMANUEL MIDDLETON MAKES IT! Assist: Shaquille Ball
Score: 28-41

[10:16] Team_020 possession (Score: 28-41)
FOUL! Reach-in foul on Immanuel Middleton during the drive. [Team fouls: 2] No free throws, side out. (Immanuel Middleton: 1 personal fouls)

[10:03] Team_020 possession (Score: 28-41)
Terry Simons attempts a 3Pt. Contested by Evan Carter (4.9 feet, ZONE). Terry Simons misses. Rebound secured by Evan Carter.

[09:49] Team_095 possession (Score: 28-41)
Shaquille Ball throws a bad pass out of bounds! TURNOVER! (dead ball)

[09:49] Substitution (Team_020): Jarrett McCollum OUT → Franz Doncic IN (stamina_rule2)

[09:49] Substitution (Team_020): James Cunningham OUT → Stephen Parker IN (stamina_rule2)

[09:49] Substitution (Team_020): Terry Simons OUT → Victor Holiday IN (stamina_rule2)

[09:49] Substitution (Team_020): Bam Leonard OUT → Cole Barnes IN (stamina_rule2)

[09:49] Substitution (Team_020): Trae Curry OUT → Miles Siakam IN (stamina_rule2)

[09:49] Substitution (Team_095): Dejounte Hyland OUT → Kyle Poole IN (stamina_rule2)

[09:49] Substitution (Team_095): Shaquille Ball OUT → Cade Beal IN (stamina_rule2)

[09:49] Substitution (Team_095): Evan Carter OUT → Tobias Wagner IN (stamina_rule2)

[09:49] Substitution (Team_095): Immanuel Middleton OUT → Gary Davis IN (stamina_rule2)

[09:49] Substitution (Team_095): Kyrie Ming OUT → DeMar McCollum IN (stamina_rule2)

[09:33] Team_020 possession (Score: 28-41)
Cole Barnes attempts a 3Pt. Contested by Gary Davis (5.5 feet, MAN). Cole Barnes misses. Rebound secured by Tobias Wagner.

[09:20] Team_095 possession (Score: 28-41)
FOUL! Reach-in foul on Miles Siakam during the drive. [Team fouls: 1] No free throws, side out. (Miles Siakam: 1 personal fouls)

[09:08] Team_095 possession (Score: 28-41)
DeMar McCollum drives and kicks out. DeMar McCollum attempts a Midrange. Contested by Miles Siakam (4.0 feet, MAN). DeMar McCollum misses. Rebound secured by Miles Siakam.

[08:53] Team_020 possession (Score: 28-41)
FOUL! Shooting foul on Cade Beal. Miles Siakam to the line for 2 free throws. [Team fouls: 3] (Cade Beal: 1 personal fouls)   FT 1/2: GOOD   FT 2/2: GOOD Miles Siakam makes 2/2 from the line.
Score: 30-41

[08:43] Team_095 possession (Score: 30-41)
FOUL! Shooting foul on Stephen Parker. Cade Beal to the line for 2 free throws. [Team fouls: 2] (Stephen Parker: 1 personal fouls)   FT 1/2: MISS   FT 2/2: GOOD Cade Beal makes 1/2 from the line.
Score: 30-42

[08:28] Team_020 possession (Score: 30-42)
FOUL! Shooting foul on Gary Davis. Cole Barnes to the line for 2 free throws. [Team fouls: 4] (Gary Davis: 1 personal fouls)   FT 1/2: GOOD   FT 2/2: GOOD Cole Barnes makes 2/2 from the line.
Score: 32-42

[08:17] Team_095 possession (Score: 32-42)
Gary Davis attempts a Midrange. Contested by Cole Barnes (4.7 feet, MAN). GARY DAVIS MAKES IT! Assist: Tobias Wagner
Score: 32-44

[08:04] Team_020 possession (Score: 32-44)
Victor Holiday attempts a Midrange. Contested by Cade Beal (4.8 feet, ZONE). Victor Holiday misses. Rebound secured by DeMar McCollum.

[07:52] Team_095 possession (Score: 32-44)
Cade Beal attempts a Layup. BLOCKED BY MILES SIAKAM! Ball deflects out of bounds off Cade Beal.

[07:36] Team_020 possession (Score: 32-44)
Stephen Parker attempts a 3Pt. Contested by Kyle Poole (4.9 feet, ZONE). Stephen Parker misses. Rebound secured by Gary Davis.

[07:20] Team_095 possession (Score: 32-44)
Cade Beal attempts a Midrange. Contested by Stephen Parker (5.4 feet, MAN). CADE BEAL MAKES IT! Assist: Gary Davis
Score: 32-46

[07:08] Team_020 possession (Score: 32-46)
Cole Barnes attempts a 3Pt. Contested by Gary Davis (5.5 feet, MAN). Cole Barnes misses. Rebound secured by Gary Davis.

[06:56] Team_095 possession (Score: 32-46)
Tobias Wagner attempts a Layup. Contested by Victor Holiday (4.6 feet, MAN). TOBIAS WAGNER MAKES IT!
Score: 32-48

[06:39] Team_020 possession (Score: 32-48)
Stephen Parker throws a bad pass! Stolen by Cade Beal! TURNOVER! (live ball)

[06:23] Team_095 possession (Score: 32-48)
Kyle Poole attempts a 3Pt. Contested by Stephen Parker (5.8 feet, ZONE). Kyle Poole misses. Offensive rebound by DeMar McCollum! DeMar McCollum kicks it out.

[06:09] Team_095 possession (Score: 32-48)
Cade Beal attempts a 3Pt. Contested by Stephen Parker (5.4 feet, MAN). Cade Beal misses. Offensive rebound by Tobias Wagner! Tobias Wagner kicks it out.

[05:54] Team_095 possession (Score: 32-48)
DeMar McCollum attempts a Layup. Contested by Miles Siakam (4.5 feet, ZONE). DeMar McCollum misses. Rebound secured by Cole Barnes.

[05:43] Team_020 possession (Score: 32-48)
Cole Barnes drives, DeMar McCollum stays with him. Cole Barnes attempts a Layup. Contested by DeMar McCollum (4.9 feet, ZONE). Cole Barnes misses. Rebound secured by Gary Davis.

[05:24] Team_095 possession (Score: 32-48)
Cade Beal attempts a Midrange. Contested by Victor Holiday (4.2 feet, ZONE). Cade Beal misses. Rebound secured by Cole Barnes.

[05:08] Team_020 possession (Score: 32-48)
Miles Siakam loses control! Ball rolls out of bounds! TURNOVER! (dead ball)

[04:48] Team_095 possession (Score: 32-48)
Tobias Wagner attempts a 3Pt. Contested by Stephen Parker (5.8 feet, ZONE). TOBIAS WAGNER MAKES IT! Assist: DeMar McCollum
Score: 32-51

[04:35] Team_020 possession (Score: 32-51)
Cole Barnes drives to the basket... Cole Barnes commits a violation (traveling/carry)! TURNOVER! (dead ball)

[04:19] Team_095 possession (Score: 32-51)
Cade Beal drives to the basket... Cade Beal throws a bad pass! Stolen by Stephen Parker! TURNOVER! (live ball)

[04:08] Team_020 possession (Score: 32-51)
FOUL! Reach-in foul on DeMar McCollum during the drive. [IN THE BONUS! 5 team fouls] Miles Siakam to the line for 2 free throws. (DeMar McCollum: 1 personal fouls)   FT 1/2: GOOD   FT 2/2: MISS Miles Siakam makes 1/2 from the line. Rebound secured by Tobias Wagner.
Score: 33-51

[03:53] Team_095 possession (Score: 33-51)
FOUL! Holding foul on Victor Holiday. [Team fouls: 3] No free throws, side out. (Victor Holiday: 1 personal fouls)

[03:36] Team_095 possession (Score: 33-51)
FOUL! Shooting foul on Franz Doncic. Kyle Poole to the line for 3 free throws. [Team fouls: 4] (Franz Doncic: 1 personal fouls)   FT 1/3: GOOD   FT 2/3: GOOD   FT 3/3: GOOD Kyle Poole makes 3/3 from the line.
Score: 33-54

[03:21] Team_020 possession (Score: 33-54)
Franz Doncic attempts a Layup. Contested by DeMar McCollum (4.5 feet, ZONE). Franz Doncic misses. Rebound secured by DeMar McCollum.

[03:04] Team_095 possession (Score: 33-54)
Gary Davis attempts a Midrange. Contested by Cole Barnes (4.7 feet, MAN). GARY DAVIS MAKES IT! Assist: Kyle Poole
Score: 33-56

[02:48] Team_020 possession (Score: 33-56)
Franz Doncic attempts a 3Pt. Contested by Kyle Poole (4.4 feet, MAN). FRANZ DONCIC MAKES IT! Assist: Cole Barnes
Score: 36-56

[02:39] Team_095 possession (Score: 36-56)
FOUL! Shooting foul on Miles Siakam. DeMar McCollum to the line for 2 free throws. [BONUS: 5 team fouls] (Miles Siakam: 2 personal fouls)   FT 1/2: MISS   FT 2/2: GOOD DeMar McCollum makes 1/2 from the line.
Score: 36-57

[02:20] Team_020 possession (Score: 36-57)
Cole Barnes drives to the basket... Cole Barnes loses control! Ball rolls out of bounds! TURNOVER! (dead ball)

[02:05] Team_095 possession (Score: 36-57)
FOUL! Reach-in foul on Victor Holiday during the drive. [IN THE BONUS! 6 team fouls] Tobias Wagner to the line for 2 free throws. (Victor Holiday: 2 personal fouls)   FT 1/2: GOOD   FT 2/2: GOOD Tobias Wagner makes 2/2 from the line.
Score: 36-59

[01:49] Team_020 possession (Score: 36-59)
Franz Doncic attempts a 3Pt. Contested by Cade Beal (4.0 feet, ZONE). Franz Doncic misses. Rebound secured by DeMar McCollum.

[01:33] Team_095 possession (Score: 36-59)
Kyle Poole attempts a Midrange. Contested by Cole Barnes (5.4 feet, ZONE). Kyle Poole misses. Offensive rebound by Tobias Wagner! Tobias Wagner kicks it out.

[01:20] Team_095 possession (Score: 36-59)
Kyle Poole drives and kicks out. Gary Davis attempts a 3Pt. Contested by Victor Holiday (4.4 feet, ZONE). Gary Davis misses. Offensive rebound by DeMar McCollum! DeMar McCollum kicks it out.

[01:08] Team_095 possession (Score: 36-59)
Tobias Wagner attempts a Midrange. Contested by Victor Holiday (4.7 feet, MAN). Tobias Wagner misses. Rebound secured by Cole Barnes.

[00:55] Team_020 possession (Score: 36-59)
Victor Holiday attempts a 3Pt. Contested by Tobias Wagner (4.4 feet, MAN). Victor Holiday misses. Rebound secured by DeMar McCollum.

[00:39] Team_095 possession (Score: 36-59)
Kyle Poole drives, Miles Siakam stays with him. Kyle Poole attempts a Dunk. Contested by Miles Siakam (4.6 feet, ZONE). KYLE POOLE MAKES IT! Assist: DeMar McCollum
Score: 36-61

[00:28] Team_020 possession (Score: 36-61)
Franz Doncic attempts a 3Pt. Contested by Kyle Poole (4.6 feet, MAN). Franz Doncic misses. Rebound secured by Tobias Wagner.

[00:12] Team_095 possession (Score: 36-61)
DeMar McCollum drives and kicks out. Tobias Wagner attempts a 3Pt. Contested by Victor Holiday (4.5 feet, MAN). Tobias Wagner misses. Rebound secured by Miles Siakam.

================================================================================
                              2ND QUARTER COMPLETE                              
================================================================================

2ND QUARTER SCORE: Team_020 12, Team_095 28

BOX SCORE:
================================================================================

Team_020
--------------------------------------------------------------------------------
Player                MIN  PTS  REB  AST  TO      FG   FG%      3P   3P%
--------------------------------------------------------------------------------
Franz Doncic           10    3    0    0   0   1/4    25.0     0/0   0.0
Bam Leonard            15    2    1    0   0   1/1   100.0     0/0   0.0
James Cunningham       15    2    0    0   0   1/1   100.0     0/0   0.0
Cole Barnes            10    2    3    1   0   1/4    25.0     0/0   0.0
Miles Siakam           10    2    2    0   0   1/2    50.0     0/0   0.0
Terry Simons           15    0    0    0   0   0/2     0.0     0/0   0.0
Victor Holiday         10    0    0    0   0   0/2     0.0     0/0   0.0
Stephen Parker         10    0    0    0   0   0/1     0.0     0/0   0.0

TEAM: FG: 5/17 (29.4%), 3PT: 2/10 (20.0%), REB: 6 (1 off, 5 def), AST: 1, TO: 4
TEAM FOULS: 6 [Team_095 in BONUS]


Team_095
--------------------------------------------------------------------------------
Player                MIN  PTS  REB  AST  TO      FG   FG%      3P   3P%
--------------------------------------------------------------------------------
Tobias Wagner          10    7    5    1   0   3/4    75.0     0/0   0.0
Immanuel Middleton     15    5    0    0   0   2/2   100.0     0/0   0.0
Kyle Poole             10    5    0    1   0   2/2   100.0     0/0   0.0
Gary Davis             10    4    3    1   0   2/2   100.0     0/0   0.0
Dejounte Hyland        15    3    1    0   0   1/1   100.0     0/0   0.0
Cade Beal              10    3    0    0   0   2/4    50.0     0/0   0.0
DeMar McCollum         10    1    6    2   0   1/4    25.0     0/0   0.0
Kyrie Ming             15    0    0    1   0   0/0     0.0     0/0   0.0
Shaquille Ball         15    0    0    1   0   0/0     0.0     0/0   0.0
Evan Carter            15    0    1    0   0   0/0     0.0     0/0   0.0

TEAM: FG: 13/19 (68.4%), 3PT: 4/4 (100.0%), REB: 16 (4 off, 12 def), AST: 7, TO: 2
TEAM FOULS: 5 [Team_020 in BONUS]

================================================================================

================================================================================
                       3RD QUARTER - Team_020 vs Team_095                       
================================================================================

[12:00] Team_020 possession (Score: 36-61)
Jarrett McCollum drives to the basket... FOUL! Offensive foul on Jarrett McCollum! Dejounte Hyland drew the charge! [Team fouls: 1] (Jarrett McCollum: 1 personal fouls) TURNOVER! (dead ball)

[11:51] Team_095 possession (Score: 36-61)
Immanuel Middleton drives, picks up Bam Leonard. Help arrives from Jarrett McCollum! Immanuel Middleton attempts a Dunk. Contested by Jarrett McCollum (2.3 feet, MAN). IMMANUEL MIDDLETON MAKES IT! Assist: Kyrie Ming
Score: 36-63

[11:36] Team_020 possession (Score: 36-63)
Trae Curry loses control! Ball rolls out of bounds! TURNOVER! (dead ball)

[11:20] Team_095 possession (Score: 36-63)
Dejounte Hyland attempts a Midrange. Contested by James Cunningham (5.0 feet, ZONE). Dejounte Hyland misses. Rebound secured by Bam Leonard.

[11:05] Team_020 possession (Score: 36-63)
Trae Curry attempts a Layup. Contested by Kyrie Ming (5.5 feet, MAN). TRAE CURRY MAKES IT! Assist: Jarrett McCollum
Score: 38-63

[10:52] Team_095 possession (Score: 38-63)
FOUL! Holding foul on Bam Leonard. [Team fouls: 2] No free throws, side out. (Bam Leonard: 1 personal fouls)

[10:38] Team_095 possession (Score: 38-63)
Dejounte Hyland drives, Jarrett McCollum stays with him. Dejounte Hyland attempts a Layup. Contested by Jarrett McCollum (4.4 feet, MAN). DEJOUNTE HYLAND MAKES IT!
Score: 38-65

[10:24] Team_020 possession (Score: 38-65)
FOUL! Holding foul on Dejounte Hyland. [Team fouls: 1] No free throws, side out. (Dejounte Hyland: 1 personal fouls)

[10:07] Team_020 possession (Score: 38-65)
James Cunningham attempts a 3Pt. Contested by Evan Carter (4.2 feet, ZONE). James Cunningham misses. Rebound secured by Evan Carter.

[09:51] Team_095 possession (Score: 38-65)
Dejounte Hyland attempts a 3Pt. Contested by Jarrett McCollum (4.4 feet, MAN). Dejounte Hyland misses. Rebound secured by Terry Simons.

[09:37] Team_020 possession (Score: 38-65)
Terry Simons attempts a 3Pt. Contested by Evan Carter (4.5 feet, ZONE). Terry Simons misses. Offensive rebound by Trae Curry! Trae Curry's putback is no good. Rebound secured by Dejounte Hyland.

[09:24] Team_095 possession (Score: 38-65)
FOUL! Holding foul on Jarrett McCollum. [Team fouls: 3] No free throws, side out. (Jarrett McCollum: 2 personal fouls)

[09:12] Team_095 possession (Score: 38-65)
Shaquille Ball attempts a 3Pt. Contested by Bam Leonard (2.3 feet, ZONE). SHAQUILLE BALL MAKES IT!
Score: 38-68

[08:56] Team_020 possession (Score: 38-68)
James Cunningham attempts a 3Pt. Contested by Shaquille Ball (4.7 feet, MAN). James Cunningham misses. Rebound secured by Dejounte Hyland.

[08:40] Team_095 possession (Score: 38-68)
Evan Carter drives, picks up Trae Curry. Help arrives from Jarrett McCollum! Evan Carter attempts a Dunk. Contested by Jarrett McCollum (4.8 feet, ZONE). EVAN CARTER MAKES IT!
Score: 38-70

[08:23] Team_020 possession (Score: 38-70)
James Cunningham attempts a Midrange. Contested by Kyrie Ming (5.4 feet, ZONE). James Cunningham misses. Rebound secured by Shaquille Ball.

[08:05] Team_095 possession (Score: 38-70)
Dejounte Hyland loses the ball! Stripped by Jarrett McCollum! TURNOVER! (live ball)

[07:55] Team_020 possession (Score: 38-70)
Bam Leonard attempts a Layup. Contested by Immanuel Middleton (5.2 feet, MAN). BAM LEONARD MAKES IT! Assist: Jarrett McCollum
Score: 40-70

[07:43] Team_095 possession (Score: 40-70)
Evan Carter drives and kicks out. Evan Carter attempts a 3Pt. Contested by Bam Leonard (2.3 feet, ZONE). EVAN CARTER MAKES IT!
Score: 40-73

[07:30] Team_020 possession (Score: 40-73)
Jarrett McCollum attempts a 3Pt. Contested by Dejounte Hyland (5.0 feet, MAN). JARRETT MCCOLLUM MAKES IT! Assist: Bam Leonard
Score: 43-73

[07:16] Team_095 possession (Score: 43-73)
Shaquille Ball attempts a Layup. Contested by Trae Curry (4.6 feet, ZONE). Shaquille Ball misses. Offensive rebound by Dejounte Hyland! Dejounte Hyland kicks it out.

[07:01] Team_095 possession (Score: 43-73)
Kyrie Ming attempts a Layup. Contested by Trae Curry (4.8 feet, ZONE). KYRIE MING MAKES IT! Assist: Immanuel Middleton
Score: 43-75

[06:49] Team_020 possession (Score: 43-75)
Trae Curry drives, Kyrie Ming stays with him. Trae Curry attempts a Dunk. Contested by Kyrie Ming (5.5 feet, MAN). TRAE CURRY MAKES IT! Assist: Bam Leonard
Score: 45-75

[06:40] Team_095 possession (Score: 45-75)
Kyrie Ming attempts a Midrange. Contested by Terry Simons (4.4 feet, ZONE). Kyrie Ming misses. Offensive rebound by Evan Carter! Evan Carter's putback is no good. Rebound secured by Bam Leonard.

[06:25] Team_020 possession (Score: 45-75)
FOUL! Holding foul on Shaquille Ball. [Team fouls: 2] No free throws, side out. (Shaquille Ball: 1 personal fouls)

[06:15] Team_020 possession (Score: 45-75)
Terry Simons throws a bad pass! Stolen by Evan Carter! TURNOVER! (live ball)

[06:02] Team_095 possession (Score: 45-75)
Kyrie Ming makes the Layup and draws the foul on Bam Leonard! And-1! Kyrie Ming to the line for 1. [Team fouls: 4] (Bam Leonard: 2 personal fouls)   FT 1/1: GOOD Kyrie Ming makes 1/1 from the line.
Score: 45-78

[05:44] Team_020 possession (Score: 45-78)
Jarrett McCollum attempts a 3Pt. Contested by Evan Carter (4.0 feet, ZONE). Jarrett McCollum misses. Rebound secured by Shaquille Ball.

[05:33] Team_095 possession (Score: 45-78)
Shaquille Ball attempts a Layup. Contested by James Cunningham (5.0 feet, MAN). SHAQUILLE BALL MAKES IT! Assist: Dejounte Hyland
Score: 45-80

[05:13] Team_020 possession (Score: 45-80)
Terry Simons attempts a Layup. Contested by Immanuel Middleton (5.6 feet, ZONE). TERRY SIMONS MAKES IT! Assist: Bam Leonard
Score: 47-80

[04:56] Team_095 possession (Score: 47-80)
FOUL! Reach-in foul on Bam Leonard during the drive. [IN THE BONUS! 5 team fouls] Immanuel Middleton to the line for 2 free throws. (Bam Leonard: 3 personal fouls)   FT 1/2: GOOD   FT 2/2: MISS Immanuel Middleton makes 1/2 from the line. Rebound secured by Terry Simons.
Score: 47-81

[04:40] Team_020 possession (Score: 47-81)
Terry Simons attempts a 3Pt. Contested by Evan Carter (4.5 feet, ZONE). Terry Simons misses. Rebound secured by Evan Carter.

[04:25] Team_095 possession (Score: 47-81)
Shaquille Ball attempts a 3Pt. Contested by James Cunningham (5.0 feet, MAN). Shaquille Ball misses. Offensive rebound by Evan Carter! Evan Carter's putback is no good. Rebound secured by Bam Leonard.

[04:09] Team_020 possession (Score: 47-81)
Terry Simons makes the Dunk and draws the foul on Kyrie Ming! And-1! Terry Simons to the line for 1. [Team fouls: 3] (Kyrie Ming: 1 personal fouls)   FT 1/1: GOOD Terry Simons makes 1/1 from the line.
Score: 50-81

[03:57] Team_095 possession (Score: 50-81)
FOUL! Shooting foul on James Cunningham. Shaquille Ball to the line for 2 free throws. [BONUS: 6 team fouls] (James Cunningham: 1 personal fouls)   FT 1/2: GOOD   FT 2/2: MISS Shaquille Ball makes 1/2 from the line. Offensive rebound by Evan Carter! Evan Carter's putback is no good.
Score: 50-82

[03:44] Team_020 possession (Score: 50-82)
Terry Simons attempts a Layup. BLOCKED BY EVAN CARTER! Ball is loose! Rebound secured by Shaquille Ball.

[03:30] Team_095 possession (Score: 50-82)
Shaquille Ball makes the Dunk and draws the foul on Trae Curry! And-1! Shaquille Ball to the line for 1. [BONUS: 7 team fouls] (Trae Curry: 1 personal fouls)   FT 1/1: GOOD Shaquille Ball makes 1/1 from the line.
Score: 50-85

[03:15] Team_020 possession (Score: 50-85)
Bam Leonard attempts a Layup. Contested by Immanuel Middleton (5.4 feet, ZONE). Bam Leonard misses. Offensive rebound by Trae Curry! Trae Curry's putback is no good. Rebound secured by Dejounte Hyland.

[02:56] Team_095 possession (Score: 50-85)
Shaquille Ball makes the Layup and draws the foul on James Cunningham! And-1! Shaquille Ball to the line for 1. [BONUS: 8 team fouls] (James Cunningham: 2 personal fouls)   FT 1/1: GOOD Shaquille Ball makes 1/1 from the line.
Score: 50-88

[02:41] Team_020 possession (Score: 50-88)
Trae Curry attempts a Layup. Contested by Immanuel Middleton (5.5 feet, ZONE). TRAE CURRY MAKES IT! Assist: James Cunningham
Score: 52-88

[02:26] Team_095 possession (Score: 52-88)
Dejounte Hyland attempts a 3Pt. Contested by Bam Leonard (2.7 feet, ZONE). DEJOUNTE HYLAND MAKES IT! Assist: Kyrie Ming
Score: 52-91

[02:10] Team_020 possession (Score: 52-91)
FOUL! Shooting foul on Dejounte Hyland. Trae Curry to the line for 2 free throws. [Team fouls: 4] (Dejounte Hyland: 2 personal fouls)   FT 1/2: GOOD   FT 2/2: GOOD Trae Curry makes 2/2 from the line.
Score: 54-91

[01:56] Team_095 possession (Score: 54-91)
Immanuel Middleton attempts a 3Pt. Contested by Bam Leonard (2.7 feet, ZONE). IMMANUEL MIDDLETON MAKES IT! Assist: Kyrie Ming
Score: 54-94

[01:40] Team_020 possession (Score: 54-94)
James Cunningham attempts a 3Pt. Contested by Shaquille Ball (4.9 feet, MAN). JAMES CUNNINGHAM MAKES IT! Assist: Terry Simons
Score: 57-94

[01:29] Team_095 possession (Score: 57-94)
Dejounte Hyland attempts a 3Pt. Contested by Bam Leonard (2.8 feet, ZONE). DEJOUNTE HYLAND MAKES IT! Assist: Evan Carter
Score: 57-97

[01:13] Team_020 possession (Score: 57-97)
FOUL! Reach-in foul on Dejounte Hyland during the drive. [IN THE BONUS! 5 team fouls] Jarrett McCollum to the line for 2 free throws. (Dejounte Hyland: 3 personal fouls)   FT 1/2: GOOD   FT 2/2: MISS Jarrett McCollum makes 1/2 from the line. Rebound secured by Dejounte Hyland.
Score: 58-97

[01:01] Team_095 possession (Score: 58-97)
Dejounte Hyland attempts a Midrange. Contested by James Cunningham (5.3 feet, ZONE). DEJOUNTE HYLAND MAKES IT! Assist: Immanuel Middleton
Score: 58-99

[00:45] Team_020 possession (Score: 58-99)
Trae Curry drives to the basket... Trae Curry throws a bad pass out of bounds! TURNOVER! (dead ball)

[00:45] Substitution (Team_020): Jarrett McCollum OUT → Franz Doncic IN (stamina_rule2)

[00:45] Substitution (Team_020): James Cunningham OUT → Stephen Parker IN (stamina_rule2)

[00:45] Substitution (Team_020): Terry Simons OUT → Victor Holiday IN (stamina_rule2)

[00:45] Substitution (Team_020): Bam Leonard OUT → Cole Barnes IN (stamina_rule2)

[00:45] Substitution (Team_020): Trae Curry OUT → Miles Siakam IN (stamina_rule2)

[00:45] Substitution (Team_095): Dejounte Hyland OUT → Kyle Poole IN (stamina_rule2)

[00:45] Substitution (Team_095): Shaquille Ball OUT → Cade Beal IN (stamina_rule2)

[00:45] Substitution (Team_095): Evan Carter OUT → Tobias Wagner IN (stamina_rule2)

[00:45] Substitution (Team_095): Immanuel Middleton OUT → Gary Davis IN (stamina_rule2)

[00:45] Substitution (Team_095): Kyrie Ming OUT → DeMar McCollum IN (stamina_rule2)

[00:31] Team_095 possession (Score: 58-99)
DeMar McCollum drives, Miles Siakam stays with him. DeMar McCollum attempts a Dunk. Contested by Miles Siakam (4.5 feet, MAN). DeMar McCollum misses. Rebound secured by Miles Siakam.

[00:16] Team_020 possession (Score: 58-99)
Franz Doncic attempts a Midrange. Contested by Cade Beal (4.0 feet, ZONE). Franz Doncic misses. Offensive rebound by Cole Barnes! Cole Barnes kicks it out.

[00:02] Team_020 possession (Score: 58-99)
Cole Barnes drives, Gary Davis stays with him. Cole Barnes attempts a Layup. Contested by Gary Davis (5.5 feet, MAN). COLE BARNES MAKES IT! Assist: Franz Doncic
Score: 60-99

================================================================================
                              3RD QUARTER COMPLETE                              
================================================================================

3RD QUARTER SCORE: Team_020 24, Team_095 38

BOX SCORE:
================================================================================

Team_020
--------------------------------------------------------------------------------
Player                MIN  PTS  REB  AST  TO      FG   FG%      3P   3P%
--------------------------------------------------------------------------------
Trae Curry             26    8    0    0   0   4/4   100.0     0/0   0.0
Terry Simons           26    5    2    1   0   2/5    40.0     0/0   0.0
Jarrett McCollum       26    3    0    2   0   1/3    33.3     0/0   0.0
James Cunningham       26    3    0    1   0   1/4    25.0     0/0   0.0
Bam Leonard            26    2    3    3   0   1/2    50.0     0/0   0.0
Cole Barnes            10    2    1    0   0   1/1   100.0     0/0   0.0
Miles Siakam           10    0    1    0   0   0/0     0.0     0/0   0.0
Franz Doncic           10    0    0    1   0   0/0     0.0     0/0   0.0

TEAM: FG: 10/19 (52.6%), 3PT: 2/7 (28.6%), REB: 8 (3 off, 5 def), AST: 8, TO: 4
TEAM FOULS: 8 [Team_095 in BONUS]


Team_095
--------------------------------------------------------------------------------
Player                MIN  PTS  REB  AST  TO      FG   FG%      3P   3P%
--------------------------------------------------------------------------------
Shaquille Ball         26   11    3    0   0   4/6    66.7     0/0   0.0
Dejounte Hyland        26   10    5    1   0   4/6    66.7     0/0   0.0
Immanuel Middleton     26    5    0    2   0   2/3    66.7     0/0   0.0
Kyrie Ming             26    5    0    3   0   2/3    66.7     0/0   0.0
Evan Carter            26    5    3    1   0   2/2   100.0     0/0   0.0
DeMar McCollum         10    0    0    0   0   0/1     0.0     0/0   0.0

TEAM: FG: 14/21 (66.7%), 3PT: 4/6 (66.7%), REB: 10 (3 off, 7 def), AST: 7, TO: 1
TEAM FOULS: 5 [Team_020 in BONUS]

================================================================================

================================================================================
                       4TH QUARTER - Team_020 vs Team_095                       
================================================================================

[12:00] Substitution (Team_020): Jarrett McCollum OUT (stamina: 71) → Franz Doncic IN (comeback_detected)

[12:00] Substitution (Team_095): Dejounte Hyland OUT (stamina: 72) → Kyle Poole IN (comeback_detected)

[12:00] Team_020 possession (Score: 60-99)
Terry Simons makes the Midrange and draws the foul on Evan Carter! And-1! Terry Simons to the line for 1. [Team fouls: 1] (Evan Carter: 1 personal fouls)   FT 1/1: GOOD Terry Simons makes 1/1 from the line.
Score: 63-99

[11:42] Team_095 possession (Score: 63-99)
Shaquille Ball drives and kicks out. Shaquille Ball makes the Midrange and draws the foul on James Cunningham! And-1! Shaquille Ball to the line for 1. [Team fouls: 1] (James Cunningham: 1 personal fouls)   FT 1/1: GOOD Shaquille Ball makes 1/1 from the line.
Score: 63-102

[11:26] Team_020 possession (Score: 63-102)
Franz Doncic attempts a Layup. Contested by Kyle Poole (4.3 feet, MAN). FRANZ DONCIC MAKES IT! Assist: James Cunningham
Score: 65-102

[11:09] Team_095 possession (Score: 65-102)
Immanuel Middleton throws a bad pass! Stolen by Bam Leonard! TURNOVER! (live ball)

[10:50] Team_020 possession (Score: 65-102)
James Cunningham attempts a 3Pt. Contested by Evan Carter (4.4 feet, ZONE). JAMES CUNNINGHAM MAKES IT! Assist: Terry Simons
Score: 68-102

[10:36] Team_095 possession (Score: 68-102)
Evan Carter attempts a 3Pt. Contested by Bam Leonard (3.0 feet, ZONE). Evan Carter misses. Offensive rebound by Shaquille Ball! Shaquille Ball kicks it out.

[10:21] Team_095 possession (Score: 68-102)
Kyle Poole throws a bad pass! Stolen by Franz Doncic! TURNOVER! (live ball)

[10:04] Team_020 possession (Score: 68-102)
Trae Curry attempts a Midrange. Contested by Shaquille Ball (5.0 feet, ZONE). Trae Curry misses. Rebound secured by Evan Carter.

[09:47] Team_095 possession (Score: 68-102)
Kyle Poole attempts a 3Pt. Contested by Franz Doncic (4.3 feet, MAN). Kyle Poole misses. Rebound secured by Trae Curry.

[09:35] Team_020 possession (Score: 68-102)
Trae Curry attempts a Midrange. Contested by Kyrie Ming (5.9 feet, MAN). Trae Curry misses. Rebound secured by Shaquille Ball.

[09:23] Team_095 possession (Score: 68-102)
Kyle Poole attempts a Layup. BLOCKED BY FRANZ DONCIC! Ball is loose! Offensive rebound by Shaquille Ball! Shaquille Ball kicks it out.

[09:05] Team_095 possession (Score: 68-102)
FOUL! Reach-in foul on Terry Simons during the drive. [Team fouls: 2] No free throws, side out. (Terry Simons: 1 personal fouls)

[08:51] Team_095 possession (Score: 68-102)
FOUL! Shooting foul on Bam Leonard. Evan Carter to the line for 3 free throws. [Team fouls: 3] (Bam Leonard: 1 personal fouls)   FT 1/3: GOOD   FT 2/3: GOOD   FT 3/3: GOOD Evan Carter makes 3/3 from the line.
Score: 68-105

[08:38] Team_020 possession (Score: 68-105)
James Cunningham attempts a 3Pt. Contested by Evan Carter (4.6 feet, ZONE). JAMES CUNNINGHAM MAKES IT!
Score: 71-105

[08:24] Team_095 possession (Score: 71-105)
Shaquille Ball drives to the basket... FOUL! Offensive foul on Shaquille Ball! James Cunningham drew the charge! [Team fouls: 2] (Shaquille Ball: 1 personal fouls) TURNOVER! (dead ball)

[08:11] Team_020 possession (Score: 71-105)
Franz Doncic drives, picks up Kyle Poole. Help arrives from Evan Carter! Franz Doncic attempts a Dunk. Contested by Evan Carter (4.3 feet, MAN). Franz Doncic misses. Rebound secured by Evan Carter.

[07:58] Team_095 possession (Score: 71-105)
Immanuel Middleton drives, picks up Bam Leonard. Help arrives from Franz Doncic! Immanuel Middleton attempts a Layup. Contested by Franz Doncic (3.2 feet, MAN). IMMANUEL MIDDLETON MAKES IT!
Score: 71-107

[07:45] Team_020 possession (Score: 71-107)
Franz Doncic attempts a Midrange. Contested by Immanuel Middleton (5.3 feet, ZONE). FRANZ DONCIC MAKES IT!
Score: 73-107

[07:30] Team_095 possession (Score: 73-107)
Evan Carter drives to the basket... FOUL! Offensive foul on Evan Carter! Terry Simons drew the charge! [Team fouls: 3] (Evan Carter: 2 personal fouls) TURNOVER! (dead ball)

[07:16] Team_020 possession (Score: 73-107)
FOUL! Shooting foul on Immanuel Middleton. Trae Curry to the line for 2 free throws. [Team fouls: 4] (Immanuel Middleton: 1 personal fouls)   FT 1/2: GOOD   FT 2/2: GOOD Trae Curry makes 2/2 from the line.
Score: 75-107

[06:58] Team_095 possession (Score: 75-107)
Kyle Poole attempts a 3Pt. Contested by Bam Leonard (3.8 feet, ZONE). Kyle Poole misses. Rebound secured by Trae Curry.

[06:47] Team_020 possession (Score: 75-107)
Terry Simons attempts a 3Pt. Contested by Kyle Poole (5.2 feet, ZONE). Terry Simons misses. Rebound secured by Shaquille Ball.

[06:33] Team_095 possession (Score: 75-107)
Kyle Poole attempts a 3Pt. Contested by Bam Leonard (3.9 feet, ZONE). Kyle Poole misses. Rebound secured by Trae Curry.

[06:14] Team_020 possession (Score: 75-107)
FOUL! Holding foul on Immanuel Middleton. [IN THE BONUS! 5 team fouls] Bam Leonard to the line for 2 free throws. (Immanuel Middleton: 2 personal fouls)   FT 1/2: MISS   FT 2/2: GOOD Bam Leonard makes 1/2 from the line.
Score: 76-107

[06:05] Team_095 possession (Score: 76-107)
FOUL! Holding foul on James Cunningham. [Team fouls: 4] No free throws, side out. (James Cunningham: 2 personal fouls)

[05:48] Team_095 possession (Score: 76-107)
FOUL! Holding foul on Terry Simons. [IN THE BONUS! 5 team fouls] Evan Carter to the line for 2 free throws. (Terry Simons: 2 personal fouls)   FT 1/2: GOOD   FT 2/2: GOOD Evan Carter makes 2/2 from the line.
Score: 76-109

[05:32] Team_020 possession (Score: 76-109)
James Cunningham attempts a Midrange. Contested by Evan Carter (5.0 feet, ZONE). James Cunningham misses. Rebound secured by Kyle Poole.

[05:17] Team_095 possession (Score: 76-109)
Kyle Poole attempts a Midrange. Contested by Terry Simons (5.8 feet, ZONE). Kyle Poole misses. Rebound secured by Terry Simons.

[05:04] Team_020 possession (Score: 76-109)
Terry Simons attempts a Layup. Contested by Evan Carter (5.4 feet, MAN). TERRY SIMONS MAKES IT! Assist: Franz Doncic
Score: 78-109

[04:55] Team_095 possession (Score: 78-109)
Evan Carter attempts a 3Pt. Contested by Franz Doncic (4.0 feet, ZONE). Evan Carter misses. Rebound secured by Bam Leonard.

[04:42] Team_020 possession (Score: 78-109)
Terry Simons attempts a Layup. Wide open! Immanuel Middleton is 6.5 feet away. [ZONE] TERRY SIMONS MAKES IT! Assist: Trae Curry
Score: 80-109

[04:29] Team_095 possession (Score: 80-109)
Shaquille Ball attempts a Layup. Contested by James Cunningham (5.9 feet, MAN). SHAQUILLE BALL MAKES IT!
Score: 80-111

[04:12] Team_020 possession (Score: 80-111)
James Cunningham attempts a 3Pt. Contested by Shaquille Ball (5.6 feet, MAN). JAMES CUNNINGHAM MAKES IT! Assist: Franz Doncic
Score: 83-111

[03:57] Team_095 possession (Score: 83-111)
Evan Carter drives, Terry Simons stays with him. Evan Carter attempts a Dunk. Contested by Terry Simons (5.7 feet, MAN). Evan Carter misses. Rebound secured by Franz Doncic.

[03:40] Team_020 possession (Score: 83-111)
Bam Leonard attempts a Layup. Wide open! Immanuel Middleton is 6.4 feet away. [MAN] BAM LEONARD MAKES IT! Assist: James Cunningham
Score: 85-111

[03:23] Team_095 possession (Score: 85-111)
Evan Carter drives and kicks out. Kyrie Ming attempts a 3Pt. Wide open! Trae Curry is 6.2 feet away. [MAN] Kyrie Ming misses. Rebound secured by Bam Leonard.

[03:12] Team_020 possession (Score: 85-111)
Franz Doncic attempts a Midrange. Contested by Kyle Poole (4.6 feet, MAN). Franz Doncic misses. Rebound secured by Shaquille Ball.

[02:57] Team_095 possession (Score: 85-111)
Kyle Poole drives, Franz Doncic stays with him. Kyle Poole attempts a Layup. Contested by Franz Doncic (4.5 feet, MAN). Kyle Poole misses. Rebound secured by Trae Curry.

[02:47] Team_020 possession (Score: 85-111)
FOUL! Holding foul on Evan Carter. [IN THE BONUS! 6 team fouls] Terry Simons to the line for 2 free throws. (Evan Carter: 3 personal fouls)   FT 1/2: GOOD   FT 2/2: GOOD Terry Simons makes 2/2 from the line.
Score: 87-111

[02:37] Team_095 possession (Score: 87-111)
Kyrie Ming attempts a Layup. Wide open! Trae Curry is 6.3 feet away. [MAN] KYRIE MING MAKES IT! Assist: Kyle Poole
Score: 87-113

[02:22] Team_020 possession (Score: 87-113)
James Cunningham drives to the basket... James Cunningham loses the ball! Stripped by Shaquille Ball! TURNOVER! (live ball)

[02:07] Team_095 possession (Score: 87-113)
Shaquille Ball drives, picks up James Cunningham. Help arrives from Franz Doncic! Shaquille Ball attempts a Layup. Wide open! Franz Doncic is 6.2 feet away. [MAN] SHAQUILLE BALL MAKES IT! Assist: Kyrie Ming
Score: 87-115

[01:53] Team_020 possession (Score: 87-115)
Trae Curry attempts a Midrange. Wide open! Kyrie Ming is 6.8 feet away. [MAN] TRAE CURRY MAKES IT!
Score: 89-115

[01:42] Team_095 possession (Score: 89-115)
Kyrie Ming attempts a Midrange. Contested by Terry Simons (6.0 feet, ZONE). KYRIE MING MAKES IT!
Score: 89-117

[01:30] Team_020 possession (Score: 89-117)
Franz Doncic drives, Immanuel Middleton stays with him. Franz Doncic attempts a Dunk. Wide open! Immanuel Middleton is 6.3 feet away. [ZONE] Franz Doncic misses. Rebound secured by Evan Carter.

[01:16] Team_095 possession (Score: 89-117)
Evan Carter attempts a 3Pt. Wide open! Terry Simons is 6.1 feet away. [MAN] EVAN CARTER MAKES IT! Assist: Kyle Poole
Score: 89-120

[01:03] Team_020 possession (Score: 89-120)
James Cunningham attempts a Layup. Wide open! Immanuel Middleton is 6.8 feet away. [ZONE] JAMES CUNNINGHAM MAKES IT!
Score: 91-120

[00:45] Team_095 possession (Score: 91-120)
Evan Carter drives, picks up Trae Curry. Help arrives from Franz Doncic! Evan Carter attempts a Dunk. Wide open! Franz Doncic is 6.6 feet away. [ZONE] EVAN CARTER MAKES IT!
Score: 91-122

[00:27] Team_020 possession (Score: 91-122)
Trae Curry attempts a Layup. Wide open! Kyrie Ming is 7.0 feet away. [MAN] Trae Curry misses. Rebound secured by Kyle Poole.

[00:11] Team_095 possession (Score: 91-122)
Immanuel Middleton attempts a Layup. Wide open! Trae Curry is 6.5 feet away. [ZONE] Immanuel Middleton misses. Rebound secured by Bam Leonard.

================================================================================
                              4TH QUARTER COMPLETE                              
================================================================================

4TH QUARTER SCORE: Team_020 31, Team_095 23

BOX SCORE:
================================================================================

Team_020
--------------------------------------------------------------------------------
Player                MIN  PTS  REB  AST  TO      FG   FG%      3P   3P%
--------------------------------------------------------------------------------
James Cunningham       38   11    0    2   0   4/5    80.0     0/0   0.0
Terry Simons           38    9    1    1   0   4/5    80.0     0/0   0.0
Franz Doncic           22    4    1    2   0   2/5    40.0     0/0   0.0
Trae Curry             38    4    4    1   0   2/5    40.0     0/0   0.0
Bam Leonard            38    3    3    0   0   2/2   100.0     0/0   0.0

TEAM: FG: 14/22 (63.6%), 3PT: 3/4 (75.0%), REB: 9 (0 off, 9 def), AST: 6, TO: 1
TEAM FOULS: 5 [Team_095 in BONUS]


Team_095
--------------------------------------------------------------------------------
Player                MIN  PTS  REB  AST  TO      FG   FG%      3P   3P%
--------------------------------------------------------------------------------
Evan Carter            38   10    3    0   0   4/7    57.1     0/0   0.0
Shaquille Ball         38    7    5    0   0   3/3   100.0     0/0   0.0
Kyrie Ming             38    4    0    1   0   2/2   100.0     0/0   0.0
Immanuel Middleton     38    2    0    0   0   1/2    50.0     0/0   0.0
Kyle Poole             22    0    2    2   0   0/5     0.0     0/0   0.0

TEAM: FG: 10/19 (52.6%), 3PT: 2/6 (33.3%), REB: 10 (2 off, 8 def), AST: 3, TO: 4
TEAM FOULS: 6 [Team_020 in BONUS]

================================================================================

================================================================================
                               FULL GAME COMPLETE                               
================================================================================

FINAL SCORE: Team_020 91, Team_095 122

SCORING BY QUARTER:
--------------------------------------------------------------------------------
Team                     Q1     Q2     Q3     Q4    FINAL
--------------------------------------------------------------------------------
Team_020                 24     12     24     31       91
Team_095                 33     28     38     23      122
--------------------------------------------------------------------------------

FULL GAME BOX SCORE:
================================================================================

Team_020
--------------------------------------------------------------------------------
Player                MIN  PTS  REB  AST  TO      FG   FG%      3P   3P%      FT STL BLK
--------------------------------------------------------------------------------
James Cunningham       38   16    0    5   1   6/11   54.5   4/6    66.7   0/0     1   0
Terry Simons           38   19    6    3   2   9/17   52.9   2/8    25.0   5/5     0   0
Bam Leonard            38   10   10    4   3   3/6    50.0   0/0     0.0   2/3     1   0
Trae Curry             38   26   11    1   1   9/14   64.3   0/1     0.0   4/4     0   0
Jarrett McCollum       26    5    0    2   1   4/9    44.4   2/5    40.0   1/3     1   0
Franz Doncic           22    7    1    3   0   3/9    33.3   1/3    33.3   0/0     1   1
Stephen Parker         10    0    0    0   2   0/1     0.0   0/1     0.0   0/0     1   0
Victor Holiday         10    0    0    0   0   0/2     0.0   0/1     0.0   0/0     0   0
Cole Barnes            10    4    4    1   1   2/5    40.0   0/2     0.0   2/2     0   0
Miles Siakam           10    2    3    0   1   1/2    50.0   0/0     0.0   3/4     0   1

TEAM: FG: 39/78 (50.0%), 3PT: 9/27 (33.3%), REB: 37 (10 off, 27 def), AST: 19, TO: 12


Team_095
--------------------------------------------------------------------------------
Player                MIN  PTS  REB  AST  TO      FG   FG%      3P   3P%      FT STL BLK
--------------------------------------------------------------------------------
Shaquille Ball         38   28    9    2   2  11/15   73.3   2/5    40.0   5/6     1   0
Evan Carter            38   20   11    4   1   7/11   63.6   3/5    60.0   5/5     1   1
Immanuel Middleton     38   22    0    3   2  10/15   66.7   3/5    60.0   2/3     1   0
Kyrie Ming             38    9    0    7   1   5/7    71.4   0/0     0.0   1/1     0   1
Dejounte Hyland        26   21   12    1   1   6/9    66.7   3/5    60.0   2/2     0   0
Kyle Poole             22    5    2    3   1   2/7    28.6   1/4    25.0   3/3     0   0
Cade Beal              10    3    0    0   0   2/4    50.0   0/0     0.0   1/2     1   0
Tobias Wagner          10    7    5    1   0   3/4    75.0   1/1   100.0   2/2     0   0
Gary Davis             10    4    3    1   1   2/2   100.0   0/0     0.0   0/0     0   0
DeMar McCollum         10    1    6    2   0   1/5    20.0   0/0     0.0   1/2     0   0

TEAM: FG: 50/80 (62.5%), 3PT: 13/25 (52.0%), REB: 45 (10 off, 35 def), AST: 24, TO: 9

================================================================================
