================================================================================
                        FULL GAME - Team_069 vs Team_067                        
================================================================================

================================================================================
                       1ST QUARTER - Team_069 vs Team_067                       
================================================================================

[12:00] Team_069 possession (Score: 0-0)
Pau Middleton attempts a 3Pt. Contested by Desmond Simmons (4.1 feet, ZONE). Pau Middleton misses. Rebound secured by Desmond Simmons.

[11:45] Team_067 possession (Score: 0-0)
Ben Ball attempts a Midrange. Contested by Domantas Towns (5.4 feet, MAN). Ben Ball misses. Rebound secured by Pau Middleton.

[11:30] Team_069 possession (Score: 0-0)
Domantas Towns drives, picks up Ben Ball. Help arrives from Wendell Antetokounmpo! Domantas Towns attempts a Dunk. Contested by Wendell Antetokounmpo (4.1 feet, MAN). DOMANTAS TOWNS MAKES IT! Assist: CJ Fox
Score: 2-0

[11:17] Team_067 possession (Score: 2-0)
Desmond Simmons attempts a 3Pt. Contested by Pau Middleton (4.1 feet, MAN). Desmond Simmons misses. Rebound secured by Domantas Towns.

[11:01] Team_069 possession (Score: 2-0)
James Sexton attempts a 3Pt. Contested by Desmond Simmons (4.4 feet, ZONE). James Sexton misses. Offensive rebound by Domantas Towns! Domantas Towns kicks it out.

[10:46] Team_069 possession (Score: 2-0)
Pau Middleton attempts a 3Pt. Contested by Desmond Simmons (4.1 feet, ZONE). PAU MIDDLETON MAKES IT!
Score: 5-0

[10:35] Team_067 possession (Score: 5-0)
Malcolm Westbrook makes the Midrange and draws the foul on CJ Fox! And-1! Malcolm Westbrook to the line for 1. [Team fouls: 1] (CJ Fox: 1 personal fouls)   FT 1/1: GOOD Malcolm Westbrook makes 1/1 from the line.
Score: 5-3

[10:20] Team_069 possession (Score: 5-3)
Domantas Towns attempts a Midrange. Contested by Ben Ball (4.1 feet, ZONE). Domantas Towns misses. Rebound secured by Malcolm Westbrook.

[10:06] Team_067 possession (Score: 5-3)
Malcolm Westbrook drives, picks up Domantas Towns. Help arrives from James Sexton! Malcolm Westbrook attempts a Layup. Contested by James Sexton (4.9 feet, ZONE). MALCOLM WESTBROOK MAKES IT!
Score: 5-5

[09:50] Team_069 possession (Score: 5-5)
Pau Middleton loses the ball! Stripped by Desmond Simmons! TURNOVER! (live ball)

[09:36] Team_067 possession (Score: 5-5)
Malcolm Westbrook attempts a Midrange. Contested by Domantas Lowry (4.7 feet, ZONE). Malcolm Westbrook misses. Rebound secured by Domantas Towns.

[09:18] Team_069 possession (Score: 5-5)
Pau Middleton attempts a 3Pt. Contested by Desmond Simmons (4.1 feet, MAN). Pau Middleton misses. Rebound secured by Desmond Simmons.

[09:03] Team_067 possession (Score: 5-5)
FOUL! Shooting foul on Pau Middleton. Desmond Simmons to the line for 2 free throws. [Team fouls: 2] (Pau Middleton: 1 personal fouls)   FT 1/2: GOOD   FT 2/2: GOOD Desmond Simmons makes 2/2 from the line.
Score: 5-7

[08:47] Team_069 possession (Score: 5-7)
Domantas Towns attempts a Midrange. Contested by Desmond Simmons (4.0 feet, ZONE). DOMANTAS TOWNS MAKES IT! Assist: James Sexton
Score: 7-7

[08:35] Team_067 possession (Score: 7-7)
Manu Reaves attempts a 3Pt. Contested by James Sexton (3.7 feet, MAN). Manu Reaves misses. Rebound secured by CJ Fox.

[08:19] Team_069 possession (Score: 7-7)
CJ Fox drives and kicks out. Domantas Towns attempts a 3Pt. Contested by Ben Ball (3.8 feet, MAN). Domantas Towns misses. Rebound secured by Wendell Antetokounmpo.

[08:05] Team_067 possession (Score: 7-7)
Ben Ball drives, Domantas Towns stays with him. Ben Ball attempts a Dunk. Contested by Domantas Towns (5.4 feet, ZONE). Ben Ball misses. Rebound secured by Pau Middleton.

[07:53] Team_069 possession (Score: 7-7)
FOUL! Shooting foul on Manu Reaves. James Sexton to the line for 2 free throws. [Team fouls: 1] (Manu Reaves: 1 personal fouls)   FT 1/2: MISS   FT 2/2: GOOD James Sexton makes 1/2 from the line.
Score: 8-7

[07:34] Team_067 possession (Score: 8-7)
Manu Reaves attempts a 3Pt. Contested by James Sexton (3.7 feet, ZONE). Manu Reaves misses. Rebound secured by Pau Middleton.

[07:21] Team_069 possession (Score: 8-7)
Domantas Towns attempts a Midrange. Contested by Ben Ball (4.1 feet, ZONE). DOMANTAS TOWNS MAKES IT!
Score: 10-7

[07:07] Team_067 possession (Score: 10-7)
Malcolm Westbrook attempts a 3Pt. Contested by James Sexton (3.7 feet, ZONE). Malcolm Westbrook misses. Rebound secured by CJ Fox.

[06:53] Team_069 possession (Score: 10-7)
James Sexton attempts a Layup. Contested by Manu Reaves (4.5 feet, MAN). JAMES SEXTON MAKES IT! Assist: Domantas Towns
Score: 12-7

[06:36] Team_067 possession (Score: 12-7)
Desmond Simmons attempts a Midrange. Contested by Pau Middleton (4.1 feet, MAN). DESMOND SIMMONS MAKES IT!
Score: 12-9

[06:20] Team_069 possession (Score: 12-9)
James Sexton attempts a Midrange. Contested by Ben Ball (4.5 feet, ZONE). JAMES SEXTON MAKES IT!
Score: 14-9

[06:07] Team_067 possession (Score: 14-9)
Desmond Simmons attempts a 3Pt. Contested by Pau Middleton (4.1 feet, MAN). Desmond Simmons misses. Rebound secured by Domantas Towns.

[05:53] Team_069 possession (Score: 14-9)
CJ Fox attempts a Midrange. Contested by Wendell Antetokounmpo (4.6 feet, ZONE). CJ Fox misses. Rebound secured by Desmond Simmons.

[05:40] Team_067 possession (Score: 14-9)
Malcolm Westbrook attempts a Midrange. Contested by CJ Fox (5.7 feet, MAN). Malcolm Westbrook misses. FOUL! Loose ball foul on Domantas Towns during the rebound battle. [Team fouls: 3] No free throws, side out. (Domantas Towns: 1 personal fouls)

[05:28] Team_067 possession (Score: 14-9)
Wendell Antetokounmpo attempts a Midrange. Contested by Domantas Lowry (4.7 feet, MAN). WENDELL ANTETOKOUNMPO MAKES IT!
Score: 14-11

[05:13] Team_069 possession (Score: 14-11)
James Sexton drives, picks up Malcolm Westbrook. Help arrives from Wendell Antetokounmpo! James Sexton attempts a Layup. Contested by Wendell Antetokounmpo (4.6 feet, ZONE). James Sexton misses. Offensive rebound by Domantas Towns! Domantas Towns kicks it out.

[05:00] Team_069 possession (Score: 14-11)
FOUL! Shooting foul on Malcolm Westbrook. Domantas Towns to the line for 2 free throws. [Team fouls: 2] (Malcolm Westbrook: 1 personal fouls)   FT 1/2: GOOD   FT 2/2: GOOD Domantas Towns makes 2/2 from the line.
Score: 16-11

[04:43] Team_067 possession (Score: 16-11)
Wendell Antetokounmpo attempts a 3Pt. Contested by Domantas Lowry (4.7 feet, MAN). Wendell Antetokounmpo misses. Rebound secured by CJ Fox.

[04:33] Team_069 possession (Score: 16-11)
Domantas Lowry attempts a 3Pt. Contested by Desmond Simmons (3.8 feet, ZONE). Domantas Lowry misses. Offensive rebound by Domantas Towns! Domantas Towns kicks it out.

[04:20] Team_069 possession (Score: 16-11)
CJ Fox drives, Malcolm Westbrook stays with him. CJ Fox attempts a Dunk. Contested by Malcolm Westbrook (4.3 feet, MAN). CJ Fox misses. Rebound secured by Desmond Simmons.

[04:04] Team_067 possession (Score: 16-11)
FOUL! Holding foul on CJ Fox. [Team fouls: 4] No free throws, side out. (CJ Fox: 2 personal fouls)

[03:50] Team_067 possession (Score: 16-11)
Ben Ball drives to the basket... Ben Ball loses the ball! Stripped by Domantas Towns! TURNOVER! (live ball)

[03:32] Team_069 possession (Score: 16-11)
Domantas Towns attempts a 3Pt. Contested by Desmond Simmons (4.1 feet, ZONE). Domantas Towns misses. Rebound secured by Manu Reaves.

[03:15] Team_067 possession (Score: 16-11)
Ben Ball makes the Dunk and draws the foul on Domantas Towns! And-1! Ben Ball to the line for 1. [BONUS: 5 team fouls] (Domantas Towns: 2 personal fouls)   FT 1/1: GOOD Ben Ball makes 1/1 from the line.
Score: 16-14

[02:57] Team_069 possession (Score: 16-14)
Domantas Towns drives, Malcolm Westbrook stays with him. Domantas Towns attempts a Layup. Contested by Malcolm Westbrook (4.4 feet, ZONE). Domantas Towns misses. Rebound secured by Malcolm Westbrook.

[02:43] Team_067 possession (Score: 16-14)
Ben Ball attempts a 3Pt. Contested by James Sexton (4.4 feet, ZONE). Ben Ball misses. Rebound secured by Pau Middleton.

[02:28] Team_069 possession (Score: 16-14)
James Sexton drives and kicks out. Domantas Lowry attempts a 3Pt. Contested by Ben Ball (4.1 feet, ZONE). Domantas Lowry misses. Rebound secured by Manu Reaves.

[02:13] Team_067 possession (Score: 16-14)
Manu Reaves attempts a 3Pt. Contested by James Sexton (4.0 feet, ZONE). Manu Reaves misses. Rebound secured by CJ Fox.

[01:57] Team_069 possession (Score: 16-14)
Domantas Towns attempts a Layup. BLOCKED BY BEN BALL! Ball goes out off Ben Ball. Domantas Towns's ball!

[01:44] Team_069 possession (Score: 16-14)
Domantas Towns attempts a 3Pt. Contested by Ben Ball (4.4 feet, MAN). DOMANTAS TOWNS MAKES IT!
Score: 19-14

[01:26] Team_067 possession (Score: 19-14)
Manu Reaves drives, Domantas Towns stays with him. Manu Reaves attempts a Dunk. Contested by Domantas Towns (5.4 feet, ZONE). MANU REAVES MAKES IT! Assist: Ben Ball
Score: 19-16

[01:13] Team_069 possession (Score: 19-16)
Domantas Lowry throws a bad pass! Stolen by Wendell Antetokounmpo! TURNOVER! (live ball)

[01:00] Team_067 possession (Score: 19-16)
Desmond Simmons attempts a 3Pt. Contested by James Sexton (4.0 feet, ZONE). Desmond Simmons misses. Rebound secured by Pau Middleton.

[00:46] Team_069 possession (Score: 19-16)
Domantas Lowry drives and kicks out. Pau Middleton attempts a Midrange. Contested by Malcolm Westbrook (4.5 feet, ZONE). Pau Middleton misses. Offensive rebound by CJ Fox! CJ Fox kicks it out.

[00:35] Team_069 possession (Score: 19-16)
FOUL! Shooting foul on Desmond Simmons. James Sexton to the line for 2 free throws. [Team fouls: 3] (Desmond Simmons: 1 personal fouls)   FT 1/2: GOOD   FT 2/2: GOOD James Sexton makes 2/2 from the line.
Score: 21-16

[00:24] Team_067 possession (Score: 21-16)
Malcolm Westbrook drives to the basket... Malcolm Westbrook loses control! Ball rolls out of bounds! TURNOVER! (dead ball)

[00:24] Substitution (Team_069): James Sexton OUT → Jarrett Murray IN (stamina_rule2)

[00:24] Substitution (Team_069): Domantas Lowry OUT → Trae Antetokounmpo IN (stamina_rule2)

[00:24] Substitution (Team_069): Pau Middleton OUT → Tyrese Simons IN (stamina_rule2)

[00:24] Substitution (Team_069): Domantas Towns OUT → Devin Giddey IN (stamina_rule2)

[00:24] Substitution (Team_069): CJ Fox OUT → Shai Quickley IN (stamina_rule2)

[00:24] Substitution (Team_067): Manu Reaves OUT → James Rozier IN (stamina_rule2)

[00:24] Substitution (Team_067): Wendell Antetokounmpo OUT → Anfernee Wagner IN (stamina_rule2)

[00:24] Substitution (Team_067): Desmond Simmons OUT → Kyle Leonard IN (stamina_rule2)

[00:24] Substitution (Team_067): Ben Ball OUT → Kristaps Davis IN (stamina_rule2)

[00:24] Substitution (Team_067): Malcolm Westbrook OUT → Zach DeRozan IN (stamina_rule2)

[00:10] Team_069 possession (Score: 21-16)
Trae Antetokounmpo attempts a 3Pt. Contested by Kristaps Davis (4.5 feet, ZONE). Trae Antetokounmpo misses. Offensive rebound by Shai Quickley! Shai Quickley puts it back in!
Score: 23-16

================================================================================
                              1ST QUARTER COMPLETE                              
================================================================================

1ST QUARTER SCORE: Team_069 23, Team_067 16

BOX SCORE:
================================================================================

Team_069
--------------------------------------------------------------------------------
Player                MIN  PTS  REB  AST  TO      FG   FG%      3P   3P%
--------------------------------------------------------------------------------
Domantas Towns         12   11    6    1   0   5/8    62.5     0/0   0.0
James Sexton           12    7    0    1   0   4/5    80.0     0/0   0.0
Pau Middleton          12    3    5    0   0   1/3    33.3     0/0   0.0
Shai Quickley           0    2    1    0   0   1/1   100.0     0/0   0.0
CJ Fox                 12    0    5    1   0   0/3     0.0     0/0   0.0

TEAM: FG: 11/20 (55.0%), 3PT: 3/6 (50.0%), REB: 17 (5 off, 12 def), AST: 3, TO: 2
TEAM FOULS: 5 [Team_067 in BONUS]


Team_067
--------------------------------------------------------------------------------
Player                MIN  PTS  REB  AST  TO      FG   FG%      3P   3P%
--------------------------------------------------------------------------------
Malcolm Westbrook      12    5    3    0   0   2/4    50.0     0/0   0.0
Desmond Simmons        12    4    4    0   0   2/5    40.0     0/0   0.0
Ben Ball               12    3    0    1   0   1/4    25.0     0/0   0.0
Manu Reaves            12    2    2    0   0   1/4    25.0     0/0   0.0
Wendell Antetokounmpo   12    2    1    0   0   1/2    50.0     0/0   0.0

TEAM: FG: 7/19 (36.8%), 3PT: 0/9 (0.0%), REB: 10 (1 off, 9 def), AST: 1, TO: 2
TEAM FOULS: 3

================================================================================

================================================================================
                       2ND QUARTER - Team_069 vs Team_067                       
================================================================================

[12:00] Team_069 possession (Score: 23-16)
Domantas Towns attempts a 3Pt. Contested by Desmond Simmons (4.2 feet, ZONE). Domantas Towns misses. Offensive rebound by CJ Fox! CJ Fox kicks it out.

[11:45] Team_069 possession (Score: 23-16)
FOUL! Holding foul on Ben Ball. [Team fouls: 1] No free throws, side out. (Ben Ball: 1 personal fouls)

[11:34] Team_069 possession (Score: 23-16)
Domantas Lowry attempts a 3Pt. Contested by Desmond Simmons (3.9 feet, ZONE). DOMANTAS LOWRY MAKES IT! Assist: Pau Middleton
Score: 26-16

[11:17] Team_067 possession (Score: 26-16)
Wendell Antetokounmpo attempts a Midrange. Contested by Domantas Lowry (4.9 feet, MAN). Wendell Antetokounmpo misses. Offensive rebound by Malcolm Westbrook! Malcolm Westbrook puts it back in!
Score: 26-18

[11:01] Team_069 possession (Score: 26-18)
Domantas Towns attempts a Midrange. Contested by Ben Ball (4.5 feet, MAN). DOMANTAS TOWNS MAKES IT! Assist: James Sexton
Score: 28-18

[10:47] Team_067 possession (Score: 28-18)
Ben Ball drives and kicks out. Ben Ball attempts a Midrange. Contested by Domantas Towns (5.1 feet, MAN). BEN BALL MAKES IT!
Score: 28-20

[10:31] Team_069 possession (Score: 28-20)
James Sexton attempts a Midrange. Contested by Manu Reaves (5.0 feet, MAN). James Sexton misses. Rebound secured by Malcolm Westbrook.

[10:15] Team_067 possession (Score: 28-20)
FOUL! Reach-in foul on Domantas Towns during the drive. [Team fouls: 1] No free throws, side out. (Domantas Towns: 1 personal fouls)

[10:01] Team_067 possession (Score: 28-20)
Wendell Antetokounmpo attempts a 3Pt. Contested by James Sexton (4.2 feet, ZONE). WENDELL ANTETOKOUNMPO MAKES IT! Assist: Desmond Simmons
Score: 28-23

[09:51] Team_069 possession (Score: 28-23)
Pau Middleton attempts a Layup. BLOCKED BY WENDELL ANTETOKOUNMPO! Ball is loose! Offensive rebound by Domantas Towns! Domantas Towns kicks it out.

[09:39] Team_069 possession (Score: 28-23)
Pau Middleton attempts a Midrange. Contested by Manu Reaves (4.8 feet, ZONE). Pau Middleton misses. Rebound secured by Manu Reaves.

[09:28] Team_067 possession (Score: 28-23)
Malcolm Westbrook drives to the basket... Malcolm Westbrook loses the ball! Stripped by Domantas Towns! TURNOVER! (live ball)

[09:11] Team_069 possession (Score: 28-23)
Domantas Lowry attempts a 3Pt. Contested by Desmond Simmons (4.2 feet, ZONE). Domantas Lowry misses. Rebound secured by Desmond Simmons.

[08:54] Team_067 possession (Score: 28-23)
FOUL! Reach-in foul on Domantas Towns during the drive. [Team fouls: 2] No free throws, side out. (Domantas Towns: 2 personal fouls)

[08:40] Team_067 possession (Score: 28-23)
Malcolm Westbrook attempts a Layup. Wide open! CJ Fox is 6.1 feet away. [MAN] Malcolm Westbrook misses. Rebound secured by CJ Fox.

[08:25] Team_069 possession (Score: 28-23)
Domantas Lowry drives and kicks out. Pau Middleton attempts a 3Pt. Contested by Desmond Simmons (4.4 feet, ZONE). PAU MIDDLETON MAKES IT! Assist: CJ Fox
Score: 31-23

[08:10] Team_067 possession (Score: 31-23)
Wendell Antetokounmpo throws a bad pass out of bounds! TURNOVER! (dead ball)

[08:10] Substitution (Team_069): James Sexton OUT → Jarrett Murray IN (stamina_rule2)

[08:10] Substitution (Team_069): Domantas Lowry OUT → Trae Antetokounmpo IN (stamina_rule2)

[08:10] Substitution (Team_069): Pau Middleton OUT → Tyrese Simons IN (stamina_rule2)

[08:10] Substitution (Team_069): Domantas Towns OUT → Devin Giddey IN (stamina_rule2)

[08:10] Substitution (Team_069): CJ Fox OUT → Shai Quickley IN (stamina_rule2)

[08:10] Substitution (Team_067): Manu Reaves OUT → James Rozier IN (stamina_rule2)

[08:10] Substitution (Team_067): Wendell Antetokounmpo OUT → Anfernee Wagner IN (stamina_rule2)

[08:10] Substitution (Team_067): Desmond Simmons OUT → Kyle Leonard IN (stamina_rule2)

[08:10] Substitution (Team_067): Ben Ball OUT → Kristaps Davis IN (stamina_rule2)

[08:10] Substitution (Team_067): Malcolm Westbrook OUT → Zach DeRozan IN (stamina_rule2)

[07:57] Team_069 possession (Score: 31-23)
FOUL! Shooting foul on James Rozier. Jarrett Murray to the line for 2 free throws. [Team fouls: 2] (James Rozier: 1 personal fouls)   FT 1/2: MISS   FT 2/2: GOOD Jarrett Murray makes 1/2 from the line.
Score: 32-23

[07:41] Team_067 possession (Score: 32-23)
James Rozier attempts a Layup. BLOCKED BY TRAE ANTETOKOUNMPO! Ball is loose! Offensive rebound by Kristaps Davis! Kristaps Davis kicks it out.

[07:28] Team_067 possession (Score: 32-23)
Zach DeRozan attempts a Midrange. Contested by Shai Quickley (4.2 feet, MAN). Zach DeRozan misses. Rebound secured by Tyrese Simons.

[07:12] Team_069 possession (Score: 32-23)
Jarrett Murray drives and kicks out. Jarrett Murray attempts a Midrange. Contested by Kristaps Davis (4.3 feet, ZONE). Jarrett Murray misses. Offensive rebound by Tyrese Simons! Tyrese Simons kicks it out.

[06:58] Team_069 possession (Score: 32-23)
Trae Antetokounmpo attempts a 3Pt. Contested by Anfernee Wagner (3.9 feet, ZONE). Trae Antetokounmpo misses. Offensive rebound by Shai Quickley! Shai Quickley's putback is no good. Rebound secured by Zach DeRozan.

[06:41] Team_067 possession (Score: 32-23)
Kristaps Davis makes the Layup and draws the foul on Devin Giddey! And-1! Kristaps Davis to the line for 1. [Team fouls: 4] (Devin Giddey: 1 personal fouls)   FT 1/1: GOOD Kristaps Davis makes 1/1 from the line.
Score: 32-26

[06:24] Team_069 possession (Score: 32-26)
Trae Antetokounmpo drives, Anfernee Wagner stays with him. Trae Antetokounmpo attempts a Layup. Contested by Anfernee Wagner (3.9 feet, MAN). Trae Antetokounmpo misses. Offensive rebound by Shai Quickley! Shai Quickley puts it back in!
Score: 34-26

[06:11] Team_067 possession (Score: 34-26)
James Rozier attempts a 3Pt. Contested by Jarrett Murray (5.3 feet, MAN). James Rozier misses. Rebound secured by Trae Antetokounmpo.

[06:00] Team_069 possession (Score: 34-26)
Trae Antetokounmpo makes the Layup and draws the foul on Anfernee Wagner! And-1! Trae Antetokounmpo to the line for 1. [Team fouls: 3] (Anfernee Wagner: 1 personal fouls)   FT 1/1: GOOD Trae Antetokounmpo makes 1/1 from the line.
Score: 37-26

[05:44] Team_067 possession (Score: 37-26)
Anfernee Wagner attempts a Midrange. Contested by Trae Antetokounmpo (5.3 feet, MAN). Anfernee Wagner misses. Rebound secured by Shai Quickley.

[05:28] Team_069 possession (Score: 37-26)
Devin Giddey makes the Layup and draws the foul on Kristaps Davis! And-1! Devin Giddey to the line for 1. [Team fouls: 4] (Kristaps Davis: 1 personal fouls)   FT 1/1: MISS Devin Giddey makes 0/1 from the line. Offensive rebound by Tyrese Simons! Tyrese Simons kicks it out.
Score: 39-26

[05:14] Team_069 possession (Score: 39-26)
Tyrese Simons drives, Kristaps Davis stays with him. Tyrese Simons attempts a Dunk. Contested by Kristaps Davis (4.6 feet, ZONE). TYRESE SIMONS MAKES IT! Assist: Jarrett Murray
Score: 41-26

[04:57] Team_067 possession (Score: 41-26)
Kyle Leonard drives, Tyrese Simons stays with him. Kyle Leonard attempts a Layup. Contested by Tyrese Simons (5.6 feet, MAN). Kyle Leonard misses. Offensive rebound by Zach DeRozan! Zach DeRozan kicks it out.

[04:47] Team_067 possession (Score: 41-26)
Zach DeRozan attempts a Midrange. Contested by Shai Quickley (4.2 feet, MAN). ZACH DEROZAN MAKES IT!
Score: 41-28

[04:36] Team_069 possession (Score: 41-28)
FOUL! Holding foul on Kristaps Davis. [IN THE BONUS! 5 team fouls] Devin Giddey to the line for 2 free throws. (Kristaps Davis: 2 personal fouls)   FT 1/2: GOOD   FT 2/2: MISS Devin Giddey makes 1/2 from the line. Offensive rebound by Shai Quickley! Shai Quickley puts it back in!
Score: 44-28

[04:20] Team_067 possession (Score: 44-28)
Zach DeRozan attempts a Layup. Contested by Shai Quickley (4.2 feet, MAN). Zach DeRozan misses. Rebound secured by Shai Quickley.

[04:07] Team_069 possession (Score: 44-28)
Jarrett Murray attempts a Midrange. Contested by James Rozier (4.4 feet, ZONE). Jarrett Murray misses. FOUL! Loose ball foul on Anfernee Wagner during the rebound battle. [IN THE BONUS! 6 team fouls] Tyrese Simons to the line for 2 free throws. (Anfernee Wagner: 2 personal fouls)   FT 1/2: GOOD   FT 2/2: GOOD Tyrese Simons makes 2/2 from the line.
Score: 46-28

[03:57] Team_067 possession (Score: 46-28)
Anfernee Wagner attempts a Layup. BLOCKED BY DEVIN GIDDEY! Ball is loose! Rebound secured by Trae Antetokounmpo.

[03:41] Team_069 possession (Score: 46-28)
Tyrese Simons attempts a 3Pt. Contested by Anfernee Wagner (4.0 feet, ZONE). Tyrese Simons misses. Rebound secured by Kristaps Davis.

[03:28] Team_067 possession (Score: 46-28)
Anfernee Wagner attempts a Midrange. Contested by Devin Giddey (5.0 feet, ZONE). ANFERNEE WAGNER MAKES IT!
Score: 46-30

[03:17] Team_069 possession (Score: 46-30)
Tyrese Simons drives and kicks out. Shai Quickley attempts a Midrange. Contested by Kyle Leonard (3.7 feet, ZONE). Shai Quickley misses. Rebound secured by Zach DeRozan.

[03:02] Team_067 possession (Score: 46-30)
Zach DeRozan attempts a Midrange. Contested by Shai Quickley (4.2 feet, MAN). Zach DeRozan misses. FOUL! Loose ball foul on Tyrese Simons during the rebound battle. [IN THE BONUS! 5 team fouls] Kristaps Davis to the line for 2 free throws. (Tyrese Simons: 1 personal fouls)   FT 1/2: GOOD   FT 2/2: MISS Kristaps Davis makes 1/2 from the line. Offensive rebound by Zach DeRozan! Zach DeRozan kicks it out.
Score: 46-31

[02:45] Team_067 possession (Score: 46-31)
Zach DeRozan attempts a 3Pt. Contested by Shai Quickley (4.2 feet, MAN). Zach DeRozan misses. Rebound secured by Shai Quickley.

[02:31] Team_069 possession (Score: 46-31)
Trae Antetokounmpo drives to the basket... Trae Antetokounmpo throws a bad pass out of bounds! TURNOVER! (dead ball)

[02:14] Team_067 possession (Score: 46-31)
James Rozier attempts a 3Pt. Contested by Jarrett Murray (5.3 feet, MAN). James Rozier misses. Rebound secured by Shai Quickley.

[01:58] Team_069 possession (Score: 46-31)
Tyrese Simons attempts a 3Pt. Contested by James Rozier (4.4 feet, ZONE). TYRESE SIMONS MAKES IT! Assist: Devin Giddey
Score: 49-31

[01:41] Team_067 possession (Score: 49-31)
FOUL! Shooting foul on Devin Giddey. Kristaps Davis to the line for 2 free throws. [BONUS: 6 team fouls] (Devin Giddey: 2 personal fouls)   FT 1/2: MISS   FT 2/2: GOOD Kristaps Davis makes 1/2 from the line.
Score: 49-32

[01:32] Team_069 possession (Score: 49-32)
FOUL! Reach-in foul on Kristaps Davis during the drive. [IN THE BONUS! 7 team fouls] Jarrett Murray to the line for 2 free throws. (Kristaps Davis: 3 personal fouls)   FT 1/2: MISS   FT 2/2: MISS Jarrett Murray makes 0/2 from the line. Rebound secured by Kristaps Davis.

[01:17] Team_067 possession (Score: 49-32)
James Rozier loses control! Ball rolls out of bounds! TURNOVER! (dead ball)

[01:05] Team_069 possession (Score: 49-32)
Trae Antetokounmpo attempts a 3Pt. Contested by Anfernee Wagner (3.9 feet, ZONE). Trae Antetokounmpo misses. Rebound secured by Anfernee Wagner.

[00:51] Team_067 possession (Score: 49-32)
FOUL! Holding foul on Jarrett Murray. [IN THE BONUS! 7 team fouls] James Rozier to the line for 2 free throws. (Jarrett Murray: 1 personal fouls)   FT 1/2: GOOD   FT 2/2: GOOD James Rozier makes 2/2 from the line.
Score: 49-34

[00:37] Team_069 possession (Score: 49-34)
Devin Giddey attempts a 3Pt. Contested by Anfernee Wagner (3.6 feet, ZONE). DEVIN GIDDEY MAKES IT! Assist: Jarrett Murray
Score: 52-34

[00:19] Team_067 possession (Score: 52-34)
Zach DeRozan attempts a 3Pt. Contested by Tyrese Simons (5.3 feet, ZONE). Zach DeRozan misses. Offensive rebound by Kristaps Davis! Kristaps Davis's putback is no good. Offensive rebound by Zach DeRozan! Zach DeRozan kicks it out.

================================================================================
                              2ND QUARTER COMPLETE                              
================================================================================

2ND QUARTER SCORE: Team_069 29, Team_067 18

BOX SCORE:
================================================================================

Team_069
--------------------------------------------------------------------------------
Player                MIN  PTS  REB  AST  TO      FG   FG%      3P   3P%
--------------------------------------------------------------------------------
Tyrese Simons           8    7    3    0   0   3/5    60.0     0/0   0.0
Shai Quickley           8    5    5    0   0   2/2   100.0     0/0   0.0
Domantas Lowry         16    3    0    0   0   1/2    50.0     0/0   0.0
Pau Middleton          16    3    0    1   0   1/2    50.0     0/0   0.0
Trae Antetokounmpo      8    3    2    0   0   1/3    33.3     0/0   0.0
Devin Giddey            8    3    0    1   0   1/1   100.0     0/0   0.0
Domantas Towns         16    2    1    0   0   1/1   100.0     0/0   0.0
Jarrett Murray          8    1    0    2   0   1/2    50.0     0/0   0.0
CJ Fox                 16    0    2    1   0   0/0     0.0     0/0   0.0
James Sexton           16    0    0    1   0   0/1     0.0     0/0   0.0

TEAM: FG: 11/19 (57.9%), 3PT: 3/7 (42.9%), REB: 14 (6 off, 8 def), AST: 6, TO: 1
TEAM FOULS: 7 [Team_067 in BONUS]


Team_067
--------------------------------------------------------------------------------
Player                MIN  PTS  REB  AST  TO      FG   FG%      3P   3P%
--------------------------------------------------------------------------------
Kristaps Davis          8    4    3    0   0   2/2   100.0     0/0   0.0
Wendell Antetokounmpo   16    3    0    0   0   1/1   100.0     0/0   0.0
Malcolm Westbrook      16    2    2    0   0   1/2    50.0     0/0   0.0
Ben Ball               16    2    0    0   0   1/1   100.0     0/0   0.0
Zach DeRozan            8    2    5    0   0   1/4    25.0     0/0   0.0
James Rozier            8    2    0    0   0   1/3    33.3     0/0   0.0
Anfernee Wagner         8    2    1    0   0   1/3    33.3     0/0   0.0
Desmond Simmons        16    0    1    1   0   0/0     0.0     0/0   0.0
Manu Reaves            16    0    1    0   0   0/0     0.0     0/0   0.0

TEAM: FG: 8/16 (50.0%), 3PT: 1/4 (25.0%), REB: 12 (5 off, 7 def), AST: 1, TO: 3
TEAM FOULS: 7 [Team_069 in BONUS]

================================================================================

================================================================================
                       3RD QUARTER - Team_069 vs Team_067                       
================================================================================

[12:00] Team_069 possession (Score: 52-34)
Domantas Lowry attempts a Midrange. Contested by Wendell Antetokounmpo (4.4 feet, ZONE). DOMANTAS LOWRY MAKES IT!
Score: 54-34

[11:49] Team_067 possession (Score: 54-34)
Manu Reaves attempts a Midrange. Contested by James Sexton (3.7 feet, MAN). Manu Reaves misses. FOUL! Loose ball foul on Domantas Towns during the rebound battle. [Team fouls: 1] No free throws, side out. (Domantas Towns: 1 personal fouls)

[11:37] Team_067 possession (Score: 54-34)
Ben Ball attempts a 3Pt. Contested by Domantas Towns (5.4 feet, ZONE). Ben Ball misses. Rebound secured by CJ Fox.

[11:24] Team_069 possession (Score: 54-34)
CJ Fox drives and kicks out. Pau Middleton attempts a Midrange. Contested by Ben Ball (3.8 feet, ZONE). Pau Middleton misses. Rebound secured by Desmond Simmons.

[11:07] Team_067 possession (Score: 54-34)
Ben Ball attempts a 3Pt. Contested by James Sexton (4.2 feet, ZONE). BEN BALL MAKES IT! Assist: Wendell Antetokounmpo
Score: 54-37

[10:51] Team_069 possession (Score: 54-37)
Domantas Towns drives, Malcolm Westbrook stays with him. Domantas Towns attempts a Dunk. Contested by Malcolm Westbrook (4.2 feet, ZONE). Domantas Towns misses. Rebound secured by Desmond Simmons.

[10:38] Team_067 possession (Score: 54-37)
Desmond Simmons throws a bad pass out of bounds! TURNOVER! (dead ball)

[10:22] Team_069 possession (Score: 54-37)
Pau Middleton attempts a 3Pt. Contested by Desmond Simmons (4.1 feet, MAN). Pau Middleton misses. Rebound secured by Malcolm Westbrook.

[10:07] Team_067 possession (Score: 54-37)
Manu Reaves drives, James Sexton stays with him. Manu Reaves attempts a Layup. Contested by James Sexton (3.7 feet, MAN). MANU REAVES MAKES IT! Assist: Desmond Simmons
Score: 54-39

[09:56] Team_069 possession (Score: 54-39)
Pau Middleton attempts a Midrange. Contested by Desmond Simmons (4.1 feet, MAN). Pau Middleton misses. Rebound secured by Malcolm Westbrook.

[09:36] Team_067 possession (Score: 54-39)
FOUL! Reach-in foul on James Sexton during the drive. [Team fouls: 2] No free throws, side out. (James Sexton: 1 personal fouls)

[09:23] Team_067 possession (Score: 54-39)
FOUL! Reach-in foul on Domantas Towns during the drive. [Team fouls: 3] No free throws, side out. (Domantas Towns: 2 personal fouls)

[09:12] Team_067 possession (Score: 54-39)
Wendell Antetokounmpo drives, Domantas Lowry stays with him. Wendell Antetokounmpo attempts a Dunk. Contested by Domantas Lowry (4.7 feet, MAN). Wendell Antetokounmpo misses. Offensive rebound by Malcolm Westbrook! Malcolm Westbrook puts it back in!
Score: 54-41

[08:54] Team_069 possession (Score: 54-41)
CJ Fox attempts a Midrange. Contested by Ben Ball (4.1 feet, ZONE). CJ Fox misses. Rebound secured by Desmond Simmons.

[08:38] Team_067 possession (Score: 54-41)
Wendell Antetokounmpo attempts a 3Pt. Contested by Domantas Towns (4.9 feet, ZONE). Wendell Antetokounmpo misses. Offensive rebound by Malcolm Westbrook! Malcolm Westbrook puts it back in!
Score: 54-43

[08:25] Team_069 possession (Score: 54-43)
FOUL! Shooting foul on Malcolm Westbrook. CJ Fox to the line for 2 free throws. [Team fouls: 1] (Malcolm Westbrook: 1 personal fouls)   FT 1/2: GOOD   FT 2/2: GOOD CJ Fox makes 2/2 from the line.
Score: 56-43

[08:14] Team_067 possession (Score: 56-43)
Wendell Antetokounmpo attempts a 3Pt. Contested by James Sexton (3.7 feet, ZONE). Wendell Antetokounmpo misses. Rebound secured by CJ Fox.

[07:58] Team_069 possession (Score: 56-43)
Domantas Towns throws a bad pass out of bounds! TURNOVER! (dead ball)

[07:40] Team_067 possession (Score: 56-43)
Manu Reaves attempts a Midrange. Contested by James Sexton (3.7 feet, MAN). Manu Reaves misses. Rebound secured by Pau Middleton.

[07:22] Team_069 possession (Score: 56-43)
FOUL! Shooting foul on Malcolm Westbrook. Pau Middleton to the line for 2 free throws. [Team fouls: 2] (Malcolm Westbrook: 2 personal fouls)   FT 1/2: GOOD   FT 2/2: GOOD Pau Middleton makes 2/2 from the line.
Score: 58-43

[07:05] Team_067 possession (Score: 58-43)
FOUL! Shooting foul on Domantas Towns. Ben Ball to the line for 3 free throws. [Team fouls: 4] (Domantas Towns: 3 personal fouls)   FT 1/3: GOOD   FT 2/3: GOOD   FT 3/3: GOOD Ben Ball makes 3/3 from the line.
Score: 58-46

[06:50] Team_069 possession (Score: 58-46)
CJ Fox attempts a 3Pt. Contested by Desmond Simmons (4.0 feet, ZONE). CJ Fox misses. Rebound secured by Desmond Simmons.

[06:37] Team_067 possession (Score: 58-46)
Ben Ball attempts a 3Pt. Contested by Domantas Towns (5.4 feet, MAN). Ben Ball misses. Rebound secured by Pau Middleton.

[06:25] Team_069 possession (Score: 58-46)
Domantas Lowry attempts a 3Pt. Contested by Wendell Antetokounmpo (4.4 feet, ZONE). Domantas Lowry misses. Rebound secured by Desmond Simmons.

[06:08] Team_067 possession (Score: 58-46)
Malcolm Westbrook drives, picks up CJ Fox. Help arrives from James Sexton! Malcolm Westbrook attempts a Dunk. Contested by James Sexton (5.7 feet, MAN). Malcolm Westbrook misses. Rebound secured by CJ Fox.

[05:54] Team_069 possession (Score: 58-46)
Domantas Lowry attempts a Layup. Contested by Wendell Antetokounmpo (4.4 feet, MAN). DOMANTAS LOWRY MAKES IT!
Score: 60-46

[05:40] Team_067 possession (Score: 60-46)
Manu Reaves attempts a Midrange. Contested by James Sexton (3.7 feet, MAN). Manu Reaves misses. Rebound secured by Pau Middleton.

[05:22] Team_069 possession (Score: 60-46)
Domantas Towns attempts a Layup. Contested by Ben Ball (4.1 feet, ZONE). DOMANTAS TOWNS MAKES IT! Assist: Pau Middleton
Score: 62-46

[05:09] Team_067 possession (Score: 62-46)
Malcolm Westbrook attempts a Midrange. Contested by CJ Fox (5.7 feet, MAN). Malcolm Westbrook misses. Rebound secured by CJ Fox.

[04:56] Team_069 possession (Score: 62-46)
Pau Middleton makes the Layup and draws the foul on Malcolm Westbrook! And-1! Pau Middleton to the line for 1. [Team fouls: 3] (Malcolm Westbrook: 3 personal fouls)   FT 1/1: GOOD Pau Middleton makes 1/1 from the line.
Score: 65-46

[04:44] Team_067 possession (Score: 65-46)
Ben Ball attempts a 3Pt. Contested by Domantas Towns (5.5 feet, MAN). BEN BALL MAKES IT!
Score: 65-49

[04:29] Team_069 possession (Score: 65-49)
Domantas Lowry drives, picks up Malcolm Westbrook. Help arrives from Wendell Antetokounmpo! Domantas Lowry attempts a Dunk. Contested by Wendell Antetokounmpo (4.0 feet, ZONE). Domantas Lowry misses. Rebound secured by Wendell Antetokounmpo.

[04:13] Team_067 possession (Score: 65-49)
Malcolm Westbrook makes the Layup and draws the foul on CJ Fox! And-1! Malcolm Westbrook to the line for 1. [BONUS: 5 team fouls] (CJ Fox: 1 personal fouls)   FT 1/1: GOOD Malcolm Westbrook makes 1/1 from the line.
Score: 65-52

[03:59] Team_069 possession (Score: 65-52)
FOUL! Shooting foul on Wendell Antetokounmpo. Domantas Lowry to the line for 2 free throws. [Team fouls: 4] (Wendell Antetokounmpo: 1 personal fouls)   FT 1/2: GOOD   FT 2/2: MISS Domantas Lowry makes 1/2 from the line. FOUL! Loose ball foul on Wendell Antetokounmpo during the free throw rebound! [IN THE BONUS! 5 team fouls] CJ Fox to the line for 2 free throws. (Wendell Antetokounmpo: 2 personal fouls)   FT 1/2: GOOD   FT 2/2: GOOD CJ Fox makes 2/2 from the line.
Score: 68-52

[03:47] Team_067 possession (Score: 68-52)
FOUL! Holding foul on Domantas Towns. [IN THE BONUS! 6 team fouls] Ben Ball to the line for 2 free throws. (Domantas Towns: 4 personal fouls)   FT 1/2: GOOD   FT 2/2: GOOD Ben Ball makes 2/2 from the line.
Score: 68-54

[03:36] Team_069 possession (Score: 68-54)
Domantas Lowry attempts a 3Pt. Contested by Desmond Simmons (3.8 feet, ZONE). Domantas Lowry misses. Offensive rebound by Domantas Towns! Domantas Towns kicks it out.

[03:24] Team_069 possession (Score: 68-54)
FOUL! Shooting foul on Malcolm Westbrook. Domantas Towns to the line for 2 free throws. [BONUS: 6 team fouls] (Malcolm Westbrook: 4 personal fouls)   FT 1/2: GOOD   FT 2/2: GOOD Domantas Towns makes 2/2 from the line.
Score: 70-54

[03:09] Team_067 possession (Score: 70-54)
Ben Ball attempts a Midrange. Contested by Domantas Towns (5.7 feet, MAN). Ben Ball misses. Offensive rebound by Malcolm Westbrook! Malcolm Westbrook's putback is no good. Rebound secured by Pau Middleton.

[02:49] Team_069 possession (Score: 70-54)
James Sexton drives and kicks out. Pau Middleton attempts a Midrange. Contested by Wendell Antetokounmpo (4.7 feet, ZONE). Pau Middleton misses. Rebound secured by Manu Reaves.

[02:37] Team_067 possession (Score: 70-54)
Manu Reaves commits a violation (traveling/carry)! TURNOVER! (dead ball)

[02:37] Substitution (Team_069): James Sexton OUT → Jarrett Murray IN (stamina_rule2)

[02:37] Substitution (Team_069): Pau Middleton OUT → Tyrese Simons IN (stamina_rule2)

[02:37] Substitution (Team_069): Domantas Towns OUT → Devin Giddey IN (stamina_rule2)

[02:37] Substitution (Team_069): CJ Fox OUT → Shai Quickley IN (stamina_rule2)

[02:37] Substitution (Team_067): Manu Reaves OUT → James Rozier IN (stamina_rule2)

[02:37] Substitution (Team_067): Wendell Antetokounmpo OUT → Anfernee Wagner IN (stamina_rule2)

[02:37] Substitution (Team_067): Ben Ball OUT → Kristaps Davis IN (stamina_rule2)

[02:37] Substitution (Team_067): Malcolm Westbrook OUT → Zach DeRozan IN (stamina_rule2)

[02:19] Team_069 possession (Score: 70-54)
Jarrett Murray attempts a Midrange. Contested by Kristaps Davis (4.6 feet, ZONE). Jarrett Murray misses. Offensive rebound by Tyrese Simons! Tyrese Simons kicks it out.

[02:06] Team_069 possession (Score: 70-54)
Domantas Lowry drives, Anfernee Wagner stays with him. Domantas Lowry attempts a Dunk. Contested by Anfernee Wagner (3.6 feet, MAN). DOMANTAS LOWRY MAKES IT! Assist: Tyrese Simons
Score: 72-54

[01:48] Team_067 possession (Score: 72-54)
Anfernee Wagner attempts a 3Pt. Contested by Tyrese Simons (5.0 feet, ZONE). ANFERNEE WAGNER MAKES IT! Assist: Desmond Simmons
Score: 72-57

[01:37] Team_069 possession (Score: 72-57)
Tyrese Simons throws a bad pass out of bounds! TURNOVER! (dead ball)

[01:37] Substitution (Team_069): Domantas Lowry OUT → Trae Antetokounmpo IN (stamina_rule2)

[01:37] Substitution (Team_067): Desmond Simmons OUT → Kyle Leonard IN (stamina_rule2)

[01:22] Team_067 possession (Score: 72-57)
Kyle Leonard attempts a Midrange. Contested by Devin Giddey (5.6 feet, ZONE). KYLE LEONARD MAKES IT!
Score: 72-59

[01:06] Team_069 possession (Score: 72-59)
Tyrese Simons attempts a 3Pt. Contested by Anfernee Wagner (4.0 feet, ZONE). Tyrese Simons misses. Rebound secured by Kristaps Davis.

[00:50] Team_067 possession (Score: 72-59)
Anfernee Wagner makes the Midrange and draws the foul on Trae Antetokounmpo! And-1! Anfernee Wagner to the line for 1. [BONUS: 7 team fouls] (Trae Antetokounmpo: 1 personal fouls)   FT 1/1: GOOD Anfernee Wagner makes 1/1 from the line.
Score: 72-62

[00:33] Team_069 possession (Score: 72-62)
Trae Antetokounmpo attempts a Midrange. Contested by Anfernee Wagner (3.9 feet, ZONE). Trae Antetokounmpo misses. Rebound secured by Zach DeRozan.

[00:19] Team_067 possession (Score: 72-62)
James Rozier attempts a Midrange. Contested by Trae Antetokounmpo (5.6 feet, ZONE). JAMES ROZIER MAKES IT!
Score: 72-64

[00:04] Team_069 possession (Score: 72-64)
Tyrese Simons attempts a 3Pt. Contested by Kyle Leonard (4.0 feet, MAN). Tyrese Simons misses. Rebound secured by Anfernee Wagner.

================================================================================
                              3RD QUARTER COMPLETE                              
================================================================================

3RD QUARTER SCORE: Team_069 20, Team_067 30

BOX SCORE:
================================================================================

Team_069
--------------------------------------------------------------------------------
Player                MIN  PTS  REB  AST  TO      FG   FG%      3P   3P%
--------------------------------------------------------------------------------
Domantas Lowry         27    6    0    0   0   3/5    60.0     0/0   0.0
CJ Fox                 26    5    4    0   0   2/5    40.0     0/0   0.0
Domantas Towns         26    4    1    0   0   2/3    66.7     0/0   0.0
James Sexton           26    0    0    0   0   0/1     0.0     0/0   0.0
Tyrese Simons          11    0    1    1   0   0/2     0.0     0/0   0.0
Trae Antetokounmpo     10    0    0    0   0   0/1     0.0     0/0   0.0

TEAM: FG: 9/21 (42.9%), 3PT: 0/5 (0.0%), REB: 9 (2 off, 7 def), AST: 2, TO: 2
TEAM FOULS: 7 [Team_067 in BONUS]


Team_067
--------------------------------------------------------------------------------
Player                MIN  PTS  REB  AST  TO      FG   FG%      3P   3P%
--------------------------------------------------------------------------------
Ben Ball               26   11    0    0   0   4/7    57.1     0/0   0.0
Malcolm Westbrook      26    7    5    0   0   3/5    60.0     0/0   0.0
Anfernee Wagner        11    6    1    0   0   2/2   100.0     0/0   0.0
Pau Middleton          26    5    4    1   0   2/4    50.0     0/0   0.0
Manu Reaves            26    2    1    0   0   1/3    33.3     0/0   0.0
Kyle Leonard           10    2    0    0   0   1/1   100.0     0/0   0.0
James Rozier           11    2    0    0   0   1/1   100.0     0/0   0.0
Desmond Simmons        27    0    5    2   0   0/0     0.0     0/0   0.0
Wendell Antetokounmpo   26    0    1    1   0   0/1     0.0     0/0   0.0
Kristaps Davis         11    0    1    0   0   0/0     0.0     0/0   0.0
Zach DeRozan           11    0    1    0   0   0/0     0.0     0/0   0.0

TEAM: FG: 12/20 (60.0%), 3PT: 5/8 (62.5%), REB: 16 (4 off, 12 def), AST: 3, TO: 2
TEAM FOULS: 6 [Team_069 in BONUS]

================================================================================

================================================================================
                       4TH QUARTER - Team_069 vs Team_067                       
================================================================================

[12:00] Team_069 possession (Score: 72-64)
Domantas Towns attempts a 3Pt. Contested by Desmond Simmons (4.1 feet, ZONE). Domantas Towns misses. Rebound secured by Malcolm Westbrook.

[11:46] Team_067 possession (Score: 72-64)
Ben Ball attempts a Midrange. Contested by Domantas Towns (5.5 feet, ZONE). Ben Ball misses. Rebound secured by Pau Middleton.

[11:33] Team_069 possession (Score: 72-64)
James Sexton attempts a Midrange. Contested by Manu Reaves (4.6 feet, MAN). James Sexton misses. Rebound secured by Desmond Simmons.

[11:22] Team_067 possession (Score: 72-64)
Ben Ball drives to the basket... FOUL! Offensive foul on Ben Ball! Domantas Towns drew the charge! [Team fouls: 1] (Ben Ball: 1 personal fouls) TURNOVER! (dead ball)

[11:08] Team_069 possession (Score: 72-64)
Pau Middleton attempts a Midrange. Contested by Malcolm Westbrook (4.3 feet, ZONE). Pau Middleton misses. Rebound secured by Desmond Simmons.

[10:51] Team_067 possession (Score: 72-64)
Desmond Simmons attempts a Midrange. BLOCKED BY PAU MIDDLETON! Ball is loose! Offensive rebound by Desmond Simmons! Desmond Simmons kicks it out.

[10:37] Team_067 possession (Score: 72-64)
Manu Reaves attempts a Midrange. Contested by Domantas Towns (5.1 feet, ZONE). Manu Reaves misses. Rebound secured by CJ Fox.

[10:23] Team_069 possession (Score: 72-64)
FOUL! Shooting foul on Wendell Antetokounmpo. Pau Middleton to the line for 2 free throws. [Team fouls: 2] (Wendell Antetokounmpo: 1 personal fouls)   FT 1/2: GOOD   FT 2/2: GOOD Pau Middleton makes 2/2 from the line.
Score: 74-64

[10:09] Team_067 possession (Score: 74-64)
Wendell Antetokounmpo drives to the basket... Wendell Antetokounmpo loses the ball! Stripped by Domantas Lowry! TURNOVER! (live ball)

[09:59] Team_069 possession (Score: 74-64)
Pau Middleton attempts a Layup. BLOCKED BY WENDELL ANTETOKOUNMPO! Ball is loose! Offensive rebound by Domantas Towns! Domantas Towns kicks it out.

[09:43] Team_069 possession (Score: 74-64)
Pau Middleton drives, Malcolm Westbrook stays with him. Pau Middleton attempts a Layup. Contested by Malcolm Westbrook (4.5 feet, ZONE). PAU MIDDLETON MAKES IT!
Score: 76-64

[09:27] Team_067 possession (Score: 76-64)
Wendell Antetokounmpo attempts a 3Pt. Contested by Domantas Lowry (5.0 feet, MAN). Wendell Antetokounmpo misses. Rebound secured by Domantas Towns.

[09:15] Team_069 possession (Score: 76-64)
Domantas Towns throws a bad pass! Stolen by Ben Ball! TURNOVER! (live ball)

[09:02] Team_067 possession (Score: 76-64)
Wendell Antetokounmpo attempts a 3Pt. Contested by James Sexton (3.9 feet, ZONE). WENDELL ANTETOKOUNMPO MAKES IT! Assist: Manu Reaves
Score: 76-67

[08:47] Team_069 possession (Score: 76-67)
Domantas Towns drives and kicks out. Domantas Towns attempts a 3Pt. Contested by Manu Reaves (4.3 feet, ZONE). Domantas Towns misses. Offensive rebound by CJ Fox! CJ Fox kicks it out.

[08:31] Team_069 possession (Score: 76-67)
Pau Middleton attempts a Midrange. Contested by Desmond Simmons (4.4 feet, MAN). Pau Middleton misses. Rebound secured by Desmond Simmons.

[08:18] Team_067 possession (Score: 76-67)
Ben Ball attempts a 3Pt. Contested by James Sexton (4.5 feet, ZONE). BEN BALL MAKES IT! Assist: Wendell Antetokounmpo
Score: 76-70

[08:02] Team_069 possession (Score: 76-70)
Domantas Towns attempts a 3Pt. Contested by Ben Ball (4.5 feet, MAN). Domantas Towns misses. Rebound secured by Manu Reaves.

[07:50] Team_067 possession (Score: 76-70)
Manu Reaves makes the Midrange and draws the foul on Pau Middleton! And-1! Manu Reaves to the line for 1. [Team fouls: 2] (Pau Middleton: 2 personal fouls)   FT 1/1: MISS Manu Reaves makes 0/1 from the line. Rebound secured by CJ Fox.
Score: 76-72

[07:36] Team_069 possession (Score: 76-72)
CJ Fox attempts a Midrange. Contested by Ben Ball (4.5 feet, ZONE). CJ Fox misses. Rebound secured by Desmond Simmons.

[07:21] Team_067 possession (Score: 76-72)
Wendell Antetokounmpo attempts a 3Pt. Contested by James Sexton (4.2 feet, ZONE). Wendell Antetokounmpo misses. Rebound secured by Domantas Towns.

[07:03] Team_069 possession (Score: 76-72)
Domantas Towns attempts a Midrange. Contested by Ben Ball (4.6 feet, MAN). DOMANTAS TOWNS MAKES IT! Assist: James Sexton
Score: 78-72

[06:53] Team_067 possession (Score: 78-72)
Malcolm Westbrook attempts a Layup. Contested by Domantas Towns (5.5 feet, ZONE). MALCOLM WESTBROOK MAKES IT! Assist: Manu Reaves
Score: 78-74

[06:38] Team_069 possession (Score: 78-74)
James Sexton makes the Dunk and draws the foul on Malcolm Westbrook! And-1! James Sexton to the line for 1. [Team fouls: 3] (Malcolm Westbrook: 1 personal fouls)   FT 1/1: GOOD James Sexton makes 1/1 from the line.
Score: 81-74

[06:27] Team_067 possession (Score: 81-74)
Ben Ball drives and kicks out. Wendell Antetokounmpo attempts a Midrange. Contested by Domantas Lowry (5.0 feet, MAN). Wendell Antetokounmpo misses. Rebound secured by CJ Fox.

[06:11] Team_069 possession (Score: 81-74)
Domantas Lowry attempts a 3Pt. Contested by Desmond Simmons (4.3 feet, ZONE). Domantas Lowry misses. Offensive rebound by CJ Fox! CJ Fox kicks it out.

[05:59] Team_069 possession (Score: 81-74)
CJ Fox attempts a Layup. BLOCKED BY MALCOLM WESTBROOK! Ball is loose! Rebound secured by Desmond Simmons.

[05:43] Team_067 possession (Score: 81-74)
Ben Ball drives, CJ Fox stays with him. Ben Ball attempts a Dunk. Wide open! CJ Fox is 6.6 feet away. [ZONE] BEN BALL MAKES IT! Assist: Wendell Antetokounmpo
Score: 81-76

[05:28] Team_069 possession (Score: 81-76)
Pau Middleton attempts a 3Pt. Contested by Desmond Simmons (4.7 feet, MAN). Pau Middleton misses. Offensive rebound by CJ Fox! CJ Fox kicks it out.

[05:14] Team_069 possession (Score: 81-76)
Domantas Lowry attempts a 3Pt. Contested by Wendell Antetokounmpo (5.3 feet, MAN). Domantas Lowry misses. Rebound secured by Desmond Simmons.

[05:02] Team_067 possession (Score: 81-76)
FOUL! Holding foul on Domantas Towns. [Team fouls: 3] No free throws, side out. (Domantas Towns: 1 personal fouls)

[04:46] Team_067 possession (Score: 81-76)
Manu Reaves attempts a Midrange. Contested by James Sexton (4.6 feet, MAN). Manu Reaves misses. Rebound secured by Pau Middleton.

[04:29] Team_069 possession (Score: 81-76)
Domantas Towns drives and kicks out. Domantas Lowry attempts a 3Pt. Contested by Wendell Antetokounmpo (5.5 feet, MAN). Domantas Lowry misses. Rebound secured by Ben Ball.

[04:12] Team_067 possession (Score: 81-76)
Manu Reaves attempts a Layup. Contested by James Sexton (4.6 feet, MAN). MANU REAVES MAKES IT!
Score: 81-78

[03:57] Team_069 possession (Score: 81-78)
CJ Fox attempts a Midrange. Contested by Malcolm Westbrook (5.1 feet, MAN). CJ FOX MAKES IT! Assist: Pau Middleton
Score: 83-78

[03:43] Team_067 possession (Score: 83-78)
Ben Ball drives, picks up Domantas Towns. Help arrives from James Sexton! Ben Ball attempts a Dunk. Wide open! James Sexton is 6.4 feet away. [ZONE] BEN BALL MAKES IT! Assist: Malcolm Westbrook
Score: 83-80

[03:30] Team_069 possession (Score: 83-80)
Pau Middleton attempts a 3Pt. Contested by Desmond Simmons (4.9 feet, MAN). Pau Middleton misses. Rebound secured by Ben Ball.

[03:15] Team_067 possession (Score: 83-80)
Manu Reaves drives, James Sexton stays with him. Manu Reaves attempts a Layup. Contested by James Sexton (4.8 feet, MAN). MANU REAVES MAKES IT! Assist: Wendell Antetokounmpo
Score: 83-82

[02:59] Team_069 possession (Score: 83-82)
James Sexton attempts a Layup. Contested by Manu Reaves (5.6 feet, MAN). JAMES SEXTON MAKES IT!
Score: 85-82

[02:47] Team_067 possession (Score: 85-82)
Malcolm Westbrook makes the Layup and draws the foul on CJ Fox! And-1! Malcolm Westbrook to the line for 1. [Team fouls: 4] (CJ Fox: 1 personal fouls)   FT 1/1: GOOD Malcolm Westbrook makes 1/1 from the line.
Score: 85-85

[02:33] Team_069 possession (Score: 85-85)
Domantas Towns attempts a 3Pt. Contested by Desmond Simmons (5.0 feet, ZONE). Domantas Towns misses. Rebound secured by Desmond Simmons.

[02:18] Team_067 possession (Score: 85-85)
Wendell Antetokounmpo attempts a Layup. Wide open! Domantas Towns is 6.2 feet away. [ZONE] WENDELL ANTETOKOUNMPO MAKES IT!
Score: 85-87

[02:06] Team_069 possession (Score: 85-87)
FOUL! Reach-in foul on Desmond Simmons during the drive. [Team fouls: 4] No free throws, side out. (Desmond Simmons: 1 personal fouls)

[01:47] Team_069 possession (Score: 85-87)
James Sexton attempts a 3Pt. Contested by Desmond Simmons (5.5 feet, ZONE). James Sexton misses. Rebound secured by Desmond Simmons.

[01:33] Team_067 possession (Score: 85-87)
Manu Reaves attempts a 3Pt. Contested by James Sexton (5.1 feet, ZONE). Manu Reaves misses. Rebound secured by CJ Fox.

[01:23] Team_069 possession (Score: 85-87)
FOUL! Shooting foul on Malcolm Westbrook. CJ Fox to the line for 2 free throws. [BONUS: 5 team fouls] (Malcolm Westbrook: 2 personal fouls)   FT 1/2: GOOD   FT 2/2: GOOD CJ Fox makes 2/2 from the line.
Score: 87-87

[01:11] Team_067 possession (Score: 87-87)
FOUL! Holding foul on CJ Fox. [IN THE BONUS! 5 team fouls] Malcolm Westbrook to the line for 2 free throws. (CJ Fox: 2 personal fouls)   FT 1/2: MISS   FT 2/2: GOOD Malcolm Westbrook makes 1/2 from the line.
Score: 87-88

[00:59] Team_069 possession (Score: 87-88)
CJ Fox attempts a Midrange. Wide open! Wendell Antetokounmpo is 6.2 feet away. [ZONE] CJ Fox misses. Rebound secured by Desmond Simmons.

[00:44] Team_067 possession (Score: 87-88)
Manu Reaves drives and kicks out. Malcolm Westbrook attempts a Midrange. Wide open! CJ Fox is 6.6 feet away. [MAN] Malcolm Westbrook misses. Rebound secured by Domantas Towns.

[00:35] Team_069 possession (Score: 87-88)
Domantas Lowry attempts a 3Pt. Contested by Desmond Simmons (5.1 feet, ZONE). Domantas Lowry misses. FOUL! Loose ball foul on Malcolm Westbrook during the rebound battle. [IN THE BONUS! 6 team fouls] CJ Fox to the line for 2 free throws. (Malcolm Westbrook: 3 personal fouls)   FT 1/2: MISS   FT 2/2: GOOD CJ Fox makes 1/2 from the line.
Score: 88-88

[00:26] Team_067 possession (Score: 88-88)
Desmond Simmons attempts a 3Pt. Contested by Pau Middleton (5.9 feet, MAN). DESMOND SIMMONS MAKES IT! Assist: Wendell Antetokounmpo
Score: 88-91

[00:12] Team_069 possession (Score: 88-91)
Domantas Lowry attempts a Midrange. Contested by Ben Ball (5.4 feet, ZONE). Domantas Lowry misses. Offensive rebound by Domantas Towns! Domantas Towns kicks it out.

================================================================================
                              4TH QUARTER COMPLETE                              
================================================================================

4TH QUARTER SCORE: Team_069 16, Team_067 27

BOX SCORE:
================================================================================

Team_069
--------------------------------------------------------------------------------
Player                MIN  PTS  REB  AST  TO      FG   FG%      3P   3P%
--------------------------------------------------------------------------------
James Sexton           38    5    0    1   0   2/4    50.0     0/0   0.0
CJ Fox                 38    5    7    0   0   3/6    50.0     0/0   0.0
Pau Middleton          38    4    2    1   0   2/5    40.0     0/0   0.0
Domantas Towns         38    2    5    0   0   1/5    20.0     0/0   0.0
Domantas Lowry         39    0    0    0   0   0/1     0.0     0/0   0.0

TEAM: FG: 8/21 (38.1%), 3PT: 1/7 (14.3%), REB: 14 (5 off, 9 def), AST: 2, TO: 1
TEAM FOULS: 5 [Team_067 in BONUS]


Team_067
--------------------------------------------------------------------------------
Player                MIN  PTS  REB  AST  TO      FG   FG%      3P   3P%
--------------------------------------------------------------------------------
Ben Ball               38    7    2    0   0   3/5    60.0     0/0   0.0
Malcolm Westbrook      38    6    1    1   0   3/3   100.0     0/0   0.0
Wendell Antetokounmpo   38    5    0    4   0   2/4    50.0     0/0   0.0
Manu Reaves            38    4    1    2   0   2/7    28.6     0/0   0.0
Desmond Simmons        39    3   10    0   0   1/1   100.0     0/0   0.0

TEAM: FG: 11/20 (55.0%), 3PT: 3/6 (50.0%), REB: 14 (1 off, 13 def), AST: 7, TO: 2
TEAM FOULS: 6 [Team_069 in BONUS]

================================================================================

================================================================================
                               FULL GAME COMPLETE                               
================================================================================

FINAL SCORE: Team_069 88, Team_067 91

SCORING BY QUARTER:
--------------------------------------------------------------------------------
Team                     Q1     Q2     Q3     Q4    FINAL
--------------------------------------------------------------------------------
Team_069                 23     29     20     16       88
Team_067                 16     18     30     27       91
--------------------------------------------------------------------------------

FULL GAME BOX SCORE:
================================================================================

Team_069
--------------------------------------------------------------------------------
Player                MIN  PTS  REB  AST  TO      FG   FG%      3P   3P%      FT STL BLK
--------------------------------------------------------------------------------
Domantas Lowry         39    9    0    0   1   7/11   63.6   2/5    40.0   1/2     1   0
James Sexton           38   12    0    3   0   6/11   54.5   0/1     0.0   4/5     0   0
Pau Middleton          38   15   11    3   1   5/13   38.5   1/5    20.0   5/5     0   1
Domantas Towns         38   19   13    1   2   9/17   52.9   1/5    20.0   4/4     2   0
CJ Fox                 38   10   18    2   0   3/12   25.0   0/1     0.0   5/6     0   0
Jarrett Murray         11    1    0    2   0   2/3    66.7   0/0     0.0   1/4     0   0
Tyrese Simons          11    7    4    1   1   2/6    33.3   1/4    25.0   2/2     0   0
Devin Giddey           11    3    0    1   1   1/1   100.0   1/1   100.0   1/3     0   1
Shai Quickley          11    7    7    0   0   0/0     0.0   0/0     0.0   0/0     0   0
Trae Antetokounmpo     10    3    2    0   0   3/6    50.0   1/3    33.3   1/1     0   1

TEAM: FG: 39/81 (48.1%), 3PT: 7/25 (28.0%), REB: 54 (18 off, 36 def), AST: 13, TO: 6


Team_067
--------------------------------------------------------------------------------
Player                MIN  PTS  REB  AST  TO      FG   FG%      3P   3P%      FT STL BLK
--------------------------------------------------------------------------------
Desmond Simmons        39    7   20    3   2   3/6    50.0   1/4    25.0   2/2     1   0
Manu Reaves            38    8    5    2   1   4/14   28.6   0/4     0.0   0/1     0   0
Wendell Antetokounmpo   38   10    2    5   1   7/11   63.6   3/7    42.9   0/0     1   2
Ben Ball               38   23    2    1   1   8/16   50.0   4/7    57.1   6/6     1   1
Malcolm Westbrook      38   20   11    1   3   5/10   50.0   0/1     0.0   4/5     0   1
James Rozier           11    4    0    0   1   1/3    33.3   0/2     0.0   2/2     0   0
Anfernee Wagner        11    8    2    0   0   3/5    60.0   1/1   100.0   1/1     0   0
Kristaps Davis         11    4    4    0   0   2/2   100.0   0/0     0.0   3/5     0   0
Zach DeRozan           11    2    6    0   0   1/4    25.0   0/1     0.0   0/0     0   0
Kyle Leonard           10    2    0    0   0   1/1   100.0   0/0     0.0   0/0     0   0

TEAM: FG: 38/75 (50.7%), 3PT: 9/27 (33.3%), REB: 52 (11 off, 41 def), AST: 12, TO: 9

================================================================================
