================================================================================
                        FULL GAME - Team_043 vs Team_050                        
================================================================================

================================================================================
                       1ST QUARTER - Team_043 vs Team_050                       
================================================================================

[12:00] Team_043 possession (Score: 0-0)
FOUL! Shooting foul on Giannis LaVine. Malcolm Murray to the line for 3 free throws. [Team fouls: 1] (Giannis LaVine: 1 personal fouls)   FT 1/3: GOOD   FT 2/3: GOOD   FT 3/3: GOOD Malcolm Murray makes 3/3 from the line.
Score: 3-0

[11:42] Team_050 possession (Score: 3-0)
Giannis LaVine attempts a Midrange. Contested by D'Angelo Iverson (3.3 feet, ZONE). Giannis LaVine misses. FOUL! Loose ball foul on Dwyane Dosunmu during the rebound battle. [Team fouls: 1] No free throws, side out. (Dwyane Dosunmu: 1 personal fouls)

[11:27] Team_050 possession (Score: 3-0)
Collin Bane drives, picks up D'Angelo Iverson. Help arrives from Malcolm Murray! Collin Bane attempts a Layup. Contested by Malcolm Murray (3.1 feet, MAN). COLLIN BANE MAKES IT!
Score: 3-2

[11:09] Team_043 possession (Score: 3-2)
FOUL! Holding foul on Donovan Trent. [Team fouls: 2] No free throws, side out. (Donovan Trent: 1 personal fouls)

[10:56] Team_043 possession (Score: 3-2)
D'Angelo Iverson attempts a 3Pt. Contested by Giannis LaVine (3.9 feet, ZONE). D'Angelo Iverson misses. Rebound secured by Collin Bane.

[10:40] Team_050 possession (Score: 3-2)
FOUL! Shooting foul on Manu Carter. Donovan Trent to the line for 2 free throws. [Team fouls: 2] (Manu Carter: 1 personal fouls)   FT 1/2: GOOD   FT 2/2: GOOD Donovan Trent makes 2/2 from the line.
Score: 3-4

[10:22] Team_043 possession (Score: 3-4)
D'Angelo Iverson makes the Midrange and draws the foul on Collin Bane! And-1! D'Angelo Iverson to the line for 1. [Team fouls: 3] (Collin Bane: 1 personal fouls)   FT 1/1: MISS D'Angelo Iverson makes 0/1 from the line. Rebound secured by Collin Bane.
Score: 5-4

[10:08] Team_050 possession (Score: 5-4)
Collin Bane attempts a Layup. Contested by Manu Carter (4.3 feet, ZONE). COLLIN BANE MAKES IT! Assist: Giannis LaVine
Score: 5-6

[09:52] Team_043 possession (Score: 5-6)
Malcolm Murray throws a bad pass out of bounds! TURNOVER! (dead ball)

[09:37] Team_050 possession (Score: 5-6)
Joel Banchero attempts a Layup. Contested by Magic Durant (4.9 feet, MAN). Joel Banchero misses. Offensive rebound by LeBron Bridges! LeBron Bridges kicks it out.

[09:18] Team_050 possession (Score: 5-6)
LeBron Bridges attempts a Layup. BLOCKED BY MANU CARTER! Ball deflects out of bounds off LeBron Bridges.

[09:06] Team_043 possession (Score: 5-6)
Malcolm Murray attempts a 3Pt. Contested by Giannis LaVine (4.0 feet, MAN). Malcolm Murray misses. Rebound secured by Collin Bane.

[08:54] Team_050 possession (Score: 5-6)
Donovan Trent drives, picks up Manu Carter. Help arrives from Malcolm Murray! Donovan Trent attempts a Dunk. Contested by Malcolm Murray (4.0 feet, MAN). Donovan Trent misses. Rebound secured by Dwyane Dosunmu.

[08:40] Team_043 possession (Score: 5-6)
D'Angelo Iverson attempts a 3Pt. Contested by Collin Bane (4.2 feet, MAN). D'ANGELO IVERSON MAKES IT! Assist: Dwyane Dosunmu
Score: 8-6

[08:21] Team_050 possession (Score: 8-6)
Joel Banchero attempts a 3Pt. Contested by D'Angelo Iverson (2.7 feet, ZONE). Joel Banchero misses. Rebound secured by Manu Carter.

[08:09] Team_043 possession (Score: 8-6)
Malcolm Murray attempts a 3Pt. Contested by Giannis LaVine (4.0 feet, MAN). Malcolm Murray misses. Offensive rebound by D'Angelo Iverson! D'Angelo Iverson kicks it out.

[07:57] Team_043 possession (Score: 8-6)
D'Angelo Iverson attempts a Midrange. Contested by Joel Banchero (4.4 feet, ZONE). D'ANGELO IVERSON MAKES IT!
Score: 10-6

[07:46] Team_050 possession (Score: 10-6)
Collin Bane drives, picks up Manu Carter. Help arrives from Malcolm Murray! Collin Bane attempts a Layup. Contested by Malcolm Murray (4.3 feet, ZONE). COLLIN BANE MAKES IT! Assist: LeBron Bridges
Score: 10-8

[07:26] Team_043 possession (Score: 10-8)
Malcolm Murray attempts a Midrange. Contested by Giannis LaVine (4.0 feet, MAN). Malcolm Murray misses. Rebound secured by LeBron Bridges.

[07:08] Team_050 possession (Score: 10-8)
Giannis LaVine attempts a Layup. Contested by Malcolm Murray (4.1 feet, MAN). Giannis LaVine misses. Rebound secured by Dwyane Dosunmu.

[06:51] Team_043 possession (Score: 10-8)
Magic Durant attempts a 3Pt. Contested by Joel Banchero (4.3 feet, ZONE). Magic Durant misses. Offensive rebound by D'Angelo Iverson! D'Angelo Iverson kicks it out.

[06:35] Team_043 possession (Score: 10-8)
Dwyane Dosunmu makes the Dunk and draws the foul on Joel Banchero! And-1! Dwyane Dosunmu to the line for 1. [Team fouls: 4] (Joel Banchero: 1 personal fouls)   FT 1/1: MISS Dwyane Dosunmu makes 0/1 from the line. Rebound secured by Joel Banchero.
Score: 12-8

[06:17] Team_050 possession (Score: 12-8)
Giannis LaVine attempts a Layup. BLOCKED BY MALCOLM MURRAY! Ball goes out off Malcolm Murray. Giannis LaVine's ball!

[06:05] Team_050 possession (Score: 12-8)
Donovan Trent attempts a Midrange. Contested by D'Angelo Iverson (2.7 feet, ZONE). Donovan Trent misses. Offensive rebound by LeBron Bridges! LeBron Bridges kicks it out.

[05:51] Team_050 possession (Score: 12-8)
Collin Bane drives and kicks out. Joel Banchero attempts a Midrange. Contested by Magic Durant (5.1 feet, MAN). JOEL BANCHERO MAKES IT! Assist: Collin Bane
Score: 12-10

[05:35] Team_043 possession (Score: 12-10)
Dwyane Dosunmu attempts a Midrange. Contested by Collin Bane (4.2 feet, ZONE). Dwyane Dosunmu misses. Rebound secured by Collin Bane.

[05:19] Team_050 possession (Score: 12-10)
Donovan Trent drives to the basket... Donovan Trent loses control! Ball rolls out of bounds! TURNOVER! (dead ball)

[05:04] Team_043 possession (Score: 12-10)
Dwyane Dosunmu drives, picks up Donovan Trent. Help arrives from Joel Banchero! Dwyane Dosunmu attempts a Dunk. Contested by Joel Banchero (4.9 feet, ZONE). Dwyane Dosunmu misses. Rebound secured by Joel Banchero.

[04:48] Team_050 possession (Score: 12-10)
LeBron Bridges attempts a 3Pt. Contested by Manu Carter (4.4 feet, MAN). LEBRON BRIDGES MAKES IT! Assist: Joel Banchero
Score: 12-13

[04:31] Team_043 possession (Score: 12-13)
Manu Carter attempts a Midrange. BLOCKED BY GIANNIS LAVINE! Ball deflects out of bounds off Manu Carter.

[04:14] Team_050 possession (Score: 12-13)
Collin Bane drives and kicks out. Collin Bane attempts a Midrange. Contested by Magic Durant (5.2 feet, ZONE). COLLIN BANE MAKES IT! Assist: LeBron Bridges
Score: 12-15

[04:03] Team_043 possession (Score: 12-15)
Manu Carter drives and kicks out. Manu Carter attempts a Midrange. Contested by LeBron Bridges (4.3 feet, MAN). Manu Carter misses. Rebound secured by Joel Banchero.

[03:54] Team_050 possession (Score: 12-15)
FOUL! Offensive foul on LeBron Bridges! Manu Carter drew the charge! [Team fouls: 5] (LeBron Bridges: 1 personal fouls) TURNOVER! (dead ball)

[03:45] Team_043 possession (Score: 12-15)
FOUL! Holding foul on Collin Bane. [IN THE BONUS! 6 team fouls] D'Angelo Iverson to the line for 2 free throws. (Collin Bane: 2 personal fouls)   FT 1/2: GOOD   FT 2/2: GOOD D'Angelo Iverson makes 2/2 from the line.
Score: 14-15

[03:31] Team_050 possession (Score: 14-15)
LeBron Bridges makes the Layup and draws the foul on Manu Carter! And-1! LeBron Bridges to the line for 1. [Team fouls: 3] (Manu Carter: 2 personal fouls)   FT 1/1: GOOD LeBron Bridges makes 1/1 from the line.
Score: 14-18

[03:18] Team_043 possession (Score: 14-18)
FOUL! Shooting foul on Donovan Trent. Dwyane Dosunmu to the line for 2 free throws. [BONUS: 7 team fouls] (Donovan Trent: 2 personal fouls)   FT 1/2: GOOD   FT 2/2: GOOD Dwyane Dosunmu makes 2/2 from the line.
Score: 16-18

[03:08] Team_050 possession (Score: 16-18)
LeBron Bridges attempts a 3Pt. Contested by D'Angelo Iverson (3.2 feet, ZONE). LeBron Bridges misses. Rebound secured by D'Angelo Iverson.

[02:56] Team_043 possession (Score: 16-18)
Malcolm Murray attempts a Midrange. Contested by Joel Banchero (4.5 feet, ZONE). MALCOLM MURRAY MAKES IT! Assist: Magic Durant
Score: 18-18

[02:40] Team_050 possession (Score: 18-18)
Collin Bane attempts a 3Pt. Contested by D'Angelo Iverson (3.3 feet, ZONE). Collin Bane misses. Rebound secured by Manu Carter.

[02:29] Team_043 possession (Score: 18-18)
Manu Carter attempts a Midrange. Contested by LeBron Bridges (5.0 feet, MAN). MANU CARTER MAKES IT! Assist: Magic Durant
Score: 20-18

[02:15] Team_050 possession (Score: 20-18)
Giannis LaVine attempts a 3Pt. Contested by D'Angelo Iverson (3.6 feet, ZONE). Giannis LaVine misses. Rebound secured by D'Angelo Iverson.

[02:02] Team_043 possession (Score: 20-18)
Dwyane Dosunmu drives to the basket... Dwyane Dosunmu loses the ball! Stripped by Donovan Trent! TURNOVER! (live ball)

[01:45] Team_050 possession (Score: 20-18)
Donovan Trent loses the ball! Stripped by Manu Carter! TURNOVER! (live ball)

[01:32] Team_043 possession (Score: 20-18)
Dwyane Dosunmu attempts a Midrange. Contested by LeBron Bridges (4.7 feet, ZONE). Dwyane Dosunmu misses. Rebound secured by Collin Bane.

[01:19] Team_050 possession (Score: 20-18)
Donovan Trent attempts a Layup. Contested by Manu Carter (4.4 feet, ZONE). DONOVAN TRENT MAKES IT! Assist: LeBron Bridges
Score: 20-20

[01:09] Team_043 possession (Score: 20-20)
Magic Durant drives, picks up Donovan Trent. Help arrives from Joel Banchero! Magic Durant attempts a Dunk. Contested by Joel Banchero (5.2 feet, ZONE). MAGIC DURANT MAKES IT! Assist: Malcolm Murray
Score: 22-20

[00:53] Team_050 possession (Score: 22-20)
Collin Bane makes the Layup and draws the foul on D'Angelo Iverson! And-1! Collin Bane to the line for 1. [Team fouls: 4] (D'Angelo Iverson: 1 personal fouls)   FT 1/1: GOOD Collin Bane makes 1/1 from the line.
Score: 22-23

[00:38] Team_043 possession (Score: 22-23)
Dwyane Dosunmu drives, picks up Donovan Trent. Help arrives from Joel Banchero! Dwyane Dosunmu attempts a Dunk. Contested by Joel Banchero (5.3 feet, ZONE). Dwyane Dosunmu misses. Rebound secured by Collin Bane.

[00:27] Team_050 possession (Score: 22-23)
LeBron Bridges makes the Layup and draws the foul on Manu Carter! And-1! LeBron Bridges to the line for 1. [BONUS: 5 team fouls] (Manu Carter: 3 personal fouls)   FT 1/1: GOOD LeBron Bridges makes 1/1 from the line.
Score: 22-26

[00:08] Team_043 possession (Score: 22-26)
Magic Durant makes the Layup and draws the foul on Donovan Trent! And-1! Magic Durant to the line for 1. [BONUS: 8 team fouls] (Donovan Trent: 3 personal fouls)   FT 1/1: GOOD Magic Durant makes 1/1 from the line.
Score: 25-26

================================================================================
                              1ST QUARTER COMPLETE                              
================================================================================

1ST QUARTER SCORE: Team_043 25, Team_050 26

BOX SCORE:
================================================================================

Team_043
--------------------------------------------------------------------------------
Player                MIN  PTS  REB  AST  TO      FG   FG%      3P   3P%
--------------------------------------------------------------------------------
D'Angelo Iverson       12    7    4    0   0   3/5    60.0     0/0   0.0
Malcolm Murray         12    5    0    1   0   2/4    50.0     0/0   0.0
Magic Durant           12    5    0    2   0   2/2   100.0     0/0   0.0
Dwyane Dosunmu         12    2    2    1   0   1/6    16.7     0/0   0.0
Manu Carter            12    2    2    0   0   1/3    33.3     0/0   0.0

TEAM: FG: 9/20 (45.0%), 3PT: 2/4 (50.0%), REB: 8 (2 off, 6 def), AST: 4, TO: 2
TEAM FOULS: 5 [Team_050 in BONUS]


Team_050
--------------------------------------------------------------------------------
Player                MIN  PTS  REB  AST  TO      FG   FG%      3P   3P%
--------------------------------------------------------------------------------
Collin Bane            12   11    6    1   0   5/6    83.3     0/0   0.0
LeBron Bridges         12    9    4    3   0   3/5    60.0     0/0   0.0
Donovan Trent          12    4    0    0   0   2/3    66.7     0/0   0.0
Joel Banchero          12    2    3    1   0   1/2    50.0     0/0   0.0
Giannis LaVine         12    0    0    1   0   0/2     0.0     0/0   0.0

TEAM: FG: 11/18 (61.1%), 3PT: 1/5 (20.0%), REB: 13 (3 off, 10 def), AST: 6, TO: 3
TEAM FOULS: 8 [Team_043 in BONUS]

================================================================================

================================================================================
                       2ND QUARTER - Team_043 vs Team_050                       
================================================================================

[12:00] Team_043 possession (Score: 25-26)
Manu Carter attempts a 3Pt. Contested by Giannis LaVine (4.6 feet, ZONE). MANU CARTER MAKES IT!
Score: 28-26

[11:45] Team_050 possession (Score: 28-26)
Joel Banchero drives and kicks out. Collin Bane attempts a Midrange. Contested by D'Angelo Iverson (3.2 feet, MAN). COLLIN BANE MAKES IT!
Score: 28-28

[11:35] Team_043 possession (Score: 28-28)
Manu Carter attempts a 3Pt. Contested by LeBron Bridges (5.1 feet, MAN). Manu Carter misses. Rebound secured by Collin Bane.

[11:19] Team_050 possession (Score: 28-28)
LeBron Bridges attempts a Layup. Contested by Manu Carter (4.7 feet, MAN). LeBron Bridges misses. Rebound secured by Dwyane Dosunmu.

[11:08] Team_043 possession (Score: 28-28)
Dwyane Dosunmu attempts a 3Pt. Contested by Donovan Trent (5.3 feet, MAN). Dwyane Dosunmu misses. Offensive rebound by D'Angelo Iverson! D'Angelo Iverson kicks it out.

[10:51] Team_043 possession (Score: 28-28)
FOUL! Reach-in foul on Donovan Trent during the drive. [Team fouls: 1] No free throws, side out. (Donovan Trent: 1 personal fouls)

[10:41] Team_043 possession (Score: 28-28)
Magic Durant attempts a 3Pt. Contested by LeBron Bridges (4.8 feet, ZONE). Magic Durant misses. Rebound secured by Collin Bane.

[10:28] Team_050 possession (Score: 28-28)
FOUL! Reach-in foul on Manu Carter during the drive. [Team fouls: 1] No free throws, side out. (Manu Carter: 1 personal fouls)

[10:15] Team_050 possession (Score: 28-28)
Joel Banchero attempts a 3Pt. Contested by Magic Durant (5.5 feet, ZONE). Joel Banchero misses. Rebound secured by Dwyane Dosunmu.

[10:02] Team_043 possession (Score: 28-28)
FOUL! Reach-in foul on Joel Banchero during the drive. [Team fouls: 2] No free throws, side out. (Joel Banchero: 1 personal fouls)

[09:49] Team_043 possession (Score: 28-28)
Magic Durant attempts a Midrange. Contested by Joel Banchero (4.7 feet, ZONE). MAGIC DURANT MAKES IT! Assist: Manu Carter
Score: 30-28

[09:33] Team_050 possession (Score: 30-28)
Joel Banchero attempts a 3Pt. Contested by Magic Durant (5.6 feet, MAN). Joel Banchero misses. Offensive rebound by LeBron Bridges! LeBron Bridges kicks it out.

[09:21] Team_050 possession (Score: 30-28)
Collin Bane attempts a 3Pt. Contested by D'Angelo Iverson (3.7 feet, ZONE). COLLIN BANE MAKES IT! Assist: Donovan Trent
Score: 30-31

[09:11] Team_043 possession (Score: 30-31)
Manu Carter drives, picks up LeBron Bridges. Help arrives from Joel Banchero! Manu Carter attempts a Layup. Contested by Joel Banchero (5.4 feet, MAN). MANU CARTER MAKES IT!
Score: 32-31

[08:58] Team_050 possession (Score: 32-31)
Giannis LaVine drives, Manu Carter stays with him. Giannis LaVine attempts a Layup. Contested by Manu Carter (5.3 feet, ZONE). GIANNIS LAVINE MAKES IT! Assist: Donovan Trent
Score: 32-33

[08:42] Team_043 possession (Score: 32-33)
Manu Carter drives and kicks out. Magic Durant attempts a 3Pt. Contested by Giannis LaVine (4.7 feet, ZONE). MAGIC DURANT MAKES IT! Assist: Manu Carter
Score: 35-33

[08:27] Team_050 possession (Score: 35-33)
LeBron Bridges drives, picks up Manu Carter. Help arrives from Malcolm Murray! LeBron Bridges attempts a Layup. Contested by Malcolm Murray (5.1 feet, MAN). LeBron Bridges misses. Offensive rebound by LeBron Bridges! LeBron Bridges kicks it out.

[08:14] Team_050 possession (Score: 35-33)
Collin Bane attempts a Midrange. Contested by D'Angelo Iverson (3.9 feet, MAN). COLLIN BANE MAKES IT! Assist: Joel Banchero
Score: 35-35

[07:56] Team_043 possession (Score: 35-35)
Manu Carter makes the Layup and draws the foul on Joel Banchero! And-1! Manu Carter to the line for 1. [Team fouls: 3] (Joel Banchero: 2 personal fouls)   FT 1/1: GOOD Manu Carter makes 1/1 from the line.
Score: 38-35

[07:43] Team_050 possession (Score: 38-35)
FOUL! Shooting foul on Malcolm Murray. Giannis LaVine to the line for 3 free throws. [Team fouls: 2] (Malcolm Murray: 1 personal fouls)   FT 1/3: MISS   FT 2/3: MISS   FT 3/3: GOOD Giannis LaVine makes 1/3 from the line.
Score: 38-36

[07:27] Team_043 possession (Score: 38-36)
D'Angelo Iverson attempts a 3Pt. Contested by Collin Bane (5.0 feet, MAN). D'Angelo Iverson misses. Rebound secured by LeBron Bridges.

[07:10] Team_050 possession (Score: 38-36)
Collin Bane attempts a 3Pt. Contested by D'Angelo Iverson (4.0 feet, MAN). Collin Bane misses. Rebound secured by D'Angelo Iverson.

[06:53] Team_043 possession (Score: 38-36)
Magic Durant attempts a Layup. Contested by Joel Banchero (5.1 feet, MAN). Magic Durant misses. Rebound secured by Collin Bane.

[06:42] Team_050 possession (Score: 38-36)
FOUL! Shooting foul on Malcolm Murray. Giannis LaVine to the line for 2 free throws. [Team fouls: 3] (Malcolm Murray: 2 personal fouls)   FT 1/2: MISS   FT 2/2: MISS Giannis LaVine makes 0/2 from the line. Rebound secured by Dwyane Dosunmu.

[06:24] Team_043 possession (Score: 38-36)
Malcolm Murray attempts a 3Pt. Contested by Giannis LaVine (5.0 feet, ZONE). Malcolm Murray misses. Rebound secured by Collin Bane.

[06:09] Team_050 possession (Score: 38-36)
LeBron Bridges attempts a 3Pt. Contested by Manu Carter (5.4 feet, ZONE). LeBron Bridges misses. Rebound secured by D'Angelo Iverson.

[05:51] Team_043 possession (Score: 38-36)
Manu Carter drives, picks up LeBron Bridges. Help arrives from Joel Banchero! Manu Carter attempts a Layup. Contested by Joel Banchero (5.9 feet, MAN). Manu Carter misses. Rebound secured by Collin Bane.

[05:41] Team_050 possession (Score: 38-36)
Joel Banchero attempts a 3Pt. Contested by Malcolm Murray (4.7 feet, ZONE). Joel Banchero misses. Rebound secured by Dwyane Dosunmu.

[05:27] Team_043 possession (Score: 38-36)
D'Angelo Iverson attempts a Layup. Wide open! Donovan Trent is 6.1 feet away. [ZONE] D'ANGELO IVERSON MAKES IT! Assist: Dwyane Dosunmu
Score: 40-36

[05:13] Team_050 possession (Score: 40-36)
Joel Banchero drives, Manu Carter stays with him. Joel Banchero attempts a Dunk. Contested by Manu Carter (5.3 feet, ZONE). JOEL BANCHERO MAKES IT! Assist: LeBron Bridges
Score: 40-38

[04:59] Team_043 possession (Score: 40-38)
Magic Durant attempts a Layup. Wide open! Donovan Trent is 6.1 feet away. [ZONE] MAGIC DURANT MAKES IT!
Score: 42-38

[04:44] Team_050 possession (Score: 42-38)
Giannis LaVine attempts a 3Pt. Contested by D'Angelo Iverson (4.6 feet, ZONE). Giannis LaVine misses. Rebound secured by Manu Carter.

[04:35] Team_043 possession (Score: 42-38)
Magic Durant attempts a 3Pt. Contested by Joel Banchero (5.4 feet, MAN). Magic Durant misses. Offensive rebound by Manu Carter! Manu Carter kicks it out.

[04:22] Team_043 possession (Score: 42-38)
D'Angelo Iverson attempts a 3Pt. Contested by Giannis LaVine (5.3 feet, ZONE). D'Angelo Iverson misses. FOUL! Loose ball foul on Collin Bane during the rebound battle. [Team fouls: 4] No free throws, side out. (Collin Bane: 1 personal fouls)

[04:10] Team_043 possession (Score: 42-38)
Dwyane Dosunmu attempts a Layup. Wide open! Donovan Trent is 6.2 feet away. [ZONE] DWYANE DOSUNMU MAKES IT! Assist: Magic Durant
Score: 44-38

[03:53] Team_050 possession (Score: 44-38)
Donovan Trent drives, Dwyane Dosunmu stays with him. Donovan Trent attempts a Dunk. Wide open! Dwyane Dosunmu is 6.2 feet away. [MAN] Donovan Trent misses. Rebound secured by Dwyane Dosunmu.

[03:39] Team_043 possession (Score: 44-38)
Malcolm Murray attempts a 3Pt. Contested by Giannis LaVine (5.5 feet, ZONE). Malcolm Murray misses. Rebound secured by LeBron Bridges.

[03:28] Team_050 possession (Score: 44-38)
FOUL! Shooting foul on Manu Carter. LeBron Bridges to the line for 2 free throws. [Team fouls: 4] (Manu Carter: 2 personal fouls)   FT 1/2: MISS   FT 2/2: GOOD LeBron Bridges makes 1/2 from the line.
Score: 44-39

[03:16] Team_043 possession (Score: 44-39)
Magic Durant attempts a 3Pt. Contested by Joel Banchero (5.6 feet, MAN). Magic Durant misses. Offensive rebound by Manu Carter! Manu Carter kicks it out.

[03:04] Team_043 possession (Score: 44-39)
Dwyane Dosunmu attempts a Midrange. Contested by Giannis LaVine (5.5 feet, ZONE). DWYANE DOSUNMU MAKES IT!
Score: 46-39

[02:50] Team_050 possession (Score: 46-39)
FOUL! Reach-in foul on Dwyane Dosunmu during the drive. [IN THE BONUS! 5 team fouls] Donovan Trent to the line for 2 free throws. (Dwyane Dosunmu: 1 personal fouls)   FT 1/2: GOOD   FT 2/2: GOOD Donovan Trent makes 2/2 from the line.
Score: 46-41

[02:32] Team_043 possession (Score: 46-41)
Dwyane Dosunmu attempts a Midrange. Contested by Collin Bane (5.6 feet, ZONE). DWYANE DOSUNMU MAKES IT! Assist: Malcolm Murray
Score: 48-41

[02:19] Team_050 possession (Score: 48-41)
Joel Banchero attempts a 3Pt. Contested by D'Angelo Iverson (4.6 feet, ZONE). Joel Banchero misses. Rebound secured by Manu Carter.

[02:09] Team_043 possession (Score: 48-41)
Dwyane Dosunmu attempts a 3Pt. Wide open! Donovan Trent is 6.6 feet away. [MAN] Dwyane Dosunmu misses. FOUL! Loose ball foul on Joel Banchero during the rebound battle. [IN THE BONUS! 5 team fouls] Manu Carter to the line for 2 free throws. (Joel Banchero: 3 personal fouls)   FT 1/2: GOOD   FT 2/2: MISS Manu Carter makes 1/2 from the line. Offensive rebound by D'Angelo Iverson! D'Angelo Iverson kicks it out.
Score: 49-41

[01:57] Team_043 possession (Score: 49-41)
Malcolm Murray attempts a 3Pt. Contested by Giannis LaVine (5.8 feet, MAN). MALCOLM MURRAY MAKES IT! Assist: Manu Carter
Score: 52-41

[01:44] Team_050 possession (Score: 52-41)
Joel Banchero attempts a Midrange. Wide open! Magic Durant is 6.7 feet away. [MAN] JOEL BANCHERO MAKES IT! Assist: Donovan Trent
Score: 52-43

[01:31] Team_043 possession (Score: 52-43)
Magic Durant attempts a Layup. Wide open! Donovan Trent is 6.6 feet away. [ZONE] MAGIC DURANT MAKES IT! Assist: Dwyane Dosunmu
Score: 54-43

[01:13] Team_050 possession (Score: 54-43)
Collin Bane attempts a 3Pt. Contested by D'Angelo Iverson (5.0 feet, MAN). COLLIN BANE MAKES IT! Assist: Joel Banchero
Score: 54-46

[00:58] Team_043 possession (Score: 54-46)
Manu Carter attempts a Layup. Wide open! Donovan Trent is 7.1 feet away. [ZONE] Manu Carter misses. Rebound secured by Joel Banchero.

[00:40] Team_050 possession (Score: 54-46)
Joel Banchero attempts a 3Pt. Wide open! Magic Durant is 6.9 feet away. [MAN] Joel Banchero misses. FOUL! Loose ball foul on D'Angelo Iverson during the rebound battle. [IN THE BONUS! 6 team fouls] Collin Bane to the line for 2 free throws. (D'Angelo Iverson: 1 personal fouls)   FT 1/2: GOOD   FT 2/2: GOOD Collin Bane makes 2/2 from the line.
Score: 54-48

[00:22] Team_043 possession (Score: 54-48)
Magic Durant attempts a Midrange. Wide open! LeBron Bridges is 6.5 feet away. [ZONE] MAGIC DURANT MAKES IT!
Score: 56-48

[00:03] Team_050 possession (Score: 56-48)
Joel Banchero drives, Manu Carter stays with him. Joel Banchero attempts a Dunk. Wide open! Manu Carter is 6.3 feet away. [ZONE] JOEL BANCHERO MAKES IT!
Score: 56-50

================================================================================
                              2ND QUARTER COMPLETE                              
================================================================================

2ND QUARTER SCORE: Team_043 31, Team_050 24

BOX SCORE:
================================================================================

Team_043
--------------------------------------------------------------------------------
Player                MIN  PTS  REB  AST  TO      FG   FG%      3P   3P%
--------------------------------------------------------------------------------
Magic Durant           24   11    0    1   0   5/7    71.4     0/0   0.0
Manu Carter            24    8    5    3   0   3/6    50.0     0/0   0.0
Dwyane Dosunmu         24    6    5    2   0   3/3   100.0     0/0   0.0
Malcolm Murray         24    3    0    1   0   1/3    33.3     0/0   0.0
D'Angelo Iverson       24    2    4    0   0   1/2    50.0     0/0   0.0

TEAM: FG: 13/21 (61.9%), 3PT: 2/7 (28.6%), REB: 14 (5 off, 9 def), AST: 7, TO: 0
TEAM FOULS: 6 [Team_050 in BONUS]


Team_050
--------------------------------------------------------------------------------
Player                MIN  PTS  REB  AST  TO      FG   FG%      3P   3P%
--------------------------------------------------------------------------------
Collin Bane            24   12    5    0   0   5/6    83.3     0/0   0.0
Joel Banchero          24    6    1    2   0   3/6    50.0     0/0   0.0
Giannis LaVine         24    3    0    0   0   2/4    50.0     0/0   0.0
Donovan Trent          24    2    0    3   0   1/2    50.0     0/0   0.0
LeBron Bridges         24    1    4    1   0   1/3    33.3     0/0   0.0

TEAM: FG: 12/21 (57.1%), 3PT: 4/10 (40.0%), REB: 10 (2 off, 8 def), AST: 6, TO: 0
TEAM FOULS: 5 [Team_043 in BONUS]

================================================================================

================================================================================
                       3RD QUARTER - Team_043 vs Team_050                       
================================================================================

[12:00] Team_043 possession (Score: 56-50)
Magic Durant attempts a 3Pt. Contested by Joel Banchero (4.3 feet, MAN). MAGIC DURANT MAKES IT!
Score: 59-50

[11:46] Team_050 possession (Score: 59-50)
LeBron Bridges attempts a Layup. Contested by Manu Carter (4.3 feet, ZONE). LeBron Bridges misses. Offensive rebound by LeBron Bridges! LeBron Bridges kicks it out.

[11:31] Team_050 possession (Score: 59-50)
Giannis LaVine attempts a 3Pt. Contested by D'Angelo Iverson (3.3 feet, ZONE). Giannis LaVine misses. FOUL! Loose ball foul on Dwyane Dosunmu during the rebound battle. [Team fouls: 1] No free throws, side out. (Dwyane Dosunmu: 1 personal fouls)

[11:14] Team_050 possession (Score: 59-50)
Joel Banchero attempts a Layup. Contested by Magic Durant (4.9 feet, MAN). Joel Banchero misses. Rebound secured by D'Angelo Iverson.

[11:01] Team_043 possession (Score: 59-50)
D'Angelo Iverson attempts a 3Pt. Contested by Collin Bane (4.2 feet, MAN). D'Angelo Iverson misses. Rebound secured by Collin Bane.

[10:43] Team_050 possession (Score: 59-50)
LeBron Bridges attempts a Midrange. Contested by Manu Carter (4.3 feet, ZONE). LeBron Bridges misses. Rebound secured by Manu Carter.

[10:28] Team_043 possession (Score: 59-50)
Manu Carter attempts a Layup. Contested by LeBron Bridges (4.7 feet, ZONE). MANU CARTER MAKES IT! Assist: Malcolm Murray
Score: 61-50

[10:15] Team_050 possession (Score: 61-50)
Collin Bane drives and kicks out. Donovan Trent attempts a 3Pt. Contested by Manu Carter (4.2 feet, MAN). Donovan Trent misses. Rebound secured by Dwyane Dosunmu.

[10:01] Team_043 possession (Score: 61-50)
Malcolm Murray attempts a 3Pt. Contested by Giannis LaVine (4.0 feet, MAN). Malcolm Murray misses. Rebound secured by Collin Bane.

[09:46] Team_050 possession (Score: 61-50)
Collin Bane attempts a 3Pt. Contested by D'Angelo Iverson (3.1 feet, MAN). COLLIN BANE MAKES IT! Assist: Donovan Trent
Score: 61-53

[09:36] Team_043 possession (Score: 61-53)
Manu Carter drives and kicks out. Malcolm Murray attempts a 3Pt. Contested by Giannis LaVine (3.9 feet, MAN). Malcolm Murray misses. Rebound secured by Joel Banchero.

[09:18] Team_050 possession (Score: 61-53)
Joel Banchero attempts a Midrange. Contested by Magic Durant (4.9 feet, MAN). JOEL BANCHERO MAKES IT! Assist: Donovan Trent
Score: 61-55

[09:03] Team_043 possession (Score: 61-55)
Manu Carter makes the Layup and draws the foul on LeBron Bridges! And-1! Manu Carter to the line for 1. [Team fouls: 1] (LeBron Bridges: 1 personal fouls)   FT 1/1: MISS Manu Carter makes 0/1 from the line. FOUL! Loose ball foul on Joel Banchero during the free throw rebound! [Team fouls: 2] No free throws, side out. (Joel Banchero: 1 personal fouls)
Score: 63-55

[08:51] Team_043 possession (Score: 63-55)
Malcolm Murray drives to the basket... Malcolm Murray throws a bad pass! Stolen by Giannis LaVine! TURNOVER! (live ball)

[08:37] Team_050 possession (Score: 63-55)
Collin Bane makes the Layup and draws the foul on Dwyane Dosunmu! And-1! Collin Bane to the line for 1. [Team fouls: 2] (Dwyane Dosunmu: 2 personal fouls)   FT 1/1: GOOD Collin Bane makes 1/1 from the line.
Score: 63-58

[08:26] Team_043 possession (Score: 63-58)
Malcolm Murray drives, Donovan Trent stays with him. Malcolm Murray attempts a Dunk. Contested by Donovan Trent (4.9 feet, ZONE). MALCOLM MURRAY MAKES IT! Assist: Manu Carter
Score: 65-58

[08:12] Team_050 possession (Score: 65-58)
Donovan Trent attempts a Layup. Contested by Manu Carter (4.0 feet, MAN). DONOVAN TRENT MAKES IT! Assist: Giannis LaVine
Score: 65-60

[07:55] Team_043 possession (Score: 65-60)
Malcolm Murray attempts a Layup. BLOCKED BY GIANNIS LAVINE! Ball is loose! Rebound secured by Collin Bane.

[07:42] Team_050 possession (Score: 65-60)
Donovan Trent drives and kicks out. Collin Bane attempts a 3Pt. Contested by D'Angelo Iverson (2.9 feet, MAN). Collin Bane misses. Rebound secured by D'Angelo Iverson.

[07:27] Team_043 possession (Score: 65-60)
Magic Durant drives to the basket... Magic Durant throws a bad pass out of bounds! TURNOVER! (dead ball)

[07:14] Team_050 possession (Score: 65-60)
Joel Banchero attempts a Midrange. Contested by Manu Carter (4.0 feet, ZONE). Joel Banchero misses. Offensive rebound by LeBron Bridges! LeBron Bridges kicks it out.

[07:00] Team_050 possession (Score: 65-60)
Collin Bane attempts a 3Pt. Contested by D'Angelo Iverson (3.1 feet, ZONE). Collin Bane misses. Rebound secured by Dwyane Dosunmu.

[06:49] Team_043 possession (Score: 65-60)
Dwyane Dosunmu makes the Dunk and draws the foul on Donovan Trent! And-1! Dwyane Dosunmu to the line for 1. [Team fouls: 3] (Donovan Trent: 1 personal fouls)   FT 1/1: GOOD Dwyane Dosunmu makes 1/1 from the line.
Score: 68-60

[06:36] Team_050 possession (Score: 68-60)
Joel Banchero drives to the basket... Joel Banchero throws a bad pass! Stolen by Magic Durant! TURNOVER! (live ball)

[06:24] Team_043 possession (Score: 68-60)
Dwyane Dosunmu drives and kicks out. Malcolm Murray attempts a Midrange. Contested by Giannis LaVine (3.9 feet, MAN). Malcolm Murray misses. Rebound secured by Collin Bane.

[06:12] Team_050 possession (Score: 68-60)
Collin Bane attempts a Midrange. Contested by D'Angelo Iverson (3.1 feet, MAN). Collin Bane misses. Offensive rebound by LeBron Bridges! LeBron Bridges kicks it out.

[05:55] Team_050 possession (Score: 68-60)
Collin Bane attempts a Layup. BLOCKED BY D'ANGELO IVERSON! Ball deflects out of bounds off Collin Bane.

[05:39] Team_043 possession (Score: 68-60)
Manu Carter drives to the basket... Manu Carter loses control! Ball rolls out of bounds! TURNOVER! (dead ball)

[05:24] Team_050 possession (Score: 68-60)
LeBron Bridges drives, Manu Carter stays with him. LeBron Bridges attempts a Layup. Contested by Manu Carter (4.4 feet, MAN). LeBron Bridges misses. Rebound secured by Dwyane Dosunmu.

[05:11] Team_043 possession (Score: 68-60)
FOUL! Reach-in foul on Donovan Trent during the drive. [Team fouls: 4] No free throws, side out. (Donovan Trent: 2 personal fouls)

[04:55] Team_043 possession (Score: 68-60)
Dwyane Dosunmu makes the Dunk and draws the foul on Donovan Trent! And-1! Dwyane Dosunmu to the line for 1. [BONUS: 5 team fouls] (Donovan Trent: 3 personal fouls)   FT 1/1: GOOD Dwyane Dosunmu makes 1/1 from the line.
Score: 71-60

[04:43] Team_050 possession (Score: 71-60)
Collin Bane attempts a Midrange. Contested by D'Angelo Iverson (3.1 feet, ZONE). COLLIN BANE MAKES IT! Assist: Joel Banchero
Score: 71-62

[04:30] Team_043 possession (Score: 71-62)
D'Angelo Iverson attempts a 3Pt. Contested by Giannis LaVine (4.0 feet, ZONE). D'Angelo Iverson misses. Offensive rebound by Manu Carter! Manu Carter kicks it out.

[04:13] Team_043 possession (Score: 71-62)
Manu Carter attempts a Layup. Contested by LeBron Bridges (4.8 feet, MAN). MANU CARTER MAKES IT!
Score: 73-62

[03:53] Team_050 possession (Score: 73-62)
Donovan Trent attempts a 3Pt. Contested by Magic Durant (5.0 feet, ZONE). Donovan Trent misses. Rebound secured by D'Angelo Iverson.

[03:37] Team_043 possession (Score: 73-62)
Manu Carter drives, picks up LeBron Bridges. Help arrives from Joel Banchero! Manu Carter attempts a Layup. Contested by Joel Banchero (4.9 feet, MAN). Manu Carter misses. Rebound secured by Collin Bane.

[03:25] Team_050 possession (Score: 73-62)
Giannis LaVine attempts a Midrange. Contested by Manu Carter (4.8 feet, ZONE). Giannis LaVine misses. Rebound secured by Manu Carter.

[03:08] Team_043 possession (Score: 73-62)
D'Angelo Iverson attempts a Midrange. Contested by Collin Bane (4.3 feet, MAN). D'ANGELO IVERSON MAKES IT!
Score: 75-62

[02:54] Team_050 possession (Score: 75-62)
Collin Bane attempts a Midrange. Contested by D'Angelo Iverson (3.3 feet, MAN). Collin Bane misses. Rebound secured by D'Angelo Iverson.

[02:42] Team_043 possession (Score: 75-62)
FOUL! Reach-in foul on Donovan Trent during the drive. [IN THE BONUS! 6 team fouls] Manu Carter to the line for 2 free throws. (Donovan Trent: 4 personal fouls)   FT 1/2: GOOD   FT 2/2: GOOD Manu Carter makes 2/2 from the line.
Score: 77-62

[02:30] Team_050 possession (Score: 77-62)
LeBron Bridges attempts a Layup. Contested by Manu Carter (4.6 feet, MAN). LeBron Bridges misses. Rebound secured by D'Angelo Iverson.

[02:17] Team_043 possession (Score: 77-62)
FOUL! Shooting foul on Donovan Trent. Dwyane Dosunmu to the line for 2 free throws. [BONUS: 7 team fouls] (Donovan Trent: 5 personal fouls)   FT 1/2: GOOD   FT 2/2: GOOD Dwyane Dosunmu makes 2/2 from the line.
Score: 79-62

[02:02] Team_050 possession (Score: 79-62)
LeBron Bridges attempts a Layup. Contested by Manu Carter (4.7 feet, ZONE). LEBRON BRIDGES MAKES IT!
Score: 79-64

[01:45] Team_043 possession (Score: 79-64)
Dwyane Dosunmu drives to the basket... Dwyane Dosunmu commits a violation (traveling/carry)! TURNOVER! (dead ball)

[01:45] Substitution (Team_043): Malcolm Murray OUT → Jabari Holiday IN (stamina_rule2)

[01:45] Substitution (Team_043): Magic Durant OUT → Ben LaVine IN (stamina_rule2)

[01:45] Substitution (Team_043): D'Angelo Iverson OUT → Dirk Herro IN (stamina_rule2)

[01:45] Substitution (Team_043): Manu Carter OUT → Joel Murray IN (stamina_rule2)

[01:45] Substitution (Team_043): Dwyane Dosunmu OUT → Terry Randle IN (stamina_rule2)

[01:45] Substitution (Team_050): Giannis LaVine OUT → Damian O'Neal IN (stamina_rule2)

[01:45] Substitution (Team_050): Joel Banchero OUT → Dwyane Towns IN (stamina_rule2)

[01:45] Substitution (Team_050): Collin Bane OUT → Larry Curry IN (stamina_rule2)

[01:45] Substitution (Team_050): LeBron Bridges OUT → Luka Gasol IN (stamina_rule2)

[01:45] Substitution (Team_050): Donovan Trent OUT → Tyler Smith IN (stamina_rule2)

[01:32] Team_050 possession (Score: 79-64)
Larry Curry attempts a 3Pt. Contested by Ben LaVine (5.2 feet, ZONE). Larry Curry misses. Rebound secured by Ben LaVine.

[01:17] Team_043 possession (Score: 79-64)
Ben LaVine attempts a Midrange. Contested by Luka Gasol (5.3 feet, ZONE). Ben LaVine misses. Rebound secured by Tyler Smith.

[01:07] Team_050 possession (Score: 79-64)
Damian O'Neal attempts a Midrange. Contested by Jabari Holiday (4.6 feet, MAN). DAMIAN O'NEAL MAKES IT!
Score: 79-66

[00:53] Team_043 possession (Score: 79-66)
Joel Murray attempts a Midrange. Contested by Luka Gasol (5.2 feet, ZONE). Joel Murray misses. Rebound secured by Tyler Smith.

[00:35] Team_050 possession (Score: 79-66)
Luka Gasol drives and kicks out. Larry Curry attempts a 3Pt. Contested by Dirk Herro (4.0 feet, MAN). LARRY CURRY MAKES IT! Assist: Luka Gasol
Score: 79-69

[00:19] Team_043 possession (Score: 79-69)
Joel Murray attempts a Midrange. Contested by Larry Curry (5.2 feet, ZONE). Joel Murray misses. Rebound secured by Dwyane Towns.

[00:07] Team_050 possession (Score: 79-69)
FOUL! Reach-in foul on Terry Randle during the drive. [Team fouls: 3] No free throws, side out. (Terry Randle: 1 personal fouls)

================================================================================
                              3RD QUARTER COMPLETE                              
================================================================================

3RD QUARTER SCORE: Team_043 23, Team_050 19

BOX SCORE:
================================================================================

Team_043
--------------------------------------------------------------------------------
Player                MIN  PTS  REB  AST  TO      FG   FG%      3P   3P%
--------------------------------------------------------------------------------
Dwyane Dosunmu         35    8    3    0   0   3/4    75.0     0/0   0.0
Manu Carter            35    6    4    1   0   3/5    60.0     0/0   0.0
Magic Durant           35    3    0    0   0   1/1   100.0     0/0   0.0
D'Angelo Iverson       35    2    5    0   0   1/2    50.0     0/0   0.0
Malcolm Murray         35    2    0    1   0   1/3    33.3     0/0   0.0
Ben LaVine              2    0    1    0   0   0/1     0.0     0/0   0.0
Joel Murray             2    0    0    0   0   0/2     0.0     0/0   0.0

TEAM: FG: 9/18 (50.0%), 3PT: 1/3 (33.3%), REB: 13 (2 off, 11 def), AST: 2, TO: 4
TEAM FOULS: 3


Team_050
--------------------------------------------------------------------------------
Player                MIN  PTS  REB  AST  TO      FG   FG%      3P   3P%
--------------------------------------------------------------------------------
Collin Bane            35    8    5    0   0   3/7    42.9     0/0   0.0
Larry Curry             2    3    0    0   0   1/2    50.0     0/0   0.0
LeBron Bridges         35    2    4    0   0   1/4    25.0     0/0   0.0
Joel Banchero          35    2    1    1   0   1/2    50.0     0/0   0.0
Donovan Trent          35    2    0    2   0   1/3    33.3     0/0   0.0
Damian O'Neal           2    2    0    0   0   1/1   100.0     0/0   0.0
Giannis LaVine         35    0    0    1   0   0/1     0.0     0/0   0.0
Tyler Smith             2    0    2    0   0   0/0     0.0     0/0   0.0
Luka Gasol              2    0    0    1   0   0/0     0.0     0/0   0.0
Dwyane Towns            2    0    1    0   0   0/0     0.0     0/0   0.0

TEAM: FG: 8/20 (40.0%), 3PT: 1/4 (25.0%), REB: 13 (4 off, 9 def), AST: 5, TO: 1
TEAM FOULS: 7 [Team_043 in BONUS]

================================================================================

================================================================================
                       4TH QUARTER - Team_043 vs Team_050                       
================================================================================

[12:00] Team_043 possession (Score: 79-69)
Malcolm Murray drives and kicks out. Dwyane Dosunmu attempts a 3Pt. Contested by Giannis LaVine (4.0 feet, ZONE). Dwyane Dosunmu misses. Rebound secured by LeBron Bridges.

[11:42] Team_050 possession (Score: 79-69)
LeBron Bridges drives and kicks out. Giannis LaVine attempts a 3Pt. Contested by Malcolm Murray (3.8 feet, MAN). Giannis LaVine misses. Rebound secured by Dwyane Dosunmu.

[11:31] Team_043 possession (Score: 79-69)
Manu Carter attempts a 3Pt. Contested by LeBron Bridges (4.9 feet, MAN). MANU CARTER MAKES IT! Assist: Magic Durant
Score: 82-69

[11:16] Team_050 possession (Score: 82-69)
Collin Bane drives, Manu Carter stays with him. Collin Bane attempts a Dunk. Contested by Manu Carter (4.5 feet, ZONE). Collin Bane misses. Offensive rebound by Collin Bane! Collin Bane kicks it out.

[11:00] Team_050 possession (Score: 82-69)
Donovan Trent drives and kicks out. Joel Banchero attempts a 3Pt. Contested by Manu Carter (4.4 feet, ZONE). JOEL BANCHERO MAKES IT! Assist: Donovan Trent
Score: 82-72

[10:48] Team_043 possession (Score: 82-72)
D'Angelo Iverson attempts a Midrange. Contested by Collin Bane (4.3 feet, MAN). D'Angelo Iverson misses. Rebound secured by Collin Bane.

[10:30] Team_050 possession (Score: 82-72)
Collin Bane attempts a Layup. Contested by D'Angelo Iverson (3.3 feet, MAN). COLLIN BANE MAKES IT! Assist: Giannis LaVine
Score: 82-74

[10:17] Team_043 possession (Score: 82-74)
Manu Carter drives, Donovan Trent stays with him. Manu Carter attempts a Layup. Contested by Donovan Trent (5.6 feet, ZONE). MANU CARTER MAKES IT!
Score: 84-74

[09:59] Team_050 possession (Score: 84-74)
Collin Bane drives and kicks out. Collin Bane attempts a 3Pt. Contested by D'Angelo Iverson (3.2 feet, ZONE). COLLIN BANE MAKES IT! Assist: Joel Banchero
Score: 84-77

[09:43] Team_043 possession (Score: 84-77)
Malcolm Murray attempts a 3Pt. Contested by Giannis LaVine (4.3 feet, ZONE). Malcolm Murray misses. Offensive rebound by D'Angelo Iverson! D'Angelo Iverson kicks it out.

[09:27] Team_043 possession (Score: 84-77)
Malcolm Murray attempts a 3Pt. Contested by Giannis LaVine (4.3 feet, ZONE). MALCOLM MURRAY MAKES IT! Assist: Dwyane Dosunmu
Score: 87-77

[09:11] Team_050 possession (Score: 87-77)
Donovan Trent attempts a 3Pt. Contested by Manu Carter (4.3 feet, MAN). Donovan Trent misses. Rebound secured by Dwyane Dosunmu.

[08:54] Team_043 possession (Score: 87-77)
Malcolm Murray attempts a Midrange. Contested by Giannis LaVine (4.3 feet, MAN). MALCOLM MURRAY MAKES IT! Assist: Dwyane Dosunmu
Score: 89-77

[08:41] Team_050 possession (Score: 89-77)
Donovan Trent drives, Manu Carter stays with him. Donovan Trent attempts a Dunk. Contested by Manu Carter (4.4 feet, ZONE). Donovan Trent misses. Rebound secured by D'Angelo Iverson.

[08:29] Team_043 possession (Score: 89-77)
Magic Durant attempts a 3Pt. Contested by Giannis LaVine (4.3 feet, ZONE). Magic Durant misses. Rebound secured by Collin Bane.

[08:13] Team_050 possession (Score: 89-77)
Joel Banchero attempts a 3Pt. Contested by Magic Durant (5.4 feet, MAN). Joel Banchero misses. Rebound secured by Manu Carter.

[08:01] Team_043 possession (Score: 89-77)
Malcolm Murray attempts a 3Pt. Contested by Giannis LaVine (4.4 feet, MAN). Malcolm Murray misses. Offensive rebound by D'Angelo Iverson! D'Angelo Iverson kicks it out.

[07:49] Team_043 possession (Score: 89-77)
Manu Carter attempts a 3Pt. Contested by LeBron Bridges (5.3 feet, MAN). Manu Carter misses. Rebound secured by Joel Banchero.

[07:37] Team_050 possession (Score: 89-77)
Donovan Trent drives to the basket... FOUL! Offensive foul on Donovan Trent! Manu Carter drew the charge! [Team fouls: 1] (Donovan Trent: 1 personal fouls) TURNOVER! (dead ball)

[07:22] Team_043 possession (Score: 89-77)
Magic Durant attempts a 3Pt. Contested by Joel Banchero (4.7 feet, MAN). Magic Durant misses. Offensive rebound by D'Angelo Iverson! D'Angelo Iverson kicks it out.

[07:12] Team_043 possession (Score: 89-77)
Malcolm Murray attempts a 3Pt. Contested by Giannis LaVine (4.6 feet, ZONE). Malcolm Murray misses. Rebound secured by LeBron Bridges.

[06:58] Team_050 possession (Score: 89-77)
Collin Bane attempts a 3Pt. Contested by D'Angelo Iverson (3.7 feet, ZONE). Collin Bane misses. Rebound secured by D'Angelo Iverson.

[06:43] Team_043 possession (Score: 89-77)
Malcolm Murray attempts a 3Pt. Contested by Giannis LaVine (4.6 feet, ZONE). Malcolm Murray misses. Offensive rebound by D'Angelo Iverson! D'Angelo Iverson kicks it out.

[06:28] Team_043 possession (Score: 89-77)
Manu Carter attempts a 3Pt. Contested by LeBron Bridges (5.5 feet, MAN). Manu Carter misses. Rebound secured by LeBron Bridges.

[06:10] Team_050 possession (Score: 89-77)
Collin Bane attempts a Midrange. Contested by D'Angelo Iverson (3.8 feet, MAN). Collin Bane misses. Rebound secured by Dwyane Dosunmu.

[05:51] Team_043 possession (Score: 89-77)
Manu Carter attempts a 3Pt. Contested by LeBron Bridges (5.5 feet, MAN). Manu Carter misses. Offensive rebound by Manu Carter! Manu Carter kicks it out.

[05:37] Team_043 possession (Score: 89-77)
Magic Durant makes the Layup and draws the foul on Donovan Trent! And-1! Magic Durant to the line for 1. [Team fouls: 2] (Donovan Trent: 2 personal fouls)   FT 1/1: GOOD Magic Durant makes 1/1 from the line.
Score: 92-77

[05:22] Team_050 possession (Score: 92-77)
Joel Banchero attempts a 3Pt. Contested by Magic Durant (5.8 feet, MAN). Joel Banchero misses. Rebound secured by Manu Carter.

[05:09] Team_043 possession (Score: 92-77)
Malcolm Murray makes the Dunk and draws the foul on Donovan Trent! And-1! Malcolm Murray to the line for 1. [Team fouls: 3] (Donovan Trent: 3 personal fouls)   FT 1/1: GOOD Malcolm Murray makes 1/1 from the line.
Score: 95-77

[04:56] Team_050 possession (Score: 95-77)
Collin Bane attempts a 3Pt. Contested by D'Angelo Iverson (4.0 feet, ZONE). Collin Bane misses. Rebound secured by Manu Carter.

[04:40] Team_043 possession (Score: 95-77)
Magic Durant attempts a Midrange. Contested by Joel Banchero (5.0 feet, MAN). Magic Durant misses. Offensive rebound by Manu Carter! Manu Carter kicks it out.

[04:28] Team_043 possession (Score: 95-77)
Dwyane Dosunmu makes the Layup and draws the foul on Donovan Trent! And-1! Dwyane Dosunmu to the line for 1. [Team fouls: 4] (Donovan Trent: 4 personal fouls)   FT 1/1: GOOD Dwyane Dosunmu makes 1/1 from the line.
Score: 98-77

[04:09] Team_050 possession (Score: 98-77)
Giannis LaVine attempts a 3Pt. Contested by Malcolm Murray (5.0 feet, MAN). GIANNIS LAVINE MAKES IT! Assist: LeBron Bridges
Score: 98-80

[03:54] Team_043 possession (Score: 98-80)
Dwyane Dosunmu drives, Donovan Trent stays with him. Dwyane Dosunmu attempts a Dunk. Contested by Donovan Trent (5.9 feet, ZONE). DWYANE DOSUNMU MAKES IT! Assist: Manu Carter
Score: 100-80

[03:43] Team_050 possession (Score: 100-80)
LeBron Bridges attempts a 3Pt. Contested by Manu Carter (5.4 feet, MAN). LeBron Bridges misses. Rebound secured by Dwyane Dosunmu.

[03:29] Team_043 possession (Score: 100-80)
FOUL! Shooting foul on LeBron Bridges. Manu Carter to the line for 2 free throws. [BONUS: 5 team fouls] (LeBron Bridges: 1 personal fouls)   FT 1/2: GOOD   FT 2/2: GOOD Manu Carter makes 2/2 from the line.
Score: 102-80

[03:16] Team_050 possession (Score: 102-80)
Joel Banchero attempts a 3Pt. Contested by D'Angelo Iverson (3.9 feet, ZONE). Joel Banchero misses. Rebound secured by D'Angelo Iverson.

[03:05] Team_043 possession (Score: 102-80)
Dwyane Dosunmu drives, Donovan Trent stays with him. Dwyane Dosunmu attempts a Layup. Wide open! Donovan Trent is 6.0 feet away. [ZONE] Dwyane Dosunmu misses. Offensive rebound by Manu Carter! Manu Carter kicks it out.

[02:48] Team_043 possession (Score: 102-80)
D'Angelo Iverson attempts a 3Pt. Contested by Collin Bane (5.2 feet, MAN). D'Angelo Iverson misses. FOUL! Loose ball foul on Joel Banchero during the rebound battle. [IN THE BONUS! 6 team fouls] D'Angelo Iverson to the line for 2 free throws. (Joel Banchero: 1 personal fouls)   FT 1/2: GOOD   FT 2/2: GOOD D'Angelo Iverson makes 2/2 from the line.
Score: 104-80

[02:33] Team_050 possession (Score: 104-80)
Joel Banchero attempts a 3Pt. Wide open! Magic Durant is 6.2 feet away. [MAN] JOEL BANCHERO MAKES IT! Assist: Donovan Trent
Score: 104-83

[02:18] Team_043 possession (Score: 104-83)
D'Angelo Iverson attempts a 3Pt. Contested by Collin Bane (5.3 feet, MAN). D'Angelo Iverson misses. Rebound secured by LeBron Bridges.

[02:06] Team_050 possession (Score: 104-83)
Joel Banchero attempts a 3Pt. Wide open! Magic Durant is 6.2 feet away. [MAN] Joel Banchero misses. Rebound secured by Manu Carter.

[01:55] Team_043 possession (Score: 104-83)
D'Angelo Iverson attempts a Midrange. Contested by Collin Bane (5.4 feet, MAN). D'ANGELO IVERSON MAKES IT!
Score: 106-83

[01:40] Team_050 possession (Score: 106-83)
Giannis LaVine attempts a 3Pt. Contested by D'Angelo Iverson (4.7 feet, ZONE). GIANNIS LAVINE MAKES IT!
Score: 106-86

[01:26] Team_043 possession (Score: 106-86)
Magic Durant attempts a 3Pt. Contested by Joel Banchero (5.5 feet, MAN). Magic Durant misses. Offensive rebound by D'Angelo Iverson! D'Angelo Iverson kicks it out.

[01:15] Team_043 possession (Score: 106-86)
D'Angelo Iverson drives, Collin Bane stays with him. D'Angelo Iverson attempts a Dunk. Contested by Collin Bane (5.5 feet, MAN). D'ANGELO IVERSON MAKES IT!
Score: 108-86

[00:59] Team_050 possession (Score: 108-86)
Donovan Trent attempts a Midrange. Wide open! Dwyane Dosunmu is 6.2 feet away. [MAN] Donovan Trent misses. FOUL! Loose ball foul on Manu Carter during the rebound battle. [Team fouls: 1] No free throws, side out. (Manu Carter: 1 personal fouls)

[00:46] Team_050 possession (Score: 108-86)
Collin Bane attempts a 3Pt. Contested by Manu Carter (5.9 feet, ZONE). Collin Bane misses. Rebound secured by D'Angelo Iverson.

[00:32] Team_043 possession (Score: 108-86)
Magic Durant attempts a 3Pt. Contested by Joel Banchero (5.6 feet, MAN). MAGIC DURANT MAKES IT! Assist: Manu Carter
Score: 111-86

[00:17] Team_050 possession (Score: 111-86)
FOUL! Offensive foul on Collin Bane! D'Angelo Iverson drew the charge! [Team fouls: 7] (Collin Bane: 1 personal fouls) TURNOVER! (dead ball)

================================================================================
                              4TH QUARTER COMPLETE                              
================================================================================

4TH QUARTER SCORE: Team_043 32, Team_050 17

BOX SCORE:
================================================================================

Team_043
--------------------------------------------------------------------------------
Player                MIN  PTS  REB  AST  TO      FG   FG%      3P   3P%
--------------------------------------------------------------------------------
Malcolm Murray         47    8    0    0   0   3/5    60.0     0/0   0.0
Manu Carter            47    7    7    2   0   3/5    60.0     0/0   0.0
Magic Durant           47    6    0    1   0   2/3    66.7     0/0   0.0
D'Angelo Iverson       47    6    9    0   0   3/5    60.0     0/0   0.0
Dwyane Dosunmu         47    5    4    2   0   2/2   100.0     0/0   0.0

TEAM: FG: 13/20 (65.0%), 3PT: 4/9 (44.4%), REB: 20 (8 off, 12 def), AST: 5, TO: 0
TEAM FOULS: 1


Team_050
--------------------------------------------------------------------------------
Player                MIN  PTS  REB  AST  TO      FG   FG%      3P   3P%
--------------------------------------------------------------------------------
Joel Banchero          47    6    1    1   0   2/6    33.3     0/0   0.0
Giannis LaVine         47    6    0    1   0   2/2   100.0     0/0   0.0
Collin Bane            47    5    4    0   0   2/6    33.3     0/0   0.0
LeBron Bridges         47    0    4    1   0   0/2     0.0     0/0   0.0
Donovan Trent          47    0    0    2   0   0/2     0.0     0/0   0.0

TEAM: FG: 6/18 (33.3%), 3PT: 3/12 (25.0%), REB: 9 (2 off, 7 def), AST: 5, TO: 2
TEAM FOULS: 7 [Team_043 in BONUS]

================================================================================

================================================================================
                               FULL GAME COMPLETE                               
================================================================================

FINAL SCORE: Team_043 111, Team_050 86

SCORING BY QUARTER:
--------------------------------------------------------------------------------
Team                     Q1     Q2     Q3     Q4    FINAL
--------------------------------------------------------------------------------
Team_043                 25     31     23     32      111
Team_050                 26     24     19     17       86
--------------------------------------------------------------------------------

FULL GAME BOX SCORE:
================================================================================

Team_043
--------------------------------------------------------------------------------
Player                MIN  PTS  REB  AST  TO      FG   FG%      3P   3P%      FT STL BLK
--------------------------------------------------------------------------------
Malcolm Murray         47   18    0    3   3   7/15   46.7   3/8    37.5   4/4     0   1
Magic Durant           47   25    0    4   0   9/12   75.0   2/4    50.0   2/2     1   0
D'Angelo Iverson       47   17   22    0   0   7/13   53.8   2/6    33.3   4/5     0   1
Manu Carter            47   23   18    6   2  11/20   55.0   2/5    40.0   6/8     1   1
Dwyane Dosunmu         47   21   14    5   1   9/15   60.0   0/0     0.0   7/8     0   0
Jabari Holiday          2    0    0    0   0   0/0     0.0   0/0     0.0   0/0     0   0
Ben LaVine              2    0    1    0   0   0/1     0.0   0/0     0.0   0/0     0   0
Dirk Herro              2    0    0    0   0   0/0     0.0   0/0     0.0   0/0     0   0
Joel Murray             2    0    0    0   0   0/2     0.0   0/0     0.0   0/0     0   0
Terry Randle            2    0    0    0   0   0/0     0.0   0/0     0.0   0/0     0   0

TEAM: FG: 44/79 (55.7%), 3PT: 9/23 (39.1%), REB: 55 (17 off, 38 def), AST: 18, TO: 6


Team_050
--------------------------------------------------------------------------------
Player                MIN  PTS  REB  AST  TO      FG   FG%      3P   3P%      FT STL BLK
--------------------------------------------------------------------------------
Giannis LaVine         47    9    0    3   0   4/9    44.4   3/5    60.0   1/5     1   2
Joel Banchero          47   16    6    5   0   7/16   43.8   2/10   20.0   0/0     0   0
Collin Bane            47   36   20    1   1  14/24   58.3   3/9    33.3   4/4     0   0
LeBron Bridges         47   12   16    5   4   5/14   35.7   1/4    25.0   3/4     0   0
Donovan Trent          47    8    0    7   1   5/11   45.5   0/2     0.0   4/4     1   0
Damian O'Neal           2    2    0    0   0   1/1   100.0   0/0     0.0   0/0     0   0
Dwyane Towns            2    0    1    0   0   0/0     0.0   0/0     0.0   0/0     0   0
Larry Curry             2    3    0    0   0   0/1     0.0   0/1     0.0   0/0     0   0
Luka Gasol              2    0    0    1   0   1/1   100.0   0/0     0.0   0/0     0   0
Tyler Smith             2    0    2    0   0   0/0     0.0   0/0     0.0   0/0     0   0

TEAM: FG: 37/77 (48.1%), 3PT: 9/31 (29.0%), REB: 45 (11 off, 34 def), AST: 22, TO: 6

================================================================================
