================================================================================
                        FULL GAME - Team_036 vs Team_043                        
================================================================================

================================================================================
                       1ST QUARTER - Team_036 vs Team_043                       
================================================================================

[12:00] Team_036 possession (Score: 0-0)
Anthony Poole attempts a 3Pt. Contested by D'Angelo Iverson (3.6 feet, MAN). Anthony Poole misses. Rebound secured by Manu Carter.

[11:43] Team_043 possession (Score: 0-0)
FOUL! Shooting foul on Giannis Booker. Magic Durant to the line for 2 free throws. [Team fouls: 1] (Giannis Booker: 1 personal fouls)   FT 1/2: GOOD   FT 2/2: GOOD Magic Durant makes 2/2 from the line.
Score: 0-2

[11:30] Team_036 possession (Score: 0-2)
Terry Durant attempts a 3Pt. Contested by D'Angelo Iverson (3.4 feet, ZONE). Terry Durant misses. Rebound secured by D'Angelo Iverson.

[11:16] Team_043 possession (Score: 0-2)
Dwyane Dosunmu makes the Midrange and draws the foul on Kobe Simmons! And-1! Dwyane Dosunmu to the line for 1. [Team fouls: 2] (Kobe Simmons: 1 personal fouls)   FT 1/1: GOOD Dwyane Dosunmu makes 1/1 from the line.
Score: 0-5

[10:59] Team_036 possession (Score: 0-5)
Terry Durant makes the Layup and draws the foul on Manu Carter! And-1! Terry Durant to the line for 1. [Team fouls: 1] (Manu Carter: 1 personal fouls)   FT 1/1: GOOD Terry Durant makes 1/1 from the line.
Score: 3-5

[10:47] Team_043 possession (Score: 3-5)
Dwyane Dosunmu attempts a Layup. Contested by Kobe Simmons (3.5 feet, ZONE). DWYANE DOSUNMU MAKES IT!
Score: 3-7

[10:33] Team_036 possession (Score: 3-7)
Giannis Booker makes the Dunk and draws the foul on Manu Carter! And-1! Giannis Booker to the line for 1. [Team fouls: 2] (Manu Carter: 2 personal fouls)   FT 1/1: GOOD Giannis Booker makes 1/1 from the line.
Score: 6-7

[10:23] Team_043 possession (Score: 6-7)
Dwyane Dosunmu makes the Dunk and draws the foul on Giannis Booker! And-1! Dwyane Dosunmu to the line for 1. [Team fouls: 3] (Giannis Booker: 2 personal fouls)   FT 1/1: MISS Dwyane Dosunmu makes 0/1 from the line. Offensive rebound by Manu Carter! Manu Carter kicks it out.
Score: 6-9

[10:10] Team_043 possession (Score: 6-9)
Dwyane Dosunmu attempts a 3Pt. Contested by Kobe Simmons (3.5 feet, MAN). Dwyane Dosunmu misses. Rebound secured by Terry Durant.

[09:57] Team_036 possession (Score: 6-9)
Terry Durant attempts a 3Pt. Contested by D'Angelo Iverson (3.4 feet, ZONE). Terry Durant misses. Rebound secured by D'Angelo Iverson.

[09:47] Team_043 possession (Score: 6-9)
Manu Carter attempts a Midrange. Contested by Giannis Booker (5.0 feet, ZONE). MANU CARTER MAKES IT! Assist: D'Angelo Iverson
Score: 6-11

[09:29] Team_036 possession (Score: 6-11)
Giannis Booker attempts a Midrange. Contested by Magic Durant (5.5 feet, MAN). Giannis Booker misses. Rebound secured by Dwyane Dosunmu.

[09:10] Team_043 possession (Score: 6-11)
FOUL! Reach-in foul on Kobe Simmons during the drive. [Team fouls: 4] No free throws, side out. (Kobe Simmons: 2 personal fouls)

[08:57] Team_043 possession (Score: 6-11)
FOUL! Shooting foul on Giannis Booker. D'Angelo Iverson to the line for 2 free throws. [BONUS: 5 team fouls] (Giannis Booker: 3 personal fouls)   FT 1/2: GOOD   FT 2/2: GOOD D'Angelo Iverson makes 2/2 from the line.
Score: 6-13

[08:45] Team_036 possession (Score: 6-13)
Anthony Poole drives to the basket... FOUL! Offensive foul on Anthony Poole! D'Angelo Iverson drew the charge! [Team fouls: 6] (Anthony Poole: 1 personal fouls) TURNOVER! (dead ball)

[08:28] Team_043 possession (Score: 6-13)
D'Angelo Iverson drives to the basket... D'Angelo Iverson throws a bad pass! Stolen by Anthony Poole! TURNOVER! (live ball)

[08:16] Team_036 possession (Score: 6-13)
FOUL! Shooting foul on D'Angelo Iverson. Anthony Poole to the line for 3 free throws. [Team fouls: 3] (D'Angelo Iverson: 1 personal fouls)   FT 1/3: GOOD   FT 2/3: GOOD   FT 3/3: GOOD Anthony Poole makes 3/3 from the line.
Score: 9-13

[08:03] Team_043 possession (Score: 9-13)
D'Angelo Iverson attempts a 3Pt. Contested by Terry Durant (4.5 feet, ZONE). D'Angelo Iverson misses. Offensive rebound by D'Angelo Iverson! D'Angelo Iverson kicks it out.

[07:45] Team_043 possession (Score: 9-13)
Magic Durant drives, picks up Giannis Booker. Help arrives from Anthony Poole! Magic Durant attempts a Layup. Contested by Anthony Poole (4.5 feet, MAN). MAGIC DURANT MAKES IT!
Score: 9-15

[07:31] Team_036 possession (Score: 9-15)
Giannis Booker attempts a 3Pt. Contested by D'Angelo Iverson (3.3 feet, ZONE). GIANNIS BOOKER MAKES IT! Assist: Kobe Simmons
Score: 12-15

[07:19] Team_043 possession (Score: 12-15)
Manu Carter throws a bad pass! Stolen by Terry Durant! TURNOVER! (live ball)

[07:01] Team_036 possession (Score: 12-15)
Michael Westbrook attempts a Midrange. Contested by Manu Carter (4.7 feet, ZONE). Michael Westbrook misses. Rebound secured by Dwyane Dosunmu.

[06:50] Team_043 possession (Score: 12-15)
D'Angelo Iverson attempts a 3Pt. Contested by Michael Westbrook (4.7 feet, ZONE). D'Angelo Iverson misses. Rebound secured by Kobe Simmons.

[06:33] Team_036 possession (Score: 12-15)
Michael Westbrook drives to the basket... Michael Westbrook throws a bad pass out of bounds! TURNOVER! (dead ball)

[06:16] Team_043 possession (Score: 12-15)
FOUL! Shooting foul on Giannis Booker. D'Angelo Iverson to the line for 2 free throws. [BONUS: 7 team fouls] (Giannis Booker: 4 personal fouls)   FT 1/2: GOOD   FT 2/2: GOOD D'Angelo Iverson makes 2/2 from the line.
Score: 12-17

[06:00] Team_036 possession (Score: 12-17)
Kobe Simmons attempts a 3Pt. Contested by Manu Carter (4.6 feet, MAN). KOBE SIMMONS MAKES IT! Assist: Anthony Poole
Score: 15-17

[05:43] Team_043 possession (Score: 15-17)
Manu Carter drives and kicks out. FOUL! Shooting foul on Anthony Poole. D'Angelo Iverson to the line for 2 free throws. [BONUS: 8 team fouls] (Anthony Poole: 2 personal fouls)   FT 1/2: GOOD   FT 2/2: GOOD D'Angelo Iverson makes 2/2 from the line.
Score: 15-19

[05:30] Team_036 possession (Score: 15-19)
Terry Durant makes the Layup and draws the foul on Manu Carter! And-1! Terry Durant to the line for 1. [Team fouls: 4] (Manu Carter: 3 personal fouls)   FT 1/1: MISS Terry Durant makes 0/1 from the line. Rebound secured by Dwyane Dosunmu.
Score: 17-19

[05:14] Team_043 possession (Score: 17-19)
Manu Carter drives and kicks out. Manu Carter attempts a 3Pt. Contested by Michael Westbrook (4.7 feet, ZONE). MANU CARTER MAKES IT! Assist: Dwyane Dosunmu
Score: 17-22

[05:01] Team_036 possession (Score: 17-22)
Michael Westbrook attempts a 3Pt. Contested by Malcolm Murray (4.2 feet, MAN). MICHAEL WESTBROOK MAKES IT! Assist: Terry Durant
Score: 20-22

[04:47] Team_043 possession (Score: 20-22)
Dwyane Dosunmu attempts a 3Pt. Contested by Michael Westbrook (4.7 feet, ZONE). Dwyane Dosunmu misses. Rebound secured by Kobe Simmons.

[04:35] Team_036 possession (Score: 20-22)
Giannis Booker attempts a Layup. Contested by Dwyane Dosunmu (5.3 feet, ZONE). GIANNIS BOOKER MAKES IT! Assist: Kobe Simmons
Score: 22-22

[04:20] Team_043 possession (Score: 22-22)
Malcolm Murray drives and kicks out. Magic Durant attempts a 3Pt. Contested by Giannis Booker (4.6 feet, MAN). MAGIC DURANT MAKES IT! Assist: D'Angelo Iverson
Score: 22-25

[04:07] Team_036 possession (Score: 22-25)
Kobe Simmons drives, Manu Carter stays with him. Kobe Simmons attempts a Layup. Contested by Manu Carter (4.7 feet, ZONE). KOBE SIMMONS MAKES IT! Assist: Terry Durant
Score: 24-25

[03:52] Team_043 possession (Score: 24-25)
Magic Durant attempts a Midrange. Contested by Giannis Booker (4.6 feet, MAN). MAGIC DURANT MAKES IT! Assist: Manu Carter
Score: 24-27

[03:35] Team_036 possession (Score: 24-27)
Giannis Booker makes the Dunk and draws the foul on Magic Durant! And-1! Giannis Booker to the line for 1. [BONUS: 5 team fouls] (Magic Durant: 1 personal fouls)   FT 1/1: GOOD Giannis Booker makes 1/1 from the line.
Score: 27-27

[03:20] Team_043 possession (Score: 27-27)
Dwyane Dosunmu attempts a Midrange. Contested by Kobe Simmons (3.7 feet, MAN). DWYANE DOSUNMU MAKES IT!
Score: 27-29

[03:04] Team_036 possession (Score: 27-29)
Kobe Simmons drives to the basket... Kobe Simmons loses the ball! Stripped by Manu Carter! TURNOVER! (live ball)

[02:51] Team_043 possession (Score: 27-29)
Magic Durant attempts a Layup. Contested by Kobe Simmons (3.7 feet, ZONE). Magic Durant misses. Rebound secured by Giannis Booker.

[02:38] Team_036 possession (Score: 27-29)
Giannis Booker attempts a 3Pt. Contested by Magic Durant (5.7 feet, MAN). GIANNIS BOOKER MAKES IT! Assist: Anthony Poole
Score: 30-29

[02:21] Team_043 possession (Score: 30-29)
Magic Durant attempts a 3Pt. Contested by Giannis Booker (4.7 feet, MAN). Magic Durant misses. Rebound secured by Kobe Simmons.

[02:07] Team_036 possession (Score: 30-29)
Anthony Poole attempts a Midrange. Contested by D'Angelo Iverson (3.9 feet, MAN). Anthony Poole misses. Rebound secured by Dwyane Dosunmu.

[01:52] Team_043 possession (Score: 30-29)
Manu Carter drives and kicks out. Malcolm Murray attempts a 3Pt. Contested by Michael Westbrook (5.0 feet, MAN). MALCOLM MURRAY MAKES IT! Assist: Dwyane Dosunmu
Score: 30-32

[01:37] Team_036 possession (Score: 30-32)
Michael Westbrook attempts a Layup. Contested by Manu Carter (5.0 feet, ZONE). MICHAEL WESTBROOK MAKES IT!
Score: 32-32

[01:21] Team_043 possession (Score: 32-32)
Malcolm Murray attempts a Layup. Contested by Kobe Simmons (4.0 feet, ZONE). Malcolm Murray misses. Rebound secured by Kobe Simmons.

[01:09] Team_036 possession (Score: 32-32)
Kobe Simmons attempts a Midrange. Contested by Magic Durant (5.9 feet, ZONE). Kobe Simmons misses. Rebound secured by D'Angelo Iverson.

[00:55] Team_043 possession (Score: 32-32)
Manu Carter attempts a 3Pt. Contested by Giannis Booker (5.3 feet, ZONE). Manu Carter misses. Rebound secured by Giannis Booker.

[00:45] Team_036 possession (Score: 32-32)
Terry Durant attempts a Layup. Contested by Manu Carter (5.1 feet, ZONE). TERRY DURANT MAKES IT!
Score: 34-32

[00:32] Team_043 possession (Score: 34-32)
Manu Carter attempts a Midrange. Contested by Anthony Poole (5.7 feet, ZONE). Manu Carter misses. Offensive rebound by Manu Carter! Manu Carter kicks it out.

[00:13] Team_043 possession (Score: 34-32)
D'Angelo Iverson drives, Kobe Simmons stays with him. D'Angelo Iverson attempts a Dunk. Contested by Kobe Simmons (4.1 feet, ZONE). D'Angelo Iverson misses. Offensive rebound by Manu Carter! Manu Carter kicks it out.

================================================================================
                              1ST QUARTER COMPLETE                              
================================================================================

1ST QUARTER SCORE: Team_036 34, Team_043 32

BOX SCORE:
================================================================================

Team_036
--------------------------------------------------------------------------------
Player                MIN  PTS  REB  AST  TO      FG   FG%      3P   3P%
--------------------------------------------------------------------------------
Giannis Booker         12   14    2    0   0   5/6    83.3     0/0   0.0
Terry Durant           12    5    1    2   0   2/5    40.0     0/0   0.0
Kobe Simmons           12    5    4    2   0   2/3    66.7     0/0   0.0
Michael Westbrook      12    5    0    0   0   2/3    66.7     0/0   0.0
Anthony Poole          12    3    0    2   0   1/3    33.3     0/0   0.0

TEAM: FG: 12/20 (60.0%), 3PT: 5/8 (62.5%), REB: 7 (0 off, 7 def), AST: 6, TO: 3
TEAM FOULS: 8 [Team_043 in BONUS]


Team_043
--------------------------------------------------------------------------------
Player                MIN  PTS  REB  AST  TO      FG   FG%      3P   3P%
--------------------------------------------------------------------------------
Magic Durant           12    9    0    0   0   4/6    66.7     0/0   0.0
Dwyane Dosunmu         12    7    4    2   0   3/5    60.0     0/0   0.0
D'Angelo Iverson       12    6    4    2   0   3/4    75.0     0/0   0.0
Manu Carter            12    5    4    1   0   2/3    66.7     0/0   0.0
Malcolm Murray         12    3    0    0   0   1/2    50.0     0/0   0.0

TEAM: FG: 13/20 (65.0%), 3PT: 0/5 (0.0%), REB: 12 (4 off, 8 def), AST: 5, TO: 2
TEAM FOULS: 5 [Team_036 in BONUS]

================================================================================

================================================================================
                       2ND QUARTER - Team_036 vs Team_043                       
================================================================================

[12:00] Team_036 possession (Score: 34-32)
Terry Durant attempts a Midrange. Contested by D'Angelo Iverson (3.6 feet, ZONE). TERRY DURANT MAKES IT! Assist: Michael Westbrook
Score: 36-32

[11:43] Team_043 possession (Score: 36-32)
Dwyane Dosunmu attempts a Midrange. Contested by Terry Durant (4.8 feet, ZONE). Dwyane Dosunmu misses. Rebound secured by Kobe Simmons.

[11:29] Team_036 possession (Score: 36-32)
Michael Westbrook attempts a 3Pt. Contested by D'Angelo Iverson (3.7 feet, ZONE). MICHAEL WESTBROOK MAKES IT! Assist: Giannis Booker
Score: 39-32

[11:10] Team_043 possession (Score: 39-32)
Magic Durant attempts a Midrange. Contested by Giannis Booker (4.8 feet, ZONE). MAGIC DURANT MAKES IT!
Score: 39-34

[10:53] Team_036 possession (Score: 39-34)
Kobe Simmons drives, Manu Carter stays with him. Kobe Simmons attempts a Dunk. Contested by Manu Carter (5.0 feet, MAN). KOBE SIMMONS MAKES IT! Assist: Terry Durant
Score: 41-34

[10:40] Team_043 possession (Score: 41-34)
Manu Carter attempts a 3Pt. Contested by Terry Durant (5.3 feet, MAN). Manu Carter misses. Rebound secured by Kobe Simmons.

[10:24] Team_036 possession (Score: 41-34)
FOUL! Holding foul on Malcolm Murray. [Team fouls: 1] No free throws, side out. (Malcolm Murray: 1 personal fouls)

[10:06] Team_036 possession (Score: 41-34)
Kobe Simmons attempts a 3Pt. Contested by Magic Durant (6.0 feet, ZONE). Kobe Simmons misses. Rebound secured by Manu Carter.

[09:54] Team_043 possession (Score: 41-34)
D'Angelo Iverson attempts a Midrange. BLOCKED BY ANTHONY POOLE! Ball is loose! Rebound secured by Terry Durant.

[09:41] Team_036 possession (Score: 41-34)
Kobe Simmons drives and kicks out. Michael Westbrook attempts a 3Pt. Contested by Malcolm Murray (4.3 feet, MAN). MICHAEL WESTBROOK MAKES IT!
Score: 44-34

[09:26] Team_043 possession (Score: 44-34)
Malcolm Murray attempts a 3Pt. Contested by Michael Westbrook (5.2 feet, ZONE). Malcolm Murray misses. Rebound secured by Terry Durant.

[09:11] Team_036 possession (Score: 44-34)
Michael Westbrook drives to the basket... FOUL! Offensive foul on Michael Westbrook! Malcolm Murray drew the charge! [Team fouls: 1] (Michael Westbrook: 1 personal fouls) TURNOVER! (dead ball)

[09:01] Team_043 possession (Score: 44-34)
Dwyane Dosunmu attempts a Midrange. Contested by Kobe Simmons (4.2 feet, MAN). Dwyane Dosunmu misses. Rebound secured by Giannis Booker.

[08:44] Team_036 possession (Score: 44-34)
Giannis Booker attempts a Layup. Wide open! Magic Durant is 6.1 feet away. [MAN] GIANNIS BOOKER MAKES IT! Assist: Anthony Poole
Score: 46-34

[08:27] Team_043 possession (Score: 46-34)
FOUL! Reach-in foul on Kobe Simmons during the drive. [Team fouls: 2] No free throws, side out. (Kobe Simmons: 1 personal fouls)

[08:09] Team_043 possession (Score: 46-34)
Magic Durant attempts a 3Pt. Contested by Giannis Booker (5.1 feet, MAN). Magic Durant misses. Rebound secured by Terry Durant.

[07:56] Team_036 possession (Score: 46-34)
FOUL! Holding foul on D'Angelo Iverson. [Team fouls: 2] No free throws, side out. (D'Angelo Iverson: 1 personal fouls)

[07:42] Team_036 possession (Score: 46-34)
Michael Westbrook drives and kicks out. Giannis Booker attempts a 3Pt. Wide open! Magic Durant is 6.0 feet away. [MAN] Giannis Booker misses. Offensive rebound by Terry Durant! Terry Durant kicks it out.

[07:27] Team_036 possession (Score: 46-34)
Terry Durant attempts a Midrange. Contested by Manu Carter (5.5 feet, MAN). TERRY DURANT MAKES IT!
Score: 48-34

[07:13] Team_043 possession (Score: 48-34)
D'Angelo Iverson attempts a 3Pt. Contested by Anthony Poole (5.6 feet, MAN). D'Angelo Iverson misses. Offensive rebound by D'Angelo Iverson! D'Angelo Iverson kicks it out.

[06:56] Team_043 possession (Score: 48-34)
D'Angelo Iverson attempts a Midrange. Contested by Terry Durant (5.4 feet, ZONE). D'Angelo Iverson misses. Offensive rebound by D'Angelo Iverson! D'Angelo Iverson kicks it out.

[06:41] Team_043 possession (Score: 48-34)
Manu Carter attempts a Layup. Contested by Kobe Simmons (4.9 feet, ZONE). MANU CARTER MAKES IT! Assist: D'Angelo Iverson
Score: 48-36

[06:22] Team_036 possession (Score: 48-36)
Giannis Booker attempts a Midrange. Wide open! Magic Durant is 6.4 feet away. [MAN] GIANNIS BOOKER MAKES IT!
Score: 50-36

[06:08] Team_043 possession (Score: 50-36)
Malcolm Murray drives to the basket... Malcolm Murray loses control! Ball rolls out of bounds! TURNOVER! (dead ball)

[06:08] Substitution (Team_036): Michael Westbrook OUT → Dirk Anunoby IN (stamina_rule2)

[06:08] Substitution (Team_036): Giannis Booker OUT → Tobias Fox IN (stamina_rule2)

[06:08] Substitution (Team_036): Anthony Poole OUT → Pascal Antetokounmpo IN (stamina_rule2)

[06:08] Substitution (Team_036): Terry Durant OUT → Devin Simmons IN (stamina_rule2)

[06:08] Substitution (Team_036): Kobe Simmons OUT → Bradley Murray IN (stamina_rule2)

[06:08] Substitution (Team_043): Malcolm Murray OUT → Jabari Holiday IN (stamina_rule2)

[06:08] Substitution (Team_043): Magic Durant OUT → Ben LaVine IN (stamina_rule2)

[06:08] Substitution (Team_043): D'Angelo Iverson OUT → Dirk Herro IN (stamina_rule2)

[06:08] Substitution (Team_043): Manu Carter OUT → Joel Murray IN (stamina_rule2)

[06:08] Substitution (Team_043): Dwyane Dosunmu OUT → Terry Randle IN (stamina_rule2)

[05:53] Team_036 possession (Score: 50-36)
Dirk Anunoby throws a bad pass out of bounds! TURNOVER! (dead ball)

[05:37] Team_043 possession (Score: 50-36)
Joel Murray attempts a Layup. Contested by Devin Simmons (5.6 feet, MAN). JOEL MURRAY MAKES IT! Assist: Jabari Holiday
Score: 50-38

[05:24] Team_036 possession (Score: 50-38)
Bradley Murray attempts a Midrange. Contested by Terry Randle (4.3 feet, MAN). Bradley Murray misses. Rebound secured by Dirk Herro.

[05:07] Team_043 possession (Score: 50-38)
Dirk Herro attempts a 3Pt. Contested by Tobias Fox (4.8 feet, ZONE). DIRK HERRO MAKES IT! Assist: Terry Randle
Score: 50-41

[04:55] Team_036 possession (Score: 50-41)
Devin Simmons makes the Layup and draws the foul on Ben LaVine! And-1! Devin Simmons to the line for 1. [Team fouls: 3] (Ben LaVine: 1 personal fouls)   FT 1/1: GOOD Devin Simmons makes 1/1 from the line.
Score: 53-41

[04:39] Team_043 possession (Score: 53-41)
Dirk Herro attempts a 3Pt. Contested by Pascal Antetokounmpo (5.1 feet, ZONE). Dirk Herro misses. Offensive rebound by Terry Randle! Terry Randle kicks it out.

[04:25] Team_043 possession (Score: 53-41)
Ben LaVine drives and kicks out. Ben LaVine attempts a 3Pt. Contested by Dirk Anunoby (5.5 feet, ZONE). BEN LAVINE MAKES IT! Assist: Jabari Holiday
Score: 53-44

[04:06] Team_036 possession (Score: 53-44)
Bradley Murray attempts a 3Pt. Contested by Terry Randle (4.3 feet, MAN). Bradley Murray misses. Offensive rebound by Devin Simmons! Devin Simmons kicks it out.

[03:55] Team_036 possession (Score: 53-44)
FOUL! Reach-in foul on Ben LaVine during the drive. [Team fouls: 4] No free throws, side out. (Ben LaVine: 2 personal fouls)

[03:37] Team_036 possession (Score: 53-44)
Tobias Fox attempts a 3Pt. Contested by Dirk Herro (4.4 feet, ZONE). Tobias Fox misses. Rebound secured by Ben LaVine.

[03:23] Team_043 possession (Score: 53-44)
Terry Randle attempts a Midrange. Contested by Tobias Fox (4.9 feet, ZONE). Terry Randle misses. Rebound secured by Bradley Murray.

[03:07] Team_036 possession (Score: 53-44)
Pascal Antetokounmpo attempts a 3Pt. Contested by Jabari Holiday (4.8 feet, ZONE). Pascal Antetokounmpo misses. Offensive rebound by Devin Simmons! Devin Simmons kicks it out.

[02:48] Team_036 possession (Score: 53-44)
Bradley Murray makes the Layup and draws the foul on Terry Randle! And-1! Bradley Murray to the line for 1. [BONUS: 5 team fouls] (Terry Randle: 1 personal fouls)   FT 1/1: GOOD Bradley Murray makes 1/1 from the line.
Score: 56-44

[02:35] Team_043 possession (Score: 56-44)
Jabari Holiday drives and kicks out. FOUL! Shooting foul on Dirk Anunoby. Jabari Holiday to the line for 2 free throws. [Team fouls: 3] (Dirk Anunoby: 1 personal fouls)   FT 1/2: GOOD   FT 2/2: GOOD Jabari Holiday makes 2/2 from the line.
Score: 56-46

[02:21] Team_036 possession (Score: 56-46)
Devin Simmons attempts a Midrange. Contested by Joel Murray (5.8 feet, MAN). DEVIN SIMMONS MAKES IT! Assist: Tobias Fox
Score: 58-46

[02:05] Team_043 possession (Score: 58-46)
FOUL! Holding foul on Tobias Fox. [Team fouls: 4] No free throws, side out. (Tobias Fox: 1 personal fouls)

[01:53] Team_043 possession (Score: 58-46)
Joel Murray attempts a 3Pt. Contested by Devin Simmons (5.6 feet, ZONE). Joel Murray misses. Rebound secured by Bradley Murray.

[01:37] Team_036 possession (Score: 58-46)
Bradley Murray attempts a Midrange. Contested by Terry Randle (4.3 feet, MAN). Bradley Murray misses. Rebound secured by Terry Randle.

[01:25] Team_043 possession (Score: 58-46)
Jabari Holiday attempts a 3Pt. Wide open! Dirk Anunoby is 6.0 feet away. [MAN] Jabari Holiday misses. Rebound secured by Pascal Antetokounmpo.

[01:09] Team_036 possession (Score: 58-46)
Dirk Anunoby drives and kicks out. Pascal Antetokounmpo makes the 3Pt and draws the foul on Dirk Herro! And-1! Pascal Antetokounmpo to the line for 1. [BONUS: 6 team fouls] (Dirk Herro: 1 personal fouls)   FT 1/1: GOOD Pascal Antetokounmpo makes 1/1 from the line.
Score: 62-46

[00:58] Team_043 possession (Score: 62-46)
Ben LaVine attempts a 3Pt. Contested by Tobias Fox (4.9 feet, ZONE). Ben LaVine misses. Rebound secured by Pascal Antetokounmpo.

[00:39] Team_036 possession (Score: 62-46)
Bradley Murray drives to the basket... Bradley Murray throws a bad pass out of bounds! TURNOVER! (dead ball)

[00:24] Team_043 possession (Score: 62-46)
Terry Randle makes the Layup and draws the foul on Bradley Murray! And-1! Terry Randle to the line for 1. [BONUS: 5 team fouls] (Bradley Murray: 1 personal fouls)   FT 1/1: GOOD Terry Randle makes 1/1 from the line.
Score: 62-49

[00:07] Team_036 possession (Score: 62-49)
Pascal Antetokounmpo attempts a 3Pt. Contested by Dirk Herro (4.3 feet, MAN). Pascal Antetokounmpo misses. Rebound secured by Dirk Herro.

================================================================================
                              2ND QUARTER COMPLETE                              
================================================================================

2ND QUARTER SCORE: Team_036 28, Team_043 17

BOX SCORE:
================================================================================

Team_036
--------------------------------------------------------------------------------
Player                MIN  PTS  REB  AST  TO      FG   FG%      3P   3P%
--------------------------------------------------------------------------------
Michael Westbrook      18    6    0    1   0   2/2   100.0     0/0   0.0
Devin Simmons           6    5    2    0   0   2/2   100.0     0/0   0.0
Terry Durant           18    4    4    1   0   2/2   100.0     0/0   0.0
Giannis Booker         18    4    1    1   0   2/2   100.0     0/0   0.0
Pascal Antetokounmpo    6    4    2    0   0   1/2    50.0     0/0   0.0
Bradley Murray          6    3    2    0   0   1/3    33.3     0/0   0.0
Kobe Simmons           18    2    2    0   0   1/2    50.0     0/0   0.0
Anthony Poole          18    0    0    1   0   0/0     0.0     0/0   0.0
Tobias Fox              6    0    0    1   0   0/1     0.0     0/0   0.0

TEAM: FG: 11/16 (68.8%), 3PT: 1/4 (25.0%), REB: 13 (3 off, 10 def), AST: 5, TO: 3
TEAM FOULS: 5 [Team_043 in BONUS]


Team_043
--------------------------------------------------------------------------------
Player                MIN  PTS  REB  AST  TO      FG   FG%      3P   3P%
--------------------------------------------------------------------------------
Dirk Herro              6    3    2    0   0   1/1   100.0     0/0   0.0
Terry Randle            6    3    2    1   0   1/2    50.0     0/0   0.0
Ben LaVine              6    3    1    0   0   1/2    50.0     0/0   0.0
Magic Durant           18    2    0    0   0   1/2    50.0     0/0   0.0
Manu Carter            18    2    1    0   0   1/2    50.0     0/0   0.0
Joel Murray             6    2    0    0   0   1/2    50.0     0/0   0.0
Jabari Holiday          6    2    0    2   0   1/2    50.0     0/0   0.0
Dwyane Dosunmu         18    0    0    0   0   0/2     0.0     0/0   0.0
D'Angelo Iverson       18    0    2    1   0   0/1     0.0     0/0   0.0
Malcolm Murray         18    0    0    0   0   0/1     0.0     0/0   0.0

TEAM: FG: 7/17 (41.2%), 3PT: 1/7 (14.3%), REB: 8 (3 off, 5 def), AST: 4, TO: 1
TEAM FOULS: 6 [Team_036 in BONUS]

================================================================================

================================================================================
                       3RD QUARTER - Team_036 vs Team_043                       
================================================================================

[12:00] Team_036 possession (Score: 62-49)
Terry Durant attempts a Midrange. Contested by Manu Carter (4.6 feet, MAN). TERRY DURANT MAKES IT! Assist: Michael Westbrook
Score: 64-49

[11:48] Team_043 possession (Score: 64-49)
FOUL! Reach-in foul on Kobe Simmons during the drive. [Team fouls: 1] No free throws, side out. (Kobe Simmons: 1 personal fouls)

[11:32] Team_043 possession (Score: 64-49)
Magic Durant drives and kicks out. Malcolm Murray attempts a Midrange. Contested by Anthony Poole (4.9 feet, ZONE). Malcolm Murray misses. Rebound secured by Giannis Booker.

[11:20] Team_036 possession (Score: 64-49)
FOUL! Shooting foul on D'Angelo Iverson. Anthony Poole to the line for 3 free throws. [Team fouls: 1] (D'Angelo Iverson: 1 personal fouls)   FT 1/3: GOOD   FT 2/3: GOOD   FT 3/3: GOOD Anthony Poole makes 3/3 from the line.
Score: 67-49

[11:06] Team_043 possession (Score: 67-49)
Dwyane Dosunmu loses the ball! Stripped by Kobe Simmons! TURNOVER! (live ball)

[10:55] Team_036 possession (Score: 67-49)
Kobe Simmons makes the Dunk and draws the foul on Dwyane Dosunmu! And-1! Kobe Simmons to the line for 1. [Team fouls: 2] (Dwyane Dosunmu: 1 personal fouls)   FT 1/1: MISS Kobe Simmons makes 0/1 from the line. Rebound secured by Manu Carter.
Score: 69-49

[10:42] Team_043 possession (Score: 69-49)
Malcolm Murray attempts a Midrange. BLOCKED BY TERRY DURANT! Ball is loose! Rebound secured by Terry Durant.

[10:30] Team_036 possession (Score: 69-49)
Giannis Booker loses control! Ball rolls out of bounds! TURNOVER! (dead ball)

[10:13] Team_043 possession (Score: 69-49)
FOUL! Holding foul on Kobe Simmons. [Team fouls: 2] No free throws, side out. (Kobe Simmons: 2 personal fouls)

[10:00] Team_043 possession (Score: 69-49)
Manu Carter attempts a Layup. Contested by Kobe Simmons (4.0 feet, ZONE). MANU CARTER MAKES IT! Assist: Dwyane Dosunmu
Score: 69-51

[09:45] Team_036 possession (Score: 69-51)
FOUL! Reach-in foul on Manu Carter during the drive. [Team fouls: 3] No free throws, side out. (Manu Carter: 1 personal fouls)

[09:31] Team_036 possession (Score: 69-51)
Terry Durant attempts a 3Pt. Contested by D'Angelo Iverson (3.4 feet, ZONE). Terry Durant misses. Rebound secured by Manu Carter.

[09:13] Team_043 possession (Score: 69-51)
Malcolm Murray makes the Layup and draws the foul on Michael Westbrook! And-1! Malcolm Murray to the line for 1. [Team fouls: 3] (Michael Westbrook: 1 personal fouls)   FT 1/1: GOOD Malcolm Murray makes 1/1 from the line.
Score: 69-54

[08:56] Team_036 possession (Score: 69-54)
Anthony Poole makes the Dunk and draws the foul on Dwyane Dosunmu! And-1! Anthony Poole to the line for 1. [Team fouls: 4] (Dwyane Dosunmu: 2 personal fouls)   FT 1/1: GOOD Anthony Poole makes 1/1 from the line.
Score: 72-54

[08:46] Team_043 possession (Score: 72-54)
FOUL! Reach-in foul on Kobe Simmons during the drive. [Team fouls: 4] No free throws, side out. (Kobe Simmons: 3 personal fouls)

[08:32] Team_043 possession (Score: 72-54)
Malcolm Murray attempts a 3Pt. Contested by Michael Westbrook (4.7 feet, MAN). Malcolm Murray misses. Offensive rebound by D'Angelo Iverson! D'Angelo Iverson kicks it out.

[08:23] Team_043 possession (Score: 72-54)
FOUL! Shooting foul on Kobe Simmons. Dwyane Dosunmu to the line for 2 free throws. [BONUS: 5 team fouls] (Kobe Simmons: 4 personal fouls)   FT 1/2: MISS   FT 2/2: GOOD Dwyane Dosunmu makes 1/2 from the line.
Score: 72-55

[08:06] Team_036 possession (Score: 72-55)
Giannis Booker drives, Magic Durant stays with him. Giannis Booker attempts a Dunk. Contested by Magic Durant (5.5 feet, MAN). Giannis Booker misses. Offensive rebound by Terry Durant! Terry Durant puts it back in!
Score: 74-55

[07:52] Team_043 possession (Score: 74-55)
Malcolm Murray attempts a Midrange. Contested by Terry Durant (4.5 feet, ZONE). MALCOLM MURRAY MAKES IT!
Score: 74-57

[07:38] Team_036 possession (Score: 74-57)
Anthony Poole attempts a 3Pt. Contested by D'Angelo Iverson (3.6 feet, MAN). Anthony Poole misses. Offensive rebound by Kobe Simmons! Kobe Simmons puts it back in!
Score: 76-57

[07:24] Team_043 possession (Score: 76-57)
Malcolm Murray drives to the basket... FOUL! Offensive foul on Malcolm Murray! Kobe Simmons drew the charge! [Team fouls: 5] (Malcolm Murray: 1 personal fouls) TURNOVER! (dead ball)

[07:12] Team_036 possession (Score: 76-57)
Anthony Poole drives and kicks out. Kobe Simmons attempts a 3Pt. Contested by D'Angelo Iverson (2.9 feet, ZONE). Kobe Simmons misses. Rebound secured by D'Angelo Iverson.

[06:57] Team_043 possession (Score: 76-57)
D'Angelo Iverson attempts a 3Pt. Contested by Michael Westbrook (4.7 feet, ZONE). D'Angelo Iverson misses. Rebound secured by Terry Durant.

[06:42] Team_036 possession (Score: 76-57)
Terry Durant drives and kicks out. Anthony Poole attempts a Midrange. Contested by D'Angelo Iverson (2.9 feet, MAN). ANTHONY POOLE MAKES IT! Assist: Terry Durant
Score: 78-57

[06:30] Team_043 possession (Score: 78-57)
D'Angelo Iverson attempts a 3Pt. Contested by Michael Westbrook (4.7 feet, ZONE). D'Angelo Iverson misses. Rebound secured by Terry Durant.

[06:14] Team_036 possession (Score: 78-57)
Michael Westbrook attempts a 3Pt. Contested by D'Angelo Iverson (3.4 feet, ZONE). Michael Westbrook misses. Offensive rebound by Kobe Simmons! Kobe Simmons's putback is no good. Rebound secured by Dwyane Dosunmu.

[05:59] Team_043 possession (Score: 78-57)
D'Angelo Iverson attempts a 3Pt. Contested by Michael Westbrook (4.7 feet, ZONE). D'ANGELO IVERSON MAKES IT! Assist: Dwyane Dosunmu
Score: 78-60

[05:42] Team_036 possession (Score: 78-60)
Kobe Simmons attempts a Midrange. Contested by Manu Carter (4.6 feet, MAN). Kobe Simmons misses. Rebound secured by D'Angelo Iverson.

[05:30] Team_043 possession (Score: 78-60)
Malcolm Murray drives and kicks out. Manu Carter attempts a 3Pt. Contested by Michael Westbrook (4.7 feet, ZONE). Manu Carter misses. Rebound secured by Terry Durant.

[05:16] Team_036 possession (Score: 78-60)
Michael Westbrook attempts a 3Pt. Contested by Malcolm Murray (4.2 feet, MAN). Michael Westbrook misses. FOUL! Loose ball foul on D'Angelo Iverson during the rebound battle. [IN THE BONUS! 6 team fouls] Terry Durant to the line for 2 free throws. (D'Angelo Iverson: 2 personal fouls)   FT 1/2: GOOD   FT 2/2: GOOD Terry Durant makes 2/2 from the line.
Score: 80-60

[05:03] Team_043 possession (Score: 80-60)
Magic Durant drives to the basket... Magic Durant throws a bad pass out of bounds! TURNOVER! (dead ball)

[04:49] Team_036 possession (Score: 80-60)
Kobe Simmons drives to the basket... Kobe Simmons commits a violation (traveling/carry)! TURNOVER! (dead ball)

[04:37] Team_043 possession (Score: 80-60)
Magic Durant attempts a 3Pt. Contested by Michael Westbrook (4.7 feet, ZONE). Magic Durant misses. Rebound secured by Kobe Simmons.

[04:21] Team_036 possession (Score: 80-60)
Kobe Simmons attempts a Midrange. Contested by Manu Carter (4.7 feet, ZONE). Kobe Simmons misses. Offensive rebound by Kobe Simmons! Kobe Simmons's putback is no good. Offensive rebound by Terry Durant! Terry Durant kicks it out.

[04:06] Team_036 possession (Score: 80-60)
Terry Durant attempts a 3Pt. Contested by D'Angelo Iverson (3.4 feet, ZONE). Terry Durant misses. FOUL! Loose ball foul on Dwyane Dosunmu during the rebound battle. [IN THE BONUS! 7 team fouls] Terry Durant to the line for 2 free throws. (Dwyane Dosunmu: 3 personal fouls)   FT 1/2: GOOD   FT 2/2: GOOD Terry Durant makes 2/2 from the line.
Score: 82-60

[03:53] Team_043 possession (Score: 82-60)
FOUL! Holding foul on Michael Westbrook. [IN THE BONUS! 6 team fouls] Malcolm Murray to the line for 2 free throws. (Michael Westbrook: 2 personal fouls)   FT 1/2: GOOD   FT 2/2: GOOD Malcolm Murray makes 2/2 from the line.
Score: 82-62

[03:40] Team_036 possession (Score: 82-62)
Kobe Simmons attempts a 3Pt. Contested by Manu Carter (4.7 feet, MAN). Kobe Simmons misses. Offensive rebound by Terry Durant! Terry Durant's putback is no good. Rebound secured by Manu Carter.

[03:25] Team_043 possession (Score: 82-62)
Manu Carter attempts a Midrange. Contested by Giannis Booker (5.1 feet, ZONE). MANU CARTER MAKES IT!
Score: 82-64

[03:14] Team_036 possession (Score: 82-64)
Giannis Booker attempts a 3Pt. Contested by D'Angelo Iverson (3.5 feet, ZONE). Giannis Booker misses. Rebound secured by Manu Carter.

[02:57] Team_043 possession (Score: 82-64)
Dwyane Dosunmu drives, picks up Kobe Simmons. Help arrives from Giannis Booker! Dwyane Dosunmu attempts a Layup. Contested by Giannis Booker (3.8 feet, MAN). DWYANE DOSUNMU MAKES IT! Assist: Malcolm Murray
Score: 82-66

[02:40] Team_036 possession (Score: 82-66)
Giannis Booker attempts a 3Pt. Contested by Magic Durant (5.8 feet, MAN). GIANNIS BOOKER MAKES IT! Assist: Kobe Simmons
Score: 85-66

[02:29] Team_043 possession (Score: 85-66)
Malcolm Murray attempts a 3Pt. Contested by Michael Westbrook (5.0 feet, ZONE). Malcolm Murray misses. Rebound secured by Terry Durant.

[02:15] Team_036 possession (Score: 85-66)
Michael Westbrook attempts a Layup. Contested by Manu Carter (5.0 feet, ZONE). MICHAEL WESTBROOK MAKES IT! Assist: Giannis Booker
Score: 87-66

[02:03] Team_043 possession (Score: 87-66)
Magic Durant attempts a Midrange. Contested by Giannis Booker (4.8 feet, MAN). Magic Durant misses. Offensive rebound by D'Angelo Iverson! D'Angelo Iverson kicks it out.

[01:51] Team_043 possession (Score: 87-66)
FOUL! Reach-in foul on Kobe Simmons during the drive. [IN THE BONUS! 7 team fouls] Magic Durant to the line for 2 free throws. (Kobe Simmons: 5 personal fouls)   FT 1/2: GOOD   FT 2/2: GOOD Magic Durant makes 2/2 from the line.
Score: 87-68

[01:38] Team_036 possession (Score: 87-68)
Kobe Simmons drives, picks up Manu Carter. Help arrives from Malcolm Murray! Kobe Simmons attempts a Layup. Contested by Malcolm Murray (5.0 feet, ZONE). KOBE SIMMONS MAKES IT!
Score: 89-68

[01:25] Team_043 possession (Score: 89-68)
FOUL! Reach-in foul on Kobe Simmons during the drive. [IN THE BONUS! 8 team fouls] Dwyane Dosunmu to the line for 2 free throws. (Kobe Simmons: 6 personal fouls) Kobe Simmons FOULS OUT!   FT 1/2: MISS   FT 2/2: GOOD Dwyane Dosunmu makes 1/2 from the line.
Score: 89-69

[01:25] Substitution (Team_036): Kobe Simmons OUT (stamina: 64) → Dirk Anunoby IN (foul_out)

[01:06] Team_036 possession (Score: 89-69)
Terry Durant drives to the basket... Terry Durant loses control! Ball rolls out of bounds! TURNOVER! (dead ball)

[01:06] Substitution (Team_036): Michael Westbrook OUT → Tobias Fox IN (stamina_rule2)

[01:06] Substitution (Team_036): Giannis Booker OUT → Michael Westbrook IN (stamina_rule2)

[01:06] Substitution (Team_036): Anthony Poole OUT → Pascal Antetokounmpo IN (stamina_rule2)

[01:06] Substitution (Team_036): Terry Durant OUT → Devin Simmons IN (stamina_rule2)

[01:06] Substitution (Team_043): Malcolm Murray OUT → Jabari Holiday IN (stamina_rule2)

[01:06] Substitution (Team_043): Magic Durant OUT → Ben LaVine IN (stamina_rule2)

[01:06] Substitution (Team_043): D'Angelo Iverson OUT → Dirk Herro IN (stamina_rule2)

[01:06] Substitution (Team_043): Manu Carter OUT → Joel Murray IN (stamina_rule2)

[01:06] Substitution (Team_043): Dwyane Dosunmu OUT → Terry Randle IN (stamina_rule2)

[00:53] Team_043 possession (Score: 89-69)
FOUL! Shooting foul on Pascal Antetokounmpo. Dirk Herro to the line for 2 free throws. [BONUS: 9 team fouls] (Pascal Antetokounmpo: 1 personal fouls)   FT 1/2: GOOD   FT 2/2: MISS Dirk Herro makes 1/2 from the line. Rebound secured by Devin Simmons.
Score: 89-70

[00:39] Team_036 possession (Score: 89-70)
Tobias Fox attempts a 3Pt. Wide open! Joel Murray is 6.1 feet away. [ZONE] TOBIAS FOX MAKES IT! Assist: Devin Simmons
Score: 92-70

[00:22] Team_043 possession (Score: 92-70)
Dirk Herro attempts a Layup. Contested by Devin Simmons (5.5 feet, ZONE). DIRK HERRO MAKES IT!
Score: 92-72

[00:04] Team_036 possession (Score: 92-72)
Dirk Anunoby attempts a Midrange. Contested by Jabari Holiday (5.0 feet, MAN). Dirk Anunoby misses. Offensive rebound by Devin Simmons! Devin Simmons kicks it out.

================================================================================
                              3RD QUARTER COMPLETE                              
================================================================================

3RD QUARTER SCORE: Team_036 30, Team_043 23

BOX SCORE:
================================================================================

Team_036
--------------------------------------------------------------------------------
Player                MIN  PTS  REB  AST  TO      FG   FG%      3P   3P%
--------------------------------------------------------------------------------
Terry Durant           29    8    7    1   0   4/5    80.0     0/0   0.0
Anthony Poole          29    8    0    0   0   3/4    75.0     0/0   0.0
Kobe Simmons           29    4    2    1   0   2/5    40.0     0/0   0.0
Giannis Booker         29    3    1    1   0   1/2    50.0     0/0   0.0
Tobias Fox              7    3    0    0   0   1/1   100.0     0/0   0.0
Michael Westbrook      30    2    0    1   0   1/2    50.0     0/0   0.0
Devin Simmons           7    0    2    1   0   0/0     0.0     0/0   0.0

TEAM: FG: 12/19 (63.2%), 3PT: 6/10 (60.0%), REB: 14 (6 off, 8 def), AST: 5, TO: 3
TEAM FOULS: 9 [Team_043 in BONUS]


Team_043
--------------------------------------------------------------------------------
Player                MIN  PTS  REB  AST  TO      FG   FG%      3P   3P%
--------------------------------------------------------------------------------
Malcolm Murray         29    7    0    1   0   3/6    50.0     0/0   0.0
Manu Carter            29    4    4    0   0   2/2   100.0     0/0   0.0
Dwyane Dosunmu         29    4    1    2   0   3/3   100.0     0/0   0.0
D'Angelo Iverson       29    3    4    0   0   1/3    33.3     0/0   0.0
Magic Durant           29    2    0    0   0   1/3    33.3     0/0   0.0
Dirk Herro              7    2    0    0   0   1/2    50.0     0/0   0.0

TEAM: FG: 11/19 (57.9%), 3PT: 1/5 (20.0%), REB: 7 (2 off, 5 def), AST: 3, TO: 3
TEAM FOULS: 7 [Team_036 in BONUS]

================================================================================

================================================================================
                       4TH QUARTER - Team_036 vs Team_043                       
================================================================================

[12:00] Team_036 possession (Score: 92-72)
Kobe Simmons drives, Manu Carter stays with him. Kobe Simmons attempts a Dunk. Contested by Manu Carter (4.8 feet, MAN). KOBE SIMMONS MAKES IT!
Score: 94-72

[11:45] Team_043 possession (Score: 94-72)
D'Angelo Iverson attempts a 3Pt. Contested by Michael Westbrook (5.1 feet, ZONE). D'Angelo Iverson misses. Rebound secured by Giannis Booker.

[11:31] Team_036 possession (Score: 94-72)
Terry Durant attempts a 3Pt. Contested by D'Angelo Iverson (3.5 feet, ZONE). TERRY DURANT MAKES IT! Assist: Anthony Poole
Score: 97-72

[11:18] Team_043 possession (Score: 97-72)
FOUL! Shooting foul on Anthony Poole. D'Angelo Iverson to the line for 2 free throws. [Team fouls: 1] (Anthony Poole: 1 personal fouls)   FT 1/2: GOOD   FT 2/2: GOOD D'Angelo Iverson makes 2/2 from the line.
Score: 97-74

[11:07] Team_036 possession (Score: 97-74)
Kobe Simmons drives and kicks out. Anthony Poole attempts a Midrange. Contested by D'Angelo Iverson (3.2 feet, ZONE). ANTHONY POOLE MAKES IT!
Score: 99-74

[10:54] Team_043 possession (Score: 99-74)
Malcolm Murray attempts a 3Pt. Contested by Michael Westbrook (5.2 feet, MAN). Malcolm Murray misses. Rebound secured by Terry Durant.

[10:45] Team_036 possession (Score: 99-74)
Giannis Booker drives, picks up Manu Carter. Help arrives from Malcolm Murray! Giannis Booker attempts a Dunk. Contested by Malcolm Murray (4.9 feet, ZONE). Giannis Booker misses. Rebound secured by D'Angelo Iverson.

[10:34] Team_043 possession (Score: 99-74)
Dwyane Dosunmu drives to the basket... Dwyane Dosunmu throws a bad pass out of bounds! TURNOVER! (dead ball)

[10:34] Substitution (Team_036): Michael Westbrook OUT → Dirk Anunoby IN (stamina_rule2)

[10:34] Substitution (Team_036): Giannis Booker OUT → Tobias Fox IN (stamina_rule2)

[10:34] Substitution (Team_036): Anthony Poole OUT → Pascal Antetokounmpo IN (stamina_rule2)

[10:34] Substitution (Team_036): Terry Durant OUT → Devin Simmons IN (stamina_rule2)

[10:34] Substitution (Team_036): Kobe Simmons OUT → Bradley Murray IN (stamina_rule2)

[10:34] Substitution (Team_043): Malcolm Murray OUT → Jabari Holiday IN (stamina_rule2)

[10:34] Substitution (Team_043): Magic Durant OUT → Ben LaVine IN (stamina_rule2)

[10:34] Substitution (Team_043): D'Angelo Iverson OUT → Dirk Herro IN (stamina_rule2)

[10:34] Substitution (Team_043): Manu Carter OUT → Joel Murray IN (stamina_rule2)

[10:34] Substitution (Team_043): Dwyane Dosunmu OUT → Terry Randle IN (stamina_rule2)

[10:22] Team_036 possession (Score: 99-74)
Tobias Fox drives, picks up Ben LaVine. Help arrives from Dirk Herro! Tobias Fox attempts a Dunk. Contested by Dirk Herro (5.5 feet, MAN). TOBIAS FOX MAKES IT!
Score: 101-74

[10:08] Team_043 possession (Score: 101-74)
Jabari Holiday loses control! Ball rolls out of bounds! TURNOVER! (dead ball)

[09:52] Team_036 possession (Score: 101-74)
Bradley Murray drives, Terry Randle stays with him. Bradley Murray attempts a Dunk. Contested by Terry Randle (4.3 feet, MAN). BRADLEY MURRAY MAKES IT!
Score: 103-74

[09:35] Team_043 possession (Score: 103-74)
Jabari Holiday throws a bad pass out of bounds! TURNOVER! (dead ball)

[09:19] Team_036 possession (Score: 103-74)
Pascal Antetokounmpo drives and kicks out. Dirk Anunoby attempts a 3Pt. Contested by Dirk Herro (4.0 feet, ZONE). Dirk Anunoby misses. Rebound secured by Dirk Herro.

[09:03] Team_043 possession (Score: 103-74)
Ben LaVine attempts a 3Pt. Contested by Tobias Fox (4.9 feet, MAN). Ben LaVine misses. Rebound secured by Bradley Murray.

[08:52] Team_036 possession (Score: 103-74)
Dirk Anunoby attempts a 3Pt. Contested by Dirk Herro (4.4 feet, ZONE). Dirk Anunoby misses. Rebound secured by Dirk Herro.

[08:41] Team_043 possession (Score: 103-74)
Ben LaVine attempts a Midrange. Contested by Tobias Fox (4.9 feet, ZONE). Ben LaVine misses. Rebound secured by Bradley Murray.

[08:27] Team_036 possession (Score: 103-74)
Devin Simmons drives, Terry Randle stays with him. Devin Simmons attempts a Dunk. Contested by Terry Randle (4.5 feet, ZONE). DEVIN SIMMONS MAKES IT! Assist: Bradley Murray
Score: 105-74

[08:10] Team_043 possession (Score: 105-74)
Joel Murray attempts a 3Pt. Contested by Tobias Fox (4.9 feet, ZONE). Joel Murray misses. Offensive rebound by Dirk Herro! Dirk Herro's putback is no good. Rebound secured by Pascal Antetokounmpo.

[07:55] Team_036 possession (Score: 105-74)
Dirk Anunoby attempts a 3Pt. Contested by Dirk Herro (4.4 feet, ZONE). DIRK ANUNOBY MAKES IT! Assist: Bradley Murray
Score: 108-74

[07:37] Team_043 possession (Score: 108-74)
Dirk Herro attempts a Layup. Contested by Pascal Antetokounmpo (5.1 feet, MAN). DIRK HERRO MAKES IT! Assist: Jabari Holiday
Score: 108-76

[07:21] Team_036 possession (Score: 108-76)
Bradley Murray attempts a Midrange. Contested by Terry Randle (4.3 feet, MAN). Bradley Murray misses. Rebound secured by Ben LaVine.

[07:08] Team_043 possession (Score: 108-76)
FOUL! Reach-in foul on Devin Simmons during the drive. [Team fouls: 2] No free throws, side out. (Devin Simmons: 1 personal fouls)

[06:50] Team_043 possession (Score: 108-76)
Jabari Holiday attempts a 3Pt. Wide open! Dirk Anunoby is 6.0 feet away. [MAN] JABARI HOLIDAY MAKES IT! Assist: Terry Randle
Score: 108-79

[06:33] Team_036 possession (Score: 108-79)
Pascal Antetokounmpo attempts a 3Pt. Contested by Dirk Herro (4.3 feet, ZONE). Pascal Antetokounmpo misses. Rebound secured by Terry Randle.

[06:23] Team_043 possession (Score: 108-79)
Joel Murray makes the Dunk and draws the foul on Devin Simmons! And-1! Joel Murray to the line for 1. [Team fouls: 3] (Devin Simmons: 2 personal fouls)   FT 1/1: GOOD Joel Murray makes 1/1 from the line.
Score: 108-82

[06:08] Team_036 possession (Score: 108-82)
Devin Simmons drives to the basket... FOUL! Offensive foul on Devin Simmons! Joel Murray drew the charge! [Team fouls: 4] (Devin Simmons: 3 personal fouls) TURNOVER! (dead ball)

[05:54] Team_043 possession (Score: 108-82)
Terry Randle attempts a Layup. Contested by Bradley Murray (5.0 feet, MAN). Terry Randle misses. Rebound secured by Pascal Antetokounmpo.

[05:43] Team_036 possession (Score: 108-82)
Tobias Fox drives and kicks out. Tobias Fox attempts a Midrange. Contested by Ben LaVine (5.1 feet, MAN). Tobias Fox misses. Rebound secured by Dirk Herro.

[05:28] Team_043 possession (Score: 108-82)
Terry Randle throws a bad pass! Stolen by Bradley Murray! TURNOVER! (live ball)

[05:15] Team_036 possession (Score: 108-82)
Devin Simmons attempts a 3Pt. Contested by Dirk Herro (4.1 feet, ZONE). Devin Simmons misses. Rebound secured by Terry Randle.

[05:00] Team_043 possession (Score: 108-82)
Jabari Holiday attempts a Layup. Wide open! Dirk Anunoby is 6.0 feet away. [MAN] JABARI HOLIDAY MAKES IT!
Score: 108-84

[04:46] Team_036 possession (Score: 108-84)
Tobias Fox attempts a 3Pt. Contested by Ben LaVine (5.5 feet, MAN). Tobias Fox misses. Rebound secured by Ben LaVine.

[04:32] Team_043 possession (Score: 108-84)
FOUL! Holding foul on Dirk Anunoby. [IN THE BONUS! 5 team fouls] Jabari Holiday to the line for 2 free throws. (Dirk Anunoby: 1 personal fouls)   FT 1/2: MISS   FT 2/2: GOOD Jabari Holiday makes 1/2 from the line.
Score: 108-85

[04:17] Team_036 possession (Score: 108-85)
Tobias Fox throws a bad pass! Stolen by Ben LaVine! TURNOVER! (live ball)

[04:00] Team_043 possession (Score: 108-85)
Dirk Herro throws a bad pass! Stolen by Pascal Antetokounmpo! TURNOVER! (live ball)

[03:49] Team_036 possession (Score: 108-85)
Devin Simmons attempts a Midrange. Contested by Dirk Herro (4.1 feet, ZONE). DEVIN SIMMONS MAKES IT! Assist: Pascal Antetokounmpo
Score: 110-85

[03:33] Team_043 possession (Score: 110-85)
Terry Randle drives and kicks out. Ben LaVine attempts a Midrange. Contested by Tobias Fox (4.6 feet, MAN). BEN LAVINE MAKES IT! Assist: Dirk Herro
Score: 110-87

[03:20] Team_036 possession (Score: 110-87)
Tobias Fox attempts a 3Pt. Contested by Ben LaVine (5.6 feet, MAN). Tobias Fox misses. Rebound secured by Dirk Herro.

[03:04] Team_043 possession (Score: 110-87)
Joel Murray attempts a Midrange. Contested by Dirk Anunoby (6.0 feet, ZONE). JOEL MURRAY MAKES IT! Assist: Terry Randle
Score: 110-89

[02:53] Team_036 possession (Score: 110-89)
Tobias Fox attempts a 3Pt. Contested by Ben LaVine (5.6 feet, MAN). Tobias Fox misses. Rebound secured by Terry Randle.

[02:41] Team_043 possession (Score: 110-89)
Joel Murray attempts a Midrange. Contested by Devin Simmons (5.7 feet, ZONE). JOEL MURRAY MAKES IT! Assist: Terry Randle
Score: 110-91

[02:28] Team_036 possession (Score: 110-91)
Pascal Antetokounmpo attempts a 3Pt. Contested by Dirk Herro (4.4 feet, ZONE). Pascal Antetokounmpo misses. Rebound secured by Terry Randle.

[02:16] Team_043 possession (Score: 110-91)
Jabari Holiday attempts a 3Pt. Wide open! Dirk Anunoby is 6.2 feet away. [MAN] Jabari Holiday misses. Rebound secured by Devin Simmons.

[02:04] Team_036 possession (Score: 110-91)
Bradley Murray makes the Layup and draws the foul on Terry Randle! And-1! Bradley Murray to the line for 1. [Team fouls: 1] (Terry Randle: 1 personal fouls)   FT 1/1: GOOD Bradley Murray makes 1/1 from the line.
Score: 113-91

[01:47] Team_043 possession (Score: 113-91)
Ben LaVine attempts a 3Pt. Contested by Tobias Fox (5.1 feet, ZONE). BEN LAVINE MAKES IT! Assist: Jabari Holiday
Score: 113-94

[01:28] Team_036 possession (Score: 113-94)
FOUL! Holding foul on Jabari Holiday. [Team fouls: 2] No free throws, side out. (Jabari Holiday: 1 personal fouls)

[01:17] Team_036 possession (Score: 113-94)
Bradley Murray makes the Layup and draws the foul on Terry Randle! And-1! Bradley Murray to the line for 1. [Team fouls: 3] (Terry Randle: 2 personal fouls)   FT 1/1: GOOD Bradley Murray makes 1/1 from the line.
Score: 116-94

[01:01] Team_043 possession (Score: 116-94)
Joel Murray drives and kicks out. Jabari Holiday attempts a 3Pt. Contested by Dirk Anunoby (5.9 feet, ZONE). Jabari Holiday misses. Rebound secured by Bradley Murray.

[00:46] Team_036 possession (Score: 116-94)
FOUL! Reach-in foul on Terry Randle during the drive. [Team fouls: 4] No free throws, side out. (Terry Randle: 3 personal fouls)

[00:36] Team_036 possession (Score: 116-94)
Pascal Antetokounmpo attempts a 3Pt. Contested by Dirk Herro (4.5 feet, ZONE). Pascal Antetokounmpo misses. Rebound secured by Ben LaVine.

[00:20] Team_043 possession (Score: 116-94)
FOUL! Shooting foul on Bradley Murray. Terry Randle to the line for 2 free throws. [BONUS: 6 team fouls] (Bradley Murray: 1 personal fouls)   FT 1/2: GOOD   FT 2/2: GOOD Terry Randle makes 2/2 from the line.
Score: 116-96

[00:03] Team_036 possession (Score: 116-96)
Devin Simmons attempts a Midrange. Wide open! Joel Murray is 6.2 feet away. [MAN] Devin Simmons misses. Offensive rebound by Devin Simmons! Devin Simmons kicks it out.

================================================================================
                              4TH QUARTER COMPLETE                              
================================================================================

4TH QUARTER SCORE: Team_036 24, Team_043 24

BOX SCORE:
================================================================================

Team_036
--------------------------------------------------------------------------------
Player                MIN  PTS  REB  AST  TO      FG   FG%      3P   3P%
--------------------------------------------------------------------------------
Bradley Murray         16    8    3    2   0   3/4    75.0     0/0   0.0
Devin Simmons          18    4    2    0   0   2/3    66.7     0/0   0.0
Terry Durant           31    3    1    0   0   1/1   100.0     0/0   0.0
Dirk Anunoby           18    3    0    0   0   1/2    50.0     0/0   0.0
Kobe Simmons           31    2    0    0   0   1/1   100.0     0/0   0.0
Anthony Poole          31    2    0    1   0   1/1   100.0     0/0   0.0
Tobias Fox             18    2    0    0   0   1/5    20.0     0/0   0.0
Giannis Booker         31    0    1    0   0   0/1     0.0     0/0   0.0
Pascal Antetokounmpo   18    0    2    1   0   0/4     0.0     0/0   0.0

TEAM: FG: 10/22 (45.5%), 3PT: 2/10 (20.0%), REB: 8 (1 off, 7 def), AST: 4, TO: 2
TEAM FOULS: 6 [Team_043 in BONUS]


Team_043
--------------------------------------------------------------------------------
Player                MIN  PTS  REB  AST  TO      FG   FG%      3P   3P%
--------------------------------------------------------------------------------
Joel Murray            18    7    0    0   0   3/5    60.0     0/0   0.0
Jabari Holiday         18    6    0    2   0   3/4    75.0     0/0   0.0
Ben LaVine             18    5    3    0   0   2/4    50.0     0/0   0.0
D'Angelo Iverson       31    2    1    0   0   1/2    50.0     0/0   0.0
Dirk Herro             18    2    4    1   0   1/1   100.0     0/0   0.0
Terry Randle           18    2    4    3   0   1/2    50.0     0/0   0.0
Malcolm Murray         31    0    0    0   0   0/1     0.0     0/0   0.0

TEAM: FG: 11/19 (57.9%), 3PT: 2/7 (28.6%), REB: 13 (1 off, 12 def), AST: 6, TO: 5
TEAM FOULS: 4

================================================================================

================================================================================
                               FULL GAME COMPLETE                               
================================================================================

FINAL SCORE: Team_036 116, Team_043 96

SCORING BY QUARTER:
--------------------------------------------------------------------------------
Team                     Q1     Q2     Q3     Q4    FINAL
--------------------------------------------------------------------------------
Team_036                 34     28     30     24      116
Team_043                 32     17     23     24       96
--------------------------------------------------------------------------------

FULL GAME BOX SCORE:
================================================================================

Team_036
--------------------------------------------------------------------------------
Player                MIN  PTS  REB  AST  TO      FG   FG%      3P   3P%      FT STL BLK
--------------------------------------------------------------------------------
Michael Westbrook      32   13    0    2   1   5/7    71.4   3/4    75.0   0/0     0   0
Giannis Booker         31   21    5    2   2   9/12   75.0   3/4    75.0   2/2     0   0
Anthony Poole          31   13    0    4   3   4/7    57.1   3/4    75.0   7/7     1   1
Terry Durant           31   20   13    4   0   8/12   66.7   2/5    40.0   5/6     1   1
Kobe Simmons           31   13    8    3   1   7/12   58.3   1/3    33.3   0/1     1   0
Dirk Anunoby           18    3    0    0   1   2/3    66.7   1/2    50.0   0/0     0   0
Tobias Fox             18    5    0    1   1   2/7    28.6   1/5    20.0   0/0     0   0
Pascal Antetokounmpo   18    4    4    1   1   0/5     0.0   0/4     0.0   1/1     1   0
Devin Simmons          18    9    6    1   1   4/5    80.0   0/1     0.0   1/1     0   0
Bradley Murray         16   11    5    2   0   4/7    57.1   0/0     0.0   3/3     1   0

TEAM: FG: 45/77 (58.4%), 3PT: 14/32 (43.8%), REB: 42 (10 off, 32 def), AST: 20, TO: 11


Team_043
--------------------------------------------------------------------------------
Player                MIN  PTS  REB  AST  TO      FG   FG%      3P   3P%      FT STL BLK
--------------------------------------------------------------------------------
Malcolm Murray         31   10    0    1   2   3/9    33.3   0/3     0.0   3/3     0   0
Magic Durant           31   13    0    0   1   5/10   50.0   0/3     0.0   4/4     0   0
D'Angelo Iverson       31   11   11    3   0   4/9    44.4   1/5    20.0   8/8     0   0
Manu Carter            31   11    9    1   1   7/9    77.8   0/2     0.0   0/0     1   0
Dwyane Dosunmu         31   11    5    4   3   6/10   60.0   0/2     0.0   3/6     0   0
Jabari Holiday         18    8    0    4   2   3/5    60.0   1/3    33.3   3/4     0   0
Ben LaVine             18    8    4    0   0   2/5    40.0   1/3    33.3   0/0     1   0
Dirk Herro             18    7    6    1   1   3/4    75.0   1/1   100.0   1/2     0   0
Joel Murray            18    9    0    0   0   4/7    57.1   0/2     0.0   1/1     0   0
Terry Randle           18    5    6    4   1   3/5    60.0   0/0     0.0   3/3     0   0

TEAM: FG: 42/75 (56.0%), 3PT: 4/24 (16.7%), REB: 40 (10 off, 30 def), AST: 18, TO: 11

================================================================================
