================================================================================
                        FULL GAME - Team_038 vs Team_008                        
================================================================================

================================================================================
                       1ST QUARTER - Team_038 vs Team_008                       
================================================================================

[12:00] Team_038 possession (Score: 0-0)
Luka Barnes drives, picks up Magic Young. Help arrives from Jrue Harris! Luka Barnes attempts a Dunk. Contested by Jrue Harris (5.3 feet, MAN). LUKA BARNES MAKES IT! Assist: DeMar Harris
Score: 2-0

[11:41] Team_008 possession (Score: 2-0)
Jrue Harris attempts a 3Pt. Contested by DeMar Harris (3.2 feet, ZONE). Jrue Harris misses. Rebound secured by Luka Barnes.

[11:27] Team_038 possession (Score: 2-0)
FOUL! Shooting foul on Jrue Harris. Malcolm Poole to the line for 3 free throws. [Team fouls: 1] (Jrue Harris: 1 personal fouls)   FT 1/3: GOOD   FT 2/3: GOOD   FT 3/3: GOOD Malcolm Poole makes 3/3 from the line.
Score: 5-0

[11:15] Team_008 possession (Score: 5-0)
Victor Leonard attempts a 3Pt. Contested by Rudy Thompson (4.1 feet, MAN). Victor Leonard misses. Rebound secured by DeMar Harris.

[11:05] Team_038 possession (Score: 5-0)
Luka Barnes attempts a Midrange. Contested by Jrue Harris (4.6 feet, ZONE). Luka Barnes misses. Rebound secured by Khris Hyland.

[10:47] Team_008 possession (Score: 5-0)
Victor Leonard drives to the basket... FOUL! Offensive foul on Victor Leonard! Tracy LaVine drew the charge! [Team fouls: 2] (Victor Leonard: 1 personal fouls) TURNOVER! (dead ball)

[10:35] Team_038 possession (Score: 5-0)
Tracy LaVine makes the Midrange and draws the foul on Tyrese Thompson! And-1! Tracy LaVine to the line for 1. [Team fouls: 3] (Tyrese Thompson: 1 personal fouls)   FT 1/1: GOOD Tracy LaVine makes 1/1 from the line.
Score: 8-0

[10:19] Team_008 possession (Score: 8-0)
Victor Leonard attempts a Midrange. Contested by Tracy LaVine (4.2 feet, ZONE). Victor Leonard misses. Rebound secured by Luka Barnes.

[10:05] Team_038 possession (Score: 8-0)
Luka Barnes attempts a Layup. Contested by Tyrese Thompson (4.7 feet, ZONE). LUKA BARNES MAKES IT!
Score: 10-0

[09:48] Team_008 possession (Score: 10-0)
Khris Hyland commits a violation (traveling/carry)! TURNOVER! (dead ball)

[09:38] Team_038 possession (Score: 10-0)
Rudy Thompson drives to the basket... Rudy Thompson throws a bad pass! Stolen by Victor Leonard! TURNOVER! (live ball)

[09:20] Team_008 possession (Score: 10-0)
Victor Leonard attempts a 3Pt. Contested by DeMar Harris (3.4 feet, ZONE). Victor Leonard misses. Offensive rebound by Tyrese Thompson! Tyrese Thompson kicks it out.

[09:08] Team_008 possession (Score: 10-0)
Tyrese Thompson attempts a 3Pt. Contested by Tracy LaVine (4.0 feet, MAN). Tyrese Thompson misses. Rebound secured by Luka Barnes.

[08:57] Team_038 possession (Score: 10-0)
Malcolm Poole attempts a Midrange. BLOCKED BY MAGIC YOUNG! Ball is loose! Offensive rebound by Tracy LaVine! Tracy LaVine kicks it out.

[08:40] Team_038 possession (Score: 10-0)
Malcolm Poole attempts a 3Pt. Contested by Victor Leonard (4.9 feet, ZONE). Malcolm Poole misses. Rebound secured by Magic Young.

[08:23] Team_008 possession (Score: 10-0)
Victor Leonard attempts a Midrange. Contested by DeMar Harris (3.4 feet, ZONE). Victor Leonard misses. Rebound secured by Tracy LaVine.

[08:09] Team_038 possession (Score: 10-0)
Malcolm Poole drives, picks up Tyrese Thompson. Help arrives from Jrue Harris! Malcolm Poole attempts a Layup. Contested by Jrue Harris (4.3 feet, ZONE). Malcolm Poole misses. Rebound secured by Khris Hyland.

[07:50] Team_008 possession (Score: 10-0)
Magic Young makes the Dunk and draws the foul on Malcolm Poole! And-1! Magic Young to the line for 1. [Team fouls: 1] (Malcolm Poole: 1 personal fouls)   FT 1/1: GOOD Magic Young makes 1/1 from the line.
Score: 10-3

[07:35] Team_038 possession (Score: 10-3)
Tracy LaVine drives, picks up Tyrese Thompson. Help arrives from Jrue Harris! Tracy LaVine attempts a Layup. Contested by Jrue Harris (4.2 feet, MAN). TRACY LAVINE MAKES IT!
Score: 12-3

[07:21] Team_008 possession (Score: 12-3)
Tyrese Thompson attempts a 3Pt. Contested by Tracy LaVine (4.0 feet, MAN). Tyrese Thompson misses. Rebound secured by Luka Barnes.

[07:07] Team_038 possession (Score: 12-3)
DeMar Harris attempts a 3Pt. Contested by Victor Leonard (5.8 feet, ZONE). DeMar Harris misses. Rebound secured by Magic Young.

[06:58] Team_008 possession (Score: 12-3)
FOUL! Shooting foul on Tracy LaVine. Magic Young to the line for 2 free throws. [Team fouls: 2] (Tracy LaVine: 1 personal fouls)   FT 1/2: GOOD   FT 2/2: GOOD Magic Young makes 2/2 from the line.
Score: 12-5

[06:42] Team_038 possession (Score: 12-5)
Malcolm Poole drives, picks up Tyrese Thompson. Help arrives from Jrue Harris! Malcolm Poole attempts a Layup. Contested by Jrue Harris (4.3 feet, ZONE). MALCOLM POOLE MAKES IT!
Score: 14-5

[06:27] Team_008 possession (Score: 14-5)
FOUL! Reach-in foul on Tracy LaVine during the drive. [Team fouls: 3] No free throws, side out. (Tracy LaVine: 2 personal fouls)

[06:14] Team_008 possession (Score: 14-5)
Khris Hyland attempts a Midrange. Contested by DeMar Harris (3.2 feet, ZONE). Khris Hyland misses. Rebound secured by Luka Barnes.

[06:03] Team_038 possession (Score: 14-5)
Luka Barnes attempts a Layup. Contested by Magic Young (5.3 feet, MAN). LUKA BARNES MAKES IT! Assist: Malcolm Poole
Score: 16-5

[05:46] Team_008 possession (Score: 16-5)
Tyrese Thompson attempts a Layup. Contested by Tracy LaVine (4.0 feet, MAN). Tyrese Thompson misses. Offensive rebound by Magic Young! Magic Young's putback is no good. Rebound secured by Luka Barnes.

[05:34] Team_038 possession (Score: 16-5)
Luka Barnes attempts a Layup. BLOCKED BY MAGIC YOUNG! Ball is loose! Rebound secured by Khris Hyland.

[05:23] Team_008 possession (Score: 16-5)
Jrue Harris loses control! Ball rolls out of bounds! TURNOVER! (dead ball)

[05:09] Team_038 possession (Score: 16-5)
Rudy Thompson attempts a 3Pt. Contested by Jrue Harris (4.9 feet, ZONE). Rudy Thompson misses. Rebound secured by Magic Young.

[04:53] Team_008 possession (Score: 16-5)
Magic Young attempts a Layup. Contested by Luka Barnes (4.7 feet, MAN). Magic Young misses. Rebound secured by Tracy LaVine.

[04:37] Team_038 possession (Score: 16-5)
DeMar Harris attempts a 3Pt. Contested by Khris Hyland (4.9 feet, MAN). DEMAR HARRIS MAKES IT! Assist: Malcolm Poole
Score: 19-5

[04:24] Team_008 possession (Score: 19-5)
Tyrese Thompson drives, Tracy LaVine stays with him. Tyrese Thompson attempts a Dunk. Contested by Tracy LaVine (4.1 feet, MAN). TYRESE THOMPSON MAKES IT! Assist: Victor Leonard
Score: 19-7

[04:10] Team_038 possession (Score: 19-7)
Luka Barnes drives, Magic Young stays with him. Luka Barnes attempts a Dunk. Contested by Magic Young (5.4 feet, MAN). LUKA BARNES MAKES IT!
Score: 21-7

[03:54] Team_008 possession (Score: 21-7)
FOUL! Shooting foul on Luka Barnes. Magic Young to the line for 2 free throws. [Team fouls: 4] (Luka Barnes: 1 personal fouls)   FT 1/2: GOOD   FT 2/2: GOOD Magic Young makes 2/2 from the line.
Score: 21-9

[03:39] Team_038 possession (Score: 21-9)
DeMar Harris makes the Dunk and draws the foul on Tyrese Thompson! And-1! DeMar Harris to the line for 1. [BONUS: 5 team fouls] (Tyrese Thompson: 2 personal fouls)   FT 1/1: GOOD DeMar Harris makes 1/1 from the line.
Score: 24-9

[03:24] Team_008 possession (Score: 24-9)
Khris Hyland attempts a 3Pt. Contested by DeMar Harris (3.4 feet, MAN). Khris Hyland misses. Rebound secured by Tracy LaVine.

[03:10] Team_038 possession (Score: 24-9)
Malcolm Poole attempts a 3Pt. Contested by Jrue Harris (4.4 feet, MAN). MALCOLM POOLE MAKES IT! Assist: Luka Barnes
Score: 27-9

[02:56] Team_008 possession (Score: 27-9)
Jrue Harris loses control! Ball rolls out of bounds! TURNOVER! (dead ball)

[02:56] Substitution (Team_038): Tracy LaVine OUT → Jabari Carter IN (stamina_rule2)

[02:56] Substitution (Team_008): Victor Leonard OUT → Blake Holiday IN (stamina_rule2)

[02:56] Substitution (Team_008): Tyrese Thompson OUT → Khris Giddey IN (stamina_rule2)

[02:56] Substitution (Team_008): Magic Young OUT → Lamelo Middleton IN (stamina_rule2)

[02:46] Team_038 possession (Score: 27-9)
DeMar Harris attempts a Midrange. Contested by Khris Hyland (5.0 feet, MAN). DeMar Harris misses. Rebound secured by Khris Giddey.

[02:28] Team_008 possession (Score: 27-9)
Khris Giddey attempts a 3Pt. Contested by Rudy Thompson (4.0 feet, ZONE). Khris Giddey misses. Rebound secured by Luka Barnes.

[02:13] Team_038 possession (Score: 27-9)
Malcolm Poole makes the 3Pt and draws the foul on Jrue Harris! And-1! Malcolm Poole to the line for 1. [BONUS: 6 team fouls] (Jrue Harris: 2 personal fouls)   FT 1/1: GOOD Malcolm Poole makes 1/1 from the line.
Score: 31-9

[02:02] Team_008 possession (Score: 31-9)
Khris Giddey attempts a 3Pt. Contested by Rudy Thompson (4.0 feet, ZONE). Khris Giddey misses. Rebound secured by Luka Barnes.

[01:46] Team_038 possession (Score: 31-9)
Luka Barnes attempts a Midrange. Contested by Khris Hyland (4.7 feet, ZONE). LUKA BARNES MAKES IT! Assist: Malcolm Poole
Score: 33-9

[01:27] Team_008 possession (Score: 33-9)
Khris Hyland drives, picks up DeMar Harris. Help arrives from Malcolm Poole! Khris Hyland attempts a Layup. Contested by Malcolm Poole (3.6 feet, MAN). KHRIS HYLAND MAKES IT! Assist: Blake Holiday
Score: 33-11

[01:11] Team_038 possession (Score: 33-11)
DeMar Harris attempts a Layup. Contested by Lamelo Middleton (4.9 feet, ZONE). DeMar Harris misses. Rebound secured by Khris Hyland.

[00:53] Team_008 possession (Score: 33-11)
Jrue Harris attempts a Layup. Contested by Jabari Carter (4.1 feet, ZONE). JRUE HARRIS MAKES IT! Assist: Khris Giddey
Score: 33-13

[00:36] Team_038 possession (Score: 33-13)
Luka Barnes drives and kicks out. Luka Barnes attempts a 3Pt. Contested by Khris Giddey (4.3 feet, ZONE). LUKA BARNES MAKES IT! Assist: DeMar Harris
Score: 36-13

[00:22] Team_008 possession (Score: 36-13)
Blake Holiday attempts a 3Pt. Contested by Rudy Thompson (4.6 feet, MAN). Blake Holiday misses. Rebound secured by Jabari Carter.

[00:11] Team_038 possession (Score: 36-13)
Malcolm Poole attempts a 3Pt. Contested by Khris Giddey (4.1 feet, ZONE). Malcolm Poole misses. Rebound secured by Lamelo Middleton.

================================================================================
                              1ST QUARTER COMPLETE                              
================================================================================

1ST QUARTER SCORE: Team_038 36, Team_008 13

BOX SCORE:
================================================================================

Team_038
--------------------------------------------------------------------------------
Player                MIN  PTS  REB  AST  TO      FG   FG%      3P   3P%
--------------------------------------------------------------------------------
Luka Barnes            12   13    8    1   0   6/8    75.0     0/0   0.0
Malcolm Poole          12   12    0    3   0   4/7    57.1     0/0   0.0
DeMar Harris           12    6    1    2   0   2/5    40.0     0/0   0.0
Tracy LaVine            9    5    4    0   0   2/2   100.0     0/0   0.0
Rudy Thompson          12    0    0    0   0   0/1     0.0     0/0   0.0
Jabari Carter           3    0    1    0   0   0/0     0.0     0/0   0.0

TEAM: FG: 14/23 (60.9%), 3PT: 4/8 (50.0%), REB: 13 (1 off, 12 def), AST: 6, TO: 1
TEAM FOULS: 4


Team_008
--------------------------------------------------------------------------------
Player                MIN  PTS  REB  AST  TO      FG   FG%      3P   3P%
--------------------------------------------------------------------------------
Magic Young             9    7    3    0   0   3/4    75.0     0/0   0.0
Jrue Harris            12    2    0    0   0   1/2    50.0     0/0   0.0
Khris Hyland           12    2    4    0   0   1/3    33.3     0/0   0.0
Tyrese Thompson         9    2    1    0   0   1/4    25.0     0/0   0.0
Victor Leonard          9    0    0    1   0   0/3     0.0     0/0   0.0
Khris Giddey            3    0    1    1   0   0/2     0.0     0/0   0.0
Blake Holiday           3    0    0    1   0   0/1     0.0     0/0   0.0
Lamelo Middleton        3    0    1    0   0   0/0     0.0     0/0   0.0

TEAM: FG: 6/19 (31.6%), 3PT: 0/8 (0.0%), REB: 11 (2 off, 9 def), AST: 3, TO: 4
TEAM FOULS: 6 [Team_038 in BONUS]

================================================================================

================================================================================
                       2ND QUARTER - Team_038 vs Team_008                       
================================================================================

[12:00] Team_038 possession (Score: 36-13)
FOUL! Reach-in foul on Magic Young during the drive. [Team fouls: 1] No free throws, side out. (Magic Young: 1 personal fouls)

[11:45] Team_038 possession (Score: 36-13)
Rudy Thompson attempts a Midrange. Contested by Khris Hyland (5.0 feet, ZONE). Rudy Thompson misses. Rebound secured by Magic Young.

[11:33] Team_008 possession (Score: 36-13)
Jrue Harris drives, Tracy LaVine stays with him. Jrue Harris attempts a Layup. Contested by Tracy LaVine (3.9 feet, ZONE). JRUE HARRIS MAKES IT!
Score: 36-15

[11:18] Team_038 possession (Score: 36-15)
Malcolm Poole makes the Layup and draws the foul on Victor Leonard! And-1! Malcolm Poole to the line for 1. [Team fouls: 2] (Victor Leonard: 1 personal fouls)   FT 1/1: GOOD Malcolm Poole makes 1/1 from the line.
Score: 39-15

[10:59] Team_008 possession (Score: 39-15)
Magic Young commits a violation (traveling/carry)! TURNOVER! (dead ball)

[10:59] Substitution (Team_038): Rudy Thompson OUT → Jalen Hyland IN (stamina_rule2)

[10:59] Substitution (Team_038): Malcolm Poole OUT → Jaren Jokic IN (stamina_rule2)

[10:59] Substitution (Team_038): DeMar Harris OUT → Magic Dosunmu IN (stamina_rule2)

[10:59] Substitution (Team_038): Luka Barnes OUT → Ja Smith IN (stamina_rule2)

[10:59] Substitution (Team_008): Jrue Harris OUT → Chris Griffin IN (stamina_rule2)

[10:59] Substitution (Team_008): Khris Hyland OUT → Immanuel Young IN (stamina_rule2)

[10:45] Team_038 possession (Score: 39-15)
Jaren Jokic attempts a 3Pt. Contested by Immanuel Young (4.0 feet, ZONE). JAREN JOKIC MAKES IT! Assist: Tracy LaVine
Score: 42-15

[10:34] Team_008 possession (Score: 42-15)
Chris Griffin drives, Jaren Jokic stays with him. Chris Griffin attempts a Layup. Contested by Jaren Jokic (5.4 feet, MAN). CHRIS GRIFFIN MAKES IT!
Score: 42-17

[10:24] Team_038 possession (Score: 42-17)
Jalen Hyland drives, Tyrese Thompson stays with him. Jalen Hyland attempts a Dunk. Contested by Tyrese Thompson (4.7 feet, ZONE). JALEN HYLAND MAKES IT! Assist: Tracy LaVine
Score: 44-17

[10:12] Team_008 possession (Score: 44-17)
Tyrese Thompson attempts a 3Pt. Contested by Jalen Hyland (4.5 feet, ZONE). Tyrese Thompson misses. Rebound secured by Ja Smith.

[09:55] Team_038 possession (Score: 44-17)
Ja Smith attempts a 3Pt. Wide open! Magic Young is 6.1 feet away. [MAN] JA SMITH MAKES IT! Assist: Tracy LaVine
Score: 47-17

[09:41] Team_008 possession (Score: 47-17)
Magic Young attempts a Midrange. Contested by Ja Smith (3.6 feet, MAN). Magic Young misses. Rebound secured by Tracy LaVine.

[09:24] Team_038 possession (Score: 47-17)
Magic Dosunmu attempts a 3Pt. Contested by Immanuel Young (4.6 feet, ZONE). MAGIC DOSUNMU MAKES IT! Assist: Tracy LaVine
Score: 50-17

[09:05] Team_008 possession (Score: 50-17)
Immanuel Young drives and kicks out. Victor Leonard attempts a 3Pt. Contested by Jalen Hyland (4.3 feet, MAN). Victor Leonard misses. Offensive rebound by Magic Young! Magic Young kicks it out.

[08:53] Team_008 possession (Score: 50-17)
Immanuel Young attempts a Layup. Contested by Ja Smith (3.8 feet, ZONE). IMMANUEL YOUNG MAKES IT! Assist: Chris Griffin
Score: 50-19

[08:42] Team_038 possession (Score: 50-19)
Tracy LaVine attempts a 3Pt. Contested by Tyrese Thompson (4.6 feet, MAN). Tracy LaVine misses. Offensive rebound by Ja Smith! Ja Smith's putback is no good. Offensive rebound by Tracy LaVine! Tracy LaVine kicks it out.

[08:22] Team_038 possession (Score: 50-19)
Magic Dosunmu throws a bad pass! Stolen by Immanuel Young! TURNOVER! (live ball)

[08:09] Team_008 possession (Score: 50-19)
Victor Leonard drives to the basket... Victor Leonard throws a bad pass out of bounds! TURNOVER! (dead ball)

[08:09] Substitution (Team_038): Tracy LaVine OUT → Jabari Carter IN (stamina_rule2)

[08:09] Substitution (Team_008): Victor Leonard OUT → Blake Holiday IN (stamina_rule2)

[08:09] Substitution (Team_008): Tyrese Thompson OUT → Khris Giddey IN (stamina_rule2)

[08:09] Substitution (Team_008): Magic Young OUT → Lamelo Middleton IN (stamina_rule2)

[07:55] Team_038 possession (Score: 50-19)
Jabari Carter drives and kicks out. Jalen Hyland attempts a Midrange. Contested by Immanuel Young (4.3 feet, ZONE). Jalen Hyland misses. Offensive rebound by Ja Smith! Ja Smith puts it back in!
Score: 52-19

[07:45] Team_008 possession (Score: 52-19)
Lamelo Middleton drives, Ja Smith stays with him. Lamelo Middleton attempts a Dunk. Contested by Ja Smith (3.6 feet, ZONE). Lamelo Middleton misses. Rebound secured by Jalen Hyland.

[07:33] Team_038 possession (Score: 52-19)
Jaren Jokic attempts a Midrange. Contested by Chris Griffin (4.9 feet, MAN). Jaren Jokic misses. Rebound secured by Khris Giddey.

[07:21] Team_008 possession (Score: 52-19)
Blake Holiday throws a bad pass! Stolen by Jalen Hyland! TURNOVER! (live ball)

[07:05] Team_038 possession (Score: 52-19)
Magic Dosunmu attempts a Midrange. Contested by Immanuel Young (4.6 feet, ZONE). MAGIC DOSUNMU MAKES IT!
Score: 54-19

[06:49] Team_008 possession (Score: 54-19)
Khris Giddey drives to the basket... Khris Giddey throws a bad pass! Stolen by Jabari Carter! TURNOVER! (live ball)

[06:35] Team_038 possession (Score: 54-19)
Jaren Jokic attempts a 3Pt. Contested by Chris Griffin (4.9 feet, MAN). Jaren Jokic misses. Rebound secured by Lamelo Middleton.

[06:21] Team_008 possession (Score: 54-19)
Chris Griffin makes the Layup and draws the foul on Ja Smith! And-1! Chris Griffin to the line for 1. [Team fouls: 1] (Ja Smith: 1 personal fouls)   FT 1/1: MISS Chris Griffin makes 0/1 from the line. Rebound secured by Ja Smith.
Score: 54-21

[06:08] Team_038 possession (Score: 54-21)
Ja Smith drives to the basket... FOUL! Offensive foul on Ja Smith! Lamelo Middleton drew the charge! [Team fouls: 2] (Ja Smith: 2 personal fouls) TURNOVER! (dead ball)

[05:53] Team_008 possession (Score: 54-21)
Chris Griffin attempts a 3Pt. Contested by Jalen Hyland (4.6 feet, ZONE). CHRIS GRIFFIN MAKES IT! Assist: Immanuel Young
Score: 54-24

[05:36] Team_038 possession (Score: 54-24)
FOUL! Offensive foul on Jaren Jokic! Chris Griffin drew the charge! [Team fouls: 3] (Jaren Jokic: 1 personal fouls) TURNOVER! (dead ball)

[05:24] Team_008 possession (Score: 54-24)
Lamelo Middleton attempts a Layup. BLOCKED BY JA SMITH! Ball is loose! Rebound secured by Jabari Carter.

[05:08] Team_038 possession (Score: 54-24)
Magic Dosunmu drives and kicks out. Magic Dosunmu attempts a 3Pt. Contested by Immanuel Young (4.3 feet, MAN). MAGIC DOSUNMU MAKES IT! Assist: Ja Smith
Score: 57-24

[04:54] Team_008 possession (Score: 57-24)
Chris Griffin attempts a 3Pt. Contested by Jalen Hyland (4.6 feet, ZONE). Chris Griffin misses. Rebound secured by Ja Smith.

[04:39] Team_038 possession (Score: 57-24)
Jaren Jokic attempts a 3Pt. Contested by Chris Griffin (4.9 feet, MAN). JAREN JOKIC MAKES IT! Assist: Ja Smith
Score: 60-24

[04:25] Team_008 possession (Score: 60-24)
Lamelo Middleton makes the Layup and draws the foul on Ja Smith! And-1! Lamelo Middleton to the line for 1. [Team fouls: 4] (Ja Smith: 3 personal fouls)   FT 1/1: MISS Lamelo Middleton makes 0/1 from the line. Offensive rebound by Lamelo Middleton! Lamelo Middleton puts it back in!
Score: 60-28

[04:12] Team_038 possession (Score: 60-28)
Ja Smith attempts a Midrange. Contested by Lamelo Middleton (5.3 feet, MAN). Ja Smith misses. Offensive rebound by Ja Smith! Ja Smith puts it back in!
Score: 62-28

[03:56] Team_008 possession (Score: 62-28)
Immanuel Young attempts a Midrange. Contested by Magic Dosunmu (3.6 feet, MAN). Immanuel Young misses. Rebound secured by Jalen Hyland.

[03:41] Team_038 possession (Score: 62-28)
Magic Dosunmu attempts a Layup. Contested by Immanuel Young (4.6 feet, MAN). MAGIC DOSUNMU MAKES IT! Assist: Ja Smith
Score: 64-28

[03:28] Team_008 possession (Score: 64-28)
Khris Giddey drives, picks up Ja Smith. Help arrives from Jalen Hyland! Khris Giddey attempts a Layup. Contested by Jalen Hyland (3.3 feet, ZONE). KHRIS GIDDEY MAKES IT! Assist: Immanuel Young
Score: 64-30

[03:14] Team_038 possession (Score: 64-30)
Jaren Jokic attempts a 3Pt. Contested by Khris Giddey (3.9 feet, ZONE). Jaren Jokic misses. Rebound secured by Lamelo Middleton.

[02:59] Team_008 possession (Score: 64-30)
Chris Griffin attempts a 3Pt. Contested by Jaren Jokic (5.4 feet, MAN). Chris Griffin misses. Rebound secured by Jalen Hyland.

[02:43] Team_038 possession (Score: 64-30)
Jabari Carter makes the Midrange and draws the foul on Immanuel Young! And-1! Jabari Carter to the line for 1. [Team fouls: 3] (Immanuel Young: 1 personal fouls)   FT 1/1: MISS Jabari Carter makes 0/1 from the line. Offensive rebound by Ja Smith! Ja Smith puts it back in!
Score: 68-30

[02:30] Team_008 possession (Score: 68-30)
Khris Giddey attempts a 3Pt. Contested by Jalen Hyland (4.4 feet, ZONE). KHRIS GIDDEY MAKES IT! Assist: Lamelo Middleton
Score: 68-33

[02:16] Team_038 possession (Score: 68-33)
Jalen Hyland drives to the basket... Jalen Hyland throws a bad pass! Stolen by Lamelo Middleton! TURNOVER! (live ball)

[02:01] Team_008 possession (Score: 68-33)
Chris Griffin attempts a 3Pt. Contested by Jalen Hyland (4.8 feet, ZONE). Chris Griffin misses. Offensive rebound by Khris Giddey! Khris Giddey kicks it out.

[01:48] Team_008 possession (Score: 68-33)
Khris Giddey drives and kicks out. Khris Giddey attempts a Midrange. Contested by Magic Dosunmu (3.4 feet, ZONE). Khris Giddey misses. Rebound secured by Jabari Carter.

[01:36] Team_038 possession (Score: 68-33)
Magic Dosunmu attempts a 3Pt. Contested by Khris Giddey (4.6 feet, ZONE). Magic Dosunmu misses. Offensive rebound by Ja Smith! Ja Smith puts it back in!
Score: 70-33

[01:26] Team_008 possession (Score: 70-33)
Khris Giddey attempts a Midrange. Contested by Jabari Carter (4.1 feet, ZONE). Khris Giddey misses. Rebound secured by Ja Smith.

[01:14] Team_038 possession (Score: 70-33)
Magic Dosunmu attempts a 3Pt. Contested by Immanuel Young (4.8 feet, MAN). MAGIC DOSUNMU MAKES IT! Assist: Jaren Jokic
Score: 73-33

[00:59] Team_008 possession (Score: 73-33)
Immanuel Young drives, picks up Magic Dosunmu. Help arrives from Jalen Hyland! Immanuel Young attempts a Layup. Contested by Jalen Hyland (3.9 feet, MAN). IMMANUEL YOUNG MAKES IT! Assist: Khris Giddey
Score: 73-35

[00:43] Team_038 possession (Score: 73-35)
Magic Dosunmu attempts a Midrange. Contested by Chris Griffin (5.8 feet, ZONE). MAGIC DOSUNMU MAKES IT! Assist: Jalen Hyland
Score: 75-35

[00:28] Team_008 possession (Score: 75-35)
FOUL! Shooting foul on Ja Smith. Immanuel Young to the line for 2 free throws. [BONUS: 5 team fouls] (Ja Smith: 4 personal fouls)   FT 1/2: MISS   FT 2/2: GOOD Immanuel Young makes 1/2 from the line.
Score: 75-36

[00:15] Team_038 possession (Score: 75-36)
FOUL! Shooting foul on Immanuel Young. Jaren Jokic to the line for 2 free throws. [Team fouls: 4] (Immanuel Young: 2 personal fouls)   FT 1/2: GOOD   FT 2/2: GOOD Jaren Jokic makes 2/2 from the line.
Score: 77-36

[00:03] Team_008 possession (Score: 77-36)
Blake Holiday attempts a 3Pt. Contested by Jalen Hyland (4.9 feet, MAN). Blake Holiday misses. Offensive rebound by Lamelo Middleton! Lamelo Middleton puts it back in!
Score: 77-38

================================================================================
                              2ND QUARTER COMPLETE                              
================================================================================

2ND QUARTER SCORE: Team_038 41, Team_008 25

BOX SCORE:
================================================================================

Team_038
--------------------------------------------------------------------------------
Player                MIN  PTS  REB  AST  TO      FG   FG%      3P   3P%
--------------------------------------------------------------------------------
Magic Dosunmu          11   15    0    0   0   6/6   100.0     0/0   0.0
Ja Smith               11   13    7    3   0   5/5   100.0     0/0   0.0
Jaren Jokic            11    8    0    1   0   3/6    50.0     0/0   0.0
Malcolm Poole          13    3    0    0   0   1/1   100.0     0/0   0.0
Jalen Hyland           11    2    3    1   0   1/1   100.0     0/0   0.0
Rudy Thompson          13    0    0    0   0   0/1     0.0     0/0   0.0
Tracy LaVine           13    0    2    4   0   0/0     0.0     0/0   0.0
Jabari Carter          11    0    2    0   0   0/0     0.0     0/0   0.0

TEAM: FG: 16/20 (80.0%), 3PT: 6/8 (75.0%), REB: 14 (4 off, 10 def), AST: 9, TO: 4
TEAM FOULS: 5 [Team_008 in BONUS]


Team_008
--------------------------------------------------------------------------------
Player                MIN  PTS  REB  AST  TO      FG   FG%      3P   3P%
--------------------------------------------------------------------------------
Lamelo Middleton       11    6    3    1   0   2/4    50.0     0/0   0.0
Chris Griffin          11    5    0    1   0   2/5    40.0     0/0   0.0
Immanuel Young         11    5    0    2   0   3/4    75.0     0/0   0.0
Khris Giddey           11    5    2    1   0   2/4    50.0     0/0   0.0
Jrue Harris            13    2    0    0   0   1/1   100.0     0/0   0.0
Magic Young            13    0    2    0   0   0/1     0.0     0/0   0.0
Tyrese Thompson        13    0    0    0   0   0/1     0.0     0/0   0.0

TEAM: FG: 10/20 (50.0%), 3PT: 3/6 (50.0%), REB: 7 (3 off, 4 def), AST: 5, TO: 4
TEAM FOULS: 4

================================================================================

================================================================================
                       3RD QUARTER - Team_038 vs Team_008                       
================================================================================

[12:00] Team_038 possession (Score: 77-38)
FOUL! Offensive foul on Rudy Thompson! Victor Leonard drew the charge! [Team fouls: 1] (Rudy Thompson: 1 personal fouls) TURNOVER! (dead ball)

[11:49] Team_008 possession (Score: 77-38)
FOUL! Shooting foul on DeMar Harris. Tyrese Thompson to the line for 3 free throws. [Team fouls: 2] (DeMar Harris: 1 personal fouls)   FT 1/3: GOOD   FT 2/3: MISS   FT 3/3: MISS Tyrese Thompson makes 1/3 from the line. Rebound secured by Luka Barnes.
Score: 77-39

[11:33] Team_038 possession (Score: 77-39)
Tracy LaVine attempts a Layup. Contested by Tyrese Thompson (4.2 feet, ZONE). Tracy LaVine misses. Offensive rebound by Luka Barnes! Luka Barnes kicks it out.

[11:18] Team_038 possession (Score: 77-39)
Malcolm Poole attempts a 3Pt. Contested by Victor Leonard (4.9 feet, ZONE). MALCOLM POOLE MAKES IT! Assist: Luka Barnes
Score: 80-39

[11:00] Team_008 possession (Score: 80-39)
Jrue Harris attempts a Midrange. Contested by Malcolm Poole (5.0 feet, MAN). Jrue Harris misses. Rebound secured by Luka Barnes.

[10:47] Team_038 possession (Score: 80-39)
DeMar Harris attempts a Layup. Contested by Tyrese Thompson (5.1 feet, ZONE). DEMAR HARRIS MAKES IT!
Score: 82-39

[10:31] Team_008 possession (Score: 82-39)
Magic Young attempts a Midrange. Contested by DeMar Harris (3.5 feet, ZONE). MAGIC YOUNG MAKES IT!
Score: 82-41

[10:21] Team_038 possession (Score: 82-41)
Luka Barnes attempts a Midrange. Contested by Jrue Harris (4.6 feet, ZONE). LUKA BARNES MAKES IT! Assist: DeMar Harris
Score: 84-41

[10:01] Team_008 possession (Score: 84-41)
Victor Leonard drives, Tracy LaVine stays with him. Victor Leonard attempts a Layup. Contested by Tracy LaVine (4.2 feet, ZONE). VICTOR LEONARD MAKES IT!
Score: 84-43

[09:45] Team_038 possession (Score: 84-43)
Malcolm Poole attempts a 3Pt. Contested by Jrue Harris (4.2 feet, MAN). Malcolm Poole misses. Rebound secured by Magic Young.

[09:30] Team_008 possession (Score: 84-43)
Victor Leonard attempts a 3Pt. Contested by DeMar Harris (3.4 feet, ZONE). Victor Leonard misses. Rebound secured by DeMar Harris.

[09:14] Team_038 possession (Score: 84-43)
Tracy LaVine attempts a 3Pt. Contested by Victor Leonard (4.8 feet, ZONE). Tracy LaVine misses. Offensive rebound by Tracy LaVine! Tracy LaVine puts it back in!
Score: 86-43

[08:59] Team_008 possession (Score: 86-43)
Magic Young makes the Layup and draws the foul on Luka Barnes! And-1! Magic Young to the line for 1. [Team fouls: 3] (Luka Barnes: 1 personal fouls)   FT 1/1: GOOD Magic Young makes 1/1 from the line.
Score: 86-46

[08:40] Team_038 possession (Score: 86-46)
FOUL! Shooting foul on Khris Hyland. DeMar Harris to the line for 2 free throws. [Team fouls: 1] (Khris Hyland: 1 personal fouls)   FT 1/2: GOOD   FT 2/2: GOOD DeMar Harris makes 2/2 from the line.
Score: 88-46

[08:29] Team_008 possession (Score: 88-46)
Tyrese Thompson loses control! Ball rolls out of bounds! TURNOVER! (dead ball)

[08:15] Team_038 possession (Score: 88-46)
DeMar Harris attempts a 3Pt. Contested by Khris Hyland (4.8 feet, MAN). DeMar Harris misses. Rebound secured by Khris Hyland.

[07:56] Team_008 possession (Score: 88-46)
FOUL! Holding foul on Rudy Thompson. [Team fouls: 4] No free throws, side out. (Rudy Thompson: 2 personal fouls)

[07:40] Team_008 possession (Score: 88-46)
Jrue Harris attempts a 3Pt. Contested by DeMar Harris (3.2 feet, ZONE). Jrue Harris misses. Rebound secured by Luka Barnes.

[07:27] Team_038 possession (Score: 88-46)
Malcolm Poole attempts a 3Pt. Contested by Victor Leonard (4.9 feet, ZONE). Malcolm Poole misses. Offensive rebound by Luka Barnes! Luka Barnes kicks it out.

[07:12] Team_038 possession (Score: 88-46)
Tracy LaVine loses the ball! Stripped by Tyrese Thompson! TURNOVER! (live ball)

[07:02] Team_008 possession (Score: 88-46)
Khris Hyland makes the Midrange and draws the foul on DeMar Harris! And-1! Khris Hyland to the line for 1. [BONUS: 5 team fouls] (DeMar Harris: 2 personal fouls)   FT 1/1: GOOD Khris Hyland makes 1/1 from the line.
Score: 88-49

[06:50] Team_038 possession (Score: 88-49)
Luka Barnes drives, picks up Tyrese Thompson. Help arrives from Jrue Harris! Luka Barnes attempts a Layup. Contested by Jrue Harris (4.7 feet, ZONE). LUKA BARNES MAKES IT! Assist: DeMar Harris
Score: 90-49

[06:40] Team_008 possession (Score: 90-49)
Victor Leonard drives, Tracy LaVine stays with him. Victor Leonard attempts a Layup. Contested by Tracy LaVine (4.2 feet, ZONE). VICTOR LEONARD MAKES IT!
Score: 90-51

[06:24] Team_038 possession (Score: 90-51)
FOUL! Shooting foul on Tyrese Thompson. Rudy Thompson to the line for 2 free throws. [Team fouls: 2] (Tyrese Thompson: 1 personal fouls)   FT 1/2: GOOD   FT 2/2: GOOD Rudy Thompson makes 2/2 from the line.
Score: 92-51

[06:11] Team_008 possession (Score: 92-51)
Khris Hyland loses the ball! Stripped by DeMar Harris! TURNOVER! (live ball)

[05:55] Team_038 possession (Score: 92-51)
Tracy LaVine makes the Dunk and draws the foul on Tyrese Thompson! And-1! Tracy LaVine to the line for 1. [Team fouls: 3] (Tyrese Thompson: 2 personal fouls)   FT 1/1: GOOD Tracy LaVine makes 1/1 from the line.
Score: 95-51

[05:42] Team_008 possession (Score: 95-51)
Tyrese Thompson attempts a 3Pt. Contested by DeMar Harris (3.3 feet, ZONE). Tyrese Thompson misses. Offensive rebound by Magic Young! Magic Young puts it back in!
Score: 95-53

[05:30] Team_038 possession (Score: 95-53)
Rudy Thompson drives, Tyrese Thompson stays with him. Rudy Thompson attempts a Dunk. Contested by Tyrese Thompson (5.0 feet, ZONE). RUDY THOMPSON MAKES IT! Assist: DeMar Harris
Score: 97-53

[05:15] Team_008 possession (Score: 97-53)
Khris Hyland drives to the basket... Khris Hyland loses control! Ball rolls out of bounds! TURNOVER! (dead ball)

[05:02] Team_038 possession (Score: 97-53)
Malcolm Poole drives, Tyrese Thompson stays with him. Malcolm Poole attempts a Layup. Contested by Tyrese Thompson (4.4 feet, ZONE). MALCOLM POOLE MAKES IT! Assist: DeMar Harris
Score: 99-53

[04:53] Team_008 possession (Score: 99-53)
Tyrese Thompson drives and kicks out. Magic Young attempts a Midrange. Contested by DeMar Harris (3.1 feet, ZONE). Magic Young misses. Offensive rebound by Tyrese Thompson! Tyrese Thompson kicks it out.

[04:36] Team_008 possession (Score: 99-53)
Tyrese Thompson attempts a 3Pt. Contested by Tracy LaVine (4.1 feet, MAN). Tyrese Thompson misses. Rebound secured by Luka Barnes.

[04:20] Team_038 possession (Score: 99-53)
FOUL! Holding foul on Tyrese Thompson. [Team fouls: 4] No free throws, side out. (Tyrese Thompson: 3 personal fouls)

[04:09] Team_038 possession (Score: 99-53)
Malcolm Poole drives, Jrue Harris stays with him. Malcolm Poole attempts a Layup. Contested by Jrue Harris (4.3 feet, MAN). MALCOLM POOLE MAKES IT! Assist: DeMar Harris
Score: 101-53

[03:58] Team_008 possession (Score: 101-53)
Magic Young drives to the basket... Magic Young throws a bad pass out of bounds! TURNOVER! (dead ball)

[03:43] Team_038 possession (Score: 101-53)
DeMar Harris makes the Midrange and draws the foul on Jrue Harris! And-1! DeMar Harris to the line for 1. [BONUS: 5 team fouls] (Jrue Harris: 1 personal fouls)   FT 1/1: MISS DeMar Harris makes 0/1 from the line. FOUL! Loose ball foul on Khris Hyland during the free throw rebound! [IN THE BONUS! 6 team fouls] Tracy LaVine to the line for 2 free throws. (Khris Hyland: 2 personal fouls)   FT 1/2: GOOD   FT 2/2: MISS Tracy LaVine makes 1/2 from the line. Rebound secured by Tyrese Thompson.
Score: 104-53

[03:29] Team_008 possession (Score: 104-53)
Jrue Harris attempts a Midrange. Contested by Malcolm Poole (5.1 feet, MAN). Jrue Harris misses. Rebound secured by Luka Barnes.

[03:14] Team_038 possession (Score: 104-53)
Malcolm Poole drives to the basket... Malcolm Poole loses the ball! Stripped by Tyrese Thompson! TURNOVER! (live ball)

[02:57] Team_008 possession (Score: 104-53)
Tyrese Thompson attempts a Midrange. Contested by Tracy LaVine (4.2 feet, MAN). TYRESE THOMPSON MAKES IT!
Score: 104-55

[02:46] Team_038 possession (Score: 104-55)
Tracy LaVine attempts a Layup. Contested by Tyrese Thompson (4.6 feet, ZONE). Tracy LaVine misses. Rebound secured by Tyrese Thompson.

[02:31] Team_008 possession (Score: 104-55)
Jrue Harris attempts a 3Pt. Contested by Malcolm Poole (5.2 feet, MAN). JRUE HARRIS MAKES IT! Assist: Khris Hyland
Score: 104-58

[02:17] Team_038 possession (Score: 104-58)
Luka Barnes makes the Midrange and draws the foul on Magic Young! And-1! Luka Barnes to the line for 1. [BONUS: 7 team fouls] (Magic Young: 1 personal fouls)   FT 1/1: GOOD Luka Barnes makes 1/1 from the line.
Score: 107-58

[01:57] Team_008 possession (Score: 107-58)
FOUL! Reach-in foul on Tracy LaVine during the drive. [IN THE BONUS! 6 team fouls] Tyrese Thompson to the line for 2 free throws. (Tracy LaVine: 1 personal fouls)   FT 1/2: GOOD   FT 2/2: GOOD Tyrese Thompson makes 2/2 from the line.
Score: 107-60

[01:44] Team_038 possession (Score: 107-60)
Rudy Thompson attempts a Midrange. Contested by Victor Leonard (5.9 feet, MAN). Rudy Thompson misses. Rebound secured by Tyrese Thompson.

[01:30] Team_008 possession (Score: 107-60)
Magic Young attempts a Midrange. Contested by Luka Barnes (5.0 feet, MAN). Magic Young misses. Rebound secured by Luka Barnes.

[01:14] Team_038 possession (Score: 107-60)
Luka Barnes attempts a Midrange. Contested by Victor Leonard (5.7 feet, ZONE). Luka Barnes misses. Rebound secured by Khris Hyland.

[01:00] Team_008 possession (Score: 107-60)
Victor Leonard attempts a Midrange. Contested by Rudy Thompson (4.5 feet, MAN). VICTOR LEONARD MAKES IT!
Score: 107-62

[00:44] Team_038 possession (Score: 107-62)
FOUL! Reach-in foul on Magic Young during the drive. [IN THE BONUS! 8 team fouls] Luka Barnes to the line for 2 free throws. (Magic Young: 2 personal fouls)   FT 1/2: GOOD   FT 2/2: GOOD Luka Barnes makes 2/2 from the line.
Score: 109-62

[00:29] Team_008 possession (Score: 109-62)
Magic Young attempts a Layup. BLOCKED BY TRACY LAVINE! Ball goes out off Tracy LaVine. Magic Young's ball!

[00:18] Team_008 possession (Score: 109-62)
Victor Leonard attempts a 3Pt. Contested by DeMar Harris (4.0 feet, ZONE). Victor Leonard misses. Offensive rebound by Magic Young! Magic Young kicks it out.

[00:03] Team_008 possession (Score: 109-62)
Jrue Harris drives, Malcolm Poole stays with him. Jrue Harris attempts a Layup. Contested by Malcolm Poole (5.4 feet, MAN). JRUE HARRIS MAKES IT! Assist: Magic Young
Score: 109-64

================================================================================
                              3RD QUARTER COMPLETE                              
================================================================================

3RD QUARTER SCORE: Team_038 32, Team_008 26

BOX SCORE:
================================================================================

Team_038
--------------------------------------------------------------------------------
Player                MIN  PTS  REB  AST  TO      FG   FG%      3P   3P%
--------------------------------------------------------------------------------
Luka Barnes            25    9    8    1   0   4/5    80.0     0/0   0.0
Malcolm Poole          25    7    0    0   0   3/4    75.0     0/0   0.0
Tracy LaVine           25    5    1    0   0   2/3    66.7     0/0   0.0
DeMar Harris           25    4    1    5   0   2/4    50.0     0/0   0.0
Rudy Thompson          25    4    0    0   0   2/3    66.7     0/0   0.0

TEAM: FG: 13/19 (68.4%), 3PT: 2/4 (50.0%), REB: 10 (3 off, 7 def), AST: 6, TO: 3
TEAM FOULS: 6 [Team_008 in BONUS]


Team_008
--------------------------------------------------------------------------------
Player                MIN  PTS  REB  AST  TO      FG   FG%      3P   3P%
--------------------------------------------------------------------------------
Magic Young            25    7    3    1   0   3/4    75.0     0/0   0.0
Victor Leonard         25    6    0    0   0   3/4    75.0     0/0   0.0
Jrue Harris            25    5    0    0   0   2/5    40.0     0/0   0.0
Tyrese Thompson        25    4    4    0   0   2/4    50.0     0/0   0.0
Khris Hyland           25    3    2    1   0   1/1   100.0     0/0   0.0

TEAM: FG: 11/18 (61.1%), 3PT: 2/6 (33.3%), REB: 9 (3 off, 6 def), AST: 2, TO: 4
TEAM FOULS: 8 [Team_038 in BONUS]

================================================================================

================================================================================
                       4TH QUARTER - Team_038 vs Team_008                       
================================================================================

[12:00] Team_038 possession (Score: 109-64)
DeMar Harris drives, picks up Khris Hyland. Help arrives from Jrue Harris! DeMar Harris attempts a Layup. Contested by Jrue Harris (5.1 feet, MAN). DeMar Harris misses. Rebound secured by Khris Hyland.

[11:48] Team_008 possession (Score: 109-64)
Tyrese Thompson drives, picks up Tracy LaVine. Help arrives from Malcolm Poole! Tyrese Thompson attempts a Layup. Contested by Malcolm Poole (4.4 feet, ZONE). Tyrese Thompson misses. Rebound secured by Luka Barnes.

[11:35] Team_038 possession (Score: 109-64)
Rudy Thompson attempts a Midrange. Contested by Victor Leonard (5.9 feet, MAN). Rudy Thompson misses. FOUL! Loose ball foul on Magic Young during the rebound battle. [Team fouls: 1] No free throws, side out. (Magic Young: 1 personal fouls)

[11:20] Team_038 possession (Score: 109-64)
Tracy LaVine attempts a 3Pt. Contested by Tyrese Thompson (4.8 feet, MAN). Tracy LaVine misses. Rebound secured by Tyrese Thompson.

[11:08] Team_008 possession (Score: 109-64)
Tyrese Thompson attempts a 3Pt. Contested by DeMar Harris (3.7 feet, ZONE). Tyrese Thompson misses. Rebound secured by Tracy LaVine.

[10:55] Team_038 possession (Score: 109-64)
Luka Barnes attempts a Midrange. Contested by Magic Young (5.7 feet, MAN). Luka Barnes misses. Rebound secured by Magic Young.

[10:38] Team_008 possession (Score: 109-64)
Tyrese Thompson drives and kicks out. Khris Hyland attempts a 3Pt. Contested by DeMar Harris (3.7 feet, ZONE). Khris Hyland misses. Rebound secured by Luka Barnes.

[10:25] Team_038 possession (Score: 109-64)
Tracy LaVine attempts a Midrange. Contested by Tyrese Thompson (4.9 feet, MAN). Tracy LaVine misses. Rebound secured by Magic Young.

[10:09] Team_008 possession (Score: 109-64)
Khris Hyland attempts a 3Pt. Contested by DeMar Harris (3.8 feet, MAN). Khris Hyland misses. Rebound secured by Luka Barnes.

[09:56] Team_038 possession (Score: 109-64)
Rudy Thompson loses the ball! Stripped by Victor Leonard! TURNOVER! (live ball)

[09:46] Team_008 possession (Score: 109-64)
Magic Young attempts a Layup. Contested by Tracy LaVine (4.8 feet, ZONE). MAGIC YOUNG MAKES IT!
Score: 109-66

[09:34] Team_038 possession (Score: 109-66)
DeMar Harris throws a bad pass out of bounds! TURNOVER! (dead ball)

[09:34] Substitution (Team_038): Rudy Thompson OUT → Jalen Hyland IN (stamina_rule2)

[09:34] Substitution (Team_038): Malcolm Poole OUT → Jaren Jokic IN (stamina_rule2)

[09:34] Substitution (Team_038): DeMar Harris OUT → Magic Dosunmu IN (stamina_rule2)

[09:34] Substitution (Team_038): Tracy LaVine OUT → Jabari Carter IN (stamina_rule2)

[09:34] Substitution (Team_038): Luka Barnes OUT → Ja Smith IN (stamina_rule2)

[09:34] Substitution (Team_008): Victor Leonard OUT → Blake Holiday IN (stamina_rule2)

[09:34] Substitution (Team_008): Jrue Harris OUT → Chris Griffin IN (stamina_rule2)

[09:34] Substitution (Team_008): Khris Hyland OUT → Immanuel Young IN (stamina_rule2)

[09:34] Substitution (Team_008): Tyrese Thompson OUT → Khris Giddey IN (stamina_rule2)

[09:34] Substitution (Team_008): Magic Young OUT → Lamelo Middleton IN (stamina_rule2)

[09:19] Team_008 possession (Score: 109-66)
Chris Griffin attempts a Layup. BLOCKED BY JA SMITH! Ball deflects out of bounds off Chris Griffin.

[09:03] Team_038 possession (Score: 109-66)
Ja Smith attempts a Midrange. Contested by Lamelo Middleton (5.3 feet, MAN). Ja Smith misses. Offensive rebound by Ja Smith! Ja Smith puts it back in!
Score: 111-66

[08:46] Team_008 possession (Score: 111-66)
Blake Holiday attempts a 3Pt. Contested by Jalen Hyland (4.5 feet, MAN). Blake Holiday misses. Offensive rebound by Khris Giddey! Khris Giddey kicks it out.

[08:33] Team_008 possession (Score: 111-66)
Immanuel Young attempts a 3Pt. Contested by Jalen Hyland (4.8 feet, ZONE). Immanuel Young misses. Offensive rebound by Lamelo Middleton! Lamelo Middleton puts it back in!
Score: 111-68

[08:24] Team_038 possession (Score: 111-68)
Ja Smith attempts a Midrange. Contested by Lamelo Middleton (5.3 feet, MAN). Ja Smith misses. Rebound secured by Khris Giddey.

[08:09] Team_008 possession (Score: 111-68)
Khris Giddey attempts a Midrange. Contested by Ja Smith (3.2 feet, ZONE). Khris Giddey misses. Rebound secured by Jabari Carter.

[07:50] Team_038 possession (Score: 111-68)
Jaren Jokic drives to the basket... Jaren Jokic loses the ball! Stripped by Chris Griffin! TURNOVER! (live ball)

[07:39] Team_008 possession (Score: 111-68)
FOUL! Holding foul on Ja Smith. [Team fouls: 1] No free throws, side out. (Ja Smith: 1 personal fouls)

[07:22] Team_008 possession (Score: 111-68)
Blake Holiday attempts a Layup. Contested by Jalen Hyland (4.5 feet, MAN). Blake Holiday misses. Rebound secured by Ja Smith.

[07:05] Team_038 possession (Score: 111-68)
Jaren Jokic drives and kicks out. Jaren Jokic attempts a Midrange. Contested by Chris Griffin (5.3 feet, ZONE). Jaren Jokic misses. Rebound secured by Chris Griffin.

[06:50] Team_008 possession (Score: 111-68)
Khris Giddey makes the Layup and draws the foul on Jalen Hyland! And-1! Khris Giddey to the line for 1. [Team fouls: 2] (Jalen Hyland: 1 personal fouls)   FT 1/1: MISS Khris Giddey makes 0/1 from the line. Rebound secured by Ja Smith.
Score: 111-70

[06:37] Team_038 possession (Score: 111-70)
FOUL! Shooting foul on Chris Griffin. Ja Smith to the line for 2 free throws. [Team fouls: 2] (Chris Griffin: 1 personal fouls)   FT 1/2: GOOD   FT 2/2: GOOD Ja Smith makes 2/2 from the line.
Score: 113-70

[06:21] Team_008 possession (Score: 113-70)
Chris Griffin attempts a Midrange. Contested by Jaren Jokic (5.4 feet, MAN). CHRIS GRIFFIN MAKES IT! Assist: Lamelo Middleton
Score: 113-72

[06:06] Team_038 possession (Score: 113-72)
FOUL! Reach-in foul on Lamelo Middleton during the drive. [Team fouls: 3] No free throws, side out. (Lamelo Middleton: 1 personal fouls)

[05:56] Team_038 possession (Score: 113-72)
Magic Dosunmu attempts a 3Pt. Contested by Immanuel Young (4.6 feet, MAN). MAGIC DOSUNMU MAKES IT! Assist: Ja Smith
Score: 116-72

[05:41] Team_008 possession (Score: 116-72)
FOUL! Shooting foul on Jalen Hyland. Immanuel Young to the line for 3 free throws. [Team fouls: 3] (Jalen Hyland: 2 personal fouls)   FT 1/3: MISS   FT 2/3: GOOD   FT 3/3: MISS Immanuel Young makes 1/3 from the line. Rebound secured by Ja Smith.
Score: 116-73

[05:21] Team_038 possession (Score: 116-73)
Ja Smith drives and kicks out. Jabari Carter attempts a 3Pt. Contested by Khris Giddey (4.3 feet, MAN). Jabari Carter misses. Offensive rebound by Jabari Carter! Jabari Carter's putback is no good. Rebound secured by Lamelo Middleton.

[05:11] Team_008 possession (Score: 116-73)
Lamelo Middleton makes the Dunk and draws the foul on Jalen Hyland! And-1! Lamelo Middleton to the line for 1. [Team fouls: 4] (Jalen Hyland: 3 personal fouls)   FT 1/1: GOOD Lamelo Middleton makes 1/1 from the line.
Score: 116-76

[05:00] Team_038 possession (Score: 116-76)
Magic Dosunmu loses control! Ball rolls out of bounds! TURNOVER! (dead ball)

[04:46] Team_008 possession (Score: 116-76)
Blake Holiday attempts a 3Pt. Contested by Jalen Hyland (4.5 feet, ZONE). Blake Holiday misses. Rebound secured by Jabari Carter.

[04:30] Team_038 possession (Score: 116-76)
FOUL! Reach-in foul on Lamelo Middleton during the drive. [Team fouls: 4] No free throws, side out. (Lamelo Middleton: 2 personal fouls)

[04:18] Team_038 possession (Score: 116-76)
Ja Smith drives and kicks out. Jalen Hyland attempts a 3Pt. Contested by Blake Holiday (5.4 feet, MAN). JALEN HYLAND MAKES IT! Assist: Magic Dosunmu
Score: 119-76

[04:08] Team_008 possession (Score: 119-76)
Chris Griffin commits a violation (traveling/carry)! TURNOVER! (dead ball)

[03:52] Team_038 possession (Score: 119-76)
Jalen Hyland drives and kicks out. Jabari Carter attempts a 3Pt. Contested by Khris Giddey (4.3 feet, MAN). Jabari Carter misses. Rebound secured by Lamelo Middleton.

[03:38] Team_008 possession (Score: 119-76)
Immanuel Young attempts a 3Pt. Contested by Magic Dosunmu (3.6 feet, ZONE). Immanuel Young misses. Rebound secured by Jabari Carter.

[03:22] Team_038 possession (Score: 119-76)
Jaren Jokic makes the Midrange and draws the foul on Chris Griffin! And-1! Jaren Jokic to the line for 1. [BONUS: 5 team fouls] (Chris Griffin: 2 personal fouls)   FT 1/1: GOOD Jaren Jokic makes 1/1 from the line.
Score: 122-76

[03:06] Team_008 possession (Score: 122-76)
Immanuel Young drives, Ja Smith stays with him. Immanuel Young attempts a Dunk. Contested by Ja Smith (3.8 feet, ZONE). Immanuel Young misses. Rebound secured by Jabari Carter.

[02:53] Team_038 possession (Score: 122-76)
Ja Smith attempts a 3Pt. Contested by Khris Giddey (5.2 feet, ZONE). Ja Smith misses. Rebound secured by Khris Giddey.

[02:42] Team_008 possession (Score: 122-76)
Lamelo Middleton attempts a Midrange. Contested by Jaren Jokic (5.4 feet, ZONE). LAMELO MIDDLETON MAKES IT! Assist: Khris Giddey
Score: 122-78

[02:27] Team_038 possession (Score: 122-78)
Jaren Jokic attempts a 3Pt. Contested by Chris Griffin (5.0 feet, MAN). Jaren Jokic misses. Rebound secured by Chris Griffin.

[02:13] Team_008 possession (Score: 122-78)
Immanuel Young drives to the basket... FOUL! Offensive foul on Immanuel Young! Ja Smith drew the charge! [Team fouls: 6] (Immanuel Young: 1 personal fouls) TURNOVER! (dead ball)

[01:55] Team_038 possession (Score: 122-78)
Magic Dosunmu drives and kicks out. Magic Dosunmu attempts a Midrange. Contested by Immanuel Young (4.4 feet, MAN). Magic Dosunmu misses. Rebound secured by Lamelo Middleton.

[01:41] Team_008 possession (Score: 122-78)
Immanuel Young attempts a 3Pt. Contested by Magic Dosunmu (3.7 feet, MAN). IMMANUEL YOUNG MAKES IT! Assist: Khris Giddey
Score: 122-81

[01:25] Team_038 possession (Score: 122-81)
Jabari Carter attempts a 3Pt. Contested by Khris Giddey (4.9 feet, ZONE). Jabari Carter misses. Rebound secured by Chris Griffin.

[01:14] Team_008 possession (Score: 122-81)
Khris Giddey drives to the basket... Khris Giddey throws a bad pass! Stolen by Jabari Carter! TURNOVER! (live ball)

[00:59] Team_038 possession (Score: 122-81)
FOUL! Reach-in foul on Lamelo Middleton during the drive. [IN THE BONUS! 7 team fouls] Magic Dosunmu to the line for 2 free throws. (Lamelo Middleton: 3 personal fouls)   FT 1/2: GOOD   FT 2/2: GOOD Magic Dosunmu makes 2/2 from the line.
Score: 124-81

[00:49] Team_008 possession (Score: 124-81)
FOUL! Reach-in foul on Jalen Hyland during the drive. [IN THE BONUS! 5 team fouls] Blake Holiday to the line for 2 free throws. (Jalen Hyland: 4 personal fouls)   FT 1/2: GOOD   FT 2/2: GOOD Blake Holiday makes 2/2 from the line.
Score: 124-83

[00:36] Team_038 possession (Score: 124-83)
Jaren Jokic attempts a Midrange. Contested by Chris Griffin (5.1 feet, MAN). Jaren Jokic misses. Rebound secured by Chris Griffin.

[00:20] Team_008 possession (Score: 124-83)
Immanuel Young makes the Layup and draws the foul on Jalen Hyland! And-1! Immanuel Young to the line for 1. [BONUS: 6 team fouls] (Jalen Hyland: 5 personal fouls)   FT 1/1: GOOD Immanuel Young makes 1/1 from the line.
Score: 124-86

[00:01] Team_038 possession (Score: 124-86)
Jabari Carter drives, Khris Giddey stays with him. Jabari Carter attempts a Layup. Contested by Khris Giddey (5.0 feet, MAN). JABARI CARTER MAKES IT! Assist: Jalen Hyland
Score: 126-86

================================================================================
                              4TH QUARTER COMPLETE                              
================================================================================

4TH QUARTER SCORE: Team_038 17, Team_008 22

BOX SCORE:
================================================================================

Team_038
--------------------------------------------------------------------------------
Player                MIN  PTS  REB  AST  TO      FG   FG%      3P   3P%
--------------------------------------------------------------------------------
Magic Dosunmu          20    5    0    1   0   2/3    66.7     0/0   0.0
Ja Smith               20    4    4    1   0   2/5    40.0     0/0   0.0
Jaren Jokic            20    3    0    0   0   1/4    25.0     0/0   0.0
Jalen Hyland           20    3    0    1   0   1/2    50.0     0/0   0.0
Jabari Carter          21    2    4    0   0   1/2    50.0     0/0   0.0
DeMar Harris           28    0    0    0   0   0/1     0.0     0/0   0.0
Luka Barnes            28    0    4    0   0   0/1     0.0     0/0   0.0
Tracy LaVine           28    0    1    0   0   0/2     0.0     0/0   0.0

TEAM: FG: 7/20 (35.0%), 3PT: 1/5 (20.0%), REB: 14 (3 off, 11 def), AST: 3, TO: 4
TEAM FOULS: 6 [Team_008 in BONUS]


Team_008
--------------------------------------------------------------------------------
Player                MIN  PTS  REB  AST  TO      FG   FG%      3P   3P%
--------------------------------------------------------------------------------
Lamelo Middleton       21    7    4    1   0   3/3   100.0     0/0   0.0
Immanuel Young         20    6    0    0   0   2/5    40.0     0/0   0.0
Magic Young            28    2    2    0   0   1/1   100.0     0/0   0.0
Chris Griffin          20    2    4    0   0   1/2    50.0     0/0   0.0
Blake Holiday          21    2    0    0   0   1/3    33.3     0/0   0.0
Khris Hyland           28    0    1    0   0   0/1     0.0     0/0   0.0
Tyrese Thompson        28    0    1    0   0   0/3     0.0     0/0   0.0
Khris Giddey           21    0    3    2   0   0/2     0.0     0/0   0.0

TEAM: FG: 8/20 (40.0%), 3PT: 2/7 (28.6%), REB: 14 (2 off, 12 def), AST: 3, TO: 3
TEAM FOULS: 7 [Team_038 in BONUS]

================================================================================

================================================================================
                               FULL GAME COMPLETE                               
================================================================================

FINAL SCORE: Team_038 126, Team_008 86

SCORING BY QUARTER:
--------------------------------------------------------------------------------
Team                     Q1     Q2     Q3     Q4    FINAL
--------------------------------------------------------------------------------
Team_038                 36     41     32     17      126
Team_008                 13     25     26     22       86
--------------------------------------------------------------------------------

FULL GAME BOX SCORE:
================================================================================

Team_038
--------------------------------------------------------------------------------
Player                MIN  PTS  REB  AST  TO      FG   FG%      3P   3P%      FT STL BLK
--------------------------------------------------------------------------------
Rudy Thompson          28    4    0    0   2   2/5    40.0   0/1     0.0   2/2     0   0
Malcolm Poole          28   22    0    3   0   8/12   66.7   4/7    57.1   5/5     0   0
DeMar Harris           28   10    2    7   2   4/10   40.0   1/3    33.3   3/4     1   0
Luka Barnes            28   22   20    2   0  10/14   71.4   0/0     0.0   3/3     0   0
Tracy LaVine           28   10    8    4   2   4/7    57.1   1/2    50.0   2/2     0   1
Jabari Carter          21    2    7    0   2   3/4    75.0   0/1     0.0   0/1     2   0
Jalen Hyland           20    5    3    2   0   1/2    50.0   0/0     0.0   0/0     1   0
Jaren Jokic            20   11    0    1   2   4/10   40.0   2/5    40.0   3/3     0   0
Magic Dosunmu          20   20    0    1   2   9/10   90.0   4/4   100.0   2/2     0   0
Ja Smith               20   17   12    4   0   5/8    62.5   1/2    50.0   2/2     0   2

TEAM: FG: 50/82 (61.0%), 3PT: 13/25 (52.0%), REB: 51 (11 off, 40 def), AST: 24, TO: 12


Team_008
--------------------------------------------------------------------------------
Player                MIN  PTS  REB  AST  TO      FG   FG%      3P   3P%      FT STL BLK
--------------------------------------------------------------------------------
Jrue Harris            28    9    0    0   3   4/8    50.0   1/3    33.3   0/0     0   0
Khris Hyland           28    5    7    1   2   2/5    40.0   0/2     0.0   1/1     0   0
Victor Leonard         28    6    0    1   2   3/7    42.9   0/2     0.0   0/0     2   0
Tyrese Thompson        28    6    6    0   2   4/13   30.8   1/7    14.3   3/5     2   0
Magic Young            28   16   10    1   1   6/9    66.7   0/0     0.0   6/6     0   2
Blake Holiday          21    2    0    1   1   2/5    40.0   1/3    33.3   2/2     0   0
Khris Giddey           21    5    6    4   1   2/8    25.0   1/3    33.3   0/1     0   0
Lamelo Middleton       21   13    9    2   1   3/5    60.0   0/0     0.0   1/2     1   0
Chris Griffin          20    7    4    1   2   3/7    42.9   1/3    33.3   0/1     1   0
Immanuel Young         20   11    0    2   0   6/10   60.0   2/4    50.0   3/6     1   0

TEAM: FG: 35/77 (45.5%), 3PT: 7/27 (25.9%), REB: 41 (10 off, 31 def), AST: 13, TO: 15

================================================================================
