================================================================================
                        FULL GAME - Team_040 vs Team_093                        
================================================================================

================================================================================
                       1ST QUARTER - Team_040 vs Team_093                       
================================================================================

[12:00] Team_040 possession (Score: 0-0)
Carmelo Murray drives and kicks out. Ayo Rose attempts a 3Pt. Contested by Damian Williamson (4.8 feet, MAN). AYO ROSE MAKES IT! Assist: Bam Gobert
Score: 3-0

[11:50] Team_093 possession (Score: 3-0)
Ben Cunningham attempts a 3Pt. Contested by Ayo Rose (5.1 feet, ZONE). Ben Cunningham misses. Rebound secured by Dirk Johnson.

[11:34] Team_040 possession (Score: 3-0)
Bam Gobert drives, Ben Cunningham stays with him. Bam Gobert attempts a Dunk. Contested by Ben Cunningham (5.2 feet, ZONE). BAM GOBERT MAKES IT! Assist: Carmelo Murray
Score: 5-0

[11:21] Team_093 possession (Score: 5-0)
Carmelo Wagner makes the Dunk and draws the foul on Carmelo Murray! And-1! Carmelo Wagner to the line for 1. [Team fouls: 1] (Carmelo Murray: 1 personal fouls)   FT 1/1: GOOD Carmelo Wagner makes 1/1 from the line.
Score: 5-3

[11:10] Team_040 possession (Score: 5-3)
FOUL! Shooting foul on Vince Barnes. Bam Gobert to the line for 2 free throws. [Team fouls: 1] (Vince Barnes: 1 personal fouls)   FT 1/2: GOOD   FT 2/2: GOOD Bam Gobert makes 2/2 from the line.
Score: 7-3

[10:58] Team_093 possession (Score: 7-3)
Carmelo Wagner drives to the basket... Carmelo Wagner loses control! Ball rolls out of bounds! TURNOVER! (dead ball)

[10:44] Team_040 possession (Score: 7-3)
Dirk Johnson attempts a 3Pt. Contested by Vince Barnes (4.3 feet, MAN). Dirk Johnson misses. Rebound secured by Carmelo Wagner.

[10:30] Team_093 possession (Score: 7-3)
Carmelo Wagner attempts a Layup. BLOCKED BY CARMELO MURRAY! Ball goes out off Carmelo Murray. Carmelo Wagner's ball!

[10:16] Team_093 possession (Score: 7-3)
Ben Cunningham attempts a Midrange. Contested by Bam Gobert (4.4 feet, MAN). BEN CUNNINGHAM MAKES IT!
Score: 7-5

[10:01] Team_040 possession (Score: 7-5)
Bam Gobert attempts a 3Pt. Contested by Ben Cunningham (5.2 feet, MAN). BAM GOBERT MAKES IT! Assist: Dirk Johnson
Score: 10-5

[09:48] Team_093 possession (Score: 10-5)
Carmelo Wagner attempts a Midrange. Contested by Carmelo Murray (4.1 feet, MAN). CARMELO WAGNER MAKES IT! Assist: Damian Williamson
Score: 10-7

[09:38] Team_040 possession (Score: 10-7)
Carmelo Murray drives, Ben Cunningham stays with him. Carmelo Murray attempts a Layup. Contested by Ben Cunningham (5.2 feet, ZONE). CARMELO MURRAY MAKES IT!
Score: 12-7

[09:23] Team_093 possession (Score: 12-7)
Trae Westbrook attempts a 3Pt. Contested by Ayo Rose (4.4 feet, ZONE). Trae Westbrook misses. Rebound secured by Dirk Johnson.

[09:11] Team_040 possession (Score: 12-7)
Bam Gobert attempts a Layup. Contested by Ben Cunningham (5.2 feet, ZONE). BAM GOBERT MAKES IT!
Score: 14-7

[08:57] Team_093 possession (Score: 14-7)
Ben Cunningham makes the Dunk and draws the foul on Bam Gobert! And-1! Ben Cunningham to the line for 1. [Team fouls: 2] (Bam Gobert: 1 personal fouls)   FT 1/1: GOOD Ben Cunningham makes 1/1 from the line.
Score: 14-10

[08:38] Team_040 possession (Score: 14-10)
Dirk Johnson attempts a Layup. BLOCKED BY TRAE WESTBROOK! Ball is loose! Rebound secured by Vince Barnes.

[08:28] Team_093 possession (Score: 14-10)
Damian Williamson drives, Ayo Rose stays with him. Damian Williamson attempts a Layup. Contested by Ayo Rose (4.5 feet, MAN). Damian Williamson misses. Offensive rebound by Ben Cunningham! Ben Cunningham kicks it out.

[08:15] Team_093 possession (Score: 14-10)
Vince Barnes attempts a Layup. Contested by Bam Gobert (4.1 feet, ZONE). Vince Barnes misses. Rebound secured by Dirk Johnson.

[08:03] Team_040 possession (Score: 14-10)
Shaquille Bane drives, Ben Cunningham stays with him. Shaquille Bane attempts a Layup. Contested by Ben Cunningham (5.4 feet, ZONE). Shaquille Bane misses. Offensive rebound by Bam Gobert! Bam Gobert kicks it out.

[07:48] Team_040 possession (Score: 14-10)
Ayo Rose drives, picks up Ben Cunningham. Help arrives from Trae Westbrook! Ayo Rose attempts a Dunk. Contested by Trae Westbrook (5.6 feet, ZONE). Ayo Rose misses. Rebound secured by Vince Barnes.

[07:35] Team_093 possession (Score: 14-10)
FOUL! Reach-in foul on Bam Gobert during the drive. [Team fouls: 3] No free throws, side out. (Bam Gobert: 2 personal fouls)

[07:24] Team_093 possession (Score: 14-10)
Ben Cunningham throws a bad pass! Stolen by Bam Gobert! TURNOVER! (live ball)

[07:07] Team_040 possession (Score: 14-10)
Bam Gobert drives to the basket... Bam Gobert throws a bad pass! Stolen by Ben Cunningham! TURNOVER! (live ball)

[06:49] Team_093 possession (Score: 14-10)
Vince Barnes attempts a Midrange. Wide open! Dirk Johnson is 6.0 feet away. [MAN] VINCE BARNES MAKES IT!
Score: 14-12

[06:34] Team_040 possession (Score: 14-12)
Dirk Johnson throws a bad pass! Stolen by Vince Barnes! TURNOVER! (live ball)

[06:20] Team_093 possession (Score: 14-12)
Carmelo Wagner attempts a Layup. Contested by Bam Gobert (3.6 feet, ZONE). Carmelo Wagner misses. Offensive rebound by Ben Cunningham! Ben Cunningham kicks it out.

[06:04] Team_093 possession (Score: 14-12)
FOUL! Shooting foul on Bam Gobert. Trae Westbrook to the line for 2 free throws. [Team fouls: 4] (Bam Gobert: 3 personal fouls)   FT 1/2: GOOD   FT 2/2: GOOD Trae Westbrook makes 2/2 from the line.
Score: 14-14

[05:52] Team_040 possession (Score: 14-14)
Ayo Rose attempts a 3Pt. Contested by Damian Williamson (5.5 feet, MAN). AYO ROSE MAKES IT! Assist: Dirk Johnson
Score: 17-14

[05:38] Team_093 possession (Score: 17-14)
FOUL! Holding foul on Carmelo Murray. [IN THE BONUS! 5 team fouls] Carmelo Wagner to the line for 2 free throws. (Carmelo Murray: 2 personal fouls)   FT 1/2: GOOD   FT 2/2: MISS Carmelo Wagner makes 1/2 from the line. Rebound secured by Shaquille Bane.
Score: 17-15

[05:21] Team_040 possession (Score: 17-15)
Bam Gobert attempts a Layup. Contested by Ben Cunningham (5.3 feet, ZONE). BAM GOBERT MAKES IT! Assist: Carmelo Murray
Score: 19-15

[05:10] Team_093 possession (Score: 19-15)
Ben Cunningham loses the ball! Stripped by Bam Gobert! TURNOVER! (live ball)

[05:00] Team_040 possession (Score: 19-15)
Ayo Rose drives and kicks out. Ayo Rose attempts a 3Pt. Contested by Carmelo Wagner (3.5 feet, ZONE). Ayo Rose misses. Rebound secured by Carmelo Wagner.

[04:48] Team_093 possession (Score: 19-15)
Vince Barnes attempts a 3Pt. Contested by Ayo Rose (4.8 feet, ZONE). Vince Barnes misses. Rebound secured by Dirk Johnson.

[04:38] Team_040 possession (Score: 19-15)
Bam Gobert drives to the basket... Bam Gobert throws a bad pass! Stolen by Ben Cunningham! TURNOVER! (live ball)

[04:24] Team_093 possession (Score: 19-15)
Ben Cunningham throws a bad pass! Stolen by Bam Gobert! TURNOVER! (live ball)

[04:10] Team_040 possession (Score: 19-15)
Dirk Johnson attempts a Midrange. Contested by Vince Barnes (4.4 feet, MAN). DIRK JOHNSON MAKES IT! Assist: Shaquille Bane
Score: 21-15

[03:57] Team_093 possession (Score: 21-15)
Carmelo Wagner attempts a 3Pt. Contested by Carmelo Murray (4.3 feet, MAN). Carmelo Wagner misses. Rebound secured by Dirk Johnson.

[03:42] Team_040 possession (Score: 21-15)
Ayo Rose attempts a Midrange. Wide open! Trae Westbrook is 6.2 feet away. [ZONE] AYO ROSE MAKES IT! Assist: Shaquille Bane
Score: 23-15

[03:32] Team_093 possession (Score: 23-15)
Vince Barnes attempts a 3Pt. Wide open! Dirk Johnson is 6.2 feet away. [MAN] VINCE BARNES MAKES IT! Assist: Carmelo Wagner
Score: 23-18

[03:21] Team_040 possession (Score: 23-18)
Ayo Rose makes the Layup and draws the foul on Ben Cunningham! And-1! Ayo Rose to the line for 1. [Team fouls: 2] (Ben Cunningham: 1 personal fouls)   FT 1/1: GOOD Ayo Rose makes 1/1 from the line.
Score: 26-18

[03:06] Team_093 possession (Score: 26-18)
Ben Cunningham drives and kicks out. Trae Westbrook attempts a 3Pt. Contested by Shaquille Bane (4.9 feet, MAN). TRAE WESTBROOK MAKES IT! Assist: Ben Cunningham
Score: 26-21

[02:51] Team_040 possession (Score: 26-21)
FOUL! Shooting foul on Vince Barnes. Bam Gobert to the line for 2 free throws. [Team fouls: 3] (Vince Barnes: 2 personal fouls)   FT 1/2: GOOD   FT 2/2: GOOD Bam Gobert makes 2/2 from the line.
Score: 28-21

[02:40] Team_093 possession (Score: 28-21)
Ben Cunningham drives, picks up Dirk Johnson. Help arrives from Shaquille Bane! Ben Cunningham attempts a Dunk. Wide open! Shaquille Bane is 6.5 feet away. [ZONE] BEN CUNNINGHAM MAKES IT! Assist: Vince Barnes
Score: 28-23

[02:26] Team_040 possession (Score: 28-23)
Shaquille Bane attempts a Midrange. Contested by Vince Barnes (4.8 feet, ZONE). SHAQUILLE BANE MAKES IT! Assist: Bam Gobert
Score: 30-23

[02:07] Team_093 possession (Score: 30-23)
Carmelo Wagner drives, Carmelo Murray stays with him. Carmelo Wagner attempts a Dunk. Contested by Carmelo Murray (4.5 feet, MAN). CARMELO WAGNER MAKES IT!
Score: 30-25

[01:50] Team_040 possession (Score: 30-25)
Shaquille Bane attempts a Midrange. Contested by Carmelo Wagner (4.3 feet, ZONE). Shaquille Bane misses. Rebound secured by Vince Barnes.

[01:36] Team_093 possession (Score: 30-25)
Damian Williamson attempts a 3Pt. Contested by Ayo Rose (5.0 feet, MAN). Damian Williamson misses. Rebound secured by Shaquille Bane.

[01:25] Team_040 possession (Score: 30-25)
Bam Gobert makes the Midrange and draws the foul on Vince Barnes! And-1! Bam Gobert to the line for 1. [Team fouls: 4] (Vince Barnes: 3 personal fouls)   FT 1/1: GOOD Bam Gobert makes 1/1 from the line.
Score: 33-25

[01:08] Team_093 possession (Score: 33-25)
Trae Westbrook attempts a 3Pt. Contested by Shaquille Bane (4.9 feet, MAN). TRAE WESTBROOK MAKES IT! Assist: Vince Barnes
Score: 33-28

[00:54] Team_040 possession (Score: 33-28)
Ayo Rose drives, picks up Damian Williamson. Help arrives from Carmelo Wagner! Ayo Rose attempts a Dunk. Contested by Carmelo Wagner (6.0 feet, MAN). Ayo Rose misses. Rebound secured by Ben Cunningham.

[00:39] Team_093 possession (Score: 33-28)
FOUL! Shooting foul on Shaquille Bane. Trae Westbrook to the line for 2 free throws. [BONUS: 6 team fouls] (Shaquille Bane: 1 personal fouls)   FT 1/2: GOOD   FT 2/2: MISS Trae Westbrook makes 1/2 from the line. Offensive rebound by Carmelo Wagner! Carmelo Wagner kicks it out.
Score: 33-29

[00:21] Team_093 possession (Score: 33-29)
Trae Westbrook attempts a Layup. Wide open! Dirk Johnson is 6.1 feet away. [ZONE] TRAE WESTBROOK MAKES IT!
Score: 33-31

[00:08] Team_040 possession (Score: 33-31)
Shaquille Bane attempts a 3Pt. Wide open! Trae Westbrook is 6.3 feet away. [MAN] SHAQUILLE BANE MAKES IT! Assist: Carmelo Murray
Score: 36-31

================================================================================
                              1ST QUARTER COMPLETE                              
================================================================================

1ST QUARTER SCORE: Team_040 36, Team_093 31

BOX SCORE:
================================================================================

Team_040
--------------------------------------------------------------------------------
Player                MIN  PTS  REB  AST  TO      FG   FG%      3P   3P%
--------------------------------------------------------------------------------
Bam Gobert             12   16    1    2   0   7/7   100.0     0/0   0.0
Ayo Rose               12   11    0    0   0   4/7    57.1     0/0   0.0
Shaquille Bane         12    5    2    2   0   2/3    66.7     0/0   0.0
Dirk Johnson           12    2    5    2   0   1/3    33.3     0/0   0.0
Carmelo Murray         12    2    0    3   0   1/1   100.0     0/0   0.0

TEAM: FG: 15/21 (71.4%), 3PT: 3/4 (75.0%), REB: 8 (1 off, 7 def), AST: 9, TO: 3
TEAM FOULS: 6 [Team_093 in BONUS]


Team_093
--------------------------------------------------------------------------------
Player                MIN  PTS  REB  AST  TO      FG   FG%      3P   3P%
--------------------------------------------------------------------------------
Trae Westbrook         12   10    0    0   0   4/5    80.0     0/0   0.0
Ben Cunningham         12    7    3    1   0   3/4    75.0     0/0   0.0
Carmelo Wagner         12    7    3    1   0   3/4    75.0     0/0   0.0
Vince Barnes           12    5    3    2   0   2/4    50.0     0/0   0.0
Damian Williamson      12    0    0    1   0   0/1     0.0     0/0   0.0

TEAM: FG: 12/19 (63.2%), 3PT: 2/7 (28.6%), REB: 9 (3 off, 6 def), AST: 5, TO: 4
TEAM FOULS: 4

================================================================================

================================================================================
                       2ND QUARTER - Team_040 vs Team_093                       
================================================================================

[12:00] Team_040 possession (Score: 36-31)
Carmelo Murray attempts a Layup. Contested by Vince Barnes (4.7 feet, ZONE). CARMELO MURRAY MAKES IT! Assist: Dirk Johnson
Score: 38-31

[11:50] Team_093 possession (Score: 38-31)
Carmelo Wagner attempts a 3Pt. BLOCKED BY CARMELO MURRAY! Ball deflects out of bounds off Carmelo Wagner.

[11:38] Team_040 possession (Score: 38-31)
Carmelo Murray attempts a Midrange. Contested by Ben Cunningham (5.7 feet, ZONE). Carmelo Murray misses. Offensive rebound by Dirk Johnson! Dirk Johnson kicks it out.

[11:25] Team_040 possession (Score: 38-31)
Shaquille Bane attempts a 3Pt. Wide open! Trae Westbrook is 6.2 feet away. [MAN] Shaquille Bane misses. FOUL! Loose ball foul on Ben Cunningham during the rebound battle. [Team fouls: 1] No free throws, side out. (Ben Cunningham: 1 personal fouls)

[11:14] Team_040 possession (Score: 38-31)
Dirk Johnson attempts a 3Pt. Contested by Carmelo Wagner (4.2 feet, ZONE). Dirk Johnson misses. Rebound secured by Vince Barnes.

[11:01] Team_093 possession (Score: 38-31)
Vince Barnes attempts a 3Pt. Wide open! Dirk Johnson is 6.4 feet away. [MAN] Vince Barnes misses. Rebound secured by Dirk Johnson.

[10:46] Team_040 possession (Score: 38-31)
Carmelo Murray attempts a Midrange. Contested by Carmelo Wagner (4.3 feet, MAN). CARMELO MURRAY MAKES IT!
Score: 40-31

[10:35] Team_093 possession (Score: 40-31)
Trae Westbrook attempts a Layup. Contested by Bam Gobert (4.3 feet, ZONE). Trae Westbrook misses. FOUL! Loose ball foul on Shaquille Bane during the rebound battle. [Team fouls: 1] No free throws, side out. (Shaquille Bane: 1 personal fouls)

[10:20] Team_093 possession (Score: 40-31)
Trae Westbrook loses control! Ball rolls out of bounds! TURNOVER! (dead ball)

[10:20] Substitution (Team_040): Ayo Rose OUT → Cole O'Neal IN (stamina_rule2)

[10:20] Substitution (Team_040): Shaquille Bane OUT → Tracy Middleton IN (stamina_rule2)

[10:20] Substitution (Team_040): Carmelo Murray OUT → Klay Leonard IN (stamina_rule2)

[10:20] Substitution (Team_040): Dirk Johnson OUT → RJ Curry IN (stamina_rule2)

[10:20] Substitution (Team_040): Bam Gobert OUT → Josh Banchero IN (stamina_rule2)

[10:20] Substitution (Team_093): Damian Williamson OUT → Shaquille George IN (stamina_rule2)

[10:20] Substitution (Team_093): Trae Westbrook OUT → Immanuel Cunningham IN (stamina_rule2)

[10:20] Substitution (Team_093): Carmelo Wagner OUT → Lauri Parker IN (stamina_rule2)

[10:20] Substitution (Team_093): Vince Barnes OUT → Kobe Murray IN (stamina_rule2)

[10:20] Substitution (Team_093): Ben Cunningham OUT → Cade O'Neal IN (stamina_rule2)

[10:09] Team_040 possession (Score: 40-31)
Josh Banchero attempts a Midrange. Wide open! Immanuel Cunningham is 6.1 feet away. [ZONE] JOSH BANCHERO MAKES IT! Assist: Cole O'Neal
Score: 42-31

[09:53] Team_093 possession (Score: 42-31)
Kobe Murray attempts a Layup. Contested by Josh Banchero (5.9 feet, ZONE). KOBE MURRAY MAKES IT!
Score: 42-33

[09:35] Team_040 possession (Score: 42-33)
Klay Leonard drives, picks up Kobe Murray. Help arrives from Shaquille George! Klay Leonard attempts a Layup. Contested by Shaquille George (3.9 feet, ZONE). Klay Leonard misses. Rebound secured by Lauri Parker.

[09:19] Team_093 possession (Score: 42-33)
Immanuel Cunningham attempts a Layup. Wide open! Tracy Middleton is 6.1 feet away. [MAN] Immanuel Cunningham misses. Rebound secured by RJ Curry.

[09:01] Team_040 possession (Score: 42-33)
Cole O'Neal attempts a 3Pt. Contested by Shaquille George (4.3 feet, ZONE). Cole O'Neal misses. Rebound secured by Cade O'Neal.

[08:48] Team_093 possession (Score: 42-33)
Kobe Murray attempts a Layup. Contested by RJ Curry (4.9 feet, MAN). KOBE MURRAY MAKES IT!
Score: 42-35

[08:32] Team_040 possession (Score: 42-35)
Tracy Middleton drives, Kobe Murray stays with him. Tracy Middleton attempts a Layup. Contested by Kobe Murray (4.3 feet, ZONE). Tracy Middleton misses. Rebound secured by Cade O'Neal.

[08:19] Team_093 possession (Score: 42-35)
Shaquille George attempts a 3Pt. Wide open! Cole O'Neal is 6.8 feet away. [MAN] Shaquille George misses. Offensive rebound by Cade O'Neal! Cade O'Neal kicks it out.

[08:06] Team_093 possession (Score: 42-35)
Kobe Murray drives and kicks out. Shaquille George attempts a 3Pt. Wide open! Cole O'Neal is 6.5 feet away. [MAN] SHAQUILLE GEORGE MAKES IT! Assist: Kobe Murray
Score: 42-38

[07:50] Team_040 possession (Score: 42-38)
Tracy Middleton attempts a Layup. BLOCKED BY IMMANUEL CUNNINGHAM! Ball is loose! Rebound secured by Lauri Parker.

[07:37] Team_093 possession (Score: 42-38)
Kobe Murray drives, RJ Curry stays with him. Kobe Murray attempts a Dunk. Contested by RJ Curry (4.9 feet, MAN). KOBE MURRAY MAKES IT!
Score: 42-40

[07:25] Team_040 possession (Score: 42-40)
RJ Curry attempts a 3Pt. Contested by Kobe Murray (3.8 feet, MAN). RJ CURRY MAKES IT! Assist: Cole O'Neal
Score: 45-40

[07:11] Team_093 possession (Score: 45-40)
Cade O'Neal attempts a Layup. Contested by Josh Banchero (5.9 feet, ZONE). CADE O'NEAL MAKES IT!
Score: 45-42

[06:58] Team_040 possession (Score: 45-42)
Cole O'Neal attempts a 3Pt. Contested by Shaquille George (4.3 feet, MAN). Cole O'Neal misses. Offensive rebound by RJ Curry! RJ Curry kicks it out.

[06:39] Team_040 possession (Score: 45-42)
Cole O'Neal attempts a 3Pt. Contested by Shaquille George (4.3 feet, ZONE). Cole O'Neal misses. Rebound secured by Lauri Parker.

[06:24] Team_093 possession (Score: 45-42)
Kobe Murray attempts a Midrange. Contested by RJ Curry (4.9 feet, MAN). KOBE MURRAY MAKES IT! Assist: Shaquille George
Score: 45-44

[06:10] Team_040 possession (Score: 45-44)
Klay Leonard attempts a 3Pt. Contested by Shaquille George (4.2 feet, ZONE). Klay Leonard misses. Rebound secured by Cade O'Neal.

[05:56] Team_093 possession (Score: 45-44)
FOUL! Reach-in foul on Cole O'Neal during the drive. [Team fouls: 2] No free throws, side out. (Cole O'Neal: 1 personal fouls)

[05:44] Team_093 possession (Score: 45-44)
Lauri Parker drives to the basket... Lauri Parker throws a bad pass! Stolen by Josh Banchero! TURNOVER! (live ball)

[05:32] Team_040 possession (Score: 45-44)
Cole O'Neal drives, picks up Shaquille George. Help arrives from Lauri Parker! Cole O'Neal attempts a Dunk. Contested by Lauri Parker (4.3 feet, MAN). Cole O'Neal misses. Offensive rebound by Josh Banchero! Josh Banchero kicks it out.

[05:14] Team_040 possession (Score: 45-44)
Tracy Middleton drives and kicks out. Tracy Middleton attempts a 3Pt. Contested by Shaquille George (4.3 feet, ZONE). Tracy Middleton misses. Rebound secured by Kobe Murray.

[05:01] Team_093 possession (Score: 45-44)
Shaquille George drives, picks up Josh Banchero. Help arrives from Tracy Middleton! Shaquille George attempts a Dunk. Wide open! Tracy Middleton is 6.1 feet away. [ZONE] Shaquille George misses. Rebound secured by Josh Banchero.

[04:49] Team_040 possession (Score: 45-44)
Josh Banchero drives, Kobe Murray stays with him. Josh Banchero attempts a Layup. Contested by Kobe Murray (4.5 feet, MAN). Josh Banchero misses. Offensive rebound by Josh Banchero! Josh Banchero kicks it out.

[04:34] Team_040 possession (Score: 45-44)
RJ Curry drives, picks up Kobe Murray. Help arrives from Shaquille George! RJ Curry attempts a Dunk. Contested by Shaquille George (3.8 feet, ZONE). RJ Curry misses. Offensive rebound by RJ Curry! RJ Curry kicks it out.

[04:23] Team_040 possession (Score: 45-44)
Josh Banchero drives, Kobe Murray stays with him. Josh Banchero attempts a Dunk. Contested by Kobe Murray (4.5 feet, MAN). JOSH BANCHERO MAKES IT! Assist: RJ Curry
Score: 47-44

[04:09] Team_093 possession (Score: 47-44)
FOUL! Shooting foul on Josh Banchero. Cade O'Neal to the line for 3 free throws. [Team fouls: 3] (Josh Banchero: 1 personal fouls)   FT 1/3: GOOD   FT 2/3: GOOD   FT 3/3: GOOD Cade O'Neal makes 3/3 from the line.
Score: 47-47

[03:57] Team_040 possession (Score: 47-47)
Cole O'Neal attempts a Layup. Contested by Shaquille George (4.3 feet, MAN). COLE O'NEAL MAKES IT! Assist: Josh Banchero
Score: 49-47

[03:40] Team_093 possession (Score: 49-47)
Lauri Parker attempts a Midrange. Contested by Klay Leonard (5.0 feet, MAN). Lauri Parker misses. Rebound secured by RJ Curry.

[03:28] Team_040 possession (Score: 49-47)
RJ Curry makes the Midrange and draws the foul on Lauri Parker! And-1! RJ Curry to the line for 1. [Team fouls: 2] (Lauri Parker: 1 personal fouls)   FT 1/1: GOOD RJ Curry makes 1/1 from the line.
Score: 52-47

[03:11] Team_093 possession (Score: 52-47)
FOUL! Holding foul on Klay Leonard. [Team fouls: 4] No free throws, side out. (Klay Leonard: 1 personal fouls)

[02:59] Team_093 possession (Score: 52-47)
Cade O'Neal attempts a 3Pt. Contested by Josh Banchero (6.0 feet, MAN). Cade O'Neal misses. Rebound secured by Klay Leonard.

[02:43] Team_040 possession (Score: 52-47)
Cole O'Neal drives and kicks out. Tracy Middleton attempts a 3Pt. Contested by Immanuel Cunningham (5.7 feet, MAN). Tracy Middleton misses. Rebound secured by Lauri Parker.

[02:28] Team_093 possession (Score: 52-47)
Cade O'Neal attempts a Midrange. Contested by Josh Banchero (6.0 feet, MAN). Cade O'Neal misses. Rebound secured by Josh Banchero.

[02:17] Team_040 possession (Score: 52-47)
Cole O'Neal drives and kicks out. FOUL! Shooting foul on Shaquille George. Cole O'Neal to the line for 3 free throws. [Team fouls: 3] (Shaquille George: 1 personal fouls)   FT 1/3: GOOD   FT 2/3: MISS   FT 3/3: GOOD Cole O'Neal makes 2/3 from the line.
Score: 54-47

[02:02] Team_093 possession (Score: 54-47)
Cade O'Neal attempts a Layup. Wide open! Josh Banchero is 6.0 feet away. [ZONE] CADE O'NEAL MAKES IT! Assist: Shaquille George
Score: 54-49

[01:46] Team_040 possession (Score: 54-49)
Klay Leonard drives, Kobe Murray stays with him. Klay Leonard attempts a Dunk. Contested by Kobe Murray (4.1 feet, ZONE). KLAY LEONARD MAKES IT! Assist: Cole O'Neal
Score: 56-49

[01:29] Team_093 possession (Score: 56-49)
Lauri Parker attempts a 3Pt. Contested by Klay Leonard (5.1 feet, MAN). Lauri Parker misses. Rebound secured by RJ Curry.

[01:19] Team_040 possession (Score: 56-49)
Cole O'Neal attempts a 3Pt. Contested by Shaquille George (4.5 feet, ZONE). Cole O'Neal misses. Rebound secured by Kobe Murray.

[01:05] Team_093 possession (Score: 56-49)
Lauri Parker attempts a Midrange. Contested by RJ Curry (5.1 feet, ZONE). LAURI PARKER MAKES IT!
Score: 56-51

[00:48] Team_040 possession (Score: 56-51)
Tracy Middleton attempts a 3Pt. Contested by Shaquille George (4.8 feet, ZONE). Tracy Middleton misses. Rebound secured by Cade O'Neal.

[00:29] Team_093 possession (Score: 56-51)
Shaquille George attempts a Layup. Wide open! Josh Banchero is 6.4 feet away. [ZONE] SHAQUILLE GEORGE MAKES IT!
Score: 56-53

[00:15] Team_040 possession (Score: 56-53)
Klay Leonard attempts a Midrange. Contested by Lauri Parker (4.8 feet, MAN). Klay Leonard misses. FOUL! Loose ball foul on Lauri Parker during the rebound battle. [Team fouls: 4] No free throws, side out. (Lauri Parker: 2 personal fouls)

[00:05] Team_040 possession (Score: 56-53)
Klay Leonard drives and kicks out. Tracy Middleton attempts a 3Pt. Contested by Immanuel Cunningham (5.9 feet, MAN). Tracy Middleton misses. Rebound secured by Kobe Murray.

================================================================================
                              2ND QUARTER COMPLETE                              
================================================================================

2ND QUARTER SCORE: Team_040 20, Team_093 22

BOX SCORE:
================================================================================

Team_040
--------------------------------------------------------------------------------
Player                MIN  PTS  REB  AST  TO      FG   FG%      3P   3P%
--------------------------------------------------------------------------------
RJ Curry               10    6    6    1   0   2/2   100.0     0/0   0.0
Carmelo Murray         14    4    0    0   0   2/2   100.0     0/0   0.0
Josh Banchero          10    4    4    1   0   2/2   100.0     0/0   0.0
Cole O'Neal            10    4    0    3   0   2/6    33.3     0/0   0.0
Klay Leonard           10    2    1    0   0   1/4    25.0     0/0   0.0
Dirk Johnson           14    0    3    1   0   0/1     0.0     0/0   0.0
Tracy Middleton        10    0    0    0   0   0/4     0.0     0/0   0.0

TEAM: FG: 9/21 (42.9%), 3PT: 1/7 (14.3%), REB: 14 (7 off, 7 def), AST: 6, TO: 0
TEAM FOULS: 4


Team_093
--------------------------------------------------------------------------------
Player                MIN  PTS  REB  AST  TO      FG   FG%      3P   3P%
--------------------------------------------------------------------------------
Kobe Murray            10    8    3    1   0   4/4   100.0     0/0   0.0
Cade O'Neal            10    7    5    0   0   3/5    60.0     0/0   0.0
Shaquille George       10    5    0    2   0   2/3    66.7     0/0   0.0
Lauri Parker           10    2    4    0   0   1/3    33.3     0/0   0.0
Carmelo Wagner         14    0    1    0   0   0/1     0.0     0/0   0.0
Vince Barnes           14    0    1    0   0   0/1     0.0     0/0   0.0
Immanuel Cunningham    10    0    0    0   0   0/1     0.0     0/0   0.0

TEAM: FG: 10/18 (55.6%), 3PT: 1/5 (20.0%), REB: 14 (2 off, 12 def), AST: 3, TO: 2
TEAM FOULS: 4

================================================================================

================================================================================
                       3RD QUARTER - Team_040 vs Team_093                       
================================================================================

[12:00] Team_040 possession (Score: 56-53)
Ayo Rose drives and kicks out. Dirk Johnson attempts a Midrange. Contested by Vince Barnes (4.1 feet, MAN). DIRK JOHNSON MAKES IT!
Score: 58-53

[11:48] Team_093 possession (Score: 58-53)
Carmelo Wagner attempts a 3Pt. Contested by Ayo Rose (4.3 feet, ZONE). Carmelo Wagner misses. Rebound secured by Dirk Johnson.

[11:34] Team_040 possession (Score: 58-53)
Bam Gobert attempts a Layup. Contested by Ben Cunningham (5.2 feet, ZONE). Bam Gobert misses. Rebound secured by Carmelo Wagner.

[11:15] Team_093 possession (Score: 58-53)
Damian Williamson attempts a 3Pt. Contested by Ayo Rose (4.5 feet, MAN). Damian Williamson misses. FOUL! Loose ball foul on Shaquille Bane during the rebound battle. [Team fouls: 1] No free throws, side out. (Shaquille Bane: 1 personal fouls)

[11:01] Team_093 possession (Score: 58-53)
Trae Westbrook attempts a 3Pt. Contested by Shaquille Bane (4.4 feet, MAN). Trae Westbrook misses. Rebound secured by Shaquille Bane.

[10:47] Team_040 possession (Score: 58-53)
Dirk Johnson drives to the basket... Dirk Johnson loses the ball! Stripped by Ben Cunningham! TURNOVER! (live ball)

[10:30] Team_093 possession (Score: 58-53)
Ben Cunningham attempts a Midrange. Contested by Carmelo Murray (5.0 feet, ZONE). Ben Cunningham misses. Rebound secured by Shaquille Bane.

[10:16] Team_040 possession (Score: 58-53)
Dirk Johnson attempts a 3Pt. Contested by Carmelo Wagner (3.6 feet, ZONE). Dirk Johnson misses. Rebound secured by Vince Barnes.

[10:01] Team_093 possession (Score: 58-53)
Carmelo Wagner attempts a 3Pt. Contested by Ayo Rose (4.3 feet, ZONE). Carmelo Wagner misses. Offensive rebound by Carmelo Wagner! Carmelo Wagner kicks it out.

[09:46] Team_093 possession (Score: 58-53)
Damian Williamson attempts a 3Pt. Contested by Ayo Rose (4.5 feet, ZONE). Damian Williamson misses. Rebound secured by Bam Gobert.

[09:32] Team_040 possession (Score: 58-53)
Shaquille Bane attempts a Layup. Contested by Ben Cunningham (5.4 feet, ZONE). Shaquille Bane misses. Rebound secured by Vince Barnes.

[09:20] Team_093 possession (Score: 58-53)
Trae Westbrook attempts a Midrange. Contested by Dirk Johnson (5.6 feet, ZONE). Trae Westbrook misses. Offensive rebound by Carmelo Wagner! Carmelo Wagner kicks it out.

[09:06] Team_093 possession (Score: 58-53)
Ben Cunningham drives, Bam Gobert stays with him. Ben Cunningham attempts a Layup. Contested by Bam Gobert (4.4 feet, MAN). BEN CUNNINGHAM MAKES IT! Assist: Trae Westbrook
Score: 58-55

[08:54] Team_040 possession (Score: 58-55)
Bam Gobert attempts a Midrange. Contested by Ben Cunningham (5.2 feet, MAN). Bam Gobert misses. Offensive rebound by Dirk Johnson! Dirk Johnson kicks it out.

[08:42] Team_040 possession (Score: 58-55)
Dirk Johnson drives to the basket... Dirk Johnson throws a bad pass! Stolen by Ben Cunningham! TURNOVER! (live ball)

[08:28] Team_093 possession (Score: 58-55)
Ben Cunningham attempts a Midrange. Contested by Bam Gobert (4.4 feet, MAN). BEN CUNNINGHAM MAKES IT! Assist: Vince Barnes
Score: 58-57

[08:14] Team_040 possession (Score: 58-57)
Carmelo Murray commits a violation (traveling/carry)! TURNOVER! (dead ball)

[07:59] Team_093 possession (Score: 58-57)
FOUL! Reach-in foul on Carmelo Murray during the drive. [Team fouls: 2] No free throws, side out. (Carmelo Murray: 1 personal fouls)

[07:47] Team_093 possession (Score: 58-57)
Ben Cunningham attempts a Midrange. Wide open! Dirk Johnson is 6.3 feet away. [ZONE] BEN CUNNINGHAM MAKES IT!
Score: 58-59

[07:29] Team_040 possession (Score: 58-59)
Carmelo Murray drives and kicks out. Shaquille Bane attempts a 3Pt. Contested by Carmelo Wagner (3.3 feet, ZONE). Shaquille Bane misses. Offensive rebound by Bam Gobert! Bam Gobert kicks it out.

[07:11] Team_040 possession (Score: 58-59)
FOUL! Reach-in foul on Ben Cunningham during the drive. [Team fouls: 1] No free throws, side out. (Ben Cunningham: 1 personal fouls)

[06:54] Team_040 possession (Score: 58-59)
Shaquille Bane attempts a 3Pt. Contested by Trae Westbrook (5.9 feet, MAN). Shaquille Bane misses. Rebound secured by Carmelo Wagner.

[06:41] Team_093 possession (Score: 58-59)
Ben Cunningham drives, Bam Gobert stays with him. Ben Cunningham attempts a Layup. Contested by Bam Gobert (4.4 feet, MAN). BEN CUNNINGHAM MAKES IT! Assist: Carmelo Wagner
Score: 58-61

[06:25] Team_040 possession (Score: 58-61)
Ayo Rose attempts a Midrange. Contested by Damian Williamson (5.5 feet, MAN). Ayo Rose misses. Rebound secured by Vince Barnes.

[06:07] Team_093 possession (Score: 58-61)
Trae Westbrook attempts a Layup. Contested by Shaquille Bane (4.4 feet, MAN). Trae Westbrook misses. Offensive rebound by Carmelo Wagner! Carmelo Wagner kicks it out.

[05:51] Team_093 possession (Score: 58-61)
Carmelo Wagner throws a bad pass out of bounds! TURNOVER! (dead ball)

[05:35] Team_040 possession (Score: 58-61)
Ayo Rose attempts a 3Pt. Contested by Damian Williamson (5.5 feet, MAN). Ayo Rose misses. Rebound secured by Carmelo Wagner.

[05:19] Team_093 possession (Score: 58-61)
Vince Barnes attempts a 3Pt. Contested by Ayo Rose (4.8 feet, ZONE). VINCE BARNES MAKES IT! Assist: Damian Williamson
Score: 58-64

[05:02] Team_040 possession (Score: 58-64)
Ayo Rose attempts a Midrange. Contested by Damian Williamson (5.5 feet, MAN). Ayo Rose misses. Rebound secured by Carmelo Wagner.

[04:49] Team_093 possession (Score: 58-64)
Damian Williamson drives, picks up Bam Gobert. Help arrives from Shaquille Bane! Damian Williamson attempts a Dunk. Contested by Shaquille Bane (3.9 feet, ZONE). DAMIAN WILLIAMSON MAKES IT! Assist: Carmelo Wagner
Score: 58-66

[04:35] Team_040 possession (Score: 58-66)
Ayo Rose attempts a Layup. Contested by Damian Williamson (5.5 feet, MAN). AYO ROSE MAKES IT! Assist: Dirk Johnson
Score: 60-66

[04:20] Team_093 possession (Score: 60-66)
Damian Williamson throws a bad pass! Stolen by Ayo Rose! TURNOVER! (live ball)

[04:07] Team_040 possession (Score: 60-66)
Ayo Rose attempts a 3Pt. Contested by Damian Williamson (5.6 feet, MAN). Ayo Rose misses. Rebound secured by Carmelo Wagner.

[03:50] Team_093 possession (Score: 60-66)
Vince Barnes drives and kicks out. Vince Barnes attempts a 3Pt. Contested by Ayo Rose (4.7 feet, ZONE). VINCE BARNES MAKES IT! Assist: Carmelo Wagner
Score: 60-69

[03:33] Team_040 possession (Score: 60-69)
Dirk Johnson attempts a Midrange. Contested by Vince Barnes (4.4 feet, MAN). Dirk Johnson misses. Offensive rebound by Bam Gobert! Bam Gobert kicks it out.

[03:16] Team_040 possession (Score: 60-69)
FOUL! Holding foul on Carmelo Wagner. [Team fouls: 2] No free throws, side out. (Carmelo Wagner: 1 personal fouls)

[03:05] Team_040 possession (Score: 60-69)
Bam Gobert attempts a 3Pt. Contested by Carmelo Wagner (3.9 feet, ZONE). BAM GOBERT MAKES IT! Assist: Shaquille Bane
Score: 63-69

[02:51] Team_093 possession (Score: 63-69)
Damian Williamson drives and kicks out. Damian Williamson attempts a Midrange. Contested by Ayo Rose (4.8 feet, MAN). DAMIAN WILLIAMSON MAKES IT! Assist: Vince Barnes
Score: 63-71

[02:40] Team_040 possession (Score: 63-71)
Bam Gobert attempts a Midrange. Contested by Trae Westbrook (5.8 feet, ZONE). BAM GOBERT MAKES IT!
Score: 65-71

[02:23] Team_093 possession (Score: 65-71)
Ben Cunningham makes the Layup and draws the foul on Bam Gobert! And-1! Ben Cunningham to the line for 1. [Team fouls: 3] (Bam Gobert: 1 personal fouls)   FT 1/1: GOOD Ben Cunningham makes 1/1 from the line.
Score: 65-74

[02:07] Team_040 possession (Score: 65-74)
FOUL! Shooting foul on Vince Barnes. Carmelo Murray to the line for 2 free throws. [Team fouls: 3] (Vince Barnes: 1 personal fouls)   FT 1/2: MISS   FT 2/2: MISS Carmelo Murray makes 0/2 from the line. Rebound secured by Ben Cunningham.

[01:49] Team_093 possession (Score: 65-74)
Ben Cunningham attempts a Layup. Contested by Bam Gobert (4.6 feet, MAN). BEN CUNNINGHAM MAKES IT! Assist: Damian Williamson
Score: 65-76

[01:33] Team_040 possession (Score: 65-76)
Carmelo Murray drives and kicks out. Carmelo Murray attempts a Midrange. Contested by Vince Barnes (4.4 feet, ZONE). Carmelo Murray misses. Rebound secured by Ben Cunningham.

[01:20] Team_093 possession (Score: 65-76)
Ben Cunningham attempts a Layup. Contested by Bam Gobert (4.7 feet, ZONE). BEN CUNNINGHAM MAKES IT!
Score: 65-78

[01:05] Team_040 possession (Score: 65-78)
Carmelo Murray drives and kicks out. Ayo Rose attempts a Midrange. Contested by Damian Williamson (5.3 feet, MAN). Ayo Rose misses. Rebound secured by Vince Barnes.

[00:54] Team_093 possession (Score: 65-78)
Trae Westbrook attempts a 3Pt. Contested by Ayo Rose (4.8 feet, ZONE). Trae Westbrook misses. Rebound secured by Bam Gobert.

[00:43] Team_040 possession (Score: 65-78)
Dirk Johnson drives, Ben Cunningham stays with him. Dirk Johnson attempts a Dunk. Contested by Ben Cunningham (5.6 feet, ZONE). DIRK JOHNSON MAKES IT! Assist: Carmelo Murray
Score: 67-78

[00:28] Team_093 possession (Score: 67-78)
Trae Westbrook drives and kicks out. Ben Cunningham attempts a 3Pt. Contested by Bam Gobert (4.4 feet, MAN). Ben Cunningham misses. Rebound secured by Bam Gobert.

[00:15] Team_040 possession (Score: 67-78)
Bam Gobert attempts a Layup. Contested by Ben Cunningham (5.7 feet, ZONE). BAM GOBERT MAKES IT! Assist: Carmelo Murray
Score: 69-78

================================================================================
                              3RD QUARTER COMPLETE                              
================================================================================

3RD QUARTER SCORE: Team_040 13, Team_093 25

BOX SCORE:
================================================================================

Team_040
--------------------------------------------------------------------------------
Player                MIN  PTS  REB  AST  TO      FG   FG%      3P   3P%
--------------------------------------------------------------------------------
Bam Gobert             26    7    5    0   0   3/4    75.0     0/0   0.0
Dirk Johnson           26    4    2    1   0   2/3    66.7     0/0   0.0
Ayo Rose               26    2    0    0   0   1/5    20.0     0/0   0.0
Shaquille Bane         26    0    2    1   0   0/2     0.0     0/0   0.0
Carmelo Murray         26    0    0    2   0   0/3     0.0     0/0   0.0

TEAM: FG: 6/17 (35.3%), 3PT: 1/5 (20.0%), REB: 9 (3 off, 6 def), AST: 4, TO: 3
TEAM FOULS: 3


Team_093
--------------------------------------------------------------------------------
Player                MIN  PTS  REB  AST  TO      FG   FG%      3P   3P%
--------------------------------------------------------------------------------
Ben Cunningham         26   15    2    0   0   7/8    87.5     0/0   0.0
Vince Barnes           26    6    4    2   0   2/2   100.0     0/0   0.0
Damian Williamson      26    4    0    2   0   2/3    66.7     0/0   0.0
Carmelo Wagner         26    0    9    3   0   0/1     0.0     0/0   0.0
Trae Westbrook         26    0    0    1   0   0/3     0.0     0/0   0.0

TEAM: FG: 11/17 (64.7%), 3PT: 1/5 (20.0%), REB: 15 (4 off, 11 def), AST: 8, TO: 2
TEAM FOULS: 3

================================================================================

================================================================================
                       4TH QUARTER - Team_040 vs Team_093                       
================================================================================

[12:00] Team_040 possession (Score: 69-78)
Carmelo Murray attempts a Midrange. Contested by Carmelo Wagner (4.0 feet, MAN). CARMELO MURRAY MAKES IT! Assist: Ayo Rose
Score: 71-78

[11:49] Team_093 possession (Score: 71-78)
Trae Westbrook attempts a 3Pt. Contested by Ayo Rose (4.7 feet, ZONE). TRAE WESTBROOK MAKES IT! Assist: Damian Williamson
Score: 71-81

[11:37] Team_040 possession (Score: 71-81)
Shaquille Bane drives and kicks out. Ayo Rose attempts a Midrange. Contested by Damian Williamson (5.3 feet, MAN). Ayo Rose misses. Rebound secured by Carmelo Wagner.

[11:23] Team_093 possession (Score: 71-81)
Trae Westbrook attempts a Layup. Contested by Bam Gobert (4.0 feet, ZONE). TRAE WESTBROOK MAKES IT! Assist: Carmelo Wagner
Score: 71-83

[11:10] Team_040 possession (Score: 71-83)
Bam Gobert attempts a 3Pt. Contested by Carmelo Wagner (4.1 feet, ZONE). Bam Gobert misses. Rebound secured by Ben Cunningham.

[10:52] Team_093 possession (Score: 71-83)
Ben Cunningham attempts a 3Pt. Contested by Ayo Rose (5.5 feet, ZONE). Ben Cunningham misses. Rebound secured by Bam Gobert.

[10:36] Team_040 possession (Score: 71-83)
Bam Gobert attempts a Midrange. Contested by Vince Barnes (4.7 feet, ZONE). Bam Gobert misses. Rebound secured by Ben Cunningham.

[10:17] Team_093 possession (Score: 71-83)
Ben Cunningham attempts a Layup. Contested by Bam Gobert (4.8 feet, ZONE). BEN CUNNINGHAM MAKES IT! Assist: Trae Westbrook
Score: 71-85

[10:07] Team_040 possession (Score: 71-85)
Ayo Rose commits a violation (traveling/carry)! TURNOVER! (dead ball)

[10:07] Substitution (Team_040): Ayo Rose OUT → Cole O'Neal IN (stamina_rule2)

[10:07] Substitution (Team_040): Shaquille Bane OUT → Tracy Middleton IN (stamina_rule2)

[10:07] Substitution (Team_040): Carmelo Murray OUT → Klay Leonard IN (stamina_rule2)

[10:07] Substitution (Team_040): Dirk Johnson OUT → RJ Curry IN (stamina_rule2)

[10:07] Substitution (Team_040): Bam Gobert OUT → Josh Banchero IN (stamina_rule2)

[10:07] Substitution (Team_093): Damian Williamson OUT → Shaquille George IN (stamina_rule2)

[10:07] Substitution (Team_093): Trae Westbrook OUT → Immanuel Cunningham IN (stamina_rule2)

[10:07] Substitution (Team_093): Carmelo Wagner OUT → Lauri Parker IN (stamina_rule2)

[10:07] Substitution (Team_093): Vince Barnes OUT → Kobe Murray IN (stamina_rule2)

[10:07] Substitution (Team_093): Ben Cunningham OUT → Cade O'Neal IN (stamina_rule2)

[09:55] Team_093 possession (Score: 71-85)
Immanuel Cunningham attempts a 3Pt. Contested by RJ Curry (5.1 feet, ZONE). Immanuel Cunningham misses. Rebound secured by Klay Leonard.

[09:40] Team_040 possession (Score: 71-85)
Klay Leonard loses the ball! Stripped by Lauri Parker! TURNOVER! (live ball)

[09:26] Team_093 possession (Score: 71-85)
Immanuel Cunningham drives, picks up Tracy Middleton. Help arrives from Klay Leonard! Immanuel Cunningham attempts a Dunk. Wide open! Klay Leonard is 6.1 feet away. [MAN] Immanuel Cunningham misses. Offensive rebound by Kobe Murray! Kobe Murray's putback is no good. Rebound secured by Josh Banchero.

[09:10] Team_040 possession (Score: 71-85)
Josh Banchero drives, Kobe Murray stays with him. Josh Banchero attempts a Dunk. Contested by Kobe Murray (4.5 feet, MAN). JOSH BANCHERO MAKES IT! Assist: RJ Curry
Score: 73-85

[09:01] Team_093 possession (Score: 73-85)
Immanuel Cunningham loses control! Ball rolls out of bounds! TURNOVER! (dead ball)

[08:46] Team_040 possession (Score: 73-85)
Klay Leonard makes the Layup and draws the foul on Lauri Parker! And-1! Klay Leonard to the line for 1. [Team fouls: 1] (Lauri Parker: 1 personal fouls)   FT 1/1: GOOD Klay Leonard makes 1/1 from the line.
Score: 76-85

[08:30] Team_093 possession (Score: 76-85)
FOUL! Holding foul on RJ Curry. [Team fouls: 1] No free throws, side out. (RJ Curry: 1 personal fouls)

[08:13] Team_093 possession (Score: 76-85)
Kobe Murray drives, picks up RJ Curry. Help arrives from Tracy Middleton! Kobe Murray attempts a Dunk. Contested by Tracy Middleton (4.9 feet, MAN). Kobe Murray misses. Rebound secured by Klay Leonard.

[08:01] Team_040 possession (Score: 76-85)
Klay Leonard attempts a Layup. Contested by Lauri Parker (4.4 feet, MAN). KLAY LEONARD MAKES IT! Assist: Tracy Middleton
Score: 78-85

[07:44] Team_093 possession (Score: 78-85)
Cade O'Neal drives and kicks out. Kobe Murray attempts a 3Pt. Contested by RJ Curry (4.9 feet, ZONE). KOBE MURRAY MAKES IT! Assist: Lauri Parker
Score: 78-88

[07:29] Team_040 possession (Score: 78-88)
Cole O'Neal attempts a 3Pt. Contested by Shaquille George (4.3 feet, MAN). Cole O'Neal misses. Rebound secured by Cade O'Neal.

[07:15] Team_093 possession (Score: 78-88)
Cade O'Neal drives, picks up Josh Banchero. Help arrives from Tracy Middleton! Cade O'Neal attempts a Layup. Contested by Tracy Middleton (5.9 feet, ZONE). Cade O'Neal misses. Rebound secured by RJ Curry.

[07:03] Team_040 possession (Score: 78-88)
RJ Curry drives to the basket... FOUL! Offensive foul on RJ Curry! Kobe Murray drew the charge! [Team fouls: 2] (RJ Curry: 2 personal fouls) TURNOVER! (dead ball)

[06:44] Team_093 possession (Score: 78-88)
Cade O'Neal attempts a Layup. Contested by Josh Banchero (5.9 feet, ZONE). CADE O'NEAL MAKES IT! Assist: Lauri Parker
Score: 78-90

[06:28] Team_040 possession (Score: 78-90)
Josh Banchero throws a bad pass out of bounds! TURNOVER! (dead ball)

[06:15] Team_093 possession (Score: 78-90)
Lauri Parker drives, Klay Leonard stays with him. Lauri Parker attempts a Layup. Contested by Klay Leonard (5.0 feet, MAN). LAURI PARKER MAKES IT!
Score: 78-92

[06:01] Team_040 possession (Score: 78-92)
Tracy Middleton drives and kicks out. Josh Banchero attempts a Midrange. Contested by Lauri Parker (4.6 feet, ZONE). JOSH BANCHERO MAKES IT!
Score: 80-92

[05:44] Team_093 possession (Score: 80-92)
FOUL! Holding foul on Josh Banchero. [Team fouls: 3] No free throws, side out. (Josh Banchero: 1 personal fouls)

[05:27] Team_093 possession (Score: 80-92)
FOUL! Holding foul on Klay Leonard. [Team fouls: 4] No free throws, side out. (Klay Leonard: 1 personal fouls)

[05:15] Team_093 possession (Score: 80-92)
FOUL! Holding foul on Tracy Middleton. [IN THE BONUS! 5 team fouls] Immanuel Cunningham to the line for 2 free throws. (Tracy Middleton: 1 personal fouls)   FT 1/2: GOOD   FT 2/2: GOOD Immanuel Cunningham makes 2/2 from the line.
Score: 80-94

[05:03] Team_040 possession (Score: 80-94)
RJ Curry drives and kicks out. Cole O'Neal attempts a 3Pt. Contested by Kobe Murray (4.1 feet, ZONE). Cole O'Neal misses. Rebound secured by Cade O'Neal.

[04:48] Team_093 possession (Score: 80-94)
Kobe Murray throws a bad pass! Stolen by RJ Curry! TURNOVER! (live ball)

[04:32] Team_040 possession (Score: 80-94)
FOUL! Holding foul on Kobe Murray. [Team fouls: 2] No free throws, side out. (Kobe Murray: 1 personal fouls)

[04:21] Team_040 possession (Score: 80-94)
Tracy Middleton drives, picks up Kobe Murray. Help arrives from Shaquille George! Tracy Middleton attempts a Dunk. Contested by Shaquille George (4.3 feet, ZONE). TRACY MIDDLETON MAKES IT! Assist: Klay Leonard
Score: 82-94

[04:09] Team_093 possession (Score: 82-94)
Kobe Murray drives, picks up RJ Curry. Help arrives from Tracy Middleton! Kobe Murray attempts a Layup. Contested by Tracy Middleton (4.9 feet, ZONE). KOBE MURRAY MAKES IT! Assist: Immanuel Cunningham
Score: 82-96

[03:53] Team_040 possession (Score: 82-96)
RJ Curry drives and kicks out. RJ Curry attempts a 3Pt. Contested by Kobe Murray (4.1 feet, MAN). RJ Curry misses. Rebound secured by Cade O'Neal.

[03:35] Team_093 possession (Score: 82-96)
Kobe Murray attempts a 3Pt. Contested by RJ Curry (4.9 feet, MAN). Kobe Murray misses. Rebound secured by RJ Curry.

[03:16] Team_040 possession (Score: 82-96)
Klay Leonard attempts a Midrange. Contested by Lauri Parker (4.5 feet, MAN). KLAY LEONARD MAKES IT!
Score: 84-96

[03:03] Team_093 possession (Score: 84-96)
FOUL! Offensive foul on Kobe Murray! RJ Curry drew the charge! [Team fouls: 3] (Kobe Murray: 2 personal fouls) TURNOVER! (dead ball)

[02:50] Team_040 possession (Score: 84-96)
Klay Leonard loses the ball! Stripped by Lauri Parker! TURNOVER! (live ball)

[02:35] Team_093 possession (Score: 84-96)
Cade O'Neal attempts a Midrange. Contested by Josh Banchero (6.0 feet, MAN). Cade O'Neal misses. FOUL! Loose ball foul on Josh Banchero during the rebound battle. [IN THE BONUS! 6 team fouls] Kobe Murray to the line for 2 free throws. (Josh Banchero: 2 personal fouls)   FT 1/2: GOOD   FT 2/2: GOOD Kobe Murray makes 2/2 from the line.
Score: 84-98

[02:19] Team_040 possession (Score: 84-98)
Tracy Middleton attempts a 3Pt. Contested by Immanuel Cunningham (5.9 feet, MAN). TRACY MIDDLETON MAKES IT! Assist: Cole O'Neal
Score: 87-98

[02:03] Team_093 possession (Score: 87-98)
Lauri Parker loses the ball! Stripped by Klay Leonard! TURNOVER! (live ball)

[01:45] Team_040 possession (Score: 87-98)
Josh Banchero attempts a Layup. Contested by Kobe Murray (4.7 feet, ZONE). JOSH BANCHERO MAKES IT! Assist: Cole O'Neal
Score: 89-98

[01:31] Team_093 possession (Score: 89-98)
Shaquille George attempts a 3Pt. Wide open! Cole O'Neal is 6.8 feet away. [MAN] SHAQUILLE GEORGE MAKES IT! Assist: Cade O'Neal
Score: 89-101

[01:18] Team_040 possession (Score: 89-101)
Tracy Middleton drives and kicks out. Klay Leonard attempts a 3Pt. Contested by Shaquille George (4.5 feet, ZONE). Klay Leonard misses. Rebound secured by Cade O'Neal.

[01:03] Team_093 possession (Score: 89-101)
Cade O'Neal drives, Josh Banchero stays with him. Cade O'Neal attempts a Layup. Wide open! Josh Banchero is 6.1 feet away. [ZONE] CADE O'NEAL MAKES IT!
Score: 89-103

[00:49] Team_040 possession (Score: 89-103)
Cole O'Neal drives and kicks out. Tracy Middleton attempts a Midrange. Contested by Immanuel Cunningham (5.8 feet, MAN). TRACY MIDDLETON MAKES IT!
Score: 91-103

[00:35] Team_093 possession (Score: 91-103)
Lauri Parker attempts a 3Pt. Contested by RJ Curry (5.1 feet, ZONE). Lauri Parker misses. Offensive rebound by Cade O'Neal! Cade O'Neal kicks it out.

[00:18] Team_093 possession (Score: 91-103)
Immanuel Cunningham loses control! Ball rolls out of bounds! TURNOVER! (dead ball)

[00:03] Team_040 possession (Score: 91-103)
Tracy Middleton attempts a Layup. Wide open! Immanuel Cunningham is 6.1 feet away. [MAN] Tracy Middleton misses. Rebound secured by Cade O'Neal.

================================================================================
                              4TH QUARTER COMPLETE                              
================================================================================

4TH QUARTER SCORE: Team_040 22, Team_093 25

BOX SCORE:
================================================================================

Team_040
--------------------------------------------------------------------------------
Player                MIN  PTS  REB  AST  TO      FG   FG%      3P   3P%
--------------------------------------------------------------------------------
Klay Leonard           20    7    2    1   0   3/3   100.0     0/0   0.0
Tracy Middleton        20    7    0    1   0   3/5    60.0     0/0   0.0
Josh Banchero          20    6    1    0   0   3/3   100.0     0/0   0.0
Carmelo Murray         28    2    0    0   0   1/1   100.0     0/0   0.0
Ayo Rose               28    0    0    1   0   0/0     0.0     0/0   0.0
Shaquille Bane         28    0    0    0   0   0/1     0.0     0/0   0.0
Bam Gobert             28    0    1    0   0   0/2     0.0     0/0   0.0
RJ Curry               20    0    2    1   0   0/2     0.0     0/0   0.0
Cole O'Neal            20    0    0    2   0   0/1     0.0     0/0   0.0

TEAM: FG: 10/18 (55.6%), 3PT: 1/3 (33.3%), REB: 5 (0 off, 5 def), AST: 6, TO: 5
TEAM FOULS: 6 [Team_093 in BONUS]


Team_093
--------------------------------------------------------------------------------
Player                MIN  PTS  REB  AST  TO      FG   FG%      3P   3P%
--------------------------------------------------------------------------------
Kobe Murray            20    7    0    0   0   3/5    60.0     0/0   0.0
Trae Westbrook         28    5    0    1   0   2/2   100.0     0/0   0.0
Cade O'Neal            20    4    6    1   0   2/3    66.7     0/0   0.0
Shaquille George       20    3    0    0   0   1/1   100.0     0/0   0.0
Ben Cunningham         28    2    2    0   0   1/2    50.0     0/0   0.0
Immanuel Cunningham    20    2    0    1   0   1/3    33.3     0/0   0.0
Lauri Parker           20    2    0    2   0   1/1   100.0     0/0   0.0
Damian Williamson      28    0    0    1   0   0/0     0.0     0/0   0.0
Carmelo Wagner         28    0    1    1   0   0/0     0.0     0/0   0.0

TEAM: FG: 11/17 (64.7%), 3PT: 2/5 (40.0%), REB: 10 (2 off, 8 def), AST: 7, TO: 5
TEAM FOULS: 3

================================================================================

================================================================================
                               FULL GAME COMPLETE                               
================================================================================

FINAL SCORE: Team_040 91, Team_093 103

SCORING BY QUARTER:
--------------------------------------------------------------------------------
Team                     Q1     Q2     Q3     Q4    FINAL
--------------------------------------------------------------------------------
Team_040                 36     20     13     22       91
Team_093                 31     22     25     25      103
--------------------------------------------------------------------------------

FULL GAME BOX SCORE:
================================================================================

Team_040
--------------------------------------------------------------------------------
Player                MIN  PTS  REB  AST  TO      FG   FG%      3P   3P%      FT STL BLK
--------------------------------------------------------------------------------
Ayo Rose               28   13    0    1   1   5/12   41.7   1/3    33.3   1/1     1   0
Shaquille Bane         28    5    4    3   1   2/6    33.3   1/2    50.0   0/0     0   0
Carmelo Murray         28    8    0    5   2   5/8    62.5   0/0     0.0   0/2     0   2
Dirk Johnson           28    6   10    4   2   2/6    33.3   0/3     0.0   0/0     0   0
Bam Gobert             28   23    7    2   1  10/13   76.9   2/3    66.7   5/5     3   0
Cole O'Neal            20    4    0    5   0   3/8    37.5   0/4     0.0   2/3     0   0
Tracy Middleton        20    7    0    1   0   3/9    33.3   1/2    50.0   0/0     0   0
Klay Leonard           20    9    3    1   2   4/7    57.1   0/1     0.0   1/1     1   0
RJ Curry               20    6    8    2   1   2/4    50.0   1/1   100.0   1/1     1   0
Josh Banchero          20   10    5    1   1   4/4   100.0   0/0     0.0   0/0     1   0

TEAM: FG: 40/77 (51.9%), 3PT: 6/19 (31.6%), REB: 36 (11 off, 25 def), AST: 25, TO: 11


Team_093
--------------------------------------------------------------------------------
Player                MIN  PTS  REB  AST  TO      FG   FG%      3P   3P%      FT STL BLK
--------------------------------------------------------------------------------
Damian Williamson      28    4    0    4   1   2/4    50.0   0/2     0.0   0/0     0   0
Trae Westbrook         28   15    0    2   2   5/9    55.6   2/5    40.0   3/4     0   1
Carmelo Wagner         28    7   14    5   1   3/6    50.0   0/3     0.0   2/3     0   0
Vince Barnes           28   11    8    4   0   4/7    57.1   2/4    50.0   0/0     1   0
Ben Cunningham         28   24    7    1   3  12/15   80.0   0/2     0.0   2/2     4   0
Shaquille George       20    8    0    2   0   2/3    66.7   1/1   100.0   0/0     0   0
Immanuel Cunningham    20    2    0    1   2   0/3     0.0   0/1     0.0   2/2     0   1
Lauri Parker           20    4    4    2   2   2/4    50.0   0/1     0.0   0/0     2   0
Kobe Murray            20   15    3    1   2   6/8    75.0   0/1     0.0   2/2     0   0
Cade O'Neal            20   11   11    1   0   7/10   70.0   1/2    50.0   3/3     0   0

TEAM: FG: 44/71 (62.0%), 3PT: 6/22 (27.3%), REB: 48 (11 off, 37 def), AST: 23, TO: 13

================================================================================
