================================================================================
                        FULL GAME - Team_050 vs Team_099                        
================================================================================

================================================================================
                       1ST QUARTER - Team_050 vs Team_099                       
================================================================================

[12:00] Team_050 possession (Score: 0-0)
Giannis LaVine attempts a Midrange. Contested by Damian Ginobili (4.0 feet, ZONE). GIANNIS LAVINE MAKES IT! Assist: Donovan Trent
Score: 2-0

[11:43] Team_099 possession (Score: 2-0)
Larry Wade attempts a Midrange. Contested by Donovan Trent (5.1 feet, MAN). LARRY WADE MAKES IT! Assist: Ayo Barrett
Score: 2-2

[11:28] Team_050 possession (Score: 2-2)
Collin Bane attempts a Layup. Contested by Vince Lillard (2.7 feet, ZONE). Collin Bane misses. Rebound secured by Vince Lillard.

[11:13] Team_099 possession (Score: 2-2)
Ayo Barrett drives and kicks out. FOUL! Shooting foul on Giannis LaVine. Ayo Barrett to the line for 2 free throws. [Team fouls: 1] (Giannis LaVine: 1 personal fouls)   FT 1/2: GOOD   FT 2/2: GOOD Ayo Barrett makes 2/2 from the line.
Score: 2-4

[10:56] Team_050 possession (Score: 2-4)
Joel Banchero attempts a 3Pt. Contested by Ayo Barrett (3.6 feet, ZONE). JOEL BANCHERO MAKES IT! Assist: Collin Bane
Score: 5-4

[10:46] Team_099 possession (Score: 5-4)
Damian Ginobili makes the Layup and draws the foul on Collin Bane! And-1! Damian Ginobili to the line for 1. [Team fouls: 2] (Collin Bane: 1 personal fouls)   FT 1/1: GOOD Damian Ginobili makes 1/1 from the line.
Score: 5-7

[10:30] Team_050 possession (Score: 5-7)
Collin Bane attempts a 3Pt. Contested by Damian Ginobili (3.7 feet, MAN). Collin Bane misses. Offensive rebound by Collin Bane! Collin Bane kicks it out.

[10:17] Team_050 possession (Score: 5-7)
LeBron Bridges drives to the basket... FOUL! Offensive foul on LeBron Bridges! Vince Lillard drew the charge! [Team fouls: 3] (LeBron Bridges: 1 personal fouls) TURNOVER! (dead ball)

[10:03] Team_099 possession (Score: 5-7)
Damian Ginobili attempts a 3Pt. Contested by Giannis LaVine (4.1 feet, ZONE). Damian Ginobili misses. Rebound secured by Collin Bane.

[09:50] Team_050 possession (Score: 5-7)
Giannis LaVine attempts a Midrange. Contested by Ayo Barrett (4.2 feet, MAN). GIANNIS LAVINE MAKES IT!
Score: 7-7

[09:31] Team_099 possession (Score: 7-7)
Ayo Barrett throws a bad pass! Stolen by Giannis LaVine! TURNOVER! (live ball)

[09:20] Team_050 possession (Score: 7-7)
Giannis LaVine attempts a 3Pt. Contested by Ayo Barrett (4.2 feet, ZONE). Giannis LaVine misses. Rebound secured by Vince Lillard.

[09:10] Team_099 possession (Score: 7-7)
Larry James attempts a 3Pt. Contested by Giannis LaVine (4.0 feet, ZONE). Larry James misses. Rebound secured by Collin Bane.

[08:50] Team_050 possession (Score: 7-7)
Collin Bane attempts a Midrange. Contested by Vince Lillard (2.7 feet, ZONE). Collin Bane misses. Rebound secured by Larry Wade.

[08:32] Team_099 possession (Score: 7-7)
Larry Wade drives, picks up Donovan Trent. Help arrives from Joel Banchero! Larry Wade attempts a Layup. Contested by Joel Banchero (5.1 feet, MAN). LARRY WADE MAKES IT! Assist: Damian Ginobili
Score: 7-9

[08:19] Team_050 possession (Score: 7-9)
LeBron Bridges drives, picks up Vince Lillard. Help arrives from Ayo Barrett! LeBron Bridges attempts a Layup. Contested by Ayo Barrett (2.7 feet, MAN). LEBRON BRIDGES MAKES IT!
Score: 9-9

[08:07] Team_099 possession (Score: 9-9)
Vince Lillard attempts a Midrange. Contested by Joel Banchero (4.4 feet, ZONE). VINCE LILLARD MAKES IT!
Score: 9-11

[07:53] Team_050 possession (Score: 9-11)
Joel Banchero drives and kicks out. Giannis LaVine attempts a Midrange. Contested by Vince Lillard (2.5 feet, ZONE). Giannis LaVine misses. Rebound secured by Larry Wade.

[07:39] Team_099 possession (Score: 9-11)
Larry Wade attempts a 3Pt. Contested by Giannis LaVine (4.2 feet, ZONE). Larry Wade misses. Rebound secured by LeBron Bridges.

[07:27] Team_050 possession (Score: 9-11)
FOUL! Shooting foul on Ayo Barrett. Collin Bane to the line for 2 free throws. [Team fouls: 1] (Ayo Barrett: 1 personal fouls)   FT 1/2: MISS   FT 2/2: MISS Collin Bane makes 0/2 from the line. Rebound secured by Damian Ginobili.

[07:11] Team_099 possession (Score: 9-11)
Ayo Barrett drives to the basket... Ayo Barrett loses the ball! Stripped by Giannis LaVine! TURNOVER! (live ball)

[06:54] Team_050 possession (Score: 9-11)
Collin Bane attempts a 3Pt. Contested by Damian Ginobili (3.7 feet, ZONE). Collin Bane misses. Rebound secured by Vince Lillard.

[06:40] Team_099 possession (Score: 9-11)
Ayo Barrett attempts a 3Pt. Contested by Giannis LaVine (4.0 feet, MAN). AYO BARRETT MAKES IT! Assist: Vince Lillard
Score: 9-14

[06:22] Team_050 possession (Score: 9-14)
Giannis LaVine attempts a Midrange. Contested by Larry James (5.5 feet, ZONE). Giannis LaVine misses. Rebound secured by Larry Wade.

[06:07] Team_099 possession (Score: 9-14)
Larry James attempts a 3Pt. Contested by Giannis LaVine (4.0 feet, ZONE). Larry James misses. Rebound secured by Collin Bane.

[05:53] Team_050 possession (Score: 9-14)
Donovan Trent attempts a Midrange. Contested by Larry James (4.9 feet, ZONE). DONOVAN TRENT MAKES IT! Assist: LeBron Bridges
Score: 11-14

[05:36] Team_099 possession (Score: 11-14)
Larry James makes the Layup and draws the foul on Joel Banchero! And-1! Larry James to the line for 1. [Team fouls: 4] (Joel Banchero: 1 personal fouls)   FT 1/1: GOOD Larry James makes 1/1 from the line.
Score: 11-17

[05:24] Team_050 possession (Score: 11-17)
Collin Bane attempts a Layup. Contested by Vince Lillard (2.7 feet, ZONE). COLLIN BANE MAKES IT! Assist: Joel Banchero
Score: 13-17

[05:08] Team_099 possession (Score: 13-17)
Larry James throws a bad pass out of bounds! TURNOVER! (dead ball)

[04:51] Team_050 possession (Score: 13-17)
Collin Bane attempts a Midrange. Contested by Damian Ginobili (3.7 feet, MAN). Collin Bane misses. Rebound secured by Vince Lillard.

[04:38] Team_099 possession (Score: 13-17)
Vince Lillard attempts a 3Pt. Contested by Giannis LaVine (4.0 feet, ZONE). VINCE LILLARD MAKES IT! Assist: Larry James
Score: 13-20

[04:28] Team_050 possession (Score: 13-20)
Giannis LaVine drives and kicks out. Giannis LaVine attempts a 3Pt. Contested by Ayo Barrett (3.8 feet, MAN). Giannis LaVine misses. Rebound secured by Larry Wade.

[04:14] Team_099 possession (Score: 13-20)
Larry James attempts a 3Pt. Contested by Joel Banchero (4.4 feet, MAN). LARRY JAMES MAKES IT! Assist: Ayo Barrett
Score: 13-23

[04:00] Team_050 possession (Score: 13-23)
Giannis LaVine attempts a 3Pt. Contested by Ayo Barrett (4.2 feet, MAN). Giannis LaVine misses. Rebound secured by Larry Wade.

[03:47] Team_099 possession (Score: 13-23)
Larry James attempts a Midrange. Contested by Joel Banchero (4.5 feet, ZONE). Larry James misses. Rebound secured by Collin Bane.

[03:32] Team_050 possession (Score: 13-23)
Giannis LaVine attempts a 3Pt. Contested by Ayo Barrett (4.3 feet, MAN). GIANNIS LAVINE MAKES IT! Assist: Donovan Trent
Score: 16-23

[03:18] Team_099 possession (Score: 16-23)
Ayo Barrett attempts a 3Pt. Contested by Giannis LaVine (4.2 feet, MAN). Ayo Barrett misses. Rebound secured by LeBron Bridges.

[03:03] Team_050 possession (Score: 16-23)
Collin Bane attempts a Layup. Contested by Damian Ginobili (3.9 feet, MAN). COLLIN BANE MAKES IT!
Score: 18-23

[02:54] Team_099 possession (Score: 18-23)
FOUL! Reach-in foul on Donovan Trent during the drive. [IN THE BONUS! 5 team fouls] Ayo Barrett to the line for 2 free throws. (Donovan Trent: 1 personal fouls)   FT 1/2: GOOD   FT 2/2: GOOD Ayo Barrett makes 2/2 from the line.
Score: 18-25

[02:42] Team_050 possession (Score: 18-25)
Collin Bane attempts a 3Pt. Contested by Damian Ginobili (4.0 feet, MAN). Collin Bane misses. Rebound secured by Damian Ginobili.

[02:29] Team_099 possession (Score: 18-25)
Larry James drives to the basket... Larry James loses the ball! Stripped by Donovan Trent! TURNOVER! (live ball)

[02:13] Team_050 possession (Score: 18-25)
Donovan Trent attempts a Midrange. Contested by Ayo Barrett (3.8 feet, ZONE). Donovan Trent misses. Rebound secured by Damian Ginobili.

[01:57] Team_099 possession (Score: 18-25)
Larry James attempts a 3Pt. Contested by Joel Banchero (4.6 feet, MAN). LARRY JAMES MAKES IT! Assist: Larry Wade
Score: 18-28

[01:44] Team_050 possession (Score: 18-28)
Donovan Trent drives and kicks out. Donovan Trent attempts a Midrange. Contested by Larry Wade (4.6 feet, MAN). Donovan Trent misses. Rebound secured by Vince Lillard.

[01:26] Team_099 possession (Score: 18-28)
FOUL! Holding foul on Donovan Trent. [IN THE BONUS! 6 team fouls] Larry Wade to the line for 2 free throws. (Donovan Trent: 2 personal fouls)   FT 1/2: GOOD   FT 2/2: GOOD Larry Wade makes 2/2 from the line.
Score: 18-30

[01:06] Team_050 possession (Score: 18-30)
FOUL! Offensive foul on LeBron Bridges! Vince Lillard drew the charge! [Team fouls: 7] (LeBron Bridges: 2 personal fouls) TURNOVER! (dead ball)

[00:52] Team_099 possession (Score: 18-30)
Damian Ginobili attempts a 3Pt. Contested by Giannis LaVine (4.5 feet, ZONE). Damian Ginobili misses. Rebound secured by Collin Bane.

[00:38] Team_050 possession (Score: 18-30)
LeBron Bridges drives to the basket... LeBron Bridges throws a bad pass out of bounds! TURNOVER! (dead ball)

[00:38] Substitution (Team_050): Giannis LaVine OUT → Damian O'Neal IN (stamina_rule2)

[00:38] Substitution (Team_050): Joel Banchero OUT → Dwyane Towns IN (stamina_rule2)

[00:38] Substitution (Team_050): Collin Bane OUT → Larry Curry IN (stamina_rule2)

[00:38] Substitution (Team_050): LeBron Bridges OUT → Luka Gasol IN (stamina_rule2)

[00:38] Substitution (Team_050): Donovan Trent OUT → Tyler Smith IN (stamina_rule2)

[00:38] Substitution (Team_099): Ayo Barrett OUT → CJ Cunningham IN (stamina_rule2)

[00:38] Substitution (Team_099): Larry James OUT → Manu Johnson IN (stamina_rule2)

[00:38] Substitution (Team_099): Damian Ginobili OUT → Scottie Quickley IN (stamina_rule2)

[00:38] Substitution (Team_099): Vince Lillard OUT → Donovan Green IN (stamina_rule2)

[00:38] Substitution (Team_099): Larry Wade OUT → Jarrett Fox IN (stamina_rule2)

[00:24] Team_099 possession (Score: 18-30)
CJ Cunningham drives, picks up Damian O'Neal. Help arrives from Dwyane Towns! CJ Cunningham attempts a Dunk. Wide open! Dwyane Towns is 6.5 feet away. [MAN] CJ Cunningham misses. Rebound secured by Tyler Smith.

[00:11] Team_050 possession (Score: 18-30)
Damian O'Neal drives to the basket... FOUL! Offensive foul on Damian O'Neal! CJ Cunningham drew the charge! [Team fouls: 8] (Damian O'Neal: 1 personal fouls) TURNOVER! (dead ball)

================================================================================
                              1ST QUARTER COMPLETE                              
================================================================================

1ST QUARTER SCORE: Team_050 18, Team_099 30

BOX SCORE:
================================================================================

Team_050
--------------------------------------------------------------------------------
Player                MIN  PTS  REB  AST  TO      FG   FG%      3P   3P%
--------------------------------------------------------------------------------
Giannis LaVine         12    7    0    0   0   3/7    42.9     0/0   0.0
Collin Bane            12    4    6    1   0   2/8    25.0     0/0   0.0
Joel Banchero          12    3    0    1   0   1/2    50.0     0/0   0.0
Donovan Trent          12    2    0    2   0   1/3    33.3     0/0   0.0
LeBron Bridges         12    2    2    1   0   1/1   100.0     0/0   0.0
Tyler Smith             0    0    1    0   0   0/0     0.0     0/0   0.0

TEAM: FG: 8/21 (38.1%), 3PT: 2/6 (33.3%), REB: 9 (1 off, 8 def), AST: 5, TO: 4
TEAM FOULS: 8 [Team_099 in BONUS]


Team_099
--------------------------------------------------------------------------------
Player                MIN  PTS  REB  AST  TO      FG   FG%      3P   3P%
--------------------------------------------------------------------------------
Larry James            12    9    0    1   0   3/6    50.0     0/0   0.0
Ayo Barrett            12    7    0    2   0   3/4    75.0     0/0   0.0
Larry Wade             12    6    5    1   0   3/4    75.0     0/0   0.0
Vince Lillard          12    5    5    1   0   2/2   100.0     0/0   0.0
Damian Ginobili        12    3    3    1   0   1/3    33.3     0/0   0.0
CJ Cunningham           0    0    0    0   0   0/1     0.0     0/0   0.0

TEAM: FG: 12/20 (60.0%), 3PT: 4/10 (40.0%), REB: 13 (0 off, 13 def), AST: 6, TO: 4
TEAM FOULS: 1

================================================================================

================================================================================
                       2ND QUARTER - Team_050 vs Team_099                       
================================================================================

[12:00] Team_050 possession (Score: 18-30)
Donovan Trent makes the Layup and draws the foul on Vince Lillard! And-1! Donovan Trent to the line for 1. [Team fouls: 1] (Vince Lillard: 1 personal fouls)   FT 1/1: GOOD Donovan Trent makes 1/1 from the line.
Score: 21-30

[11:46] Team_099 possession (Score: 21-30)
Damian Ginobili attempts a 3Pt. Contested by Giannis LaVine (4.3 feet, ZONE). Damian Ginobili misses. Rebound secured by LeBron Bridges.

[11:34] Team_050 possession (Score: 21-30)
Joel Banchero attempts a 3Pt. Contested by Larry James (5.1 feet, MAN). Joel Banchero misses. Rebound secured by Vince Lillard.

[11:16] Team_099 possession (Score: 21-30)
Damian Ginobili attempts a Layup. Contested by Collin Bane (4.5 feet, MAN). DAMIAN GINOBILI MAKES IT! Assist: Larry James
Score: 21-32

[11:03] Team_050 possession (Score: 21-32)
LeBron Bridges attempts a Midrange. Contested by Vince Lillard (3.1 feet, ZONE). LeBron Bridges misses. Rebound secured by Vince Lillard.

[10:44] Team_099 possession (Score: 21-32)
FOUL! Reach-in foul on LeBron Bridges during the drive. [Team fouls: 1] No free throws, side out. (LeBron Bridges: 1 personal fouls)

[10:30] Team_099 possession (Score: 21-32)
Larry Wade drives to the basket... Larry Wade commits a violation (traveling/carry)! TURNOVER! (dead ball)

[10:30] Substitution (Team_050): Giannis LaVine OUT → Damian O'Neal IN (stamina_rule2)

[10:30] Substitution (Team_050): Joel Banchero OUT → Dwyane Towns IN (stamina_rule2)

[10:30] Substitution (Team_050): Collin Bane OUT → Larry Curry IN (stamina_rule2)

[10:30] Substitution (Team_050): LeBron Bridges OUT → Luka Gasol IN (stamina_rule2)

[10:30] Substitution (Team_050): Donovan Trent OUT → Tyler Smith IN (stamina_rule2)

[10:30] Substitution (Team_099): Ayo Barrett OUT → CJ Cunningham IN (stamina_rule2)

[10:30] Substitution (Team_099): Larry James OUT → Manu Johnson IN (stamina_rule2)

[10:30] Substitution (Team_099): Damian Ginobili OUT → Scottie Quickley IN (stamina_rule2)

[10:30] Substitution (Team_099): Vince Lillard OUT → Donovan Green IN (stamina_rule2)

[10:30] Substitution (Team_099): Larry Wade OUT → Jarrett Fox IN (stamina_rule2)

[10:17] Team_050 possession (Score: 21-32)
Luka Gasol throws a bad pass! Stolen by Donovan Green! TURNOVER! (live ball)

[10:06] Team_099 possession (Score: 21-32)
Jarrett Fox drives and kicks out. Donovan Green attempts a Midrange. Contested by Larry Curry (4.9 feet, ZONE). DONOVAN GREEN MAKES IT! Assist: Jarrett Fox
Score: 21-34

[09:48] Team_050 possession (Score: 21-34)
Larry Curry drives and kicks out. Luka Gasol attempts a 3Pt. Contested by Donovan Green (3.9 feet, MAN). Luka Gasol misses. Rebound secured by Jarrett Fox.

[09:35] Team_099 possession (Score: 21-34)
Donovan Green makes the Layup and draws the foul on Tyler Smith! And-1! Donovan Green to the line for 1. [Team fouls: 2] (Tyler Smith: 1 personal fouls)   FT 1/1: GOOD Donovan Green makes 1/1 from the line.
Score: 21-37

[09:19] Team_050 possession (Score: 21-37)
Larry Curry drives, picks up Jarrett Fox. Help arrives from Manu Johnson! Larry Curry attempts a Layup. Contested by Manu Johnson (4.1 feet, ZONE). LARRY CURRY MAKES IT!
Score: 23-37

[09:05] Team_099 possession (Score: 23-37)
CJ Cunningham makes the Midrange and draws the foul on Damian O'Neal! And-1! CJ Cunningham to the line for 1. [Team fouls: 3] (Damian O'Neal: 1 personal fouls)   FT 1/1: GOOD CJ Cunningham makes 1/1 from the line.
Score: 23-40

[08:52] Team_050 possession (Score: 23-40)
FOUL! Reach-in foul on CJ Cunningham during the drive. [Team fouls: 2] No free throws, side out. (CJ Cunningham: 1 personal fouls)

[08:37] Team_050 possession (Score: 23-40)
Dwyane Towns throws a bad pass! Stolen by Manu Johnson! TURNOVER! (live ball)

[08:23] Team_099 possession (Score: 23-40)
Manu Johnson attempts a 3Pt. Contested by Luka Gasol (5.0 feet, ZONE). Manu Johnson misses. Rebound secured by Dwyane Towns.

[08:05] Team_050 possession (Score: 23-40)
Damian O'Neal attempts a Midrange. Contested by CJ Cunningham (5.9 feet, MAN). Damian O'Neal misses. Rebound secured by Jarrett Fox.

[07:49] Team_099 possession (Score: 23-40)
Donovan Green attempts a Layup. Contested by Luka Gasol (5.0 feet, MAN). Donovan Green misses. Offensive rebound by Jarrett Fox! Jarrett Fox's putback is no good. Rebound secured by Tyler Smith.

[07:36] Team_050 possession (Score: 23-40)
Larry Curry drives and kicks out. Dwyane Towns attempts a Midrange. Contested by Jarrett Fox (4.0 feet, ZONE). Dwyane Towns misses. Rebound secured by Jarrett Fox.

[07:22] Team_099 possession (Score: 23-40)
Manu Johnson attempts a 3Pt. Contested by Dwyane Towns (4.4 feet, MAN). Manu Johnson misses. Rebound secured by Larry Curry.

[07:09] Team_050 possession (Score: 23-40)
Dwyane Towns attempts a Midrange. Contested by Manu Johnson (5.1 feet, MAN). Dwyane Towns misses. Rebound secured by Scottie Quickley.

[06:58] Team_099 possession (Score: 23-40)
Donovan Green drives and kicks out. Scottie Quickley attempts a 3Pt. Contested by Larry Curry (4.9 feet, MAN). SCOTTIE QUICKLEY MAKES IT!
Score: 23-43

[06:42] Team_050 possession (Score: 23-43)
Larry Curry makes the Dunk and draws the foul on Manu Johnson! And-1! Larry Curry to the line for 1. [Team fouls: 3] (Manu Johnson: 1 personal fouls)   FT 1/1: GOOD Larry Curry makes 1/1 from the line.
Score: 26-43

[06:27] Team_099 possession (Score: 26-43)
Donovan Green attempts a Layup. Contested by Tyler Smith (5.3 feet, ZONE). DONOVAN GREEN MAKES IT! Assist: CJ Cunningham
Score: 26-45

[06:13] Team_050 possession (Score: 26-45)
Tyler Smith attempts a Midrange. Contested by Jarrett Fox (4.4 feet, MAN). Tyler Smith misses. Rebound secured by Jarrett Fox.

[05:59] Team_099 possession (Score: 26-45)
Scottie Quickley attempts a 3Pt. Contested by Larry Curry (5.2 feet, MAN). Scottie Quickley misses. Rebound secured by Dwyane Towns.

[05:45] Team_050 possession (Score: 26-45)
Tyler Smith drives and kicks out. Larry Curry attempts a Midrange. Contested by Scottie Quickley (4.0 feet, ZONE). Larry Curry misses. Rebound secured by Jarrett Fox.

[05:28] Team_099 possession (Score: 26-45)
Donovan Green attempts a 3Pt. Contested by Luka Gasol (5.0 feet, MAN). Donovan Green misses. Rebound secured by Tyler Smith.

[05:15] Team_050 possession (Score: 26-45)
Larry Curry drives, Jarrett Fox stays with him. Larry Curry attempts a Layup. Contested by Jarrett Fox (4.1 feet, ZONE). LARRY CURRY MAKES IT! Assist: Dwyane Towns
Score: 28-45

[05:02] Team_099 possession (Score: 28-45)
Donovan Green attempts a 3Pt. Contested by Luka Gasol (5.0 feet, MAN). Donovan Green misses. Rebound secured by Tyler Smith.

[04:49] Team_050 possession (Score: 28-45)
FOUL! Shooting foul on Scottie Quickley. Larry Curry to the line for 3 free throws. [Team fouls: 4] (Scottie Quickley: 1 personal fouls)   FT 1/3: GOOD   FT 2/3: GOOD   FT 3/3: GOOD Larry Curry makes 3/3 from the line.
Score: 31-45

[04:33] Team_099 possession (Score: 31-45)
Jarrett Fox makes the Dunk and draws the foul on Tyler Smith! And-1! Jarrett Fox to the line for 1. [Team fouls: 4] (Tyler Smith: 2 personal fouls)   FT 1/1: GOOD Jarrett Fox makes 1/1 from the line.
Score: 31-48

[04:17] Team_050 possession (Score: 31-48)
Dwyane Towns drives, Manu Johnson stays with him. Dwyane Towns attempts a Dunk. Contested by Manu Johnson (5.1 feet, MAN). DWYANE TOWNS MAKES IT! Assist: Damian O'Neal
Score: 33-48

[04:00] Team_099 possession (Score: 33-48)
Scottie Quickley drives and kicks out. Manu Johnson attempts a Midrange. Contested by Dwyane Towns (4.3 feet, MAN). MANU JOHNSON MAKES IT! Assist: Donovan Green
Score: 33-50

[03:45] Team_050 possession (Score: 33-50)
Damian O'Neal drives, CJ Cunningham stays with him. Damian O'Neal attempts a Dunk. Contested by CJ Cunningham (5.9 feet, MAN). DAMIAN O'NEAL MAKES IT! Assist: Tyler Smith
Score: 35-50

[03:32] Team_099 possession (Score: 35-50)
FOUL! Shooting foul on Tyler Smith. Scottie Quickley to the line for 2 free throws. [BONUS: 5 team fouls] (Tyler Smith: 3 personal fouls)   FT 1/2: GOOD   FT 2/2: MISS Scottie Quickley makes 1/2 from the line. Offensive rebound by Jarrett Fox! Jarrett Fox puts it back in!
Score: 35-53

[03:21] Team_050 possession (Score: 35-53)
Luka Gasol attempts a Layup. Contested by Donovan Green (3.9 feet, MAN). Luka Gasol misses. Rebound secured by Scottie Quickley.

[03:07] Team_099 possession (Score: 35-53)
Donovan Green attempts a Midrange. Contested by Larry Curry (5.1 feet, ZONE). DONOVAN GREEN MAKES IT!
Score: 35-55

[02:55] Team_050 possession (Score: 35-55)
Dwyane Towns drives and kicks out. Luka Gasol attempts a Midrange. Contested by Scottie Quickley (4.2 feet, ZONE). LUKA GASOL MAKES IT!
Score: 37-55

[02:41] Team_099 possession (Score: 37-55)
Scottie Quickley attempts a 3Pt. Contested by Luka Gasol (5.3 feet, ZONE). Scottie Quickley misses. Rebound secured by Dwyane Towns.

[02:30] Team_050 possession (Score: 37-55)
Larry Curry attempts a Midrange. Contested by Scottie Quickley (4.3 feet, MAN). Larry Curry misses. Rebound secured by Jarrett Fox.

[02:14] Team_099 possession (Score: 37-55)
Jarrett Fox attempts a Midrange. Contested by Larry Curry (5.5 feet, ZONE). JARRETT FOX MAKES IT!
Score: 37-57

[02:02] Team_050 possession (Score: 37-57)
Damian O'Neal drives to the basket... FOUL! Offensive foul on Damian O'Neal! Jarrett Fox drew the charge! [Team fouls: 6] (Damian O'Neal: 2 personal fouls) TURNOVER! (dead ball)

[01:49] Team_099 possession (Score: 37-57)
CJ Cunningham attempts a Midrange. Contested by Dwyane Towns (4.6 feet, ZONE). CJ Cunningham misses. Rebound secured by Tyler Smith.

[01:35] Team_050 possession (Score: 37-57)
Dwyane Towns attempts a Midrange. Contested by Manu Johnson (5.3 feet, MAN). DWYANE TOWNS MAKES IT! Assist: Tyler Smith
Score: 39-57

[01:25] Team_099 possession (Score: 39-57)
Manu Johnson attempts a Midrange. Contested by Luka Gasol (5.2 feet, ZONE). Manu Johnson misses. Offensive rebound by Donovan Green! Donovan Green kicks it out.

[01:07] Team_099 possession (Score: 39-57)
Jarrett Fox drives, Tyler Smith stays with him. Jarrett Fox attempts a Dunk. Contested by Tyler Smith (5.9 feet, ZONE). Jarrett Fox misses. Offensive rebound by Donovan Green! Donovan Green kicks it out.

[00:51] Team_099 possession (Score: 39-57)
Jarrett Fox attempts a 3Pt. Contested by Luka Gasol (5.6 feet, ZONE). JARRETT FOX MAKES IT! Assist: Manu Johnson
Score: 39-60

[00:36] Team_050 possession (Score: 39-60)
Dwyane Towns attempts a 3Pt. Contested by Manu Johnson (5.4 feet, ZONE). Dwyane Towns misses. Rebound secured by Scottie Quickley.

[00:22] Team_099 possession (Score: 39-60)
Manu Johnson attempts a Midrange. Contested by Larry Curry (5.3 feet, ZONE). Manu Johnson misses. Offensive rebound by Donovan Green! Donovan Green kicks it out.

[00:11] Team_099 possession (Score: 39-60)
CJ Cunningham attempts a 3Pt. Wide open! Damian O'Neal is 6.8 feet away. [MAN] CJ Cunningham misses. Rebound secured by Tyler Smith.

================================================================================
                              2ND QUARTER COMPLETE                              
================================================================================

2ND QUARTER SCORE: Team_050 21, Team_099 30

BOX SCORE:
================================================================================

Team_050
--------------------------------------------------------------------------------
Player                MIN  PTS  REB  AST  TO      FG   FG%      3P   3P%
--------------------------------------------------------------------------------
Larry Curry            11   10    1    0   0   4/7    57.1     0/0   0.0
Dwyane Towns           11    4    3    1   0   2/4    50.0     0/0   0.0
Donovan Trent          13    3    0    0   0   1/1   100.0     0/0   0.0
Damian O'Neal          11    2    0    1   0   1/2    50.0     0/0   0.0
Luka Gasol             11    2    0    0   0   1/2    50.0     0/0   0.0
LeBron Bridges         13    0    1    0   0   0/1     0.0     0/0   0.0
Joel Banchero          13    0    0    0   0   0/1     0.0     0/0   0.0
Tyler Smith            11    0    5    2   0   0/2     0.0     0/0   0.0

TEAM: FG: 9/20 (45.0%), 3PT: 1/3 (33.3%), REB: 9 (0 off, 9 def), AST: 4, TO: 3
TEAM FOULS: 6 [Team_099 in BONUS]


Team_099
--------------------------------------------------------------------------------
Player                MIN  PTS  REB  AST  TO      FG   FG%      3P   3P%
--------------------------------------------------------------------------------
Jarrett Fox            11   11    6    1   0   4/4   100.0     0/0   0.0
Donovan Green          11    9    3    1   0   4/7    57.1     0/0   0.0
CJ Cunningham          11    3    0    1   0   1/3    33.3     0/0   0.0
Scottie Quickley       11    3    3    0   0   1/3    33.3     0/0   0.0
Damian Ginobili        13    2    0    0   0   1/2    50.0     0/0   0.0
Manu Johnson           11    2    0    1   0   1/3    33.3     0/0   0.0
Vince Lillard          13    0    2    0   0   0/0     0.0     0/0   0.0
Larry James            13    0    0    1   0   0/0     0.0     0/0   0.0

TEAM: FG: 12/22 (54.5%), 3PT: 1/9 (11.1%), REB: 15 (4 off, 11 def), AST: 5, TO: 1
TEAM FOULS: 4

================================================================================

================================================================================
                       3RD QUARTER - Team_050 vs Team_099                       
================================================================================

[12:00] Team_050 possession (Score: 39-60)
Joel Banchero attempts a Layup. BLOCKED BY VINCE LILLARD! Ball deflects out of bounds off Joel Banchero.

[11:42] Team_099 possession (Score: 39-60)
Ayo Barrett attempts a Layup. Contested by Donovan Trent (5.0 feet, ZONE). Ayo Barrett misses. Rebound secured by LeBron Bridges.

[11:28] Team_050 possession (Score: 39-60)
LeBron Bridges attempts a 3Pt. Contested by Ayo Barrett (3.9 feet, ZONE). LEBRON BRIDGES MAKES IT! Assist: Giannis LaVine
Score: 42-60

[11:13] Team_099 possession (Score: 42-60)
Larry James drives, Joel Banchero stays with him. Larry James attempts a Layup. Contested by Joel Banchero (4.4 feet, MAN). LARRY JAMES MAKES IT! Assist: Damian Ginobili
Score: 42-62

[11:01] Team_050 possession (Score: 42-62)
LeBron Bridges drives to the basket... LeBron Bridges throws a bad pass! Stolen by Vince Lillard! TURNOVER! (live ball)

[10:47] Team_099 possession (Score: 42-62)
Larry Wade drives and kicks out. Damian Ginobili attempts a 3Pt. Contested by Joel Banchero (4.3 feet, ZONE). Damian Ginobili misses. Rebound secured by Joel Banchero.

[10:33] Team_050 possession (Score: 42-62)
FOUL! Shooting foul on Ayo Barrett. Giannis LaVine to the line for 2 free throws. [Team fouls: 1] (Ayo Barrett: 1 personal fouls)   FT 1/2: MISS   FT 2/2: GOOD Giannis LaVine makes 1/2 from the line.
Score: 43-62

[10:17] Team_099 possession (Score: 43-62)
Damian Ginobili attempts a Midrange. Contested by LeBron Bridges (4.4 feet, ZONE). Damian Ginobili misses. Offensive rebound by Larry Wade! Larry Wade's putback is no good. Offensive rebound by Larry Wade! Larry Wade kicks it out.

[09:59] Team_099 possession (Score: 43-62)
Ayo Barrett attempts a 3Pt. Contested by Giannis LaVine (4.0 feet, MAN). Ayo Barrett misses. Rebound secured by Collin Bane.

[09:47] Team_050 possession (Score: 43-62)
Collin Bane drives, Damian Ginobili stays with him. Collin Bane attempts a Dunk. Contested by Damian Ginobili (3.7 feet, MAN). Collin Bane misses. Rebound secured by Vince Lillard.

[09:34] Team_099 possession (Score: 43-62)
Larry James attempts a Midrange. Contested by Joel Banchero (4.4 feet, MAN). LARRY JAMES MAKES IT!
Score: 43-64

[09:18] Team_050 possession (Score: 43-64)
LeBron Bridges attempts a Midrange. Contested by Vince Lillard (2.7 feet, MAN). LeBron Bridges misses. Rebound secured by Larry Wade.

[09:04] Team_099 possession (Score: 43-64)
Vince Lillard drives, picks up LeBron Bridges. Help arrives from Joel Banchero! Vince Lillard attempts a Dunk. Contested by Joel Banchero (4.2 feet, MAN). Vince Lillard misses. Offensive rebound by Vince Lillard! Vince Lillard puts it back in!
Score: 43-66

[08:49] Team_050 possession (Score: 43-66)
Joel Banchero attempts a Midrange. Contested by Larry James (4.9 feet, MAN). Joel Banchero misses. Rebound secured by Vince Lillard.

[08:34] Team_099 possession (Score: 43-66)
Vince Lillard loses the ball! Stripped by LeBron Bridges! TURNOVER! (live ball)

[08:17] Team_050 possession (Score: 43-66)
Donovan Trent attempts a Midrange. Contested by Vince Lillard (2.3 feet, ZONE). Donovan Trent misses. Rebound secured by Larry Wade.

[07:58] Team_099 possession (Score: 43-66)
Larry James attempts a Layup. Contested by Donovan Trent (4.9 feet, ZONE). LARRY JAMES MAKES IT!
Score: 43-68

[07:41] Team_050 possession (Score: 43-68)
Joel Banchero drives, Vince Lillard stays with him. Joel Banchero attempts a Layup. Contested by Vince Lillard (2.3 feet, ZONE). JOEL BANCHERO MAKES IT! Assist: Donovan Trent
Score: 45-68

[07:23] Team_099 possession (Score: 45-68)
Larry Wade drives, Donovan Trent stays with him. Larry Wade attempts a Layup. Contested by Donovan Trent (5.1 feet, MAN). LARRY WADE MAKES IT!
Score: 45-70

[07:09] Team_050 possession (Score: 45-70)
Giannis LaVine makes the Layup and draws the foul on Ayo Barrett! And-1! Giannis LaVine to the line for 1. [Team fouls: 2] (Ayo Barrett: 2 personal fouls)   FT 1/1: GOOD Giannis LaVine makes 1/1 from the line.
Score: 48-70

[06:59] Team_099 possession (Score: 48-70)
Larry Wade attempts a Midrange. Contested by Donovan Trent (5.1 feet, MAN). LARRY WADE MAKES IT! Assist: Larry James
Score: 48-72

[06:42] Team_050 possession (Score: 48-72)
Collin Bane attempts a Layup. Contested by Damian Ginobili (3.7 feet, MAN). Collin Bane misses. Rebound secured by Damian Ginobili.

[06:24] Team_099 possession (Score: 48-72)
Larry Wade attempts a Midrange. Contested by Joel Banchero (4.6 feet, ZONE). Larry Wade misses. Offensive rebound by Larry Wade! Larry Wade's putback is no good. Offensive rebound by Vince Lillard! Vince Lillard kicks it out.

[06:13] Team_099 possession (Score: 48-72)
Damian Ginobili drives, picks up Donovan Trent. Help arrives from Joel Banchero! Damian Ginobili attempts a Dunk. Contested by Joel Banchero (5.0 feet, ZONE). DAMIAN GINOBILI MAKES IT!
Score: 48-74

[06:01] Team_050 possession (Score: 48-74)
Joel Banchero drives and kicks out. Donovan Trent attempts a 3Pt. Contested by Larry Wade (4.2 feet, MAN). DONOVAN TRENT MAKES IT! Assist: LeBron Bridges
Score: 51-74

[05:50] Team_099 possession (Score: 51-74)
Vince Lillard drives and kicks out. Larry James attempts a 3Pt. Contested by Giannis LaVine (3.9 feet, ZONE). Larry James misses. Rebound secured by Collin Bane.

[05:34] Team_050 possession (Score: 51-74)
Donovan Trent attempts a Layup. Contested by Vince Lillard (2.3 feet, ZONE). Donovan Trent misses. Offensive rebound by Collin Bane! Collin Bane kicks it out.

[05:19] Team_050 possession (Score: 51-74)
Donovan Trent drives, picks up Vince Lillard. Help arrives from Ayo Barrett! Donovan Trent attempts a Dunk. Contested by Ayo Barrett (2.3 feet, ZONE). DONOVAN TRENT MAKES IT!
Score: 53-74

[05:03] Team_099 possession (Score: 53-74)
Larry Wade throws a bad pass out of bounds! TURNOVER! (dead ball)

[04:45] Team_050 possession (Score: 53-74)
Collin Bane drives to the basket... Collin Bane commits a violation (traveling/carry)! TURNOVER! (dead ball)

[04:27] Team_099 possession (Score: 53-74)
Larry James attempts a 3Pt. Contested by Giannis LaVine (4.0 feet, ZONE). Larry James misses. Rebound secured by Joel Banchero.

[04:16] Team_050 possession (Score: 53-74)
Collin Bane attempts a Midrange. Contested by Damian Ginobili (3.8 feet, MAN). Collin Bane misses. Rebound secured by Vince Lillard.

[04:06] Team_099 possession (Score: 53-74)
Vince Lillard drives, LeBron Bridges stays with him. Vince Lillard attempts a Dunk. Contested by LeBron Bridges (4.4 feet, MAN). Vince Lillard misses. FOUL! Loose ball foul on Joel Banchero during the rebound battle. [Team fouls: 1] No free throws, side out. (Joel Banchero: 1 personal fouls)

[03:47] Team_099 possession (Score: 53-74)
Damian Ginobili attempts a Midrange. Contested by Donovan Trent (5.2 feet, ZONE). DAMIAN GINOBILI MAKES IT!
Score: 53-76

[03:31] Team_050 possession (Score: 53-76)
Giannis LaVine commits a violation (traveling/carry)! TURNOVER! (dead ball)

[03:19] Team_099 possession (Score: 53-76)
FOUL! Holding foul on LeBron Bridges. [Team fouls: 2] No free throws, side out. (LeBron Bridges: 1 personal fouls)

[03:06] Team_099 possession (Score: 53-76)
Larry James drives, Joel Banchero stays with him. Larry James attempts a Dunk. Contested by Joel Banchero (4.5 feet, MAN). LARRY JAMES MAKES IT! Assist: Ayo Barrett
Score: 53-78

[02:49] Team_050 possession (Score: 53-78)
Joel Banchero drives and kicks out. Joel Banchero attempts a Midrange. Contested by Vince Lillard (2.8 feet, ZONE). JOEL BANCHERO MAKES IT! Assist: LeBron Bridges
Score: 55-78

[02:37] Team_099 possession (Score: 55-78)
FOUL! Shooting foul on Joel Banchero. Larry James to the line for 2 free throws. [Team fouls: 3] (Joel Banchero: 2 personal fouls)   FT 1/2: GOOD   FT 2/2: GOOD Larry James makes 2/2 from the line.
Score: 55-80

[02:27] Team_050 possession (Score: 55-80)
Joel Banchero attempts a Layup. Contested by Vince Lillard (2.7 feet, ZONE). Joel Banchero misses. FOUL! Loose ball foul on Damian Ginobili during the rebound battle. [Team fouls: 3] No free throws, side out. (Damian Ginobili: 1 personal fouls)

[02:15] Team_050 possession (Score: 55-80)
Giannis LaVine attempts a 3Pt. Contested by Ayo Barrett (4.4 feet, ZONE). Giannis LaVine misses. Offensive rebound by Collin Bane! Collin Bane kicks it out.

[02:02] Team_050 possession (Score: 55-80)
FOUL! Shooting foul on Damian Ginobili. Collin Bane to the line for 3 free throws. [Team fouls: 4] (Damian Ginobili: 2 personal fouls)   FT 1/3: GOOD   FT 2/3: GOOD   FT 3/3: GOOD Collin Bane makes 3/3 from the line.
Score: 58-80

[01:47] Team_099 possession (Score: 58-80)
FOUL! Offensive foul on Larry Wade! Donovan Trent drew the charge! [Team fouls: 5] (Larry Wade: 1 personal fouls) TURNOVER! (dead ball)

[01:33] Team_050 possession (Score: 58-80)
Joel Banchero attempts a Midrange. Contested by Vince Lillard (2.8 feet, ZONE). Joel Banchero misses. Offensive rebound by LeBron Bridges! LeBron Bridges kicks it out.

[01:19] Team_050 possession (Score: 58-80)
Collin Bane attempts a 3Pt. Contested by Damian Ginobili (4.1 feet, MAN). Collin Bane misses. Rebound secured by Larry Wade.

[01:05] Team_099 possession (Score: 58-80)
Larry James attempts a 3Pt. Contested by Giannis LaVine (4.4 feet, ZONE). Larry James misses. Rebound secured by Collin Bane.

[00:53] Team_050 possession (Score: 58-80)
LeBron Bridges attempts a 3Pt. Contested by Vince Lillard (3.2 feet, MAN). LEBRON BRIDGES MAKES IT! Assist: Giannis LaVine
Score: 61-80

[00:39] Team_099 possession (Score: 61-80)
Damian Ginobili attempts a 3Pt. Contested by Giannis LaVine (4.5 feet, ZONE). Damian Ginobili misses. Rebound secured by Joel Banchero.

[00:24] Team_050 possession (Score: 61-80)
Giannis LaVine drives, Ayo Barrett stays with him. Giannis LaVine attempts a Layup. Contested by Ayo Barrett (4.5 feet, MAN). GIANNIS LAVINE MAKES IT! Assist: Donovan Trent
Score: 63-80

[00:09] Team_099 possession (Score: 63-80)
Damian Ginobili drives and kicks out. Ayo Barrett attempts a 3Pt. Contested by Giannis LaVine (4.5 feet, ZONE). Ayo Barrett misses. Rebound secured by Collin Bane.

================================================================================
                              3RD QUARTER COMPLETE                              
================================================================================

3RD QUARTER SCORE: Team_050 24, Team_099 20

BOX SCORE:
================================================================================

Team_050
--------------------------------------------------------------------------------
Player                MIN  PTS  REB  AST  TO      FG   FG%      3P   3P%
--------------------------------------------------------------------------------
LeBron Bridges         25    6    3    2   0   2/3    66.7     0/0   0.0
Giannis LaVine         25    6    0    2   0   3/3   100.0     0/0   0.0
Donovan Trent          25    5    0    2   0   2/3    66.7     0/0   0.0
Joel Banchero          25    4    3    0   0   2/4    50.0     0/0   0.0
Collin Bane            25    3    6    0   0   1/5    20.0     0/0   0.0

TEAM: FG: 10/18 (55.6%), 3PT: 3/4 (75.0%), REB: 12 (4 off, 8 def), AST: 6, TO: 3
TEAM FOULS: 3


Team_099
--------------------------------------------------------------------------------
Player                MIN  PTS  REB  AST  TO      FG   FG%      3P   3P%
--------------------------------------------------------------------------------
Larry James            25   10    0    1   0   5/7    71.4     0/0   0.0
Damian Ginobili        25    4    1    1   0   2/4    50.0     0/0   0.0
Larry Wade             25    4    4    0   0   2/3    66.7     0/0   0.0
Vince Lillard          25    2    6    0   0   1/2    50.0     0/0   0.0
Ayo Barrett            25    0    0    1   0   0/2     0.0     0/0   0.0

TEAM: FG: 10/18 (55.6%), 3PT: 0/4 (0.0%), REB: 11 (4 off, 7 def), AST: 3, TO: 3
TEAM FOULS: 5 [Team_050 in BONUS]

================================================================================

================================================================================
                       4TH QUARTER - Team_050 vs Team_099                       
================================================================================

[12:00] Substitution (Team_050): Giannis LaVine OUT (stamina: 69) → Damian O'Neal IN (comeback_detected)

[12:00] Substitution (Team_099): Ayo Barrett OUT (stamina: 71) → CJ Cunningham IN (comeback_detected)

[12:00] Team_050 possession (Score: 63-80)
Joel Banchero attempts a Midrange. Contested by Damian Ginobili (3.7 feet, ZONE). Joel Banchero misses. Rebound secured by Larry Wade.

[11:44] Team_099 possession (Score: 63-80)
Vince Lillard attempts a Midrange. Wide open! Damian O'Neal is 6.3 feet away. [ZONE] VINCE LILLARD MAKES IT!
Score: 63-82

[11:25] Team_050 possession (Score: 63-82)
Damian O'Neal attempts a 3Pt. Contested by Damian Ginobili (4.0 feet, ZONE). Damian O'Neal misses. Rebound secured by Larry Wade.

[11:10] Team_099 possession (Score: 63-82)
Larry James loses the ball! Stripped by Joel Banchero! TURNOVER! (live ball)

[10:56] Team_050 possession (Score: 63-82)
Collin Bane makes the Dunk and draws the foul on Larry James! And-1! Collin Bane to the line for 1. [Team fouls: 1] (Larry James: 1 personal fouls)   FT 1/1: GOOD Collin Bane makes 1/1 from the line.
Score: 66-82

[10:39] Team_099 possession (Score: 66-82)
Vince Lillard makes the Midrange and draws the foul on LeBron Bridges! And-1! Vince Lillard to the line for 1. [Team fouls: 1] (LeBron Bridges: 1 personal fouls)   FT 1/1: GOOD Vince Lillard makes 1/1 from the line.
Score: 66-85

[10:23] Team_050 possession (Score: 66-85)
Donovan Trent drives and kicks out. Damian O'Neal attempts a 3Pt. Contested by CJ Cunningham (5.8 feet, MAN). DAMIAN O'NEAL MAKES IT! Assist: Collin Bane
Score: 69-85

[10:07] Team_099 possession (Score: 69-85)
Larry Wade drives, Donovan Trent stays with him. Larry Wade attempts a Layup. Contested by Donovan Trent (5.6 feet, MAN). LARRY WADE MAKES IT! Assist: Vince Lillard
Score: 69-87

[09:54] Team_050 possession (Score: 69-87)
FOUL! Shooting foul on CJ Cunningham. Damian O'Neal to the line for 2 free throws. [Team fouls: 2] (CJ Cunningham: 1 personal fouls)   FT 1/2: GOOD   FT 2/2: GOOD Damian O'Neal makes 2/2 from the line.
Score: 71-87

[09:41] Team_099 possession (Score: 71-87)
CJ Cunningham attempts a 3Pt. Contested by Joel Banchero (5.0 feet, ZONE). CJ Cunningham misses. Rebound secured by Joel Banchero.

[09:28] Team_050 possession (Score: 71-87)
Collin Bane drives to the basket... Collin Bane throws a bad pass! Stolen by Damian Ginobili! TURNOVER! (live ball)

[09:13] Team_099 possession (Score: 71-87)
Larry Wade attempts a Midrange. Contested by LeBron Bridges (5.2 feet, ZONE). LARRY WADE MAKES IT! Assist: CJ Cunningham
Score: 71-89

[09:01] Team_050 possession (Score: 71-89)
FOUL! Offensive foul on Joel Banchero! Larry James drew the charge! [Team fouls: 2] (Joel Banchero: 1 personal fouls) TURNOVER! (dead ball)

[08:46] Team_099 possession (Score: 71-89)
CJ Cunningham attempts a 3Pt. Wide open! Damian O'Neal is 6.5 feet away. [MAN] CJ CUNNINGHAM MAKES IT!
Score: 71-92

[08:31] Team_050 possession (Score: 71-92)
Damian O'Neal attempts a Layup. BLOCKED BY VINCE LILLARD! Ball is loose! Rebound secured by Damian Ginobili.

[08:14] Team_099 possession (Score: 71-92)
Vince Lillard attempts a Midrange. Contested by Joel Banchero (4.9 feet, ZONE). Vince Lillard misses. FOUL! Loose ball foul on Collin Bane during the rebound battle. [Team fouls: 3] No free throws, side out. (Collin Bane: 1 personal fouls)

[08:00] Team_099 possession (Score: 71-92)
Vince Lillard drives, LeBron Bridges stays with him. Vince Lillard attempts a Layup. Contested by LeBron Bridges (5.2 feet, MAN). Vince Lillard misses. Rebound secured by Collin Bane.

[07:43] Team_050 possession (Score: 71-92)
FOUL! Holding foul on Damian Ginobili. [Team fouls: 3] No free throws, side out. (Damian Ginobili: 1 personal fouls)

[07:29] Team_050 possession (Score: 71-92)
LeBron Bridges attempts a Layup. Contested by Vince Lillard (3.7 feet, MAN). LeBron Bridges misses. Rebound secured by Vince Lillard.

[07:16] Team_099 possession (Score: 71-92)
Larry James attempts a 3Pt. Contested by Joel Banchero (5.1 feet, ZONE). Larry James misses. Offensive rebound by Larry Wade! Larry Wade kicks it out.

[07:02] Team_099 possession (Score: 71-92)
Larry James attempts a 3Pt. Contested by Joel Banchero (5.2 feet, ZONE). Larry James misses. Rebound secured by Collin Bane.

[06:48] Team_050 possession (Score: 71-92)
FOUL! Reach-in foul on Larry James during the drive. [Team fouls: 4] No free throws, side out. (Larry James: 2 personal fouls)

[06:38] Team_050 possession (Score: 71-92)
Damian O'Neal attempts a 3Pt. Contested by CJ Cunningham (5.9 feet, ZONE). Damian O'Neal misses. Rebound secured by Damian Ginobili.

[06:26] Team_099 possession (Score: 71-92)
Larry James attempts a Layup. BLOCKED BY DONOVAN TRENT! Ball is loose! Rebound secured by LeBron Bridges.

[06:12] Team_050 possession (Score: 71-92)
Collin Bane attempts a 3Pt. Contested by Damian Ginobili (4.8 feet, MAN). COLLIN BANE MAKES IT! Assist: Damian O'Neal
Score: 74-92

[05:55] Team_099 possession (Score: 74-92)
FOUL! Offensive foul on Damian Ginobili! Collin Bane drew the charge! [Team fouls: 5] (Damian Ginobili: 2 personal fouls) TURNOVER! (dead ball)

[05:41] Team_050 possession (Score: 74-92)
Joel Banchero drives and kicks out. Joel Banchero attempts a Midrange. Wide open! Larry James is 6.0 feet away. [MAN] JOEL BANCHERO MAKES IT!
Score: 76-92

[05:28] Team_099 possession (Score: 76-92)
Larry James makes the 3Pt and draws the foul on Joel Banchero! And-1! Larry James to the line for 1. [Team fouls: 4] (Joel Banchero: 2 personal fouls)   FT 1/1: GOOD Larry James makes 1/1 from the line.
Score: 76-96

[05:14] Team_050 possession (Score: 76-96)
Donovan Trent attempts a Midrange. Contested by Vince Lillard (3.9 feet, ZONE). Donovan Trent misses. Rebound secured by Damian Ginobili.

[05:02] Team_099 possession (Score: 76-96)
Larry Wade attempts a Layup. Wide open! Donovan Trent is 6.3 feet away. [ZONE] LARRY WADE MAKES IT! Assist: Larry James
Score: 76-98

[04:43] Team_050 possession (Score: 76-98)
LeBron Bridges drives and kicks out. Damian O'Neal attempts a 3Pt. Contested by CJ Cunningham (5.9 feet, ZONE). Damian O'Neal misses. Rebound secured by Damian Ginobili.

[04:30] Team_099 possession (Score: 76-98)
FOUL! Reach-in foul on Donovan Trent during the drive. [IN THE BONUS! 5 team fouls] Larry Wade to the line for 2 free throws. (Donovan Trent: 1 personal fouls)   FT 1/2: GOOD   FT 2/2: GOOD Larry Wade makes 2/2 from the line.
Score: 76-100

[04:17] Team_050 possession (Score: 76-100)
FOUL! Reach-in foul on Damian Ginobili during the drive. [IN THE BONUS! 6 team fouls] Collin Bane to the line for 2 free throws. (Damian Ginobili: 3 personal fouls)   FT 1/2: GOOD   FT 2/2: MISS Collin Bane makes 1/2 from the line. Rebound secured by Larry Wade.
Score: 77-100

[03:58] Team_099 possession (Score: 77-100)
Vince Lillard drives to the basket... Vince Lillard commits a violation (traveling/carry)! TURNOVER! (dead ball)

[03:58] Substitution (Team_050): Joel Banchero OUT → Dwyane Towns IN (stamina_rule2)

[03:58] Substitution (Team_050): Collin Bane OUT → Larry Curry IN (stamina_rule2)

[03:58] Substitution (Team_050): LeBron Bridges OUT → Luka Gasol IN (stamina_rule2)

[03:58] Substitution (Team_050): Donovan Trent OUT → Tyler Smith IN (stamina_rule2)

[03:58] Substitution (Team_099): Larry James OUT → Manu Johnson IN (stamina_rule2)

[03:58] Substitution (Team_099): Damian Ginobili OUT → Scottie Quickley IN (stamina_rule2)

[03:58] Substitution (Team_099): Vince Lillard OUT → Donovan Green IN (stamina_rule2)

[03:58] Substitution (Team_099): Larry Wade OUT → Jarrett Fox IN (stamina_rule2)

[03:48] Team_050 possession (Score: 77-100)
FOUL! Reach-in foul on Donovan Green during the drive. [IN THE BONUS! 7 team fouls] Luka Gasol to the line for 2 free throws. (Donovan Green: 1 personal fouls)   FT 1/2: MISS   FT 2/2: GOOD Luka Gasol makes 1/2 from the line.
Score: 78-100

[03:30] Team_099 possession (Score: 78-100)
Scottie Quickley attempts a 3Pt. Contested by Larry Curry (5.2 feet, MAN). SCOTTIE QUICKLEY MAKES IT! Assist: Donovan Green
Score: 78-103

[03:16] Team_050 possession (Score: 78-103)
Luka Gasol attempts a Midrange. Contested by Donovan Green (3.9 feet, ZONE). Luka Gasol misses. Rebound secured by Scottie Quickley.

[03:04] Team_099 possession (Score: 78-103)
CJ Cunningham attempts a 3Pt. Contested by Luka Gasol (5.1 feet, ZONE). CJ CUNNINGHAM MAKES IT! Assist: Scottie Quickley
Score: 78-106

[02:53] Team_050 possession (Score: 78-106)
Dwyane Towns attempts a Layup. Contested by Manu Johnson (5.1 feet, MAN). DWYANE TOWNS MAKES IT! Assist: Luka Gasol
Score: 80-106

[02:37] Team_099 possession (Score: 80-106)
Jarrett Fox makes the Layup and draws the foul on Dwyane Towns! And-1! Jarrett Fox to the line for 1. [BONUS: 6 team fouls] (Dwyane Towns: 1 personal fouls)   FT 1/1: GOOD Jarrett Fox makes 1/1 from the line.
Score: 80-109

[02:20] Team_050 possession (Score: 80-109)
Luka Gasol attempts a 3Pt. Contested by Manu Johnson (4.9 feet, ZONE). Luka Gasol misses. Rebound secured by Jarrett Fox.

[02:07] Team_099 possession (Score: 80-109)
CJ Cunningham drives to the basket... CJ Cunningham loses the ball! Stripped by Damian O'Neal! TURNOVER! (live ball)

[01:53] Team_050 possession (Score: 80-109)
Luka Gasol attempts a Layup. Contested by Jarrett Fox (4.0 feet, ZONE). LUKA GASOL MAKES IT!
Score: 82-109

[01:36] Team_099 possession (Score: 82-109)
FOUL! Holding foul on Dwyane Towns. [IN THE BONUS! 7 team fouls] Manu Johnson to the line for 2 free throws. (Dwyane Towns: 2 personal fouls)   FT 1/2: MISS   FT 2/2: MISS Manu Johnson makes 0/2 from the line. Rebound secured by Larry Curry.

[01:19] Team_050 possession (Score: 82-109)
Damian O'Neal attempts a Midrange. Wide open! CJ Cunningham is 6.2 feet away. [MAN] Damian O'Neal misses. Rebound secured by Jarrett Fox.

[01:05] Team_099 possession (Score: 82-109)
Manu Johnson drives and kicks out. Jarrett Fox attempts a Midrange. Contested by Tyler Smith (5.2 feet, MAN). Jarrett Fox misses. Offensive rebound by Jarrett Fox! Jarrett Fox's putback is no good. Rebound secured by Tyler Smith.

[00:50] Team_050 possession (Score: 82-109)
Larry Curry drives and kicks out. Luka Gasol attempts a 3Pt. Contested by Scottie Quickley (4.0 feet, ZONE). Luka Gasol misses. FOUL! Loose ball foul on Scottie Quickley during the rebound battle. [IN THE BONUS! 8 team fouls] Tyler Smith to the line for 2 free throws. (Scottie Quickley: 1 personal fouls)   FT 1/2: GOOD   FT 2/2: GOOD Tyler Smith makes 2/2 from the line.
Score: 84-109

[00:36] Team_099 possession (Score: 84-109)
Manu Johnson drives, Tyler Smith stays with him. Manu Johnson attempts a Dunk. Contested by Tyler Smith (5.3 feet, ZONE). MANU JOHNSON MAKES IT! Assist: Jarrett Fox
Score: 84-111

[00:25] Team_050 possession (Score: 84-111)
Tyler Smith attempts a Midrange. Contested by Jarrett Fox (4.4 feet, MAN). Tyler Smith misses. Rebound secured by Jarrett Fox.

[00:12] Team_099 possession (Score: 84-111)
Jarrett Fox attempts a Midrange. Contested by Luka Gasol (5.4 feet, ZONE). Jarrett Fox misses. Offensive rebound by Jarrett Fox! Jarrett Fox puts it back in!
Score: 84-113

[00:01] Team_050 possession (Score: 84-113)
Larry Curry attempts a Layup. Contested by Jarrett Fox (4.1 feet, ZONE). Larry Curry misses. Rebound secured by Donovan Green.

================================================================================
                              4TH QUARTER COMPLETE                              
================================================================================

4TH QUARTER SCORE: Team_050 21, Team_099 33

BOX SCORE:
================================================================================

Team_050
--------------------------------------------------------------------------------
Player                MIN  PTS  REB  AST  TO      FG   FG%      3P   3P%
--------------------------------------------------------------------------------
Collin Bane            34    6    2    1   0   2/3    66.7     0/0   0.0
Damian O'Neal          23    5    0    1   0   2/6    33.3     0/0   0.0
Luka Gasol             15    3    0    1   0   2/4    50.0     0/0   0.0
Joel Banchero          34    2    1    0   0   1/2    50.0     0/0   0.0
Dwyane Towns           15    2    0    0   0   1/1   100.0     0/0   0.0
Tyler Smith            15    2    1    0   0   1/2    50.0     0/0   0.0
LeBron Bridges         34    0    1    0   0   0/2     0.0     0/0   0.0
Donovan Trent          34    0    0    0   0   0/1     0.0     0/0   0.0
Larry Curry            15    0    1    0   0   0/1     0.0     0/0   0.0

TEAM: FG: 9/22 (40.9%), 3PT: 1/4 (25.0%), REB: 5 (0 off, 5 def), AST: 3, TO: 2
TEAM FOULS: 7 [Team_099 in BONUS]


Team_099
--------------------------------------------------------------------------------
Player                MIN  PTS  REB  AST  TO      FG   FG%      3P   3P%
--------------------------------------------------------------------------------
Larry Wade             34    8    5    0   0   4/4   100.0     0/0   0.0
CJ Cunningham          23    6    0    1   0   2/3    66.7     0/0   0.0
Vince Lillard          34    5    1    1   0   2/3    66.7     0/0   0.0
Jarrett Fox            15    5    4    1   0   2/2   100.0     0/0   0.0
Larry James            34    4    0    1   0   1/3    33.3     0/0   0.0
Scottie Quickley       15    3    1    1   0   1/1   100.0     0/0   0.0
Manu Johnson           15    2    0    0   0   1/2    50.0     0/0   0.0
Damian Ginobili        34    0    4    0   0   0/0     0.0     0/0   0.0
Donovan Green          15    0    1    1   0   0/0     0.0     0/0   0.0

TEAM: FG: 13/19 (68.4%), 3PT: 4/6 (66.7%), REB: 17 (4 off, 13 def), AST: 6, TO: 4
TEAM FOULS: 8 [Team_050 in BONUS]

================================================================================

================================================================================
                               FULL GAME COMPLETE                               
================================================================================

FINAL SCORE: Team_050 84, Team_099 113

SCORING BY QUARTER:
--------------------------------------------------------------------------------
Team                     Q1     Q2     Q3     Q4    FINAL
--------------------------------------------------------------------------------
Team_050                 18     21     24     21       84
Team_099                 30     30     20     33      113
--------------------------------------------------------------------------------

FULL GAME BOX SCORE:
================================================================================

Team_050
--------------------------------------------------------------------------------
Player                MIN  PTS  REB  AST  TO      FG   FG%      3P   3P%      FT STL BLK
--------------------------------------------------------------------------------
Joel Banchero          34    9    4    1   1   5/10   50.0   1/2    50.0   0/0     1   0
Collin Bane            34   13   14    2   1   5/16   31.2   2/5    40.0   5/8     0   0
LeBron Bridges         34    8    7    3   4   3/7    42.9   2/2   100.0   0/0     1   0
Donovan Trent          34   10    0    4   1   4/8    50.0   0/0     0.0   1/1     1   1
Giannis LaVine         25   13    0    2   1   6/10   60.0   1/3    33.3   2/3     2   0
Damian O'Neal          23    7    0    2   0   2/7    28.6   0/2     0.0   2/2     1   0
Dwyane Towns           15    6    3    1   1   4/6    66.7   0/1     0.0   0/0     0   0
Larry Curry            15   10    2    0   1   5/9    55.6   1/1   100.0   4/4     0   0
Luka Gasol             15    5    0    1   2   2/5    40.0   0/1     0.0   1/2     0   0
Tyler Smith            15    2    7    2   0   0/3     0.0   0/0     0.0   2/2     0   0

TEAM: FG: 36/81 (44.4%), 3PT: 7/17 (41.2%), REB: 35 (5 off, 30 def), AST: 18, TO: 12


Team_099
--------------------------------------------------------------------------------
Player                MIN  PTS  REB  AST  TO      FG   FG%      3P   3P%      FT STL BLK
--------------------------------------------------------------------------------
Larry James            34   23    0    4   3   9/16   56.2   3/8    37.5   4/4     0   0
Damian Ginobili        34    9    8    2   1   4/9    44.4   0/4     0.0   1/1     1   0
Vince Lillard          34   12   14    2   1   5/7    71.4   1/1   100.0   1/1     1   2
Larry Wade             34   18   14    1   4   8/10   80.0   0/1     0.0   4/4     0   0
Ayo Barrett            25    7    0    3   2   3/6    50.0   1/3    33.3   4/4     0   0
CJ Cunningham          23    9    0    2   1   3/7    42.9   2/4    50.0   1/1     0   0
Manu Johnson           15    4    0    1   0   1/4    25.0   0/2     0.0   0/2     1   0
Scottie Quickley       15    6    4    1   0   3/5    60.0   1/3    33.3   1/2     0   0
Donovan Green          15    9    4    2   0   4/7    57.1   0/2     0.0   1/1     1   0
Jarrett Fox            15   16   11    2   0   6/6   100.0   1/1   100.0   2/2     0   0

TEAM: FG: 47/79 (59.5%), 3PT: 9/29 (31.0%), REB: 56 (12 off, 44 def), AST: 20, TO: 12

================================================================================
