================================================================================
                        FULL GAME - Team_039 vs Team_088                        
================================================================================

================================================================================
                       1ST QUARTER - Team_039 vs Team_088                       
================================================================================

[12:00] Team_039 possession (Score: 0-0)
Austin O'Neal attempts a Layup. Contested by Tyler Hyland (4.6 feet, MAN). AUSTIN O'NEAL MAKES IT! Assist: Jrue Bridges
Score: 2-0

[11:45] Team_088 possession (Score: 2-0)
Giannis Smith drives to the basket... Giannis Smith commits a violation (traveling/carry)! TURNOVER! (dead ball)

[11:31] Team_039 possession (Score: 2-0)
FOUL! Offensive foul on Klay Wade! Allen Ming drew the charge! [Team fouls: 1] (Klay Wade: 1 personal fouls) TURNOVER! (dead ball)

[11:18] Team_088 possession (Score: 2-0)
Josh Duncan attempts a 3Pt. Contested by Jrue Bridges (3.1 feet, ZONE). Josh Duncan misses. Rebound secured by Austin O'Neal.

[11:02] Team_039 possession (Score: 2-0)
Austin O'Neal drives and kicks out. Donovan Markkanen attempts a Midrange. Contested by Tobias Haliburton (5.0 feet, MAN). Donovan Markkanen misses. Rebound secured by Tyler Hyland.

[10:46] Team_088 possession (Score: 2-0)
Josh Duncan commits a violation (traveling/carry)! TURNOVER! (dead ball)

[10:35] Team_039 possession (Score: 2-0)
Anfernee Carter attempts a Layup. Contested by Giannis Smith (4.2 feet, MAN). ANFERNEE CARTER MAKES IT! Assist: Donovan Markkanen
Score: 4-0

[10:22] Team_088 possession (Score: 4-0)
Giannis Smith attempts a Midrange. Contested by Austin O'Neal (4.1 feet, ZONE). Giannis Smith misses. Rebound secured by Klay Wade.

[10:05] Team_039 possession (Score: 4-0)
Klay Wade attempts a 3Pt. Contested by Tobias Haliburton (5.6 feet, ZONE). Klay Wade misses. Rebound secured by Allen Ming.

[09:50] Team_088 possession (Score: 4-0)
Allen Ming drives, Klay Wade stays with him. Allen Ming attempts a Layup. Contested by Klay Wade (4.2 feet, MAN). ALLEN MING MAKES IT! Assist: Tyler Hyland
Score: 4-2

[09:37] Team_039 possession (Score: 4-2)
Jrue Bridges attempts a 3Pt. Contested by Tobias Haliburton (5.2 feet, ZONE). Jrue Bridges misses. Rebound secured by Giannis Smith.

[09:20] Team_088 possession (Score: 4-2)
Tyler Hyland attempts a 3Pt. Contested by Austin O'Neal (3.8 feet, MAN). Tyler Hyland misses. Rebound secured by Austin O'Neal.

[09:03] Team_039 possession (Score: 4-2)
Jrue Bridges attempts a 3Pt. Contested by Tobias Haliburton (5.2 feet, ZONE). JRUE BRIDGES MAKES IT! Assist: Donovan Markkanen
Score: 7-2

[08:46] Team_088 possession (Score: 7-2)
Tyler Hyland attempts a Layup. BLOCKED BY AUSTIN O'NEAL! Ball is loose! Offensive rebound by Allen Ming! Allen Ming kicks it out.

[08:31] Team_088 possession (Score: 7-2)
Tyler Hyland attempts a 3Pt. Contested by Jrue Bridges (3.0 feet, ZONE). Tyler Hyland misses. Rebound secured by Klay Wade.

[08:17] Team_039 possession (Score: 7-2)
Anfernee Carter makes the Layup and draws the foul on Allen Ming! And-1! Anfernee Carter to the line for 1. [Team fouls: 1] (Allen Ming: 1 personal fouls)   FT 1/1: GOOD Anfernee Carter makes 1/1 from the line.
Score: 10-2

[08:02] Team_088 possession (Score: 10-2)
Giannis Smith makes the Dunk and draws the foul on Klay Wade! And-1! Giannis Smith to the line for 1. [Team fouls: 3] (Klay Wade: 2 personal fouls)   FT 1/1: GOOD Giannis Smith makes 1/1 from the line.
Score: 10-5

[07:50] Team_039 possession (Score: 10-5)
Jrue Bridges drives and kicks out. Anfernee Carter attempts a 3Pt. Contested by Tobias Haliburton (5.0 feet, ZONE). ANFERNEE CARTER MAKES IT! Assist: Donovan Markkanen
Score: 13-5

[07:38] Team_088 possession (Score: 13-5)
Giannis Smith attempts a 3Pt. Contested by Jrue Bridges (3.3 feet, ZONE). Giannis Smith misses. Rebound secured by Austin O'Neal.

[07:26] Team_039 possession (Score: 13-5)
Klay Wade attempts a Layup. Contested by Allen Ming (4.8 feet, MAN). KLAY WADE MAKES IT! Assist: Austin O'Neal
Score: 15-5

[07:11] Team_088 possession (Score: 15-5)
Josh Duncan loses control! Ball rolls out of bounds! TURNOVER! (dead ball)

[06:57] Team_039 possession (Score: 15-5)
Donovan Markkanen attempts a 3Pt. Contested by Tobias Haliburton (5.3 feet, MAN). DONOVAN MARKKANEN MAKES IT! Assist: Jrue Bridges
Score: 18-5

[06:41] Team_088 possession (Score: 18-5)
Tyler Hyland attempts a 3Pt. Contested by Jrue Bridges (3.0 feet, ZONE). TYLER HYLAND MAKES IT! Assist: Giannis Smith
Score: 18-8

[06:30] Team_039 possession (Score: 18-8)
Anfernee Carter attempts a 3Pt. Contested by Tobias Haliburton (5.3 feet, ZONE). ANFERNEE CARTER MAKES IT! Assist: Austin O'Neal
Score: 21-8

[06:17] Team_088 possession (Score: 21-8)
Tyler Hyland drives, Klay Wade stays with him. Tyler Hyland attempts a Layup. Contested by Klay Wade (3.9 feet, ZONE). TYLER HYLAND MAKES IT!
Score: 21-10

[06:00] Team_039 possession (Score: 21-10)
Anfernee Carter attempts a 3Pt. Contested by Giannis Smith (4.2 feet, MAN). Anfernee Carter misses. Rebound secured by Allen Ming.

[05:47] Team_088 possession (Score: 21-10)
FOUL! Reach-in foul on Klay Wade during the drive. [Team fouls: 4] No free throws, side out. (Klay Wade: 3 personal fouls)

[05:32] Team_088 possession (Score: 21-10)
Tyler Hyland drives to the basket... Tyler Hyland throws a bad pass out of bounds! TURNOVER! (dead ball)

[05:16] Team_039 possession (Score: 21-10)
Austin O'Neal drives to the basket... Austin O'Neal throws a bad pass! Stolen by Tyler Hyland! TURNOVER! (live ball)

[05:03] Team_088 possession (Score: 21-10)
Allen Ming drives, Klay Wade stays with him. Allen Ming attempts a Dunk. Contested by Klay Wade (4.2 feet, MAN). ALLEN MING MAKES IT!
Score: 21-12

[04:51] Team_039 possession (Score: 21-12)
Austin O'Neal attempts a Midrange. Contested by Tyler Hyland (4.7 feet, MAN). Austin O'Neal misses. Offensive rebound by Austin O'Neal! Austin O'Neal kicks it out.

[04:38] Team_039 possession (Score: 21-12)
Austin O'Neal attempts a 3Pt. Contested by Tyler Hyland (4.7 feet, MAN). Austin O'Neal misses. Rebound secured by Tyler Hyland.

[04:26] Team_088 possession (Score: 21-12)
FOUL! Shooting foul on Klay Wade. Allen Ming to the line for 2 free throws. [BONUS: 5 team fouls] (Klay Wade: 4 personal fouls)   FT 1/2: GOOD   FT 2/2: GOOD Allen Ming makes 2/2 from the line.
Score: 21-14

[04:08] Team_039 possession (Score: 21-14)
Austin O'Neal attempts a 3Pt. Contested by Tobias Haliburton (5.2 feet, ZONE). AUSTIN O'NEAL MAKES IT! Assist: Klay Wade
Score: 24-14

[03:51] Team_088 possession (Score: 24-14)
Allen Ming attempts a Midrange. Contested by Klay Wade (4.3 feet, MAN). Allen Ming misses. Rebound secured by Donovan Markkanen.

[03:37] Team_039 possession (Score: 24-14)
Anfernee Carter makes the Midrange and draws the foul on Giannis Smith! And-1! Anfernee Carter to the line for 1. [Team fouls: 2] (Giannis Smith: 1 personal fouls)   FT 1/1: GOOD Anfernee Carter makes 1/1 from the line.
Score: 27-14

[03:19] Team_088 possession (Score: 27-14)
Josh Duncan attempts a 3Pt. Contested by Jrue Bridges (3.3 feet, ZONE). Josh Duncan misses. Rebound secured by Klay Wade.

[03:04] Team_039 possession (Score: 27-14)
Donovan Markkanen drives to the basket... Donovan Markkanen throws a bad pass! Stolen by Tobias Haliburton! TURNOVER! (live ball)

[02:52] Team_088 possession (Score: 27-14)
Josh Duncan attempts a 3Pt. Contested by Jrue Bridges (3.4 feet, ZONE). Josh Duncan misses. Rebound secured by Donovan Markkanen.

[02:35] Team_039 possession (Score: 27-14)
Jrue Bridges drives, picks up Giannis Smith. Help arrives from Tobias Haliburton! Jrue Bridges attempts a Dunk. Contested by Tobias Haliburton (4.5 feet, ZONE). Jrue Bridges misses. Offensive rebound by Austin O'Neal! Austin O'Neal kicks it out.

[02:20] Team_039 possession (Score: 27-14)
Anfernee Carter attempts a Midrange. Contested by Giannis Smith (4.6 feet, MAN). ANFERNEE CARTER MAKES IT!
Score: 29-14

[02:05] Team_088 possession (Score: 29-14)
Tobias Haliburton attempts a 3Pt. Contested by Jrue Bridges (3.4 feet, ZONE). TOBIAS HALIBURTON MAKES IT! Assist: Giannis Smith
Score: 29-17

[01:53] Team_039 possession (Score: 29-17)
Austin O'Neal makes the Dunk and draws the foul on Giannis Smith! And-1! Austin O'Neal to the line for 1. [Team fouls: 3] (Giannis Smith: 2 personal fouls)   FT 1/1: GOOD Austin O'Neal makes 1/1 from the line.
Score: 32-17

[01:43] Team_088 possession (Score: 32-17)
Josh Duncan attempts a 3Pt. Contested by Jrue Bridges (3.5 feet, MAN). Josh Duncan misses. Rebound secured by Klay Wade.

[01:26] Team_039 possession (Score: 32-17)
Austin O'Neal throws a bad pass out of bounds! TURNOVER! (dead ball)

[01:26] Substitution (Team_039): Jrue Bridges OUT → Tracy Mitchell IN (stamina_rule2)

[01:26] Substitution (Team_039): Donovan Markkanen OUT → Jayson Cunningham IN (stamina_rule2)

[01:26] Substitution (Team_039): Austin O'Neal OUT → Yao Carter IN (stamina_rule2)

[01:26] Substitution (Team_039): Anfernee Carter OUT → Victor Gasol IN (stamina_rule2)

[01:26] Substitution (Team_039): Klay Wade OUT → Bam Booker IN (stamina_rule2)

[01:26] Substitution (Team_088): Josh Duncan OUT → Klay Quickley IN (stamina_rule2)

[01:26] Substitution (Team_088): Tobias Haliburton OUT → Vince Carter IN (stamina_rule2)

[01:26] Substitution (Team_088): Tyler Hyland OUT → Pau Bird IN (stamina_rule2)

[01:26] Substitution (Team_088): Giannis Smith OUT → Zion Harris IN (stamina_rule2)

[01:26] Substitution (Team_088): Allen Ming OUT → Josh Embiid IN (stamina_rule2)

[01:08] Team_088 possession (Score: 32-17)
Josh Embiid makes the Layup and draws the foul on Tracy Mitchell! And-1! Josh Embiid to the line for 1. [BONUS: 6 team fouls] (Tracy Mitchell: 1 personal fouls)   FT 1/1: GOOD Josh Embiid makes 1/1 from the line.
Score: 32-20

[00:51] Team_039 possession (Score: 32-20)
FOUL! Holding foul on Josh Embiid. [Team fouls: 4] No free throws, side out. (Josh Embiid: 1 personal fouls)

[00:39] Team_039 possession (Score: 32-20)
Tracy Mitchell drives, Klay Quickley stays with him. Tracy Mitchell attempts a Layup. Wide open! Klay Quickley is 6.4 feet away. [MAN] TRACY MITCHELL MAKES IT! Assist: Yao Carter
Score: 34-20

[00:23] Team_088 possession (Score: 34-20)
Vince Carter attempts a 3Pt. Contested by Tracy Mitchell (5.4 feet, ZONE). Vince Carter misses. Rebound secured by Victor Gasol.

[00:10] Team_039 possession (Score: 34-20)
Jayson Cunningham drives and kicks out. Yao Carter attempts a 3Pt. Contested by Pau Bird (5.0 feet, MAN). Yao Carter misses. Rebound secured by Josh Embiid.

================================================================================
                              1ST QUARTER COMPLETE                              
================================================================================

1ST QUARTER SCORE: Team_039 34, Team_088 20

BOX SCORE:
================================================================================

Team_039
--------------------------------------------------------------------------------
Player                MIN  PTS  REB  AST  TO      FG   FG%      3P   3P%
--------------------------------------------------------------------------------
Anfernee Carter        11   16    0    0   0   6/7    85.7     0/0   0.0
Austin O'Neal          11    8    5    2   0   3/5    60.0     0/0   0.0
Jrue Bridges           11    3    0    2   0   1/2    50.0     0/0   0.0
Donovan Markkanen      11    3    2    3   0   1/1   100.0     0/0   0.0
Klay Wade              11    2    4    1   0   1/2    50.0     0/0   0.0
Tracy Mitchell          1    2    0    0   0   1/1   100.0     0/0   0.0
Yao Carter              1    0    0    1   0   0/0     0.0     0/0   0.0
Victor Gasol            1    0    1    0   0   0/0     0.0     0/0   0.0
Jayson Cunningham       1    0    0    0   0   0/1     0.0     0/0   0.0

TEAM: FG: 13/19 (68.4%), 3PT: 4/8 (50.0%), REB: 12 (2 off, 10 def), AST: 9, TO: 4
TEAM FOULS: 6 [Team_088 in BONUS]


Team_088
--------------------------------------------------------------------------------
Player                MIN  PTS  REB  AST  TO      FG   FG%      3P   3P%
--------------------------------------------------------------------------------
Allen Ming             11    6    3    0   0   3/4    75.0     0/0   0.0
Tyler Hyland           11    5    2    1   0   2/4    50.0     0/0   0.0
Giannis Smith          11    3    1    2   0   1/3    33.3     0/0   0.0
Tobias Haliburton      11    3    0    0   0   1/1   100.0     0/0   0.0
Josh Embiid             1    3    1    0   0   1/1   100.0     0/0   0.0
Josh Duncan            11    0    0    0   0   0/4     0.0     0/0   0.0
Vince Carter            1    0    0    0   0   0/1     0.0     0/0   0.0

TEAM: FG: 8/18 (44.4%), 3PT: 2/10 (20.0%), REB: 7 (1 off, 6 def), AST: 3, TO: 4
TEAM FOULS: 4

================================================================================

================================================================================
                       2ND QUARTER - Team_039 vs Team_088                       
================================================================================

[12:00] Team_039 possession (Score: 34-20)
Austin O'Neal attempts a 3Pt. Contested by Tobias Haliburton (5.2 feet, ZONE). Austin O'Neal misses. Rebound secured by Tyler Hyland.

[11:45] Team_088 possession (Score: 34-20)
Josh Duncan drives to the basket... Josh Duncan throws a bad pass! Stolen by Klay Wade! TURNOVER! (live ball)

[11:34] Team_039 possession (Score: 34-20)
Anfernee Carter attempts a 3Pt. Contested by Giannis Smith (4.5 feet, MAN). ANFERNEE CARTER MAKES IT!
Score: 37-20

[11:23] Team_088 possession (Score: 37-20)
Josh Duncan attempts a 3Pt. Contested by Jrue Bridges (3.4 feet, MAN). Josh Duncan misses. Rebound secured by Donovan Markkanen.

[11:07] Team_039 possession (Score: 37-20)
FOUL! Shooting foul on Tyler Hyland. Austin O'Neal to the line for 3 free throws. [Team fouls: 1] (Tyler Hyland: 1 personal fouls)   FT 1/3: GOOD   FT 2/3: GOOD   FT 3/3: GOOD Austin O'Neal makes 3/3 from the line.
Score: 40-20

[10:54] Team_088 possession (Score: 40-20)
Giannis Smith attempts a 3Pt. Contested by Klay Wade (4.3 feet, MAN). Giannis Smith misses. Rebound secured by Austin O'Neal.

[10:37] Team_039 possession (Score: 40-20)
Jrue Bridges attempts a 3Pt. Contested by Josh Duncan (5.7 feet, MAN). Jrue Bridges misses. Rebound secured by Giannis Smith.

[10:23] Team_088 possession (Score: 40-20)
Tyler Hyland attempts a 3Pt. Contested by Austin O'Neal (4.2 feet, MAN). TYLER HYLAND MAKES IT! Assist: Josh Duncan
Score: 40-23

[10:10] Team_039 possession (Score: 40-23)
Donovan Markkanen attempts a 3Pt. Contested by Tobias Haliburton (5.6 feet, ZONE). DONOVAN MARKKANEN MAKES IT!
Score: 43-23

[09:54] Team_088 possession (Score: 43-23)
Tyler Hyland attempts a Midrange. Contested by Austin O'Neal (4.2 feet, ZONE). Tyler Hyland misses. Rebound secured by Austin O'Neal.

[09:36] Team_039 possession (Score: 43-23)
Anfernee Carter attempts a Midrange. Contested by Tobias Haliburton (5.6 feet, ZONE). Anfernee Carter misses. Offensive rebound by Austin O'Neal! Austin O'Neal kicks it out.

[09:21] Team_039 possession (Score: 43-23)
Anfernee Carter attempts a Midrange. Contested by Tobias Haliburton (5.6 feet, ZONE). Anfernee Carter misses. Rebound secured by Giannis Smith.

[09:04] Team_088 possession (Score: 43-23)
Allen Ming drives to the basket... FOUL! Offensive foul on Allen Ming! Klay Wade drew the charge! [Team fouls: 2] (Allen Ming: 1 personal fouls) TURNOVER! (dead ball)

[08:47] Team_039 possession (Score: 43-23)
Jrue Bridges drives and kicks out. Klay Wade attempts a 3Pt. Contested by Tobias Haliburton (5.5 feet, ZONE). KLAY WADE MAKES IT! Assist: Jrue Bridges
Score: 46-23

[08:32] Team_088 possession (Score: 46-23)
Tobias Haliburton attempts a 3Pt. Contested by Jrue Bridges (3.7 feet, ZONE). Tobias Haliburton misses. Offensive rebound by Allen Ming! Allen Ming puts it back in!
Score: 46-25

[08:15] Team_039 possession (Score: 46-25)
FOUL! Shooting foul on Allen Ming. Klay Wade to the line for 2 free throws. [Team fouls: 3] (Allen Ming: 2 personal fouls)   FT 1/2: GOOD   FT 2/2: GOOD Klay Wade makes 2/2 from the line.
Score: 48-25

[07:57] Team_088 possession (Score: 48-25)
Tyler Hyland attempts a Midrange. Contested by Austin O'Neal (4.5 feet, ZONE). Tyler Hyland misses. Rebound secured by Donovan Markkanen.

[07:47] Team_039 possession (Score: 48-25)
Jrue Bridges attempts a 3Pt. Wide open! Josh Duncan is 6.0 feet away. [MAN] Jrue Bridges misses. Rebound secured by Tyler Hyland.

[07:32] Team_088 possession (Score: 48-25)
Giannis Smith attempts a 3Pt. Contested by Jrue Bridges (4.0 feet, ZONE). Giannis Smith misses. Rebound secured by Austin O'Neal.

[07:18] Team_039 possession (Score: 48-25)
Klay Wade attempts a 3Pt. Wide open! Tobias Haliburton is 6.1 feet away. [ZONE] Klay Wade misses. Rebound secured by Tyler Hyland.

[07:01] Team_088 possession (Score: 48-25)
FOUL! Reach-in foul on Jrue Bridges during the drive. [Team fouls: 1] No free throws, side out. (Jrue Bridges: 1 personal fouls)

[06:45] Team_088 possession (Score: 48-25)
Tobias Haliburton attempts a 3Pt. Contested by Austin O'Neal (4.8 feet, ZONE). Tobias Haliburton misses. Rebound secured by Donovan Markkanen.

[06:26] Team_039 possession (Score: 48-25)
Austin O'Neal makes the Dunk and draws the foul on Tobias Haliburton! And-1! Austin O'Neal to the line for 1. [Team fouls: 4] (Tobias Haliburton: 1 personal fouls)   FT 1/1: GOOD Austin O'Neal makes 1/1 from the line.
Score: 51-25

[06:15] Team_088 possession (Score: 51-25)
Tyler Hyland drives, picks up Anfernee Carter. Help arrives from Donovan Markkanen! Tyler Hyland attempts a Dunk. Wide open! Donovan Markkanen is 7.1 feet away. [ZONE] TYLER HYLAND MAKES IT! Assist: Josh Duncan
Score: 51-27

[06:02] Team_039 possession (Score: 51-27)
Donovan Markkanen attempts a Midrange. Contested by Tyler Hyland (5.5 feet, ZONE). DONOVAN MARKKANEN MAKES IT! Assist: Jrue Bridges
Score: 53-27

[05:51] Team_088 possession (Score: 53-27)
Josh Duncan drives, Jrue Bridges stays with him. Josh Duncan attempts a Dunk. Contested by Jrue Bridges (4.1 feet, MAN). JOSH DUNCAN MAKES IT! Assist: Giannis Smith
Score: 53-29

[05:33] Team_039 possession (Score: 53-29)
Austin O'Neal attempts a 3Pt. Contested by Tyler Hyland (5.4 feet, MAN). Austin O'Neal misses. Rebound secured by Tyler Hyland.

[05:16] Team_088 possession (Score: 53-29)
Giannis Smith attempts a Layup. Contested by Klay Wade (4.9 feet, MAN). Giannis Smith misses. Rebound secured by Austin O'Neal.

[05:03] Team_039 possession (Score: 53-29)
Klay Wade attempts a 3Pt. Contested by Giannis Smith (5.6 feet, ZONE). Klay Wade misses. Rebound secured by Allen Ming.

[04:47] Team_088 possession (Score: 53-29)
FOUL! Reach-in foul on Klay Wade during the drive. [Team fouls: 2] No free throws, side out. (Klay Wade: 1 personal fouls)

[04:30] Team_088 possession (Score: 53-29)
Tobias Haliburton attempts a 3Pt. Contested by Jrue Bridges (4.3 feet, ZONE). Tobias Haliburton misses. Offensive rebound by Allen Ming! Allen Ming kicks it out.

[04:12] Team_088 possession (Score: 53-29)
FOUL! Offensive foul on Josh Duncan! Jrue Bridges drew the charge! [Team fouls: 5] (Josh Duncan: 1 personal fouls) TURNOVER! (dead ball)

[03:58] Team_039 possession (Score: 53-29)
FOUL! Reach-in foul on Giannis Smith during the drive. [IN THE BONUS! 6 team fouls] Anfernee Carter to the line for 2 free throws. (Giannis Smith: 1 personal fouls)   FT 1/2: GOOD   FT 2/2: GOOD Anfernee Carter makes 2/2 from the line.
Score: 55-29

[03:41] Team_088 possession (Score: 55-29)
Allen Ming makes the Layup and draws the foul on Klay Wade! And-1! Allen Ming to the line for 1. [Team fouls: 3] (Klay Wade: 2 personal fouls)   FT 1/1: GOOD Allen Ming makes 1/1 from the line.
Score: 55-32

[03:24] Team_039 possession (Score: 55-32)
Jrue Bridges attempts a 3Pt. Wide open! Josh Duncan is 6.5 feet away. [MAN] JRUE BRIDGES MAKES IT! Assist: Donovan Markkanen
Score: 58-32

[03:10] Team_088 possession (Score: 58-32)
Giannis Smith attempts a Midrange. Contested by Klay Wade (5.2 feet, MAN). Giannis Smith misses. Offensive rebound by Allen Ming! Allen Ming kicks it out.

[02:55] Team_088 possession (Score: 58-32)
Tobias Haliburton makes the Layup and draws the foul on Austin O'Neal! And-1! Tobias Haliburton to the line for 1. [Team fouls: 4] (Austin O'Neal: 1 personal fouls)   FT 1/1: GOOD Tobias Haliburton makes 1/1 from the line.
Score: 58-35

[02:40] Team_039 possession (Score: 58-35)
Anfernee Carter drives and kicks out. Austin O'Neal attempts a Midrange. Wide open! Tobias Haliburton is 6.4 feet away. [ZONE] AUSTIN O'NEAL MAKES IT! Assist: Donovan Markkanen
Score: 60-35

[02:25] Team_088 possession (Score: 60-35)
Josh Duncan attempts a 3Pt. Contested by Jrue Bridges (4.6 feet, ZONE). Josh Duncan misses. FOUL! Loose ball foul on Klay Wade during the rebound battle. [IN THE BONUS! 5 team fouls] Giannis Smith to the line for 2 free throws. (Klay Wade: 3 personal fouls)   FT 1/2: MISS   FT 2/2: GOOD Giannis Smith makes 1/2 from the line.
Score: 60-36

[02:14] Team_039 possession (Score: 60-36)
Donovan Markkanen attempts a Midrange. Wide open! Tobias Haliburton is 6.5 feet away. [MAN] DONOVAN MARKKANEN MAKES IT! Assist: Jrue Bridges
Score: 62-36

[01:59] Team_088 possession (Score: 62-36)
Tobias Haliburton attempts a 3Pt. Contested by Austin O'Neal (5.5 feet, ZONE). TOBIAS HALIBURTON MAKES IT! Assist: Josh Duncan
Score: 62-39

[01:45] Team_039 possession (Score: 62-39)
Klay Wade attempts a Midrange. Wide open! Allen Ming is 6.3 feet away. [MAN] KLAY WADE MAKES IT!
Score: 64-39

[01:28] Team_088 possession (Score: 64-39)
Josh Duncan attempts a 3Pt. Contested by Jrue Bridges (4.8 feet, ZONE). Josh Duncan misses. Rebound secured by Klay Wade.

[01:13] Team_039 possession (Score: 64-39)
Anfernee Carter drives to the basket... Anfernee Carter loses control! Ball rolls out of bounds! TURNOVER! (dead ball)

[01:13] Substitution (Team_039): Jrue Bridges OUT → Tracy Mitchell IN (stamina_rule2)

[01:13] Substitution (Team_039): Donovan Markkanen OUT → Jayson Cunningham IN (stamina_rule2)

[01:13] Substitution (Team_039): Austin O'Neal OUT → Yao Carter IN (stamina_rule2)

[01:13] Substitution (Team_039): Anfernee Carter OUT → Victor Gasol IN (stamina_rule2)

[01:13] Substitution (Team_039): Klay Wade OUT → Bam Booker IN (stamina_rule2)

[01:13] Substitution (Team_088): Josh Duncan OUT → Klay Quickley IN (stamina_rule2)

[01:13] Substitution (Team_088): Tobias Haliburton OUT → Vince Carter IN (stamina_rule2)

[01:13] Substitution (Team_088): Tyler Hyland OUT → Pau Bird IN (stamina_rule2)

[01:13] Substitution (Team_088): Giannis Smith OUT → Zion Harris IN (stamina_rule2)

[01:13] Substitution (Team_088): Allen Ming OUT → Josh Embiid IN (stamina_rule2)

[01:00] Team_088 possession (Score: 64-39)
Klay Quickley attempts a 3Pt. Contested by Tracy Mitchell (5.7 feet, ZONE). KLAY QUICKLEY MAKES IT! Assist: Vince Carter
Score: 64-42

[00:42] Team_039 possession (Score: 64-42)
Victor Gasol drives, Zion Harris stays with him. Victor Gasol attempts a Layup. Contested by Zion Harris (6.0 feet, ZONE). Victor Gasol misses. Rebound secured by Pau Bird.

[00:31] Team_088 possession (Score: 64-42)
FOUL! Holding foul on Bam Booker. [IN THE BONUS! 6 team fouls] Josh Embiid to the line for 2 free throws. (Bam Booker: 1 personal fouls)   FT 1/2: GOOD   FT 2/2: GOOD Josh Embiid makes 2/2 from the line.
Score: 64-44

[00:16] Team_039 possession (Score: 64-44)
FOUL! Holding foul on Vince Carter. [IN THE BONUS! 7 team fouls] Jayson Cunningham to the line for 2 free throws. (Vince Carter: 1 personal fouls)   FT 1/2: GOOD   FT 2/2: GOOD Jayson Cunningham makes 2/2 from the line.
Score: 66-44

================================================================================
                              2ND QUARTER COMPLETE                              
================================================================================

2ND QUARTER SCORE: Team_039 32, Team_088 24

BOX SCORE:
================================================================================

Team_039
--------------------------------------------------------------------------------
Player                MIN  PTS  REB  AST  TO      FG   FG%      3P   3P%
--------------------------------------------------------------------------------
Austin O'Neal          22    8    5    0   0   3/5    60.0     0/0   0.0
Donovan Markkanen      22    7    3    2   0   3/3   100.0     0/0   0.0
Klay Wade              22    7    1    0   0   3/5    60.0     0/0   0.0
Anfernee Carter        22    5    0    0   0   2/3    66.7     0/0   0.0
Jrue Bridges           22    3    0    3   0   1/3    33.3     0/0   0.0
Jayson Cunningham       2    2    0    0   0   1/1   100.0     0/0   0.0
Victor Gasol            2    0    0    0   0   0/1     0.0     0/0   0.0

TEAM: FG: 13/21 (61.9%), 3PT: 4/10 (40.0%), REB: 9 (1 off, 8 def), AST: 5, TO: 1
TEAM FOULS: 6 [Team_088 in BONUS]


Team_088
--------------------------------------------------------------------------------
Player                MIN  PTS  REB  AST  TO      FG   FG%      3P   3P%
--------------------------------------------------------------------------------
Tobias Haliburton      22    6    0    0   0   2/3    66.7     0/0   0.0
Tyler Hyland           22    5    4    0   0   2/4    50.0     0/0   0.0
Allen Ming             22    5    4    0   0   2/2   100.0     0/0   0.0
Klay Quickley           2    3    0    0   0   1/1   100.0     0/0   0.0
Josh Duncan            22    2    0    3   0   1/3    33.3     0/0   0.0
Josh Embiid             2    2    0    0   0   1/1   100.0     0/0   0.0
Giannis Smith          22    1    2    1   0   1/4    25.0     0/0   0.0
Vince Carter            2    0    0    1   0   0/0     0.0     0/0   0.0
Pau Bird                2    0    1    0   0   0/0     0.0     0/0   0.0

TEAM: FG: 10/18 (55.6%), 3PT: 5/10 (50.0%), REB: 11 (3 off, 8 def), AST: 5, TO: 3
TEAM FOULS: 7 [Team_039 in BONUS]

================================================================================

================================================================================
                       3RD QUARTER - Team_039 vs Team_088                       
================================================================================

[12:00] Team_039 possession (Score: 66-44)
FOUL! Shooting foul on Tobias Haliburton. Klay Wade to the line for 2 free throws. [Team fouls: 1] (Tobias Haliburton: 1 personal fouls)   FT 1/2: GOOD   FT 2/2: GOOD Klay Wade makes 2/2 from the line.
Score: 68-44

[11:41] Team_088 possession (Score: 68-44)
Josh Duncan throws a bad pass out of bounds! TURNOVER! (dead ball)

[11:26] Team_039 possession (Score: 68-44)
Jrue Bridges drives, Giannis Smith stays with him. Jrue Bridges attempts a Layup. Contested by Giannis Smith (4.2 feet, ZONE). Jrue Bridges misses. Offensive rebound by Klay Wade! Klay Wade kicks it out.

[11:14] Team_039 possession (Score: 68-44)
Anfernee Carter attempts a 3Pt. Contested by Tobias Haliburton (5.3 feet, ZONE). Anfernee Carter misses. Rebound secured by Allen Ming.

[10:57] Team_088 possession (Score: 68-44)
Josh Duncan drives, Jrue Bridges stays with him. Josh Duncan attempts a Dunk. Contested by Jrue Bridges (3.1 feet, MAN). Josh Duncan misses. Rebound secured by Donovan Markkanen.

[10:43] Team_039 possession (Score: 68-44)
Jrue Bridges attempts a Midrange. Contested by Tyler Hyland (4.7 feet, ZONE). JRUE BRIDGES MAKES IT!
Score: 70-44

[10:26] Team_088 possession (Score: 70-44)
Tobias Haliburton attempts a 3Pt. Contested by Jrue Bridges (3.1 feet, ZONE). Tobias Haliburton misses. Rebound secured by Klay Wade.

[10:10] Team_039 possession (Score: 70-44)
Anfernee Carter attempts a 3Pt. Contested by Tobias Haliburton (5.3 feet, ZONE). Anfernee Carter misses. Offensive rebound by Klay Wade! Klay Wade kicks it out.

[09:57] Team_039 possession (Score: 70-44)
FOUL! Holding foul on Giannis Smith. [Team fouls: 2] No free throws, side out. (Giannis Smith: 1 personal fouls)

[09:43] Team_039 possession (Score: 70-44)
Jrue Bridges drives, Josh Duncan stays with him. Jrue Bridges attempts a Dunk. Contested by Josh Duncan (5.5 feet, MAN). JRUE BRIDGES MAKES IT! Assist: Klay Wade
Score: 72-44

[09:28] Team_088 possession (Score: 72-44)
Tobias Haliburton drives, picks up Donovan Markkanen. Help arrives from Austin O'Neal! Tobias Haliburton attempts a Dunk. Contested by Austin O'Neal (3.8 feet, MAN). TOBIAS HALIBURTON MAKES IT! Assist: Allen Ming
Score: 72-46

[09:16] Team_039 possession (Score: 72-46)
Jrue Bridges attempts a Layup. Contested by Josh Duncan (5.5 feet, MAN). JRUE BRIDGES MAKES IT! Assist: Anfernee Carter
Score: 74-46

[09:04] Team_088 possession (Score: 74-46)
Tobias Haliburton attempts a Midrange. Contested by Donovan Markkanen (3.8 feet, MAN). TOBIAS HALIBURTON MAKES IT!
Score: 74-48

[08:49] Team_039 possession (Score: 74-48)
Austin O'Neal attempts a 3Pt. Contested by Tobias Haliburton (5.1 feet, ZONE). AUSTIN O'NEAL MAKES IT!
Score: 77-48

[08:33] Team_088 possession (Score: 77-48)
Tobias Haliburton drives to the basket... Tobias Haliburton throws a bad pass! Stolen by Donovan Markkanen! TURNOVER! (live ball)

[08:17] Team_039 possession (Score: 77-48)
FOUL! Reach-in foul on Allen Ming during the drive. [Team fouls: 3] No free throws, side out. (Allen Ming: 1 personal fouls)

[08:02] Team_039 possession (Score: 77-48)
Klay Wade drives to the basket... Klay Wade throws a bad pass out of bounds! TURNOVER! (dead ball)

[07:47] Team_088 possession (Score: 77-48)
Allen Ming drives and kicks out. Giannis Smith attempts a 3Pt. Contested by Jrue Bridges (3.1 feet, ZONE). Giannis Smith misses. Rebound secured by Austin O'Neal.

[07:30] Team_039 possession (Score: 77-48)
Klay Wade drives, Allen Ming stays with him. Klay Wade attempts a Dunk. Contested by Allen Ming (4.8 feet, MAN). KLAY WADE MAKES IT! Assist: Austin O'Neal
Score: 79-48

[07:12] Team_088 possession (Score: 79-48)
Josh Duncan attempts a 3Pt. Contested by Jrue Bridges (3.1 feet, ZONE). Josh Duncan misses. Rebound secured by Donovan Markkanen.

[06:55] Team_039 possession (Score: 79-48)
Anfernee Carter drives, picks up Allen Ming. Help arrives from Tobias Haliburton! Anfernee Carter attempts a Layup. Contested by Tobias Haliburton (4.4 feet, ZONE). ANFERNEE CARTER MAKES IT! Assist: Klay Wade
Score: 81-48

[06:40] Team_088 possession (Score: 81-48)
Tyler Hyland attempts a Layup. Contested by Klay Wade (3.9 feet, ZONE). Tyler Hyland misses. Rebound secured by Klay Wade.

[06:25] Team_039 possession (Score: 81-48)
Donovan Markkanen attempts a 3Pt. Contested by Tobias Haliburton (5.3 feet, ZONE). Donovan Markkanen misses. Rebound secured by Tyler Hyland.

[06:11] Team_088 possession (Score: 81-48)
Allen Ming attempts a Midrange. Contested by Klay Wade (4.2 feet, MAN). Allen Ming misses. Rebound secured by Donovan Markkanen.

[05:53] Team_039 possession (Score: 81-48)
Jrue Bridges throws a bad pass! Stolen by Josh Duncan! TURNOVER! (live ball)

[05:36] Team_088 possession (Score: 81-48)
Josh Duncan makes the Dunk and draws the foul on Austin O'Neal! And-1! Josh Duncan to the line for 1. [Team fouls: 1] (Austin O'Neal: 1 personal fouls)   FT 1/1: GOOD Josh Duncan makes 1/1 from the line.
Score: 81-51

[05:19] Team_039 possession (Score: 81-51)
Anfernee Carter attempts a 3Pt. Contested by Tobias Haliburton (5.3 feet, ZONE). Anfernee Carter misses. Rebound secured by Tyler Hyland.

[05:04] Team_088 possession (Score: 81-51)
FOUL! Shooting foul on Klay Wade. Giannis Smith to the line for 2 free throws. [Team fouls: 2] (Klay Wade: 1 personal fouls)   FT 1/2: GOOD   FT 2/2: MISS Giannis Smith makes 1/2 from the line. Rebound secured by Klay Wade.
Score: 81-52

[04:47] Team_039 possession (Score: 81-52)
Austin O'Neal makes the Layup and draws the foul on Giannis Smith! And-1! Austin O'Neal to the line for 1. [Team fouls: 4] (Giannis Smith: 2 personal fouls)   FT 1/1: GOOD Austin O'Neal makes 1/1 from the line.
Score: 84-52

[04:35] Team_088 possession (Score: 84-52)
Allen Ming makes the Layup and draws the foul on Klay Wade! And-1! Allen Ming to the line for 1. [Team fouls: 3] (Klay Wade: 2 personal fouls)   FT 1/1: GOOD Allen Ming makes 1/1 from the line.
Score: 84-55

[04:22] Team_039 possession (Score: 84-55)
Austin O'Neal makes the Layup and draws the foul on Tyler Hyland! And-1! Austin O'Neal to the line for 1. [BONUS: 5 team fouls] (Tyler Hyland: 1 personal fouls)   FT 1/1: GOOD Austin O'Neal makes 1/1 from the line.
Score: 87-55

[04:03] Team_088 possession (Score: 87-55)
Josh Duncan throws a bad pass out of bounds! TURNOVER! (dead ball)

[03:48] Team_039 possession (Score: 87-55)
Jrue Bridges attempts a 3Pt. Contested by Tobias Haliburton (5.3 feet, ZONE). JRUE BRIDGES MAKES IT! Assist: Klay Wade
Score: 90-55

[03:34] Team_088 possession (Score: 90-55)
Allen Ming drives to the basket... Allen Ming throws a bad pass out of bounds! TURNOVER! (dead ball)

[03:22] Team_039 possession (Score: 90-55)
Jrue Bridges drives to the basket... FOUL! Offensive foul on Jrue Bridges! Josh Duncan drew the charge! [Team fouls: 4] (Jrue Bridges: 1 personal fouls) TURNOVER! (dead ball)

[03:08] Team_088 possession (Score: 90-55)
Josh Duncan attempts a 3Pt. Contested by Jrue Bridges (3.3 feet, MAN). Josh Duncan misses. Offensive rebound by Giannis Smith! Giannis Smith puts it back in!
Score: 90-57

[02:52] Team_039 possession (Score: 90-57)
Anfernee Carter attempts a Layup. Contested by Giannis Smith (4.5 feet, ZONE). ANFERNEE CARTER MAKES IT! Assist: Jrue Bridges
Score: 92-57

[02:39] Team_088 possession (Score: 92-57)
Giannis Smith attempts a 3Pt. Contested by Jrue Bridges (3.5 feet, ZONE). Giannis Smith misses. Rebound secured by Klay Wade.

[02:20] Team_039 possession (Score: 92-57)
Jrue Bridges attempts a Layup. BLOCKED BY JOSH DUNCAN! Ball goes out off Josh Duncan. Jrue Bridges's ball!

[02:09] Team_039 possession (Score: 92-57)
Donovan Markkanen attempts a 3Pt. Contested by Josh Duncan (5.8 feet, ZONE). DONOVAN MARKKANEN MAKES IT! Assist: Austin O'Neal
Score: 95-57

[01:55] Team_088 possession (Score: 95-57)
Tobias Haliburton attempts a Midrange. Wide open! Anfernee Carter is 6.9 feet away. [ZONE] TOBIAS HALIBURTON MAKES IT!
Score: 95-59

[01:43] Team_039 possession (Score: 95-59)
Austin O'Neal attempts a 3Pt. Contested by Tobias Haliburton (5.4 feet, ZONE). AUSTIN O'NEAL MAKES IT! Assist: Anfernee Carter
Score: 98-59

[01:28] Team_088 possession (Score: 98-59)
Allen Ming drives to the basket... Allen Ming loses the ball! Stripped by Klay Wade! TURNOVER! (live ball)

[01:15] Team_039 possession (Score: 98-59)
Jrue Bridges drives to the basket... Jrue Bridges commits a violation (traveling/carry)! TURNOVER! (dead ball)

[01:15] Substitution (Team_039): Jrue Bridges OUT → Tracy Mitchell IN (stamina_rule2)

[01:15] Substitution (Team_039): Donovan Markkanen OUT → Jayson Cunningham IN (stamina_rule2)

[01:15] Substitution (Team_039): Austin O'Neal OUT → Yao Carter IN (stamina_rule2)

[01:15] Substitution (Team_039): Anfernee Carter OUT → Victor Gasol IN (stamina_rule2)

[01:15] Substitution (Team_039): Klay Wade OUT → Bam Booker IN (stamina_rule2)

[01:15] Substitution (Team_088): Josh Duncan OUT → Klay Quickley IN (stamina_rule2)

[01:15] Substitution (Team_088): Tobias Haliburton OUT → Vince Carter IN (stamina_rule2)

[01:15] Substitution (Team_088): Tyler Hyland OUT → Pau Bird IN (stamina_rule2)

[01:15] Substitution (Team_088): Giannis Smith OUT → Zion Harris IN (stamina_rule2)

[01:15] Substitution (Team_088): Allen Ming OUT → Josh Embiid IN (stamina_rule2)

[01:00] Team_088 possession (Score: 98-59)
Josh Embiid drives, picks up Bam Booker. Help arrives from Tracy Mitchell! Josh Embiid attempts a Layup. Contested by Tracy Mitchell (4.5 feet, MAN). Josh Embiid misses. Rebound secured by Victor Gasol.

[00:47] Team_039 possession (Score: 98-59)
Yao Carter attempts a 3Pt. Contested by Pau Bird (5.1 feet, MAN). Yao Carter misses. Rebound secured by Zion Harris.

[00:30] Team_088 possession (Score: 98-59)
Josh Embiid loses control! Ball rolls out of bounds! TURNOVER! (dead ball)

[00:12] Team_039 possession (Score: 98-59)
Yao Carter attempts a 3Pt. Contested by Pau Bird (5.1 feet, ZONE). Yao Carter misses. Rebound secured by Pau Bird.

================================================================================
                              3RD QUARTER COMPLETE                              
================================================================================

3RD QUARTER SCORE: Team_039 32, Team_088 15

BOX SCORE:
================================================================================

Team_039
--------------------------------------------------------------------------------
Player                MIN  PTS  REB  AST  TO      FG   FG%      3P   3P%
--------------------------------------------------------------------------------
Austin O'Neal          33   12    1    2   0   4/4   100.0     0/0   0.0
Jrue Bridges           33    9    0    1   0   4/4   100.0     0/0   0.0
Klay Wade              33    4    6    3   0   2/2   100.0     0/0   0.0
Anfernee Carter        33    4    0    2   0   2/4    50.0     0/0   0.0
Donovan Markkanen      33    3    3    0   0   1/2    50.0     0/0   0.0
Victor Gasol            3    0    1    0   0   0/0     0.0     0/0   0.0
Yao Carter              3    0    0    0   0   0/2     0.0     0/0   0.0

TEAM: FG: 13/18 (72.2%), 3PT: 4/9 (44.4%), REB: 11 (2 off, 9 def), AST: 8, TO: 4
TEAM FOULS: 4


Team_088
--------------------------------------------------------------------------------
Player                MIN  PTS  REB  AST  TO      FG   FG%      3P   3P%
--------------------------------------------------------------------------------
Tobias Haliburton      33    6    0    0   0   3/4    75.0     0/0   0.0
Allen Ming             33    3    1    1   0   1/3    33.3     0/0   0.0
Josh Duncan            33    3    0    0   0   1/3    33.3     0/0   0.0
Giannis Smith          33    2    1    0   0   1/3    33.3     0/0   0.0
Tyler Hyland           33    0    2    0   0   0/1     0.0     0/0   0.0
Josh Embiid             3    0    0    0   0   0/1     0.0     0/0   0.0
Zion Harris             3    0    1    0   0   0/0     0.0     0/0   0.0
Pau Bird                3    0    1    0   0   0/0     0.0     0/0   0.0

TEAM: FG: 6/15 (40.0%), 3PT: 1/4 (25.0%), REB: 6 (1 off, 5 def), AST: 1, TO: 6
TEAM FOULS: 5 [Team_039 in BONUS]

================================================================================

================================================================================
                       4TH QUARTER - Team_039 vs Team_088                       
================================================================================

[12:00] Team_039 possession (Score: 98-59)
Anfernee Carter attempts a 3Pt. Contested by Giannis Smith (4.4 feet, MAN). Anfernee Carter misses. Rebound secured by Giannis Smith.

[11:49] Team_088 possession (Score: 98-59)
Josh Duncan attempts a 3Pt. Contested by Jrue Bridges (3.3 feet, ZONE). Josh Duncan misses. Rebound secured by Klay Wade.

[11:37] Team_039 possession (Score: 98-59)
Donovan Markkanen attempts a Layup. Contested by Tobias Haliburton (5.4 feet, MAN). DONOVAN MARKKANEN MAKES IT!
Score: 100-59

[11:24] Team_088 possession (Score: 100-59)
FOUL! Holding foul on Jrue Bridges. [Team fouls: 1] No free throws, side out. (Jrue Bridges: 1 personal fouls)

[11:07] Team_088 possession (Score: 100-59)
Allen Ming drives, Klay Wade stays with him. Allen Ming attempts a Layup. Contested by Klay Wade (4.3 feet, MAN). Allen Ming misses. Rebound secured by Austin O'Neal.

[10:53] Team_039 possession (Score: 100-59)
Austin O'Neal attempts a 3Pt. Contested by Tyler Hyland (4.8 feet, MAN). AUSTIN O'NEAL MAKES IT! Assist: Jrue Bridges
Score: 103-59

[10:42] Team_088 possession (Score: 103-59)
FOUL! Shooting foul on Donovan Markkanen. Tobias Haliburton to the line for 2 free throws. [Team fouls: 2] (Donovan Markkanen: 1 personal fouls)   FT 1/2: GOOD   FT 2/2: GOOD Tobias Haliburton makes 2/2 from the line.
Score: 103-61

[10:30] Team_039 possession (Score: 103-61)
Austin O'Neal attempts a 3Pt. Contested by Tobias Haliburton (5.4 feet, ZONE). Austin O'Neal misses. Rebound secured by Giannis Smith.

[10:10] Team_088 possession (Score: 103-61)
Josh Duncan attempts a Layup. Contested by Klay Wade (4.3 feet, ZONE). JOSH DUNCAN MAKES IT! Assist: Giannis Smith
Score: 103-63

[09:51] Team_039 possession (Score: 103-63)
Anfernee Carter attempts a 3Pt. Contested by Josh Duncan (5.8 feet, ZONE). Anfernee Carter misses. Rebound secured by Allen Ming.

[09:33] Team_088 possession (Score: 103-63)
Tyler Hyland attempts a Midrange. Contested by Austin O'Neal (4.3 feet, MAN). TYLER HYLAND MAKES IT! Assist: Giannis Smith
Score: 103-65

[09:19] Team_039 possession (Score: 103-65)
Donovan Markkanen drives, Tobias Haliburton stays with him. Donovan Markkanen attempts a Layup. Contested by Tobias Haliburton (5.6 feet, MAN). DONOVAN MARKKANEN MAKES IT! Assist: Klay Wade
Score: 105-65

[09:06] Team_088 possession (Score: 105-65)
Giannis Smith attempts a Midrange. Contested by Klay Wade (4.5 feet, MAN). Giannis Smith misses. Rebound secured by Donovan Markkanen.

[08:52] Team_039 possession (Score: 105-65)
Austin O'Neal attempts a 3Pt. Contested by Tyler Hyland (5.0 feet, MAN). AUSTIN O'NEAL MAKES IT! Assist: Jrue Bridges
Score: 108-65

[08:36] Team_088 possession (Score: 108-65)
FOUL! Holding foul on Klay Wade. [Team fouls: 3] No free throws, side out. (Klay Wade: 1 personal fouls)

[08:22] Team_088 possession (Score: 108-65)
Josh Duncan attempts a 3Pt. Contested by Jrue Bridges (3.7 feet, MAN). Josh Duncan misses. Rebound secured by Klay Wade.

[08:10] Team_039 possession (Score: 108-65)
Anfernee Carter drives and kicks out. Klay Wade attempts a Midrange. Contested by Giannis Smith (4.8 feet, ZONE). KLAY WADE MAKES IT!
Score: 110-65

[07:58] Team_088 possession (Score: 110-65)
Giannis Smith drives, Klay Wade stays with him. Giannis Smith attempts a Dunk. Contested by Klay Wade (4.6 feet, ZONE). Giannis Smith misses. Rebound secured by Klay Wade.

[07:41] Team_039 possession (Score: 110-65)
Jrue Bridges drives, Josh Duncan stays with him. Jrue Bridges attempts a Layup. Wide open! Josh Duncan is 6.0 feet away. [MAN] JRUE BRIDGES MAKES IT!
Score: 112-65

[07:25] Team_088 possession (Score: 112-65)
Allen Ming drives and kicks out. Allen Ming attempts a 3Pt. Contested by Klay Wade (4.6 feet, MAN). Allen Ming misses. Offensive rebound by Allen Ming! Allen Ming puts it back in!
Score: 112-67

[07:12] Team_039 possession (Score: 112-67)
Anfernee Carter makes the Midrange and draws the foul on Giannis Smith! And-1! Anfernee Carter to the line for 1. [Team fouls: 1] (Giannis Smith: 1 personal fouls)   FT 1/1: GOOD Anfernee Carter makes 1/1 from the line.
Score: 115-67

[06:59] Team_088 possession (Score: 115-67)
Tyler Hyland drives, picks up Anfernee Carter. Help arrives from Donovan Markkanen! Tyler Hyland attempts a Layup. Wide open! Donovan Markkanen is 7.0 feet away. [ZONE] Tyler Hyland misses. Rebound secured by Klay Wade.

[06:42] Team_039 possession (Score: 115-67)
Klay Wade drives, Allen Ming stays with him. Klay Wade attempts a Dunk. Contested by Allen Ming (5.6 feet, MAN). KLAY WADE MAKES IT!
Score: 117-67

[06:27] Team_088 possession (Score: 117-67)
Giannis Smith drives and kicks out. Tyler Hyland attempts a Midrange. Contested by Austin O'Neal (4.9 feet, ZONE). Tyler Hyland misses. Rebound secured by Donovan Markkanen.

[06:12] Team_039 possession (Score: 117-67)
Anfernee Carter attempts a Midrange. Wide open! Josh Duncan is 6.2 feet away. [ZONE] ANFERNEE CARTER MAKES IT! Assist: Jrue Bridges
Score: 119-67

[05:55] Team_088 possession (Score: 119-67)
Tobias Haliburton attempts a 3Pt. Contested by Donovan Markkanen (4.5 feet, MAN). Tobias Haliburton misses. Rebound secured by Klay Wade.

[05:40] Team_039 possession (Score: 119-67)
Austin O'Neal attempts a 3Pt. Contested by Tyler Hyland (5.4 feet, MAN). Austin O'Neal misses. Offensive rebound by Klay Wade! Klay Wade kicks it out.

[05:23] Team_039 possession (Score: 119-67)
Donovan Markkanen drives, Tobias Haliburton stays with him. Donovan Markkanen attempts a Dunk. Wide open! Tobias Haliburton is 6.1 feet away. [MAN] DONOVAN MARKKANEN MAKES IT! Assist: Klay Wade
Score: 121-67

[05:10] Team_088 possession (Score: 121-67)
Josh Duncan attempts a 3Pt. Contested by Jrue Bridges (4.2 feet, ZONE). Josh Duncan misses. Rebound secured by Klay Wade.

[04:53] Team_039 possession (Score: 121-67)
Austin O'Neal attempts a 3Pt. Contested by Tyler Hyland (5.5 feet, MAN). Austin O'Neal misses. Rebound secured by Allen Ming.

[04:41] Team_088 possession (Score: 121-67)
Allen Ming makes the Layup and draws the foul on Klay Wade! And-1! Allen Ming to the line for 1. [Team fouls: 4] (Klay Wade: 2 personal fouls)   FT 1/1: GOOD Allen Ming makes 1/1 from the line.
Score: 121-70

[04:24] Team_039 possession (Score: 121-70)
Donovan Markkanen attempts a 3Pt. Wide open! Tobias Haliburton is 6.2 feet away. [MAN] Donovan Markkanen misses. Rebound secured by Allen Ming.

[04:10] Team_088 possession (Score: 121-70)
Tyler Hyland throws a bad pass! Stolen by Austin O'Neal! TURNOVER! (live ball)

[03:56] Team_039 possession (Score: 121-70)
Jrue Bridges drives, picks up Giannis Smith. Help arrives from Tobias Haliburton! Jrue Bridges attempts a Layup. Contested by Tobias Haliburton (5.5 feet, ZONE). Jrue Bridges misses. Offensive rebound by Klay Wade! Klay Wade kicks it out.

[03:42] Team_039 possession (Score: 121-70)
Austin O'Neal attempts a 3Pt. Contested by Tyler Hyland (5.7 feet, MAN). AUSTIN O'NEAL MAKES IT! Assist: Donovan Markkanen
Score: 124-70

[03:29] Team_088 possession (Score: 124-70)
Josh Duncan attempts a 3Pt. Contested by Jrue Bridges (4.5 feet, MAN). Josh Duncan misses. FOUL! Loose ball foul on Austin O'Neal during the rebound battle. [IN THE BONUS! 5 team fouls] Allen Ming to the line for 2 free throws. (Austin O'Neal: 1 personal fouls)   FT 1/2: GOOD   FT 2/2: GOOD Allen Ming makes 2/2 from the line.
Score: 124-72

[03:15] Team_039 possession (Score: 124-72)
Jrue Bridges attempts a 3Pt. Wide open! Josh Duncan is 6.6 feet away. [MAN] JRUE BRIDGES MAKES IT! Assist: Donovan Markkanen
Score: 127-72

[03:01] Team_088 possession (Score: 127-72)
Josh Duncan attempts a Midrange. Wide open! Anfernee Carter is 7.5 feet away. [ZONE] JOSH DUNCAN MAKES IT! Assist: Allen Ming
Score: 127-74

[02:49] Team_039 possession (Score: 127-74)
Klay Wade drives and kicks out. Klay Wade attempts a 3Pt. Contested by Allen Ming (5.9 feet, MAN). KLAY WADE MAKES IT! Assist: Austin O'Neal
Score: 130-74

[02:31] Team_088 possession (Score: 130-74)
FOUL! Shooting foul on Austin O'Neal. Tobias Haliburton to the line for 2 free throws. [BONUS: 6 team fouls] (Austin O'Neal: 2 personal fouls)   FT 1/2: MISS   FT 2/2: GOOD Tobias Haliburton makes 1/2 from the line.
Score: 130-75

[02:22] Team_039 possession (Score: 130-75)
Austin O'Neal drives, picks up Tyler Hyland. Help arrives from Tobias Haliburton! Austin O'Neal attempts a Layup. Contested by Tobias Haliburton (5.9 feet, MAN). AUSTIN O'NEAL MAKES IT! Assist: Klay Wade
Score: 132-75

[02:09] Team_088 possession (Score: 132-75)
Tobias Haliburton attempts a Midrange. Contested by Austin O'Neal (5.5 feet, ZONE). Tobias Haliburton misses. Rebound secured by Austin O'Neal.

[01:56] Team_039 possession (Score: 132-75)
Austin O'Neal drives to the basket... FOUL! Offensive foul on Austin O'Neal! Tyler Hyland drew the charge! [Team fouls: 7] (Austin O'Neal: 3 personal fouls) TURNOVER! (dead ball)

[01:41] Team_088 possession (Score: 132-75)
Tyler Hyland drives, Austin O'Neal stays with him. Tyler Hyland attempts a Dunk. Contested by Austin O'Neal (5.5 feet, MAN). Tyler Hyland misses. Rebound secured by Donovan Markkanen.

[01:26] Team_039 possession (Score: 132-75)
Klay Wade attempts a Midrange. Wide open! Giannis Smith is 6.3 feet away. [ZONE] Klay Wade misses. Rebound secured by Tyler Hyland.

[01:09] Team_088 possession (Score: 132-75)
Tobias Haliburton attempts a 3Pt. Contested by Donovan Markkanen (5.1 feet, MAN). Tobias Haliburton misses. Rebound secured by Klay Wade.

[00:58] Team_039 possession (Score: 132-75)
Jrue Bridges attempts a Midrange. Wide open! Josh Duncan is 6.9 feet away. [MAN] Jrue Bridges misses. FOUL! Loose ball foul on Giannis Smith during the rebound battle. [Team fouls: 2] No free throws, side out. (Giannis Smith: 2 personal fouls)

[00:44] Team_039 possession (Score: 132-75)
Klay Wade attempts a Midrange. Wide open! Allen Ming is 6.5 feet away. [MAN] Klay Wade misses. Rebound secured by Tyler Hyland.

[00:26] Team_088 possession (Score: 132-75)
Josh Duncan attempts a 3Pt. Contested by Jrue Bridges (5.0 feet, ZONE). JOSH DUNCAN MAKES IT! Assist: Giannis Smith
Score: 132-78

[00:13] Team_039 possession (Score: 132-78)
Jrue Bridges attempts a 3Pt. Wide open! Tobias Haliburton is 6.7 feet away. [ZONE] Jrue Bridges misses. Offensive rebound by Klay Wade! Klay Wade kicks it out.

================================================================================
                              4TH QUARTER COMPLETE                              
================================================================================

4TH QUARTER SCORE: Team_039 34, Team_088 19

BOX SCORE:
================================================================================

Team_039
--------------------------------------------------------------------------------
Player                MIN  PTS  REB  AST  TO      FG   FG%      3P   3P%
--------------------------------------------------------------------------------
Austin O'Neal          45   11    2    1   0   4/6    66.7     0/0   0.0
Klay Wade              45    7   11    3   0   3/5    60.0     0/0   0.0
Donovan Markkanen      45    6    3    2   0   3/4    75.0     0/0   0.0
Anfernee Carter        45    5    0    0   0   2/4    50.0     0/0   0.0
Jrue Bridges           45    5    0    3   0   2/2   100.0     0/0   0.0

TEAM: FG: 14/21 (66.7%), 3PT: 4/9 (44.4%), REB: 16 (4 off, 12 def), AST: 9, TO: 1
TEAM FOULS: 7 [Team_088 in BONUS]


Team_088
--------------------------------------------------------------------------------
Player                MIN  PTS  REB  AST  TO      FG   FG%      3P   3P%
--------------------------------------------------------------------------------
Josh Duncan            45    7    0    0   0   3/6    50.0     0/0   0.0
Allen Ming             45    7    4    1   0   3/4    75.0     0/0   0.0
Tobias Haliburton      45    3    0    0   0   2/5    40.0     0/0   0.0
Tyler Hyland           45    2    2    0   0   1/3    33.3     0/0   0.0
Giannis Smith          45    0    2    3   0   0/3     0.0     0/0   0.0

TEAM: FG: 9/21 (42.9%), 3PT: 2/7 (28.6%), REB: 8 (1 off, 7 def), AST: 4, TO: 1
TEAM FOULS: 2

================================================================================

================================================================================
                               FULL GAME COMPLETE                               
================================================================================

FINAL SCORE: Team_039 132, Team_088 78

SCORING BY QUARTER:
--------------------------------------------------------------------------------
Team                     Q1     Q2     Q3     Q4    FINAL
--------------------------------------------------------------------------------
Team_039                 34     32     32     34      132
Team_088                 20     24     15     19       78
--------------------------------------------------------------------------------

FULL GAME BOX SCORE:
================================================================================

Team_039
--------------------------------------------------------------------------------
Player                MIN  PTS  REB  AST  TO      FG   FG%      3P   3P%      FT STL BLK
--------------------------------------------------------------------------------
Jrue Bridges           45   20    0    9   1  10/13   76.9   4/7    57.1   0/0     0   0
Donovan Markkanen      45   19   11    7   2   8/10   80.0   3/5    60.0   0/0     1   0
Austin O'Neal          45   39   13    5   5  13/19   68.4   7/12   58.3   7/7     1   1
Anfernee Carter        45   30    0    2   0  13/19   68.4   2/7    28.6   5/5     0   0
Klay Wade              45   20   22    7   2   7/12   58.3   0/3     0.0   4/4     2   0
Tracy Mitchell          3    2    0    0   0   1/1   100.0   0/0     0.0   0/0     0   0
Jayson Cunningham       3    2    0    0   0   0/1     0.0   0/0     0.0   2/2     0   0
Yao Carter              3    0    0    1   0   0/2     0.0   0/2     0.0   0/0     0   0
Victor Gasol            3    0    2    0   0   0/1     0.0   0/0     0.0   0/0     0   0
Bam Booker              3    0    0    0   0   0/0     0.0   0/0     0.0   0/0     0   0

TEAM: FG: 53/79 (67.1%), 3PT: 16/36 (44.4%), REB: 48 (9 off, 39 def), AST: 31, TO: 10


Team_088
--------------------------------------------------------------------------------
Player                MIN  PTS  REB  AST  TO      FG   FG%      3P   3P%      FT STL BLK
--------------------------------------------------------------------------------
Josh Duncan            45   12    0    3   6   8/19   42.1   4/14   28.6   1/1     1   1
Tobias Haliburton      45   18    0    0   2   9/14   64.3   3/7    42.9   4/5     1   0
Tyler Hyland           45   12   10    1   2   5/12   41.7   2/4    50.0   0/0     1   0
Giannis Smith          45    6    6    6   0   1/11    9.1   0/4     0.0   3/5     0   0
Allen Ming             45   21   12    2   3   7/11   63.6   0/0     0.0   7/7     0   0
Klay Quickley           3    3    0    0   0   1/1   100.0   1/1   100.0   0/0     0   0
Vince Carter            3    0    0    1   0   0/1     0.0   0/1     0.0   0/0     0   0
Pau Bird                3    0    2    0   0   0/0     0.0   0/0     0.0   0/0     0   0
Zion Harris             3    0    1    0   0   0/0     0.0   0/0     0.0   0/0     0   0
Josh Embiid             3    5    1    0   1   1/2    50.0   0/0     0.0   3/3     0   0

TEAM: FG: 33/72 (45.8%), 3PT: 10/31 (32.3%), REB: 32 (6 off, 26 def), AST: 13, TO: 14

================================================================================
