================================================================================
                        FULL GAME - Team_042 vs Team_081                        
================================================================================

================================================================================
                       1ST QUARTER - Team_042 vs Team_081                       
================================================================================

[12:00] Team_042 possession (Score: 0-0)
Tyler Barrett drives and kicks out. Dejounte Butler attempts a Midrange. Contested by Bradley Sabonis (4.0 feet, MAN). Dejounte Butler misses. Rebound secured by Franz Antetokounmpo.

[11:48] Team_081 possession (Score: 0-0)
Franz Antetokounmpo loses the ball! Stripped by Cade Dosunmu! TURNOVER! (live ball)

[11:33] Team_042 possession (Score: 0-0)
Kristaps Parker attempts a 3Pt. Contested by Vince Adebayo (3.4 feet, ZONE). Kristaps Parker misses. Rebound secured by Vince Adebayo.

[11:20] Team_081 possession (Score: 0-0)
Vince Adebayo attempts a Midrange. Contested by Kristaps Parker (5.0 feet, ZONE). Vince Adebayo misses. Rebound secured by Cade Dosunmu.

[11:04] Team_042 possession (Score: 0-0)
Tyler Barrett drives and kicks out. Kristaps Parker attempts a 3Pt. Contested by Bradley Leonard (3.7 feet, MAN). KRISTAPS PARKER MAKES IT! Assist: Dejounte Butler
Score: 3-0

[10:44] Team_081 possession (Score: 3-0)
Vince Adebayo throws a bad pass out of bounds! TURNOVER! (dead ball)

[10:30] Team_042 possession (Score: 3-0)
Cade Dosunmu drives, Franz Antetokounmpo stays with him. Cade Dosunmu attempts a Dunk. Contested by Franz Antetokounmpo (4.5 feet, ZONE). CADE DOSUNMU MAKES IT! Assist: Dejounte Butler
Score: 5-0

[10:17] Team_081 possession (Score: 5-0)
Vince Adebayo attempts a 3Pt. Contested by Jarrett Sabonis (3.9 feet, ZONE). Vince Adebayo misses. Rebound secured by Tyler Barrett.

[10:06] Team_042 possession (Score: 5-0)
Tyler Barrett drives to the basket... Tyler Barrett throws a bad pass! Stolen by Franz Antetokounmpo! TURNOVER! (live ball)

[09:47] Team_081 possession (Score: 5-0)
Bradley Leonard attempts a 3Pt. Contested by Dejounte Butler (3.7 feet, ZONE). Bradley Leonard misses. Rebound secured by Dejounte Butler.

[09:35] Team_042 possession (Score: 5-0)
Jarrett Sabonis loses control! Ball rolls out of bounds! TURNOVER! (dead ball)

[09:19] Team_081 possession (Score: 5-0)
Vince Adebayo attempts a 3Pt. Contested by Tyler Barrett (3.4 feet, ZONE). Vince Adebayo misses. Offensive rebound by Franz Antetokounmpo! Franz Antetokounmpo puts it back in!
Score: 5-2

[09:01] Team_042 possession (Score: 5-2)
Dejounte Butler attempts a Midrange. Contested by Bradley Sabonis (4.3 feet, MAN). Dejounte Butler misses. Rebound secured by Vince Adebayo.

[08:51] Team_081 possession (Score: 5-2)
Julius Durant attempts a 3Pt. Contested by Tyler Barrett (3.5 feet, MAN). Julius Durant misses. Rebound secured by Tyler Barrett.

[08:36] Team_042 possession (Score: 5-2)
Jarrett Sabonis attempts a Midrange. Contested by Vince Adebayo (3.9 feet, MAN). JARRETT SABONIS MAKES IT! Assist: Cade Dosunmu
Score: 7-2

[08:17] Team_081 possession (Score: 7-2)
Vince Adebayo attempts a 3Pt. Contested by Jarrett Sabonis (3.9 feet, MAN). Vince Adebayo misses. Rebound secured by Cade Dosunmu.

[08:05] Team_042 possession (Score: 7-2)
Kristaps Parker attempts a Midrange. Contested by Bradley Leonard (3.6 feet, MAN). Kristaps Parker misses. Rebound secured by Vince Adebayo.

[07:53] Team_081 possession (Score: 7-2)
Vince Adebayo attempts a Midrange. Contested by Jarrett Sabonis (3.9 feet, ZONE). VINCE ADEBAYO MAKES IT!
Score: 7-4

[07:36] Team_042 possession (Score: 7-4)
Jarrett Sabonis attempts a 3Pt. Contested by Vince Adebayo (3.9 feet, ZONE). Jarrett Sabonis misses. Rebound secured by Franz Antetokounmpo.

[07:22] Team_081 possession (Score: 7-4)
Bradley Leonard drives to the basket... Bradley Leonard throws a bad pass out of bounds! TURNOVER! (dead ball)

[07:11] Team_042 possession (Score: 7-4)
Cade Dosunmu attempts a Layup. Contested by Franz Antetokounmpo (4.5 feet, ZONE). CADE DOSUNMU MAKES IT! Assist: Dejounte Butler
Score: 9-4

[06:58] Team_081 possession (Score: 9-4)
Bradley Leonard attempts a 3Pt. Contested by Kristaps Parker (5.1 feet, MAN). BRADLEY LEONARD MAKES IT! Assist: Vince Adebayo
Score: 9-7

[06:44] Team_042 possession (Score: 9-7)
Cade Dosunmu drives, Franz Antetokounmpo stays with him. Cade Dosunmu attempts a Layup. Contested by Franz Antetokounmpo (4.5 feet, MAN). CADE DOSUNMU MAKES IT!
Score: 11-7

[06:31] Team_081 possession (Score: 11-7)
Vince Adebayo attempts a 3Pt. Contested by Jarrett Sabonis (3.9 feet, MAN). Vince Adebayo misses. Rebound secured by Cade Dosunmu.

[06:15] Team_042 possession (Score: 11-7)
Cade Dosunmu makes the Layup and draws the foul on Franz Antetokounmpo! And-1! Cade Dosunmu to the line for 1. [Team fouls: 1] (Franz Antetokounmpo: 1 personal fouls)   FT 1/1: GOOD Cade Dosunmu makes 1/1 from the line.
Score: 14-7

[05:57] Team_081 possession (Score: 14-7)
Bradley Sabonis drives, Cade Dosunmu stays with him. Bradley Sabonis attempts a Layup. Contested by Cade Dosunmu (3.8 feet, ZONE). BRADLEY SABONIS MAKES IT!
Score: 14-9

[05:42] Team_042 possession (Score: 14-9)
Kristaps Parker attempts a Layup. Contested by Bradley Leonard (3.6 feet, MAN). Kristaps Parker misses. Offensive rebound by Dejounte Butler! Dejounte Butler puts it back in!
Score: 16-9

[05:24] Team_081 possession (Score: 16-9)
Vince Adebayo drives, Cade Dosunmu stays with him. Vince Adebayo attempts a Dunk. Contested by Cade Dosunmu (4.0 feet, ZONE). VINCE ADEBAYO MAKES IT!
Score: 16-11

[05:11] Team_042 possession (Score: 16-11)
Cade Dosunmu drives and kicks out. Dejounte Butler attempts a 3Pt. Contested by Bradley Sabonis (4.0 feet, MAN). Dejounte Butler misses. Rebound secured by Bradley Sabonis.

[04:58] Team_081 possession (Score: 16-11)
FOUL! Offensive foul on Bradley Leonard! Kristaps Parker drew the charge! [Team fouls: 2] (Bradley Leonard: 1 personal fouls) TURNOVER! (dead ball)

[04:46] Team_042 possession (Score: 16-11)
Dejounte Butler attempts a 3Pt. Contested by Bradley Leonard (4.0 feet, ZONE). Dejounte Butler misses. Offensive rebound by Cade Dosunmu! Cade Dosunmu's putback is no good. Rebound secured by Franz Antetokounmpo.

[04:33] Team_081 possession (Score: 16-11)
Bradley Leonard attempts a Midrange. Contested by Kristaps Parker (5.2 feet, MAN). BRADLEY LEONARD MAKES IT!
Score: 16-13

[04:17] Team_042 possession (Score: 16-13)
Jarrett Sabonis attempts a 3Pt. Contested by Vince Adebayo (4.0 feet, MAN). Jarrett Sabonis misses. Rebound secured by Bradley Sabonis.

[04:04] Team_081 possession (Score: 16-13)
Bradley Sabonis drives, Cade Dosunmu stays with him. Bradley Sabonis attempts a Layup. Contested by Cade Dosunmu (4.0 feet, ZONE). BRADLEY SABONIS MAKES IT! Assist: Bradley Leonard
Score: 16-15

[03:47] Team_042 possession (Score: 16-15)
Kristaps Parker attempts a 3Pt. Contested by Bradley Leonard (3.7 feet, MAN). Kristaps Parker misses. Rebound secured by Bradley Sabonis.

[03:35] Team_081 possession (Score: 16-15)
Bradley Sabonis drives and kicks out. Bradley Leonard attempts a 3Pt. Contested by Kristaps Parker (5.1 feet, MAN). Bradley Leonard misses. Rebound secured by Dejounte Butler.

[03:21] Team_042 possession (Score: 16-15)
Kristaps Parker attempts a 3Pt. Contested by Bradley Leonard (3.8 feet, MAN). Kristaps Parker misses. Rebound secured by Vince Adebayo.

[03:07] Team_081 possession (Score: 16-15)
Bradley Sabonis drives and kicks out. Franz Antetokounmpo attempts a 3Pt. Contested by Tyler Barrett (3.6 feet, ZONE). FRANZ ANTETOKOUNMPO MAKES IT! Assist: Julius Durant
Score: 16-18

[02:55] Team_042 possession (Score: 16-18)
Cade Dosunmu makes the Layup and draws the foul on Franz Antetokounmpo! And-1! Cade Dosunmu to the line for 1. [Team fouls: 3] (Franz Antetokounmpo: 2 personal fouls)   FT 1/1: GOOD Cade Dosunmu makes 1/1 from the line.
Score: 19-18

[02:42] Team_081 possession (Score: 19-18)
Julius Durant attempts a 3Pt. Contested by Jarrett Sabonis (4.2 feet, ZONE). Julius Durant misses. Rebound secured by Dejounte Butler.

[02:28] Team_042 possession (Score: 19-18)
Kristaps Parker loses the ball! Stripped by Bradley Leonard! TURNOVER! (live ball)

[02:17] Team_081 possession (Score: 19-18)
Vince Adebayo attempts a Layup. Contested by Jarrett Sabonis (4.2 feet, MAN). VINCE ADEBAYO MAKES IT! Assist: Franz Antetokounmpo
Score: 19-20

[02:02] Team_042 possession (Score: 19-20)
Kristaps Parker commits a violation (traveling/carry)! TURNOVER! (dead ball)

[02:02] Substitution (Team_042): Tyler Barrett OUT → Khris George IN (stamina_rule2)

[02:02] Substitution (Team_042): Kristaps Parker OUT → Isaiah Randle IN (stamina_rule2)

[02:02] Substitution (Team_042): Jarrett Sabonis OUT → Gary Jackson IN (stamina_rule2)

[02:02] Substitution (Team_042): Dejounte Butler OUT → Allen Towns IN (stamina_rule2)

[02:02] Substitution (Team_042): Cade Dosunmu OUT → Lamelo Stewart IN (stamina_rule2)

[02:02] Substitution (Team_081): Julius Durant OUT → Dejounte Bane IN (stamina_rule2)

[02:02] Substitution (Team_081): Bradley Leonard OUT → Lamelo Wade IN (stamina_rule2)

[02:02] Substitution (Team_081): Vince Adebayo OUT → Larry Adebayo IN (stamina_rule2)

[02:02] Substitution (Team_081): Bradley Sabonis OUT → Chris Holiday IN (stamina_rule2)

[02:02] Substitution (Team_081): Franz Antetokounmpo OUT → D'Angelo Markkanen IN (stamina_rule2)

[01:46] Team_081 possession (Score: 19-20)
Larry Adebayo attempts a 3Pt. Contested by Gary Jackson (4.5 feet, MAN). LARRY ADEBAYO MAKES IT! Assist: Lamelo Wade
Score: 19-23

[01:31] Team_042 possession (Score: 19-23)
Khris George drives, picks up Chris Holiday. Help arrives from Lamelo Wade! Khris George attempts a Dunk. Contested by Lamelo Wade (5.0 feet, ZONE). KHRIS GEORGE MAKES IT! Assist: Isaiah Randle
Score: 21-23

[01:13] Team_081 possession (Score: 21-23)
D'Angelo Markkanen drives to the basket... D'Angelo Markkanen commits a violation (traveling/carry)! TURNOVER! (dead ball)

[01:04] Team_042 possession (Score: 21-23)
Isaiah Randle attempts a Layup. Contested by Chris Holiday (4.4 feet, ZONE). Isaiah Randle misses. Rebound secured by Chris Holiday.

[00:52] Team_081 possession (Score: 21-23)
D'Angelo Markkanen drives to the basket... D'Angelo Markkanen throws a bad pass! Stolen by Allen Towns! TURNOVER! (live ball)

[00:33] Team_042 possession (Score: 21-23)
FOUL! Shooting foul on Lamelo Wade. Isaiah Randle to the line for 2 free throws. [Team fouls: 4] (Lamelo Wade: 1 personal fouls)   FT 1/2: GOOD   FT 2/2: GOOD Isaiah Randle makes 2/2 from the line.
Score: 23-23

[00:17] Team_081 possession (Score: 23-23)
Chris Holiday attempts a Midrange. Contested by Allen Towns (4.3 feet, ZONE). CHRIS HOLIDAY MAKES IT! Assist: Larry Adebayo
Score: 23-25

[00:04] Team_042 possession (Score: 23-25)
FOUL! Reach-in foul on Chris Holiday during the drive. [IN THE BONUS! 5 team fouls] Gary Jackson to the line for 2 free throws. (Chris Holiday: 1 personal fouls)   FT 1/2: GOOD   FT 2/2: GOOD Gary Jackson makes 2/2 from the line.
Score: 25-25

================================================================================
                              1ST QUARTER COMPLETE                              
================================================================================

1ST QUARTER SCORE: Team_042 25, Team_081 25

BOX SCORE:
================================================================================

Team_042
--------------------------------------------------------------------------------
Player                MIN  PTS  REB  AST  TO      FG   FG%      3P   3P%
--------------------------------------------------------------------------------
Cade Dosunmu           10   12    3    1   0   5/6    83.3     0/0   0.0
Kristaps Parker        10    3    0    0   0   1/5    20.0     0/0   0.0
Dejounte Butler        10    2    4    3   0   1/3    33.3     0/0   0.0
Jarrett Sabonis        10    2    0    0   0   1/3    33.3     0/0   0.0
Khris George            2    2    0    0   0   1/1   100.0     0/0   0.0
Isaiah Randle           2    2    0    1   0   1/2    50.0     0/0   0.0
Gary Jackson            2    2    0    0   0   1/1   100.0     0/0   0.0
Tyler Barrett          10    0    2    0   0   0/1     0.0     0/0   0.0

TEAM: FG: 11/22 (50.0%), 3PT: 0/6 (0.0%), REB: 10 (2 off, 8 def), AST: 5, TO: 4
TEAM FOULS: 0


Team_081
--------------------------------------------------------------------------------
Player                MIN  PTS  REB  AST  TO      FG   FG%      3P   3P%
--------------------------------------------------------------------------------
Vince Adebayo          10    6    4    1   0   3/7    42.9     0/0   0.0
Franz Antetokounmpo    10    5    4    1   0   2/2   100.0     0/0   0.0
Bradley Leonard        10    5    0    1   0   2/3    66.7     0/0   0.0
Bradley Sabonis        10    4    3    0   0   2/3    66.7     0/0   0.0
Larry Adebayo           2    3    0    1   0   1/1   100.0     0/0   0.0
Chris Holiday           2    2    1    0   0   1/1   100.0     0/0   0.0
Julius Durant          10    0    0    1   0   0/2     0.0     0/0   0.0
Lamelo Wade             2    0    0    1   0   0/0     0.0     0/0   0.0

TEAM: FG: 11/19 (57.9%), 3PT: 3/9 (33.3%), REB: 11 (1 off, 10 def), AST: 6, TO: 6
TEAM FOULS: 5 [Team_042 in BONUS]

================================================================================

================================================================================
                       2ND QUARTER - Team_042 vs Team_081                       
================================================================================

[12:00] Team_042 possession (Score: 25-25)
Jarrett Sabonis attempts a Midrange. Contested by Vince Adebayo (4.0 feet, MAN). Jarrett Sabonis misses. Rebound secured by Vince Adebayo.

[11:45] Team_081 possession (Score: 25-25)
FOUL! Holding foul on Dejounte Butler. [Team fouls: 1] No free throws, side out. (Dejounte Butler: 1 personal fouls)

[11:26] Team_081 possession (Score: 25-25)
Franz Antetokounmpo attempts a Midrange. Contested by Jarrett Sabonis (4.1 feet, ZONE). FRANZ ANTETOKOUNMPO MAKES IT!
Score: 25-27

[11:14] Team_042 possession (Score: 25-27)
FOUL! Shooting foul on Bradley Leonard. Dejounte Butler to the line for 2 free throws. [Team fouls: 1] (Bradley Leonard: 1 personal fouls)   FT 1/2: GOOD   FT 2/2: GOOD Dejounte Butler makes 2/2 from the line.
Score: 27-27

[11:00] Team_081 possession (Score: 27-27)
Julius Durant drives, Tyler Barrett stays with him. Julius Durant attempts a Dunk. Contested by Tyler Barrett (3.6 feet, MAN). JULIUS DURANT MAKES IT! Assist: Bradley Sabonis
Score: 27-29

[10:44] Team_042 possession (Score: 27-29)
Kristaps Parker makes the Layup and draws the foul on Franz Antetokounmpo! And-1! Kristaps Parker to the line for 1. [Team fouls: 2] (Franz Antetokounmpo: 1 personal fouls)   FT 1/1: GOOD Kristaps Parker makes 1/1 from the line.
Score: 30-29

[10:27] Team_081 possession (Score: 30-29)
Julius Durant attempts a Layup. Contested by Tyler Barrett (3.6 feet, MAN). JULIUS DURANT MAKES IT! Assist: Franz Antetokounmpo
Score: 30-31

[10:12] Team_042 possession (Score: 30-31)
Cade Dosunmu loses the ball! Stripped by Franz Antetokounmpo! TURNOVER! (live ball)

[09:55] Team_081 possession (Score: 30-31)
FOUL! Reach-in foul on Dejounte Butler during the drive. [Team fouls: 2] No free throws, side out. (Dejounte Butler: 2 personal fouls)

[09:36] Team_081 possession (Score: 30-31)
Bradley Leonard drives, Kristaps Parker stays with him. Bradley Leonard attempts a Dunk. Contested by Kristaps Parker (5.3 feet, MAN). Bradley Leonard misses. Rebound secured by Dejounte Butler.

[09:19] Team_042 possession (Score: 30-31)
Kristaps Parker attempts a 3Pt. Contested by Bradley Leonard (3.9 feet, MAN). KRISTAPS PARKER MAKES IT! Assist: Dejounte Butler
Score: 33-31

[09:08] Team_081 possession (Score: 33-31)
Vince Adebayo drives, Jarrett Sabonis stays with him. Vince Adebayo attempts a Layup. Contested by Jarrett Sabonis (4.2 feet, MAN). Vince Adebayo misses. Offensive rebound by Franz Antetokounmpo! Franz Antetokounmpo's putback is no good. Offensive rebound by Franz Antetokounmpo! Franz Antetokounmpo kicks it out.

[08:55] Team_081 possession (Score: 33-31)
Bradley Leonard attempts a 3Pt. Contested by Kristaps Parker (5.4 feet, MAN). BRADLEY LEONARD MAKES IT! Assist: Vince Adebayo
Score: 33-34

[08:43] Team_042 possession (Score: 33-34)
Tyler Barrett attempts a Midrange. Contested by Bradley Sabonis (4.7 feet, ZONE). Tyler Barrett misses. Rebound secured by Bradley Sabonis.

[08:27] Team_081 possession (Score: 33-34)
Franz Antetokounmpo attempts a Midrange. Contested by Jarrett Sabonis (4.3 feet, ZONE). Franz Antetokounmpo misses. Rebound secured by Cade Dosunmu.

[08:11] Team_042 possession (Score: 33-34)
Jarrett Sabonis attempts a Midrange. Contested by Bradley Leonard (4.5 feet, ZONE). Jarrett Sabonis misses. Rebound secured by Bradley Sabonis.

[07:58] Team_081 possession (Score: 33-34)
Vince Adebayo attempts a 3Pt. Contested by Jarrett Sabonis (4.3 feet, MAN). Vince Adebayo misses. Rebound secured by Dejounte Butler.

[07:46] Team_042 possession (Score: 33-34)
Cade Dosunmu attempts a Midrange. Contested by Franz Antetokounmpo (4.9 feet, ZONE). Cade Dosunmu misses. Rebound secured by Vince Adebayo.

[07:35] Team_081 possession (Score: 33-34)
Julius Durant attempts a 3Pt. Contested by Tyler Barrett (4.0 feet, ZONE). JULIUS DURANT MAKES IT! Assist: Bradley Leonard
Score: 33-37

[07:22] Team_042 possession (Score: 33-37)
Jarrett Sabonis attempts a 3Pt. Contested by Bradley Leonard (4.6 feet, ZONE). JARRETT SABONIS MAKES IT! Assist: Dejounte Butler
Score: 36-37

[07:09] Team_081 possession (Score: 36-37)
Bradley Sabonis attempts a 3Pt. Contested by Dejounte Butler (4.1 feet, MAN). Bradley Sabonis misses. Rebound secured by Tyler Barrett.

[06:55] Team_042 possession (Score: 36-37)
FOUL! Offensive foul on Kristaps Parker! Bradley Leonard drew the charge! [Team fouls: 3] (Kristaps Parker: 1 personal fouls) TURNOVER! (dead ball)

[06:37] Team_081 possession (Score: 36-37)
Vince Adebayo attempts a 3Pt. Contested by Jarrett Sabonis (4.5 feet, MAN). Vince Adebayo misses. Offensive rebound by Bradley Sabonis! Bradley Sabonis kicks it out.

[06:20] Team_081 possession (Score: 36-37)
Julius Durant attempts a 3Pt. Contested by Tyler Barrett (4.1 feet, MAN). Julius Durant misses. Rebound secured by Cade Dosunmu.

[06:10] Team_042 possession (Score: 36-37)
Dejounte Butler attempts a Layup. Contested by Bradley Sabonis (4.8 feet, MAN). Dejounte Butler misses. FOUL! Loose ball foul on Bradley Sabonis during the rebound battle. [Team fouls: 3] No free throws, side out. (Bradley Sabonis: 1 personal fouls)

[05:56] Team_042 possession (Score: 36-37)
Kristaps Parker attempts a Midrange. Contested by Bradley Sabonis (4.6 feet, ZONE). KRISTAPS PARKER MAKES IT!
Score: 38-37

[05:46] Team_081 possession (Score: 38-37)
Vince Adebayo attempts a Layup. BLOCKED BY TYLER BARRETT! Ball is loose! Rebound secured by Cade Dosunmu.

[05:28] Team_042 possession (Score: 38-37)
Tyler Barrett attempts a Layup. Contested by Julius Durant (5.1 feet, MAN). Tyler Barrett misses. Offensive rebound by Cade Dosunmu! Cade Dosunmu puts it back in!
Score: 40-37

[05:13] Team_081 possession (Score: 40-37)
Bradley Leonard drives and kicks out. Bradley Leonard attempts a Midrange. Contested by Jarrett Sabonis (4.8 feet, ZONE). BRADLEY LEONARD MAKES IT!
Score: 40-39

[04:59] Team_042 possession (Score: 40-39)
Cade Dosunmu attempts a Layup. Contested by Franz Antetokounmpo (5.3 feet, ZONE). CADE DOSUNMU MAKES IT! Assist: Dejounte Butler
Score: 42-39

[04:46] Team_081 possession (Score: 42-39)
Bradley Leonard attempts a Midrange. Contested by Dejounte Butler (4.7 feet, ZONE). Bradley Leonard misses. Rebound secured by Tyler Barrett.

[04:31] Team_042 possession (Score: 42-39)
FOUL! Holding foul on Vince Adebayo. [Team fouls: 4] No free throws, side out. (Vince Adebayo: 1 personal fouls)

[04:17] Team_042 possession (Score: 42-39)
Jarrett Sabonis makes the Layup and draws the foul on Franz Antetokounmpo! And-1! Jarrett Sabonis to the line for 1. [BONUS: 5 team fouls] (Franz Antetokounmpo: 2 personal fouls)   FT 1/1: MISS Jarrett Sabonis makes 0/1 from the line. Rebound secured by Franz Antetokounmpo.
Score: 44-39

[04:01] Team_081 possession (Score: 44-39)
FOUL! Reach-in foul on Cade Dosunmu during the drive. [Team fouls: 4] No free throws, side out. (Cade Dosunmu: 1 personal fouls)

[03:51] Team_081 possession (Score: 44-39)
FOUL! Shooting foul on Jarrett Sabonis. Vince Adebayo to the line for 3 free throws. [BONUS: 5 team fouls] (Jarrett Sabonis: 1 personal fouls)   FT 1/3: GOOD   FT 2/3: MISS   FT 3/3: GOOD Vince Adebayo makes 2/3 from the line.
Score: 44-41

[03:34] Team_042 possession (Score: 44-41)
FOUL! Holding foul on Julius Durant. [IN THE BONUS! 6 team fouls] Tyler Barrett to the line for 2 free throws. (Julius Durant: 1 personal fouls)   FT 1/2: GOOD   FT 2/2: GOOD Tyler Barrett makes 2/2 from the line.
Score: 46-41

[03:17] Team_081 possession (Score: 46-41)
Bradley Leonard attempts a Layup. Contested by Cade Dosunmu (5.3 feet, ZONE). BRADLEY LEONARD MAKES IT! Assist: Bradley Sabonis
Score: 46-43

[03:01] Team_042 possession (Score: 46-43)
Kristaps Parker drives, Bradley Leonard stays with him. Kristaps Parker attempts a Dunk. Contested by Bradley Leonard (4.7 feet, MAN). Kristaps Parker misses. Rebound secured by Bradley Sabonis.

[02:47] Team_081 possession (Score: 46-43)
Bradley Leonard attempts a 3Pt. Contested by Tyler Barrett (4.7 feet, ZONE). Bradley Leonard misses. Rebound secured by Tyler Barrett.

[02:29] Team_042 possession (Score: 46-43)
Cade Dosunmu attempts a Layup. Contested by Franz Antetokounmpo (5.6 feet, ZONE). CADE DOSUNMU MAKES IT! Assist: Jarrett Sabonis
Score: 48-43

[02:12] Team_081 possession (Score: 48-43)
Franz Antetokounmpo makes the Dunk and draws the foul on Tyler Barrett! And-1! Franz Antetokounmpo to the line for 1. [BONUS: 6 team fouls] (Tyler Barrett: 1 personal fouls)   FT 1/1: GOOD Franz Antetokounmpo makes 1/1 from the line.
Score: 48-46

[01:58] Team_042 possession (Score: 48-46)
Kristaps Parker attempts a 3Pt. Contested by Bradley Leonard (4.8 feet, MAN). Kristaps Parker misses. Rebound secured by Bradley Sabonis.

[01:39] Team_081 possession (Score: 48-46)
Vince Adebayo makes the Layup and draws the foul on Tyler Barrett! And-1! Vince Adebayo to the line for 1. [BONUS: 7 team fouls] (Tyler Barrett: 2 personal fouls)   FT 1/1: GOOD Vince Adebayo makes 1/1 from the line.
Score: 48-49

[01:28] Team_042 possession (Score: 48-49)
Jarrett Sabonis attempts a 3Pt. Contested by Vince Adebayo (5.4 feet, MAN). Jarrett Sabonis misses. Rebound secured by Franz Antetokounmpo.

[01:15] Team_081 possession (Score: 48-49)
Bradley Leonard attempts a 3Pt. Wide open! Kristaps Parker is 6.3 feet away. [MAN] BRADLEY LEONARD MAKES IT! Assist: Vince Adebayo
Score: 48-52

[01:02] Team_042 possession (Score: 48-52)
Jarrett Sabonis attempts a Midrange. Contested by Vince Adebayo (5.5 feet, ZONE). JARRETT SABONIS MAKES IT! Assist: Cade Dosunmu
Score: 50-52

[00:47] Team_081 possession (Score: 50-52)
Bradley Sabonis attempts a Midrange. Contested by Dejounte Butler (5.1 feet, ZONE). Bradley Sabonis misses. Rebound secured by Cade Dosunmu.

[00:38] Team_042 possession (Score: 50-52)
Kristaps Parker drives, picks up Bradley Leonard. Help arrives from Vince Adebayo! Kristaps Parker attempts a Layup. Contested by Vince Adebayo (5.0 feet, MAN). KRISTAPS PARKER MAKES IT! Assist: Dejounte Butler
Score: 52-52

[00:20] Team_081 possession (Score: 52-52)
Bradley Leonard attempts a 3Pt. Contested by Tyler Barrett (5.1 feet, ZONE). BRADLEY LEONARD MAKES IT! Assist: Julius Durant
Score: 52-55

[00:08] Team_042 possession (Score: 52-55)
Tyler Barrett attempts a 3Pt. Contested by Julius Durant (5.8 feet, MAN). Tyler Barrett misses. Rebound secured by Vince Adebayo.

================================================================================
                              2ND QUARTER COMPLETE                              
================================================================================

2ND QUARTER SCORE: Team_042 27, Team_081 30

BOX SCORE:
================================================================================

Team_042
--------------------------------------------------------------------------------
Player                MIN  PTS  REB  AST  TO      FG   FG%      3P   3P%
--------------------------------------------------------------------------------
Kristaps Parker        22   10    0    0   0   4/6    66.7     0/0   0.0
Cade Dosunmu           22    6    5    1   0   3/4    75.0     0/0   0.0
Jarrett Sabonis        22    5    0    1   0   2/6    33.3     0/0   0.0
Dejounte Butler        22    2    3    4   0   1/1   100.0     0/0   0.0
Tyler Barrett          22    2    3    0   0   1/3    33.3     0/0   0.0

TEAM: FG: 11/20 (55.0%), 3PT: 2/5 (40.0%), REB: 11 (2 off, 9 def), AST: 6, TO: 2
TEAM FOULS: 7 [Team_081 in BONUS]


Team_081
--------------------------------------------------------------------------------
Player                MIN  PTS  REB  AST  TO      FG   FG%      3P   3P%
--------------------------------------------------------------------------------
Bradley Leonard        22   13    0    1   0   5/8    62.5     0/0   0.0
Julius Durant          22    7    0    1   0   3/4    75.0     0/0   0.0
Vince Adebayo          22    5    3    2   0   2/4    50.0     0/0   0.0
Franz Antetokounmpo    22    5    3    1   0   2/3    66.7     0/0   0.0
Bradley Sabonis        22    0    5    2   0   0/2     0.0     0/0   0.0

TEAM: FG: 12/21 (57.1%), 3PT: 5/9 (55.6%), REB: 11 (2 off, 9 def), AST: 7, TO: 0
TEAM FOULS: 6 [Team_042 in BONUS]

================================================================================

================================================================================
                       3RD QUARTER - Team_042 vs Team_081                       
================================================================================

[12:00] Team_042 possession (Score: 52-55)
Jarrett Sabonis attempts a Midrange. Contested by Vince Adebayo (3.9 feet, MAN). Jarrett Sabonis misses. Rebound secured by Bradley Sabonis.

[11:40] Team_081 possession (Score: 52-55)
Julius Durant attempts a 3Pt. Contested by Dejounte Butler (3.7 feet, ZONE). JULIUS DURANT MAKES IT! Assist: Bradley Sabonis
Score: 52-58

[11:25] Team_042 possession (Score: 52-58)
Tyler Barrett attempts a 3Pt. Contested by Vince Adebayo (3.9 feet, ZONE). Tyler Barrett misses. FOUL! Loose ball foul on Bradley Sabonis during the rebound battle. [Team fouls: 1] No free throws, side out. (Bradley Sabonis: 1 personal fouls)

[11:11] Team_042 possession (Score: 52-58)
Jarrett Sabonis attempts a Layup. Contested by Vince Adebayo (3.9 feet, MAN). Jarrett Sabonis misses. Rebound secured by Bradley Sabonis.

[10:57] Team_081 possession (Score: 52-58)
Vince Adebayo attempts a Midrange. Contested by Jarrett Sabonis (3.9 feet, MAN). VINCE ADEBAYO MAKES IT!
Score: 52-60

[10:38] Team_042 possession (Score: 52-60)
Dejounte Butler attempts a 3Pt. Contested by Vince Adebayo (3.7 feet, ZONE). Dejounte Butler misses. Rebound secured by Vince Adebayo.

[10:22] Team_081 possession (Score: 52-60)
Franz Antetokounmpo attempts a Midrange. Contested by Cade Dosunmu (4.0 feet, MAN). FRANZ ANTETOKOUNMPO MAKES IT! Assist: Bradley Leonard
Score: 52-62

[10:11] Team_042 possession (Score: 52-62)
Tyler Barrett drives and kicks out. Dejounte Butler attempts a 3Pt. Contested by Bradley Sabonis (4.0 feet, MAN). Dejounte Butler misses. Rebound secured by Bradley Sabonis.

[09:54] Team_081 possession (Score: 52-62)
Vince Adebayo attempts a 3Pt. Contested by Jarrett Sabonis (3.9 feet, MAN). VINCE ADEBAYO MAKES IT! Assist: Julius Durant
Score: 52-65

[09:37] Team_042 possession (Score: 52-65)
Cade Dosunmu drives, Franz Antetokounmpo stays with him. Cade Dosunmu attempts a Dunk. Contested by Franz Antetokounmpo (4.5 feet, MAN). CADE DOSUNMU MAKES IT! Assist: Jarrett Sabonis
Score: 54-65

[09:19] Team_081 possession (Score: 54-65)
Bradley Leonard attempts a Midrange. Contested by Kristaps Parker (5.1 feet, ZONE). Bradley Leonard misses. Rebound secured by Tyler Barrett.

[09:07] Team_042 possession (Score: 54-65)
Kristaps Parker attempts a Midrange. BLOCKED BY BRADLEY LEONARD! Ball deflects out of bounds off Kristaps Parker.

[08:54] Team_081 possession (Score: 54-65)
Vince Adebayo attempts a Layup. Contested by Cade Dosunmu (3.9 feet, ZONE). Vince Adebayo misses. Rebound secured by Dejounte Butler.

[08:35] Team_042 possession (Score: 54-65)
Dejounte Butler makes the 3Pt and draws the foul on Bradley Sabonis! And-1! Dejounte Butler to the line for 1. [Team fouls: 2] (Bradley Sabonis: 2 personal fouls)   FT 1/1: GOOD Dejounte Butler makes 1/1 from the line.
Score: 58-65

[08:24] Team_081 possession (Score: 58-65)
Julius Durant drives to the basket... Julius Durant throws a bad pass out of bounds! TURNOVER! (dead ball)

[08:11] Team_042 possession (Score: 58-65)
Kristaps Parker makes the Layup and draws the foul on Bradley Leonard! And-1! Kristaps Parker to the line for 1. [Team fouls: 3] (Bradley Leonard: 1 personal fouls)   FT 1/1: GOOD Kristaps Parker makes 1/1 from the line.
Score: 61-65

[07:56] Team_081 possession (Score: 61-65)
Vince Adebayo attempts a 3Pt. Contested by Jarrett Sabonis (3.9 feet, MAN). Vince Adebayo misses. Rebound secured by Dejounte Butler.

[07:40] Team_042 possession (Score: 61-65)
Dejounte Butler attempts a 3Pt. Contested by Bradley Sabonis (4.3 feet, MAN). Dejounte Butler misses. Rebound secured by Franz Antetokounmpo.

[07:21] Team_081 possession (Score: 61-65)
Bradley Leonard attempts a Midrange. Contested by Jarrett Sabonis (4.0 feet, ZONE). Bradley Leonard misses. Rebound secured by Tyler Barrett.

[07:07] Team_042 possession (Score: 61-65)
Dejounte Butler drives and kicks out. Kristaps Parker attempts a 3Pt. Contested by Bradley Leonard (3.7 feet, MAN). Kristaps Parker misses. Rebound secured by Franz Antetokounmpo.

[06:52] Team_081 possession (Score: 61-65)
FOUL! Shooting foul on Tyler Barrett. Vince Adebayo to the line for 2 free throws. [Team fouls: 1] (Tyler Barrett: 1 personal fouls)   FT 1/2: GOOD   FT 2/2: GOOD Vince Adebayo makes 2/2 from the line.
Score: 61-67

[06:35] Team_042 possession (Score: 61-67)
Dejounte Butler attempts a 3Pt. Contested by Bradley Sabonis (4.3 feet, MAN). Dejounte Butler misses. Offensive rebound by Dejounte Butler! Dejounte Butler's putback is no good. Offensive rebound by Cade Dosunmu! Cade Dosunmu kicks it out.

[06:19] Team_042 possession (Score: 61-67)
Jarrett Sabonis attempts a 3Pt. Contested by Vince Adebayo (3.9 feet, MAN). Jarrett Sabonis misses. Offensive rebound by Cade Dosunmu! Cade Dosunmu's putback is no good. Rebound secured by Franz Antetokounmpo.

[06:03] Team_081 possession (Score: 61-67)
Julius Durant drives, Tyler Barrett stays with him. Julius Durant attempts a Layup. Contested by Tyler Barrett (3.5 feet, MAN). Julius Durant misses. Offensive rebound by Bradley Sabonis! Bradley Sabonis kicks it out.

[05:47] Team_081 possession (Score: 61-67)
FOUL! Shooting foul on Tyler Barrett. Julius Durant to the line for 3 free throws. [Team fouls: 2] (Tyler Barrett: 2 personal fouls)   FT 1/3: GOOD   FT 2/3: GOOD   FT 3/3: MISS Julius Durant makes 2/3 from the line. Rebound secured by Tyler Barrett.
Score: 61-69

[05:33] Team_042 possession (Score: 61-69)
Dejounte Butler attempts a 3Pt. Contested by Vince Adebayo (3.7 feet, ZONE). Dejounte Butler misses. Rebound secured by Franz Antetokounmpo.

[05:20] Team_081 possession (Score: 61-69)
Bradley Leonard attempts a Layup. BLOCKED BY CADE DOSUNMU! Ball is loose! Rebound secured by Dejounte Butler.

[05:06] Team_042 possession (Score: 61-69)
Cade Dosunmu attempts a Midrange. Contested by Franz Antetokounmpo (4.5 feet, MAN). Cade Dosunmu misses. Rebound secured by Franz Antetokounmpo.

[04:54] Team_081 possession (Score: 61-69)
Vince Adebayo attempts a Midrange. Contested by Jarrett Sabonis (3.9 feet, MAN). VINCE ADEBAYO MAKES IT!
Score: 61-71

[04:39] Team_042 possession (Score: 61-71)
Jarrett Sabonis attempts a 3Pt. Contested by Bradley Leonard (4.1 feet, ZONE). Jarrett Sabonis misses. FOUL! Loose ball foul on Franz Antetokounmpo during the rebound battle. [Team fouls: 4] No free throws, side out. (Franz Antetokounmpo: 1 personal fouls)

[04:26] Team_042 possession (Score: 61-71)
FOUL! Shooting foul on Franz Antetokounmpo. Cade Dosunmu to the line for 2 free throws. [BONUS: 5 team fouls] (Franz Antetokounmpo: 2 personal fouls)   FT 1/2: GOOD   FT 2/2: GOOD Cade Dosunmu makes 2/2 from the line.
Score: 63-71

[04:13] Team_081 possession (Score: 63-71)
FOUL! Holding foul on Dejounte Butler. [Team fouls: 3] No free throws, side out. (Dejounte Butler: 1 personal fouls)

[04:00] Team_081 possession (Score: 63-71)
Bradley Sabonis loses the ball! Stripped by Dejounte Butler! TURNOVER! (live ball)

[03:43] Team_042 possession (Score: 63-71)
Dejounte Butler attempts a Midrange. Contested by Bradley Leonard (4.0 feet, ZONE). Dejounte Butler misses. Rebound secured by Vince Adebayo.

[03:29] Team_081 possession (Score: 63-71)
Bradley Leonard attempts a 3Pt. Contested by Tyler Barrett (3.7 feet, ZONE). Bradley Leonard misses. Rebound secured by Cade Dosunmu.

[03:18] Team_042 possession (Score: 63-71)
Dejounte Butler attempts a 3Pt. Contested by Bradley Sabonis (4.4 feet, MAN). Dejounte Butler misses. Rebound secured by Bradley Sabonis.

[03:02] Team_081 possession (Score: 63-71)
Franz Antetokounmpo commits a violation (traveling/carry)! TURNOVER! (dead ball)

[02:46] Team_042 possession (Score: 63-71)
Jarrett Sabonis drives, Franz Antetokounmpo stays with him. Jarrett Sabonis attempts a Layup. Contested by Franz Antetokounmpo (4.9 feet, ZONE). Jarrett Sabonis misses. FOUL! Loose ball foul on Bradley Sabonis during the rebound battle. [IN THE BONUS! 6 team fouls] Dejounte Butler to the line for 2 free throws. (Bradley Sabonis: 3 personal fouls)   FT 1/2: GOOD   FT 2/2: GOOD Dejounte Butler makes 2/2 from the line.
Score: 65-71

[02:27] Team_081 possession (Score: 65-71)
Bradley Leonard attempts a 3Pt. Contested by Kristaps Parker (5.3 feet, MAN). Bradley Leonard misses. Offensive rebound by Franz Antetokounmpo! Franz Antetokounmpo puts it back in!
Score: 65-73

[02:13] Team_042 possession (Score: 65-73)
Dejounte Butler attempts a 3Pt. Contested by Bradley Leonard (4.1 feet, ZONE). DEJOUNTE BUTLER MAKES IT! Assist: Kristaps Parker
Score: 68-73

[02:03] Team_081 possession (Score: 68-73)
FOUL! Holding foul on Jarrett Sabonis. [Team fouls: 4] No free throws, side out. (Jarrett Sabonis: 1 personal fouls)

[01:47] Team_081 possession (Score: 68-73)
Bradley Sabonis drives to the basket... Bradley Sabonis throws a bad pass out of bounds! TURNOVER! (dead ball)

[01:47] Substitution (Team_042): Tyler Barrett OUT → Khris George IN (stamina_rule2)

[01:47] Substitution (Team_042): Kristaps Parker OUT → Isaiah Randle IN (stamina_rule2)

[01:47] Substitution (Team_042): Jarrett Sabonis OUT → Gary Jackson IN (stamina_rule2)

[01:47] Substitution (Team_042): Dejounte Butler OUT → Allen Towns IN (stamina_rule2)

[01:47] Substitution (Team_042): Cade Dosunmu OUT → Lamelo Stewart IN (stamina_rule2)

[01:47] Substitution (Team_081): Julius Durant OUT → Dejounte Bane IN (stamina_rule2)

[01:47] Substitution (Team_081): Bradley Leonard OUT → Lamelo Wade IN (stamina_rule2)

[01:47] Substitution (Team_081): Vince Adebayo OUT → Larry Adebayo IN (stamina_rule2)

[01:47] Substitution (Team_081): Bradley Sabonis OUT → Chris Holiday IN (stamina_rule2)

[01:47] Substitution (Team_081): Franz Antetokounmpo OUT → D'Angelo Markkanen IN (stamina_rule2)

[01:31] Team_042 possession (Score: 68-73)
FOUL! Holding foul on Chris Holiday. [IN THE BONUS! 7 team fouls] Lamelo Stewart to the line for 2 free throws. (Chris Holiday: 1 personal fouls)   FT 1/2: GOOD   FT 2/2: GOOD Lamelo Stewart makes 2/2 from the line.
Score: 70-73

[01:17] Team_081 possession (Score: 70-73)
Dejounte Bane attempts a 3Pt. Contested by Khris George (4.2 feet, ZONE). Dejounte Bane misses. Rebound secured by Allen Towns.

[01:06] Team_042 possession (Score: 70-73)
FOUL! Shooting foul on Lamelo Wade. Allen Towns to the line for 2 free throws. [BONUS: 8 team fouls] (Lamelo Wade: 1 personal fouls)   FT 1/2: GOOD   FT 2/2: GOOD Allen Towns makes 2/2 from the line.
Score: 72-73

[00:52] Team_081 possession (Score: 72-73)
D'Angelo Markkanen drives, picks up Lamelo Stewart. Help arrives from Khris George! D'Angelo Markkanen attempts a Layup. Contested by Khris George (4.3 feet, MAN). D'ANGELO MARKKANEN MAKES IT!
Score: 72-75

[00:38] Team_042 possession (Score: 72-75)
Gary Jackson attempts a 3Pt. Contested by Chris Holiday (4.3 feet, ZONE). Gary Jackson misses. Rebound secured by Lamelo Wade.

[00:23] Team_081 possession (Score: 72-75)
Chris Holiday attempts a 3Pt. Contested by Allen Towns (4.3 feet, MAN). Chris Holiday misses. Rebound secured by Lamelo Stewart.

[00:06] Team_042 possession (Score: 72-75)
Gary Jackson attempts a Midrange. Contested by Larry Adebayo (5.3 feet, MAN). GARY JACKSON MAKES IT! Assist: Allen Towns
Score: 74-75

================================================================================
                              3RD QUARTER COMPLETE                              
================================================================================

3RD QUARTER SCORE: Team_042 22, Team_081 20

BOX SCORE:
================================================================================

Team_042
--------------------------------------------------------------------------------
Player                MIN  PTS  REB  AST  TO      FG   FG%      3P   3P%
--------------------------------------------------------------------------------
Dejounte Butler        33    9    3    0   0   3/9    33.3     0/0   0.0
Cade Dosunmu           33    4    4    0   0   2/3    66.7     0/0   0.0
Kristaps Parker        33    3    0    1   0   1/2    50.0     0/0   0.0
Lamelo Stewart          4    2    1    0   0   1/1   100.0     0/0   0.0
Allen Towns             4    2    1    1   0   1/1   100.0     0/0   0.0
Gary Jackson            4    2    0    0   0   1/2    50.0     0/0   0.0
Jarrett Sabonis        33    0    0    1   0   0/3     0.0     0/0   0.0
Tyler Barrett          33    0    3    0   0   0/1     0.0     0/0   0.0

TEAM: FG: 9/22 (40.9%), 3PT: 2/8 (25.0%), REB: 13 (4 off, 9 def), AST: 3, TO: 0
TEAM FOULS: 4


Team_081
--------------------------------------------------------------------------------
Player                MIN  PTS  REB  AST  TO      FG   FG%      3P   3P%
--------------------------------------------------------------------------------
Vince Adebayo          33    9    2    0   0   4/6    66.7     0/0   0.0
Franz Antetokounmpo    33    4    6    0   0   2/2   100.0     0/0   0.0
Julius Durant          33    3    0    1   0   1/2    50.0     0/0   0.0
D'Angelo Markkanen      4    2    0    0   0   1/1   100.0     0/0   0.0
Bradley Sabonis        33    0    5    1   0   0/0     0.0     0/0   0.0
Bradley Leonard        33    0    0    1   0   0/4     0.0     0/0   0.0
Dejounte Bane           4    0    0    0   0   0/1     0.0     0/0   0.0
Lamelo Wade             4    0    1    0   0   0/0     0.0     0/0   0.0
Chris Holiday           4    0    0    0   0   0/1     0.0     0/0   0.0

TEAM: FG: 8/17 (47.1%), 3PT: 3/8 (37.5%), REB: 13 (2 off, 11 def), AST: 3, TO: 4
TEAM FOULS: 8 [Team_042 in BONUS]

================================================================================

================================================================================
                       4TH QUARTER - Team_042 vs Team_081                       
================================================================================

[12:00] Team_042 possession (Score: 74-75)
Kristaps Parker drives, Bradley Leonard stays with him. Kristaps Parker attempts a Dunk. Contested by Bradley Leonard (3.6 feet, MAN). KRISTAPS PARKER MAKES IT! Assist: Cade Dosunmu
Score: 76-75

[11:46] Team_081 possession (Score: 76-75)
Franz Antetokounmpo attempts a Dunk. BLOCKED BY CADE DOSUNMU! Ball goes out off Cade Dosunmu. Franz Antetokounmpo's ball!

[11:33] Team_081 possession (Score: 76-75)
Vince Adebayo makes the Dunk and draws the foul on Cade Dosunmu! And-1! Vince Adebayo to the line for 1. [Team fouls: 1] (Cade Dosunmu: 1 personal fouls)   FT 1/1: GOOD Vince Adebayo makes 1/1 from the line.
Score: 76-78

[11:17] Team_042 possession (Score: 76-78)
FOUL! Offensive foul on Kristaps Parker! Bradley Leonard drew the charge! [Team fouls: 2] (Kristaps Parker: 1 personal fouls) TURNOVER! (dead ball)

[11:00] Team_081 possession (Score: 76-78)
Julius Durant attempts a 3Pt. Contested by Tyler Barrett (3.6 feet, ZONE). JULIUS DURANT MAKES IT! Assist: Vince Adebayo
Score: 76-81

[10:48] Team_042 possession (Score: 76-81)
FOUL! Shooting foul on Bradley Sabonis. Jarrett Sabonis to the line for 2 free throws. [Team fouls: 1] (Bradley Sabonis: 1 personal fouls)   FT 1/2: GOOD   FT 2/2: GOOD Jarrett Sabonis makes 2/2 from the line.
Score: 78-81

[10:31] Team_081 possession (Score: 78-81)
Julius Durant attempts a 3Pt. Contested by Tyler Barrett (3.6 feet, ZONE). Julius Durant misses. Rebound secured by Dejounte Butler.

[10:13] Team_042 possession (Score: 78-81)
Cade Dosunmu drives to the basket... Cade Dosunmu throws a bad pass! Stolen by Franz Antetokounmpo! TURNOVER! (live ball)

[09:54] Team_081 possession (Score: 78-81)
Franz Antetokounmpo attempts a Midrange. Contested by Cade Dosunmu (4.3 feet, MAN). Franz Antetokounmpo misses. Rebound secured by Cade Dosunmu.

[09:38] Team_042 possession (Score: 78-81)
Tyler Barrett drives and kicks out. Cade Dosunmu attempts a 3Pt. Contested by Bradley Leonard (3.9 feet, ZONE). Cade Dosunmu misses. Rebound secured by Bradley Sabonis.

[09:25] Team_081 possession (Score: 78-81)
FOUL! Reach-in foul on Kristaps Parker during the drive. [Team fouls: 3] No free throws, side out. (Kristaps Parker: 2 personal fouls)

[09:13] Team_081 possession (Score: 78-81)
Julius Durant throws a bad pass! Stolen by Tyler Barrett! TURNOVER! (live ball)

[08:55] Team_042 possession (Score: 78-81)
Dejounte Butler attempts a Midrange. Contested by Vince Adebayo (4.1 feet, ZONE). Dejounte Butler misses. Offensive rebound by Cade Dosunmu! Cade Dosunmu puts it back in!
Score: 80-81

[08:43] Team_081 possession (Score: 80-81)
Vince Adebayo attempts a 3Pt. Contested by Jarrett Sabonis (4.2 feet, MAN). Vince Adebayo misses. Rebound secured by Tyler Barrett.

[08:31] Team_042 possession (Score: 80-81)
Cade Dosunmu attempts a Layup. Contested by Franz Antetokounmpo (4.9 feet, MAN). CADE DOSUNMU MAKES IT! Assist: Kristaps Parker
Score: 82-81

[08:20] Team_081 possession (Score: 82-81)
Vince Adebayo attempts a Midrange. Contested by Jarrett Sabonis (4.3 feet, ZONE). Vince Adebayo misses. Rebound secured by Tyler Barrett.

[08:08] Team_042 possession (Score: 82-81)
Dejounte Butler drives to the basket... Dejounte Butler throws a bad pass! Stolen by Bradley Sabonis! TURNOVER! (live ball)

[07:54] Team_081 possession (Score: 82-81)
Julius Durant drives and kicks out. Bradley Sabonis attempts a 3Pt. Contested by Dejounte Butler (4.1 feet, MAN). BRADLEY SABONIS MAKES IT! Assist: Bradley Leonard
Score: 82-84

[07:42] Team_042 possession (Score: 82-84)
Jarrett Sabonis attempts a 3Pt. Contested by Bradley Leonard (4.5 feet, ZONE). JARRETT SABONIS MAKES IT! Assist: Cade Dosunmu
Score: 85-84

[07:25] Team_081 possession (Score: 85-84)
Vince Adebayo attempts a Midrange. Contested by Jarrett Sabonis (4.4 feet, MAN). Vince Adebayo misses. Rebound secured by Tyler Barrett.

[07:10] Team_042 possession (Score: 85-84)
Cade Dosunmu drives and kicks out. Kristaps Parker attempts a 3Pt. Contested by Bradley Leonard (4.3 feet, MAN). KRISTAPS PARKER MAKES IT!
Score: 88-84

[06:55] Team_081 possession (Score: 88-84)
Bradley Sabonis attempts a Layup. Contested by Cade Dosunmu (4.5 feet, ZONE). BRADLEY SABONIS MAKES IT! Assist: Bradley Leonard
Score: 88-86

[06:38] Team_042 possession (Score: 88-86)
Cade Dosunmu attempts a Midrange. Contested by Franz Antetokounmpo (5.1 feet, MAN). Cade Dosunmu misses. Rebound secured by Bradley Sabonis.

[06:23] Team_081 possession (Score: 88-86)
Julius Durant makes the Midrange and draws the foul on Tyler Barrett! And-1! Julius Durant to the line for 1. [Team fouls: 4] (Tyler Barrett: 1 personal fouls)   FT 1/1: GOOD Julius Durant makes 1/1 from the line.
Score: 88-89

[06:04] Team_042 possession (Score: 88-89)
Cade Dosunmu attempts a Midrange. Contested by Julius Durant (4.8 feet, ZONE). CADE DOSUNMU MAKES IT! Assist: Tyler Barrett
Score: 90-89

[05:51] Team_081 possession (Score: 90-89)
FOUL! Reach-in foul on Dejounte Butler during the drive. [IN THE BONUS! 5 team fouls] Bradley Sabonis to the line for 2 free throws. (Dejounte Butler: 1 personal fouls)   FT 1/2: GOOD   FT 2/2: GOOD Bradley Sabonis makes 2/2 from the line.
Score: 90-91

[05:40] Team_042 possession (Score: 90-91)
Cade Dosunmu drives and kicks out. FOUL! Shooting foul on Vince Adebayo. Jarrett Sabonis to the line for 2 free throws. [Team fouls: 2] (Vince Adebayo: 1 personal fouls)   FT 1/2: GOOD   FT 2/2: GOOD Jarrett Sabonis makes 2/2 from the line.
Score: 92-91

[05:24] Team_081 possession (Score: 92-91)
Bradley Leonard drives to the basket... Bradley Leonard loses control! Ball rolls out of bounds! TURNOVER! (dead ball)

[05:24] Substitution (Team_042): Tyler Barrett OUT → Khris George IN (stamina_rule2)

[05:24] Substitution (Team_042): Kristaps Parker OUT → Isaiah Randle IN (stamina_rule2)

[05:24] Substitution (Team_042): Jarrett Sabonis OUT → Gary Jackson IN (stamina_rule2)

[05:24] Substitution (Team_042): Dejounte Butler OUT → Allen Towns IN (stamina_rule2)

[05:24] Substitution (Team_042): Cade Dosunmu OUT → Lamelo Stewart IN (stamina_rule2)

[05:24] Substitution (Team_081): Julius Durant OUT → Dejounte Bane IN (stamina_rule2)

[05:24] Substitution (Team_081): Bradley Leonard OUT → Lamelo Wade IN (stamina_rule2)

[05:24] Substitution (Team_081): Vince Adebayo OUT → Larry Adebayo IN (stamina_rule2)

[05:24] Substitution (Team_081): Bradley Sabonis OUT → Chris Holiday IN (stamina_rule2)

[05:24] Substitution (Team_081): Franz Antetokounmpo OUT → D'Angelo Markkanen IN (stamina_rule2)

[05:11] Team_042 possession (Score: 92-91)
Allen Towns attempts a Midrange. Contested by Lamelo Wade (5.2 feet, ZONE). ALLEN TOWNS MAKES IT!
Score: 94-91

[04:55] Team_081 possession (Score: 94-91)
Lamelo Wade drives and kicks out. Larry Adebayo attempts a 3Pt. Contested by Gary Jackson (4.6 feet, MAN). Larry Adebayo misses. Rebound secured by Allen Towns.

[04:42] Team_042 possession (Score: 94-91)
Allen Towns attempts a 3Pt. Contested by Chris Holiday (4.8 feet, ZONE). Allen Towns misses. Offensive rebound by Lamelo Stewart! Lamelo Stewart kicks it out.

[04:23] Team_042 possession (Score: 94-91)
Khris George attempts a Layup. Wide open! Dejounte Bane is 6.2 feet away. [MAN] Khris George misses. Rebound secured by Lamelo Wade.

[04:11] Team_081 possession (Score: 94-91)
FOUL! Holding foul on Lamelo Stewart. [IN THE BONUS! 6 team fouls] D'Angelo Markkanen to the line for 2 free throws. (Lamelo Stewart: 1 personal fouls)   FT 1/2: GOOD   FT 2/2: GOOD D'Angelo Markkanen makes 2/2 from the line.
Score: 94-93

[03:57] Team_042 possession (Score: 94-93)
Lamelo Stewart attempts a 3Pt. Contested by Chris Holiday (4.2 feet, ZONE). Lamelo Stewart misses. Rebound secured by Chris Holiday.

[03:45] Team_081 possession (Score: 94-93)
FOUL! Offensive foul on Dejounte Bane! Khris George drew the charge! [Team fouls: 3] (Dejounte Bane: 1 personal fouls) TURNOVER! (dead ball)

[03:29] Team_042 possession (Score: 94-93)
Allen Towns drives and kicks out. Khris George attempts a 3Pt. Contested by Chris Holiday (4.3 feet, ZONE). Khris George misses. Rebound secured by Larry Adebayo.

[03:17] Team_081 possession (Score: 94-93)
Larry Adebayo attempts a 3Pt. Contested by Gary Jackson (4.5 feet, MAN). Larry Adebayo misses. Rebound secured by Allen Towns.

[03:01] Team_042 possession (Score: 94-93)
Khris George throws a bad pass out of bounds! TURNOVER! (dead ball)

[02:47] Team_081 possession (Score: 94-93)
D'Angelo Markkanen drives and kicks out. D'Angelo Markkanen attempts a 3Pt. Contested by Lamelo Stewart (4.2 feet, MAN). D'Angelo Markkanen misses. Offensive rebound by Lamelo Wade! Lamelo Wade kicks it out.

[02:33] Team_081 possession (Score: 94-93)
Dejounte Bane attempts a 3Pt. Contested by Khris George (4.2 feet, ZONE). Dejounte Bane misses. Rebound secured by Allen Towns.

[02:22] Team_042 possession (Score: 94-93)
FOUL! Shooting foul on Lamelo Wade. Isaiah Randle to the line for 2 free throws. [Team fouls: 4] (Lamelo Wade: 1 personal fouls)   FT 1/2: GOOD   FT 2/2: MISS Isaiah Randle makes 1/2 from the line. Rebound secured by Lamelo Wade.
Score: 95-93

[02:08] Team_081 possession (Score: 95-93)
FOUL! Holding foul on Isaiah Randle. [IN THE BONUS! 7 team fouls] Lamelo Wade to the line for 2 free throws. (Isaiah Randle: 1 personal fouls)   FT 1/2: MISS   FT 2/2: GOOD Lamelo Wade makes 1/2 from the line.
Score: 95-94

[01:55] Team_042 possession (Score: 95-94)
Isaiah Randle attempts a Midrange. Contested by Chris Holiday (4.4 feet, ZONE). Isaiah Randle misses. Rebound secured by Chris Holiday.

[01:40] Team_081 possession (Score: 95-94)
Chris Holiday attempts a Layup. BLOCKED BY ALLEN TOWNS! Ball is loose! Offensive rebound by Lamelo Wade! Lamelo Wade kicks it out.

[01:28] Team_081 possession (Score: 95-94)
Dejounte Bane attempts a Midrange. Contested by Gary Jackson (4.8 feet, ZONE). DEJOUNTE BANE MAKES IT!
Score: 95-96

[01:08] Team_042 possession (Score: 95-96)
Lamelo Stewart drives to the basket... Lamelo Stewart loses the ball! Stripped by Chris Holiday! TURNOVER! (live ball)

[00:53] Team_081 possession (Score: 95-96)
D'Angelo Markkanen drives and kicks out. Chris Holiday attempts a Midrange. Contested by Khris George (4.0 feet, ZONE). Chris Holiday misses. Rebound secured by Gary Jackson.

[00:38] Team_042 possession (Score: 95-96)
FOUL! Reach-in foul on Lamelo Wade during the drive. [IN THE BONUS! 5 team fouls] Isaiah Randle to the line for 2 free throws. (Lamelo Wade: 2 personal fouls)   FT 1/2: GOOD   FT 2/2: MISS Isaiah Randle makes 1/2 from the line. Rebound secured by Chris Holiday.
Score: 96-96

[00:26] Team_081 possession (Score: 96-96)
D'Angelo Markkanen commits a violation (traveling/carry)! TURNOVER! (dead ball)

[00:10] Team_042 possession (Score: 96-96)
Lamelo Stewart drives and kicks out. Allen Towns attempts a 3Pt. Contested by Chris Holiday (4.3 feet, MAN). Allen Towns misses. Rebound secured by Lamelo Wade.

================================================================================
                              4TH QUARTER COMPLETE                              
================================================================================

4TH QUARTER SCORE: Team_042 22, Team_081 21

BOX SCORE:
================================================================================

Team_042
--------------------------------------------------------------------------------
Player                MIN  PTS  REB  AST  TO      FG   FG%      3P   3P%
--------------------------------------------------------------------------------
Jarrett Sabonis        40    7    0    0   0   3/3   100.0     0/0   0.0
Cade Dosunmu           40    6    2    2   0   3/4    75.0     0/0   0.0
Kristaps Parker        40    5    0    1   0   2/2   100.0     0/0   0.0
Allen Towns             9    2    3    0   0   1/2    50.0     0/0   0.0
Dejounte Butler        40    0    1    0   0   0/0     0.0     0/0   0.0
Tyler Barrett          40    0    3    1   0   0/1     0.0     0/0   0.0
Lamelo Stewart          9    0    1    0   0   0/2     0.0     0/0   0.0
Khris George            9    0    0    0   0   0/1     0.0     0/0   0.0
Isaiah Randle           9    0    0    0   0   0/3     0.0     0/0   0.0
Gary Jackson            9    0    1    0   0   0/0     0.0     0/0   0.0

TEAM: FG: 9/18 (50.0%), 3PT: 1/2 (50.0%), REB: 11 (2 off, 9 def), AST: 4, TO: 5
TEAM FOULS: 7 [Team_081 in BONUS]


Team_081
--------------------------------------------------------------------------------
Player                MIN  PTS  REB  AST  TO      FG   FG%      3P   3P%
--------------------------------------------------------------------------------
Bradley Sabonis        40    7    2    0   0   3/3   100.0     0/0   0.0
Julius Durant          40    6    0    0   0   2/3    66.7     0/0   0.0
Vince Adebayo          40    3    0    1   0   1/4    25.0     0/0   0.0
D'Angelo Markkanen      9    2    0    0   0   1/2    50.0     0/0   0.0
Dejounte Bane           9    2    0    0   0   1/2    50.0     0/0   0.0
Lamelo Wade             9    1    5    0   0   1/2    50.0     0/0   0.0
Franz Antetokounmpo    40    0    0    0   0   0/1     0.0     0/0   0.0
Bradley Leonard        40    0    0    2   0   0/0     0.0     0/0   0.0
Chris Holiday           9    0    3    0   0   0/0     0.0     0/0   0.0
Larry Adebayo           9    0    1    0   0   0/1     0.0     0/0   0.0

TEAM: FG: 9/18 (50.0%), 3PT: 1/5 (20.0%), REB: 11 (2 off, 9 def), AST: 3, TO: 4
TEAM FOULS: 5 [Team_042 in BONUS]

================================================================================

================================================================================
                               FULL GAME COMPLETE                               
================================================================================

FINAL SCORE: Team_042 96, Team_081 96

SCORING BY QUARTER:
--------------------------------------------------------------------------------
Team                     Q1     Q2     Q3     Q4    FINAL
--------------------------------------------------------------------------------
Team_042                 25     27     22     22       96
Team_081                 25     30     20     21       96
--------------------------------------------------------------------------------

FULL GAME BOX SCORE:
================================================================================

Team_042
--------------------------------------------------------------------------------
Player                MIN  PTS  REB  AST  TO      FG   FG%      3P   3P%      FT STL BLK
--------------------------------------------------------------------------------
Tyler Barrett          40    2   11    1   1   2/7    28.6   0/1     0.0   2/2     1   1
Kristaps Parker        40   21    0    2   4   7/14   50.0   1/5    20.0   2/2     0   0
Jarrett Sabonis        40   14    0    2   2   6/15   40.0   2/6    33.3   4/5     0   0
Dejounte Butler        40   13   11    7   1   4/12   33.3   2/7    28.6   5/5     1   0
Cade Dosunmu           40   28   14    4   1  13/17   76.5   0/0     0.0   4/4     1   2
Khris George            9    2    0    0   1   1/2    50.0   0/0     0.0   0/0     0   0
Isaiah Randle           9    2    0    1   1   1/5    20.0   0/0     0.0   4/6     0   0
Gary Jackson            9    4    1    0   0   2/3    66.7   0/1     0.0   2/2     0   0
Allen Towns             9    4    4    1   0   2/3    66.7   0/0     0.0   2/2     1   1
Lamelo Stewart          9    2    2    0   0   0/2     0.0   0/1     0.0   2/2     0   0

TEAM: FG: 40/82 (48.8%), 3PT: 5/21 (23.8%), REB: 45 (10 off, 35 def), AST: 18, TO: 11


Team_081
--------------------------------------------------------------------------------
Player                MIN  PTS  REB  AST  TO      FG   FG%      3P   3P%      FT STL BLK
--------------------------------------------------------------------------------
Julius Durant          40   16    0    3   2   7/12   58.3   3/8    37.5   3/4     0   0
Bradley Leonard        40   18    0    5   2   8/16   50.0   5/8    62.5   0/0     1   1
Vince Adebayo          40   23    9    4   2  11/22   50.0   3/9    33.3   6/7     0   0
Bradley Sabonis        40   11   15    3   1   5/8    62.5   0/1     0.0   2/2     1   0
Franz Antetokounmpo    40   14   13    2   3   3/5    60.0   0/0     0.0   1/1     3   0
Dejounte Bane           9    2    0    0   2   1/3    33.3   0/2     0.0   0/0     0   0
Lamelo Wade             9    1    6    1   0   0/1     0.0   0/0     0.0   1/2     0   0
Larry Adebayo           9    3    1    1   1   1/2    50.0   1/2    50.0   0/0     0   0
Chris Holiday           9    2    4    0   0   1/2    50.0   0/1     0.0   0/0     1   0
D'Angelo Markkanen      9    4    0    0   1   1/2    50.0   0/0     0.0   2/2     0   0

TEAM: FG: 40/75 (53.3%), 3PT: 12/31 (38.7%), REB: 46 (7 off, 39 def), AST: 19, TO: 14

================================================================================
