================================================================================
                        FULL GAME - Team_100 vs Team_020                        
================================================================================

================================================================================
                       1ST QUARTER - Team_100 vs Team_020                       
================================================================================

[12:00] Team_100 possession (Score: 0-0)
Chris Mobley attempts a Layup. Contested by Bam Leonard (2.6 feet, MAN). CHRIS MOBLEY MAKES IT!
Score: 2-0

[11:47] Team_020 possession (Score: 2-0)
James Cunningham drives, Manu Ball stays with him. James Cunningham attempts a Dunk. Wide open! Manu Ball is 6.4 feet away. [MAN] JAMES CUNNINGHAM MAKES IT!
Score: 2-2

[11:34] Team_100 possession (Score: 2-2)
Tyler Griffin attempts a 3Pt. Contested by Bam Leonard (2.5 feet, ZONE). Tyler Griffin misses. Rebound secured by Bam Leonard.

[11:19] Team_020 possession (Score: 2-2)
Bam Leonard attempts a Midrange. Contested by Pau LaVine (4.8 feet, MAN). Bam Leonard misses. Offensive rebound by Bam Leonard! Bam Leonard puts it back in!
Score: 2-4

[11:04] Team_100 possession (Score: 2-4)
FOUL! Shooting foul on Bam Leonard. Chris Mobley to the line for 2 free throws. [Team fouls: 1] (Bam Leonard: 1 personal fouls)   FT 1/2: GOOD   FT 2/2: GOOD Chris Mobley makes 2/2 from the line.
Score: 4-4

[10:52] Team_020 possession (Score: 4-4)
Trae Curry loses the ball! Stripped by Chris Mobley! TURNOVER! (live ball)

[10:35] Team_100 possession (Score: 4-4)
Chris Mobley drives and kicks out. Tyler Griffin attempts a 3Pt. Contested by Terry Simons (4.2 feet, MAN). Tyler Griffin misses. Rebound secured by Terry Simons.

[10:21] Team_020 possession (Score: 4-4)
Jarrett McCollum attempts a 3Pt. Contested by Luka Green (5.5 feet, MAN). JARRETT MCCOLLUM MAKES IT! Assist: Bam Leonard
Score: 4-7

[10:06] Team_100 possession (Score: 4-7)
Tyler Griffin attempts a Midrange. Contested by Terry Simons (4.4 feet, MAN). Tyler Griffin misses. Offensive rebound by Pau LaVine! Pau LaVine kicks it out.

[09:51] Team_100 possession (Score: 4-7)
FOUL! Shooting foul on James Cunningham. Manu Ball to the line for 2 free throws. [Team fouls: 2] (James Cunningham: 1 personal fouls)   FT 1/2: GOOD   FT 2/2: GOOD Manu Ball makes 2/2 from the line.
Score: 6-7

[09:37] Team_020 possession (Score: 6-7)
Jarrett McCollum attempts a Layup. Contested by Pau LaVine (4.6 feet, ZONE). Jarrett McCollum misses. Offensive rebound by Bam Leonard! Bam Leonard's putback is no good. Offensive rebound by Trae Curry! Trae Curry kicks it out.

[09:20] Team_020 possession (Score: 6-7)
James Cunningham throws a bad pass! Stolen by Manu Ball! TURNOVER! (live ball)

[09:07] Team_100 possession (Score: 6-7)
Pau LaVine drives and kicks out. Manu Ball attempts a Midrange. Contested by James Cunningham (5.0 feet, ZONE). Manu Ball misses. Rebound secured by Trae Curry.

[08:53] Team_020 possession (Score: 6-7)
Terry Simons loses the ball! Stripped by Tyler Griffin! TURNOVER! (live ball)

[08:34] Team_100 possession (Score: 6-7)
Luka Green attempts a 3Pt. Contested by Bam Leonard (2.5 feet, ZONE). Luka Green misses. Rebound secured by Trae Curry.

[08:19] Team_020 possession (Score: 6-7)
FOUL! Holding foul on Tyler Griffin. [Team fouls: 1] No free throws, side out. (Tyler Griffin: 1 personal fouls)

[08:07] Team_020 possession (Score: 6-7)
Terry Simons attempts a Midrange. Contested by Tyler Griffin (5.4 feet, ZONE). TERRY SIMONS MAKES IT! Assist: Jarrett McCollum
Score: 6-9

[07:55] Team_100 possession (Score: 6-9)
Luka Green attempts a 3Pt. Contested by Jarrett McCollum (4.6 feet, MAN). LUKA GREEN MAKES IT! Assist: Tyler Griffin
Score: 9-9

[07:36] Team_020 possession (Score: 9-9)
Trae Curry drives to the basket... Trae Curry loses control! Ball rolls out of bounds! TURNOVER! (dead ball)

[07:23] Team_100 possession (Score: 9-9)
Tyler Griffin attempts a 3Pt. Contested by Bam Leonard (2.5 feet, ZONE). Tyler Griffin misses. Rebound secured by Terry Simons.

[07:08] Team_020 possession (Score: 9-9)
FOUL! Shooting foul on Manu Ball. Trae Curry to the line for 2 free throws. [Team fouls: 2] (Manu Ball: 1 personal fouls)   FT 1/2: MISS   FT 2/2: MISS Trae Curry makes 0/2 from the line. Offensive rebound by Trae Curry! Trae Curry's putback is no good.

[06:55] Team_100 possession (Score: 9-9)
Luka Green drives to the basket... Luka Green throws a bad pass! Stolen by Jarrett McCollum! TURNOVER! (live ball)

[06:43] Team_020 possession (Score: 9-9)
Terry Simons attempts a Midrange. Contested by Tyler Griffin (5.4 feet, MAN). Terry Simons misses. Rebound secured by Tyler Griffin.

[06:25] Team_100 possession (Score: 9-9)
Pau LaVine attempts a 3Pt. Contested by Bam Leonard (2.4 feet, MAN). PAU LAVINE MAKES IT! Assist: Tyler Griffin
Score: 12-9

[06:12] Team_020 possession (Score: 12-9)
FOUL! Shooting foul on Tyler Griffin. Bam Leonard to the line for 2 free throws. [Team fouls: 3] (Tyler Griffin: 2 personal fouls)   FT 1/2: GOOD   FT 2/2: GOOD Bam Leonard makes 2/2 from the line.
Score: 12-11

[05:57] Team_100 possession (Score: 12-11)
Luka Green attempts a Layup. Contested by Bam Leonard (2.5 feet, ZONE). Luka Green misses. Rebound secured by Trae Curry.

[05:43] Team_020 possession (Score: 12-11)
Jarrett McCollum attempts a 3Pt. Contested by Luka Green (5.5 feet, MAN). Jarrett McCollum misses. Rebound secured by Chris Mobley.

[05:24] Team_100 possession (Score: 12-11)
Tyler Griffin attempts a 3Pt. Contested by Bam Leonard (2.5 feet, ZONE). Tyler Griffin misses. Offensive rebound by Pau LaVine! Pau LaVine kicks it out.

[05:10] Team_100 possession (Score: 12-11)
Pau LaVine makes the Layup and draws the foul on Bam Leonard! And-1! Pau LaVine to the line for 1. [Team fouls: 3] (Bam Leonard: 2 personal fouls)   FT 1/1: MISS Pau LaVine makes 0/1 from the line. Offensive rebound by Chris Mobley! Chris Mobley kicks it out.
Score: 14-11

[04:59] Team_100 possession (Score: 14-11)
Manu Ball attempts a Layup. Contested by James Cunningham (5.0 feet, MAN). Manu Ball misses. Rebound secured by Terry Simons.

[04:43] Team_020 possession (Score: 14-11)
Jarrett McCollum attempts a Layup. BLOCKED BY LUKA GREEN! Ball is loose! Rebound secured by Chris Mobley.

[04:27] Team_100 possession (Score: 14-11)
Tyler Griffin attempts a 3Pt. Contested by Bam Leonard (2.6 feet, ZONE). Tyler Griffin misses. Rebound secured by Bam Leonard.

[04:10] Team_020 possession (Score: 14-11)
FOUL! Reach-in foul on Chris Mobley during the drive. [Team fouls: 4] No free throws, side out. (Chris Mobley: 1 personal fouls)

[03:55] Team_020 possession (Score: 14-11)
Jarrett McCollum drives and kicks out. James Cunningham attempts a 3Pt. Contested by Luka Green (5.4 feet, ZONE). James Cunningham misses. Rebound secured by Pau LaVine.

[03:43] Team_100 possession (Score: 14-11)
Manu Ball attempts a Midrange. Contested by Terry Simons (4.4 feet, ZONE). Manu Ball misses. Rebound secured by Terry Simons.

[03:29] Team_020 possession (Score: 14-11)
Bam Leonard attempts a Midrange. Wide open! Manu Ball is 6.5 feet away. [ZONE] BAM LEONARD MAKES IT!
Score: 14-13

[03:15] Team_100 possession (Score: 14-13)
Manu Ball attempts a 3Pt. Contested by James Cunningham (5.1 feet, MAN). MANU BALL MAKES IT! Assist: Pau LaVine
Score: 17-13

[03:00] Team_020 possession (Score: 17-13)
Terry Simons drives, picks up Tyler Griffin. Help arrives from Manu Ball! Terry Simons attempts a Layup. Contested by Manu Ball (5.6 feet, MAN). TERRY SIMONS MAKES IT! Assist: Jarrett McCollum
Score: 17-15

[02:41] Team_100 possession (Score: 17-15)
Tyler Griffin makes the Midrange and draws the foul on Terry Simons! And-1! Tyler Griffin to the line for 1. [Team fouls: 4] (Terry Simons: 1 personal fouls)   FT 1/1: MISS Tyler Griffin makes 0/1 from the line. Rebound secured by Bam Leonard.
Score: 19-15

[02:28] Team_020 possession (Score: 19-15)
Jarrett McCollum makes the Midrange and draws the foul on Luka Green! And-1! Jarrett McCollum to the line for 1. [BONUS: 5 team fouls] (Luka Green: 1 personal fouls)   FT 1/1: GOOD Jarrett McCollum makes 1/1 from the line.
Score: 19-18

[02:11] Team_100 possession (Score: 19-18)
Manu Ball attempts a 3Pt. Contested by Bam Leonard (2.7 feet, ZONE). MANU BALL MAKES IT! Assist: Tyler Griffin
Score: 22-18

[01:55] Team_020 possession (Score: 22-18)
Bam Leonard attempts a Midrange. Contested by Pau LaVine (5.1 feet, MAN). BAM LEONARD MAKES IT!
Score: 22-20

[01:40] Team_100 possession (Score: 22-20)
Luka Green attempts a 3Pt. Contested by Jarrett McCollum (4.9 feet, MAN). Luka Green misses. Rebound secured by Bam Leonard.

[01:26] Team_020 possession (Score: 22-20)
Terry Simons drives and kicks out. Bam Leonard attempts a 3Pt. Contested by Pau LaVine (4.9 feet, ZONE). Bam Leonard misses. Rebound secured by Tyler Griffin.

[01:14] Team_100 possession (Score: 22-20)
Tyler Griffin attempts a Midrange. Contested by Terry Simons (4.8 feet, MAN). Tyler Griffin misses. Rebound secured by Trae Curry.

[00:56] Team_020 possession (Score: 22-20)
Jarrett McCollum drives and kicks out. Terry Simons attempts a Midrange. Wide open! Manu Ball is 6.4 feet away. [ZONE] Terry Simons misses. Rebound secured by Tyler Griffin.

[00:45] Team_100 possession (Score: 22-20)
Chris Mobley drives and kicks out. Chris Mobley attempts a Midrange. Contested by Terry Simons (4.7 feet, ZONE). CHRIS MOBLEY MAKES IT!
Score: 24-20

[00:32] Team_020 possession (Score: 24-20)
Jarrett McCollum attempts a 3Pt. Contested by Luka Green (5.8 feet, MAN). JARRETT MCCOLLUM MAKES IT! Assist: Bam Leonard
Score: 24-23

[00:21] Team_100 possession (Score: 24-23)
Manu Ball attempts a 3Pt. Contested by Bam Leonard (3.0 feet, ZONE). Manu Ball misses. Rebound secured by Trae Curry.

[00:07] Team_020 possession (Score: 24-23)
Bam Leonard attempts a Layup. BLOCKED BY PAU LAVINE! Ball is loose! Rebound secured by Pau LaVine.

================================================================================
                              1ST QUARTER COMPLETE                              
================================================================================

1ST QUARTER SCORE: Team_100 24, Team_020 23

BOX SCORE:
================================================================================

Team_100
--------------------------------------------------------------------------------
Player                MIN  PTS  REB  AST  TO      FG   FG%      3P   3P%
--------------------------------------------------------------------------------
Manu Ball              12    8    0    0   0   3/6    50.0     0/0   0.0
Chris Mobley           12    6    3    0   0   3/4    75.0     0/0   0.0
Pau LaVine             12    3    4    1   0   1/2    50.0     0/0   0.0
Luka Green             12    3    0    0   0   1/4    25.0     0/0   0.0
Tyler Griffin          12    0    3    3   0   0/5     0.0     0/0   0.0

TEAM: FG: 8/21 (38.1%), 3PT: 4/10 (40.0%), REB: 11 (3 off, 8 def), AST: 4, TO: 1
TEAM FOULS: 5 [Team_020 in BONUS]


Team_020
--------------------------------------------------------------------------------
Player                MIN  PTS  REB  AST  TO      FG   FG%      3P   3P%
--------------------------------------------------------------------------------
Jarrett McCollum       12    9    0    2   0   3/7    42.9     0/0   0.0
Bam Leonard            12    8    5    2   0   4/5    80.0     0/0   0.0
Terry Simons           12    4    4    0   0   2/4    50.0     0/0   0.0
James Cunningham       12    2    0    0   0   1/1   100.0     0/0   0.0
Trae Curry             12    0    7    0   0   0/1     0.0     0/0   0.0

TEAM: FG: 10/18 (55.6%), 3PT: 2/3 (66.7%), REB: 15 (2 off, 13 def), AST: 4, TO: 4
TEAM FOULS: 4

================================================================================

================================================================================
                       2ND QUARTER - Team_100 vs Team_020                       
================================================================================

[12:00] Team_100 possession (Score: 24-23)
Manu Ball drives to the basket... Manu Ball loses the ball! Stripped by Trae Curry! TURNOVER! (live ball)

[11:47] Team_020 possession (Score: 24-23)
Trae Curry drives and kicks out. Terry Simons attempts a 3Pt. Contested by Pau LaVine (4.9 feet, ZONE). Terry Simons misses. Rebound secured by Pau LaVine.

[11:33] Team_100 possession (Score: 24-23)
Pau LaVine attempts a Midrange. Contested by Trae Curry (5.1 feet, ZONE). PAU LAVINE MAKES IT!
Score: 26-23

[11:19] Team_020 possession (Score: 26-23)
Bam Leonard attempts a Midrange. Contested by Pau LaVine (5.2 feet, ZONE). BAM LEONARD MAKES IT!
Score: 26-25

[11:10] Team_100 possession (Score: 26-25)
Tyler Griffin attempts a Midrange. Contested by James Cunningham (5.5 feet, ZONE). Tyler Griffin misses. Rebound secured by Bam Leonard.

[10:57] Team_020 possession (Score: 26-25)
James Cunningham attempts a 3Pt. Contested by Luka Green (5.9 feet, ZONE). James Cunningham misses. Offensive rebound by Bam Leonard! Bam Leonard puts it back in!
Score: 26-27

[10:44] Team_100 possession (Score: 26-27)
Tyler Griffin attempts a 3Pt. Contested by Bam Leonard (3.1 feet, ZONE). Tyler Griffin misses. Offensive rebound by Chris Mobley! Chris Mobley kicks it out.

[10:25] Team_100 possession (Score: 26-27)
Pau LaVine attempts a Midrange. Contested by Bam Leonard (3.0 feet, ZONE). Pau LaVine misses. Rebound secured by Bam Leonard.

[10:10] Team_020 possession (Score: 26-27)
Bam Leonard attempts a Midrange. Wide open! Manu Ball is 6.7 feet away. [ZONE] BAM LEONARD MAKES IT! Assist: Jarrett McCollum
Score: 26-29

[09:58] Team_100 possession (Score: 26-29)
Chris Mobley attempts a Layup. Contested by Bam Leonard (3.3 feet, MAN). CHRIS MOBLEY MAKES IT!
Score: 28-29

[09:44] Team_020 possession (Score: 28-29)
James Cunningham attempts a Midrange. Wide open! Manu Ball is 6.8 feet away. [ZONE] JAMES CUNNINGHAM MAKES IT! Assist: Bam Leonard
Score: 28-31

[09:33] Team_100 possession (Score: 28-31)
Chris Mobley drives, picks up Trae Curry. Help arrives from Jarrett McCollum! Chris Mobley attempts a Layup. Contested by Jarrett McCollum (5.5 feet, ZONE). Chris Mobley misses. Rebound secured by Bam Leonard.

[09:17] Team_020 possession (Score: 28-31)
Terry Simons attempts a 3Pt. Contested by Tyler Griffin (6.0 feet, MAN). TERRY SIMONS MAKES IT! Assist: James Cunningham
Score: 28-34

[08:59] Team_100 possession (Score: 28-34)
Pau LaVine attempts a Layup. Contested by Bam Leonard (3.3 feet, MAN). Pau LaVine misses. Rebound secured by Trae Curry.

[08:45] Team_020 possession (Score: 28-34)
Bam Leonard attempts a Layup. Contested by Pau LaVine (5.5 feet, MAN). Bam Leonard misses. Offensive rebound by Bam Leonard! Bam Leonard puts it back in!
Score: 28-36

[08:28] Team_100 possession (Score: 28-36)
FOUL! Shooting foul on Trae Curry. Luka Green to the line for 2 free throws. [Team fouls: 1] (Trae Curry: 1 personal fouls)   FT 1/2: MISS   FT 2/2: GOOD Luka Green makes 1/2 from the line.
Score: 29-36

[08:13] Team_020 possession (Score: 29-36)
James Cunningham attempts a 3Pt. Wide open! Luka Green is 6.1 feet away. [ZONE] James Cunningham misses. Rebound secured by Pau LaVine.

[07:57] Team_100 possession (Score: 29-36)
FOUL! Shooting foul on Bam Leonard. Manu Ball to the line for 3 free throws. [Team fouls: 2] (Bam Leonard: 1 personal fouls)   FT 1/3: GOOD   FT 2/3: MISS   FT 3/3: GOOD Manu Ball makes 2/3 from the line.
Score: 31-36

[07:44] Team_020 possession (Score: 31-36)
Bam Leonard throws a bad pass! Stolen by Pau LaVine! TURNOVER! (live ball)

[07:31] Team_100 possession (Score: 31-36)
Luka Green attempts a Midrange. Contested by Jarrett McCollum (5.5 feet, ZONE). Luka Green misses. Rebound secured by Bam Leonard.

[07:17] Team_020 possession (Score: 31-36)
Bam Leonard loses control! Ball rolls out of bounds! TURNOVER! (dead ball)

[07:17] Substitution (Team_100): Luka Green OUT → Dirk Sabonis IN (stamina_rule2)

[07:17] Substitution (Team_100): Manu Ball OUT → Evan Butler IN (stamina_rule2)

[07:17] Substitution (Team_100): Tyler Griffin OUT → Tyrese Wade IN (stamina_rule2)

[07:17] Substitution (Team_100): Pau LaVine OUT → Carmelo Ginobili IN (stamina_rule2)

[07:17] Substitution (Team_100): Chris Mobley OUT → John Rozier IN (stamina_rule2)

[07:17] Substitution (Team_020): Jarrett McCollum OUT → Franz Doncic IN (stamina_rule2)

[07:17] Substitution (Team_020): James Cunningham OUT → Stephen Parker IN (stamina_rule2)

[07:17] Substitution (Team_020): Terry Simons OUT → Victor Holiday IN (stamina_rule2)

[07:17] Substitution (Team_020): Bam Leonard OUT → Cole Barnes IN (stamina_rule2)

[07:17] Substitution (Team_020): Trae Curry OUT → Miles Siakam IN (stamina_rule2)

[07:01] Team_100 possession (Score: 31-36)
Evan Butler attempts a 3Pt. Contested by Stephen Parker (5.3 feet, MAN). Evan Butler misses. Rebound secured by Cole Barnes.

[06:46] Team_020 possession (Score: 31-36)
Miles Siakam attempts a Layup. Contested by John Rozier (4.7 feet, ZONE). Miles Siakam misses. Rebound secured by John Rozier.

[06:37] Team_100 possession (Score: 31-36)
Carmelo Ginobili attempts a 3Pt. Contested by Cole Barnes (4.6 feet, MAN). CARMELO GINOBILI MAKES IT! Assist: Evan Butler
Score: 34-36

[06:20] Team_020 possession (Score: 34-36)
Franz Doncic attempts a 3Pt. Contested by Dirk Sabonis (5.3 feet, MAN). Franz Doncic misses. Offensive rebound by Miles Siakam! Miles Siakam kicks it out.

[06:02] Team_020 possession (Score: 34-36)
FOUL! Holding foul on John Rozier. [Team fouls: 1] No free throws, side out. (John Rozier: 1 personal fouls)

[05:48] Team_020 possession (Score: 34-36)
FOUL! Shooting foul on Carmelo Ginobili. Cole Barnes to the line for 2 free throws. [Team fouls: 2] (Carmelo Ginobili: 1 personal fouls)   FT 1/2: GOOD   FT 2/2: GOOD Cole Barnes makes 2/2 from the line.
Score: 34-38

[05:32] Team_100 possession (Score: 34-38)
Dirk Sabonis attempts a 3Pt. Contested by Stephen Parker (5.7 feet, ZONE). DIRK SABONIS MAKES IT! Assist: John Rozier
Score: 37-38

[05:20] Team_020 possession (Score: 37-38)
FOUL! Reach-in foul on Carmelo Ginobili during the drive. [Team fouls: 3] No free throws, side out. (Carmelo Ginobili: 2 personal fouls)

[05:06] Team_020 possession (Score: 37-38)
Miles Siakam drives and kicks out. Victor Holiday attempts a 3Pt. Contested by Dirk Sabonis (5.7 feet, ZONE). Victor Holiday misses. Rebound secured by Tyrese Wade.

[04:49] Team_100 possession (Score: 37-38)
John Rozier attempts a 3Pt. Contested by Miles Siakam (4.3 feet, MAN). JOHN ROZIER MAKES IT! Assist: Evan Butler
Score: 40-38

[04:34] Team_020 possession (Score: 40-38)
Miles Siakam attempts a Midrange. Contested by John Rozier (4.7 feet, MAN). MILES SIAKAM MAKES IT! Assist: Franz Doncic
Score: 40-40

[04:17] Team_100 possession (Score: 40-40)
Dirk Sabonis attempts a 3Pt. Contested by Stephen Parker (5.7 feet, ZONE). Dirk Sabonis misses. Rebound secured by Cole Barnes.

[04:01] Team_020 possession (Score: 40-40)
Cole Barnes attempts a Midrange. Contested by Tyrese Wade (4.6 feet, ZONE). COLE BARNES MAKES IT!
Score: 40-42

[03:48] Team_100 possession (Score: 40-42)
Dirk Sabonis attempts a Layup. Contested by Miles Siakam (4.3 feet, ZONE). DIRK SABONIS MAKES IT! Assist: Carmelo Ginobili
Score: 42-42

[03:39] Team_020 possession (Score: 42-42)
Franz Doncic attempts a Midrange. Contested by Evan Butler (4.7 feet, ZONE). Franz Doncic misses. Offensive rebound by Cole Barnes! Cole Barnes kicks it out.

[03:29] Team_020 possession (Score: 42-42)
Victor Holiday throws a bad pass! Stolen by Tyrese Wade! TURNOVER! (live ball)

[03:13] Team_100 possession (Score: 42-42)
Carmelo Ginobili loses control! Ball rolls out of bounds! TURNOVER! (dead ball)

[02:58] Team_020 possession (Score: 42-42)
Victor Holiday attempts a 3Pt. Contested by Tyrese Wade (4.9 feet, ZONE). Victor Holiday misses. Rebound secured by Carmelo Ginobili.

[02:39] Team_100 possession (Score: 42-42)
Carmelo Ginobili attempts a 3Pt. Contested by Stephen Parker (5.1 feet, ZONE). Carmelo Ginobili misses. Rebound secured by Victor Holiday.

[02:22] Team_020 possession (Score: 42-42)
Franz Doncic drives to the basket... Franz Doncic throws a bad pass! Stolen by John Rozier! TURNOVER! (live ball)

[02:06] Team_100 possession (Score: 42-42)
Evan Butler attempts a 3Pt. Contested by Stephen Parker (5.3 feet, MAN). EVAN BUTLER MAKES IT! Assist: Tyrese Wade
Score: 45-42

[01:50] Team_020 possession (Score: 45-42)
Stephen Parker drives to the basket... Stephen Parker loses control! Ball rolls out of bounds! TURNOVER! (dead ball)

[01:36] Team_100 possession (Score: 45-42)
Carmelo Ginobili drives, picks up Miles Siakam. Help arrives from Franz Doncic! Carmelo Ginobili attempts a Dunk. Contested by Franz Doncic (3.7 feet, ZONE). CARMELO GINOBILI MAKES IT!
Score: 47-42

[01:20] Team_020 possession (Score: 47-42)
Victor Holiday drives, Tyrese Wade stays with him. Victor Holiday attempts a Layup. Contested by Tyrese Wade (4.9 feet, MAN). Victor Holiday misses. Offensive rebound by Miles Siakam! Miles Siakam kicks it out.

[01:06] Team_020 possession (Score: 47-42)
Victor Holiday makes the Layup and draws the foul on Tyrese Wade! And-1! Victor Holiday to the line for 1. [Team fouls: 4] (Tyrese Wade: 1 personal fouls)   FT 1/1: GOOD Victor Holiday makes 1/1 from the line.
Score: 47-45

[00:53] Team_100 possession (Score: 47-45)
Carmelo Ginobili attempts a Layup. BLOCKED BY MILES SIAKAM! Ball is loose! Rebound secured by Miles Siakam.

[00:34] Team_020 possession (Score: 47-45)
Franz Doncic attempts a 3Pt. Contested by Dirk Sabonis (5.3 feet, MAN). FRANZ DONCIC MAKES IT! Assist: Cole Barnes
Score: 47-48

[00:18] Team_100 possession (Score: 47-48)
Carmelo Ginobili drives, Cole Barnes stays with him. Carmelo Ginobili attempts a Layup. Contested by Cole Barnes (4.6 feet, MAN). Carmelo Ginobili misses. Rebound secured by Miles Siakam.

[00:05] Team_020 possession (Score: 47-48)
Miles Siakam attempts a 3Pt. Contested by Tyrese Wade (4.8 feet, ZONE). Miles Siakam misses. Rebound secured by John Rozier.

================================================================================
                              2ND QUARTER COMPLETE                              
================================================================================

2ND QUARTER SCORE: Team_100 23, Team_020 25

BOX SCORE:
================================================================================

Team_100
--------------------------------------------------------------------------------
Player                MIN  PTS  REB  AST  TO      FG   FG%      3P   3P%
--------------------------------------------------------------------------------
Carmelo Ginobili        7    5    1    1   0   2/5    40.0     0/0   0.0
Dirk Sabonis            7    5    0    0   0   2/3    66.7     0/0   0.0
Evan Butler             7    3    0    2   0   1/2    50.0     0/0   0.0
John Rozier             7    3    2    1   0   1/1   100.0     0/0   0.0
Pau LaVine             17    2    2    0   0   1/3    33.3     0/0   0.0
Chris Mobley           17    2    1    0   0   1/2    50.0     0/0   0.0
Manu Ball              17    2    0    0   0   1/1   100.0     0/0   0.0
Luka Green             17    1    0    0   0   1/2    50.0     0/0   0.0
Tyler Griffin          17    0    0    0   0   0/1     0.0     0/0   0.0
Tyrese Wade             7    0    1    1   0   0/0     0.0     0/0   0.0

TEAM: FG: 10/20 (50.0%), 3PT: 5/8 (62.5%), REB: 7 (1 off, 6 def), AST: 5, TO: 2
TEAM FOULS: 4


Team_020
--------------------------------------------------------------------------------
Player                MIN  PTS  REB  AST  TO      FG   FG%      3P   3P%
--------------------------------------------------------------------------------
Bam Leonard            17    8    6    1   0   4/4   100.0     0/0   0.0
Cole Barnes             7    4    3    1   0   2/2   100.0     0/0   0.0
Terry Simons           17    3    0    0   0   1/1   100.0     0/0   0.0
Franz Doncic            7    3    0    1   0   1/1   100.0     0/0   0.0
Victor Holiday          7    3    1    0   0   1/2    50.0     0/0   0.0
James Cunningham       17    2    0    1   0   1/2    50.0     0/0   0.0
Miles Siakam            7    2    4    0   0   1/4    25.0     0/0   0.0
Trae Curry             17    0    1    0   0   0/1     0.0     0/0   0.0
Jarrett McCollum       17    0    0    1   0   0/0     0.0     0/0   0.0

TEAM: FG: 11/17 (64.7%), 3PT: 3/6 (50.0%), REB: 15 (5 off, 10 def), AST: 5, TO: 5
TEAM FOULS: 2

================================================================================

================================================================================
                       3RD QUARTER - Team_100 vs Team_020                       
================================================================================

[12:00] Team_100 possession (Score: 47-48)
FOUL! Offensive foul on Luka Green! Jarrett McCollum drew the charge! [Team fouls: 1] (Luka Green: 1 personal fouls) TURNOVER! (dead ball)

[11:48] Team_020 possession (Score: 47-48)
Jarrett McCollum attempts a 3Pt. Contested by Luka Green (5.5 feet, MAN). Jarrett McCollum misses. Offensive rebound by Bam Leonard! Bam Leonard puts it back in!
Score: 47-50

[11:34] Team_100 possession (Score: 47-50)
Luka Green attempts a 3Pt. Contested by Bam Leonard (2.5 feet, ZONE). Luka Green misses. Rebound secured by Bam Leonard.

[11:21] Team_020 possession (Score: 47-50)
Trae Curry attempts a Layup. Contested by Chris Mobley (5.6 feet, MAN). Trae Curry misses. Rebound secured by Pau LaVine.

[11:06] Team_100 possession (Score: 47-50)
Luka Green drives and kicks out. Manu Ball attempts a 3Pt. Contested by James Cunningham (5.0 feet, MAN). Manu Ball misses. Rebound secured by Terry Simons.

[10:55] Team_020 possession (Score: 47-50)
Terry Simons attempts a 3Pt. Contested by Tyler Griffin (5.4 feet, MAN). Terry Simons misses. Rebound secured by Pau LaVine.

[10:36] Team_100 possession (Score: 47-50)
Pau LaVine drives, Trae Curry stays with him. Pau LaVine attempts a Layup. Contested by Trae Curry (4.7 feet, ZONE). PAU LAVINE MAKES IT!
Score: 49-50

[10:21] Team_020 possession (Score: 49-50)
Jarrett McCollum makes the Midrange and draws the foul on Luka Green! And-1! Jarrett McCollum to the line for 1. [Team fouls: 2] (Luka Green: 2 personal fouls)   FT 1/1: MISS Jarrett McCollum makes 0/1 from the line. Rebound secured by Pau LaVine.
Score: 49-52

[10:10] Team_100 possession (Score: 49-52)
Pau LaVine attempts a 3Pt. Contested by Bam Leonard (2.4 feet, ZONE). Pau LaVine misses. Rebound secured by Terry Simons.

[09:56] Team_020 possession (Score: 49-52)
FOUL! Reach-in foul on Pau LaVine during the drive. [Team fouls: 3] No free throws, side out. (Pau LaVine: 1 personal fouls)

[09:42] Team_020 possession (Score: 49-52)
Bam Leonard attempts a Midrange. Contested by Pau LaVine (4.8 feet, MAN). BAM LEONARD MAKES IT!
Score: 49-54

[09:27] Team_100 possession (Score: 49-54)
Tyler Griffin loses the ball! Stripped by Terry Simons! TURNOVER! (live ball)

[09:11] Team_020 possession (Score: 49-54)
Jarrett McCollum attempts a 3Pt. Contested by Luka Green (5.5 feet, MAN). Jarrett McCollum misses. Rebound secured by Chris Mobley.

[08:54] Team_100 possession (Score: 49-54)
Manu Ball drives and kicks out. Tyler Griffin attempts a 3Pt. Contested by Bam Leonard (2.3 feet, ZONE). Tyler Griffin misses. Rebound secured by Terry Simons.

[08:40] Team_020 possession (Score: 49-54)
Bam Leonard attempts a Layup. Contested by Pau LaVine (4.8 feet, ZONE). BAM LEONARD MAKES IT! Assist: Terry Simons
Score: 49-56

[08:24] Team_100 possession (Score: 49-56)
Tyler Griffin drives and kicks out. Tyler Griffin attempts a 3Pt. Contested by Terry Simons (4.2 feet, MAN). Tyler Griffin misses. Rebound secured by Trae Curry.

[08:12] Team_020 possession (Score: 49-56)
Jarrett McCollum attempts a Layup. Contested by Luka Green (5.5 feet, MAN). Jarrett McCollum misses. Rebound secured by Chris Mobley.

[07:59] Team_100 possession (Score: 49-56)
Tyler Griffin attempts a Midrange. Contested by James Cunningham (5.2 feet, ZONE). TYLER GRIFFIN MAKES IT!
Score: 51-56

[07:46] Team_020 possession (Score: 51-56)
Jarrett McCollum drives, Pau LaVine stays with him. Jarrett McCollum attempts a Dunk. Contested by Pau LaVine (4.6 feet, ZONE). JARRETT MCCOLLUM MAKES IT! Assist: James Cunningham
Score: 51-58

[07:31] Team_100 possession (Score: 51-58)
Tyler Griffin attempts a 3Pt. Contested by Bam Leonard (2.5 feet, ZONE). TYLER GRIFFIN MAKES IT! Assist: Chris Mobley
Score: 54-58

[07:17] Team_020 possession (Score: 54-58)
FOUL! Offensive foul on Trae Curry! Chris Mobley drew the charge! [Team fouls: 1] (Trae Curry: 1 personal fouls) TURNOVER! (dead ball)

[07:00] Team_100 possession (Score: 54-58)
Chris Mobley attempts a 3Pt. Contested by Bam Leonard (2.6 feet, ZONE). Chris Mobley misses. Rebound secured by Bam Leonard.

[06:47] Team_020 possession (Score: 54-58)
James Cunningham throws a bad pass out of bounds! TURNOVER! (dead ball)

[06:31] Team_100 possession (Score: 54-58)
Manu Ball drives and kicks out. Manu Ball attempts a Midrange. Contested by James Cunningham (5.0 feet, MAN). MANU BALL MAKES IT!
Score: 56-58

[06:19] Team_020 possession (Score: 56-58)
Terry Simons drives and kicks out. James Cunningham attempts a Midrange. Wide open! Manu Ball is 6.0 feet away. [ZONE] JAMES CUNNINGHAM MAKES IT!
Score: 56-60

[06:03] Team_100 possession (Score: 56-60)
Pau LaVine attempts a 3Pt. Contested by Bam Leonard (2.4 feet, ZONE). Pau LaVine misses. Rebound secured by Trae Curry.

[05:49] Team_020 possession (Score: 56-60)
Trae Curry drives, picks up Chris Mobley. Help arrives from Manu Ball! Trae Curry attempts a Dunk. Contested by Manu Ball (5.6 feet, MAN). Trae Curry misses. Rebound secured by Pau LaVine.

[05:38] Team_100 possession (Score: 56-60)
Chris Mobley attempts a 3Pt. Contested by Bam Leonard (2.6 feet, ZONE). Chris Mobley misses. Rebound secured by Trae Curry.

[05:25] Team_020 possession (Score: 56-60)
Trae Curry attempts a Layup. Contested by Pau LaVine (4.9 feet, ZONE). Trae Curry misses. Offensive rebound by Bam Leonard! Bam Leonard puts it back in!
Score: 56-62

[05:08] Team_100 possession (Score: 56-62)
FOUL! Reach-in foul on Trae Curry during the drive. [Team fouls: 2] No free throws, side out. (Trae Curry: 2 personal fouls)

[04:51] Team_100 possession (Score: 56-62)
Chris Mobley drives to the basket... Chris Mobley throws a bad pass! Stolen by Bam Leonard! TURNOVER! (live ball)

[04:39] Team_020 possession (Score: 56-62)
FOUL! Offensive foul on James Cunningham! Manu Ball drew the charge! [Team fouls: 3] (James Cunningham: 1 personal fouls) TURNOVER! (dead ball)

[04:24] Team_100 possession (Score: 56-62)
Manu Ball attempts a 3Pt. Contested by James Cunningham (5.0 feet, MAN). Manu Ball misses. Rebound secured by Terry Simons.

[04:12] Team_020 possession (Score: 56-62)
Bam Leonard attempts a 3Pt. Contested by Luka Green (5.7 feet, ZONE). Bam Leonard misses. Offensive rebound by Trae Curry! Trae Curry puts it back in!
Score: 56-64

[04:00] Team_100 possession (Score: 56-64)
Luka Green makes the Layup and draws the foul on Trae Curry! And-1! Luka Green to the line for 1. [Team fouls: 4] (Trae Curry: 3 personal fouls)   FT 1/1: MISS Luka Green makes 0/1 from the line. Offensive rebound by Pau LaVine! Pau LaVine kicks it out.
Score: 58-64

[03:48] Team_100 possession (Score: 58-64)
FOUL! Holding foul on Jarrett McCollum. [IN THE BONUS! 5 team fouls] Luka Green to the line for 2 free throws. (Jarrett McCollum: 1 personal fouls)   FT 1/2: GOOD   FT 2/2: GOOD Luka Green makes 2/2 from the line.
Score: 60-64

[03:35] Team_020 possession (Score: 60-64)
Jarrett McCollum throws a bad pass! Stolen by Luka Green! TURNOVER! (live ball)

[03:20] Team_100 possession (Score: 60-64)
Manu Ball commits a violation (traveling/carry)! TURNOVER! (dead ball)

[03:20] Substitution (Team_100): Chris Mobley OUT → John Rozier IN (stamina_rule2)

[03:20] Substitution (Team_020): Trae Curry OUT → Miles Siakam IN (stamina_rule2)

[03:09] Team_020 possession (Score: 60-64)
Jarrett McCollum attempts a 3Pt. Contested by Luka Green (5.6 feet, ZONE). Jarrett McCollum misses. FOUL! Loose ball foul on Tyler Griffin during the rebound battle. [Team fouls: 4] No free throws, side out. (Tyler Griffin: 1 personal fouls)

[02:52] Team_020 possession (Score: 60-64)
FOUL! Reach-in foul on John Rozier during the drive. [IN THE BONUS! 5 team fouls] James Cunningham to the line for 2 free throws. (John Rozier: 1 personal fouls)   FT 1/2: MISS   FT 2/2: MISS James Cunningham makes 0/2 from the line. Rebound secured by Pau LaVine.

[02:39] Team_100 possession (Score: 60-64)
FOUL! Holding foul on Terry Simons. [IN THE BONUS! 6 team fouls] Tyler Griffin to the line for 2 free throws. (Terry Simons: 1 personal fouls)   FT 1/2: MISS   FT 2/2: GOOD Tyler Griffin makes 1/2 from the line.
Score: 61-64

[02:23] Team_020 possession (Score: 61-64)
Terry Simons attempts a 3Pt. Wide open! Luka Green is 6.1 feet away. [ZONE] Terry Simons misses. Rebound secured by Pau LaVine.

[02:04] Team_100 possession (Score: 61-64)
Luka Green attempts a Midrange. Contested by Jarrett McCollum (4.9 feet, MAN). Luka Green misses. FOUL! Loose ball foul on Bam Leonard during the rebound battle. [IN THE BONUS! 7 team fouls] John Rozier to the line for 2 free throws. (Bam Leonard: 1 personal fouls)   FT 1/2: GOOD   FT 2/2: GOOD John Rozier makes 2/2 from the line.
Score: 63-64

[01:53] Team_020 possession (Score: 63-64)
Terry Simons attempts a 3Pt. Contested by Tyler Griffin (5.7 feet, MAN). TERRY SIMONS MAKES IT! Assist: James Cunningham
Score: 63-67

[01:39] Team_100 possession (Score: 63-67)
Tyler Griffin attempts a 3Pt. Contested by Terry Simons (4.8 feet, MAN). Tyler Griffin misses. Rebound secured by Miles Siakam.

[01:23] Team_020 possession (Score: 63-67)
Bam Leonard attempts a Layup. Contested by John Rozier (4.8 feet, ZONE). BAM LEONARD MAKES IT! Assist: Miles Siakam
Score: 63-69

[01:05] Team_100 possession (Score: 63-69)
Manu Ball drives, picks up James Cunningham. Help arrives from Terry Simons! Manu Ball attempts a Layup. Contested by Terry Simons (5.3 feet, MAN). Manu Ball misses. FOUL! Loose ball foul on Miles Siakam during the rebound battle. [IN THE BONUS! 8 team fouls] John Rozier to the line for 2 free throws. (Miles Siakam: 1 personal fouls)   FT 1/2: GOOD   FT 2/2: GOOD John Rozier makes 2/2 from the line.
Score: 65-69

[00:50] Team_020 possession (Score: 65-69)
Miles Siakam drives, picks up John Rozier. Help arrives from Manu Ball! Miles Siakam attempts a Layup. Contested by Manu Ball (4.7 feet, MAN). Miles Siakam misses. Rebound secured by John Rozier.

[00:38] Team_100 possession (Score: 65-69)
Luka Green makes the Layup and draws the foul on Bam Leonard! And-1! Luka Green to the line for 1. [BONUS: 9 team fouls] (Bam Leonard: 2 personal fouls)   FT 1/1: GOOD Luka Green makes 1/1 from the line.
Score: 68-69

[00:23] Team_020 possession (Score: 68-69)
James Cunningham attempts a Midrange. Contested by Pau LaVine (5.3 feet, ZONE). James Cunningham misses. Rebound secured by Tyler Griffin.

[00:07] Team_100 possession (Score: 68-69)
Tyler Griffin attempts a 3Pt. Contested by Terry Simons (5.0 feet, MAN). Tyler Griffin misses. Rebound secured by Bam Leonard.

================================================================================
                              3RD QUARTER COMPLETE                              
================================================================================

3RD QUARTER SCORE: Team_100 21, Team_020 21

BOX SCORE:
================================================================================

Team_100
--------------------------------------------------------------------------------
Player                MIN  PTS  REB  AST  TO      FG   FG%      3P   3P%
--------------------------------------------------------------------------------
Tyler Griffin          29    6    1    0   0   3/6    50.0     0/0   0.0
Luka Green             29    5    0    0   0   2/4    50.0     0/0   0.0
John Rozier            10    4    1    0   0   2/2   100.0     0/0   0.0
Pau LaVine             29    2    7    0   0   1/3    33.3     0/0   0.0
Manu Ball              29    2    0    0   0   1/3    33.3     0/0   0.0
Chris Mobley           26    0    2    1   0   0/2     0.0     0/0   0.0

TEAM: FG: 9/20 (45.0%), 3PT: 1/9 (11.1%), REB: 11 (1 off, 10 def), AST: 1, TO: 4
TEAM FOULS: 5 [Team_020 in BONUS]


Team_020
--------------------------------------------------------------------------------
Player                MIN  PTS  REB  AST  TO      FG   FG%      3P   3P%
--------------------------------------------------------------------------------
Bam Leonard            29   10    5    0   0   5/5   100.0     0/0   0.0
Terry Simons           29    3    4    1   0   1/3    33.3     0/0   0.0
Trae Curry             26    2    4    0   0   1/3    33.3     0/0   0.0
Jarrett McCollum       29    2    0    0   0   1/4    25.0     0/0   0.0
James Cunningham       29    2    0    2   0   1/3    33.3     0/0   0.0
Miles Siakam           10    0    2    1   0   0/1     0.0     0/0   0.0

TEAM: FG: 9/19 (47.4%), 3PT: 3/6 (50.0%), REB: 15 (4 off, 11 def), AST: 4, TO: 4
TEAM FOULS: 9 [Team_100 in BONUS]

================================================================================

================================================================================
                       4TH QUARTER - Team_100 vs Team_020                       
================================================================================

[12:00] Team_100 possession (Score: 68-69)
Tyler Griffin attempts a Midrange. Contested by Terry Simons (4.8 feet, MAN). TYLER GRIFFIN MAKES IT! Assist: Chris Mobley
Score: 70-69

[11:48] Team_020 possession (Score: 70-69)
James Cunningham drives to the basket... James Cunningham loses the ball! Stripped by Pau LaVine! TURNOVER! (live ball)

[11:33] Team_100 possession (Score: 70-69)
Manu Ball attempts a Layup. Contested by James Cunningham (5.3 feet, MAN). MANU BALL MAKES IT! Assist: Chris Mobley
Score: 72-69

[11:20] Team_020 possession (Score: 72-69)
James Cunningham attempts a 3Pt. Contested by Luka Green (5.9 feet, ZONE). James Cunningham misses. Rebound secured by Tyler Griffin.

[11:03] Team_100 possession (Score: 72-69)
Tyler Griffin drives, Terry Simons stays with him. Tyler Griffin attempts a Layup. Contested by Terry Simons (4.9 feet, MAN). Tyler Griffin misses. Rebound secured by Terry Simons.

[10:48] Team_020 possession (Score: 72-69)
Jarrett McCollum drives, picks up Pau LaVine. Help arrives from Manu Ball! Jarrett McCollum attempts a Layup. Contested by Manu Ball (5.1 feet, ZONE). JARRETT MCCOLLUM MAKES IT!
Score: 72-71

[10:36] Team_100 possession (Score: 72-71)
FOUL! Offensive foul on Manu Ball! James Cunningham drew the charge! [Team fouls: 1] (Manu Ball: 1 personal fouls) TURNOVER! (dead ball)

[10:24] Team_020 possession (Score: 72-71)
Terry Simons attempts a Layup. BLOCKED BY PAU LAVINE! Ball goes out off Pau LaVine. Terry Simons's ball!

[10:09] Team_020 possession (Score: 72-71)
Trae Curry attempts a Midrange. Contested by Chris Mobley (5.7 feet, MAN). TRAE CURRY MAKES IT! Assist: Terry Simons
Score: 72-73

[09:52] Team_100 possession (Score: 72-73)
Luka Green attempts a 3Pt. Contested by Bam Leonard (3.3 feet, ZONE). Luka Green misses. Rebound secured by Trae Curry.

[09:39] Team_020 possession (Score: 72-73)
James Cunningham attempts a 3Pt. Wide open! Luka Green is 6.0 feet away. [ZONE] James Cunningham misses. Rebound secured by Pau LaVine.

[09:28] Team_100 possession (Score: 72-73)
Luka Green drives to the basket... FOUL! Offensive foul on Luka Green! Jarrett McCollum drew the charge! [Team fouls: 2] (Luka Green: 1 personal fouls) TURNOVER! (dead ball)

[09:13] Team_020 possession (Score: 72-73)
James Cunningham attempts a Midrange. Wide open! Manu Ball is 6.8 feet away. [MAN] JAMES CUNNINGHAM MAKES IT! Assist: Bam Leonard
Score: 72-75

[08:59] Team_100 possession (Score: 72-75)
Tyler Griffin attempts a Midrange. Contested by Terry Simons (5.1 feet, MAN). Tyler Griffin misses. Offensive rebound by Chris Mobley! Chris Mobley kicks it out.

[08:42] Team_100 possession (Score: 72-75)
FOUL! Reach-in foul on Terry Simons during the drive. [Team fouls: 1] No free throws, side out. (Terry Simons: 1 personal fouls)

[08:28] Team_100 possession (Score: 72-75)
Pau LaVine attempts a 3Pt. Contested by Bam Leonard (3.4 feet, ZONE). Pau LaVine misses. Rebound secured by Terry Simons.

[08:17] Team_020 possession (Score: 72-75)
Terry Simons attempts a 3Pt. Wide open! Tyler Griffin is 6.1 feet away. [MAN] Terry Simons misses. Offensive rebound by Trae Curry! Trae Curry's putback is no good. Rebound secured by Tyler Griffin.

[08:05] Team_100 possession (Score: 72-75)
Chris Mobley makes the Layup and draws the foul on Jarrett McCollum! And-1! Chris Mobley to the line for 1. [Team fouls: 2] (Jarrett McCollum: 1 personal fouls)   FT 1/1: GOOD Chris Mobley makes 1/1 from the line.
Score: 75-75

[07:52] Team_020 possession (Score: 75-75)
James Cunningham attempts a Midrange. Contested by Tyler Griffin (5.9 feet, ZONE). JAMES CUNNINGHAM MAKES IT! Assist: Jarrett McCollum
Score: 75-77

[07:38] Team_100 possession (Score: 75-77)
Pau LaVine makes the Layup and draws the foul on Trae Curry! And-1! Pau LaVine to the line for 1. [Team fouls: 3] (Trae Curry: 1 personal fouls)   FT 1/1: GOOD Pau LaVine makes 1/1 from the line.
Score: 78-77

[07:25] Team_020 possession (Score: 78-77)
Trae Curry attempts a 3Pt. Wide open! Luka Green is 6.4 feet away. [ZONE] TRAE CURRY MAKES IT! Assist: Bam Leonard
Score: 78-80

[07:12] Team_100 possession (Score: 78-80)
Tyler Griffin attempts a Layup. BLOCKED BY TRAE CURRY! Ball is loose! Rebound secured by Terry Simons.

[06:55] Team_020 possession (Score: 78-80)
James Cunningham attempts a 3Pt. Wide open! Luka Green is 6.3 feet away. [ZONE] JAMES CUNNINGHAM MAKES IT! Assist: Bam Leonard
Score: 78-83

[06:40] Team_100 possession (Score: 78-83)
FOUL! Shooting foul on Bam Leonard. Pau LaVine to the line for 2 free throws. [Team fouls: 4] (Bam Leonard: 1 personal fouls)   FT 1/2: GOOD   FT 2/2: MISS Pau LaVine makes 1/2 from the line. Rebound secured by Bam Leonard.
Score: 79-83

[06:21] Team_020 possession (Score: 79-83)
James Cunningham drives, picks up Pau LaVine. Help arrives from Manu Ball! James Cunningham attempts a Dunk. Contested by Manu Ball (5.9 feet, ZONE). JAMES CUNNINGHAM MAKES IT! Assist: Trae Curry
Score: 79-85

[06:04] Team_100 possession (Score: 79-85)
Pau LaVine attempts a 3Pt. Contested by Bam Leonard (3.9 feet, MAN). Pau LaVine misses. Rebound secured by Terry Simons.

[05:49] Team_020 possession (Score: 79-85)
Bam Leonard drives and kicks out. Bam Leonard attempts a 3Pt. Wide open! Luka Green is 6.3 feet away. [ZONE] BAM LEONARD MAKES IT!
Score: 79-88

[05:33] Team_100 possession (Score: 79-88)
Manu Ball attempts a Layup. Contested by Trae Curry (5.1 feet, ZONE). Manu Ball misses. Rebound secured by Trae Curry.

[05:18] Team_020 possession (Score: 79-88)
Trae Curry attempts a Layup. Wide open! Chris Mobley is 6.2 feet away. [MAN] TRAE CURRY MAKES IT! Assist: James Cunningham
Score: 79-90

[05:01] Team_100 possession (Score: 79-90)
Pau LaVine drives, picks up Bam Leonard. Help arrives from Jarrett McCollum! Pau LaVine attempts a Layup. Contested by Jarrett McCollum (4.1 feet, MAN). Pau LaVine misses. Rebound secured by Trae Curry.

[04:47] Team_020 possession (Score: 79-90)
Bam Leonard attempts a Layup. Wide open! Chris Mobley is 6.1 feet away. [ZONE] Bam Leonard misses. Rebound secured by Pau LaVine.

[04:37] Team_100 possession (Score: 79-90)
Chris Mobley attempts a 3Pt. Contested by Bam Leonard (4.4 feet, ZONE). Chris Mobley misses. Rebound secured by Terry Simons.

[04:20] Team_020 possession (Score: 79-90)
Trae Curry drives and kicks out. Bam Leonard attempts a 3Pt. Wide open! Luka Green is 6.4 feet away. [ZONE] Bam Leonard misses. Rebound secured by Chris Mobley.

[04:09] Team_100 possession (Score: 79-90)
Chris Mobley attempts a 3Pt. Contested by Bam Leonard (4.5 feet, ZONE). CHRIS MOBLEY MAKES IT! Assist: Tyler Griffin
Score: 82-90

[03:54] Team_020 possession (Score: 82-90)
Bam Leonard drives to the basket... FOUL! Offensive foul on Bam Leonard! Chris Mobley drew the charge! [Team fouls: 5] (Bam Leonard: 2 personal fouls) TURNOVER! (dead ball)

[03:38] Team_100 possession (Score: 82-90)
Manu Ball attempts a Midrange. Contested by Bam Leonard (4.3 feet, ZONE). MANU BALL MAKES IT! Assist: Pau LaVine
Score: 84-90

[03:23] Team_020 possession (Score: 84-90)
Trae Curry attempts a Layup. Wide open! Chris Mobley is 6.5 feet away. [ZONE] TRAE CURRY MAKES IT!
Score: 84-92

[03:03] Team_100 possession (Score: 84-92)
Luka Green attempts a 3Pt. Wide open! James Cunningham is 6.5 feet away. [ZONE] LUKA GREEN MAKES IT! Assist: Tyler Griffin
Score: 87-92

[02:46] Team_020 possession (Score: 87-92)
Trae Curry attempts a 3Pt. Wide open! Chris Mobley is 6.5 feet away. [MAN] Trae Curry misses. Rebound secured by Pau LaVine.

[02:35] Team_100 possession (Score: 87-92)
Luka Green attempts a Midrange. Wide open! Jarrett McCollum is 6.2 feet away. [MAN] LUKA GREEN MAKES IT!
Score: 89-92

[02:22] Team_020 possession (Score: 89-92)
Bam Leonard attempts a Layup. Wide open! Chris Mobley is 6.4 feet away. [ZONE] BAM LEONARD MAKES IT! Assist: James Cunningham
Score: 89-94

[02:08] Team_100 possession (Score: 89-94)
Pau LaVine attempts a 3Pt. Contested by Bam Leonard (4.7 feet, ZONE). Pau LaVine misses. Rebound secured by Terry Simons.

[01:52] Team_020 possession (Score: 89-94)
Terry Simons attempts a 3Pt. Wide open! Luka Green is 7.0 feet away. [ZONE] Terry Simons misses. FOUL! Loose ball foul on Pau LaVine during the rebound battle. [Team fouls: 3] No free throws, side out. (Pau LaVine: 1 personal fouls)

[01:36] Team_020 possession (Score: 89-94)
Jarrett McCollum drives to the basket... FOUL! Offensive foul on Jarrett McCollum! Luka Green drew the charge! [Team fouls: 6] (Jarrett McCollum: 2 personal fouls) TURNOVER! (dead ball)

[01:23] Team_100 possession (Score: 89-94)
Luka Green attempts a Midrange. Contested by Bam Leonard (5.0 feet, ZONE). Luka Green misses. Rebound secured by Trae Curry.

[01:08] Team_020 possession (Score: 89-94)
Trae Curry attempts a 3Pt. Wide open! Pau LaVine is 6.8 feet away. [ZONE] Trae Curry misses. Rebound secured by Chris Mobley.

[00:50] Team_100 possession (Score: 89-94)
Manu Ball attempts a 3Pt. Contested by Bam Leonard (4.9 feet, ZONE). Manu Ball misses. FOUL! Loose ball foul on Terry Simons during the rebound battle. [IN THE BONUS! 7 team fouls] Pau LaVine to the line for 2 free throws. (Terry Simons: 2 personal fouls)   FT 1/2: GOOD   FT 2/2: MISS Pau LaVine makes 1/2 from the line. Rebound secured by Bam Leonard.
Score: 90-94

[00:39] Team_020 possession (Score: 90-94)
Bam Leonard attempts a Layup. Wide open! Pau LaVine is 6.6 feet away. [MAN] BAM LEONARD MAKES IT!
Score: 90-96

[00:25] Team_100 possession (Score: 90-96)
Chris Mobley throws a bad pass! Stolen by Trae Curry! TURNOVER! (live ball)

[00:09] Team_020 possession (Score: 90-96)
Terry Simons attempts a 3Pt. Wide open! Luka Green is 7.1 feet away. [ZONE] TERRY SIMONS MAKES IT! Assist: Jarrett McCollum
Score: 90-99

================================================================================
                              4TH QUARTER COMPLETE                              
================================================================================

4TH QUARTER SCORE: Team_100 22, Team_020 30

BOX SCORE:
================================================================================

Team_100
--------------------------------------------------------------------------------
Player                MIN  PTS  REB  AST  TO      FG   FG%      3P   3P%
--------------------------------------------------------------------------------
Chris Mobley           38    6    3    2   0   2/3    66.7     0/0   0.0
Luka Green             41    5    0    0   0   2/4    50.0     0/0   0.0
Manu Ball              41    4    0    0   0   2/4    50.0     0/0   0.0
Pau LaVine             41    3    3    1   0   1/6    16.7     0/0   0.0
Tyler Griffin          41    2    2    2   0   1/3    33.3     0/0   0.0

TEAM: FG: 8/20 (40.0%), 3PT: 2/8 (25.0%), REB: 8 (2 off, 6 def), AST: 5, TO: 3
TEAM FOULS: 3


Team_020
--------------------------------------------------------------------------------
Player                MIN  PTS  REB  AST  TO      FG   FG%      3P   3P%
--------------------------------------------------------------------------------
James Cunningham       41    9    0    2   0   4/6    66.7     0/0   0.0
Trae Curry             38    9    4    1   0   4/7    57.1     0/0   0.0
Bam Leonard            41    7    3    3   0   3/4    75.0     0/0   0.0
Terry Simons           41    3    6    1   0   1/2    50.0     0/0   0.0
Jarrett McCollum       41    2    0    2   0   1/1   100.0     0/0   0.0

TEAM: FG: 13/20 (65.0%), 3PT: 3/8 (37.5%), REB: 13 (2 off, 11 def), AST: 9, TO: 3
TEAM FOULS: 7 [Team_100 in BONUS]

================================================================================

================================================================================
                               FULL GAME COMPLETE                               
================================================================================

FINAL SCORE: Team_100 90, Team_020 99

SCORING BY QUARTER:
--------------------------------------------------------------------------------
Team                     Q1     Q2     Q3     Q4    FINAL
--------------------------------------------------------------------------------
Team_100                 24     23     21     22       90
Team_020                 23     25     21     30       99
--------------------------------------------------------------------------------

FULL GAME BOX SCORE:
================================================================================

Team_100
--------------------------------------------------------------------------------
Player                MIN  PTS  REB  AST  TO      FG   FG%      3P   3P%      FT STL BLK
--------------------------------------------------------------------------------
Luka Green             41   14    0    0   3   6/14   42.9   2/6    33.3   4/6     1   1
Manu Ball              41   16    0    0   2   8/15   53.3   3/6    50.0   4/5     1   0
Tyler Griffin          41    8    6    5   2   3/14   21.4   1/6    16.7   1/3     1   0
Pau LaVine             41   10   16    2   1   4/14   28.6   1/6    16.7   3/6     2   2
Chris Mobley           38   14    9    3   1   6/11   54.5   1/4    25.0   3/3     1   0
John Rozier            10    7    3    1   0   1/1   100.0   1/1   100.0   4/4     1   0
Dirk Sabonis            7    5    0    0   0   2/3    66.7   1/2    50.0   0/0     0   0
Evan Butler             7    3    0    2   0   1/2    50.0   1/2    50.0   0/0     0   0
Tyrese Wade             7    0    1    1   0   0/0     0.0   0/0     0.0   0/0     1   0
Carmelo Ginobili        7    5    1    1   1   2/5    40.0   1/2    50.0   0/0     0   0

TEAM: FG: 35/81 (43.2%), 3PT: 12/35 (34.3%), REB: 37 (7 off, 30 def), AST: 15, TO: 10


Team_020
--------------------------------------------------------------------------------
Player                MIN  PTS  REB  AST  TO      FG   FG%      3P   3P%      FT STL BLK
--------------------------------------------------------------------------------
Jarrett McCollum       41   13    0    5   2   6/13   46.2   3/5    60.0   1/2     1   0
James Cunningham       41   15    0    5   3   7/12   58.3   2/5    40.0   0/2     0   0
Terry Simons           41   13   14    2   3   6/11   54.5   3/6    50.0   0/0     1   0
Bam Leonard            41   33   19    6   2  14/16   87.5   1/1   100.0   2/2     1   0
Trae Curry             38   11   16    1   3   5/12   41.7   1/3    33.3   0/2     2   1
Miles Siakam           10    2    6    1   2   1/5    20.0   0/1     0.0   0/0     0   1
Franz Doncic            7    3    0    1   0   1/1   100.0   1/1   100.0   0/0     0   0
Stephen Parker          7    0    0    0   0   0/0     0.0   0/0     0.0   0/0     0   0
Victor Holiday          7    3    1    0   1   1/2    50.0   0/1     0.0   1/1     0   0
Cole Barnes             7    4    3    1   0   2/2   100.0   0/0     0.0   2/2     0   0

TEAM: FG: 43/74 (58.1%), 3PT: 11/23 (47.8%), REB: 58 (13 off, 45 def), AST: 22, TO: 16

================================================================================
