================================================================================
                        FULL GAME - Team_019 vs Team_097                        
================================================================================

================================================================================
                       1ST QUARTER - Team_019 vs Team_097                       
================================================================================

[12:00] Team_019 possession (Score: 0-0)
Rudy Giddey drives to the basket... Rudy Giddey commits a violation (traveling/carry)! TURNOVER! (dead ball)

[11:49] Team_097 possession (Score: 0-0)
Tyrese Stewart attempts a Layup. Contested by DeMar James (5.1 feet, ZONE). TYRESE STEWART MAKES IT!
Score: 0-2

[11:38] Team_019 possession (Score: 0-2)
Tobias Hyland drives, Anthony Haliburton stays with him. Tobias Hyland attempts a Dunk. Contested by Anthony Haliburton (3.3 feet, MAN). Tobias Hyland misses. Rebound secured by Tyrese Stewart.

[11:21] Team_097 possession (Score: 0-2)
FOUL! Offensive foul on Anthony Haliburton! Tobias Hyland drew the charge! [Team fouls: 1] (Anthony Haliburton: 1 personal fouls) TURNOVER! (dead ball)

[11:06] Team_019 possession (Score: 0-2)
D'Angelo Randle attempts a Layup. Contested by Shai Poole (3.6 feet, MAN). D'ANGELO RANDLE MAKES IT! Assist: DeMar James
Score: 2-2

[10:51] Team_097 possession (Score: 2-2)
Shai Poole makes the Layup and draws the foul on Brandon James! And-1! Shai Poole to the line for 1. [Team fouls: 1] (Brandon James: 1 personal fouls)   FT 1/1: GOOD Shai Poole makes 1/1 from the line.
Score: 2-5

[10:34] Team_019 possession (Score: 2-5)
FOUL! Shooting foul on Jrue Haliburton. D'Angelo Randle to the line for 2 free throws. [Team fouls: 2] (Jrue Haliburton: 1 personal fouls)   FT 1/2: MISS   FT 2/2: GOOD D'Angelo Randle makes 1/2 from the line.
Score: 3-5

[10:20] Team_097 possession (Score: 3-5)
Jrue Haliburton attempts a 3Pt. Contested by D'Angelo Randle (4.0 feet, ZONE). JRUE HALIBURTON MAKES IT! Assist: Anthony Haliburton
Score: 3-8

[10:10] Team_019 possession (Score: 3-8)
Rudy Giddey attempts a 3Pt. Contested by Shai Poole (3.6 feet, ZONE). Rudy Giddey misses. Rebound secured by Shai Poole.

[09:55] Team_097 possession (Score: 3-8)
Shai Poole attempts a 3Pt. Contested by D'Angelo Randle (4.2 feet, MAN). SHAI POOLE MAKES IT! Assist: Anthony Haliburton
Score: 3-11

[09:40] Team_019 possession (Score: 3-11)
Brandon James drives, picks up Anthony Haliburton. Help arrives from Jrue Haliburton! Brandon James attempts a Layup. Contested by Jrue Haliburton (3.3 feet, ZONE). BRANDON JAMES MAKES IT! Assist: DeMar James
Score: 5-11

[09:22] Team_097 possession (Score: 5-11)
Jrue Haliburton drives, Brandon James stays with him. Jrue Haliburton attempts a Dunk. Contested by Brandon James (5.5 feet, MAN). JRUE HALIBURTON MAKES IT! Assist: Evan Brogdon
Score: 5-13

[09:08] Team_019 possession (Score: 5-13)
Rudy Giddey attempts a 3Pt. Contested by Evan Brogdon (4.9 feet, MAN). RUDY GIDDEY MAKES IT! Assist: D'Angelo Randle
Score: 8-13

[08:56] Team_097 possession (Score: 8-13)
Evan Brogdon attempts a Midrange. Wide open! Rudy Giddey is 6.0 feet away. [MAN] Evan Brogdon misses. Rebound secured by DeMar James.

[08:39] Team_019 possession (Score: 8-13)
D'Angelo Randle attempts a 3Pt. Contested by Shai Poole (3.6 feet, MAN). D'Angelo Randle misses. Offensive rebound by DeMar James! DeMar James's putback is no good. Rebound secured by Tyrese Stewart.

[08:22] Team_097 possession (Score: 8-13)
Anthony Haliburton attempts a 3Pt. Contested by D'Angelo Randle (4.0 feet, ZONE). Anthony Haliburton misses. Rebound secured by DeMar James.

[08:08] Team_019 possession (Score: 8-13)
Rudy Giddey attempts a 3Pt. Contested by Evan Brogdon (4.9 feet, MAN). Rudy Giddey misses. Rebound secured by Anthony Haliburton.

[07:53] Team_097 possession (Score: 8-13)
Tyrese Stewart attempts a 3Pt. Contested by DeMar James (5.1 feet, MAN). TYRESE STEWART MAKES IT! Assist: Jrue Haliburton
Score: 8-16

[07:41] Team_019 possession (Score: 8-16)
Tobias Hyland attempts a 3Pt. Contested by Shai Poole (3.4 feet, ZONE). Tobias Hyland misses. Rebound secured by Tyrese Stewart.

[07:31] Team_097 possession (Score: 8-16)
FOUL! Holding foul on Brandon James. [Team fouls: 2] No free throws, side out. (Brandon James: 2 personal fouls)

[07:18] Team_097 possession (Score: 8-16)
Shai Poole attempts a 3Pt. Contested by D'Angelo Randle (4.2 feet, MAN). Shai Poole misses. Rebound secured by D'Angelo Randle.

[07:02] Team_019 possession (Score: 8-16)
Tobias Hyland attempts a 3Pt. Contested by Anthony Haliburton (3.3 feet, MAN). Tobias Hyland misses. Offensive rebound by DeMar James! DeMar James puts it back in!
Score: 10-16

[06:49] Team_097 possession (Score: 10-16)
Anthony Haliburton drives, DeMar James stays with him. Anthony Haliburton attempts a Dunk. Contested by DeMar James (4.7 feet, ZONE). ANTHONY HALIBURTON MAKES IT! Assist: Jrue Haliburton
Score: 10-18

[06:35] Team_019 possession (Score: 10-18)
D'Angelo Randle attempts a 3Pt. Contested by Shai Poole (3.6 feet, ZONE). D'Angelo Randle misses. Rebound secured by Tyrese Stewart.

[06:23] Team_097 possession (Score: 10-18)
Evan Brogdon drives, picks up Rudy Giddey. Help arrives from D'Angelo Randle! Evan Brogdon attempts a Dunk. Wide open! D'Angelo Randle is 6.0 feet away. [MAN] Evan Brogdon misses. Offensive rebound by Anthony Haliburton! Anthony Haliburton's putback is no good. Offensive rebound by Tyrese Stewart! Tyrese Stewart kicks it out.

[06:05] Team_097 possession (Score: 10-18)
Tyrese Stewart attempts a Layup. BLOCKED BY DEMAR JAMES! Ball goes out off DeMar James. Tyrese Stewart's ball!

[05:49] Team_097 possession (Score: 10-18)
FOUL! Reach-in foul on DeMar James during the drive. [Team fouls: 3] No free throws, side out. (DeMar James: 1 personal fouls)

[05:37] Team_097 possession (Score: 10-18)
Anthony Haliburton attempts a Midrange. Wide open! Tobias Hyland is 6.1 feet away. [ZONE] Anthony Haliburton misses. Offensive rebound by Tyrese Stewart! Tyrese Stewart kicks it out.

[05:25] Team_097 possession (Score: 10-18)
Jrue Haliburton drives and kicks out. Shai Poole attempts a 3Pt. Contested by D'Angelo Randle (3.6 feet, ZONE). Shai Poole misses. Rebound secured by DeMar James.

[05:14] Team_019 possession (Score: 10-18)
Tobias Hyland attempts a Midrange. Contested by Anthony Haliburton (3.3 feet, MAN). Tobias Hyland misses. Rebound secured by Tyrese Stewart.

[04:59] Team_097 possession (Score: 10-18)
Shai Poole attempts a Midrange. Contested by Rudy Giddey (5.9 feet, ZONE). SHAI POOLE MAKES IT!
Score: 10-20

[04:45] Team_019 possession (Score: 10-20)
D'Angelo Randle attempts a Midrange. Contested by Shai Poole (3.7 feet, MAN). D'ANGELO RANDLE MAKES IT!
Score: 12-20

[04:28] Team_097 possession (Score: 12-20)
Evan Brogdon makes the Dunk and draws the foul on DeMar James! And-1! Evan Brogdon to the line for 1. [Team fouls: 4] (DeMar James: 2 personal fouls)   FT 1/1: GOOD Evan Brogdon makes 1/1 from the line.
Score: 12-23

[04:18] Team_019 possession (Score: 12-23)
Tobias Hyland drives, Anthony Haliburton stays with him. Tobias Hyland attempts a Dunk. Contested by Anthony Haliburton (3.4 feet, ZONE). TOBIAS HYLAND MAKES IT!
Score: 14-23

[04:04] Team_097 possession (Score: 14-23)
Jrue Haliburton drives and kicks out. Jrue Haliburton attempts a 3Pt. Contested by Brandon James (5.2 feet, MAN). JRUE HALIBURTON MAKES IT! Assist: Tyrese Stewart
Score: 14-26

[03:49] Team_019 possession (Score: 14-26)
Brandon James attempts a 3Pt. Contested by Shai Poole (3.5 feet, ZONE). Brandon James misses. Offensive rebound by D'Angelo Randle! D'Angelo Randle kicks it out.

[03:34] Team_019 possession (Score: 14-26)
D'Angelo Randle attempts a 3Pt. Contested by Shai Poole (3.8 feet, ZONE). D'Angelo Randle misses. Rebound secured by Anthony Haliburton.

[03:21] Team_097 possession (Score: 14-26)
Shai Poole drives and kicks out. Shai Poole attempts a Midrange. Contested by D'Angelo Randle (3.8 feet, MAN). Shai Poole misses. Offensive rebound by Tyrese Stewart! Tyrese Stewart kicks it out.

[03:02] Team_097 possession (Score: 14-26)
Tyrese Stewart drives to the basket... Tyrese Stewart throws a bad pass! Stolen by DeMar James! TURNOVER! (live ball)

[02:48] Team_019 possession (Score: 14-26)
D'Angelo Randle attempts a 3Pt. Contested by Shai Poole (3.8 feet, MAN). D'Angelo Randle misses. Rebound secured by Anthony Haliburton.

[02:36] Team_097 possession (Score: 14-26)
Evan Brogdon attempts a 3Pt. Wide open! Rudy Giddey is 6.2 feet away. [MAN] Evan Brogdon misses. Offensive rebound by Anthony Haliburton! Anthony Haliburton kicks it out.

[02:21] Team_097 possession (Score: 14-26)
Evan Brogdon attempts a Midrange. Wide open! Tobias Hyland is 6.6 feet away. [ZONE] EVAN BROGDON MAKES IT!
Score: 14-28

[02:09] Team_019 possession (Score: 14-28)
D'Angelo Randle attempts a 3Pt. Contested by Shai Poole (3.9 feet, MAN). D'Angelo Randle misses. Rebound secured by Anthony Haliburton.

[01:54] Team_097 possession (Score: 14-28)
Shai Poole drives to the basket... Shai Poole throws a bad pass out of bounds! TURNOVER! (dead ball)

[01:54] Substitution (Team_019): Rudy Giddey OUT → Gary Ginobili IN (stamina_rule2)

[01:54] Substitution (Team_019): Brandon James OUT → Jalen Turner IN (stamina_rule2)

[01:54] Substitution (Team_019): D'Angelo Randle OUT → Blake LaVine IN (stamina_rule2)

[01:54] Substitution (Team_019): Tobias Hyland OUT → Shai Ingram IN (stamina_rule2)

[01:54] Substitution (Team_019): DeMar James OUT → Tim Jordan IN (stamina_rule2)

[01:54] Substitution (Team_097): Evan Brogdon OUT → Gary Carter IN (stamina_rule2)

[01:54] Substitution (Team_097): Jrue Haliburton OUT → Dwyane Ginobili IN (stamina_rule2)

[01:54] Substitution (Team_097): Shai Poole OUT → Miles Dosunmu IN (stamina_rule2)

[01:54] Substitution (Team_097): Anthony Haliburton OUT → Joel Simons IN (stamina_rule2)

[01:54] Substitution (Team_097): Tyrese Stewart OUT → Miles Banchero IN (stamina_rule2)

[01:39] Team_019 possession (Score: 14-28)
FOUL! Shooting foul on Joel Simons. Tim Jordan to the line for 2 free throws. [Team fouls: 3] (Joel Simons: 1 personal fouls)   FT 1/2: MISS   FT 2/2: GOOD Tim Jordan makes 1/2 from the line.
Score: 15-28

[01:26] Team_097 possession (Score: 15-28)
Joel Simons drives, Shai Ingram stays with him. Joel Simons attempts a Layup. Contested by Shai Ingram (4.7 feet, MAN). JOEL SIMONS MAKES IT! Assist: Gary Carter
Score: 15-30

[01:08] Team_019 possession (Score: 15-30)
Shai Ingram attempts a Midrange. Contested by Joel Simons (3.5 feet, MAN). SHAI INGRAM MAKES IT!
Score: 17-30

[00:55] Team_097 possession (Score: 17-30)
Joel Simons attempts a Midrange. Contested by Jalen Turner (4.1 feet, ZONE). Joel Simons misses. Rebound secured by Tim Jordan.

[00:41] Team_019 possession (Score: 17-30)
Gary Ginobili attempts a Midrange. Contested by Joel Simons (4.0 feet, ZONE). Gary Ginobili misses. Offensive rebound by Tim Jordan! Tim Jordan kicks it out.

[00:27] Team_019 possession (Score: 17-30)
Blake LaVine attempts a 3Pt. Contested by Joel Simons (3.7 feet, ZONE). Blake LaVine misses. Rebound secured by Joel Simons.

[00:14] Team_097 possession (Score: 17-30)
Joel Simons drives to the basket... Joel Simons throws a bad pass! Stolen by Shai Ingram! TURNOVER! (live ball)

[00:01] Team_019 possession (Score: 17-30)
Shai Ingram attempts a Layup. Contested by Joel Simons (3.5 feet, MAN). Shai Ingram misses. Rebound secured by Miles Dosunmu.

================================================================================
                              1ST QUARTER COMPLETE                              
================================================================================

1ST QUARTER SCORE: Team_019 17, Team_097 30

BOX SCORE:
================================================================================

Team_019
--------------------------------------------------------------------------------
Player                MIN  PTS  REB  AST  TO      FG   FG%      3P   3P%
--------------------------------------------------------------------------------
D'Angelo Randle        10    5    2    1   0   3/8    37.5     0/0   0.0
Rudy Giddey            10    3    0    0   0   1/3    33.3     0/0   0.0
Tobias Hyland          10    2    0    0   0   1/4    25.0     0/0   0.0
DeMar James            10    2    4    2   0   1/1   100.0     0/0   0.0
Brandon James          10    2    0    0   0   1/1   100.0     0/0   0.0
Shai Ingram             2    2    0    0   0   1/2    50.0     0/0   0.0
Tim Jordan              2    1    2    0   0   1/1   100.0     0/0   0.0
Blake LaVine            2    0    0    0   0   0/1     0.0     0/0   0.0

TEAM: FG: 9/21 (42.9%), 3PT: 2/11 (18.2%), REB: 9 (4 off, 5 def), AST: 3, TO: 1
TEAM FOULS: 4


Team_097
--------------------------------------------------------------------------------
Player                MIN  PTS  REB  AST  TO      FG   FG%      3P   3P%
--------------------------------------------------------------------------------
Shai Poole             10    8    1    0   0   3/4    75.0     0/0   0.0
Jrue Haliburton        10    8    0    2   0   3/4    75.0     0/0   0.0
Tyrese Stewart         10    5    8    1   0   2/2   100.0     0/0   0.0
Evan Brogdon           10    5    0    1   0   2/3    66.7     0/0   0.0
Anthony Haliburton     10    2    5    2   0   1/2    50.0     0/0   0.0
Joel Simons             2    2    1    0   0   1/2    50.0     0/0   0.0
Gary Carter             2    0    0    1   0   0/0     0.0     0/0   0.0
Miles Dosunmu           2    0    1    0   0   0/0     0.0     0/0   0.0

TEAM: FG: 12/17 (70.6%), 3PT: 3/5 (60.0%), REB: 15 (4 off, 11 def), AST: 7, TO: 4
TEAM FOULS: 3

================================================================================

================================================================================
                       2ND QUARTER - Team_019 vs Team_097                       
================================================================================

[12:00] Team_019 possession (Score: 17-30)
D'Angelo Randle attempts a Midrange. Contested by Shai Poole (3.7 feet, MAN). D'Angelo Randle misses. Rebound secured by Anthony Haliburton.

[11:46] Team_097 possession (Score: 17-30)
Evan Brogdon attempts a Midrange. Contested by Brandon James (5.8 feet, ZONE). EVAN BROGDON MAKES IT!
Score: 17-32

[11:34] Team_019 possession (Score: 17-32)
D'Angelo Randle attempts a Layup. Contested by Shai Poole (3.7 feet, MAN). D'ANGELO RANDLE MAKES IT! Assist: Brandon James
Score: 19-32

[11:25] Team_097 possession (Score: 19-32)
Anthony Haliburton drives, Tobias Hyland stays with him. Anthony Haliburton attempts a Layup. Wide open! Tobias Hyland is 6.2 feet away. [MAN] Anthony Haliburton misses. Rebound secured by DeMar James.

[11:06] Team_019 possession (Score: 19-32)
DeMar James drives, picks up Anthony Haliburton. Help arrives from Jrue Haliburton! DeMar James attempts a Layup. Contested by Jrue Haliburton (3.8 feet, ZONE). DEMAR JAMES MAKES IT! Assist: D'Angelo Randle
Score: 21-32

[10:57] Team_097 possession (Score: 21-32)
Evan Brogdon attempts a Midrange. Wide open! Rudy Giddey is 6.1 feet away. [ZONE] EVAN BROGDON MAKES IT! Assist: Shai Poole
Score: 21-34

[10:42] Team_019 possession (Score: 21-34)
Tobias Hyland drives and kicks out. Rudy Giddey attempts a 3Pt. Contested by Shai Poole (3.6 feet, ZONE). Rudy Giddey misses. Rebound secured by Tyrese Stewart.

[10:30] Team_097 possession (Score: 21-34)
Anthony Haliburton attempts a Midrange. Wide open! Tobias Hyland is 6.3 feet away. [MAN] Anthony Haliburton misses. Rebound secured by Tobias Hyland.

[10:16] Team_019 possession (Score: 21-34)
D'Angelo Randle attempts a 3Pt. Contested by Shai Poole (3.8 feet, MAN). D'Angelo Randle misses. Rebound secured by Anthony Haliburton.

[10:01] Team_097 possession (Score: 21-34)
Jrue Haliburton attempts a 3Pt. Contested by Brandon James (5.8 feet, MAN). Jrue Haliburton misses. Rebound secured by D'Angelo Randle.

[09:48] Team_019 possession (Score: 21-34)
Rudy Giddey attempts a 3Pt. Contested by Evan Brogdon (5.1 feet, MAN). Rudy Giddey misses. Rebound secured by Shai Poole.

[09:32] Team_097 possession (Score: 21-34)
Shai Poole attempts a 3Pt. Contested by D'Angelo Randle (4.5 feet, ZONE). Shai Poole misses. Rebound secured by Tobias Hyland.

[09:21] Team_019 possession (Score: 21-34)
D'Angelo Randle attempts a 3Pt. Contested by Shai Poole (3.9 feet, MAN). D'ANGELO RANDLE MAKES IT! Assist: Tobias Hyland
Score: 24-34

[09:07] Team_097 possession (Score: 24-34)
Shai Poole attempts a Layup. Contested by D'Angelo Randle (4.6 feet, MAN). Shai Poole misses. Rebound secured by D'Angelo Randle.

[08:52] Team_019 possession (Score: 24-34)
FOUL! Shooting foul on Anthony Haliburton. Tobias Hyland to the line for 2 free throws. [Team fouls: 1] (Anthony Haliburton: 1 personal fouls)   FT 1/2: GOOD   FT 2/2: MISS Tobias Hyland makes 1/2 from the line. Rebound secured by Anthony Haliburton.
Score: 25-34

[08:33] Team_097 possession (Score: 25-34)
Shai Poole loses control! Ball rolls out of bounds! TURNOVER! (dead ball)

[08:33] Substitution (Team_019): Rudy Giddey OUT → Gary Ginobili IN (stamina_rule2)

[08:33] Substitution (Team_019): Brandon James OUT → Jalen Turner IN (stamina_rule2)

[08:33] Substitution (Team_019): D'Angelo Randle OUT → Blake LaVine IN (stamina_rule2)

[08:33] Substitution (Team_019): Tobias Hyland OUT → Shai Ingram IN (stamina_rule2)

[08:33] Substitution (Team_019): DeMar James OUT → Tim Jordan IN (stamina_rule2)

[08:33] Substitution (Team_097): Evan Brogdon OUT → Gary Carter IN (stamina_rule2)

[08:33] Substitution (Team_097): Jrue Haliburton OUT → Dwyane Ginobili IN (stamina_rule2)

[08:33] Substitution (Team_097): Shai Poole OUT → Miles Dosunmu IN (stamina_rule2)

[08:33] Substitution (Team_097): Anthony Haliburton OUT → Joel Simons IN (stamina_rule2)

[08:33] Substitution (Team_097): Tyrese Stewart OUT → Miles Banchero IN (stamina_rule2)

[08:21] Team_019 possession (Score: 25-34)
FOUL! Shooting foul on Dwyane Ginobili. Jalen Turner to the line for 3 free throws. [Team fouls: 2] (Dwyane Ginobili: 1 personal fouls)   FT 1/3: GOOD   FT 2/3: GOOD   FT 3/3: GOOD Jalen Turner makes 3/3 from the line.
Score: 28-34

[08:10] Team_097 possession (Score: 28-34)
Miles Dosunmu attempts a 3Pt. Contested by Blake LaVine (5.2 feet, MAN). Miles Dosunmu misses. Rebound secured by Tim Jordan.

[07:53] Team_019 possession (Score: 28-34)
Jalen Turner attempts a Midrange. Contested by Dwyane Ginobili (4.8 feet, MAN). Jalen Turner misses. Rebound secured by Miles Dosunmu.

[07:38] Team_097 possession (Score: 28-34)
Dwyane Ginobili attempts a Layup. Contested by Jalen Turner (3.8 feet, MAN). DWYANE GINOBILI MAKES IT! Assist: Gary Carter
Score: 28-36

[07:26] Team_019 possession (Score: 28-36)
Tim Jordan attempts a Midrange. Contested by Miles Banchero (4.8 feet, ZONE). TIM JORDAN MAKES IT! Assist: Gary Ginobili
Score: 30-36

[07:09] Team_097 possession (Score: 30-36)
Gary Carter attempts a Midrange. Wide open! Tim Jordan is 6.3 feet away. [ZONE] GARY CARTER MAKES IT! Assist: Miles Dosunmu
Score: 30-38

[06:55] Team_019 possession (Score: 30-38)
Blake LaVine drives to the basket... Blake LaVine loses the ball! Stripped by Joel Simons! TURNOVER! (live ball)

[06:37] Team_097 possession (Score: 30-38)
FOUL! Holding foul on Jalen Turner. [Team fouls: 1] No free throws, side out. (Jalen Turner: 1 personal fouls)

[06:23] Team_097 possession (Score: 30-38)
Miles Banchero drives, Shai Ingram stays with him. Miles Banchero attempts a Dunk. Contested by Shai Ingram (4.7 feet, MAN). MILES BANCHERO MAKES IT!
Score: 30-40

[06:06] Team_019 possession (Score: 30-40)
FOUL! Reach-in foul on Gary Carter during the drive. [Team fouls: 3] No free throws, side out. (Gary Carter: 1 personal fouls)

[05:53] Team_019 possession (Score: 30-40)
Jalen Turner attempts a 3Pt. Contested by Dwyane Ginobili (4.8 feet, MAN). Jalen Turner misses. FOUL! Loose ball foul on Miles Dosunmu during the rebound battle. [Team fouls: 4] No free throws, side out. (Miles Dosunmu: 1 personal fouls)

[05:34] Team_019 possession (Score: 30-40)
Tim Jordan throws a bad pass! Stolen by Joel Simons! TURNOVER! (live ball)

[05:21] Team_097 possession (Score: 30-40)
Gary Carter attempts a 3Pt. Contested by Blake LaVine (4.5 feet, ZONE). GARY CARTER MAKES IT! Assist: Miles Dosunmu
Score: 30-43

[05:06] Team_019 possession (Score: 30-43)
Gary Ginobili attempts a Layup. Contested by Joel Simons (4.0 feet, ZONE). GARY GINOBILI MAKES IT!
Score: 32-43

[04:54] Team_097 possession (Score: 32-43)
Miles Banchero loses the ball! Stripped by Shai Ingram! TURNOVER! (live ball)

[04:39] Team_019 possession (Score: 32-43)
Shai Ingram attempts a 3Pt. Contested by Joel Simons (3.5 feet, MAN). Shai Ingram misses. Rebound secured by Miles Dosunmu.

[04:20] Team_097 possession (Score: 32-43)
Miles Banchero drives and kicks out. Miles Banchero attempts a 3Pt. Contested by Shai Ingram (4.5 feet, MAN). Miles Banchero misses. Offensive rebound by Joel Simons! Joel Simons kicks it out.

[04:05] Team_097 possession (Score: 32-43)
Miles Banchero drives to the basket... Miles Banchero throws a bad pass out of bounds! TURNOVER! (dead ball)

[03:55] Team_019 possession (Score: 32-43)
Jalen Turner drives to the basket... Jalen Turner throws a bad pass out of bounds! TURNOVER! (dead ball)

[03:45] Team_097 possession (Score: 32-43)
Gary Carter drives, Gary Ginobili stays with him. Gary Carter attempts a Layup. Contested by Gary Ginobili (5.6 feet, MAN). GARY CARTER MAKES IT!
Score: 32-45

[03:31] Team_019 possession (Score: 32-45)
Blake LaVine attempts a 3Pt. Contested by Joel Simons (3.7 feet, ZONE). Blake LaVine misses. Rebound secured by Miles Dosunmu.

[03:18] Team_097 possession (Score: 32-45)
Joel Simons attempts a Layup. Contested by Shai Ingram (4.7 feet, MAN). JOEL SIMONS MAKES IT! Assist: Gary Carter
Score: 32-47

[03:04] Team_019 possession (Score: 32-47)
Gary Ginobili attempts a 3Pt. Contested by Joel Simons (4.0 feet, ZONE). Gary Ginobili misses. Rebound secured by Joel Simons.

[02:53] Team_097 possession (Score: 32-47)
Joel Simons attempts a Midrange. Wide open! Gary Ginobili is 6.0 feet away. [ZONE] JOEL SIMONS MAKES IT! Assist: Gary Carter
Score: 32-49

[02:39] Team_019 possession (Score: 32-49)
Gary Ginobili attempts a 3Pt. Contested by Joel Simons (4.1 feet, ZONE). Gary Ginobili misses. Rebound secured by Miles Banchero.

[02:22] Team_097 possession (Score: 32-49)
FOUL! Reach-in foul on Shai Ingram during the drive. [Team fouls: 2] No free throws, side out. (Shai Ingram: 1 personal fouls)

[02:08] Team_097 possession (Score: 32-49)
Miles Banchero drives to the basket... Miles Banchero throws a bad pass! Stolen by Shai Ingram! TURNOVER! (live ball)

[01:51] Team_019 possession (Score: 32-49)
Shai Ingram drives to the basket... Shai Ingram loses the ball! Stripped by Joel Simons! TURNOVER! (live ball)

[01:35] Team_097 possession (Score: 32-49)
Dwyane Ginobili attempts a Midrange. Contested by Shai Ingram (4.6 feet, ZONE). Dwyane Ginobili misses. Rebound secured by Tim Jordan.

[01:22] Team_019 possession (Score: 32-49)
Gary Ginobili attempts a 3Pt. Contested by Joel Simons (4.2 feet, ZONE). Gary Ginobili misses. Rebound secured by Miles Dosunmu.

[01:07] Team_097 possession (Score: 32-49)
Miles Dosunmu drives to the basket... Miles Dosunmu loses control! Ball rolls out of bounds! TURNOVER! (dead ball)

[00:55] Team_019 possession (Score: 32-49)
Tim Jordan makes the Layup and draws the foul on Joel Simons! And-1! Tim Jordan to the line for 1. [BONUS: 5 team fouls] (Joel Simons: 1 personal fouls)   FT 1/1: GOOD Tim Jordan makes 1/1 from the line.
Score: 35-49

[00:39] Team_097 possession (Score: 35-49)
Gary Carter attempts a 3Pt. Contested by Gary Ginobili (5.8 feet, MAN). Gary Carter misses. FOUL! Loose ball foul on Shai Ingram during the rebound battle. [Team fouls: 3] No free throws, side out. (Shai Ingram: 2 personal fouls)

[00:25] Team_097 possession (Score: 35-49)
Joel Simons attempts a Midrange. Contested by Shai Ingram (5.0 feet, MAN). Joel Simons misses. Rebound secured by Shai Ingram.

[00:10] Team_019 possession (Score: 35-49)
Tim Jordan attempts a Midrange. Contested by Joel Simons (3.8 feet, MAN). Tim Jordan misses. Rebound secured by Joel Simons.

================================================================================
                              2ND QUARTER COMPLETE                              
================================================================================

2ND QUARTER SCORE: Team_019 18, Team_097 19

BOX SCORE:
================================================================================

Team_019
--------------------------------------------------------------------------------
Player                MIN  PTS  REB  AST  TO      FG   FG%      3P   3P%
--------------------------------------------------------------------------------
D'Angelo Randle        14    5    2    1   0   2/4    50.0     0/0   0.0
Tim Jordan             10    5    3    0   0   2/3    66.7     0/0   0.0
Jalen Turner           10    3    0    0   0   1/2    50.0     0/0   0.0
DeMar James            14    2    1    0   0   1/1   100.0     0/0   0.0
Gary Ginobili          10    2    0    1   0   1/4    25.0     0/0   0.0
Brandon James          14    0    0    1   0   0/0     0.0     0/0   0.0
Tobias Hyland          14    0    2    1   0   0/2     0.0     0/0   0.0
Rudy Giddey            14    0    0    0   0   0/1     0.0     0/0   0.0
Shai Ingram            10    0    1    0   0   0/1     0.0     0/0   0.0
Blake LaVine           10    0    0    0   0   0/1     0.0     0/0   0.0

TEAM: FG: 7/19 (36.8%), 3PT: 2/9 (22.2%), REB: 9 (1 off, 8 def), AST: 4, TO: 4
TEAM FOULS: 3


Team_097
--------------------------------------------------------------------------------
Player                MIN  PTS  REB  AST  TO      FG   FG%      3P   3P%
--------------------------------------------------------------------------------
Gary Carter            10    7    0    3   0   3/3   100.0     0/0   0.0
Evan Brogdon           14    4    0    0   0   2/2   100.0     0/0   0.0
Joel Simons            10    4    3    0   0   2/3    66.7     0/0   0.0
Dwyane Ginobili        10    2    0    0   0   1/2    50.0     0/0   0.0
Miles Banchero         10    2    1    0   0   1/1   100.0     0/0   0.0
Anthony Haliburton     14    0    3    0   0   0/2     0.0     0/0   0.0
Shai Poole             14    0    1    1   0   0/2     0.0     0/0   0.0
Tyrese Stewart         14    0    1    0   0   0/0     0.0     0/0   0.0
Jrue Haliburton        14    0    0    0   0   0/1     0.0     0/0   0.0
Miles Dosunmu          10    0    5    2   0   0/1     0.0     0/0   0.0

TEAM: FG: 9/17 (52.9%), 3PT: 1/4 (25.0%), REB: 14 (2 off, 12 def), AST: 6, TO: 5
TEAM FOULS: 5 [Team_019 in BONUS]

================================================================================

================================================================================
                       3RD QUARTER - Team_019 vs Team_097                       
================================================================================

[12:00] Team_019 possession (Score: 35-49)
Brandon James attempts a Layup. Contested by Jrue Haliburton (5.2 feet, MAN). Brandon James misses. Rebound secured by Anthony Haliburton.

[11:45] Team_097 possession (Score: 35-49)
Shai Poole throws a bad pass! Stolen by D'Angelo Randle! TURNOVER! (live ball)

[11:32] Team_019 possession (Score: 35-49)
Brandon James drives to the basket... Brandon James throws a bad pass! Stolen by Jrue Haliburton! TURNOVER! (live ball)

[11:20] Team_097 possession (Score: 35-49)
Anthony Haliburton attempts a Midrange. BLOCKED BY D'ANGELO RANDLE! Ball is loose! Offensive rebound by Anthony Haliburton! Anthony Haliburton kicks it out.

[11:09] Team_097 possession (Score: 35-49)
Tyrese Stewart attempts a 3Pt. Contested by D'Angelo Randle (4.5 feet, ZONE). Tyrese Stewart misses. FOUL! Loose ball foul on D'Angelo Randle during the rebound battle. [Team fouls: 2] No free throws, side out. (D'Angelo Randle: 1 personal fouls)

[10:53] Team_097 possession (Score: 35-49)
Anthony Haliburton attempts a Midrange. Wide open! Tobias Hyland is 6.1 feet away. [MAN] ANTHONY HALIBURTON MAKES IT! Assist: Jrue Haliburton
Score: 35-51

[10:40] Team_019 possession (Score: 35-51)
D'Angelo Randle attempts a Midrange. Contested by Jrue Haliburton (5.4 feet, ZONE). D'ANGELO RANDLE MAKES IT!
Score: 37-51

[10:29] Team_097 possession (Score: 37-51)
Evan Brogdon attempts a 3Pt. Wide open! Rudy Giddey is 6.0 feet away. [MAN] Evan Brogdon misses. Rebound secured by Tobias Hyland.

[10:15] Team_019 possession (Score: 37-51)
Tobias Hyland attempts a Midrange. Contested by Anthony Haliburton (3.3 feet, MAN). Tobias Hyland misses. Rebound secured by Shai Poole.

[09:59] Team_097 possession (Score: 37-51)
Tyrese Stewart attempts a 3Pt. Wide open! Rudy Giddey is 6.2 feet away. [ZONE] Tyrese Stewart misses. Rebound secured by D'Angelo Randle.

[09:41] Team_019 possession (Score: 37-51)
Rudy Giddey attempts a 3Pt. Contested by Shai Poole (3.6 feet, ZONE). Rudy Giddey misses. Rebound secured by Anthony Haliburton.

[09:27] Team_097 possession (Score: 37-51)
Evan Brogdon attempts a Layup. Wide open! Rudy Giddey is 6.0 feet away. [MAN] Evan Brogdon misses. Rebound secured by DeMar James.

[09:13] Team_019 possession (Score: 37-51)
DeMar James attempts a 3Pt. Contested by Shai Poole (3.8 feet, ZONE). DeMar James misses. Rebound secured by Tyrese Stewart.

[08:58] Team_097 possession (Score: 37-51)
Anthony Haliburton attempts a Midrange. Contested by D'Angelo Randle (4.0 feet, ZONE). Anthony Haliburton misses. Rebound secured by Tobias Hyland.

[08:39] Team_019 possession (Score: 37-51)
D'Angelo Randle makes the Layup and draws the foul on Jrue Haliburton! And-1! D'Angelo Randle to the line for 1. [Team fouls: 1] (Jrue Haliburton: 1 personal fouls)   FT 1/1: MISS D'Angelo Randle makes 0/1 from the line. Rebound secured by Anthony Haliburton.
Score: 39-51

[08:26] Team_097 possession (Score: 39-51)
Anthony Haliburton attempts a 3Pt. Contested by D'Angelo Randle (4.0 feet, ZONE). Anthony Haliburton misses. Rebound secured by D'Angelo Randle.

[08:13] Team_019 possession (Score: 39-51)
Rudy Giddey makes the Dunk and draws the foul on Shai Poole! And-1! Rudy Giddey to the line for 1. [Team fouls: 2] (Shai Poole: 1 personal fouls)   FT 1/1: GOOD Rudy Giddey makes 1/1 from the line.
Score: 42-51

[08:02] Team_097 possession (Score: 42-51)
Evan Brogdon drives, picks up Rudy Giddey. Help arrives from D'Angelo Randle! Evan Brogdon attempts a Dunk. Wide open! D'Angelo Randle is 6.0 feet away. [MAN] EVAN BROGDON MAKES IT!
Score: 42-53

[07:45] Team_019 possession (Score: 42-53)
FOUL! Offensive foul on D'Angelo Randle! Shai Poole drew the charge! [Team fouls: 3] (D'Angelo Randle: 2 personal fouls) TURNOVER! (dead ball)

[07:30] Team_097 possession (Score: 42-53)
Evan Brogdon attempts a Midrange. Wide open! Rudy Giddey is 6.0 feet away. [MAN] Evan Brogdon misses. Rebound secured by D'Angelo Randle.

[07:14] Team_019 possession (Score: 42-53)
D'Angelo Randle drives to the basket... D'Angelo Randle loses the ball! Stripped by Shai Poole! TURNOVER! (live ball)

[06:59] Team_097 possession (Score: 42-53)
Tyrese Stewart attempts a Midrange. Contested by Brandon James (6.0 feet, ZONE). Tyrese Stewart misses. Rebound secured by Tobias Hyland.

[06:46] Team_019 possession (Score: 42-53)
FOUL! Shooting foul on Tyrese Stewart. D'Angelo Randle to the line for 2 free throws. [Team fouls: 3] (Tyrese Stewart: 1 personal fouls)   FT 1/2: GOOD   FT 2/2: GOOD D'Angelo Randle makes 2/2 from the line.
Score: 44-53

[06:34] Team_097 possession (Score: 44-53)
Shai Poole drives, D'Angelo Randle stays with him. Shai Poole attempts a Dunk. Contested by D'Angelo Randle (4.2 feet, MAN). Shai Poole misses. Offensive rebound by Anthony Haliburton! Anthony Haliburton puts it back in!
Score: 44-55

[06:21] Team_019 possession (Score: 44-55)
FOUL! Shooting foul on Anthony Haliburton. DeMar James to the line for 2 free throws. [Team fouls: 4] (Anthony Haliburton: 1 personal fouls)   FT 1/2: GOOD   FT 2/2: MISS DeMar James makes 1/2 from the line. Offensive rebound by DeMar James! DeMar James's putback is no good.
Score: 45-55

[06:06] Team_097 possession (Score: 45-55)
Evan Brogdon attempts a 3Pt. Wide open! Rudy Giddey is 6.0 feet away. [MAN] EVAN BROGDON MAKES IT!
Score: 45-58

[05:50] Team_019 possession (Score: 45-58)
Rudy Giddey drives, picks up Evan Brogdon. Help arrives from Shai Poole! Rudy Giddey attempts a Dunk. Contested by Shai Poole (4.9 feet, MAN). RUDY GIDDEY MAKES IT! Assist: Tobias Hyland
Score: 47-58

[05:36] Team_097 possession (Score: 47-58)
Jrue Haliburton attempts a 3Pt. Contested by Brandon James (5.5 feet, MAN). Jrue Haliburton misses. Rebound secured by Tobias Hyland.

[05:24] Team_019 possession (Score: 47-58)
DeMar James attempts a Layup. BLOCKED BY ANTHONY HALIBURTON! Ball is loose! Rebound secured by Tyrese Stewart.

[05:09] Team_097 possession (Score: 47-58)
Jrue Haliburton attempts a Midrange. Contested by Brandon James (5.6 feet, MAN). Jrue Haliburton misses. FOUL! Loose ball foul on DeMar James during the rebound battle. [Team fouls: 4] No free throws, side out. (DeMar James: 1 personal fouls)

[04:54] Team_097 possession (Score: 47-58)
FOUL! Shooting foul on DeMar James. Anthony Haliburton to the line for 2 free throws. [BONUS: 5 team fouls] (DeMar James: 2 personal fouls)   FT 1/2: MISS   FT 2/2: GOOD Anthony Haliburton makes 1/2 from the line.
Score: 47-59

[04:40] Team_019 possession (Score: 47-59)
Tobias Hyland throws a bad pass! Stolen by Anthony Haliburton! TURNOVER! (live ball)

[04:26] Team_097 possession (Score: 47-59)
Anthony Haliburton attempts a Midrange. Wide open! Tobias Hyland is 6.2 feet away. [MAN] ANTHONY HALIBURTON MAKES IT!
Score: 47-61

[04:09] Team_019 possession (Score: 47-61)
DeMar James drives, picks up Anthony Haliburton. Help arrives from Jrue Haliburton! DeMar James attempts a Dunk. Contested by Jrue Haliburton (3.8 feet, ZONE). DeMar James misses. Rebound secured by Anthony Haliburton.

[03:53] Team_097 possession (Score: 47-61)
Jrue Haliburton attempts a Midrange. Contested by Brandon James (5.6 feet, MAN). Jrue Haliburton misses. Offensive rebound by Tyrese Stewart! Tyrese Stewart kicks it out.

[03:43] Team_097 possession (Score: 47-61)
Jrue Haliburton attempts a 3Pt. Contested by Brandon James (5.7 feet, MAN). JRUE HALIBURTON MAKES IT! Assist: Tyrese Stewart
Score: 47-64

[03:29] Team_019 possession (Score: 47-64)
FOUL! Reach-in foul on Anthony Haliburton during the drive. [IN THE BONUS! 5 team fouls] D'Angelo Randle to the line for 2 free throws. (Anthony Haliburton: 2 personal fouls)   FT 1/2: GOOD   FT 2/2: GOOD D'Angelo Randle makes 2/2 from the line.
Score: 49-64

[03:18] Team_097 possession (Score: 49-64)
FOUL! Holding foul on Rudy Giddey. [IN THE BONUS! 6 team fouls] Evan Brogdon to the line for 2 free throws. (Rudy Giddey: 1 personal fouls)   FT 1/2: GOOD   FT 2/2: GOOD Evan Brogdon makes 2/2 from the line.
Score: 49-66

[02:59] Team_019 possession (Score: 49-66)
DeMar James drives to the basket... DeMar James throws a bad pass! Stolen by Anthony Haliburton! TURNOVER! (live ball)

[02:45] Team_097 possession (Score: 49-66)
Tyrese Stewart attempts a Layup. Contested by DeMar James (5.3 feet, MAN). TYRESE STEWART MAKES IT! Assist: Jrue Haliburton
Score: 49-68

[02:31] Team_019 possession (Score: 49-68)
Rudy Giddey attempts a 3Pt. Contested by Shai Poole (3.9 feet, ZONE). Rudy Giddey misses. Rebound secured by Shai Poole.

[02:18] Team_097 possession (Score: 49-68)
FOUL! Holding foul on Brandon James. [IN THE BONUS! 7 team fouls] Jrue Haliburton to the line for 2 free throws. (Brandon James: 1 personal fouls)   FT 1/2: MISS   FT 2/2: GOOD Jrue Haliburton makes 1/2 from the line.
Score: 49-69

[02:03] Team_019 possession (Score: 49-69)
Brandon James attempts a 3Pt. Contested by Shai Poole (3.7 feet, ZONE). Brandon James misses. Rebound secured by Anthony Haliburton.

[01:47] Team_097 possession (Score: 49-69)
Evan Brogdon attempts a Layup. BLOCKED BY DEMAR JAMES! Ball is loose! Rebound secured by Tobias Hyland.

[01:38] Team_019 possession (Score: 49-69)
D'Angelo Randle attempts a 3Pt. Contested by Shai Poole (4.0 feet, MAN). D'Angelo Randle misses. Rebound secured by Tyrese Stewart.

[01:21] Team_097 possession (Score: 49-69)
FOUL! Shooting foul on DeMar James. Tyrese Stewart to the line for 2 free throws. [BONUS: 8 team fouls] (DeMar James: 3 personal fouls)   FT 1/2: GOOD   FT 2/2: GOOD Tyrese Stewart makes 2/2 from the line.
Score: 49-71

[01:05] Team_019 possession (Score: 49-71)
D'Angelo Randle attempts a 3Pt. Contested by Shai Poole (4.0 feet, MAN). D'Angelo Randle misses. Rebound secured by Shai Poole.

[00:54] Team_097 possession (Score: 49-71)
Shai Poole drives and kicks out. Anthony Haliburton attempts a 3Pt. Wide open! Tobias Hyland is 6.1 feet away. [MAN] ANTHONY HALIBURTON MAKES IT! Assist: Shai Poole
Score: 49-74

[00:45] Team_019 possession (Score: 49-74)
D'Angelo Randle attempts a 3Pt. Contested by Shai Poole (4.1 feet, ZONE). D'Angelo Randle misses. Rebound secured by Tyrese Stewart.

[00:28] Team_097 possession (Score: 49-74)
Evan Brogdon attempts a 3Pt. Contested by D'Angelo Randle (4.8 feet, ZONE). Evan Brogdon misses. Rebound secured by D'Angelo Randle.

[00:14] Team_019 possession (Score: 49-74)
D'Angelo Randle attempts a Layup. Contested by Anthony Haliburton (4.1 feet, ZONE). D'ANGELO RANDLE MAKES IT!
Score: 51-74

================================================================================
                              3RD QUARTER COMPLETE                              
================================================================================

3RD QUARTER SCORE: Team_019 16, Team_097 25

BOX SCORE:
================================================================================

Team_019
--------------------------------------------------------------------------------
Player                MIN  PTS  REB  AST  TO      FG   FG%      3P   3P%
--------------------------------------------------------------------------------
D'Angelo Randle        26    8    4    0   0   4/8    50.0     0/0   0.0
Rudy Giddey            26    5    0    0   0   2/4    50.0     0/0   0.0
Brandon James          26    0    0    0   0   0/2     0.0     0/0   0.0
Tobias Hyland          26    0    5    1   0   0/1     0.0     0/0   0.0
DeMar James            26    0    2    0   0   0/4     0.0     0/0   0.0

TEAM: FG: 6/19 (31.6%), 3PT: 0/7 (0.0%), REB: 10 (0 off, 10 def), AST: 1, TO: 5
TEAM FOULS: 8 [Team_097 in BONUS]


Team_097
--------------------------------------------------------------------------------
Player                MIN  PTS  REB  AST  TO      FG   FG%      3P   3P%
--------------------------------------------------------------------------------
Anthony Haliburton     26   10    9    0   0   5/7    71.4     0/0   0.0
Evan Brogdon           26    7    0    0   0   3/8    37.5     0/0   0.0
Jrue Haliburton        26    4    0    2   0   2/3    66.7     0/0   0.0
Tyrese Stewart         26    4    5    1   0   2/4    50.0     0/0   0.0
Shai Poole             26    0    3    1   0   0/0     0.0     0/0   0.0

TEAM: FG: 12/22 (54.5%), 3PT: 2/7 (28.6%), REB: 18 (5 off, 13 def), AST: 4, TO: 1
TEAM FOULS: 5 [Team_019 in BONUS]

================================================================================

================================================================================
                       4TH QUARTER - Team_019 vs Team_097                       
================================================================================

[12:00] Substitution (Team_019): Rudy Giddey OUT (stamina: 69) → Gary Ginobili IN (comeback_detected)

[12:00] Substitution (Team_097): Evan Brogdon OUT (stamina: 68) → Gary Carter IN (comeback_detected)

[12:00] Team_019 possession (Score: 51-74)
Tobias Hyland attempts a Layup. Contested by Anthony Haliburton (3.7 feet, ZONE). TOBIAS HYLAND MAKES IT!
Score: 53-74

[11:49] Team_097 possession (Score: 53-74)
FOUL! Holding foul on Gary Ginobili. [Team fouls: 1] No free throws, side out. (Gary Ginobili: 1 personal fouls)

[11:36] Team_097 possession (Score: 53-74)
FOUL! Holding foul on DeMar James. [Team fouls: 2] No free throws, side out. (DeMar James: 1 personal fouls)

[11:22] Team_097 possession (Score: 53-74)
Gary Carter attempts a 3Pt. Contested by Gary Ginobili (5.6 feet, MAN). GARY CARTER MAKES IT! Assist: Jrue Haliburton
Score: 53-77

[11:06] Team_019 possession (Score: 53-77)
Brandon James attempts a 3Pt. Contested by Anthony Haliburton (3.8 feet, ZONE). Brandon James misses. Rebound secured by Anthony Haliburton.

[10:55] Team_097 possession (Score: 53-77)
Anthony Haliburton drives to the basket... Anthony Haliburton throws a bad pass! Stolen by Tobias Hyland! TURNOVER! (live ball)

[10:39] Team_019 possession (Score: 53-77)
Gary Ginobili attempts a Midrange. Contested by Gary Carter (5.2 feet, MAN). GARY GINOBILI MAKES IT!
Score: 55-77

[10:26] Team_097 possession (Score: 55-77)
Gary Carter attempts a Midrange. Contested by Gary Ginobili (5.6 feet, MAN). Gary Carter misses. Rebound secured by Tobias Hyland.

[10:11] Team_019 possession (Score: 55-77)
Tobias Hyland loses the ball! Stripped by Anthony Haliburton! TURNOVER! (live ball)

[09:54] Team_097 possession (Score: 55-77)
Jrue Haliburton attempts a 3Pt. Wide open! Brandon James is 6.0 feet away. [MAN] JRUE HALIBURTON MAKES IT!
Score: 55-80

[09:37] Team_019 possession (Score: 55-80)
FOUL! Shooting foul on Anthony Haliburton. Tobias Hyland to the line for 2 free throws. [Team fouls: 1] (Anthony Haliburton: 1 personal fouls)   FT 1/2: MISS   FT 2/2: MISS Tobias Hyland makes 0/2 from the line. Rebound secured by Tyrese Stewart.

[09:21] Team_097 possession (Score: 55-80)
Shai Poole attempts a Midrange. Contested by D'Angelo Randle (4.8 feet, ZONE). SHAI POOLE MAKES IT! Assist: Jrue Haliburton
Score: 55-82

[09:03] Team_019 possession (Score: 55-82)
D'Angelo Randle attempts a Midrange. Contested by Shai Poole (4.3 feet, MAN). D'ANGELO RANDLE MAKES IT! Assist: DeMar James
Score: 57-82

[08:48] Team_097 possession (Score: 57-82)
Tyrese Stewart drives and kicks out. Jrue Haliburton attempts a 3Pt. Contested by Brandon James (5.8 feet, MAN). Jrue Haliburton misses. Offensive rebound by Tyrese Stewart! Tyrese Stewart kicks it out.

[08:32] Team_097 possession (Score: 57-82)
Tyrese Stewart attempts a Midrange. Contested by DeMar James (5.8 feet, MAN). Tyrese Stewart misses. Offensive rebound by Anthony Haliburton! Anthony Haliburton kicks it out.

[08:13] Team_097 possession (Score: 57-82)
Anthony Haliburton attempts a 3Pt. Contested by D'Angelo Randle (4.9 feet, ZONE). Anthony Haliburton misses. Rebound secured by D'Angelo Randle.

[08:00] Team_019 possession (Score: 57-82)
D'Angelo Randle makes the Dunk and draws the foul on Gary Carter! And-1! D'Angelo Randle to the line for 1. [Team fouls: 2] (Gary Carter: 1 personal fouls)   FT 1/1: GOOD D'Angelo Randle makes 1/1 from the line.
Score: 60-82

[07:44] Team_097 possession (Score: 60-82)
Anthony Haliburton attempts a 3Pt. Contested by D'Angelo Randle (4.9 feet, ZONE). Anthony Haliburton misses. Rebound secured by D'Angelo Randle.

[07:30] Team_019 possession (Score: 60-82)
Gary Ginobili loses control! Ball rolls out of bounds! TURNOVER! (dead ball)

[07:30] Substitution (Team_019): Brandon James OUT → Jalen Turner IN (stamina_rule2)

[07:30] Substitution (Team_019): D'Angelo Randle OUT → Blake LaVine IN (stamina_rule2)

[07:30] Substitution (Team_019): Tobias Hyland OUT → Shai Ingram IN (stamina_rule2)

[07:30] Substitution (Team_019): DeMar James OUT → Tim Jordan IN (stamina_rule2)

[07:30] Substitution (Team_097): Jrue Haliburton OUT → Dwyane Ginobili IN (stamina_rule2)

[07:30] Substitution (Team_097): Shai Poole OUT → Miles Dosunmu IN (stamina_rule2)

[07:30] Substitution (Team_097): Anthony Haliburton OUT → Joel Simons IN (stamina_rule2)

[07:30] Substitution (Team_097): Tyrese Stewart OUT → Miles Banchero IN (stamina_rule2)

[07:15] Team_097 possession (Score: 60-82)
Joel Simons drives to the basket... FOUL! Offensive foul on Joel Simons! Shai Ingram drew the charge! [Team fouls: 3] (Joel Simons: 1 personal fouls) TURNOVER! (dead ball)

[07:00] Team_019 possession (Score: 60-82)
Blake LaVine attempts a Midrange. Contested by Miles Dosunmu (4.0 feet, MAN). Blake LaVine misses. Rebound secured by Miles Banchero.

[06:49] Team_097 possession (Score: 60-82)
Joel Simons attempts a Layup. Contested by Shai Ingram (4.7 feet, MAN). JOEL SIMONS MAKES IT! Assist: Miles Dosunmu
Score: 60-84

[06:35] Team_019 possession (Score: 60-84)
Jalen Turner attempts a 3Pt. Contested by Dwyane Ginobili (4.8 feet, MAN). JALEN TURNER MAKES IT! Assist: Tim Jordan
Score: 63-84

[06:21] Team_097 possession (Score: 63-84)
Dwyane Ginobili drives and kicks out. Miles Dosunmu attempts a 3Pt. Contested by Blake LaVine (4.7 feet, MAN). MILES DOSUNMU MAKES IT! Assist: Dwyane Ginobili
Score: 63-87

[06:07] Team_019 possession (Score: 63-87)
Shai Ingram attempts a 3Pt. Contested by Joel Simons (3.5 feet, MAN). Shai Ingram misses. Rebound secured by Joel Simons.

[05:48] Team_097 possession (Score: 63-87)
FOUL! Reach-in foul on Shai Ingram during the drive. [Team fouls: 3] No free throws, side out. (Shai Ingram: 1 personal fouls)

[05:35] Team_097 possession (Score: 63-87)
Miles Dosunmu attempts a 3Pt. Contested by Blake LaVine (5.2 feet, MAN). Miles Dosunmu misses. Offensive rebound by Joel Simons! Joel Simons kicks it out.

[05:16] Team_097 possession (Score: 63-87)
Joel Simons drives to the basket... FOUL! Offensive foul on Joel Simons! Shai Ingram drew the charge! [Team fouls: 4] (Joel Simons: 2 personal fouls) TURNOVER! (dead ball)

[05:02] Team_019 possession (Score: 63-87)
Gary Ginobili attempts a Midrange. Contested by Gary Carter (5.2 feet, MAN). GARY GINOBILI MAKES IT! Assist: Tim Jordan
Score: 65-87

[04:52] Team_097 possession (Score: 65-87)
Dwyane Ginobili attempts a 3Pt. Contested by Blake LaVine (4.6 feet, ZONE). Dwyane Ginobili misses. Offensive rebound by Miles Dosunmu! Miles Dosunmu kicks it out.

[04:37] Team_097 possession (Score: 65-87)
Joel Simons attempts a Midrange. Contested by Shai Ingram (4.7 feet, MAN). Joel Simons misses. Rebound secured by Shai Ingram.

[04:26] Team_019 possession (Score: 65-87)
Blake LaVine attempts a 3Pt. Contested by Joel Simons (3.7 feet, ZONE). BLAKE LAVINE MAKES IT! Assist: Shai Ingram
Score: 68-87

[04:12] Team_097 possession (Score: 68-87)
FOUL! Shooting foul on Gary Ginobili. Gary Carter to the line for 3 free throws. [Team fouls: 4] (Gary Ginobili: 2 personal fouls)   FT 1/3: GOOD   FT 2/3: GOOD   FT 3/3: GOOD Gary Carter makes 3/3 from the line.
Score: 68-90

[04:01] Team_019 possession (Score: 68-90)
Shai Ingram attempts a Layup. Contested by Joel Simons (3.5 feet, MAN). Shai Ingram misses. Rebound secured by Joel Simons.

[03:46] Team_097 possession (Score: 68-90)
Joel Simons attempts a 3Pt. Contested by Shai Ingram (4.7 feet, MAN). JOEL SIMONS MAKES IT! Assist: Dwyane Ginobili
Score: 68-93

[03:29] Team_019 possession (Score: 68-93)
Shai Ingram attempts a 3Pt. Contested by Joel Simons (3.5 feet, ZONE). Shai Ingram misses. Offensive rebound by Shai Ingram! Shai Ingram kicks it out.

[03:12] Team_019 possession (Score: 68-93)
FOUL! Shooting foul on Joel Simons. Blake LaVine to the line for 2 free throws. [BONUS: 5 team fouls] (Joel Simons: 3 personal fouls)   FT 1/2: GOOD   FT 2/2: GOOD Blake LaVine makes 2/2 from the line.
Score: 70-93

[02:58] Team_097 possession (Score: 70-93)
Dwyane Ginobili drives and kicks out. Miles Dosunmu attempts a 3Pt. Contested by Blake LaVine (4.7 feet, ZONE). Miles Dosunmu misses. Offensive rebound by Joel Simons! Joel Simons kicks it out.

[02:43] Team_097 possession (Score: 70-93)
Miles Banchero drives, picks up Shai Ingram. Help arrives from Jalen Turner! Miles Banchero attempts a Dunk. Contested by Jalen Turner (4.7 feet, MAN). MILES BANCHERO MAKES IT! Assist: Joel Simons
Score: 70-95

[02:28] Team_019 possession (Score: 70-95)
Tim Jordan makes the Layup and draws the foul on Dwyane Ginobili! And-1! Tim Jordan to the line for 1. [BONUS: 6 team fouls] (Dwyane Ginobili: 1 personal fouls)   FT 1/1: GOOD Tim Jordan makes 1/1 from the line.
Score: 73-95

[02:10] Team_097 possession (Score: 73-95)
Dwyane Ginobili attempts a Midrange. Contested by Shai Ingram (4.4 feet, ZONE). Dwyane Ginobili misses. Rebound secured by Tim Jordan.

[01:58] Team_019 possession (Score: 73-95)
Gary Ginobili drives to the basket... Gary Ginobili throws a bad pass! Stolen by Joel Simons! TURNOVER! (live ball)

[01:42] Team_097 possession (Score: 73-95)
Miles Dosunmu drives to the basket... Miles Dosunmu commits a violation (traveling/carry)! TURNOVER! (dead ball)

[01:32] Team_019 possession (Score: 73-95)
Blake LaVine attempts a Midrange. Contested by Miles Dosunmu (4.0 feet, MAN). Blake LaVine misses. FOUL! Loose ball foul on Joel Simons during the rebound battle. [IN THE BONUS! 7 team fouls] Shai Ingram to the line for 2 free throws. (Joel Simons: 4 personal fouls)   FT 1/2: GOOD   FT 2/2: GOOD Shai Ingram makes 2/2 from the line.
Score: 75-95

[01:17] Team_097 possession (Score: 75-95)
Miles Dosunmu attempts a 3Pt. Contested by Blake LaVine (5.2 feet, MAN). MILES DOSUNMU MAKES IT! Assist: Dwyane Ginobili
Score: 75-98

[01:01] Team_019 possession (Score: 75-98)
Shai Ingram attempts a 3Pt. Contested by Joel Simons (3.5 feet, MAN). SHAI INGRAM MAKES IT! Assist: Blake LaVine
Score: 78-98

[00:45] Team_097 possession (Score: 78-98)
Dwyane Ginobili attempts a 3Pt. Contested by Shai Ingram (4.4 feet, ZONE). Dwyane Ginobili misses. Offensive rebound by Miles Dosunmu! Miles Dosunmu kicks it out.

[00:30] Team_097 possession (Score: 78-98)
Miles Banchero attempts a Midrange. Contested by Shai Ingram (4.7 feet, MAN). MILES BANCHERO MAKES IT! Assist: Gary Carter
Score: 78-100

[00:18] Team_019 possession (Score: 78-100)
Gary Ginobili drives to the basket... FOUL! Offensive foul on Gary Ginobili! Joel Simons drew the charge! [Team fouls: 5] (Gary Ginobili: 3 personal fouls) TURNOVER! (dead ball)

[00:01] Team_097 possession (Score: 78-100)
Gary Carter attempts a 3Pt. Wide open! Gary Ginobili is 6.1 feet away. [MAN] Gary Carter misses. Offensive rebound by Joel Simons! Joel Simons kicks it out.

================================================================================
                              4TH QUARTER COMPLETE                              
================================================================================

4TH QUARTER SCORE: Team_019 27, Team_097 26

BOX SCORE:
================================================================================

Team_019
--------------------------------------------------------------------------------
Player                MIN  PTS  REB  AST  TO      FG   FG%      3P   3P%
--------------------------------------------------------------------------------
D'Angelo Randle        31    5    2    0   0   2/2   100.0     0/0   0.0
Blake LaVine           18    5    0    1   0   2/3    66.7     0/0   0.0
Shai Ingram            18    5    2    1   0   2/4    50.0     0/0   0.0
Gary Ginobili          23    4    0    0   0   2/2   100.0     0/0   0.0
Jalen Turner           18    3    0    0   0   1/1   100.0     0/0   0.0
Tim Jordan             18    3    1    2   0   1/1   100.0     0/0   0.0
Tobias Hyland          31    2    1    0   0   1/2    50.0     0/0   0.0
Brandon James          31    0    0    0   0   0/1     0.0     0/0   0.0
DeMar James            31    0    0    1   0   0/0     0.0     0/0   0.0

TEAM: FG: 11/16 (68.8%), 3PT: 3/5 (60.0%), REB: 6 (1 off, 5 def), AST: 5, TO: 4
TEAM FOULS: 5 [Team_097 in BONUS]


Team_097
--------------------------------------------------------------------------------
Player                MIN  PTS  REB  AST  TO      FG   FG%      3P   3P%
--------------------------------------------------------------------------------
Gary Carter            23    6    0    1   0   2/3    66.7     0/0   0.0
Miles Dosunmu          18    6    2    1   0   2/2   100.0     0/0   0.0
Joel Simons            18    5    5    1   0   2/3    66.7     0/0   0.0
Miles Banchero         18    4    1    0   0   2/2   100.0     0/0   0.0
Jrue Haliburton        31    3    0    2   0   1/1   100.0     0/0   0.0
Shai Poole             31    2    0    0   0   1/1   100.0     0/0   0.0
Anthony Haliburton     31    0    2    0   0   0/2     0.0     0/0   0.0
Tyrese Stewart         31    0    2    0   0   0/0     0.0     0/0   0.0
Dwyane Ginobili        18    0    0    3   0   0/1     0.0     0/0   0.0

TEAM: FG: 10/15 (66.7%), 3PT: 5/7 (71.4%), REB: 12 (7 off, 5 def), AST: 8, TO: 4
TEAM FOULS: 7 [Team_019 in BONUS]

================================================================================

================================================================================
                               FULL GAME COMPLETE                               
================================================================================

FINAL SCORE: Team_019 78, Team_097 100

SCORING BY QUARTER:
--------------------------------------------------------------------------------
Team                     Q1     Q2     Q3     Q4    FINAL
--------------------------------------------------------------------------------
Team_019                 17     18     16     27       78
Team_097                 30     19     25     26      100
--------------------------------------------------------------------------------

FULL GAME BOX SCORE:
================================================================================

Team_019
--------------------------------------------------------------------------------
Player                MIN  PTS  REB  AST  TO      FG   FG%      3P   3P%      FT STL BLK
--------------------------------------------------------------------------------
Brandon James          31    2    0    1   0   1/4    25.0   0/2     0.0   0/0     0   0
D'Angelo Randle        31   23   10    2   1  11/22   50.0   1/10   10.0   6/8     1   1
Tobias Hyland          31    4    8    2   4   3/10   30.0   1/2    50.0   1/4     1   0
DeMar James            31    4    7    3   1   1/5    20.0   0/1     0.0   1/2     1   2
Rudy Giddey            26    8    0    0   1   3/8    37.5   1/6    16.7   1/1     0   0
Gary Ginobili          23    6    0    1   2   3/6    50.0   0/3     0.0   0/0     0   0
Jalen Turner           18    6    0    0   0   2/3    66.7   2/2   100.0   3/3     0   0
Blake LaVine           18    5    0    1   1   3/6    50.0   1/3    33.3   2/2     0   0
Shai Ingram            18    7    3    1   1   2/6    33.3   1/3    33.3   2/2     3   0
Tim Jordan             18    9    6    2   3   4/5    80.0   0/0     0.0   3/4     0   0

TEAM: FG: 33/75 (44.0%), 3PT: 7/32 (21.9%), REB: 34 (6 off, 28 def), AST: 13, TO: 14


Team_097
--------------------------------------------------------------------------------
Player                MIN  PTS  REB  AST  TO      FG   FG%      3P   3P%      FT STL BLK
--------------------------------------------------------------------------------
Jrue Haliburton        31   15    0    6   1   5/8    62.5   3/5    60.0   1/2     1   0
Shai Poole             31   10    5    2   3   6/9    66.7   1/3    33.3   1/1     1   0
Anthony Haliburton     31   12   19    2   2   4/11   36.4   0/4     0.0   1/2     3   1
Tyrese Stewart         31    9   16    2   0   4/6    66.7   1/2    50.0   2/2     0   0
Evan Brogdon           26   16    0    1   0   6/12   50.0   1/3    33.3   3/3     0   0
Gary Carter            23   13    0    5   1   5/6    83.3   3/3   100.0   3/3     0   0
Dwyane Ginobili        18    2    0    3   1   2/4    50.0   0/0     0.0   0/0     0   0
Miles Dosunmu          18    6    8    3   2   1/2    50.0   1/2    50.0   0/0     0   0
Joel Simons            18   11    9    1   2   5/8    62.5   1/1   100.0   0/0     4   0
Miles Banchero         18    6    2    0   2   3/3   100.0   0/0     0.0   0/0     0   0

TEAM: FG: 43/71 (60.6%), 3PT: 11/23 (47.8%), REB: 59 (18 off, 41 def), AST: 25, TO: 14

================================================================================
