================================================================================
                        FULL GAME - Team_091 vs Team_083                        
================================================================================

================================================================================
                       1ST QUARTER - Team_091 vs Team_083                       
================================================================================

[12:00] Team_091 possession (Score: 0-0)
D'Angelo Ingram drives, picks up Kyrie Griffin. Help arrives from Karl Jokic! D'Angelo Ingram attempts a Dunk. Contested by Karl Jokic (4.3 feet, MAN). D'ANGELO INGRAM MAKES IT! Assist: Rudy Bridges
Score: 2-0

[11:43] Team_083 possession (Score: 2-0)
Karl Jokic attempts a 3Pt. Wide open! Isaiah Siakam is 6.1 feet away. [MAN] KARL JOKIC MAKES IT! Assist: Bradley Thompson
Score: 2-3

[11:29] Team_091 possession (Score: 2-3)
Isaiah Siakam attempts a 3Pt. Contested by Malcolm Brogdon (5.2 feet, ZONE). Isaiah Siakam misses. Rebound secured by Kyrie Griffin.

[11:18] Team_083 possession (Score: 2-3)
Malcolm Brogdon attempts a Midrange. Contested by D'Angelo Ingram (4.3 feet, ZONE). MALCOLM BROGDON MAKES IT! Assist: Yao Oladipo
Score: 2-5

[11:08] Team_091 possession (Score: 2-5)
Isaiah Siakam drives and kicks out. Rudy Bridges attempts a 3Pt. Contested by Karl Jokic (4.6 feet, ZONE). Rudy Bridges misses. Offensive rebound by Kevin Simons! Kevin Simons puts it back in!
Score: 4-5

[10:53] Team_083 possession (Score: 4-5)
Yao Oladipo makes the Layup and draws the foul on Kevin Simons! And-1! Yao Oladipo to the line for 1. [Team fouls: 1] (Kevin Simons: 1 personal fouls)   FT 1/1: GOOD Yao Oladipo makes 1/1 from the line.
Score: 4-8

[10:39] Team_091 possession (Score: 4-8)
FOUL! Shooting foul on Kyrie Griffin. D'Angelo Ingram to the line for 2 free throws. [Team fouls: 1] (Kyrie Griffin: 1 personal fouls)   FT 1/2: MISS   FT 2/2: GOOD D'Angelo Ingram makes 1/2 from the line.
Score: 5-8

[10:21] Team_083 possession (Score: 5-8)
Bradley Thompson drives, Kevin Simons stays with him. Bradley Thompson attempts a Layup. Contested by Kevin Simons (3.7 feet, ZONE). BRADLEY THOMPSON MAKES IT! Assist: Karl Jokic
Score: 5-10

[10:05] Team_091 possession (Score: 5-10)
FOUL! Reach-in foul on Malcolm Brogdon during the drive. [Team fouls: 2] No free throws, side out. (Malcolm Brogdon: 1 personal fouls)

[09:53] Team_091 possession (Score: 5-10)
D'Angelo Ingram attempts a 3Pt. Contested by Yao Oladipo (4.3 feet, ZONE). D'Angelo Ingram misses. Offensive rebound by Rudy Bridges! Rudy Bridges kicks it out.

[09:39] Team_091 possession (Score: 5-10)
Rudy Bridges attempts a 3Pt. Contested by Yao Oladipo (3.4 feet, MAN). Rudy Bridges misses. FOUL! Loose ball foul on Bradley Thompson during the rebound battle. [Team fouls: 3] No free throws, side out. (Bradley Thompson: 1 personal fouls)

[09:23] Team_091 possession (Score: 5-10)
Isaiah Siakam makes the Dunk and draws the foul on Karl Jokic! And-1! Isaiah Siakam to the line for 1. [Team fouls: 4] (Karl Jokic: 1 personal fouls)   FT 1/1: GOOD Isaiah Siakam makes 1/1 from the line.
Score: 8-10

[09:09] Team_083 possession (Score: 8-10)
Karl Jokic attempts a Layup. BLOCKED BY KEVIN SIMONS! Ball is loose! Offensive rebound by Bradley Thompson! Bradley Thompson kicks it out.

[08:55] Team_083 possession (Score: 8-10)
Yao Oladipo attempts a 3Pt. Contested by Kyrie Rozier (4.4 feet, ZONE). YAO OLADIPO MAKES IT! Assist: Karl Jokic
Score: 8-13

[08:41] Team_091 possession (Score: 8-13)
Kevin Simons attempts a Layup. Contested by Bradley Thompson (4.1 feet, ZONE). Kevin Simons misses. Offensive rebound by Rudy Bridges! Rudy Bridges kicks it out.

[08:25] Team_091 possession (Score: 8-13)
Isaiah Siakam makes the 3Pt and draws the foul on Karl Jokic! And-1! Isaiah Siakam to the line for 1. [BONUS: 5 team fouls] (Karl Jokic: 2 personal fouls)   FT 1/1: GOOD Isaiah Siakam makes 1/1 from the line.
Score: 12-13

[08:09] Team_083 possession (Score: 12-13)
Kyrie Griffin drives, picks up Kevin Simons. Help arrives from Kyrie Rozier! Kyrie Griffin attempts a Layup. Contested by Kyrie Rozier (3.9 feet, ZONE). KYRIE GRIFFIN MAKES IT!
Score: 12-15

[07:52] Team_091 possession (Score: 12-15)
FOUL! Shooting foul on Kyrie Griffin. Kevin Simons to the line for 2 free throws. [BONUS: 6 team fouls] (Kyrie Griffin: 2 personal fouls)   FT 1/2: GOOD   FT 2/2: GOOD Kevin Simons makes 2/2 from the line.
Score: 14-15

[07:41] Team_083 possession (Score: 14-15)
FOUL! Holding foul on Rudy Bridges. [Team fouls: 3] No free throws, side out. (Rudy Bridges: 2 personal fouls)

[07:23] Team_083 possession (Score: 14-15)
Karl Jokic drives to the basket... Karl Jokic loses control! Ball rolls out of bounds! TURNOVER! (dead ball)

[07:08] Team_091 possession (Score: 14-15)
Kyrie Rozier drives and kicks out. Rudy Bridges attempts a Midrange. Contested by Yao Oladipo (3.4 feet, MAN). Rudy Bridges misses. Rebound secured by Yao Oladipo.

[06:52] Team_083 possession (Score: 14-15)
Bradley Thompson attempts a Midrange. Contested by Kevin Simons (3.7 feet, MAN). Bradley Thompson misses. Offensive rebound by Kyrie Griffin! Kyrie Griffin kicks it out.

[06:37] Team_083 possession (Score: 14-15)
FOUL! Shooting foul on Kyrie Rozier. Malcolm Brogdon to the line for 3 free throws. [Team fouls: 4] (Kyrie Rozier: 1 personal fouls)   FT 1/3: GOOD   FT 2/3: GOOD   FT 3/3: GOOD Malcolm Brogdon makes 3/3 from the line.
Score: 14-18

[06:23] Team_091 possession (Score: 14-18)
Kevin Simons drives, Kyrie Griffin stays with him. Kevin Simons attempts a Dunk. Contested by Kyrie Griffin (3.8 feet, ZONE). KEVIN SIMONS MAKES IT! Assist: Kyrie Rozier
Score: 16-18

[06:09] Team_083 possession (Score: 16-18)
Malcolm Brogdon drives to the basket... Malcolm Brogdon throws a bad pass out of bounds! TURNOVER! (dead ball)

[05:53] Team_091 possession (Score: 16-18)
FOUL! Holding foul on Kyrie Griffin. [IN THE BONUS! 7 team fouls] D'Angelo Ingram to the line for 2 free throws. (Kyrie Griffin: 3 personal fouls)   FT 1/2: GOOD   FT 2/2: GOOD D'Angelo Ingram makes 2/2 from the line.
Score: 18-18

[05:42] Team_083 possession (Score: 18-18)
Kyrie Griffin drives, D'Angelo Ingram stays with him. Kyrie Griffin attempts a Dunk. Contested by D'Angelo Ingram (5.0 feet, MAN). KYRIE GRIFFIN MAKES IT!
Score: 18-20

[05:24] Team_091 possession (Score: 18-20)
Rudy Bridges makes the Dunk and draws the foul on Yao Oladipo! And-1! Rudy Bridges to the line for 1. [BONUS: 8 team fouls] (Yao Oladipo: 1 personal fouls)   FT 1/1: GOOD Rudy Bridges makes 1/1 from the line.
Score: 21-20

[05:13] Team_083 possession (Score: 21-20)
Malcolm Brogdon drives and kicks out. FOUL! Shooting foul on Kyrie Rozier. Malcolm Brogdon to the line for 2 free throws. [BONUS: 5 team fouls] (Kyrie Rozier: 2 personal fouls)   FT 1/2: GOOD   FT 2/2: GOOD Malcolm Brogdon makes 2/2 from the line.
Score: 21-22

[05:02] Team_091 possession (Score: 21-22)
Kevin Simons attempts a 3Pt. Contested by Yao Oladipo (3.8 feet, ZONE). Kevin Simons misses. Rebound secured by Bradley Thompson.

[04:47] Team_083 possession (Score: 21-22)
FOUL! Holding foul on Kevin Simons. [IN THE BONUS! 6 team fouls] Bradley Thompson to the line for 2 free throws. (Kevin Simons: 2 personal fouls)   FT 1/2: GOOD   FT 2/2: GOOD Bradley Thompson makes 2/2 from the line.
Score: 21-24

[04:35] Team_091 possession (Score: 21-24)
Rudy Bridges attempts a 3Pt. Contested by Yao Oladipo (3.5 feet, MAN). Rudy Bridges misses. Rebound secured by Bradley Thompson.

[04:18] Team_083 possession (Score: 21-24)
Bradley Thompson drives, picks up Kevin Simons. Help arrives from Kyrie Rozier! Bradley Thompson attempts a Layup. Contested by Kyrie Rozier (3.8 feet, MAN). Bradley Thompson misses. Rebound secured by Kyrie Rozier.

[04:05] Team_091 possession (Score: 21-24)
Kevin Simons drives, Bradley Thompson stays with him. Kevin Simons attempts a Layup. Contested by Bradley Thompson (4.2 feet, MAN). KEVIN SIMONS MAKES IT!
Score: 23-24

[03:47] Team_083 possession (Score: 23-24)
FOUL! Reach-in foul on Kevin Simons during the drive. [IN THE BONUS! 7 team fouls] Bradley Thompson to the line for 2 free throws. (Kevin Simons: 3 personal fouls)   FT 1/2: GOOD   FT 2/2: GOOD Bradley Thompson makes 2/2 from the line.
Score: 23-26

[03:29] Team_091 possession (Score: 23-26)
Kevin Simons drives to the basket... FOUL! Offensive foul on Kevin Simons! Kyrie Griffin drew the charge! [Team fouls: 8] (Kevin Simons: 4 personal fouls) TURNOVER! (dead ball)

[03:09] Team_083 possession (Score: 23-26)
Karl Jokic drives and kicks out. Yao Oladipo attempts a 3Pt. Contested by Rudy Bridges (4.5 feet, MAN). YAO OLADIPO MAKES IT! Assist: Bradley Thompson
Score: 23-29

[02:54] Team_091 possession (Score: 23-29)
FOUL! Shooting foul on Kyrie Griffin. Kevin Simons to the line for 2 free throws. [BONUS: 9 team fouls] (Kyrie Griffin: 4 personal fouls)   FT 1/2: GOOD   FT 2/2: GOOD Kevin Simons makes 2/2 from the line.
Score: 25-29

[02:38] Team_083 possession (Score: 25-29)
Bradley Thompson attempts a Midrange. Contested by Kevin Simons (3.9 feet, MAN). Bradley Thompson misses. Rebound secured by Rudy Bridges.

[02:21] Team_091 possession (Score: 25-29)
Isaiah Siakam attempts a 3Pt. Contested by Yao Oladipo (3.9 feet, ZONE). Isaiah Siakam misses. Rebound secured by Kyrie Griffin.

[02:03] Team_083 possession (Score: 25-29)
Yao Oladipo attempts a Midrange. Contested by Rudy Bridges (4.8 feet, ZONE). Yao Oladipo misses. Rebound secured by Kevin Simons.

[01:49] Team_091 possession (Score: 25-29)
D'Angelo Ingram drives to the basket... D'Angelo Ingram loses the ball! Stripped by Bradley Thompson! TURNOVER! (live ball)

[01:35] Team_083 possession (Score: 25-29)
Bradley Thompson attempts a Layup. Contested by Kevin Simons (4.0 feet, ZONE). BRADLEY THOMPSON MAKES IT! Assist: Karl Jokic
Score: 25-31

[01:24] Team_091 possession (Score: 25-31)
Kyrie Rozier attempts a Midrange. Contested by Malcolm Brogdon (5.3 feet, MAN). Kyrie Rozier misses. Rebound secured by Kyrie Griffin.

[01:13] Team_083 possession (Score: 25-31)
FOUL! Shooting foul on Kevin Simons. Bradley Thompson to the line for 2 free throws. [BONUS: 9 team fouls] (Kevin Simons: 5 personal fouls)   FT 1/2: GOOD   FT 2/2: GOOD Bradley Thompson makes 2/2 from the line.
Score: 25-33

[00:57] Team_091 possession (Score: 25-33)
Kyrie Rozier attempts a 3Pt. Contested by Malcolm Brogdon (5.3 feet, MAN). Kyrie Rozier misses. Rebound secured by Bradley Thompson.

[00:41] Team_083 possession (Score: 25-33)
Yao Oladipo drives, picks up Kevin Simons. Help arrives from Kyrie Rozier! Yao Oladipo attempts a Dunk. Contested by Kyrie Rozier (4.3 feet, ZONE). YAO OLADIPO MAKES IT! Assist: Karl Jokic
Score: 25-35

[00:24] Team_091 possession (Score: 25-35)
Kyrie Rozier drives and kicks out. Isaiah Siakam attempts a 3Pt. Contested by Karl Jokic (5.0 feet, MAN). Isaiah Siakam misses. Offensive rebound by Kevin Simons! Kevin Simons puts it back in!
Score: 27-35

[00:10] Team_083 possession (Score: 27-35)
Kyrie Griffin attempts a 3Pt. Contested by Kyrie Rozier (4.7 feet, ZONE). KYRIE GRIFFIN MAKES IT! Assist: Yao Oladipo
Score: 27-38

================================================================================
                              1ST QUARTER COMPLETE                              
================================================================================

1ST QUARTER SCORE: Team_091 27, Team_083 38

BOX SCORE:
================================================================================

Team_091
--------------------------------------------------------------------------------
Player                MIN  PTS  REB  AST  TO      FG   FG%      3P   3P%
--------------------------------------------------------------------------------
Kevin Simons           12   12    3    0   0   6/7    85.7     0/0   0.0
Isaiah Siakam          12    7    0    0   0   2/4    50.0     0/0   0.0
D'Angelo Ingram        12    5    0    0   0   3/3   100.0     0/0   0.0
Rudy Bridges           12    3    4    1   0   1/2    50.0     0/0   0.0
Kyrie Rozier           12    0    1    1   0   0/3     0.0     0/0   0.0

TEAM: FG: 12/19 (63.2%), 3PT: 1/6 (16.7%), REB: 8 (5 off, 3 def), AST: 2, TO: 2
TEAM FOULS: 9 [Team_083 in BONUS]


Team_083
--------------------------------------------------------------------------------
Player                MIN  PTS  REB  AST  TO      FG   FG%      3P   3P%
--------------------------------------------------------------------------------
Yao Oladipo            12   11    1    2   0   4/5    80.0     0/0   0.0
Bradley Thompson       12   10    4    2   0   5/7    71.4     0/0   0.0
Kyrie Griffin          12    7    4    0   0   3/3   100.0     0/0   0.0
Malcolm Brogdon        12    7    0    0   0   3/3   100.0     0/0   0.0
Karl Jokic             12    3    0    4   0   1/1   100.0     0/0   0.0

TEAM: FG: 16/19 (84.2%), 3PT: 4/4 (100.0%), REB: 9 (2 off, 7 def), AST: 8, TO: 2
TEAM FOULS: 9 [Team_091 in BONUS]

================================================================================

================================================================================
                       2ND QUARTER - Team_091 vs Team_083                       
================================================================================

[12:00] Team_091 possession (Score: 27-38)
Kyrie Rozier drives and kicks out. FOUL! Shooting foul on Yao Oladipo. Isaiah Siakam to the line for 3 free throws. [Team fouls: 1] (Yao Oladipo: 1 personal fouls)   FT 1/3: GOOD   FT 2/3: GOOD   FT 3/3: GOOD Isaiah Siakam makes 3/3 from the line.
Score: 30-38

[11:43] Team_083 possession (Score: 30-38)
Yao Oladipo attempts a Midrange. Wide open! Isaiah Siakam is 6.2 feet away. [ZONE] YAO OLADIPO MAKES IT!
Score: 30-40

[11:30] Team_091 possession (Score: 30-40)
D'Angelo Ingram attempts a 3Pt. Contested by Yao Oladipo (4.6 feet, ZONE). D'Angelo Ingram misses. Rebound secured by Yao Oladipo.

[11:17] Team_083 possession (Score: 30-40)
Malcolm Brogdon attempts a 3Pt. Contested by Kyrie Rozier (4.0 feet, ZONE). MALCOLM BROGDON MAKES IT! Assist: Kyrie Griffin
Score: 30-43

[11:06] Team_091 possession (Score: 30-43)
Rudy Bridges attempts a 3Pt. Contested by Yao Oladipo (3.8 feet, ZONE). Rudy Bridges misses. FOUL! Loose ball foul on Yao Oladipo during the rebound battle. [Team fouls: 2] No free throws, side out. (Yao Oladipo: 2 personal fouls)

[10:50] Team_091 possession (Score: 30-43)
Rudy Bridges throws a bad pass! Stolen by Yao Oladipo! TURNOVER! (live ball)

[10:34] Team_083 possession (Score: 30-43)
Karl Jokic attempts a 3Pt. Wide open! Isaiah Siakam is 6.5 feet away. [MAN] Karl Jokic misses. Rebound secured by Rudy Bridges.

[10:19] Team_091 possession (Score: 30-43)
D'Angelo Ingram attempts a Midrange. Contested by Yao Oladipo (4.7 feet, ZONE). D'ANGELO INGRAM MAKES IT! Assist: Kyrie Rozier
Score: 32-43

[10:05] Team_083 possession (Score: 32-43)
Kyrie Griffin attempts a Layup. Contested by Kevin Simons (4.4 feet, ZONE). KYRIE GRIFFIN MAKES IT!
Score: 32-45

[09:51] Team_091 possession (Score: 32-45)
Rudy Bridges attempts a 3Pt. Contested by Yao Oladipo (3.9 feet, MAN). Rudy Bridges misses. Offensive rebound by Rudy Bridges! Rudy Bridges kicks it out.

[09:35] Team_091 possession (Score: 32-45)
Isaiah Siakam attempts a Midrange. BLOCKED BY KARL JOKIC! Ball goes out off Karl Jokic. Isaiah Siakam's ball!

[09:24] Team_091 possession (Score: 32-45)
Kyrie Rozier attempts a 3Pt. Contested by Yao Oladipo (4.1 feet, ZONE). Kyrie Rozier misses. Rebound secured by Yao Oladipo.

[09:10] Team_083 possession (Score: 32-45)
Malcolm Brogdon attempts a 3Pt. Contested by Kyrie Rozier (4.2 feet, MAN). MALCOLM BROGDON MAKES IT! Assist: Kyrie Griffin
Score: 32-48

[08:52] Team_091 possession (Score: 32-48)
Kevin Simons drives to the basket... Kevin Simons loses the ball! Stripped by Bradley Thompson! TURNOVER! (live ball)

[08:34] Team_083 possession (Score: 32-48)
FOUL! Reach-in foul on Isaiah Siakam during the drive. [Team fouls: 1] No free throws, side out. (Isaiah Siakam: 1 personal fouls)

[08:19] Team_083 possession (Score: 32-48)
Malcolm Brogdon attempts a 3Pt. Contested by Kyrie Rozier (4.3 feet, MAN). Malcolm Brogdon misses. Rebound secured by Kevin Simons.

[08:03] Team_091 possession (Score: 32-48)
Rudy Bridges attempts a Midrange. Contested by Yao Oladipo (4.2 feet, MAN). RUDY BRIDGES MAKES IT! Assist: D'Angelo Ingram
Score: 34-48

[07:49] Team_083 possession (Score: 34-48)
Kyrie Griffin drives and kicks out. Kyrie Griffin attempts a Midrange. Contested by D'Angelo Ingram (5.4 feet, ZONE). Kyrie Griffin misses. Rebound secured by Rudy Bridges.

[07:32] Team_091 possession (Score: 34-48)
Rudy Bridges attempts a 3Pt. Contested by Yao Oladipo (4.2 feet, ZONE). Rudy Bridges misses. Rebound secured by Yao Oladipo.

[07:16] Team_083 possession (Score: 34-48)
Yao Oladipo attempts a 3Pt. Contested by Kyrie Rozier (5.0 feet, ZONE). Yao Oladipo misses. Rebound secured by Kevin Simons.

[07:01] Team_091 possession (Score: 34-48)
Kyrie Rozier attempts a Midrange. Contested by Yao Oladipo (4.3 feet, ZONE). Kyrie Rozier misses. Rebound secured by Kyrie Griffin.

[06:45] Team_083 possession (Score: 34-48)
Malcolm Brogdon attempts a Layup. Contested by Kevin Simons (4.3 feet, ZONE). MALCOLM BROGDON MAKES IT!
Score: 34-50

[06:32] Team_091 possession (Score: 34-50)
Isaiah Siakam attempts a Midrange. Contested by Karl Jokic (5.5 feet, ZONE). ISAIAH SIAKAM MAKES IT!
Score: 36-50

[06:21] Team_083 possession (Score: 36-50)
Karl Jokic drives, picks up Kevin Simons. Help arrives from Kyrie Rozier! Karl Jokic attempts a Dunk. Contested by Kyrie Rozier (5.1 feet, ZONE). Karl Jokic misses. FOUL! Loose ball foul on Kyrie Rozier during the rebound battle. [Team fouls: 2] No free throws, side out. (Kyrie Rozier: 1 personal fouls)

[06:06] Team_083 possession (Score: 36-50)
Kyrie Griffin attempts a Layup. Contested by Kevin Simons (5.0 feet, ZONE). Kyrie Griffin misses. Rebound secured by Kyrie Rozier.

[05:55] Team_091 possession (Score: 36-50)
Kyrie Rozier attempts a 3Pt. Contested by Yao Oladipo (4.5 feet, ZONE). Kyrie Rozier misses. Rebound secured by Bradley Thompson.

[05:43] Team_083 possession (Score: 36-50)
Kyrie Griffin drives and kicks out. Yao Oladipo attempts a 3Pt. Contested by Kyrie Rozier (5.1 feet, ZONE). Yao Oladipo misses. Offensive rebound by Kyrie Griffin! Kyrie Griffin kicks it out.

[05:31] Team_083 possession (Score: 36-50)
Yao Oladipo attempts a 3Pt. Contested by Rudy Bridges (5.5 feet, MAN). Yao Oladipo misses. Rebound secured by Rudy Bridges.

[05:14] Team_091 possession (Score: 36-50)
Kyrie Rozier attempts a 3Pt. Contested by Yao Oladipo (4.6 feet, ZONE). Kyrie Rozier misses. Offensive rebound by Rudy Bridges! Rudy Bridges kicks it out.

[04:57] Team_091 possession (Score: 36-50)
Isaiah Siakam attempts a 3Pt. Contested by Karl Jokic (5.7 feet, MAN). ISAIAH SIAKAM MAKES IT! Assist: Rudy Bridges
Score: 39-50

[04:41] Team_083 possession (Score: 39-50)
Yao Oladipo attempts a 3Pt. Contested by Rudy Bridges (5.6 feet, MAN). YAO OLADIPO MAKES IT! Assist: Kyrie Griffin
Score: 39-53

[04:25] Team_091 possession (Score: 39-53)
Kyrie Rozier drives, Bradley Thompson stays with him. Kyrie Rozier attempts a Dunk. Contested by Bradley Thompson (5.2 feet, ZONE). Kyrie Rozier misses. Rebound secured by Kyrie Griffin.

[04:14] Team_083 possession (Score: 39-53)
Yao Oladipo drives, Rudy Bridges stays with him. Yao Oladipo attempts a Layup. Contested by Rudy Bridges (5.6 feet, MAN). Yao Oladipo misses. Rebound secured by Kyrie Rozier.

[04:04] Team_091 possession (Score: 39-53)
Rudy Bridges attempts a Layup. BLOCKED BY KYRIE GRIFFIN! Ball is loose! Rebound secured by Bradley Thompson.

[03:53] Team_083 possession (Score: 39-53)
Yao Oladipo attempts a 3Pt. Contested by Kyrie Rozier (5.5 feet, ZONE). YAO OLADIPO MAKES IT! Assist: Bradley Thompson
Score: 39-56

[03:34] Team_091 possession (Score: 39-56)
Rudy Bridges drives, Yao Oladipo stays with him. Rudy Bridges attempts a Dunk. Contested by Yao Oladipo (4.8 feet, MAN). Rudy Bridges misses. Rebound secured by Yao Oladipo.

[03:19] Team_083 possession (Score: 39-56)
Kyrie Griffin drives to the basket... Kyrie Griffin loses the ball! Stripped by Kevin Simons! TURNOVER! (live ball)

[03:06] Team_091 possession (Score: 39-56)
D'Angelo Ingram attempts a Midrange. Contested by Kyrie Griffin (5.8 feet, MAN). D'Angelo Ingram misses. Rebound secured by Bradley Thompson.

[02:47] Team_083 possession (Score: 39-56)
Yao Oladipo drives, Kevin Simons stays with him. Yao Oladipo attempts a Dunk. Contested by Kevin Simons (5.5 feet, ZONE). YAO OLADIPO MAKES IT! Assist: Bradley Thompson
Score: 39-58

[02:32] Team_091 possession (Score: 39-58)
Kyrie Rozier throws a bad pass out of bounds! TURNOVER! (dead ball)

[02:32] Substitution (Team_091): Kyrie Rozier OUT → Karl Morant IN (stamina_rule2)

[02:32] Substitution (Team_091): Isaiah Siakam OUT → Julius Barnes IN (stamina_rule2)

[02:32] Substitution (Team_091): Rudy Bridges OUT → Tim Antetokounmpo IN (stamina_rule2)

[02:32] Substitution (Team_091): D'Angelo Ingram OUT → Zion Mitchell IN (stamina_rule2)

[02:32] Substitution (Team_091): Kevin Simons OUT → Ja George IN (stamina_rule2)

[02:32] Substitution (Team_083): Malcolm Brogdon OUT → Zion Markkanen IN (stamina_rule2)

[02:32] Substitution (Team_083): Karl Jokic OUT → Damian Towns IN (stamina_rule2)

[02:32] Substitution (Team_083): Yao Oladipo OUT → Domantas Doncic IN (stamina_rule2)

[02:32] Substitution (Team_083): Kyrie Griffin OUT → Cole Simmons IN (stamina_rule2)

[02:32] Substitution (Team_083): Bradley Thompson OUT → Victor McCollum IN (stamina_rule2)

[02:15] Team_083 possession (Score: 39-58)
Damian Towns drives and kicks out. Cole Simmons attempts a 3Pt. Contested by Zion Mitchell (4.9 feet, MAN). Cole Simmons misses. Rebound secured by Zion Mitchell.

[02:02] Team_091 possession (Score: 39-58)
FOUL! Holding foul on Zion Markkanen. [Team fouls: 3] No free throws, side out. (Zion Markkanen: 1 personal fouls)

[01:51] Team_091 possession (Score: 39-58)
Ja George drives to the basket... Ja George throws a bad pass out of bounds! TURNOVER! (dead ball)

[01:37] Team_083 possession (Score: 39-58)
Zion Markkanen drives, picks up Karl Morant. Help arrives from Tim Antetokounmpo! Zion Markkanen attempts a Layup. Contested by Tim Antetokounmpo (5.0 feet, MAN). ZION MARKKANEN MAKES IT!
Score: 39-60

[01:21] Team_091 possession (Score: 39-60)
Tim Antetokounmpo attempts a Midrange. Contested by Domantas Doncic (4.6 feet, MAN). Tim Antetokounmpo misses. Offensive rebound by Zion Mitchell! Zion Mitchell kicks it out.

[01:07] Team_091 possession (Score: 39-60)
Tim Antetokounmpo attempts a 3Pt. Contested by Domantas Doncic (4.6 feet, MAN). Tim Antetokounmpo misses. Rebound secured by Cole Simmons.

[00:50] Team_083 possession (Score: 39-60)
Cole Simmons attempts a 3Pt. Contested by Zion Mitchell (4.9 feet, MAN). Cole Simmons misses. Rebound secured by Ja George.

[00:35] Team_091 possession (Score: 39-60)
Tim Antetokounmpo attempts a 3Pt. Contested by Zion Markkanen (5.5 feet, ZONE). TIM ANTETOKOUNMPO MAKES IT! Assist: Zion Mitchell
Score: 42-60

[00:23] Team_083 possession (Score: 42-60)
Damian Towns attempts a 3Pt. Contested by Karl Morant (5.4 feet, ZONE). DAMIAN TOWNS MAKES IT! Assist: Domantas Doncic
Score: 42-63

[00:08] Team_091 possession (Score: 42-63)
Karl Morant attempts a 3Pt. Contested by Zion Markkanen (5.7 feet, ZONE). KARL MORANT MAKES IT!
Score: 45-63

================================================================================
                              2ND QUARTER COMPLETE                              
================================================================================

2ND QUARTER SCORE: Team_091 18, Team_083 25

BOX SCORE:
================================================================================

Team_091
--------------------------------------------------------------------------------
Player                MIN  PTS  REB  AST  TO      FG   FG%      3P   3P%
--------------------------------------------------------------------------------
Isaiah Siakam          22    8    0    0   0   3/3   100.0     0/0   0.0
Tim Antetokounmpo       2    3    0    0   0   1/2    50.0     0/0   0.0
Karl Morant             2    3    0    0   0   1/1   100.0     0/0   0.0
D'Angelo Ingram        22    2    0    1   0   1/3    33.3     0/0   0.0
Rudy Bridges           22    2    6    1   0   1/4    25.0     0/0   0.0
Kyrie Rozier           22    0    2    1   0   0/4     0.0     0/0   0.0
Kevin Simons           22    0    2    0   0   0/0     0.0     0/0   0.0
Zion Mitchell           2    0    2    1   0   0/0     0.0     0/0   0.0
Ja George               2    0    1    0   0   0/0     0.0     0/0   0.0

TEAM: FG: 7/17 (41.2%), 3PT: 3/8 (37.5%), REB: 13 (4 off, 9 def), AST: 4, TO: 4
TEAM FOULS: 2


Team_083
--------------------------------------------------------------------------------
Player                MIN  PTS  REB  AST  TO      FG   FG%      3P   3P%
--------------------------------------------------------------------------------
Yao Oladipo            22   10    4    0   0   4/7    57.1     0/0   0.0
Malcolm Brogdon        22    8    0    0   0   3/4    75.0     0/0   0.0
Damian Towns            2    3    0    0   0   1/2    50.0     0/0   0.0
Kyrie Griffin          22    2    4    3   0   1/3    33.3     0/0   0.0
Zion Markkanen          2    2    0    0   0   1/1   100.0     0/0   0.0
Karl Jokic             22    0    0    0   0   0/1     0.0     0/0   0.0
Bradley Thompson       22    0    3    2   0   0/0     0.0     0/0   0.0
Cole Simmons            2    0    1    0   0   0/1     0.0     0/0   0.0
Domantas Doncic         2    0    0    1   0   0/0     0.0     0/0   0.0

TEAM: FG: 10/19 (52.6%), 3PT: 5/10 (50.0%), REB: 12 (2 off, 10 def), AST: 6, TO: 1
TEAM FOULS: 3

================================================================================

================================================================================
                       3RD QUARTER - Team_091 vs Team_083                       
================================================================================

[12:00] Team_091 possession (Score: 45-63)
Kyrie Rozier attempts a 3Pt. Contested by Yao Oladipo (3.5 feet, ZONE). Kyrie Rozier misses. Offensive rebound by Kevin Simons! Kevin Simons's putback is no good. Rebound secured by Bradley Thompson.

[11:44] Team_083 possession (Score: 45-63)
Yao Oladipo drives, Kevin Simons stays with him. Yao Oladipo attempts a Layup. Contested by Kevin Simons (3.8 feet, ZONE). Yao Oladipo misses. Offensive rebound by Bradley Thompson! Bradley Thompson puts it back in!
Score: 45-65

[11:34] Team_091 possession (Score: 45-65)
Kyrie Rozier attempts a 3Pt. Contested by Yao Oladipo (3.5 feet, ZONE). Kyrie Rozier misses. Rebound secured by Bradley Thompson.

[11:22] Team_083 possession (Score: 45-65)
Malcolm Brogdon attempts a Midrange. Contested by Isaiah Siakam (5.3 feet, ZONE). Malcolm Brogdon misses. Rebound secured by Kevin Simons.

[11:10] Team_091 possession (Score: 45-65)
Kevin Simons attempts a Midrange. Contested by Bradley Thompson (4.1 feet, MAN). KEVIN SIMONS MAKES IT! Assist: D'Angelo Ingram
Score: 47-65

[10:54] Team_083 possession (Score: 47-65)
Karl Jokic attempts a 3Pt. Contested by Rudy Bridges (4.9 feet, ZONE). KARL JOKIC MAKES IT! Assist: Yao Oladipo
Score: 47-68

[10:36] Team_091 possession (Score: 47-68)
Kevin Simons drives and kicks out. Isaiah Siakam attempts a Midrange. Contested by Malcolm Brogdon (4.8 feet, ZONE). Isaiah Siakam misses. Rebound secured by Kyrie Griffin.

[10:19] Team_083 possession (Score: 47-68)
Karl Jokic drives and kicks out. Yao Oladipo attempts a Midrange. Contested by Isaiah Siakam (5.6 feet, ZONE). YAO OLADIPO MAKES IT! Assist: Kyrie Griffin
Score: 47-70

[10:00] Team_091 possession (Score: 47-70)
Rudy Bridges makes the Layup and draws the foul on Yao Oladipo! And-1! Rudy Bridges to the line for 1. [Team fouls: 1] (Yao Oladipo: 1 personal fouls)   FT 1/1: GOOD Rudy Bridges makes 1/1 from the line.
Score: 50-70

[09:46] Team_083 possession (Score: 50-70)
Karl Jokic attempts a 3Pt. Contested by Kyrie Rozier (4.6 feet, ZONE). Karl Jokic misses. Offensive rebound by Bradley Thompson! Bradley Thompson's putback is no good. Offensive rebound by Kyrie Griffin! Kyrie Griffin kicks it out.

[09:32] Team_083 possession (Score: 50-70)
Kyrie Griffin attempts a Midrange. Contested by D'Angelo Ingram (5.0 feet, MAN). KYRIE GRIFFIN MAKES IT!
Score: 50-72

[09:17] Team_091 possession (Score: 50-72)
FOUL! Shooting foul on Yao Oladipo. Kyrie Rozier to the line for 3 free throws. [Team fouls: 2] (Yao Oladipo: 2 personal fouls)   FT 1/3: MISS   FT 2/3: MISS   FT 3/3: GOOD Kyrie Rozier makes 1/3 from the line.
Score: 51-72

[09:07] Team_083 possession (Score: 51-72)
Malcolm Brogdon attempts a 3Pt. Contested by Kyrie Rozier (3.7 feet, MAN). Malcolm Brogdon misses. Rebound secured by Rudy Bridges.

[08:53] Team_091 possession (Score: 51-72)
D'Angelo Ingram drives and kicks out. Kevin Simons attempts a 3Pt. Contested by Yao Oladipo (3.4 feet, ZONE). Kevin Simons misses. Rebound secured by Bradley Thompson.

[08:38] Team_083 possession (Score: 51-72)
Yao Oladipo makes the Dunk and draws the foul on Kyrie Rozier! And-1! Yao Oladipo to the line for 1. [Team fouls: 1] (Kyrie Rozier: 1 personal fouls)   FT 1/1: MISS Yao Oladipo makes 0/1 from the line. Rebound secured by Kyrie Rozier.
Score: 51-74

[08:21] Team_091 possession (Score: 51-74)
Kevin Simons attempts a 3Pt. Contested by Bradley Thompson (4.1 feet, MAN). Kevin Simons misses. Offensive rebound by Kevin Simons! Kevin Simons puts it back in!
Score: 53-74

[08:02] Team_083 possession (Score: 53-74)
Yao Oladipo drives, picks up Kevin Simons. Help arrives from Kyrie Rozier! Yao Oladipo attempts a Dunk. Contested by Kyrie Rozier (3.8 feet, ZONE). Yao Oladipo misses. Offensive rebound by Kyrie Griffin! Kyrie Griffin kicks it out.

[07:46] Team_083 possession (Score: 53-74)
Karl Jokic attempts a 3Pt. Contested by Kyrie Rozier (4.6 feet, ZONE). Karl Jokic misses. Rebound secured by Kyrie Rozier.

[07:31] Team_091 possession (Score: 53-74)
Kevin Simons attempts a 3Pt. Contested by Yao Oladipo (3.8 feet, ZONE). Kevin Simons misses. Rebound secured by Yao Oladipo.

[07:18] Team_083 possession (Score: 53-74)
Kyrie Griffin attempts a 3Pt. Contested by Kyrie Rozier (4.4 feet, ZONE). Kyrie Griffin misses. Offensive rebound by Bradley Thompson! Bradley Thompson puts it back in!
Score: 53-76

[07:03] Team_091 possession (Score: 53-76)
Kyrie Rozier attempts a Midrange. Contested by Bradley Thompson (3.8 feet, ZONE). Kyrie Rozier misses. Rebound secured by Kyrie Griffin.

[06:48] Team_083 possession (Score: 53-76)
Kyrie Griffin drives, picks up D'Angelo Ingram. Help arrives from Kyrie Rozier! Kyrie Griffin attempts a Dunk. Contested by Kyrie Rozier (5.0 feet, MAN). KYRIE GRIFFIN MAKES IT! Assist: Karl Jokic
Score: 53-78

[06:30] Team_091 possession (Score: 53-78)
Isaiah Siakam attempts a 3Pt. Contested by Karl Jokic (4.9 feet, MAN). ISAIAH SIAKAM MAKES IT! Assist: D'Angelo Ingram
Score: 56-78

[06:17] Team_083 possession (Score: 56-78)
Karl Jokic drives and kicks out. Yao Oladipo attempts a 3Pt. Contested by Kyrie Rozier (4.1 feet, ZONE). YAO OLADIPO MAKES IT!
Score: 56-81

[06:03] Team_091 possession (Score: 56-81)
D'Angelo Ingram attempts a 3Pt. Contested by Kyrie Griffin (4.3 feet, MAN). D'Angelo Ingram misses. Rebound secured by Kyrie Griffin.

[05:48] Team_083 possession (Score: 56-81)
Bradley Thompson attempts a 3Pt. Contested by Isaiah Siakam (5.7 feet, ZONE). BRADLEY THOMPSON MAKES IT! Assist: Karl Jokic
Score: 56-84

[05:38] Team_091 possession (Score: 56-84)
Isaiah Siakam attempts a 3Pt. Contested by Yao Oladipo (3.7 feet, ZONE). Isaiah Siakam misses. Offensive rebound by Rudy Bridges! Rudy Bridges kicks it out.

[05:23] Team_091 possession (Score: 56-84)
Rudy Bridges attempts a 3Pt. Contested by Yao Oladipo (3.4 feet, MAN). Rudy Bridges misses. Offensive rebound by Kevin Simons! Kevin Simons puts it back in!
Score: 58-84

[05:09] Team_083 possession (Score: 58-84)
Malcolm Brogdon attempts a 3Pt. Contested by Kyrie Rozier (3.7 feet, ZONE). Malcolm Brogdon misses. Rebound secured by Rudy Bridges.

[04:59] Team_091 possession (Score: 58-84)
Rudy Bridges attempts a 3Pt. Contested by Yao Oladipo (3.5 feet, ZONE). Rudy Bridges misses. Rebound secured by Bradley Thompson.

[04:40] Team_083 possession (Score: 58-84)
Kyrie Griffin drives and kicks out. Yao Oladipo attempts a Midrange. Contested by Rudy Bridges (4.4 feet, MAN). YAO OLADIPO MAKES IT!
Score: 58-86

[04:26] Team_091 possession (Score: 58-86)
D'Angelo Ingram attempts a Layup. Contested by Kyrie Griffin (4.4 feet, MAN). D'Angelo Ingram misses. Rebound secured by Kyrie Griffin.

[04:12] Team_083 possession (Score: 58-86)
Kyrie Griffin attempts a 3Pt. Contested by D'Angelo Ingram (5.0 feet, MAN). Kyrie Griffin misses. Offensive rebound by Bradley Thompson! Bradley Thompson puts it back in!
Score: 58-88

[03:58] Team_091 possession (Score: 58-88)
Isaiah Siakam throws a bad pass! Stolen by Karl Jokic! TURNOVER! (live ball)

[03:42] Team_083 possession (Score: 58-88)
Kyrie Griffin attempts a 3Pt. Contested by D'Angelo Ingram (5.1 feet, MAN). KYRIE GRIFFIN MAKES IT! Assist: Yao Oladipo
Score: 58-91

[03:26] Team_091 possession (Score: 58-91)
Kevin Simons attempts a Midrange. Contested by Yao Oladipo (3.9 feet, ZONE). KEVIN SIMONS MAKES IT!
Score: 60-91

[03:12] Team_083 possession (Score: 60-91)
Bradley Thompson attempts a Layup. Contested by Kevin Simons (3.9 feet, MAN). Bradley Thompson misses. Rebound secured by Kevin Simons.

[02:57] Team_091 possession (Score: 60-91)
Isaiah Siakam attempts a 3Pt. Contested by Yao Oladipo (3.8 feet, ZONE). Isaiah Siakam misses. Rebound secured by Yao Oladipo.

[02:40] Team_083 possession (Score: 60-91)
Kyrie Griffin attempts a Midrange. Contested by D'Angelo Ingram (5.2 feet, MAN). Kyrie Griffin misses. Offensive rebound by Bradley Thompson! Bradley Thompson kicks it out.

[02:24] Team_083 possession (Score: 60-91)
Karl Jokic attempts a Layup. Wide open! Isaiah Siakam is 6.4 feet away. [MAN] KARL JOKIC MAKES IT!
Score: 60-93

[02:09] Team_091 possession (Score: 60-93)
FOUL! Shooting foul on Karl Jokic. Rudy Bridges to the line for 2 free throws. [Team fouls: 3] (Karl Jokic: 1 personal fouls)   FT 1/2: GOOD   FT 2/2: GOOD Rudy Bridges makes 2/2 from the line.
Score: 62-93

[01:58] Team_083 possession (Score: 62-93)
Kyrie Griffin drives, picks up D'Angelo Ingram. Help arrives from Kyrie Rozier! Kyrie Griffin attempts a Dunk. Contested by Kyrie Rozier (5.2 feet, MAN). KYRIE GRIFFIN MAKES IT! Assist: Malcolm Brogdon
Score: 62-95

[01:40] Team_091 possession (Score: 62-95)
Rudy Bridges drives and kicks out. Isaiah Siakam attempts a 3Pt. Contested by Karl Jokic (4.8 feet, MAN). Isaiah Siakam misses. Rebound secured by Kyrie Griffin.

[01:28] Team_083 possession (Score: 62-95)
Bradley Thompson drives and kicks out. Bradley Thompson attempts a 3Pt. Contested by Kyrie Rozier (4.4 feet, ZONE). Bradley Thompson misses. Rebound secured by Kyrie Rozier.

[01:14] Team_091 possession (Score: 62-95)
Kyrie Rozier attempts a Layup. Contested by Malcolm Brogdon (5.3 feet, MAN). Kyrie Rozier misses. Rebound secured by Kyrie Griffin.

[00:57] Team_083 possession (Score: 62-95)
FOUL! Shooting foul on Kevin Simons. Bradley Thompson to the line for 2 free throws. [Team fouls: 2] (Kevin Simons: 1 personal fouls)   FT 1/2: GOOD   FT 2/2: MISS Bradley Thompson makes 1/2 from the line. Offensive rebound by Bradley Thompson! Bradley Thompson kicks it out.
Score: 62-96

[00:40] Team_083 possession (Score: 62-96)
Malcolm Brogdon attempts a 3Pt. Contested by Kyrie Rozier (4.1 feet, MAN). Malcolm Brogdon misses. Rebound secured by Kyrie Rozier.

[00:26] Team_091 possession (Score: 62-96)
Isaiah Siakam drives, picks up Karl Jokic. Help arrives from Yao Oladipo! Isaiah Siakam attempts a Dunk. Contested by Yao Oladipo (5.2 feet, MAN). Isaiah Siakam misses. Rebound secured by Bradley Thompson.

[00:07] Team_083 possession (Score: 62-96)
Malcolm Brogdon attempts a Midrange. Contested by D'Angelo Ingram (4.8 feet, ZONE). Malcolm Brogdon misses. Rebound secured by Kevin Simons.

================================================================================
                              3RD QUARTER COMPLETE                              
================================================================================

3RD QUARTER SCORE: Team_091 17, Team_083 33

BOX SCORE:
================================================================================

Team_091
--------------------------------------------------------------------------------
Player                MIN  PTS  REB  AST  TO      FG   FG%      3P   3P%
--------------------------------------------------------------------------------
Kevin Simons           34    8    5    0   0   4/6    66.7     0/0   0.0
Rudy Bridges           34    5    3    0   0   2/4    50.0     0/0   0.0
Isaiah Siakam          34    3    0    0   0   1/3    33.3     0/0   0.0
Kyrie Rozier           34    1    4    0   0   1/5    20.0     0/0   0.0
D'Angelo Ingram        34    0    0    2   0   0/3     0.0     0/0   0.0

TEAM: FG: 8/21 (38.1%), 3PT: 4/10 (40.0%), REB: 13 (4 off, 9 def), AST: 2, TO: 1
TEAM FOULS: 2


Team_083
--------------------------------------------------------------------------------
Player                MIN  PTS  REB  AST  TO      FG   FG%      3P   3P%
--------------------------------------------------------------------------------
Bradley Thompson       34    9   10    0   0   4/6    66.7     0/0   0.0
Kyrie Griffin          34    9    8    1   0   4/4   100.0     0/0   0.0
Yao Oladipo            34    7    2    2   0   3/4    75.0     0/0   0.0
Karl Jokic             34    5    0    2   0   2/3    66.7     0/0   0.0
Malcolm Brogdon        34    0    0    1   0   0/5     0.0     0/0   0.0

TEAM: FG: 13/22 (59.1%), 3PT: 5/9 (55.6%), REB: 19 (7 off, 12 def), AST: 6, TO: 0
TEAM FOULS: 3

================================================================================

================================================================================
                       4TH QUARTER - Team_091 vs Team_083                       
================================================================================

[12:00] Substitution (Team_091): Kyrie Rozier OUT (stamina: 72) → Karl Morant IN (comeback_detected)

[12:00] Substitution (Team_083): Malcolm Brogdon OUT (stamina: 70) → Zion Markkanen IN (comeback_detected)

[12:00] Team_091 possession (Score: 62-96)
Karl Morant attempts a 3Pt. Contested by Zion Markkanen (5.7 feet, MAN). KARL MORANT MAKES IT! Assist: Rudy Bridges
Score: 65-96

[11:43] Team_083 possession (Score: 65-96)
Bradley Thompson drives and kicks out. Karl Jokic attempts a Midrange. Contested by Rudy Bridges (4.6 feet, ZONE). Karl Jokic misses. Offensive rebound by Kyrie Griffin! Kyrie Griffin kicks it out.

[11:29] Team_083 possession (Score: 65-96)
Zion Markkanen makes the Layup and draws the foul on Rudy Bridges! And-1! Zion Markkanen to the line for 1. [Team fouls: 1] (Rudy Bridges: 1 personal fouls)   FT 1/1: GOOD Zion Markkanen makes 1/1 from the line.
Score: 65-99

[11:16] Team_091 possession (Score: 65-99)
Isaiah Siakam drives and kicks out. Rudy Bridges attempts a 3Pt. Contested by Yao Oladipo (3.7 feet, MAN). Rudy Bridges misses. Rebound secured by Kyrie Griffin.

[11:00] Team_083 possession (Score: 65-99)
Karl Jokic drives to the basket... Karl Jokic commits a violation (traveling/carry)! TURNOVER! (dead ball)

[11:00] Substitution (Team_091): Isaiah Siakam OUT → Julius Barnes IN (stamina_rule2)

[11:00] Substitution (Team_091): Rudy Bridges OUT → Tim Antetokounmpo IN (stamina_rule2)

[11:00] Substitution (Team_091): D'Angelo Ingram OUT → Zion Mitchell IN (stamina_rule2)

[11:00] Substitution (Team_091): Kevin Simons OUT → Ja George IN (stamina_rule2)

[11:00] Substitution (Team_083): Karl Jokic OUT → Damian Towns IN (stamina_rule2)

[11:00] Substitution (Team_083): Yao Oladipo OUT → Domantas Doncic IN (stamina_rule2)

[11:00] Substitution (Team_083): Kyrie Griffin OUT → Cole Simmons IN (stamina_rule2)

[11:00] Substitution (Team_083): Bradley Thompson OUT → Victor McCollum IN (stamina_rule2)

[10:49] Team_091 possession (Score: 65-99)
Karl Morant drives and kicks out. Ja George attempts a 3Pt. Contested by Victor McCollum (4.0 feet, MAN). Ja George misses. Offensive rebound by Zion Mitchell! Zion Mitchell kicks it out.

[10:36] Team_091 possession (Score: 65-99)
Tim Antetokounmpo attempts a Midrange. Contested by Domantas Doncic (4.6 feet, ZONE). TIM ANTETOKOUNMPO MAKES IT!
Score: 67-99

[10:20] Team_083 possession (Score: 67-99)
Cole Simmons attempts a 3Pt. Contested by Zion Mitchell (4.9 feet, MAN). Cole Simmons misses. Rebound secured by Tim Antetokounmpo.

[10:07] Team_091 possession (Score: 67-99)
Tim Antetokounmpo attempts a 3Pt. Contested by Domantas Doncic (4.6 feet, MAN). Tim Antetokounmpo misses. Rebound secured by Cole Simmons.

[09:53] Team_083 possession (Score: 67-99)
Cole Simmons drives and kicks out. Zion Markkanen attempts a 3Pt. Contested by Karl Morant (4.9 feet, MAN). Zion Markkanen misses. Rebound secured by Zion Mitchell.

[09:35] Team_091 possession (Score: 67-99)
Zion Mitchell attempts a Midrange. Contested by Cole Simmons (5.0 feet, MAN). ZION MITCHELL MAKES IT! Assist: Tim Antetokounmpo
Score: 69-99

[09:19] Team_083 possession (Score: 69-99)
Damian Towns drives to the basket... FOUL! Offensive foul on Damian Towns! Zion Mitchell drew the charge! [Team fouls: 1] (Damian Towns: 1 personal fouls) TURNOVER! (dead ball)

[09:04] Team_091 possession (Score: 69-99)
Karl Morant attempts a 3Pt. Contested by Zion Markkanen (5.7 feet, MAN). KARL MORANT MAKES IT! Assist: Zion Mitchell
Score: 72-99

[08:49] Team_083 possession (Score: 72-99)
Victor McCollum attempts a Midrange. Contested by Ja George (5.3 feet, MAN). Victor McCollum misses. Rebound secured by Zion Mitchell.

[08:34] Team_091 possession (Score: 72-99)
FOUL! Reach-in foul on Victor McCollum during the drive. [Team fouls: 2] No free throws, side out. (Victor McCollum: 1 personal fouls)

[08:20] Team_091 possession (Score: 72-99)
Ja George loses control! Ball rolls out of bounds! TURNOVER! (dead ball)

[08:08] Team_083 possession (Score: 72-99)
Victor McCollum drives to the basket... FOUL! Offensive foul on Victor McCollum! Ja George drew the charge! [Team fouls: 3] (Victor McCollum: 2 personal fouls) TURNOVER! (dead ball)

[07:51] Team_091 possession (Score: 72-99)
Ja George drives to the basket... FOUL! Offensive foul on Ja George! Victor McCollum drew the charge! [Team fouls: 2] (Ja George: 1 personal fouls) TURNOVER! (dead ball)

[07:33] Team_083 possession (Score: 72-99)
FOUL! Shooting foul on Julius Barnes. Damian Towns to the line for 3 free throws. [Team fouls: 3] (Julius Barnes: 1 personal fouls)   FT 1/3: MISS   FT 2/3: GOOD   FT 3/3: GOOD Damian Towns makes 2/3 from the line.
Score: 72-101

[07:15] Team_091 possession (Score: 72-101)
Julius Barnes attempts a 3Pt. Contested by Damian Towns (4.9 feet, MAN). JULIUS BARNES MAKES IT!
Score: 75-101

[07:00] Team_083 possession (Score: 75-101)
Cole Simmons attempts a 3Pt. Contested by Zion Mitchell (4.9 feet, MAN). Cole Simmons misses. Rebound secured by Ja George.

[06:43] Team_091 possession (Score: 75-101)
Tim Antetokounmpo attempts a 3Pt. Contested by Zion Markkanen (5.5 feet, ZONE). TIM ANTETOKOUNMPO MAKES IT! Assist: Zion Mitchell
Score: 78-101

[06:27] Team_083 possession (Score: 78-101)
Zion Markkanen attempts a 3Pt. Contested by Karl Morant (5.0 feet, ZONE). ZION MARKKANEN MAKES IT! Assist: Cole Simmons
Score: 78-104

[06:08] Team_091 possession (Score: 78-104)
Tim Antetokounmpo throws a bad pass out of bounds! TURNOVER! (dead ball)

[05:56] Team_083 possession (Score: 78-104)
Cole Simmons drives, picks up Zion Mitchell. Help arrives from Karl Morant! Cole Simmons attempts a Layup. Contested by Karl Morant (4.9 feet, MAN). COLE SIMMONS MAKES IT! Assist: Victor McCollum
Score: 78-106

[05:44] Team_091 possession (Score: 78-106)
Karl Morant attempts a 3Pt. Contested by Zion Markkanen (5.7 feet, ZONE). KARL MORANT MAKES IT! Assist: Tim Antetokounmpo
Score: 81-106

[05:33] Team_083 possession (Score: 81-106)
Zion Markkanen throws a bad pass out of bounds! TURNOVER! (dead ball)

[05:21] Team_091 possession (Score: 81-106)
Karl Morant drives, Victor McCollum stays with him. Karl Morant attempts a Layup. Contested by Victor McCollum (4.3 feet, ZONE). KARL MORANT MAKES IT!
Score: 83-106

[05:05] Team_083 possession (Score: 83-106)
Cole Simmons attempts a 3Pt. Contested by Zion Mitchell (4.9 feet, MAN). Cole Simmons misses. Rebound secured by Tim Antetokounmpo.

[04:54] Team_091 possession (Score: 83-106)
Karl Morant attempts a 3Pt. Contested by Zion Markkanen (5.7 feet, MAN). Karl Morant misses. Rebound secured by Damian Towns.

[04:40] Team_083 possession (Score: 83-106)
Zion Markkanen attempts a Midrange. Contested by Karl Morant (5.1 feet, MAN). Zion Markkanen misses. FOUL! Loose ball foul on Ja George during the rebound battle. [Team fouls: 4] No free throws, side out. (Ja George: 2 personal fouls)

[04:29] Team_083 possession (Score: 83-106)
Cole Simmons attempts a Midrange. Contested by Zion Mitchell (4.9 feet, MAN). COLE SIMMONS MAKES IT! Assist: Zion Markkanen
Score: 83-108

[04:13] Team_091 possession (Score: 83-108)
FOUL! Holding foul on Victor McCollum. [Team fouls: 4] No free throws, side out. (Victor McCollum: 3 personal fouls)

[04:00] Team_091 possession (Score: 83-108)
Ja George attempts a Layup. Contested by Victor McCollum (4.1 feet, ZONE). Ja George misses. Rebound secured by Cole Simmons.

[03:42] Team_083 possession (Score: 83-108)
Cole Simmons attempts a Midrange. Contested by Zion Mitchell (4.9 feet, MAN). COLE SIMMONS MAKES IT! Assist: Damian Towns
Score: 83-110

[03:31] Team_091 possession (Score: 83-110)
Ja George drives and kicks out. Zion Mitchell attempts a 3Pt. Contested by Zion Markkanen (5.5 feet, ZONE). Zion Mitchell misses. Rebound secured by Damian Towns.

[03:19] Team_083 possession (Score: 83-110)
Cole Simmons attempts a Midrange. Contested by Karl Morant (5.0 feet, ZONE). Cole Simmons misses. Rebound secured by Zion Mitchell.

[03:04] Team_091 possession (Score: 83-110)
Zion Mitchell attempts a Midrange. Contested by Damian Towns (5.2 feet, ZONE). ZION MITCHELL MAKES IT!
Score: 85-110

[02:47] Team_083 possession (Score: 85-110)
Domantas Doncic attempts a 3Pt. Contested by Karl Morant (5.2 feet, ZONE). Domantas Doncic misses. Rebound secured by Zion Mitchell.

[02:31] Team_091 possession (Score: 85-110)
Tim Antetokounmpo attempts a Layup. BLOCKED BY VICTOR MCCOLLUM! Ball is loose! Offensive rebound by Ja George! Ja George kicks it out.

[02:19] Team_091 possession (Score: 85-110)
Karl Morant attempts a Midrange. Contested by Zion Markkanen (5.8 feet, MAN). Karl Morant misses. Rebound secured by Victor McCollum.

[02:06] Team_083 possession (Score: 85-110)
FOUL! Shooting foul on Zion Mitchell. Cole Simmons to the line for 2 free throws. [BONUS: 5 team fouls] (Zion Mitchell: 1 personal fouls)   FT 1/2: MISS   FT 2/2: GOOD Cole Simmons makes 1/2 from the line.
Score: 85-111

[01:52] Team_091 possession (Score: 85-111)
Julius Barnes drives to the basket... FOUL! Offensive foul on Julius Barnes! Damian Towns drew the charge! [Team fouls: 6] (Julius Barnes: 2 personal fouls) TURNOVER! (dead ball)

[01:39] Team_083 possession (Score: 85-111)
Cole Simmons drives to the basket... Cole Simmons throws a bad pass out of bounds! TURNOVER! (dead ball)

[01:23] Team_091 possession (Score: 85-111)
Tim Antetokounmpo attempts a 3Pt. Contested by Domantas Doncic (4.8 feet, ZONE). Tim Antetokounmpo misses. Offensive rebound by Ja George! Ja George kicks it out.

[01:10] Team_091 possession (Score: 85-111)
Julius Barnes attempts a 3Pt. Contested by Damian Towns (5.1 feet, MAN). Julius Barnes misses. Offensive rebound by Zion Mitchell! Zion Mitchell kicks it out.

[00:59] Team_091 possession (Score: 85-111)
Ja George attempts a Midrange. Contested by Cole Simmons (5.1 feet, ZONE). Ja George misses. Rebound secured by Victor McCollum.

[00:47] Team_083 possession (Score: 85-111)
Zion Markkanen attempts a Midrange. Contested by Karl Morant (5.5 feet, MAN). ZION MARKKANEN MAKES IT!
Score: 85-113

[00:37] Team_091 possession (Score: 85-113)
Zion Mitchell attempts a Layup. Contested by Cole Simmons (5.3 feet, MAN). Zion Mitchell misses. Rebound secured by Damian Towns.

[00:24] Team_083 possession (Score: 85-113)
Damian Towns drives and kicks out. Victor McCollum attempts a 3Pt. Contested by Ja George (5.1 feet, MAN). VICTOR MCCOLLUM MAKES IT! Assist: Zion Markkanen
Score: 85-116

[00:09] Team_091 possession (Score: 85-116)
Karl Morant attempts a Layup. Contested by Victor McCollum (4.6 feet, ZONE). KARL MORANT MAKES IT!
Score: 87-116

================================================================================
                              4TH QUARTER COMPLETE                              
================================================================================

4TH QUARTER SCORE: Team_091 25, Team_083 20

BOX SCORE:
================================================================================

Team_091
--------------------------------------------------------------------------------
Player                MIN  PTS  REB  AST  TO      FG   FG%      3P   3P%
--------------------------------------------------------------------------------
Karl Morant            14   13    0    0   0   5/7    71.4     0/0   0.0
Tim Antetokounmpo      13    5    2    2   0   2/3    66.7     0/0   0.0
Zion Mitchell          13    4    6    2   0   2/3    66.7     0/0   0.0
Julius Barnes          13    3    0    0   0   1/1   100.0     0/0   0.0
Rudy Bridges           35    0    0    1   0   0/0     0.0     0/0   0.0
Isaiah Siakam          35    0    0    0   0   0/1     0.0     0/0   0.0
Ja George              13    0    3    0   0   0/3     0.0     0/0   0.0

TEAM: FG: 10/18 (55.6%), 3PT: 5/7 (71.4%), REB: 11 (4 off, 7 def), AST: 5, TO: 4
TEAM FOULS: 6 [Team_083 in BONUS]


Team_083
--------------------------------------------------------------------------------
Player                MIN  PTS  REB  AST  TO      FG   FG%      3P   3P%
--------------------------------------------------------------------------------
Zion Markkanen         14    8    0    2   0   3/3   100.0     0/0   0.0
Cole Simmons           13    7    2    1   0   4/9    44.4     0/0   0.0
Victor McCollum        13    3    3    1   0   1/2    50.0     0/0   0.0
Damian Towns           13    2    3    1   0   1/1   100.0     0/0   0.0
Kyrie Griffin          35    0    2    0   0   0/0     0.0     0/0   0.0
Domantas Doncic        13    0    0    0   0   0/1     0.0     0/0   0.0

TEAM: FG: 9/16 (56.2%), 3PT: 2/6 (33.3%), REB: 10 (2 off, 8 def), AST: 5, TO: 5
TEAM FOULS: 4

================================================================================

================================================================================
                               FULL GAME COMPLETE                               
================================================================================

FINAL SCORE: Team_091 87, Team_083 116

SCORING BY QUARTER:
--------------------------------------------------------------------------------
Team                     Q1     Q2     Q3     Q4    FINAL
--------------------------------------------------------------------------------
Team_091                 27     18     17     25       87
Team_083                 38     25     33     20      116
--------------------------------------------------------------------------------

FULL GAME BOX SCORE:
================================================================================

Team_091
--------------------------------------------------------------------------------
Player                MIN  PTS  REB  AST  TO      FG   FG%      3P   3P%      FT STL BLK
--------------------------------------------------------------------------------
Isaiah Siakam          35   18    0    0   2   6/11   54.5   3/6    50.0   5/5     0   0
Rudy Bridges           35   10   13    3   1   5/11   45.5   1/4    25.0   4/4     0   0
D'Angelo Ingram        35    7    0    3   0   3/8    37.5   0/2     0.0   3/4     0   0
Kevin Simons           35   20   10    0   2   7/10   70.0   1/3    33.3   4/4     1   1
Kyrie Rozier           34    1    7    2   1   3/14   21.4   1/6    16.7   1/3     0   0
Karl Morant            14   16    0    0   1   6/8    75.0   4/5    80.0   0/0     0   0
Julius Barnes          13    3    0    0   0   1/1   100.0   1/1   100.0   0/0     0   0
Tim Antetokounmpo      13    8    2    2   2   3/5    60.0   2/4    50.0   0/0     0   0
Zion Mitchell          13    4    8    3   1   2/3    66.7   0/0     0.0   0/0     0   0
Ja George              13    0    4    0   1   0/3     0.0   0/0     0.0   0/0     0   0

TEAM: FG: 37/75 (49.3%), 3PT: 13/31 (41.9%), REB: 45 (17 off, 28 def), AST: 13, TO: 11


Team_083
--------------------------------------------------------------------------------
Player                MIN  PTS  REB  AST  TO      FG   FG%      3P   3P%      FT STL BLK
--------------------------------------------------------------------------------
Karl Jokic             35    8    0    6   1   6/8    75.0   2/4    50.0   0/0     1   1
Yao Oladipo            35   28    7    4   1   8/13   61.5   3/5    60.0   1/2     1   0
Kyrie Griffin          35   18   18    4   0  11/13   84.6   4/4   100.0   0/0     0   1
Bradley Thompson       35   19   17    4   2   5/9    55.6   1/1   100.0   7/8     2   0
Malcolm Brogdon        34   15    0    1   0   6/12   50.0   3/7    42.9   5/5     0   0
Zion Markkanen         14   10    0    2   1   4/4   100.0   1/1   100.0   1/1     0   0
Damian Towns           13    5    3    1   0   3/4    75.0   2/2   100.0   2/3     0   0
Domantas Doncic        13    0    0    1   0   0/1     0.0   0/1     0.0   0/0     0   0
Cole Simmons           13    7    3    1   2   4/10   40.0   0/4     0.0   1/2     0   0
Victor McCollum        13    3    3    1   1   0/1     0.0   0/0     0.0   0/0     0   1

TEAM: FG: 48/76 (63.2%), 3PT: 16/29 (55.2%), REB: 50 (13 off, 37 def), AST: 25, TO: 8

================================================================================
