================================================================================
                        FULL GAME - Team_061 vs Team_042                        
================================================================================

================================================================================
                       1ST QUARTER - Team_061 vs Team_042                       
================================================================================

[12:00] Team_061 possession (Score: 0-0)
Jayson Holiday loses control! Ball rolls out of bounds! TURNOVER! (dead ball)

[11:44] Team_042 possession (Score: 0-0)
Tyler Barrett drives, Brandon Russell stays with him. Tyler Barrett attempts a Dunk. Contested by Brandon Russell (4.4 feet, MAN). TYLER BARRETT MAKES IT! Assist: Dejounte Butler
Score: 0-2

[11:33] Team_061 possession (Score: 0-2)
Jayson Holiday loses control! Ball rolls out of bounds! TURNOVER! (dead ball)

[11:18] Team_042 possession (Score: 0-2)
Kristaps Parker attempts a 3Pt. Contested by Jayson Holiday (3.9 feet, MAN). KRISTAPS PARKER MAKES IT! Assist: Dejounte Butler
Score: 0-5

[11:00] Team_061 possession (Score: 0-5)
Draymond Banchero attempts a 3Pt. Contested by Tyler Barrett (4.1 feet, ZONE). Draymond Banchero misses. Rebound secured by Tyler Barrett.

[10:43] Team_042 possession (Score: 0-5)
Dejounte Butler attempts a Midrange. Contested by Michael Russell (3.9 feet, ZONE). Dejounte Butler misses. Rebound secured by Bam Sexton.

[10:27] Team_061 possession (Score: 0-5)
Jayson Holiday attempts a 3Pt. Contested by Tyler Barrett (3.8 feet, ZONE). Jayson Holiday misses. Rebound secured by Dejounte Butler.

[10:14] Team_042 possession (Score: 0-5)
Dejounte Butler drives and kicks out. FOUL! Shooting foul on Jayson Holiday. Kristaps Parker to the line for 2 free throws. [Team fouls: 1] (Jayson Holiday: 1 personal fouls)   FT 1/2: GOOD   FT 2/2: GOOD Kristaps Parker makes 2/2 from the line.
Score: 0-7

[10:00] Team_061 possession (Score: 0-7)
Jayson Holiday drives, Kristaps Parker stays with him. Jayson Holiday attempts a Dunk. Contested by Kristaps Parker (5.4 feet, MAN). JAYSON HOLIDAY MAKES IT! Assist: Draymond Banchero
Score: 2-7

[09:48] Team_042 possession (Score: 2-7)
Kristaps Parker attempts a 3Pt. Contested by Jayson Holiday (3.9 feet, MAN). Kristaps Parker misses. Rebound secured by Draymond Banchero.

[09:34] Team_061 possession (Score: 2-7)
Bam Sexton attempts a Layup. Contested by Dejounte Butler (4.0 feet, MAN). BAM SEXTON MAKES IT! Assist: Jayson Holiday
Score: 4-7

[09:24] Team_042 possession (Score: 4-7)
FOUL! Shooting foul on Brandon Russell. Tyler Barrett to the line for 3 free throws. [Team fouls: 2] (Brandon Russell: 1 personal fouls)   FT 1/3: MISS   FT 2/3: MISS   FT 3/3: GOOD Tyler Barrett makes 1/3 from the line.
Score: 4-8

[09:09] Team_061 possession (Score: 4-8)
Brandon Russell drives, Cade Dosunmu stays with him. Brandon Russell attempts a Dunk. Contested by Cade Dosunmu (4.1 feet, ZONE). BRANDON RUSSELL MAKES IT!
Score: 6-8

[08:54] Team_042 possession (Score: 6-8)
Dejounte Butler drives and kicks out. Cade Dosunmu attempts a 3Pt. Contested by Draymond Banchero (2.6 feet, MAN). Cade Dosunmu misses. Offensive rebound by Dejounte Butler! Dejounte Butler puts it back in!
Score: 6-10

[08:37] Team_061 possession (Score: 6-10)
Michael Russell attempts a Layup. Contested by Jarrett Sabonis (4.2 feet, MAN). MICHAEL RUSSELL MAKES IT!
Score: 8-10

[08:26] Team_042 possession (Score: 8-10)
Cade Dosunmu attempts a 3Pt. Contested by Bam Sexton (5.1 feet, ZONE). Cade Dosunmu misses. Rebound secured by Draymond Banchero.

[08:12] Team_061 possession (Score: 8-10)
Brandon Russell attempts a Layup. Contested by Cade Dosunmu (4.1 feet, ZONE). BRANDON RUSSELL MAKES IT!
Score: 10-10

[07:58] Team_042 possession (Score: 10-10)
Tyler Barrett drives to the basket... Tyler Barrett loses control! Ball rolls out of bounds! TURNOVER! (dead ball)

[07:45] Team_061 possession (Score: 10-10)
Jayson Holiday drives and kicks out. Michael Russell attempts a 3Pt. Contested by Tyler Barrett (3.4 feet, ZONE). MICHAEL RUSSELL MAKES IT! Assist: Draymond Banchero
Score: 13-10

[07:28] Team_042 possession (Score: 13-10)
Dejounte Butler attempts a Midrange. Contested by Jayson Holiday (4.2 feet, ZONE). Dejounte Butler misses. Rebound secured by Bam Sexton.

[07:11] Team_061 possession (Score: 13-10)
Draymond Banchero attempts a Midrange. Contested by Dejounte Butler (4.2 feet, ZONE). DRAYMOND BANCHERO MAKES IT! Assist: Jayson Holiday
Score: 15-10

[06:54] Team_042 possession (Score: 15-10)
Tyler Barrett throws a bad pass! Stolen by Brandon Russell! TURNOVER! (live ball)

[06:42] Team_061 possession (Score: 15-10)
Jayson Holiday attempts a 3Pt. Contested by Kristaps Parker (5.4 feet, ZONE). JAYSON HOLIDAY MAKES IT! Assist: Michael Russell
Score: 18-10

[06:31] Team_042 possession (Score: 18-10)
Tyler Barrett attempts a 3Pt. Contested by Brandon Russell (4.4 feet, ZONE). TYLER BARRETT MAKES IT! Assist: Cade Dosunmu
Score: 18-13

[06:14] Team_061 possession (Score: 18-13)
Brandon Russell attempts a Layup. Contested by Cade Dosunmu (4.1 feet, ZONE). Brandon Russell misses. Rebound secured by Cade Dosunmu.

[05:58] Team_042 possession (Score: 18-13)
Dejounte Butler drives to the basket... Dejounte Butler throws a bad pass! Stolen by Bam Sexton! TURNOVER! (live ball)

[05:42] Team_061 possession (Score: 18-13)
Bam Sexton drives and kicks out. Draymond Banchero attempts a Midrange. Contested by Cade Dosunmu (3.9 feet, MAN). Draymond Banchero misses. Rebound secured by Tyler Barrett.

[05:26] Team_042 possession (Score: 18-13)
FOUL! Shooting foul on Draymond Banchero. Cade Dosunmu to the line for 2 free throws. [Team fouls: 3] (Draymond Banchero: 1 personal fouls)   FT 1/2: GOOD   FT 2/2: GOOD Cade Dosunmu makes 2/2 from the line.
Score: 18-15

[05:13] Team_061 possession (Score: 18-15)
FOUL! Reach-in foul on Tyler Barrett during the drive. [Team fouls: 1] No free throws, side out. (Tyler Barrett: 1 personal fouls)

[04:59] Team_061 possession (Score: 18-15)
Jayson Holiday attempts a Midrange. Contested by Dejounte Butler (4.0 feet, ZONE). Jayson Holiday misses. Rebound secured by Cade Dosunmu.

[04:44] Team_042 possession (Score: 18-15)
Dejounte Butler attempts a Midrange. Contested by Bam Sexton (5.1 feet, MAN). Dejounte Butler misses. Rebound secured by Draymond Banchero.

[04:33] Team_061 possession (Score: 18-15)
Bam Sexton drives, picks up Dejounte Butler. Help arrives from Tyler Barrett! Bam Sexton attempts a Dunk. Contested by Tyler Barrett (4.1 feet, MAN). BAM SEXTON MAKES IT! Assist: Jayson Holiday
Score: 20-15

[04:18] Team_042 possession (Score: 20-15)
Dejounte Butler attempts a 3Pt. Contested by Bam Sexton (5.1 feet, MAN). Dejounte Butler misses. Rebound secured by Draymond Banchero.

[04:04] Team_061 possession (Score: 20-15)
Jayson Holiday attempts a 3Pt. Contested by Tyler Barrett (3.9 feet, ZONE). Jayson Holiday misses. Rebound secured by Cade Dosunmu.

[03:50] Team_042 possession (Score: 20-15)
Cade Dosunmu drives, picks up Draymond Banchero. Help arrives from Jayson Holiday! Cade Dosunmu attempts a Layup. Contested by Jayson Holiday (2.9 feet, ZONE). CADE DOSUNMU MAKES IT!
Score: 20-17

[03:36] Team_061 possession (Score: 20-17)
FOUL! Holding foul on Dejounte Butler. [Team fouls: 2] No free throws, side out. (Dejounte Butler: 1 personal fouls)

[03:17] Team_061 possession (Score: 20-17)
Draymond Banchero attempts a Layup. Contested by Cade Dosunmu (4.8 feet, ZONE). Draymond Banchero misses. Rebound secured by Tyler Barrett.

[03:05] Team_042 possession (Score: 20-17)
Tyler Barrett attempts a 3Pt. Contested by Brandon Russell (4.5 feet, MAN). Tyler Barrett misses. Rebound secured by Draymond Banchero.

[02:53] Team_061 possession (Score: 20-17)
Bam Sexton attempts a 3Pt. Contested by Dejounte Butler (4.3 feet, MAN). Bam Sexton misses. Rebound secured by Cade Dosunmu.

[02:42] Team_042 possession (Score: 20-17)
Dejounte Butler attempts a 3Pt. Contested by Bam Sexton (5.2 feet, MAN). Dejounte Butler misses. Offensive rebound by Cade Dosunmu! Cade Dosunmu's putback is no good. Rebound secured by Draymond Banchero.

[02:32] Team_061 possession (Score: 20-17)
Jayson Holiday attempts a 3Pt. Contested by Kristaps Parker (5.6 feet, MAN). Jayson Holiday misses. Rebound secured by Dejounte Butler.

[02:20] Team_042 possession (Score: 20-17)
Tyler Barrett drives, Draymond Banchero stays with him. Tyler Barrett attempts a Layup. Contested by Draymond Banchero (3.3 feet, ZONE). TYLER BARRETT MAKES IT!
Score: 20-19

[02:02] Team_061 possession (Score: 20-19)
Bam Sexton throws a bad pass out of bounds! TURNOVER! (dead ball)

[02:02] Substitution (Team_061): Jayson Holiday OUT → Gary Fox IN (stamina_rule2)

[02:02] Substitution (Team_061): Michael Russell OUT → Desmond Morant IN (stamina_rule2)

[02:02] Substitution (Team_061): Draymond Banchero OUT → Tim Durant IN (stamina_rule2)

[02:02] Substitution (Team_042): Tyler Barrett OUT → Khris George IN (stamina_rule2)

[02:02] Substitution (Team_042): Kristaps Parker OUT → Isaiah Randle IN (stamina_rule2)

[02:02] Substitution (Team_042): Jarrett Sabonis OUT → Gary Jackson IN (stamina_rule2)

[02:02] Substitution (Team_042): Dejounte Butler OUT → Allen Towns IN (stamina_rule2)

[02:02] Substitution (Team_042): Cade Dosunmu OUT → Lamelo Stewart IN (stamina_rule2)

[01:49] Team_042 possession (Score: 20-19)
Gary Jackson drives and kicks out. FOUL! Shooting foul on Desmond Morant. Gary Jackson to the line for 2 free throws. [Team fouls: 4] (Desmond Morant: 1 personal fouls)   FT 1/2: MISS   FT 2/2: MISS Gary Jackson makes 0/2 from the line. Rebound secured by Desmond Morant.

[01:33] Team_061 possession (Score: 20-19)
Bam Sexton attempts a 3Pt. Contested by Allen Towns (4.7 feet, MAN). Bam Sexton misses. Rebound secured by Allen Towns.

[01:22] Team_042 possession (Score: 20-19)
Isaiah Randle drives, picks up Tim Durant. Help arrives from Brandon Russell! Isaiah Randle attempts a Dunk. Contested by Brandon Russell (4.3 feet, ZONE). ISAIAH RANDLE MAKES IT!
Score: 20-21

[01:07] Team_061 possession (Score: 20-21)
Tim Durant drives and kicks out. Desmond Morant attempts a Midrange. Contested by Gary Jackson (4.6 feet, MAN). DESMOND MORANT MAKES IT! Assist: Gary Fox
Score: 22-21

[00:51] Team_042 possession (Score: 22-21)
Gary Jackson attempts a 3Pt. Contested by Desmond Morant (4.5 feet, MAN). Gary Jackson misses. FOUL! Loose ball foul on Desmond Morant during the rebound battle. [IN THE BONUS! 5 team fouls] Lamelo Stewart to the line for 2 free throws. (Desmond Morant: 2 personal fouls)   FT 1/2: GOOD   FT 2/2: GOOD Lamelo Stewart makes 2/2 from the line.
Score: 22-23

[00:37] Team_061 possession (Score: 22-23)
Tim Durant drives and kicks out. Tim Durant attempts a Midrange. Contested by Lamelo Stewart (4.2 feet, MAN). Tim Durant misses. FOUL! Loose ball foul on Lamelo Stewart during the rebound battle. [Team fouls: 3] No free throws, side out. (Lamelo Stewart: 1 personal fouls)

[00:23] Team_061 possession (Score: 22-23)
Tim Durant attempts a Midrange. Contested by Lamelo Stewart (4.7 feet, MAN). Tim Durant misses. Rebound secured by Lamelo Stewart.

[00:12] Team_042 possession (Score: 22-23)
Lamelo Stewart makes the Layup and draws the foul on Brandon Russell! And-1! Lamelo Stewart to the line for 1. [BONUS: 6 team fouls] (Brandon Russell: 2 personal fouls)   FT 1/1: GOOD Lamelo Stewart makes 1/1 from the line.
Score: 22-26

================================================================================
                              1ST QUARTER COMPLETE                              
================================================================================

1ST QUARTER SCORE: Team_061 22, Team_042 26

BOX SCORE:
================================================================================

Team_061
--------------------------------------------------------------------------------
Player                MIN  PTS  REB  AST  TO      FG   FG%      3P   3P%
--------------------------------------------------------------------------------
Jayson Holiday         10    5    0    3   0   2/6    33.3     0/0   0.0
Michael Russell        10    5    0    1   0   2/2   100.0     0/0   0.0
Bam Sexton             12    4    2    0   0   2/5    40.0     0/0   0.0
Brandon Russell        12    4    0    0   0   2/3    66.7     0/0   0.0
Desmond Morant          2    2    1    0   0   1/1   100.0     0/0   0.0
Gary Fox                2    0    0    1   0   0/0     0.0     0/0   0.0
Tim Durant              2    0    1    0   0   0/1     0.0     0/0   0.0

TEAM: FG: 10/21 (47.6%), 3PT: 1/7 (14.3%), REB: 9 (1 off, 8 def), AST: 7, TO: 3
TEAM FOULS: 6 [Team_042 in BONUS]


Team_042
--------------------------------------------------------------------------------
Player                MIN  PTS  REB  AST  TO      FG   FG%      3P   3P%
--------------------------------------------------------------------------------
Tyler Barrett          10    8    3    0   0   4/5    80.0     0/0   0.0
Kristaps Parker        10    5    0    0   0   2/3    66.7     0/0   0.0
Lamelo Stewart          2    5    1    0   0   2/2   100.0     0/0   0.0
Cade Dosunmu           10    4    4    1   0   2/3    66.7     0/0   0.0
Dejounte Butler        10    2    3    2   0   1/6    16.7     0/0   0.0
Draymond Banchero      10    2    6    2   0   1/3    33.3     0/0   0.0
Isaiah Randle           2    2    0    0   0   1/1   100.0     0/0   0.0
Gary Jackson            2    0    0    0   0   0/1     0.0     0/0   0.0
Allen Towns             2    0    1    0   0   0/0     0.0     0/0   0.0

TEAM: FG: 12/21 (57.1%), 3PT: 4/9 (44.4%), REB: 13 (2 off, 11 def), AST: 3, TO: 3
TEAM FOULS: 3

================================================================================

================================================================================
                       2ND QUARTER - Team_061 vs Team_042                       
================================================================================

[12:00] Team_061 possession (Score: 22-26)
Jayson Holiday attempts a 3Pt. Contested by Kristaps Parker (5.4 feet, MAN). JAYSON HOLIDAY MAKES IT! Assist: Draymond Banchero
Score: 25-26

[11:46] Team_042 possession (Score: 25-26)
Cade Dosunmu commits a violation (traveling/carry)! TURNOVER! (dead ball)

[11:46] Substitution (Team_061): Brandon Russell OUT → Evan Rose IN (stamina_rule2)

[11:33] Team_061 possession (Score: 25-26)
FOUL! Holding foul on Dejounte Butler. [Team fouls: 1] No free throws, side out. (Dejounte Butler: 1 personal fouls)

[11:23] Team_061 possession (Score: 25-26)
Bam Sexton attempts a 3Pt. Contested by Dejounte Butler (4.1 feet, MAN). Bam Sexton misses. Offensive rebound by Draymond Banchero! Draymond Banchero puts it back in!
Score: 27-26

[11:10] Team_042 possession (Score: 27-26)
Jarrett Sabonis attempts a 3Pt. Contested by Michael Russell (4.3 feet, ZONE). Jarrett Sabonis misses. Rebound secured by Michael Russell.

[10:55] Team_061 possession (Score: 27-26)
Jayson Holiday attempts a 3Pt. Contested by Tyler Barrett (3.9 feet, ZONE). Jayson Holiday misses. Offensive rebound by Michael Russell! Michael Russell puts it back in!
Score: 29-26

[10:45] Team_042 possession (Score: 29-26)
Cade Dosunmu attempts a Layup. Contested by Draymond Banchero (3.0 feet, MAN). CADE DOSUNMU MAKES IT!
Score: 29-28

[10:28] Team_061 possession (Score: 29-28)
Draymond Banchero attempts a Midrange. Contested by Cade Dosunmu (4.9 feet, MAN). Draymond Banchero misses. Rebound secured by Dejounte Butler.

[10:15] Team_042 possession (Score: 29-28)
Dejounte Butler attempts a 3Pt. Contested by Michael Russell (4.2 feet, ZONE). Dejounte Butler misses. Rebound secured by Bam Sexton.

[10:00] Team_061 possession (Score: 29-28)
Evan Rose attempts a 3Pt. Contested by Tyler Barrett (3.9 feet, ZONE). EVAN ROSE MAKES IT! Assist: Michael Russell
Score: 32-28

[09:44] Team_042 possession (Score: 32-28)
Dejounte Butler drives, Draymond Banchero stays with him. Dejounte Butler attempts a Dunk. Contested by Draymond Banchero (3.1 feet, ZONE). Dejounte Butler misses. Rebound secured by Draymond Banchero.

[09:30] Team_061 possession (Score: 32-28)
Draymond Banchero drives and kicks out. Bam Sexton attempts a 3Pt. Contested by Dejounte Butler (3.9 feet, MAN). BAM SEXTON MAKES IT! Assist: Michael Russell
Score: 35-28

[09:16] Team_042 possession (Score: 35-28)
Tyler Barrett attempts a 3Pt. Contested by Evan Rose (5.4 feet, MAN). Tyler Barrett misses. Rebound secured by Michael Russell.

[09:02] Team_061 possession (Score: 35-28)
Jayson Holiday attempts a 3Pt. Contested by Dejounte Butler (4.4 feet, ZONE). Jayson Holiday misses. Rebound secured by Dejounte Butler.

[08:50] Team_042 possession (Score: 35-28)
Jarrett Sabonis attempts a 3Pt. Contested by Michael Russell (4.6 feet, ZONE). JARRETT SABONIS MAKES IT! Assist: Cade Dosunmu
Score: 35-31

[08:36] Team_061 possession (Score: 35-31)
Bam Sexton attempts a Midrange. Contested by Dejounte Butler (4.4 feet, ZONE). Bam Sexton misses. Offensive rebound by Draymond Banchero! Draymond Banchero puts it back in!
Score: 37-31

[08:21] Team_042 possession (Score: 37-31)
FOUL! Reach-in foul on Bam Sexton during the drive. [Team fouls: 1] No free throws, side out. (Bam Sexton: 1 personal fouls)

[08:04] Team_042 possession (Score: 37-31)
Tyler Barrett attempts a 3Pt. Contested by Evan Rose (5.4 feet, MAN). Tyler Barrett misses. FOUL! Loose ball foul on Bam Sexton during the rebound battle. [Team fouls: 2] No free throws, side out. (Bam Sexton: 2 personal fouls)

[07:53] Team_042 possession (Score: 37-31)
Jarrett Sabonis attempts a 3Pt. Contested by Michael Russell (4.7 feet, MAN). Jarrett Sabonis misses. Rebound secured by Bam Sexton.

[07:35] Team_061 possession (Score: 37-31)
Michael Russell attempts a 3Pt. Contested by Tyler Barrett (4.2 feet, ZONE). MICHAEL RUSSELL MAKES IT! Assist: Bam Sexton
Score: 40-31

[07:22] Team_042 possession (Score: 40-31)
Jarrett Sabonis attempts a Midrange. Contested by Michael Russell (4.7 feet, ZONE). Jarrett Sabonis misses. Rebound secured by Draymond Banchero.

[07:05] Team_061 possession (Score: 40-31)
Evan Rose attempts a 3Pt. Contested by Tyler Barrett (4.3 feet, ZONE). Evan Rose misses. Rebound secured by Cade Dosunmu.

[06:46] Team_042 possession (Score: 40-31)
Tyler Barrett attempts a 3Pt. Contested by Evan Rose (5.3 feet, ZONE). Tyler Barrett misses. Rebound secured by Bam Sexton.

[06:29] Team_061 possession (Score: 40-31)
FOUL! Shooting foul on Cade Dosunmu. Evan Rose to the line for 2 free throws. [Team fouls: 2] (Cade Dosunmu: 1 personal fouls)   FT 1/2: GOOD   FT 2/2: GOOD Evan Rose makes 2/2 from the line.
Score: 42-31

[06:12] Team_042 possession (Score: 42-31)
Tyler Barrett attempts a Midrange. Contested by Evan Rose (5.3 feet, ZONE). Tyler Barrett misses. Rebound secured by Bam Sexton.

[05:58] Team_061 possession (Score: 42-31)
FOUL! Reach-in foul on Dejounte Butler during the drive. [Team fouls: 3] No free throws, side out. (Dejounte Butler: 2 personal fouls)

[05:45] Team_061 possession (Score: 42-31)
Michael Russell attempts a 3Pt. Contested by Jarrett Sabonis (4.9 feet, MAN). MICHAEL RUSSELL MAKES IT! Assist: Evan Rose
Score: 45-31

[05:32] Team_042 possession (Score: 45-31)
Tyler Barrett drives to the basket... Tyler Barrett commits a violation (traveling/carry)! TURNOVER! (dead ball)

[05:32] Substitution (Team_061): Jayson Holiday OUT → Gary Fox IN (stamina_rule2)

[05:32] Substitution (Team_061): Michael Russell OUT → Desmond Morant IN (stamina_rule2)

[05:32] Substitution (Team_061): Bam Sexton OUT → Stephen Towns IN (stamina_rule2)

[05:32] Substitution (Team_061): Draymond Banchero OUT → Tim Durant IN (stamina_rule2)

[05:32] Substitution (Team_042): Tyler Barrett OUT → Khris George IN (stamina_rule2)

[05:32] Substitution (Team_042): Kristaps Parker OUT → Isaiah Randle IN (stamina_rule2)

[05:32] Substitution (Team_042): Jarrett Sabonis OUT → Gary Jackson IN (stamina_rule2)

[05:32] Substitution (Team_042): Dejounte Butler OUT → Allen Towns IN (stamina_rule2)

[05:32] Substitution (Team_042): Cade Dosunmu OUT → Lamelo Stewart IN (stamina_rule2)

[05:18] Team_061 possession (Score: 45-31)
Desmond Morant drives, Gary Jackson stays with him. Desmond Morant attempts a Layup. Contested by Gary Jackson (4.9 feet, MAN). DESMOND MORANT MAKES IT!
Score: 47-31

[05:04] Team_042 possession (Score: 47-31)
Allen Towns throws a bad pass out of bounds! TURNOVER! (dead ball)

[04:51] Team_061 possession (Score: 47-31)
FOUL! Holding foul on Gary Jackson. [Team fouls: 4] No free throws, side out. (Gary Jackson: 1 personal fouls)

[04:39] Team_061 possession (Score: 47-31)
Desmond Morant attempts a 3Pt. Contested by Khris George (4.3 feet, ZONE). DESMOND MORANT MAKES IT! Assist: Stephen Towns
Score: 50-31

[04:24] Team_042 possession (Score: 50-31)
FOUL! Shooting foul on Evan Rose. Lamelo Stewart to the line for 2 free throws. [Team fouls: 3] (Evan Rose: 1 personal fouls)   FT 1/2: MISS   FT 2/2: GOOD Lamelo Stewart makes 1/2 from the line.
Score: 50-32

[04:08] Team_061 possession (Score: 50-32)
Desmond Morant attempts a Layup. Contested by Gary Jackson (4.9 feet, MAN). Desmond Morant misses. Offensive rebound by Stephen Towns! Stephen Towns kicks it out.

[03:54] Team_061 possession (Score: 50-32)
Desmond Morant attempts a Layup. Contested by Gary Jackson (4.9 feet, MAN). Desmond Morant misses. Rebound secured by Lamelo Stewart.

[03:43] Team_042 possession (Score: 50-32)
Isaiah Randle attempts a Layup. Wide open! Gary Fox is 6.1 feet away. [MAN] ISAIAH RANDLE MAKES IT!
Score: 50-34

[03:33] Team_061 possession (Score: 50-34)
Evan Rose attempts a Layup. Contested by Khris George (4.2 feet, MAN). EVAN ROSE MAKES IT! Assist: Desmond Morant
Score: 52-34

[03:21] Team_042 possession (Score: 52-34)
Isaiah Randle attempts a Layup. Wide open! Gary Fox is 6.1 feet away. [MAN] ISAIAH RANDLE MAKES IT!
Score: 52-36

[03:07] Team_061 possession (Score: 52-36)
Gary Fox attempts a 3Pt. Contested by Khris George (4.0 feet, ZONE). GARY FOX MAKES IT! Assist: Desmond Morant
Score: 55-36

[02:52] Team_042 possession (Score: 55-36)
Khris George attempts a 3Pt. Contested by Desmond Morant (5.2 feet, ZONE). Khris George misses. Rebound secured by Stephen Towns.

[02:40] Team_061 possession (Score: 55-36)
Desmond Morant attempts a 3Pt. Contested by Gary Jackson (4.9 feet, MAN). Desmond Morant misses. Offensive rebound by Tim Durant! Tim Durant puts it back in!
Score: 57-36

[02:26] Team_042 possession (Score: 57-36)
Khris George attempts a 3Pt. Contested by Desmond Morant (5.2 feet, ZONE). KHRIS GEORGE MAKES IT! Assist: Allen Towns
Score: 57-39

[02:15] Team_061 possession (Score: 57-39)
Tim Durant drives and kicks out. Desmond Morant attempts a Midrange. Contested by Gary Jackson (4.6 feet, ZONE). Desmond Morant misses. Rebound secured by Lamelo Stewart.

[02:01] Team_042 possession (Score: 57-39)
Lamelo Stewart makes the Dunk and draws the foul on Evan Rose! And-1! Lamelo Stewart to the line for 1. [Team fouls: 4] (Evan Rose: 2 personal fouls)   FT 1/1: GOOD Lamelo Stewart makes 1/1 from the line.
Score: 57-42

[01:50] Team_061 possession (Score: 57-42)
Desmond Morant drives, Allen Towns stays with him. Desmond Morant attempts a Dunk. Contested by Allen Towns (4.6 feet, ZONE). Desmond Morant misses. Rebound secured by Allen Towns.

[01:39] Team_042 possession (Score: 57-42)
Isaiah Randle attempts a 3Pt. Contested by Desmond Morant (4.6 feet, ZONE). Isaiah Randle misses. Rebound secured by Stephen Towns.

[01:25] Team_061 possession (Score: 57-42)
Tim Durant attempts a Midrange. Contested by Lamelo Stewart (4.7 feet, MAN). Tim Durant misses. Rebound secured by Lamelo Stewart.

[01:10] Team_042 possession (Score: 57-42)
Gary Jackson attempts a 3Pt. Contested by Desmond Morant (4.5 feet, ZONE). Gary Jackson misses. Offensive rebound by Allen Towns! Allen Towns kicks it out.

[00:54] Team_042 possession (Score: 57-42)
Lamelo Stewart drives, picks up Tim Durant. Help arrives from Evan Rose! Lamelo Stewart attempts a Dunk. Contested by Evan Rose (4.1 feet, ZONE). Lamelo Stewart misses. Rebound secured by Stephen Towns.

[00:39] Team_061 possession (Score: 57-42)
Stephen Towns attempts a Midrange. Contested by Allen Towns (4.6 feet, MAN). Stephen Towns misses. Rebound secured by Lamelo Stewart.

[00:25] Team_042 possession (Score: 57-42)
Gary Jackson attempts a 3Pt. Contested by Desmond Morant (4.5 feet, ZONE). GARY JACKSON MAKES IT! Assist: Allen Towns
Score: 57-45

[00:10] Team_061 possession (Score: 57-45)
Gary Fox throws a bad pass out of bounds! TURNOVER! (dead ball)

================================================================================
                              2ND QUARTER COMPLETE                              
================================================================================

2ND QUARTER SCORE: Team_061 35, Team_042 19

BOX SCORE:
================================================================================

Team_061
--------------------------------------------------------------------------------
Player                MIN  PTS  REB  AST  TO      FG   FG%      3P   3P%
--------------------------------------------------------------------------------
Michael Russell        17    8    3    2   0   3/3   100.0     0/0   0.0
Evan Rose              12    7    0    1   0   3/4    75.0     0/0   0.0
Desmond Morant          7    5    0    2   0   2/4    50.0     0/0   0.0
Draymond Banchero      17    4    4    1   0   2/3    66.7     0/0   0.0
Jayson Holiday         17    3    0    0   0   1/2    50.0     0/0   0.0
Bam Sexton             19    3    4    1   0   1/1   100.0     0/0   0.0
Gary Fox                7    3    0    0   0   1/1   100.0     0/0   0.0
Tim Durant              7    2    1    0   0   1/3    33.3     0/0   0.0
Stephen Towns           5    0    4    1   0   0/1     0.0     0/0   0.0

TEAM: FG: 14/22 (63.6%), 3PT: 9/11 (81.8%), REB: 16 (5 off, 11 def), AST: 8, TO: 1
TEAM FOULS: 4


Team_042
--------------------------------------------------------------------------------
Player                MIN  PTS  REB  AST  TO      FG   FG%      3P   3P%
--------------------------------------------------------------------------------
Lamelo Stewart          7    4    4    0   0   2/3    66.7     0/0   0.0
Isaiah Randle           7    4    0    0   0   2/3    66.7     0/0   0.0
Jarrett Sabonis        17    3    0    0   0   1/4    25.0     0/0   0.0
Khris George            7    3    0    0   0   1/2    50.0     0/0   0.0
Gary Jackson            7    3    0    0   0   1/1   100.0     0/0   0.0
Cade Dosunmu           17    2    2    1   0   1/1   100.0     0/0   0.0
Dejounte Butler        17    0    2    0   0   0/2     0.0     0/0   0.0
Tyler Barrett          17    0    0    0   0   0/3     0.0     0/0   0.0
Allen Towns             7    0    2    2   0   0/0     0.0     0/0   0.0

TEAM: FG: 8/19 (42.1%), 3PT: 3/10 (30.0%), REB: 10 (2 off, 8 def), AST: 3, TO: 3
TEAM FOULS: 4

================================================================================

================================================================================
                       3RD QUARTER - Team_061 vs Team_042                       
================================================================================

[12:00] Team_061 possession (Score: 57-45)
Brandon Russell attempts a Midrange. Contested by Dejounte Butler (3.8 feet, ZONE). BRANDON RUSSELL MAKES IT!
Score: 59-45

[11:46] Team_042 possession (Score: 59-45)
Dejounte Butler attempts a Midrange. Contested by Bam Sexton (5.1 feet, MAN). Dejounte Butler misses. Rebound secured by Draymond Banchero.

[11:27] Team_061 possession (Score: 59-45)
Brandon Russell attempts a Midrange. Contested by Tyler Barrett (3.6 feet, MAN). Brandon Russell misses. Offensive rebound by Draymond Banchero! Draymond Banchero puts it back in!
Score: 61-45

[11:15] Team_042 possession (Score: 61-45)
FOUL! Offensive foul on Jarrett Sabonis! Michael Russell drew the charge! [Team fouls: 1] (Jarrett Sabonis: 1 personal fouls) TURNOVER! (dead ball)

[11:03] Team_061 possession (Score: 61-45)
Jayson Holiday attempts a 3Pt. Contested by Tyler Barrett (3.8 feet, ZONE). Jayson Holiday misses. Rebound secured by Dejounte Butler.

[10:49] Team_042 possession (Score: 61-45)
Cade Dosunmu makes the Layup and draws the foul on Draymond Banchero! And-1! Cade Dosunmu to the line for 1. [Team fouls: 1] (Draymond Banchero: 1 personal fouls)   FT 1/1: MISS Cade Dosunmu makes 0/1 from the line. Rebound secured by Michael Russell.
Score: 61-47

[10:34] Team_061 possession (Score: 61-47)
Draymond Banchero attempts a Midrange. Contested by Cade Dosunmu (4.6 feet, MAN). Draymond Banchero misses. Rebound secured by Cade Dosunmu.

[10:21] Team_042 possession (Score: 61-47)
Jarrett Sabonis attempts a Midrange. Contested by Michael Russell (4.1 feet, MAN). Jarrett Sabonis misses. Rebound secured by Draymond Banchero.

[10:09] Team_061 possession (Score: 61-47)
Michael Russell attempts a 3Pt. Contested by Tyler Barrett (3.7 feet, ZONE). Michael Russell misses. Rebound secured by Dejounte Butler.

[09:54] Team_042 possession (Score: 61-47)
Cade Dosunmu attempts a Midrange. Contested by Draymond Banchero (2.9 feet, MAN). Cade Dosunmu misses. Rebound secured by Bam Sexton.

[09:42] Team_061 possession (Score: 61-47)
FOUL! Shooting foul on Cade Dosunmu. Draymond Banchero to the line for 2 free throws. [Team fouls: 2] (Cade Dosunmu: 1 personal fouls)   FT 1/2: MISS   FT 2/2: GOOD Draymond Banchero makes 1/2 from the line.
Score: 62-47

[09:31] Team_042 possession (Score: 62-47)
Kristaps Parker drives, Jayson Holiday stays with him. Kristaps Parker attempts a Dunk. Contested by Jayson Holiday (3.9 feet, MAN). KRISTAPS PARKER MAKES IT!
Score: 62-49

[09:18] Team_061 possession (Score: 62-49)
Jayson Holiday attempts a Layup. Contested by Kristaps Parker (5.4 feet, MAN). JAYSON HOLIDAY MAKES IT! Assist: Draymond Banchero
Score: 64-49

[09:05] Team_042 possession (Score: 64-49)
Cade Dosunmu drives, picks up Draymond Banchero. Help arrives from Jayson Holiday! Cade Dosunmu attempts a Dunk. Contested by Jayson Holiday (2.9 feet, ZONE). CADE DOSUNMU MAKES IT! Assist: Kristaps Parker
Score: 64-51

[08:48] Team_061 possession (Score: 64-51)
FOUL! Holding foul on Tyler Barrett. [Team fouls: 3] No free throws, side out. (Tyler Barrett: 1 personal fouls)

[08:32] Team_061 possession (Score: 64-51)
Michael Russell attempts a Midrange. Contested by Jarrett Sabonis (4.2 feet, ZONE). Michael Russell misses. Rebound secured by Tyler Barrett.

[08:21] Team_042 possession (Score: 64-51)
Tyler Barrett attempts a 3Pt. Contested by Brandon Russell (4.4 feet, MAN). TYLER BARRETT MAKES IT! Assist: Kristaps Parker
Score: 64-54

[08:06] Team_061 possession (Score: 64-54)
Jayson Holiday drives and kicks out. Jayson Holiday attempts a 3Pt. Contested by Kristaps Parker (5.0 feet, MAN). JAYSON HOLIDAY MAKES IT! Assist: Draymond Banchero
Score: 67-54

[07:52] Team_042 possession (Score: 67-54)
Jarrett Sabonis attempts a 3Pt. Contested by Brandon Russell (4.3 feet, ZONE). JARRETT SABONIS MAKES IT! Assist: Cade Dosunmu
Score: 67-57

[07:41] Team_061 possession (Score: 67-57)
Bam Sexton makes the Layup and draws the foul on Tyler Barrett! And-1! Bam Sexton to the line for 1. [Team fouls: 4] (Tyler Barrett: 2 personal fouls)   FT 1/1: GOOD Bam Sexton makes 1/1 from the line.
Score: 70-57

[07:32] Team_042 possession (Score: 70-57)
Jarrett Sabonis attempts a 3Pt. Contested by Michael Russell (4.1 feet, MAN). Jarrett Sabonis misses. Rebound secured by Draymond Banchero.

[07:20] Team_061 possession (Score: 70-57)
Brandon Russell drives to the basket... Brandon Russell commits a violation (traveling/carry)! TURNOVER! (dead ball)

[07:04] Team_042 possession (Score: 70-57)
Kristaps Parker attempts a 3Pt. Contested by Brandon Russell (3.8 feet, ZONE). Kristaps Parker misses. Rebound secured by Bam Sexton.

[06:53] Team_061 possession (Score: 70-57)
Brandon Russell attempts a 3Pt. Contested by Tyler Barrett (3.6 feet, ZONE). Brandon Russell misses. Rebound secured by Cade Dosunmu.

[06:36] Team_042 possession (Score: 70-57)
Kristaps Parker attempts a 3Pt. Contested by Jayson Holiday (3.9 feet, MAN). KRISTAPS PARKER MAKES IT! Assist: Dejounte Butler
Score: 70-60

[06:20] Team_061 possession (Score: 70-60)
Jayson Holiday attempts a 3Pt. Contested by Tyler Barrett (3.8 feet, ZONE). Jayson Holiday misses. Rebound secured by Dejounte Butler.

[06:02] Team_042 possession (Score: 70-60)
Cade Dosunmu drives, picks up Draymond Banchero. Help arrives from Jayson Holiday! Cade Dosunmu attempts a Dunk. Contested by Jayson Holiday (2.9 feet, ZONE). CADE DOSUNMU MAKES IT! Assist: Dejounte Butler
Score: 70-62

[05:46] Team_061 possession (Score: 70-62)
Jayson Holiday attempts a 3Pt. Contested by Kristaps Parker (5.4 feet, MAN). Jayson Holiday misses. Rebound secured by Cade Dosunmu.

[05:32] Team_042 possession (Score: 70-62)
Kristaps Parker attempts a 3Pt. Contested by Brandon Russell (3.8 feet, ZONE). Kristaps Parker misses. Rebound secured by Michael Russell.

[05:18] Team_061 possession (Score: 70-62)
Bam Sexton attempts a 3Pt. Contested by Tyler Barrett (3.9 feet, ZONE). Bam Sexton misses. Rebound secured by Tyler Barrett.

[05:06] Team_042 possession (Score: 70-62)
Tyler Barrett attempts a Layup. Contested by Draymond Banchero (3.1 feet, ZONE). Tyler Barrett misses. Rebound secured by Michael Russell.

[04:51] Team_061 possession (Score: 70-62)
Michael Russell attempts a 3Pt. Contested by Jarrett Sabonis (4.2 feet, MAN). Michael Russell misses. Rebound secured by Tyler Barrett.

[04:35] Team_042 possession (Score: 70-62)
Kristaps Parker attempts a Layup. BLOCKED BY DRAYMOND BANCHERO! Ball deflects out of bounds off Kristaps Parker.

[04:22] Team_061 possession (Score: 70-62)
Jayson Holiday drives and kicks out. Draymond Banchero attempts a Midrange. Contested by Jarrett Sabonis (4.0 feet, ZONE). DRAYMOND BANCHERO MAKES IT!
Score: 72-62

[04:06] Team_042 possession (Score: 72-62)
Tyler Barrett attempts a 3Pt. Contested by Brandon Russell (4.4 feet, ZONE). Tyler Barrett misses. Rebound secured by Michael Russell.

[03:52] Team_061 possession (Score: 72-62)
Jayson Holiday drives, Cade Dosunmu stays with him. Jayson Holiday attempts a Layup. Contested by Cade Dosunmu (4.5 feet, ZONE). Jayson Holiday misses. Rebound secured by Dejounte Butler.

[03:36] Team_042 possession (Score: 72-62)
Cade Dosunmu loses the ball! Stripped by Draymond Banchero! TURNOVER! (live ball)

[03:20] Team_061 possession (Score: 72-62)
FOUL! Reach-in foul on Cade Dosunmu during the drive. [IN THE BONUS! 5 team fouls] Bam Sexton to the line for 2 free throws. (Cade Dosunmu: 2 personal fouls)   FT 1/2: GOOD   FT 2/2: GOOD Bam Sexton makes 2/2 from the line.
Score: 74-62

[03:04] Team_042 possession (Score: 74-62)
Tyler Barrett attempts a 3Pt. Contested by Brandon Russell (4.5 feet, MAN). Tyler Barrett misses. Offensive rebound by Cade Dosunmu! Cade Dosunmu puts it back in!
Score: 74-64

[02:52] Team_061 possession (Score: 74-64)
Bam Sexton attempts a 3Pt. Contested by Tyler Barrett (4.1 feet, ZONE). Bam Sexton misses. Rebound secured by Tyler Barrett.

[02:37] Team_042 possession (Score: 74-64)
Tyler Barrett drives, Brandon Russell stays with him. Tyler Barrett attempts a Dunk. Contested by Brandon Russell (4.5 feet, MAN). TYLER BARRETT MAKES IT!
Score: 74-66

[02:19] Team_061 possession (Score: 74-66)
Michael Russell drives, picks up Cade Dosunmu. Help arrives from Tyler Barrett! Michael Russell attempts a Layup. Contested by Tyler Barrett (4.6 feet, ZONE). Michael Russell misses. Rebound secured by Dejounte Butler.

[02:04] Team_042 possession (Score: 74-66)
Tyler Barrett attempts a Midrange. Contested by Jayson Holiday (4.8 feet, ZONE). Tyler Barrett misses. Offensive rebound by Dejounte Butler! Dejounte Butler's putback is no good. Rebound secured by Bam Sexton.

[01:50] Team_061 possession (Score: 74-66)
Michael Russell attempts a 3Pt. Contested by Jarrett Sabonis (4.5 feet, MAN). Michael Russell misses. Rebound secured by Tyler Barrett.

[01:37] Team_042 possession (Score: 74-66)
Jarrett Sabonis attempts a Midrange. Contested by Michael Russell (4.5 feet, MAN). Jarrett Sabonis misses. Rebound secured by Bam Sexton.

[01:24] Team_061 possession (Score: 74-66)
Brandon Russell attempts a 3Pt. Contested by Tyler Barrett (4.0 feet, ZONE). BRANDON RUSSELL MAKES IT! Assist: Bam Sexton
Score: 77-66

[01:07] Team_042 possession (Score: 77-66)
Kristaps Parker attempts a 3Pt. Contested by Brandon Russell (4.1 feet, ZONE). Kristaps Parker misses. Rebound secured by Bam Sexton.

[00:57] Team_061 possession (Score: 77-66)
Draymond Banchero attempts a Midrange. Contested by Cade Dosunmu (5.1 feet, MAN). Draymond Banchero misses. Rebound secured by Cade Dosunmu.

[00:42] Team_042 possession (Score: 77-66)
Cade Dosunmu drives, Draymond Banchero stays with him. Cade Dosunmu attempts a Dunk. Contested by Draymond Banchero (3.3 feet, ZONE). CADE DOSUNMU MAKES IT!
Score: 77-68

[00:29] Team_061 possession (Score: 77-68)
Bam Sexton attempts a 3Pt. Contested by Dejounte Butler (4.6 feet, MAN). Bam Sexton misses. Rebound secured by Cade Dosunmu.

[00:14] Team_042 possession (Score: 77-68)
Dejounte Butler drives, Draymond Banchero stays with him. Dejounte Butler attempts a Layup. Contested by Draymond Banchero (3.3 feet, ZONE). DEJOUNTE BUTLER MAKES IT!
Score: 77-70

[00:03] Team_061 possession (Score: 77-70)
Jayson Holiday drives, Cade Dosunmu stays with him. Jayson Holiday attempts a Dunk. Contested by Cade Dosunmu (5.0 feet, ZONE). Jayson Holiday misses. Offensive rebound by Draymond Banchero! Draymond Banchero's putback is no good. Rebound secured by Cade Dosunmu.

================================================================================
                              3RD QUARTER COMPLETE                              
================================================================================

3RD QUARTER SCORE: Team_061 20, Team_042 25

BOX SCORE:
================================================================================

Team_061
--------------------------------------------------------------------------------
Player                MIN  PTS  REB  AST  TO      FG   FG%      3P   3P%
--------------------------------------------------------------------------------
Cade Dosunmu           29    8    7    1   0   4/6    66.7     0/0   0.0
Brandon Russell        25    5    0    0   0   2/3    66.7     0/0   0.0
Draymond Banchero      29    5    4    2   0   3/5    60.0     0/0   0.0
Jayson Holiday         29    5    0    0   0   2/7    28.6     0/0   0.0
Bam Sexton             31    5    5    1   0   2/5    40.0     0/0   0.0
Michael Russell        29    0    4    0   0   0/5     0.0     0/0   0.0

TEAM: FG: 9/25 (36.0%), 3PT: 1/11 (9.1%), REB: 13 (2 off, 11 def), AST: 3, TO: 1
TEAM FOULS: 1


Team_042
--------------------------------------------------------------------------------
Player                MIN  PTS  REB  AST  TO      FG   FG%      3P   3P%
--------------------------------------------------------------------------------
Kristaps Parker        29    5    0    2   0   2/6    33.3     0/0   0.0
Tyler Barrett          29    5    5    0   0   2/5    40.0     0/0   0.0
Jarrett Sabonis        29    3    0    0   0   1/4    25.0     0/0   0.0
Dejounte Butler        29    2    5    2   0   1/2    50.0     0/0   0.0

TEAM: FG: 10/23 (43.5%), 3PT: 4/9 (44.4%), REB: 17 (2 off, 15 def), AST: 5, TO: 2
TEAM FOULS: 5 [Team_061 in BONUS]

================================================================================

================================================================================
                       4TH QUARTER - Team_061 vs Team_042                       
================================================================================

[12:00] Team_061 possession (Score: 77-70)
Michael Russell attempts a 3Pt. Contested by Jarrett Sabonis (4.5 feet, MAN). MICHAEL RUSSELL MAKES IT! Assist: Bam Sexton
Score: 80-70

[11:45] Team_042 possession (Score: 80-70)
Cade Dosunmu attempts a Midrange. Contested by Draymond Banchero (3.2 feet, MAN). Cade Dosunmu misses. Rebound secured by Bam Sexton.

[11:33] Team_061 possession (Score: 80-70)
Michael Russell makes the Layup and draws the foul on Cade Dosunmu! And-1! Michael Russell to the line for 1. [Team fouls: 1] (Cade Dosunmu: 1 personal fouls)   FT 1/1: GOOD Michael Russell makes 1/1 from the line.
Score: 83-70

[11:22] Team_042 possession (Score: 83-70)
Kristaps Parker attempts a Midrange. Contested by Jayson Holiday (4.3 feet, ZONE). KRISTAPS PARKER MAKES IT! Assist: Jarrett Sabonis
Score: 83-72

[11:04] Team_061 possession (Score: 83-72)
Bam Sexton attempts a Midrange. Contested by Dejounte Butler (4.5 feet, MAN). Bam Sexton misses. Offensive rebound by Michael Russell! Michael Russell kicks it out.

[10:46] Team_061 possession (Score: 83-72)
FOUL! Shooting foul on Jarrett Sabonis. Bam Sexton to the line for 2 free throws. [Team fouls: 2] (Jarrett Sabonis: 1 personal fouls)   FT 1/2: GOOD   FT 2/2: GOOD Bam Sexton makes 2/2 from the line.
Score: 85-72

[10:27] Team_042 possession (Score: 85-72)
FOUL! Shooting foul on Draymond Banchero. Cade Dosunmu to the line for 2 free throws. [Team fouls: 1] (Draymond Banchero: 1 personal fouls)   FT 1/2: GOOD   FT 2/2: GOOD Cade Dosunmu makes 2/2 from the line.
Score: 85-74

[10:12] Team_061 possession (Score: 85-74)
FOUL! Shooting foul on Tyler Barrett. Michael Russell to the line for 3 free throws. [Team fouls: 3] (Tyler Barrett: 1 personal fouls)   FT 1/3: GOOD   FT 2/3: GOOD   FT 3/3: MISS Michael Russell makes 2/3 from the line. Offensive rebound by Draymond Banchero! Draymond Banchero's putback is no good.
Score: 87-74

[09:54] Team_042 possession (Score: 87-74)
Cade Dosunmu drives and kicks out. Cade Dosunmu attempts a Midrange. Contested by Draymond Banchero (3.2 feet, MAN). Cade Dosunmu misses. Offensive rebound by Cade Dosunmu! Cade Dosunmu puts it back in!
Score: 87-76

[09:37] Team_061 possession (Score: 87-76)
Jayson Holiday attempts a Midrange. Contested by Kristaps Parker (5.9 feet, MAN). Jayson Holiday misses. Offensive rebound by Draymond Banchero! Draymond Banchero puts it back in!
Score: 89-76

[09:21] Team_042 possession (Score: 89-76)
Cade Dosunmu drives, Draymond Banchero stays with him. Cade Dosunmu attempts a Layup. Contested by Draymond Banchero (3.4 feet, ZONE). CADE DOSUNMU MAKES IT!
Score: 89-78

[09:09] Team_061 possession (Score: 89-78)
FOUL! Shooting foul on Jarrett Sabonis. Michael Russell to the line for 3 free throws. [Team fouls: 4] (Jarrett Sabonis: 2 personal fouls)   FT 1/3: GOOD   FT 2/3: GOOD   FT 3/3: GOOD Michael Russell makes 3/3 from the line.
Score: 92-78

[08:51] Team_042 possession (Score: 92-78)
Jarrett Sabonis attempts a 3Pt. Contested by Brandon Russell (4.8 feet, ZONE). Jarrett Sabonis misses. Offensive rebound by Dejounte Butler! Dejounte Butler's putback is no good. Offensive rebound by Cade Dosunmu! Cade Dosunmu kicks it out.

[08:33] Team_042 possession (Score: 92-78)
Kristaps Parker attempts a 3Pt. Contested by Brandon Russell (4.4 feet, ZONE). Kristaps Parker misses. Rebound secured by Bam Sexton.

[08:20] Team_061 possession (Score: 92-78)
Jayson Holiday attempts a 3Pt. Contested by Tyler Barrett (4.5 feet, ZONE). Jayson Holiday misses. Rebound secured by Cade Dosunmu.

[08:11] Team_042 possession (Score: 92-78)
Jarrett Sabonis loses control! Ball rolls out of bounds! TURNOVER! (dead ball)

[08:11] Substitution (Team_061): Brandon Russell OUT → Evan Rose IN (stamina_rule2)

[08:11] Substitution (Team_061): Jayson Holiday OUT → Gary Fox IN (stamina_rule2)

[08:11] Substitution (Team_061): Michael Russell OUT → Desmond Morant IN (stamina_rule2)

[08:11] Substitution (Team_061): Bam Sexton OUT → Stephen Towns IN (stamina_rule2)

[08:11] Substitution (Team_061): Draymond Banchero OUT → Tim Durant IN (stamina_rule2)

[08:11] Substitution (Team_042): Tyler Barrett OUT → Khris George IN (stamina_rule2)

[08:11] Substitution (Team_042): Kristaps Parker OUT → Isaiah Randle IN (stamina_rule2)

[08:11] Substitution (Team_042): Jarrett Sabonis OUT → Gary Jackson IN (stamina_rule2)

[08:11] Substitution (Team_042): Dejounte Butler OUT → Allen Towns IN (stamina_rule2)

[08:11] Substitution (Team_042): Cade Dosunmu OUT → Lamelo Stewart IN (stamina_rule2)

[07:53] Team_061 possession (Score: 92-78)
Stephen Towns attempts a Midrange. Contested by Isaiah Randle (5.4 feet, ZONE). Stephen Towns misses. Rebound secured by Gary Jackson.

[07:36] Team_042 possession (Score: 92-78)
FOUL! Shooting foul on Tim Durant. Gary Jackson to the line for 2 free throws. [Team fouls: 2] (Tim Durant: 1 personal fouls)   FT 1/2: MISS   FT 2/2: MISS Gary Jackson makes 0/2 from the line. Rebound secured by Tim Durant.

[07:25] Team_061 possession (Score: 92-78)
Stephen Towns drives, Allen Towns stays with him. Stephen Towns attempts a Dunk. Contested by Allen Towns (4.6 feet, MAN). Stephen Towns misses. FOUL! Loose ball foul on Gary Jackson during the rebound battle. [IN THE BONUS! 5 team fouls] Stephen Towns to the line for 2 free throws. (Gary Jackson: 1 personal fouls)   FT 1/2: GOOD   FT 2/2: GOOD Stephen Towns makes 2/2 from the line.
Score: 94-78

[07:09] Team_042 possession (Score: 94-78)
Gary Jackson loses control! Ball rolls out of bounds! TURNOVER! (dead ball)

[06:52] Team_061 possession (Score: 94-78)
Desmond Morant drives, Gary Jackson stays with him. Desmond Morant attempts a Dunk. Contested by Gary Jackson (4.9 feet, MAN). DESMOND MORANT MAKES IT! Assist: Tim Durant
Score: 96-78

[06:36] Team_042 possession (Score: 96-78)
Isaiah Randle attempts a 3Pt. Wide open! Gary Fox is 6.1 feet away. [MAN] ISAIAH RANDLE MAKES IT! Assist: Allen Towns
Score: 96-81

[06:17] Team_061 possession (Score: 96-81)
Gary Fox attempts a 3Pt. Contested by Khris George (4.0 feet, ZONE). GARY FOX MAKES IT! Assist: Evan Rose
Score: 99-81

[06:02] Team_042 possession (Score: 99-81)
Isaiah Randle attempts a 3Pt. Wide open! Gary Fox is 6.1 feet away. [MAN] Isaiah Randle misses. Rebound secured by Tim Durant.

[05:44] Team_061 possession (Score: 99-81)
Desmond Morant drives to the basket... Desmond Morant commits a violation (traveling/carry)! TURNOVER! (dead ball)

[05:31] Team_042 possession (Score: 99-81)
Lamelo Stewart attempts a 3Pt. Contested by Desmond Morant (4.4 feet, ZONE). LAMELO STEWART MAKES IT! Assist: Gary Jackson
Score: 99-84

[05:17] Team_061 possession (Score: 99-84)
Stephen Towns drives and kicks out. Evan Rose attempts a Midrange. Contested by Khris George (4.0 feet, MAN). Evan Rose misses. FOUL! Loose ball foul on Gary Jackson during the rebound battle. [IN THE BONUS! 6 team fouls] Tim Durant to the line for 2 free throws. (Gary Jackson: 2 personal fouls)   FT 1/2: MISS   FT 2/2: GOOD Tim Durant makes 1/2 from the line.
Score: 100-84

[05:03] Team_042 possession (Score: 100-84)
Isaiah Randle loses the ball! Stripped by Gary Fox! TURNOVER! (live ball)

[04:50] Team_061 possession (Score: 100-84)
Evan Rose drives, picks up Allen Towns. Help arrives from Khris George! Evan Rose attempts a Layup. Contested by Khris George (4.5 feet, ZONE). Evan Rose misses. Rebound secured by Allen Towns.

[04:34] Team_042 possession (Score: 100-84)
Gary Jackson attempts a 3Pt. Contested by Desmond Morant (4.5 feet, MAN). Gary Jackson misses. FOUL! Loose ball foul on Stephen Towns during the rebound battle. [Team fouls: 3] No free throws, side out. (Stephen Towns: 1 personal fouls)

[04:15] Team_042 possession (Score: 100-84)
Allen Towns drives, picks up Tim Durant. Help arrives from Evan Rose! Allen Towns attempts a Dunk. Contested by Evan Rose (4.7 feet, ZONE). ALLEN TOWNS MAKES IT! Assist: Khris George
Score: 100-86

[04:03] Team_061 possession (Score: 100-86)
Tim Durant attempts a 3Pt. Contested by Lamelo Stewart (4.7 feet, MAN). TIM DURANT MAKES IT! Assist: Desmond Morant
Score: 103-86

[03:50] Team_042 possession (Score: 103-86)
FOUL! Reach-in foul on Evan Rose during the drive. [Team fouls: 4] No free throws, side out. (Evan Rose: 1 personal fouls)

[03:31] Team_042 possession (Score: 103-86)
Allen Towns drives, Stephen Towns stays with him. Allen Towns attempts a Dunk. Contested by Stephen Towns (5.4 feet, MAN). ALLEN TOWNS MAKES IT! Assist: Khris George
Score: 103-88

[03:15] Team_061 possession (Score: 103-88)
Gary Fox attempts a 3Pt. Contested by Khris George (4.0 feet, ZONE). Gary Fox misses. Rebound secured by Allen Towns.

[03:00] Team_042 possession (Score: 103-88)
Khris George drives to the basket... Khris George commits a violation (traveling/carry)! TURNOVER! (dead ball)

[02:47] Team_061 possession (Score: 103-88)
Tim Durant attempts a Midrange. Contested by Lamelo Stewart (4.7 feet, MAN). Tim Durant misses. Rebound secured by Lamelo Stewart.

[02:35] Team_042 possession (Score: 103-88)
Isaiah Randle attempts a 3Pt. Wide open! Gary Fox is 6.1 feet away. [MAN] ISAIAH RANDLE MAKES IT!
Score: 103-91

[02:17] Team_061 possession (Score: 103-91)
FOUL! Holding foul on Isaiah Randle. [IN THE BONUS! 7 team fouls] Gary Fox to the line for 2 free throws. (Isaiah Randle: 1 personal fouls)   FT 1/2: GOOD   FT 2/2: GOOD Gary Fox makes 2/2 from the line.
Score: 105-91

[02:00] Team_042 possession (Score: 105-91)
Gary Jackson attempts a Layup. Contested by Tim Durant (4.2 feet, ZONE). GARY JACKSON MAKES IT! Assist: Isaiah Randle
Score: 105-93

[01:45] Team_061 possession (Score: 105-93)
Gary Fox loses the ball! Stripped by Isaiah Randle! TURNOVER! (live ball)

[01:31] Team_042 possession (Score: 105-93)
Khris George attempts a 3Pt. Contested by Desmond Morant (5.2 feet, ZONE). Khris George misses. Rebound secured by Desmond Morant.

[01:12] Team_061 possession (Score: 105-93)
Tim Durant drives, Lamelo Stewart stays with him. Tim Durant attempts a Layup. Contested by Lamelo Stewart (4.7 feet, MAN). TIM DURANT MAKES IT! Assist: Desmond Morant
Score: 107-93

[00:55] Team_042 possession (Score: 107-93)
Gary Jackson attempts a Layup. BLOCKED BY DESMOND MORANT! Ball goes out off Desmond Morant. Gary Jackson's ball!

[00:40] Team_042 possession (Score: 107-93)
Gary Jackson attempts a 3Pt. Contested by Desmond Morant (4.5 feet, MAN). Gary Jackson misses. Offensive rebound by Allen Towns! Allen Towns kicks it out.

[00:26] Team_042 possession (Score: 107-93)
Isaiah Randle attempts a 3Pt. Wide open! Gary Fox is 6.1 feet away. [MAN] Isaiah Randle misses. Rebound secured by Tim Durant.

[00:16] Team_061 possession (Score: 107-93)
Tim Durant throws a bad pass out of bounds! TURNOVER! (dead ball)

[00:04] Team_042 possession (Score: 107-93)
Allen Towns attempts a 3Pt. Contested by Desmond Morant (5.1 feet, ZONE). Allen Towns misses. Rebound secured by Stephen Towns.

================================================================================
                              4TH QUARTER COMPLETE                              
================================================================================

4TH QUARTER SCORE: Team_061 30, Team_042 23

BOX SCORE:
================================================================================

Team_061
--------------------------------------------------------------------------------
Player                MIN  PTS  REB  AST  TO      FG   FG%      3P   3P%
--------------------------------------------------------------------------------
Michael Russell        33    9    1    0   0   3/4    75.0     0/0   0.0
Tim Durant             15    6    3    1   0   3/4    75.0     0/0   0.0
Gary Fox               15    5    0    0   0   2/3    66.7     0/0   0.0
Bam Sexton             35    2    2    1   0   1/1   100.0     0/0   0.0
Draymond Banchero      33    2    2    0   0   1/1   100.0     0/0   0.0
Stephen Towns          13    2    1    0   0   1/2    50.0     0/0   0.0
Desmond Morant         15    2    1    2   0   1/1   100.0     0/0   0.0
Jayson Holiday         33    0    0    0   0   0/1     0.0     0/0   0.0
Evan Rose              20    0    0    1   0   0/1     0.0     0/0   0.0

TEAM: FG: 12/18 (66.7%), 3PT: 4/7 (57.1%), REB: 9 (2 off, 7 def), AST: 5, TO: 3
TEAM FOULS: 4


Team_042
--------------------------------------------------------------------------------
Player                MIN  PTS  REB  AST  TO      FG   FG%      3P   3P%
--------------------------------------------------------------------------------
Cade Dosunmu           33    6    3    0   0   3/4    75.0     0/0   0.0
Isaiah Randle          15    6    0    1   0   2/4    50.0     0/0   0.0
Allen Towns            15    4    3    1   0   2/3    66.7     0/0   0.0
Lamelo Stewart         15    3    2    0   0   1/1   100.0     0/0   0.0
Kristaps Parker        33    2    0    0   0   1/2    50.0     0/0   0.0
Gary Jackson           15    2    1    1   0   1/2    50.0     0/0   0.0
Jarrett Sabonis        33    0    0    1   0   0/0     0.0     0/0   0.0
Khris George           15    0    0    2   0   0/1     0.0     0/0   0.0

TEAM: FG: 10/17 (58.8%), 3PT: 3/8 (37.5%), REB: 10 (4 off, 6 def), AST: 6, TO: 4
TEAM FOULS: 7 [Team_061 in BONUS]

================================================================================

================================================================================
                               FULL GAME COMPLETE                               
================================================================================

FINAL SCORE: Team_061 107, Team_042 93

SCORING BY QUARTER:
--------------------------------------------------------------------------------
Team                     Q1     Q2     Q3     Q4    FINAL
--------------------------------------------------------------------------------
Team_061                 22     35     20     30      107
Team_042                 26     19     25     23       93
--------------------------------------------------------------------------------

FULL GAME BOX SCORE:
================================================================================

Team_061
--------------------------------------------------------------------------------
Player                MIN  PTS  REB  AST  TO      FG   FG%      3P   3P%      FT STL BLK
--------------------------------------------------------------------------------
Bam Sexton             35   14   13    3   1   7/13   53.8   1/6    16.7   5/5     1   0
Jayson Holiday         33   13    0    3   2   9/20   45.0   3/11   27.3   0/0     0   0
Michael Russell        33   22    8    3   0   6/12   50.0   4/8    50.0   6/7     0   0
Draymond Banchero      33   13   16    5   0   3/8    37.5   0/1     0.0   1/2     1   1
Brandon Russell        29    9    0    0   1   5/7    71.4   1/2    50.0   0/0     1   0
Evan Rose              20    7    0    2   0   3/5    60.0   1/2    50.0   2/2     0   0
Gary Fox               15    8    0    1   2   2/3    66.7   2/3    66.7   2/2     1   0
Desmond Morant         15    9    2    4   0   4/6    66.7   2/2   100.0   0/0     0   1
Tim Durant             15    8    5    1   1   3/7    42.9   1/1   100.0   1/2     0   0
Stephen Towns          13    2    5    1   1   2/4    50.0   0/0     0.0   2/2     0   0

TEAM: FG: 45/86 (52.3%), 3PT: 15/36 (41.7%), REB: 47 (10 off, 37 def), AST: 23, TO: 8


Team_042
--------------------------------------------------------------------------------
Player                MIN  PTS  REB  AST  TO      FG   FG%      3P   3P%      FT STL BLK
--------------------------------------------------------------------------------
Tyler Barrett          33   13    8    0   1   7/14   50.0   4/8    50.0   1/3     0   0
Kristaps Parker        33   12    0    2   1   4/10   40.0   2/7    28.6   2/2     0   0
Jarrett Sabonis        33    6    0    1   3   2/8    25.0   2/5    40.0   0/0     0   0
Dejounte Butler        33    4   10    4   1   3/11   27.3   0/3     0.0   0/0     0   0
Cade Dosunmu           33   20   16    3   2   9/13   69.2   0/1     0.0   4/5     0   0
Khris George           15    3    0    2   1   1/3    33.3   1/3    33.3   0/0     0   0
Isaiah Randle          15   12    0    1   1   5/8    62.5   2/5    40.0   0/0     1   0
Gary Jackson           15    5    1    1   1   3/5    60.0   2/2   100.0   0/4     0   0
Allen Towns            15    4    6    3   1   2/3    66.7   0/1     0.0   0/0     0   0
Lamelo Stewart         15   12    7    0   0   4/5    80.0   1/1   100.0   5/6     0   0

TEAM: FG: 40/80 (50.0%), 3PT: 14/36 (38.9%), REB: 50 (10 off, 40 def), AST: 17, TO: 12

================================================================================
