================================================================================
                        FULL GAME - Team_027 vs Team_042                        
================================================================================

================================================================================
                       1ST QUARTER - Team_027 vs Team_042                       
================================================================================

[12:00] Team_027 possession (Score: 0-0)
Bradley Dosunmu attempts a Midrange. Contested by Kristaps Parker (5.1 feet, ZONE). Bradley Dosunmu misses. Offensive rebound by Bradley Dosunmu! Bradley Dosunmu kicks it out.

[11:43] Team_027 possession (Score: 0-0)
Tim Johnson attempts a 3Pt. Contested by Tyler Barrett (3.7 feet, ZONE). Tim Johnson misses. Rebound secured by Cade Dosunmu.

[11:29] Team_042 possession (Score: 0-0)
Cade Dosunmu attempts a 3Pt. Contested by John Russell (4.2 feet, MAN). Cade Dosunmu misses. Rebound secured by John Russell.

[11:16] Team_027 possession (Score: 0-0)
Tony Doncic attempts a 3Pt. Contested by Dejounte Butler (3.7 feet, ZONE). Tony Doncic misses. Rebound secured by Tyler Barrett.

[11:00] Team_042 possession (Score: 0-0)
Tyler Barrett attempts a Layup. Contested by Tim Johnson (5.4 feet, MAN). Tyler Barrett misses. FOUL! Loose ball foul on Tony Doncic during the rebound battle. [Team fouls: 1] No free throws, side out. (Tony Doncic: 1 personal fouls)

[10:42] Team_042 possession (Score: 0-0)
Tyler Barrett loses the ball! Stripped by Tim Johnson! TURNOVER! (live ball)

[10:30] Team_027 possession (Score: 0-0)
Bradley Dosunmu attempts a 3Pt. Contested by Tyler Barrett (3.5 feet, ZONE). Bradley Dosunmu misses. Offensive rebound by John Russell! John Russell puts it back in!
Score: 2-0

[10:18] Team_042 possession (Score: 2-0)
Tyler Barrett attempts a 3Pt. Contested by Tim Johnson (5.4 feet, ZONE). TYLER BARRETT MAKES IT! Assist: Cade Dosunmu
Score: 2-3

[10:04] Team_027 possession (Score: 2-3)
Tony Doncic drives and kicks out. John Russell attempts a 3Pt. Contested by Cade Dosunmu (3.9 feet, MAN). John Russell misses. Rebound secured by Dejounte Butler.

[09:53] Team_042 possession (Score: 2-3)
Tyler Barrett attempts a 3Pt. Contested by Tim Johnson (5.4 feet, ZONE). Tyler Barrett misses. FOUL! Loose ball foul on Tony Doncic during the rebound battle. [Team fouls: 2] No free throws, side out. (Tony Doncic: 2 personal fouls)

[09:41] Team_042 possession (Score: 2-3)
Dejounte Butler drives and kicks out. Tyler Barrett makes the Midrange and draws the foul on Tim Johnson! And-1! Tyler Barrett to the line for 1. [Team fouls: 3] (Tim Johnson: 1 personal fouls)   FT 1/1: GOOD Tyler Barrett makes 1/1 from the line.
Score: 2-6

[09:27] Team_027 possession (Score: 2-6)
John Russell loses the ball! Stripped by Cade Dosunmu! TURNOVER! (live ball)

[09:11] Team_042 possession (Score: 2-6)
Cade Dosunmu drives and kicks out. Dejounte Butler attempts a Midrange. Contested by Bradley Dosunmu (4.4 feet, MAN). DEJOUNTE BUTLER MAKES IT!
Score: 2-8

[08:57] Team_027 possession (Score: 2-8)
John Russell attempts a Midrange. Contested by Dejounte Butler (4.4 feet, ZONE). John Russell misses. Rebound secured by Cade Dosunmu.

[08:40] Team_042 possession (Score: 2-8)
Jarrett Sabonis drives, picks up Scottie Harden. Help arrives from Tony Doncic! Jarrett Sabonis attempts a Dunk. Contested by Tony Doncic (4.9 feet, MAN). JARRETT SABONIS MAKES IT! Assist: Tyler Barrett
Score: 2-10

[08:26] Team_027 possession (Score: 2-10)
Bradley Dosunmu drives to the basket... Bradley Dosunmu throws a bad pass! Stolen by Dejounte Butler! TURNOVER! (live ball)

[08:10] Team_042 possession (Score: 2-10)
FOUL! Shooting foul on Bradley Dosunmu. Dejounte Butler to the line for 2 free throws. [Team fouls: 4] (Bradley Dosunmu: 1 personal fouls)   FT 1/2: GOOD   FT 2/2: GOOD Dejounte Butler makes 2/2 from the line.
Score: 2-12

[08:01] Team_027 possession (Score: 2-12)
Tim Johnson attempts a 3Pt. Contested by Tyler Barrett (3.7 feet, ZONE). Tim Johnson misses. Rebound secured by Dejounte Butler.

[07:46] Team_042 possession (Score: 2-12)
Tyler Barrett drives, John Russell stays with him. Tyler Barrett attempts a Layup. Contested by John Russell (4.4 feet, ZONE). TYLER BARRETT MAKES IT! Assist: Dejounte Butler
Score: 2-14

[07:34] Team_027 possession (Score: 2-14)
Tim Johnson drives to the basket... Tim Johnson throws a bad pass out of bounds! TURNOVER! (dead ball)

[07:15] Team_042 possession (Score: 2-14)
Tyler Barrett makes the Layup and draws the foul on Tony Doncic! And-1! Tyler Barrett to the line for 1. [BONUS: 5 team fouls] (Tony Doncic: 3 personal fouls)   FT 1/1: GOOD Tyler Barrett makes 1/1 from the line.
Score: 2-17

[07:05] Team_027 possession (Score: 2-17)
FOUL! Shooting foul on Cade Dosunmu. Bradley Dosunmu to the line for 2 free throws. [Team fouls: 1] (Cade Dosunmu: 1 personal fouls)   FT 1/2: GOOD   FT 2/2: GOOD Bradley Dosunmu makes 2/2 from the line.
Score: 4-17

[06:50] Team_042 possession (Score: 4-17)
Dejounte Butler drives and kicks out. Tyler Barrett attempts a 3Pt. Contested by Tim Johnson (4.9 feet, MAN). Tyler Barrett misses. Rebound secured by John Russell.

[06:35] Team_027 possession (Score: 4-17)
Scottie Harden attempts a 3Pt. Contested by Jarrett Sabonis (4.0 feet, MAN). Scottie Harden misses. Offensive rebound by John Russell! John Russell puts it back in!
Score: 6-17

[06:24] Team_042 possession (Score: 6-17)
Jarrett Sabonis attempts a 3Pt. Contested by Scottie Harden (4.9 feet, MAN). JARRETT SABONIS MAKES IT! Assist: Cade Dosunmu
Score: 6-20

[06:09] Team_027 possession (Score: 6-20)
FOUL! Reach-in foul on Jarrett Sabonis during the drive. [Team fouls: 2] No free throws, side out. (Jarrett Sabonis: 1 personal fouls)

[05:57] Team_027 possession (Score: 6-20)
Tim Johnson attempts a Midrange. Contested by Tyler Barrett (3.7 feet, MAN). Tim Johnson misses. Rebound secured by Dejounte Butler.

[05:46] Team_042 possession (Score: 6-20)
Cade Dosunmu drives, John Russell stays with him. Cade Dosunmu attempts a Layup. Contested by John Russell (4.2 feet, MAN). CADE DOSUNMU MAKES IT! Assist: Jarrett Sabonis
Score: 6-22

[05:32] Team_027 possession (Score: 6-22)
Tony Doncic drives to the basket... FOUL! Offensive foul on Tony Doncic! Cade Dosunmu drew the charge! [Team fouls: 6] (Tony Doncic: 4 personal fouls) TURNOVER! (dead ball)

[05:22] Team_042 possession (Score: 6-22)
FOUL! Offensive foul on Kristaps Parker! Tony Doncic drew the charge! [Team fouls: 3] (Kristaps Parker: 1 personal fouls) TURNOVER! (dead ball)

[05:08] Team_027 possession (Score: 6-22)
FOUL! Shooting foul on Kristaps Parker. Tony Doncic to the line for 3 free throws. [Team fouls: 4] (Kristaps Parker: 2 personal fouls)   FT 1/3: GOOD   FT 2/3: GOOD   FT 3/3: GOOD Tony Doncic makes 3/3 from the line.
Score: 9-22

[04:51] Team_042 possession (Score: 9-22)
Jarrett Sabonis attempts a 3Pt. Contested by Scottie Harden (5.0 feet, MAN). Jarrett Sabonis misses. Offensive rebound by Dejounte Butler! Dejounte Butler puts it back in!
Score: 9-24

[04:36] Team_027 possession (Score: 9-24)
Bradley Dosunmu attempts a 3Pt. Contested by Dejounte Butler (3.8 feet, MAN). Bradley Dosunmu misses. Offensive rebound by Bradley Dosunmu! Bradley Dosunmu kicks it out.

[04:25] Team_027 possession (Score: 9-24)
Tim Johnson attempts a Layup. Contested by Tyler Barrett (3.8 feet, MAN). TIM JOHNSON MAKES IT! Assist: John Russell
Score: 11-24

[04:09] Team_042 possession (Score: 11-24)
Dejounte Butler attempts a 3Pt. Contested by Bradley Dosunmu (4.7 feet, MAN). Dejounte Butler misses. Rebound secured by John Russell.

[03:57] Team_027 possession (Score: 11-24)
Bradley Dosunmu attempts a Midrange. Contested by Dejounte Butler (3.8 feet, MAN). BRADLEY DOSUNMU MAKES IT!
Score: 13-24

[03:44] Team_042 possession (Score: 13-24)
Cade Dosunmu drives and kicks out. Jarrett Sabonis attempts a 3Pt. Contested by Scottie Harden (4.7 feet, MAN). JARRETT SABONIS MAKES IT! Assist: Cade Dosunmu
Score: 13-27

[03:32] Team_027 possession (Score: 13-27)
Bradley Dosunmu attempts a Layup. BLOCKED BY CADE DOSUNMU! Ball deflects out of bounds off Bradley Dosunmu.

[03:18] Team_042 possession (Score: 13-27)
Dejounte Butler attempts a Midrange. Contested by Bradley Dosunmu (4.8 feet, MAN). Dejounte Butler misses. FOUL! Loose ball foul on John Russell during the rebound battle. [IN THE BONUS! 7 team fouls] Cade Dosunmu to the line for 2 free throws. (John Russell: 1 personal fouls)   FT 1/2: GOOD   FT 2/2: GOOD Cade Dosunmu makes 2/2 from the line.
Score: 13-29

[03:04] Team_027 possession (Score: 13-29)
Bradley Dosunmu attempts a Midrange. Contested by Dejounte Butler (3.9 feet, MAN). Bradley Dosunmu misses. FOUL! Loose ball foul on Cade Dosunmu during the rebound battle. [IN THE BONUS! 5 team fouls] Bradley Dosunmu to the line for 2 free throws. (Cade Dosunmu: 2 personal fouls)   FT 1/2: GOOD   FT 2/2: MISS Bradley Dosunmu makes 1/2 from the line. Rebound secured by Dejounte Butler.
Score: 14-29

[02:50] Team_042 possession (Score: 14-29)
Jarrett Sabonis attempts a 3Pt. Contested by Tim Johnson (5.6 feet, ZONE). Jarrett Sabonis misses. Rebound secured by John Russell.

[02:30] Team_027 possession (Score: 14-29)
FOUL! Reach-in foul on Cade Dosunmu during the drive. [IN THE BONUS! 6 team fouls] Tony Doncic to the line for 2 free throws. (Cade Dosunmu: 3 personal fouls)   FT 1/2: GOOD   FT 2/2: GOOD Tony Doncic makes 2/2 from the line.
Score: 16-29

[02:18] Team_042 possession (Score: 16-29)
FOUL! Reach-in foul on John Russell during the drive. [IN THE BONUS! 8 team fouls] Cade Dosunmu to the line for 2 free throws. (John Russell: 2 personal fouls)   FT 1/2: GOOD   FT 2/2: GOOD Cade Dosunmu makes 2/2 from the line.
Score: 16-31

[02:03] Team_027 possession (Score: 16-31)
Tony Doncic attempts a 3Pt. Contested by Tyler Barrett (3.9 feet, ZONE). TONY DONCIC MAKES IT! Assist: John Russell
Score: 19-31

[01:46] Team_042 possession (Score: 19-31)
Tyler Barrett attempts a 3Pt. Contested by Scottie Harden (5.4 feet, ZONE). Tyler Barrett misses. Offensive rebound by Dejounte Butler! Dejounte Butler's putback is no good. Offensive rebound by Dejounte Butler! Dejounte Butler kicks it out.

[01:30] Team_042 possession (Score: 19-31)
Cade Dosunmu attempts a Layup. Contested by John Russell (4.6 feet, MAN). CADE DOSUNMU MAKES IT! Assist: Tyler Barrett
Score: 19-33

[01:14] Team_027 possession (Score: 19-33)
Scottie Harden attempts a 3Pt. Contested by Jarrett Sabonis (4.4 feet, MAN). Scottie Harden misses. Rebound secured by Dejounte Butler.

[01:00] Team_042 possession (Score: 19-33)
Kristaps Parker attempts a 3Pt. Contested by Tony Doncic (4.2 feet, MAN). Kristaps Parker misses. Offensive rebound by Dejounte Butler! Dejounte Butler's putback is no good. Offensive rebound by Cade Dosunmu! Cade Dosunmu kicks it out.

[00:48] Team_042 possession (Score: 19-33)
FOUL! Reach-in foul on Bradley Dosunmu during the drive. [IN THE BONUS! 9 team fouls] Kristaps Parker to the line for 2 free throws. (Bradley Dosunmu: 2 personal fouls)   FT 1/2: GOOD   FT 2/2: MISS Kristaps Parker makes 1/2 from the line. Rebound secured by John Russell.
Score: 19-34

[00:34] Team_027 possession (Score: 19-34)
John Russell attempts a Dunk. BLOCKED BY CADE DOSUNMU! Ball is loose! Rebound secured by Cade Dosunmu.

[00:23] Team_042 possession (Score: 19-34)
Dejounte Butler attempts a 3Pt. Contested by Bradley Dosunmu (5.1 feet, ZONE). Dejounte Butler misses. Rebound secured by Tony Doncic.

[00:10] Team_027 possession (Score: 19-34)
Tim Johnson drives, Tyler Barrett stays with him. Tim Johnson attempts a Layup. Contested by Tyler Barrett (4.2 feet, MAN). TIM JOHNSON MAKES IT! Assist: Tony Doncic
Score: 21-34

================================================================================
                              1ST QUARTER COMPLETE                              
================================================================================

1ST QUARTER SCORE: Team_027 21, Team_042 34

BOX SCORE:
================================================================================

Team_027
--------------------------------------------------------------------------------
Player                MIN  PTS  REB  AST  TO      FG   FG%      3P   3P%
--------------------------------------------------------------------------------
Tony Doncic            12    8    1    1   0   3/5    60.0     0/0   0.0
Bradley Dosunmu        12    4    2    0   0   2/4    50.0     0/0   0.0
Tim Johnson            12    4    0    0   0   2/5    40.0     0/0   0.0
John Russell           12    4    7    2   0   2/4    50.0     0/0   0.0
Scottie Harden         12    0    0    0   0   0/1     0.0     0/0   0.0

TEAM: FG: 9/19 (47.4%), 3PT: 4/8 (50.0%), REB: 11 (5 off, 6 def), AST: 3, TO: 4
TEAM FOULS: 9 [Team_042 in BONUS]


Team_042
--------------------------------------------------------------------------------
Player                MIN  PTS  REB  AST  TO      FG   FG%      3P   3P%
--------------------------------------------------------------------------------
Tyler Barrett          12   11    1    2   0   4/4   100.0     0/0   0.0
Cade Dosunmu           12    8    6    3   0   4/5    80.0     0/0   0.0
Jarrett Sabonis        12    8    0    1   0   3/4    75.0     0/0   0.0
Dejounte Butler        12    6    7    1   0   3/6    50.0     0/0   0.0
Kristaps Parker        12    0    0    0   0   0/1     0.0     0/0   0.0

TEAM: FG: 14/20 (70.0%), 3PT: 3/7 (42.9%), REB: 13 (5 off, 8 def), AST: 7, TO: 2
TEAM FOULS: 6 [Team_027 in BONUS]

================================================================================

================================================================================
                       2ND QUARTER - Team_027 vs Team_042                       
================================================================================

[12:00] Team_027 possession (Score: 21-34)
FOUL! Holding foul on Cade Dosunmu. [Team fouls: 1] No free throws, side out. (Cade Dosunmu: 1 personal fouls)

[11:41] Team_027 possession (Score: 21-34)
Scottie Harden attempts a 3Pt. Contested by Jarrett Sabonis (4.3 feet, MAN). Scottie Harden misses. Rebound secured by Cade Dosunmu.

[11:27] Team_042 possession (Score: 21-34)
Kristaps Parker attempts a 3Pt. Contested by Tony Doncic (4.2 feet, ZONE). Kristaps Parker misses. Offensive rebound by Dejounte Butler! Dejounte Butler's putback is no good. Rebound secured by Tony Doncic.

[11:13] Team_027 possession (Score: 21-34)
Scottie Harden makes the Dunk and draws the foul on Dejounte Butler! And-1! Scottie Harden to the line for 1. [Team fouls: 2] (Dejounte Butler: 1 personal fouls)   FT 1/1: GOOD Scottie Harden makes 1/1 from the line.
Score: 24-34

[10:58] Team_042 possession (Score: 24-34)
Cade Dosunmu drives and kicks out. Cade Dosunmu attempts a Midrange. Contested by Tony Doncic (4.3 feet, ZONE). Cade Dosunmu misses. Rebound secured by Tony Doncic.

[10:46] Team_027 possession (Score: 24-34)
FOUL! Offensive foul on Tony Doncic! Kristaps Parker drew the charge! [Team fouls: 1] (Tony Doncic: 1 personal fouls) TURNOVER! (dead ball)

[10:36] Team_042 possession (Score: 24-34)
Jarrett Sabonis attempts a 3Pt. Contested by Scottie Harden (5.4 feet, MAN). Jarrett Sabonis misses. Rebound secured by Bradley Dosunmu.

[10:24] Team_027 possession (Score: 24-34)
John Russell attempts a Midrange. Contested by Cade Dosunmu (5.3 feet, MAN). JOHN RUSSELL MAKES IT!
Score: 26-34

[10:12] Team_042 possession (Score: 26-34)
Jarrett Sabonis attempts a Midrange. Contested by Scottie Harden (5.5 feet, ZONE). JARRETT SABONIS MAKES IT! Assist: Cade Dosunmu
Score: 26-36

[09:58] Team_027 possession (Score: 26-36)
John Russell loses the ball! Stripped by Cade Dosunmu! TURNOVER! (live ball)

[09:46] Team_042 possession (Score: 26-36)
Tyler Barrett attempts a 3Pt. Contested by Tim Johnson (5.9 feet, MAN). Tyler Barrett misses. Offensive rebound by Cade Dosunmu! Cade Dosunmu's putback is no good. Rebound secured by Bradley Dosunmu.

[09:34] Team_027 possession (Score: 26-36)
Scottie Harden drives and kicks out. John Russell attempts a 3Pt. Contested by Kristaps Parker (5.6 feet, ZONE). John Russell misses. Rebound secured by Tyler Barrett.

[09:15] Team_042 possession (Score: 26-36)
Tyler Barrett attempts a Layup. Contested by John Russell (5.1 feet, ZONE). TYLER BARRETT MAKES IT!
Score: 26-38

[08:59] Team_027 possession (Score: 26-38)
Bradley Dosunmu attempts a 3Pt. Contested by Tyler Barrett (4.2 feet, ZONE). Bradley Dosunmu misses. Rebound secured by Dejounte Butler.

[08:46] Team_042 possession (Score: 26-38)
Jarrett Sabonis drives, John Russell stays with him. Jarrett Sabonis attempts a Dunk. Contested by John Russell (5.1 feet, ZONE). Jarrett Sabonis misses. Rebound secured by Tony Doncic.

[08:33] Team_027 possession (Score: 26-38)
Tony Doncic makes the Layup and draws the foul on Kristaps Parker! And-1! Tony Doncic to the line for 1. [Team fouls: 3] (Kristaps Parker: 1 personal fouls)   FT 1/1: GOOD Tony Doncic makes 1/1 from the line.
Score: 29-38

[08:19] Team_042 possession (Score: 29-38)
Dejounte Butler attempts a Midrange. Contested by Bradley Dosunmu (5.3 feet, MAN). DEJOUNTE BUTLER MAKES IT!
Score: 29-40

[08:00] Team_027 possession (Score: 29-40)
FOUL! Shooting foul on Cade Dosunmu. John Russell to the line for 2 free throws. [Team fouls: 4] (Cade Dosunmu: 2 personal fouls)   FT 1/2: GOOD   FT 2/2: GOOD John Russell makes 2/2 from the line.
Score: 31-40

[07:40] Team_042 possession (Score: 31-40)
Jarrett Sabonis loses the ball! Stripped by Scottie Harden! TURNOVER! (live ball)

[07:28] Team_027 possession (Score: 31-40)
John Russell drives to the basket... John Russell loses control! Ball rolls out of bounds! TURNOVER! (dead ball)

[07:28] Substitution (Team_027): Tim Johnson OUT → CJ Green IN (stamina_rule2)

[07:28] Substitution (Team_027): Tony Doncic OUT → Dirk Lillard IN (stamina_rule2)

[07:28] Substitution (Team_027): Scottie Harden OUT → Rudy Quickley IN (stamina_rule2)

[07:28] Substitution (Team_027): Bradley Dosunmu OUT → LeBron Russell IN (stamina_rule2)

[07:28] Substitution (Team_027): John Russell OUT → Ben Stewart IN (stamina_rule2)

[07:28] Substitution (Team_042): Tyler Barrett OUT → Khris George IN (stamina_rule2)

[07:28] Substitution (Team_042): Kristaps Parker OUT → Isaiah Randle IN (stamina_rule2)

[07:28] Substitution (Team_042): Jarrett Sabonis OUT → Gary Jackson IN (stamina_rule2)

[07:28] Substitution (Team_042): Dejounte Butler OUT → Allen Towns IN (stamina_rule2)

[07:28] Substitution (Team_042): Cade Dosunmu OUT → Lamelo Stewart IN (stamina_rule2)

[07:10] Team_042 possession (Score: 31-40)
Allen Towns attempts a Midrange. Contested by Rudy Quickley (3.9 feet, ZONE). ALLEN TOWNS MAKES IT! Assist: Lamelo Stewart
Score: 31-42

[06:51] Team_027 possession (Score: 31-42)
Rudy Quickley attempts a Midrange. Contested by Gary Jackson (5.0 feet, MAN). Rudy Quickley misses. Rebound secured by Lamelo Stewart.

[06:38] Team_042 possession (Score: 31-42)
FOUL! Reach-in foul on LeBron Russell during the drive. [Team fouls: 2] No free throws, side out. (LeBron Russell: 1 personal fouls)

[06:26] Team_042 possession (Score: 31-42)
Gary Jackson attempts a 3Pt. Contested by Rudy Quickley (3.3 feet, MAN). Gary Jackson misses. Rebound secured by LeBron Russell.

[06:11] Team_027 possession (Score: 31-42)
Rudy Quickley attempts a 3Pt. Contested by Khris George (4.4 feet, ZONE). Rudy Quickley misses. Rebound secured by Allen Towns.

[05:59] Team_042 possession (Score: 31-42)
Lamelo Stewart attempts a 3Pt. Contested by Rudy Quickley (3.3 feet, ZONE). Lamelo Stewart misses. Rebound secured by LeBron Russell.

[05:44] Team_027 possession (Score: 31-42)
Ben Stewart attempts a Layup. Contested by Lamelo Stewart (4.1 feet, MAN). BEN STEWART MAKES IT! Assist: Rudy Quickley
Score: 33-42

[05:33] Team_042 possession (Score: 33-42)
Allen Towns attempts a 3Pt. Contested by LeBron Russell (6.0 feet, MAN). Allen Towns misses. FOUL! Loose ball foul on LeBron Russell during the rebound battle. [Team fouls: 3] No free throws, side out. (LeBron Russell: 2 personal fouls)

[05:21] Team_042 possession (Score: 33-42)
Gary Jackson attempts a Midrange. Contested by Dirk Lillard (4.2 feet, ZONE). Gary Jackson misses. Rebound secured by Ben Stewart.

[05:03] Team_027 possession (Score: 33-42)
Dirk Lillard attempts a 3Pt. Contested by Isaiah Randle (5.1 feet, MAN). Dirk Lillard misses. Rebound secured by Lamelo Stewart.

[04:46] Team_042 possession (Score: 33-42)
Allen Towns makes the Dunk and draws the foul on Dirk Lillard! And-1! Allen Towns to the line for 1. [Team fouls: 4] (Dirk Lillard: 1 personal fouls)   FT 1/1: GOOD Allen Towns makes 1/1 from the line.
Score: 33-45

[04:31] Team_027 possession (Score: 33-45)
Ben Stewart attempts a 3Pt. Contested by Khris George (3.9 feet, ZONE). Ben Stewart misses. Rebound secured by Gary Jackson.

[04:18] Team_042 possession (Score: 33-45)
Allen Towns attempts a Midrange. Contested by LeBron Russell (6.0 feet, MAN). Allen Towns misses. Rebound secured by Ben Stewart.

[04:03] Team_027 possession (Score: 33-45)
LeBron Russell throws a bad pass! Stolen by Allen Towns! TURNOVER! (live ball)

[03:47] Team_042 possession (Score: 33-45)
Gary Jackson attempts a Layup. BLOCKED BY BEN STEWART! Ball deflects out of bounds off Gary Jackson.

[03:29] Team_027 possession (Score: 33-45)
CJ Green attempts a 3Pt. Contested by Khris George (4.1 feet, ZONE). CJ Green misses. Rebound secured by Allen Towns.

[03:16] Team_042 possession (Score: 33-45)
FOUL! Offensive foul on Gary Jackson! Rudy Quickley drew the charge! [Team fouls: 5] (Gary Jackson: 1 personal fouls) TURNOVER! (dead ball)

[03:02] Team_027 possession (Score: 33-45)
FOUL! Shooting foul on Lamelo Stewart. Ben Stewart to the line for 2 free throws. [BONUS: 6 team fouls] (Lamelo Stewart: 1 personal fouls)   FT 1/2: GOOD   FT 2/2: GOOD Ben Stewart makes 2/2 from the line.
Score: 35-45

[02:48] Team_042 possession (Score: 35-45)
Khris George attempts a Midrange. Contested by CJ Green (5.8 feet, MAN). Khris George misses. Rebound secured by LeBron Russell.

[02:36] Team_027 possession (Score: 35-45)
LeBron Russell attempts a Layup. Contested by Allen Towns (4.3 feet, ZONE). LeBron Russell misses. Rebound secured by Gary Jackson.

[02:20] Team_042 possession (Score: 35-45)
Gary Jackson attempts a Layup. BLOCKED BY RUDY QUICKLEY! Ball is loose! Offensive rebound by Allen Towns! Allen Towns kicks it out.

[02:06] Team_042 possession (Score: 35-45)
Gary Jackson drives and kicks out. Khris George attempts a Midrange. Contested by CJ Green (5.1 feet, MAN). KHRIS GEORGE MAKES IT! Assist: Lamelo Stewart
Score: 35-47

[01:50] Team_027 possession (Score: 35-47)
LeBron Russell drives, Allen Towns stays with him. LeBron Russell attempts a Layup. Contested by Allen Towns (4.3 feet, ZONE). LeBron Russell misses. Rebound secured by Lamelo Stewart.

[01:36] Team_042 possession (Score: 35-47)
Gary Jackson attempts a Midrange. Contested by LeBron Russell (5.5 feet, ZONE). Gary Jackson misses. Rebound secured by Ben Stewart.

[01:22] Team_027 possession (Score: 35-47)
Ben Stewart attempts a 3Pt. Contested by Lamelo Stewart (4.1 feet, MAN). Ben Stewart misses. Rebound secured by Allen Towns.

[01:13] Team_042 possession (Score: 35-47)
Gary Jackson throws a bad pass! Stolen by Rudy Quickley! TURNOVER! (live ball)

[00:56] Team_027 possession (Score: 35-47)
FOUL! Reach-in foul on Khris George during the drive. [IN THE BONUS! 7 team fouls] CJ Green to the line for 2 free throws. (Khris George: 1 personal fouls)   FT 1/2: GOOD   FT 2/2: GOOD CJ Green makes 2/2 from the line.
Score: 37-47

[00:43] Team_042 possession (Score: 37-47)
Allen Towns throws a bad pass out of bounds! TURNOVER! (dead ball)

[00:30] Team_027 possession (Score: 37-47)
CJ Green drives, Khris George stays with him. CJ Green attempts a Dunk. Contested by Khris George (4.2 feet, MAN). CJ GREEN MAKES IT! Assist: Ben Stewart
Score: 39-47

[00:15] Team_042 possession (Score: 39-47)
Khris George attempts a 3Pt. Contested by Rudy Quickley (4.1 feet, ZONE). Khris George misses. Rebound secured by LeBron Russell.

[00:01] Team_027 possession (Score: 39-47)
FOUL! Reach-in foul on Allen Towns during the drive. [IN THE BONUS! 8 team fouls] Rudy Quickley to the line for 2 free throws. (Allen Towns: 1 personal fouls)   FT 1/2: GOOD   FT 2/2: GOOD Rudy Quickley makes 2/2 from the line.
Score: 41-47

================================================================================
                              2ND QUARTER COMPLETE                              
================================================================================

2ND QUARTER SCORE: Team_027 20, Team_042 13

BOX SCORE:
================================================================================

Team_027
--------------------------------------------------------------------------------
Player                MIN  PTS  REB  AST  TO      FG   FG%      3P   3P%
--------------------------------------------------------------------------------
John Russell           17    4    0    0   0   2/2   100.0     0/0   0.0
Ben Stewart             7    4    3    1   0   2/4    50.0     0/0   0.0
CJ Green                7    4    0    0   0   2/3    66.7     0/0   0.0
Scottie Harden         17    3    0    0   0   1/3    33.3     0/0   0.0
Tony Doncic            17    3    3    0   0   1/1   100.0     0/0   0.0
Rudy Quickley           7    2    0    1   0   1/3    33.3     0/0   0.0
Bradley Dosunmu        17    0    2    0   0   0/1     0.0     0/0   0.0
LeBron Russell          7    0    4    0   0   0/2     0.0     0/0   0.0
Dirk Lillard            7    0    0    0   0   0/1     0.0     0/0   0.0

TEAM: FG: 9/20 (45.0%), 3PT: 0/7 (0.0%), REB: 10 (0 off, 10 def), AST: 2, TO: 4
TEAM FOULS: 5 [Team_042 in BONUS]


Team_042
--------------------------------------------------------------------------------
Player                MIN  PTS  REB  AST  TO      FG   FG%      3P   3P%
--------------------------------------------------------------------------------
Allen Towns             7    5    4    0   0   2/3    66.7     0/0   0.0
Jarrett Sabonis        17    2    0    0   0   1/3    33.3     0/0   0.0
Tyler Barrett          17    2    1    0   0   1/2    50.0     0/0   0.0
Dejounte Butler        17    2    1    0   0   1/1   100.0     0/0   0.0
Khris George            7    2    0    0   0   1/3    33.3     0/0   0.0
Cade Dosunmu           17    0    1    1   0   0/1     0.0     0/0   0.0
Kristaps Parker        17    0    0    0   0   0/1     0.0     0/0   0.0
Lamelo Stewart          7    0    4    2   0   0/1     0.0     0/0   0.0
Gary Jackson            7    0    2    0   0   0/4     0.0     0/0   0.0

TEAM: FG: 6/19 (31.6%), 3PT: 0/6 (0.0%), REB: 15 (4 off, 11 def), AST: 3, TO: 4
TEAM FOULS: 8 [Team_027 in BONUS]

================================================================================

================================================================================
                       3RD QUARTER - Team_027 vs Team_042                       
================================================================================

[12:00] Team_027 possession (Score: 41-47)
FOUL! Reach-in foul on Jarrett Sabonis during the drive. [Team fouls: 1] No free throws, side out. (Jarrett Sabonis: 1 personal fouls)

[11:44] Team_027 possession (Score: 41-47)
Tim Johnson attempts a 3Pt. Contested by Tyler Barrett (3.7 feet, MAN). TIM JOHNSON MAKES IT! Assist: Tony Doncic
Score: 44-47

[11:29] Team_042 possession (Score: 44-47)
Kristaps Parker attempts a Layup. Contested by Tony Doncic (3.8 feet, MAN). KRISTAPS PARKER MAKES IT!
Score: 44-49

[11:14] Team_027 possession (Score: 44-49)
Bradley Dosunmu drives, Cade Dosunmu stays with him. Bradley Dosunmu attempts a Dunk. Contested by Cade Dosunmu (4.0 feet, ZONE). Bradley Dosunmu misses. FOUL! Loose ball foul on Cade Dosunmu during the rebound battle. [Team fouls: 2] No free throws, side out. (Cade Dosunmu: 1 personal fouls)

[10:55] Team_027 possession (Score: 44-49)
Tim Johnson drives, Cade Dosunmu stays with him. Tim Johnson attempts a Dunk. Contested by Cade Dosunmu (4.2 feet, ZONE). TIM JOHNSON MAKES IT!
Score: 46-49

[10:40] Team_042 possession (Score: 46-49)
Jarrett Sabonis attempts a Midrange. Contested by Scottie Harden (4.9 feet, MAN). Jarrett Sabonis misses. Rebound secured by Bradley Dosunmu.

[10:25] Team_027 possession (Score: 46-49)
Tim Johnson attempts a 3Pt. Contested by Tyler Barrett (3.7 feet, MAN). Tim Johnson misses. Rebound secured by Dejounte Butler.

[10:08] Team_042 possession (Score: 46-49)
Tyler Barrett drives to the basket... Tyler Barrett throws a bad pass! Stolen by Tim Johnson! TURNOVER! (live ball)

[09:54] Team_027 possession (Score: 46-49)
John Russell makes the Layup and draws the foul on Cade Dosunmu! And-1! John Russell to the line for 1. [Team fouls: 3] (Cade Dosunmu: 2 personal fouls)   FT 1/1: GOOD John Russell makes 1/1 from the line.
Score: 49-49

[09:41] Team_042 possession (Score: 49-49)
Dejounte Butler attempts a Midrange. Contested by Scottie Harden (4.8 feet, ZONE). DEJOUNTE BUTLER MAKES IT! Assist: Jarrett Sabonis
Score: 49-51

[09:27] Team_027 possession (Score: 49-51)
Bradley Dosunmu attempts a 3Pt. Contested by Tyler Barrett (3.5 feet, ZONE). BRADLEY DOSUNMU MAKES IT! Assist: John Russell
Score: 52-51

[09:13] Team_042 possession (Score: 52-51)
Kristaps Parker attempts a 3Pt. Contested by Tim Johnson (4.8 feet, ZONE). Kristaps Parker misses. Rebound secured by Tony Doncic.

[09:03] Team_027 possession (Score: 52-51)
FOUL! Offensive foul on Tim Johnson! Tyler Barrett drew the charge! [Team fouls: 1] (Tim Johnson: 1 personal fouls) TURNOVER! (dead ball)

[08:52] Team_042 possession (Score: 52-51)
FOUL! Reach-in foul on John Russell during the drive. [Team fouls: 2] No free throws, side out. (John Russell: 1 personal fouls)

[08:33] Team_042 possession (Score: 52-51)
Jarrett Sabonis makes the Layup and draws the foul on John Russell! And-1! Jarrett Sabonis to the line for 1. [Team fouls: 3] (John Russell: 2 personal fouls)   FT 1/1: GOOD Jarrett Sabonis makes 1/1 from the line.
Score: 52-54

[08:16] Team_027 possession (Score: 52-54)
Tim Johnson attempts a 3Pt. Contested by Tyler Barrett (3.7 feet, MAN). Tim Johnson misses. Rebound secured by Dejounte Butler.

[07:59] Team_042 possession (Score: 52-54)
Kristaps Parker attempts a Midrange. Contested by Tony Doncic (3.8 feet, MAN). KRISTAPS PARKER MAKES IT! Assist: Tyler Barrett
Score: 52-56

[07:45] Team_027 possession (Score: 52-56)
Tim Johnson makes the Dunk and draws the foul on Jarrett Sabonis! And-1! Tim Johnson to the line for 1. [Team fouls: 4] (Jarrett Sabonis: 2 personal fouls)   FT 1/1: GOOD Tim Johnson makes 1/1 from the line.
Score: 55-56

[07:30] Team_042 possession (Score: 55-56)
Kristaps Parker attempts a 3Pt. Contested by Tim Johnson (4.8 feet, ZONE). KRISTAPS PARKER MAKES IT! Assist: Tyler Barrett
Score: 55-59

[07:15] Team_027 possession (Score: 55-59)
John Russell attempts a Layup. Contested by Cade Dosunmu (4.7 feet, MAN). John Russell misses. Rebound secured by Tyler Barrett.

[06:59] Team_042 possession (Score: 55-59)
Dejounte Butler drives, picks up John Russell. Help arrives from Tony Doncic! Dejounte Butler attempts a Dunk. Contested by Tony Doncic (4.2 feet, ZONE). DEJOUNTE BUTLER MAKES IT!
Score: 55-61

[06:44] Team_027 possession (Score: 55-61)
John Russell attempts a Midrange. Contested by Cade Dosunmu (4.7 feet, MAN). John Russell misses. Rebound secured by Dejounte Butler.

[06:28] Team_042 possession (Score: 55-61)
Jarrett Sabonis attempts a 3Pt. Contested by Tim Johnson (5.3 feet, ZONE). Jarrett Sabonis misses. Rebound secured by Tony Doncic.

[06:12] Team_027 possession (Score: 55-61)
Scottie Harden attempts a 3Pt. Contested by Tyler Barrett (3.5 feet, ZONE). Scottie Harden misses. Offensive rebound by Bradley Dosunmu! Bradley Dosunmu kicks it out.

[05:59] Team_027 possession (Score: 55-61)
John Russell makes the Layup and draws the foul on Cade Dosunmu! And-1! John Russell to the line for 1. [BONUS: 5 team fouls] (Cade Dosunmu: 3 personal fouls)   FT 1/1: MISS John Russell makes 0/1 from the line. Rebound secured by Cade Dosunmu.
Score: 57-61

[05:43] Team_042 possession (Score: 57-61)
Dejounte Butler drives, picks up John Russell. Help arrives from Tony Doncic! Dejounte Butler attempts a Layup. Contested by Tony Doncic (4.2 feet, ZONE). Dejounte Butler misses. Rebound secured by John Russell.

[05:28] Team_027 possession (Score: 57-61)
John Russell attempts a 3Pt. Contested by Tyler Barrett (4.2 feet, ZONE). John Russell misses. Rebound secured by Cade Dosunmu.

[05:11] Team_042 possession (Score: 57-61)
Cade Dosunmu attempts a Midrange. Contested by Scottie Harden (4.8 feet, ZONE). Cade Dosunmu misses. Offensive rebound by Dejounte Butler! Dejounte Butler's putback is no good. Offensive rebound by Cade Dosunmu! Cade Dosunmu kicks it out.

[04:56] Team_042 possession (Score: 57-61)
Tyler Barrett drives and kicks out. FOUL! Shooting foul on Tim Johnson. Tyler Barrett to the line for 3 free throws. [Team fouls: 4] (Tim Johnson: 2 personal fouls)   FT 1/3: GOOD   FT 2/3: MISS   FT 3/3: GOOD Tyler Barrett makes 2/3 from the line.
Score: 57-63

[04:42] Team_027 possession (Score: 57-63)
Tim Johnson drives to the basket... Tim Johnson commits a violation (traveling/carry)! TURNOVER! (dead ball)

[04:33] Team_042 possession (Score: 57-63)
Kristaps Parker attempts a 3Pt. Contested by Tony Doncic (3.9 feet, MAN). Kristaps Parker misses. Rebound secured by Bradley Dosunmu.

[04:14] Team_027 possession (Score: 57-63)
Scottie Harden attempts a Midrange. Contested by Jarrett Sabonis (4.0 feet, MAN). SCOTTIE HARDEN MAKES IT! Assist: Tim Johnson
Score: 59-63

[04:01] Team_042 possession (Score: 59-63)
Cade Dosunmu attempts a Midrange. Contested by John Russell (4.3 feet, MAN). Cade Dosunmu misses. Rebound secured by Bradley Dosunmu.

[03:44] Team_027 possession (Score: 59-63)
Tony Doncic drives to the basket... Tony Doncic loses control! Ball rolls out of bounds! TURNOVER! (dead ball)

[03:32] Team_042 possession (Score: 59-63)
Tyler Barrett attempts a 3Pt. Contested by Tim Johnson (5.5 feet, MAN). TYLER BARRETT MAKES IT! Assist: Jarrett Sabonis
Score: 59-66

[03:18] Team_027 possession (Score: 59-66)
Tim Johnson attempts a Midrange. Contested by Kristaps Parker (5.4 feet, ZONE). TIM JOHNSON MAKES IT! Assist: John Russell
Score: 61-66

[03:09] Team_042 possession (Score: 61-66)
Dejounte Butler attempts a 3Pt. Contested by Tim Johnson (5.3 feet, ZONE). Dejounte Butler misses. Rebound secured by John Russell.

[02:58] Team_027 possession (Score: 61-66)
FOUL! Shooting foul on Dejounte Butler. Bradley Dosunmu to the line for 2 free throws. [BONUS: 6 team fouls] (Dejounte Butler: 1 personal fouls)   FT 1/2: GOOD   FT 2/2: GOOD Bradley Dosunmu makes 2/2 from the line.
Score: 63-66

[02:43] Team_042 possession (Score: 63-66)
Tyler Barrett attempts a Midrange. Contested by Tim Johnson (5.6 feet, MAN). Tyler Barrett misses. Rebound secured by Tony Doncic.

[02:26] Team_027 possession (Score: 63-66)
Scottie Harden attempts a Layup. Contested by Cade Dosunmu (4.3 feet, ZONE). SCOTTIE HARDEN MAKES IT! Assist: Tony Doncic
Score: 65-66

[02:09] Team_042 possession (Score: 65-66)
Cade Dosunmu attempts a Layup. Contested by John Russell (4.5 feet, ZONE). CADE DOSUNMU MAKES IT!
Score: 65-68

[01:57] Team_027 possession (Score: 65-68)
Bradley Dosunmu throws a bad pass out of bounds! TURNOVER! (dead ball)

[01:57] Substitution (Team_027): Tim Johnson OUT → CJ Green IN (stamina_rule2)

[01:57] Substitution (Team_027): Scottie Harden OUT → Rudy Quickley IN (stamina_rule2)

[01:57] Substitution (Team_027): Bradley Dosunmu OUT → LeBron Russell IN (stamina_rule2)

[01:57] Substitution (Team_027): John Russell OUT → Ben Stewart IN (stamina_rule2)

[01:57] Substitution (Team_042): Tyler Barrett OUT → Khris George IN (stamina_rule2)

[01:57] Substitution (Team_042): Kristaps Parker OUT → Isaiah Randle IN (stamina_rule2)

[01:57] Substitution (Team_042): Jarrett Sabonis OUT → Gary Jackson IN (stamina_rule2)

[01:57] Substitution (Team_042): Dejounte Butler OUT → Allen Towns IN (stamina_rule2)

[01:57] Substitution (Team_042): Cade Dosunmu OUT → Lamelo Stewart IN (stamina_rule2)

[01:42] Team_042 possession (Score: 65-68)
Khris George attempts a Layup. Contested by Ben Stewart (5.4 feet, ZONE). KHRIS GEORGE MAKES IT! Assist: Isaiah Randle
Score: 65-70

[01:31] Team_027 possession (Score: 65-70)
Rudy Quickley drives, Allen Towns stays with him. Rudy Quickley attempts a Layup. Contested by Allen Towns (4.7 feet, ZONE). RUDY QUICKLEY MAKES IT! Assist: Ben Stewart
Score: 67-70

[01:15] Team_042 possession (Score: 67-70)
Allen Towns drives, picks up LeBron Russell. Help arrives from Tony Doncic! Allen Towns attempts a Layup. Contested by Tony Doncic (6.0 feet, MAN). ALLEN TOWNS MAKES IT! Assist: Khris George
Score: 67-72

[01:02] Team_027 possession (Score: 67-72)
FOUL! Reach-in foul on Allen Towns during the drive. [IN THE BONUS! 7 team fouls] Rudy Quickley to the line for 2 free throws. (Allen Towns: 1 personal fouls)   FT 1/2: GOOD   FT 2/2: GOOD Rudy Quickley makes 2/2 from the line.
Score: 69-72

[00:44] Team_042 possession (Score: 69-72)
Khris George drives, picks up Ben Stewart. Help arrives from Tony Doncic! Khris George attempts a Layup. Contested by Tony Doncic (5.4 feet, ZONE). KHRIS GEORGE MAKES IT! Assist: Gary Jackson
Score: 69-74

[00:29] Team_027 possession (Score: 69-74)
Ben Stewart attempts a Layup. Contested by Allen Towns (4.2 feet, ZONE). BEN STEWART MAKES IT!
Score: 71-74

[00:16] Team_042 possession (Score: 71-74)
Isaiah Randle attempts a Midrange. Contested by Tony Doncic (4.6 feet, MAN). Isaiah Randle misses. FOUL! Loose ball foul on LeBron Russell during the rebound battle. [IN THE BONUS! 5 team fouls] Lamelo Stewart to the line for 2 free throws. (LeBron Russell: 1 personal fouls)   FT 1/2: MISS   FT 2/2: GOOD Lamelo Stewart makes 1/2 from the line.
Score: 71-75

[00:01] Team_027 possession (Score: 71-75)
CJ Green attempts a Midrange. Contested by Khris George (4.1 feet, MAN). CJ GREEN MAKES IT! Assist: LeBron Russell
Score: 73-75

================================================================================
                              3RD QUARTER COMPLETE                              
================================================================================

3RD QUARTER SCORE: Team_027 32, Team_042 28

BOX SCORE:
================================================================================

Team_027
--------------------------------------------------------------------------------
Player                MIN  PTS  REB  AST  TO      FG   FG%      3P   3P%
--------------------------------------------------------------------------------
Tim Johnson            27   10    0    1   0   4/6    66.7     0/0   0.0
Bradley Dosunmu        27    5    5    0   0   2/2   100.0     0/0   0.0
Scottie Harden         27    4    0    0   0   2/2   100.0     0/0   0.0
Rudy Quickley           9    4    0    0   0   2/2   100.0     0/0   0.0
John Russell           27    3    2    2   0   1/5    20.0     0/0   0.0
Ben Stewart             9    2    0    1   0   1/1   100.0     0/0   0.0
CJ Green                9    2    0    0   0   1/1   100.0     0/0   0.0
Tony Doncic            29    0    3    2   0   0/0     0.0     0/0   0.0
LeBron Russell          9    0    0    1   0   0/0     0.0     0/0   0.0

TEAM: FG: 13/19 (68.4%), 3PT: 2/5 (40.0%), REB: 10 (2 off, 8 def), AST: 7, TO: 4
TEAM FOULS: 5 [Team_042 in BONUS]


Team_042
--------------------------------------------------------------------------------
Player                MIN  PTS  REB  AST  TO      FG   FG%      3P   3P%
--------------------------------------------------------------------------------
Kristaps Parker        27    7    0    0   0   3/5    60.0     0/0   0.0
Tyler Barrett          27    5    1    2   0   2/3    66.7     0/0   0.0
Dejounte Butler        27    4    3    0   0   2/4    50.0     0/0   0.0
Khris George            9    4    0    1   0   2/2   100.0     0/0   0.0
Jarrett Sabonis        27    3    0    2   0   1/3    33.3     0/0   0.0
Cade Dosunmu           27    2    3    0   0   1/2    50.0     0/0   0.0
Allen Towns             9    2    0    0   0   1/1   100.0     0/0   0.0
Lamelo Stewart          9    1    0    0   0   1/1   100.0     0/0   0.0
Isaiah Randle           9    0    0    1   0   0/0     0.0     0/0   0.0
Gary Jackson            9    0    0    1   0   0/0     0.0     0/0   0.0

TEAM: FG: 13/21 (61.9%), 3PT: 2/6 (33.3%), REB: 7 (1 off, 6 def), AST: 7, TO: 1
TEAM FOULS: 7 [Team_027 in BONUS]

================================================================================

================================================================================
                       4TH QUARTER - Team_027 vs Team_042                       
================================================================================

[12:00] Team_027 possession (Score: 73-75)
FOUL! Reach-in foul on Cade Dosunmu during the drive. [Team fouls: 1] No free throws, side out. (Cade Dosunmu: 1 personal fouls)

[11:45] Team_027 possession (Score: 73-75)
John Russell attempts a Midrange. Contested by Dejounte Butler (4.4 feet, ZONE). John Russell misses. Rebound secured by Dejounte Butler.

[11:34] Team_042 possession (Score: 73-75)
Cade Dosunmu attempts a 3Pt. Contested by John Russell (4.3 feet, MAN). Cade Dosunmu misses. Rebound secured by John Russell.

[11:16] Team_027 possession (Score: 73-75)
Scottie Harden attempts a 3Pt. Contested by Tyler Barrett (3.5 feet, ZONE). Scottie Harden misses. FOUL! Loose ball foul on Cade Dosunmu during the rebound battle. [Team fouls: 2] No free throws, side out. (Cade Dosunmu: 2 personal fouls)

[11:01] Team_027 possession (Score: 73-75)
Scottie Harden attempts a 3Pt. Contested by Jarrett Sabonis (4.1 feet, MAN). Scottie Harden misses. Rebound secured by Cade Dosunmu.

[10:44] Team_042 possession (Score: 73-75)
FOUL! Holding foul on Tony Doncic. [Team fouls: 1] No free throws, side out. (Tony Doncic: 1 personal fouls)

[10:33] Team_042 possession (Score: 73-75)
FOUL! Reach-in foul on Bradley Dosunmu during the drive. [Team fouls: 2] No free throws, side out. (Bradley Dosunmu: 1 personal fouls)

[10:24] Team_042 possession (Score: 73-75)
Jarrett Sabonis drives and kicks out. Dejounte Butler attempts a 3Pt. Contested by Bradley Dosunmu (4.5 feet, MAN). Dejounte Butler misses. Offensive rebound by Cade Dosunmu! Cade Dosunmu puts it back in!
Score: 73-77

[10:10] Team_027 possession (Score: 73-77)
John Russell attempts a Layup. Contested by Cade Dosunmu (5.0 feet, MAN). JOHN RUSSELL MAKES IT! Assist: Bradley Dosunmu
Score: 75-77

[09:53] Team_042 possession (Score: 75-77)
Tyler Barrett drives, Tim Johnson stays with him. Tyler Barrett attempts a Dunk. Contested by Tim Johnson (5.6 feet, MAN). TYLER BARRETT MAKES IT! Assist: Kristaps Parker
Score: 75-79

[09:38] Team_027 possession (Score: 75-79)
Tony Doncic attempts a 3Pt. Contested by Tyler Barrett (3.7 feet, ZONE). Tony Doncic misses. Offensive rebound by John Russell! John Russell puts it back in!
Score: 77-79

[09:25] Team_042 possession (Score: 77-79)
Kristaps Parker drives and kicks out. Kristaps Parker attempts a 3Pt. Contested by Scottie Harden (4.9 feet, ZONE). Kristaps Parker misses. Offensive rebound by Dejounte Butler! Dejounte Butler's putback is no good. Offensive rebound by Dejounte Butler! Dejounte Butler kicks it out.

[09:11] Team_042 possession (Score: 77-79)
Tyler Barrett attempts a Midrange. Contested by Bradley Dosunmu (5.1 feet, ZONE). Tyler Barrett misses. Rebound secured by John Russell.

[09:00] Team_027 possession (Score: 77-79)
Scottie Harden drives, picks up Jarrett Sabonis. Help arrives from Tyler Barrett! Scottie Harden attempts a Dunk. Contested by Tyler Barrett (4.3 feet, MAN). Scottie Harden misses. Offensive rebound by Bradley Dosunmu! Bradley Dosunmu kicks it out.

[08:45] Team_027 possession (Score: 77-79)
Tony Doncic makes the Midrange and draws the foul on Kristaps Parker! And-1! Tony Doncic to the line for 1. [Team fouls: 3] (Kristaps Parker: 1 personal fouls)   FT 1/1: GOOD Tony Doncic makes 1/1 from the line.
Score: 80-79

[08:33] Team_042 possession (Score: 80-79)
Cade Dosunmu drives, picks up John Russell. Help arrives from Tony Doncic! Cade Dosunmu attempts a Layup. Contested by Tony Doncic (4.6 feet, MAN). Cade Dosunmu misses. Offensive rebound by Cade Dosunmu! Cade Dosunmu's putback is no good. Offensive rebound by Dejounte Butler! Dejounte Butler kicks it out.

[08:18] Team_042 possession (Score: 80-79)
FOUL! Holding foul on Tony Doncic. [Team fouls: 3] No free throws, side out. (Tony Doncic: 2 personal fouls)

[08:03] Team_042 possession (Score: 80-79)
Cade Dosunmu attempts a Layup. Contested by John Russell (4.7 feet, MAN). Cade Dosunmu misses. Offensive rebound by Dejounte Butler! Dejounte Butler's putback is no good. Rebound secured by Tony Doncic.

[07:48] Team_027 possession (Score: 80-79)
Tony Doncic attempts a 3Pt. Contested by Kristaps Parker (5.5 feet, MAN). Tony Doncic misses. Rebound secured by Dejounte Butler.

[07:35] Team_042 possession (Score: 80-79)
Tyler Barrett drives, Tim Johnson stays with him. Tyler Barrett attempts a Dunk. Contested by Tim Johnson (5.8 feet, MAN). Tyler Barrett misses. Rebound secured by Bradley Dosunmu.

[07:19] Team_027 possession (Score: 80-79)
Bradley Dosunmu attempts a Layup. BLOCKED BY CADE DOSUNMU! Ball is loose! Rebound secured by Cade Dosunmu.

[07:04] Team_042 possession (Score: 80-79)
FOUL! Holding foul on Tony Doncic. [Team fouls: 4] No free throws, side out. (Tony Doncic: 3 personal fouls)

[06:53] Team_042 possession (Score: 80-79)
Jarrett Sabonis attempts a 3Pt. Contested by Bradley Dosunmu (5.3 feet, ZONE). Jarrett Sabonis misses. Rebound secured by John Russell.

[06:35] Team_027 possession (Score: 80-79)
Tony Doncic attempts a 3Pt. Contested by Tyler Barrett (4.1 feet, ZONE). TONY DONCIC MAKES IT! Assist: Tim Johnson
Score: 83-79

[06:19] Team_042 possession (Score: 83-79)
FOUL! Shooting foul on John Russell. Cade Dosunmu to the line for 2 free throws. [BONUS: 5 team fouls] (John Russell: 1 personal fouls)   FT 1/2: GOOD   FT 2/2: MISS Cade Dosunmu makes 1/2 from the line. Rebound secured by John Russell.
Score: 83-80

[06:05] Team_027 possession (Score: 83-80)
John Russell attempts a Midrange. Contested by Cade Dosunmu (5.4 feet, MAN). John Russell misses. Rebound secured by Dejounte Butler.

[05:46] Team_042 possession (Score: 83-80)
Kristaps Parker commits a violation (traveling/carry)! TURNOVER! (dead ball)

[05:46] Substitution (Team_027): Tim Johnson OUT → CJ Green IN (stamina_rule2)

[05:46] Substitution (Team_027): Tony Doncic OUT → Dirk Lillard IN (stamina_rule2)

[05:46] Substitution (Team_027): Scottie Harden OUT → Rudy Quickley IN (stamina_rule2)

[05:46] Substitution (Team_027): Bradley Dosunmu OUT → LeBron Russell IN (stamina_rule2)

[05:46] Substitution (Team_027): John Russell OUT → Ben Stewart IN (stamina_rule2)

[05:46] Substitution (Team_042): Tyler Barrett OUT → Khris George IN (stamina_rule2)

[05:46] Substitution (Team_042): Kristaps Parker OUT → Isaiah Randle IN (stamina_rule2)

[05:46] Substitution (Team_042): Jarrett Sabonis OUT → Gary Jackson IN (stamina_rule2)

[05:46] Substitution (Team_042): Dejounte Butler OUT → Allen Towns IN (stamina_rule2)

[05:46] Substitution (Team_042): Cade Dosunmu OUT → Lamelo Stewart IN (stamina_rule2)

[05:30] Team_027 possession (Score: 83-80)
LeBron Russell drives, picks up Allen Towns. Help arrives from Khris George! LeBron Russell attempts a Layup. Contested by Khris George (4.3 feet, MAN). LeBron Russell misses. Offensive rebound by Dirk Lillard! Dirk Lillard kicks it out.

[05:18] Team_027 possession (Score: 83-80)
Dirk Lillard attempts a Midrange. Contested by Isaiah Randle (5.1 feet, MAN). DIRK LILLARD MAKES IT!
Score: 85-80

[05:07] Team_042 possession (Score: 85-80)
Allen Towns attempts a Midrange. Contested by LeBron Russell (6.0 feet, MAN). ALLEN TOWNS MAKES IT!
Score: 85-82

[04:53] Team_027 possession (Score: 85-82)
LeBron Russell attempts a Midrange. Contested by Allen Towns (4.3 feet, MAN). LEBRON RUSSELL MAKES IT! Assist: Dirk Lillard
Score: 87-82

[04:39] Team_042 possession (Score: 87-82)
Lamelo Stewart attempts a Midrange. Contested by Dirk Lillard (4.1 feet, ZONE). LAMELO STEWART MAKES IT! Assist: Gary Jackson
Score: 87-84

[04:28] Team_027 possession (Score: 87-84)
FOUL! Holding foul on Allen Towns. [Team fouls: 4] No free throws, side out. (Allen Towns: 1 personal fouls)

[04:14] Team_027 possession (Score: 87-84)
Ben Stewart attempts a Midrange. Contested by Lamelo Stewart (4.1 feet, MAN). Ben Stewart misses. Rebound secured by Gary Jackson.

[03:57] Team_042 possession (Score: 87-84)
Allen Towns drives and kicks out. Khris George attempts a 3Pt. Contested by CJ Green (5.1 feet, MAN). KHRIS GEORGE MAKES IT! Assist: Gary Jackson
Score: 87-87

[03:44] Team_027 possession (Score: 87-87)
CJ Green attempts a 3Pt. Contested by Khris George (4.1 feet, MAN). CJ Green misses. Rebound secured by Lamelo Stewart.

[03:31] Team_042 possession (Score: 87-87)
Gary Jackson attempts a 3Pt. Contested by Dirk Lillard (4.2 feet, ZONE). Gary Jackson misses. Rebound secured by Dirk Lillard.

[03:16] Team_027 possession (Score: 87-87)
CJ Green attempts a 3Pt. Contested by Khris George (4.1 feet, ZONE). CJ GREEN MAKES IT!
Score: 90-87

[03:00] Team_042 possession (Score: 90-87)
Gary Jackson attempts a 3Pt. Contested by Dirk Lillard (4.2 feet, ZONE). Gary Jackson misses. Rebound secured by Ben Stewart.

[02:41] Team_027 possession (Score: 90-87)
Rudy Quickley attempts a 3Pt. Contested by Gary Jackson (5.0 feet, MAN). Rudy Quickley misses. Rebound secured by Lamelo Stewart.

[02:25] Team_042 possession (Score: 90-87)
Khris George attempts a 3Pt. Contested by CJ Green (5.8 feet, MAN). Khris George misses. Rebound secured by Ben Stewart.

[02:11] Team_027 possession (Score: 90-87)
LeBron Russell attempts a 3Pt. Contested by Allen Towns (4.3 feet, MAN). LeBron Russell misses. Rebound secured by Allen Towns.

[01:58] Team_042 possession (Score: 90-87)
Lamelo Stewart attempts a Midrange. Contested by Ben Stewart (4.6 feet, MAN). Lamelo Stewart misses. Rebound secured by LeBron Russell.

[01:44] Team_027 possession (Score: 90-87)
Ben Stewart drives and kicks out. CJ Green attempts a 3Pt. Contested by Gary Jackson (4.6 feet, ZONE). CJ Green misses. Rebound secured by Lamelo Stewart.

[01:28] Team_042 possession (Score: 90-87)
Isaiah Randle attempts a 3Pt. Contested by LeBron Russell (5.6 feet, ZONE). Isaiah Randle misses. Rebound secured by Ben Stewart.

[01:14] Team_027 possession (Score: 90-87)
Rudy Quickley attempts a 3Pt. Contested by Khris George (4.4 feet, ZONE). Rudy Quickley misses. Rebound secured by Gary Jackson.

[00:59] Team_042 possession (Score: 90-87)
Isaiah Randle drives and kicks out. Gary Jackson attempts a Midrange. Contested by LeBron Russell (5.5 feet, ZONE). Gary Jackson misses. Rebound secured by Dirk Lillard.

[00:46] Team_027 possession (Score: 90-87)
FOUL! Reach-in foul on Isaiah Randle during the drive. [IN THE BONUS! 5 team fouls] Dirk Lillard to the line for 2 free throws. (Isaiah Randle: 1 personal fouls)   FT 1/2: GOOD   FT 2/2: GOOD Dirk Lillard makes 2/2 from the line.
Score: 92-87

[00:31] Team_042 possession (Score: 92-87)
FOUL! Shooting foul on Ben Stewart. Lamelo Stewart to the line for 2 free throws. [BONUS: 6 team fouls] (Ben Stewart: 1 personal fouls)   FT 1/2: GOOD   FT 2/2: GOOD Lamelo Stewart makes 2/2 from the line.
Score: 92-89

[00:15] Team_027 possession (Score: 92-89)
LeBron Russell attempts a Midrange. Contested by Isaiah Randle (5.1 feet, ZONE). LEBRON RUSSELL MAKES IT! Assist: Ben Stewart
Score: 94-89

[00:01] Team_042 possession (Score: 94-89)
FOUL! Holding foul on LeBron Russell. [IN THE BONUS! 7 team fouls] Allen Towns to the line for 2 free throws. (LeBron Russell: 1 personal fouls)   FT 1/2: GOOD   FT 2/2: GOOD Allen Towns makes 2/2 from the line.
Score: 94-91

================================================================================
                              4TH QUARTER COMPLETE                              
================================================================================

4TH QUARTER SCORE: Team_027 21, Team_042 16

BOX SCORE:
================================================================================

Team_027
--------------------------------------------------------------------------------
Player                MIN  PTS  REB  AST  TO      FG   FG%      3P   3P%
--------------------------------------------------------------------------------
Tony Doncic            36    6    1    0   0   2/3    66.7     0/0   0.0
John Russell           34    4    5    0   0   2/4    50.0     0/0   0.0
Dirk Lillard           13    4    3    1   0   2/2   100.0     0/0   0.0
LeBron Russell         15    4    1    0   0   2/3    66.7     0/0   0.0
CJ Green               15    3    0    0   0   1/2    50.0     0/0   0.0
Bradley Dosunmu        34    0    3    1   0   0/1     0.0     0/0   0.0
Scottie Harden         34    0    0    0   0   0/1     0.0     0/0   0.0
Tim Johnson            34    0    0    1   0   0/0     0.0     0/0   0.0
Ben Stewart            15    0    3    1   0   0/2     0.0     0/0   0.0
Rudy Quickley          15    0    0    0   0   0/2     0.0     0/0   0.0

TEAM: FG: 9/20 (45.0%), 3PT: 3/9 (33.3%), REB: 15 (4 off, 11 def), AST: 4, TO: 0
TEAM FOULS: 7 [Team_042 in BONUS]


Team_042
--------------------------------------------------------------------------------
Player                MIN  PTS  REB  AST  TO      FG   FG%      3P   3P%
--------------------------------------------------------------------------------
Allen Towns            15    4    1    0   0   2/2   100.0     0/0   0.0
Lamelo Stewart         15    4    3    0   0   2/3    66.7     0/0   0.0
Khris George           15    3    0    0   0   1/2    50.0     0/0   0.0
Cade Dosunmu           34    2    3    0   0   1/4    25.0     0/0   0.0
Tyler Barrett          34    2    0    0   0   1/3    33.3     0/0   0.0
Dejounte Butler        34    0    5    0   0   0/0     0.0     0/0   0.0
Kristaps Parker        34    0    0    1   0   0/0     0.0     0/0   0.0
Jarrett Sabonis        34    0    0    0   0   0/1     0.0     0/0   0.0
Gary Jackson           15    0    2    2   0   0/2     0.0     0/0   0.0
Isaiah Randle          15    0    0    0   0   0/2     0.0     0/0   0.0

TEAM: FG: 7/19 (36.8%), 3PT: 0/6 (0.0%), REB: 15 (4 off, 11 def), AST: 3, TO: 1
TEAM FOULS: 5 [Team_027 in BONUS]

================================================================================

================================================================================
                               FULL GAME COMPLETE                               
================================================================================

FINAL SCORE: Team_027 94, Team_042 91

SCORING BY QUARTER:
--------------------------------------------------------------------------------
Team                     Q1     Q2     Q3     Q4    FINAL
--------------------------------------------------------------------------------
Team_027                 21     20     32     21       94
Team_042                 34     13     28     16       91
--------------------------------------------------------------------------------

FULL GAME BOX SCORE:
================================================================================

Team_027
--------------------------------------------------------------------------------
Player                MIN  PTS  REB  AST  TO      FG   FG%      3P   3P%      FT STL BLK
--------------------------------------------------------------------------------
Tony Doncic            36   17    8    3   2   7/10   70.0   4/6    66.7   7/7     0   0
Tim Johnson            34   14    0    2   3   6/11   54.5   1/5    20.0   1/1     2   0
Scottie Harden         34    7    0    0   1   4/8    50.0   1/4    25.0   1/1     1   0
Bradley Dosunmu        34    9   12    1   3   5/9    55.6   2/3    66.7   5/6     0   0
John Russell           34   15   14    4   2   4/12   33.3   0/1     0.0   3/4     0   0
CJ Green               15    9    0    0   0   4/6    66.7   1/3    33.3   2/2     0   0
Rudy Quickley          15    6    0    1   0   3/7    42.9   0/3     0.0   4/4     1   1
LeBron Russell         15    4    5    1   1   2/5    40.0   0/1     0.0   0/0     0   0
Ben Stewart            15    6    6    3   0   3/7    42.9   0/2     0.0   2/2     0   1
Dirk Lillard           13    4    3    1   0   2/3    66.7   0/1     0.0   2/2     0   0

TEAM: FG: 40/78 (51.3%), 3PT: 9/29 (31.0%), REB: 46 (11 off, 35 def), AST: 16, TO: 12


Team_042
--------------------------------------------------------------------------------
Player                MIN  PTS  REB  AST  TO      FG   FG%      3P   3P%      FT STL BLK
--------------------------------------------------------------------------------
Tyler Barrett          34   20    3    4   2   7/11   63.6   2/3    66.7   4/5     0   0
Kristaps Parker        34    7    0    1   2   3/7    42.9   1/4    25.0   1/2     0   0
Jarrett Sabonis        34   13    0    3   1   6/12   50.0   2/6    33.3   1/1     0   0
Dejounte Butler        34   12   16    1   0   6/11   54.5   0/3     0.0   2/2     1   0
Cade Dosunmu           34   12   13    4   0   6/12   50.0   0/2     0.0   5/6     2   3
Khris George           15    9    0    1   0   2/5    40.0   0/2     0.0   0/0     0   0
Isaiah Randle          15    0    0    1   0   1/3    33.3   0/1     0.0   0/0     0   0
Gary Jackson           15    0    4    3   2   1/7    14.3   0/3     0.0   0/0     0   0
Allen Towns            15   11    5    0   1   5/6    83.3   0/0     0.0   3/3     1   0
Lamelo Stewart         15    5    7    2   0   2/4    50.0   0/1     0.0   3/4     0   0

TEAM: FG: 40/79 (50.6%), 3PT: 5/25 (20.0%), REB: 50 (14 off, 36 def), AST: 20, TO: 8

================================================================================
