================================================================================
                        FULL GAME - Team_081 vs Team_025                        
================================================================================

================================================================================
                       1ST QUARTER - Team_081 vs Team_025                       
================================================================================

[12:00] Team_081 possession (Score: 0-0)
Franz Antetokounmpo drives and kicks out. Bradley Sabonis attempts a 3Pt. Contested by Cade Anthony (4.2 feet, MAN). Bradley Sabonis misses. Rebound secured by Cade Anthony.

[11:45] Team_025 possession (Score: 0-0)
Ben Giddey attempts a Midrange. Contested by Bradley Sabonis (4.5 feet, ZONE). BEN GIDDEY MAKES IT!
Score: 0-2

[11:27] Team_081 possession (Score: 0-2)
Bradley Leonard loses the ball! Stripped by Ben Giddey! TURNOVER! (live ball)

[11:16] Team_025 possession (Score: 0-2)
Desmond Jordan attempts a 3Pt. Contested by Vince Adebayo (3.6 feet, MAN). Desmond Jordan misses. Rebound secured by Bradley Sabonis.

[11:01] Team_081 possession (Score: 0-2)
Bradley Leonard attempts a 3Pt. Contested by Ben Giddey (3.8 feet, ZONE). Bradley Leonard misses. Offensive rebound by Bradley Sabonis! Bradley Sabonis kicks it out.

[10:48] Team_081 possession (Score: 0-2)
Franz Antetokounmpo drives and kicks out. Bradley Leonard attempts a Midrange. Contested by Ben Giddey (3.6 feet, MAN). BRADLEY LEONARD MAKES IT! Assist: Vince Adebayo
Score: 2-2

[10:37] Team_025 possession (Score: 2-2)
Paolo Lowry drives and kicks out. Paolo Lowry attempts a 3Pt. Contested by Julius Durant (4.0 feet, MAN). PAOLO LOWRY MAKES IT! Assist: Cade Anthony
Score: 2-5

[10:20] Team_081 possession (Score: 2-5)
Bradley Leonard drives, Allen Embiid stays with him. Bradley Leonard attempts a Dunk. Contested by Allen Embiid (3.0 feet, ZONE). Bradley Leonard misses. Rebound secured by Cade Anthony.

[10:04] Team_025 possession (Score: 2-5)
FOUL! Shooting foul on Bradley Sabonis. Desmond Jordan to the line for 3 free throws. [Team fouls: 1] (Bradley Sabonis: 1 personal fouls)   FT 1/3: GOOD   FT 2/3: GOOD   FT 3/3: MISS Desmond Jordan makes 2/3 from the line. Offensive rebound by Allen Embiid! Allen Embiid's putback is no good.
Score: 2-7

[09:51] Team_081 possession (Score: 2-7)
Bradley Leonard attempts a 3Pt. Contested by Ben Giddey (3.8 feet, MAN). BRADLEY LEONARD MAKES IT! Assist: Franz Antetokounmpo
Score: 5-7

[09:39] Team_025 possession (Score: 5-7)
Desmond Jordan drives, Vince Adebayo stays with him. Desmond Jordan attempts a Layup. Contested by Vince Adebayo (3.6 feet, MAN). DESMOND JORDAN MAKES IT!
Score: 5-9

[09:22] Team_081 possession (Score: 5-9)
Bradley Leonard attempts a Midrange. Contested by Ben Giddey (3.8 feet, MAN). Bradley Leonard misses. Rebound secured by Allen Embiid.

[09:04] Team_025 possession (Score: 5-9)
Desmond Jordan attempts a Midrange. Contested by Bradley Leonard (3.9 feet, ZONE). Desmond Jordan misses. Rebound secured by Franz Antetokounmpo.

[08:47] Team_081 possession (Score: 5-9)
Vince Adebayo attempts a 3Pt. Contested by Desmond Jordan (3.4 feet, MAN). Vince Adebayo misses. Rebound secured by Cade Anthony.

[08:37] Team_025 possession (Score: 5-9)
Ben Giddey attempts a Midrange. Contested by Vince Adebayo (3.9 feet, ZONE). Ben Giddey misses. Rebound secured by Vince Adebayo.

[08:22] Team_081 possession (Score: 5-9)
FOUL! Holding foul on Cade Anthony. [Team fouls: 1] No free throws, side out. (Cade Anthony: 1 personal fouls)

[08:08] Team_081 possession (Score: 5-9)
Franz Antetokounmpo attempts a Layup. Contested by Allen Embiid (3.0 feet, MAN). FRANZ ANTETOKOUNMPO MAKES IT! Assist: Vince Adebayo
Score: 7-9

[07:56] Team_025 possession (Score: 7-9)
FOUL! Shooting foul on Julius Durant. Paolo Lowry to the line for 2 free throws. [Team fouls: 2] (Julius Durant: 1 personal fouls)   FT 1/2: MISS   FT 2/2: GOOD Paolo Lowry makes 1/2 from the line.
Score: 7-10

[07:41] Team_081 possession (Score: 7-10)
Julius Durant attempts a Layup. Contested by Allen Embiid (3.0 feet, ZONE). JULIUS DURANT MAKES IT! Assist: Bradley Leonard
Score: 9-10

[07:29] Team_025 possession (Score: 9-10)
Allen Embiid drives to the basket... Allen Embiid throws a bad pass out of bounds! TURNOVER! (dead ball)

[07:13] Team_081 possession (Score: 9-10)
Franz Antetokounmpo attempts a Dunk. BLOCKED BY ALLEN EMBIID! Ball is loose! Rebound secured by Cade Anthony.

[06:59] Team_025 possession (Score: 9-10)
Allen Embiid drives to the basket... FOUL! Offensive foul on Allen Embiid! Franz Antetokounmpo drew the charge! [Team fouls: 2] (Allen Embiid: 1 personal fouls) TURNOVER! (dead ball)

[06:41] Team_081 possession (Score: 9-10)
Vince Adebayo attempts a Midrange. Contested by Desmond Jordan (3.4 feet, MAN). VINCE ADEBAYO MAKES IT!
Score: 11-10

[06:26] Team_025 possession (Score: 11-10)
Paolo Lowry attempts a 3Pt. Contested by Julius Durant (4.4 feet, MAN). Paolo Lowry misses. Rebound secured by Franz Antetokounmpo.

[06:10] Team_081 possession (Score: 11-10)
Bradley Leonard throws a bad pass out of bounds! TURNOVER! (dead ball)

[05:55] Team_025 possession (Score: 11-10)
Cade Anthony attempts a 3Pt. Contested by Bradley Sabonis (4.7 feet, MAN). Cade Anthony misses. Rebound secured by Franz Antetokounmpo.

[05:40] Team_081 possession (Score: 11-10)
Franz Antetokounmpo attempts a Midrange. Contested by Allen Embiid (3.0 feet, MAN). Franz Antetokounmpo misses. Rebound secured by Desmond Jordan.

[05:26] Team_025 possession (Score: 11-10)
Ben Giddey attempts a 3Pt. Contested by Bradley Sabonis (4.5 feet, ZONE). Ben Giddey misses. Rebound secured by Franz Antetokounmpo.

[05:16] Team_081 possession (Score: 11-10)
Bradley Leonard attempts a 3Pt. Contested by Ben Giddey (3.8 feet, ZONE). Bradley Leonard misses. Rebound secured by Allen Embiid.

[05:06] Team_025 possession (Score: 11-10)
Cade Anthony makes the Midrange and draws the foul on Bradley Sabonis! And-1! Cade Anthony to the line for 1. [Team fouls: 3] (Bradley Sabonis: 2 personal fouls)   FT 1/1: GOOD Cade Anthony makes 1/1 from the line.
Score: 11-13

[04:54] Team_081 possession (Score: 11-13)
Franz Antetokounmpo drives and kicks out. Vince Adebayo attempts a 3Pt. Contested by Ben Giddey (3.6 feet, ZONE). VINCE ADEBAYO MAKES IT! Assist: Bradley Leonard
Score: 14-13

[04:40] Team_025 possession (Score: 14-13)
Allen Embiid attempts a Layup. Contested by Franz Antetokounmpo (4.5 feet, MAN). Allen Embiid misses. Offensive rebound by Desmond Jordan! Desmond Jordan puts it back in!
Score: 14-15

[04:27] Team_081 possession (Score: 14-15)
Julius Durant attempts a 3Pt. Contested by Paolo Lowry (5.1 feet, MAN). Julius Durant misses. Rebound secured by Cade Anthony.

[04:12] Team_025 possession (Score: 14-15)
Desmond Jordan attempts a Midrange. Contested by Bradley Leonard (3.9 feet, ZONE). DESMOND JORDAN MAKES IT!
Score: 14-17

[03:53] Team_081 possession (Score: 14-17)
FOUL! Offensive foul on Vince Adebayo! Desmond Jordan drew the charge! [Team fouls: 4] (Vince Adebayo: 1 personal fouls) TURNOVER! (dead ball)

[03:42] Team_025 possession (Score: 14-17)
Cade Anthony attempts a 3Pt. Contested by Bradley Sabonis (4.8 feet, MAN). Cade Anthony misses. Rebound secured by Bradley Sabonis.

[03:29] Team_081 possession (Score: 14-17)
FOUL! Reach-in foul on Allen Embiid during the drive. [Team fouls: 3] No free throws, side out. (Allen Embiid: 2 personal fouls)

[03:12] Team_081 possession (Score: 14-17)
Bradley Leonard makes the Layup and draws the foul on Ben Giddey! And-1! Bradley Leonard to the line for 1. [Team fouls: 4] (Ben Giddey: 1 personal fouls)   FT 1/1: GOOD Bradley Leonard makes 1/1 from the line.
Score: 17-17

[02:57] Team_025 possession (Score: 17-17)
Cade Anthony attempts a Layup. Contested by Franz Antetokounmpo (5.2 feet, ZONE). CADE ANTHONY MAKES IT! Assist: Allen Embiid
Score: 17-19

[02:41] Team_081 possession (Score: 17-19)
FOUL! Holding foul on Allen Embiid. [IN THE BONUS! 5 team fouls] Franz Antetokounmpo to the line for 2 free throws. (Allen Embiid: 3 personal fouls)   FT 1/2: MISS   FT 2/2: GOOD Franz Antetokounmpo makes 1/2 from the line.
Score: 18-19

[02:24] Team_025 possession (Score: 18-19)
Ben Giddey attempts a 3Pt. Contested by Bradley Leonard (4.4 feet, MAN). Ben Giddey misses. Rebound secured by Bradley Sabonis.

[02:07] Team_081 possession (Score: 18-19)
Bradley Leonard loses control! Ball rolls out of bounds! TURNOVER! (dead ball)

[02:07] Substitution (Team_081): Julius Durant OUT → Dejounte Bane IN (stamina_rule2)

[02:07] Substitution (Team_081): Bradley Leonard OUT → Lamelo Wade IN (stamina_rule2)

[02:07] Substitution (Team_081): Vince Adebayo OUT → Larry Adebayo IN (stamina_rule2)

[02:07] Substitution (Team_081): Bradley Sabonis OUT → Chris Holiday IN (stamina_rule2)

[02:07] Substitution (Team_081): Franz Antetokounmpo OUT → D'Angelo Markkanen IN (stamina_rule2)

[02:07] Substitution (Team_025): Paolo Lowry OUT → LeBron Griffin IN (stamina_rule2)

[02:07] Substitution (Team_025): Ben Giddey OUT → Dirk Gilgeous-Alexander IN (stamina_rule2)

[02:07] Substitution (Team_025): Desmond Jordan OUT → Immanuel LaVine IN (stamina_rule2)

[02:07] Substitution (Team_025): Allen Embiid OUT → Nikola Lillard IN (stamina_rule2)

[01:56] Team_025 possession (Score: 18-19)
FOUL! Holding foul on Dejounte Bane. [IN THE BONUS! 5 team fouls] LeBron Griffin to the line for 2 free throws. (Dejounte Bane: 1 personal fouls)   FT 1/2: GOOD   FT 2/2: MISS LeBron Griffin makes 1/2 from the line. Rebound secured by Lamelo Wade.
Score: 18-20

[01:44] Team_081 possession (Score: 18-20)
Chris Holiday drives and kicks out. D'Angelo Markkanen attempts a 3Pt. Contested by LeBron Griffin (4.7 feet, ZONE). D'Angelo Markkanen misses. Rebound secured by Cade Anthony.

[01:27] Team_025 possession (Score: 18-20)
Nikola Lillard makes the Dunk and draws the foul on Chris Holiday! And-1! Nikola Lillard to the line for 1. [BONUS: 6 team fouls] (Chris Holiday: 1 personal fouls)   FT 1/1: GOOD Nikola Lillard makes 1/1 from the line.
Score: 18-23

[01:10] Team_081 possession (Score: 18-23)
Lamelo Wade attempts a 3Pt. Contested by LeBron Griffin (4.6 feet, ZONE). LAMELO WADE MAKES IT! Assist: Chris Holiday
Score: 21-23

[00:53] Team_025 possession (Score: 21-23)
LeBron Griffin throws a bad pass out of bounds! TURNOVER! (dead ball)

[00:53] Substitution (Team_025): Cade Anthony OUT → Damian Adebayo IN (stamina_rule2)

[00:38] Team_081 possession (Score: 21-23)
Chris Holiday drives, Nikola Lillard stays with him. Chris Holiday attempts a Dunk. Contested by Nikola Lillard (4.5 feet, ZONE). CHRIS HOLIDAY MAKES IT!
Score: 23-23

[00:24] Team_025 possession (Score: 23-23)
Damian Adebayo attempts a 3Pt. Contested by Chris Holiday (4.2 feet, ZONE). Damian Adebayo misses. Rebound secured by Lamelo Wade.

[00:06] Team_081 possession (Score: 23-23)
Lamelo Wade attempts a Midrange. Contested by Dirk Gilgeous-Alexander (5.6 feet, MAN). LAMELO WADE MAKES IT!
Score: 25-23

================================================================================
                              1ST QUARTER COMPLETE                              
================================================================================

1ST QUARTER SCORE: Team_081 25, Team_025 23

BOX SCORE:
================================================================================

Team_081
--------------------------------------------------------------------------------
Player                MIN  PTS  REB  AST  TO      FG   FG%      3P   3P%
--------------------------------------------------------------------------------
Bradley Leonard        10    8    0    2   0   3/6    50.0     0/0   0.0
Vince Adebayo          10    5    1    2   0   2/3    66.7     0/0   0.0
Lamelo Wade             2    5    2    0   0   2/2   100.0     0/0   0.0
Franz Antetokounmpo    10    3    4    1   0   2/5    40.0     0/0   0.0
Julius Durant          10    2    0    0   0   1/2    50.0     0/0   0.0
Chris Holiday           2    2    0    1   0   1/2    50.0     0/0   0.0
Bradley Sabonis        10    0    4    0   0   0/0     0.0     0/0   0.0

TEAM: FG: 11/20 (55.0%), 3PT: 2/5 (40.0%), REB: 12 (1 off, 11 def), AST: 6, TO: 4
TEAM FOULS: 6 [Team_025 in BONUS]


Team_025
--------------------------------------------------------------------------------
Player                MIN  PTS  REB  AST  TO      FG   FG%      3P   3P%
--------------------------------------------------------------------------------
Desmond Jordan         10    6    2    0   0   3/6    50.0     0/0   0.0
Cade Anthony           11    5    6    1   0   2/4    50.0     0/0   0.0
Paolo Lowry            10    4    0    0   0   2/3    66.7     0/0   0.0
Nikola Lillard          2    3    0    0   0   1/1   100.0     0/0   0.0
Ben Giddey             10    2    0    0   0   1/4    25.0     0/0   0.0
Allen Embiid           10    0    3    1   0   0/0     0.0     0/0   0.0
Damian Adebayo          1    0    0    0   0   0/1     0.0     0/0   0.0

TEAM: FG: 9/20 (45.0%), 3PT: 0/8 (0.0%), REB: 10 (1 off, 9 def), AST: 2, TO: 3
TEAM FOULS: 5 [Team_081 in BONUS]

================================================================================

================================================================================
                       2ND QUARTER - Team_081 vs Team_025                       
================================================================================

[12:00] Team_081 possession (Score: 25-23)
Bradley Leonard attempts a 3Pt. Contested by Ben Giddey (3.8 feet, MAN). Bradley Leonard misses. Rebound secured by Allen Embiid.

[11:45] Team_025 possession (Score: 25-23)
Desmond Jordan attempts a Layup. Contested by Franz Antetokounmpo (4.5 feet, ZONE). DESMOND JORDAN MAKES IT! Assist: Allen Embiid
Score: 25-25

[11:29] Team_081 possession (Score: 25-25)
Franz Antetokounmpo attempts a Midrange. Contested by Allen Embiid (3.1 feet, MAN). Franz Antetokounmpo misses. Rebound secured by Allen Embiid.

[11:16] Team_025 possession (Score: 25-25)
Desmond Jordan attempts a Layup. Contested by Franz Antetokounmpo (4.5 feet, ZONE). DESMOND JORDAN MAKES IT!
Score: 25-27

[11:02] Team_081 possession (Score: 25-27)
Vince Adebayo throws a bad pass out of bounds! TURNOVER! (dead ball)

[10:47] Team_025 possession (Score: 25-27)
FOUL! Holding foul on Bradley Leonard. [Team fouls: 1] No free throws, side out. (Bradley Leonard: 1 personal fouls)

[10:30] Team_025 possession (Score: 25-27)
Desmond Jordan attempts a 3Pt. Contested by Bradley Sabonis (4.3 feet, ZONE). DESMOND JORDAN MAKES IT! Assist: Ben Giddey
Score: 25-30

[10:12] Team_081 possession (Score: 25-30)
FOUL! Reach-in foul on Paolo Lowry during the drive. [Team fouls: 1] No free throws, side out. (Paolo Lowry: 1 personal fouls)

[09:58] Team_081 possession (Score: 25-30)
FOUL! Shooting foul on Cade Anthony. Bradley Sabonis to the line for 2 free throws. [Team fouls: 2] (Cade Anthony: 1 personal fouls)   FT 1/2: GOOD   FT 2/2: GOOD Bradley Sabonis makes 2/2 from the line.
Score: 27-30

[09:40] Team_025 possession (Score: 27-30)
Paolo Lowry attempts a 3Pt. Contested by Bradley Leonard (4.3 feet, ZONE). PAOLO LOWRY MAKES IT! Assist: Ben Giddey
Score: 27-33

[09:26] Team_081 possession (Score: 27-33)
FOUL! Holding foul on Desmond Jordan. [Team fouls: 3] No free throws, side out. (Desmond Jordan: 1 personal fouls)

[09:12] Team_081 possession (Score: 27-33)
Vince Adebayo drives and kicks out. Vince Adebayo attempts a Midrange. Contested by Cade Anthony (4.6 feet, ZONE). Vince Adebayo misses. Rebound secured by Cade Anthony.

[08:52] Team_025 possession (Score: 27-33)
Ben Giddey attempts a Midrange. Contested by Bradley Leonard (4.4 feet, MAN). BEN GIDDEY MAKES IT!
Score: 27-35

[08:41] Team_081 possession (Score: 27-35)
Franz Antetokounmpo attempts a Layup. Contested by Cade Anthony (4.8 feet, ZONE). FRANZ ANTETOKOUNMPO MAKES IT! Assist: Bradley Leonard
Score: 29-35

[08:30] Team_025 possession (Score: 29-35)
FOUL! Shooting foul on Franz Antetokounmpo. Cade Anthony to the line for 2 free throws. [Team fouls: 2] (Franz Antetokounmpo: 1 personal fouls)   FT 1/2: MISS   FT 2/2: GOOD Cade Anthony makes 1/2 from the line.
Score: 29-36

[08:17] Team_081 possession (Score: 29-36)
Bradley Leonard drives to the basket... Bradley Leonard throws a bad pass! Stolen by Allen Embiid! TURNOVER! (live ball)

[07:58] Team_025 possession (Score: 29-36)
FOUL! Holding foul on Julius Durant. [Team fouls: 3] No free throws, side out. (Julius Durant: 1 personal fouls)

[07:48] Team_025 possession (Score: 29-36)
FOUL! Holding foul on Bradley Leonard. [Team fouls: 4] No free throws, side out. (Bradley Leonard: 2 personal fouls)

[07:33] Team_025 possession (Score: 29-36)
Ben Giddey attempts a 3Pt. Contested by Bradley Leonard (4.5 feet, MAN). Ben Giddey misses. Rebound secured by Franz Antetokounmpo.

[07:23] Team_081 possession (Score: 29-36)
FOUL! Shooting foul on Allen Embiid. Franz Antetokounmpo to the line for 2 free throws. [Team fouls: 4] (Allen Embiid: 1 personal fouls)   FT 1/2: GOOD   FT 2/2: MISS Franz Antetokounmpo makes 1/2 from the line. Rebound secured by Allen Embiid.
Score: 30-36

[07:12] Team_025 possession (Score: 30-36)
Allen Embiid drives to the basket... Allen Embiid loses control! Ball rolls out of bounds! TURNOVER! (dead ball)

[07:12] Substitution (Team_081): Julius Durant OUT → Dejounte Bane IN (stamina_rule2)

[07:12] Substitution (Team_081): Bradley Leonard OUT → Lamelo Wade IN (stamina_rule2)

[07:12] Substitution (Team_081): Vince Adebayo OUT → Larry Adebayo IN (stamina_rule2)

[07:12] Substitution (Team_081): Bradley Sabonis OUT → Chris Holiday IN (stamina_rule2)

[07:12] Substitution (Team_081): Franz Antetokounmpo OUT → D'Angelo Markkanen IN (stamina_rule2)

[07:12] Substitution (Team_025): Paolo Lowry OUT → LeBron Griffin IN (stamina_rule2)

[07:12] Substitution (Team_025): Ben Giddey OUT → Dirk Gilgeous-Alexander IN (stamina_rule2)

[07:12] Substitution (Team_025): Desmond Jordan OUT → Immanuel LaVine IN (stamina_rule2)

[07:12] Substitution (Team_025): Cade Anthony OUT → Damian Adebayo IN (stamina_rule2)

[07:12] Substitution (Team_025): Allen Embiid OUT → Nikola Lillard IN (stamina_rule2)

[06:56] Team_081 possession (Score: 30-36)
Chris Holiday attempts a Midrange. Contested by Damian Adebayo (5.0 feet, MAN). Chris Holiday misses. Rebound secured by Nikola Lillard.

[06:42] Team_025 possession (Score: 30-36)
LeBron Griffin drives to the basket... LeBron Griffin throws a bad pass out of bounds! TURNOVER! (dead ball)

[06:24] Team_081 possession (Score: 30-36)
Dejounte Bane attempts a 3Pt. Contested by LeBron Griffin (4.9 feet, MAN). Dejounte Bane misses. Offensive rebound by Lamelo Wade! Lamelo Wade kicks it out.

[06:13] Team_081 possession (Score: 30-36)
FOUL! Offensive foul on D'Angelo Markkanen! Nikola Lillard drew the charge! [Team fouls: 5] (D'Angelo Markkanen: 1 personal fouls) TURNOVER! (dead ball)

[06:00] Team_025 possession (Score: 30-36)
Nikola Lillard attempts a 3Pt. Contested by Chris Holiday (4.4 feet, ZONE). Nikola Lillard misses. Rebound secured by Larry Adebayo.

[05:46] Team_081 possession (Score: 30-36)
Larry Adebayo drives to the basket... Larry Adebayo throws a bad pass out of bounds! TURNOVER! (dead ball)

[05:28] Team_025 possession (Score: 30-36)
Dirk Gilgeous-Alexander attempts a 3Pt. Contested by Lamelo Wade (4.9 feet, MAN). DIRK GILGEOUS-ALEXANDER MAKES IT!
Score: 30-39

[05:12] Team_081 possession (Score: 30-39)
Larry Adebayo attempts a 3Pt. Contested by Immanuel LaVine (4.4 feet, MAN). Larry Adebayo misses. Rebound secured by Nikola Lillard.

[04:56] Team_025 possession (Score: 30-39)
Damian Adebayo attempts a 3Pt. Contested by Chris Holiday (4.2 feet, MAN). Damian Adebayo misses. Rebound secured by Chris Holiday.

[04:41] Team_081 possession (Score: 30-39)
D'Angelo Markkanen drives to the basket... D'Angelo Markkanen loses the ball! Stripped by Damian Adebayo! TURNOVER! (live ball)

[04:25] Team_025 possession (Score: 30-39)
FOUL! Holding foul on Dejounte Bane. [IN THE BONUS! 6 team fouls] LeBron Griffin to the line for 2 free throws. (Dejounte Bane: 1 personal fouls)   FT 1/2: GOOD   FT 2/2: GOOD LeBron Griffin makes 2/2 from the line.
Score: 30-41

[04:10] Team_081 possession (Score: 30-41)
FOUL! Offensive foul on Dejounte Bane! LeBron Griffin drew the charge! [Team fouls: 7] (Dejounte Bane: 2 personal fouls) TURNOVER! (dead ball)

[03:55] Team_025 possession (Score: 30-41)
Damian Adebayo attempts a Layup. BLOCKED BY CHRIS HOLIDAY! Ball is loose! Offensive rebound by Nikola Lillard! Nikola Lillard kicks it out.

[03:38] Team_025 possession (Score: 30-41)
Dirk Gilgeous-Alexander drives to the basket... FOUL! Offensive foul on Dirk Gilgeous-Alexander! Lamelo Wade drew the charge! [Team fouls: 5] (Dirk Gilgeous-Alexander: 1 personal fouls) TURNOVER! (dead ball)

[03:24] Team_081 possession (Score: 30-41)
D'Angelo Markkanen attempts a 3Pt. Contested by LeBron Griffin (4.8 feet, ZONE). D'Angelo Markkanen misses. Rebound secured by Immanuel LaVine.

[03:08] Team_025 possession (Score: 30-41)
Nikola Lillard attempts a 3Pt. Contested by Chris Holiday (4.4 feet, ZONE). Nikola Lillard misses. Offensive rebound by Nikola Lillard! Nikola Lillard kicks it out.

[02:53] Team_025 possession (Score: 30-41)
Damian Adebayo attempts a Midrange. Contested by Chris Holiday (4.2 feet, MAN). DAMIAN ADEBAYO MAKES IT!
Score: 30-43

[02:33] Team_081 possession (Score: 30-43)
Lamelo Wade attempts a Midrange. Contested by LeBron Griffin (4.6 feet, ZONE). Lamelo Wade misses. Rebound secured by Immanuel LaVine.

[02:19] Team_025 possession (Score: 30-43)
FOUL! Holding foul on Chris Holiday. [IN THE BONUS! 9 team fouls] Damian Adebayo to the line for 2 free throws. (Chris Holiday: 1 personal fouls)   FT 1/2: GOOD   FT 2/2: GOOD Damian Adebayo makes 2/2 from the line.
Score: 30-45

[02:06] Team_081 possession (Score: 30-45)
Chris Holiday attempts a Midrange. BLOCKED BY DAMIAN ADEBAYO! Ball is loose! Rebound secured by Dirk Gilgeous-Alexander.

[01:48] Team_025 possession (Score: 30-45)
Nikola Lillard attempts a Midrange. Contested by Chris Holiday (4.4 feet, MAN). NIKOLA LILLARD MAKES IT!
Score: 30-47

[01:38] Team_081 possession (Score: 30-47)
Larry Adebayo attempts a Midrange. Contested by LeBron Griffin (4.6 feet, ZONE). Larry Adebayo misses. Rebound secured by Nikola Lillard.

[01:25] Team_025 possession (Score: 30-47)
Nikola Lillard attempts a Layup. BLOCKED BY CHRIS HOLIDAY! Ball is loose! Offensive rebound by Immanuel LaVine! Immanuel LaVine kicks it out.

[01:11] Team_025 possession (Score: 30-47)
Nikola Lillard attempts a Layup. Contested by Chris Holiday (4.4 feet, MAN). Nikola Lillard misses. Rebound secured by Larry Adebayo.

[00:55] Team_081 possession (Score: 30-47)
Dejounte Bane attempts a 3Pt. Contested by LeBron Griffin (4.9 feet, ZONE). Dejounte Bane misses. Rebound secured by Immanuel LaVine.

[00:40] Team_025 possession (Score: 30-47)
FOUL! Holding foul on Larry Adebayo. [IN THE BONUS! 10 team fouls] Immanuel LaVine to the line for 2 free throws. (Larry Adebayo: 2 personal fouls)   FT 1/2: GOOD   FT 2/2: GOOD Immanuel LaVine makes 2/2 from the line.
Score: 30-49

[00:25] Team_081 possession (Score: 30-49)
Chris Holiday loses control! Ball rolls out of bounds! TURNOVER! (dead ball)

[00:12] Team_025 possession (Score: 30-49)
Damian Adebayo attempts a 3Pt. Contested by Chris Holiday (4.3 feet, ZONE). Damian Adebayo misses. Rebound secured by Chris Holiday.

================================================================================
                              2ND QUARTER COMPLETE                              
================================================================================

2ND QUARTER SCORE: Team_081 5, Team_025 26

BOX SCORE:
================================================================================

Team_081
--------------------------------------------------------------------------------
Player                MIN  PTS  REB  AST  TO      FG   FG%      3P   3P%
--------------------------------------------------------------------------------
Franz Antetokounmpo    15    2    1    0   0   1/3    33.3     0/0   0.0
Bradley Sabonis        15    2    0    0   0   1/1   100.0     0/0   0.0
Bradley Leonard        15    0    0    1   0   0/1     0.0     0/0   0.0
Vince Adebayo          15    0    0    0   0   0/1     0.0     0/0   0.0
Chris Holiday           9    0    2    0   0   0/2     0.0     0/0   0.0
Lamelo Wade             9    0    1    0   0   0/1     0.0     0/0   0.0
Larry Adebayo           9    0    2    0   0   0/2     0.0     0/0   0.0
D'Angelo Markkanen      9    0    0    0   0   0/1     0.0     0/0   0.0
Dejounte Bane           9    0    0    0   0   0/1     0.0     0/0   0.0

TEAM: FG: 2/13 (15.4%), 3PT: 0/4 (0.0%), REB: 6 (1 off, 5 def), AST: 1, TO: 7
TEAM FOULS: 10 [Team_025 in BONUS]


Team_025
--------------------------------------------------------------------------------
Player                MIN  PTS  REB  AST  TO      FG   FG%      3P   3P%
--------------------------------------------------------------------------------
Desmond Jordan         15    7    0    0   0   3/3   100.0     0/0   0.0
Damian Adebayo          8    4    0    0   0   2/4    50.0     0/0   0.0
Paolo Lowry            15    3    0    0   0   1/1   100.0     0/0   0.0
Dirk Gilgeous-Alexander    9    3    1    0   0   1/1   100.0     0/0   0.0
Ben Giddey             15    2    0    2   0   1/2    50.0     0/0   0.0
Nikola Lillard          9    2    5    0   0   1/3    33.3     0/0   0.0
LeBron Griffin          9    2    0    0   0   1/1   100.0     0/0   0.0
Immanuel LaVine         9    2    4    0   0   1/1   100.0     0/0   0.0
Cade Anthony           16    1    1    0   0   1/1   100.0     0/0   0.0
Allen Embiid           15    0    3    1   0   0/0     0.0     0/0   0.0

TEAM: FG: 12/17 (70.6%), 3PT: 3/7 (42.9%), REB: 14 (3 off, 11 def), AST: 3, TO: 3
TEAM FOULS: 5 [Team_081 in BONUS]

================================================================================

================================================================================
                       3RD QUARTER - Team_081 vs Team_025                       
================================================================================

[12:00] Team_081 possession (Score: 30-49)
FOUL! Reach-in foul on Allen Embiid during the drive. [Team fouls: 1] No free throws, side out. (Allen Embiid: 1 personal fouls)

[11:45] Team_081 possession (Score: 30-49)
Vince Adebayo attempts a Midrange. Contested by Desmond Jordan (3.4 feet, MAN). VINCE ADEBAYO MAKES IT!
Score: 32-49

[11:31] Team_025 possession (Score: 32-49)
Allen Embiid drives and kicks out. Paolo Lowry attempts a 3Pt. Contested by Julius Durant (4.0 feet, MAN). Paolo Lowry misses. Offensive rebound by Desmond Jordan! Desmond Jordan's putback is no good. Rebound secured by Bradley Sabonis.

[11:16] Team_081 possession (Score: 32-49)
Bradley Leonard attempts a 3Pt. Contested by Ben Giddey (3.8 feet, ZONE). Bradley Leonard misses. Rebound secured by Desmond Jordan.

[11:01] Team_025 possession (Score: 32-49)
Desmond Jordan attempts a Midrange. Contested by Julius Durant (4.2 feet, ZONE). DESMOND JORDAN MAKES IT! Assist: Allen Embiid
Score: 32-51

[10:45] Team_081 possession (Score: 32-51)
Bradley Sabonis makes the Layup and draws the foul on Allen Embiid! And-1! Bradley Sabonis to the line for 1. [Team fouls: 2] (Allen Embiid: 2 personal fouls)   FT 1/1: GOOD Bradley Sabonis makes 1/1 from the line.
Score: 35-51

[10:31] Team_025 possession (Score: 35-51)
Allen Embiid drives, Franz Antetokounmpo stays with him. Allen Embiid attempts a Dunk. Contested by Franz Antetokounmpo (4.4 feet, MAN). ALLEN EMBIID MAKES IT!
Score: 35-53

[10:12] Team_081 possession (Score: 35-53)
Vince Adebayo attempts a Layup. BLOCKED BY ALLEN EMBIID! Ball is loose! Rebound secured by Cade Anthony.

[09:56] Team_025 possession (Score: 35-53)
Cade Anthony drives to the basket... Cade Anthony throws a bad pass! Stolen by Bradley Sabonis! TURNOVER! (live ball)

[09:41] Team_081 possession (Score: 35-53)
Vince Adebayo drives, Desmond Jordan stays with him. Vince Adebayo attempts a Layup. Contested by Desmond Jordan (3.4 feet, MAN). VINCE ADEBAYO MAKES IT!
Score: 37-53

[09:30] Team_025 possession (Score: 37-53)
FOUL! Reach-in foul on Bradley Leonard during the drive. [Team fouls: 1] No free throws, side out. (Bradley Leonard: 1 personal fouls)

[09:17] Team_025 possession (Score: 37-53)
FOUL! Shooting foul on Franz Antetokounmpo. Allen Embiid to the line for 2 free throws. [Team fouls: 2] (Franz Antetokounmpo: 1 personal fouls)   FT 1/2: GOOD   FT 2/2: MISS Allen Embiid makes 1/2 from the line. Rebound secured by Franz Antetokounmpo.
Score: 37-54

[09:04] Team_081 possession (Score: 37-54)
Julius Durant attempts a 3Pt. Contested by Ben Giddey (3.7 feet, ZONE). Julius Durant misses. Offensive rebound by Franz Antetokounmpo! Franz Antetokounmpo's putback is no good. Rebound secured by Allen Embiid.

[08:45] Team_025 possession (Score: 37-54)
Ben Giddey attempts a 3Pt. Contested by Bradley Leonard (4.2 feet, MAN). BEN GIDDEY MAKES IT! Assist: Paolo Lowry
Score: 37-57

[08:30] Team_081 possession (Score: 37-57)
Vince Adebayo attempts a Midrange. Contested by Desmond Jordan (3.4 feet, MAN). Vince Adebayo misses. Rebound secured by Desmond Jordan.

[08:16] Team_025 possession (Score: 37-57)
Cade Anthony attempts a Layup. Contested by Bradley Sabonis (4.7 feet, MAN). Cade Anthony misses. Rebound secured by Bradley Sabonis.

[08:00] Team_081 possession (Score: 37-57)
Julius Durant attempts a 3Pt. Contested by Ben Giddey (3.7 feet, ZONE). Julius Durant misses. Rebound secured by Cade Anthony.

[07:42] Team_025 possession (Score: 37-57)
Ben Giddey attempts a 3Pt. Contested by Bradley Leonard (4.2 feet, MAN). Ben Giddey misses. Rebound secured by Vince Adebayo.

[07:25] Team_081 possession (Score: 37-57)
Bradley Sabonis drives to the basket... Bradley Sabonis loses the ball! Stripped by Cade Anthony! TURNOVER! (live ball)

[07:08] Team_025 possession (Score: 37-57)
Desmond Jordan attempts a Midrange. Contested by Bradley Sabonis (4.2 feet, ZONE). Desmond Jordan misses. Rebound secured by Vince Adebayo.

[06:53] Team_081 possession (Score: 37-57)
Bradley Sabonis loses the ball! Stripped by Cade Anthony! TURNOVER! (live ball)

[06:37] Team_025 possession (Score: 37-57)
Allen Embiid drives, picks up Bradley Sabonis. Help arrives from Bradley Leonard! Allen Embiid attempts a Dunk. Contested by Bradley Leonard (4.2 feet, ZONE). ALLEN EMBIID MAKES IT! Assist: Paolo Lowry
Score: 37-59

[06:23] Team_081 possession (Score: 37-59)
FOUL! Shooting foul on Cade Anthony. Bradley Sabonis to the line for 3 free throws. [Team fouls: 3] (Cade Anthony: 1 personal fouls)   FT 1/3: MISS   FT 2/3: GOOD   FT 3/3: GOOD Bradley Sabonis makes 2/3 from the line.
Score: 39-59

[06:05] Team_025 possession (Score: 39-59)
Ben Giddey attempts a Midrange. Contested by Vince Adebayo (3.9 feet, ZONE). Ben Giddey misses. Rebound secured by Vince Adebayo.

[05:50] Team_081 possession (Score: 39-59)
Bradley Leonard attempts a 3Pt. Contested by Ben Giddey (3.8 feet, MAN). BRADLEY LEONARD MAKES IT! Assist: Bradley Sabonis
Score: 42-59

[05:36] Team_025 possession (Score: 42-59)
Cade Anthony attempts a Layup. Contested by Franz Antetokounmpo (5.0 feet, ZONE). CADE ANTHONY MAKES IT! Assist: Desmond Jordan
Score: 42-61

[05:20] Team_081 possession (Score: 42-61)
Vince Adebayo attempts a 3Pt. Contested by Desmond Jordan (3.3 feet, MAN). VINCE ADEBAYO MAKES IT! Assist: Bradley Sabonis
Score: 45-61

[05:06] Team_025 possession (Score: 45-61)
Ben Giddey attempts a 3Pt. Contested by Bradley Leonard (4.2 feet, MAN). Ben Giddey misses. Offensive rebound by Desmond Jordan! Desmond Jordan's putback is no good. Rebound secured by Vince Adebayo.

[04:54] Team_081 possession (Score: 45-61)
Bradley Sabonis drives, Cade Anthony stays with him. Bradley Sabonis attempts a Dunk. Contested by Cade Anthony (4.1 feet, MAN). BRADLEY SABONIS MAKES IT!
Score: 47-61

[04:40] Team_025 possession (Score: 47-61)
Cade Anthony attempts a 3Pt. Contested by Bradley Sabonis (4.7 feet, MAN). Cade Anthony misses. Rebound secured by Bradley Sabonis.

[04:23] Team_081 possession (Score: 47-61)
Franz Antetokounmpo attempts a Midrange. Contested by Desmond Jordan (3.5 feet, ZONE). Franz Antetokounmpo misses. Offensive rebound by Bradley Sabonis! Bradley Sabonis kicks it out.

[04:04] Team_081 possession (Score: 47-61)
Bradley Leonard attempts a 3Pt. Contested by Ben Giddey (3.8 feet, MAN). Bradley Leonard misses. Rebound secured by Desmond Jordan.

[03:49] Team_025 possession (Score: 47-61)
Allen Embiid attempts a Midrange. Contested by Julius Durant (4.2 feet, ZONE). Allen Embiid misses. Rebound secured by Vince Adebayo.

[03:36] Team_081 possession (Score: 47-61)
Bradley Sabonis drives and kicks out. Franz Antetokounmpo attempts a 3Pt. Contested by Allen Embiid (3.0 feet, MAN). FRANZ ANTETOKOUNMPO MAKES IT! Assist: Julius Durant
Score: 50-61

[03:25] Team_025 possession (Score: 50-61)
Desmond Jordan drives, Vince Adebayo stays with him. Desmond Jordan attempts a Layup. Contested by Vince Adebayo (3.8 feet, MAN). Desmond Jordan misses. Rebound secured by Franz Antetokounmpo.

[03:13] Team_081 possession (Score: 50-61)
Bradley Leonard attempts a 3Pt. Contested by Ben Giddey (3.9 feet, MAN). Bradley Leonard misses. Rebound secured by Cade Anthony.

[02:58] Team_025 possession (Score: 50-61)
Paolo Lowry attempts a 3Pt. Contested by Bradley Leonard (4.2 feet, ZONE). Paolo Lowry misses. Rebound secured by Vince Adebayo.

[02:44] Team_081 possession (Score: 50-61)
Franz Antetokounmpo attempts a Midrange. Contested by Allen Embiid (3.2 feet, MAN). Franz Antetokounmpo misses. Rebound secured by Cade Anthony.

[02:34] Team_025 possession (Score: 50-61)
Paolo Lowry attempts a 3Pt. Contested by Julius Durant (4.6 feet, MAN). Paolo Lowry misses. FOUL! Loose ball foul on Bradley Sabonis during the rebound battle. [Team fouls: 3] No free throws, side out. (Bradley Sabonis: 1 personal fouls)

[02:20] Team_025 possession (Score: 50-61)
Allen Embiid drives, picks up Franz Antetokounmpo. Help arrives from Bradley Leonard! Allen Embiid attempts a Layup. Contested by Bradley Leonard (4.6 feet, ZONE). Allen Embiid misses. Rebound secured by Bradley Sabonis.

[02:04] Team_081 possession (Score: 50-61)
FOUL! Shooting foul on Cade Anthony. Bradley Sabonis to the line for 2 free throws. [Team fouls: 4] (Cade Anthony: 2 personal fouls)   FT 1/2: GOOD   FT 2/2: GOOD Bradley Sabonis makes 2/2 from the line.
Score: 52-61

[01:51] Team_025 possession (Score: 52-61)
Cade Anthony attempts a 3Pt. Contested by Bradley Sabonis (4.9 feet, MAN). Cade Anthony misses. Offensive rebound by Allen Embiid! Allen Embiid puts it back in!
Score: 52-63

[01:39] Team_081 possession (Score: 52-63)
Franz Antetokounmpo makes the Dunk and draws the foul on Ben Giddey! And-1! Franz Antetokounmpo to the line for 1. [BONUS: 5 team fouls] (Ben Giddey: 1 personal fouls)   FT 1/1: GOOD Franz Antetokounmpo makes 1/1 from the line.
Score: 55-63

[01:26] Team_025 possession (Score: 55-63)
Paolo Lowry attempts a 3Pt. Contested by Julius Durant (4.7 feet, MAN). PAOLO LOWRY MAKES IT! Assist: Desmond Jordan
Score: 55-66

[01:13] Team_081 possession (Score: 55-66)
Franz Antetokounmpo drives and kicks out. Franz Antetokounmpo attempts a Midrange. Contested by Allen Embiid (3.4 feet, MAN). Franz Antetokounmpo misses. FOUL! Loose ball foul on Allen Embiid during the rebound battle. [IN THE BONUS! 6 team fouls] Bradley Sabonis to the line for 2 free throws. (Allen Embiid: 3 personal fouls)   FT 1/2: GOOD   FT 2/2: GOOD Bradley Sabonis makes 2/2 from the line.
Score: 57-66

[00:59] Team_025 possession (Score: 57-66)
Allen Embiid attempts a Midrange. Contested by Franz Antetokounmpo (4.8 feet, MAN). ALLEN EMBIID MAKES IT! Assist: Cade Anthony
Score: 57-68

[00:44] Team_081 possession (Score: 57-68)
Bradley Sabonis makes the Layup and draws the foul on Ben Giddey! And-1! Bradley Sabonis to the line for 1. [BONUS: 7 team fouls] (Ben Giddey: 2 personal fouls)   FT 1/1: GOOD Bradley Sabonis makes 1/1 from the line.
Score: 60-68

[00:30] Team_025 possession (Score: 60-68)
Ben Giddey attempts a 3Pt. Contested by Bradley Leonard (4.6 feet, MAN). Ben Giddey misses. Offensive rebound by Allen Embiid! Allen Embiid's putback is no good. Rebound secured by Franz Antetokounmpo.

[00:14] Team_081 possession (Score: 60-68)
Bradley Leonard attempts a 3Pt. Contested by Ben Giddey (4.2 feet, MAN). BRADLEY LEONARD MAKES IT! Assist: Vince Adebayo
Score: 63-68

================================================================================
                              3RD QUARTER COMPLETE                              
================================================================================

3RD QUARTER SCORE: Team_081 33, Team_025 19

BOX SCORE:
================================================================================

Team_081
--------------------------------------------------------------------------------
Player                MIN  PTS  REB  AST  TO      FG   FG%      3P   3P%
--------------------------------------------------------------------------------
Bradley Sabonis        27   14    5    2   0   6/6   100.0     0/0   0.0
Vince Adebayo          27    7    6    1   0   3/5    60.0     0/0   0.0
Bradley Leonard        27    6    0    0   0   2/5    40.0     0/0   0.0
Julius Durant          27    0    0    1   0   0/2     0.0     0/0   0.0

TEAM: FG: 13/21 (61.9%), 3PT: 4/9 (44.4%), REB: 12 (2 off, 10 def), AST: 4, TO: 2
TEAM FOULS: 3


Team_025
--------------------------------------------------------------------------------
Player                MIN  PTS  REB  AST  TO      FG   FG%      3P   3P%
--------------------------------------------------------------------------------
Allen Embiid           27    8    2    1   0   4/8    50.0     0/0   0.0
Franz Antetokounmpo    27    6    3    0   0   2/3    66.7     0/0   0.0
Ben Giddey             27    3    0    0   0   1/5    20.0     0/0   0.0
Paolo Lowry            27    3    0    2   0   1/2    50.0     0/0   0.0
Desmond Jordan         27    2    4    2   0   1/3    33.3     0/0   0.0
Cade Anthony           29    2    4    1   0   1/3    33.3     0/0   0.0

TEAM: FG: 8/21 (38.1%), 3PT: 3/8 (37.5%), REB: 12 (5 off, 7 def), AST: 6, TO: 1
TEAM FOULS: 7 [Team_081 in BONUS]

================================================================================

================================================================================
                       4TH QUARTER - Team_081 vs Team_025                       
================================================================================

[12:00] Substitution (Team_081): Vince Adebayo OUT → Larry Adebayo IN (stamina_rule2)

[12:00] Substitution (Team_081): Franz Antetokounmpo OUT → D'Angelo Markkanen IN (stamina_rule2)

[12:00] Substitution (Team_025): Paolo Lowry OUT → LeBron Griffin IN (stamina_rule2)

[12:00] Substitution (Team_025): Ben Giddey OUT → Dirk Gilgeous-Alexander IN (stamina_rule2)

[12:00] Substitution (Team_025): Desmond Jordan OUT → Immanuel LaVine IN (stamina_rule2)

[12:00] Substitution (Team_025): Allen Embiid OUT → Nikola Lillard IN (stamina_rule2)

[12:00] Team_081 possession (Score: 63-68)
Franz Antetokounmpo drives to the basket... Franz Antetokounmpo commits a violation (traveling/carry)! TURNOVER! (dead ball)

[11:46] Team_025 possession (Score: 63-68)
LeBron Griffin drives and kicks out. Nikola Lillard attempts a 3Pt. Contested by D'Angelo Markkanen (5.2 feet, MAN). Nikola Lillard misses. Rebound secured by Larry Adebayo.

[11:32] Team_081 possession (Score: 63-68)
Bradley Leonard attempts a 3Pt. Contested by Dirk Gilgeous-Alexander (5.7 feet, MAN). BRADLEY LEONARD MAKES IT! Assist: Julius Durant
Score: 66-68

[11:13] Team_025 possession (Score: 66-68)
Immanuel LaVine attempts a Layup. Contested by Bradley Sabonis (4.4 feet, ZONE). IMMANUEL LAVINE MAKES IT!
Score: 66-70

[10:58] Team_081 possession (Score: 66-70)
Bradley Leonard attempts a 3Pt. Contested by Dirk Gilgeous-Alexander (5.7 feet, MAN). Bradley Leonard misses. Rebound secured by Cade Anthony.

[10:44] Team_025 possession (Score: 66-70)
Nikola Lillard drives and kicks out. Nikola Lillard attempts a 3Pt. Contested by D'Angelo Markkanen (5.2 feet, MAN). Nikola Lillard misses. Rebound secured by D'Angelo Markkanen.

[10:34] Team_081 possession (Score: 66-70)
Julius Durant attempts a 3Pt. Contested by LeBron Griffin (4.7 feet, MAN). Julius Durant misses. Rebound secured by Immanuel LaVine.

[10:19] Team_025 possession (Score: 66-70)
Nikola Lillard attempts a Layup. Contested by D'Angelo Markkanen (5.4 feet, MAN). NIKOLA LILLARD MAKES IT! Assist: Cade Anthony
Score: 66-72

[10:02] Team_081 possession (Score: 66-72)
Bradley Sabonis attempts a Midrange. Contested by Cade Anthony (4.5 feet, ZONE). Bradley Sabonis misses. Rebound secured by Immanuel LaVine.

[09:42] Team_025 possession (Score: 66-72)
Dirk Gilgeous-Alexander drives and kicks out. Immanuel LaVine attempts a 3Pt. Contested by Larry Adebayo (5.3 feet, MAN). Immanuel LaVine misses. Offensive rebound by Cade Anthony! Cade Anthony kicks it out.

[09:29] Team_025 possession (Score: 66-72)
Dirk Gilgeous-Alexander attempts a 3Pt. Contested by Bradley Leonard (4.5 feet, ZONE). Dirk Gilgeous-Alexander misses. Rebound secured by Larry Adebayo.

[09:14] Team_081 possession (Score: 66-72)
Julius Durant attempts a 3Pt. Contested by LeBron Griffin (4.7 feet, MAN). Julius Durant misses. Rebound secured by Immanuel LaVine.

[09:01] Team_025 possession (Score: 66-72)
Nikola Lillard makes the Midrange and draws the foul on D'Angelo Markkanen! And-1! Nikola Lillard to the line for 1. [Team fouls: 1] (D'Angelo Markkanen: 1 personal fouls)   FT 1/1: GOOD Nikola Lillard makes 1/1 from the line.
Score: 66-75

[08:45] Team_081 possession (Score: 66-75)
Larry Adebayo attempts a Layup. Contested by Cade Anthony (4.8 feet, ZONE). LARRY ADEBAYO MAKES IT! Assist: Bradley Leonard
Score: 68-75

[08:27] Team_025 possession (Score: 68-75)
Immanuel LaVine attempts a 3Pt. Contested by Larry Adebayo (5.4 feet, MAN). Immanuel LaVine misses. Rebound secured by D'Angelo Markkanen.

[08:12] Team_081 possession (Score: 68-75)
D'Angelo Markkanen attempts a Midrange. Contested by Cade Anthony (5.0 feet, ZONE). D'Angelo Markkanen misses. Rebound secured by Nikola Lillard.

[08:01] Team_025 possession (Score: 68-75)
LeBron Griffin attempts a 3Pt. Contested by Julius Durant (4.7 feet, MAN). LeBron Griffin misses. Offensive rebound by Immanuel LaVine! Immanuel LaVine kicks it out.

[07:49] Team_025 possession (Score: 68-75)
Nikola Lillard drives and kicks out. Cade Anthony attempts a 3Pt. Contested by Bradley Sabonis (4.8 feet, MAN). Cade Anthony misses. Rebound secured by Larry Adebayo.

[07:34] Team_081 possession (Score: 68-75)
Larry Adebayo attempts a 3Pt. Contested by LeBron Griffin (4.6 feet, ZONE). Larry Adebayo misses. Rebound secured by Immanuel LaVine.

[07:18] Team_025 possession (Score: 68-75)
Cade Anthony makes the Layup and draws the foul on Bradley Sabonis! And-1! Cade Anthony to the line for 1. [Team fouls: 2] (Bradley Sabonis: 1 personal fouls)   FT 1/1: MISS Cade Anthony makes 0/1 from the line. Rebound secured by Larry Adebayo.
Score: 68-77

[07:01] Team_081 possession (Score: 68-77)
Bradley Sabonis drives, Cade Anthony stays with him. Bradley Sabonis attempts a Dunk. Contested by Cade Anthony (4.8 feet, MAN). BRADLEY SABONIS MAKES IT!
Score: 70-77

[06:47] Team_025 possession (Score: 70-77)
FOUL! Shooting foul on Larry Adebayo. Nikola Lillard to the line for 2 free throws. [Team fouls: 3] (Larry Adebayo: 1 personal fouls)   FT 1/2: GOOD   FT 2/2: GOOD Nikola Lillard makes 2/2 from the line.
Score: 70-79

[06:38] Team_081 possession (Score: 70-79)
D'Angelo Markkanen drives to the basket... D'Angelo Markkanen throws a bad pass! Stolen by Cade Anthony! TURNOVER! (live ball)

[06:24] Team_025 possession (Score: 70-79)
Nikola Lillard drives to the basket... Nikola Lillard throws a bad pass! Stolen by Bradley Sabonis! TURNOVER! (live ball)

[06:11] Team_081 possession (Score: 70-79)
Bradley Leonard loses control! Ball rolls out of bounds! TURNOVER! (dead ball)

[06:11] Substitution (Team_081): Julius Durant OUT → Dejounte Bane IN (stamina_rule2)

[06:11] Substitution (Team_081): Bradley Leonard OUT → Lamelo Wade IN (stamina_rule2)

[06:11] Substitution (Team_081): Bradley Sabonis OUT → Chris Holiday IN (stamina_rule2)

[06:11] Substitution (Team_025): Cade Anthony OUT → Damian Adebayo IN (stamina_rule2)

[05:53] Team_025 possession (Score: 70-79)
LeBron Griffin attempts a Midrange. Contested by Dejounte Bane (5.4 feet, MAN). LeBron Griffin misses. Rebound secured by Larry Adebayo.

[05:39] Team_081 possession (Score: 70-79)
Chris Holiday attempts a 3Pt. Contested by LeBron Griffin (4.7 feet, ZONE). Chris Holiday misses. Rebound secured by Nikola Lillard.

[05:22] Team_025 possession (Score: 70-79)
LeBron Griffin drives, picks up Chris Holiday. Help arrives from Lamelo Wade! LeBron Griffin attempts a Dunk. Contested by Lamelo Wade (4.2 feet, ZONE). LEBRON GRIFFIN MAKES IT! Assist: Dirk Gilgeous-Alexander
Score: 70-81

[05:10] Team_081 possession (Score: 70-81)
FOUL! Shooting foul on LeBron Griffin. Dejounte Bane to the line for 3 free throws. [Team fouls: 1] (LeBron Griffin: 1 personal fouls)   FT 1/3: GOOD   FT 2/3: GOOD   FT 3/3: GOOD Dejounte Bane makes 3/3 from the line.
Score: 73-81

[04:55] Team_025 possession (Score: 73-81)
Nikola Lillard drives and kicks out. Dirk Gilgeous-Alexander attempts a 3Pt. Contested by Chris Holiday (4.3 feet, ZONE). Dirk Gilgeous-Alexander misses. Offensive rebound by Immanuel LaVine! Immanuel LaVine kicks it out.

[04:41] Team_025 possession (Score: 73-81)
Nikola Lillard attempts a 3Pt. Contested by Chris Holiday (4.4 feet, ZONE). Nikola Lillard misses. Rebound secured by Chris Holiday.

[04:27] Team_081 possession (Score: 73-81)
Lamelo Wade attempts a Layup. Contested by Dirk Gilgeous-Alexander (5.6 feet, MAN). LAMELO WADE MAKES IT!
Score: 75-81

[04:11] Team_025 possession (Score: 75-81)
Dirk Gilgeous-Alexander attempts a 3Pt. Contested by Lamelo Wade (4.9 feet, MAN). Dirk Gilgeous-Alexander misses. Rebound secured by Lamelo Wade.

[03:56] Team_081 possession (Score: 75-81)
D'Angelo Markkanen drives, Nikola Lillard stays with him. D'Angelo Markkanen attempts a Dunk. Contested by Nikola Lillard (4.7 feet, MAN). D'ANGELO MARKKANEN MAKES IT! Assist: Larry Adebayo
Score: 77-81

[03:36] Team_025 possession (Score: 77-81)
Damian Adebayo makes the Layup and draws the foul on Chris Holiday! And-1! Damian Adebayo to the line for 1. [Team fouls: 4] (Chris Holiday: 1 personal fouls)   FT 1/1: GOOD Damian Adebayo makes 1/1 from the line.
Score: 77-84

[03:23] Team_081 possession (Score: 77-84)
Lamelo Wade attempts a Midrange. Contested by Dirk Gilgeous-Alexander (5.6 feet, MAN). LAMELO WADE MAKES IT!
Score: 79-84

[03:12] Team_025 possession (Score: 79-84)
Dirk Gilgeous-Alexander drives to the basket... Dirk Gilgeous-Alexander throws a bad pass! Stolen by Lamelo Wade! TURNOVER! (live ball)

[02:56] Team_081 possession (Score: 79-84)
Lamelo Wade attempts a 3Pt. Contested by LeBron Griffin (4.8 feet, ZONE). Lamelo Wade misses. Rebound secured by Dirk Gilgeous-Alexander.

[02:41] Team_025 possession (Score: 79-84)
Dirk Gilgeous-Alexander attempts a 3Pt. Contested by Lamelo Wade (4.9 feet, ZONE). Dirk Gilgeous-Alexander misses. Rebound secured by Larry Adebayo.

[02:26] Team_081 possession (Score: 79-84)
D'Angelo Markkanen attempts a Midrange. Contested by Immanuel LaVine (4.8 feet, ZONE). D'ANGELO MARKKANEN MAKES IT! Assist: Chris Holiday
Score: 81-84

[02:16] Team_025 possession (Score: 81-84)
LeBron Griffin attempts a 3Pt. Contested by Chris Holiday (4.1 feet, ZONE). LEBRON GRIFFIN MAKES IT! Assist: Immanuel LaVine
Score: 81-87

[02:00] Team_081 possession (Score: 81-87)
Dejounte Bane attempts a Layup. Contested by LeBron Griffin (5.2 feet, MAN). DEJOUNTE BANE MAKES IT!
Score: 83-87

[01:45] Team_025 possession (Score: 83-87)
Immanuel LaVine attempts a Midrange. Contested by Larry Adebayo (5.6 feet, MAN). Immanuel LaVine misses. Rebound secured by Lamelo Wade.

[01:33] Team_081 possession (Score: 83-87)
Dejounte Bane drives, LeBron Griffin stays with him. Dejounte Bane attempts a Layup. Contested by LeBron Griffin (5.2 feet, MAN). Dejounte Bane misses. Rebound secured by Immanuel LaVine.

[01:21] Team_025 possession (Score: 83-87)
LeBron Griffin attempts a Midrange. Contested by Dejounte Bane (5.3 feet, MAN). LeBron Griffin misses. Rebound secured by Larry Adebayo.

[01:08] Team_081 possession (Score: 83-87)
Larry Adebayo attempts a Midrange. Contested by Dirk Gilgeous-Alexander (5.8 feet, ZONE). Larry Adebayo misses. Offensive rebound by Lamelo Wade! Lamelo Wade kicks it out.

[00:53] Team_081 possession (Score: 83-87)
FOUL! Shooting foul on Immanuel LaVine. Dejounte Bane to the line for 2 free throws. [Team fouls: 2] (Immanuel LaVine: 1 personal fouls)   FT 1/2: MISS   FT 2/2: GOOD Dejounte Bane makes 1/2 from the line.
Score: 84-87

[00:38] Team_025 possession (Score: 84-87)
LeBron Griffin attempts a Midrange. Contested by Dejounte Bane (5.3 feet, MAN). LeBron Griffin misses. Offensive rebound by Nikola Lillard! Nikola Lillard kicks it out.

[00:21] Team_025 possession (Score: 84-87)
LeBron Griffin attempts a 3Pt. Contested by Chris Holiday (4.1 feet, ZONE). LEBRON GRIFFIN MAKES IT! Assist: Damian Adebayo
Score: 84-90

[00:06] Team_081 possession (Score: 84-90)
Chris Holiday attempts a Layup. Contested by Damian Adebayo (5.0 feet, MAN). Chris Holiday misses. Rebound secured by Immanuel LaVine.

================================================================================
                              4TH QUARTER COMPLETE                              
================================================================================

4TH QUARTER SCORE: Team_081 21, Team_025 22

BOX SCORE:
================================================================================

Team_081
--------------------------------------------------------------------------------
Player                MIN  PTS  REB  AST  TO      FG   FG%      3P   3P%
--------------------------------------------------------------------------------
Dejounte Bane          15    6    0    0   0   3/4    75.0     0/0   0.0
D'Angelo Markkanen     21    4    2    0   0   2/3    66.7     0/0   0.0
Lamelo Wade            15    4    3    0   0   2/3    66.7     0/0   0.0
Bradley Leonard        33    3    0    1   0   1/2    50.0     0/0   0.0
Larry Adebayo          21    2    7    1   0   1/2    50.0     0/0   0.0
Bradley Sabonis        33    2    0    0   0   1/2    50.0     0/0   0.0
Julius Durant          33    0    0    1   0   0/2     0.0     0/0   0.0
Chris Holiday          15    0    1    1   0   0/2     0.0     0/0   0.0

TEAM: FG: 10/20 (50.0%), 3PT: 2/8 (25.0%), REB: 13 (1 off, 12 def), AST: 4, TO: 3
TEAM FOULS: 4


Team_025
--------------------------------------------------------------------------------
Player                MIN  PTS  REB  AST  TO      FG   FG%      3P   3P%
--------------------------------------------------------------------------------
LeBron Griffin         21    8    0    0   0   3/6    50.0     0/0   0.0
Nikola Lillard         21    7    3    0   0   3/6    50.0     0/0   0.0
Damian Adebayo         14    3    0    1   0   1/1   100.0     0/0   0.0
Immanuel LaVine        21    2    8    1   0   1/3    33.3     0/0   0.0
Cade Anthony           35    0    2    1   0   0/1     0.0     0/0   0.0
Dirk Gilgeous-Alexander   21    0    1    1   0   0/3     0.0     0/0   0.0

TEAM: FG: 8/20 (40.0%), 3PT: 2/7 (28.6%), REB: 14 (4 off, 10 def), AST: 4, TO: 2
TEAM FOULS: 2

================================================================================

================================================================================
                               FULL GAME COMPLETE                               
================================================================================

FINAL SCORE: Team_081 84, Team_025 90

SCORING BY QUARTER:
--------------------------------------------------------------------------------
Team                     Q1     Q2     Q3     Q4    FINAL
--------------------------------------------------------------------------------
Team_081                 25      5     33     21       84
Team_025                 23     26     19     22       90
--------------------------------------------------------------------------------

FULL GAME BOX SCORE:
================================================================================

Team_081
--------------------------------------------------------------------------------
Player                MIN  PTS  REB  AST  TO      FG   FG%      3P   3P%      FT STL BLK
--------------------------------------------------------------------------------
Julius Durant          33    2    0    2   0   1/6    16.7   0/5     0.0   0/0     0   0
Bradley Leonard        33   17    0    4   4   5/13   38.5   4/10   40.0   1/1     0   0
Bradley Sabonis        33   18    9    2   1   8/9    88.9   1/1   100.0  10/11    2   0
Vince Adebayo          27   12    7    3   5   4/8    50.0   1/2    50.0   0/0     0   0
Franz Antetokounmpo    27   11    8    1   0   6/12   50.0   0/0     0.0   3/5     0   0
Larry Adebayo          21    2    9    1   1   1/4    25.0   0/2     0.0   0/0     0   0
D'Angelo Markkanen     21    4    2    0   2   2/4    50.0   0/1     0.0   0/0     0   0
Dejounte Bane          15    6    0    0   2   3/5    60.0   1/2    50.0   4/5     0   0
Lamelo Wade            15    9    6    0   0   4/6    66.7   1/2    50.0   0/0     1   0
Chris Holiday          15    2    3    2   1   1/6    16.7   0/1     0.0   0/0     0   2

TEAM: FG: 36/74 (48.6%), 3PT: 8/26 (30.8%), REB: 43 (5 off, 38 def), AST: 15, TO: 16


Team_025
--------------------------------------------------------------------------------
Player                MIN  PTS  REB  AST  TO      FG   FG%      3P   3P%      FT STL BLK
--------------------------------------------------------------------------------
Cade Anthony           35    8   13    3   1   5/10   50.0   1/4    25.0   2/4     3   0
Paolo Lowry            27   10    0    2   0   4/6    66.7   2/4    50.0   1/2     0   0
Ben Giddey             27    7    0    2   0   3/11   27.3   1/7    14.3   0/0     1   0
Desmond Jordan         27   15    6    2   0   6/11   54.5   1/3    33.3   2/3     0   0
Allen Embiid           27    8    8    3   4   4/8    50.0   0/0     0.0   1/2     1   2
LeBron Griffin         21   10    0    0   1   3/6    50.0   2/2   100.0   3/4     0   0
Dirk Gilgeous-Alexander   21    3    2    1   0   1/4    25.0   1/4    25.0   0/0     0   0
Immanuel LaVine        21    4   12    1   1   1/3    33.3   0/1     0.0   2/2     0   0
Nikola Lillard         21   12    8    0   2   5/10   50.0   0/2     0.0   4/4     0   0
Damian Adebayo         14    7    0    1   0   2/5    40.0   0/3     0.0   3/3     1   1

TEAM: FG: 37/78 (47.4%), 3PT: 8/30 (26.7%), REB: 50 (13 off, 37 def), AST: 15, TO: 9

================================================================================
