================================================================================
                        FULL GAME - Team_003 vs Team_094                        
================================================================================

================================================================================
                       1ST QUARTER - Team_003 vs Team_094                       
================================================================================

[12:00] Team_003 possession (Score: 0-0)
Nikola Bryant attempts a 3Pt. Contested by Kobe Wagner (4.4 feet, ZONE). NIKOLA BRYANT MAKES IT! Assist: Ayo Jackson
Score: 3-0

[11:41] Team_094 possession (Score: 3-0)
Tim Russell attempts a 3Pt. Contested by Giannis Turner (3.0 feet, MAN). Tim Russell misses. Rebound secured by Victor O'Neal.

[11:24] Team_003 possession (Score: 3-0)
Giannis Turner attempts a 3Pt. Contested by Tim Russell (5.1 feet, MAN). GIANNIS TURNER MAKES IT! Assist: Rudy Haliburton
Score: 6-0

[11:13] Team_094 possession (Score: 6-0)
Kobe Bryant attempts a Layup. Contested by Giannis Turner (3.0 feet, MAN). KOBE BRYANT MAKES IT!
Score: 6-2

[10:59] Team_003 possession (Score: 6-2)
Victor O'Neal attempts a Midrange. Contested by Kobe Wagner (4.1 feet, ZONE). Victor O'Neal misses. Rebound secured by Tim Russell.

[10:41] Team_094 possession (Score: 6-2)
Lauri Thompson drives, picks up Giannis Turner. Help arrives from Nikola Bryant! Lauri Thompson attempts a Layup. Contested by Nikola Bryant (3.2 feet, ZONE). LAURI THOMPSON MAKES IT!
Score: 6-4

[10:25] Team_003 possession (Score: 6-4)
Nikola Bryant attempts a Midrange. Contested by Lauri Thompson (5.1 feet, MAN). Nikola Bryant misses. Rebound secured by Tim Russell.

[10:09] Team_094 possession (Score: 6-4)
FOUL! Reach-in foul on Giannis Turner during the drive. [Team fouls: 1] No free throws, side out. (Giannis Turner: 1 personal fouls)

[09:59] Team_094 possession (Score: 6-4)
Terry Ingram drives and kicks out. Kobe Wagner attempts a 3Pt. Contested by Ayo Jackson (5.2 feet, ZONE). Kobe Wagner misses. Rebound secured by Victor O'Neal.

[09:47] Team_003 possession (Score: 6-4)
FOUL! Holding foul on Kobe Bryant. [Team fouls: 1] No free throws, side out. (Kobe Bryant: 1 personal fouls)

[09:36] Team_003 possession (Score: 6-4)
Ayo Jackson makes the Dunk and draws the foul on Terry Ingram! And-1! Ayo Jackson to the line for 1. [Team fouls: 2] (Terry Ingram: 1 personal fouls)   FT 1/1: GOOD Ayo Jackson makes 1/1 from the line.
Score: 9-4

[09:21] Team_094 possession (Score: 9-4)
Lauri Thompson drives and kicks out. Kobe Bryant attempts a 3Pt. Contested by Giannis Turner (2.8 feet, MAN). Kobe Bryant misses. Offensive rebound by Kobe Bryant! Kobe Bryant puts it back in!
Score: 9-6

[09:07] Team_003 possession (Score: 9-6)
Nikola Bryant attempts a Layup. BLOCKED BY KOBE WAGNER! Ball is loose! Rebound secured by Tim Russell.

[08:48] Team_094 possession (Score: 9-6)
Kobe Bryant attempts a Layup. Contested by Giannis Turner (3.0 feet, MAN). KOBE BRYANT MAKES IT! Assist: Kobe Wagner
Score: 9-8

[08:29] Team_003 possession (Score: 9-8)
Rudy Haliburton attempts a 3Pt. Contested by Kobe Wagner (4.2 feet, ZONE). Rudy Haliburton misses. Rebound secured by Kobe Bryant.

[08:12] Team_094 possession (Score: 9-8)
Kobe Bryant attempts a Layup. Contested by Giannis Turner (3.0 feet, ZONE). KOBE BRYANT MAKES IT! Assist: Kobe Wagner
Score: 9-10

[08:00] Team_003 possession (Score: 9-10)
Rudy Haliburton drives, Tim Russell stays with him. Rudy Haliburton attempts a Dunk. Contested by Tim Russell (4.9 feet, ZONE). Rudy Haliburton misses. Rebound secured by Tim Russell.

[07:47] Team_094 possession (Score: 9-10)
FOUL! Shooting foul on Rudy Haliburton. Kobe Wagner to the line for 2 free throws. [Team fouls: 2] (Rudy Haliburton: 1 personal fouls)   FT 1/2: GOOD   FT 2/2: GOOD Kobe Wagner makes 2/2 from the line.
Score: 9-12

[07:31] Team_003 possession (Score: 9-12)
FOUL! Shooting foul on Lauri Thompson. Giannis Turner to the line for 2 free throws. [Team fouls: 3] (Lauri Thompson: 1 personal fouls)   FT 1/2: MISS   FT 2/2: GOOD Giannis Turner makes 1/2 from the line.
Score: 10-12

[07:13] Team_094 possession (Score: 10-12)
Kobe Wagner attempts a 3Pt. Contested by Rudy Haliburton (3.7 feet, MAN). Kobe Wagner misses. Rebound secured by Victor O'Neal.

[06:58] Team_003 possession (Score: 10-12)
Rudy Haliburton attempts a 3Pt. Contested by Kobe Wagner (4.2 feet, ZONE). Rudy Haliburton misses. Offensive rebound by Victor O'Neal! Victor O'Neal kicks it out.

[06:40] Team_003 possession (Score: 10-12)
Victor O'Neal attempts a Midrange. Contested by Kobe Bryant (5.0 feet, MAN). Victor O'Neal misses. Rebound secured by Kobe Bryant.

[06:22] Team_094 possession (Score: 10-12)
Lauri Thompson attempts a 3Pt. Contested by Giannis Turner (3.2 feet, ZONE). Lauri Thompson misses. Offensive rebound by Tim Russell! Tim Russell kicks it out.

[06:09] Team_094 possession (Score: 10-12)
Kobe Bryant attempts a Layup. Contested by Giannis Turner (3.0 feet, MAN). KOBE BRYANT MAKES IT! Assist: Terry Ingram
Score: 10-14

[05:56] Team_003 possession (Score: 10-14)
Victor O'Neal attempts a Layup. Contested by Kobe Bryant (5.0 feet, MAN). Victor O'Neal misses. Rebound secured by Kobe Wagner.

[05:38] Team_094 possession (Score: 10-14)
Terry Ingram attempts a 3Pt. Contested by Ayo Jackson (5.6 feet, MAN). TERRY INGRAM MAKES IT!
Score: 10-17

[05:23] Team_003 possession (Score: 10-17)
Giannis Turner attempts a Midrange. Contested by Tim Russell (5.1 feet, MAN). Giannis Turner misses. Rebound secured by Kobe Wagner.

[05:05] Team_094 possession (Score: 10-17)
Terry Ingram drives and kicks out. Lauri Thompson attempts a 3Pt. Contested by Nikola Bryant (4.0 feet, MAN). LAURI THOMPSON MAKES IT! Assist: Terry Ingram
Score: 10-20

[04:52] Team_003 possession (Score: 10-20)
Giannis Turner attempts a 3Pt. Contested by Tim Russell (5.1 feet, ZONE). Giannis Turner misses. Rebound secured by Tim Russell.

[04:36] Team_094 possession (Score: 10-20)
FOUL! Holding foul on Ayo Jackson. [Team fouls: 3] No free throws, side out. (Ayo Jackson: 1 personal fouls)

[04:20] Team_094 possession (Score: 10-20)
Terry Ingram attempts a 3Pt. Contested by Giannis Turner (3.2 feet, ZONE). TERRY INGRAM MAKES IT! Assist: Lauri Thompson
Score: 10-23

[04:07] Team_003 possession (Score: 10-23)
Victor O'Neal attempts a 3Pt. Contested by Kobe Bryant (5.0 feet, MAN). Victor O'Neal misses. Offensive rebound by Rudy Haliburton! Rudy Haliburton puts it back in!
Score: 12-23

[03:53] Team_094 possession (Score: 12-23)
Kobe Wagner attempts a 3Pt. Contested by Rudy Haliburton (3.8 feet, MAN). Kobe Wagner misses. Offensive rebound by Kobe Bryant! Kobe Bryant's putback is no good. Rebound secured by Giannis Turner.

[03:40] Team_003 possession (Score: 12-23)
Giannis Turner makes the Layup and draws the foul on Tim Russell! And-1! Giannis Turner to the line for 1. [Team fouls: 4] (Tim Russell: 1 personal fouls)   FT 1/1: GOOD Giannis Turner makes 1/1 from the line.
Score: 15-23

[03:22] Team_094 possession (Score: 15-23)
FOUL! Shooting foul on Giannis Turner. Tim Russell to the line for 2 free throws. [Team fouls: 4] (Giannis Turner: 2 personal fouls)   FT 1/2: GOOD   FT 2/2: MISS Tim Russell makes 1/2 from the line. Rebound secured by Victor O'Neal.
Score: 15-24

[03:06] Team_003 possession (Score: 15-24)
Ayo Jackson drives and kicks out. Nikola Bryant attempts a 3Pt. Contested by Lauri Thompson (4.9 feet, MAN). Nikola Bryant misses. Rebound secured by Tim Russell.

[02:55] Team_094 possession (Score: 15-24)
Kobe Bryant drives and kicks out. Terry Ingram attempts a 3Pt. Contested by Giannis Turner (3.0 feet, ZONE). Terry Ingram misses. Rebound secured by Giannis Turner.

[02:39] Team_003 possession (Score: 15-24)
FOUL! Shooting foul on Tim Russell. Ayo Jackson to the line for 2 free throws. [BONUS: 5 team fouls] (Tim Russell: 2 personal fouls)   FT 1/2: GOOD   FT 2/2: MISS Ayo Jackson makes 1/2 from the line. Rebound secured by Kobe Wagner.
Score: 16-24

[02:22] Team_094 possession (Score: 16-24)
Tim Russell attempts a Midrange. Contested by Nikola Bryant (4.4 feet, ZONE). Tim Russell misses. Offensive rebound by Tim Russell! Tim Russell kicks it out.

[02:04] Team_094 possession (Score: 16-24)
Kobe Wagner attempts a Midrange. Contested by Rudy Haliburton (3.9 feet, MAN). Kobe Wagner misses. Rebound secured by Rudy Haliburton.

[01:51] Team_003 possession (Score: 16-24)
Ayo Jackson attempts a 3Pt. Contested by Kobe Wagner (4.6 feet, ZONE). Ayo Jackson misses. Rebound secured by Kobe Bryant.

[01:36] Team_094 possession (Score: 16-24)
Tim Russell attempts a Midrange. Contested by Giannis Turner (3.3 feet, MAN). TIM RUSSELL MAKES IT!
Score: 16-26

[01:20] Team_003 possession (Score: 16-26)
Nikola Bryant commits a violation (traveling/carry)! TURNOVER! (dead ball)

[01:20] Substitution (Team_003): Ayo Jackson OUT → Miles Towns IN (stamina_rule2)

[01:20] Substitution (Team_003): Nikola Bryant OUT → Pau Williamson IN (stamina_rule2)

[01:20] Substitution (Team_003): Rudy Haliburton OUT → Collin Mitchell IN (stamina_rule2)

[01:20] Substitution (Team_003): Giannis Turner OUT → Anfernee Jordan IN (stamina_rule2)

[01:20] Substitution (Team_003): Victor O'Neal OUT → Bam Gilgeous-Alexander IN (stamina_rule2)

[01:20] Substitution (Team_094): Terry Ingram OUT → Shaquille Bryant IN (stamina_rule2)

[01:20] Substitution (Team_094): Lauri Thompson OUT → Kevin Rozier IN (stamina_rule2)

[01:20] Substitution (Team_094): Kobe Wagner OUT → Ayo Gasol IN (stamina_rule2)

[01:20] Substitution (Team_094): Tim Russell OUT → Domantas Haliburton IN (stamina_rule2)

[01:20] Substitution (Team_094): Kobe Bryant OUT → Isaiah Quickley IN (stamina_rule2)

[01:08] Team_094 possession (Score: 16-26)
Kevin Rozier attempts a Midrange. Contested by Pau Williamson (5.6 feet, ZONE). KEVIN ROZIER MAKES IT!
Score: 16-28

[00:54] Team_003 possession (Score: 16-28)
Collin Mitchell drives, Isaiah Quickley stays with him. Collin Mitchell attempts a Layup. Wide open! Isaiah Quickley is 6.3 feet away. [ZONE] COLLIN MITCHELL MAKES IT! Assist: Anfernee Jordan
Score: 18-28

[00:37] Team_094 possession (Score: 18-28)
Ayo Gasol attempts a 3Pt. Contested by Collin Mitchell (4.4 feet, ZONE). AYO GASOL MAKES IT! Assist: Shaquille Bryant
Score: 18-31

[00:26] Team_003 possession (Score: 18-31)
Pau Williamson drives and kicks out. Anfernee Jordan attempts a Midrange. Contested by Domantas Haliburton (5.8 feet, MAN). ANFERNEE JORDAN MAKES IT!
Score: 20-31

[00:13] Team_094 possession (Score: 20-31)
Kevin Rozier attempts a 3Pt. Contested by Pau Williamson (5.6 feet, MAN). Kevin Rozier misses. Rebound secured by Bam Gilgeous-Alexander.

================================================================================
                              1ST QUARTER COMPLETE                              
================================================================================

1ST QUARTER SCORE: Team_003 20, Team_094 31

BOX SCORE:
================================================================================

Team_003
--------------------------------------------------------------------------------
Player                MIN  PTS  REB  AST  TO      FG   FG%      3P   3P%
--------------------------------------------------------------------------------
Giannis Turner         11    7    2    0   0   3/5    60.0     0/0   0.0
Nikola Bryant          11    3    0    0   0   1/3    33.3     0/0   0.0
Ayo Jackson            11    3    0    1   0   1/4    25.0     0/0   0.0
Rudy Haliburton        11    2    2    1   0   1/3    33.3     0/0   0.0
Collin Mitchell         1    2    0    0   0   1/1   100.0     0/0   0.0
Anfernee Jordan         1    2    0    1   0   1/1   100.0     0/0   0.0
Victor O'Neal          11    0    5    0   0   0/3     0.0     0/0   0.0
Bam Gilgeous-Alexander    1    0    1    0   0   0/0     0.0     0/0   0.0

TEAM: FG: 8/20 (40.0%), 3PT: 3/6 (50.0%), REB: 9 (2 off, 7 def), AST: 3, TO: 1
TEAM FOULS: 4


Team_094
--------------------------------------------------------------------------------
Player                MIN  PTS  REB  AST  TO      FG   FG%      3P   3P%
--------------------------------------------------------------------------------
Kobe Bryant            11   10    4    0   0   5/6    83.3     0/0   0.0
Terry Ingram           11    6    0    2   0   2/3    66.7     0/0   0.0
Lauri Thompson         11    5    0    1   0   2/2   100.0     0/0   0.0
Ayo Gasol               1    3    0    0   0   1/1   100.0     0/0   0.0
Tim Russell            11    2    8    0   0   1/3    33.3     0/0   0.0
Kobe Wagner            11    2    3    2   0   1/4    25.0     0/0   0.0
Kevin Rozier            1    2    0    0   0   1/2    50.0     0/0   0.0
Shaquille Bryant        1    0    0    1   0   0/0     0.0     0/0   0.0

TEAM: FG: 13/21 (61.9%), 3PT: 3/7 (42.9%), REB: 16 (4 off, 12 def), AST: 6, TO: 0
TEAM FOULS: 5 [Team_003 in BONUS]

================================================================================

================================================================================
                       2ND QUARTER - Team_003 vs Team_094                       
================================================================================

[12:00] Team_003 possession (Score: 20-31)
Nikola Bryant attempts a 3Pt. Contested by Kobe Wagner (4.5 feet, ZONE). Nikola Bryant misses. Rebound secured by Kobe Bryant.

[11:43] Team_094 possession (Score: 20-31)
Kobe Wagner loses control! Ball rolls out of bounds! TURNOVER! (dead ball)

[11:29] Team_003 possession (Score: 20-31)
Nikola Bryant loses control! Ball rolls out of bounds! TURNOVER! (dead ball)

[11:15] Team_094 possession (Score: 20-31)
Kobe Bryant drives and kicks out. Terry Ingram attempts a 3Pt. Contested by Giannis Turner (2.9 feet, ZONE). Terry Ingram misses. Rebound secured by Giannis Turner.

[11:05] Team_003 possession (Score: 20-31)
Ayo Jackson attempts a 3Pt. Contested by Tim Russell (5.2 feet, ZONE). Ayo Jackson misses. Rebound secured by Tim Russell.

[10:50] Team_094 possession (Score: 20-31)
Kobe Bryant drives, picks up Giannis Turner. Help arrives from Nikola Bryant! Kobe Bryant attempts a Dunk. Contested by Nikola Bryant (3.2 feet, ZONE). KOBE BRYANT MAKES IT! Assist: Tim Russell
Score: 20-33

[10:35] Team_003 possession (Score: 20-33)
Giannis Turner attempts a Midrange. Contested by Tim Russell (5.3 feet, MAN). Giannis Turner misses. Rebound secured by Kobe Bryant.

[10:21] Team_094 possession (Score: 20-33)
Kobe Wagner drives to the basket... Kobe Wagner loses the ball! Stripped by Giannis Turner! TURNOVER! (live ball)

[10:06] Team_003 possession (Score: 20-33)
Victor O'Neal makes the Layup and draws the foul on Tim Russell! And-1! Victor O'Neal to the line for 1. [Team fouls: 1] (Tim Russell: 1 personal fouls)   FT 1/1: GOOD Victor O'Neal makes 1/1 from the line.
Score: 23-33

[09:54] Team_094 possession (Score: 23-33)
Tim Russell drives, Giannis Turner stays with him. Tim Russell attempts a Dunk. Contested by Giannis Turner (3.3 feet, MAN). Tim Russell misses. Rebound secured by Giannis Turner.

[09:41] Team_003 possession (Score: 23-33)
Victor O'Neal attempts a 3Pt. Contested by Kobe Bryant (5.2 feet, MAN). Victor O'Neal misses. Rebound secured by Kobe Bryant.

[09:24] Team_094 possession (Score: 23-33)
FOUL! Shooting foul on Giannis Turner. Lauri Thompson to the line for 3 free throws. [Team fouls: 1] (Giannis Turner: 1 personal fouls)   FT 1/3: MISS   FT 2/3: MISS   FT 3/3: MISS Lauri Thompson makes 0/3 from the line. Rebound secured by Giannis Turner.

[09:08] Team_003 possession (Score: 23-33)
FOUL! Holding foul on Kobe Wagner. [Team fouls: 2] No free throws, side out. (Kobe Wagner: 1 personal fouls)

[08:56] Team_003 possession (Score: 23-33)
Nikola Bryant attempts a 3Pt. Contested by Kobe Wagner (4.7 feet, ZONE). Nikola Bryant misses. Rebound secured by Kobe Bryant.

[08:42] Team_094 possession (Score: 23-33)
Kobe Wagner attempts a 3Pt. Contested by Rudy Haliburton (4.0 feet, MAN). Kobe Wagner misses. Offensive rebound by Tim Russell! Tim Russell kicks it out.

[08:31] Team_094 possession (Score: 23-33)
Kobe Wagner attempts a Layup. Contested by Rudy Haliburton (4.1 feet, MAN). KOBE WAGNER MAKES IT!
Score: 23-35

[08:19] Team_003 possession (Score: 23-35)
Ayo Jackson drives and kicks out. Rudy Haliburton attempts a 3Pt. Contested by Kobe Wagner (4.6 feet, MAN). RUDY HALIBURTON MAKES IT! Assist: Giannis Turner
Score: 26-35

[08:07] Team_094 possession (Score: 26-35)
Terry Ingram attempts a Midrange. Wide open! Ayo Jackson is 6.0 feet away. [MAN] TERRY INGRAM MAKES IT! Assist: Tim Russell
Score: 26-37

[07:49] Team_003 possession (Score: 26-37)
Rudy Haliburton attempts a 3Pt. Contested by Kobe Wagner (4.7 feet, ZONE). Rudy Haliburton misses. Rebound secured by Kobe Wagner.

[07:33] Team_094 possession (Score: 26-37)
Lauri Thompson drives and kicks out. Kobe Bryant attempts a 3Pt. Contested by Ayo Jackson (5.8 feet, ZONE). Kobe Bryant misses. Rebound secured by Rudy Haliburton.

[07:20] Team_003 possession (Score: 26-37)
Nikola Bryant throws a bad pass! Stolen by Lauri Thompson! TURNOVER! (live ball)

[07:09] Team_094 possession (Score: 26-37)
Kobe Wagner makes the Layup and draws the foul on Giannis Turner! And-1! Kobe Wagner to the line for 1. [Team fouls: 2] (Giannis Turner: 2 personal fouls)   FT 1/1: GOOD Kobe Wagner makes 1/1 from the line.
Score: 26-40

[06:52] Team_003 possession (Score: 26-40)
Giannis Turner drives to the basket... Giannis Turner loses the ball! Stripped by Tim Russell! TURNOVER! (live ball)

[06:33] Team_094 possession (Score: 26-40)
Kobe Bryant drives, Victor O'Neal stays with him. Kobe Bryant attempts a Layup. Contested by Victor O'Neal (5.1 feet, MAN). KOBE BRYANT MAKES IT! Assist: Tim Russell
Score: 26-42

[06:22] Team_003 possession (Score: 26-42)
Rudy Haliburton attempts a 3Pt. Contested by Kobe Wagner (4.9 feet, ZONE). RUDY HALIBURTON MAKES IT!
Score: 29-42

[06:09] Team_094 possession (Score: 29-42)
Terry Ingram attempts a Midrange. Wide open! Ayo Jackson is 6.2 feet away. [MAN] TERRY INGRAM MAKES IT!
Score: 29-44

[05:52] Team_003 possession (Score: 29-44)
Victor O'Neal makes the Dunk and draws the foul on Kobe Bryant! And-1! Victor O'Neal to the line for 1. [Team fouls: 3] (Kobe Bryant: 1 personal fouls)   FT 1/1: GOOD Victor O'Neal makes 1/1 from the line.
Score: 32-44

[05:36] Team_094 possession (Score: 32-44)
Kobe Bryant drives, Giannis Turner stays with him. Kobe Bryant attempts a Dunk. Contested by Giannis Turner (4.0 feet, ZONE). KOBE BRYANT MAKES IT! Assist: Kobe Wagner
Score: 32-46

[05:19] Team_003 possession (Score: 32-46)
Rudy Haliburton drives, picks up Tim Russell. Help arrives from Lauri Thompson! Rudy Haliburton attempts a Layup. Contested by Lauri Thompson (5.6 feet, ZONE). RUDY HALIBURTON MAKES IT! Assist: Nikola Bryant
Score: 34-46

[05:02] Team_094 possession (Score: 34-46)
Lauri Thompson attempts a 3Pt. Contested by Nikola Bryant (5.2 feet, MAN). Lauri Thompson misses. Rebound secured by Rudy Haliburton.

[04:51] Team_003 possession (Score: 34-46)
Victor O'Neal drives and kicks out. Ayo Jackson attempts a 3Pt. Contested by Terry Ingram (5.8 feet, MAN). Ayo Jackson misses. Offensive rebound by Rudy Haliburton! Rudy Haliburton kicks it out.

[04:34] Team_003 possession (Score: 34-46)
Rudy Haliburton attempts a 3Pt. Contested by Kobe Wagner (5.1 feet, MAN). RUDY HALIBURTON MAKES IT! Assist: Victor O'Neal
Score: 37-46

[04:18] Team_094 possession (Score: 37-46)
Terry Ingram attempts a 3Pt. Wide open! Ayo Jackson is 6.4 feet away. [ZONE] Terry Ingram misses. Rebound secured by Rudy Haliburton.

[04:04] Team_003 possession (Score: 37-46)
Nikola Bryant attempts a Midrange. Contested by Lauri Thompson (5.9 feet, ZONE). Nikola Bryant misses. Offensive rebound by Rudy Haliburton! Rudy Haliburton kicks it out.

[03:48] Team_003 possession (Score: 37-46)
Rudy Haliburton attempts a Midrange. Contested by Kobe Wagner (5.2 feet, MAN). Rudy Haliburton misses. Rebound secured by Kobe Wagner.

[03:35] Team_094 possession (Score: 37-46)
Tim Russell drives, picks up Giannis Turner. Help arrives from Nikola Bryant! Tim Russell attempts a Layup. Contested by Nikola Bryant (4.2 feet, MAN). TIM RUSSELL MAKES IT! Assist: Lauri Thompson
Score: 37-48

[03:22] Team_003 possession (Score: 37-48)
Rudy Haliburton drives and kicks out. Nikola Bryant attempts a 3Pt. Contested by Lauri Thompson (5.9 feet, MAN). NIKOLA BRYANT MAKES IT! Assist: Rudy Haliburton
Score: 40-48

[03:06] Team_094 possession (Score: 40-48)
Tim Russell drives and kicks out. Tim Russell attempts a Midrange. Contested by Giannis Turner (4.3 feet, MAN). Tim Russell misses. Rebound secured by Victor O'Neal.

[02:50] Team_003 possession (Score: 40-48)
Rudy Haliburton drives, Tim Russell stays with him. Rudy Haliburton attempts a Layup. Contested by Tim Russell (5.9 feet, ZONE). Rudy Haliburton misses. FOUL! Loose ball foul on Tim Russell during the rebound battle. [Team fouls: 4] No free throws, side out. (Tim Russell: 2 personal fouls)

[02:39] Team_003 possession (Score: 40-48)
Nikola Bryant attempts a 3Pt. Contested by Kobe Wagner (5.5 feet, ZONE). Nikola Bryant misses. Rebound secured by Tim Russell.

[02:29] Team_094 possession (Score: 40-48)
Kobe Bryant attempts a 3Pt. Contested by Giannis Turner (4.5 feet, ZONE). Kobe Bryant misses. Rebound secured by Victor O'Neal.

[02:10] Team_003 possession (Score: 40-48)
Rudy Haliburton attempts a 3Pt. BLOCKED BY KOBE WAGNER! Ball is loose! Rebound secured by Kobe Wagner.

[01:58] Team_094 possession (Score: 40-48)
Lauri Thompson drives and kicks out. Lauri Thompson attempts a Midrange. Contested by Rudy Haliburton (4.7 feet, ZONE). LAURI THOMPSON MAKES IT!
Score: 40-50

[01:46] Team_003 possession (Score: 40-50)
Nikola Bryant attempts a Layup. Wide open! Lauri Thompson is 6.2 feet away. [MAN] Nikola Bryant misses. Rebound secured by Tim Russell.

[01:28] Team_094 possession (Score: 40-50)
FOUL! Shooting foul on Giannis Turner. Terry Ingram to the line for 3 free throws. [Team fouls: 3] (Giannis Turner: 3 personal fouls)   FT 1/3: GOOD   FT 2/3: GOOD   FT 3/3: MISS Terry Ingram makes 2/3 from the line. Rebound secured by Giannis Turner.
Score: 40-52

[01:13] Team_003 possession (Score: 40-52)
Victor O'Neal drives and kicks out. Nikola Bryant attempts a 3Pt. Wide open! Lauri Thompson is 6.2 feet away. [MAN] NIKOLA BRYANT MAKES IT!
Score: 43-52

[01:01] Team_094 possession (Score: 43-52)
Kobe Bryant drives and kicks out. Tim Russell attempts a 3Pt. Contested by Giannis Turner (4.7 feet, MAN). Tim Russell misses. Rebound secured by Giannis Turner.

[00:51] Team_003 possession (Score: 43-52)
Rudy Haliburton attempts a 3Pt. Contested by Kobe Wagner (5.6 feet, MAN). RUDY HALIBURTON MAKES IT! Assist: Ayo Jackson
Score: 46-52

[00:38] Team_094 possession (Score: 46-52)
FOUL! Holding foul on Nikola Bryant. [Team fouls: 4] No free throws, side out. (Nikola Bryant: 1 personal fouls)

[00:25] Team_094 possession (Score: 46-52)
Lauri Thompson attempts a 3Pt. Contested by Giannis Turner (4.9 feet, ZONE). Lauri Thompson misses. Rebound secured by Giannis Turner.

[00:08] Team_003 possession (Score: 46-52)
Ayo Jackson attempts a Midrange. Wide open! Lauri Thompson is 6.4 feet away. [ZONE] Ayo Jackson misses. Rebound secured by Kobe Bryant.

================================================================================
                              2ND QUARTER COMPLETE                              
================================================================================

2ND QUARTER SCORE: Team_003 26, Team_094 21

BOX SCORE:
================================================================================

Team_003
--------------------------------------------------------------------------------
Player                MIN  PTS  REB  AST  TO      FG   FG%      3P   3P%
--------------------------------------------------------------------------------
Rudy Haliburton        23   14    6    1   0   5/8    62.5     0/0   0.0
Nikola Bryant          23    6    0    1   0   2/6    33.3     0/0   0.0
Victor O'Neal          23    6    2    1   0   2/3    66.7     0/0   0.0
Giannis Turner         23    0    6    1   0   0/1     0.0     0/0   0.0
Ayo Jackson            23    0    0    1   0   0/2     0.0     0/0   0.0

TEAM: FG: 9/20 (45.0%), 3PT: 3/10 (30.0%), REB: 14 (3 off, 11 def), AST: 5, TO: 3
TEAM FOULS: 4


Team_094
--------------------------------------------------------------------------------
Player                MIN  PTS  REB  AST  TO      FG   FG%      3P   3P%
--------------------------------------------------------------------------------
Kobe Bryant            23    6    5    0   0   3/6    50.0     0/0   0.0
Kobe Wagner            23    5    3    1   0   2/2   100.0     0/0   0.0
Terry Ingram           23    4    0    0   0   2/4    50.0     0/0   0.0
Tim Russell            23    2    4    3   0   1/3    33.3     0/0   0.0
Lauri Thompson         23    2    0    1   0   1/5    20.0     0/0   0.0

TEAM: FG: 9/20 (45.0%), 3PT: 0/6 (0.0%), REB: 12 (1 off, 11 def), AST: 5, TO: 2
TEAM FOULS: 4

================================================================================

================================================================================
                       3RD QUARTER - Team_003 vs Team_094                       
================================================================================

[12:00] Team_003 possession (Score: 46-52)
Giannis Turner attempts a Midrange. Contested by Kobe Wagner (4.4 feet, ZONE). GIANNIS TURNER MAKES IT!
Score: 48-52

[11:43] Team_094 possession (Score: 48-52)
Lauri Thompson attempts a Layup. Contested by Nikola Bryant (4.4 feet, MAN). LAURI THOMPSON MAKES IT! Assist: Terry Ingram
Score: 48-54

[11:27] Team_003 possession (Score: 48-54)
Nikola Bryant attempts a Midrange. Contested by Lauri Thompson (5.1 feet, MAN). Nikola Bryant misses. Offensive rebound by Victor O'Neal! Victor O'Neal kicks it out.

[11:15] Team_003 possession (Score: 48-54)
Ayo Jackson attempts a 3Pt. Contested by Terry Ingram (5.0 feet, ZONE). Ayo Jackson misses. Offensive rebound by Rudy Haliburton! Rudy Haliburton's putback is no good. Rebound secured by Kobe Wagner.

[10:59] Team_094 possession (Score: 48-54)
Kobe Bryant drives to the basket... Kobe Bryant throws a bad pass out of bounds! TURNOVER! (dead ball)

[10:45] Team_003 possession (Score: 48-54)
Victor O'Neal drives to the basket... Victor O'Neal throws a bad pass out of bounds! TURNOVER! (dead ball)

[10:28] Team_094 possession (Score: 48-54)
Tim Russell attempts a Layup. Contested by Giannis Turner (3.0 feet, MAN). TIM RUSSELL MAKES IT! Assist: Kobe Wagner
Score: 48-56

[10:18] Team_003 possession (Score: 48-56)
Ayo Jackson attempts a Midrange. Contested by Kobe Wagner (4.4 feet, ZONE). Ayo Jackson misses. Offensive rebound by Victor O'Neal! Victor O'Neal kicks it out.

[10:00] Team_003 possession (Score: 48-56)
Victor O'Neal attempts a Layup. Contested by Kobe Bryant (5.0 feet, MAN). VICTOR O'NEAL MAKES IT!
Score: 50-56

[09:47] Team_094 possession (Score: 50-56)
Kobe Bryant attempts a 3Pt. Contested by Giannis Turner (3.0 feet, ZONE). Kobe Bryant misses. Rebound secured by Victor O'Neal.

[09:38] Team_003 possession (Score: 50-56)
Giannis Turner attempts a 3Pt. Contested by Kobe Wagner (4.4 feet, ZONE). Giannis Turner misses. Rebound secured by Kobe Wagner.

[09:25] Team_094 possession (Score: 50-56)
Terry Ingram attempts a 3Pt. Contested by Nikola Bryant (4.3 feet, ZONE). Terry Ingram misses. FOUL! Loose ball foul on Giannis Turner during the rebound battle. [Team fouls: 1] No free throws, side out. (Giannis Turner: 1 personal fouls)

[09:08] Team_094 possession (Score: 50-56)
FOUL! Shooting foul on Rudy Haliburton. Lauri Thompson to the line for 2 free throws. [Team fouls: 2] (Rudy Haliburton: 1 personal fouls)   FT 1/2: MISS   FT 2/2: GOOD Lauri Thompson makes 1/2 from the line.
Score: 50-57

[08:59] Team_003 possession (Score: 50-57)
Ayo Jackson drives, Tim Russell stays with him. Ayo Jackson attempts a Dunk. Contested by Tim Russell (5.1 feet, ZONE). AYO JACKSON MAKES IT! Assist: Nikola Bryant
Score: 52-57

[08:49] Team_094 possession (Score: 52-57)
Tim Russell drives, Giannis Turner stays with him. Tim Russell attempts a Dunk. Contested by Giannis Turner (3.0 feet, MAN). TIM RUSSELL MAKES IT!
Score: 52-59

[08:35] Team_003 possession (Score: 52-59)
Nikola Bryant drives, picks up Lauri Thompson. Help arrives from Kobe Wagner! Nikola Bryant attempts a Layup. Contested by Kobe Wagner (5.1 feet, MAN). NIKOLA BRYANT MAKES IT! Assist: Rudy Haliburton
Score: 54-59

[08:24] Team_094 possession (Score: 54-59)
Kobe Wagner attempts a 3Pt. Contested by Giannis Turner (3.2 feet, ZONE). Kobe Wagner misses. Rebound secured by Victor O'Neal.

[08:09] Team_003 possession (Score: 54-59)
Nikola Bryant attempts a 3Pt. Contested by Lauri Thompson (5.1 feet, MAN). NIKOLA BRYANT MAKES IT! Assist: Ayo Jackson
Score: 57-59

[07:57] Team_094 possession (Score: 57-59)
Tim Russell drives and kicks out. Terry Ingram attempts a 3Pt. Contested by Giannis Turner (2.8 feet, ZONE). TERRY INGRAM MAKES IT! Assist: Kobe Wagner
Score: 57-62

[07:41] Team_003 possession (Score: 57-62)
Giannis Turner attempts a Layup. Contested by Tim Russell (5.1 feet, MAN). GIANNIS TURNER MAKES IT! Assist: Victor O'Neal
Score: 59-62

[07:24] Team_094 possession (Score: 59-62)
Kobe Wagner attempts a 3Pt. Contested by Rudy Haliburton (3.7 feet, MAN). Kobe Wagner misses. Rebound secured by Giannis Turner.

[07:08] Team_003 possession (Score: 59-62)
Rudy Haliburton attempts a 3Pt. Contested by Kobe Wagner (4.2 feet, MAN). Rudy Haliburton misses. Rebound secured by Kobe Wagner.

[06:55] Team_094 possession (Score: 59-62)
Lauri Thompson makes the Layup and draws the foul on Nikola Bryant! And-1! Lauri Thompson to the line for 1. [Team fouls: 3] (Nikola Bryant: 1 personal fouls)   FT 1/1: GOOD Lauri Thompson makes 1/1 from the line.
Score: 59-65

[06:39] Team_003 possession (Score: 59-65)
Rudy Haliburton attempts a 3Pt. Contested by Kobe Wagner (4.2 feet, MAN). Rudy Haliburton misses. Rebound secured by Tim Russell.

[06:20] Team_094 possession (Score: 59-65)
Terry Ingram drives to the basket... Terry Ingram throws a bad pass! Stolen by Ayo Jackson! TURNOVER! (live ball)

[06:09] Team_003 possession (Score: 59-65)
Giannis Turner drives and kicks out. Rudy Haliburton attempts a 3Pt. Contested by Kobe Wagner (4.1 feet, ZONE). Rudy Haliburton misses. Rebound secured by Kobe Wagner.

[05:56] Team_094 possession (Score: 59-65)
FOUL! Shooting foul on Ayo Jackson. Terry Ingram to the line for 2 free throws. [Team fouls: 4] (Ayo Jackson: 1 personal fouls)   FT 1/2: GOOD   FT 2/2: GOOD Terry Ingram makes 2/2 from the line.
Score: 59-67

[05:37] Team_003 possession (Score: 59-67)
Rudy Haliburton drives, Kobe Wagner stays with him. Rudy Haliburton attempts a Dunk. Contested by Kobe Wagner (4.2 feet, MAN). Rudy Haliburton misses. Rebound secured by Kobe Wagner.

[05:24] Team_094 possession (Score: 59-67)
FOUL! Holding foul on Ayo Jackson. [IN THE BONUS! 5 team fouls] Terry Ingram to the line for 2 free throws. (Ayo Jackson: 2 personal fouls)   FT 1/2: GOOD   FT 2/2: GOOD Terry Ingram makes 2/2 from the line.
Score: 59-69

[05:11] Team_003 possession (Score: 59-69)
Nikola Bryant attempts a Layup. Contested by Tim Russell (5.1 feet, ZONE). NIKOLA BRYANT MAKES IT! Assist: Ayo Jackson
Score: 61-69

[04:58] Team_094 possession (Score: 61-69)
Kobe Wagner loses the ball! Stripped by Rudy Haliburton! TURNOVER! (live ball)

[04:39] Team_003 possession (Score: 61-69)
Giannis Turner attempts a Midrange. Contested by Tim Russell (5.1 feet, MAN). Giannis Turner misses. Rebound secured by Kobe Wagner.

[04:29] Team_094 possession (Score: 61-69)
Terry Ingram drives, picks up Ayo Jackson. Help arrives from Rudy Haliburton! Terry Ingram attempts a Layup. Contested by Rudy Haliburton (5.7 feet, MAN). Terry Ingram misses. Rebound secured by Victor O'Neal.

[04:13] Team_003 possession (Score: 61-69)
FOUL! Reach-in foul on Terry Ingram during the drive. [Team fouls: 1] No free throws, side out. (Terry Ingram: 1 personal fouls)

[04:01] Team_003 possession (Score: 61-69)
Rudy Haliburton drives to the basket... Rudy Haliburton commits a violation (traveling/carry)! TURNOVER! (dead ball)

[03:45] Team_094 possession (Score: 61-69)
Lauri Thompson attempts a 3Pt. Contested by Nikola Bryant (4.5 feet, MAN). Lauri Thompson misses. Rebound secured by Rudy Haliburton.

[03:31] Team_003 possession (Score: 61-69)
Ayo Jackson attempts a Midrange. Contested by Kobe Bryant (5.4 feet, ZONE). Ayo Jackson misses. Offensive rebound by Rudy Haliburton! Rudy Haliburton kicks it out.

[03:12] Team_003 possession (Score: 61-69)
Rudy Haliburton attempts a Layup. Contested by Tim Russell (5.0 feet, ZONE). RUDY HALIBURTON MAKES IT! Assist: Nikola Bryant
Score: 63-69

[02:55] Team_094 possession (Score: 63-69)
Lauri Thompson attempts a 3Pt. Contested by Nikola Bryant (4.6 feet, MAN). Lauri Thompson misses. Offensive rebound by Kobe Bryant! Kobe Bryant's putback is no good. Rebound secured by Rudy Haliburton.

[02:37] Team_003 possession (Score: 63-69)
Giannis Turner drives and kicks out. Giannis Turner attempts a 3Pt. Contested by Tim Russell (5.0 feet, MAN). Giannis Turner misses. Rebound secured by Kobe Wagner.

[02:23] Team_094 possession (Score: 63-69)
Tim Russell attempts a 3Pt. Contested by Rudy Haliburton (3.6 feet, ZONE). Tim Russell misses. Rebound secured by Rudy Haliburton.

[02:04] Team_003 possession (Score: 63-69)
Giannis Turner attempts a 3Pt. Contested by Tim Russell (5.3 feet, MAN). Giannis Turner misses. Rebound secured by Kobe Bryant.

[01:51] Team_094 possession (Score: 63-69)
FOUL! Shooting foul on Nikola Bryant. Lauri Thompson to the line for 2 free throws. [BONUS: 6 team fouls] (Nikola Bryant: 2 personal fouls)   FT 1/2: MISS   FT 2/2: GOOD Lauri Thompson makes 1/2 from the line.
Score: 63-70

[01:39] Team_003 possession (Score: 63-70)
Ayo Jackson attempts a 3Pt. Contested by Terry Ingram (5.4 feet, MAN). AYO JACKSON MAKES IT! Assist: Giannis Turner
Score: 66-70

[01:20] Team_094 possession (Score: 66-70)
Kobe Bryant drives, Victor O'Neal stays with him. Kobe Bryant attempts a Dunk. Contested by Victor O'Neal (4.8 feet, ZONE). Kobe Bryant misses. Rebound secured by Giannis Turner.

[01:01] Team_003 possession (Score: 66-70)
Rudy Haliburton drives, Tim Russell stays with him. Rudy Haliburton attempts a Layup. Contested by Tim Russell (5.2 feet, ZONE). RUDY HALIBURTON MAKES IT! Assist: Ayo Jackson
Score: 68-70

[00:45] Team_094 possession (Score: 68-70)
FOUL! Holding foul on Ayo Jackson. [IN THE BONUS! 7 team fouls] Terry Ingram to the line for 2 free throws. (Ayo Jackson: 3 personal fouls)   FT 1/2: MISS   FT 2/2: GOOD Terry Ingram makes 1/2 from the line.
Score: 68-71

[00:28] Team_003 possession (Score: 68-71)
Nikola Bryant attempts a 3Pt. BLOCKED BY KOBE WAGNER! Ball is loose! Offensive rebound by Victor O'Neal! Victor O'Neal kicks it out.

[00:11] Team_003 possession (Score: 68-71)
Ayo Jackson attempts a Layup. Contested by Terry Ingram (5.5 feet, MAN). AYO JACKSON MAKES IT! Assist: Giannis Turner
Score: 70-71

================================================================================
                              3RD QUARTER COMPLETE                              
================================================================================

3RD QUARTER SCORE: Team_003 24, Team_094 19

BOX SCORE:
================================================================================

Team_003
--------------------------------------------------------------------------------
Player                MIN  PTS  REB  AST  TO      FG   FG%      3P   3P%
--------------------------------------------------------------------------------
Ayo Jackson            35    7    0    3   0   3/4    75.0     0/0   0.0
Nikola Bryant          35    7    0    2   0   3/3   100.0     0/0   0.0
Giannis Turner         35    4    2    2   0   2/7    28.6     0/0   0.0
Rudy Haliburton        35    4    4    1   0   2/5    40.0     0/0   0.0
Victor O'Neal          35    2    6    1   0   1/1   100.0     0/0   0.0

TEAM: FG: 11/20 (55.0%), 3PT: 2/7 (28.6%), REB: 12 (5 off, 7 def), AST: 9, TO: 2
TEAM FOULS: 7 [Team_094 in BONUS]


Team_094
--------------------------------------------------------------------------------
Player                MIN  PTS  REB  AST  TO      FG   FG%      3P   3P%
--------------------------------------------------------------------------------
Terry Ingram           35    8    0    1   0   4/5    80.0     0/0   0.0
Lauri Thompson         35    7    0    0   0   4/6    66.7     0/0   0.0
Tim Russell            35    4    2    0   0   2/3    66.7     0/0   0.0
Kobe Wagner            35    0    7    2   0   0/2     0.0     0/0   0.0
Kobe Bryant            35    0    1    0   0   0/2     0.0     0/0   0.0

TEAM: FG: 10/18 (55.6%), 3PT: 0/6 (0.0%), REB: 10 (2 off, 8 def), AST: 3, TO: 3
TEAM FOULS: 1

================================================================================

================================================================================
                       4TH QUARTER - Team_003 vs Team_094                       
================================================================================

[12:00] Team_003 possession (Score: 70-71)
Victor O'Neal attempts a Midrange. Contested by Tim Russell (5.0 feet, ZONE). Victor O'Neal misses. Rebound secured by Kobe Bryant.

[11:44] Team_094 possession (Score: 70-71)
Kobe Wagner drives to the basket... Kobe Wagner throws a bad pass! Stolen by Rudy Haliburton! TURNOVER! (live ball)

[11:31] Team_003 possession (Score: 70-71)
Rudy Haliburton attempts a 3Pt. Contested by Kobe Wagner (4.5 feet, ZONE). Rudy Haliburton misses. Rebound secured by Tim Russell.

[11:13] Team_094 possession (Score: 70-71)
Lauri Thompson loses the ball! Stripped by Nikola Bryant! TURNOVER! (live ball)

[10:55] Team_003 possession (Score: 70-71)
Rudy Haliburton attempts a 3Pt. Contested by Kobe Wagner (4.5 feet, MAN). Rudy Haliburton misses. Rebound secured by Kobe Bryant.

[10:39] Team_094 possession (Score: 70-71)
Kobe Wagner attempts a 3Pt. Contested by Giannis Turner (3.7 feet, ZONE). Kobe Wagner misses. Offensive rebound by Tim Russell! Tim Russell kicks it out.

[10:24] Team_094 possession (Score: 70-71)
Kobe Bryant drives, picks up Giannis Turner. Help arrives from Nikola Bryant! Kobe Bryant attempts a Dunk. Contested by Nikola Bryant (3.5 feet, MAN). KOBE BRYANT MAKES IT! Assist: Lauri Thompson
Score: 70-73

[10:09] Team_003 possession (Score: 70-73)
Victor O'Neal attempts a Layup. Contested by Tim Russell (5.1 feet, ZONE). VICTOR O'NEAL MAKES IT! Assist: Rudy Haliburton
Score: 72-73

[09:55] Team_094 possession (Score: 72-73)
Terry Ingram drives and kicks out. Terry Ingram attempts a Midrange. Contested by Ayo Jackson (5.8 feet, MAN). Terry Ingram misses. Offensive rebound by Kobe Bryant! Kobe Bryant puts it back in!
Score: 72-75

[09:43] Team_003 possession (Score: 72-75)
Giannis Turner drives, Tim Russell stays with him. Giannis Turner attempts a Dunk. Contested by Tim Russell (5.5 feet, ZONE). Giannis Turner misses. Rebound secured by Kobe Bryant.

[09:25] Team_094 possession (Score: 72-75)
Lauri Thompson attempts a 3Pt. Contested by Giannis Turner (3.8 feet, ZONE). Lauri Thompson misses. Rebound secured by Rudy Haliburton.

[09:09] Team_003 possession (Score: 72-75)
FOUL! Reach-in foul on Terry Ingram during the drive. [Team fouls: 1] No free throws, side out. (Terry Ingram: 1 personal fouls)

[08:52] Team_003 possession (Score: 72-75)
Victor O'Neal attempts a 3Pt. Contested by Kobe Bryant (5.4 feet, MAN). Victor O'Neal misses. Rebound secured by Kobe Wagner.

[08:40] Team_094 possession (Score: 72-75)
Kobe Bryant attempts a Layup. Contested by Giannis Turner (3.7 feet, MAN). KOBE BRYANT MAKES IT! Assist: Terry Ingram
Score: 72-77

[08:27] Team_003 possession (Score: 72-77)
Giannis Turner loses the ball! Stripped by Tim Russell! TURNOVER! (live ball)

[08:08] Team_094 possession (Score: 72-77)
Kobe Wagner attempts a 3Pt. Contested by Giannis Turner (4.0 feet, ZONE). KOBE WAGNER MAKES IT! Assist: Terry Ingram
Score: 72-80

[07:54] Team_003 possession (Score: 72-80)
Rudy Haliburton attempts a Midrange. Contested by Kobe Wagner (4.9 feet, MAN). RUDY HALIBURTON MAKES IT!
Score: 74-80

[07:43] Team_094 possession (Score: 74-80)
Kobe Wagner attempts a 3Pt. Contested by Giannis Turner (4.1 feet, ZONE). Kobe Wagner misses. Offensive rebound by Tim Russell! Tim Russell kicks it out.

[07:29] Team_094 possession (Score: 74-80)
Lauri Thompson attempts a 3Pt. Contested by Nikola Bryant (5.1 feet, MAN). Lauri Thompson misses. Rebound secured by Rudy Haliburton.

[07:12] Team_003 possession (Score: 74-80)
Victor O'Neal attempts a Midrange. Contested by Kobe Bryant (5.6 feet, MAN). Victor O'Neal misses. Rebound secured by Kobe Bryant.

[07:00] Team_094 possession (Score: 74-80)
Tim Russell drives and kicks out. Kobe Wagner attempts a Midrange. Contested by Giannis Turner (3.9 feet, ZONE). KOBE WAGNER MAKES IT! Assist: Tim Russell
Score: 74-82

[06:44] Team_003 possession (Score: 74-82)
Giannis Turner attempts a Layup. Contested by Tim Russell (5.8 feet, MAN). Giannis Turner misses. Rebound secured by Kobe Wagner.

[06:25] Team_094 possession (Score: 74-82)
Tim Russell attempts a Midrange. Contested by Giannis Turner (4.0 feet, MAN). TIM RUSSELL MAKES IT!
Score: 74-84

[06:12] Team_003 possession (Score: 74-84)
Ayo Jackson attempts a Midrange. Contested by Terry Ingram (6.0 feet, MAN). Ayo Jackson misses. Rebound secured by Kobe Wagner.

[06:03] Team_094 possession (Score: 74-84)
Tim Russell attempts a Midrange. Contested by Nikola Bryant (5.1 feet, ZONE). Tim Russell misses. Rebound secured by Giannis Turner.

[05:51] Team_003 possession (Score: 74-84)
Nikola Bryant attempts a Midrange. Contested by Tim Russell (5.9 feet, ZONE). NIKOLA BRYANT MAKES IT! Assist: Victor O'Neal
Score: 76-84

[05:38] Team_094 possession (Score: 76-84)
Tim Russell attempts a Layup. Contested by Giannis Turner (4.2 feet, MAN). TIM RUSSELL MAKES IT!
Score: 76-86

[05:21] Team_003 possession (Score: 76-86)
Ayo Jackson attempts a 3Pt. Contested by Kobe Wagner (5.4 feet, ZONE). Ayo Jackson misses. Rebound secured by Kobe Wagner.

[05:07] Team_094 possession (Score: 76-86)
Kobe Bryant drives to the basket... Kobe Bryant commits a violation (traveling/carry)! TURNOVER! (dead ball)

[05:07] Substitution (Team_003): Ayo Jackson OUT → Miles Towns IN (stamina_rule2)

[05:07] Substitution (Team_003): Nikola Bryant OUT → Pau Williamson IN (stamina_rule2)

[05:07] Substitution (Team_003): Rudy Haliburton OUT → Collin Mitchell IN (stamina_rule2)

[05:07] Substitution (Team_003): Giannis Turner OUT → Anfernee Jordan IN (stamina_rule2)

[05:07] Substitution (Team_003): Victor O'Neal OUT → Bam Gilgeous-Alexander IN (stamina_rule2)

[05:07] Substitution (Team_094): Terry Ingram OUT → Shaquille Bryant IN (stamina_rule2)

[05:07] Substitution (Team_094): Lauri Thompson OUT → Kevin Rozier IN (stamina_rule2)

[05:07] Substitution (Team_094): Kobe Wagner OUT → Ayo Gasol IN (stamina_rule2)

[05:07] Substitution (Team_094): Tim Russell OUT → Domantas Haliburton IN (stamina_rule2)

[05:07] Substitution (Team_094): Kobe Bryant OUT → Isaiah Quickley IN (stamina_rule2)

[04:50] Team_003 possession (Score: 76-86)
Anfernee Jordan drives, Isaiah Quickley stays with him. Anfernee Jordan attempts a Dunk. Contested by Isaiah Quickley (5.9 feet, ZONE). ANFERNEE JORDAN MAKES IT!
Score: 78-86

[04:32] Team_094 possession (Score: 78-86)
Ayo Gasol attempts a 3Pt. Contested by Collin Mitchell (4.4 feet, MAN). AYO GASOL MAKES IT! Assist: Shaquille Bryant
Score: 78-89

[04:18] Team_003 possession (Score: 78-89)
Miles Towns attempts a Midrange. Contested by Kevin Rozier (4.9 feet, ZONE). Miles Towns misses. FOUL! Loose ball foul on Ayo Gasol during the rebound battle. [Team fouls: 2] No free throws, side out. (Ayo Gasol: 1 personal fouls)

[04:05] Team_003 possession (Score: 78-89)
FOUL! Shooting foul on Ayo Gasol. Bam Gilgeous-Alexander to the line for 2 free throws. [Team fouls: 3] (Ayo Gasol: 2 personal fouls)   FT 1/2: GOOD   FT 2/2: GOOD Bam Gilgeous-Alexander makes 2/2 from the line.
Score: 80-89

[03:49] Team_094 possession (Score: 80-89)
Shaquille Bryant attempts a Midrange. Contested by Miles Towns (4.9 feet, MAN). Shaquille Bryant misses. Rebound secured by Bam Gilgeous-Alexander.

[03:38] Team_003 possession (Score: 80-89)
Pau Williamson attempts a Layup. Contested by Kevin Rozier (4.9 feet, MAN). PAU WILLIAMSON MAKES IT! Assist: Miles Towns
Score: 82-89

[03:20] Team_094 possession (Score: 82-89)
Kevin Rozier attempts a 3Pt. Contested by Miles Towns (5.8 feet, ZONE). Kevin Rozier misses. Rebound secured by Anfernee Jordan.

[03:07] Team_003 possession (Score: 82-89)
Pau Williamson drives and kicks out. Collin Mitchell makes the Midrange and draws the foul on Ayo Gasol! And-1! Collin Mitchell to the line for 1. [Team fouls: 4] (Ayo Gasol: 3 personal fouls)   FT 1/1: MISS Collin Mitchell makes 0/1 from the line. Rebound secured by Isaiah Quickley.
Score: 84-89

[02:54] Team_094 possession (Score: 84-89)
Isaiah Quickley attempts a Layup. Contested by Bam Gilgeous-Alexander (3.3 feet, ZONE). Isaiah Quickley misses. Rebound secured by Collin Mitchell.

[02:37] Team_003 possession (Score: 84-89)
Anfernee Jordan drives to the basket... Anfernee Jordan throws a bad pass out of bounds! TURNOVER! (dead ball)

[02:24] Team_094 possession (Score: 84-89)
Ayo Gasol attempts a Layup. Contested by Bam Gilgeous-Alexander (3.3 feet, ZONE). AYO GASOL MAKES IT!
Score: 84-91

[02:07] Team_003 possession (Score: 84-91)
Pau Williamson loses the ball! Stripped by Kevin Rozier! TURNOVER! (live ball)

[01:48] Team_094 possession (Score: 84-91)
Shaquille Bryant attempts a 3Pt. Contested by Miles Towns (4.9 feet, ZONE). Shaquille Bryant misses. Rebound secured by Bam Gilgeous-Alexander.

[01:30] Team_003 possession (Score: 84-91)
Bam Gilgeous-Alexander drives to the basket... Bam Gilgeous-Alexander throws a bad pass out of bounds! TURNOVER! (dead ball)

[01:12] Team_094 possession (Score: 84-91)
Shaquille Bryant attempts a 3Pt. Contested by Miles Towns (4.9 feet, MAN). Shaquille Bryant misses. Rebound secured by Bam Gilgeous-Alexander.

[00:56] Team_003 possession (Score: 84-91)
Collin Mitchell attempts a Layup. BLOCKED BY AYO GASOL! Ball deflects out of bounds off Collin Mitchell.

[00:41] Team_094 possession (Score: 84-91)
Domantas Haliburton attempts a Midrange. Contested by Bam Gilgeous-Alexander (3.1 feet, MAN). DOMANTAS HALIBURTON MAKES IT! Assist: Isaiah Quickley
Score: 84-93

[00:30] Team_003 possession (Score: 84-93)
Collin Mitchell drives, Domantas Haliburton stays with him. Collin Mitchell attempts a Layup. Wide open! Domantas Haliburton is 6.0 feet away. [ZONE] COLLIN MITCHELL MAKES IT! Assist: Pau Williamson
Score: 86-93

[00:16] Team_094 possession (Score: 86-93)
FOUL! Reach-in foul on Miles Towns during the drive. [Team fouls: 1] No free throws, side out. (Miles Towns: 1 personal fouls)

[00:03] Team_094 possession (Score: 86-93)
Kevin Rozier drives, picks up Bam Gilgeous-Alexander. Help arrives from Pau Williamson! Kevin Rozier attempts a Dunk. Contested by Pau Williamson (3.5 feet, ZONE). Kevin Rozier misses. Rebound secured by Anfernee Jordan.

================================================================================
                              4TH QUARTER COMPLETE                              
================================================================================

4TH QUARTER SCORE: Team_003 16, Team_094 22

BOX SCORE:
================================================================================

Team_003
--------------------------------------------------------------------------------
Player                MIN  PTS  REB  AST  TO      FG   FG%      3P   3P%
--------------------------------------------------------------------------------
Victor O'Neal          42    2    0    1   0   1/4    25.0     0/0   0.0
Rudy Haliburton        42    2    2    1   0   1/3    33.3     0/0   0.0
Nikola Bryant          42    2    0    0   0   1/1   100.0     0/0   0.0
Anfernee Jordan         6    2    2    0   0   1/1   100.0     0/0   0.0
Collin Mitchell         6    2    2    0   0   1/2    50.0     0/0   0.0
Bam Gilgeous-Alexander    6    2    3    0   0   1/1   100.0     0/0   0.0
Pau Williamson          6    2    0    1   0   1/2    50.0     0/0   0.0
Giannis Turner         42    0    1    0   0   0/2     0.0     0/0   0.0
Ayo Jackson            42    0    0    0   0   0/2     0.0     0/0   0.0
Miles Towns             6    0    0    1   0   0/0     0.0     0/0   0.0

TEAM: FG: 7/18 (38.9%), 3PT: 0/4 (0.0%), REB: 10 (1 off, 9 def), AST: 4, TO: 4
TEAM FOULS: 1


Team_094
--------------------------------------------------------------------------------
Player                MIN  PTS  REB  AST  TO      FG   FG%      3P   3P%
--------------------------------------------------------------------------------
Kobe Bryant            42    6    5    0   0   3/3   100.0     0/0   0.0
Kobe Wagner            42    5    4    0   0   2/2   100.0     0/0   0.0
Ayo Gasol               6    5    0    0   0   2/2   100.0     0/0   0.0
Tim Russell            42    4    3    1   0   2/3    66.7     0/0   0.0
Domantas Haliburton     6    2    0    0   0   1/1   100.0     0/0   0.0
Lauri Thompson         42    0    0    1   0   0/2     0.0     0/0   0.0
Terry Ingram           42    0    0    2   0   0/0     0.0     0/0   0.0
Shaquille Bryant        6    0    0    1   0   0/3     0.0     0/0   0.0
Kevin Rozier            6    0    0    0   0   0/2     0.0     0/0   0.0
Isaiah Quickley         6    0    1    1   0   0/1     0.0     0/0   0.0

TEAM: FG: 10/19 (52.6%), 3PT: 2/7 (28.6%), REB: 13 (3 off, 10 def), AST: 6, TO: 3
TEAM FOULS: 4

================================================================================

================================================================================
                               FULL GAME COMPLETE                               
================================================================================

FINAL SCORE: Team_003 86, Team_094 93

SCORING BY QUARTER:
--------------------------------------------------------------------------------
Team                     Q1     Q2     Q3     Q4    FINAL
--------------------------------------------------------------------------------
Team_003                 20     26     24     16       86
Team_094                 31     21     19     22       93
--------------------------------------------------------------------------------

FULL GAME BOX SCORE:
================================================================================

Team_003
--------------------------------------------------------------------------------
Player                MIN  PTS  REB  AST  TO      FG   FG%      3P   3P%      FT STL BLK
--------------------------------------------------------------------------------
Ayo Jackson            42   10    0    5   1   5/13   38.5   1/5    20.0   2/3     1   0
Nikola Bryant          42   18    0    3   5   5/11   45.5   2/5    40.0   0/0     1   0
Rudy Haliburton        42   22   14    4   0   8/18   44.4   3/10   30.0   0/0     2   0
Giannis Turner         42   11   11    3   1   5/15   33.3   1/4    25.0   2/3     1   0
Victor O'Neal          42   10   13    3   0   6/13   46.2   1/3    33.3   2/2     0   0
Miles Towns             6    0    0    1   2   0/0     0.0   0/0     0.0   0/0     0   0
Pau Williamson          6    2    0    1   1   2/3    66.7   0/0     0.0   0/0     0   0
Collin Mitchell         6    4    2    0   0   2/3    66.7   0/0     0.0   0/1     0   0
Anfernee Jordan         6    4    2    1   0   1/1   100.0   0/0     0.0   0/0     0   0
Bam Gilgeous-Alexander    6    2    4    0   0   1/1   100.0   0/0     0.0   2/2     0   0

TEAM: FG: 35/78 (44.9%), 3PT: 8/27 (29.6%), REB: 45 (11 off, 34 def), AST: 21, TO: 10


Team_094
--------------------------------------------------------------------------------
Player                MIN  PTS  REB  AST  TO      FG   FG%      3P   3P%      FT STL BLK
--------------------------------------------------------------------------------
Terry Ingram           42   18    0    5   1   7/11   63.6   2/4    50.0   7/9     0   0
Lauri Thompson         42   14    0    3   1   7/15   46.7   0/7     0.0   3/8     1   0
Kobe Wagner            42   12   17    5   3   4/9    44.4   1/5    20.0   3/3     0   3
Tim Russell            42   12   17    4   1   8/14   57.1   0/2     0.0   1/2     2   0
Kobe Bryant            42   22   15    0   2   9/15   60.0   0/2     0.0   0/0     0   0
Shaquille Bryant        6    0    0    2   0   0/3     0.0   0/2     0.0   0/0     0   0
Kevin Rozier            6    2    0    0   0   1/4    25.0   0/2     0.0   0/0     1   0
Ayo Gasol               6    8    0    0   0   3/3   100.0   2/2   100.0   0/0     0   1
Domantas Haliburton     6    2    0    0   0   1/1   100.0   0/0     0.0   0/0     0   0
Isaiah Quickley         6    0    1    1   0   0/1     0.0   0/0     0.0   0/0     0   0

TEAM: FG: 42/78 (53.8%), 3PT: 5/26 (19.2%), REB: 51 (10 off, 41 def), AST: 20, TO: 8

================================================================================
