================================================================================
                        FULL GAME - Team_008 vs Team_064                        
================================================================================

================================================================================
                       1ST QUARTER - Team_008 vs Team_064                       
================================================================================

[12:00] Team_008 possession (Score: 0-0)
Victor Leonard makes the Layup and draws the foul on Russell Simons! And-1! Victor Leonard to the line for 1. [Team fouls: 1] (Russell Simons: 1 personal fouls)   FT 1/1: MISS Victor Leonard makes 0/1 from the line. Offensive rebound by Magic Young! Magic Young's putback is no good.
Score: 2-0

[11:48] Team_064 possession (Score: 2-0)
Jordan Mitchell attempts a Layup. Contested by Tyrese Thompson (3.9 feet, ZONE). Jordan Mitchell misses. Rebound secured by Tyrese Thompson.

[11:35] Team_008 possession (Score: 2-0)
Victor Leonard attempts a Midrange. Contested by Russell Simons (3.6 feet, ZONE). Victor Leonard misses. Rebound secured by Russell Simons.

[11:23] Team_064 possession (Score: 2-0)
FOUL! Reach-in foul on Tyrese Thompson during the drive. [Team fouls: 1] No free throws, side out. (Tyrese Thompson: 1 personal fouls)

[11:06] Team_064 possession (Score: 2-0)
Shai Hyland attempts a Midrange. Contested by Magic Young (5.3 feet, MAN). Shai Hyland misses. Offensive rebound by Russell Simons! Russell Simons kicks it out.

[10:56] Team_064 possession (Score: 2-0)
Kawhi Irving attempts a Midrange. Contested by Tyrese Thompson (4.3 feet, ZONE). KAWHI IRVING MAKES IT! Assist: Russell Simons
Score: 2-2

[10:43] Team_008 possession (Score: 2-2)
Magic Young attempts a Midrange. Contested by Shai Hyland (5.4 feet, ZONE). Magic Young misses. Rebound secured by Russell Simons.

[10:29] Team_064 possession (Score: 2-2)
Kawhi Irving attempts a Midrange. Contested by Khris Hyland (3.9 feet, MAN). Kawhi Irving misses. Rebound secured by Magic Young.

[10:17] Team_008 possession (Score: 2-2)
FOUL! Reach-in foul on Russell Simons during the drive. [Team fouls: 2] No free throws, side out. (Russell Simons: 2 personal fouls)

[10:05] Team_008 possession (Score: 2-2)
Tyrese Thompson attempts a Layup. Contested by Russell Simons (3.4 feet, MAN). TYRESE THOMPSON MAKES IT! Assist: Jrue Harris
Score: 4-2

[09:51] Team_064 possession (Score: 4-2)
Shai Hyland attempts a Midrange. Contested by Jrue Harris (4.6 feet, ZONE). SHAI HYLAND MAKES IT! Assist: Russell Simons
Score: 4-4

[09:33] Team_008 possession (Score: 4-4)
Khris Hyland attempts a Layup. Contested by Russell Simons (3.3 feet, ZONE). Khris Hyland misses. Rebound secured by Russell Simons.

[09:16] Team_064 possession (Score: 4-4)
Kawhi Irving makes the Dunk and draws the foul on Jrue Harris! And-1! Kawhi Irving to the line for 1. [Team fouls: 2] (Jrue Harris: 1 personal fouls)   FT 1/1: GOOD Kawhi Irving makes 1/1 from the line.
Score: 4-7

[09:05] Team_008 possession (Score: 4-7)
Victor Leonard makes the Dunk and draws the foul on Russell Simons! And-1! Victor Leonard to the line for 1. [Team fouls: 3] (Russell Simons: 3 personal fouls)   FT 1/1: GOOD Victor Leonard makes 1/1 from the line.
Score: 7-7

[08:51] Team_064 possession (Score: 7-7)
Ja Mitchell attempts a 3Pt. Contested by Victor Leonard (5.2 feet, MAN). Ja Mitchell misses. Offensive rebound by Kawhi Irving! Kawhi Irving kicks it out.

[08:36] Team_064 possession (Score: 7-7)
Russell Simons attempts a Layup. Contested by Tyrese Thompson (4.5 feet, MAN). Russell Simons misses. Rebound secured by Magic Young.

[08:20] Team_008 possession (Score: 7-7)
Khris Hyland attempts a 3Pt. Contested by Kawhi Irving (4.4 feet, MAN). Khris Hyland misses. Offensive rebound by Magic Young! Magic Young puts it back in!
Score: 9-7

[08:03] Team_064 possession (Score: 9-7)
Shai Hyland attempts a Midrange. Contested by Magic Young (5.3 feet, MAN). SHAI HYLAND MAKES IT!
Score: 9-9

[07:49] Team_008 possession (Score: 9-9)
FOUL! Shooting foul on Jordan Mitchell. Magic Young to the line for 2 free throws. [Team fouls: 4] (Jordan Mitchell: 1 personal fouls)   FT 1/2: MISS   FT 2/2: MISS Magic Young makes 0/2 from the line. Rebound secured by Kawhi Irving.

[07:33] Team_064 possession (Score: 9-9)
Jordan Mitchell attempts a Midrange. Contested by Tyrese Thompson (3.9 feet, ZONE). Jordan Mitchell misses. Rebound secured by Magic Young.

[07:22] Team_008 possession (Score: 9-9)
Magic Young attempts a Midrange. Contested by Ja Mitchell (5.5 feet, ZONE). MAGIC YOUNG MAKES IT! Assist: Khris Hyland
Score: 11-9

[07:02] Team_064 possession (Score: 11-9)
FOUL! Shooting foul on Jrue Harris. Shai Hyland to the line for 2 free throws. [Team fouls: 3] (Jrue Harris: 2 personal fouls)   FT 1/2: GOOD   FT 2/2: GOOD Shai Hyland makes 2/2 from the line.
Score: 11-11

[06:45] Team_008 possession (Score: 11-11)
Tyrese Thompson attempts a 3Pt. Contested by Russell Simons (3.4 feet, MAN). Tyrese Thompson misses. Rebound secured by Kawhi Irving.

[06:33] Team_064 possession (Score: 11-11)
Russell Simons drives and kicks out. Ja Mitchell attempts a Midrange. Contested by Victor Leonard (5.0 feet, MAN). Ja Mitchell misses. Offensive rebound by Russell Simons! Russell Simons kicks it out.

[06:17] Team_064 possession (Score: 11-11)
Russell Simons drives to the basket... Russell Simons commits a violation (traveling/carry)! TURNOVER! (dead ball)

[06:05] Team_008 possession (Score: 11-11)
Victor Leonard attempts a Midrange. Contested by Ja Mitchell (5.5 feet, MAN). Victor Leonard misses. Rebound secured by Shai Hyland.

[05:49] Team_064 possession (Score: 11-11)
Shai Hyland attempts a 3Pt. Contested by Victor Leonard (5.3 feet, ZONE). Shai Hyland misses. Offensive rebound by Kawhi Irving! Kawhi Irving kicks it out.

[05:33] Team_064 possession (Score: 11-11)
FOUL! Holding foul on Jrue Harris. [Team fouls: 4] No free throws, side out. (Jrue Harris: 3 personal fouls)

[05:16] Team_064 possession (Score: 11-11)
Kawhi Irving loses control! Ball rolls out of bounds! TURNOVER! (dead ball)

[05:06] Team_008 possession (Score: 11-11)
Khris Hyland attempts a 3Pt. Contested by Kawhi Irving (4.4 feet, MAN). Khris Hyland misses. Rebound secured by Shai Hyland.

[04:52] Team_064 possession (Score: 11-11)
Russell Simons drives to the basket... Russell Simons loses control! Ball rolls out of bounds! TURNOVER! (dead ball)

[04:36] Team_008 possession (Score: 11-11)
Victor Leonard attempts a 3Pt. Contested by Ja Mitchell (5.5 feet, ZONE). Victor Leonard misses. Rebound secured by Shai Hyland.

[04:21] Team_064 possession (Score: 11-11)
Jordan Mitchell attempts a 3Pt. Contested by Jrue Harris (3.9 feet, MAN). Jordan Mitchell misses. Rebound secured by Tyrese Thompson.

[04:10] Team_008 possession (Score: 11-11)
Khris Hyland throws a bad pass! Stolen by Kawhi Irving! TURNOVER! (live ball)

[03:58] Team_064 possession (Score: 11-11)
Shai Hyland drives and kicks out. Shai Hyland attempts a 3Pt. Contested by Magic Young (5.1 feet, MAN). Shai Hyland misses. Offensive rebound by Kawhi Irving! Kawhi Irving kicks it out.

[03:40] Team_064 possession (Score: 11-11)
Kawhi Irving attempts a 3Pt. Contested by Khris Hyland (4.1 feet, MAN). Kawhi Irving misses. Rebound secured by Magic Young.

[03:22] Team_008 possession (Score: 11-11)
FOUL! Reach-in foul on Shai Hyland during the drive. [IN THE BONUS! 5 team fouls] Magic Young to the line for 2 free throws. (Shai Hyland: 1 personal fouls)   FT 1/2: GOOD   FT 2/2: GOOD Magic Young makes 2/2 from the line.
Score: 13-11

[03:04] Team_064 possession (Score: 13-11)
Kawhi Irving attempts a 3Pt. Contested by Victor Leonard (5.1 feet, ZONE). KAWHI IRVING MAKES IT! Assist: Jordan Mitchell
Score: 13-14

[02:52] Team_008 possession (Score: 13-14)
Khris Hyland attempts a Layup. Contested by Kawhi Irving (4.6 feet, MAN). KHRIS HYLAND MAKES IT! Assist: Magic Young
Score: 15-14

[02:41] Team_064 possession (Score: 15-14)
Kawhi Irving attempts a 3Pt. Contested by Khris Hyland (4.2 feet, MAN). KAWHI IRVING MAKES IT! Assist: Ja Mitchell
Score: 15-17

[02:26] Team_008 possession (Score: 15-17)
Tyrese Thompson attempts a Midrange. Contested by Jordan Mitchell (4.3 feet, ZONE). Tyrese Thompson misses. Rebound secured by Shai Hyland.

[02:15] Team_064 possession (Score: 15-17)
Jordan Mitchell drives and kicks out. Ja Mitchell attempts a 3Pt. Contested by Khris Hyland (4.4 feet, ZONE). JA MITCHELL MAKES IT! Assist: Jordan Mitchell
Score: 15-20

[01:59] Team_008 possession (Score: 15-20)
Magic Young attempts a 3Pt. Contested by Russell Simons (4.1 feet, ZONE). Magic Young misses. Rebound secured by Shai Hyland.

[01:49] Team_064 possession (Score: 15-20)
Kawhi Irving attempts a 3Pt. Contested by Khris Hyland (4.3 feet, MAN). KAWHI IRVING MAKES IT! Assist: Shai Hyland
Score: 15-23

[01:36] Team_008 possession (Score: 15-23)
Magic Young attempts a Midrange. Contested by Russell Simons (4.1 feet, ZONE). Magic Young misses. Rebound secured by Shai Hyland.

[01:22] Team_064 possession (Score: 15-23)
Shai Hyland drives and kicks out. Jordan Mitchell attempts a 3Pt. Contested by Jrue Harris (4.7 feet, MAN). Jordan Mitchell misses. Offensive rebound by Russell Simons! Russell Simons kicks it out.

[01:10] Team_064 possession (Score: 15-23)
Ja Mitchell drives and kicks out. Jordan Mitchell attempts a 3Pt. Contested by Jrue Harris (4.7 feet, MAN). Jordan Mitchell misses. Offensive rebound by Kawhi Irving! Kawhi Irving kicks it out.

[00:53] Team_064 possession (Score: 15-23)
Shai Hyland makes the Layup and draws the foul on Tyrese Thompson! And-1! Shai Hyland to the line for 1. [BONUS: 5 team fouls] (Tyrese Thompson: 2 personal fouls)   FT 1/1: MISS Shai Hyland makes 0/1 from the line. Offensive rebound by Russell Simons! Russell Simons kicks it out.
Score: 15-25

[00:40] Team_064 possession (Score: 15-25)
Kawhi Irving attempts a 3Pt. Contested by Victor Leonard (5.3 feet, ZONE). KAWHI IRVING MAKES IT! Assist: Ja Mitchell
Score: 15-28

[00:28] Team_008 possession (Score: 15-28)
Tyrese Thompson attempts a Layup. BLOCKED BY RUSSELL SIMONS! Ball is loose! Rebound secured by Kawhi Irving.

[00:12] Team_064 possession (Score: 15-28)
Russell Simons attempts a Midrange. Contested by Jrue Harris (4.9 feet, ZONE). RUSSELL SIMONS MAKES IT!
Score: 15-30

================================================================================
                              1ST QUARTER COMPLETE                              
================================================================================

1ST QUARTER SCORE: Team_008 15, Team_064 30

BOX SCORE:
================================================================================

Team_008
--------------------------------------------------------------------------------
Player                MIN  PTS  REB  AST  TO      FG   FG%      3P   3P%
--------------------------------------------------------------------------------
Magic Young            12    6    6    1   0   3/7    42.9     0/0   0.0
Victor Leonard         12    3    0    0   0   1/5    20.0     0/0   0.0
Tyrese Thompson        12    2    2    0   0   1/4    25.0     0/0   0.0
Khris Hyland           12    2    0    1   0   1/3    33.3     0/0   0.0
Jrue Harris            12    0    0    1   0   0/0     0.0     0/0   0.0

TEAM: FG: 6/19 (31.6%), 3PT: 1/5 (20.0%), REB: 7 (1 off, 6 def), AST: 3, TO: 1
TEAM FOULS: 5 [Team_064 in BONUS]


Team_064
--------------------------------------------------------------------------------
Player                MIN  PTS  REB  AST  TO      FG   FG%      3P   3P%
--------------------------------------------------------------------------------
Kawhi Irving           12   17    7    0   0   6/8    75.0     0/0   0.0
Shai Hyland            12    6    6    1   0   3/3   100.0     0/0   0.0
Ja Mitchell            12    3    0    2   0   1/1   100.0     0/0   0.0
Russell Simons         12    2    7    2   0   1/2    50.0     0/0   0.0
Jordan Mitchell        12    0    0    2   0   0/3     0.0     0/0   0.0

TEAM: FG: 11/17 (64.7%), 3PT: 4/6 (66.7%), REB: 21 (8 off, 13 def), AST: 7, TO: 3
TEAM FOULS: 5 [Team_008 in BONUS]

================================================================================

================================================================================
                       2ND QUARTER - Team_008 vs Team_064                       
================================================================================

[12:00] Team_008 possession (Score: 15-30)
Victor Leonard drives, Russell Simons stays with him. Victor Leonard attempts a Dunk. Contested by Russell Simons (4.0 feet, ZONE). VICTOR LEONARD MAKES IT!
Score: 17-30

[11:47] Team_064 possession (Score: 17-30)
Ja Mitchell attempts a Midrange. Contested by Jrue Harris (4.8 feet, ZONE). JA MITCHELL MAKES IT!
Score: 17-32

[11:34] Team_008 possession (Score: 17-32)
Khris Hyland attempts a Midrange. Contested by Kawhi Irving (4.7 feet, MAN). Khris Hyland misses. Rebound secured by Russell Simons.

[11:23] Team_064 possession (Score: 17-32)
Ja Mitchell makes the Midrange and draws the foul on Tyrese Thompson! And-1! Ja Mitchell to the line for 1. [Team fouls: 1] (Tyrese Thompson: 1 personal fouls)   FT 1/1: MISS Ja Mitchell makes 0/1 from the line. Offensive rebound by Kawhi Irving! Kawhi Irving kicks it out.
Score: 17-34

[11:07] Team_064 possession (Score: 17-34)
Russell Simons makes the Layup and draws the foul on Tyrese Thompson! And-1! Russell Simons to the line for 1. [Team fouls: 2] (Tyrese Thompson: 2 personal fouls)   FT 1/1: GOOD Russell Simons makes 1/1 from the line.
Score: 17-37

[10:52] Team_008 possession (Score: 17-37)
Magic Young drives to the basket... Magic Young throws a bad pass! Stolen by Russell Simons! TURNOVER! (live ball)

[10:36] Team_064 possession (Score: 17-37)
Kawhi Irving drives to the basket... Kawhi Irving loses control! Ball rolls out of bounds! TURNOVER! (dead ball)

[10:36] Substitution (Team_008): Victor Leonard OUT → Blake Holiday IN (stamina_rule2)

[10:36] Substitution (Team_008): Jrue Harris OUT → Chris Griffin IN (stamina_rule2)

[10:36] Substitution (Team_008): Khris Hyland OUT → Immanuel Young IN (stamina_rule2)

[10:36] Substitution (Team_008): Tyrese Thompson OUT → Khris Giddey IN (stamina_rule2)

[10:36] Substitution (Team_008): Magic Young OUT → Lamelo Middleton IN (stamina_rule2)

[10:36] Substitution (Team_064): Ja Mitchell OUT → CJ Haliburton IN (stamina_rule2)

[10:36] Substitution (Team_064): Jordan Mitchell OUT → Ja Simmons IN (stamina_rule2)

[10:36] Substitution (Team_064): Kawhi Irving OUT → Tobias Herro IN (stamina_rule2)

[10:36] Substitution (Team_064): Russell Simons OUT → Austin Smith IN (stamina_rule2)

[10:36] Substitution (Team_064): Shai Hyland OUT → Devin Cunningham IN (stamina_rule2)

[10:19] Team_008 possession (Score: 17-37)
Lamelo Middleton attempts a Midrange. Contested by Devin Cunningham (5.5 feet, MAN). Lamelo Middleton misses. Rebound secured by Austin Smith.

[10:05] Team_064 possession (Score: 17-37)
FOUL! Holding foul on Khris Giddey. [Team fouls: 3] No free throws, side out. (Khris Giddey: 1 personal fouls)

[09:52] Team_064 possession (Score: 17-37)
Devin Cunningham drives, Lamelo Middleton stays with him. Devin Cunningham attempts a Layup. Contested by Lamelo Middleton (4.1 feet, ZONE). DEVIN CUNNINGHAM MAKES IT! Assist: CJ Haliburton
Score: 17-39

[09:36] Team_008 possession (Score: 17-39)
Lamelo Middleton drives and kicks out. Blake Holiday makes the Midrange and draws the foul on Ja Simmons! And-1! Blake Holiday to the line for 1. [Team fouls: 1] (Ja Simmons: 1 personal fouls)   FT 1/1: GOOD Blake Holiday makes 1/1 from the line.
Score: 20-39

[09:20] Team_064 possession (Score: 20-39)
Tobias Herro throws a bad pass! Stolen by Immanuel Young! TURNOVER! (live ball)

[09:05] Team_008 possession (Score: 20-39)
Lamelo Middleton drives to the basket... Lamelo Middleton loses control! Ball rolls out of bounds! TURNOVER! (dead ball)

[08:49] Team_064 possession (Score: 20-39)
Devin Cunningham attempts a 3Pt. Contested by Blake Holiday (5.2 feet, ZONE). Devin Cunningham misses. Rebound secured by Lamelo Middleton.

[08:31] Team_008 possession (Score: 20-39)
Khris Giddey drives, picks up Austin Smith. Help arrives from Ja Simmons! Khris Giddey attempts a Dunk. Contested by Ja Simmons (4.4 feet, MAN). Khris Giddey misses. Offensive rebound by Lamelo Middleton! Lamelo Middleton puts it back in!
Score: 22-39

[08:16] Team_064 possession (Score: 22-39)
Austin Smith attempts a Layup. Contested by Khris Giddey (3.9 feet, MAN). AUSTIN SMITH MAKES IT! Assist: CJ Haliburton
Score: 22-41

[08:02] Team_008 possession (Score: 22-41)
Blake Holiday attempts a Layup. Contested by Austin Smith (4.7 feet, ZONE). BLAKE HOLIDAY MAKES IT!
Score: 24-41

[07:50] Team_064 possession (Score: 24-41)
CJ Haliburton attempts a 3Pt. Contested by Blake Holiday (5.7 feet, MAN). CJ HALIBURTON MAKES IT!
Score: 24-44

[07:37] Team_008 possession (Score: 24-44)
Khris Giddey attempts a Layup. Contested by Austin Smith (4.4 feet, MAN). Khris Giddey misses. Rebound secured by Ja Simmons.

[07:17] Team_064 possession (Score: 24-44)
Ja Simmons attempts a Layup. Contested by Khris Giddey (4.1 feet, ZONE). JA SIMMONS MAKES IT! Assist: CJ Haliburton
Score: 24-46

[07:00] Team_008 possession (Score: 24-46)
FOUL! Holding foul on Devin Cunningham. [Team fouls: 2] No free throws, side out. (Devin Cunningham: 1 personal fouls)

[06:46] Team_008 possession (Score: 24-46)
Chris Griffin attempts a 3Pt. Contested by Ja Simmons (5.9 feet, MAN). Chris Griffin misses. Rebound secured by Ja Simmons.

[06:31] Team_064 possession (Score: 24-46)
CJ Haliburton attempts a 3Pt. Contested by Blake Holiday (5.7 feet, MAN). CJ HALIBURTON MAKES IT! Assist: Tobias Herro
Score: 24-49

[06:15] Team_008 possession (Score: 24-49)
Lamelo Middleton attempts a Midrange. Wide open! Tobias Herro is 6.3 feet away. [ZONE] Lamelo Middleton misses. Rebound secured by Devin Cunningham.

[06:01] Team_064 possession (Score: 24-49)
Tobias Herro drives to the basket... Tobias Herro loses control! Ball rolls out of bounds! TURNOVER! (dead ball)

[05:43] Team_008 possession (Score: 24-49)
Lamelo Middleton attempts a 3Pt. Wide open! CJ Haliburton is 6.3 feet away. [ZONE] Lamelo Middleton misses. Offensive rebound by Lamelo Middleton! Lamelo Middleton's putback is no good. Rebound secured by Ja Simmons.

[05:33] Team_064 possession (Score: 24-49)
Austin Smith makes the Layup and draws the foul on Khris Giddey! And-1! Austin Smith to the line for 1. [Team fouls: 4] (Khris Giddey: 2 personal fouls)   FT 1/1: GOOD Austin Smith makes 1/1 from the line.
Score: 24-52

[05:18] Team_008 possession (Score: 24-52)
Khris Giddey drives, Austin Smith stays with him. Khris Giddey attempts a Dunk. Contested by Austin Smith (4.4 feet, MAN). Khris Giddey misses. Rebound secured by Austin Smith.

[05:03] Team_064 possession (Score: 24-52)
CJ Haliburton attempts a Midrange. Contested by Blake Holiday (5.7 feet, MAN). CJ Haliburton misses. Rebound secured by Khris Giddey.

[04:52] Team_008 possession (Score: 24-52)
Chris Griffin attempts a 3Pt. Contested by Austin Smith (4.9 feet, ZONE). CHRIS GRIFFIN MAKES IT! Assist: Immanuel Young
Score: 27-52

[04:37] Team_064 possession (Score: 27-52)
Austin Smith attempts a Layup. Contested by Lamelo Middleton (3.9 feet, ZONE). AUSTIN SMITH MAKES IT! Assist: CJ Haliburton
Score: 27-54

[04:23] Team_008 possession (Score: 27-54)
FOUL! Offensive foul on Khris Giddey! Austin Smith drew the charge! [Team fouls: 5] (Khris Giddey: 3 personal fouls) TURNOVER! (dead ball)

[04:09] Team_064 possession (Score: 27-54)
Austin Smith attempts a Midrange. Contested by Khris Giddey (3.9 feet, ZONE). Austin Smith misses. Rebound secured by Lamelo Middleton.

[03:57] Team_008 possession (Score: 27-54)
Chris Griffin attempts a 3Pt. Contested by Austin Smith (4.9 feet, ZONE). CHRIS GRIFFIN MAKES IT! Assist: Lamelo Middleton
Score: 30-54

[03:43] Team_064 possession (Score: 30-54)
FOUL! Holding foul on Khris Giddey. [IN THE BONUS! 6 team fouls] Austin Smith to the line for 2 free throws. (Khris Giddey: 4 personal fouls)   FT 1/2: GOOD   FT 2/2: GOOD Austin Smith makes 2/2 from the line.
Score: 30-56

[03:28] Team_008 possession (Score: 30-56)
Chris Griffin drives and kicks out. Blake Holiday attempts a 3Pt. Contested by Austin Smith (4.6 feet, ZONE). Blake Holiday misses. Rebound secured by Austin Smith.

[03:18] Team_064 possession (Score: 30-56)
Tobias Herro attempts a 3Pt. Contested by Immanuel Young (3.8 feet, MAN). TOBIAS HERRO MAKES IT! Assist: CJ Haliburton
Score: 30-59

[03:02] Team_008 possession (Score: 30-59)
Chris Griffin attempts a 3Pt. Contested by Ja Simmons (6.0 feet, MAN). CHRIS GRIFFIN MAKES IT! Assist: Lamelo Middleton
Score: 33-59

[02:46] Team_064 possession (Score: 33-59)
FOUL! Holding foul on Chris Griffin. [IN THE BONUS! 7 team fouls] Ja Simmons to the line for 2 free throws. (Chris Griffin: 1 personal fouls)   FT 1/2: GOOD   FT 2/2: GOOD Ja Simmons makes 2/2 from the line.
Score: 33-61

[02:27] Team_008 possession (Score: 33-61)
Immanuel Young throws a bad pass out of bounds! TURNOVER! (dead ball)

[02:15] Team_064 possession (Score: 33-61)
Devin Cunningham attempts a Midrange. Contested by Lamelo Middleton (4.2 feet, MAN). DEVIN CUNNINGHAM MAKES IT!
Score: 33-63

[02:01] Team_008 possession (Score: 33-63)
Chris Griffin drives, Ja Simmons stays with him. Chris Griffin attempts a Dunk. Wide open! Ja Simmons is 6.0 feet away. [MAN] CHRIS GRIFFIN MAKES IT! Assist: Khris Giddey
Score: 35-63

[01:47] Team_064 possession (Score: 35-63)
Ja Simmons attempts a Layup. Contested by Chris Griffin (5.2 feet, MAN). JA SIMMONS MAKES IT! Assist: Tobias Herro
Score: 35-65

[01:30] Team_008 possession (Score: 35-65)
Lamelo Middleton drives, picks up Devin Cunningham. Help arrives from Ja Simmons! Lamelo Middleton attempts a Dunk. Contested by Ja Simmons (5.7 feet, MAN). LAMELO MIDDLETON MAKES IT!
Score: 37-65

[01:20] Team_064 possession (Score: 37-65)
Tobias Herro drives and kicks out. CJ Haliburton attempts a Midrange. Contested by Blake Holiday (5.6 feet, MAN). CJ HALIBURTON MAKES IT! Assist: Tobias Herro
Score: 37-67

[01:05] Team_008 possession (Score: 37-67)
Blake Holiday attempts a Layup. Wide open! CJ Haliburton is 6.3 feet away. [MAN] BLAKE HOLIDAY MAKES IT! Assist: Lamelo Middleton
Score: 39-67

[00:52] Team_064 possession (Score: 39-67)
CJ Haliburton attempts a 3Pt. Contested by Blake Holiday (5.9 feet, MAN). CJ Haliburton misses. Offensive rebound by Ja Simmons! Ja Simmons kicks it out.

[00:40] Team_064 possession (Score: 39-67)
Devin Cunningham drives and kicks out. Devin Cunningham attempts a 3Pt. Contested by Khris Giddey (4.5 feet, ZONE). DEVIN CUNNINGHAM MAKES IT! Assist: CJ Haliburton
Score: 39-70

[00:26] Team_008 possession (Score: 39-70)
Chris Griffin attempts a Midrange. Wide open! Ja Simmons is 6.1 feet away. [ZONE] CHRIS GRIFFIN MAKES IT! Assist: Immanuel Young
Score: 41-70

[00:16] Team_064 possession (Score: 41-70)
Austin Smith attempts a 3Pt. Contested by Chris Griffin (5.2 feet, ZONE). Austin Smith misses. Rebound secured by Lamelo Middleton.

================================================================================
                              2ND QUARTER COMPLETE                              
================================================================================

2ND QUARTER SCORE: Team_008 26, Team_064 40

BOX SCORE:
================================================================================

Team_008
--------------------------------------------------------------------------------
Player                MIN  PTS  REB  AST  TO      FG   FG%      3P   3P%
--------------------------------------------------------------------------------
Chris Griffin          10   13    0    0   0   5/7    71.4     0/0   0.0
Blake Holiday          10    7    0    0   0   3/3   100.0     0/0   0.0
Lamelo Middleton       10    4    4    3   0   2/5    40.0     0/0   0.0
Victor Leonard         14    2    0    0   0   1/1   100.0     0/0   0.0
Khris Hyland           14    0    0    0   0   0/1     0.0     0/0   0.0
Khris Giddey           10    0    1    1   0   0/2     0.0     0/0   0.0
Immanuel Young         10    0    0    2   0   0/0     0.0     0/0   0.0

TEAM: FG: 11/19 (57.9%), 3PT: 3/5 (60.0%), REB: 6 (2 off, 4 def), AST: 6, TO: 4
TEAM FOULS: 7 [Team_064 in BONUS]


Team_064
--------------------------------------------------------------------------------
Player                MIN  PTS  REB  AST  TO      FG   FG%      3P   3P%
--------------------------------------------------------------------------------
Austin Smith           10    9    3    0   0   4/6    66.7     0/0   0.0
CJ Haliburton          10    8    0    6   0   3/4    75.0     0/0   0.0
Devin Cunningham       10    7    1    0   0   3/4    75.0     0/0   0.0
Ja Simmons             10    6    4    0   0   3/3   100.0     0/0   0.0
Russell Simons         14    3    1    0   0   1/1   100.0     0/0   0.0
Tobias Herro           10    3    0    3   0   1/1   100.0     0/0   0.0
Ja Mitchell            14    2    0    0   0   1/1   100.0     0/0   0.0
Kawhi Irving           14    0    1    0   0   0/0     0.0     0/0   0.0

TEAM: FG: 16/20 (80.0%), 3PT: 3/5 (60.0%), REB: 9 (2 off, 7 def), AST: 9, TO: 3
TEAM FOULS: 2

================================================================================

================================================================================
                       3RD QUARTER - Team_008 vs Team_064                       
================================================================================

[12:00] Team_008 possession (Score: 41-70)
Magic Young attempts a Midrange. Contested by Kawhi Irving (4.7 feet, ZONE). Magic Young misses. Offensive rebound by Magic Young! Magic Young puts it back in!
Score: 43-70

[11:47] Team_064 possession (Score: 43-70)
Shai Hyland drives to the basket... Shai Hyland loses control! Ball rolls out of bounds! TURNOVER! (dead ball)

[11:36] Team_008 possession (Score: 43-70)
Victor Leonard drives, picks up Russell Simons. Help arrives from Jordan Mitchell! Victor Leonard attempts a Layup. Contested by Jordan Mitchell (3.6 feet, ZONE). VICTOR LEONARD MAKES IT! Assist: Jrue Harris
Score: 45-70

[11:22] Team_064 possession (Score: 45-70)
Jordan Mitchell drives to the basket... Jordan Mitchell commits a violation (traveling/carry)! TURNOVER! (dead ball)

[11:09] Team_008 possession (Score: 45-70)
Magic Young drives, Shai Hyland stays with him. Magic Young attempts a Dunk. Contested by Shai Hyland (5.4 feet, MAN). MAGIC YOUNG MAKES IT! Assist: Khris Hyland
Score: 47-70

[10:54] Team_064 possession (Score: 47-70)
FOUL! Shooting foul on Tyrese Thompson. Kawhi Irving to the line for 2 free throws. [Team fouls: 1] (Tyrese Thompson: 1 personal fouls)   FT 1/2: MISS   FT 2/2: MISS Kawhi Irving makes 0/2 from the line. Rebound secured by Magic Young.

[10:40] Team_008 possession (Score: 47-70)
Jrue Harris attempts a 3Pt. Contested by Ja Mitchell (5.2 feet, ZONE). Jrue Harris misses. Rebound secured by Shai Hyland.

[10:23] Team_064 possession (Score: 47-70)
Russell Simons attempts a 3Pt. Contested by Victor Leonard (5.1 feet, ZONE). RUSSELL SIMONS MAKES IT! Assist: Jordan Mitchell
Score: 47-73

[10:06] Team_008 possession (Score: 47-73)
Magic Young drives and kicks out. FOUL! Shooting foul on Shai Hyland. Magic Young to the line for 3 free throws. [Team fouls: 1] (Shai Hyland: 1 personal fouls)   FT 1/3: GOOD   FT 2/3: GOOD   FT 3/3: MISS Magic Young makes 2/3 from the line. Rebound secured by Kawhi Irving.
Score: 49-73

[09:49] Team_064 possession (Score: 49-73)
Shai Hyland attempts a Midrange. Contested by Khris Hyland (4.4 feet, ZONE). SHAI HYLAND MAKES IT! Assist: Ja Mitchell
Score: 49-75

[09:39] Team_008 possession (Score: 49-75)
Jrue Harris attempts a Midrange. Contested by Jordan Mitchell (3.9 feet, ZONE). Jrue Harris misses. Rebound secured by Russell Simons.

[09:24] Team_064 possession (Score: 49-75)
Shai Hyland commits a violation (traveling/carry)! TURNOVER! (dead ball)

[09:07] Team_008 possession (Score: 49-75)
Magic Young drives, Shai Hyland stays with him. Magic Young attempts a Layup. Contested by Shai Hyland (5.4 feet, ZONE). MAGIC YOUNG MAKES IT! Assist: Victor Leonard
Score: 51-75

[08:51] Team_064 possession (Score: 51-75)
Russell Simons attempts a 3Pt. Contested by Tyrese Thompson (4.5 feet, MAN). Russell Simons misses. Rebound secured by Magic Young.

[08:38] Team_008 possession (Score: 51-75)
Tyrese Thompson attempts a Layup. Contested by Russell Simons (3.4 feet, ZONE). Tyrese Thompson misses. Rebound secured by Shai Hyland.

[08:23] Team_064 possession (Score: 51-75)
Kawhi Irving attempts a 3Pt. Contested by Khris Hyland (3.9 feet, MAN). KAWHI IRVING MAKES IT! Assist: Ja Mitchell
Score: 51-78

[08:11] Team_008 possession (Score: 51-78)
Jrue Harris drives and kicks out. Magic Young attempts a Midrange. Contested by Shai Hyland (5.0 feet, MAN). Magic Young misses. Rebound secured by Shai Hyland.

[08:00] Team_064 possession (Score: 51-78)
Kawhi Irving attempts a 3Pt. Contested by Khris Hyland (3.9 feet, MAN). Kawhi Irving misses. Rebound secured by Tyrese Thompson.

[07:46] Team_008 possession (Score: 51-78)
Jrue Harris attempts a 3Pt. Contested by Jordan Mitchell (3.9 feet, MAN). Jrue Harris misses. Offensive rebound by Tyrese Thompson! Tyrese Thompson kicks it out.

[07:32] Team_008 possession (Score: 51-78)
Victor Leonard makes the Layup and draws the foul on Jordan Mitchell! And-1! Victor Leonard to the line for 1. [Team fouls: 2] (Jordan Mitchell: 1 personal fouls)   FT 1/1: GOOD Victor Leonard makes 1/1 from the line.
Score: 54-78

[07:19] Team_064 possession (Score: 54-78)
Kawhi Irving attempts a Midrange. Contested by Khris Hyland (3.9 feet, MAN). Kawhi Irving misses. Rebound secured by Tyrese Thompson.

[07:03] Team_008 possession (Score: 54-78)
Magic Young attempts a Layup. Contested by Shai Hyland (5.4 feet, MAN). MAGIC YOUNG MAKES IT!
Score: 56-78

[06:46] Team_064 possession (Score: 56-78)
Russell Simons drives and kicks out. Shai Hyland makes the Midrange and draws the foul on Jrue Harris! And-1! Shai Hyland to the line for 1. [Team fouls: 2] (Jrue Harris: 1 personal fouls)   FT 1/1: GOOD Shai Hyland makes 1/1 from the line.
Score: 56-81

[06:35] Team_008 possession (Score: 56-81)
Magic Young attempts a Layup. Contested by Shai Hyland (5.4 feet, MAN). MAGIC YOUNG MAKES IT! Assist: Victor Leonard
Score: 58-81

[06:20] Team_064 possession (Score: 58-81)
Ja Mitchell attempts a 3Pt. Contested by Victor Leonard (5.2 feet, MAN). Ja Mitchell misses. Rebound secured by Tyrese Thompson.

[06:03] Team_008 possession (Score: 58-81)
Khris Hyland attempts a Midrange. Contested by Shai Hyland (5.1 feet, ZONE). Khris Hyland misses. Rebound secured by Russell Simons.

[05:51] Team_064 possession (Score: 58-81)
Russell Simons attempts a Midrange. Contested by Jrue Harris (4.4 feet, ZONE). Russell Simons misses. Rebound secured by Magic Young.

[05:40] Team_008 possession (Score: 58-81)
Tyrese Thompson drives and kicks out. Khris Hyland attempts a Midrange. Contested by Kawhi Irving (4.3 feet, ZONE). KHRIS HYLAND MAKES IT! Assist: Tyrese Thompson
Score: 60-81

[05:24] Team_064 possession (Score: 60-81)
Kawhi Irving attempts a 3Pt. Contested by Victor Leonard (4.9 feet, ZONE). Kawhi Irving misses. Offensive rebound by Kawhi Irving! Kawhi Irving kicks it out.

[05:08] Team_064 possession (Score: 60-81)
Ja Mitchell loses the ball! Stripped by Victor Leonard! TURNOVER! (live ball)

[04:54] Team_008 possession (Score: 60-81)
Khris Hyland attempts a Midrange. Contested by Jordan Mitchell (4.0 feet, ZONE). Khris Hyland misses. Rebound secured by Shai Hyland.

[04:39] Team_064 possession (Score: 60-81)
Russell Simons drives to the basket... FOUL! Offensive foul on Russell Simons! Tyrese Thompson drew the charge! [Team fouls: 3] (Russell Simons: 1 personal fouls) TURNOVER! (dead ball)

[04:24] Team_008 possession (Score: 60-81)
Magic Young makes the Midrange and draws the foul on Shai Hyland! And-1! Magic Young to the line for 1. [Team fouls: 4] (Shai Hyland: 2 personal fouls)   FT 1/1: GOOD Magic Young makes 1/1 from the line.
Score: 63-81

[04:08] Team_064 possession (Score: 63-81)
Shai Hyland drives and kicks out. Ja Mitchell attempts a 3Pt. Contested by Victor Leonard (5.1 feet, MAN). Ja Mitchell misses. Rebound secured by Magic Young.

[03:56] Team_008 possession (Score: 63-81)
Victor Leonard drives and kicks out. Victor Leonard attempts a Midrange. Contested by Ja Mitchell (5.3 feet, MAN). VICTOR LEONARD MAKES IT!
Score: 65-81

[03:39] Team_064 possession (Score: 65-81)
Ja Mitchell drives, picks up Tyrese Thompson. Help arrives from Jrue Harris! Ja Mitchell attempts a Dunk. Contested by Jrue Harris (4.8 feet, ZONE). JA MITCHELL MAKES IT! Assist: Kawhi Irving
Score: 65-83

[03:27] Team_008 possession (Score: 65-83)
FOUL! Holding foul on Jordan Mitchell. [IN THE BONUS! 5 team fouls] Jrue Harris to the line for 2 free throws. (Jordan Mitchell: 2 personal fouls)   FT 1/2: GOOD   FT 2/2: GOOD Jrue Harris makes 2/2 from the line.
Score: 67-83

[03:13] Team_064 possession (Score: 67-83)
Ja Mitchell attempts a 3Pt. Contested by Victor Leonard (5.4 feet, MAN). Ja Mitchell misses. Rebound secured by Tyrese Thompson.

[03:04] Team_008 possession (Score: 67-83)
Magic Young drives to the basket... Magic Young loses control! Ball rolls out of bounds! TURNOVER! (dead ball)

[03:04] Substitution (Team_008): Victor Leonard OUT → Blake Holiday IN (stamina_rule2)

[03:04] Substitution (Team_008): Tyrese Thompson OUT → Khris Giddey IN (stamina_rule2)

[03:04] Substitution (Team_008): Magic Young OUT → Lamelo Middleton IN (stamina_rule2)

[03:04] Substitution (Team_064): Ja Mitchell OUT → CJ Haliburton IN (stamina_rule2)

[03:04] Substitution (Team_064): Russell Simons OUT → Austin Smith IN (stamina_rule2)

[03:04] Substitution (Team_064): Shai Hyland OUT → Devin Cunningham IN (stamina_rule2)

[02:48] Team_064 possession (Score: 67-83)
Kawhi Irving drives and kicks out. CJ Haliburton attempts a 3Pt. Contested by Blake Holiday (5.4 feet, MAN). CJ HALIBURTON MAKES IT! Assist: Devin Cunningham
Score: 67-86

[02:38] Team_008 possession (Score: 67-86)
FOUL! Shooting foul on Austin Smith. Khris Hyland to the line for 2 free throws. [BONUS: 6 team fouls] (Austin Smith: 1 personal fouls)   FT 1/2: GOOD   FT 2/2: MISS Khris Hyland makes 1/2 from the line. Rebound secured by Austin Smith.
Score: 68-86

[02:22] Team_064 possession (Score: 68-86)
Kawhi Irving attempts a 3Pt. Contested by Khris Hyland (4.2 feet, MAN). KAWHI IRVING MAKES IT! Assist: Austin Smith
Score: 68-89

[02:06] Team_008 possession (Score: 68-89)
Khris Giddey commits a violation (traveling/carry)! TURNOVER! (dead ball)

[02:06] Substitution (Team_008): Jrue Harris OUT → Chris Griffin IN (stamina_rule2)

[02:06] Substitution (Team_008): Khris Hyland OUT → Immanuel Young IN (stamina_rule2)

[02:06] Substitution (Team_064): Jordan Mitchell OUT → Ja Simmons IN (stamina_rule2)

[02:06] Substitution (Team_064): Kawhi Irving OUT → Tobias Herro IN (stamina_rule2)

[01:50] Team_064 possession (Score: 68-89)
Tobias Herro attempts a 3Pt. Contested by Immanuel Young (3.8 feet, MAN). TOBIAS HERRO MAKES IT! Assist: Devin Cunningham
Score: 68-92

[01:37] Team_008 possession (Score: 68-92)
Immanuel Young drives, picks up Austin Smith. Help arrives from Ja Simmons! Immanuel Young attempts a Dunk. Contested by Ja Simmons (5.0 feet, ZONE). IMMANUEL YOUNG MAKES IT! Assist: Chris Griffin
Score: 70-92

[01:21] Team_064 possession (Score: 70-92)
CJ Haliburton attempts a 3Pt. Contested by Blake Holiday (5.7 feet, MAN). CJ HALIBURTON MAKES IT! Assist: Tobias Herro
Score: 70-95

[01:09] Team_008 possession (Score: 70-95)
Chris Griffin attempts a 3Pt. Contested by Austin Smith (4.9 feet, ZONE). Chris Griffin misses. Rebound secured by Ja Simmons.

[00:58] Team_064 possession (Score: 70-95)
Austin Smith attempts a 3Pt. Contested by Khris Giddey (3.9 feet, MAN). AUSTIN SMITH MAKES IT! Assist: Devin Cunningham
Score: 70-98

[00:43] Team_008 possession (Score: 70-98)
Lamelo Middleton attempts a 3Pt. Contested by Austin Smith (4.8 feet, ZONE). Lamelo Middleton misses. Rebound secured by Devin Cunningham.

[00:29] Team_064 possession (Score: 70-98)
FOUL! Reach-in foul on Chris Griffin during the drive. [Team fouls: 3] No free throws, side out. (Chris Griffin: 1 personal fouls)

[00:13] Team_064 possession (Score: 70-98)
Tobias Herro drives, Immanuel Young stays with him. Tobias Herro attempts a Dunk. Contested by Immanuel Young (3.8 feet, MAN). Tobias Herro misses. Rebound secured by Khris Giddey.

================================================================================
                              3RD QUARTER COMPLETE                              
================================================================================

3RD QUARTER SCORE: Team_008 29, Team_064 28

BOX SCORE:
================================================================================

Team_008
--------------------------------------------------------------------------------
Player                MIN  PTS  REB  AST  TO      FG   FG%      3P   3P%
--------------------------------------------------------------------------------
Magic Young            23   13    5    0   0   6/7    85.7     0/0   0.0
Victor Leonard         23    7    0    2   0   3/3   100.0     0/0   0.0
Jrue Harris            24    2    0    1   0   1/4    25.0     0/0   0.0
Khris Hyland           24    2    0    1   0   1/4    25.0     0/0   0.0
Immanuel Young         12    2    0    0   0   1/1   100.0     0/0   0.0
Tyrese Thompson        23    0    5    1   0   0/1     0.0     0/0   0.0
Chris Griffin          12    0    0    1   0   0/1     0.0     0/0   0.0
Lamelo Middleton       13    0    0    0   0   0/1     0.0     0/0   0.0
Khris Giddey           13    0    1    0   0   0/0     0.0     0/0   0.0

TEAM: FG: 12/22 (54.5%), 3PT: 0/3 (0.0%), REB: 11 (2 off, 9 def), AST: 6, TO: 2
TEAM FOULS: 3


Team_064
--------------------------------------------------------------------------------
Player                MIN  PTS  REB  AST  TO      FG   FG%      3P   3P%
--------------------------------------------------------------------------------
Kawhi Irving           24    6    2    1   0   2/5    40.0     0/0   0.0
CJ Haliburton          13    6    0    0   0   2/2   100.0     0/0   0.0
Shai Hyland            23    5    4    0   0   2/3    66.7     0/0   0.0
Russell Simons         23    3    2    0   0   1/3    33.3     0/0   0.0
Austin Smith           13    3    1    1   0   1/1   100.0     0/0   0.0
Tobias Herro           12    3    0    1   0   1/2    50.0     0/0   0.0
Ja Mitchell            23    2    0    2   0   1/3    33.3     0/0   0.0
Jordan Mitchell        24    0    0    1   0   0/0     0.0     0/0   0.0
Devin Cunningham       13    0    1    3   0   0/0     0.0     0/0   0.0
Ja Simmons             12    0    1    0   0   0/0     0.0     0/0   0.0

TEAM: FG: 10/19 (52.6%), 3PT: 6/10 (60.0%), REB: 11 (1 off, 10 def), AST: 9, TO: 5
TEAM FOULS: 6 [Team_008 in BONUS]

================================================================================

================================================================================
                       4TH QUARTER - Team_008 vs Team_064                       
================================================================================

[12:00] Substitution (Team_008): Victor Leonard OUT (stamina: 80) → Blake Holiday IN (comeback_detected)

[12:00] Substitution (Team_064): Ja Mitchell OUT (stamina: 80) → CJ Haliburton IN (comeback_detected)

[12:00] Team_008 possession (Score: 70-98)
Blake Holiday attempts a Layup. Contested by Russell Simons (3.4 feet, ZONE). BLAKE HOLIDAY MAKES IT! Assist: Tyrese Thompson
Score: 72-98

[11:48] Team_064 possession (Score: 72-98)
FOUL! Reach-in foul on Tyrese Thompson during the drive. [Team fouls: 1] No free throws, side out. (Tyrese Thompson: 1 personal fouls)

[11:32] Team_064 possession (Score: 72-98)
Kawhi Irving attempts a Midrange. Contested by Khris Hyland (4.0 feet, MAN). KAWHI IRVING MAKES IT! Assist: Jordan Mitchell
Score: 72-100

[11:17] Team_008 possession (Score: 72-100)
Khris Hyland attempts a 3Pt. Contested by Russell Simons (3.4 feet, ZONE). Khris Hyland misses. Rebound secured by Shai Hyland.

[11:06] Team_064 possession (Score: 72-100)
Shai Hyland attempts a Midrange. Contested by Magic Young (5.3 feet, MAN). SHAI HYLAND MAKES IT! Assist: CJ Haliburton
Score: 72-102

[10:51] Team_008 possession (Score: 72-102)
Tyrese Thompson attempts a 3Pt. Contested by Russell Simons (3.5 feet, MAN). Tyrese Thompson misses. Offensive rebound by Tyrese Thompson! Tyrese Thompson kicks it out.

[10:38] Team_008 possession (Score: 72-102)
Blake Holiday attempts a Layup. Wide open! CJ Haliburton is 6.2 feet away. [MAN] Blake Holiday misses. Rebound secured by Russell Simons.

[10:27] Team_064 possession (Score: 72-102)
FOUL! Reach-in foul on Blake Holiday during the drive. [Team fouls: 2] No free throws, side out. (Blake Holiday: 1 personal fouls)

[10:11] Team_064 possession (Score: 72-102)
Jordan Mitchell attempts a 3Pt. Contested by Jrue Harris (4.0 feet, MAN). Jordan Mitchell misses. Rebound secured by Tyrese Thompson.

[10:00] Team_008 possession (Score: 72-102)
Tyrese Thompson attempts a Layup. Contested by Russell Simons (3.6 feet, ZONE). TYRESE THOMPSON MAKES IT! Assist: Khris Hyland
Score: 74-102

[09:48] Team_064 possession (Score: 74-102)
CJ Haliburton attempts a 3Pt. Contested by Blake Holiday (5.7 feet, MAN). CJ HALIBURTON MAKES IT! Assist: Shai Hyland
Score: 74-105

[09:34] Team_008 possession (Score: 74-105)
Jrue Harris attempts a Layup. Contested by Russell Simons (3.6 feet, ZONE). JRUE HARRIS MAKES IT! Assist: Blake Holiday
Score: 76-105

[09:17] Team_064 possession (Score: 76-105)
Jordan Mitchell drives and kicks out. Russell Simons attempts a Midrange. Contested by Blake Holiday (5.4 feet, ZONE). Russell Simons misses. Offensive rebound by Kawhi Irving! Kawhi Irving kicks it out.

[09:02] Team_064 possession (Score: 76-105)
Shai Hyland drives to the basket... Shai Hyland throws a bad pass! Stolen by Magic Young! TURNOVER! (live ball)

[08:48] Team_008 possession (Score: 76-105)
Khris Hyland attempts a Midrange. Contested by Jordan Mitchell (4.3 feet, ZONE). Khris Hyland misses. FOUL! Loose ball foul on Shai Hyland during the rebound battle. [Team fouls: 1] No free throws, side out. (Shai Hyland: 1 personal fouls)

[08:31] Team_008 possession (Score: 76-105)
Jrue Harris attempts a Midrange. Contested by Jordan Mitchell (4.4 feet, ZONE). Jrue Harris misses. Offensive rebound by Magic Young! Magic Young kicks it out.

[08:16] Team_008 possession (Score: 76-105)
Jrue Harris attempts a 3Pt. Contested by Jordan Mitchell (4.4 feet, MAN). Jrue Harris misses. Rebound secured by Shai Hyland.

[08:03] Team_064 possession (Score: 76-105)
Jordan Mitchell attempts a Layup. BLOCKED BY TYRESE THOMPSON! Ball goes out off Tyrese Thompson. Jordan Mitchell's ball!

[07:49] Team_064 possession (Score: 76-105)
Jordan Mitchell throws a bad pass out of bounds! TURNOVER! (dead ball)

[07:49] Substitution (Team_008): Jrue Harris OUT → Chris Griffin IN (stamina_rule2)

[07:49] Substitution (Team_008): Khris Hyland OUT → Immanuel Young IN (stamina_rule2)

[07:49] Substitution (Team_008): Tyrese Thompson OUT → Khris Giddey IN (stamina_rule2)

[07:49] Substitution (Team_008): Magic Young OUT → Lamelo Middleton IN (stamina_rule2)

[07:49] Substitution (Team_064): Jordan Mitchell OUT → Ja Simmons IN (stamina_rule2)

[07:49] Substitution (Team_064): Kawhi Irving OUT → Tobias Herro IN (stamina_rule2)

[07:49] Substitution (Team_064): Russell Simons OUT → Austin Smith IN (stamina_rule2)

[07:49] Substitution (Team_064): Shai Hyland OUT → Devin Cunningham IN (stamina_rule2)

[07:39] Team_008 possession (Score: 76-105)
Lamelo Middleton drives to the basket... Lamelo Middleton commits a violation (traveling/carry)! TURNOVER! (dead ball)

[07:25] Team_064 possession (Score: 76-105)
Devin Cunningham makes the Layup and draws the foul on Chris Griffin! And-1! Devin Cunningham to the line for 1. [Team fouls: 3] (Chris Griffin: 1 personal fouls)   FT 1/1: GOOD Devin Cunningham makes 1/1 from the line.
Score: 76-108

[07:13] Team_008 possession (Score: 76-108)
Blake Holiday drives and kicks out. Khris Giddey attempts a 3Pt. Contested by Austin Smith (4.6 feet, MAN). Khris Giddey misses. Rebound secured by Ja Simmons.

[06:56] Team_064 possession (Score: 76-108)
FOUL! Reach-in foul on Lamelo Middleton during the drive. [Team fouls: 4] No free throws, side out. (Lamelo Middleton: 1 personal fouls)

[06:42] Team_064 possession (Score: 76-108)
Ja Simmons attempts a 3Pt. Contested by Blake Holiday (5.3 feet, ZONE). Ja Simmons misses. Rebound secured by Lamelo Middleton.

[06:27] Team_008 possession (Score: 76-108)
Immanuel Young attempts a 3Pt. Wide open! Tobias Herro is 6.5 feet away. [MAN] Immanuel Young misses. Rebound secured by Devin Cunningham.

[06:10] Team_064 possession (Score: 76-108)
Devin Cunningham drives, picks up Lamelo Middleton. Help arrives from Chris Griffin! Devin Cunningham attempts a Dunk. Contested by Chris Griffin (4.1 feet, MAN). Devin Cunningham misses. Offensive rebound by Ja Simmons! Ja Simmons kicks it out.

[05:54] Team_064 possession (Score: 76-108)
CJ Haliburton attempts a Midrange. Contested by Blake Holiday (5.8 feet, MAN). CJ Haliburton misses. Rebound secured by Khris Giddey.

[05:38] Team_008 possession (Score: 76-108)
Immanuel Young drives, Tobias Herro stays with him. Immanuel Young attempts a Dunk. Wide open! Tobias Herro is 6.5 feet away. [MAN] Immanuel Young misses. Rebound secured by Ja Simmons.

[05:24] Team_064 possession (Score: 76-108)
Tobias Herro attempts a 3Pt. Contested by Immanuel Young (3.8 feet, MAN). Tobias Herro misses. Rebound secured by Khris Giddey.

[05:06] Team_008 possession (Score: 76-108)
FOUL! Offensive foul on Lamelo Middleton! Devin Cunningham drew the charge! [Team fouls: 5] (Lamelo Middleton: 2 personal fouls) TURNOVER! (dead ball)

[04:51] Team_064 possession (Score: 76-108)
Devin Cunningham commits a violation (traveling/carry)! TURNOVER! (dead ball)

[04:37] Team_008 possession (Score: 76-108)
Immanuel Young throws a bad pass out of bounds! TURNOVER! (dead ball)

[04:22] Team_064 possession (Score: 76-108)
CJ Haliburton makes the Layup and draws the foul on Chris Griffin! And-1! CJ Haliburton to the line for 1. [BONUS: 6 team fouls] (Chris Griffin: 2 personal fouls)   FT 1/1: MISS CJ Haliburton makes 0/1 from the line. Rebound secured by Lamelo Middleton.
Score: 76-110

[04:09] Team_008 possession (Score: 76-110)
Lamelo Middleton drives to the basket... FOUL! Offensive foul on Lamelo Middleton! Austin Smith drew the charge! [Team fouls: 7] (Lamelo Middleton: 3 personal fouls) TURNOVER! (dead ball)

[03:59] Team_064 possession (Score: 76-110)
Austin Smith makes the Midrange and draws the foul on Khris Giddey! And-1! Austin Smith to the line for 1. [BONUS: 8 team fouls] (Khris Giddey: 1 personal fouls)   FT 1/1: GOOD Austin Smith makes 1/1 from the line.
Score: 76-113

[03:46] Team_008 possession (Score: 76-113)
Immanuel Young attempts a 3Pt. Wide open! Tobias Herro is 6.5 feet away. [ZONE] Immanuel Young misses. Rebound secured by Devin Cunningham.

[03:32] Team_064 possession (Score: 76-113)
FOUL! Shooting foul on Lamelo Middleton. Devin Cunningham to the line for 2 free throws. [BONUS: 9 team fouls] (Lamelo Middleton: 4 personal fouls)   FT 1/2: MISS   FT 2/2: GOOD Devin Cunningham makes 1/2 from the line.
Score: 76-114

[03:14] Team_008 possession (Score: 76-114)
Khris Giddey makes the Dunk and draws the foul on Austin Smith! And-1! Khris Giddey to the line for 1. [Team fouls: 2] (Austin Smith: 1 personal fouls)   FT 1/1: GOOD Khris Giddey makes 1/1 from the line.
Score: 79-114

[02:57] Team_064 possession (Score: 79-114)
Austin Smith drives and kicks out. Austin Smith attempts a 3Pt. Contested by Khris Giddey (4.3 feet, MAN). Austin Smith misses. Offensive rebound by Austin Smith! Austin Smith kicks it out.

[02:45] Team_064 possession (Score: 79-114)
FOUL! Shooting foul on Chris Griffin. Austin Smith to the line for 2 free throws. [BONUS: 10 team fouls] (Chris Griffin: 3 personal fouls)   FT 1/2: MISS   FT 2/2: GOOD Austin Smith makes 1/2 from the line.
Score: 79-115

[02:28] Team_008 possession (Score: 79-115)
Blake Holiday attempts a Midrange. Wide open! CJ Haliburton is 6.6 feet away. [MAN] Blake Holiday misses. Offensive rebound by Khris Giddey! Khris Giddey kicks it out.

[02:11] Team_008 possession (Score: 79-115)
Lamelo Middleton attempts a Layup. Contested by Austin Smith (4.9 feet, ZONE). LAMELO MIDDLETON MAKES IT! Assist: Khris Giddey
Score: 81-115

[01:52] Team_064 possession (Score: 81-115)
Austin Smith loses control! Ball rolls out of bounds! TURNOVER! (dead ball)

[01:52] Substitution (Team_008): Blake Holiday OUT → Victor Leonard IN (starter_return_rule1)

[01:52] Substitution (Team_064): CJ Haliburton OUT → Ja Mitchell IN (starter_return_rule1)

[01:38] Team_008 possession (Score: 81-115)
Victor Leonard drives to the basket... Victor Leonard commits a violation (traveling/carry)! TURNOVER! (dead ball)

[01:24] Team_064 possession (Score: 81-115)
Devin Cunningham attempts a 3Pt. Contested by Khris Giddey (4.1 feet, ZONE). DEVIN CUNNINGHAM MAKES IT! Assist: Ja Simmons
Score: 81-118

[01:08] Team_008 possession (Score: 81-118)
Immanuel Young attempts a Layup. Contested by Austin Smith (5.1 feet, ZONE). Immanuel Young misses. Rebound secured by Devin Cunningham.

[00:53] Team_064 possession (Score: 81-118)
Ja Simmons attempts a Layup. BLOCKED BY CHRIS GRIFFIN! Ball is loose! Rebound secured by Khris Giddey.

[00:35] Team_008 possession (Score: 81-118)
Victor Leonard attempts a 3Pt. Contested by Ja Mitchell (5.5 feet, ZONE). Victor Leonard misses. Rebound secured by Austin Smith.

[00:24] Team_064 possession (Score: 81-118)
Devin Cunningham attempts a Layup. BLOCKED BY LAMELO MIDDLETON! Ball is loose! Offensive rebound by Austin Smith! Austin Smith kicks it out.

[00:08] Team_064 possession (Score: 81-118)
Ja Mitchell attempts a Midrange. Contested by Lamelo Middleton (4.8 feet, ZONE). Ja Mitchell misses. Rebound secured by Lamelo Middleton.

================================================================================
                              4TH QUARTER COMPLETE                              
================================================================================

4TH QUARTER SCORE: Team_008 11, Team_064 20

BOX SCORE:
================================================================================

Team_008
--------------------------------------------------------------------------------
Player                MIN  PTS  REB  AST  TO      FG   FG%      3P   3P%
--------------------------------------------------------------------------------
Khris Giddey           21    3    4    1   0   1/1   100.0     0/0   0.0
Blake Holiday          24    2    0    1   0   1/3    33.3     0/0   0.0
Tyrese Thompson        27    2    3    1   0   1/1   100.0     0/0   0.0
Jrue Harris            28    2    0    0   0   1/2    50.0     0/0   0.0
Lamelo Middleton       21    2    3    0   0   1/1   100.0     0/0   0.0
Khris Hyland           28    0    0    1   0   0/1     0.0     0/0   0.0
Magic Young            27    0    1    0   0   0/0     0.0     0/0   0.0
Immanuel Young         20    0    0    0   0   0/4     0.0     0/0   0.0
Victor Leonard         25    0    0    0   0   0/1     0.0     0/0   0.0

TEAM: FG: 5/14 (35.7%), 3PT: 0/5 (0.0%), REB: 11 (4 off, 7 def), AST: 4, TO: 5
TEAM FOULS: 11 [Team_064 in BONUS]


Team_064
--------------------------------------------------------------------------------
Player                MIN  PTS  REB  AST  TO      FG   FG%      3P   3P%
--------------------------------------------------------------------------------
Devin Cunningham       21    7    3    0   0   3/3   100.0     0/0   0.0
Austin Smith           21    4    3    0   0   2/2   100.0     0/0   0.0
CJ Haliburton          24    3    0    1   0   1/3    33.3     0/0   0.0
Kawhi Irving           28    2    1    0   0   1/1   100.0     0/0   0.0
Shai Hyland            27    2    2    1   0   1/1   100.0     0/0   0.0
Jordan Mitchell        28    0    0    1   0   0/1     0.0     0/0   0.0
Russell Simons         27    0    1    0   0   0/0     0.0     0/0   0.0
Ja Simmons             20    0    3    1   0   0/2     0.0     0/0   0.0
Tobias Herro           20    0    0    0   0   0/1     0.0     0/0   0.0
Ja Mitchell            25    0    0    0   0   0/1     0.0     0/0   0.0

TEAM: FG: 8/15 (53.3%), 3PT: 2/5 (40.0%), REB: 13 (4 off, 9 def), AST: 4, TO: 4
TEAM FOULS: 2

================================================================================

================================================================================
                               FULL GAME COMPLETE                               
================================================================================

FINAL SCORE: Team_008 81, Team_064 118

SCORING BY QUARTER:
--------------------------------------------------------------------------------
Team                     Q1     Q2     Q3     Q4    FINAL
--------------------------------------------------------------------------------
Team_008                 15     26     29     11       81
Team_064                 30     40     28     20      118
--------------------------------------------------------------------------------

FULL GAME BOX SCORE:
================================================================================

Team_008
--------------------------------------------------------------------------------
Player                MIN  PTS  REB  AST  TO      FG   FG%      3P   3P%      FT STL BLK
--------------------------------------------------------------------------------
Jrue Harris            28    4    0    2   2   1/5    20.0   0/2     0.0   2/2     0   0
Khris Hyland           28    4    0    3   1   2/9    22.2   1/3    33.3   1/2     0   0
Tyrese Thompson        27    4   10    2   0   3/7    42.9   0/1     0.0   0/0     0   1
Magic Young            27   19   12    1   0   8/13   61.5   0/1     0.0   5/8     1   0
Victor Leonard         25   12    0    2   0   5/10   50.0   0/2     0.0   2/3     1   0
Blake Holiday          24    9    0    1   1   3/5    60.0   0/0     0.0   1/1     0   0
Khris Giddey           21    3    6    2   3   2/4    50.0   0/0     0.0   1/1     0   0
Lamelo Middleton       21    6    7    3   2   3/7    42.9   0/2     0.0   0/0     0   1
Chris Griffin          20   13    0    1   0   5/8    62.5   3/5    60.0   0/0     0   1
Immanuel Young         20    2    0    2   3   1/5    20.0   0/2     0.0   0/0     1   0

TEAM: FG: 34/74 (45.9%), 3PT: 4/18 (22.2%), REB: 35 (9 off, 26 def), AST: 19, TO: 12


Team_064
--------------------------------------------------------------------------------
Player                MIN  PTS  REB  AST  TO      FG   FG%      3P   3P%      FT STL BLK
--------------------------------------------------------------------------------
Jordan Mitchell        28    0    0    4   2   1/5    20.0   0/2     0.0   0/0     0   0
Kawhi Irving           28   25   11    1   4  10/15   66.7   6/8    75.0   1/3     1   0
Russell Simons         27    8   11    2   1   4/7    57.1   1/2    50.0   1/1     1   1
Shai Hyland            27   13   12    2   1   5/6    83.3   0/0     0.0   3/4     0   0
Ja Mitchell            25    7    0    4   2   2/5    40.0   0/2     0.0   0/1     0   0
CJ Haliburton          24   17    0    7   1   4/7    57.1   4/4   100.0   0/1     0   0
Austin Smith           21   16    7    1   1   6/8    75.0   1/2    50.0   5/6     0   0
Devin Cunningham       21   14    5    3   1   6/7    85.7   1/2    50.0   2/3     0   0
Ja Simmons             20    6    8    1   1   2/4    50.0   0/1     0.0   2/2     0   0
Tobias Herro           20    6    0    4   1   3/5    60.0   2/3    66.7   0/0     0   0

TEAM: FG: 45/71 (63.4%), 3PT: 15/26 (57.7%), REB: 54 (15 off, 39 def), AST: 29, TO: 15

================================================================================
