================================================================================
                        FULL GAME - Team_049 vs Team_092                        
================================================================================

================================================================================
                       1ST QUARTER - Team_049 vs Team_092                       
================================================================================

[12:00] Team_049 possession (Score: 0-0)
Jimmy Griffin attempts a 3Pt. Contested by John Giddey (4.1 feet, ZONE). Jimmy Griffin misses. Rebound secured by Paul James.

[11:41] Team_092 possession (Score: 0-0)
Karl Gobert drives, Ja Oladipo stays with him. Karl Gobert attempts a Layup. Contested by Ja Oladipo (4.1 feet, MAN). Karl Gobert misses. Rebound secured by Shai Mobley.

[11:27] Team_049 possession (Score: 0-0)
FOUL! Offensive foul on Shai Mobley! Immanuel Ingram drew the charge! [Team fouls: 1] (Shai Mobley: 1 personal fouls) TURNOVER! (dead ball)

[11:15] Team_092 possession (Score: 0-0)
Paul James attempts a 3Pt. Contested by Ja Oladipo (4.9 feet, ZONE). Paul James misses. Rebound secured by Jimmy Griffin.

[10:59] Team_049 possession (Score: 0-0)
De'Aaron Allen attempts a 3Pt. Contested by John Giddey (3.9 feet, MAN). De'Aaron Allen misses. Offensive rebound by Shai Mobley! Shai Mobley puts it back in!
Score: 2-0

[10:49] Team_092 possession (Score: 2-0)
Paul James loses control! Ball rolls out of bounds! TURNOVER! (dead ball)

[10:36] Team_049 possession (Score: 2-0)
Jimmy Griffin makes the Layup and draws the foul on Paul James! And-1! Jimmy Griffin to the line for 1. [Team fouls: 1] (Paul James: 1 personal fouls)   FT 1/1: GOOD Jimmy Griffin makes 1/1 from the line.
Score: 5-0

[10:23] Team_092 possession (Score: 5-0)
Austin Bridges attempts a 3Pt. Contested by Shai Bird (3.7 feet, MAN). Austin Bridges misses. Rebound secured by Jimmy Griffin.

[10:08] Team_049 possession (Score: 5-0)
Ja Oladipo attempts a Midrange. Contested by Austin Bridges (4.6 feet, ZONE). Ja Oladipo misses. Offensive rebound by Jimmy Griffin! Jimmy Griffin kicks it out.

[09:56] Team_049 possession (Score: 5-0)
De'Aaron Allen attempts a Layup. BLOCKED BY JOHN GIDDEY! Ball is loose! Rebound secured by Immanuel Ingram.

[09:38] Team_092 possession (Score: 5-0)
Paul James attempts a Layup. Contested by Jimmy Griffin (5.3 feet, MAN). Paul James misses. Rebound secured by De'Aaron Allen.

[09:24] Team_049 possession (Score: 5-0)
Shai Bird makes the Dunk and draws the foul on Paul James! And-1! Shai Bird to the line for 1. [Team fouls: 2] (Paul James: 2 personal fouls)   FT 1/1: GOOD Shai Bird makes 1/1 from the line.
Score: 8-0

[09:09] Team_092 possession (Score: 8-0)
Austin Bridges attempts a Midrange. Contested by Shai Bird (3.7 feet, MAN). AUSTIN BRIDGES MAKES IT!
Score: 8-2

[08:54] Team_049 possession (Score: 8-2)
Shai Mobley attempts a Layup. BLOCKED BY JOHN GIDDEY! Ball is loose! Offensive rebound by Jimmy Griffin! Jimmy Griffin kicks it out.

[08:39] Team_049 possession (Score: 8-2)
Shai Mobley attempts a 3Pt. Contested by John Giddey (4.3 feet, ZONE). SHAI MOBLEY MAKES IT! Assist: De'Aaron Allen
Score: 11-2

[08:27] Team_092 possession (Score: 11-2)
Karl Gobert attempts a Midrange. Contested by Ja Oladipo (4.1 feet, MAN). KARL GOBERT MAKES IT! Assist: Austin Bridges
Score: 11-4

[08:15] Team_049 possession (Score: 11-4)
De'Aaron Allen attempts a 3Pt. Contested by John Giddey (3.9 feet, ZONE). De'Aaron Allen misses. Rebound secured by John Giddey.

[08:00] Team_092 possession (Score: 11-4)
John Giddey drives, De'Aaron Allen stays with him. John Giddey attempts a Dunk. Contested by De'Aaron Allen (4.5 feet, ZONE). JOHN GIDDEY MAKES IT! Assist: Karl Gobert
Score: 11-6

[07:46] Team_049 possession (Score: 11-6)
De'Aaron Allen attempts a Midrange. Contested by Paul James (4.6 feet, ZONE). De'Aaron Allen misses. Rebound secured by Paul James.

[07:28] Team_092 possession (Score: 11-6)
Karl Gobert drives and kicks out. Immanuel Ingram attempts a 3Pt. Contested by Ja Oladipo (4.2 feet, ZONE). Immanuel Ingram misses. Rebound secured by Jimmy Griffin.

[07:11] Team_049 possession (Score: 11-6)
Ja Oladipo attempts a Midrange. Contested by Karl Gobert (5.3 feet, MAN). JA OLADIPO MAKES IT!
Score: 13-6

[06:58] Team_092 possession (Score: 13-6)
John Giddey makes the Layup and draws the foul on De'Aaron Allen! And-1! John Giddey to the line for 1. [Team fouls: 2] (De'Aaron Allen: 1 personal fouls)   FT 1/1: GOOD John Giddey makes 1/1 from the line.
Score: 13-9

[06:44] Team_049 possession (Score: 13-9)
Shai Mobley drives and kicks out. Shai Bird attempts a 3Pt. Contested by Austin Bridges (4.4 feet, MAN). Shai Bird misses. Rebound secured by Paul James.

[06:33] Team_092 possession (Score: 13-9)
John Giddey drives, De'Aaron Allen stays with him. John Giddey attempts a Dunk. Contested by De'Aaron Allen (4.5 feet, MAN). John Giddey misses. Offensive rebound by John Giddey! John Giddey kicks it out.

[06:18] Team_092 possession (Score: 13-9)
John Giddey throws a bad pass! Stolen by De'Aaron Allen! TURNOVER! (live ball)

[06:04] Team_049 possession (Score: 13-9)
Jimmy Griffin attempts a 3Pt. Contested by John Giddey (4.1 feet, ZONE). Jimmy Griffin misses. Offensive rebound by Shai Mobley! Shai Mobley puts it back in!
Score: 15-9

[05:46] Team_092 possession (Score: 15-9)
John Giddey attempts a Layup. Contested by De'Aaron Allen (4.5 feet, MAN). John Giddey misses. Rebound secured by Jimmy Griffin.

[05:30] Team_049 possession (Score: 15-9)
De'Aaron Allen attempts a Midrange. Contested by John Giddey (3.9 feet, MAN). DE'AARON ALLEN MAKES IT!
Score: 17-9

[05:14] Team_092 possession (Score: 17-9)
Austin Bridges attempts a 3Pt. Contested by Shai Bird (3.7 feet, MAN). Austin Bridges misses. Offensive rebound by John Giddey! John Giddey kicks it out.

[04:59] Team_092 possession (Score: 17-9)
Paul James drives, Jimmy Griffin stays with him. Paul James attempts a Dunk. Contested by Jimmy Griffin (5.4 feet, MAN). Paul James misses. Rebound secured by Shai Mobley.

[04:45] Team_049 possession (Score: 17-9)
Shai Bird attempts a 3Pt. Contested by Karl Gobert (5.5 feet, ZONE). Shai Bird misses. Rebound secured by Paul James.

[04:28] Team_092 possession (Score: 17-9)
John Giddey attempts a Midrange. Contested by De'Aaron Allen (4.6 feet, ZONE). John Giddey misses. Rebound secured by Shai Mobley.

[04:09] Team_049 possession (Score: 17-9)
FOUL! Shooting foul on Austin Bridges. Ja Oladipo to the line for 2 free throws. [Team fouls: 3] (Austin Bridges: 1 personal fouls)   FT 1/2: GOOD   FT 2/2: MISS Ja Oladipo makes 1/2 from the line. Rebound secured by Immanuel Ingram.
Score: 18-9

[03:58] Team_092 possession (Score: 18-9)
Paul James throws a bad pass out of bounds! TURNOVER! (dead ball)

[03:43] Team_049 possession (Score: 18-9)
FOUL! Reach-in foul on John Giddey during the drive. [Team fouls: 4] No free throws, side out. (John Giddey: 1 personal fouls)

[03:24] Team_049 possession (Score: 18-9)
Shai Bird attempts a 3Pt. Contested by Karl Gobert (5.6 feet, ZONE). Shai Bird misses. Rebound secured by John Giddey.

[03:10] Team_092 possession (Score: 18-9)
Paul James drives and kicks out. Karl Gobert attempts a Midrange. Contested by Ja Oladipo (4.4 feet, ZONE). KARL GOBERT MAKES IT!
Score: 18-11

[03:00] Team_049 possession (Score: 18-11)
De'Aaron Allen attempts a Layup. Contested by John Giddey (4.1 feet, MAN). DE'AARON ALLEN MAKES IT!
Score: 20-11

[02:49] Team_092 possession (Score: 20-11)
Karl Gobert drives, Ja Oladipo stays with him. Karl Gobert attempts a Layup. Contested by Ja Oladipo (4.3 feet, MAN). Karl Gobert misses. Offensive rebound by Paul James! Paul James kicks it out.

[02:37] Team_092 possession (Score: 20-11)
John Giddey attempts a Midrange. Contested by Jimmy Griffin (5.1 feet, ZONE). John Giddey misses. Rebound secured by Jimmy Griffin.

[02:20] Team_049 possession (Score: 20-11)
FOUL! Shooting foul on Karl Gobert. Ja Oladipo to the line for 2 free throws. [BONUS: 5 team fouls] (Karl Gobert: 1 personal fouls)   FT 1/2: GOOD   FT 2/2: GOOD Ja Oladipo makes 2/2 from the line.
Score: 22-11

[02:05] Team_092 possession (Score: 22-11)
Karl Gobert attempts a 3Pt. Contested by Ja Oladipo (4.4 feet, MAN). KARL GOBERT MAKES IT! Assist: Austin Bridges
Score: 22-14

[01:49] Team_049 possession (Score: 22-14)
Ja Oladipo attempts a 3Pt. Contested by Karl Gobert (5.5 feet, MAN). JA OLADIPO MAKES IT! Assist: Jimmy Griffin
Score: 25-14

[01:38] Team_092 possession (Score: 25-14)
Immanuel Ingram attempts a Layup. Contested by De'Aaron Allen (4.4 feet, ZONE). Immanuel Ingram misses. Rebound secured by Shai Mobley.

[01:24] Team_049 possession (Score: 25-14)
Shai Bird attempts a 3Pt. Contested by Austin Bridges (5.3 feet, MAN). SHAI BIRD MAKES IT! Assist: Ja Oladipo
Score: 28-14

[01:09] Team_092 possession (Score: 28-14)
Immanuel Ingram attempts a Layup. Contested by De'Aaron Allen (4.5 feet, ZONE). IMMANUEL INGRAM MAKES IT!
Score: 28-16

[00:57] Team_049 possession (Score: 28-16)
Jimmy Griffin drives, picks up Paul James. Help arrives from Austin Bridges! Jimmy Griffin attempts a Layup. Contested by Austin Bridges (5.1 feet, MAN). Jimmy Griffin misses. Offensive rebound by Shai Mobley! Shai Mobley's putback is no good. Rebound secured by Immanuel Ingram.

[00:40] Team_092 possession (Score: 28-16)
Austin Bridges attempts a 3Pt. Contested by Ja Oladipo (4.5 feet, ZONE). AUSTIN BRIDGES MAKES IT!
Score: 28-19

[00:26] Team_049 possession (Score: 28-19)
Shai Bird attempts a 3Pt. Contested by Austin Bridges (5.4 feet, MAN). SHAI BIRD MAKES IT! Assist: Jimmy Griffin
Score: 31-19

[00:10] Team_092 possession (Score: 31-19)
Austin Bridges attempts a 3Pt. Contested by Ja Oladipo (4.5 feet, ZONE). Austin Bridges misses. Offensive rebound by Paul James! Paul James kicks it out.

================================================================================
                              1ST QUARTER COMPLETE                              
================================================================================

1ST QUARTER SCORE: Team_049 31, Team_092 19

BOX SCORE:
================================================================================

Team_049
--------------------------------------------------------------------------------
Player                MIN  PTS  REB  AST  TO      FG   FG%      3P   3P%
--------------------------------------------------------------------------------
Shai Bird              12    9    0    0   0   3/5    60.0     0/0   0.0
Shai Mobley            12    7    6    0   0   3/4    75.0     0/0   0.0
Ja Oladipo             12    7    0    1   0   3/4    75.0     0/0   0.0
De'Aaron Allen         12    4    1    1   0   2/5    40.0     0/0   0.0
Jimmy Griffin          12    3    7    2   0   1/3    33.3     0/0   0.0
Immanuel Ingram        12    2    3    0   0   1/2    50.0     0/0   0.0

TEAM: FG: 12/21 (57.1%), 3PT: 6/10 (60.0%), REB: 15 (5 off, 10 def), AST: 4, TO: 1
TEAM FOULS: 2


Team_092
--------------------------------------------------------------------------------
Player                MIN  PTS  REB  AST  TO      FG   FG%      3P   3P%
--------------------------------------------------------------------------------
Karl Gobert            12    7    0    1   0   3/5    60.0     0/0   0.0
Austin Bridges         12    5    0    2   0   2/3    66.7     0/0   0.0
John Giddey            12    5    4    0   0   2/5    40.0     0/0   0.0
Paul James             12    0    6    0   0   0/3     0.0     0/0   0.0

TEAM: FG: 8/18 (44.4%), 3PT: 2/4 (50.0%), REB: 12 (4 off, 8 def), AST: 3, TO: 3
TEAM FOULS: 5 [Team_049 in BONUS]

================================================================================

================================================================================
                       2ND QUARTER - Team_049 vs Team_092                       
================================================================================

[12:00] Team_049 possession (Score: 31-19)
Jimmy Griffin drives and kicks out. FOUL! Shooting foul on Paul James. Jimmy Griffin to the line for 2 free throws. [Team fouls: 1] (Paul James: 1 personal fouls)   FT 1/2: MISS   FT 2/2: MISS Jimmy Griffin makes 0/2 from the line. Rebound secured by Paul James.

[11:44] Team_092 possession (Score: 31-19)
Immanuel Ingram attempts a Midrange. Contested by Shai Mobley (4.4 feet, MAN). Immanuel Ingram misses. Rebound secured by De'Aaron Allen.

[11:29] Team_049 possession (Score: 31-19)
FOUL! Reach-in foul on John Giddey during the drive. [Team fouls: 2] No free throws, side out. (John Giddey: 1 personal fouls)

[11:14] Team_049 possession (Score: 31-19)
FOUL! Holding foul on Immanuel Ingram. [Team fouls: 3] No free throws, side out. (Immanuel Ingram: 1 personal fouls)

[10:58] Team_049 possession (Score: 31-19)
De'Aaron Allen drives, picks up John Giddey. Help arrives from Austin Bridges! De'Aaron Allen attempts a Layup. Contested by Austin Bridges (4.3 feet, MAN). De'Aaron Allen misses. Rebound secured by Paul James.

[10:43] Team_092 possession (Score: 31-19)
Paul James attempts a 3Pt. Contested by Jimmy Griffin (5.7 feet, MAN). Paul James misses. Rebound secured by De'Aaron Allen.

[10:28] Team_049 possession (Score: 31-19)
FOUL! Reach-in foul on Immanuel Ingram during the drive. [Team fouls: 4] No free throws, side out. (Immanuel Ingram: 2 personal fouls)

[10:16] Team_049 possession (Score: 31-19)
Shai Mobley drives and kicks out. Ja Oladipo attempts a Midrange. Contested by Paul James (5.2 feet, ZONE). JA OLADIPO MAKES IT! Assist: Shai Mobley
Score: 33-19

[10:05] Team_092 possession (Score: 33-19)
Paul James makes the 3Pt and draws the foul on Jimmy Griffin! And-1! Paul James to the line for 1. [Team fouls: 1] (Jimmy Griffin: 1 personal fouls)   FT 1/1: GOOD Paul James makes 1/1 from the line.
Score: 33-23

[09:52] Team_049 possession (Score: 33-23)
Jimmy Griffin drives to the basket... Jimmy Griffin throws a bad pass out of bounds! TURNOVER! (dead ball)

[09:52] Substitution (Team_049): Shai Bird OUT → Shaquille Lillard IN (stamina_rule2)

[09:52] Substitution (Team_049): Ja Oladipo OUT → Shai Jordan IN (stamina_rule2)

[09:52] Substitution (Team_049): Jimmy Griffin OUT → Desmond Towns IN (stamina_rule2)

[09:52] Substitution (Team_049): De'Aaron Allen OUT → Giannis Anunoby IN (stamina_rule2)

[09:52] Substitution (Team_049): Shai Mobley OUT → Miles Jackson IN (stamina_rule2)

[09:52] Substitution (Team_092): Austin Bridges OUT → Bones Giddey IN (stamina_rule2)

[09:52] Substitution (Team_092): Karl Gobert OUT → Shaquille Russell IN (stamina_rule2)

[09:52] Substitution (Team_092): Paul James OUT → Vince Harris IN (stamina_rule2)

[09:52] Substitution (Team_092): John Giddey OUT → Shaquille Paul IN (stamina_rule2)

[09:52] Substitution (Team_092): Immanuel Ingram OUT → Pau Reaves IN (stamina_rule2)

[09:34] Team_092 possession (Score: 33-23)
Pau Reaves attempts a Layup. BLOCKED BY SHAI JORDAN! Ball is loose! Rebound secured by Miles Jackson.

[09:19] Team_049 possession (Score: 33-23)
Giannis Anunoby attempts a Midrange. Contested by Shaquille Paul (5.6 feet, MAN). Giannis Anunoby misses. Rebound secured by Shaquille Russell.

[09:06] Team_092 possession (Score: 33-23)
Shaquille Russell drives and kicks out. Shaquille Russell attempts a Midrange. Contested by Giannis Anunoby (4.6 feet, ZONE). Shaquille Russell misses. Rebound secured by Giannis Anunoby.

[08:53] Team_049 possession (Score: 33-23)
Shai Jordan attempts a 3Pt. Contested by Vince Harris (4.2 feet, ZONE). Shai Jordan misses. Offensive rebound by Miles Jackson! Miles Jackson puts it back in!
Score: 35-23

[08:41] Team_092 possession (Score: 35-23)
Shaquille Russell loses control! Ball rolls out of bounds! TURNOVER! (dead ball)

[08:26] Team_049 possession (Score: 35-23)
Desmond Towns attempts a 3Pt. Contested by Vince Harris (4.2 feet, MAN). DESMOND TOWNS MAKES IT! Assist: Shaquille Lillard
Score: 38-23

[08:13] Team_092 possession (Score: 38-23)
FOUL! Reach-in foul on Miles Jackson during the drive. [Team fouls: 2] No free throws, side out. (Miles Jackson: 1 personal fouls)

[08:01] Team_092 possession (Score: 38-23)
Pau Reaves attempts a Layup. BLOCKED BY MILES JACKSON! Ball is loose! Rebound secured by Giannis Anunoby.

[07:49] Team_049 possession (Score: 38-23)
Giannis Anunoby attempts a Midrange. Contested by Shaquille Paul (5.6 feet, ZONE). Giannis Anunoby misses. Offensive rebound by Giannis Anunoby! Giannis Anunoby kicks it out.

[07:31] Team_049 possession (Score: 38-23)
Giannis Anunoby attempts a Midrange. Contested by Shaquille Paul (5.6 feet, MAN). Giannis Anunoby misses. Rebound secured by Shaquille Russell.

[07:20] Team_092 possession (Score: 38-23)
Shaquille Russell drives, Miles Jackson stays with him. Shaquille Russell attempts a Dunk. Contested by Miles Jackson (3.8 feet, ZONE). SHAQUILLE RUSSELL MAKES IT! Assist: Pau Reaves
Score: 38-25

[07:10] Team_049 possession (Score: 38-25)
Shaquille Lillard attempts a Layup. Contested by Bones Giddey (5.4 feet, MAN). SHAQUILLE LILLARD MAKES IT! Assist: Giannis Anunoby
Score: 40-25

[06:55] Team_092 possession (Score: 40-25)
Shaquille Russell drives to the basket... Shaquille Russell commits a violation (traveling/carry)! TURNOVER! (dead ball)

[06:41] Team_049 possession (Score: 40-25)
Desmond Towns attempts a Midrange. Contested by Vince Harris (4.2 feet, MAN). DESMOND TOWNS MAKES IT! Assist: Miles Jackson
Score: 42-25

[06:24] Team_092 possession (Score: 42-25)
Vince Harris drives, picks up Miles Jackson. Help arrives from Shai Jordan! Vince Harris attempts a Dunk. Contested by Shai Jordan (3.5 feet, ZONE). Vince Harris misses. Offensive rebound by Shaquille Paul! Shaquille Paul kicks it out.

[06:11] Team_092 possession (Score: 42-25)
Pau Reaves attempts a Layup. Contested by Miles Jackson (3.7 feet, MAN). PAU REAVES MAKES IT! Assist: Bones Giddey
Score: 42-27

[05:57] Team_049 possession (Score: 42-27)
Miles Jackson attempts a 3Pt. Contested by Pau Reaves (4.8 feet, MAN). Miles Jackson misses. Rebound secured by Shaquille Paul.

[05:44] Team_092 possession (Score: 42-27)
FOUL! Reach-in foul on Miles Jackson during the drive. [Team fouls: 3] No free throws, side out. (Miles Jackson: 2 personal fouls)

[05:28] Team_092 possession (Score: 42-27)
Shaquille Paul attempts a 3Pt. Contested by Giannis Anunoby (5.2 feet, MAN). Shaquille Paul misses. Offensive rebound by Pau Reaves! Pau Reaves kicks it out.

[05:11] Team_092 possession (Score: 42-27)
Bones Giddey drives to the basket... Bones Giddey loses control! Ball rolls out of bounds! TURNOVER! (dead ball)

[04:53] Team_049 possession (Score: 42-27)
Shai Jordan attempts a Midrange. Contested by Shaquille Paul (5.6 feet, ZONE). Shai Jordan misses. Rebound secured by Pau Reaves.

[04:40] Team_092 possession (Score: 42-27)
Shaquille Russell drives and kicks out. Vince Harris attempts a 3Pt. Contested by Shaquille Lillard (4.5 feet, ZONE). VINCE HARRIS MAKES IT!
Score: 42-30

[04:26] Team_049 possession (Score: 42-30)
Shai Jordan attempts a 3Pt. Contested by Shaquille Russell (4.2 feet, MAN). Shai Jordan misses. Offensive rebound by Miles Jackson! Miles Jackson puts it back in!
Score: 44-30

[04:11] Team_092 possession (Score: 44-30)
Shaquille Paul attempts a Layup. Contested by Giannis Anunoby (5.2 feet, MAN). SHAQUILLE PAUL MAKES IT! Assist: Pau Reaves
Score: 44-32

[04:01] Team_049 possession (Score: 44-32)
Shaquille Lillard makes the Midrange and draws the foul on Shaquille Paul! And-1! Shaquille Lillard to the line for 1. [BONUS: 5 team fouls] (Shaquille Paul: 1 personal fouls)   FT 1/1: GOOD Shaquille Lillard makes 1/1 from the line.
Score: 47-32

[03:48] Team_092 possession (Score: 47-32)
Pau Reaves drives to the basket... Pau Reaves throws a bad pass! Stolen by Miles Jackson! TURNOVER! (live ball)

[03:31] Team_049 possession (Score: 47-32)
Shai Jordan drives, Shaquille Russell stays with him. Shai Jordan attempts a Layup. Contested by Shaquille Russell (4.2 feet, MAN). Shai Jordan misses. Rebound secured by Shaquille Paul.

[03:16] Team_092 possession (Score: 47-32)
Shaquille Paul drives to the basket... Shaquille Paul commits a violation (traveling/carry)! TURNOVER! (dead ball)

[03:03] Team_049 possession (Score: 47-32)
FOUL! Offensive foul on Shaquille Lillard! Bones Giddey drew the charge! [Team fouls: 4] (Shaquille Lillard: 1 personal fouls) TURNOVER! (dead ball)

[02:46] Team_092 possession (Score: 47-32)
Pau Reaves attempts a Layup. Contested by Miles Jackson (3.8 feet, MAN). PAU REAVES MAKES IT!
Score: 47-34

[02:32] Team_049 possession (Score: 47-34)
Shaquille Lillard drives and kicks out. Desmond Towns attempts a 3Pt. Contested by Vince Harris (4.2 feet, ZONE). Desmond Towns misses. Offensive rebound by Miles Jackson! Miles Jackson's putback is no good. Offensive rebound by Giannis Anunoby! Giannis Anunoby kicks it out.

[02:17] Team_049 possession (Score: 47-34)
FOUL! Shooting foul on Pau Reaves. Desmond Towns to the line for 2 free throws. [BONUS: 6 team fouls] (Pau Reaves: 1 personal fouls)   FT 1/2: GOOD   FT 2/2: GOOD Desmond Towns makes 2/2 from the line.
Score: 49-34

[02:02] Team_092 possession (Score: 49-34)
Pau Reaves attempts a Layup. Contested by Miles Jackson (3.8 feet, ZONE). PAU REAVES MAKES IT! Assist: Shaquille Paul
Score: 49-36

[01:48] Team_049 possession (Score: 49-36)
Shaquille Lillard attempts a 3Pt. Contested by Vince Harris (4.4 feet, ZONE). Shaquille Lillard misses. Rebound secured by Shaquille Paul.

[01:37] Team_092 possession (Score: 49-36)
Shaquille Paul makes the Layup and draws the foul on Giannis Anunoby! And-1! Shaquille Paul to the line for 1. [BONUS: 5 team fouls] (Giannis Anunoby: 1 personal fouls)   FT 1/1: GOOD Shaquille Paul makes 1/1 from the line.
Score: 49-39

[01:21] Team_049 possession (Score: 49-39)
Shai Jordan attempts a Layup. Contested by Pau Reaves (5.0 feet, ZONE). Shai Jordan misses. Offensive rebound by Miles Jackson! Miles Jackson's putback is no good. Rebound secured by Shaquille Russell.

[01:05] Team_092 possession (Score: 49-39)
Bones Giddey drives and kicks out. Pau Reaves attempts a Midrange. Contested by Miles Jackson (3.7 feet, MAN). Pau Reaves misses. Rebound secured by Miles Jackson.

[00:52] Team_049 possession (Score: 49-39)
FOUL! Shooting foul on Bones Giddey. Shai Jordan to the line for 3 free throws. [BONUS: 7 team fouls] (Bones Giddey: 1 personal fouls)   FT 1/3: MISS   FT 2/3: MISS   FT 3/3: GOOD Shai Jordan makes 1/3 from the line.
Score: 50-39

[00:37] Team_092 possession (Score: 50-39)
FOUL! Offensive foul on Pau Reaves! Miles Jackson drew the charge! [Team fouls: 8] (Pau Reaves: 2 personal fouls) TURNOVER! (dead ball)

[00:22] Team_049 possession (Score: 50-39)
Desmond Towns attempts a Layup. BLOCKED BY VINCE HARRIS! Ball is loose! Rebound secured by Shaquille Paul.

[00:09] Team_092 possession (Score: 50-39)
Shaquille Russell attempts a Layup. Wide open! Shai Jordan is 6.7 feet away. [MAN] SHAQUILLE RUSSELL MAKES IT!
Score: 50-41

================================================================================
                              2ND QUARTER COMPLETE                              
================================================================================

2ND QUARTER SCORE: Team_049 19, Team_092 22

BOX SCORE:
================================================================================

Team_049
--------------------------------------------------------------------------------
Player                MIN  PTS  REB  AST  TO      FG   FG%      3P   3P%
--------------------------------------------------------------------------------
Desmond Towns          10    7    0    0   0   3/4    75.0     0/0   0.0
Shaquille Lillard      10    5    0    1   0   2/3    66.7     0/0   0.0
Miles Jackson          10    4    4    1   0   2/3    66.7     0/0   0.0
Ja Oladipo             15    2    0    0   0   1/1   100.0     0/0   0.0
Shai Jordan            10    1    0    0   0   1/4    25.0     0/0   0.0
Jimmy Griffin          15    0    0    0   0   0/1     0.0     0/0   0.0
De'Aaron Allen         15    0    2    0   0   0/1     0.0     0/0   0.0
Shai Mobley            15    0    0    1   0   0/0     0.0     0/0   0.0
Giannis Anunoby        10    0    4    1   0   0/2     0.0     0/0   0.0

TEAM: FG: 9/19 (47.4%), 3PT: 4/6 (66.7%), REB: 11 (5 off, 6 def), AST: 4, TO: 2
TEAM FOULS: 5 [Team_092 in BONUS]


Team_092
--------------------------------------------------------------------------------
Player                MIN  PTS  REB  AST  TO      FG   FG%      3P   3P%
--------------------------------------------------------------------------------
Pau Reaves             10    6    2    2   0   3/5    60.0     0/0   0.0
Shaquille Paul         10    5    5    1   0   2/2   100.0     0/0   0.0
Paul James             15    4    2    0   0   1/2    50.0     0/0   0.0
Shaquille Russell      10    4    3    0   0   2/3    66.7     0/0   0.0
Vince Harris           10    3    0    0   0   1/1   100.0     0/0   0.0
Immanuel Ingram        15    0    0    0   0   0/1     0.0     0/0   0.0
Bones Giddey           10    0    0    1   0   0/1     0.0     0/0   0.0

TEAM: FG: 9/15 (60.0%), 3PT: 1/2 (50.0%), REB: 11 (2 off, 9 def), AST: 4, TO: 6
TEAM FOULS: 8 [Team_049 in BONUS]

================================================================================

================================================================================
                       3RD QUARTER - Team_049 vs Team_092                       
================================================================================

[12:00] Team_049 possession (Score: 50-41)
Jimmy Griffin throws a bad pass! Stolen by Paul James! TURNOVER! (live ball)

[11:47] Team_092 possession (Score: 50-41)
Austin Bridges attempts a 3Pt. Contested by Shai Bird (3.7 feet, MAN). Austin Bridges misses. Rebound secured by De'Aaron Allen.

[11:30] Team_049 possession (Score: 50-41)
Ja Oladipo attempts a Layup. Contested by Karl Gobert (5.3 feet, MAN). JA OLADIPO MAKES IT! Assist: Jimmy Griffin
Score: 52-41

[11:12] Team_092 possession (Score: 52-41)
John Giddey attempts a Layup. Contested by De'Aaron Allen (4.5 feet, MAN). JOHN GIDDEY MAKES IT! Assist: Austin Bridges
Score: 52-43

[10:55] Team_049 possession (Score: 52-43)
Ja Oladipo attempts a Layup. Contested by Karl Gobert (5.3 feet, MAN). JA OLADIPO MAKES IT! Assist: Shai Mobley
Score: 54-43

[10:43] Team_092 possession (Score: 54-43)
John Giddey attempts a Midrange. Contested by De'Aaron Allen (4.5 feet, ZONE). JOHN GIDDEY MAKES IT!
Score: 54-45

[10:31] Team_049 possession (Score: 54-45)
De'Aaron Allen drives to the basket... De'Aaron Allen throws a bad pass! Stolen by John Giddey! TURNOVER! (live ball)

[10:21] Team_092 possession (Score: 54-45)
Paul James drives, picks up Jimmy Griffin. Help arrives from Ja Oladipo! Paul James attempts a Dunk. Contested by Ja Oladipo (5.3 feet, MAN). PAUL JAMES MAKES IT! Assist: Immanuel Ingram
Score: 54-47

[10:05] Team_049 possession (Score: 54-47)
Jimmy Griffin attempts a Midrange. Contested by Karl Gobert (5.1 feet, ZONE). Jimmy Griffin misses. Offensive rebound by Jimmy Griffin! Jimmy Griffin kicks it out.

[09:54] Team_049 possession (Score: 54-47)
Jimmy Griffin attempts a 3Pt. Contested by Paul James (4.8 feet, MAN). Jimmy Griffin misses. Rebound secured by Immanuel Ingram.

[09:41] Team_092 possession (Score: 54-47)
Karl Gobert drives to the basket... FOUL! Offensive foul on Karl Gobert! De'Aaron Allen drew the charge! [Team fouls: 1] (Karl Gobert: 1 personal fouls) TURNOVER! (dead ball)

[09:24] Team_049 possession (Score: 54-47)
FOUL! Shooting foul on John Giddey. Jimmy Griffin to the line for 2 free throws. [Team fouls: 2] (John Giddey: 1 personal fouls)   FT 1/2: GOOD   FT 2/2: GOOD Jimmy Griffin makes 2/2 from the line.
Score: 56-47

[09:09] Team_092 possession (Score: 56-47)
Austin Bridges attempts a 3Pt. Contested by Shai Bird (3.7 feet, MAN). Austin Bridges misses. Rebound secured by Shai Mobley.

[08:57] Team_049 possession (Score: 56-47)
Jimmy Griffin attempts a Midrange. Contested by Paul James (4.8 feet, MAN). JIMMY GRIFFIN MAKES IT!
Score: 58-47

[08:44] Team_092 possession (Score: 58-47)
Austin Bridges attempts a Midrange. Contested by Shai Bird (3.7 feet, MAN). Austin Bridges misses. Rebound secured by Shai Mobley.

[08:27] Team_049 possession (Score: 58-47)
Jimmy Griffin drives, Paul James stays with him. Jimmy Griffin attempts a Dunk. Contested by Paul James (4.8 feet, MAN). Jimmy Griffin misses. Rebound secured by Immanuel Ingram.

[08:13] Team_092 possession (Score: 58-47)
John Giddey attempts a Midrange. Contested by De'Aaron Allen (4.5 feet, ZONE). John Giddey misses. Offensive rebound by John Giddey! John Giddey kicks it out.

[08:00] Team_092 possession (Score: 58-47)
Austin Bridges attempts a 3Pt. Contested by Shai Bird (3.7 feet, MAN). AUSTIN BRIDGES MAKES IT!
Score: 58-50

[07:46] Team_049 possession (Score: 58-50)
Shai Bird attempts a 3Pt. Contested by Karl Gobert (5.5 feet, ZONE). SHAI BIRD MAKES IT! Assist: Shai Mobley
Score: 61-50

[07:30] Team_092 possession (Score: 61-50)
Austin Bridges drives and kicks out. Karl Gobert attempts a 3Pt. Contested by Ja Oladipo (4.2 feet, ZONE). KARL GOBERT MAKES IT! Assist: Paul James
Score: 61-53

[07:16] Team_049 possession (Score: 61-53)
Jimmy Griffin attempts a 3Pt. Contested by John Giddey (4.1 feet, ZONE). Jimmy Griffin misses. Rebound secured by Immanuel Ingram.

[07:02] Team_092 possession (Score: 61-53)
Immanuel Ingram attempts a 3Pt. Contested by Shai Bird (3.7 feet, ZONE). Immanuel Ingram misses. Rebound secured by Shai Mobley.

[06:50] Team_049 possession (Score: 61-53)
Jimmy Griffin drives and kicks out. Shai Bird attempts a Midrange. Contested by Austin Bridges (4.4 feet, MAN). SHAI BIRD MAKES IT! Assist: Jimmy Griffin
Score: 63-53

[06:36] Team_092 possession (Score: 63-53)
Karl Gobert attempts a 3Pt. Contested by Jimmy Griffin (4.5 feet, ZONE). Karl Gobert misses. Rebound secured by Shai Mobley.

[06:25] Team_049 possession (Score: 63-53)
Shai Bird attempts a Midrange. BLOCKED BY JOHN GIDDEY! Ball is loose! Offensive rebound by Jimmy Griffin! Jimmy Griffin kicks it out.

[06:14] Team_049 possession (Score: 63-53)
Ja Oladipo attempts a 3Pt. Contested by Karl Gobert (5.3 feet, MAN). Ja Oladipo misses. Rebound secured by John Giddey.

[06:03] Team_092 possession (Score: 63-53)
John Giddey attempts a Midrange. Contested by De'Aaron Allen (4.5 feet, MAN). JOHN GIDDEY MAKES IT!
Score: 63-55

[05:50] Team_049 possession (Score: 63-55)
Shai Mobley attempts a Midrange. Contested by Immanuel Ingram (4.3 feet, MAN). SHAI MOBLEY MAKES IT! Assist: Shai Bird
Score: 65-55

[05:35] Team_092 possession (Score: 65-55)
FOUL! Shooting foul on De'Aaron Allen. John Giddey to the line for 3 free throws. [Team fouls: 1] (De'Aaron Allen: 1 personal fouls)   FT 1/3: GOOD   FT 2/3: GOOD   FT 3/3: GOOD John Giddey makes 3/3 from the line.
Score: 65-58

[05:20] Team_049 possession (Score: 65-58)
De'Aaron Allen drives to the basket... De'Aaron Allen loses control! Ball rolls out of bounds! TURNOVER! (dead ball)

[05:06] Team_092 possession (Score: 65-58)
FOUL! Shooting foul on Ja Oladipo. John Giddey to the line for 3 free throws. [Team fouls: 2] (Ja Oladipo: 1 personal fouls)   FT 1/3: GOOD   FT 2/3: MISS   FT 3/3: MISS John Giddey makes 1/3 from the line. Rebound secured by Jimmy Griffin.
Score: 65-59

[04:51] Team_049 possession (Score: 65-59)
De'Aaron Allen attempts a Midrange. Contested by John Giddey (4.0 feet, MAN). DE'AARON ALLEN MAKES IT!
Score: 67-59

[04:38] Team_092 possession (Score: 67-59)
John Giddey attempts a 3Pt. Contested by De'Aaron Allen (4.6 feet, MAN). John Giddey misses. Rebound secured by Shai Mobley.

[04:28] Team_049 possession (Score: 67-59)
Shai Bird attempts a Layup. Contested by Austin Bridges (5.0 feet, MAN). SHAI BIRD MAKES IT!
Score: 69-59

[04:11] Team_092 possession (Score: 69-59)
John Giddey attempts a Midrange. Contested by De'Aaron Allen (4.6 feet, MAN). JOHN GIDDEY MAKES IT! Assist: Austin Bridges
Score: 69-61

[03:54] Team_049 possession (Score: 69-61)
Ja Oladipo drives, Karl Gobert stays with him. Ja Oladipo attempts a Layup. Contested by Karl Gobert (5.4 feet, MAN). JA OLADIPO MAKES IT! Assist: Shai Mobley
Score: 71-61

[03:41] Team_092 possession (Score: 71-61)
Immanuel Ingram drives and kicks out. Austin Bridges attempts a Midrange. Contested by De'Aaron Allen (4.4 feet, ZONE). Austin Bridges misses. Offensive rebound by John Giddey! John Giddey kicks it out.

[03:21] Team_092 possession (Score: 71-61)
FOUL! Shooting foul on De'Aaron Allen. John Giddey to the line for 2 free throws. [Team fouls: 3] (De'Aaron Allen: 2 personal fouls)   FT 1/2: MISS   FT 2/2: GOOD John Giddey makes 1/2 from the line.
Score: 71-62

[03:06] Team_049 possession (Score: 71-62)
Shai Mobley attempts a 3Pt. Contested by John Giddey (4.6 feet, ZONE). Shai Mobley misses. Rebound secured by John Giddey.

[02:52] Team_092 possession (Score: 71-62)
Austin Bridges commits a violation (traveling/carry)! TURNOVER! (dead ball)

[02:52] Substitution (Team_049): Shai Bird OUT → Shaquille Lillard IN (stamina_rule2)

[02:52] Substitution (Team_049): Jimmy Griffin OUT → Desmond Towns IN (stamina_rule2)

[02:52] Substitution (Team_092): Austin Bridges OUT → Bones Giddey IN (stamina_rule2)

[02:52] Substitution (Team_092): Karl Gobert OUT → Shaquille Russell IN (stamina_rule2)

[02:52] Substitution (Team_092): John Giddey OUT → Shaquille Paul IN (stamina_rule2)

[02:40] Team_049 possession (Score: 71-62)
Ja Oladipo attempts a 3Pt. Contested by Shaquille Russell (4.4 feet, ZONE). Ja Oladipo misses. Rebound secured by Shaquille Paul.

[02:27] Team_092 possession (Score: 71-62)
Bones Giddey attempts a Midrange. Contested by Shaquille Lillard (4.2 feet, MAN). Bones Giddey misses. Rebound secured by Ja Oladipo.

[02:12] Team_049 possession (Score: 71-62)
Shaquille Lillard drives to the basket... Shaquille Lillard throws a bad pass! Stolen by Bones Giddey! TURNOVER! (live ball)

[02:01] Team_092 possession (Score: 71-62)
Paul James makes the Layup and draws the foul on Desmond Towns! And-1! Paul James to the line for 1. [Team fouls: 4] (Desmond Towns: 1 personal fouls)   FT 1/1: GOOD Paul James makes 1/1 from the line.
Score: 71-65

[01:44] Team_049 possession (Score: 71-65)
Desmond Towns attempts a 3Pt. Contested by Paul James (5.2 feet, MAN). Desmond Towns misses. Rebound secured by Shaquille Paul.

[01:28] Team_092 possession (Score: 71-65)
Immanuel Ingram drives to the basket... Immanuel Ingram throws a bad pass! Stolen by Shai Mobley! TURNOVER! (live ball)

[01:19] Team_049 possession (Score: 71-65)
Shai Mobley attempts a Layup. Contested by Immanuel Ingram (4.7 feet, MAN). SHAI MOBLEY MAKES IT! Assist: Desmond Towns
Score: 73-65

[01:01] Team_092 possession (Score: 73-65)
Shaquille Russell drives, picks up De'Aaron Allen. Help arrives from Ja Oladipo! Shaquille Russell attempts a Dunk. Contested by Ja Oladipo (5.1 feet, ZONE). SHAQUILLE RUSSELL MAKES IT! Assist: Paul James
Score: 73-67

[00:44] Team_049 possession (Score: 73-67)
Ja Oladipo attempts a 3Pt. Contested by Shaquille Russell (4.3 feet, ZONE). Ja Oladipo misses. Rebound secured by Immanuel Ingram.

[00:31] Team_092 possession (Score: 73-67)
FOUL! Offensive foul on Bones Giddey! Shaquille Lillard drew the charge! [Team fouls: 3] (Bones Giddey: 1 personal fouls) TURNOVER! (dead ball)

[00:17] Team_049 possession (Score: 73-67)
Desmond Towns drives and kicks out. Shaquille Lillard attempts a 3Pt. Contested by Shaquille Paul (5.6 feet, ZONE). SHAQUILLE LILLARD MAKES IT! Assist: Desmond Towns
Score: 76-67

[00:04] Team_092 possession (Score: 76-67)
Shaquille Russell drives to the basket... Shaquille Russell commits a violation (traveling/carry)! TURNOVER! (dead ball)

[00:04] Substitution (Team_049): Ja Oladipo OUT → Shai Jordan IN (stamina_rule2)

[00:04] Substitution (Team_049): De'Aaron Allen OUT → Giannis Anunoby IN (stamina_rule2)

[00:04] Substitution (Team_049): Shai Mobley OUT → Miles Jackson IN (stamina_rule2)

[00:04] Substitution (Team_092): Paul James OUT → Vince Harris IN (stamina_rule2)

[00:04] Substitution (Team_092): Immanuel Ingram OUT → Pau Reaves IN (stamina_rule2)

================================================================================
                              3RD QUARTER COMPLETE                              
================================================================================

3RD QUARTER SCORE: Team_049 26, Team_092 26

BOX SCORE:
================================================================================

Team_049
--------------------------------------------------------------------------------
Player                MIN  PTS  REB  AST  TO      FG   FG%      3P   3P%
--------------------------------------------------------------------------------
Shai Bird              24    7    0    1   0   3/3   100.0     0/0   0.0
Ja Oladipo             27    6    1    0   0   3/6    50.0     0/0   0.0
Jimmy Griffin          24    4    3    2   0   2/5    40.0     0/0   0.0
Shai Mobley            27    4    5    3   0   2/3    66.7     0/0   0.0
Shaquille Lillard      13    3    0    0   0   1/1   100.0     0/0   0.0
De'Aaron Allen         27    2    1    0   0   1/1   100.0     0/0   0.0
Desmond Towns          13    0    0    2   0   0/1     0.0     0/0   0.0

TEAM: FG: 12/20 (60.0%), 3PT: 1/8 (12.5%), REB: 10 (2 off, 8 def), AST: 8, TO: 4
TEAM FOULS: 4


Team_092
--------------------------------------------------------------------------------
Player                MIN  PTS  REB  AST  TO      FG   FG%      3P   3P%
--------------------------------------------------------------------------------
John Giddey            24   12    4    0   0   6/8    75.0     0/0   0.0
Paul James             27    5    0    2   0   2/2   100.0     0/0   0.0
Austin Bridges         24    3    0    2   0   1/4    25.0     0/0   0.0
Karl Gobert            24    3    0    0   0   1/2    50.0     0/0   0.0
Shaquille Russell      13    2    0    0   0   1/1   100.0     0/0   0.0
Immanuel Ingram        27    0    4    1   0   0/1     0.0     0/0   0.0
Shaquille Paul         13    0    2    0   0   0/0     0.0     0/0   0.0
Bones Giddey           13    0    0    0   0   0/1     0.0     0/0   0.0

TEAM: FG: 11/19 (57.9%), 3PT: 2/8 (25.0%), REB: 10 (2 off, 8 def), AST: 5, TO: 5
TEAM FOULS: 3

================================================================================

================================================================================
                       4TH QUARTER - Team_049 vs Team_092                       
================================================================================

[12:00] Team_049 possession (Score: 76-67)
Shai Bird attempts a Midrange. Contested by Austin Bridges (4.9 feet, MAN). SHAI BIRD MAKES IT! Assist: De'Aaron Allen
Score: 78-67

[11:43] Team_092 possession (Score: 78-67)
Paul James attempts a 3Pt. Contested by Jimmy Griffin (5.3 feet, MAN). Paul James misses. Offensive rebound by Paul James! Paul James kicks it out.

[11:28] Team_092 possession (Score: 78-67)
Austin Bridges attempts a 3Pt. Contested by Jimmy Griffin (4.5 feet, ZONE). Austin Bridges misses. Rebound secured by Jimmy Griffin.

[11:17] Team_049 possession (Score: 78-67)
De'Aaron Allen makes the Layup and draws the foul on John Giddey! And-1! De'Aaron Allen to the line for 1. [Team fouls: 1] (John Giddey: 1 personal fouls)   FT 1/1: GOOD De'Aaron Allen makes 1/1 from the line.
Score: 81-67

[11:02] Team_092 possession (Score: 81-67)
Immanuel Ingram attempts a Layup. Contested by De'Aaron Allen (4.5 feet, ZONE). Immanuel Ingram misses. Rebound secured by Jimmy Griffin.

[10:44] Team_049 possession (Score: 81-67)
Ja Oladipo attempts a Layup. Contested by John Giddey (4.3 feet, ZONE). JA OLADIPO MAKES IT! Assist: Jimmy Griffin
Score: 83-67

[10:32] Team_092 possession (Score: 83-67)
Paul James attempts a Layup. Contested by De'Aaron Allen (5.3 feet, ZONE). PAUL JAMES MAKES IT! Assist: Immanuel Ingram
Score: 83-69

[10:16] Team_049 possession (Score: 83-69)
Shai Bird attempts a 3Pt. Contested by John Giddey (4.6 feet, ZONE). Shai Bird misses. Rebound secured by Paul James.

[09:58] Team_092 possession (Score: 83-69)
Paul James attempts a 3Pt. Contested by Jimmy Griffin (5.3 feet, ZONE). Paul James misses. Offensive rebound by Paul James! Paul James kicks it out.

[09:43] Team_092 possession (Score: 83-69)
Paul James attempts a 3Pt. Contested by Jimmy Griffin (5.4 feet, ZONE). PAUL JAMES MAKES IT!
Score: 83-72

[09:28] Team_049 possession (Score: 83-72)
Shai Bird attempts a 3Pt. Contested by John Giddey (4.7 feet, ZONE). Shai Bird misses. Rebound secured by Paul James.

[09:14] Team_092 possession (Score: 83-72)
John Giddey attempts a 3Pt. Contested by De'Aaron Allen (5.1 feet, MAN). John Giddey misses. Rebound secured by Jimmy Griffin.

[09:03] Team_049 possession (Score: 83-72)
FOUL! Offensive foul on Jimmy Griffin! Paul James drew the charge! [Team fouls: 1] (Jimmy Griffin: 1 personal fouls) TURNOVER! (dead ball)

[08:49] Team_092 possession (Score: 83-72)
Paul James drives and kicks out. John Giddey attempts a 3Pt. Contested by De'Aaron Allen (5.0 feet, MAN). John Giddey misses. Rebound secured by De'Aaron Allen.

[08:33] Team_049 possession (Score: 83-72)
Ja Oladipo attempts a Layup. Contested by John Giddey (4.5 feet, ZONE). JA OLADIPO MAKES IT!
Score: 85-72

[08:19] Team_092 possession (Score: 85-72)
Paul James drives and kicks out. Immanuel Ingram attempts a 3Pt. Contested by Shai Mobley (5.1 feet, MAN). IMMANUEL INGRAM MAKES IT! Assist: John Giddey
Score: 85-75

[08:07] Team_049 possession (Score: 85-75)
FOUL! Shooting foul on John Giddey. Jimmy Griffin to the line for 3 free throws. [Team fouls: 2] (John Giddey: 2 personal fouls)   FT 1/3: GOOD   FT 2/3: MISS   FT 3/3: GOOD Jimmy Griffin makes 2/3 from the line.
Score: 87-75

[07:51] Team_092 possession (Score: 87-75)
John Giddey attempts a Layup. Contested by De'Aaron Allen (5.3 feet, MAN). JOHN GIDDEY MAKES IT! Assist: Karl Gobert
Score: 87-77

[07:38] Team_049 possession (Score: 87-77)
Shai Mobley drives, Immanuel Ingram stays with him. Shai Mobley attempts a Dunk. Contested by Immanuel Ingram (5.1 feet, MAN). SHAI MOBLEY MAKES IT! Assist: Ja Oladipo
Score: 89-77

[07:22] Team_092 possession (Score: 89-77)
FOUL! Reach-in foul on Ja Oladipo during the drive. [Team fouls: 2] No free throws, side out. (Ja Oladipo: 1 personal fouls)

[07:09] Team_092 possession (Score: 89-77)
FOUL! Shooting foul on De'Aaron Allen. John Giddey to the line for 2 free throws. [Team fouls: 3] (De'Aaron Allen: 1 personal fouls)   FT 1/2: GOOD   FT 2/2: GOOD John Giddey makes 2/2 from the line.
Score: 89-79

[06:56] Team_049 possession (Score: 89-79)
De'Aaron Allen drives, picks up John Giddey. Help arrives from Austin Bridges! De'Aaron Allen attempts a Layup. Contested by Austin Bridges (4.3 feet, MAN). DE'AARON ALLEN MAKES IT! Assist: Ja Oladipo
Score: 91-79

[06:45] Team_092 possession (Score: 91-79)
Immanuel Ingram attempts a Layup. Contested by Shai Mobley (5.1 feet, MAN). Immanuel Ingram misses. Rebound secured by De'Aaron Allen.

[06:30] Team_049 possession (Score: 91-79)
FOUL! Holding foul on Immanuel Ingram. [Team fouls: 3] No free throws, side out. (Immanuel Ingram: 1 personal fouls)

[06:17] Team_049 possession (Score: 91-79)
Jimmy Griffin attempts a 3Pt. Contested by John Giddey (4.7 feet, ZONE). Jimmy Griffin misses. Rebound secured by Paul James.

[06:01] Team_092 possession (Score: 91-79)
Austin Bridges drives, picks up Shai Bird. Help arrives from Jimmy Griffin! Austin Bridges attempts a Dunk. Contested by Jimmy Griffin (4.3 feet, MAN). AUSTIN BRIDGES MAKES IT! Assist: John Giddey
Score: 91-81

[05:45] Team_049 possession (Score: 91-81)
Shai Mobley attempts a 3Pt. Contested by Immanuel Ingram (5.3 feet, MAN). Shai Mobley misses. Rebound secured by John Giddey.

[05:32] Team_092 possession (Score: 91-81)
Paul James attempts a 3Pt. Contested by Jimmy Griffin (5.7 feet, ZONE). Paul James misses. Offensive rebound by Paul James! Paul James kicks it out.

[05:18] Team_092 possession (Score: 91-81)
John Giddey drives to the basket... FOUL! Offensive foul on John Giddey! De'Aaron Allen drew the charge! [Team fouls: 4] (John Giddey: 3 personal fouls) TURNOVER! (dead ball)

[05:02] Team_049 possession (Score: 91-81)
Jimmy Griffin attempts a Midrange. Contested by Paul James (5.9 feet, MAN). JIMMY GRIFFIN MAKES IT! Assist: Ja Oladipo
Score: 93-81

[04:48] Team_092 possession (Score: 93-81)
Immanuel Ingram makes the Dunk and draws the foul on Shai Bird! And-1! Immanuel Ingram to the line for 1. [Team fouls: 4] (Shai Bird: 1 personal fouls)   FT 1/1: GOOD Immanuel Ingram makes 1/1 from the line.
Score: 93-84

[04:34] Team_049 possession (Score: 93-84)
FOUL! Shooting foul on Paul James. Jimmy Griffin to the line for 2 free throws. [BONUS: 5 team fouls] (Paul James: 1 personal fouls)   FT 1/2: GOOD   FT 2/2: GOOD Jimmy Griffin makes 2/2 from the line.
Score: 95-84

[04:18] Team_092 possession (Score: 95-84)
Austin Bridges attempts a 3Pt. Contested by De'Aaron Allen (5.3 feet, ZONE). Austin Bridges misses. Rebound secured by Jimmy Griffin.

[04:04] Team_049 possession (Score: 95-84)
Shai Mobley drives, Immanuel Ingram stays with him. Shai Mobley attempts a Layup. Contested by Immanuel Ingram (5.5 feet, MAN). SHAI MOBLEY MAKES IT! Assist: De'Aaron Allen
Score: 97-84

[03:45] Team_092 possession (Score: 97-84)
Immanuel Ingram attempts a Midrange. Contested by Shai Mobley (5.5 feet, MAN). IMMANUEL INGRAM MAKES IT! Assist: Karl Gobert
Score: 97-86

[03:30] Team_049 possession (Score: 97-86)
Ja Oladipo drives and kicks out. Ja Oladipo attempts a Midrange. Contested by Immanuel Ingram (5.6 feet, ZONE). JA OLADIPO MAKES IT! Assist: Shai Bird
Score: 99-86

[03:12] Team_092 possession (Score: 99-86)
Karl Gobert drives, De'Aaron Allen stays with him. Karl Gobert attempts a Dunk. Contested by De'Aaron Allen (5.6 feet, ZONE). KARL GOBERT MAKES IT! Assist: John Giddey
Score: 99-88

[03:01] Team_049 possession (Score: 99-88)
Shai Bird drives and kicks out. Shai Bird attempts a 3Pt. Contested by John Giddey (5.2 feet, ZONE). SHAI BIRD MAKES IT! Assist: Jimmy Griffin
Score: 102-88

[02:46] Team_092 possession (Score: 102-88)
Austin Bridges attempts a 3Pt. Contested by Shai Bird (4.8 feet, MAN). Austin Bridges misses. Offensive rebound by John Giddey! John Giddey kicks it out.

[02:28] Team_092 possession (Score: 102-88)
Immanuel Ingram attempts a Layup. Contested by Shai Mobley (5.7 feet, MAN). Immanuel Ingram misses. Offensive rebound by John Giddey! John Giddey kicks it out.

[02:12] Team_092 possession (Score: 102-88)
John Giddey attempts a 3Pt. Contested by Jimmy Griffin (5.9 feet, ZONE). JOHN GIDDEY MAKES IT! Assist: Karl Gobert
Score: 102-91

[02:00] Team_049 possession (Score: 102-91)
Shai Bird attempts a 3Pt. Contested by John Giddey (5.6 feet, ZONE). Shai Bird misses. Rebound secured by John Giddey.

[01:46] Team_092 possession (Score: 102-91)
John Giddey drives and kicks out. John Giddey attempts a 3Pt. Wide open! De'Aaron Allen is 6.1 feet away. [MAN] John Giddey misses. Rebound secured by Jimmy Griffin.

[01:30] Team_049 possession (Score: 102-91)
Jimmy Griffin drives, picks up Paul James. Help arrives from Austin Bridges! Jimmy Griffin attempts a Dunk. Wide open! Austin Bridges is 6.3 feet away. [MAN] Jimmy Griffin misses. Rebound secured by John Giddey.

[01:13] Team_092 possession (Score: 102-91)
FOUL! Shooting foul on Shai Bird. Austin Bridges to the line for 2 free throws. [BONUS: 5 team fouls] (Shai Bird: 2 personal fouls)   FT 1/2: GOOD   FT 2/2: GOOD Austin Bridges makes 2/2 from the line.
Score: 102-93

[01:02] Team_049 possession (Score: 102-93)
Shai Bird drives and kicks out. De'Aaron Allen attempts a 3Pt. Contested by John Giddey (5.6 feet, MAN). De'Aaron Allen misses. Rebound secured by Immanuel Ingram.

[00:43] Team_092 possession (Score: 102-93)
FOUL! Shooting foul on De'Aaron Allen. Immanuel Ingram to the line for 2 free throws. [BONUS: 6 team fouls] (De'Aaron Allen: 2 personal fouls)   FT 1/2: MISS   FT 2/2: GOOD Immanuel Ingram makes 1/2 from the line.
Score: 102-94

[00:30] Team_049 possession (Score: 102-94)
De'Aaron Allen attempts a Layup. BLOCKED BY JOHN GIDDEY! Ball deflects out of bounds off De'Aaron Allen.

[00:18] Team_092 possession (Score: 102-94)
John Giddey attempts a Midrange. Wide open! De'Aaron Allen is 6.3 feet away. [MAN] John Giddey misses. Rebound secured by Shai Mobley.

[00:02] Team_049 possession (Score: 102-94)
Shai Mobley attempts a 3Pt. Wide open! Paul James is 6.6 feet away. [ZONE] SHAI MOBLEY MAKES IT! Assist: Jimmy Griffin
Score: 105-94

================================================================================
                              4TH QUARTER COMPLETE                              
================================================================================

4TH QUARTER SCORE: Team_049 29, Team_092 27

BOX SCORE:
================================================================================

Team_049
--------------------------------------------------------------------------------
Player                MIN  PTS  REB  AST  TO      FG   FG%      3P   3P%
--------------------------------------------------------------------------------
Shai Mobley            39    7    1    0   0   3/4    75.0     0/0   0.0
Jimmy Griffin          36    6    5    3   0   3/5    60.0     0/0   0.0
Ja Oladipo             39    6    0    3   0   3/3   100.0     0/0   0.0
Shai Bird              36    5    0    1   0   2/6    33.3     0/0   0.0
De'Aaron Allen         39    5    2    2   0   2/3    66.7     0/0   0.0

TEAM: FG: 13/21 (61.9%), 3PT: 2/7 (28.6%), REB: 8 (0 off, 8 def), AST: 9, TO: 1
TEAM FOULS: 6 [Team_092 in BONUS]


Team_092
--------------------------------------------------------------------------------
Player                MIN  PTS  REB  AST  TO      FG   FG%      3P   3P%
--------------------------------------------------------------------------------
Immanuel Ingram        39    9    1    1   0   4/6    66.7     0/0   0.0
John Giddey            36    7    5    3   0   3/6    50.0     0/0   0.0
Paul James             39    5    6    0   0   2/3    66.7     0/0   0.0
Austin Bridges         36    4    0    0   0   2/4    50.0     0/0   0.0
Karl Gobert            36    2    0    3   0   1/1   100.0     0/0   0.0

TEAM: FG: 12/20 (60.0%), 3PT: 2/5 (40.0%), REB: 12 (5 off, 7 def), AST: 7, TO: 1
TEAM FOULS: 5 [Team_049 in BONUS]

================================================================================

================================================================================
                               FULL GAME COMPLETE                               
================================================================================

FINAL SCORE: Team_049 105, Team_092 94

SCORING BY QUARTER:
--------------------------------------------------------------------------------
Team                     Q1     Q2     Q3     Q4    FINAL
--------------------------------------------------------------------------------
Team_049                 31     19     26     29      105
Team_092                 19     22     26     27       94
--------------------------------------------------------------------------------

FULL GAME BOX SCORE:
================================================================================

Team_049
--------------------------------------------------------------------------------
Player                MIN  PTS  REB  AST  TO      FG   FG%      3P   3P%      FT STL BLK
--------------------------------------------------------------------------------
Ja Oladipo             39   21    1    4   0   9/13   69.2   1/4    25.0   3/4     0   0
De'Aaron Allen         39   11    6    3   2   6/11   54.5   1/2    50.0   1/1     1   0
Shai Mobley            39   18   12    4   1   7/10   70.0   2/4    50.0   0/0     1   0
Shai Bird              36   21    0    2   1   7/13   53.8   3/8    37.5   1/1     0   0
Jimmy Griffin          36   13   15    7   3   8/16   50.0   2/6    33.3   7/10    0   0
Shaquille Lillard      13    8    0    1   1   2/3    66.7   0/1     0.0   1/1     0   0
Desmond Towns          13    7    0    2   0   4/6    66.7   1/2    50.0   2/2     0   0
Shai Jordan            10    1    0    0   0   3/6    50.0   3/3   100.0   1/3     0   1
Giannis Anunoby        10    0    4    1   0   0/2     0.0   0/0     0.0   0/0     0   0
Miles Jackson          10    4    4    1   0   0/1     0.0   0/1     0.0   0/0     1   1

TEAM: FG: 46/81 (56.8%), 3PT: 13/31 (41.9%), REB: 44 (12 off, 32 def), AST: 25, TO: 8


Team_092
--------------------------------------------------------------------------------
Player                MIN  PTS  REB  AST  TO      FG   FG%      3P   3P%      FT STL BLK
--------------------------------------------------------------------------------
Paul James             39   14   14    2   4   7/12   58.3   2/4    50.0   2/2     1   0
Immanuel Ingram        39   11    8    2   0   4/9    44.4   0/1     0.0   2/3     0   0
Austin Bridges         36   12    0    4   1   6/12   50.0   2/7    28.6   2/2     0   0
Karl Gobert            36   12    0    4   1   3/6    50.0   1/2    50.0   0/0     0   0
John Giddey            36   24   13    3   1  11/19   57.9   2/5    40.0   8/11    1   4
Bones Giddey           13    0    0    1   2   0/2     0.0   0/0     0.0   0/0     1   0
Shaquille Russell      13    6    3    0   3   4/5    80.0   0/0     0.0   0/0     0   0
Shaquille Paul         13    5    7    1   0   2/2   100.0   0/0     0.0   1/1     0   0
Vince Harris           10    3    0    0   0   0/0     0.0   0/0     0.0   0/0     0   1
Pau Reaves             10    6    2    2   3   3/5    60.0   0/0     0.0   0/0     0   0

TEAM: FG: 40/72 (55.6%), 3PT: 7/19 (36.8%), REB: 45 (13 off, 32 def), AST: 19, TO: 15

================================================================================
