================================================================================
                        FULL GAME - Team_062 vs Team_033                        
================================================================================

================================================================================
                       1ST QUARTER - Team_062 vs Team_033                       
================================================================================

[12:00] Team_062 possession (Score: 0-0)
Michael Hyland attempts a 3Pt. Contested by Cade Randle (2.9 feet, ZONE). Michael Hyland misses. Rebound secured by Cade Randle.

[11:47] Team_033 possession (Score: 0-0)
Joel Green makes the Layup and draws the foul on Jalen Reaves! And-1! Joel Green to the line for 1. [Team fouls: 1] (Jalen Reaves: 1 personal fouls)   FT 1/1: MISS Joel Green makes 0/1 from the line. Rebound secured by Michael Hyland.
Score: 0-2

[11:30] Team_062 possession (Score: 0-2)
Kawhi Thompson attempts a Midrange. Contested by Chris Anunoby (3.9 feet, ZONE). KAWHI THOMPSON MAKES IT!
Score: 2-2

[11:15] Team_033 possession (Score: 2-2)
Desmond DeRozan drives to the basket... Desmond DeRozan commits a violation (traveling/carry)! TURNOVER! (dead ball)

[10:59] Team_062 possession (Score: 2-2)
RJ Williamson attempts a 3Pt. Contested by Joel Green (4.0 feet, ZONE). RJ WILLIAMSON MAKES IT! Assist: Michael Hyland
Score: 5-2

[10:42] Team_033 possession (Score: 5-2)
Cade Randle attempts a Midrange. Contested by Michael Hyland (5.2 feet, ZONE). Cade Randle misses. Rebound secured by Kawhi Thompson.

[10:22] Team_062 possession (Score: 5-2)
Michael Hyland attempts a 3Pt. Contested by Joel Green (4.2 feet, ZONE). MICHAEL HYLAND MAKES IT!
Score: 8-2

[10:07] Team_033 possession (Score: 8-2)
Joel Green drives to the basket... Joel Green loses the ball! Stripped by Jalen Reaves! TURNOVER! (live ball)

[09:52] Team_062 possession (Score: 8-2)
Jalen Reaves makes the Layup and draws the foul on Bradley Simmons! And-1! Jalen Reaves to the line for 1. [Team fouls: 1] (Bradley Simmons: 1 personal fouls)   FT 1/1: GOOD Jalen Reaves makes 1/1 from the line.
Score: 11-2

[09:35] Team_033 possession (Score: 11-2)
Bradley Simmons drives and kicks out. Cade Randle attempts a Midrange. Contested by Michael Hyland (4.6 feet, ZONE). CADE RANDLE MAKES IT!
Score: 11-4

[09:22] Team_062 possession (Score: 11-4)
Jalen Reaves attempts a 3Pt. Contested by Bradley Simmons (3.2 feet, MAN). Jalen Reaves misses. Rebound secured by Cade Randle.

[09:05] Team_033 possession (Score: 11-4)
Desmond DeRozan attempts a 3Pt. Contested by Kawhi Thompson (4.9 feet, MAN). Desmond DeRozan misses. Rebound secured by Jalen Reaves.

[08:48] Team_062 possession (Score: 11-4)
Kawhi Thompson attempts a 3Pt. Contested by Joel Green (4.3 feet, ZONE). Kawhi Thompson misses. FOUL! Loose ball foul on Bradley Simmons during the rebound battle. [Team fouls: 2] No free throws, side out. (Bradley Simmons: 2 personal fouls)

[08:35] Team_062 possession (Score: 11-4)
RJ Williamson attempts a 3Pt. Contested by Chris Anunoby (3.6 feet, MAN). RJ Williamson misses. Rebound secured by Desmond DeRozan.

[08:23] Team_033 possession (Score: 11-4)
FOUL! Offensive foul on Bradley Simmons! Jalen Reaves drew the charge! [Team fouls: 3] (Bradley Simmons: 3 personal fouls) TURNOVER! (dead ball)

[08:10] Team_062 possession (Score: 11-4)
Kawhi Thompson attempts a Midrange. Contested by Desmond DeRozan (4.8 feet, MAN). Kawhi Thompson misses. Rebound secured by Cade Randle.

[07:59] Team_033 possession (Score: 11-4)
Cade Randle drives to the basket... Cade Randle loses the ball! Stripped by Jalen Reaves! TURNOVER! (live ball)

[07:44] Team_062 possession (Score: 11-4)
Kawhi Thompson attempts a 3Pt. Contested by Joel Green (4.3 feet, ZONE). Kawhi Thompson misses. Rebound secured by Cade Randle.

[07:31] Team_033 possession (Score: 11-4)
Bradley Simmons attempts a Layup. Contested by Jalen Reaves (4.8 feet, ZONE). BRADLEY SIMMONS MAKES IT! Assist: Joel Green
Score: 11-6

[07:20] Team_062 possession (Score: 11-6)
Chris Bird makes the Layup and draws the foul on Joel Green! And-1! Chris Bird to the line for 1. [Team fouls: 4] (Joel Green: 1 personal fouls)   FT 1/1: GOOD Chris Bird makes 1/1 from the line.
Score: 14-6

[07:07] Team_033 possession (Score: 14-6)
Bradley Simmons attempts a Dunk. BLOCKED BY CHRIS BIRD! Ball goes out off Chris Bird. Bradley Simmons's ball!

[06:51] Team_033 possession (Score: 14-6)
FOUL! Holding foul on RJ Williamson. [Team fouls: 2] No free throws, side out. (RJ Williamson: 1 personal fouls)

[06:38] Team_033 possession (Score: 14-6)
Chris Anunoby attempts a 3Pt. Contested by RJ Williamson (4.3 feet, ZONE). CHRIS ANUNOBY MAKES IT! Assist: Joel Green
Score: 14-9

[06:28] Team_062 possession (Score: 14-9)
Kawhi Thompson attempts a Midrange. Contested by Desmond DeRozan (4.8 feet, ZONE). Kawhi Thompson misses. Offensive rebound by Jalen Reaves! Jalen Reaves's putback is no good. Rebound secured by Desmond DeRozan.

[06:11] Team_033 possession (Score: 14-9)
Chris Anunoby attempts a 3Pt. Contested by RJ Williamson (4.3 feet, MAN). Chris Anunoby misses. Rebound secured by Jalen Reaves.

[05:57] Team_062 possession (Score: 14-9)
FOUL! Reach-in foul on Bradley Simmons during the drive. [IN THE BONUS! 5 team fouls] Jalen Reaves to the line for 2 free throws. (Bradley Simmons: 4 personal fouls)   FT 1/2: GOOD   FT 2/2: GOOD Jalen Reaves makes 2/2 from the line.
Score: 16-9

[05:41] Team_033 possession (Score: 16-9)
Cade Randle attempts a 3Pt. Contested by Michael Hyland (5.2 feet, MAN). Cade Randle misses. Rebound secured by Jalen Reaves.

[05:27] Team_062 possession (Score: 16-9)
Jalen Reaves attempts a Layup. BLOCKED BY CHRIS ANUNOBY! Ball deflects out of bounds off Jalen Reaves.

[05:14] Team_033 possession (Score: 16-9)
Chris Anunoby attempts a 3Pt. Contested by RJ Williamson (4.3 feet, MAN). Chris Anunoby misses. Rebound secured by Kawhi Thompson.

[04:59] Team_062 possession (Score: 16-9)
Chris Bird drives, picks up Bradley Simmons. Help arrives from Chris Anunoby! Chris Bird attempts a Layup. Contested by Chris Anunoby (3.2 feet, ZONE). CHRIS BIRD MAKES IT! Assist: Kawhi Thompson
Score: 18-9

[04:42] Team_033 possession (Score: 18-9)
FOUL! Holding foul on Kawhi Thompson. [Team fouls: 3] No free throws, side out. (Kawhi Thompson: 1 personal fouls)

[04:28] Team_033 possession (Score: 18-9)
Cade Randle drives, picks up Michael Hyland. Help arrives from Chris Bird! Cade Randle attempts a Layup. Contested by Chris Bird (5.2 feet, MAN). Cade Randle misses. Rebound secured by Jalen Reaves.

[04:14] Team_062 possession (Score: 18-9)
RJ Williamson attempts a Layup. BLOCKED BY BRADLEY SIMMONS! Ball is loose! Rebound secured by Desmond DeRozan.

[03:58] Team_033 possession (Score: 18-9)
Cade Randle attempts a Layup. Contested by Michael Hyland (5.3 feet, MAN). CADE RANDLE MAKES IT!
Score: 18-11

[03:45] Team_062 possession (Score: 18-11)
RJ Williamson attempts a Layup. BLOCKED BY BRADLEY SIMMONS! Ball goes out off Bradley Simmons. RJ Williamson's ball!

[03:34] Team_062 possession (Score: 18-11)
Kawhi Thompson attempts a Midrange. Contested by Desmond DeRozan (5.0 feet, MAN). Kawhi Thompson misses. Rebound secured by Bradley Simmons.

[03:17] Team_033 possession (Score: 18-11)
Joel Green attempts a 3Pt. Contested by RJ Williamson (4.9 feet, ZONE). JOEL GREEN MAKES IT! Assist: Cade Randle
Score: 18-14

[03:02] Team_062 possession (Score: 18-14)
RJ Williamson attempts a 3Pt. Contested by Joel Green (4.2 feet, ZONE). RJ WILLIAMSON MAKES IT! Assist: Jalen Reaves
Score: 21-14

[02:44] Team_033 possession (Score: 21-14)
Chris Anunoby attempts a 3Pt. Contested by RJ Williamson (4.5 feet, ZONE). Chris Anunoby misses. Offensive rebound by Bradley Simmons! Bradley Simmons's putback is no good. Rebound secured by Kawhi Thompson.

[02:27] Team_062 possession (Score: 21-14)
Michael Hyland drives and kicks out. Chris Bird attempts a 3Pt. Contested by Joel Green (4.5 feet, MAN). Chris Bird misses. Rebound secured by Bradley Simmons.

[02:10] Team_033 possession (Score: 21-14)
Desmond DeRozan drives to the basket... Desmond DeRozan throws a bad pass! Stolen by Kawhi Thompson! TURNOVER! (live ball)

[01:54] Team_062 possession (Score: 21-14)
Jalen Reaves drives and kicks out. RJ Williamson attempts a 3Pt. Contested by Joel Green (4.6 feet, ZONE). RJ Williamson misses. Rebound secured by Cade Randle.

[01:43] Team_033 possession (Score: 21-14)
Bradley Simmons attempts a 3Pt. Contested by RJ Williamson (4.6 feet, ZONE). Bradley Simmons misses. Rebound secured by Michael Hyland.

[01:27] Team_062 possession (Score: 21-14)
Kawhi Thompson drives, Bradley Simmons stays with him. Kawhi Thompson attempts a Dunk. Contested by Bradley Simmons (3.5 feet, ZONE). KAWHI THOMPSON MAKES IT! Assist: Michael Hyland
Score: 23-14

[01:10] Team_033 possession (Score: 23-14)
Cade Randle drives to the basket... Cade Randle throws a bad pass out of bounds! TURNOVER! (dead ball)

[01:10] Substitution (Team_062): Chris Bird OUT → Paolo McCollum IN (stamina_rule2)

[01:10] Substitution (Team_062): RJ Williamson OUT → Tony LaVine IN (stamina_rule2)

[01:10] Substitution (Team_062): Michael Hyland OUT → Paul Poole IN (stamina_rule2)

[01:10] Substitution (Team_062): Kawhi Thompson OUT → RJ Wall IN (stamina_rule2)

[01:10] Substitution (Team_062): Jalen Reaves OUT → Devin Young IN (stamina_rule2)

[01:10] Substitution (Team_033): Joel Green OUT → Ben Anthony IN (stamina_rule2)

[01:10] Substitution (Team_033): Chris Anunoby OUT → Manu Irving IN (stamina_rule2)

[01:10] Substitution (Team_033): Cade Randle OUT → Terry Jokic IN (stamina_rule2)

[01:10] Substitution (Team_033): Desmond DeRozan OUT → Zion Adebayo IN (stamina_rule2)

[01:10] Substitution (Team_033): Bradley Simmons OUT → Tim Griffin IN (stamina_rule2)

[00:56] Team_062 possession (Score: 23-14)
Paolo McCollum attempts a 3Pt. Contested by Ben Anthony (5.0 feet, MAN). PAOLO MCCOLLUM MAKES IT! Assist: RJ Wall
Score: 26-14

[00:43] Team_033 possession (Score: 26-14)
Zion Adebayo drives and kicks out. Ben Anthony attempts a 3Pt. Contested by Paolo McCollum (5.6 feet, ZONE). Ben Anthony misses. Rebound secured by RJ Wall.

[00:29] Team_062 possession (Score: 26-14)
Devin Young makes the Layup and draws the foul on Tim Griffin! And-1! Devin Young to the line for 1. [BONUS: 6 team fouls] (Tim Griffin: 1 personal fouls)   FT 1/1: GOOD Devin Young makes 1/1 from the line.
Score: 29-14

[00:17] Team_033 possession (Score: 29-14)
FOUL! Shooting foul on RJ Wall. Tim Griffin to the line for 2 free throws. [Team fouls: 4] (RJ Wall: 1 personal fouls)   FT 1/2: GOOD   FT 2/2: MISS Tim Griffin makes 1/2 from the line. Rebound secured by Paul Poole.
Score: 29-15

[00:03] Team_062 possession (Score: 29-15)
Tony LaVine drives, picks up Tim Griffin. Help arrives from Manu Irving! Tony LaVine attempts a Layup. Contested by Manu Irving (5.2 feet, ZONE). Tony LaVine misses. Offensive rebound by RJ Wall! RJ Wall kicks it out.

================================================================================
                              1ST QUARTER COMPLETE                              
================================================================================

1ST QUARTER SCORE: Team_062 29, Team_033 15

BOX SCORE:
================================================================================

Team_062
--------------------------------------------------------------------------------
Player                MIN  PTS  REB  AST  TO      FG   FG%      3P   3P%
--------------------------------------------------------------------------------
RJ Williamson          11    6    0    0   0   2/4    50.0     0/0   0.0
Jalen Reaves           11    5    5    1   0   2/5    40.0     0/0   0.0
Chris Bird             11    5    0    0   0   2/2   100.0     0/0   0.0
Kawhi Thompson         11    4    3    1   0   2/6    33.3     0/0   0.0
Michael Hyland         11    3    2    2   0   1/3    33.3     0/0   0.0
Paolo McCollum          1    3    0    0   0   1/1   100.0     0/0   0.0
Devin Young             1    3    0    0   0   1/1   100.0     0/0   0.0
RJ Wall                 1    0    2    1   0   0/0     0.0     0/0   0.0
Paul Poole              1    0    1    0   0   0/0     0.0     0/0   0.0

TEAM: FG: 11/22 (50.0%), 3PT: 4/8 (50.0%), REB: 13 (3 off, 10 def), AST: 5, TO: 0
TEAM FOULS: 4


Team_033
--------------------------------------------------------------------------------
Player                MIN  PTS  REB  AST  TO      FG   FG%      3P   3P%
--------------------------------------------------------------------------------
Cade Randle            11    4    5    1   0   2/5    40.0     0/0   0.0
Joel Green             11    3    0    2   0   1/2    50.0     0/0   0.0
Chris Anunoby          11    3    0    0   0   1/4    25.0     0/0   0.0
Bradley Simmons        11    2    2    0   0   1/2    50.0     0/0   0.0
Desmond DeRozan        11    0    3    0   0   0/1     0.0     0/0   0.0
Zion Adebayo            1    0    0    0   0   0/1     0.0     0/0   0.0
Tim Griffin             1    0    0    0   0   0/1     0.0     0/0   0.0

TEAM: FG: 5/16 (31.2%), 3PT: 2/8 (25.0%), REB: 10 (1 off, 9 def), AST: 3, TO: 6
TEAM FOULS: 6 [Team_062 in BONUS]

================================================================================

================================================================================
                       2ND QUARTER - Team_062 vs Team_033                       
================================================================================

[12:00] Team_062 possession (Score: 29-15)
Chris Bird attempts a Midrange. Contested by Joel Green (4.6 feet, MAN). CHRIS BIRD MAKES IT!
Score: 31-15

[11:50] Team_033 possession (Score: 31-15)
Desmond DeRozan drives and kicks out. Joel Green attempts a Midrange. Contested by Chris Bird (4.3 feet, MAN). Joel Green misses. Rebound secured by Kawhi Thompson.

[11:37] Team_062 possession (Score: 31-15)
FOUL! Reach-in foul on Bradley Simmons during the drive. [Team fouls: 1] No free throws, side out. (Bradley Simmons: 1 personal fouls)

[11:23] Team_062 possession (Score: 31-15)
Michael Hyland attempts a 3Pt. Contested by Cade Randle (3.1 feet, MAN). Michael Hyland misses. Rebound secured by Cade Randle.

[11:13] Team_033 possession (Score: 31-15)
Cade Randle attempts a 3Pt. Contested by Michael Hyland (5.4 feet, MAN). Cade Randle misses. Rebound secured by Jalen Reaves.

[10:59] Team_062 possession (Score: 31-15)
RJ Williamson makes the Layup and draws the foul on Bradley Simmons! And-1! RJ Williamson to the line for 1. [Team fouls: 2] (Bradley Simmons: 2 personal fouls)   FT 1/1: GOOD RJ Williamson makes 1/1 from the line.
Score: 34-15

[10:46] Team_033 possession (Score: 34-15)
Bradley Simmons drives, Jalen Reaves stays with him. Bradley Simmons attempts a Dunk. Contested by Jalen Reaves (5.1 feet, MAN). Bradley Simmons misses. Rebound secured by Kawhi Thompson.

[10:27] Team_062 possession (Score: 34-15)
Jalen Reaves throws a bad pass! Stolen by Bradley Simmons! TURNOVER! (live ball)

[10:16] Team_033 possession (Score: 34-15)
Cade Randle attempts a Midrange. Contested by Michael Hyland (5.5 feet, MAN). CADE RANDLE MAKES IT!
Score: 34-17

[10:00] Team_062 possession (Score: 34-17)
Jalen Reaves drives to the basket... Jalen Reaves throws a bad pass out of bounds! TURNOVER! (dead ball)

[10:00] Substitution (Team_062): Chris Bird OUT → Paolo McCollum IN (stamina_rule2)

[10:00] Substitution (Team_062): RJ Williamson OUT → Tony LaVine IN (stamina_rule2)

[10:00] Substitution (Team_062): Michael Hyland OUT → Paul Poole IN (stamina_rule2)

[10:00] Substitution (Team_062): Kawhi Thompson OUT → RJ Wall IN (stamina_rule2)

[10:00] Substitution (Team_062): Jalen Reaves OUT → Devin Young IN (stamina_rule2)

[10:00] Substitution (Team_033): Joel Green OUT → Ben Anthony IN (stamina_rule2)

[10:00] Substitution (Team_033): Chris Anunoby OUT → Manu Irving IN (stamina_rule2)

[10:00] Substitution (Team_033): Desmond DeRozan OUT → Zion Adebayo IN (stamina_rule2)

[10:00] Substitution (Team_033): Bradley Simmons OUT → Tim Griffin IN (stamina_rule2)

[09:40] Team_033 possession (Score: 34-17)
Cade Randle attempts a 3Pt. Wide open! Paolo McCollum is 6.0 feet away. [ZONE] Cade Randle misses. Rebound secured by Paul Poole.

[09:23] Team_062 possession (Score: 34-17)
RJ Wall loses the ball! Stripped by Zion Adebayo! TURNOVER! (live ball)

[09:10] Team_033 possession (Score: 34-17)
Cade Randle attempts a 3Pt. Wide open! Paul Poole is 6.8 feet away. [MAN] Cade Randle misses. Rebound secured by Devin Young.

[08:56] Team_062 possession (Score: 34-17)
FOUL! Shooting foul on Manu Irving. Paul Poole to the line for 3 free throws. [Team fouls: 3] (Manu Irving: 1 personal fouls)   FT 1/3: MISS   FT 2/3: GOOD   FT 3/3: MISS Paul Poole makes 1/3 from the line. Rebound secured by Cade Randle.
Score: 35-17

[08:39] Team_033 possession (Score: 35-17)
Cade Randle throws a bad pass out of bounds! TURNOVER! (dead ball)

[08:39] Substitution (Team_033): Cade Randle OUT → Terry Jokic IN (stamina_rule2)

[08:26] Team_062 possession (Score: 35-17)
RJ Wall attempts a 3Pt. Contested by Ben Anthony (4.7 feet, ZONE). RJ Wall misses. Rebound secured by Zion Adebayo.

[08:13] Team_033 possession (Score: 35-17)
Manu Irving drives and kicks out. Manu Irving attempts a 3Pt. Contested by Tony LaVine (5.9 feet, MAN). MANU IRVING MAKES IT! Assist: Ben Anthony
Score: 35-20

[08:03] Team_062 possession (Score: 35-20)
Paolo McCollum attempts a Midrange. Contested by Ben Anthony (5.0 feet, MAN). Paolo McCollum misses. Rebound secured by Tim Griffin.

[07:48] Team_033 possession (Score: 35-20)
Ben Anthony attempts a 3Pt. Wide open! Paolo McCollum is 6.1 feet away. [ZONE] BEN ANTHONY MAKES IT! Assist: Terry Jokic
Score: 35-23

[07:29] Team_062 possession (Score: 35-23)
Paolo McCollum attempts a 3Pt. Contested by Ben Anthony (5.0 feet, MAN). Paolo McCollum misses. Rebound secured by Zion Adebayo.

[07:16] Team_033 possession (Score: 35-23)
Zion Adebayo drives, picks up RJ Wall. Help arrives from Paolo McCollum! Zion Adebayo attempts a Layup. Contested by Paolo McCollum (5.3 feet, ZONE). Zion Adebayo misses. Rebound secured by RJ Wall.

[07:01] Team_062 possession (Score: 35-23)
Tony LaVine attempts a Layup. Contested by Manu Irving (5.0 feet, MAN). TONY LAVINE MAKES IT!
Score: 37-23

[06:48] Team_033 possession (Score: 37-23)
Tim Griffin attempts a Layup. Wide open! Devin Young is 6.1 feet away. [MAN] TIM GRIFFIN MAKES IT!
Score: 37-25

[06:32] Team_062 possession (Score: 37-25)
Paul Poole attempts a Midrange. Contested by Manu Irving (4.7 feet, ZONE). Paul Poole misses. Rebound secured by Tim Griffin.

[06:18] Team_033 possession (Score: 37-25)
Tim Griffin attempts a 3Pt. Contested by Paolo McCollum (5.7 feet, ZONE). Tim Griffin misses. Rebound secured by Devin Young.

[06:04] Team_062 possession (Score: 37-25)
Devin Young attempts a Midrange. Contested by Tim Griffin (5.3 feet, MAN). Devin Young misses. Rebound secured by Tim Griffin.

[05:50] Team_033 possession (Score: 37-25)
Manu Irving attempts a Midrange. Wide open! Devin Young is 6.1 feet away. [ZONE] MANU IRVING MAKES IT! Assist: Tim Griffin
Score: 37-27

[05:34] Team_062 possession (Score: 37-27)
Paolo McCollum attempts a Midrange. Contested by Manu Irving (4.9 feet, ZONE). PAOLO MCCOLLUM MAKES IT! Assist: RJ Wall
Score: 39-27

[05:18] Team_033 possession (Score: 39-27)
Manu Irving drives, picks up Tony LaVine. Help arrives from Paolo McCollum! Manu Irving attempts a Layup. Contested by Paolo McCollum (6.0 feet, MAN). MANU IRVING MAKES IT! Assist: Zion Adebayo
Score: 39-29

[04:59] Team_062 possession (Score: 39-29)
FOUL! Holding foul on Zion Adebayo. [Team fouls: 4] No free throws, side out. (Zion Adebayo: 1 personal fouls)

[04:47] Team_062 possession (Score: 39-29)
Paolo McCollum attempts a 3Pt. Contested by Ben Anthony (5.0 feet, ZONE). Paolo McCollum misses. Rebound secured by Terry Jokic.

[04:34] Team_033 possession (Score: 39-29)
Tim Griffin attempts a Midrange. Wide open! Devin Young is 6.1 feet away. [MAN] TIM GRIFFIN MAKES IT!
Score: 39-31

[04:23] Team_062 possession (Score: 39-31)
Paolo McCollum attempts a 3Pt. Contested by Manu Irving (4.9 feet, ZONE). Paolo McCollum misses. Offensive rebound by Devin Young! Devin Young kicks it out.

[04:03] Team_062 possession (Score: 39-31)
Paolo McCollum drives to the basket... Paolo McCollum throws a bad pass out of bounds! TURNOVER! (dead ball)

[03:48] Team_033 possession (Score: 39-31)
Zion Adebayo attempts a Layup. Contested by RJ Wall (5.3 feet, ZONE). Zion Adebayo misses. Rebound secured by Devin Young.

[03:34] Team_062 possession (Score: 39-31)
FOUL! Shooting foul on Ben Anthony. Paolo McCollum to the line for 2 free throws. [BONUS: 5 team fouls] (Ben Anthony: 1 personal fouls)   FT 1/2: GOOD   FT 2/2: MISS Paolo McCollum makes 1/2 from the line. Rebound secured by Zion Adebayo.
Score: 40-31

[03:19] Team_033 possession (Score: 40-31)
Ben Anthony makes the Layup and draws the foul on RJ Wall! And-1! Ben Anthony to the line for 1. [Team fouls: 1] (RJ Wall: 1 personal fouls)   FT 1/1: GOOD Ben Anthony makes 1/1 from the line.
Score: 40-34

[03:08] Team_062 possession (Score: 40-34)
Tony LaVine drives, picks up Manu Irving. Help arrives from Terry Jokic! Tony LaVine attempts a Dunk. Contested by Terry Jokic (5.1 feet, MAN). Tony LaVine misses. Offensive rebound by Devin Young! Devin Young kicks it out.

[02:54] Team_062 possession (Score: 40-34)
Devin Young drives to the basket... Devin Young throws a bad pass! Stolen by Tim Griffin! TURNOVER! (live ball)

[02:36] Team_033 possession (Score: 40-34)
Manu Irving attempts a Midrange. Wide open! Paul Poole is 6.4 feet away. [ZONE] MANU IRVING MAKES IT! Assist: Zion Adebayo
Score: 40-36

[02:18] Team_062 possession (Score: 40-36)
Paul Poole drives, picks up Tim Griffin. Help arrives from Manu Irving! Paul Poole attempts a Dunk. Contested by Manu Irving (5.0 feet, ZONE). PAUL POOLE MAKES IT! Assist: Tony LaVine
Score: 42-36

[02:05] Team_033 possession (Score: 42-36)
Ben Anthony drives, picks up Paolo McCollum. Help arrives from Paul Poole! Ben Anthony attempts a Layup. Wide open! Paul Poole is 6.2 feet away. [MAN] BEN ANTHONY MAKES IT!
Score: 42-38

[01:50] Team_062 possession (Score: 42-38)
Tony LaVine drives to the basket... Tony LaVine throws a bad pass! Stolen by Tim Griffin! TURNOVER! (live ball)

[01:38] Team_033 possession (Score: 42-38)
Ben Anthony makes the Layup and draws the foul on RJ Wall! And-1! Ben Anthony to the line for 1. [Team fouls: 2] (RJ Wall: 2 personal fouls)   FT 1/1: MISS Ben Anthony makes 0/1 from the line. Rebound secured by RJ Wall.
Score: 42-40

[01:25] Team_062 possession (Score: 42-40)
Paolo McCollum drives to the basket... Paolo McCollum throws a bad pass! Stolen by Ben Anthony! TURNOVER! (live ball)

[01:12] Team_033 possession (Score: 42-40)
Tim Griffin attempts a Midrange. Wide open! Devin Young is 6.4 feet away. [MAN] Tim Griffin misses. Rebound secured by Paul Poole.

[00:57] Team_062 possession (Score: 42-40)
Paul Poole attempts a Midrange. Contested by Terry Jokic (4.0 feet, MAN). Paul Poole misses. Rebound secured by Tim Griffin.

[00:43] Team_033 possession (Score: 42-40)
FOUL! Holding foul on RJ Wall. [Team fouls: 3] No free throws, side out. (RJ Wall: 3 personal fouls)

[00:31] Team_033 possession (Score: 42-40)
Manu Irving drives to the basket... Manu Irving commits a violation (traveling/carry)! TURNOVER! (dead ball)

[00:20] Team_062 possession (Score: 42-40)
Paul Poole drives and kicks out. RJ Wall attempts a Midrange. Contested by Zion Adebayo (4.9 feet, MAN). RJ WALL MAKES IT! Assist: Tony LaVine
Score: 44-40

[00:04] Team_033 possession (Score: 44-40)
Manu Irving drives and kicks out. Ben Anthony attempts a 3Pt. Contested by Paolo McCollum (5.9 feet, MAN). Ben Anthony misses. Rebound secured by RJ Wall.

================================================================================
                              2ND QUARTER COMPLETE                              
================================================================================

2ND QUARTER SCORE: Team_062 15, Team_033 25

BOX SCORE:
================================================================================

Team_062
--------------------------------------------------------------------------------
Player                MIN  PTS  REB  AST  TO      FG   FG%      3P   3P%
--------------------------------------------------------------------------------
RJ Williamson          13    3    0    0   0   1/1   100.0     0/0   0.0
Chris Bird             13    2    0    0   0   1/1   100.0     0/0   0.0
Paul Poole             11    2    2    0   0   1/4    25.0     0/0   0.0
RJ Wall                11    2    3    1   0   1/2    50.0     0/0   0.0
Paolo McCollum         11    2    0    0   0   1/5    20.0     0/0   0.0
Tony LaVine            11    2    0    2   0   1/1   100.0     0/0   0.0
Kawhi Thompson         13    0    2    0   0   0/0     0.0     0/0   0.0
Michael Hyland         13    0    0    0   0   0/1     0.0     0/0   0.0
Jalen Reaves           13    0    1    0   0   0/0     0.0     0/0   0.0
Devin Young            11    0    5    0   0   0/1     0.0     0/0   0.0

TEAM: FG: 6/16 (37.5%), 3PT: 0/5 (0.0%), REB: 13 (2 off, 11 def), AST: 3, TO: 7
TEAM FOULS: 3


Team_033
--------------------------------------------------------------------------------
Player                MIN  PTS  REB  AST  TO      FG   FG%      3P   3P%
--------------------------------------------------------------------------------
Manu Irving            11    9    0    0   0   4/5    80.0     0/0   0.0
Ben Anthony            11    8    0    1   0   3/4    75.0     0/0   0.0
Tim Griffin            11    4    4    1   0   2/4    50.0     0/0   0.0
Cade Randle            15    2    2    0   0   1/4    25.0     0/0   0.0
Desmond DeRozan        13    0    0    0   0   0/1     0.0     0/0   0.0
Bradley Simmons        13    0    0    0   0   0/1     0.0     0/0   0.0
Zion Adebayo           11    0    3    2   0   0/2     0.0     0/0   0.0
Terry Jokic            10    0    1    1   0   0/0     0.0     0/0   0.0

TEAM: FG: 10/21 (47.6%), 3PT: 1/5 (20.0%), REB: 10 (0 off, 10 def), AST: 5, TO: 2
TEAM FOULS: 5 [Team_062 in BONUS]

================================================================================

================================================================================
                       3RD QUARTER - Team_062 vs Team_033                       
================================================================================

[12:00] Team_062 possession (Score: 44-40)
Kawhi Thompson makes the Dunk and draws the foul on Chris Anunoby! And-1! Kawhi Thompson to the line for 1. [Team fouls: 1] (Chris Anunoby: 1 personal fouls)   FT 1/1: GOOD Kawhi Thompson makes 1/1 from the line.
Score: 47-40

[11:41] Team_033 possession (Score: 47-40)
Chris Anunoby attempts a Midrange. Contested by RJ Williamson (4.3 feet, MAN). Chris Anunoby misses. Rebound secured by Michael Hyland.

[11:29] Team_062 possession (Score: 47-40)
Michael Hyland attempts a 3Pt. Contested by Joel Green (4.2 feet, ZONE). Michael Hyland misses. Offensive rebound by Jalen Reaves! Jalen Reaves's putback is no good. Offensive rebound by Jalen Reaves! Jalen Reaves kicks it out.

[11:15] Team_062 possession (Score: 47-40)
Michael Hyland commits a violation (traveling/carry)! TURNOVER! (dead ball)

[10:56] Team_033 possession (Score: 47-40)
Bradley Simmons drives, Jalen Reaves stays with him. Bradley Simmons attempts a Dunk. Contested by Jalen Reaves (4.8 feet, MAN). BRADLEY SIMMONS MAKES IT!
Score: 47-42

[10:39] Team_062 possession (Score: 47-42)
Jalen Reaves attempts a Layup. Contested by Bradley Simmons (3.2 feet, MAN). JALEN REAVES MAKES IT!
Score: 49-42

[10:23] Team_033 possession (Score: 49-42)
Cade Randle drives, picks up Jalen Reaves. Help arrives from Chris Bird! Cade Randle attempts a Dunk. Contested by Chris Bird (5.5 feet, ZONE). Cade Randle misses. Rebound secured by Kawhi Thompson.

[10:09] Team_062 possession (Score: 49-42)
Michael Hyland attempts a Layup. Contested by Bradley Simmons (3.0 feet, ZONE). MICHAEL HYLAND MAKES IT! Assist: Chris Bird
Score: 51-42

[09:55] Team_033 possession (Score: 51-42)
Desmond DeRozan attempts a Midrange. Contested by Kawhi Thompson (4.9 feet, MAN). DESMOND DEROZAN MAKES IT! Assist: Bradley Simmons
Score: 51-44

[09:44] Team_062 possession (Score: 51-44)
Kawhi Thompson attempts a Midrange. Contested by Chris Anunoby (3.9 feet, ZONE). KAWHI THOMPSON MAKES IT! Assist: RJ Williamson
Score: 53-44

[09:29] Team_033 possession (Score: 53-44)
Joel Green attempts a 3Pt. Contested by RJ Williamson (4.7 feet, ZONE). Joel Green misses. Rebound secured by Kawhi Thompson.

[09:11] Team_062 possession (Score: 53-44)
FOUL! Shooting foul on Bradley Simmons. Kawhi Thompson to the line for 2 free throws. [Team fouls: 2] (Bradley Simmons: 1 personal fouls)   FT 1/2: GOOD   FT 2/2: MISS Kawhi Thompson makes 1/2 from the line. Rebound secured by Bradley Simmons.
Score: 54-44

[08:58] Team_033 possession (Score: 54-44)
Joel Green drives and kicks out. Bradley Simmons attempts a 3Pt. Contested by Jalen Reaves (4.9 feet, MAN). Bradley Simmons misses. Rebound secured by Jalen Reaves.

[08:41] Team_062 possession (Score: 54-44)
Kawhi Thompson makes the Midrange and draws the foul on Desmond DeRozan! And-1! Kawhi Thompson to the line for 1. [Team fouls: 3] (Desmond DeRozan: 1 personal fouls)   FT 1/1: MISS Kawhi Thompson makes 0/1 from the line. Rebound secured by Bradley Simmons.
Score: 56-44

[08:28] Team_033 possession (Score: 56-44)
Desmond DeRozan attempts a 3Pt. Contested by RJ Williamson (4.4 feet, ZONE). Desmond DeRozan misses. Rebound secured by Jalen Reaves.

[08:16] Team_062 possession (Score: 56-44)
Kawhi Thompson attempts a 3Pt. Contested by Joel Green (4.3 feet, ZONE). Kawhi Thompson misses. Offensive rebound by Kawhi Thompson! Kawhi Thompson kicks it out.

[08:03] Team_062 possession (Score: 56-44)
FOUL! Reach-in foul on Bradley Simmons during the drive. [Team fouls: 4] No free throws, side out. (Bradley Simmons: 2 personal fouls)

[07:45] Team_062 possession (Score: 56-44)
Jalen Reaves attempts a Layup. Contested by Bradley Simmons (3.2 feet, MAN). Jalen Reaves misses. Rebound secured by Bradley Simmons.

[07:30] Team_033 possession (Score: 56-44)
Bradley Simmons attempts a Midrange. Contested by Michael Hyland (4.6 feet, ZONE). Bradley Simmons misses. Rebound secured by Michael Hyland.

[07:17] Team_062 possession (Score: 56-44)
RJ Williamson attempts a 3Pt. Contested by Chris Anunoby (3.6 feet, MAN). RJ Williamson misses. Rebound secured by Desmond DeRozan.

[07:00] Team_033 possession (Score: 56-44)
Desmond DeRozan makes the 3Pt and draws the foul on RJ Williamson! And-1! Desmond DeRozan to the line for 1. [Team fouls: 1] (RJ Williamson: 1 personal fouls)   FT 1/1: GOOD Desmond DeRozan makes 1/1 from the line.
Score: 56-48

[06:45] Team_062 possession (Score: 56-48)
FOUL! Shooting foul on Bradley Simmons. Jalen Reaves to the line for 2 free throws. [BONUS: 5 team fouls] (Bradley Simmons: 3 personal fouls)   FT 1/2: GOOD   FT 2/2: GOOD Jalen Reaves makes 2/2 from the line.
Score: 58-48

[06:29] Team_033 possession (Score: 58-48)
Cade Randle attempts a 3Pt. Contested by RJ Williamson (4.9 feet, ZONE). Cade Randle misses. Offensive rebound by Desmond DeRozan! Desmond DeRozan kicks it out.

[06:18] Team_033 possession (Score: 58-48)
Bradley Simmons drives, Jalen Reaves stays with him. Bradley Simmons attempts a Dunk. Contested by Jalen Reaves (4.8 feet, MAN). BRADLEY SIMMONS MAKES IT!
Score: 58-50

[06:02] Team_062 possession (Score: 58-50)
Chris Bird drives, picks up Bradley Simmons. Help arrives from Chris Anunoby! Chris Bird attempts a Layup. Contested by Chris Anunoby (3.2 feet, ZONE). Chris Bird misses. Rebound secured by Cade Randle.

[05:50] Team_033 possession (Score: 58-50)
FOUL! Reach-in foul on Kawhi Thompson during the drive. [Team fouls: 2] No free throws, side out. (Kawhi Thompson: 1 personal fouls)

[05:37] Team_033 possession (Score: 58-50)
Desmond DeRozan attempts a Layup. Contested by Kawhi Thompson (4.9 feet, MAN). DESMOND DEROZAN MAKES IT! Assist: Bradley Simmons
Score: 58-52

[05:21] Team_062 possession (Score: 58-52)
Kawhi Thompson attempts a Layup. Contested by Desmond DeRozan (4.8 feet, MAN). KAWHI THOMPSON MAKES IT! Assist: Chris Bird
Score: 60-52

[05:09] Team_033 possession (Score: 60-52)
Chris Anunoby drives to the basket... FOUL! Offensive foul on Chris Anunoby! Jalen Reaves drew the charge! [Team fouls: 6] (Chris Anunoby: 2 personal fouls) TURNOVER! (dead ball)

[04:57] Team_062 possession (Score: 60-52)
Michael Hyland attempts a 3Pt. Contested by Joel Green (4.3 feet, ZONE). Michael Hyland misses. Rebound secured by Cade Randle.

[04:43] Team_033 possession (Score: 60-52)
Bradley Simmons drives, Jalen Reaves stays with him. Bradley Simmons attempts a Layup. Contested by Jalen Reaves (4.9 feet, MAN). BRADLEY SIMMONS MAKES IT!
Score: 60-54

[04:29] Team_062 possession (Score: 60-54)
FOUL! Reach-in foul on Bradley Simmons during the drive. [IN THE BONUS! 7 team fouls] Jalen Reaves to the line for 2 free throws. (Bradley Simmons: 4 personal fouls)   FT 1/2: GOOD   FT 2/2: GOOD Jalen Reaves makes 2/2 from the line.
Score: 62-54

[04:16] Team_033 possession (Score: 62-54)
Cade Randle attempts a 3Pt. Contested by RJ Williamson (5.0 feet, ZONE). Cade Randle misses. Offensive rebound by Cade Randle! Cade Randle's putback is no good. Rebound secured by Kawhi Thompson.

[04:00] Team_062 possession (Score: 62-54)
RJ Williamson throws a bad pass! Stolen by Chris Anunoby! TURNOVER! (live ball)

[03:41] Team_033 possession (Score: 62-54)
Cade Randle makes the Layup and draws the foul on Jalen Reaves! And-1! Cade Randle to the line for 1. [Team fouls: 3] (Jalen Reaves: 1 personal fouls)   FT 1/1: GOOD Cade Randle makes 1/1 from the line.
Score: 62-57

[03:26] Team_062 possession (Score: 62-57)
Chris Bird attempts a 3Pt. Contested by Joel Green (4.6 feet, ZONE). Chris Bird misses. Rebound secured by Desmond DeRozan.

[03:12] Team_033 possession (Score: 62-57)
Bradley Simmons attempts a Layup. Contested by Jalen Reaves (5.0 feet, ZONE). BRADLEY SIMMONS MAKES IT!
Score: 62-59

[02:59] Team_062 possession (Score: 62-59)
Jalen Reaves attempts a Layup. Contested by Bradley Simmons (3.5 feet, ZONE). Jalen Reaves misses. Offensive rebound by Jalen Reaves! Jalen Reaves kicks it out.

[02:48] Team_062 possession (Score: 62-59)
Chris Bird attempts a 3Pt. Contested by Joel Green (4.7 feet, MAN). Chris Bird misses. Rebound secured by Bradley Simmons.

[02:35] Team_033 possession (Score: 62-59)
Chris Anunoby drives, RJ Williamson stays with him. Chris Anunoby attempts a Dunk. Contested by RJ Williamson (4.5 feet, MAN). Chris Anunoby misses. Rebound secured by Kawhi Thompson.

[02:19] Team_062 possession (Score: 62-59)
RJ Williamson attempts a Layup. BLOCKED BY CADE RANDLE! Ball is loose! Rebound secured by Cade Randle.

[02:08] Team_033 possession (Score: 62-59)
Cade Randle attempts a 3Pt. Contested by Michael Hyland (5.4 feet, MAN). CADE RANDLE MAKES IT! Assist: Desmond DeRozan
Score: 62-62

[01:53] Team_062 possession (Score: 62-62)
Kawhi Thompson attempts a Midrange. Contested by Desmond DeRozan (5.2 feet, MAN). Kawhi Thompson misses. Rebound secured by Cade Randle.

[01:41] Team_033 possession (Score: 62-62)
Desmond DeRozan attempts a Layup. Contested by Kawhi Thompson (5.2 feet, MAN). DESMOND DEROZAN MAKES IT! Assist: Chris Anunoby
Score: 62-64

[01:29] Team_062 possession (Score: 62-64)
Jalen Reaves attempts a Midrange. Contested by Bradley Simmons (3.7 feet, MAN). Jalen Reaves misses. Rebound secured by Cade Randle.

[01:12] Team_033 possession (Score: 62-64)
Chris Anunoby attempts a 3Pt. Contested by RJ Williamson (4.7 feet, ZONE). CHRIS ANUNOBY MAKES IT!
Score: 62-67

[00:54] Team_062 possession (Score: 62-67)
Jalen Reaves drives and kicks out. RJ Williamson attempts a 3Pt. Contested by Chris Anunoby (4.4 feet, MAN). RJ Williamson misses. Rebound secured by Bradley Simmons.

[00:41] Team_033 possession (Score: 62-67)
Chris Anunoby attempts a 3Pt. Contested by RJ Williamson (4.8 feet, MAN). Chris Anunoby misses. Offensive rebound by Bradley Simmons! Bradley Simmons's putback is no good. Rebound secured by Michael Hyland.

[00:23] Team_062 possession (Score: 62-67)
Jalen Reaves attempts a 3Pt. Contested by Joel Green (4.9 feet, ZONE). JALEN REAVES MAKES IT! Assist: Michael Hyland
Score: 65-67

[00:11] Team_033 possession (Score: 65-67)
Desmond DeRozan attempts a 3Pt. Contested by RJ Williamson (4.9 feet, ZONE). Desmond DeRozan misses. Offensive rebound by Cade Randle! Cade Randle puts it back in!
Score: 65-69

================================================================================
                              3RD QUARTER COMPLETE                              
================================================================================

3RD QUARTER SCORE: Team_062 21, Team_033 29

BOX SCORE:
================================================================================

Team_062
--------------------------------------------------------------------------------
Player                MIN  PTS  REB  AST  TO      FG   FG%      3P   3P%
--------------------------------------------------------------------------------
Jalen Reaves           25    9    4    0   0   4/7    57.1     0/0   0.0
Kawhi Thompson         25    7    5    0   0   3/6    50.0     0/0   0.0
Michael Hyland         25    2    3    1   0   1/2    50.0     0/0   0.0
Chris Bird             25    0    0    2   0   0/3     0.0     0/0   0.0
RJ Williamson          25    0    0    1   0   0/2     0.0     0/0   0.0

TEAM: FG: 8/20 (40.0%), 3PT: 1/5 (20.0%), REB: 10 (3 off, 7 def), AST: 4, TO: 2
TEAM FOULS: 3


Team_033
--------------------------------------------------------------------------------
Player                MIN  PTS  REB  AST  TO      FG   FG%      3P   3P%
--------------------------------------------------------------------------------
Desmond DeRozan        25   10    3    1   0   4/5    80.0     0/0   0.0
Bradley Simmons        25    8    5    2   0   4/5    80.0     0/0   0.0
Cade Randle            27    8    6    0   0   3/5    60.0     0/0   0.0
Chris Anunoby          25    3    0    1   0   1/4    25.0     0/0   0.0
Joel Green             25    0    0    0   0   0/2     0.0     0/0   0.0

TEAM: FG: 12/21 (57.1%), 3PT: 4/8 (50.0%), REB: 16 (4 off, 12 def), AST: 4, TO: 1
TEAM FOULS: 7 [Team_062 in BONUS]

================================================================================

================================================================================
                       4TH QUARTER - Team_062 vs Team_033                       
================================================================================

[12:00] Team_062 possession (Score: 65-69)
Jalen Reaves attempts a Layup. BLOCKED BY BRADLEY SIMMONS! Ball goes out off Bradley Simmons. Jalen Reaves's ball!

[11:45] Team_062 possession (Score: 65-69)
Michael Hyland attempts a Midrange. Contested by Chris Anunoby (4.2 feet, ZONE). Michael Hyland misses. Rebound secured by Bradley Simmons.

[11:29] Team_033 possession (Score: 65-69)
Joel Green attempts a Midrange. Contested by RJ Williamson (5.0 feet, ZONE). Joel Green misses. Rebound secured by Kawhi Thompson.

[11:14] Team_062 possession (Score: 65-69)
FOUL! Shooting foul on Bradley Simmons. Chris Bird to the line for 2 free throws. [Team fouls: 1] (Bradley Simmons: 1 personal fouls)   FT 1/2: GOOD   FT 2/2: MISS Chris Bird makes 1/2 from the line. Rebound secured by Cade Randle.
Score: 66-69

[10:57] Team_033 possession (Score: 66-69)
Chris Anunoby attempts a Midrange. Contested by RJ Williamson (4.7 feet, MAN). CHRIS ANUNOBY MAKES IT!
Score: 66-71

[10:43] Team_062 possession (Score: 66-71)
Kawhi Thompson drives and kicks out. Kawhi Thompson attempts a 3Pt. Contested by Desmond DeRozan (5.3 feet, MAN). KAWHI THOMPSON MAKES IT! Assist: Chris Bird
Score: 69-71

[10:28] Team_033 possession (Score: 69-71)
Bradley Simmons commits a violation (traveling/carry)! TURNOVER! (dead ball)

[10:28] Substitution (Team_062): Chris Bird OUT → Paolo McCollum IN (stamina_rule2)

[10:28] Substitution (Team_062): RJ Williamson OUT → Tony LaVine IN (stamina_rule2)

[10:28] Substitution (Team_062): Michael Hyland OUT → Paul Poole IN (stamina_rule2)

[10:28] Substitution (Team_062): Kawhi Thompson OUT → RJ Wall IN (stamina_rule2)

[10:28] Substitution (Team_062): Jalen Reaves OUT → Devin Young IN (stamina_rule2)

[10:28] Substitution (Team_033): Joel Green OUT → Ben Anthony IN (stamina_rule2)

[10:28] Substitution (Team_033): Chris Anunoby OUT → Manu Irving IN (stamina_rule2)

[10:28] Substitution (Team_033): Cade Randle OUT → Terry Jokic IN (stamina_rule2)

[10:28] Substitution (Team_033): Desmond DeRozan OUT → Zion Adebayo IN (stamina_rule2)

[10:28] Substitution (Team_033): Bradley Simmons OUT → Tim Griffin IN (stamina_rule2)

[10:13] Team_062 possession (Score: 69-71)
Tony LaVine attempts a Midrange. Contested by Manu Irving (5.0 feet, ZONE). Tony LaVine misses. Rebound secured by Terry Jokic.

[09:59] Team_033 possession (Score: 69-71)
Zion Adebayo drives and kicks out. Tim Griffin attempts a 3Pt. Contested by Devin Young (6.0 feet, MAN). TIM GRIFFIN MAKES IT! Assist: Manu Irving
Score: 69-74

[09:44] Team_062 possession (Score: 69-74)
Tony LaVine attempts a 3Pt. Contested by Zion Adebayo (4.8 feet, ZONE). Tony LaVine misses. Rebound secured by Zion Adebayo.

[09:28] Team_033 possession (Score: 69-74)
Ben Anthony drives, picks up Paolo McCollum. Help arrives from Paul Poole! Ben Anthony attempts a Layup. Wide open! Paul Poole is 6.1 feet away. [MAN] BEN ANTHONY MAKES IT! Assist: Zion Adebayo
Score: 69-76

[09:14] Team_062 possession (Score: 69-76)
Devin Young attempts a Midrange. Contested by Tim Griffin (5.3 feet, MAN). DEVIN YOUNG MAKES IT!
Score: 71-76

[08:57] Team_033 possession (Score: 71-76)
Ben Anthony attempts a 3Pt. Wide open! Tony LaVine is 6.4 feet away. [ZONE] Ben Anthony misses. Rebound secured by RJ Wall.

[08:44] Team_062 possession (Score: 71-76)
Paul Poole attempts a 3Pt. Contested by Terry Jokic (3.9 feet, MAN). Paul Poole misses. Rebound secured by Zion Adebayo.

[08:28] Team_033 possession (Score: 71-76)
Terry Jokic attempts a 3Pt. Wide open! Paul Poole is 6.7 feet away. [MAN] Terry Jokic misses. Rebound secured by Paul Poole.

[08:14] Team_062 possession (Score: 71-76)
Paul Poole attempts a 3Pt. Contested by Ben Anthony (4.8 feet, ZONE). Paul Poole misses. Rebound secured by Tim Griffin.

[07:58] Team_033 possession (Score: 71-76)
Terry Jokic attempts a 3Pt. Wide open! Paul Poole is 6.7 feet away. [MAN] TERRY JOKIC MAKES IT!
Score: 71-79

[07:42] Team_062 possession (Score: 71-79)
RJ Wall attempts a 3Pt. Contested by Ben Anthony (4.7 feet, ZONE). RJ Wall misses. Rebound secured by Tim Griffin.

[07:29] Team_033 possession (Score: 71-79)
Terry Jokic attempts a Midrange. Wide open! Paul Poole is 6.7 feet away. [MAN] Terry Jokic misses. Offensive rebound by Terry Jokic! Terry Jokic kicks it out.

[07:10] Team_033 possession (Score: 71-79)
Terry Jokic drives and kicks out. Tim Griffin attempts a Midrange. Contested by Devin Young (6.0 feet, MAN). Tim Griffin misses. Rebound secured by RJ Wall.

[06:54] Team_062 possession (Score: 71-79)
Paul Poole drives, Tim Griffin stays with him. Paul Poole attempts a Dunk. Contested by Tim Griffin (4.9 feet, ZONE). PAUL POOLE MAKES IT! Assist: Paolo McCollum
Score: 73-79

[06:44] Team_033 possession (Score: 73-79)
Ben Anthony attempts a Midrange. Wide open! Tony LaVine is 6.4 feet away. [ZONE] BEN ANTHONY MAKES IT! Assist: Terry Jokic
Score: 73-81

[06:31] Team_062 possession (Score: 73-81)
Devin Young attempts a Midrange. Contested by Zion Adebayo (4.9 feet, ZONE). Devin Young misses. Rebound secured by Tim Griffin.

[06:18] Team_033 possession (Score: 73-81)
Zion Adebayo attempts a 3Pt. Contested by Paolo McCollum (5.7 feet, ZONE). Zion Adebayo misses. Rebound secured by Paul Poole.

[06:01] Team_062 possession (Score: 73-81)
Paolo McCollum drives, Tim Griffin stays with him. Paolo McCollum attempts a Layup. Contested by Tim Griffin (5.1 feet, ZONE). PAOLO MCCOLLUM MAKES IT! Assist: Devin Young
Score: 75-81

[05:52] Team_033 possession (Score: 75-81)
Tim Griffin drives, Devin Young stays with him. Tim Griffin attempts a Dunk. Wide open! Devin Young is 6.1 feet away. [MAN] TIM GRIFFIN MAKES IT!
Score: 75-83

[05:39] Team_062 possession (Score: 75-83)
Devin Young throws a bad pass out of bounds! TURNOVER! (dead ball)

[05:25] Team_033 possession (Score: 75-83)
FOUL! Shooting foul on Paolo McCollum. Manu Irving to the line for 3 free throws. [Team fouls: 1] (Paolo McCollum: 1 personal fouls)   FT 1/3: GOOD   FT 2/3: GOOD   FT 3/3: GOOD Manu Irving makes 3/3 from the line.
Score: 75-86

[05:09] Team_062 possession (Score: 75-86)
Paul Poole throws a bad pass! Stolen by Terry Jokic! TURNOVER! (live ball)

[04:56] Team_033 possession (Score: 75-86)
FOUL! Holding foul on Paul Poole. [Team fouls: 2] No free throws, side out. (Paul Poole: 1 personal fouls)

[04:40] Team_033 possession (Score: 75-86)
Terry Jokic attempts a 3Pt. Wide open! Paul Poole is 6.7 feet away. [MAN] TERRY JOKIC MAKES IT! Assist: Zion Adebayo
Score: 75-89

[04:26] Team_062 possession (Score: 75-89)
Devin Young drives to the basket... Devin Young loses control! Ball rolls out of bounds! TURNOVER! (dead ball)

[04:08] Team_033 possession (Score: 75-89)
Zion Adebayo drives, RJ Wall stays with him. Zion Adebayo attempts a Dunk. Contested by RJ Wall (5.3 feet, ZONE). ZION ADEBAYO MAKES IT!
Score: 75-91

[03:59] Team_062 possession (Score: 75-91)
Devin Young drives to the basket... FOUL! Offensive foul on Devin Young! Tim Griffin drew the charge! [Team fouls: 3] (Devin Young: 1 personal fouls) TURNOVER! (dead ball)

[03:44] Team_033 possession (Score: 75-91)
Zion Adebayo makes the Layup and draws the foul on RJ Wall! And-1! Zion Adebayo to the line for 1. [Team fouls: 4] (RJ Wall: 1 personal fouls)   FT 1/1: GOOD Zion Adebayo makes 1/1 from the line.
Score: 75-94

[03:29] Team_062 possession (Score: 75-94)
RJ Wall drives, picks up Zion Adebayo. Help arrives from Manu Irving! RJ Wall attempts a Dunk. Contested by Manu Irving (4.4 feet, MAN). RJ Wall misses. Rebound secured by Terry Jokic.

[03:15] Team_033 possession (Score: 75-94)
Ben Anthony attempts a Midrange. Wide open! Paolo McCollum is 6.1 feet away. [MAN] Ben Anthony misses. Rebound secured by Devin Young.

[02:59] Team_062 possession (Score: 75-94)
Paul Poole attempts a Layup. Contested by Terry Jokic (3.9 feet, MAN). PAUL POOLE MAKES IT! Assist: Devin Young
Score: 77-94

[02:42] Team_033 possession (Score: 77-94)
FOUL! Holding foul on Tony LaVine. [IN THE BONUS! 5 team fouls] Manu Irving to the line for 2 free throws. (Tony LaVine: 1 personal fouls)   FT 1/2: GOOD   FT 2/2: GOOD Manu Irving makes 2/2 from the line.
Score: 77-96

[02:25] Team_062 possession (Score: 77-96)
Paolo McCollum drives to the basket... Paolo McCollum loses control! Ball rolls out of bounds! TURNOVER! (dead ball)

[02:08] Team_033 possession (Score: 77-96)
Ben Anthony drives, picks up Paolo McCollum. Help arrives from Paul Poole! Ben Anthony attempts a Dunk. Wide open! Paul Poole is 6.2 feet away. [MAN] BEN ANTHONY MAKES IT!
Score: 77-98

[01:53] Team_062 possession (Score: 77-98)
FOUL! Shooting foul on Ben Anthony. Paolo McCollum to the line for 3 free throws. [Team fouls: 2] (Ben Anthony: 1 personal fouls)   FT 1/3: GOOD   FT 2/3: GOOD   FT 3/3: GOOD Paolo McCollum makes 3/3 from the line.
Score: 80-98

[01:42] Team_033 possession (Score: 80-98)
Zion Adebayo attempts a Layup. Contested by RJ Wall (5.5 feet, MAN). ZION ADEBAYO MAKES IT! Assist: Manu Irving
Score: 80-100

[01:29] Team_062 possession (Score: 80-100)
Devin Young loses the ball! Stripped by Tim Griffin! TURNOVER! (live ball)

[01:15] Team_033 possession (Score: 80-100)
Ben Anthony attempts a 3Pt. Wide open! Paolo McCollum is 6.2 feet away. [ZONE] Ben Anthony misses. Rebound secured by RJ Wall.

[00:58] Team_062 possession (Score: 80-100)
RJ Wall attempts a Layup. Contested by Zion Adebayo (4.6 feet, MAN). RJ WALL MAKES IT!
Score: 82-100

[00:38] Team_033 possession (Score: 82-100)
Tim Griffin attempts a Midrange. Contested by RJ Wall (5.5 feet, ZONE). Tim Griffin misses. Rebound secured by Paul Poole.

[00:23] Team_062 possession (Score: 82-100)
Devin Young attempts a Midrange. Contested by Tim Griffin (5.4 feet, MAN). Devin Young misses. Rebound secured by Terry Jokic.

[00:11] Team_033 possession (Score: 82-100)
Tim Griffin commits a violation (traveling/carry)! TURNOVER! (dead ball)

================================================================================
                              4TH QUARTER COMPLETE                              
================================================================================

4TH QUARTER SCORE: Team_062 17, Team_033 31

BOX SCORE:
================================================================================

Team_062
--------------------------------------------------------------------------------
Player                MIN  PTS  REB  AST  TO      FG   FG%      3P   3P%
--------------------------------------------------------------------------------
Paolo McCollum         21    5    0    1   0   2/2   100.0     0/0   0.0
Paul Poole             21    4    3    0   0   2/4    50.0     0/0   0.0
Kawhi Thompson         27    3    1    0   0   1/1   100.0     0/0   0.0
Devin Young            21    2    1    2   0   1/3    33.3     0/0   0.0
RJ Wall                21    2    3    0   0   1/3    33.3     0/0   0.0
Michael Hyland         27    0    0    0   0   0/1     0.0     0/0   0.0
Chris Bird             27    0    0    1   0   0/1     0.0     0/0   0.0
Tony LaVine            21    0    0    0   0   0/2     0.0     0/0   0.0

TEAM: FG: 7/17 (41.2%), 3PT: 1/5 (20.0%), REB: 8 (0 off, 8 def), AST: 4, TO: 6
TEAM FOULS: 5 [Team_033 in BONUS]


Team_033
--------------------------------------------------------------------------------
Player                MIN  PTS  REB  AST  TO      FG   FG%      3P   3P%
--------------------------------------------------------------------------------
Zion Adebayo           21    7    2    2   0   3/4    75.0     0/0   0.0
Terry Jokic            20    6    4    1   0   2/4    50.0     0/0   0.0
Ben Anthony            21    6    0    0   0   3/6    50.0     0/0   0.0
Tim Griffin            21    5    3    0   0   2/3    66.7     0/0   0.0
Manu Irving            21    5    0    2   0   2/2   100.0     0/0   0.0
Chris Anunoby          27    2    0    0   0   1/1   100.0     0/0   0.0
Bradley Simmons        27    0    1    0   0   0/0     0.0     0/0   0.0
Joel Green             27    0    0    0   0   0/1     0.0     0/0   0.0
Cade Randle            28    0    1    0   0   0/0     0.0     0/0   0.0

TEAM: FG: 13/21 (61.9%), 3PT: 3/7 (42.9%), REB: 11 (1 off, 10 def), AST: 5, TO: 2
TEAM FOULS: 2

================================================================================

================================================================================
                               FULL GAME COMPLETE                               
================================================================================

FINAL SCORE: Team_062 82, Team_033 100

SCORING BY QUARTER:
--------------------------------------------------------------------------------
Team                     Q1     Q2     Q3     Q4    FINAL
--------------------------------------------------------------------------------
Team_062                 29     15     21     17       82
Team_033                 15     25     29     31      100
--------------------------------------------------------------------------------

FULL GAME BOX SCORE:
================================================================================

Team_062
--------------------------------------------------------------------------------
Player                MIN  PTS  REB  AST  TO      FG   FG%      3P   3P%      FT STL BLK
--------------------------------------------------------------------------------
Chris Bird             27    7    0    3   0   3/7    42.9   0/2     0.0   2/3     0   1
RJ Williamson          27    9    0    1   2   3/7    42.9   2/4    50.0   1/1     0   0
Michael Hyland         27    5    5    3   1   2/7    28.6   1/4    25.0   0/0     0   0
Kawhi Thompson         27   14   11    1   0   6/13   46.2   0/1     0.0   2/4     1   0
Jalen Reaves           27   14   10    1   1   6/12   50.0   1/2    50.0   7/7     2   0
Paolo McCollum         21   10    0    1   1   4/8    50.0   2/4    50.0   4/5     0   0
Tony LaVine            21    2    0    2   2   1/3    33.3   0/1     0.0   0/0     0   0
Paul Poole             21    6    6    0   3   4/9    44.4   0/3     0.0   1/3     0   0
RJ Wall                21    4    8    2   3   1/4    25.0   0/2     0.0   0/0     0   0
Devin Young            21    5    6    2   2   2/5    40.0   0/0     0.0   1/1     0   0

TEAM: FG: 32/75 (42.7%), 3PT: 6/23 (26.1%), REB: 44 (8 off, 36 def), AST: 16, TO: 15


Team_033
--------------------------------------------------------------------------------
Player                MIN  PTS  REB  AST  TO      FG   FG%      3P   3P%      FT STL BLK
--------------------------------------------------------------------------------
Cade Randle            28   14   14    1   3   4/12   33.3   1/6    16.7   1/1     0   1
Joel Green             27    3    0    2   2   1/5    20.0   1/2    50.0   0/1     0   0
Chris Anunoby          27    8    0    1   1   3/9    33.3   2/6    33.3   0/0     1   1
Desmond DeRozan        27   10    6    1   0   5/8    62.5   2/4    50.0   1/1     0   0
Bradley Simmons        27   10    8    2   3   6/9    66.7   0/1     0.0   0/0     1   3
Ben Anthony            21   14    0    1   1   6/10   60.0   1/3    33.3   1/2     1   0
Manu Irving            21   14    0    2   0   5/6    83.3   1/1   100.0   5/5     0   0
Zion Adebayo           21    7    5    4   0   4/8    50.0   0/1     0.0   1/1     1   0
Tim Griffin            21    9    7    1   1   3/7    42.9   0/1     0.0   1/2     3   0
Terry Jokic            20    6    5    2   0   2/4    50.0   2/3    66.7   0/0     1   0

TEAM: FG: 40/79 (50.6%), 3PT: 10/28 (35.7%), REB: 47 (6 off, 41 def), AST: 17, TO: 11

================================================================================
