================================================================================
                        FULL GAME - Team_034 vs Team_083                        
================================================================================

================================================================================
                       1ST QUARTER - Team_034 vs Team_083                       
================================================================================

[12:00] Team_034 possession (Score: 0-0)
Anthony Bane attempts a Layup. Contested by Bradley Thompson (3.8 feet, MAN). ANTHONY BANE MAKES IT! Assist: Cole Antetokounmpo
Score: 2-0

[11:43] Team_083 possession (Score: 2-0)
Malcolm Brogdon attempts a Midrange. Contested by Cole Antetokounmpo (4.2 feet, ZONE). MALCOLM BROGDON MAKES IT! Assist: Kyrie Griffin
Score: 2-2

[11:28] Team_034 possession (Score: 2-2)
FOUL! Reach-in foul on Bradley Thompson during the drive. [Team fouls: 1] No free throws, side out. (Bradley Thompson: 1 personal fouls)

[11:11] Team_034 possession (Score: 2-2)
Terry Doncic attempts a 3Pt. Contested by Yao Oladipo (3.5 feet, ZONE). Terry Doncic misses. Rebound secured by Bradley Thompson.

[10:54] Team_083 possession (Score: 2-2)
Malcolm Brogdon attempts a 3Pt. Contested by Devin Poole (3.6 feet, ZONE). Malcolm Brogdon misses. Offensive rebound by Bradley Thompson! Bradley Thompson puts it back in!
Score: 2-4

[10:41] Team_034 possession (Score: 2-4)
Ben Hyland attempts a 3Pt. Contested by Yao Oladipo (3.4 feet, ZONE). Ben Hyland misses. Rebound secured by Bradley Thompson.

[10:24] Team_083 possession (Score: 2-4)
Bradley Thompson attempts a Layup. BLOCKED BY ANTHONY BANE! Ball is loose! Rebound secured by Anthony Bane.

[10:12] Team_034 possession (Score: 2-4)
FOUL! Reach-in foul on Malcolm Brogdon during the drive. [Team fouls: 2] No free throws, side out. (Malcolm Brogdon: 1 personal fouls)

[09:58] Team_034 possession (Score: 2-4)
Devin Poole attempts a Midrange. Contested by Karl Jokic (4.5 feet, ZONE). Devin Poole misses. Rebound secured by Kyrie Griffin.

[09:46] Team_083 possession (Score: 2-4)
Yao Oladipo makes the Layup and draws the foul on Terry Doncic! And-1! Yao Oladipo to the line for 1. [Team fouls: 1] (Terry Doncic: 1 personal fouls)   FT 1/1: GOOD Yao Oladipo makes 1/1 from the line.
Score: 2-7

[09:31] Team_034 possession (Score: 2-7)
Cole Antetokounmpo makes the Layup and draws the foul on Yao Oladipo! And-1! Cole Antetokounmpo to the line for 1. [Team fouls: 3] (Yao Oladipo: 1 personal fouls)   FT 1/1: GOOD Cole Antetokounmpo makes 1/1 from the line.
Score: 5-7

[09:18] Team_083 possession (Score: 5-7)
Malcolm Brogdon attempts a 3Pt. Contested by Devin Poole (3.6 feet, ZONE). Malcolm Brogdon misses. Rebound secured by Anthony Bane.

[09:04] Team_034 possession (Score: 5-7)
FOUL! Shooting foul on Karl Jokic. Devin Poole to the line for 2 free throws. [Team fouls: 4] (Karl Jokic: 1 personal fouls)   FT 1/2: MISS   FT 2/2: GOOD Devin Poole makes 1/2 from the line.
Score: 6-7

[08:52] Team_083 possession (Score: 6-7)
Bradley Thompson attempts a Layup. BLOCKED BY BEN HYLAND! Ball deflects out of bounds off Bradley Thompson.

[08:43] Team_034 possession (Score: 6-7)
Devin Poole attempts a Midrange. Contested by Karl Jokic (4.5 feet, ZONE). DEVIN POOLE MAKES IT!
Score: 8-7

[08:32] Team_083 possession (Score: 8-7)
Karl Jokic attempts a 3Pt. Contested by Devin Poole (4.4 feet, ZONE). Karl Jokic misses. Offensive rebound by Kyrie Griffin! Kyrie Griffin kicks it out.

[08:17] Team_083 possession (Score: 8-7)
Yao Oladipo attempts a 3Pt. Contested by Cole Antetokounmpo (4.8 feet, MAN). Yao Oladipo misses. Rebound secured by Anthony Bane.

[08:01] Team_034 possession (Score: 8-7)
Devin Poole attempts a Midrange. Contested by Yao Oladipo (3.3 feet, ZONE). Devin Poole misses. Rebound secured by Yao Oladipo.

[07:48] Team_083 possession (Score: 8-7)
Bradley Thompson attempts a Midrange. Contested by Anthony Bane (5.3 feet, MAN). Bradley Thompson misses. FOUL! Loose ball foul on Terry Doncic during the rebound battle. [Team fouls: 2] No free throws, side out. (Terry Doncic: 2 personal fouls)

[07:36] Team_083 possession (Score: 8-7)
Yao Oladipo attempts a Midrange. Contested by Terry Doncic (4.3 feet, ZONE). Yao Oladipo misses. Rebound secured by Anthony Bane.

[07:23] Team_034 possession (Score: 8-7)
Devin Poole attempts a Midrange. Contested by Malcolm Brogdon (4.7 feet, ZONE). DEVIN POOLE MAKES IT!
Score: 10-7

[07:11] Team_083 possession (Score: 10-7)
Yao Oladipo drives, picks up Cole Antetokounmpo. Help arrives from Ben Hyland! Yao Oladipo attempts a Layup. Contested by Ben Hyland (4.8 feet, MAN). YAO OLADIPO MAKES IT! Assist: Bradley Thompson
Score: 10-9

[06:58] Team_034 possession (Score: 10-9)
Devin Poole drives and kicks out. Ben Hyland attempts a 3Pt. Contested by Karl Jokic (4.6 feet, MAN). Ben Hyland misses. Rebound secured by Bradley Thompson.

[06:44] Team_083 possession (Score: 10-9)
Bradley Thompson makes the Layup and draws the foul on Anthony Bane! And-1! Bradley Thompson to the line for 1. [Team fouls: 3] (Anthony Bane: 1 personal fouls)   FT 1/1: GOOD Bradley Thompson makes 1/1 from the line.
Score: 10-12

[06:30] Team_034 possession (Score: 10-12)
Cole Antetokounmpo attempts a 3Pt. Contested by Yao Oladipo (3.8 feet, ZONE). Cole Antetokounmpo misses. Rebound secured by Bradley Thompson.

[06:12] Team_083 possession (Score: 10-12)
FOUL! Holding foul on Terry Doncic. [Team fouls: 4] No free throws, side out. (Terry Doncic: 3 personal fouls)

[05:55] Team_083 possession (Score: 10-12)
Karl Jokic attempts a 3Pt. Contested by Devin Poole (4.4 feet, ZONE). Karl Jokic misses. Offensive rebound by Bradley Thompson! Bradley Thompson puts it back in!
Score: 10-14

[05:42] Team_034 possession (Score: 10-14)
FOUL! Holding foul on Karl Jokic. [IN THE BONUS! 5 team fouls] Ben Hyland to the line for 2 free throws. (Karl Jokic: 2 personal fouls)   FT 1/2: GOOD   FT 2/2: GOOD Ben Hyland makes 2/2 from the line.
Score: 12-14

[05:31] Team_083 possession (Score: 12-14)
FOUL! Reach-in foul on Anthony Bane during the drive. [IN THE BONUS! 5 team fouls] Bradley Thompson to the line for 2 free throws. (Anthony Bane: 2 personal fouls)   FT 1/2: GOOD   FT 2/2: GOOD Bradley Thompson makes 2/2 from the line.
Score: 12-16

[05:17] Team_034 possession (Score: 12-16)
Cole Antetokounmpo drives, Yao Oladipo stays with him. Cole Antetokounmpo attempts a Dunk. Contested by Yao Oladipo (3.9 feet, MAN). COLE ANTETOKOUNMPO MAKES IT! Assist: Terry Doncic
Score: 14-16

[05:01] Team_083 possession (Score: 14-16)
Kyrie Griffin drives and kicks out. Malcolm Brogdon attempts a Midrange. Contested by Devin Poole (4.0 feet, MAN). MALCOLM BROGDON MAKES IT!
Score: 14-18

[04:48] Team_034 possession (Score: 14-18)
FOUL! Holding foul on Yao Oladipo. [IN THE BONUS! 6 team fouls] Cole Antetokounmpo to the line for 2 free throws. (Yao Oladipo: 2 personal fouls)   FT 1/2: GOOD   FT 2/2: GOOD Cole Antetokounmpo makes 2/2 from the line.
Score: 16-18

[04:32] Team_083 possession (Score: 16-18)
Karl Jokic drives and kicks out. Malcolm Brogdon attempts a 3Pt. Contested by Devin Poole (4.0 feet, MAN). Malcolm Brogdon misses. Rebound secured by Anthony Bane.

[04:16] Team_034 possession (Score: 16-18)
FOUL! Shooting foul on Yao Oladipo. Ben Hyland to the line for 2 free throws. [BONUS: 7 team fouls] (Yao Oladipo: 3 personal fouls)   FT 1/2: GOOD   FT 2/2: GOOD Ben Hyland makes 2/2 from the line.
Score: 18-18

[04:05] Team_083 possession (Score: 18-18)
Karl Jokic attempts a 3Pt. Contested by Devin Poole (4.6 feet, ZONE). Karl Jokic misses. Offensive rebound by Bradley Thompson! Bradley Thompson puts it back in!
Score: 18-20

[03:49] Team_034 possession (Score: 18-20)
Ben Hyland throws a bad pass! Stolen by Karl Jokic! TURNOVER! (live ball)

[03:35] Team_083 possession (Score: 18-20)
Yao Oladipo attempts a 3Pt. Contested by Cole Antetokounmpo (4.9 feet, MAN). Yao Oladipo misses. Rebound secured by Terry Doncic.

[03:20] Team_034 possession (Score: 18-20)
FOUL! Reach-in foul on Kyrie Griffin during the drive. [IN THE BONUS! 8 team fouls] Anthony Bane to the line for 2 free throws. (Kyrie Griffin: 1 personal fouls)   FT 1/2: MISS   FT 2/2: GOOD Anthony Bane makes 1/2 from the line.
Score: 19-20

[03:03] Team_083 possession (Score: 19-20)
FOUL! Holding foul on Terry Doncic. [IN THE BONUS! 6 team fouls] Kyrie Griffin to the line for 2 free throws. (Terry Doncic: 4 personal fouls)   FT 1/2: GOOD   FT 2/2: GOOD Kyrie Griffin makes 2/2 from the line.
Score: 19-22

[02:47] Team_034 possession (Score: 19-22)
Cole Antetokounmpo makes the Midrange and draws the foul on Yao Oladipo! And-1! Cole Antetokounmpo to the line for 1. [BONUS: 9 team fouls] (Yao Oladipo: 4 personal fouls)   FT 1/1: GOOD Cole Antetokounmpo makes 1/1 from the line.
Score: 22-22

[02:37] Team_083 possession (Score: 22-22)
Kyrie Griffin attempts a Midrange. Contested by Cole Antetokounmpo (5.1 feet, ZONE). KYRIE GRIFFIN MAKES IT!
Score: 22-24

[02:19] Team_034 possession (Score: 22-24)
Cole Antetokounmpo attempts a 3Pt. Contested by Yao Oladipo (4.1 feet, ZONE). COLE ANTETOKOUNMPO MAKES IT! Assist: Terry Doncic
Score: 25-24

[02:06] Team_083 possession (Score: 25-24)
Malcolm Brogdon attempts a 3Pt. Contested by Devin Poole (4.0 feet, MAN). Malcolm Brogdon misses. Rebound secured by Cole Antetokounmpo.

[01:56] Team_034 possession (Score: 25-24)
Devin Poole drives to the basket... Devin Poole throws a bad pass! Stolen by Kyrie Griffin! TURNOVER! (live ball)

[01:45] Team_083 possession (Score: 25-24)
FOUL! Holding foul on Devin Poole. [IN THE BONUS! 7 team fouls] Malcolm Brogdon to the line for 2 free throws. (Devin Poole: 1 personal fouls)   FT 1/2: GOOD   FT 2/2: GOOD Malcolm Brogdon makes 2/2 from the line.
Score: 25-26

[01:30] Team_034 possession (Score: 25-26)
Terry Doncic drives and kicks out. Ben Hyland makes the Midrange and draws the foul on Karl Jokic! And-1! Ben Hyland to the line for 1. [BONUS: 10 team fouls] (Karl Jokic: 3 personal fouls)   FT 1/1: GOOD Ben Hyland makes 1/1 from the line.
Score: 28-26

[01:12] Team_083 possession (Score: 28-26)
Malcolm Brogdon drives, Devin Poole stays with him. Malcolm Brogdon attempts a Layup. Contested by Devin Poole (4.1 feet, MAN). Malcolm Brogdon misses. Rebound secured by Cole Antetokounmpo.

[00:57] Team_034 possession (Score: 28-26)
Anthony Bane attempts a Midrange. Contested by Bradley Thompson (4.3 feet, MAN). Anthony Bane misses. Offensive rebound by Anthony Bane! Anthony Bane kicks it out.

[00:44] Team_034 possession (Score: 28-26)
Terry Doncic attempts a 3Pt. Contested by Yao Oladipo (3.9 feet, ZONE). Terry Doncic misses. Rebound secured by Kyrie Griffin.

[00:25] Team_083 possession (Score: 28-26)
Yao Oladipo attempts a 3Pt. Contested by Devin Poole (4.8 feet, ZONE). Yao Oladipo misses. Rebound secured by Anthony Bane.

[00:08] Team_034 possession (Score: 28-26)
Cole Antetokounmpo attempts a 3Pt. Contested by Yao Oladipo (4.3 feet, MAN). Cole Antetokounmpo misses. Rebound secured by Yao Oladipo.

================================================================================
                              1ST QUARTER COMPLETE                              
================================================================================

1ST QUARTER SCORE: Team_034 28, Team_083 26

BOX SCORE:
================================================================================

Team_034
--------------------------------------------------------------------------------
Player                MIN  PTS  REB  AST  TO      FG   FG%      3P   3P%
--------------------------------------------------------------------------------
Cole Antetokounmpo     12   13    2    1   0   5/7    71.4     0/0   0.0
Ben Hyland             12    7    0    0   0   3/4    75.0     0/0   0.0
Devin Poole            12    5    0    0   0   3/6    50.0     0/0   0.0
Anthony Bane           12    3    7    0   0   2/2   100.0     0/0   0.0
Terry Doncic           12    0    1    2   0   0/2     0.0     0/0   0.0

TEAM: FG: 13/21 (61.9%), 3PT: 1/6 (16.7%), REB: 10 (1 off, 9 def), AST: 3, TO: 2
TEAM FOULS: 7 [Team_083 in BONUS]


Team_083
--------------------------------------------------------------------------------
Player                MIN  PTS  REB  AST  TO      FG   FG%      3P   3P%
--------------------------------------------------------------------------------
Bradley Thompson       12   11    7    1   0   5/7    71.4     0/0   0.0
Malcolm Brogdon        12    6    0    0   0   3/6    50.0     0/0   0.0
Yao Oladipo            12    5    2    0   0   2/6    33.3     0/0   0.0
Kyrie Griffin          12    4    4    1   0   2/2   100.0     0/0   0.0
Karl Jokic             12    0    0    0   0   0/1     0.0     0/0   0.0

TEAM: FG: 12/22 (54.5%), 3PT: 3/8 (37.5%), REB: 13 (5 off, 8 def), AST: 2, TO: 0
TEAM FOULS: 10 [Team_034 in BONUS]

================================================================================

================================================================================
                       2ND QUARTER - Team_034 vs Team_083                       
================================================================================

[12:00] Team_034 possession (Score: 28-26)
FOUL! Reach-in foul on Kyrie Griffin during the drive. [Team fouls: 1] No free throws, side out. (Kyrie Griffin: 1 personal fouls)

[11:47] Team_034 possession (Score: 28-26)
FOUL! Reach-in foul on Karl Jokic during the drive. [Team fouls: 2] No free throws, side out. (Karl Jokic: 1 personal fouls)

[11:35] Team_034 possession (Score: 28-26)
Terry Doncic attempts a 3Pt. Contested by Yao Oladipo (3.8 feet, ZONE). TERRY DONCIC MAKES IT! Assist: Devin Poole
Score: 31-26

[11:18] Team_083 possession (Score: 31-26)
Kyrie Griffin attempts a Midrange. Contested by Terry Doncic (4.8 feet, MAN). KYRIE GRIFFIN MAKES IT! Assist: Karl Jokic
Score: 31-28

[11:04] Team_034 possession (Score: 31-28)
Ben Hyland drives to the basket... Ben Hyland loses the ball! Stripped by Karl Jokic! TURNOVER! (live ball)

[10:50] Team_083 possession (Score: 31-28)
Malcolm Brogdon drives and kicks out. Malcolm Brogdon attempts a Midrange. Contested by Ben Hyland (4.1 feet, ZONE). Malcolm Brogdon misses. FOUL! Loose ball foul on Cole Antetokounmpo during the rebound battle. [Team fouls: 1] No free throws, side out. (Cole Antetokounmpo: 1 personal fouls)

[10:38] Team_083 possession (Score: 31-28)
Bradley Thompson drives to the basket... FOUL! Offensive foul on Bradley Thompson! Terry Doncic drew the charge! [Team fouls: 3] (Bradley Thompson: 1 personal fouls) TURNOVER! (dead ball)

[10:21] Team_034 possession (Score: 31-28)
Terry Doncic drives to the basket... FOUL! Offensive foul on Terry Doncic! Kyrie Griffin drew the charge! [Team fouls: 2] (Terry Doncic: 1 personal fouls) TURNOVER! (dead ball)

[10:12] Team_083 possession (Score: 31-28)
Yao Oladipo attempts a 3Pt. Contested by Devin Poole (4.9 feet, ZONE). Yao Oladipo misses. Rebound secured by Anthony Bane.

[10:00] Team_034 possession (Score: 31-28)
Terry Doncic attempts a 3Pt. Contested by Kyrie Griffin (4.1 feet, MAN). TERRY DONCIC MAKES IT! Assist: Cole Antetokounmpo
Score: 34-28

[09:46] Team_083 possession (Score: 34-28)
Yao Oladipo attempts a Midrange. Contested by Ben Hyland (4.4 feet, ZONE). Yao Oladipo misses. Rebound secured by Cole Antetokounmpo.

[09:31] Team_034 possession (Score: 34-28)
Anthony Bane attempts a 3Pt. Contested by Yao Oladipo (4.1 feet, ZONE). Anthony Bane misses. Rebound secured by Yao Oladipo.

[09:19] Team_083 possession (Score: 34-28)
Karl Jokic attempts a 3Pt. Contested by Devin Poole (5.2 feet, ZONE). KARL JOKIC MAKES IT! Assist: Kyrie Griffin
Score: 34-31

[09:07] Team_034 possession (Score: 34-31)
Anthony Bane drives to the basket... Anthony Bane throws a bad pass! Stolen by Kyrie Griffin! TURNOVER! (live ball)

[08:52] Team_083 possession (Score: 34-31)
FOUL! Shooting foul on Ben Hyland. Karl Jokic to the line for 3 free throws. [Team fouls: 3] (Ben Hyland: 1 personal fouls)   FT 1/3: GOOD   FT 2/3: GOOD   FT 3/3: GOOD Karl Jokic makes 3/3 from the line.
Score: 34-34

[08:39] Team_034 possession (Score: 34-34)
Devin Poole attempts a 3Pt. Contested by Yao Oladipo (4.0 feet, ZONE). Devin Poole misses. Rebound secured by Yao Oladipo.

[08:24] Team_083 possession (Score: 34-34)
Malcolm Brogdon attempts a Layup. BLOCKED BY DEVIN POOLE! Ball is loose! Rebound secured by Terry Doncic.

[08:10] Team_034 possession (Score: 34-34)
Anthony Bane drives, Kyrie Griffin stays with him. Anthony Bane attempts a Layup. Contested by Kyrie Griffin (4.4 feet, ZONE). Anthony Bane misses. Rebound secured by Yao Oladipo.

[07:54] Team_083 possession (Score: 34-34)
Karl Jokic drives, Terry Doncic stays with him. Karl Jokic attempts a Dunk. Contested by Terry Doncic (5.4 feet, ZONE). KARL JOKIC MAKES IT! Assist: Yao Oladipo
Score: 34-36

[07:38] Team_034 possession (Score: 34-36)
Cole Antetokounmpo attempts a Midrange. Contested by Yao Oladipo (4.6 feet, MAN). Cole Antetokounmpo misses. Rebound secured by Yao Oladipo.

[07:22] Team_083 possession (Score: 34-36)
FOUL! Shooting foul on Ben Hyland. Yao Oladipo to the line for 2 free throws. [Team fouls: 4] (Ben Hyland: 2 personal fouls)   FT 1/2: GOOD   FT 2/2: GOOD Yao Oladipo makes 2/2 from the line.
Score: 34-38

[07:08] Team_034 possession (Score: 34-38)
FOUL! Reach-in foul on Kyrie Griffin during the drive. [Team fouls: 4] No free throws, side out. (Kyrie Griffin: 2 personal fouls)

[06:53] Team_034 possession (Score: 34-38)
Anthony Bane drives and kicks out. Cole Antetokounmpo attempts a 3Pt. Contested by Yao Oladipo (4.5 feet, ZONE). COLE ANTETOKOUNMPO MAKES IT! Assist: Ben Hyland
Score: 37-38

[06:36] Team_083 possession (Score: 37-38)
Malcolm Brogdon attempts a 3Pt. Contested by Devin Poole (4.8 feet, ZONE). MALCOLM BROGDON MAKES IT! Assist: Yao Oladipo
Score: 37-41

[06:21] Team_034 possession (Score: 37-41)
Devin Poole attempts a Layup. Contested by Malcolm Brogdon (5.6 feet, MAN). Devin Poole misses. Rebound secured by Bradley Thompson.

[06:04] Team_083 possession (Score: 37-41)
Malcolm Brogdon attempts a Midrange. Contested by Devin Poole (4.9 feet, MAN). MALCOLM BROGDON MAKES IT! Assist: Yao Oladipo
Score: 37-43

[05:48] Team_034 possession (Score: 37-43)
Devin Poole attempts a 3Pt. Contested by Yao Oladipo (4.4 feet, ZONE). Devin Poole misses. Rebound secured by Kyrie Griffin.

[05:33] Team_083 possession (Score: 37-43)
Yao Oladipo drives to the basket... Yao Oladipo throws a bad pass out of bounds! TURNOVER! (dead ball)

[05:33] Substitution (Team_034): Devin Poole OUT → Manu Jokic IN (stamina_rule2)

[05:33] Substitution (Team_034): Ben Hyland OUT → Damian Turner IN (stamina_rule2)

[05:33] Substitution (Team_034): Cole Antetokounmpo OUT → Vince Paul IN (stamina_rule2)

[05:33] Substitution (Team_034): Terry Doncic OUT → Nikola Wagner IN (stamina_rule2)

[05:33] Substitution (Team_034): Anthony Bane OUT → Carmelo Anunoby IN (stamina_rule2)

[05:33] Substitution (Team_083): Malcolm Brogdon OUT → Zion Markkanen IN (stamina_rule2)

[05:33] Substitution (Team_083): Karl Jokic OUT → Damian Towns IN (stamina_rule2)

[05:33] Substitution (Team_083): Yao Oladipo OUT → Domantas Doncic IN (stamina_rule2)

[05:33] Substitution (Team_083): Kyrie Griffin OUT → Cole Simmons IN (stamina_rule2)

[05:33] Substitution (Team_083): Bradley Thompson OUT → Victor McCollum IN (stamina_rule2)

[05:21] Team_034 possession (Score: 37-43)
Carmelo Anunoby attempts a 3Pt. Contested by Zion Markkanen (5.5 feet, ZONE). Carmelo Anunoby misses. Rebound secured by Damian Towns.

[05:05] Team_083 possession (Score: 37-43)
Cole Simmons attempts a Layup. Contested by Carmelo Anunoby (5.4 feet, ZONE). COLE SIMMONS MAKES IT! Assist: Domantas Doncic
Score: 37-45

[04:46] Team_034 possession (Score: 37-45)
Nikola Wagner drives, picks up Cole Simmons. Help arrives from Damian Towns! Nikola Wagner attempts a Layup. Contested by Damian Towns (4.9 feet, MAN). NIKOLA WAGNER MAKES IT! Assist: Vince Paul
Score: 39-45

[04:30] Team_083 possession (Score: 39-45)
FOUL! Shooting foul on Nikola Wagner. Cole Simmons to the line for 2 free throws. [BONUS: 5 team fouls] (Nikola Wagner: 1 personal fouls)   FT 1/2: GOOD   FT 2/2: GOOD Cole Simmons makes 2/2 from the line.
Score: 39-47

[04:18] Team_034 possession (Score: 39-47)
FOUL! Reach-in foul on Victor McCollum during the drive. [IN THE BONUS! 5 team fouls] Carmelo Anunoby to the line for 2 free throws. (Victor McCollum: 1 personal fouls)   FT 1/2: GOOD   FT 2/2: MISS Carmelo Anunoby makes 1/2 from the line. Offensive rebound by Vince Paul! Vince Paul puts it back in!
Score: 42-47

[04:04] Team_083 possession (Score: 42-47)
Domantas Doncic attempts a Layup. Contested by Vince Paul (4.3 feet, MAN). Domantas Doncic misses. Rebound secured by Vince Paul.

[03:45] Team_034 possession (Score: 42-47)
Damian Turner attempts a Layup. Contested by Cole Simmons (5.2 feet, ZONE). DAMIAN TURNER MAKES IT!
Score: 44-47

[03:31] Team_083 possession (Score: 44-47)
Damian Towns drives, Damian Turner stays with him. Damian Towns attempts a Dunk. Contested by Damian Turner (5.9 feet, MAN). DAMIAN TOWNS MAKES IT! Assist: Domantas Doncic
Score: 44-49

[03:19] Team_034 possession (Score: 44-49)
Manu Jokic makes the Midrange and draws the foul on Zion Markkanen! And-1! Manu Jokic to the line for 1. [BONUS: 6 team fouls] (Zion Markkanen: 1 personal fouls)   FT 1/1: GOOD Manu Jokic makes 1/1 from the line.
Score: 47-49

[03:06] Team_083 possession (Score: 47-49)
Cole Simmons attempts a 3Pt. Contested by Vince Paul (4.2 feet, ZONE). Cole Simmons misses. Rebound secured by Vince Paul.

[02:54] Team_034 possession (Score: 47-49)
Damian Turner makes the Dunk and draws the foul on Victor McCollum! And-1! Damian Turner to the line for 1. [BONUS: 7 team fouls] (Victor McCollum: 2 personal fouls)   FT 1/1: GOOD Damian Turner makes 1/1 from the line.
Score: 50-49

[02:41] Team_083 possession (Score: 50-49)
Damian Towns drives, Carmelo Anunoby stays with him. Damian Towns attempts a Layup. Contested by Carmelo Anunoby (5.9 feet, ZONE). DAMIAN TOWNS MAKES IT!
Score: 50-51

[02:30] Team_034 possession (Score: 50-51)
Manu Jokic makes the Layup and draws the foul on Damian Towns! And-1! Manu Jokic to the line for 1. [BONUS: 8 team fouls] (Damian Towns: 1 personal fouls)   FT 1/1: GOOD Manu Jokic makes 1/1 from the line.
Score: 53-51

[02:16] Team_083 possession (Score: 53-51)
Victor McCollum drives and kicks out. Victor McCollum attempts a 3Pt. Contested by Carmelo Anunoby (5.4 feet, MAN). Victor McCollum misses. Rebound secured by Carmelo Anunoby.

[02:04] Team_034 possession (Score: 53-51)
Vince Paul attempts a 3Pt. Contested by Domantas Doncic (4.9 feet, MAN). Vince Paul misses. Rebound secured by Damian Towns.

[01:52] Team_083 possession (Score: 53-51)
Zion Markkanen drives and kicks out. Damian Towns attempts a 3Pt. Contested by Vince Paul (4.2 feet, ZONE). Damian Towns misses. Rebound secured by Nikola Wagner.

[01:42] Team_034 possession (Score: 53-51)
Nikola Wagner attempts a 3Pt. Contested by Cole Simmons (4.9 feet, MAN). Nikola Wagner misses. Rebound secured by Damian Towns.

[01:30] Team_083 possession (Score: 53-51)
Victor McCollum loses control! Ball rolls out of bounds! TURNOVER! (dead ball)

[01:15] Team_034 possession (Score: 53-51)
Nikola Wagner attempts a 3Pt. Contested by Zion Markkanen (5.5 feet, ZONE). Nikola Wagner misses. FOUL! Loose ball foul on Damian Towns during the rebound battle. [IN THE BONUS! 9 team fouls] Vince Paul to the line for 2 free throws. (Damian Towns: 2 personal fouls)   FT 1/2: GOOD   FT 2/2: GOOD Vince Paul makes 2/2 from the line.
Score: 55-51

[00:58] Team_083 possession (Score: 55-51)
Cole Simmons drives, Nikola Wagner stays with him. Cole Simmons attempts a Layup. Contested by Nikola Wagner (6.0 feet, MAN). COLE SIMMONS MAKES IT! Assist: Damian Towns
Score: 55-53

[00:48] Team_034 possession (Score: 55-53)
Manu Jokic attempts a Midrange. Contested by Cole Simmons (4.8 feet, ZONE). Manu Jokic misses. Rebound secured by Cole Simmons.

[00:35] Team_083 possession (Score: 55-53)
Damian Towns attempts a 3Pt. Contested by Damian Turner (5.9 feet, MAN). Damian Towns misses. Rebound secured by Carmelo Anunoby.

[00:23] Team_034 possession (Score: 55-53)
Carmelo Anunoby attempts a Midrange. Contested by Cole Simmons (4.9 feet, ZONE). Carmelo Anunoby misses. Rebound secured by Damian Towns.

[00:09] Team_083 possession (Score: 55-53)
Zion Markkanen attempts a 3Pt. Contested by Vince Paul (4.4 feet, ZONE). Zion Markkanen misses. Rebound secured by Vince Paul.

================================================================================
                              2ND QUARTER COMPLETE                              
================================================================================

2ND QUARTER SCORE: Team_034 27, Team_083 27

BOX SCORE:
================================================================================

Team_034
--------------------------------------------------------------------------------
Player                MIN  PTS  REB  AST  TO      FG   FG%      3P   3P%
--------------------------------------------------------------------------------
Terry Doncic           19    6    1    0   0   2/2   100.0     0/0   0.0
Manu Jokic              5    6    0    0   0   2/3    66.7     0/0   0.0
Vince Paul              5    5    3    1   0   2/3    66.7     0/0   0.0
Damian Turner           5    5    0    0   0   2/2   100.0     0/0   0.0
Cole Antetokounmpo     19    3    1    1   0   1/2    50.0     0/0   0.0
Nikola Wagner           5    2    1    0   0   1/2    50.0     0/0   0.0
Devin Poole            19    0    0    1   0   0/3     0.0     0/0   0.0
Anthony Bane           19    0    1    0   0   0/2     0.0     0/0   0.0
Ben Hyland             19    0    0    1   0   0/0     0.0     0/0   0.0
Carmelo Anunoby         5    0    2    0   0   0/2     0.0     0/0   0.0

TEAM: FG: 10/21 (47.6%), 3PT: 3/9 (33.3%), REB: 9 (0 off, 9 def), AST: 4, TO: 3
TEAM FOULS: 5 [Team_083 in BONUS]


Team_083
--------------------------------------------------------------------------------
Player                MIN  PTS  REB  AST  TO      FG   FG%      3P   3P%
--------------------------------------------------------------------------------
Karl Jokic             19    8    0    1   0   3/3   100.0     0/0   0.0
Cole Simmons            5    6    1    0   0   3/4    75.0     0/0   0.0
Malcolm Brogdon        19    5    0    0   0   2/3    66.7     0/0   0.0
Damian Towns            5    4    4    1   0   2/3    66.7     0/0   0.0
Kyrie Griffin          19    2    1    1   0   1/1   100.0     0/0   0.0
Yao Oladipo            19    2    4    3   0   1/3    33.3     0/0   0.0
Bradley Thompson       19    0    2    0   0   0/0     0.0     0/0   0.0
Domantas Doncic         5    0    0    2   0   0/1     0.0     0/0   0.0
Victor McCollum         5    0    0    0   0   0/1     0.0     0/0   0.0
Zion Markkanen          5    0    0    0   0   0/2     0.0     0/0   0.0

TEAM: FG: 12/21 (57.1%), 3PT: 3/7 (42.9%), REB: 12 (1 off, 11 def), AST: 8, TO: 3
TEAM FOULS: 9 [Team_034 in BONUS]

================================================================================

================================================================================
                       3RD QUARTER - Team_034 vs Team_083                       
================================================================================

[12:00] Team_034 possession (Score: 55-53)
Anthony Bane attempts a 3Pt. Contested by Bradley Thompson (3.8 feet, MAN). Anthony Bane misses. Offensive rebound by Anthony Bane! Anthony Bane kicks it out.

[11:43] Team_034 possession (Score: 55-53)
Ben Hyland drives to the basket... Ben Hyland loses the ball! Stripped by Kyrie Griffin! TURNOVER! (live ball)

[11:25] Team_083 possession (Score: 55-53)
Yao Oladipo throws a bad pass out of bounds! TURNOVER! (dead ball)

[11:08] Team_034 possession (Score: 55-53)
Cole Antetokounmpo attempts a 3Pt. Contested by Kyrie Griffin (3.9 feet, ZONE). Cole Antetokounmpo misses. Rebound secured by Bradley Thompson.

[10:52] Team_083 possession (Score: 55-53)
Bradley Thompson attempts a Layup. BLOCKED BY TERRY DONCIC! Ball is loose! Rebound secured by Anthony Bane.

[10:38] Team_034 possession (Score: 55-53)
Cole Antetokounmpo attempts a Midrange. Contested by Kyrie Griffin (3.9 feet, ZONE). COLE ANTETOKOUNMPO MAKES IT!
Score: 57-53

[10:26] Team_083 possession (Score: 57-53)
Yao Oladipo attempts a 3Pt. Contested by Cole Antetokounmpo (4.8 feet, MAN). Yao Oladipo misses. Rebound secured by Terry Doncic.

[10:13] Team_034 possession (Score: 57-53)
Cole Antetokounmpo drives to the basket... Cole Antetokounmpo throws a bad pass! Stolen by Yao Oladipo! TURNOVER! (live ball)

[09:59] Team_083 possession (Score: 57-53)
Bradley Thompson drives to the basket... Bradley Thompson loses control! Ball rolls out of bounds! TURNOVER! (dead ball)

[09:49] Team_034 possession (Score: 57-53)
Cole Antetokounmpo drives, picks up Yao Oladipo. Help arrives from Karl Jokic! Cole Antetokounmpo attempts a Layup. Contested by Karl Jokic (3.8 feet, MAN). COLE ANTETOKOUNMPO MAKES IT! Assist: Terry Doncic
Score: 59-53

[09:29] Team_083 possession (Score: 59-53)
FOUL! Reach-in foul on Terry Doncic during the drive. [Team fouls: 1] No free throws, side out. (Terry Doncic: 1 personal fouls)

[09:12] Team_083 possession (Score: 59-53)
Bradley Thompson drives, Terry Doncic stays with him. Bradley Thompson attempts a Layup. Contested by Terry Doncic (4.2 feet, ZONE). BRADLEY THOMPSON MAKES IT! Assist: Kyrie Griffin
Score: 59-55

[08:59] Team_034 possession (Score: 59-55)
Anthony Bane drives, picks up Bradley Thompson. Help arrives from Karl Jokic! Anthony Bane attempts a Layup. Contested by Karl Jokic (3.8 feet, MAN). Anthony Bane misses. Rebound secured by Kyrie Griffin.

[08:48] Team_083 possession (Score: 59-55)
Yao Oladipo attempts a Midrange. Contested by Devin Poole (4.2 feet, ZONE). Yao Oladipo misses. FOUL! Loose ball foul on Anthony Bane during the rebound battle. [Team fouls: 2] No free throws, side out. (Anthony Bane: 1 personal fouls)

[08:35] Team_083 possession (Score: 59-55)
Bradley Thompson attempts a Midrange. Contested by Ben Hyland (3.7 feet, ZONE). Bradley Thompson misses. Rebound secured by Terry Doncic.

[08:21] Team_034 possession (Score: 59-55)
Ben Hyland attempts a Midrange. Contested by Karl Jokic (4.6 feet, ZONE). Ben Hyland misses. Rebound secured by Kyrie Griffin.

[08:06] Team_083 possession (Score: 59-55)
Kyrie Griffin attempts a 3Pt. Contested by Devin Poole (4.2 feet, ZONE). Kyrie Griffin misses. Rebound secured by Terry Doncic.

[07:53] Team_034 possession (Score: 59-55)
Terry Doncic attempts a Midrange. Contested by Kyrie Griffin (3.5 feet, ZONE). TERRY DONCIC MAKES IT!
Score: 61-55

[07:37] Team_083 possession (Score: 61-55)
Malcolm Brogdon attempts a 3Pt. Contested by Devin Poole (3.6 feet, MAN). Malcolm Brogdon misses. Rebound secured by Cole Antetokounmpo.

[07:21] Team_034 possession (Score: 61-55)
Ben Hyland makes the Layup and draws the foul on Karl Jokic! And-1! Ben Hyland to the line for 1. [Team fouls: 1] (Karl Jokic: 1 personal fouls)   FT 1/1: GOOD Ben Hyland makes 1/1 from the line.
Score: 64-55

[07:05] Team_083 possession (Score: 64-55)
Karl Jokic attempts a 3Pt. Contested by Devin Poole (4.4 feet, ZONE). Karl Jokic misses. Rebound secured by Cole Antetokounmpo.

[06:48] Team_034 possession (Score: 64-55)
Devin Poole attempts a Midrange. Contested by Malcolm Brogdon (4.7 feet, MAN). Devin Poole misses. Rebound secured by Kyrie Griffin.

[06:29] Team_083 possession (Score: 64-55)
Bradley Thompson attempts a Midrange. Contested by Anthony Bane (5.3 feet, MAN). Bradley Thompson misses. Rebound secured by Anthony Bane.

[06:16] Team_034 possession (Score: 64-55)
Devin Poole attempts a Layup. Contested by Kyrie Griffin (3.3 feet, ZONE). DEVIN POOLE MAKES IT!
Score: 66-55

[05:57] Team_083 possession (Score: 66-55)
Yao Oladipo attempts a 3Pt. Contested by Devin Poole (4.2 feet, ZONE). Yao Oladipo misses. Rebound secured by Terry Doncic.

[05:40] Team_034 possession (Score: 66-55)
Ben Hyland attempts a 3Pt. Contested by Yao Oladipo (3.4 feet, ZONE). Ben Hyland misses. FOUL! Loose ball foul on Kyrie Griffin during the rebound battle. [Team fouls: 2] No free throws, side out. (Kyrie Griffin: 1 personal fouls)

[05:29] Team_034 possession (Score: 66-55)
Devin Poole drives and kicks out. Cole Antetokounmpo attempts a 3Pt. Contested by Yao Oladipo (3.4 feet, ZONE). Cole Antetokounmpo misses. Rebound secured by Kyrie Griffin.

[05:15] Team_083 possession (Score: 66-55)
Malcolm Brogdon attempts a Midrange. Contested by Terry Doncic (3.7 feet, ZONE). MALCOLM BROGDON MAKES IT! Assist: Bradley Thompson
Score: 66-57

[05:02] Team_034 possession (Score: 66-57)
Devin Poole attempts a 3Pt. Contested by Yao Oladipo (3.3 feet, ZONE). DEVIN POOLE MAKES IT!
Score: 69-57

[04:51] Team_083 possession (Score: 69-57)
Bradley Thompson attempts a Midrange. Contested by Terry Doncic (4.2 feet, ZONE). Bradley Thompson misses. Rebound secured by Cole Antetokounmpo.

[04:39] Team_034 possession (Score: 69-57)
Anthony Bane makes the Layup and draws the foul on Kyrie Griffin! And-1! Anthony Bane to the line for 1. [Team fouls: 3] (Kyrie Griffin: 2 personal fouls)   FT 1/1: MISS Anthony Bane makes 0/1 from the line. Rebound secured by Yao Oladipo.
Score: 71-57

[04:24] Team_083 possession (Score: 71-57)
FOUL! Reach-in foul on Terry Doncic during the drive. [Team fouls: 3] No free throws, side out. (Terry Doncic: 2 personal fouls)

[04:10] Team_083 possession (Score: 71-57)
Bradley Thompson drives and kicks out. Kyrie Griffin attempts a Midrange. Contested by Ben Hyland (3.7 feet, ZONE). Kyrie Griffin misses. Rebound secured by Terry Doncic.

[03:53] Team_034 possession (Score: 71-57)
Ben Hyland attempts a 3Pt. Contested by Karl Jokic (4.7 feet, MAN). Ben Hyland misses. Offensive rebound by Terry Doncic! Terry Doncic's putback is no good. Rebound secured by Bradley Thompson.

[03:36] Team_083 possession (Score: 71-57)
Yao Oladipo attempts a Layup. Contested by Cole Antetokounmpo (4.9 feet, MAN). Yao Oladipo misses. Rebound secured by Terry Doncic.

[03:23] Team_034 possession (Score: 71-57)
Devin Poole attempts a 3Pt. Contested by Yao Oladipo (3.4 feet, ZONE). Devin Poole misses. Rebound secured by Yao Oladipo.

[03:10] Team_083 possession (Score: 71-57)
Yao Oladipo attempts a Layup. Contested by Terry Doncic (4.5 feet, ZONE). YAO OLADIPO MAKES IT!
Score: 71-59

[02:57] Team_034 possession (Score: 71-59)
Ben Hyland drives, picks up Karl Jokic. Help arrives from Yao Oladipo! Ben Hyland attempts a Dunk. Contested by Yao Oladipo (4.8 feet, MAN). BEN HYLAND MAKES IT!
Score: 73-59

[02:44] Team_083 possession (Score: 73-59)
Malcolm Brogdon drives, Terry Doncic stays with him. Malcolm Brogdon attempts a Dunk. Contested by Terry Doncic (3.9 feet, ZONE). Malcolm Brogdon misses. Rebound secured by Anthony Bane.

[02:28] Team_034 possession (Score: 73-59)
Anthony Bane drives and kicks out. Cole Antetokounmpo attempts a 3Pt. Contested by Yao Oladipo (3.6 feet, MAN). Cole Antetokounmpo misses. Rebound secured by Yao Oladipo.

[02:13] Team_083 possession (Score: 73-59)
FOUL! Offensive foul on Yao Oladipo! Cole Antetokounmpo drew the charge! [Team fouls: 4] (Yao Oladipo: 1 personal fouls) TURNOVER! (dead ball)

[01:58] Team_034 possession (Score: 73-59)
Anthony Bane attempts a Layup. BLOCKED BY KYRIE GRIFFIN! Ball goes out off Kyrie Griffin. Anthony Bane's ball!

[01:44] Team_034 possession (Score: 73-59)
Cole Antetokounmpo drives to the basket... Cole Antetokounmpo throws a bad pass! Stolen by Yao Oladipo! TURNOVER! (live ball)

[01:32] Team_083 possession (Score: 73-59)
Karl Jokic attempts a 3Pt. Contested by Ben Hyland (4.4 feet, MAN). KARL JOKIC MAKES IT! Assist: Yao Oladipo
Score: 73-62

[01:20] Team_034 possession (Score: 73-62)
FOUL! Shooting foul on Bradley Thompson. Anthony Bane to the line for 2 free throws. [BONUS: 5 team fouls] (Bradley Thompson: 1 personal fouls)   FT 1/2: MISS   FT 2/2: GOOD Anthony Bane makes 1/2 from the line.
Score: 74-62

[01:03] Team_083 possession (Score: 74-62)
Bradley Thompson attempts a Layup. Contested by Terry Doncic (4.6 feet, ZONE). BRADLEY THOMPSON MAKES IT! Assist: Kyrie Griffin
Score: 74-64

[00:51] Team_034 possession (Score: 74-64)
FOUL! Reach-in foul on Kyrie Griffin during the drive. [IN THE BONUS! 6 team fouls] Anthony Bane to the line for 2 free throws. (Kyrie Griffin: 3 personal fouls)   FT 1/2: GOOD   FT 2/2: MISS Anthony Bane makes 1/2 from the line. Rebound secured by Kyrie Griffin.
Score: 75-64

[00:34] Team_083 possession (Score: 75-64)
Kyrie Griffin attempts a 3Pt. Contested by Terry Doncic (4.8 feet, MAN). Kyrie Griffin misses. Rebound secured by Cole Antetokounmpo.

[00:16] Team_034 possession (Score: 75-64)
Cole Antetokounmpo attempts a Midrange. Contested by Yao Oladipo (4.3 feet, MAN). Cole Antetokounmpo misses. Rebound secured by Kyrie Griffin.

[00:01] Team_083 possession (Score: 75-64)
Karl Jokic attempts a Midrange. Contested by Ben Hyland (4.6 feet, MAN). KARL JOKIC MAKES IT!
Score: 75-66

================================================================================
                              3RD QUARTER COMPLETE                              
================================================================================

3RD QUARTER SCORE: Team_034 20, Team_083 13

BOX SCORE:
================================================================================

Team_034
--------------------------------------------------------------------------------
Player                MIN  PTS  REB  AST  TO      FG   FG%      3P   3P%
--------------------------------------------------------------------------------
Ben Hyland             31    5    0    0   0   2/4    50.0     0/0   0.0
Devin Poole            31    5    0    0   0   2/5    40.0     0/0   0.0
Cole Antetokounmpo     31    4    4    0   0   2/4    50.0     0/0   0.0
Terry Doncic           31    2    6    1   0   1/1   100.0     0/0   0.0
Anthony Bane           31    1    5    0   0   1/5    20.0     0/0   0.0

TEAM: FG: 8/19 (42.1%), 3PT: 1/4 (25.0%), REB: 16 (3 off, 13 def), AST: 1, TO: 3
TEAM FOULS: 3


Team_083
--------------------------------------------------------------------------------
Player                MIN  PTS  REB  AST  TO      FG   FG%      3P   3P%
--------------------------------------------------------------------------------
Karl Jokic             31    5    0    0   0   2/3    66.7     0/0   0.0
Bradley Thompson       31    4    3    1   0   2/7    28.6     0/0   0.0
Yao Oladipo            31    2    3    1   0   1/4    25.0     0/0   0.0
Malcolm Brogdon        31    2    0    0   0   1/3    33.3     0/0   0.0
Kyrie Griffin          31    0    6    2   0   0/2     0.0     0/0   0.0

TEAM: FG: 6/19 (31.6%), 3PT: 1/7 (14.3%), REB: 11 (1 off, 10 def), AST: 4, TO: 3
TEAM FOULS: 6 [Team_034 in BONUS]

================================================================================

================================================================================
                       4TH QUARTER - Team_034 vs Team_083                       
================================================================================

[12:00] Team_034 possession (Score: 75-66)
Devin Poole attempts a 3Pt. Contested by Yao Oladipo (3.5 feet, ZONE). Devin Poole misses. Rebound secured by Kyrie Griffin.

[11:41] Team_083 possession (Score: 75-66)
Karl Jokic attempts a Midrange. Contested by Ben Hyland (4.4 feet, MAN). KARL JOKIC MAKES IT! Assist: Yao Oladipo
Score: 75-68

[11:28] Team_034 possession (Score: 75-68)
Devin Poole attempts a 3Pt. Contested by Karl Jokic (4.7 feet, ZONE). DEVIN POOLE MAKES IT! Assist: Cole Antetokounmpo
Score: 78-68

[11:12] Team_083 possession (Score: 78-68)
Karl Jokic attempts a 3Pt. Contested by Devin Poole (4.9 feet, ZONE). Karl Jokic misses. Rebound secured by Cole Antetokounmpo.

[10:54] Team_034 possession (Score: 78-68)
Devin Poole drives to the basket... Devin Poole throws a bad pass out of bounds! TURNOVER! (dead ball)

[10:54] Substitution (Team_034): Devin Poole OUT → Manu Jokic IN (stamina_rule2)

[10:54] Substitution (Team_034): Ben Hyland OUT → Damian Turner IN (stamina_rule2)

[10:54] Substitution (Team_034): Cole Antetokounmpo OUT → Vince Paul IN (stamina_rule2)

[10:54] Substitution (Team_034): Terry Doncic OUT → Nikola Wagner IN (stamina_rule2)

[10:54] Substitution (Team_034): Anthony Bane OUT → Carmelo Anunoby IN (stamina_rule2)

[10:54] Substitution (Team_083): Malcolm Brogdon OUT → Zion Markkanen IN (stamina_rule2)

[10:54] Substitution (Team_083): Karl Jokic OUT → Damian Towns IN (stamina_rule2)

[10:54] Substitution (Team_083): Yao Oladipo OUT → Domantas Doncic IN (stamina_rule2)

[10:54] Substitution (Team_083): Kyrie Griffin OUT → Cole Simmons IN (stamina_rule2)

[10:54] Substitution (Team_083): Bradley Thompson OUT → Victor McCollum IN (stamina_rule2)

[10:38] Team_083 possession (Score: 78-68)
Cole Simmons drives, picks up Carmelo Anunoby. Help arrives from Damian Turner! Cole Simmons attempts a Layup. Contested by Damian Turner (5.4 feet, ZONE). COLE SIMMONS MAKES IT! Assist: Damian Towns
Score: 78-70

[10:27] Team_034 possession (Score: 78-70)
Nikola Wagner attempts a Layup. Contested by Cole Simmons (4.9 feet, MAN). NIKOLA WAGNER MAKES IT!
Score: 80-70

[10:10] Team_083 possession (Score: 80-70)
Cole Simmons attempts a 3Pt. Contested by Vince Paul (4.2 feet, ZONE). Cole Simmons misses. Rebound secured by Carmelo Anunoby.

[09:55] Team_034 possession (Score: 80-70)
Manu Jokic attempts a 3Pt. Contested by Zion Markkanen (5.4 feet, ZONE). Manu Jokic misses. FOUL! Loose ball foul on Damian Towns during the rebound battle. [Team fouls: 1] No free throws, side out. (Damian Towns: 1 personal fouls)

[09:40] Team_034 possession (Score: 80-70)
FOUL! Shooting foul on Zion Markkanen. Manu Jokic to the line for 3 free throws. [Team fouls: 2] (Zion Markkanen: 1 personal fouls)   FT 1/3: GOOD   FT 2/3: GOOD   FT 3/3: GOOD Manu Jokic makes 3/3 from the line.
Score: 83-70

[09:28] Team_083 possession (Score: 83-70)
Damian Towns drives, picks up Carmelo Anunoby. Help arrives from Damian Turner! Damian Towns attempts a Dunk. Contested by Damian Turner (5.9 feet, ZONE). Damian Towns misses. Rebound secured by Vince Paul.

[09:13] Team_034 possession (Score: 83-70)
FOUL! Shooting foul on Cole Simmons. Nikola Wagner to the line for 2 free throws. [Team fouls: 3] (Cole Simmons: 1 personal fouls)   FT 1/2: GOOD   FT 2/2: MISS Nikola Wagner makes 1/2 from the line. Rebound secured by Victor McCollum.
Score: 84-70

[08:55] Team_083 possession (Score: 84-70)
Zion Markkanen drives and kicks out. Cole Simmons attempts a Midrange. Contested by Damian Turner (5.4 feet, ZONE). COLE SIMMONS MAKES IT! Assist: Victor McCollum
Score: 84-72

[08:45] Team_034 possession (Score: 84-72)
Damian Turner attempts a 3Pt. Contested by Zion Markkanen (5.8 feet, ZONE). DAMIAN TURNER MAKES IT! Assist: Carmelo Anunoby
Score: 87-72

[08:32] Team_083 possession (Score: 87-72)
Damian Towns attempts a 3Pt. Contested by Manu Jokic (5.2 feet, ZONE). Damian Towns misses. Rebound secured by Carmelo Anunoby.

[08:18] Team_034 possession (Score: 87-72)
FOUL! Holding foul on Victor McCollum. [Team fouls: 4] No free throws, side out. (Victor McCollum: 1 personal fouls)

[08:03] Team_034 possession (Score: 87-72)
Carmelo Anunoby drives to the basket... Carmelo Anunoby commits a violation (traveling/carry)! TURNOVER! (dead ball)

[07:49] Team_083 possession (Score: 87-72)
Domantas Doncic throws a bad pass! Stolen by Vince Paul! TURNOVER! (live ball)

[07:36] Team_034 possession (Score: 87-72)
FOUL! Shooting foul on Zion Markkanen. Manu Jokic to the line for 3 free throws. [BONUS: 5 team fouls] (Zion Markkanen: 2 personal fouls)   FT 1/3: GOOD   FT 2/3: GOOD   FT 3/3: GOOD Manu Jokic makes 3/3 from the line.
Score: 90-72

[07:21] Team_083 possession (Score: 90-72)
FOUL! Offensive foul on Domantas Doncic! Vince Paul drew the charge! [Team fouls: 6] (Domantas Doncic: 1 personal fouls) TURNOVER! (dead ball)

[07:03] Team_034 possession (Score: 90-72)
Nikola Wagner attempts a Midrange. Contested by Domantas Doncic (4.6 feet, ZONE). Nikola Wagner misses. Rebound secured by Damian Towns.

[06:50] Team_083 possession (Score: 90-72)
Cole Simmons drives and kicks out. Victor McCollum attempts a 3Pt. Contested by Vince Paul (4.2 feet, ZONE). Victor McCollum misses. Rebound secured by Vince Paul.

[06:37] Team_034 possession (Score: 90-72)
FOUL! Shooting foul on Cole Simmons. Manu Jokic to the line for 3 free throws. [BONUS: 7 team fouls] (Cole Simmons: 2 personal fouls)   FT 1/3: MISS   FT 2/3: GOOD   FT 3/3: MISS Manu Jokic makes 1/3 from the line. Offensive rebound by Vince Paul! Vince Paul puts it back in!
Score: 93-72

[06:26] Team_083 possession (Score: 93-72)
Domantas Doncic makes the Layup and draws the foul on Carmelo Anunoby! And-1! Domantas Doncic to the line for 1. [Team fouls: 1] (Carmelo Anunoby: 1 personal fouls)   FT 1/1: MISS Domantas Doncic makes 0/1 from the line. Rebound secured by Carmelo Anunoby.
Score: 93-74

[06:16] Team_034 possession (Score: 93-74)
Carmelo Anunoby attempts a Layup. Contested by Victor McCollum (4.1 feet, MAN). CARMELO ANUNOBY MAKES IT! Assist: Manu Jokic
Score: 95-74

[06:00] Team_083 possession (Score: 95-74)
Domantas Doncic drives and kicks out. Cole Simmons attempts a 3Pt. Contested by Vince Paul (4.2 feet, ZONE). Cole Simmons misses. Offensive rebound by Victor McCollum! Victor McCollum puts it back in!
Score: 95-76

[05:49] Team_034 possession (Score: 95-76)
FOUL! Reach-in foul on Victor McCollum during the drive. [IN THE BONUS! 8 team fouls] Vince Paul to the line for 2 free throws. (Victor McCollum: 2 personal fouls)   FT 1/2: GOOD   FT 2/2: MISS Vince Paul makes 1/2 from the line. Rebound secured by Damian Towns.
Score: 96-76

[05:37] Team_083 possession (Score: 96-76)
FOUL! Reach-in foul on Nikola Wagner during the drive. [Team fouls: 2] No free throws, side out. (Nikola Wagner: 1 personal fouls)

[05:24] Team_083 possession (Score: 96-76)
Zion Markkanen attempts a 3Pt. Contested by Manu Jokic (4.9 feet, MAN). Zion Markkanen misses. Rebound secured by Nikola Wagner.

[05:08] Team_034 possession (Score: 96-76)
FOUL! Shooting foul on Damian Towns. Damian Turner to the line for 3 free throws. [BONUS: 9 team fouls] (Damian Towns: 2 personal fouls)   FT 1/3: GOOD   FT 2/3: GOOD   FT 3/3: GOOD Damian Turner makes 3/3 from the line.
Score: 99-76

[04:58] Team_083 possession (Score: 99-76)
FOUL! Shooting foul on Vince Paul. Damian Towns to the line for 2 free throws. [Team fouls: 3] (Vince Paul: 1 personal fouls)   FT 1/2: MISS   FT 2/2: GOOD Damian Towns makes 1/2 from the line.
Score: 99-77

[04:44] Team_034 possession (Score: 99-77)
Carmelo Anunoby makes the Layup and draws the foul on Damian Towns! And-1! Carmelo Anunoby to the line for 1. [BONUS: 10 team fouls] (Damian Towns: 3 personal fouls)   FT 1/1: GOOD Carmelo Anunoby makes 1/1 from the line.
Score: 102-77

[04:28] Team_083 possession (Score: 102-77)
Zion Markkanen attempts a 3Pt. Contested by Manu Jokic (4.9 feet, MAN). ZION MARKKANEN MAKES IT! Assist: Victor McCollum
Score: 102-80

[04:12] Team_034 possession (Score: 102-80)
Nikola Wagner attempts a 3Pt. Contested by Zion Markkanen (5.5 feet, ZONE). Nikola Wagner misses. Rebound secured by Victor McCollum.

[04:02] Team_083 possession (Score: 102-80)
Damian Towns loses the ball! Stripped by Damian Turner! TURNOVER! (live ball)

[03:52] Team_034 possession (Score: 102-80)
Vince Paul attempts a 3Pt. Contested by Domantas Doncic (4.9 feet, MAN). Vince Paul misses. Rebound secured by Victor McCollum.

[03:37] Team_083 possession (Score: 102-80)
Zion Markkanen attempts a 3Pt. Contested by Manu Jokic (5.0 feet, MAN). ZION MARKKANEN MAKES IT! Assist: Domantas Doncic
Score: 102-83

[03:25] Team_034 possession (Score: 102-83)
Vince Paul drives to the basket... Vince Paul throws a bad pass out of bounds! TURNOVER! (dead ball)

[03:10] Team_083 possession (Score: 102-83)
Domantas Doncic attempts a 3Pt. Contested by Vince Paul (4.4 feet, MAN). DOMANTAS DONCIC MAKES IT! Assist: Cole Simmons
Score: 102-86

[02:55] Team_034 possession (Score: 102-86)
Carmelo Anunoby attempts a Midrange. Contested by Victor McCollum (4.2 feet, MAN). CARMELO ANUNOBY MAKES IT!
Score: 104-86

[02:37] Team_083 possession (Score: 104-86)
Damian Towns drives and kicks out. Damian Towns attempts a 3Pt. Contested by Vince Paul (4.4 feet, ZONE). DAMIAN TOWNS MAKES IT! Assist: Cole Simmons
Score: 104-89

[02:21] Team_034 possession (Score: 104-89)
Manu Jokic attempts a Midrange. Contested by Cole Simmons (5.0 feet, ZONE). Manu Jokic misses. Rebound secured by Victor McCollum.

[02:04] Team_083 possession (Score: 104-89)
Domantas Doncic makes the Dunk and draws the foul on Vince Paul! And-1! Domantas Doncic to the line for 1. [Team fouls: 4] (Vince Paul: 2 personal fouls)   FT 1/1: GOOD Domantas Doncic makes 1/1 from the line.
Score: 104-92

[01:51] Team_034 possession (Score: 104-92)
Vince Paul loses control! Ball rolls out of bounds! TURNOVER! (dead ball)

[01:37] Team_083 possession (Score: 104-92)
Victor McCollum attempts a 3Pt. Wide open! Carmelo Anunoby is 6.4 feet away. [MAN] Victor McCollum misses. Rebound secured by Nikola Wagner.

[01:19] Team_034 possession (Score: 104-92)
Manu Jokic drives and kicks out. Carmelo Anunoby attempts a 3Pt. Contested by Cole Simmons (5.1 feet, ZONE). CARMELO ANUNOBY MAKES IT! Assist: Damian Turner
Score: 107-92

[01:03] Team_083 possession (Score: 107-92)
Domantas Doncic drives, picks up Carmelo Anunoby. Help arrives from Damian Turner! Domantas Doncic attempts a Layup. Contested by Damian Turner (5.9 feet, ZONE). Domantas Doncic misses. Offensive rebound by Damian Towns! Damian Towns kicks it out.

[00:44] Team_083 possession (Score: 107-92)
FOUL! Offensive foul on Victor McCollum! Carmelo Anunoby drew the charge! [Team fouls: 11] (Victor McCollum: 3 personal fouls) TURNOVER! (dead ball)

[00:30] Team_034 possession (Score: 107-92)
Manu Jokic attempts a 3Pt. Contested by Zion Markkanen (5.7 feet, MAN). Manu Jokic misses. FOUL! Loose ball foul on Cole Simmons during the rebound battle. [IN THE BONUS! 12 team fouls] Carmelo Anunoby to the line for 2 free throws. (Cole Simmons: 3 personal fouls)   FT 1/2: GOOD   FT 2/2: MISS Carmelo Anunoby makes 1/2 from the line. FOUL! Loose ball foul on Victor McCollum during the free throw rebound! [IN THE BONUS! 13 team fouls] Carmelo Anunoby to the line for 2 free throws. (Victor McCollum: 4 personal fouls)   FT 1/2: GOOD   FT 2/2: GOOD Carmelo Anunoby makes 2/2 from the line.
Score: 110-92

[00:18] Team_083 possession (Score: 110-92)
Damian Towns attempts a 3Pt. Wide open! Damian Turner is 6.3 feet away. [MAN] Damian Towns misses. Rebound secured by Nikola Wagner.

[00:06] Team_034 possession (Score: 110-92)
Carmelo Anunoby drives and kicks out. Nikola Wagner attempts a 3Pt. Contested by Cole Simmons (5.2 feet, MAN). Nikola Wagner misses. Rebound secured by Victor McCollum.

================================================================================
                              4TH QUARTER COMPLETE                              
================================================================================

4TH QUARTER SCORE: Team_034 35, Team_083 26

BOX SCORE:
================================================================================

Team_034
--------------------------------------------------------------------------------
Player                MIN  PTS  REB  AST  TO      FG   FG%      3P   3P%
--------------------------------------------------------------------------------
Carmelo Anunoby        16   13    4    1   0   5/6    83.3     0/0   0.0
Manu Jokic             16    6    0    1   0   2/3    66.7     0/0   0.0
Damian Turner          16    6    0    1   0   2/2   100.0     0/0   0.0
Devin Poole            32    3    0    0   0   1/2    50.0     0/0   0.0
Vince Paul             16    3    2    0   0   1/3    33.3     0/0   0.0
Nikola Wagner          16    2    3    0   0   1/4    25.0     0/0   0.0
Cole Antetokounmpo     32    0    1    1   0   0/0     0.0     0/0   0.0

TEAM: FG: 12/20 (60.0%), 3PT: 7/10 (70.0%), REB: 10 (1 off, 9 def), AST: 4, TO: 4
TEAM FOULS: 4


Team_083
--------------------------------------------------------------------------------
Player                MIN  PTS  REB  AST  TO      FG   FG%      3P   3P%
--------------------------------------------------------------------------------
Domantas Doncic        16    6    0    1   0   2/3    66.7     0/0   0.0
Zion Markkanen         16    6    0    0   0   2/3    66.7     0/0   0.0
Cole Simmons           16    4    0    2   0   2/4    50.0     0/0   0.0
Damian Towns           16    4    3    1   0   2/5    40.0     0/0   0.0
Karl Jokic             32    2    0    0   0   1/2    50.0     0/0   0.0
Victor McCollum        16    2    6    2   0   1/2    50.0     0/0   0.0
Kyrie Griffin          32    0    1    0   0   0/0     0.0     0/0   0.0
Yao Oladipo            32    0    0    1   0   0/0     0.0     0/0   0.0

TEAM: FG: 10/19 (52.6%), 3PT: 3/9 (33.3%), REB: 10 (2 off, 8 def), AST: 7, TO: 4
TEAM FOULS: 13 [Team_034 in BONUS]

================================================================================

================================================================================
                               FULL GAME COMPLETE                               
================================================================================

FINAL SCORE: Team_034 110, Team_083 92

SCORING BY QUARTER:
--------------------------------------------------------------------------------
Team                     Q1     Q2     Q3     Q4    FINAL
--------------------------------------------------------------------------------
Team_034                 28     27     20     35      110
Team_083                 26     27     13     26       92
--------------------------------------------------------------------------------

FULL GAME BOX SCORE:
================================================================================

Team_034
--------------------------------------------------------------------------------
Player                MIN  PTS  REB  AST  TO      FG   FG%      3P   3P%      FT STL BLK
--------------------------------------------------------------------------------
Devin Poole            32   13    0    1   0   6/16   37.5   2/6    33.3   1/2     0   1
Ben Hyland             32   12    0    1   1   3/6    50.0   0/2     0.0   6/6     0   1
Cole Antetokounmpo     32   20    8    3   4   6/11   54.5   1/4    25.0   4/4     0   0
Terry Doncic           32    8    8    3   2   4/6    66.7   2/4    50.0   0/0     0   1
Anthony Bane           32    4   13    0   2   4/10   40.0   0/1     0.0   3/7     0   1
Manu Jokic             16   12    0    1   0   7/9    77.8   4/4   100.0   9/11    0   0
Damian Turner          16   11    0    1   1   4/4   100.0   2/2   100.0   4/4     1   0
Vince Paul             16    8    7    1   1   0/3     0.0   0/2     0.0   3/4     1   0
Nikola Wagner          16    4    4    0   0   3/7    42.9   1/3    33.3   1/2     0   0
Carmelo Anunoby        16   13    6    1   1   4/7    57.1   0/1     0.0   3/5     0   0

TEAM: FG: 43/81 (53.1%), 3PT: 12/29 (41.4%), REB: 45 (5 off, 40 def), AST: 12, TO: 12


Team_083
--------------------------------------------------------------------------------
Player                MIN  PTS  REB  AST  TO      FG   FG%      3P   3P%      FT STL BLK
--------------------------------------------------------------------------------
Malcolm Brogdon        32   13    0    0   2   5/11   45.5   2/5    40.0   2/2     0   0
Karl Jokic             32   15    0    1   1   8/11   72.7   5/7    71.4   3/3     2   0
Yao Oladipo            32    9    9    5   2   4/13   30.8   0/6     0.0   3/3     2   0
Kyrie Griffin          32    6   12    4   0   3/5    60.0   0/2     0.0   2/2     3   1
Bradley Thompson       32   15   12    2   0   4/11   36.4   0/0     0.0   3/3     0   0
Zion Markkanen         16    6    0    0   0   3/6    50.0   2/4    50.0   0/0     0   0
Damian Towns           16    8    7    2   1   4/8    50.0   0/3     0.0   1/2     0   0
Domantas Doncic        16    6    0    3   2   3/5    60.0   1/1   100.0   1/2     0   0
Cole Simmons           16   10    1    2   0   4/7    57.1   0/2     0.0   2/2     0   0
Victor McCollum        16    2    6    2   2   0/2     0.0   0/1     0.0   0/0     0   0

TEAM: FG: 40/81 (49.4%), 3PT: 10/31 (32.3%), REB: 46 (9 off, 37 def), AST: 21, TO: 10

================================================================================
