================================================================================
                        FULL GAME - Team_076 vs Team_010                        
================================================================================

================================================================================
                       1ST QUARTER - Team_076 vs Team_010                       
================================================================================

[12:00] Team_076 possession (Score: 0-0)
Cade Barnes drives and kicks out. FOUL! Shooting foul on Michael Turner. Tobias Mitchell to the line for 2 free throws. [Team fouls: 1] (Michael Turner: 1 personal fouls)   FT 1/2: GOOD   FT 2/2: GOOD Tobias Mitchell makes 2/2 from the line.
Score: 2-0

[11:44] Team_010 possession (Score: 2-0)
FOUL! Reach-in foul on Cade Barnes during the drive. [Team fouls: 1] No free throws, side out. (Cade Barnes: 1 personal fouls)

[11:27] Team_010 possession (Score: 2-0)
Cade Morant throws a bad pass out of bounds! TURNOVER! (dead ball)

[11:08] Team_076 possession (Score: 2-0)
Cade Barnes drives to the basket... Cade Barnes throws a bad pass! Stolen by Desmond Antetokounmpo! TURNOVER! (live ball)

[10:57] Team_010 possession (Score: 2-0)
Cade Morant attempts a Midrange. Contested by Dejounte LaVine (5.3 feet, MAN). Cade Morant misses. Rebound secured by Tobias Mitchell.

[10:43] Team_076 possession (Score: 2-0)
Paul Leonard drives and kicks out. Tobias Mitchell attempts a 3Pt. Contested by Michael Turner (4.0 feet, MAN). Tobias Mitchell misses. Offensive rebound by Cade Barnes! Cade Barnes kicks it out.

[10:32] Team_076 possession (Score: 2-0)
Dejounte LaVine attempts a 3Pt. Contested by Cade Morant (3.8 feet, MAN). Dejounte LaVine misses. Rebound secured by Anthony Durant.

[10:17] Team_010 possession (Score: 2-0)
Desmond Antetokounmpo drives, Cade Barnes stays with him. Desmond Antetokounmpo attempts a Layup. Contested by Cade Barnes (3.7 feet, ZONE). Desmond Antetokounmpo misses. Rebound secured by Cade Barnes.

[10:05] Team_076 possession (Score: 2-0)
Dejounte LaVine attempts a Midrange. Contested by Cade Morant (3.8 feet, MAN). Dejounte LaVine misses. Offensive rebound by Cade Barnes! Cade Barnes kicks it out.

[09:50] Team_076 possession (Score: 2-0)
Dejounte LaVine attempts a 3Pt. Contested by Cade Morant (3.8 feet, MAN). Dejounte LaVine misses. Rebound secured by Cade Morant.

[09:36] Team_010 possession (Score: 2-0)
Desmond Antetokounmpo makes the Dunk and draws the foul on Cade Barnes! And-1! Desmond Antetokounmpo to the line for 1. [Team fouls: 2] (Cade Barnes: 2 personal fouls)   FT 1/1: GOOD Desmond Antetokounmpo makes 1/1 from the line.
Score: 2-3

[09:22] Team_076 possession (Score: 2-3)
Tobias Mitchell drives and kicks out. Tobias Mitchell makes the 3Pt and draws the foul on Cade Morant! And-1! Tobias Mitchell to the line for 1. [Team fouls: 2] (Cade Morant: 1 personal fouls)   FT 1/1: GOOD Tobias Mitchell makes 1/1 from the line.
Score: 6-3

[09:08] Team_010 possession (Score: 6-3)
Desmond Antetokounmpo drives and kicks out. Cade Morant attempts a Midrange. Contested by Dejounte LaVine (4.8 feet, MAN). Cade Morant misses. Rebound secured by D'Angelo Tatum.

[08:52] Team_076 possession (Score: 6-3)
FOUL! Shooting foul on Desmond Antetokounmpo. Cade Barnes to the line for 2 free throws. [Team fouls: 3] (Desmond Antetokounmpo: 1 personal fouls)   FT 1/2: GOOD   FT 2/2: GOOD Cade Barnes makes 2/2 from the line.
Score: 8-3

[08:35] Team_010 possession (Score: 8-3)
Desmond Antetokounmpo attempts a 3Pt. Contested by Cade Barnes (3.7 feet, MAN). Desmond Antetokounmpo misses. Rebound secured by Tobias Mitchell.

[08:17] Team_076 possession (Score: 8-3)
Tobias Mitchell attempts a 3Pt. Contested by Cade Morant (4.3 feet, ZONE). Tobias Mitchell misses. Rebound secured by Anthony Durant.

[08:03] Team_010 possession (Score: 8-3)
Cade Morant attempts a 3Pt. Contested by Dejounte LaVine (5.3 feet, MAN). Cade Morant misses. Rebound secured by Cade Barnes.

[07:48] Team_076 possession (Score: 8-3)
D'Angelo Tatum drives to the basket... D'Angelo Tatum commits a violation (traveling/carry)! TURNOVER! (dead ball)

[07:38] Team_010 possession (Score: 8-3)
Michael Turner loses the ball! Stripped by Tobias Mitchell! TURNOVER! (live ball)

[07:27] Team_076 possession (Score: 8-3)
D'Angelo Tatum attempts a Midrange. Contested by RJ Young (5.0 feet, ZONE). D'ANGELO TATUM MAKES IT! Assist: Cade Barnes
Score: 10-3

[07:12] Team_010 possession (Score: 10-3)
Desmond Antetokounmpo attempts a 3Pt. Contested by Cade Barnes (3.7 feet, ZONE). DESMOND ANTETOKOUNMPO MAKES IT! Assist: Cade Morant
Score: 10-6

[06:55] Team_076 possession (Score: 10-6)
Cade Barnes attempts a 3Pt. Contested by Cade Morant (4.1 feet, ZONE). Cade Barnes misses. Rebound secured by Anthony Durant.

[06:43] Team_010 possession (Score: 10-6)
Anthony Durant drives, Cade Barnes stays with him. Anthony Durant attempts a Layup. Contested by Cade Barnes (3.8 feet, ZONE). ANTHONY DURANT MAKES IT! Assist: Desmond Antetokounmpo
Score: 10-8

[06:30] Team_076 possession (Score: 10-8)
Paul Leonard drives, picks up RJ Young. Help arrives from Cade Morant! Paul Leonard attempts a Dunk. Contested by Cade Morant (5.1 feet, MAN). Paul Leonard misses. Offensive rebound by D'Angelo Tatum! D'Angelo Tatum kicks it out.

[06:16] Team_076 possession (Score: 10-8)
Dejounte LaVine drives, Anthony Durant stays with him. Dejounte LaVine attempts a Dunk. Contested by Anthony Durant (3.4 feet, ZONE). DEJOUNTE LAVINE MAKES IT! Assist: Cade Barnes
Score: 12-8

[06:04] Team_010 possession (Score: 12-8)
RJ Young attempts a 3Pt. Contested by Cade Barnes (3.3 feet, ZONE). RJ Young misses. Offensive rebound by Cade Morant! Cade Morant kicks it out.

[05:47] Team_010 possession (Score: 12-8)
Cade Morant attempts a 3Pt. Contested by Cade Barnes (4.0 feet, ZONE). Cade Morant misses. Rebound secured by Cade Barnes.

[05:33] Team_076 possession (Score: 12-8)
Paul Leonard attempts a Layup. Contested by RJ Young (5.1 feet, MAN). Paul Leonard misses. Offensive rebound by D'Angelo Tatum! D'Angelo Tatum kicks it out.

[05:17] Team_076 possession (Score: 12-8)
Paul Leonard drives and kicks out. Dejounte LaVine attempts a Midrange. Contested by Cade Morant (3.9 feet, ZONE). Dejounte LaVine misses. Rebound secured by Cade Morant.

[05:01] Team_010 possession (Score: 12-8)
Desmond Antetokounmpo attempts a 3Pt. Contested by Dejounte LaVine (5.0 feet, ZONE). Desmond Antetokounmpo misses. Rebound secured by D'Angelo Tatum.

[04:43] Team_076 possession (Score: 12-8)
Paul Leonard drives to the basket... FOUL! Offensive foul on Paul Leonard! RJ Young drew the charge! [Team fouls: 3] (Paul Leonard: 1 personal fouls) TURNOVER! (dead ball)

[04:28] Team_010 possession (Score: 12-8)
Desmond Antetokounmpo attempts a Midrange. Contested by Cade Barnes (3.7 feet, MAN). DESMOND ANTETOKOUNMPO MAKES IT! Assist: Anthony Durant
Score: 12-10

[04:13] Team_076 possession (Score: 12-10)
FOUL! Offensive foul on Paul Leonard! RJ Young drew the charge! [Team fouls: 4] (Paul Leonard: 2 personal fouls) TURNOVER! (dead ball)

[04:02] Team_010 possession (Score: 12-10)
Anthony Durant throws a bad pass out of bounds! TURNOVER! (dead ball)

[03:45] Team_076 possession (Score: 12-10)
FOUL! Reach-in foul on Anthony Durant during the drive. [Team fouls: 4] No free throws, side out. (Anthony Durant: 1 personal fouls)

[03:31] Team_076 possession (Score: 12-10)
FOUL! Shooting foul on Desmond Antetokounmpo. Cade Barnes to the line for 2 free throws. [BONUS: 5 team fouls] (Desmond Antetokounmpo: 2 personal fouls)   FT 1/2: MISS   FT 2/2: MISS Cade Barnes makes 0/2 from the line. Offensive rebound by Cade Barnes! Cade Barnes kicks it out.

[03:13] Team_076 possession (Score: 12-10)
FOUL! Shooting foul on Michael Turner. Tobias Mitchell to the line for 2 free throws. [BONUS: 6 team fouls] (Michael Turner: 2 personal fouls)   FT 1/2: GOOD   FT 2/2: GOOD Tobias Mitchell makes 2/2 from the line.
Score: 14-10

[02:56] Team_010 possession (Score: 14-10)
Anthony Durant throws a bad pass out of bounds! TURNOVER! (dead ball)

[02:44] Team_076 possession (Score: 14-10)
FOUL! Shooting foul on Anthony Durant. D'Angelo Tatum to the line for 2 free throws. [BONUS: 7 team fouls] (Anthony Durant: 2 personal fouls)   FT 1/2: GOOD   FT 2/2: GOOD D'Angelo Tatum makes 2/2 from the line.
Score: 16-10

[02:30] Team_010 possession (Score: 16-10)
Cade Morant makes the Layup and draws the foul on D'Angelo Tatum! And-1! Cade Morant to the line for 1. [BONUS: 5 team fouls] (D'Angelo Tatum: 1 personal fouls)   FT 1/1: MISS Cade Morant makes 0/1 from the line. Offensive rebound by Cade Morant! Cade Morant kicks it out.
Score: 16-12

[02:16] Team_010 possession (Score: 16-12)
Cade Morant attempts a 3Pt. Contested by Paul Leonard (5.8 feet, ZONE). Cade Morant misses. Rebound secured by Tobias Mitchell.

[02:00] Team_076 possession (Score: 16-12)
Dejounte LaVine attempts a 3Pt. Contested by Cade Morant (4.1 feet, ZONE). DEJOUNTE LAVINE MAKES IT! Assist: Cade Barnes
Score: 19-12

[01:45] Team_010 possession (Score: 19-12)
Michael Turner attempts a 3Pt. Contested by Tobias Mitchell (4.7 feet, MAN). MICHAEL TURNER MAKES IT! Assist: RJ Young
Score: 19-15

[01:30] Team_076 possession (Score: 19-15)
Cade Barnes makes the Midrange and draws the foul on Michael Turner! And-1! Cade Barnes to the line for 1. [BONUS: 8 team fouls] (Michael Turner: 3 personal fouls)   FT 1/1: GOOD Cade Barnes makes 1/1 from the line.
Score: 22-15

[01:18] Team_010 possession (Score: 22-15)
RJ Young commits a violation (traveling/carry)! TURNOVER! (dead ball)

[01:18] Substitution (Team_076): Dejounte LaVine OUT → Pascal Lowry IN (stamina_rule2)

[01:18] Substitution (Team_076): Tobias Mitchell OUT → Jalen Poole IN (stamina_rule2)

[01:18] Substitution (Team_076): Paul Leonard OUT → Vince Lowry IN (stamina_rule2)

[01:18] Substitution (Team_076): Cade Barnes OUT → Kevin Nowitzki IN (stamina_rule2)

[01:18] Substitution (Team_076): D'Angelo Tatum OUT → Jordan Doncic IN (stamina_rule2)

[01:18] Substitution (Team_010): Cade Morant OUT → Draymond Leonard IN (stamina_rule2)

[01:18] Substitution (Team_010): Michael Turner OUT → Blake Harden IN (stamina_rule2)

[01:18] Substitution (Team_010): RJ Young OUT → Ben Gilgeous-Alexander IN (stamina_rule2)

[01:18] Substitution (Team_010): Desmond Antetokounmpo OUT → Vince Ingram IN (stamina_rule2)

[01:18] Substitution (Team_010): Anthony Durant OUT → Paolo Wade IN (stamina_rule2)

[01:04] Team_076 possession (Score: 22-15)
Jalen Poole drives to the basket... Jalen Poole throws a bad pass out of bounds! TURNOVER! (dead ball)

[00:51] Team_010 possession (Score: 22-15)
Draymond Leonard drives, Pascal Lowry stays with him. Draymond Leonard attempts a Layup. Wide open! Pascal Lowry is 6.7 feet away. [MAN] DRAYMOND LEONARD MAKES IT! Assist: Paolo Wade
Score: 22-17

[00:33] Team_076 possession (Score: 22-17)
Vince Lowry drives to the basket... Vince Lowry loses the ball! Stripped by Paolo Wade! TURNOVER! (live ball)

[00:20] Team_010 possession (Score: 22-17)
Draymond Leonard attempts a Midrange. Wide open! Pascal Lowry is 6.7 feet away. [MAN] DRAYMOND LEONARD MAKES IT!
Score: 22-19

[00:08] Team_076 possession (Score: 22-19)
Vince Lowry drives, Ben Gilgeous-Alexander stays with him. Vince Lowry attempts a Dunk. Contested by Ben Gilgeous-Alexander (4.5 feet, MAN). VINCE LOWRY MAKES IT!
Score: 24-19

================================================================================
                              1ST QUARTER COMPLETE                              
================================================================================

1ST QUARTER SCORE: Team_076 24, Team_010 19

BOX SCORE:
================================================================================

Team_076
--------------------------------------------------------------------------------
Player                MIN  PTS  REB  AST  TO      FG   FG%      3P   3P%
--------------------------------------------------------------------------------
Tobias Mitchell        11    8    3    0   0   3/4    75.0     0/0   0.0
Cade Barnes            11    5    6    3   0   2/3    66.7     0/0   0.0
Dejounte LaVine        11    5    0    0   0   2/4    50.0     0/0   0.0
D'Angelo Tatum         11    4    4    0   0   2/2   100.0     0/0   0.0
Vince Lowry             1    2    0    0   0   1/1   100.0     0/0   0.0
Paul Leonard           11    0    0    0   0   0/1     0.0     0/0   0.0

TEAM: FG: 10/15 (66.7%), 3PT: 1/5 (20.0%), REB: 13 (5 off, 8 def), AST: 3, TO: 6
TEAM FOULS: 5 [Team_010 in BONUS]


Team_010
--------------------------------------------------------------------------------
Player                MIN  PTS  REB  AST  TO      FG   FG%      3P   3P%
--------------------------------------------------------------------------------
Desmond Antetokounmpo   11    8    0    1   0   3/7    42.9     0/0   0.0
Draymond Leonard        1    4    0    0   0   2/2   100.0     0/0   0.0
Michael Turner         11    3    0    0   0   1/1   100.0     0/0   0.0
Anthony Durant         11    2    3    1   0   1/1   100.0     0/0   0.0
Cade Morant            11    0    4    1   0   0/4     0.0     0/0   0.0
RJ Young               11    0    0    1   0   0/0     0.0     0/0   0.0
Paolo Wade              1    0    0    1   0   0/0     0.0     0/0   0.0

TEAM: FG: 7/15 (46.7%), 3PT: 2/7 (28.6%), REB: 7 (2 off, 5 def), AST: 5, TO: 5
TEAM FOULS: 8 [Team_076 in BONUS]

================================================================================

================================================================================
                       2ND QUARTER - Team_076 vs Team_010                       
================================================================================

[12:00] Team_076 possession (Score: 24-19)
FOUL! Reach-in foul on Desmond Antetokounmpo during the drive. [Team fouls: 1] No free throws, side out. (Desmond Antetokounmpo: 1 personal fouls)

[11:45] Team_076 possession (Score: 24-19)
FOUL! Shooting foul on Desmond Antetokounmpo. Paul Leonard to the line for 2 free throws. [Team fouls: 2] (Desmond Antetokounmpo: 2 personal fouls)   FT 1/2: GOOD   FT 2/2: GOOD Paul Leonard makes 2/2 from the line.
Score: 26-19

[11:31] Team_010 possession (Score: 26-19)
Desmond Antetokounmpo attempts a Midrange. Contested by Paul Leonard (5.4 feet, ZONE). Desmond Antetokounmpo misses. Offensive rebound by Anthony Durant! Anthony Durant kicks it out.

[11:14] Team_010 possession (Score: 26-19)
Anthony Durant drives, Cade Barnes stays with him. Anthony Durant attempts a Layup. Contested by Cade Barnes (4.0 feet, ZONE). ANTHONY DURANT MAKES IT! Assist: Cade Morant
Score: 26-21

[11:01] Team_076 possession (Score: 26-21)
D'Angelo Tatum drives, Anthony Durant stays with him. D'Angelo Tatum attempts a Layup. Contested by Anthony Durant (4.0 feet, ZONE). D'ANGELO TATUM MAKES IT! Assist: Dejounte LaVine
Score: 28-21

[10:46] Team_010 possession (Score: 28-21)
Desmond Antetokounmpo makes the Midrange and draws the foul on Cade Barnes! And-1! Desmond Antetokounmpo to the line for 1. [Team fouls: 1] (Cade Barnes: 1 personal fouls)   FT 1/1: GOOD Desmond Antetokounmpo makes 1/1 from the line.
Score: 28-24

[10:34] Team_076 possession (Score: 28-24)
Tobias Mitchell attempts a 3Pt. Contested by Michael Turner (4.6 feet, MAN). Tobias Mitchell misses. Rebound secured by Michael Turner.

[10:20] Team_010 possession (Score: 28-24)
Desmond Antetokounmpo makes the Midrange and draws the foul on Cade Barnes! And-1! Desmond Antetokounmpo to the line for 1. [Team fouls: 2] (Cade Barnes: 2 personal fouls)   FT 1/1: GOOD Desmond Antetokounmpo makes 1/1 from the line.
Score: 28-27

[10:06] Team_076 possession (Score: 28-27)
D'Angelo Tatum attempts a Layup. Contested by Anthony Durant (4.1 feet, ZONE). D'ANGELO TATUM MAKES IT!
Score: 30-27

[09:48] Team_010 possession (Score: 30-27)
Desmond Antetokounmpo attempts a Layup. Contested by Cade Barnes (4.0 feet, ZONE). DESMOND ANTETOKOUNMPO MAKES IT!
Score: 30-29

[09:34] Team_076 possession (Score: 30-29)
Paul Leonard attempts a 3Pt. Contested by Cade Morant (4.6 feet, ZONE). PAUL LEONARD MAKES IT! Assist: Dejounte LaVine
Score: 33-29

[09:17] Team_010 possession (Score: 33-29)
Anthony Durant loses the ball! Stripped by D'Angelo Tatum! TURNOVER! (live ball)

[09:01] Team_076 possession (Score: 33-29)
Cade Barnes attempts a Layup. Contested by Anthony Durant (4.2 feet, ZONE). Cade Barnes misses. Rebound secured by Anthony Durant.

[08:46] Team_010 possession (Score: 33-29)
Anthony Durant drives and kicks out. Cade Morant attempts a 3Pt. Contested by Dejounte LaVine (5.3 feet, MAN). CADE MORANT MAKES IT! Assist: Michael Turner
Score: 33-32

[08:29] Team_076 possession (Score: 33-32)
Cade Barnes attempts a Midrange. Contested by RJ Young (5.3 feet, ZONE). Cade Barnes misses. Rebound secured by Cade Morant.

[08:16] Team_010 possession (Score: 33-32)
RJ Young attempts a 3Pt. Contested by Paul Leonard (5.3 feet, MAN). RJ YOUNG MAKES IT! Assist: Cade Morant
Score: 33-35

[08:00] Team_076 possession (Score: 33-35)
Cade Barnes attempts a 3Pt. Contested by Desmond Antetokounmpo (4.9 feet, MAN). Cade Barnes misses. Rebound secured by Anthony Durant.

[07:50] Team_010 possession (Score: 33-35)
Desmond Antetokounmpo drives to the basket... Desmond Antetokounmpo loses the ball! Stripped by Cade Barnes! TURNOVER! (live ball)

[07:36] Team_076 possession (Score: 33-35)
Dejounte LaVine drives to the basket... Dejounte LaVine loses the ball! Stripped by Cade Morant! TURNOVER! (live ball)

[07:19] Team_010 possession (Score: 33-35)
RJ Young attempts a 3Pt. Contested by Paul Leonard (5.4 feet, MAN). RJ YOUNG MAKES IT! Assist: Michael Turner
Score: 33-38

[07:06] Team_076 possession (Score: 33-38)
D'Angelo Tatum drives, picks up Anthony Durant. Help arrives from Cade Morant! D'Angelo Tatum attempts a Layup. Contested by Cade Morant (4.5 feet, ZONE). D'ANGELO TATUM MAKES IT! Assist: Tobias Mitchell
Score: 35-38

[06:54] Team_010 possession (Score: 35-38)
Michael Turner attempts a Midrange. Contested by Paul Leonard (5.9 feet, ZONE). MICHAEL TURNER MAKES IT! Assist: Desmond Antetokounmpo
Score: 35-40

[06:40] Team_076 possession (Score: 35-40)
FOUL! Shooting foul on RJ Young. Paul Leonard to the line for 2 free throws. [Team fouls: 3] (RJ Young: 1 personal fouls)   FT 1/2: GOOD   FT 2/2: GOOD Paul Leonard makes 2/2 from the line.
Score: 37-40

[06:26] Team_010 possession (Score: 37-40)
Desmond Antetokounmpo attempts a Layup. Contested by Cade Barnes (4.4 feet, MAN). DESMOND ANTETOKOUNMPO MAKES IT!
Score: 37-42

[06:13] Team_076 possession (Score: 37-42)
Cade Barnes attempts a Layup. Contested by Anthony Durant (4.6 feet, ZONE). Cade Barnes misses. Rebound secured by Anthony Durant.

[05:59] Team_010 possession (Score: 37-42)
Michael Turner attempts a 3Pt. Contested by Cade Barnes (4.6 feet, ZONE). Michael Turner misses. Rebound secured by Cade Barnes.

[05:40] Team_076 possession (Score: 37-42)
Cade Barnes attempts a Midrange. Contested by Michael Turner (5.0 feet, ZONE). Cade Barnes misses. Rebound secured by Anthony Durant.

[05:27] Team_010 possession (Score: 37-42)
Michael Turner makes the Layup and draws the foul on Tobias Mitchell! And-1! Michael Turner to the line for 1. [Team fouls: 3] (Tobias Mitchell: 1 personal fouls)   FT 1/1: GOOD Michael Turner makes 1/1 from the line.
Score: 37-45

[05:10] Team_076 possession (Score: 37-45)
FOUL! Shooting foul on Cade Morant. Paul Leonard to the line for 2 free throws. [Team fouls: 4] (Cade Morant: 1 personal fouls)   FT 1/2: GOOD   FT 2/2: GOOD Paul Leonard makes 2/2 from the line.
Score: 39-45

[04:54] Team_010 possession (Score: 39-45)
FOUL! Reach-in foul on Paul Leonard during the drive. [Team fouls: 4] No free throws, side out. (Paul Leonard: 1 personal fouls)

[04:39] Team_010 possession (Score: 39-45)
RJ Young drives, Cade Barnes stays with him. RJ Young attempts a Layup. Contested by Cade Barnes (4.4 feet, ZONE). RJ YOUNG MAKES IT! Assist: Michael Turner
Score: 39-47

[04:22] Team_076 possession (Score: 39-47)
FOUL! Shooting foul on RJ Young. Dejounte LaVine to the line for 2 free throws. [BONUS: 5 team fouls] (RJ Young: 2 personal fouls)   FT 1/2: MISS   FT 2/2: GOOD Dejounte LaVine makes 1/2 from the line.
Score: 40-47

[04:05] Team_010 possession (Score: 40-47)
Cade Morant attempts a Midrange. Wide open! Dejounte LaVine is 6.2 feet away. [MAN] CADE MORANT MAKES IT! Assist: Michael Turner
Score: 40-49

[03:50] Team_076 possession (Score: 40-49)
Paul Leonard makes the Layup and draws the foul on Anthony Durant! And-1! Paul Leonard to the line for 1. [BONUS: 6 team fouls] (Anthony Durant: 1 personal fouls)   FT 1/1: GOOD Paul Leonard makes 1/1 from the line.
Score: 43-49

[03:36] Team_010 possession (Score: 43-49)
Michael Turner drives, picks up D'Angelo Tatum. Help arrives from Tobias Mitchell! Michael Turner attempts a Dunk. Contested by Tobias Mitchell (5.0 feet, ZONE). Michael Turner misses. Rebound secured by D'Angelo Tatum.

[03:26] Team_076 possession (Score: 43-49)
Dejounte LaVine attempts a 3Pt. Contested by Cade Morant (5.1 feet, MAN). Dejounte LaVine misses. Rebound secured by Cade Morant.

[03:13] Team_010 possession (Score: 43-49)
Michael Turner attempts a Midrange. Contested by Tobias Mitchell (5.5 feet, MAN). MICHAEL TURNER MAKES IT! Assist: Desmond Antetokounmpo
Score: 43-51

[02:59] Team_076 possession (Score: 43-51)
Paul Leonard attempts a 3Pt. Wide open! RJ Young is 6.1 feet away. [ZONE] Paul Leonard misses. Rebound secured by Cade Morant.

[02:44] Team_010 possession (Score: 43-51)
RJ Young attempts a 3Pt. Contested by Paul Leonard (6.0 feet, MAN). RJ Young misses. Rebound secured by Cade Barnes.

[02:29] Team_076 possession (Score: 43-51)
Cade Barnes drives, picks up Anthony Durant. Help arrives from Cade Morant! Cade Barnes attempts a Dunk. Contested by Cade Morant (5.1 feet, ZONE). CADE BARNES MAKES IT! Assist: Paul Leonard
Score: 45-51

[02:16] Team_010 possession (Score: 45-51)
Anthony Durant drives, D'Angelo Tatum stays with him. Anthony Durant attempts a Dunk. Contested by D'Angelo Tatum (5.2 feet, MAN). ANTHONY DURANT MAKES IT!
Score: 45-53

[02:00] Team_076 possession (Score: 45-53)
Dejounte LaVine attempts a 3Pt. BLOCKED BY CADE MORANT! Ball deflects out of bounds off Dejounte LaVine.

[01:43] Team_010 possession (Score: 45-53)
Anthony Durant attempts a Layup. Contested by D'Angelo Tatum (5.3 feet, MAN). ANTHONY DURANT MAKES IT! Assist: RJ Young
Score: 45-55

[01:30] Team_076 possession (Score: 45-55)
D'Angelo Tatum attempts a Midrange. Contested by Anthony Durant (5.3 feet, MAN). D'ANGELO TATUM MAKES IT! Assist: Tobias Mitchell
Score: 47-55

[01:16] Team_010 possession (Score: 47-55)
Anthony Durant attempts a Midrange. Contested by D'Angelo Tatum (5.4 feet, MAN). Anthony Durant misses. Offensive rebound by Anthony Durant! Anthony Durant kicks it out.

[01:00] Team_010 possession (Score: 47-55)
FOUL! Shooting foul on Paul Leonard. Anthony Durant to the line for 2 free throws. [BONUS: 5 team fouls] (Paul Leonard: 2 personal fouls)   FT 1/2: GOOD   FT 2/2: GOOD Anthony Durant makes 2/2 from the line.
Score: 47-57

[00:46] Team_076 possession (Score: 47-57)
D'Angelo Tatum attempts a Layup. BLOCKED BY CADE MORANT! Ball deflects out of bounds off D'Angelo Tatum.

[00:27] Team_010 possession (Score: 47-57)
Michael Turner attempts a Layup. BLOCKED BY TOBIAS MITCHELL! Ball is loose! Rebound secured by Cade Barnes.

[00:13] Team_076 possession (Score: 47-57)
Tobias Mitchell attempts a 3Pt. Contested by Michael Turner (5.8 feet, MAN). Tobias Mitchell misses. Rebound secured by Anthony Durant.

================================================================================
                              2ND QUARTER COMPLETE                              
================================================================================

2ND QUARTER SCORE: Team_076 23, Team_010 38

BOX SCORE:
================================================================================

Team_076
--------------------------------------------------------------------------------
Player                MIN  PTS  REB  AST  TO      FG   FG%      3P   3P%
--------------------------------------------------------------------------------
Paul Leonard           23   12    0    1   0   5/6    83.3     0/0   0.0
D'Angelo Tatum         23    8    1    0   0   4/5    80.0     0/0   0.0
Cade Barnes            23    2    3    0   0   1/6    16.7     0/0   0.0
Dejounte LaVine        23    1    0    2   0   1/3    33.3     0/0   0.0
Tobias Mitchell        23    0    0    2   0   0/2     0.0     0/0   0.0

TEAM: FG: 11/22 (50.0%), 3PT: 1/7 (14.3%), REB: 4 (0 off, 4 def), AST: 5, TO: 1
TEAM FOULS: 5 [Team_010 in BONUS]


Team_010
--------------------------------------------------------------------------------
Player                MIN  PTS  REB  AST  TO      FG   FG%      3P   3P%
--------------------------------------------------------------------------------
Desmond Antetokounmpo   23   10    0    2   0   4/4   100.0     0/0   0.0
Anthony Durant         23    8    7    0   0   4/4   100.0     0/0   0.0
RJ Young               23    8    0    1   0   3/4    75.0     0/0   0.0
Michael Turner         23    7    1    4   0   3/6    50.0     0/0   0.0
Cade Morant            23    5    3    2   0   2/2   100.0     0/0   0.0

TEAM: FG: 16/20 (80.0%), 3PT: 2/4 (50.0%), REB: 11 (2 off, 9 def), AST: 9, TO: 2
TEAM FOULS: 6 [Team_076 in BONUS]

================================================================================

================================================================================
                       3RD QUARTER - Team_076 vs Team_010                       
================================================================================

[12:00] Team_076 possession (Score: 47-57)
Dejounte LaVine attempts a 3Pt. Contested by RJ Young (4.6 feet, ZONE). Dejounte LaVine misses. Rebound secured by Anthony Durant.

[11:46] Team_010 possession (Score: 47-57)
Michael Turner attempts a 3Pt. Contested by Cade Barnes (3.8 feet, ZONE). Michael Turner misses. Rebound secured by Tobias Mitchell.

[11:32] Team_076 possession (Score: 47-57)
Cade Barnes attempts a Midrange. BLOCKED BY DESMOND ANTETOKOUNMPO! Ball is loose! Rebound secured by Anthony Durant.

[11:18] Team_010 possession (Score: 47-57)
Cade Morant attempts a Midrange. Contested by Dejounte LaVine (5.3 feet, MAN). Cade Morant misses. Offensive rebound by Anthony Durant! Anthony Durant kicks it out.

[11:04] Team_010 possession (Score: 47-57)
Cade Morant attempts a 3Pt. Contested by Dejounte LaVine (5.3 feet, MAN). CADE MORANT MAKES IT! Assist: Anthony Durant
Score: 47-60

[10:49] Team_076 possession (Score: 47-60)
Tobias Mitchell drives and kicks out. FOUL! Shooting foul on Cade Morant. D'Angelo Tatum to the line for 3 free throws. [Team fouls: 1] (Cade Morant: 1 personal fouls)   FT 1/3: GOOD   FT 2/3: GOOD   FT 3/3: GOOD D'Angelo Tatum makes 3/3 from the line.
Score: 50-60

[10:32] Team_010 possession (Score: 50-60)
Desmond Antetokounmpo attempts a 3Pt. Contested by Cade Barnes (3.7 feet, MAN). Desmond Antetokounmpo misses. Rebound secured by Tobias Mitchell.

[10:20] Team_076 possession (Score: 50-60)
D'Angelo Tatum drives, picks up Anthony Durant. Help arrives from Cade Morant! D'Angelo Tatum attempts a Dunk. Contested by Cade Morant (3.7 feet, ZONE). D'ANGELO TATUM MAKES IT! Assist: Paul Leonard
Score: 52-60

[10:07] Team_010 possession (Score: 52-60)
Cade Morant drives to the basket... Cade Morant loses control! Ball rolls out of bounds! TURNOVER! (dead ball)

[09:52] Team_076 possession (Score: 52-60)
FOUL! Reach-in foul on Anthony Durant during the drive. [Team fouls: 2] No free throws, side out. (Anthony Durant: 1 personal fouls)

[09:39] Team_076 possession (Score: 52-60)
Tobias Mitchell makes the Layup and draws the foul on Anthony Durant! And-1! Tobias Mitchell to the line for 1. [Team fouls: 3] (Anthony Durant: 2 personal fouls)   FT 1/1: GOOD Tobias Mitchell makes 1/1 from the line.
Score: 55-60

[09:20] Team_010 possession (Score: 55-60)
Cade Morant attempts a 3Pt. Contested by Dejounte LaVine (5.3 feet, MAN). CADE MORANT MAKES IT! Assist: Desmond Antetokounmpo
Score: 55-63

[09:05] Team_076 possession (Score: 55-63)
Paul Leonard attempts a 3Pt. Contested by Cade Morant (4.2 feet, ZONE). PAUL LEONARD MAKES IT! Assist: Dejounte LaVine
Score: 58-63

[08:49] Team_010 possession (Score: 58-63)
Michael Turner attempts a 3Pt. Contested by Cade Barnes (3.8 feet, ZONE). Michael Turner misses. Rebound secured by Tobias Mitchell.

[08:32] Team_076 possession (Score: 58-63)
D'Angelo Tatum drives and kicks out. Paul Leonard attempts a 3Pt. Contested by RJ Young (4.7 feet, MAN). PAUL LEONARD MAKES IT! Assist: Dejounte LaVine
Score: 61-63

[08:16] Team_010 possession (Score: 61-63)
Anthony Durant attempts a 3Pt. Contested by Cade Barnes (3.8 feet, ZONE). Anthony Durant misses. Offensive rebound by Cade Morant! Cade Morant kicks it out.

[08:00] Team_010 possession (Score: 61-63)
FOUL! Offensive foul on RJ Young! Paul Leonard drew the charge! [Team fouls: 4] (RJ Young: 1 personal fouls) TURNOVER! (dead ball)

[07:49] Team_076 possession (Score: 61-63)
Dejounte LaVine attempts a 3Pt. Contested by Cade Morant (3.8 feet, MAN). Dejounte LaVine misses. Offensive rebound by D'Angelo Tatum! D'Angelo Tatum kicks it out.

[07:36] Team_076 possession (Score: 61-63)
Cade Barnes drives to the basket... Cade Barnes loses the ball! Stripped by Desmond Antetokounmpo! TURNOVER! (live ball)

[07:20] Team_010 possession (Score: 61-63)
FOUL! Reach-in foul on Cade Barnes during the drive. [Team fouls: 1] No free throws, side out. (Cade Barnes: 1 personal fouls)

[07:03] Team_010 possession (Score: 61-63)
Cade Morant attempts a Midrange. Contested by Dejounte LaVine (5.3 feet, MAN). CADE MORANT MAKES IT!
Score: 61-65

[06:52] Team_076 possession (Score: 61-65)
Cade Barnes attempts a 3Pt. Contested by Cade Morant (4.1 feet, ZONE). Cade Barnes misses. FOUL! Loose ball foul on Desmond Antetokounmpo during the rebound battle. [IN THE BONUS! 5 team fouls] Cade Barnes to the line for 2 free throws. (Desmond Antetokounmpo: 1 personal fouls)   FT 1/2: MISS   FT 2/2: GOOD Cade Barnes makes 1/2 from the line.
Score: 62-65

[06:33] Team_010 possession (Score: 62-65)
Anthony Durant attempts a Layup. Contested by Cade Barnes (3.8 feet, ZONE). ANTHONY DURANT MAKES IT! Assist: Cade Morant
Score: 62-67

[06:17] Team_076 possession (Score: 62-67)
D'Angelo Tatum drives, Anthony Durant stays with him. D'Angelo Tatum attempts a Layup. Contested by Anthony Durant (3.7 feet, MAN). D'Angelo Tatum misses. Rebound secured by Anthony Durant.

[06:01] Team_010 possession (Score: 62-67)
Anthony Durant attempts a Midrange. Contested by Tobias Mitchell (4.4 feet, ZONE). ANTHONY DURANT MAKES IT!
Score: 62-69

[05:47] Team_076 possession (Score: 62-69)
Tobias Mitchell drives and kicks out. FOUL! Shooting foul on Cade Morant. Dejounte LaVine to the line for 2 free throws. [BONUS: 6 team fouls] (Cade Morant: 2 personal fouls)   FT 1/2: GOOD   FT 2/2: GOOD Dejounte LaVine makes 2/2 from the line.
Score: 64-69

[05:30] Team_010 possession (Score: 64-69)
Anthony Durant drives, picks up D'Angelo Tatum. Help arrives from Tobias Mitchell! Anthony Durant attempts a Layup. Contested by Tobias Mitchell (4.0 feet, MAN). ANTHONY DURANT MAKES IT!
Score: 64-71

[05:17] Team_076 possession (Score: 64-71)
D'Angelo Tatum attempts a Midrange. Contested by Desmond Antetokounmpo (4.5 feet, ZONE). D'ANGELO TATUM MAKES IT!
Score: 66-71

[05:02] Team_010 possession (Score: 66-71)
RJ Young drives and kicks out. Michael Turner attempts a 3Pt. Contested by Tobias Mitchell (4.1 feet, MAN). Michael Turner misses. Rebound secured by D'Angelo Tatum.

[04:51] Team_076 possession (Score: 66-71)
Cade Barnes commits a violation (traveling/carry)! TURNOVER! (dead ball)

[04:35] Team_010 possession (Score: 66-71)
Michael Turner drives, picks up Tobias Mitchell. Help arrives from Dejounte LaVine! Michael Turner attempts a Layup. Contested by Dejounte LaVine (4.4 feet, MAN). Michael Turner misses. Rebound secured by Cade Barnes.

[04:23] Team_076 possession (Score: 66-71)
Tobias Mitchell attempts a 3Pt. Contested by Cade Morant (4.4 feet, ZONE). Tobias Mitchell misses. Offensive rebound by Cade Barnes! Cade Barnes kicks it out.

[04:12] Team_076 possession (Score: 66-71)
Tobias Mitchell attempts a Midrange. Contested by Michael Turner (4.4 feet, MAN). Tobias Mitchell misses. Offensive rebound by D'Angelo Tatum! D'Angelo Tatum kicks it out.

[04:03] Team_076 possession (Score: 66-71)
Cade Barnes attempts a 3Pt. Contested by Desmond Antetokounmpo (4.5 feet, MAN). CADE BARNES MAKES IT! Assist: Dejounte LaVine
Score: 69-71

[03:48] Team_010 possession (Score: 69-71)
FOUL! Shooting foul on Paul Leonard. RJ Young to the line for 2 free throws. [Team fouls: 2] (Paul Leonard: 1 personal fouls)   FT 1/2: GOOD   FT 2/2: GOOD RJ Young makes 2/2 from the line.
Score: 69-73

[03:36] Team_076 possession (Score: 69-73)
FOUL! Holding foul on Desmond Antetokounmpo. [IN THE BONUS! 7 team fouls] Cade Barnes to the line for 2 free throws. (Desmond Antetokounmpo: 2 personal fouls)   FT 1/2: MISS   FT 2/2: GOOD Cade Barnes makes 1/2 from the line.
Score: 70-73

[03:19] Team_010 possession (Score: 70-73)
Desmond Antetokounmpo attempts a 3Pt. Contested by Cade Barnes (3.8 feet, MAN). Desmond Antetokounmpo misses. Rebound secured by Tobias Mitchell.

[03:03] Team_076 possession (Score: 70-73)
Dejounte LaVine attempts a Midrange. Contested by Cade Morant (4.0 feet, MAN). DEJOUNTE LAVINE MAKES IT!
Score: 72-73

[02:45] Team_010 possession (Score: 72-73)
Cade Morant attempts a 3Pt. Contested by Cade Barnes (4.2 feet, ZONE). Cade Morant misses. Rebound secured by Cade Barnes.

[02:33] Team_076 possession (Score: 72-73)
Tobias Mitchell attempts a Midrange. Contested by Michael Turner (4.6 feet, MAN). Tobias Mitchell misses. Rebound secured by Michael Turner.

[02:21] Team_010 possession (Score: 72-73)
FOUL! Offensive foul on Cade Morant! Dejounte LaVine drew the charge! [Team fouls: 8] (Cade Morant: 3 personal fouls) TURNOVER! (dead ball)

[02:06] Team_076 possession (Score: 72-73)
Paul Leonard attempts a 3Pt. Contested by Cade Morant (4.6 feet, ZONE). PAUL LEONARD MAKES IT! Assist: D'Angelo Tatum
Score: 75-73

[01:52] Team_010 possession (Score: 75-73)
Desmond Antetokounmpo attempts a Layup. Contested by Cade Barnes (4.0 feet, ZONE). DESMOND ANTETOKOUNMPO MAKES IT! Assist: Anthony Durant
Score: 75-75

[01:39] Team_076 possession (Score: 75-75)
Paul Leonard attempts a Layup. Contested by RJ Young (5.4 feet, MAN). PAUL LEONARD MAKES IT! Assist: Tobias Mitchell
Score: 77-75

[01:24] Team_010 possession (Score: 77-75)
Michael Turner makes the Layup and draws the foul on Tobias Mitchell! And-1! Michael Turner to the line for 1. [Team fouls: 3] (Tobias Mitchell: 1 personal fouls)   FT 1/1: GOOD Michael Turner makes 1/1 from the line.
Score: 77-78

[01:10] Team_076 possession (Score: 77-78)
Tobias Mitchell attempts a 3Pt. Contested by Cade Morant (4.7 feet, ZONE). Tobias Mitchell misses. Rebound secured by Anthony Durant.

[00:55] Team_010 possession (Score: 77-78)
Cade Morant attempts a 3Pt. Contested by Dejounte LaVine (5.7 feet, MAN). Cade Morant misses. Rebound secured by Cade Barnes.

[00:39] Team_076 possession (Score: 77-78)
Dejounte LaVine drives to the basket... FOUL! Offensive foul on Dejounte LaVine! Cade Morant drew the charge! [Team fouls: 4] (Dejounte LaVine: 1 personal fouls) TURNOVER! (dead ball)

[00:23] Team_010 possession (Score: 77-78)
Desmond Antetokounmpo attempts a 3Pt. Contested by Tobias Mitchell (4.7 feet, ZONE). Desmond Antetokounmpo misses. Rebound secured by D'Angelo Tatum.

[00:09] Team_076 possession (Score: 77-78)
Tobias Mitchell attempts a 3Pt. Contested by Michael Turner (4.8 feet, ZONE). TOBIAS MITCHELL MAKES IT! Assist: Dejounte LaVine
Score: 80-78

================================================================================
                              3RD QUARTER COMPLETE                              
================================================================================

3RD QUARTER SCORE: Team_076 33, Team_010 21

BOX SCORE:
================================================================================

Team_076
--------------------------------------------------------------------------------
Player                MIN  PTS  REB  AST  TO      FG   FG%      3P   3P%
--------------------------------------------------------------------------------
Paul Leonard           35   11    0    1   0   4/4   100.0     0/0   0.0
D'Angelo Tatum         35    7    4    1   0   3/4    75.0     0/0   0.0
Tobias Mitchell        35    6    4    1   0   2/4    50.0     0/0   0.0
Cade Barnes            35    5    4    0   0   3/4    75.0     0/0   0.0
Dejounte LaVine        35    4    0    4   0   2/3    66.7     0/0   0.0

TEAM: FG: 14/19 (73.7%), 3PT: 5/7 (71.4%), REB: 12 (3 off, 9 def), AST: 7, TO: 3
TEAM FOULS: 4


Team_010
--------------------------------------------------------------------------------
Player                MIN  PTS  REB  AST  TO      FG   FG%      3P   3P%
--------------------------------------------------------------------------------
Cade Morant            35    8    1    1   0   3/5    60.0     0/0   0.0
Anthony Durant         35    6    5    2   0   3/3   100.0     0/0   0.0
Michael Turner         35    3    1    0   0   1/4    25.0     0/0   0.0
Desmond Antetokounmpo   35    2    0    1   0   1/4    25.0     0/0   0.0
RJ Young               35    2    0    0   0   1/2    50.0     0/0   0.0

TEAM: FG: 9/18 (50.0%), 3PT: 2/9 (22.2%), REB: 7 (2 off, 5 def), AST: 4, TO: 3
TEAM FOULS: 8 [Team_076 in BONUS]

================================================================================

================================================================================
                       4TH QUARTER - Team_076 vs Team_010                       
================================================================================

[12:00] Team_076 possession (Score: 80-78)
D'Angelo Tatum attempts a 3Pt. Contested by Cade Morant (4.5 feet, ZONE). D'Angelo Tatum misses. Rebound secured by Anthony Durant.

[11:47] Team_010 possession (Score: 80-78)
FOUL! Shooting foul on Cade Barnes. Cade Morant to the line for 2 free throws. [Team fouls: 1] (Cade Barnes: 1 personal fouls)   FT 1/2: GOOD   FT 2/2: GOOD Cade Morant makes 2/2 from the line.
Score: 80-80

[11:31] Team_076 possession (Score: 80-80)
D'Angelo Tatum attempts a 3Pt. Contested by Cade Morant (4.5 feet, ZONE). D'Angelo Tatum misses. Rebound secured by Michael Turner.

[11:16] Team_010 possession (Score: 80-80)
Desmond Antetokounmpo attempts a 3Pt. Contested by Cade Barnes (4.0 feet, ZONE). Desmond Antetokounmpo misses. Rebound secured by Cade Barnes.

[10:57] Team_076 possession (Score: 80-80)
Paul Leonard attempts a 3Pt. Contested by Cade Morant (4.7 feet, ZONE). Paul Leonard misses. Rebound secured by Michael Turner.

[10:44] Team_010 possession (Score: 80-80)
Michael Turner drives and kicks out. Desmond Antetokounmpo attempts a 3Pt. Contested by Cade Barnes (4.0 feet, MAN). DESMOND ANTETOKOUNMPO MAKES IT! Assist: RJ Young
Score: 80-83

[10:26] Team_076 possession (Score: 80-83)
D'Angelo Tatum attempts a Midrange. Contested by RJ Young (5.4 feet, ZONE). D'Angelo Tatum misses. Offensive rebound by Cade Barnes! Cade Barnes kicks it out.

[10:13] Team_076 possession (Score: 80-83)
Paul Leonard attempts a 3Pt. Contested by RJ Young (5.5 feet, MAN). Paul Leonard misses. Rebound secured by Cade Morant.

[09:58] Team_010 possession (Score: 80-83)
RJ Young attempts a 3Pt. Contested by Cade Barnes (3.9 feet, ZONE). RJ Young misses. Rebound secured by Cade Barnes.

[09:48] Team_076 possession (Score: 80-83)
D'Angelo Tatum attempts a Midrange. Contested by Anthony Durant (4.4 feet, MAN). D'Angelo Tatum misses. Rebound secured by Anthony Durant.

[09:35] Team_010 possession (Score: 80-83)
Desmond Antetokounmpo attempts a Layup. Contested by Cade Barnes (4.2 feet, MAN). DESMOND ANTETOKOUNMPO MAKES IT!
Score: 80-85

[09:20] Team_076 possession (Score: 80-85)
D'Angelo Tatum drives to the basket... D'Angelo Tatum commits a violation (traveling/carry)! TURNOVER! (dead ball)

[09:20] Substitution (Team_076): Dejounte LaVine OUT → Pascal Lowry IN (stamina_rule2)

[09:20] Substitution (Team_076): Tobias Mitchell OUT → Jalen Poole IN (stamina_rule2)

[09:20] Substitution (Team_076): Paul Leonard OUT → Vince Lowry IN (stamina_rule2)

[09:20] Substitution (Team_076): Cade Barnes OUT → Kevin Nowitzki IN (stamina_rule2)

[09:20] Substitution (Team_076): D'Angelo Tatum OUT → Jordan Doncic IN (stamina_rule2)

[09:20] Substitution (Team_010): Cade Morant OUT → Draymond Leonard IN (stamina_rule2)

[09:20] Substitution (Team_010): Michael Turner OUT → Blake Harden IN (stamina_rule2)

[09:20] Substitution (Team_010): RJ Young OUT → Ben Gilgeous-Alexander IN (stamina_rule2)

[09:20] Substitution (Team_010): Desmond Antetokounmpo OUT → Vince Ingram IN (stamina_rule2)

[09:20] Substitution (Team_010): Anthony Durant OUT → Paolo Wade IN (stamina_rule2)

[09:05] Team_010 possession (Score: 80-85)
Blake Harden attempts a Midrange. Contested by Jalen Poole (5.1 feet, MAN). BLAKE HARDEN MAKES IT!
Score: 80-87

[08:55] Team_076 possession (Score: 80-87)
Jordan Doncic attempts a 3Pt. Contested by Paolo Wade (4.5 feet, MAN). Jordan Doncic misses. Rebound secured by Blake Harden.

[08:40] Team_010 possession (Score: 80-87)
Ben Gilgeous-Alexander drives and kicks out. Ben Gilgeous-Alexander attempts a Midrange. Contested by Vince Lowry (4.2 feet, ZONE). Ben Gilgeous-Alexander misses. Rebound secured by Kevin Nowitzki.

[08:24] Team_076 possession (Score: 80-87)
Vince Lowry attempts a Layup. BLOCKED BY VINCE INGRAM! Ball is loose! Offensive rebound by Kevin Nowitzki! Kevin Nowitzki kicks it out.

[08:12] Team_076 possession (Score: 80-87)
Jordan Doncic drives and kicks out. Kevin Nowitzki attempts a Midrange. Contested by Blake Harden (4.6 feet, ZONE). KEVIN NOWITZKI MAKES IT!
Score: 82-87

[08:00] Team_010 possession (Score: 82-87)
Vince Ingram attempts a 3Pt. Contested by Vince Lowry (4.9 feet, ZONE). VINCE INGRAM MAKES IT! Assist: Blake Harden
Score: 82-90

[07:49] Team_076 possession (Score: 82-90)
Vince Lowry attempts a 3Pt. Contested by Ben Gilgeous-Alexander (4.5 feet, MAN). Vince Lowry misses. Offensive rebound by Jordan Doncic! Jordan Doncic kicks it out.

[07:35] Team_076 possession (Score: 82-90)
Jordan Doncic attempts a 3Pt. Contested by Draymond Leonard (3.8 feet, ZONE). Jordan Doncic misses. Rebound secured by Ben Gilgeous-Alexander.

[07:17] Team_010 possession (Score: 82-90)
Draymond Leonard attempts a Midrange. Wide open! Pascal Lowry is 6.7 feet away. [MAN] Draymond Leonard misses. Rebound secured by Vince Lowry.

[06:58] Team_076 possession (Score: 82-90)
Pascal Lowry makes the Midrange and draws the foul on Draymond Leonard! And-1! Pascal Lowry to the line for 1. [Team fouls: 1] (Draymond Leonard: 1 personal fouls)   FT 1/1: GOOD Pascal Lowry makes 1/1 from the line.
Score: 85-90

[06:41] Team_010 possession (Score: 85-90)
Blake Harden makes the Midrange and draws the foul on Jalen Poole! And-1! Blake Harden to the line for 1. [Team fouls: 2] (Jalen Poole: 1 personal fouls)   FT 1/1: GOOD Blake Harden makes 1/1 from the line.
Score: 85-93

[06:22] Team_076 possession (Score: 85-93)
Jordan Doncic attempts a Midrange. Contested by Blake Harden (4.0 feet, ZONE). Jordan Doncic misses. FOUL! Loose ball foul on Ben Gilgeous-Alexander during the rebound battle. [Team fouls: 2] No free throws, side out. (Ben Gilgeous-Alexander: 1 personal fouls)

[06:08] Team_076 possession (Score: 85-93)
Kevin Nowitzki attempts a Layup. Contested by Vince Ingram (5.6 feet, MAN). Kevin Nowitzki misses. Offensive rebound by Jordan Doncic! Jordan Doncic kicks it out.

[05:59] Team_076 possession (Score: 85-93)
FOUL! Shooting foul on Draymond Leonard. Pascal Lowry to the line for 3 free throws. [Team fouls: 3] (Draymond Leonard: 2 personal fouls)   FT 1/3: GOOD   FT 2/3: GOOD   FT 3/3: GOOD Pascal Lowry makes 3/3 from the line.
Score: 88-93

[05:47] Team_010 possession (Score: 88-93)
Vince Ingram makes the Layup and draws the foul on Kevin Nowitzki! And-1! Vince Ingram to the line for 1. [Team fouls: 3] (Kevin Nowitzki: 1 personal fouls)   FT 1/1: GOOD Vince Ingram makes 1/1 from the line.
Score: 88-96

[05:32] Team_076 possession (Score: 88-96)
Pascal Lowry attempts a 3Pt. Contested by Draymond Leonard (4.0 feet, MAN). Pascal Lowry misses. Rebound secured by Blake Harden.

[05:17] Team_010 possession (Score: 88-96)
Ben Gilgeous-Alexander drives to the basket... Ben Gilgeous-Alexander throws a bad pass out of bounds! TURNOVER! (dead ball)

[05:01] Team_076 possession (Score: 88-96)
Vince Lowry attempts a 3Pt. Contested by Draymond Leonard (4.3 feet, ZONE). VINCE LOWRY MAKES IT! Assist: Pascal Lowry
Score: 91-96

[04:44] Team_010 possession (Score: 91-96)
Vince Ingram drives to the basket... FOUL! Offensive foul on Vince Ingram! Jordan Doncic drew the charge! [Team fouls: 4] (Vince Ingram: 1 personal fouls) TURNOVER! (dead ball)

[04:30] Team_076 possession (Score: 91-96)
FOUL! Holding foul on Blake Harden. [IN THE BONUS! 5 team fouls] Jalen Poole to the line for 2 free throws. (Blake Harden: 1 personal fouls)   FT 1/2: GOOD   FT 2/2: GOOD Jalen Poole makes 2/2 from the line.
Score: 93-96

[04:13] Team_010 possession (Score: 93-96)
Draymond Leonard drives, picks up Jordan Doncic. Help arrives from Jalen Poole! Draymond Leonard attempts a Dunk. Contested by Jalen Poole (3.7 feet, ZONE). DRAYMOND LEONARD MAKES IT! Assist: Paolo Wade
Score: 93-98

[04:00] Team_076 possession (Score: 93-98)
Kevin Nowitzki attempts a 3Pt. Contested by Draymond Leonard (4.6 feet, ZONE). KEVIN NOWITZKI MAKES IT! Assist: Pascal Lowry
Score: 96-98

[03:46] Team_010 possession (Score: 96-98)
Ben Gilgeous-Alexander attempts a Layup. Contested by Jordan Doncic (3.5 feet, ZONE). Ben Gilgeous-Alexander misses. Rebound secured by Kevin Nowitzki.

[03:35] Team_076 possession (Score: 96-98)
Jordan Doncic drives, picks up Paolo Wade. Help arrives from Blake Harden! Jordan Doncic attempts a Layup. Contested by Blake Harden (4.5 feet, ZONE). JORDAN DONCIC MAKES IT!
Score: 98-98

[03:19] Team_010 possession (Score: 98-98)
Paolo Wade drives and kicks out. Blake Harden attempts a Midrange. Contested by Jalen Poole (5.4 feet, MAN). Blake Harden misses. Rebound secured by Vince Lowry.

[03:03] Team_076 possession (Score: 98-98)
Kevin Nowitzki drives and kicks out. Jalen Poole attempts a 3Pt. Contested by Blake Harden (4.6 feet, MAN). Jalen Poole misses. Rebound secured by Blake Harden.

[02:47] Team_010 possession (Score: 98-98)
FOUL! Reach-in foul on Jordan Doncic during the drive. [Team fouls: 4] No free throws, side out. (Jordan Doncic: 1 personal fouls)

[02:31] Team_010 possession (Score: 98-98)
Paolo Wade drives and kicks out. Draymond Leonard attempts a 3Pt. Wide open! Pascal Lowry is 6.3 feet away. [MAN] Draymond Leonard misses. Rebound secured by Kevin Nowitzki.

[02:19] Team_076 possession (Score: 98-98)
Vince Lowry attempts a Midrange. Contested by Ben Gilgeous-Alexander (4.5 feet, MAN). VINCE LOWRY MAKES IT!
Score: 100-98

[02:05] Team_010 possession (Score: 100-98)
Vince Ingram drives, Jordan Doncic stays with him. Vince Ingram attempts a Layup. Contested by Jordan Doncic (4.1 feet, ZONE). VINCE INGRAM MAKES IT! Assist: Draymond Leonard
Score: 100-100

[01:50] Team_076 possession (Score: 100-100)
Vince Lowry attempts a 3Pt. Contested by Ben Gilgeous-Alexander (4.5 feet, MAN). Vince Lowry misses. Rebound secured by Blake Harden.

[01:38] Team_010 possession (Score: 100-100)
Draymond Leonard attempts a 3Pt. Wide open! Pascal Lowry is 6.7 feet away. [MAN] DRAYMOND LEONARD MAKES IT! Assist: Ben Gilgeous-Alexander
Score: 100-103

[01:24] Team_076 possession (Score: 100-103)
Jalen Poole attempts a Midrange. Contested by Blake Harden (5.0 feet, MAN). Jalen Poole misses. Rebound secured by Blake Harden.

[01:11] Team_010 possession (Score: 100-103)
Ben Gilgeous-Alexander makes the Dunk and draws the foul on Jordan Doncic! And-1! Ben Gilgeous-Alexander to the line for 1. [BONUS: 5 team fouls] (Jordan Doncic: 2 personal fouls)   FT 1/1: GOOD Ben Gilgeous-Alexander makes 1/1 from the line.
Score: 100-106

[00:57] Team_076 possession (Score: 100-106)
FOUL! Holding foul on Paolo Wade. [IN THE BONUS! 6 team fouls] Jordan Doncic to the line for 2 free throws. (Paolo Wade: 1 personal fouls)   FT 1/2: GOOD   FT 2/2: GOOD Jordan Doncic makes 2/2 from the line.
Score: 102-106

[00:43] Team_010 possession (Score: 102-106)
Paolo Wade drives, Jordan Doncic stays with him. Paolo Wade attempts a Layup. Contested by Jordan Doncic (3.7 feet, ZONE). Paolo Wade misses. Rebound secured by Kevin Nowitzki.

[00:33] Team_076 possession (Score: 102-106)
Kevin Nowitzki drives to the basket... Kevin Nowitzki throws a bad pass! Stolen by Paolo Wade! TURNOVER! (live ball)

[00:17] Team_010 possession (Score: 102-106)
Ben Gilgeous-Alexander attempts a 3Pt. Contested by Vince Lowry (4.6 feet, MAN). Ben Gilgeous-Alexander misses. FOUL! Loose ball foul on Jordan Doncic during the rebound battle. [IN THE BONUS! 6 team fouls] Paolo Wade to the line for 2 free throws. (Jordan Doncic: 3 personal fouls)   FT 1/2: GOOD   FT 2/2: GOOD Paolo Wade makes 2/2 from the line.
Score: 102-108

[00:05] Team_076 possession (Score: 102-108)
Pascal Lowry drives, Draymond Leonard stays with him. Pascal Lowry attempts a Layup. Contested by Draymond Leonard (4.2 feet, MAN). Pascal Lowry misses. Rebound secured by Blake Harden.

================================================================================
                              4TH QUARTER COMPLETE                              
================================================================================

4TH QUARTER SCORE: Team_076 22, Team_010 30

BOX SCORE:
================================================================================

Team_076
--------------------------------------------------------------------------------
Player                MIN  PTS  REB  AST  TO      FG   FG%      3P   3P%
--------------------------------------------------------------------------------
Pascal Lowry           10    6    0    2   0   2/4    50.0     0/0   0.0
Kevin Nowitzki         10    5    6    0   0   2/3    66.7     0/0   0.0
Vince Lowry            10    5    2    0   0   2/3    66.7     0/0   0.0
Jordan Doncic          10    4    2    0   0   2/4    50.0     0/0   0.0
Jalen Poole            10    2    0    0   0   1/2    50.0     0/0   0.0
D'Angelo Tatum         38    0    0    0   0   0/3     0.0     0/0   0.0
Cade Barnes            38    0    3    0   0   0/0     0.0     0/0   0.0
Paul Leonard           38    0    0    0   0   0/2     0.0     0/0   0.0

TEAM: FG: 9/21 (42.9%), 3PT: 3/11 (27.3%), REB: 13 (5 off, 8 def), AST: 2, TO: 2
TEAM FOULS: 6 [Team_010 in BONUS]


Team_010
--------------------------------------------------------------------------------
Player                MIN  PTS  REB  AST  TO      FG   FG%      3P   3P%
--------------------------------------------------------------------------------
Vince Ingram           10    8    0    0   0   3/3   100.0     0/0   0.0
Desmond Antetokounmpo   38    5    0    0   0   2/3    66.7     0/0   0.0
Blake Harden           10    5    6    1   0   2/2   100.0     0/0   0.0
Draymond Leonard       10    5    0    1   0   2/3    66.7     0/0   0.0
Ben Gilgeous-Alexander   10    3    1    1   0   1/3    33.3     0/0   0.0
Cade Morant            38    2    1    0   0   1/1   100.0     0/0   0.0
Paolo Wade             10    2    0    1   0   1/4    25.0     0/0   0.0
Anthony Durant         38    0    2    0   0   0/0     0.0     0/0   0.0
Michael Turner         38    0    2    0   0   0/0     0.0     0/0   0.0
RJ Young               38    0    0    1   0   0/1     0.0     0/0   0.0

TEAM: FG: 12/20 (60.0%), 3PT: 3/5 (60.0%), REB: 12 (0 off, 12 def), AST: 5, TO: 2
TEAM FOULS: 6 [Team_076 in BONUS]

================================================================================

================================================================================
                               FULL GAME COMPLETE                               
================================================================================

FINAL SCORE: Team_076 102, Team_010 108

SCORING BY QUARTER:
--------------------------------------------------------------------------------
Team                     Q1     Q2     Q3     Q4    FINAL
--------------------------------------------------------------------------------
Team_076                 24     23     33     22      102
Team_010                 19     38     21     30      108
--------------------------------------------------------------------------------

FULL GAME BOX SCORE:
================================================================================

Team_076
--------------------------------------------------------------------------------
Player                MIN  PTS  REB  AST  TO      FG   FG%      3P   3P%      FT STL BLK
--------------------------------------------------------------------------------
Dejounte LaVine        38   10    0    6   2   4/9    44.4   1/6    16.7   3/4     0   0
Tobias Mitchell        38   14    7    3   1   6/11   54.5   1/5    20.0   6/6     1   1
Paul Leonard           38   23    0    2   2   8/12   66.7   3/6    50.0   7/7     0   0
Cade Barnes            38   12   16    3   2   6/13   46.2   2/4    50.0   5/9     1   0
D'Angelo Tatum         38   19    9    1   2   9/14   64.3   0/2     0.0   5/5     1   0
Pascal Lowry           10    6    0    2   0   2/4    50.0   1/2    50.0   4/4     0   0
Jalen Poole            10    2    0    0   0   0/1     0.0   0/0     0.0   2/2     0   0
Vince Lowry            10    7    2    0   2   3/4    75.0   1/2    50.0   0/0     0   0
Kevin Nowitzki         10    5    6    0   0   1/2    50.0   1/1   100.0   0/0     0   0
Jordan Doncic          10    4    2    0   1   2/4    50.0   0/2     0.0   2/2     0   0

TEAM: FG: 44/77 (57.1%), 3PT: 10/30 (33.3%), REB: 42 (13 off, 29 def), AST: 17, TO: 12


Team_010
--------------------------------------------------------------------------------
Player                MIN  PTS  REB  AST  TO      FG   FG%      3P   3P%      FT STL BLK
--------------------------------------------------------------------------------
Cade Morant            38   15    9    4   3   5/11   45.5   2/7    28.6   2/3     1   2
Michael Turner         38   13    4    4   1   6/12   50.0   1/4    25.0   2/2     0   0
RJ Young               38   10    0    3   3   4/7    57.1   2/4    50.0   2/2     0   0
Desmond Antetokounmpo   38   25    0    4   0   9/17   52.9   1/7    14.3   3/3     2   1
Anthony Durant         38   16   17    3   3   9/9   100.0   0/0     0.0   2/2     0   0
Draymond Leonard       10    9    0    1   2   4/5    80.0   1/1   100.0   0/0     0   0
Blake Harden           10    5    6    1   0   2/2   100.0   0/0     0.0   1/1     0   0
Ben Gilgeous-Alexander   10    3    1    1   0   2/4    50.0   1/1   100.0   1/1     0   0
Vince Ingram           10    8    0    0   0   3/3   100.0   1/1   100.0   1/1     0   1
Paolo Wade             10    2    0    2   0   0/3     0.0   0/0     0.0   2/2     2   0

TEAM: FG: 44/73 (60.3%), 3PT: 9/25 (36.0%), REB: 37 (6 off, 31 def), AST: 23, TO: 12

================================================================================
