================================================================================
                        FULL GAME - Team_030 vs Team_098                        
================================================================================

================================================================================
                       1ST QUARTER - Team_030 vs Team_098                       
================================================================================

[12:00] Team_030 possession (Score: 0-0)
Tim Barrett drives to the basket... Tim Barrett throws a bad pass out of bounds! TURNOVER! (dead ball)

[11:48] Team_098 possession (Score: 0-0)
Pascal Lillard attempts a 3Pt. Contested by Jordan Nowitzki (4.9 feet, MAN). Pascal Lillard misses. Rebound secured by Jordan Nowitzki.

[11:32] Team_030 possession (Score: 0-0)
Tyler Beal drives, Pascal Lillard stays with him. Tyler Beal attempts a Layup. Contested by Pascal Lillard (4.3 feet, ZONE). Tyler Beal misses. Rebound secured by Derrick Durant.

[11:15] Team_098 possession (Score: 0-0)
Malcolm Tatum attempts a 3Pt. Contested by Tyler Beal (4.4 feet, ZONE). Malcolm Tatum misses. Rebound secured by Joel Anunoby.

[11:04] Team_030 possession (Score: 0-0)
Jaren Green drives and kicks out. FOUL! Shooting foul on Nikola Rose. Jaren Green to the line for 2 free throws. [Team fouls: 1] (Nikola Rose: 1 personal fouls)   FT 1/2: GOOD   FT 2/2: GOOD Jaren Green makes 2/2 from the line.
Score: 2-0

[10:50] Team_098 possession (Score: 2-0)
Malcolm Tatum attempts a Midrange. Contested by Tyler Beal (4.4 feet, MAN). Malcolm Tatum misses. Rebound secured by Jordan Nowitzki.

[10:39] Team_030 possession (Score: 2-0)
Joel Anunoby attempts a 3Pt. Contested by Blake Murray (4.8 feet, MAN). Joel Anunoby misses. Rebound secured by Nikola Rose.

[10:27] Team_098 possession (Score: 2-0)
Blake Murray attempts a 3Pt. Contested by Joel Anunoby (3.6 feet, MAN). BLAKE MURRAY MAKES IT! Assist: Malcolm Tatum
Score: 2-3

[10:14] Team_030 possession (Score: 2-3)
Tim Barrett makes the Midrange and draws the foul on Blake Murray! And-1! Tim Barrett to the line for 1. [Team fouls: 2] (Blake Murray: 1 personal fouls)   FT 1/1: GOOD Tim Barrett makes 1/1 from the line.
Score: 5-3

[09:59] Team_098 possession (Score: 5-3)
Blake Murray attempts a 3Pt. Contested by Tyler Beal (4.4 feet, ZONE). Blake Murray misses. Rebound secured by Joel Anunoby.

[09:47] Team_030 possession (Score: 5-3)
Tim Barrett drives and kicks out. Jaren Green attempts a Midrange. Contested by Derrick Durant (4.3 feet, MAN). Jaren Green misses. Rebound secured by Nikola Rose.

[09:37] Team_098 possession (Score: 5-3)
Blake Murray drives, Jaren Green stays with him. Blake Murray attempts a Dunk. Contested by Jaren Green (4.2 feet, ZONE). Blake Murray misses. Offensive rebound by Pascal Lillard! Pascal Lillard kicks it out.

[09:26] Team_098 possession (Score: 5-3)
Blake Murray attempts a Layup. Contested by Jaren Green (4.2 feet, ZONE). Blake Murray misses. Rebound secured by Joel Anunoby.

[09:09] Team_030 possession (Score: 5-3)
Jaren Green loses control! Ball rolls out of bounds! TURNOVER! (dead ball)

[08:51] Team_098 possession (Score: 5-3)
Nikola Rose drives, picks up Jaren Green. Help arrives from Tyler Beal! Nikola Rose attempts a Dunk. Contested by Tyler Beal (4.3 feet, ZONE). Nikola Rose misses. Offensive rebound by Pascal Lillard! Pascal Lillard kicks it out.

[08:38] Team_098 possession (Score: 5-3)
Malcolm Tatum makes the Midrange and draws the foul on Tyler Beal! And-1! Malcolm Tatum to the line for 1. [Team fouls: 1] (Tyler Beal: 1 personal fouls)   FT 1/1: GOOD Malcolm Tatum makes 1/1 from the line.
Score: 5-6

[08:22] Team_030 possession (Score: 5-6)
Tim Barrett attempts a 3Pt. Contested by Nikola Rose (3.1 feet, ZONE). Tim Barrett misses. Rebound secured by Derrick Durant.

[08:08] Team_098 possession (Score: 5-6)
Malcolm Tatum drives to the basket... Malcolm Tatum loses the ball! Stripped by Jaren Green! TURNOVER! (live ball)

[07:53] Team_030 possession (Score: 5-6)
Joel Anunoby attempts a 3Pt. Contested by Blake Murray (4.8 feet, MAN). Joel Anunoby misses. Rebound secured by Nikola Rose.

[07:40] Team_098 possession (Score: 5-6)
Derrick Durant attempts a Midrange. Contested by Jordan Nowitzki (4.5 feet, ZONE). DERRICK DURANT MAKES IT! Assist: Malcolm Tatum
Score: 5-8

[07:26] Team_030 possession (Score: 5-8)
FOUL! Shooting foul on Pascal Lillard. Tim Barrett to the line for 2 free throws. [Team fouls: 3] (Pascal Lillard: 1 personal fouls)   FT 1/2: GOOD   FT 2/2: GOOD Tim Barrett makes 2/2 from the line.
Score: 7-8

[07:08] Team_098 possession (Score: 7-8)
Blake Murray attempts a Midrange. Contested by Jordan Nowitzki (4.5 feet, ZONE). Blake Murray misses. FOUL! Loose ball foul on Jaren Green during the rebound battle. [Team fouls: 2] No free throws, side out. (Jaren Green: 1 personal fouls)

[06:54] Team_098 possession (Score: 7-8)
Derrick Durant attempts a 3Pt. Contested by Tim Barrett (5.0 feet, ZONE). DERRICK DURANT MAKES IT! Assist: Blake Murray
Score: 7-11

[06:40] Team_030 possession (Score: 7-11)
Joel Anunoby attempts a 3Pt. Contested by Blake Murray (4.8 feet, MAN). Joel Anunoby misses. Rebound secured by Derrick Durant.

[06:24] Team_098 possession (Score: 7-11)
FOUL! Reach-in foul on Jaren Green during the drive. [Team fouls: 3] No free throws, side out. (Jaren Green: 2 personal fouls)

[06:11] Team_098 possession (Score: 7-11)
Nikola Rose attempts a 3Pt. Contested by Tyler Beal (4.5 feet, ZONE). Nikola Rose misses. Rebound secured by Jaren Green.

[05:55] Team_030 possession (Score: 7-11)
Jaren Green drives to the basket... Jaren Green throws a bad pass out of bounds! TURNOVER! (dead ball)

[05:41] Team_098 possession (Score: 7-11)
Pascal Lillard drives and kicks out. Nikola Rose attempts a 3Pt. Contested by Tyler Beal (4.2 feet, ZONE). Nikola Rose misses. Rebound secured by Jaren Green.

[05:30] Team_030 possession (Score: 7-11)
Jordan Nowitzki throws a bad pass out of bounds! TURNOVER! (dead ball)

[05:15] Team_098 possession (Score: 7-11)
Blake Murray attempts a 3Pt. Contested by Tyler Beal (4.4 feet, ZONE). Blake Murray misses. Rebound secured by Jaren Green.

[04:58] Team_030 possession (Score: 7-11)
Tyler Beal attempts a Layup. Contested by Malcolm Tatum (4.2 feet, MAN). TYLER BEAL MAKES IT! Assist: Tim Barrett
Score: 9-11

[04:44] Team_098 possession (Score: 9-11)
Malcolm Tatum attempts a 3Pt. Contested by Tim Barrett (5.0 feet, ZONE). Malcolm Tatum misses. Rebound secured by Jordan Nowitzki.

[04:27] Team_030 possession (Score: 9-11)
Jordan Nowitzki attempts a 3Pt. Contested by Nikola Rose (3.7 feet, ZONE). Jordan Nowitzki misses. Rebound secured by Pascal Lillard.

[04:11] Team_098 possession (Score: 9-11)
Derrick Durant attempts a Layup. Contested by Jaren Green (4.3 feet, ZONE). DERRICK DURANT MAKES IT! Assist: Nikola Rose
Score: 9-13

[04:00] Team_030 possession (Score: 9-13)
Jordan Nowitzki drives to the basket... Jordan Nowitzki throws a bad pass! Stolen by Pascal Lillard! TURNOVER! (live ball)

[03:45] Team_098 possession (Score: 9-13)
Pascal Lillard drives, picks up Jordan Nowitzki. Help arrives from Tyler Beal! Pascal Lillard attempts a Dunk. Contested by Tyler Beal (5.0 feet, MAN). Pascal Lillard misses. Rebound secured by Joel Anunoby.

[03:30] Team_030 possession (Score: 9-13)
Tim Barrett drives and kicks out. Jordan Nowitzki attempts a Midrange. BLOCKED BY BLAKE MURRAY! Ball is loose! Rebound secured by Nikola Rose.

[03:16] Team_098 possession (Score: 9-13)
Derrick Durant drives, Jaren Green stays with him. Derrick Durant attempts a Layup. Contested by Jaren Green (4.4 feet, ZONE). Derrick Durant misses. Rebound secured by Jaren Green.

[03:02] Team_030 possession (Score: 9-13)
Jordan Nowitzki makes the Layup and draws the foul on Pascal Lillard! And-1! Jordan Nowitzki to the line for 1. [Team fouls: 4] (Pascal Lillard: 2 personal fouls)   FT 1/1: GOOD Jordan Nowitzki makes 1/1 from the line.
Score: 12-13

[02:48] Team_098 possession (Score: 12-13)
Nikola Rose attempts a 3Pt. Contested by Tim Barrett (5.3 feet, MAN). NIKOLA ROSE MAKES IT!
Score: 12-16

[02:33] Team_030 possession (Score: 12-16)
Joel Anunoby attempts a Midrange. Contested by Blake Murray (5.1 feet, MAN). JOEL ANUNOBY MAKES IT! Assist: Jordan Nowitzki
Score: 14-16

[02:18] Team_098 possession (Score: 14-16)
Nikola Rose drives and kicks out. Derrick Durant attempts a 3Pt. Contested by Jaren Green (4.3 feet, MAN). DERRICK DURANT MAKES IT! Assist: Nikola Rose
Score: 14-19

[02:05] Team_030 possession (Score: 14-19)
FOUL! Holding foul on Nikola Rose. [IN THE BONUS! 5 team fouls] Tim Barrett to the line for 2 free throws. (Nikola Rose: 2 personal fouls)   FT 1/2: GOOD   FT 2/2: MISS Tim Barrett makes 1/2 from the line. Rebound secured by Nikola Rose.
Score: 15-19

[01:51] Team_098 possession (Score: 15-19)
FOUL! Holding foul on Tyler Beal. [Team fouls: 4] No free throws, side out. (Tyler Beal: 2 personal fouls)

[01:35] Team_098 possession (Score: 15-19)
FOUL! Shooting foul on Joel Anunoby. Blake Murray to the line for 2 free throws. [BONUS: 5 team fouls] (Joel Anunoby: 1 personal fouls)   FT 1/2: GOOD   FT 2/2: GOOD Blake Murray makes 2/2 from the line.
Score: 15-21

[01:21] Team_030 possession (Score: 15-21)
FOUL! Reach-in foul on Pascal Lillard during the drive. [IN THE BONUS! 6 team fouls] Tyler Beal to the line for 2 free throws. (Pascal Lillard: 3 personal fouls)   FT 1/2: GOOD   FT 2/2: GOOD Tyler Beal makes 2/2 from the line.
Score: 17-21

[01:09] Team_098 possession (Score: 17-21)
Nikola Rose attempts a Midrange. Contested by Joel Anunoby (4.1 feet, ZONE). Nikola Rose misses. Rebound secured by Joel Anunoby.

[00:56] Team_030 possession (Score: 17-21)
Jaren Green attempts a Layup. Contested by Pascal Lillard (5.2 feet, ZONE). JAREN GREEN MAKES IT!
Score: 19-21

[00:40] Team_098 possession (Score: 19-21)
Nikola Rose attempts a 3Pt. Contested by Tyler Beal (4.9 feet, ZONE). NIKOLA ROSE MAKES IT! Assist: Malcolm Tatum
Score: 19-24

[00:26] Team_030 possession (Score: 19-24)
Jaren Green attempts a Layup. Contested by Pascal Lillard (5.3 feet, ZONE). JAREN GREEN MAKES IT!
Score: 21-24

[00:12] Team_098 possession (Score: 21-24)
Nikola Rose loses the ball! Stripped by Tim Barrett! TURNOVER! (live ball)

================================================================================
                              1ST QUARTER COMPLETE                              
================================================================================

1ST QUARTER SCORE: Team_030 21, Team_098 24

BOX SCORE:
================================================================================

Team_030
--------------------------------------------------------------------------------
Player                MIN  PTS  REB  AST  TO      FG   FG%      3P   3P%
--------------------------------------------------------------------------------
Jaren Green            12    6    4    0   0   3/3   100.0     0/0   0.0
Tim Barrett            12    5    0    1   0   2/5    40.0     0/0   0.0
Tyler Beal             12    4    0    0   0   2/3    66.7     0/0   0.0
Jordan Nowitzki        12    3    3    1   0   1/2    50.0     0/0   0.0
Joel Anunoby           12    2    5    0   0   1/4    25.0     0/0   0.0

TEAM: FG: 9/18 (50.0%), 3PT: 0/5 (0.0%), REB: 12 (0 off, 12 def), AST: 2, TO: 5
TEAM FOULS: 5 [Team_098 in BONUS]


Team_098
--------------------------------------------------------------------------------
Player                MIN  PTS  REB  AST  TO      FG   FG%      3P   3P%
--------------------------------------------------------------------------------
Derrick Durant         12   10    3    0   0   4/5    80.0     0/0   0.0
Nikola Rose            12    6    5    2   0   2/4    50.0     0/0   0.0
Blake Murray           12    5    0    1   0   2/5    40.0     0/0   0.0
Malcolm Tatum          12    3    0    3   0   1/4    25.0     0/0   0.0
Pascal Lillard         12    0    4    0   0   0/3     0.0     0/0   0.0

TEAM: FG: 9/21 (42.9%), 3PT: 4/10 (40.0%), REB: 12 (3 off, 9 def), AST: 6, TO: 2
TEAM FOULS: 6 [Team_030 in BONUS]

================================================================================

================================================================================
                       2ND QUARTER - Team_030 vs Team_098                       
================================================================================

[12:00] Team_030 possession (Score: 21-24)
Joel Anunoby attempts a Layup. Contested by Blake Murray (5.1 feet, MAN). JOEL ANUNOBY MAKES IT!
Score: 23-24

[11:46] Team_098 possession (Score: 23-24)
Blake Murray attempts a Layup. BLOCKED BY TYLER BEAL! Ball goes out off Tyler Beal. Blake Murray's ball!

[11:31] Team_098 possession (Score: 23-24)
Pascal Lillard attempts a 3Pt. Contested by Tyler Beal (5.1 feet, ZONE). Pascal Lillard misses. Offensive rebound by Derrick Durant! Derrick Durant puts it back in!
Score: 23-26

[11:15] Team_030 possession (Score: 23-26)
Tim Barrett drives to the basket... Tim Barrett loses the ball! Stripped by Pascal Lillard! TURNOVER! (live ball)

[11:00] Team_098 possession (Score: 23-26)
Pascal Lillard attempts a Layup. Contested by Jaren Green (5.0 feet, ZONE). PASCAL LILLARD MAKES IT! Assist: Derrick Durant
Score: 23-28

[10:45] Team_030 possession (Score: 23-28)
Tim Barrett attempts a 3Pt. Contested by Pascal Lillard (4.4 feet, ZONE). TIM BARRETT MAKES IT! Assist: Jordan Nowitzki
Score: 26-28

[10:34] Team_098 possession (Score: 26-28)
Derrick Durant attempts a Layup. BLOCKED BY JAREN GREEN! Ball deflects out of bounds off Derrick Durant.

[10:20] Team_030 possession (Score: 26-28)
Jaren Green drives, picks up Derrick Durant. Help arrives from Nikola Rose! Jaren Green attempts a Dunk. Contested by Nikola Rose (5.7 feet, MAN). Jaren Green misses. Offensive rebound by Joel Anunoby! Joel Anunoby kicks it out.

[10:08] Team_030 possession (Score: 26-28)
Jaren Green drives and kicks out. Tim Barrett attempts a 3Pt. Contested by Nikola Rose (3.8 feet, ZONE). Tim Barrett misses. Rebound secured by Pascal Lillard.

[09:53] Team_098 possession (Score: 26-28)
Blake Murray drives to the basket... Blake Murray loses the ball! Stripped by Jaren Green! TURNOVER! (live ball)

[09:38] Team_030 possession (Score: 26-28)
Tim Barrett drives, Nikola Rose stays with him. Tim Barrett attempts a Layup. Contested by Nikola Rose (3.7 feet, MAN). Tim Barrett misses. Offensive rebound by Jordan Nowitzki! Jordan Nowitzki kicks it out.

[09:23] Team_030 possession (Score: 26-28)
Tim Barrett attempts a 3Pt. Contested by Nikola Rose (3.8 feet, ZONE). Tim Barrett misses. Rebound secured by Derrick Durant.

[09:07] Team_098 possession (Score: 26-28)
FOUL! Holding foul on Jordan Nowitzki. [Team fouls: 1] No free throws, side out. (Jordan Nowitzki: 1 personal fouls)

[08:54] Team_098 possession (Score: 26-28)
Malcolm Tatum attempts a 3Pt. Contested by Tyler Beal (5.0 feet, MAN). Malcolm Tatum misses. Rebound secured by Jordan Nowitzki.

[08:38] Team_030 possession (Score: 26-28)
Tim Barrett attempts a 3Pt. Contested by Nikola Rose (3.8 feet, ZONE). Tim Barrett misses. Offensive rebound by Joel Anunoby! Joel Anunoby kicks it out.

[08:24] Team_030 possession (Score: 26-28)
Jaren Green drives, Pascal Lillard stays with him. Jaren Green attempts a Layup. Contested by Pascal Lillard (5.5 feet, ZONE). JAREN GREEN MAKES IT! Assist: Tim Barrett
Score: 28-28

[08:09] Team_098 possession (Score: 28-28)
Malcolm Tatum attempts a 3Pt. Contested by Tyler Beal (5.1 feet, MAN). MALCOLM TATUM MAKES IT! Assist: Derrick Durant
Score: 28-31

[07:53] Team_030 possession (Score: 28-31)
Joel Anunoby attempts a 3Pt. Contested by Nikola Rose (4.3 feet, ZONE). JOEL ANUNOBY MAKES IT! Assist: Jordan Nowitzki
Score: 31-31

[07:40] Team_098 possession (Score: 31-31)
Pascal Lillard throws a bad pass! Stolen by Jordan Nowitzki! TURNOVER! (live ball)

[07:28] Team_030 possession (Score: 31-31)
Jaren Green attempts a 3Pt. Wide open! Derrick Durant is 6.1 feet away. [MAN] Jaren Green misses. Rebound secured by Pascal Lillard.

[07:12] Team_098 possession (Score: 31-31)
Malcolm Tatum attempts a Midrange. Contested by Tyler Beal (5.2 feet, MAN). Malcolm Tatum misses. Rebound secured by Jaren Green.

[06:57] Team_030 possession (Score: 31-31)
Tim Barrett drives, picks up Nikola Rose. Help arrives from Blake Murray! Tim Barrett attempts a Dunk. Contested by Blake Murray (4.1 feet, MAN). Tim Barrett misses. Rebound secured by Derrick Durant.

[06:41] Team_098 possession (Score: 31-31)
Derrick Durant loses control! Ball rolls out of bounds! TURNOVER! (dead ball)

[06:41] Substitution (Team_030): Tyler Beal OUT → RJ Carter IN (stamina_rule2)

[06:41] Substitution (Team_030): Tim Barrett OUT → Josh Smith IN (stamina_rule2)

[06:41] Substitution (Team_030): Joel Anunoby OUT → Pau James IN (stamina_rule2)

[06:41] Substitution (Team_030): Jordan Nowitzki OUT → Damian Green IN (stamina_rule2)

[06:41] Substitution (Team_030): Jaren Green OUT → Franz Anunoby IN (stamina_rule2)

[06:41] Substitution (Team_098): Malcolm Tatum OUT → Tracy Rose IN (stamina_rule2)

[06:41] Substitution (Team_098): Nikola Rose OUT → Dirk McCollum IN (stamina_rule2)

[06:41] Substitution (Team_098): Blake Murray OUT → Kristaps Iverson IN (stamina_rule2)

[06:41] Substitution (Team_098): Pascal Lillard OUT → Manu Jordan IN (stamina_rule2)

[06:41] Substitution (Team_098): Derrick Durant OUT → Russell McGrady IN (stamina_rule2)

[06:24] Team_030 possession (Score: 31-31)
Franz Anunoby attempts a Midrange. Contested by Kristaps Iverson (4.2 feet, ZONE). Franz Anunoby misses. Rebound secured by Manu Jordan.

[06:07] Team_098 possession (Score: 31-31)
Dirk McCollum makes the Midrange and draws the foul on Josh Smith! And-1! Dirk McCollum to the line for 1. [Team fouls: 2] (Josh Smith: 1 personal fouls)   FT 1/1: GOOD Dirk McCollum makes 1/1 from the line.
Score: 31-34

[05:54] Team_030 possession (Score: 31-34)
Josh Smith attempts a 3Pt. Contested by Dirk McCollum (4.3 feet, ZONE). Josh Smith misses. Rebound secured by Kristaps Iverson.

[05:43] Team_098 possession (Score: 31-34)
Manu Jordan drives to the basket... Manu Jordan throws a bad pass! Stolen by Damian Green! TURNOVER! (live ball)

[05:27] Team_030 possession (Score: 31-34)
Pau James throws a bad pass! Stolen by Kristaps Iverson! TURNOVER! (live ball)

[05:11] Team_098 possession (Score: 31-34)
Russell McGrady attempts a Layup. Contested by Franz Anunoby (4.3 feet, MAN). Russell McGrady misses. Rebound secured by Damian Green.

[04:54] Team_030 possession (Score: 31-34)
Josh Smith attempts a Midrange. Contested by Dirk McCollum (4.3 feet, MAN). JOSH SMITH MAKES IT!
Score: 33-34

[04:43] Team_098 possession (Score: 33-34)
Russell McGrady attempts a Midrange. Contested by Franz Anunoby (4.3 feet, MAN). Russell McGrady misses. Rebound secured by Pau James.

[04:28] Team_030 possession (Score: 33-34)
Josh Smith makes the Layup and draws the foul on Dirk McCollum! And-1! Josh Smith to the line for 1. [Team fouls: 1] (Dirk McCollum: 1 personal fouls)   FT 1/1: GOOD Josh Smith makes 1/1 from the line.
Score: 36-34

[04:14] Team_098 possession (Score: 36-34)
Tracy Rose attempts a 3Pt. Contested by RJ Carter (5.8 feet, ZONE). TRACY ROSE MAKES IT! Assist: Manu Jordan
Score: 36-37

[03:58] Team_030 possession (Score: 36-37)
FOUL! Shooting foul on Dirk McCollum. Franz Anunoby to the line for 2 free throws. [Team fouls: 2] (Dirk McCollum: 2 personal fouls)   FT 1/2: GOOD   FT 2/2: GOOD Franz Anunoby makes 2/2 from the line.
Score: 38-37

[03:46] Team_098 possession (Score: 38-37)
Kristaps Iverson attempts a 3Pt. Contested by Pau James (4.5 feet, MAN). Kristaps Iverson misses. Offensive rebound by Russell McGrady! Russell McGrady puts it back in!
Score: 38-39

[03:31] Team_030 possession (Score: 38-39)
Josh Smith attempts a 3Pt. Contested by Dirk McCollum (4.3 feet, ZONE). Josh Smith misses. Rebound secured by Kristaps Iverson.

[03:15] Team_098 possession (Score: 38-39)
FOUL! Reach-in foul on Damian Green during the drive. [Team fouls: 3] No free throws, side out. (Damian Green: 1 personal fouls)

[02:58] Team_098 possession (Score: 38-39)
Dirk McCollum attempts a 3Pt. Contested by Josh Smith (4.7 feet, MAN). DIRK MCCOLLUM MAKES IT! Assist: Tracy Rose
Score: 38-42

[02:47] Team_030 possession (Score: 38-42)
FOUL! Shooting foul on Manu Jordan. Damian Green to the line for 2 free throws. [Team fouls: 3] (Manu Jordan: 1 personal fouls)   FT 1/2: GOOD   FT 2/2: GOOD Damian Green makes 2/2 from the line.
Score: 40-42

[02:34] Team_098 possession (Score: 40-42)
Manu Jordan loses control! Ball rolls out of bounds! TURNOVER! (dead ball)

[02:19] Team_030 possession (Score: 40-42)
RJ Carter attempts a Layup. BLOCKED BY KRISTAPS IVERSON! Ball goes out off Kristaps Iverson. RJ Carter's ball!

[02:06] Team_030 possession (Score: 40-42)
RJ Carter attempts a 3Pt. Contested by Dirk McCollum (4.3 feet, ZONE). RJ Carter misses. Rebound secured by Kristaps Iverson.

[01:46] Team_098 possession (Score: 40-42)
Russell McGrady attempts a Midrange. Contested by Franz Anunoby (4.3 feet, MAN). RUSSELL MCGRADY MAKES IT! Assist: Manu Jordan
Score: 40-44

[01:35] Team_030 possession (Score: 40-44)
Pau James attempts a 3Pt. Contested by Kristaps Iverson (4.0 feet, MAN). Pau James misses. FOUL! Loose ball foul on Manu Jordan during the rebound battle. [Team fouls: 4] No free throws, side out. (Manu Jordan: 2 personal fouls)

[01:23] Team_030 possession (Score: 40-44)
Franz Anunoby drives, picks up Russell McGrady. Help arrives from Dirk McCollum! Franz Anunoby attempts a Dunk. Contested by Dirk McCollum (4.1 feet, ZONE). FRANZ ANUNOBY MAKES IT!
Score: 42-44

[01:11] Team_098 possession (Score: 42-44)
Russell McGrady attempts a Midrange. Contested by Franz Anunoby (4.3 feet, MAN). Russell McGrady misses. Rebound secured by Damian Green.

[00:57] Team_030 possession (Score: 42-44)
Franz Anunoby makes the Layup and draws the foul on Russell McGrady! And-1! Franz Anunoby to the line for 1. [BONUS: 5 team fouls] (Russell McGrady: 1 personal fouls)   FT 1/1: MISS Franz Anunoby makes 0/1 from the line. Rebound secured by Kristaps Iverson.
Score: 44-44

[00:42] Team_098 possession (Score: 44-44)
Tracy Rose attempts a Layup. Contested by Damian Green (5.2 feet, ZONE). TRACY ROSE MAKES IT!
Score: 44-46

[00:31] Team_030 possession (Score: 44-46)
RJ Carter drives and kicks out. FOUL! Shooting foul on Kristaps Iverson. Pau James to the line for 3 free throws. [BONUS: 6 team fouls] (Kristaps Iverson: 1 personal fouls)   FT 1/3: MISS   FT 2/3: GOOD   FT 3/3: MISS Pau James makes 1/3 from the line. Rebound secured by Russell McGrady.
Score: 45-46

[00:18] Team_098 possession (Score: 45-46)
Dirk McCollum attempts a 3Pt. Contested by RJ Carter (5.8 feet, ZONE). DIRK MCCOLLUM MAKES IT! Assist: Manu Jordan
Score: 45-49

[00:06] Team_030 possession (Score: 45-49)
Damian Green attempts a Midrange. Contested by Kristaps Iverson (3.7 feet, ZONE). Damian Green misses. Rebound secured by Russell McGrady.

================================================================================
                              2ND QUARTER COMPLETE                              
================================================================================

2ND QUARTER SCORE: Team_030 24, Team_098 25

BOX SCORE:
================================================================================

Team_030
--------------------------------------------------------------------------------
Player                MIN  PTS  REB  AST  TO      FG   FG%      3P   3P%
--------------------------------------------------------------------------------
Joel Anunoby           18    5    2    0   0   2/2   100.0     0/0   0.0
Josh Smith              7    5    0    0   0   2/4    50.0     0/0   0.0
Franz Anunoby           7    4    0    0   0   2/4    50.0     0/0   0.0
Tim Barrett            18    3    0    1   0   1/3    33.3     0/0   0.0
Jaren Green            18    2    1    0   0   1/3    33.3     0/0   0.0
Damian Green            7    2    3    0   0   1/2    50.0     0/0   0.0
Jordan Nowitzki        18    0    2    2   0   0/0     0.0     0/0   0.0
Pau James               7    0    1    0   0   0/0     0.0     0/0   0.0
RJ Carter               7    0    0    0   0   0/2     0.0     0/0   0.0

TEAM: FG: 9/20 (45.0%), 3PT: 2/7 (28.6%), REB: 9 (4 off, 5 def), AST: 3, TO: 2
TEAM FOULS: 3


Team_098
--------------------------------------------------------------------------------
Player                MIN  PTS  REB  AST  TO      FG   FG%      3P   3P%
--------------------------------------------------------------------------------
Dirk McCollum           7    9    0    0   0   3/3   100.0     0/0   0.0
Tracy Rose              7    5    0    1   0   2/2   100.0     0/0   0.0
Russell McGrady         7    4    3    0   0   2/5    40.0     0/0   0.0
Malcolm Tatum          18    3    0    0   0   1/3    33.3     0/0   0.0
Derrick Durant         18    2    3    2   0   1/2    50.0     0/0   0.0
Pascal Lillard         18    2    2    0   0   1/1   100.0     0/0   0.0
Manu Jordan             7    0    1    3   0   0/0     0.0     0/0   0.0
Kristaps Iverson        7    0    4    0   0   0/0     0.0     0/0   0.0

TEAM: FG: 10/16 (62.5%), 3PT: 6/7 (85.7%), REB: 13 (2 off, 11 def), AST: 6, TO: 5
TEAM FOULS: 6 [Team_030 in BONUS]

================================================================================

================================================================================
                       3RD QUARTER - Team_030 vs Team_098                       
================================================================================

[12:00] Team_030 possession (Score: 45-49)
Tim Barrett attempts a Layup. BLOCKED BY NIKOLA ROSE! Ball is loose! Rebound secured by Pascal Lillard.

[11:45] Team_098 possession (Score: 45-49)
Malcolm Tatum drives, picks up Tyler Beal. Help arrives from Joel Anunoby! Malcolm Tatum attempts a Dunk. Contested by Joel Anunoby (4.4 feet, MAN). MALCOLM TATUM MAKES IT! Assist: Pascal Lillard
Score: 45-51

[11:31] Team_030 possession (Score: 45-51)
Tim Barrett attempts a 3Pt. Contested by Nikola Rose (3.1 feet, MAN). Tim Barrett misses. Offensive rebound by Joel Anunoby! Joel Anunoby kicks it out.

[11:18] Team_030 possession (Score: 45-51)
Jaren Green loses the ball! Stripped by Derrick Durant! TURNOVER! (live ball)

[11:06] Team_098 possession (Score: 45-51)
Blake Murray drives, Joel Anunoby stays with him. Blake Murray attempts a Layup. Contested by Joel Anunoby (3.6 feet, MAN). Blake Murray misses. Rebound secured by Joel Anunoby.

[10:52] Team_030 possession (Score: 45-51)
FOUL! Reach-in foul on Pascal Lillard during the drive. [Team fouls: 1] No free throws, side out. (Pascal Lillard: 1 personal fouls)

[10:36] Team_030 possession (Score: 45-51)
Tim Barrett attempts a 3Pt. Contested by Nikola Rose (3.1 feet, ZONE). Tim Barrett misses. Offensive rebound by Jordan Nowitzki! Jordan Nowitzki puts it back in!
Score: 47-51

[10:20] Team_098 possession (Score: 47-51)
Derrick Durant attempts a Midrange. Contested by Jaren Green (4.2 feet, MAN). DERRICK DURANT MAKES IT! Assist: Malcolm Tatum
Score: 47-53

[10:03] Team_030 possession (Score: 47-53)
Tyler Beal makes the Layup and draws the foul on Malcolm Tatum! And-1! Tyler Beal to the line for 1. [Team fouls: 2] (Malcolm Tatum: 1 personal fouls)   FT 1/1: GOOD Tyler Beal makes 1/1 from the line.
Score: 50-53

[09:45] Team_098 possession (Score: 50-53)
Blake Murray attempts a Midrange. Contested by Jaren Green (4.2 feet, ZONE). Blake Murray misses. Offensive rebound by Pascal Lillard! Pascal Lillard kicks it out.

[09:28] Team_098 possession (Score: 50-53)
Blake Murray drives and kicks out. Nikola Rose attempts a 3Pt. Contested by Tim Barrett (4.7 feet, MAN). NIKOLA ROSE MAKES IT! Assist: Pascal Lillard
Score: 50-56

[09:19] Team_030 possession (Score: 50-56)
Tyler Beal drives and kicks out. Tyler Beal attempts a 3Pt. Contested by Nikola Rose (3.2 feet, ZONE). Tyler Beal misses. Offensive rebound by Joel Anunoby! Joel Anunoby kicks it out.

[09:07] Team_030 possession (Score: 50-56)
Jordan Nowitzki attempts a Layup. BLOCKED BY PASCAL LILLARD! Ball is loose! Rebound secured by Nikola Rose.

[08:52] Team_098 possession (Score: 50-56)
Derrick Durant drives, picks up Jaren Green. Help arrives from Tyler Beal! Derrick Durant attempts a Layup. Contested by Tyler Beal (4.2 feet, MAN). DERRICK DURANT MAKES IT! Assist: Malcolm Tatum
Score: 50-58

[08:39] Team_030 possession (Score: 50-58)
Tyler Beal attempts a 3Pt. Contested by Nikola Rose (3.4 feet, ZONE). TYLER BEAL MAKES IT! Assist: Tim Barrett
Score: 53-58

[08:23] Team_098 possession (Score: 53-58)
Derrick Durant attempts a Midrange. Contested by Jaren Green (4.2 feet, MAN). Derrick Durant misses. Rebound secured by Jordan Nowitzki.

[08:11] Team_030 possession (Score: 53-58)
Joel Anunoby attempts a 3Pt. Contested by Pascal Lillard (4.4 feet, ZONE). Joel Anunoby misses. Rebound secured by Derrick Durant.

[07:56] Team_098 possession (Score: 53-58)
Nikola Rose drives, Jordan Nowitzki stays with him. Nikola Rose attempts a Layup. Contested by Jordan Nowitzki (4.7 feet, ZONE). Nikola Rose misses. Rebound secured by Joel Anunoby.

[07:43] Team_030 possession (Score: 53-58)
Jordan Nowitzki attempts a Midrange. Contested by Blake Murray (5.0 feet, ZONE). Jordan Nowitzki misses. Offensive rebound by Joel Anunoby! Joel Anunoby kicks it out.

[07:25] Team_030 possession (Score: 53-58)
Jordan Nowitzki attempts a Midrange. Contested by Pascal Lillard (4.6 feet, MAN). Jordan Nowitzki misses. Rebound secured by Nikola Rose.

[07:07] Team_098 possession (Score: 53-58)
Derrick Durant attempts a Layup. Contested by Jaren Green (4.2 feet, ZONE). DERRICK DURANT MAKES IT!
Score: 53-60

[06:51] Team_030 possession (Score: 53-60)
FOUL! Holding foul on Blake Murray. [Team fouls: 3] No free throws, side out. (Blake Murray: 1 personal fouls)

[06:35] Team_030 possession (Score: 53-60)
Tim Barrett attempts a 3Pt. Contested by Nikola Rose (3.1 feet, MAN). Tim Barrett misses. Rebound secured by Pascal Lillard.

[06:22] Team_098 possession (Score: 53-60)
Nikola Rose attempts a 3Pt. Contested by Tim Barrett (5.1 feet, MAN). NIKOLA ROSE MAKES IT! Assist: Derrick Durant
Score: 53-63

[06:08] Team_030 possession (Score: 53-63)
Tyler Beal attempts a Midrange. Contested by Malcolm Tatum (4.2 feet, MAN). Tyler Beal misses. FOUL! Loose ball foul on Nikola Rose during the rebound battle. [Team fouls: 4] No free throws, side out. (Nikola Rose: 1 personal fouls)

[05:55] Team_030 possession (Score: 53-63)
Jaren Green attempts a Midrange. Contested by Derrick Durant (5.1 feet, MAN). Jaren Green misses. FOUL! Loose ball foul on Pascal Lillard during the rebound battle. [IN THE BONUS! 5 team fouls] Joel Anunoby to the line for 2 free throws. (Pascal Lillard: 2 personal fouls)   FT 1/2: GOOD   FT 2/2: GOOD Joel Anunoby makes 2/2 from the line.
Score: 55-63

[05:42] Team_098 possession (Score: 55-63)
FOUL! Reach-in foul on Joel Anunoby during the drive. [Team fouls: 1] No free throws, side out. (Joel Anunoby: 1 personal fouls)

[05:29] Team_098 possession (Score: 55-63)
Malcolm Tatum drives and kicks out. Derrick Durant attempts a 3Pt. Contested by Jaren Green (4.0 feet, MAN). Derrick Durant misses. Offensive rebound by Derrick Durant! Derrick Durant puts it back in!
Score: 55-65

[05:16] Team_030 possession (Score: 55-65)
Tim Barrett attempts a Layup. Contested by Pascal Lillard (4.0 feet, ZONE). TIM BARRETT MAKES IT! Assist: Jordan Nowitzki
Score: 57-65

[05:01] Team_098 possession (Score: 57-65)
Malcolm Tatum makes the Layup and draws the foul on Tyler Beal! And-1! Malcolm Tatum to the line for 1. [Team fouls: 2] (Tyler Beal: 1 personal fouls)   FT 1/1: GOOD Malcolm Tatum makes 1/1 from the line.
Score: 57-68

[04:48] Team_030 possession (Score: 57-68)
Jaren Green drives, picks up Derrick Durant. Help arrives from Nikola Rose! Jaren Green attempts a Layup. Contested by Nikola Rose (5.2 feet, MAN). JAREN GREEN MAKES IT!
Score: 59-68

[04:32] Team_098 possession (Score: 59-68)
Nikola Rose attempts a 3Pt. Contested by Tim Barrett (5.1 feet, ZONE). Nikola Rose misses. Rebound secured by Jaren Green.

[04:17] Team_030 possession (Score: 59-68)
FOUL! Holding foul on Malcolm Tatum. [IN THE BONUS! 6 team fouls] Tyler Beal to the line for 2 free throws. (Malcolm Tatum: 2 personal fouls)   FT 1/2: MISS   FT 2/2: GOOD Tyler Beal makes 1/2 from the line.
Score: 60-68

[04:02] Team_098 possession (Score: 60-68)
Blake Murray makes the Midrange and draws the foul on Jordan Nowitzki! And-1! Blake Murray to the line for 1. [Team fouls: 3] (Jordan Nowitzki: 1 personal fouls)   FT 1/1: GOOD Blake Murray makes 1/1 from the line.
Score: 60-71

[03:50] Team_030 possession (Score: 60-71)
FOUL! Reach-in foul on Pascal Lillard during the drive. [IN THE BONUS! 7 team fouls] Tyler Beal to the line for 2 free throws. (Pascal Lillard: 3 personal fouls)   FT 1/2: MISS   FT 2/2: GOOD Tyler Beal makes 1/2 from the line.
Score: 61-71

[03:36] Team_098 possession (Score: 61-71)
FOUL! Shooting foul on Jaren Green. Malcolm Tatum to the line for 2 free throws. [Team fouls: 4] (Jaren Green: 1 personal fouls)   FT 1/2: GOOD   FT 2/2: MISS Malcolm Tatum makes 1/2 from the line. Rebound secured by Jordan Nowitzki.
Score: 61-72

[03:21] Team_030 possession (Score: 61-72)
FOUL! Shooting foul on Nikola Rose. Joel Anunoby to the line for 2 free throws. [BONUS: 8 team fouls] (Nikola Rose: 2 personal fouls)   FT 1/2: MISS   FT 2/2: GOOD Joel Anunoby makes 1/2 from the line.
Score: 62-72

[03:02] Team_098 possession (Score: 62-72)
Derrick Durant makes the Layup and draws the foul on Jaren Green! And-1! Derrick Durant to the line for 1. [BONUS: 5 team fouls] (Jaren Green: 2 personal fouls)   FT 1/1: GOOD Derrick Durant makes 1/1 from the line.
Score: 62-75

[02:51] Team_030 possession (Score: 62-75)
Jaren Green drives to the basket... Jaren Green throws a bad pass! Stolen by Derrick Durant! TURNOVER! (live ball)

[02:35] Team_098 possession (Score: 62-75)
Malcolm Tatum makes the Layup and draws the foul on Jaren Green! And-1! Malcolm Tatum to the line for 1. [BONUS: 6 team fouls] (Jaren Green: 3 personal fouls)   FT 1/1: GOOD Malcolm Tatum makes 1/1 from the line.
Score: 62-78

[02:17] Team_030 possession (Score: 62-78)
Jaren Green attempts a 3Pt. Contested by Nikola Rose (4.2 feet, ZONE). JAREN GREEN MAKES IT!
Score: 65-78

[01:59] Team_098 possession (Score: 65-78)
Nikola Rose attempts a 3Pt. Contested by Tyler Beal (4.8 feet, ZONE). Nikola Rose misses. Rebound secured by Joel Anunoby.

[01:43] Team_030 possession (Score: 65-78)
FOUL! Reach-in foul on Nikola Rose during the drive. [IN THE BONUS! 9 team fouls] Tim Barrett to the line for 2 free throws. (Nikola Rose: 3 personal fouls)   FT 1/2: GOOD   FT 2/2: MISS Tim Barrett makes 1/2 from the line. Rebound secured by Derrick Durant.
Score: 66-78

[01:26] Team_098 possession (Score: 66-78)
Pascal Lillard makes the Layup and draws the foul on Tyler Beal! And-1! Pascal Lillard to the line for 1. [BONUS: 7 team fouls] (Tyler Beal: 2 personal fouls)   FT 1/1: GOOD Pascal Lillard makes 1/1 from the line.
Score: 66-81

[01:12] Team_030 possession (Score: 66-81)
Jaren Green drives and kicks out. Jaren Green attempts a Midrange. Contested by Pascal Lillard (4.4 feet, ZONE). JAREN GREEN MAKES IT! Assist: Tim Barrett
Score: 68-81

[00:59] Team_098 possession (Score: 68-81)
Derrick Durant makes the Dunk and draws the foul on Tyler Beal! And-1! Derrick Durant to the line for 1. [BONUS: 8 team fouls] (Tyler Beal: 3 personal fouls)   FT 1/1: GOOD Derrick Durant makes 1/1 from the line.
Score: 68-84

[00:41] Team_030 possession (Score: 68-84)
Tyler Beal attempts a Layup. Contested by Pascal Lillard (4.7 feet, ZONE). TYLER BEAL MAKES IT!
Score: 70-84

[00:26] Team_098 possession (Score: 70-84)
Derrick Durant drives, picks up Jaren Green. Help arrives from Tyler Beal! Derrick Durant attempts a Layup. Contested by Tyler Beal (4.6 feet, MAN). DERRICK DURANT MAKES IT! Assist: Pascal Lillard
Score: 70-86

[00:10] Team_030 possession (Score: 70-86)
Tyler Beal attempts a 3Pt. Contested by Nikola Rose (3.9 feet, ZONE). Tyler Beal misses. Offensive rebound by Joel Anunoby! Joel Anunoby kicks it out.

================================================================================
                              3RD QUARTER COMPLETE                              
================================================================================

3RD QUARTER SCORE: Team_030 25, Team_098 37

BOX SCORE:
================================================================================

Team_030
--------------------------------------------------------------------------------
Player                MIN  PTS  REB  AST  TO      FG   FG%      3P   3P%
--------------------------------------------------------------------------------
Tyler Beal             30   10    0    0   0   5/5   100.0     0/0   0.0
Jaren Green            30    7    1    0   0   3/3   100.0     0/0   0.0
Joel Anunoby           30    3    7    0   0   2/3    66.7     0/0   0.0
Tim Barrett            30    2    0    2   0   1/4    25.0     0/0   0.0
Jordan Nowitzki        30    2    4    1   0   1/3    33.3     0/0   0.0

TEAM: FG: 12/18 (66.7%), 3PT: 3/5 (60.0%), REB: 12 (6 off, 6 def), AST: 3, TO: 2
TEAM FOULS: 8 [Team_098 in BONUS]


Team_098
--------------------------------------------------------------------------------
Player                MIN  PTS  REB  AST  TO      FG   FG%      3P   3P%
--------------------------------------------------------------------------------
Derrick Durant         30   16    3    1   0   7/8    87.5     0/0   0.0
Malcolm Tatum          30    8    0    2   0   3/4    75.0     0/0   0.0
Nikola Rose            30    6    2    0   0   2/5    40.0     0/0   0.0
Pascal Lillard         30    3    3    3   0   1/1   100.0     0/0   0.0
Blake Murray           30    3    0    0   0   1/2    50.0     0/0   0.0

TEAM: FG: 14/20 (70.0%), 3PT: 1/3 (33.3%), REB: 8 (2 off, 6 def), AST: 6, TO: 0
TEAM FOULS: 9 [Team_030 in BONUS]

================================================================================

================================================================================
                       4TH QUARTER - Team_030 vs Team_098                       
================================================================================

[12:00] Substitution (Team_030): Tyler Beal OUT (stamina: 71) → RJ Carter IN (comeback_detected)

[12:00] Substitution (Team_098): Malcolm Tatum OUT (stamina: 70) → Tracy Rose IN (comeback_detected)

[12:00] Team_030 possession (Score: 70-86)
Jaren Green drives and kicks out. Jordan Nowitzki attempts a 3Pt. Contested by Nikola Rose (3.4 feet, ZONE). JORDAN NOWITZKI MAKES IT!
Score: 73-86

[11:42] Team_098 possession (Score: 73-86)
Derrick Durant attempts a Layup. Contested by Jaren Green (4.5 feet, MAN). DERRICK DURANT MAKES IT! Assist: Pascal Lillard
Score: 73-88

[11:28] Team_030 possession (Score: 73-88)
Joel Anunoby attempts a 3Pt. Contested by Tracy Rose (3.5 feet, ZONE). JOEL ANUNOBY MAKES IT! Assist: RJ Carter
Score: 76-88

[11:14] Team_098 possession (Score: 76-88)
FOUL! Offensive foul on Nikola Rose! Tim Barrett drew the charge! [Team fouls: 1] (Nikola Rose: 1 personal fouls) TURNOVER! (dead ball)

[10:57] Team_030 possession (Score: 76-88)
Jaren Green makes the Layup and draws the foul on Pascal Lillard! And-1! Jaren Green to the line for 1. [Team fouls: 2] (Pascal Lillard: 1 personal fouls)   FT 1/1: GOOD Jaren Green makes 1/1 from the line.
Score: 79-88

[10:43] Team_098 possession (Score: 79-88)
FOUL! Shooting foul on Tim Barrett. Nikola Rose to the line for 2 free throws. [Team fouls: 1] (Tim Barrett: 1 personal fouls)   FT 1/2: MISS   FT 2/2: GOOD Nikola Rose makes 1/2 from the line.
Score: 79-89

[10:28] Team_030 possession (Score: 79-89)
Joel Anunoby attempts a Midrange. Contested by Blake Murray (5.3 feet, ZONE). Joel Anunoby misses. Rebound secured by Pascal Lillard.

[10:17] Team_098 possession (Score: 79-89)
Nikola Rose attempts a Midrange. Contested by Joel Anunoby (4.1 feet, ZONE). NIKOLA ROSE MAKES IT!
Score: 79-91

[10:07] Team_030 possession (Score: 79-91)
Jordan Nowitzki attempts a Midrange. Contested by Pascal Lillard (5.0 feet, ZONE). JORDAN NOWITZKI MAKES IT!
Score: 81-91

[09:50] Team_098 possession (Score: 81-91)
FOUL! Reach-in foul on Jaren Green during the drive. [Team fouls: 2] No free throws, side out. (Jaren Green: 1 personal fouls)

[09:35] Team_098 possession (Score: 81-91)
Derrick Durant attempts a Layup. Contested by Jaren Green (4.7 feet, MAN). Derrick Durant misses. Offensive rebound by Derrick Durant! Derrick Durant's putback is no good. Rebound secured by Joel Anunoby.

[09:19] Team_030 possession (Score: 81-91)
Jaren Green attempts a Midrange. Contested by Nikola Rose (4.5 feet, ZONE). Jaren Green misses. Offensive rebound by Jordan Nowitzki! Jordan Nowitzki kicks it out.

[09:03] Team_030 possession (Score: 81-91)
Joel Anunoby attempts a 3Pt. Contested by Tracy Rose (3.5 feet, ZONE). Joel Anunoby misses. Rebound secured by Pascal Lillard.

[08:47] Team_098 possession (Score: 81-91)
Pascal Lillard makes the Layup and draws the foul on Jaren Green! And-1! Pascal Lillard to the line for 1. [Team fouls: 3] (Jaren Green: 2 personal fouls)   FT 1/1: GOOD Pascal Lillard makes 1/1 from the line.
Score: 81-94

[08:30] Team_030 possession (Score: 81-94)
Joel Anunoby drives, Blake Murray stays with him. Joel Anunoby attempts a Dunk. Contested by Blake Murray (5.5 feet, MAN). JOEL ANUNOBY MAKES IT! Assist: RJ Carter
Score: 83-94

[08:15] Team_098 possession (Score: 83-94)
Derrick Durant makes the Layup and draws the foul on Jaren Green! And-1! Derrick Durant to the line for 1. [Team fouls: 4] (Jaren Green: 3 personal fouls)   FT 1/1: GOOD Derrick Durant makes 1/1 from the line.
Score: 83-97

[07:57] Team_030 possession (Score: 83-97)
RJ Carter attempts a Layup. Contested by Tracy Rose (3.3 feet, MAN). RJ CARTER MAKES IT!
Score: 85-97

[07:42] Team_098 possession (Score: 85-97)
Pascal Lillard attempts a Layup. BLOCKED BY JORDAN NOWITZKI! Ball is loose! Rebound secured by Jaren Green.

[07:28] Team_030 possession (Score: 85-97)
FOUL! Holding foul on Tracy Rose. [Team fouls: 3] No free throws, side out. (Tracy Rose: 1 personal fouls)

[07:10] Team_030 possession (Score: 85-97)
Jordan Nowitzki attempts a Layup. Contested by Pascal Lillard (5.3 feet, MAN). JORDAN NOWITZKI MAKES IT!
Score: 87-97

[06:52] Team_098 possession (Score: 87-97)
Pascal Lillard attempts a Layup. Contested by Jordan Nowitzki (5.6 feet, MAN). PASCAL LILLARD MAKES IT! Assist: Blake Murray
Score: 87-99

[06:33] Team_030 possession (Score: 87-99)
RJ Carter drives to the basket... RJ Carter throws a bad pass! Stolen by Tracy Rose! TURNOVER! (live ball)

[06:19] Team_098 possession (Score: 87-99)
FOUL! Shooting foul on RJ Carter. Derrick Durant to the line for 2 free throws. [BONUS: 5 team fouls] (RJ Carter: 1 personal fouls)   FT 1/2: GOOD   FT 2/2: GOOD Derrick Durant makes 2/2 from the line.
Score: 87-101

[06:04] Team_030 possession (Score: 87-101)
RJ Carter throws a bad pass out of bounds! TURNOVER! (dead ball)

[06:04] Substitution (Team_030): Tim Barrett OUT → Josh Smith IN (stamina_rule2)

[06:04] Substitution (Team_030): Joel Anunoby OUT → Pau James IN (stamina_rule2)

[06:04] Substitution (Team_030): Jordan Nowitzki OUT → Damian Green IN (stamina_rule2)

[06:04] Substitution (Team_030): Jaren Green OUT → Franz Anunoby IN (stamina_rule2)

[06:04] Substitution (Team_098): Nikola Rose OUT → Dirk McCollum IN (stamina_rule2)

[06:04] Substitution (Team_098): Blake Murray OUT → Kristaps Iverson IN (stamina_rule2)

[06:04] Substitution (Team_098): Pascal Lillard OUT → Manu Jordan IN (stamina_rule2)

[06:04] Substitution (Team_098): Derrick Durant OUT → Russell McGrady IN (stamina_rule2)

[05:52] Team_098 possession (Score: 87-101)
Russell McGrady drives and kicks out. Dirk McCollum attempts a 3Pt. Contested by RJ Carter (5.7 feet, ZONE). Dirk McCollum misses. Offensive rebound by Kristaps Iverson! Kristaps Iverson kicks it out.

[05:40] Team_098 possession (Score: 87-101)
Kristaps Iverson makes the Dunk and draws the foul on Pau James! And-1! Kristaps Iverson to the line for 1. [BONUS: 6 team fouls] (Pau James: 1 personal fouls)   FT 1/1: GOOD Kristaps Iverson makes 1/1 from the line.
Score: 87-104

[05:27] Team_030 possession (Score: 87-104)
Pau James drives to the basket... Pau James loses the ball! Stripped by Russell McGrady! TURNOVER! (live ball)

[05:15] Team_098 possession (Score: 87-104)
Manu Jordan drives to the basket... Manu Jordan loses control! Ball rolls out of bounds! TURNOVER! (dead ball)

[05:02] Team_030 possession (Score: 87-104)
FOUL! Shooting foul on Kristaps Iverson. Pau James to the line for 2 free throws. [Team fouls: 4] (Kristaps Iverson: 1 personal fouls)   FT 1/2: GOOD   FT 2/2: MISS Pau James makes 1/2 from the line. Offensive rebound by Pau James! Pau James kicks it out.
Score: 88-104

[04:49] Team_030 possession (Score: 88-104)
Damian Green makes the Layup and draws the foul on Manu Jordan! And-1! Damian Green to the line for 1. [BONUS: 5 team fouls] (Manu Jordan: 1 personal fouls)   FT 1/1: GOOD Damian Green makes 1/1 from the line.
Score: 91-104

[04:39] Team_098 possession (Score: 91-104)
Dirk McCollum attempts a 3Pt. Contested by RJ Carter (5.8 feet, ZONE). Dirk McCollum misses. Rebound secured by Pau James.

[04:24] Team_030 possession (Score: 91-104)
RJ Carter attempts a Layup. Contested by Tracy Rose (3.4 feet, MAN). RJ Carter misses. Rebound secured by Russell McGrady.

[04:13] Team_098 possession (Score: 91-104)
Dirk McCollum attempts a 3Pt. Contested by RJ Carter (5.9 feet, ZONE). DIRK MCCOLLUM MAKES IT! Assist: Russell McGrady
Score: 91-107

[04:03] Team_030 possession (Score: 91-107)
Pau James attempts a Midrange. Contested by Kristaps Iverson (4.0 feet, MAN). Pau James misses. Rebound secured by Kristaps Iverson.

[03:50] Team_098 possession (Score: 91-107)
Manu Jordan attempts a Layup. Contested by Franz Anunoby (4.6 feet, ZONE). Manu Jordan misses. Rebound secured by Franz Anunoby.

[03:34] Team_030 possession (Score: 91-107)
RJ Carter drives to the basket... RJ Carter commits a violation (traveling/carry)! TURNOVER! (dead ball)

[03:23] Team_098 possession (Score: 91-107)
Kristaps Iverson attempts a Layup. Contested by Pau James (4.5 feet, MAN). Kristaps Iverson misses. Offensive rebound by Kristaps Iverson! Kristaps Iverson kicks it out.

[03:09] Team_098 possession (Score: 91-107)
Dirk McCollum attempts a 3Pt. Contested by Josh Smith (4.7 feet, MAN). Dirk McCollum misses. Rebound secured by Pau James.

[02:54] Team_030 possession (Score: 91-107)
Josh Smith attempts a 3Pt. Contested by Dirk McCollum (4.3 feet, MAN). Josh Smith misses. Rebound secured by Russell McGrady.

[02:37] Team_098 possession (Score: 91-107)
Tracy Rose attempts a 3Pt. Contested by RJ Carter (5.9 feet, ZONE). Tracy Rose misses. Rebound secured by Damian Green.

[02:24] Team_030 possession (Score: 91-107)
Franz Anunoby drives, Russell McGrady stays with him. Franz Anunoby attempts a Layup. Contested by Russell McGrady (4.1 feet, MAN). FRANZ ANUNOBY MAKES IT! Assist: RJ Carter
Score: 93-107

[02:08] Team_098 possession (Score: 93-107)
Manu Jordan attempts a Midrange. Contested by Pau James (4.6 feet, ZONE). MANU JORDAN MAKES IT! Assist: Tracy Rose
Score: 93-109

[01:52] Team_030 possession (Score: 93-109)
Pau James attempts a 3Pt. Contested by Dirk McCollum (4.2 feet, ZONE). Pau James misses. Offensive rebound by Damian Green! Damian Green kicks it out.

[01:40] Team_030 possession (Score: 93-109)
Damian Green attempts a Layup. Contested by Russell McGrady (3.6 feet, ZONE). Damian Green misses. Rebound secured by Kristaps Iverson.

[01:26] Team_098 possession (Score: 93-109)
Kristaps Iverson attempts a 3Pt. Contested by Josh Smith (4.7 feet, ZONE). Kristaps Iverson misses. Rebound secured by Franz Anunoby.

[01:10] Team_030 possession (Score: 93-109)
Franz Anunoby drives and kicks out. Damian Green attempts a 3Pt. Contested by Dirk McCollum (4.2 feet, ZONE). Damian Green misses. Rebound secured by Russell McGrady.

[00:54] Team_098 possession (Score: 93-109)
FOUL! Holding foul on Pau James. [IN THE BONUS! 7 team fouls] Kristaps Iverson to the line for 2 free throws. (Pau James: 2 personal fouls)   FT 1/2: GOOD   FT 2/2: GOOD Kristaps Iverson makes 2/2 from the line.
Score: 93-111

[00:38] Team_030 possession (Score: 93-111)
Franz Anunoby throws a bad pass! Stolen by Russell McGrady! TURNOVER! (live ball)

[00:24] Team_098 possession (Score: 93-111)
Russell McGrady attempts a Midrange. Contested by Franz Anunoby (4.3 feet, MAN). Russell McGrady misses. Rebound secured by Pau James.

[00:07] Team_030 possession (Score: 93-111)
Pau James attempts a Layup. Contested by Russell McGrady (3.8 feet, ZONE). PAU JAMES MAKES IT! Assist: RJ Carter
Score: 95-111

================================================================================
                              4TH QUARTER COMPLETE                              
================================================================================

4TH QUARTER SCORE: Team_030 25, Team_098 25

BOX SCORE:
================================================================================

Team_030
--------------------------------------------------------------------------------
Player                MIN  PTS  REB  AST  TO      FG   FG%      3P   3P%
--------------------------------------------------------------------------------
Jordan Nowitzki        36    7    1    0   0   3/3   100.0     0/0   0.0
Joel Anunoby           36    5    1    0   0   2/4    50.0     0/0   0.0
Jaren Green            36    3    1    0   0   1/1   100.0     0/0   0.0
Damian Green           13    3    2    0   0   1/2    50.0     0/0   0.0
RJ Carter              19    2    0    4   0   1/2    50.0     0/0   0.0
Pau James              13    2    4    0   0   1/2    50.0     0/0   0.0
Franz Anunoby          13    2    2    0   0   1/2    50.0     0/0   0.0
Josh Smith             13    0    0    0   0   0/1     0.0     0/0   0.0

TEAM: FG: 10/17 (58.8%), 3PT: 1/3 (33.3%), REB: 10 (3 off, 7 def), AST: 4, TO: 5
TEAM FOULS: 7 [Team_098 in BONUS]


Team_098
--------------------------------------------------------------------------------
Player                MIN  PTS  REB  AST  TO      FG   FG%      3P   3P%
--------------------------------------------------------------------------------
Derrick Durant         36    7    0    0   0   3/4    75.0     0/0   0.0
Pascal Lillard         36    5    2    1   0   2/3    66.7     0/0   0.0
Kristaps Iverson       13    5    4    0   0   2/3    66.7     0/0   0.0
Nikola Rose            36    3    0    0   0   2/2   100.0     0/0   0.0
Dirk McCollum          13    3    0    0   0   1/3    33.3     0/0   0.0
Manu Jordan            13    2    0    0   0   1/2    50.0     0/0   0.0
Blake Murray           36    0    0    1   0   0/0     0.0     0/0   0.0
Russell McGrady        13    0    3    1   0   0/1     0.0     0/0   0.0
Tracy Rose             19    0    0    1   0   0/1     0.0     0/0   0.0

TEAM: FG: 11/19 (57.9%), 3PT: 1/5 (20.0%), REB: 10 (3 off, 7 def), AST: 4, TO: 2
TEAM FOULS: 5 [Team_030 in BONUS]

================================================================================

================================================================================
                               FULL GAME COMPLETE                               
================================================================================

FINAL SCORE: Team_030 95, Team_098 111

SCORING BY QUARTER:
--------------------------------------------------------------------------------
Team                     Q1     Q2     Q3     Q4    FINAL
--------------------------------------------------------------------------------
Team_030                 21     24     25     25       95
Team_098                 24     25     37     25      111
--------------------------------------------------------------------------------

FULL GAME BOX SCORE:
================================================================================

Team_030
--------------------------------------------------------------------------------
Player                MIN  PTS  REB  AST  TO      FG   FG%      3P   3P%      FT STL BLK
--------------------------------------------------------------------------------
Tim Barrett            36   10    0    4   3   5/13   38.5   2/5    40.0   5/7     1   0
Joel Anunoby           36   15   15    0   1   6/12   50.0   2/7    28.6   3/4     0   0
Jordan Nowitzki        36   12   10    4   2   3/6    50.0   0/1     0.0   1/1     1   1
Jaren Green            36   18    7    0   2  10/12   83.3   1/2    50.0   3/3     2   1
Tyler Beal             30   14    0    0   1   6/7    85.7   1/1   100.0   5/7     0   1
RJ Carter              19    2    0    4   1   1/4    25.0   0/1     0.0   0/0     0   0
Josh Smith             13    5    0    0   0   2/5    40.0   0/3     0.0   1/1     0   0
Pau James              13    2    5    0   2   1/2    50.0   0/0     0.0   2/5     0   0
Damian Green           13    5    5    0   0   2/4    50.0   0/0     0.0   3/3     1   0
Franz Anunoby          13    6    2    0   2   3/6    50.0   0/0     0.0   2/3     0   0

TEAM: FG: 40/73 (54.8%), 3PT: 6/20 (30.0%), REB: 43 (13 off, 30 def), AST: 12, TO: 14


Team_098
--------------------------------------------------------------------------------
Player                MIN  PTS  REB  AST  TO      FG   FG%      3P   3P%      FT STL BLK
--------------------------------------------------------------------------------
Nikola Rose            36   15    7    2   2   6/11   54.5   3/6    50.0   1/2     0   1
Blake Murray           36    8    0    2   0   4/8    50.0   1/3    33.3   3/3     0   1
Pascal Lillard         36   10   11    4   1   5/9    55.6   1/2    50.0   2/2     2   1
Derrick Durant         36   35    9    3   3  12/16   75.0   1/1   100.0   5/5     2   0
Malcolm Tatum          30   14    0    5   0   6/12   50.0   1/4    25.0   4/5     0   0
Tracy Rose             19    5    0    2   0   2/3    66.7   1/2    50.0   0/0     1   0
Dirk McCollum          13   12    0    0   0   4/6    66.7   3/5    60.0   1/1     0   0
Kristaps Iverson       13    5    8    0   0   2/3    66.7   1/2    50.0   3/3     1   1
Manu Jordan            13    2    1    3   1   1/2    50.0   0/0     0.0   0/0     0   0
Russell McGrady        13    4    6    1   2   1/5    20.0   0/0     0.0   0/0     2   0

TEAM: FG: 44/76 (57.9%), 3PT: 12/25 (48.0%), REB: 43 (10 off, 33 def), AST: 22, TO: 9

================================================================================
