================================================================================
                        FULL GAME - Team_066 vs Team_075                        
================================================================================

================================================================================
                       1ST QUARTER - Team_066 vs Team_075                       
================================================================================

[12:00] Team_066 possession (Score: 0-0)
FOUL! Shooting foul on Larry McCollum. Yao Brogdon to the line for 2 free throws. [Team fouls: 1] (Larry McCollum: 1 personal fouls)   FT 1/2: GOOD   FT 2/2: GOOD Yao Brogdon makes 2/2 from the line.
Score: 2-0

[11:50] Team_075 possession (Score: 2-0)
Kawhi Ingram attempts a 3Pt. Contested by Pau Curry (5.3 feet, MAN). KAWHI INGRAM MAKES IT! Assist: Klay Jokic
Score: 2-3

[11:40] Team_066 possession (Score: 2-3)
Yao Brogdon loses the ball! Stripped by Derrick Stewart! TURNOVER! (live ball)

[11:25] Team_075 possession (Score: 2-3)
Klay Jokic attempts a 3Pt. Contested by Kyle Wagner (4.4 feet, MAN). KLAY JOKIC MAKES IT! Assist: Derrick Stewart
Score: 2-6

[11:11] Team_066 possession (Score: 2-6)
Yao Brogdon drives and kicks out. Jimmy Davis attempts a 3Pt. Contested by Larry McCollum (4.2 feet, ZONE). Jimmy Davis misses. Rebound secured by Derrick Stewart.

[10:56] Team_075 possession (Score: 2-6)
Klay Jokic attempts a 3Pt. Contested by Kyle Wagner (4.4 feet, MAN). Klay Jokic misses. Rebound secured by Brandon Reaves.

[10:42] Team_066 possession (Score: 2-6)
FOUL! Holding foul on Derrick Stewart. [Team fouls: 2] No free throws, side out. (Derrick Stewart: 1 personal fouls)

[10:24] Team_066 possession (Score: 2-6)
Yao Brogdon drives and kicks out. Yao Brogdon attempts a 3Pt. Contested by Derrick Stewart (4.5 feet, MAN). Yao Brogdon misses. Rebound secured by Kawhi Ingram.

[10:10] Team_075 possession (Score: 2-6)
Myles Barrett attempts a Layup. Contested by Kyle Wagner (4.1 feet, ZONE). MYLES BARRETT MAKES IT! Assist: Klay Jokic
Score: 2-8

[09:57] Team_066 possession (Score: 2-8)
Brandon Reaves attempts a 3Pt. Contested by Larry McCollum (4.7 feet, ZONE). Brandon Reaves misses. Rebound secured by Klay Jokic.

[09:43] Team_075 possession (Score: 2-8)
Larry McCollum attempts a 3Pt. Contested by Jimmy Davis (4.1 feet, MAN). Larry McCollum misses. FOUL! Loose ball foul on Brandon Reaves during the rebound battle. [Team fouls: 1] No free throws, side out. (Brandon Reaves: 1 personal fouls)

[09:26] Team_075 possession (Score: 2-8)
Myles Barrett attempts a 3Pt. Contested by Brandon Reaves (5.3 feet, MAN). Myles Barrett misses. Rebound secured by Kyle Wagner.

[09:13] Team_066 possession (Score: 2-8)
Kyle Wagner attempts a Layup. Contested by Klay Jokic (5.2 feet, MAN). KYLE WAGNER MAKES IT! Assist: Brandon Reaves
Score: 4-8

[08:56] Team_075 possession (Score: 4-8)
Kawhi Ingram drives to the basket... Kawhi Ingram throws a bad pass out of bounds! TURNOVER! (dead ball)

[08:42] Team_066 possession (Score: 4-8)
Yao Brogdon attempts a 3Pt. Contested by Derrick Stewart (4.9 feet, MAN). YAO BROGDON MAKES IT! Assist: Pau Curry
Score: 7-8

[08:31] Team_075 possession (Score: 7-8)
Klay Jokic attempts a Midrange. Contested by Kyle Wagner (4.4 feet, MAN). Klay Jokic misses. Rebound secured by Yao Brogdon.

[08:18] Team_066 possession (Score: 7-8)
Yao Brogdon attempts a Midrange. Contested by Derrick Stewart (4.9 feet, MAN). Yao Brogdon misses. Offensive rebound by Yao Brogdon! Yao Brogdon kicks it out.

[08:00] Team_066 possession (Score: 7-8)
Pau Curry attempts a 3Pt. Contested by Kawhi Ingram (4.3 feet, MAN). Pau Curry misses. Rebound secured by Klay Jokic.

[07:44] Team_075 possession (Score: 7-8)
Kawhi Ingram drives to the basket... Kawhi Ingram throws a bad pass! Stolen by Pau Curry! TURNOVER! (live ball)

[07:28] Team_066 possession (Score: 7-8)
Yao Brogdon makes the Layup and draws the foul on Derrick Stewart! And-1! Yao Brogdon to the line for 1. [Team fouls: 3] (Derrick Stewart: 2 personal fouls)   FT 1/1: GOOD Yao Brogdon makes 1/1 from the line.
Score: 10-8

[07:16] Team_075 possession (Score: 10-8)
Myles Barrett attempts a 3Pt. Contested by Pau Curry (5.7 feet, ZONE). MYLES BARRETT MAKES IT! Assist: Derrick Stewart
Score: 10-11

[07:03] Team_066 possession (Score: 10-11)
Pau Curry attempts a Midrange. Wide open! Myles Barrett is 6.1 feet away. [ZONE] PAU CURRY MAKES IT!
Score: 12-11

[06:51] Team_075 possession (Score: 12-11)
Kawhi Ingram makes the Layup and draws the foul on Kyle Wagner! And-1! Kawhi Ingram to the line for 1. [Team fouls: 2] (Kyle Wagner: 1 personal fouls)   FT 1/1: GOOD Kawhi Ingram makes 1/1 from the line.
Score: 12-14

[06:34] Team_066 possession (Score: 12-14)
Jimmy Davis attempts a 3Pt. Contested by Larry McCollum (4.7 feet, ZONE). Jimmy Davis misses. Rebound secured by Klay Jokic.

[06:21] Team_075 possession (Score: 12-14)
Larry McCollum attempts a 3Pt. Contested by Jimmy Davis (4.1 feet, ZONE). Larry McCollum misses. Rebound secured by Kyle Wagner.

[06:07] Team_066 possession (Score: 12-14)
Jimmy Davis loses control! Ball rolls out of bounds! TURNOVER! (dead ball)

[05:51] Team_075 possession (Score: 12-14)
Klay Jokic drives and kicks out. Myles Barrett attempts a 3Pt. Contested by Brandon Reaves (5.1 feet, MAN). MYLES BARRETT MAKES IT! Assist: Klay Jokic
Score: 12-17

[05:34] Team_066 possession (Score: 12-17)
Yao Brogdon attempts a Midrange. Contested by Derrick Stewart (4.9 feet, MAN). YAO BROGDON MAKES IT!
Score: 14-17

[05:18] Team_075 possession (Score: 14-17)
FOUL! Holding foul on Pau Curry. [Team fouls: 3] No free throws, side out. (Pau Curry: 1 personal fouls)

[05:02] Team_075 possession (Score: 14-17)
Klay Jokic throws a bad pass out of bounds! TURNOVER! (dead ball)

[04:47] Team_066 possession (Score: 14-17)
Jimmy Davis attempts a Midrange. Wide open! Myles Barrett is 6.4 feet away. [ZONE] JIMMY DAVIS MAKES IT! Assist: Brandon Reaves
Score: 16-17

[04:30] Team_075 possession (Score: 16-17)
Klay Jokic attempts a 3Pt. Contested by Kyle Wagner (4.4 feet, MAN). Klay Jokic misses. Offensive rebound by Derrick Stewart! Derrick Stewart kicks it out.

[04:12] Team_075 possession (Score: 16-17)
Klay Jokic attempts a Layup. Contested by Kyle Wagner (4.4 feet, ZONE). Klay Jokic misses. Rebound secured by Kyle Wagner.

[03:55] Team_066 possession (Score: 16-17)
Jimmy Davis attempts a 3Pt. Contested by Larry McCollum (4.8 feet, ZONE). JIMMY DAVIS MAKES IT! Assist: Yao Brogdon
Score: 19-17

[03:42] Team_075 possession (Score: 19-17)
Myles Barrett drives to the basket... Myles Barrett throws a bad pass! Stolen by Kyle Wagner! TURNOVER! (live ball)

[03:31] Team_066 possession (Score: 19-17)
Jimmy Davis drives, Larry McCollum stays with him. Jimmy Davis attempts a Layup. Contested by Larry McCollum (4.8 feet, MAN). Jimmy Davis misses. FOUL! Loose ball foul on Klay Jokic during the rebound battle. [Team fouls: 4] No free throws, side out. (Klay Jokic: 1 personal fouls)

[03:18] Team_066 possession (Score: 19-17)
Brandon Reaves drives to the basket... Brandon Reaves loses control! Ball rolls out of bounds! TURNOVER! (dead ball)

[03:06] Team_075 possession (Score: 19-17)
Kawhi Ingram makes the Dunk and draws the foul on Jimmy Davis! And-1! Kawhi Ingram to the line for 1. [Team fouls: 4] (Jimmy Davis: 1 personal fouls)   FT 1/1: GOOD Kawhi Ingram makes 1/1 from the line.
Score: 19-20

[02:54] Team_066 possession (Score: 19-20)
Pau Curry attempts a 3Pt. Contested by Larry McCollum (4.7 feet, ZONE). Pau Curry misses. Offensive rebound by Yao Brogdon! Yao Brogdon kicks it out.

[02:39] Team_066 possession (Score: 19-20)
Yao Brogdon attempts a 3Pt. Contested by Larry McCollum (4.9 feet, ZONE). YAO BROGDON MAKES IT! Assist: Jimmy Davis
Score: 22-20

[02:20] Team_075 possession (Score: 22-20)
Klay Jokic drives and kicks out. Myles Barrett attempts a 3Pt. Contested by Brandon Reaves (5.3 feet, MAN). MYLES BARRETT MAKES IT! Assist: Larry McCollum
Score: 22-23

[02:07] Team_066 possession (Score: 22-23)
Jimmy Davis attempts a 3Pt. Contested by Larry McCollum (5.0 feet, ZONE). JIMMY DAVIS MAKES IT!
Score: 25-23

[01:51] Team_075 possession (Score: 25-23)
Klay Jokic drives to the basket... Klay Jokic loses control! Ball rolls out of bounds! TURNOVER! (dead ball)

[01:51] Substitution (Team_066): Jimmy Davis OUT → Pascal Carter IN (stamina_rule2)

[01:51] Substitution (Team_066): Pau Curry OUT → Lauri LaVine IN (stamina_rule2)

[01:51] Substitution (Team_066): Brandon Reaves OUT → Brandon Middleton IN (stamina_rule2)

[01:51] Substitution (Team_066): Yao Brogdon OUT → Cole Morant IN (stamina_rule2)

[01:51] Substitution (Team_066): Kyle Wagner OUT → Donovan Simmons IN (stamina_rule2)

[01:51] Substitution (Team_075): Larry McCollum OUT → D'Angelo Anunoby IN (stamina_rule2)

[01:51] Substitution (Team_075): Kawhi Ingram OUT → LeBron Ginobili IN (stamina_rule2)

[01:51] Substitution (Team_075): Myles Barrett OUT → Donovan Paul IN (stamina_rule2)

[01:51] Substitution (Team_075): Derrick Stewart OUT → Collin Duncan IN (stamina_rule2)

[01:51] Substitution (Team_075): Klay Jokic OUT → Kevin Towns IN (stamina_rule2)

[01:39] Team_066 possession (Score: 25-23)
Brandon Middleton attempts a 3Pt. Contested by D'Angelo Anunoby (5.0 feet, ZONE). BRANDON MIDDLETON MAKES IT! Assist: Pascal Carter
Score: 28-23

[01:21] Team_075 possession (Score: 28-23)
LeBron Ginobili attempts a Layup. Contested by Lauri LaVine (3.9 feet, MAN). LEBRON GINOBILI MAKES IT!
Score: 28-25

[01:07] Team_066 possession (Score: 28-25)
Lauri LaVine attempts a Midrange. Contested by LeBron Ginobili (5.0 feet, MAN). Lauri LaVine misses. Rebound secured by Collin Duncan.

[00:53] Team_075 possession (Score: 28-25)
D'Angelo Anunoby drives and kicks out. D'Angelo Anunoby attempts a Midrange. Wide open! Pascal Carter is 6.7 feet away. [MAN] D'ANGELO ANUNOBY MAKES IT!
Score: 28-27

[00:42] Team_066 possession (Score: 28-27)
Donovan Simmons attempts a Midrange. Contested by Kevin Towns (5.5 feet, MAN). DONOVAN SIMMONS MAKES IT! Assist: Pascal Carter
Score: 30-27

[00:29] Team_075 possession (Score: 30-27)
D'Angelo Anunoby drives and kicks out. Collin Duncan attempts a 3Pt. Contested by Cole Morant (5.5 feet, MAN). COLLIN DUNCAN MAKES IT! Assist: Kevin Towns
Score: 30-30

[00:12] Team_066 possession (Score: 30-30)
Donovan Simmons attempts a Layup. Contested by Kevin Towns (5.5 feet, ZONE). DONOVAN SIMMONS MAKES IT!
Score: 32-30

================================================================================
                              1ST QUARTER COMPLETE                              
================================================================================

1ST QUARTER SCORE: Team_066 32, Team_075 30

BOX SCORE:
================================================================================

Team_066
--------------------------------------------------------------------------------
Player                MIN  PTS  REB  AST  TO      FG   FG%      3P   3P%
--------------------------------------------------------------------------------
Yao Brogdon            10   13    4    1   0   5/7    71.4     0/0   0.0
Jimmy Davis            10    8    0    1   0   3/4    75.0     0/0   0.0
Donovan Simmons         2    4    0    0   0   2/2   100.0     0/0   0.0
Brandon Middleton       2    3    0    0   0   1/1   100.0     0/0   0.0
Kyle Wagner            10    2    3    0   0   1/1   100.0     0/0   0.0
Pau Curry              10    2    0    1   0   1/2    50.0     0/0   0.0
Brandon Reaves         10    0    1    2   0   0/1     0.0     0/0   0.0
Pascal Carter           2    0    0    2   0   0/0     0.0     0/0   0.0
Lauri LaVine            2    0    0    0   0   0/1     0.0     0/0   0.0

TEAM: FG: 13/19 (68.4%), 3PT: 5/8 (62.5%), REB: 8 (3 off, 5 def), AST: 7, TO: 3
TEAM FOULS: 4


Team_075
--------------------------------------------------------------------------------
Player                MIN  PTS  REB  AST  TO      FG   FG%      3P   3P%
--------------------------------------------------------------------------------
Myles Barrett          10   11    0    0   0   4/5    80.0     0/0   0.0
Kawhi Ingram           10    9    1    0   0   3/3   100.0     0/0   0.0
Klay Jokic             10    3    3    3   0   1/4    25.0     0/0   0.0
Collin Duncan           2    3    1    0   0   1/1   100.0     0/0   0.0
LeBron Ginobili         2    2    0    0   0   1/1   100.0     0/0   0.0
D'Angelo Anunoby        2    2    0    0   0   1/1   100.0     0/0   0.0
Derrick Stewart        10    0    3    2   0   0/0     0.0     0/0   0.0
Larry McCollum         10    0    0    1   0   0/1     0.0     0/0   0.0
Kevin Towns             2    0    0    1   0   0/0     0.0     0/0   0.0

TEAM: FG: 11/16 (68.8%), 3PT: 3/6 (50.0%), REB: 8 (2 off, 6 def), AST: 7, TO: 5
TEAM FOULS: 4

================================================================================

================================================================================
                       2ND QUARTER - Team_066 vs Team_075                       
================================================================================

[12:00] Team_066 possession (Score: 32-30)
Pau Curry attempts a Layup. BLOCKED BY DERRICK STEWART! Ball deflects out of bounds off Pau Curry.

[11:47] Team_075 possession (Score: 32-30)
Myles Barrett drives and kicks out. Myles Barrett attempts a 3Pt. Contested by Brandon Reaves (5.1 feet, MAN). MYLES BARRETT MAKES IT! Assist: Kawhi Ingram
Score: 32-33

[11:36] Team_066 possession (Score: 32-33)
Pau Curry attempts a 3Pt. Wide open! Myles Barrett is 6.2 feet away. [ZONE] Pau Curry misses. FOUL! Loose ball foul on Klay Jokic during the rebound battle. [Team fouls: 1] No free throws, side out. (Klay Jokic: 1 personal fouls)

[11:24] Team_066 possession (Score: 32-33)
Pau Curry attempts a 3Pt. Contested by Larry McCollum (4.6 feet, ZONE). Pau Curry misses. Rebound secured by Derrick Stewart.

[11:08] Team_075 possession (Score: 32-33)
Myles Barrett attempts a 3Pt. Contested by Pau Curry (5.9 feet, ZONE). Myles Barrett misses. Rebound secured by Brandon Reaves.

[10:54] Team_066 possession (Score: 32-33)
Kyle Wagner drives to the basket... Kyle Wagner throws a bad pass out of bounds! TURNOVER! (dead ball)

[10:42] Team_075 possession (Score: 32-33)
Derrick Stewart drives and kicks out. FOUL! Shooting foul on Kyle Wagner. Klay Jokic to the line for 2 free throws. [Team fouls: 1] (Kyle Wagner: 1 personal fouls)   FT 1/2: GOOD   FT 2/2: MISS Klay Jokic makes 1/2 from the line. Rebound secured by Brandon Reaves.
Score: 32-34

[10:28] Team_066 possession (Score: 32-34)
Yao Brogdon attempts a Midrange. Contested by Derrick Stewart (5.1 feet, MAN). YAO BROGDON MAKES IT! Assist: Pau Curry
Score: 34-34

[10:15] Team_075 possession (Score: 34-34)
Larry McCollum throws a bad pass out of bounds! TURNOVER! (dead ball)

[10:15] Substitution (Team_066): Jimmy Davis OUT → Pascal Carter IN (stamina_rule2)

[10:15] Substitution (Team_066): Pau Curry OUT → Lauri LaVine IN (stamina_rule2)

[10:15] Substitution (Team_066): Yao Brogdon OUT → Cole Morant IN (stamina_rule2)

[10:15] Substitution (Team_075): Larry McCollum OUT → D'Angelo Anunoby IN (stamina_rule2)

[10:15] Substitution (Team_075): Kawhi Ingram OUT → LeBron Ginobili IN (stamina_rule2)

[10:15] Substitution (Team_075): Myles Barrett OUT → Donovan Paul IN (stamina_rule2)

[10:15] Substitution (Team_075): Derrick Stewart OUT → Collin Duncan IN (stamina_rule2)

[10:15] Substitution (Team_075): Klay Jokic OUT → Kevin Towns IN (stamina_rule2)

[10:01] Team_066 possession (Score: 34-34)
Cole Morant makes the Layup and draws the foul on D'Angelo Anunoby! And-1! Cole Morant to the line for 1. [Team fouls: 2] (D'Angelo Anunoby: 1 personal fouls)   FT 1/1: GOOD Cole Morant makes 1/1 from the line.
Score: 37-34

[09:49] Team_075 possession (Score: 37-34)
Collin Duncan attempts a 3Pt. Contested by Cole Morant (5.5 feet, MAN). COLLIN DUNCAN MAKES IT!
Score: 37-37

[09:40] Team_066 possession (Score: 37-37)
Pascal Carter attempts a Layup. Contested by D'Angelo Anunoby (5.4 feet, MAN). Pascal Carter misses. Rebound secured by Collin Duncan.

[09:28] Team_075 possession (Score: 37-37)
D'Angelo Anunoby attempts a Layup. Wide open! Pascal Carter is 6.7 feet away. [MAN] D'Angelo Anunoby misses. Rebound secured by Brandon Reaves.

[09:12] Team_066 possession (Score: 37-37)
Cole Morant attempts a Midrange. Contested by LeBron Ginobili (5.4 feet, ZONE). COLE MORANT MAKES IT! Assist: Lauri LaVine
Score: 39-37

[09:00] Team_075 possession (Score: 39-37)
Collin Duncan drives, Cole Morant stays with him. Collin Duncan attempts a Layup. Contested by Cole Morant (5.5 feet, ZONE). COLLIN DUNCAN MAKES IT! Assist: LeBron Ginobili
Score: 39-39

[08:49] Team_066 possession (Score: 39-39)
Cole Morant attempts a 3Pt. Wide open! Collin Duncan is 6.2 feet away. [MAN] Cole Morant misses. Rebound secured by Collin Duncan.

[08:34] Team_075 possession (Score: 39-39)
LeBron Ginobili attempts a 3Pt. Contested by Lauri LaVine (3.9 feet, ZONE). LeBron Ginobili misses. Rebound secured by Brandon Reaves.

[08:16] Team_066 possession (Score: 39-39)
Lauri LaVine loses the ball! Stripped by LeBron Ginobili! TURNOVER! (live ball)

[08:03] Team_075 possession (Score: 39-39)
Collin Duncan attempts a 3Pt. Contested by Cole Morant (5.5 feet, MAN). Collin Duncan misses. Rebound secured by Lauri LaVine.

[07:48] Team_066 possession (Score: 39-39)
Brandon Reaves attempts a 3Pt. Wide open! Donovan Paul is 6.3 feet away. [MAN] Brandon Reaves misses. Rebound secured by D'Angelo Anunoby.

[07:33] Team_075 possession (Score: 39-39)
Collin Duncan attempts a 3Pt. Contested by Lauri LaVine (4.0 feet, ZONE). Collin Duncan misses. Offensive rebound by Collin Duncan! Collin Duncan kicks it out.

[07:14] Team_075 possession (Score: 39-39)
LeBron Ginobili attempts a 3Pt. Contested by Cole Morant (5.5 feet, ZONE). LEBRON GINOBILI MAKES IT!
Score: 39-42

[07:00] Team_066 possession (Score: 39-42)
Brandon Reaves attempts a 3Pt. Contested by D'Angelo Anunoby (5.6 feet, ZONE). Brandon Reaves misses. Rebound secured by Collin Duncan.

[06:47] Team_075 possession (Score: 39-42)
D'Angelo Anunoby attempts a Layup. Wide open! Pascal Carter is 6.7 feet away. [MAN] D'ANGELO ANUNOBY MAKES IT!
Score: 39-44

[06:33] Team_066 possession (Score: 39-44)
FOUL! Reach-in foul on Kevin Towns during the drive. [Team fouls: 3] No free throws, side out. (Kevin Towns: 1 personal fouls)

[06:16] Team_066 possession (Score: 39-44)
Brandon Reaves attempts a 3Pt. Contested by D'Angelo Anunoby (5.6 feet, ZONE). BRANDON REAVES MAKES IT! Assist: Lauri LaVine
Score: 42-44

[06:02] Team_075 possession (Score: 42-44)
D'Angelo Anunoby attempts a 3Pt. Wide open! Pascal Carter is 6.7 feet away. [MAN] D'Angelo Anunoby misses. Rebound secured by Lauri LaVine.

[05:49] Team_066 possession (Score: 42-44)
Lauri LaVine attempts a Midrange. Contested by LeBron Ginobili (5.0 feet, MAN). LAURI LAVINE MAKES IT!
Score: 44-44

[05:36] Team_075 possession (Score: 44-44)
FOUL! Holding foul on Kyle Wagner. [Team fouls: 2] No free throws, side out. (Kyle Wagner: 2 personal fouls)

[05:18] Team_075 possession (Score: 44-44)
D'Angelo Anunoby attempts a 3Pt. Contested by Lauri LaVine (3.9 feet, ZONE). D'Angelo Anunoby misses. Rebound secured by Lauri LaVine.

[05:06] Team_066 possession (Score: 44-44)
Pascal Carter drives and kicks out. FOUL! Shooting foul on Kevin Towns. Kyle Wagner to the line for 3 free throws. [Team fouls: 4] (Kevin Towns: 2 personal fouls)   FT 1/3: GOOD   FT 2/3: GOOD   FT 3/3: GOOD Kyle Wagner makes 3/3 from the line.
Score: 47-44

[04:48] Team_075 possession (Score: 47-44)
Collin Duncan attempts a 3Pt. Contested by Lauri LaVine (4.0 feet, ZONE). Collin Duncan misses. Offensive rebound by Collin Duncan! Collin Duncan kicks it out.

[04:33] Team_075 possession (Score: 47-44)
Kevin Towns drives, Kyle Wagner stays with him. Kevin Towns attempts a Dunk. Contested by Kyle Wagner (5.3 feet, ZONE). Kevin Towns misses. Rebound secured by Cole Morant.

[04:17] Team_066 possession (Score: 47-44)
Pascal Carter attempts a Layup. Contested by Kevin Towns (5.7 feet, ZONE). PASCAL CARTER MAKES IT!
Score: 49-44

[04:06] Team_075 possession (Score: 49-44)
Donovan Paul attempts a Midrange. Wide open! Brandon Reaves is 6.5 feet away. [ZONE] DONOVAN PAUL MAKES IT! Assist: LeBron Ginobili
Score: 49-46

[03:54] Team_066 possession (Score: 49-46)
Pascal Carter attempts a 3Pt. Contested by LeBron Ginobili (5.0 feet, ZONE). PASCAL CARTER MAKES IT! Assist: Lauri LaVine
Score: 52-46

[03:42] Team_075 possession (Score: 52-46)
Donovan Paul drives and kicks out. Kevin Towns attempts a 3Pt. Contested by Kyle Wagner (5.1 feet, MAN). Kevin Towns misses. Offensive rebound by Collin Duncan! Collin Duncan kicks it out.

[03:27] Team_075 possession (Score: 52-46)
Kevin Towns drives, Kyle Wagner stays with him. Kevin Towns attempts a Layup. Contested by Kyle Wagner (5.5 feet, ZONE). Kevin Towns misses. Offensive rebound by Kevin Towns! Kevin Towns kicks it out.

[03:13] Team_075 possession (Score: 52-46)
LeBron Ginobili attempts a 3Pt. Wide open! Pascal Carter is 6.8 feet away. [ZONE] LEBRON GINOBILI MAKES IT! Assist: D'Angelo Anunoby
Score: 52-49

[02:55] Team_066 possession (Score: 52-49)
Brandon Reaves makes the Layup and draws the foul on D'Angelo Anunoby! And-1! Brandon Reaves to the line for 1. [BONUS: 5 team fouls] (D'Angelo Anunoby: 2 personal fouls)   FT 1/1: GOOD Brandon Reaves makes 1/1 from the line.
Score: 55-49

[02:39] Team_075 possession (Score: 55-49)
Donovan Paul attempts a 3Pt. Contested by Lauri LaVine (4.6 feet, ZONE). Donovan Paul misses. Rebound secured by Kyle Wagner.

[02:24] Team_066 possession (Score: 55-49)
Pascal Carter attempts a 3Pt. Contested by D'Angelo Anunoby (5.7 feet, ZONE). Pascal Carter misses. Rebound secured by Kevin Towns.

[02:11] Team_075 possession (Score: 55-49)
D'Angelo Anunoby attempts a Layup. Contested by Kyle Wagner (5.2 feet, ZONE). D'ANGELO ANUNOBY MAKES IT! Assist: LeBron Ginobili
Score: 55-51

[01:56] Team_066 possession (Score: 55-51)
Lauri LaVine attempts a Midrange. Contested by D'Angelo Anunoby (5.7 feet, ZONE). LAURI LAVINE MAKES IT!
Score: 57-51

[01:42] Team_075 possession (Score: 57-51)
Collin Duncan makes the Layup and draws the foul on Cole Morant! And-1! Collin Duncan to the line for 1. [Team fouls: 3] (Cole Morant: 1 personal fouls)   FT 1/1: GOOD Collin Duncan makes 1/1 from the line.
Score: 57-54

[01:30] Team_066 possession (Score: 57-54)
Kyle Wagner attempts a Layup. Contested by Kevin Towns (5.5 feet, ZONE). KYLE WAGNER MAKES IT! Assist: Brandon Reaves
Score: 59-54

[01:19] Team_075 possession (Score: 59-54)
Kevin Towns makes the Layup and draws the foul on Kyle Wagner! And-1! Kevin Towns to the line for 1. [Team fouls: 4] (Kyle Wagner: 3 personal fouls)   FT 1/1: GOOD Kevin Towns makes 1/1 from the line.
Score: 59-57

[01:07] Team_066 possession (Score: 59-57)
Kyle Wagner drives and kicks out. Kyle Wagner attempts a 3Pt. Contested by Kevin Towns (5.9 feet, MAN). Kyle Wagner misses. Rebound secured by D'Angelo Anunoby.

[00:51] Team_075 possession (Score: 59-57)
LeBron Ginobili drives to the basket... LeBron Ginobili throws a bad pass! Stolen by Kyle Wagner! TURNOVER! (live ball)

[00:36] Team_066 possession (Score: 59-57)
Kyle Wagner attempts a Layup. Contested by Kevin Towns (5.6 feet, ZONE). Kyle Wagner misses. Rebound secured by D'Angelo Anunoby.

[00:25] Team_075 possession (Score: 59-57)
D'Angelo Anunoby attempts a 3Pt. Wide open! Pascal Carter is 6.9 feet away. [MAN] D'Angelo Anunoby misses. Rebound secured by Lauri LaVine.

[00:09] Team_066 possession (Score: 59-57)
FOUL! Shooting foul on D'Angelo Anunoby. Lauri LaVine to the line for 2 free throws. [BONUS: 6 team fouls] (D'Angelo Anunoby: 3 personal fouls)   FT 1/2: MISS   FT 2/2: GOOD Lauri LaVine makes 1/2 from the line.
Score: 60-57

================================================================================
                              2ND QUARTER COMPLETE                              
================================================================================

2ND QUARTER SCORE: Team_066 28, Team_075 27

BOX SCORE:
================================================================================

Team_066
--------------------------------------------------------------------------------
Player                MIN  PTS  REB  AST  TO      FG   FG%      3P   3P%
--------------------------------------------------------------------------------
Brandon Reaves         22    6    4    1   0   2/4    50.0     0/0   0.0
Kyle Wagner            22    5    2    0   0   2/4    50.0     0/0   0.0
Cole Morant            12    5    1    0   0   2/3    66.7     0/0   0.0
Pascal Carter          12    5    0    0   0   2/4    50.0     0/0   0.0
Lauri LaVine           12    5    4    3   0   3/3   100.0     0/0   0.0
Yao Brogdon            12    2    0    0   0   1/1   100.0     0/0   0.0
Pau Curry              12    0    0    1   0   0/2     0.0     0/0   0.0

TEAM: FG: 12/21 (57.1%), 3PT: 2/7 (28.6%), REB: 11 (1 off, 10 def), AST: 5, TO: 2
TEAM FOULS: 4


Team_075
--------------------------------------------------------------------------------
Player                MIN  PTS  REB  AST  TO      FG   FG%      3P   3P%
--------------------------------------------------------------------------------
Collin Duncan          12    8    6    0   0   3/4    75.0     0/0   0.0
LeBron Ginobili        12    6    0    3   0   2/3    66.7     0/0   0.0
D'Angelo Anunoby       12    4    3    1   0   2/6    33.3     0/0   0.0
Myles Barrett          12    3    0    0   0   1/2    50.0     0/0   0.0
Kevin Towns            12    3    2    0   0   1/2    50.0     0/0   0.0
Donovan Paul           12    2    0    0   0   1/2    50.0     0/0   0.0
Kawhi Ingram           12    0    0    1   0   0/0     0.0     0/0   0.0
Derrick Stewart        12    0    1    0   0   0/1     0.0     0/0   0.0

TEAM: FG: 10/20 (50.0%), 3PT: 3/10 (30.0%), REB: 12 (4 off, 8 def), AST: 5, TO: 2
TEAM FOULS: 6 [Team_066 in BONUS]

================================================================================

================================================================================
                       3RD QUARTER - Team_066 vs Team_075                       
================================================================================

[12:00] Team_066 possession (Score: 60-57)
Jimmy Davis attempts a 3Pt. Contested by Larry McCollum (4.7 feet, MAN). Jimmy Davis misses. Rebound secured by Kawhi Ingram.

[11:46] Team_075 possession (Score: 60-57)
Kawhi Ingram attempts a 3Pt. Contested by Pau Curry (5.3 feet, ZONE). Kawhi Ingram misses. Rebound secured by Brandon Reaves.

[11:36] Team_066 possession (Score: 60-57)
FOUL! Shooting foul on Kawhi Ingram. Pau Curry to the line for 2 free throws. [Team fouls: 1] (Kawhi Ingram: 1 personal fouls)   FT 1/2: GOOD   FT 2/2: GOOD Pau Curry makes 2/2 from the line.
Score: 62-57

[11:21] Team_075 possession (Score: 62-57)
Larry McCollum attempts a Layup. Contested by Kyle Wagner (4.0 feet, ZONE). LARRY MCCOLLUM MAKES IT! Assist: Derrick Stewart
Score: 62-59

[11:08] Team_066 possession (Score: 62-59)
Kyle Wagner drives, Klay Jokic stays with him. Kyle Wagner attempts a Dunk. Contested by Klay Jokic (5.2 feet, MAN). KYLE WAGNER MAKES IT! Assist: Brandon Reaves
Score: 64-59

[10:49] Team_075 possession (Score: 64-59)
Larry McCollum drives and kicks out. Klay Jokic attempts a 3Pt. Contested by Pau Curry (5.5 feet, ZONE). Klay Jokic misses. Rebound secured by Brandon Reaves.

[10:35] Team_066 possession (Score: 64-59)
Brandon Reaves drives, Derrick Stewart stays with him. Brandon Reaves attempts a Dunk. Contested by Derrick Stewart (5.0 feet, ZONE). BRANDON REAVES MAKES IT!
Score: 66-59

[10:21] Team_075 possession (Score: 66-59)
Larry McCollum drives, picks up Kyle Wagner. Help arrives from Jimmy Davis! Larry McCollum attempts a Layup. Contested by Jimmy Davis (4.0 feet, ZONE). Larry McCollum misses. Rebound secured by Brandon Reaves.

[10:06] Team_066 possession (Score: 66-59)
Kyle Wagner drives, Klay Jokic stays with him. Kyle Wagner attempts a Layup. Contested by Klay Jokic (5.2 feet, MAN). KYLE WAGNER MAKES IT!
Score: 68-59

[09:51] Team_075 possession (Score: 68-59)
Myles Barrett attempts a 3Pt. Contested by Pau Curry (5.7 feet, ZONE). MYLES BARRETT MAKES IT! Assist: Klay Jokic
Score: 68-62

[09:35] Team_066 possession (Score: 68-62)
Brandon Reaves attempts a 3Pt. Wide open! Myles Barrett is 6.4 feet away. [MAN] BRANDON REAVES MAKES IT!
Score: 71-62

[09:23] Team_075 possession (Score: 71-62)
Kawhi Ingram drives and kicks out. Derrick Stewart attempts a Midrange. Contested by Yao Brogdon (5.1 feet, MAN). Derrick Stewart misses. Offensive rebound by Kawhi Ingram! Kawhi Ingram kicks it out.

[09:08] Team_075 possession (Score: 71-62)
Larry McCollum attempts a 3Pt. Contested by Jimmy Davis (4.1 feet, MAN). Larry McCollum misses. Rebound secured by Kyle Wagner.

[08:52] Team_066 possession (Score: 71-62)
Pau Curry makes the Layup and draws the foul on Kawhi Ingram! And-1! Pau Curry to the line for 1. [Team fouls: 2] (Kawhi Ingram: 2 personal fouls)   FT 1/1: GOOD Pau Curry makes 1/1 from the line.
Score: 74-62

[08:33] Team_075 possession (Score: 74-62)
Larry McCollum attempts a Layup. Contested by Kyle Wagner (4.0 feet, ZONE). LARRY MCCOLLUM MAKES IT! Assist: Kawhi Ingram
Score: 74-64

[08:18] Team_066 possession (Score: 74-64)
Jimmy Davis attempts a 3Pt. Contested by Larry McCollum (4.7 feet, ZONE). Jimmy Davis misses. Offensive rebound by Yao Brogdon! Yao Brogdon kicks it out.

[08:05] Team_066 possession (Score: 74-64)
FOUL! Holding foul on Kawhi Ingram. [Team fouls: 3] No free throws, side out. (Kawhi Ingram: 3 personal fouls)

[07:51] Team_066 possession (Score: 74-64)
Brandon Reaves throws a bad pass out of bounds! TURNOVER! (dead ball)

[07:38] Team_075 possession (Score: 74-64)
Myles Barrett attempts a 3Pt. Contested by Pau Curry (5.7 feet, ZONE). Myles Barrett misses. Rebound secured by Brandon Reaves.

[07:28] Team_066 possession (Score: 74-64)
Jimmy Davis attempts a Midrange. Wide open! Myles Barrett is 6.3 feet away. [ZONE] Jimmy Davis misses. Offensive rebound by Yao Brogdon! Yao Brogdon kicks it out.

[07:12] Team_066 possession (Score: 74-64)
FOUL! Reach-in foul on Derrick Stewart during the drive. [Team fouls: 4] No free throws, side out. (Derrick Stewart: 1 personal fouls)

[06:57] Team_066 possession (Score: 74-64)
FOUL! Shooting foul on Derrick Stewart. Brandon Reaves to the line for 2 free throws. [BONUS: 5 team fouls] (Derrick Stewart: 2 personal fouls)   FT 1/2: GOOD   FT 2/2: GOOD Brandon Reaves makes 2/2 from the line.
Score: 76-64

[06:47] Team_075 possession (Score: 76-64)
Derrick Stewart attempts a Layup. Contested by Kyle Wagner (3.8 feet, ZONE). DERRICK STEWART MAKES IT!
Score: 76-66

[06:32] Team_066 possession (Score: 76-66)
FOUL! Offensive foul on Kyle Wagner! Klay Jokic drew the charge! [Team fouls: 1] (Kyle Wagner: 1 personal fouls) TURNOVER! (dead ball)

[06:22] Team_075 possession (Score: 76-66)
FOUL! Reach-in foul on Kyle Wagner during the drive. [Team fouls: 2] No free throws, side out. (Kyle Wagner: 2 personal fouls)

[06:09] Team_075 possession (Score: 76-66)
Myles Barrett attempts a Layup. BLOCKED BY KYLE WAGNER! Ball deflects out of bounds off Myles Barrett.

[05:58] Team_066 possession (Score: 76-66)
Yao Brogdon attempts a 3Pt. Contested by Derrick Stewart (4.9 feet, MAN). Yao Brogdon misses. Rebound secured by Kawhi Ingram.

[05:49] Team_075 possession (Score: 76-66)
Larry McCollum drives, Jimmy Davis stays with him. Larry McCollum attempts a Layup. Contested by Jimmy Davis (4.1 feet, MAN). LARRY MCCOLLUM MAKES IT! Assist: Klay Jokic
Score: 76-68

[05:35] Team_066 possession (Score: 76-68)
Brandon Reaves drives and kicks out. Pau Curry attempts a 3Pt. Contested by Kawhi Ingram (4.0 feet, MAN). PAU CURRY MAKES IT! Assist: Jimmy Davis
Score: 79-68

[05:18] Team_075 possession (Score: 79-68)
Derrick Stewart drives and kicks out. Kawhi Ingram attempts a 3Pt. Contested by Pau Curry (5.5 feet, MAN). Kawhi Ingram misses. Rebound secured by Kyle Wagner.

[05:02] Team_066 possession (Score: 79-68)
Pau Curry attempts a Layup. BLOCKED BY DERRICK STEWART! Ball is loose! Rebound secured by Derrick Stewart.

[04:47] Team_075 possession (Score: 79-68)
Derrick Stewart drives and kicks out. Klay Jokic attempts a 3Pt. Contested by Kyle Wagner (3.9 feet, MAN). Klay Jokic misses. Rebound secured by Brandon Reaves.

[04:29] Team_066 possession (Score: 79-68)
Brandon Reaves attempts a 3Pt. Wide open! Myles Barrett is 6.4 feet away. [MAN] Brandon Reaves misses. Rebound secured by Kawhi Ingram.

[04:10] Team_075 possession (Score: 79-68)
Larry McCollum makes the Layup and draws the foul on Jimmy Davis! And-1! Larry McCollum to the line for 1. [Team fouls: 3] (Jimmy Davis: 1 personal fouls)   FT 1/1: GOOD Larry McCollum makes 1/1 from the line.
Score: 79-71

[03:52] Team_066 possession (Score: 79-71)
Yao Brogdon attempts a Layup. Contested by Derrick Stewart (5.1 feet, ZONE). YAO BROGDON MAKES IT! Assist: Pau Curry
Score: 81-71

[03:39] Team_075 possession (Score: 81-71)
Myles Barrett drives and kicks out. Kawhi Ingram attempts a Midrange. Contested by Pau Curry (5.6 feet, MAN). Kawhi Ingram misses. Rebound secured by Brandon Reaves.

[03:21] Team_066 possession (Score: 81-71)
Jimmy Davis drives, picks up Larry McCollum. Help arrives from Myles Barrett! Jimmy Davis attempts a Dunk. Contested by Myles Barrett (4.8 feet, MAN). JIMMY DAVIS MAKES IT!
Score: 83-71

[03:09] Team_075 possession (Score: 83-71)
Kawhi Ingram attempts a 3Pt. Contested by Pau Curry (5.5 feet, MAN). Kawhi Ingram misses. Rebound secured by Brandon Reaves.

[02:57] Team_066 possession (Score: 83-71)
FOUL! Shooting foul on Derrick Stewart. Kyle Wagner to the line for 2 free throws. [BONUS: 6 team fouls] (Derrick Stewart: 3 personal fouls)   FT 1/2: MISS   FT 2/2: GOOD Kyle Wagner makes 1/2 from the line.
Score: 84-71

[02:37] Team_075 possession (Score: 84-71)
Myles Barrett attempts a 3Pt. Contested by Yao Brogdon (5.6 feet, ZONE). Myles Barrett misses. Rebound secured by Kyle Wagner.

[02:24] Team_066 possession (Score: 84-71)
Kyle Wagner attempts a 3Pt. Contested by Larry McCollum (4.4 feet, ZONE). Kyle Wagner misses. Rebound secured by Derrick Stewart.

[02:10] Team_075 possession (Score: 84-71)
FOUL! Shooting foul on Jimmy Davis. Myles Barrett to the line for 2 free throws. [Team fouls: 4] (Jimmy Davis: 2 personal fouls)   FT 1/2: GOOD   FT 2/2: GOOD Myles Barrett makes 2/2 from the line.
Score: 84-73

[01:56] Team_066 possession (Score: 84-73)
Yao Brogdon drives and kicks out. Jimmy Davis attempts a 3Pt. Contested by Larry McCollum (4.6 feet, ZONE). Jimmy Davis misses. Rebound secured by Klay Jokic.

[01:39] Team_075 possession (Score: 84-73)
Larry McCollum loses control! Ball rolls out of bounds! TURNOVER! (dead ball)

[01:39] Substitution (Team_066): Jimmy Davis OUT → Pascal Carter IN (stamina_rule2)

[01:39] Substitution (Team_066): Pau Curry OUT → Lauri LaVine IN (stamina_rule2)

[01:39] Substitution (Team_066): Brandon Reaves OUT → Brandon Middleton IN (stamina_rule2)

[01:39] Substitution (Team_066): Yao Brogdon OUT → Cole Morant IN (stamina_rule2)

[01:39] Substitution (Team_066): Kyle Wagner OUT → Donovan Simmons IN (stamina_rule2)

[01:39] Substitution (Team_075): Larry McCollum OUT → D'Angelo Anunoby IN (stamina_rule2)

[01:39] Substitution (Team_075): Kawhi Ingram OUT → LeBron Ginobili IN (stamina_rule2)

[01:39] Substitution (Team_075): Myles Barrett OUT → Donovan Paul IN (stamina_rule2)

[01:39] Substitution (Team_075): Derrick Stewart OUT → Collin Duncan IN (stamina_rule2)

[01:39] Substitution (Team_075): Klay Jokic OUT → Kevin Towns IN (stamina_rule2)

[01:26] Team_066 possession (Score: 84-73)
Brandon Middleton drives, Kevin Towns stays with him. Brandon Middleton attempts a Dunk. Contested by Kevin Towns (5.2 feet, ZONE). Brandon Middleton misses. Rebound secured by Kevin Towns.

[01:09] Team_075 possession (Score: 84-73)
LeBron Ginobili attempts a 3Pt. Contested by Lauri LaVine (3.9 feet, ZONE). LeBron Ginobili misses. Rebound secured by Donovan Simmons.

[00:51] Team_066 possession (Score: 84-73)
Lauri LaVine attempts a Layup. Contested by Kevin Towns (5.6 feet, ZONE). LAURI LAVINE MAKES IT! Assist: Brandon Middleton
Score: 86-73

[00:39] Team_075 possession (Score: 86-73)
Donovan Paul drives to the basket... Donovan Paul loses the ball! Stripped by Donovan Simmons! TURNOVER! (live ball)

[00:21] Team_066 possession (Score: 86-73)
Lauri LaVine throws a bad pass! Stolen by LeBron Ginobili! TURNOVER! (live ball)

[00:06] Team_075 possession (Score: 86-73)
LeBron Ginobili attempts a Midrange. Contested by Cole Morant (5.5 feet, ZONE). LeBron Ginobili misses. Offensive rebound by Kevin Towns! Kevin Towns kicks it out.

================================================================================
                              3RD QUARTER COMPLETE                              
================================================================================

3RD QUARTER SCORE: Team_066 26, Team_075 16

BOX SCORE:
================================================================================

Team_066
--------------------------------------------------------------------------------
Player                MIN  PTS  REB  AST  TO      FG   FG%      3P   3P%
--------------------------------------------------------------------------------
Pau Curry              23    8    0    1   0   3/4    75.0     0/0   0.0
Brandon Reaves         33    7    7    1   0   3/4    75.0     0/0   0.0
Kyle Wagner            33    5    3    0   0   3/4    75.0     0/0   0.0
Jimmy Davis            23    2    0    1   0   1/2    50.0     0/0   0.0
Yao Brogdon            23    2    2    0   0   1/3    33.3     0/0   0.0
Lauri LaVine           14    2    0    0   0   1/1   100.0     0/0   0.0
Brandon Middleton       3    0    0    1   0   0/1     0.0     0/0   0.0
Donovan Simmons         3    0    1    0   0   0/0     0.0     0/0   0.0

TEAM: FG: 12/19 (63.2%), 3PT: 1/5 (20.0%), REB: 13 (2 off, 11 def), AST: 4, TO: 3
TEAM FOULS: 4


Team_075
--------------------------------------------------------------------------------
Player                MIN  PTS  REB  AST  TO      FG   FG%      3P   3P%
--------------------------------------------------------------------------------
Larry McCollum         23    9    0    0   0   4/7    57.1     0/0   0.0
Myles Barrett          23    5    0    0   0   2/6    33.3     0/0   0.0
Derrick Stewart        23    2    2    1   0   1/3    33.3     0/0   0.0
Kawhi Ingram           23    0    4    1   0   0/2     0.0     0/0   0.0
Klay Jokic             23    0    1    2   0   0/0     0.0     0/0   0.0
Kevin Towns            14    0    2    0   0   0/0     0.0     0/0   0.0
LeBron Ginobili        14    0    0    0   0   0/1     0.0     0/0   0.0

TEAM: FG: 7/19 (36.8%), 3PT: 1/7 (14.3%), REB: 9 (2 off, 7 def), AST: 4, TO: 2
TEAM FOULS: 6 [Team_066 in BONUS]

================================================================================

================================================================================
                       4TH QUARTER - Team_066 vs Team_075                       
================================================================================

[12:00] Team_066 possession (Score: 86-73)
Yao Brogdon attempts a 3Pt. Contested by Derrick Stewart (5.0 feet, MAN). Yao Brogdon misses. FOUL! Loose ball foul on Kawhi Ingram during the rebound battle. [Team fouls: 1] No free throws, side out. (Kawhi Ingram: 1 personal fouls)

[11:46] Team_066 possession (Score: 86-73)
Pau Curry drives to the basket... Pau Curry loses control! Ball rolls out of bounds! TURNOVER! (dead ball)

[11:31] Team_075 possession (Score: 86-73)
Larry McCollum attempts a 3Pt. Contested by Pau Curry (5.7 feet, ZONE). Larry McCollum misses. Rebound secured by Yao Brogdon.

[11:12] Team_066 possession (Score: 86-73)
Kyle Wagner drives to the basket... FOUL! Offensive foul on Kyle Wagner! Derrick Stewart drew the charge! [Team fouls: 1] (Kyle Wagner: 1 personal fouls) TURNOVER! (dead ball)

[11:02] Team_075 possession (Score: 86-73)
Myles Barrett throws a bad pass out of bounds! TURNOVER! (dead ball)

[10:48] Team_066 possession (Score: 86-73)
FOUL! Shooting foul on Derrick Stewart. Yao Brogdon to the line for 2 free throws. [Team fouls: 2] (Derrick Stewart: 1 personal fouls)   FT 1/2: GOOD   FT 2/2: GOOD Yao Brogdon makes 2/2 from the line.
Score: 88-73

[10:29] Team_075 possession (Score: 88-73)
Derrick Stewart drives, picks up Yao Brogdon. Help arrives from Jimmy Davis! Derrick Stewart attempts a Dunk. Contested by Jimmy Davis (5.3 feet, MAN). DERRICK STEWART MAKES IT! Assist: Myles Barrett
Score: 88-75

[10:17] Team_066 possession (Score: 88-75)
Yao Brogdon attempts a 3Pt. Contested by Larry McCollum (4.9 feet, ZONE). YAO BROGDON MAKES IT! Assist: Brandon Reaves
Score: 91-75

[10:01] Team_075 possession (Score: 91-75)
Kawhi Ingram attempts a 3Pt. Contested by Pau Curry (5.6 feet, MAN). Kawhi Ingram misses. Rebound secured by Yao Brogdon.

[09:45] Team_066 possession (Score: 91-75)
Brandon Reaves attempts a Midrange. Wide open! Myles Barrett is 6.6 feet away. [MAN] BRANDON REAVES MAKES IT! Assist: Pau Curry
Score: 93-75

[09:34] Team_075 possession (Score: 93-75)
Kawhi Ingram attempts a Layup. Contested by Kyle Wagner (4.0 feet, ZONE). KAWHI INGRAM MAKES IT! Assist: Derrick Stewart
Score: 93-77

[09:19] Team_066 possession (Score: 93-77)
Yao Brogdon attempts a 3Pt. Contested by Larry McCollum (5.0 feet, ZONE). Yao Brogdon misses. Rebound secured by Klay Jokic.

[09:09] Team_075 possession (Score: 93-77)
Larry McCollum attempts a Midrange. Contested by Jimmy Davis (4.5 feet, ZONE). Larry McCollum misses. Rebound secured by Yao Brogdon.

[08:58] Team_066 possession (Score: 93-77)
Kyle Wagner attempts a Midrange. Contested by Derrick Stewart (4.8 feet, ZONE). KYLE WAGNER MAKES IT! Assist: Jimmy Davis
Score: 95-77

[08:49] Team_075 possession (Score: 95-77)
Klay Jokic drives to the basket... Klay Jokic throws a bad pass out of bounds! TURNOVER! (dead ball)

[08:49] Substitution (Team_066): Jimmy Davis OUT → Pascal Carter IN (stamina_rule2)

[08:49] Substitution (Team_066): Pau Curry OUT → Lauri LaVine IN (stamina_rule2)

[08:49] Substitution (Team_066): Brandon Reaves OUT → Brandon Middleton IN (stamina_rule2)

[08:49] Substitution (Team_066): Yao Brogdon OUT → Cole Morant IN (stamina_rule2)

[08:49] Substitution (Team_066): Kyle Wagner OUT → Donovan Simmons IN (stamina_rule2)

[08:49] Substitution (Team_075): Larry McCollum OUT → D'Angelo Anunoby IN (stamina_rule2)

[08:49] Substitution (Team_075): Kawhi Ingram OUT → LeBron Ginobili IN (stamina_rule2)

[08:49] Substitution (Team_075): Myles Barrett OUT → Donovan Paul IN (stamina_rule2)

[08:49] Substitution (Team_075): Derrick Stewart OUT → Collin Duncan IN (stamina_rule2)

[08:49] Substitution (Team_075): Klay Jokic OUT → Kevin Towns IN (stamina_rule2)

[08:29] Team_066 possession (Score: 95-77)
Donovan Simmons drives, Kevin Towns stays with him. Donovan Simmons attempts a Layup. Contested by Kevin Towns (5.5 feet, ZONE). DONOVAN SIMMONS MAKES IT! Assist: Lauri LaVine
Score: 97-77

[08:11] Team_075 possession (Score: 97-77)
FOUL! Holding foul on Pascal Carter. [Team fouls: 2] No free throws, side out. (Pascal Carter: 1 personal fouls)

[08:00] Team_075 possession (Score: 97-77)
LeBron Ginobili attempts a 3Pt. Contested by Lauri LaVine (3.9 feet, ZONE). LEBRON GINOBILI MAKES IT! Assist: Collin Duncan
Score: 97-80

[07:45] Team_066 possession (Score: 97-80)
Donovan Simmons drives, Kevin Towns stays with him. Donovan Simmons attempts a Layup. Contested by Kevin Towns (5.5 feet, ZONE). Donovan Simmons misses. Rebound secured by D'Angelo Anunoby.

[07:32] Team_075 possession (Score: 97-80)
Donovan Paul attempts a 3Pt. Contested by Brandon Middleton (5.6 feet, MAN). Donovan Paul misses. Rebound secured by Lauri LaVine.

[07:21] Team_066 possession (Score: 97-80)
FOUL! Reach-in foul on Kevin Towns during the drive. [Team fouls: 3] No free throws, side out. (Kevin Towns: 1 personal fouls)

[07:05] Team_066 possession (Score: 97-80)
Lauri LaVine drives, LeBron Ginobili stays with him. Lauri LaVine attempts a Dunk. Contested by LeBron Ginobili (5.0 feet, MAN). LAURI LAVINE MAKES IT! Assist: Brandon Middleton
Score: 99-80

[06:50] Team_075 possession (Score: 99-80)
D'Angelo Anunoby attempts a Layup. Contested by Donovan Simmons (4.9 feet, ZONE). D'ANGELO ANUNOBY MAKES IT! Assist: Collin Duncan
Score: 99-82

[06:36] Team_066 possession (Score: 99-82)
Donovan Simmons drives to the basket... Donovan Simmons throws a bad pass! Stolen by Kevin Towns! TURNOVER! (live ball)

[06:23] Team_075 possession (Score: 99-82)
Donovan Paul attempts a 3Pt. Contested by Lauri LaVine (4.4 feet, ZONE). Donovan Paul misses. Rebound secured by Donovan Simmons.

[06:07] Team_066 possession (Score: 99-82)
Cole Morant drives and kicks out. Brandon Middleton attempts a Midrange. Contested by LeBron Ginobili (4.8 feet, ZONE). Brandon Middleton misses. Rebound secured by D'Angelo Anunoby.

[05:52] Team_075 possession (Score: 99-82)
D'Angelo Anunoby attempts a 3Pt. Wide open! Pascal Carter is 6.7 feet away. [MAN] D'Angelo Anunoby misses. Offensive rebound by Collin Duncan! Collin Duncan kicks it out.

[05:40] Team_075 possession (Score: 99-82)
Kevin Towns attempts a Layup. Contested by Donovan Simmons (5.3 feet, ZONE). KEVIN TOWNS MAKES IT! Assist: D'Angelo Anunoby
Score: 99-84

[05:26] Team_066 possession (Score: 99-84)
Cole Morant attempts a Midrange. Wide open! Collin Duncan is 6.2 feet away. [MAN] Cole Morant misses. Rebound secured by Kevin Towns.

[05:14] Team_075 possession (Score: 99-84)
Collin Duncan attempts a Midrange. BLOCKED BY DONOVAN SIMMONS! Ball is loose! Offensive rebound by Kevin Towns! Kevin Towns kicks it out.

[05:02] Team_075 possession (Score: 99-84)
FOUL! Holding foul on Lauri LaVine. [Team fouls: 3] No free throws, side out. (Lauri LaVine: 1 personal fouls)

[04:45] Team_075 possession (Score: 99-84)
D'Angelo Anunoby attempts a 3Pt. Contested by Brandon Middleton (5.1 feet, ZONE). D'Angelo Anunoby misses. FOUL! Loose ball foul on Brandon Middleton during the rebound battle. [Team fouls: 4] No free throws, side out. (Brandon Middleton: 1 personal fouls)

[04:31] Team_075 possession (Score: 99-84)
Collin Duncan attempts a Midrange. Contested by Lauri LaVine (4.0 feet, ZONE). COLLIN DUNCAN MAKES IT!
Score: 99-86

[04:15] Team_066 possession (Score: 99-86)
Brandon Middleton attempts a Layup. Contested by Donovan Paul (5.6 feet, MAN). BRANDON MIDDLETON MAKES IT! Assist: Lauri LaVine
Score: 101-86

[04:03] Team_075 possession (Score: 101-86)
Donovan Paul attempts a 3Pt. Contested by Lauri LaVine (4.4 feet, ZONE). Donovan Paul misses. Rebound secured by Lauri LaVine.

[03:51] Team_066 possession (Score: 101-86)
Brandon Middleton drives, Donovan Paul stays with him. Brandon Middleton attempts a Dunk. Contested by Donovan Paul (5.6 feet, MAN). Brandon Middleton misses. Rebound secured by D'Angelo Anunoby.

[03:35] Team_075 possession (Score: 101-86)
Kevin Towns drives, Donovan Simmons stays with him. Kevin Towns attempts a Dunk. Contested by Donovan Simmons (5.3 feet, MAN). Kevin Towns misses. Rebound secured by Donovan Simmons.

[03:19] Team_066 possession (Score: 101-86)
Cole Morant attempts a 3Pt. Wide open! Collin Duncan is 6.2 feet away. [MAN] Cole Morant misses. Rebound secured by D'Angelo Anunoby.

[03:08] Team_075 possession (Score: 101-86)
Collin Duncan attempts a Layup. Contested by Donovan Simmons (5.0 feet, ZONE). COLLIN DUNCAN MAKES IT!
Score: 101-88

[02:51] Team_066 possession (Score: 101-88)
Cole Morant attempts a Midrange. Wide open! Collin Duncan is 6.2 feet away. [MAN] COLE MORANT MAKES IT! Assist: Donovan Simmons
Score: 103-88

[02:41] Team_075 possession (Score: 103-88)
D'Angelo Anunoby drives to the basket... D'Angelo Anunoby loses the ball! Stripped by Pascal Carter! TURNOVER! (live ball)

[02:26] Team_066 possession (Score: 103-88)
Brandon Middleton attempts a 3Pt. Contested by Donovan Paul (5.7 feet, MAN). BRANDON MIDDLETON MAKES IT!
Score: 106-88

[02:12] Team_075 possession (Score: 106-88)
LeBron Ginobili attempts a 3Pt. Contested by Lauri LaVine (4.0 feet, ZONE). LEBRON GINOBILI MAKES IT! Assist: Collin Duncan
Score: 106-91

[01:58] Team_066 possession (Score: 106-91)
Pascal Carter drives and kicks out. Donovan Simmons attempts a 3Pt. Contested by Kevin Towns (5.6 feet, MAN). Donovan Simmons misses. FOUL! Loose ball foul on D'Angelo Anunoby during the rebound battle. [Team fouls: 4] No free throws, side out. (D'Angelo Anunoby: 1 personal fouls)

[01:45] Team_066 possession (Score: 106-91)
Cole Morant drives, Kevin Towns stays with him. Cole Morant attempts a Layup. Wide open! Kevin Towns is 6.1 feet away. [ZONE] COLE MORANT MAKES IT!
Score: 108-91

[01:32] Team_075 possession (Score: 108-91)
FOUL! Reach-in foul on Pascal Carter during the drive. [IN THE BONUS! 5 team fouls] D'Angelo Anunoby to the line for 2 free throws. (Pascal Carter: 2 personal fouls)   FT 1/2: GOOD   FT 2/2: GOOD D'Angelo Anunoby makes 2/2 from the line.
Score: 108-93

[01:19] Team_066 possession (Score: 108-93)
FOUL! Shooting foul on LeBron Ginobili. Donovan Simmons to the line for 2 free throws. [BONUS: 5 team fouls] (LeBron Ginobili: 1 personal fouls)   FT 1/2: GOOD   FT 2/2: GOOD Donovan Simmons makes 2/2 from the line.
Score: 110-93

[01:08] Team_075 possession (Score: 110-93)
D'Angelo Anunoby attempts a Layup. Contested by Donovan Simmons (5.0 feet, ZONE). D'Angelo Anunoby misses. Rebound secured by Donovan Simmons.

[00:50] Team_066 possession (Score: 110-93)
Lauri LaVine makes the Layup and draws the foul on LeBron Ginobili! And-1! Lauri LaVine to the line for 1. [BONUS: 6 team fouls] (LeBron Ginobili: 2 personal fouls)   FT 1/1: GOOD Lauri LaVine makes 1/1 from the line.
Score: 113-93

[00:39] Team_075 possession (Score: 113-93)
LeBron Ginobili attempts a 3Pt. Contested by Lauri LaVine (4.2 feet, MAN). LeBron Ginobili misses. Rebound secured by Lauri LaVine.

[00:24] Team_066 possession (Score: 113-93)
Donovan Simmons attempts a Midrange. Contested by Kevin Towns (5.8 feet, MAN). Donovan Simmons misses. Rebound secured by Collin Duncan.

[00:08] Team_075 possession (Score: 113-93)
Collin Duncan attempts a Layup. BLOCKED BY COLE MORANT! Ball is loose! Offensive rebound by Collin Duncan! Collin Duncan kicks it out.

================================================================================
                              4TH QUARTER COMPLETE                              
================================================================================

4TH QUARTER SCORE: Team_066 27, Team_075 20

BOX SCORE:
================================================================================

Team_066
--------------------------------------------------------------------------------
Player                MIN  PTS  REB  AST  TO      FG   FG%      3P   3P%
--------------------------------------------------------------------------------
Yao Brogdon            26    5    3    0   0   2/3    66.7     0/0   0.0
Lauri LaVine           22    5    3    2   0   2/2   100.0     0/0   0.0
Brandon Middleton      12    5    0    1   0   2/3    66.7     0/0   0.0
Donovan Simmons        12    4    4    1   0   2/4    50.0     0/0   0.0
Cole Morant            22    4    0    0   0   2/5    40.0     0/0   0.0
Kyle Wagner            37    2    1    0   0   1/1   100.0     0/0   0.0
Brandon Reaves         37    2    0    1   0   1/1   100.0     0/0   0.0
Pau Curry              26    0    0    1   0   0/0     0.0     0/0   0.0
Jimmy Davis            26    0    0    1   0   0/0     0.0     0/0   0.0

TEAM: FG: 12/19 (63.2%), 3PT: 2/4 (50.0%), REB: 11 (2 off, 9 def), AST: 7, TO: 3
TEAM FOULS: 5 [Team_075 in BONUS]


Team_075
--------------------------------------------------------------------------------
Player                MIN  PTS  REB  AST  TO      FG   FG%      3P   3P%
--------------------------------------------------------------------------------
LeBron Ginobili        22    6    0    0   0   2/3    66.7     0/0   0.0
Collin Duncan          22    4    3    3   0   2/2   100.0     0/0   0.0
D'Angelo Anunoby       22    4    4    1   0   2/3    66.7     0/0   0.0
Derrick Stewart        26    2    0    1   0   1/1   100.0     0/0   0.0
Kawhi Ingram           26    2    0    0   0   1/2    50.0     0/0   0.0
Kevin Towns            22    2    3    0   0   1/2    50.0     0/0   0.0
Larry McCollum         26    0    0    0   0   0/2     0.0     0/0   0.0
Myles Barrett          26    0    0    1   0   0/0     0.0     0/0   0.0
Klay Jokic             26    0    1    0   0   0/0     0.0     0/0   0.0
Donovan Paul           22    0    0    0   0   0/3     0.0     0/0   0.0

TEAM: FG: 9/18 (50.0%), 3PT: 2/8 (25.0%), REB: 11 (4 off, 7 def), AST: 6, TO: 3
TEAM FOULS: 6 [Team_066 in BONUS]

================================================================================

================================================================================
                               FULL GAME COMPLETE                               
================================================================================

FINAL SCORE: Team_066 113, Team_075 93

SCORING BY QUARTER:
--------------------------------------------------------------------------------
Team                     Q1     Q2     Q3     Q4    FINAL
--------------------------------------------------------------------------------
Team_066                 32     28     26     27      113
Team_075                 30     27     16     20       93
--------------------------------------------------------------------------------

FULL GAME BOX SCORE:
================================================================================

Team_066
--------------------------------------------------------------------------------
Player                MIN  PTS  REB  AST  TO      FG   FG%      3P   3P%      FT STL BLK
--------------------------------------------------------------------------------
Brandon Reaves         37   15   12    5   1   7/11   63.6   2/6    33.3   3/3     0   0
Kyle Wagner            37   14    9    0   2   6/9    66.7   0/1     0.0   4/5     2   1
Jimmy Davis            26   10    0    3   2   4/6    66.7   2/4    50.0   0/0     0   0
Pau Curry              26   10    0    4   1   3/7    42.9   0/2     0.0   3/3     1   0
Yao Brogdon            26   22    9    1   2   9/14   64.3   3/5    60.0   5/5     0   0
Pascal Carter          22    5    0    2   0   3/5    60.0   1/2    50.0   0/0     1   0
Lauri LaVine           22   12    7    5   2   6/7    85.7   0/0     0.0   2/3     0   0
Cole Morant            22    9    1    0   0   4/8    50.0   0/2     0.0   1/1     0   1
Brandon Middleton      12    8    0    2   1   3/5    60.0   2/2   100.0   0/0     0   0
Donovan Simmons        12    8    5    1   0   4/6    66.7   0/0     0.0   2/2     1   1

TEAM: FG: 49/78 (62.8%), 3PT: 10/24 (41.7%), REB: 43 (8 off, 35 def), AST: 23, TO: 11


Team_075
--------------------------------------------------------------------------------
Player                MIN  PTS  REB  AST  TO      FG   FG%      3P   3P%      FT STL BLK
--------------------------------------------------------------------------------
Larry McCollum         26    9    0    1   2   4/10   40.0   0/3     0.0   1/1     0   0
Kawhi Ingram           26   11    5    2   2   4/7    57.1   1/4    25.0   2/2     0   0
Myles Barrett          26   19    0    1   3   5/11   45.5   2/6    33.3   2/2     0   0
Derrick Stewart        26    4    6    4   0   2/5    40.0   0/0     0.0   0/0     1   2
Klay Jokic             26    3    5    5   2   3/6    50.0   1/2    50.0   1/2     0   0
D'Angelo Anunoby       22   10    7    2   0   6/11   54.5   0/3     0.0   2/2     0   0
LeBron Ginobili        22   14    0    3   0   5/8    62.5   4/7    57.1   0/0     2   0
Donovan Paul           22    2    0    0   1   1/5    20.0   0/4     0.0   0/0     0   0
Collin Duncan          22   15   10    3   1   5/6    83.3   1/2    50.0   1/1     0   0
Kevin Towns            22    5    7    1   1   2/4    50.0   0/0     0.0   1/1     1   0

TEAM: FG: 37/73 (50.7%), 3PT: 9/31 (29.0%), REB: 40 (12 off, 28 def), AST: 22, TO: 12

================================================================================
