================================================================================
                        FULL GAME - Team_093 vs Team_013                        
================================================================================

================================================================================
                       1ST QUARTER - Team_093 vs Team_013                       
================================================================================

[12:00] Team_093 possession (Score: 0-0)
Damian Williamson attempts a Layup. Contested by Manu Smith (4.7 feet, MAN). Damian Williamson misses. Offensive rebound by Carmelo Wagner! Carmelo Wagner kicks it out.

[11:48] Team_093 possession (Score: 0-0)
Ben Cunningham attempts a Midrange. Contested by Jayson Morant (4.5 feet, ZONE). Ben Cunningham misses. Rebound secured by Desmond Ginobili.

[11:30] Team_013 possession (Score: 0-0)
Manu Smith attempts a 3Pt. Contested by Carmelo Wagner (3.8 feet, ZONE). Manu Smith misses. Offensive rebound by Desmond Ginobili! Desmond Ginobili kicks it out.

[11:19] Team_013 possession (Score: 0-0)
Desmond Ginobili attempts a 3Pt. Contested by Carmelo Wagner (3.7 feet, ZONE). Desmond Ginobili misses. Rebound secured by Carmelo Wagner.

[11:07] Team_093 possession (Score: 0-0)
Carmelo Wagner attempts a Midrange. Contested by Jayson Morant (3.7 feet, MAN). CARMELO WAGNER MAKES IT! Assist: Trae Westbrook
Score: 2-0

[10:52] Team_013 possession (Score: 2-0)
Manu Smith attempts a Midrange. Contested by Damian Williamson (5.3 feet, MAN). MANU SMITH MAKES IT! Assist: Desmond Ginobili
Score: 2-2

[10:35] Team_093 possession (Score: 2-2)
Vince Barnes drives to the basket... FOUL! Offensive foul on Vince Barnes! Desmond Ginobili drew the charge! [Team fouls: 1] (Vince Barnes: 1 personal fouls) TURNOVER! (dead ball)

[10:22] Team_013 possession (Score: 2-2)
Manu Smith drives and kicks out. Desmond Ginobili attempts a 3Pt. Contested by Vince Barnes (4.1 feet, MAN). Desmond Ginobili misses. Rebound secured by Ben Cunningham.

[10:11] Team_093 possession (Score: 2-2)
Vince Barnes attempts a 3Pt. Contested by Pau Mobley (3.9 feet, ZONE). Vince Barnes misses. FOUL! Loose ball foul on Nikola Curry during the rebound battle. [Team fouls: 1] No free throws, side out. (Nikola Curry: 1 personal fouls)

[09:55] Team_093 possession (Score: 2-2)
Ben Cunningham attempts a Layup. Contested by Desmond Ginobili (5.3 feet, ZONE). BEN CUNNINGHAM MAKES IT!
Score: 4-2

[09:41] Team_013 possession (Score: 4-2)
Pau Mobley drives to the basket... Pau Mobley loses control! Ball rolls out of bounds! TURNOVER! (dead ball)

[09:28] Team_093 possession (Score: 4-2)
Vince Barnes drives to the basket... Vince Barnes throws a bad pass out of bounds! TURNOVER! (dead ball)

[09:12] Team_013 possession (Score: 4-2)
Desmond Ginobili makes the Layup and draws the foul on Trae Westbrook! And-1! Desmond Ginobili to the line for 1. [Team fouls: 2] (Trae Westbrook: 1 personal fouls)   FT 1/1: GOOD Desmond Ginobili makes 1/1 from the line.
Score: 4-5

[08:53] Team_093 possession (Score: 4-5)
Carmelo Wagner attempts a 3Pt. Contested by Pau Mobley (3.4 feet, ZONE). Carmelo Wagner misses. Rebound secured by Pau Mobley.

[08:37] Team_013 possession (Score: 4-5)
Desmond Ginobili attempts a Layup. Contested by Ben Cunningham (5.3 feet, ZONE). Desmond Ginobili misses. Rebound secured by Carmelo Wagner.

[08:21] Team_093 possession (Score: 4-5)
FOUL! Shooting foul on Jayson Morant. Damian Williamson to the line for 2 free throws. [Team fouls: 2] (Jayson Morant: 1 personal fouls)   FT 1/2: MISS   FT 2/2: MISS Damian Williamson makes 0/2 from the line. Rebound secured by Nikola Curry.

[08:10] Team_013 possession (Score: 4-5)
Manu Smith attempts a Midrange. Contested by Damian Williamson (5.3 feet, MAN). Manu Smith misses. Rebound secured by Vince Barnes.

[08:01] Team_093 possession (Score: 4-5)
Ben Cunningham makes the Layup and draws the foul on Desmond Ginobili! And-1! Ben Cunningham to the line for 1. [Team fouls: 3] (Desmond Ginobili: 1 personal fouls)   FT 1/1: GOOD Ben Cunningham makes 1/1 from the line.
Score: 7-5

[07:47] Team_013 possession (Score: 7-5)
Jayson Morant attempts a Layup. Contested by Ben Cunningham (5.3 feet, ZONE). JAYSON MORANT MAKES IT!
Score: 7-7

[07:30] Team_093 possession (Score: 7-7)
Vince Barnes drives, picks up Desmond Ginobili. Help arrives from Pau Mobley! Vince Barnes attempts a Dunk. Contested by Pau Mobley (5.0 feet, ZONE). VINCE BARNES MAKES IT!
Score: 9-7

[07:16] Team_013 possession (Score: 9-7)
Manu Smith attempts a Layup. BLOCKED BY BEN CUNNINGHAM! Ball deflects out of bounds off Manu Smith.

[07:02] Team_093 possession (Score: 9-7)
Ben Cunningham attempts a Midrange. Contested by Manu Smith (5.2 feet, ZONE). Ben Cunningham misses. Rebound secured by Pau Mobley.

[06:46] Team_013 possession (Score: 9-7)
Manu Smith attempts a 3Pt. Contested by Carmelo Wagner (3.8 feet, ZONE). Manu Smith misses. Rebound secured by Carmelo Wagner.

[06:32] Team_093 possession (Score: 9-7)
FOUL! Reach-in foul on Nikola Curry during the drive. [Team fouls: 4] No free throws, side out. (Nikola Curry: 2 personal fouls)

[06:16] Team_093 possession (Score: 9-7)
Vince Barnes attempts a 3Pt. Contested by Pau Mobley (3.9 feet, ZONE). Vince Barnes misses. Rebound secured by Pau Mobley.

[05:57] Team_013 possession (Score: 9-7)
Pau Mobley attempts a 3Pt. Contested by Carmelo Wagner (3.3 feet, ZONE). Pau Mobley misses. Rebound secured by Ben Cunningham.

[05:44] Team_093 possession (Score: 9-7)
Vince Barnes attempts a Layup. Contested by Desmond Ginobili (5.0 feet, MAN). VINCE BARNES MAKES IT! Assist: Damian Williamson
Score: 11-7

[05:31] Team_013 possession (Score: 11-7)
Nikola Curry attempts a Layup. Contested by Ben Cunningham (5.5 feet, MAN). NIKOLA CURRY MAKES IT! Assist: Manu Smith
Score: 11-9

[05:12] Team_093 possession (Score: 11-9)
FOUL! Shooting foul on Jayson Morant. Carmelo Wagner to the line for 2 free throws. [BONUS: 5 team fouls] (Jayson Morant: 2 personal fouls)   FT 1/2: GOOD   FT 2/2: GOOD Carmelo Wagner makes 2/2 from the line.
Score: 13-9

[04:57] Team_013 possession (Score: 13-9)
Manu Smith drives and kicks out. Pau Mobley attempts a Midrange. Contested by Trae Westbrook (5.4 feet, MAN). PAU MOBLEY MAKES IT!
Score: 13-11

[04:46] Team_093 possession (Score: 13-11)
Trae Westbrook attempts a Layup. BLOCKED BY PAU MOBLEY! Ball deflects out of bounds off Trae Westbrook.

[04:32] Team_013 possession (Score: 13-11)
Desmond Ginobili drives, picks up Vince Barnes. Help arrives from Trae Westbrook! Desmond Ginobili attempts a Layup. Contested by Trae Westbrook (4.4 feet, MAN). DESMOND GINOBILI MAKES IT! Assist: Manu Smith
Score: 13-13

[04:20] Team_093 possession (Score: 13-13)
Damian Williamson drives and kicks out. Ben Cunningham attempts a Midrange. Contested by Manu Smith (4.8 feet, ZONE). Ben Cunningham misses. Rebound secured by Desmond Ginobili.

[04:05] Team_013 possession (Score: 13-13)
Pau Mobley attempts a 3Pt. Contested by Trae Westbrook (5.5 feet, MAN). Pau Mobley misses. Rebound secured by Carmelo Wagner.

[03:50] Team_093 possession (Score: 13-13)
Damian Williamson attempts a Layup. Contested by Manu Smith (4.7 feet, MAN). Damian Williamson misses. Rebound secured by Desmond Ginobili.

[03:33] Team_013 possession (Score: 13-13)
Desmond Ginobili attempts a 3Pt. Contested by Carmelo Wagner (3.9 feet, ZONE). Desmond Ginobili misses. Rebound secured by Vince Barnes.

[03:17] Team_093 possession (Score: 13-13)
FOUL! Holding foul on Jayson Morant. [IN THE BONUS! 6 team fouls] Carmelo Wagner to the line for 2 free throws. (Jayson Morant: 3 personal fouls)   FT 1/2: GOOD   FT 2/2: GOOD Carmelo Wagner makes 2/2 from the line.
Score: 15-13

[03:05] Team_013 possession (Score: 15-13)
Pau Mobley drives, Ben Cunningham stays with him. Pau Mobley attempts a Layup. Contested by Ben Cunningham (5.2 feet, ZONE). PAU MOBLEY MAKES IT!
Score: 15-15

[02:49] Team_093 possession (Score: 15-15)
Damian Williamson attempts a 3Pt. Contested by Manu Smith (4.8 feet, MAN). Damian Williamson misses. Rebound secured by Desmond Ginobili.

[02:38] Team_013 possession (Score: 15-15)
Manu Smith attempts a 3Pt. Contested by Damian Williamson (5.6 feet, MAN). Manu Smith misses. Rebound secured by Carmelo Wagner.

[02:26] Team_093 possession (Score: 15-15)
Carmelo Wagner makes the 3Pt and draws the foul on Jayson Morant! And-1! Carmelo Wagner to the line for 1. [BONUS: 7 team fouls] (Jayson Morant: 4 personal fouls)   FT 1/1: MISS Carmelo Wagner makes 0/1 from the line. Rebound secured by Nikola Curry.
Score: 18-15

[02:11] Team_013 possession (Score: 18-15)
FOUL! Shooting foul on Carmelo Wagner. Nikola Curry to the line for 2 free throws. [Team fouls: 3] (Carmelo Wagner: 1 personal fouls)   FT 1/2: GOOD   FT 2/2: GOOD Nikola Curry makes 2/2 from the line.
Score: 18-17

[01:58] Team_093 possession (Score: 18-17)
Trae Westbrook attempts a Midrange. Contested by Pau Mobley (3.8 feet, MAN). TRAE WESTBROOK MAKES IT!
Score: 20-17

[01:40] Team_013 possession (Score: 20-17)
Pau Mobley drives and kicks out. Desmond Ginobili attempts a 3Pt. Contested by Carmelo Wagner (3.9 feet, ZONE). Desmond Ginobili misses. Offensive rebound by Nikola Curry! Nikola Curry kicks it out.

[01:28] Team_013 possession (Score: 20-17)
Pau Mobley attempts a 3Pt. Contested by Trae Westbrook (5.7 feet, MAN). Pau Mobley misses. Rebound secured by Carmelo Wagner.

[01:13] Team_093 possession (Score: 20-17)
Carmelo Wagner attempts a Layup. Contested by Jayson Morant (4.2 feet, MAN). Carmelo Wagner misses. Rebound secured by Nikola Curry.

[00:59] Team_013 possession (Score: 20-17)
Jayson Morant attempts a 3Pt. Contested by Carmelo Wagner (4.2 feet, ZONE). Jayson Morant misses. Offensive rebound by Desmond Ginobili! Desmond Ginobili kicks it out.

[00:46] Team_013 possession (Score: 20-17)
Jayson Morant drives, Carmelo Wagner stays with him. Jayson Morant attempts a Layup. Contested by Carmelo Wagner (4.2 feet, MAN). Jayson Morant misses. Rebound secured by Vince Barnes.

[00:30] Team_093 possession (Score: 20-17)
Vince Barnes drives to the basket... Vince Barnes throws a bad pass! Stolen by Desmond Ginobili! TURNOVER! (live ball)

[00:18] Team_013 possession (Score: 20-17)
Pau Mobley attempts a Midrange. Contested by Trae Westbrook (5.8 feet, MAN). PAU MOBLEY MAKES IT!
Score: 20-19

[00:03] Team_093 possession (Score: 20-19)
FOUL! Reach-in foul on Jayson Morant during the drive. [IN THE BONUS! 8 team fouls] Carmelo Wagner to the line for 2 free throws. (Jayson Morant: 5 personal fouls)   FT 1/2: GOOD   FT 2/2: MISS Carmelo Wagner makes 1/2 from the line. Rebound secured by Nikola Curry.
Score: 21-19

================================================================================
                              1ST QUARTER COMPLETE                              
================================================================================

1ST QUARTER SCORE: Team_093 21, Team_013 19

BOX SCORE:
================================================================================

Team_093
--------------------------------------------------------------------------------
Player                MIN  PTS  REB  AST  TO      FG   FG%      3P   3P%
--------------------------------------------------------------------------------
Carmelo Wagner         12    6    7    0   0   3/7    42.9     0/0   0.0
Ben Cunningham         12    5    3    0   0   2/4    50.0     0/0   0.0
Vince Barnes           12    4    3    0   0   2/3    66.7     0/0   0.0
Trae Westbrook         12    2    0    1   0   1/2    50.0     0/0   0.0
Damian Williamson      12    0    0    1   0   0/4     0.0     0/0   0.0

TEAM: FG: 8/20 (40.0%), 3PT: 0/4 (0.0%), REB: 13 (2 off, 11 def), AST: 2, TO: 3
TEAM FOULS: 3


Team_013
--------------------------------------------------------------------------------
Player                MIN  PTS  REB  AST  TO      FG   FG%      3P   3P%
--------------------------------------------------------------------------------
Pau Mobley             12    6    3    0   0   3/6    50.0     0/0   0.0
Desmond Ginobili       12    5    6    1   0   2/5    40.0     0/0   0.0
Nikola Curry           12    4    5    0   0   2/2   100.0     0/0   0.0
Manu Smith             12    2    0    2   0   1/6    16.7     0/0   0.0
Jayson Morant          12    2    0    0   0   1/2    50.0     0/0   0.0

TEAM: FG: 9/21 (42.9%), 3PT: 0/7 (0.0%), REB: 14 (3 off, 11 def), AST: 3, TO: 1
TEAM FOULS: 8 [Team_093 in BONUS]

================================================================================

================================================================================
                       2ND QUARTER - Team_093 vs Team_013                       
================================================================================

[12:00] Team_093 possession (Score: 21-19)
Trae Westbrook makes the Layup and draws the foul on Desmond Ginobili! And-1! Trae Westbrook to the line for 1. [Team fouls: 1] (Desmond Ginobili: 1 personal fouls)   FT 1/1: GOOD Trae Westbrook makes 1/1 from the line.
Score: 24-19

[11:42] Team_013 possession (Score: 24-19)
Nikola Curry drives, picks up Ben Cunningham. Help arrives from Trae Westbrook! Nikola Curry attempts a Dunk. Contested by Trae Westbrook (5.8 feet, ZONE). Nikola Curry misses. Rebound secured by Ben Cunningham.

[11:25] Team_093 possession (Score: 24-19)
Ben Cunningham drives to the basket... Ben Cunningham loses control! Ball rolls out of bounds! TURNOVER! (dead ball)

[11:25] Substitution (Team_093): Damian Williamson OUT → Shaquille George IN (stamina_rule2)

[11:25] Substitution (Team_093): Trae Westbrook OUT → Immanuel Cunningham IN (stamina_rule2)

[11:25] Substitution (Team_093): Carmelo Wagner OUT → Lauri Parker IN (stamina_rule2)

[11:25] Substitution (Team_093): Vince Barnes OUT → Kobe Murray IN (stamina_rule2)

[11:25] Substitution (Team_093): Ben Cunningham OUT → Cade O'Neal IN (stamina_rule2)

[11:25] Substitution (Team_013): Manu Smith OUT → Gary Iverson IN (stamina_rule2)

[11:25] Substitution (Team_013): Pau Mobley OUT → Chris Bryant IN (stamina_rule2)

[11:25] Substitution (Team_013): Jayson Morant OUT → Vince Nowitzki IN (stamina_rule2)

[11:25] Substitution (Team_013): Desmond Ginobili OUT → Dirk Booker IN (stamina_rule2)

[11:25] Substitution (Team_013): Nikola Curry OUT → Jayson Nowitzki IN (stamina_rule2)

[11:10] Team_013 possession (Score: 24-19)
Chris Bryant attempts a Midrange. Contested by Immanuel Cunningham (5.9 feet, MAN). CHRIS BRYANT MAKES IT! Assist: Jayson Nowitzki
Score: 24-21

[10:53] Team_093 possession (Score: 24-21)
FOUL! Holding foul on Chris Bryant. [Team fouls: 2] No free throws, side out. (Chris Bryant: 1 personal fouls)

[10:35] Team_093 possession (Score: 24-21)
FOUL! Holding foul on Dirk Booker. [Team fouls: 3] No free throws, side out. (Dirk Booker: 1 personal fouls)

[10:21] Team_093 possession (Score: 24-21)
FOUL! Holding foul on Chris Bryant. [Team fouls: 4] No free throws, side out. (Chris Bryant: 2 personal fouls)

[10:07] Team_093 possession (Score: 24-21)
Immanuel Cunningham attempts a 3Pt. Contested by Chris Bryant (4.8 feet, MAN). Immanuel Cunningham misses. Rebound secured by Jayson Nowitzki.

[09:54] Team_013 possession (Score: 24-21)
Vince Nowitzki drives to the basket... Vince Nowitzki throws a bad pass! Stolen by Kobe Murray! TURNOVER! (live ball)

[09:42] Team_093 possession (Score: 24-21)
Lauri Parker drives, picks up Jayson Nowitzki. Help arrives from Gary Iverson! Lauri Parker attempts a Dunk. Wide open! Gary Iverson is 6.7 feet away. [ZONE] LAURI PARKER MAKES IT! Assist: Kobe Murray
Score: 26-21

[09:30] Team_013 possession (Score: 26-21)
Dirk Booker attempts a Midrange. Contested by Immanuel Cunningham (5.9 feet, ZONE). Dirk Booker misses. Rebound secured by Kobe Murray.

[09:17] Team_093 possession (Score: 26-21)
FOUL! Shooting foul on Chris Bryant. Kobe Murray to the line for 3 free throws. [BONUS: 5 team fouls] (Chris Bryant: 3 personal fouls)   FT 1/3: GOOD   FT 2/3: GOOD   FT 3/3: GOOD Kobe Murray makes 3/3 from the line.
Score: 29-21

[09:01] Team_013 possession (Score: 29-21)
FOUL! Shooting foul on Shaquille George. Dirk Booker to the line for 2 free throws. [Team fouls: 1] (Shaquille George: 1 personal fouls)   FT 1/2: MISS   FT 2/2: GOOD Dirk Booker makes 1/2 from the line.
Score: 29-22

[08:44] Team_093 possession (Score: 29-22)
Cade O'Neal drives, picks up Jayson Nowitzki. Help arrives from Gary Iverson! Cade O'Neal attempts a Dunk. Wide open! Gary Iverson is 6.7 feet away. [ZONE] Cade O'Neal misses. Rebound secured by Jayson Nowitzki.

[08:27] Team_013 possession (Score: 29-22)
Jayson Nowitzki drives, Kobe Murray stays with him. Jayson Nowitzki attempts a Dunk. Contested by Kobe Murray (3.9 feet, ZONE). Jayson Nowitzki misses. Offensive rebound by Dirk Booker! Dirk Booker kicks it out.

[08:16] Team_013 possession (Score: 29-22)
Dirk Booker throws a bad pass! Stolen by Kobe Murray! TURNOVER! (live ball)

[08:01] Team_093 possession (Score: 29-22)
Immanuel Cunningham throws a bad pass! Stolen by Chris Bryant! TURNOVER! (live ball)

[07:43] Team_013 possession (Score: 29-22)
Chris Bryant attempts a Layup. Contested by Immanuel Cunningham (5.9 feet, MAN). CHRIS BRYANT MAKES IT! Assist: Dirk Booker
Score: 29-24

[07:26] Team_093 possession (Score: 29-24)
Immanuel Cunningham attempts a 3Pt. Contested by Chris Bryant (4.8 feet, ZONE). Immanuel Cunningham misses. Rebound secured by Jayson Nowitzki.

[07:09] Team_013 possession (Score: 29-24)
Jayson Nowitzki drives, Kobe Murray stays with him. Jayson Nowitzki attempts a Layup. Contested by Kobe Murray (3.9 feet, ZONE). Jayson Nowitzki misses. Rebound secured by Lauri Parker.

[06:56] Team_093 possession (Score: 29-24)
Lauri Parker attempts a Midrange. Wide open! Vince Nowitzki is 6.1 feet away. [ZONE] LAURI PARKER MAKES IT!
Score: 31-24

[06:38] Team_013 possession (Score: 31-24)
Gary Iverson attempts a Midrange. Contested by Shaquille George (4.2 feet, MAN). GARY IVERSON MAKES IT! Assist: Dirk Booker
Score: 31-26

[06:23] Team_093 possession (Score: 31-26)
Cade O'Neal drives, Jayson Nowitzki stays with him. Cade O'Neal attempts a Dunk. Wide open! Jayson Nowitzki is 6.7 feet away. [ZONE] Cade O'Neal misses. Rebound secured by Dirk Booker.

[06:07] Team_013 possession (Score: 31-26)
Gary Iverson attempts a Midrange. Contested by Shaquille George (4.2 feet, MAN). Gary Iverson misses. Rebound secured by Cade O'Neal.

[05:56] Team_093 possession (Score: 31-26)
Kobe Murray drives, Dirk Booker stays with him. Kobe Murray attempts a Layup. Contested by Dirk Booker (5.5 feet, MAN). KOBE MURRAY MAKES IT! Assist: Lauri Parker
Score: 33-26

[05:36] Team_013 possession (Score: 33-26)
Vince Nowitzki attempts a 3Pt. Contested by Shaquille George (4.1 feet, ZONE). Vince Nowitzki misses. Rebound secured by Lauri Parker.

[05:22] Team_093 possession (Score: 33-26)
Kobe Murray drives to the basket... FOUL! Offensive foul on Kobe Murray! Jayson Nowitzki drew the charge! [Team fouls: 2] (Kobe Murray: 1 personal fouls) TURNOVER! (dead ball)

[05:05] Team_013 possession (Score: 33-26)
Gary Iverson throws a bad pass! Stolen by Shaquille George! TURNOVER! (live ball)

[04:50] Team_093 possession (Score: 33-26)
Shaquille George attempts a Midrange. Contested by Chris Bryant (4.9 feet, ZONE). Shaquille George misses. Rebound secured by Dirk Booker.

[04:33] Team_013 possession (Score: 33-26)
FOUL! Holding foul on Kobe Murray. [Team fouls: 3] No free throws, side out. (Kobe Murray: 2 personal fouls)

[04:16] Team_013 possession (Score: 33-26)
Chris Bryant attempts a Layup. BLOCKED BY KOBE MURRAY! Ball is loose! Rebound secured by Kobe Murray.

[04:03] Team_093 possession (Score: 33-26)
Cade O'Neal attempts a Layup. Contested by Dirk Booker (5.5 feet, MAN). CADE O'NEAL MAKES IT! Assist: Shaquille George
Score: 35-26

[03:45] Team_013 possession (Score: 35-26)
Dirk Booker attempts a 3Pt. Contested by Shaquille George (4.6 feet, ZONE). Dirk Booker misses. Rebound secured by Cade O'Neal.

[03:28] Team_093 possession (Score: 35-26)
Cade O'Neal attempts a Layup. Wide open! Jayson Nowitzki is 6.8 feet away. [ZONE] CADE O'NEAL MAKES IT!
Score: 37-26

[03:17] Team_013 possession (Score: 37-26)
Vince Nowitzki attempts a Midrange. Contested by Lauri Parker (4.5 feet, MAN). Vince Nowitzki misses. Rebound secured by Lauri Parker.

[03:02] Team_093 possession (Score: 37-26)
Immanuel Cunningham drives and kicks out. Kobe Murray attempts a 3Pt. Contested by Dirk Booker (5.5 feet, MAN). KOBE MURRAY MAKES IT! Assist: Lauri Parker
Score: 40-26

[02:52] Team_013 possession (Score: 40-26)
Gary Iverson drives to the basket... Gary Iverson loses control! Ball rolls out of bounds! TURNOVER! (dead ball)

[02:35] Team_093 possession (Score: 40-26)
Kobe Murray drives to the basket... FOUL! Offensive foul on Kobe Murray! Jayson Nowitzki drew the charge! [Team fouls: 4] (Kobe Murray: 3 personal fouls) TURNOVER! (dead ball)

[02:22] Team_013 possession (Score: 40-26)
Jayson Nowitzki attempts a Midrange. Contested by Kobe Murray (4.2 feet, MAN). Jayson Nowitzki misses. Rebound secured by Kobe Murray.

[02:05] Team_093 possession (Score: 40-26)
Kobe Murray attempts a 3Pt. Contested by Dirk Booker (5.6 feet, MAN). KOBE MURRAY MAKES IT! Assist: Shaquille George
Score: 43-26

[01:51] Team_013 possession (Score: 43-26)
Gary Iverson attempts a 3Pt. Contested by Shaquille George (4.3 feet, MAN). Gary Iverson misses. Rebound secured by Kobe Murray.

[01:39] Team_093 possession (Score: 43-26)
Kobe Murray attempts a 3Pt. Contested by Dirk Booker (5.6 feet, MAN). Kobe Murray misses. FOUL! Loose ball foul on Dirk Booker during the rebound battle. [IN THE BONUS! 6 team fouls] Kobe Murray to the line for 2 free throws. (Dirk Booker: 2 personal fouls)   FT 1/2: GOOD   FT 2/2: GOOD Kobe Murray makes 2/2 from the line.
Score: 45-26

[01:22] Team_013 possession (Score: 45-26)
Vince Nowitzki attempts a Midrange. Contested by Kobe Murray (4.2 feet, ZONE). VINCE NOWITZKI MAKES IT! Assist: Chris Bryant
Score: 45-28

[01:10] Team_093 possession (Score: 45-28)
Shaquille George drives and kicks out. Kobe Murray attempts a 3Pt. Contested by Dirk Booker (5.7 feet, MAN). Kobe Murray misses. Offensive rebound by Kobe Murray! Kobe Murray puts it back in!
Score: 47-28

[00:55] Team_013 possession (Score: 47-28)
Vince Nowitzki drives and kicks out. Jayson Nowitzki attempts a 3Pt. Contested by Shaquille George (4.6 feet, ZONE). Jayson Nowitzki misses. Rebound secured by Cade O'Neal.

[00:39] Team_093 possession (Score: 47-28)
Shaquille George attempts a 3Pt. Contested by Gary Iverson (5.3 feet, MAN). Shaquille George misses. FOUL! Loose ball foul on Jayson Nowitzki during the rebound battle. [IN THE BONUS! 7 team fouls] Cade O'Neal to the line for 2 free throws. (Jayson Nowitzki: 1 personal fouls)   FT 1/2: MISS   FT 2/2: GOOD Cade O'Neal makes 1/2 from the line.
Score: 48-28

[00:23] Team_013 possession (Score: 48-28)
Gary Iverson attempts a 3Pt. Contested by Shaquille George (4.5 feet, ZONE). Gary Iverson misses. Rebound secured by Cade O'Neal.

[00:09] Team_093 possession (Score: 48-28)
Lauri Parker attempts a Layup. Wide open! Vince Nowitzki is 6.4 feet away. [MAN] Lauri Parker misses. Rebound secured by Chris Bryant.

================================================================================
                              2ND QUARTER COMPLETE                              
================================================================================

2ND QUARTER SCORE: Team_093 27, Team_013 9

BOX SCORE:
================================================================================

Team_093
--------------------------------------------------------------------------------
Player                MIN  PTS  REB  AST  TO      FG   FG%      3P   3P%
--------------------------------------------------------------------------------
Kobe Murray            11   15    5    1   0   6/6   100.0     0/0   0.0
Cade O'Neal            11    5    4    0   0   3/5    60.0     0/0   0.0
Lauri Parker           11    4    3    2   0   2/3    66.7     0/0   0.0
Trae Westbrook         13    3    0    0   0   1/1   100.0     0/0   0.0
Ben Cunningham         13    0    1    0   0   0/0     0.0     0/0   0.0
Immanuel Cunningham    11    0    0    0   0   0/2     0.0     0/0   0.0
Shaquille George       11    0    0    2   0   0/1     0.0     0/0   0.0

TEAM: FG: 12/18 (66.7%), 3PT: 4/6 (66.7%), REB: 13 (1 off, 12 def), AST: 5, TO: 4
TEAM FOULS: 4


Team_013
--------------------------------------------------------------------------------
Player                MIN  PTS  REB  AST  TO      FG   FG%      3P   3P%
--------------------------------------------------------------------------------
Chris Bryant           11    4    1    1   0   2/3    66.7     0/0   0.0
Gary Iverson           11    2    0    0   0   1/4    25.0     0/0   0.0
Vince Nowitzki         11    2    0    0   0   1/4    25.0     0/0   0.0
Dirk Booker            11    1    3    2   0   1/3    33.3     0/0   0.0
Nikola Curry           13    0    0    0   0   0/1     0.0     0/0   0.0
Jayson Nowitzki        11    0    3    1   0   0/2     0.0     0/0   0.0

TEAM: FG: 5/17 (29.4%), 3PT: 0/4 (0.0%), REB: 7 (1 off, 6 def), AST: 4, TO: 4
TEAM FOULS: 7 [Team_093 in BONUS]

================================================================================

================================================================================
                       3RD QUARTER - Team_093 vs Team_013                       
================================================================================

[12:00] Team_093 possession (Score: 48-28)
Vince Barnes drives and kicks out. Ben Cunningham attempts a Midrange. Contested by Nikola Curry (5.0 feet, MAN). Ben Cunningham misses. Rebound secured by Desmond Ginobili.

[11:49] Team_013 possession (Score: 48-28)
Desmond Ginobili loses the ball! Stripped by Vince Barnes! TURNOVER! (live ball)

[11:31] Team_093 possession (Score: 48-28)
Ben Cunningham attempts a Layup. Contested by Nikola Curry (5.5 feet, MAN). BEN CUNNINGHAM MAKES IT! Assist: Damian Williamson
Score: 50-28

[11:13] Team_013 possession (Score: 50-28)
Desmond Ginobili loses the ball! Stripped by Vince Barnes! TURNOVER! (live ball)

[10:58] Team_093 possession (Score: 50-28)
Trae Westbrook attempts a Midrange. Contested by Pau Mobley (3.5 feet, MAN). TRAE WESTBROOK MAKES IT!
Score: 52-28

[10:46] Team_013 possession (Score: 52-28)
Pau Mobley attempts a 3Pt. Contested by Carmelo Wagner (3.3 feet, ZONE). PAU MOBLEY MAKES IT! Assist: Manu Smith
Score: 52-31

[10:35] Team_093 possession (Score: 52-31)
Vince Barnes attempts a Layup. Contested by Desmond Ginobili (5.0 feet, ZONE). VINCE BARNES MAKES IT!
Score: 54-31

[10:21] Team_013 possession (Score: 54-31)
Desmond Ginobili drives, Vince Barnes stays with him. Desmond Ginobili attempts a Dunk. Contested by Vince Barnes (4.4 feet, MAN). DESMOND GINOBILI MAKES IT!
Score: 54-33

[10:05] Team_093 possession (Score: 54-33)
Carmelo Wagner attempts a 3Pt. Contested by Pau Mobley (3.4 feet, ZONE). CARMELO WAGNER MAKES IT! Assist: Trae Westbrook
Score: 57-33

[09:50] Team_013 possession (Score: 57-33)
Jayson Morant drives to the basket... Jayson Morant loses the ball! Stripped by Carmelo Wagner! TURNOVER! (live ball)

[09:34] Team_093 possession (Score: 57-33)
Carmelo Wagner attempts a Midrange. Contested by Jayson Morant (3.7 feet, ZONE). CARMELO WAGNER MAKES IT!
Score: 59-33

[09:18] Team_013 possession (Score: 59-33)
Jayson Morant throws a bad pass! Stolen by Carmelo Wagner! TURNOVER! (live ball)

[09:02] Team_093 possession (Score: 59-33)
Vince Barnes attempts a Midrange. Contested by Desmond Ginobili (5.0 feet, MAN). Vince Barnes misses. Rebound secured by Nikola Curry.

[08:51] Team_013 possession (Score: 59-33)
Pau Mobley attempts a Midrange. Contested by Trae Westbrook (5.4 feet, MAN). PAU MOBLEY MAKES IT!
Score: 59-35

[08:38] Team_093 possession (Score: 59-35)
Carmelo Wagner drives to the basket... FOUL! Offensive foul on Carmelo Wagner! Desmond Ginobili drew the charge! [Team fouls: 1] (Carmelo Wagner: 1 personal fouls) TURNOVER! (dead ball)

[08:26] Team_013 possession (Score: 59-35)
FOUL! Offensive foul on Nikola Curry! Ben Cunningham drew the charge! [Team fouls: 1] (Nikola Curry: 1 personal fouls) TURNOVER! (dead ball)

[08:12] Team_093 possession (Score: 59-35)
Carmelo Wagner makes the Dunk and draws the foul on Jayson Morant! And-1! Carmelo Wagner to the line for 1. [Team fouls: 2] (Jayson Morant: 1 personal fouls)   FT 1/1: GOOD Carmelo Wagner makes 1/1 from the line.
Score: 62-35

[07:55] Team_013 possession (Score: 62-35)
Nikola Curry drives, Ben Cunningham stays with him. Nikola Curry attempts a Layup. Contested by Ben Cunningham (5.5 feet, MAN). Nikola Curry misses. Rebound secured by Vince Barnes.

[07:44] Team_093 possession (Score: 62-35)
Vince Barnes attempts a Midrange. Contested by Desmond Ginobili (5.0 feet, MAN). Vince Barnes misses. Rebound secured by Pau Mobley.

[07:31] Team_013 possession (Score: 62-35)
Pau Mobley drives and kicks out. Pau Mobley attempts a Midrange. Contested by Trae Westbrook (5.4 feet, MAN). PAU MOBLEY MAKES IT! Assist: Desmond Ginobili
Score: 62-37

[07:18] Team_093 possession (Score: 62-37)
Vince Barnes attempts a Midrange. Contested by Desmond Ginobili (5.0 feet, MAN). VINCE BARNES MAKES IT! Assist: Ben Cunningham
Score: 64-37

[06:59] Team_013 possession (Score: 64-37)
Pau Mobley drives and kicks out. Nikola Curry attempts a 3Pt. Contested by Ben Cunningham (4.9 feet, MAN). NIKOLA CURRY MAKES IT! Assist: Pau Mobley
Score: 64-40

[06:41] Team_093 possession (Score: 64-40)
Carmelo Wagner attempts a 3Pt. Contested by Pau Mobley (3.4 feet, ZONE). Carmelo Wagner misses. Rebound secured by Pau Mobley.

[06:27] Team_013 possession (Score: 64-40)
Desmond Ginobili attempts a Midrange. Contested by Vince Barnes (4.4 feet, MAN). Desmond Ginobili misses. Rebound secured by Carmelo Wagner.

[06:10] Team_093 possession (Score: 64-40)
Trae Westbrook attempts a 3Pt. Contested by Pau Mobley (3.5 feet, ZONE). Trae Westbrook misses. Rebound secured by Desmond Ginobili.

[05:55] Team_013 possession (Score: 64-40)
Manu Smith attempts a 3Pt. Contested by Damian Williamson (5.3 feet, MAN). MANU SMITH MAKES IT!
Score: 64-43

[05:39] Team_093 possession (Score: 64-43)
Trae Westbrook attempts a 3Pt. Contested by Pau Mobley (3.5 feet, MAN). TRAE WESTBROOK MAKES IT! Assist: Damian Williamson
Score: 67-43

[05:20] Team_013 possession (Score: 67-43)
Jayson Morant drives, picks up Ben Cunningham. Help arrives from Trae Westbrook! Jayson Morant attempts a Dunk. Contested by Trae Westbrook (5.3 feet, ZONE). JAYSON MORANT MAKES IT!
Score: 67-45

[05:11] Team_093 possession (Score: 67-45)
Damian Williamson drives and kicks out. Ben Cunningham attempts a 3Pt. Contested by Pau Mobley (3.7 feet, ZONE). Ben Cunningham misses. Rebound secured by Nikola Curry.

[04:56] Team_013 possession (Score: 67-45)
FOUL! Reach-in foul on Ben Cunningham during the drive. [Team fouls: 2] No free throws, side out. (Ben Cunningham: 1 personal fouls)

[04:42] Team_013 possession (Score: 67-45)
Manu Smith attempts a Layup. Contested by Damian Williamson (5.4 feet, MAN). Manu Smith misses. Rebound secured by Carmelo Wagner.

[04:23] Team_093 possession (Score: 67-45)
FOUL! Holding foul on Nikola Curry. [Team fouls: 3] No free throws, side out. (Nikola Curry: 2 personal fouls)

[04:10] Team_093 possession (Score: 67-45)
Carmelo Wagner makes the Layup and draws the foul on Jayson Morant! And-1! Carmelo Wagner to the line for 1. [Team fouls: 4] (Jayson Morant: 2 personal fouls)   FT 1/1: GOOD Carmelo Wagner makes 1/1 from the line.
Score: 70-45

[04:00] Team_013 possession (Score: 70-45)
Nikola Curry loses control! Ball rolls out of bounds! TURNOVER! (dead ball)

[03:49] Team_093 possession (Score: 70-45)
Carmelo Wagner drives, Jayson Morant stays with him. Carmelo Wagner attempts a Layup. Contested by Jayson Morant (3.9 feet, MAN). CARMELO WAGNER MAKES IT! Assist: Trae Westbrook
Score: 72-45

[03:30] Team_013 possession (Score: 72-45)
Desmond Ginobili attempts a 3Pt. Contested by Carmelo Wagner (3.9 feet, ZONE). Desmond Ginobili misses. FOUL! Loose ball foul on Ben Cunningham during the rebound battle. [Team fouls: 3] No free throws, side out. (Ben Cunningham: 2 personal fouls)

[03:16] Team_013 possession (Score: 72-45)
Jayson Morant drives and kicks out. Jayson Morant attempts a 3Pt. Contested by Damian Williamson (5.1 feet, ZONE). Jayson Morant misses. Rebound secured by Carmelo Wagner.

[03:04] Team_093 possession (Score: 72-45)
Carmelo Wagner attempts a Midrange. Contested by Jayson Morant (3.9 feet, MAN). CARMELO WAGNER MAKES IT!
Score: 74-45

[02:46] Team_013 possession (Score: 74-45)
Pau Mobley attempts a 3Pt. Contested by Carmelo Wagner (3.6 feet, ZONE). PAU MOBLEY MAKES IT! Assist: Manu Smith
Score: 74-48

[02:36] Team_093 possession (Score: 74-48)
Carmelo Wagner attempts a Layup. Contested by Desmond Ginobili (4.8 feet, ZONE). Carmelo Wagner misses. Rebound secured by Nikola Curry.

[02:19] Team_013 possession (Score: 74-48)
FOUL! Shooting foul on Vince Barnes. Desmond Ginobili to the line for 2 free throws. [Team fouls: 4] (Vince Barnes: 1 personal fouls)   FT 1/2: MISS   FT 2/2: GOOD Desmond Ginobili makes 1/2 from the line.
Score: 74-49

[02:06] Team_093 possession (Score: 74-49)
Damian Williamson attempts a Layup. Contested by Manu Smith (4.8 feet, MAN). DAMIAN WILLIAMSON MAKES IT! Assist: Ben Cunningham
Score: 76-49

[01:53] Team_013 possession (Score: 76-49)
Nikola Curry attempts a Layup. BLOCKED BY BEN CUNNINGHAM! Ball is loose! Rebound secured by Carmelo Wagner.

[01:36] Team_093 possession (Score: 76-49)
FOUL! Offensive foul on Ben Cunningham! Nikola Curry drew the charge! [Team fouls: 5] (Ben Cunningham: 3 personal fouls) TURNOVER! (dead ball)

[01:18] Team_013 possession (Score: 76-49)
FOUL! Shooting foul on Vince Barnes. Pau Mobley to the line for 2 free throws. [BONUS: 6 team fouls] (Vince Barnes: 2 personal fouls)   FT 1/2: GOOD   FT 2/2: GOOD Pau Mobley makes 2/2 from the line.
Score: 76-51

[01:03] Team_093 possession (Score: 76-51)
Vince Barnes drives and kicks out. Vince Barnes attempts a 3Pt. Contested by Desmond Ginobili (5.2 feet, MAN). Vince Barnes misses. Offensive rebound by Ben Cunningham! Ben Cunningham kicks it out.

[00:49] Team_093 possession (Score: 76-51)
Trae Westbrook attempts a Midrange. Contested by Pau Mobley (4.0 feet, MAN). Trae Westbrook misses. Rebound secured by Desmond Ginobili.

[00:33] Team_013 possession (Score: 76-51)
Manu Smith drives and kicks out. Desmond Ginobili attempts a Midrange. Contested by Damian Williamson (5.4 feet, ZONE). Desmond Ginobili misses. Rebound secured by Ben Cunningham.

[00:21] Team_093 possession (Score: 76-51)
Vince Barnes attempts a Layup. BLOCKED BY PAU MOBLEY! Ball deflects out of bounds off Vince Barnes.

[00:04] Team_013 possession (Score: 76-51)
Jayson Morant drives and kicks out. Nikola Curry attempts a 3Pt. Contested by Carmelo Wagner (4.1 feet, ZONE). Nikola Curry misses. Offensive rebound by Nikola Curry! Nikola Curry kicks it out.

================================================================================
                              3RD QUARTER COMPLETE                              
================================================================================

3RD QUARTER SCORE: Team_093 28, Team_013 23

BOX SCORE:
================================================================================

Team_093
--------------------------------------------------------------------------------
Player                MIN  PTS  REB  AST  TO      FG   FG%      3P   3P%
--------------------------------------------------------------------------------
Carmelo Wagner         25   15    4    0   0   6/8    75.0     0/0   0.0
Trae Westbrook         25    5    0    2   0   2/4    50.0     0/0   0.0
Vince Barnes           25    4    1    0   0   2/6    33.3     0/0   0.0
Ben Cunningham         25    2    2    2   0   1/1   100.0     0/0   0.0
Damian Williamson      25    2    0    2   0   1/2    50.0     0/0   0.0

TEAM: FG: 12/21 (57.1%), 3PT: 2/4 (50.0%), REB: 7 (1 off, 6 def), AST: 6, TO: 2
TEAM FOULS: 6 [Team_013 in BONUS]


Team_013
--------------------------------------------------------------------------------
Player                MIN  PTS  REB  AST  TO      FG   FG%      3P   3P%
--------------------------------------------------------------------------------
Pau Mobley             25   12    2    1   0   5/5   100.0     0/0   0.0
Desmond Ginobili       25    3    3    1   0   2/3    66.7     0/0   0.0
Manu Smith             25    3    0    2   0   1/3    33.3     0/0   0.0
Nikola Curry           25    3    5    0   0   1/3    33.3     0/0   0.0
Jayson Morant          25    2    0    0   0   1/2    50.0     0/0   0.0

TEAM: FG: 10/16 (62.5%), 3PT: 3/3 (100.0%), REB: 10 (2 off, 8 def), AST: 4, TO: 6
TEAM FOULS: 4

================================================================================

================================================================================
                       4TH QUARTER - Team_093 vs Team_013                       
================================================================================

[12:00] Team_093 possession (Score: 76-51)
Vince Barnes attempts a 3Pt. Contested by Pau Mobley (4.2 feet, ZONE). Vince Barnes misses. Rebound secured by Nikola Curry.

[11:46] Team_013 possession (Score: 76-51)
Jayson Morant attempts a 3Pt. Contested by Carmelo Wagner (4.1 feet, ZONE). Jayson Morant misses. Rebound secured by Vince Barnes.

[11:30] Team_093 possession (Score: 76-51)
Trae Westbrook attempts a 3Pt. Contested by Pau Mobley (3.9 feet, MAN). Trae Westbrook misses. Offensive rebound by Ben Cunningham! Ben Cunningham kicks it out.

[11:15] Team_093 possession (Score: 76-51)
Damian Williamson drives to the basket... Damian Williamson throws a bad pass out of bounds! TURNOVER! (dead ball)

[11:15] Substitution (Team_093): Damian Williamson OUT → Shaquille George IN (stamina_rule2)

[11:15] Substitution (Team_093): Trae Westbrook OUT → Immanuel Cunningham IN (stamina_rule2)

[11:15] Substitution (Team_093): Carmelo Wagner OUT → Lauri Parker IN (stamina_rule2)

[11:15] Substitution (Team_093): Vince Barnes OUT → Kobe Murray IN (stamina_rule2)

[11:15] Substitution (Team_093): Ben Cunningham OUT → Cade O'Neal IN (stamina_rule2)

[11:15] Substitution (Team_013): Manu Smith OUT → Gary Iverson IN (stamina_rule2)

[11:15] Substitution (Team_013): Pau Mobley OUT → Chris Bryant IN (stamina_rule2)

[11:15] Substitution (Team_013): Jayson Morant OUT → Vince Nowitzki IN (stamina_rule2)

[11:15] Substitution (Team_013): Desmond Ginobili OUT → Dirk Booker IN (stamina_rule2)

[11:15] Substitution (Team_013): Nikola Curry OUT → Jayson Nowitzki IN (stamina_rule2)

[11:01] Team_013 possession (Score: 76-51)
Chris Bryant attempts a 3Pt. Contested by Immanuel Cunningham (5.9 feet, MAN). Chris Bryant misses. Rebound secured by Lauri Parker.

[10:48] Team_093 possession (Score: 76-51)
Lauri Parker attempts a 3Pt. Wide open! Vince Nowitzki is 6.1 feet away. [MAN] Lauri Parker misses. Rebound secured by Dirk Booker.

[10:34] Team_013 possession (Score: 76-51)
Gary Iverson attempts a 3Pt. Contested by Shaquille George (4.2 feet, ZONE). Gary Iverson misses. FOUL! Loose ball foul on Kobe Murray during the rebound battle. [Team fouls: 1] No free throws, side out. (Kobe Murray: 1 personal fouls)

[10:25] Team_013 possession (Score: 76-51)
Jayson Nowitzki drives, picks up Kobe Murray. Help arrives from Shaquille George! Jayson Nowitzki attempts a Dunk. Contested by Shaquille George (3.9 feet, MAN). JAYSON NOWITZKI MAKES IT! Assist: Vince Nowitzki
Score: 76-53

[10:08] Team_093 possession (Score: 76-53)
Lauri Parker drives to the basket... Lauri Parker throws a bad pass! Stolen by Jayson Nowitzki! TURNOVER! (live ball)

[09:54] Team_013 possession (Score: 76-53)
Vince Nowitzki drives and kicks out. Jayson Nowitzki attempts a Midrange. Contested by Lauri Parker (4.6 feet, ZONE). Jayson Nowitzki misses. Offensive rebound by Jayson Nowitzki! Jayson Nowitzki kicks it out.

[09:40] Team_013 possession (Score: 76-53)
Dirk Booker attempts a Layup. Contested by Kobe Murray (4.3 feet, ZONE). Dirk Booker misses. Rebound secured by Lauri Parker.

[09:26] Team_093 possession (Score: 76-53)
Kobe Murray attempts a Midrange. Contested by Gary Iverson (4.7 feet, ZONE). Kobe Murray misses. Rebound secured by Jayson Nowitzki.

[09:10] Team_013 possession (Score: 76-53)
Gary Iverson attempts a Layup. BLOCKED BY SHAQUILLE GEORGE! Ball is loose! Offensive rebound by Dirk Booker! Dirk Booker kicks it out.

[08:57] Team_013 possession (Score: 76-53)
Gary Iverson attempts a Midrange. Contested by Shaquille George (4.2 feet, MAN). GARY IVERSON MAKES IT! Assist: Chris Bryant
Score: 76-55

[08:45] Team_093 possession (Score: 76-55)
Immanuel Cunningham attempts a Midrange. Contested by Chris Bryant (4.8 feet, MAN). Immanuel Cunningham misses. Offensive rebound by Kobe Murray! Kobe Murray's putback is no good. Rebound secured by Jayson Nowitzki.

[08:31] Team_013 possession (Score: 76-55)
Vince Nowitzki drives, Lauri Parker stays with him. Vince Nowitzki attempts a Dunk. Contested by Lauri Parker (4.3 feet, MAN). Vince Nowitzki misses. FOUL! Loose ball foul on Kobe Murray during the rebound battle. [Team fouls: 2] No free throws, side out. (Kobe Murray: 2 personal fouls)

[08:15] Team_013 possession (Score: 76-55)
Chris Bryant drives, Kobe Murray stays with him. Chris Bryant attempts a Layup. Contested by Kobe Murray (4.3 feet, ZONE). Chris Bryant misses. Rebound secured by Kobe Murray.

[08:00] Team_093 possession (Score: 76-55)
Shaquille George attempts a Midrange. Contested by Gary Iverson (5.0 feet, MAN). Shaquille George misses. Rebound secured by Jayson Nowitzki.

[07:48] Team_013 possession (Score: 76-55)
Dirk Booker attempts a 3Pt. Contested by Shaquille George (4.6 feet, ZONE). Dirk Booker misses. Rebound secured by Kobe Murray.

[07:34] Team_093 possession (Score: 76-55)
Kobe Murray drives, Jayson Nowitzki stays with him. Kobe Murray attempts a Layup. Wide open! Jayson Nowitzki is 6.7 feet away. [ZONE] KOBE MURRAY MAKES IT! Assist: Immanuel Cunningham
Score: 78-55

[07:19] Team_013 possession (Score: 78-55)
Dirk Booker drives, Kobe Murray stays with him. Dirk Booker attempts a Dunk. Contested by Kobe Murray (4.3 feet, ZONE). Dirk Booker misses. Rebound secured by Cade O'Neal.

[07:08] Team_093 possession (Score: 78-55)
Cade O'Neal attempts a 3Pt. Contested by Chris Bryant (4.7 feet, ZONE). Cade O'Neal misses. FOUL! Loose ball foul on Jayson Nowitzki during the rebound battle. [Team fouls: 1] No free throws, side out. (Jayson Nowitzki: 1 personal fouls)

[06:54] Team_093 possession (Score: 78-55)
Lauri Parker drives and kicks out. Shaquille George attempts a 3Pt. Contested by Chris Bryant (4.6 feet, ZONE). Shaquille George misses. FOUL! Loose ball foul on Jayson Nowitzki during the rebound battle. [Team fouls: 2] No free throws, side out. (Jayson Nowitzki: 2 personal fouls)

[06:34] Team_093 possession (Score: 78-55)
Shaquille George attempts a 3Pt. Contested by Chris Bryant (4.9 feet, ZONE). SHAQUILLE GEORGE MAKES IT! Assist: Lauri Parker
Score: 81-55

[06:17] Team_013 possession (Score: 81-55)
FOUL! Reach-in foul on Lauri Parker during the drive. [Team fouls: 3] No free throws, side out. (Lauri Parker: 1 personal fouls)

[06:01] Team_013 possession (Score: 81-55)
Vince Nowitzki drives and kicks out. Vince Nowitzki attempts a 3Pt. Contested by Lauri Parker (4.6 feet, MAN). Vince Nowitzki misses. Offensive rebound by Jayson Nowitzki! Jayson Nowitzki kicks it out.

[05:43] Team_013 possession (Score: 81-55)
Dirk Booker attempts a Midrange. Contested by Kobe Murray (4.3 feet, MAN). Dirk Booker misses. Rebound secured by Kobe Murray.

[05:31] Team_093 possession (Score: 81-55)
Cade O'Neal drives, Jayson Nowitzki stays with him. Cade O'Neal attempts a Dunk. Wide open! Jayson Nowitzki is 6.7 feet away. [ZONE] Cade O'Neal misses. Rebound secured by Chris Bryant.

[05:19] Team_013 possession (Score: 81-55)
Jayson Nowitzki drives, picks up Kobe Murray. Help arrives from Shaquille George! Jayson Nowitzki attempts a Dunk. Contested by Shaquille George (3.9 feet, MAN). Jayson Nowitzki misses. Rebound secured by Kobe Murray.

[05:07] Team_093 possession (Score: 81-55)
Kobe Murray attempts a 3Pt. Contested by Chris Bryant (4.7 feet, ZONE). Kobe Murray misses. Offensive rebound by Kobe Murray! Kobe Murray's putback is no good. Offensive rebound by Cade O'Neal! Cade O'Neal kicks it out.

[04:54] Team_093 possession (Score: 81-55)
Lauri Parker attempts a 3Pt. Wide open! Vince Nowitzki is 6.1 feet away. [MAN] LAURI PARKER MAKES IT!
Score: 84-55

[04:36] Team_013 possession (Score: 84-55)
Gary Iverson attempts a Midrange. Contested by Shaquille George (4.2 feet, MAN). Gary Iverson misses. Offensive rebound by Jayson Nowitzki! Jayson Nowitzki kicks it out.

[04:23] Team_013 possession (Score: 84-55)
Gary Iverson attempts a Midrange. Contested by Shaquille George (4.2 feet, MAN). Gary Iverson misses. Rebound secured by Cade O'Neal.

[04:14] Team_093 possession (Score: 84-55)
Kobe Murray drives, Jayson Nowitzki stays with him. Kobe Murray attempts a Layup. Wide open! Jayson Nowitzki is 6.7 feet away. [ZONE] Kobe Murray misses. Offensive rebound by Kobe Murray! Kobe Murray's putback is no good. Rebound secured by Chris Bryant.

[03:59] Team_013 possession (Score: 84-55)
Gary Iverson attempts a 3Pt. Contested by Shaquille George (4.2 feet, MAN). GARY IVERSON MAKES IT!
Score: 84-58

[03:48] Team_093 possession (Score: 84-58)
Shaquille George attempts a Layup. Wide open! Jayson Nowitzki is 7.0 feet away. [ZONE] SHAQUILLE GEORGE MAKES IT! Assist: Cade O'Neal
Score: 86-58

[03:33] Team_013 possession (Score: 86-58)
Gary Iverson attempts a 3Pt. Contested by Shaquille George (4.2 feet, ZONE). Gary Iverson misses. Rebound secured by Kobe Murray.

[03:17] Team_093 possession (Score: 86-58)
Shaquille George attempts a 3Pt. Contested by Gary Iverson (5.1 feet, MAN). Shaquille George misses. Rebound secured by Jayson Nowitzki.

[03:04] Team_013 possession (Score: 86-58)
Chris Bryant makes the Midrange and draws the foul on Kobe Murray! And-1! Chris Bryant to the line for 1. [Team fouls: 4] (Kobe Murray: 3 personal fouls)   FT 1/1: GOOD Chris Bryant makes 1/1 from the line.
Score: 86-61

[02:47] Team_093 possession (Score: 86-61)
Kobe Murray drives to the basket... Kobe Murray throws a bad pass out of bounds! TURNOVER! (dead ball)

[02:35] Team_013 possession (Score: 86-61)
Chris Bryant attempts a 3Pt. Wide open! Immanuel Cunningham is 6.0 feet away. [MAN] Chris Bryant misses. Rebound secured by Lauri Parker.

[02:20] Team_093 possession (Score: 86-61)
Immanuel Cunningham attempts a 3Pt. Wide open! Vince Nowitzki is 6.4 feet away. [ZONE] Immanuel Cunningham misses. Rebound secured by Dirk Booker.

[02:02] Team_013 possession (Score: 86-61)
FOUL! Shooting foul on Shaquille George. Jayson Nowitzki to the line for 3 free throws. [BONUS: 5 team fouls] (Shaquille George: 1 personal fouls)   FT 1/3: GOOD   FT 2/3: GOOD   FT 3/3: GOOD Jayson Nowitzki makes 3/3 from the line.
Score: 86-64

[01:49] Team_093 possession (Score: 86-64)
Cade O'Neal drives and kicks out. Immanuel Cunningham attempts a Midrange. Contested by Chris Bryant (4.8 feet, MAN). IMMANUEL CUNNINGHAM MAKES IT! Assist: Kobe Murray
Score: 88-64

[01:35] Team_013 possession (Score: 88-64)
Jayson Nowitzki attempts a Midrange. Contested by Lauri Parker (4.8 feet, ZONE). Jayson Nowitzki misses. Offensive rebound by Dirk Booker! Dirk Booker kicks it out.

[01:21] Team_013 possession (Score: 88-64)
Gary Iverson drives to the basket... Gary Iverson loses control! Ball rolls out of bounds! TURNOVER! (dead ball)

[01:03] Team_093 possession (Score: 88-64)
Cade O'Neal attempts a Midrange. Contested by Dirk Booker (5.7 feet, MAN). CADE O'NEAL MAKES IT!
Score: 90-64

[00:48] Team_013 possession (Score: 90-64)
Dirk Booker drives and kicks out. Gary Iverson attempts a Midrange. Contested by Shaquille George (4.7 feet, MAN). GARY IVERSON MAKES IT!
Score: 90-66

[00:35] Team_093 possession (Score: 90-66)
FOUL! Reach-in foul on Dirk Booker during the drive. [Team fouls: 3] No free throws, side out. (Dirk Booker: 1 personal fouls)

[00:16] Team_093 possession (Score: 90-66)
Shaquille George drives and kicks out. Kobe Murray attempts a Midrange. Contested by Dirk Booker (5.8 feet, MAN). Kobe Murray misses. Rebound secured by Dirk Booker.

[00:05] Team_013 possession (Score: 90-66)
Dirk Booker attempts a Midrange. Contested by Kobe Murray (4.9 feet, MAN). DIRK BOOKER MAKES IT! Assist: Gary Iverson
Score: 90-68

================================================================================
                              4TH QUARTER COMPLETE                              
================================================================================

4TH QUARTER SCORE: Team_093 14, Team_013 17

BOX SCORE:
================================================================================

Team_093
--------------------------------------------------------------------------------
Player                MIN  PTS  REB  AST  TO      FG   FG%      3P   3P%
--------------------------------------------------------------------------------
Shaquille George       22    5    0    0   0   2/5    40.0     0/0   0.0
Lauri Parker           22    3    3    1   0   1/2    50.0     0/0   0.0
Kobe Murray            22    2    5    1   0   1/3    33.3     0/0   0.0
Immanuel Cunningham    22    2    0    1   0   1/3    33.3     0/0   0.0
Cade O'Neal            22    2    5    1   0   1/2    50.0     0/0   0.0
Vince Barnes           26    0    1    0   0   0/1     0.0     0/0   0.0
Ben Cunningham         26    0    1    0   0   0/0     0.0     0/0   0.0

TEAM: FG: 6/16 (37.5%), 3PT: 2/6 (33.3%), REB: 17 (6 off, 11 def), AST: 4, TO: 3
TEAM FOULS: 5 [Team_013 in BONUS]


Team_013
--------------------------------------------------------------------------------
Player                MIN  PTS  REB  AST  TO      FG   FG%      3P   3P%
--------------------------------------------------------------------------------
Gary Iverson           22    7    0    1   0   3/5    60.0     0/0   0.0
Jayson Nowitzki        22    5    9    0   0   2/3    66.7     0/0   0.0
Chris Bryant           22    3    2    1   0   1/4    25.0     0/0   0.0
Dirk Booker            22    2    5    0   0   1/5    20.0     0/0   0.0
Nikola Curry           26    0    1    0   0   0/0     0.0     0/0   0.0
Jayson Morant          26    0    0    0   0   0/1     0.0     0/0   0.0
Vince Nowitzki         22    0    0    1   0   0/0     0.0     0/0   0.0

TEAM: FG: 7/18 (38.9%), 3PT: 2/7 (28.6%), REB: 15 (7 off, 8 def), AST: 3, TO: 1
TEAM FOULS: 3

================================================================================

================================================================================
                               FULL GAME COMPLETE                               
================================================================================

FINAL SCORE: Team_093 90, Team_013 68

SCORING BY QUARTER:
--------------------------------------------------------------------------------
Team                     Q1     Q2     Q3     Q4    FINAL
--------------------------------------------------------------------------------
Team_093                 21     27     28     14       90
Team_013                 19      9     23     17       68
--------------------------------------------------------------------------------

FULL GAME BOX SCORE:
================================================================================

Team_093
--------------------------------------------------------------------------------
Player                MIN  PTS  REB  AST  TO      FG   FG%      3P   3P%      FT STL BLK
--------------------------------------------------------------------------------
Damian Williamson      26    2    0    3   2   1/6    16.7   0/1     0.0   0/2     0   0
Trae Westbrook         26   10    0    3   0   4/7    57.1   1/2    50.0   1/1     0   0
Carmelo Wagner         26   21   11    0   1   8/14   57.1   1/4    25.0   7/9     2   0
Vince Barnes           26    8    5    0   3   4/10   40.0   0/2     0.0   0/0     2   0
Ben Cunningham         26    7    7    2   1   3/5    60.0   0/0     0.0   1/1     0   2
Shaquille George       22    5    0    2   1   4/8    50.0   2/3    66.7   0/0     1   1
Immanuel Cunningham    22    2    0    1   1   1/5    20.0   0/3     0.0   0/0     0   0
Lauri Parker           22    7    6    3   0   3/5    60.0   1/2    50.0   0/0     0   0
Kobe Murray            22   17   10    2   2   5/7    71.4   3/3   100.0   5/5     2   1
Cade O'Neal            22    7    9    1   1   4/7    57.1   0/0     0.0   1/2     0   0

TEAM: FG: 38/75 (50.7%), 3PT: 8/20 (40.0%), REB: 50 (10 off, 40 def), AST: 17, TO: 12


Team_013
--------------------------------------------------------------------------------
Player                MIN  PTS  REB  AST  TO      FG   FG%      3P   3P%      FT STL BLK
--------------------------------------------------------------------------------
Manu Smith             26    5    0    4   0   3/10   30.0   1/3    33.3   0/0     0   0
Pau Mobley             26   18    5    1   0   8/11   72.7   2/5    40.0   2/2     0   2
Jayson Morant          26    4    0    0   1   2/5    40.0   0/1     0.0   0/0     0   0
Desmond Ginobili       26    8    9    2   4   4/8    50.0   0/2     0.0   2/3     1   0
Nikola Curry           26    7   11    0   2   2/5    40.0   0/0     0.0   2/2     0   0
Gary Iverson           22    9    0    1   2   3/8    37.5   1/4    25.0   0/0     0   0
Chris Bryant           22    7    3    2   2   3/7    42.9   0/2     0.0   1/1     1   0
Vince Nowitzki         22    2    0    1   0   1/4    25.0   0/1     0.0   0/0     0   0
Dirk Booker            22    3    8    2   1   3/9    33.3   0/2     0.0   1/2     0   0
Jayson Nowitzki        22    5   12    1   0   2/5    40.0   1/1   100.0   3/3     1   0

TEAM: FG: 31/72 (43.1%), 3PT: 5/21 (23.8%), REB: 46 (13 off, 33 def), AST: 14, TO: 12

================================================================================
