================================================================================
                        FULL GAME - Team_049 vs Team_092                        
================================================================================

================================================================================
                       1ST QUARTER - Team_049 vs Team_092                       
================================================================================

[12:00] Team_049 possession (Score: 0-0)
Shai Mobley attempts a Layup. BLOCKED BY JOHN GIDDEY! Ball is loose! Offensive rebound by Shai Mobley! Shai Mobley kicks it out.

[11:49] Team_049 possession (Score: 0-0)
Shai Bird attempts a 3Pt. Contested by John Giddey (4.5 feet, ZONE). SHAI BIRD MAKES IT!
Score: 3-0

[11:34] Team_092 possession (Score: 3-0)
Karl Gobert attempts a 3Pt. Contested by Ja Oladipo (4.1 feet, MAN). KARL GOBERT MAKES IT! Assist: Immanuel Ingram
Score: 3-3

[11:19] Team_049 possession (Score: 3-3)
Shai Bird attempts a Layup. Contested by John Giddey (4.5 feet, ZONE). Shai Bird misses. Rebound secured by John Giddey.

[11:03] Team_092 possession (Score: 3-3)
Paul James attempts a Midrange. Contested by Shai Mobley (4.9 feet, ZONE). PAUL JAMES MAKES IT!
Score: 3-5

[10:50] Team_049 possession (Score: 3-5)
FOUL! Reach-in foul on Immanuel Ingram during the drive. [Team fouls: 1] No free throws, side out. (Immanuel Ingram: 1 personal fouls)

[10:39] Team_049 possession (Score: 3-5)
Ja Oladipo attempts a 3Pt. Contested by Karl Gobert (5.3 feet, MAN). JA OLADIPO MAKES IT! Assist: Shai Mobley
Score: 6-5

[10:25] Team_092 possession (Score: 6-5)
John Giddey attempts a Layup. Contested by De'Aaron Allen (4.5 feet, MAN). JOHN GIDDEY MAKES IT!
Score: 6-7

[10:16] Team_049 possession (Score: 6-7)
Shai Bird attempts a 3Pt. Contested by John Giddey (4.5 feet, ZONE). Shai Bird misses. Offensive rebound by Shai Mobley! Shai Mobley puts it back in!
Score: 8-7

[10:03] Team_092 possession (Score: 8-7)
John Giddey attempts a 3Pt. Contested by Ja Oladipo (4.5 feet, ZONE). John Giddey misses. Rebound secured by Shai Mobley.

[09:49] Team_049 possession (Score: 8-7)
FOUL! Shooting foul on John Giddey. Jimmy Griffin to the line for 3 free throws. [Team fouls: 2] (John Giddey: 1 personal fouls)   FT 1/3: GOOD   FT 2/3: GOOD   FT 3/3: GOOD Jimmy Griffin makes 3/3 from the line.
Score: 11-7

[09:35] Team_092 possession (Score: 11-7)
Paul James drives and kicks out. Austin Bridges attempts a 3Pt. Contested by Ja Oladipo (4.2 feet, ZONE). Austin Bridges misses. Rebound secured by Jimmy Griffin.

[09:18] Team_049 possession (Score: 11-7)
Shai Bird drives, picks up Austin Bridges. Help arrives from Paul James! Shai Bird attempts a Layup. Contested by Paul James (4.9 feet, MAN). SHAI BIRD MAKES IT! Assist: Jimmy Griffin
Score: 13-7

[09:01] Team_092 possession (Score: 13-7)
John Giddey drives, picks up De'Aaron Allen. Help arrives from Ja Oladipo! John Giddey attempts a Dunk. Contested by Ja Oladipo (4.5 feet, MAN). JOHN GIDDEY MAKES IT! Assist: Paul James
Score: 13-9

[08:46] Team_049 possession (Score: 13-9)
FOUL! Reach-in foul on John Giddey during the drive. [Team fouls: 3] No free throws, side out. (John Giddey: 2 personal fouls)

[08:32] Team_049 possession (Score: 13-9)
De'Aaron Allen attempts a 3Pt. Contested by John Giddey (3.9 feet, ZONE). De'Aaron Allen misses. Rebound secured by Paul James.

[08:19] Team_092 possession (Score: 13-9)
Karl Gobert attempts a 3Pt. Contested by Ja Oladipo (4.1 feet, MAN). Karl Gobert misses. Rebound secured by Shai Mobley.

[08:03] Team_049 possession (Score: 13-9)
Jimmy Griffin loses the ball! Stripped by Paul James! TURNOVER! (live ball)

[07:52] Team_092 possession (Score: 13-9)
Immanuel Ingram drives and kicks out. Paul James attempts a 3Pt. Contested by Ja Oladipo (4.2 feet, ZONE). Paul James misses. Rebound secured by Shai Mobley.

[07:39] Team_049 possession (Score: 13-9)
FOUL! Reach-in foul on Austin Bridges during the drive. [Team fouls: 4] No free throws, side out. (Austin Bridges: 1 personal fouls)

[07:24] Team_049 possession (Score: 13-9)
Shai Mobley attempts a Midrange. Contested by John Giddey (4.3 feet, ZONE). SHAI MOBLEY MAKES IT! Assist: Shai Bird
Score: 15-9

[07:06] Team_092 possession (Score: 15-9)
Austin Bridges attempts a 3Pt. Contested by De'Aaron Allen (4.0 feet, ZONE). Austin Bridges misses. Rebound secured by Shai Mobley.

[06:53] Team_049 possession (Score: 15-9)
Shai Bird drives, picks up John Giddey. Help arrives from Austin Bridges! Shai Bird attempts a Layup. Contested by Austin Bridges (4.5 feet, ZONE). Shai Bird misses. Rebound secured by Paul James.

[06:41] Team_092 possession (Score: 15-9)
Paul James attempts a 3Pt. Contested by Ja Oladipo (4.9 feet, ZONE). Paul James misses. Rebound secured by Shai Mobley.

[06:22] Team_049 possession (Score: 15-9)
De'Aaron Allen drives, John Giddey stays with him. De'Aaron Allen attempts a Dunk. Contested by John Giddey (3.9 feet, MAN). DE'AARON ALLEN MAKES IT! Assist: Shai Mobley
Score: 17-9

[06:12] Team_092 possession (Score: 17-9)
Austin Bridges attempts a 3Pt. Contested by Ja Oladipo (4.0 feet, ZONE). Austin Bridges misses. Rebound secured by Shai Mobley.

[05:58] Team_049 possession (Score: 17-9)
Jimmy Griffin attempts a Midrange. Contested by Paul James (4.8 feet, MAN). JIMMY GRIFFIN MAKES IT! Assist: Shai Bird
Score: 19-9

[05:45] Team_092 possession (Score: 19-9)
Immanuel Ingram attempts a Layup. Contested by De'Aaron Allen (4.1 feet, ZONE). Immanuel Ingram misses. Offensive rebound by John Giddey! John Giddey kicks it out.

[05:33] Team_092 possession (Score: 19-9)
Paul James drives and kicks out. Paul James attempts a Midrange. Contested by Jimmy Griffin (4.7 feet, ZONE). Paul James misses. Rebound secured by De'Aaron Allen.

[05:19] Team_049 possession (Score: 19-9)
Shai Mobley attempts a Layup. BLOCKED BY JOHN GIDDEY! Ball is loose! Rebound secured by Paul James.

[04:59] Team_092 possession (Score: 19-9)
FOUL! Holding foul on Jimmy Griffin. [Team fouls: 1] No free throws, side out. (Jimmy Griffin: 1 personal fouls)

[04:43] Team_092 possession (Score: 19-9)
John Giddey attempts a Layup. Contested by De'Aaron Allen (4.6 feet, ZONE). JOHN GIDDEY MAKES IT! Assist: Paul James
Score: 19-11

[04:26] Team_049 possession (Score: 19-11)
Jimmy Griffin drives and kicks out. Shai Mobley attempts a 3Pt. Contested by Immanuel Ingram (4.1 feet, MAN). Shai Mobley misses. Rebound secured by Paul James.

[04:12] Team_092 possession (Score: 19-11)
Austin Bridges attempts a Layup. Contested by De'Aaron Allen (4.1 feet, ZONE). AUSTIN BRIDGES MAKES IT!
Score: 19-13

[03:55] Team_049 possession (Score: 19-13)
De'Aaron Allen attempts a 3Pt. Contested by John Giddey (4.0 feet, MAN). De'Aaron Allen misses. Rebound secured by John Giddey.

[03:40] Team_092 possession (Score: 19-13)
FOUL! Holding foul on Jimmy Griffin. [Team fouls: 2] No free throws, side out. (Jimmy Griffin: 2 personal fouls)

[03:26] Team_092 possession (Score: 19-13)
Immanuel Ingram attempts a 3Pt. Contested by Ja Oladipo (4.3 feet, ZONE). Immanuel Ingram misses. Rebound secured by Jimmy Griffin.

[03:12] Team_049 possession (Score: 19-13)
De'Aaron Allen makes the Layup and draws the foul on Austin Bridges! And-1! De'Aaron Allen to the line for 1. [BONUS: 5 team fouls] (Austin Bridges: 2 personal fouls)   FT 1/1: GOOD De'Aaron Allen makes 1/1 from the line.
Score: 22-13

[03:02] Team_092 possession (Score: 22-13)
Austin Bridges attempts a Midrange. Contested by Shai Bird (3.9 feet, MAN). AUSTIN BRIDGES MAKES IT! Assist: Karl Gobert
Score: 22-15

[02:48] Team_049 possession (Score: 22-15)
Ja Oladipo attempts a 3Pt. Contested by Karl Gobert (5.5 feet, MAN). Ja Oladipo misses. Rebound secured by John Giddey.

[02:36] Team_092 possession (Score: 22-15)
Austin Bridges attempts a 3Pt. Contested by Ja Oladipo (4.3 feet, ZONE). AUSTIN BRIDGES MAKES IT!
Score: 22-18

[02:21] Team_049 possession (Score: 22-18)
Shai Bird attempts a Midrange. Contested by John Giddey (4.8 feet, ZONE). SHAI BIRD MAKES IT! Assist: Shai Mobley
Score: 24-18

[02:09] Team_092 possession (Score: 24-18)
Paul James attempts a 3Pt. Contested by Ja Oladipo (5.2 feet, ZONE). Paul James misses. Offensive rebound by John Giddey! John Giddey kicks it out.

[01:53] Team_092 possession (Score: 24-18)
Immanuel Ingram attempts a Layup. BLOCKED BY SHAI MOBLEY! Ball is loose! Rebound secured by De'Aaron Allen.

[01:38] Team_049 possession (Score: 24-18)
Ja Oladipo drives, Karl Gobert stays with him. Ja Oladipo attempts a Layup. Contested by Karl Gobert (5.6 feet, MAN). Ja Oladipo misses. Rebound secured by Paul James.

[01:23] Team_092 possession (Score: 24-18)
Karl Gobert attempts a 3Pt. Contested by Ja Oladipo (4.5 feet, ZONE). Karl Gobert misses. Rebound secured by De'Aaron Allen.

[01:05] Team_049 possession (Score: 24-18)
Shai Mobley drives and kicks out. De'Aaron Allen attempts a Midrange. Contested by Paul James (5.1 feet, ZONE). De'Aaron Allen misses. Rebound secured by Paul James.

[00:52] Team_092 possession (Score: 24-18)
Karl Gobert drives to the basket... Karl Gobert loses the ball! Stripped by Shai Mobley! TURNOVER! (live ball)

[00:38] Team_049 possession (Score: 24-18)
Shai Bird drives and kicks out. Ja Oladipo attempts a Midrange. Contested by John Giddey (4.6 feet, ZONE). Ja Oladipo misses. Rebound secured by John Giddey.

[00:27] Team_092 possession (Score: 24-18)
Karl Gobert attempts a Midrange. Contested by Jimmy Griffin (5.0 feet, ZONE). Karl Gobert misses. Rebound secured by Jimmy Griffin.

[00:14] Team_049 possession (Score: 24-18)
FOUL! Shooting foul on Paul James. Jimmy Griffin to the line for 2 free throws. [BONUS: 6 team fouls] (Paul James: 1 personal fouls)   FT 1/2: GOOD   FT 2/2: GOOD Jimmy Griffin makes 2/2 from the line.
Score: 26-18

[00:03] Team_092 possession (Score: 26-18)
Immanuel Ingram attempts a Midrange. Contested by De'Aaron Allen (4.6 feet, ZONE). Immanuel Ingram misses. Rebound secured by Jimmy Griffin.

================================================================================
                              1ST QUARTER COMPLETE                              
================================================================================

1ST QUARTER SCORE: Team_049 26, Team_092 18

BOX SCORE:
================================================================================

Team_049
--------------------------------------------------------------------------------
Player                MIN  PTS  REB  AST  TO      FG   FG%      3P   3P%
--------------------------------------------------------------------------------
Shai Bird              12    7    0    2   0   3/6    50.0     0/0   0.0
Jimmy Griffin          12    7    4    1   0   3/4    75.0     0/0   0.0
De'Aaron Allen         12    5    3    0   0   2/4    50.0     0/0   0.0
Shai Mobley            12    4    8    3   0   2/4    50.0     0/0   0.0
Ja Oladipo             12    3    0    0   0   1/3    33.3     0/0   0.0

TEAM: FG: 11/21 (52.4%), 3PT: 4/7 (57.1%), REB: 15 (2 off, 13 def), AST: 6, TO: 1
TEAM FOULS: 2


Team_092
--------------------------------------------------------------------------------
Player                MIN  PTS  REB  AST  TO      FG   FG%      3P   3P%
--------------------------------------------------------------------------------
Austin Bridges         12    7    0    0   0   3/5    60.0     0/0   0.0
John Giddey            12    6    6    0   0   3/4    75.0     0/0   0.0
Karl Gobert            12    3    0    1   0   1/4    25.0     0/0   0.0
Paul James             12    2    6    2   0   1/4    25.0     0/0   0.0
Immanuel Ingram        12    0    0    1   0   0/4     0.0     0/0   0.0

TEAM: FG: 8/21 (38.1%), 3PT: 2/9 (22.2%), REB: 12 (2 off, 10 def), AST: 4, TO: 1
TEAM FOULS: 6 [Team_049 in BONUS]

================================================================================

================================================================================
                       2ND QUARTER - Team_049 vs Team_092                       
================================================================================

[12:00] Team_049 possession (Score: 26-18)
De'Aaron Allen attempts a Midrange. Contested by John Giddey (4.3 feet, MAN). De'Aaron Allen misses. Rebound secured by John Giddey.

[11:45] Team_092 possession (Score: 26-18)
John Giddey attempts a Layup. Contested by De'Aaron Allen (4.8 feet, MAN). JOHN GIDDEY MAKES IT!
Score: 26-20

[11:30] Team_049 possession (Score: 26-20)
FOUL! Reach-in foul on John Giddey during the drive. [Team fouls: 1] No free throws, side out. (John Giddey: 1 personal fouls)

[11:17] Team_049 possession (Score: 26-20)
Jimmy Griffin drives to the basket... Jimmy Griffin throws a bad pass out of bounds! TURNOVER! (dead ball)

[11:17] Substitution (Team_049): Shai Bird OUT → Shaquille Lillard IN (stamina_rule2)

[11:17] Substitution (Team_049): Ja Oladipo OUT → Shai Jordan IN (stamina_rule2)

[11:17] Substitution (Team_049): Jimmy Griffin OUT → Desmond Towns IN (stamina_rule2)

[11:17] Substitution (Team_049): De'Aaron Allen OUT → Giannis Anunoby IN (stamina_rule2)

[11:17] Substitution (Team_049): Shai Mobley OUT → Miles Jackson IN (stamina_rule2)

[11:17] Substitution (Team_092): Austin Bridges OUT → Bones Giddey IN (stamina_rule2)

[11:17] Substitution (Team_092): Karl Gobert OUT → Shaquille Russell IN (stamina_rule2)

[11:17] Substitution (Team_092): Paul James OUT → Vince Harris IN (stamina_rule2)

[11:17] Substitution (Team_092): John Giddey OUT → Shaquille Paul IN (stamina_rule2)

[11:17] Substitution (Team_092): Immanuel Ingram OUT → Pau Reaves IN (stamina_rule2)

[11:05] Team_092 possession (Score: 26-20)
Shaquille Russell attempts a Layup. Contested by Miles Jackson (3.8 feet, ZONE). SHAQUILLE RUSSELL MAKES IT!
Score: 26-22

[10:47] Team_049 possession (Score: 26-22)
Shaquille Lillard attempts a 3Pt. Contested by Bones Giddey (5.4 feet, MAN). SHAQUILLE LILLARD MAKES IT! Assist: Miles Jackson
Score: 29-22

[10:31] Team_092 possession (Score: 29-22)
Shaquille Paul attempts a 3Pt. Contested by Giannis Anunoby (5.2 feet, MAN). Shaquille Paul misses. Rebound secured by Shai Jordan.

[10:21] Team_049 possession (Score: 29-22)
Desmond Towns attempts a 3Pt. Contested by Shaquille Russell (4.3 feet, ZONE). Desmond Towns misses. Offensive rebound by Giannis Anunoby! Giannis Anunoby kicks it out.

[10:02] Team_049 possession (Score: 29-22)
Shai Jordan attempts a 3Pt. Contested by Vince Harris (4.2 feet, ZONE). Shai Jordan misses. Rebound secured by Shaquille Russell.

[09:49] Team_092 possession (Score: 29-22)
FOUL! Shooting foul on Giannis Anunoby. Shaquille Paul to the line for 3 free throws. [Team fouls: 1] (Giannis Anunoby: 1 personal fouls)   FT 1/3: GOOD   FT 2/3: GOOD   FT 3/3: GOOD Shaquille Paul makes 3/3 from the line.
Score: 29-25

[09:36] Team_049 possession (Score: 29-25)
Miles Jackson attempts a Layup. Contested by Pau Reaves (4.8 feet, MAN). Miles Jackson misses. Offensive rebound by Giannis Anunoby! Giannis Anunoby kicks it out.

[09:19] Team_049 possession (Score: 29-25)
FOUL! Shooting foul on Pau Reaves. Giannis Anunoby to the line for 2 free throws. [Team fouls: 2] (Pau Reaves: 1 personal fouls)   FT 1/2: MISS   FT 2/2: GOOD Giannis Anunoby makes 1/2 from the line.
Score: 30-25

[09:08] Team_092 possession (Score: 30-25)
FOUL! Offensive foul on Vince Harris! Desmond Towns drew the charge! [Team fouls: 3] (Vince Harris: 1 personal fouls) TURNOVER! (dead ball)

[08:50] Team_049 possession (Score: 30-25)
Miles Jackson attempts a Layup. BLOCKED BY PAU REAVES! Ball is loose! Offensive rebound by Miles Jackson! Miles Jackson kicks it out.

[08:37] Team_049 possession (Score: 30-25)
Shai Jordan drives to the basket... Shai Jordan commits a violation (traveling/carry)! TURNOVER! (dead ball)

[08:22] Team_092 possession (Score: 30-25)
Shaquille Russell attempts a 3Pt. Wide open! Shai Jordan is 6.5 feet away. [MAN] Shaquille Russell misses. Rebound secured by Miles Jackson.

[08:07] Team_049 possession (Score: 30-25)
FOUL! Shooting foul on Bones Giddey. Shaquille Lillard to the line for 2 free throws. [Team fouls: 4] (Bones Giddey: 1 personal fouls)   FT 1/2: GOOD   FT 2/2: GOOD Shaquille Lillard makes 2/2 from the line.
Score: 32-25

[07:55] Team_092 possession (Score: 32-25)
FOUL! Holding foul on Shai Jordan. [Team fouls: 2] No free throws, side out. (Shai Jordan: 1 personal fouls)

[07:46] Team_092 possession (Score: 32-25)
Vince Harris makes the 3Pt and draws the foul on Desmond Towns! And-1! Vince Harris to the line for 1. [Team fouls: 3] (Desmond Towns: 1 personal fouls)   FT 1/1: GOOD Vince Harris makes 1/1 from the line.
Score: 32-29

[07:35] Team_049 possession (Score: 32-29)
Desmond Towns attempts a Midrange. Contested by Vince Harris (4.2 feet, MAN). DESMOND TOWNS MAKES IT!
Score: 34-29

[07:24] Team_092 possession (Score: 34-29)
Pau Reaves attempts a Midrange. Contested by Desmond Towns (4.8 feet, ZONE). PAU REAVES MAKES IT!
Score: 34-31

[07:14] Team_049 possession (Score: 34-31)
Giannis Anunoby drives to the basket... Giannis Anunoby loses the ball! Stripped by Shaquille Paul! TURNOVER! (live ball)

[06:55] Team_092 possession (Score: 34-31)
FOUL! Shooting foul on Miles Jackson. Pau Reaves to the line for 2 free throws. [Team fouls: 4] (Miles Jackson: 1 personal fouls)   FT 1/2: MISS   FT 2/2: GOOD Pau Reaves makes 1/2 from the line.
Score: 34-32

[06:39] Team_049 possession (Score: 34-32)
Miles Jackson attempts a 3Pt. Contested by Pau Reaves (4.8 feet, MAN). Miles Jackson misses. Rebound secured by Pau Reaves.

[06:25] Team_092 possession (Score: 34-32)
Shaquille Paul drives, Giannis Anunoby stays with him. Shaquille Paul attempts a Dunk. Contested by Giannis Anunoby (5.2 feet, MAN). Shaquille Paul misses. Rebound secured by Miles Jackson.

[06:12] Team_049 possession (Score: 34-32)
Shai Jordan attempts a Layup. Contested by Shaquille Russell (4.2 feet, MAN). Shai Jordan misses. Rebound secured by Shaquille Paul.

[05:54] Team_092 possession (Score: 34-32)
Pau Reaves attempts a Layup. BLOCKED BY SHAI JORDAN! Ball is loose! Rebound secured by Miles Jackson.

[05:43] Team_049 possession (Score: 34-32)
Giannis Anunoby attempts a Midrange. BLOCKED BY VINCE HARRIS! Ball is loose! Rebound secured by Pau Reaves.

[05:23] Team_092 possession (Score: 34-32)
Pau Reaves drives, Miles Jackson stays with him. Pau Reaves attempts a Layup. Contested by Miles Jackson (3.7 feet, MAN). Pau Reaves misses. Rebound secured by Shai Jordan.

[05:08] Team_049 possession (Score: 34-32)
Miles Jackson attempts a 3Pt. Contested by Vince Harris (4.2 feet, ZONE). MILES JACKSON MAKES IT! Assist: Giannis Anunoby
Score: 37-32

[04:54] Team_092 possession (Score: 37-32)
Bones Giddey drives to the basket... FOUL! Offensive foul on Bones Giddey! Miles Jackson drew the charge! [Team fouls: 5] (Bones Giddey: 2 personal fouls) TURNOVER! (dead ball)

[04:42] Team_049 possession (Score: 37-32)
Desmond Towns attempts a 3Pt. Contested by Vince Harris (4.2 feet, MAN). Desmond Towns misses. Rebound secured by Shaquille Russell.

[04:28] Team_092 possession (Score: 37-32)
Shaquille Russell drives and kicks out. Vince Harris attempts a Midrange. Wide open! Shai Jordan is 6.1 feet away. [ZONE] VINCE HARRIS MAKES IT! Assist: Shaquille Paul
Score: 37-34

[04:13] Team_049 possession (Score: 37-34)
Desmond Towns drives and kicks out. FOUL! Shooting foul on Pau Reaves. Shaquille Lillard to the line for 2 free throws. [BONUS: 6 team fouls] (Pau Reaves: 2 personal fouls)   FT 1/2: GOOD   FT 2/2: GOOD Shaquille Lillard makes 2/2 from the line.
Score: 39-34

[04:02] Team_092 possession (Score: 39-34)
Shaquille Russell attempts a 3Pt. Contested by Shaquille Lillard (5.0 feet, ZONE). Shaquille Russell misses. Rebound secured by Giannis Anunoby.

[03:50] Team_049 possession (Score: 39-34)
Miles Jackson attempts a Midrange. Contested by Pau Reaves (4.9 feet, MAN). MILES JACKSON MAKES IT!
Score: 41-34

[03:37] Team_092 possession (Score: 41-34)
Vince Harris attempts a Layup. Contested by Miles Jackson (3.6 feet, ZONE). VINCE HARRIS MAKES IT!
Score: 41-36

[03:21] Team_049 possession (Score: 41-36)
Shai Jordan attempts a 3Pt. Contested by Vince Harris (4.3 feet, ZONE). Shai Jordan misses. Offensive rebound by Miles Jackson! Miles Jackson's putback is no good. Rebound secured by Shaquille Russell.

[03:02] Team_092 possession (Score: 41-36)
Bones Giddey attempts a Layup. Contested by Shaquille Lillard (4.3 feet, MAN). Bones Giddey misses. Rebound secured by Miles Jackson.

[02:49] Team_049 possession (Score: 41-36)
Desmond Towns attempts a 3Pt. Contested by Vince Harris (4.4 feet, MAN). Desmond Towns misses. Rebound secured by Shaquille Russell.

[02:34] Team_092 possession (Score: 41-36)
Pau Reaves attempts a Layup. BLOCKED BY SHAI JORDAN! Ball is loose! Rebound secured by Shai Jordan.

[02:18] Team_049 possession (Score: 41-36)
Giannis Anunoby attempts a Midrange. Contested by Shaquille Paul (5.8 feet, MAN). Giannis Anunoby misses. Offensive rebound by Giannis Anunoby! Giannis Anunoby kicks it out.

[02:00] Team_049 possession (Score: 41-36)
Shaquille Lillard drives to the basket... Shaquille Lillard throws a bad pass! Stolen by Bones Giddey! TURNOVER! (live ball)

[01:47] Team_092 possession (Score: 41-36)
Bones Giddey attempts a 3Pt. Contested by Shaquille Lillard (4.4 feet, MAN). Bones Giddey misses. Offensive rebound by Shaquille Paul! Shaquille Paul kicks it out.

[01:34] Team_092 possession (Score: 41-36)
Shaquille Russell attempts a Layup. Contested by Miles Jackson (4.1 feet, ZONE). Shaquille Russell misses. Rebound secured by Miles Jackson.

[01:16] Team_049 possession (Score: 41-36)
Shai Jordan attempts a 3Pt. Contested by Vince Harris (4.5 feet, ZONE). Shai Jordan misses. Rebound secured by Vince Harris.

[01:01] Team_092 possession (Score: 41-36)
FOUL! Shooting foul on Shai Jordan. Pau Reaves to the line for 2 free throws. [BONUS: 5 team fouls] (Shai Jordan: 2 personal fouls)   FT 1/2: GOOD   FT 2/2: GOOD Pau Reaves makes 2/2 from the line.
Score: 41-38

[00:46] Team_049 possession (Score: 41-38)
Miles Jackson attempts a Midrange. Contested by Pau Reaves (5.2 feet, MAN). Miles Jackson misses. Rebound secured by Shaquille Paul.

[00:34] Team_092 possession (Score: 41-38)
FOUL! Shooting foul on Shaquille Lillard. Bones Giddey to the line for 2 free throws. [BONUS: 6 team fouls] (Shaquille Lillard: 1 personal fouls)   FT 1/2: GOOD   FT 2/2: MISS Bones Giddey makes 1/2 from the line. Rebound secured by Miles Jackson.
Score: 41-39

[00:17] Team_049 possession (Score: 41-39)
Shai Jordan drives, picks up Pau Reaves. Help arrives from Shaquille Russell! Shai Jordan attempts a Layup. Contested by Shaquille Russell (5.3 feet, ZONE). Shai Jordan misses. Rebound secured by Vince Harris.

[00:06] Team_092 possession (Score: 41-39)
Bones Giddey attempts a 3Pt. Contested by Shaquille Lillard (4.6 feet, MAN). Bones Giddey misses. Rebound secured by Giannis Anunoby.

================================================================================
                              2ND QUARTER COMPLETE                              
================================================================================

2ND QUARTER SCORE: Team_049 15, Team_092 21

BOX SCORE:
================================================================================

Team_049
--------------------------------------------------------------------------------
Player                MIN  PTS  REB  AST  TO      FG   FG%      3P   3P%
--------------------------------------------------------------------------------
Shaquille Lillard      11    7    0    0   0   3/3   100.0     0/0   0.0
Miles Jackson          11    5    7    1   0   2/4    50.0     0/0   0.0
Desmond Towns          11    2    0    0   0   1/3    33.3     0/0   0.0
Giannis Anunoby        11    1    5    1   0   1/2    50.0     0/0   0.0
De'Aaron Allen         13    0    0    0   0   0/1     0.0     0/0   0.0
Shai Jordan            11    0    3    0   0   0/5     0.0     0/0   0.0

TEAM: FG: 7/18 (38.9%), 3PT: 2/8 (25.0%), REB: 16 (5 off, 11 def), AST: 2, TO: 4
TEAM FOULS: 6 [Team_092 in BONUS]


Team_092
--------------------------------------------------------------------------------
Player                MIN  PTS  REB  AST  TO      FG   FG%      3P   3P%
--------------------------------------------------------------------------------
Vince Harris           11    8    2    0   0   3/3   100.0     0/0   0.0
Pau Reaves             11    5    2    0   0   3/6    50.0     0/0   0.0
Shaquille Paul         11    3    3    1   0   1/3    33.3     0/0   0.0
John Giddey            13    2    1    0   0   1/1   100.0     0/0   0.0
Shaquille Russell      11    2    4    0   0   1/4    25.0     0/0   0.0
Bones Giddey           11    0    0    0   0   0/3     0.0     0/0   0.0

TEAM: FG: 9/20 (45.0%), 3PT: 2/6 (33.3%), REB: 11 (1 off, 10 def), AST: 1, TO: 2
TEAM FOULS: 6 [Team_049 in BONUS]

================================================================================

================================================================================
                       3RD QUARTER - Team_049 vs Team_092                       
================================================================================

[12:00] Team_049 possession (Score: 41-39)
De'Aaron Allen attempts a 3Pt. Contested by John Giddey (3.9 feet, ZONE). De'Aaron Allen misses. Rebound secured by Paul James.

[11:41] Team_092 possession (Score: 41-39)
John Giddey drives, De'Aaron Allen stays with him. John Giddey attempts a Dunk. Contested by De'Aaron Allen (4.5 feet, MAN). JOHN GIDDEY MAKES IT! Assist: Karl Gobert
Score: 41-41

[11:27] Team_049 possession (Score: 41-41)
Ja Oladipo drives, John Giddey stays with him. Ja Oladipo attempts a Layup. Contested by John Giddey (4.3 feet, ZONE). Ja Oladipo misses. Offensive rebound by Jimmy Griffin! Jimmy Griffin kicks it out.

[11:11] Team_049 possession (Score: 41-41)
De'Aaron Allen drives and kicks out. Shai Bird attempts a Midrange. BLOCKED BY KARL GOBERT! Ball is loose! Rebound secured by Paul James.

[10:58] Team_092 possession (Score: 41-41)
Paul James attempts a 3Pt. Contested by Jimmy Griffin (5.3 feet, MAN). Paul James misses. Rebound secured by De'Aaron Allen.

[10:43] Team_049 possession (Score: 41-41)
Shai Mobley attempts a Midrange. Contested by Immanuel Ingram (4.3 feet, MAN). Shai Mobley misses. Rebound secured by John Giddey.

[10:29] Team_092 possession (Score: 41-41)
Karl Gobert drives and kicks out. John Giddey attempts a 3Pt. Contested by Ja Oladipo (4.2 feet, ZONE). JOHN GIDDEY MAKES IT! Assist: Paul James
Score: 41-44

[10:18] Team_049 possession (Score: 41-44)
Jimmy Griffin attempts a 3Pt. Contested by Paul James (4.8 feet, MAN). Jimmy Griffin misses. Offensive rebound by Shai Mobley! Shai Mobley puts it back in!
Score: 43-44

[10:07] Team_092 possession (Score: 43-44)
Karl Gobert attempts a 3Pt. Contested by Ja Oladipo (4.1 feet, MAN). Karl Gobert misses. Offensive rebound by John Giddey! John Giddey kicks it out.

[09:54] Team_092 possession (Score: 43-44)
Paul James drives to the basket... Paul James throws a bad pass! Stolen by Jimmy Griffin! TURNOVER! (live ball)

[09:41] Team_049 possession (Score: 43-44)
Shai Mobley drives to the basket... Shai Mobley throws a bad pass out of bounds! TURNOVER! (dead ball)

[09:26] Team_092 possession (Score: 43-44)
Immanuel Ingram attempts a Midrange. Contested by Shai Mobley (4.1 feet, MAN). IMMANUEL INGRAM MAKES IT!
Score: 43-46

[09:10] Team_049 possession (Score: 43-46)
Jimmy Griffin attempts a 3Pt. Contested by Paul James (4.8 feet, MAN). JIMMY GRIFFIN MAKES IT! Assist: Ja Oladipo
Score: 46-46

[08:57] Team_092 possession (Score: 46-46)
Karl Gobert attempts a Layup. Contested by De'Aaron Allen (4.1 feet, ZONE). Karl Gobert misses. Rebound secured by Shai Mobley.

[08:43] Team_049 possession (Score: 46-46)
Ja Oladipo attempts a 3Pt. Contested by Karl Gobert (5.3 feet, MAN). Ja Oladipo misses. Offensive rebound by Shai Mobley! Shai Mobley puts it back in!
Score: 48-46

[08:26] Team_092 possession (Score: 48-46)
Paul James drives, picks up De'Aaron Allen. Help arrives from Ja Oladipo! Paul James attempts a Dunk. Contested by Ja Oladipo (4.9 feet, ZONE). PAUL JAMES MAKES IT! Assist: John Giddey
Score: 48-48

[08:09] Team_049 possession (Score: 48-48)
FOUL! Shooting foul on Austin Bridges. Ja Oladipo to the line for 2 free throws. [Team fouls: 1] (Austin Bridges: 1 personal fouls)   FT 1/2: GOOD   FT 2/2: GOOD Ja Oladipo makes 2/2 from the line.
Score: 50-48

[07:55] Team_092 possession (Score: 50-48)
Immanuel Ingram attempts a Layup. BLOCKED BY SHAI MOBLEY! Ball deflects out of bounds off Immanuel Ingram.

[07:40] Team_049 possession (Score: 50-48)
FOUL! Holding foul on Karl Gobert. [Team fouls: 2] No free throws, side out. (Karl Gobert: 1 personal fouls)

[07:23] Team_049 possession (Score: 50-48)
Jimmy Griffin attempts a 3Pt. Contested by Paul James (4.8 feet, MAN). JIMMY GRIFFIN MAKES IT! Assist: Shai Mobley
Score: 53-48

[07:05] Team_092 possession (Score: 53-48)
Immanuel Ingram attempts a Layup. BLOCKED BY DE'AARON ALLEN! Ball is loose! Rebound secured by De'Aaron Allen.

[06:51] Team_049 possession (Score: 53-48)
FOUL! Holding foul on Karl Gobert. [Team fouls: 3] No free throws, side out. (Karl Gobert: 2 personal fouls)

[06:40] Team_049 possession (Score: 53-48)
De'Aaron Allen attempts a Layup. Contested by John Giddey (3.9 feet, ZONE). DE'AARON ALLEN MAKES IT! Assist: Jimmy Griffin
Score: 55-48

[06:28] Team_092 possession (Score: 55-48)
Immanuel Ingram attempts a 3Pt. Contested by Ja Oladipo (4.1 feet, ZONE). Immanuel Ingram misses. Offensive rebound by Paul James! Paul James kicks it out.

[06:14] Team_092 possession (Score: 55-48)
Paul James attempts a Layup. Contested by De'Aaron Allen (4.9 feet, ZONE). Paul James misses. Rebound secured by De'Aaron Allen.

[06:00] Team_049 possession (Score: 55-48)
FOUL! Shooting foul on John Giddey. Ja Oladipo to the line for 2 free throws. [Team fouls: 4] (John Giddey: 1 personal fouls)   FT 1/2: GOOD   FT 2/2: GOOD Ja Oladipo makes 2/2 from the line.
Score: 57-48

[05:46] Team_092 possession (Score: 57-48)
Paul James attempts a Midrange. Contested by Ja Oladipo (4.9 feet, ZONE). Paul James misses. Rebound secured by De'Aaron Allen.

[05:31] Team_049 possession (Score: 57-48)
Shai Mobley drives to the basket... Shai Mobley throws a bad pass out of bounds! TURNOVER! (dead ball)

[05:21] Team_092 possession (Score: 57-48)
FOUL! Reach-in foul on De'Aaron Allen during the drive. [Team fouls: 1] No free throws, side out. (De'Aaron Allen: 1 personal fouls)

[05:06] Team_092 possession (Score: 57-48)
Immanuel Ingram attempts a Layup. BLOCKED BY DE'AARON ALLEN! Ball is loose! Rebound secured by De'Aaron Allen.

[04:50] Team_049 possession (Score: 57-48)
Ja Oladipo attempts a Midrange. Contested by Immanuel Ingram (4.3 feet, ZONE). Ja Oladipo misses. FOUL! Loose ball foul on Paul James during the rebound battle. [IN THE BONUS! 5 team fouls] Shai Mobley to the line for 2 free throws. (Paul James: 1 personal fouls)   FT 1/2: GOOD   FT 2/2: MISS Shai Mobley makes 1/2 from the line. Offensive rebound by Shai Mobley! Shai Mobley's putback is no good.
Score: 58-48

[04:34] Team_092 possession (Score: 58-48)
John Giddey drives and kicks out. Paul James attempts a 3Pt. Contested by Ja Oladipo (4.3 feet, ZONE). Paul James misses. Rebound secured by Shai Mobley.

[04:18] Team_049 possession (Score: 58-48)
De'Aaron Allen attempts a Midrange. Contested by John Giddey (4.0 feet, MAN). De'Aaron Allen misses. Rebound secured by Paul James.

[04:08] Team_092 possession (Score: 58-48)
Karl Gobert attempts a 3Pt. Contested by Ja Oladipo (4.2 feet, ZONE). Karl Gobert misses. Rebound secured by Shai Mobley.

[03:53] Team_049 possession (Score: 58-48)
Shai Mobley attempts a Midrange. Contested by Immanuel Ingram (4.4 feet, MAN). SHAI MOBLEY MAKES IT!
Score: 60-48

[03:38] Team_092 possession (Score: 60-48)
FOUL! Shooting foul on Shai Mobley. Immanuel Ingram to the line for 2 free throws. [Team fouls: 2] (Shai Mobley: 1 personal fouls)   FT 1/2: GOOD   FT 2/2: GOOD Immanuel Ingram makes 2/2 from the line.
Score: 60-50

[03:26] Team_049 possession (Score: 60-50)
Shai Mobley drives to the basket... Shai Mobley commits a violation (traveling/carry)! TURNOVER! (dead ball)

[03:07] Team_092 possession (Score: 60-50)
Karl Gobert attempts a 3Pt. Contested by Ja Oladipo (4.3 feet, MAN). Karl Gobert misses. Offensive rebound by Paul James! Paul James kicks it out.

[02:51] Team_092 possession (Score: 60-50)
Austin Bridges attempts a 3Pt. Contested by Shai Bird (3.9 feet, MAN). Austin Bridges misses. Rebound secured by De'Aaron Allen.

[02:38] Team_049 possession (Score: 60-50)
FOUL! Offensive foul on Shai Bird! Austin Bridges drew the charge! [Team fouls: 3] (Shai Bird: 1 personal fouls) TURNOVER! (dead ball)

[02:28] Team_092 possession (Score: 60-50)
Austin Bridges drives to the basket... Austin Bridges throws a bad pass! Stolen by Shai Bird! TURNOVER! (live ball)

[02:14] Team_049 possession (Score: 60-50)
De'Aaron Allen attempts a 3Pt. Contested by John Giddey (4.2 feet, MAN). DE'AARON ALLEN MAKES IT! Assist: Shai Mobley
Score: 63-50

[01:59] Team_092 possession (Score: 63-50)
Immanuel Ingram drives and kicks out. John Giddey attempts a 3Pt. Contested by De'Aaron Allen (4.6 feet, MAN). JOHN GIDDEY MAKES IT! Assist: Austin Bridges
Score: 63-53

[01:45] Team_049 possession (Score: 63-53)
Shai Bird drives, John Giddey stays with him. Shai Bird attempts a Layup. Contested by John Giddey (4.8 feet, ZONE). SHAI BIRD MAKES IT!
Score: 65-53

[01:31] Team_092 possession (Score: 65-53)
Immanuel Ingram drives and kicks out. Immanuel Ingram attempts a Midrange. Contested by Ja Oladipo (4.6 feet, ZONE). IMMANUEL INGRAM MAKES IT!
Score: 65-55

[01:18] Team_049 possession (Score: 65-55)
Ja Oladipo drives, John Giddey stays with him. Ja Oladipo attempts a Layup. Contested by John Giddey (4.7 feet, ZONE). Ja Oladipo misses. Rebound secured by John Giddey.

[01:02] Team_092 possession (Score: 65-55)
John Giddey attempts a 3Pt. Contested by Ja Oladipo (4.9 feet, ZONE). JOHN GIDDEY MAKES IT! Assist: Karl Gobert
Score: 65-58

[00:50] Team_049 possession (Score: 65-58)
Ja Oladipo attempts a 3Pt. Contested by Karl Gobert (5.6 feet, MAN). Ja Oladipo misses. FOUL! Loose ball foul on Paul James during the rebound battle. [IN THE BONUS! 6 team fouls] De'Aaron Allen to the line for 2 free throws. (Paul James: 2 personal fouls)   FT 1/2: GOOD   FT 2/2: GOOD De'Aaron Allen makes 2/2 from the line.
Score: 67-58

[00:34] Team_092 possession (Score: 67-58)
Karl Gobert attempts a 3Pt. Contested by Ja Oladipo (4.6 feet, MAN). Karl Gobert misses. Offensive rebound by Paul James! Paul James kicks it out.

[00:19] Team_092 possession (Score: 67-58)
Karl Gobert drives to the basket... Karl Gobert loses control! Ball rolls out of bounds! TURNOVER! (dead ball)

[00:19] Substitution (Team_049): Shai Bird OUT → Shaquille Lillard IN (stamina_rule2)

[00:19] Substitution (Team_049): Ja Oladipo OUT → Shai Jordan IN (stamina_rule2)

[00:19] Substitution (Team_049): Jimmy Griffin OUT → Desmond Towns IN (stamina_rule2)

[00:19] Substitution (Team_049): De'Aaron Allen OUT → Giannis Anunoby IN (stamina_rule2)

[00:19] Substitution (Team_049): Shai Mobley OUT → Miles Jackson IN (stamina_rule2)

[00:19] Substitution (Team_092): Austin Bridges OUT → Bones Giddey IN (stamina_rule2)

[00:19] Substitution (Team_092): Karl Gobert OUT → Shaquille Russell IN (stamina_rule2)

[00:19] Substitution (Team_092): Paul James OUT → Vince Harris IN (stamina_rule2)

[00:19] Substitution (Team_092): John Giddey OUT → Shaquille Paul IN (stamina_rule2)

[00:19] Substitution (Team_092): Immanuel Ingram OUT → Pau Reaves IN (stamina_rule2)

[00:02] Team_049 possession (Score: 67-58)
Shai Jordan attempts a Layup. Contested by Pau Reaves (4.9 feet, ZONE). SHAI JORDAN MAKES IT!
Score: 69-58

================================================================================
                              3RD QUARTER COMPLETE                              
================================================================================

3RD QUARTER SCORE: Team_049 28, Team_092 19

BOX SCORE:
================================================================================

Team_049
--------------------------------------------------------------------------------
Player                MIN  PTS  REB  AST  TO      FG   FG%      3P   3P%
--------------------------------------------------------------------------------
De'Aaron Allen         25    7    6    0   0   3/6    50.0     0/0   0.0
Jimmy Griffin          25    6    1    1   0   2/2   100.0     0/0   0.0
Shai Mobley            25    6    6    2   0   3/4    75.0     0/0   0.0
Ja Oladipo             25    4    0    1   0   2/4    50.0     0/0   0.0
Shai Bird              25    2    0    0   0   1/1   100.0     0/0   0.0
Shai Jordan            12    2    0    0   0   1/1   100.0     0/0   0.0

TEAM: FG: 12/18 (66.7%), 3PT: 6/7 (85.7%), REB: 13 (4 off, 9 def), AST: 4, TO: 4
TEAM FOULS: 3


Team_092
--------------------------------------------------------------------------------
Player                MIN  PTS  REB  AST  TO      FG   FG%      3P   3P%
--------------------------------------------------------------------------------
John Giddey            25   11    3    1   0   4/5    80.0     0/0   0.0
Immanuel Ingram        25    6    0    0   0   3/6    50.0     0/0   0.0
Paul James             25    2    6    1   0   1/4    25.0     0/0   0.0
Karl Gobert            25    0    0    2   0   0/2     0.0     0/0   0.0
Austin Bridges         25    0    0    1   0   0/1     0.0     0/0   0.0

TEAM: FG: 8/18 (44.4%), 3PT: 1/4 (25.0%), REB: 9 (4 off, 5 def), AST: 5, TO: 3
TEAM FOULS: 6 [Team_049 in BONUS]

================================================================================

================================================================================
                       4TH QUARTER - Team_049 vs Team_092                       
================================================================================

[12:00] Team_049 possession (Score: 69-58)
Shai Bird attempts a Midrange. Contested by Austin Bridges (5.2 feet, MAN). SHAI BIRD MAKES IT! Assist: Ja Oladipo
Score: 71-58

[11:51] Team_092 possession (Score: 71-58)
John Giddey attempts a Midrange. Contested by De'Aaron Allen (4.7 feet, MAN). John Giddey misses. Rebound secured by Jimmy Griffin.

[11:40] Team_049 possession (Score: 71-58)
Ja Oladipo attempts a Layup. Contested by John Giddey (4.6 feet, ZONE). JA OLADIPO MAKES IT! Assist: De'Aaron Allen
Score: 73-58

[11:23] Team_092 possession (Score: 73-58)
Immanuel Ingram drives, picks up De'Aaron Allen. Help arrives from Ja Oladipo! Immanuel Ingram attempts a Layup. Contested by Ja Oladipo (4.4 feet, ZONE). IMMANUEL INGRAM MAKES IT!
Score: 73-60

[11:10] Team_049 possession (Score: 73-60)
FOUL! Offensive foul on Ja Oladipo! Karl Gobert drew the charge! [Team fouls: 1] (Ja Oladipo: 1 personal fouls) TURNOVER! (dead ball)

[10:58] Team_092 possession (Score: 73-60)
Paul James attempts a 3Pt. Contested by Ja Oladipo (5.2 feet, ZONE). Paul James misses. FOUL! Loose ball foul on Shai Mobley during the rebound battle. [Team fouls: 2] No free throws, side out. (Shai Mobley: 1 personal fouls)

[10:45] Team_092 possession (Score: 73-60)
Paul James attempts a Layup. Contested by Jimmy Griffin (5.7 feet, MAN). PAUL JAMES MAKES IT!
Score: 73-62

[10:27] Team_049 possession (Score: 73-62)
Ja Oladipo drives, John Giddey stays with him. Ja Oladipo attempts a Dunk. Contested by John Giddey (4.8 feet, ZONE). JA OLADIPO MAKES IT! Assist: Shai Bird
Score: 75-62

[10:14] Team_092 possession (Score: 75-62)
John Giddey attempts a Midrange. Contested by De'Aaron Allen (4.9 feet, MAN). JOHN GIDDEY MAKES IT! Assist: Immanuel Ingram
Score: 75-64

[09:56] Team_049 possession (Score: 75-64)
Shai Bird attempts a 3Pt. Contested by Austin Bridges (5.4 feet, MAN). Shai Bird misses. Rebound secured by Paul James.

[09:44] Team_092 possession (Score: 75-64)
Karl Gobert drives, De'Aaron Allen stays with him. Karl Gobert attempts a Layup. Contested by De'Aaron Allen (4.6 feet, ZONE). Karl Gobert misses. Offensive rebound by Paul James! Paul James kicks it out.

[09:31] Team_092 possession (Score: 75-64)
Karl Gobert attempts a 3Pt. Contested by Ja Oladipo (4.7 feet, MAN). Karl Gobert misses. Rebound secured by Shai Mobley.

[09:19] Team_049 possession (Score: 75-64)
Ja Oladipo drives, John Giddey stays with him. Ja Oladipo attempts a Layup. Contested by John Giddey (4.9 feet, ZONE). Ja Oladipo misses. Rebound secured by Immanuel Ingram.

[09:02] Team_092 possession (Score: 75-64)
John Giddey drives and kicks out. Austin Bridges attempts a 3Pt. Contested by Shai Bird (4.7 feet, MAN). Austin Bridges misses. Rebound secured by Shai Mobley.

[08:46] Team_049 possession (Score: 75-64)
Shai Bird attempts a 3Pt. Contested by John Giddey (5.2 feet, ZONE). SHAI BIRD MAKES IT! Assist: Jimmy Griffin
Score: 78-64

[08:36] Team_092 possession (Score: 78-64)
John Giddey drives to the basket... John Giddey loses control! Ball rolls out of bounds! TURNOVER! (dead ball)

[08:36] Substitution (Team_049): Shai Bird OUT → Shaquille Lillard IN (stamina_rule2)

[08:36] Substitution (Team_049): Ja Oladipo OUT → Shai Jordan IN (stamina_rule2)

[08:36] Substitution (Team_049): Jimmy Griffin OUT → Desmond Towns IN (stamina_rule2)

[08:36] Substitution (Team_049): De'Aaron Allen OUT → Giannis Anunoby IN (stamina_rule2)

[08:36] Substitution (Team_049): Shai Mobley OUT → Miles Jackson IN (stamina_rule2)

[08:36] Substitution (Team_092): Austin Bridges OUT → Bones Giddey IN (stamina_rule2)

[08:36] Substitution (Team_092): Karl Gobert OUT → Shaquille Russell IN (stamina_rule2)

[08:36] Substitution (Team_092): Paul James OUT → Vince Harris IN (stamina_rule2)

[08:36] Substitution (Team_092): John Giddey OUT → Shaquille Paul IN (stamina_rule2)

[08:36] Substitution (Team_092): Immanuel Ingram OUT → Pau Reaves IN (stamina_rule2)

[08:20] Team_049 possession (Score: 78-64)
Shai Jordan attempts a Layup. Contested by Shaquille Russell (4.2 feet, MAN). SHAI JORDAN MAKES IT! Assist: Desmond Towns
Score: 80-64

[08:09] Team_092 possession (Score: 80-64)
Bones Giddey drives, Miles Jackson stays with him. Bones Giddey attempts a Layup. Contested by Miles Jackson (3.1 feet, ZONE). BONES GIDDEY MAKES IT! Assist: Shaquille Paul
Score: 80-66

[07:56] Team_049 possession (Score: 80-66)
Giannis Anunoby attempts a Midrange. Contested by Shaquille Paul (5.6 feet, MAN). Giannis Anunoby misses. Rebound secured by Pau Reaves.

[07:43] Team_092 possession (Score: 80-66)
Pau Reaves attempts a Midrange. Contested by Miles Jackson (3.7 feet, MAN). Pau Reaves misses. Rebound secured by Miles Jackson.

[07:26] Team_049 possession (Score: 80-66)
Miles Jackson attempts a Layup. BLOCKED BY PAU REAVES! Ball deflects out of bounds off Miles Jackson.

[07:11] Team_092 possession (Score: 80-66)
Pau Reaves attempts a Layup. BLOCKED BY MILES JACKSON! Ball deflects out of bounds off Pau Reaves.

[06:57] Team_049 possession (Score: 80-66)
Shaquille Lillard drives, Bones Giddey stays with him. Shaquille Lillard attempts a Dunk. Contested by Bones Giddey (5.4 feet, MAN). SHAQUILLE LILLARD MAKES IT! Assist: Giannis Anunoby
Score: 82-66

[06:43] Team_092 possession (Score: 82-66)
Bones Giddey attempts a Midrange. Contested by Shaquille Lillard (4.2 feet, MAN). BONES GIDDEY MAKES IT!
Score: 82-68

[06:24] Team_049 possession (Score: 82-68)
Shaquille Lillard attempts a 3Pt. Contested by Vince Harris (4.3 feet, ZONE). Shaquille Lillard misses. Offensive rebound by Miles Jackson! Miles Jackson puts it back in!
Score: 84-68

[06:07] Team_092 possession (Score: 84-68)
Pau Reaves drives, Miles Jackson stays with him. Pau Reaves attempts a Layup. Contested by Miles Jackson (3.7 feet, MAN). PAU REAVES MAKES IT! Assist: Vince Harris
Score: 84-70

[05:56] Team_049 possession (Score: 84-70)
FOUL! Holding foul on Pau Reaves. [Team fouls: 1] No free throws, side out. (Pau Reaves: 1 personal fouls)

[05:45] Team_049 possession (Score: 84-70)
Shai Jordan attempts a 3Pt. Contested by Shaquille Russell (4.2 feet, MAN). Shai Jordan misses. Rebound secured by Shaquille Paul.

[05:32] Team_092 possession (Score: 84-70)
Shaquille Paul attempts a Midrange. Contested by Desmond Towns (5.1 feet, ZONE). Shaquille Paul misses. Offensive rebound by Shaquille Paul! Shaquille Paul kicks it out.

[05:18] Team_092 possession (Score: 84-70)
FOUL! Reach-in foul on Miles Jackson during the drive. [Team fouls: 3] No free throws, side out. (Miles Jackson: 1 personal fouls)

[05:02] Team_092 possession (Score: 84-70)
FOUL! Reach-in foul on Miles Jackson during the drive. [Team fouls: 4] No free throws, side out. (Miles Jackson: 2 personal fouls)

[04:44] Team_092 possession (Score: 84-70)
Pau Reaves attempts a Layup. Contested by Miles Jackson (3.7 feet, MAN). Pau Reaves misses. Offensive rebound by Shaquille Paul! Shaquille Paul kicks it out.

[04:29] Team_092 possession (Score: 84-70)
Bones Giddey drives and kicks out. Pau Reaves attempts a 3Pt. Contested by Miles Jackson (3.4 feet, MAN). PAU REAVES MAKES IT! Assist: Shaquille Russell
Score: 84-73

[04:15] Team_049 possession (Score: 84-73)
FOUL! Shooting foul on Vince Harris. Shaquille Lillard to the line for 3 free throws. [Team fouls: 2] (Vince Harris: 1 personal fouls)   FT 1/3: GOOD   FT 2/3: GOOD   FT 3/3: GOOD Shaquille Lillard makes 3/3 from the line.
Score: 87-73

[03:59] Team_092 possession (Score: 87-73)
Bones Giddey attempts a 3Pt. Contested by Shaquille Lillard (4.2 feet, ZONE). Bones Giddey misses. FOUL! Loose ball foul on Giannis Anunoby during the rebound battle. [IN THE BONUS! 5 team fouls] Shaquille Paul to the line for 2 free throws. (Giannis Anunoby: 1 personal fouls)   FT 1/2: GOOD   FT 2/2: GOOD Shaquille Paul makes 2/2 from the line.
Score: 87-75

[03:47] Team_049 possession (Score: 87-75)
Miles Jackson drives to the basket... Miles Jackson loses the ball! Stripped by Pau Reaves! TURNOVER! (live ball)

[03:29] Team_092 possession (Score: 87-75)
FOUL! Holding foul on Miles Jackson. [IN THE BONUS! 6 team fouls] Pau Reaves to the line for 2 free throws. (Miles Jackson: 3 personal fouls)   FT 1/2: GOOD   FT 2/2: GOOD Pau Reaves makes 2/2 from the line.
Score: 87-77

[03:15] Team_049 possession (Score: 87-77)
Giannis Anunoby attempts a 3Pt. Contested by Shaquille Paul (5.6 feet, MAN). Giannis Anunoby misses. Offensive rebound by Miles Jackson! Miles Jackson puts it back in!
Score: 89-77

[03:02] Team_092 possession (Score: 89-77)
Bones Giddey attempts a Layup. Contested by Shaquille Lillard (4.2 feet, MAN). Bones Giddey misses. Rebound secured by Shai Jordan.

[02:48] Team_049 possession (Score: 89-77)
Desmond Towns attempts a 3Pt. Contested by Vince Harris (4.2 feet, ZONE). Desmond Towns misses. Rebound secured by Pau Reaves.

[02:30] Team_092 possession (Score: 89-77)
Vince Harris drives to the basket... Vince Harris loses the ball! Stripped by Desmond Towns! TURNOVER! (live ball)

[02:14] Team_049 possession (Score: 89-77)
FOUL! Offensive foul on Shaquille Lillard! Bones Giddey drew the charge! [Team fouls: 7] (Shaquille Lillard: 1 personal fouls) TURNOVER! (dead ball)

[01:56] Team_092 possession (Score: 89-77)
Bones Giddey attempts a 3Pt. Contested by Shaquille Lillard (4.2 feet, MAN). Bones Giddey misses. Rebound secured by Miles Jackson.

[01:38] Team_049 possession (Score: 89-77)
Desmond Towns attempts a Midrange. Contested by Shaquille Paul (5.7 feet, ZONE). DESMOND TOWNS MAKES IT!
Score: 91-77

[01:24] Team_092 possession (Score: 91-77)
Shaquille Russell attempts a 3Pt. Contested by Shaquille Lillard (5.0 feet, ZONE). Shaquille Russell misses. Rebound secured by Shai Jordan.

[01:14] Team_049 possession (Score: 91-77)
Giannis Anunoby attempts a Midrange. Contested by Vince Harris (4.2 feet, ZONE). Giannis Anunoby misses. Rebound secured by Shaquille Paul.

[00:59] Team_092 possession (Score: 91-77)
Pau Reaves makes the Layup and draws the foul on Miles Jackson! And-1! Pau Reaves to the line for 1. [BONUS: 8 team fouls] (Miles Jackson: 4 personal fouls)   FT 1/1: GOOD Pau Reaves makes 1/1 from the line.
Score: 91-80

[00:44] Team_049 possession (Score: 91-80)
Desmond Towns attempts a Midrange. Contested by Shaquille Russell (4.4 feet, ZONE). Desmond Towns misses. Rebound secured by Shaquille Paul.

[00:29] Team_092 possession (Score: 91-80)
FOUL! Shooting foul on Shaquille Lillard. Vince Harris to the line for 3 free throws. [BONUS: 9 team fouls] (Shaquille Lillard: 2 personal fouls)   FT 1/3: GOOD   FT 2/3: GOOD   FT 3/3: GOOD Vince Harris makes 3/3 from the line.
Score: 91-83

[00:18] Team_049 possession (Score: 91-83)
Desmond Towns drives to the basket... Desmond Towns throws a bad pass out of bounds! TURNOVER! (dead ball)

[00:02] Team_092 possession (Score: 91-83)
Shaquille Russell attempts a 3Pt. Wide open! Shai Jordan is 6.6 feet away. [MAN] Shaquille Russell misses. Rebound secured by Giannis Anunoby.

================================================================================
                              4TH QUARTER COMPLETE                              
================================================================================

4TH QUARTER SCORE: Team_049 22, Team_092 25

BOX SCORE:
================================================================================

Team_049
--------------------------------------------------------------------------------
Player                MIN  PTS  REB  AST  TO      FG   FG%      3P   3P%
--------------------------------------------------------------------------------
Shai Bird              29    5    0    1   0   2/3    66.7     0/0   0.0
Shaquille Lillard      20    5    0    0   0   2/2   100.0     0/0   0.0
Ja Oladipo             29    4    0    1   0   2/3    66.7     0/0   0.0
Miles Jackson          20    4    4    0   0   2/3    66.7     0/0   0.0
Shai Jordan            20    2    2    0   0   1/2    50.0     0/0   0.0
Desmond Towns          20    2    0    1   0   1/3    33.3     0/0   0.0
Jimmy Griffin          29    0    1    1   0   0/0     0.0     0/0   0.0
De'Aaron Allen         29    0    0    1   0   0/0     0.0     0/0   0.0
Shai Mobley            29    0    2    0   0   0/0     0.0     0/0   0.0
Giannis Anunoby        20    0    1    1   0   0/2     0.0     0/0   0.0

TEAM: FG: 10/18 (55.6%), 3PT: 4/7 (57.1%), REB: 10 (2 off, 8 def), AST: 6, TO: 4
TEAM FOULS: 9 [Team_092 in BONUS]


Team_092
--------------------------------------------------------------------------------
Player                MIN  PTS  REB  AST  TO      FG   FG%      3P   3P%
--------------------------------------------------------------------------------
Pau Reaves             20   10    2    0   0   4/6    66.7     0/0   0.0
Bones Giddey           20    4    0    0   0   2/4    50.0     0/0   0.0
Vince Harris           20    3    0    1   0   1/1   100.0     0/0   0.0
John Giddey            29    2    0    0   0   1/3    33.3     0/0   0.0
Immanuel Ingram        29    2    1    1   0   1/1   100.0     0/0   0.0
Paul James             29    2    3    0   0   1/1   100.0     0/0   0.0
Shaquille Paul         20    2    5    1   0   1/1   100.0     0/0   0.0
Karl Gobert            29    0    0    0   0   0/1     0.0     0/0   0.0
Shaquille Russell      20    0    0    1   0   0/2     0.0     0/0   0.0

TEAM: FG: 11/20 (55.0%), 3PT: 2/6 (33.3%), REB: 11 (4 off, 7 def), AST: 4, TO: 2
TEAM FOULS: 2

================================================================================

================================================================================
                               FULL GAME COMPLETE                               
================================================================================

FINAL SCORE: Team_049 91, Team_092 83

SCORING BY QUARTER:
--------------------------------------------------------------------------------
Team                     Q1     Q2     Q3     Q4    FINAL
--------------------------------------------------------------------------------
Team_049                 26     15     28     22       91
Team_092                 18     21     19     25       83
--------------------------------------------------------------------------------

FULL GAME BOX SCORE:
================================================================================

Team_049
--------------------------------------------------------------------------------
Player                MIN  PTS  REB  AST  TO      FG   FG%      3P   3P%      FT STL BLK
--------------------------------------------------------------------------------
Shai Bird              29   14    0    3   1   7/11   63.6   3/4    75.0   0/0     1   0
Ja Oladipo             29   11    0    2   2   7/12   58.3   3/4    75.0   4/4     0   0
Jimmy Griffin          29   13    6    3   2   6/7    85.7   4/4   100.0   5/5     1   0
De'Aaron Allen         29   12    9    1   1   4/10   40.0   1/4    25.0   3/3     0   2
Shai Mobley            29   10   16    5   1   2/5    40.0   0/0     0.0   1/2     1   2
Shaquille Lillard      20   12    0    0   3   5/5   100.0   3/3   100.0   7/7     0   0
Shai Jordan            20    4    5    0   0   2/8    25.0   0/4     0.0   0/0     0   2
Desmond Towns          20    4    0    1   2   3/7    42.9   0/3     0.0   0/0     1   0
Giannis Anunoby        20    1    6    2   1   2/5    40.0   1/1   100.0   1/2     0   0
Miles Jackson          20    9   11    1   0   2/5    40.0   1/2    50.0   0/0     0   1

TEAM: FG: 40/75 (53.3%), 3PT: 16/29 (55.2%), REB: 54 (13 off, 41 def), AST: 18, TO: 13


Team_092
--------------------------------------------------------------------------------
Player                MIN  PTS  REB  AST  TO      FG   FG%      3P   3P%      FT STL BLK
--------------------------------------------------------------------------------
Austin Bridges         29    7    0    1   3   3/6    50.0   1/4    25.0   0/0     0   0
Karl Gobert            29    3    0    3   1   2/8    25.0   1/5    20.0   0/0     0   1
Paul James             29    6   15    3   0   3/9    33.3   0/2     0.0   0/0     1   0
John Giddey            29   21   10    1   1   7/11   63.6   1/2    50.0   0/0     0   2
Immanuel Ingram        29    8    1    2   0   5/12   41.7   0/1     0.0   2/2     0   0
Bones Giddey           20    4    0    0   1   4/9    44.4   1/3    33.3   1/2     1   0
Shaquille Russell      20    2    4    1   0   2/7    28.6   0/4     0.0   0/0     0   0
Vince Harris           20   11    2    1   1   3/3   100.0   2/2   100.0   4/4     0   1
Shaquille Paul         20    5    8    2   0   1/3    33.3   1/2    50.0   5/5     1   0
Pau Reaves             20   15    4    0   1   5/10   50.0   0/0     0.0   6/7     1   2

TEAM: FG: 36/79 (45.6%), 3PT: 7/25 (28.0%), REB: 43 (11 off, 32 def), AST: 14, TO: 8

================================================================================
