================================================================================
                        FULL GAME - Team_001 vs Team_084                        
================================================================================

================================================================================
                       1ST QUARTER - Team_001 vs Team_084                       
================================================================================

[12:00] Team_001 possession (Score: 0-0)
Dejounte McCollum attempts a Layup. BLOCKED BY GIANNIS QUICKLEY! Ball is loose! Offensive rebound by Miles Griffin! Miles Griffin kicks it out.

[11:47] Team_001 possession (Score: 0-0)
Dirk Young drives and kicks out. Dejounte McCollum attempts a Midrange. Contested by Jarrett Booker (4.6 feet, ZONE). Dejounte McCollum misses. Rebound secured by Giannis Quickley.

[11:36] Team_084 possession (Score: 0-0)
Dejounte Ginobili attempts a 3Pt. Contested by Dirk Young (3.8 feet, MAN). Dejounte Ginobili misses. Rebound secured by Miles Griffin.

[11:23] Team_001 possession (Score: 0-0)
Miles Griffin makes the Layup and draws the foul on Giannis Quickley! And-1! Miles Griffin to the line for 1. [Team fouls: 1] (Giannis Quickley: 1 personal fouls)   FT 1/1: GOOD Miles Griffin makes 1/1 from the line.
Score: 3-0

[11:06] Team_084 possession (Score: 3-0)
Klay Thompson attempts a 3Pt. Contested by Klay Harden (4.4 feet, ZONE). Klay Thompson misses. Rebound secured by Miles Griffin.

[10:49] Team_001 possession (Score: 3-0)
Dejounte McCollum makes the Layup and draws the foul on Dejounte Ginobili! And-1! Dejounte McCollum to the line for 1. [Team fouls: 2] (Dejounte Ginobili: 1 personal fouls)   FT 1/1: MISS Dejounte McCollum makes 0/1 from the line. Rebound secured by Klay Thompson.
Score: 5-0

[10:38] Team_084 possession (Score: 5-0)
Jarrett Booker makes the Midrange and draws the foul on Dejounte McCollum! And-1! Jarrett Booker to the line for 1. [Team fouls: 1] (Dejounte McCollum: 1 personal fouls)   FT 1/1: GOOD Jarrett Booker makes 1/1 from the line.
Score: 5-3

[10:20] Team_001 possession (Score: 5-3)
Dejounte McCollum makes the Dunk and draws the foul on Giannis Quickley! And-1! Dejounte McCollum to the line for 1. [Team fouls: 3] (Giannis Quickley: 2 personal fouls)   FT 1/1: GOOD Dejounte McCollum makes 1/1 from the line.
Score: 8-3

[10:03] Team_084 possession (Score: 8-3)
Klay Thompson attempts a 3Pt. Contested by Klay Harden (4.4 feet, ZONE). Klay Thompson misses. Rebound secured by Dejounte McCollum.

[09:44] Team_001 possession (Score: 8-3)
Dirk Young drives, Giannis Quickley stays with him. Dirk Young attempts a Layup. Contested by Giannis Quickley (4.6 feet, ZONE). DIRK YOUNG MAKES IT!
Score: 10-3

[09:30] Team_084 possession (Score: 10-3)
Jarrett Booker makes the Layup and draws the foul on Dejounte McCollum! And-1! Jarrett Booker to the line for 1. [Team fouls: 2] (Dejounte McCollum: 2 personal fouls)   FT 1/1: GOOD Jarrett Booker makes 1/1 from the line.
Score: 10-6

[09:19] Team_001 possession (Score: 10-6)
Cole Ball attempts a Midrange. Contested by Klay Thompson (4.6 feet, MAN). Cole Ball misses. Rebound secured by Klay Thompson.

[09:09] Team_084 possession (Score: 10-6)
Dejounte Ginobili attempts a Midrange. Contested by Dirk Young (3.8 feet, MAN). DEJOUNTE GINOBILI MAKES IT!
Score: 10-8

[08:51] Team_001 possession (Score: 10-8)
Dejounte McCollum drives to the basket... FOUL! Offensive foul on Dejounte McCollum! Giannis Quickley drew the charge! [Team fouls: 3] (Dejounte McCollum: 3 personal fouls) TURNOVER! (dead ball)

[08:38] Team_084 possession (Score: 10-8)
Klay Thompson attempts a Midrange. Contested by Cole Ball (3.6 feet, ZONE). Klay Thompson misses. Rebound secured by Cole Ball.

[08:24] Team_001 possession (Score: 10-8)
Klay Harden drives, Giannis Quickley stays with him. Klay Harden attempts a Dunk. Contested by Giannis Quickley (4.3 feet, ZONE). KLAY HARDEN MAKES IT! Assist: Dirk Young
Score: 12-8

[08:10] Team_084 possession (Score: 12-8)
Luka Sexton attempts a 3Pt. Contested by Klay Harden (4.2 feet, MAN). LUKA SEXTON MAKES IT! Assist: Klay Thompson
Score: 12-11

[08:00] Team_001 possession (Score: 12-11)
Miles Griffin attempts a Layup. Contested by Giannis Quickley (4.9 feet, MAN). Miles Griffin misses. Rebound secured by Dejounte Ginobili.

[07:44] Team_084 possession (Score: 12-11)
FOUL! Reach-in foul on Miles Griffin during the drive. [Team fouls: 4] No free throws, side out. (Miles Griffin: 1 personal fouls)

[07:34] Team_084 possession (Score: 12-11)
Dejounte Ginobili attempts a 3Pt. Contested by Klay Harden (4.1 feet, ZONE). Dejounte Ginobili misses. Rebound secured by Miles Griffin.

[07:21] Team_001 possession (Score: 12-11)
Dejounte McCollum attempts a 3Pt. Contested by Jarrett Booker (4.5 feet, MAN). DEJOUNTE MCCOLLUM MAKES IT! Assist: Cole Ball
Score: 15-11

[07:09] Team_084 possession (Score: 15-11)
Klay Thompson drives, picks up Miles Griffin. Help arrives from Klay Harden! Klay Thompson attempts a Dunk. Contested by Klay Harden (4.5 feet, ZONE). Klay Thompson misses. Rebound secured by Cole Ball.

[06:56] Team_001 possession (Score: 15-11)
Klay Harden attempts a Layup. BLOCKED BY DEJOUNTE GINOBILI! Ball is loose! Offensive rebound by Miles Griffin! Miles Griffin kicks it out.

[06:41] Team_001 possession (Score: 15-11)
Cole Ball attempts a Midrange. Contested by Klay Thompson (4.6 feet, ZONE). Cole Ball misses. Rebound secured by Klay Thompson.

[06:26] Team_084 possession (Score: 15-11)
Giannis Quickley loses the ball! Stripped by Miles Griffin! TURNOVER! (live ball)

[06:12] Team_001 possession (Score: 15-11)
FOUL! Shooting foul on Giannis Quickley. Dirk Young to the line for 2 free throws. [Team fouls: 4] (Giannis Quickley: 3 personal fouls)   FT 1/2: GOOD   FT 2/2: GOOD Dirk Young makes 2/2 from the line.
Score: 17-11

[05:57] Team_084 possession (Score: 17-11)
Luka Sexton attempts a 3Pt. Contested by Klay Harden (4.2 feet, MAN). LUKA SEXTON MAKES IT! Assist: Jarrett Booker
Score: 17-14

[05:45] Team_001 possession (Score: 17-14)
Dejounte McCollum drives and kicks out. Dejounte McCollum attempts a Midrange. Contested by Jarrett Booker (4.6 feet, ZONE). Dejounte McCollum misses. Rebound secured by Klay Thompson.

[05:35] Team_084 possession (Score: 17-14)
Giannis Quickley attempts a Midrange. BLOCKED BY COLE BALL! Ball is loose! Rebound secured by Miles Griffin.

[05:21] Team_001 possession (Score: 17-14)
Klay Harden makes the Layup and draws the foul on Luka Sexton! And-1! Klay Harden to the line for 1. [BONUS: 5 team fouls] (Luka Sexton: 1 personal fouls)   FT 1/1: GOOD Klay Harden makes 1/1 from the line.
Score: 20-14

[05:05] Team_084 possession (Score: 20-14)
Jarrett Booker drives and kicks out. Dejounte Ginobili attempts a Midrange. Contested by Dirk Young (3.6 feet, MAN). DEJOUNTE GINOBILI MAKES IT!
Score: 20-16

[04:48] Team_001 possession (Score: 20-16)
Miles Griffin drives and kicks out. Dirk Young attempts a 3Pt. Contested by Dejounte Ginobili (4.6 feet, MAN). DIRK YOUNG MAKES IT! Assist: Cole Ball
Score: 23-16

[04:36] Team_084 possession (Score: 23-16)
Dejounte Ginobili drives to the basket... Dejounte Ginobili throws a bad pass! Stolen by Dirk Young! TURNOVER! (live ball)

[04:22] Team_001 possession (Score: 23-16)
Cole Ball attempts a 3Pt. Contested by Klay Thompson (4.7 feet, MAN). Cole Ball misses. Rebound secured by Dejounte Ginobili.

[04:06] Team_084 possession (Score: 23-16)
Jarrett Booker attempts a Midrange. Contested by Miles Griffin (4.4 feet, ZONE). Jarrett Booker misses. Offensive rebound by Giannis Quickley! Giannis Quickley's putback is no good. Rebound secured by Cole Ball.

[03:49] Team_001 possession (Score: 23-16)
Dejounte McCollum attempts a Layup. Contested by Jarrett Booker (4.6 feet, ZONE). DEJOUNTE MCCOLLUM MAKES IT! Assist: Cole Ball
Score: 25-16

[03:33] Team_084 possession (Score: 25-16)
Dejounte Ginobili makes the Dunk and draws the foul on Miles Griffin! And-1! Dejounte Ginobili to the line for 1. [BONUS: 5 team fouls] (Miles Griffin: 2 personal fouls)   FT 1/1: MISS Dejounte Ginobili makes 0/1 from the line. Rebound secured by Cole Ball.
Score: 25-18

[03:18] Team_001 possession (Score: 25-18)
Cole Ball attempts a Midrange. Contested by Klay Thompson (4.8 feet, MAN). Cole Ball misses. Rebound secured by Dejounte Ginobili.

[03:00] Team_084 possession (Score: 25-18)
Jarrett Booker attempts a Layup. BLOCKED BY DEJOUNTE MCCOLLUM! Ball is loose! Rebound secured by Dejounte McCollum.

[02:49] Team_001 possession (Score: 25-18)
Cole Ball attempts a 3Pt. Contested by Klay Thompson (4.8 feet, MAN). Cole Ball misses. FOUL! Loose ball foul on Dejounte Ginobili during the rebound battle. [IN THE BONUS! 6 team fouls] Miles Griffin to the line for 2 free throws. (Dejounte Ginobili: 2 personal fouls)   FT 1/2: GOOD   FT 2/2: GOOD Miles Griffin makes 2/2 from the line.
Score: 27-18

[02:31] Team_084 possession (Score: 27-18)
Dejounte Ginobili drives, picks up Dirk Young. Help arrives from Cole Ball! Dejounte Ginobili attempts a Layup. Contested by Cole Ball (4.0 feet, MAN). Dejounte Ginobili misses. Rebound secured by Miles Griffin.

[02:19] Team_001 possession (Score: 27-18)
Klay Harden drives and kicks out. Cole Ball attempts a 3Pt. Contested by Luka Sexton (3.9 feet, ZONE). COLE BALL MAKES IT! Assist: Klay Harden
Score: 30-18

[02:05] Team_084 possession (Score: 30-18)
Jarrett Booker attempts a Midrange. Contested by Dejounte McCollum (4.2 feet, MAN). Jarrett Booker misses. Rebound secured by Dejounte McCollum.

[01:49] Team_001 possession (Score: 30-18)
Dejounte McCollum attempts a 3Pt. Contested by Jarrett Booker (4.8 feet, MAN). Dejounte McCollum misses. Offensive rebound by Cole Ball! Cole Ball kicks it out.

[01:32] Team_001 possession (Score: 30-18)
Dirk Young makes the 3Pt and draws the foul on Dejounte Ginobili! And-1! Dirk Young to the line for 1. [BONUS: 7 team fouls] (Dejounte Ginobili: 3 personal fouls)   FT 1/1: GOOD Dirk Young makes 1/1 from the line.
Score: 34-18

[01:17] Team_084 possession (Score: 34-18)
Dejounte Ginobili drives, Miles Griffin stays with him. Dejounte Ginobili attempts a Dunk. Contested by Miles Griffin (4.7 feet, ZONE). DEJOUNTE GINOBILI MAKES IT! Assist: Giannis Quickley
Score: 34-20

[01:02] Team_001 possession (Score: 34-20)
Dirk Young attempts a Midrange. Contested by Dejounte Ginobili (5.2 feet, MAN). DIRK YOUNG MAKES IT!
Score: 36-20

[00:49] Team_084 possession (Score: 36-20)
FOUL! Shooting foul on Miles Griffin. Giannis Quickley to the line for 2 free throws. [BONUS: 6 team fouls] (Miles Griffin: 3 personal fouls)   FT 1/2: GOOD   FT 2/2: GOOD Giannis Quickley makes 2/2 from the line.
Score: 36-22

[00:34] Team_001 possession (Score: 36-22)
FOUL! Reach-in foul on Luka Sexton during the drive. [IN THE BONUS! 8 team fouls] Klay Harden to the line for 2 free throws. (Luka Sexton: 2 personal fouls)   FT 1/2: GOOD   FT 2/2: GOOD Klay Harden makes 2/2 from the line.
Score: 38-22

[00:21] Team_084 possession (Score: 38-22)
Jarrett Booker commits a violation (traveling/carry)! TURNOVER! (dead ball)

[00:21] Substitution (Team_001): Klay Harden OUT → Ja Dosunmu IN (stamina_rule2)

[00:21] Substitution (Team_001): Dirk Young OUT → Rudy George IN (stamina_rule2)

[00:21] Substitution (Team_001): Cole Ball OUT → Larry Trent IN (stamina_rule2)

[00:21] Substitution (Team_001): Dejounte McCollum OUT → Franz Bryant IN (stamina_rule2)

[00:21] Substitution (Team_001): Miles Griffin OUT → Kristaps Ming IN (stamina_rule2)

[00:21] Substitution (Team_084): Luka Sexton OUT → Magic Bryant IN (stamina_rule2)

[00:21] Substitution (Team_084): Dejounte Ginobili OUT → Chris Parker IN (stamina_rule2)

[00:21] Substitution (Team_084): Klay Thompson OUT → Evan Quickley IN (stamina_rule2)

[00:21] Substitution (Team_084): Jarrett Booker OUT → Pascal Jackson IN (stamina_rule2)

[00:21] Substitution (Team_084): Giannis Quickley OUT → Dejounte Porzingis IN (stamina_rule2)

[00:10] Team_001 possession (Score: 38-22)
Ja Dosunmu makes the Layup and draws the foul on Magic Bryant! And-1! Ja Dosunmu to the line for 1. [BONUS: 9 team fouls] (Magic Bryant: 1 personal fouls)   FT 1/1: GOOD Ja Dosunmu makes 1/1 from the line.
Score: 41-22

================================================================================
                              1ST QUARTER COMPLETE                              
================================================================================

1ST QUARTER SCORE: Team_001 41, Team_084 22

BOX SCORE:
================================================================================

Team_001
--------------------------------------------------------------------------------
Player                MIN  PTS  REB  AST  TO      FG   FG%      3P   3P%
--------------------------------------------------------------------------------
Dirk Young             12   13    0    1   0   5/6    83.3     0/0   0.0
Dejounte McCollum      12    8    3    0   0   3/5    60.0     0/0   0.0
Klay Harden            12    7    0    1   0   3/3   100.0     0/0   0.0
Miles Griffin          12    5    7    0   0   2/3    66.7     0/0   0.0
Cole Ball              12    3    5    3   0   1/5    20.0     0/0   0.0
Ja Dosunmu              0    3    0    0   0   1/1   100.0     0/0   0.0

TEAM: FG: 15/23 (65.2%), 3PT: 3/4 (75.0%), REB: 14 (3 off, 11 def), AST: 5, TO: 1
TEAM FOULS: 6 [Team_084 in BONUS]


Team_084
--------------------------------------------------------------------------------
Player                MIN  PTS  REB  AST  TO      FG   FG%      3P   3P%
--------------------------------------------------------------------------------
Dejounte Ginobili      12    6    3    0   0   3/7    42.9     0/0   0.0
Jarrett Booker         12    6    0    1   0   2/5    40.0     0/0   0.0
Luka Sexton            12    6    0    0   0   2/2   100.0     0/0   0.0
Giannis Quickley       12    2    1    1   0   1/2    50.0     0/0   0.0
Klay Thompson          12    0    4    1   0   0/4     0.0     0/0   0.0

TEAM: FG: 8/20 (40.0%), 3PT: 2/6 (33.3%), REB: 9 (1 off, 8 def), AST: 3, TO: 3
TEAM FOULS: 9 [Team_001 in BONUS]

================================================================================

================================================================================
                       2ND QUARTER - Team_001 vs Team_084                       
================================================================================

[12:00] Team_001 possession (Score: 41-22)
Dirk Young attempts a 3Pt. Contested by Luka Sexton (4.1 feet, ZONE). DIRK YOUNG MAKES IT! Assist: Dejounte McCollum
Score: 44-22

[11:45] Team_084 possession (Score: 44-22)
Dejounte Ginobili drives, Dirk Young stays with him. Dejounte Ginobili attempts a Dunk. Contested by Dirk Young (4.1 feet, MAN). DEJOUNTE GINOBILI MAKES IT!
Score: 44-24

[11:30] Team_001 possession (Score: 44-24)
FOUL! Shooting foul on Jarrett Booker. Dejounte McCollum to the line for 2 free throws. [Team fouls: 1] (Jarrett Booker: 1 personal fouls)   FT 1/2: GOOD   FT 2/2: GOOD Dejounte McCollum makes 2/2 from the line.
Score: 46-24

[11:18] Team_084 possession (Score: 46-24)
Giannis Quickley attempts a 3Pt. Contested by Miles Griffin (4.7 feet, MAN). GIANNIS QUICKLEY MAKES IT! Assist: Luka Sexton
Score: 46-27

[11:04] Team_001 possession (Score: 46-27)
Miles Griffin makes the Dunk and draws the foul on Giannis Quickley! And-1! Miles Griffin to the line for 1. [Team fouls: 2] (Giannis Quickley: 1 personal fouls)   FT 1/1: GOOD Miles Griffin makes 1/1 from the line.
Score: 49-27

[10:50] Team_084 possession (Score: 49-27)
Klay Thompson attempts a 3Pt. Contested by Klay Harden (4.8 feet, ZONE). KLAY THOMPSON MAKES IT! Assist: Luka Sexton
Score: 49-30

[10:31] Team_001 possession (Score: 49-30)
Cole Ball drives and kicks out. Dejounte McCollum attempts a Midrange. Contested by Dejounte Ginobili (5.0 feet, ZONE). Dejounte McCollum misses. Rebound secured by Giannis Quickley.

[10:19] Team_084 possession (Score: 49-30)
Jarrett Booker attempts a Layup. Contested by Miles Griffin (4.8 feet, ZONE). Jarrett Booker misses. Rebound secured by Cole Ball.

[10:04] Team_001 possession (Score: 49-30)
Miles Griffin drives and kicks out. Dirk Young attempts a 3Pt. Contested by Dejounte Ginobili (5.1 feet, MAN). Dirk Young misses. Rebound secured by Dejounte Ginobili.

[09:51] Team_084 possession (Score: 49-30)
Giannis Quickley makes the Dunk and draws the foul on Miles Griffin! And-1! Giannis Quickley to the line for 1. [Team fouls: 1] (Miles Griffin: 1 personal fouls)   FT 1/1: GOOD Giannis Quickley makes 1/1 from the line.
Score: 49-33

[09:38] Team_001 possession (Score: 49-33)
Dejounte McCollum attempts a Layup. Contested by Jarrett Booker (5.0 feet, MAN). DEJOUNTE MCCOLLUM MAKES IT! Assist: Dirk Young
Score: 51-33

[09:24] Team_084 possession (Score: 51-33)
Dejounte Ginobili attempts a 3Pt. Contested by Klay Harden (4.8 feet, ZONE). Dejounte Ginobili misses. Rebound secured by Dejounte McCollum.

[09:12] Team_001 possession (Score: 51-33)
Cole Ball drives to the basket... Cole Ball throws a bad pass! Stolen by Giannis Quickley! TURNOVER! (live ball)

[08:57] Team_084 possession (Score: 51-33)
Jarrett Booker attempts a 3Pt. Contested by Dejounte McCollum (4.5 feet, MAN). Jarrett Booker misses. Rebound secured by Miles Griffin.

[08:42] Team_001 possession (Score: 51-33)
Cole Ball drives, picks up Klay Thompson. Help arrives from Dejounte Ginobili! Cole Ball attempts a Dunk. Contested by Dejounte Ginobili (5.3 feet, MAN). COLE BALL MAKES IT! Assist: Dirk Young
Score: 53-33

[08:28] Team_084 possession (Score: 53-33)
Dejounte Ginobili drives, Miles Griffin stays with him. Dejounte Ginobili attempts a Dunk. Contested by Miles Griffin (5.0 feet, ZONE). DEJOUNTE GINOBILI MAKES IT! Assist: Jarrett Booker
Score: 53-35

[08:11] Team_001 possession (Score: 53-35)
Dirk Young drives to the basket... Dirk Young throws a bad pass out of bounds! TURNOVER! (dead ball)

[08:11] Substitution (Team_001): Klay Harden OUT → Ja Dosunmu IN (stamina_rule2)

[08:11] Substitution (Team_001): Dirk Young OUT → Rudy George IN (stamina_rule2)

[08:11] Substitution (Team_001): Cole Ball OUT → Larry Trent IN (stamina_rule2)

[08:11] Substitution (Team_001): Dejounte McCollum OUT → Franz Bryant IN (stamina_rule2)

[08:11] Substitution (Team_001): Miles Griffin OUT → Kristaps Ming IN (stamina_rule2)

[08:11] Substitution (Team_084): Luka Sexton OUT → Magic Bryant IN (stamina_rule2)

[08:11] Substitution (Team_084): Dejounte Ginobili OUT → Chris Parker IN (stamina_rule2)

[08:11] Substitution (Team_084): Klay Thompson OUT → Evan Quickley IN (stamina_rule2)

[08:11] Substitution (Team_084): Jarrett Booker OUT → Pascal Jackson IN (stamina_rule2)

[08:11] Substitution (Team_084): Giannis Quickley OUT → Dejounte Porzingis IN (stamina_rule2)

[07:58] Team_084 possession (Score: 53-35)
Evan Quickley attempts a 3Pt. Contested by Ja Dosunmu (3.9 feet, ZONE). Evan Quickley misses. Rebound secured by Larry Trent.

[07:44] Team_001 possession (Score: 53-35)
FOUL! Holding foul on Chris Parker. [Team fouls: 3] No free throws, side out. (Chris Parker: 1 personal fouls)

[07:31] Team_001 possession (Score: 53-35)
Larry Trent attempts a 3Pt. Contested by Evan Quickley (5.4 feet, MAN). Larry Trent misses. Rebound secured by Pascal Jackson.

[07:13] Team_084 possession (Score: 53-35)
Magic Bryant attempts a 3Pt. Contested by Ja Dosunmu (4.0 feet, MAN). MAGIC BRYANT MAKES IT! Assist: Evan Quickley
Score: 53-38

[06:55] Team_001 possession (Score: 53-38)
Franz Bryant attempts a Midrange. Contested by Pascal Jackson (4.8 feet, ZONE). Franz Bryant misses. Rebound secured by Dejounte Porzingis.

[06:44] Team_084 possession (Score: 53-38)
Pascal Jackson attempts a 3Pt. Contested by Franz Bryant (4.3 feet, MAN). Pascal Jackson misses. FOUL! Loose ball foul on Rudy George during the rebound battle. [Team fouls: 2] No free throws, side out. (Rudy George: 1 personal fouls)

[06:31] Team_084 possession (Score: 53-38)
Chris Parker drives and kicks out. Magic Bryant attempts a 3Pt. Contested by Ja Dosunmu (4.0 feet, MAN). Magic Bryant misses. Offensive rebound by Dejounte Porzingis! Dejounte Porzingis kicks it out.

[06:19] Team_084 possession (Score: 53-38)
Chris Parker drives, Franz Bryant stays with him. Chris Parker attempts a Dunk. Contested by Franz Bryant (4.2 feet, ZONE). CHRIS PARKER MAKES IT!
Score: 53-40

[05:59] Team_001 possession (Score: 53-40)
Franz Bryant attempts a 3Pt. Contested by Magic Bryant (3.8 feet, ZONE). Franz Bryant misses. Rebound secured by Pascal Jackson.

[05:46] Team_084 possession (Score: 53-40)
Pascal Jackson attempts a Midrange. Contested by Larry Trent (4.3 feet, ZONE). Pascal Jackson misses. Rebound secured by Larry Trent.

[05:31] Team_001 possession (Score: 53-40)
Rudy George attempts a Midrange. Contested by Chris Parker (4.6 feet, MAN). RUDY GEORGE MAKES IT!
Score: 55-40

[05:14] Team_084 possession (Score: 55-40)
Magic Bryant attempts a 3Pt. Contested by Ja Dosunmu (4.0 feet, ZONE). Magic Bryant misses. Rebound secured by Kristaps Ming.

[04:56] Team_001 possession (Score: 55-40)
Ja Dosunmu attempts a 3Pt. Contested by Magic Bryant (3.9 feet, MAN). Ja Dosunmu misses. FOUL! Loose ball foul on Dejounte Porzingis during the rebound battle. [Team fouls: 4] No free throws, side out. (Dejounte Porzingis: 1 personal fouls)

[04:42] Team_001 possession (Score: 55-40)
Rudy George attempts a 3Pt. Contested by Magic Bryant (3.8 feet, ZONE). Rudy George misses. Rebound secured by Pascal Jackson.

[04:25] Team_084 possession (Score: 55-40)
FOUL! Reach-in foul on Rudy George during the drive. [Team fouls: 3] No free throws, side out. (Rudy George: 2 personal fouls)

[04:11] Team_084 possession (Score: 55-40)
Evan Quickley makes the Layup and draws the foul on Larry Trent! And-1! Evan Quickley to the line for 1. [Team fouls: 4] (Larry Trent: 1 personal fouls)   FT 1/1: MISS Evan Quickley makes 0/1 from the line. Rebound secured by Kristaps Ming.
Score: 55-42

[03:57] Team_001 possession (Score: 55-42)
Franz Bryant attempts a 3Pt. Contested by Magic Bryant (3.8 feet, ZONE). Franz Bryant misses. Rebound secured by Dejounte Porzingis.

[03:43] Team_084 possession (Score: 55-42)
Evan Quickley attempts a 3Pt. Contested by Larry Trent (4.1 feet, MAN). Evan Quickley misses. Rebound secured by Kristaps Ming.

[03:30] Team_001 possession (Score: 55-42)
Ja Dosunmu attempts a 3Pt. Contested by Chris Parker (4.8 feet, ZONE). JA DOSUNMU MAKES IT!
Score: 58-42

[03:19] Team_084 possession (Score: 58-42)
FOUL! Holding foul on Ja Dosunmu. [IN THE BONUS! 5 team fouls] Magic Bryant to the line for 2 free throws. (Ja Dosunmu: 1 personal fouls)   FT 1/2: GOOD   FT 2/2: GOOD Magic Bryant makes 2/2 from the line.
Score: 58-44

[03:02] Team_001 possession (Score: 58-44)
Rudy George attempts a 3Pt. Contested by Magic Bryant (3.8 feet, ZONE). Rudy George misses. Rebound secured by Evan Quickley.

[02:45] Team_084 possession (Score: 58-44)
Chris Parker attempts a Midrange. Contested by Ja Dosunmu (4.1 feet, ZONE). Chris Parker misses. Offensive rebound by Dejounte Porzingis! Dejounte Porzingis kicks it out.

[02:28] Team_084 possession (Score: 58-44)
Magic Bryant attempts a 3Pt. Contested by Ja Dosunmu (4.0 feet, MAN). MAGIC BRYANT MAKES IT! Assist: Evan Quickley
Score: 58-47

[02:13] Team_001 possession (Score: 58-47)
Franz Bryant drives, Pascal Jackson stays with him. Franz Bryant attempts a Layup. Contested by Pascal Jackson (4.8 feet, MAN). Franz Bryant misses. Offensive rebound by Rudy George! Rudy George kicks it out.

[01:57] Team_001 possession (Score: 58-47)
Franz Bryant attempts a 3Pt. Contested by Pascal Jackson (4.8 feet, MAN). Franz Bryant misses. Offensive rebound by Rudy George! Rudy George kicks it out.

[01:42] Team_001 possession (Score: 58-47)
Kristaps Ming drives to the basket... Kristaps Ming loses the ball! Stripped by Dejounte Porzingis! TURNOVER! (live ball)

[01:29] Team_084 possession (Score: 58-47)
FOUL! Shooting foul on Rudy George. Evan Quickley to the line for 2 free throws. [BONUS: 6 team fouls] (Rudy George: 3 personal fouls)   FT 1/2: GOOD   FT 2/2: GOOD Evan Quickley makes 2/2 from the line.
Score: 58-49

[01:12] Team_001 possession (Score: 58-49)
Rudy George attempts a Layup. Contested by Dejounte Porzingis (5.1 feet, ZONE). RUDY GEORGE MAKES IT!
Score: 60-49

[00:59] Team_084 possession (Score: 60-49)
Magic Bryant attempts a 3Pt. Contested by Ja Dosunmu (4.1 feet, MAN). Magic Bryant misses. Offensive rebound by Dejounte Porzingis! Dejounte Porzingis kicks it out.

[00:49] Team_084 possession (Score: 60-49)
Magic Bryant attempts a 3Pt. Contested by Ja Dosunmu (4.1 feet, ZONE). MAGIC BRYANT MAKES IT! Assist: Dejounte Porzingis
Score: 60-52

[00:33] Team_001 possession (Score: 60-52)
FOUL! Reach-in foul on Pascal Jackson during the drive. [IN THE BONUS! 5 team fouls] Franz Bryant to the line for 2 free throws. (Pascal Jackson: 1 personal fouls)   FT 1/2: MISS   FT 2/2: GOOD Franz Bryant makes 1/2 from the line.
Score: 61-52

[00:18] Team_084 possession (Score: 61-52)
FOUL! Reach-in foul on Franz Bryant during the drive. [IN THE BONUS! 7 team fouls] Dejounte Porzingis to the line for 2 free throws. (Franz Bryant: 1 personal fouls)   FT 1/2: GOOD   FT 2/2: GOOD Dejounte Porzingis makes 2/2 from the line.
Score: 61-54

[00:05] Team_001 possession (Score: 61-54)
FOUL! Shooting foul on Chris Parker. Rudy George to the line for 3 free throws. [BONUS: 6 team fouls] (Chris Parker: 2 personal fouls)   FT 1/3: GOOD   FT 2/3: GOOD   FT 3/3: GOOD Rudy George makes 3/3 from the line.
Score: 64-54

================================================================================
                              2ND QUARTER COMPLETE                              
================================================================================

2ND QUARTER SCORE: Team_001 23, Team_084 32

BOX SCORE:
================================================================================

Team_001
--------------------------------------------------------------------------------
Player                MIN  PTS  REB  AST  TO      FG   FG%      3P   3P%
--------------------------------------------------------------------------------
Rudy George             8    7    2    0   0   3/5    60.0     0/0   0.0
Dejounte McCollum      16    4    1    1   0   2/2   100.0     0/0   0.0
Dirk Young             16    3    0    2   0   1/1   100.0     0/0   0.0
Miles Griffin          16    3    1    0   0   1/2    50.0     0/0   0.0
Ja Dosunmu              8    3    0    0   0   1/1   100.0     0/0   0.0
Cole Ball              16    2    1    0   0   1/2    50.0     0/0   0.0
Franz Bryant            8    1    0    0   0   1/4    25.0     0/0   0.0
Larry Trent             8    0    3    0   0   0/1     0.0     0/0   0.0
Kristaps Ming           8    0    3    0   0   0/0     0.0     0/0   0.0

TEAM: FG: 10/18 (55.6%), 3PT: 3/8 (37.5%), REB: 11 (3 off, 8 def), AST: 3, TO: 3
TEAM FOULS: 7 [Team_084 in BONUS]


Team_084
--------------------------------------------------------------------------------
Player                MIN  PTS  REB  AST  TO      FG   FG%      3P   3P%
--------------------------------------------------------------------------------
Magic Bryant            8   11    0    0   0   4/5    80.0     0/0   0.0
Giannis Quickley       16    6    1    0   0   2/2   100.0     0/0   0.0
Dejounte Ginobili      16    4    1    0   0   2/3    66.7     0/0   0.0
Klay Thompson          16    3    0    0   0   1/1   100.0     0/0   0.0
Evan Quickley           8    2    1    2   0   1/4    25.0     0/0   0.0
Dejounte Porzingis      8    2    5    1   0   1/1   100.0     0/0   0.0
Chris Parker            8    2    0    0   0   1/1   100.0     0/0   0.0
Luka Sexton            16    0    0    2   0   0/0     0.0     0/0   0.0
Jarrett Booker         16    0    0    1   0   0/2     0.0     0/0   0.0
Pascal Jackson          8    0    4    0   0   0/1     0.0     0/0   0.0

TEAM: FG: 12/20 (60.0%), 3PT: 5/10 (50.0%), REB: 12 (4 off, 8 def), AST: 6, TO: 0
TEAM FOULS: 6 [Team_001 in BONUS]

================================================================================

================================================================================
                       3RD QUARTER - Team_001 vs Team_084                       
================================================================================

[12:00] Team_001 possession (Score: 64-54)
Dirk Young throws a bad pass! Stolen by Dejounte Ginobili! TURNOVER! (live ball)

[11:50] Team_084 possession (Score: 64-54)
Giannis Quickley attempts a Midrange. Contested by Dirk Young (3.8 feet, ZONE). GIANNIS QUICKLEY MAKES IT! Assist: Dejounte Ginobili
Score: 64-56

[11:35] Team_001 possession (Score: 64-56)
Klay Harden attempts a 3Pt. Contested by Luka Sexton (3.6 feet, ZONE). Klay Harden misses. Rebound secured by Giannis Quickley.

[11:22] Team_084 possession (Score: 64-56)
FOUL! Shooting foul on Dirk Young. Dejounte Ginobili to the line for 2 free throws. [Team fouls: 1] (Dirk Young: 1 personal fouls)   FT 1/2: MISS   FT 2/2: MISS Dejounte Ginobili makes 0/2 from the line. Rebound secured by Cole Ball.

[11:09] Team_001 possession (Score: 64-56)
Miles Griffin drives and kicks out. Cole Ball attempts a 3Pt. Contested by Luka Sexton (3.6 feet, ZONE). COLE BALL MAKES IT! Assist: Miles Griffin
Score: 67-56

[10:55] Team_084 possession (Score: 67-56)
Klay Thompson drives, picks up Miles Griffin. Help arrives from Klay Harden! Klay Thompson attempts a Dunk. Contested by Klay Harden (4.5 feet, ZONE). KLAY THOMPSON MAKES IT! Assist: Dejounte Ginobili
Score: 67-58

[10:40] Team_001 possession (Score: 67-58)
Dirk Young drives and kicks out. Miles Griffin attempts a 3Pt. Contested by Giannis Quickley (4.4 feet, MAN). Miles Griffin misses. Rebound secured by Dejounte Ginobili.

[10:24] Team_084 possession (Score: 67-58)
FOUL! Shooting foul on Dejounte McCollum. Jarrett Booker to the line for 2 free throws. [Team fouls: 2] (Dejounte McCollum: 1 personal fouls)   FT 1/2: MISS   FT 2/2: GOOD Jarrett Booker makes 1/2 from the line.
Score: 67-59

[10:12] Team_001 possession (Score: 67-59)
Dirk Young attempts a 3Pt. Contested by Dejounte Ginobili (4.8 feet, MAN). Dirk Young misses. Rebound secured by Giannis Quickley.

[09:58] Team_084 possession (Score: 67-59)
Luka Sexton attempts a 3Pt. Contested by Klay Harden (4.2 feet, ZONE). LUKA SEXTON MAKES IT! Assist: Dejounte Ginobili
Score: 67-62

[09:39] Team_001 possession (Score: 67-62)
Dejounte McCollum throws a bad pass! Stolen by Jarrett Booker! TURNOVER! (live ball)

[09:29] Team_084 possession (Score: 67-62)
Jarrett Booker drives to the basket... Jarrett Booker throws a bad pass out of bounds! TURNOVER! (dead ball)

[09:16] Team_001 possession (Score: 67-62)
Dirk Young makes the Layup and draws the foul on Dejounte Ginobili! And-1! Dirk Young to the line for 1. [Team fouls: 1] (Dejounte Ginobili: 1 personal fouls)   FT 1/1: GOOD Dirk Young makes 1/1 from the line.
Score: 70-62

[09:07] Team_084 possession (Score: 70-62)
Klay Thompson drives, Cole Ball stays with him. Klay Thompson attempts a Dunk. Contested by Cole Ball (3.6 feet, MAN). Klay Thompson misses. Rebound secured by Miles Griffin.

[08:55] Team_001 possession (Score: 70-62)
Dirk Young attempts a 3Pt. Contested by Dejounte Ginobili (4.8 feet, MAN). Dirk Young misses. Rebound secured by Dejounte Ginobili.

[08:43] Team_084 possession (Score: 70-62)
Klay Thompson drives, picks up Cole Ball. Help arrives from Klay Harden! Klay Thompson attempts a Dunk. Contested by Klay Harden (3.6 feet, MAN). KLAY THOMPSON MAKES IT!
Score: 70-64

[08:29] Team_001 possession (Score: 70-64)
Miles Griffin attempts a 3Pt. Contested by Giannis Quickley (4.9 feet, MAN). Miles Griffin misses. FOUL! Loose ball foul on Giannis Quickley during the rebound battle. [Team fouls: 2] No free throws, side out. (Giannis Quickley: 1 personal fouls)

[08:11] Team_001 possession (Score: 70-64)
Dirk Young attempts a 3Pt. Contested by Luka Sexton (3.9 feet, ZONE). DIRK YOUNG MAKES IT! Assist: Dejounte McCollum
Score: 73-64

[07:55] Team_084 possession (Score: 73-64)
Dejounte Ginobili makes the Dunk and draws the foul on Klay Harden! And-1! Dejounte Ginobili to the line for 1. [Team fouls: 3] (Klay Harden: 1 personal fouls)   FT 1/1: GOOD Dejounte Ginobili makes 1/1 from the line.
Score: 73-67

[07:39] Team_001 possession (Score: 73-67)
Miles Griffin attempts a 3Pt. Contested by Luka Sexton (4.1 feet, ZONE). Miles Griffin misses. Rebound secured by Giannis Quickley.

[07:20] Team_084 possession (Score: 73-67)
Dejounte Ginobili attempts a 3Pt. Contested by Klay Harden (4.1 feet, ZONE). Dejounte Ginobili misses. Rebound secured by Miles Griffin.

[07:05] Team_001 possession (Score: 73-67)
Dirk Young attempts a 3Pt. Contested by Dejounte Ginobili (4.8 feet, MAN). DIRK YOUNG MAKES IT! Assist: Cole Ball
Score: 76-67

[06:54] Team_084 possession (Score: 76-67)
Giannis Quickley makes the Dunk and draws the foul on Miles Griffin! And-1! Giannis Quickley to the line for 1. [Team fouls: 4] (Miles Griffin: 1 personal fouls)   FT 1/1: GOOD Giannis Quickley makes 1/1 from the line.
Score: 76-70

[06:37] Team_001 possession (Score: 76-70)
Dirk Young attempts a 3Pt. Contested by Jarrett Booker (4.8 feet, ZONE). DIRK YOUNG MAKES IT! Assist: Klay Harden
Score: 79-70

[06:22] Team_084 possession (Score: 79-70)
Jarrett Booker attempts a Midrange. Contested by Dirk Young (3.8 feet, ZONE). Jarrett Booker misses. Rebound secured by Dejounte McCollum.

[06:06] Team_001 possession (Score: 79-70)
FOUL! Reach-in foul on Giannis Quickley during the drive. [Team fouls: 3] No free throws, side out. (Giannis Quickley: 2 personal fouls)

[05:56] Team_001 possession (Score: 79-70)
Cole Ball attempts a Layup. BLOCKED BY KLAY THOMPSON! Ball is loose! Rebound secured by Giannis Quickley.

[05:44] Team_084 possession (Score: 79-70)
Jarrett Booker attempts a Midrange. Contested by Dejounte McCollum (4.0 feet, MAN). Jarrett Booker misses. Rebound secured by Miles Griffin.

[05:34] Team_001 possession (Score: 79-70)
Cole Ball drives, Giannis Quickley stays with him. Cole Ball attempts a Dunk. Contested by Giannis Quickley (4.2 feet, ZONE). COLE BALL MAKES IT! Assist: Miles Griffin
Score: 81-70

[05:20] Team_084 possession (Score: 81-70)
Giannis Quickley attempts a Dunk. BLOCKED BY MILES GRIFFIN! Ball is loose! Offensive rebound by Dejounte Ginobili! Dejounte Ginobili kicks it out.

[05:05] Team_084 possession (Score: 81-70)
Jarrett Booker attempts a 3Pt. Contested by Cole Ball (3.4 feet, ZONE). Jarrett Booker misses. Rebound secured by Cole Ball.

[04:52] Team_001 possession (Score: 81-70)
Klay Harden attempts a Midrange. Contested by Giannis Quickley (4.4 feet, ZONE). KLAY HARDEN MAKES IT!
Score: 83-70

[04:42] Team_084 possession (Score: 83-70)
Giannis Quickley drives to the basket... Giannis Quickley commits a violation (traveling/carry)! TURNOVER! (dead ball)

[04:29] Team_001 possession (Score: 83-70)
Cole Ball throws a bad pass! Stolen by Klay Thompson! TURNOVER! (live ball)

[04:11] Team_084 possession (Score: 83-70)
Jarrett Booker attempts a Midrange. Contested by Dejounte McCollum (4.1 feet, MAN). JARRETT BOOKER MAKES IT!
Score: 83-72

[03:56] Team_001 possession (Score: 83-72)
FOUL! Holding foul on Giannis Quickley. [Team fouls: 4] No free throws, side out. (Giannis Quickley: 3 personal fouls)

[03:38] Team_001 possession (Score: 83-72)
Klay Harden attempts a 3Pt. Contested by Luka Sexton (3.7 feet, MAN). Klay Harden misses. Rebound secured by Giannis Quickley.

[03:19] Team_084 possession (Score: 83-72)
Giannis Quickley attempts a Layup. Contested by Miles Griffin (4.5 feet, MAN). GIANNIS QUICKLEY MAKES IT!
Score: 83-74

[03:02] Team_001 possession (Score: 83-74)
Klay Harden attempts a 3Pt. Contested by Luka Sexton (3.7 feet, MAN). Klay Harden misses. Rebound secured by Giannis Quickley.

[02:49] Team_084 possession (Score: 83-74)
Dejounte Ginobili attempts a 3Pt. Contested by Klay Harden (4.4 feet, ZONE). Dejounte Ginobili misses. Offensive rebound by Giannis Quickley! Giannis Quickley puts it back in!
Score: 83-76

[02:34] Team_001 possession (Score: 83-76)
Dejounte McCollum attempts a Layup. Contested by Jarrett Booker (4.7 feet, MAN). Dejounte McCollum misses. Offensive rebound by Cole Ball! Cole Ball kicks it out.

[02:21] Team_001 possession (Score: 83-76)
Dejounte McCollum makes the Layup and draws the foul on Jarrett Booker! And-1! Dejounte McCollum to the line for 1. [BONUS: 5 team fouls] (Jarrett Booker: 1 personal fouls)   FT 1/1: GOOD Dejounte McCollum makes 1/1 from the line.
Score: 86-76

[02:07] Team_084 possession (Score: 86-76)
Giannis Quickley drives to the basket... Giannis Quickley commits a violation (traveling/carry)! TURNOVER! (dead ball)

[02:07] Substitution (Team_001): Klay Harden OUT → Ja Dosunmu IN (stamina_rule2)

[02:07] Substitution (Team_001): Dirk Young OUT → Rudy George IN (stamina_rule2)

[02:07] Substitution (Team_001): Cole Ball OUT → Larry Trent IN (stamina_rule2)

[02:07] Substitution (Team_001): Dejounte McCollum OUT → Franz Bryant IN (stamina_rule2)

[02:07] Substitution (Team_001): Miles Griffin OUT → Kristaps Ming IN (stamina_rule2)

[02:07] Substitution (Team_084): Luka Sexton OUT → Magic Bryant IN (stamina_rule2)

[02:07] Substitution (Team_084): Dejounte Ginobili OUT → Chris Parker IN (stamina_rule2)

[02:07] Substitution (Team_084): Klay Thompson OUT → Evan Quickley IN (stamina_rule2)

[02:07] Substitution (Team_084): Jarrett Booker OUT → Pascal Jackson IN (stamina_rule2)

[02:07] Substitution (Team_084): Giannis Quickley OUT → Dejounte Porzingis IN (stamina_rule2)

[01:47] Team_001 possession (Score: 86-76)
Franz Bryant throws a bad pass! Stolen by Pascal Jackson! TURNOVER! (live ball)

[01:33] Team_084 possession (Score: 86-76)
Dejounte Porzingis attempts a 3Pt. Contested by Ja Dosunmu (4.1 feet, ZONE). Dejounte Porzingis misses. Offensive rebound by Pascal Jackson! Pascal Jackson kicks it out.

[01:21] Team_084 possession (Score: 86-76)
Pascal Jackson attempts a Layup. Contested by Franz Bryant (4.3 feet, MAN). PASCAL JACKSON MAKES IT! Assist: Magic Bryant
Score: 86-78

[01:07] Team_001 possession (Score: 86-78)
Ja Dosunmu drives, picks up Dejounte Porzingis. Help arrives from Magic Bryant! Ja Dosunmu attempts a Dunk. Contested by Magic Bryant (5.3 feet, ZONE). JA DOSUNMU MAKES IT!
Score: 88-78

[00:54] Team_084 possession (Score: 88-78)
Dejounte Porzingis attempts a Midrange. Contested by Rudy George (4.4 feet, ZONE). DEJOUNTE PORZINGIS MAKES IT!
Score: 88-80

[00:36] Team_001 possession (Score: 88-80)
Kristaps Ming attempts a 3Pt. Contested by Dejounte Porzingis (5.1 feet, MAN). KRISTAPS MING MAKES IT! Assist: Ja Dosunmu
Score: 91-80

[00:21] Team_084 possession (Score: 91-80)
Dejounte Porzingis drives, Kristaps Ming stays with him. Dejounte Porzingis attempts a Layup. Contested by Kristaps Ming (5.5 feet, MAN). DEJOUNTE PORZINGIS MAKES IT!
Score: 91-82

[00:10] Team_001 possession (Score: 91-82)
Franz Bryant attempts a 3Pt. Contested by Pascal Jackson (4.8 feet, MAN). Franz Bryant misses. Rebound secured by Evan Quickley.

================================================================================
                              3RD QUARTER COMPLETE                              
================================================================================

3RD QUARTER SCORE: Team_001 27, Team_084 28

BOX SCORE:
================================================================================

Team_001
--------------------------------------------------------------------------------
Player                MIN  PTS  REB  AST  TO      FG   FG%      3P   3P%
--------------------------------------------------------------------------------
Dirk Young             26   12    0    0   0   4/7    57.1     0/0   0.0
Cole Ball              26    5    3    1   0   2/3    66.7     0/0   0.0
Dejounte McCollum      26    3    1    1   0   1/1   100.0     0/0   0.0
Kristaps Ming          10    3    0    0   0   1/1   100.0     0/0   0.0
Klay Harden            26    2    0    1   0   1/4    25.0     0/0   0.0
Ja Dosunmu             10    2    0    1   0   1/1   100.0     0/0   0.0
Miles Griffin          26    0    4    2   0   0/1     0.0     0/0   0.0
Franz Bryant           10    0    0    0   0   0/1     0.0     0/0   0.0

TEAM: FG: 10/19 (52.6%), 3PT: 4/11 (36.4%), REB: 8 (2 off, 6 def), AST: 6, TO: 4
TEAM FOULS: 4


Team_084
--------------------------------------------------------------------------------
Player                MIN  PTS  REB  AST  TO      FG   FG%      3P   3P%
--------------------------------------------------------------------------------
Giannis Quickley       26    9    7    0   0   4/4   100.0     0/0   0.0
Klay Thompson          26    4    0    0   0   2/3    66.7     0/0   0.0
Dejounte Porzingis     10    4    0    0   0   2/2   100.0     0/0   0.0
Dejounte Ginobili      26    3    3    3   0   1/3    33.3     0/0   0.0
Jarrett Booker         26    3    0    0   0   2/5    40.0     0/0   0.0
Luka Sexton            26    3    0    0   0   1/1   100.0     0/0   0.0
Pascal Jackson         10    2    1    0   0   1/1   100.0     0/0   0.0
Magic Bryant           10    0    0    1   0   0/0     0.0     0/0   0.0
Evan Quickley          10    0    1    0   0   0/0     0.0     0/0   0.0

TEAM: FG: 13/19 (68.4%), 3PT: 2/4 (50.0%), REB: 12 (3 off, 9 def), AST: 4, TO: 3
TEAM FOULS: 5 [Team_001 in BONUS]

================================================================================

================================================================================
                       4TH QUARTER - Team_001 vs Team_084                       
================================================================================

[12:00] Team_001 possession (Score: 91-82)
Miles Griffin attempts a Layup. Contested by Giannis Quickley (4.9 feet, ZONE). Miles Griffin misses. Rebound secured by Giannis Quickley.

[11:49] Team_084 possession (Score: 91-82)
Giannis Quickley drives, Miles Griffin stays with him. Giannis Quickley attempts a Layup. Contested by Miles Griffin (4.4 feet, ZONE). Giannis Quickley misses. Rebound secured by Dejounte McCollum.

[11:37] Team_001 possession (Score: 91-82)
Dejounte McCollum attempts a Midrange. Contested by Jarrett Booker (4.6 feet, ZONE). DEJOUNTE MCCOLLUM MAKES IT! Assist: Cole Ball
Score: 93-82

[11:18] Team_084 possession (Score: 93-82)
Luka Sexton attempts a Layup. BLOCKED BY KLAY HARDEN! Ball goes out off Klay Harden. Luka Sexton's ball!

[11:07] Team_084 possession (Score: 93-82)
Dejounte Ginobili throws a bad pass! Stolen by Dirk Young! TURNOVER! (live ball)

[10:52] Team_001 possession (Score: 93-82)
FOUL! Reach-in foul on Giannis Quickley during the drive. [Team fouls: 1] No free throws, side out. (Giannis Quickley: 1 personal fouls)

[10:38] Team_001 possession (Score: 93-82)
Klay Harden attempts a Midrange. Contested by Luka Sexton (3.7 feet, MAN). Klay Harden misses. Offensive rebound by Miles Griffin! Miles Griffin kicks it out.

[10:22] Team_001 possession (Score: 93-82)
Cole Ball makes the Layup and draws the foul on Giannis Quickley! And-1! Cole Ball to the line for 1. [Team fouls: 2] (Giannis Quickley: 2 personal fouls)   FT 1/1: GOOD Cole Ball makes 1/1 from the line.
Score: 96-82

[10:08] Team_084 possession (Score: 96-82)
Klay Thompson attempts a 3Pt. Contested by Klay Harden (4.6 feet, ZONE). Klay Thompson misses. Rebound secured by Miles Griffin.

[09:51] Team_001 possession (Score: 96-82)
Klay Harden attempts a 3Pt. Contested by Luka Sexton (3.8 feet, MAN). KLAY HARDEN MAKES IT! Assist: Cole Ball
Score: 99-82

[09:40] Team_084 possession (Score: 99-82)
Klay Thompson loses the ball! Stripped by Cole Ball! TURNOVER! (live ball)

[09:24] Team_001 possession (Score: 99-82)
Dirk Young drives, Giannis Quickley stays with him. Dirk Young attempts a Dunk. Contested by Giannis Quickley (5.0 feet, ZONE). Dirk Young misses. Rebound secured by Dejounte Ginobili.

[09:11] Team_084 possession (Score: 99-82)
Dejounte Ginobili attempts a 3Pt. Contested by Klay Harden (4.5 feet, ZONE). Dejounte Ginobili misses. Rebound secured by Cole Ball.

[08:53] Team_001 possession (Score: 99-82)
FOUL! Reach-in foul on Giannis Quickley during the drive. [Team fouls: 3] No free throws, side out. (Giannis Quickley: 3 personal fouls)

[08:41] Team_001 possession (Score: 99-82)
FOUL! Holding foul on Klay Thompson. [Team fouls: 4] No free throws, side out. (Klay Thompson: 1 personal fouls)

[08:26] Team_001 possession (Score: 99-82)
Klay Harden attempts a Layup. BLOCKED BY GIANNIS QUICKLEY! Ball is loose! Rebound secured by Dejounte Ginobili.

[08:12] Team_084 possession (Score: 99-82)
Jarrett Booker attempts a Midrange. Contested by Cole Ball (3.7 feet, ZONE). Jarrett Booker misses. Offensive rebound by Giannis Quickley! Giannis Quickley puts it back in!
Score: 99-84

[07:59] Team_001 possession (Score: 99-84)
Cole Ball attempts a Layup. Contested by Giannis Quickley (4.7 feet, ZONE). COLE BALL MAKES IT! Assist: Klay Harden
Score: 101-84

[07:49] Team_084 possession (Score: 101-84)
Dejounte Ginobili attempts a Layup. Contested by Dirk Young (4.3 feet, MAN). Dejounte Ginobili misses. FOUL! Loose ball foul on Dejounte McCollum during the rebound battle. [Team fouls: 1] No free throws, side out. (Dejounte McCollum: 1 personal fouls)

[07:36] Team_084 possession (Score: 101-84)
Jarrett Booker attempts a Midrange. Contested by Cole Ball (3.8 feet, ZONE). JARRETT BOOKER MAKES IT!
Score: 101-86

[07:16] Team_001 possession (Score: 101-86)
Dirk Young attempts a 3Pt. Contested by Luka Sexton (4.3 feet, ZONE). Dirk Young misses. Offensive rebound by Cole Ball! Cole Ball kicks it out.

[07:04] Team_001 possession (Score: 101-86)
Dejounte McCollum attempts a Midrange. Contested by Jarrett Booker (5.1 feet, MAN). Dejounte McCollum misses. Rebound secured by Dejounte Ginobili.

[06:46] Team_084 possession (Score: 101-86)
Dejounte Ginobili attempts a 3Pt. Contested by Klay Harden (4.8 feet, ZONE). Dejounte Ginobili misses. Rebound secured by Miles Griffin.

[06:31] Team_001 possession (Score: 101-86)
Cole Ball throws a bad pass! Stolen by Klay Thompson! TURNOVER! (live ball)

[06:19] Team_084 possession (Score: 101-86)
Dejounte Ginobili attempts a Layup. Contested by Miles Griffin (5.0 feet, ZONE). DEJOUNTE GINOBILI MAKES IT! Assist: Klay Thompson
Score: 101-88

[06:07] Team_001 possession (Score: 101-88)
Dejounte McCollum attempts a Layup. BLOCKED BY DEJOUNTE GINOBILI! Ball is loose! Rebound secured by Dejounte Ginobili.

[05:53] Team_084 possession (Score: 101-88)
Jarrett Booker attempts a Layup. Contested by Miles Griffin (5.1 feet, ZONE). Jarrett Booker misses. Rebound secured by Cole Ball.

[05:39] Team_001 possession (Score: 101-88)
Dirk Young drives and kicks out. Miles Griffin attempts a Midrange. Contested by Dejounte Ginobili (5.3 feet, ZONE). Miles Griffin misses. Rebound secured by Dejounte Ginobili.

[05:25] Team_084 possession (Score: 101-88)
Giannis Quickley attempts a Midrange. Contested by Miles Griffin (5.2 feet, MAN). GIANNIS QUICKLEY MAKES IT! Assist: Dejounte Ginobili
Score: 101-90

[05:09] Team_001 possession (Score: 101-90)
FOUL! Reach-in foul on Giannis Quickley during the drive. [IN THE BONUS! 5 team fouls] Dirk Young to the line for 2 free throws. (Giannis Quickley: 4 personal fouls)   FT 1/2: GOOD   FT 2/2: GOOD Dirk Young makes 2/2 from the line.
Score: 103-90

[04:54] Team_084 possession (Score: 103-90)
Giannis Quickley makes the Layup and draws the foul on Klay Harden! And-1! Giannis Quickley to the line for 1. [Team fouls: 2] (Klay Harden: 1 personal fouls)   FT 1/1: MISS Giannis Quickley makes 0/1 from the line. Rebound secured by Dejounte McCollum.
Score: 103-92

[04:37] Team_001 possession (Score: 103-92)
Dejounte McCollum attempts a Midrange. Contested by Dejounte Ginobili (5.3 feet, ZONE). Dejounte McCollum misses. Rebound secured by Giannis Quickley.

[04:24] Team_084 possession (Score: 103-92)
Jarrett Booker drives and kicks out. Luka Sexton attempts a 3Pt. Contested by Klay Harden (5.1 feet, ZONE). LUKA SEXTON MAKES IT!
Score: 103-95

[04:10] Team_001 possession (Score: 103-95)
Dejounte McCollum attempts a Midrange. Contested by Jarrett Booker (5.4 feet, MAN). DEJOUNTE MCCOLLUM MAKES IT! Assist: Miles Griffin
Score: 105-95

[03:57] Team_084 possession (Score: 105-95)
FOUL! Shooting foul on Cole Ball. Luka Sexton to the line for 3 free throws. [Team fouls: 3] (Cole Ball: 1 personal fouls)   FT 1/3: GOOD   FT 2/3: GOOD   FT 3/3: GOOD Luka Sexton makes 3/3 from the line.
Score: 105-98

[03:39] Team_001 possession (Score: 105-98)
Dejounte McCollum attempts a 3Pt. Contested by Jarrett Booker (5.5 feet, MAN). Dejounte McCollum misses. Rebound secured by Dejounte Ginobili.

[03:26] Team_084 possession (Score: 105-98)
Giannis Quickley drives, Miles Griffin stays with him. Giannis Quickley attempts a Dunk. Contested by Miles Griffin (5.4 feet, MAN). GIANNIS QUICKLEY MAKES IT! Assist: Luka Sexton
Score: 105-100

[03:14] Team_001 possession (Score: 105-100)
FOUL! Reach-in foul on Jarrett Booker during the drive. [IN THE BONUS! 6 team fouls] Dejounte McCollum to the line for 2 free throws. (Jarrett Booker: 1 personal fouls)   FT 1/2: GOOD   FT 2/2: GOOD Dejounte McCollum makes 2/2 from the line.
Score: 107-100

[03:00] Team_084 possession (Score: 107-100)
Giannis Quickley drives and kicks out. Klay Thompson attempts a 3Pt. Contested by Cole Ball (4.3 feet, MAN). Klay Thompson misses. Rebound secured by Cole Ball.

[02:47] Team_001 possession (Score: 107-100)
Dirk Young throws a bad pass out of bounds! TURNOVER! (dead ball)

[02:47] Substitution (Team_001): Klay Harden OUT → Ja Dosunmu IN (stamina_rule2)

[02:47] Substitution (Team_001): Dirk Young OUT → Rudy George IN (stamina_rule2)

[02:47] Substitution (Team_001): Cole Ball OUT → Larry Trent IN (stamina_rule2)

[02:47] Substitution (Team_001): Dejounte McCollum OUT → Franz Bryant IN (stamina_rule2)

[02:47] Substitution (Team_001): Miles Griffin OUT → Kristaps Ming IN (stamina_rule2)

[02:47] Substitution (Team_084): Luka Sexton OUT → Magic Bryant IN (stamina_rule2)

[02:47] Substitution (Team_084): Dejounte Ginobili OUT → Chris Parker IN (stamina_rule2)

[02:47] Substitution (Team_084): Klay Thompson OUT → Evan Quickley IN (stamina_rule2)

[02:47] Substitution (Team_084): Jarrett Booker OUT → Pascal Jackson IN (stamina_rule2)

[02:47] Substitution (Team_084): Giannis Quickley OUT → Dejounte Porzingis IN (stamina_rule2)

[02:34] Team_084 possession (Score: 107-100)
FOUL! Reach-in foul on Franz Bryant during the drive. [Team fouls: 4] No free throws, side out. (Franz Bryant: 1 personal fouls)

[02:16] Team_084 possession (Score: 107-100)
Pascal Jackson drives, picks up Franz Bryant. Help arrives from Rudy George! Pascal Jackson attempts a Layup. Contested by Rudy George (4.3 feet, ZONE). Pascal Jackson misses. Offensive rebound by Dejounte Porzingis! Dejounte Porzingis kicks it out.

[02:06] Team_084 possession (Score: 107-100)
FOUL! Shooting foul on Franz Bryant. Pascal Jackson to the line for 2 free throws. [BONUS: 5 team fouls] (Franz Bryant: 2 personal fouls)   FT 1/2: GOOD   FT 2/2: GOOD Pascal Jackson makes 2/2 from the line.
Score: 107-102

[01:51] Team_001 possession (Score: 107-102)
Franz Bryant drives and kicks out. Ja Dosunmu attempts a Midrange. Contested by Magic Bryant (3.7 feet, MAN). Ja Dosunmu misses. Rebound secured by Dejounte Porzingis.

[01:34] Team_084 possession (Score: 107-102)
Evan Quickley attempts a 3Pt. Contested by Larry Trent (4.1 feet, MAN). Evan Quickley misses. Offensive rebound by Pascal Jackson! Pascal Jackson kicks it out.

[01:19] Team_084 possession (Score: 107-102)
FOUL! Shooting foul on Larry Trent. Evan Quickley to the line for 2 free throws. [BONUS: 6 team fouls] (Larry Trent: 1 personal fouls)   FT 1/2: GOOD   FT 2/2: GOOD Evan Quickley makes 2/2 from the line.
Score: 107-104

[01:06] Team_001 possession (Score: 107-104)
Larry Trent attempts a Midrange. Contested by Pascal Jackson (5.2 feet, ZONE). LARRY TRENT MAKES IT! Assist: Franz Bryant
Score: 109-104

[00:55] Team_084 possession (Score: 109-104)
Dejounte Porzingis attempts a Layup. Contested by Franz Bryant (4.2 feet, ZONE). DEJOUNTE PORZINGIS MAKES IT!
Score: 109-106

[00:41] Team_001 possession (Score: 109-106)
Franz Bryant attempts a 3Pt. Contested by Pascal Jackson (4.8 feet, MAN). Franz Bryant misses. Rebound secured by Dejounte Porzingis.

[00:28] Team_084 possession (Score: 109-106)
Pascal Jackson attempts a 3Pt. Contested by Ja Dosunmu (4.2 feet, ZONE). Pascal Jackson misses. Offensive rebound by Dejounte Porzingis! Dejounte Porzingis kicks it out.

[00:12] Team_084 possession (Score: 109-106)
Pascal Jackson loses control! Ball rolls out of bounds! TURNOVER! (dead ball)

================================================================================
                              4TH QUARTER COMPLETE                              
================================================================================

4TH QUARTER SCORE: Team_001 18, Team_084 24

BOX SCORE:
================================================================================

Team_001
--------------------------------------------------------------------------------
Player                MIN  PTS  REB  AST  TO      FG   FG%      3P   3P%
--------------------------------------------------------------------------------
Dejounte McCollum      36    6    2    0   0   3/7    42.9     0/0   0.0
Cole Ball              36    5    4    2   0   2/2   100.0     0/0   0.0
Klay Harden            36    3    0    1   0   1/2    50.0     0/0   0.0
Dirk Young             36    2    0    0   0   1/3    33.3     0/0   0.0
Larry Trent            13    2    0    0   0   1/1   100.0     0/0   0.0
Miles Griffin          36    0    3    1   0   0/1     0.0     0/0   0.0
Franz Bryant           13    0    0    1   0   0/2     0.0     0/0   0.0

TEAM: FG: 8/18 (44.4%), 3PT: 1/3 (33.3%), REB: 9 (2 off, 7 def), AST: 5, TO: 2
TEAM FOULS: 6 [Team_084 in BONUS]


Team_084
--------------------------------------------------------------------------------
Player                MIN  PTS  REB  AST  TO      FG   FG%      3P   3P%
--------------------------------------------------------------------------------
Giannis Quickley       36    6    4    0   0   3/6    50.0     0/0   0.0
Luka Sexton            36    6    0    1   0   2/2   100.0     0/0   0.0
Dejounte Ginobili      36    2    6    1   0   1/3    33.3     0/0   0.0
Jarrett Booker         36    2    0    0   0   1/2    50.0     0/0   0.0
Dejounte Porzingis     13    2    4    0   0   1/1   100.0     0/0   0.0
Pascal Jackson         13    2    1    0   0   1/1   100.0     0/0   0.0
Evan Quickley          13    2    0    0   0   1/1   100.0     0/0   0.0
Klay Thompson          36    0    0    1   0   0/1     0.0     0/0   0.0

TEAM: FG: 10/17 (58.8%), 3PT: 1/4 (25.0%), REB: 15 (5 off, 10 def), AST: 3, TO: 3
TEAM FOULS: 6 [Team_001 in BONUS]

================================================================================

================================================================================
                               FULL GAME COMPLETE                               
================================================================================

FINAL SCORE: Team_001 109, Team_084 106

SCORING BY QUARTER:
--------------------------------------------------------------------------------
Team                     Q1     Q2     Q3     Q4    FINAL
--------------------------------------------------------------------------------
Team_001                 41     23     27     18      109
Team_084                 22     32     28     24      106
--------------------------------------------------------------------------------

FULL GAME BOX SCORE:
================================================================================

Team_001
--------------------------------------------------------------------------------
Player                MIN  PTS  REB  AST  TO      FG   FG%      3P   3P%      FT STL BLK
--------------------------------------------------------------------------------
Klay Harden            36   12    0    3   1   6/10   60.0   1/4    25.0   3/3     0   1
Dirk Young             36   30    0    3   2  10/16   62.5   5/7    71.4   6/6     2   0
Cole Ball              36   15   13    6   3   5/11   45.5   1/2    50.0   1/1     1   1
Dejounte McCollum      36   21    7    2   2   9/15   60.0   1/2    50.0   6/7     0   1
Miles Griffin          36    8   15    3   0   4/8    50.0   0/1     0.0   4/4     1   1
Ja Dosunmu             13    8    0    1   0   3/3   100.0   1/1   100.0   1/1     0   0
Rudy George            13    7    2    0   1   3/5    60.0   1/3    33.3   3/3     0   0
Larry Trent            13    2    3    0   0   1/2    50.0   0/1     0.0   0/0     0   0
Franz Bryant           13    1    0    1   1   1/7    14.3   0/4     0.0   1/2     0   0
Kristaps Ming          13    3    3    0   0   1/1   100.0   1/1   100.0   0/0     0   0

TEAM: FG: 43/78 (55.1%), 3PT: 11/26 (42.3%), REB: 42 (10 off, 32 def), AST: 19, TO: 10


Team_084
--------------------------------------------------------------------------------
Player                MIN  PTS  REB  AST  TO      FG   FG%      3P   3P%      FT STL BLK
--------------------------------------------------------------------------------
Luka Sexton            36   15    0    3   1   4/4   100.0   4/4   100.0   3/3     0   0
Dejounte Ginobili      36   15   13    4   2   7/16   43.8   1/7    14.3   1/4     1   2
Klay Thompson          36    7    4    2   1   3/9    33.3   1/4    25.0   0/0     2   1
Jarrett Booker         36   11    0    2   1   8/17   47.1   0/2     0.0   3/4     1   0
Giannis Quickley       36   23   13    1   3   8/12   66.7   1/1   100.0   4/5     1   2
Magic Bryant           13   11    0    1   0   3/4    75.0   3/4    75.0   2/2     0   0
Chris Parker           13    2    0    0   0   1/1   100.0   0/0     0.0   0/0     0   0
Evan Quickley          13    4    2    2   0   2/5    40.0   0/2     0.0   4/5     0   0
Pascal Jackson         13    4    6    0   1   2/3    66.7   0/0     0.0   2/2     1   0
Dejounte Porzingis     13    8    9    1   0   4/4   100.0   0/0     0.0   2/2     1   0

TEAM: FG: 43/76 (56.6%), 3PT: 10/24 (41.7%), REB: 48 (13 off, 35 def), AST: 16, TO: 9

================================================================================
