================================================================================
                        FULL GAME - Team_031 vs Team_005                        
================================================================================

================================================================================
                       1ST QUARTER - Team_031 vs Team_005                       
================================================================================

[12:00] Team_031 possession (Score: 0-0)
Gary Morant drives and kicks out. Immanuel James attempts a Midrange. Contested by Cade Markkanen (3.2 feet, MAN). Immanuel James misses. Rebound secured by Jalen Rozier.

[11:48] Team_005 possession (Score: 0-0)
Cade Markkanen attempts a 3Pt. Contested by Pau Irving (3.4 feet, ZONE). Cade Markkanen misses. Offensive rebound by Cade Markkanen! Cade Markkanen's putback is no good. Rebound secured by Immanuel James.

[11:31] Team_031 possession (Score: 0-0)
Gary Morant attempts a 3Pt. Contested by Derrick Allen (4.8 feet, ZONE). Gary Morant misses. Rebound secured by Cade Markkanen.

[11:15] Team_005 possession (Score: 0-0)
Brandon George drives to the basket... Brandon George throws a bad pass! Stolen by Immanuel James! TURNOVER! (live ball)

[11:02] Team_031 possession (Score: 0-0)
FOUL! Reach-in foul on Brandon George during the drive. [Team fouls: 1] No free throws, side out. (Brandon George: 1 personal fouls)

[10:50] Team_031 possession (Score: 0-0)
FOUL! Holding foul on Brandon George. [Team fouls: 2] No free throws, side out. (Brandon George: 2 personal fouls)

[10:36] Team_031 possession (Score: 0-0)
Shai Durant drives, picks up Brandon George. Help arrives from Anthony Rozier! Shai Durant attempts a Dunk. Contested by Anthony Rozier (5.3 feet, MAN). SHAI DURANT MAKES IT! Assist: Pau Irving
Score: 2-0

[10:19] Team_005 possession (Score: 2-0)
Brandon George attempts a Layup. Contested by Shai Durant (4.1 feet, MAN). BRANDON GEORGE MAKES IT! Assist: Jalen Rozier
Score: 2-2

[10:07] Team_031 possession (Score: 2-2)
Immanuel James attempts a Layup. Contested by Cade Markkanen (3.7 feet, ZONE). IMMANUEL JAMES MAKES IT! Assist: Luka Sabonis
Score: 4-2

[09:51] Team_005 possession (Score: 4-2)
Derrick Allen attempts a Layup. Contested by Immanuel James (3.4 feet, ZONE). Derrick Allen misses. Offensive rebound by Jalen Rozier! Jalen Rozier kicks it out.

[09:33] Team_005 possession (Score: 4-2)
Brandon George drives and kicks out. Jalen Rozier attempts a 3Pt. Contested by Immanuel James (3.0 feet, MAN). JALEN ROZIER MAKES IT! Assist: Derrick Allen
Score: 4-5

[09:17] Team_031 possession (Score: 4-5)
Shai Durant attempts a 3Pt. Contested by Brandon George (5.3 feet, MAN). Shai Durant misses. Rebound secured by Derrick Allen.

[09:02] Team_005 possession (Score: 4-5)
Cade Markkanen drives to the basket... Cade Markkanen loses control! Ball rolls out of bounds! TURNOVER! (dead ball)

[08:45] Team_031 possession (Score: 4-5)
Pau Irving drives, Derrick Allen stays with him. Pau Irving attempts a Layup. Contested by Derrick Allen (4.3 feet, MAN). Pau Irving misses. Rebound secured by Jalen Rozier.

[08:32] Team_005 possession (Score: 4-5)
Cade Markkanen attempts a Layup. Contested by Luka Sabonis (3.0 feet, MAN). CADE MARKKANEN MAKES IT!
Score: 4-7

[08:19] Team_031 possession (Score: 4-7)
Pau Irving attempts a 3Pt. Contested by Derrick Allen (4.3 feet, ZONE). Pau Irving misses. Offensive rebound by Immanuel James! Immanuel James puts it back in!
Score: 6-7

[08:04] Team_005 possession (Score: 6-7)
Jalen Rozier makes the Dunk and draws the foul on Shai Durant! And-1! Jalen Rozier to the line for 1. [Team fouls: 1] (Shai Durant: 1 personal fouls)   FT 1/1: GOOD Jalen Rozier makes 1/1 from the line.
Score: 6-10

[07:51] Team_031 possession (Score: 6-10)
Pau Irving attempts a 3Pt. Contested by Brandon George (5.2 feet, ZONE). Pau Irving misses. Rebound secured by Cade Markkanen.

[07:33] Team_005 possession (Score: 6-10)
Jalen Rozier drives, Immanuel James stays with him. Jalen Rozier attempts a Dunk. Contested by Immanuel James (3.3 feet, MAN). JALEN ROZIER MAKES IT! Assist: Brandon George
Score: 6-12

[07:16] Team_031 possession (Score: 6-12)
Luka Sabonis attempts a Dunk. BLOCKED BY CADE MARKKANEN! Ball deflects out of bounds off Luka Sabonis.

[07:04] Team_005 possession (Score: 6-12)
Anthony Rozier attempts a 3Pt. Contested by Gary Morant (3.8 feet, MAN). ANTHONY ROZIER MAKES IT! Assist: Brandon George
Score: 6-15

[06:48] Team_031 possession (Score: 6-15)
Pau Irving attempts a 3Pt. Contested by Derrick Allen (4.3 feet, ZONE). Pau Irving misses. Rebound secured by Jalen Rozier.

[06:34] Team_005 possession (Score: 6-15)
Anthony Rozier attempts a 3Pt. Contested by Gary Morant (3.8 feet, MAN). Anthony Rozier misses. Rebound secured by Luka Sabonis.

[06:22] Team_031 possession (Score: 6-15)
Shai Durant attempts a Midrange. Contested by Derrick Allen (4.4 feet, ZONE). Shai Durant misses. Offensive rebound by Immanuel James! Immanuel James's putback is no good. Offensive rebound by Luka Sabonis! Luka Sabonis kicks it out.

[06:02] Team_031 possession (Score: 6-15)
Luka Sabonis attempts a Midrange. Contested by Cade Markkanen (3.9 feet, MAN). Luka Sabonis misses. Offensive rebound by Luka Sabonis! Luka Sabonis puts it back in!
Score: 8-15

[05:47] Team_005 possession (Score: 8-15)
Derrick Allen makes the Layup and draws the foul on Pau Irving! And-1! Derrick Allen to the line for 1. [Team fouls: 2] (Pau Irving: 1 personal fouls)   FT 1/1: MISS Derrick Allen makes 0/1 from the line. Rebound secured by Luka Sabonis.
Score: 8-17

[05:31] Team_031 possession (Score: 8-17)
Shai Durant attempts a 3Pt. Contested by Brandon George (5.3 feet, MAN). Shai Durant misses. FOUL! Loose ball foul on Jalen Rozier during the rebound battle. [Team fouls: 4] No free throws, side out. (Jalen Rozier: 1 personal fouls)

[05:19] Team_031 possession (Score: 8-17)
Immanuel James attempts a 3Pt. Contested by Cade Markkanen (3.7 feet, MAN). Immanuel James misses. Rebound secured by Jalen Rozier.

[05:04] Team_005 possession (Score: 8-17)
Jalen Rozier makes the Dunk and draws the foul on Shai Durant! And-1! Jalen Rozier to the line for 1. [Team fouls: 3] (Shai Durant: 2 personal fouls)   FT 1/1: GOOD Jalen Rozier makes 1/1 from the line.
Score: 8-20

[04:49] Team_031 possession (Score: 8-20)
Luka Sabonis drives to the basket... FOUL! Offensive foul on Luka Sabonis! Jalen Rozier drew the charge! [Team fouls: 4] (Luka Sabonis: 1 personal fouls) TURNOVER! (dead ball)

[04:37] Team_005 possession (Score: 8-20)
Cade Markkanen drives to the basket... FOUL! Offensive foul on Cade Markkanen! Luka Sabonis drew the charge! [Team fouls: 5] (Cade Markkanen: 2 personal fouls) TURNOVER! (dead ball)

[04:28] Team_031 possession (Score: 8-20)
Immanuel James attempts a Layup. Contested by Cade Markkanen (3.8 feet, MAN). IMMANUEL JAMES MAKES IT! Assist: Gary Morant
Score: 10-20

[04:11] Team_005 possession (Score: 10-20)
Jalen Rozier attempts a Midrange. Contested by Immanuel James (3.5 feet, MAN). Jalen Rozier misses. Rebound secured by Immanuel James.

[03:55] Team_031 possession (Score: 10-20)
Immanuel James makes the Midrange and draws the foul on Jalen Rozier! And-1! Immanuel James to the line for 1. [BONUS: 6 team fouls] (Jalen Rozier: 2 personal fouls)   FT 1/1: GOOD Immanuel James makes 1/1 from the line.
Score: 13-20

[03:38] Team_005 possession (Score: 13-20)
Anthony Rozier attempts a Midrange. Contested by Gary Morant (3.9 feet, MAN). Anthony Rozier misses. Rebound secured by Luka Sabonis.

[03:20] Team_031 possession (Score: 13-20)
Immanuel James makes the Dunk and draws the foul on Jalen Rozier! And-1! Immanuel James to the line for 1. [BONUS: 7 team fouls] (Jalen Rozier: 3 personal fouls)   FT 1/1: MISS Immanuel James makes 0/1 from the line. Rebound secured by Cade Markkanen.
Score: 15-20

[03:02] Team_005 possession (Score: 15-20)
Cade Markkanen attempts a 3Pt. Contested by Pau Irving (3.6 feet, ZONE). CADE MARKKANEN MAKES IT! Assist: Brandon George
Score: 15-23

[02:42] Team_031 possession (Score: 15-23)
Immanuel James makes the Layup and draws the foul on Anthony Rozier! And-1! Immanuel James to the line for 1. [BONUS: 8 team fouls] (Anthony Rozier: 1 personal fouls)   FT 1/1: GOOD Immanuel James makes 1/1 from the line.
Score: 18-23

[02:28] Team_005 possession (Score: 18-23)
Anthony Rozier attempts a 3Pt. Contested by Pau Irving (3.9 feet, ZONE). Anthony Rozier misses. FOUL! Loose ball foul on Luka Sabonis during the rebound battle. [IN THE BONUS! 5 team fouls] Jalen Rozier to the line for 2 free throws. (Luka Sabonis: 2 personal fouls)   FT 1/2: GOOD   FT 2/2: GOOD Jalen Rozier makes 2/2 from the line.
Score: 18-25

[02:12] Team_031 possession (Score: 18-25)
FOUL! Reach-in foul on Cade Markkanen during the drive. [IN THE BONUS! 9 team fouls] Luka Sabonis to the line for 2 free throws. (Cade Markkanen: 3 personal fouls)   FT 1/2: GOOD   FT 2/2: GOOD Luka Sabonis makes 2/2 from the line.
Score: 20-25

[02:02] Team_005 possession (Score: 20-25)
Cade Markkanen attempts a Midrange. Contested by Luka Sabonis (3.4 feet, MAN). Cade Markkanen misses. Rebound secured by Immanuel James.

[01:44] Team_031 possession (Score: 20-25)
Immanuel James drives, picks up Jalen Rozier. Help arrives from Anthony Rozier! Immanuel James attempts a Layup. Contested by Anthony Rozier (5.6 feet, MAN). IMMANUEL JAMES MAKES IT!
Score: 22-25

[01:30] Team_005 possession (Score: 22-25)
Cade Markkanen attempts a Midrange. Contested by Luka Sabonis (3.4 feet, MAN). CADE MARKKANEN MAKES IT!
Score: 22-27

[01:16] Team_031 possession (Score: 22-27)
Immanuel James attempts a 3Pt. Contested by Jalen Rozier (5.6 feet, MAN). Immanuel James misses. Rebound secured by Derrick Allen.

[00:57] Team_005 possession (Score: 22-27)
FOUL! Holding foul on Luka Sabonis. [IN THE BONUS! 6 team fouls] Cade Markkanen to the line for 2 free throws. (Luka Sabonis: 3 personal fouls)   FT 1/2: MISS   FT 2/2: GOOD Cade Markkanen makes 1/2 from the line.
Score: 22-28

[00:44] Team_031 possession (Score: 22-28)
Pau Irving attempts a 3Pt. Contested by Derrick Allen (4.6 feet, MAN). Pau Irving misses. Rebound secured by Cade Markkanen.

[00:29] Team_005 possession (Score: 22-28)
Derrick Allen attempts a 3Pt. Contested by Pau Irving (4.4 feet, ZONE). Derrick Allen misses. Rebound secured by Luka Sabonis.

[00:16] Team_031 possession (Score: 22-28)
Immanuel James attempts a 3Pt. Contested by Derrick Allen (5.0 feet, ZONE). Immanuel James misses. Offensive rebound by Immanuel James! Immanuel James kicks it out.

[00:01] Team_031 possession (Score: 22-28)
Shai Durant drives, picks up Brandon George. Help arrives from Anthony Rozier! Shai Durant attempts a Dunk. Contested by Anthony Rozier (5.8 feet, MAN). Shai Durant misses. Offensive rebound by Immanuel James! Immanuel James kicks it out.

================================================================================
                              1ST QUARTER COMPLETE                              
================================================================================

1ST QUARTER SCORE: Team_031 22, Team_005 28

BOX SCORE:
================================================================================

Team_031
--------------------------------------------------------------------------------
Player                MIN  PTS  REB  AST  TO      FG   FG%      3P   3P%
--------------------------------------------------------------------------------
Immanuel James         12   14    6    0   0   6/9    66.7     0/0   0.0
Luka Sabonis           12    4    7    1   0   2/3    66.7     0/0   0.0
Shai Durant            12    2    0    0   0   1/2    50.0     0/0   0.0
Gary Morant            12    0    0    1   0   0/2     0.0     0/0   0.0
Pau Irving             12    0    0    1   0   0/4     0.0     0/0   0.0

TEAM: FG: 9/20 (45.0%), 3PT: 1/8 (12.5%), REB: 12 (6 off, 6 def), AST: 3, TO: 1
TEAM FOULS: 6 [Team_005 in BONUS]


Team_005
--------------------------------------------------------------------------------
Player                MIN  PTS  REB  AST  TO      FG   FG%      3P   3P%
--------------------------------------------------------------------------------
Jalen Rozier           12   13    5    1   0   5/6    83.3     0/0   0.0
Cade Markkanen         12    8    4    0   0   4/6    66.7     0/0   0.0
Anthony Rozier         12    3    0    0   0   1/3    33.3     0/0   0.0
Brandon George         12    2    0    3   0   1/1   100.0     0/0   0.0
Derrick Allen          12    0    2    1   0   0/2     0.0     0/0   0.0

TEAM: FG: 11/18 (61.1%), 3PT: 3/6 (50.0%), REB: 12 (2 off, 10 def), AST: 5, TO: 3
TEAM FOULS: 9 [Team_031 in BONUS]

================================================================================

================================================================================
                       2ND QUARTER - Team_031 vs Team_005                       
================================================================================

[12:00] Team_031 possession (Score: 22-28)
Luka Sabonis attempts a 3Pt. Contested by Derrick Allen (5.0 feet, ZONE). Luka Sabonis misses. Rebound secured by Cade Markkanen.

[11:47] Team_005 possession (Score: 22-28)
Brandon George attempts a 3Pt. Contested by Pau Irving (4.1 feet, ZONE). BRANDON GEORGE MAKES IT! Assist: Anthony Rozier
Score: 22-31

[11:32] Team_031 possession (Score: 22-31)
Luka Sabonis drives, picks up Cade Markkanen. Help arrives from Anthony Rozier! Luka Sabonis attempts a Dunk. Contested by Anthony Rozier (4.3 feet, MAN). LUKA SABONIS MAKES IT! Assist: Gary Morant
Score: 24-31

[11:19] Team_005 possession (Score: 24-31)
Anthony Rozier attempts a 3Pt. Contested by Gary Morant (4.2 feet, MAN). Anthony Rozier misses. Rebound secured by Gary Morant.

[11:05] Team_031 possession (Score: 24-31)
Luka Sabonis attempts a Midrange. BLOCKED BY CADE MARKKANEN! Ball deflects out of bounds off Luka Sabonis.

[10:51] Team_005 possession (Score: 24-31)
Cade Markkanen attempts a 3Pt. Contested by Gary Morant (4.0 feet, ZONE). Cade Markkanen misses. Rebound secured by Luka Sabonis.

[10:35] Team_031 possession (Score: 24-31)
Pau Irving makes the Layup and draws the foul on Derrick Allen! And-1! Pau Irving to the line for 1. [Team fouls: 1] (Derrick Allen: 1 personal fouls)   FT 1/1: MISS Pau Irving makes 0/1 from the line. FOUL! Loose ball foul on Jalen Rozier during the free throw rebound! [Team fouls: 2] No free throws, side out. (Jalen Rozier: 1 personal fouls)
Score: 26-31

[10:21] Team_031 possession (Score: 26-31)
Pau Irving drives, picks up Cade Markkanen. Help arrives from Anthony Rozier! Pau Irving attempts a Dunk. Contested by Anthony Rozier (4.0 feet, ZONE). PAU IRVING MAKES IT!
Score: 28-31

[10:05] Team_005 possession (Score: 28-31)
Brandon George attempts a Midrange. Contested by Gary Morant (4.4 feet, ZONE). Brandon George misses. Offensive rebound by Derrick Allen! Derrick Allen kicks it out.

[09:54] Team_005 possession (Score: 28-31)
Derrick Allen makes the Layup and draws the foul on Immanuel James! And-1! Derrick Allen to the line for 1. [Team fouls: 1] (Immanuel James: 1 personal fouls)   FT 1/1: GOOD Derrick Allen makes 1/1 from the line.
Score: 28-34

[09:36] Team_031 possession (Score: 28-34)
Gary Morant loses control! Ball rolls out of bounds! TURNOVER! (dead ball)

[09:36] Substitution (Team_031): Shai Durant OUT → Kevin Morant IN (stamina_rule2)

[09:36] Substitution (Team_031): Gary Morant OUT → Isaiah Ingram IN (stamina_rule2)

[09:36] Substitution (Team_031): Pau Irving OUT → Miles Stewart IN (stamina_rule2)

[09:36] Substitution (Team_031): Immanuel James OUT → Kobe Randle IN (stamina_rule2)

[09:36] Substitution (Team_031): Luka Sabonis OUT → Jimmy Poole IN (stamina_rule2)

[09:36] Substitution (Team_005): Brandon George OUT → Blake O'Neal IN (stamina_rule2)

[09:36] Substitution (Team_005): Anthony Rozier OUT → Draymond Smith IN (stamina_rule2)

[09:36] Substitution (Team_005): Derrick Allen OUT → Lauri Wade IN (stamina_rule2)

[09:36] Substitution (Team_005): Jalen Rozier OUT → Isaiah Durant IN (stamina_rule2)

[09:36] Substitution (Team_005): Cade Markkanen OUT → Zion Parker IN (stamina_rule2)

[09:23] Team_005 possession (Score: 28-34)
Blake O'Neal makes the Midrange and draws the foul on Kevin Morant! And-1! Blake O'Neal to the line for 1. [Team fouls: 2] (Kevin Morant: 1 personal fouls)   FT 1/1: GOOD Blake O'Neal makes 1/1 from the line.
Score: 28-37

[09:09] Team_031 possession (Score: 28-37)
Isaiah Ingram attempts a Layup. Contested by Draymond Smith (4.7 feet, MAN). ISAIAH INGRAM MAKES IT!
Score: 30-37

[08:59] Team_005 possession (Score: 30-37)
Blake O'Neal attempts a 3Pt. Contested by Kevin Morant (5.2 feet, MAN). Blake O'Neal misses. Rebound secured by Kobe Randle.

[08:44] Team_031 possession (Score: 30-37)
Miles Stewart attempts a Midrange. Contested by Lauri Wade (5.1 feet, MAN). Miles Stewart misses. Rebound secured by Draymond Smith.

[08:28] Team_005 possession (Score: 30-37)
Isaiah Durant drives, picks up Kobe Randle. Help arrives from Isaiah Ingram! Isaiah Durant attempts a Dunk. Contested by Isaiah Ingram (4.6 feet, MAN). Isaiah Durant misses. Offensive rebound by Zion Parker! Zion Parker's putback is no good. Rebound secured by Kobe Randle.

[08:11] Team_031 possession (Score: 30-37)
Jimmy Poole attempts a Layup. Contested by Zion Parker (4.0 feet, ZONE). JIMMY POOLE MAKES IT! Assist: Kevin Morant
Score: 32-37

[07:58] Team_005 possession (Score: 32-37)
FOUL! Shooting foul on Kobe Randle. Draymond Smith to the line for 2 free throws. [Team fouls: 3] (Kobe Randle: 1 personal fouls)   FT 1/2: GOOD   FT 2/2: GOOD Draymond Smith makes 2/2 from the line.
Score: 32-39

[07:42] Team_031 possession (Score: 32-39)
Isaiah Ingram attempts a Midrange. Contested by Lauri Wade (5.5 feet, ZONE). Isaiah Ingram misses. Rebound secured by Lauri Wade.

[07:25] Team_005 possession (Score: 32-39)
Lauri Wade attempts a Midrange. Contested by Miles Stewart (5.4 feet, MAN). LAURI WADE MAKES IT!
Score: 32-41

[07:08] Team_031 possession (Score: 32-41)
Miles Stewart attempts a Layup. Contested by Zion Parker (4.0 feet, ZONE). MILES STEWART MAKES IT! Assist: Isaiah Ingram
Score: 34-41

[06:52] Team_005 possession (Score: 34-41)
Blake O'Neal makes the Layup and draws the foul on Kobe Randle! And-1! Blake O'Neal to the line for 1. [Team fouls: 4] (Kobe Randle: 2 personal fouls)   FT 1/1: MISS Blake O'Neal makes 0/1 from the line. Rebound secured by Kobe Randle.
Score: 34-43

[06:40] Team_031 possession (Score: 34-43)
Isaiah Ingram attempts a 3Pt. Contested by Blake O'Neal (4.5 feet, ZONE). Isaiah Ingram misses. Rebound secured by Draymond Smith.

[06:29] Team_005 possession (Score: 34-43)
Lauri Wade attempts a Layup. Contested by Kobe Randle (4.4 feet, ZONE). Lauri Wade misses. Rebound secured by Jimmy Poole.

[06:15] Team_031 possession (Score: 34-43)
Jimmy Poole makes the Layup and draws the foul on Zion Parker! And-1! Jimmy Poole to the line for 1. [Team fouls: 3] (Zion Parker: 1 personal fouls)   FT 1/1: GOOD Jimmy Poole makes 1/1 from the line.
Score: 37-43

[06:00] Team_005 possession (Score: 37-43)
Blake O'Neal attempts a 3Pt. Contested by Kevin Morant (5.2 feet, MAN). Blake O'Neal misses. Offensive rebound by Zion Parker! Zion Parker puts it back in!
Score: 37-45

[05:46] Team_031 possession (Score: 37-45)
Kobe Randle attempts a Midrange. Contested by Isaiah Durant (5.0 feet, MAN). KOBE RANDLE MAKES IT! Assist: Kevin Morant
Score: 39-45

[05:33] Team_005 possession (Score: 39-45)
Draymond Smith attempts a Midrange. Contested by Miles Stewart (5.1 feet, ZONE). DRAYMOND SMITH MAKES IT! Assist: Blake O'Neal
Score: 39-47

[05:15] Team_031 possession (Score: 39-47)
Kobe Randle attempts a Midrange. Contested by Isaiah Durant (5.0 feet, ZONE). Kobe Randle misses. Rebound secured by Lauri Wade.

[05:00] Team_005 possession (Score: 39-47)
Isaiah Durant drives, picks up Kobe Randle. Help arrives from Isaiah Ingram! Isaiah Durant attempts a Dunk. Contested by Isaiah Ingram (4.6 feet, MAN). ISAIAH DURANT MAKES IT!
Score: 39-49

[04:41] Team_031 possession (Score: 39-49)
Kobe Randle attempts a Midrange. Contested by Isaiah Durant (5.0 feet, MAN). KOBE RANDLE MAKES IT!
Score: 41-49

[04:22] Team_005 possession (Score: 41-49)
Blake O'Neal attempts a 3Pt. Contested by Miles Stewart (5.7 feet, ZONE). Blake O'Neal misses. Rebound secured by Jimmy Poole.

[04:09] Team_031 possession (Score: 41-49)
Miles Stewart makes the Layup and draws the foul on Zion Parker! And-1! Miles Stewart to the line for 1. [Team fouls: 4] (Zion Parker: 2 personal fouls)   FT 1/1: GOOD Miles Stewart makes 1/1 from the line.
Score: 44-49

[03:52] Team_005 possession (Score: 44-49)
Isaiah Durant drives, Kobe Randle stays with him. Isaiah Durant attempts a Dunk. Contested by Kobe Randle (4.6 feet, ZONE). ISAIAH DURANT MAKES IT!
Score: 44-51

[03:39] Team_031 possession (Score: 44-51)
Miles Stewart drives and kicks out. Kobe Randle attempts a 3Pt. Contested by Blake O'Neal (4.1 feet, ZONE). KOBE RANDLE MAKES IT! Assist: Kevin Morant
Score: 47-51

[03:27] Team_005 possession (Score: 47-51)
Draymond Smith attempts a Layup. Contested by Jimmy Poole (5.4 feet, ZONE). Draymond Smith misses. Rebound secured by Kobe Randle.

[03:13] Team_031 possession (Score: 47-51)
Kevin Morant attempts a 3Pt. Contested by Blake O'Neal (4.2 feet, MAN). KEVIN MORANT MAKES IT! Assist: Kobe Randle
Score: 50-51

[03:00] Team_005 possession (Score: 50-51)
Lauri Wade attempts a Layup. Contested by Kobe Randle (4.5 feet, ZONE). LAURI WADE MAKES IT! Assist: Draymond Smith
Score: 50-53

[02:42] Team_031 possession (Score: 50-53)
FOUL! Holding foul on Draymond Smith. [IN THE BONUS! 5 team fouls] Isaiah Ingram to the line for 2 free throws. (Draymond Smith: 1 personal fouls)   FT 1/2: GOOD   FT 2/2: GOOD Isaiah Ingram makes 2/2 from the line.
Score: 52-53

[02:27] Team_005 possession (Score: 52-53)
Blake O'Neal attempts a 3Pt. Contested by Isaiah Ingram (4.7 feet, ZONE). Blake O'Neal misses. Rebound secured by Isaiah Ingram.

[02:14] Team_031 possession (Score: 52-53)
Kevin Morant drives to the basket... FOUL! Offensive foul on Kevin Morant! Zion Parker drew the charge! [Team fouls: 5] (Kevin Morant: 2 personal fouls) TURNOVER! (dead ball)

[01:58] Team_005 possession (Score: 52-53)
Blake O'Neal attempts a Midrange. Contested by Kevin Morant (5.3 feet, MAN). BLAKE O'NEAL MAKES IT!
Score: 52-55

[01:44] Team_031 possession (Score: 52-55)
FOUL! Shooting foul on Blake O'Neal. Kobe Randle to the line for 2 free throws. [BONUS: 6 team fouls] (Blake O'Neal: 1 personal fouls)   FT 1/2: GOOD   FT 2/2: GOOD Kobe Randle makes 2/2 from the line.
Score: 54-55

[01:30] Team_005 possession (Score: 54-55)
Isaiah Durant attempts a 3Pt. Contested by Miles Stewart (5.6 feet, ZONE). Isaiah Durant misses. Rebound secured by Isaiah Ingram.

[01:12] Team_031 possession (Score: 54-55)
Kevin Morant attempts a 3Pt. Contested by Blake O'Neal (4.3 feet, ZONE). Kevin Morant misses. FOUL! Loose ball foul on Zion Parker during the rebound battle. [IN THE BONUS! 7 team fouls] Jimmy Poole to the line for 2 free throws. (Zion Parker: 3 personal fouls)   FT 1/2: GOOD   FT 2/2: GOOD Jimmy Poole makes 2/2 from the line.
Score: 56-55

[01:02] Team_005 possession (Score: 56-55)
Lauri Wade attempts a 3Pt. Contested by Miles Stewart (5.5 feet, MAN). LAURI WADE MAKES IT! Assist: Isaiah Durant
Score: 56-58

[00:45] Team_031 possession (Score: 56-58)
Jimmy Poole makes the Layup and draws the foul on Zion Parker! And-1! Jimmy Poole to the line for 1. [BONUS: 8 team fouls] (Zion Parker: 4 personal fouls)   FT 1/1: GOOD Jimmy Poole makes 1/1 from the line.
Score: 59-58

[00:32] Team_005 possession (Score: 59-58)
Lauri Wade attempts a Midrange. Contested by Kevin Morant (5.1 feet, ZONE). LAURI WADE MAKES IT! Assist: Zion Parker
Score: 59-60

[00:13] Team_031 possession (Score: 59-60)
Isaiah Ingram attempts a 3Pt. Contested by Draymond Smith (4.9 feet, MAN). ISAIAH INGRAM MAKES IT! Assist: Kevin Morant
Score: 62-60

================================================================================
                              2ND QUARTER COMPLETE                              
================================================================================

2ND QUARTER SCORE: Team_031 40, Team_005 32

BOX SCORE:
================================================================================

Team_031
--------------------------------------------------------------------------------
Player                MIN  PTS  REB  AST  TO      FG   FG%      3P   3P%
--------------------------------------------------------------------------------
Jimmy Poole             9   10    2    0   0   4/4   100.0     0/0   0.0
Kobe Randle             9    9    4    1   0   4/5    80.0     0/0   0.0
Isaiah Ingram           9    7    2    1   0   3/5    60.0     0/0   0.0
Miles Stewart           9    5    0    0   0   2/3    66.7     0/0   0.0
Kevin Morant            9    3    0    4   0   1/1   100.0     0/0   0.0
Luka Sabonis           15    2    1    0   0   1/3    33.3     0/0   0.0
Pau Irving             15    2    0    0   0   1/1   100.0     0/0   0.0
Gary Morant            15    0    1    1   0   0/0     0.0     0/0   0.0
Immanuel James         15    0    1    0   0   0/0     0.0     0/0   0.0

TEAM: FG: 16/22 (72.7%), 3PT: 3/5 (60.0%), REB: 10 (1 off, 9 def), AST: 7, TO: 2
TEAM FOULS: 5 [Team_005 in BONUS]


Team_005
--------------------------------------------------------------------------------
Player                MIN  PTS  REB  AST  TO      FG   FG%      3P   3P%
--------------------------------------------------------------------------------
Lauri Wade              9    9    2    0   0   4/5    80.0     0/0   0.0
Blake O'Neal            9    5    0    1   0   2/6    33.3     0/0   0.0
Draymond Smith          9    4    2    1   0   2/3    66.7     0/0   0.0
Isaiah Durant           9    4    0    1   0   2/4    50.0     0/0   0.0
Brandon George         15    3    0    0   0   1/1   100.0     0/0   0.0
Derrick Allen          15    3    1    0   0   1/1   100.0     0/0   0.0
Zion Parker             9    2    1    1   0   1/1   100.0     0/0   0.0
Cade Markkanen         15    0    1    0   0   0/1     0.0     0/0   0.0
Anthony Rozier         15    0    0    1   0   0/1     0.0     0/0   0.0

TEAM: FG: 13/23 (56.5%), 3PT: 3/9 (33.3%), REB: 8 (3 off, 5 def), AST: 5, TO: 0
TEAM FOULS: 8 [Team_031 in BONUS]

================================================================================

================================================================================
                       3RD QUARTER - Team_031 vs Team_005                       
================================================================================

[12:00] Team_031 possession (Score: 62-60)
Pau Irving drives and kicks out. Luka Sabonis attempts a Midrange. Contested by Jalen Rozier (4.9 feet, ZONE). LUKA SABONIS MAKES IT!
Score: 64-60

[11:41] Team_005 possession (Score: 64-60)
Cade Markkanen attempts a Midrange. Contested by Pau Irving (3.4 feet, ZONE). Cade Markkanen misses. Rebound secured by Gary Morant.

[11:24] Team_031 possession (Score: 64-60)
Immanuel James drives, picks up Cade Markkanen. Help arrives from Anthony Rozier! Immanuel James attempts a Layup. Contested by Anthony Rozier (3.7 feet, ZONE). IMMANUEL JAMES MAKES IT! Assist: Luka Sabonis
Score: 66-60

[11:04] Team_005 possession (Score: 66-60)
Brandon George attempts a Layup. Contested by Shai Durant (4.1 feet, MAN). BRANDON GEORGE MAKES IT!
Score: 66-62

[10:48] Team_031 possession (Score: 66-62)
Gary Morant attempts a 3Pt. Contested by Derrick Allen (4.8 feet, ZONE). Gary Morant misses. Rebound secured by Cade Markkanen.

[10:32] Team_005 possession (Score: 66-62)
Derrick Allen attempts a 3Pt. Contested by Immanuel James (3.4 feet, ZONE). DERRICK ALLEN MAKES IT! Assist: Brandon George
Score: 66-65

[10:22] Team_031 possession (Score: 66-65)
Luka Sabonis makes the Layup and draws the foul on Cade Markkanen! And-1! Luka Sabonis to the line for 1. [Team fouls: 1] (Cade Markkanen: 1 personal fouls)   FT 1/1: GOOD Luka Sabonis makes 1/1 from the line.
Score: 69-65

[10:10] Team_005 possession (Score: 69-65)
Brandon George drives, Immanuel James stays with him. Brandon George attempts a Layup. Contested by Immanuel James (3.2 feet, ZONE). BRANDON GEORGE MAKES IT!
Score: 69-67

[09:55] Team_031 possession (Score: 69-67)
Shai Durant drives, picks up Cade Markkanen. Help arrives from Anthony Rozier! Shai Durant attempts a Dunk. Contested by Anthony Rozier (3.4 feet, ZONE). Shai Durant misses. Rebound secured by Cade Markkanen.

[09:38] Team_005 possession (Score: 69-67)
Brandon George attempts a Midrange. Contested by Shai Durant (4.1 feet, MAN). Brandon George misses. Rebound secured by Luka Sabonis.

[09:22] Team_031 possession (Score: 69-67)
Pau Irving attempts a Midrange. Contested by Derrick Allen (4.3 feet, MAN). Pau Irving misses. Rebound secured by Derrick Allen.

[09:09] Team_005 possession (Score: 69-67)
Derrick Allen attempts a 3Pt. Contested by Pau Irving (4.0 feet, MAN). Derrick Allen misses. Rebound secured by Gary Morant.

[08:56] Team_031 possession (Score: 69-67)
Luka Sabonis makes the Layup and draws the foul on Cade Markkanen! And-1! Luka Sabonis to the line for 1. [Team fouls: 2] (Cade Markkanen: 2 personal fouls)   FT 1/1: MISS Luka Sabonis makes 0/1 from the line. Rebound secured by Cade Markkanen.
Score: 71-67

[08:45] Team_005 possession (Score: 71-67)
Anthony Rozier attempts a 3Pt. Contested by Gary Morant (3.8 feet, MAN). ANTHONY ROZIER MAKES IT! Assist: Brandon George
Score: 71-70

[08:33] Team_031 possession (Score: 71-70)
Luka Sabonis drives, Cade Markkanen stays with him. Luka Sabonis attempts a Dunk. Contested by Cade Markkanen (3.9 feet, MAN). LUKA SABONIS MAKES IT! Assist: Gary Morant
Score: 73-70

[08:21] Team_005 possession (Score: 73-70)
Brandon George attempts a Layup. Contested by Shai Durant (4.1 feet, MAN). BRANDON GEORGE MAKES IT!
Score: 73-72

[08:06] Team_031 possession (Score: 73-72)
Luka Sabonis attempts a Layup. Contested by Cade Markkanen (3.9 feet, MAN). Luka Sabonis misses. Rebound secured by Derrick Allen.

[07:52] Team_005 possession (Score: 73-72)
Derrick Allen drives and kicks out. Derrick Allen attempts a 3Pt. Contested by Pau Irving (3.6 feet, ZONE). Derrick Allen misses. Rebound secured by Gary Morant.

[07:37] Team_031 possession (Score: 73-72)
Shai Durant attempts a 3Pt. Contested by Brandon George (5.3 feet, MAN). Shai Durant misses. FOUL! Loose ball foul on Derrick Allen during the rebound battle. [Team fouls: 3] No free throws, side out. (Derrick Allen: 1 personal fouls)

[07:22] Team_031 possession (Score: 73-72)
Shai Durant attempts a 3Pt. Contested by Brandon George (5.3 feet, MAN). SHAI DURANT MAKES IT! Assist: Luka Sabonis
Score: 76-72

[07:08] Team_005 possession (Score: 76-72)
Derrick Allen attempts a 3Pt. Contested by Pau Irving (4.0 feet, ZONE). Derrick Allen misses. Rebound secured by Immanuel James.

[06:55] Team_031 possession (Score: 76-72)
Pau Irving attempts a 3Pt. Contested by Derrick Allen (4.3 feet, MAN). Pau Irving misses. Rebound secured by Jalen Rozier.

[06:42] Team_005 possession (Score: 76-72)
Anthony Rozier attempts a 3Pt. Contested by Pau Irving (3.7 feet, ZONE). Anthony Rozier misses. Rebound secured by Gary Morant.

[06:24] Team_031 possession (Score: 76-72)
Immanuel James drives, picks up Cade Markkanen. Help arrives from Anthony Rozier! Immanuel James attempts a Layup. Contested by Anthony Rozier (3.7 feet, ZONE). IMMANUEL JAMES MAKES IT! Assist: Pau Irving
Score: 78-72

[06:07] Team_005 possession (Score: 78-72)
Cade Markkanen makes the Layup and draws the foul on Luka Sabonis! And-1! Cade Markkanen to the line for 1. [Team fouls: 1] (Luka Sabonis: 1 personal fouls)   FT 1/1: GOOD Cade Markkanen makes 1/1 from the line.
Score: 78-75

[05:50] Team_031 possession (Score: 78-75)
Shai Durant throws a bad pass out of bounds! TURNOVER! (dead ball)

[05:37] Team_005 possession (Score: 78-75)
Jalen Rozier attempts a Layup. Contested by Luka Sabonis (3.5 feet, ZONE). Jalen Rozier misses. Rebound secured by Immanuel James.

[05:21] Team_031 possession (Score: 78-75)
FOUL! Shooting foul on Derrick Allen. Pau Irving to the line for 2 free throws. [Team fouls: 4] (Derrick Allen: 2 personal fouls)   FT 1/2: GOOD   FT 2/2: MISS Pau Irving makes 1/2 from the line. Rebound secured by Cade Markkanen.
Score: 79-75

[05:11] Team_005 possession (Score: 79-75)
Brandon George drives and kicks out. Jalen Rozier attempts a Midrange. Contested by Immanuel James (3.1 feet, MAN). Jalen Rozier misses. Rebound secured by Luka Sabonis.

[04:57] Team_031 possession (Score: 79-75)
Gary Morant drives to the basket... Gary Morant commits a violation (traveling/carry)! TURNOVER! (dead ball)

[04:42] Team_005 possession (Score: 79-75)
Derrick Allen makes the Layup and draws the foul on Immanuel James! And-1! Derrick Allen to the line for 1. [Team fouls: 2] (Immanuel James: 1 personal fouls)   FT 1/1: GOOD Derrick Allen makes 1/1 from the line.
Score: 79-78

[04:26] Team_031 possession (Score: 79-78)
Pau Irving attempts a 3Pt. Contested by Derrick Allen (4.3 feet, MAN). Pau Irving misses. Rebound secured by Cade Markkanen.

[04:11] Team_005 possession (Score: 79-78)
FOUL! Holding foul on Pau Irving. [Team fouls: 3] No free throws, side out. (Pau Irving: 1 personal fouls)

[03:53] Team_005 possession (Score: 79-78)
Anthony Rozier drives to the basket... FOUL! Offensive foul on Anthony Rozier! Luka Sabonis drew the charge! [Team fouls: 5] (Anthony Rozier: 1 personal fouls) TURNOVER! (dead ball)

[03:34] Team_031 possession (Score: 79-78)
Shai Durant commits a violation (traveling/carry)! TURNOVER! (dead ball)

[03:17] Team_005 possession (Score: 79-78)
Derrick Allen attempts a 3Pt. Contested by Pau Irving (4.1 feet, ZONE). DERRICK ALLEN MAKES IT! Assist: Brandon George
Score: 79-81

[03:01] Team_031 possession (Score: 79-81)
Gary Morant drives to the basket... Gary Morant loses control! Ball rolls out of bounds! TURNOVER! (dead ball)

[03:01] Substitution (Team_031): Immanuel James OUT → Kobe Randle IN (stamina_rule2)

[03:01] Substitution (Team_005): Brandon George OUT → Blake O'Neal IN (stamina_rule2)

[03:01] Substitution (Team_005): Anthony Rozier OUT → Draymond Smith IN (stamina_rule2)

[03:01] Substitution (Team_005): Cade Markkanen OUT → Zion Parker IN (stamina_rule2)

[02:43] Team_005 possession (Score: 79-81)
Blake O'Neal attempts a 3Pt. Contested by Pau Irving (4.2 feet, ZONE). Blake O'Neal misses. Rebound secured by Luka Sabonis.

[02:31] Team_031 possession (Score: 79-81)
Kobe Randle attempts a Layup. Contested by Zion Parker (4.7 feet, ZONE). Kobe Randle misses. Offensive rebound by Kobe Randle! Kobe Randle kicks it out.

[02:13] Team_031 possession (Score: 79-81)
FOUL! Holding foul on Jalen Rozier. [IN THE BONUS! 6 team fouls] Kobe Randle to the line for 2 free throws. (Jalen Rozier: 1 personal fouls)   FT 1/2: GOOD   FT 2/2: MISS Kobe Randle makes 1/2 from the line. Rebound secured by Zion Parker.
Score: 80-81

[01:55] Team_005 possession (Score: 80-81)
Blake O'Neal attempts a 3Pt. Contested by Shai Durant (4.5 feet, MAN). BLAKE O'NEAL MAKES IT!
Score: 80-84

[01:42] Team_031 possession (Score: 80-84)
Kobe Randle attempts a 3Pt. Contested by Blake O'Neal (4.7 feet, ZONE). KOBE RANDLE MAKES IT! Assist: Shai Durant
Score: 83-84

[01:26] Team_005 possession (Score: 83-84)
Jalen Rozier attempts a Midrange. Contested by Kobe Randle (4.7 feet, ZONE). JALEN ROZIER MAKES IT!
Score: 83-86

[01:11] Team_031 possession (Score: 83-86)
FOUL! Holding foul on Zion Parker. [IN THE BONUS! 7 team fouls] Luka Sabonis to the line for 2 free throws. (Zion Parker: 1 personal fouls)   FT 1/2: GOOD   FT 2/2: MISS Luka Sabonis makes 1/2 from the line. Rebound secured by Jalen Rozier.
Score: 84-86

[01:01] Team_005 possession (Score: 84-86)
FOUL! Shooting foul on Pau Irving. Draymond Smith to the line for 3 free throws. [Team fouls: 4] (Pau Irving: 2 personal fouls)   FT 1/3: MISS   FT 2/3: GOOD   FT 3/3: GOOD Draymond Smith makes 2/3 from the line.
Score: 84-88

[00:49] Team_031 possession (Score: 84-88)
Gary Morant attempts a 3Pt. Contested by Draymond Smith (4.8 feet, MAN). GARY MORANT MAKES IT! Assist: Kobe Randle
Score: 87-88

[00:30] Team_005 possession (Score: 87-88)
Zion Parker attempts a Layup. Contested by Luka Sabonis (3.8 feet, MAN). ZION PARKER MAKES IT! Assist: Derrick Allen
Score: 87-90

[00:18] Team_031 possession (Score: 87-90)
Kobe Randle attempts a Layup. Wide open! Jalen Rozier is 6.1 feet away. [MAN] Kobe Randle misses. Offensive rebound by Kobe Randle! Kobe Randle kicks it out.

================================================================================
                              3RD QUARTER COMPLETE                              
================================================================================

3RD QUARTER SCORE: Team_031 25, Team_005 30

BOX SCORE:
================================================================================

Team_031
--------------------------------------------------------------------------------
Player                MIN  PTS  REB  AST  TO      FG   FG%      3P   3P%
--------------------------------------------------------------------------------
Luka Sabonis           27    7    3    2   0   3/5    60.0     0/0   0.0
Immanuel James         24    4    3    0   0   2/2   100.0     0/0   0.0
Gary Morant            27    3    4    1   0   1/2    50.0     0/0   0.0
Shai Durant            27    3    0    1   0   1/2    50.0     0/0   0.0
Kobe Randle            12    3    2    1   0   1/1   100.0     0/0   0.0
Pau Irving             27    0    0    1   0   0/4     0.0     0/0   0.0

TEAM: FG: 8/18 (44.4%), 3PT: 3/6 (50.0%), REB: 12 (3 off, 9 def), AST: 6, TO: 4
TEAM FOULS: 4


Team_005
--------------------------------------------------------------------------------
Player                MIN  PTS  REB  AST  TO      FG   FG%      3P   3P%
--------------------------------------------------------------------------------
Derrick Allen          27    9    2    1   0   3/6    50.0     0/0   0.0
Brandon George         24    6    0    3   0   3/5    60.0     0/0   0.0
Cade Markkanen         24    3    5    0   0   1/2    50.0     0/0   0.0
Anthony Rozier         24    3    0    0   0   1/2    50.0     0/0   0.0
Blake O'Neal           12    3    0    0   0   1/2    50.0     0/0   0.0
Jalen Rozier           27    2    2    0   0   1/2    50.0     0/0   0.0
Zion Parker            12    2    1    0   0   1/1   100.0     0/0   0.0
Draymond Smith         12    2    0    0   0   1/1   100.0     0/0   0.0

TEAM: FG: 12/21 (57.1%), 3PT: 5/9 (55.6%), REB: 10 (0 off, 10 def), AST: 4, TO: 1
TEAM FOULS: 7 [Team_031 in BONUS]

================================================================================

================================================================================
                       4TH QUARTER - Team_031 vs Team_005                       
================================================================================

[12:00] Team_031 possession (Score: 87-90)
Shai Durant attempts a 3Pt. Contested by Derrick Allen (4.6 feet, ZONE). Shai Durant misses. Rebound secured by Derrick Allen.

[11:44] Team_005 possession (Score: 87-90)
Brandon George makes the Midrange and draws the foul on Shai Durant! And-1! Brandon George to the line for 1. [Team fouls: 1] (Shai Durant: 1 personal fouls)   FT 1/1: GOOD Brandon George makes 1/1 from the line.
Score: 87-93

[11:31] Team_031 possession (Score: 87-93)
Luka Sabonis attempts a Midrange. Contested by Cade Markkanen (3.8 feet, MAN). Luka Sabonis misses. Rebound secured by Cade Markkanen.

[11:13] Team_005 possession (Score: 87-93)
Anthony Rozier attempts a Midrange. Contested by Gary Morant (4.2 feet, MAN). Anthony Rozier misses. Rebound secured by Gary Morant.

[11:00] Team_031 possession (Score: 87-93)
Luka Sabonis drives, Cade Markkanen stays with him. Luka Sabonis attempts a Layup. Contested by Cade Markkanen (3.8 feet, MAN). LUKA SABONIS MAKES IT!
Score: 89-93

[10:46] Team_005 possession (Score: 89-93)
Anthony Rozier drives and kicks out. Derrick Allen attempts a 3Pt. Contested by Pau Irving (4.0 feet, MAN). Derrick Allen misses. Rebound secured by Luka Sabonis.

[10:33] Team_031 possession (Score: 89-93)
Shai Durant attempts a 3Pt. Contested by Brandon George (5.3 feet, MAN). Shai Durant misses. Rebound secured by Jalen Rozier.

[10:21] Team_005 possession (Score: 89-93)
FOUL! Holding foul on Gary Morant. [Team fouls: 2] No free throws, side out. (Gary Morant: 1 personal fouls)

[10:09] Team_005 possession (Score: 89-93)
Cade Markkanen attempts a 3Pt. Contested by Pau Irving (3.9 feet, ZONE). Cade Markkanen misses. Offensive rebound by Cade Markkanen! Cade Markkanen's putback is no good. Rebound secured by Gary Morant.

[09:59] Team_031 possession (Score: 89-93)
Immanuel James makes the Dunk and draws the foul on Cade Markkanen! And-1! Immanuel James to the line for 1. [Team fouls: 1] (Cade Markkanen: 1 personal fouls)   FT 1/1: MISS Immanuel James makes 0/1 from the line. Rebound secured by Derrick Allen.
Score: 91-93

[09:50] Team_005 possession (Score: 91-93)
Anthony Rozier drives and kicks out. Derrick Allen attempts a Midrange. Contested by Pau Irving (4.2 feet, MAN). Derrick Allen misses. Offensive rebound by Derrick Allen! Derrick Allen kicks it out.

[09:36] Team_005 possession (Score: 91-93)
Cade Markkanen drives to the basket... FOUL! Offensive foul on Cade Markkanen! Immanuel James drew the charge! [Team fouls: 2] (Cade Markkanen: 2 personal fouls) TURNOVER! (dead ball)

[09:22] Team_031 possession (Score: 91-93)
Pau Irving attempts a Midrange. Contested by Anthony Rozier (4.8 feet, ZONE). Pau Irving misses. Rebound secured by Derrick Allen.

[09:04] Team_005 possession (Score: 91-93)
FOUL! Shooting foul on Shai Durant. Brandon George to the line for 2 free throws. [Team fouls: 3] (Shai Durant: 2 personal fouls)   FT 1/2: GOOD   FT 2/2: MISS Brandon George makes 1/2 from the line. Offensive rebound by Derrick Allen! Derrick Allen kicks it out.
Score: 91-94

[08:46] Team_005 possession (Score: 91-94)
Derrick Allen attempts a 3Pt. Contested by Pau Irving (4.6 feet, ZONE). Derrick Allen misses. Rebound secured by Luka Sabonis.

[08:32] Team_031 possession (Score: 91-94)
Luka Sabonis drives to the basket... Luka Sabonis throws a bad pass out of bounds! TURNOVER! (dead ball)

[08:32] Substitution (Team_031): Shai Durant OUT → Kevin Morant IN (stamina_rule2)

[08:32] Substitution (Team_031): Gary Morant OUT → Isaiah Ingram IN (stamina_rule2)

[08:32] Substitution (Team_031): Pau Irving OUT → Miles Stewart IN (stamina_rule2)

[08:32] Substitution (Team_031): Immanuel James OUT → Kobe Randle IN (stamina_rule2)

[08:32] Substitution (Team_031): Luka Sabonis OUT → Jimmy Poole IN (stamina_rule2)

[08:32] Substitution (Team_005): Brandon George OUT → Blake O'Neal IN (stamina_rule2)

[08:32] Substitution (Team_005): Anthony Rozier OUT → Draymond Smith IN (stamina_rule2)

[08:32] Substitution (Team_005): Derrick Allen OUT → Lauri Wade IN (stamina_rule2)

[08:32] Substitution (Team_005): Jalen Rozier OUT → Isaiah Durant IN (stamina_rule2)

[08:32] Substitution (Team_005): Cade Markkanen OUT → Zion Parker IN (stamina_rule2)

[08:18] Team_005 possession (Score: 91-94)
Lauri Wade makes the Dunk and draws the foul on Isaiah Ingram! And-1! Lauri Wade to the line for 1. [Team fouls: 4] (Isaiah Ingram: 1 personal fouls)   FT 1/1: GOOD Lauri Wade makes 1/1 from the line.
Score: 91-97

[08:02] Team_031 possession (Score: 91-97)
FOUL! Shooting foul on Isaiah Durant. Kobe Randle to the line for 2 free throws. [Team fouls: 3] (Isaiah Durant: 1 personal fouls)   FT 1/2: GOOD   FT 2/2: GOOD Kobe Randle makes 2/2 from the line.
Score: 93-97

[07:46] Team_005 possession (Score: 93-97)
Draymond Smith attempts a 3Pt. Contested by Isaiah Ingram (4.0 feet, MAN). Draymond Smith misses. Rebound secured by Isaiah Ingram.

[07:33] Team_031 possession (Score: 93-97)
Miles Stewart drives and kicks out. Jimmy Poole attempts a 3Pt. Contested by Blake O'Neal (4.1 feet, ZONE). Jimmy Poole misses. Rebound secured by Draymond Smith.

[07:19] Team_005 possession (Score: 93-97)
Blake O'Neal attempts a Midrange. Contested by Kevin Morant (5.2 feet, MAN). Blake O'Neal misses. Rebound secured by Jimmy Poole.

[07:05] Team_031 possession (Score: 93-97)
FOUL! Shooting foul on Blake O'Neal. Jimmy Poole to the line for 2 free throws. [Team fouls: 4] (Blake O'Neal: 1 personal fouls)   FT 1/2: GOOD   FT 2/2: MISS Jimmy Poole makes 1/2 from the line. Rebound secured by Draymond Smith.
Score: 94-97

[06:52] Team_005 possession (Score: 94-97)
Zion Parker drives and kicks out. Lauri Wade attempts a 3Pt. Contested by Miles Stewart (5.3 feet, MAN). Lauri Wade misses. Rebound secured by Kobe Randle.

[06:42] Team_031 possession (Score: 94-97)
Miles Stewart attempts a 3Pt. Contested by Lauri Wade (5.1 feet, MAN). Miles Stewart misses. Rebound secured by Zion Parker.

[06:28] Team_005 possession (Score: 94-97)
Lauri Wade drives to the basket... Lauri Wade loses control! Ball rolls out of bounds! TURNOVER! (dead ball)

[06:12] Team_031 possession (Score: 94-97)
Kobe Randle attempts a Midrange. Contested by Draymond Smith (4.9 feet, ZONE). Kobe Randle misses. Rebound secured by Zion Parker.

[06:02] Team_005 possession (Score: 94-97)
Zion Parker attempts a Layup. Contested by Jimmy Poole (5.7 feet, MAN). ZION PARKER MAKES IT!
Score: 94-99

[05:46] Team_031 possession (Score: 94-99)
Kobe Randle attempts a 3Pt. Contested by Isaiah Durant (5.0 feet, MAN). Kobe Randle misses. Rebound secured by Draymond Smith.

[05:32] Team_005 possession (Score: 94-99)
Blake O'Neal drives, Kevin Morant stays with him. Blake O'Neal attempts a Dunk. Contested by Kevin Morant (5.2 feet, MAN). BLAKE O'NEAL MAKES IT! Assist: Zion Parker
Score: 94-101

[05:15] Team_031 possession (Score: 94-101)
FOUL! Shooting foul on Draymond Smith. Isaiah Ingram to the line for 3 free throws. [BONUS: 5 team fouls] (Draymond Smith: 1 personal fouls)   FT 1/3: GOOD   FT 2/3: MISS   FT 3/3: GOOD Isaiah Ingram makes 2/3 from the line.
Score: 96-101

[04:58] Team_005 possession (Score: 96-101)
Lauri Wade attempts a Midrange. Contested by Isaiah Ingram (4.3 feet, ZONE). LAURI WADE MAKES IT!
Score: 96-103

[04:47] Team_031 possession (Score: 96-103)
Miles Stewart attempts a Midrange. Contested by Draymond Smith (4.3 feet, ZONE). Miles Stewart misses. Rebound secured by Zion Parker.

[04:33] Team_005 possession (Score: 96-103)
Zion Parker attempts a Midrange. Contested by Kobe Randle (4.4 feet, ZONE). Zion Parker misses. Rebound secured by Kobe Randle.

[04:13] Team_031 possession (Score: 96-103)
Jimmy Poole attempts a Layup. BLOCKED BY ZION PARKER! Ball is loose! Rebound secured by Draymond Smith.

[04:00] Team_005 possession (Score: 96-103)
Isaiah Durant drives and kicks out. Blake O'Neal attempts a 3Pt. Contested by Kevin Morant (4.9 feet, MAN). Blake O'Neal misses. Rebound secured by Kobe Randle.

[03:46] Team_031 possession (Score: 96-103)
Miles Stewart attempts a 3Pt. Contested by Lauri Wade (5.1 feet, MAN). Miles Stewart misses. Rebound secured by Lauri Wade.

[03:32] Team_005 possession (Score: 96-103)
Isaiah Durant attempts a Layup. Contested by Kobe Randle (4.7 feet, MAN). ISAIAH DURANT MAKES IT! Assist: Blake O'Neal
Score: 96-105

[03:17] Team_031 possession (Score: 96-105)
Kevin Morant attempts a 3Pt. Contested by Blake O'Neal (4.2 feet, MAN). Kevin Morant misses. Rebound secured by Zion Parker.

[03:04] Team_005 possession (Score: 96-105)
Isaiah Durant attempts a Midrange. Contested by Kobe Randle (4.7 feet, MAN). ISAIAH DURANT MAKES IT! Assist: Lauri Wade
Score: 96-107

[02:47] Team_031 possession (Score: 96-107)
Kevin Morant attempts a Midrange. Contested by Blake O'Neal (4.2 feet, MAN). Kevin Morant misses. Offensive rebound by Isaiah Ingram! Isaiah Ingram kicks it out.

[02:36] Team_031 possession (Score: 96-107)
Isaiah Ingram attempts a 3Pt. Contested by Blake O'Neal (4.6 feet, ZONE). Isaiah Ingram misses. Rebound secured by Lauri Wade.

[02:24] Team_005 possession (Score: 96-107)
Draymond Smith makes the 3Pt and draws the foul on Miles Stewart! And-1! Draymond Smith to the line for 1. [BONUS: 5 team fouls] (Miles Stewart: 1 personal fouls)   FT 1/1: MISS Draymond Smith makes 0/1 from the line. Rebound secured by Kobe Randle.
Score: 96-110

[02:09] Team_031 possession (Score: 96-110)
Jimmy Poole attempts a 3Pt. Contested by Blake O'Neal (4.2 feet, ZONE). JIMMY POOLE MAKES IT! Assist: Kobe Randle
Score: 99-110

[01:57] Team_005 possession (Score: 99-110)
Lauri Wade drives and kicks out. Zion Parker attempts a 3Pt. Contested by Jimmy Poole (5.7 feet, MAN). Zion Parker misses. Rebound secured by Kobe Randle.

[01:39] Team_031 possession (Score: 99-110)
FOUL! Shooting foul on Draymond Smith. Isaiah Ingram to the line for 3 free throws. [BONUS: 6 team fouls] (Draymond Smith: 2 personal fouls)   FT 1/3: GOOD   FT 2/3: GOOD   FT 3/3: GOOD Isaiah Ingram makes 3/3 from the line.
Score: 102-110

[01:26] Team_005 possession (Score: 102-110)
Isaiah Durant attempts a Layup. Contested by Kobe Randle (4.9 feet, MAN). Isaiah Durant misses. Rebound secured by Jimmy Poole.

[01:14] Team_031 possession (Score: 102-110)
Jimmy Poole attempts a 3Pt. Contested by Zion Parker (4.2 feet, MAN). JIMMY POOLE MAKES IT! Assist: Kevin Morant
Score: 105-110

[01:04] Team_005 possession (Score: 105-110)
Zion Parker drives, Jimmy Poole stays with him. Zion Parker attempts a Dunk. Contested by Jimmy Poole (5.7 feet, MAN). Zion Parker misses. Offensive rebound by Zion Parker! Zion Parker puts it back in!
Score: 105-112

[00:49] Team_031 possession (Score: 105-112)
Kobe Randle attempts a Layup. Contested by Isaiah Durant (5.1 feet, MAN). Kobe Randle misses. Rebound secured by Draymond Smith.

[00:39] Team_005 possession (Score: 105-112)
Isaiah Durant attempts a 3Pt. Contested by Miles Stewart (5.7 feet, ZONE). ISAIAH DURANT MAKES IT! Assist: Zion Parker
Score: 105-115

[00:23] Team_031 possession (Score: 105-115)
Kobe Randle attempts a Midrange. Contested by Isaiah Durant (5.1 feet, MAN). Kobe Randle misses. Offensive rebound by Jimmy Poole! Jimmy Poole kicks it out.

[00:10] Team_031 possession (Score: 105-115)
Kevin Morant attempts a Midrange. BLOCKED BY BLAKE O'NEAL! Ball goes out off Blake O'Neal. Kevin Morant's ball!

================================================================================
                              4TH QUARTER COMPLETE                              
================================================================================

4TH QUARTER SCORE: Team_031 18, Team_005 25

BOX SCORE:
================================================================================

Team_031
--------------------------------------------------------------------------------
Player                MIN  PTS  REB  AST  TO      FG   FG%      3P   3P%
--------------------------------------------------------------------------------
Jimmy Poole            18    6    3    0   0   2/4    50.0     0/0   0.0
Isaiah Ingram          18    5    2    0   0   2/3    66.7     0/0   0.0
Luka Sabonis           31    2    2    0   0   1/2    50.0     0/0   0.0
Kobe Randle            21    2    5    1   0   1/4    25.0     0/0   0.0
Shai Durant            31    0    0    0   0   0/2     0.0     0/0   0.0
Immanuel James         28    0    0    0   0   0/1     0.0     0/0   0.0
Pau Irving             31    0    0    0   0   0/1     0.0     0/0   0.0
Miles Stewart          18    0    0    0   0   0/4     0.0     0/0   0.0
Kevin Morant           18    0    0    1   0   0/1     0.0     0/0   0.0

TEAM: FG: 6/22 (27.3%), 3PT: 4/11 (36.4%), REB: 13 (2 off, 11 def), AST: 2, TO: 1
TEAM FOULS: 5 [Team_005 in BONUS]


Team_005
--------------------------------------------------------------------------------
Player                MIN  PTS  REB  AST  TO      FG   FG%      3P   3P%
--------------------------------------------------------------------------------
Isaiah Durant          18    7    0    0   0   3/5    60.0     0/0   0.0
Lauri Wade             18    5    2    1   0   2/3    66.7     0/0   0.0
Zion Parker            21    4    5    2   0   2/4    50.0     0/0   0.0
Brandon George         28    3    0    0   0   1/1   100.0     0/0   0.0
Blake O'Neal           21    2    0    1   0   1/2    50.0     0/0   0.0
Derrick Allen          31    0    5    0   0   0/1     0.0     0/0   0.0
Cade Markkanen         28    0    1    0   0   0/1     0.0     0/0   0.0
Anthony Rozier         28    0    0    0   0   0/2     0.0     0/0   0.0
Gary Morant            31    0    2    0   0   0/0     0.0     0/0   0.0
Jalen Rozier           31    0    1    0   0   0/0     0.0     0/0   0.0
Draymond Smith         21    0    5    0   0   0/2     0.0     0/0   0.0

TEAM: FG: 9/21 (42.9%), 3PT: 1/5 (20.0%), REB: 20 (4 off, 16 def), AST: 4, TO: 2
TEAM FOULS: 6 [Team_031 in BONUS]

================================================================================

================================================================================
                               FULL GAME COMPLETE                               
================================================================================

FINAL SCORE: Team_031 105, Team_005 115

SCORING BY QUARTER:
--------------------------------------------------------------------------------
Team                     Q1     Q2     Q3     Q4    FINAL
--------------------------------------------------------------------------------
Team_031                 22     40     25     18      105
Team_005                 28     32     30     25      115
--------------------------------------------------------------------------------

FULL GAME BOX SCORE:
================================================================================

Team_031
--------------------------------------------------------------------------------
Player                MIN  PTS  REB  AST  TO      FG   FG%      3P   3P%      FT STL BLK
--------------------------------------------------------------------------------
Shai Durant            31    5    0    1   4   2/6    33.3   1/4    25.0   0/0     0   0
Gary Morant            31    3    7    3   1   1/4    25.0   1/3    33.3   0/0     0   0
Pau Irving             31    2    0    2   1   3/12   25.0   1/6    16.7   1/3     0   0
Luka Sabonis           31   15   13    3   1   6/12   50.0   0/1     0.0   4/6     0   0
Immanuel James         28   18   10    0   0   7/11   63.6   0/2     0.0   2/4     1   0
Kobe Randle            21   14   11    3   1   5/9    55.6   1/2    50.0   5/6     0   0
Kevin Morant           18    3    0    5   0   2/3    66.7   2/3    66.7   0/0     0   0
Isaiah Ingram          18   12    4    1   0   4/7    57.1   3/5    60.0   7/8     0   0
Miles Stewart          18    5    0    0   0   3/8    37.5   0/2     0.0   1/1     0   0
Jimmy Poole            18   16    5    0   0   5/7    71.4   2/2   100.0   5/6     0   0

TEAM: FG: 39/82 (47.6%), 3PT: 11/30 (36.7%), REB: 47 (12 off, 35 def), AST: 18, TO: 8


Team_005
--------------------------------------------------------------------------------
Player                MIN  PTS  REB  AST  TO      FG   FG%      3P   3P%      FT STL BLK
--------------------------------------------------------------------------------
Derrick Allen          31   12   10    2   2   4/10   40.0   2/6    33.3   2/3     0   0
Jalen Rozier           31   15    8    1   1   4/6    66.7   0/0     0.0   4/4     0   0
Brandon George         28   14    0    6   2   7/9    77.8   1/1   100.0   2/3     0   0
Anthony Rozier         28    6    0    1   0   3/9    33.3   3/6    50.0   0/0     0   0
Cade Markkanen         28   11   11    0   0   4/9    44.4   1/4    25.0   2/3     0   2
Blake O'Neal           21   10    0    2   0   5/11   45.5   2/6    33.3   1/2     0   1
Draymond Smith         21    6    7    1   1   3/6    50.0   1/3    33.3   4/6     0   0
Zion Parker            21    8    7    3   0   3/5    60.0   0/0     0.0   0/0     0   1
Lauri Wade             18   14    4    1   0   6/8    75.0   1/1   100.0   1/1     0   0
Isaiah Durant          18   11    0    1   0   5/9    55.6   1/2    50.0   0/0     0   0

TEAM: FG: 45/83 (54.2%), 3PT: 12/29 (41.4%), REB: 50 (9 off, 41 def), AST: 18, TO: 6

================================================================================
