================================================================================
                        FULL GAME - Team_014 vs Team_057                        
================================================================================

================================================================================
                       1ST QUARTER - Team_014 vs Team_057                       
================================================================================

[12:00] Team_014 possession (Score: 0-0)
FOUL! Offensive foul on Jordan Anunoby! Klay Rozier drew the charge! [Team fouls: 1] (Jordan Anunoby: 1 personal fouls) TURNOVER! (dead ball)

[11:40] Team_057 possession (Score: 0-0)
Ben Adebayo attempts a Midrange. Contested by DeMar Adebayo (3.7 feet, MAN). Ben Adebayo misses. Rebound secured by Michael Cunningham.

[11:23] Team_014 possession (Score: 0-0)
FOUL! Shooting foul on Ben Adebayo. DeMar Adebayo to the line for 2 free throws. [Team fouls: 1] (Ben Adebayo: 1 personal fouls)   FT 1/2: MISS   FT 2/2: GOOD DeMar Adebayo makes 1/2 from the line.
Score: 1-0

[11:08] Team_057 possession (Score: 1-0)
Klay Rozier attempts a 3Pt. Contested by Jordan Anunoby (4.9 feet, ZONE). Klay Rozier misses. Rebound secured by Michael Cunningham.

[10:52] Team_014 possession (Score: 1-0)
Ayo Murray attempts a Midrange. Contested by Anfernee Adebayo (5.1 feet, ZONE). Ayo Murray misses. Rebound secured by Miles Middleton.

[10:41] Team_057 possession (Score: 1-0)
Miles Middleton drives to the basket... FOUL! Offensive foul on Miles Middleton! DeMar Adebayo drew the charge! [Team fouls: 2] (Miles Middleton: 1 personal fouls) TURNOVER! (dead ball)

[10:24] Team_014 possession (Score: 1-0)
Michael Cunningham drives and kicks out. Ayo Murray attempts a 3Pt. Contested by Kobe Ming (4.4 feet, ZONE). AYO MURRAY MAKES IT! Assist: DeMar Adebayo
Score: 4-0

[10:08] Team_057 possession (Score: 4-0)
FOUL! Shooting foul on DeMar Adebayo. Klay Rozier to the line for 2 free throws. [Team fouls: 2] (DeMar Adebayo: 1 personal fouls)   FT 1/2: GOOD   FT 2/2: MISS Klay Rozier makes 1/2 from the line. Rebound secured by DeMar Adebayo.
Score: 4-1

[09:56] Team_014 possession (Score: 4-1)
DeMar Adebayo attempts a 3Pt. Contested by Ben Adebayo (4.4 feet, MAN). DeMar Adebayo misses. Rebound secured by Ben Adebayo.

[09:40] Team_057 possession (Score: 4-1)
FOUL! Holding foul on Lamelo Simmons. [Team fouls: 3] No free throws, side out. (Lamelo Simmons: 1 personal fouls)

[09:27] Team_057 possession (Score: 4-1)
Anfernee Adebayo drives and kicks out. Ben Adebayo attempts a 3Pt. Contested by DeMar Adebayo (3.1 feet, MAN). Ben Adebayo misses. Rebound secured by Michael Cunningham.

[09:15] Team_014 possession (Score: 4-1)
Ayo Murray drives, Miles Middleton stays with him. Ayo Murray attempts a Dunk. Contested by Miles Middleton (4.7 feet, MAN). Ayo Murray misses. Rebound secured by Miles Middleton.

[08:56] Team_057 possession (Score: 4-1)
Ben Adebayo makes the Layup and draws the foul on DeMar Adebayo! And-1! Ben Adebayo to the line for 1. [Team fouls: 4] (DeMar Adebayo: 2 personal fouls)   FT 1/1: GOOD Ben Adebayo makes 1/1 from the line.
Score: 4-4

[08:42] Team_014 possession (Score: 4-4)
Jordan Anunoby attempts a Midrange. Contested by Klay Rozier (3.9 feet, MAN). JORDAN ANUNOBY MAKES IT!
Score: 6-4

[08:31] Team_057 possession (Score: 6-4)
Klay Rozier drives, DeMar Adebayo stays with him. Klay Rozier attempts a Dunk. Contested by DeMar Adebayo (3.3 feet, ZONE). Klay Rozier misses. Rebound secured by Michael Cunningham.

[08:16] Team_014 possession (Score: 6-4)
Ayo Murray commits a violation (traveling/carry)! TURNOVER! (dead ball)

[07:57] Team_057 possession (Score: 6-4)
Anfernee Adebayo throws a bad pass! Stolen by Lamelo Simmons! TURNOVER! (live ball)

[07:44] Team_014 possession (Score: 6-4)
Michael Cunningham attempts a 3Pt. Contested by Kobe Ming (4.2 feet, ZONE). MICHAEL CUNNINGHAM MAKES IT! Assist: Jordan Anunoby
Score: 9-4

[07:33] Team_057 possession (Score: 9-4)
Kobe Ming makes the Layup and draws the foul on DeMar Adebayo! And-1! Kobe Ming to the line for 1. [BONUS: 5 team fouls] (DeMar Adebayo: 3 personal fouls)   FT 1/1: GOOD Kobe Ming makes 1/1 from the line.
Score: 9-7

[07:22] Team_014 possession (Score: 9-7)
DeMar Adebayo attempts a Layup. Contested by Ben Adebayo (4.4 feet, MAN). DEMAR ADEBAYO MAKES IT! Assist: Jordan Anunoby
Score: 11-7

[07:06] Team_057 possession (Score: 11-7)
Miles Middleton makes the Dunk and draws the foul on Ayo Murray! And-1! Miles Middleton to the line for 1. [BONUS: 6 team fouls] (Ayo Murray: 1 personal fouls)   FT 1/1: GOOD Miles Middleton makes 1/1 from the line.
Score: 11-10

[06:52] Team_014 possession (Score: 11-10)
Jordan Anunoby drives and kicks out. DeMar Adebayo attempts a 3Pt. Contested by Ben Adebayo (4.4 feet, MAN). DeMar Adebayo misses. Rebound secured by Miles Middleton.

[06:36] Team_057 possession (Score: 11-10)
Miles Middleton drives to the basket... Miles Middleton loses the ball! Stripped by DeMar Adebayo! TURNOVER! (live ball)

[06:21] Team_014 possession (Score: 11-10)
Michael Cunningham makes the Layup and draws the foul on Kobe Ming! And-1! Michael Cunningham to the line for 1. [Team fouls: 3] (Kobe Ming: 1 personal fouls)   FT 1/1: GOOD Michael Cunningham makes 1/1 from the line.
Score: 14-10

[06:08] Team_057 possession (Score: 14-10)
Ben Adebayo attempts a Layup. BLOCKED BY MICHAEL CUNNINGHAM! Ball is loose! Offensive rebound by Ben Adebayo! Ben Adebayo kicks it out.

[05:54] Team_057 possession (Score: 14-10)
Ben Adebayo attempts a 3Pt. Contested by DeMar Adebayo (3.7 feet, MAN). Ben Adebayo misses. Rebound secured by DeMar Adebayo.

[05:44] Team_014 possession (Score: 14-10)
DeMar Adebayo drives and kicks out. Ayo Murray attempts a 3Pt. Contested by Miles Middleton (4.4 feet, MAN). Ayo Murray misses. Rebound secured by Ben Adebayo.

[05:26] Team_057 possession (Score: 14-10)
Miles Middleton attempts a Midrange. Contested by Ayo Murray (4.7 feet, MAN). MILES MIDDLETON MAKES IT! Assist: Klay Rozier
Score: 14-12

[05:09] Team_014 possession (Score: 14-12)
Michael Cunningham attempts a 3Pt. Contested by Kobe Ming (4.2 feet, ZONE). Michael Cunningham misses. Rebound secured by Miles Middleton.

[04:51] Team_057 possession (Score: 14-12)
Miles Middleton drives, picks up Ayo Murray. Help arrives from Michael Cunningham! Miles Middleton attempts a Layup. Contested by Michael Cunningham (4.7 feet, MAN). MILES MIDDLETON MAKES IT! Assist: Klay Rozier
Score: 14-14

[04:38] Team_014 possession (Score: 14-14)
Ayo Murray attempts a Midrange. Contested by Miles Middleton (4.8 feet, MAN). Ayo Murray misses. Rebound secured by Ben Adebayo.

[04:24] Team_057 possession (Score: 14-14)
Miles Middleton attempts a Layup. BLOCKED BY DEMAR ADEBAYO! Ball is loose! Rebound secured by DeMar Adebayo.

[04:11] Team_014 possession (Score: 14-14)
FOUL! Shooting foul on Anfernee Adebayo. Lamelo Simmons to the line for 2 free throws. [Team fouls: 4] (Anfernee Adebayo: 1 personal fouls)   FT 1/2: GOOD   FT 2/2: GOOD Lamelo Simmons makes 2/2 from the line.
Score: 16-14

[04:00] Team_057 possession (Score: 16-14)
Ben Adebayo drives to the basket... Ben Adebayo commits a violation (traveling/carry)! TURNOVER! (dead ball)

[03:41] Team_014 possession (Score: 16-14)
FOUL! Holding foul on Kobe Ming. [IN THE BONUS! 5 team fouls] Michael Cunningham to the line for 2 free throws. (Kobe Ming: 2 personal fouls)   FT 1/2: MISS   FT 2/2: GOOD Michael Cunningham makes 1/2 from the line.
Score: 17-14

[03:23] Team_057 possession (Score: 17-14)
Kobe Ming attempts a 3Pt. Contested by Michael Cunningham (4.4 feet, ZONE). Kobe Ming misses. Rebound secured by DeMar Adebayo.

[03:10] Team_014 possession (Score: 17-14)
Ayo Murray attempts a 3Pt. Contested by Kobe Ming (4.9 feet, ZONE). Ayo Murray misses. Offensive rebound by Ayo Murray! Ayo Murray kicks it out.

[02:57] Team_014 possession (Score: 17-14)
FOUL! Shooting foul on Kobe Ming. Michael Cunningham to the line for 2 free throws. [BONUS: 6 team fouls] (Kobe Ming: 3 personal fouls)   FT 1/2: GOOD   FT 2/2: MISS Michael Cunningham makes 1/2 from the line. Offensive rebound by DeMar Adebayo! DeMar Adebayo kicks it out.
Score: 18-14

[02:42] Team_014 possession (Score: 18-14)
Ayo Murray attempts a Layup. Contested by Ben Adebayo (5.0 feet, ZONE). Ayo Murray misses. Rebound secured by Anfernee Adebayo.

[02:28] Team_057 possession (Score: 18-14)
Ben Adebayo attempts a Midrange. Contested by Ayo Murray (5.5 feet, ZONE). BEN ADEBAYO MAKES IT!
Score: 18-16

[02:14] Team_014 possession (Score: 18-16)
Ayo Murray drives to the basket... Ayo Murray throws a bad pass! Stolen by Ben Adebayo! TURNOVER! (live ball)

[02:00] Team_057 possession (Score: 18-16)
Miles Middleton attempts a Layup. Contested by Ayo Murray (4.9 feet, MAN). MILES MIDDLETON MAKES IT!
Score: 18-18

[01:48] Team_014 possession (Score: 18-18)
Michael Cunningham attempts a 3Pt. Contested by Kobe Ming (4.5 feet, MAN). Michael Cunningham misses. Rebound secured by Ben Adebayo.

[01:31] Team_057 possession (Score: 18-18)
Kobe Ming attempts a Midrange. Contested by Michael Cunningham (4.6 feet, MAN). Kobe Ming misses. Rebound secured by Michael Cunningham.

[01:12] Team_014 possession (Score: 18-18)
FOUL! Reach-in foul on Kobe Ming during the drive. [IN THE BONUS! 7 team fouls] Michael Cunningham to the line for 2 free throws. (Kobe Ming: 4 personal fouls)   FT 1/2: GOOD   FT 2/2: MISS Michael Cunningham makes 1/2 from the line. Offensive rebound by DeMar Adebayo! DeMar Adebayo kicks it out.
Score: 19-18

[00:59] Team_014 possession (Score: 19-18)
FOUL! Shooting foul on Klay Rozier. Lamelo Simmons to the line for 2 free throws. [BONUS: 8 team fouls] (Klay Rozier: 1 personal fouls)   FT 1/2: MISS   FT 2/2: GOOD Lamelo Simmons makes 1/2 from the line.
Score: 20-18

[00:39] Team_057 possession (Score: 20-18)
Miles Middleton attempts a Layup. Contested by Ayo Murray (5.0 feet, MAN). MILES MIDDLETON MAKES IT! Assist: Ben Adebayo
Score: 20-20

[00:25] Team_014 possession (Score: 20-20)
Ayo Murray attempts a Midrange. Contested by Klay Rozier (4.4 feet, ZONE). AYO MURRAY MAKES IT! Assist: DeMar Adebayo
Score: 22-20

[00:13] Team_057 possession (Score: 22-20)
FOUL! Holding foul on DeMar Adebayo. [IN THE BONUS! 7 team fouls] Ben Adebayo to the line for 2 free throws. (DeMar Adebayo: 4 personal fouls)   FT 1/2: GOOD   FT 2/2: GOOD Ben Adebayo makes 2/2 from the line.
Score: 22-22

================================================================================
                              1ST QUARTER COMPLETE                              
================================================================================

1ST QUARTER SCORE: Team_014 22, Team_057 22

BOX SCORE:
================================================================================

Team_014
--------------------------------------------------------------------------------
Player                MIN  PTS  REB  AST  TO      FG   FG%      3P   3P%
--------------------------------------------------------------------------------
Michael Cunningham     12    7    5    0   0   3/5    60.0     0/0   0.0
Ayo Murray             12    5    1    0   0   2/6    33.3     0/0   0.0
DeMar Adebayo          12    3    6    2   0   2/4    50.0     0/0   0.0
Lamelo Simmons         12    3    0    0   0   2/2   100.0     0/0   0.0
Jordan Anunoby         12    2    0    2   0   1/2    50.0     0/0   0.0

TEAM: FG: 10/19 (52.6%), 3PT: 1/4 (25.0%), REB: 12 (3 off, 9 def), AST: 4, TO: 3
TEAM FOULS: 7 [Team_057 in BONUS]


Team_057
--------------------------------------------------------------------------------
Player                MIN  PTS  REB  AST  TO      FG   FG%      3P   3P%
--------------------------------------------------------------------------------
Miles Middleton        12   11    4    0   0   5/6    83.3     0/0   0.0
Ben Adebayo            12    7    5    1   0   3/5    60.0     0/0   0.0
Kobe Ming              12    3    0    0   0   1/3    33.3     0/0   0.0
Klay Rozier            12    0    0    2   0   0/3     0.0     0/0   0.0
Anfernee Adebayo       12    0    1    0   0   0/1     0.0     0/0   0.0

TEAM: FG: 9/18 (50.0%), 3PT: 0/3 (0.0%), REB: 10 (1 off, 9 def), AST: 3, TO: 4
TEAM FOULS: 8 [Team_014 in BONUS]

================================================================================

================================================================================
                       2ND QUARTER - Team_014 vs Team_057                       
================================================================================

[12:00] Team_014 possession (Score: 22-22)
Michael Cunningham attempts a 3Pt. Contested by Kobe Ming (4.5 feet, ZONE). Michael Cunningham misses. Rebound secured by Miles Middleton.

[11:47] Team_057 possession (Score: 22-22)
Anfernee Adebayo attempts a Midrange. Contested by Lamelo Simmons (4.9 feet, MAN). Anfernee Adebayo misses. Rebound secured by Michael Cunningham.

[11:35] Team_014 possession (Score: 22-22)
Lamelo Simmons attempts a 3Pt. Contested by Anfernee Adebayo (5.5 feet, MAN). LAMELO SIMMONS MAKES IT! Assist: Michael Cunningham
Score: 25-22

[11:17] Team_057 possession (Score: 25-22)
FOUL! Shooting foul on Jordan Anunoby. Klay Rozier to the line for 2 free throws. [Team fouls: 1] (Jordan Anunoby: 1 personal fouls)   FT 1/2: MISS   FT 2/2: GOOD Klay Rozier makes 1/2 from the line.
Score: 25-23

[11:01] Team_014 possession (Score: 25-23)
Lamelo Simmons attempts a 3Pt. Contested by Anfernee Adebayo (5.6 feet, MAN). Lamelo Simmons misses. Rebound secured by Anfernee Adebayo.

[10:42] Team_057 possession (Score: 25-23)
Ben Adebayo drives and kicks out. Ben Adebayo attempts a 3Pt. Contested by DeMar Adebayo (3.7 feet, MAN). Ben Adebayo misses. Rebound secured by Michael Cunningham.

[10:27] Team_014 possession (Score: 25-23)
DeMar Adebayo attempts a Midrange. Contested by Klay Rozier (4.0 feet, ZONE). DeMar Adebayo misses. Rebound secured by Anfernee Adebayo.

[10:14] Team_057 possession (Score: 25-23)
Ben Adebayo attempts a Layup. BLOCKED BY DEMAR ADEBAYO! Ball is loose! Rebound secured by Ayo Murray.

[09:57] Team_014 possession (Score: 25-23)
Lamelo Simmons makes the Layup and draws the foul on Klay Rozier! And-1! Lamelo Simmons to the line for 1. [Team fouls: 1] (Klay Rozier: 1 personal fouls)   FT 1/1: MISS Lamelo Simmons makes 0/1 from the line. Offensive rebound by DeMar Adebayo! DeMar Adebayo kicks it out.
Score: 27-23

[09:44] Team_014 possession (Score: 27-23)
Ayo Murray loses the ball! Stripped by Miles Middleton! TURNOVER! (live ball)

[09:32] Team_057 possession (Score: 27-23)
FOUL! Offensive foul on Ben Adebayo! DeMar Adebayo drew the charge! [Team fouls: 2] (Ben Adebayo: 1 personal fouls) TURNOVER! (dead ball)

[09:20] Team_014 possession (Score: 27-23)
Ayo Murray drives, picks up Miles Middleton. Help arrives from Klay Rozier! Ayo Murray attempts a Dunk. Contested by Klay Rozier (5.3 feet, MAN). AYO MURRAY MAKES IT! Assist: DeMar Adebayo
Score: 29-23

[09:03] Team_057 possession (Score: 29-23)
Kobe Ming drives to the basket... Kobe Ming commits a violation (traveling/carry)! TURNOVER! (dead ball)

[09:03] Substitution (Team_014): Michael Cunningham OUT → Jalen Booker IN (stamina_rule2)

[09:03] Substitution (Team_014): Jordan Anunoby OUT → Bones Quickley IN (stamina_rule2)

[09:03] Substitution (Team_014): Lamelo Simmons OUT → Tracy Westbrook IN (stamina_rule2)

[09:03] Substitution (Team_014): DeMar Adebayo OUT → Nikola James IN (stamina_rule2)

[09:03] Substitution (Team_014): Ayo Murray OUT → Collin Gasol IN (stamina_rule2)

[09:03] Substitution (Team_057): Kobe Ming OUT → Scottie Johnson IN (stamina_rule2)

[09:03] Substitution (Team_057): Klay Rozier OUT → Bradley Ginobili IN (stamina_rule2)

[09:03] Substitution (Team_057): Anfernee Adebayo OUT → Joel Wade IN (stamina_rule2)

[09:03] Substitution (Team_057): Ben Adebayo OUT → Lamelo Irving IN (stamina_rule2)

[09:03] Substitution (Team_057): Miles Middleton OUT → Zion Lillard IN (stamina_rule2)

[08:49] Team_014 possession (Score: 29-23)
Collin Gasol attempts a Layup. Contested by Zion Lillard (4.0 feet, MAN). COLLIN GASOL MAKES IT! Assist: Bones Quickley
Score: 31-23

[08:33] Team_057 possession (Score: 31-23)
Joel Wade attempts a 3Pt. Contested by Jalen Booker (4.1 feet, ZONE). Joel Wade misses. Rebound secured by Tracy Westbrook.

[08:16] Team_014 possession (Score: 31-23)
Bones Quickley attempts a 3Pt. Contested by Bradley Ginobili (4.8 feet, MAN). Bones Quickley misses. Rebound secured by Zion Lillard.

[07:56] Team_057 possession (Score: 31-23)
Lamelo Irving attempts a Midrange. Contested by Nikola James (5.9 feet, MAN). LAMELO IRVING MAKES IT! Assist: Scottie Johnson
Score: 31-25

[07:45] Team_014 possession (Score: 31-25)
Jalen Booker drives, picks up Lamelo Irving. Help arrives from Bradley Ginobili! Jalen Booker attempts a Layup. Contested by Bradley Ginobili (4.9 feet, ZONE). JALEN BOOKER MAKES IT! Assist: Nikola James
Score: 33-25

[07:30] Team_057 possession (Score: 33-25)
Bradley Ginobili drives, Collin Gasol stays with him. Bradley Ginobili attempts a Layup. Contested by Collin Gasol (5.4 feet, ZONE). BRADLEY GINOBILI MAKES IT! Assist: Zion Lillard
Score: 33-27

[07:14] Team_014 possession (Score: 33-27)
Tracy Westbrook attempts a Layup. Contested by Joel Wade (5.1 feet, MAN). TRACY WESTBROOK MAKES IT! Assist: Bones Quickley
Score: 35-27

[06:57] Team_057 possession (Score: 35-27)
Joel Wade attempts a 3Pt. Contested by Jalen Booker (4.1 feet, ZONE). JOEL WADE MAKES IT! Assist: Bradley Ginobili
Score: 35-30

[06:39] Team_014 possession (Score: 35-30)
Jalen Booker attempts a 3Pt. Contested by Scottie Johnson (4.9 feet, MAN). Jalen Booker misses. Rebound secured by Lamelo Irving.

[06:24] Team_057 possession (Score: 35-30)
Joel Wade attempts a 3Pt. Contested by Tracy Westbrook (5.1 feet, MAN). JOEL WADE MAKES IT! Assist: Scottie Johnson
Score: 35-33

[06:08] Team_014 possession (Score: 35-33)
Nikola James drives, picks up Lamelo Irving. Help arrives from Bradley Ginobili! Nikola James attempts a Dunk. Contested by Bradley Ginobili (4.9 feet, ZONE). Nikola James misses. Offensive rebound by Collin Gasol! Collin Gasol puts it back in!
Score: 37-33

[05:55] Team_057 possession (Score: 37-33)
Scottie Johnson drives to the basket... Scottie Johnson loses the ball! Stripped by Collin Gasol! TURNOVER! (live ball)

[05:38] Team_014 possession (Score: 37-33)
Tracy Westbrook attempts a 3Pt. Contested by Lamelo Irving (4.5 feet, ZONE). Tracy Westbrook misses. Rebound secured by Zion Lillard.

[05:21] Team_057 possession (Score: 37-33)
Bradley Ginobili commits a violation (traveling/carry)! TURNOVER! (dead ball)

[05:07] Team_014 possession (Score: 37-33)
Nikola James drives, Lamelo Irving stays with him. Nikola James attempts a Dunk. Contested by Lamelo Irving (4.9 feet, MAN). NIKOLA JAMES MAKES IT!
Score: 39-33

[04:52] Team_057 possession (Score: 39-33)
Lamelo Irving attempts a Midrange. Contested by Nikola James (5.9 feet, MAN). Lamelo Irving misses. Rebound secured by Tracy Westbrook.

[04:37] Team_014 possession (Score: 39-33)
Collin Gasol attempts a Midrange. Contested by Zion Lillard (4.0 feet, MAN). COLLIN GASOL MAKES IT!
Score: 41-33

[04:25] Team_057 possession (Score: 41-33)
Joel Wade attempts a 3Pt. Contested by Tracy Westbrook (5.1 feet, MAN). Joel Wade misses. Rebound secured by Nikola James.

[04:08] Team_014 possession (Score: 41-33)
Tracy Westbrook attempts a 3Pt. Contested by Joel Wade (5.1 feet, MAN). Tracy Westbrook misses. Rebound secured by Joel Wade.

[03:53] Team_057 possession (Score: 41-33)
Zion Lillard attempts a 3Pt. Contested by Jalen Booker (4.5 feet, ZONE). Zion Lillard misses. Rebound secured by Collin Gasol.

[03:40] Team_014 possession (Score: 41-33)
Nikola James attempts a Midrange. Contested by Lamelo Irving (4.9 feet, MAN). Nikola James misses. Rebound secured by Zion Lillard.

[03:23] Team_057 possession (Score: 41-33)
Zion Lillard drives and kicks out. Zion Lillard attempts a 3Pt. Contested by Jalen Booker (4.3 feet, ZONE). Zion Lillard misses. Rebound secured by Tracy Westbrook.

[03:09] Team_014 possession (Score: 41-33)
Nikola James drives, Lamelo Irving stays with him. Nikola James attempts a Dunk. Contested by Lamelo Irving (4.9 feet, ZONE). Nikola James misses. Rebound secured by Zion Lillard.

[02:59] Team_057 possession (Score: 41-33)
Joel Wade makes the Layup and draws the foul on Collin Gasol! And-1! Joel Wade to the line for 1. [Team fouls: 2] (Collin Gasol: 1 personal fouls)   FT 1/1: GOOD Joel Wade makes 1/1 from the line.
Score: 41-36

[02:45] Team_014 possession (Score: 41-36)
Bones Quickley attempts a 3Pt. Contested by Scottie Johnson (4.7 feet, ZONE). BONES QUICKLEY MAKES IT! Assist: Jalen Booker
Score: 44-36

[02:30] Team_057 possession (Score: 44-36)
Bradley Ginobili attempts a Layup. Contested by Bones Quickley (5.9 feet, MAN). Bradley Ginobili misses. Rebound secured by Collin Gasol.

[02:13] Team_014 possession (Score: 44-36)
Nikola James attempts a Midrange. Contested by Zion Lillard (3.7 feet, ZONE). Nikola James misses. Rebound secured by Zion Lillard.

[02:00] Team_057 possession (Score: 44-36)
Lamelo Irving throws a bad pass! Stolen by Nikola James! TURNOVER! (live ball)

[01:49] Team_014 possession (Score: 44-36)
Jalen Booker drives, Lamelo Irving stays with him. Jalen Booker attempts a Dunk. Contested by Lamelo Irving (4.9 feet, ZONE). Jalen Booker misses. Rebound secured by Zion Lillard.

[01:33] Team_057 possession (Score: 44-36)
FOUL! Shooting foul on Tracy Westbrook. Joel Wade to the line for 2 free throws. [Team fouls: 3] (Tracy Westbrook: 1 personal fouls)   FT 1/2: GOOD   FT 2/2: GOOD Joel Wade makes 2/2 from the line.
Score: 44-38

[01:22] Team_014 possession (Score: 44-38)
Tracy Westbrook attempts a 3Pt. Contested by Scottie Johnson (4.6 feet, ZONE). Tracy Westbrook misses. Rebound secured by Joel Wade.

[01:08] Team_057 possession (Score: 44-38)
Bradley Ginobili attempts a Layup. Contested by Collin Gasol (5.5 feet, ZONE). BRADLEY GINOBILI MAKES IT!
Score: 44-40

[00:54] Team_014 possession (Score: 44-40)
Jalen Booker attempts a 3Pt. Contested by Scottie Johnson (5.0 feet, ZONE). Jalen Booker misses. Rebound secured by Lamelo Irving.

[00:37] Team_057 possession (Score: 44-40)
Scottie Johnson attempts a Layup. Contested by Jalen Booker (4.6 feet, MAN). SCOTTIE JOHNSON MAKES IT! Assist: Joel Wade
Score: 44-42

[00:22] Team_014 possession (Score: 44-42)
Bones Quickley drives, Lamelo Irving stays with him. Bones Quickley attempts a Dunk. Contested by Lamelo Irving (4.9 feet, ZONE). BONES QUICKLEY MAKES IT!
Score: 46-42

[00:06] Team_057 possession (Score: 46-42)
Joel Wade drives and kicks out. Lamelo Irving attempts a 3Pt. Contested by Nikola James (5.3 feet, MAN). Lamelo Irving misses. Rebound secured by Collin Gasol.

================================================================================
                              2ND QUARTER COMPLETE                              
================================================================================

2ND QUARTER SCORE: Team_014 24, Team_057 20

BOX SCORE:
================================================================================

Team_014
--------------------------------------------------------------------------------
Player                MIN  PTS  REB  AST  TO      FG   FG%      3P   3P%
--------------------------------------------------------------------------------
Collin Gasol            9    6    4    0   0   3/3   100.0     0/0   0.0
Bones Quickley          9    5    0    2   0   2/3    66.7     0/0   0.0
Lamelo Simmons         15    3    0    0   0   1/2    50.0     0/0   0.0
Ayo Murray             15    2    1    0   0   1/1   100.0     0/0   0.0
Tracy Westbrook         9    2    3    0   0   1/4    25.0     0/0   0.0
Jalen Booker            9    2    0    1   0   1/4    25.0     0/0   0.0
Nikola James            9    2    1    1   0   1/4    25.0     0/0   0.0
Michael Cunningham     15    0    2    1   0   0/1     0.0     0/0   0.0
DeMar Adebayo          15    0    1    1   0   0/1     0.0     0/0   0.0

TEAM: FG: 10/23 (43.5%), 3PT: 2/10 (20.0%), REB: 12 (2 off, 10 def), AST: 6, TO: 1
TEAM FOULS: 3


Team_057
--------------------------------------------------------------------------------
Player                MIN  PTS  REB  AST  TO      FG   FG%      3P   3P%
--------------------------------------------------------------------------------
Joel Wade               9   11    2    1   0   4/7    57.1     0/0   0.0
Bradley Ginobili        9    4    0    1   0   2/3    66.7     0/0   0.0
Lamelo Irving           9    2    2    0   0   1/2    50.0     0/0   0.0
Scottie Johnson         9    2    0    2   0   1/1   100.0     0/0   0.0
Klay Rozier            15    1    0    0   0   1/1   100.0     0/0   0.0
Miles Middleton        15    0    1    0   0   0/0     0.0     0/0   0.0
Anfernee Adebayo       15    0    2    0   0   0/1     0.0     0/0   0.0
Ben Adebayo            15    0    0    0   0   0/2     0.0     0/0   0.0
Zion Lillard            9    0    6    1   0   0/2     0.0     0/0   0.0

TEAM: FG: 9/19 (47.4%), 3PT: 2/5 (40.0%), REB: 13 (0 off, 13 def), AST: 5, TO: 5
TEAM FOULS: 2

================================================================================

================================================================================
                       3RD QUARTER - Team_014 vs Team_057                       
================================================================================

[12:00] Team_014 possession (Score: 46-42)
DeMar Adebayo attempts a Midrange. Contested by Ben Adebayo (4.4 feet, MAN). DeMar Adebayo misses. Rebound secured by Ben Adebayo.

[11:45] Team_057 possession (Score: 46-42)
Ben Adebayo throws a bad pass out of bounds! TURNOVER! (dead ball)

[11:27] Team_014 possession (Score: 46-42)
Lamelo Simmons attempts a 3Pt. Contested by Klay Rozier (4.1 feet, ZONE). Lamelo Simmons misses. Offensive rebound by DeMar Adebayo! DeMar Adebayo kicks it out.

[11:15] Team_014 possession (Score: 46-42)
Michael Cunningham attempts a 3Pt. Contested by Kobe Ming (4.2 feet, ZONE). MICHAEL CUNNINGHAM MAKES IT! Assist: Ayo Murray
Score: 49-42

[11:02] Team_057 possession (Score: 49-42)
Kobe Ming attempts a Midrange. Contested by Michael Cunningham (4.3 feet, MAN). Kobe Ming misses. Rebound secured by DeMar Adebayo.

[10:46] Team_014 possession (Score: 49-42)
Michael Cunningham attempts a Midrange. Contested by Kobe Ming (4.2 feet, MAN). MICHAEL CUNNINGHAM MAKES IT!
Score: 51-42

[10:31] Team_057 possession (Score: 51-42)
Ben Adebayo makes the Layup and draws the foul on DeMar Adebayo! And-1! Ben Adebayo to the line for 1. [Team fouls: 1] (DeMar Adebayo: 1 personal fouls)   FT 1/1: GOOD Ben Adebayo makes 1/1 from the line.
Score: 51-45

[10:14] Team_014 possession (Score: 51-45)
Michael Cunningham drives to the basket... Michael Cunningham throws a bad pass out of bounds! TURNOVER! (dead ball)

[10:01] Team_057 possession (Score: 51-45)
Anfernee Adebayo attempts a 3Pt. Contested by Lamelo Simmons (4.5 feet, MAN). Anfernee Adebayo misses. Rebound secured by Ayo Murray.

[09:49] Team_014 possession (Score: 51-45)
FOUL! Holding foul on Ben Adebayo. [Team fouls: 1] No free throws, side out. (Ben Adebayo: 1 personal fouls)

[09:35] Team_014 possession (Score: 51-45)
Ayo Murray attempts a Layup. Contested by Miles Middleton (4.7 feet, MAN). AYO MURRAY MAKES IT! Assist: Jordan Anunoby
Score: 53-45

[09:19] Team_057 possession (Score: 53-45)
Ben Adebayo drives and kicks out. Miles Middleton attempts a Midrange. Contested by Ayo Murray (4.8 feet, MAN). Miles Middleton misses. Rebound secured by Ayo Murray.

[09:08] Team_014 possession (Score: 53-45)
Ayo Murray drives and kicks out. Michael Cunningham attempts a Midrange. Contested by Kobe Ming (4.4 feet, MAN). Michael Cunningham misses. Rebound secured by Anfernee Adebayo.

[08:52] Team_057 possession (Score: 53-45)
Anfernee Adebayo drives and kicks out. Kobe Ming attempts a 3Pt. Contested by Jordan Anunoby (4.7 feet, ZONE). KOBE MING MAKES IT! Assist: Ben Adebayo
Score: 53-48

[08:38] Team_014 possession (Score: 53-48)
Lamelo Simmons attempts a Layup. Contested by Ben Adebayo (4.9 feet, ZONE). Lamelo Simmons misses. Rebound secured by Miles Middleton.

[08:26] Team_057 possession (Score: 53-48)
Kobe Ming makes the Layup and draws the foul on Michael Cunningham! And-1! Kobe Ming to the line for 1. [Team fouls: 2] (Michael Cunningham: 1 personal fouls)   FT 1/1: MISS Kobe Ming makes 0/1 from the line. Rebound secured by Ayo Murray.
Score: 53-50

[08:12] Team_014 possession (Score: 53-50)
Jordan Anunoby makes the Midrange and draws the foul on Klay Rozier! And-1! Jordan Anunoby to the line for 1. [Team fouls: 2] (Klay Rozier: 1 personal fouls)   FT 1/1: GOOD Jordan Anunoby makes 1/1 from the line.
Score: 56-50

[07:55] Team_057 possession (Score: 56-50)
Ben Adebayo attempts a Midrange. Contested by DeMar Adebayo (3.7 feet, MAN). Ben Adebayo misses. Rebound secured by Michael Cunningham.

[07:38] Team_014 possession (Score: 56-50)
Jordan Anunoby makes the Midrange and draws the foul on Klay Rozier! And-1! Jordan Anunoby to the line for 1. [Team fouls: 3] (Klay Rozier: 2 personal fouls)   FT 1/1: GOOD Jordan Anunoby makes 1/1 from the line.
Score: 59-50

[07:21] Team_057 possession (Score: 59-50)
FOUL! Offensive foul on Kobe Ming! Michael Cunningham drew the charge! [Team fouls: 4] (Kobe Ming: 1 personal fouls) TURNOVER! (dead ball)

[07:05] Team_014 possession (Score: 59-50)
Michael Cunningham attempts a 3Pt. Contested by Kobe Ming (4.2 feet, ZONE). Michael Cunningham misses. Rebound secured by Miles Middleton.

[06:52] Team_057 possession (Score: 59-50)
Ben Adebayo drives to the basket... Ben Adebayo throws a bad pass out of bounds! TURNOVER! (dead ball)

[06:35] Team_014 possession (Score: 59-50)
DeMar Adebayo attempts a 3Pt. Contested by Ben Adebayo (4.4 feet, MAN). DeMar Adebayo misses. Rebound secured by Anfernee Adebayo.

[06:23] Team_057 possession (Score: 59-50)
FOUL! Shooting foul on DeMar Adebayo. Ben Adebayo to the line for 2 free throws. [Team fouls: 3] (DeMar Adebayo: 2 personal fouls)   FT 1/2: GOOD   FT 2/2: MISS Ben Adebayo makes 1/2 from the line. Offensive rebound by Ben Adebayo! Ben Adebayo kicks it out.
Score: 59-51

[06:10] Team_057 possession (Score: 59-51)
Miles Middleton attempts a Midrange. Contested by DeMar Adebayo (3.0 feet, ZONE). Miles Middleton misses. Rebound secured by Michael Cunningham.

[05:59] Team_014 possession (Score: 59-51)
DeMar Adebayo drives and kicks out. Ayo Murray attempts a 3Pt. Contested by Miles Middleton (4.4 feet, MAN). AYO MURRAY MAKES IT! Assist: DeMar Adebayo
Score: 62-51

[05:45] Team_057 possession (Score: 62-51)
Anfernee Adebayo drives to the basket... Anfernee Adebayo loses control! Ball rolls out of bounds! TURNOVER! (dead ball)

[05:30] Team_014 possession (Score: 62-51)
Jordan Anunoby attempts a 3Pt. Contested by Kobe Ming (4.7 feet, ZONE). Jordan Anunoby misses. Rebound secured by Anfernee Adebayo.

[05:14] Team_057 possession (Score: 62-51)
Anfernee Adebayo attempts a Layup. Contested by Ayo Murray (5.3 feet, ZONE). ANFERNEE ADEBAYO MAKES IT! Assist: Miles Middleton
Score: 62-53

[04:57] Team_014 possession (Score: 62-53)
DeMar Adebayo makes the Layup and draws the foul on Ben Adebayo! And-1! DeMar Adebayo to the line for 1. [BONUS: 5 team fouls] (Ben Adebayo: 2 personal fouls)   FT 1/1: GOOD DeMar Adebayo makes 1/1 from the line.
Score: 65-53

[04:41] Team_057 possession (Score: 65-53)
FOUL! Shooting foul on Michael Cunningham. Miles Middleton to the line for 2 free throws. [Team fouls: 4] (Michael Cunningham: 2 personal fouls)   FT 1/2: MISS   FT 2/2: GOOD Miles Middleton makes 1/2 from the line.
Score: 65-54

[04:27] Team_014 possession (Score: 65-54)
Ayo Murray drives, Miles Middleton stays with him. Ayo Murray attempts a Dunk. Contested by Miles Middleton (4.8 feet, MAN). AYO MURRAY MAKES IT! Assist: Lamelo Simmons
Score: 67-54

[04:10] Team_057 possession (Score: 67-54)
Kobe Ming attempts a Layup. Contested by DeMar Adebayo (3.5 feet, ZONE). KOBE MING MAKES IT! Assist: Ben Adebayo
Score: 67-56

[03:53] Team_014 possession (Score: 67-56)
FOUL! Shooting foul on Kobe Ming. Michael Cunningham to the line for 3 free throws. [BONUS: 6 team fouls] (Kobe Ming: 2 personal fouls)   FT 1/3: GOOD   FT 2/3: GOOD   FT 3/3: MISS Michael Cunningham makes 2/3 from the line. Rebound secured by Miles Middleton.
Score: 69-56

[03:34] Team_057 possession (Score: 69-56)
Kobe Ming attempts a Midrange. Contested by Michael Cunningham (4.4 feet, MAN). Kobe Ming misses. Offensive rebound by Miles Middleton! Miles Middleton kicks it out.

[03:21] Team_057 possession (Score: 69-56)
Ben Adebayo attempts a 3Pt. Contested by Jordan Anunoby (5.3 feet, ZONE). BEN ADEBAYO MAKES IT! Assist: Kobe Ming
Score: 69-59

[03:07] Team_014 possession (Score: 69-59)
FOUL! Shooting foul on Miles Middleton. Ayo Murray to the line for 2 free throws. [BONUS: 7 team fouls] (Miles Middleton: 1 personal fouls)   FT 1/2: GOOD   FT 2/2: MISS Ayo Murray makes 1/2 from the line. Rebound secured by Miles Middleton.
Score: 70-59

[02:52] Team_057 possession (Score: 70-59)
Ben Adebayo drives, picks up Ayo Murray. Help arrives from Michael Cunningham! Ben Adebayo attempts a Dunk. Contested by Michael Cunningham (5.5 feet, ZONE). BEN ADEBAYO MAKES IT! Assist: Anfernee Adebayo
Score: 70-61

[02:35] Team_014 possession (Score: 70-61)
DeMar Adebayo drives and kicks out. Jordan Anunoby attempts a Midrange. Contested by Klay Rozier (3.9 feet, MAN). Jordan Anunoby misses. Rebound secured by Miles Middleton.

[02:22] Team_057 possession (Score: 70-61)
Kobe Ming attempts a 3Pt. Contested by Michael Cunningham (4.5 feet, MAN). Kobe Ming misses. Rebound secured by Ayo Murray.

[02:06] Team_014 possession (Score: 70-61)
Jordan Anunoby attempts a 3Pt. Contested by Klay Rozier (4.2 feet, MAN). Jordan Anunoby misses. Offensive rebound by Ayo Murray! Ayo Murray kicks it out.

[01:52] Team_014 possession (Score: 70-61)
Michael Cunningham attempts a 3Pt. Contested by Kobe Ming (4.5 feet, MAN). Michael Cunningham misses. Rebound secured by Anfernee Adebayo.

[01:39] Team_057 possession (Score: 70-61)
FOUL! Shooting foul on Ayo Murray. Miles Middleton to the line for 2 free throws. [BONUS: 5 team fouls] (Ayo Murray: 1 personal fouls)   FT 1/2: GOOD   FT 2/2: MISS Miles Middleton makes 1/2 from the line. Offensive rebound by Miles Middleton! Miles Middleton kicks it out.
Score: 70-62

[01:28] Team_057 possession (Score: 70-62)
Miles Middleton attempts a Layup. Contested by Ayo Murray (5.0 feet, MAN). MILES MIDDLETON MAKES IT! Assist: Anfernee Adebayo
Score: 70-64

[01:15] Team_014 possession (Score: 70-64)
Lamelo Simmons makes the Layup and draws the foul on Anfernee Adebayo! And-1! Lamelo Simmons to the line for 1. [BONUS: 8 team fouls] (Anfernee Adebayo: 1 personal fouls)   FT 1/1: GOOD Lamelo Simmons makes 1/1 from the line.
Score: 73-64

[01:00] Team_057 possession (Score: 73-64)
FOUL! Shooting foul on Ayo Murray. Miles Middleton to the line for 2 free throws. [BONUS: 6 team fouls] (Ayo Murray: 2 personal fouls)   FT 1/2: MISS   FT 2/2: GOOD Miles Middleton makes 1/2 from the line.
Score: 73-65

[00:42] Team_014 possession (Score: 73-65)
Lamelo Simmons attempts a 3Pt. Contested by Anfernee Adebayo (5.6 feet, MAN). Lamelo Simmons misses. Offensive rebound by Ayo Murray! Ayo Murray kicks it out.

[00:24] Team_014 possession (Score: 73-65)
Ayo Murray attempts a Midrange. Contested by Miles Middleton (5.2 feet, MAN). AYO MURRAY MAKES IT!
Score: 75-65

[00:10] Team_057 possession (Score: 75-65)
FOUL! Shooting foul on DeMar Adebayo. Kobe Ming to the line for 2 free throws. [BONUS: 7 team fouls] (DeMar Adebayo: 3 personal fouls)   FT 1/2: GOOD   FT 2/2: GOOD Kobe Ming makes 2/2 from the line.
Score: 75-67

================================================================================
                              3RD QUARTER COMPLETE                              
================================================================================

3RD QUARTER SCORE: Team_014 29, Team_057 25

BOX SCORE:
================================================================================

Team_014
--------------------------------------------------------------------------------
Player                MIN  PTS  REB  AST  TO      FG   FG%      3P   3P%
--------------------------------------------------------------------------------
Ayo Murray             27    9    6    1   0   4/6    66.7     0/0   0.0
Jordan Anunoby         27    6    0    1   0   2/3    66.7     0/0   0.0
Michael Cunningham     27    5    2    0   0   2/5    40.0     0/0   0.0
DeMar Adebayo          27    3    2    1   0   1/4    25.0     0/0   0.0
Lamelo Simmons         27    3    0    1   0   1/2    50.0     0/0   0.0

TEAM: FG: 10/20 (50.0%), 3PT: 1/6 (16.7%), REB: 10 (3 off, 7 def), AST: 4, TO: 1
TEAM FOULS: 7 [Team_057 in BONUS]


Team_057
--------------------------------------------------------------------------------
Player                MIN  PTS  REB  AST  TO      FG   FG%      3P   3P%
--------------------------------------------------------------------------------
Ben Adebayo            27    8    2    2   0   3/5    60.0     0/0   0.0
Kobe Ming              27    7    0    1   0   3/6    50.0     0/0   0.0
Miles Middleton        27    4    7    1   0   3/4    75.0     0/0   0.0
Anfernee Adebayo       27    2    4    2   0   1/2    50.0     0/0   0.0

TEAM: FG: 10/17 (58.8%), 3PT: 1/3 (33.3%), REB: 13 (3 off, 10 def), AST: 6, TO: 4
TEAM FOULS: 8 [Team_014 in BONUS]

================================================================================

================================================================================
                       4TH QUARTER - Team_014 vs Team_057                       
================================================================================

[12:00] Team_014 possession (Score: 75-67)
Ayo Murray drives, picks up Ben Adebayo. Help arrives from Klay Rozier! Ayo Murray attempts a Dunk. Contested by Klay Rozier (5.0 feet, ZONE). Ayo Murray misses. Rebound secured by Ben Adebayo.

[11:48] Team_057 possession (Score: 75-67)
Klay Rozier attempts a Layup. Contested by Jordan Anunoby (5.1 feet, MAN). KLAY ROZIER MAKES IT! Assist: Kobe Ming
Score: 75-69

[11:31] Team_014 possession (Score: 75-69)
DeMar Adebayo attempts a 3Pt. Contested by Anfernee Adebayo (5.1 feet, ZONE). DeMar Adebayo misses. Rebound secured by Ben Adebayo.

[11:18] Team_057 possession (Score: 75-69)
Miles Middleton drives, picks up Ayo Murray. Help arrives from Michael Cunningham! Miles Middleton attempts a Layup. Contested by Michael Cunningham (5.0 feet, MAN). MILES MIDDLETON MAKES IT! Assist: Kobe Ming
Score: 75-71

[10:58] Team_014 possession (Score: 75-71)
Jordan Anunoby attempts a Layup. Contested by Klay Rozier (4.3 feet, MAN). Jordan Anunoby misses. Offensive rebound by Ayo Murray! Ayo Murray kicks it out.

[10:39] Team_014 possession (Score: 75-71)
Ayo Murray attempts a Layup. Contested by Ben Adebayo (5.2 feet, ZONE). AYO MURRAY MAKES IT! Assist: Lamelo Simmons
Score: 77-71

[10:26] Team_057 possession (Score: 77-71)
FOUL! Shooting foul on DeMar Adebayo. Ben Adebayo to the line for 2 free throws. [Team fouls: 1] (DeMar Adebayo: 1 personal fouls)   FT 1/2: MISS   FT 2/2: GOOD Ben Adebayo makes 1/2 from the line.
Score: 77-72

[10:08] Team_014 possession (Score: 77-72)
DeMar Adebayo attempts a 3Pt. Contested by Kobe Ming (4.8 feet, ZONE). DEMAR ADEBAYO MAKES IT! Assist: Ayo Murray
Score: 80-72

[09:58] Team_057 possession (Score: 80-72)
Anfernee Adebayo drives, Lamelo Simmons stays with him. Anfernee Adebayo attempts a Layup. Contested by Lamelo Simmons (5.1 feet, MAN). ANFERNEE ADEBAYO MAKES IT! Assist: Ben Adebayo
Score: 80-74

[09:46] Team_014 possession (Score: 80-74)
Michael Cunningham attempts a 3Pt. Contested by Kobe Ming (4.7 feet, ZONE). Michael Cunningham misses. Rebound secured by Anfernee Adebayo.

[09:30] Team_057 possession (Score: 80-74)
Miles Middleton attempts a Midrange. Contested by Lamelo Simmons (4.6 feet, ZONE). MILES MIDDLETON MAKES IT! Assist: Kobe Ming
Score: 80-76

[09:20] Team_014 possession (Score: 80-76)
Lamelo Simmons attempts a Midrange. Contested by Anfernee Adebayo (5.7 feet, MAN). LAMELO SIMMONS MAKES IT! Assist: DeMar Adebayo
Score: 82-76

[09:06] Team_057 possession (Score: 82-76)
FOUL! Reach-in foul on Jordan Anunoby during the drive. [Team fouls: 2] No free throws, side out. (Jordan Anunoby: 1 personal fouls)

[08:49] Team_057 possession (Score: 82-76)
Kobe Ming attempts a Midrange. Contested by Jordan Anunoby (5.5 feet, ZONE). KOBE MING MAKES IT! Assist: Ben Adebayo
Score: 82-78

[08:34] Team_014 possession (Score: 82-78)
Jordan Anunoby attempts a Midrange. Contested by Klay Rozier (4.6 feet, MAN). Jordan Anunoby misses. Rebound secured by Miles Middleton.

[08:17] Team_057 possession (Score: 82-78)
Anfernee Adebayo drives to the basket... Anfernee Adebayo loses the ball! Stripped by Lamelo Simmons! TURNOVER! (live ball)

[08:04] Team_014 possession (Score: 82-78)
FOUL! Holding foul on Ben Adebayo. [Team fouls: 1] No free throws, side out. (Ben Adebayo: 1 personal fouls)

[07:48] Team_014 possession (Score: 82-78)
Michael Cunningham attempts a Midrange. Contested by Kobe Ming (5.0 feet, MAN). Michael Cunningham misses. Rebound secured by Anfernee Adebayo.

[07:30] Team_057 possession (Score: 82-78)
Anfernee Adebayo attempts a 3Pt. Contested by Lamelo Simmons (5.4 feet, MAN). ANFERNEE ADEBAYO MAKES IT! Assist: Kobe Ming
Score: 82-81

[07:16] Team_014 possession (Score: 82-81)
FOUL! Reach-in foul on Kobe Ming during the drive. [Team fouls: 2] No free throws, side out. (Kobe Ming: 1 personal fouls)

[07:04] Team_014 possession (Score: 82-81)
Michael Cunningham attempts a 3Pt. Contested by Kobe Ming (5.1 feet, ZONE). Michael Cunningham misses. Rebound secured by Miles Middleton.

[06:47] Team_057 possession (Score: 82-81)
Miles Middleton attempts a Midrange. Contested by Lamelo Simmons (5.0 feet, ZONE). Miles Middleton misses. Rebound secured by DeMar Adebayo.

[06:36] Team_014 possession (Score: 82-81)
Ayo Murray drives, Ben Adebayo stays with him. Ayo Murray attempts a Dunk. Contested by Ben Adebayo (5.6 feet, ZONE). AYO MURRAY MAKES IT! Assist: Jordan Anunoby
Score: 84-81

[06:23] Team_057 possession (Score: 84-81)
Kobe Ming attempts a 3Pt. Contested by Jordan Anunoby (5.8 feet, ZONE). Kobe Ming misses. Rebound secured by Ayo Murray.

[06:10] Team_014 possession (Score: 84-81)
DeMar Adebayo drives to the basket... DeMar Adebayo throws a bad pass out of bounds! TURNOVER! (dead ball)

[06:10] Substitution (Team_014): Michael Cunningham OUT → Jalen Booker IN (stamina_rule2)

[06:10] Substitution (Team_014): Jordan Anunoby OUT → Bones Quickley IN (stamina_rule2)

[06:10] Substitution (Team_014): Lamelo Simmons OUT → Tracy Westbrook IN (stamina_rule2)

[06:10] Substitution (Team_014): DeMar Adebayo OUT → Nikola James IN (stamina_rule2)

[06:10] Substitution (Team_014): Ayo Murray OUT → Collin Gasol IN (stamina_rule2)

[06:10] Substitution (Team_057): Kobe Ming OUT → Scottie Johnson IN (stamina_rule2)

[06:10] Substitution (Team_057): Klay Rozier OUT → Bradley Ginobili IN (stamina_rule2)

[06:10] Substitution (Team_057): Anfernee Adebayo OUT → Joel Wade IN (stamina_rule2)

[06:10] Substitution (Team_057): Ben Adebayo OUT → Lamelo Irving IN (stamina_rule2)

[06:10] Substitution (Team_057): Miles Middleton OUT → Zion Lillard IN (stamina_rule2)

[05:54] Team_057 possession (Score: 84-81)
Zion Lillard attempts a 3Pt. Contested by Jalen Booker (4.5 feet, ZONE). Zion Lillard misses. Offensive rebound by Zion Lillard! Zion Lillard puts it back in!
Score: 84-83

[05:35] Team_014 possession (Score: 84-83)
Jalen Booker attempts a Midrange. Contested by Scottie Johnson (4.9 feet, MAN). JALEN BOOKER MAKES IT! Assist: Bones Quickley
Score: 86-83

[05:17] Team_057 possession (Score: 86-83)
Lamelo Irving attempts a 3Pt. Contested by Nikola James (5.9 feet, MAN). LAMELO IRVING MAKES IT! Assist: Zion Lillard
Score: 86-86

[05:00] Team_014 possession (Score: 86-86)
Tracy Westbrook attempts a Midrange. Contested by Joel Wade (5.1 feet, MAN). Tracy Westbrook misses. Rebound secured by Joel Wade.

[04:47] Team_057 possession (Score: 86-86)
Joel Wade attempts a Midrange. Contested by Tracy Westbrook (5.1 feet, ZONE). Joel Wade misses. FOUL! Loose ball foul on Nikola James during the rebound battle. [Team fouls: 3] No free throws, side out. (Nikola James: 1 personal fouls)

[04:33] Team_057 possession (Score: 86-86)
Bradley Ginobili attempts a Midrange. Contested by Tracy Westbrook (5.6 feet, ZONE). Bradley Ginobili misses. Rebound secured by Tracy Westbrook.

[04:18] Team_014 possession (Score: 86-86)
Tracy Westbrook attempts a Layup. Contested by Lamelo Irving (4.5 feet, ZONE). TRACY WESTBROOK MAKES IT! Assist: Bones Quickley
Score: 88-86

[04:05] Team_057 possession (Score: 88-86)
Scottie Johnson drives and kicks out. Zion Lillard attempts a Midrange. Contested by Bones Quickley (5.5 feet, ZONE). ZION LILLARD MAKES IT! Assist: Lamelo Irving
Score: 88-88

[03:52] Team_014 possession (Score: 88-88)
Collin Gasol attempts a 3Pt. Contested by Zion Lillard (4.0 feet, MAN). Collin Gasol misses. Offensive rebound by Collin Gasol! Collin Gasol puts it back in!
Score: 90-88

[03:37] Team_057 possession (Score: 90-88)
Bradley Ginobili attempts a 3Pt. Contested by Jalen Booker (4.6 feet, ZONE). Bradley Ginobili misses. Rebound secured by Tracy Westbrook.

[03:22] Team_014 possession (Score: 90-88)
Jalen Booker attempts a 3Pt. Contested by Scottie Johnson (4.9 feet, MAN). Jalen Booker misses. Rebound secured by Zion Lillard.

[03:04] Team_057 possession (Score: 90-88)
Joel Wade attempts a 3Pt. Contested by Jalen Booker (4.1 feet, ZONE). Joel Wade misses. Offensive rebound by Zion Lillard! Zion Lillard puts it back in!
Score: 90-90

[02:51] Team_014 possession (Score: 90-90)
Nikola James attempts a Midrange. Contested by Joel Wade (5.5 feet, ZONE). Nikola James misses. FOUL! Loose ball foul on Joel Wade during the rebound battle. [Team fouls: 3] No free throws, side out. (Joel Wade: 1 personal fouls)

[02:34] Team_014 possession (Score: 90-90)
Bones Quickley attempts a 3Pt. Contested by Scottie Johnson (4.7 feet, ZONE). Bones Quickley misses. Rebound secured by Zion Lillard.

[02:15] Team_057 possession (Score: 90-90)
Lamelo Irving drives to the basket... Lamelo Irving throws a bad pass out of bounds! TURNOVER! (dead ball)

[01:57] Team_014 possession (Score: 90-90)
Tracy Westbrook attempts a 3Pt. Contested by Scottie Johnson (4.5 feet, ZONE). TRACY WESTBROOK MAKES IT! Assist: Jalen Booker
Score: 93-90

[01:47] Team_057 possession (Score: 93-90)
FOUL! Shooting foul on Jalen Booker. Lamelo Irving to the line for 2 free throws. [Team fouls: 4] (Jalen Booker: 1 personal fouls)   FT 1/2: GOOD   FT 2/2: GOOD Lamelo Irving makes 2/2 from the line.
Score: 93-92

[01:33] Team_014 possession (Score: 93-92)
Bones Quickley drives, Lamelo Irving stays with him. Bones Quickley attempts a Layup. Contested by Lamelo Irving (4.7 feet, ZONE). BONES QUICKLEY MAKES IT!
Score: 95-92

[01:17] Team_057 possession (Score: 95-92)
FOUL! Reach-in foul on Collin Gasol during the drive. [IN THE BONUS! 5 team fouls] Zion Lillard to the line for 2 free throws. (Collin Gasol: 1 personal fouls)   FT 1/2: GOOD   FT 2/2: GOOD Zion Lillard makes 2/2 from the line.
Score: 95-94

[01:00] Team_014 possession (Score: 95-94)
FOUL! Holding foul on Lamelo Irving. [Team fouls: 4] No free throws, side out. (Lamelo Irving: 1 personal fouls)

[00:47] Team_014 possession (Score: 95-94)
FOUL! Holding foul on Joel Wade. [IN THE BONUS! 5 team fouls] Tracy Westbrook to the line for 2 free throws. (Joel Wade: 2 personal fouls)   FT 1/2: GOOD   FT 2/2: GOOD Tracy Westbrook makes 2/2 from the line.
Score: 97-94

[00:31] Team_057 possession (Score: 97-94)
Scottie Johnson attempts a 3Pt. Contested by Jalen Booker (4.5 feet, MAN). Scottie Johnson misses. Rebound secured by Nikola James.

[00:15] Team_014 possession (Score: 97-94)
Jalen Booker drives and kicks out. Nikola James attempts a 3Pt. Contested by Lamelo Irving (4.8 feet, MAN). Nikola James misses. Rebound secured by Lamelo Irving.

[00:01] Team_057 possession (Score: 97-94)
Lamelo Irving drives to the basket... Lamelo Irving loses the ball! Stripped by Collin Gasol! TURNOVER! (live ball)

================================================================================
                              4TH QUARTER COMPLETE                              
================================================================================

4TH QUARTER SCORE: Team_014 22, Team_057 27

BOX SCORE:
================================================================================

Team_014
--------------------------------------------------------------------------------
Player                MIN  PTS  REB  AST  TO      FG   FG%      3P   3P%
--------------------------------------------------------------------------------
Tracy Westbrook        15    7    2    0   0   3/4    75.0     0/0   0.0
Ayo Murray             33    4    2    1   0   2/3    66.7     0/0   0.0
DeMar Adebayo          33    3    1    1   0   1/2    50.0     0/0   0.0
Lamelo Simmons         33    2    0    1   0   1/1   100.0     0/0   0.0
Jalen Booker           15    2    0    1   0   1/3    33.3     0/0   0.0
Bones Quickley         15    2    0    2   0   1/2    50.0     0/0   0.0
Collin Gasol           15    2    2    0   0   1/1   100.0     0/0   0.0
Michael Cunningham     33    0    0    0   0   0/3     0.0     0/0   0.0
Jordan Anunoby         33    0    0    1   0   0/1     0.0     0/0   0.0
Nikola James           15    0    1    0   0   0/0     0.0     0/0   0.0

TEAM: FG: 10/20 (50.0%), 3PT: 3/8 (37.5%), REB: 8 (3 off, 5 def), AST: 7, TO: 1
TEAM FOULS: 5 [Team_057 in BONUS]


Team_057
--------------------------------------------------------------------------------
Player                MIN  PTS  REB  AST  TO      FG   FG%      3P   3P%
--------------------------------------------------------------------------------
Zion Lillard           15    8    4    1   0   4/4   100.0     0/0   0.0
Anfernee Adebayo       33    5    2    0   0   2/2   100.0     0/0   0.0
Lamelo Irving          15    5    2    1   0   2/2   100.0     0/0   0.0
Miles Middleton        33    4    2    0   0   2/3    66.7     0/0   0.0
Klay Rozier            33    2    0    0   0   1/1   100.0     0/0   0.0
Kobe Ming              33    2    0    4   0   1/2    50.0     0/0   0.0
Ben Adebayo            33    1    2    2   0   1/1   100.0     0/0   0.0
Joel Wade              15    0    1    0   0   0/0     0.0     0/0   0.0
Bradley Ginobili       15    0    0    0   0   0/2     0.0     0/0   0.0
Scottie Johnson        15    0    0    0   0   0/1     0.0     0/0   0.0

TEAM: FG: 13/18 (72.2%), 3PT: 4/7 (57.1%), REB: 13 (3 off, 10 def), AST: 8, TO: 3
TEAM FOULS: 5 [Team_014 in BONUS]

================================================================================

================================================================================
                               FULL GAME COMPLETE                               
================================================================================

FINAL SCORE: Team_014 97, Team_057 94

SCORING BY QUARTER:
--------------------------------------------------------------------------------
Team                     Q1     Q2     Q3     Q4    FINAL
--------------------------------------------------------------------------------
Team_014                 22     24     29     22       97
Team_057                 22     20     25     27       94
--------------------------------------------------------------------------------

FULL GAME BOX SCORE:
================================================================================

Team_014
--------------------------------------------------------------------------------
Player                MIN  PTS  REB  AST  TO      FG   FG%      3P   3P%      FT STL BLK
--------------------------------------------------------------------------------
Michael Cunningham     33   12    9    1   0   5/14   35.7   2/10   20.0   6/10    0   1
Jordan Anunoby         33    8    0    4   1   3/6    50.0   0/1     0.0   2/2     0   0
Lamelo Simmons         33   11    0    2   2   5/7    71.4   1/2    50.0   4/6     2   0
DeMar Adebayo          33    9   10    5   1   5/12   41.7   1/4    25.0   2/3     1   2
Ayo Murray             33   20   10    2   2   7/14   50.0   0/0     0.0   1/2     0   0
Jalen Booker           15    4    0    2   0   2/7    28.6   0/3     0.0   0/0     0   0
Bones Quickley         15    7    0    4   0   3/5    60.0   1/3    33.3   0/0     0   0
Tracy Westbrook        15    9    5    0   0   3/7    42.9   1/4    25.0   2/2     0   0
Nikola James           15    2    2    1   0   2/5    40.0   0/0     0.0   0/0     1   0
Collin Gasol           15    8    6    0   0   3/3   100.0   1/1   100.0   0/0     2   0

TEAM: FG: 40/82 (48.8%), 3PT: 7/28 (25.0%), REB: 42 (11 off, 31 def), AST: 21, TO: 6


Team_057
--------------------------------------------------------------------------------
Player                MIN  PTS  REB  AST  TO      FG   FG%      3P   3P%      FT STL BLK
--------------------------------------------------------------------------------
Kobe Ming              33   12    0    5   2   4/10   40.0   0/3     0.0   3/4     0   0
Klay Rozier            33    3    0    2   0   2/5    40.0   0/1     0.0   2/4     0   0
Anfernee Adebayo       33    7    9    2   2   4/7    57.1   1/2    50.0   0/0     0   0
Ben Adebayo            33   16    9    5   6   6/12   50.0   1/2    50.0   6/8     1   0
Miles Middleton        33   19   14    1   1  10/13   76.9   0/0     0.0   4/7     1   0
Scottie Johnson        15    2    0    2   1   2/3    66.7   0/1     0.0   0/0     0   0
Bradley Ginobili       15    4    0    1   2   2/5    40.0   0/1     0.0   0/0     0   0
Joel Wade              15   11    3    1   0   5/8    62.5   3/5    60.0   3/3     0   0
Lamelo Irving          15    7    4    1   2   3/4    75.0   1/1   100.0   2/2     0   0
Zion Lillard           15    8   10    2   0   2/4    50.0   1/2    50.0   2/2     0   0

TEAM: FG: 41/72 (56.9%), 3PT: 7/18 (38.9%), REB: 49 (7 off, 42 def), AST: 22, TO: 16

================================================================================
