================================================================================
                        FULL GAME - Team_033 vs Team_037                        
================================================================================

================================================================================
                       1ST QUARTER - Team_033 vs Team_037                       
================================================================================

[12:00] Team_033 possession (Score: 0-0)
Bradley Simmons attempts a Midrange. Contested by Collin Young (3.9 feet, MAN). Bradley Simmons misses. Rebound secured by Jarrett Tatum.

[11:44] Team_037 possession (Score: 0-0)
Collin Young attempts a Midrange. Contested by Desmond DeRozan (4.8 feet, ZONE). COLLIN YOUNG MAKES IT! Assist: RJ Mitchell
Score: 0-2

[11:29] Team_033 possession (Score: 0-2)
Cade Randle attempts a 3Pt. Contested by Scottie Jackson (4.1 feet, ZONE). Cade Randle misses. Rebound secured by Collin Young.

[11:18] Team_037 possession (Score: 0-2)
RJ Mitchell attempts a 3Pt. Contested by Joel Green (4.5 feet, ZONE). RJ Mitchell misses. Rebound secured by Bradley Simmons.

[11:02] Team_033 possession (Score: 0-2)
Desmond DeRozan attempts a 3Pt. Contested by Scottie Jackson (3.6 feet, MAN). Desmond DeRozan misses. Rebound secured by Collin Young.

[10:47] Team_037 possession (Score: 0-2)
Collin Young attempts a Midrange. Contested by Bradley Simmons (3.1 feet, MAN). COLLIN YOUNG MAKES IT!
Score: 0-4

[10:33] Team_033 possession (Score: 0-4)
Joel Green attempts a 3Pt. Contested by RJ Mitchell (5.0 feet, MAN). Joel Green misses. Rebound secured by Scottie Jackson.

[10:21] Team_037 possession (Score: 0-4)
Jarrett Tatum drives and kicks out. Giannis Middleton attempts a 3Pt. Contested by Joel Green (4.3 feet, ZONE). Giannis Middleton misses. Rebound secured by Desmond DeRozan.

[10:04] Team_033 possession (Score: 0-4)
FOUL! Reach-in foul on Collin Young during the drive. [Team fouls: 1] No free throws, side out. (Collin Young: 1 personal fouls)

[09:51] Team_033 possession (Score: 0-4)
Cade Randle attempts a 3Pt. Contested by Jarrett Tatum (4.5 feet, MAN). Cade Randle misses. Rebound secured by Jarrett Tatum.

[09:39] Team_037 possession (Score: 0-4)
Collin Young throws a bad pass out of bounds! TURNOVER! (dead ball)

[09:24] Team_033 possession (Score: 0-4)
FOUL! Reach-in foul on Collin Young during the drive. [Team fouls: 2] No free throws, side out. (Collin Young: 2 personal fouls)

[09:06] Team_033 possession (Score: 0-4)
Cade Randle attempts a 3Pt. Contested by Giannis Middleton (4.5 feet, ZONE). CADE RANDLE MAKES IT! Assist: Bradley Simmons
Score: 3-4

[08:53] Team_037 possession (Score: 3-4)
Giannis Middleton drives and kicks out. Collin Young attempts a 3Pt. Contested by Joel Green (4.3 feet, ZONE). COLLIN YOUNG MAKES IT! Assist: RJ Mitchell
Score: 3-7

[08:37] Team_033 possession (Score: 3-7)
Chris Anunoby attempts a 3Pt. Contested by Scottie Jackson (3.5 feet, ZONE). Chris Anunoby misses. Offensive rebound by Desmond DeRozan! Desmond DeRozan kicks it out.

[08:22] Team_033 possession (Score: 3-7)
Chris Anunoby drives, Giannis Middleton stays with him. Chris Anunoby attempts a Dunk. Contested by Giannis Middleton (4.0 feet, MAN). CHRIS ANUNOBY MAKES IT! Assist: Desmond DeRozan
Score: 5-7

[08:08] Team_037 possession (Score: 5-7)
RJ Mitchell drives, picks up Bradley Simmons. Help arrives from Chris Anunoby! RJ Mitchell attempts a Dunk. Contested by Chris Anunoby (3.2 feet, ZONE). RJ MITCHELL MAKES IT! Assist: Giannis Middleton
Score: 5-9

[07:50] Team_033 possession (Score: 5-9)
Desmond DeRozan attempts a 3Pt. Contested by Scottie Jackson (3.6 feet, MAN). Desmond DeRozan misses. Offensive rebound by Bradley Simmons! Bradley Simmons puts it back in!
Score: 7-9

[07:32] Team_037 possession (Score: 7-9)
Giannis Middleton attempts a Midrange. Contested by Chris Anunoby (4.2 feet, MAN). Giannis Middleton misses. Rebound secured by Cade Randle.

[07:20] Team_033 possession (Score: 7-9)
FOUL! Shooting foul on Giannis Middleton. Chris Anunoby to the line for 2 free throws. [Team fouls: 3] (Giannis Middleton: 1 personal fouls)   FT 1/2: GOOD   FT 2/2: GOOD Chris Anunoby makes 2/2 from the line.
Score: 9-9

[07:07] Team_037 possession (Score: 9-9)
Giannis Middleton attempts a 3Pt. Contested by Chris Anunoby (4.2 feet, MAN). Giannis Middleton misses. Rebound secured by Bradley Simmons.

[06:50] Team_033 possession (Score: 9-9)
Chris Anunoby attempts a 3Pt. Contested by Giannis Middleton (4.0 feet, MAN). Chris Anunoby misses. Rebound secured by Scottie Jackson.

[06:36] Team_037 possession (Score: 9-9)
Giannis Middleton attempts a 3Pt. Contested by Chris Anunoby (4.2 feet, MAN). Giannis Middleton misses. FOUL! Loose ball foul on Desmond DeRozan during the rebound battle. [Team fouls: 1] No free throws, side out. (Desmond DeRozan: 1 personal fouls)

[06:19] Team_037 possession (Score: 9-9)
Scottie Jackson makes the Layup and draws the foul on Bradley Simmons! And-1! Scottie Jackson to the line for 1. [Team fouls: 2] (Bradley Simmons: 1 personal fouls)   FT 1/1: GOOD Scottie Jackson makes 1/1 from the line.
Score: 9-12

[06:06] Team_033 possession (Score: 9-12)
FOUL! Offensive foul on Cade Randle! Jarrett Tatum drew the charge! [Team fouls: 3] (Cade Randle: 1 personal fouls) TURNOVER! (dead ball)

[05:51] Team_037 possession (Score: 9-12)
Jarrett Tatum attempts a 3Pt. Contested by Joel Green (4.5 feet, ZONE). Jarrett Tatum misses. Rebound secured by Desmond DeRozan.

[05:37] Team_033 possession (Score: 9-12)
Cade Randle attempts a 3Pt. Contested by Scottie Jackson (4.1 feet, ZONE). Cade Randle misses. Rebound secured by Jarrett Tatum.

[05:23] Team_037 possession (Score: 9-12)
Scottie Jackson attempts a Layup. Contested by Desmond DeRozan (5.4 feet, MAN). SCOTTIE JACKSON MAKES IT! Assist: Collin Young
Score: 9-14

[05:08] Team_033 possession (Score: 9-14)
FOUL! Shooting foul on Scottie Jackson. Joel Green to the line for 3 free throws. [Team fouls: 4] (Scottie Jackson: 1 personal fouls)   FT 1/3: GOOD   FT 2/3: MISS   FT 3/3: GOOD Joel Green makes 2/3 from the line.
Score: 11-14

[04:50] Team_037 possession (Score: 11-14)
Giannis Middleton drives, picks up Chris Anunoby. Help arrives from Cade Randle! Giannis Middleton attempts a Dunk. Contested by Cade Randle (4.3 feet, MAN). GIANNIS MIDDLETON MAKES IT! Assist: Jarrett Tatum
Score: 11-16

[04:35] Team_033 possession (Score: 11-16)
Joel Green drives, Scottie Jackson stays with him. Joel Green attempts a Layup. Contested by Scottie Jackson (3.9 feet, ZONE). Joel Green misses. Rebound secured by Jarrett Tatum.

[04:24] Team_037 possession (Score: 11-16)
Giannis Middleton makes the Layup and draws the foul on Bradley Simmons! And-1! Giannis Middleton to the line for 1. [Team fouls: 4] (Bradley Simmons: 2 personal fouls)   FT 1/1: GOOD Giannis Middleton makes 1/1 from the line.
Score: 11-19

[04:08] Team_033 possession (Score: 11-19)
Desmond DeRozan drives and kicks out. Bradley Simmons attempts a 3Pt. Contested by Scottie Jackson (3.6 feet, ZONE). Bradley Simmons misses. Rebound secured by Collin Young.

[03:52] Team_037 possession (Score: 11-19)
Giannis Middleton attempts a 3Pt. Contested by Chris Anunoby (4.4 feet, MAN). Giannis Middleton misses. Rebound secured by Desmond DeRozan.

[03:39] Team_033 possession (Score: 11-19)
Chris Anunoby attempts a 3Pt. Contested by Giannis Middleton (4.0 feet, MAN). Chris Anunoby misses. Rebound secured by Collin Young.

[03:23] Team_037 possession (Score: 11-19)
Jarrett Tatum attempts a 3Pt. Contested by Cade Randle (3.3 feet, MAN). JARRETT TATUM MAKES IT!
Score: 11-22

[03:11] Team_033 possession (Score: 11-22)
Chris Anunoby attempts a Midrange. Contested by Giannis Middleton (4.1 feet, MAN). CHRIS ANUNOBY MAKES IT! Assist: Joel Green
Score: 13-22

[02:58] Team_037 possession (Score: 13-22)
Giannis Middleton attempts a Layup. BLOCKED BY BRADLEY SIMMONS! Ball is loose! Offensive rebound by Scottie Jackson! Scottie Jackson kicks it out.

[02:44] Team_037 possession (Score: 13-22)
Giannis Middleton makes the Layup and draws the foul on Cade Randle! And-1! Giannis Middleton to the line for 1. [BONUS: 5 team fouls] (Cade Randle: 2 personal fouls)   FT 1/1: MISS Giannis Middleton makes 0/1 from the line. Rebound secured by Cade Randle.
Score: 13-24

[02:27] Team_033 possession (Score: 13-24)
FOUL! Reach-in foul on Giannis Middleton during the drive. [IN THE BONUS! 5 team fouls] Chris Anunoby to the line for 2 free throws. (Giannis Middleton: 2 personal fouls)   FT 1/2: GOOD   FT 2/2: GOOD Chris Anunoby makes 2/2 from the line.
Score: 15-24

[02:13] Team_037 possession (Score: 15-24)
FOUL! Offensive foul on Collin Young! Bradley Simmons drew the charge! [Team fouls: 6] (Collin Young: 3 personal fouls) TURNOVER! (dead ball)

[02:00] Team_033 possession (Score: 15-24)
Chris Anunoby makes the Layup and draws the foul on Giannis Middleton! And-1! Chris Anunoby to the line for 1. [BONUS: 7 team fouls] (Giannis Middleton: 3 personal fouls)   FT 1/1: GOOD Chris Anunoby makes 1/1 from the line.
Score: 18-24

[01:44] Team_037 possession (Score: 18-24)
RJ Mitchell attempts a 3Pt. Contested by Joel Green (4.8 feet, MAN). RJ Mitchell misses. Rebound secured by Desmond DeRozan.

[01:34] Team_033 possession (Score: 18-24)
Joel Green attempts a Layup. Contested by RJ Mitchell (5.2 feet, MAN). JOEL GREEN MAKES IT!
Score: 20-24

[01:20] Team_037 possession (Score: 20-24)
Giannis Middleton attempts a 3Pt. Contested by Joel Green (5.0 feet, ZONE). Giannis Middleton misses. Rebound secured by Bradley Simmons.

[01:06] Team_033 possession (Score: 20-24)
Cade Randle attempts a 3Pt. Contested by Scottie Jackson (4.4 feet, ZONE). Cade Randle misses. Rebound secured by Scottie Jackson.

[00:48] Team_037 possession (Score: 20-24)
FOUL! Shooting foul on Bradley Simmons. Collin Young to the line for 2 free throws. [BONUS: 6 team fouls] (Bradley Simmons: 3 personal fouls)   FT 1/2: MISS   FT 2/2: GOOD Collin Young makes 1/2 from the line.
Score: 20-25

[00:35] Team_033 possession (Score: 20-25)
FOUL! Shooting foul on Giannis Middleton. Chris Anunoby to the line for 2 free throws. [BONUS: 8 team fouls] (Giannis Middleton: 4 personal fouls)   FT 1/2: GOOD   FT 2/2: MISS Chris Anunoby makes 1/2 from the line. Rebound secured by Jarrett Tatum.
Score: 21-25

[00:23] Team_037 possession (Score: 21-25)
FOUL! Offensive foul on Collin Young! Bradley Simmons drew the charge! [Team fouls: 9] (Collin Young: 4 personal fouls) TURNOVER! (dead ball)

[00:06] Team_033 possession (Score: 21-25)
Cade Randle attempts a Midrange. Contested by RJ Mitchell (5.6 feet, ZONE). Cade Randle misses. Rebound secured by Collin Young.

================================================================================
                              1ST QUARTER COMPLETE                              
================================================================================

1ST QUARTER SCORE: Team_033 21, Team_037 25

BOX SCORE:
================================================================================

Team_033
--------------------------------------------------------------------------------
Player                MIN  PTS  REB  AST  TO      FG   FG%      3P   3P%
--------------------------------------------------------------------------------
Chris Anunoby          12   11    0    0   0   5/8    62.5     0/0   0.0
Joel Green             12    4    0    1   0   2/4    50.0     0/0   0.0
Cade Randle            12    3    2    0   0   1/6    16.7     0/0   0.0
Bradley Simmons        12    2    4    1   0   1/2    50.0     0/0   0.0
Desmond DeRozan        12    0    5    1   0   0/2     0.0     0/0   0.0

TEAM: FG: 9/22 (40.9%), 3PT: 3/11 (27.3%), REB: 11 (2 off, 9 def), AST: 3, TO: 1
TEAM FOULS: 6 [Team_037 in BONUS]


Team_037
--------------------------------------------------------------------------------
Player                MIN  PTS  REB  AST  TO      FG   FG%      3P   3P%
--------------------------------------------------------------------------------
Collin Young           12    8    6    1   0   4/4   100.0     0/0   0.0
Scottie Jackson        12    5    4    0   0   2/2   100.0     0/0   0.0
Giannis Middleton      12    5    0    1   0   2/7    28.6     0/0   0.0
Jarrett Tatum          12    3    5    1   0   1/3    33.3     0/0   0.0
RJ Mitchell            12    2    0    2   0   1/3    33.3     0/0   0.0

TEAM: FG: 10/19 (52.6%), 3PT: 1/7 (14.3%), REB: 15 (2 off, 13 def), AST: 5, TO: 3
TEAM FOULS: 9 [Team_033 in BONUS]

================================================================================

================================================================================
                       2ND QUARTER - Team_033 vs Team_037                       
================================================================================

[12:00] Team_033 possession (Score: 21-25)
Desmond DeRozan attempts a Midrange. Contested by Scottie Jackson (3.8 feet, MAN). Desmond DeRozan misses. Rebound secured by Scottie Jackson.

[11:42] Team_037 possession (Score: 21-25)
Giannis Middleton attempts a Midrange. Contested by Chris Anunoby (4.6 feet, MAN). GIANNIS MIDDLETON MAKES IT! Assist: RJ Mitchell
Score: 21-27

[11:28] Team_033 possession (Score: 21-27)
Desmond DeRozan attempts a Midrange. Contested by Scottie Jackson (3.9 feet, MAN). Desmond DeRozan misses. Rebound secured by Collin Young.

[11:15] Team_037 possession (Score: 21-27)
Giannis Middleton drives and kicks out. Jarrett Tatum attempts a 3Pt. Contested by Joel Green (4.7 feet, ZONE). Jarrett Tatum misses. Rebound secured by Desmond DeRozan.

[11:04] Team_033 possession (Score: 21-27)
Bradley Simmons attempts a 3Pt. Contested by Scottie Jackson (3.8 feet, ZONE). Bradley Simmons misses. Offensive rebound by Bradley Simmons! Bradley Simmons puts it back in!
Score: 23-27

[10:50] Team_037 possession (Score: 23-27)
RJ Mitchell attempts a 3Pt. Contested by Joel Green (4.9 feet, MAN). RJ MITCHELL MAKES IT! Assist: Scottie Jackson
Score: 23-30

[10:32] Team_033 possession (Score: 23-30)
Bradley Simmons drives to the basket... Bradley Simmons commits a violation (traveling/carry)! TURNOVER! (dead ball)

[10:32] Substitution (Team_033): Joel Green OUT → Ben Anthony IN (stamina_rule2)

[10:32] Substitution (Team_033): Chris Anunoby OUT → Manu Irving IN (stamina_rule2)

[10:32] Substitution (Team_033): Cade Randle OUT → Terry Jokic IN (stamina_rule2)

[10:32] Substitution (Team_033): Desmond DeRozan OUT → Zion Adebayo IN (stamina_rule2)

[10:32] Substitution (Team_033): Bradley Simmons OUT → Tim Griffin IN (stamina_rule2)

[10:32] Substitution (Team_037): RJ Mitchell OUT → Jarrett Randle IN (stamina_rule2)

[10:32] Substitution (Team_037): Giannis Middleton OUT → Collin Trent IN (stamina_rule2)

[10:32] Substitution (Team_037): Jarrett Tatum OUT → Julius Bird IN (stamina_rule2)

[10:32] Substitution (Team_037): Scottie Jackson OUT → Russell Anthony IN (stamina_rule2)

[10:32] Substitution (Team_037): Collin Young OUT → Wendell Herro IN (stamina_rule2)

[10:17] Team_037 possession (Score: 23-30)
Russell Anthony makes the Layup and draws the foul on Manu Irving! And-1! Russell Anthony to the line for 1. [Team fouls: 1] (Manu Irving: 1 personal fouls)   FT 1/1: GOOD Russell Anthony makes 1/1 from the line.
Score: 23-33

[10:04] Team_033 possession (Score: 23-33)
FOUL! Shooting foul on Russell Anthony. Zion Adebayo to the line for 2 free throws. [Team fouls: 1] (Russell Anthony: 1 personal fouls)   FT 1/2: MISS   FT 2/2: GOOD Zion Adebayo makes 1/2 from the line.
Score: 24-33

[09:52] Team_037 possession (Score: 24-33)
Jarrett Randle drives and kicks out. Jarrett Randle attempts a Midrange. Contested by Ben Anthony (4.8 feet, MAN). Jarrett Randle misses. Rebound secured by Zion Adebayo.

[09:34] Team_033 possession (Score: 24-33)
Ben Anthony attempts a Layup. BLOCKED BY JARRETT RANDLE! Ball deflects out of bounds off Ben Anthony.

[09:20] Team_037 possession (Score: 24-33)
Wendell Herro drives and kicks out. Russell Anthony attempts a 3Pt. Contested by Zion Adebayo (4.5 feet, MAN). Russell Anthony misses. Rebound secured by Tim Griffin.

[09:08] Team_033 possession (Score: 24-33)
Zion Adebayo attempts a 3Pt. Contested by Russell Anthony (3.9 feet, MAN). Zion Adebayo misses. Rebound secured by Julius Bird.

[08:53] Team_037 possession (Score: 24-33)
Wendell Herro drives and kicks out. FOUL! Shooting foul on Ben Anthony. Wendell Herro to the line for 3 free throws. [Team fouls: 2] (Ben Anthony: 1 personal fouls)   FT 1/3: MISS   FT 2/3: GOOD   FT 3/3: MISS Wendell Herro makes 1/3 from the line. Rebound secured by Terry Jokic.
Score: 24-34

[08:37] Team_033 possession (Score: 24-34)
Terry Jokic attempts a Midrange. Wide open! Collin Trent is 6.1 feet away. [ZONE] Terry Jokic misses. Rebound secured by Wendell Herro.

[08:21] Team_037 possession (Score: 24-34)
Julius Bird attempts a 3Pt. Contested by Terry Jokic (4.2 feet, MAN). Julius Bird misses. Rebound secured by Zion Adebayo.

[08:02] Team_033 possession (Score: 24-34)
Tim Griffin drives and kicks out. FOUL! Shooting foul on Collin Trent. Terry Jokic to the line for 2 free throws. [Team fouls: 2] (Collin Trent: 1 personal fouls)   FT 1/2: MISS   FT 2/2: GOOD Terry Jokic makes 1/2 from the line.
Score: 25-34

[07:48] Team_037 possession (Score: 25-34)
Wendell Herro attempts a Layup. Contested by Tim Griffin (5.2 feet, MAN). WENDELL HERRO MAKES IT!
Score: 25-36

[07:34] Team_033 possession (Score: 25-36)
Tim Griffin attempts a Midrange. Contested by Russell Anthony (3.9 feet, MAN). Tim Griffin misses. Rebound secured by Julius Bird.

[07:16] Team_037 possession (Score: 25-36)
Russell Anthony makes the Dunk and draws the foul on Tim Griffin! And-1! Russell Anthony to the line for 1. [Team fouls: 3] (Tim Griffin: 1 personal fouls)   FT 1/1: GOOD Russell Anthony makes 1/1 from the line.
Score: 25-39

[06:57] Team_033 possession (Score: 25-39)
Tim Griffin drives to the basket... Tim Griffin throws a bad pass out of bounds! TURNOVER! (dead ball)

[06:42] Team_037 possession (Score: 25-39)
Julius Bird attempts a Midrange. Contested by Terry Jokic (4.2 feet, MAN). JULIUS BIRD MAKES IT! Assist: Wendell Herro
Score: 25-41

[06:28] Team_033 possession (Score: 25-41)
Ben Anthony attempts a 3Pt. Contested by Jarrett Randle (4.3 feet, MAN). Ben Anthony misses. Rebound secured by Russell Anthony.

[06:17] Team_037 possession (Score: 25-41)
Jarrett Randle attempts a 3Pt. Contested by Ben Anthony (4.9 feet, ZONE). Jarrett Randle misses. Rebound secured by Tim Griffin.

[06:01] Team_033 possession (Score: 25-41)
Manu Irving drives, picks up Russell Anthony. Help arrives from Collin Trent! Manu Irving attempts a Layup. Contested by Collin Trent (3.9 feet, ZONE). MANU IRVING MAKES IT! Assist: Terry Jokic
Score: 27-41

[05:42] Team_037 possession (Score: 27-41)
Wendell Herro loses control! Ball rolls out of bounds! TURNOVER! (dead ball)

[05:24] Team_033 possession (Score: 27-41)
Manu Irving drives and kicks out. Tim Griffin attempts a 3Pt. Contested by Russell Anthony (3.8 feet, MAN). TIM GRIFFIN MAKES IT! Assist: Zion Adebayo
Score: 30-41

[05:08] Team_037 possession (Score: 30-41)
Collin Trent drives, Manu Irving stays with him. Collin Trent attempts a Layup. Contested by Manu Irving (5.0 feet, MAN). Collin Trent misses. Rebound secured by Zion Adebayo.

[04:51] Team_033 possession (Score: 30-41)
FOUL! Shooting foul on Jarrett Randle. Ben Anthony to the line for 3 free throws. [Team fouls: 3] (Jarrett Randle: 1 personal fouls)   FT 1/3: GOOD   FT 2/3: MISS   FT 3/3: GOOD Ben Anthony makes 2/3 from the line.
Score: 32-41

[04:38] Team_037 possession (Score: 32-41)
Collin Trent attempts a 3Pt. Contested by Manu Irving (5.0 feet, MAN). Collin Trent misses. Rebound secured by Terry Jokic.

[04:26] Team_033 possession (Score: 32-41)
Manu Irving drives and kicks out. Tim Griffin attempts a Midrange. Contested by Russell Anthony (3.8 feet, MAN). Tim Griffin misses. Offensive rebound by Terry Jokic! Terry Jokic kicks it out.

[04:10] Team_033 possession (Score: 32-41)
Terry Jokic attempts a 3Pt. Contested by Julius Bird (4.9 feet, MAN). TERRY JOKIC MAKES IT! Assist: Manu Irving
Score: 35-41

[03:52] Team_037 possession (Score: 35-41)
FOUL! Shooting foul on Tim Griffin. Russell Anthony to the line for 2 free throws. [Team fouls: 4] (Tim Griffin: 2 personal fouls)   FT 1/2: GOOD   FT 2/2: MISS Russell Anthony makes 1/2 from the line. Rebound secured by Tim Griffin.
Score: 35-42

[03:39] Team_033 possession (Score: 35-42)
Tim Griffin attempts a Layup. BLOCKED BY RUSSELL ANTHONY! Ball is loose! Offensive rebound by Terry Jokic! Terry Jokic kicks it out.

[03:25] Team_033 possession (Score: 35-42)
FOUL! Reach-in foul on Russell Anthony during the drive. [Team fouls: 4] No free throws, side out. (Russell Anthony: 2 personal fouls)

[03:10] Team_033 possession (Score: 35-42)
Terry Jokic attempts a Midrange. Contested by Julius Bird (4.9 feet, MAN). Terry Jokic misses. Offensive rebound by Tim Griffin! Tim Griffin puts it back in!
Score: 37-42

[02:57] Team_037 possession (Score: 37-42)
Jarrett Randle attempts a Midrange. Contested by Terry Jokic (4.0 feet, ZONE). Jarrett Randle misses. Offensive rebound by Russell Anthony! Russell Anthony puts it back in!
Score: 37-44

[02:43] Team_033 possession (Score: 37-44)
Zion Adebayo attempts a 3Pt. Contested by Russell Anthony (4.0 feet, MAN). Zion Adebayo misses. Offensive rebound by Tim Griffin! Tim Griffin puts it back in!
Score: 39-44

[02:30] Team_037 possession (Score: 39-44)
FOUL! Shooting foul on Zion Adebayo. Russell Anthony to the line for 3 free throws. [BONUS: 5 team fouls] (Zion Adebayo: 1 personal fouls)   FT 1/3: MISS   FT 2/3: MISS   FT 3/3: MISS Russell Anthony makes 0/3 from the line. Rebound secured by Zion Adebayo.

[02:18] Team_033 possession (Score: 39-44)
FOUL! Shooting foul on Russell Anthony. Tim Griffin to the line for 2 free throws. [BONUS: 5 team fouls] (Russell Anthony: 3 personal fouls)   FT 1/2: GOOD   FT 2/2: GOOD Tim Griffin makes 2/2 from the line.
Score: 41-44

[02:01] Team_037 possession (Score: 41-44)
FOUL! Shooting foul on Tim Griffin. Julius Bird to the line for 2 free throws. [BONUS: 6 team fouls] (Tim Griffin: 3 personal fouls)   FT 1/2: GOOD   FT 2/2: GOOD Julius Bird makes 2/2 from the line.
Score: 41-46

[01:48] Team_033 possession (Score: 41-46)
Ben Anthony makes the Layup and draws the foul on Russell Anthony! And-1! Ben Anthony to the line for 1. [BONUS: 6 team fouls] (Russell Anthony: 4 personal fouls)   FT 1/1: GOOD Ben Anthony makes 1/1 from the line.
Score: 44-46

[01:32] Team_037 possession (Score: 44-46)
Russell Anthony drives and kicks out. Julius Bird attempts a 3Pt. Contested by Terry Jokic (4.0 feet, MAN). Julius Bird misses. Rebound secured by Tim Griffin.

[01:16] Team_033 possession (Score: 44-46)
FOUL! Shooting foul on Russell Anthony. Zion Adebayo to the line for 2 free throws. [BONUS: 7 team fouls] (Russell Anthony: 5 personal fouls)   FT 1/2: GOOD   FT 2/2: GOOD Zion Adebayo makes 2/2 from the line.
Score: 46-46

[01:02] Team_037 possession (Score: 46-46)
Collin Trent attempts a Layup. Contested by Manu Irving (5.2 feet, MAN). COLLIN TRENT MAKES IT! Assist: Wendell Herro
Score: 46-48

[00:49] Team_033 possession (Score: 46-48)
Manu Irving attempts a 3Pt. Contested by Jarrett Randle (4.1 feet, ZONE). Manu Irving misses. Rebound secured by Julius Bird.

[00:33] Team_037 possession (Score: 46-48)
Wendell Herro attempts a Midrange. Contested by Tim Griffin (5.4 feet, MAN). WENDELL HERRO MAKES IT!
Score: 46-50

[00:19] Team_033 possession (Score: 46-50)
Ben Anthony drives to the basket... Ben Anthony commits a violation (traveling/carry)! TURNOVER! (dead ball)

[00:03] Team_037 possession (Score: 46-50)
Jarrett Randle loses control! Ball rolls out of bounds! TURNOVER! (dead ball)

================================================================================
                              2ND QUARTER COMPLETE                              
================================================================================

2ND QUARTER SCORE: Team_033 25, Team_037 25

BOX SCORE:
================================================================================

Team_033
--------------------------------------------------------------------------------
Player                MIN  PTS  REB  AST  TO      FG   FG%      3P   3P%
--------------------------------------------------------------------------------
Tim Griffin            10    9    6    0   0   4/5    80.0     0/0   0.0
Ben Anthony            10    5    0    0   0   2/4    50.0     0/0   0.0
Terry Jokic            10    4    4    1   0   2/3    66.7     0/0   0.0
Zion Adebayo           10    3    4    1   0   2/3    66.7     0/0   0.0
Bradley Simmons        14    2    1    0   0   1/1   100.0     0/0   0.0
Manu Irving            10    2    0    1   0   1/2    50.0     0/0   0.0
Desmond DeRozan        14    0    1    0   0   0/2     0.0     0/0   0.0

TEAM: FG: 12/20 (60.0%), 3PT: 4/7 (57.1%), REB: 16 (5 off, 11 def), AST: 3, TO: 3
TEAM FOULS: 6 [Team_037 in BONUS]


Team_037
--------------------------------------------------------------------------------
Player                MIN  PTS  REB  AST  TO      FG   FG%      3P   3P%
--------------------------------------------------------------------------------
Russell Anthony        10    8    2    0   0   3/6    50.0     0/0   0.0
Wendell Herro          10    4    1    2   0   2/4    50.0     0/0   0.0
Julius Bird            10    4    3    0   0   2/3    66.7     0/0   0.0
RJ Mitchell            14    3    0    1   0   1/1   100.0     0/0   0.0
Giannis Middleton      14    2    0    0   0   1/2    50.0     0/0   0.0
Collin Trent           10    2    0    0   0   1/3    33.3     0/0   0.0
Scottie Jackson        14    0    1    1   0   0/0     0.0     0/0   0.0
Collin Young           14    0    1    0   0   0/0     0.0     0/0   0.0
Jarrett Randle         10    0    0    0   0   0/2     0.0     0/0   0.0

TEAM: FG: 10/21 (47.6%), 3PT: 1/5 (20.0%), REB: 8 (1 off, 7 def), AST: 4, TO: 2
TEAM FOULS: 7 [Team_033 in BONUS]

================================================================================

================================================================================
                       3RD QUARTER - Team_033 vs Team_037                       
================================================================================

[12:00] Team_033 possession (Score: 46-50)
Chris Anunoby attempts a Layup. Contested by Scottie Jackson (3.5 feet, ZONE). CHRIS ANUNOBY MAKES IT!
Score: 48-50

[11:43] Team_037 possession (Score: 48-50)
Giannis Middleton drives, picks up Bradley Simmons. Help arrives from Chris Anunoby! Giannis Middleton attempts a Dunk. Contested by Chris Anunoby (3.4 feet, ZONE). Giannis Middleton misses. Offensive rebound by Scottie Jackson! Scottie Jackson puts it back in!
Score: 48-52

[11:28] Team_033 possession (Score: 48-52)
Desmond DeRozan drives to the basket... FOUL! Offensive foul on Desmond DeRozan! Scottie Jackson drew the charge! [Team fouls: 1] (Desmond DeRozan: 1 personal fouls) TURNOVER! (dead ball)

[11:12] Team_037 possession (Score: 48-52)
Collin Young drives and kicks out. Scottie Jackson attempts a Midrange. Contested by Desmond DeRozan (4.8 feet, MAN). Scottie Jackson misses. Rebound secured by Bradley Simmons.

[10:54] Team_033 possession (Score: 48-52)
FOUL! Reach-in foul on Collin Young during the drive. [Team fouls: 1] No free throws, side out. (Collin Young: 1 personal fouls)

[10:41] Team_033 possession (Score: 48-52)
Joel Green drives and kicks out. Chris Anunoby attempts a 3Pt. Contested by Giannis Middleton (4.0 feet, MAN). Chris Anunoby misses. Rebound secured by Scottie Jackson.

[10:27] Team_037 possession (Score: 48-52)
Scottie Jackson attempts a Layup. Contested by Desmond DeRozan (5.4 feet, MAN). SCOTTIE JACKSON MAKES IT! Assist: RJ Mitchell
Score: 48-54

[10:09] Team_033 possession (Score: 48-54)
Desmond DeRozan attempts a Midrange. Contested by Scottie Jackson (3.6 feet, ZONE). DESMOND DEROZAN MAKES IT!
Score: 50-54

[09:50] Team_037 possession (Score: 50-54)
Collin Young throws a bad pass! Stolen by Bradley Simmons! TURNOVER! (live ball)

[09:35] Team_033 possession (Score: 50-54)
Chris Anunoby attempts a 3Pt. Contested by Scottie Jackson (3.5 feet, ZONE). Chris Anunoby misses. Rebound secured by Jarrett Tatum.

[09:21] Team_037 possession (Score: 50-54)
Jarrett Tatum throws a bad pass out of bounds! TURNOVER! (dead ball)

[09:08] Team_033 possession (Score: 50-54)
Chris Anunoby drives and kicks out. Cade Randle attempts a 3Pt. Contested by Scottie Jackson (3.6 feet, ZONE). CADE RANDLE MAKES IT! Assist: Bradley Simmons
Score: 53-54

[08:54] Team_037 possession (Score: 53-54)
Jarrett Tatum attempts a Midrange. Contested by Desmond DeRozan (5.0 feet, ZONE). Jarrett Tatum misses. Rebound secured by Desmond DeRozan.

[08:40] Team_033 possession (Score: 53-54)
Desmond DeRozan drives, Scottie Jackson stays with him. Desmond DeRozan attempts a Layup. Contested by Scottie Jackson (3.6 feet, ZONE). DESMOND DEROZAN MAKES IT!
Score: 55-54

[08:24] Team_037 possession (Score: 55-54)
Giannis Middleton attempts a 3Pt. Contested by Chris Anunoby (4.2 feet, ZONE). Giannis Middleton misses. Rebound secured by Cade Randle.

[08:14] Team_033 possession (Score: 55-54)
Cade Randle makes the Dunk and draws the foul on Collin Young! And-1! Cade Randle to the line for 1. [Team fouls: 2] (Collin Young: 2 personal fouls)   FT 1/1: GOOD Cade Randle makes 1/1 from the line.
Score: 58-54

[08:01] Team_037 possession (Score: 58-54)
Giannis Middleton attempts a 3Pt. Contested by Chris Anunoby (4.2 feet, MAN). GIANNIS MIDDLETON MAKES IT! Assist: Scottie Jackson
Score: 58-57

[07:45] Team_033 possession (Score: 58-57)
Joel Green attempts a 3Pt. Contested by Scottie Jackson (3.9 feet, ZONE). JOEL GREEN MAKES IT! Assist: Chris Anunoby
Score: 61-57

[07:33] Team_037 possession (Score: 61-57)
Jarrett Tatum throws a bad pass! Stolen by Cade Randle! TURNOVER! (live ball)

[07:17] Team_033 possession (Score: 61-57)
FOUL! Holding foul on Scottie Jackson. [Team fouls: 3] No free throws, side out. (Scottie Jackson: 1 personal fouls)

[07:05] Team_033 possession (Score: 61-57)
Chris Anunoby drives to the basket... Chris Anunoby loses the ball! Stripped by Scottie Jackson! TURNOVER! (live ball)

[06:52] Team_037 possession (Score: 61-57)
Jarrett Tatum attempts a Midrange. Contested by Cade Randle (3.2 feet, MAN). Jarrett Tatum misses. Rebound secured by Desmond DeRozan.

[06:39] Team_033 possession (Score: 61-57)
Desmond DeRozan attempts a Layup. Contested by Scottie Jackson (3.6 feet, MAN). DESMOND DEROZAN MAKES IT! Assist: Bradley Simmons
Score: 63-57

[06:25] Team_037 possession (Score: 63-57)
Collin Young attempts a Layup. Contested by Bradley Simmons (3.1 feet, ZONE). COLLIN YOUNG MAKES IT!
Score: 63-59

[06:06] Team_033 possession (Score: 63-59)
FOUL! Shooting foul on Scottie Jackson. Joel Green to the line for 2 free throws. [Team fouls: 4] (Scottie Jackson: 2 personal fouls)   FT 1/2: MISS   FT 2/2: GOOD Joel Green makes 1/2 from the line.
Score: 64-59

[05:55] Team_037 possession (Score: 64-59)
Jarrett Tatum attempts a 3Pt. Contested by Cade Randle (3.2 feet, MAN). JARRETT TATUM MAKES IT! Assist: Collin Young
Score: 64-62

[05:41] Team_033 possession (Score: 64-62)
Joel Green attempts a 3Pt. Contested by Scottie Jackson (3.9 feet, ZONE). Joel Green misses. Rebound secured by Jarrett Tatum.

[05:31] Team_037 possession (Score: 64-62)
Jarrett Tatum attempts a 3Pt. Contested by Cade Randle (3.2 feet, MAN). JARRETT TATUM MAKES IT!
Score: 64-65

[05:12] Team_033 possession (Score: 64-65)
Cade Randle attempts a Layup. Contested by Scottie Jackson (4.1 feet, ZONE). Cade Randle misses. Rebound secured by Jarrett Tatum.

[04:56] Team_037 possession (Score: 64-65)
Jarrett Tatum drives, Bradley Simmons stays with him. Jarrett Tatum attempts a Dunk. Contested by Bradley Simmons (3.3 feet, ZONE). JARRETT TATUM MAKES IT! Assist: Scottie Jackson
Score: 64-67

[04:38] Team_033 possession (Score: 64-67)
Joel Green attempts a 3Pt. Contested by RJ Mitchell (5.0 feet, MAN). Joel Green misses. Offensive rebound by Bradley Simmons! Bradley Simmons puts it back in!
Score: 66-67

[04:23] Team_037 possession (Score: 66-67)
Jarrett Tatum attempts a Midrange. Contested by Joel Green (4.5 feet, ZONE). Jarrett Tatum misses. FOUL! Loose ball foul on Desmond DeRozan during the rebound battle. [Team fouls: 2] No free throws, side out. (Desmond DeRozan: 2 personal fouls)

[04:04] Team_037 possession (Score: 66-67)
Scottie Jackson attempts a Midrange. Contested by Chris Anunoby (4.5 feet, ZONE). Scottie Jackson misses. Rebound secured by Cade Randle.

[03:54] Team_033 possession (Score: 66-67)
Cade Randle attempts a Layup. Contested by Jarrett Tatum (4.6 feet, MAN). CADE RANDLE MAKES IT!
Score: 68-67

[03:37] Team_037 possession (Score: 68-67)
Giannis Middleton attempts a 3Pt. Contested by Joel Green (4.8 feet, ZONE). GIANNIS MIDDLETON MAKES IT! Assist: Scottie Jackson
Score: 68-70

[03:23] Team_033 possession (Score: 68-70)
Desmond DeRozan drives to the basket... Desmond DeRozan throws a bad pass! Stolen by Scottie Jackson! TURNOVER! (live ball)

[03:06] Team_037 possession (Score: 68-70)
Giannis Middleton attempts a Layup. Contested by Chris Anunoby (4.4 feet, MAN). GIANNIS MIDDLETON MAKES IT! Assist: Collin Young
Score: 68-72

[02:49] Team_033 possession (Score: 68-72)
Bradley Simmons attempts a Layup. Contested by Collin Young (4.1 feet, MAN). Bradley Simmons misses. Offensive rebound by Bradley Simmons! Bradley Simmons puts it back in!
Score: 70-72

[02:31] Team_037 possession (Score: 70-72)
Scottie Jackson attempts a Layup. Contested by Desmond DeRozan (5.6 feet, MAN). SCOTTIE JACKSON MAKES IT! Assist: Giannis Middleton
Score: 70-74

[02:18] Team_033 possession (Score: 70-74)
FOUL! Reach-in foul on Collin Young during the drive. [IN THE BONUS! 5 team fouls] Bradley Simmons to the line for 2 free throws. (Collin Young: 3 personal fouls)   FT 1/2: GOOD   FT 2/2: MISS Bradley Simmons makes 1/2 from the line. Rebound secured by Scottie Jackson.
Score: 71-74

[02:02] Team_037 possession (Score: 71-74)
RJ Mitchell makes the Midrange and draws the foul on Chris Anunoby! And-1! RJ Mitchell to the line for 1. [Team fouls: 3] (Chris Anunoby: 1 personal fouls)   FT 1/1: GOOD RJ Mitchell makes 1/1 from the line.
Score: 71-77

[01:50] Team_033 possession (Score: 71-77)
Desmond DeRozan attempts a Midrange. Contested by Giannis Middleton (4.2 feet, ZONE). Desmond DeRozan misses. FOUL! Loose ball foul on Scottie Jackson during the rebound battle. [IN THE BONUS! 6 team fouls] Bradley Simmons to the line for 2 free throws. (Scottie Jackson: 3 personal fouls)   FT 1/2: MISS   FT 2/2: GOOD Bradley Simmons makes 1/2 from the line.
Score: 72-77

[01:40] Team_037 possession (Score: 72-77)
Scottie Jackson attempts a 3Pt. Contested by Desmond DeRozan (5.7 feet, MAN). Scottie Jackson misses. Rebound secured by Bradley Simmons.

[01:23] Team_033 possession (Score: 72-77)
FOUL! Reach-in foul on Scottie Jackson during the drive. [IN THE BONUS! 7 team fouls] Bradley Simmons to the line for 2 free throws. (Scottie Jackson: 4 personal fouls)   FT 1/2: GOOD   FT 2/2: MISS Bradley Simmons makes 1/2 from the line. Rebound secured by Collin Young.
Score: 73-77

[01:09] Team_037 possession (Score: 73-77)
Scottie Jackson attempts a Midrange. BLOCKED BY DESMOND DEROZAN! Ball is loose! Rebound secured by Cade Randle.

[00:54] Team_033 possession (Score: 73-77)
Chris Anunoby attempts a Layup. Contested by Scottie Jackson (3.9 feet, ZONE). Chris Anunoby misses. Rebound secured by Scottie Jackson.

[00:43] Team_037 possession (Score: 73-77)
Collin Young drives, Bradley Simmons stays with him. Collin Young attempts a Dunk. Contested by Bradley Simmons (3.6 feet, MAN). COLLIN YOUNG MAKES IT!
Score: 73-79

[00:31] Team_033 possession (Score: 73-79)
Bradley Simmons attempts a Layup. Contested by Collin Young (4.4 feet, MAN). BRADLEY SIMMONS MAKES IT! Assist: Desmond DeRozan
Score: 75-79

[00:15] Team_037 possession (Score: 75-79)
Collin Young drives, Bradley Simmons stays with him. Collin Young attempts a Layup. Contested by Bradley Simmons (3.7 feet, ZONE). Collin Young misses. Rebound secured by Desmond DeRozan.

================================================================================
                              3RD QUARTER COMPLETE                              
================================================================================

3RD QUARTER SCORE: Team_033 29, Team_037 29

BOX SCORE:
================================================================================

Team_033
--------------------------------------------------------------------------------
Player                MIN  PTS  REB  AST  TO      FG   FG%      3P   3P%
--------------------------------------------------------------------------------
Cade Randle            26    8    3    0   0   3/4    75.0     0/0   0.0
Bradley Simmons        26    7    4    2   0   4/6    66.7     0/0   0.0
Desmond DeRozan        26    6    3    1   0   3/3   100.0     0/0   0.0
Joel Green             26    4    0    0   0   2/4    50.0     0/0   0.0
Chris Anunoby          26    2    0    1   0   1/3    33.3     0/0   0.0

TEAM: FG: 13/20 (65.0%), 3PT: 2/4 (50.0%), REB: 10 (2 off, 8 def), AST: 4, TO: 3
TEAM FOULS: 3


Team_037
--------------------------------------------------------------------------------
Player                MIN  PTS  REB  AST  TO      FG   FG%      3P   3P%
--------------------------------------------------------------------------------
Jarrett Tatum          26    8    3    0   0   3/5    60.0     0/0   0.0
Giannis Middleton      26    8    0    1   0   3/4    75.0     0/0   0.0
Scottie Jackson        26    6    4    3   0   3/6    50.0     0/0   0.0
Collin Young           26    4    2    2   0   2/4    50.0     0/0   0.0
RJ Mitchell            26    3    0    1   0   1/1   100.0     0/0   0.0

TEAM: FG: 12/20 (60.0%), 3PT: 4/6 (66.7%), REB: 9 (2 off, 7 def), AST: 7, TO: 3
TEAM FOULS: 7 [Team_033 in BONUS]

================================================================================

================================================================================
                       4TH QUARTER - Team_033 vs Team_037                       
================================================================================

[12:00] Team_033 possession (Score: 75-79)
Desmond DeRozan attempts a Midrange. Contested by Scottie Jackson (3.8 feet, MAN). Desmond DeRozan misses. Rebound secured by Scottie Jackson.

[11:46] Team_037 possession (Score: 75-79)
RJ Mitchell attempts a Midrange. Contested by Joel Green (4.8 feet, MAN). RJ Mitchell misses. Rebound secured by Desmond DeRozan.

[11:36] Team_033 possession (Score: 75-79)
Joel Green drives, picks up RJ Mitchell. Help arrives from Giannis Middleton! Joel Green attempts a Layup. Contested by Giannis Middleton (5.2 feet, MAN). JOEL GREEN MAKES IT!
Score: 77-79

[11:18] Team_037 possession (Score: 77-79)
Jarrett Tatum drives, picks up Cade Randle. Help arrives from Chris Anunoby! Jarrett Tatum attempts a Layup. Contested by Chris Anunoby (3.5 feet, MAN). Jarrett Tatum misses. Rebound secured by Cade Randle.

[11:01] Team_033 possession (Score: 77-79)
Cade Randle attempts a 3Pt. Contested by Jarrett Tatum (4.8 feet, MAN). CADE RANDLE MAKES IT! Assist: Desmond DeRozan
Score: 80-79

[10:50] Team_037 possession (Score: 80-79)
Collin Young drives to the basket... Collin Young throws a bad pass out of bounds! TURNOVER! (dead ball)

[10:50] Substitution (Team_033): Joel Green OUT → Ben Anthony IN (stamina_rule2)

[10:50] Substitution (Team_033): Chris Anunoby OUT → Manu Irving IN (stamina_rule2)

[10:50] Substitution (Team_033): Cade Randle OUT → Terry Jokic IN (stamina_rule2)

[10:50] Substitution (Team_033): Desmond DeRozan OUT → Zion Adebayo IN (stamina_rule2)

[10:50] Substitution (Team_033): Bradley Simmons OUT → Tim Griffin IN (stamina_rule2)

[10:50] Substitution (Team_037): RJ Mitchell OUT → Jarrett Randle IN (stamina_rule2)

[10:50] Substitution (Team_037): Giannis Middleton OUT → Collin Trent IN (stamina_rule2)

[10:50] Substitution (Team_037): Jarrett Tatum OUT → Julius Bird IN (stamina_rule2)

[10:50] Substitution (Team_037): Scottie Jackson OUT → Russell Anthony IN (stamina_rule2)

[10:50] Substitution (Team_037): Collin Young OUT → Wendell Herro IN (stamina_rule2)

[10:32] Team_033 possession (Score: 80-79)
Ben Anthony attempts a 3Pt. Contested by Jarrett Randle (4.3 feet, MAN). BEN ANTHONY MAKES IT! Assist: Manu Irving
Score: 83-79

[10:14] Team_037 possession (Score: 83-79)
Collin Trent drives and kicks out. Wendell Herro attempts a Midrange. Contested by Tim Griffin (4.9 feet, MAN). WENDELL HERRO MAKES IT!
Score: 83-81

[09:54] Team_033 possession (Score: 83-81)
Zion Adebayo makes the Layup and draws the foul on Russell Anthony! And-1! Zion Adebayo to the line for 1. [Team fouls: 1] (Russell Anthony: 1 personal fouls)   FT 1/1: GOOD Zion Adebayo makes 1/1 from the line.
Score: 86-81

[09:44] Team_037 possession (Score: 86-81)
Russell Anthony throws a bad pass out of bounds! TURNOVER! (dead ball)

[09:31] Team_033 possession (Score: 86-81)
Terry Jokic attempts a 3Pt. Contested by Julius Bird (4.9 feet, MAN). Terry Jokic misses. Rebound secured by Russell Anthony.

[09:19] Team_037 possession (Score: 86-81)
Collin Trent attempts a Layup. Contested by Manu Irving (5.0 feet, MAN). COLLIN TRENT MAKES IT! Assist: Wendell Herro
Score: 86-83

[09:09] Team_033 possession (Score: 86-83)
Terry Jokic attempts a 3Pt. Contested by Julius Bird (4.9 feet, MAN). Terry Jokic misses. Offensive rebound by Tim Griffin! Tim Griffin's putback is no good. Rebound secured by Julius Bird.

[08:58] Team_037 possession (Score: 86-83)
Jarrett Randle makes the Midrange and draws the foul on Terry Jokic! And-1! Jarrett Randle to the line for 1. [Team fouls: 1] (Terry Jokic: 1 personal fouls)   FT 1/1: GOOD Jarrett Randle makes 1/1 from the line.
Score: 86-86

[08:45] Team_033 possession (Score: 86-86)
Zion Adebayo drives, Russell Anthony stays with him. Zion Adebayo attempts a Dunk. Contested by Russell Anthony (3.9 feet, ZONE). ZION ADEBAYO MAKES IT!
Score: 88-86

[08:28] Team_037 possession (Score: 88-86)
Julius Bird attempts a Midrange. Contested by Terry Jokic (4.2 feet, ZONE). Julius Bird misses. Rebound secured by Terry Jokic.

[08:11] Team_033 possession (Score: 88-86)
Manu Irving attempts a 3Pt. Contested by Collin Trent (5.8 feet, MAN). Manu Irving misses. Rebound secured by Russell Anthony.

[07:58] Team_037 possession (Score: 88-86)
Jarrett Randle attempts a 3Pt. Contested by Ben Anthony (4.9 feet, ZONE). Jarrett Randle misses. Rebound secured by Tim Griffin.

[07:42] Team_033 possession (Score: 88-86)
Terry Jokic attempts a Midrange. Contested by Russell Anthony (4.2 feet, ZONE). Terry Jokic misses. Rebound secured by Russell Anthony.

[07:30] Team_037 possession (Score: 88-86)
Jarrett Randle loses the ball! Stripped by Ben Anthony! TURNOVER! (live ball)

[07:14] Team_033 possession (Score: 88-86)
Manu Irving attempts a 3Pt. Contested by Collin Trent (5.8 feet, MAN). Manu Irving misses. FOUL! Loose ball foul on Wendell Herro during the rebound battle. [Team fouls: 2] No free throws, side out. (Wendell Herro: 1 personal fouls)

[06:54] Team_033 possession (Score: 88-86)
Terry Jokic makes the Layup and draws the foul on Wendell Herro! And-1! Terry Jokic to the line for 1. [Team fouls: 3] (Wendell Herro: 2 personal fouls)   FT 1/1: MISS Terry Jokic makes 0/1 from the line. Rebound secured by Russell Anthony.
Score: 90-86

[06:39] Team_037 possession (Score: 90-86)
FOUL! Shooting foul on Zion Adebayo. Russell Anthony to the line for 3 free throws. [Team fouls: 2] (Zion Adebayo: 1 personal fouls)   FT 1/3: GOOD   FT 2/3: GOOD   FT 3/3: MISS Russell Anthony makes 2/3 from the line. Rebound secured by Terry Jokic.
Score: 90-88

[06:25] Team_033 possession (Score: 90-88)
Manu Irving attempts a Midrange. Contested by Collin Trent (5.8 feet, ZONE). MANU IRVING MAKES IT!
Score: 92-88

[06:07] Team_037 possession (Score: 92-88)
Wendell Herro attempts a Layup. BLOCKED BY TIM GRIFFIN! Ball deflects out of bounds off Wendell Herro.

[05:51] Team_033 possession (Score: 92-88)
FOUL! Shooting foul on Russell Anthony. Tim Griffin to the line for 2 free throws. [Team fouls: 4] (Russell Anthony: 2 personal fouls)   FT 1/2: GOOD   FT 2/2: GOOD Tim Griffin makes 2/2 from the line.
Score: 94-88

[05:39] Team_037 possession (Score: 94-88)
Russell Anthony attempts a 3Pt. Contested by Zion Adebayo (4.8 feet, MAN). Russell Anthony misses. Offensive rebound by Russell Anthony! Russell Anthony puts it back in!
Score: 94-90

[05:25] Team_033 possession (Score: 94-90)
Terry Jokic attempts a 3Pt. Contested by Julius Bird (4.9 feet, MAN). Terry Jokic misses. Rebound secured by Russell Anthony.

[05:10] Team_037 possession (Score: 94-90)
Wendell Herro attempts a Layup. Contested by Tim Griffin (5.2 feet, MAN). WENDELL HERRO MAKES IT!
Score: 94-92

[04:57] Team_033 possession (Score: 94-92)
Terry Jokic drives, Julius Bird stays with him. Terry Jokic attempts a Dunk. Contested by Julius Bird (4.9 feet, MAN). TERRY JOKIC MAKES IT!
Score: 96-92

[04:41] Team_037 possession (Score: 96-92)
Collin Trent attempts a Layup. BLOCKED BY MANU IRVING! Ball deflects out of bounds off Collin Trent.

[04:31] Team_033 possession (Score: 96-92)
Ben Anthony drives to the basket... Ben Anthony commits a violation (traveling/carry)! TURNOVER! (dead ball)

[04:21] Team_037 possession (Score: 96-92)
FOUL! Shooting foul on Manu Irving. Jarrett Randle to the line for 2 free throws. [Team fouls: 3] (Manu Irving: 1 personal fouls)   FT 1/2: MISS   FT 2/2: GOOD Jarrett Randle makes 1/2 from the line.
Score: 96-93

[04:07] Team_033 possession (Score: 96-93)
Tim Griffin attempts a 3Pt. Contested by Jarrett Randle (4.0 feet, ZONE). Tim Griffin misses. Rebound secured by Julius Bird.

[03:55] Team_037 possession (Score: 96-93)
Julius Bird attempts a 3Pt. Contested by Zion Adebayo (4.9 feet, ZONE). Julius Bird misses. FOUL! Loose ball foul on Terry Jokic during the rebound battle. [Team fouls: 4] No free throws, side out. (Terry Jokic: 2 personal fouls)

[03:42] Team_037 possession (Score: 96-93)
Julius Bird makes the Layup and draws the foul on Terry Jokic! And-1! Julius Bird to the line for 1. [BONUS: 5 team fouls] (Terry Jokic: 3 personal fouls)   FT 1/1: GOOD Julius Bird makes 1/1 from the line.
Score: 96-96

[03:28] Team_033 possession (Score: 96-96)
Ben Anthony makes the Layup and draws the foul on Jarrett Randle! And-1! Ben Anthony to the line for 1. [BONUS: 5 team fouls] (Jarrett Randle: 1 personal fouls)   FT 1/1: GOOD Ben Anthony makes 1/1 from the line.
Score: 99-96

[03:13] Team_037 possession (Score: 99-96)
Jarrett Randle attempts a Midrange. Contested by Ben Anthony (5.0 feet, MAN). Jarrett Randle misses. Rebound secured by Zion Adebayo.

[03:00] Team_033 possession (Score: 99-96)
Tim Griffin drives, Russell Anthony stays with him. Tim Griffin attempts a Dunk. Contested by Russell Anthony (4.0 feet, ZONE). Tim Griffin misses. Rebound secured by Wendell Herro.

[02:49] Team_037 possession (Score: 99-96)
Russell Anthony throws a bad pass out of bounds! TURNOVER! (dead ball)

[02:31] Team_033 possession (Score: 99-96)
Terry Jokic makes the Layup and draws the foul on Julius Bird! And-1! Terry Jokic to the line for 1. [BONUS: 6 team fouls] (Julius Bird: 1 personal fouls)   FT 1/1: GOOD Terry Jokic makes 1/1 from the line.
Score: 102-96

[02:22] Team_037 possession (Score: 102-96)
Russell Anthony attempts a Layup. Contested by Tim Griffin (5.3 feet, ZONE). Russell Anthony misses. Rebound secured by Tim Griffin.

[02:04] Team_033 possession (Score: 102-96)
Ben Anthony attempts a Midrange. Wide open! Wendell Herro is 6.4 feet away. [ZONE] Ben Anthony misses. Rebound secured by Julius Bird.

[01:53] Team_037 possession (Score: 102-96)
Julius Bird attempts a 3Pt. Contested by Terry Jokic (4.4 feet, MAN). Julius Bird misses. Rebound secured by Terry Jokic.

[01:38] Team_033 possession (Score: 102-96)
Terry Jokic attempts a 3Pt. Contested by Julius Bird (5.0 feet, MAN). Terry Jokic misses. Rebound secured by Russell Anthony.

[01:22] Team_037 possession (Score: 102-96)
Julius Bird attempts a Midrange. Contested by Zion Adebayo (5.1 feet, ZONE). Julius Bird misses. Rebound secured by Terry Jokic.

[01:04] Team_033 possession (Score: 102-96)
Terry Jokic attempts a 3Pt. Contested by Julius Bird (5.1 feet, MAN). Terry Jokic misses. Offensive rebound by Terry Jokic! Terry Jokic kicks it out.

[00:50] Team_033 possession (Score: 102-96)
FOUL! Shooting foul on Julius Bird. Terry Jokic to the line for 3 free throws. [BONUS: 7 team fouls] (Julius Bird: 2 personal fouls)   FT 1/3: GOOD   FT 2/3: GOOD   FT 3/3: GOOD Terry Jokic makes 3/3 from the line.
Score: 105-96

[00:35] Team_037 possession (Score: 105-96)
Jarrett Randle attempts a Midrange. Contested by Ben Anthony (5.2 feet, MAN). Jarrett Randle misses. Rebound secured by Terry Jokic.

[00:19] Team_033 possession (Score: 105-96)
Tim Griffin drives, Russell Anthony stays with him. Tim Griffin attempts a Layup. Contested by Russell Anthony (4.2 feet, MAN). TIM GRIFFIN MAKES IT! Assist: Manu Irving
Score: 107-96

[00:04] Team_037 possession (Score: 107-96)
Jarrett Randle attempts a 3Pt. Contested by Ben Anthony (5.3 feet, ZONE). JARRETT RANDLE MAKES IT! Assist: Wendell Herro
Score: 107-99

================================================================================
                              4TH QUARTER COMPLETE                              
================================================================================

4TH QUARTER SCORE: Team_033 32, Team_037 20

BOX SCORE:
================================================================================

Team_033
--------------------------------------------------------------------------------
Player                MIN  PTS  REB  AST  TO      FG   FG%      3P   3P%
--------------------------------------------------------------------------------
Terry Jokic            21    8    6    0   0   3/9    33.3     0/0   0.0
Ben Anthony            21    6    0    0   0   2/3    66.7     0/0   0.0
Zion Adebayo           21    5    1    0   0   2/2   100.0     0/0   0.0
Tim Griffin            21    4    3    0   0   2/4    50.0     0/0   0.0
Cade Randle            27    3    1    0   0   1/1   100.0     0/0   0.0
Joel Green             27    2    0    0   0   1/1   100.0     0/0   0.0
Manu Irving            21    2    0    2   0   1/2    50.0     0/0   0.0
Desmond DeRozan        27    0    1    1   0   0/1     0.0     0/0   0.0

TEAM: FG: 12/23 (52.2%), 3PT: 3/9 (33.3%), REB: 13 (3 off, 10 def), AST: 3, TO: 1
TEAM FOULS: 5 [Team_037 in BONUS]


Team_037
--------------------------------------------------------------------------------
Player                MIN  PTS  REB  AST  TO      FG   FG%      3P   3P%
--------------------------------------------------------------------------------
Jarrett Randle         21    7    0    0   0   3/6    50.0     0/0   0.0
Wendell Herro          21    4    1    2   0   2/3    66.7     0/0   0.0
Julius Bird            21    3    4    0   0   1/4    25.0     0/0   0.0
Russell Anthony        21    2    7    0   0   1/3    33.3     0/0   0.0
Collin Trent           21    2    0    0   0   1/2    50.0     0/0   0.0
Scottie Jackson        27    0    1    0   0   0/0     0.0     0/0   0.0
RJ Mitchell            27    0    0    0   0   0/1     0.0     0/0   0.0
Jarrett Tatum          27    0    0    0   0   0/1     0.0     0/0   0.0

TEAM: FG: 8/20 (40.0%), 3PT: 2/5 (40.0%), REB: 12 (2 off, 10 def), AST: 2, TO: 4
TEAM FOULS: 7 [Team_033 in BONUS]

================================================================================

================================================================================
                               FULL GAME COMPLETE                               
================================================================================

FINAL SCORE: Team_033 107, Team_037 99

SCORING BY QUARTER:
--------------------------------------------------------------------------------
Team                     Q1     Q2     Q3     Q4    FINAL
--------------------------------------------------------------------------------
Team_033                 21     25     29     32      107
Team_037                 25     25     29     20       99
--------------------------------------------------------------------------------

FULL GAME BOX SCORE:
================================================================================

Team_033
--------------------------------------------------------------------------------
Player                MIN  PTS  REB  AST  TO      FG   FG%      3P   3P%      FT STL BLK
--------------------------------------------------------------------------------
Joel Green             27   10    0    1   0   6/10   60.0   3/5    60.0   3/5     0   0
Chris Anunoby          27   13    0    1   0   7/12   58.3   0/3     0.0   6/7     0   0
Cade Randle            27   14    6    0   2   4/10   40.0   2/6    33.3   1/1     1   0
Desmond DeRozan        27    6   10    3   2   5/10   50.0   1/2    50.0   0/0     0   1
Bradley Simmons        27   11    9    3   1   3/6    50.0   1/1   100.0   3/6     1   1
Ben Anthony            21   11    0    0   2   4/7    57.1   2/3    66.7   4/5     1   0
Manu Irving            21    4    0    3   0   3/5    60.0   0/2     0.0   0/0     0   1
Terry Jokic            21   12   10    1   0   5/12   41.7   2/6    33.3   5/7     0   0
Zion Adebayo           21    8    5    1   0   5/6    83.3   1/2    50.0   4/5     0   0
Tim Griffin            21   13    9    0   1   4/7    57.1   0/1     0.0   4/4     0   1

TEAM: FG: 46/85 (54.1%), 3PT: 12/31 (38.7%), REB: 50 (12 off, 38 def), AST: 13, TO: 8


Team_037
--------------------------------------------------------------------------------
Player                MIN  PTS  REB  AST  TO      FG   FG%      3P   3P%      FT STL BLK
--------------------------------------------------------------------------------
RJ Mitchell            27    8    0    4   0   3/6    50.0   1/3    33.3   1/1     0   0
Giannis Middleton      27   15    0    2   0   8/15   53.3   2/6    33.3   1/2     0   0
Jarrett Tatum          27   11    8    1   2   4/9    44.4   3/4    75.0   0/0     0   0
Scottie Jackson        27   11   10    4   0   4/7    57.1   0/1     0.0   1/1     2   0
Collin Young           27   12    9    3   5   5/7    71.4   0/0     0.0   1/2     0   0
Jarrett Randle         21    7    0    0   2   4/9    44.4   1/3    33.3   2/3     0   1
Collin Trent           21    4    0    0   0   3/6    50.0   0/1     0.0   0/0     0   0
Julius Bird            21    7    7    0   0   3/7    42.9   0/2     0.0   3/3     0   0
Russell Anthony        21   10    9    0   2   3/8    37.5   1/3    33.3   5/10    0   1
Wendell Herro          21    8    2    4   1   3/6    50.0   0/0     0.0   1/3     0   0

TEAM: FG: 40/80 (50.0%), 3PT: 8/23 (34.8%), REB: 44 (7 off, 37 def), AST: 18, TO: 12

================================================================================
