================================================================================
                        FULL GAME - Team_046 vs Team_086                        
================================================================================

================================================================================
                       1ST QUARTER - Team_046 vs Team_086                       
================================================================================

[12:00] Team_046 possession (Score: 0-0)
Victor Nowitzki attempts a Layup. BLOCKED BY ANFERNEE HARRIS! Ball is loose! Rebound secured by Rudy Rose.

[11:48] Team_086 possession (Score: 0-0)
Anfernee Harris attempts a 3Pt. Wide open! Victor Nowitzki is 6.1 feet away. [MAN] Anfernee Harris misses. Rebound secured by Kevin Allen.

[11:33] Team_046 possession (Score: 0-0)
D'Angelo O'Neal attempts a 3Pt. Contested by Lauri Johnson (4.6 feet, MAN). D'Angelo O'Neal misses. Rebound secured by Miles Gobert.

[11:24] Team_086 possession (Score: 0-0)
Miles Gobert makes the Layup and draws the foul on Lauri Carter! And-1! Miles Gobert to the line for 1. [Team fouls: 1] (Lauri Carter: 1 personal fouls)   FT 1/1: GOOD Miles Gobert makes 1/1 from the line.
Score: 0-3

[11:10] Team_046 possession (Score: 0-3)
Cade Wall loses control! Ball rolls out of bounds! TURNOVER! (dead ball)

[10:54] Team_086 possession (Score: 0-3)
Anfernee Harris attempts a Midrange. Wide open! Victor Nowitzki is 6.1 feet away. [MAN] ANFERNEE HARRIS MAKES IT!
Score: 0-5

[10:36] Team_046 possession (Score: 0-5)
Victor Nowitzki attempts a Midrange. Contested by Anfernee Harris (4.4 feet, MAN). VICTOR NOWITZKI MAKES IT!
Score: 2-5

[10:19] Team_086 possession (Score: 2-5)
Anfernee Harris loses control! Ball rolls out of bounds! TURNOVER! (dead ball)

[10:07] Team_046 possession (Score: 2-5)
Cade Wall attempts a 3Pt. Contested by Lauri Johnson (5.0 feet, ZONE). CADE WALL MAKES IT! Assist: Lauri Carter
Score: 5-5

[09:52] Team_086 possession (Score: 5-5)
Miles Gobert attempts a 3Pt. Contested by Lauri Carter (3.5 feet, MAN). Miles Gobert misses. Rebound secured by Kevin Allen.

[09:32] Team_046 possession (Score: 5-5)
Victor Nowitzki loses control! Ball rolls out of bounds! TURNOVER! (dead ball)

[09:17] Team_086 possession (Score: 5-5)
Anfernee Harris attempts a Midrange. Wide open! Victor Nowitzki is 6.1 feet away. [MAN] Anfernee Harris misses. FOUL! Loose ball foul on Cade Wall during the rebound battle. [Team fouls: 2] No free throws, side out. (Cade Wall: 1 personal fouls)

[09:06] Team_086 possession (Score: 5-5)
Miles Gobert drives to the basket... Miles Gobert loses the ball! Stripped by Kevin Allen! TURNOVER! (live ball)

[08:52] Team_046 possession (Score: 5-5)
Victor Nowitzki attempts a 3Pt. Contested by Lauri Johnson (4.5 feet, ZONE). VICTOR NOWITZKI MAKES IT! Assist: D'Angelo O'Neal
Score: 8-5

[08:34] Team_086 possession (Score: 8-5)
Rudy Rose attempts a Midrange. Contested by Lauri Carter (3.5 feet, ZONE). RUDY ROSE MAKES IT!
Score: 8-7

[08:18] Team_046 possession (Score: 8-7)
Cade Wall makes the Layup and draws the foul on Bones Ginobili! And-1! Cade Wall to the line for 1. [Team fouls: 1] (Bones Ginobili: 1 personal fouls)   FT 1/1: GOOD Cade Wall makes 1/1 from the line.
Score: 11-7

[08:08] Team_086 possession (Score: 11-7)
Bones Ginobili makes the Layup and draws the foul on Cade Wall! And-1! Bones Ginobili to the line for 1. [Team fouls: 3] (Cade Wall: 2 personal fouls)   FT 1/1: MISS Bones Ginobili makes 0/1 from the line. Rebound secured by Lauri Carter.
Score: 11-9

[07:56] Team_046 possession (Score: 11-9)
Victor Nowitzki attempts a 3Pt. Contested by Anfernee Harris (4.4 feet, MAN). Victor Nowitzki misses. Rebound secured by Rudy Rose.

[07:43] Team_086 possession (Score: 11-9)
Lauri Johnson attempts a Midrange. Contested by D'Angelo O'Neal (4.3 feet, MAN). Lauri Johnson misses. Offensive rebound by Miles Gobert! Miles Gobert kicks it out.

[07:25] Team_086 possession (Score: 11-9)
Bones Ginobili attempts a 3Pt. Contested by Lauri Carter (3.7 feet, ZONE). Bones Ginobili misses. Offensive rebound by Miles Gobert! Miles Gobert kicks it out.

[07:10] Team_086 possession (Score: 11-9)
Anfernee Harris attempts a 3Pt. Contested by Lauri Carter (3.8 feet, ZONE). Anfernee Harris misses. Rebound secured by Cade Wall.

[07:00] Team_046 possession (Score: 11-9)
Lauri Carter attempts a 3Pt. Contested by Lauri Johnson (4.6 feet, ZONE). Lauri Carter misses. Rebound secured by Miles Gobert.

[06:46] Team_086 possession (Score: 11-9)
Rudy Rose drives to the basket... Rudy Rose loses the ball! Stripped by Kevin Allen! TURNOVER! (live ball)

[06:31] Team_046 possession (Score: 11-9)
Kevin Allen drives, Rudy Rose stays with him. Kevin Allen attempts a Dunk. Contested by Rudy Rose (4.0 feet, ZONE). Kevin Allen misses. Rebound secured by Miles Gobert.

[06:20] Team_086 possession (Score: 11-9)
FOUL! Reach-in foul on Kevin Allen during the drive. [Team fouls: 4] No free throws, side out. (Kevin Allen: 1 personal fouls)

[06:02] Team_086 possession (Score: 11-9)
Anfernee Harris attempts a Midrange. Contested by Kevin Allen (5.2 feet, ZONE). Anfernee Harris misses. Rebound secured by Cade Wall.

[05:52] Team_046 possession (Score: 11-9)
FOUL! Holding foul on Rudy Rose. [Team fouls: 2] No free throws, side out. (Rudy Rose: 1 personal fouls)

[05:41] Team_046 possession (Score: 11-9)
Kevin Allen makes the Layup and draws the foul on Rudy Rose! And-1! Kevin Allen to the line for 1. [Team fouls: 3] (Rudy Rose: 2 personal fouls)   FT 1/1: GOOD Kevin Allen makes 1/1 from the line.
Score: 14-9

[05:30] Team_086 possession (Score: 14-9)
Lauri Johnson attempts a 3Pt. Contested by Lauri Carter (3.5 feet, ZONE). Lauri Johnson misses. Rebound secured by Kevin Allen.

[05:15] Team_046 possession (Score: 14-9)
D'Angelo O'Neal drives, picks up Lauri Johnson. Help arrives from Miles Gobert! D'Angelo O'Neal attempts a Dunk. Contested by Miles Gobert (4.6 feet, MAN). D'ANGELO O'NEAL MAKES IT! Assist: Cade Wall
Score: 16-9

[04:58] Team_086 possession (Score: 16-9)
Bones Ginobili drives, Kevin Allen stays with him. Bones Ginobili attempts a Dunk. Contested by Kevin Allen (5.1 feet, ZONE). Bones Ginobili misses. Offensive rebound by Miles Gobert! Miles Gobert kicks it out.

[04:46] Team_086 possession (Score: 16-9)
Rudy Rose attempts a Midrange. Contested by Kevin Allen (5.0 feet, MAN). Rudy Rose misses. Offensive rebound by Rudy Rose! Rudy Rose's putback is no good. Rebound secured by Kevin Allen.

[04:32] Team_046 possession (Score: 16-9)
FOUL! Reach-in foul on Rudy Rose during the drive. [Team fouls: 4] No free throws, side out. (Rudy Rose: 3 personal fouls)

[04:16] Team_046 possession (Score: 16-9)
Victor Nowitzki attempts a 3Pt. Contested by Anfernee Harris (4.5 feet, MAN). Victor Nowitzki misses. Rebound secured by Bones Ginobili.

[04:03] Team_086 possession (Score: 16-9)
Bones Ginobili attempts a Layup. Contested by Kevin Allen (5.2 feet, ZONE). BONES GINOBILI MAKES IT! Assist: Anfernee Harris
Score: 16-11

[03:48] Team_046 possession (Score: 16-11)
FOUL! Holding foul on Lauri Johnson. [IN THE BONUS! 5 team fouls] D'Angelo O'Neal to the line for 2 free throws. (Lauri Johnson: 1 personal fouls)   FT 1/2: GOOD   FT 2/2: GOOD D'Angelo O'Neal makes 2/2 from the line.
Score: 18-11

[03:32] Team_086 possession (Score: 18-11)
Miles Gobert makes the Layup and draws the foul on Lauri Carter! And-1! Miles Gobert to the line for 1. [BONUS: 5 team fouls] (Lauri Carter: 2 personal fouls)   FT 1/1: MISS Miles Gobert makes 0/1 from the line. Offensive rebound by Miles Gobert! Miles Gobert kicks it out.
Score: 18-13

[03:19] Team_086 possession (Score: 18-13)
Rudy Rose drives, Kevin Allen stays with him. Rudy Rose attempts a Dunk. Contested by Kevin Allen (5.2 feet, MAN). Rudy Rose misses. Rebound secured by Lauri Carter.

[03:02] Team_046 possession (Score: 18-13)
Kevin Allen drives, Rudy Rose stays with him. Kevin Allen attempts a Dunk. Contested by Rudy Rose (4.2 feet, MAN). Kevin Allen misses. Offensive rebound by Kevin Allen! Kevin Allen kicks it out.

[02:46] Team_046 possession (Score: 18-13)
Lauri Carter attempts a 3Pt. Contested by Lauri Johnson (4.8 feet, ZONE). Lauri Carter misses. Rebound secured by Rudy Rose.

[02:30] Team_086 possession (Score: 18-13)
Lauri Johnson drives and kicks out. Rudy Rose attempts a Midrange. Contested by Kevin Allen (5.0 feet, MAN). Rudy Rose misses. Rebound secured by Cade Wall.

[02:12] Team_046 possession (Score: 18-13)
Victor Nowitzki attempts a Layup. Contested by Rudy Rose (4.1 feet, ZONE). VICTOR NOWITZKI MAKES IT! Assist: Lauri Carter
Score: 20-13

[01:53] Team_086 possession (Score: 20-13)
FOUL! Holding foul on Victor Nowitzki. [IN THE BONUS! 6 team fouls] Anfernee Harris to the line for 2 free throws. (Victor Nowitzki: 1 personal fouls)   FT 1/2: GOOD   FT 2/2: GOOD Anfernee Harris makes 2/2 from the line.
Score: 20-15

[01:36] Team_046 possession (Score: 20-15)
Victor Nowitzki loses control! Ball rolls out of bounds! TURNOVER! (dead ball)

[01:36] Substitution (Team_046): D'Angelo O'Neal OUT → Collin Butler IN (stamina_rule2)

[01:36] Substitution (Team_046): Victor Nowitzki OUT → Manu Dosunmu IN (stamina_rule2)

[01:36] Substitution (Team_046): Lauri Carter OUT → Josh Barrett IN (stamina_rule2)

[01:36] Substitution (Team_046): Cade Wall OUT → Chris LaVine IN (stamina_rule2)

[01:36] Substitution (Team_046): Kevin Allen OUT → Paul DeRozan IN (stamina_rule2)

[01:36] Substitution (Team_086): Lauri Johnson OUT → Anfernee Green IN (stamina_rule2)

[01:36] Substitution (Team_086): Anfernee Harris OUT → Anthony James IN (stamina_rule2)

[01:36] Substitution (Team_086): Miles Gobert OUT → Franz McGrady IN (stamina_rule2)

[01:36] Substitution (Team_086): Bones Ginobili OUT → Kyle McCollum IN (stamina_rule2)

[01:36] Substitution (Team_086): Rudy Rose OUT → Lamelo Towns IN (stamina_rule2)

[01:20] Team_086 possession (Score: 20-15)
Kyle McCollum attempts a 3Pt. Contested by Chris LaVine (3.9 feet, MAN). Kyle McCollum misses. Offensive rebound by Lamelo Towns! Lamelo Towns kicks it out.

[01:10] Team_086 possession (Score: 20-15)
Anfernee Green loses control! Ball rolls out of bounds! TURNOVER! (dead ball)

[00:55] Team_046 possession (Score: 20-15)
Collin Butler attempts a Layup. Contested by Anfernee Green (4.4 feet, MAN). COLLIN BUTLER MAKES IT! Assist: Manu Dosunmu
Score: 22-15

[00:39] Team_086 possession (Score: 22-15)
Lamelo Towns drives, Chris LaVine stays with him. Lamelo Towns attempts a Layup. Contested by Chris LaVine (3.7 feet, ZONE). LAMELO TOWNS MAKES IT! Assist: Franz McGrady
Score: 22-17

[00:27] Team_046 possession (Score: 22-17)
Collin Butler drives, picks up Anfernee Green. Help arrives from Anthony James! Collin Butler attempts a Dunk. Contested by Anthony James (4.4 feet, MAN). COLLIN BUTLER MAKES IT!
Score: 24-17

[00:15] Team_086 possession (Score: 24-17)
Anfernee Green attempts a Midrange. Contested by Collin Butler (4.1 feet, MAN). ANFERNEE GREEN MAKES IT! Assist: Franz McGrady
Score: 24-19

[00:06] Team_046 possession (Score: 24-19)
Paul DeRozan attempts a 3Pt. Contested by Lamelo Towns (5.3 feet, MAN). Paul DeRozan misses. Rebound secured by Anfernee Green.

================================================================================
                              1ST QUARTER COMPLETE                              
================================================================================

1ST QUARTER SCORE: Team_046 24, Team_086 19

BOX SCORE:
================================================================================

Team_046
--------------------------------------------------------------------------------
Player                MIN  PTS  REB  AST  TO      FG   FG%      3P   3P%
--------------------------------------------------------------------------------
Victor Nowitzki        11    7    0    0   0   3/6    50.0     0/0   0.0
Cade Wall              11    6    3    1   0   2/2   100.0     0/0   0.0
D'Angelo O'Neal        11    4    0    1   0   2/3    66.7     0/0   0.0
Collin Butler           1    4    0    0   0   2/2   100.0     0/0   0.0
Kevin Allen            11    3    5    0   0   1/2    50.0     0/0   0.0
Lauri Carter           11    0    2    2   0   0/2     0.0     0/0   0.0
Manu Dosunmu            1    0    0    1   0   0/0     0.0     0/0   0.0
Paul DeRozan            1    0    0    0   0   0/1     0.0     0/0   0.0

TEAM: FG: 10/18 (55.6%), 3PT: 2/8 (25.0%), REB: 9 (1 off, 8 def), AST: 5, TO: 3
TEAM FOULS: 6 [Team_086 in BONUS]


Team_086
--------------------------------------------------------------------------------
Player                MIN  PTS  REB  AST  TO      FG   FG%      3P   3P%
--------------------------------------------------------------------------------
Anfernee Harris        11    4    0    1   0   2/5    40.0     0/0   0.0
Miles Gobert           11    3    7    0   0   1/2    50.0     0/0   0.0
Rudy Rose              11    2    4    0   0   1/3    33.3     0/0   0.0
Bones Ginobili         11    2    1    0   0   1/2    50.0     0/0   0.0
Lamelo Towns            1    2    1    0   0   1/1   100.0     0/0   0.0
Anfernee Green          1    2    1    0   0   1/1   100.0     0/0   0.0
Lauri Johnson          11    0    0    0   0   0/2     0.0     0/0   0.0
Franz McGrady           1    0    0    2   0   0/0     0.0     0/0   0.0

TEAM: FG: 7/16 (43.8%), 3PT: 0/4 (0.0%), REB: 15 (7 off, 8 def), AST: 3, TO: 4
TEAM FOULS: 5 [Team_046 in BONUS]

================================================================================

================================================================================
                       2ND QUARTER - Team_046 vs Team_086                       
================================================================================

[12:00] Team_046 possession (Score: 24-19)
D'Angelo O'Neal attempts a Midrange. Contested by Bones Ginobili (5.1 feet, ZONE). D'ANGELO O'NEAL MAKES IT!
Score: 26-19

[11:50] Team_086 possession (Score: 26-19)
FOUL! Offensive foul on Miles Gobert! Lauri Carter drew the charge! [Team fouls: 1] (Miles Gobert: 1 personal fouls) TURNOVER! (dead ball)

[11:35] Team_046 possession (Score: 26-19)
Cade Wall attempts a 3Pt. Contested by Bones Ginobili (5.5 feet, MAN). Cade Wall misses. FOUL! Loose ball foul on Bones Ginobili during the rebound battle. [Team fouls: 2] No free throws, side out. (Bones Ginobili: 1 personal fouls)

[11:20] Team_046 possession (Score: 26-19)
Lauri Carter attempts a 3Pt. Contested by Miles Gobert (3.8 feet, MAN). Lauri Carter misses. Rebound secured by Rudy Rose.

[11:02] Team_086 possession (Score: 26-19)
Anfernee Harris loses control! Ball rolls out of bounds! TURNOVER! (dead ball)

[11:02] Substitution (Team_046): Kevin Allen OUT → Paul DeRozan IN (stamina_rule2)

[10:47] Team_046 possession (Score: 26-19)
FOUL! Reach-in foul on Rudy Rose during the drive. [Team fouls: 3] No free throws, side out. (Rudy Rose: 1 personal fouls)

[10:35] Team_046 possession (Score: 26-19)
Paul DeRozan makes the Dunk and draws the foul on Anfernee Harris! And-1! Paul DeRozan to the line for 1. [Team fouls: 4] (Anfernee Harris: 1 personal fouls)   FT 1/1: GOOD Paul DeRozan makes 1/1 from the line.
Score: 29-19

[10:16] Team_086 possession (Score: 29-19)
Miles Gobert attempts a 3Pt. Contested by Lauri Carter (3.7 feet, ZONE). Miles Gobert misses. Rebound secured by Lauri Carter.

[10:00] Team_046 possession (Score: 29-19)
D'Angelo O'Neal attempts a 3Pt. Contested by Lauri Johnson (4.8 feet, ZONE). D'Angelo O'Neal misses. Rebound secured by Bones Ginobili.

[09:47] Team_086 possession (Score: 29-19)
FOUL! Holding foul on Lauri Carter. [Team fouls: 1] No free throws, side out. (Lauri Carter: 1 personal fouls)

[09:29] Team_086 possession (Score: 29-19)
Miles Gobert attempts a 3Pt. Contested by Lauri Carter (3.8 feet, MAN). Miles Gobert misses. Rebound secured by Lauri Carter.

[09:15] Team_046 possession (Score: 29-19)
Paul DeRozan attempts a 3Pt. Contested by Rudy Rose (4.0 feet, MAN). Paul DeRozan misses. Rebound secured by Bones Ginobili.

[08:56] Team_086 possession (Score: 29-19)
Rudy Rose attempts a Layup. Contested by Paul DeRozan (5.2 feet, ZONE). RUDY ROSE MAKES IT!
Score: 29-21

[08:39] Team_046 possession (Score: 29-21)
Paul DeRozan attempts a Layup. Contested by Rudy Rose (4.1 feet, MAN). PAUL DEROZAN MAKES IT! Assist: Victor Nowitzki
Score: 31-21

[08:30] Team_086 possession (Score: 31-21)
Miles Gobert drives and kicks out. Rudy Rose attempts a 3Pt. Contested by D'Angelo O'Neal (4.6 feet, ZONE). Rudy Rose misses. Rebound secured by Lauri Carter.

[08:17] Team_046 possession (Score: 31-21)
Cade Wall attempts a Layup. Contested by Rudy Rose (4.7 feet, ZONE). Cade Wall misses. Rebound secured by Miles Gobert.

[08:01] Team_086 possession (Score: 31-21)
Bones Ginobili commits a violation (traveling/carry)! TURNOVER! (dead ball)

[08:01] Substitution (Team_046): D'Angelo O'Neal OUT → Collin Butler IN (stamina_rule2)

[08:01] Substitution (Team_046): Victor Nowitzki OUT → Manu Dosunmu IN (stamina_rule2)

[08:01] Substitution (Team_046): Lauri Carter OUT → Josh Barrett IN (stamina_rule2)

[08:01] Substitution (Team_046): Cade Wall OUT → Chris LaVine IN (stamina_rule2)

[08:01] Substitution (Team_086): Lauri Johnson OUT → Anfernee Green IN (stamina_rule2)

[08:01] Substitution (Team_086): Anfernee Harris OUT → Anthony James IN (stamina_rule2)

[08:01] Substitution (Team_086): Miles Gobert OUT → Franz McGrady IN (stamina_rule2)

[08:01] Substitution (Team_086): Bones Ginobili OUT → Kyle McCollum IN (stamina_rule2)

[08:01] Substitution (Team_086): Rudy Rose OUT → Lamelo Towns IN (stamina_rule2)

[07:46] Team_046 possession (Score: 31-21)
Chris LaVine attempts a Layup. Contested by Lamelo Towns (5.8 feet, ZONE). Chris LaVine misses. Rebound secured by Kyle McCollum.

[07:32] Team_086 possession (Score: 31-21)
FOUL! Shooting foul on Chris LaVine. Lamelo Towns to the line for 2 free throws. [Team fouls: 2] (Chris LaVine: 1 personal fouls)   FT 1/2: MISS   FT 2/2: GOOD Lamelo Towns makes 1/2 from the line.
Score: 31-22

[07:17] Team_046 possession (Score: 31-22)
Chris LaVine attempts a Layup. Contested by Lamelo Towns (5.8 feet, ZONE). CHRIS LAVINE MAKES IT! Assist: Josh Barrett
Score: 33-22

[07:05] Team_086 possession (Score: 33-22)
Franz McGrady attempts a 3Pt. Contested by Josh Barrett (5.0 feet, ZONE). Franz McGrady misses. Rebound secured by Paul DeRozan.

[06:51] Team_046 possession (Score: 33-22)
Paul DeRozan loses control! Ball rolls out of bounds! TURNOVER! (dead ball)

[06:37] Team_086 possession (Score: 33-22)
Anthony James attempts a 3Pt. Contested by Collin Butler (4.5 feet, ZONE). Anthony James misses. Offensive rebound by Anfernee Green! Anfernee Green kicks it out.

[06:25] Team_086 possession (Score: 33-22)
Kyle McCollum attempts a Layup. Contested by Chris LaVine (3.9 feet, MAN). KYLE MCCOLLUM MAKES IT! Assist: Lamelo Towns
Score: 33-24

[06:12] Team_046 possession (Score: 33-24)
Josh Barrett drives to the basket... Josh Barrett commits a violation (traveling/carry)! TURNOVER! (dead ball)

[06:00] Team_086 possession (Score: 33-24)
Anthony James drives, Chris LaVine stays with him. Anthony James attempts a Layup. Contested by Chris LaVine (4.6 feet, ZONE). Anthony James misses. Rebound secured by Manu Dosunmu.

[05:50] Team_046 possession (Score: 33-24)
Paul DeRozan drives, Lamelo Towns stays with him. Paul DeRozan attempts a Dunk. Contested by Lamelo Towns (5.3 feet, ZONE). PAUL DEROZAN MAKES IT!
Score: 35-24

[05:36] Team_086 possession (Score: 35-24)
Anthony James attempts a 3Pt. Contested by Manu Dosunmu (5.4 feet, MAN). Anthony James misses. Rebound secured by Paul DeRozan.

[05:19] Team_046 possession (Score: 35-24)
Collin Butler attempts a 3Pt. Contested by Anfernee Green (4.4 feet, MAN). Collin Butler misses. Rebound secured by Anfernee Green.

[05:07] Team_086 possession (Score: 35-24)
FOUL! Shooting foul on Collin Butler. Anfernee Green to the line for 3 free throws. [Team fouls: 3] (Collin Butler: 1 personal fouls)   FT 1/3: MISS   FT 2/3: GOOD   FT 3/3: GOOD Anfernee Green makes 2/3 from the line.
Score: 35-26

[04:55] Team_046 possession (Score: 35-26)
Collin Butler attempts a 3Pt. Contested by Anfernee Green (4.4 feet, ZONE). Collin Butler misses. Rebound secured by Anfernee Green.

[04:41] Team_086 possession (Score: 35-26)
FOUL! Holding foul on Chris LaVine. [Team fouls: 4] No free throws, side out. (Chris LaVine: 2 personal fouls)

[04:28] Team_086 possession (Score: 35-26)
FOUL! Shooting foul on Manu Dosunmu. Lamelo Towns to the line for 2 free throws. [BONUS: 5 team fouls] (Manu Dosunmu: 1 personal fouls)   FT 1/2: GOOD   FT 2/2: GOOD Lamelo Towns makes 2/2 from the line.
Score: 35-28

[04:11] Team_046 possession (Score: 35-28)
Collin Butler attempts a Layup. Contested by Anfernee Green (4.4 feet, MAN). COLLIN BUTLER MAKES IT! Assist: Josh Barrett
Score: 37-28

[04:01] Team_086 possession (Score: 37-28)
FOUL! Shooting foul on Collin Butler. Kyle McCollum to the line for 3 free throws. [BONUS: 6 team fouls] (Collin Butler: 2 personal fouls)   FT 1/3: MISS   FT 2/3: GOOD   FT 3/3: MISS Kyle McCollum makes 1/3 from the line. Rebound secured by Manu Dosunmu.
Score: 37-29

[03:47] Team_046 possession (Score: 37-29)
Paul DeRozan drives and kicks out. Collin Butler attempts a 3Pt. Contested by Anfernee Green (4.1 feet, ZONE). Collin Butler misses. Rebound secured by Kyle McCollum.

[03:35] Team_086 possession (Score: 37-29)
Kyle McCollum attempts a 3Pt. BLOCKED BY COLLIN BUTLER! Ball is loose! Rebound secured by Paul DeRozan.

[03:21] Team_046 possession (Score: 37-29)
Manu Dosunmu attempts a Layup. Contested by Anthony James (4.6 feet, MAN). MANU DOSUNMU MAKES IT! Assist: Paul DeRozan
Score: 39-29

[03:04] Team_086 possession (Score: 39-29)
Anthony James attempts a Layup. BLOCKED BY MANU DOSUNMU! Ball is loose! Rebound secured by Paul DeRozan.

[02:53] Team_046 possession (Score: 39-29)
Collin Butler attempts a 3Pt. Contested by Anfernee Green (4.4 feet, MAN). Collin Butler misses. Rebound secured by Anfernee Green.

[02:38] Team_086 possession (Score: 39-29)
Anthony James attempts a 3Pt. Contested by Collin Butler (4.6 feet, ZONE). Anthony James misses. Offensive rebound by Lamelo Towns! Lamelo Towns kicks it out.

[02:22] Team_086 possession (Score: 39-29)
FOUL! Shooting foul on Collin Butler. Franz McGrady to the line for 3 free throws. [BONUS: 7 team fouls] (Collin Butler: 3 personal fouls)   FT 1/3: GOOD   FT 2/3: MISS   FT 3/3: GOOD Franz McGrady makes 2/3 from the line.
Score: 39-31

[02:07] Team_046 possession (Score: 39-31)
Chris LaVine drives, picks up Lamelo Towns. Help arrives from Anfernee Green! Chris LaVine attempts a Layup. Contested by Anfernee Green (5.8 feet, ZONE). CHRIS LAVINE MAKES IT!
Score: 41-31

[01:51] Team_086 possession (Score: 41-31)
FOUL! Reach-in foul on Manu Dosunmu during the drive. [IN THE BONUS! 8 team fouls] Anthony James to the line for 2 free throws. (Manu Dosunmu: 2 personal fouls)   FT 1/2: GOOD   FT 2/2: MISS Anthony James makes 1/2 from the line. Rebound secured by Paul DeRozan.
Score: 41-32

[01:35] Team_046 possession (Score: 41-32)
Chris LaVine drives and kicks out. Manu Dosunmu attempts a Midrange. Contested by Anthony James (4.1 feet, MAN). MANU DOSUNMU MAKES IT! Assist: Chris LaVine
Score: 43-32

[01:18] Team_086 possession (Score: 43-32)
Franz McGrady attempts a 3Pt. Contested by Josh Barrett (5.1 feet, MAN). Franz McGrady misses. Offensive rebound by Lamelo Towns! Lamelo Towns kicks it out.

[01:05] Team_086 possession (Score: 43-32)
Anthony James attempts a 3Pt. Contested by Manu Dosunmu (5.6 feet, MAN). ANTHONY JAMES MAKES IT! Assist: Anfernee Green
Score: 43-35

[00:49] Team_046 possession (Score: 43-35)
Josh Barrett attempts a Midrange. Contested by Franz McGrady (5.1 feet, MAN). JOSH BARRETT MAKES IT! Assist: Paul DeRozan
Score: 45-35

[00:35] Team_086 possession (Score: 45-35)
Kyle McCollum attempts a Layup. BLOCKED BY CHRIS LAVINE! Ball is loose! Rebound secured by Manu Dosunmu.

[00:17] Team_046 possession (Score: 45-35)
Collin Butler attempts a Midrange. Contested by Kyle McCollum (5.7 feet, ZONE). Collin Butler misses. Rebound secured by Lamelo Towns.

[00:01] Team_086 possession (Score: 45-35)
FOUL! Holding foul on Manu Dosunmu. [IN THE BONUS! 9 team fouls] Anthony James to the line for 2 free throws. (Manu Dosunmu: 3 personal fouls)   FT 1/2: GOOD   FT 2/2: GOOD Anthony James makes 2/2 from the line.
Score: 45-37

================================================================================
                              2ND QUARTER COMPLETE                              
================================================================================

2ND QUARTER SCORE: Team_046 21, Team_086 18

BOX SCORE:
================================================================================

Team_046
--------------------------------------------------------------------------------
Player                MIN  PTS  REB  AST  TO      FG   FG%      3P   3P%
--------------------------------------------------------------------------------
Paul DeRozan           13    7    5    2   0   3/5    60.0     0/0   0.0
Chris LaVine           10    4    0    1   0   2/3    66.7     0/0   0.0
Manu Dosunmu           10    4    3    0   0   2/2   100.0     0/0   0.0
D'Angelo O'Neal        15    2    0    0   0   1/2    50.0     0/0   0.0
Josh Barrett           10    2    0    2   0   1/1   100.0     0/0   0.0
Collin Butler          10    2    0    0   0   1/5    20.0     0/0   0.0
Cade Wall              15    0    1    0   0   0/1     0.0     0/0   0.0
Lauri Carter           15    0    3    0   0   0/1     0.0     0/0   0.0
Victor Nowitzki        15    0    0    1   0   0/0     0.0     0/0   0.0

TEAM: FG: 10/20 (50.0%), 3PT: 0/6 (0.0%), REB: 12 (1 off, 11 def), AST: 6, TO: 2
TEAM FOULS: 9 [Team_086 in BONUS]


Team_086
--------------------------------------------------------------------------------
Player                MIN  PTS  REB  AST  TO      FG   FG%      3P   3P%
--------------------------------------------------------------------------------
Anthony James          10    5    0    0   0   2/6    33.3     0/0   0.0
Lamelo Towns           10    3    3    1   0   2/2   100.0     0/0   0.0
Rudy Rose              15    2    1    0   0   1/1   100.0     0/0   0.0
Kyle McCollum          10    2    2    0   0   1/4    25.0     0/0   0.0
Franz McGrady          10    2    0    0   0   1/2    50.0     0/0   0.0
Anfernee Green         10    2    4    1   0   1/1   100.0     0/0   0.0
Miles Gobert           15    0    1    0   0   0/3     0.0     0/0   0.0
Bones Ginobili         15    0    2    0   0   0/0     0.0     0/0   0.0

TEAM: FG: 8/19 (42.1%), 3PT: 3/9 (33.3%), REB: 13 (3 off, 10 def), AST: 2, TO: 3
TEAM FOULS: 4

================================================================================

================================================================================
                       3RD QUARTER - Team_046 vs Team_086                       
================================================================================

[12:00] Team_046 possession (Score: 45-37)
Lauri Carter attempts a Midrange. Contested by Miles Gobert (3.7 feet, MAN). Lauri Carter misses. Rebound secured by Bones Ginobili.

[11:46] Team_086 possession (Score: 45-37)
Miles Gobert attempts a Midrange. Contested by Lauri Carter (3.5 feet, MAN). Miles Gobert misses. Offensive rebound by Miles Gobert! Miles Gobert kicks it out.

[11:26] Team_086 possession (Score: 45-37)
Rudy Rose attempts a Layup. Contested by Kevin Allen (4.9 feet, MAN). RUDY ROSE MAKES IT!
Score: 45-39

[11:11] Team_046 possession (Score: 45-39)
Victor Nowitzki drives and kicks out. Lauri Carter attempts a Midrange. Contested by Miles Gobert (3.5 feet, MAN). Lauri Carter misses. Rebound secured by Bones Ginobili.

[10:54] Team_086 possession (Score: 45-39)
Anfernee Harris attempts a 3Pt. Wide open! Victor Nowitzki is 6.1 feet away. [MAN] ANFERNEE HARRIS MAKES IT! Assist: Lauri Johnson
Score: 45-42

[10:39] Team_046 possession (Score: 45-42)
Kevin Allen attempts a Layup. BLOCKED BY RUDY ROSE! Ball is loose! Rebound secured by Bones Ginobili.

[10:25] Team_086 possession (Score: 45-42)
FOUL! Shooting foul on Cade Wall. Bones Ginobili to the line for 2 free throws. [Team fouls: 1] (Cade Wall: 1 personal fouls)   FT 1/2: GOOD   FT 2/2: GOOD Bones Ginobili makes 2/2 from the line.
Score: 45-44

[10:10] Team_046 possession (Score: 45-44)
Kevin Allen attempts a 3Pt. Contested by Rudy Rose (4.0 feet, MAN). Kevin Allen misses. Offensive rebound by Kevin Allen! Kevin Allen kicks it out.

[09:55] Team_046 possession (Score: 45-44)
Cade Wall attempts a Midrange. Contested by Rudy Rose (4.3 feet, ZONE). Cade Wall misses. Rebound secured by Rudy Rose.

[09:45] Team_086 possession (Score: 45-44)
FOUL! Shooting foul on Kevin Allen. Rudy Rose to the line for 2 free throws. [Team fouls: 2] (Kevin Allen: 1 personal fouls)   FT 1/2: GOOD   FT 2/2: GOOD Rudy Rose makes 2/2 from the line.
Score: 45-46

[09:29] Team_046 possession (Score: 45-46)
Cade Wall attempts a Layup. BLOCKED BY BONES GINOBILI! Ball is loose! Offensive rebound by Kevin Allen! Kevin Allen kicks it out.

[09:15] Team_046 possession (Score: 45-46)
Victor Nowitzki drives and kicks out. Kevin Allen attempts a Midrange. Contested by Rudy Rose (3.7 feet, MAN). KEVIN ALLEN MAKES IT!
Score: 47-46

[08:58] Team_086 possession (Score: 47-46)
Anfernee Harris attempts a 3Pt. Wide open! Victor Nowitzki is 6.1 feet away. [MAN] ANFERNEE HARRIS MAKES IT! Assist: Lauri Johnson
Score: 47-49

[08:43] Team_046 possession (Score: 47-49)
Kevin Allen attempts a Midrange. Contested by Miles Gobert (3.8 feet, ZONE). Kevin Allen misses. Rebound secured by Bones Ginobili.

[08:24] Team_086 possession (Score: 47-49)
Rudy Rose attempts a 3Pt. Contested by Lauri Carter (3.5 feet, ZONE). Rudy Rose misses. Rebound secured by Cade Wall.

[08:05] Team_046 possession (Score: 47-49)
Cade Wall attempts a 3Pt. Contested by Bones Ginobili (5.4 feet, MAN). CADE WALL MAKES IT! Assist: Lauri Carter
Score: 50-49

[07:52] Team_086 possession (Score: 50-49)
Lauri Johnson drives to the basket... Lauri Johnson loses the ball! Stripped by D'Angelo O'Neal! TURNOVER! (live ball)

[07:39] Team_046 possession (Score: 50-49)
Lauri Carter throws a bad pass! Stolen by Miles Gobert! TURNOVER! (live ball)

[07:21] Team_086 possession (Score: 50-49)
Lauri Johnson drives and kicks out. Lauri Johnson attempts a Midrange. Contested by Victor Nowitzki (5.5 feet, ZONE). LAURI JOHNSON MAKES IT! Assist: Rudy Rose
Score: 50-51

[07:09] Team_046 possession (Score: 50-51)
Cade Wall attempts a 3Pt. Contested by Lauri Johnson (5.0 feet, ZONE). Cade Wall misses. Rebound secured by Rudy Rose.

[06:56] Team_086 possession (Score: 50-51)
FOUL! Holding foul on Lauri Carter. [Team fouls: 3] No free throws, side out. (Lauri Carter: 1 personal fouls)

[06:43] Team_086 possession (Score: 50-51)
Lauri Johnson attempts a 3Pt. Contested by Lauri Carter (3.5 feet, ZONE). Lauri Johnson misses. Rebound secured by Cade Wall.

[06:26] Team_046 possession (Score: 50-51)
Cade Wall attempts a Layup. BLOCKED BY RUDY ROSE! Ball is loose! Offensive rebound by Cade Wall! Cade Wall kicks it out.

[06:13] Team_046 possession (Score: 50-51)
Victor Nowitzki drives and kicks out. Victor Nowitzki attempts a 3Pt. Contested by Lauri Johnson (4.4 feet, ZONE). Victor Nowitzki misses. Rebound secured by Rudy Rose.

[06:01] Team_086 possession (Score: 50-51)
Anfernee Harris drives and kicks out. Lauri Johnson attempts a 3Pt. Contested by D'Angelo O'Neal (4.0 feet, MAN). Lauri Johnson misses. Rebound secured by Cade Wall.

[05:46] Team_046 possession (Score: 50-51)
FOUL! Shooting foul on Rudy Rose. D'Angelo O'Neal to the line for 2 free throws. [Team fouls: 1] (Rudy Rose: 1 personal fouls)   FT 1/2: MISS   FT 2/2: GOOD D'Angelo O'Neal makes 1/2 from the line.
Score: 51-51

[05:32] Team_086 possession (Score: 51-51)
Bones Ginobili makes the Dunk and draws the foul on Kevin Allen! And-1! Bones Ginobili to the line for 1. [Team fouls: 4] (Kevin Allen: 2 personal fouls)   FT 1/1: GOOD Bones Ginobili makes 1/1 from the line.
Score: 51-54

[05:20] Team_046 possession (Score: 51-54)
D'Angelo O'Neal drives and kicks out. Lauri Carter attempts a Midrange. Contested by Miles Gobert (3.5 feet, ZONE). Lauri Carter misses. Offensive rebound by Cade Wall! Cade Wall kicks it out.

[05:06] Team_046 possession (Score: 51-54)
Cade Wall drives to the basket... Cade Wall commits a violation (traveling/carry)! TURNOVER! (dead ball)

[04:50] Team_086 possession (Score: 51-54)
Bones Ginobili drives and kicks out. Anfernee Harris attempts a 3Pt. Contested by D'Angelo O'Neal (4.1 feet, ZONE). ANFERNEE HARRIS MAKES IT!
Score: 51-57

[04:37] Team_046 possession (Score: 51-57)
FOUL! Reach-in foul on Rudy Rose during the drive. [Team fouls: 2] No free throws, side out. (Rudy Rose: 2 personal fouls)

[04:21] Team_046 possession (Score: 51-57)
D'Angelo O'Neal makes the 3Pt and draws the foul on Lauri Johnson! And-1! D'Angelo O'Neal to the line for 1. [Team fouls: 3] (Lauri Johnson: 1 personal fouls)   FT 1/1: GOOD D'Angelo O'Neal makes 1/1 from the line.
Score: 55-57

[04:06] Team_086 possession (Score: 55-57)
FOUL! Shooting foul on D'Angelo O'Neal. Lauri Johnson to the line for 2 free throws. [BONUS: 5 team fouls] (D'Angelo O'Neal: 1 personal fouls)   FT 1/2: MISS   FT 2/2: GOOD Lauri Johnson makes 1/2 from the line.
Score: 55-58

[03:51] Team_046 possession (Score: 55-58)
Victor Nowitzki attempts a Layup. Contested by Anfernee Harris (4.5 feet, MAN). VICTOR NOWITZKI MAKES IT!
Score: 57-58

[03:38] Team_086 possession (Score: 57-58)
Rudy Rose loses the ball! Stripped by Kevin Allen! TURNOVER! (live ball)

[03:26] Team_046 possession (Score: 57-58)
Cade Wall attempts a Midrange. Contested by Bones Ginobili (5.5 feet, MAN). CADE WALL MAKES IT! Assist: Victor Nowitzki
Score: 59-58

[03:11] Team_086 possession (Score: 59-58)
Rudy Rose drives to the basket... FOUL! Offensive foul on Rudy Rose! Kevin Allen drew the charge! [Team fouls: 4] (Rudy Rose: 3 personal fouls) TURNOVER! (dead ball)

[02:58] Team_046 possession (Score: 59-58)
Lauri Carter attempts a 3Pt. Contested by Lauri Johnson (4.7 feet, ZONE). Lauri Carter misses. Rebound secured by Rudy Rose.

[02:41] Team_086 possession (Score: 59-58)
Rudy Rose loses the ball! Stripped by Kevin Allen! TURNOVER! (live ball)

[02:26] Team_046 possession (Score: 59-58)
Cade Wall attempts a 3Pt. Contested by Bones Ginobili (5.6 feet, MAN). CADE WALL MAKES IT! Assist: Victor Nowitzki
Score: 62-58

[02:09] Team_086 possession (Score: 62-58)
Lauri Johnson attempts a 3Pt. Contested by Lauri Carter (3.7 feet, ZONE). Lauri Johnson misses. Offensive rebound by Rudy Rose! Rudy Rose puts it back in!
Score: 62-60

[01:55] Team_046 possession (Score: 62-60)
FOUL! Shooting foul on Rudy Rose. D'Angelo O'Neal to the line for 2 free throws. [BONUS: 5 team fouls] (Rudy Rose: 4 personal fouls)   FT 1/2: MISS   FT 2/2: GOOD D'Angelo O'Neal makes 1/2 from the line.
Score: 63-60

[01:36] Team_086 possession (Score: 63-60)
FOUL! Shooting foul on D'Angelo O'Neal. Rudy Rose to the line for 2 free throws. [BONUS: 6 team fouls] (D'Angelo O'Neal: 2 personal fouls)   FT 1/2: GOOD   FT 2/2: MISS Rudy Rose makes 1/2 from the line. Offensive rebound by Rudy Rose! Rudy Rose puts it back in!
Score: 63-63

[01:24] Team_046 possession (Score: 63-63)
Lauri Carter attempts a 3Pt. Contested by Lauri Johnson (4.8 feet, ZONE). Lauri Carter misses. Rebound secured by Rudy Rose.

[01:10] Team_086 possession (Score: 63-63)
Lauri Johnson drives and kicks out. Miles Gobert attempts a Midrange. Contested by Cade Wall (4.2 feet, ZONE). Miles Gobert misses. Rebound secured by Lauri Carter.

[00:57] Team_046 possession (Score: 63-63)
Victor Nowitzki loses the ball! Stripped by Anfernee Harris! TURNOVER! (live ball)

[00:42] Team_086 possession (Score: 63-63)
Miles Gobert attempts a 3Pt. Contested by Lauri Carter (3.9 feet, MAN). Miles Gobert misses. Offensive rebound by Rudy Rose! Rudy Rose's putback is no good. Rebound secured by Lauri Carter.

[00:23] Team_046 possession (Score: 63-63)
FOUL! Shooting foul on Rudy Rose. Kevin Allen to the line for 2 free throws. [BONUS: 6 team fouls] (Rudy Rose: 5 personal fouls)   FT 1/2: MISS   FT 2/2: GOOD Kevin Allen makes 1/2 from the line.
Score: 64-63

[00:06] Team_086 possession (Score: 64-63)
Rudy Rose drives, Kevin Allen stays with him. Rudy Rose attempts a Layup. Contested by Kevin Allen (5.5 feet, MAN). RUDY ROSE MAKES IT! Assist: Anfernee Harris
Score: 64-65

================================================================================
                              3RD QUARTER COMPLETE                              
================================================================================

3RD QUARTER SCORE: Team_046 19, Team_086 28

BOX SCORE:
================================================================================

Team_046
--------------------------------------------------------------------------------
Player                MIN  PTS  REB  AST  TO      FG   FG%      3P   3P%
--------------------------------------------------------------------------------
Cade Wall              27    8    5    0   0   3/5    60.0     0/0   0.0
D'Angelo O'Neal        27    6    0    0   0   3/3   100.0     0/0   0.0
Kevin Allen            24    3    2    0   0   2/4    50.0     0/0   0.0
Victor Nowitzki        27    2    0    2   0   1/3    33.3     0/0   0.0

TEAM: FG: 9/18 (50.0%), 3PT: 3/6 (50.0%), REB: 8 (4 off, 4 def), AST: 3, TO: 3
TEAM FOULS: 6 [Team_086 in BONUS]


Team_086
--------------------------------------------------------------------------------
Player                MIN  PTS  REB  AST  TO      FG   FG%      3P   3P%
--------------------------------------------------------------------------------
Rudy Rose              27   11    6    1   0   5/6    83.3     0/0   0.0
Anfernee Harris        27    9    0    1   0   3/4    75.0     0/0   0.0
Bones Ginobili         27    5    4    0   0   2/2   100.0     0/0   0.0
Lauri Johnson          27    3    0    2   0   2/4    50.0     0/0   0.0
Lauri Carter           27    0    2    1   0   0/3     0.0     0/0   0.0
Miles Gobert           27    0    1    0   0   0/1     0.0     0/0   0.0

TEAM: FG: 12/17 (70.6%), 3PT: 3/6 (50.0%), REB: 12 (3 off, 9 def), AST: 4, TO: 4
TEAM FOULS: 6 [Team_046 in BONUS]

================================================================================

================================================================================
                       4TH QUARTER - Team_046 vs Team_086                       
================================================================================

[12:00] Team_046 possession (Score: 64-65)
Lauri Carter attempts a Midrange. Contested by Miles Gobert (3.9 feet, ZONE). Lauri Carter misses. Rebound secured by Rudy Rose.

[11:48] Team_086 possession (Score: 64-65)
Rudy Rose attempts a 3Pt. Contested by Lauri Carter (3.8 feet, ZONE). Rudy Rose misses. Rebound secured by Cade Wall.

[11:33] Team_046 possession (Score: 64-65)
Lauri Carter attempts a 3Pt. Contested by Miles Gobert (3.9 feet, MAN). Lauri Carter misses. Rebound secured by Rudy Rose.

[11:19] Team_086 possession (Score: 64-65)
Rudy Rose attempts a Layup. Contested by Kevin Allen (5.3 feet, MAN). RUDY ROSE MAKES IT! Assist: Bones Ginobili
Score: 64-67

[11:02] Team_046 possession (Score: 64-67)
Kevin Allen attempts a Layup. Contested by Rudy Rose (4.3 feet, MAN). Kevin Allen misses. FOUL! Loose ball foul on Miles Gobert during the rebound battle. [Team fouls: 1] No free throws, side out. (Miles Gobert: 1 personal fouls)

[10:48] Team_046 possession (Score: 64-67)
D'Angelo O'Neal attempts a 3Pt. Contested by Lauri Johnson (4.9 feet, ZONE). D'Angelo O'Neal misses. Offensive rebound by Cade Wall! Cade Wall kicks it out.

[10:34] Team_046 possession (Score: 64-67)
Kevin Allen drives to the basket... Kevin Allen loses the ball! Stripped by Rudy Rose! TURNOVER! (live ball)

[10:17] Team_086 possession (Score: 64-67)
Miles Gobert loses the ball! Stripped by Lauri Carter! TURNOVER! (live ball)

[10:01] Team_046 possession (Score: 64-67)
Cade Wall drives to the basket... FOUL! Offensive foul on Cade Wall! Bones Ginobili drew the charge! [Team fouls: 1] (Cade Wall: 1 personal fouls) TURNOVER! (dead ball)

[09:47] Team_086 possession (Score: 64-67)
Bones Ginobili attempts a 3Pt. Contested by Cade Wall (4.8 feet, MAN). BONES GINOBILI MAKES IT! Assist: Miles Gobert
Score: 64-70

[09:31] Team_046 possession (Score: 64-70)
Cade Wall attempts a Midrange. Contested by Miles Gobert (4.5 feet, ZONE). CADE WALL MAKES IT! Assist: Victor Nowitzki
Score: 66-70

[09:18] Team_086 possession (Score: 66-70)
Miles Gobert drives, picks up Lauri Carter. Help arrives from D'Angelo O'Neal! Miles Gobert attempts a Dunk. Contested by D'Angelo O'Neal (4.1 feet, MAN). MILES GOBERT MAKES IT! Assist: Bones Ginobili
Score: 66-72

[08:59] Team_046 possession (Score: 66-72)
Victor Nowitzki drives and kicks out. Cade Wall attempts a 3Pt. Contested by Miles Gobert (4.1 feet, ZONE). Cade Wall misses. Rebound secured by Rudy Rose.

[08:45] Team_086 possession (Score: 66-72)
Bones Ginobili attempts a Layup. Contested by Kevin Allen (5.8 feet, ZONE). BONES GINOBILI MAKES IT!
Score: 66-74

[08:30] Team_046 possession (Score: 66-74)
D'Angelo O'Neal drives, Rudy Rose stays with him. D'Angelo O'Neal attempts a Layup. Contested by Rudy Rose (4.5 feet, ZONE). D'Angelo O'Neal misses. Offensive rebound by Cade Wall! Cade Wall kicks it out.

[08:13] Team_046 possession (Score: 66-74)
Cade Wall loses the ball! Stripped by Bones Ginobili! TURNOVER! (live ball)

[08:01] Team_086 possession (Score: 66-74)
Anfernee Harris drives to the basket... Anfernee Harris throws a bad pass! Stolen by Kevin Allen! TURNOVER! (live ball)

[07:45] Team_046 possession (Score: 66-74)
Victor Nowitzki attempts a 3Pt. Contested by Lauri Johnson (5.1 feet, ZONE). Victor Nowitzki misses. Rebound secured by Miles Gobert.

[07:31] Team_086 possession (Score: 66-74)
Anfernee Harris attempts a 3Pt. Wide open! Victor Nowitzki is 6.7 feet away. [MAN] ANFERNEE HARRIS MAKES IT! Assist: Bones Ginobili
Score: 66-77

[07:19] Team_046 possession (Score: 66-77)
Cade Wall attempts a Midrange. Wide open! Bones Ginobili is 6.1 feet away. [ZONE] Cade Wall misses. Rebound secured by Rudy Rose.

[07:04] Team_086 possession (Score: 66-77)
Anfernee Harris attempts a 3Pt. Wide open! Victor Nowitzki is 6.7 feet away. [MAN] ANFERNEE HARRIS MAKES IT! Assist: Miles Gobert
Score: 66-80

[06:49] Team_046 possession (Score: 66-80)
Cade Wall attempts a 3Pt. Wide open! Bones Ginobili is 6.1 feet away. [MAN] Cade Wall misses. Rebound secured by Rudy Rose.

[06:34] Team_086 possession (Score: 66-80)
Miles Gobert drives and kicks out. Lauri Johnson makes the Midrange and draws the foul on Lauri Carter! And-1! Lauri Johnson to the line for 1. [Team fouls: 2] (Lauri Carter: 1 personal fouls)   FT 1/1: GOOD Lauri Johnson makes 1/1 from the line.
Score: 66-83

[06:21] Team_046 possession (Score: 66-83)
Cade Wall drives, Rudy Rose stays with him. Cade Wall attempts a Layup. Contested by Rudy Rose (5.1 feet, ZONE). Cade Wall misses. Offensive rebound by Cade Wall! Cade Wall kicks it out.

[06:11] Team_046 possession (Score: 66-83)
Kevin Allen attempts a Midrange. Contested by Bones Ginobili (5.9 feet, ZONE). Kevin Allen misses. Rebound secured by Rudy Rose.

[05:53] Team_086 possession (Score: 66-83)
Lauri Johnson attempts a 3Pt. Contested by D'Angelo O'Neal (5.4 feet, MAN). Lauri Johnson misses. Rebound secured by Kevin Allen.

[05:37] Team_046 possession (Score: 66-83)
Lauri Carter drives and kicks out. Victor Nowitzki attempts a 3Pt. Contested by Lauri Johnson (5.4 feet, ZONE). Victor Nowitzki misses. Rebound secured by Bones Ginobili.

[05:22] Team_086 possession (Score: 66-83)
Rudy Rose drives to the basket... Rudy Rose throws a bad pass! Stolen by Kevin Allen! TURNOVER! (live ball)

[05:03] Team_046 possession (Score: 66-83)
Kevin Allen attempts a Layup. BLOCKED BY RUDY ROSE! Ball is loose! Rebound secured by Miles Gobert.

[04:45] Team_086 possession (Score: 66-83)
Anfernee Harris attempts a 3Pt. Contested by Lauri Carter (5.0 feet, ZONE). Anfernee Harris misses. Rebound secured by Cade Wall.

[04:33] Team_046 possession (Score: 66-83)
Victor Nowitzki drives, Anfernee Harris stays with him. Victor Nowitzki attempts a Dunk. Contested by Anfernee Harris (5.5 feet, MAN). VICTOR NOWITZKI MAKES IT!
Score: 68-83

[04:21] Team_086 possession (Score: 68-83)
Lauri Johnson attempts a Midrange. Contested by Lauri Carter (4.8 feet, ZONE). Lauri Johnson misses. Offensive rebound by Rudy Rose! Rudy Rose's putback is no good. Offensive rebound by Rudy Rose! Rudy Rose kicks it out.

[04:05] Team_086 possession (Score: 68-83)
FOUL! Shooting foul on Cade Wall. Bones Ginobili to the line for 2 free throws. [Team fouls: 3] (Cade Wall: 2 personal fouls)   FT 1/2: GOOD   FT 2/2: GOOD Bones Ginobili makes 2/2 from the line.
Score: 68-85

[03:53] Team_046 possession (Score: 68-85)
FOUL! Shooting foul on Lauri Johnson. D'Angelo O'Neal to the line for 3 free throws. [Team fouls: 2] (Lauri Johnson: 1 personal fouls)   FT 1/3: GOOD   FT 2/3: GOOD   FT 3/3: MISS D'Angelo O'Neal makes 2/3 from the line. Rebound secured by Bones Ginobili.
Score: 70-85

[03:36] Team_086 possession (Score: 70-85)
Rudy Rose drives and kicks out. Lauri Johnson attempts a Midrange. Contested by D'Angelo O'Neal (5.8 feet, MAN). Lauri Johnson misses. Offensive rebound by Miles Gobert! Miles Gobert kicks it out.

[03:22] Team_086 possession (Score: 70-85)
Bones Ginobili attempts a 3Pt. Wide open! Victor Nowitzki is 7.0 feet away. [ZONE] Bones Ginobili misses. Rebound secured by Kevin Allen.

[03:11] Team_046 possession (Score: 70-85)
Cade Wall attempts a 3Pt. Wide open! Lauri Johnson is 6.1 feet away. [ZONE] CADE WALL MAKES IT! Assist: Kevin Allen
Score: 73-85

[03:01] Team_086 possession (Score: 73-85)
Rudy Rose drives, Kevin Allen stays with him. Rudy Rose attempts a Dunk. Wide open! Kevin Allen is 6.5 feet away. [MAN] RUDY ROSE MAKES IT!
Score: 73-87

[02:43] Team_046 possession (Score: 73-87)
Cade Wall attempts a Layup. Wide open! Bones Ginobili is 6.6 feet away. [MAN] Cade Wall misses. Rebound secured by Miles Gobert.

[02:28] Team_086 possession (Score: 73-87)
Lauri Johnson drives and kicks out. Rudy Rose attempts a Midrange. Wide open! Kevin Allen is 6.5 feet away. [MAN] RUDY ROSE MAKES IT!
Score: 73-89

[02:14] Team_046 possession (Score: 73-89)
Victor Nowitzki drives and kicks out. Kevin Allen attempts a Midrange. Contested by Rudy Rose (5.4 feet, ZONE). Kevin Allen misses. Rebound secured by Miles Gobert.

[02:02] Team_086 possession (Score: 73-89)
Anfernee Harris attempts a 3Pt. Contested by Lauri Carter (5.4 feet, ZONE). Anfernee Harris misses. Rebound secured by Kevin Allen.

[01:48] Team_046 possession (Score: 73-89)
Lauri Carter attempts a 3Pt. Contested by Lauri Johnson (6.0 feet, ZONE). LAURI CARTER MAKES IT! Assist: Victor Nowitzki
Score: 76-89

[01:30] Team_086 possession (Score: 76-89)
Anfernee Harris attempts a Midrange. Wide open! Cade Wall is 6.1 feet away. [ZONE] ANFERNEE HARRIS MAKES IT! Assist: Lauri Johnson
Score: 76-91

[01:11] Team_046 possession (Score: 76-91)
Lauri Carter attempts a Layup. Contested by Rudy Rose (5.5 feet, ZONE). Lauri Carter misses. Rebound secured by Bones Ginobili.

[00:54] Team_086 possession (Score: 76-91)
Miles Gobert attempts a Layup. Contested by Cade Wall (6.0 feet, ZONE). MILES GOBERT MAKES IT! Assist: Rudy Rose
Score: 76-93

[00:35] Team_046 possession (Score: 76-93)
FOUL! Shooting foul on Anfernee Harris. Victor Nowitzki to the line for 3 free throws. [Team fouls: 3] (Anfernee Harris: 1 personal fouls)   FT 1/3: GOOD   FT 2/3: GOOD   FT 3/3: GOOD Victor Nowitzki makes 3/3 from the line.
Score: 79-93

[00:17] Team_086 possession (Score: 79-93)
Anfernee Harris attempts a Layup. Wide open! Victor Nowitzki is 7.4 feet away. [MAN] ANFERNEE HARRIS MAKES IT!
Score: 79-95

================================================================================
                              4TH QUARTER COMPLETE                              
================================================================================

4TH QUARTER SCORE: Team_046 15, Team_086 30

BOX SCORE:
================================================================================

Team_046
--------------------------------------------------------------------------------
Player                MIN  PTS  REB  AST  TO      FG   FG%      3P   3P%
--------------------------------------------------------------------------------
Cade Wall              39    5    5    0   0   2/5    40.0     0/0   0.0
Victor Nowitzki        39    5    0    2   0   2/5    40.0     0/0   0.0
Lauri Carter           39    3    1    0   0   1/5    20.0     0/0   0.0
Kevin Allen            36    0    3    1   0   0/2     0.0     0/0   0.0
D'Angelo O'Neal        39    0    0    0   0   0/1     0.0     0/0   0.0

TEAM: FG: 5/18 (27.8%), 3PT: 3/7 (42.9%), REB: 9 (4 off, 5 def), AST: 3, TO: 3
TEAM FOULS: 3


Team_086
--------------------------------------------------------------------------------
Player                MIN  PTS  REB  AST  TO      FG   FG%      3P   3P%
--------------------------------------------------------------------------------
Anfernee Harris        39   10    0    0   0   4/6    66.7     0/0   0.0
Bones Ginobili         39    7    3    3   0   3/4    75.0     0/0   0.0
Rudy Rose              39    6    7    1   0   3/4    75.0     0/0   0.0
Miles Gobert           39    4    5    2   0   2/2   100.0     0/0   0.0
Lauri Johnson          39    3    0    1   0   1/2    50.0     0/0   0.0

TEAM: FG: 13/18 (72.2%), 3PT: 3/8 (37.5%), REB: 15 (2 off, 13 def), AST: 7, TO: 3
TEAM FOULS: 3

================================================================================

================================================================================
                               FULL GAME COMPLETE                               
================================================================================

FINAL SCORE: Team_046 79, Team_086 95

SCORING BY QUARTER:
--------------------------------------------------------------------------------
Team                     Q1     Q2     Q3     Q4    FINAL
--------------------------------------------------------------------------------
Team_046                 24     21     19     15       79
Team_086                 19     18     28     30       95
--------------------------------------------------------------------------------

FULL GAME BOX SCORE:
================================================================================

Team_046
--------------------------------------------------------------------------------
Player                MIN  PTS  REB  AST  TO      FG   FG%      3P   3P%      FT STL BLK
--------------------------------------------------------------------------------
D'Angelo O'Neal        39   12    0    1   0   5/8    62.5   1/4    25.0   7/10    1   0
Victor Nowitzki        39   14    0    5   3   7/15   46.7   2/5    40.0   3/3     0   0
Lauri Carter           39    3    8    3   4   1/11    9.1   1/7    14.3   0/0     1   0
Cade Wall              39   19   14    1   2   7/13   53.8   4/6    66.7   1/1     0   0
Kevin Allen            36    6   10    1   0   2/7    28.6   0/0     0.0   2/3     6   0
Paul DeRozan           13    7    5    2   1   3/6    50.0   0/2     0.0   1/1     0   0
Collin Butler          10    6    0    0   0   3/7    42.9   0/3     0.0   0/0     0   1
Manu Dosunmu           10    4    3    1   0   1/1   100.0   0/0     0.0   0/0     0   1
Josh Barrett           10    2    0    2   1   1/1   100.0   0/0     0.0   0/0     0   0
Chris LaVine           10    4    0    1   0   3/4    75.0   0/0     0.0   0/0     0   1

TEAM: FG: 34/74 (45.9%), 3PT: 8/27 (29.6%), REB: 38 (10 off, 28 def), AST: 17, TO: 11


Team_086
--------------------------------------------------------------------------------
Player                MIN  PTS  REB  AST  TO      FG   FG%      3P   3P%      FT STL BLK
--------------------------------------------------------------------------------
Lauri Johnson          39    6    0    3   1   4/9    44.4   1/4    25.0   2/3     0   0
Anfernee Harris        39   23    0    2   5   7/13   53.8   4/8    50.0   2/2     1   1
Miles Gobert           39    7   14    2   3   4/9    44.4   0/4     0.0   1/2     1   0
Bones Ginobili         39   14   10    3   1   7/9    77.8   1/2    50.0   5/6     1   1
Rudy Rose              39   21   19    2   3   8/12   66.7   0/2     0.0   3/4     1   3
Anfernee Green         10    4    5    1   1   2/2   100.0   1/1   100.0   2/3     0   0
Anthony James          10    5    0    0   0   1/5    20.0   1/2    50.0   3/4     0   0
Franz McGrady          10    2    0    2   0   1/2    50.0   1/2    50.0   2/3     0   0
Kyle McCollum          10    2    2    0   0   1/4    25.0   0/2     0.0   1/3     0   0
Lamelo Towns           10    5    4    1   0   3/3   100.0   0/0     0.0   3/4     0   0

TEAM: FG: 40/70 (57.1%), 3PT: 9/27 (33.3%), REB: 55 (15 off, 40 def), AST: 16, TO: 14

================================================================================
