================================================================================
                        FULL GAME - Team_094 vs Team_064                        
================================================================================

================================================================================
                       1ST QUARTER - Team_094 vs Team_064                       
================================================================================

[12:00] Team_094 possession (Score: 0-0)
Terry Ingram attempts a 3Pt. Contested by Ja Mitchell (5.5 feet, MAN). Terry Ingram misses. Rebound secured by Kawhi Irving.

[11:46] Team_064 possession (Score: 0-0)
Ja Mitchell attempts a Layup. Contested by Tim Russell (5.1 feet, ZONE). JA MITCHELL MAKES IT! Assist: Jordan Mitchell
Score: 0-2

[11:31] Team_094 possession (Score: 0-2)
Kobe Wagner drives, picks up Kawhi Irving. Help arrives from Jordan Mitchell! Kobe Wagner attempts a Dunk. Contested by Jordan Mitchell (4.8 feet, MAN). Kobe Wagner misses. Rebound secured by Kawhi Irving.

[11:17] Team_064 possession (Score: 0-2)
Ja Mitchell attempts a Layup. BLOCKED BY TERRY INGRAM! Ball is loose! Offensive rebound by Kawhi Irving! Kawhi Irving kicks it out.

[11:05] Team_064 possession (Score: 0-2)
Kawhi Irving drives, Kobe Wagner stays with him. Kawhi Irving attempts a Dunk. Contested by Kobe Wagner (4.0 feet, MAN). KAWHI IRVING MAKES IT!
Score: 0-4

[10:51] Team_094 possession (Score: 0-4)
Terry Ingram attempts a Midrange. Contested by Ja Mitchell (5.5 feet, MAN). TERRY INGRAM MAKES IT!
Score: 2-4

[10:33] Team_064 possession (Score: 2-4)
Kawhi Irving makes the Dunk and draws the foul on Kobe Wagner! And-1! Kawhi Irving to the line for 1. [Team fouls: 2] (Kobe Wagner: 1 personal fouls)   FT 1/1: GOOD Kawhi Irving makes 1/1 from the line.
Score: 2-7

[10:23] Team_094 possession (Score: 2-7)
Kobe Wagner makes the 3Pt and draws the foul on Ja Mitchell! And-1! Kobe Wagner to the line for 1. [Team fouls: 1] (Ja Mitchell: 1 personal fouls)   FT 1/1: GOOD Kobe Wagner makes 1/1 from the line.
Score: 6-7

[10:08] Team_064 possession (Score: 6-7)
Jordan Mitchell attempts a 3Pt. Contested by Tim Russell (4.4 feet, ZONE). Jordan Mitchell misses. Rebound secured by Kobe Wagner.

[09:56] Team_094 possession (Score: 6-7)
Terry Ingram attempts a Midrange. Contested by Ja Mitchell (5.5 feet, MAN). Terry Ingram misses. Rebound secured by Russell Simons.

[09:41] Team_064 possession (Score: 6-7)
FOUL! Shooting foul on Kobe Bryant. Shai Hyland to the line for 2 free throws. [Team fouls: 3] (Kobe Bryant: 1 personal fouls)   FT 1/2: GOOD   FT 2/2: GOOD Shai Hyland makes 2/2 from the line.
Score: 6-9

[09:26] Team_094 possession (Score: 6-9)
FOUL! Holding foul on Jordan Mitchell. [Team fouls: 2] No free throws, side out. (Jordan Mitchell: 1 personal fouls)

[09:12] Team_094 possession (Score: 6-9)
Tim Russell makes the Dunk and draws the foul on Jordan Mitchell! And-1! Tim Russell to the line for 1. [Team fouls: 3] (Jordan Mitchell: 2 personal fouls)   FT 1/1: GOOD Tim Russell makes 1/1 from the line.
Score: 9-9

[09:01] Team_064 possession (Score: 9-9)
Jordan Mitchell makes the Layup and draws the foul on Lauri Thompson! And-1! Jordan Mitchell to the line for 1. [Team fouls: 4] (Lauri Thompson: 1 personal fouls)   FT 1/1: GOOD Jordan Mitchell makes 1/1 from the line.
Score: 9-12

[08:44] Team_094 possession (Score: 9-12)
FOUL! Shooting foul on Russell Simons. Lauri Thompson to the line for 2 free throws. [Team fouls: 4] (Russell Simons: 1 personal fouls)   FT 1/2: GOOD   FT 2/2: GOOD Lauri Thompson makes 2/2 from the line.
Score: 11-12

[08:33] Team_064 possession (Score: 11-12)
Jordan Mitchell drives, Tim Russell stays with him. Jordan Mitchell attempts a Dunk. Contested by Tim Russell (4.4 feet, ZONE). JORDAN MITCHELL MAKES IT! Assist: Shai Hyland
Score: 11-14

[08:20] Team_094 possession (Score: 11-14)
Kobe Wagner attempts a 3Pt. Contested by Ja Mitchell (5.6 feet, ZONE). KOBE WAGNER MAKES IT! Assist: Tim Russell
Score: 14-14

[08:06] Team_064 possession (Score: 14-14)
Ja Mitchell attempts a 3Pt. Contested by Kobe Wagner (4.4 feet, ZONE). Ja Mitchell misses. Rebound secured by Tim Russell.

[07:48] Team_094 possession (Score: 14-14)
Lauri Thompson drives and kicks out. Kobe Wagner attempts a 3Pt. Contested by Kawhi Irving (4.3 feet, MAN). Kobe Wagner misses. Rebound secured by Russell Simons.

[07:30] Team_064 possession (Score: 14-14)
FOUL! Shooting foul on Tim Russell. Jordan Mitchell to the line for 2 free throws. [BONUS: 5 team fouls] (Tim Russell: 2 personal fouls)   FT 1/2: MISS   FT 2/2: GOOD Jordan Mitchell makes 1/2 from the line.
Score: 14-15

[07:20] Team_094 possession (Score: 14-15)
Lauri Thompson drives, picks up Jordan Mitchell. Help arrives from Kawhi Irving! Lauri Thompson attempts a Layup. Contested by Kawhi Irving (4.2 feet, MAN). LAURI THOMPSON MAKES IT! Assist: Kobe Bryant
Score: 16-15

[07:04] Team_064 possession (Score: 16-15)
Jordan Mitchell attempts a 3Pt. Contested by Kobe Wagner (3.7 feet, ZONE). Jordan Mitchell misses. Rebound secured by Tim Russell.

[06:50] Team_094 possession (Score: 16-15)
Terry Ingram attempts a 3Pt. Contested by Ja Mitchell (5.5 feet, ZONE). TERRY INGRAM MAKES IT! Assist: Kobe Bryant
Score: 19-15

[06:37] Team_064 possession (Score: 19-15)
Jordan Mitchell attempts a Midrange. Contested by Lauri Thompson (4.4 feet, ZONE). JORDAN MITCHELL MAKES IT!
Score: 19-17

[06:21] Team_094 possession (Score: 19-17)
Kobe Wagner drives and kicks out. Tim Russell makes the 3Pt and draws the foul on Jordan Mitchell! And-1! Tim Russell to the line for 1. [BONUS: 5 team fouls] (Jordan Mitchell: 3 personal fouls)   FT 1/1: MISS Tim Russell makes 0/1 from the line. Offensive rebound by Kobe Bryant! Kobe Bryant puts it back in!
Score: 24-17

[06:05] Team_064 possession (Score: 24-17)
Shai Hyland throws a bad pass! Stolen by Kobe Bryant! TURNOVER! (live ball)

[05:48] Team_094 possession (Score: 24-17)
Terry Ingram drives to the basket... Terry Ingram commits a violation (traveling/carry)! TURNOVER! (dead ball)

[05:37] Team_064 possession (Score: 24-17)
Russell Simons attempts a Midrange. Contested by Tim Russell (4.9 feet, MAN). Russell Simons misses. Rebound secured by Tim Russell.

[05:22] Team_094 possession (Score: 24-17)
Tim Russell attempts a Midrange. BLOCKED BY RUSSELL SIMONS! Ball is loose! Offensive rebound by Kobe Bryant! Kobe Bryant kicks it out.

[05:08] Team_094 possession (Score: 24-17)
Kobe Wagner attempts a Midrange. Contested by Russell Simons (3.8 feet, ZONE). Kobe Wagner misses. Rebound secured by Russell Simons.

[04:52] Team_064 possession (Score: 24-17)
Ja Mitchell attempts a Midrange. Contested by Terry Ingram (5.0 feet, MAN). Ja Mitchell misses. Rebound secured by Kobe Wagner.

[04:35] Team_094 possession (Score: 24-17)
Tim Russell attempts a Layup. Contested by Russell Simons (3.5 feet, ZONE). TIM RUSSELL MAKES IT! Assist: Kobe Wagner
Score: 26-17

[04:17] Team_064 possession (Score: 26-17)
Russell Simons attempts a Layup. Contested by Kobe Bryant (5.2 feet, ZONE). RUSSELL SIMONS MAKES IT! Assist: Ja Mitchell
Score: 26-19

[04:07] Team_094 possession (Score: 26-19)
Kobe Bryant drives, Shai Hyland stays with him. Kobe Bryant attempts a Layup. Contested by Shai Hyland (5.4 feet, MAN). Kobe Bryant misses. Rebound secured by Russell Simons.

[03:51] Team_064 possession (Score: 26-19)
Shai Hyland drives to the basket... Shai Hyland throws a bad pass! Stolen by Kobe Bryant! TURNOVER! (live ball)

[03:35] Team_094 possession (Score: 26-19)
Terry Ingram attempts a 3Pt. Contested by Kawhi Irving (4.8 feet, ZONE). TERRY INGRAM MAKES IT! Assist: Kobe Wagner
Score: 29-19

[03:23] Team_064 possession (Score: 29-19)
Shai Hyland attempts a 3Pt. Contested by Kobe Wagner (4.6 feet, ZONE). Shai Hyland misses. Rebound secured by Tim Russell.

[03:04] Team_094 possession (Score: 29-19)
Kobe Wagner attempts a 3Pt. Contested by Kawhi Irving (4.9 feet, MAN). Kobe Wagner misses. Offensive rebound by Kobe Bryant! Kobe Bryant puts it back in!
Score: 31-19

[02:50] Team_064 possession (Score: 31-19)
Jordan Mitchell attempts a Midrange. Contested by Lauri Thompson (4.5 feet, MAN). JORDAN MITCHELL MAKES IT! Assist: Kawhi Irving
Score: 31-21

[02:38] Team_094 possession (Score: 31-21)
Tim Russell attempts a Midrange. Contested by Russell Simons (3.8 feet, MAN). Tim Russell misses. Rebound secured by Shai Hyland.

[02:29] Team_064 possession (Score: 31-21)
Ja Mitchell attempts a Midrange. Contested by Terry Ingram (5.2 feet, MAN). JA MITCHELL MAKES IT!
Score: 31-23

[02:16] Team_094 possession (Score: 31-23)
Kobe Wagner drives and kicks out. Lauri Thompson attempts a Midrange. Contested by Jordan Mitchell (4.2 feet, MAN). LAURI THOMPSON MAKES IT! Assist: Tim Russell
Score: 33-23

[02:03] Team_064 possession (Score: 33-23)
Ja Mitchell drives to the basket... Ja Mitchell loses the ball! Stripped by Terry Ingram! TURNOVER! (live ball)

[01:47] Team_094 possession (Score: 33-23)
Lauri Thompson drives to the basket... Lauri Thompson loses the ball! Stripped by Russell Simons! TURNOVER! (live ball)

[01:28] Team_064 possession (Score: 33-23)
Russell Simons attempts a Layup. Contested by Tim Russell (5.2 feet, ZONE). RUSSELL SIMONS MAKES IT!
Score: 33-25

[01:17] Team_094 possession (Score: 33-25)
Kobe Bryant drives, Russell Simons stays with him. Kobe Bryant attempts a Dunk. Contested by Russell Simons (4.1 feet, ZONE). KOBE BRYANT MAKES IT!
Score: 35-25

[01:06] Team_064 possession (Score: 35-25)
Shai Hyland attempts a Midrange. Contested by Tim Russell (5.4 feet, ZONE). Shai Hyland misses. Rebound secured by Tim Russell.

[00:47] Team_094 possession (Score: 35-25)
Kobe Bryant makes the Layup and draws the foul on Shai Hyland! And-1! Kobe Bryant to the line for 1. [BONUS: 7 team fouls] (Shai Hyland: 1 personal fouls)   FT 1/1: GOOD Kobe Bryant makes 1/1 from the line.
Score: 38-25

[00:34] Team_064 possession (Score: 38-25)
Jordan Mitchell attempts a 3Pt. Contested by Kobe Wagner (4.2 feet, ZONE). Jordan Mitchell misses. Rebound secured by Kobe Bryant.

[00:24] Team_094 possession (Score: 38-25)
Kobe Wagner attempts a Midrange. Contested by Kawhi Irving (5.2 feet, MAN). Kobe Wagner misses. Offensive rebound by Kobe Bryant! Kobe Bryant puts it back in!
Score: 40-25

[00:09] Team_064 possession (Score: 40-25)
Ja Mitchell attempts a 3Pt. Contested by Kobe Wagner (4.8 feet, ZONE). Ja Mitchell misses. Rebound secured by Kobe Wagner.

================================================================================
                              1ST QUARTER COMPLETE                              
================================================================================

1ST QUARTER SCORE: Team_094 40, Team_064 25

BOX SCORE:
================================================================================

Team_094
--------------------------------------------------------------------------------
Player                MIN  PTS  REB  AST  TO      FG   FG%      3P   3P%
--------------------------------------------------------------------------------
Kobe Bryant            12   14    4    2   0   5/6    83.3     0/0   0.0
Terry Ingram           12    8    0    0   0   3/5    60.0     0/0   0.0
Kobe Wagner            12    7    3    2   0   2/4    50.0     0/0   0.0
Lauri Thompson         12    6    0    0   0   3/4    75.0     0/0   0.0
Tim Russell            12    5    5    2   0   2/3    66.7     0/0   0.0

TEAM: FG: 15/22 (68.2%), 3PT: 5/6 (83.3%), REB: 12 (3 off, 9 def), AST: 6, TO: 2
TEAM FOULS: 5 [Team_064 in BONUS]


Team_064
--------------------------------------------------------------------------------
Player                MIN  PTS  REB  AST  TO      FG   FG%      3P   3P%
--------------------------------------------------------------------------------
Jordan Mitchell        12   10    0    1   0   5/8    62.5     0/0   0.0
Kawhi Irving           12    5    3    1   0   2/2   100.0     0/0   0.0
Ja Mitchell            12    4    0    1   0   2/5    40.0     0/0   0.0
Russell Simons         12    4    4    0   0   2/3    66.7     0/0   0.0
Shai Hyland            12    2    1    1   0   1/3    33.3     0/0   0.0

TEAM: FG: 12/21 (57.1%), 3PT: 0/6 (0.0%), REB: 8 (1 off, 7 def), AST: 4, TO: 3
TEAM FOULS: 7 [Team_094 in BONUS]

================================================================================

================================================================================
                       2ND QUARTER - Team_094 vs Team_064                       
================================================================================

[12:00] Team_094 possession (Score: 40-25)
Terry Ingram attempts a 3Pt. Contested by Ja Mitchell (5.8 feet, ZONE). TERRY INGRAM MAKES IT! Assist: Kobe Wagner
Score: 43-25

[11:42] Team_064 possession (Score: 43-25)
Jordan Mitchell attempts a 3Pt. Contested by Lauri Thompson (4.6 feet, MAN). Jordan Mitchell misses. Rebound secured by Kobe Bryant.

[11:29] Team_094 possession (Score: 43-25)
Tim Russell attempts a Midrange. Contested by Russell Simons (4.0 feet, MAN). Tim Russell misses. Offensive rebound by Kobe Bryant! Kobe Bryant puts it back in!
Score: 45-25

[11:15] Team_064 possession (Score: 45-25)
Ja Mitchell attempts a Midrange. Contested by Kobe Wagner (4.7 feet, ZONE). Ja Mitchell misses. Rebound secured by Tim Russell.

[11:03] Team_094 possession (Score: 45-25)
Kobe Bryant drives, picks up Shai Hyland. Help arrives from Jordan Mitchell! Kobe Bryant attempts a Layup. Contested by Jordan Mitchell (5.7 feet, MAN). KOBE BRYANT MAKES IT! Assist: Lauri Thompson
Score: 47-25

[10:50] Team_064 possession (Score: 47-25)
Russell Simons drives, picks up Tim Russell. Help arrives from Lauri Thompson! Russell Simons attempts a Dunk. Contested by Lauri Thompson (5.3 feet, ZONE). RUSSELL SIMONS MAKES IT!
Score: 47-27

[10:36] Team_094 possession (Score: 47-27)
Tim Russell drives and kicks out. Terry Ingram attempts a Midrange. Contested by Ja Mitchell (5.7 feet, MAN). TERRY INGRAM MAKES IT! Assist: Kobe Wagner
Score: 49-27

[10:22] Team_064 possession (Score: 49-27)
Shai Hyland drives, Kobe Bryant stays with him. Shai Hyland attempts a Layup. Contested by Kobe Bryant (5.7 feet, MAN). SHAI HYLAND MAKES IT! Assist: Jordan Mitchell
Score: 49-29

[10:04] Team_094 possession (Score: 49-29)
Kobe Wagner attempts a 3Pt. Wide open! Ja Mitchell is 6.1 feet away. [ZONE] Kobe Wagner misses. Rebound secured by Kawhi Irving.

[09:53] Team_064 possession (Score: 49-29)
Shai Hyland drives and kicks out. Shai Hyland attempts a Midrange. Contested by Lauri Thompson (5.3 feet, ZONE). SHAI HYLAND MAKES IT! Assist: Russell Simons
Score: 49-31

[09:37] Team_094 possession (Score: 49-31)
Terry Ingram attempts a Layup. Wide open! Ja Mitchell is 6.0 feet away. [MAN] TERRY INGRAM MAKES IT! Assist: Kobe Wagner
Score: 51-31

[09:24] Team_064 possession (Score: 51-31)
Kawhi Irving drives and kicks out. Jordan Mitchell attempts a 3Pt. Contested by Kobe Wagner (4.8 feet, ZONE). Jordan Mitchell misses. Rebound secured by Kobe Wagner.

[09:12] Team_094 possession (Score: 51-31)
FOUL! Shooting foul on Jordan Mitchell. Lauri Thompson to the line for 3 free throws. [Team fouls: 1] (Jordan Mitchell: 1 personal fouls)   FT 1/3: GOOD   FT 2/3: MISS   FT 3/3: GOOD Lauri Thompson makes 2/3 from the line.
Score: 53-31

[08:56] Team_064 possession (Score: 53-31)
Shai Hyland drives, Kobe Bryant stays with him. Shai Hyland attempts a Layup. Contested by Kobe Bryant (5.8 feet, MAN). SHAI HYLAND MAKES IT! Assist: Ja Mitchell
Score: 53-33

[08:40] Team_094 possession (Score: 53-33)
Kobe Wagner drives and kicks out. Kobe Bryant attempts a Midrange. Contested by Shai Hyland (5.9 feet, MAN). Kobe Bryant misses. Offensive rebound by Kobe Bryant! Kobe Bryant puts it back in!
Score: 55-33

[08:25] Team_064 possession (Score: 55-33)
Ja Mitchell attempts a 3Pt. Contested by Terry Ingram (5.7 feet, MAN). Ja Mitchell misses. Rebound secured by Kobe Bryant.

[08:11] Team_094 possession (Score: 55-33)
Tim Russell attempts a 3Pt. Contested by Russell Simons (4.5 feet, MAN). Tim Russell misses. FOUL! Loose ball foul on Jordan Mitchell during the rebound battle. [Team fouls: 2] No free throws, side out. (Jordan Mitchell: 2 personal fouls)

[07:57] Team_094 possession (Score: 55-33)
Terry Ingram attempts a 3Pt. Wide open! Ja Mitchell is 6.2 feet away. [ZONE] TERRY INGRAM MAKES IT! Assist: Kobe Wagner
Score: 58-33

[07:39] Team_064 possession (Score: 58-33)
Jordan Mitchell drives and kicks out. Kawhi Irving attempts a Midrange. Contested by Kobe Wagner (5.0 feet, ZONE). KAWHI IRVING MAKES IT!
Score: 58-35

[07:25] Team_094 possession (Score: 58-35)
FOUL! Holding foul on Ja Mitchell. [Team fouls: 3] No free throws, side out. (Ja Mitchell: 1 personal fouls)

[07:08] Team_094 possession (Score: 58-35)
Kobe Bryant drives, Shai Hyland stays with him. Kobe Bryant attempts a Dunk. Wide open! Shai Hyland is 6.2 feet away. [MAN] Kobe Bryant misses. Rebound secured by Kawhi Irving.

[06:56] Team_064 possession (Score: 58-35)
Jordan Mitchell attempts a Layup. Contested by Lauri Thompson (5.2 feet, MAN). JORDAN MITCHELL MAKES IT! Assist: Shai Hyland
Score: 58-37

[06:41] Team_094 possession (Score: 58-37)
Tim Russell makes the Dunk and draws the foul on Russell Simons! And-1! Tim Russell to the line for 1. [Team fouls: 4] (Russell Simons: 1 personal fouls)   FT 1/1: MISS Tim Russell makes 0/1 from the line. Rebound secured by Russell Simons.
Score: 60-37

[06:26] Team_064 possession (Score: 60-37)
Russell Simons attempts a Midrange. Contested by Tim Russell (5.7 feet, MAN). Russell Simons misses. Rebound secured by Tim Russell.

[06:14] Team_094 possession (Score: 60-37)
Kobe Bryant drives, Russell Simons stays with him. Kobe Bryant attempts a Dunk. Contested by Russell Simons (4.9 feet, ZONE). KOBE BRYANT MAKES IT! Assist: Terry Ingram
Score: 62-37

[05:57] Team_064 possession (Score: 62-37)
Shai Hyland attempts a Layup. Wide open! Kobe Bryant is 6.1 feet away. [MAN] SHAI HYLAND MAKES IT!
Score: 62-39

[05:39] Team_094 possession (Score: 62-39)
FOUL! Reach-in foul on Russell Simons during the drive. [IN THE BONUS! 5 team fouls] Tim Russell to the line for 2 free throws. (Russell Simons: 2 personal fouls)   FT 1/2: MISS   FT 2/2: GOOD Tim Russell makes 1/2 from the line.
Score: 63-39

[05:24] Team_064 possession (Score: 63-39)
Jordan Mitchell attempts a Midrange. Contested by Lauri Thompson (5.4 feet, MAN). Jordan Mitchell misses. Rebound secured by Kobe Bryant.

[05:11] Team_094 possession (Score: 63-39)
Kobe Bryant attempts a 3Pt. Wide open! Ja Mitchell is 6.5 feet away. [ZONE] Kobe Bryant misses. Rebound secured by Kawhi Irving.

[05:00] Team_064 possession (Score: 63-39)
Shai Hyland attempts a 3Pt. Wide open! Kobe Bryant is 6.2 feet away. [MAN] Shai Hyland misses. Rebound secured by Kobe Bryant.

[04:49] Team_094 possession (Score: 63-39)
Terry Ingram drives, Ja Mitchell stays with him. Terry Ingram attempts a Layup. Wide open! Ja Mitchell is 6.6 feet away. [MAN] TERRY INGRAM MAKES IT! Assist: Tim Russell
Score: 65-39

[04:34] Team_064 possession (Score: 65-39)
Russell Simons attempts a Layup. Contested by Tim Russell (6.0 feet, ZONE). RUSSELL SIMONS MAKES IT! Assist: Kawhi Irving
Score: 65-41

[04:23] Team_094 possession (Score: 65-41)
FOUL! Shooting foul on Russell Simons. Lauri Thompson to the line for 2 free throws. [BONUS: 6 team fouls] (Russell Simons: 3 personal fouls)   FT 1/2: GOOD   FT 2/2: MISS Lauri Thompson makes 1/2 from the line. Rebound secured by Kawhi Irving.
Score: 66-41

[04:11] Team_064 possession (Score: 66-41)
Kawhi Irving attempts a Midrange. Contested by Kobe Wagner (5.3 feet, MAN). Kawhi Irving misses. Rebound secured by Tim Russell.

[03:53] Team_094 possession (Score: 66-41)
Terry Ingram attempts a Layup. Wide open! Ja Mitchell is 6.7 feet away. [MAN] TERRY INGRAM MAKES IT!
Score: 68-41

[03:36] Team_064 possession (Score: 68-41)
Ja Mitchell drives and kicks out. Kawhi Irving attempts a 3Pt. Contested by Kobe Wagner (5.7 feet, MAN). KAWHI IRVING MAKES IT! Assist: Shai Hyland
Score: 68-44

[03:20] Team_094 possession (Score: 68-44)
Terry Ingram drives, picks up Ja Mitchell. Help arrives from Kawhi Irving! Terry Ingram attempts a Layup. Wide open! Kawhi Irving is 6.7 feet away. [MAN] Terry Ingram misses. Rebound secured by Russell Simons.

[03:10] Team_064 possession (Score: 68-44)
Jordan Mitchell attempts a 3Pt. Contested by Lauri Thompson (5.7 feet, MAN). JORDAN MITCHELL MAKES IT! Assist: Shai Hyland
Score: 68-47

[02:56] Team_094 possession (Score: 68-47)
FOUL! Shooting foul on Ja Mitchell. Tim Russell to the line for 3 free throws. [BONUS: 7 team fouls] (Ja Mitchell: 2 personal fouls)   FT 1/3: GOOD   FT 2/3: GOOD   FT 3/3: GOOD Tim Russell makes 3/3 from the line.
Score: 71-47

[02:42] Team_064 possession (Score: 71-47)
Shai Hyland attempts a 3Pt. Contested by Kobe Wagner (5.8 feet, ZONE). Shai Hyland misses. Rebound secured by Kobe Bryant.

[02:25] Team_094 possession (Score: 71-47)
Tim Russell attempts a 3Pt. Contested by Russell Simons (5.6 feet, MAN). Tim Russell misses. Rebound secured by Kawhi Irving.

[02:14] Team_064 possession (Score: 71-47)
Shai Hyland attempts a Layup. Wide open! Tim Russell is 6.4 feet away. [ZONE] SHAI HYLAND MAKES IT! Assist: Ja Mitchell
Score: 71-49

[02:00] Team_094 possession (Score: 71-49)
Tim Russell drives, picks up Russell Simons. Help arrives from Jordan Mitchell! Tim Russell attempts a Dunk. Contested by Jordan Mitchell (5.7 feet, MAN). TIM RUSSELL MAKES IT! Assist: Kobe Wagner
Score: 73-49

[01:46] Team_064 possession (Score: 73-49)
Russell Simons loses the ball! Stripped by Tim Russell! TURNOVER! (live ball)

[01:31] Team_094 possession (Score: 73-49)
Lauri Thompson attempts a 3Pt. Wide open! Ja Mitchell is 7.1 feet away. [ZONE] Lauri Thompson misses. Rebound secured by Jordan Mitchell.

[01:16] Team_064 possession (Score: 73-49)
Ja Mitchell attempts a Midrange. Wide open! Terry Ingram is 6.8 feet away. [MAN] JA MITCHELL MAKES IT! Assist: Kawhi Irving
Score: 73-51

[01:06] Team_094 possession (Score: 73-51)
FOUL! Offensive foul on Lauri Thompson! Jordan Mitchell drew the charge! [Team fouls: 1] (Lauri Thompson: 1 personal fouls) TURNOVER! (dead ball)

[00:54] Team_064 possession (Score: 73-51)
Ja Mitchell attempts a 3Pt. Wide open! Kobe Wagner is 6.1 feet away. [ZONE] Ja Mitchell misses. Offensive rebound by Kawhi Irving! Kawhi Irving kicks it out.

[00:39] Team_064 possession (Score: 73-51)
Shai Hyland drives, Kobe Bryant stays with him. Shai Hyland attempts a Layup. Wide open! Kobe Bryant is 6.7 feet away. [MAN] Shai Hyland misses. Rebound secured by Tim Russell.

[00:24] Team_094 possession (Score: 73-51)
Kobe Wagner attempts a 3Pt. Wide open! Ja Mitchell is 7.3 feet away. [ZONE] Kobe Wagner misses. Rebound secured by Russell Simons.

[00:11] Team_064 possession (Score: 73-51)
Ja Mitchell drives, Tim Russell stays with him. Ja Mitchell attempts a Dunk. Wide open! Tim Russell is 6.7 feet away. [ZONE] Ja Mitchell misses. Rebound secured by Kobe Wagner.

================================================================================
                              2ND QUARTER COMPLETE                              
================================================================================

2ND QUARTER SCORE: Team_094 33, Team_064 26

BOX SCORE:
================================================================================

Team_094
--------------------------------------------------------------------------------
Player                MIN  PTS  REB  AST  TO      FG   FG%      3P   3P%
--------------------------------------------------------------------------------
Terry Ingram           24   14    0    1   0   6/7    85.7     0/0   0.0
Kobe Bryant            24    8    7    0   0   4/6    66.7     0/0   0.0
Tim Russell            24    6    5    1   0   3/5    60.0     0/0   0.0
Lauri Thompson         24    2    0    1   0   1/3    33.3     0/0   0.0
Kobe Wagner            24    0    2    5   0   0/2     0.0     0/0   0.0

TEAM: FG: 14/23 (60.9%), 3PT: 4/9 (44.4%), REB: 14 (3 off, 11 def), AST: 8, TO: 1
TEAM FOULS: 1


Team_064
--------------------------------------------------------------------------------
Player                MIN  PTS  REB  AST  TO      FG   FG%      3P   3P%
--------------------------------------------------------------------------------
Shai Hyland            24   10    0    3   0   5/8    62.5     0/0   0.0
Jordan Mitchell        24    5    1    1   0   2/4    50.0     0/0   0.0
Kawhi Irving           24    5    6    2   0   2/4    50.0     0/0   0.0
Russell Simons         24    4    3    1   0   2/3    66.7     0/0   0.0
Ja Mitchell            24    2    0    2   0   1/4    25.0     0/0   0.0

TEAM: FG: 12/23 (52.2%), 3PT: 1/5 (20.0%), REB: 10 (1 off, 9 def), AST: 9, TO: 1
TEAM FOULS: 7 [Team_094 in BONUS]

================================================================================

================================================================================
                       3RD QUARTER - Team_094 vs Team_064                       
================================================================================

[12:00] Team_094 possession (Score: 73-51)
Terry Ingram drives, Ja Mitchell stays with him. Terry Ingram attempts a Dunk. Contested by Ja Mitchell (5.5 feet, MAN). Terry Ingram misses. Rebound secured by Kawhi Irving.

[11:48] Team_064 possession (Score: 73-51)
Jordan Mitchell attempts a Layup. Contested by Lauri Thompson (4.4 feet, MAN). JORDAN MITCHELL MAKES IT!
Score: 73-53

[11:30] Team_094 possession (Score: 73-53)
Terry Ingram attempts a Midrange. Contested by Ja Mitchell (5.5 feet, MAN). TERRY INGRAM MAKES IT!
Score: 75-53

[11:12] Team_064 possession (Score: 75-53)
Shai Hyland makes the Dunk and draws the foul on Kobe Bryant! And-1! Shai Hyland to the line for 1. [Team fouls: 1] (Kobe Bryant: 1 personal fouls)   FT 1/1: MISS Shai Hyland makes 0/1 from the line. Rebound secured by Kobe Bryant.
Score: 75-55

[11:00] Team_094 possession (Score: 75-55)
Lauri Thompson attempts a 3Pt. Contested by Jordan Mitchell (4.2 feet, MAN). Lauri Thompson misses. Rebound secured by Shai Hyland.

[10:43] Team_064 possession (Score: 75-55)
FOUL! Shooting foul on Kobe Wagner. Kawhi Irving to the line for 2 free throws. [Team fouls: 2] (Kobe Wagner: 1 personal fouls)   FT 1/2: GOOD   FT 2/2: GOOD Kawhi Irving makes 2/2 from the line.
Score: 75-57

[10:24] Team_094 possession (Score: 75-57)
Terry Ingram attempts a 3Pt. Contested by Ja Mitchell (5.5 feet, MAN). Terry Ingram misses. Offensive rebound by Tim Russell! Tim Russell kicks it out.

[10:09] Team_094 possession (Score: 75-57)
Tim Russell attempts a Midrange. Contested by Kawhi Irving (4.5 feet, ZONE). Tim Russell misses. Rebound secured by Russell Simons.

[09:50] Team_064 possession (Score: 75-57)
Ja Mitchell throws a bad pass! Stolen by Terry Ingram! TURNOVER! (live ball)

[09:39] Team_094 possession (Score: 75-57)
FOUL! Holding foul on Kawhi Irving. [Team fouls: 1] No free throws, side out. (Kawhi Irving: 1 personal fouls)

[09:27] Team_094 possession (Score: 75-57)
Kobe Wagner attempts a 3Pt. Contested by Jordan Mitchell (4.3 feet, ZONE). Kobe Wagner misses. Offensive rebound by Tim Russell! Tim Russell kicks it out.

[09:16] Team_094 possession (Score: 75-57)
Kobe Wagner drives, Kawhi Irving stays with him. Kobe Wagner attempts a Layup. Contested by Kawhi Irving (4.8 feet, MAN). Kobe Wagner misses. Offensive rebound by Kobe Bryant! Kobe Bryant puts it back in!
Score: 77-57

[09:03] Team_064 possession (Score: 77-57)
Kawhi Irving makes the Layup and draws the foul on Tim Russell! And-1! Kawhi Irving to the line for 1. [Team fouls: 3] (Tim Russell: 1 personal fouls)   FT 1/1: GOOD Kawhi Irving makes 1/1 from the line.
Score: 77-60

[08:51] Team_094 possession (Score: 77-60)
Kobe Bryant attempts a Midrange. Contested by Kawhi Irving (4.6 feet, ZONE). KOBE BRYANT MAKES IT!
Score: 79-60

[08:38] Team_064 possession (Score: 79-60)
Ja Mitchell throws a bad pass! Stolen by Terry Ingram! TURNOVER! (live ball)

[08:25] Team_094 possession (Score: 79-60)
Kobe Wagner makes the Layup and draws the foul on Russell Simons! And-1! Kobe Wagner to the line for 1. [Team fouls: 2] (Russell Simons: 1 personal fouls)   FT 1/1: GOOD Kobe Wagner makes 1/1 from the line.
Score: 82-60

[08:12] Team_064 possession (Score: 82-60)
Ja Mitchell attempts a 3Pt. Contested by Kobe Wagner (4.4 feet, ZONE). Ja Mitchell misses. Rebound secured by Kobe Bryant.

[07:56] Team_094 possession (Score: 82-60)
Tim Russell drives to the basket... FOUL! Offensive foul on Tim Russell! Russell Simons drew the charge! [Team fouls: 4] (Tim Russell: 2 personal fouls) TURNOVER! (dead ball)

[07:40] Team_064 possession (Score: 82-60)
Ja Mitchell attempts a Layup. BLOCKED BY KOBE WAGNER! Ball deflects out of bounds off Ja Mitchell.

[07:25] Team_094 possession (Score: 82-60)
FOUL! Holding foul on Kawhi Irving. [Team fouls: 3] No free throws, side out. (Kawhi Irving: 2 personal fouls)

[07:11] Team_094 possession (Score: 82-60)
FOUL! Shooting foul on Jordan Mitchell. Lauri Thompson to the line for 2 free throws. [Team fouls: 4] (Jordan Mitchell: 1 personal fouls)   FT 1/2: MISS   FT 2/2: GOOD Lauri Thompson makes 1/2 from the line.
Score: 83-60

[06:56] Team_064 possession (Score: 83-60)
FOUL! Shooting foul on Kobe Bryant. Kawhi Irving to the line for 2 free throws. [BONUS: 5 team fouls] (Kobe Bryant: 2 personal fouls)   FT 1/2: GOOD   FT 2/2: GOOD Kawhi Irving makes 2/2 from the line.
Score: 83-62

[06:42] Team_094 possession (Score: 83-62)
FOUL! Holding foul on Russell Simons. [IN THE BONUS! 5 team fouls] Tim Russell to the line for 2 free throws. (Russell Simons: 2 personal fouls)   FT 1/2: GOOD   FT 2/2: GOOD Tim Russell makes 2/2 from the line.
Score: 85-62

[06:28] Team_064 possession (Score: 85-62)
Shai Hyland drives to the basket... Shai Hyland throws a bad pass! Stolen by Tim Russell! TURNOVER! (live ball)

[06:16] Team_094 possession (Score: 85-62)
Lauri Thompson drives and kicks out. Kobe Wagner attempts a 3Pt. Contested by Kawhi Irving (4.3 feet, MAN). Kobe Wagner misses. Rebound secured by Russell Simons.

[06:00] Team_064 possession (Score: 85-62)
FOUL! Reach-in foul on Tim Russell during the drive. [IN THE BONUS! 6 team fouls] Shai Hyland to the line for 2 free throws. (Tim Russell: 3 personal fouls)   FT 1/2: GOOD   FT 2/2: GOOD Shai Hyland makes 2/2 from the line.
Score: 85-64

[05:45] Team_094 possession (Score: 85-64)
Tim Russell attempts a 3Pt. Contested by Russell Simons (3.4 feet, MAN). TIM RUSSELL MAKES IT! Assist: Kobe Bryant
Score: 88-64

[05:31] Team_064 possession (Score: 88-64)
Russell Simons drives and kicks out. Ja Mitchell attempts a 3Pt. Contested by Terry Ingram (4.7 feet, MAN). Ja Mitchell misses. Rebound secured by Tim Russell.

[05:18] Team_094 possession (Score: 88-64)
Kobe Bryant attempts a Layup. Contested by Shai Hyland (5.3 feet, MAN). KOBE BRYANT MAKES IT!
Score: 90-64

[05:01] Team_064 possession (Score: 90-64)
Russell Simons attempts a 3Pt. Contested by Kobe Wagner (4.3 feet, ZONE). Russell Simons misses. Rebound secured by Kobe Wagner.

[04:45] Team_094 possession (Score: 90-64)
FOUL! Holding foul on Shai Hyland. [IN THE BONUS! 6 team fouls] Kobe Bryant to the line for 2 free throws. (Shai Hyland: 1 personal fouls)   FT 1/2: MISS   FT 2/2: GOOD Kobe Bryant makes 1/2 from the line.
Score: 91-64

[04:27] Team_064 possession (Score: 91-64)
FOUL! Shooting foul on Terry Ingram. Ja Mitchell to the line for 2 free throws. [BONUS: 7 team fouls] (Terry Ingram: 1 personal fouls)   FT 1/2: GOOD   FT 2/2: MISS Ja Mitchell makes 1/2 from the line. Offensive rebound by Russell Simons! Russell Simons kicks it out.
Score: 91-65

[04:09] Team_064 possession (Score: 91-65)
Jordan Mitchell attempts a Layup. Contested by Tim Russell (4.4 feet, ZONE). JORDAN MITCHELL MAKES IT! Assist: Ja Mitchell
Score: 91-67

[03:51] Team_094 possession (Score: 91-67)
Kobe Wagner attempts a 3Pt. Contested by Ja Mitchell (5.7 feet, ZONE). Kobe Wagner misses. Rebound secured by Russell Simons.

[03:33] Team_064 possession (Score: 91-67)
Kawhi Irving attempts a 3Pt. Contested by Kobe Wagner (4.1 feet, ZONE). Kawhi Irving misses. Rebound secured by Kobe Wagner.

[03:23] Team_094 possession (Score: 91-67)
Terry Ingram drives, Russell Simons stays with him. Terry Ingram attempts a Layup. Contested by Russell Simons (3.8 feet, ZONE). TERRY INGRAM MAKES IT! Assist: Kobe Wagner
Score: 93-67

[03:13] Team_064 possession (Score: 93-67)
Russell Simons attempts a 3Pt. Contested by Tim Russell (5.0 feet, ZONE). Russell Simons misses. Rebound secured by Tim Russell.

[02:54] Team_094 possession (Score: 93-67)
Kobe Bryant drives, picks up Shai Hyland. Help arrives from Jordan Mitchell! Kobe Bryant attempts a Layup. Contested by Jordan Mitchell (5.5 feet, MAN). KOBE BRYANT MAKES IT!
Score: 95-67

[02:42] Team_064 possession (Score: 95-67)
Russell Simons drives and kicks out. Shai Hyland attempts a Midrange. Contested by Kobe Bryant (5.2 feet, MAN). SHAI HYLAND MAKES IT! Assist: Russell Simons
Score: 95-69

[02:27] Team_094 possession (Score: 95-69)
Kobe Bryant drives and kicks out. Kobe Wagner attempts a 3Pt. Contested by Ja Mitchell (5.4 feet, ZONE). Kobe Wagner misses. Rebound secured by Shai Hyland.

[02:11] Team_064 possession (Score: 95-69)
Jordan Mitchell attempts a 3Pt. Contested by Kobe Wagner (3.9 feet, ZONE). Jordan Mitchell misses. Rebound secured by Tim Russell.

[01:55] Team_094 possession (Score: 95-69)
Kobe Wagner drives and kicks out. Kobe Wagner attempts a 3Pt. Contested by Kawhi Irving (4.6 feet, MAN). KOBE WAGNER MAKES IT! Assist: Kobe Bryant
Score: 98-69

[01:42] Team_064 possession (Score: 98-69)
Shai Hyland makes the Layup and draws the foul on Tim Russell! And-1! Shai Hyland to the line for 1. [BONUS: 8 team fouls] (Tim Russell: 4 personal fouls)   FT 1/1: GOOD Shai Hyland makes 1/1 from the line.
Score: 98-72

[01:32] Team_094 possession (Score: 98-72)
Lauri Thompson attempts a Layup. Contested by Russell Simons (4.1 feet, ZONE). Lauri Thompson misses. Rebound secured by Russell Simons.

[01:18] Team_064 possession (Score: 98-72)
Jordan Mitchell drives, picks up Tim Russell. Help arrives from Lauri Thompson! Jordan Mitchell attempts a Layup. Contested by Lauri Thompson (4.7 feet, ZONE). JORDAN MITCHELL MAKES IT!
Score: 98-74

[01:00] Team_094 possession (Score: 98-74)
Lauri Thompson attempts a Layup. Contested by Jordan Mitchell (4.6 feet, MAN). Lauri Thompson misses. Rebound secured by Russell Simons.

[00:45] Team_064 possession (Score: 98-74)
Ja Mitchell drives and kicks out. Jordan Mitchell attempts a 3Pt. Contested by Lauri Thompson (5.2 feet, MAN). Jordan Mitchell misses. Offensive rebound by Kawhi Irving! Kawhi Irving kicks it out.

[00:32] Team_064 possession (Score: 98-74)
Ja Mitchell attempts a 3Pt. Contested by Terry Ingram (5.4 feet, MAN). JA MITCHELL MAKES IT! Assist: Shai Hyland
Score: 98-77

[00:20] Team_094 possession (Score: 98-77)
Lauri Thompson attempts a 3Pt. Contested by Russell Simons (4.3 feet, ZONE). Lauri Thompson misses. Offensive rebound by Kobe Bryant! Kobe Bryant puts it back in!
Score: 100-77

[00:03] Team_064 possession (Score: 100-77)
FOUL! Reach-in foul on Tim Russell during the drive. [IN THE BONUS! 9 team fouls] Kawhi Irving to the line for 2 free throws. (Tim Russell: 5 personal fouls)   FT 1/2: MISS   FT 2/2: GOOD Kawhi Irving makes 1/2 from the line.
Score: 100-78

================================================================================
                              3RD QUARTER COMPLETE                              
================================================================================

3RD QUARTER SCORE: Team_094 27, Team_064 27

BOX SCORE:
================================================================================

Team_094
--------------------------------------------------------------------------------
Player                MIN  PTS  REB  AST  TO      FG   FG%      3P   3P%
--------------------------------------------------------------------------------
Kobe Bryant            36   11    4    2   0   6/7    85.7     0/0   0.0
Kobe Wagner            36    6    2    1   0   2/3    66.7     0/0   0.0
Tim Russell            36    5    5    0   0   2/3    66.7     0/0   0.0
Terry Ingram           36    4    0    0   0   2/3    66.7     0/0   0.0
Lauri Thompson         36    1    0    0   0   1/5    20.0     0/0   0.0

TEAM: FG: 13/21 (61.9%), 3PT: 2/4 (50.0%), REB: 11 (4 off, 7 def), AST: 3, TO: 1
TEAM FOULS: 9 [Team_064 in BONUS]


Team_064
--------------------------------------------------------------------------------
Player                MIN  PTS  REB  AST  TO      FG   FG%      3P   3P%
--------------------------------------------------------------------------------
Kawhi Irving           36    8    2    0   0   4/5    80.0     0/0   0.0
Shai Hyland            36    7    2    1   0   3/4    75.0     0/0   0.0
Jordan Mitchell        36    6    0    0   0   3/4    75.0     0/0   0.0
Ja Mitchell            36    3    0    1   0   1/3    33.3     0/0   0.0
Russell Simons         36    0    6    1   0   0/3     0.0     0/0   0.0

TEAM: FG: 11/19 (57.9%), 3PT: 1/6 (16.7%), REB: 10 (2 off, 8 def), AST: 3, TO: 3
TEAM FOULS: 6 [Team_094 in BONUS]

================================================================================

================================================================================
                       4TH QUARTER - Team_094 vs Team_064                       
================================================================================

[12:00] Team_094 possession (Score: 100-78)
Terry Ingram attempts a Layup. BLOCKED BY JA MITCHELL! Ball goes out off Ja Mitchell. Terry Ingram's ball!

[11:42] Team_094 possession (Score: 100-78)
Terry Ingram drives to the basket... Terry Ingram throws a bad pass out of bounds! TURNOVER! (dead ball)

[11:42] Substitution (Team_094): Terry Ingram OUT → Shaquille Bryant IN (stamina_rule2)

[11:42] Substitution (Team_094): Lauri Thompson OUT → Kevin Rozier IN (stamina_rule2)

[11:42] Substitution (Team_094): Kobe Wagner OUT → Ayo Gasol IN (stamina_rule2)

[11:42] Substitution (Team_094): Tim Russell OUT → Domantas Haliburton IN (stamina_rule2)

[11:42] Substitution (Team_094): Kobe Bryant OUT → Isaiah Quickley IN (stamina_rule2)

[11:42] Substitution (Team_064): Ja Mitchell OUT → CJ Haliburton IN (stamina_rule2)

[11:42] Substitution (Team_064): Jordan Mitchell OUT → Ja Simmons IN (stamina_rule2)

[11:42] Substitution (Team_064): Kawhi Irving OUT → Tobias Herro IN (stamina_rule2)

[11:42] Substitution (Team_064): Russell Simons OUT → Austin Smith IN (stamina_rule2)

[11:42] Substitution (Team_064): Shai Hyland OUT → Devin Cunningham IN (stamina_rule2)

[11:25] Team_064 possession (Score: 100-78)
Austin Smith attempts a 3Pt. Contested by Domantas Haliburton (5.4 feet, ZONE). Austin Smith misses. FOUL! Loose ball foul on Isaiah Quickley during the rebound battle. [Team fouls: 1] No free throws, side out. (Isaiah Quickley: 1 personal fouls)

[11:05] Team_064 possession (Score: 100-78)
CJ Haliburton attempts a Midrange. Contested by Shaquille Bryant (5.6 feet, MAN). CJ HALIBURTON MAKES IT!
Score: 100-80

[10:53] Team_094 possession (Score: 100-80)
Kevin Rozier attempts a 3Pt. Contested by Austin Smith (5.1 feet, ZONE). Kevin Rozier misses. Rebound secured by Devin Cunningham.

[10:40] Team_064 possession (Score: 100-80)
Devin Cunningham drives and kicks out. Austin Smith attempts a 3Pt. Contested by Domantas Haliburton (5.8 feet, MAN). Austin Smith misses. Rebound secured by Ayo Gasol.

[10:23] Team_094 possession (Score: 100-80)
Isaiah Quickley attempts a 3Pt. Contested by Devin Cunningham (5.5 feet, MAN). Isaiah Quickley misses. Rebound secured by Ja Simmons.

[10:05] Team_064 possession (Score: 100-80)
CJ Haliburton drives, Isaiah Quickley stays with him. CJ Haliburton attempts a Dunk. Wide open! Isaiah Quickley is 6.4 feet away. [ZONE] CJ HALIBURTON MAKES IT!
Score: 100-82

[09:46] Team_094 possession (Score: 100-82)
Isaiah Quickley attempts a 3Pt. Contested by Devin Cunningham (5.5 feet, MAN). Isaiah Quickley misses. Rebound secured by Ja Simmons.

[09:33] Team_064 possession (Score: 100-82)
Ja Simmons attempts a Midrange. Contested by Kevin Rozier (4.8 feet, MAN). JA SIMMONS MAKES IT! Assist: CJ Haliburton
Score: 100-84

[09:19] Team_094 possession (Score: 100-84)
Ayo Gasol drives and kicks out. Isaiah Quickley attempts a 3Pt. Contested by Austin Smith (4.6 feet, ZONE). Isaiah Quickley misses. Rebound secured by Devin Cunningham.

[09:07] Team_064 possession (Score: 100-84)
FOUL! Offensive foul on Austin Smith! Domantas Haliburton drew the charge! [Team fouls: 1] (Austin Smith: 1 personal fouls) TURNOVER! (dead ball)

[08:50] Team_094 possession (Score: 100-84)
Shaquille Bryant drives and kicks out. Isaiah Quickley attempts a 3Pt. Wide open! Tobias Herro is 6.0 feet away. [ZONE] Isaiah Quickley misses. Rebound secured by Devin Cunningham.

[08:34] Team_064 possession (Score: 100-84)
Austin Smith attempts a Layup. Contested by Isaiah Quickley (5.7 feet, ZONE). Austin Smith misses. Rebound secured by Ayo Gasol.

[08:18] Team_094 possession (Score: 100-84)
Ayo Gasol attempts a Midrange. Wide open! Tobias Herro is 6.3 feet away. [MAN] AYO GASOL MAKES IT!
Score: 102-84

[08:05] Team_064 possession (Score: 102-84)
Austin Smith attempts a Midrange. Contested by Kevin Rozier (4.6 feet, ZONE). AUSTIN SMITH MAKES IT!
Score: 102-86

[07:50] Team_094 possession (Score: 102-86)
Isaiah Quickley attempts a Midrange. Contested by Ja Simmons (5.9 feet, ZONE). Isaiah Quickley misses. Rebound secured by Austin Smith.

[07:37] Team_064 possession (Score: 102-86)
CJ Haliburton attempts a Midrange. Contested by Kevin Rozier (5.3 feet, ZONE). CJ Haliburton misses. Rebound secured by Domantas Haliburton.

[07:22] Team_094 possession (Score: 102-86)
Kevin Rozier attempts a 3Pt. Contested by Austin Smith (5.1 feet, ZONE). KEVIN ROZIER MAKES IT! Assist: Shaquille Bryant
Score: 105-86

[07:07] Team_064 possession (Score: 105-86)
Tobias Herro attempts a 3Pt. Contested by Domantas Haliburton (5.3 feet, ZONE). Tobias Herro misses. Rebound secured by Domantas Haliburton.

[06:56] Team_094 possession (Score: 105-86)
FOUL! Reach-in foul on Austin Smith during the drive. [Team fouls: 2] No free throws, side out. (Austin Smith: 2 personal fouls)

[06:45] Team_094 possession (Score: 105-86)
Domantas Haliburton attempts a 3Pt. Contested by Austin Smith (4.7 feet, MAN). DOMANTAS HALIBURTON MAKES IT! Assist: Ayo Gasol
Score: 108-86

[06:29] Team_064 possession (Score: 108-86)
Devin Cunningham drives and kicks out. Tobias Herro attempts a Midrange. Contested by Ayo Gasol (4.9 feet, MAN). TOBIAS HERRO MAKES IT! Assist: Devin Cunningham
Score: 108-88

[06:20] Team_094 possession (Score: 108-88)
Ayo Gasol drives to the basket... Ayo Gasol commits a violation (traveling/carry)! TURNOVER! (dead ball)

[06:10] Team_064 possession (Score: 108-88)
Austin Smith attempts a Midrange. Contested by Kevin Rozier (4.6 feet, ZONE). AUSTIN SMITH MAKES IT!
Score: 108-90

[05:55] Team_094 possession (Score: 108-90)
FOUL! Shooting foul on Austin Smith. Domantas Haliburton to the line for 2 free throws. [Team fouls: 3] (Austin Smith: 3 personal fouls)   FT 1/2: GOOD   FT 2/2: GOOD Domantas Haliburton makes 2/2 from the line.
Score: 110-90

[05:38] Team_064 possession (Score: 110-90)
Austin Smith attempts a Layup. Contested by Domantas Haliburton (5.4 feet, MAN). AUSTIN SMITH MAKES IT! Assist: Devin Cunningham
Score: 110-92

[05:26] Team_094 possession (Score: 110-92)
Shaquille Bryant drives, Austin Smith stays with him. Shaquille Bryant attempts a Dunk. Contested by Austin Smith (4.2 feet, ZONE). Shaquille Bryant misses. Rebound secured by Austin Smith.

[05:15] Team_064 possession (Score: 110-92)
Tobias Herro attempts a 3Pt. Contested by Shaquille Bryant (4.8 feet, ZONE). TOBIAS HERRO MAKES IT!
Score: 110-95

[05:00] Team_094 possession (Score: 110-95)
Ayo Gasol attempts a 3Pt. Wide open! Tobias Herro is 6.3 feet away. [MAN] AYO GASOL MAKES IT! Assist: Domantas Haliburton
Score: 113-95

[04:47] Team_064 possession (Score: 113-95)
CJ Haliburton attempts a 3Pt. Wide open! Domantas Haliburton is 6.1 feet away. [ZONE] CJ Haliburton misses. FOUL! Loose ball foul on Ayo Gasol during the rebound battle. [Team fouls: 2] No free throws, side out. (Ayo Gasol: 1 personal fouls)

[04:31] Team_064 possession (Score: 113-95)
Tobias Herro drives, Ayo Gasol stays with him. Tobias Herro attempts a Layup. Contested by Ayo Gasol (4.5 feet, MAN). TOBIAS HERRO MAKES IT! Assist: CJ Haliburton
Score: 113-97

[04:21] Team_094 possession (Score: 113-97)
Ayo Gasol attempts a 3Pt. Contested by Austin Smith (4.9 feet, ZONE). AYO GASOL MAKES IT! Assist: Isaiah Quickley
Score: 116-97

[04:07] Team_064 possession (Score: 116-97)
CJ Haliburton drives, picks up Isaiah Quickley. Help arrives from Kevin Rozier! CJ Haliburton attempts a Layup. Wide open! Kevin Rozier is 6.4 feet away. [ZONE] CJ HALIBURTON MAKES IT! Assist: Austin Smith
Score: 116-99

[03:48] Team_094 possession (Score: 116-99)
Domantas Haliburton attempts a Midrange. Contested by Austin Smith (4.7 feet, MAN). DOMANTAS HALIBURTON MAKES IT!
Score: 118-99

[03:31] Team_064 possession (Score: 118-99)
Devin Cunningham attempts a 3Pt. Contested by Isaiah Quickley (6.0 feet, MAN). DEVIN CUNNINGHAM MAKES IT! Assist: Ja Simmons
Score: 118-102

[03:15] Team_094 possession (Score: 118-102)
FOUL! Holding foul on Tobias Herro. [Team fouls: 4] No free throws, side out. (Tobias Herro: 1 personal fouls)

[02:57] Team_094 possession (Score: 118-102)
Kevin Rozier attempts a 3Pt. Wide open! Ja Simmons is 6.2 feet away. [MAN] Kevin Rozier misses. Offensive rebound by Isaiah Quickley! Isaiah Quickley kicks it out.

[02:39] Team_094 possession (Score: 118-102)
Domantas Haliburton attempts a 3Pt. Contested by Austin Smith (4.8 feet, MAN). Domantas Haliburton misses. Rebound secured by Devin Cunningham.

[02:28] Team_064 possession (Score: 118-102)
Ja Simmons attempts a Midrange. Contested by Domantas Haliburton (5.8 feet, ZONE). Ja Simmons misses. Rebound secured by Isaiah Quickley.

[02:14] Team_094 possession (Score: 118-102)
Domantas Haliburton attempts a 3Pt. Contested by Austin Smith (4.9 feet, MAN). Domantas Haliburton misses. Rebound secured by Ja Simmons.

[01:58] Team_064 possession (Score: 118-102)
FOUL! Reach-in foul on Domantas Haliburton during the drive. [Team fouls: 3] No free throws, side out. (Domantas Haliburton: 1 personal fouls)

[01:44] Team_064 possession (Score: 118-102)
Ja Simmons attempts a 3Pt. Contested by Kevin Rozier (5.1 feet, MAN). Ja Simmons misses. FOUL! Loose ball foul on Isaiah Quickley during the rebound battle. [Team fouls: 4] No free throws, side out. (Isaiah Quickley: 2 personal fouls)

[01:27] Team_064 possession (Score: 118-102)
Austin Smith attempts a Midrange. Contested by Domantas Haliburton (5.7 feet, MAN). AUSTIN SMITH MAKES IT!
Score: 118-104

[01:13] Team_094 possession (Score: 118-104)
Kevin Rozier makes the Dunk and draws the foul on Tobias Herro! And-1! Kevin Rozier to the line for 1. [BONUS: 5 team fouls] (Tobias Herro: 2 personal fouls)   FT 1/1: GOOD Kevin Rozier makes 1/1 from the line.
Score: 121-104

[01:01] Team_064 possession (Score: 121-104)
Austin Smith makes the Dunk and draws the foul on Domantas Haliburton! And-1! Austin Smith to the line for 1. [BONUS: 5 team fouls] (Domantas Haliburton: 2 personal fouls)   FT 1/1: GOOD Austin Smith makes 1/1 from the line.
Score: 121-107

[00:49] Team_094 possession (Score: 121-107)
Shaquille Bryant attempts a 3Pt. Contested by Austin Smith (4.6 feet, ZONE). SHAQUILLE BRYANT MAKES IT! Assist: Isaiah Quickley
Score: 124-107

[00:34] Team_064 possession (Score: 124-107)
Austin Smith attempts a 3Pt. Contested by Domantas Haliburton (5.7 feet, ZONE). AUSTIN SMITH MAKES IT! Assist: Tobias Herro
Score: 124-110

[00:18] Team_094 possession (Score: 124-110)
Isaiah Quickley attempts a Midrange. Contested by Austin Smith (5.2 feet, ZONE). ISAIAH QUICKLEY MAKES IT!
Score: 126-110

[00:07] Team_064 possession (Score: 126-110)
Ja Simmons attempts a 3Pt. Contested by Ayo Gasol (5.3 feet, ZONE). Ja Simmons misses. Rebound secured by Isaiah Quickley.

================================================================================
                              4TH QUARTER COMPLETE                              
================================================================================

4TH QUARTER SCORE: Team_094 26, Team_064 32

BOX SCORE:
================================================================================

Team_094
--------------------------------------------------------------------------------
Player                MIN  PTS  REB  AST  TO      FG   FG%      3P   3P%
--------------------------------------------------------------------------------
Ayo Gasol              12    8    2    1   0   3/4    75.0     0/0   0.0
Domantas Haliburton    12    7    2    1   0   3/5    60.0     0/0   0.0
Kevin Rozier           12    6    0    0   0   2/3    66.7     0/0   0.0
Shaquille Bryant       12    3    0    1   0   1/3    33.3     0/0   0.0
Isaiah Quickley        12    2    3    2   0   1/4    25.0     0/0   0.0

TEAM: FG: 10/19 (52.6%), 3PT: 5/10 (50.0%), REB: 7 (1 off, 6 def), AST: 5, TO: 2
TEAM FOULS: 5 [Team_064 in BONUS]


Team_064
--------------------------------------------------------------------------------
Player                MIN  PTS  REB  AST  TO      FG   FG%      3P   3P%
--------------------------------------------------------------------------------
Austin Smith           12   14    3    1   0   6/7    85.7     0/0   0.0
Tobias Herro           12    7    0    1   0   3/4    75.0     0/0   0.0
CJ Haliburton          12    6    0    2   0   3/4    75.0     0/0   0.0
Devin Cunningham       12    3    4    2   0   1/2    50.0     0/0   0.0
Ja Simmons             12    2    5    1   0   1/3    33.3     0/0   0.0

TEAM: FG: 14/20 (70.0%), 3PT: 3/5 (60.0%), REB: 12 (3 off, 9 def), AST: 7, TO: 1
TEAM FOULS: 5 [Team_094 in BONUS]

================================================================================

================================================================================
                               FULL GAME COMPLETE                               
================================================================================

FINAL SCORE: Team_094 126, Team_064 110

SCORING BY QUARTER:
--------------------------------------------------------------------------------
Team                     Q1     Q2     Q3     Q4    FINAL
--------------------------------------------------------------------------------
Team_094                 40     33     27     26      126
Team_064                 25     26     27     32      110
--------------------------------------------------------------------------------

FULL GAME BOX SCORE:
================================================================================

Team_094
--------------------------------------------------------------------------------
Player                MIN  PTS  REB  AST  TO      FG   FG%      3P   3P%      FT STL BLK
--------------------------------------------------------------------------------
Terry Ingram           37   26    0    1   0  10/14   71.4   4/5    80.0   0/0     3   1
Lauri Thompson         37    9    0    1   3   5/12   41.7   2/4    50.0   6/9     0   0
Kobe Wagner            37   13    7    8   0  10/15   66.7   3/6    50.0   2/2     0   1
Tim Russell            37   16   15    3   1   8/12   66.7   2/3    66.7   7/10    2   0
Kobe Bryant            37   33   16    4   1   7/11   63.6   0/1     0.0   2/3     2   0
Shaquille Bryant       12    3    0    1   0   1/3    33.3   1/1   100.0   0/0     0   0
Kevin Rozier           12    6    0    0   0   2/3    66.7   1/2    50.0   1/1     0   0
Ayo Gasol              12    8    2    1   0   3/4    75.0   2/2   100.0   0/0     0   0
Domantas Haliburton    12    7    2    1   0   3/5    60.0   1/3    33.3   2/2     0   0
Isaiah Quickley        12    2    3    2   1   1/4    25.0   0/2     0.0   0/0     0   0

TEAM: FG: 52/85 (61.2%), 3PT: 16/29 (55.2%), REB: 44 (11 off, 33 def), AST: 22, TO: 6


Team_064
--------------------------------------------------------------------------------
Player                MIN  PTS  REB  AST  TO      FG   FG%      3P   3P%      FT STL BLK
--------------------------------------------------------------------------------
Ja Mitchell            37    9    0    4   2   5/13   38.5   1/5    20.0   1/2     0   1
Jordan Mitchell        37   21    1    2   2  11/17   64.7   1/6    16.7   2/3     0   0
Kawhi Irving           37   18   11    3   0   6/9    66.7   0/1     0.0   7/8     0   0
Russell Simons         37    8   13    2   1   5/10   50.0   0/2     0.0   0/0     1   1
Shai Hyland            37   19    3    5   2   8/14   57.1   0/3     0.0   5/6     0   0
CJ Haliburton          12    6    0    2   0   3/4    75.0   0/0     0.0   0/0     0   0
Ja Simmons             12    2    5    1   0   1/3    33.3   0/1     0.0   0/0     0   0
Tobias Herro           12    7    0    1   0   2/3    66.7   1/2    50.0   0/0     0   0
Austin Smith           12   14    3    1   1   6/7    85.7   1/1   100.0   1/1     0   0
Devin Cunningham       12    3    4    2   0   2/3    66.7   1/1   100.0   0/0     0   0

TEAM: FG: 49/83 (59.0%), 3PT: 5/22 (22.7%), REB: 40 (7 off, 33 def), AST: 23, TO: 8

================================================================================
