================================================================================
                        FULL GAME - Team_029 vs Team_032                        
================================================================================

================================================================================
                       1ST QUARTER - Team_029 vs Team_032                       
================================================================================

[12:00] Team_029 possession (Score: 0-0)
Devin Butler drives, Malcolm Lillard stays with him. Devin Butler attempts a Layup. Contested by Malcolm Lillard (5.1 feet, ZONE). DEVIN BUTLER MAKES IT!
Score: 2-0

[11:44] Team_032 possession (Score: 2-0)
DeMar Giddey attempts a Midrange. Contested by Scottie Bird (3.4 feet, ZONE). DeMar Giddey misses. Rebound secured by Giannis Banchero.

[11:32] Team_029 possession (Score: 2-0)
James Wall attempts a 3Pt. Contested by Tobias Bane (4.9 feet, ZONE). James Wall misses. FOUL! Loose ball foul on Tobias Bane during the rebound battle. [Team fouls: 1] No free throws, side out. (Tobias Bane: 1 personal fouls)

[11:13] Team_029 possession (Score: 2-0)
Giannis Banchero drives and kicks out. Scottie Bird attempts a 3Pt. Contested by Tobias Bane (4.3 feet, ZONE). Scottie Bird misses. Rebound secured by Malcolm Lillard.

[10:58] Team_032 possession (Score: 2-0)
DeMar Giddey attempts a 3Pt. Contested by Giannis Banchero (3.9 feet, ZONE). DeMar Giddey misses. Rebound secured by James Wall.

[10:43] Team_029 possession (Score: 2-0)
FOUL! Holding foul on DeMar Giddey. [Team fouls: 2] No free throws, side out. (DeMar Giddey: 1 personal fouls)

[10:27] Team_029 possession (Score: 2-0)
Paul Iverson attempts a Midrange. Contested by Anfernee Butler (4.1 feet, ZONE). PAUL IVERSON MAKES IT!
Score: 4-0

[10:08] Team_032 possession (Score: 4-0)
DeMar Giddey drives to the basket... DeMar Giddey commits a violation (traveling/carry)! TURNOVER! (dead ball)

[09:55] Team_029 possession (Score: 4-0)
Scottie Bird attempts a 3Pt. Contested by Tobias Bane (4.7 feet, ZONE). Scottie Bird misses. FOUL! Loose ball foul on Anfernee Butler during the rebound battle. [Team fouls: 3] No free throws, side out. (Anfernee Butler: 1 personal fouls)

[09:38] Team_029 possession (Score: 4-0)
Giannis Banchero attempts a 3Pt. Contested by Tobias Bane (4.9 feet, ZONE). Giannis Banchero misses. FOUL! Loose ball foul on Anfernee Butler during the rebound battle. [Team fouls: 4] No free throws, side out. (Anfernee Butler: 2 personal fouls)

[09:20] Team_029 possession (Score: 4-0)
Devin Butler makes the Layup and draws the foul on DeMar Giddey! And-1! Devin Butler to the line for 1. [BONUS: 5 team fouls] (DeMar Giddey: 2 personal fouls)   FT 1/1: GOOD Devin Butler makes 1/1 from the line.
Score: 7-0

[09:09] Team_032 possession (Score: 7-0)
Jalen Westbrook drives and kicks out. FOUL! Shooting foul on Giannis Banchero. Jalen Westbrook to the line for 2 free throws. [Team fouls: 1] (Giannis Banchero: 1 personal fouls)   FT 1/2: GOOD   FT 2/2: GOOD Jalen Westbrook makes 2/2 from the line.
Score: 7-2

[08:57] Team_029 possession (Score: 7-2)
Scottie Bird drives and kicks out. Giannis Banchero makes the 3Pt and draws the foul on Jalen Westbrook! And-1! Giannis Banchero to the line for 1. [BONUS: 6 team fouls] (Jalen Westbrook: 1 personal fouls)   FT 1/1: GOOD Giannis Banchero makes 1/1 from the line.
Score: 11-2

[08:47] Team_032 possession (Score: 11-2)
Jalen Westbrook attempts a 3Pt. Contested by Giannis Banchero (3.8 feet, ZONE). JALEN WESTBROOK MAKES IT! Assist: DeMar Giddey
Score: 11-5

[08:32] Team_029 possession (Score: 11-5)
Devin Butler drives and kicks out. James Wall attempts a 3Pt. Contested by Anfernee Butler (3.8 feet, ZONE). James Wall misses. Rebound secured by Tobias Bane.

[08:22] Team_032 possession (Score: 11-5)
Malcolm Lillard makes the Layup and draws the foul on Devin Butler! And-1! Malcolm Lillard to the line for 1. [Team fouls: 2] (Devin Butler: 1 personal fouls)   FT 1/1: GOOD Malcolm Lillard makes 1/1 from the line.
Score: 11-8

[08:08] Team_029 possession (Score: 11-8)
James Wall attempts a 3Pt. Contested by Anfernee Butler (4.4 feet, MAN). James Wall misses. Offensive rebound by James Wall! James Wall's putback is no good. Rebound secured by Malcolm Lillard.

[07:52] Team_032 possession (Score: 11-8)
Anfernee Butler drives, James Wall stays with him. Anfernee Butler attempts a Layup. Contested by James Wall (2.3 feet, MAN). ANFERNEE BUTLER MAKES IT!
Score: 11-10

[07:39] Team_029 possession (Score: 11-10)
Devin Butler attempts a Layup. Contested by Malcolm Lillard (5.1 feet, ZONE). DEVIN BUTLER MAKES IT! Assist: Giannis Banchero
Score: 13-10

[07:26] Team_032 possession (Score: 13-10)
Malcolm Lillard makes the Layup and draws the foul on Devin Butler! And-1! Malcolm Lillard to the line for 1. [Team fouls: 3] (Devin Butler: 2 personal fouls)   FT 1/1: GOOD Malcolm Lillard makes 1/1 from the line.
Score: 13-13

[07:12] Team_029 possession (Score: 13-13)
Devin Butler drives and kicks out. Giannis Banchero attempts a Midrange. Contested by Jalen Westbrook (4.8 feet, MAN). Giannis Banchero misses. Offensive rebound by James Wall! James Wall's putback is no good. Offensive rebound by James Wall! James Wall kicks it out.

[06:57] Team_029 possession (Score: 13-13)
James Wall drives and kicks out. Devin Butler attempts a Midrange. Contested by Jalen Westbrook (4.8 feet, ZONE). DEVIN BUTLER MAKES IT! Assist: Giannis Banchero
Score: 15-13

[06:45] Team_032 possession (Score: 15-13)
DeMar Giddey attempts a 3Pt. Contested by James Wall (2.9 feet, ZONE). DeMar Giddey misses. Rebound secured by Giannis Banchero.

[06:32] Team_029 possession (Score: 15-13)
Paul Iverson attempts a 3Pt. Contested by Tobias Bane (4.6 feet, ZONE). Paul Iverson misses. Rebound secured by Malcolm Lillard.

[06:18] Team_032 possession (Score: 15-13)
Malcolm Lillard drives, picks up Devin Butler. Help arrives from Scottie Bird! Malcolm Lillard attempts a Dunk. Contested by Scottie Bird (4.4 feet, MAN). Malcolm Lillard misses. Rebound secured by Devin Butler.

[06:06] Team_029 possession (Score: 15-13)
Devin Butler attempts a 3Pt. Contested by Tobias Bane (4.8 feet, ZONE). Devin Butler misses. Rebound secured by Anfernee Butler.

[05:54] Team_032 possession (Score: 15-13)
Tobias Bane drives, picks up James Wall. Help arrives from Scottie Bird! Tobias Bane attempts a Dunk. Contested by Scottie Bird (2.8 feet, ZONE). TOBIAS BANE MAKES IT! Assist: DeMar Giddey
Score: 15-15

[05:39] Team_029 possession (Score: 15-15)
Devin Butler makes the Layup and draws the foul on Malcolm Lillard! And-1! Devin Butler to the line for 1. [BONUS: 7 team fouls] (Malcolm Lillard: 1 personal fouls)   FT 1/1: GOOD Devin Butler makes 1/1 from the line.
Score: 18-15

[05:28] Team_032 possession (Score: 18-15)
Jalen Westbrook drives and kicks out. DeMar Giddey attempts a 3Pt. Contested by Giannis Banchero (3.6 feet, ZONE). DeMar Giddey misses. Offensive rebound by Anfernee Butler! Anfernee Butler kicks it out.

[05:15] Team_032 possession (Score: 18-15)
Jalen Westbrook attempts a Midrange. Contested by Giannis Banchero (3.9 feet, MAN). Jalen Westbrook misses. Rebound secured by Devin Butler.

[05:02] Team_029 possession (Score: 18-15)
Paul Iverson attempts a 3Pt. Contested by Tobias Bane (4.6 feet, ZONE). Paul Iverson misses. Offensive rebound by Devin Butler! Devin Butler kicks it out.

[04:44] Team_029 possession (Score: 18-15)
James Wall drives to the basket... James Wall commits a violation (traveling/carry)! TURNOVER! (dead ball)

[04:32] Team_032 possession (Score: 18-15)
FOUL! Shooting foul on Giannis Banchero. DeMar Giddey to the line for 2 free throws. [Team fouls: 4] (Giannis Banchero: 2 personal fouls)   FT 1/2: GOOD   FT 2/2: GOOD DeMar Giddey makes 2/2 from the line.
Score: 18-17

[04:20] Team_029 possession (Score: 18-17)
Devin Butler drives to the basket... Devin Butler throws a bad pass! Stolen by Malcolm Lillard! TURNOVER! (live ball)

[04:08] Team_032 possession (Score: 18-17)
Tobias Bane makes the Layup and draws the foul on James Wall! And-1! Tobias Bane to the line for 1. [BONUS: 5 team fouls] (James Wall: 1 personal fouls)   FT 1/1: MISS Tobias Bane makes 0/1 from the line. Rebound secured by Devin Butler.
Score: 18-19

[03:51] Team_029 possession (Score: 18-19)
Paul Iverson attempts a 3Pt. Contested by Tobias Bane (4.7 feet, MAN). Paul Iverson misses. Offensive rebound by James Wall! James Wall puts it back in!
Score: 20-19

[03:34] Team_032 possession (Score: 20-19)
FOUL! Shooting foul on James Wall. DeMar Giddey to the line for 2 free throws. [BONUS: 6 team fouls] (James Wall: 2 personal fouls)   FT 1/2: GOOD   FT 2/2: GOOD DeMar Giddey makes 2/2 from the line.
Score: 20-21

[03:18] Team_029 possession (Score: 20-21)
Devin Butler attempts a 3Pt. Contested by Tobias Bane (5.0 feet, ZONE). Devin Butler misses. Offensive rebound by Devin Butler! Devin Butler kicks it out.

[03:06] Team_029 possession (Score: 20-21)
FOUL! Shooting foul on Malcolm Lillard. Devin Butler to the line for 2 free throws. [BONUS: 8 team fouls] (Malcolm Lillard: 2 personal fouls)   FT 1/2: MISS   FT 2/2: GOOD Devin Butler makes 1/2 from the line.
Score: 21-21

[02:48] Team_032 possession (Score: 21-21)
Jalen Westbrook attempts a 3Pt. Contested by Giannis Banchero (4.1 feet, MAN). Jalen Westbrook misses. Rebound secured by Giannis Banchero.

[02:33] Team_029 possession (Score: 21-21)
Devin Butler attempts a Midrange. Contested by DeMar Giddey (4.7 feet, ZONE). Devin Butler misses. Rebound secured by Tobias Bane.

[02:20] Team_032 possession (Score: 21-21)
DeMar Giddey attempts a 3Pt. Contested by Scottie Bird (3.7 feet, MAN). DeMar Giddey misses. Rebound secured by Devin Butler.

[02:07] Team_029 possession (Score: 21-21)
FOUL! Offensive foul on James Wall! Anfernee Butler drew the charge! [Team fouls: 7] (James Wall: 3 personal fouls) TURNOVER! (dead ball)

[01:51] Team_032 possession (Score: 21-21)
Jalen Westbrook attempts a 3Pt. Contested by Giannis Banchero (4.2 feet, ZONE). JALEN WESTBROOK MAKES IT! Assist: Malcolm Lillard
Score: 21-24

[01:36] Team_029 possession (Score: 21-24)
Scottie Bird drives and kicks out. FOUL! Shooting foul on Jalen Westbrook. Devin Butler to the line for 2 free throws. [BONUS: 9 team fouls] (Jalen Westbrook: 2 personal fouls)   FT 1/2: GOOD   FT 2/2: GOOD Devin Butler makes 2/2 from the line.
Score: 23-24

[01:26] Team_032 possession (Score: 23-24)
Anfernee Butler attempts a Midrange. Contested by James Wall (2.7 feet, MAN). Anfernee Butler misses. Offensive rebound by Anfernee Butler! Anfernee Butler kicks it out.

[01:09] Team_032 possession (Score: 23-24)
Anfernee Butler drives, James Wall stays with him. Anfernee Butler attempts a Dunk. Contested by James Wall (2.7 feet, MAN). ANFERNEE BUTLER MAKES IT! Assist: Jalen Westbrook
Score: 23-26

[00:56] Team_029 possession (Score: 23-26)
Devin Butler attempts a 3Pt. Contested by Jalen Westbrook (5.7 feet, ZONE). Devin Butler misses. Offensive rebound by Devin Butler! Devin Butler kicks it out.

[00:46] Team_029 possession (Score: 23-26)
Devin Butler attempts a 3Pt. Contested by Malcolm Lillard (5.4 feet, MAN). Devin Butler misses. Rebound secured by Tobias Bane.

[00:28] Team_032 possession (Score: 23-26)
Jalen Westbrook attempts a 3Pt. Contested by Giannis Banchero (4.4 feet, ZONE). Jalen Westbrook misses. Rebound secured by Giannis Banchero.

[00:19] Team_029 possession (Score: 23-26)
FOUL! Holding foul on Malcolm Lillard. [IN THE BONUS! 10 team fouls] Devin Butler to the line for 2 free throws. (Malcolm Lillard: 3 personal fouls)   FT 1/2: GOOD   FT 2/2: MISS Devin Butler makes 1/2 from the line. Rebound secured by Malcolm Lillard.
Score: 24-26

[00:01] Team_032 possession (Score: 24-26)
Anfernee Butler attempts a Midrange. Contested by Giannis Banchero (3.9 feet, ZONE). ANFERNEE BUTLER MAKES IT!
Score: 24-28

================================================================================
                              1ST QUARTER COMPLETE                              
================================================================================

1ST QUARTER SCORE: Team_029 24, Team_032 28

BOX SCORE:
================================================================================

Team_029
--------------------------------------------------------------------------------
Player                MIN  PTS  REB  AST  TO      FG   FG%      3P   3P%
--------------------------------------------------------------------------------
Devin Butler           12   15   10    0   0   7/11   63.6     0/0   0.0
Giannis Banchero       12    4    4    2   0   1/2    50.0     0/0   0.0
James Wall             12    2    3    0   0   1/2    50.0     0/0   0.0
Paul Iverson           12    2    0    0   0   1/2    50.0     0/0   0.0

TEAM: FG: 10/18 (55.6%), 3PT: 1/5 (20.0%), REB: 18 (9 off, 9 def), AST: 2, TO: 3
TEAM FOULS: 7 [Team_032 in BONUS]


Team_032
--------------------------------------------------------------------------------
Player                MIN  PTS  REB  AST  TO      FG   FG%      3P   3P%
--------------------------------------------------------------------------------
Jalen Westbrook        12    8    0    1   0   3/6    50.0     0/0   0.0
Malcolm Lillard        12    6    4    1   0   2/3    66.7     0/0   0.0
Anfernee Butler        12    6    3    0   0   3/3   100.0     0/0   0.0
DeMar Giddey           12    4    0    2   0   2/6    33.3     0/0   0.0
Tobias Bane            12    2    3    0   0   1/2    50.0     0/0   0.0

TEAM: FG: 11/20 (55.0%), 3PT: 2/7 (28.6%), REB: 9 (2 off, 7 def), AST: 4, TO: 1
TEAM FOULS: 10 [Team_029 in BONUS]

================================================================================

================================================================================
                       2ND QUARTER - Team_029 vs Team_032                       
================================================================================

[12:00] Team_029 possession (Score: 24-28)
Giannis Banchero attempts a Layup. Contested by Jalen Westbrook (5.7 feet, MAN). GIANNIS BANCHERO MAKES IT! Assist: James Wall
Score: 26-28

[11:45] Team_032 possession (Score: 26-28)
Jalen Westbrook attempts a 3Pt. Contested by Giannis Banchero (4.3 feet, ZONE). Jalen Westbrook misses. Rebound secured by Devin Butler.

[11:30] Team_029 possession (Score: 26-28)
Devin Butler drives to the basket... Devin Butler throws a bad pass out of bounds! TURNOVER! (dead ball)

[11:30] Substitution (Team_029): Paul Iverson OUT → Immanuel Irving IN (stamina_rule2)

[11:30] Substitution (Team_029): Scottie Bird OUT → Bones Carter IN (stamina_rule2)

[11:30] Substitution (Team_029): Giannis Banchero OUT → Pau Anthony IN (stamina_rule2)

[11:30] Substitution (Team_029): James Wall OUT → Derrick Rozier IN (stamina_rule2)

[11:30] Substitution (Team_029): Devin Butler OUT → Shai Ball IN (stamina_rule2)

[11:30] Substitution (Team_032): Tobias Bane OUT → Anfernee Griffin IN (stamina_rule2)

[11:30] Substitution (Team_032): DeMar Giddey OUT → Myles Herro IN (stamina_rule2)

[11:30] Substitution (Team_032): Jalen Westbrook OUT → Jrue Simmons IN (stamina_rule2)

[11:30] Substitution (Team_032): Anfernee Butler OUT → Jayson O'Neal IN (stamina_rule2)

[11:30] Substitution (Team_032): Malcolm Lillard OUT → Lauri Towns IN (stamina_rule2)

[11:18] Team_032 possession (Score: 26-28)
Jrue Simmons attempts a 3Pt. Contested by Pau Anthony (4.0 feet, ZONE). Jrue Simmons misses. Rebound secured by Pau Anthony.

[11:04] Team_029 possession (Score: 26-28)
Shai Ball throws a bad pass out of bounds! TURNOVER! (dead ball)

[10:50] Team_032 possession (Score: 26-28)
Lauri Towns attempts a 3Pt. Contested by Pau Anthony (3.9 feet, ZONE). Lauri Towns misses. Rebound secured by Pau Anthony.

[10:34] Team_029 possession (Score: 26-28)
Bones Carter attempts a 3Pt. Contested by Jrue Simmons (4.9 feet, ZONE). Bones Carter misses. Offensive rebound by Derrick Rozier! Derrick Rozier kicks it out.

[10:23] Team_029 possession (Score: 26-28)
Immanuel Irving drives to the basket... Immanuel Irving loses the ball! Stripped by Lauri Towns! TURNOVER! (live ball)

[10:07] Team_032 possession (Score: 26-28)
Jrue Simmons drives to the basket... Jrue Simmons loses the ball! Stripped by Pau Anthony! TURNOVER! (live ball)

[09:51] Team_029 possession (Score: 26-28)
Derrick Rozier drives and kicks out. Shai Ball attempts a 3Pt. Contested by Anfernee Griffin (5.1 feet, ZONE). Shai Ball misses. Rebound secured by Lauri Towns.

[09:40] Team_032 possession (Score: 26-28)
FOUL! Shooting foul on Derrick Rozier. Jayson O'Neal to the line for 2 free throws. [Team fouls: 1] (Derrick Rozier: 1 personal fouls)   FT 1/2: GOOD   FT 2/2: GOOD Jayson O'Neal makes 2/2 from the line.
Score: 26-30

[09:24] Team_029 possession (Score: 26-30)
Immanuel Irving drives to the basket... Immanuel Irving loses the ball! Stripped by Anfernee Griffin! TURNOVER! (live ball)

[09:12] Team_032 possession (Score: 26-30)
Jayson O'Neal drives and kicks out. Jrue Simmons attempts a 3Pt. Contested by Pau Anthony (3.7 feet, MAN). JRUE SIMMONS MAKES IT! Assist: Anfernee Griffin
Score: 26-33

[08:54] Team_029 possession (Score: 26-33)
FOUL! Offensive foul on Immanuel Irving! Anfernee Griffin drew the charge! [Team fouls: 2] (Immanuel Irving: 1 personal fouls) TURNOVER! (dead ball)

[08:39] Team_032 possession (Score: 26-33)
Myles Herro attempts a 3Pt. Contested by Bones Carter (5.4 feet, MAN). Myles Herro misses. Offensive rebound by Lauri Towns! Lauri Towns kicks it out.

[08:24] Team_032 possession (Score: 26-33)
FOUL! Offensive foul on Jrue Simmons! Pau Anthony drew the charge! [Team fouls: 1] (Jrue Simmons: 1 personal fouls) TURNOVER! (dead ball)

[08:13] Team_029 possession (Score: 26-33)
Shai Ball attempts a Midrange. Wide open! Myles Herro is 6.3 feet away. [ZONE] Shai Ball misses. Rebound secured by Lauri Towns.

[07:59] Team_032 possession (Score: 26-33)
Jayson O'Neal attempts a Layup. BLOCKED BY DERRICK ROZIER! Ball deflects out of bounds off Jayson O'Neal.

[07:46] Team_029 possession (Score: 26-33)
Bones Carter drives to the basket... Bones Carter throws a bad pass out of bounds! TURNOVER! (dead ball)

[07:32] Team_032 possession (Score: 26-33)
Myles Herro attempts a 3Pt. Contested by Bones Carter (5.4 feet, MAN). Myles Herro misses. Rebound secured by Pau Anthony.

[07:15] Team_029 possession (Score: 26-33)
Immanuel Irving attempts a Midrange. Contested by Anfernee Griffin (5.6 feet, MAN). Immanuel Irving misses. Rebound secured by Myles Herro.

[07:03] Team_032 possession (Score: 26-33)
Lauri Towns attempts a 3Pt. Contested by Pau Anthony (3.9 feet, ZONE). Lauri Towns misses. Rebound secured by Shai Ball.

[06:50] Team_029 possession (Score: 26-33)
Shai Ball attempts a Layup. Contested by Lauri Towns (5.7 feet, MAN). SHAI BALL MAKES IT!
Score: 28-33

[06:35] Team_032 possession (Score: 28-33)
Lauri Towns makes the Dunk and draws the foul on Bones Carter! And-1! Lauri Towns to the line for 1. [Team fouls: 3] (Bones Carter: 1 personal fouls)   FT 1/1: GOOD Lauri Towns makes 1/1 from the line.
Score: 28-36

[06:19] Team_029 possession (Score: 28-36)
Derrick Rozier attempts a Layup. Contested by Lauri Towns (5.7 feet, ZONE). Derrick Rozier misses. Rebound secured by Lauri Towns.

[06:02] Team_032 possession (Score: 28-36)
Anfernee Griffin drives to the basket... Anfernee Griffin throws a bad pass! Stolen by Derrick Rozier! TURNOVER! (live ball)

[05:48] Team_029 possession (Score: 28-36)
Immanuel Irving attempts a 3Pt. Contested by Anfernee Griffin (5.6 feet, MAN). Immanuel Irving misses. Rebound secured by Myles Herro.

[05:33] Team_032 possession (Score: 28-36)
Anfernee Griffin makes the Layup and draws the foul on Immanuel Irving! And-1! Anfernee Griffin to the line for 1. [Team fouls: 4] (Immanuel Irving: 2 personal fouls)   FT 1/1: GOOD Anfernee Griffin makes 1/1 from the line.
Score: 28-39

[05:19] Team_029 possession (Score: 28-39)
Derrick Rozier attempts a 3Pt. Contested by Anfernee Griffin (5.4 feet, ZONE). Derrick Rozier misses. Rebound secured by Jayson O'Neal.

[05:08] Team_032 possession (Score: 28-39)
Myles Herro drives, picks up Bones Carter. Help arrives from Pau Anthony! Myles Herro attempts a Dunk. Contested by Pau Anthony (5.4 feet, MAN). MYLES HERRO MAKES IT! Assist: Jayson O'Neal
Score: 28-41

[04:54] Team_029 possession (Score: 28-41)
Pau Anthony attempts a 3Pt. Contested by Anfernee Griffin (5.5 feet, ZONE). Pau Anthony misses. Rebound secured by Lauri Towns.

[04:39] Team_032 possession (Score: 28-41)
Anfernee Griffin attempts a Midrange. Contested by Immanuel Irving (4.9 feet, MAN). ANFERNEE GRIFFIN MAKES IT! Assist: Myles Herro
Score: 28-43

[04:19] Team_029 possession (Score: 28-43)
Derrick Rozier attempts a Layup. BLOCKED BY MYLES HERRO! Ball is loose! Rebound secured by Lauri Towns.

[04:03] Team_032 possession (Score: 28-43)
Lauri Towns attempts a Midrange. Contested by Pau Anthony (3.9 feet, ZONE). Lauri Towns misses. Rebound secured by Pau Anthony.

[03:46] Team_029 possession (Score: 28-43)
Bones Carter attempts a 3Pt. Contested by Anfernee Griffin (5.3 feet, ZONE). Bones Carter misses. Rebound secured by Jayson O'Neal.

[03:34] Team_032 possession (Score: 28-43)
Jayson O'Neal drives, picks up Derrick Rozier. Help arrives from Bones Carter! Jayson O'Neal attempts a Layup. Contested by Bones Carter (4.2 feet, MAN). JAYSON O'NEAL MAKES IT!
Score: 28-45

[03:18] Team_029 possession (Score: 28-45)
Immanuel Irving attempts a 3Pt. Contested by Anfernee Griffin (5.7 feet, ZONE). Immanuel Irving misses. Offensive rebound by Derrick Rozier! Derrick Rozier kicks it out.

[03:04] Team_029 possession (Score: 28-45)
Bones Carter attempts a Midrange. Contested by Jayson O'Neal (5.0 feet, ZONE). Bones Carter misses. Rebound secured by Lauri Towns.

[02:48] Team_032 possession (Score: 28-45)
Anfernee Griffin makes the Layup and draws the foul on Bones Carter! And-1! Anfernee Griffin to the line for 1. [BONUS: 5 team fouls] (Bones Carter: 2 personal fouls)   FT 1/1: MISS Anfernee Griffin makes 0/1 from the line. Offensive rebound by Jayson O'Neal! Jayson O'Neal puts it back in!
Score: 28-49

[02:35] Team_029 possession (Score: 28-49)
Bones Carter attempts a 3Pt. Wide open! Myles Herro is 6.3 feet away. [MAN] BONES CARTER MAKES IT! Assist: Pau Anthony
Score: 31-49

[02:20] Team_032 possession (Score: 31-49)
Jayson O'Neal makes the Layup and draws the foul on Derrick Rozier! And-1! Jayson O'Neal to the line for 1. [BONUS: 6 team fouls] (Derrick Rozier: 2 personal fouls)   FT 1/1: GOOD Jayson O'Neal makes 1/1 from the line.
Score: 31-52

[02:04] Team_029 possession (Score: 31-52)
Immanuel Irving attempts a 3Pt. Contested by Anfernee Griffin (5.8 feet, MAN). Immanuel Irving misses. Rebound secured by Lauri Towns.

[01:48] Team_032 possession (Score: 31-52)
Myles Herro drives and kicks out. Lauri Towns attempts a 3Pt. Contested by Shai Ball (4.0 feet, MAN). Lauri Towns misses. Offensive rebound by Lauri Towns! Lauri Towns kicks it out.

[01:34] Team_032 possession (Score: 31-52)
Jrue Simmons attempts a 3Pt. Contested by Pau Anthony (4.2 feet, ZONE). JRUE SIMMONS MAKES IT! Assist: Jayson O'Neal
Score: 31-55

[01:18] Team_029 possession (Score: 31-55)
Bones Carter drives to the basket... FOUL! Offensive foul on Bones Carter! Myles Herro drew the charge! [Team fouls: 7] (Bones Carter: 3 personal fouls) TURNOVER! (dead ball)

[01:01] Team_032 possession (Score: 31-55)
Myles Herro attempts a Midrange. Contested by Bones Carter (5.7 feet, MAN). Myles Herro misses. Rebound secured by Pau Anthony.

[00:44] Team_029 possession (Score: 31-55)
Bones Carter attempts a 3Pt. Contested by Anfernee Griffin (5.5 feet, ZONE). Bones Carter misses. Offensive rebound by Pau Anthony! Pau Anthony kicks it out.

[00:33] Team_029 possession (Score: 31-55)
Bones Carter attempts a Midrange. Contested by Jrue Simmons (5.2 feet, ZONE). BONES CARTER MAKES IT! Assist: Immanuel Irving
Score: 33-55

[00:16] Team_032 possession (Score: 33-55)
Lauri Towns attempts a Midrange. Contested by Shai Ball (4.4 feet, MAN). Lauri Towns misses. Rebound secured by Pau Anthony.

[00:04] Team_029 possession (Score: 33-55)
Pau Anthony attempts a 3Pt. Contested by Jrue Simmons (5.5 feet, MAN). Pau Anthony misses. Rebound secured by Myles Herro.

================================================================================
                              2ND QUARTER COMPLETE                              
================================================================================

2ND QUARTER SCORE: Team_029 9, Team_032 27

BOX SCORE:
================================================================================

Team_029
--------------------------------------------------------------------------------
Player                MIN  PTS  REB  AST  TO      FG   FG%      3P   3P%
--------------------------------------------------------------------------------
Bones Carter           11    5    0    0   0   2/4    50.0     0/0   0.0
Giannis Banchero       13    2    0    0   0   1/1   100.0     0/0   0.0
Shai Ball              11    2    1    0   0   1/2    50.0     0/0   0.0
James Wall             13    0    0    1   0   0/0     0.0     0/0   0.0
Devin Butler           13    0    1    0   0   0/0     0.0     0/0   0.0
Pau Anthony            11    0    7    1   0   0/2     0.0     0/0   0.0
Derrick Rozier         11    0    2    0   0   0/4     0.0     0/0   0.0
Immanuel Irving        11    0    0    1   0   0/3     0.0     0/0   0.0

TEAM: FG: 4/16 (25.0%), 3PT: 1/7 (14.3%), REB: 11 (3 off, 8 def), AST: 3, TO: 7
TEAM FOULS: 7 [Team_032 in BONUS]


Team_032
--------------------------------------------------------------------------------
Player                MIN  PTS  REB  AST  TO      FG   FG%      3P   3P%
--------------------------------------------------------------------------------
Jayson O'Neal          11   11    2    2   0   4/5    80.0     0/0   0.0
Jrue Simmons           11    6    0    0   0   2/3    66.7     0/0   0.0
Anfernee Griffin       11    5    0    1   0   2/2   100.0     0/0   0.0
Lauri Towns            11    3    9    0   0   1/5    20.0     0/0   0.0
Myles Herro            11    2    3    1   0   1/3    33.3     0/0   0.0
Jalen Westbrook        13    0    0    0   0   0/1     0.0     0/0   0.0

TEAM: FG: 10/19 (52.6%), 3PT: 1/6 (16.7%), REB: 14 (2 off, 12 def), AST: 4, TO: 3
TEAM FOULS: 1

================================================================================

================================================================================
                       3RD QUARTER - Team_029 vs Team_032                       
================================================================================

[12:00] Team_029 possession (Score: 33-55)
Paul Iverson attempts a 3Pt. Contested by Tobias Bane (4.6 feet, ZONE). PAUL IVERSON MAKES IT! Assist: Scottie Bird
Score: 36-55

[11:49] Team_032 possession (Score: 36-55)
FOUL! Shooting foul on Devin Butler. Malcolm Lillard to the line for 2 free throws. [Team fouls: 1] (Devin Butler: 1 personal fouls)   FT 1/2: GOOD   FT 2/2: GOOD Malcolm Lillard makes 2/2 from the line.
Score: 36-57

[11:36] Team_029 possession (Score: 36-57)
Paul Iverson drives and kicks out. Paul Iverson attempts a 3Pt. Contested by Tobias Bane (4.3 feet, MAN). PAUL IVERSON MAKES IT! Assist: Devin Butler
Score: 39-57

[11:22] Team_032 possession (Score: 39-57)
Tobias Bane drives to the basket... Tobias Bane commits a violation (traveling/carry)! TURNOVER! (dead ball)

[11:12] Team_029 possession (Score: 39-57)
Giannis Banchero drives and kicks out. Devin Butler attempts a Midrange. Contested by Malcolm Lillard (4.6 feet, MAN). Devin Butler misses. Rebound secured by Malcolm Lillard.

[11:00] Team_032 possession (Score: 39-57)
DeMar Giddey attempts a 3Pt. Contested by Scottie Bird (3.4 feet, MAN). DeMar Giddey misses. Rebound secured by Giannis Banchero.

[10:44] Team_029 possession (Score: 39-57)
FOUL! Reach-in foul on Malcolm Lillard during the drive. [Team fouls: 1] No free throws, side out. (Malcolm Lillard: 1 personal fouls)

[10:28] Team_029 possession (Score: 39-57)
James Wall makes the Layup and draws the foul on Malcolm Lillard! And-1! James Wall to the line for 1. [Team fouls: 2] (Malcolm Lillard: 2 personal fouls)   FT 1/1: GOOD James Wall makes 1/1 from the line.
Score: 42-57

[10:11] Team_032 possession (Score: 42-57)
FOUL! Shooting foul on Devin Butler. Tobias Bane to the line for 2 free throws. [Team fouls: 2] (Devin Butler: 2 personal fouls)   FT 1/2: GOOD   FT 2/2: GOOD Tobias Bane makes 2/2 from the line.
Score: 42-59

[09:54] Team_029 possession (Score: 42-59)
Paul Iverson attempts a Layup. BLOCKED BY TOBIAS BANE! Ball is loose! Offensive rebound by James Wall! James Wall kicks it out.

[09:41] Team_029 possession (Score: 42-59)
Scottie Bird attempts a 3Pt. Contested by Anfernee Butler (4.2 feet, ZONE). Scottie Bird misses. Rebound secured by Malcolm Lillard.

[09:30] Team_032 possession (Score: 42-59)
Anfernee Butler drives and kicks out. DeMar Giddey attempts a 3Pt. Contested by Scottie Bird (3.1 feet, MAN). DeMar Giddey misses. Rebound secured by James Wall.

[09:14] Team_029 possession (Score: 42-59)
Giannis Banchero attempts a 3Pt. Contested by Tobias Bane (4.9 feet, ZONE). Giannis Banchero misses. Rebound secured by Malcolm Lillard.

[09:02] Team_032 possession (Score: 42-59)
Tobias Bane drives and kicks out. Jalen Westbrook attempts a Midrange. Contested by Giannis Banchero (3.5 feet, MAN). Jalen Westbrook misses. Rebound secured by Giannis Banchero.

[08:51] Team_029 possession (Score: 42-59)
Paul Iverson attempts a Midrange. Contested by Tobias Bane (4.6 feet, MAN). PAUL IVERSON MAKES IT!
Score: 44-59

[08:39] Team_032 possession (Score: 44-59)
Jalen Westbrook attempts a Midrange. Contested by Giannis Banchero (3.8 feet, MAN). Jalen Westbrook misses. Rebound secured by Giannis Banchero.

[08:24] Team_029 possession (Score: 44-59)
James Wall attempts a Midrange. Contested by Anfernee Butler (4.4 feet, ZONE). James Wall misses. Rebound secured by Anfernee Butler.

[08:15] Team_032 possession (Score: 44-59)
FOUL! Shooting foul on Giannis Banchero. Tobias Bane to the line for 3 free throws. [Team fouls: 3] (Giannis Banchero: 1 personal fouls)   FT 1/3: GOOD   FT 2/3: GOOD   FT 3/3: GOOD Tobias Bane makes 3/3 from the line.
Score: 44-62

[08:05] Team_029 possession (Score: 44-62)
Scottie Bird attempts a Midrange. Contested by DeMar Giddey (4.2 feet, MAN). Scottie Bird misses. Offensive rebound by Devin Butler! Devin Butler kicks it out.

[07:51] Team_029 possession (Score: 44-62)
Scottie Bird attempts a 3Pt. Contested by Tobias Bane (4.7 feet, ZONE). Scottie Bird misses. Rebound secured by Tobias Bane.

[07:40] Team_032 possession (Score: 44-62)
DeMar Giddey throws a bad pass! Stolen by Scottie Bird! TURNOVER! (live ball)

[07:31] Team_029 possession (Score: 44-62)
Paul Iverson drives, picks up Tobias Bane. Help arrives from Jalen Westbrook! Paul Iverson attempts a Dunk. Contested by Jalen Westbrook (4.6 feet, MAN). PAUL IVERSON MAKES IT!
Score: 46-62

[07:21] Team_032 possession (Score: 46-62)
Anfernee Butler attempts a 3Pt. Contested by James Wall (2.3 feet, MAN). Anfernee Butler misses. Rebound secured by Giannis Banchero.

[07:06] Team_029 possession (Score: 46-62)
Devin Butler drives and kicks out. James Wall attempts a Midrange. Contested by Anfernee Butler (3.8 feet, MAN). James Wall misses. Rebound secured by Tobias Bane.

[06:51] Team_032 possession (Score: 46-62)
FOUL! Shooting foul on Giannis Banchero. DeMar Giddey to the line for 2 free throws. [Team fouls: 4] (Giannis Banchero: 2 personal fouls)   FT 1/2: GOOD   FT 2/2: GOOD DeMar Giddey makes 2/2 from the line.
Score: 46-64

[06:33] Team_029 possession (Score: 46-64)
FOUL! Shooting foul on Malcolm Lillard. James Wall to the line for 2 free throws. [Team fouls: 3] (Malcolm Lillard: 3 personal fouls)   FT 1/2: GOOD   FT 2/2: GOOD James Wall makes 2/2 from the line.
Score: 48-64

[06:15] Team_032 possession (Score: 48-64)
Tobias Bane makes the Layup and draws the foul on Paul Iverson! And-1! Tobias Bane to the line for 1. [BONUS: 5 team fouls] (Paul Iverson: 1 personal fouls)   FT 1/1: GOOD Tobias Bane makes 1/1 from the line.
Score: 48-67

[05:57] Team_029 possession (Score: 48-67)
Giannis Banchero drives and kicks out. Scottie Bird attempts a 3Pt. Contested by DeMar Giddey (3.9 feet, MAN). Scottie Bird misses. Rebound secured by Tobias Bane.

[05:43] Team_032 possession (Score: 48-67)
FOUL! Shooting foul on James Wall. Tobias Bane to the line for 2 free throws. [BONUS: 6 team fouls] (James Wall: 1 personal fouls)   FT 1/2: GOOD   FT 2/2: MISS Tobias Bane makes 1/2 from the line. Offensive rebound by Anfernee Butler! Anfernee Butler kicks it out.
Score: 48-68

[05:29] Team_032 possession (Score: 48-68)
Malcolm Lillard drives, picks up Devin Butler. Help arrives from Scottie Bird! Malcolm Lillard attempts a Dunk. Contested by Scottie Bird (4.5 feet, MAN). MALCOLM LILLARD MAKES IT! Assist: Anfernee Butler
Score: 48-70

[05:13] Team_029 possession (Score: 48-70)
Giannis Banchero attempts a 3Pt. Contested by Tobias Bane (5.0 feet, ZONE). Giannis Banchero misses. Offensive rebound by James Wall! James Wall puts it back in!
Score: 50-70

[04:56] Team_032 possession (Score: 50-70)
Jalen Westbrook attempts a Midrange. Contested by Paul Iverson (4.6 feet, ZONE). JALEN WESTBROOK MAKES IT! Assist: Anfernee Butler
Score: 50-72

[04:42] Team_029 possession (Score: 50-72)
Scottie Bird attempts a 3Pt. Contested by Tobias Bane (4.7 feet, ZONE). Scottie Bird misses. Rebound secured by Anfernee Butler.

[04:27] Team_032 possession (Score: 50-72)
Tobias Bane attempts a 3Pt. Contested by Giannis Banchero (3.9 feet, ZONE). TOBIAS BANE MAKES IT! Assist: DeMar Giddey
Score: 50-75

[04:12] Team_029 possession (Score: 50-75)
Devin Butler drives and kicks out. Scottie Bird attempts a 3Pt. Contested by DeMar Giddey (4.1 feet, MAN). Scottie Bird misses. Offensive rebound by James Wall! James Wall's putback is no good. Rebound secured by Malcolm Lillard.

[03:57] Team_032 possession (Score: 50-75)
Malcolm Lillard attempts a Midrange. Contested by James Wall (3.1 feet, ZONE). Malcolm Lillard misses. Offensive rebound by Anfernee Butler! Anfernee Butler kicks it out.

[03:44] Team_032 possession (Score: 50-75)
Anfernee Butler drives and kicks out. Jalen Westbrook attempts a Midrange. Contested by Giannis Banchero (3.8 feet, ZONE). JALEN WESTBROOK MAKES IT!
Score: 50-77

[03:33] Team_029 possession (Score: 50-77)
Giannis Banchero attempts a Layup. BLOCKED BY JALEN WESTBROOK! Ball goes out off Jalen Westbrook. Giannis Banchero's ball!

[03:18] Team_029 possession (Score: 50-77)
Giannis Banchero drives and kicks out. James Wall attempts a Midrange. Contested by Anfernee Butler (4.2 feet, MAN). James Wall misses. Rebound secured by Anfernee Butler.

[03:01] Team_032 possession (Score: 50-77)
Tobias Bane drives and kicks out. DeMar Giddey attempts a 3Pt. Contested by Giannis Banchero (3.9 feet, ZONE). DeMar Giddey misses. Rebound secured by Giannis Banchero.

[02:44] Team_029 possession (Score: 50-77)
Giannis Banchero attempts a Midrange. Contested by Jalen Westbrook (5.7 feet, MAN). Giannis Banchero misses. Rebound secured by Malcolm Lillard.

[02:30] Team_032 possession (Score: 50-77)
Anfernee Butler drives to the basket... Anfernee Butler throws a bad pass out of bounds! TURNOVER! (dead ball)

[02:30] Substitution (Team_029): Paul Iverson OUT → Immanuel Irving IN (stamina_rule2)

[02:30] Substitution (Team_029): Scottie Bird OUT → Bones Carter IN (stamina_rule2)

[02:30] Substitution (Team_029): Giannis Banchero OUT → Pau Anthony IN (stamina_rule2)

[02:30] Substitution (Team_029): Devin Butler OUT → Shai Ball IN (stamina_rule2)

[02:30] Substitution (Team_032): Tobias Bane OUT → Anfernee Griffin IN (stamina_rule2)

[02:30] Substitution (Team_032): DeMar Giddey OUT → Myles Herro IN (stamina_rule2)

[02:30] Substitution (Team_032): Jalen Westbrook OUT → Jrue Simmons IN (stamina_rule2)

[02:30] Substitution (Team_032): Anfernee Butler OUT → Jayson O'Neal IN (stamina_rule2)

[02:18] Team_029 possession (Score: 50-77)
Pau Anthony attempts a 3Pt. Contested by Anfernee Griffin (5.5 feet, ZONE). PAU ANTHONY MAKES IT! Assist: Immanuel Irving
Score: 53-77

[02:09] Team_032 possession (Score: 53-77)
FOUL! Offensive foul on Myles Herro! Bones Carter drew the charge! [Team fouls: 4] (Myles Herro: 1 personal fouls) TURNOVER! (dead ball)

[01:57] Team_029 possession (Score: 53-77)
Pau Anthony attempts a 3Pt. Contested by Jrue Simmons (5.2 feet, MAN). Pau Anthony misses. Rebound secured by Myles Herro.

[01:43] Team_032 possession (Score: 53-77)
Jrue Simmons loses the ball! Stripped by Pau Anthony! TURNOVER! (live ball)

[01:28] Team_029 possession (Score: 53-77)
Shai Ball drives, Malcolm Lillard stays with him. Shai Ball attempts a Dunk. Contested by Malcolm Lillard (5.3 feet, MAN). SHAI BALL MAKES IT!
Score: 55-77

[01:08] Team_032 possession (Score: 55-77)
Malcolm Lillard attempts a Midrange. Contested by James Wall (3.4 feet, ZONE). Malcolm Lillard misses. Rebound secured by Shai Ball.

[00:50] Team_029 possession (Score: 55-77)
Immanuel Irving attempts a 3Pt. Contested by Anfernee Griffin (5.6 feet, ZONE). IMMANUEL IRVING MAKES IT! Assist: James Wall
Score: 58-77

[00:34] Team_032 possession (Score: 58-77)
Jayson O'Neal attempts a 3Pt. Contested by Pau Anthony (3.9 feet, ZONE). Jayson O'Neal misses. Offensive rebound by Jayson O'Neal! Jayson O'Neal puts it back in!
Score: 58-79

[00:17] Team_029 possession (Score: 58-79)
Immanuel Irving attempts a 3Pt. Contested by Anfernee Griffin (5.6 feet, ZONE). Immanuel Irving misses. FOUL! Loose ball foul on Jayson O'Neal during the rebound battle. [IN THE BONUS! 5 team fouls] James Wall to the line for 2 free throws. (Jayson O'Neal: 1 personal fouls)   FT 1/2: GOOD   FT 2/2: GOOD James Wall makes 2/2 from the line.
Score: 60-79

[00:05] Team_032 possession (Score: 60-79)
Myles Herro attempts a 3Pt. Contested by Pau Anthony (3.6 feet, ZONE). Myles Herro misses. Rebound secured by James Wall.

================================================================================
                              3RD QUARTER COMPLETE                              
================================================================================

3RD QUARTER SCORE: Team_029 27, Team_032 24

BOX SCORE:
================================================================================

Team_029
--------------------------------------------------------------------------------
Player                MIN  PTS  REB  AST  TO      FG   FG%      3P   3P%
--------------------------------------------------------------------------------
Paul Iverson           23   10    0    0   0   4/4   100.0     0/0   0.0
James Wall             25    9    4    1   0   4/5    80.0     0/0   0.0
Pau Anthony            14    3    0    0   0   1/2    50.0     0/0   0.0
Immanuel Irving        14    3    0    1   0   1/1   100.0     0/0   0.0
Shai Ball              14    2    1    0   0   1/1   100.0     0/0   0.0
Scottie Bird           23    0    0    1   0   0/3     0.0     0/0   0.0
Devin Butler           23    0    1    1   0   0/2     0.0     0/0   0.0
Giannis Banchero       23    0    5    0   0   0/5     0.0     0/0   0.0

TEAM: FG: 11/23 (47.8%), 3PT: 5/10 (50.0%), REB: 12 (4 off, 8 def), AST: 4, TO: 0
TEAM FOULS: 6 [Team_032 in BONUS]


Team_032
--------------------------------------------------------------------------------
Player                MIN  PTS  REB  AST  TO      FG   FG%      3P   3P%
--------------------------------------------------------------------------------
Tobias Bane            23   11    3    0   0   4/6    66.7     0/0   0.0
Malcolm Lillard        25    4    5    0   0   2/3    66.7     0/0   0.0
Jalen Westbrook        23    4    0    0   0   2/3    66.7     0/0   0.0
DeMar Giddey           23    2    0    1   0   1/2    50.0     0/0   0.0
Jayson O'Neal          14    2    1    0   0   1/1   100.0     0/0   0.0
Anfernee Butler        23    0    5    2   0   0/2     0.0     0/0   0.0
Myles Herro            14    0    1    0   0   0/1     0.0     0/0   0.0

TEAM: FG: 10/18 (55.6%), 3PT: 3/6 (50.0%), REB: 14 (3 off, 11 def), AST: 3, TO: 5
TEAM FOULS: 5 [Team_029 in BONUS]

================================================================================

================================================================================
                       4TH QUARTER - Team_029 vs Team_032                       
================================================================================

[12:00] Substitution (Team_029): Paul Iverson OUT (stamina: 80) → Immanuel Irving IN (comeback_detected)

[12:00] Substitution (Team_032): Tobias Bane OUT (stamina: 79) → Anfernee Griffin IN (comeback_detected)

[12:00] Team_029 possession (Score: 60-79)
Devin Butler attempts a Layup. Contested by Malcolm Lillard (5.4 feet, MAN). Devin Butler misses. Rebound secured by DeMar Giddey.

[11:47] Team_032 possession (Score: 60-79)
Jalen Westbrook attempts a 3Pt. Contested by Giannis Banchero (3.9 feet, MAN). Jalen Westbrook misses. Rebound secured by James Wall.

[11:32] Team_029 possession (Score: 60-79)
Immanuel Irving attempts a 3Pt. Contested by Anfernee Griffin (5.6 feet, MAN). Immanuel Irving misses. Rebound secured by DeMar Giddey.

[11:20] Team_032 possession (Score: 60-79)
DeMar Giddey attempts a 3Pt. Contested by Giannis Banchero (4.0 feet, ZONE). DeMar Giddey misses. Rebound secured by James Wall.

[11:08] Team_029 possession (Score: 60-79)
James Wall loses the ball! Stripped by Anfernee Butler! TURNOVER! (live ball)

[10:51] Team_032 possession (Score: 60-79)
Anfernee Griffin attempts a 3Pt. Contested by Giannis Banchero (3.4 feet, ZONE). Anfernee Griffin misses. Rebound secured by Giannis Banchero.

[10:38] Team_029 possession (Score: 60-79)
FOUL! Reach-in foul on Malcolm Lillard during the drive. [Team fouls: 1] No free throws, side out. (Malcolm Lillard: 1 personal fouls)

[10:23] Team_029 possession (Score: 60-79)
FOUL! Shooting foul on Anfernee Butler. Immanuel Irving to the line for 2 free throws. [Team fouls: 2] (Anfernee Butler: 1 personal fouls)   FT 1/2: GOOD   FT 2/2: MISS Immanuel Irving makes 1/2 from the line. Rebound secured by Malcolm Lillard.
Score: 61-79

[10:10] Team_032 possession (Score: 61-79)
Anfernee Butler attempts a 3Pt. Contested by Giannis Banchero (3.4 feet, ZONE). ANFERNEE BUTLER MAKES IT! Assist: DeMar Giddey
Score: 61-82

[09:59] Team_029 possession (Score: 61-82)
Scottie Bird drives to the basket... Scottie Bird throws a bad pass out of bounds! TURNOVER! (dead ball)

[09:59] Substitution (Team_029): Giannis Banchero OUT → Pau Anthony IN (stamina_rule2)

[09:59] Substitution (Team_029): James Wall OUT → Derrick Rozier IN (stamina_rule2)

[09:59] Substitution (Team_032): Jalen Westbrook OUT → Jrue Simmons IN (stamina_rule2)

[09:59] Substitution (Team_032): Anfernee Butler OUT → Jayson O'Neal IN (stamina_rule2)

[09:59] Substitution (Team_032): Malcolm Lillard OUT → Lauri Towns IN (stamina_rule2)

[09:39] Team_032 possession (Score: 61-82)
Lauri Towns drives and kicks out. Lauri Towns attempts a Midrange. Contested by Scottie Bird (3.4 feet, ZONE). LAURI TOWNS MAKES IT! Assist: Jayson O'Neal
Score: 61-84

[09:23] Team_029 possession (Score: 61-84)
Derrick Rozier drives, Lauri Towns stays with him. Derrick Rozier attempts a Dunk. Contested by Lauri Towns (5.7 feet, ZONE). DERRICK ROZIER MAKES IT!
Score: 63-84

[09:14] Team_032 possession (Score: 63-84)
DeMar Giddey attempts a 3Pt. Contested by Scottie Bird (3.7 feet, MAN). DEMAR GIDDEY MAKES IT! Assist: Jrue Simmons
Score: 63-87

[08:59] Team_029 possession (Score: 63-87)
FOUL! Reach-in foul on Anfernee Griffin during the drive. [Team fouls: 3] No free throws, side out. (Anfernee Griffin: 1 personal fouls)

[08:42] Team_029 possession (Score: 63-87)
Devin Butler attempts a 3Pt. BLOCKED BY JRUE SIMMONS! Ball deflects out of bounds off Devin Butler.

[08:29] Team_032 possession (Score: 63-87)
Lauri Towns drives, Derrick Rozier stays with him. Lauri Towns attempts a Layup. Contested by Derrick Rozier (4.1 feet, ZONE). Lauri Towns misses. Offensive rebound by Jayson O'Neal! Jayson O'Neal puts it back in!
Score: 63-89

[08:15] Team_029 possession (Score: 63-89)
FOUL! Shooting foul on Lauri Towns. Scottie Bird to the line for 2 free throws. [Team fouls: 4] (Lauri Towns: 1 personal fouls)   FT 1/2: GOOD   FT 2/2: GOOD Scottie Bird makes 2/2 from the line.
Score: 65-89

[07:56] Team_032 possession (Score: 65-89)
Anfernee Griffin attempts a 3Pt. Contested by Pau Anthony (3.4 feet, ZONE). Anfernee Griffin misses. Offensive rebound by Lauri Towns! Lauri Towns kicks it out.

[07:42] Team_032 possession (Score: 65-89)
Jrue Simmons attempts a Midrange. Contested by Pau Anthony (4.0 feet, MAN). Jrue Simmons misses. Rebound secured by Devin Butler.

[07:23] Team_029 possession (Score: 65-89)
Pau Anthony drives, picks up Jrue Simmons. Help arrives from DeMar Giddey! Pau Anthony attempts a Layup. Contested by DeMar Giddey (5.2 feet, MAN). PAU ANTHONY MAKES IT!
Score: 67-89

[07:12] Team_032 possession (Score: 67-89)
Jrue Simmons attempts a 3Pt. Contested by Derrick Rozier (4.2 feet, ZONE). Jrue Simmons misses. Rebound secured by Pau Anthony.

[06:56] Team_029 possession (Score: 67-89)
Devin Butler attempts a 3Pt. Contested by Lauri Towns (5.8 feet, MAN). DEVIN BUTLER MAKES IT!
Score: 70-89

[06:44] Team_032 possession (Score: 70-89)
DeMar Giddey attempts a 3Pt. Contested by Derrick Rozier (4.1 feet, ZONE). DeMar Giddey misses. Rebound secured by Pau Anthony.

[06:31] Team_029 possession (Score: 70-89)
Immanuel Irving attempts a Midrange. Contested by Anfernee Griffin (5.7 feet, MAN). Immanuel Irving misses. Rebound secured by Jayson O'Neal.

[06:15] Team_032 possession (Score: 70-89)
Jayson O'Neal attempts a 3Pt. Contested by Derrick Rozier (4.1 feet, MAN). JAYSON O'NEAL MAKES IT! Assist: DeMar Giddey
Score: 70-92

[06:05] Team_029 possession (Score: 70-92)
Derrick Rozier attempts a Layup. Contested by Lauri Towns (5.7 feet, ZONE). Derrick Rozier misses. FOUL! Loose ball foul on Jrue Simmons during the rebound battle. [IN THE BONUS! 5 team fouls] Pau Anthony to the line for 2 free throws. (Jrue Simmons: 1 personal fouls)   FT 1/2: GOOD   FT 2/2: GOOD Pau Anthony makes 2/2 from the line.
Score: 72-92

[05:48] Team_032 possession (Score: 72-92)
Jrue Simmons attempts a 3Pt. Contested by Pau Anthony (4.0 feet, ZONE). Jrue Simmons misses. Rebound secured by Devin Butler.

[05:31] Team_029 possession (Score: 72-92)
Scottie Bird attempts a Layup. Contested by DeMar Giddey (4.9 feet, MAN). Scottie Bird misses. Offensive rebound by Derrick Rozier! Derrick Rozier kicks it out.

[05:15] Team_029 possession (Score: 72-92)
Derrick Rozier attempts a Layup. Contested by Jayson O'Neal (5.0 feet, MAN). Derrick Rozier misses. Offensive rebound by Derrick Rozier! Derrick Rozier kicks it out.

[04:55] Team_029 possession (Score: 72-92)
Scottie Bird attempts a Midrange. Contested by Jrue Simmons (5.0 feet, ZONE). SCOTTIE BIRD MAKES IT! Assist: Derrick Rozier
Score: 74-92

[04:37] Team_032 possession (Score: 74-92)
DeMar Giddey attempts a Layup. Contested by Derrick Rozier (4.1 feet, ZONE). DeMar Giddey misses. Rebound secured by Devin Butler.

[04:22] Team_029 possession (Score: 74-92)
FOUL! Shooting foul on Jrue Simmons. Pau Anthony to the line for 2 free throws. [BONUS: 6 team fouls] (Jrue Simmons: 2 personal fouls)   FT 1/2: GOOD   FT 2/2: GOOD Pau Anthony makes 2/2 from the line.
Score: 76-92

[04:10] Team_032 possession (Score: 76-92)
Jrue Simmons drives, Derrick Rozier stays with him. Jrue Simmons attempts a Dunk. Contested by Derrick Rozier (4.2 feet, ZONE). JRUE SIMMONS MAKES IT! Assist: DeMar Giddey
Score: 76-94

[03:59] Team_029 possession (Score: 76-94)
Derrick Rozier throws a bad pass! Stolen by Jayson O'Neal! TURNOVER! (live ball)

[03:42] Team_032 possession (Score: 76-94)
DeMar Giddey attempts a 3Pt. Contested by Scottie Bird (4.5 feet, MAN). DeMar Giddey misses. Offensive rebound by Lauri Towns! Lauri Towns kicks it out.

[03:32] Team_032 possession (Score: 76-94)
Jayson O'Neal drives, Derrick Rozier stays with him. Jayson O'Neal attempts a Dunk. Contested by Derrick Rozier (4.1 feet, ZONE). Jayson O'Neal misses. Offensive rebound by Lauri Towns! Lauri Towns kicks it out.

[03:21] Team_032 possession (Score: 76-94)
DeMar Giddey attempts a Midrange. Contested by Scottie Bird (4.5 feet, MAN). DeMar Giddey misses. Rebound secured by Derrick Rozier.

[03:06] Team_029 possession (Score: 76-94)
Pau Anthony drives to the basket... Pau Anthony throws a bad pass! Stolen by Jrue Simmons! TURNOVER! (live ball)

[02:55] Team_032 possession (Score: 76-94)
DeMar Giddey attempts a Midrange. Contested by Scottie Bird (4.6 feet, MAN). DeMar Giddey misses. Rebound secured by Derrick Rozier.

[02:40] Team_029 possession (Score: 76-94)
Devin Butler attempts a 3Pt. Contested by Lauri Towns (5.7 feet, MAN). Devin Butler misses. Offensive rebound by Pau Anthony! Pau Anthony kicks it out.

[02:26] Team_029 possession (Score: 76-94)
FOUL! Shooting foul on Jrue Simmons. Devin Butler to the line for 2 free throws. [BONUS: 7 team fouls] (Jrue Simmons: 3 personal fouls)   FT 1/2: GOOD   FT 2/2: MISS Devin Butler makes 1/2 from the line. Offensive rebound by Pau Anthony! Pau Anthony kicks it out.
Score: 77-94

[02:12] Team_029 possession (Score: 77-94)
FOUL! Reach-in foul on Lauri Towns during the drive. [IN THE BONUS! 8 team fouls] Devin Butler to the line for 2 free throws. (Lauri Towns: 2 personal fouls)   FT 1/2: GOOD   FT 2/2: MISS Devin Butler makes 1/2 from the line. Rebound secured by Lauri Towns.
Score: 78-94

[01:59] Team_032 possession (Score: 78-94)
Anfernee Griffin attempts a 3Pt. Contested by Immanuel Irving (5.4 feet, MAN). ANFERNEE GRIFFIN MAKES IT! Assist: DeMar Giddey
Score: 78-97

[01:45] Team_029 possession (Score: 78-97)
Derrick Rozier attempts a Midrange. Contested by Jayson O'Neal (5.3 feet, MAN). Derrick Rozier misses. Rebound secured by Lauri Towns.

[01:33] Team_032 possession (Score: 78-97)
Lauri Towns attempts a 3Pt. Contested by Devin Butler (5.8 feet, MAN). Lauri Towns misses. Rebound secured by Pau Anthony.

[01:16] Team_029 possession (Score: 78-97)
FOUL! Holding foul on Lauri Towns. [IN THE BONUS! 9 team fouls] Devin Butler to the line for 2 free throws. (Lauri Towns: 3 personal fouls)   FT 1/2: GOOD   FT 2/2: GOOD Devin Butler makes 2/2 from the line.
Score: 80-97

[01:01] Team_032 possession (Score: 80-97)
Jrue Simmons attempts a Layup. BLOCKED BY PAU ANTHONY! Ball is loose! Rebound secured by Derrick Rozier.

[00:50] Team_029 possession (Score: 80-97)
Pau Anthony attempts a 3Pt. Wide open! Anfernee Griffin is 6.1 feet away. [ZONE] PAU ANTHONY MAKES IT! Assist: Devin Butler
Score: 83-97

[00:35] Team_032 possession (Score: 83-97)
Anfernee Griffin commits a violation (traveling/carry)! TURNOVER! (dead ball)

[00:35] Substitution (Team_029): Scottie Bird OUT → Bones Carter IN (stamina_rule2)

[00:35] Substitution (Team_029): Devin Butler OUT → Shai Ball IN (stamina_rule2)

[00:35] Substitution (Team_029): Immanuel Irving OUT → Paul Iverson IN (starter_return_rule1)

[00:35] Substitution (Team_032): DeMar Giddey OUT → Myles Herro IN (stamina_rule2)

[00:35] Substitution (Team_032): Anfernee Griffin OUT → Tobias Bane IN (starter_return_rule1)

[00:23] Team_029 possession (Score: 83-97)
Shai Ball attempts a Layup. Wide open! Lauri Towns is 6.0 feet away. [MAN] SHAI BALL MAKES IT! Assist: Paul Iverson
Score: 85-97

[00:13] Team_032 possession (Score: 85-97)
Lauri Towns attempts a Layup. BLOCKED BY SHAI BALL! Ball deflects out of bounds off Lauri Towns.

================================================================================
                              4TH QUARTER COMPLETE                              
================================================================================

4TH QUARTER SCORE: Team_029 25, Team_032 18

BOX SCORE:
================================================================================

Team_029
--------------------------------------------------------------------------------
Player                MIN  PTS  REB  AST  TO      FG   FG%      3P   3P%
--------------------------------------------------------------------------------
Pau Anthony            24    9    5    0   0   4/4   100.0     0/0   0.0
Devin Butler           34    5    3    1   0   2/5    40.0     0/0   0.0
Scottie Bird           34    4    0    0   0   2/2   100.0     0/0   0.0
Derrick Rozier         21    2    5    1   0   1/2    50.0     0/0   0.0
Shai Ball              14    2    0    0   0   1/1   100.0     0/0   0.0
James Wall             27    0    2    0   0   0/0     0.0     0/0   0.0
Immanuel Irving        26    0    0    0   0   0/3     0.0     0/0   0.0
Giannis Banchero       25    0    1    0   0   0/0     0.0     0/0   0.0
Paul Iverson           23    0    0    1   0   0/0     0.0     0/0   0.0

TEAM: FG: 10/17 (58.8%), 3PT: 2/4 (50.0%), REB: 16 (4 off, 12 def), AST: 3, TO: 4
TEAM FOULS: 0


Team_032
--------------------------------------------------------------------------------
Player                MIN  PTS  REB  AST  TO      FG   FG%      3P   3P%
--------------------------------------------------------------------------------
Jayson O'Neal          24    5    2    1   0   2/2   100.0     0/0   0.0
DeMar Giddey           34    3    2    4   0   1/6    16.7     0/0   0.0
Anfernee Griffin       26    3    0    0   0   1/2    50.0     0/0   0.0
Anfernee Butler        25    3    0    0   0   1/1   100.0     0/0   0.0
Lauri Towns            21    2    5    0   0   1/3    33.3     0/0   0.0
Jrue Simmons           24    2    0    1   0   1/5    20.0     0/0   0.0
Jalen Westbrook        25    0    0    0   0   0/1     0.0     0/0   0.0
Malcolm Lillard        27    0    1    0   0   0/0     0.0     0/0   0.0

TEAM: FG: 7/20 (35.0%), 3PT: 4/11 (36.4%), REB: 10 (4 off, 6 def), AST: 6, TO: 1
TEAM FOULS: 9 [Team_029 in BONUS]

================================================================================

================================================================================
                               FULL GAME COMPLETE                               
================================================================================

FINAL SCORE: Team_029 85, Team_032 97

SCORING BY QUARTER:
--------------------------------------------------------------------------------
Team                     Q1     Q2     Q3     Q4    FINAL
--------------------------------------------------------------------------------
Team_029                 24      9     27     25       85
Team_032                 28     27     24     18       97
--------------------------------------------------------------------------------

FULL GAME BOX SCORE:
================================================================================

Team_029
--------------------------------------------------------------------------------
Player                MIN  PTS  REB  AST  TO      FG   FG%      3P   3P%      FT STL BLK
--------------------------------------------------------------------------------
Scottie Bird           34    4    0    1   1   4/7    57.1   0/3     0.0   2/2     1   0
Devin Butler           34   20   15    2   0   6/15   40.0   1/4    25.0  10/14    0   0
James Wall             27   11    9    2   2   3/5    60.0   0/1     0.0   5/5     0   0
Immanuel Irving        26    3    0    2   4   2/8    25.0   2/5    40.0   1/2     0   0
Giannis Banchero       25    6   10    2   2   2/8    25.0   1/2    50.0   1/1     0   0
Pau Anthony            24   12   12    1   0   4/7    57.1   2/5    40.0   4/4     2   1
Paul Iverson           23   12    0    1   0   6/7    85.7   2/3    66.7   0/0     0   0
Derrick Rozier         21    2    7    1   1   2/7    28.6   0/1     0.0   0/0     1   1
Bones Carter           14    5    0    0   1   2/4    50.0   1/2    50.0   0/0     0   0
Shai Ball              14    6    2    0   3   3/4    75.0   0/0     0.0   0/0     0   1

TEAM: FG: 35/74 (47.3%), 3PT: 9/26 (34.6%), REB: 57 (20 off, 37 def), AST: 12, TO: 14


Team_032
--------------------------------------------------------------------------------
Player                MIN  PTS  REB  AST  TO      FG   FG%      3P   3P%      FT STL BLK
--------------------------------------------------------------------------------
DeMar Giddey           34    9    2    7   2   4/14   28.6   1/7    14.3   6/6     0   0
Malcolm Lillard        27   10   10    1   1   4/6    66.7   0/0     0.0   4/4     1   0
Anfernee Griffin       26    8    0    1   1   4/5    80.0   1/2    50.0   1/2     1   0
Jalen Westbrook        25   12    0    1   1   4/10   40.0   2/6    33.3   2/2     0   1
Anfernee Butler        25    9    8    2   0   5/7    71.4   1/2    50.0   0/0     1   0
Jrue Simmons           24    8    0    1   2   2/7    28.6   1/4    25.0   0/0     1   1
Jayson O'Neal          24   18    6    3   1   6/7    85.7   2/2   100.0   3/3     1   0
Tobias Bane            23   13    6    0   0   5/8    62.5   2/2   100.0   7/9     0   1
Lauri Towns            21    5   14    0   1   3/9    33.3   0/3     0.0   1/1     1   0
Myles Herro            14    2    4    1   1   1/4    25.0   0/2     0.0   0/0     0   1

TEAM: FG: 38/77 (49.4%), 3PT: 10/30 (33.3%), REB: 47 (11 off, 36 def), AST: 17, TO: 10

================================================================================
