================================================================================
                        FULL GAME - Team_050 vs Team_005                        
================================================================================

================================================================================
                       1ST QUARTER - Team_050 vs Team_005                       
================================================================================

[12:00] Team_050 possession (Score: 0-0)
LeBron Bridges makes the Layup and draws the foul on Cade Markkanen! And-1! LeBron Bridges to the line for 1. [Team fouls: 1] (Cade Markkanen: 1 personal fouls)   FT 1/1: GOOD LeBron Bridges makes 1/1 from the line.
Score: 3-0

[11:43] Team_005 possession (Score: 3-0)
Derrick Allen attempts a 3Pt. Contested by Giannis LaVine (4.3 feet, ZONE). Derrick Allen misses. Rebound secured by Joel Banchero.

[11:32] Team_050 possession (Score: 3-0)
Giannis LaVine attempts a Layup. BLOCKED BY CADE MARKKANEN! Ball goes out off Cade Markkanen. Giannis LaVine's ball!

[11:18] Team_050 possession (Score: 3-0)
LeBron Bridges attempts a Midrange. Contested by Cade Markkanen (3.4 feet, ZONE). LeBron Bridges misses. Rebound secured by Cade Markkanen.

[11:07] Team_005 possession (Score: 3-0)
Anthony Rozier drives and kicks out. Derrick Allen attempts a 3Pt. Contested by Joel Banchero (4.3 feet, ZONE). Derrick Allen misses. Rebound secured by LeBron Bridges.

[10:54] Team_050 possession (Score: 3-0)
Donovan Trent drives, Cade Markkanen stays with him. Donovan Trent attempts a Layup. Contested by Cade Markkanen (3.0 feet, MAN). DONOVAN TRENT MAKES IT! Assist: Giannis LaVine
Score: 5-0

[10:35] Team_005 possession (Score: 5-0)
Cade Markkanen attempts a Layup. Contested by LeBron Bridges (4.0 feet, ZONE). CADE MARKKANEN MAKES IT! Assist: Brandon George
Score: 5-2

[10:19] Team_050 possession (Score: 5-2)
Joel Banchero throws a bad pass! Stolen by Anthony Rozier! TURNOVER! (live ball)

[10:00] Team_005 possession (Score: 5-2)
Brandon George attempts a 3Pt. Contested by Giannis LaVine (4.1 feet, MAN). Brandon George misses. Rebound secured by Collin Bane.

[09:46] Team_050 possession (Score: 5-2)
Donovan Trent drives, Cade Markkanen stays with him. Donovan Trent attempts a Dunk. Contested by Cade Markkanen (3.0 feet, MAN). DONOVAN TRENT MAKES IT! Assist: Collin Bane
Score: 7-2

[09:35] Team_005 possession (Score: 7-2)
Jalen Rozier drives to the basket... Jalen Rozier loses the ball! Stripped by LeBron Bridges! TURNOVER! (live ball)

[09:20] Team_050 possession (Score: 7-2)
FOUL! Reach-in foul on Cade Markkanen during the drive. [Team fouls: 2] No free throws, side out. (Cade Markkanen: 2 personal fouls)

[09:05] Team_050 possession (Score: 7-2)
Joel Banchero attempts a Layup. Contested by Anthony Rozier (4.4 feet, MAN). Joel Banchero misses. Rebound secured by Jalen Rozier.

[08:47] Team_005 possession (Score: 7-2)
Brandon George drives and kicks out. Jalen Rozier attempts a 3Pt. Contested by LeBron Bridges (4.2 feet, MAN). Jalen Rozier misses. Rebound secured by LeBron Bridges.

[08:29] Team_050 possession (Score: 7-2)
Joel Banchero attempts a Layup. BLOCKED BY ANTHONY ROZIER! Ball is loose! Rebound secured by Jalen Rozier.

[08:18] Team_005 possession (Score: 7-2)
Cade Markkanen drives to the basket... FOUL! Offensive foul on Cade Markkanen! Donovan Trent drew the charge! [Team fouls: 3] (Cade Markkanen: 3 personal fouls) TURNOVER! (dead ball)

[08:05] Team_050 possession (Score: 7-2)
FOUL! Reach-in foul on Cade Markkanen during the drive. [Team fouls: 4] No free throws, side out. (Cade Markkanen: 4 personal fouls)

[07:49] Team_050 possession (Score: 7-2)
Collin Bane attempts a Midrange. Contested by Cade Markkanen (3.4 feet, ZONE). Collin Bane misses. Offensive rebound by LeBron Bridges! LeBron Bridges kicks it out.

[07:37] Team_050 possession (Score: 7-2)
LeBron Bridges attempts a 3Pt. Contested by Derrick Allen (4.4 feet, ZONE). LeBron Bridges misses. Rebound secured by Derrick Allen.

[07:25] Team_005 possession (Score: 7-2)
Jalen Rozier attempts a Layup. Contested by LeBron Bridges (4.5 feet, MAN). JALEN ROZIER MAKES IT!
Score: 7-4

[07:13] Team_050 possession (Score: 7-4)
Giannis LaVine throws a bad pass! Stolen by Brandon George! TURNOVER! (live ball)

[06:57] Team_005 possession (Score: 7-4)
FOUL! Offensive foul on Jalen Rozier! LeBron Bridges drew the charge! [Team fouls: 5] (Jalen Rozier: 1 personal fouls) TURNOVER! (dead ball)

[06:40] Team_050 possession (Score: 7-4)
Giannis LaVine throws a bad pass out of bounds! TURNOVER! (dead ball)

[06:21] Team_005 possession (Score: 7-4)
FOUL! Offensive foul on Jalen Rozier! LeBron Bridges drew the charge! [Team fouls: 6] (Jalen Rozier: 2 personal fouls) TURNOVER! (dead ball)

[06:04] Team_050 possession (Score: 7-4)
Donovan Trent attempts a Layup. Contested by Jalen Rozier (4.7 feet, ZONE). DONOVAN TRENT MAKES IT! Assist: Giannis LaVine
Score: 9-4

[05:45] Team_005 possession (Score: 9-4)
Anthony Rozier attempts a Midrange. Contested by Joel Banchero (4.4 feet, ZONE). Anthony Rozier misses. Offensive rebound by Cade Markkanen! Cade Markkanen puts it back in!
Score: 9-6

[05:34] Team_050 possession (Score: 9-6)
Collin Bane drives to the basket... Collin Bane throws a bad pass! Stolen by Cade Markkanen! TURNOVER! (live ball)

[05:20] Team_005 possession (Score: 9-6)
Derrick Allen attempts a Layup. Contested by Collin Bane (4.5 feet, MAN). Derrick Allen misses. Rebound secured by LeBron Bridges.

[05:04] Team_050 possession (Score: 9-6)
Giannis LaVine drives to the basket... Giannis LaVine loses control! Ball rolls out of bounds! TURNOVER! (dead ball)

[04:51] Team_005 possession (Score: 9-6)
Cade Markkanen drives to the basket... FOUL! Offensive foul on Cade Markkanen! Donovan Trent drew the charge! [Team fouls: 7] (Cade Markkanen: 5 personal fouls) TURNOVER! (dead ball)

[04:34] Team_050 possession (Score: 9-6)
Joel Banchero attempts a 3Pt. Contested by Anthony Rozier (4.5 feet, MAN). JOEL BANCHERO MAKES IT! Assist: Giannis LaVine
Score: 12-6

[04:19] Team_005 possession (Score: 12-6)
Jalen Rozier attempts a Midrange. Contested by Collin Bane (4.5 feet, ZONE). Jalen Rozier misses. Rebound secured by Collin Bane.

[04:01] Team_050 possession (Score: 12-6)
Collin Bane attempts a Layup. BLOCKED BY CADE MARKKANEN! Ball is loose! Rebound secured by Cade Markkanen.

[03:43] Team_005 possession (Score: 12-6)
Jalen Rozier attempts a 3Pt. Contested by Giannis LaVine (4.3 feet, ZONE). Jalen Rozier misses. Rebound secured by Collin Bane.

[03:31] Team_050 possession (Score: 12-6)
Collin Bane attempts a Midrange. Contested by Derrick Allen (4.5 feet, MAN). COLLIN BANE MAKES IT!
Score: 14-6

[03:21] Team_005 possession (Score: 14-6)
Brandon George attempts a Layup. Contested by Giannis LaVine (4.2 feet, MAN). Brandon George misses. Rebound secured by Joel Banchero.

[03:11] Team_050 possession (Score: 14-6)
LeBron Bridges attempts a Layup. BLOCKED BY ANTHONY ROZIER! Ball deflects out of bounds off LeBron Bridges.

[02:55] Team_005 possession (Score: 14-6)
Jalen Rozier drives and kicks out. Jalen Rozier attempts a Midrange. Contested by LeBron Bridges (4.5 feet, MAN). Jalen Rozier misses. Rebound secured by Joel Banchero.

[02:44] Team_050 possession (Score: 14-6)
LeBron Bridges attempts a Midrange. Contested by Jalen Rozier (5.3 feet, MAN). LEBRON BRIDGES MAKES IT!
Score: 16-6

[02:33] Team_005 possession (Score: 16-6)
Anthony Rozier attempts a Layup. BLOCKED BY DONOVAN TRENT! Ball is loose! Rebound secured by Joel Banchero.

[02:15] Team_050 possession (Score: 16-6)
FOUL! Reach-in foul on Jalen Rozier during the drive. [IN THE BONUS! 8 team fouls] LeBron Bridges to the line for 2 free throws. (Jalen Rozier: 3 personal fouls)   FT 1/2: MISS   FT 2/2: MISS LeBron Bridges makes 0/2 from the line. Rebound secured by Derrick Allen.

[02:01] Team_005 possession (Score: 16-6)
Cade Markkanen makes the Layup and draws the foul on Joel Banchero! And-1! Cade Markkanen to the line for 1. [Team fouls: 1] (Joel Banchero: 1 personal fouls)   FT 1/1: MISS Cade Markkanen makes 0/1 from the line. Rebound secured by LeBron Bridges.
Score: 16-8

[01:45] Team_050 possession (Score: 16-8)
Donovan Trent attempts a Midrange. Contested by Cade Markkanen (3.5 feet, MAN). Donovan Trent misses. Rebound secured by Jalen Rozier.

[01:27] Team_005 possession (Score: 16-8)
Derrick Allen drives and kicks out. Anthony Rozier attempts a 3Pt. Contested by Joel Banchero (4.6 feet, MAN). ANTHONY ROZIER MAKES IT! Assist: Brandon George
Score: 16-11

[01:11] Team_050 possession (Score: 16-11)
Giannis LaVine attempts a Midrange. Contested by Brandon George (6.0 feet, MAN). Giannis LaVine misses. Rebound secured by Derrick Allen.

[00:59] Team_005 possession (Score: 16-11)
Jalen Rozier loses the ball! Stripped by LeBron Bridges! TURNOVER! (live ball)

[00:41] Team_050 possession (Score: 16-11)
Giannis LaVine drives to the basket... FOUL! Offensive foul on Giannis LaVine! Brandon George drew the charge! [Team fouls: 2] (Giannis LaVine: 1 personal fouls) TURNOVER! (dead ball)

[00:25] Team_005 possession (Score: 16-11)
Brandon George drives to the basket... Brandon George throws a bad pass out of bounds! TURNOVER! (dead ball)

[00:25] Substitution (Team_050): Giannis LaVine OUT → Damian O'Neal IN (stamina_rule2)

[00:25] Substitution (Team_050): Joel Banchero OUT → Dwyane Towns IN (stamina_rule2)

[00:25] Substitution (Team_050): Collin Bane OUT → Larry Curry IN (stamina_rule2)

[00:25] Substitution (Team_050): LeBron Bridges OUT → Luka Gasol IN (stamina_rule2)

[00:25] Substitution (Team_050): Donovan Trent OUT → Tyler Smith IN (stamina_rule2)

[00:25] Substitution (Team_005): Brandon George OUT → Blake O'Neal IN (stamina_rule2)

[00:25] Substitution (Team_005): Anthony Rozier OUT → Draymond Smith IN (stamina_rule2)

[00:25] Substitution (Team_005): Derrick Allen OUT → Lauri Wade IN (stamina_rule2)

[00:25] Substitution (Team_005): Jalen Rozier OUT → Isaiah Durant IN (stamina_rule2)

[00:25] Substitution (Team_005): Cade Markkanen OUT → Zion Parker IN (stamina_rule2)

[00:08] Team_050 possession (Score: 16-11)
Luka Gasol attempts a Midrange. Contested by Isaiah Durant (4.4 feet, MAN). LUKA GASOL MAKES IT! Assist: Tyler Smith
Score: 18-11

================================================================================
                              1ST QUARTER COMPLETE                              
================================================================================

1ST QUARTER SCORE: Team_050 18, Team_005 11

BOX SCORE:
================================================================================

Team_050
--------------------------------------------------------------------------------
Player                MIN  PTS  REB  AST  TO      FG   FG%      3P   3P%
--------------------------------------------------------------------------------
Donovan Trent          12    6    0    0   0   3/4    75.0     0/0   0.0
LeBron Bridges         12    5    5    0   0   2/6    33.3     0/0   0.0
Joel Banchero          12    3    4    0   0   1/3    33.3     0/0   0.0
Collin Bane            12    2    3    1   0   1/2    50.0     0/0   0.0
Luka Gasol              0    2    0    0   0   1/1   100.0     0/0   0.0
Giannis LaVine         12    0    0    3   0   0/1     0.0     0/0   0.0
Tyler Smith             0    0    0    1   0   0/0     0.0     0/0   0.0

TEAM: FG: 8/17 (47.1%), 3PT: 1/2 (50.0%), REB: 12 (1 off, 11 def), AST: 5, TO: 6
TEAM FOULS: 2


Team_005
--------------------------------------------------------------------------------
Player                MIN  PTS  REB  AST  TO      FG   FG%      3P   3P%
--------------------------------------------------------------------------------
Cade Markkanen         12    4    3    0   0   2/3    66.7     0/0   0.0
Anthony Rozier         12    3    0    0   0   1/3    33.3     0/0   0.0
Jalen Rozier           12    2    3    0   0   1/4    25.0     0/0   0.0
Derrick Allen          12    0    3    0   0   0/2     0.0     0/0   0.0
Brandon George         12    0    0    2   0   0/3     0.0     0/0   0.0

TEAM: FG: 4/15 (26.7%), 3PT: 0/3 (0.0%), REB: 9 (1 off, 8 def), AST: 2, TO: 7
TEAM FOULS: 8 [Team_050 in BONUS]

================================================================================

================================================================================
                       2ND QUARTER - Team_050 vs Team_005                       
================================================================================

[12:00] Team_050 possession (Score: 18-11)
LeBron Bridges drives, Cade Markkanen stays with him. LeBron Bridges attempts a Dunk. Contested by Cade Markkanen (3.8 feet, ZONE). LEBRON BRIDGES MAKES IT! Assist: Donovan Trent
Score: 20-11

[11:45] Team_005 possession (Score: 20-11)
Anthony Rozier drives and kicks out. Brandon George attempts a 3Pt. Contested by Giannis LaVine (4.2 feet, MAN). Brandon George misses. Rebound secured by Joel Banchero.

[11:29] Team_050 possession (Score: 20-11)
Giannis LaVine attempts a Midrange. Contested by Brandon George (5.9 feet, MAN). GIANNIS LAVINE MAKES IT!
Score: 22-11

[11:20] Team_005 possession (Score: 22-11)
Derrick Allen attempts a 3Pt. Contested by Joel Banchero (4.9 feet, ZONE). DERRICK ALLEN MAKES IT! Assist: Brandon George
Score: 22-14

[11:06] Team_050 possession (Score: 22-14)
LeBron Bridges attempts a 3Pt. Contested by Jalen Rozier (5.4 feet, MAN). LEBRON BRIDGES MAKES IT! Assist: Joel Banchero
Score: 25-14

[10:50] Team_005 possession (Score: 25-14)
Anthony Rozier attempts a Layup. Contested by Donovan Trent (5.3 feet, ZONE). Anthony Rozier misses. Rebound secured by LeBron Bridges.

[10:36] Team_050 possession (Score: 25-14)
FOUL! Offensive foul on LeBron Bridges! Jalen Rozier drew the charge! [Team fouls: 1] (LeBron Bridges: 1 personal fouls) TURNOVER! (dead ball)

[10:20] Team_005 possession (Score: 25-14)
Derrick Allen drives, Donovan Trent stays with him. Derrick Allen attempts a Layup. Contested by Donovan Trent (5.7 feet, ZONE). Derrick Allen misses. Offensive rebound by Cade Markkanen! Cade Markkanen kicks it out.

[10:09] Team_005 possession (Score: 25-14)
Jalen Rozier attempts a 3Pt. Contested by LeBron Bridges (5.1 feet, MAN). JALEN ROZIER MAKES IT!
Score: 25-17

[09:58] Team_050 possession (Score: 25-17)
Giannis LaVine throws a bad pass! Stolen by Brandon George! TURNOVER! (live ball)

[09:41] Team_005 possession (Score: 25-17)
FOUL! Holding foul on Collin Bane. [Team fouls: 2] No free throws, side out. (Collin Bane: 1 personal fouls)

[09:27] Team_005 possession (Score: 25-17)
Cade Markkanen drives to the basket... Cade Markkanen loses control! Ball rolls out of bounds! TURNOVER! (dead ball)

[09:27] Substitution (Team_050): Giannis LaVine OUT → Damian O'Neal IN (stamina_rule2)

[09:27] Substitution (Team_050): Joel Banchero OUT → Dwyane Towns IN (stamina_rule2)

[09:27] Substitution (Team_050): Collin Bane OUT → Larry Curry IN (stamina_rule2)

[09:27] Substitution (Team_050): LeBron Bridges OUT → Luka Gasol IN (stamina_rule2)

[09:27] Substitution (Team_050): Donovan Trent OUT → Tyler Smith IN (stamina_rule2)

[09:27] Substitution (Team_005): Brandon George OUT → Blake O'Neal IN (stamina_rule2)

[09:27] Substitution (Team_005): Anthony Rozier OUT → Draymond Smith IN (stamina_rule2)

[09:27] Substitution (Team_005): Derrick Allen OUT → Lauri Wade IN (stamina_rule2)

[09:27] Substitution (Team_005): Jalen Rozier OUT → Isaiah Durant IN (stamina_rule2)

[09:27] Substitution (Team_005): Cade Markkanen OUT → Zion Parker IN (stamina_rule2)

[09:11] Team_050 possession (Score: 25-17)
Dwyane Towns attempts a Midrange. Contested by Isaiah Durant (4.6 feet, ZONE). Dwyane Towns misses. Offensive rebound by Larry Curry! Larry Curry kicks it out.

[08:55] Team_050 possession (Score: 25-17)
Tyler Smith drives, Zion Parker stays with him. Tyler Smith attempts a Layup. Contested by Zion Parker (4.4 feet, MAN). Tyler Smith misses. Rebound secured by Draymond Smith.

[08:40] Team_005 possession (Score: 25-17)
Blake O'Neal drives to the basket... Blake O'Neal throws a bad pass out of bounds! TURNOVER! (dead ball)

[08:29] Team_050 possession (Score: 25-17)
Larry Curry drives to the basket... Larry Curry throws a bad pass! Stolen by Lauri Wade! TURNOVER! (live ball)

[08:14] Team_005 possession (Score: 25-17)
Zion Parker attempts a 3Pt. Contested by Luka Gasol (4.9 feet, ZONE). Zion Parker misses. Rebound secured by Tyler Smith.

[08:03] Team_050 possession (Score: 25-17)
Damian O'Neal throws a bad pass! Stolen by Blake O'Neal! TURNOVER! (live ball)

[07:49] Team_005 possession (Score: 25-17)
Blake O'Neal throws a bad pass! Stolen by Damian O'Neal! TURNOVER! (live ball)

[07:33] Team_050 possession (Score: 25-17)
Damian O'Neal attempts a 3Pt. Contested by Blake O'Neal (4.2 feet, MAN). Damian O'Neal misses. FOUL! Loose ball foul on Zion Parker during the rebound battle. [Team fouls: 1] No free throws, side out. (Zion Parker: 1 personal fouls)

[07:16] Team_050 possession (Score: 25-17)
Luka Gasol drives and kicks out. Tyler Smith attempts a Midrange. Contested by Zion Parker (4.0 feet, MAN). Tyler Smith misses. Rebound secured by Zion Parker.

[07:02] Team_005 possession (Score: 25-17)
FOUL! Offensive foul on Isaiah Durant! Luka Gasol drew the charge! [Team fouls: 2] (Isaiah Durant: 1 personal fouls) TURNOVER! (dead ball)

[06:44] Team_050 possession (Score: 25-17)
Dwyane Towns attempts a 3Pt. Contested by Draymond Smith (4.5 feet, MAN). Dwyane Towns misses. Rebound secured by Draymond Smith.

[06:31] Team_005 possession (Score: 25-17)
Isaiah Durant drives and kicks out. Isaiah Durant attempts a 3Pt. Contested by Luka Gasol (4.9 feet, MAN). Isaiah Durant misses. Rebound secured by Dwyane Towns.

[06:11] Team_050 possession (Score: 25-17)
Luka Gasol attempts a Layup. Contested by Isaiah Durant (4.4 feet, MAN). LUKA GASOL MAKES IT! Assist: Damian O'Neal
Score: 27-17

[05:56] Team_005 possession (Score: 27-17)
Lauri Wade drives, Larry Curry stays with him. Lauri Wade attempts a Dunk. Contested by Larry Curry (4.9 feet, MAN). Lauri Wade misses. Rebound secured by Dwyane Towns.

[05:45] Team_050 possession (Score: 27-17)
FOUL! Shooting foul on Draymond Smith. Dwyane Towns to the line for 2 free throws. [Team fouls: 3] (Draymond Smith: 1 personal fouls)   FT 1/2: MISS   FT 2/2: GOOD Dwyane Towns makes 1/2 from the line.
Score: 28-17

[05:33] Team_005 possession (Score: 28-17)
Draymond Smith attempts a 3Pt. Contested by Luka Gasol (4.7 feet, ZONE). Draymond Smith misses. Rebound secured by Dwyane Towns.

[05:21] Team_050 possession (Score: 28-17)
Larry Curry attempts a Layup. Contested by Lauri Wade (5.2 feet, MAN). LARRY CURRY MAKES IT! Assist: Damian O'Neal
Score: 30-17

[05:05] Team_005 possession (Score: 30-17)
Isaiah Durant drives, picks up Luka Gasol. Help arrives from Dwyane Towns! Isaiah Durant attempts a Layup. Contested by Dwyane Towns (5.1 feet, MAN). Isaiah Durant misses. Rebound secured by Dwyane Towns.

[04:50] Team_050 possession (Score: 30-17)
Luka Gasol drives, Isaiah Durant stays with him. Luka Gasol attempts a Dunk. Contested by Isaiah Durant (4.4 feet, MAN). Luka Gasol misses. Rebound secured by Draymond Smith.

[04:39] Team_005 possession (Score: 30-17)
Blake O'Neal attempts a 3Pt. Wide open! Damian O'Neal is 6.7 feet away. [MAN] Blake O'Neal misses. Rebound secured by Tyler Smith.

[04:28] Team_050 possession (Score: 30-17)
Luka Gasol attempts a Midrange. Contested by Blake O'Neal (4.1 feet, ZONE). Luka Gasol misses. Rebound secured by Lauri Wade.

[04:16] Team_005 possession (Score: 30-17)
Blake O'Neal attempts a 3Pt. Wide open! Damian O'Neal is 6.7 feet away. [MAN] Blake O'Neal misses. Rebound secured by Dwyane Towns.

[04:03] Team_050 possession (Score: 30-17)
Damian O'Neal attempts a 3Pt. Contested by Blake O'Neal (4.2 feet, ZONE). Damian O'Neal misses. Rebound secured by Lauri Wade.

[03:46] Team_005 possession (Score: 30-17)
Isaiah Durant attempts a Layup. Contested by Tyler Smith (5.4 feet, ZONE). ISAIAH DURANT MAKES IT!
Score: 30-19

[03:31] Team_050 possession (Score: 30-19)
Damian O'Neal attempts a 3Pt. Contested by Blake O'Neal (4.2 feet, MAN). DAMIAN O'NEAL MAKES IT! Assist: Larry Curry
Score: 33-19

[03:18] Team_005 possession (Score: 33-19)
Draymond Smith drives and kicks out. Blake O'Neal attempts a 3Pt. Wide open! Damian O'Neal is 6.3 feet away. [MAN] Blake O'Neal misses. Rebound secured by Tyler Smith.

[03:08] Team_050 possession (Score: 33-19)
Dwyane Towns attempts a Layup. BLOCKED BY ZION PARKER! Ball is loose! Rebound secured by Zion Parker.

[02:51] Team_005 possession (Score: 33-19)
Isaiah Durant drives to the basket... Isaiah Durant throws a bad pass out of bounds! TURNOVER! (dead ball)

[02:38] Team_050 possession (Score: 33-19)
Larry Curry attempts a Midrange. Contested by Lauri Wade (5.2 feet, MAN). Larry Curry misses. Rebound secured by Draymond Smith.

[02:21] Team_005 possession (Score: 33-19)
Zion Parker drives, picks up Tyler Smith. Help arrives from Dwyane Towns! Zion Parker attempts a Layup. Contested by Dwyane Towns (5.3 feet, ZONE). Zion Parker misses. Offensive rebound by Zion Parker! Zion Parker's putback is no good. Rebound secured by Larry Curry.

[02:07] Team_050 possession (Score: 33-19)
Dwyane Towns attempts a Midrange. Contested by Draymond Smith (4.6 feet, MAN). Dwyane Towns misses. Rebound secured by Zion Parker.

[01:50] Team_005 possession (Score: 33-19)
Blake O'Neal attempts a Midrange. Contested by Luka Gasol (5.4 feet, ZONE). Blake O'Neal misses. Rebound secured by Larry Curry.

[01:33] Team_050 possession (Score: 33-19)
Larry Curry attempts a Layup. Contested by Lauri Wade (5.3 feet, MAN). LARRY CURRY MAKES IT! Assist: Tyler Smith
Score: 35-19

[01:14] Team_005 possession (Score: 35-19)
Blake O'Neal attempts a Midrange. Wide open! Damian O'Neal is 6.8 feet away. [MAN] BLAKE O'NEAL MAKES IT! Assist: Zion Parker
Score: 35-21

[01:00] Team_050 possession (Score: 35-21)
Larry Curry attempts a 3Pt. Contested by Blake O'Neal (4.4 feet, ZONE). LARRY CURRY MAKES IT! Assist: Luka Gasol
Score: 38-21

[00:46] Team_005 possession (Score: 38-21)
Draymond Smith makes the Midrange and draws the foul on Luka Gasol! And-1! Draymond Smith to the line for 1. [Team fouls: 3] (Luka Gasol: 1 personal fouls)   FT 1/1: MISS Draymond Smith makes 0/1 from the line. Rebound secured by Dwyane Towns.
Score: 38-23

[00:30] Team_050 possession (Score: 38-23)
Dwyane Towns attempts a 3Pt. Contested by Draymond Smith (4.7 feet, MAN). Dwyane Towns misses. Rebound secured by Draymond Smith.

[00:17] Team_005 possession (Score: 38-23)
Zion Parker attempts a Layup. Contested by Tyler Smith (5.4 feet, MAN). Zion Parker misses. Rebound secured by Tyler Smith.

================================================================================
                              2ND QUARTER COMPLETE                              
================================================================================

2ND QUARTER SCORE: Team_050 20, Team_005 12

BOX SCORE:
================================================================================

Team_050
--------------------------------------------------------------------------------
Player                MIN  PTS  REB  AST  TO      FG   FG%      3P   3P%
--------------------------------------------------------------------------------
Larry Curry             9    7    4    1   0   3/4    75.0     0/0   0.0
LeBron Bridges         15    5    1    0   0   2/2   100.0     0/0   0.0
Damian O'Neal           9    3    0    2   0   1/2    50.0     0/0   0.0
Giannis LaVine         15    2    0    0   0   1/1   100.0     0/0   0.0
Luka Gasol              9    2    0    1   0   1/4    25.0     0/0   0.0
Dwyane Towns            9    1    6    0   0   1/5    20.0     0/0   0.0
Donovan Trent          15    0    0    1   0   0/0     0.0     0/0   0.0
Joel Banchero          15    0    1    1   0   0/0     0.0     0/0   0.0
Tyler Smith             9    0    4    1   0   0/1     0.0     0/0   0.0

TEAM: FG: 9/19 (47.4%), 3PT: 3/6 (50.0%), REB: 15 (2 off, 13 def), AST: 7, TO: 4
TEAM FOULS: 3


Team_005
--------------------------------------------------------------------------------
Player                MIN  PTS  REB  AST  TO      FG   FG%      3P   3P%
--------------------------------------------------------------------------------
Derrick Allen          15    3    0    0   0   1/1   100.0     0/0   0.0
Jalen Rozier           15    3    0    0   0   1/1   100.0     0/0   0.0
Isaiah Durant           9    2    0    0   0   1/3    33.3     0/0   0.0
Blake O'Neal            9    2    0    0   0   1/4    25.0     0/0   0.0
Anthony Rozier         15    0    0    0   0   0/2     0.0     0/0   0.0
Brandon George         15    0    0    1   0   0/0     0.0     0/0   0.0
Cade Markkanen         15    0    1    0   0   0/0     0.0     0/0   0.0
Draymond Smith          9    0    5    0   0   0/3     0.0     0/0   0.0
Zion Parker             9    0    3    1   0   0/3     0.0     0/0   0.0
Lauri Wade              9    0    2    0   0   0/1     0.0     0/0   0.0

TEAM: FG: 4/18 (22.2%), 3PT: 2/6 (33.3%), REB: 12 (2 off, 10 def), AST: 2, TO: 5
TEAM FOULS: 3

================================================================================

================================================================================
                       3RD QUARTER - Team_050 vs Team_005                       
================================================================================

[12:00] Team_050 possession (Score: 38-23)
LeBron Bridges drives to the basket... LeBron Bridges loses control! Ball rolls out of bounds! TURNOVER! (dead ball)

[11:47] Team_005 possession (Score: 38-23)
Derrick Allen attempts a 3Pt. Contested by Collin Bane (4.5 feet, MAN). Derrick Allen misses. Rebound secured by LeBron Bridges.

[11:31] Team_050 possession (Score: 38-23)
Joel Banchero attempts a 3Pt. Contested by Derrick Allen (4.1 feet, ZONE). Joel Banchero misses. Rebound secured by Derrick Allen.

[11:14] Team_005 possession (Score: 38-23)
Cade Markkanen attempts a Layup. Contested by Donovan Trent (4.6 feet, ZONE). CADE MARKKANEN MAKES IT! Assist: Anthony Rozier
Score: 38-25

[11:00] Team_050 possession (Score: 38-25)
LeBron Bridges drives, Cade Markkanen stays with him. LeBron Bridges attempts a Layup. Contested by Cade Markkanen (3.4 feet, ZONE). LeBron Bridges misses. FOUL! Loose ball foul on Cade Markkanen during the rebound battle. [Team fouls: 1] No free throws, side out. (Cade Markkanen: 1 personal fouls)

[10:45] Team_050 possession (Score: 38-25)
LeBron Bridges attempts a Layup. Contested by Cade Markkanen (3.4 feet, ZONE). LEBRON BRIDGES MAKES IT!
Score: 40-25

[10:31] Team_005 possession (Score: 40-25)
Jalen Rozier makes the Layup and draws the foul on Donovan Trent! And-1! Jalen Rozier to the line for 1. [Team fouls: 1] (Donovan Trent: 1 personal fouls)   FT 1/1: GOOD Jalen Rozier makes 1/1 from the line.
Score: 40-28

[10:17] Team_050 possession (Score: 40-28)
LeBron Bridges attempts a Midrange. Contested by Cade Markkanen (3.4 feet, MAN). LeBron Bridges misses. Offensive rebound by LeBron Bridges! LeBron Bridges kicks it out.

[09:59] Team_050 possession (Score: 40-28)
Giannis LaVine attempts a 3Pt. Contested by Derrick Allen (4.7 feet, ZONE). Giannis LaVine misses. Rebound secured by Cade Markkanen.

[09:48] Team_005 possession (Score: 40-28)
Derrick Allen attempts a 3Pt. Contested by Giannis LaVine (4.3 feet, ZONE). Derrick Allen misses. Rebound secured by Collin Bane.

[09:36] Team_050 possession (Score: 40-28)
FOUL! Reach-in foul on Cade Markkanen during the drive. [Team fouls: 2] No free throws, side out. (Cade Markkanen: 2 personal fouls)

[09:23] Team_050 possession (Score: 40-28)
LeBron Bridges attempts a 3Pt. Contested by Cade Markkanen (3.4 feet, MAN). LeBron Bridges misses. Rebound secured by Jalen Rozier.

[09:11] Team_005 possession (Score: 40-28)
Jalen Rozier attempts a Midrange. Contested by Collin Bane (4.4 feet, ZONE). Jalen Rozier misses. Rebound secured by Joel Banchero.

[08:56] Team_050 possession (Score: 40-28)
Giannis LaVine attempts a Midrange. Contested by Brandon George (5.6 feet, MAN). GIANNIS LAVINE MAKES IT! Assist: Joel Banchero
Score: 42-28

[08:45] Team_005 possession (Score: 42-28)
Jalen Rozier attempts a Midrange. Contested by Collin Bane (4.4 feet, ZONE). Jalen Rozier misses. Rebound secured by Joel Banchero.

[08:31] Team_050 possession (Score: 42-28)
Giannis LaVine attempts a 3Pt. Contested by Brandon George (5.6 feet, MAN). Giannis LaVine misses. Rebound secured by Jalen Rozier.

[08:17] Team_005 possession (Score: 42-28)
Derrick Allen attempts a 3Pt. Contested by Giannis LaVine (4.3 feet, ZONE). Derrick Allen misses. Offensive rebound by Cade Markkanen! Cade Markkanen's putback is no good. Rebound secured by LeBron Bridges.

[08:01] Team_050 possession (Score: 42-28)
Donovan Trent attempts a 3Pt. Contested by Cade Markkanen (3.0 feet, MAN). Donovan Trent misses. Rebound secured by Derrick Allen.

[07:46] Team_005 possession (Score: 42-28)
Derrick Allen attempts a 3Pt. Contested by Collin Bane (4.5 feet, MAN). Derrick Allen misses. Rebound secured by LeBron Bridges.

[07:34] Team_050 possession (Score: 42-28)
Donovan Trent attempts a Layup. Contested by Cade Markkanen (3.0 feet, ZONE). Donovan Trent misses. Rebound secured by Derrick Allen.

[07:19] Team_005 possession (Score: 42-28)
Brandon George makes the Layup and draws the foul on Collin Bane! And-1! Brandon George to the line for 1. [Team fouls: 2] (Collin Bane: 1 personal fouls)   FT 1/1: GOOD Brandon George makes 1/1 from the line.
Score: 42-31

[07:08] Team_050 possession (Score: 42-31)
LeBron Bridges drives to the basket... LeBron Bridges throws a bad pass! Stolen by Cade Markkanen! TURNOVER! (live ball)

[06:54] Team_005 possession (Score: 42-31)
Derrick Allen attempts a 3Pt. Contested by Collin Bane (4.5 feet, MAN). Derrick Allen misses. Rebound secured by LeBron Bridges.

[06:37] Team_050 possession (Score: 42-31)
Donovan Trent attempts a Layup. Contested by Cade Markkanen (3.0 feet, ZONE). DONOVAN TRENT MAKES IT! Assist: LeBron Bridges
Score: 44-31

[06:24] Team_005 possession (Score: 44-31)
Cade Markkanen drives, Donovan Trent stays with him. Cade Markkanen attempts a Layup. Contested by Donovan Trent (4.6 feet, ZONE). CADE MARKKANEN MAKES IT! Assist: Jalen Rozier
Score: 44-33

[06:08] Team_050 possession (Score: 44-33)
Joel Banchero attempts a Midrange. Contested by Jalen Rozier (4.7 feet, ZONE). Joel Banchero misses. Rebound secured by Cade Markkanen.

[05:51] Team_005 possession (Score: 44-33)
Cade Markkanen drives and kicks out. Derrick Allen attempts a 3Pt. Contested by Collin Bane (4.1 feet, MAN). DERRICK ALLEN MAKES IT! Assist: Jalen Rozier
Score: 44-36

[05:36] Team_050 possession (Score: 44-36)
Joel Banchero loses the ball! Stripped by Anthony Rozier! TURNOVER! (live ball)

[05:24] Team_005 possession (Score: 44-36)
Anthony Rozier attempts a Midrange. Contested by Joel Banchero (4.3 feet, MAN). ANTHONY ROZIER MAKES IT!
Score: 44-38

[05:09] Team_050 possession (Score: 44-38)
FOUL! Holding foul on Cade Markkanen. [Team fouls: 3] No free throws, side out. (Cade Markkanen: 3 personal fouls)

[04:57] Team_050 possession (Score: 44-38)
Joel Banchero makes the Dunk and draws the foul on Anthony Rozier! And-1! Joel Banchero to the line for 1. [Team fouls: 4] (Anthony Rozier: 1 personal fouls)   FT 1/1: GOOD Joel Banchero makes 1/1 from the line.
Score: 47-38

[04:43] Team_005 possession (Score: 47-38)
Brandon George attempts a 3Pt. Contested by Giannis LaVine (4.1 feet, MAN). Brandon George misses. Rebound secured by LeBron Bridges.

[04:32] Team_050 possession (Score: 47-38)
Donovan Trent throws a bad pass! Stolen by Cade Markkanen! TURNOVER! (live ball)

[04:14] Team_005 possession (Score: 47-38)
Cade Markkanen drives, Donovan Trent stays with him. Cade Markkanen attempts a Dunk. Contested by Donovan Trent (4.8 feet, ZONE). CADE MARKKANEN MAKES IT!
Score: 47-40

[04:00] Team_050 possession (Score: 47-40)
Donovan Trent attempts a Midrange. Contested by Cade Markkanen (3.3 feet, MAN). Donovan Trent misses. Rebound secured by Derrick Allen.

[03:43] Team_005 possession (Score: 47-40)
FOUL! Reach-in foul on Donovan Trent during the drive. [Team fouls: 3] No free throws, side out. (Donovan Trent: 2 personal fouls)

[03:27] Team_005 possession (Score: 47-40)
Derrick Allen attempts a 3Pt. Contested by Collin Bane (4.6 feet, MAN). Derrick Allen misses. Rebound secured by Joel Banchero.

[03:14] Team_050 possession (Score: 47-40)
Joel Banchero drives, picks up Cade Markkanen. Help arrives from Anthony Rozier! Joel Banchero attempts a Layup. Contested by Anthony Rozier (3.4 feet, ZONE). JOEL BANCHERO MAKES IT! Assist: Donovan Trent
Score: 49-40

[02:59] Team_005 possession (Score: 49-40)
Brandon George makes the 3Pt and draws the foul on Giannis LaVine! And-1! Brandon George to the line for 1. [Team fouls: 4] (Giannis LaVine: 1 personal fouls)   FT 1/1: GOOD Brandon George makes 1/1 from the line.
Score: 49-44

[02:48] Team_050 possession (Score: 49-44)
Donovan Trent drives and kicks out. Donovan Trent makes the Midrange and draws the foul on Derrick Allen! And-1! Donovan Trent to the line for 1. [BONUS: 5 team fouls] (Derrick Allen: 1 personal fouls)   FT 1/1: GOOD Donovan Trent makes 1/1 from the line.
Score: 52-44

[02:34] Team_005 possession (Score: 52-44)
Cade Markkanen attempts a Layup. Contested by Donovan Trent (4.9 feet, MAN). CADE MARKKANEN MAKES IT! Assist: Brandon George
Score: 52-46

[02:25] Team_050 possession (Score: 52-46)
LeBron Bridges attempts a Layup. Contested by Cade Markkanen (3.8 feet, ZONE). LeBron Bridges misses. Rebound secured by Cade Markkanen.

[02:12] Team_005 possession (Score: 52-46)
Brandon George drives, Giannis LaVine stays with him. Brandon George attempts a Layup. Contested by Giannis LaVine (4.4 feet, MAN). Brandon George misses. Rebound secured by LeBron Bridges.

[02:00] Team_050 possession (Score: 52-46)
LeBron Bridges attempts a Midrange. Contested by Brandon George (5.7 feet, ZONE). LeBron Bridges misses. Rebound secured by Cade Markkanen.

[01:46] Team_005 possession (Score: 52-46)
Anthony Rozier attempts a Midrange. Contested by Donovan Trent (5.3 feet, ZONE). Anthony Rozier misses. Offensive rebound by Cade Markkanen! Cade Markkanen kicks it out.

[01:29] Team_005 possession (Score: 52-46)
Derrick Allen drives to the basket... FOUL! Offensive foul on Derrick Allen! Collin Bane drew the charge! [Team fouls: 6] (Derrick Allen: 2 personal fouls) TURNOVER! (dead ball)

[01:11] Team_050 possession (Score: 52-46)
LeBron Bridges makes the Layup and draws the foul on Cade Markkanen! And-1! LeBron Bridges to the line for 1. [BONUS: 7 team fouls] (Cade Markkanen: 4 personal fouls)   FT 1/1: MISS LeBron Bridges makes 0/1 from the line. Rebound secured by Cade Markkanen.
Score: 54-46

[00:55] Team_005 possession (Score: 54-46)
Anthony Rozier drives, Joel Banchero stays with him. Anthony Rozier attempts a Layup. Contested by Joel Banchero (4.7 feet, MAN). ANTHONY ROZIER MAKES IT!
Score: 54-48

[00:42] Team_050 possession (Score: 54-48)
Donovan Trent attempts a Midrange. Contested by Cade Markkanen (3.8 feet, MAN). Donovan Trent misses. Offensive rebound by Collin Bane! Collin Bane kicks it out.

[00:24] Team_050 possession (Score: 54-48)
LeBron Bridges attempts a 3Pt. Contested by Jalen Rozier (5.5 feet, MAN). LeBron Bridges misses. Rebound secured by Jalen Rozier.

[00:11] Team_005 possession (Score: 54-48)
Anthony Rozier attempts a 3Pt. Contested by Joel Banchero (4.8 feet, MAN). Anthony Rozier misses. Rebound secured by Joel Banchero.

================================================================================
                              3RD QUARTER COMPLETE                              
================================================================================

3RD QUARTER SCORE: Team_050 16, Team_005 25

BOX SCORE:
================================================================================

Team_050
--------------------------------------------------------------------------------
Player                MIN  PTS  REB  AST  TO      FG   FG%      3P   3P%
--------------------------------------------------------------------------------
Joel Banchero          27    5    4    1   0   2/4    50.0     0/0   0.0
Donovan Trent          27    5    0    1   0   2/5    40.0     0/0   0.0
LeBron Bridges         27    2    8    1   0   1/6    16.7     0/0   0.0
Giannis LaVine         27    2    0    0   0   1/3    33.3     0/0   0.0
Collin Bane            27    0    2    0   0   0/0     0.0     0/0   0.0

TEAM: FG: 6/18 (33.3%), 3PT: 0/6 (0.0%), REB: 13 (3 off, 10 def), AST: 3, TO: 4
TEAM FOULS: 4


Team_005
--------------------------------------------------------------------------------
Player                MIN  PTS  REB  AST  TO      FG   FG%      3P   3P%
--------------------------------------------------------------------------------
Cade Markkanen         27    8    6    0   0   4/4   100.0     0/0   0.0
Brandon George         27    7    0    1   0   2/4    50.0     0/0   0.0
Anthony Rozier         27    4    0    1   0   2/3    66.7     0/0   0.0
Derrick Allen          27    3    4    0   0   1/7    14.3     0/0   0.0
Jalen Rozier           27    3    3    2   0   1/3    33.3     0/0   0.0

TEAM: FG: 10/21 (47.6%), 3PT: 1/9 (11.1%), REB: 14 (2 off, 12 def), AST: 4, TO: 1
TEAM FOULS: 7 [Team_050 in BONUS]

================================================================================

================================================================================
                       4TH QUARTER - Team_050 vs Team_005                       
================================================================================

[12:00] Team_050 possession (Score: 54-48)
Collin Bane attempts a Midrange. Contested by Derrick Allen (4.7 feet, MAN). Collin Bane misses. Rebound secured by Cade Markkanen.

[11:48] Team_005 possession (Score: 54-48)
Derrick Allen attempts a 3Pt. Contested by Collin Bane (4.8 feet, MAN). DERRICK ALLEN MAKES IT! Assist: Jalen Rozier
Score: 54-51

[11:34] Team_050 possession (Score: 54-51)
Joel Banchero drives and kicks out. LeBron Bridges attempts a Midrange. Contested by Anthony Rozier (5.1 feet, ZONE). LeBron Bridges misses. Rebound secured by Cade Markkanen.

[11:22] Team_005 possession (Score: 54-51)
Derrick Allen attempts a 3Pt. Contested by Giannis LaVine (4.7 feet, ZONE). Derrick Allen misses. Rebound secured by Joel Banchero.

[11:04] Team_050 possession (Score: 54-51)
Collin Bane drives and kicks out. Joel Banchero attempts a Midrange. Contested by Anthony Rozier (5.2 feet, MAN). Joel Banchero misses. Offensive rebound by LeBron Bridges! LeBron Bridges kicks it out.

[10:48] Team_050 possession (Score: 54-51)
FOUL! Holding foul on Brandon George. [Team fouls: 1] No free throws, side out. (Brandon George: 1 personal fouls)

[10:33] Team_050 possession (Score: 54-51)
LeBron Bridges attempts a Layup. Contested by Jalen Rozier (5.5 feet, MAN). LEBRON BRIDGES MAKES IT! Assist: Giannis LaVine
Score: 56-51

[10:19] Team_005 possession (Score: 56-51)
Brandon George attempts a 3Pt. Contested by Giannis LaVine (4.5 feet, ZONE). BRANDON GEORGE MAKES IT! Assist: Cade Markkanen
Score: 56-54

[10:03] Team_050 possession (Score: 56-54)
LeBron Bridges makes the Layup and draws the foul on Cade Markkanen! And-1! LeBron Bridges to the line for 1. [Team fouls: 2] (Cade Markkanen: 1 personal fouls)   FT 1/1: GOOD LeBron Bridges makes 1/1 from the line.
Score: 59-54

[09:45] Team_005 possession (Score: 59-54)
Jalen Rozier attempts a 3Pt. Contested by Giannis LaVine (4.8 feet, ZONE). JALEN ROZIER MAKES IT! Assist: Cade Markkanen
Score: 59-57

[09:25] Team_050 possession (Score: 59-57)
Joel Banchero drives and kicks out. LeBron Bridges attempts a Midrange. Contested by Derrick Allen (4.8 feet, ZONE). LEBRON BRIDGES MAKES IT! Assist: Giannis LaVine
Score: 61-57

[09:16] Team_005 possession (Score: 61-57)
Jalen Rozier throws a bad pass out of bounds! TURNOVER! (dead ball)

[09:16] Substitution (Team_050): Giannis LaVine OUT → Damian O'Neal IN (stamina_rule2)

[09:16] Substitution (Team_050): Joel Banchero OUT → Dwyane Towns IN (stamina_rule2)

[09:16] Substitution (Team_050): Collin Bane OUT → Larry Curry IN (stamina_rule2)

[09:16] Substitution (Team_050): LeBron Bridges OUT → Luka Gasol IN (stamina_rule2)

[09:16] Substitution (Team_050): Donovan Trent OUT → Tyler Smith IN (stamina_rule2)

[09:16] Substitution (Team_005): Brandon George OUT → Blake O'Neal IN (stamina_rule2)

[09:16] Substitution (Team_005): Anthony Rozier OUT → Draymond Smith IN (stamina_rule2)

[09:16] Substitution (Team_005): Derrick Allen OUT → Lauri Wade IN (stamina_rule2)

[09:16] Substitution (Team_005): Jalen Rozier OUT → Isaiah Durant IN (stamina_rule2)

[09:16] Substitution (Team_005): Cade Markkanen OUT → Zion Parker IN (stamina_rule2)

[08:59] Team_050 possession (Score: 61-57)
Tyler Smith attempts a 3Pt. Contested by Blake O'Neal (4.5 feet, ZONE). Tyler Smith misses. Rebound secured by Draymond Smith.

[08:43] Team_005 possession (Score: 61-57)
Lauri Wade attempts a 3Pt. Contested by Luka Gasol (5.0 feet, ZONE). Lauri Wade misses. Rebound secured by Tyler Smith.

[08:31] Team_050 possession (Score: 61-57)
Luka Gasol attempts a Layup. Contested by Zion Parker (4.0 feet, ZONE). Luka Gasol misses. Rebound secured by Zion Parker.

[08:17] Team_005 possession (Score: 61-57)
Zion Parker attempts a Midrange. Contested by Tyler Smith (5.2 feet, MAN). Zion Parker misses. FOUL! Loose ball foul on Dwyane Towns during the rebound battle. [Team fouls: 1] No free throws, side out. (Dwyane Towns: 1 personal fouls)

[08:04] Team_005 possession (Score: 61-57)
Lauri Wade attempts a 3Pt. Contested by Luka Gasol (5.0 feet, ZONE). Lauri Wade misses. Rebound secured by Dwyane Towns.

[07:48] Team_050 possession (Score: 61-57)
Damian O'Neal drives and kicks out. Luka Gasol attempts a 3Pt. Contested by Isaiah Durant (4.4 feet, ZONE). Luka Gasol misses. Rebound secured by Draymond Smith.

[07:35] Team_005 possession (Score: 61-57)
Zion Parker attempts a Midrange. Contested by Tyler Smith (5.2 feet, ZONE). Zion Parker misses. Rebound secured by Dwyane Towns.

[07:26] Team_050 possession (Score: 61-57)
Dwyane Towns attempts a 3Pt. Contested by Blake O'Neal (4.3 feet, ZONE). Dwyane Towns misses. Rebound secured by Draymond Smith.

[07:07] Team_005 possession (Score: 61-57)
Blake O'Neal attempts a Layup. Contested by Tyler Smith (5.6 feet, ZONE). BLAKE O'NEAL MAKES IT! Assist: Lauri Wade
Score: 61-59

[06:52] Team_050 possession (Score: 61-59)
Larry Curry drives, picks up Isaiah Durant. Help arrives from Blake O'Neal! Larry Curry attempts a Layup. Contested by Blake O'Neal (4.5 feet, ZONE). LARRY CURRY MAKES IT! Assist: Dwyane Towns
Score: 63-59

[06:34] Team_005 possession (Score: 63-59)
Zion Parker drives to the basket... Zion Parker loses the ball! Stripped by Tyler Smith! TURNOVER! (live ball)

[06:20] Team_050 possession (Score: 63-59)
FOUL! Shooting foul on Draymond Smith. Dwyane Towns to the line for 2 free throws. [Team fouls: 3] (Draymond Smith: 1 personal fouls)   FT 1/2: GOOD   FT 2/2: GOOD Dwyane Towns makes 2/2 from the line.
Score: 65-59

[06:05] Team_005 possession (Score: 65-59)
FOUL! Shooting foul on Tyler Smith. Zion Parker to the line for 2 free throws. [Team fouls: 2] (Tyler Smith: 1 personal fouls)   FT 1/2: GOOD   FT 2/2: MISS Zion Parker makes 1/2 from the line. Rebound secured by Larry Curry.
Score: 65-60

[05:49] Team_050 possession (Score: 65-60)
FOUL! Offensive foul on Larry Curry! Lauri Wade drew the charge! [Team fouls: 3] (Larry Curry: 1 personal fouls) TURNOVER! (dead ball)

[05:33] Team_005 possession (Score: 65-60)
Blake O'Neal attempts a 3Pt. Wide open! Damian O'Neal is 6.7 feet away. [MAN] Blake O'Neal misses. Offensive rebound by Zion Parker! Zion Parker puts it back in!
Score: 65-62

[05:15] Team_050 possession (Score: 65-62)
Larry Curry attempts a 3Pt. Contested by Blake O'Neal (4.2 feet, ZONE). Larry Curry misses. Offensive rebound by Larry Curry! Larry Curry kicks it out.

[04:58] Team_050 possession (Score: 65-62)
Tyler Smith drives, Zion Parker stays with him. Tyler Smith attempts a Dunk. Contested by Zion Parker (4.4 feet, ZONE). TYLER SMITH MAKES IT! Assist: Dwyane Towns
Score: 67-62

[04:42] Team_005 possession (Score: 67-62)
Draymond Smith attempts a Layup. Contested by Dwyane Towns (4.1 feet, MAN). DRAYMOND SMITH MAKES IT! Assist: Blake O'Neal
Score: 67-64

[04:23] Team_050 possession (Score: 67-64)
Larry Curry drives to the basket... FOUL! Offensive foul on Larry Curry! Lauri Wade drew the charge! [Team fouls: 4] (Larry Curry: 2 personal fouls) TURNOVER! (dead ball)

[04:10] Team_005 possession (Score: 67-64)
FOUL! Holding foul on Tyler Smith. [IN THE BONUS! 5 team fouls] Zion Parker to the line for 2 free throws. (Tyler Smith: 2 personal fouls)   FT 1/2: GOOD   FT 2/2: MISS Zion Parker makes 1/2 from the line. Rebound secured by Tyler Smith.
Score: 67-65

[03:53] Team_050 possession (Score: 67-65)
Damian O'Neal makes the Layup and draws the foul on Blake O'Neal! And-1! Damian O'Neal to the line for 1. [Team fouls: 4] (Blake O'Neal: 1 personal fouls)   FT 1/1: GOOD Damian O'Neal makes 1/1 from the line.
Score: 70-65

[03:39] Team_005 possession (Score: 70-65)
FOUL! Holding foul on Damian O'Neal. [IN THE BONUS! 6 team fouls] Blake O'Neal to the line for 2 free throws. (Damian O'Neal: 1 personal fouls)   FT 1/2: GOOD   FT 2/2: MISS Blake O'Neal makes 1/2 from the line. Rebound secured by Dwyane Towns.
Score: 70-66

[03:23] Team_050 possession (Score: 70-66)
Tyler Smith attempts a 3Pt. Contested by Zion Parker (4.4 feet, MAN). Tyler Smith misses. Rebound secured by Draymond Smith.

[03:08] Team_005 possession (Score: 70-66)
Blake O'Neal attempts a Layup. Contested by Tyler Smith (5.6 feet, ZONE). Blake O'Neal misses. FOUL! Loose ball foul on Larry Curry during the rebound battle. [IN THE BONUS! 7 team fouls] Zion Parker to the line for 2 free throws. (Larry Curry: 3 personal fouls)   FT 1/2: MISS   FT 2/2: GOOD Zion Parker makes 1/2 from the line.
Score: 70-67

[02:54] Team_050 possession (Score: 70-67)
Luka Gasol throws a bad pass! Stolen by Isaiah Durant! TURNOVER! (live ball)

[02:38] Team_005 possession (Score: 70-67)
Lauri Wade makes the Layup and draws the foul on Larry Curry! And-1! Lauri Wade to the line for 1. [BONUS: 8 team fouls] (Larry Curry: 4 personal fouls)   FT 1/1: GOOD Lauri Wade makes 1/1 from the line.
Score: 70-70

[02:21] Team_050 possession (Score: 70-70)
Luka Gasol attempts a 3Pt. Contested by Blake O'Neal (4.1 feet, ZONE). Luka Gasol misses. Rebound secured by Draymond Smith.

[02:09] Team_005 possession (Score: 70-70)
Lauri Wade attempts a 3Pt. Contested by Larry Curry (4.9 feet, MAN). Lauri Wade misses. Rebound secured by Larry Curry.

[01:54] Team_050 possession (Score: 70-70)
Tyler Smith drives and kicks out. Tyler Smith attempts a 3Pt. Contested by Blake O'Neal (4.1 feet, ZONE). TYLER SMITH MAKES IT!
Score: 73-70

[01:42] Team_005 possession (Score: 73-70)
Zion Parker attempts a Midrange. Contested by Tyler Smith (5.2 feet, MAN). Zion Parker misses. Rebound secured by Larry Curry.

[01:25] Team_050 possession (Score: 73-70)
Tyler Smith drives and kicks out. Damian O'Neal attempts a Midrange. Contested by Blake O'Neal (4.2 feet, MAN). DAMIAN O'NEAL MAKES IT! Assist: Tyler Smith
Score: 75-70

[01:08] Team_005 possession (Score: 75-70)
FOUL! Reach-in foul on Tyler Smith during the drive. [IN THE BONUS! 9 team fouls] Zion Parker to the line for 2 free throws. (Tyler Smith: 3 personal fouls)   FT 1/2: GOOD   FT 2/2: GOOD Zion Parker makes 2/2 from the line.
Score: 75-72

[00:56] Team_050 possession (Score: 75-72)
Damian O'Neal attempts a 3Pt. Contested by Blake O'Neal (4.3 feet, ZONE). DAMIAN O'NEAL MAKES IT! Assist: Larry Curry
Score: 78-72

[00:43] Team_005 possession (Score: 78-72)
Isaiah Durant attempts a Midrange. Contested by Luka Gasol (5.2 feet, MAN). ISAIAH DURANT MAKES IT! Assist: Lauri Wade
Score: 78-74

[00:29] Team_050 possession (Score: 78-74)
Damian O'Neal attempts a Midrange. Contested by Lauri Wade (5.3 feet, ZONE). Damian O'Neal misses. Rebound secured by Zion Parker.

[00:14] Team_005 possession (Score: 78-74)
Isaiah Durant attempts a 3Pt. Contested by Luka Gasol (5.3 feet, ZONE). ISAIAH DURANT MAKES IT! Assist: Blake O'Neal
Score: 78-77

================================================================================
                              4TH QUARTER COMPLETE                              
================================================================================

4TH QUARTER SCORE: Team_050 24, Team_005 29

BOX SCORE:
================================================================================

Team_050
--------------------------------------------------------------------------------
Player                MIN  PTS  REB  AST  TO      FG   FG%      3P   3P%
--------------------------------------------------------------------------------
Damian O'Neal          18    8    0    0   0   3/5    60.0     0/0   0.0
LeBron Bridges         30    7    1    0   0   3/3   100.0     0/0   0.0
Tyler Smith            18    5    2    1   0   2/4    50.0     0/0   0.0
Dwyane Towns           18    2    3    2   0   1/2    50.0     0/0   0.0
Larry Curry            18    2    4    1   0   1/1   100.0     0/0   0.0
Collin Bane            30    0    0    0   0   0/1     0.0     0/0   0.0
Joel Banchero          30    0    1    0   0   0/1     0.0     0/0   0.0
Giannis LaVine         30    0    0    2   0   0/0     0.0     0/0   0.0
Luka Gasol             18    0    0    0   0   0/2     0.0     0/0   0.0

TEAM: FG: 10/19 (52.6%), 3PT: 1/5 (20.0%), REB: 11 (2 off, 9 def), AST: 6, TO: 3
TEAM FOULS: 9 [Team_005 in BONUS]


Team_005
--------------------------------------------------------------------------------
Player                MIN  PTS  REB  AST  TO      FG   FG%      3P   3P%
--------------------------------------------------------------------------------
Zion Parker            18    5    4    0   0   3/6    50.0     0/0   0.0
Isaiah Durant          18    5    0    0   0   2/2   100.0     0/0   0.0
Derrick Allen          30    3    0    0   0   1/2    50.0     0/0   0.0
Jalen Rozier           30    3    0    1   0   1/1   100.0     0/0   0.0
Brandon George         30    3    0    0   0   1/1   100.0     0/0   0.0
Lauri Wade             18    3    0    2   0   1/4    25.0     0/0   0.0
Draymond Smith         18    2    5    0   0   1/1   100.0     0/0   0.0
Blake O'Neal           18    2    0    2   0   1/1   100.0     0/0   0.0
Cade Markkanen         30    0    2    2   0   0/0     0.0     0/0   0.0

TEAM: FG: 11/20 (55.0%), 3PT: 5/9 (55.6%), REB: 11 (2 off, 9 def), AST: 7, TO: 2
TEAM FOULS: 4

================================================================================

================================================================================
                               FULL GAME COMPLETE                               
================================================================================

FINAL SCORE: Team_050 78, Team_005 77

SCORING BY QUARTER:
--------------------------------------------------------------------------------
Team                     Q1     Q2     Q3     Q4    FINAL
--------------------------------------------------------------------------------
Team_050                 18     20     16     24       78
Team_005                 11     12     25     29       77
--------------------------------------------------------------------------------

FULL GAME BOX SCORE:
================================================================================

Team_050
--------------------------------------------------------------------------------
Player                MIN  PTS  REB  AST  TO      FG   FG%      3P   3P%      FT STL BLK
--------------------------------------------------------------------------------
Giannis LaVine         30    4    0    5   5   2/5    40.0   0/2     0.0   0/0     0   0
Joel Banchero          30    8   10    2   3   4/9    44.4   1/2    50.0   1/1     0   0
Collin Bane            30    2    5    1   0   1/3    33.3   0/0     0.0   0/0     0   0
LeBron Bridges         30   19   15    1   2   7/16   43.8   1/4    25.0   2/5     2   0
Donovan Trent          30   11    0    2   2   5/9    55.6   0/1     0.0   1/1     0   1
Damian O'Neal          18   11    0    2   1   3/6    50.0   2/3    66.7   1/1     1   0
Dwyane Towns           18    3    9    2   1   2/7    28.6   0/3     0.0   3/4     0   0
Larry Curry            18    9    8    2   2   4/5    80.0   1/1   100.0   0/0     0   0
Luka Gasol             18    4    0    1   1   2/7    28.6   0/1     0.0   0/0     0   0
Tyler Smith            18    5    6    3   0   3/6    50.0   0/2     0.0   0/0     1   0

TEAM: FG: 33/73 (45.2%), 3PT: 5/19 (26.3%), REB: 51 (8 off, 43 def), AST: 21, TO: 17


Team_005
--------------------------------------------------------------------------------
Player                MIN  PTS  REB  AST  TO      FG   FG%      3P   3P%      FT STL BLK
--------------------------------------------------------------------------------
Brandon George         30   10    0    4   0   3/8    37.5   2/4    50.0   2/2     2   0
Anthony Rozier         30    7    0    1   0   3/8    37.5   0/1     0.0   0/0     2   2
Derrick Allen          30    9    7    0   3   3/12   25.0   2/10   20.0   0/0     0   0
Jalen Rozier           30   11    6    3   6   4/9    44.4   2/3    66.7   1/1     0   0
Cade Markkanen         30   12   12    2   1   6/7    85.7   0/0     0.0   0/1     3   2
Blake O'Neal           18    4    0    2   1   4/7    57.1   1/3    33.3   1/2     1   0
Draymond Smith         18    2   10    0   0   1/4    25.0   0/1     0.0   0/1     0   0
Lauri Wade             18    3    2    2   2   1/5    20.0   0/3     0.0   1/1     1   0
Isaiah Durant          18    7    0    0   1   3/5    60.0   1/1   100.0   0/0     1   0
Zion Parker            18    5    7    1   1   1/7    14.3   0/1     0.0   5/8     0   1

TEAM: FG: 29/74 (39.2%), 3PT: 8/27 (29.6%), REB: 46 (7 off, 39 def), AST: 15, TO: 15

================================================================================
