================================================================================
                        FULL GAME - Team_092 vs Team_016                        
================================================================================

================================================================================
                       1ST QUARTER - Team_092 vs Team_016                       
================================================================================

[12:00] Team_092 possession (Score: 0-0)
FOUL! Holding foul on Vince Quickley. [Team fouls: 1] No free throws, side out. (Vince Quickley: 1 personal fouls)

[11:45] Team_092 possession (Score: 0-0)
John Giddey attempts a Midrange. Contested by Ben Barrett (3.9 feet, MAN). JOHN GIDDEY MAKES IT!
Score: 2-0

[11:34] Team_016 possession (Score: 2-0)
Ben Barrett drives, John Giddey stays with him. Ben Barrett attempts a Dunk. Contested by John Giddey (4.6 feet, MAN). BEN BARRETT MAKES IT! Assist: Collin Barnes
Score: 2-2

[11:19] Team_092 possession (Score: 2-2)
Immanuel Ingram drives, picks up Vince Duncan. Help arrives from Collin Barnes! Immanuel Ingram attempts a Layup. Contested by Collin Barnes (3.0 feet, MAN). Immanuel Ingram misses. Rebound secured by Ben Barrett.

[11:07] Team_016 possession (Score: 2-2)
Vince Quickley drives to the basket... FOUL! Offensive foul on Vince Quickley! Paul James drew the charge! [Team fouls: 2] (Vince Quickley: 2 personal fouls) TURNOVER! (dead ball)

[10:51] Team_092 possession (Score: 2-2)
Austin Bridges drives to the basket... Austin Bridges throws a bad pass out of bounds! TURNOVER! (dead ball)

[10:37] Team_016 possession (Score: 2-2)
Vince Quickley attempts a 3Pt. Contested by John Giddey (3.6 feet, ZONE). Vince Quickley misses. Rebound secured by John Giddey.

[10:23] Team_092 possession (Score: 2-2)
Immanuel Ingram makes the Layup and draws the foul on Vince Duncan! And-1! Immanuel Ingram to the line for 1. [Team fouls: 3] (Vince Duncan: 1 personal fouls)   FT 1/1: MISS Immanuel Ingram makes 0/1 from the line. Rebound secured by Vince Duncan.
Score: 4-2

[10:10] Team_016 possession (Score: 4-2)
Ben Barrett attempts a 3Pt. Contested by John Giddey (4.6 feet, ZONE). Ben Barrett misses. Rebound secured by Immanuel Ingram.

[09:52] Team_092 possession (Score: 4-2)
Austin Bridges attempts a Midrange. Contested by Vince Duncan (2.9 feet, ZONE). Austin Bridges misses. Rebound secured by Ben Barrett.

[09:40] Team_016 possession (Score: 4-2)
Vince Quickley drives, Paul James stays with him. Vince Quickley attempts a Dunk. Contested by Paul James (4.3 feet, MAN). Vince Quickley misses. FOUL! Loose ball foul on John Giddey during the rebound battle. [Team fouls: 1] No free throws, side out. (John Giddey: 1 personal fouls)

[09:28] Team_016 possession (Score: 4-2)
Vince Duncan commits a violation (traveling/carry)! TURNOVER! (dead ball)

[09:16] Team_092 possession (Score: 4-2)
John Giddey attempts a Midrange. Contested by Ben Barrett (3.9 feet, MAN). JOHN GIDDEY MAKES IT! Assist: Austin Bridges
Score: 6-2

[09:06] Team_016 possession (Score: 6-2)
Collin Barnes attempts a Midrange. Contested by Austin Bridges (4.4 feet, MAN). Collin Barnes misses. Rebound secured by Immanuel Ingram.

[08:52] Team_092 possession (Score: 6-2)
Paul James attempts a 3Pt. Contested by Collin Barnes (4.7 feet, ZONE). PAUL JAMES MAKES IT! Assist: John Giddey
Score: 9-2

[08:37] Team_016 possession (Score: 9-2)
Vince Quickley attempts a 3Pt. Contested by John Giddey (3.6 feet, ZONE). Vince Quickley misses. Rebound secured by Paul James.

[08:19] Team_092 possession (Score: 9-2)
Immanuel Ingram drives to the basket... Immanuel Ingram throws a bad pass! Stolen by Vince Duncan! TURNOVER! (live ball)

[08:01] Team_016 possession (Score: 9-2)
Collin Barnes attempts a 3Pt. Contested by Austin Bridges (4.4 feet, MAN). Collin Barnes misses. Rebound secured by John Giddey.

[07:47] Team_092 possession (Score: 9-2)
Austin Bridges throws a bad pass! Stolen by Collin Barnes! TURNOVER! (live ball)

[07:36] Team_016 possession (Score: 9-2)
Ben Barrett drives to the basket... Ben Barrett commits a violation (traveling/carry)! TURNOVER! (dead ball)

[07:21] Team_092 possession (Score: 9-2)
Immanuel Ingram makes the Layup and draws the foul on Vince Duncan! And-1! Immanuel Ingram to the line for 1. [Team fouls: 4] (Vince Duncan: 2 personal fouls)   FT 1/1: GOOD Immanuel Ingram makes 1/1 from the line.
Score: 12-2

[07:06] Team_016 possession (Score: 12-2)
Ben Barrett drives and kicks out. Collin Barnes attempts a 3Pt. Contested by John Giddey (4.0 feet, ZONE). Collin Barnes misses. FOUL! Loose ball foul on Immanuel Ingram during the rebound battle. [Team fouls: 2] No free throws, side out. (Immanuel Ingram: 1 personal fouls)

[06:53] Team_016 possession (Score: 12-2)
Giannis Ginobili attempts a 3Pt. Contested by Karl Gobert (5.1 feet, ZONE). GIANNIS GINOBILI MAKES IT! Assist: Vince Duncan
Score: 12-5

[06:39] Team_092 possession (Score: 12-5)
John Giddey attempts a Layup. Contested by Ben Barrett (3.9 feet, MAN). John Giddey misses. Rebound secured by Vince Quickley.

[06:26] Team_016 possession (Score: 12-5)
Collin Barnes attempts a Layup. Contested by Austin Bridges (4.4 feet, MAN). COLLIN BARNES MAKES IT! Assist: Vince Quickley
Score: 12-7

[06:11] Team_092 possession (Score: 12-7)
Immanuel Ingram attempts a Midrange. Contested by Vince Duncan (3.0 feet, MAN). IMMANUEL INGRAM MAKES IT!
Score: 14-7

[05:55] Team_016 possession (Score: 14-7)
Collin Barnes attempts a 3Pt. Contested by Austin Bridges (4.4 feet, MAN). Collin Barnes misses. Rebound secured by Immanuel Ingram.

[05:40] Team_092 possession (Score: 14-7)
FOUL! Shooting foul on Collin Barnes. Karl Gobert to the line for 2 free throws. [BONUS: 5 team fouls] (Collin Barnes: 1 personal fouls)   FT 1/2: GOOD   FT 2/2: MISS Karl Gobert makes 1/2 from the line. Offensive rebound by John Giddey! John Giddey kicks it out.
Score: 15-7

[05:26] Team_092 possession (Score: 15-7)
Paul James drives, picks up Vince Quickley. Help arrives from Collin Barnes! Paul James attempts a Dunk. Contested by Collin Barnes (4.9 feet, MAN). PAUL JAMES MAKES IT! Assist: John Giddey
Score: 17-7

[05:15] Team_016 possession (Score: 17-7)
Vince Duncan drives, picks up John Giddey. Help arrives from Austin Bridges! Vince Duncan attempts a Dunk. Contested by Austin Bridges (4.4 feet, ZONE). VINCE DUNCAN MAKES IT! Assist: Vince Quickley
Score: 17-9

[05:01] Team_092 possession (Score: 17-9)
Immanuel Ingram attempts a Midrange. Contested by Giannis Ginobili (5.5 feet, ZONE). Immanuel Ingram misses. Rebound secured by Vince Quickley.

[04:48] Team_016 possession (Score: 17-9)
Vince Duncan commits a violation (traveling/carry)! TURNOVER! (dead ball)

[04:32] Team_092 possession (Score: 17-9)
John Giddey drives, picks up Vince Duncan. Help arrives from Collin Barnes! John Giddey attempts a Layup. Contested by Collin Barnes (3.5 feet, ZONE). JOHN GIDDEY MAKES IT! Assist: Karl Gobert
Score: 19-9

[04:19] Team_016 possession (Score: 19-9)
Collin Barnes attempts a 3Pt. BLOCKED BY AUSTIN BRIDGES! Ball deflects out of bounds off Collin Barnes.

[04:06] Team_092 possession (Score: 19-9)
Paul James attempts a 3Pt. Contested by Collin Barnes (4.8 feet, ZONE). PAUL JAMES MAKES IT! Assist: Karl Gobert
Score: 22-9

[03:53] Team_016 possession (Score: 22-9)
Vince Duncan attempts a Layup. Contested by John Giddey (4.6 feet, ZONE). VINCE DUNCAN MAKES IT! Assist: Collin Barnes
Score: 22-11

[03:38] Team_092 possession (Score: 22-11)
Karl Gobert attempts a Layup. Contested by Vince Duncan (3.2 feet, ZONE). KARL GOBERT MAKES IT! Assist: Immanuel Ingram
Score: 24-11

[03:20] Team_016 possession (Score: 24-11)
Vince Duncan drives, picks up John Giddey. Help arrives from Austin Bridges! Vince Duncan attempts a Layup. Contested by Austin Bridges (4.6 feet, ZONE). VINCE DUNCAN MAKES IT!
Score: 24-13

[03:03] Team_092 possession (Score: 24-13)
John Giddey attempts a Layup. BLOCKED BY VINCE DUNCAN! Ball is loose! Rebound secured by Ben Barrett.

[02:49] Team_016 possession (Score: 24-13)
Ben Barrett attempts a Midrange. Contested by John Giddey (4.8 feet, MAN). BEN BARRETT MAKES IT! Assist: Vince Quickley
Score: 24-15

[02:38] Team_092 possession (Score: 24-15)
Karl Gobert attempts a 3Pt. Contested by Giannis Ginobili (5.6 feet, MAN). Karl Gobert misses. Offensive rebound by Paul James! Paul James kicks it out.

[02:27] Team_092 possession (Score: 24-15)
Karl Gobert attempts a 3Pt. Contested by Giannis Ginobili (5.7 feet, MAN). KARL GOBERT MAKES IT! Assist: John Giddey
Score: 27-15

[02:11] Team_016 possession (Score: 27-15)
Collin Barnes attempts a Midrange. Contested by Austin Bridges (4.8 feet, MAN). Collin Barnes misses. Rebound secured by Paul James.

[01:52] Team_092 possession (Score: 27-15)
Karl Gobert attempts a 3Pt. Contested by Giannis Ginobili (5.7 feet, ZONE). Karl Gobert misses. Rebound secured by Vince Duncan.

[01:34] Team_016 possession (Score: 27-15)
Giannis Ginobili attempts a Layup. Contested by John Giddey (4.5 feet, ZONE). GIANNIS GINOBILI MAKES IT!
Score: 27-17

[01:20] Team_092 possession (Score: 27-17)
Karl Gobert attempts a 3Pt. Contested by Giannis Ginobili (5.7 feet, MAN). KARL GOBERT MAKES IT!
Score: 30-17

[01:08] Team_016 possession (Score: 30-17)
Vince Quickley makes the Layup and draws the foul on Paul James! And-1! Vince Quickley to the line for 1. [Team fouls: 3] (Paul James: 1 personal fouls)   FT 1/1: GOOD Vince Quickley makes 1/1 from the line.
Score: 30-20

[00:51] Team_092 possession (Score: 30-20)
Austin Bridges attempts a 3Pt. Contested by Collin Barnes (4.3 feet, ZONE). AUSTIN BRIDGES MAKES IT! Assist: Immanuel Ingram
Score: 33-20

[00:36] Team_016 possession (Score: 33-20)
Collin Barnes attempts a 3Pt. Contested by Austin Bridges (5.0 feet, ZONE). Collin Barnes misses. Rebound secured by John Giddey.

[00:20] Team_092 possession (Score: 33-20)
John Giddey drives and kicks out. Paul James attempts a 3Pt. Contested by Collin Barnes (4.7 feet, ZONE). Paul James misses. Rebound secured by Vince Duncan.

[00:04] Team_016 possession (Score: 33-20)
Vince Duncan attempts a Layup. Contested by Immanuel Ingram (4.8 feet, MAN). VINCE DUNCAN MAKES IT! Assist: Vince Quickley
Score: 33-22

================================================================================
                              1ST QUARTER COMPLETE                              
================================================================================

1ST QUARTER SCORE: Team_092 33, Team_016 22

BOX SCORE:
================================================================================

Team_092
--------------------------------------------------------------------------------
Player                MIN  PTS  REB  AST  TO      FG   FG%      3P   3P%
--------------------------------------------------------------------------------
Paul James             12    8    3    0   0   3/3   100.0     0/0   0.0
Karl Gobert            12    8    0    2   0   3/4    75.0     0/0   0.0
John Giddey            12    6    4    3   0   3/6    50.0     0/0   0.0
Immanuel Ingram        12    5    3    2   0   2/5    40.0     0/0   0.0
Austin Bridges         12    3    0    1   0   1/2    50.0     0/0   0.0

TEAM: FG: 12/20 (60.0%), 3PT: 5/6 (83.3%), REB: 10 (2 off, 8 def), AST: 8, TO: 3
TEAM FOULS: 3


Team_016
--------------------------------------------------------------------------------
Player                MIN  PTS  REB  AST  TO      FG   FG%      3P   3P%
--------------------------------------------------------------------------------
Vince Duncan           12    8    4    1   0   4/4   100.0     0/0   0.0
Giannis Ginobili       12    5    0    0   0   2/2   100.0     0/0   0.0
Ben Barrett            12    4    4    0   0   2/3    66.7     0/0   0.0
Vince Quickley         12    3    2    4   0   1/3    33.3     0/0   0.0
Collin Barnes          12    2    0    2   0   1/7    14.3     0/0   0.0

TEAM: FG: 10/19 (52.6%), 3PT: 1/8 (12.5%), REB: 10 (2 off, 8 def), AST: 7, TO: 4
TEAM FOULS: 5 [Team_092 in BONUS]

================================================================================

================================================================================
                       2ND QUARTER - Team_092 vs Team_016                       
================================================================================

[12:00] Team_092 possession (Score: 33-22)
John Giddey drives and kicks out. John Giddey attempts a Midrange. Contested by Ben Barrett (4.0 feet, MAN). John Giddey misses. Rebound secured by Ben Barrett.

[11:48] Team_016 possession (Score: 33-22)
Vince Duncan attempts a Midrange. Contested by Immanuel Ingram (4.6 feet, MAN). Vince Duncan misses. Rebound secured by Paul James.

[11:33] Team_092 possession (Score: 33-22)
Karl Gobert attempts a Layup. Contested by Giannis Ginobili (5.7 feet, MAN). KARL GOBERT MAKES IT! Assist: John Giddey
Score: 35-22

[11:17] Team_016 possession (Score: 35-22)
Vince Duncan drives, John Giddey stays with him. Vince Duncan attempts a Dunk. Contested by John Giddey (4.8 feet, ZONE). Vince Duncan misses. Rebound secured by Immanuel Ingram.

[11:01] Team_092 possession (Score: 35-22)
Paul James makes the Layup and draws the foul on Giannis Ginobili! And-1! Paul James to the line for 1. [Team fouls: 1] (Giannis Ginobili: 1 personal fouls)   FT 1/1: GOOD Paul James makes 1/1 from the line.
Score: 38-22

[10:47] Team_016 possession (Score: 38-22)
Vince Quickley attempts a Layup. Contested by John Giddey (4.1 feet, ZONE). Vince Quickley misses. Rebound secured by Immanuel Ingram.

[10:33] Team_092 possession (Score: 38-22)
Karl Gobert drives, Giannis Ginobili stays with him. Karl Gobert attempts a Layup. Contested by Giannis Ginobili (5.8 feet, MAN). Karl Gobert misses. Rebound secured by Ben Barrett.

[10:18] Team_016 possession (Score: 38-22)
FOUL! Offensive foul on Vince Quickley! Paul James drew the charge! [Team fouls: 2] (Vince Quickley: 1 personal fouls) TURNOVER! (dead ball)

[10:03] Team_092 possession (Score: 38-22)
Karl Gobert drives to the basket... Karl Gobert loses the ball! Stripped by Giannis Ginobili! TURNOVER! (live ball)

[09:47] Team_016 possession (Score: 38-22)
Ben Barrett drives and kicks out. Collin Barnes attempts a Midrange. Contested by Austin Bridges (5.2 feet, MAN). Collin Barnes misses. Offensive rebound by Ben Barrett! Ben Barrett puts it back in!
Score: 38-24

[09:37] Team_092 possession (Score: 38-24)
Paul James attempts a 3Pt. Contested by Vince Quickley (5.3 feet, MAN). PAUL JAMES MAKES IT! Assist: Immanuel Ingram
Score: 41-24

[09:25] Team_016 possession (Score: 41-24)
FOUL! Offensive foul on Collin Barnes! Austin Bridges drew the charge! [Team fouls: 3] (Collin Barnes: 1 personal fouls) TURNOVER! (dead ball)

[09:10] Team_092 possession (Score: 41-24)
Karl Gobert attempts a 3Pt. Contested by Giannis Ginobili (5.9 feet, MAN). Karl Gobert misses. Rebound secured by Vince Duncan.

[09:00] Team_016 possession (Score: 41-24)
FOUL! Reach-in foul on John Giddey during the drive. [Team fouls: 1] No free throws, side out. (John Giddey: 1 personal fouls)

[08:48] Team_016 possession (Score: 41-24)
Vince Duncan makes the Midrange and draws the foul on Immanuel Ingram! And-1! Vince Duncan to the line for 1. [Team fouls: 2] (Immanuel Ingram: 1 personal fouls)   FT 1/1: GOOD Vince Duncan makes 1/1 from the line.
Score: 41-27

[08:33] Team_092 possession (Score: 41-27)
John Giddey attempts a Midrange. Wide open! Giannis Ginobili is 6.3 feet away. [ZONE] John Giddey misses. Rebound secured by Vince Quickley.

[08:19] Team_016 possession (Score: 41-27)
FOUL! Holding foul on Immanuel Ingram. [Team fouls: 3] No free throws, side out. (Immanuel Ingram: 2 personal fouls)

[08:03] Team_016 possession (Score: 41-27)
Vince Duncan drives to the basket... Vince Duncan loses control! Ball rolls out of bounds! TURNOVER! (dead ball)

[08:03] Substitution (Team_092): Austin Bridges OUT → Bones Giddey IN (stamina_rule2)

[08:03] Substitution (Team_092): Karl Gobert OUT → Shaquille Russell IN (stamina_rule2)

[08:03] Substitution (Team_092): Paul James OUT → Vince Harris IN (stamina_rule2)

[08:03] Substitution (Team_092): John Giddey OUT → Shaquille Paul IN (stamina_rule2)

[08:03] Substitution (Team_092): Immanuel Ingram OUT → Pau Reaves IN (stamina_rule2)

[08:03] Substitution (Team_016): Collin Barnes OUT → Lamelo Herro IN (stamina_rule2)

[08:03] Substitution (Team_016): Giannis Ginobili OUT → Immanuel Nowitzki IN (stamina_rule2)

[08:03] Substitution (Team_016): Vince Quickley OUT → Kevin Butler IN (stamina_rule2)

[08:03] Substitution (Team_016): Ben Barrett OUT → Giannis Doncic IN (stamina_rule2)

[08:03] Substitution (Team_016): Vince Duncan OUT → Trae Barnes IN (stamina_rule2)

[07:49] Team_092 possession (Score: 41-27)
Bones Giddey attempts a 3Pt. Contested by Lamelo Herro (3.5 feet, ZONE). BONES GIDDEY MAKES IT!
Score: 44-27

[07:36] Team_016 possession (Score: 44-27)
Trae Barnes attempts a 3Pt. Contested by Vince Harris (3.9 feet, ZONE). Trae Barnes misses. Rebound secured by Shaquille Russell.

[07:21] Team_092 possession (Score: 44-27)
FOUL! Offensive foul on Shaquille Russell! Immanuel Nowitzki drew the charge! [Team fouls: 4] (Shaquille Russell: 1 personal fouls) TURNOVER! (dead ball)

[07:08] Team_016 possession (Score: 44-27)
FOUL! Shooting foul on Pau Reaves. Immanuel Nowitzki to the line for 2 free throws. [BONUS: 5 team fouls] (Pau Reaves: 1 personal fouls)   FT 1/2: GOOD   FT 2/2: GOOD Immanuel Nowitzki makes 2/2 from the line.
Score: 44-29

[06:54] Team_092 possession (Score: 44-29)
Shaquille Russell attempts a Midrange. Contested by Immanuel Nowitzki (5.0 feet, ZONE). Shaquille Russell misses. Rebound secured by Giannis Doncic.

[06:39] Team_016 possession (Score: 44-29)
FOUL! Reach-in foul on Pau Reaves during the drive. [IN THE BONUS! 6 team fouls] Trae Barnes to the line for 2 free throws. (Pau Reaves: 2 personal fouls)   FT 1/2: MISS   FT 2/2: GOOD Trae Barnes makes 1/2 from the line.
Score: 44-30

[06:23] Team_092 possession (Score: 44-30)
Shaquille Paul attempts a 3Pt. Contested by Giannis Doncic (4.3 feet, MAN). Shaquille Paul misses. Rebound secured by Lamelo Herro.

[06:10] Team_016 possession (Score: 44-30)
Trae Barnes drives and kicks out. Immanuel Nowitzki attempts a 3Pt. Contested by Shaquille Russell (4.2 feet, MAN). Immanuel Nowitzki misses. Rebound secured by Shaquille Paul.

[05:59] Team_092 possession (Score: 44-30)
Bones Giddey attempts a 3Pt. Contested by Lamelo Herro (3.5 feet, ZONE). Bones Giddey misses. Rebound secured by Trae Barnes.

[05:43] Team_016 possession (Score: 44-30)
FOUL! Shooting foul on Pau Reaves. Lamelo Herro to the line for 2 free throws. [BONUS: 7 team fouls] (Pau Reaves: 3 personal fouls)   FT 1/2: GOOD   FT 2/2: GOOD Lamelo Herro makes 2/2 from the line.
Score: 44-32

[05:28] Team_092 possession (Score: 44-32)
Bones Giddey drives and kicks out. Shaquille Paul attempts a 3Pt. Contested by Lamelo Herro (3.8 feet, ZONE). Shaquille Paul misses. FOUL! Loose ball foul on Trae Barnes during the rebound battle. [Team fouls: 4] No free throws, side out. (Trae Barnes: 1 personal fouls)

[05:13] Team_092 possession (Score: 44-32)
Bones Giddey attempts a 3Pt. Contested by Lamelo Herro (3.5 feet, ZONE). Bones Giddey misses. Rebound secured by Trae Barnes.

[05:02] Team_016 possession (Score: 44-32)
Giannis Doncic attempts a Layup. Contested by Pau Reaves (4.8 feet, ZONE). Giannis Doncic misses. Rebound secured by Shaquille Paul.

[04:49] Team_092 possession (Score: 44-32)
Vince Harris attempts a 3Pt. Contested by Kevin Butler (4.5 feet, MAN). Vince Harris misses. Rebound secured by Trae Barnes.

[04:31] Team_016 possession (Score: 44-32)
Immanuel Nowitzki drives, picks up Pau Reaves. Help arrives from Shaquille Russell! Immanuel Nowitzki attempts a Dunk. Contested by Shaquille Russell (4.9 feet, ZONE). IMMANUEL NOWITZKI MAKES IT! Assist: Giannis Doncic
Score: 44-34

[04:12] Team_092 possession (Score: 44-34)
Shaquille Russell attempts a 3Pt. Contested by Lamelo Herro (4.2 feet, ZONE). Shaquille Russell misses. Rebound secured by Trae Barnes.

[03:52] Team_016 possession (Score: 44-34)
Immanuel Nowitzki loses the ball! Stripped by Shaquille Russell! TURNOVER! (live ball)

[03:37] Team_092 possession (Score: 44-34)
Shaquille Paul drives and kicks out. Pau Reaves attempts a 3Pt. Contested by Trae Barnes (5.7 feet, MAN). Pau Reaves misses. Rebound secured by Lamelo Herro.

[03:19] Team_016 possession (Score: 44-34)
FOUL! Shooting foul on Bones Giddey. Lamelo Herro to the line for 2 free throws. [BONUS: 8 team fouls] (Bones Giddey: 1 personal fouls)   FT 1/2: GOOD   FT 2/2: GOOD Lamelo Herro makes 2/2 from the line.
Score: 44-36

[03:06] Team_092 possession (Score: 44-36)
Shaquille Russell attempts a 3Pt. Contested by Lamelo Herro (4.2 feet, ZONE). SHAQUILLE RUSSELL MAKES IT! Assist: Shaquille Paul
Score: 47-36

[02:48] Team_016 possession (Score: 47-36)
FOUL! Holding foul on Pau Reaves. [IN THE BONUS! 9 team fouls] Trae Barnes to the line for 2 free throws. (Pau Reaves: 4 personal fouls)   FT 1/2: GOOD   FT 2/2: GOOD Trae Barnes makes 2/2 from the line.
Score: 47-38

[02:39] Team_092 possession (Score: 47-38)
FOUL! Offensive foul on Pau Reaves! Trae Barnes drew the charge! [Team fouls: 10] (Pau Reaves: 5 personal fouls) TURNOVER! (dead ball)

[02:22] Team_016 possession (Score: 47-38)
Giannis Doncic drives to the basket... Giannis Doncic commits a violation (traveling/carry)! TURNOVER! (dead ball)

[02:03] Team_092 possession (Score: 47-38)
Shaquille Paul attempts a Layup. Contested by Giannis Doncic (4.3 feet, ZONE). SHAQUILLE PAUL MAKES IT! Assist: Shaquille Russell
Score: 49-38

[01:47] Team_016 possession (Score: 49-38)
Immanuel Nowitzki drives and kicks out. Immanuel Nowitzki attempts a 3Pt. Contested by Shaquille Russell (4.2 feet, MAN). Immanuel Nowitzki misses. Rebound secured by Pau Reaves.

[01:32] Team_092 possession (Score: 49-38)
Vince Harris attempts a 3Pt. Contested by Kevin Butler (4.5 feet, MAN). Vince Harris misses. Rebound secured by Lamelo Herro.

[01:19] Team_016 possession (Score: 49-38)
Kevin Butler throws a bad pass! Stolen by Vince Harris! TURNOVER! (live ball)

[01:04] Team_092 possession (Score: 49-38)
Shaquille Paul drives and kicks out. Bones Giddey attempts a Midrange. Contested by Lamelo Herro (3.8 feet, MAN). Bones Giddey misses. Rebound secured by Lamelo Herro.

[00:50] Team_016 possession (Score: 49-38)
Immanuel Nowitzki drives and kicks out. FOUL! Shooting foul on Shaquille Paul. Giannis Doncic to the line for 3 free throws. [BONUS: 11 team fouls] (Shaquille Paul: 1 personal fouls)   FT 1/3: GOOD   FT 2/3: GOOD   FT 3/3: GOOD Giannis Doncic makes 3/3 from the line.
Score: 49-41

[00:35] Team_092 possession (Score: 49-41)
Shaquille Paul attempts a 3Pt. Contested by Lamelo Herro (4.4 feet, ZONE). Shaquille Paul misses. Rebound secured by Lamelo Herro.

[00:24] Team_016 possession (Score: 49-41)
Trae Barnes drives and kicks out. FOUL! Shooting foul on Shaquille Russell. Lamelo Herro to the line for 2 free throws. [BONUS: 12 team fouls] (Shaquille Russell: 2 personal fouls)   FT 1/2: MISS   FT 2/2: MISS Lamelo Herro makes 0/2 from the line. Offensive rebound by Giannis Doncic! Giannis Doncic kicks it out.

[00:07] Team_016 possession (Score: 49-41)
Kevin Butler throws a bad pass! Stolen by Vince Harris! TURNOVER! (live ball)

================================================================================
                              2ND QUARTER COMPLETE                              
================================================================================

2ND QUARTER SCORE: Team_092 16, Team_016 19

BOX SCORE:
================================================================================

Team_092
--------------------------------------------------------------------------------
Player                MIN  PTS  REB  AST  TO      FG   FG%      3P   3P%
--------------------------------------------------------------------------------
Paul James             16    6    1    0   0   2/2   100.0     0/0   0.0
Bones Giddey            8    3    0    0   0   1/3    33.3     0/0   0.0
Shaquille Russell       8    3    1    1   0   1/3    33.3     0/0   0.0
Karl Gobert            16    2    0    0   0   1/3    33.3     0/0   0.0
Shaquille Paul          8    2    2    1   0   1/5    20.0     0/0   0.0
John Giddey            16    0    0    1   0   0/2     0.0     0/0   0.0
Immanuel Ingram        16    0    2    1   0   0/0     0.0     0/0   0.0
Pau Reaves              8    0    2    0   0   0/0     0.0     0/0   0.0
Vince Harris            8    0    0    0   0   0/2     0.0     0/0   0.0

TEAM: FG: 6/20 (30.0%), 3PT: 3/11 (27.3%), REB: 8 (1 off, 7 def), AST: 4, TO: 3
TEAM FOULS: 12 [Team_016 in BONUS]


Team_016
--------------------------------------------------------------------------------
Player                MIN  PTS  REB  AST  TO      FG   FG%      3P   3P%
--------------------------------------------------------------------------------
Immanuel Nowitzki       8    4    0    0   0   2/3    66.7     0/0   0.0
Lamelo Herro            8    4    5    0   0   2/2   100.0     0/0   0.0
Vince Duncan           16    3    1    0   0   1/3    33.3     0/0   0.0
Trae Barnes             8    3    4    0   0   2/4    50.0     0/0   0.0
Giannis Doncic          8    3    2    1   0   1/2    50.0     0/0   0.0
Ben Barrett            16    2    3    0   0   1/1   100.0     0/0   0.0
Vince Quickley         16    0    1    0   0   0/1     0.0     0/0   0.0

TEAM: FG: 9/16 (56.2%), 3PT: 0/1 (0.0%), REB: 16 (2 off, 14 def), AST: 1, TO: 7
TEAM FOULS: 4

================================================================================

================================================================================
                       3RD QUARTER - Team_092 vs Team_016                       
================================================================================

[12:00] Team_092 possession (Score: 49-41)
Austin Bridges attempts a 3Pt. Contested by Collin Barnes (3.8 feet, ZONE). Austin Bridges misses. Rebound secured by Ben Barrett.

[11:49] Team_016 possession (Score: 49-41)
Ben Barrett attempts a 3Pt. Contested by John Giddey (4.6 feet, ZONE). BEN BARRETT MAKES IT! Assist: Vince Quickley
Score: 49-44

[11:35] Team_092 possession (Score: 49-44)
John Giddey attempts a 3Pt. Contested by Collin Barnes (4.3 feet, ZONE). JOHN GIDDEY MAKES IT! Assist: Immanuel Ingram
Score: 52-44

[11:17] Team_016 possession (Score: 52-44)
FOUL! Offensive foul on Ben Barrett! John Giddey drew the charge! [Team fouls: 1] (Ben Barrett: 1 personal fouls) TURNOVER! (dead ball)

[11:03] Team_092 possession (Score: 52-44)
Immanuel Ingram drives to the basket... FOUL! Offensive foul on Immanuel Ingram! Vince Duncan drew the charge! [Team fouls: 1] (Immanuel Ingram: 1 personal fouls) TURNOVER! (dead ball)

[10:50] Team_016 possession (Score: 52-44)
Ben Barrett makes the Dunk and draws the foul on John Giddey! And-1! Ben Barrett to the line for 1. [Team fouls: 2] (John Giddey: 1 personal fouls)   FT 1/1: GOOD Ben Barrett makes 1/1 from the line.
Score: 52-47

[10:31] Team_092 possession (Score: 52-47)
Paul James attempts a 3Pt. Contested by Collin Barnes (4.7 feet, ZONE). PAUL JAMES MAKES IT! Assist: Immanuel Ingram
Score: 55-47

[10:19] Team_016 possession (Score: 55-47)
Vince Duncan attempts a Layup. Contested by Immanuel Ingram (4.4 feet, MAN). VINCE DUNCAN MAKES IT! Assist: Collin Barnes
Score: 55-49

[10:07] Team_092 possession (Score: 55-49)
FOUL! Shooting foul on Giannis Ginobili. Karl Gobert to the line for 2 free throws. [Team fouls: 2] (Giannis Ginobili: 1 personal fouls)   FT 1/2: GOOD   FT 2/2: MISS Karl Gobert makes 1/2 from the line. FOUL! Loose ball foul on Vince Duncan during the free throw rebound! [Team fouls: 3] No free throws, side out. (Vince Duncan: 1 personal fouls)
Score: 56-49

[09:52] Team_092 possession (Score: 56-49)
Paul James attempts a Midrange. Contested by Vince Quickley (4.9 feet, MAN). PAUL JAMES MAKES IT! Assist: Immanuel Ingram
Score: 58-49

[09:40] Team_016 possession (Score: 58-49)
Vince Quickley drives to the basket... Vince Quickley loses control! Ball rolls out of bounds! TURNOVER! (dead ball)

[09:25] Team_092 possession (Score: 58-49)
Immanuel Ingram drives and kicks out. Immanuel Ingram attempts a Midrange. Contested by Giannis Ginobili (5.6 feet, ZONE). IMMANUEL INGRAM MAKES IT! Assist: Paul James
Score: 60-49

[09:11] Team_016 possession (Score: 60-49)
Giannis Ginobili drives to the basket... Giannis Ginobili throws a bad pass out of bounds! TURNOVER! (dead ball)

[08:55] Team_092 possession (Score: 60-49)
Immanuel Ingram attempts a 3Pt. Contested by Collin Barnes (3.9 feet, ZONE). Immanuel Ingram misses. Rebound secured by Ben Barrett.

[08:42] Team_016 possession (Score: 60-49)
Collin Barnes attempts a Midrange. Contested by John Giddey (4.1 feet, ZONE). Collin Barnes misses. FOUL! Loose ball foul on Paul James during the rebound battle. [Team fouls: 3] No free throws, side out. (Paul James: 1 personal fouls)

[08:30] Team_016 possession (Score: 60-49)
Collin Barnes attempts a Midrange. Contested by Paul James (4.8 feet, ZONE). Collin Barnes misses. FOUL! Loose ball foul on John Giddey during the rebound battle. [Team fouls: 4] No free throws, side out. (John Giddey: 2 personal fouls)

[08:14] Team_016 possession (Score: 60-49)
Vince Duncan attempts a Layup. Contested by John Giddey (4.4 feet, ZONE). VINCE DUNCAN MAKES IT! Assist: Ben Barrett
Score: 60-51

[07:59] Team_092 possession (Score: 60-51)
Karl Gobert attempts a Midrange. Contested by Giannis Ginobili (5.5 feet, MAN). KARL GOBERT MAKES IT!
Score: 62-51

[07:46] Team_016 possession (Score: 62-51)
Ben Barrett attempts a Midrange. Contested by Karl Gobert (5.6 feet, ZONE). Ben Barrett misses. Offensive rebound by Vince Duncan! Vince Duncan's putback is no good. Rebound secured by Paul James.

[07:35] Team_092 possession (Score: 62-51)
John Giddey drives to the basket... John Giddey loses the ball! Stripped by Ben Barrett! TURNOVER! (live ball)

[07:19] Team_016 possession (Score: 62-51)
Vince Quickley drives and kicks out. Ben Barrett attempts a Midrange. Contested by John Giddey (4.0 feet, ZONE). Ben Barrett misses. Rebound secured by John Giddey.

[07:04] Team_092 possession (Score: 62-51)
Paul James drives and kicks out. Immanuel Ingram attempts a 3Pt. Contested by Collin Barnes (4.0 feet, ZONE). Immanuel Ingram misses. Rebound secured by Vince Duncan.

[06:50] Team_016 possession (Score: 62-51)
Ben Barrett drives and kicks out. Ben Barrett attempts a Midrange. Contested by John Giddey (4.0 feet, ZONE). Ben Barrett misses. Rebound secured by John Giddey.

[06:33] Team_092 possession (Score: 62-51)
FOUL! Shooting foul on Vince Duncan. Karl Gobert to the line for 2 free throws. [Team fouls: 4] (Vince Duncan: 2 personal fouls)   FT 1/2: GOOD   FT 2/2: MISS Karl Gobert makes 1/2 from the line. FOUL! Loose ball foul on Vince Duncan during the free throw rebound! [IN THE BONUS! 5 team fouls] Paul James to the line for 2 free throws. (Vince Duncan: 3 personal fouls)   FT 1/2: GOOD   FT 2/2: GOOD Paul James makes 2/2 from the line.
Score: 65-51

[06:17] Team_016 possession (Score: 65-51)
Collin Barnes attempts a Midrange. Contested by Karl Gobert (5.1 feet, ZONE). COLLIN BARNES MAKES IT!
Score: 65-53

[06:04] Team_092 possession (Score: 65-53)
Immanuel Ingram attempts a Midrange. Contested by Vince Quickley (4.1 feet, ZONE). Immanuel Ingram misses. Rebound secured by Vince Quickley.

[05:52] Team_016 possession (Score: 65-53)
FOUL! Reach-in foul on John Giddey during the drive. [IN THE BONUS! 5 team fouls] Vince Quickley to the line for 2 free throws. (John Giddey: 3 personal fouls)   FT 1/2: GOOD   FT 2/2: GOOD Vince Quickley makes 2/2 from the line.
Score: 65-55

[05:38] Team_092 possession (Score: 65-55)
Immanuel Ingram attempts a Midrange. Contested by Vince Duncan (3.0 feet, MAN). Immanuel Ingram misses. Rebound secured by Vince Quickley.

[05:25] Team_016 possession (Score: 65-55)
Ben Barrett attempts a Midrange. Contested by John Giddey (4.6 feet, MAN). Ben Barrett misses. Rebound secured by John Giddey.

[05:12] Team_092 possession (Score: 65-55)
Paul James attempts a 3Pt. Contested by Vince Quickley (4.9 feet, MAN). Paul James misses. Rebound secured by Ben Barrett.

[05:03] Team_016 possession (Score: 65-55)
Giannis Ginobili attempts a 3Pt. Contested by Karl Gobert (5.2 feet, MAN). Giannis Ginobili misses. Rebound secured by Immanuel Ingram.

[04:46] Team_092 possession (Score: 65-55)
Paul James attempts a Layup. Contested by Vince Duncan (3.9 feet, ZONE). Paul James misses. Rebound secured by Vince Duncan.

[04:36] Team_016 possession (Score: 65-55)
Giannis Ginobili attempts a 3Pt. Contested by Karl Gobert (5.2 feet, MAN). Giannis Ginobili misses. Rebound secured by Immanuel Ingram.

[04:20] Team_092 possession (Score: 65-55)
Paul James attempts a 3Pt. Contested by Vince Quickley (4.9 feet, MAN). Paul James misses. Offensive rebound by Paul James! Paul James kicks it out.

[04:06] Team_092 possession (Score: 65-55)
Karl Gobert attempts a 3Pt. Contested by Giannis Ginobili (5.5 feet, ZONE). Karl Gobert misses. Rebound secured by Vince Duncan.

[03:51] Team_016 possession (Score: 65-55)
Vince Quickley throws a bad pass! Stolen by Paul James! TURNOVER! (live ball)

[03:39] Team_092 possession (Score: 65-55)
FOUL! Reach-in foul on Vince Duncan during the drive. [IN THE BONUS! 6 team fouls] Immanuel Ingram to the line for 2 free throws. (Vince Duncan: 4 personal fouls)   FT 1/2: GOOD   FT 2/2: GOOD Immanuel Ingram makes 2/2 from the line.
Score: 67-55

[03:23] Team_016 possession (Score: 67-55)
Ben Barrett attempts a Midrange. Contested by John Giddey (4.8 feet, MAN). BEN BARRETT MAKES IT! Assist: Vince Quickley
Score: 67-57

[03:10] Team_092 possession (Score: 67-57)
FOUL! Shooting foul on Ben Barrett. John Giddey to the line for 2 free throws. [BONUS: 7 team fouls] (Ben Barrett: 2 personal fouls)   FT 1/2: GOOD   FT 2/2: GOOD John Giddey makes 2/2 from the line.
Score: 69-57

[02:53] Team_016 possession (Score: 69-57)
Giannis Ginobili attempts a 3Pt. Contested by Paul James (5.0 feet, ZONE). Giannis Ginobili misses. Rebound secured by John Giddey.

[02:37] Team_092 possession (Score: 69-57)
Karl Gobert attempts a Midrange. Contested by Vince Duncan (3.4 feet, ZONE). Karl Gobert misses. Rebound secured by Ben Barrett.

[02:25] Team_016 possession (Score: 69-57)
FOUL! Shooting foul on John Giddey. Giannis Ginobili to the line for 3 free throws. [BONUS: 6 team fouls] (John Giddey: 4 personal fouls)   FT 1/3: GOOD   FT 2/3: GOOD   FT 3/3: GOOD Giannis Ginobili makes 3/3 from the line.
Score: 69-60

[02:11] Team_092 possession (Score: 69-60)
Immanuel Ingram attempts a Midrange. Contested by Giannis Ginobili (5.7 feet, ZONE). IMMANUEL INGRAM MAKES IT!
Score: 71-60

[01:58] Team_016 possession (Score: 71-60)
Giannis Ginobili attempts a Midrange. Contested by Karl Gobert (5.4 feet, MAN). GIANNIS GINOBILI MAKES IT!
Score: 71-62

[01:42] Team_092 possession (Score: 71-62)
Paul James attempts a 3Pt. Contested by Collin Barnes (5.1 feet, ZONE). Paul James misses. FOUL! Loose ball foul on Vince Quickley during the rebound battle. [IN THE BONUS! 8 team fouls] Paul James to the line for 2 free throws. (Vince Quickley: 1 personal fouls)   FT 1/2: GOOD   FT 2/2: GOOD Paul James makes 2/2 from the line.
Score: 73-62

[01:30] Team_016 possession (Score: 73-62)
Giannis Ginobili makes the 3Pt and draws the foul on John Giddey! And-1! Giannis Ginobili to the line for 1. [BONUS: 7 team fouls] (John Giddey: 5 personal fouls)   FT 1/1: GOOD Giannis Ginobili makes 1/1 from the line.
Score: 73-66

[01:17] Team_092 possession (Score: 73-66)
Paul James attempts a Layup. BLOCKED BY VINCE DUNCAN! Ball is loose! Offensive rebound by John Giddey! John Giddey kicks it out.

[01:01] Team_092 possession (Score: 73-66)
Immanuel Ingram attempts a Midrange. Contested by Ben Barrett (4.0 feet, ZONE). Immanuel Ingram misses. Rebound secured by Vince Duncan.

[00:45] Team_016 possession (Score: 73-66)
Ben Barrett attempts a Layup. Contested by John Giddey (5.1 feet, MAN). Ben Barrett misses. Rebound secured by Paul James.

[00:33] Team_092 possession (Score: 73-66)
Karl Gobert attempts a 3Pt. Contested by Collin Barnes (4.5 feet, ZONE). KARL GOBERT MAKES IT! Assist: John Giddey
Score: 76-66

[00:17] Team_016 possession (Score: 76-66)
Vince Duncan attempts a 3Pt. Contested by John Giddey (5.0 feet, ZONE). VINCE DUNCAN MAKES IT! Assist: Vince Quickley
Score: 76-69

[00:03] Team_092 possession (Score: 76-69)
Immanuel Ingram drives to the basket... FOUL! Offensive foul on Immanuel Ingram! Vince Duncan drew the charge! [Team fouls: 8] (Immanuel Ingram: 2 personal fouls) TURNOVER! (dead ball)

================================================================================
                              3RD QUARTER COMPLETE                              
================================================================================

3RD QUARTER SCORE: Team_092 27, Team_016 28

BOX SCORE:
================================================================================

Team_092
--------------------------------------------------------------------------------
Player                MIN  PTS  REB  AST  TO      FG   FG%      3P   3P%
--------------------------------------------------------------------------------
Paul James             29   10    4    1   0   4/7    57.1     0/0   0.0
Immanuel Ingram        29    6    2    3   0   3/7    42.9     0/0   0.0
John Giddey            29    5    5    1   0   2/2   100.0     0/0   0.0
Karl Gobert            29    5    0    0   0   2/4    50.0     0/0   0.0
Austin Bridges         29    0    0    0   0   0/1     0.0     0/0   0.0

TEAM: FG: 11/21 (52.4%), 3PT: 4/8 (50.0%), REB: 10 (3 off, 7 def), AST: 5, TO: 3
TEAM FOULS: 8 [Team_016 in BONUS]


Team_016
--------------------------------------------------------------------------------
Player                MIN  PTS  REB  AST  TO      FG   FG%      3P   3P%
--------------------------------------------------------------------------------
Giannis Ginobili       29    9    0    0   0   3/6    50.0     0/0   0.0
Ben Barrett            29    8    6    1   0   3/7    42.9     0/0   0.0
Vince Duncan           29    7    4    0   0   3/3   100.0     0/0   0.0
Vince Quickley         29    2    2    3   0   1/2    50.0     0/0   0.0
Collin Barnes          29    2    0    1   0   1/1   100.0     0/0   0.0

TEAM: FG: 11/19 (57.9%), 3PT: 4/7 (57.1%), REB: 13 (3 off, 10 def), AST: 5, TO: 4
TEAM FOULS: 8 [Team_092 in BONUS]

================================================================================

================================================================================
                       4TH QUARTER - Team_092 vs Team_016                       
================================================================================

[12:00] Team_092 possession (Score: 76-69)
Immanuel Ingram makes the Layup and draws the foul on Vince Duncan! And-1! Immanuel Ingram to the line for 1. [Team fouls: 1] (Vince Duncan: 1 personal fouls)   FT 1/1: GOOD Immanuel Ingram makes 1/1 from the line.
Score: 79-69

[11:48] Team_016 possession (Score: 79-69)
Vince Duncan attempts a 3Pt. Contested by John Giddey (4.8 feet, ZONE). Vince Duncan misses. Rebound secured by Immanuel Ingram.

[11:34] Team_092 possession (Score: 79-69)
Paul James drives and kicks out. Austin Bridges attempts a 3Pt. Contested by Vince Quickley (4.5 feet, ZONE). Austin Bridges misses. Offensive rebound by John Giddey! John Giddey kicks it out.

[11:20] Team_092 possession (Score: 79-69)
Karl Gobert attempts a Layup. Contested by Giannis Ginobili (5.7 feet, MAN). KARL GOBERT MAKES IT! Assist: John Giddey
Score: 81-69

[11:02] Team_016 possession (Score: 81-69)
Vince Duncan attempts a Midrange. Contested by Immanuel Ingram (4.7 feet, MAN). Vince Duncan misses. Offensive rebound by Ben Barrett! Ben Barrett puts it back in!
Score: 81-71

[10:48] Team_092 possession (Score: 81-71)
John Giddey drives and kicks out. FOUL! Shooting foul on Giannis Ginobili. Karl Gobert to the line for 3 free throws. [Team fouls: 2] (Giannis Ginobili: 1 personal fouls)   FT 1/3: GOOD   FT 2/3: GOOD   FT 3/3: GOOD Karl Gobert makes 3/3 from the line.
Score: 84-71

[10:36] Team_016 possession (Score: 84-71)
Ben Barrett attempts a Layup. Contested by John Giddey (5.1 feet, ZONE). BEN BARRETT MAKES IT! Assist: Giannis Ginobili
Score: 84-73

[10:26] Team_092 possession (Score: 84-73)
Paul James attempts a 3Pt. Contested by Vince Quickley (5.2 feet, MAN). Paul James misses. Offensive rebound by John Giddey! John Giddey kicks it out.

[10:11] Team_092 possession (Score: 84-73)
John Giddey makes the Dunk and draws the foul on Ben Barrett! And-1! John Giddey to the line for 1. [Team fouls: 3] (Ben Barrett: 1 personal fouls)   FT 1/1: GOOD John Giddey makes 1/1 from the line.
Score: 87-73

[10:01] Team_016 possession (Score: 87-73)
Vince Quickley attempts a 3Pt. Contested by John Giddey (4.3 feet, ZONE). Vince Quickley misses. Rebound secured by Immanuel Ingram.

[09:50] Team_092 possession (Score: 87-73)
Paul James attempts a 3Pt. Contested by Vince Quickley (5.3 feet, MAN). PAUL JAMES MAKES IT!
Score: 90-73

[09:35] Team_016 possession (Score: 90-73)
Collin Barnes attempts a 3Pt. Contested by Austin Bridges (5.2 feet, MAN). Collin Barnes misses. Rebound secured by John Giddey.

[09:20] Team_092 possession (Score: 90-73)
Karl Gobert attempts a Midrange. Contested by Giannis Ginobili (5.9 feet, MAN). Karl Gobert misses. Offensive rebound by John Giddey! John Giddey kicks it out.

[09:07] Team_092 possession (Score: 90-73)
Austin Bridges attempts a Midrange. Contested by Vince Quickley (4.5 feet, ZONE). AUSTIN BRIDGES MAKES IT! Assist: Immanuel Ingram
Score: 92-73

[08:51] Team_016 possession (Score: 92-73)
Collin Barnes attempts a Layup. Contested by Austin Bridges (5.3 feet, MAN). Collin Barnes misses. Offensive rebound by Ben Barrett! Ben Barrett puts it back in!
Score: 92-75

[08:35] Team_092 possession (Score: 92-75)
Austin Bridges attempts a 3Pt. Contested by Collin Barnes (4.7 feet, ZONE). Austin Bridges misses. Rebound secured by Vince Quickley.

[08:21] Team_016 possession (Score: 92-75)
FOUL! Holding foul on Paul James. [Team fouls: 1] No free throws, side out. (Paul James: 1 personal fouls)

[08:10] Team_016 possession (Score: 92-75)
Giannis Ginobili attempts a Midrange. Contested by John Giddey (5.1 feet, ZONE). GIANNIS GINOBILI MAKES IT! Assist: Vince Quickley
Score: 92-77

[08:00] Team_092 possession (Score: 92-77)
FOUL! Holding foul on Giannis Ginobili. [Team fouls: 4] No free throws, side out. (Giannis Ginobili: 2 personal fouls)

[07:43] Team_092 possession (Score: 92-77)
John Giddey drives and kicks out. Paul James attempts a 3Pt. Contested by Vince Quickley (5.0 feet, MAN). PAUL JAMES MAKES IT! Assist: John Giddey
Score: 95-77

[07:27] Team_016 possession (Score: 95-77)
Ben Barrett attempts a 3Pt. Contested by John Giddey (5.5 feet, MAN). BEN BARRETT MAKES IT! Assist: Collin Barnes
Score: 95-80

[07:15] Team_092 possession (Score: 95-80)
Paul James attempts a Midrange. Wide open! Giannis Ginobili is 6.8 feet away. [ZONE] Paul James misses. Rebound secured by Vince Duncan.

[06:59] Team_016 possession (Score: 95-80)
Vince Quickley attempts a 3Pt. Contested by John Giddey (4.8 feet, ZONE). VINCE QUICKLEY MAKES IT! Assist: Vince Duncan
Score: 95-83

[06:43] Team_092 possession (Score: 95-83)
Karl Gobert attempts a Layup. Contested by Vince Duncan (4.3 feet, ZONE). Karl Gobert misses. Rebound secured by Ben Barrett.

[06:33] Team_016 possession (Score: 95-83)
Vince Duncan drives, picks up John Giddey. Help arrives from Austin Bridges! Vince Duncan attempts a Dunk. Contested by Austin Bridges (5.5 feet, ZONE). Vince Duncan misses. Rebound secured by Paul James.

[06:22] Team_092 possession (Score: 95-83)
Paul James drives to the basket... Paul James loses the ball! Stripped by Vince Duncan! TURNOVER! (live ball)

[06:09] Team_016 possession (Score: 95-83)
FOUL! Offensive foul on Collin Barnes! Austin Bridges drew the charge! [Team fouls: 5] (Collin Barnes: 1 personal fouls) TURNOVER! (dead ball)

[05:55] Team_092 possession (Score: 95-83)
John Giddey drives and kicks out. Karl Gobert attempts a 3Pt. Wide open! Giannis Ginobili is 6.5 feet away. [MAN] KARL GOBERT MAKES IT! Assist: Paul James
Score: 98-83

[05:39] Team_016 possession (Score: 98-83)
Giannis Ginobili makes the Layup and draws the foul on John Giddey! And-1! Giannis Ginobili to the line for 1. [Team fouls: 2] (John Giddey: 1 personal fouls)   FT 1/1: GOOD Giannis Ginobili makes 1/1 from the line.
Score: 98-86

[05:24] Team_092 possession (Score: 98-86)
Immanuel Ingram drives and kicks out. Paul James attempts a 3Pt. Contested by Vince Quickley (5.4 feet, MAN). Paul James misses. Offensive rebound by John Giddey! John Giddey kicks it out.

[05:07] Team_092 possession (Score: 98-86)
FOUL! Reach-in foul on Giannis Ginobili during the drive. [IN THE BONUS! 6 team fouls] Karl Gobert to the line for 2 free throws. (Giannis Ginobili: 3 personal fouls)   FT 1/2: GOOD   FT 2/2: GOOD Karl Gobert makes 2/2 from the line.
Score: 100-86

[04:54] Team_016 possession (Score: 100-86)
Vince Duncan attempts a 3Pt. Contested by John Giddey (5.8 feet, ZONE). Vince Duncan misses. Rebound secured by Immanuel Ingram.

[04:39] Team_092 possession (Score: 100-86)
Paul James attempts a 3Pt. Wide open! Collin Barnes is 6.1 feet away. [ZONE] Paul James misses. Rebound secured by Ben Barrett.

[04:23] Team_016 possession (Score: 100-86)
Giannis Ginobili attempts a Midrange. Wide open! Karl Gobert is 6.4 feet away. [MAN] GIANNIS GINOBILI MAKES IT!
Score: 100-88

[04:10] Team_092 possession (Score: 100-88)
John Giddey attempts a 3Pt. Contested by Collin Barnes (5.8 feet, ZONE). John Giddey misses. Rebound secured by Ben Barrett.

[03:55] Team_016 possession (Score: 100-88)
Vince Quickley throws a bad pass! Stolen by Paul James! TURNOVER! (live ball)

[03:43] Team_092 possession (Score: 100-88)
Austin Bridges attempts a Midrange. Contested by Vince Quickley (5.2 feet, ZONE). Austin Bridges misses. Rebound secured by Ben Barrett.

[03:28] Team_016 possession (Score: 100-88)
Ben Barrett attempts a Layup. Wide open! John Giddey is 6.1 feet away. [MAN] Ben Barrett misses. Rebound secured by Immanuel Ingram.

[03:12] Team_092 possession (Score: 100-88)
Karl Gobert loses control! Ball rolls out of bounds! TURNOVER! (dead ball)

[03:12] Substitution (Team_092): Austin Bridges OUT → Bones Giddey IN (stamina_rule2)

[03:12] Substitution (Team_092): Karl Gobert OUT → Shaquille Russell IN (stamina_rule2)

[03:12] Substitution (Team_092): Paul James OUT → Vince Harris IN (stamina_rule2)

[03:12] Substitution (Team_092): John Giddey OUT → Shaquille Paul IN (stamina_rule2)

[03:12] Substitution (Team_092): Immanuel Ingram OUT → Pau Reaves IN (stamina_rule2)

[03:12] Substitution (Team_016): Collin Barnes OUT → Lamelo Herro IN (stamina_rule2)

[03:12] Substitution (Team_016): Giannis Ginobili OUT → Immanuel Nowitzki IN (stamina_rule2)

[03:12] Substitution (Team_016): Vince Quickley OUT → Kevin Butler IN (stamina_rule2)

[03:12] Substitution (Team_016): Ben Barrett OUT → Giannis Doncic IN (stamina_rule2)

[03:12] Substitution (Team_016): Vince Duncan OUT → Trae Barnes IN (stamina_rule2)

[02:54] Team_016 possession (Score: 100-88)
Giannis Doncic drives, picks up Pau Reaves. Help arrives from Shaquille Russell! Giannis Doncic attempts a Dunk. Contested by Shaquille Russell (4.8 feet, ZONE). GIANNIS DONCIC MAKES IT!
Score: 100-90

[02:38] Team_092 possession (Score: 100-90)
Shaquille Russell attempts a 3Pt. Contested by Immanuel Nowitzki (5.0 feet, MAN). SHAQUILLE RUSSELL MAKES IT! Assist: Vince Harris
Score: 103-90

[02:26] Team_016 possession (Score: 103-90)
FOUL! Holding foul on Shaquille Russell. [Team fouls: 3] No free throws, side out. (Shaquille Russell: 1 personal fouls)

[02:13] Team_016 possession (Score: 103-90)
Kevin Butler drives and kicks out. Giannis Doncic attempts a 3Pt. Contested by Shaquille Paul (5.6 feet, MAN). Giannis Doncic misses. Offensive rebound by Giannis Doncic! Giannis Doncic kicks it out.

[01:59] Team_016 possession (Score: 103-90)
Lamelo Herro attempts a 3Pt. Contested by Shaquille Russell (4.1 feet, ZONE). Lamelo Herro misses. Rebound secured by Shaquille Paul.

[01:41] Team_092 possession (Score: 103-90)
Vince Harris makes the Layup and draws the foul on Giannis Doncic! And-1! Vince Harris to the line for 1. [BONUS: 7 team fouls] (Giannis Doncic: 1 personal fouls)   FT 1/1: GOOD Vince Harris makes 1/1 from the line.
Score: 106-90

[01:21] Team_016 possession (Score: 106-90)
Trae Barnes attempts a Midrange. Contested by Pau Reaves (4.6 feet, MAN). Trae Barnes misses. Rebound secured by Shaquille Paul.

[01:07] Team_092 possession (Score: 106-90)
FOUL! Shooting foul on Giannis Doncic. Vince Harris to the line for 2 free throws. [BONUS: 8 team fouls] (Giannis Doncic: 2 personal fouls)   FT 1/2: GOOD   FT 2/2: GOOD Vince Harris makes 2/2 from the line.
Score: 108-90

[00:52] Team_016 possession (Score: 108-90)
Trae Barnes drives to the basket... Trae Barnes loses the ball! Stripped by Pau Reaves! TURNOVER! (live ball)

[00:38] Team_092 possession (Score: 108-90)
Shaquille Russell attempts a 3Pt. Contested by Immanuel Nowitzki (5.0 feet, MAN). SHAQUILLE RUSSELL MAKES IT! Assist: Vince Harris
Score: 111-90

[00:26] Team_016 possession (Score: 111-90)
Lamelo Herro attempts a 3Pt. Contested by Vince Harris (4.1 feet, ZONE). Lamelo Herro misses. Offensive rebound by Trae Barnes! Trae Barnes kicks it out.

[00:12] Team_016 possession (Score: 111-90)
Giannis Doncic attempts a Layup. Contested by Shaquille Paul (5.6 feet, ZONE). GIANNIS DONCIC MAKES IT! Assist: Lamelo Herro
Score: 111-92

[00:02] Team_092 possession (Score: 111-92)
Vince Harris attempts a 3Pt. Contested by Lamelo Herro (3.9 feet, ZONE). Vince Harris misses. Rebound secured by Giannis Doncic.

================================================================================
                              4TH QUARTER COMPLETE                              
================================================================================

4TH QUARTER SCORE: Team_092 35, Team_016 23

BOX SCORE:
================================================================================

Team_092
--------------------------------------------------------------------------------
Player                MIN  PTS  REB  AST  TO      FG   FG%      3P   3P%
--------------------------------------------------------------------------------
Karl Gobert            38   10    0    0   0   4/5    80.0     0/0   0.0
Paul James             38    6    1    1   0   2/4    50.0     0/0   0.0
Shaquille Russell      11    6    0    0   0   2/2   100.0     0/0   0.0
Vince Harris           11    5    0    2   0   2/3    66.7     0/0   0.0
Immanuel Ingram        38    3    4    1   0   1/1   100.0     0/0   0.0
John Giddey            38    3    5    2   0   1/2    50.0     0/0   0.0
Austin Bridges         38    2    0    0   0   1/3    33.3     0/0   0.0
Shaquille Paul         11    0    2    0   0   0/0     0.0     0/0   0.0

TEAM: FG: 13/20 (65.0%), 3PT: 3/7 (42.9%), REB: 12 (4 off, 8 def), AST: 6, TO: 2
TEAM FOULS: 3


Team_016
--------------------------------------------------------------------------------
Player                MIN  PTS  REB  AST  TO      FG   FG%      3P   3P%
--------------------------------------------------------------------------------
Ben Barrett            38    9    6    0   0   4/5    80.0     0/0   0.0
Giannis Ginobili       38    7    0    1   0   3/3   100.0     0/0   0.0
Giannis Doncic         11    4    2    0   0   2/2   100.0     0/0   0.0
Vince Quickley         38    3    1    1   0   1/2    50.0     0/0   0.0
Vince Duncan           38    0    1    1   0   0/3     0.0     0/0   0.0
Collin Barnes          38    0    0    1   0   0/1     0.0     0/0   0.0
Lamelo Herro           11    0    0    1   0   0/1     0.0     0/0   0.0
Trae Barnes            11    0    1    0   0   0/1     0.0     0/0   0.0

TEAM: FG: 10/18 (55.6%), 3PT: 2/7 (28.6%), REB: 11 (4 off, 7 def), AST: 5, TO: 3
TEAM FOULS: 8 [Team_092 in BONUS]

================================================================================

================================================================================
                               FULL GAME COMPLETE                               
================================================================================

FINAL SCORE: Team_092 111, Team_016 92

SCORING BY QUARTER:
--------------------------------------------------------------------------------
Team                     Q1     Q2     Q3     Q4    FINAL
--------------------------------------------------------------------------------
Team_092                 33     16     27     35      111
Team_016                 22     19     28     23       92
--------------------------------------------------------------------------------

FULL GAME BOX SCORE:
================================================================================

Team_092
--------------------------------------------------------------------------------
Player                MIN  PTS  REB  AST  TO      FG   FG%      3P   3P%      FT STL BLK
--------------------------------------------------------------------------------
Austin Bridges         38    5    0    1   1   2/6    33.3   1/3    33.3   0/0     0   1
Karl Gobert            38   25    0    2   2   9/15   60.0   3/6    50.0   8/11    0   0
Paul James             38   30    9    2   1   9/14   64.3   6/8    75.0   3/3     2   0
John Giddey            38   14   14    7   3   9/15   60.0   1/2    50.0   3/3     0   0
Immanuel Ingram        38   14   11    7   2   6/13   46.2   0/1     0.0   4/5     0   0
Bones Giddey           11    3    0    0   0   1/3    33.3   1/3    33.3   0/0     0   0
Shaquille Russell      11    9    1    1   1   3/5    60.0   3/4    75.0   0/0     1   0
Vince Harris           11    5    0    2   0   2/5    40.0   0/3     0.0   3/3     2   0
Shaquille Paul         11    2    4    1   0   1/5    20.0   0/2     0.0   0/0     0   0
Pau Reaves             11    0    2    0   1   0/0     0.0   0/0     0.0   0/0     1   0

TEAM: FG: 42/81 (51.9%), 3PT: 15/32 (46.9%), REB: 40 (10 off, 30 def), AST: 23, TO: 11


Team_016
--------------------------------------------------------------------------------
Player                MIN  PTS  REB  AST  TO      FG   FG%      3P   3P%      FT STL BLK
--------------------------------------------------------------------------------
Collin Barnes          38    4    0    4   2   3/10   30.0   0/5     0.0   0/0     1   0
Giannis Ginobili       38   21    0    1   1   8/11   72.7   3/6    50.0   5/5     1   0
Vince Quickley         38    8    6    8   4   3/8    37.5   1/4    25.0   3/3     0   0
Ben Barrett            38   23   19    1   3   8/14   57.1   2/3    66.7   1/1     1   0
Vince Duncan           38   18   10    2   3   9/14   64.3   1/3    33.3   1/1     2   2
Lamelo Herro           11    4    5    1   0   2/3    66.7   0/1     0.0   4/6     0   0
Immanuel Nowitzki      11    4    0    0   2   3/4    75.0   0/0     0.0   2/2     0   0
Kevin Butler           11    0    0    0   2   0/0     0.0   0/0     0.0   0/0     0   0
Giannis Doncic         11    7    4    1   1   2/3    66.7   0/0     0.0   3/3     0   0
Trae Barnes            11    3    5    0   0   1/4    25.0   0/1     0.0   3/4     0   0

TEAM: FG: 40/72 (55.6%), 3PT: 7/23 (30.4%), REB: 50 (11 off, 39 def), AST: 18, TO: 18

================================================================================
