================================================================================
                        FULL GAME - Team_021 vs Team_074                        
================================================================================

================================================================================
                       1ST QUARTER - Team_021 vs Team_074                       
================================================================================

[12:00] Team_021 possession (Score: 0-0)
Kyrie Leonard attempts a 3Pt. Contested by Dwyane Quickley (5.3 feet, MAN). Kyrie Leonard misses. Offensive rebound by Zach Carter! Zach Carter kicks it out.

[11:49] Team_021 possession (Score: 0-0)
Kyrie Wagner attempts a Layup. Contested by James Turner (3.5 feet, ZONE). KYRIE WAGNER MAKES IT! Assist: Anthony Oladipo
Score: 2-0

[11:37] Team_074 possession (Score: 2-0)
Dwyane Quickley drives and kicks out. Dwyane Quickley attempts a 3Pt. Contested by Kyrie Leonard (4.5 feet, MAN). Dwyane Quickley misses. Offensive rebound by James Turner! James Turner's putback is no good. Rebound secured by Kyrie Leonard.

[11:23] Team_021 possession (Score: 2-0)
Zach Carter drives, James Turner stays with him. Zach Carter attempts a Layup. Contested by James Turner (3.8 feet, MAN). ZACH CARTER MAKES IT!
Score: 4-0

[11:09] Team_074 possession (Score: 4-0)
Dwyane Quickley attempts a 3Pt. Contested by Kyrie Leonard (4.8 feet, MAN). Dwyane Quickley misses. Rebound secured by Kyrie Leonard.

[10:54] Team_021 possession (Score: 4-0)
Zach Carter attempts a Midrange. Contested by James Turner (3.8 feet, MAN). Zach Carter misses. Rebound secured by Donovan Doncic.

[10:40] Team_074 possession (Score: 4-0)
Chris Carter attempts a 3Pt. Contested by Kyrie Wagner (4.6 feet, ZONE). Chris Carter misses. Offensive rebound by Donovan Doncic! Donovan Doncic kicks it out.

[10:24] Team_074 possession (Score: 4-0)
Donovan Doncic commits a violation (traveling/carry)! TURNOVER! (dead ball)

[10:09] Team_021 possession (Score: 4-0)
Anthony Oladipo attempts a Layup. Contested by Chris Carter (4.2 feet, MAN). ANTHONY OLADIPO MAKES IT! Assist: Zach Carter
Score: 6-0

[09:54] Team_074 possession (Score: 6-0)
Shai Green attempts a 3Pt. Contested by Kyrie Wagner (4.5 feet, ZONE). Shai Green misses. Rebound secured by Zach Carter.

[09:37] Team_021 possession (Score: 6-0)
Kyrie Leonard attempts a 3Pt. Contested by Dwyane Quickley (5.3 feet, ZONE). Kyrie Leonard misses. Rebound secured by Donovan Doncic.

[09:20] Team_074 possession (Score: 6-0)
FOUL! Reach-in foul on Zach Carter during the drive. [Team fouls: 1] No free throws, side out. (Zach Carter: 1 personal fouls)

[09:10] Team_074 possession (Score: 6-0)
Donovan Doncic attempts a 3Pt. Contested by Kyrie Wagner (4.3 feet, MAN). Donovan Doncic misses. Rebound secured by Anthony Oladipo.

[08:56] Team_021 possession (Score: 6-0)
Kyrie Leonard attempts a Midrange. Contested by Dwyane Quickley (5.3 feet, MAN). KYRIE LEONARD MAKES IT!
Score: 8-0

[08:39] Team_074 possession (Score: 8-0)
FOUL! Shooting foul on Karl Bridges. Shai Green to the line for 3 free throws. [Team fouls: 2] (Karl Bridges: 1 personal fouls)   FT 1/3: GOOD   FT 2/3: GOOD   FT 3/3: GOOD Shai Green makes 3/3 from the line.
Score: 8-3

[08:28] Team_021 possession (Score: 8-3)
Karl Bridges attempts a Midrange. Contested by Shai Green (3.4 feet, ZONE). Karl Bridges misses. Offensive rebound by Kyrie Leonard! Kyrie Leonard kicks it out.

[08:12] Team_021 possession (Score: 8-3)
Karl Bridges drives and kicks out. Anthony Oladipo attempts a 3Pt. Contested by Dwyane Quickley (5.4 feet, ZONE). Anthony Oladipo misses. Rebound secured by Donovan Doncic.

[07:59] Team_074 possession (Score: 8-3)
James Turner drives and kicks out. James Turner makes the 3Pt and draws the foul on Kyrie Wagner! And-1! James Turner to the line for 1. [Team fouls: 3] (Kyrie Wagner: 1 personal fouls)   FT 1/1: GOOD James Turner makes 1/1 from the line.
Score: 8-7

[07:44] Team_021 possession (Score: 8-7)
Anthony Oladipo drives and kicks out. Karl Bridges attempts a Midrange. Contested by Shai Green (3.5 feet, MAN). KARL BRIDGES MAKES IT!
Score: 10-7

[07:33] Team_074 possession (Score: 10-7)
Shai Green drives, picks up Karl Bridges. Help arrives from Kyrie Leonard! Shai Green attempts a Layup. Wide open! Kyrie Leonard is 6.1 feet away. [MAN] SHAI GREEN MAKES IT! Assist: Donovan Doncic
Score: 10-9

[07:23] Team_021 possession (Score: 10-9)
Karl Bridges attempts a 3Pt. Contested by Dwyane Quickley (5.3 feet, ZONE). KARL BRIDGES MAKES IT!
Score: 13-9

[07:03] Team_074 possession (Score: 13-9)
James Turner drives, Zach Carter stays with him. James Turner attempts a Dunk. Contested by Zach Carter (4.7 feet, ZONE). JAMES TURNER MAKES IT! Assist: Shai Green
Score: 13-11

[06:50] Team_021 possession (Score: 13-11)
Karl Bridges attempts a 3Pt. Contested by Dwyane Quickley (5.3 feet, ZONE). Karl Bridges misses. Rebound secured by Shai Green.

[06:33] Team_074 possession (Score: 13-11)
Dwyane Quickley makes the Midrange and draws the foul on Kyrie Wagner! And-1! Dwyane Quickley to the line for 1. [Team fouls: 4] (Kyrie Wagner: 2 personal fouls)   FT 1/1: GOOD Dwyane Quickley makes 1/1 from the line.
Score: 13-14

[06:21] Team_021 possession (Score: 13-14)
Kyrie Leonard attempts a Midrange. Contested by Donovan Doncic (3.5 feet, ZONE). KYRIE LEONARD MAKES IT! Assist: Kyrie Wagner
Score: 15-14

[06:04] Team_074 possession (Score: 15-14)
James Turner drives, picks up Zach Carter. Help arrives from Kyrie Leonard! James Turner attempts a Layup. Contested by Kyrie Leonard (4.7 feet, MAN). JAMES TURNER MAKES IT! Assist: Shai Green
Score: 15-16

[05:45] Team_021 possession (Score: 15-16)
Anthony Oladipo drives, picks up Donovan Doncic. Help arrives from Chris Carter! Anthony Oladipo attempts a Layup. Contested by Chris Carter (3.6 feet, ZONE). Anthony Oladipo misses. Offensive rebound by Zach Carter! Zach Carter kicks it out.

[05:28] Team_021 possession (Score: 15-16)
Kyrie Leonard loses the ball! Stripped by Dwyane Quickley! TURNOVER! (live ball)

[05:16] Team_074 possession (Score: 15-16)
Donovan Doncic attempts a Midrange. Contested by Kyrie Wagner (4.3 feet, MAN). DONOVAN DONCIC MAKES IT!
Score: 15-18

[05:04] Team_021 possession (Score: 15-18)
Anthony Oladipo drives to the basket... Anthony Oladipo throws a bad pass out of bounds! TURNOVER! (dead ball)

[04:49] Team_074 possession (Score: 15-18)
James Turner attempts a Layup. Contested by Kyrie Wagner (4.7 feet, ZONE). JAMES TURNER MAKES IT! Assist: Shai Green
Score: 15-20

[04:36] Team_021 possession (Score: 15-20)
Zach Carter attempts a 3Pt. Contested by James Turner (3.9 feet, MAN). ZACH CARTER MAKES IT! Assist: Anthony Oladipo
Score: 18-20

[04:23] Team_074 possession (Score: 18-20)
Chris Carter drives and kicks out. Donovan Doncic attempts a 3Pt. Contested by Kyrie Wagner (4.1 feet, MAN). Donovan Doncic misses. Offensive rebound by Donovan Doncic! Donovan Doncic kicks it out.

[04:09] Team_074 possession (Score: 18-20)
FOUL! Offensive foul on James Turner! Zach Carter drew the charge! [Team fouls: 1] (James Turner: 1 personal fouls) TURNOVER! (dead ball)

[03:54] Team_021 possession (Score: 18-20)
Anthony Oladipo attempts a 3Pt. Contested by Chris Carter (4.3 feet, MAN). Anthony Oladipo misses. Rebound secured by James Turner.

[03:41] Team_074 possession (Score: 18-20)
James Turner loses control! Ball rolls out of bounds! TURNOVER! (dead ball)

[03:26] Team_021 possession (Score: 18-20)
Zach Carter throws a bad pass out of bounds! TURNOVER! (dead ball)

[03:10] Team_074 possession (Score: 18-20)
Dwyane Quickley makes the Layup and draws the foul on Kyrie Leonard! And-1! Dwyane Quickley to the line for 1. [BONUS: 5 team fouls] (Kyrie Leonard: 1 personal fouls)   FT 1/1: GOOD Dwyane Quickley makes 1/1 from the line.
Score: 18-23

[02:51] Team_021 possession (Score: 18-23)
Zach Carter drives and kicks out. Kyrie Leonard attempts a Midrange. Contested by Donovan Doncic (3.9 feet, ZONE). KYRIE LEONARD MAKES IT! Assist: Zach Carter
Score: 20-23

[02:41] Team_074 possession (Score: 20-23)
Donovan Doncic drives to the basket... Donovan Doncic commits a violation (traveling/carry)! TURNOVER! (dead ball)

[02:41] Substitution (Team_021): Kyrie Wagner OUT → Vince George IN (stamina_rule2)

[02:41] Substitution (Team_074): Chris Carter OUT → Giannis Westbrook IN (stamina_rule2)

[02:41] Substitution (Team_074): Shai Green OUT → Ayo Smith IN (stamina_rule2)

[02:25] Team_021 possession (Score: 20-23)
Karl Bridges attempts a 3Pt. Contested by Ayo Smith (4.6 feet, ZONE). Karl Bridges misses. Rebound secured by Donovan Doncic.

[02:09] Team_074 possession (Score: 20-23)
Giannis Westbrook attempts a Midrange. Contested by Zach Carter (4.4 feet, ZONE). Giannis Westbrook misses. Rebound secured by Zach Carter.

[02:00] Team_021 possession (Score: 20-23)
Zach Carter attempts a 3Pt. Contested by Ayo Smith (5.1 feet, ZONE). Zach Carter misses. Rebound secured by James Turner.

[01:44] Team_074 possession (Score: 20-23)
James Turner drives and kicks out. Ayo Smith attempts a 3Pt. Contested by Karl Bridges (5.9 feet, MAN). Ayo Smith misses. Offensive rebound by Donovan Doncic! Donovan Doncic kicks it out.

[01:26] Team_074 possession (Score: 20-23)
Giannis Westbrook drives to the basket... Giannis Westbrook throws a bad pass! Stolen by Zach Carter! TURNOVER! (live ball)

[01:12] Team_021 possession (Score: 20-23)
Anthony Oladipo attempts a 3Pt. Contested by Ayo Smith (4.7 feet, ZONE). Anthony Oladipo misses. Rebound secured by Donovan Doncic.

[00:57] Team_074 possession (Score: 20-23)
Dwyane Quickley attempts a 3Pt. Contested by Kyrie Leonard (5.2 feet, MAN). Dwyane Quickley misses. Offensive rebound by Donovan Doncic! Donovan Doncic kicks it out.

[00:44] Team_074 possession (Score: 20-23)
Ayo Smith attempts a 3Pt. Contested by Anthony Oladipo (5.2 feet, ZONE). Ayo Smith misses. Rebound secured by Kyrie Leonard.

[00:28] Team_021 possession (Score: 20-23)
FOUL! Shooting foul on Giannis Westbrook. Anthony Oladipo to the line for 3 free throws. [Team fouls: 2] (Giannis Westbrook: 1 personal fouls)   FT 1/3: GOOD   FT 2/3: GOOD   FT 3/3: GOOD Anthony Oladipo makes 3/3 from the line.
Score: 23-23

[00:15] Team_074 possession (Score: 23-23)
Ayo Smith attempts a 3Pt. Contested by Anthony Oladipo (5.3 feet, ZONE). AYO SMITH MAKES IT! Assist: Donovan Doncic
Score: 23-26

[00:02] Team_021 possession (Score: 23-26)
Karl Bridges drives, Ayo Smith stays with him. Karl Bridges attempts a Dunk. Contested by Ayo Smith (4.6 feet, MAN). Karl Bridges misses. Rebound secured by Ayo Smith.

================================================================================
                              1ST QUARTER COMPLETE                              
================================================================================

1ST QUARTER SCORE: Team_021 23, Team_074 26

BOX SCORE:
================================================================================

Team_021
--------------------------------------------------------------------------------
Player                MIN  PTS  REB  AST  TO      FG   FG%      3P   3P%
--------------------------------------------------------------------------------
Kyrie Leonard          12    6    4    0   0   3/4    75.0     0/0   0.0
Zach Carter            12    5    4    2   0   2/4    50.0     0/0   0.0
Anthony Oladipo        12    5    1    2   0   2/4    50.0     0/0   0.0
Karl Bridges           12    5    0    0   0   2/6    33.3     0/0   0.0
Kyrie Wagner           10    2    0    1   0   1/1   100.0     0/0   0.0

TEAM: FG: 10/19 (52.6%), 3PT: 3/9 (33.3%), REB: 8 (3 off, 5 def), AST: 5, TO: 3
TEAM FOULS: 5 [Team_074 in BONUS]


Team_074
--------------------------------------------------------------------------------
Player                MIN  PTS  REB  AST  TO      FG   FG%      3P   3P%
--------------------------------------------------------------------------------
James Turner           12   10    2    0   0   4/4   100.0     0/0   0.0
Dwyane Quickley        12    6    0    0   0   2/4    50.0     0/0   0.0
Shai Green             10    5    1    3   0   2/3    66.7     0/0   0.0
Ayo Smith               3    3    1    0   0   1/2    50.0     0/0   0.0
Donovan Doncic         12    2    9    2   0   1/2    50.0     0/0   0.0
Giannis Westbrook       3    0    0    0   0   0/1     0.0     0/0   0.0

TEAM: FG: 10/16 (62.5%), 3PT: 2/6 (33.3%), REB: 14 (5 off, 9 def), AST: 5, TO: 5
TEAM FOULS: 2

================================================================================

================================================================================
                       2ND QUARTER - Team_021 vs Team_074                       
================================================================================

[12:00] Team_021 possession (Score: 23-26)
Karl Bridges attempts a 3Pt. Contested by Shai Green (3.3 feet, MAN). KARL BRIDGES MAKES IT! Assist: Kyrie Leonard
Score: 26-26

[11:46] Team_074 possession (Score: 26-26)
Dwyane Quickley drives and kicks out. Chris Carter attempts a 3Pt. Contested by Anthony Oladipo (4.9 feet, MAN). Chris Carter misses. Rebound secured by Kyrie Leonard.

[11:32] Team_021 possession (Score: 26-26)
FOUL! Shooting foul on Donovan Doncic. Zach Carter to the line for 2 free throws. [Team fouls: 1] (Donovan Doncic: 1 personal fouls)   FT 1/2: GOOD   FT 2/2: GOOD Zach Carter makes 2/2 from the line.
Score: 28-26

[11:15] Team_074 possession (Score: 28-26)
Chris Carter attempts a Layup. Contested by Anthony Oladipo (5.6 feet, MAN). CHRIS CARTER MAKES IT! Assist: Dwyane Quickley
Score: 28-28

[11:01] Team_021 possession (Score: 28-28)
Kyrie Wagner attempts a Midrange. Contested by Shai Green (3.6 feet, ZONE). KYRIE WAGNER MAKES IT!
Score: 30-28

[10:47] Team_074 possession (Score: 30-28)
Donovan Doncic drives, Kyrie Wagner stays with him. Donovan Doncic attempts a Dunk. Contested by Kyrie Wagner (4.3 feet, MAN). DONOVAN DONCIC MAKES IT!
Score: 30-30

[10:33] Team_021 possession (Score: 30-30)
FOUL! Holding foul on Shai Green. [Team fouls: 2] No free throws, side out. (Shai Green: 1 personal fouls)

[10:18] Team_021 possession (Score: 30-30)
FOUL! Reach-in foul on Donovan Doncic during the drive. [Team fouls: 3] No free throws, side out. (Donovan Doncic: 2 personal fouls)

[10:00] Team_021 possession (Score: 30-30)
FOUL! Reach-in foul on Dwyane Quickley during the drive. [Team fouls: 4] No free throws, side out. (Dwyane Quickley: 1 personal fouls)

[09:41] Team_021 possession (Score: 30-30)
Karl Bridges attempts a 3Pt. Contested by Chris Carter (4.2 feet, ZONE). KARL BRIDGES MAKES IT! Assist: Kyrie Leonard
Score: 33-30

[09:24] Team_074 possession (Score: 33-30)
Dwyane Quickley makes the Layup and draws the foul on Kyrie Leonard! And-1! Dwyane Quickley to the line for 1. [Team fouls: 1] (Kyrie Leonard: 1 personal fouls)   FT 1/1: GOOD Dwyane Quickley makes 1/1 from the line.
Score: 33-33

[09:08] Team_021 possession (Score: 33-33)
Karl Bridges attempts a 3Pt. Contested by Chris Carter (4.3 feet, ZONE). Karl Bridges misses. Rebound secured by Shai Green.

[08:53] Team_074 possession (Score: 33-33)
Chris Carter attempts a 3Pt. BLOCKED BY KYRIE WAGNER! Ball is loose! Offensive rebound by James Turner! James Turner kicks it out.

[08:39] Team_074 possession (Score: 33-33)
Dwyane Quickley attempts a 3Pt. Contested by Kyrie Leonard (5.4 feet, ZONE). DWYANE QUICKLEY MAKES IT! Assist: Donovan Doncic
Score: 33-36

[08:23] Team_021 possession (Score: 33-36)
Anthony Oladipo attempts a Midrange. Contested by Shai Green (3.7 feet, ZONE). ANTHONY OLADIPO MAKES IT!
Score: 35-36

[08:07] Team_074 possession (Score: 35-36)
Donovan Doncic drives to the basket... Donovan Doncic throws a bad pass out of bounds! TURNOVER! (dead ball)

[08:07] Substitution (Team_021): Kyrie Leonard OUT → Joel LaVine IN (stamina_rule2)

[08:07] Substitution (Team_021): Anthony Oladipo OUT → Victor Mitchell IN (stamina_rule2)

[08:07] Substitution (Team_021): Karl Bridges OUT → Paul Allen IN (stamina_rule2)

[08:07] Substitution (Team_021): Kyrie Wagner OUT → Vince George IN (stamina_rule2)

[08:07] Substitution (Team_021): Zach Carter OUT → Magic Ingram IN (stamina_rule2)

[08:07] Substitution (Team_074): Dwyane Quickley OUT → James Barnes IN (stamina_rule2)

[08:07] Substitution (Team_074): Chris Carter OUT → Giannis Westbrook IN (stamina_rule2)

[08:07] Substitution (Team_074): Shai Green OUT → Ayo Smith IN (stamina_rule2)

[08:07] Substitution (Team_074): Donovan Doncic OUT → Yao Randle IN (stamina_rule2)

[08:07] Substitution (Team_074): James Turner OUT → Jaren Rozier IN (stamina_rule2)

[07:52] Team_021 possession (Score: 35-36)
FOUL! Holding foul on Giannis Westbrook. [IN THE BONUS! 5 team fouls] Victor Mitchell to the line for 2 free throws. (Giannis Westbrook: 1 personal fouls)   FT 1/2: GOOD   FT 2/2: GOOD Victor Mitchell makes 2/2 from the line.
Score: 37-36

[07:39] Team_074 possession (Score: 37-36)
Giannis Westbrook attempts a Midrange. Contested by Paul Allen (5.9 feet, ZONE). GIANNIS WESTBROOK MAKES IT! Assist: Yao Randle
Score: 37-38

[07:21] Team_021 possession (Score: 37-38)
Paul Allen attempts a 3Pt. Contested by Ayo Smith (5.0 feet, MAN). Paul Allen misses. Rebound secured by Jaren Rozier.

[07:11] Team_074 possession (Score: 37-38)
James Barnes drives and kicks out. Ayo Smith attempts a 3Pt. Contested by Paul Allen (5.8 feet, MAN). AYO SMITH MAKES IT! Assist: James Barnes
Score: 37-41

[06:56] Team_021 possession (Score: 37-41)
Victor Mitchell attempts a 3Pt. Contested by James Barnes (4.2 feet, ZONE). VICTOR MITCHELL MAKES IT!
Score: 40-41

[06:41] Team_074 possession (Score: 40-41)
FOUL! Shooting foul on Victor Mitchell. James Barnes to the line for 2 free throws. [Team fouls: 2] (Victor Mitchell: 1 personal fouls)   FT 1/2: GOOD   FT 2/2: GOOD James Barnes makes 2/2 from the line.
Score: 40-43

[06:29] Team_021 possession (Score: 40-43)
Paul Allen attempts a 3Pt. Contested by Ayo Smith (5.0 feet, MAN). Paul Allen misses. Rebound secured by Jaren Rozier.

[06:13] Team_074 possession (Score: 40-43)
Yao Randle drives, picks up Vince George. Help arrives from Victor Mitchell! Yao Randle attempts a Layup. Contested by Victor Mitchell (5.1 feet, MAN). YAO RANDLE MAKES IT! Assist: Jaren Rozier
Score: 40-45

[06:02] Team_021 possession (Score: 40-45)
Victor Mitchell drives to the basket... Victor Mitchell loses the ball! Stripped by Yao Randle! TURNOVER! (live ball)

[05:45] Team_074 possession (Score: 40-45)
Yao Randle attempts a 3Pt. Contested by Victor Mitchell (4.3 feet, ZONE). Yao Randle misses. FOUL! Loose ball foul on Magic Ingram during the rebound battle. [Team fouls: 3] No free throws, side out. (Magic Ingram: 1 personal fouls)

[05:31] Team_074 possession (Score: 40-45)
Jaren Rozier drives to the basket... Jaren Rozier loses control! Ball rolls out of bounds! TURNOVER! (dead ball)

[05:17] Team_021 possession (Score: 40-45)
Joel LaVine attempts a 3Pt. Contested by James Barnes (4.1 feet, MAN). Joel LaVine misses. Rebound secured by Jaren Rozier.

[05:00] Team_074 possession (Score: 40-45)
Jaren Rozier attempts a 3Pt. Contested by Magic Ingram (4.8 feet, MAN). Jaren Rozier misses. Offensive rebound by Jaren Rozier! Jaren Rozier kicks it out.

[04:46] Team_074 possession (Score: 40-45)
Jaren Rozier drives, picks up Magic Ingram. Help arrives from Victor Mitchell! Jaren Rozier attempts a Dunk. Contested by Victor Mitchell (4.8 feet, MAN). JAREN ROZIER MAKES IT! Assist: Yao Randle
Score: 40-47

[04:32] Team_021 possession (Score: 40-47)
Victor Mitchell attempts a 3Pt. Contested by James Barnes (4.2 feet, ZONE). Victor Mitchell misses. Rebound secured by Jaren Rozier.

[04:20] Team_074 possession (Score: 40-47)
Jaren Rozier attempts a Layup. Contested by Magic Ingram (4.8 feet, ZONE). JAREN ROZIER MAKES IT! Assist: Yao Randle
Score: 40-49

[04:06] Team_021 possession (Score: 40-49)
Joel LaVine attempts a 3Pt. Contested by James Barnes (4.1 feet, MAN). JOEL LAVINE MAKES IT! Assist: Victor Mitchell
Score: 43-49

[03:48] Team_074 possession (Score: 43-49)
Giannis Westbrook drives to the basket... Giannis Westbrook throws a bad pass out of bounds! TURNOVER! (dead ball)

[03:32] Team_021 possession (Score: 43-49)
Vince George attempts a Layup. Contested by Jaren Rozier (4.3 feet, ZONE). VINCE GEORGE MAKES IT!
Score: 45-49

[03:15] Team_074 possession (Score: 45-49)
FOUL! Shooting foul on Magic Ingram. Jaren Rozier to the line for 2 free throws. [Team fouls: 4] (Magic Ingram: 2 personal fouls)   FT 1/2: GOOD   FT 2/2: GOOD Jaren Rozier makes 2/2 from the line.
Score: 45-51

[03:03] Team_021 possession (Score: 45-51)
Vince George throws a bad pass! Stolen by Yao Randle! TURNOVER! (live ball)

[02:44] Team_074 possession (Score: 45-51)
James Barnes drives to the basket... James Barnes throws a bad pass! Stolen by Magic Ingram! TURNOVER! (live ball)

[02:30] Team_021 possession (Score: 45-51)
Victor Mitchell throws a bad pass out of bounds! TURNOVER! (dead ball)

[02:17] Team_074 possession (Score: 45-51)
Giannis Westbrook attempts a 3Pt. Contested by Victor Mitchell (4.3 feet, ZONE). Giannis Westbrook misses. Rebound secured by Magic Ingram.

[02:03] Team_021 possession (Score: 45-51)
Joel LaVine makes the Layup and draws the foul on Yao Randle! And-1! Joel LaVine to the line for 1. [BONUS: 6 team fouls] (Yao Randle: 1 personal fouls)   FT 1/1: GOOD Joel LaVine makes 1/1 from the line.
Score: 48-51

[01:49] Team_074 possession (Score: 48-51)
Jaren Rozier drives, picks up Magic Ingram. Help arrives from Victor Mitchell! Jaren Rozier attempts a Layup. Contested by Victor Mitchell (4.8 feet, MAN). Jaren Rozier misses. Rebound secured by Vince George.

[01:34] Team_021 possession (Score: 48-51)
Victor Mitchell drives to the basket... Victor Mitchell throws a bad pass! Stolen by Yao Randle! TURNOVER! (live ball)

[01:20] Team_074 possession (Score: 48-51)
FOUL! Reach-in foul on Magic Ingram during the drive. [IN THE BONUS! 5 team fouls] James Barnes to the line for 2 free throws. (Magic Ingram: 3 personal fouls)   FT 1/2: GOOD   FT 2/2: GOOD James Barnes makes 2/2 from the line.
Score: 48-53

[01:06] Team_021 possession (Score: 48-53)
Magic Ingram attempts a 3Pt. Contested by James Barnes (4.4 feet, ZONE). MAGIC INGRAM MAKES IT! Assist: Joel LaVine
Score: 51-53

[00:48] Team_074 possession (Score: 51-53)
Jaren Rozier attempts a 3Pt. Contested by Victor Mitchell (4.0 feet, ZONE). JAREN ROZIER MAKES IT! Assist: Ayo Smith
Score: 51-56

[00:36] Team_021 possession (Score: 51-56)
Victor Mitchell throws a bad pass out of bounds! TURNOVER! (dead ball)

[00:20] Team_074 possession (Score: 51-56)
FOUL! Shooting foul on Vince George. Ayo Smith to the line for 2 free throws. [BONUS: 6 team fouls] (Vince George: 1 personal fouls)   FT 1/2: GOOD   FT 2/2: GOOD Ayo Smith makes 2/2 from the line.
Score: 51-58

[00:03] Team_021 possession (Score: 51-58)
Magic Ingram attempts a Layup. Contested by Jaren Rozier (4.7 feet, MAN). MAGIC INGRAM MAKES IT! Assist: Victor Mitchell
Score: 53-58

================================================================================
                              2ND QUARTER COMPLETE                              
================================================================================

2ND QUARTER SCORE: Team_021 30, Team_074 32

BOX SCORE:
================================================================================

Team_021
--------------------------------------------------------------------------------
Player                MIN  PTS  REB  AST  TO      FG   FG%      3P   3P%
--------------------------------------------------------------------------------
Karl Bridges           16    6    0    0   0   2/3    66.7     0/0   0.0
Joel LaVine             8    6    0    1   0   2/3    66.7     0/0   0.0
Victor Mitchell         8    5    0    2   0   2/3    66.7     0/0   0.0
Magic Ingram            8    5    1    0   0   2/2   100.0     0/0   0.0
Zach Carter            16    2    0    0   0   1/1   100.0     0/0   0.0
Kyrie Wagner           14    2    0    0   0   1/1   100.0     0/0   0.0
Anthony Oladipo        16    2    0    0   0   1/1   100.0     0/0   0.0
Vince George           11    2    1    0   0   1/1   100.0     0/0   0.0
Kyrie Leonard          16    0    1    2   0   0/0     0.0     0/0   0.0
Paul Allen              8    0    0    0   0   0/2     0.0     0/0   0.0

TEAM: FG: 12/17 (70.6%), 3PT: 5/10 (50.0%), REB: 3 (0 off, 3 def), AST: 5, TO: 5
TEAM FOULS: 6 [Team_074 in BONUS]


Team_074
--------------------------------------------------------------------------------
Player                MIN  PTS  REB  AST  TO      FG   FG%      3P   3P%
--------------------------------------------------------------------------------
Jaren Rozier            8    9    5    1   0   4/5    80.0     0/0   0.0
Dwyane Quickley        16    6    0    1   0   2/3    66.7     0/0   0.0
Ayo Smith              11    5    0    1   0   2/2   100.0     0/0   0.0
James Barnes            8    4    0    1   0   2/2   100.0     0/0   0.0
Chris Carter           14    2    0    0   0   1/1   100.0     0/0   0.0
Donovan Doncic         16    2    0    1   0   1/1   100.0     0/0   0.0
Giannis Westbrook      11    2    0    0   0   1/2    50.0     0/0   0.0
Yao Randle              8    2    1    3   0   1/1   100.0     0/0   0.0
Shai Green             14    0    1    0   0   0/0     0.0     0/0   0.0
James Turner           16    0    1    0   0   0/0     0.0     0/0   0.0

TEAM: FG: 14/17 (82.4%), 3PT: 2/3 (66.7%), REB: 8 (3 off, 5 def), AST: 8, TO: 4
TEAM FOULS: 6 [Team_021 in BONUS]

================================================================================

================================================================================
                       3RD QUARTER - Team_021 vs Team_074                       
================================================================================

[12:00] Team_021 possession (Score: 53-58)
Kyrie Wagner attempts a 3Pt. Contested by Donovan Doncic (3.7 feet, MAN). KYRIE WAGNER MAKES IT! Assist: Kyrie Leonard
Score: 56-58

[11:46] Team_074 possession (Score: 56-58)
Dwyane Quickley attempts a 3Pt. Contested by Kyrie Leonard (4.8 feet, MAN). Dwyane Quickley misses. FOUL! Loose ball foul on Anthony Oladipo during the rebound battle. [Team fouls: 1] No free throws, side out. (Anthony Oladipo: 1 personal fouls)

[11:30] Team_074 possession (Score: 56-58)
Shai Green attempts a Layup. Contested by Zach Carter (4.5 feet, ZONE). Shai Green misses. Rebound secured by Anthony Oladipo.

[11:14] Team_021 possession (Score: 56-58)
Kyrie Leonard attempts a 3Pt. Contested by Dwyane Quickley (5.3 feet, ZONE). Kyrie Leonard misses. Rebound secured by James Turner.

[10:58] Team_074 possession (Score: 56-58)
FOUL! Offensive foul on Donovan Doncic! Kyrie Wagner drew the charge! [Team fouls: 1] (Donovan Doncic: 1 personal fouls) TURNOVER! (dead ball)

[10:48] Team_021 possession (Score: 56-58)
Karl Bridges attempts a 3Pt. Contested by Shai Green (3.4 feet, MAN). KARL BRIDGES MAKES IT! Assist: Kyrie Wagner
Score: 59-58

[10:32] Team_074 possession (Score: 59-58)
Shai Green attempts a Midrange. BLOCKED BY KYRIE WAGNER! Ball is loose! Rebound secured by Anthony Oladipo.

[10:17] Team_021 possession (Score: 59-58)
Anthony Oladipo attempts a 3Pt. Contested by Dwyane Quickley (5.4 feet, ZONE). ANTHONY OLADIPO MAKES IT! Assist: Kyrie Leonard
Score: 62-58

[10:01] Team_074 possession (Score: 62-58)
James Turner attempts a Midrange. Contested by Zach Carter (4.7 feet, MAN). JAMES TURNER MAKES IT! Assist: Dwyane Quickley
Score: 62-60

[09:45] Team_021 possession (Score: 62-60)
Karl Bridges attempts a 3Pt. Contested by Shai Green (3.4 feet, MAN). Karl Bridges misses. FOUL! Loose ball foul on Shai Green during the rebound battle. [Team fouls: 2] No free throws, side out. (Shai Green: 1 personal fouls)

[09:26] Team_021 possession (Score: 62-60)
Anthony Oladipo loses control! Ball rolls out of bounds! TURNOVER! (dead ball)

[09:10] Team_074 possession (Score: 62-60)
Donovan Doncic makes the Dunk and draws the foul on Zach Carter! And-1! Donovan Doncic to the line for 1. [Team fouls: 2] (Zach Carter: 1 personal fouls)   FT 1/1: GOOD Donovan Doncic makes 1/1 from the line.
Score: 62-63

[08:55] Team_021 possession (Score: 62-63)
Kyrie Wagner attempts a 3Pt. Contested by Donovan Doncic (3.7 feet, MAN). Kyrie Wagner misses. Rebound secured by Shai Green.

[08:41] Team_074 possession (Score: 62-63)
James Turner attempts a Midrange. Contested by Zach Carter (4.7 feet, MAN). James Turner misses. Rebound secured by Anthony Oladipo.

[08:28] Team_021 possession (Score: 62-63)
FOUL! Shooting foul on Dwyane Quickley. Kyrie Wagner to the line for 3 free throws. [Team fouls: 3] (Dwyane Quickley: 1 personal fouls)   FT 1/3: GOOD   FT 2/3: GOOD   FT 3/3: GOOD Kyrie Wagner makes 3/3 from the line.
Score: 65-63

[08:16] Team_074 possession (Score: 65-63)
Shai Green attempts a 3Pt. Wide open! Karl Bridges is 6.1 feet away. [MAN] Shai Green misses. Rebound secured by Zach Carter.

[07:59] Team_021 possession (Score: 65-63)
Kyrie Wagner drives, Donovan Doncic stays with him. Kyrie Wagner attempts a Layup. Contested by Donovan Doncic (3.7 feet, ZONE). KYRIE WAGNER MAKES IT! Assist: Anthony Oladipo
Score: 67-63

[07:46] Team_074 possession (Score: 67-63)
Shai Green attempts a 3Pt. Wide open! Karl Bridges is 6.1 feet away. [MAN] Shai Green misses. Rebound secured by Anthony Oladipo.

[07:28] Team_021 possession (Score: 67-63)
Anthony Oladipo attempts a Layup. Contested by Chris Carter (4.2 feet, MAN). ANTHONY OLADIPO MAKES IT! Assist: Kyrie Leonard
Score: 69-63

[07:13] Team_074 possession (Score: 69-63)
James Turner attempts a Midrange. Contested by Kyrie Leonard (5.2 feet, ZONE). JAMES TURNER MAKES IT! Assist: Dwyane Quickley
Score: 69-65

[07:03] Team_021 possession (Score: 69-65)
Anthony Oladipo drives to the basket... Anthony Oladipo throws a bad pass! Stolen by Donovan Doncic! TURNOVER! (live ball)

[06:52] Team_074 possession (Score: 69-65)
Shai Green attempts a 3Pt. Wide open! Karl Bridges is 6.1 feet away. [MAN] SHAI GREEN MAKES IT! Assist: Chris Carter
Score: 69-68

[06:41] Team_021 possession (Score: 69-68)
Zach Carter attempts a Midrange. Contested by James Turner (3.8 feet, MAN). ZACH CARTER MAKES IT!
Score: 71-68

[06:24] Team_074 possession (Score: 71-68)
Shai Green attempts a 3Pt. Wide open! Karl Bridges is 6.1 feet away. [MAN] Shai Green misses. Rebound secured by Anthony Oladipo.

[06:08] Team_021 possession (Score: 71-68)
Karl Bridges attempts a Midrange. Contested by Donovan Doncic (3.6 feet, ZONE). Karl Bridges misses. Rebound secured by Donovan Doncic.

[05:52] Team_074 possession (Score: 71-68)
FOUL! Holding foul on Kyrie Wagner. [Team fouls: 3] No free throws, side out. (Kyrie Wagner: 1 personal fouls)

[05:39] Team_074 possession (Score: 71-68)
Shai Green attempts a 3Pt. Contested by Anthony Oladipo (5.1 feet, ZONE). Shai Green misses. Rebound secured by Kyrie Leonard.

[05:23] Team_021 possession (Score: 71-68)
Kyrie Wagner loses the ball! Stripped by Donovan Doncic! TURNOVER! (live ball)

[05:09] Team_074 possession (Score: 71-68)
Donovan Doncic makes the Dunk and draws the foul on Zach Carter! And-1! Donovan Doncic to the line for 1. [Team fouls: 4] (Zach Carter: 2 personal fouls)   FT 1/1: GOOD Donovan Doncic makes 1/1 from the line.
Score: 71-71

[04:55] Team_021 possession (Score: 71-71)
FOUL! Reach-in foul on Donovan Doncic during the drive. [Team fouls: 4] No free throws, side out. (Donovan Doncic: 2 personal fouls)

[04:39] Team_021 possession (Score: 71-71)
Karl Bridges loses control! Ball rolls out of bounds! TURNOVER! (dead ball)

[04:24] Team_074 possession (Score: 71-71)
Dwyane Quickley attempts a Midrange. Contested by Kyrie Leonard (4.9 feet, MAN). Dwyane Quickley misses. Offensive rebound by Donovan Doncic! Donovan Doncic kicks it out.

[04:11] Team_074 possession (Score: 71-71)
Shai Green attempts a 3Pt. Contested by Kyrie Wagner (4.6 feet, ZONE). Shai Green misses. Offensive rebound by Donovan Doncic! Donovan Doncic kicks it out.

[04:00] Team_074 possession (Score: 71-71)
Donovan Doncic attempts a 3Pt. Contested by Kyrie Wagner (4.4 feet, ZONE). Donovan Doncic misses. Rebound secured by Anthony Oladipo.

[03:42] Team_021 possession (Score: 71-71)
Zach Carter attempts a Layup. Contested by Donovan Doncic (4.2 feet, ZONE). Zach Carter misses. Rebound secured by Shai Green.

[03:24] Team_074 possession (Score: 71-71)
James Turner attempts a Midrange. Contested by Zach Carter (4.8 feet, MAN). JAMES TURNER MAKES IT! Assist: Donovan Doncic
Score: 71-73

[03:07] Team_021 possession (Score: 71-73)
Kyrie Leonard attempts a Midrange. Contested by Shai Green (3.5 feet, ZONE). Kyrie Leonard misses. Offensive rebound by Kyrie Leonard! Kyrie Leonard kicks it out.

[02:53] Team_021 possession (Score: 71-73)
FOUL! Shooting foul on Dwyane Quickley. Kyrie Leonard to the line for 3 free throws. [BONUS: 5 team fouls] (Dwyane Quickley: 2 personal fouls)   FT 1/3: GOOD   FT 2/3: GOOD   FT 3/3: GOOD Kyrie Leonard makes 3/3 from the line.
Score: 74-73

[02:43] Team_074 possession (Score: 74-73)
Chris Carter attempts a 3Pt. Contested by Anthony Oladipo (5.4 feet, MAN). Chris Carter misses. Rebound secured by Anthony Oladipo.

[02:30] Team_021 possession (Score: 74-73)
Anthony Oladipo attempts a 3Pt. Contested by Chris Carter (4.4 feet, MAN). Anthony Oladipo misses. Offensive rebound by Zach Carter! Zach Carter kicks it out.

[02:13] Team_021 possession (Score: 74-73)
Kyrie Leonard commits a violation (traveling/carry)! TURNOVER! (dead ball)

[02:13] Substitution (Team_021): Kyrie Leonard OUT → Joel LaVine IN (stamina_rule2)

[02:13] Substitution (Team_021): Karl Bridges OUT → Paul Allen IN (stamina_rule2)

[02:13] Substitution (Team_021): Kyrie Wagner OUT → Vince George IN (stamina_rule2)

[02:13] Substitution (Team_021): Zach Carter OUT → Magic Ingram IN (stamina_rule2)

[02:13] Substitution (Team_074): Dwyane Quickley OUT → James Barnes IN (stamina_rule2)

[02:13] Substitution (Team_074): Chris Carter OUT → Giannis Westbrook IN (stamina_rule2)

[02:13] Substitution (Team_074): Shai Green OUT → Ayo Smith IN (stamina_rule2)

[02:04] Team_074 possession (Score: 74-73)
Donovan Doncic attempts a Midrange. Contested by Vince George (5.3 feet, MAN). Donovan Doncic misses. Offensive rebound by Donovan Doncic! Donovan Doncic kicks it out.

[01:51] Team_074 possession (Score: 74-73)
Giannis Westbrook commits a violation (traveling/carry)! TURNOVER! (dead ball)

[01:51] Substitution (Team_021): Anthony Oladipo OUT → Victor Mitchell IN (stamina_rule2)

[01:51] Substitution (Team_074): Donovan Doncic OUT → Yao Randle IN (stamina_rule2)

[01:51] Substitution (Team_074): James Turner OUT → Jaren Rozier IN (stamina_rule2)

[01:37] Team_021 possession (Score: 74-73)
Victor Mitchell attempts a 3Pt. Contested by Giannis Westbrook (4.4 feet, MAN). VICTOR MITCHELL MAKES IT! Assist: Joel LaVine
Score: 77-73

[01:19] Team_074 possession (Score: 77-73)
FOUL! Reach-in foul on Magic Ingram during the drive. [IN THE BONUS! 5 team fouls] Yao Randle to the line for 2 free throws. (Magic Ingram: 1 personal fouls)   FT 1/2: GOOD   FT 2/2: GOOD Yao Randle makes 2/2 from the line.
Score: 77-75

[01:07] Team_021 possession (Score: 77-75)
Magic Ingram attempts a Layup. Contested by Yao Randle (4.6 feet, ZONE). Magic Ingram misses. Rebound secured by Yao Randle.

[00:50] Team_074 possession (Score: 77-75)
Ayo Smith drives, picks up Paul Allen. Help arrives from Victor Mitchell! Ayo Smith attempts a Dunk. Contested by Victor Mitchell (6.0 feet, MAN). Ayo Smith misses. Rebound secured by Magic Ingram.

[00:31] Team_021 possession (Score: 77-75)
Vince George makes the Layup and draws the foul on Yao Randle! And-1! Vince George to the line for 1. [BONUS: 6 team fouls] (Yao Randle: 1 personal fouls)   FT 1/1: GOOD Vince George makes 1/1 from the line.
Score: 80-75

[00:17] Team_074 possession (Score: 80-75)
Jaren Rozier loses control! Ball rolls out of bounds! TURNOVER! (dead ball)

================================================================================
                              3RD QUARTER COMPLETE                              
================================================================================

3RD QUARTER SCORE: Team_021 27, Team_074 17

BOX SCORE:
================================================================================

Team_021
--------------------------------------------------------------------------------
Player                MIN  PTS  REB  AST  TO      FG   FG%      3P   3P%
--------------------------------------------------------------------------------
Kyrie Wagner           24    8    0    1   0   3/4    75.0     0/0   0.0
Anthony Oladipo        27    5    7    1   0   2/2   100.0     0/0   0.0
Kyrie Leonard          26    3    3    3   0   1/2    50.0     0/0   0.0
Karl Bridges           26    3    0    0   0   1/2    50.0     0/0   0.0
Victor Mitchell        10    3    0    0   0   1/1   100.0     0/0   0.0
Vince George           13    3    0    0   0   1/1   100.0     0/0   0.0
Zach Carter            26    2    2    0   0   1/2    50.0     0/0   0.0
Joel LaVine            10    0    0    1   0   0/0     0.0     0/0   0.0
Magic Ingram           10    0    1    0   0   0/1     0.0     0/0   0.0

TEAM: FG: 10/15 (66.7%), 3PT: 6/8 (75.0%), REB: 13 (3 off, 10 def), AST: 6, TO: 5
TEAM FOULS: 5 [Team_074 in BONUS]


Team_074
--------------------------------------------------------------------------------
Player                MIN  PTS  REB  AST  TO      FG   FG%      3P   3P%
--------------------------------------------------------------------------------
James Turner           27    6    2    0   0   3/4    75.0     0/0   0.0
Donovan Doncic         27    6    4    1   0   2/3    66.7     0/0   0.0
Shai Green             24    3    2    0   0   1/7    14.3     0/0   0.0
Yao Randle             10    2    1    0   0   1/1   100.0     0/0   0.0
Dwyane Quickley        26    0    0    2   0   0/0     0.0     0/0   0.0
Chris Carter           24    0    0    1   0   0/1     0.0     0/0   0.0
Ayo Smith              13    0    0    0   0   0/1     0.0     0/0   0.0

TEAM: FG: 7/17 (41.2%), 3PT: 1/7 (14.3%), REB: 9 (4 off, 5 def), AST: 4, TO: 3
TEAM FOULS: 6 [Team_021 in BONUS]

================================================================================

================================================================================
                       4TH QUARTER - Team_021 vs Team_074                       
================================================================================

[12:00] Team_021 possession (Score: 80-75)
Karl Bridges attempts a 3Pt. Contested by Dwyane Quickley (5.3 feet, ZONE). Karl Bridges misses. Offensive rebound by Kyrie Leonard! Kyrie Leonard kicks it out.

[11:43] Team_021 possession (Score: 80-75)
Kyrie Wagner drives, Donovan Doncic stays with him. Kyrie Wagner attempts a Layup. Contested by Donovan Doncic (3.8 feet, MAN). KYRIE WAGNER MAKES IT!
Score: 82-75

[11:29] Team_074 possession (Score: 82-75)
FOUL! Offensive foul on Donovan Doncic! Kyrie Wagner drew the charge! [Team fouls: 1] (Donovan Doncic: 1 personal fouls) TURNOVER! (dead ball)

[11:15] Team_021 possession (Score: 82-75)
FOUL! Shooting foul on Chris Carter. Anthony Oladipo to the line for 3 free throws. [Team fouls: 2] (Chris Carter: 1 personal fouls)   FT 1/3: MISS   FT 2/3: GOOD   FT 3/3: GOOD Anthony Oladipo makes 2/3 from the line.
Score: 84-75

[11:00] Team_074 possession (Score: 84-75)
James Turner drives and kicks out. Donovan Doncic attempts a 3Pt. Contested by Kyrie Wagner (4.1 feet, ZONE). Donovan Doncic misses. Rebound secured by Zach Carter.

[10:43] Team_021 possession (Score: 84-75)
Zach Carter attempts a Midrange. Contested by James Turner (4.0 feet, MAN). Zach Carter misses. Rebound secured by James Turner.

[10:27] Team_074 possession (Score: 84-75)
Donovan Doncic attempts a 3Pt. Contested by Kyrie Wagner (4.4 feet, ZONE). Donovan Doncic misses. Rebound secured by Kyrie Leonard.

[10:10] Team_021 possession (Score: 84-75)
Kyrie Leonard attempts a 3Pt. Contested by Dwyane Quickley (5.4 feet, MAN). Kyrie Leonard misses. FOUL! Loose ball foul on James Turner during the rebound battle. [Team fouls: 3] No free throws, side out. (James Turner: 1 personal fouls)

[09:54] Team_021 possession (Score: 84-75)
Karl Bridges attempts a Layup. Contested by Donovan Doncic (3.7 feet, ZONE). KARL BRIDGES MAKES IT! Assist: Anthony Oladipo
Score: 86-75

[09:36] Team_074 possession (Score: 86-75)
Dwyane Quickley drives and kicks out. James Turner attempts a Midrange. Contested by Kyrie Wagner (4.2 feet, ZONE). James Turner misses. Rebound secured by Kyrie Leonard.

[09:26] Team_021 possession (Score: 86-75)
Zach Carter attempts a Layup. BLOCKED BY JAMES TURNER! Ball is loose! Rebound secured by Donovan Doncic.

[09:10] Team_074 possession (Score: 86-75)
Dwyane Quickley drives and kicks out. James Turner attempts a 3Pt. Contested by Zach Carter (4.3 feet, MAN). JAMES TURNER MAKES IT! Assist: Shai Green
Score: 86-78

[09:00] Team_021 possession (Score: 86-78)
Kyrie Wagner attempts a 3Pt. Contested by Dwyane Quickley (5.7 feet, ZONE). Kyrie Wagner misses. Rebound secured by Donovan Doncic.

[08:47] Team_074 possession (Score: 86-78)
Donovan Doncic drives, picks up Kyrie Wagner. Help arrives from Kyrie Leonard! Donovan Doncic attempts a Dunk. Contested by Kyrie Leonard (4.6 feet, ZONE). Donovan Doncic misses. FOUL! Loose ball foul on Anthony Oladipo during the rebound battle. [Team fouls: 1] No free throws, side out. (Anthony Oladipo: 1 personal fouls)

[08:32] Team_074 possession (Score: 86-78)
Donovan Doncic attempts a 3Pt. Contested by Kyrie Wagner (4.6 feet, MAN). Donovan Doncic misses. Offensive rebound by James Turner! James Turner kicks it out.

[08:22] Team_074 possession (Score: 86-78)
Dwyane Quickley drives, picks up Kyrie Leonard. Help arrives from Anthony Oladipo! Dwyane Quickley attempts a Dunk. Contested by Anthony Oladipo (5.1 feet, MAN). Dwyane Quickley misses. Rebound secured by Kyrie Leonard.

[08:11] Team_021 possession (Score: 86-78)
Zach Carter drives, picks up James Turner. Help arrives from Chris Carter! Zach Carter attempts a Layup. Contested by Chris Carter (4.2 feet, MAN). Zach Carter misses. Rebound secured by James Turner.

[07:54] Team_074 possession (Score: 86-78)
James Turner drives and kicks out. Chris Carter attempts a 3Pt. Contested by Anthony Oladipo (5.1 feet, MAN). Chris Carter misses. Rebound secured by Anthony Oladipo.

[07:40] Team_021 possession (Score: 86-78)
Karl Bridges attempts a 3Pt. Contested by Dwyane Quickley (5.6 feet, ZONE). Karl Bridges misses. Rebound secured by Shai Green.

[07:27] Team_074 possession (Score: 86-78)
Donovan Doncic attempts a 3Pt. Contested by Kyrie Leonard (5.3 feet, ZONE). Donovan Doncic misses. Offensive rebound by James Turner! James Turner kicks it out.

[07:10] Team_074 possession (Score: 86-78)
Chris Carter attempts a 3Pt. Contested by Kyrie Wagner (5.1 feet, ZONE). CHRIS CARTER MAKES IT! Assist: Dwyane Quickley
Score: 86-81

[06:59] Team_021 possession (Score: 86-81)
Anthony Oladipo attempts a 3Pt. Contested by Dwyane Quickley (5.8 feet, ZONE). Anthony Oladipo misses. Offensive rebound by Kyrie Leonard! Kyrie Leonard kicks it out.

[06:49] Team_021 possession (Score: 86-81)
Anthony Oladipo attempts a Midrange. Contested by Donovan Doncic (4.1 feet, ZONE). ANTHONY OLADIPO MAKES IT!
Score: 88-81

[06:32] Team_074 possession (Score: 88-81)
Donovan Doncic attempts a 3Pt. Contested by Kyrie Wagner (4.9 feet, MAN). Donovan Doncic misses. Offensive rebound by James Turner! James Turner kicks it out.

[06:19] Team_074 possession (Score: 88-81)
James Turner drives and kicks out. FOUL! Shooting foul on Kyrie Wagner. James Turner to the line for 3 free throws. [Team fouls: 2] (Kyrie Wagner: 1 personal fouls)   FT 1/3: GOOD   FT 2/3: MISS   FT 3/3: GOOD James Turner makes 2/3 from the line.
Score: 88-83

[06:04] Team_021 possession (Score: 88-83)
Kyrie Leonard attempts a 3Pt. Contested by Dwyane Quickley (5.8 feet, ZONE). Kyrie Leonard misses. Rebound secured by Donovan Doncic.

[05:47] Team_074 possession (Score: 88-83)
FOUL! Reach-in foul on Anthony Oladipo during the drive. [Team fouls: 3] No free throws, side out. (Anthony Oladipo: 2 personal fouls)

[05:30] Team_074 possession (Score: 88-83)
Donovan Doncic attempts a Midrange. Contested by Kyrie Leonard (5.5 feet, ZONE). DONOVAN DONCIC MAKES IT!
Score: 88-85

[05:19] Team_021 possession (Score: 88-85)
Karl Bridges drives and kicks out. Kyrie Leonard attempts a Midrange. Wide open! Dwyane Quickley is 6.1 feet away. [MAN] KYRIE LEONARD MAKES IT!
Score: 90-85

[05:10] Team_074 possession (Score: 90-85)
Shai Green attempts a 3Pt. Wide open! Karl Bridges is 6.6 feet away. [MAN] SHAI GREEN MAKES IT! Assist: James Turner
Score: 90-88

[04:55] Team_021 possession (Score: 90-88)
Kyrie Wagner attempts a 3Pt. Contested by Donovan Doncic (4.5 feet, MAN). Kyrie Wagner misses. Rebound secured by James Turner.

[04:39] Team_074 possession (Score: 90-88)
Dwyane Quickley attempts a 3Pt. Contested by Kyrie Wagner (5.1 feet, ZONE). Dwyane Quickley misses. Offensive rebound by James Turner! James Turner kicks it out.

[04:23] Team_074 possession (Score: 90-88)
Donovan Doncic attempts a Midrange. Contested by Anthony Oladipo (5.7 feet, ZONE). DONOVAN DONCIC MAKES IT!
Score: 90-90

[04:12] Team_021 possession (Score: 90-90)
FOUL! Offensive foul on Karl Bridges! Shai Green drew the charge! [Team fouls: 4] (Karl Bridges: 1 personal fouls) TURNOVER! (dead ball)

[03:55] Team_074 possession (Score: 90-90)
Chris Carter attempts a 3Pt. Contested by Kyrie Wagner (5.5 feet, ZONE). Chris Carter misses. FOUL! Loose ball foul on Anthony Oladipo during the rebound battle. [IN THE BONUS! 5 team fouls] Donovan Doncic to the line for 2 free throws. (Anthony Oladipo: 3 personal fouls)   FT 1/2: GOOD   FT 2/2: GOOD Donovan Doncic makes 2/2 from the line.
Score: 90-92

[03:41] Team_021 possession (Score: 90-92)
Zach Carter attempts a Midrange. Contested by James Turner (4.8 feet, MAN). Zach Carter misses. Rebound secured by Donovan Doncic.

[03:27] Team_074 possession (Score: 90-92)
Dwyane Quickley attempts a 3Pt. Contested by Kyrie Wagner (5.2 feet, ZONE). Dwyane Quickley misses. Offensive rebound by James Turner! James Turner kicks it out.

[03:10] Team_074 possession (Score: 90-92)
Shai Green attempts a Midrange. Wide open! Karl Bridges is 6.8 feet away. [MAN] SHAI GREEN MAKES IT!
Score: 90-94

[02:59] Team_021 possession (Score: 90-94)
Kyrie Leonard attempts a 3Pt. Wide open! Dwyane Quickley is 6.1 feet away. [ZONE] Kyrie Leonard misses. Offensive rebound by Kyrie Leonard! Kyrie Leonard kicks it out.

[02:40] Team_021 possession (Score: 90-94)
Kyrie Leonard drives to the basket... Kyrie Leonard throws a bad pass! Stolen by Donovan Doncic! TURNOVER! (live ball)

[02:27] Team_074 possession (Score: 90-94)
Chris Carter attempts a 3Pt. Wide open! Anthony Oladipo is 6.2 feet away. [MAN] Chris Carter misses. Rebound secured by Kyrie Leonard.

[02:13] Team_021 possession (Score: 90-94)
Karl Bridges attempts a 3Pt. Contested by Shai Green (4.7 feet, MAN). Karl Bridges misses. Rebound secured by Donovan Doncic.

[01:59] Team_074 possession (Score: 90-94)
James Turner makes the Dunk and draws the foul on Zach Carter! And-1! James Turner to the line for 1. [BONUS: 6 team fouls] (Zach Carter: 1 personal fouls)   FT 1/1: GOOD James Turner makes 1/1 from the line.
Score: 90-97

[01:44] Team_021 possession (Score: 90-97)
FOUL! Reach-in foul on Shai Green during the drive. [Team fouls: 4] No free throws, side out. (Shai Green: 1 personal fouls)

[01:33] Team_021 possession (Score: 90-97)
FOUL! Shooting foul on Donovan Doncic. Zach Carter to the line for 2 free throws. [BONUS: 5 team fouls] (Donovan Doncic: 2 personal fouls)   FT 1/2: GOOD   FT 2/2: GOOD Zach Carter makes 2/2 from the line.
Score: 92-97

[01:18] Team_074 possession (Score: 92-97)
FOUL! Shooting foul on Kyrie Leonard. Dwyane Quickley to the line for 2 free throws. [BONUS: 7 team fouls] (Kyrie Leonard: 1 personal fouls)   FT 1/2: GOOD   FT 2/2: GOOD Dwyane Quickley makes 2/2 from the line.
Score: 92-99

[01:06] Team_021 possession (Score: 92-99)
Zach Carter attempts a Midrange. Contested by James Turner (5.2 feet, MAN). Zach Carter misses. Rebound secured by Shai Green.

[00:53] Team_074 possession (Score: 92-99)
Shai Green attempts a 3Pt. Wide open! Karl Bridges is 7.0 feet away. [MAN] Shai Green misses. Rebound secured by Zach Carter.

[00:37] Team_021 possession (Score: 92-99)
Karl Bridges attempts a 3Pt. Wide open! Dwyane Quickley is 6.4 feet away. [ZONE] KARL BRIDGES MAKES IT!
Score: 95-99

[00:21] Team_074 possession (Score: 95-99)
Dwyane Quickley makes the Layup and draws the foul on Kyrie Wagner! And-1! Dwyane Quickley to the line for 1. [BONUS: 8 team fouls] (Kyrie Wagner: 2 personal fouls)   FT 1/1: GOOD Dwyane Quickley makes 1/1 from the line.
Score: 95-102

[00:08] Team_021 possession (Score: 95-102)
Kyrie Wagner attempts a Midrange. Contested by Shai Green (5.2 feet, ZONE). Kyrie Wagner misses. FOUL! Loose ball foul on James Turner during the rebound battle. [IN THE BONUS! 6 team fouls] Zach Carter to the line for 2 free throws. (James Turner: 2 personal fouls)   FT 1/2: GOOD   FT 2/2: MISS Zach Carter makes 1/2 from the line. Rebound secured by Donovan Doncic.
Score: 96-102

================================================================================
                              4TH QUARTER COMPLETE                              
================================================================================

4TH QUARTER SCORE: Team_021 16, Team_074 27

BOX SCORE:
================================================================================

Team_021
--------------------------------------------------------------------------------
Player                MIN  PTS  REB  AST  TO      FG   FG%      3P   3P%
--------------------------------------------------------------------------------
Donovan Doncic         39    6    6    0   0   3/4    75.0     0/0   0.0
Karl Bridges           38    5    0    0   0   2/4    50.0     0/0   0.0
Anthony Oladipo        39    4    1    1   0   2/2   100.0     0/0   0.0
Kyrie Leonard          38    2    8    0   0   1/2    50.0     0/0   0.0
Kyrie Wagner           36    2    0    0   0   1/4    25.0     0/0   0.0
Zach Carter            38    2    2    0   0   1/6    16.7     0/0   0.0

TEAM: FG: 7/18 (38.9%), 3PT: 2/7 (28.6%), REB: 12 (5 off, 7 def), AST: 1, TO: 2
TEAM FOULS: 8 [Team_074 in BONUS]


Team_074
--------------------------------------------------------------------------------
Player                MIN  PTS  REB  AST  TO      FG   FG%      3P   3P%
--------------------------------------------------------------------------------
James Turner           39    8    9    1   0   3/5    60.0     0/0   0.0
Dwyane Quickley        38    5    0    1   0   2/4    50.0     0/0   0.0
Shai Green             36    5    2    1   0   2/3    66.7     0/0   0.0
Chris Carter           36    3    0    0   0   1/2    50.0     0/0   0.0

TEAM: FG: 11/18 (61.1%), 3PT: 3/6 (50.0%), REB: 16 (6 off, 10 def), AST: 3, TO: 1
TEAM FOULS: 6 [Team_021 in BONUS]

================================================================================

================================================================================
                               FULL GAME COMPLETE                               
================================================================================

FINAL SCORE: Team_021 96, Team_074 102

SCORING BY QUARTER:
--------------------------------------------------------------------------------
Team                     Q1     Q2     Q3     Q4    FINAL
--------------------------------------------------------------------------------
Team_021                 23     30     27     16       96
Team_074                 26     32     17     27      102
--------------------------------------------------------------------------------

FULL GAME BOX SCORE:
================================================================================

Team_021
--------------------------------------------------------------------------------
Player                MIN  PTS  REB  AST  TO      FG   FG%      3P   3P%      FT STL BLK
--------------------------------------------------------------------------------
Anthony Oladipo        39   16    9    4   2   8/10   80.0   3/5    60.0   5/6     0   0
Kyrie Leonard          38   11   16    5   2   3/6    50.0   1/4    25.0   3/3     0   0
Karl Bridges           38   19    0    0   2   7/15   46.7   5/10   50.0   0/0     0   0
Zach Carter            38   11    8    2   1   6/14   42.9   1/2    50.0   5/6     1   0
Kyrie Wagner           36   14    0    2   3   6/10   60.0   2/5    40.0   3/3     0   2
Vince George           13    5    1    0   1   2/2   100.0   0/0     0.0   1/1     0   0
Joel LaVine            10    6    0    2   1   2/3    66.7   1/2    50.0   1/1     0   0
Paul Allen             10    0    0    0   1   0/2     0.0   0/2     0.0   0/0     0   0
Magic Ingram           10    5    2    0   0   2/3    66.7   1/1   100.0   0/0     1   0
Victor Mitchell        10    8    0    2   2   2/3    66.7   2/3    66.7   2/2     0   0

TEAM: FG: 39/69 (56.5%), 3PT: 16/34 (47.1%), REB: 36 (11 off, 25 def), AST: 17, TO: 15


Team_074
--------------------------------------------------------------------------------
Player                MIN  PTS  REB  AST  TO      FG   FG%      3P   3P%      FT STL BLK
--------------------------------------------------------------------------------
Donovan Doncic         39   16   19    4   4   6/9    66.7   0/3     0.0   4/4     3   0
James Turner           39   24   14    1   3   9/12   75.0   0/0     0.0   4/5     0   1
Dwyane Quickley        38   17    0    4   1   7/12   58.3   1/2    50.0   6/6     1   0
Chris Carter           36    5    0    1   0   3/5    60.0   2/4    50.0   0/0     0   0
Shai Green             36   13    6    4   0   5/13   38.5   3/9    33.3   3/3     0   0
Giannis Westbrook      13    2    0    0   1   1/3    33.3   0/1     0.0   0/0     0   0
Ayo Smith              13    8    1    1   1   2/4    50.0   1/2    50.0   2/2     0   0
James Barnes           10    4    0    1   1   3/3   100.0   0/0     0.0   4/4     0   0
Yao Randle             10    4    2    3   0   2/2   100.0   0/0     0.0   2/2     3   0
Jaren Rozier           10    9    5    1   2   4/5    80.0   1/1   100.0   2/2     0   0

TEAM: FG: 42/68 (61.8%), 3PT: 8/22 (36.4%), REB: 47 (18 off, 29 def), AST: 20, TO: 13

================================================================================
