================================================================================
                        FULL GAME - Team_060 vs Team_079                        
================================================================================

================================================================================
                       1ST QUARTER - Team_060 vs Team_079                       
================================================================================

[12:00] Team_060 possession (Score: 0-0)
Joel Morant loses the ball! Stripped by Khris Embiid! TURNOVER! (live ball)

[11:44] Team_079 possession (Score: 0-0)
Bam Randle loses control! Ball rolls out of bounds! TURNOVER! (dead ball)

[11:27] Team_060 possession (Score: 0-0)
Jaren George attempts a Layup. Contested by Donovan Randle (4.3 feet, MAN). Jaren George misses. Rebound secured by Donovan Randle.

[11:14] Team_079 possession (Score: 0-0)
Trae Durant drives and kicks out. Donovan Randle attempts a Midrange. Contested by Jaren George (5.2 feet, MAN). DONOVAN RANDLE MAKES IT!
Score: 0-2

[11:02] Team_060 possession (Score: 0-2)
Immanuel Ming attempts a 3Pt. Contested by Trae Durant (3.0 feet, ZONE). IMMANUEL MING MAKES IT! Assist: Larry Westbrook
Score: 3-2

[10:48] Team_079 possession (Score: 3-2)
Bam Randle attempts a 3Pt. Contested by Julius Green (3.6 feet, ZONE). Bam Randle misses. Rebound secured by Immanuel Ming.

[10:30] Team_060 possession (Score: 3-2)
Julius Green attempts a 3Pt. Contested by Miles Ming (3.9 feet, MAN). JULIUS GREEN MAKES IT! Assist: Jaren George
Score: 6-2

[10:19] Team_079 possession (Score: 6-2)
Donovan Randle attempts a Layup. Contested by Jaren George (5.3 feet, MAN). Donovan Randle misses. Rebound secured by Jaren George.

[10:05] Team_060 possession (Score: 6-2)
FOUL! Shooting foul on Khris Embiid. Joel Morant to the line for 2 free throws. [Team fouls: 1] (Khris Embiid: 1 personal fouls)   FT 1/2: GOOD   FT 2/2: GOOD Joel Morant makes 2/2 from the line.
Score: 8-2

[09:51] Team_079 possession (Score: 8-2)
Miles Ming attempts a 3Pt. Contested by Julius Green (4.0 feet, ZONE). Miles Ming misses. Rebound secured by Immanuel Ming.

[09:37] Team_060 possession (Score: 8-2)
FOUL! Reach-in foul on Donovan Randle during the drive. [Team fouls: 2] No free throws, side out. (Donovan Randle: 1 personal fouls)

[09:24] Team_060 possession (Score: 8-2)
Julius Green attempts a Layup. Contested by Trae Durant (2.9 feet, ZONE). Julius Green misses. Rebound secured by Bam Randle.

[09:09] Team_079 possession (Score: 8-2)
Miles Ming attempts a 3Pt. Contested by Larry Westbrook (4.8 feet, ZONE). Miles Ming misses. Offensive rebound by Donovan Randle! Donovan Randle kicks it out.

[08:56] Team_079 possession (Score: 8-2)
Trae Durant attempts a 3Pt. Contested by Julius Green (3.6 feet, ZONE). Trae Durant misses. Offensive rebound by Trae Durant! Trae Durant puts it back in!
Score: 8-4

[08:40] Team_060 possession (Score: 8-4)
FOUL! Shooting foul on Miles Ming. Julius Green to the line for 2 free throws. [Team fouls: 3] (Miles Ming: 1 personal fouls)   FT 1/2: MISS   FT 2/2: GOOD Julius Green makes 1/2 from the line.
Score: 9-4

[08:26] Team_079 possession (Score: 9-4)
Bam Randle attempts a 3Pt. Contested by Immanuel Ming (3.5 feet, MAN). Bam Randle misses. Rebound secured by Larry Westbrook.

[08:10] Team_060 possession (Score: 9-4)
Immanuel Ming attempts a 3Pt. Contested by Bam Randle (4.2 feet, MAN). Immanuel Ming misses. Rebound secured by Bam Randle.

[07:53] Team_079 possession (Score: 9-4)
Donovan Randle commits a violation (traveling/carry)! TURNOVER! (dead ball)

[07:40] Team_060 possession (Score: 9-4)
Jaren George attempts a Midrange. Contested by Miles Ming (4.3 feet, ZONE). Jaren George misses. Rebound secured by Bam Randle.

[07:22] Team_079 possession (Score: 9-4)
Miles Ming makes the Midrange and draws the foul on Julius Green! And-1! Miles Ming to the line for 1. [Team fouls: 1] (Julius Green: 1 personal fouls)   FT 1/1: GOOD Miles Ming makes 1/1 from the line.
Score: 9-7

[07:05] Team_060 possession (Score: 9-7)
Julius Green attempts a Midrange. Contested by Bam Randle (4.0 feet, ZONE). JULIUS GREEN MAKES IT! Assist: Immanuel Ming
Score: 11-7

[06:50] Team_079 possession (Score: 11-7)
Khris Embiid attempts a Layup. Contested by Jaren George (5.5 feet, ZONE). KHRIS EMBIID MAKES IT!
Score: 11-9

[06:38] Team_060 possession (Score: 11-9)
Jaren George attempts a Layup. Contested by Donovan Randle (4.3 feet, MAN). JAREN GEORGE MAKES IT!
Score: 13-9

[06:23] Team_079 possession (Score: 13-9)
Donovan Randle makes the Layup and draws the foul on Jaren George! And-1! Donovan Randle to the line for 1. [Team fouls: 2] (Jaren George: 1 personal fouls)   FT 1/1: GOOD Donovan Randle makes 1/1 from the line.
Score: 13-12

[06:09] Team_060 possession (Score: 13-12)
Joel Morant drives, Khris Embiid stays with him. Joel Morant attempts a Layup. Contested by Khris Embiid (4.2 feet, MAN). JOEL MORANT MAKES IT! Assist: Immanuel Ming
Score: 15-12

[05:56] Team_079 possession (Score: 15-12)
Donovan Randle attempts a Midrange. Contested by Jaren George (5.3 feet, MAN). Donovan Randle misses. Rebound secured by Larry Westbrook.

[05:42] Team_060 possession (Score: 15-12)
Larry Westbrook attempts a 3Pt. Contested by Trae Durant (3.5 feet, ZONE). Larry Westbrook misses. Offensive rebound by Immanuel Ming! Immanuel Ming kicks it out.

[05:25] Team_060 possession (Score: 15-12)
Larry Westbrook attempts a Layup. BLOCKED BY TRAE DURANT! Ball is loose! Rebound secured by Bam Randle.

[05:12] Team_079 possession (Score: 15-12)
Miles Ming attempts a 3Pt. Contested by Julius Green (4.0 feet, MAN). Miles Ming misses. Rebound secured by Jaren George.

[04:54] Team_060 possession (Score: 15-12)
Larry Westbrook makes the Midrange and draws the foul on Miles Ming! And-1! Larry Westbrook to the line for 1. [Team fouls: 4] (Miles Ming: 2 personal fouls)   FT 1/1: GOOD Larry Westbrook makes 1/1 from the line.
Score: 18-12

[04:39] Team_079 possession (Score: 18-12)
Miles Ming attempts a Layup. BLOCKED BY JAREN GEORGE! Ball is loose! Rebound secured by Larry Westbrook.

[04:25] Team_060 possession (Score: 18-12)
Joel Morant attempts a 3Pt. Contested by Trae Durant (2.8 feet, ZONE). JOEL MORANT MAKES IT! Assist: Jaren George
Score: 21-12

[04:11] Team_079 possession (Score: 21-12)
Khris Embiid drives, Jaren George stays with him. Khris Embiid attempts a Dunk. Contested by Jaren George (5.6 feet, ZONE). KHRIS EMBIID MAKES IT! Assist: Bam Randle
Score: 21-14

[03:51] Team_060 possession (Score: 21-14)
Julius Green drives and kicks out. Immanuel Ming attempts a Midrange. Contested by Bam Randle (4.3 feet, MAN). Immanuel Ming misses. Offensive rebound by Immanuel Ming! Immanuel Ming kicks it out.

[03:35] Team_060 possession (Score: 21-14)
FOUL! Shooting foul on Trae Durant. Julius Green to the line for 3 free throws. [BONUS: 5 team fouls] (Trae Durant: 1 personal fouls)   FT 1/3: GOOD   FT 2/3: GOOD   FT 3/3: GOOD Julius Green makes 3/3 from the line.
Score: 24-14

[03:25] Team_079 possession (Score: 24-14)
Donovan Randle makes the Midrange and draws the foul on Jaren George! And-1! Donovan Randle to the line for 1. [Team fouls: 3] (Jaren George: 2 personal fouls)   FT 1/1: MISS Donovan Randle makes 0/1 from the line. Rebound secured by Immanuel Ming.
Score: 24-16

[03:07] Team_060 possession (Score: 24-16)
Jaren George drives to the basket... Jaren George loses control! Ball rolls out of bounds! TURNOVER! (dead ball)

[03:07] Substitution (Team_060): Joel Morant OUT → Domantas Barnes IN (stamina_rule2)

[03:07] Substitution (Team_060): Larry Westbrook OUT → Yao Tatum IN (stamina_rule2)

[03:07] Substitution (Team_060): Jaren George OUT → Klay Haliburton IN (stamina_rule2)

[02:51] Team_079 possession (Score: 24-16)
Donovan Randle attempts a Midrange. Contested by Yao Tatum (5.3 feet, ZONE). Donovan Randle misses. Rebound secured by Klay Haliburton.

[02:38] Team_060 possession (Score: 24-16)
Domantas Barnes drives, picks up Trae Durant. Help arrives from Miles Ming! Domantas Barnes attempts a Dunk. Contested by Miles Ming (3.2 feet, ZONE). DOMANTAS BARNES MAKES IT! Assist: Immanuel Ming
Score: 26-16

[02:26] Team_079 possession (Score: 26-16)
FOUL! Holding foul on Klay Haliburton. [Team fouls: 4] No free throws, side out. (Klay Haliburton: 1 personal fouls)

[02:10] Team_079 possession (Score: 26-16)
Trae Durant attempts a Midrange. Contested by Immanuel Ming (3.7 feet, ZONE). Trae Durant misses. Rebound secured by Klay Haliburton.

[01:57] Team_060 possession (Score: 26-16)
Immanuel Ming attempts a Midrange. Contested by Bam Randle (4.5 feet, MAN). Immanuel Ming misses. Rebound secured by Trae Durant.

[01:40] Team_079 possession (Score: 26-16)
Donovan Randle drives, Klay Haliburton stays with him. Donovan Randle attempts a Layup. Contested by Klay Haliburton (4.3 feet, ZONE). Donovan Randle misses. Rebound secured by Klay Haliburton.

[01:25] Team_060 possession (Score: 26-16)
Yao Tatum drives and kicks out. Immanuel Ming attempts a 3Pt. Contested by Trae Durant (3.4 feet, ZONE). Immanuel Ming misses. Rebound secured by Trae Durant.

[01:08] Team_079 possession (Score: 26-16)
Trae Durant throws a bad pass out of bounds! TURNOVER! (dead ball)

[01:08] Substitution (Team_060): Julius Green OUT → Rudy Ginobili IN (stamina_rule2)

[01:08] Substitution (Team_060): Immanuel Ming OUT → Jarrett Wagner IN (stamina_rule2)

[01:08] Substitution (Team_079): Khris Embiid OUT → Evan Mobley IN (stamina_rule2)

[01:08] Substitution (Team_079): Miles Ming OUT → Karl Ingram IN (stamina_rule2)

[01:08] Substitution (Team_079): Bam Randle OUT → Anthony Wade IN (stamina_rule2)

[01:08] Substitution (Team_079): Trae Durant OUT → Kobe Curry IN (stamina_rule2)

[01:08] Substitution (Team_079): Donovan Randle OUT → James LaVine IN (stamina_rule2)

[00:53] Team_060 possession (Score: 26-16)
Rudy Ginobili drives, James LaVine stays with him. Rudy Ginobili attempts a Layup. Contested by James LaVine (4.4 feet, ZONE). RUDY GINOBILI MAKES IT!
Score: 28-16

[00:42] Team_079 possession (Score: 28-16)
Evan Mobley attempts a 3Pt. Contested by Domantas Barnes (5.1 feet, ZONE). Evan Mobley misses. Offensive rebound by Kobe Curry! Kobe Curry kicks it out.

[00:28] Team_079 possession (Score: 28-16)
Kobe Curry attempts a Layup. Contested by Klay Haliburton (4.4 feet, ZONE). Kobe Curry misses. Offensive rebound by Kobe Curry! Kobe Curry kicks it out.

[00:10] Team_079 possession (Score: 28-16)
James LaVine attempts a Midrange. Contested by Klay Haliburton (4.3 feet, MAN). James LaVine misses. Offensive rebound by Kobe Curry! Kobe Curry kicks it out.

================================================================================
                              1ST QUARTER COMPLETE                              
================================================================================

1ST QUARTER SCORE: Team_060 28, Team_079 16

BOX SCORE:
================================================================================

Team_060
--------------------------------------------------------------------------------
Player                MIN  PTS  REB  AST  TO      FG   FG%      3P   3P%
--------------------------------------------------------------------------------
Julius Green           11    9    0    0   0   4/5    80.0     0/0   0.0
Joel Morant             9    7    0    0   0   3/3   100.0     0/0   0.0
Immanuel Ming          11    3    5    3   0   1/3    33.3     0/0   0.0
Larry Westbrook         9    3    3    1   0   1/2    50.0     0/0   0.0
Jaren George            9    2    2    2   0   1/3    33.3     0/0   0.0
Domantas Barnes         3    2    0    0   0   1/1   100.0     0/0   0.0
Rudy Ginobili           1    2    0    0   0   1/1   100.0     0/0   0.0
Klay Haliburton         3    0    3    0   0   0/0     0.0     0/0   0.0
Yao Tatum               3    0    0    0   0   0/1     0.0     0/0   0.0

TEAM: FG: 12/19 (63.2%), 3PT: 4/5 (80.0%), REB: 13 (2 off, 11 def), AST: 6, TO: 2
TEAM FOULS: 4


Team_079
--------------------------------------------------------------------------------
Player                MIN  PTS  REB  AST  TO      FG   FG%      3P   3P%
--------------------------------------------------------------------------------
Donovan Randle         11    5    2    0   0   2/7    28.6     0/0   0.0
Khris Embiid           11    4    0    0   0   2/2   100.0     0/0   0.0
Miles Ming             11    3    0    0   0   1/4    25.0     0/0   0.0
Trae Durant            11    2    3    0   0   1/2    50.0     0/0   0.0
Bam Randle             11    0    4    1   0   0/2     0.0     0/0   0.0
Kobe Curry              1    0    3    0   0   0/0     0.0     0/0   0.0

TEAM: FG: 6/17 (35.3%), 3PT: 1/5 (20.0%), REB: 12 (5 off, 7 def), AST: 1, TO: 3
TEAM FOULS: 5 [Team_060 in BONUS]

================================================================================

================================================================================
                       2ND QUARTER - Team_060 vs Team_079                       
================================================================================

[12:00] Team_060 possession (Score: 28-16)
FOUL! Shooting foul on Trae Durant. Joel Morant to the line for 2 free throws. [Team fouls: 1] (Trae Durant: 1 personal fouls)   FT 1/2: GOOD   FT 2/2: GOOD Joel Morant makes 2/2 from the line.
Score: 30-16

[11:48] Team_079 possession (Score: 30-16)
Trae Durant attempts a 3Pt. Contested by Larry Westbrook (4.4 feet, MAN). Trae Durant misses. Offensive rebound by Trae Durant! Trae Durant puts it back in!
Score: 30-18

[11:35] Team_060 possession (Score: 30-18)
Jaren George drives, picks up Donovan Randle. Help arrives from Miles Ming! Jaren George attempts a Dunk. Contested by Miles Ming (4.6 feet, MAN). Jaren George misses. Offensive rebound by Immanuel Ming! Immanuel Ming kicks it out.

[11:18] Team_060 possession (Score: 30-18)
Immanuel Ming makes the Layup and draws the foul on Trae Durant! And-1! Immanuel Ming to the line for 1. [Team fouls: 2] (Trae Durant: 2 personal fouls)   FT 1/1: GOOD Immanuel Ming makes 1/1 from the line.
Score: 33-18

[11:00] Team_079 possession (Score: 33-18)
Donovan Randle attempts a Midrange. Contested by Jaren George (5.3 feet, MAN). DONOVAN RANDLE MAKES IT!
Score: 33-20

[10:43] Team_060 possession (Score: 33-20)
Larry Westbrook attempts a 3Pt. Contested by Trae Durant (3.7 feet, MAN). Larry Westbrook misses. Rebound secured by Bam Randle.

[10:27] Team_079 possession (Score: 33-20)
FOUL! Reach-in foul on Immanuel Ming during the drive. [Team fouls: 1] No free throws, side out. (Immanuel Ming: 1 personal fouls)

[10:16] Team_079 possession (Score: 33-20)
Miles Ming drives, Jaren George stays with him. Miles Ming attempts a Dunk. Contested by Jaren George (5.4 feet, ZONE). MILES MING MAKES IT! Assist: Trae Durant
Score: 33-22

[10:02] Team_060 possession (Score: 33-22)
FOUL! Shooting foul on Trae Durant. Joel Morant to the line for 3 free throws. [Team fouls: 3] (Trae Durant: 3 personal fouls)   FT 1/3: MISS   FT 2/3: GOOD   FT 3/3: MISS Joel Morant makes 1/3 from the line. Offensive rebound by Jaren George! Jaren George puts it back in!
Score: 36-22

[09:50] Team_079 possession (Score: 36-22)
Khris Embiid attempts a 3Pt. Contested by Julius Green (4.4 feet, ZONE). KHRIS EMBIID MAKES IT! Assist: Trae Durant
Score: 36-25

[09:32] Team_060 possession (Score: 36-25)
FOUL! Holding foul on Khris Embiid. [Team fouls: 4] No free throws, side out. (Khris Embiid: 1 personal fouls)

[09:18] Team_060 possession (Score: 36-25)
Julius Green throws a bad pass! Stolen by Miles Ming! TURNOVER! (live ball)

[09:07] Team_079 possession (Score: 36-25)
Donovan Randle drives, Jaren George stays with him. Donovan Randle attempts a Dunk. Contested by Jaren George (5.5 feet, MAN). Donovan Randle misses. Rebound secured by Immanuel Ming.

[08:54] Team_060 possession (Score: 36-25)
Joel Morant attempts a 3Pt. Contested by Trae Durant (3.1 feet, ZONE). Joel Morant misses. Rebound secured by Bam Randle.

[08:42] Team_079 possession (Score: 36-25)
Khris Embiid attempts a 3Pt. Contested by Joel Morant (5.7 feet, MAN). KHRIS EMBIID MAKES IT! Assist: Miles Ming
Score: 36-28

[08:31] Team_060 possession (Score: 36-28)
Immanuel Ming drives to the basket... Immanuel Ming commits a violation (traveling/carry)! TURNOVER! (dead ball)

[08:31] Substitution (Team_060): Joel Morant OUT → Domantas Barnes IN (stamina_rule2)

[08:31] Substitution (Team_060): Julius Green OUT → Rudy Ginobili IN (stamina_rule2)

[08:31] Substitution (Team_060): Immanuel Ming OUT → Jarrett Wagner IN (stamina_rule2)

[08:31] Substitution (Team_060): Larry Westbrook OUT → Yao Tatum IN (stamina_rule2)

[08:31] Substitution (Team_060): Jaren George OUT → Klay Haliburton IN (stamina_rule2)

[08:31] Substitution (Team_079): Khris Embiid OUT → Evan Mobley IN (stamina_rule2)

[08:31] Substitution (Team_079): Miles Ming OUT → Karl Ingram IN (stamina_rule2)

[08:31] Substitution (Team_079): Bam Randle OUT → Anthony Wade IN (stamina_rule2)

[08:31] Substitution (Team_079): Trae Durant OUT → Kobe Curry IN (stamina_rule2)

[08:31] Substitution (Team_079): Donovan Randle OUT → James LaVine IN (stamina_rule2)

[08:14] Team_079 possession (Score: 36-28)
Evan Mobley attempts a Layup. BLOCKED BY DOMANTAS BARNES! Ball deflects out of bounds off Evan Mobley.

[07:59] Team_060 possession (Score: 36-28)
Klay Haliburton drives and kicks out. Rudy Ginobili attempts a Midrange. BLOCKED BY KARL INGRAM! Ball is loose! Rebound secured by Kobe Curry.

[07:48] Team_079 possession (Score: 36-28)
FOUL! Shooting foul on Yao Tatum. Kobe Curry to the line for 2 free throws. [Team fouls: 2] (Yao Tatum: 1 personal fouls)   FT 1/2: GOOD   FT 2/2: MISS Kobe Curry makes 1/2 from the line. Rebound secured by Domantas Barnes.
Score: 36-29

[07:33] Team_060 possession (Score: 36-29)
Domantas Barnes drives and kicks out. Jarrett Wagner attempts a Midrange. Wide open! Anthony Wade is 6.0 feet away. [MAN] Jarrett Wagner misses. Rebound secured by Anthony Wade.

[07:16] Team_079 possession (Score: 36-29)
James LaVine throws a bad pass out of bounds! TURNOVER! (dead ball)

[07:00] Team_060 possession (Score: 36-29)
Jarrett Wagner drives, Anthony Wade stays with him. Jarrett Wagner attempts a Layup. Wide open! Anthony Wade is 6.2 feet away. [MAN] JARRETT WAGNER MAKES IT! Assist: Klay Haliburton
Score: 38-29

[06:45] Team_079 possession (Score: 38-29)
Karl Ingram attempts a Midrange. Contested by Rudy Ginobili (4.5 feet, MAN). Karl Ingram misses. Rebound secured by Klay Haliburton.

[06:34] Team_060 possession (Score: 38-29)
Yao Tatum attempts a 3Pt. Contested by Kobe Curry (4.6 feet, MAN). Yao Tatum misses. Rebound secured by Kobe Curry.

[06:20] Team_079 possession (Score: 38-29)
Kobe Curry attempts a 3Pt. Contested by Domantas Barnes (4.7 feet, ZONE). Kobe Curry misses. Rebound secured by Domantas Barnes.

[06:06] Team_060 possession (Score: 38-29)
Yao Tatum attempts a Midrange. Contested by Kobe Curry (4.6 feet, MAN). Yao Tatum misses. Rebound secured by Anthony Wade.

[05:51] Team_079 possession (Score: 38-29)
Anthony Wade drives, Klay Haliburton stays with him. Anthony Wade attempts a Dunk. Contested by Klay Haliburton (4.3 feet, ZONE). ANTHONY WADE MAKES IT! Assist: James LaVine
Score: 38-31

[05:33] Team_060 possession (Score: 38-31)
Klay Haliburton attempts a 3Pt. Contested by James LaVine (4.4 feet, MAN). Klay Haliburton misses. Rebound secured by Anthony Wade.

[05:20] Team_079 possession (Score: 38-31)
Evan Mobley attempts a 3Pt. Contested by Domantas Barnes (5.1 feet, MAN). Evan Mobley misses. Rebound secured by Rudy Ginobili.

[05:03] Team_060 possession (Score: 38-31)
FOUL! Offensive foul on Yao Tatum! Kobe Curry drew the charge! [Team fouls: 3] (Yao Tatum: 2 personal fouls) TURNOVER! (dead ball)

[04:46] Team_079 possession (Score: 38-31)
Karl Ingram attempts a Midrange. Contested by Rudy Ginobili (4.5 feet, ZONE). KARL INGRAM MAKES IT! Assist: Kobe Curry
Score: 38-33

[04:30] Team_060 possession (Score: 38-33)
Rudy Ginobili attempts a Midrange. Contested by Karl Ingram (5.6 feet, MAN). Rudy Ginobili misses. Rebound secured by Anthony Wade.

[04:13] Team_079 possession (Score: 38-33)
FOUL! Shooting foul on Rudy Ginobili. Karl Ingram to the line for 3 free throws. [Team fouls: 4] (Rudy Ginobili: 1 personal fouls)   FT 1/3: GOOD   FT 2/3: MISS   FT 3/3: MISS Karl Ingram makes 1/3 from the line. Rebound secured by Klay Haliburton.
Score: 38-34

[03:59] Team_060 possession (Score: 38-34)
Klay Haliburton attempts a Layup. Contested by James LaVine (4.4 feet, MAN). Klay Haliburton misses. Offensive rebound by Klay Haliburton! Klay Haliburton puts it back in!
Score: 40-34

[03:48] Team_079 possession (Score: 40-34)
Karl Ingram drives, picks up Rudy Ginobili. Help arrives from Domantas Barnes! Karl Ingram attempts a Layup. Contested by Domantas Barnes (4.5 feet, MAN). KARL INGRAM MAKES IT! Assist: Evan Mobley
Score: 40-36

[03:38] Team_060 possession (Score: 40-36)
Yao Tatum attempts a 3Pt. Contested by Evan Mobley (4.5 feet, ZONE). YAO TATUM MAKES IT! Assist: Jarrett Wagner
Score: 43-36

[03:18] Team_079 possession (Score: 43-36)
Anthony Wade drives, Klay Haliburton stays with him. Anthony Wade attempts a Dunk. Contested by Klay Haliburton (4.3 feet, ZONE). Anthony Wade misses. Rebound secured by Rudy Ginobili.

[03:08] Team_060 possession (Score: 43-36)
Klay Haliburton drives to the basket... Klay Haliburton throws a bad pass! Stolen by James LaVine! TURNOVER! (live ball)

[02:52] Team_079 possession (Score: 43-36)
James LaVine makes the Layup and draws the foul on Yao Tatum! And-1! James LaVine to the line for 1. [BONUS: 5 team fouls] (Yao Tatum: 3 personal fouls)   FT 1/1: GOOD James LaVine makes 1/1 from the line.
Score: 43-39

[02:33] Team_060 possession (Score: 43-39)
Yao Tatum attempts a 3Pt. Contested by Karl Ingram (5.3 feet, ZONE). Yao Tatum misses. Rebound secured by James LaVine.

[02:16] Team_079 possession (Score: 43-39)
Karl Ingram throws a bad pass out of bounds! TURNOVER! (dead ball)

[02:05] Team_060 possession (Score: 43-39)
Rudy Ginobili attempts a Midrange. Contested by Karl Ingram (5.6 feet, MAN). RUDY GINOBILI MAKES IT! Assist: Klay Haliburton
Score: 45-39

[01:53] Team_079 possession (Score: 45-39)
FOUL! Holding foul on Domantas Barnes. [IN THE BONUS! 6 team fouls] Evan Mobley to the line for 2 free throws. (Domantas Barnes: 1 personal fouls)   FT 1/2: GOOD   FT 2/2: GOOD Evan Mobley makes 2/2 from the line.
Score: 45-41

[01:40] Team_060 possession (Score: 45-41)
FOUL! Shooting foul on James LaVine. Klay Haliburton to the line for 2 free throws. [BONUS: 5 team fouls] (James LaVine: 1 personal fouls)   FT 1/2: GOOD   FT 2/2: MISS Klay Haliburton makes 1/2 from the line. Rebound secured by James LaVine.
Score: 46-41

[01:30] Team_079 possession (Score: 46-41)
Anthony Wade makes the Layup and draws the foul on Klay Haliburton! And-1! Anthony Wade to the line for 1. [BONUS: 7 team fouls] (Klay Haliburton: 1 personal fouls)   FT 1/1: GOOD Anthony Wade makes 1/1 from the line.
Score: 46-44

[01:16] Team_060 possession (Score: 46-44)
Jarrett Wagner attempts a 3Pt. Contested by Karl Ingram (5.6 feet, ZONE). Jarrett Wagner misses. Rebound secured by Kobe Curry.

[01:00] Team_079 possession (Score: 46-44)
Kobe Curry attempts a Layup. Contested by Yao Tatum (5.5 feet, MAN). KOBE CURRY MAKES IT! Assist: Karl Ingram
Score: 46-46

[00:43] Team_060 possession (Score: 46-46)
Klay Haliburton attempts a Layup. Contested by James LaVine (4.5 feet, MAN). KLAY HALIBURTON MAKES IT!
Score: 48-46

[00:30] Team_079 possession (Score: 48-46)
Evan Mobley attempts a 3Pt. Contested by Domantas Barnes (5.3 feet, MAN). EVAN MOBLEY MAKES IT! Assist: Karl Ingram
Score: 48-49

[00:13] Team_060 possession (Score: 48-49)
Yao Tatum attempts a Layup. Contested by James LaVine (4.4 feet, ZONE). Yao Tatum misses. Rebound secured by Anthony Wade.

================================================================================
                              2ND QUARTER COMPLETE                              
================================================================================

2ND QUARTER SCORE: Team_060 20, Team_079 33

BOX SCORE:
================================================================================

Team_060
--------------------------------------------------------------------------------
Player                MIN  PTS  REB  AST  TO      FG   FG%      3P   3P%
--------------------------------------------------------------------------------
Klay Haliburton        11    4    3    2   0   2/5    40.0     0/0   0.0
Immanuel Ming          15    3    2    0   0   1/1   100.0     0/0   0.0
Jaren George           13    3    0    0   0   1/1   100.0     0/0   0.0
Yao Tatum              11    3    0    0   0   1/5    20.0     0/0   0.0
Joel Morant            13    2    0    0   0   1/2    50.0     0/0   0.0
Jarrett Wagner          9    2    0    1   0   1/2    50.0     0/0   0.0
Rudy Ginobili           9    2    2    0   0   1/2    50.0     0/0   0.0
Larry Westbrook        13    0    0    0   0   0/1     0.0     0/0   0.0
Domantas Barnes        11    0    2    0   0   0/1     0.0     0/0   0.0

TEAM: FG: 8/20 (40.0%), 3PT: 2/8 (25.0%), REB: 9 (2 off, 7 def), AST: 3, TO: 4
TEAM FOULS: 7 [Team_079 in BONUS]


Team_079
--------------------------------------------------------------------------------
Player                MIN  PTS  REB  AST  TO      FG   FG%      3P   3P%
--------------------------------------------------------------------------------
Khris Embiid           15    6    0    0   0   2/2   100.0     0/0   0.0
Evan Mobley             9    5    0    1   0   2/4    50.0     0/0   0.0
Anthony Wade            9    5    5    0   0   2/3    66.7     0/0   0.0
Karl Ingram             9    4    0    2   0   2/4    50.0     0/0   0.0
James LaVine            9    3    2    1   0   1/1   100.0     0/0   0.0
Trae Durant            15    2    1    2   0   1/1   100.0     0/0   0.0
Donovan Randle         15    2    0    0   0   1/2    50.0     0/0   0.0
Miles Ming             15    2    0    1   0   1/1   100.0     0/0   0.0
Kobe Curry              9    2    3    1   0   1/3    33.3     0/0   0.0
Bam Randle             15    0    2    0   0   0/0     0.0     0/0   0.0

TEAM: FG: 13/21 (61.9%), 3PT: 4/7 (57.1%), REB: 13 (1 off, 12 def), AST: 8, TO: 2
TEAM FOULS: 5 [Team_060 in BONUS]

================================================================================

================================================================================
                       3RD QUARTER - Team_060 vs Team_079                       
================================================================================

[12:00] Team_060 possession (Score: 48-49)
Larry Westbrook attempts a Layup. Contested by Trae Durant (3.5 feet, MAN). Larry Westbrook misses. Rebound secured by Donovan Randle.

[11:45] Team_079 possession (Score: 48-49)
Bam Randle attempts a 3Pt. Contested by Immanuel Ming (3.5 feet, MAN). Bam Randle misses. Rebound secured by Jaren George.

[11:33] Team_060 possession (Score: 48-49)
Larry Westbrook drives, Trae Durant stays with him. Larry Westbrook attempts a Layup. Contested by Trae Durant (3.5 feet, MAN). Larry Westbrook misses. Rebound secured by Donovan Randle.

[11:21] Team_079 possession (Score: 48-49)
Donovan Randle attempts a Midrange. Contested by Julius Green (3.9 feet, ZONE). Donovan Randle misses. Rebound secured by Larry Westbrook.

[11:05] Team_060 possession (Score: 48-49)
Jaren George drives to the basket... FOUL! Offensive foul on Jaren George! Donovan Randle drew the charge! [Team fouls: 1] (Jaren George: 1 personal fouls) TURNOVER! (dead ball)

[10:49] Team_079 possession (Score: 48-49)
Bam Randle drives, Immanuel Ming stays with him. Bam Randle attempts a Layup. Contested by Immanuel Ming (3.5 feet, MAN). Bam Randle misses. Rebound secured by Immanuel Ming.

[10:34] Team_060 possession (Score: 48-49)
Larry Westbrook attempts a 3Pt. Contested by Trae Durant (3.5 feet, MAN). Larry Westbrook misses. Rebound secured by Bam Randle.

[10:22] Team_079 possession (Score: 48-49)
Donovan Randle drives to the basket... Donovan Randle throws a bad pass out of bounds! TURNOVER! (dead ball)

[10:04] Team_060 possession (Score: 48-49)
Immanuel Ming attempts a 3Pt. Contested by Bam Randle (4.2 feet, MAN). Immanuel Ming misses. Rebound secured by Bam Randle.

[09:49] Team_079 possession (Score: 48-49)
Trae Durant attempts a Layup. Contested by Jaren George (5.0 feet, ZONE). TRAE DURANT MAKES IT! Assist: Miles Ming
Score: 48-51

[09:36] Team_060 possession (Score: 48-51)
Jaren George attempts a Midrange. Contested by Trae Durant (3.2 feet, ZONE). JAREN GEORGE MAKES IT!
Score: 50-51

[09:17] Team_079 possession (Score: 50-51)
Bam Randle drives, Immanuel Ming stays with him. Bam Randle attempts a Layup. Contested by Immanuel Ming (3.5 feet, MAN). Bam Randle misses. Rebound secured by Immanuel Ming.

[09:02] Team_060 possession (Score: 50-51)
Larry Westbrook attempts a 3Pt. Contested by Trae Durant (3.5 feet, ZONE). LARRY WESTBROOK MAKES IT! Assist: Immanuel Ming
Score: 53-51

[08:45] Team_079 possession (Score: 53-51)
Trae Durant attempts a Midrange. Contested by Larry Westbrook (4.4 feet, ZONE). TRAE DURANT MAKES IT! Assist: Bam Randle
Score: 53-53

[08:30] Team_060 possession (Score: 53-53)
Joel Morant drives and kicks out. Jaren George attempts a 3Pt. Contested by Trae Durant (3.0 feet, ZONE). Jaren George misses. Rebound secured by Trae Durant.

[08:14] Team_079 possession (Score: 53-53)
Donovan Randle attempts a Midrange. Contested by Jaren George (5.3 feet, MAN). DONOVAN RANDLE MAKES IT! Assist: Khris Embiid
Score: 53-55

[08:03] Team_060 possession (Score: 53-55)
Julius Green attempts a Midrange. Contested by Trae Durant (2.9 feet, ZONE). Julius Green misses. Rebound secured by Donovan Randle.

[07:49] Team_079 possession (Score: 53-55)
FOUL! Shooting foul on Julius Green. Khris Embiid to the line for 3 free throws. [Team fouls: 2] (Julius Green: 1 personal fouls)   FT 1/3: GOOD   FT 2/3: GOOD   FT 3/3: GOOD Khris Embiid makes 3/3 from the line.
Score: 53-58

[07:30] Team_060 possession (Score: 53-58)
Julius Green attempts a 3Pt. Contested by Miles Ming (3.9 feet, MAN). Julius Green misses. Rebound secured by Trae Durant.

[07:15] Team_079 possession (Score: 53-58)
Bam Randle attempts a Midrange. BLOCKED BY IMMANUEL MING! Ball is loose! Offensive rebound by Trae Durant! Trae Durant kicks it out.

[07:01] Team_079 possession (Score: 53-58)
Trae Durant attempts a 3Pt. Contested by Larry Westbrook (4.4 feet, MAN). Trae Durant misses. Rebound secured by Larry Westbrook.

[06:48] Team_060 possession (Score: 53-58)
FOUL! Reach-in foul on Trae Durant during the drive. [Team fouls: 1] No free throws, side out. (Trae Durant: 1 personal fouls)

[06:32] Team_060 possession (Score: 53-58)
Jaren George makes the Dunk and draws the foul on Donovan Randle! And-1! Jaren George to the line for 1. [Team fouls: 2] (Donovan Randle: 1 personal fouls)   FT 1/1: GOOD Jaren George makes 1/1 from the line.
Score: 56-58

[06:20] Team_079 possession (Score: 56-58)
Khris Embiid attempts a Midrange. Contested by Joel Morant (5.5 feet, MAN). Khris Embiid misses. Rebound secured by Larry Westbrook.

[06:07] Team_060 possession (Score: 56-58)
Larry Westbrook drives, picks up Trae Durant. Help arrives from Miles Ming! Larry Westbrook attempts a Layup. Contested by Miles Ming (3.5 feet, ZONE). LARRY WESTBROOK MAKES IT! Assist: Jaren George
Score: 58-58

[05:57] Team_079 possession (Score: 58-58)
Bam Randle attempts a Layup. Contested by Jaren George (5.0 feet, ZONE). BAM RANDLE MAKES IT! Assist: Trae Durant
Score: 58-60

[05:43] Team_060 possession (Score: 58-60)
Julius Green attempts a Layup. BLOCKED BY TRAE DURANT! Ball deflects out of bounds off Julius Green.

[05:29] Team_079 possession (Score: 58-60)
Donovan Randle attempts a Layup. Contested by Jaren George (5.4 feet, MAN). DONOVAN RANDLE MAKES IT!
Score: 58-62

[05:15] Team_060 possession (Score: 58-62)
Larry Westbrook drives and kicks out. Immanuel Ming attempts a Midrange. Contested by Khris Embiid (4.5 feet, ZONE). Immanuel Ming misses. Rebound secured by Donovan Randle.

[05:00] Team_079 possession (Score: 58-62)
FOUL! Shooting foul on Jaren George. Bam Randle to the line for 2 free throws. [Team fouls: 3] (Jaren George: 2 personal fouls)   FT 1/2: GOOD   FT 2/2: GOOD Bam Randle makes 2/2 from the line.
Score: 58-64

[04:44] Team_060 possession (Score: 58-64)
Larry Westbrook drives, Trae Durant stays with him. Larry Westbrook attempts a Layup. Contested by Trae Durant (3.5 feet, ZONE). Larry Westbrook misses. Rebound secured by Bam Randle.

[04:29] Team_079 possession (Score: 58-64)
FOUL! Holding foul on Julius Green. [Team fouls: 4] No free throws, side out. (Julius Green: 2 personal fouls)

[04:11] Team_079 possession (Score: 58-64)
Khris Embiid throws a bad pass! Stolen by Joel Morant! TURNOVER! (live ball)

[03:58] Team_060 possession (Score: 58-64)
Immanuel Ming attempts a Midrange. Contested by Donovan Randle (4.3 feet, ZONE). Immanuel Ming misses. Rebound secured by Bam Randle.

[03:43] Team_079 possession (Score: 58-64)
Khris Embiid attempts a 3Pt. Contested by Joel Morant (5.7 feet, MAN). Khris Embiid misses. Offensive rebound by Donovan Randle! Donovan Randle kicks it out.

[03:29] Team_079 possession (Score: 58-64)
FOUL! Shooting foul on Larry Westbrook. Trae Durant to the line for 2 free throws. [BONUS: 5 team fouls] (Larry Westbrook: 1 personal fouls)   FT 1/2: MISS   FT 2/2: GOOD Trae Durant makes 1/2 from the line.
Score: 58-65

[03:13] Team_060 possession (Score: 58-65)
FOUL! Shooting foul on Miles Ming. Julius Green to the line for 3 free throws. [Team fouls: 3] (Miles Ming: 1 personal fouls)   FT 1/3: GOOD   FT 2/3: MISS   FT 3/3: GOOD Julius Green makes 2/3 from the line.
Score: 60-65

[02:55] Team_079 possession (Score: 60-65)
Bam Randle drives, Immanuel Ming stays with him. Bam Randle attempts a Dunk. Contested by Immanuel Ming (3.6 feet, MAN). BAM RANDLE MAKES IT!
Score: 60-67

[02:45] Team_060 possession (Score: 60-67)
Immanuel Ming attempts a Layup. Contested by Bam Randle (4.4 feet, MAN). Immanuel Ming misses. FOUL! Loose ball foul on Donovan Randle during the rebound battle. [Team fouls: 4] No free throws, side out. (Donovan Randle: 2 personal fouls)

[02:34] Team_060 possession (Score: 60-67)
Larry Westbrook attempts a 3Pt. Contested by Trae Durant (3.7 feet, ZONE). LARRY WESTBROOK MAKES IT!
Score: 63-67

[02:23] Team_079 possession (Score: 63-67)
Bam Randle attempts a 3Pt. Contested by Immanuel Ming (3.7 feet, MAN). Bam Randle misses. Offensive rebound by Trae Durant! Trae Durant kicks it out.

[02:09] Team_079 possession (Score: 63-67)
FOUL! Shooting foul on Jaren George. Khris Embiid to the line for 2 free throws. [BONUS: 6 team fouls] (Jaren George: 3 personal fouls)   FT 1/2: MISS   FT 2/2: GOOD Khris Embiid makes 1/2 from the line.
Score: 63-68

[01:56] Team_060 possession (Score: 63-68)
Julius Green drives, Trae Durant stays with him. Julius Green attempts a Dunk. Contested by Trae Durant (3.1 feet, ZONE). JULIUS GREEN MAKES IT! Assist: Jaren George
Score: 65-68

[01:43] Team_079 possession (Score: 65-68)
FOUL! Offensive foul on Donovan Randle! Jaren George drew the charge! [Team fouls: 5] (Donovan Randle: 3 personal fouls) TURNOVER! (dead ball)

[01:27] Team_060 possession (Score: 65-68)
Joel Morant drives, Trae Durant stays with him. Joel Morant attempts a Layup. Contested by Trae Durant (3.0 feet, ZONE). Joel Morant misses. Offensive rebound by Jaren George! Jaren George puts it back in!
Score: 67-68

[01:15] Team_079 possession (Score: 67-68)
FOUL! Shooting foul on Jaren George. Miles Ming to the line for 2 free throws. [BONUS: 7 team fouls] (Jaren George: 4 personal fouls)   FT 1/2: GOOD   FT 2/2: GOOD Miles Ming makes 2/2 from the line.
Score: 67-70

[00:57] Team_060 possession (Score: 67-70)
Jaren George attempts a Layup. Contested by Donovan Randle (4.8 feet, MAN). Jaren George misses. Offensive rebound by Immanuel Ming! Immanuel Ming kicks it out.

[00:39] Team_060 possession (Score: 67-70)
Joel Morant attempts a 3Pt. Contested by Khris Embiid (4.6 feet, MAN). Joel Morant misses. Rebound secured by Trae Durant.

[00:27] Team_079 possession (Score: 67-70)
Trae Durant attempts a Layup. Contested by Jaren George (5.6 feet, ZONE). TRAE DURANT MAKES IT! Assist: Miles Ming
Score: 67-72

[00:11] Team_060 possession (Score: 67-72)
Jaren George attempts a Midrange. Contested by Miles Ming (4.7 feet, ZONE). Jaren George misses. Rebound secured by Trae Durant.

================================================================================
                              3RD QUARTER COMPLETE                              
================================================================================

3RD QUARTER SCORE: Team_060 19, Team_079 23

BOX SCORE:
================================================================================

Team_060
--------------------------------------------------------------------------------
Player                MIN  PTS  REB  AST  TO      FG   FG%      3P   3P%
--------------------------------------------------------------------------------
Larry Westbrook        25    8    3    0   0   3/8    37.5     0/0   0.0
Jaren George           25    7    2    2   0   3/4    75.0     0/0   0.0
Julius Green           27    4    0    0   0   2/5    40.0     0/0   0.0
Immanuel Ming          27    0    4    1   0   0/2     0.0     0/0   0.0
Joel Morant            25    0    0    0   0   0/2     0.0     0/0   0.0

TEAM: FG: 8/21 (38.1%), 3PT: 3/7 (42.9%), REB: 9 (3 off, 6 def), AST: 3, TO: 1
TEAM FOULS: 7 [Team_079 in BONUS]


Team_079
--------------------------------------------------------------------------------
Player                MIN  PTS  REB  AST  TO      FG   FG%      3P   3P%
--------------------------------------------------------------------------------
Trae Durant            27    7    6    1   0   4/5    80.0     0/0   0.0
Bam Randle             27    6    4    1   0   3/6    50.0     0/0   0.0
Donovan Randle         27    4    5    0   0   2/3    66.7     0/0   0.0
Khris Embiid           27    4    0    1   0   2/3    66.7     0/0   0.0
Miles Ming             27    2    0    2   0   1/1   100.0     0/0   0.0

TEAM: FG: 12/18 (66.7%), 3PT: 1/3 (33.3%), REB: 15 (3 off, 12 def), AST: 5, TO: 3
TEAM FOULS: 5 [Team_060 in BONUS]

================================================================================

================================================================================
                       4TH QUARTER - Team_060 vs Team_079                       
================================================================================

[12:00] Team_060 possession (Score: 67-72)
Julius Green attempts a 3Pt. Contested by Miles Ming (4.2 feet, MAN). JULIUS GREEN MAKES IT! Assist: Jaren George
Score: 70-72

[11:47] Team_079 possession (Score: 70-72)
Bam Randle drives and kicks out. Miles Ming attempts a 3Pt. Contested by Julius Green (4.1 feet, MAN). Miles Ming misses. Rebound secured by Larry Westbrook.

[11:38] Team_060 possession (Score: 70-72)
Immanuel Ming drives and kicks out. Julius Green attempts a 3Pt. Contested by Miles Ming (4.5 feet, ZONE). JULIUS GREEN MAKES IT! Assist: Jaren George
Score: 73-72

[11:25] Team_079 possession (Score: 73-72)
FOUL! Shooting foul on Immanuel Ming. Khris Embiid to the line for 2 free throws. [Team fouls: 1] (Immanuel Ming: 1 personal fouls)   FT 1/2: GOOD   FT 2/2: GOOD Khris Embiid makes 2/2 from the line.
Score: 73-74

[11:14] Team_060 possession (Score: 73-74)
Larry Westbrook attempts a Midrange. Contested by Trae Durant (3.8 feet, MAN). Larry Westbrook misses. Offensive rebound by Immanuel Ming! Immanuel Ming kicks it out.

[11:03] Team_060 possession (Score: 73-74)
Jaren George attempts a Midrange. Contested by Miles Ming (4.7 feet, ZONE). Jaren George misses. Rebound secured by Donovan Randle.

[10:46] Team_079 possession (Score: 73-74)
Donovan Randle makes the Dunk and draws the foul on Julius Green! And-1! Donovan Randle to the line for 1. [Team fouls: 2] (Julius Green: 1 personal fouls)   FT 1/1: GOOD Donovan Randle makes 1/1 from the line.
Score: 73-77

[10:36] Team_060 possession (Score: 73-77)
Jaren George attempts a 3Pt. Contested by Donovan Randle (4.9 feet, MAN). Jaren George misses. Rebound secured by Bam Randle.

[10:21] Team_079 possession (Score: 73-77)
Trae Durant attempts a Dunk. BLOCKED BY JAREN GEORGE! Ball deflects out of bounds off Trae Durant.

[10:08] Team_060 possession (Score: 73-77)
FOUL! Holding foul on Miles Ming. [Team fouls: 1] No free throws, side out. (Miles Ming: 1 personal fouls)

[09:55] Team_060 possession (Score: 73-77)
Julius Green drives, Trae Durant stays with him. Julius Green attempts a Dunk. Contested by Trae Durant (3.4 feet, ZONE). JULIUS GREEN MAKES IT! Assist: Joel Morant
Score: 75-77

[09:43] Team_079 possession (Score: 75-77)
Khris Embiid drives and kicks out. Miles Ming attempts a 3Pt. Contested by Julius Green (4.4 feet, MAN). Miles Ming misses. Rebound secured by Immanuel Ming.

[09:29] Team_060 possession (Score: 75-77)
Joel Morant attempts a 3Pt. Contested by Khris Embiid (4.7 feet, MAN). JOEL MORANT MAKES IT! Assist: Immanuel Ming
Score: 78-77

[09:14] Team_079 possession (Score: 78-77)
Bam Randle attempts a 3Pt. Contested by Immanuel Ming (4.0 feet, MAN). Bam Randle misses. Rebound secured by Immanuel Ming.

[08:59] Team_060 possession (Score: 78-77)
Jaren George attempts a 3Pt. Contested by Trae Durant (3.7 feet, ZONE). JAREN GEORGE MAKES IT! Assist: Larry Westbrook
Score: 81-77

[08:46] Team_079 possession (Score: 81-77)
Donovan Randle drives to the basket... Donovan Randle throws a bad pass! Stolen by Jaren George! TURNOVER! (live ball)

[08:28] Team_060 possession (Score: 81-77)
FOUL! Reach-in foul on Trae Durant during the drive. [Team fouls: 2] No free throws, side out. (Trae Durant: 1 personal fouls)

[08:11] Team_060 possession (Score: 81-77)
Joel Morant drives, Donovan Randle stays with him. Joel Morant attempts a Dunk. Contested by Donovan Randle (4.8 feet, ZONE). JOEL MORANT MAKES IT! Assist: Immanuel Ming
Score: 83-77

[07:58] Team_079 possession (Score: 83-77)
Khris Embiid attempts a Midrange. BLOCKED BY LARRY WESTBROOK! Ball deflects out of bounds off Khris Embiid.

[07:45] Team_060 possession (Score: 83-77)
Jaren George attempts a Layup. BLOCKED BY MILES MING! Ball deflects out of bounds off Jaren George.

[07:34] Team_079 possession (Score: 83-77)
Khris Embiid attempts a 3Pt. Wide open! Joel Morant is 6.4 feet away. [MAN] Khris Embiid misses. Rebound secured by Immanuel Ming.

[07:23] Team_060 possession (Score: 83-77)
Jaren George makes the Midrange and draws the foul on Donovan Randle! And-1! Jaren George to the line for 1. [Team fouls: 3] (Donovan Randle: 1 personal fouls)   FT 1/1: MISS Jaren George makes 0/1 from the line. Rebound secured by Donovan Randle.
Score: 85-77

[07:08] Team_079 possession (Score: 85-77)
Miles Ming attempts a Midrange. Contested by Julius Green (4.9 feet, MAN). Miles Ming misses. Rebound secured by Immanuel Ming.

[06:51] Team_060 possession (Score: 85-77)
Larry Westbrook makes the Dunk and draws the foul on Trae Durant! And-1! Larry Westbrook to the line for 1. [Team fouls: 4] (Trae Durant: 2 personal fouls)   FT 1/1: GOOD Larry Westbrook makes 1/1 from the line.
Score: 88-77

[06:39] Team_079 possession (Score: 88-77)
Bam Randle attempts a 3Pt. Contested by Immanuel Ming (4.4 feet, MAN). Bam Randle misses. Rebound secured by Jaren George.

[06:22] Team_060 possession (Score: 88-77)
FOUL! Reach-in foul on Trae Durant during the drive. [IN THE BONUS! 5 team fouls] Jaren George to the line for 2 free throws. (Trae Durant: 3 personal fouls)   FT 1/2: GOOD   FT 2/2: GOOD Jaren George makes 2/2 from the line.
Score: 90-77

[06:08] Team_079 possession (Score: 90-77)
Donovan Randle drives, picks up Jaren George. Help arrives from Julius Green! Donovan Randle attempts a Layup. Wide open! Julius Green is 6.4 feet away. [ZONE] DONOVAN RANDLE MAKES IT! Assist: Bam Randle
Score: 90-79

[05:54] Team_060 possession (Score: 90-79)
Larry Westbrook attempts a Midrange. Contested by Trae Durant (4.4 feet, MAN). LARRY WESTBROOK MAKES IT! Assist: Immanuel Ming
Score: 92-79

[05:39] Team_079 possession (Score: 92-79)
Donovan Randle attempts a Midrange. Contested by Immanuel Ming (4.7 feet, ZONE). DONOVAN RANDLE MAKES IT!
Score: 92-81

[05:26] Team_060 possession (Score: 92-81)
Larry Westbrook attempts a 3Pt. Contested by Miles Ming (5.7 feet, ZONE). Larry Westbrook misses. Offensive rebound by Jaren George! Jaren George kicks it out.

[05:16] Team_060 possession (Score: 92-81)
Immanuel Ming drives, Bam Randle stays with him. Immanuel Ming attempts a Dunk. Contested by Bam Randle (5.5 feet, MAN). Immanuel Ming misses. Rebound secured by Bam Randle.

[05:00] Team_079 possession (Score: 92-81)
Donovan Randle attempts a Layup. Wide open! Jaren George is 6.6 feet away. [ZONE] Donovan Randle misses. Rebound secured by Jaren George.

[04:49] Team_060 possession (Score: 92-81)
Jaren George drives and kicks out. Larry Westbrook attempts a 3Pt. Contested by Trae Durant (4.4 feet, ZONE). Larry Westbrook misses. Rebound secured by Bam Randle.

[04:35] Team_079 possession (Score: 92-81)
Bam Randle attempts a 3Pt. Contested by Immanuel Ming (4.7 feet, MAN). Bam Randle misses. Rebound secured by Larry Westbrook.

[04:18] Team_060 possession (Score: 92-81)
FOUL! Offensive foul on Joel Morant! Khris Embiid drew the charge! [Team fouls: 3] (Joel Morant: 1 personal fouls) TURNOVER! (dead ball)

[04:01] Team_079 possession (Score: 92-81)
Miles Ming drives and kicks out. Bam Randle attempts a 3Pt. Contested by Immanuel Ming (5.1 feet, ZONE). Bam Randle misses. Rebound secured by Jaren George.

[03:47] Team_060 possession (Score: 92-81)
Immanuel Ming attempts a 3Pt. Contested by Trae Durant (4.4 feet, ZONE). Immanuel Ming misses. Rebound secured by Donovan Randle.

[03:35] Team_079 possession (Score: 92-81)
FOUL! Shooting foul on Immanuel Ming. Bam Randle to the line for 2 free throws. [Team fouls: 4] (Immanuel Ming: 2 personal fouls)   FT 1/2: GOOD   FT 2/2: GOOD Bam Randle makes 2/2 from the line.
Score: 92-83

[03:19] Team_060 possession (Score: 92-83)
FOUL! Holding foul on Miles Ming. [IN THE BONUS! 6 team fouls] Julius Green to the line for 2 free throws. (Miles Ming: 2 personal fouls)   FT 1/2: GOOD   FT 2/2: GOOD Julius Green makes 2/2 from the line.
Score: 94-83

[03:01] Team_079 possession (Score: 94-83)
Khris Embiid attempts a 3Pt. Contested by Immanuel Ming (5.2 feet, ZONE). Khris Embiid misses. Rebound secured by Jaren George.

[02:51] Team_060 possession (Score: 94-83)
Immanuel Ming attempts a 3Pt. Contested by Trae Durant (4.6 feet, ZONE). Immanuel Ming misses. Rebound secured by Trae Durant.

[02:38] Team_079 possession (Score: 94-83)
Trae Durant drives, Larry Westbrook stays with him. Trae Durant attempts a Layup. Wide open! Larry Westbrook is 6.3 feet away. [ZONE] TRAE DURANT MAKES IT! Assist: Bam Randle
Score: 94-85

[02:27] Team_060 possession (Score: 94-85)
Joel Morant attempts a 3Pt. Contested by Khris Embiid (5.7 feet, MAN). Joel Morant misses. Rebound secured by Trae Durant.

[02:16] Team_079 possession (Score: 94-85)
Khris Embiid attempts a Layup. Wide open! Jaren George is 7.2 feet away. [ZONE] KHRIS EMBIID MAKES IT! Assist: Miles Ming
Score: 94-87

[02:03] Team_060 possession (Score: 94-87)
Julius Green drives, Miles Ming stays with him. Julius Green attempts a Dunk. Contested by Miles Ming (5.7 feet, MAN). Julius Green misses. Rebound secured by Bam Randle.

[01:46] Team_079 possession (Score: 94-87)
Khris Embiid attempts a 3Pt. Contested by Immanuel Ming (5.4 feet, ZONE). KHRIS EMBIID MAKES IT! Assist: Trae Durant
Score: 94-90

[01:28] Team_060 possession (Score: 94-90)
Julius Green drives to the basket... Julius Green throws a bad pass! Stolen by Miles Ming! TURNOVER! (live ball)

[01:16] Team_079 possession (Score: 94-90)
Bam Randle makes the Dunk and draws the foul on Immanuel Ming! And-1! Bam Randle to the line for 1. [BONUS: 5 team fouls] (Immanuel Ming: 3 personal fouls)   FT 1/1: GOOD Bam Randle makes 1/1 from the line.
Score: 94-93

[01:01] Team_060 possession (Score: 94-93)
Jaren George makes the Layup and draws the foul on Trae Durant! And-1! Jaren George to the line for 1. [BONUS: 7 team fouls] (Trae Durant: 4 personal fouls)   FT 1/1: GOOD Jaren George makes 1/1 from the line.
Score: 97-93

[00:46] Team_079 possession (Score: 97-93)
Donovan Randle drives to the basket... FOUL! Offensive foul on Donovan Randle! Jaren George drew the charge! [Team fouls: 8] (Donovan Randle: 2 personal fouls) TURNOVER! (dead ball)

[00:31] Team_060 possession (Score: 97-93)
Jaren George attempts a Midrange. Wide open! Donovan Randle is 6.5 feet away. [MAN] JAREN GEORGE MAKES IT! Assist: Larry Westbrook
Score: 99-93

[00:13] Team_079 possession (Score: 99-93)
Khris Embiid drives and kicks out. Khris Embiid attempts a Midrange. Contested by Immanuel Ming (5.7 feet, ZONE). Khris Embiid misses. Rebound secured by Jaren George.

================================================================================
                              4TH QUARTER COMPLETE                              
================================================================================

4TH QUARTER SCORE: Team_060 32, Team_079 21

BOX SCORE:
================================================================================

Team_060
--------------------------------------------------------------------------------
Player                MIN  PTS  REB  AST  TO      FG   FG%      3P   3P%
--------------------------------------------------------------------------------
Julius Green           39   10    0    0   0   4/5    80.0     0/0   0.0
Jaren George           37   10    6    2   0   4/9    44.4     0/0   0.0
Larry Westbrook        37    5    2    2   0   2/2   100.0     0/0   0.0
Joel Morant            37    5    0    1   0   2/3    66.7     0/0   0.0
Immanuel Ming          39    0    5    3   0   0/3     0.0     0/0   0.0

TEAM: FG: 12/22 (54.5%), 3PT: 3/7 (42.9%), REB: 13 (2 off, 11 def), AST: 8, TO: 2
TEAM FOULS: 5 [Team_079 in BONUS]


Team_079
--------------------------------------------------------------------------------
Player                MIN  PTS  REB  AST  TO      FG   FG%      3P   3P%
--------------------------------------------------------------------------------
Khris Embiid           39    7    0    0   0   3/8    37.5     0/0   0.0
Donovan Randle         39    7    3    0   0   3/4    75.0     0/0   0.0
Bam Randle             39    5    4    2   0   2/6    33.3     0/0   0.0
Trae Durant            39    2    2    1   0   1/2    50.0     0/0   0.0
Miles Ming             39    0    0    1   0   0/2     0.0     0/0   0.0

TEAM: FG: 9/22 (40.9%), 3PT: 1/6 (16.7%), REB: 9 (0 off, 9 def), AST: 4, TO: 2
TEAM FOULS: 8 [Team_060 in BONUS]

================================================================================

================================================================================
                               FULL GAME COMPLETE                               
================================================================================

FINAL SCORE: Team_060 99, Team_079 93

SCORING BY QUARTER:
--------------------------------------------------------------------------------
Team                     Q1     Q2     Q3     Q4    FINAL
--------------------------------------------------------------------------------
Team_060                 28     20     19     32       99
Team_079                 16     33     23     21       93
--------------------------------------------------------------------------------

FULL GAME BOX SCORE:
================================================================================

Team_060
--------------------------------------------------------------------------------
Player                MIN  PTS  REB  AST  TO      FG   FG%      3P   3P%      FT STL BLK
--------------------------------------------------------------------------------
Julius Green           39   23    0    0   1   8/13   61.5   4/5    80.0   8/10    0   0
Immanuel Ming          39    6   16    7   1   3/10   30.0   1/5    20.0   1/1     0   1
Joel Morant            37   14    0    1   5   8/12   66.7   3/6    50.0   5/7     1   0
Larry Westbrook        37   16    8    3   0   6/13   46.2   2/4    50.0   2/2     0   1
Jaren George           37   22   11    6   0   7/15   46.7   1/2    50.0   4/5     1   2
Domantas Barnes        11    2    2    0   0   1/2    50.0   0/0     0.0   0/0     0   1
Yao Tatum              11    3    0    0   1   1/6    16.7   1/3    33.3   0/0     0   0
Klay Haliburton        11    4    6    2   1   2/5    40.0   0/1     0.0   1/2     0   0
Rudy Ginobili           9    4    2    0   0   2/3    66.7   0/0     0.0   0/0     0   0
Jarrett Wagner          9    2    0    1   0   1/2    50.0   0/1     0.0   0/0     0   0

TEAM: FG: 40/82 (48.8%), 3PT: 12/27 (44.4%), REB: 44 (9 off, 35 def), AST: 20, TO: 9


Team_079
--------------------------------------------------------------------------------
Player                MIN  PTS  REB  AST  TO      FG   FG%      3P   3P%      FT STL BLK
--------------------------------------------------------------------------------
Khris Embiid           39   21    0    1   1   9/15   60.0   4/6    66.7   6/7     1   0
Miles Ming             39    7    0    4   1   3/8    37.5   0/2     0.0   3/3     2   1
Bam Randle             39   11   14    4   2   5/14   35.7   0/6     0.0   5/5     0   0
Trae Durant            39   13   12    4   2   8/11   72.7   2/3    66.7   1/2     0   2
Donovan Randle         39   18   10    0   2   7/15   46.7   0/0     0.0   2/3     0   0
Evan Mobley             9    5    0    1   0   1/3    33.3   1/2    50.0   2/2     0   0
Karl Ingram             9    4    0    2   1   2/4    50.0   0/1     0.0   1/3     0   1
Anthony Wade            9    5    5    0   0   2/3    66.7   0/0     0.0   1/1     0   0
Kobe Curry              9    2    6    1   0   1/3    33.3   0/1     0.0   1/2     0   0
James LaVine            9    3    2    1   1   1/1   100.0   0/0     0.0   1/1     1   0

TEAM: FG: 40/78 (51.3%), 3PT: 7/21 (33.3%), REB: 49 (9 off, 40 def), AST: 18, TO: 10

================================================================================
