================================================================================
                        FULL GAME - Team_008 vs Team_037                        
================================================================================

================================================================================
                       1ST QUARTER - Team_008 vs Team_037                       
================================================================================

[12:00] Team_008 possession (Score: 0-0)
Khris Hyland attempts a Layup. Contested by Jarrett Tatum (4.0 feet, MAN). Khris Hyland misses. Rebound secured by Scottie Jackson.

[11:48] Team_037 possession (Score: 0-0)
Scottie Jackson attempts a Midrange. Contested by Tyrese Thompson (4.9 feet, MAN). SCOTTIE JACKSON MAKES IT!
Score: 0-2

[11:36] Team_008 possession (Score: 0-2)
Tyrese Thompson drives and kicks out. Jrue Harris attempts a Midrange. Contested by Jarrett Tatum (3.9 feet, ZONE). JRUE HARRIS MAKES IT!
Score: 2-2

[11:20] Team_037 possession (Score: 2-2)
Collin Young drives and kicks out. RJ Mitchell attempts a Midrange. Contested by Victor Leonard (5.0 feet, MAN). RJ Mitchell misses. Rebound secured by Tyrese Thompson.

[11:09] Team_008 possession (Score: 2-2)
Jrue Harris attempts a 3Pt. Contested by Scottie Jackson (3.7 feet, ZONE). Jrue Harris misses. Rebound secured by Scottie Jackson.

[10:54] Team_037 possession (Score: 2-2)
Scottie Jackson attempts a 3Pt. Contested by Victor Leonard (5.5 feet, ZONE). Scottie Jackson misses. Rebound secured by Magic Young.

[10:39] Team_008 possession (Score: 2-2)
Khris Hyland attempts a Midrange. Contested by Giannis Middleton (4.1 feet, ZONE). KHRIS HYLAND MAKES IT!
Score: 4-2

[10:29] Team_037 possession (Score: 4-2)
RJ Mitchell attempts a 3Pt. Contested by Victor Leonard (5.2 feet, ZONE). RJ Mitchell misses. Rebound secured by Tyrese Thompson.

[10:17] Team_008 possession (Score: 4-2)
FOUL! Shooting foul on RJ Mitchell. Victor Leonard to the line for 2 free throws. [Team fouls: 1] (RJ Mitchell: 1 personal fouls)   FT 1/2: MISS   FT 2/2: GOOD Victor Leonard makes 1/2 from the line.
Score: 5-2

[10:01] Team_037 possession (Score: 5-2)
Jarrett Tatum makes the Dunk and draws the foul on Jrue Harris! And-1! Jarrett Tatum to the line for 1. [Team fouls: 1] (Jrue Harris: 1 personal fouls)   FT 1/1: GOOD Jarrett Tatum makes 1/1 from the line.
Score: 5-5

[09:48] Team_008 possession (Score: 5-5)
Khris Hyland attempts a 3Pt. Contested by Jarrett Tatum (4.0 feet, MAN). Khris Hyland misses. Rebound secured by Collin Young.

[09:32] Team_037 possession (Score: 5-5)
RJ Mitchell drives and kicks out. RJ Mitchell attempts a Midrange. Contested by Victor Leonard (5.0 feet, MAN). RJ Mitchell misses. Rebound secured by Magic Young.

[09:13] Team_008 possession (Score: 5-5)
Jrue Harris attempts a Midrange. Contested by Giannis Middleton (4.1 feet, ZONE). JRUE HARRIS MAKES IT! Assist: Magic Young
Score: 7-5

[09:00] Team_037 possession (Score: 7-5)
Collin Young attempts a Midrange. BLOCKED BY MAGIC YOUNG! Ball is loose! Offensive rebound by Scottie Jackson! Scottie Jackson kicks it out.

[08:44] Team_037 possession (Score: 7-5)
Giannis Middleton attempts a 3Pt. Contested by Jrue Harris (4.7 feet, MAN). Giannis Middleton misses. Rebound secured by Tyrese Thompson.

[08:29] Team_008 possession (Score: 7-5)
Jrue Harris attempts a 3Pt. Contested by Giannis Middleton (4.1 feet, MAN). JRUE HARRIS MAKES IT! Assist: Tyrese Thompson
Score: 10-5

[08:12] Team_037 possession (Score: 10-5)
Scottie Jackson throws a bad pass out of bounds! TURNOVER! (dead ball)

[07:52] Team_008 possession (Score: 10-5)
Victor Leonard attempts a Midrange. Contested by Jarrett Tatum (4.3 feet, ZONE). Victor Leonard misses. Rebound secured by Jarrett Tatum.

[07:42] Team_037 possession (Score: 10-5)
Jarrett Tatum attempts a 3Pt. Contested by Khris Hyland (4.2 feet, MAN). Jarrett Tatum misses. Rebound secured by Tyrese Thompson.

[07:29] Team_008 possession (Score: 10-5)
Magic Young attempts a 3Pt. Contested by Scottie Jackson (4.0 feet, ZONE). Magic Young misses. Rebound secured by Jarrett Tatum.

[07:12] Team_037 possession (Score: 10-5)
Collin Young attempts a Midrange. Contested by Jrue Harris (4.3 feet, ZONE). Collin Young misses. Rebound secured by Magic Young.

[06:59] Team_008 possession (Score: 10-5)
Khris Hyland attempts a 3Pt. Contested by Scottie Jackson (3.7 feet, ZONE). KHRIS HYLAND MAKES IT! Assist: Victor Leonard
Score: 13-5

[06:43] Team_037 possession (Score: 13-5)
Jarrett Tatum drives and kicks out. Collin Young attempts a 3Pt. Contested by Victor Leonard (5.0 feet, ZONE). Collin Young misses. Offensive rebound by Scottie Jackson! Scottie Jackson puts it back in!
Score: 13-7

[06:28] Team_008 possession (Score: 13-7)
Victor Leonard attempts a 3Pt. Contested by RJ Mitchell (5.0 feet, MAN). VICTOR LEONARD MAKES IT! Assist: Khris Hyland
Score: 16-7

[06:13] Team_037 possession (Score: 16-7)
Scottie Jackson attempts a Midrange. Contested by Tyrese Thompson (4.9 feet, MAN). Scottie Jackson misses. Rebound secured by Magic Young.

[06:00] Team_008 possession (Score: 16-7)
Jrue Harris drives to the basket... Jrue Harris loses control! Ball rolls out of bounds! TURNOVER! (dead ball)

[05:45] Team_037 possession (Score: 16-7)
Scottie Jackson attempts a Midrange. Contested by Tyrese Thompson (4.9 feet, MAN). Scottie Jackson misses. Offensive rebound by Collin Young! Collin Young puts it back in!
Score: 16-9

[05:29] Team_008 possession (Score: 16-9)
Magic Young attempts a 3Pt. Contested by Scottie Jackson (4.0 feet, ZONE). Magic Young misses. Rebound secured by Jarrett Tatum.

[05:11] Team_037 possession (Score: 16-9)
Giannis Middleton attempts a Midrange. Contested by Jrue Harris (4.7 feet, MAN). Giannis Middleton misses. Rebound secured by Khris Hyland.

[04:56] Team_008 possession (Score: 16-9)
FOUL! Reach-in foul on Scottie Jackson during the drive. [Team fouls: 2] No free throws, side out. (Scottie Jackson: 1 personal fouls)

[04:44] Team_008 possession (Score: 16-9)
Jrue Harris attempts a Layup. Contested by Giannis Middleton (4.1 feet, MAN). JRUE HARRIS MAKES IT! Assist: Victor Leonard
Score: 18-9

[04:30] Team_037 possession (Score: 18-9)
Collin Young attempts a Midrange. Contested by Khris Hyland (4.1 feet, ZONE). Collin Young misses. Offensive rebound by Collin Young! Collin Young puts it back in!
Score: 18-11

[04:17] Team_008 possession (Score: 18-11)
FOUL! Holding foul on Giannis Middleton. [Team fouls: 3] No free throws, side out. (Giannis Middleton: 1 personal fouls)

[04:02] Team_008 possession (Score: 18-11)
FOUL! Reach-in foul on Scottie Jackson during the drive. [Team fouls: 4] No free throws, side out. (Scottie Jackson: 2 personal fouls)

[03:47] Team_008 possession (Score: 18-11)
FOUL! Reach-in foul on Scottie Jackson during the drive. [IN THE BONUS! 5 team fouls] Tyrese Thompson to the line for 2 free throws. (Scottie Jackson: 3 personal fouls)   FT 1/2: MISS   FT 2/2: GOOD Tyrese Thompson makes 1/2 from the line.
Score: 19-11

[03:34] Team_037 possession (Score: 19-11)
Scottie Jackson attempts a 3Pt. Contested by Tyrese Thompson (5.1 feet, MAN). SCOTTIE JACKSON MAKES IT! Assist: Collin Young
Score: 19-14

[03:16] Team_008 possession (Score: 19-14)
Tyrese Thompson drives, picks up Collin Young. Help arrives from Giannis Middleton! Tyrese Thompson attempts a Layup. Contested by Giannis Middleton (4.3 feet, ZONE). Tyrese Thompson misses. Rebound secured by Scottie Jackson.

[03:03] Team_037 possession (Score: 19-14)
Jarrett Tatum drives, Khris Hyland stays with him. Jarrett Tatum attempts a Dunk. Contested by Khris Hyland (4.4 feet, MAN). JARRETT TATUM MAKES IT! Assist: Collin Young
Score: 19-16

[02:46] Team_008 possession (Score: 19-16)
Jrue Harris attempts a 3Pt. Contested by Scottie Jackson (3.8 feet, ZONE). Jrue Harris misses. Rebound secured by Jarrett Tatum.

[02:35] Team_037 possession (Score: 19-16)
Collin Young makes the Midrange and draws the foul on Victor Leonard! And-1! Collin Young to the line for 1. [Team fouls: 2] (Victor Leonard: 1 personal fouls)   FT 1/1: MISS Collin Young makes 0/1 from the line. Rebound secured by Tyrese Thompson.
Score: 19-18

[02:24] Team_008 possession (Score: 19-18)
Tyrese Thompson drives, picks up Scottie Jackson. Help arrives from Giannis Middleton! Tyrese Thompson attempts a Layup. Contested by Giannis Middleton (3.9 feet, MAN). TYRESE THOMPSON MAKES IT! Assist: Jrue Harris
Score: 21-18

[02:10] Team_037 possession (Score: 21-18)
Giannis Middleton attempts a 3Pt. Contested by Jrue Harris (4.9 feet, MAN). Giannis Middleton misses. Rebound secured by Khris Hyland.

[01:57] Team_008 possession (Score: 21-18)
Victor Leonard attempts a 3Pt. Contested by RJ Mitchell (5.2 feet, MAN). Victor Leonard misses. Rebound secured by Collin Young.

[01:42] Team_037 possession (Score: 21-18)
FOUL! Offensive foul on Giannis Middleton! Jrue Harris drew the charge! [Team fouls: 6] (Giannis Middleton: 2 personal fouls) TURNOVER! (dead ball)

[01:26] Team_008 possession (Score: 21-18)
FOUL! Holding foul on Jarrett Tatum. [IN THE BONUS! 7 team fouls] Khris Hyland to the line for 2 free throws. (Jarrett Tatum: 1 personal fouls)   FT 1/2: MISS   FT 2/2: GOOD Khris Hyland makes 1/2 from the line.
Score: 22-18

[01:09] Team_037 possession (Score: 22-18)
Collin Young drives and kicks out. Scottie Jackson attempts a Midrange. Contested by Tyrese Thompson (4.9 feet, MAN). Scottie Jackson misses. Rebound secured by Khris Hyland.

[00:57] Team_008 possession (Score: 22-18)
FOUL! Holding foul on RJ Mitchell. [IN THE BONUS! 8 team fouls] Victor Leonard to the line for 2 free throws. (RJ Mitchell: 2 personal fouls)   FT 1/2: GOOD   FT 2/2: GOOD Victor Leonard makes 2/2 from the line.
Score: 24-18

[00:43] Team_037 possession (Score: 24-18)
FOUL! Shooting foul on Khris Hyland. RJ Mitchell to the line for 2 free throws. [Team fouls: 3] (Khris Hyland: 1 personal fouls)   FT 1/2: MISS   FT 2/2: GOOD RJ Mitchell makes 1/2 from the line.
Score: 24-19

[00:32] Team_008 possession (Score: 24-19)
Jrue Harris attempts a 3Pt. Contested by Giannis Middleton (4.5 feet, MAN). Jrue Harris misses. Rebound secured by Collin Young.

[00:14] Team_037 possession (Score: 24-19)
Jarrett Tatum commits a violation (traveling/carry)! TURNOVER! (dead ball)

[00:14] Substitution (Team_008): Victor Leonard OUT → Blake Holiday IN (stamina_rule2)

[00:14] Substitution (Team_008): Jrue Harris OUT → Chris Griffin IN (stamina_rule2)

[00:14] Substitution (Team_008): Khris Hyland OUT → Immanuel Young IN (stamina_rule2)

[00:14] Substitution (Team_008): Tyrese Thompson OUT → Khris Giddey IN (stamina_rule2)

[00:14] Substitution (Team_008): Magic Young OUT → Lamelo Middleton IN (stamina_rule2)

[00:14] Substitution (Team_037): RJ Mitchell OUT → Jarrett Randle IN (stamina_rule2)

[00:14] Substitution (Team_037): Giannis Middleton OUT → Collin Trent IN (stamina_rule2)

[00:14] Substitution (Team_037): Jarrett Tatum OUT → Julius Bird IN (stamina_rule2)

[00:14] Substitution (Team_037): Scottie Jackson OUT → Russell Anthony IN (stamina_rule2)

[00:14] Substitution (Team_037): Collin Young OUT → Wendell Herro IN (stamina_rule2)

================================================================================
                              1ST QUARTER COMPLETE                              
================================================================================

1ST QUARTER SCORE: Team_008 24, Team_037 19

BOX SCORE:
================================================================================

Team_008
--------------------------------------------------------------------------------
Player                MIN  PTS  REB  AST  TO      FG   FG%      3P   3P%
--------------------------------------------------------------------------------
Jrue Harris            12    9    0    1   0   4/7    57.1     0/0   0.0
Khris Hyland           12    6    3    1   0   3/5    60.0     0/0   0.0
Victor Leonard         12    6    0    2   0   3/5    60.0     0/0   0.0
Tyrese Thompson        12    3    5    1   0   2/3    66.7     0/0   0.0
Magic Young            12    0    4    1   0   0/2     0.0     0/0   0.0

TEAM: FG: 12/22 (54.5%), 3PT: 3/10 (30.0%), REB: 12 (0 off, 12 def), AST: 6, TO: 1
TEAM FOULS: 3


Team_037
--------------------------------------------------------------------------------
Player                MIN  PTS  REB  AST  TO      FG   FG%      3P   3P%
--------------------------------------------------------------------------------
Scottie Jackson        12    7    5    0   0   3/5    60.0     0/0   0.0
Jarrett Tatum          12    5    4    0   0   2/3    66.7     0/0   0.0
Collin Young           12    4    5    2   0   2/6    33.3     0/0   0.0
RJ Mitchell            12    1    0    0   0   1/3    33.3     0/0   0.0
Giannis Middleton      12    0    0    0   0   0/3     0.0     0/0   0.0

TEAM: FG: 8/20 (40.0%), 3PT: 1/6 (16.7%), REB: 14 (4 off, 10 def), AST: 2, TO: 3
TEAM FOULS: 8 [Team_008 in BONUS]

================================================================================

================================================================================
                       2ND QUARTER - Team_008 vs Team_037                       
================================================================================

[12:00] Team_008 possession (Score: 24-19)
Magic Young drives and kicks out. FOUL! Shooting foul on RJ Mitchell. Khris Hyland to the line for 3 free throws. [Team fouls: 1] (RJ Mitchell: 1 personal fouls)   FT 1/3: GOOD   FT 2/3: GOOD   FT 3/3: GOOD Khris Hyland makes 3/3 from the line.
Score: 27-19

[11:44] Team_037 possession (Score: 27-19)
Giannis Middleton makes the 3Pt and draws the foul on Jrue Harris! And-1! Giannis Middleton to the line for 1. [Team fouls: 1] (Jrue Harris: 1 personal fouls)   FT 1/1: GOOD Giannis Middleton makes 1/1 from the line.
Score: 27-23

[11:32] Team_008 possession (Score: 27-23)
Tyrese Thompson attempts a 3Pt. Contested by Scottie Jackson (4.0 feet, ZONE). Tyrese Thompson misses. Rebound secured by Collin Young.

[11:17] Team_037 possession (Score: 27-23)
Giannis Middleton loses control! Ball rolls out of bounds! TURNOVER! (dead ball)

[11:17] Substitution (Team_008): Victor Leonard OUT → Blake Holiday IN (stamina_rule2)

[11:17] Substitution (Team_008): Jrue Harris OUT → Chris Griffin IN (stamina_rule2)

[11:17] Substitution (Team_008): Khris Hyland OUT → Immanuel Young IN (stamina_rule2)

[11:17] Substitution (Team_008): Tyrese Thompson OUT → Khris Giddey IN (stamina_rule2)

[11:17] Substitution (Team_008): Magic Young OUT → Lamelo Middleton IN (stamina_rule2)

[11:17] Substitution (Team_037): RJ Mitchell OUT → Jarrett Randle IN (stamina_rule2)

[11:17] Substitution (Team_037): Giannis Middleton OUT → Collin Trent IN (stamina_rule2)

[11:17] Substitution (Team_037): Jarrett Tatum OUT → Julius Bird IN (stamina_rule2)

[11:17] Substitution (Team_037): Scottie Jackson OUT → Russell Anthony IN (stamina_rule2)

[11:17] Substitution (Team_037): Collin Young OUT → Wendell Herro IN (stamina_rule2)

[11:07] Team_008 possession (Score: 27-23)
Khris Giddey drives and kicks out. Blake Holiday attempts a 3Pt. Contested by Jarrett Randle (3.8 feet, ZONE). Blake Holiday misses. Offensive rebound by Lamelo Middleton! Lamelo Middleton puts it back in!
Score: 29-23

[10:51] Team_037 possession (Score: 29-23)
Wendell Herro commits a violation (traveling/carry)! TURNOVER! (dead ball)

[10:34] Team_008 possession (Score: 29-23)
Blake Holiday attempts a 3Pt. Contested by Jarrett Randle (4.0 feet, MAN). Blake Holiday misses. Rebound secured by Wendell Herro.

[10:20] Team_037 possession (Score: 29-23)
Julius Bird attempts a 3Pt. Contested by Khris Giddey (4.7 feet, ZONE). Julius Bird misses. Offensive rebound by Julius Bird! Julius Bird kicks it out.

[10:08] Team_037 possession (Score: 29-23)
Russell Anthony drives to the basket... Russell Anthony commits a violation (traveling/carry)! TURNOVER! (dead ball)

[09:57] Team_008 possession (Score: 29-23)
Chris Griffin drives, picks up Collin Trent. Help arrives from Julius Bird! Chris Griffin attempts a Layup. Contested by Julius Bird (6.0 feet, MAN). CHRIS GRIFFIN MAKES IT!
Score: 31-23

[09:44] Team_037 possession (Score: 31-23)
Wendell Herro drives and kicks out. Collin Trent attempts a Midrange. Contested by Chris Griffin (5.3 feet, MAN). COLLIN TRENT MAKES IT!
Score: 31-25

[09:26] Team_008 possession (Score: 31-25)
Khris Giddey makes the 3Pt and draws the foul on Russell Anthony! And-1! Khris Giddey to the line for 1. [Team fouls: 2] (Russell Anthony: 1 personal fouls)   FT 1/1: GOOD Khris Giddey makes 1/1 from the line.
Score: 35-25

[09:08] Team_037 possession (Score: 35-25)
Collin Trent drives and kicks out. Julius Bird attempts a Midrange. Contested by Immanuel Young (4.3 feet, MAN). Julius Bird misses. Rebound secured by Khris Giddey.

[08:55] Team_008 possession (Score: 35-25)
Lamelo Middleton drives, Russell Anthony stays with him. Lamelo Middleton attempts a Dunk. Contested by Russell Anthony (4.1 feet, MAN). Lamelo Middleton misses. Rebound secured by Russell Anthony.

[08:44] Team_037 possession (Score: 35-25)
Julius Bird attempts a 3Pt. Contested by Immanuel Young (4.7 feet, MAN). JULIUS BIRD MAKES IT! Assist: Russell Anthony
Score: 35-28

[08:27] Team_008 possession (Score: 35-28)
Khris Giddey attempts a Layup. Contested by Russell Anthony (3.6 feet, MAN). Khris Giddey misses. Rebound secured by Julius Bird.

[08:10] Team_037 possession (Score: 35-28)
Wendell Herro drives, Lamelo Middleton stays with him. Wendell Herro attempts a Layup. Contested by Lamelo Middleton (4.6 feet, ZONE). WENDELL HERRO MAKES IT!
Score: 35-30

[07:53] Team_008 possession (Score: 35-30)
Blake Holiday attempts a Layup. BLOCKED BY RUSSELL ANTHONY! Ball deflects out of bounds off Blake Holiday.

[07:40] Team_037 possession (Score: 35-30)
Wendell Herro attempts a Midrange. Contested by Lamelo Middleton (4.6 feet, MAN). Wendell Herro misses. FOUL! Loose ball foul on Khris Giddey during the rebound battle. [Team fouls: 2] No free throws, side out. (Khris Giddey: 1 personal fouls)

[07:24] Team_037 possession (Score: 35-30)
Julius Bird attempts a 3Pt. Contested by Immanuel Young (4.7 feet, MAN). Julius Bird misses. Rebound secured by Lamelo Middleton.

[07:09] Team_008 possession (Score: 35-30)
Lamelo Middleton drives, Russell Anthony stays with him. Lamelo Middleton attempts a Dunk. Contested by Russell Anthony (4.1 feet, ZONE). Lamelo Middleton misses. Offensive rebound by Lamelo Middleton! Lamelo Middleton's putback is no good. Rebound secured by Wendell Herro.

[06:53] Team_037 possession (Score: 35-30)
Julius Bird drives and kicks out. Russell Anthony attempts a 3Pt. Contested by Immanuel Young (4.3 feet, ZONE). Russell Anthony misses. Rebound secured by Chris Griffin.

[06:38] Team_008 possession (Score: 35-30)
Khris Giddey attempts a Midrange. Contested by Collin Trent (5.5 feet, ZONE). Khris Giddey misses. FOUL! Loose ball foul on Russell Anthony during the rebound battle. [Team fouls: 3] No free throws, side out. (Russell Anthony: 2 personal fouls)

[06:23] Team_008 possession (Score: 35-30)
Lamelo Middleton drives, picks up Russell Anthony. Help arrives from Collin Trent! Lamelo Middleton attempts a Dunk. Contested by Collin Trent (4.1 feet, MAN). LAMELO MIDDLETON MAKES IT! Assist: Immanuel Young
Score: 37-30

[06:06] Team_037 possession (Score: 37-30)
Collin Trent attempts a Midrange. Contested by Chris Griffin (5.6 feet, ZONE). Collin Trent misses. Offensive rebound by Julius Bird! Julius Bird kicks it out.

[05:56] Team_037 possession (Score: 37-30)
Julius Bird loses control! Ball rolls out of bounds! TURNOVER! (dead ball)

[05:38] Team_008 possession (Score: 37-30)
Khris Giddey attempts a Midrange. Contested by Russell Anthony (3.6 feet, MAN). Khris Giddey misses. Offensive rebound by Lamelo Middleton! Lamelo Middleton's putback is no good. Offensive rebound by Lamelo Middleton! Lamelo Middleton kicks it out.

[05:22] Team_008 possession (Score: 37-30)
Lamelo Middleton drives to the basket... Lamelo Middleton throws a bad pass! Stolen by Russell Anthony! TURNOVER! (live ball)

[05:10] Team_037 possession (Score: 37-30)
FOUL! Shooting foul on Chris Griffin. Wendell Herro to the line for 2 free throws. [Team fouls: 3] (Chris Griffin: 1 personal fouls)   FT 1/2: GOOD   FT 2/2: MISS Wendell Herro makes 1/2 from the line. Rebound secured by Chris Griffin.
Score: 37-31

[04:54] Team_008 possession (Score: 37-31)
Lamelo Middleton attempts a Midrange. Contested by Julius Bird (4.7 feet, ZONE). LAMELO MIDDLETON MAKES IT! Assist: Chris Griffin
Score: 39-31

[04:38] Team_037 possession (Score: 39-31)
Julius Bird attempts a Layup. Contested by Immanuel Young (4.7 feet, MAN). JULIUS BIRD MAKES IT! Assist: Russell Anthony
Score: 39-33

[04:26] Team_008 possession (Score: 39-33)
Lamelo Middleton drives and kicks out. Lamelo Middleton attempts a Midrange. Contested by Russell Anthony (3.8 feet, MAN). Lamelo Middleton misses. Offensive rebound by Lamelo Middleton! Lamelo Middleton's putback is no good. Offensive rebound by Lamelo Middleton! Lamelo Middleton kicks it out.

[04:10] Team_008 possession (Score: 39-33)
Blake Holiday drives to the basket... FOUL! Offensive foul on Blake Holiday! Russell Anthony drew the charge! [Team fouls: 4] (Blake Holiday: 1 personal fouls) TURNOVER! (dead ball)

[03:54] Team_037 possession (Score: 39-33)
Julius Bird attempts a Midrange. Contested by Immanuel Young (4.8 feet, MAN). Julius Bird misses. Rebound secured by Khris Giddey.

[03:41] Team_008 possession (Score: 39-33)
Chris Griffin drives, Russell Anthony stays with him. Chris Griffin attempts a Layup. Contested by Russell Anthony (4.1 feet, ZONE). Chris Griffin misses. Rebound secured by Russell Anthony.

[03:29] Team_037 possession (Score: 39-33)
Collin Trent throws a bad pass! Stolen by Chris Griffin! TURNOVER! (live ball)

[03:14] Team_008 possession (Score: 39-33)
FOUL! Reach-in foul on Russell Anthony during the drive. [IN THE BONUS! 5 team fouls] Khris Giddey to the line for 2 free throws. (Russell Anthony: 4 personal fouls)   FT 1/2: GOOD   FT 2/2: MISS Khris Giddey makes 1/2 from the line. Rebound secured by Julius Bird.
Score: 40-33

[03:00] Team_037 possession (Score: 40-33)
Jarrett Randle attempts a 3Pt. Contested by Blake Holiday (5.6 feet, MAN). Jarrett Randle misses. Rebound secured by Lamelo Middleton.

[02:44] Team_008 possession (Score: 40-33)
FOUL! Holding foul on Julius Bird. [IN THE BONUS! 6 team fouls] Immanuel Young to the line for 2 free throws. (Julius Bird: 1 personal fouls)   FT 1/2: GOOD   FT 2/2: MISS Immanuel Young makes 1/2 from the line. Rebound secured by Wendell Herro.
Score: 41-33

[02:32] Team_037 possession (Score: 41-33)
Wendell Herro drives to the basket... Wendell Herro loses control! Ball rolls out of bounds! TURNOVER! (dead ball)

[02:20] Team_008 possession (Score: 41-33)
Khris Giddey drives, picks up Russell Anthony. Help arrives from Collin Trent! Khris Giddey attempts a Dunk. Contested by Collin Trent (3.8 feet, ZONE). KHRIS GIDDEY MAKES IT! Assist: Lamelo Middleton
Score: 43-33

[02:02] Team_037 possession (Score: 43-33)
Wendell Herro drives, picks up Lamelo Middleton. Help arrives from Chris Griffin! Wendell Herro attempts a Dunk. Contested by Chris Griffin (4.8 feet, MAN). Wendell Herro misses. Offensive rebound by Russell Anthony! Russell Anthony puts it back in!
Score: 43-35

[01:52] Team_008 possession (Score: 43-35)
Lamelo Middleton drives, picks up Russell Anthony. Help arrives from Collin Trent! Lamelo Middleton attempts a Dunk. Contested by Collin Trent (4.3 feet, ZONE). Lamelo Middleton misses. Offensive rebound by Lamelo Middleton! Lamelo Middleton's putback is no good. Rebound secured by Russell Anthony.

[01:41] Team_037 possession (Score: 43-35)
Julius Bird drives and kicks out. Collin Trent attempts a 3Pt. Contested by Khris Giddey (4.5 feet, ZONE). Collin Trent misses. Rebound secured by Lamelo Middleton.

[01:28] Team_008 possession (Score: 43-35)
Immanuel Young drives, Julius Bird stays with him. Immanuel Young attempts a Layup. Contested by Julius Bird (5.1 feet, MAN). Immanuel Young misses. Rebound secured by Wendell Herro.

[01:13] Team_037 possession (Score: 43-35)
Wendell Herro attempts a Midrange. Contested by Khris Giddey (4.8 feet, ZONE). Wendell Herro misses. Offensive rebound by Russell Anthony! Russell Anthony puts it back in!
Score: 43-37

[01:00] Team_008 possession (Score: 43-37)
Immanuel Young drives to the basket... Immanuel Young throws a bad pass! Stolen by Julius Bird! TURNOVER! (live ball)

[00:47] Team_037 possession (Score: 43-37)
Russell Anthony attempts a 3Pt. Contested by Khris Giddey (4.9 feet, MAN). Russell Anthony misses. Rebound secured by Lamelo Middleton.

[00:33] Team_008 possession (Score: 43-37)
FOUL! Holding foul on Collin Trent. [IN THE BONUS! 7 team fouls] Chris Griffin to the line for 2 free throws. (Collin Trent: 1 personal fouls)   FT 1/2: GOOD   FT 2/2: GOOD Chris Griffin makes 2/2 from the line.
Score: 45-37

[00:20] Team_037 possession (Score: 45-37)
Jarrett Randle attempts a Midrange. Contested by Khris Giddey (4.8 feet, ZONE). Jarrett Randle misses. Offensive rebound by Russell Anthony! Russell Anthony puts it back in!
Score: 45-39

[00:03] Team_008 possession (Score: 45-39)
FOUL! Holding foul on Jarrett Randle. [IN THE BONUS! 8 team fouls] Blake Holiday to the line for 2 free throws. (Jarrett Randle: 1 personal fouls)   FT 1/2: GOOD   FT 2/2: MISS Blake Holiday makes 1/2 from the line. Rebound secured by Russell Anthony.
Score: 46-39

================================================================================
                              2ND QUARTER COMPLETE                              
================================================================================

2ND QUARTER SCORE: Team_008 22, Team_037 20

BOX SCORE:
================================================================================

Team_008
--------------------------------------------------------------------------------
Player                MIN  PTS  REB  AST  TO      FG   FG%      3P   3P%
--------------------------------------------------------------------------------
Lamelo Middleton       11    6    8    1   0   3/6    50.0     0/0   0.0
Khris Giddey           11    6    2    0   0   2/4    50.0     0/0   0.0
Chris Griffin          11    4    2    1   0   2/3    66.7     0/0   0.0
Khris Hyland           13    3    0    0   0   1/1   100.0     0/0   0.0
Tyrese Thompson        13    0    0    0   0   0/1     0.0     0/0   0.0
Blake Holiday          11    0    0    0   0   0/2     0.0     0/0   0.0
Immanuel Young         11    0    0    1   0   0/1     0.0     0/0   0.0

TEAM: FG: 8/20 (40.0%), 3PT: 1/3 (33.3%), REB: 14 (6 off, 8 def), AST: 3, TO: 3
TEAM FOULS: 4


Team_037
--------------------------------------------------------------------------------
Player                MIN  PTS  REB  AST  TO      FG   FG%      3P   3P%
--------------------------------------------------------------------------------
Russell Anthony        11    6    8    2   0   3/4    75.0     0/0   0.0
Julius Bird            11    5    4    0   0   2/6    33.3     0/0   0.0
Giannis Middleton      13    4    0    0   0   1/1   100.0     0/0   0.0
Wendell Herro          11    2    4    0   0   1/2    50.0     0/0   0.0
Collin Trent           11    2    0    0   0   1/2    50.0     0/0   0.0
Collin Young           13    0    1    0   0   0/0     0.0     0/0   0.0
Jarrett Randle         11    0    0    0   0   0/1     0.0     0/0   0.0

TEAM: FG: 8/16 (50.0%), 3PT: 2/5 (40.0%), REB: 15 (6 off, 9 def), AST: 2, TO: 6
TEAM FOULS: 8 [Team_008 in BONUS]

================================================================================

================================================================================
                       3RD QUARTER - Team_008 vs Team_037                       
================================================================================

[12:00] Team_008 possession (Score: 46-39)
Tyrese Thompson drives and kicks out. Tyrese Thompson attempts a Midrange. Contested by Scottie Jackson (3.6 feet, MAN). Tyrese Thompson misses. Rebound secured by Jarrett Tatum.

[11:46] Team_037 possession (Score: 46-39)
RJ Mitchell attempts a 3Pt. Contested by Victor Leonard (5.2 feet, MAN). RJ Mitchell misses. Rebound secured by Khris Hyland.

[11:29] Team_008 possession (Score: 46-39)
Khris Hyland attempts a Layup. Contested by Jarrett Tatum (4.0 feet, MAN). KHRIS HYLAND MAKES IT!
Score: 48-39

[11:14] Team_037 possession (Score: 48-39)
Collin Young drives, picks up Magic Young. Help arrives from Jrue Harris! Collin Young attempts a Dunk. Contested by Jrue Harris (5.0 feet, MAN). COLLIN YOUNG MAKES IT! Assist: Scottie Jackson
Score: 48-41

[11:01] Team_008 possession (Score: 48-41)
Khris Hyland attempts a 3Pt. Contested by Jarrett Tatum (4.0 feet, MAN). KHRIS HYLAND MAKES IT! Assist: Tyrese Thompson
Score: 51-41

[10:49] Team_037 possession (Score: 51-41)
Scottie Jackson attempts a Midrange. Contested by Khris Hyland (4.6 feet, ZONE). Scottie Jackson misses. Rebound secured by Magic Young.

[10:33] Team_008 possession (Score: 51-41)
FOUL! Reach-in foul on Scottie Jackson during the drive. [Team fouls: 1] No free throws, side out. (Scottie Jackson: 1 personal fouls)

[10:15] Team_008 possession (Score: 51-41)
Khris Hyland attempts a Midrange. Contested by Giannis Middleton (4.1 feet, ZONE). KHRIS HYLAND MAKES IT!
Score: 53-41

[10:01] Team_037 possession (Score: 53-41)
Giannis Middleton drives and kicks out. Giannis Middleton attempts a 3Pt. Contested by Jrue Harris (4.3 feet, MAN). Giannis Middleton misses. Rebound secured by Khris Hyland.

[09:50] Team_008 possession (Score: 53-41)
Victor Leonard drives to the basket... Victor Leonard loses the ball! Stripped by Scottie Jackson! TURNOVER! (live ball)

[09:32] Team_037 possession (Score: 53-41)
Collin Young makes the Dunk and draws the foul on Jrue Harris! And-1! Collin Young to the line for 1. [Team fouls: 1] (Jrue Harris: 1 personal fouls)   FT 1/1: GOOD Collin Young makes 1/1 from the line.
Score: 53-44

[09:20] Team_008 possession (Score: 53-44)
Victor Leonard attempts a 3Pt. Contested by RJ Mitchell (5.0 feet, MAN). VICTOR LEONARD MAKES IT! Assist: Jrue Harris
Score: 56-44

[09:08] Team_037 possession (Score: 56-44)
RJ Mitchell attempts a 3Pt. Contested by Victor Leonard (5.2 feet, MAN). RJ Mitchell misses. Rebound secured by Tyrese Thompson.

[08:55] Team_008 possession (Score: 56-44)
FOUL! Reach-in foul on Scottie Jackson during the drive. [Team fouls: 2] No free throws, side out. (Scottie Jackson: 2 personal fouls)

[08:42] Team_008 possession (Score: 56-44)
Jrue Harris attempts a 3Pt. Contested by Scottie Jackson (3.7 feet, ZONE). Jrue Harris misses. Rebound secured by Scottie Jackson.

[08:28] Team_037 possession (Score: 56-44)
Collin Young attempts a Layup. Contested by Tyrese Thompson (4.4 feet, ZONE). COLLIN YOUNG MAKES IT! Assist: Scottie Jackson
Score: 56-46

[08:15] Team_008 possession (Score: 56-46)
Magic Young drives, picks up Collin Young. Help arrives from Giannis Middleton! Magic Young attempts a Layup. Contested by Giannis Middleton (4.4 feet, MAN). MAGIC YOUNG MAKES IT! Assist: Khris Hyland
Score: 58-46

[07:59] Team_037 possession (Score: 58-46)
Giannis Middleton attempts a Layup. Contested by Tyrese Thompson (4.8 feet, ZONE). GIANNIS MIDDLETON MAKES IT!
Score: 58-48

[07:50] Team_008 possession (Score: 58-48)
Victor Leonard attempts a 3Pt. Contested by RJ Mitchell (5.0 feet, MAN). Victor Leonard misses. Rebound secured by Collin Young.

[07:37] Team_037 possession (Score: 58-48)
Collin Young drives, Magic Young stays with him. Collin Young attempts a Layup. Contested by Magic Young (5.0 feet, MAN). COLLIN YOUNG MAKES IT!
Score: 58-50

[07:25] Team_008 possession (Score: 58-50)
Jrue Harris attempts a 3Pt. Contested by Scottie Jackson (3.7 feet, ZONE). Jrue Harris misses. Rebound secured by Scottie Jackson.

[07:09] Team_037 possession (Score: 58-50)
Collin Young drives to the basket... Collin Young throws a bad pass! Stolen by Tyrese Thompson! TURNOVER! (live ball)

[06:55] Team_008 possession (Score: 58-50)
Victor Leonard drives, Scottie Jackson stays with him. Victor Leonard attempts a Layup. Contested by Scottie Jackson (3.9 feet, ZONE). Victor Leonard misses. Offensive rebound by Tyrese Thompson! Tyrese Thompson kicks it out.

[06:43] Team_008 possession (Score: 58-50)
Tyrese Thompson attempts a Midrange. Contested by Scottie Jackson (3.8 feet, MAN). Tyrese Thompson misses. FOUL! Loose ball foul on Jarrett Tatum during the rebound battle. [Team fouls: 3] No free throws, side out. (Jarrett Tatum: 1 personal fouls)

[06:25] Team_008 possession (Score: 58-50)
Jrue Harris attempts a 3Pt. Contested by Giannis Middleton (4.1 feet, MAN). Jrue Harris misses. Rebound secured by Scottie Jackson.

[06:06] Team_037 possession (Score: 58-50)
Jarrett Tatum attempts a 3Pt. Contested by Khris Hyland (4.2 feet, MAN). Jarrett Tatum misses. Rebound secured by Tyrese Thompson.

[05:52] Team_008 possession (Score: 58-50)
Victor Leonard attempts a 3Pt. Contested by RJ Mitchell (4.9 feet, MAN). Victor Leonard misses. Rebound secured by Scottie Jackson.

[05:36] Team_037 possession (Score: 58-50)
FOUL! Shooting foul on Magic Young. Collin Young to the line for 2 free throws. [Team fouls: 2] (Magic Young: 1 personal fouls)   FT 1/2: MISS   FT 2/2: GOOD Collin Young makes 1/2 from the line.
Score: 58-51

[05:23] Team_008 possession (Score: 58-51)
Magic Young makes the Layup and draws the foul on Giannis Middleton! And-1! Magic Young to the line for 1. [Team fouls: 4] (Giannis Middleton: 1 personal fouls)   FT 1/1: MISS Magic Young makes 0/1 from the line. Rebound secured by Scottie Jackson.
Score: 60-51

[05:10] Team_037 possession (Score: 60-51)
Giannis Middleton attempts a Layup. BLOCKED BY JRUE HARRIS! Ball deflects out of bounds off Giannis Middleton.

[04:53] Team_008 possession (Score: 60-51)
Jrue Harris makes the Layup and draws the foul on Jarrett Tatum! And-1! Jrue Harris to the line for 1. [BONUS: 5 team fouls] (Jarrett Tatum: 2 personal fouls)   FT 1/1: GOOD Jrue Harris makes 1/1 from the line.
Score: 63-51

[04:39] Team_037 possession (Score: 63-51)
FOUL! Holding foul on Tyrese Thompson. [Team fouls: 3] No free throws, side out. (Tyrese Thompson: 1 personal fouls)

[04:22] Team_037 possession (Score: 63-51)
Jarrett Tatum attempts a 3Pt. Contested by Victor Leonard (5.3 feet, ZONE). Jarrett Tatum misses. Rebound secured by Magic Young.

[04:08] Team_008 possession (Score: 63-51)
Jrue Harris attempts a 3Pt. Contested by Giannis Middleton (4.2 feet, MAN). Jrue Harris misses. Rebound secured by Collin Young.

[03:54] Team_037 possession (Score: 63-51)
Jarrett Tatum attempts a Midrange. Contested by Tyrese Thompson (4.8 feet, ZONE). JARRETT TATUM MAKES IT!
Score: 63-53

[03:41] Team_008 possession (Score: 63-53)
Khris Hyland attempts a 3Pt. Contested by Scottie Jackson (3.8 feet, ZONE). Khris Hyland misses. Offensive rebound by Magic Young! Magic Young kicks it out.

[03:29] Team_008 possession (Score: 63-53)
Magic Young attempts a Layup. Contested by Scottie Jackson (4.1 feet, ZONE). MAGIC YOUNG MAKES IT! Assist: Jrue Harris
Score: 65-53

[03:14] Team_037 possession (Score: 65-53)
Collin Young drives, Magic Young stays with him. Collin Young attempts a Layup. Contested by Magic Young (5.2 feet, MAN). COLLIN YOUNG MAKES IT! Assist: RJ Mitchell
Score: 65-55

[02:59] Team_008 possession (Score: 65-55)
Tyrese Thompson attempts a Midrange. Contested by Scottie Jackson (3.9 feet, MAN). TYRESE THOMPSON MAKES IT!
Score: 67-55

[02:45] Team_037 possession (Score: 67-55)
Giannis Middleton loses the ball! Stripped by Jrue Harris! TURNOVER! (live ball)

[02:31] Team_008 possession (Score: 67-55)
Tyrese Thompson attempts a 3Pt. Contested by Scottie Jackson (3.9 feet, ZONE). Tyrese Thompson misses. Rebound secured by Scottie Jackson.

[02:16] Team_037 possession (Score: 67-55)
RJ Mitchell attempts a Midrange. Contested by Victor Leonard (5.5 feet, MAN). RJ MITCHELL MAKES IT!
Score: 67-57

[01:58] Team_008 possession (Score: 67-57)
Tyrese Thompson attempts a Layup. BLOCKED BY SCOTTIE JACKSON! Ball is loose! Rebound secured by Collin Young.

[01:45] Team_037 possession (Score: 67-57)
Scottie Jackson attempts a 3Pt. Contested by Tyrese Thompson (5.4 feet, MAN). Scottie Jackson misses. Offensive rebound by Scottie Jackson! Scottie Jackson puts it back in!
Score: 67-59

[01:28] Team_008 possession (Score: 67-59)
Tyrese Thompson attempts a 3Pt. Contested by Giannis Middleton (4.5 feet, ZONE). Tyrese Thompson misses. Rebound secured by Scottie Jackson.

[01:17] Team_037 possession (Score: 67-59)
FOUL! Holding foul on Jrue Harris. [Team fouls: 4] No free throws, side out. (Jrue Harris: 2 personal fouls)

[01:02] Team_037 possession (Score: 67-59)
Jarrett Tatum attempts a Layup. Contested by Khris Hyland (4.6 feet, MAN). JARRETT TATUM MAKES IT! Assist: Giannis Middleton
Score: 67-61

[00:45] Team_008 possession (Score: 67-61)
Jrue Harris attempts a Midrange. Contested by Giannis Middleton (4.5 feet, MAN). JRUE HARRIS MAKES IT!
Score: 69-61

[00:30] Team_037 possession (Score: 69-61)
Giannis Middleton makes the Dunk and draws the foul on Jrue Harris! And-1! Giannis Middleton to the line for 1. [BONUS: 5 team fouls] (Jrue Harris: 3 personal fouls)   FT 1/1: MISS Giannis Middleton makes 0/1 from the line. Offensive rebound by Collin Young! Collin Young puts it back in!
Score: 69-65

[00:13] Team_008 possession (Score: 69-65)
FOUL! Reach-in foul on Giannis Middleton during the drive. [IN THE BONUS! 6 team fouls] Jrue Harris to the line for 2 free throws. (Giannis Middleton: 2 personal fouls)   FT 1/2: GOOD   FT 2/2: GOOD Jrue Harris makes 2/2 from the line.
Score: 71-65

================================================================================
                              3RD QUARTER COMPLETE                              
================================================================================

3RD QUARTER SCORE: Team_008 25, Team_037 26

BOX SCORE:
================================================================================

Team_008
--------------------------------------------------------------------------------
Player                MIN  PTS  REB  AST  TO      FG   FG%      3P   3P%
--------------------------------------------------------------------------------
Khris Hyland           25    7    2    1   0   3/3   100.0     0/0   0.0
Jrue Harris            25    7    0    2   0   3/7    42.9     0/0   0.0
Magic Young            25    4    4    0   0   2/3    66.7     0/0   0.0
Victor Leonard         25    3    0    0   0   1/3    33.3     0/0   0.0
Tyrese Thompson        25    2    3    1   0   1/5    20.0     0/0   0.0

TEAM: FG: 10/21 (47.6%), 3PT: 2/10 (20.0%), REB: 9 (3 off, 6 def), AST: 4, TO: 1
TEAM FOULS: 5 [Team_037 in BONUS]


Team_037
--------------------------------------------------------------------------------
Player                MIN  PTS  REB  AST  TO      FG   FG%      3P   3P%
--------------------------------------------------------------------------------
Collin Young           25   16    3    0   0   7/7   100.0     0/0   0.0
Jarrett Tatum          25    4    1    0   0   2/4    50.0     0/0   0.0
RJ Mitchell            25    2    0    1   0   1/3    33.3     0/0   0.0
Scottie Jackson        25    2    8    2   0   1/2    50.0     0/0   0.0
Giannis Middleton      25    2    0    1   0   1/3    33.3     0/0   0.0

TEAM: FG: 12/19 (63.2%), 3PT: 1/5 (20.0%), REB: 12 (1 off, 11 def), AST: 4, TO: 2
TEAM FOULS: 6 [Team_008 in BONUS]

================================================================================

================================================================================
                       4TH QUARTER - Team_008 vs Team_037                       
================================================================================

[12:00] Substitution (Team_008): Victor Leonard OUT → Blake Holiday IN (stamina_rule2)

[12:00] Substitution (Team_008): Jrue Harris OUT → Chris Griffin IN (stamina_rule2)

[12:00] Substitution (Team_008): Khris Hyland OUT → Immanuel Young IN (stamina_rule2)

[12:00] Substitution (Team_008): Tyrese Thompson OUT → Khris Giddey IN (stamina_rule2)

[12:00] Substitution (Team_008): Magic Young OUT → Lamelo Middleton IN (stamina_rule2)

[12:00] Substitution (Team_037): RJ Mitchell OUT → Jarrett Randle IN (stamina_rule2)

[12:00] Substitution (Team_037): Jarrett Tatum OUT → Julius Bird IN (stamina_rule2)

[12:00] Substitution (Team_037): Collin Young OUT → Wendell Herro IN (stamina_rule2)

[12:00] Team_008 possession (Score: 71-65)
Jrue Harris drives to the basket... Jrue Harris loses control! Ball rolls out of bounds! TURNOVER! (dead ball)

[11:49] Team_037 possession (Score: 71-65)
Julius Bird attempts a Midrange. Contested by Immanuel Young (4.7 feet, MAN). JULIUS BIRD MAKES IT!
Score: 71-67

[11:32] Team_008 possession (Score: 71-67)
Chris Griffin attempts a 3Pt. Contested by Giannis Middleton (4.6 feet, ZONE). Chris Griffin misses. Rebound secured by Scottie Jackson.

[11:16] Team_037 possession (Score: 71-67)
FOUL! Shooting foul on Lamelo Middleton. Wendell Herro to the line for 3 free throws. [Team fouls: 1] (Lamelo Middleton: 1 personal fouls)   FT 1/3: GOOD   FT 2/3: GOOD   FT 3/3: GOOD Wendell Herro makes 3/3 from the line.
Score: 71-70

[11:04] Team_008 possession (Score: 71-70)
Blake Holiday loses control! Ball rolls out of bounds! TURNOVER! (dead ball)

[11:04] Substitution (Team_037): Giannis Middleton OUT → Collin Trent IN (stamina_rule2)

[11:04] Substitution (Team_037): Scottie Jackson OUT → Russell Anthony IN (stamina_rule2)

[10:51] Team_037 possession (Score: 71-70)
Julius Bird attempts a 3Pt. Contested by Khris Giddey (4.7 feet, ZONE). Julius Bird misses. Rebound secured by Khris Giddey.

[10:37] Team_008 possession (Score: 71-70)
Blake Holiday attempts a Midrange. Contested by Jarrett Randle (4.0 feet, MAN). Blake Holiday misses. Rebound secured by Wendell Herro.

[10:22] Team_037 possession (Score: 71-70)
Collin Trent attempts a 3Pt. Contested by Chris Griffin (5.6 feet, MAN). Collin Trent misses. Offensive rebound by Julius Bird! Julius Bird kicks it out.

[10:06] Team_037 possession (Score: 71-70)
Jarrett Randle attempts a 3Pt. Contested by Blake Holiday (5.5 feet, MAN). Jarrett Randle misses. Rebound secured by Lamelo Middleton.

[09:51] Team_008 possession (Score: 71-70)
FOUL! Shooting foul on Julius Bird. Immanuel Young to the line for 3 free throws. [Team fouls: 1] (Julius Bird: 1 personal fouls)   FT 1/3: MISS   FT 2/3: GOOD   FT 3/3: MISS Immanuel Young makes 1/3 from the line. Offensive rebound by Khris Giddey! Khris Giddey kicks it out.
Score: 72-70

[09:38] Team_008 possession (Score: 72-70)
Blake Holiday attempts a 3Pt. Contested by Jarrett Randle (4.0 feet, ZONE). BLAKE HOLIDAY MAKES IT! Assist: Lamelo Middleton
Score: 75-70

[09:23] Team_037 possession (Score: 75-70)
Wendell Herro drives, Lamelo Middleton stays with him. Wendell Herro attempts a Layup. Contested by Lamelo Middleton (4.6 feet, MAN). WENDELL HERRO MAKES IT!
Score: 75-72

[09:05] Team_008 possession (Score: 75-72)
Khris Giddey makes the Layup and draws the foul on Russell Anthony! And-1! Khris Giddey to the line for 1. [Team fouls: 2] (Russell Anthony: 1 personal fouls)   FT 1/1: GOOD Khris Giddey makes 1/1 from the line.
Score: 78-72

[08:47] Team_037 possession (Score: 78-72)
Wendell Herro attempts a Midrange. Contested by Khris Giddey (4.6 feet, ZONE). Wendell Herro misses. Rebound secured by Lamelo Middleton.

[08:30] Team_008 possession (Score: 78-72)
Immanuel Young drives, Russell Anthony stays with him. Immanuel Young attempts a Dunk. Contested by Russell Anthony (4.2 feet, ZONE). Immanuel Young misses. Rebound secured by Russell Anthony.

[08:18] Team_037 possession (Score: 78-72)
Russell Anthony drives, Khris Giddey stays with him. Russell Anthony attempts a Layup. Contested by Khris Giddey (4.6 feet, MAN). RUSSELL ANTHONY MAKES IT! Assist: Collin Trent
Score: 78-74

[08:04] Team_008 possession (Score: 78-74)
FOUL! Reach-in foul on Russell Anthony during the drive. [Team fouls: 3] No free throws, side out. (Russell Anthony: 2 personal fouls)

[07:49] Team_008 possession (Score: 78-74)
Blake Holiday attempts a Midrange. Contested by Jarrett Randle (4.0 feet, MAN). Blake Holiday misses. Rebound secured by Russell Anthony.

[07:35] Team_037 possession (Score: 78-74)
Russell Anthony drives, Lamelo Middleton stays with him. Russell Anthony attempts a Dunk. Contested by Lamelo Middleton (4.6 feet, ZONE). RUSSELL ANTHONY MAKES IT! Assist: Jarrett Randle
Score: 78-76

[07:19] Team_008 possession (Score: 78-76)
Chris Griffin makes the Layup and draws the foul on Russell Anthony! And-1! Chris Griffin to the line for 1. [Team fouls: 4] (Russell Anthony: 3 personal fouls)   FT 1/1: GOOD Chris Griffin makes 1/1 from the line.
Score: 81-76

[07:04] Team_037 possession (Score: 81-76)
Collin Trent makes the Midrange and draws the foul on Chris Griffin! And-1! Collin Trent to the line for 1. [Team fouls: 2] (Chris Griffin: 1 personal fouls)   FT 1/1: GOOD Collin Trent makes 1/1 from the line.
Score: 81-79

[06:46] Team_008 possession (Score: 81-79)
Chris Griffin attempts a 3Pt. Contested by Julius Bird (4.7 feet, ZONE). Chris Griffin misses. Offensive rebound by Lamelo Middleton! Lamelo Middleton puts it back in!
Score: 83-79

[06:32] Team_037 possession (Score: 83-79)
Julius Bird attempts a Midrange. Contested by Khris Giddey (4.7 feet, ZONE). Julius Bird misses. Rebound secured by Khris Giddey.

[06:22] Team_008 possession (Score: 83-79)
FOUL! Holding foul on Jarrett Randle. [IN THE BONUS! 5 team fouls] Blake Holiday to the line for 2 free throws. (Jarrett Randle: 1 personal fouls)   FT 1/2: GOOD   FT 2/2: GOOD Blake Holiday makes 2/2 from the line.
Score: 85-79

[06:08] Team_037 possession (Score: 85-79)
Jarrett Randle attempts a 3Pt. Contested by Chris Griffin (5.4 feet, ZONE). Jarrett Randle misses. Offensive rebound by Julius Bird! Julius Bird kicks it out.

[05:51] Team_037 possession (Score: 85-79)
Jarrett Randle attempts a 3Pt. Contested by Khris Giddey (4.4 feet, ZONE). JARRETT RANDLE MAKES IT! Assist: Wendell Herro
Score: 85-82

[05:34] Team_008 possession (Score: 85-82)
Immanuel Young attempts a Layup. Contested by Julius Bird (4.9 feet, MAN). IMMANUEL YOUNG MAKES IT! Assist: Blake Holiday
Score: 87-82

[05:20] Team_037 possession (Score: 87-82)
Collin Trent attempts a Midrange. Contested by Chris Griffin (5.6 feet, MAN). Collin Trent misses. Rebound secured by Chris Griffin.

[05:04] Team_008 possession (Score: 87-82)
Lamelo Middleton attempts a 3Pt. Contested by Russell Anthony (4.1 feet, MAN). LAMELO MIDDLETON MAKES IT! Assist: Chris Griffin
Score: 90-82

[04:48] Team_037 possession (Score: 90-82)
Collin Trent attempts a Midrange. Contested by Chris Griffin (5.6 feet, MAN). COLLIN TRENT MAKES IT!
Score: 90-84

[04:34] Team_008 possession (Score: 90-84)
Chris Griffin attempts a Layup. Contested by Collin Trent (6.0 feet, MAN). CHRIS GRIFFIN MAKES IT! Assist: Lamelo Middleton
Score: 92-84

[04:16] Team_037 possession (Score: 92-84)
Collin Trent makes the 3Pt and draws the foul on Chris Griffin! And-1! Collin Trent to the line for 1. [Team fouls: 3] (Chris Griffin: 2 personal fouls)   FT 1/1: GOOD Collin Trent makes 1/1 from the line.
Score: 92-88

[04:02] Team_008 possession (Score: 92-88)
Lamelo Middleton attempts a Midrange. Contested by Julius Bird (4.7 feet, ZONE). Lamelo Middleton misses. Rebound secured by Julius Bird.

[03:45] Team_037 possession (Score: 92-88)
Julius Bird attempts a 3Pt. Contested by Khris Giddey (4.7 feet, ZONE). Julius Bird misses. Rebound secured by Chris Griffin.

[03:36] Team_008 possession (Score: 92-88)
Lamelo Middleton drives and kicks out. Blake Holiday attempts a 3Pt. Contested by Jarrett Randle (3.9 feet, MAN). Blake Holiday misses. Rebound secured by Russell Anthony.

[03:23] Team_037 possession (Score: 92-88)
Russell Anthony attempts a Layup. Contested by Khris Giddey (4.7 feet, MAN). Russell Anthony misses. Rebound secured by Chris Griffin.

[03:13] Team_008 possession (Score: 92-88)
Khris Giddey attempts a Midrange. Contested by Russell Anthony (3.7 feet, MAN). Khris Giddey misses. Rebound secured by Wendell Herro.

[02:56] Team_037 possession (Score: 92-88)
FOUL! Shooting foul on Lamelo Middleton. Wendell Herro to the line for 2 free throws. [Team fouls: 4] (Lamelo Middleton: 2 personal fouls)   FT 1/2: MISS   FT 2/2: GOOD Wendell Herro makes 1/2 from the line.
Score: 92-89

[02:43] Team_008 possession (Score: 92-89)
FOUL! Reach-in foul on Collin Trent during the drive. [IN THE BONUS! 6 team fouls] Chris Griffin to the line for 2 free throws. (Collin Trent: 1 personal fouls)   FT 1/2: MISS   FT 2/2: GOOD Chris Griffin makes 1/2 from the line.
Score: 93-89

[02:29] Team_037 possession (Score: 93-89)
FOUL! Shooting foul on Khris Giddey. Jarrett Randle to the line for 2 free throws. [BONUS: 5 team fouls] (Khris Giddey: 1 personal fouls)   FT 1/2: GOOD   FT 2/2: GOOD Jarrett Randle makes 2/2 from the line.
Score: 93-91

[02:17] Team_008 possession (Score: 93-91)
Blake Holiday attempts a Midrange. Contested by Jarrett Randle (4.2 feet, MAN). Blake Holiday misses. Rebound secured by Julius Bird.

[01:59] Team_037 possession (Score: 93-91)
Julius Bird drives and kicks out. Jarrett Randle makes the Midrange and draws the foul on Blake Holiday! And-1! Jarrett Randle to the line for 1. [BONUS: 6 team fouls] (Blake Holiday: 1 personal fouls)   FT 1/1: GOOD Jarrett Randle makes 1/1 from the line.
Score: 93-94

[01:47] Team_008 possession (Score: 93-94)
Immanuel Young attempts a 3Pt. Contested by Julius Bird (5.1 feet, MAN). Immanuel Young misses. FOUL! Loose ball foul on Wendell Herro during the rebound battle. [IN THE BONUS! 7 team fouls] Khris Giddey to the line for 2 free throws. (Wendell Herro: 1 personal fouls)   FT 1/2: GOOD   FT 2/2: GOOD Khris Giddey makes 2/2 from the line.
Score: 95-94

[01:31] Team_037 possession (Score: 95-94)
Julius Bird attempts a 3Pt. Contested by Immanuel Young (5.0 feet, MAN). JULIUS BIRD MAKES IT! Assist: Collin Trent
Score: 95-97

[01:13] Team_008 possession (Score: 95-97)
FOUL! Offensive foul on Khris Giddey! Russell Anthony drew the charge! [Team fouls: 7] (Khris Giddey: 2 personal fouls) TURNOVER! (dead ball)

[00:55] Team_037 possession (Score: 95-97)
Jarrett Randle drives to the basket... Jarrett Randle loses control! Ball rolls out of bounds! TURNOVER! (dead ball)

[00:39] Team_008 possession (Score: 95-97)
FOUL! Shooting foul on Collin Trent. Khris Giddey to the line for 2 free throws. [BONUS: 8 team fouls] (Collin Trent: 2 personal fouls)   FT 1/2: GOOD   FT 2/2: GOOD Khris Giddey makes 2/2 from the line.
Score: 97-97

[00:22] Team_037 possession (Score: 97-97)
Collin Trent attempts a 3Pt. Contested by Chris Griffin (6.0 feet, MAN). Collin Trent misses. Offensive rebound by Julius Bird! Julius Bird kicks it out.

[00:03] Team_037 possession (Score: 97-97)
Julius Bird attempts a 3Pt. Contested by Khris Giddey (5.1 feet, ZONE). JULIUS BIRD MAKES IT! Assist: Wendell Herro
Score: 97-100

================================================================================
                              4TH QUARTER COMPLETE                              
================================================================================

4TH QUARTER SCORE: Team_008 26, Team_037 35

BOX SCORE:
================================================================================

Team_008
--------------------------------------------------------------------------------
Player                MIN  PTS  REB  AST  TO      FG   FG%      3P   3P%
--------------------------------------------------------------------------------
Khris Giddey           23    7    3    0   0   3/4    75.0     0/0   0.0
Chris Griffin          23    6    3    1   0   3/4    75.0     0/0   0.0
Blake Holiday          23    5    0    1   0   2/5    40.0     0/0   0.0
Lamelo Middleton       23    5    3    2   0   2/4    50.0     0/0   0.0
Immanuel Young         23    2    0    0   0   1/2    50.0     0/0   0.0

TEAM: FG: 11/19 (57.9%), 3PT: 4/5 (80.0%), REB: 9 (2 off, 7 def), AST: 4, TO: 3
TEAM FOULS: 7 [Team_037 in BONUS]


Team_037
--------------------------------------------------------------------------------
Player                MIN  PTS  REB  AST  TO      FG   FG%      3P   3P%
--------------------------------------------------------------------------------
Collin Trent           22    9    0    2   0   3/4    75.0     0/0   0.0
Julius Bird            23    8    5    0   0   3/6    50.0     0/0   0.0
Jarrett Randle         23    8    0    1   0   3/4    75.0     0/0   0.0
Wendell Herro          23    6    2    2   0   3/4    75.0     0/0   0.0
Russell Anthony        22    4    3    0   0   2/3    66.7     0/0   0.0
Scottie Jackson        26    0    1    0   0   0/0     0.0     0/0   0.0

TEAM: FG: 14/21 (66.7%), 3PT: 5/8 (62.5%), REB: 11 (3 off, 8 def), AST: 5, TO: 1
TEAM FOULS: 8 [Team_008 in BONUS]

================================================================================

================================================================================
                               FULL GAME COMPLETE                               
================================================================================

FINAL SCORE: Team_008 97, Team_037 100

SCORING BY QUARTER:
--------------------------------------------------------------------------------
Team                     Q1     Q2     Q3     Q4    FINAL
--------------------------------------------------------------------------------
Team_008                 24     22     25     26       97
Team_037                 19     20     26     35      100
--------------------------------------------------------------------------------

FULL GAME BOX SCORE:
================================================================================

Team_008
--------------------------------------------------------------------------------
Player                MIN  PTS  REB  AST  TO      FG   FG%      3P   3P%      FT STL BLK
--------------------------------------------------------------------------------
Victor Leonard         25    9    0    2   1   3/7    42.9   2/5    40.0   3/4     0   0
Jrue Harris            25   16    0    3   0   6/13   46.2   1/8    12.5   3/3     1   1
Khris Hyland           25   16    5    2   1   5/7    71.4   2/3    66.7   4/5     0   0
Tyrese Thompson        25    5    8    2   0   4/10   40.0   0/3     0.0   1/2     1   0
Magic Young            25    4    8    1   1   3/6    50.0   0/2     0.0   0/1     0   1
Blake Holiday          23    5    0    1   2   1/6    16.7   1/2    50.0   3/4     0   0
Chris Griffin          23   10    5    2   0   5/7    71.4   1/2    50.0   4/5     1   0
Immanuel Young         23    2    0    1   2   2/4    50.0   1/1   100.0   2/5     0   0
Khris Giddey           23   13    5    0   1   5/8    62.5   1/1   100.0   7/8     0   0
Lamelo Middleton       23   11   11    3   0   3/8    37.5   1/1   100.0   0/0     0   0

TEAM: FG: 41/82 (50.0%), 3PT: 10/28 (35.7%), REB: 44 (11 off, 33 def), AST: 17, TO: 8


Team_037
--------------------------------------------------------------------------------
Player                MIN  PTS  REB  AST  TO      FG   FG%      3P   3P%      FT STL BLK
--------------------------------------------------------------------------------
Giannis Middleton      26    6    0    1   3   3/8    37.5   1/3    33.3   1/2     0   0
Scottie Jackson        26    9   14    2   2   4/7    57.1   2/3    66.7   0/0     1   1
RJ Mitchell            25    3    0    1   0   2/6    33.3   0/3     0.0   1/2     0   0
Jarrett Tatum          25    9    5    0   1   5/8    62.5   0/3     0.0   1/1     0   0
Collin Young           25   20   10    2   0   7/11   63.6   0/0     0.0   2/4     0   0
Jarrett Randle         23    8    0    1   1   3/5    60.0   1/3    33.3   3/3     0   0
Julius Bird            23   13    9    0   2   6/13   46.2   3/6    50.0   0/0     1   0
Wendell Herro          23    8    6    2   1   7/9    77.8   1/1   100.0   5/7     0   0
Collin Trent           22   11    0    2   2   3/5    60.0   1/1   100.0   2/2     0   0
Russell Anthony        22   10   11    2   0   2/4    50.0   0/1     0.0   0/0     1   1

TEAM: FG: 42/76 (55.3%), 3PT: 9/24 (37.5%), REB: 52 (14 off, 38 def), AST: 13, TO: 12

================================================================================
