================================================================================
                        FULL GAME - Team_057 vs Team_069                        
================================================================================

================================================================================
                       1ST QUARTER - Team_057 vs Team_069                       
================================================================================

[12:00] Team_057 possession (Score: 0-0)
Anfernee Adebayo attempts a 3Pt. Contested by James Sexton (3.8 feet, ZONE). Anfernee Adebayo misses. Rebound secured by Domantas Towns.

[11:43] Team_069 possession (Score: 0-0)
CJ Fox makes the Layup and draws the foul on Miles Middleton! And-1! CJ Fox to the line for 1. [Team fouls: 1] (Miles Middleton: 1 personal fouls)   FT 1/1: MISS CJ Fox makes 0/1 from the line. Offensive rebound by Domantas Towns! Domantas Towns kicks it out.
Score: 0-2

[11:28] Team_069 possession (Score: 0-2)
CJ Fox attempts a Layup. Contested by Miles Middleton (4.6 feet, ZONE). CJ FOX MAKES IT!
Score: 0-4

[11:14] Team_057 possession (Score: 0-4)
Ben Adebayo attempts a Layup. Contested by Domantas Towns (5.1 feet, MAN). BEN ADEBAYO MAKES IT!
Score: 2-4

[11:03] Team_069 possession (Score: 2-4)
Domantas Lowry attempts a Midrange. Contested by Anfernee Adebayo (4.8 feet, ZONE). DOMANTAS LOWRY MAKES IT! Assist: Pau Middleton
Score: 2-6

[10:46] Team_057 possession (Score: 2-6)
Miles Middleton drives and kicks out. Kobe Ming attempts a Midrange. Contested by Pau Middleton (3.9 feet, ZONE). Kobe Ming misses. Rebound secured by Domantas Towns.

[10:30] Team_069 possession (Score: 2-6)
CJ Fox attempts a Layup. BLOCKED BY MILES MIDDLETON! Ball is loose! Rebound secured by Anfernee Adebayo.

[10:13] Team_057 possession (Score: 2-6)
Miles Middleton makes the Layup and draws the foul on James Sexton! And-1! Miles Middleton to the line for 1. [Team fouls: 1] (James Sexton: 1 personal fouls)   FT 1/1: MISS Miles Middleton makes 0/1 from the line. Rebound secured by CJ Fox.
Score: 4-6

[10:01] Team_069 possession (Score: 4-6)
FOUL! Shooting foul on Ben Adebayo. Domantas Towns to the line for 2 free throws. [Team fouls: 2] (Ben Adebayo: 1 personal fouls)   FT 1/2: GOOD   FT 2/2: MISS Domantas Towns makes 1/2 from the line. Rebound secured by Anfernee Adebayo.
Score: 4-7

[09:45] Team_057 possession (Score: 4-7)
Miles Middleton drives to the basket... Miles Middleton loses the ball! Stripped by Domantas Towns! TURNOVER! (live ball)

[09:28] Team_069 possession (Score: 4-7)
James Sexton attempts a 3Pt. Contested by Kobe Ming (5.1 feet, ZONE). JAMES SEXTON MAKES IT! Assist: Pau Middleton
Score: 4-10

[09:10] Team_057 possession (Score: 4-10)
Anfernee Adebayo attempts a Midrange. Contested by Domantas Towns (5.0 feet, ZONE). ANFERNEE ADEBAYO MAKES IT!
Score: 6-10

[08:52] Team_069 possession (Score: 6-10)
Domantas Towns drives and kicks out. Domantas Lowry attempts a Midrange. Contested by Klay Rozier (3.6 feet, MAN). DOMANTAS LOWRY MAKES IT!
Score: 6-12

[08:37] Team_057 possession (Score: 6-12)
Klay Rozier loses the ball! Stripped by Domantas Lowry! TURNOVER! (live ball)

[08:22] Team_069 possession (Score: 6-12)
CJ Fox throws a bad pass out of bounds! TURNOVER! (dead ball)

[08:07] Team_057 possession (Score: 6-12)
Miles Middleton attempts a 3Pt. Contested by CJ Fox (5.2 feet, MAN). Miles Middleton misses. Rebound secured by Pau Middleton.

[07:54] Team_069 possession (Score: 6-12)
FOUL! Reach-in foul on Ben Adebayo during the drive. [Team fouls: 3] No free throws, side out. (Ben Adebayo: 2 personal fouls)

[07:39] Team_069 possession (Score: 6-12)
Pau Middleton drives to the basket... FOUL! Offensive foul on Pau Middleton! Anfernee Adebayo drew the charge! [Team fouls: 2] (Pau Middleton: 1 personal fouls) TURNOVER! (dead ball)

[07:22] Team_057 possession (Score: 6-12)
Anfernee Adebayo drives, Pau Middleton stays with him. Anfernee Adebayo attempts a Dunk. Contested by Pau Middleton (4.4 feet, MAN). Anfernee Adebayo misses. Rebound secured by Pau Middleton.

[07:05] Team_069 possession (Score: 6-12)
James Sexton attempts a 3Pt. Contested by Kobe Ming (5.1 feet, MAN). James Sexton misses. Rebound secured by Miles Middleton.

[06:51] Team_057 possession (Score: 6-12)
Anfernee Adebayo attempts a Layup. Contested by Pau Middleton (4.4 feet, MAN). ANFERNEE ADEBAYO MAKES IT!
Score: 8-12

[06:37] Team_069 possession (Score: 8-12)
FOUL! Offensive foul on Domantas Towns! Ben Adebayo drew the charge! [Team fouls: 3] (Domantas Towns: 1 personal fouls) TURNOVER! (dead ball)

[06:19] Team_057 possession (Score: 8-12)
Kobe Ming drives, picks up Domantas Towns. Help arrives from James Sexton! Kobe Ming attempts a Layup. Contested by James Sexton (4.8 feet, ZONE). KOBE MING MAKES IT! Assist: Miles Middleton
Score: 10-12

[06:09] Team_069 possession (Score: 10-12)
Pau Middleton attempts a 3Pt. Contested by Kobe Ming (4.7 feet, ZONE). PAU MIDDLETON MAKES IT! Assist: James Sexton
Score: 10-15

[05:50] Team_057 possession (Score: 10-15)
Kobe Ming drives, picks up Domantas Towns. Help arrives from James Sexton! Kobe Ming attempts a Layup. Contested by James Sexton (4.8 feet, ZONE). KOBE MING MAKES IT! Assist: Anfernee Adebayo
Score: 12-15

[05:35] Team_069 possession (Score: 12-15)
CJ Fox drives to the basket... CJ Fox throws a bad pass out of bounds! TURNOVER! (dead ball)

[05:23] Team_057 possession (Score: 12-15)
Kobe Ming attempts a 3Pt. Contested by James Sexton (3.6 feet, ZONE). Kobe Ming misses. Offensive rebound by Ben Adebayo! Ben Adebayo kicks it out.

[05:08] Team_057 possession (Score: 12-15)
Klay Rozier attempts a 3Pt. Contested by Domantas Lowry (4.5 feet, MAN). Klay Rozier misses. Rebound secured by Pau Middleton.

[04:55] Team_069 possession (Score: 12-15)
Domantas Towns drives, Ben Adebayo stays with him. Domantas Towns attempts a Dunk. Contested by Ben Adebayo (4.7 feet, ZONE). DOMANTAS TOWNS MAKES IT!
Score: 12-17

[04:36] Team_057 possession (Score: 12-17)
FOUL! Reach-in foul on Pau Middleton during the drive. [Team fouls: 4] No free throws, side out. (Pau Middleton: 2 personal fouls)

[04:22] Team_057 possession (Score: 12-17)
Miles Middleton drives, Domantas Towns stays with him. Miles Middleton attempts a Layup. Contested by Domantas Towns (4.5 feet, ZONE). MILES MIDDLETON MAKES IT!
Score: 14-17

[04:06] Team_069 possession (Score: 14-17)
FOUL! Shooting foul on Ben Adebayo. Domantas Towns to the line for 3 free throws. [Team fouls: 4] (Ben Adebayo: 3 personal fouls)   FT 1/3: GOOD   FT 2/3: MISS   FT 3/3: GOOD Domantas Towns makes 2/3 from the line.
Score: 14-19

[03:52] Team_057 possession (Score: 14-19)
Kobe Ming attempts a Midrange. Contested by Domantas Towns (5.0 feet, ZONE). Kobe Ming misses. Rebound secured by Pau Middleton.

[03:38] Team_069 possession (Score: 14-19)
Pau Middleton attempts a 3Pt. Contested by Anfernee Adebayo (5.2 feet, ZONE). Pau Middleton misses. Rebound secured by Anfernee Adebayo.

[03:22] Team_057 possession (Score: 14-19)
Anfernee Adebayo attempts a 3Pt. Contested by Pau Middleton (4.6 feet, MAN). Anfernee Adebayo misses. Rebound secured by Pau Middleton.

[03:03] Team_069 possession (Score: 14-19)
Domantas Towns attempts a Midrange. Contested by Ben Adebayo (4.8 feet, MAN). DOMANTAS TOWNS MAKES IT! Assist: Pau Middleton
Score: 14-21

[02:48] Team_057 possession (Score: 14-21)
Ben Adebayo attempts a 3Pt. Contested by Domantas Towns (5.3 feet, MAN). Ben Adebayo misses. Rebound secured by Pau Middleton.

[02:31] Team_069 possession (Score: 14-21)
Pau Middleton attempts a Midrange. Contested by Anfernee Adebayo (5.3 feet, MAN). PAU MIDDLETON MAKES IT! Assist: CJ Fox
Score: 14-23

[02:17] Team_057 possession (Score: 14-23)
Ben Adebayo drives and kicks out. Klay Rozier attempts a 3Pt. Contested by James Sexton (3.6 feet, ZONE). Klay Rozier misses. Rebound secured by Domantas Towns.

[02:01] Team_069 possession (Score: 14-23)
FOUL! Shooting foul on Miles Middleton. Domantas Towns to the line for 2 free throws. [BONUS: 5 team fouls] (Miles Middleton: 2 personal fouls)   FT 1/2: GOOD   FT 2/2: GOOD Domantas Towns makes 2/2 from the line.
Score: 14-25

[01:47] Team_057 possession (Score: 14-25)
FOUL! Reach-in foul on Pau Middleton during the drive. [IN THE BONUS! 5 team fouls] Anfernee Adebayo to the line for 2 free throws. (Pau Middleton: 3 personal fouls)   FT 1/2: GOOD   FT 2/2: GOOD Anfernee Adebayo makes 2/2 from the line.
Score: 16-25

[01:32] Team_069 possession (Score: 16-25)
CJ Fox attempts a 3Pt. Contested by Kobe Ming (4.9 feet, ZONE). CJ Fox misses. Rebound secured by Miles Middleton.

[01:18] Team_057 possession (Score: 16-25)
Klay Rozier attempts a 3Pt. Contested by Domantas Lowry (4.8 feet, MAN). Klay Rozier misses. Rebound secured by Pau Middleton.

[01:03] Team_069 possession (Score: 16-25)
Domantas Lowry attempts a Layup. BLOCKED BY BEN ADEBAYO! Ball is loose! Offensive rebound by Domantas Towns! Domantas Towns kicks it out.

[00:51] Team_069 possession (Score: 16-25)
Domantas Towns drives, Ben Adebayo stays with him. Domantas Towns attempts a Layup. Contested by Ben Adebayo (5.0 feet, MAN). Domantas Towns misses. Rebound secured by Anfernee Adebayo.

[00:38] Team_057 possession (Score: 16-25)
Miles Middleton drives and kicks out. Anfernee Adebayo attempts a 3Pt. Contested by Pau Middleton (4.5 feet, MAN). Anfernee Adebayo misses. Rebound secured by Domantas Towns.

[00:21] Team_069 possession (Score: 16-25)
CJ Fox makes the Layup and draws the foul on Miles Middleton! And-1! CJ Fox to the line for 1. [BONUS: 6 team fouls] (Miles Middleton: 3 personal fouls)   FT 1/1: GOOD CJ Fox makes 1/1 from the line.
Score: 16-28

[00:02] Team_057 possession (Score: 16-28)
FOUL! Shooting foul on Domantas Towns. Kobe Ming to the line for 2 free throws. [BONUS: 6 team fouls] (Domantas Towns: 2 personal fouls)   FT 1/2: GOOD   FT 2/2: GOOD Kobe Ming makes 2/2 from the line.
Score: 18-28

================================================================================
                              1ST QUARTER COMPLETE                              
================================================================================

1ST QUARTER SCORE: Team_057 18, Team_069 28

BOX SCORE:
================================================================================

Team_057
--------------------------------------------------------------------------------
Player                MIN  PTS  REB  AST  TO      FG   FG%      3P   3P%
--------------------------------------------------------------------------------
Anfernee Adebayo       12    6    4    1   0   3/6    50.0     0/0   0.0
Kobe Ming              12    6    0    0   0   3/4    75.0     0/0   0.0
Ben Adebayo            12    2    1    0   0   1/3    33.3     0/0   0.0
Miles Middleton        12    2    2    1   0   1/5    20.0     0/0   0.0
Klay Rozier            12    0    0    0   0   0/2     0.0     0/0   0.0

TEAM: FG: 8/20 (40.0%), 3PT: 0/6 (0.0%), REB: 7 (1 off, 6 def), AST: 2, TO: 2
TEAM FOULS: 6 [Team_069 in BONUS]


Team_069
--------------------------------------------------------------------------------
Player                MIN  PTS  REB  AST  TO      FG   FG%      3P   3P%
--------------------------------------------------------------------------------
Domantas Towns         12    8    6    0   0   4/6    66.7     0/0   0.0
CJ Fox                 12    5    1    1   0   2/4    50.0     0/0   0.0
Pau Middleton          12    5    7    3   0   2/3    66.7     0/0   0.0
Domantas Lowry         12    4    0    0   0   2/2   100.0     0/0   0.0
James Sexton           12    3    0    1   0   1/2    50.0     0/0   0.0

TEAM: FG: 11/17 (64.7%), 3PT: 3/6 (50.0%), REB: 14 (2 off, 12 def), AST: 5, TO: 4
TEAM FOULS: 6 [Team_057 in BONUS]

================================================================================

================================================================================
                       2ND QUARTER - Team_057 vs Team_069                       
================================================================================

[12:00] Substitution (Team_057): Kobe Ming OUT → Scottie Johnson IN (stamina_rule2)

[12:00] Substitution (Team_057): Klay Rozier OUT → Bradley Ginobili IN (stamina_rule2)

[12:00] Substitution (Team_057): Anfernee Adebayo OUT → Joel Wade IN (stamina_rule2)

[12:00] Substitution (Team_057): Ben Adebayo OUT → Lamelo Irving IN (stamina_rule2)

[12:00] Substitution (Team_057): Miles Middleton OUT → Zion Lillard IN (stamina_rule2)

[12:00] Substitution (Team_069): James Sexton OUT → Jarrett Murray IN (stamina_rule2)

[12:00] Substitution (Team_069): Pau Middleton OUT → Tyrese Simons IN (stamina_rule2)

[12:00] Substitution (Team_069): Domantas Towns OUT → Devin Giddey IN (stamina_rule2)

[12:00] Substitution (Team_069): CJ Fox OUT → Shai Quickley IN (stamina_rule2)

[12:00] Team_057 possession (Score: 18-28)
Ben Adebayo throws a bad pass out of bounds! TURNOVER! (dead ball)

[11:46] Team_069 possession (Score: 18-28)
Tyrese Simons attempts a 3Pt. Contested by Scottie Johnson (5.2 feet, ZONE). Tyrese Simons misses. Rebound secured by Lamelo Irving.

[11:32] Team_057 possession (Score: 18-28)
Joel Wade throws a bad pass! Stolen by Tyrese Simons! TURNOVER! (live ball)

[11:21] Team_069 possession (Score: 18-28)
Shai Quickley attempts a Layup. Contested by Zion Lillard (3.9 feet, MAN). Shai Quickley misses. Rebound secured by Zion Lillard.

[11:10] Team_057 possession (Score: 18-28)
Joel Wade drives, picks up Tyrese Simons. Help arrives from Domantas Lowry! Joel Wade attempts a Dunk. Contested by Domantas Lowry (5.1 feet, MAN). JOEL WADE MAKES IT! Assist: Bradley Ginobili
Score: 20-28

[10:53] Team_069 possession (Score: 20-28)
Tyrese Simons attempts a 3Pt. Contested by Scottie Johnson (5.2 feet, ZONE). Tyrese Simons misses. Rebound secured by Joel Wade.

[10:36] Team_057 possession (Score: 20-28)
Lamelo Irving attempts a 3Pt. Contested by Tyrese Simons (5.9 feet, ZONE). Lamelo Irving misses. Rebound secured by Tyrese Simons.

[10:27] Team_069 possession (Score: 20-28)
Tyrese Simons attempts a 3Pt. Contested by Scottie Johnson (5.2 feet, ZONE). Tyrese Simons misses. Rebound secured by Lamelo Irving.

[10:09] Team_057 possession (Score: 20-28)
Scottie Johnson drives to the basket... FOUL! Offensive foul on Scottie Johnson! Jarrett Murray drew the charge! [Team fouls: 1] (Scottie Johnson: 1 personal fouls) TURNOVER! (dead ball)

[09:50] Team_069 possession (Score: 20-28)
Jarrett Murray drives, Lamelo Irving stays with him. Jarrett Murray attempts a Layup. Contested by Lamelo Irving (5.1 feet, ZONE). JARRETT MURRAY MAKES IT! Assist: Domantas Lowry
Score: 20-30

[09:36] Team_057 possession (Score: 20-30)
Bradley Ginobili attempts a 3Pt. Contested by Tyrese Simons (5.5 feet, ZONE). BRADLEY GINOBILI MAKES IT! Assist: Zion Lillard
Score: 23-30

[09:23] Team_069 possession (Score: 23-30)
Devin Giddey drives, picks up Lamelo Irving. Help arrives from Bradley Ginobili! Devin Giddey attempts a Dunk. Contested by Bradley Ginobili (4.7 feet, MAN). DEVIN GIDDEY MAKES IT! Assist: Jarrett Murray
Score: 23-32

[09:07] Team_057 possession (Score: 23-32)
Bradley Ginobili attempts a Midrange. Contested by Domantas Lowry (5.2 feet, MAN). BRADLEY GINOBILI MAKES IT! Assist: Joel Wade
Score: 25-32

[08:54] Team_069 possession (Score: 25-32)
FOUL! Shooting foul on Lamelo Irving. Devin Giddey to the line for 2 free throws. [Team fouls: 2] (Lamelo Irving: 1 personal fouls)   FT 1/2: GOOD   FT 2/2: GOOD Devin Giddey makes 2/2 from the line.
Score: 25-34

[08:37] Team_057 possession (Score: 25-34)
Bradley Ginobili attempts a 3Pt. Contested by Domantas Lowry (5.3 feet, MAN). BRADLEY GINOBILI MAKES IT! Assist: Lamelo Irving
Score: 28-34

[08:25] Team_069 possession (Score: 28-34)
Shai Quickley drives, Lamelo Irving stays with him. Shai Quickley attempts a Dunk. Contested by Lamelo Irving (5.1 feet, ZONE). Shai Quickley misses. Rebound secured by Lamelo Irving.

[08:12] Team_057 possession (Score: 28-34)
Zion Lillard drives, Shai Quickley stays with him. Zion Lillard attempts a Layup. Contested by Shai Quickley (4.4 feet, MAN). ZION LILLARD MAKES IT! Assist: Bradley Ginobili
Score: 30-34

[07:56] Team_069 possession (Score: 30-34)
Shai Quickley drives and kicks out. Tyrese Simons attempts a 3Pt. Contested by Scottie Johnson (4.8 feet, ZONE). TYRESE SIMONS MAKES IT!
Score: 30-37

[07:41] Team_057 possession (Score: 30-37)
Joel Wade attempts a 3Pt. Contested by Tyrese Simons (5.1 feet, ZONE). Joel Wade misses. FOUL! Loose ball foul on Devin Giddey during the rebound battle. [Team fouls: 1] No free throws, side out. (Devin Giddey: 1 personal fouls)

[07:25] Team_057 possession (Score: 30-37)
Scottie Johnson attempts a 3Pt. Contested by Tyrese Simons (5.4 feet, ZONE). Scottie Johnson misses. Rebound secured by Tyrese Simons.

[07:14] Team_069 possession (Score: 30-37)
FOUL! Holding foul on Joel Wade. [Team fouls: 3] No free throws, side out. (Joel Wade: 1 personal fouls)

[06:59] Team_069 possession (Score: 30-37)
Devin Giddey attempts a 3Pt. Contested by Scottie Johnson (4.7 feet, ZONE). Devin Giddey misses. Rebound secured by Lamelo Irving.

[06:44] Team_057 possession (Score: 30-37)
Bradley Ginobili loses control! Ball rolls out of bounds! TURNOVER! (dead ball)

[06:44] Substitution (Team_069): Domantas Lowry OUT → Trae Antetokounmpo IN (stamina_rule2)

[06:29] Team_069 possession (Score: 30-37)
FOUL! Reach-in foul on Zion Lillard during the drive. [Team fouls: 4] No free throws, side out. (Zion Lillard: 1 personal fouls)

[06:13] Team_069 possession (Score: 30-37)
Devin Giddey attempts a Midrange. Contested by Lamelo Irving (4.7 feet, ZONE). Devin Giddey misses. FOUL! Loose ball foul on Zion Lillard during the rebound battle. [IN THE BONUS! 5 team fouls] Shai Quickley to the line for 2 free throws. (Zion Lillard: 2 personal fouls)   FT 1/2: GOOD   FT 2/2: GOOD Shai Quickley makes 2/2 from the line.
Score: 30-39

[06:00] Team_057 possession (Score: 30-39)
FOUL! Reach-in foul on Devin Giddey during the drive. [Team fouls: 2] No free throws, side out. (Devin Giddey: 2 personal fouls)

[05:43] Team_057 possession (Score: 30-39)
Bradley Ginobili attempts a Layup. Contested by Trae Antetokounmpo (5.8 feet, MAN). BRADLEY GINOBILI MAKES IT! Assist: Zion Lillard
Score: 32-39

[05:28] Team_069 possession (Score: 32-39)
FOUL! Shooting foul on Lamelo Irving. Trae Antetokounmpo to the line for 2 free throws. [BONUS: 6 team fouls] (Lamelo Irving: 2 personal fouls)   FT 1/2: GOOD   FT 2/2: GOOD Trae Antetokounmpo makes 2/2 from the line.
Score: 32-41

[05:17] Team_057 possession (Score: 32-41)
Scottie Johnson attempts a 3Pt. Contested by Tyrese Simons (5.4 feet, ZONE). Scottie Johnson misses. Offensive rebound by Lamelo Irving! Lamelo Irving kicks it out.

[05:02] Team_057 possession (Score: 32-41)
Lamelo Irving attempts a Layup. Contested by Devin Giddey (5.9 feet, MAN). Lamelo Irving misses. Offensive rebound by Lamelo Irving! Lamelo Irving kicks it out.

[04:49] Team_057 possession (Score: 32-41)
Joel Wade attempts a 3Pt. Contested by Tyrese Simons (5.1 feet, ZONE). JOEL WADE MAKES IT! Assist: Scottie Johnson
Score: 35-41

[04:33] Team_069 possession (Score: 35-41)
Jarrett Murray drives to the basket... Jarrett Murray throws a bad pass out of bounds! TURNOVER! (dead ball)

[04:17] Team_057 possession (Score: 35-41)
Scottie Johnson attempts a 3Pt. Contested by Tyrese Simons (5.5 feet, ZONE). Scottie Johnson misses. Rebound secured by Shai Quickley.

[04:03] Team_069 possession (Score: 35-41)
Devin Giddey attempts a Midrange. Contested by Bradley Ginobili (4.8 feet, ZONE). Devin Giddey misses. Rebound secured by Joel Wade.

[03:44] Team_057 possession (Score: 35-41)
Scottie Johnson attempts a 3Pt. Contested by Tyrese Simons (5.5 feet, ZONE). Scottie Johnson misses. Offensive rebound by Zion Lillard! Zion Lillard's putback is no good. Rebound secured by Trae Antetokounmpo.

[03:29] Team_069 possession (Score: 35-41)
Tyrese Simons attempts a 3Pt. Contested by Lamelo Irving (5.3 feet, ZONE). Tyrese Simons misses. Rebound secured by Joel Wade.

[03:15] Team_057 possession (Score: 35-41)
Zion Lillard throws a bad pass! Stolen by Shai Quickley! TURNOVER! (live ball)

[03:00] Team_069 possession (Score: 35-41)
Tyrese Simons attempts a 3Pt. Contested by Joel Wade (5.9 feet, MAN). Tyrese Simons misses. FOUL! Loose ball foul on Joel Wade during the rebound battle. [IN THE BONUS! 7 team fouls] Tyrese Simons to the line for 2 free throws. (Joel Wade: 2 personal fouls)   FT 1/2: GOOD   FT 2/2: GOOD Tyrese Simons makes 2/2 from the line.
Score: 35-43

[02:47] Team_057 possession (Score: 35-43)
Bradley Ginobili attempts a Midrange. Contested by Devin Giddey (5.8 feet, ZONE). Bradley Ginobili misses. Rebound secured by Tyrese Simons.

[02:29] Team_069 possession (Score: 35-43)
Trae Antetokounmpo attempts a 3Pt. Contested by Bradley Ginobili (5.3 feet, MAN). Trae Antetokounmpo misses. Rebound secured by Lamelo Irving.

[02:14] Team_057 possession (Score: 35-43)
Zion Lillard throws a bad pass out of bounds! TURNOVER! (dead ball)

[01:55] Team_069 possession (Score: 35-43)
Tyrese Simons drives and kicks out. Tyrese Simons attempts a 3Pt. Contested by Joel Wade (5.6 feet, MAN). Tyrese Simons misses. Rebound secured by Joel Wade.

[01:45] Team_057 possession (Score: 35-43)
Lamelo Irving commits a violation (traveling/carry)! TURNOVER! (dead ball)

[01:32] Team_069 possession (Score: 35-43)
FOUL! Holding foul on Lamelo Irving. [IN THE BONUS! 8 team fouls] Devin Giddey to the line for 2 free throws. (Lamelo Irving: 3 personal fouls)   FT 1/2: MISS   FT 2/2: GOOD Devin Giddey makes 1/2 from the line.
Score: 35-44

[01:14] Team_057 possession (Score: 35-44)
Joel Wade drives and kicks out. Scottie Johnson attempts a Midrange. Contested by Jarrett Murray (5.6 feet, MAN). Scottie Johnson misses. Rebound secured by Shai Quickley.

[00:56] Team_069 possession (Score: 35-44)
Tyrese Simons commits a violation (traveling/carry)! TURNOVER! (dead ball)

[00:39] Team_057 possession (Score: 35-44)
Zion Lillard drives and kicks out. Bradley Ginobili attempts a 3Pt. Contested by Tyrese Simons (5.6 feet, ZONE). Bradley Ginobili misses. Rebound secured by Trae Antetokounmpo.

[00:25] Team_069 possession (Score: 35-44)
Jarrett Murray attempts a 3Pt. Contested by Scottie Johnson (5.6 feet, ZONE). Jarrett Murray misses. Offensive rebound by Tyrese Simons! Tyrese Simons kicks it out.

[00:14] Team_069 possession (Score: 35-44)
Shai Quickley drives, Lamelo Irving stays with him. Shai Quickley attempts a Layup. Contested by Lamelo Irving (5.6 feet, ZONE). SHAI QUICKLEY MAKES IT!
Score: 35-46

[00:02] Team_057 possession (Score: 35-46)
Zion Lillard drives and kicks out. Scottie Johnson attempts a Midrange. Contested by Devin Giddey (5.8 feet, ZONE). Scottie Johnson misses. Rebound secured by Shai Quickley.

================================================================================
                              2ND QUARTER COMPLETE                              
================================================================================

2ND QUARTER SCORE: Team_057 17, Team_069 18

BOX SCORE:
================================================================================

Team_057
--------------------------------------------------------------------------------
Player                MIN  PTS  REB  AST  TO      FG   FG%      3P   3P%
--------------------------------------------------------------------------------
Bradley Ginobili       12   10    0    2   0   4/5    80.0     0/0   0.0
Joel Wade              12    5    4    1   0   2/3    66.7     0/0   0.0
Zion Lillard           12    2    1    2   0   1/3    33.3     0/0   0.0
Lamelo Irving          12    0    8    1   0   0/1     0.0     0/0   0.0
Scottie Johnson        12    0    0    1   0   0/3     0.0     0/0   0.0

TEAM: FG: 7/15 (46.7%), 3PT: 3/7 (42.9%), REB: 14 (4 off, 10 def), AST: 7, TO: 7
TEAM FOULS: 8 [Team_069 in BONUS]


Team_069
--------------------------------------------------------------------------------
Player                MIN  PTS  REB  AST  TO      FG   FG%      3P   3P%
--------------------------------------------------------------------------------
Tyrese Simons          12    5    4    0   0   2/7    28.6     0/0   0.0
Devin Giddey           12    5    0    0   0   3/5    60.0     0/0   0.0
Shai Quickley          12    4    3    0   0   2/4    50.0     0/0   0.0
Jarrett Murray         12    2    0    1   0   1/1   100.0     0/0   0.0
Trae Antetokounmpo      7    2    2    0   0   1/2    50.0     0/0   0.0
Domantas Lowry         18    0    0    1   0   0/0     0.0     0/0   0.0

TEAM: FG: 9/19 (47.4%), 3PT: 1/7 (14.3%), REB: 8 (1 off, 7 def), AST: 2, TO: 2
TEAM FOULS: 2

================================================================================

================================================================================
                       3RD QUARTER - Team_057 vs Team_069                       
================================================================================

[12:00] Team_057 possession (Score: 35-46)
Ben Adebayo attempts a Midrange. Contested by Domantas Towns (5.1 feet, ZONE). Ben Adebayo misses. Rebound secured by Pau Middleton.

[11:46] Team_069 possession (Score: 35-46)
Domantas Lowry attempts a 3Pt. Contested by Kobe Ming (4.4 feet, ZONE). DOMANTAS LOWRY MAKES IT! Assist: CJ Fox
Score: 35-49

[11:30] Team_057 possession (Score: 35-49)
FOUL! Shooting foul on Pau Middleton. Kobe Ming to the line for 2 free throws. [Team fouls: 1] (Pau Middleton: 1 personal fouls)   FT 1/2: GOOD   FT 2/2: GOOD Kobe Ming makes 2/2 from the line.
Score: 37-49

[11:16] Team_069 possession (Score: 37-49)
Pau Middleton attempts a 3Pt. Contested by Kobe Ming (4.7 feet, ZONE). Pau Middleton misses. FOUL! Loose ball foul on Ben Adebayo during the rebound battle. [Team fouls: 1] No free throws, side out. (Ben Adebayo: 1 personal fouls)

[11:05] Team_069 possession (Score: 37-49)
James Sexton attempts a 3Pt. Contested by Kobe Ming (5.1 feet, MAN). James Sexton misses. Rebound secured by Ben Adebayo.

[10:54] Team_057 possession (Score: 37-49)
Kobe Ming attempts a Layup. Contested by James Sexton (3.6 feet, MAN). Kobe Ming misses. Rebound secured by Domantas Towns.

[10:39] Team_069 possession (Score: 37-49)
Pau Middleton attempts a 3Pt. Contested by Anfernee Adebayo (5.1 feet, MAN). Pau Middleton misses. Offensive rebound by Domantas Towns! Domantas Towns kicks it out.

[10:25] Team_069 possession (Score: 37-49)
Domantas Lowry attempts a Midrange. Contested by Ben Adebayo (4.4 feet, ZONE). Domantas Lowry misses. Rebound secured by Anfernee Adebayo.

[10:06] Team_057 possession (Score: 37-49)
FOUL! Reach-in foul on Domantas Lowry during the drive. [Team fouls: 2] No free throws, side out. (Domantas Lowry: 1 personal fouls)

[09:50] Team_057 possession (Score: 37-49)
Kobe Ming attempts a Layup. BLOCKED BY JAMES SEXTON! Ball is loose! Offensive rebound by Ben Adebayo! Ben Adebayo kicks it out.

[09:37] Team_057 possession (Score: 37-49)
Klay Rozier attempts a Midrange. Contested by Domantas Lowry (4.5 feet, MAN). Klay Rozier misses. Rebound secured by CJ Fox.

[09:22] Team_069 possession (Score: 37-49)
FOUL! Shooting foul on Ben Adebayo. Domantas Towns to the line for 2 free throws. [Team fouls: 2] (Ben Adebayo: 2 personal fouls)   FT 1/2: MISS   FT 2/2: GOOD Domantas Towns makes 1/2 from the line.
Score: 37-50

[09:04] Team_057 possession (Score: 37-50)
Ben Adebayo makes the Midrange and draws the foul on Domantas Towns! And-1! Ben Adebayo to the line for 1. [Team fouls: 3] (Domantas Towns: 1 personal fouls)   FT 1/1: MISS Ben Adebayo makes 0/1 from the line. FOUL! Loose ball foul on CJ Fox during the free throw rebound! [Team fouls: 4] No free throws, side out. (CJ Fox: 1 personal fouls)
Score: 39-50

[08:48] Team_057 possession (Score: 39-50)
Klay Rozier attempts a Midrange. Contested by Domantas Lowry (4.5 feet, ZONE). Klay Rozier misses. Rebound secured by Pau Middleton.

[08:33] Team_069 possession (Score: 39-50)
Domantas Lowry drives, Klay Rozier stays with him. Domantas Lowry attempts a Dunk. Contested by Klay Rozier (3.6 feet, MAN). Domantas Lowry misses. Offensive rebound by Domantas Towns! Domantas Towns kicks it out.

[08:21] Team_069 possession (Score: 39-50)
Domantas Lowry drives, picks up Miles Middleton. Help arrives from Klay Rozier! Domantas Lowry attempts a Dunk. Contested by Klay Rozier (4.4 feet, ZONE). DOMANTAS LOWRY MAKES IT! Assist: Pau Middleton
Score: 39-52

[08:02] Team_057 possession (Score: 39-52)
FOUL! Shooting foul on CJ Fox. Miles Middleton to the line for 3 free throws. [BONUS: 5 team fouls] (CJ Fox: 2 personal fouls)   FT 1/3: GOOD   FT 2/3: GOOD   FT 3/3: MISS Miles Middleton makes 2/3 from the line. Rebound secured by CJ Fox.
Score: 41-52

[07:49] Team_069 possession (Score: 41-52)
CJ Fox attempts a Midrange. Contested by Miles Middleton (4.6 feet, MAN). CJ Fox misses. Offensive rebound by Pau Middleton! Pau Middleton kicks it out.

[07:38] Team_069 possession (Score: 41-52)
Domantas Towns attempts a 3Pt. Contested by Ben Adebayo (4.7 feet, ZONE). Domantas Towns misses. Rebound secured by Anfernee Adebayo.

[07:25] Team_057 possession (Score: 41-52)
Kobe Ming drives and kicks out. Kobe Ming attempts a 3Pt. Contested by James Sexton (3.3 feet, MAN). Kobe Ming misses. Offensive rebound by Miles Middleton! Miles Middleton kicks it out.

[07:08] Team_057 possession (Score: 41-52)
FOUL! Shooting foul on Domantas Towns. Kobe Ming to the line for 2 free throws. [BONUS: 6 team fouls] (Domantas Towns: 2 personal fouls)   FT 1/2: GOOD   FT 2/2: GOOD Kobe Ming makes 2/2 from the line.
Score: 43-52

[06:50] Team_069 possession (Score: 43-52)
Domantas Lowry makes the Layup and draws the foul on Klay Rozier! And-1! Domantas Lowry to the line for 1. [Team fouls: 3] (Klay Rozier: 1 personal fouls)   FT 1/1: GOOD Domantas Lowry makes 1/1 from the line.
Score: 43-55

[06:33] Team_057 possession (Score: 43-55)
Kobe Ming drives and kicks out. Klay Rozier attempts a Midrange. Contested by Domantas Lowry (4.3 feet, MAN). Klay Rozier misses. Offensive rebound by Miles Middleton! Miles Middleton kicks it out.

[06:16] Team_057 possession (Score: 43-55)
FOUL! Reach-in foul on CJ Fox during the drive. [IN THE BONUS! 7 team fouls] Ben Adebayo to the line for 2 free throws. (CJ Fox: 3 personal fouls)   FT 1/2: GOOD   FT 2/2: GOOD Ben Adebayo makes 2/2 from the line.
Score: 45-55

[05:58] Team_069 possession (Score: 45-55)
CJ Fox drives, Ben Adebayo stays with him. CJ Fox attempts a Layup. Contested by Ben Adebayo (4.7 feet, ZONE). CJ FOX MAKES IT! Assist: Pau Middleton
Score: 45-57

[05:40] Team_057 possession (Score: 45-57)
Ben Adebayo attempts a Midrange. Contested by Pau Middleton (4.4 feet, ZONE). BEN ADEBAYO MAKES IT!
Score: 47-57

[05:29] Team_069 possession (Score: 47-57)
Domantas Towns attempts a 3Pt. Contested by Kobe Ming (4.7 feet, ZONE). Domantas Towns misses. Offensive rebound by CJ Fox! CJ Fox kicks it out.

[05:10] Team_069 possession (Score: 47-57)
Domantas Towns attempts a Midrange. Contested by Anfernee Adebayo (5.1 feet, ZONE). DOMANTAS TOWNS MAKES IT! Assist: James Sexton
Score: 47-59

[04:55] Team_057 possession (Score: 47-59)
Anfernee Adebayo makes the Layup and draws the foul on Pau Middleton! And-1! Anfernee Adebayo to the line for 1. [BONUS: 8 team fouls] (Pau Middleton: 2 personal fouls)   FT 1/1: GOOD Anfernee Adebayo makes 1/1 from the line.
Score: 50-59

[04:40] Team_069 possession (Score: 50-59)
CJ Fox drives and kicks out. FOUL! Shooting foul on Miles Middleton. CJ Fox to the line for 2 free throws. [Team fouls: 4] (Miles Middleton: 1 personal fouls)   FT 1/2: MISS   FT 2/2: GOOD CJ Fox makes 1/2 from the line.
Score: 50-60

[04:27] Team_057 possession (Score: 50-60)
Miles Middleton attempts a 3Pt. Contested by James Sexton (3.3 feet, ZONE). Miles Middleton misses. Rebound secured by CJ Fox.

[04:10] Team_069 possession (Score: 50-60)
James Sexton attempts a Layup. Contested by Kobe Ming (5.1 feet, MAN). JAMES SEXTON MAKES IT! Assist: Domantas Towns
Score: 50-62

[04:01] Team_057 possession (Score: 50-62)
Anfernee Adebayo loses the ball! Stripped by Pau Middleton! TURNOVER! (live ball)

[03:44] Team_069 possession (Score: 50-62)
Pau Middleton attempts a 3Pt. Contested by Anfernee Adebayo (5.2 feet, MAN). Pau Middleton misses. Rebound secured by Ben Adebayo.

[03:35] Team_057 possession (Score: 50-62)
Klay Rozier attempts a Midrange. Contested by Domantas Lowry (4.6 feet, MAN). Klay Rozier misses. Offensive rebound by Miles Middleton! Miles Middleton kicks it out.

[03:18] Team_057 possession (Score: 50-62)
Miles Middleton attempts a Layup. Contested by CJ Fox (5.3 feet, ZONE). MILES MIDDLETON MAKES IT! Assist: Anfernee Adebayo
Score: 52-62

[03:03] Team_069 possession (Score: 52-62)
Domantas Towns makes the Midrange and draws the foul on Ben Adebayo! And-1! Domantas Towns to the line for 1. [BONUS: 5 team fouls] (Ben Adebayo: 3 personal fouls)   FT 1/1: GOOD Domantas Towns makes 1/1 from the line.
Score: 52-65

[02:47] Team_057 possession (Score: 52-65)
FOUL! Shooting foul on Domantas Towns. Kobe Ming to the line for 3 free throws. [BONUS: 9 team fouls] (Domantas Towns: 3 personal fouls)   FT 1/3: MISS   FT 2/3: MISS   FT 3/3: GOOD Kobe Ming makes 1/3 from the line.
Score: 53-65

[02:28] Team_069 possession (Score: 53-65)
Pau Middleton attempts a 3Pt. Contested by Anfernee Adebayo (5.3 feet, MAN). Pau Middleton misses. FOUL! Loose ball foul on Ben Adebayo during the rebound battle. [IN THE BONUS! 6 team fouls] Domantas Towns to the line for 2 free throws. (Ben Adebayo: 4 personal fouls)   FT 1/2: GOOD   FT 2/2: GOOD Domantas Towns makes 2/2 from the line.
Score: 53-67

[02:10] Team_057 possession (Score: 53-67)
Anfernee Adebayo attempts a 3Pt. Contested by Pau Middleton (4.7 feet, MAN). Anfernee Adebayo misses. Rebound secured by Pau Middleton.

[01:59] Team_069 possession (Score: 53-67)
Domantas Lowry attempts a Midrange. Contested by Klay Rozier (3.9 feet, MAN). Domantas Lowry misses. Rebound secured by Miles Middleton.

[01:40] Team_057 possession (Score: 53-67)
Anfernee Adebayo attempts a 3Pt. Contested by James Sexton (4.1 feet, ZONE). ANFERNEE ADEBAYO MAKES IT! Assist: Miles Middleton
Score: 56-67

[01:24] Team_069 possession (Score: 56-67)
FOUL! Holding foul on Ben Adebayo. [IN THE BONUS! 7 team fouls] Domantas Towns to the line for 2 free throws. (Ben Adebayo: 5 personal fouls)   FT 1/2: GOOD   FT 2/2: GOOD Domantas Towns makes 2/2 from the line.
Score: 56-69

[01:13] Team_057 possession (Score: 56-69)
Ben Adebayo drives, picks up Domantas Towns. Help arrives from James Sexton! Ben Adebayo attempts a Dunk. Contested by James Sexton (5.5 feet, ZONE). BEN ADEBAYO MAKES IT!
Score: 58-69

[01:01] Team_069 possession (Score: 58-69)
Domantas Lowry drives, Klay Rozier stays with him. Domantas Lowry attempts a Layup. Contested by Klay Rozier (4.0 feet, MAN). DOMANTAS LOWRY MAKES IT!
Score: 58-71

[00:45] Team_057 possession (Score: 58-71)
Anfernee Adebayo makes the Layup and draws the foul on Pau Middleton! And-1! Anfernee Adebayo to the line for 1. [BONUS: 10 team fouls] (Pau Middleton: 3 personal fouls)   FT 1/1: GOOD Anfernee Adebayo makes 1/1 from the line.
Score: 61-71

[00:32] Team_069 possession (Score: 61-71)
Domantas Lowry attempts a 3Pt. Contested by Klay Rozier (4.0 feet, MAN). Domantas Lowry misses. Rebound secured by Ben Adebayo.

[00:18] Team_057 possession (Score: 61-71)
FOUL! Shooting foul on Pau Middleton. Anfernee Adebayo to the line for 3 free throws. [BONUS: 11 team fouls] (Pau Middleton: 4 personal fouls)   FT 1/3: GOOD   FT 2/3: MISS   FT 3/3: GOOD Anfernee Adebayo makes 2/3 from the line.
Score: 63-71

[00:03] Team_069 possession (Score: 63-71)
FOUL! Shooting foul on Anfernee Adebayo. Pau Middleton to the line for 2 free throws. [BONUS: 8 team fouls] (Anfernee Adebayo: 1 personal fouls)   FT 1/2: GOOD   FT 2/2: MISS Pau Middleton makes 1/2 from the line. FOUL! Loose ball foul on Anfernee Adebayo during the free throw rebound! [IN THE BONUS! 9 team fouls] Domantas Towns to the line for 2 free throws. (Anfernee Adebayo: 2 personal fouls)   FT 1/2: MISS   FT 2/2: MISS Domantas Towns makes 0/2 from the line. Offensive rebound by CJ Fox! CJ Fox kicks it out.
Score: 63-72

================================================================================
                              3RD QUARTER COMPLETE                              
================================================================================

3RD QUARTER SCORE: Team_057 28, Team_069 26

BOX SCORE:
================================================================================

Team_057
--------------------------------------------------------------------------------
Player                MIN  PTS  REB  AST  TO      FG   FG%      3P   3P%
--------------------------------------------------------------------------------
Anfernee Adebayo       25   11    2    1   0   4/5    80.0     0/0   0.0
Ben Adebayo            25    6    4    0   0   3/4    75.0     0/0   0.0
Kobe Ming              25    5    0    0   0   3/4    75.0     0/0   0.0
Miles Middleton        25    2    5    1   0   1/3    33.3     0/0   0.0
Klay Rozier            25    0    0    0   0   0/2     0.0     0/0   0.0

TEAM: FG: 11/18 (61.1%), 3PT: 3/6 (50.0%), REB: 11 (5 off, 6 def), AST: 2, TO: 1
TEAM FOULS: 9 [Team_069 in BONUS]


Team_069
--------------------------------------------------------------------------------
Player                MIN  PTS  REB  AST  TO      FG   FG%      3P   3P%
--------------------------------------------------------------------------------
Domantas Lowry         30   10    0    0   0   4/7    57.1     0/0   0.0
Domantas Towns         25   10    4    1   0   5/6    83.3     0/0   0.0
CJ Fox                 25    3    5    1   0   2/2   100.0     0/0   0.0
James Sexton           25    2    0    1   0   1/2    50.0     0/0   0.0
Pau Middleton          25    0    4    2   0   0/1     0.0     0/0   0.0

TEAM: FG: 12/18 (66.7%), 3PT: 2/6 (33.3%), REB: 13 (6 off, 7 def), AST: 5, TO: 0
TEAM FOULS: 11 [Team_057 in BONUS]

================================================================================

================================================================================
                       4TH QUARTER - Team_057 vs Team_069                       
================================================================================

[12:00] Team_057 possession (Score: 63-72)
Kobe Ming attempts a 3Pt. Contested by James Sexton (3.9 feet, MAN). Kobe Ming misses. Rebound secured by Pau Middleton.

[11:46] Team_069 possession (Score: 63-72)
Domantas Towns attempts a Midrange. Contested by Ben Adebayo (4.9 feet, MAN). DOMANTAS TOWNS MAKES IT!
Score: 63-74

[11:29] Team_057 possession (Score: 63-74)
Klay Rozier attempts a 3Pt. Contested by James Sexton (3.9 feet, ZONE). Klay Rozier misses. Offensive rebound by Miles Middleton! Miles Middleton kicks it out.

[11:14] Team_057 possession (Score: 63-74)
Miles Middleton attempts a 3Pt. Contested by James Sexton (3.6 feet, ZONE). Miles Middleton misses. FOUL! Loose ball foul on CJ Fox during the rebound battle. [Team fouls: 1] No free throws, side out. (CJ Fox: 1 personal fouls)

[11:00] Team_057 possession (Score: 63-74)
FOUL! Shooting foul on James Sexton. Ben Adebayo to the line for 3 free throws. [Team fouls: 2] (James Sexton: 1 personal fouls)   FT 1/3: MISS   FT 2/3: GOOD   FT 3/3: GOOD Ben Adebayo makes 2/3 from the line.
Score: 65-74

[10:47] Team_069 possession (Score: 65-74)
FOUL! Shooting foul on Ben Adebayo. Domantas Towns to the line for 2 free throws. [Team fouls: 1] (Ben Adebayo: 1 personal fouls)   FT 1/2: GOOD   FT 2/2: GOOD Domantas Towns makes 2/2 from the line.
Score: 65-76

[10:32] Team_057 possession (Score: 65-76)
Klay Rozier drives and kicks out. Ben Adebayo attempts a 3Pt. Contested by Domantas Towns (5.2 feet, MAN). Ben Adebayo misses. Rebound secured by Domantas Towns.

[10:19] Team_069 possession (Score: 65-76)
CJ Fox drives to the basket... CJ Fox throws a bad pass! Stolen by Miles Middleton! TURNOVER! (live ball)

[10:03] Team_057 possession (Score: 65-76)
Klay Rozier attempts a 3Pt. Contested by James Sexton (4.0 feet, ZONE). Klay Rozier misses. Rebound secured by CJ Fox.

[09:52] Team_069 possession (Score: 65-76)
James Sexton attempts a Midrange. Contested by Kobe Ming (5.5 feet, MAN). James Sexton misses. FOUL! Loose ball foul on Ben Adebayo during the rebound battle. [Team fouls: 2] No free throws, side out. (Ben Adebayo: 2 personal fouls)

[09:36] Team_069 possession (Score: 65-76)
James Sexton drives, Kobe Ming stays with him. James Sexton attempts a Dunk. Contested by Kobe Ming (5.5 feet, MAN). JAMES SEXTON MAKES IT!
Score: 65-78

[09:22] Team_057 possession (Score: 65-78)
Ben Adebayo loses control! Ball rolls out of bounds! TURNOVER! (dead ball)

[09:22] Substitution (Team_057): Kobe Ming OUT → Scottie Johnson IN (stamina_rule2)

[09:22] Substitution (Team_057): Klay Rozier OUT → Bradley Ginobili IN (stamina_rule2)

[09:22] Substitution (Team_057): Anfernee Adebayo OUT → Joel Wade IN (stamina_rule2)

[09:22] Substitution (Team_057): Ben Adebayo OUT → Lamelo Irving IN (stamina_rule2)

[09:22] Substitution (Team_057): Miles Middleton OUT → Zion Lillard IN (stamina_rule2)

[09:22] Substitution (Team_069): James Sexton OUT → Jarrett Murray IN (stamina_rule2)

[09:22] Substitution (Team_069): Domantas Lowry OUT → Trae Antetokounmpo IN (stamina_rule2)

[09:22] Substitution (Team_069): Pau Middleton OUT → Tyrese Simons IN (stamina_rule2)

[09:22] Substitution (Team_069): Domantas Towns OUT → Devin Giddey IN (stamina_rule2)

[09:22] Substitution (Team_069): CJ Fox OUT → Shai Quickley IN (stamina_rule2)

[09:06] Team_069 possession (Score: 65-78)
Devin Giddey attempts a Midrange. Contested by Lamelo Irving (4.7 feet, MAN). DEVIN GIDDEY MAKES IT! Assist: Jarrett Murray
Score: 65-80

[08:52] Team_057 possession (Score: 65-80)
Scottie Johnson drives and kicks out. Zion Lillard attempts a 3Pt. Contested by Tyrese Simons (5.2 feet, ZONE). Zion Lillard misses. Offensive rebound by Zion Lillard! Zion Lillard puts it back in!
Score: 67-80

[08:39] Team_069 possession (Score: 67-80)
Devin Giddey throws a bad pass! Stolen by Lamelo Irving! TURNOVER! (live ball)

[08:23] Team_057 possession (Score: 67-80)
FOUL! Shooting foul on Devin Giddey. Scottie Johnson to the line for 2 free throws. [Team fouls: 3] (Devin Giddey: 1 personal fouls)   FT 1/2: GOOD   FT 2/2: GOOD Scottie Johnson makes 2/2 from the line.
Score: 69-80

[08:05] Team_069 possession (Score: 69-80)
FOUL! Shooting foul on Lamelo Irving. Devin Giddey to the line for 2 free throws. [Team fouls: 3] (Lamelo Irving: 1 personal fouls)   FT 1/2: GOOD   FT 2/2: GOOD Devin Giddey makes 2/2 from the line.
Score: 69-82

[07:53] Team_057 possession (Score: 69-82)
Scottie Johnson attempts a 3Pt. Contested by Devin Giddey (5.4 feet, ZONE). Scottie Johnson misses. Rebound secured by Tyrese Simons.

[07:37] Team_069 possession (Score: 69-82)
Shai Quickley attempts a 3Pt. Contested by Zion Lillard (3.9 feet, MAN). Shai Quickley misses. Rebound secured by Lamelo Irving.

[07:24] Team_057 possession (Score: 69-82)
Joel Wade attempts a Layup. Contested by Tyrese Simons (5.1 feet, MAN). JOEL WADE MAKES IT! Assist: Zion Lillard
Score: 71-82

[07:09] Team_069 possession (Score: 71-82)
Tyrese Simons throws a bad pass! Stolen by Joel Wade! TURNOVER! (live ball)

[06:54] Team_057 possession (Score: 71-82)
Joel Wade attempts a 3Pt. Contested by Tyrese Simons (5.1 feet, MAN). JOEL WADE MAKES IT! Assist: Bradley Ginobili
Score: 74-82

[06:44] Team_069 possession (Score: 74-82)
Jarrett Murray attempts a Midrange. Contested by Scottie Johnson (5.1 feet, MAN). Jarrett Murray misses. Rebound secured by Joel Wade.

[06:29] Team_057 possession (Score: 74-82)
Joel Wade attempts a Layup. Contested by Devin Giddey (5.1 feet, ZONE). JOEL WADE MAKES IT! Assist: Bradley Ginobili
Score: 76-82

[06:15] Team_069 possession (Score: 76-82)
Trae Antetokounmpo makes the Layup and draws the foul on Lamelo Irving! And-1! Trae Antetokounmpo to the line for 1. [Team fouls: 4] (Lamelo Irving: 2 personal fouls)   FT 1/1: GOOD Trae Antetokounmpo makes 1/1 from the line.
Score: 76-85

[05:58] Team_057 possession (Score: 76-85)
Zion Lillard drives to the basket... Zion Lillard throws a bad pass out of bounds! TURNOVER! (dead ball)

[05:44] Team_069 possession (Score: 76-85)
Tyrese Simons drives, Lamelo Irving stays with him. Tyrese Simons attempts a Dunk. Contested by Lamelo Irving (5.2 feet, ZONE). Tyrese Simons misses. Rebound secured by Joel Wade.

[05:31] Team_057 possession (Score: 76-85)
Zion Lillard attempts a 3Pt. Contested by Tyrese Simons (5.5 feet, ZONE). Zion Lillard misses. Rebound secured by Trae Antetokounmpo.

[05:19] Team_069 possession (Score: 76-85)
Devin Giddey attempts a 3Pt. Contested by Lamelo Irving (4.7 feet, MAN). DEVIN GIDDEY MAKES IT! Assist: Tyrese Simons
Score: 76-88

[05:04] Team_057 possession (Score: 76-88)
Joel Wade drives, picks up Tyrese Simons. Help arrives from Trae Antetokounmpo! Joel Wade attempts a Dunk. Contested by Trae Antetokounmpo (5.1 feet, MAN). JOEL WADE MAKES IT! Assist: Zion Lillard
Score: 78-88

[04:53] Team_069 possession (Score: 78-88)
Tyrese Simons drives, Joel Wade stays with him. Tyrese Simons attempts a Dunk. Contested by Joel Wade (5.7 feet, MAN). TYRESE SIMONS MAKES IT!
Score: 78-90

[04:38] Team_057 possession (Score: 78-90)
Bradley Ginobili throws a bad pass! Stolen by Trae Antetokounmpo! TURNOVER! (live ball)

[04:24] Team_069 possession (Score: 78-90)
Tyrese Simons attempts a 3Pt. Contested by Joel Wade (5.7 feet, MAN). Tyrese Simons misses. Rebound secured by Joel Wade.

[04:09] Team_057 possession (Score: 78-90)
Lamelo Irving attempts a Midrange. Contested by Tyrese Simons (5.9 feet, ZONE). Lamelo Irving misses. Rebound secured by Shai Quickley.

[03:56] Team_069 possession (Score: 78-90)
Trae Antetokounmpo drives and kicks out. Tyrese Simons attempts a 3Pt. Contested by Scottie Johnson (4.8 feet, ZONE). Tyrese Simons misses. Rebound secured by Zion Lillard.

[03:41] Team_057 possession (Score: 78-90)
Zion Lillard attempts a Midrange. Contested by Shai Quickley (4.4 feet, MAN). ZION LILLARD MAKES IT! Assist: Lamelo Irving
Score: 80-90

[03:25] Team_069 possession (Score: 80-90)
Trae Antetokounmpo attempts a Layup. BLOCKED BY JOEL WADE! Ball deflects out of bounds off Trae Antetokounmpo.

[03:09] Team_057 possession (Score: 80-90)
FOUL! Shooting foul on Tyrese Simons. Scottie Johnson to the line for 2 free throws. [Team fouls: 4] (Tyrese Simons: 1 personal fouls)   FT 1/2: GOOD   FT 2/2: GOOD Scottie Johnson makes 2/2 from the line.
Score: 82-90

[02:52] Team_069 possession (Score: 82-90)
Jarrett Murray attempts a Layup. Contested by Scottie Johnson (5.1 feet, MAN). JARRETT MURRAY MAKES IT! Assist: Tyrese Simons
Score: 82-92

[02:38] Team_057 possession (Score: 82-92)
Lamelo Irving attempts a Midrange. Wide open! Trae Antetokounmpo is 6.2 feet away. [ZONE] LAMELO IRVING MAKES IT!
Score: 84-92

[02:21] Team_069 possession (Score: 84-92)
Devin Giddey drives and kicks out. Shai Quickley attempts a 3Pt. Contested by Zion Lillard (3.6 feet, MAN). Shai Quickley misses. Rebound secured by Lamelo Irving.

[02:04] Team_057 possession (Score: 84-92)
Lamelo Irving attempts a Midrange. Contested by Tyrese Simons (5.9 feet, ZONE). LAMELO IRVING MAKES IT! Assist: Zion Lillard
Score: 86-92

[01:53] Team_069 possession (Score: 86-92)
Shai Quickley attempts a Layup. Contested by Zion Lillard (3.9 feet, MAN). SHAI QUICKLEY MAKES IT!
Score: 86-94

[01:34] Team_057 possession (Score: 86-94)
Bradley Ginobili attempts a Layup. Contested by Trae Antetokounmpo (5.9 feet, MAN). BRADLEY GINOBILI MAKES IT! Assist: Joel Wade
Score: 88-94

[01:18] Team_069 possession (Score: 88-94)
FOUL! Holding foul on Joel Wade. [IN THE BONUS! 5 team fouls] Tyrese Simons to the line for 2 free throws. (Joel Wade: 1 personal fouls)   FT 1/2: GOOD   FT 2/2: GOOD Tyrese Simons makes 2/2 from the line.
Score: 88-96

[01:06] Team_057 possession (Score: 88-96)
Lamelo Irving attempts a Midrange. Wide open! Trae Antetokounmpo is 6.3 feet away. [ZONE] Lamelo Irving misses. Offensive rebound by Lamelo Irving! Lamelo Irving kicks it out.

[00:49] Team_057 possession (Score: 88-96)
Scottie Johnson drives to the basket... Scottie Johnson loses the ball! Stripped by Jarrett Murray! TURNOVER! (live ball)

[00:38] Team_069 possession (Score: 88-96)
Devin Giddey attempts a Layup. Contested by Lamelo Irving (4.9 feet, ZONE). Devin Giddey misses. Rebound secured by Lamelo Irving.

[00:27] Team_057 possession (Score: 88-96)
Joel Wade attempts a 3Pt. Contested by Tyrese Simons (5.2 feet, ZONE). Joel Wade misses. Offensive rebound by Zion Lillard! Zion Lillard puts it back in!
Score: 90-96

[00:12] Team_069 possession (Score: 90-96)
FOUL! Holding foul on Joel Wade. [IN THE BONUS! 6 team fouls] Tyrese Simons to the line for 2 free throws. (Joel Wade: 2 personal fouls)   FT 1/2: GOOD   FT 2/2: GOOD Tyrese Simons makes 2/2 from the line.
Score: 90-98

================================================================================
                              4TH QUARTER COMPLETE                              
================================================================================

4TH QUARTER SCORE: Team_057 27, Team_069 26

BOX SCORE:
================================================================================

Team_057
--------------------------------------------------------------------------------
Player                MIN  PTS  REB  AST  TO      FG   FG%      3P   3P%
--------------------------------------------------------------------------------
Joel Wade              21    9    3    1   0   4/4   100.0     0/0   0.0
Zion Lillard           21    6    3    3   0   3/4    75.0     0/0   0.0
Scottie Johnson        21    4    0    0   0   2/3    66.7     0/0   0.0
Lamelo Irving          21    4    4    1   0   2/3    66.7     0/0   0.0
Ben Adebayo            27    2    0    0   0   1/1   100.0     0/0   0.0
Bradley Ginobili       21    2    0    2   0   1/1   100.0     0/0   0.0
Kobe Ming              27    0    0    0   0   0/1     0.0     0/0   0.0
Miles Middleton        27    0    2    0   0   0/0     0.0     0/0   0.0
Klay Rozier            27    0    0    0   0   0/2     0.0     0/0   0.0

TEAM: FG: 13/19 (68.4%), 3PT: 3/7 (42.9%), REB: 12 (5 off, 7 def), AST: 7, TO: 4
TEAM FOULS: 6 [Team_069 in BONUS]


Team_069
--------------------------------------------------------------------------------
Player                MIN  PTS  REB  AST  TO      FG   FG%      3P   3P%
--------------------------------------------------------------------------------
Devin Giddey           21    7    0    0   0   3/5    60.0     0/0   0.0
Tyrese Simons          21    6    1    2   0   3/5    60.0     0/0   0.0
Domantas Towns         27    4    2    0   0   2/2   100.0     0/0   0.0
Trae Antetokounmpo     16    3    1    0   0   1/3    33.3     0/0   0.0
James Sexton           27    2    0    0   0   1/1   100.0     0/0   0.0
Jarrett Murray         21    2    0    1   0   1/2    50.0     0/0   0.0
Shai Quickley          21    2    1    0   0   1/2    50.0     0/0   0.0
Pau Middleton          27    0    1    0   0   0/0     0.0     0/0   0.0
CJ Fox                 27    0    1    0   0   0/0     0.0     0/0   0.0

TEAM: FG: 12/20 (60.0%), 3PT: 1/3 (33.3%), REB: 7 (1 off, 6 def), AST: 3, TO: 3
TEAM FOULS: 4

================================================================================

================================================================================
                               FULL GAME COMPLETE                               
================================================================================

FINAL SCORE: Team_057 90, Team_069 98

SCORING BY QUARTER:
--------------------------------------------------------------------------------
Team                     Q1     Q2     Q3     Q4    FINAL
--------------------------------------------------------------------------------
Team_057                 18     17     28     27       90
Team_069                 28     18     26     26       98
--------------------------------------------------------------------------------

FULL GAME BOX SCORE:
================================================================================

Team_057
--------------------------------------------------------------------------------
Player                MIN  PTS  REB  AST  TO      FG   FG%      3P   3P%      FT STL BLK
--------------------------------------------------------------------------------
Kobe Ming              27   11    0    0   1   6/9    66.7   1/2    50.0   7/9     0   0
Klay Rozier            27    0    0    0   1   0/6     0.0   0/3     0.0   0/0     0   0
Anfernee Adebayo       27   17    6    2   1   7/11   63.6   2/5    40.0   6/7     0   0
Ben Adebayo            27   10    5    0   2   5/8    62.5   1/2    50.0   4/6     0   1
Miles Middleton        27    4    9    2   0   2/8    25.0   0/3     0.0   2/4     1   1
Scottie Johnson        21    4    0    1   1   3/7    42.9   0/4     0.0   4/4     0   0
Bradley Ginobili       21   12    0    4   2   5/6    83.3   2/2   100.0   0/0     0   0
Joel Wade              21   14    7    2   2   7/8    87.5   3/3   100.0   0/0     1   1
Lamelo Irving          21    4   12    2   2   2/4    50.0   0/1     0.0   0/0     1   0
Zion Lillard           21    8    4    5   2   2/5    40.0   0/1     0.0   0/0     0   0

TEAM: FG: 39/72 (54.2%), 3PT: 9/26 (34.6%), REB: 44 (15 off, 29 def), AST: 18, TO: 14


Team_069
--------------------------------------------------------------------------------
Player                MIN  PTS  REB  AST  TO      FG   FG%      3P   3P%      FT STL BLK
--------------------------------------------------------------------------------
Domantas Lowry         33   14    0    1   1   5/8    62.5   1/2    50.0   1/1     1   0
James Sexton           27    7    0    2   2   3/5    60.0   1/3    33.3   0/0     0   1
Pau Middleton          27    5   12    5   0   3/5    60.0   2/4    50.0   1/2     1   0
Domantas Towns         27   22   12    1   1  10/13   76.9   1/2    50.0  13/16    1   0
CJ Fox                 27    8    7    2   1   4/6    66.7   0/1     0.0   2/4     0   0
Jarrett Murray         21    4    0    2   0   2/3    66.7   0/0     0.0   0/0     1   0
Tyrese Simons          21   11    5    2   2   2/9    22.2   1/6    16.7   6/6     1   0
Devin Giddey           21   12    0    0   1   6/10   60.0   1/2    50.0   5/6     0   0
Shai Quickley          21    6    4    0   1   3/6    50.0   0/1     0.0   2/2     1   0
Trae Antetokounmpo     16    5    3    0   0   2/5    40.0   0/1     0.0   3/3     1   0

TEAM: FG: 44/74 (59.5%), 3PT: 7/22 (31.8%), REB: 42 (10 off, 32 def), AST: 15, TO: 9

================================================================================
