================================================================================
                        FULL GAME - Team_073 vs Team_099                        
================================================================================

================================================================================
                       1ST QUARTER - Team_073 vs Team_099                       
================================================================================

[12:00] Team_073 possession (Score: 0-0)
Carmelo Porzingis makes the Layup and draws the foul on Ayo Barrett! And-1! Carmelo Porzingis to the line for 1. [Team fouls: 1] (Ayo Barrett: 1 personal fouls)   FT 1/1: GOOD Carmelo Porzingis makes 1/1 from the line.
Score: 3-0

[11:45] Team_099 possession (Score: 3-0)
Larry Wade attempts a 3Pt. Contested by Bradley Morant (4.2 feet, MAN). Larry Wade misses. Rebound secured by Carmelo Porzingis.

[11:29] Team_073 possession (Score: 3-0)
Carmelo Porzingis drives, picks up Vince Lillard. Help arrives from Ayo Barrett! Carmelo Porzingis attempts a Dunk. Contested by Ayo Barrett (2.6 feet, ZONE). CARMELO PORZINGIS MAKES IT! Assist: Carmelo Young
Score: 5-0

[11:17] Team_099 possession (Score: 5-0)
FOUL! Holding foul on Bradley Morant. [Team fouls: 1] No free throws, side out. (Bradley Morant: 1 personal fouls)

[11:00] Team_099 possession (Score: 5-0)
Damian Ginobili drives and kicks out. FOUL! Shooting foul on Karl Williamson. Vince Lillard to the line for 2 free throws. [Team fouls: 2] (Karl Williamson: 1 personal fouls)   FT 1/2: GOOD   FT 2/2: MISS Vince Lillard makes 1/2 from the line. Rebound secured by Carmelo Porzingis.
Score: 5-1

[10:44] Team_073 possession (Score: 5-1)
Karl Williamson drives and kicks out. Carmelo Porzingis attempts a Midrange. Contested by Vince Lillard (2.5 feet, ZONE). Carmelo Porzingis misses. Rebound secured by Vince Lillard.

[10:30] Team_099 possession (Score: 5-1)
Damian Ginobili drives and kicks out. Damian Ginobili attempts a 3Pt. Contested by Karl Williamson (3.1 feet, ZONE). Damian Ginobili misses. Rebound secured by Carmelo Porzingis.

[10:16] Team_073 possession (Score: 5-1)
Carmelo Porzingis drives, Vince Lillard stays with him. Carmelo Porzingis attempts a Layup. Contested by Vince Lillard (2.6 feet, ZONE). Carmelo Porzingis misses. Offensive rebound by Carmelo Porzingis! Carmelo Porzingis kicks it out.

[10:01] Team_073 possession (Score: 5-1)
Carmelo Young attempts a Layup. Contested by Ayo Barrett (4.0 feet, MAN). CARMELO YOUNG MAKES IT! Assist: Karl Williamson
Score: 7-1

[09:45] Team_099 possession (Score: 7-1)
FOUL! Shooting foul on Isaiah Smith. Vince Lillard to the line for 2 free throws. [Team fouls: 3] (Isaiah Smith: 1 personal fouls)   FT 1/2: GOOD   FT 2/2: GOOD Vince Lillard makes 2/2 from the line.
Score: 7-3

[09:28] Team_073 possession (Score: 7-3)
FOUL! Shooting foul on Larry James. Bradley Morant to the line for 2 free throws. [Team fouls: 2] (Larry James: 1 personal fouls)   FT 1/2: GOOD   FT 2/2: GOOD Bradley Morant makes 2/2 from the line.
Score: 9-3

[09:11] Team_099 possession (Score: 9-3)
Vince Lillard drives and kicks out. Larry James attempts a 3Pt. Contested by Karl Williamson (3.1 feet, ZONE). Larry James misses. Offensive rebound by Vince Lillard! Vince Lillard puts it back in!
Score: 9-5

[09:00] Team_073 possession (Score: 9-5)
Carmelo Porzingis attempts a 3Pt. Contested by Vince Lillard (2.6 feet, MAN). Carmelo Porzingis misses. Offensive rebound by Carmelo Porzingis! Carmelo Porzingis kicks it out.

[08:48] Team_073 possession (Score: 9-5)
Carmelo Porzingis attempts a Layup. Contested by Vince Lillard (2.6 feet, ZONE). CARMELO PORZINGIS MAKES IT!
Score: 11-5

[08:29] Team_099 possession (Score: 11-5)
Ayo Barrett makes the Layup and draws the foul on Carmelo Young! And-1! Ayo Barrett to the line for 1. [Team fouls: 4] (Carmelo Young: 1 personal fouls)   FT 1/1: GOOD Ayo Barrett makes 1/1 from the line.
Score: 11-8

[08:16] Team_073 possession (Score: 11-8)
Carmelo Porzingis drives, Vince Lillard stays with him. Carmelo Porzingis attempts a Layup. Contested by Vince Lillard (2.6 feet, ZONE). CARMELO PORZINGIS MAKES IT! Assist: Carmelo Young
Score: 13-8

[08:00] Team_099 possession (Score: 13-8)
FOUL! Reach-in foul on Carmelo Young during the drive. [IN THE BONUS! 5 team fouls] Ayo Barrett to the line for 2 free throws. (Carmelo Young: 2 personal fouls)   FT 1/2: GOOD   FT 2/2: GOOD Ayo Barrett makes 2/2 from the line.
Score: 13-10

[07:45] Team_073 possession (Score: 13-10)
Isaiah Smith makes the Layup and draws the foul on Larry James! And-1! Isaiah Smith to the line for 1. [Team fouls: 3] (Larry James: 2 personal fouls)   FT 1/1: GOOD Isaiah Smith makes 1/1 from the line.
Score: 16-10

[07:32] Team_099 possession (Score: 16-10)
Damian Ginobili attempts a Layup. Contested by Karl Williamson (3.3 feet, MAN). DAMIAN GINOBILI MAKES IT!
Score: 16-12

[07:21] Team_073 possession (Score: 16-12)
Karl Williamson drives and kicks out. Carmelo Young attempts a Midrange. Contested by Ayo Barrett (3.7 feet, MAN). Carmelo Young misses. Rebound secured by Damian Ginobili.

[07:10] Team_099 possession (Score: 16-12)
Larry James attempts a 3Pt. Contested by Isaiah Smith (4.3 feet, MAN). Larry James misses. Rebound secured by Carmelo Porzingis.

[06:55] Team_073 possession (Score: 16-12)
FOUL! Reach-in foul on Vince Lillard during the drive. [Team fouls: 4] No free throws, side out. (Vince Lillard: 1 personal fouls)

[06:45] Team_073 possession (Score: 16-12)
FOUL! Reach-in foul on Damian Ginobili during the drive. [IN THE BONUS! 5 team fouls] Karl Williamson to the line for 2 free throws. (Damian Ginobili: 1 personal fouls)   FT 1/2: GOOD   FT 2/2: GOOD Karl Williamson makes 2/2 from the line.
Score: 18-12

[06:30] Team_099 possession (Score: 18-12)
Ayo Barrett drives, picks up Bradley Morant. Help arrives from Isaiah Smith! Ayo Barrett attempts a Dunk. Contested by Isaiah Smith (4.0 feet, ZONE). Ayo Barrett misses. Offensive rebound by Larry Wade! Larry Wade puts it back in!
Score: 18-14

[06:16] Team_073 possession (Score: 18-14)
Carmelo Porzingis attempts a 3Pt. Contested by Vince Lillard (2.6 feet, MAN). Carmelo Porzingis misses. Rebound secured by Vince Lillard.

[06:02] Team_099 possession (Score: 18-14)
Ayo Barrett attempts a 3Pt. Contested by Karl Williamson (3.2 feet, ZONE). AYO BARRETT MAKES IT! Assist: Vince Lillard
Score: 18-17

[05:50] Team_073 possession (Score: 18-17)
Carmelo Porzingis attempts a Midrange. Contested by Ayo Barrett (3.9 feet, ZONE). CARMELO PORZINGIS MAKES IT!
Score: 20-17

[05:34] Team_099 possession (Score: 20-17)
Ayo Barrett drives to the basket... Ayo Barrett loses the ball! Stripped by Carmelo Young! TURNOVER! (live ball)

[05:19] Team_073 possession (Score: 20-17)
Isaiah Smith attempts a Midrange. Contested by Larry James (5.3 feet, MAN). Isaiah Smith misses. FOUL! Loose ball foul on Vince Lillard during the rebound battle. [IN THE BONUS! 6 team fouls] Bradley Morant to the line for 2 free throws. (Vince Lillard: 2 personal fouls)   FT 1/2: GOOD   FT 2/2: GOOD Bradley Morant makes 2/2 from the line.
Score: 22-17

[05:05] Team_099 possession (Score: 22-17)
Larry Wade attempts a 3Pt. Contested by Isaiah Smith (4.5 feet, ZONE). LARRY WADE MAKES IT! Assist: Damian Ginobili
Score: 22-20

[04:53] Team_073 possession (Score: 22-20)
Carmelo Young drives, Ayo Barrett stays with him. Carmelo Young attempts a Layup. Contested by Ayo Barrett (4.0 feet, MAN). CARMELO YOUNG MAKES IT! Assist: Karl Williamson
Score: 24-20

[04:40] Team_099 possession (Score: 24-20)
Larry Wade makes the Layup and draws the foul on Isaiah Smith! And-1! Larry Wade to the line for 1. [BONUS: 6 team fouls] (Isaiah Smith: 2 personal fouls)   FT 1/1: MISS Larry Wade makes 0/1 from the line. Rebound secured by Bradley Morant.
Score: 24-22

[04:23] Team_073 possession (Score: 24-22)
Carmelo Young attempts a 3Pt. Contested by Ayo Barrett (4.0 feet, MAN). Carmelo Young misses. Rebound secured by Damian Ginobili.

[04:10] Team_099 possession (Score: 24-22)
Larry James attempts a Midrange. Contested by Isaiah Smith (4.4 feet, MAN). Larry James misses. Rebound secured by Carmelo Porzingis.

[03:55] Team_073 possession (Score: 24-22)
Carmelo Porzingis attempts a 3Pt. Contested by Ayo Barrett (3.9 feet, ZONE). Carmelo Porzingis misses. Rebound secured by Vince Lillard.

[03:36] Team_099 possession (Score: 24-22)
Larry James throws a bad pass! Stolen by Isaiah Smith! TURNOVER! (live ball)

[03:18] Team_073 possession (Score: 24-22)
Isaiah Smith attempts a Layup. Contested by Larry James (5.4 feet, MAN). ISAIAH SMITH MAKES IT! Assist: Bradley Morant
Score: 26-22

[03:01] Team_099 possession (Score: 26-22)
Damian Ginobili attempts a 3Pt. Contested by Karl Williamson (3.5 feet, ZONE). DAMIAN GINOBILI MAKES IT! Assist: Ayo Barrett
Score: 26-25

[02:44] Team_073 possession (Score: 26-25)
Carmelo Porzingis drives, Vince Lillard stays with him. Carmelo Porzingis attempts a Dunk. Contested by Vince Lillard (2.9 feet, MAN). CARMELO PORZINGIS MAKES IT! Assist: Karl Williamson
Score: 28-25

[02:30] Team_099 possession (Score: 28-25)
Vince Lillard attempts a 3Pt. Contested by Carmelo Porzingis (4.0 feet, MAN). VINCE LILLARD MAKES IT! Assist: Ayo Barrett
Score: 28-28

[02:18] Team_073 possession (Score: 28-28)
Isaiah Smith attempts a Layup. Contested by Vince Lillard (3.0 feet, ZONE). Isaiah Smith misses. Rebound secured by Damian Ginobili.

[02:00] Team_099 possession (Score: 28-28)
Damian Ginobili attempts a Layup. Contested by Karl Williamson (3.6 feet, MAN). DAMIAN GINOBILI MAKES IT! Assist: Vince Lillard
Score: 28-30

[01:44] Team_073 possession (Score: 28-30)
Bradley Morant makes the Layup and draws the foul on Ayo Barrett! And-1! Bradley Morant to the line for 1. [BONUS: 7 team fouls] (Ayo Barrett: 2 personal fouls)   FT 1/1: GOOD Bradley Morant makes 1/1 from the line.
Score: 31-30

[01:26] Team_099 possession (Score: 31-30)
Ayo Barrett attempts a 3Pt. Contested by Carmelo Young (5.0 feet, MAN). Ayo Barrett misses. Rebound secured by Carmelo Porzingis.

[01:12] Team_073 possession (Score: 31-30)
Karl Williamson attempts a 3Pt. Contested by Ayo Barrett (4.3 feet, ZONE). Karl Williamson misses. Rebound secured by Damian Ginobili.

[01:00] Team_099 possession (Score: 31-30)
Vince Lillard attempts a Layup. Contested by Bradley Morant (4.3 feet, ZONE). VINCE LILLARD MAKES IT! Assist: Larry Wade
Score: 31-32

[00:44] Team_073 possession (Score: 31-32)
Carmelo Young throws a bad pass out of bounds! TURNOVER! (dead ball)

[00:44] Substitution (Team_073): Carmelo Young OUT → Zach Quickley IN (stamina_rule2)

[00:44] Substitution (Team_073): Isaiah Smith OUT → Luka Butler IN (stamina_rule2)

[00:44] Substitution (Team_073): Karl Williamson OUT → Dwyane McCollum IN (stamina_rule2)

[00:44] Substitution (Team_073): Carmelo Porzingis OUT → Shai Thompson IN (stamina_rule2)

[00:44] Substitution (Team_073): Bradley Morant OUT → Ja Rose IN (stamina_rule2)

[00:44] Substitution (Team_099): Ayo Barrett OUT → CJ Cunningham IN (stamina_rule2)

[00:44] Substitution (Team_099): Larry James OUT → Manu Johnson IN (stamina_rule2)

[00:44] Substitution (Team_099): Damian Ginobili OUT → Scottie Quickley IN (stamina_rule2)

[00:44] Substitution (Team_099): Vince Lillard OUT → Donovan Green IN (stamina_rule2)

[00:44] Substitution (Team_099): Larry Wade OUT → Jarrett Fox IN (stamina_rule2)

[00:32] Team_099 possession (Score: 31-32)
Jarrett Fox makes the Layup and draws the foul on Shai Thompson! And-1! Jarrett Fox to the line for 1. [BONUS: 7 team fouls] (Shai Thompson: 1 personal fouls)   FT 1/1: MISS Jarrett Fox makes 0/1 from the line. Rebound secured by Dwyane McCollum.
Score: 31-34

[00:21] Team_073 possession (Score: 31-34)
Zach Quickley attempts a 3Pt. Contested by Manu Johnson (5.2 feet, ZONE). ZACH QUICKLEY MAKES IT! Assist: Dwyane McCollum
Score: 34-34

[00:08] Team_099 possession (Score: 34-34)
CJ Cunningham attempts a Midrange. Contested by Luka Butler (4.6 feet, ZONE). CJ CUNNINGHAM MAKES IT! Assist: Scottie Quickley
Score: 34-36

================================================================================
                              1ST QUARTER COMPLETE                              
================================================================================

1ST QUARTER SCORE: Team_073 34, Team_099 36

BOX SCORE:
================================================================================

Team_073
--------------------------------------------------------------------------------
Player                MIN  PTS  REB  AST  TO      FG   FG%      3P   3P%
--------------------------------------------------------------------------------
Carmelo Porzingis      11   13    8    0   0   6/8    75.0     0/0   0.0
Bradley Morant         11    7    1    1   0   3/3   100.0     0/0   0.0
Isaiah Smith           11    5    0    0   0   2/3    66.7     0/0   0.0
Carmelo Young          11    4    0    2   0   2/3    66.7     0/0   0.0
Zach Quickley           1    3    0    0   0   1/1   100.0     0/0   0.0
Karl Williamson        11    2    0    3   0   1/4    25.0     0/0   0.0
Dwyane McCollum         1    0    1    1   0   0/0     0.0     0/0   0.0

TEAM: FG: 15/22 (68.2%), 3PT: 1/5 (20.0%), REB: 10 (2 off, 8 def), AST: 7, TO: 1
TEAM FOULS: 7 [Team_099 in BONUS]


Team_099
--------------------------------------------------------------------------------
Player                MIN  PTS  REB  AST  TO      FG   FG%      3P   3P%
--------------------------------------------------------------------------------
Vince Lillard          11    9    4    2   0   4/4   100.0     0/0   0.0
Ayo Barrett            11    8    0    2   0   3/4    75.0     0/0   0.0
Damian Ginobili        11    7    4    1   0   3/5    60.0     0/0   0.0
Larry Wade             11    5    1    1   0   2/4    50.0     0/0   0.0
CJ Cunningham           1    2    0    0   0   1/1   100.0     0/0   0.0
Larry James            11    0    0    0   0   0/2     0.0     0/0   0.0
Jarrett Fox             1    0    0    0   0   0/1     0.0     0/0   0.0
Scottie Quickley        1    0    0    1   0   0/0     0.0     0/0   0.0

TEAM: FG: 13/21 (61.9%), 3PT: 4/7 (57.1%), REB: 9 (2 off, 7 def), AST: 7, TO: 2
TEAM FOULS: 7 [Team_073 in BONUS]

================================================================================

================================================================================
                       2ND QUARTER - Team_073 vs Team_099                       
================================================================================

[12:00] Team_073 possession (Score: 34-36)
Karl Williamson throws a bad pass! Stolen by Damian Ginobili! TURNOVER! (live ball)

[11:42] Team_099 possession (Score: 34-36)
FOUL! Holding foul on Karl Williamson. [Team fouls: 1] No free throws, side out. (Karl Williamson: 1 personal fouls)

[11:29] Team_099 possession (Score: 34-36)
Damian Ginobili drives to the basket... Damian Ginobili throws a bad pass out of bounds! TURNOVER! (dead ball)

[11:29] Substitution (Team_073): Carmelo Young OUT → Zach Quickley IN (stamina_rule2)

[11:29] Substitution (Team_099): Vince Lillard OUT → Donovan Green IN (stamina_rule2)

[11:29] Substitution (Team_099): Larry Wade OUT → Jarrett Fox IN (stamina_rule2)

[11:16] Team_073 possession (Score: 34-36)
Bradley Morant attempts a Layup. Contested by Jarrett Fox (4.3 feet, ZONE). Bradley Morant misses. Rebound secured by Damian Ginobili.

[11:05] Team_099 possession (Score: 34-36)
Ayo Barrett attempts a Layup. BLOCKED BY ZACH QUICKLEY! Ball is loose! Offensive rebound by Jarrett Fox! Jarrett Fox kicks it out.

[10:49] Team_099 possession (Score: 34-36)
Larry James attempts a Layup. BLOCKED BY ISAIAH SMITH! Ball is loose! Offensive rebound by Jarrett Fox! Jarrett Fox kicks it out.

[10:36] Team_099 possession (Score: 34-36)
Damian Ginobili drives and kicks out. Ayo Barrett attempts a 3Pt. Contested by Zach Quickley (4.4 feet, MAN). AYO BARRETT MAKES IT! Assist: Damian Ginobili
Score: 34-39

[10:24] Team_073 possession (Score: 34-39)
Bradley Morant drives and kicks out. Karl Williamson attempts a 3Pt. Contested by Damian Ginobili (3.9 feet, MAN). Karl Williamson misses. Rebound secured by Jarrett Fox.

[10:08] Team_099 possession (Score: 34-39)
Ayo Barrett attempts a 3Pt. Contested by Zach Quickley (4.5 feet, MAN). Ayo Barrett misses. Rebound secured by Bradley Morant.

[09:49] Team_073 possession (Score: 34-39)
Bradley Morant drives, Jarrett Fox stays with him. Bradley Morant attempts a Dunk. Contested by Jarrett Fox (4.3 feet, MAN). BRADLEY MORANT MAKES IT! Assist: Isaiah Smith
Score: 36-39

[09:31] Team_099 possession (Score: 36-39)
Donovan Green attempts a Midrange. Contested by Carmelo Porzingis (4.3 feet, MAN). DONOVAN GREEN MAKES IT! Assist: Larry James
Score: 36-41

[09:15] Team_073 possession (Score: 36-41)
Zach Quickley attempts a Midrange. Contested by Donovan Green (4.2 feet, ZONE). ZACH QUICKLEY MAKES IT! Assist: Karl Williamson
Score: 38-41

[09:01] Team_099 possession (Score: 38-41)
Ayo Barrett drives, picks up Zach Quickley. Help arrives from Isaiah Smith! Ayo Barrett attempts a Dunk. Contested by Isaiah Smith (4.5 feet, MAN). AYO BARRETT MAKES IT!
Score: 38-43

[08:50] Team_073 possession (Score: 38-43)
Zach Quickley drives and kicks out. Bradley Morant attempts a 3Pt. Contested by Ayo Barrett (4.3 feet, ZONE). Bradley Morant misses. Rebound secured by Damian Ginobili.

[08:36] Team_099 possession (Score: 38-43)
Ayo Barrett attempts a 3Pt. Contested by Zach Quickley (4.5 feet, MAN). Ayo Barrett misses. Rebound secured by Bradley Morant.

[08:23] Team_073 possession (Score: 38-43)
FOUL! Reach-in foul on Jarrett Fox during the drive. [Team fouls: 1] No free throws, side out. (Jarrett Fox: 1 personal fouls)

[08:07] Team_073 possession (Score: 38-43)
Carmelo Porzingis attempts a 3Pt. Contested by Ayo Barrett (4.4 feet, ZONE). Carmelo Porzingis misses. Rebound secured by Damian Ginobili.

[07:49] Team_099 possession (Score: 38-43)
FOUL! Holding foul on Karl Williamson. [Team fouls: 3] No free throws, side out. (Karl Williamson: 2 personal fouls)

[07:38] Team_099 possession (Score: 38-43)
Larry James drives, picks up Isaiah Smith. Help arrives from Zach Quickley! Larry James attempts a Layup. Contested by Zach Quickley (4.9 feet, MAN). LARRY JAMES MAKES IT! Assist: Damian Ginobili
Score: 38-45

[07:25] Team_073 possession (Score: 38-45)
Karl Williamson drives and kicks out. Karl Williamson attempts a 3Pt. Contested by Damian Ginobili (4.4 feet, MAN). Karl Williamson misses. FOUL! Loose ball foul on Donovan Green during the rebound battle. [Team fouls: 2] No free throws, side out. (Donovan Green: 1 personal fouls)

[07:08] Team_073 possession (Score: 38-45)
Carmelo Porzingis throws a bad pass out of bounds! TURNOVER! (dead ball)

[07:08] Substitution (Team_073): Isaiah Smith OUT → Luka Butler IN (stamina_rule2)

[07:08] Substitution (Team_073): Karl Williamson OUT → Dwyane McCollum IN (stamina_rule2)

[07:08] Substitution (Team_073): Carmelo Porzingis OUT → Shai Thompson IN (stamina_rule2)

[07:08] Substitution (Team_073): Bradley Morant OUT → Ja Rose IN (stamina_rule2)

[07:08] Substitution (Team_099): Ayo Barrett OUT → CJ Cunningham IN (stamina_rule2)

[07:08] Substitution (Team_099): Larry James OUT → Manu Johnson IN (stamina_rule2)

[07:08] Substitution (Team_099): Damian Ginobili OUT → Scottie Quickley IN (stamina_rule2)

[06:52] Team_099 possession (Score: 38-45)
Donovan Green attempts a 3Pt. Contested by Shai Thompson (3.9 feet, MAN). Donovan Green misses. Rebound secured by Ja Rose.

[06:39] Team_073 possession (Score: 38-45)
Zach Quickley drives and kicks out. Shai Thompson attempts a Midrange. Contested by Donovan Green (3.9 feet, ZONE). Shai Thompson misses. Rebound secured by Donovan Green.

[06:27] Team_099 possession (Score: 38-45)
Jarrett Fox loses control! Ball rolls out of bounds! TURNOVER! (dead ball)

[06:15] Team_073 possession (Score: 38-45)
Dwyane McCollum attempts a Midrange. Contested by Manu Johnson (4.9 feet, ZONE). DWYANE MCCOLLUM MAKES IT! Assist: Luka Butler
Score: 40-45

[05:58] Team_099 possession (Score: 40-45)
FOUL! Offensive foul on Jarrett Fox! Ja Rose drew the charge! [Team fouls: 3] (Jarrett Fox: 2 personal fouls) TURNOVER! (dead ball)

[05:42] Team_073 possession (Score: 40-45)
Shai Thompson attempts a Layup. BLOCKED BY MANU JOHNSON! Ball deflects out of bounds off Shai Thompson.

[05:26] Team_099 possession (Score: 40-45)
FOUL! Reach-in foul on Dwyane McCollum during the drive. [Team fouls: 4] No free throws, side out. (Dwyane McCollum: 1 personal fouls)

[05:16] Team_099 possession (Score: 40-45)
Donovan Green attempts a Midrange. Contested by Luka Butler (4.5 feet, ZONE). Donovan Green misses. Rebound secured by Ja Rose.

[05:01] Team_073 possession (Score: 40-45)
Ja Rose attempts a Layup. Contested by Jarrett Fox (4.2 feet, MAN). JA ROSE MAKES IT! Assist: Dwyane McCollum
Score: 42-45

[04:41] Team_099 possession (Score: 42-45)
CJ Cunningham attempts a Midrange. Contested by Luka Butler (4.6 feet, ZONE). CJ CUNNINGHAM MAKES IT!
Score: 42-47

[04:24] Team_073 possession (Score: 42-47)
Luka Butler attempts a 3Pt. Contested by Manu Johnson (5.4 feet, MAN). Luka Butler misses. Rebound secured by Donovan Green.

[04:10] Team_099 possession (Score: 42-47)
Scottie Quickley attempts a 3Pt. Contested by Luka Butler (4.7 feet, ZONE). Scottie Quickley misses. Rebound secured by Dwyane McCollum.

[03:56] Team_073 possession (Score: 42-47)
Dwyane McCollum makes the Midrange and draws the foul on Scottie Quickley! And-1! Dwyane McCollum to the line for 1. [Team fouls: 4] (Scottie Quickley: 1 personal fouls)   FT 1/1: GOOD Dwyane McCollum makes 1/1 from the line.
Score: 45-47

[03:41] Team_099 possession (Score: 45-47)
Jarrett Fox makes the Layup and draws the foul on Shai Thompson! And-1! Jarrett Fox to the line for 1. [BONUS: 5 team fouls] (Shai Thompson: 1 personal fouls)   FT 1/1: GOOD Jarrett Fox makes 1/1 from the line.
Score: 45-50

[03:27] Team_073 possession (Score: 45-50)
Zach Quickley attempts a Midrange. Contested by Scottie Quickley (4.3 feet, ZONE). Zach Quickley misses. Rebound secured by Jarrett Fox.

[03:12] Team_099 possession (Score: 45-50)
FOUL! Holding foul on Shai Thompson. [IN THE BONUS! 6 team fouls] Donovan Green to the line for 2 free throws. (Shai Thompson: 2 personal fouls)   FT 1/2: GOOD   FT 2/2: GOOD Donovan Green makes 2/2 from the line.
Score: 45-52

[02:57] Team_073 possession (Score: 45-52)
Shai Thompson drives to the basket... FOUL! Offensive foul on Shai Thompson! Jarrett Fox drew the charge! [Team fouls: 7] (Shai Thompson: 3 personal fouls) TURNOVER! (dead ball)

[02:42] Team_099 possession (Score: 45-52)
CJ Cunningham drives and kicks out. Scottie Quickley attempts a 3Pt. Contested by Luka Butler (4.4 feet, ZONE). Scottie Quickley misses. Rebound secured by Shai Thompson.

[02:29] Team_073 possession (Score: 45-52)
Dwyane McCollum attempts a 3Pt. Contested by Donovan Green (4.2 feet, ZONE). Dwyane McCollum misses. Rebound secured by Scottie Quickley.

[02:15] Team_099 possession (Score: 45-52)
Donovan Green loses control! Ball rolls out of bounds! TURNOVER! (dead ball)

[02:04] Team_073 possession (Score: 45-52)
Shai Thompson drives, picks up Jarrett Fox. Help arrives from Manu Johnson! Shai Thompson attempts a Layup. Contested by Manu Johnson (4.6 feet, ZONE). Shai Thompson misses. Rebound secured by Scottie Quickley.

[01:47] Team_099 possession (Score: 45-52)
Jarrett Fox makes the Layup and draws the foul on Shai Thompson! And-1! Jarrett Fox to the line for 1. [BONUS: 8 team fouls] (Shai Thompson: 4 personal fouls)   FT 1/1: GOOD Jarrett Fox makes 1/1 from the line.
Score: 45-55

[01:36] Team_073 possession (Score: 45-55)
Ja Rose attempts a 3Pt. Contested by Manu Johnson (5.0 feet, ZONE). Ja Rose misses. FOUL! Loose ball foul on Jarrett Fox during the rebound battle. [IN THE BONUS! 5 team fouls] Ja Rose to the line for 2 free throws. (Jarrett Fox: 3 personal fouls)   FT 1/2: GOOD   FT 2/2: GOOD Ja Rose makes 2/2 from the line.
Score: 47-55

[01:24] Team_099 possession (Score: 47-55)
Manu Johnson attempts a 3Pt. Contested by Luka Butler (4.5 feet, MAN). Manu Johnson misses. Rebound secured by Shai Thompson.

[01:10] Team_073 possession (Score: 47-55)
Shai Thompson attempts a Layup. Contested by Jarrett Fox (4.7 feet, ZONE). SHAI THOMPSON MAKES IT! Assist: Luka Butler
Score: 49-55

[00:52] Team_099 possession (Score: 49-55)
Jarrett Fox attempts a Midrange. Contested by Luka Butler (4.8 feet, ZONE). JARRETT FOX MAKES IT!
Score: 49-57

[00:36] Team_073 possession (Score: 49-57)
Zach Quickley attempts a Midrange. Contested by Scottie Quickley (4.3 feet, ZONE). Zach Quickley misses. Offensive rebound by Dwyane McCollum! Dwyane McCollum's putback is no good. Rebound secured by Donovan Green.

[00:21] Team_099 possession (Score: 49-57)
Manu Johnson attempts a 3Pt. Contested by Luka Butler (4.6 feet, ZONE). Manu Johnson misses. Offensive rebound by Donovan Green! Donovan Green kicks it out.

[00:06] Team_099 possession (Score: 49-57)
Donovan Green attempts a Layup. Contested by Shai Thompson (3.9 feet, ZONE). Donovan Green misses. Rebound secured by Shai Thompson.

================================================================================
                              2ND QUARTER COMPLETE                              
================================================================================

2ND QUARTER SCORE: Team_073 15, Team_099 21

BOX SCORE:
================================================================================

Team_073
--------------------------------------------------------------------------------
Player                MIN  PTS  REB  AST  TO      FG   FG%      3P   3P%
--------------------------------------------------------------------------------
Dwyane McCollum         8    5    1    1   0   2/3    66.7     0/0   0.0
Ja Rose                 8    4    2    0   0   2/2   100.0     0/0   0.0
Bradley Morant         17    2    2    0   0   1/3    33.3     0/0   0.0
Zach Quickley          12    2    0    0   0   1/5    20.0     0/0   0.0
Shai Thompson           8    2    3    0   0   1/3    33.3     0/0   0.0
Isaiah Smith           17    0    0    1   0   0/0     0.0     0/0   0.0
Karl Williamson        17    0    0    1   0   0/0     0.0     0/0   0.0
Carmelo Porzingis      17    0    1    0   0   0/1     0.0     0/0   0.0
Luka Butler             8    0    0    2   0   0/1     0.0     0/0   0.0

TEAM: FG: 7/18 (38.9%), 3PT: 1/4 (25.0%), REB: 10 (2 off, 8 def), AST: 5, TO: 3
TEAM FOULS: 8 [Team_099 in BONUS]


Team_099
--------------------------------------------------------------------------------
Player                MIN  PTS  REB  AST  TO      FG   FG%      3P   3P%
--------------------------------------------------------------------------------
Jarrett Fox            12    8    4    0   0   3/3   100.0     0/0   0.0
Ayo Barrett            17    5    0    0   0   2/4    50.0     0/0   0.0
Donovan Green          12    4    4    0   0   2/5    40.0     0/0   0.0
Larry James            17    2    0    1   0   1/1   100.0     0/0   0.0
CJ Cunningham           8    2    0    0   0   1/2    50.0     0/0   0.0
Damian Ginobili        17    0    3    2   0   0/0     0.0     0/0   0.0
Scottie Quickley        8    0    2    0   0   0/1     0.0     0/0   0.0
Manu Johnson            8    0    0    0   0   0/1     0.0     0/0   0.0

TEAM: FG: 9/17 (52.9%), 3PT: 0/5 (0.0%), REB: 12 (3 off, 9 def), AST: 3, TO: 4
TEAM FOULS: 5 [Team_073 in BONUS]

================================================================================

================================================================================
                       3RD QUARTER - Team_073 vs Team_099                       
================================================================================

[12:00] Team_073 possession (Score: 49-57)
Carmelo Porzingis drives and kicks out. Isaiah Smith attempts a Midrange. Contested by Damian Ginobili (3.5 feet, ZONE). Isaiah Smith misses. Offensive rebound by Carmelo Porzingis! Carmelo Porzingis kicks it out.

[11:42] Team_073 possession (Score: 49-57)
FOUL! Holding foul on Larry Wade. [Team fouls: 1] No free throws, side out. (Larry Wade: 1 personal fouls)

[11:29] Team_073 possession (Score: 49-57)
Karl Williamson attempts a Layup. BLOCKED BY VINCE LILLARD! Ball is loose! Offensive rebound by Carmelo Porzingis! Carmelo Porzingis kicks it out.

[11:16] Team_073 possession (Score: 49-57)
Karl Williamson attempts a 3Pt. Contested by Damian Ginobili (3.8 feet, MAN). Karl Williamson misses. FOUL! Loose ball foul on Larry Wade during the rebound battle. [Team fouls: 3] No free throws, side out. (Larry Wade: 2 personal fouls)

[11:05] Team_073 possession (Score: 49-57)
Carmelo Porzingis drives and kicks out. Isaiah Smith attempts a 3Pt. Contested by Larry James (5.1 feet, MAN). Isaiah Smith misses. Rebound secured by Larry Wade.

[10:49] Team_099 possession (Score: 49-57)
Ayo Barrett attempts a Layup. Contested by Bradley Morant (4.0 feet, ZONE). AYO BARRETT MAKES IT! Assist: Larry Wade
Score: 49-59

[10:34] Team_073 possession (Score: 49-59)
Isaiah Smith drives, Vince Lillard stays with him. Isaiah Smith attempts a Layup. Contested by Vince Lillard (2.7 feet, ZONE). Isaiah Smith misses. Rebound secured by Vince Lillard.

[10:21] Team_099 possession (Score: 49-59)
Vince Lillard drives and kicks out. Larry James attempts a 3Pt. Contested by Isaiah Smith (4.2 feet, MAN). Larry James misses. Rebound secured by Isaiah Smith.

[10:08] Team_073 possession (Score: 49-59)
Isaiah Smith drives to the basket... Isaiah Smith loses the ball! Stripped by Larry James! TURNOVER! (live ball)

[09:52] Team_099 possession (Score: 49-59)
Vince Lillard attempts a 3Pt. Contested by Carmelo Porzingis (3.8 feet, MAN). Vince Lillard misses. Rebound secured by Carmelo Porzingis.

[09:37] Team_073 possession (Score: 49-59)
FOUL! Shooting foul on Ayo Barrett. Karl Williamson to the line for 2 free throws. [Team fouls: 4] (Ayo Barrett: 1 personal fouls)   FT 1/2: GOOD   FT 2/2: GOOD Karl Williamson makes 2/2 from the line.
Score: 51-59

[09:24] Team_099 possession (Score: 51-59)
Larry Wade drives, picks up Bradley Morant. Help arrives from Isaiah Smith! Larry Wade attempts a Dunk. Contested by Isaiah Smith (4.2 feet, MAN). LARRY WADE MAKES IT! Assist: Vince Lillard
Score: 51-61

[09:07] Team_073 possession (Score: 51-61)
FOUL! Reach-in foul on Vince Lillard during the drive. [IN THE BONUS! 5 team fouls] Karl Williamson to the line for 2 free throws. (Vince Lillard: 1 personal fouls)   FT 1/2: GOOD   FT 2/2: GOOD Karl Williamson makes 2/2 from the line.
Score: 53-61

[08:52] Team_099 possession (Score: 53-61)
Vince Lillard attempts a 3Pt. Contested by Carmelo Porzingis (3.8 feet, MAN). Vince Lillard misses. Rebound secured by Carmelo Porzingis.

[08:36] Team_073 possession (Score: 53-61)
Bradley Morant attempts a Midrange. Contested by Damian Ginobili (3.9 feet, ZONE). Bradley Morant misses. Rebound secured by Damian Ginobili.

[08:18] Team_099 possession (Score: 53-61)
Vince Lillard drives, Carmelo Porzingis stays with him. Vince Lillard attempts a Dunk. Contested by Carmelo Porzingis (3.8 feet, MAN). Vince Lillard misses. Rebound secured by Carmelo Porzingis.

[08:01] Team_073 possession (Score: 53-61)
Bradley Morant makes the Layup and draws the foul on Larry Wade! And-1! Bradley Morant to the line for 1. [BONUS: 6 team fouls] (Larry Wade: 3 personal fouls)   FT 1/1: MISS Bradley Morant makes 0/1 from the line. Offensive rebound by Bradley Morant! Bradley Morant kicks it out.
Score: 55-61

[07:47] Team_073 possession (Score: 55-61)
Karl Williamson attempts a 3Pt. Contested by Damian Ginobili (3.8 feet, MAN). Karl Williamson misses. Rebound secured by Larry Wade.

[07:30] Team_099 possession (Score: 55-61)
Ayo Barrett attempts a Layup. BLOCKED BY ISAIAH SMITH! Ball is loose! Rebound secured by Isaiah Smith.

[07:13] Team_073 possession (Score: 55-61)
Carmelo Young loses control! Ball rolls out of bounds! TURNOVER! (dead ball)

[07:00] Team_099 possession (Score: 55-61)
Damian Ginobili attempts a 3Pt. Contested by Karl Williamson (3.3 feet, MAN). DAMIAN GINOBILI MAKES IT! Assist: Vince Lillard
Score: 55-64

[06:49] Team_073 possession (Score: 55-64)
FOUL! Offensive foul on Carmelo Porzingis! Vince Lillard drew the charge! [Team fouls: 1] (Carmelo Porzingis: 1 personal fouls) TURNOVER! (dead ball)

[06:38] Team_099 possession (Score: 55-64)
Ayo Barrett attempts a 3Pt. Contested by Karl Williamson (3.2 feet, ZONE). AYO BARRETT MAKES IT! Assist: Vince Lillard
Score: 55-67

[06:27] Team_073 possession (Score: 55-67)
Carmelo Porzingis attempts a 3Pt. Contested by Vince Lillard (2.6 feet, MAN). CARMELO PORZINGIS MAKES IT! Assist: Isaiah Smith
Score: 58-67

[06:09] Team_099 possession (Score: 58-67)
Ayo Barrett attempts a 3Pt. Contested by Karl Williamson (3.2 feet, ZONE). Ayo Barrett misses. Rebound secured by Carmelo Porzingis.

[05:55] Team_073 possession (Score: 58-67)
Carmelo Young attempts a 3Pt. Contested by Ayo Barrett (4.0 feet, ZONE). Carmelo Young misses. Rebound secured by Larry Wade.

[05:37] Team_099 possession (Score: 58-67)
Vince Lillard attempts a Layup. Contested by Bradley Morant (4.0 feet, ZONE). VINCE LILLARD MAKES IT! Assist: Ayo Barrett
Score: 58-69

[05:21] Team_073 possession (Score: 58-69)
Bradley Morant attempts a Layup. Contested by Larry Wade (4.6 feet, MAN). BRADLEY MORANT MAKES IT!
Score: 60-69

[05:05] Team_099 possession (Score: 60-69)
Damian Ginobili attempts a Midrange. Contested by Carmelo Porzingis (3.9 feet, ZONE). Damian Ginobili misses. FOUL! Loose ball foul on Isaiah Smith during the rebound battle. [Team fouls: 2] No free throws, side out. (Isaiah Smith: 1 personal fouls)

[04:52] Team_099 possession (Score: 60-69)
Larry Wade drives to the basket... Larry Wade loses the ball! Stripped by Bradley Morant! TURNOVER! (live ball)

[04:36] Team_073 possession (Score: 60-69)
Carmelo Young attempts a Layup. BLOCKED BY AYO BARRETT! Ball is loose! Offensive rebound by Carmelo Porzingis! Carmelo Porzingis kicks it out.

[04:18] Team_073 possession (Score: 60-69)
Carmelo Young makes the Layup and draws the foul on Ayo Barrett! And-1! Carmelo Young to the line for 1. [BONUS: 7 team fouls] (Ayo Barrett: 2 personal fouls)   FT 1/1: GOOD Carmelo Young makes 1/1 from the line.
Score: 63-69

[04:01] Team_099 possession (Score: 63-69)
Vince Lillard attempts a Layup. Contested by Carmelo Porzingis (3.8 feet, MAN). VINCE LILLARD MAKES IT!
Score: 63-71

[03:47] Team_073 possession (Score: 63-71)
Isaiah Smith attempts a 3Pt. Contested by Ayo Barrett (4.0 feet, ZONE). ISAIAH SMITH MAKES IT! Assist: Carmelo Young
Score: 66-71

[03:36] Team_099 possession (Score: 66-71)
Vince Lillard makes the Dunk and draws the foul on Isaiah Smith! And-1! Vince Lillard to the line for 1. [Team fouls: 3] (Isaiah Smith: 2 personal fouls)   FT 1/1: GOOD Vince Lillard makes 1/1 from the line.
Score: 66-74

[03:22] Team_073 possession (Score: 66-74)
FOUL! Holding foul on Ayo Barrett. [IN THE BONUS! 8 team fouls] Carmelo Young to the line for 2 free throws. (Ayo Barrett: 3 personal fouls)   FT 1/2: GOOD   FT 2/2: GOOD Carmelo Young makes 2/2 from the line.
Score: 68-74

[03:09] Team_099 possession (Score: 68-74)
Larry Wade drives and kicks out. FOUL! Shooting foul on Isaiah Smith. Larry James to the line for 2 free throws. [Team fouls: 4] (Isaiah Smith: 3 personal fouls)   FT 1/2: GOOD   FT 2/2: GOOD Larry James makes 2/2 from the line.
Score: 68-76

[02:56] Team_073 possession (Score: 68-76)
Isaiah Smith drives, picks up Larry James. Help arrives from Damian Ginobili! Isaiah Smith attempts a Layup. Contested by Damian Ginobili (5.4 feet, MAN). ISAIAH SMITH MAKES IT! Assist: Bradley Morant
Score: 70-76

[02:40] Team_099 possession (Score: 70-76)
Vince Lillard attempts a Midrange. Contested by Isaiah Smith (4.5 feet, ZONE). Vince Lillard misses. Offensive rebound by Larry Wade! Larry Wade kicks it out.

[02:31] Team_099 possession (Score: 70-76)
Larry Wade attempts a Midrange. Contested by Bradley Morant (4.4 feet, MAN). LARRY WADE MAKES IT!
Score: 70-78

[02:18] Team_073 possession (Score: 70-78)
Bradley Morant drives, Larry Wade stays with him. Bradley Morant attempts a Layup. Contested by Larry Wade (4.9 feet, MAN). BRADLEY MORANT MAKES IT! Assist: Isaiah Smith
Score: 72-78

[02:04] Team_099 possession (Score: 72-78)
Larry Wade attempts a Layup. Contested by Bradley Morant (4.4 feet, MAN). LARRY WADE MAKES IT! Assist: Larry James
Score: 72-80

[01:48] Team_073 possession (Score: 72-80)
Carmelo Porzingis throws a bad pass out of bounds! TURNOVER! (dead ball)

[01:48] Substitution (Team_073): Carmelo Young OUT → Zach Quickley IN (stamina_rule2)

[01:48] Substitution (Team_073): Isaiah Smith OUT → Luka Butler IN (stamina_rule2)

[01:48] Substitution (Team_073): Karl Williamson OUT → Dwyane McCollum IN (stamina_rule2)

[01:48] Substitution (Team_073): Carmelo Porzingis OUT → Shai Thompson IN (stamina_rule2)

[01:48] Substitution (Team_073): Bradley Morant OUT → Ja Rose IN (stamina_rule2)

[01:48] Substitution (Team_099): Ayo Barrett OUT → CJ Cunningham IN (stamina_rule2)

[01:48] Substitution (Team_099): Larry James OUT → Manu Johnson IN (stamina_rule2)

[01:48] Substitution (Team_099): Damian Ginobili OUT → Scottie Quickley IN (stamina_rule2)

[01:48] Substitution (Team_099): Vince Lillard OUT → Donovan Green IN (stamina_rule2)

[01:48] Substitution (Team_099): Larry Wade OUT → Jarrett Fox IN (stamina_rule2)

[01:36] Team_099 possession (Score: 72-80)
Manu Johnson attempts a 3Pt. Contested by Luka Butler (4.5 feet, MAN). Manu Johnson misses. Rebound secured by Ja Rose.

[01:20] Team_073 possession (Score: 72-80)
Ja Rose attempts a Layup. BLOCKED BY JARRETT FOX! Ball is loose! Rebound secured by Donovan Green.

[01:03] Team_099 possession (Score: 72-80)
Donovan Green attempts a 3Pt. Contested by Dwyane McCollum (4.2 feet, ZONE). Donovan Green misses. Offensive rebound by Donovan Green! Donovan Green kicks it out.

[00:46] Team_099 possession (Score: 72-80)
Jarrett Fox attempts a Midrange. Contested by Dwyane McCollum (4.6 feet, ZONE). Jarrett Fox misses. Rebound secured by Ja Rose.

[00:33] Team_073 possession (Score: 72-80)
Shai Thompson attempts a Midrange. Contested by Scottie Quickley (4.2 feet, ZONE). Shai Thompson misses. Rebound secured by Jarrett Fox.

[00:17] Team_099 possession (Score: 72-80)
CJ Cunningham attempts a 3Pt. Contested by Luka Butler (4.6 feet, ZONE). CJ Cunningham misses. Rebound secured by Shai Thompson.

[00:04] Team_073 possession (Score: 72-80)
Luka Butler drives, Jarrett Fox stays with him. Luka Butler attempts a Layup. Contested by Jarrett Fox (4.5 feet, ZONE). Luka Butler misses. Rebound secured by Donovan Green.

================================================================================
                              3RD QUARTER COMPLETE                              
================================================================================

3RD QUARTER SCORE: Team_073 23, Team_099 23

BOX SCORE:
================================================================================

Team_073
--------------------------------------------------------------------------------
Player                MIN  PTS  REB  AST  TO      FG   FG%      3P   3P%
--------------------------------------------------------------------------------
Isaiah Smith           27    5    2    2   0   2/3    66.7     0/0   0.0
Carmelo Young          23    5    0    1   0   2/3    66.7     0/0   0.0
Bradley Morant         27    4    2    1   0   2/3    66.7     0/0   0.0
Karl Williamson        27    4    0    0   0   2/3    66.7     0/0   0.0
Carmelo Porzingis      27    3    7    0   0   1/2    50.0     0/0   0.0
Ja Rose                 9    0    2    0   0   0/1     0.0     0/0   0.0
Shai Thompson           9    0    1    0   0   0/1     0.0     0/0   0.0
Luka Butler             9    0    0    0   0   0/1     0.0     0/0   0.0

TEAM: FG: 9/17 (52.9%), 3PT: 2/4 (50.0%), REB: 14 (5 off, 9 def), AST: 4, TO: 4
TEAM FOULS: 4


Team_099
--------------------------------------------------------------------------------
Player                MIN  PTS  REB  AST  TO      FG   FG%      3P   3P%
--------------------------------------------------------------------------------
Vince Lillard          23    7    2    3   0   3/7    42.9     0/0   0.0
Larry Wade             23    6    4    1   0   3/3   100.0     0/0   0.0
Ayo Barrett            27    5    0    1   0   2/4    50.0     0/0   0.0
Damian Ginobili        27    3    1    0   0   1/1   100.0     0/0   0.0
Larry James            27    2    0    1   0   1/1   100.0     0/0   0.0
Manu Johnson            9    0    0    0   0   0/1     0.0     0/0   0.0
Donovan Green          14    0    3    0   0   0/0     0.0     0/0   0.0
Jarrett Fox            14    0    1    0   0   0/1     0.0     0/0   0.0
CJ Cunningham           9    0    0    0   0   0/1     0.0     0/0   0.0

TEAM: FG: 10/19 (52.6%), 3PT: 2/7 (28.6%), REB: 11 (3 off, 8 def), AST: 6, TO: 1
TEAM FOULS: 8 [Team_073 in BONUS]

================================================================================

================================================================================
                       4TH QUARTER - Team_073 vs Team_099                       
================================================================================

[12:00] Team_073 possession (Score: 72-80)
Karl Williamson attempts a 3Pt. Contested by Damian Ginobili (3.8 feet, MAN). KARL WILLIAMSON MAKES IT!
Score: 75-80

[11:46] Team_099 possession (Score: 75-80)
FOUL! Reach-in foul on Carmelo Porzingis during the drive. [Team fouls: 1] No free throws, side out. (Carmelo Porzingis: 1 personal fouls)

[11:34] Team_099 possession (Score: 75-80)
Damian Ginobili attempts a 3Pt. Contested by Karl Williamson (3.4 feet, ZONE). Damian Ginobili misses. Rebound secured by Carmelo Porzingis.

[11:22] Team_073 possession (Score: 75-80)
Isaiah Smith attempts a 3Pt. Contested by Larry James (5.3 feet, MAN). Isaiah Smith misses. Rebound secured by Vince Lillard.

[11:10] Team_099 possession (Score: 75-80)
Damian Ginobili attempts a 3Pt. Contested by Karl Williamson (3.4 feet, ZONE). Damian Ginobili misses. Offensive rebound by Vince Lillard! Vince Lillard's putback is no good. Offensive rebound by Larry Wade! Larry Wade kicks it out.

[10:54] Team_099 possession (Score: 75-80)
Ayo Barrett attempts a Midrange. Contested by Carmelo Young (4.9 feet, MAN). AYO BARRETT MAKES IT!
Score: 75-82

[10:38] Team_073 possession (Score: 75-82)
Isaiah Smith attempts a Midrange. Contested by Larry James (5.4 feet, MAN). ISAIAH SMITH MAKES IT!
Score: 77-82

[10:22] Team_099 possession (Score: 77-82)
Ayo Barrett attempts a 3Pt. Contested by Carmelo Young (4.9 feet, MAN). Ayo Barrett misses. Offensive rebound by Larry Wade! Larry Wade kicks it out.

[10:05] Team_099 possession (Score: 77-82)
Larry James attempts a 3Pt. Contested by Isaiah Smith (4.5 feet, MAN). Larry James misses. Rebound secured by Isaiah Smith.

[09:55] Team_073 possession (Score: 77-82)
FOUL! Offensive foul on Bradley Morant! Larry Wade drew the charge! [Team fouls: 2] (Bradley Morant: 1 personal fouls) TURNOVER! (dead ball)

[09:36] Team_099 possession (Score: 77-82)
Ayo Barrett attempts a Midrange. Contested by Carmelo Young (5.0 feet, MAN). AYO BARRETT MAKES IT!
Score: 77-84

[09:27] Team_073 possession (Score: 77-84)
Isaiah Smith drives and kicks out. Carmelo Young attempts a 3Pt. Contested by Ayo Barrett (4.0 feet, ZONE). Carmelo Young misses. Offensive rebound by Bradley Morant! Bradley Morant kicks it out.

[09:10] Team_073 possession (Score: 77-84)
FOUL! Reach-in foul on Larry Wade during the drive. [Team fouls: 1] No free throws, side out. (Larry Wade: 1 personal fouls)

[08:56] Team_073 possession (Score: 77-84)
Isaiah Smith drives and kicks out. Bradley Morant attempts a Midrange. Contested by Larry Wade (4.6 feet, MAN). Bradley Morant misses. Offensive rebound by Carmelo Porzingis! Carmelo Porzingis kicks it out.

[08:42] Team_073 possession (Score: 77-84)
Carmelo Porzingis makes the Midrange and draws the foul on Vince Lillard! And-1! Carmelo Porzingis to the line for 1. [Team fouls: 2] (Vince Lillard: 1 personal fouls)   FT 1/1: GOOD Carmelo Porzingis makes 1/1 from the line.
Score: 80-84

[08:28] Team_099 possession (Score: 80-84)
Vince Lillard attempts a 3Pt. Contested by Carmelo Porzingis (4.1 feet, MAN). Vince Lillard misses. Rebound secured by Bradley Morant.

[08:16] Team_073 possession (Score: 80-84)
Bradley Morant attempts a Midrange. Contested by Larry Wade (5.0 feet, MAN). BRADLEY MORANT MAKES IT! Assist: Isaiah Smith
Score: 82-84

[08:02] Team_099 possession (Score: 82-84)
Ayo Barrett attempts a 3Pt. Contested by Carmelo Young (5.2 feet, MAN). AYO BARRETT MAKES IT! Assist: Damian Ginobili
Score: 82-87

[07:47] Team_073 possession (Score: 82-87)
Carmelo Young attempts a 3Pt. Contested by Ayo Barrett (4.3 feet, MAN). CARMELO YOUNG MAKES IT! Assist: Carmelo Porzingis
Score: 85-87

[07:29] Team_099 possession (Score: 85-87)
Ayo Barrett throws a bad pass out of bounds! TURNOVER! (dead ball)

[07:29] Substitution (Team_073): Carmelo Young OUT → Zach Quickley IN (stamina_rule2)

[07:29] Substitution (Team_073): Isaiah Smith OUT → Luka Butler IN (stamina_rule2)

[07:29] Substitution (Team_073): Karl Williamson OUT → Dwyane McCollum IN (stamina_rule2)

[07:29] Substitution (Team_073): Carmelo Porzingis OUT → Shai Thompson IN (stamina_rule2)

[07:29] Substitution (Team_073): Bradley Morant OUT → Ja Rose IN (stamina_rule2)

[07:29] Substitution (Team_099): Ayo Barrett OUT → CJ Cunningham IN (stamina_rule2)

[07:29] Substitution (Team_099): Larry James OUT → Manu Johnson IN (stamina_rule2)

[07:29] Substitution (Team_099): Damian Ginobili OUT → Scottie Quickley IN (stamina_rule2)

[07:29] Substitution (Team_099): Vince Lillard OUT → Donovan Green IN (stamina_rule2)

[07:29] Substitution (Team_099): Larry Wade OUT → Jarrett Fox IN (stamina_rule2)

[07:14] Team_073 possession (Score: 85-87)
Ja Rose drives and kicks out. Zach Quickley attempts a Midrange. Contested by CJ Cunningham (5.8 feet, MAN). ZACH QUICKLEY MAKES IT! Assist: Shai Thompson
Score: 87-87

[06:57] Team_099 possession (Score: 87-87)
Jarrett Fox attempts a Midrange. Contested by Luka Butler (4.9 feet, ZONE). Jarrett Fox misses. Rebound secured by Dwyane McCollum.

[06:40] Team_073 possession (Score: 87-87)
Dwyane McCollum attempts a Midrange. Contested by Scottie Quickley (4.1 feet, MAN). Dwyane McCollum misses. Rebound secured by Scottie Quickley.

[06:25] Team_099 possession (Score: 87-87)
Manu Johnson attempts a Midrange. BLOCKED BY LUKA BUTLER! Ball goes out off Luka Butler. Manu Johnson's ball!

[06:08] Team_099 possession (Score: 87-87)
CJ Cunningham drives, Zach Quickley stays with him. CJ Cunningham attempts a Layup. Contested by Zach Quickley (4.7 feet, MAN). CJ CUNNINGHAM MAKES IT! Assist: Scottie Quickley
Score: 87-89

[05:55] Team_073 possession (Score: 87-89)
FOUL! Holding foul on Scottie Quickley. [Team fouls: 3] No free throws, side out. (Scottie Quickley: 1 personal fouls)

[05:43] Team_073 possession (Score: 87-89)
Luka Butler drives to the basket... Luka Butler loses control! Ball rolls out of bounds! TURNOVER! (dead ball)

[05:29] Team_099 possession (Score: 87-89)
CJ Cunningham drives and kicks out. CJ Cunningham attempts a 3Pt. BLOCKED BY ZACH QUICKLEY! Ball is loose! Rebound secured by Dwyane McCollum.

[05:14] Team_073 possession (Score: 87-89)
FOUL! Shooting foul on Jarrett Fox. Ja Rose to the line for 2 free throws. [Team fouls: 4] (Jarrett Fox: 1 personal fouls)   FT 1/2: GOOD   FT 2/2: MISS Ja Rose makes 1/2 from the line. Rebound secured by Scottie Quickley.
Score: 88-89

[05:00] Team_099 possession (Score: 88-89)
Manu Johnson attempts a 3Pt. Contested by Luka Butler (4.5 feet, ZONE). Manu Johnson misses. Rebound secured by Dwyane McCollum.

[04:44] Team_073 possession (Score: 88-89)
Luka Butler attempts a Midrange. Contested by Scottie Quickley (4.5 feet, ZONE). Luka Butler misses. Rebound secured by Donovan Green.

[04:31] Team_099 possession (Score: 88-89)
CJ Cunningham attempts a Midrange. Contested by Zach Quickley (4.7 feet, MAN). CJ Cunningham misses. Rebound secured by Shai Thompson.

[04:14] Team_073 possession (Score: 88-89)
Dwyane McCollum attempts a 3Pt. Contested by Manu Johnson (4.9 feet, ZONE). DWYANE MCCOLLUM MAKES IT!
Score: 91-89

[04:00] Team_099 possession (Score: 91-89)
Jarrett Fox drives, picks up Ja Rose. Help arrives from Luka Butler! Jarrett Fox attempts a Layup. Contested by Luka Butler (6.0 feet, MAN). Jarrett Fox misses. Rebound secured by Dwyane McCollum.

[03:42] Team_073 possession (Score: 91-89)
Dwyane McCollum attempts a 3Pt. Contested by Manu Johnson (4.9 feet, ZONE). Dwyane McCollum misses. Rebound secured by Donovan Green.

[03:29] Team_099 possession (Score: 91-89)
Scottie Quickley attempts a Layup. Contested by Dwyane McCollum (4.4 feet, MAN). SCOTTIE QUICKLEY MAKES IT! Assist: Donovan Green
Score: 91-91

[03:14] Team_073 possession (Score: 91-91)
Luka Butler attempts a Midrange. Contested by Manu Johnson (5.4 feet, MAN). LUKA BUTLER MAKES IT!
Score: 93-91

[03:03] Team_099 possession (Score: 93-91)
Donovan Green attempts a 3Pt. Contested by Shai Thompson (3.9 feet, MAN). Donovan Green misses. Offensive rebound by Jarrett Fox! Jarrett Fox's putback is no good. Rebound secured by Ja Rose.

[02:49] Team_073 possession (Score: 93-91)
Shai Thompson loses control! Ball rolls out of bounds! TURNOVER! (dead ball)

[02:35] Team_099 possession (Score: 93-91)
Donovan Green drives, Shai Thompson stays with him. Donovan Green attempts a Layup. Contested by Shai Thompson (3.9 feet, ZONE). DONOVAN GREEN MAKES IT! Assist: Jarrett Fox
Score: 93-93

[02:26] Team_073 possession (Score: 93-93)
Luka Butler attempts a Midrange. BLOCKED BY MANU JOHNSON! Ball is loose! Rebound secured by Donovan Green.

[02:11] Team_099 possession (Score: 93-93)
CJ Cunningham attempts a Midrange. Contested by Luka Butler (4.6 feet, ZONE). CJ CUNNINGHAM MAKES IT!
Score: 93-95

[01:59] Team_073 possession (Score: 93-95)
Zach Quickley attempts a 3Pt. Contested by Manu Johnson (5.2 feet, ZONE). Zach Quickley misses. FOUL! Loose ball foul on Jarrett Fox during the rebound battle. [IN THE BONUS! 5 team fouls] Ja Rose to the line for 2 free throws. (Jarrett Fox: 2 personal fouls)   FT 1/2: GOOD   FT 2/2: MISS Ja Rose makes 1/2 from the line. Rebound secured by Donovan Green.
Score: 94-95

[01:49] Team_099 possession (Score: 94-95)
FOUL! Shooting foul on Dwyane McCollum. Scottie Quickley to the line for 3 free throws. [Team fouls: 3] (Dwyane McCollum: 1 personal fouls)   FT 1/3: GOOD   FT 2/3: GOOD   FT 3/3: GOOD Scottie Quickley makes 3/3 from the line.
Score: 94-98

[01:36] Team_073 possession (Score: 94-98)
Luka Butler attempts a 3Pt. Contested by Manu Johnson (5.4 feet, MAN). LUKA BUTLER MAKES IT! Assist: Zach Quickley
Score: 97-98

[01:22] Team_099 possession (Score: 97-98)
Scottie Quickley attempts a 3Pt. Contested by Luka Butler (4.8 feet, ZONE). Scottie Quickley misses. Rebound secured by Dwyane McCollum.

[01:08] Team_073 possession (Score: 97-98)
Luka Butler attempts a 3Pt. Contested by Manu Johnson (5.4 feet, ZONE). Luka Butler misses. Rebound secured by Jarrett Fox.

[00:56] Team_099 possession (Score: 97-98)
Manu Johnson attempts a 3Pt. Contested by Luka Butler (4.6 feet, MAN). Manu Johnson misses. Offensive rebound by Jarrett Fox! Jarrett Fox's putback is no good. Rebound secured by Shai Thompson.

[00:42] Team_073 possession (Score: 97-98)
Dwyane McCollum loses the ball! Stripped by Scottie Quickley! TURNOVER! (live ball)

[00:28] Team_099 possession (Score: 97-98)
CJ Cunningham attempts a 3Pt. Contested by Luka Butler (4.8 feet, ZONE). CJ Cunningham misses. Rebound secured by Shai Thompson.

[00:14] Team_073 possession (Score: 97-98)
Shai Thompson attempts a Midrange. Contested by Donovan Green (4.2 feet, MAN). Shai Thompson misses. Rebound secured by Jarrett Fox.

[00:01] Team_099 possession (Score: 97-98)
Manu Johnson attempts a 3Pt. Contested by Luka Butler (4.7 feet, ZONE). Manu Johnson misses. Offensive rebound by Donovan Green! Donovan Green kicks it out.

================================================================================
                              4TH QUARTER COMPLETE                              
================================================================================

4TH QUARTER SCORE: Team_073 25, Team_099 18

BOX SCORE:
================================================================================

Team_073
--------------------------------------------------------------------------------
Player                MIN  PTS  REB  AST  TO      FG   FG%      3P   3P%
--------------------------------------------------------------------------------
Luka Butler            17    5    0    0   0   2/5    40.0     0/0   0.0
Karl Williamson        32    3    0    0   0   1/1   100.0     0/0   0.0
Carmelo Porzingis      32    3    2    1   0   1/1   100.0     0/0   0.0
Carmelo Young          27    3    0    0   0   1/1   100.0     0/0   0.0
Dwyane McCollum        17    3    5    0   0   1/3    33.3     0/0   0.0
Isaiah Smith           32    2    1    1   0   1/2    50.0     0/0   0.0
Bradley Morant         32    2    2    0   0   1/1   100.0     0/0   0.0
Zach Quickley          21    2    0    1   0   1/2    50.0     0/0   0.0
Shai Thompson          17    0    3    1   0   0/1     0.0     0/0   0.0

TEAM: FG: 9/18 (50.0%), 3PT: 4/8 (50.0%), REB: 13 (3 off, 10 def), AST: 4, TO: 4
TEAM FOULS: 3


Team_099
--------------------------------------------------------------------------------
Player                MIN  PTS  REB  AST  TO      FG   FG%      3P   3P%
--------------------------------------------------------------------------------
Ayo Barrett            32    7    0    0   0   3/3   100.0     0/0   0.0
Scottie Quickley       17    5    2    1   0   2/3    66.7     0/0   0.0
CJ Cunningham          17    4    0    0   0   2/5    40.0     0/0   0.0
Donovan Green          21    2    5    1   0   1/2    50.0     0/0   0.0
Damian Ginobili        32    0    0    1   0   0/1     0.0     0/0   0.0
Vince Lillard          27    0    1    0   0   0/1     0.0     0/0   0.0
Larry Wade             27    0    2    0   0   0/0     0.0     0/0   0.0
Larry James            32    0    0    0   0   0/1     0.0     0/0   0.0
Jarrett Fox            21    0    2    1   0   0/2     0.0     0/0   0.0
Ja Rose                17    0    1    0   0   0/1     0.0     0/0   0.0
Manu Johnson           17    0    0    0   0   0/2     0.0     0/0   0.0

TEAM: FG: 8/20 (40.0%), 3PT: 2/10 (20.0%), REB: 13 (5 off, 8 def), AST: 4, TO: 1
TEAM FOULS: 5 [Team_073 in BONUS]

================================================================================

================================================================================
                               FULL GAME COMPLETE                               
================================================================================

FINAL SCORE: Team_073 97, Team_099 98

SCORING BY QUARTER:
--------------------------------------------------------------------------------
Team                     Q1     Q2     Q3     Q4    FINAL
--------------------------------------------------------------------------------
Team_073                 34     15     23     25       97
Team_099                 36     21     23     18       98
--------------------------------------------------------------------------------

FULL GAME BOX SCORE:
================================================================================

Team_073
--------------------------------------------------------------------------------
Player                MIN  PTS  REB  AST  TO      FG   FG%      3P   3P%      FT STL BLK
--------------------------------------------------------------------------------
Isaiah Smith           32   12    3    4   0   6/9    66.7   1/2    50.0   1/1     1   2
Karl Williamson        32    9    0    4   2   4/8    50.0   1/3    33.3   6/6     0   0
Carmelo Porzingis      32   19   18    1   3   8/12   66.7   1/4    25.0   2/2     0   0
Bradley Morant         32   15    7    2   1   6/9    66.7   0/0     0.0   5/6     1   0
Carmelo Young          27   12    0    3   2   4/6    66.7   1/3    33.3   3/3     1   0
Zach Quickley          21    7    0    1   1   2/7    28.6   1/2    50.0   0/0     0   2
Luka Butler            17    5    0    2   0   2/7    28.6   1/3    33.3   0/0     0   1
Dwyane McCollum        17    8    7    2   1   3/6    50.0   1/3    33.3   1/1     0   0
Shai Thompson          17    2    7    1   1   1/5    20.0   0/0     0.0   0/0     0   0
Ja Rose                17    4    5    0   1   3/5    60.0   1/1   100.0   4/6     0   0

TEAM: FG: 40/75 (53.3%), 3PT: 8/21 (38.1%), REB: 47 (12 off, 35 def), AST: 20, TO: 12


Team_099
--------------------------------------------------------------------------------
Player                MIN  PTS  REB  AST  TO      FG   FG%      3P   3P%      FT STL BLK
--------------------------------------------------------------------------------
Ayo Barrett            32   25    0    3   2  10/15   66.7   3/7    42.9   3/3     0   1
Larry James            32    4    0    2   1   1/4    25.0   0/2     0.0   2/2     1   0
Damian Ginobili        32   10    8    4   1   5/8    62.5   2/3    66.7   0/0     1   0
Vince Lillard          27   16    7    5   1   7/12   58.3   1/4    25.0   4/5     0   1
Larry Wade             27   11    7    2   0   5/7    71.4   1/2    50.0   0/1     0   0
Donovan Green          21    6   12    1   1   2/6    33.3   0/2     0.0   2/2     0   0
Jarrett Fox            21    8    7    1   2   3/7    42.9   0/0     0.0   2/3     0   1
CJ Cunningham          17    8    0    0   0   4/9    44.4   0/2     0.0   0/0     0   0
Manu Johnson           17    0    0    0   0   0/4     0.0   0/4     0.0   0/0     0   2
Scottie Quickley       17    5    4    2   0   2/4    50.0   1/3    33.3   3/3     1   0

TEAM: FG: 40/77 (51.9%), 3PT: 8/29 (27.6%), REB: 45 (13 off, 32 def), AST: 20, TO: 8

================================================================================
