================================================================================
                        FULL GAME - Team_064 vs Team_017                        
================================================================================

================================================================================
                       1ST QUARTER - Team_064 vs Team_017                       
================================================================================

[12:00] Team_064 possession (Score: 0-0)
Jordan Mitchell attempts a 3Pt. Contested by Vince Banchero (3.6 feet, MAN). Jordan Mitchell misses. Rebound secured by Kyrie Middleton.

[11:45] Team_017 possession (Score: 0-0)
Vince Banchero attempts a 3Pt. Contested by Jordan Mitchell (3.8 feet, MAN). Vince Banchero misses. Rebound secured by Russell Simons.

[11:30] Team_064 possession (Score: 0-0)
Russell Simons attempts a 3Pt. Contested by Desmond Reaves (4.1 feet, ZONE). Russell Simons misses. Rebound secured by Tony Smith.

[11:17] Team_017 possession (Score: 0-0)
Desmond Reaves attempts a Midrange. Contested by Ja Mitchell (5.6 feet, ZONE). Desmond Reaves misses. Rebound secured by Shai Hyland.

[11:03] Team_064 possession (Score: 0-0)
Jordan Mitchell attempts a 3Pt. Contested by Desmond Reaves (3.6 feet, ZONE). Jordan Mitchell misses. Rebound secured by Tony Smith.

[10:45] Team_017 possession (Score: 0-0)
FOUL! Reach-in foul on Russell Simons during the drive. [Team fouls: 1] No free throws, side out. (Russell Simons: 1 personal fouls)

[10:29] Team_017 possession (Score: 0-0)
Kyrie Middleton drives to the basket... Kyrie Middleton throws a bad pass out of bounds! TURNOVER! (dead ball)

[10:15] Team_064 possession (Score: 0-0)
FOUL! Reach-in foul on Tony Smith during the drive. [Team fouls: 1] No free throws, side out. (Tony Smith: 1 personal fouls)

[10:00] Team_064 possession (Score: 0-0)
Ja Mitchell attempts a 3Pt. Contested by Desmond Reaves (4.3 feet, MAN). Ja Mitchell misses. Rebound secured by Kyrie Middleton.

[09:41] Team_017 possession (Score: 0-0)
Vince Banchero makes the Dunk and draws the foul on Russell Simons! And-1! Vince Banchero to the line for 1. [Team fouls: 2] (Russell Simons: 2 personal fouls)   FT 1/1: GOOD Vince Banchero makes 1/1 from the line.
Score: 0-3

[09:27] Team_064 possession (Score: 0-3)
Shai Hyland drives and kicks out. Kawhi Irving attempts a 3Pt. Contested by Vince Banchero (4.0 feet, ZONE). Kawhi Irving misses. Offensive rebound by Kawhi Irving! Kawhi Irving kicks it out.

[09:14] Team_064 possession (Score: 0-3)
Ja Mitchell attempts a 3Pt. Contested by Desmond Reaves (4.3 feet, ZONE). Ja Mitchell misses. Rebound secured by Kyrie Middleton.

[09:02] Team_017 possession (Score: 0-3)
Vince Banchero attempts a 3Pt. Contested by Ja Mitchell (5.1 feet, ZONE). Vince Banchero misses. Rebound secured by Shai Hyland.

[08:52] Team_064 possession (Score: 0-3)
Shai Hyland drives and kicks out. Kawhi Irving attempts a 3Pt. Contested by Tony Smith (2.7 feet, MAN). Kawhi Irving misses. Rebound secured by Tony Smith.

[08:34] Team_017 possession (Score: 0-3)
Vince Banchero attempts a Layup. Contested by Russell Simons (3.2 feet, ZONE). VINCE BANCHERO MAKES IT! Assist: Bam Williamson
Score: 0-5

[08:18] Team_064 possession (Score: 0-5)
Ja Mitchell makes the Layup and draws the foul on Desmond Reaves! And-1! Ja Mitchell to the line for 1. [Team fouls: 2] (Desmond Reaves: 1 personal fouls)   FT 1/1: GOOD Ja Mitchell makes 1/1 from the line.
Score: 3-5

[08:08] Team_017 possession (Score: 3-5)
Desmond Reaves attempts a 3Pt. Contested by Ja Mitchell (5.6 feet, ZONE). DESMOND REAVES MAKES IT! Assist: Tony Smith
Score: 3-8

[07:53] Team_064 possession (Score: 3-8)
Ja Mitchell attempts a 3Pt. Contested by Desmond Reaves (4.3 feet, ZONE). JA MITCHELL MAKES IT! Assist: Jordan Mitchell
Score: 6-8

[07:34] Team_017 possession (Score: 6-8)
Desmond Reaves attempts a 3Pt. Contested by Jordan Mitchell (4.3 feet, ZONE). DESMOND REAVES MAKES IT! Assist: Vince Banchero
Score: 6-11

[07:15] Team_064 possession (Score: 6-11)
FOUL! Holding foul on Vince Banchero. [Team fouls: 3] No free throws, side out. (Vince Banchero: 1 personal fouls)

[06:59] Team_064 possession (Score: 6-11)
Jordan Mitchell drives, Bam Williamson stays with him. Jordan Mitchell attempts a Layup. Contested by Bam Williamson (3.6 feet, ZONE). Jordan Mitchell misses. Rebound secured by Bam Williamson.

[06:45] Team_017 possession (Score: 6-11)
Vince Banchero attempts a 3Pt. Contested by Jordan Mitchell (3.8 feet, MAN). Vince Banchero misses. Rebound secured by Kawhi Irving.

[06:32] Team_064 possession (Score: 6-11)
FOUL! Reach-in foul on Bam Williamson during the drive. [Team fouls: 4] No free throws, side out. (Bam Williamson: 1 personal fouls)

[06:18] Team_064 possession (Score: 6-11)
Jordan Mitchell attempts a 3Pt. Contested by Vince Banchero (3.6 feet, MAN). Jordan Mitchell misses. Rebound secured by Bam Williamson.

[06:00] Team_017 possession (Score: 6-11)
Desmond Reaves attempts a Layup. BLOCKED BY SHAI HYLAND! Ball deflects out of bounds off Desmond Reaves.

[05:41] Team_064 possession (Score: 6-11)
Russell Simons attempts a 3Pt. Contested by Desmond Reaves (4.1 feet, ZONE). Russell Simons misses. Rebound secured by Tony Smith.

[05:25] Team_017 possession (Score: 6-11)
Vince Banchero attempts a 3Pt. Contested by Russell Simons (3.2 feet, ZONE). Vince Banchero misses. Rebound secured by Russell Simons.

[05:13] Team_064 possession (Score: 6-11)
Ja Mitchell attempts a 3Pt. Contested by Tony Smith (3.0 feet, ZONE). JA MITCHELL MAKES IT! Assist: Kawhi Irving
Score: 9-11

[04:56] Team_017 possession (Score: 9-11)
Tony Smith attempts a Midrange. Contested by Kawhi Irving (4.9 feet, MAN). Tony Smith misses. Rebound secured by Shai Hyland.

[04:43] Team_064 possession (Score: 9-11)
FOUL! Shooting foul on Kyrie Middleton. Russell Simons to the line for 2 free throws. [BONUS: 5 team fouls] (Kyrie Middleton: 1 personal fouls)   FT 1/2: GOOD   FT 2/2: GOOD Russell Simons makes 2/2 from the line.
Score: 11-11

[04:24] Team_017 possession (Score: 11-11)
FOUL! Shooting foul on Shai Hyland. Tony Smith to the line for 2 free throws. [Team fouls: 3] (Shai Hyland: 1 personal fouls)   FT 1/2: GOOD   FT 2/2: GOOD Tony Smith makes 2/2 from the line.
Score: 11-13

[04:10] Team_064 possession (Score: 11-13)
FOUL! Shooting foul on Tony Smith. Jordan Mitchell to the line for 2 free throws. [BONUS: 6 team fouls] (Tony Smith: 2 personal fouls)   FT 1/2: GOOD   FT 2/2: GOOD Jordan Mitchell makes 2/2 from the line.
Score: 13-13

[03:56] Team_017 possession (Score: 13-13)
Desmond Reaves attempts a 3Pt. Contested by Ja Mitchell (5.7 feet, MAN). DESMOND REAVES MAKES IT! Assist: Tony Smith
Score: 13-16

[03:38] Team_064 possession (Score: 13-16)
Jordan Mitchell attempts a 3Pt. Contested by Vince Banchero (3.7 feet, MAN). Jordan Mitchell misses. Rebound secured by Tony Smith.

[03:25] Team_017 possession (Score: 13-16)
Tony Smith attempts a 3Pt. Contested by Ja Mitchell (5.8 feet, ZONE). Tony Smith misses. Rebound secured by Russell Simons.

[03:13] Team_064 possession (Score: 13-16)
Jordan Mitchell drives, Bam Williamson stays with him. Jordan Mitchell attempts a Dunk. Contested by Bam Williamson (3.8 feet, ZONE). Jordan Mitchell misses. Rebound secured by Kyrie Middleton.

[02:58] Team_017 possession (Score: 13-16)
Bam Williamson drives, Russell Simons stays with him. Bam Williamson attempts a Dunk. Contested by Russell Simons (4.2 feet, ZONE). BAM WILLIAMSON MAKES IT! Assist: Vince Banchero
Score: 13-18

[02:48] Team_064 possession (Score: 13-18)
Russell Simons attempts a Midrange. Contested by Kyrie Middleton (5.3 feet, MAN). Russell Simons misses. Rebound secured by Kyrie Middleton.

[02:37] Team_017 possession (Score: 13-18)
Tony Smith attempts a 3Pt. BLOCKED BY JA MITCHELL! Ball is loose! Rebound secured by Shai Hyland.

[02:26] Team_064 possession (Score: 13-18)
FOUL! Shooting foul on Tony Smith. Shai Hyland to the line for 2 free throws. [BONUS: 7 team fouls] (Tony Smith: 3 personal fouls)   FT 1/2: MISS   FT 2/2: GOOD Shai Hyland makes 1/2 from the line.
Score: 14-18

[02:16] Team_017 possession (Score: 14-18)
Desmond Reaves drives and kicks out. Kyrie Middleton attempts a Midrange. Contested by Russell Simons (3.7 feet, MAN). KYRIE MIDDLETON MAKES IT! Assist: Bam Williamson
Score: 14-20

[02:03] Team_064 possession (Score: 14-20)
Ja Mitchell attempts a 3Pt. Contested by Desmond Reaves (4.6 feet, MAN). Ja Mitchell misses. Offensive rebound by Kawhi Irving! Kawhi Irving kicks it out.

[01:48] Team_064 possession (Score: 14-20)
Jordan Mitchell attempts a 3Pt. Contested by Tony Smith (2.6 feet, ZONE). Jordan Mitchell misses. Offensive rebound by Russell Simons! Russell Simons kicks it out.

[01:37] Team_064 possession (Score: 14-20)
Kawhi Irving attempts a 3Pt. Contested by Desmond Reaves (4.3 feet, ZONE). Kawhi Irving misses. Rebound secured by Bam Williamson.

[01:26] Team_017 possession (Score: 14-20)
Desmond Reaves attempts a 3Pt. Contested by Ja Mitchell (5.9 feet, MAN). Desmond Reaves misses. Rebound secured by Shai Hyland.

[01:12] Team_064 possession (Score: 14-20)
Kawhi Irving attempts a 3Pt. Contested by Tony Smith (3.1 feet, ZONE). Kawhi Irving misses. Rebound secured by Bam Williamson.

[00:59] Team_017 possession (Score: 14-20)
Bam Williamson drives and kicks out. Vince Banchero attempts a 3Pt. Contested by Jordan Mitchell (4.4 feet, MAN). Vince Banchero misses. Rebound secured by Shai Hyland.

[00:49] Team_064 possession (Score: 14-20)
Russell Simons attempts a Midrange. Contested by Kyrie Middleton (5.5 feet, ZONE). Russell Simons misses. Offensive rebound by Russell Simons! Russell Simons kicks it out.

[00:31] Team_064 possession (Score: 14-20)
Ja Mitchell attempts a 3Pt. Contested by Desmond Reaves (4.8 feet, MAN). Ja Mitchell misses. Offensive rebound by Kawhi Irving! Kawhi Irving kicks it out.

[00:19] Team_064 possession (Score: 14-20)
Ja Mitchell drives and kicks out. FOUL! Shooting foul on Kyrie Middleton. Kawhi Irving to the line for 2 free throws. [BONUS: 8 team fouls] (Kyrie Middleton: 2 personal fouls)   FT 1/2: GOOD   FT 2/2: GOOD Kawhi Irving makes 2/2 from the line.
Score: 16-20

[00:07] Team_017 possession (Score: 16-20)
FOUL! Reach-in foul on Shai Hyland during the drive. [Team fouls: 4] No free throws, side out. (Shai Hyland: 2 personal fouls)

================================================================================
                              1ST QUARTER COMPLETE                              
================================================================================

1ST QUARTER SCORE: Team_064 16, Team_017 20

BOX SCORE:
================================================================================

Team_064
--------------------------------------------------------------------------------
Player                MIN  PTS  REB  AST  TO      FG   FG%      3P   3P%
--------------------------------------------------------------------------------
Ja Mitchell            12    9    0    0   0   3/5    60.0     0/0   0.0
Jordan Mitchell        12    2    0    1   0   1/7    14.3     0/0   0.0
Russell Simons         12    2    5    0   0   1/4    25.0     0/0   0.0
Kawhi Irving           12    2    4    1   0   1/3    33.3     0/0   0.0
Shai Hyland            12    1    6    0   0   1/2    50.0     0/0   0.0

TEAM: FG: 7/21 (33.3%), 3PT: 2/12 (16.7%), REB: 15 (5 off, 10 def), AST: 2, TO: 0
TEAM FOULS: 4


Team_017
--------------------------------------------------------------------------------
Player                MIN  PTS  REB  AST  TO      FG   FG%      3P   3P%
--------------------------------------------------------------------------------
Desmond Reaves         12    9    0    0   0   3/6    50.0     0/0   0.0
Vince Banchero         12    5    0    2   0   2/6    33.3     0/0   0.0
Kyrie Middleton        12    2    5    0   0   1/1   100.0     0/0   0.0
Tony Smith             12    2    5    2   0   1/4    25.0     0/0   0.0
Bam Williamson         12    2    4    2   0   1/2    50.0     0/0   0.0

TEAM: FG: 8/19 (42.1%), 3PT: 3/10 (30.0%), REB: 14 (0 off, 14 def), AST: 6, TO: 1
TEAM FOULS: 8 [Team_064 in BONUS]

================================================================================

================================================================================
                       2ND QUARTER - Team_064 vs Team_017                       
================================================================================

[12:00] Team_064 possession (Score: 16-20)
Jordan Mitchell attempts a 3Pt. Contested by Tony Smith (2.6 feet, ZONE). Jordan Mitchell misses. Rebound secured by Bam Williamson.

[11:46] Team_017 possession (Score: 16-20)
Vince Banchero attempts a 3Pt. Contested by Ja Mitchell (5.5 feet, ZONE). VINCE BANCHERO MAKES IT! Assist: Tony Smith
Score: 16-23

[11:31] Team_064 possession (Score: 16-23)
Ja Mitchell attempts a 3Pt. Contested by Tony Smith (3.4 feet, ZONE). Ja Mitchell misses. Offensive rebound by Kawhi Irving! Kawhi Irving kicks it out.

[11:12] Team_064 possession (Score: 16-23)
Shai Hyland attempts a 3Pt. Contested by Bam Williamson (4.8 feet, MAN). Shai Hyland misses. Rebound secured by Tony Smith.

[10:58] Team_017 possession (Score: 16-23)
Tony Smith drives, Russell Simons stays with him. Tony Smith attempts a Dunk. Contested by Russell Simons (4.4 feet, ZONE). Tony Smith misses. Rebound secured by Shai Hyland.

[10:41] Team_064 possession (Score: 16-23)
FOUL! Holding foul on Desmond Reaves. [Team fouls: 1] No free throws, side out. (Desmond Reaves: 1 personal fouls)

[10:26] Team_064 possession (Score: 16-23)
Shai Hyland attempts a Midrange. Contested by Bam Williamson (4.9 feet, MAN). SHAI HYLAND MAKES IT!
Score: 18-23

[10:13] Team_017 possession (Score: 18-23)
Vince Banchero attempts a 3Pt. Contested by Ja Mitchell (5.6 feet, ZONE). Vince Banchero misses. Rebound secured by Shai Hyland.

[10:01] Team_064 possession (Score: 18-23)
Ja Mitchell attempts a 3Pt. Contested by Desmond Reaves (4.8 feet, MAN). Ja Mitchell misses. Rebound secured by Tony Smith.

[09:45] Team_017 possession (Score: 18-23)
Kyrie Middleton attempts a Layup. BLOCKED BY SHAI HYLAND! Ball is loose! Offensive rebound by Kyrie Middleton! Kyrie Middleton kicks it out.

[09:26] Team_017 possession (Score: 18-23)
FOUL! Holding foul on Jordan Mitchell. [Team fouls: 1] No free throws, side out. (Jordan Mitchell: 1 personal fouls)

[09:14] Team_017 possession (Score: 18-23)
Desmond Reaves attempts a 3Pt. Wide open! Ja Mitchell is 6.1 feet away. [MAN] Desmond Reaves misses. Offensive rebound by Bam Williamson! Bam Williamson puts it back in!
Score: 18-25

[08:59] Team_064 possession (Score: 18-25)
Ja Mitchell attempts a 3Pt. Contested by Tony Smith (3.7 feet, ZONE). Ja Mitchell misses. Offensive rebound by Russell Simons! Russell Simons kicks it out.

[08:46] Team_064 possession (Score: 18-25)
Kawhi Irving commits a violation (traveling/carry)! TURNOVER! (dead ball)

[08:46] Substitution (Team_064): Ja Mitchell OUT → CJ Haliburton IN (stamina_rule2)

[08:46] Substitution (Team_064): Jordan Mitchell OUT → Ja Simmons IN (stamina_rule2)

[08:46] Substitution (Team_064): Kawhi Irving OUT → Tobias Herro IN (stamina_rule2)

[08:46] Substitution (Team_064): Russell Simons OUT → Austin Smith IN (stamina_rule2)

[08:46] Substitution (Team_064): Shai Hyland OUT → Devin Cunningham IN (stamina_rule2)

[08:46] Substitution (Team_017): Desmond Reaves OUT → Blake Reaves IN (stamina_rule2)

[08:46] Substitution (Team_017): Vince Banchero OUT → Tobias Bridges IN (stamina_rule2)

[08:46] Substitution (Team_017): Tony Smith OUT → Shaquille Stewart IN (stamina_rule2)

[08:46] Substitution (Team_017): Kyrie Middleton OUT → Ja Stewart IN (stamina_rule2)

[08:46] Substitution (Team_017): Bam Williamson OUT → Klay Holiday IN (stamina_rule2)

[08:33] Team_017 possession (Score: 18-25)
Shaquille Stewart attempts a Layup. Wide open! Tobias Herro is 6.4 feet away. [MAN] SHAQUILLE STEWART MAKES IT!
Score: 18-27

[08:18] Team_064 possession (Score: 18-27)
CJ Haliburton makes the 3Pt and draws the foul on Blake Reaves! And-1! CJ Haliburton to the line for 1. [Team fouls: 2] (Blake Reaves: 1 personal fouls)   FT 1/1: GOOD CJ Haliburton makes 1/1 from the line.
Score: 22-27

[08:05] Team_017 possession (Score: 22-27)
Tobias Bridges attempts a 3Pt. Contested by Austin Smith (4.7 feet, ZONE). Tobias Bridges misses. Offensive rebound by Shaquille Stewart! Shaquille Stewart kicks it out.

[07:52] Team_017 possession (Score: 22-27)
Tobias Bridges attempts a Layup. Contested by Ja Simmons (5.7 feet, MAN). TOBIAS BRIDGES MAKES IT!
Score: 22-29

[07:41] Team_064 possession (Score: 22-29)
CJ Haliburton drives, Ja Stewart stays with him. CJ Haliburton attempts a Layup. Contested by Ja Stewart (5.0 feet, ZONE). CJ HALIBURTON MAKES IT! Assist: Tobias Herro
Score: 24-29

[07:29] Team_017 possession (Score: 24-29)
Ja Stewart throws a bad pass! Stolen by Austin Smith! TURNOVER! (live ball)

[07:15] Team_064 possession (Score: 24-29)
Austin Smith drives to the basket... Austin Smith throws a bad pass! Stolen by Ja Stewart! TURNOVER! (live ball)

[06:57] Team_017 possession (Score: 24-29)
Ja Stewart attempts a Midrange. Contested by Austin Smith (4.2 feet, ZONE). Ja Stewart misses. Offensive rebound by Ja Stewart! Ja Stewart kicks it out.

[06:44] Team_017 possession (Score: 24-29)
Tobias Bridges drives and kicks out. Ja Stewart attempts a 3Pt. Contested by Austin Smith (4.6 feet, MAN). Ja Stewart misses. Rebound secured by Ja Simmons.

[06:32] Team_064 possession (Score: 24-29)
FOUL! Shooting foul on Ja Stewart. Austin Smith to the line for 2 free throws. [Team fouls: 3] (Ja Stewart: 1 personal fouls)   FT 1/2: GOOD   FT 2/2: GOOD Austin Smith makes 2/2 from the line.
Score: 26-29

[06:14] Team_017 possession (Score: 26-29)
Shaquille Stewart attempts a Midrange. Wide open! Tobias Herro is 6.4 feet away. [MAN] SHAQUILLE STEWART MAKES IT! Assist: Ja Stewart
Score: 26-31

[06:01] Team_064 possession (Score: 26-31)
Ja Simmons throws a bad pass! Stolen by Tobias Bridges! TURNOVER! (live ball)

[05:42] Team_017 possession (Score: 26-31)
Blake Reaves attempts a 3Pt. Contested by CJ Haliburton (5.9 feet, MAN). BLAKE REAVES MAKES IT! Assist: Shaquille Stewart
Score: 26-34

[05:27] Team_064 possession (Score: 26-34)
Tobias Herro attempts a 3Pt. Contested by Ja Stewart (4.2 feet, ZONE). Tobias Herro misses. Rebound secured by Shaquille Stewart.

[05:09] Team_017 possession (Score: 26-34)
Blake Reaves attempts a 3Pt. Contested by CJ Haliburton (5.9 feet, MAN). Blake Reaves misses. FOUL! Loose ball foul on Devin Cunningham during the rebound battle. [Team fouls: 2] No free throws, side out. (Devin Cunningham: 1 personal fouls)

[04:55] Team_017 possession (Score: 26-34)
Blake Reaves attempts a 3Pt. Contested by CJ Haliburton (5.9 feet, MAN). Blake Reaves misses. Rebound secured by Devin Cunningham.

[04:44] Team_064 possession (Score: 26-34)
Tobias Herro attempts a 3Pt. Contested by Shaquille Stewart (3.9 feet, ZONE). TOBIAS HERRO MAKES IT! Assist: Ja Simmons
Score: 29-34

[04:33] Team_017 possession (Score: 29-34)
Tobias Bridges attempts a 3Pt. Contested by Ja Simmons (5.7 feet, MAN). Tobias Bridges misses. Rebound secured by Ja Simmons.

[04:20] Team_064 possession (Score: 29-34)
CJ Haliburton drives, Blake Reaves stays with him. CJ Haliburton attempts a Dunk. Contested by Blake Reaves (5.5 feet, MAN). CJ HALIBURTON MAKES IT! Assist: Tobias Herro
Score: 31-34

[04:05] Team_017 possession (Score: 31-34)
FOUL! Shooting foul on Devin Cunningham. Klay Holiday to the line for 2 free throws. [Team fouls: 3] (Devin Cunningham: 2 personal fouls)   FT 1/2: MISS   FT 2/2: GOOD Klay Holiday makes 1/2 from the line.
Score: 31-35

[03:50] Team_064 possession (Score: 31-35)
Devin Cunningham attempts a 3Pt. Contested by Klay Holiday (4.9 feet, MAN). Devin Cunningham misses. Rebound secured by Shaquille Stewart.

[03:33] Team_017 possession (Score: 31-35)
Shaquille Stewart attempts a 3Pt. Contested by Austin Smith (4.9 feet, ZONE). Shaquille Stewart misses. Rebound secured by Austin Smith.

[03:15] Team_064 possession (Score: 31-35)
Tobias Herro attempts a Layup. BLOCKED BY JA STEWART! Ball deflects out of bounds off Tobias Herro.

[02:58] Team_017 possession (Score: 31-35)
FOUL! Shooting foul on Austin Smith. Ja Stewart to the line for 2 free throws. [Team fouls: 4] (Austin Smith: 1 personal fouls)   FT 1/2: MISS   FT 2/2: GOOD Ja Stewart makes 1/2 from the line.
Score: 31-36

[02:41] Team_064 possession (Score: 31-36)
CJ Haliburton attempts a 3Pt. Contested by Tobias Bridges (4.3 feet, ZONE). CJ Haliburton misses. Rebound secured by Shaquille Stewart.

[02:27] Team_017 possession (Score: 31-36)
Ja Stewart attempts a 3Pt. Contested by Austin Smith (4.2 feet, MAN). Ja Stewart misses. Rebound secured by Ja Simmons.

[02:11] Team_064 possession (Score: 31-36)
Ja Simmons drives, Ja Stewart stays with him. Ja Simmons attempts a Layup. Contested by Ja Stewart (4.6 feet, ZONE). JA SIMMONS MAKES IT! Assist: Austin Smith
Score: 33-36

[01:54] Team_017 possession (Score: 33-36)
Ja Stewart attempts a Midrange. Contested by Austin Smith (4.2 feet, MAN). JA STEWART MAKES IT!
Score: 33-38

[01:38] Team_064 possession (Score: 33-38)
Devin Cunningham attempts a Midrange. Contested by Blake Reaves (5.1 feet, ZONE). DEVIN CUNNINGHAM MAKES IT! Assist: Austin Smith
Score: 35-38

[01:21] Team_017 possession (Score: 35-38)
Tobias Bridges makes the Dunk and draws the foul on Ja Simmons! And-1! Tobias Bridges to the line for 1. [BONUS: 5 team fouls] (Ja Simmons: 1 personal fouls)   FT 1/1: GOOD Tobias Bridges makes 1/1 from the line.
Score: 35-41

[01:05] Team_064 possession (Score: 35-41)
CJ Haliburton attempts a 3Pt. Contested by Tobias Bridges (4.4 feet, ZONE). CJ Haliburton misses. Offensive rebound by Ja Simmons! Ja Simmons kicks it out.

[00:51] Team_064 possession (Score: 35-41)
Devin Cunningham drives, picks up Klay Holiday. Help arrives from Tobias Bridges! Devin Cunningham attempts a Layup. Contested by Tobias Bridges (5.0 feet, MAN). DEVIN CUNNINGHAM MAKES IT! Assist: Tobias Herro
Score: 37-41

[00:37] Team_017 possession (Score: 37-41)
Blake Reaves drives and kicks out. Shaquille Stewart attempts a Midrange. Wide open! Tobias Herro is 6.1 feet away. [MAN] Shaquille Stewart misses. Rebound secured by Devin Cunningham.

[00:25] Team_064 possession (Score: 37-41)
Ja Simmons attempts a 3Pt. Contested by Tobias Bridges (4.0 feet, ZONE). JA SIMMONS MAKES IT! Assist: Devin Cunningham
Score: 40-41

[00:08] Team_017 possession (Score: 40-41)
Klay Holiday attempts a Layup. Contested by Austin Smith (4.9 feet, ZONE). Klay Holiday misses. Rebound secured by Devin Cunningham.

================================================================================
                              2ND QUARTER COMPLETE                              
================================================================================

2ND QUARTER SCORE: Team_064 24, Team_017 21

BOX SCORE:
================================================================================

Team_064
--------------------------------------------------------------------------------
Player                MIN  PTS  REB  AST  TO      FG   FG%      3P   3P%
--------------------------------------------------------------------------------
CJ Haliburton           9    8    0    0   0   3/4    75.0     0/0   0.0
Ja Simmons              9    5    4    1   0   2/2   100.0     0/0   0.0
Devin Cunningham        9    4    3    1   0   2/3    66.7     0/0   0.0
Tobias Herro            9    3    0    3   0   1/3    33.3     0/0   0.0
Shai Hyland            16    2    2    0   0   1/2    50.0     0/0   0.0
Austin Smith            9    2    1    2   0   1/1   100.0     0/0   0.0
Jordan Mitchell        16    0    0    0   0   0/1     0.0     0/0   0.0
Kawhi Irving           16    0    1    0   0   0/0     0.0     0/0   0.0
Ja Mitchell            16    0    0    0   0   0/1     0.0     0/0   0.0
Russell Simons         16    0    1    0   0   0/0     0.0     0/0   0.0

TEAM: FG: 10/17 (58.8%), 3PT: 3/9 (33.3%), REB: 12 (3 off, 9 def), AST: 7, TO: 3
TEAM FOULS: 5 [Team_017 in BONUS]


Team_017
--------------------------------------------------------------------------------
Player                MIN  PTS  REB  AST  TO      FG   FG%      3P   3P%
--------------------------------------------------------------------------------
Tobias Bridges          9    5    0    0   0   2/4    50.0     0/0   0.0
Shaquille Stewart       9    4    4    1   0   2/3    66.7     0/0   0.0
Vince Banchero         16    3    0    0   0   1/2    50.0     0/0   0.0
Ja Stewart              9    3    2    1   0   2/3    66.7     0/0   0.0
Blake Reaves            9    3    0    0   0   1/3    33.3     0/0   0.0
Bam Williamson         16    2    2    0   0   1/1   100.0     0/0   0.0
Klay Holiday            9    1    0    0   0   1/2    50.0     0/0   0.0
Tony Smith             16    0    2    1   0   0/1     0.0     0/0   0.0
Kyrie Middleton        16    0    1    0   0   0/0     0.0     0/0   0.0

TEAM: FG: 10/19 (52.6%), 3PT: 3/8 (37.5%), REB: 11 (5 off, 6 def), AST: 3, TO: 1
TEAM FOULS: 3

================================================================================

================================================================================
                       3RD QUARTER - Team_064 vs Team_017                       
================================================================================

[12:00] Team_064 possession (Score: 40-41)
Shai Hyland drives and kicks out. Russell Simons attempts a Midrange. Contested by Vince Banchero (4.0 feet, ZONE). Russell Simons misses. Rebound secured by Tony Smith.

[11:48] Team_017 possession (Score: 40-41)
Kyrie Middleton drives and kicks out. Tony Smith attempts a Midrange. Contested by Kawhi Irving (4.3 feet, MAN). Tony Smith misses. Offensive rebound by Kyrie Middleton! Kyrie Middleton kicks it out.

[11:33] Team_017 possession (Score: 40-41)
Bam Williamson attempts a 3Pt. Contested by Ja Mitchell (5.9 feet, ZONE). BAM WILLIAMSON MAKES IT! Assist: Kyrie Middleton
Score: 40-44

[11:17] Team_064 possession (Score: 40-44)
Shai Hyland drives and kicks out. Ja Mitchell attempts a Midrange. Contested by Desmond Reaves (4.0 feet, MAN). Ja Mitchell misses. Rebound secured by Bam Williamson.

[11:01] Team_017 possession (Score: 40-44)
FOUL! Holding foul on Jordan Mitchell. [Team fouls: 1] No free throws, side out. (Jordan Mitchell: 1 personal fouls)

[10:46] Team_017 possession (Score: 40-44)
Vince Banchero drives to the basket... Vince Banchero commits a violation (traveling/carry)! TURNOVER! (dead ball)

[10:36] Team_064 possession (Score: 40-44)
Russell Simons attempts a Midrange. Contested by Kyrie Middleton (5.1 feet, MAN). Russell Simons misses. Offensive rebound by Kawhi Irving! Kawhi Irving kicks it out.

[10:18] Team_064 possession (Score: 40-44)
Shai Hyland attempts a Midrange. Contested by Bam Williamson (4.4 feet, MAN). Shai Hyland misses. Rebound secured by Kyrie Middleton.

[10:02] Team_017 possession (Score: 40-44)
FOUL! Holding foul on Jordan Mitchell. [Team fouls: 2] No free throws, side out. (Jordan Mitchell: 2 personal fouls)

[09:48] Team_017 possession (Score: 40-44)
Vince Banchero attempts a 3Pt. Contested by Jordan Mitchell (3.8 feet, MAN). Vince Banchero misses. Rebound secured by Russell Simons.

[09:33] Team_064 possession (Score: 40-44)
FOUL! Holding foul on Bam Williamson. [Team fouls: 1] No free throws, side out. (Bam Williamson: 1 personal fouls)

[09:17] Team_064 possession (Score: 40-44)
FOUL! Shooting foul on Bam Williamson. Kawhi Irving to the line for 2 free throws. [Team fouls: 2] (Bam Williamson: 2 personal fouls)   FT 1/2: GOOD   FT 2/2: GOOD Kawhi Irving makes 2/2 from the line.
Score: 42-44

[09:02] Team_017 possession (Score: 42-44)
Vince Banchero attempts a Layup. BLOCKED BY JORDAN MITCHELL! Ball is loose! Rebound secured by Kawhi Irving.

[08:47] Team_064 possession (Score: 42-44)
Kawhi Irving drives to the basket... Kawhi Irving loses control! Ball rolls out of bounds! TURNOVER! (dead ball)

[08:34] Team_017 possession (Score: 42-44)
Kyrie Middleton loses control! Ball rolls out of bounds! TURNOVER! (dead ball)

[08:21] Team_064 possession (Score: 42-44)
Ja Mitchell loses the ball! Stripped by Desmond Reaves! TURNOVER! (live ball)

[08:10] Team_017 possession (Score: 42-44)
Bam Williamson attempts a Midrange. Contested by Shai Hyland (5.7 feet, MAN). Bam Williamson misses. Rebound secured by Shai Hyland.

[08:00] Team_064 possession (Score: 42-44)
Ja Mitchell commits a violation (traveling/carry)! TURNOVER! (dead ball)

[07:48] Team_017 possession (Score: 42-44)
Desmond Reaves attempts a 3Pt. Contested by Ja Mitchell (5.6 feet, ZONE). DESMOND REAVES MAKES IT! Assist: Kyrie Middleton
Score: 42-47

[07:37] Team_064 possession (Score: 42-47)
Ja Mitchell attempts a 3Pt. Contested by Desmond Reaves (4.3 feet, ZONE). JA MITCHELL MAKES IT! Assist: Kawhi Irving
Score: 45-47

[07:23] Team_017 possession (Score: 45-47)
Tony Smith attempts a 3Pt. Contested by Russell Simons (3.8 feet, ZONE). TONY SMITH MAKES IT! Assist: Bam Williamson
Score: 45-50

[07:07] Team_064 possession (Score: 45-50)
Ja Mitchell throws a bad pass! Stolen by Desmond Reaves! TURNOVER! (live ball)

[06:51] Team_017 possession (Score: 45-50)
Vince Banchero drives to the basket... Vince Banchero commits a violation (traveling/carry)! TURNOVER! (dead ball)

[06:33] Team_064 possession (Score: 45-50)
Russell Simons attempts a Layup. Contested by Bam Williamson (4.1 feet, ZONE). Russell Simons misses. Rebound secured by Kyrie Middleton.

[06:15] Team_017 possession (Score: 45-50)
Desmond Reaves attempts a 3Pt. Contested by Ja Mitchell (5.6 feet, ZONE). DESMOND REAVES MAKES IT! Assist: Vince Banchero
Score: 45-53

[06:00] Team_064 possession (Score: 45-53)
Kawhi Irving attempts a 3Pt. Contested by Desmond Reaves (3.9 feet, ZONE). Kawhi Irving misses. Rebound secured by Tony Smith.

[05:46] Team_017 possession (Score: 45-53)
Kyrie Middleton attempts a Midrange. Contested by Russell Simons (3.6 feet, MAN). Kyrie Middleton misses. Rebound secured by Kawhi Irving.

[05:30] Team_064 possession (Score: 45-53)
Shai Hyland attempts a 3Pt. Contested by Bam Williamson (4.4 feet, MAN). Shai Hyland misses. Rebound secured by Bam Williamson.

[05:11] Team_017 possession (Score: 45-53)
Tony Smith attempts a 3Pt. Contested by Kawhi Irving (4.9 feet, MAN). Tony Smith misses. Rebound secured by Shai Hyland.

[04:56] Team_064 possession (Score: 45-53)
Shai Hyland attempts a Layup. Contested by Bam Williamson (4.4 feet, ZONE). SHAI HYLAND MAKES IT! Assist: Kawhi Irving
Score: 47-53

[04:45] Team_017 possession (Score: 47-53)
Bam Williamson attempts a 3Pt. Contested by Shai Hyland (5.8 feet, MAN). Bam Williamson misses. Rebound secured by Russell Simons.

[04:30] Team_064 possession (Score: 47-53)
Shai Hyland attempts a Midrange. Contested by Bam Williamson (4.4 feet, MAN). SHAI HYLAND MAKES IT! Assist: Russell Simons
Score: 49-53

[04:16] Team_017 possession (Score: 49-53)
Kyrie Middleton drives and kicks out. Bam Williamson attempts a 3Pt. Contested by Ja Mitchell (5.2 feet, ZONE). BAM WILLIAMSON MAKES IT! Assist: Desmond Reaves
Score: 49-56

[03:59] Team_064 possession (Score: 49-56)
Russell Simons drives, picks up Kyrie Middleton. Help arrives from Vince Banchero! Russell Simons attempts a Dunk. Contested by Vince Banchero (5.2 feet, MAN). Russell Simons misses. Rebound secured by Kyrie Middleton.

[03:45] Team_017 possession (Score: 49-56)
Kyrie Middleton attempts a Midrange. Contested by Kawhi Irving (4.7 feet, ZONE). Kyrie Middleton misses. Offensive rebound by Kyrie Middleton! Kyrie Middleton kicks it out.

[03:31] Team_017 possession (Score: 49-56)
Kyrie Middleton attempts a Midrange. Contested by Jordan Mitchell (4.3 feet, ZONE). Kyrie Middleton misses. Rebound secured by Shai Hyland.

[03:17] Team_064 possession (Score: 49-56)
Ja Mitchell drives, Bam Williamson stays with him. Ja Mitchell attempts a Layup. Contested by Bam Williamson (4.5 feet, ZONE). Ja Mitchell misses. Offensive rebound by Russell Simons! Russell Simons kicks it out.

[03:00] Team_064 possession (Score: 49-56)
Ja Mitchell attempts a 3Pt. Contested by Desmond Reaves (4.5 feet, MAN). Ja Mitchell misses. Rebound secured by Bam Williamson.

[02:46] Team_017 possession (Score: 49-56)
Bam Williamson attempts a Midrange. Contested by Jordan Mitchell (4.8 feet, ZONE). Bam Williamson misses. Rebound secured by Russell Simons.

[02:28] Team_064 possession (Score: 49-56)
FOUL! Holding foul on Desmond Reaves. [Team fouls: 3] No free throws, side out. (Desmond Reaves: 1 personal fouls)

[02:14] Team_064 possession (Score: 49-56)
Russell Simons attempts a 3Pt. Contested by Desmond Reaves (4.4 feet, ZONE). Russell Simons misses. Rebound secured by Bam Williamson.

[01:58] Team_017 possession (Score: 49-56)
Bam Williamson attempts a Midrange. Wide open! Shai Hyland is 6.0 feet away. [MAN] Bam Williamson misses. Rebound secured by Kawhi Irving.

[01:48] Team_064 possession (Score: 49-56)
FOUL! Shooting foul on Desmond Reaves. Ja Mitchell to the line for 2 free throws. [Team fouls: 4] (Desmond Reaves: 2 personal fouls)   FT 1/2: MISS   FT 2/2: GOOD Ja Mitchell makes 1/2 from the line.
Score: 50-56

[01:34] Team_017 possession (Score: 50-56)
Desmond Reaves throws a bad pass out of bounds! TURNOVER! (dead ball)

[01:34] Substitution (Team_064): Ja Mitchell OUT → CJ Haliburton IN (stamina_rule2)

[01:34] Substitution (Team_064): Jordan Mitchell OUT → Ja Simmons IN (stamina_rule2)

[01:34] Substitution (Team_064): Kawhi Irving OUT → Tobias Herro IN (stamina_rule2)

[01:34] Substitution (Team_064): Russell Simons OUT → Austin Smith IN (stamina_rule2)

[01:34] Substitution (Team_064): Shai Hyland OUT → Devin Cunningham IN (stamina_rule2)

[01:34] Substitution (Team_017): Desmond Reaves OUT → Blake Reaves IN (stamina_rule2)

[01:34] Substitution (Team_017): Vince Banchero OUT → Tobias Bridges IN (stamina_rule2)

[01:34] Substitution (Team_017): Tony Smith OUT → Shaquille Stewart IN (stamina_rule2)

[01:34] Substitution (Team_017): Kyrie Middleton OUT → Ja Stewart IN (stamina_rule2)

[01:34] Substitution (Team_017): Bam Williamson OUT → Klay Holiday IN (stamina_rule2)

[01:20] Team_064 possession (Score: 50-56)
Tobias Herro attempts a 3Pt. Contested by Tobias Bridges (3.5 feet, ZONE). Tobias Herro misses. Rebound secured by Klay Holiday.

[01:06] Team_017 possession (Score: 50-56)
Ja Stewart attempts a 3Pt. Contested by Austin Smith (4.2 feet, ZONE). Ja Stewart misses. Rebound secured by Devin Cunningham.

[00:49] Team_064 possession (Score: 50-56)
CJ Haliburton attempts a Layup. Contested by Blake Reaves (5.5 feet, MAN). CJ HALIBURTON MAKES IT!
Score: 52-56

[00:33] Team_017 possession (Score: 52-56)
Shaquille Stewart drives to the basket... Shaquille Stewart throws a bad pass out of bounds! TURNOVER! (dead ball)

[00:20] Team_064 possession (Score: 52-56)
Devin Cunningham drives, Klay Holiday stays with him. Devin Cunningham attempts a Dunk. Contested by Klay Holiday (4.9 feet, MAN). DEVIN CUNNINGHAM MAKES IT!
Score: 54-56

[00:01] Team_017 possession (Score: 54-56)
Shaquille Stewart makes the Layup and draws the foul on Tobias Herro! And-1! Shaquille Stewart to the line for 1. [Team fouls: 3] (Tobias Herro: 1 personal fouls)   FT 1/1: MISS Shaquille Stewart makes 0/1 from the line. Rebound secured by Devin Cunningham.
Score: 54-58

================================================================================
                              3RD QUARTER COMPLETE                              
================================================================================

3RD QUARTER SCORE: Team_064 14, Team_017 17

BOX SCORE:
================================================================================

Team_064
--------------------------------------------------------------------------------
Player                MIN  PTS  REB  AST  TO      FG   FG%      3P   3P%
--------------------------------------------------------------------------------
Shai Hyland            26    4    3    0   0   2/6    33.3     0/0   0.0
Ja Mitchell            26    4    0    0   0   2/3    66.7     0/0   0.0
Kawhi Irving           26    2    4    2   0   1/2    50.0     0/0   0.0
Devin Cunningham       10    2    2    0   0   1/1   100.0     0/0   0.0
CJ Haliburton          10    2    0    0   0   1/1   100.0     0/0   0.0
Russell Simons         26    0    4    1   0   0/3     0.0     0/0   0.0
Tobias Herro           10    0    0    0   0   0/1     0.0     0/0   0.0

TEAM: FG: 7/17 (41.2%), 3PT: 1/6 (16.7%), REB: 13 (2 off, 11 def), AST: 3, TO: 4
TEAM FOULS: 3


Team_017
--------------------------------------------------------------------------------
Player                MIN  PTS  REB  AST  TO      FG   FG%      3P   3P%
--------------------------------------------------------------------------------
Bam Williamson         26    6    4    1   0   2/6    33.3     0/0   0.0
Desmond Reaves         26    6    0    1   0   2/2   100.0     0/0   0.0
Tony Smith             26    3    2    0   0   1/2    50.0     0/0   0.0
Kyrie Middleton        26    0    5    2   0   0/2     0.0     0/0   0.0
Vince Banchero         26    0    0    1   0   0/2     0.0     0/0   0.0
Klay Holiday           10    0    1    0   0   0/0     0.0     0/0   0.0
Ja Stewart             10    0    0    0   0   0/1     0.0     0/0   0.0
Shaquille Stewart      10    0    0    0   0   0/1     0.0     0/0   0.0

TEAM: FG: 5/16 (31.2%), 3PT: 4/8 (50.0%), REB: 12 (2 off, 10 def), AST: 5, TO: 5
TEAM FOULS: 4

================================================================================

================================================================================
                       4TH QUARTER - Team_064 vs Team_017                       
================================================================================

[12:00] Team_064 possession (Score: 54-58)
Jordan Mitchell attempts a Layup. Contested by Vince Banchero (3.7 feet, MAN). Jordan Mitchell misses. Rebound secured by Bam Williamson.

[11:46] Team_017 possession (Score: 54-58)
FOUL! Shooting foul on Ja Mitchell. Desmond Reaves to the line for 3 free throws. [Team fouls: 1] (Ja Mitchell: 1 personal fouls)   FT 1/3: GOOD   FT 2/3: GOOD   FT 3/3: GOOD Desmond Reaves makes 3/3 from the line.
Score: 54-61

[11:30] Team_064 possession (Score: 54-61)
Ja Mitchell attempts a 3Pt. Contested by Desmond Reaves (4.4 feet, MAN). JA MITCHELL MAKES IT! Assist: Kawhi Irving
Score: 57-61

[11:14] Team_017 possession (Score: 57-61)
Kyrie Middleton attempts a Layup. BLOCKED BY JORDAN MITCHELL! Ball deflects out of bounds off Kyrie Middleton.

[11:04] Team_064 possession (Score: 57-61)
Jordan Mitchell attempts a 3Pt. Contested by Tony Smith (2.5 feet, ZONE). Jordan Mitchell misses. Rebound secured by Tony Smith.

[10:50] Team_017 possession (Score: 57-61)
Kyrie Middleton attempts a Layup. Contested by Russell Simons (3.9 feet, MAN). KYRIE MIDDLETON MAKES IT! Assist: Bam Williamson
Score: 57-63

[10:38] Team_064 possession (Score: 57-63)
Jordan Mitchell attempts a 3Pt. Contested by Vince Banchero (3.8 feet, MAN). Jordan Mitchell misses. Rebound secured by Tony Smith.

[10:26] Team_017 possession (Score: 57-63)
Desmond Reaves drives and kicks out. Vince Banchero attempts a 3Pt. Contested by Jordan Mitchell (4.1 feet, MAN). Vince Banchero misses. Offensive rebound by Kyrie Middleton! Kyrie Middleton kicks it out.

[10:12] Team_017 possession (Score: 57-63)
Desmond Reaves drives and kicks out. Bam Williamson attempts a 3Pt. Contested by Ja Mitchell (5.4 feet, ZONE). BAM WILLIAMSON MAKES IT! Assist: Vince Banchero
Score: 57-66

[09:58] Team_064 possession (Score: 57-66)
Jordan Mitchell attempts a 3Pt. Contested by Kyrie Middleton (4.8 feet, ZONE). Jordan Mitchell misses. Rebound secured by Kyrie Middleton.

[09:40] Team_017 possession (Score: 57-66)
Vince Banchero drives and kicks out. Desmond Reaves attempts a 3Pt. Contested by Ja Mitchell (5.5 feet, ZONE). DESMOND REAVES MAKES IT! Assist: Kyrie Middleton
Score: 57-69

[09:28] Team_064 possession (Score: 57-69)
Kawhi Irving attempts a 3Pt. Contested by Tony Smith (3.0 feet, MAN). Kawhi Irving misses. Rebound secured by Tony Smith.

[09:11] Team_017 possession (Score: 57-69)
Desmond Reaves drives, Ja Mitchell stays with him. Desmond Reaves attempts a Layup. Contested by Ja Mitchell (5.9 feet, MAN). DESMOND REAVES MAKES IT! Assist: Bam Williamson
Score: 57-71

[08:56] Team_064 possession (Score: 57-71)
Jordan Mitchell drives to the basket... Jordan Mitchell throws a bad pass! Stolen by Bam Williamson! TURNOVER! (live ball)

[08:41] Team_017 possession (Score: 57-71)
Bam Williamson drives, picks up Shai Hyland. Help arrives from Jordan Mitchell! Bam Williamson attempts a Dunk. Wide open! Jordan Mitchell is 6.1 feet away. [MAN] Bam Williamson misses. Rebound secured by Kawhi Irving.

[08:25] Team_064 possession (Score: 57-71)
Kawhi Irving attempts a Layup. Contested by Tony Smith (3.1 feet, MAN). Kawhi Irving misses. Rebound secured by Bam Williamson.

[08:08] Team_017 possession (Score: 57-71)
Desmond Reaves attempts a Midrange. Contested by Kawhi Irving (5.2 feet, ZONE). Desmond Reaves misses. FOUL! Loose ball foul on Shai Hyland during the rebound battle. [Team fouls: 2] No free throws, side out. (Shai Hyland: 1 personal fouls)

[07:57] Team_017 possession (Score: 57-71)
Kyrie Middleton attempts a 3Pt. Contested by Ja Mitchell (5.9 feet, ZONE). Kyrie Middleton misses. Rebound secured by Kawhi Irving.

[07:45] Team_064 possession (Score: 57-71)
Kawhi Irving attempts a 3Pt. Contested by Tony Smith (3.2 feet, ZONE). Kawhi Irving misses. Offensive rebound by Kawhi Irving! Kawhi Irving kicks it out.

[07:34] Team_064 possession (Score: 57-71)
Ja Mitchell attempts a 3Pt. Contested by Tony Smith (3.6 feet, ZONE). Ja Mitchell misses. Rebound secured by Tony Smith.

[07:22] Team_017 possession (Score: 57-71)
Desmond Reaves attempts a 3Pt. Wide open! Ja Mitchell is 6.1 feet away. [ZONE] DESMOND REAVES MAKES IT! Assist: Bam Williamson
Score: 57-74

[07:10] Team_064 possession (Score: 57-74)
FOUL! Offensive foul on Jordan Mitchell! Vince Banchero drew the charge! [Team fouls: 3] (Jordan Mitchell: 1 personal fouls) TURNOVER! (dead ball)

[06:57] Team_017 possession (Score: 57-74)
Bam Williamson throws a bad pass! Stolen by Shai Hyland! TURNOVER! (live ball)

[06:45] Team_064 possession (Score: 57-74)
Shai Hyland drives and kicks out. Shai Hyland attempts a 3Pt. Contested by Tony Smith (3.6 feet, ZONE). Shai Hyland misses. Rebound secured by Kyrie Middleton.

[06:30] Team_017 possession (Score: 57-74)
Tony Smith drives to the basket... Tony Smith throws a bad pass out of bounds! TURNOVER! (dead ball)

[06:30] Substitution (Team_064): Ja Mitchell OUT → CJ Haliburton IN (stamina_rule2)

[06:30] Substitution (Team_064): Jordan Mitchell OUT → Ja Simmons IN (stamina_rule2)

[06:30] Substitution (Team_064): Kawhi Irving OUT → Tobias Herro IN (stamina_rule2)

[06:30] Substitution (Team_064): Russell Simons OUT → Austin Smith IN (stamina_rule2)

[06:30] Substitution (Team_064): Shai Hyland OUT → Devin Cunningham IN (stamina_rule2)

[06:30] Substitution (Team_017): Desmond Reaves OUT → Blake Reaves IN (stamina_rule2)

[06:30] Substitution (Team_017): Vince Banchero OUT → Tobias Bridges IN (stamina_rule2)

[06:30] Substitution (Team_017): Tony Smith OUT → Shaquille Stewart IN (stamina_rule2)

[06:30] Substitution (Team_017): Kyrie Middleton OUT → Ja Stewart IN (stamina_rule2)

[06:30] Substitution (Team_017): Bam Williamson OUT → Klay Holiday IN (stamina_rule2)

[06:17] Team_064 possession (Score: 57-74)
Ja Simmons attempts a Midrange. Contested by Tobias Bridges (3.9 feet, ZONE). JA SIMMONS MAKES IT! Assist: Tobias Herro
Score: 59-74

[06:06] Team_017 possession (Score: 59-74)
Tobias Bridges makes the Layup and draws the foul on Ja Simmons! And-1! Tobias Bridges to the line for 1. [Team fouls: 4] (Ja Simmons: 1 personal fouls)   FT 1/1: GOOD Tobias Bridges makes 1/1 from the line.
Score: 59-77

[05:51] Team_064 possession (Score: 59-77)
Ja Simmons drives and kicks out. Ja Simmons attempts a 3Pt. Contested by Tobias Bridges (4.0 feet, MAN). Ja Simmons misses. Rebound secured by Klay Holiday.

[05:32] Team_017 possession (Score: 59-77)
Shaquille Stewart attempts a Midrange. Wide open! Tobias Herro is 6.4 feet away. [MAN] Shaquille Stewart misses. Rebound secured by Devin Cunningham.

[05:18] Team_064 possession (Score: 59-77)
Tobias Herro attempts a Layup. Contested by Ja Stewart (4.2 feet, ZONE). Tobias Herro misses. Rebound secured by Shaquille Stewart.

[05:03] Team_017 possession (Score: 59-77)
Shaquille Stewart attempts a 3Pt. Contested by Austin Smith (4.9 feet, ZONE). SHAQUILLE STEWART MAKES IT! Assist: Blake Reaves
Score: 59-80

[04:49] Team_064 possession (Score: 59-80)
FOUL! Reach-in foul on Klay Holiday during the drive. [Team fouls: 1] No free throws, side out. (Klay Holiday: 1 personal fouls)

[04:34] Team_064 possession (Score: 59-80)
Devin Cunningham drives to the basket... FOUL! Offensive foul on Devin Cunningham! Klay Holiday drew the charge! [Team fouls: 5] (Devin Cunningham: 1 personal fouls) TURNOVER! (dead ball)

[04:16] Team_017 possession (Score: 59-80)
Klay Holiday throws a bad pass out of bounds! TURNOVER! (dead ball)

[04:02] Team_064 possession (Score: 59-80)
Austin Smith attempts a Midrange. Contested by Ja Stewart (4.3 feet, MAN). Austin Smith misses. Rebound secured by Ja Stewart.

[03:44] Team_017 possession (Score: 59-80)
Klay Holiday attempts a Layup. Contested by Devin Cunningham (5.4 feet, MAN). KLAY HOLIDAY MAKES IT! Assist: Blake Reaves
Score: 59-82

[03:28] Team_064 possession (Score: 59-82)
Tobias Herro attempts a 3Pt. Contested by Blake Reaves (4.7 feet, ZONE). Tobias Herro misses. Rebound secured by Klay Holiday.

[03:13] Team_017 possession (Score: 59-82)
Klay Holiday drives and kicks out. Tobias Bridges attempts a 3Pt. Contested by Ja Simmons (5.6 feet, MAN). Tobias Bridges misses. Rebound secured by Devin Cunningham.

[02:59] Team_064 possession (Score: 59-82)
Devin Cunningham attempts a 3Pt. Contested by Tobias Bridges (3.9 feet, ZONE). Devin Cunningham misses. Rebound secured by Ja Stewart.

[02:47] Team_017 possession (Score: 59-82)
Shaquille Stewart attempts a Midrange. Wide open! Tobias Herro is 6.4 feet away. [MAN] SHAQUILLE STEWART MAKES IT!
Score: 59-84

[02:33] Team_064 possession (Score: 59-84)
Austin Smith attempts a Midrange. Contested by Tobias Bridges (3.6 feet, ZONE). Austin Smith misses. Offensive rebound by Austin Smith! Austin Smith kicks it out.

[02:14] Team_064 possession (Score: 59-84)
Devin Cunningham drives, Ja Stewart stays with him. Devin Cunningham attempts a Dunk. Contested by Ja Stewart (4.6 feet, ZONE). DEVIN CUNNINGHAM MAKES IT!
Score: 61-84

[02:00] Team_017 possession (Score: 61-84)
Tobias Bridges drives and kicks out. Tobias Bridges attempts a Midrange. Contested by Devin Cunningham (5.2 feet, ZONE). TOBIAS BRIDGES MAKES IT!
Score: 61-86

[01:46] Team_064 possession (Score: 61-86)
CJ Haliburton attempts a 3Pt. Contested by Tobias Bridges (4.3 feet, ZONE). CJ Haliburton misses. Rebound secured by Ja Stewart.

[01:32] Team_017 possession (Score: 61-86)
FOUL! Shooting foul on Tobias Herro. Blake Reaves to the line for 2 free throws. [BONUS: 6 team fouls] (Tobias Herro: 1 personal fouls)   FT 1/2: MISS   FT 2/2: GOOD Blake Reaves makes 1/2 from the line.
Score: 61-87

[01:16] Team_064 possession (Score: 61-87)
Tobias Herro attempts a Layup. Contested by Ja Stewart (4.2 feet, ZONE). Tobias Herro misses. Offensive rebound by Austin Smith! Austin Smith kicks it out.

[01:00] Team_064 possession (Score: 61-87)
Austin Smith makes the Midrange and draws the foul on Ja Stewart! And-1! Austin Smith to the line for 1. [Team fouls: 2] (Ja Stewart: 1 personal fouls)   FT 1/1: GOOD Austin Smith makes 1/1 from the line.
Score: 64-87

[00:47] Team_017 possession (Score: 64-87)
Ja Stewart attempts a 3Pt. Contested by Austin Smith (4.2 feet, ZONE). Ja Stewart misses. Rebound secured by Devin Cunningham.

[00:36] Team_064 possession (Score: 64-87)
Ja Simmons attempts a 3Pt. Contested by Tobias Bridges (3.9 feet, MAN). JA SIMMONS MAKES IT!
Score: 67-87

[00:22] Team_017 possession (Score: 67-87)
Blake Reaves attempts a 3Pt. Contested by Austin Smith (4.5 feet, ZONE). Blake Reaves misses. Rebound secured by Austin Smith.

[00:06] Team_064 possession (Score: 67-87)
Devin Cunningham drives, picks up Klay Holiday. Help arrives from Tobias Bridges! Devin Cunningham attempts a Dunk. Contested by Tobias Bridges (5.0 feet, MAN). Devin Cunningham misses. Rebound secured by Ja Stewart.

================================================================================
                              4TH QUARTER COMPLETE                              
================================================================================

4TH QUARTER SCORE: Team_064 13, Team_017 29

BOX SCORE:
================================================================================

Team_064
--------------------------------------------------------------------------------
Player                MIN  PTS  REB  AST  TO      FG   FG%      3P   3P%
--------------------------------------------------------------------------------
Ja Simmons             17    5    0    0   0   2/3    66.7     0/0   0.0
Ja Mitchell            32    3    0    0   0   1/2    50.0     0/0   0.0
Austin Smith           17    3    3    0   0   1/2    50.0     0/0   0.0
Devin Cunningham       17    2    3    0   0   1/3    33.3     0/0   0.0
Jordan Mitchell        32    0    0    0   0   0/4     0.0     0/0   0.0
Kawhi Irving           32    0    3    1   0   0/2     0.0     0/0   0.0
Shai Hyland            32    0    0    0   0   0/1     0.0     0/0   0.0
Tobias Herro           17    0    0    1   0   0/2     0.0     0/0   0.0
CJ Haliburton          17    0    0    0   0   0/1     0.0     0/0   0.0

TEAM: FG: 5/20 (25.0%), 3PT: 2/10 (20.0%), REB: 9 (3 off, 6 def), AST: 2, TO: 3
TEAM FOULS: 6 [Team_017 in BONUS]


Team_017
--------------------------------------------------------------------------------
Player                MIN  PTS  REB  AST  TO      FG   FG%      3P   3P%
--------------------------------------------------------------------------------
Desmond Reaves         32   11    0    0   0   4/4   100.0     0/0   0.0
Tobias Bridges         17    5    0    0   0   2/2   100.0     0/0   0.0
Shaquille Stewart      17    5    1    0   0   2/3    66.7     0/0   0.0
Bam Williamson         32    3    3    3   0   1/2    50.0     0/0   0.0
Kyrie Middleton        32    2    3    1   0   1/3    33.3     0/0   0.0
Klay Holiday           17    2    2    0   0   1/2    50.0     0/0   0.0
Blake Reaves           17    1    0    2   0   1/2    50.0     0/0   0.0
Tony Smith             32    0    4    0   0   0/0     0.0     0/0   0.0
Vince Banchero         32    0    0    1   0   0/0     0.0     0/0   0.0
Ja Stewart             17    0    4    0   0   0/1     0.0     0/0   0.0

TEAM: FG: 12/19 (63.2%), 3PT: 3/6 (50.0%), REB: 17 (2 off, 15 def), AST: 7, TO: 3
TEAM FOULS: 2

================================================================================

================================================================================
                               FULL GAME COMPLETE                               
================================================================================

FINAL SCORE: Team_064 67, Team_017 87

SCORING BY QUARTER:
--------------------------------------------------------------------------------
Team                     Q1     Q2     Q3     Q4    FINAL
--------------------------------------------------------------------------------
Team_064                 16     24     14     13       67
Team_017                 20     21     17     29       87
--------------------------------------------------------------------------------

FULL GAME BOX SCORE:
================================================================================

Team_064
--------------------------------------------------------------------------------
Player                MIN  PTS  REB  AST  TO      FG   FG%      3P   3P%      FT STL BLK
--------------------------------------------------------------------------------
Ja Mitchell            32   16    0    0   3   7/12   58.3   4/9    44.4   2/3     0   1
Jordan Mitchell        32    2    0    1   1   1/12    8.3   0/8     0.0   2/2     0   2
Kawhi Irving           32    4   12    4   2   1/6    16.7   0/4     0.0   4/4     0   0
Russell Simons         32    2   10    1   1   1/7    14.3   0/3     0.0   2/2     0   0
Shai Hyland            32    7   11    0   0   4/11   36.4   0/2     0.0   1/2     1   2
CJ Haliburton          17   10    0    0   1   4/6    66.7   1/3    33.3   1/1     0   0
Ja Simmons             17   10    4    1   2   4/5    80.0   2/2   100.0   0/0     0   0
Tobias Herro           17    3    0    4   0   1/6    16.7   1/4    25.0   0/0     0   0
Austin Smith           17    5    4    2   0   2/3    66.7   0/0     0.0   3/3     1   0
Devin Cunningham       17    8    8    1   0   4/7    57.1   0/2     0.0   0/0     0   0

TEAM: FG: 29/75 (38.7%), 3PT: 8/37 (21.6%), REB: 49 (13 off, 36 def), AST: 14, TO: 10


Team_017
--------------------------------------------------------------------------------
Player                MIN  PTS  REB  AST  TO      FG   FG%      3P   3P%      FT STL BLK
--------------------------------------------------------------------------------
Desmond Reaves         32   26    0    1   2  11/14   78.6   8/9    88.9   3/3     2   0
Vince Banchero         32    8    0    4   0   4/11   36.4   1/7    14.3   1/1     0   0
Tony Smith             32    5   13    3   1   2/7    28.6   1/4    25.0   2/2     0   0
Kyrie Middleton        32    4   14    3   3   2/6    33.3   0/1     0.0   0/0     0   0
Bam Williamson         32   13   13    6   1   2/8    25.0   1/2    50.0   0/0     1   0
Blake Reaves           17    4    0    2   0   2/5    40.0   1/3    33.3   1/2     0   0
Tobias Bridges         17   10    0    0   0   4/6    66.7   0/1     0.0   2/2     1   0
Shaquille Stewart      17    9    5    1   0   4/7    57.1   1/2    50.0   0/1     0   0
Ja Stewart             17    3    6    1   1   2/5    40.0   0/3     0.0   1/2     1   1
Klay Holiday           17    3    3    0   2   2/4    50.0   0/0     0.0   1/2     0   0

TEAM: FG: 35/73 (47.9%), 3PT: 13/32 (40.6%), REB: 54 (9 off, 45 def), AST: 21, TO: 10

================================================================================
