================================================================================
                        FULL GAME - Team_045 vs Team_047                        
================================================================================

================================================================================
                       1ST QUARTER - Team_045 vs Team_047                       
================================================================================

[12:00] Team_045 possession (Score: 0-0)
Cole Simons drives, Josh Harris stays with him. Cole Simons attempts a Dunk. Contested by Josh Harris (4.8 feet, ZONE). Cole Simons misses. Rebound secured by Myles LaVine.

[11:47] Team_047 possession (Score: 0-0)
Josh Harris attempts a 3Pt. Contested by Cole Simons (3.6 feet, ZONE). JOSH HARRIS MAKES IT! Assist: Blake Jokic
Score: 0-3

[11:32] Team_045 possession (Score: 0-3)
DeMar Turner attempts a Midrange. Contested by Josh Harris (4.5 feet, MAN). DeMar Turner misses. Rebound secured by Derrick Irving.

[11:14] Team_047 possession (Score: 0-3)
Blake Jokic attempts a Midrange. Contested by Trae Russell (5.2 feet, ZONE). BLAKE JOKIC MAKES IT!
Score: 0-5

[10:59] Team_045 possession (Score: 0-5)
Zion Butler drives, Josh Harris stays with him. Zion Butler attempts a Dunk. Contested by Josh Harris (4.5 feet, ZONE). ZION BUTLER MAKES IT!
Score: 2-5

[10:44] Team_047 possession (Score: 2-5)
Derrick Irving attempts a 3Pt. Contested by Cole Simons (3.6 feet, ZONE). Derrick Irving misses. Rebound secured by Zion Butler.

[10:30] Team_045 possession (Score: 2-5)
Cole Simons drives and kicks out. Trae Russell attempts a 3Pt. Contested by Derrick Irving (4.8 feet, MAN). Trae Russell misses. Rebound secured by Derrick Irving.

[10:14] Team_047 possession (Score: 2-5)
Blake Jokic drives and kicks out. Myles LaVine attempts a Midrange. Contested by Zion Butler (3.2 feet, MAN). Myles LaVine misses. Rebound secured by Zion Butler.

[09:59] Team_045 possession (Score: 2-5)
Rudy Antetokounmpo attempts a 3Pt. Contested by De'Aaron Rose (4.3 feet, ZONE). Rudy Antetokounmpo misses. Rebound secured by Derrick Irving.

[09:42] Team_047 possession (Score: 2-5)
Derrick Irving loses the ball! Stripped by Cole Simons! TURNOVER! (live ball)

[09:27] Team_045 possession (Score: 2-5)
Rudy Antetokounmpo attempts a 3Pt. Contested by De'Aaron Rose (4.3 feet, ZONE). Rudy Antetokounmpo misses. Rebound secured by Josh Harris.

[09:12] Team_047 possession (Score: 2-5)
Derrick Irving attempts a 3Pt. Contested by Cole Simons (3.6 feet, ZONE). Derrick Irving misses. Rebound secured by DeMar Turner.

[08:59] Team_045 possession (Score: 2-5)
DeMar Turner drives and kicks out. Zion Butler attempts a 3Pt. Contested by De'Aaron Rose (4.0 feet, ZONE). Zion Butler misses. Rebound secured by Myles LaVine.

[08:46] Team_047 possession (Score: 2-5)
Blake Jokic attempts a Layup. BLOCKED BY ZION BUTLER! Ball is loose! Rebound secured by DeMar Turner.

[08:32] Team_045 possession (Score: 2-5)
Zion Butler drives and kicks out. Zion Butler attempts a 3Pt. Contested by Myles LaVine (5.2 feet, MAN). ZION BUTLER MAKES IT! Assist: Cole Simons
Score: 5-5

[08:18] Team_047 possession (Score: 5-5)
Myles LaVine drives and kicks out. Myles LaVine attempts a 3Pt. Contested by Zion Butler (3.2 feet, MAN). Myles LaVine misses. Rebound secured by Zion Butler.

[08:00] Team_045 possession (Score: 5-5)
Rudy Antetokounmpo attempts a 3Pt. Contested by Josh Harris (4.5 feet, ZONE). Rudy Antetokounmpo misses. Rebound secured by Myles LaVine.

[07:43] Team_047 possession (Score: 5-5)
FOUL! Shooting foul on Cole Simons. De'Aaron Rose to the line for 2 free throws. [Team fouls: 1] (Cole Simons: 1 personal fouls)   FT 1/2: GOOD   FT 2/2: MISS De'Aaron Rose makes 1/2 from the line. Rebound secured by DeMar Turner.
Score: 5-6

[07:27] Team_045 possession (Score: 5-6)
DeMar Turner drives and kicks out. Zion Butler attempts a Midrange. Contested by Myles LaVine (5.2 feet, MAN). ZION BUTLER MAKES IT! Assist: Trae Russell
Score: 7-6

[07:12] Team_047 possession (Score: 7-6)
Derrick Irving drives to the basket... Derrick Irving throws a bad pass! Stolen by Zion Butler! TURNOVER! (live ball)

[07:00] Team_045 possession (Score: 7-6)
Zion Butler attempts a 3Pt. Contested by De'Aaron Rose (4.3 feet, ZONE). Zion Butler misses. Offensive rebound by DeMar Turner! DeMar Turner kicks it out.

[06:44] Team_045 possession (Score: 7-6)
DeMar Turner attempts a 3Pt. Contested by Josh Harris (4.5 feet, MAN). DeMar Turner misses. Offensive rebound by DeMar Turner! DeMar Turner kicks it out.

[06:25] Team_045 possession (Score: 7-6)
FOUL! Holding foul on Myles LaVine. [Team fouls: 1] No free throws, side out. (Myles LaVine: 1 personal fouls)

[06:10] Team_045 possession (Score: 7-6)
Trae Russell attempts a Midrange. Contested by Blake Jokic (5.4 feet, ZONE). Trae Russell misses. Rebound secured by Derrick Irving.

[05:55] Team_047 possession (Score: 7-6)
FOUL! Reach-in foul on Zion Butler during the drive. [Team fouls: 2] No free throws, side out. (Zion Butler: 1 personal fouls)

[05:41] Team_047 possession (Score: 7-6)
Josh Harris attempts a 3Pt. Contested by Cole Simons (3.6 feet, ZONE). Josh Harris misses. Rebound secured by DeMar Turner.

[05:27] Team_045 possession (Score: 7-6)
Zion Butler attempts a Midrange. Contested by Myles LaVine (5.5 feet, MAN). ZION BUTLER MAKES IT! Assist: DeMar Turner
Score: 9-6

[05:18] Team_047 possession (Score: 9-6)
Derrick Irving drives, Zion Butler stays with him. Derrick Irving attempts a Layup. Contested by Zion Butler (3.7 feet, ZONE). DERRICK IRVING MAKES IT! Assist: Josh Harris
Score: 9-8

[05:01] Team_045 possession (Score: 9-8)
DeMar Turner attempts a Midrange. Contested by Derrick Irving (5.1 feet, ZONE). DEMAR TURNER MAKES IT! Assist: Cole Simons
Score: 11-8

[04:48] Team_047 possession (Score: 11-8)
Josh Harris attempts a 3Pt. Contested by Cole Simons (3.6 feet, ZONE). JOSH HARRIS MAKES IT! Assist: Blake Jokic
Score: 11-11

[04:34] Team_045 possession (Score: 11-11)
FOUL! Shooting foul on Derrick Irving. Zion Butler to the line for 2 free throws. [Team fouls: 2] (Derrick Irving: 1 personal fouls)   FT 1/2: MISS   FT 2/2: GOOD Zion Butler makes 1/2 from the line.
Score: 12-11

[04:20] Team_047 possession (Score: 12-11)
Josh Harris makes the Layup and draws the foul on Zion Butler! And-1! Josh Harris to the line for 1. [Team fouls: 3] (Zion Butler: 2 personal fouls)   FT 1/1: GOOD Josh Harris makes 1/1 from the line.
Score: 12-14

[04:05] Team_045 possession (Score: 12-14)
Zion Butler attempts a 3Pt. Contested by Myles LaVine (5.6 feet, MAN). Zion Butler misses. Rebound secured by Derrick Irving.

[03:52] Team_047 possession (Score: 12-14)
Myles LaVine loses the ball! Stripped by Zion Butler! TURNOVER! (live ball)

[03:41] Team_045 possession (Score: 12-14)
Rudy Antetokounmpo drives, Josh Harris stays with him. Rudy Antetokounmpo attempts a Dunk. Contested by Josh Harris (4.6 feet, ZONE). Rudy Antetokounmpo misses. Rebound secured by Myles LaVine.

[03:29] Team_047 possession (Score: 12-14)
Myles LaVine attempts a 3Pt. Contested by Zion Butler (3.7 feet, MAN). MYLES LAVINE MAKES IT! Assist: Derrick Irving
Score: 12-17

[03:12] Team_045 possession (Score: 12-17)
Trae Russell drives, Josh Harris stays with him. Trae Russell attempts a Dunk. Contested by Josh Harris (4.8 feet, ZONE). Trae Russell misses. Offensive rebound by DeMar Turner! DeMar Turner kicks it out.

[02:58] Team_045 possession (Score: 12-17)
Rudy Antetokounmpo attempts a 3Pt. Contested by De'Aaron Rose (4.5 feet, MAN). Rudy Antetokounmpo misses. Rebound secured by Myles LaVine.

[02:46] Team_047 possession (Score: 12-17)
Derrick Irving drives, Cole Simons stays with him. Derrick Irving attempts a Layup. Contested by Cole Simons (3.9 feet, MAN). Derrick Irving misses. Rebound secured by Cole Simons.

[02:34] Team_045 possession (Score: 12-17)
Zion Butler attempts a 3Pt. Contested by De'Aaron Rose (4.5 feet, ZONE). Zion Butler misses. Rebound secured by Myles LaVine.

[02:18] Team_047 possession (Score: 12-17)
Derrick Irving drives to the basket... Derrick Irving throws a bad pass out of bounds! TURNOVER! (dead ball)

[02:18] Substitution (Team_045): Trae Russell OUT → Julius James IN (stamina_rule2)

[02:18] Substitution (Team_045): Cole Simons OUT → Gary Towns IN (stamina_rule2)

[02:18] Substitution (Team_045): Zion Butler OUT → Stephen Paul IN (stamina_rule2)

[02:18] Substitution (Team_047): De'Aaron Rose OUT → Austin Giddey IN (stamina_rule2)

[02:18] Substitution (Team_047): Derrick Irving OUT → Donovan Iverson IN (stamina_rule2)

[02:18] Substitution (Team_047): Josh Harris OUT → Tony Poole IN (stamina_rule2)

[02:18] Substitution (Team_047): Myles LaVine OUT → Zion Thompson IN (stamina_rule2)

[02:09] Team_045 possession (Score: 12-17)
Stephen Paul drives, Zion Thompson stays with him. Stephen Paul attempts a Layup. Contested by Zion Thompson (5.2 feet, ZONE). Stephen Paul misses. Rebound secured by Donovan Iverson.

[01:56] Team_047 possession (Score: 12-17)
Donovan Iverson attempts a 3Pt. Contested by Julius James (4.2 feet, MAN). DONOVAN IVERSON MAKES IT! Assist: Tony Poole
Score: 12-20

[01:42] Team_045 possession (Score: 12-20)
FOUL! Shooting foul on Austin Giddey. Rudy Antetokounmpo to the line for 3 free throws. [Team fouls: 3] (Austin Giddey: 1 personal fouls)   FT 1/3: GOOD   FT 2/3: GOOD   FT 3/3: GOOD Rudy Antetokounmpo makes 3/3 from the line.
Score: 15-20

[01:27] Team_047 possession (Score: 15-20)
Donovan Iverson attempts a Midrange. Contested by Julius James (4.2 feet, ZONE). Donovan Iverson misses. Rebound secured by DeMar Turner.

[01:13] Team_045 possession (Score: 15-20)
Julius James attempts a Midrange. Contested by Donovan Iverson (4.4 feet, ZONE). Julius James misses. Rebound secured by Zion Thompson.

[00:55] Team_047 possession (Score: 15-20)
Austin Giddey drives to the basket... Austin Giddey throws a bad pass! Stolen by Stephen Paul! TURNOVER! (live ball)

[00:41] Team_045 possession (Score: 15-20)
Gary Towns attempts a 3Pt. Contested by Blake Jokic (5.0 feet, MAN). GARY TOWNS MAKES IT! Assist: Rudy Antetokounmpo
Score: 18-20

[00:22] Team_047 possession (Score: 18-20)
FOUL! Reach-in foul on Gary Towns during the drive. [Team fouls: 4] No free throws, side out. (Gary Towns: 1 personal fouls)

[00:04] Team_047 possession (Score: 18-20)
FOUL! Holding foul on Rudy Antetokounmpo. [IN THE BONUS! 5 team fouls] Austin Giddey to the line for 2 free throws. (Rudy Antetokounmpo: 1 personal fouls)   FT 1/2: GOOD   FT 2/2: GOOD Austin Giddey makes 2/2 from the line.
Score: 18-22

================================================================================
                              1ST QUARTER COMPLETE                              
================================================================================

1ST QUARTER SCORE: Team_045 18, Team_047 22

BOX SCORE:
================================================================================

Team_045
--------------------------------------------------------------------------------
Player                MIN  PTS  REB  AST  TO      FG   FG%      3P   3P%
--------------------------------------------------------------------------------
Zion Butler            10   10    3    0   0   5/7    71.4     0/0   0.0
Rudy Antetokounmpo     12    3    0    1   0   1/6    16.7     0/0   0.0
Gary Towns              2    3    0    0   0   1/1   100.0     0/0   0.0
DeMar Turner           12    2    8    1   0   1/3    33.3     0/0   0.0
Cole Simons            10    0    1    2   0   0/2     0.0     0/0   0.0
Trae Russell           10    0    0    1   0   0/1     0.0     0/0   0.0
Stephen Paul            2    0    0    0   0   0/1     0.0     0/0   0.0
Julius James            2    0    0    0   0   0/1     0.0     0/0   0.0

TEAM: FG: 8/22 (36.4%), 3PT: 2/8 (25.0%), REB: 12 (3 off, 9 def), AST: 5, TO: 0
TEAM FOULS: 5 [Team_047 in BONUS]


Team_047
--------------------------------------------------------------------------------
Player                MIN  PTS  REB  AST  TO      FG   FG%      3P   3P%
--------------------------------------------------------------------------------
Josh Harris            10    9    1    1   0   3/4    75.0     0/0   0.0
Myles LaVine           10    3    6    0   0   1/2    50.0     0/0   0.0
Donovan Iverson         2    3    1    0   0   1/2    50.0     0/0   0.0
Blake Jokic            12    2    0    2   0   1/3    33.3     0/0   0.0
Derrick Irving         10    2    5    1   0   1/4    25.0     0/0   0.0
Austin Giddey           2    2    0    0   0   1/1   100.0     0/0   0.0
De'Aaron Rose          10    0    0    0   0   0/1     0.0     0/0   0.0
Tony Poole              2    0    0    1   0   0/0     0.0     0/0   0.0
Zion Thompson           2    0    1    0   0   0/0     0.0     0/0   0.0

TEAM: FG: 8/17 (47.1%), 3PT: 4/7 (57.1%), REB: 14 (0 off, 14 def), AST: 5, TO: 5
TEAM FOULS: 3

================================================================================

================================================================================
                       2ND QUARTER - Team_045 vs Team_047                       
================================================================================

[12:00] Team_045 possession (Score: 18-22)
Zion Butler attempts a Layup. Contested by Josh Harris (4.5 feet, ZONE). ZION BUTLER MAKES IT! Assist: Trae Russell
Score: 20-22

[11:50] Team_047 possession (Score: 20-22)
De'Aaron Rose drives and kicks out. De'Aaron Rose attempts a 3Pt. Contested by Rudy Antetokounmpo (4.7 feet, ZONE). De'Aaron Rose misses. Rebound secured by Zion Butler.

[11:35] Team_045 possession (Score: 20-22)
Trae Russell attempts a Midrange. Contested by Derrick Irving (5.3 feet, ZONE). Trae Russell misses. Rebound secured by Derrick Irving.

[11:18] Team_047 possession (Score: 20-22)
Blake Jokic attempts a 3Pt. Contested by Cole Simons (3.2 feet, ZONE). Blake Jokic misses. Rebound secured by Zion Butler.

[11:04] Team_045 possession (Score: 20-22)
Rudy Antetokounmpo drives to the basket... Rudy Antetokounmpo loses control! Ball rolls out of bounds! TURNOVER! (dead ball)

[11:04] Substitution (Team_045): Rudy Antetokounmpo OUT → John Wagner IN (stamina_rule2)

[11:04] Substitution (Team_045): DeMar Turner OUT → Tim Sexton IN (stamina_rule2)

[11:04] Substitution (Team_047): Blake Jokic OUT → Blake Jackson IN (stamina_rule2)

[10:49] Team_047 possession (Score: 20-22)
Derrick Irving attempts a 3Pt. Contested by Cole Simons (3.7 feet, MAN). Derrick Irving misses. Offensive rebound by Myles LaVine! Myles LaVine kicks it out.

[10:34] Team_047 possession (Score: 20-22)
Josh Harris drives and kicks out. Myles LaVine attempts a 3Pt. Contested by Tim Sexton (4.6 feet, ZONE). Myles LaVine misses. Rebound secured by Zion Butler.

[10:22] Team_045 possession (Score: 20-22)
Tim Sexton attempts a 3Pt. Contested by Josh Harris (4.7 feet, MAN). Tim Sexton misses. Rebound secured by Derrick Irving.

[10:06] Team_047 possession (Score: 20-22)
Blake Jackson attempts a 3Pt. Contested by Cole Simons (3.2 feet, ZONE). Blake Jackson misses. Rebound secured by Tim Sexton.

[09:51] Team_045 possession (Score: 20-22)
John Wagner attempts a 3Pt. Contested by De'Aaron Rose (4.3 feet, ZONE). John Wagner misses. Rebound secured by Derrick Irving.

[09:37] Team_047 possession (Score: 20-22)
De'Aaron Rose drives, John Wagner stays with him. De'Aaron Rose attempts a Layup. Contested by John Wagner (4.4 feet, MAN). De'Aaron Rose misses. Rebound secured by Cole Simons.

[09:24] Team_045 possession (Score: 20-22)
Trae Russell drives and kicks out. Cole Simons attempts a Midrange. Contested by Blake Jackson (4.4 feet, MAN). Cole Simons misses. Offensive rebound by Tim Sexton! Tim Sexton kicks it out.

[09:11] Team_045 possession (Score: 20-22)
Tim Sexton attempts a Layup. Contested by Josh Harris (4.9 feet, ZONE). Tim Sexton misses. Offensive rebound by Zion Butler! Zion Butler puts it back in!
Score: 22-22

[08:55] Team_047 possession (Score: 22-22)
Myles LaVine attempts a Layup. Contested by Zion Butler (3.9 feet, ZONE). Myles LaVine misses. Rebound secured by Tim Sexton.

[08:41] Team_045 possession (Score: 22-22)
Tim Sexton drives, picks up Josh Harris. Help arrives from Derrick Irving! Tim Sexton attempts a Dunk. Contested by Derrick Irving (4.9 feet, MAN). TIM SEXTON MAKES IT! Assist: John Wagner
Score: 24-22

[08:30] Team_047 possession (Score: 24-22)
Josh Harris throws a bad pass out of bounds! TURNOVER! (dead ball)

[08:30] Substitution (Team_045): Trae Russell OUT → Julius James IN (stamina_rule2)

[08:30] Substitution (Team_045): Cole Simons OUT → Gary Towns IN (stamina_rule2)

[08:30] Substitution (Team_045): Zion Butler OUT → Stephen Paul IN (stamina_rule2)

[08:30] Substitution (Team_047): De'Aaron Rose OUT → Austin Giddey IN (stamina_rule2)

[08:30] Substitution (Team_047): Derrick Irving OUT → Donovan Iverson IN (stamina_rule2)

[08:30] Substitution (Team_047): Josh Harris OUT → Tony Poole IN (stamina_rule2)

[08:30] Substitution (Team_047): Myles LaVine OUT → Zion Thompson IN (stamina_rule2)

[08:18] Team_045 possession (Score: 24-22)
Stephen Paul drives and kicks out. Gary Towns attempts a 3Pt. Contested by Donovan Iverson (4.2 feet, ZONE). GARY TOWNS MAKES IT! Assist: Stephen Paul
Score: 27-22

[08:06] Team_047 possession (Score: 27-22)
FOUL! Holding foul on John Wagner. [Team fouls: 1] No free throws, side out. (John Wagner: 1 personal fouls)

[07:54] Team_047 possession (Score: 27-22)
Donovan Iverson attempts a 3Pt. Contested by John Wagner (4.3 feet, ZONE). Donovan Iverson misses. FOUL! Loose ball foul on Tim Sexton during the rebound battle. [Team fouls: 2] No free throws, side out. (Tim Sexton: 1 personal fouls)

[07:42] Team_047 possession (Score: 27-22)
Tony Poole attempts a Midrange. Contested by Gary Towns (5.6 feet, ZONE). Tony Poole misses. Offensive rebound by Zion Thompson! Zion Thompson kicks it out.

[07:26] Team_047 possession (Score: 27-22)
Donovan Iverson attempts a 3Pt. Contested by Julius James (4.2 feet, MAN). DONOVAN IVERSON MAKES IT! Assist: Austin Giddey
Score: 27-25

[07:12] Team_045 possession (Score: 27-25)
John Wagner attempts a Midrange. Contested by Blake Jackson (4.5 feet, ZONE). John Wagner misses. Rebound secured by Donovan Iverson.

[06:56] Team_047 possession (Score: 27-25)
Austin Giddey attempts a 3Pt. Contested by John Wagner (4.7 feet, MAN). Austin Giddey misses. Rebound secured by Tim Sexton.

[06:42] Team_045 possession (Score: 27-25)
Julius James attempts a 3Pt. Contested by Donovan Iverson (4.4 feet, ZONE). Julius James misses. Rebound secured by Donovan Iverson.

[06:32] Team_047 possession (Score: 27-25)
Zion Thompson drives to the basket... FOUL! Offensive foul on Zion Thompson! Stephen Paul drew the charge! [Team fouls: 1] (Zion Thompson: 1 personal fouls) TURNOVER! (dead ball)

[06:16] Team_045 possession (Score: 27-25)
Stephen Paul attempts a Midrange. Contested by Zion Thompson (5.2 feet, MAN). Stephen Paul misses. Offensive rebound by Tim Sexton! Tim Sexton kicks it out.

[05:58] Team_045 possession (Score: 27-25)
Gary Towns attempts a Midrange. Contested by Donovan Iverson (4.1 feet, ZONE). GARY TOWNS MAKES IT!
Score: 29-25

[05:41] Team_047 possession (Score: 29-25)
Blake Jackson attempts a 3Pt. Contested by John Wagner (3.8 feet, ZONE). Blake Jackson misses. Rebound secured by Tim Sexton.

[05:25] Team_045 possession (Score: 29-25)
Gary Towns attempts a 3Pt. Contested by Donovan Iverson (4.1 feet, ZONE). Gary Towns misses. Rebound secured by Donovan Iverson.

[05:16] Team_047 possession (Score: 29-25)
Austin Giddey loses control! Ball rolls out of bounds! TURNOVER! (dead ball)

[04:59] Team_045 possession (Score: 29-25)
FOUL! Shooting foul on Blake Jackson. Gary Towns to the line for 2 free throws. [Team fouls: 2] (Blake Jackson: 1 personal fouls)   FT 1/2: GOOD   FT 2/2: GOOD Gary Towns makes 2/2 from the line.
Score: 31-25

[04:47] Team_047 possession (Score: 31-25)
Austin Giddey attempts a Midrange. Contested by Stephen Paul (5.1 feet, ZONE). AUSTIN GIDDEY MAKES IT! Assist: Blake Jackson
Score: 31-27

[04:33] Team_045 possession (Score: 31-27)
Julius James drives, picks up Donovan Iverson. Help arrives from Blake Jackson! Julius James attempts a Layup. Contested by Blake Jackson (4.4 feet, MAN). Julius James misses. Rebound secured by Blake Jackson.

[04:17] Team_047 possession (Score: 31-27)
Austin Giddey attempts a 3Pt. Contested by John Wagner (4.7 feet, MAN). AUSTIN GIDDEY MAKES IT! Assist: Zion Thompson
Score: 31-30

[04:01] Team_045 possession (Score: 31-30)
Julius James attempts a Midrange. Contested by Donovan Iverson (4.4 feet, MAN). JULIUS JAMES MAKES IT!
Score: 33-30

[03:47] Team_047 possession (Score: 33-30)
FOUL! Holding foul on Gary Towns. [Team fouls: 3] No free throws, side out. (Gary Towns: 1 personal fouls)

[03:31] Team_047 possession (Score: 33-30)
Austin Giddey attempts a 3Pt. Contested by John Wagner (4.8 feet, ZONE). Austin Giddey misses. Rebound secured by Stephen Paul.

[03:15] Team_045 possession (Score: 33-30)
Stephen Paul drives, Zion Thompson stays with him. Stephen Paul attempts a Dunk. Contested by Zion Thompson (5.2 feet, MAN). STEPHEN PAUL MAKES IT! Assist: John Wagner
Score: 35-30

[03:01] Team_047 possession (Score: 35-30)
Blake Jackson attempts a 3Pt. Contested by John Wagner (4.0 feet, ZONE). BLAKE JACKSON MAKES IT!
Score: 35-33

[02:48] Team_045 possession (Score: 35-33)
FOUL! Shooting foul on Zion Thompson. Stephen Paul to the line for 2 free throws. [Team fouls: 3] (Zion Thompson: 2 personal fouls)   FT 1/2: GOOD   FT 2/2: GOOD Stephen Paul makes 2/2 from the line.
Score: 37-33

[02:37] Team_047 possession (Score: 37-33)
Donovan Iverson attempts a Midrange. Contested by Julius James (4.2 feet, MAN). Donovan Iverson misses. FOUL! Loose ball foul on Stephen Paul during the rebound battle. [Team fouls: 4] No free throws, side out. (Stephen Paul: 1 personal fouls)

[02:21] Team_047 possession (Score: 37-33)
Blake Jackson drives, picks up Stephen Paul. Help arrives from Julius James! Blake Jackson attempts a Dunk. Contested by Julius James (4.3 feet, ZONE). BLAKE JACKSON MAKES IT! Assist: Donovan Iverson
Score: 37-35

[02:04] Team_045 possession (Score: 37-35)
Stephen Paul drives to the basket... Stephen Paul loses the ball! Stripped by Zion Thompson! TURNOVER! (live ball)

[01:49] Team_047 possession (Score: 37-35)
Austin Giddey attempts a Midrange. Contested by John Wagner (5.0 feet, MAN). AUSTIN GIDDEY MAKES IT!
Score: 37-37

[01:31] Team_045 possession (Score: 37-37)
Gary Towns drives to the basket... FOUL! Offensive foul on Gary Towns! Blake Jackson drew the charge! [Team fouls: 5] (Gary Towns: 2 personal fouls) TURNOVER! (dead ball)

[01:15] Team_047 possession (Score: 37-37)
FOUL! Shooting foul on Stephen Paul. Tony Poole to the line for 2 free throws. [BONUS: 6 team fouls] (Stephen Paul: 2 personal fouls)   FT 1/2: GOOD   FT 2/2: GOOD Tony Poole makes 2/2 from the line.
Score: 37-39

[00:59] Team_045 possession (Score: 37-39)
Gary Towns attempts a 3Pt. Contested by Blake Jackson (4.5 feet, MAN). GARY TOWNS MAKES IT! Assist: Julius James
Score: 40-39

[00:44] Team_047 possession (Score: 40-39)
Donovan Iverson attempts a 3Pt. Contested by John Wagner (4.7 feet, ZONE). Donovan Iverson misses. Rebound secured by Stephen Paul.

[00:34] Team_045 possession (Score: 40-39)
Julius James attempts a Midrange. Contested by Austin Giddey (5.1 feet, ZONE). JULIUS JAMES MAKES IT! Assist: Tim Sexton
Score: 42-39

[00:21] Team_047 possession (Score: 42-39)
Austin Giddey attempts a 3Pt. Contested by John Wagner (5.1 feet, MAN). Austin Giddey misses. Rebound secured by Tim Sexton.

[00:08] Team_045 possession (Score: 42-39)
John Wagner attempts a 3Pt. Contested by Donovan Iverson (4.6 feet, ZONE). JOHN WAGNER MAKES IT! Assist: Tim Sexton
Score: 45-39

================================================================================
                              2ND QUARTER COMPLETE                              
================================================================================

2ND QUARTER SCORE: Team_045 27, Team_047 17

BOX SCORE:
================================================================================

Team_045
--------------------------------------------------------------------------------
Player                MIN  PTS  REB  AST  TO      FG   FG%      3P   3P%
--------------------------------------------------------------------------------
Gary Towns             11   10    0    0   0   4/5    80.0     0/0   0.0
Zion Butler            14    4    4    0   0   2/2   100.0     0/0   0.0
Stephen Paul           11    4    2    1   0   2/2   100.0     0/0   0.0
Julius James           11    4    0    1   0   2/4    50.0     0/0   0.0
John Wagner            11    3    0    2   0   1/3    33.3     0/0   0.0
Tim Sexton             11    2    7    2   0   1/2    50.0     0/0   0.0
Trae Russell           14    0    0    1   0   0/1     0.0     0/0   0.0
Cole Simons            14    0    1    0   0   0/0     0.0     0/0   0.0

TEAM: FG: 12/19 (63.2%), 3PT: 2/6 (33.3%), REB: 14 (3 off, 11 def), AST: 7, TO: 3
TEAM FOULS: 6 [Team_047 in BONUS]


Team_047
--------------------------------------------------------------------------------
Player                MIN  PTS  REB  AST  TO      FG   FG%      3P   3P%
--------------------------------------------------------------------------------
Austin Giddey          11    7    0    1   0   3/6    50.0     0/0   0.0
Blake Jackson          11    5    2    1   0   2/4    50.0     0/0   0.0
Donovan Iverson        11    3    3    1   0   1/2    50.0     0/0   0.0
Tony Poole             11    2    0    0   0   1/1   100.0     0/0   0.0
De'Aaron Rose          14    0    0    0   0   0/2     0.0     0/0   0.0
Derrick Irving         14    0    3    0   0   0/0     0.0     0/0   0.0
Blake Jokic            13    0    0    0   0   0/1     0.0     0/0   0.0
Myles LaVine           14    0    1    0   0   0/1     0.0     0/0   0.0
Josh Harris            14    0    0    0   0   0/1     0.0     0/0   0.0
Zion Thompson          11    0    2    1   0   0/0     0.0     0/0   0.0

TEAM: FG: 7/18 (38.9%), 3PT: 3/10 (30.0%), REB: 11 (4 off, 7 def), AST: 4, TO: 3
TEAM FOULS: 3

================================================================================

================================================================================
                       3RD QUARTER - Team_045 vs Team_047                       
================================================================================

[12:00] Team_045 possession (Score: 45-39)
Zion Butler makes the Layup and draws the foul on Myles LaVine! And-1! Zion Butler to the line for 1. [Team fouls: 1] (Myles LaVine: 1 personal fouls)   FT 1/1: MISS Zion Butler makes 0/1 from the line. Rebound secured by Myles LaVine.
Score: 47-39

[11:42] Team_047 possession (Score: 47-39)
Derrick Irving attempts a 3Pt. Contested by Cole Simons (3.6 feet, ZONE). DERRICK IRVING MAKES IT! Assist: De'Aaron Rose
Score: 47-42

[11:24] Team_045 possession (Score: 47-42)
Rudy Antetokounmpo drives, De'Aaron Rose stays with him. Rudy Antetokounmpo attempts a Layup. Contested by De'Aaron Rose (4.3 feet, MAN). Rudy Antetokounmpo misses. Rebound secured by Josh Harris.

[11:13] Team_047 possession (Score: 47-42)
Blake Jokic attempts a 3Pt. Contested by Cole Simons (3.1 feet, MAN). BLAKE JOKIC MAKES IT!
Score: 47-45

[11:02] Team_045 possession (Score: 47-45)
FOUL! Reach-in foul on Myles LaVine during the drive. [Team fouls: 2] No free throws, side out. (Myles LaVine: 2 personal fouls)

[10:51] Team_045 possession (Score: 47-45)
Zion Butler drives and kicks out. Trae Russell attempts a 3Pt. Contested by Derrick Irving (4.8 feet, MAN). Trae Russell misses. Rebound secured by Josh Harris.

[10:37] Team_047 possession (Score: 47-45)
Blake Jokic attempts a Layup. Contested by Cole Simons (3.1 feet, MAN). Blake Jokic misses. Rebound secured by DeMar Turner.

[10:20] Team_045 possession (Score: 47-45)
Cole Simons makes the 3Pt and draws the foul on Blake Jokic! And-1! Cole Simons to the line for 1. [Team fouls: 3] (Blake Jokic: 1 personal fouls)   FT 1/1: GOOD Cole Simons makes 1/1 from the line.
Score: 51-45

[10:04] Team_047 possession (Score: 51-45)
Myles LaVine drives and kicks out. De'Aaron Rose attempts a 3Pt. Contested by Rudy Antetokounmpo (4.4 feet, ZONE). DE'AARON ROSE MAKES IT! Assist: Blake Jokic
Score: 51-48

[09:52] Team_045 possession (Score: 51-48)
Zion Butler attempts a Dunk. BLOCKED BY JOSH HARRIS! Ball goes out off Josh Harris. Zion Butler's ball!

[09:33] Team_045 possession (Score: 51-48)
Cole Simons attempts a Midrange. Contested by Josh Harris (4.8 feet, ZONE). COLE SIMONS MAKES IT!
Score: 53-48

[09:23] Team_047 possession (Score: 53-48)
Blake Jokic attempts a Midrange. Contested by Cole Simons (3.1 feet, MAN). Blake Jokic misses. FOUL! Loose ball foul on Zion Butler during the rebound battle. [Team fouls: 1] No free throws, side out. (Zion Butler: 1 personal fouls)

[09:04] Team_047 possession (Score: 53-48)
FOUL! Shooting foul on Cole Simons. De'Aaron Rose to the line for 3 free throws. [Team fouls: 2] (Cole Simons: 1 personal fouls)   FT 1/3: GOOD   FT 2/3: GOOD   FT 3/3: GOOD De'Aaron Rose makes 3/3 from the line.
Score: 53-51

[08:48] Team_045 possession (Score: 53-51)
Rudy Antetokounmpo attempts a 3Pt. Contested by De'Aaron Rose (4.3 feet, ZONE). Rudy Antetokounmpo misses. Rebound secured by Myles LaVine.

[08:36] Team_047 possession (Score: 53-51)
Josh Harris attempts a 3Pt. Contested by Zion Butler (3.5 feet, MAN). Josh Harris misses. Rebound secured by Cole Simons.

[08:22] Team_045 possession (Score: 53-51)
Rudy Antetokounmpo attempts a 3Pt. Contested by De'Aaron Rose (4.3 feet, MAN). Rudy Antetokounmpo misses. Rebound secured by Josh Harris.

[08:12] Team_047 possession (Score: 53-51)
Derrick Irving attempts a Layup. Contested by Cole Simons (3.6 feet, MAN). DERRICK IRVING MAKES IT!
Score: 53-53

[08:00] Team_045 possession (Score: 53-53)
FOUL! Holding foul on Blake Jokic. [Team fouls: 4] No free throws, side out. (Blake Jokic: 2 personal fouls)

[07:44] Team_045 possession (Score: 53-53)
Zion Butler makes the Dunk and draws the foul on Derrick Irving! And-1! Zion Butler to the line for 1. [BONUS: 5 team fouls] (Derrick Irving: 1 personal fouls)   FT 1/1: GOOD Zion Butler makes 1/1 from the line.
Score: 56-53

[07:34] Team_047 possession (Score: 56-53)
Myles LaVine attempts a Midrange. Contested by Trae Russell (5.5 feet, ZONE). Myles LaVine misses. Rebound secured by DeMar Turner.

[07:21] Team_045 possession (Score: 56-53)
Rudy Antetokounmpo attempts a Midrange. Contested by De'Aaron Rose (4.3 feet, MAN). RUDY ANTETOKOUNMPO MAKES IT! Assist: DeMar Turner
Score: 58-53

[07:06] Team_047 possession (Score: 58-53)
Myles LaVine drives, picks up Zion Butler. Help arrives from Rudy Antetokounmpo! Myles LaVine attempts a Dunk. Contested by Rudy Antetokounmpo (3.4 feet, MAN). MYLES LAVINE MAKES IT! Assist: De'Aaron Rose
Score: 58-55

[06:54] Team_045 possession (Score: 58-55)
Trae Russell attempts a Layup. BLOCKED BY JOSH HARRIS! Ball is loose! Offensive rebound by Zion Butler! Zion Butler kicks it out.

[06:38] Team_045 possession (Score: 58-55)
Rudy Antetokounmpo attempts a 3Pt. Contested by De'Aaron Rose (4.3 feet, MAN). RUDY ANTETOKOUNMPO MAKES IT! Assist: Zion Butler
Score: 61-55

[06:23] Team_047 possession (Score: 61-55)
Myles LaVine attempts a Layup. BLOCKED BY ZION BUTLER! Ball is loose! Rebound secured by DeMar Turner.

[06:12] Team_045 possession (Score: 61-55)
Trae Russell drives and kicks out. Trae Russell attempts a Midrange. Contested by Derrick Irving (4.8 feet, MAN). TRAE RUSSELL MAKES IT!
Score: 63-55

[05:56] Team_047 possession (Score: 63-55)
Myles LaVine drives and kicks out. Josh Harris attempts a Midrange. Contested by DeMar Turner (4.9 feet, ZONE). Josh Harris misses. Rebound secured by DeMar Turner.

[05:44] Team_045 possession (Score: 63-55)
DeMar Turner attempts a 3Pt. Contested by De'Aaron Rose (4.3 feet, ZONE). DeMar Turner misses. Rebound secured by Derrick Irving.

[05:29] Team_047 possession (Score: 63-55)
Blake Jokic attempts a 3Pt. Contested by Cole Simons (3.2 feet, ZONE). Blake Jokic misses. Rebound secured by Zion Butler.

[05:16] Team_045 possession (Score: 63-55)
Zion Butler drives, picks up Josh Harris. Help arrives from Derrick Irving! Zion Butler attempts a Dunk. Contested by Derrick Irving (4.5 feet, ZONE). ZION BUTLER MAKES IT! Assist: DeMar Turner
Score: 65-55

[05:01] Team_047 possession (Score: 65-55)
Myles LaVine attempts a Layup. Contested by Zion Butler (3.5 feet, ZONE). Myles LaVine misses. Rebound secured by DeMar Turner.

[04:43] Team_045 possession (Score: 65-55)
Rudy Antetokounmpo makes the Midrange and draws the foul on De'Aaron Rose! And-1! Rudy Antetokounmpo to the line for 1. [BONUS: 6 team fouls] (De'Aaron Rose: 1 personal fouls)   FT 1/1: GOOD Rudy Antetokounmpo makes 1/1 from the line.
Score: 68-55

[04:33] Team_047 possession (Score: 68-55)
Josh Harris makes the Layup and draws the foul on Rudy Antetokounmpo! And-1! Josh Harris to the line for 1. [Team fouls: 3] (Rudy Antetokounmpo: 1 personal fouls)   FT 1/1: GOOD Josh Harris makes 1/1 from the line.
Score: 68-58

[04:17] Team_045 possession (Score: 68-58)
Rudy Antetokounmpo attempts a Layup. BLOCKED BY JOSH HARRIS! Ball is loose! Rebound secured by Josh Harris.

[04:04] Team_047 possession (Score: 68-58)
Myles LaVine drives, Zion Butler stays with him. Myles LaVine attempts a Dunk. Contested by Zion Butler (3.6 feet, MAN). Myles LaVine misses. FOUL! Loose ball foul on Zion Butler during the rebound battle. [Team fouls: 4] No free throws, side out. (Zion Butler: 2 personal fouls)

[03:48] Team_047 possession (Score: 68-58)
Josh Harris attempts a 3Pt. Contested by Cole Simons (3.7 feet, ZONE). JOSH HARRIS MAKES IT! Assist: Myles LaVine
Score: 68-61

[03:34] Team_045 possession (Score: 68-61)
Zion Butler drives, Myles LaVine stays with him. Zion Butler attempts a Dunk. Contested by Myles LaVine (5.6 feet, MAN). ZION BUTLER MAKES IT! Assist: DeMar Turner
Score: 70-61

[03:17] Team_047 possession (Score: 70-61)
Derrick Irving drives to the basket... FOUL! Offensive foul on Derrick Irving! Zion Butler drew the charge! [Team fouls: 7] (Derrick Irving: 2 personal fouls) TURNOVER! (dead ball)

[03:02] Team_045 possession (Score: 70-61)
FOUL! Offensive foul on Trae Russell! Derrick Irving drew the charge! [Team fouls: 5] (Trae Russell: 1 personal fouls) TURNOVER! (dead ball)

[02:44] Team_047 possession (Score: 70-61)
Derrick Irving attempts a 3Pt. Contested by Cole Simons (3.9 feet, ZONE). DERRICK IRVING MAKES IT! Assist: De'Aaron Rose
Score: 70-64

[02:31] Team_045 possession (Score: 70-64)
Trae Russell attempts a 3Pt. Contested by Derrick Irving (5.5 feet, MAN). Trae Russell misses. Offensive rebound by Zion Butler! Zion Butler puts it back in!
Score: 72-64

[02:18] Team_047 possession (Score: 72-64)
Derrick Irving attempts a 3Pt. Contested by Cole Simons (4.0 feet, MAN). Derrick Irving misses. Rebound secured by DeMar Turner.

[02:04] Team_045 possession (Score: 72-64)
Rudy Antetokounmpo drives, Josh Harris stays with him. Rudy Antetokounmpo attempts a Layup. Contested by Josh Harris (4.8 feet, ZONE). RUDY ANTETOKOUNMPO MAKES IT! Assist: Cole Simons
Score: 74-64

[01:51] Team_047 possession (Score: 74-64)
Derrick Irving attempts a 3Pt. Contested by Cole Simons (4.0 feet, ZONE). Derrick Irving misses. Rebound secured by DeMar Turner.

[01:35] Team_045 possession (Score: 74-64)
Rudy Antetokounmpo drives, De'Aaron Rose stays with him. Rudy Antetokounmpo attempts a Dunk. Contested by De'Aaron Rose (4.7 feet, MAN). RUDY ANTETOKOUNMPO MAKES IT!
Score: 76-64

[01:21] Team_047 possession (Score: 76-64)
FOUL! Shooting foul on Cole Simons. Blake Jokic to the line for 3 free throws. [BONUS: 6 team fouls] (Cole Simons: 2 personal fouls)   FT 1/3: GOOD   FT 2/3: GOOD   FT 3/3: MISS Blake Jokic makes 2/3 from the line. Rebound secured by Cole Simons.
Score: 76-66

[01:09] Team_045 possession (Score: 76-66)
Zion Butler makes the Layup and draws the foul on Myles LaVine! And-1! Zion Butler to the line for 1. [BONUS: 8 team fouls] (Myles LaVine: 3 personal fouls)   FT 1/1: GOOD Zion Butler makes 1/1 from the line.
Score: 79-66

[00:54] Team_047 possession (Score: 79-66)
Blake Jokic attempts a 3Pt. Contested by Cole Simons (3.7 feet, ZONE). Blake Jokic misses. Offensive rebound by Myles LaVine! Myles LaVine kicks it out.

[00:40] Team_047 possession (Score: 79-66)
De'Aaron Rose drives and kicks out. Myles LaVine attempts a Midrange. Contested by Zion Butler (4.1 feet, MAN). Myles LaVine misses. Offensive rebound by Josh Harris! Josh Harris kicks it out.

[00:27] Team_047 possession (Score: 79-66)
Blake Jokic drives, picks up Zion Butler. Help arrives from Rudy Antetokounmpo! Blake Jokic attempts a Dunk. Contested by Rudy Antetokounmpo (3.9 feet, ZONE). Blake Jokic misses. Rebound secured by DeMar Turner.

[00:13] Team_045 possession (Score: 79-66)
Cole Simons attempts a 3Pt. Contested by Blake Jokic (5.7 feet, MAN). Cole Simons misses. Rebound secured by Josh Harris.

================================================================================
                              3RD QUARTER COMPLETE                              
================================================================================

3RD QUARTER SCORE: Team_045 34, Team_047 27

BOX SCORE:
================================================================================

Team_045
--------------------------------------------------------------------------------
Player                MIN  PTS  REB  AST  TO      FG   FG%      3P   3P%
--------------------------------------------------------------------------------
Zion Butler            26   12    3    1   0   5/7    71.4     0/0   0.0
Rudy Antetokounmpo     25   12    0    0   0   5/9    55.6     0/0   0.0
Cole Simons            26    6    2    1   0   2/3    66.7     0/0   0.0
Trae Russell           26    2    0    0   0   1/1   100.0     0/0   0.0
DeMar Turner           25    0    8    3   0   0/1     0.0     0/0   0.0

TEAM: FG: 13/21 (61.9%), 3PT: 3/7 (42.9%), REB: 13 (2 off, 11 def), AST: 5, TO: 1
TEAM FOULS: 6 [Team_047 in BONUS]


Team_047
--------------------------------------------------------------------------------
Player                MIN  PTS  REB  AST  TO      FG   FG%      3P   3P%
--------------------------------------------------------------------------------
Derrick Irving         26    8    1    0   0   3/5    60.0     0/0   0.0
De'Aaron Rose          26    6    0    3   0   2/2   100.0     0/0   0.0
Josh Harris            26    6    6    0   0   2/3    66.7     0/0   0.0
Blake Jokic            25    3    0    1   0   1/5    20.0     0/0   0.0
Myles LaVine           26    2    5    1   0   1/5    20.0     0/0   0.0

TEAM: FG: 9/20 (45.0%), 3PT: 5/10 (50.0%), REB: 12 (4 off, 8 def), AST: 5, TO: 1
TEAM FOULS: 8 [Team_045 in BONUS]

================================================================================

================================================================================
                       4TH QUARTER - Team_045 vs Team_047                       
================================================================================

[12:00] Team_045 possession (Score: 79-66)
Cole Simons drives to the basket... FOUL! Offensive foul on Cole Simons! Josh Harris drew the charge! [Team fouls: 1] (Cole Simons: 1 personal fouls) TURNOVER! (dead ball)

[11:45] Team_047 possession (Score: 79-66)
FOUL! Holding foul on Zion Butler. [Team fouls: 2] No free throws, side out. (Zion Butler: 1 personal fouls)

[11:27] Team_047 possession (Score: 79-66)
FOUL! Holding foul on Zion Butler. [Team fouls: 3] No free throws, side out. (Zion Butler: 2 personal fouls)

[11:15] Team_047 possession (Score: 79-66)
Josh Harris drives to the basket... FOUL! Offensive foul on Josh Harris! DeMar Turner drew the charge! [Team fouls: 1] (Josh Harris: 1 personal fouls) TURNOVER! (dead ball)

[11:00] Team_045 possession (Score: 79-66)
Rudy Antetokounmpo drives and kicks out. Cole Simons attempts a 3Pt. Contested by De'Aaron Rose (4.4 feet, ZONE). COLE SIMONS MAKES IT! Assist: DeMar Turner
Score: 82-66

[10:47] Team_047 possession (Score: 82-66)
Derrick Irving attempts a 3Pt. Contested by Cole Simons (4.1 feet, MAN). Derrick Irving misses. Rebound secured by Zion Butler.

[10:29] Team_045 possession (Score: 82-66)
FOUL! Holding foul on Josh Harris. [Team fouls: 2] No free throws, side out. (Josh Harris: 2 personal fouls)

[10:11] Team_045 possession (Score: 82-66)
DeMar Turner drives to the basket... DeMar Turner loses the ball! Stripped by Josh Harris! TURNOVER! (live ball)

[09:56] Team_047 possession (Score: 82-66)
De'Aaron Rose drives, Rudy Antetokounmpo stays with him. De'Aaron Rose attempts a Layup. Contested by Rudy Antetokounmpo (5.2 feet, MAN). De'Aaron Rose misses. Offensive rebound by Josh Harris! Josh Harris kicks it out.

[09:45] Team_047 possession (Score: 82-66)
FOUL! Shooting foul on Zion Butler. Josh Harris to the line for 2 free throws. [Team fouls: 4] (Zion Butler: 3 personal fouls)   FT 1/2: GOOD   FT 2/2: GOOD Josh Harris makes 2/2 from the line.
Score: 82-68

[09:28] Team_045 possession (Score: 82-68)
Rudy Antetokounmpo attempts a 3Pt. Contested by De'Aaron Rose (4.9 feet, MAN). Rudy Antetokounmpo misses. Rebound secured by Josh Harris.

[09:12] Team_047 possession (Score: 82-68)
Myles LaVine attempts a Layup. Contested by DeMar Turner (5.5 feet, ZONE). Myles LaVine misses. Rebound secured by Cole Simons.

[08:55] Team_045 possession (Score: 82-68)
Cole Simons attempts a 3Pt. Contested by De'Aaron Rose (5.1 feet, ZONE). Cole Simons misses. Rebound secured by Myles LaVine.

[08:37] Team_047 possession (Score: 82-68)
Blake Jokic drives to the basket... Blake Jokic throws a bad pass out of bounds! TURNOVER! (dead ball)

[08:37] Substitution (Team_045): Rudy Antetokounmpo OUT → John Wagner IN (stamina_rule2)

[08:37] Substitution (Team_045): Trae Russell OUT → Julius James IN (stamina_rule2)

[08:37] Substitution (Team_045): Cole Simons OUT → Gary Towns IN (stamina_rule2)

[08:37] Substitution (Team_045): DeMar Turner OUT → Tim Sexton IN (stamina_rule2)

[08:37] Substitution (Team_045): Zion Butler OUT → Stephen Paul IN (stamina_rule2)

[08:37] Substitution (Team_047): De'Aaron Rose OUT → Austin Giddey IN (stamina_rule2)

[08:37] Substitution (Team_047): Derrick Irving OUT → Donovan Iverson IN (stamina_rule2)

[08:37] Substitution (Team_047): Blake Jokic OUT → Blake Jackson IN (stamina_rule2)

[08:37] Substitution (Team_047): Josh Harris OUT → Tony Poole IN (stamina_rule2)

[08:37] Substitution (Team_047): Myles LaVine OUT → Zion Thompson IN (stamina_rule2)

[08:23] Team_045 possession (Score: 82-68)
Gary Towns attempts a 3Pt. Contested by Blake Jackson (4.2 feet, MAN). Gary Towns misses. Rebound secured by Zion Thompson.

[08:11] Team_047 possession (Score: 82-68)
Donovan Iverson loses the ball! Stripped by Julius James! TURNOVER! (live ball)

[07:57] Team_045 possession (Score: 82-68)
Julius James makes the Dunk and draws the foul on Zion Thompson! And-1! Julius James to the line for 1. [Team fouls: 3] (Zion Thompson: 1 personal fouls)   FT 1/1: GOOD Julius James makes 1/1 from the line.
Score: 85-68

[07:44] Team_047 possession (Score: 85-68)
Blake Jackson attempts a 3Pt. Contested by Gary Towns (4.7 feet, MAN). BLAKE JACKSON MAKES IT! Assist: Zion Thompson
Score: 85-71

[07:29] Team_045 possession (Score: 85-71)
Julius James attempts a 3Pt. Contested by Donovan Iverson (4.4 feet, ZONE). JULIUS JAMES MAKES IT! Assist: Tim Sexton
Score: 88-71

[07:16] Team_047 possession (Score: 88-71)
Tony Poole attempts a 3Pt. Contested by John Wagner (4.7 feet, ZONE). Tony Poole misses. Rebound secured by Julius James.

[07:01] Team_045 possession (Score: 88-71)
Stephen Paul attempts a Layup. BLOCKED BY ZION THOMPSON! Ball is loose! Rebound secured by Blake Jackson.

[06:49] Team_047 possession (Score: 88-71)
Zion Thompson drives, Stephen Paul stays with him. Zion Thompson attempts a Dunk. Contested by Stephen Paul (4.4 feet, ZONE). Zion Thompson misses. Offensive rebound by Blake Jackson! Blake Jackson kicks it out.

[06:34] Team_047 possession (Score: 88-71)
Zion Thompson attempts a Layup. Contested by Stephen Paul (4.4 feet, ZONE). ZION THOMPSON MAKES IT! Assist: Blake Jackson
Score: 88-73

[06:17] Team_045 possession (Score: 88-73)
Stephen Paul attempts a Layup. Contested by Zion Thompson (5.2 feet, MAN). STEPHEN PAUL MAKES IT! Assist: Gary Towns
Score: 90-73

[06:06] Team_047 possession (Score: 90-73)
Zion Thompson attempts a Midrange. Contested by Stephen Paul (4.4 feet, ZONE). ZION THOMPSON MAKES IT! Assist: Austin Giddey
Score: 90-75

[05:50] Team_045 possession (Score: 90-75)
Gary Towns attempts a Midrange. Contested by Tony Poole (4.9 feet, ZONE). GARY TOWNS MAKES IT!
Score: 92-75

[05:41] Team_047 possession (Score: 92-75)
Blake Jackson throws a bad pass! Stolen by Gary Towns! TURNOVER! (live ball)

[05:24] Team_045 possession (Score: 92-75)
FOUL! Holding foul on Zion Thompson. [Team fouls: 4] No free throws, side out. (Zion Thompson: 2 personal fouls)

[05:13] Team_045 possession (Score: 92-75)
Stephen Paul drives, Zion Thompson stays with him. Stephen Paul attempts a Layup. Contested by Zion Thompson (5.2 feet, MAN). Stephen Paul misses. Offensive rebound by Julius James! Julius James kicks it out.

[04:58] Team_045 possession (Score: 92-75)
John Wagner attempts a Midrange. Contested by Austin Giddey (5.0 feet, MAN). John Wagner misses. Rebound secured by Blake Jackson.

[04:46] Team_047 possession (Score: 92-75)
Tony Poole attempts a 3Pt. Contested by Tim Sexton (5.2 feet, MAN). Tony Poole misses. FOUL! Loose ball foul on Tim Sexton during the rebound battle. [IN THE BONUS! 5 team fouls] Zion Thompson to the line for 2 free throws. (Tim Sexton: 1 personal fouls)   FT 1/2: GOOD   FT 2/2: GOOD Zion Thompson makes 2/2 from the line.
Score: 92-77

[04:32] Team_045 possession (Score: 92-77)
Gary Towns attempts a Midrange. BLOCKED BY AUSTIN GIDDEY! Ball is loose! Rebound secured by Donovan Iverson.

[04:18] Team_047 possession (Score: 92-77)
Tony Poole attempts a 3Pt. Contested by Tim Sexton (5.2 feet, MAN). Tony Poole misses. FOUL! Loose ball foul on Julius James during the rebound battle. [IN THE BONUS! 6 team fouls] Zion Thompson to the line for 2 free throws. (Julius James: 1 personal fouls)   FT 1/2: GOOD   FT 2/2: GOOD Zion Thompson makes 2/2 from the line.
Score: 92-79

[04:03] Team_045 possession (Score: 92-79)
FOUL! Shooting foul on Donovan Iverson. Tim Sexton to the line for 3 free throws. [BONUS: 5 team fouls] (Donovan Iverson: 1 personal fouls)   FT 1/3: GOOD   FT 2/3: GOOD   FT 3/3: GOOD Tim Sexton makes 3/3 from the line.
Score: 95-79

[03:46] Team_047 possession (Score: 95-79)
Austin Giddey attempts a 3Pt. Contested by John Wagner (4.7 feet, ZONE). AUSTIN GIDDEY MAKES IT! Assist: Zion Thompson
Score: 95-82

[03:32] Team_045 possession (Score: 95-82)
Stephen Paul drives, Zion Thompson stays with him. Stephen Paul attempts a Dunk. Contested by Zion Thompson (5.2 feet, MAN). Stephen Paul misses. Rebound secured by Donovan Iverson.

[03:16] Team_047 possession (Score: 95-82)
Blake Jackson attempts a 3Pt. Contested by John Wagner (3.8 feet, ZONE). BLAKE JACKSON MAKES IT! Assist: Austin Giddey
Score: 95-85

[02:56] Team_045 possession (Score: 95-85)
Gary Towns attempts a 3Pt. Contested by Blake Jackson (4.2 feet, MAN). Gary Towns misses. Offensive rebound by Julius James! Julius James kicks it out.

[02:40] Team_045 possession (Score: 95-85)
Julius James drives and kicks out. Julius James attempts a Midrange. Contested by Donovan Iverson (4.2 feet, MAN). Julius James misses. Offensive rebound by Tim Sexton! Tim Sexton kicks it out.

[02:23] Team_045 possession (Score: 95-85)
Gary Towns drives to the basket... Gary Towns loses control! Ball rolls out of bounds! TURNOVER! (dead ball)

[02:07] Team_047 possession (Score: 95-85)
Blake Jackson attempts a Layup. Contested by Stephen Paul (4.2 feet, ZONE). Blake Jackson misses. Rebound secured by Stephen Paul.

[01:49] Team_045 possession (Score: 95-85)
Gary Towns makes the Layup and draws the foul on Zion Thompson! And-1! Gary Towns to the line for 1. [BONUS: 6 team fouls] (Zion Thompson: 3 personal fouls)   FT 1/1: GOOD Gary Towns makes 1/1 from the line.
Score: 98-85

[01:39] Team_047 possession (Score: 98-85)
Blake Jackson loses the ball! Stripped by Gary Towns! TURNOVER! (live ball)

[01:26] Team_045 possession (Score: 98-85)
Stephen Paul attempts a 3Pt. Contested by Zion Thompson (5.3 feet, MAN). Stephen Paul misses. Offensive rebound by Tim Sexton! Tim Sexton kicks it out.

[01:09] Team_045 possession (Score: 98-85)
Gary Towns attempts a 3Pt. Contested by Blake Jackson (4.2 feet, MAN). Gary Towns misses. Rebound secured by Zion Thompson.

[00:55] Team_047 possession (Score: 98-85)
Zion Thompson attempts a 3Pt. Contested by John Wagner (4.1 feet, ZONE). Zion Thompson misses. Rebound secured by Julius James.

[00:44] Team_045 possession (Score: 98-85)
John Wagner attempts a 3Pt. Contested by Austin Giddey (5.0 feet, MAN). JOHN WAGNER MAKES IT! Assist: Tim Sexton
Score: 101-85

[00:28] Team_047 possession (Score: 101-85)
Blake Jackson attempts a Layup. Contested by Gary Towns (4.8 feet, MAN). BLAKE JACKSON MAKES IT!
Score: 101-87

[00:09] Team_045 possession (Score: 101-87)
Stephen Paul drives and kicks out. Stephen Paul attempts a 3Pt. Contested by Donovan Iverson (4.4 feet, ZONE). Stephen Paul misses. Offensive rebound by Julius James! Julius James kicks it out.

================================================================================
                              4TH QUARTER COMPLETE                              
================================================================================

4TH QUARTER SCORE: Team_045 22, Team_047 21

BOX SCORE:
================================================================================

Team_045
--------------------------------------------------------------------------------
Player                MIN  PTS  REB  AST  TO      FG   FG%      3P   3P%
--------------------------------------------------------------------------------
Julius James           19    6    5    0   0   2/2   100.0     0/0   0.0
Gary Towns             19    5    0    1   0   2/5    40.0     0/0   0.0
Cole Simons            29    3    1    0   0   1/2    50.0     0/0   0.0
Tim Sexton             19    3    2    2   0   1/1   100.0     0/0   0.0
John Wagner            19    3    0    0   0   1/2    50.0     0/0   0.0
Stephen Paul           19    2    1    0   0   1/3    33.3     0/0   0.0
DeMar Turner           29    0    0    1   0   0/0     0.0     0/0   0.0
Zion Butler            29    0    1    0   0   0/0     0.0     0/0   0.0
Rudy Antetokounmpo     29    0    0    0   0   0/1     0.0     0/0   0.0

TEAM: FG: 8/16 (50.0%), 3PT: 3/7 (42.9%), REB: 10 (5 off, 5 def), AST: 4, TO: 3
TEAM FOULS: 6 [Team_047 in BONUS]


Team_047
--------------------------------------------------------------------------------
Player                MIN  PTS  REB  AST  TO      FG   FG%      3P   3P%
--------------------------------------------------------------------------------
Zion Thompson          19    8    2    2   0   4/5    80.0     0/0   0.0
Blake Jackson          19    8    3    1   0   3/4    75.0     0/0   0.0
Austin Giddey          19    3    0    2   0   1/1   100.0     0/0   0.0
Josh Harris            29    2    2    0   0   1/1   100.0     0/0   0.0
Derrick Irving         29    0    0    0   0   0/1     0.0     0/0   0.0
Myles LaVine           29    0    1    0   0   0/1     0.0     0/0   0.0
Tony Poole             19    0    0    0   0   0/1     0.0     0/0   0.0
Donovan Iverson        19    0    2    0   0   0/0     0.0     0/0   0.0

TEAM: FG: 9/14 (64.3%), 3PT: 5/8 (62.5%), REB: 10 (2 off, 8 def), AST: 5, TO: 5
TEAM FOULS: 6 [Team_045 in BONUS]

================================================================================

================================================================================
                               FULL GAME COMPLETE                               
================================================================================

FINAL SCORE: Team_045 101, Team_047 87

SCORING BY QUARTER:
--------------------------------------------------------------------------------
Team                     Q1     Q2     Q3     Q4    FINAL
--------------------------------------------------------------------------------
Team_045                 18     27     34     22      101
Team_047                 22     17     27     21       87
--------------------------------------------------------------------------------

FULL GAME BOX SCORE:
================================================================================

Team_045
--------------------------------------------------------------------------------
Player                MIN  PTS  REB  AST  TO      FG   FG%      3P   3P%      FT STL BLK
--------------------------------------------------------------------------------
Trae Russell           29    2    0    2   1   2/4    50.0   1/1   100.0   0/0     0   0
Cole Simons            29    9    5    3   1   2/6    33.3   1/3    33.3   1/1     1   0
Zion Butler            29   26   11    1   0   9/13   69.2   0/2     0.0   3/5     2   2
Rudy Antetokounmpo     29   15    0    1   1   7/17   41.2   2/9    22.2   4/4     0   0
DeMar Turner           29    2   16    5   1   2/5    40.0   0/1     0.0   0/0     0   0
John Wagner            19    6    0    2   0   2/5    40.0   2/3    66.7   0/0     0   0
Tim Sexton             19    5    9    4   3   3/4    75.0   1/2    50.0   3/3     0   0
Julius James           19   10    5    1   0   4/7    57.1   1/2    50.0   1/1     1   0
Gary Towns             19   18    0    1   0   6/10   60.0   2/5    40.0   3/3     2   0
Stephen Paul           19    6    3    1   0   4/7    57.1   0/0     0.0   2/2     1   0

TEAM: FG: 41/78 (52.6%), 3PT: 10/28 (35.7%), REB: 49 (13 off, 36 def), AST: 21, TO: 7


Team_047
--------------------------------------------------------------------------------
Player                MIN  PTS  REB  AST  TO      FG   FG%      3P   3P%      FT STL BLK
--------------------------------------------------------------------------------
De'Aaron Rose          29    6    0    3   2   1/4    25.0   1/1   100.0   4/5     0   0
Derrick Irving         29   10    9    1   2   4/10   40.0   2/7    28.6   0/0     0   0
Josh Harris            29   17    9    1   2   6/9    66.7   3/5    60.0   4/4     1   3
Myles LaVine           29    5   13    1   1   3/10   30.0   1/1   100.0   0/0     0   0
Blake Jokic            29    5    0    3   1   2/9    22.2   1/4    25.0   2/3     0   0
Blake Jackson          19   13    5    2   2   5/8    62.5   3/5    60.0   0/0     0   0
Austin Giddey          19   12    0    3   1   4/7    57.1   2/5    40.0   2/2     0   1
Donovan Iverson        19    6    6    1   2   2/4    50.0   2/3    66.7   0/0     0   0
Tony Poole             19    2    0    1   1   3/4    75.0   2/3    66.7   2/2     0   0
Zion Thompson          19    8    5    3   0   2/3    66.7   0/1     0.0   4/4     1   1

TEAM: FG: 33/69 (47.8%), 3PT: 17/35 (48.6%), REB: 47 (10 off, 37 def), AST: 19, TO: 14

================================================================================
