================================================================================
                        FULL GAME - Team_060 vs Team_012                        
================================================================================

================================================================================
                       1ST QUARTER - Team_060 vs Team_012                       
================================================================================

[12:00] Team_060 possession (Score: 0-0)
FOUL! Reach-in foul on Paolo Durant during the drive. [Team fouls: 1] No free throws, side out. (Paolo Durant: 1 personal fouls)

[11:50] Team_060 possession (Score: 0-0)
Jaren George loses the ball! Stripped by Ayo McGrady! TURNOVER! (live ball)

[11:37] Team_012 possession (Score: 0-0)
FOUL! Shooting foul on Larry Westbrook. Pascal Herro to the line for 2 free throws. [Team fouls: 1] (Larry Westbrook: 1 personal fouls)   FT 1/2: GOOD   FT 2/2: GOOD Pascal Herro makes 2/2 from the line.
Score: 0-2

[11:24] Team_060 possession (Score: 0-2)
Julius Green attempts a Midrange. Contested by RJ Nowitzki (3.2 feet, MAN). JULIUS GREEN MAKES IT! Assist: Immanuel Ming
Score: 2-2

[11:10] Team_012 possession (Score: 2-2)
Pascal Herro makes the Layup and draws the foul on Joel Morant! And-1! Pascal Herro to the line for 1. [Team fouls: 2] (Joel Morant: 1 personal fouls)   FT 1/1: MISS Pascal Herro makes 0/1 from the line. Rebound secured by Larry Westbrook.
Score: 2-4

[10:57] Team_060 possession (Score: 2-4)
Jaren George attempts a Midrange. Contested by Ayo McGrady (4.4 feet, MAN). Jaren George misses. Rebound secured by Paolo Durant.

[10:41] Team_012 possession (Score: 2-4)
Pascal Herro throws a bad pass out of bounds! TURNOVER! (dead ball)

[10:24] Team_060 possession (Score: 2-4)
Immanuel Ming drives, Paolo Durant stays with him. Immanuel Ming attempts a Layup. Contested by Paolo Durant (3.5 feet, ZONE). IMMANUEL MING MAKES IT!
Score: 4-4

[10:13] Team_012 possession (Score: 4-4)
Pascal Herro attempts a 3Pt. Contested by Julius Green (4.3 feet, ZONE). Pascal Herro misses. Rebound secured by Immanuel Ming.

[09:59] Team_060 possession (Score: 4-4)
Immanuel Ming attempts a 3Pt. Contested by RJ Nowitzki (3.4 feet, ZONE). Immanuel Ming misses. Rebound secured by Paolo Durant.

[09:41] Team_012 possession (Score: 4-4)
Paolo Durant drives, picks up Jaren George. Help arrives from Julius Green! Paolo Durant attempts a Layup. Contested by Julius Green (5.3 feet, ZONE). Paolo Durant misses. Rebound secured by Larry Westbrook.

[09:30] Team_060 possession (Score: 4-4)
Julius Green attempts a 3Pt. Contested by RJ Nowitzki (3.2 feet, MAN). Julius Green misses. Offensive rebound by Jaren George! Jaren George puts it back in!
Score: 6-4

[09:14] Team_012 possession (Score: 6-4)
Paolo Durant makes the Layup and draws the foul on Julius Green! And-1! Paolo Durant to the line for 1. [Team fouls: 3] (Julius Green: 1 personal fouls)   FT 1/1: GOOD Paolo Durant makes 1/1 from the line.
Score: 6-7

[09:04] Team_060 possession (Score: 6-7)
Jaren George drives, picks up Ayo McGrady. Help arrives from RJ Nowitzki! Jaren George attempts a Dunk. Contested by RJ Nowitzki (4.4 feet, MAN). Jaren George misses. Rebound secured by Ayo McGrady.

[08:49] Team_012 possession (Score: 6-7)
Pascal Herro attempts a 3Pt. Contested by Joel Morant (5.8 feet, MAN). PASCAL HERRO MAKES IT! Assist: Shaquille Booker
Score: 6-10

[08:39] Team_060 possession (Score: 6-10)
Julius Green attempts a Midrange. Contested by RJ Nowitzki (3.2 feet, MAN). JULIUS GREEN MAKES IT!
Score: 8-10

[08:27] Team_012 possession (Score: 8-10)
RJ Nowitzki attempts a 3Pt. Contested by Julius Green (4.1 feet, MAN). RJ Nowitzki misses. Rebound secured by Jaren George.

[08:12] Team_060 possession (Score: 8-10)
Larry Westbrook attempts a Layup. Contested by Paolo Durant (4.0 feet, ZONE). Larry Westbrook misses. Rebound secured by RJ Nowitzki.

[07:58] Team_012 possession (Score: 8-10)
Ayo McGrady attempts a Layup. BLOCKED BY JAREN GEORGE! Ball is loose! Rebound secured by Immanuel Ming.

[07:43] Team_060 possession (Score: 8-10)
Jaren George drives and kicks out. Jaren George attempts a Midrange. Contested by Ayo McGrady (4.3 feet, MAN). Jaren George misses. Rebound secured by RJ Nowitzki.

[07:30] Team_012 possession (Score: 8-10)
Paolo Durant throws a bad pass! Stolen by Larry Westbrook! TURNOVER! (live ball)

[07:16] Team_060 possession (Score: 8-10)
Immanuel Ming drives to the basket... Immanuel Ming loses control! Ball rolls out of bounds! TURNOVER! (dead ball)

[07:02] Team_012 possession (Score: 8-10)
Ayo McGrady attempts a 3Pt. Contested by Julius Green (3.7 feet, ZONE). Ayo McGrady misses. Rebound secured by Jaren George.

[06:46] Team_060 possession (Score: 8-10)
Jaren George attempts a Layup. Contested by Paolo Durant (3.7 feet, ZONE). JAREN GEORGE MAKES IT!
Score: 10-10

[06:33] Team_012 possession (Score: 10-10)
Shaquille Booker attempts a 3Pt. Contested by Julius Green (3.7 feet, ZONE). Shaquille Booker misses. Rebound secured by Immanuel Ming.

[06:14] Team_060 possession (Score: 10-10)
Julius Green drives and kicks out. Immanuel Ming attempts a Midrange. Contested by Shaquille Booker (4.0 feet, MAN). IMMANUEL MING MAKES IT! Assist: Julius Green
Score: 12-10

[05:59] Team_012 possession (Score: 12-10)
Ayo McGrady attempts a Midrange. Contested by Immanuel Ming (3.6 feet, ZONE). Ayo McGrady misses. Rebound secured by Jaren George.

[05:42] Team_060 possession (Score: 12-10)
Larry Westbrook drives and kicks out. Immanuel Ming attempts a 3Pt. Contested by RJ Nowitzki (3.4 feet, ZONE). Immanuel Ming misses. Rebound secured by Paolo Durant.

[05:31] Team_012 possession (Score: 12-10)
Ayo McGrady throws a bad pass out of bounds! TURNOVER! (dead ball)

[05:18] Team_060 possession (Score: 12-10)
Julius Green attempts a Midrange. Contested by Paolo Durant (3.4 feet, ZONE). JULIUS GREEN MAKES IT! Assist: Jaren George
Score: 14-10

[05:08] Team_012 possession (Score: 14-10)
Pascal Herro attempts a Midrange. Contested by Joel Morant (5.9 feet, MAN). Pascal Herro misses. Rebound secured by Larry Westbrook.

[04:52] Team_060 possession (Score: 14-10)
Larry Westbrook drives and kicks out. Immanuel Ming attempts a Midrange. Contested by RJ Nowitzki (3.5 feet, ZONE). IMMANUEL MING MAKES IT!
Score: 16-10

[04:38] Team_012 possession (Score: 16-10)
Shaquille Booker attempts a Midrange. Contested by Immanuel Ming (3.6 feet, MAN). Shaquille Booker misses. Rebound secured by Larry Westbrook.

[04:27] Team_060 possession (Score: 16-10)
Joel Morant attempts a Midrange. Contested by Ayo McGrady (4.1 feet, ZONE). Joel Morant misses. Offensive rebound by Jaren George! Jaren George puts it back in!
Score: 18-10

[04:18] Team_012 possession (Score: 18-10)
Pascal Herro attempts a 3Pt. Contested by Joel Morant (5.9 feet, MAN). Pascal Herro misses. Rebound secured by Immanuel Ming.

[04:04] Team_060 possession (Score: 18-10)
Larry Westbrook attempts a 3Pt. Contested by RJ Nowitzki (4.0 feet, ZONE). LARRY WESTBROOK MAKES IT! Assist: Jaren George
Score: 21-10

[03:51] Team_012 possession (Score: 21-10)
Pascal Herro makes the Layup and draws the foul on Joel Morant! And-1! Pascal Herro to the line for 1. [Team fouls: 4] (Joel Morant: 2 personal fouls)   FT 1/1: MISS Pascal Herro makes 0/1 from the line. Rebound secured by Immanuel Ming.
Score: 21-12

[03:37] Team_060 possession (Score: 21-12)
Larry Westbrook drives, Paolo Durant stays with him. Larry Westbrook attempts a Dunk. Contested by Paolo Durant (4.2 feet, ZONE). LARRY WESTBROOK MAKES IT!
Score: 23-12

[03:25] Team_012 possession (Score: 23-12)
RJ Nowitzki loses the ball! Stripped by Julius Green! TURNOVER! (live ball)

[03:08] Team_060 possession (Score: 23-12)
Joel Morant attempts a 3Pt. Contested by Pascal Herro (4.9 feet, MAN). Joel Morant misses. Rebound secured by Paolo Durant.

[02:52] Team_012 possession (Score: 23-12)
Paolo Durant attempts a 3Pt. Contested by Julius Green (4.1 feet, ZONE). Paolo Durant misses. Rebound secured by Immanuel Ming.

[02:34] Team_060 possession (Score: 23-12)
Jaren George attempts a Midrange. Contested by RJ Nowitzki (3.8 feet, ZONE). Jaren George misses. FOUL! Loose ball foul on Ayo McGrady during the rebound battle. [Team fouls: 2] No free throws, side out. (Ayo McGrady: 1 personal fouls)

[02:22] Team_060 possession (Score: 23-12)
Julius Green commits a violation (traveling/carry)! TURNOVER! (dead ball)

[02:22] Substitution (Team_060): Joel Morant OUT → Domantas Barnes IN (stamina_rule2)

[02:22] Substitution (Team_060): Julius Green OUT → Rudy Ginobili IN (stamina_rule2)

[02:22] Substitution (Team_060): Larry Westbrook OUT → Yao Tatum IN (stamina_rule2)

[02:22] Substitution (Team_060): Jaren George OUT → Klay Haliburton IN (stamina_rule2)

[02:22] Substitution (Team_012): Pascal Herro OUT → Desmond Irving IN (stamina_rule2)

[02:22] Substitution (Team_012): RJ Nowitzki OUT → Jalen Barnes IN (stamina_rule2)

[02:22] Substitution (Team_012): Shaquille Booker OUT → Domantas Bird IN (stamina_rule2)

[02:22] Substitution (Team_012): Paolo Durant OUT → Jimmy Quickley IN (stamina_rule2)

[02:22] Substitution (Team_012): Ayo McGrady OUT → Karl Young IN (stamina_rule2)

[02:10] Team_012 possession (Score: 23-12)
Karl Young attempts a Midrange. Contested by Rudy Ginobili (4.4 feet, ZONE). KARL YOUNG MAKES IT! Assist: Domantas Bird
Score: 23-14

[01:53] Team_060 possession (Score: 23-14)
Rudy Ginobili attempts a Midrange. Contested by Domantas Bird (5.4 feet, ZONE). RUDY GINOBILI MAKES IT!
Score: 25-14

[01:37] Team_012 possession (Score: 25-14)
Desmond Irving drives and kicks out. Desmond Irving attempts a 3Pt. Contested by Domantas Barnes (4.6 feet, ZONE). Desmond Irving misses. FOUL! Loose ball foul on Domantas Barnes during the rebound battle. [IN THE BONUS! 5 team fouls] Karl Young to the line for 2 free throws. (Domantas Barnes: 1 personal fouls)   FT 1/2: GOOD   FT 2/2: GOOD Karl Young makes 2/2 from the line.
Score: 25-16

[01:23] Team_060 possession (Score: 25-16)
Immanuel Ming drives and kicks out. Rudy Ginobili attempts a 3Pt. Contested by Desmond Irving (4.5 feet, ZONE). Rudy Ginobili misses. Rebound secured by Jimmy Quickley.

[01:09] Team_012 possession (Score: 25-16)
Desmond Irving drives, picks up Domantas Barnes. Help arrives from Immanuel Ming! Desmond Irving attempts a Layup. Contested by Immanuel Ming (4.7 feet, MAN). DESMOND IRVING MAKES IT! Assist: Karl Young
Score: 25-18

[00:54] Team_060 possession (Score: 25-18)
Domantas Barnes attempts a 3Pt. Contested by Desmond Irving (4.4 feet, ZONE). Domantas Barnes misses. Rebound secured by Jalen Barnes.

[00:43] Team_012 possession (Score: 25-18)
Desmond Irving attempts a 3Pt. Contested by Domantas Barnes (4.7 feet, MAN). DESMOND IRVING MAKES IT!
Score: 25-21

[00:29] Team_060 possession (Score: 25-21)
Klay Haliburton attempts a Midrange. Contested by Jalen Barnes (5.5 feet, ZONE). KLAY HALIBURTON MAKES IT! Assist: Domantas Barnes
Score: 27-21

[00:15] Team_012 possession (Score: 27-21)
Jalen Barnes makes the Layup and draws the foul on Klay Haliburton! And-1! Jalen Barnes to the line for 1. [BONUS: 6 team fouls] (Klay Haliburton: 1 personal fouls)   FT 1/1: GOOD Jalen Barnes makes 1/1 from the line.
Score: 27-24

[00:05] Team_060 possession (Score: 27-24)
Domantas Barnes attempts a 3Pt. Contested by Jalen Barnes (5.2 feet, ZONE). Domantas Barnes misses. Offensive rebound by Klay Haliburton! Klay Haliburton's putback is no good. Offensive rebound by Klay Haliburton! Klay Haliburton kicks it out.

================================================================================
                              1ST QUARTER COMPLETE                              
================================================================================

1ST QUARTER SCORE: Team_060 27, Team_012 24

BOX SCORE:
================================================================================

Team_060
--------------------------------------------------------------------------------
Player                MIN  PTS  REB  AST  TO      FG   FG%      3P   3P%
--------------------------------------------------------------------------------
Julius Green           10    6    0    1   0   3/3   100.0     0/0   0.0
Immanuel Ming          12    6    6    1   0   3/5    60.0     0/0   0.0
Jaren George           10    6    6    2   0   3/6    50.0     0/0   0.0
Larry Westbrook        10    5    4    0   0   2/4    50.0     0/0   0.0
Rudy Ginobili           2    2    0    0   0   1/1   100.0     0/0   0.0
Klay Haliburton         2    2    1    0   0   1/1   100.0     0/0   0.0
Joel Morant            10    0    0    0   0   0/1     0.0     0/0   0.0
Domantas Barnes         2    0    0    1   0   0/1     0.0     0/0   0.0

TEAM: FG: 13/22 (59.1%), 3PT: 2/5 (40.0%), REB: 17 (4 off, 13 def), AST: 5, TO: 3
TEAM FOULS: 6 [Team_012 in BONUS]


Team_012
--------------------------------------------------------------------------------
Player                MIN  PTS  REB  AST  TO      FG   FG%      3P   3P%
--------------------------------------------------------------------------------
Pascal Herro           10    5    0    0   0   2/7    28.6     0/0   0.0
Desmond Irving          2    5    0    0   0   2/2   100.0     0/0   0.0
Karl Young              2    4    0    1   0   2/2   100.0     0/0   0.0
Paolo Durant           10    3    4    0   0   1/3    33.3     0/0   0.0
Jalen Barnes            2    3    1    0   0   1/1   100.0     0/0   0.0
Ayo McGrady            10    0    1    0   0   0/3     0.0     0/0   0.0
Shaquille Booker       10    0    0    1   0   0/2     0.0     0/0   0.0
RJ Nowitzki            10    0    2    0   0   0/1     0.0     0/0   0.0
Domantas Bird           2    0    0    1   0   0/0     0.0     0/0   0.0
Jimmy Quickley          2    0    1    0   0   0/0     0.0     0/0   0.0

TEAM: FG: 8/21 (38.1%), 3PT: 2/8 (25.0%), REB: 9 (0 off, 9 def), AST: 3, TO: 4
TEAM FOULS: 2

================================================================================

================================================================================
                       2ND QUARTER - Team_060 vs Team_012                       
================================================================================

[12:00] Team_060 possession (Score: 27-24)
Julius Green attempts a Midrange. Contested by RJ Nowitzki (3.2 feet, MAN). Julius Green misses. FOUL! Loose ball foul on RJ Nowitzki during the rebound battle. [Team fouls: 1] No free throws, side out. (RJ Nowitzki: 1 personal fouls)

[11:41] Team_060 possession (Score: 27-24)
Jaren George drives and kicks out. Jaren George attempts a 3Pt. Contested by RJ Nowitzki (3.4 feet, ZONE). Jaren George misses. Offensive rebound by Jaren George! Jaren George puts it back in!
Score: 29-24

[11:26] Team_012 possession (Score: 29-24)
Pascal Herro attempts a 3Pt. Contested by Julius Green (4.3 feet, ZONE). PASCAL HERRO MAKES IT! Assist: RJ Nowitzki
Score: 29-27

[11:08] Team_060 possession (Score: 29-27)
Immanuel Ming attempts a Layup. Contested by Paolo Durant (3.5 feet, ZONE). IMMANUEL MING MAKES IT!
Score: 31-27

[10:54] Team_012 possession (Score: 31-27)
Shaquille Booker attempts a Midrange. Contested by Larry Westbrook (4.7 feet, ZONE). Shaquille Booker misses. Rebound secured by Larry Westbrook.

[10:40] Team_060 possession (Score: 31-27)
Jaren George attempts a Midrange. Contested by Ayo McGrady (4.5 feet, MAN). JAREN GEORGE MAKES IT! Assist: Joel Morant
Score: 33-27

[10:29] Team_012 possession (Score: 33-27)
Shaquille Booker attempts a 3Pt. Contested by Immanuel Ming (4.1 feet, MAN). SHAQUILLE BOOKER MAKES IT! Assist: Pascal Herro
Score: 33-30

[10:17] Team_060 possession (Score: 33-30)
Immanuel Ming attempts a 3Pt. Contested by Shaquille Booker (4.1 feet, MAN). Immanuel Ming misses. Rebound secured by Paolo Durant.

[10:01] Team_012 possession (Score: 33-30)
Paolo Durant drives to the basket... Paolo Durant loses the ball! Stripped by Larry Westbrook! TURNOVER! (live ball)

[09:48] Team_060 possession (Score: 33-30)
Julius Green attempts a Midrange. Contested by RJ Nowitzki (3.4 feet, ZONE). JULIUS GREEN MAKES IT! Assist: Larry Westbrook
Score: 35-30

[09:33] Team_012 possession (Score: 35-30)
Pascal Herro drives and kicks out. Pascal Herro attempts a 3Pt. Contested by Julius Green (4.0 feet, ZONE). Pascal Herro misses. Rebound secured by Jaren George.

[09:20] Team_060 possession (Score: 35-30)
Jaren George attempts a 3Pt. Contested by Ayo McGrady (4.6 feet, MAN). JAREN GEORGE MAKES IT! Assist: Larry Westbrook
Score: 38-30

[09:08] Team_012 possession (Score: 38-30)
Paolo Durant attempts a 3Pt. Contested by Larry Westbrook (5.1 feet, MAN). Paolo Durant misses. Rebound secured by Jaren George.

[08:57] Team_060 possession (Score: 38-30)
Larry Westbrook attempts a 3Pt. Contested by Paolo Durant (4.3 feet, ZONE). Larry Westbrook misses. Rebound secured by RJ Nowitzki.

[08:43] Team_012 possession (Score: 38-30)
Pascal Herro attempts a 3Pt. Contested by Julius Green (4.6 feet, ZONE). Pascal Herro misses. Offensive rebound by Paolo Durant! Paolo Durant's putback is no good. Offensive rebound by Paolo Durant! Paolo Durant kicks it out.

[08:32] Team_012 possession (Score: 38-30)
Shaquille Booker loses control! Ball rolls out of bounds! TURNOVER! (dead ball)

[08:32] Substitution (Team_060): Joel Morant OUT → Domantas Barnes IN (stamina_rule2)

[08:32] Substitution (Team_060): Julius Green OUT → Rudy Ginobili IN (stamina_rule2)

[08:32] Substitution (Team_060): Immanuel Ming OUT → Jarrett Wagner IN (stamina_rule2)

[08:32] Substitution (Team_060): Larry Westbrook OUT → Yao Tatum IN (stamina_rule2)

[08:32] Substitution (Team_060): Jaren George OUT → Klay Haliburton IN (stamina_rule2)

[08:32] Substitution (Team_012): Pascal Herro OUT → Desmond Irving IN (stamina_rule2)

[08:32] Substitution (Team_012): RJ Nowitzki OUT → Jalen Barnes IN (stamina_rule2)

[08:32] Substitution (Team_012): Shaquille Booker OUT → Domantas Bird IN (stamina_rule2)

[08:32] Substitution (Team_012): Paolo Durant OUT → Jimmy Quickley IN (stamina_rule2)

[08:32] Substitution (Team_012): Ayo McGrady OUT → Karl Young IN (stamina_rule2)

[08:17] Team_060 possession (Score: 38-30)
Domantas Barnes throws a bad pass out of bounds! TURNOVER! (dead ball)

[07:58] Team_012 possession (Score: 38-30)
Jalen Barnes attempts a 3Pt. Contested by Rudy Ginobili (4.4 feet, MAN). Jalen Barnes misses. Rebound secured by Klay Haliburton.

[07:47] Team_060 possession (Score: 38-30)
FOUL! Reach-in foul on Jimmy Quickley during the drive. [Team fouls: 2] No free throws, side out. (Jimmy Quickley: 1 personal fouls)

[07:31] Team_060 possession (Score: 38-30)
Jarrett Wagner drives and kicks out. Jarrett Wagner attempts a Midrange. Contested by Jimmy Quickley (4.9 feet, ZONE). JARRETT WAGNER MAKES IT!
Score: 40-30

[07:14] Team_012 possession (Score: 40-30)
Karl Young attempts a Midrange. Contested by Klay Haliburton (4.3 feet, MAN). Karl Young misses. Rebound secured by Rudy Ginobili.

[07:01] Team_060 possession (Score: 40-30)
Yao Tatum attempts a 3Pt. Contested by Jimmy Quickley (4.9 feet, MAN). Yao Tatum misses. Offensive rebound by Domantas Barnes! Domantas Barnes kicks it out.

[06:46] Team_060 possession (Score: 40-30)
Klay Haliburton drives, Karl Young stays with him. Klay Haliburton attempts a Layup. Contested by Karl Young (4.1 feet, MAN). Klay Haliburton misses. FOUL! Loose ball foul on Jimmy Quickley during the rebound battle. [Team fouls: 3] No free throws, side out. (Jimmy Quickley: 2 personal fouls)

[06:35] Team_060 possession (Score: 40-30)
Domantas Barnes attempts a Layup. Contested by Desmond Irving (4.4 feet, MAN). Domantas Barnes misses. Offensive rebound by Klay Haliburton! Klay Haliburton puts it back in!
Score: 42-30

[06:19] Team_012 possession (Score: 42-30)
Jalen Barnes drives to the basket... FOUL! Offensive foul on Jalen Barnes! Klay Haliburton drew the charge! [Team fouls: 4] (Jalen Barnes: 1 personal fouls) TURNOVER! (dead ball)

[06:06] Team_060 possession (Score: 42-30)
Klay Haliburton attempts a Midrange. Contested by Karl Young (4.1 feet, MAN). Klay Haliburton misses. Offensive rebound by Domantas Barnes! Domantas Barnes kicks it out.

[05:48] Team_060 possession (Score: 42-30)
Klay Haliburton attempts a Midrange. Contested by Karl Young (4.1 feet, MAN). Klay Haliburton misses. Offensive rebound by Domantas Barnes! Domantas Barnes kicks it out.

[05:35] Team_060 possession (Score: 42-30)
Jarrett Wagner attempts a 3Pt. Contested by Desmond Irving (4.6 feet, ZONE). JARRETT WAGNER MAKES IT! Assist: Domantas Barnes
Score: 45-30

[05:20] Team_012 possession (Score: 45-30)
Domantas Bird drives, Jarrett Wagner stays with him. Domantas Bird attempts a Dunk. Contested by Jarrett Wagner (4.8 feet, MAN). Domantas Bird misses. Rebound secured by Klay Haliburton.

[05:05] Team_060 possession (Score: 45-30)
Domantas Barnes drives to the basket... FOUL! Offensive foul on Domantas Barnes! Desmond Irving drew the charge! [Team fouls: 1] (Domantas Barnes: 1 personal fouls) TURNOVER! (dead ball)

[04:50] Team_012 possession (Score: 45-30)
Karl Young drives and kicks out. Domantas Bird attempts a 3Pt. Contested by Domantas Barnes (4.6 feet, ZONE). Domantas Bird misses. FOUL! Loose ball foul on Domantas Barnes during the rebound battle. [Team fouls: 2] No free throws, side out. (Domantas Barnes: 2 personal fouls)

[04:33] Team_012 possession (Score: 45-30)
FOUL! Reach-in foul on Klay Haliburton during the drive. [Team fouls: 3] No free throws, side out. (Klay Haliburton: 1 personal fouls)

[04:20] Team_012 possession (Score: 45-30)
Jalen Barnes drives to the basket... Jalen Barnes loses the ball! Stripped by Rudy Ginobili! TURNOVER! (live ball)

[04:05] Team_060 possession (Score: 45-30)
Rudy Ginobili attempts a 3Pt. Contested by Jalen Barnes (5.5 feet, MAN). Rudy Ginobili misses. Rebound secured by Karl Young.

[03:45] Team_012 possession (Score: 45-30)
Domantas Bird attempts a 3Pt. Contested by Jarrett Wagner (4.8 feet, MAN). DOMANTAS BIRD MAKES IT! Assist: Jimmy Quickley
Score: 45-33

[03:30] Team_060 possession (Score: 45-33)
Rudy Ginobili loses control! Ball rolls out of bounds! TURNOVER! (dead ball)

[03:17] Team_012 possession (Score: 45-33)
FOUL! Holding foul on Yao Tatum. [Team fouls: 4] No free throws, side out. (Yao Tatum: 1 personal fouls)

[03:01] Team_012 possession (Score: 45-33)
Jimmy Quickley drives and kicks out. Jalen Barnes attempts a Midrange. Contested by Rudy Ginobili (4.4 feet, ZONE). Jalen Barnes misses. Rebound secured by Klay Haliburton.

[02:44] Team_060 possession (Score: 45-33)
Rudy Ginobili drives, Jalen Barnes stays with him. Rudy Ginobili attempts a Layup. Contested by Jalen Barnes (5.5 feet, MAN). RUDY GINOBILI MAKES IT! Assist: Klay Haliburton
Score: 47-33

[02:32] Team_012 possession (Score: 47-33)
Desmond Irving drives and kicks out. Desmond Irving attempts a 3Pt. Contested by Domantas Barnes (4.6 feet, ZONE). Desmond Irving misses. Rebound secured by Klay Haliburton.

[02:21] Team_060 possession (Score: 47-33)
Jarrett Wagner drives and kicks out. Domantas Barnes attempts a 3Pt. Contested by Domantas Bird (5.2 feet, ZONE). DOMANTAS BARNES MAKES IT! Assist: Yao Tatum
Score: 50-33

[02:08] Team_012 possession (Score: 50-33)
Desmond Irving attempts a 3Pt. Contested by Domantas Barnes (4.7 feet, MAN). Desmond Irving misses. Rebound secured by Klay Haliburton.

[01:55] Team_060 possession (Score: 50-33)
Jarrett Wagner attempts a 3Pt. Contested by Desmond Irving (4.7 feet, ZONE). Jarrett Wagner misses. FOUL! Loose ball foul on Jimmy Quickley during the rebound battle. [IN THE BONUS! 5 team fouls] Klay Haliburton to the line for 2 free throws. (Jimmy Quickley: 3 personal fouls)   FT 1/2: GOOD   FT 2/2: GOOD Klay Haliburton makes 2/2 from the line.
Score: 52-33

[01:43] Team_012 possession (Score: 52-33)
Jimmy Quickley attempts a 3Pt. Contested by Domantas Barnes (4.9 feet, ZONE). JIMMY QUICKLEY MAKES IT! Assist: Karl Young
Score: 52-36

[01:30] Team_060 possession (Score: 52-36)
Klay Haliburton commits a violation (traveling/carry)! TURNOVER! (dead ball)

[01:11] Team_012 possession (Score: 52-36)
Jalen Barnes makes the Layup and draws the foul on Klay Haliburton! And-1! Jalen Barnes to the line for 1. [BONUS: 5 team fouls] (Klay Haliburton: 2 personal fouls)   FT 1/1: GOOD Jalen Barnes makes 1/1 from the line.
Score: 52-39

[00:52] Team_060 possession (Score: 52-39)
Yao Tatum attempts a Layup. BLOCKED BY JIMMY QUICKLEY! Ball deflects out of bounds off Yao Tatum.

[00:41] Team_012 possession (Score: 52-39)
Desmond Irving attempts a Midrange. Contested by Domantas Barnes (4.8 feet, MAN). Desmond Irving misses. Rebound secured by Domantas Barnes.

[00:24] Team_060 possession (Score: 52-39)
Jarrett Wagner attempts a Layup. Contested by Jimmy Quickley (5.3 feet, ZONE). JARRETT WAGNER MAKES IT!
Score: 54-39

[00:06] Team_012 possession (Score: 54-39)
Desmond Irving attempts a 3Pt. Contested by Yao Tatum (5.5 feet, ZONE). Desmond Irving misses. Offensive rebound by Karl Young! Karl Young kicks it out.

================================================================================
                              2ND QUARTER COMPLETE                              
================================================================================

2ND QUARTER SCORE: Team_060 27, Team_012 15

BOX SCORE:
================================================================================

Team_060
--------------------------------------------------------------------------------
Player                MIN  PTS  REB  AST  TO      FG   FG%      3P   3P%
--------------------------------------------------------------------------------
Jaren George           14    7    4    0   0   3/3   100.0     0/0   0.0
Jarrett Wagner          8    7    0    0   0   3/3   100.0     0/0   0.0
Klay Haliburton        11    4    7    1   0   2/2   100.0     0/0   0.0
Domantas Barnes        11    3    4    1   0   1/1   100.0     0/0   0.0
Immanuel Ming          16    2    0    0   0   1/2    50.0     0/0   0.0
Julius Green           14    2    0    0   0   1/1   100.0     0/0   0.0
Rudy Ginobili          11    2    1    0   0   1/2    50.0     0/0   0.0
Larry Westbrook        14    0    1    2   0   0/1     0.0     0/0   0.0
Joel Morant            14    0    0    1   0   0/0     0.0     0/0   0.0
Yao Tatum              11    0    0    1   0   0/1     0.0     0/0   0.0

TEAM: FG: 12/16 (75.0%), 3PT: 3/6 (50.0%), REB: 17 (7 off, 10 def), AST: 6, TO: 4
TEAM FOULS: 5 [Team_012 in BONUS]


Team_012
--------------------------------------------------------------------------------
Player                MIN  PTS  REB  AST  TO      FG   FG%      3P   3P%
--------------------------------------------------------------------------------
Pascal Herro           14    3    0    1   0   1/2    50.0     0/0   0.0
Shaquille Booker       14    3    0    0   0   1/2    50.0     0/0   0.0
Jalen Barnes           11    3    0    0   0   1/2    50.0     0/0   0.0
Domantas Bird          11    3    0    0   0   1/2    50.0     0/0   0.0
Jimmy Quickley         11    3    0    1   0   1/2    50.0     0/0   0.0
RJ Nowitzki            14    0    1    1   0   0/0     0.0     0/0   0.0
Paolo Durant           14    0    2    0   0   0/1     0.0     0/0   0.0
Karl Young             11    0    3    1   0   0/1     0.0     0/0   0.0
Desmond Irving         11    0    0    0   0   0/3     0.0     0/0   0.0

TEAM: FG: 5/15 (33.3%), 3PT: 4/7 (57.1%), REB: 6 (3 off, 3 def), AST: 4, TO: 4
TEAM FOULS: 5 [Team_060 in BONUS]

================================================================================

================================================================================
                       3RD QUARTER - Team_060 vs Team_012                       
================================================================================

[12:00] Team_060 possession (Score: 54-39)
Immanuel Ming makes the Layup and draws the foul on Shaquille Booker! And-1! Immanuel Ming to the line for 1. [Team fouls: 1] (Shaquille Booker: 1 personal fouls)   FT 1/1: GOOD Immanuel Ming makes 1/1 from the line.
Score: 57-39

[11:43] Team_012 possession (Score: 57-39)
Paolo Durant drives to the basket... Paolo Durant throws a bad pass! Stolen by Jaren George! TURNOVER! (live ball)

[11:28] Team_060 possession (Score: 57-39)
Immanuel Ming attempts a 3Pt. Contested by RJ Nowitzki (3.4 feet, ZONE). Immanuel Ming misses. Rebound secured by Ayo McGrady.

[11:16] Team_012 possession (Score: 57-39)
Paolo Durant attempts a Midrange. Contested by Joel Morant (5.4 feet, ZONE). Paolo Durant misses. Offensive rebound by RJ Nowitzki! RJ Nowitzki kicks it out.

[11:06] Team_012 possession (Score: 57-39)
Paolo Durant attempts a Midrange. Contested by Immanuel Ming (3.8 feet, ZONE). PAOLO DURANT MAKES IT!
Score: 57-41

[10:53] Team_060 possession (Score: 57-41)
FOUL! Shooting foul on RJ Nowitzki. Julius Green to the line for 2 free throws. [Team fouls: 2] (RJ Nowitzki: 1 personal fouls)   FT 1/2: GOOD   FT 2/2: GOOD Julius Green makes 2/2 from the line.
Score: 59-41

[10:36] Team_012 possession (Score: 59-41)
Ayo McGrady attempts a Midrange. Contested by Jaren George (5.2 feet, MAN). Ayo McGrady misses. Rebound secured by Larry Westbrook.

[10:18] Team_060 possession (Score: 59-41)
Julius Green attempts a 3Pt. Contested by RJ Nowitzki (3.2 feet, ZONE). Julius Green misses. Rebound secured by RJ Nowitzki.

[10:07] Team_012 possession (Score: 59-41)
Pascal Herro drives and kicks out. RJ Nowitzki attempts a 3Pt. Contested by Julius Green (3.8 feet, MAN). RJ Nowitzki misses. Rebound secured by Larry Westbrook.

[09:53] Team_060 possession (Score: 59-41)
Immanuel Ming makes the Dunk and draws the foul on Paolo Durant! And-1! Immanuel Ming to the line for 1. [Team fouls: 3] (Paolo Durant: 1 personal fouls)   FT 1/1: MISS Immanuel Ming makes 0/1 from the line. Rebound secured by Ayo McGrady.
Score: 61-41

[09:42] Team_012 possession (Score: 61-41)
Pascal Herro attempts a 3Pt. Contested by Immanuel Ming (4.2 feet, ZONE). PASCAL HERRO MAKES IT! Assist: RJ Nowitzki
Score: 61-44

[09:28] Team_060 possession (Score: 61-44)
Larry Westbrook attempts a Midrange. Contested by Paolo Durant (4.0 feet, MAN). Larry Westbrook misses. Rebound secured by RJ Nowitzki.

[09:15] Team_012 possession (Score: 61-44)
Shaquille Booker attempts a 3Pt. Contested by Immanuel Ming (3.6 feet, MAN). Shaquille Booker misses. Rebound secured by Larry Westbrook.

[08:59] Team_060 possession (Score: 61-44)
Julius Green drives and kicks out. Larry Westbrook attempts a 3Pt. Contested by RJ Nowitzki (3.4 feet, ZONE). Larry Westbrook misses. Offensive rebound by Immanuel Ming! Immanuel Ming kicks it out.

[08:40] Team_060 possession (Score: 61-44)
Julius Green drives to the basket... FOUL! Offensive foul on Julius Green! Paolo Durant drew the charge! [Team fouls: 1] (Julius Green: 1 personal fouls) TURNOVER! (dead ball)

[08:22] Team_012 possession (Score: 61-44)
Shaquille Booker attempts a Layup. Contested by Jaren George (5.1 feet, ZONE). SHAQUILLE BOOKER MAKES IT! Assist: Pascal Herro
Score: 61-46

[08:09] Team_060 possession (Score: 61-46)
Immanuel Ming attempts a 3Pt. Contested by Shaquille Booker (4.0 feet, MAN). IMMANUEL MING MAKES IT! Assist: Julius Green
Score: 64-46

[07:55] Team_012 possession (Score: 64-46)
Paolo Durant attempts a 3Pt. Contested by Larry Westbrook (4.7 feet, MAN). Paolo Durant misses. Rebound secured by Immanuel Ming.

[07:39] Team_060 possession (Score: 64-46)
Immanuel Ming attempts a 3Pt. Contested by RJ Nowitzki (3.4 feet, ZONE). Immanuel Ming misses. Rebound secured by RJ Nowitzki.

[07:24] Team_012 possession (Score: 64-46)
Shaquille Booker attempts a 3Pt. Contested by Immanuel Ming (3.6 feet, MAN). Shaquille Booker misses. Rebound secured by Immanuel Ming.

[07:09] Team_060 possession (Score: 64-46)
Julius Green attempts a Midrange. Contested by RJ Nowitzki (3.2 feet, MAN). Julius Green misses. Offensive rebound by Jaren George! Jaren George puts it back in!
Score: 66-46

[06:55] Team_012 possession (Score: 66-46)
Paolo Durant drives, Larry Westbrook stays with him. Paolo Durant attempts a Layup. Contested by Larry Westbrook (4.7 feet, MAN). Paolo Durant misses. Offensive rebound by RJ Nowitzki! RJ Nowitzki kicks it out.

[06:37] Team_012 possession (Score: 66-46)
RJ Nowitzki commits a violation (traveling/carry)! TURNOVER! (dead ball)

[06:22] Team_060 possession (Score: 66-46)
Jaren George attempts a Midrange. Contested by Paolo Durant (3.7 feet, ZONE). JAREN GEORGE MAKES IT! Assist: Joel Morant
Score: 68-46

[06:06] Team_012 possession (Score: 68-46)
Pascal Herro attempts a 3Pt. Contested by Joel Morant (5.8 feet, MAN). Pascal Herro misses. Rebound secured by Larry Westbrook.

[05:54] Team_060 possession (Score: 68-46)
Immanuel Ming attempts a 3Pt. Contested by Paolo Durant (3.5 feet, ZONE). IMMANUEL MING MAKES IT! Assist: Jaren George
Score: 71-46

[05:39] Team_012 possession (Score: 71-46)
Paolo Durant drives, Jaren George stays with him. Paolo Durant attempts a Layup. Contested by Jaren George (5.3 feet, ZONE). PAOLO DURANT MAKES IT!
Score: 71-48

[05:28] Team_060 possession (Score: 71-48)
Joel Morant drives and kicks out. Julius Green attempts a 3Pt. Contested by RJ Nowitzki (3.4 feet, ZONE). Julius Green misses. Rebound secured by Ayo McGrady.

[05:14] Team_012 possession (Score: 71-48)
RJ Nowitzki attempts a Midrange. Contested by Julius Green (4.1 feet, MAN). RJ Nowitzki misses. Offensive rebound by RJ Nowitzki! RJ Nowitzki kicks it out.

[05:01] Team_012 possession (Score: 71-48)
FOUL! Shooting foul on Larry Westbrook. Paolo Durant to the line for 2 free throws. [Team fouls: 2] (Larry Westbrook: 1 personal fouls)   FT 1/2: GOOD   FT 2/2: GOOD Paolo Durant makes 2/2 from the line.
Score: 71-50

[04:47] Team_060 possession (Score: 71-50)
FOUL! Shooting foul on Pascal Herro. Larry Westbrook to the line for 2 free throws. [Team fouls: 4] (Pascal Herro: 1 personal fouls)   FT 1/2: GOOD   FT 2/2: GOOD Larry Westbrook makes 2/2 from the line.
Score: 73-50

[04:30] Team_012 possession (Score: 73-50)
Paolo Durant drives to the basket... Paolo Durant commits a violation (traveling/carry)! TURNOVER! (dead ball)

[04:15] Team_060 possession (Score: 73-50)
Joel Morant makes the Midrange and draws the foul on Ayo McGrady! And-1! Joel Morant to the line for 1. [BONUS: 5 team fouls] (Ayo McGrady: 1 personal fouls)   FT 1/1: GOOD Joel Morant makes 1/1 from the line.
Score: 76-50

[04:01] Team_012 possession (Score: 76-50)
Pascal Herro attempts a Midrange. Contested by Julius Green (4.4 feet, ZONE). Pascal Herro misses. Rebound secured by Jaren George.

[03:49] Team_060 possession (Score: 76-50)
Julius Green drives to the basket... Julius Green throws a bad pass! Stolen by Paolo Durant! TURNOVER! (live ball)

[03:33] Team_012 possession (Score: 76-50)
FOUL! Shooting foul on Jaren George. Ayo McGrady to the line for 2 free throws. [Team fouls: 3] (Jaren George: 1 personal fouls)   FT 1/2: GOOD   FT 2/2: GOOD Ayo McGrady makes 2/2 from the line.
Score: 76-52

[03:18] Team_060 possession (Score: 76-52)
Julius Green drives and kicks out. Jaren George attempts a Midrange. Contested by Paolo Durant (3.7 feet, ZONE). Jaren George misses. Offensive rebound by Immanuel Ming! Immanuel Ming kicks it out.

[03:04] Team_060 possession (Score: 76-52)
FOUL! Shooting foul on Paolo Durant. Larry Westbrook to the line for 2 free throws. [BONUS: 6 team fouls] (Paolo Durant: 2 personal fouls)   FT 1/2: GOOD   FT 2/2: MISS Larry Westbrook makes 1/2 from the line. Rebound secured by Paolo Durant.
Score: 77-52

[02:47] Team_012 possession (Score: 77-52)
RJ Nowitzki attempts a 3Pt. Contested by Julius Green (4.3 feet, ZONE). RJ NOWITZKI MAKES IT! Assist: Pascal Herro
Score: 77-55

[02:34] Team_060 possession (Score: 77-55)
Immanuel Ming attempts a 3Pt. Contested by Shaquille Booker (4.2 feet, MAN). Immanuel Ming misses. Offensive rebound by Immanuel Ming! Immanuel Ming kicks it out.

[02:22] Team_060 possession (Score: 77-55)
Immanuel Ming drives and kicks out. Julius Green attempts a 3Pt. Contested by RJ Nowitzki (3.7 feet, ZONE). Julius Green misses. Rebound secured by RJ Nowitzki.

[02:08] Team_012 possession (Score: 77-55)
Ayo McGrady drives, picks up Jaren George. Help arrives from Julius Green! Ayo McGrady attempts a Dunk. Contested by Julius Green (5.5 feet, ZONE). Ayo McGrady misses. Offensive rebound by Paolo Durant! Paolo Durant puts it back in!
Score: 77-57

[01:51] Team_060 possession (Score: 77-57)
Jaren George drives to the basket... Jaren George throws a bad pass! Stolen by Ayo McGrady! TURNOVER! (live ball)

[01:35] Team_012 possession (Score: 77-57)
Ayo McGrady makes the Midrange and draws the foul on Jaren George! And-1! Ayo McGrady to the line for 1. [Team fouls: 4] (Jaren George: 2 personal fouls)   FT 1/1: GOOD Ayo McGrady makes 1/1 from the line.
Score: 77-60

[01:22] Team_060 possession (Score: 77-60)
Jaren George drives and kicks out. Joel Morant attempts a Midrange. Contested by Pascal Herro (5.3 feet, MAN). JOEL MORANT MAKES IT! Assist: Larry Westbrook
Score: 79-60

[01:07] Team_012 possession (Score: 79-60)
RJ Nowitzki drives, Julius Green stays with him. RJ Nowitzki attempts a Layup. Contested by Julius Green (4.4 feet, MAN). RJ Nowitzki misses. Offensive rebound by RJ Nowitzki! RJ Nowitzki kicks it out.

[00:48] Team_012 possession (Score: 79-60)
Pascal Herro attempts a 3Pt. Contested by Julius Green (4.7 feet, ZONE). Pascal Herro misses. Rebound secured by Jaren George.

[00:33] Team_060 possession (Score: 79-60)
Jaren George attempts a 3Pt. Contested by Ayo McGrady (4.8 feet, MAN). JAREN GEORGE MAKES IT!
Score: 82-60

[00:23] Team_012 possession (Score: 82-60)
Shaquille Booker loses control! Ball rolls out of bounds! TURNOVER! (dead ball)

[00:23] Substitution (Team_060): Joel Morant OUT → Domantas Barnes IN (stamina_rule2)

[00:23] Substitution (Team_060): Julius Green OUT → Rudy Ginobili IN (stamina_rule2)

[00:23] Substitution (Team_060): Immanuel Ming OUT → Jarrett Wagner IN (stamina_rule2)

[00:23] Substitution (Team_060): Larry Westbrook OUT → Yao Tatum IN (stamina_rule2)

[00:23] Substitution (Team_060): Jaren George OUT → Klay Haliburton IN (stamina_rule2)

[00:23] Substitution (Team_012): Pascal Herro OUT → Desmond Irving IN (stamina_rule2)

[00:23] Substitution (Team_012): RJ Nowitzki OUT → Jalen Barnes IN (stamina_rule2)

[00:23] Substitution (Team_012): Shaquille Booker OUT → Domantas Bird IN (stamina_rule2)

[00:23] Substitution (Team_012): Paolo Durant OUT → Jimmy Quickley IN (stamina_rule2)

[00:23] Substitution (Team_012): Ayo McGrady OUT → Karl Young IN (stamina_rule2)

[00:13] Team_060 possession (Score: 82-60)
Rudy Ginobili makes the Layup and draws the foul on Jalen Barnes! And-1! Rudy Ginobili to the line for 1. [BONUS: 7 team fouls] (Jalen Barnes: 1 personal fouls)   FT 1/1: MISS Rudy Ginobili makes 0/1 from the line. Rebound secured by Jimmy Quickley.
Score: 84-60

[00:01] Team_012 possession (Score: 84-60)
Desmond Irving attempts a 3Pt. Contested by Domantas Barnes (4.7 feet, MAN). Desmond Irving misses. Rebound secured by Rudy Ginobili.

================================================================================
                              3RD QUARTER COMPLETE                              
================================================================================

3RD QUARTER SCORE: Team_060 30, Team_012 21

BOX SCORE:
================================================================================

Team_060
--------------------------------------------------------------------------------
Player                MIN  PTS  REB  AST  TO      FG   FG%      3P   3P%
--------------------------------------------------------------------------------
Immanuel Ming          28    9    5    0   0   3/7    42.9     0/0   0.0
Jaren George           25    7    3    1   0   3/3   100.0     0/0   0.0
Joel Morant            25    5    0    1   0   2/3    66.7     0/0   0.0
Julius Green           25    2    0    1   0   1/2    50.0     0/0   0.0
Larry Westbrook        25    2    4    1   0   1/3    33.3     0/0   0.0
Rudy Ginobili          11    0    1    0   0   0/1     0.0     0/0   0.0

TEAM: FG: 10/19 (52.6%), 3PT: 3/6 (50.0%), REB: 13 (4 off, 9 def), AST: 4, TO: 3
TEAM FOULS: 4


Team_012
--------------------------------------------------------------------------------
Player                MIN  PTS  REB  AST  TO      FG   FG%      3P   3P%
--------------------------------------------------------------------------------
Paolo Durant           25    8    2    0   0   4/5    80.0     0/0   0.0
Ayo McGrady            25    5    3    0   0   2/3    66.7     0/0   0.0
RJ Nowitzki            25    3    8    1   0   1/1   100.0     0/0   0.0
Pascal Herro           25    3    0    2   0   1/5    20.0     0/0   0.0
Shaquille Booker       25    2    0    0   0   1/3    33.3     0/0   0.0
Jimmy Quickley         11    0    1    0   0   0/0     0.0     0/0   0.0
Desmond Irving         11    0    0    0   0   0/1     0.0     0/0   0.0

TEAM: FG: 9/18 (50.0%), 3PT: 2/8 (25.0%), REB: 14 (5 off, 9 def), AST: 3, TO: 4
TEAM FOULS: 7 [Team_060 in BONUS]

================================================================================

================================================================================
                       4TH QUARTER - Team_060 vs Team_012                       
================================================================================

[12:00] Substitution (Team_060): Joel Morant OUT → Domantas Barnes IN (stamina_rule2)

[12:00] Substitution (Team_060): Larry Westbrook OUT → Yao Tatum IN (stamina_rule2)

[12:00] Substitution (Team_060): Jaren George OUT → Klay Haliburton IN (stamina_rule2)

[12:00] Substitution (Team_012): Pascal Herro OUT → Desmond Irving IN (stamina_rule2)

[12:00] Team_060 possession (Score: 84-60)
Immanuel Ming drives to the basket... Immanuel Ming loses control! Ball rolls out of bounds! TURNOVER! (dead ball)

[11:45] Team_012 possession (Score: 84-60)
Shaquille Booker drives to the basket... Shaquille Booker throws a bad pass out of bounds! TURNOVER! (dead ball)

[11:45] Substitution (Team_060): Julius Green OUT → Rudy Ginobili IN (stamina_rule2)

[11:45] Substitution (Team_012): RJ Nowitzki OUT → Jalen Barnes IN (stamina_rule2)

[11:45] Substitution (Team_012): Shaquille Booker OUT → Domantas Bird IN (stamina_rule2)

[11:45] Substitution (Team_012): Paolo Durant OUT → Jimmy Quickley IN (stamina_rule2)

[11:45] Substitution (Team_012): Ayo McGrady OUT → Karl Young IN (stamina_rule2)

[11:30] Team_060 possession (Score: 84-60)
Yao Tatum attempts a Midrange. Contested by Jimmy Quickley (4.9 feet, ZONE). Yao Tatum misses. Rebound secured by Jimmy Quickley.

[11:13] Team_012 possession (Score: 84-60)
Jimmy Quickley attempts a 3Pt. Contested by Domantas Barnes (4.8 feet, ZONE). Jimmy Quickley misses. Rebound secured by Klay Haliburton.

[10:56] Team_060 possession (Score: 84-60)
Domantas Barnes makes the Dunk and draws the foul on Jalen Barnes! And-1! Domantas Barnes to the line for 1. [Team fouls: 1] (Jalen Barnes: 1 personal fouls)   FT 1/1: GOOD Domantas Barnes makes 1/1 from the line.
Score: 87-60

[10:44] Team_012 possession (Score: 87-60)
Jimmy Quickley attempts a Midrange. Contested by Yao Tatum (5.4 feet, MAN). JIMMY QUICKLEY MAKES IT! Assist: Desmond Irving
Score: 87-62

[10:28] Team_060 possession (Score: 87-62)
Immanuel Ming attempts a 3Pt. Contested by Domantas Bird (5.1 feet, MAN). Immanuel Ming misses. Rebound secured by Jimmy Quickley.

[10:16] Team_012 possession (Score: 87-62)
Desmond Irving attempts a 3Pt. Contested by Domantas Barnes (4.7 feet, ZONE). Desmond Irving misses. Rebound secured by Immanuel Ming.

[10:05] Team_060 possession (Score: 87-62)
Yao Tatum attempts a Midrange. Contested by Jimmy Quickley (4.9 feet, MAN). YAO TATUM MAKES IT! Assist: Rudy Ginobili
Score: 89-62

[09:48] Team_012 possession (Score: 89-62)
Desmond Irving attempts a 3Pt. Contested by Domantas Barnes (4.7 feet, MAN). Desmond Irving misses. Rebound secured by Immanuel Ming.

[09:33] Team_060 possession (Score: 89-62)
Domantas Barnes attempts a 3Pt. Contested by Desmond Irving (4.4 feet, ZONE). Domantas Barnes misses. Rebound secured by Jimmy Quickley.

[09:18] Team_012 possession (Score: 89-62)
FOUL! Shooting foul on Yao Tatum. Jimmy Quickley to the line for 3 free throws. [Team fouls: 1] (Yao Tatum: 1 personal fouls)   FT 1/3: MISS   FT 2/3: MISS   FT 3/3: MISS Jimmy Quickley makes 0/3 from the line. Rebound secured by Domantas Barnes.

[09:03] Team_060 possession (Score: 89-62)
Domantas Barnes attempts a Layup. Contested by Jimmy Quickley (4.9 feet, ZONE). Domantas Barnes misses. Rebound secured by Karl Young.

[08:47] Team_012 possession (Score: 89-62)
Desmond Irving attempts a Midrange. Contested by Yao Tatum (5.3 feet, ZONE). Desmond Irving misses. Rebound secured by Immanuel Ming.

[08:31] Team_060 possession (Score: 89-62)
Domantas Barnes makes the Layup and draws the foul on Desmond Irving! And-1! Domantas Barnes to the line for 1. [Team fouls: 2] (Desmond Irving: 1 personal fouls)   FT 1/1: GOOD Domantas Barnes makes 1/1 from the line.
Score: 92-62

[08:13] Team_012 possession (Score: 92-62)
Jimmy Quickley attempts a 3Pt. Contested by Domantas Barnes (4.8 feet, ZONE). JIMMY QUICKLEY MAKES IT! Assist: Jalen Barnes
Score: 92-65

[08:01] Team_060 possession (Score: 92-65)
Yao Tatum attempts a Midrange. Contested by Jimmy Quickley (4.9 feet, MAN). YAO TATUM MAKES IT! Assist: Rudy Ginobili
Score: 94-65

[07:44] Team_012 possession (Score: 94-65)
Desmond Irving drives and kicks out. Jalen Barnes attempts a 3Pt. Contested by Domantas Barnes (4.6 feet, ZONE). Jalen Barnes misses. Rebound secured by Immanuel Ming.

[07:31] Team_060 possession (Score: 94-65)
Yao Tatum attempts a Layup. Contested by Jimmy Quickley (4.9 feet, MAN). Yao Tatum misses. Offensive rebound by Domantas Barnes! Domantas Barnes kicks it out.

[07:12] Team_060 possession (Score: 94-65)
Immanuel Ming makes the Layup and draws the foul on Domantas Bird! And-1! Immanuel Ming to the line for 1. [Team fouls: 3] (Domantas Bird: 1 personal fouls)   FT 1/1: GOOD Immanuel Ming makes 1/1 from the line.
Score: 97-65

[06:56] Team_012 possession (Score: 97-65)
Karl Young attempts a 3Pt. Contested by Domantas Barnes (4.7 feet, ZONE). Karl Young misses. Rebound secured by Klay Haliburton.

[06:44] Team_060 possession (Score: 97-65)
Klay Haliburton drives, Jimmy Quickley stays with him. Klay Haliburton attempts a Layup. Contested by Jimmy Quickley (5.2 feet, ZONE). KLAY HALIBURTON MAKES IT! Assist: Domantas Barnes
Score: 99-65

[06:30] Team_012 possession (Score: 99-65)
Karl Young attempts a 3Pt. Contested by Domantas Barnes (4.7 feet, ZONE). Karl Young misses. Offensive rebound by Karl Young! Karl Young's putback is no good. Rebound secured by Domantas Barnes.

[06:17] Team_060 possession (Score: 99-65)
Rudy Ginobili drives to the basket... Rudy Ginobili loses the ball! Stripped by Jimmy Quickley! TURNOVER! (live ball)

[06:05] Team_012 possession (Score: 99-65)
Karl Young attempts a Midrange. Contested by Immanuel Ming (4.7 feet, ZONE). Karl Young misses. Rebound secured by Domantas Barnes.

[05:51] Team_060 possession (Score: 99-65)
Immanuel Ming attempts a 3Pt. Contested by Desmond Irving (4.3 feet, ZONE). Immanuel Ming misses. Rebound secured by Karl Young.

[05:37] Team_012 possession (Score: 99-65)
Jalen Barnes attempts a 3Pt. Contested by Rudy Ginobili (4.4 feet, MAN). Jalen Barnes misses. Offensive rebound by Jimmy Quickley! Jimmy Quickley kicks it out.

[05:23] Team_012 possession (Score: 99-65)
Desmond Irving attempts a 3Pt. Contested by Domantas Barnes (4.7 feet, MAN). Desmond Irving misses. Rebound secured by Klay Haliburton.

[05:13] Team_060 possession (Score: 99-65)
Domantas Barnes attempts a 3Pt. Contested by Desmond Irving (4.5 feet, MAN). Domantas Barnes misses. Offensive rebound by Domantas Barnes! Domantas Barnes kicks it out.

[04:59] Team_060 possession (Score: 99-65)
Rudy Ginobili attempts a Layup. Contested by Jimmy Quickley (5.2 feet, ZONE). RUDY GINOBILI MAKES IT! Assist: Domantas Barnes
Score: 101-65

[04:41] Team_012 possession (Score: 101-65)
Jalen Barnes attempts a Midrange. Contested by Immanuel Ming (4.8 feet, ZONE). Jalen Barnes misses. Rebound secured by Klay Haliburton.

[04:26] Team_060 possession (Score: 101-65)
Rudy Ginobili attempts a 3Pt. Contested by Desmond Irving (4.8 feet, ZONE). Rudy Ginobili misses. Rebound secured by Jalen Barnes.

[04:12] Team_012 possession (Score: 101-65)
FOUL! Shooting foul on Yao Tatum. Jimmy Quickley to the line for 2 free throws. [Team fouls: 2] (Yao Tatum: 2 personal fouls)   FT 1/2: GOOD   FT 2/2: GOOD Jimmy Quickley makes 2/2 from the line.
Score: 101-67

[03:53] Team_060 possession (Score: 101-67)
Klay Haliburton drives, picks up Karl Young. Help arrives from Jalen Barnes! Klay Haliburton attempts a Dunk. Contested by Jalen Barnes (4.2 feet, MAN). KLAY HALIBURTON MAKES IT! Assist: Domantas Barnes
Score: 103-67

[03:40] Team_012 possession (Score: 103-67)
Jalen Barnes drives to the basket... Jalen Barnes loses the ball! Stripped by Klay Haliburton! TURNOVER! (live ball)

[03:26] Team_060 possession (Score: 103-67)
FOUL! Holding foul on Jalen Barnes. [Team fouls: 4] No free throws, side out. (Jalen Barnes: 2 personal fouls)

[03:11] Team_060 possession (Score: 103-67)
Immanuel Ming attempts a 3Pt. Contested by Domantas Bird (5.1 feet, MAN). Immanuel Ming misses. Rebound secured by Jalen Barnes.

[02:56] Team_012 possession (Score: 103-67)
FOUL! Shooting foul on Yao Tatum. Domantas Bird to the line for 2 free throws. [Team fouls: 3] (Yao Tatum: 3 personal fouls)   FT 1/2: GOOD   FT 2/2: GOOD Domantas Bird makes 2/2 from the line.
Score: 103-69

[02:42] Team_060 possession (Score: 103-69)
Yao Tatum attempts a Midrange. Contested by Domantas Bird (5.3 feet, ZONE). Yao Tatum misses. Rebound secured by Jimmy Quickley.

[02:30] Team_012 possession (Score: 103-69)
Domantas Bird attempts a Layup. Contested by Yao Tatum (5.4 feet, ZONE). DOMANTAS BIRD MAKES IT! Assist: Desmond Irving
Score: 103-71

[02:13] Team_060 possession (Score: 103-71)
Yao Tatum drives, Jimmy Quickley stays with him. Yao Tatum attempts a Dunk. Contested by Jimmy Quickley (5.2 feet, MAN). YAO TATUM MAKES IT! Assist: Domantas Barnes
Score: 105-71

[01:56] Team_012 possession (Score: 105-71)
FOUL! Shooting foul on Klay Haliburton. Karl Young to the line for 2 free throws. [Team fouls: 4] (Klay Haliburton: 1 personal fouls)   FT 1/2: GOOD   FT 2/2: GOOD Karl Young makes 2/2 from the line.
Score: 105-73

[01:45] Team_060 possession (Score: 105-73)
Klay Haliburton drives and kicks out. Immanuel Ming attempts a 3Pt. Contested by Desmond Irving (4.9 feet, ZONE). IMMANUEL MING MAKES IT! Assist: Domantas Barnes
Score: 108-73

[01:32] Team_012 possession (Score: 108-73)
Karl Young drives, picks up Klay Haliburton. Help arrives from Domantas Barnes! Karl Young attempts a Dunk. Contested by Domantas Barnes (4.7 feet, ZONE). KARL YOUNG MAKES IT! Assist: Jimmy Quickley
Score: 108-75

[01:21] Team_060 possession (Score: 108-75)
Klay Haliburton makes the Layup and draws the foul on Karl Young! And-1! Klay Haliburton to the line for 1. [BONUS: 5 team fouls] (Karl Young: 1 personal fouls)   FT 1/1: GOOD Klay Haliburton makes 1/1 from the line.
Score: 111-75

[01:09] Team_012 possession (Score: 111-75)
Karl Young attempts a Layup. BLOCKED BY KLAY HALIBURTON! Ball is loose! Offensive rebound by Karl Young! Karl Young kicks it out.

[00:52] Team_012 possession (Score: 111-75)
Domantas Bird drives to the basket... Domantas Bird throws a bad pass! Stolen by Klay Haliburton! TURNOVER! (live ball)

[00:39] Team_060 possession (Score: 111-75)
Immanuel Ming attempts a 3Pt. Contested by Desmond Irving (4.8 feet, ZONE). IMMANUEL MING MAKES IT! Assist: Rudy Ginobili
Score: 114-75

[00:21] Team_012 possession (Score: 114-75)
Jimmy Quickley drives and kicks out. FOUL! Shooting foul on Klay Haliburton. Karl Young to the line for 3 free throws. [BONUS: 5 team fouls] (Klay Haliburton: 2 personal fouls)   FT 1/3: MISS   FT 2/3: GOOD   FT 3/3: GOOD Karl Young makes 2/3 from the line.
Score: 114-77

[00:06] Team_060 possession (Score: 114-77)
Immanuel Ming attempts a 3Pt. Contested by Domantas Bird (5.4 feet, MAN). IMMANUEL MING MAKES IT! Assist: Domantas Barnes
Score: 117-77

================================================================================
                              4TH QUARTER COMPLETE                              
================================================================================

4TH QUARTER SCORE: Team_060 33, Team_012 17

BOX SCORE:
================================================================================

Team_060
--------------------------------------------------------------------------------
Player                MIN  PTS  REB  AST  TO      FG   FG%      3P   3P%
--------------------------------------------------------------------------------
Immanuel Ming          40   12    4    0   0   4/7    57.1     0/0   0.0
Klay Haliburton        23    7    4    0   0   3/3   100.0     0/0   0.0
Yao Tatum              23    6    0    0   0   3/5    60.0     0/0   0.0
Domantas Barnes        23    6    5    6   0   2/4    50.0     0/0   0.0
Rudy Ginobili          23    2    0    3   0   1/2    50.0     0/0   0.0

TEAM: FG: 13/21 (61.9%), 3PT: 2/7 (28.6%), REB: 12 (2 off, 10 def), AST: 9, TO: 2
TEAM FOULS: 5 [Team_012 in BONUS]


Team_012
--------------------------------------------------------------------------------
Player                MIN  PTS  REB  AST  TO      FG   FG%      3P   3P%
--------------------------------------------------------------------------------
Jimmy Quickley         23    7    5    1   0   3/5    60.0     0/0   0.0
Karl Young             23    6    3    0   0   3/6    50.0     0/0   0.0
Domantas Bird          23    4    0    0   0   2/2   100.0     0/0   0.0
Desmond Irving         23    0    0    2   0   0/5     0.0     0/0   0.0
Jalen Barnes           23    0    2    1   0   0/1     0.0     0/0   0.0

TEAM: FG: 8/19 (42.1%), 3PT: 1/8 (12.5%), REB: 11 (3 off, 8 def), AST: 4, TO: 3
TEAM FOULS: 5 [Team_060 in BONUS]

================================================================================

================================================================================
                               FULL GAME COMPLETE                               
================================================================================

FINAL SCORE: Team_060 117, Team_012 77

SCORING BY QUARTER:
--------------------------------------------------------------------------------
Team                     Q1     Q2     Q3     Q4    FINAL
--------------------------------------------------------------------------------
Team_060                 27     27     30     33      117
Team_012                 24     15     21     17       77
--------------------------------------------------------------------------------

FULL GAME BOX SCORE:
================================================================================

Team_060
--------------------------------------------------------------------------------
Player                MIN  PTS  REB  AST  TO      FG   FG%      3P   3P%      FT STL BLK
--------------------------------------------------------------------------------
Immanuel Ming          40   29   15    1   2   8/18   44.4   4/11   36.4   2/3     0   0
Julius Green           26   10    0    2   1   8/9    88.9   1/2    50.0   2/2     1   0
Joel Morant            26    5    0    2   1   2/4    50.0   0/1     0.0   1/1     0   0
Larry Westbrook        26    7    9    3   1   4/9    44.4   1/2    50.0   3/4     2   0
Jaren George           26   20   13    3   2   7/10   70.0   2/2   100.0   0/0     1   1
Domantas Barnes        23    9    9    8   2   3/6    50.0   0/2     0.0   2/2     0   0
Yao Tatum              23    6    0    1   1   3/6    50.0   0/0     0.0   0/0     0   0
Klay Haliburton        23   13   12    1   1   5/5   100.0   0/0     0.0   3/3     2   1
Rudy Ginobili          23    6    2    3   1   3/6    50.0   0/2     0.0   0/1     1   0
Jarrett Wagner          9    7    0    0   0   5/5   100.0   2/2   100.0   0/0     0   0

TEAM: FG: 48/78 (61.5%), 3PT: 10/24 (41.7%), REB: 59 (17 off, 42 def), AST: 24, TO: 12


Team_012
--------------------------------------------------------------------------------
Player                MIN  PTS  REB  AST  TO      FG   FG%      3P   3P%      FT STL BLK
--------------------------------------------------------------------------------
RJ Nowitzki            26    3   11    2   4   1/2    50.0   1/2    50.0   0/0     0   0
Shaquille Booker       26    5    0    1   2   2/7    28.6   1/4    25.0   0/0     0   0
Paolo Durant           26   11    8    0   1   4/8    50.0   0/3     0.0   3/3     1   0
Ayo McGrady            26    5    4    0   2   3/7    42.9   0/1     0.0   3/3     2   0
Pascal Herro           26   11    0    3   2   4/14   28.6   3/7    42.9   2/4     0   0
Desmond Irving         23    5    0    2   2   3/12   25.0   1/6    16.7   0/0     0   0
Jalen Barnes           23    6    3    1   0   2/4    50.0   0/1     0.0   2/2     0   0
Domantas Bird          23    7    0    1   0   3/4    75.0   1/1   100.0   2/2     0   0
Jimmy Quickley         23   10    7    2   1   5/8    62.5   2/4    50.0   2/5     1   1
Karl Young             23   10    6    2   1   3/7    42.9   0/2     0.0   6/7     0   0

TEAM: FG: 30/73 (41.1%), 3PT: 9/31 (29.0%), REB: 40 (11 off, 29 def), AST: 14, TO: 15

================================================================================
