================================================================================
                        FULL GAME - Team_024 vs Team_085                        
================================================================================

================================================================================
                       1ST QUARTER - Team_024 vs Team_085                       
================================================================================

[12:00] Team_024 possession (Score: 0-0)
Draymond Towns attempts a Midrange. Contested by Collin Mobley (3.4 feet, MAN). Draymond Towns misses. Rebound secured by Collin Mobley.

[11:46] Team_085 possession (Score: 0-0)
Stephen Bird attempts a 3Pt. Contested by Zach Fox (3.8 feet, MAN). Stephen Bird misses. Rebound secured by Draymond Towns.

[11:36] Team_024 possession (Score: 0-0)
Draymond Towns drives to the basket... FOUL! Offensive foul on Draymond Towns! Paul Wagner drew the charge! [Team fouls: 1] (Draymond Towns: 1 personal fouls) TURNOVER! (dead ball)

[11:22] Team_085 possession (Score: 0-0)
Larry Duncan drives, picks up Bradley Allen. Help arrives from Zach Fox! Larry Duncan attempts a Layup. Contested by Zach Fox (4.2 feet, MAN). LARRY DUNCAN MAKES IT!
Score: 0-2

[11:07] Team_024 possession (Score: 0-2)
Anfernee Williamson attempts a Midrange. Contested by Stephen Bird (3.2 feet, ZONE). ANFERNEE WILLIAMSON MAKES IT!
Score: 2-2

[10:52] Team_085 possession (Score: 2-2)
FOUL! Offensive foul on Stephen Bird! Zach Fox drew the charge! [Team fouls: 1] (Stephen Bird: 1 personal fouls) TURNOVER! (dead ball)

[10:33] Team_024 possession (Score: 2-2)
FOUL! Shooting foul on Larry Duncan. Ja Reaves to the line for 2 free throws. [Team fouls: 2] (Larry Duncan: 1 personal fouls)   FT 1/2: MISS   FT 2/2: GOOD Ja Reaves makes 1/2 from the line.
Score: 3-2

[10:20] Team_085 possession (Score: 3-2)
Stephen Bird attempts a Midrange. Contested by Zach Fox (3.8 feet, MAN). Stephen Bird misses. Rebound secured by Draymond Towns.

[10:08] Team_024 possession (Score: 3-2)
Bradley Allen attempts a 3Pt. Contested by Magic Beal (4.0 feet, ZONE). Bradley Allen misses. Rebound secured by Collin Mobley.

[09:58] Team_085 possession (Score: 3-2)
Stephen Bird attempts a 3Pt. Contested by Zach Fox (3.8 feet, MAN). Stephen Bird misses. Rebound secured by Draymond Towns.

[09:43] Team_024 possession (Score: 3-2)
Anfernee Williamson drives to the basket... FOUL! Offensive foul on Anfernee Williamson! Paul Wagner drew the charge! [Team fouls: 2] (Anfernee Williamson: 1 personal fouls) TURNOVER! (dead ball)

[09:28] Team_085 possession (Score: 3-2)
Magic Beal drives, Anfernee Williamson stays with him. Magic Beal attempts a Dunk. Contested by Anfernee Williamson (4.1 feet, ZONE). MAGIC BEAL MAKES IT! Assist: Collin Mobley
Score: 3-4

[09:15] Team_024 possession (Score: 3-4)
Draymond Towns attempts a Midrange. Contested by Collin Mobley (3.4 feet, ZONE). Draymond Towns misses. Rebound secured by Collin Mobley.

[08:56] Team_085 possession (Score: 3-4)
Stephen Bird attempts a 3Pt. Contested by Zach Fox (3.8 feet, ZONE). Stephen Bird misses. Rebound secured by Draymond Towns.

[08:40] Team_024 possession (Score: 3-4)
Zach Fox throws a bad pass! Stolen by Stephen Bird! TURNOVER! (live ball)

[08:23] Team_085 possession (Score: 3-4)
Paul Wagner drives, Anfernee Williamson stays with him. Paul Wagner attempts a Layup. Contested by Anfernee Williamson (3.9 feet, ZONE). PAUL WAGNER MAKES IT!
Score: 3-6

[08:07] Team_024 possession (Score: 3-6)
Zach Fox attempts a Layup. Contested by Paul Wagner (3.9 feet, ZONE). Zach Fox misses. Rebound secured by Larry Duncan.

[07:52] Team_085 possession (Score: 3-6)
Stephen Bird drives to the basket... Stephen Bird throws a bad pass out of bounds! TURNOVER! (dead ball)

[07:39] Team_024 possession (Score: 3-6)
Bradley Allen attempts a Midrange. Contested by Larry Duncan (3.1 feet, MAN). Bradley Allen misses. Rebound secured by Paul Wagner.

[07:21] Team_085 possession (Score: 3-6)
Stephen Bird throws a bad pass out of bounds! TURNOVER! (dead ball)

[07:07] Team_024 possession (Score: 3-6)
Ja Reaves attempts a 3Pt. Contested by Magic Beal (4.1 feet, MAN). Ja Reaves misses. Rebound secured by Larry Duncan.

[06:48] Team_085 possession (Score: 3-6)
Stephen Bird attempts a 3Pt. Contested by Zach Fox (3.8 feet, ZONE). STEPHEN BIRD MAKES IT! Assist: Larry Duncan
Score: 3-9

[06:35] Team_024 possession (Score: 3-9)
Zach Fox attempts a Midrange. Contested by Magic Beal (4.3 feet, ZONE). ZACH FOX MAKES IT!
Score: 5-9

[06:21] Team_085 possession (Score: 5-9)
Stephen Bird drives and kicks out. Larry Duncan attempts a Midrange. Contested by Anfernee Williamson (3.6 feet, ZONE). LARRY DUNCAN MAKES IT!
Score: 5-11

[06:04] Team_024 possession (Score: 5-11)
Ja Reaves attempts a Midrange. Contested by Magic Beal (4.1 feet, MAN). JA REAVES MAKES IT! Assist: Zach Fox
Score: 7-11

[05:49] Team_085 possession (Score: 7-11)
Larry Duncan attempts a Layup. Contested by Bradley Allen (4.2 feet, MAN). LARRY DUNCAN MAKES IT!
Score: 7-13

[05:33] Team_024 possession (Score: 7-13)
Ja Reaves drives to the basket... FOUL! Offensive foul on Ja Reaves! Magic Beal drew the charge! [Team fouls: 3] (Ja Reaves: 1 personal fouls) TURNOVER! (dead ball)

[05:22] Team_085 possession (Score: 7-13)
Paul Wagner drives, Anfernee Williamson stays with him. Paul Wagner attempts a Layup. Contested by Anfernee Williamson (3.9 feet, ZONE). PAUL WAGNER MAKES IT! Assist: Larry Duncan
Score: 7-15

[05:07] Team_024 possession (Score: 7-15)
FOUL! Shooting foul on Stephen Bird. Zach Fox to the line for 2 free throws. [Team fouls: 3] (Stephen Bird: 2 personal fouls)   FT 1/2: GOOD   FT 2/2: GOOD Zach Fox makes 2/2 from the line.
Score: 9-15

[04:58] Team_085 possession (Score: 9-15)
Collin Mobley attempts a Midrange. Contested by Anfernee Williamson (3.6 feet, MAN). Collin Mobley misses. Rebound secured by Anfernee Williamson.

[04:44] Team_024 possession (Score: 9-15)
Bradley Allen loses the ball! Stripped by Larry Duncan! TURNOVER! (live ball)

[04:29] Team_085 possession (Score: 9-15)
Larry Duncan drives and kicks out. Paul Wagner makes the Midrange and draws the foul on Bradley Allen! And-1! Paul Wagner to the line for 1. [Team fouls: 4] (Bradley Allen: 1 personal fouls)   FT 1/1: GOOD Paul Wagner makes 1/1 from the line.
Score: 9-18

[04:16] Team_024 possession (Score: 9-18)
FOUL! Shooting foul on Stephen Bird. Zach Fox to the line for 2 free throws. [Team fouls: 4] (Stephen Bird: 3 personal fouls)   FT 1/2: GOOD   FT 2/2: GOOD Zach Fox makes 2/2 from the line.
Score: 11-18

[04:01] Team_085 possession (Score: 11-18)
Larry Duncan attempts a 3Pt. Contested by Bradley Allen (4.3 feet, MAN). Larry Duncan misses. Rebound secured by Anfernee Williamson.

[03:49] Team_024 possession (Score: 11-18)
Bradley Allen makes the Dunk and draws the foul on Larry Duncan! And-1! Bradley Allen to the line for 1. [BONUS: 5 team fouls] (Larry Duncan: 2 personal fouls)   FT 1/1: GOOD Bradley Allen makes 1/1 from the line.
Score: 14-18

[03:35] Team_085 possession (Score: 14-18)
Paul Wagner attempts a 3Pt. Contested by Zach Fox (3.9 feet, ZONE). Paul Wagner misses. Rebound secured by Anfernee Williamson.

[03:21] Team_024 possession (Score: 14-18)
FOUL! Holding foul on Stephen Bird. [IN THE BONUS! 6 team fouls] Zach Fox to the line for 2 free throws. (Stephen Bird: 4 personal fouls)   FT 1/2: GOOD   FT 2/2: MISS Zach Fox makes 1/2 from the line. Rebound secured by Collin Mobley.
Score: 15-18

[03:07] Team_085 possession (Score: 15-18)
Paul Wagner drives, Anfernee Williamson stays with him. Paul Wagner attempts a Dunk. Contested by Anfernee Williamson (4.1 feet, MAN). PAUL WAGNER MAKES IT! Assist: Stephen Bird
Score: 15-20

[02:53] Team_024 possession (Score: 15-20)
Bradley Allen drives, Larry Duncan stays with him. Bradley Allen attempts a Layup. Contested by Larry Duncan (3.3 feet, MAN). BRADLEY ALLEN MAKES IT! Assist: Anfernee Williamson
Score: 17-20

[02:36] Team_085 possession (Score: 17-20)
Collin Mobley attempts a Layup. Contested by Draymond Towns (4.0 feet, MAN). COLLIN MOBLEY MAKES IT! Assist: Larry Duncan
Score: 17-22

[02:16] Team_024 possession (Score: 17-22)
Zach Fox attempts a 3Pt. Contested by Paul Wagner (4.0 feet, ZONE). Zach Fox misses. Offensive rebound by Draymond Towns! Draymond Towns puts it back in!
Score: 19-22

[02:03] Team_085 possession (Score: 19-22)
Larry Duncan drives and kicks out. FOUL! Shooting foul on Anfernee Williamson. Stephen Bird to the line for 2 free throws. [BONUS: 5 team fouls] (Anfernee Williamson: 2 personal fouls)   FT 1/2: GOOD   FT 2/2: MISS Stephen Bird makes 1/2 from the line. Rebound secured by Draymond Towns.
Score: 19-23

[01:50] Team_024 possession (Score: 19-23)
Bradley Allen throws a bad pass out of bounds! TURNOVER! (dead ball)

[01:50] Substitution (Team_024): Ja Reaves OUT → Victor Simons IN (stamina_rule2)

[01:50] Substitution (Team_024): Zach Fox OUT → Vince Irving IN (stamina_rule2)

[01:50] Substitution (Team_024): Bradley Allen OUT → Zach Durant IN (stamina_rule2)

[01:50] Substitution (Team_024): Anfernee Williamson OUT → Julius Harris IN (stamina_rule2)

[01:50] Substitution (Team_024): Draymond Towns OUT → Terry Rozier IN (stamina_rule2)

[01:50] Substitution (Team_085): Magic Beal OUT → Khris Brogdon IN (stamina_rule2)

[01:50] Substitution (Team_085): Stephen Bird OUT → Jordan Morant IN (stamina_rule2)

[01:50] Substitution (Team_085): Larry Duncan OUT → Giannis Johnson IN (stamina_rule2)

[01:50] Substitution (Team_085): Collin Mobley OUT → Malcolm Beal IN (stamina_rule2)

[01:37] Team_085 possession (Score: 19-23)
Malcolm Beal drives and kicks out. Malcolm Beal attempts a Midrange. BLOCKED BY TERRY ROZIER! Ball deflects out of bounds off Malcolm Beal.

[01:23] Team_024 possession (Score: 19-23)
Vince Irving drives, picks up Paul Wagner. Help arrives from Jordan Morant! Vince Irving attempts a Layup. Contested by Jordan Morant (3.9 feet, ZONE). VINCE IRVING MAKES IT! Assist: Terry Rozier
Score: 21-23

[01:10] Team_085 possession (Score: 21-23)
FOUL! Shooting foul on Terry Rozier. Malcolm Beal to the line for 2 free throws. [BONUS: 6 team fouls] (Terry Rozier: 1 personal fouls)   FT 1/2: MISS   FT 2/2: GOOD Malcolm Beal makes 1/2 from the line.
Score: 21-24

[00:56] Team_024 possession (Score: 21-24)
Victor Simons attempts a Layup. BLOCKED BY KHRIS BROGDON! Ball goes out off Khris Brogdon. Victor Simons's ball!

[00:42] Team_024 possession (Score: 21-24)
Victor Simons attempts a Midrange. Contested by Giannis Johnson (5.9 feet, ZONE). VICTOR SIMONS MAKES IT! Assist: Zach Durant
Score: 23-24

[00:29] Team_085 possession (Score: 23-24)
Malcolm Beal drives and kicks out. Jordan Morant attempts a 3Pt. Contested by Vince Irving (4.9 feet, MAN). JORDAN MORANT MAKES IT! Assist: Khris Brogdon
Score: 23-27

[00:15] Team_024 possession (Score: 23-27)
FOUL! Shooting foul on Khris Brogdon. Victor Simons to the line for 2 free throws. [BONUS: 7 team fouls] (Khris Brogdon: 1 personal fouls)   FT 1/2: GOOD   FT 2/2: GOOD Victor Simons makes 2/2 from the line.
Score: 25-27

================================================================================
                              1ST QUARTER COMPLETE                              
================================================================================

1ST QUARTER SCORE: Team_024 25, Team_085 27

BOX SCORE:
================================================================================

Team_024
--------------------------------------------------------------------------------
Player                MIN  PTS  REB  AST  TO      FG   FG%      3P   3P%
--------------------------------------------------------------------------------
Zach Fox               10    6    0    1   0   3/4    75.0     0/0   0.0
Bradley Allen          10    5    0    0   0   2/4    50.0     0/0   0.0
Victor Simons           2    4    0    0   0   2/2   100.0     0/0   0.0
Ja Reaves              10    3    0    0   0   2/3    66.7     0/0   0.0
Draymond Towns         10    2    6    0   0   1/3    33.3     0/0   0.0
Anfernee Williamson    10    2    3    1   0   1/1   100.0     0/0   0.0
Vince Irving            2    2    0    0   0   1/1   100.0     0/0   0.0
Terry Rozier            2    0    0    1   0   0/0     0.0     0/0   0.0
Zach Durant             2    0    0    1   0   0/0     0.0     0/0   0.0

TEAM: FG: 12/19 (63.2%), 3PT: 1/3 (33.3%), REB: 9 (1 off, 8 def), AST: 4, TO: 6
TEAM FOULS: 6 [Team_085 in BONUS]


Team_085
--------------------------------------------------------------------------------
Player                MIN  PTS  REB  AST  TO      FG   FG%      3P   3P%
--------------------------------------------------------------------------------
Paul Wagner            12    9    1    0   0   4/5    80.0     0/0   0.0
Larry Duncan           10    6    2    3   0   3/5    60.0     0/0   0.0
Stephen Bird           10    3    0    1   0   1/5    20.0     0/0   0.0
Jordan Morant           2    3    0    0   0   1/1   100.0     0/0   0.0
Collin Mobley          10    2    4    1   0   1/2    50.0     0/0   0.0
Magic Beal             10    2    0    0   0   1/1   100.0     0/0   0.0
Malcolm Beal            2    1    0    0   0   1/2    50.0     0/0   0.0
Khris Brogdon           2    0    0    1   0   0/0     0.0     0/0   0.0

TEAM: FG: 12/21 (57.1%), 3PT: 1/6 (16.7%), REB: 7 (0 off, 7 def), AST: 6, TO: 3
TEAM FOULS: 7 [Team_024 in BONUS]

================================================================================

================================================================================
                       2ND QUARTER - Team_024 vs Team_085                       
================================================================================

[12:00] Team_024 possession (Score: 25-27)
Ja Reaves drives, Paul Wagner stays with him. Ja Reaves attempts a Dunk. Contested by Paul Wagner (3.9 feet, ZONE). JA REAVES MAKES IT! Assist: Bradley Allen
Score: 27-27

[11:43] Team_085 possession (Score: 27-27)
Paul Wagner attempts a 3Pt. Contested by Zach Fox (3.8 feet, ZONE). Paul Wagner misses. Rebound secured by Zach Fox.

[11:25] Team_024 possession (Score: 27-27)
Bradley Allen attempts a Layup. BLOCKED BY PAUL WAGNER! Ball goes out off Paul Wagner. Bradley Allen's ball!

[11:07] Team_024 possession (Score: 27-27)
Draymond Towns drives and kicks out. FOUL! Shooting foul on Stephen Bird. Zach Fox to the line for 2 free throws. [Team fouls: 1] (Stephen Bird: 1 personal fouls)   FT 1/2: GOOD   FT 2/2: GOOD Zach Fox makes 2/2 from the line.
Score: 29-27

[10:51] Team_085 possession (Score: 29-27)
FOUL! Shooting foul on Zach Fox. Collin Mobley to the line for 2 free throws. [Team fouls: 1] (Zach Fox: 1 personal fouls)   FT 1/2: GOOD   FT 2/2: GOOD Collin Mobley makes 2/2 from the line.
Score: 29-29

[10:35] Team_024 possession (Score: 29-29)
Zach Fox attempts a 3Pt. Contested by Magic Beal (4.5 feet, ZONE). Zach Fox misses. Rebound secured by Paul Wagner.

[10:19] Team_085 possession (Score: 29-29)
Stephen Bird attempts a Midrange. Contested by Zach Fox (3.9 feet, MAN). Stephen Bird misses. Offensive rebound by Paul Wagner! Paul Wagner kicks it out.

[10:04] Team_085 possession (Score: 29-29)
Magic Beal attempts a 3Pt. Contested by Ja Reaves (5.1 feet, MAN). MAGIC BEAL MAKES IT! Assist: Larry Duncan
Score: 29-32

[09:46] Team_024 possession (Score: 29-32)
Zach Fox loses control! Ball rolls out of bounds! TURNOVER! (dead ball)

[09:46] Substitution (Team_024): Anfernee Williamson OUT → Julius Harris IN (stamina_rule2)

[09:46] Substitution (Team_024): Draymond Towns OUT → Terry Rozier IN (stamina_rule2)

[09:46] Substitution (Team_085): Stephen Bird OUT → Jordan Morant IN (stamina_rule2)

[09:46] Substitution (Team_085): Paul Wagner OUT → Jalen Leonard IN (stamina_rule2)

[09:46] Substitution (Team_085): Collin Mobley OUT → Malcolm Beal IN (stamina_rule2)

[09:28] Team_085 possession (Score: 29-32)
Jordan Morant makes the Midrange and draws the foul on Terry Rozier! And-1! Jordan Morant to the line for 1. [Team fouls: 2] (Terry Rozier: 1 personal fouls)   FT 1/1: GOOD Jordan Morant makes 1/1 from the line.
Score: 29-35

[09:13] Team_024 possession (Score: 29-35)
Ja Reaves attempts a Midrange. Contested by Magic Beal (4.4 feet, MAN). Ja Reaves misses. Offensive rebound by Zach Fox! Zach Fox kicks it out.

[09:01] Team_024 possession (Score: 29-35)
Bradley Allen attempts a 3Pt. Contested by Magic Beal (4.3 feet, ZONE). Bradley Allen misses. Rebound secured by Jalen Leonard.

[08:44] Team_085 possession (Score: 29-35)
Larry Duncan drives, Terry Rozier stays with him. Larry Duncan attempts a Dunk. Contested by Terry Rozier (4.3 feet, ZONE). LARRY DUNCAN MAKES IT! Assist: Magic Beal
Score: 29-37

[08:25] Team_024 possession (Score: 29-37)
Zach Fox drives to the basket... Zach Fox throws a bad pass out of bounds! TURNOVER! (dead ball)

[08:25] Substitution (Team_024): Ja Reaves OUT → Victor Simons IN (stamina_rule2)

[08:25] Substitution (Team_024): Zach Fox OUT → Vince Irving IN (stamina_rule2)

[08:25] Substitution (Team_024): Bradley Allen OUT → Zach Durant IN (stamina_rule2)

[08:25] Substitution (Team_085): Magic Beal OUT → Khris Brogdon IN (stamina_rule2)

[08:25] Substitution (Team_085): Larry Duncan OUT → Giannis Johnson IN (stamina_rule2)

[08:10] Team_085 possession (Score: 29-37)
Jalen Leonard attempts a 3Pt. Contested by Victor Simons (4.3 feet, ZONE). JALEN LEONARD MAKES IT! Assist: Giannis Johnson
Score: 29-40

[08:00] Team_024 possession (Score: 29-40)
Zach Durant attempts a 3Pt. Wide open! Giannis Johnson is 6.1 feet away. [MAN] Zach Durant misses. Offensive rebound by Terry Rozier! Terry Rozier puts it back in!
Score: 31-40

[07:45] Team_085 possession (Score: 31-40)
FOUL! Shooting foul on Zach Durant. Giannis Johnson to the line for 2 free throws. [Team fouls: 3] (Zach Durant: 1 personal fouls)   FT 1/2: MISS   FT 2/2: GOOD Giannis Johnson makes 1/2 from the line.
Score: 31-41

[07:33] Team_024 possession (Score: 31-41)
Victor Simons attempts a 3Pt. Contested by Jordan Morant (3.6 feet, ZONE). Victor Simons misses. Rebound secured by Malcolm Beal.

[07:18] Team_085 possession (Score: 31-41)
Jordan Morant attempts a Midrange. Contested by Vince Irving (5.1 feet, MAN). JORDAN MORANT MAKES IT!
Score: 31-43

[07:00] Team_024 possession (Score: 31-43)
FOUL! Reach-in foul on Malcolm Beal during the drive. [Team fouls: 2] No free throws, side out. (Malcolm Beal: 1 personal fouls)

[06:46] Team_024 possession (Score: 31-43)
Terry Rozier attempts a Layup. Contested by Malcolm Beal (4.7 feet, ZONE). TERRY ROZIER MAKES IT! Assist: Vince Irving
Score: 33-43

[06:34] Team_085 possession (Score: 33-43)
Khris Brogdon attempts a 3Pt. Contested by Victor Simons (3.8 feet, MAN). KHRIS BROGDON MAKES IT! Assist: Jalen Leonard
Score: 33-46

[06:18] Team_024 possession (Score: 33-46)
Zach Durant attempts a 3Pt. Contested by Jordan Morant (3.7 feet, ZONE). ZACH DURANT MAKES IT! Assist: Terry Rozier
Score: 36-46

[06:03] Team_085 possession (Score: 36-46)
Giannis Johnson attempts a Midrange. Contested by Zach Durant (3.2 feet, MAN). GIANNIS JOHNSON MAKES IT!
Score: 36-48

[05:49] Team_024 possession (Score: 36-48)
FOUL! Shooting foul on Malcolm Beal. Zach Durant to the line for 2 free throws. [Team fouls: 3] (Malcolm Beal: 2 personal fouls)   FT 1/2: GOOD   FT 2/2: GOOD Zach Durant makes 2/2 from the line.
Score: 38-48

[05:33] Team_085 possession (Score: 38-48)
Giannis Johnson attempts a 3Pt. Contested by Zach Durant (3.2 feet, MAN). GIANNIS JOHNSON MAKES IT! Assist: Jalen Leonard
Score: 38-51

[05:18] Team_024 possession (Score: 38-51)
Zach Durant drives and kicks out. Zach Durant attempts a 3Pt. Contested by Jordan Morant (3.5 feet, ZONE). Zach Durant misses. Rebound secured by Giannis Johnson.

[05:06] Team_085 possession (Score: 38-51)
Khris Brogdon attempts a 3Pt. Contested by Victor Simons (3.8 feet, ZONE). Khris Brogdon misses. Offensive rebound by Malcolm Beal! Malcolm Beal kicks it out.

[04:47] Team_085 possession (Score: 38-51)
FOUL! Shooting foul on Vince Irving. Giannis Johnson to the line for 2 free throws. [Team fouls: 4] (Vince Irving: 1 personal fouls)   FT 1/2: GOOD   FT 2/2: GOOD Giannis Johnson makes 2/2 from the line.
Score: 38-53

[04:35] Team_024 possession (Score: 38-53)
Terry Rozier makes the Layup and draws the foul on Malcolm Beal! And-1! Terry Rozier to the line for 1. [Team fouls: 4] (Malcolm Beal: 3 personal fouls)   FT 1/1: GOOD Terry Rozier makes 1/1 from the line.
Score: 41-53

[04:21] Team_085 possession (Score: 41-53)
Malcolm Beal drives, picks up Terry Rozier. Help arrives from Vince Irving! Malcolm Beal attempts a Layup. Contested by Vince Irving (3.5 feet, MAN). MALCOLM BEAL MAKES IT!
Score: 41-55

[04:04] Team_024 possession (Score: 41-55)
Vince Irving attempts a 3Pt. Contested by Jordan Morant (3.6 feet, ZONE). Vince Irving misses. FOUL! Loose ball foul on Malcolm Beal during the rebound battle. [IN THE BONUS! 5 team fouls] Julius Harris to the line for 2 free throws. (Malcolm Beal: 4 personal fouls)   FT 1/2: GOOD   FT 2/2: GOOD Julius Harris makes 2/2 from the line.
Score: 43-55

[03:48] Team_085 possession (Score: 43-55)
Giannis Johnson attempts a 3Pt. Contested by Julius Harris (5.0 feet, ZONE). Giannis Johnson misses. Rebound secured by Terry Rozier.

[03:34] Team_024 possession (Score: 43-55)
Victor Simons attempts a 3Pt. Contested by Khris Brogdon (5.5 feet, MAN). Victor Simons misses. FOUL! Loose ball foul on Jalen Leonard during the rebound battle. [IN THE BONUS! 6 team fouls] Julius Harris to the line for 2 free throws. (Jalen Leonard: 1 personal fouls)   FT 1/2: MISS   FT 2/2: MISS Julius Harris makes 0/2 from the line. Rebound secured by Malcolm Beal.

[03:18] Team_085 possession (Score: 43-55)
Jalen Leonard attempts a 3Pt. Contested by Julius Harris (5.3 feet, MAN). JALEN LEONARD MAKES IT! Assist: Malcolm Beal
Score: 43-58

[03:03] Team_024 possession (Score: 43-58)
Terry Rozier attempts a Midrange. Contested by Jordan Morant (3.9 feet, ZONE). Terry Rozier misses. Rebound secured by Malcolm Beal.

[02:49] Team_085 possession (Score: 43-58)
Jalen Leonard attempts a Midrange. Contested by Julius Harris (5.3 feet, MAN). Jalen Leonard misses. Rebound secured by Terry Rozier.

[02:35] Team_024 possession (Score: 43-58)
Julius Harris throws a bad pass out of bounds! TURNOVER! (dead ball)

[02:21] Team_085 possession (Score: 43-58)
Khris Brogdon attempts a 3Pt. Contested by Victor Simons (3.8 feet, MAN). Khris Brogdon misses. Rebound secured by Julius Harris.

[02:07] Team_024 possession (Score: 43-58)
FOUL! Offensive foul on Victor Simons! Khris Brogdon drew the charge! [Team fouls: 5] (Victor Simons: 1 personal fouls) TURNOVER! (dead ball)

[01:47] Team_085 possession (Score: 43-58)
FOUL! Reach-in foul on Terry Rozier during the drive. [IN THE BONUS! 6 team fouls] Jalen Leonard to the line for 2 free throws. (Terry Rozier: 2 personal fouls)   FT 1/2: GOOD   FT 2/2: MISS Jalen Leonard makes 1/2 from the line. Rebound secured by Zach Durant.
Score: 43-59

[01:30] Team_024 possession (Score: 43-59)
Vince Irving attempts a 3Pt. Contested by Jordan Morant (3.8 feet, ZONE). VINCE IRVING MAKES IT!
Score: 46-59

[01:15] Team_085 possession (Score: 46-59)
Giannis Johnson drives, picks up Zach Durant. Help arrives from Vince Irving! Giannis Johnson attempts a Layup. Contested by Vince Irving (3.4 feet, MAN). GIANNIS JOHNSON MAKES IT! Assist: Jalen Leonard
Score: 46-61

[01:02] Team_024 possession (Score: 46-61)
Julius Harris loses the ball! Stripped by Jalen Leonard! TURNOVER! (live ball)

[00:49] Team_085 possession (Score: 46-61)
Khris Brogdon attempts a 3Pt. Contested by Victor Simons (3.9 feet, ZONE). Khris Brogdon misses. Rebound secured by Zach Durant.

[00:33] Team_024 possession (Score: 46-61)
Vince Irving attempts a 3Pt. Contested by Jordan Morant (3.9 feet, MAN). Vince Irving misses. Rebound secured by Giannis Johnson.

[00:16] Team_085 possession (Score: 46-61)
Malcolm Beal drives to the basket... Malcolm Beal loses the ball! Stripped by Terry Rozier! TURNOVER! (live ball)

[00:03] Team_024 possession (Score: 46-61)
Vince Irving attempts a Midrange. Contested by Jordan Morant (3.9 feet, MAN). Vince Irving misses. Rebound secured by Malcolm Beal.

================================================================================
                              2ND QUARTER COMPLETE                              
================================================================================

2ND QUARTER SCORE: Team_024 21, Team_085 34

BOX SCORE:
================================================================================

Team_024
--------------------------------------------------------------------------------
Player                MIN  PTS  REB  AST  TO      FG   FG%      3P   3P%
--------------------------------------------------------------------------------
Terry Rozier           11    7    3    1   0   3/4    75.0     0/0   0.0
Zach Durant            10    5    2    0   0   2/3    66.7     0/0   0.0
Vince Irving           10    3    0    1   0   1/3    33.3     0/0   0.0
Ja Reaves              14    2    0    0   0   1/1   100.0     0/0   0.0
Zach Fox               14    2    2    0   0   1/2    50.0     0/0   0.0
Julius Harris          11    2    1    0   0   1/1   100.0     0/0   0.0
Bradley Allen          14    0    0    1   0   0/1     0.0     0/0   0.0
Victor Simons          10    0    0    0   0   0/2     0.0     0/0   0.0

TEAM: FG: 9/17 (52.9%), 3PT: 4/9 (44.4%), REB: 9 (3 off, 6 def), AST: 3, TO: 5
TEAM FOULS: 6 [Team_085 in BONUS]


Team_085
--------------------------------------------------------------------------------
Player                MIN  PTS  REB  AST  TO      FG   FG%      3P   3P%
--------------------------------------------------------------------------------
Giannis Johnson        10   10    2    1   0   5/6    83.3     0/0   0.0
Jalen Leonard          10    6    1    3   0   2/4    50.0     0/0   0.0
Jordan Morant          11    5    0    0   0   2/2   100.0     0/0   0.0
Magic Beal             14    3    0    1   0   1/1   100.0     0/0   0.0
Khris Brogdon          10    3    0    0   0   1/3    33.3     0/0   0.0
Collin Mobley          13    2    0    0   0   1/1   100.0     0/0   0.0
Larry Duncan           14    2    0    1   0   1/1   100.0     0/0   0.0
Malcolm Beal           11    2    5    1   0   1/1   100.0     0/0   0.0
Paul Wagner            15    0    2    0   0   0/1     0.0     0/0   0.0

TEAM: FG: 14/20 (70.0%), 3PT: 5/9 (55.6%), REB: 9 (2 off, 7 def), AST: 7, TO: 1
TEAM FOULS: 6 [Team_024 in BONUS]

================================================================================

================================================================================
                       3RD QUARTER - Team_024 vs Team_085                       
================================================================================

[12:00] Team_024 possession (Score: 46-61)
Draymond Towns attempts a Midrange. Contested by Paul Wagner (3.1 feet, ZONE). Draymond Towns misses. Offensive rebound by Draymond Towns! Draymond Towns puts it back in!
Score: 48-61

[11:46] Team_085 possession (Score: 48-61)
FOUL! Shooting foul on Anfernee Williamson. Collin Mobley to the line for 2 free throws. [Team fouls: 1] (Anfernee Williamson: 1 personal fouls)   FT 1/2: GOOD   FT 2/2: MISS Collin Mobley makes 1/2 from the line. Rebound secured by Draymond Towns.
Score: 48-62

[11:32] Team_024 possession (Score: 48-62)
Bradley Allen attempts a Midrange. Contested by Larry Duncan (3.1 feet, MAN). BRADLEY ALLEN MAKES IT! Assist: Anfernee Williamson
Score: 50-62

[11:17] Team_085 possession (Score: 50-62)
Larry Duncan attempts a Midrange. Contested by Bradley Allen (4.2 feet, MAN). LARRY DUNCAN MAKES IT! Assist: Stephen Bird
Score: 50-64

[11:02] Team_024 possession (Score: 50-64)
Bradley Allen attempts a 3Pt. Contested by Larry Duncan (3.1 feet, ZONE). Bradley Allen misses. Rebound secured by Paul Wagner.

[10:49] Team_085 possession (Score: 50-64)
Paul Wagner makes the Dunk and draws the foul on Zach Fox! And-1! Paul Wagner to the line for 1. [Team fouls: 2] (Zach Fox: 1 personal fouls)   FT 1/1: GOOD Paul Wagner makes 1/1 from the line.
Score: 50-67

[10:36] Team_024 possession (Score: 50-67)
Anfernee Williamson drives to the basket... Anfernee Williamson throws a bad pass! Stolen by Paul Wagner! TURNOVER! (live ball)

[10:25] Team_085 possession (Score: 50-67)
Collin Mobley attempts a Midrange. Contested by Anfernee Williamson (3.5 feet, MAN). Collin Mobley misses. Rebound secured by Zach Fox.

[10:10] Team_024 possession (Score: 50-67)
Draymond Towns attempts a 3Pt. Contested by Magic Beal (3.5 feet, ZONE). Draymond Towns misses. Offensive rebound by Zach Fox! Zach Fox kicks it out.

[09:58] Team_024 possession (Score: 50-67)
FOUL! Reach-in foul on Stephen Bird during the drive. [Team fouls: 1] No free throws, side out. (Stephen Bird: 1 personal fouls)

[09:47] Team_024 possession (Score: 50-67)
Ja Reaves drives, picks up Paul Wagner. Help arrives from Magic Beal! Ja Reaves attempts a Layup. Contested by Magic Beal (3.6 feet, ZONE). Ja Reaves misses. Rebound secured by Paul Wagner.

[09:33] Team_085 possession (Score: 50-67)
Magic Beal attempts a 3Pt. Contested by Ja Reaves (4.9 feet, MAN). Magic Beal misses. Offensive rebound by Larry Duncan! Larry Duncan kicks it out.

[09:19] Team_085 possession (Score: 50-67)
Stephen Bird attempts a 3Pt. Contested by Zach Fox (3.8 feet, MAN). Stephen Bird misses. Offensive rebound by Larry Duncan! Larry Duncan kicks it out.

[09:06] Team_085 possession (Score: 50-67)
Paul Wagner attempts a 3Pt. Contested by Zach Fox (3.8 feet, ZONE). Paul Wagner misses. Rebound secured by Draymond Towns.

[08:48] Team_024 possession (Score: 50-67)
Anfernee Williamson drives and kicks out. Draymond Towns attempts a 3Pt. Contested by Collin Mobley (3.9 feet, MAN). Draymond Towns misses. Rebound secured by Larry Duncan.

[08:37] Team_085 possession (Score: 50-67)
Larry Duncan attempts a 3Pt. Contested by Bradley Allen (4.2 feet, MAN). LARRY DUNCAN MAKES IT! Assist: Collin Mobley
Score: 50-70

[08:25] Team_024 possession (Score: 50-70)
FOUL! Shooting foul on Larry Duncan. Bradley Allen to the line for 3 free throws. [Team fouls: 2] (Larry Duncan: 1 personal fouls)   FT 1/3: GOOD   FT 2/3: GOOD   FT 3/3: GOOD Bradley Allen makes 3/3 from the line.
Score: 53-70

[08:15] Team_085 possession (Score: 53-70)
Paul Wagner drives, Anfernee Williamson stays with him. Paul Wagner attempts a Layup. Contested by Anfernee Williamson (3.9 feet, ZONE). PAUL WAGNER MAKES IT! Assist: Collin Mobley
Score: 53-72

[07:59] Team_024 possession (Score: 53-72)
FOUL! Shooting foul on Larry Duncan. Ja Reaves to the line for 2 free throws. [Team fouls: 3] (Larry Duncan: 2 personal fouls)   FT 1/2: GOOD   FT 2/2: MISS Ja Reaves makes 1/2 from the line. Rebound secured by Collin Mobley.
Score: 54-72

[07:49] Team_085 possession (Score: 54-72)
FOUL! Shooting foul on Bradley Allen. Larry Duncan to the line for 2 free throws. [Team fouls: 3] (Bradley Allen: 1 personal fouls)   FT 1/2: GOOD   FT 2/2: GOOD Larry Duncan makes 2/2 from the line.
Score: 54-74

[07:36] Team_024 possession (Score: 54-74)
Draymond Towns attempts a 3Pt. Contested by Magic Beal (3.5 feet, ZONE). DRAYMOND TOWNS MAKES IT! Assist: Bradley Allen
Score: 57-74

[07:23] Team_085 possession (Score: 57-74)
FOUL! Shooting foul on Anfernee Williamson. Collin Mobley to the line for 2 free throws. [Team fouls: 4] (Anfernee Williamson: 2 personal fouls)   FT 1/2: GOOD   FT 2/2: GOOD Collin Mobley makes 2/2 from the line.
Score: 57-76

[07:12] Team_024 possession (Score: 57-76)
Bradley Allen attempts a Midrange. Contested by Larry Duncan (3.1 feet, MAN). BRADLEY ALLEN MAKES IT! Assist: Ja Reaves
Score: 59-76

[06:55] Team_085 possession (Score: 59-76)
Collin Mobley drives and kicks out. Larry Duncan attempts a 3Pt. Contested by Zach Fox (3.5 feet, ZONE). Larry Duncan misses. Rebound secured by Draymond Towns.

[06:43] Team_024 possession (Score: 59-76)
FOUL! Shooting foul on Paul Wagner. Zach Fox to the line for 2 free throws. [Team fouls: 4] (Paul Wagner: 1 personal fouls)   FT 1/2: GOOD   FT 2/2: GOOD Zach Fox makes 2/2 from the line.
Score: 61-76

[06:29] Team_085 possession (Score: 61-76)
FOUL! Shooting foul on Anfernee Williamson. Collin Mobley to the line for 2 free throws. [BONUS: 5 team fouls] (Anfernee Williamson: 3 personal fouls)   FT 1/2: GOOD   FT 2/2: GOOD Collin Mobley makes 2/2 from the line.
Score: 61-78

[06:16] Team_024 possession (Score: 61-78)
Draymond Towns attempts a Midrange. Contested by Collin Mobley (3.4 feet, MAN). DRAYMOND TOWNS MAKES IT! Assist: Anfernee Williamson
Score: 63-78

[06:05] Team_085 possession (Score: 63-78)
Paul Wagner attempts a Midrange. BLOCKED BY ANFERNEE WILLIAMSON! Ball is loose! Rebound secured by Zach Fox.

[05:52] Team_024 possession (Score: 63-78)
Draymond Towns attempts a Layup. Contested by Collin Mobley (3.5 feet, MAN). DRAYMOND TOWNS MAKES IT!
Score: 65-78

[05:37] Team_085 possession (Score: 65-78)
Larry Duncan drives, Anfernee Williamson stays with him. Larry Duncan attempts a Dunk. Contested by Anfernee Williamson (4.0 feet, ZONE). LARRY DUNCAN MAKES IT!
Score: 65-80

[05:19] Team_024 possession (Score: 65-80)
Anfernee Williamson attempts a Midrange. Contested by Paul Wagner (3.4 feet, MAN). ANFERNEE WILLIAMSON MAKES IT! Assist: Draymond Towns
Score: 67-80

[05:02] Team_085 possession (Score: 67-80)
Paul Wagner makes the Dunk and draws the foul on Draymond Towns! And-1! Paul Wagner to the line for 1. [BONUS: 6 team fouls] (Draymond Towns: 1 personal fouls)   FT 1/1: GOOD Paul Wagner makes 1/1 from the line.
Score: 67-83

[04:48] Team_024 possession (Score: 67-83)
Zach Fox attempts a Layup. Contested by Stephen Bird (3.9 feet, MAN). ZACH FOX MAKES IT! Assist: Bradley Allen
Score: 69-83

[04:37] Team_085 possession (Score: 69-83)
FOUL! Reach-in foul on Anfernee Williamson during the drive. [IN THE BONUS! 7 team fouls] Collin Mobley to the line for 2 free throws. (Anfernee Williamson: 4 personal fouls)   FT 1/2: GOOD   FT 2/2: GOOD Collin Mobley makes 2/2 from the line.
Score: 69-85

[04:24] Team_024 possession (Score: 69-85)
Zach Fox attempts a 3Pt. Contested by Stephen Bird (3.9 feet, MAN). Zach Fox misses. Rebound secured by Larry Duncan.

[04:09] Team_085 possession (Score: 69-85)
FOUL! Shooting foul on Zach Fox. Larry Duncan to the line for 2 free throws. [BONUS: 8 team fouls] (Zach Fox: 2 personal fouls)   FT 1/2: GOOD   FT 2/2: GOOD Larry Duncan makes 2/2 from the line.
Score: 69-87

[03:59] Team_024 possession (Score: 69-87)
Anfernee Williamson attempts a 3Pt. Contested by Magic Beal (4.0 feet, ZONE). Anfernee Williamson misses. Rebound secured by Larry Duncan.

[03:47] Team_085 possession (Score: 69-87)
Larry Duncan attempts a 3Pt. Contested by Bradley Allen (4.4 feet, MAN). Larry Duncan misses. Rebound secured by Anfernee Williamson.

[03:34] Team_024 possession (Score: 69-87)
Ja Reaves attempts a Midrange. Contested by Magic Beal (4.3 feet, MAN). JA REAVES MAKES IT! Assist: Zach Fox
Score: 71-87

[03:15] Team_085 possession (Score: 71-87)
Paul Wagner attempts a 3Pt. Contested by Zach Fox (4.0 feet, ZONE). Paul Wagner misses. Offensive rebound by Larry Duncan! Larry Duncan kicks it out.

[03:00] Team_085 possession (Score: 71-87)
Larry Duncan attempts a Midrange. Contested by Bradley Allen (4.5 feet, MAN). Larry Duncan misses. Rebound secured by Draymond Towns.

[02:47] Team_024 possession (Score: 71-87)
Bradley Allen attempts a 3Pt. Contested by Magic Beal (4.3 feet, ZONE). Bradley Allen misses. Offensive rebound by Zach Fox! Zach Fox kicks it out.

[02:36] Team_024 possession (Score: 71-87)
Draymond Towns drives and kicks out. Bradley Allen attempts a Midrange. Contested by Larry Duncan (3.4 feet, ZONE). Bradley Allen misses. Rebound secured by Paul Wagner.

[02:18] Team_085 possession (Score: 71-87)
Magic Beal drives to the basket... FOUL! Offensive foul on Magic Beal! Anfernee Williamson drew the charge! [Team fouls: 5] (Magic Beal: 1 personal fouls) TURNOVER! (dead ball)

[02:03] Team_024 possession (Score: 71-87)
FOUL! Reach-in foul on Paul Wagner during the drive. [IN THE BONUS! 6 team fouls] Anfernee Williamson to the line for 2 free throws. (Paul Wagner: 2 personal fouls)   FT 1/2: GOOD   FT 2/2: GOOD Anfernee Williamson makes 2/2 from the line.
Score: 73-87

[01:50] Team_085 possession (Score: 73-87)
Paul Wagner makes the Dunk and draws the foul on Anfernee Williamson! And-1! Paul Wagner to the line for 1. [BONUS: 9 team fouls] (Anfernee Williamson: 5 personal fouls)   FT 1/1: GOOD Paul Wagner makes 1/1 from the line.
Score: 73-90

[01:38] Team_024 possession (Score: 73-90)
Ja Reaves attempts a Midrange. Contested by Magic Beal (4.5 feet, MAN). Ja Reaves misses. Rebound secured by Paul Wagner.

[01:22] Team_085 possession (Score: 73-90)
Magic Beal attempts a Midrange. Contested by Ja Reaves (5.3 feet, MAN). Magic Beal misses. Rebound secured by Draymond Towns.

[01:08] Team_024 possession (Score: 73-90)
Bradley Allen attempts a 3Pt. Contested by Magic Beal (4.5 feet, ZONE). Bradley Allen misses. Rebound secured by Larry Duncan.

[00:55] Team_085 possession (Score: 73-90)
Paul Wagner attempts a Midrange. Contested by Bradley Allen (4.6 feet, ZONE). Paul Wagner misses. Rebound secured by Draymond Towns.

[00:43] Team_024 possession (Score: 73-90)
FOUL! Reach-in foul on Collin Mobley during the drive. [IN THE BONUS! 7 team fouls] Draymond Towns to the line for 2 free throws. (Collin Mobley: 1 personal fouls)   FT 1/2: GOOD   FT 2/2: MISS Draymond Towns makes 1/2 from the line. Rebound secured by Collin Mobley.
Score: 74-90

[00:28] Team_085 possession (Score: 74-90)
Collin Mobley attempts a 3Pt. Contested by Draymond Towns (4.3 feet, MAN). COLLIN MOBLEY MAKES IT!
Score: 74-93

[00:13] Team_024 possession (Score: 74-93)
Bradley Allen attempts a Layup. Contested by Larry Duncan (3.7 feet, MAN). BRADLEY ALLEN MAKES IT!
Score: 76-93

================================================================================
                              3RD QUARTER COMPLETE                              
================================================================================

3RD QUARTER SCORE: Team_024 30, Team_085 32

BOX SCORE:
================================================================================

Team_024
--------------------------------------------------------------------------------
Player                MIN  PTS  REB  AST  TO      FG   FG%      3P   3P%
--------------------------------------------------------------------------------
Draymond Towns         25    9    7    1   0   4/6    66.7     0/0   0.0
Bradley Allen          26    9    0    2   0   4/6    66.7     0/0   0.0
Anfernee Williamson    25    4    1    2   0   2/4    50.0     0/0   0.0
Zach Fox               26    4    4    1   0   2/3    66.7     0/0   0.0
Ja Reaves              26    2    0    1   0   1/4    25.0     0/0   0.0

TEAM: FG: 13/23 (56.5%), 3PT: 2/6 (33.3%), REB: 12 (3 off, 9 def), AST: 7, TO: 1
TEAM FOULS: 9 [Team_085 in BONUS]


Team_085
--------------------------------------------------------------------------------
Player                MIN  PTS  REB  AST  TO      FG   FG%      3P   3P%
--------------------------------------------------------------------------------
Larry Duncan           26   11    7    0   0   5/7    71.4     0/0   0.0
Paul Wagner            27   11    4    0   0   4/7    57.1     0/0   0.0
Collin Mobley          25    9    2    2   0   4/7    57.1     0/0   0.0
Stephen Bird           25    0    0    1   0   0/0     0.0     0/0   0.0
Magic Beal             26    0    0    0   0   0/1     0.0     0/0   0.0

TEAM: FG: 13/22 (59.1%), 3PT: 2/4 (50.0%), REB: 13 (3 off, 10 def), AST: 3, TO: 1
TEAM FOULS: 7 [Team_024 in BONUS]

================================================================================

================================================================================
                       4TH QUARTER - Team_024 vs Team_085                       
================================================================================

[12:00] Substitution (Team_024): Ja Reaves OUT (stamina: 67) → Victor Simons IN (comeback_detected)

[12:00] Substitution (Team_085): Magic Beal OUT (stamina: 68) → Khris Brogdon IN (comeback_detected)

[12:00] Team_024 possession (Score: 76-93)
Zach Fox attempts a 3Pt. Contested by Stephen Bird (4.2 feet, MAN). Zach Fox misses. Rebound secured by Larry Duncan.

[11:41] Team_085 possession (Score: 76-93)
Larry Duncan attempts a 3Pt. Contested by Bradley Allen (4.6 feet, MAN). LARRY DUNCAN MAKES IT!
Score: 76-96

[11:29] Team_024 possession (Score: 76-96)
Bradley Allen throws a bad pass! Stolen by Larry Duncan! TURNOVER! (live ball)

[11:15] Team_085 possession (Score: 76-96)
Khris Brogdon attempts a 3Pt. Contested by Victor Simons (3.8 feet, MAN). KHRIS BROGDON MAKES IT! Assist: Larry Duncan
Score: 76-99

[11:03] Team_024 possession (Score: 76-99)
Bradley Allen attempts a 3Pt. Contested by Larry Duncan (3.5 feet, MAN). Bradley Allen misses. Rebound secured by Larry Duncan.

[10:46] Team_085 possession (Score: 76-99)
Khris Brogdon drives to the basket... FOUL! Offensive foul on Khris Brogdon! Victor Simons drew the charge! [Team fouls: 1] (Khris Brogdon: 1 personal fouls) TURNOVER! (dead ball)

[10:31] Team_024 possession (Score: 76-99)
Bradley Allen attempts a Midrange. Contested by Paul Wagner (3.9 feet, ZONE). BRADLEY ALLEN MAKES IT!
Score: 78-99

[10:12] Team_085 possession (Score: 78-99)
Paul Wagner attempts a 3Pt. Contested by Victor Simons (4.2 feet, ZONE). PAUL WAGNER MAKES IT! Assist: Stephen Bird
Score: 78-102

[09:54] Team_024 possession (Score: 78-102)
Zach Fox attempts a 3Pt. Contested by Khris Brogdon (5.7 feet, ZONE). ZACH FOX MAKES IT!
Score: 81-102

[09:39] Team_085 possession (Score: 81-102)
Khris Brogdon attempts a Midrange. Contested by Victor Simons (3.8 feet, MAN). Khris Brogdon misses. Rebound secured by Zach Fox.

[09:20] Team_024 possession (Score: 81-102)
Bradley Allen makes the Layup and draws the foul on Paul Wagner! And-1! Bradley Allen to the line for 1. [Team fouls: 2] (Paul Wagner: 1 personal fouls)   FT 1/1: GOOD Bradley Allen makes 1/1 from the line.
Score: 84-102

[09:00] Team_085 possession (Score: 84-102)
Stephen Bird attempts a Midrange. Contested by Zach Fox (4.4 feet, MAN). Stephen Bird misses. Rebound secured by Zach Fox.

[08:44] Team_024 possession (Score: 84-102)
Bradley Allen drives to the basket... Bradley Allen loses the ball! Stripped by Paul Wagner! TURNOVER! (live ball)

[08:30] Team_085 possession (Score: 84-102)
Khris Brogdon attempts a 3Pt. Contested by Victor Simons (3.8 feet, MAN). Khris Brogdon misses. Rebound secured by Zach Fox.

[08:14] Team_024 possession (Score: 84-102)
FOUL! Reach-in foul on Paul Wagner during the drive. [Team fouls: 3] No free throws, side out. (Paul Wagner: 2 personal fouls)

[08:02] Team_024 possession (Score: 84-102)
Zach Fox drives to the basket... FOUL! Offensive foul on Zach Fox! Paul Wagner drew the charge! [Team fouls: 1] (Zach Fox: 1 personal fouls) TURNOVER! (dead ball)

[07:49] Team_085 possession (Score: 84-102)
Collin Mobley attempts a 3Pt. Contested by Victor Simons (3.7 feet, ZONE). Collin Mobley misses. Rebound secured by Draymond Towns.

[07:31] Team_024 possession (Score: 84-102)
Draymond Towns drives, picks up Paul Wagner. Help arrives from Khris Brogdon! Draymond Towns attempts a Dunk. Contested by Khris Brogdon (3.8 feet, ZONE). Draymond Towns misses. Rebound secured by Larry Duncan.

[07:17] Team_085 possession (Score: 84-102)
Collin Mobley attempts a Midrange. Contested by Draymond Towns (4.7 feet, MAN). COLLIN MOBLEY MAKES IT!
Score: 84-104

[07:03] Team_024 possession (Score: 84-104)
Bradley Allen attempts a 3Pt. Contested by Stephen Bird (4.6 feet, ZONE). Bradley Allen misses. Offensive rebound by Zach Fox! Zach Fox kicks it out.

[06:52] Team_024 possession (Score: 84-104)
Victor Simons drives and kicks out. Anfernee Williamson attempts a 3Pt. Contested by Paul Wagner (4.5 feet, MAN). Anfernee Williamson misses. Rebound secured by Larry Duncan.

[06:34] Team_085 possession (Score: 84-104)
Stephen Bird drives, picks up Anfernee Williamson. Help arrives from Zach Fox! Stephen Bird attempts a Layup. Contested by Zach Fox (5.0 feet, ZONE). STEPHEN BIRD MAKES IT! Assist: Collin Mobley
Score: 84-106

[06:18] Team_024 possession (Score: 84-106)
Anfernee Williamson drives to the basket... Anfernee Williamson commits a violation (traveling/carry)! TURNOVER! (dead ball)

[06:18] Substitution (Team_024): Zach Fox OUT → Vince Irving IN (stamina_rule2)

[06:18] Substitution (Team_024): Bradley Allen OUT → Zach Durant IN (stamina_rule2)

[06:18] Substitution (Team_024): Anfernee Williamson OUT → Julius Harris IN (stamina_rule2)

[06:18] Substitution (Team_024): Draymond Towns OUT → Terry Rozier IN (stamina_rule2)

[06:18] Substitution (Team_085): Stephen Bird OUT → Jordan Morant IN (stamina_rule2)

[06:18] Substitution (Team_085): Larry Duncan OUT → Giannis Johnson IN (stamina_rule2)

[06:18] Substitution (Team_085): Paul Wagner OUT → Jalen Leonard IN (stamina_rule2)

[06:18] Substitution (Team_085): Collin Mobley OUT → Malcolm Beal IN (stamina_rule2)

[06:03] Team_085 possession (Score: 84-106)
FOUL! Reach-in foul on Terry Rozier during the drive. [Team fouls: 2] No free throws, side out. (Terry Rozier: 1 personal fouls)

[05:51] Team_085 possession (Score: 84-106)
Jalen Leonard drives, Julius Harris stays with him. Jalen Leonard attempts a Layup. Contested by Julius Harris (5.3 feet, MAN). Jalen Leonard misses. Rebound secured by Zach Durant.

[05:31] Team_024 possession (Score: 84-106)
Julius Harris drives to the basket... Julius Harris throws a bad pass! Stolen by Jalen Leonard! TURNOVER! (live ball)

[05:17] Team_085 possession (Score: 84-106)
Khris Brogdon drives, picks up Victor Simons. Help arrives from Zach Durant! Khris Brogdon attempts a Dunk. Contested by Zach Durant (3.8 feet, MAN). Khris Brogdon misses. Rebound secured by Julius Harris.

[05:03] Team_024 possession (Score: 84-106)
Zach Durant attempts a 3Pt. Wide open! Giannis Johnson is 6.1 feet away. [MAN] ZACH DURANT MAKES IT! Assist: Victor Simons
Score: 87-106

[04:48] Team_085 possession (Score: 87-106)
Khris Brogdon throws a bad pass out of bounds! TURNOVER! (dead ball)

[04:34] Team_024 possession (Score: 87-106)
Julius Harris attempts a Midrange. Wide open! Giannis Johnson is 6.0 feet away. [ZONE] Julius Harris misses. Rebound secured by Jalen Leonard.

[04:15] Team_085 possession (Score: 87-106)
Jordan Morant attempts a 3Pt. Contested by Victor Simons (4.2 feet, ZONE). Jordan Morant misses. Offensive rebound by Malcolm Beal! Malcolm Beal kicks it out.

[03:59] Team_085 possession (Score: 87-106)
Jalen Leonard attempts a 3Pt. Contested by Julius Harris (5.3 feet, MAN). Jalen Leonard misses. FOUL! Loose ball foul on Zach Durant during the rebound battle. [Team fouls: 3] No free throws, side out. (Zach Durant: 1 personal fouls)

[03:46] Team_085 possession (Score: 87-106)
Malcolm Beal attempts a Layup. Contested by Terry Rozier (3.5 feet, MAN). MALCOLM BEAL MAKES IT! Assist: Giannis Johnson
Score: 87-108

[03:33] Team_024 possession (Score: 87-108)
Vince Irving attempts a Layup. BLOCKED BY JORDAN MORANT! Ball is loose! Rebound secured by Giannis Johnson.

[03:18] Team_085 possession (Score: 87-108)
Jordan Morant attempts a 3Pt. Contested by Victor Simons (4.3 feet, ZONE). JORDAN MORANT MAKES IT!
Score: 87-111

[03:08] Team_024 possession (Score: 87-111)
Julius Harris attempts a Layup. Contested by Jalen Leonard (4.3 feet, MAN). Julius Harris misses. Rebound secured by Giannis Johnson.

[02:54] Team_085 possession (Score: 87-111)
Khris Brogdon drives and kicks out. Jalen Leonard attempts a 3Pt. Contested by Julius Harris (5.0 feet, MAN). JALEN LEONARD MAKES IT! Assist: Khris Brogdon
Score: 87-114

[02:38] Team_024 possession (Score: 87-114)
Julius Harris drives and kicks out. Vince Irving attempts a 3Pt. Contested by Jordan Morant (3.5 feet, ZONE). Vince Irving misses. Rebound secured by Jalen Leonard.

[02:21] Team_085 possession (Score: 87-114)
Jalen Leonard drives and kicks out. Malcolm Beal attempts a 3Pt. Contested by Zach Durant (3.2 feet, ZONE). Malcolm Beal misses. Rebound secured by Zach Durant.

[02:07] Team_024 possession (Score: 87-114)
Vince Irving attempts a 3Pt. Contested by Jordan Morant (3.6 feet, ZONE). Vince Irving misses. Offensive rebound by Terry Rozier! Terry Rozier puts it back in!
Score: 89-114

[01:53] Team_085 possession (Score: 89-114)
Malcolm Beal drives, picks up Terry Rozier. Help arrives from Vince Irving! Malcolm Beal attempts a Dunk. Contested by Vince Irving (3.5 feet, ZONE). MALCOLM BEAL MAKES IT! Assist: Jordan Morant
Score: 89-116

[01:37] Team_024 possession (Score: 89-116)
Victor Simons drives to the basket... FOUL! Offensive foul on Victor Simons! Khris Brogdon drew the charge! [Team fouls: 4] (Victor Simons: 1 personal fouls) TURNOVER! (dead ball)

[01:20] Team_085 possession (Score: 89-116)
Khris Brogdon attempts a Midrange. Contested by Victor Simons (4.1 feet, MAN). Khris Brogdon misses. Offensive rebound by Jalen Leonard! Jalen Leonard kicks it out.

[01:06] Team_085 possession (Score: 89-116)
Jalen Leonard drives, Terry Rozier stays with him. Jalen Leonard attempts a Dunk. Contested by Terry Rozier (4.3 feet, ZONE). Jalen Leonard misses. Offensive rebound by Jalen Leonard! Jalen Leonard kicks it out.

[00:49] Team_085 possession (Score: 89-116)
Giannis Johnson attempts a Midrange. Contested by Julius Harris (5.0 feet, ZONE). Giannis Johnson misses. Rebound secured by Terry Rozier.

[00:39] Team_024 possession (Score: 89-116)
Terry Rozier attempts a 3Pt. Contested by Malcolm Beal (4.7 feet, MAN). Terry Rozier misses. Rebound secured by Malcolm Beal.

[00:23] Team_085 possession (Score: 89-116)
FOUL! Reach-in foul on Terry Rozier during the drive. [IN THE BONUS! 5 team fouls] Malcolm Beal to the line for 2 free throws. (Terry Rozier: 2 personal fouls)   FT 1/2: GOOD   FT 2/2: MISS Malcolm Beal makes 1/2 from the line. FOUL! Loose ball foul on Terry Rozier during the free throw rebound! [IN THE BONUS! 6 team fouls] Malcolm Beal to the line for 2 free throws. (Terry Rozier: 3 personal fouls)   FT 1/2: GOOD   FT 2/2: GOOD Malcolm Beal makes 2/2 from the line.
Score: 89-119

[00:09] Team_024 possession (Score: 89-119)
Terry Rozier attempts a Midrange. Contested by Malcolm Beal (4.7 feet, MAN). TERRY ROZIER MAKES IT! Assist: Julius Harris
Score: 91-119

================================================================================
                              4TH QUARTER COMPLETE                              
================================================================================

4TH QUARTER SCORE: Team_024 15, Team_085 26

BOX SCORE:
================================================================================

Team_024
--------------------------------------------------------------------------------
Player                MIN  PTS  REB  AST  TO      FG   FG%      3P   3P%
--------------------------------------------------------------------------------
Bradley Allen          32    5    0    0   0   2/3    66.7     0/0   0.0
Terry Rozier           17    4    2    0   0   2/3    66.7     0/0   0.0
Zach Fox               32    3    4    0   0   1/2    50.0     0/0   0.0
Zach Durant            16    3    2    0   0   1/1   100.0     0/0   0.0
Draymond Towns         31    0    1    0   0   0/1     0.0     0/0   0.0
Victor Simons          22    0    0    1   0   0/1     0.0     0/0   0.0
Julius Harris          17    0    1    1   0   0/3     0.0     0/0   0.0
Vince Irving           16    0    0    0   0   0/1     0.0     0/0   0.0

TEAM: FG: 6/15 (40.0%), 3PT: 3/6 (50.0%), REB: 10 (2 off, 8 def), AST: 2, TO: 6
TEAM FOULS: 6 [Team_085 in BONUS]


Team_085
--------------------------------------------------------------------------------
Player                MIN  PTS  REB  AST  TO      FG   FG%      3P   3P%
--------------------------------------------------------------------------------
Malcolm Beal           17    7    3    0   0   3/3   100.0     0/0   0.0
Larry Duncan           32    3    4    1   0   1/1   100.0     0/0   0.0
Khris Brogdon          22    3    0    1   0   1/4    25.0     0/0   0.0
Paul Wagner            33    3    0    0   0   1/1   100.0     0/0   0.0
Jalen Leonard          16    3    4    0   0   1/3    33.3     0/0   0.0
Jordan Morant          17    3    0    1   0   1/1   100.0     0/0   0.0
Stephen Bird           31    2    0    1   0   1/2    50.0     0/0   0.0
Collin Mobley          31    2    0    1   0   1/2    50.0     0/0   0.0
Giannis Johnson        16    0    2    1   0   0/1     0.0     0/0   0.0

TEAM: FG: 10/18 (55.6%), 3PT: 4/6 (66.7%), REB: 13 (4 off, 9 def), AST: 6, TO: 2
TEAM FOULS: 3

================================================================================

================================================================================
                               FULL GAME COMPLETE                               
================================================================================

FINAL SCORE: Team_024 91, Team_085 119

SCORING BY QUARTER:
--------------------------------------------------------------------------------
Team                     Q1     Q2     Q3     Q4    FINAL
--------------------------------------------------------------------------------
Team_024                 25     21     30     15       91
Team_085                 27     34     32     26      119
--------------------------------------------------------------------------------

FULL GAME BOX SCORE:
================================================================================

Team_024
--------------------------------------------------------------------------------
Player                MIN  PTS  REB  AST  TO      FG   FG%      3P   3P%      FT STL BLK
--------------------------------------------------------------------------------
Zach Fox               32   15   10    2   5   7/11   63.6   2/5    40.0   9/10    0   0
Bradley Allen          32   19    0    3   6   8/14   57.1   1/6    16.7   5/5     0   0
Anfernee Williamson    31    6    4    3   1   3/5    60.0   0/1     0.0   2/2     0   1
Draymond Towns         31   11   14    1   0   5/10   50.0   1/1   100.0   1/2     0   0
Ja Reaves              26    7    0    1   0   4/8    50.0   0/1     0.0   2/4     0   0
Victor Simons          22    4    0    1   3   2/5    40.0   0/2     0.0   2/2     0   0
Julius Harris          17    2    2    1   2   0/3     0.0   0/0     0.0   2/4     0   0
Terry Rozier           17   11    5    2   0   3/5    60.0   0/1     0.0   1/1     1   1
Vince Irving           16    5    0    1   0   4/7    57.1   3/4    75.0   0/0     0   0
Zach Durant            16    8    4    1   1   4/5    80.0   3/3   100.0   2/2     0   0

TEAM: FG: 40/74 (54.1%), 3PT: 10/24 (41.7%), REB: 40 (9 off, 31 def), AST: 16, TO: 18


Team_085
--------------------------------------------------------------------------------
Player                MIN  PTS  REB  AST  TO      FG   FG%      3P   3P%      FT STL BLK
--------------------------------------------------------------------------------
Paul Wagner            33   23    7    0   0   8/13   61.5   1/4    25.0   4/4     2   1
Larry Duncan           32   22   13    5   1  10/14   71.4   2/4    50.0   4/4     2   0
Stephen Bird           31    5    0    3   3   3/8    37.5   1/4    25.0   1/2     1   0
Collin Mobley          31   15    6    4   0   7/12   58.3   1/2    50.0   9/10    0   0
Magic Beal             26    5    0    1   1   2/3    66.7   1/1   100.0   0/0     0   0
Khris Brogdon          22    6    0    2   1   3/8    37.5   2/5    40.0   0/0     0   1
Jordan Morant          17   11    0    1   1   3/3   100.0   1/1   100.0   1/1     0   1
Malcolm Beal           17   10    8    1   0   6/7    85.7   0/0     0.0   2/4     0   0
Giannis Johnson        16   10    4    2   0   5/7    71.4   1/2    50.0   3/4     0   0
Jalen Leonard          16    9    5    3   0   2/6    33.3   2/2   100.0   1/2     2   0

TEAM: FG: 49/81 (60.5%), 3PT: 12/25 (48.0%), REB: 42 (9 off, 33 def), AST: 22, TO: 7

================================================================================
