================================================================================
                        FULL GAME - Team_064 vs Team_084                        
================================================================================

================================================================================
                       1ST QUARTER - Team_064 vs Team_084                       
================================================================================

[12:00] Team_064 possession (Score: 0-0)
Kawhi Irving throws a bad pass! Stolen by Klay Thompson! TURNOVER! (live ball)

[11:46] Team_084 possession (Score: 0-0)
Luka Sexton throws a bad pass! Stolen by Ja Mitchell! TURNOVER! (live ball)

[11:33] Team_064 possession (Score: 0-0)
Shai Hyland attempts a 3Pt. Contested by Luka Sexton (4.0 feet, ZONE). Shai Hyland misses. Offensive rebound by Kawhi Irving! Kawhi Irving kicks it out.

[11:16] Team_064 possession (Score: 0-0)
Ja Mitchell attempts a Layup. Contested by Luka Sexton (3.9 feet, MAN). Ja Mitchell misses. Offensive rebound by Kawhi Irving! Kawhi Irving kicks it out.

[11:03] Team_064 possession (Score: 0-0)
FOUL! Holding foul on Jarrett Booker. [Team fouls: 1] No free throws, side out. (Jarrett Booker: 1 personal fouls)

[10:46] Team_064 possession (Score: 0-0)
Russell Simons drives, picks up Jarrett Booker. Help arrives from Dejounte Ginobili! Russell Simons attempts a Layup. Contested by Dejounte Ginobili (4.7 feet, MAN). RUSSELL SIMONS MAKES IT! Assist: Shai Hyland
Score: 2-0

[10:31] Team_084 possession (Score: 2-0)
Luka Sexton attempts a 3Pt. Contested by Ja Mitchell (5.5 feet, ZONE). Luka Sexton misses. Rebound secured by Shai Hyland.

[10:16] Team_064 possession (Score: 2-0)
Ja Mitchell attempts a 3Pt. Contested by Luka Sexton (3.9 feet, MAN). JA MITCHELL MAKES IT! Assist: Jordan Mitchell
Score: 5-0

[10:07] Team_084 possession (Score: 5-0)
Giannis Quickley drives and kicks out. Klay Thompson attempts a Midrange. Contested by Kawhi Irving (4.3 feet, MAN). Klay Thompson misses. Offensive rebound by Dejounte Ginobili! Dejounte Ginobili kicks it out.

[09:54] Team_084 possession (Score: 5-0)
Luka Sexton attempts a 3Pt. Contested by Ja Mitchell (5.5 feet, ZONE). Luka Sexton misses. Rebound secured by Kawhi Irving.

[09:45] Team_064 possession (Score: 5-0)
FOUL! Shooting foul on Luka Sexton. Kawhi Irving to the line for 3 free throws. [Team fouls: 2] (Luka Sexton: 1 personal fouls)   FT 1/3: MISS   FT 2/3: GOOD   FT 3/3: GOOD Kawhi Irving makes 2/3 from the line.
Score: 7-0

[09:31] Team_084 possession (Score: 7-0)
Dejounte Ginobili throws a bad pass! Stolen by Jordan Mitchell! TURNOVER! (live ball)

[09:17] Team_064 possession (Score: 7-0)
FOUL! Reach-in foul on Giannis Quickley during the drive. [Team fouls: 3] No free throws, side out. (Giannis Quickley: 1 personal fouls)

[09:07] Team_064 possession (Score: 7-0)
Shai Hyland drives and kicks out. Russell Simons attempts a 3Pt. Contested by Luka Sexton (3.6 feet, ZONE). Russell Simons misses. Rebound secured by Klay Thompson.

[08:53] Team_084 possession (Score: 7-0)
Giannis Quickley attempts a Midrange. Contested by Shai Hyland (5.3 feet, MAN). Giannis Quickley misses. FOUL! Loose ball foul on Russell Simons during the rebound battle. [Team fouls: 1] No free throws, side out. (Russell Simons: 1 personal fouls)

[08:43] Team_084 possession (Score: 7-0)
Giannis Quickley attempts a Midrange. Contested by Jordan Mitchell (4.1 feet, ZONE). GIANNIS QUICKLEY MAKES IT!
Score: 7-2

[08:26] Team_064 possession (Score: 7-2)
Ja Mitchell drives and kicks out. Russell Simons attempts a 3Pt. Contested by Jarrett Booker (4.6 feet, MAN). Russell Simons misses. Rebound secured by Dejounte Ginobili.

[08:14] Team_084 possession (Score: 7-2)
FOUL! Reach-in foul on Russell Simons during the drive. [Team fouls: 2] No free throws, side out. (Russell Simons: 2 personal fouls)

[08:00] Team_084 possession (Score: 7-2)
Giannis Quickley makes the Dunk and draws the foul on Jordan Mitchell! And-1! Giannis Quickley to the line for 1. [Team fouls: 3] (Jordan Mitchell: 1 personal fouls)   FT 1/1: GOOD Giannis Quickley makes 1/1 from the line.
Score: 7-5

[07:46] Team_064 possession (Score: 7-5)
Kawhi Irving attempts a 3Pt. Contested by Klay Thompson (4.7 feet, MAN). Kawhi Irving misses. Rebound secured by Klay Thompson.

[07:29] Team_084 possession (Score: 7-5)
Dejounte Ginobili attempts a Midrange. Contested by Jordan Mitchell (4.1 feet, MAN). Dejounte Ginobili misses. Offensive rebound by Dejounte Ginobili! Dejounte Ginobili kicks it out.

[07:13] Team_084 possession (Score: 7-5)
Klay Thompson attempts a 3Pt. Contested by Ja Mitchell (5.6 feet, ZONE). Klay Thompson misses. Rebound secured by Kawhi Irving.

[07:00] Team_064 possession (Score: 7-5)
Ja Mitchell attempts a 3Pt. Contested by Luka Sexton (3.9 feet, ZONE). Ja Mitchell misses. FOUL! Loose ball foul on Giannis Quickley during the rebound battle. [Team fouls: 4] No free throws, side out. (Giannis Quickley: 2 personal fouls)

[06:47] Team_064 possession (Score: 7-5)
Ja Mitchell attempts a 3Pt. Contested by Luka Sexton (3.9 feet, ZONE). JA MITCHELL MAKES IT! Assist: Shai Hyland
Score: 10-5

[06:30] Team_084 possession (Score: 10-5)
Giannis Quickley attempts a Midrange. Contested by Shai Hyland (5.3 feet, MAN). Giannis Quickley misses. Offensive rebound by Giannis Quickley! Giannis Quickley's putback is no good. Offensive rebound by Dejounte Ginobili! Dejounte Ginobili kicks it out.

[06:16] Team_084 possession (Score: 10-5)
Dejounte Ginobili attempts a Layup. Contested by Jordan Mitchell (4.1 feet, MAN). Dejounte Ginobili misses. Rebound secured by Kawhi Irving.

[06:01] Team_064 possession (Score: 10-5)
Russell Simons throws a bad pass! Stolen by Jarrett Booker! TURNOVER! (live ball)

[05:47] Team_084 possession (Score: 10-5)
Klay Thompson attempts a 3Pt. Contested by Kawhi Irving (4.8 feet, MAN). Klay Thompson misses. Rebound secured by Russell Simons.

[05:32] Team_064 possession (Score: 10-5)
Russell Simons drives to the basket... Russell Simons throws a bad pass! Stolen by Jarrett Booker! TURNOVER! (live ball)

[05:22] Team_084 possession (Score: 10-5)
Dejounte Ginobili attempts a 3Pt. Contested by Jordan Mitchell (4.1 feet, MAN). DEJOUNTE GINOBILI MAKES IT!
Score: 10-8

[05:05] Team_064 possession (Score: 10-8)
Shai Hyland makes the Layup and draws the foul on Giannis Quickley! And-1! Shai Hyland to the line for 1. [BONUS: 5 team fouls] (Giannis Quickley: 3 personal fouls)   FT 1/1: GOOD Shai Hyland makes 1/1 from the line.
Score: 13-8

[04:51] Team_084 possession (Score: 13-8)
FOUL! Holding foul on Ja Mitchell. [Team fouls: 4] No free throws, side out. (Ja Mitchell: 1 personal fouls)

[04:36] Team_084 possession (Score: 13-8)
Jarrett Booker attempts a 3Pt. Contested by Jordan Mitchell (4.2 feet, ZONE). JARRETT BOOKER MAKES IT! Assist: Luka Sexton
Score: 13-11

[04:23] Team_064 possession (Score: 13-11)
Jordan Mitchell drives, picks up Giannis Quickley. Help arrives from Dejounte Ginobili! Jordan Mitchell attempts a Layup. Contested by Dejounte Ginobili (4.1 feet, ZONE). Jordan Mitchell misses. Rebound secured by Dejounte Ginobili.

[04:10] Team_084 possession (Score: 13-11)
Luka Sexton attempts a 3Pt. Contested by Ja Mitchell (5.6 feet, ZONE). Luka Sexton misses. FOUL! Loose ball foul on Kawhi Irving during the rebound battle. [IN THE BONUS! 5 team fouls] Dejounte Ginobili to the line for 2 free throws. (Kawhi Irving: 1 personal fouls)   FT 1/2: MISS   FT 2/2: GOOD Dejounte Ginobili makes 1/2 from the line.
Score: 13-12

[03:58] Team_064 possession (Score: 13-12)
Ja Mitchell attempts a 3Pt. Contested by Luka Sexton (4.0 feet, ZONE). Ja Mitchell misses. Rebound secured by Giannis Quickley.

[03:45] Team_084 possession (Score: 13-12)
Dejounte Ginobili drives, Jordan Mitchell stays with him. Dejounte Ginobili attempts a Layup. Contested by Jordan Mitchell (4.3 feet, MAN). DEJOUNTE GINOBILI MAKES IT! Assist: Giannis Quickley
Score: 13-14

[03:33] Team_064 possession (Score: 13-14)
Kawhi Irving attempts a 3Pt. Contested by Klay Thompson (4.9 feet, MAN). Kawhi Irving misses. FOUL! Loose ball foul on Giannis Quickley during the rebound battle. [IN THE BONUS! 6 team fouls] Kawhi Irving to the line for 2 free throws. (Giannis Quickley: 4 personal fouls)   FT 1/2: GOOD   FT 2/2: GOOD Kawhi Irving makes 2/2 from the line.
Score: 15-14

[03:18] Team_084 possession (Score: 15-14)
Jarrett Booker attempts a 3Pt. Contested by Jordan Mitchell (4.3 feet, ZONE). Jarrett Booker misses. Rebound secured by Shai Hyland.

[03:05] Team_064 possession (Score: 15-14)
Kawhi Irving attempts a Midrange. Contested by Luka Sexton (3.7 feet, ZONE). Kawhi Irving misses. Rebound secured by Dejounte Ginobili.

[02:51] Team_084 possession (Score: 15-14)
Giannis Quickley makes the Layup and draws the foul on Russell Simons! And-1! Giannis Quickley to the line for 1. [BONUS: 6 team fouls] (Russell Simons: 3 personal fouls)   FT 1/1: GOOD Giannis Quickley makes 1/1 from the line.
Score: 15-17

[02:41] Team_064 possession (Score: 15-17)
Ja Mitchell attempts a Layup. Contested by Luka Sexton (4.1 feet, MAN). JA MITCHELL MAKES IT! Assist: Shai Hyland
Score: 17-17

[02:27] Team_084 possession (Score: 17-17)
Dejounte Ginobili attempts a 3Pt. Contested by Ja Mitchell (5.7 feet, ZONE). Dejounte Ginobili misses. Rebound secured by Russell Simons.

[02:13] Team_064 possession (Score: 17-17)
Jordan Mitchell attempts a Midrange. Contested by Klay Thompson (4.7 feet, ZONE). JORDAN MITCHELL MAKES IT! Assist: Ja Mitchell
Score: 19-17

[01:58] Team_084 possession (Score: 19-17)
Giannis Quickley drives to the basket... Giannis Quickley loses control! Ball rolls out of bounds! TURNOVER! (dead ball)

[01:58] Substitution (Team_064): Ja Mitchell OUT → CJ Haliburton IN (stamina_rule2)

[01:58] Substitution (Team_064): Jordan Mitchell OUT → Ja Simmons IN (stamina_rule2)

[01:58] Substitution (Team_064): Kawhi Irving OUT → Tobias Herro IN (stamina_rule2)

[01:58] Substitution (Team_064): Russell Simons OUT → Austin Smith IN (stamina_rule2)

[01:58] Substitution (Team_064): Shai Hyland OUT → Devin Cunningham IN (stamina_rule2)

[01:58] Substitution (Team_084): Luka Sexton OUT → Magic Bryant IN (stamina_rule2)

[01:58] Substitution (Team_084): Dejounte Ginobili OUT → Chris Parker IN (stamina_rule2)

[01:58] Substitution (Team_084): Klay Thompson OUT → Evan Quickley IN (stamina_rule2)

[01:58] Substitution (Team_084): Jarrett Booker OUT → Pascal Jackson IN (stamina_rule2)

[01:58] Substitution (Team_084): Giannis Quickley OUT → Dejounte Porzingis IN (stamina_rule2)

[01:43] Team_064 possession (Score: 19-17)
FOUL! Offensive foul on Ja Simmons! Chris Parker drew the charge! [Team fouls: 7] (Ja Simmons: 1 personal fouls) TURNOVER! (dead ball)

[01:28] Team_084 possession (Score: 19-17)
Dejounte Porzingis attempts a Midrange. Wide open! Tobias Herro is 6.1 feet away. [ZONE] DEJOUNTE PORZINGIS MAKES IT! Assist: Magic Bryant
Score: 19-19

[01:18] Team_064 possession (Score: 19-19)
Austin Smith drives, Pascal Jackson stays with him. Austin Smith attempts a Dunk. Contested by Pascal Jackson (4.3 feet, MAN). AUSTIN SMITH MAKES IT!
Score: 21-19

[01:05] Team_084 possession (Score: 21-19)
Chris Parker attempts a 3Pt. Contested by Austin Smith (4.7 feet, ZONE). Chris Parker misses. Rebound secured by Devin Cunningham.

[00:56] Team_064 possession (Score: 21-19)
CJ Haliburton attempts a 3Pt. Contested by Magic Bryant (4.0 feet, MAN). CJ Haliburton misses. Rebound secured by Evan Quickley.

[00:45] Team_084 possession (Score: 21-19)
Dejounte Porzingis attempts a 3Pt. Contested by Devin Cunningham (5.3 feet, MAN). Dejounte Porzingis misses. Rebound secured by Austin Smith.

[00:31] Team_064 possession (Score: 21-19)
Tobias Herro attempts a 3Pt. Contested by Evan Quickley (4.4 feet, MAN). Tobias Herro misses. Rebound secured by Pascal Jackson.

[00:16] Team_084 possession (Score: 21-19)
Pascal Jackson attempts a 3Pt. Contested by Austin Smith (4.7 feet, MAN). Pascal Jackson misses. Rebound secured by Ja Simmons.

[00:03] Team_064 possession (Score: 21-19)
Austin Smith drives to the basket... Austin Smith throws a bad pass out of bounds! TURNOVER! (dead ball)

================================================================================
                              1ST QUARTER COMPLETE                              
================================================================================

1ST QUARTER SCORE: Team_064 21, Team_084 19

BOX SCORE:
================================================================================

Team_064
--------------------------------------------------------------------------------
Player                MIN  PTS  REB  AST  TO      FG   FG%      3P   3P%
--------------------------------------------------------------------------------
Ja Mitchell            10    8    0    1   0   3/5    60.0     0/0   0.0
Kawhi Irving           10    4    5    0   0   2/4    50.0     0/0   0.0
Shai Hyland            10    3    2    3   0   1/2    50.0     0/0   0.0
Russell Simons         10    2    3    0   0   1/1   100.0     0/0   0.0
Jordan Mitchell        10    2    0    1   0   1/2    50.0     0/0   0.0
Austin Smith            2    2    1    0   0   1/1   100.0     0/0   0.0
Devin Cunningham        2    0    1    0   0   0/0     0.0     0/0   0.0
CJ Haliburton           2    0    0    0   0   0/1     0.0     0/0   0.0
Tobias Herro            2    0    0    0   0   0/1     0.0     0/0   0.0
Ja Simmons              2    0    1    0   0   0/0     0.0     0/0   0.0

TEAM: FG: 9/17 (52.9%), 3PT: 4/8 (50.0%), REB: 13 (3 off, 10 def), AST: 5, TO: 5
TEAM FOULS: 7 [Team_084 in BONUS]


Team_084
--------------------------------------------------------------------------------
Player                MIN  PTS  REB  AST  TO      FG   FG%      3P   3P%
--------------------------------------------------------------------------------
Giannis Quickley       10    8    2    1   0   3/3   100.0     0/0   0.0
Dejounte Ginobili      10    6    6    0   0   3/5    60.0     0/0   0.0
Jarrett Booker         10    3    0    0   0   1/2    50.0     0/0   0.0
Dejounte Porzingis      2    2    0    0   0   1/2    50.0     0/0   0.0
Luka Sexton            10    0    0    1   0   0/2     0.0     0/0   0.0
Klay Thompson          10    0    2    0   0   0/2     0.0     0/0   0.0
Magic Bryant            2    0    0    1   0   0/0     0.0     0/0   0.0
Chris Parker            2    0    0    0   0   0/1     0.0     0/0   0.0
Evan Quickley           2    0    1    0   0   0/0     0.0     0/0   0.0
Pascal Jackson          2    0    1    0   0   0/1     0.0     0/0   0.0

TEAM: FG: 8/18 (44.4%), 3PT: 3/12 (25.0%), REB: 12 (4 off, 8 def), AST: 3, TO: 3
TEAM FOULS: 6 [Team_064 in BONUS]

================================================================================

================================================================================
                       2ND QUARTER - Team_064 vs Team_084                       
================================================================================

[12:00] Team_064 possession (Score: 21-19)
Ja Mitchell attempts a 3Pt. Contested by Luka Sexton (3.9 feet, MAN). Ja Mitchell misses. Rebound secured by Dejounte Ginobili.

[11:42] Team_084 possession (Score: 21-19)
Klay Thompson attempts a 3Pt. Contested by Kawhi Irving (4.9 feet, MAN). Klay Thompson misses. Rebound secured by Russell Simons.

[11:30] Team_064 possession (Score: 21-19)
Shai Hyland drives, picks up Giannis Quickley. Help arrives from Dejounte Ginobili! Shai Hyland attempts a Dunk. Contested by Dejounte Ginobili (4.9 feet, ZONE). SHAI HYLAND MAKES IT! Assist: Ja Mitchell
Score: 23-19

[11:13] Team_084 possession (Score: 23-19)
Jarrett Booker attempts a Midrange. Contested by Russell Simons (3.7 feet, MAN). Jarrett Booker misses. Rebound secured by Kawhi Irving.

[10:57] Team_064 possession (Score: 23-19)
Ja Mitchell drives, picks up Luka Sexton. Help arrives from Dejounte Ginobili! Ja Mitchell attempts a Dunk. Contested by Dejounte Ginobili (4.0 feet, MAN). JA MITCHELL MAKES IT!
Score: 25-19

[10:45] Team_084 possession (Score: 25-19)
Giannis Quickley attempts a Midrange. Contested by Shai Hyland (5.5 feet, MAN). Giannis Quickley misses. Rebound secured by Kawhi Irving.

[10:31] Team_064 possession (Score: 25-19)
Russell Simons makes the Layup and draws the foul on Giannis Quickley! And-1! Russell Simons to the line for 1. [Team fouls: 1] (Giannis Quickley: 1 personal fouls)   FT 1/1: GOOD Russell Simons makes 1/1 from the line.
Score: 28-19

[10:16] Team_084 possession (Score: 28-19)
Giannis Quickley attempts a Layup. Contested by Shai Hyland (5.5 feet, ZONE). GIANNIS QUICKLEY MAKES IT! Assist: Luka Sexton
Score: 28-21

[10:04] Team_064 possession (Score: 28-21)
Shai Hyland attempts a Midrange. Contested by Jarrett Booker (5.1 feet, ZONE). SHAI HYLAND MAKES IT! Assist: Kawhi Irving
Score: 30-21

[09:47] Team_084 possession (Score: 30-21)
Jarrett Booker drives to the basket... Jarrett Booker throws a bad pass! Stolen by Russell Simons! TURNOVER! (live ball)

[09:31] Team_064 possession (Score: 30-21)
Kawhi Irving attempts a Midrange. Contested by Dejounte Ginobili (4.7 feet, ZONE). KAWHI IRVING MAKES IT!
Score: 32-21

[09:15] Team_084 possession (Score: 32-21)
Jarrett Booker drives and kicks out. Giannis Quickley attempts a Midrange. Contested by Shai Hyland (5.4 feet, MAN). GIANNIS QUICKLEY MAKES IT!
Score: 32-23

[09:02] Team_064 possession (Score: 32-23)
Shai Hyland makes the Layup and draws the foul on Giannis Quickley! And-1! Shai Hyland to the line for 1. [Team fouls: 2] (Giannis Quickley: 2 personal fouls)   FT 1/1: GOOD Shai Hyland makes 1/1 from the line.
Score: 35-23

[08:45] Team_084 possession (Score: 35-23)
Dejounte Ginobili attempts a 3Pt. Contested by Ja Mitchell (5.7 feet, ZONE). Dejounte Ginobili misses. Rebound secured by Kawhi Irving.

[08:32] Team_064 possession (Score: 35-23)
Shai Hyland makes the Layup and draws the foul on Giannis Quickley! And-1! Shai Hyland to the line for 1. [Team fouls: 3] (Giannis Quickley: 3 personal fouls)   FT 1/1: MISS Shai Hyland makes 0/1 from the line. Rebound secured by Giannis Quickley.
Score: 37-23

[08:22] Team_084 possession (Score: 37-23)
FOUL! Shooting foul on Russell Simons. Klay Thompson to the line for 2 free throws. [Team fouls: 1] (Russell Simons: 1 personal fouls)   FT 1/2: GOOD   FT 2/2: GOOD Klay Thompson makes 2/2 from the line.
Score: 37-25

[08:09] Team_064 possession (Score: 37-25)
Russell Simons attempts a Layup. BLOCKED BY GIANNIS QUICKLEY! Ball is loose! Offensive rebound by Russell Simons! Russell Simons kicks it out.

[07:49] Team_064 possession (Score: 37-25)
Shai Hyland attempts a 3Pt. Contested by Giannis Quickley (5.2 feet, MAN). Shai Hyland misses. Rebound secured by Dejounte Ginobili.

[07:33] Team_084 possession (Score: 37-25)
Klay Thompson attempts a 3Pt. Contested by Jordan Mitchell (4.8 feet, ZONE). Klay Thompson misses. Rebound secured by Kawhi Irving.

[07:14] Team_064 possession (Score: 37-25)
Kawhi Irving drives, Giannis Quickley stays with him. Kawhi Irving attempts a Dunk. Contested by Giannis Quickley (4.9 feet, ZONE). Kawhi Irving misses. FOUL! Loose ball foul on Giannis Quickley during the rebound battle. [Team fouls: 4] No free throws, side out. (Giannis Quickley: 4 personal fouls)

[07:02] Team_064 possession (Score: 37-25)
Russell Simons attempts a Layup. Contested by Jarrett Booker (5.2 feet, MAN). Russell Simons misses. Rebound secured by Giannis Quickley.

[06:49] Team_084 possession (Score: 37-25)
Giannis Quickley attempts a Layup. Contested by Russell Simons (4.4 feet, ZONE). GIANNIS QUICKLEY MAKES IT! Assist: Luka Sexton
Score: 37-27

[06:38] Team_064 possession (Score: 37-27)
Shai Hyland attempts a Layup. BLOCKED BY DEJOUNTE GINOBILI! Ball deflects out of bounds off Shai Hyland.

[06:22] Team_084 possession (Score: 37-27)
Giannis Quickley makes the Layup and draws the foul on Russell Simons! And-1! Giannis Quickley to the line for 1. [Team fouls: 2] (Russell Simons: 2 personal fouls)   FT 1/1: GOOD Giannis Quickley makes 1/1 from the line.
Score: 37-30

[06:06] Team_064 possession (Score: 37-30)
Russell Simons attempts a 3Pt. Contested by Jarrett Booker (5.3 feet, ZONE). RUSSELL SIMONS MAKES IT! Assist: Ja Mitchell
Score: 40-30

[05:48] Team_084 possession (Score: 40-30)
Jarrett Booker drives to the basket... Jarrett Booker throws a bad pass! Stolen by Russell Simons! TURNOVER! (live ball)

[05:36] Team_064 possession (Score: 40-30)
Kawhi Irving attempts a 3Pt. Contested by Luka Sexton (4.3 feet, ZONE). Kawhi Irving misses. Rebound secured by Klay Thompson.

[05:19] Team_084 possession (Score: 40-30)
Klay Thompson attempts a Midrange. Contested by Jordan Mitchell (5.1 feet, ZONE). Klay Thompson misses. Rebound secured by Kawhi Irving.

[05:05] Team_064 possession (Score: 40-30)
Ja Mitchell attempts a 3Pt. Contested by Luka Sexton (4.6 feet, ZONE). Ja Mitchell misses. Rebound secured by Dejounte Ginobili.

[04:54] Team_084 possession (Score: 40-30)
Giannis Quickley attempts a Midrange. Wide open! Shai Hyland is 6.1 feet away. [MAN] GIANNIS QUICKLEY MAKES IT!
Score: 40-32

[04:38] Team_064 possession (Score: 40-32)
Kawhi Irving attempts a Midrange. Contested by Klay Thompson (5.6 feet, MAN). KAWHI IRVING MAKES IT!
Score: 42-32

[04:27] Team_084 possession (Score: 42-32)
Dejounte Ginobili attempts a 3Pt. Wide open! Ja Mitchell is 6.2 feet away. [ZONE] DEJOUNTE GINOBILI MAKES IT! Assist: Luka Sexton
Score: 42-35

[04:14] Team_064 possession (Score: 42-35)
Russell Simons drives to the basket... FOUL! Offensive foul on Russell Simons! Jarrett Booker drew the charge! [Team fouls: 3] (Russell Simons: 3 personal fouls) TURNOVER! (dead ball)

[04:00] Team_084 possession (Score: 42-35)
Klay Thompson drives to the basket... Klay Thompson loses control! Ball rolls out of bounds! TURNOVER! (dead ball)

[04:00] Substitution (Team_064): Ja Mitchell OUT → CJ Haliburton IN (stamina_rule2)

[04:00] Substitution (Team_064): Jordan Mitchell OUT → Ja Simmons IN (stamina_rule2)

[04:00] Substitution (Team_064): Kawhi Irving OUT → Tobias Herro IN (stamina_rule2)

[04:00] Substitution (Team_064): Russell Simons OUT → Austin Smith IN (stamina_rule2)

[04:00] Substitution (Team_064): Shai Hyland OUT → Devin Cunningham IN (stamina_rule2)

[04:00] Substitution (Team_084): Luka Sexton OUT → Magic Bryant IN (stamina_rule2)

[04:00] Substitution (Team_084): Dejounte Ginobili OUT → Chris Parker IN (stamina_rule2)

[04:00] Substitution (Team_084): Klay Thompson OUT → Evan Quickley IN (stamina_rule2)

[04:00] Substitution (Team_084): Jarrett Booker OUT → Pascal Jackson IN (stamina_rule2)

[04:00] Substitution (Team_084): Giannis Quickley OUT → Dejounte Porzingis IN (stamina_rule2)

[03:48] Team_064 possession (Score: 42-35)
Tobias Herro drives, Dejounte Porzingis stays with him. Tobias Herro attempts a Dunk. Contested by Dejounte Porzingis (4.5 feet, ZONE). TOBIAS HERRO MAKES IT!
Score: 44-35

[03:37] Team_084 possession (Score: 44-35)
Magic Bryant attempts a 3Pt. Wide open! CJ Haliburton is 6.0 feet away. [MAN] MAGIC BRYANT MAKES IT! Assist: Evan Quickley
Score: 44-38

[03:23] Team_064 possession (Score: 44-38)
Devin Cunningham attempts a Layup. Contested by Dejounte Porzingis (4.8 feet, MAN). Devin Cunningham misses. Rebound secured by Evan Quickley.

[03:06] Team_084 possession (Score: 44-38)
Evan Quickley attempts a 3Pt. Contested by Tobias Herro (5.9 feet, MAN). Evan Quickley misses. Rebound secured by Devin Cunningham.

[02:51] Team_064 possession (Score: 44-38)
Austin Smith attempts a Midrange. Contested by Pascal Jackson (4.3 feet, ZONE). AUSTIN SMITH MAKES IT!
Score: 46-38

[02:38] Team_084 possession (Score: 46-38)
Chris Parker attempts a 3Pt. Contested by Ja Simmons (5.7 feet, MAN). CHRIS PARKER MAKES IT! Assist: Dejounte Porzingis
Score: 46-41

[02:22] Team_064 possession (Score: 46-41)
Tobias Herro attempts a 3Pt. Contested by Chris Parker (4.0 feet, ZONE). Tobias Herro misses. Rebound secured by Dejounte Porzingis.

[02:10] Team_084 possession (Score: 46-41)
Pascal Jackson attempts a 3Pt. Contested by Austin Smith (4.7 feet, ZONE). Pascal Jackson misses. Rebound secured by Ja Simmons.

[01:58] Team_064 possession (Score: 46-41)
Ja Simmons attempts a 3Pt. Contested by Magic Bryant (3.5 feet, ZONE). Ja Simmons misses. Rebound secured by Evan Quickley.

[01:43] Team_084 possession (Score: 46-41)
Dejounte Porzingis drives and kicks out. Evan Quickley attempts a Midrange. Wide open! Tobias Herro is 6.0 feet away. [MAN] Evan Quickley misses. Rebound secured by Ja Simmons.

[01:26] Team_064 possession (Score: 46-41)
Tobias Herro throws a bad pass! Stolen by Evan Quickley! TURNOVER! (live ball)

[01:12] Team_084 possession (Score: 46-41)
Chris Parker drives, Ja Simmons stays with him. Chris Parker attempts a Dunk. Contested by Ja Simmons (5.7 feet, MAN). CHRIS PARKER MAKES IT! Assist: Evan Quickley
Score: 46-43

[01:00] Team_064 possession (Score: 46-43)
Devin Cunningham drives, Dejounte Porzingis stays with him. Devin Cunningham attempts a Dunk. Contested by Dejounte Porzingis (4.8 feet, MAN). DEVIN CUNNINGHAM MAKES IT! Assist: CJ Haliburton
Score: 48-43

[00:45] Team_084 possession (Score: 48-43)
Chris Parker attempts a Midrange. Contested by Ja Simmons (5.7 feet, MAN). CHRIS PARKER MAKES IT!
Score: 48-45

[00:28] Team_064 possession (Score: 48-45)
Austin Smith attempts a 3Pt. Contested by Magic Bryant (3.3 feet, ZONE). Austin Smith misses. Rebound secured by Pascal Jackson.

[00:15] Team_084 possession (Score: 48-45)
Dejounte Porzingis attempts a 3Pt. Wide open! Tobias Herro is 6.1 feet away. [ZONE] Dejounte Porzingis misses. Rebound secured by Devin Cunningham.

[00:02] Team_064 possession (Score: 48-45)
CJ Haliburton attempts a 3Pt. Contested by Magic Bryant (4.0 feet, ZONE). CJ Haliburton misses. Rebound secured by Dejounte Porzingis.

================================================================================
                              2ND QUARTER COMPLETE                              
================================================================================

2ND QUARTER SCORE: Team_064 27, Team_084 26

BOX SCORE:
================================================================================

Team_064
--------------------------------------------------------------------------------
Player                MIN  PTS  REB  AST  TO      FG   FG%      3P   3P%
--------------------------------------------------------------------------------
Shai Hyland            18    7    0    0   0   3/6    50.0     0/0   0.0
Russell Simons         18    6    2    0   0   2/3    66.7     0/0   0.0
Kawhi Irving           18    4    6    1   0   2/3    66.7     0/0   0.0
Ja Mitchell            18    2    0    2   0   1/3    33.3     0/0   0.0
Tobias Herro            6    2    0    0   0   1/2    50.0     0/0   0.0
Devin Cunningham        6    2    2    0   0   1/2    50.0     0/0   0.0
Austin Smith            6    2    0    0   0   1/2    50.0     0/0   0.0
Ja Simmons              6    0    2    0   0   0/1     0.0     0/0   0.0
CJ Haliburton           6    0    0    1   0   0/1     0.0     0/0   0.0

TEAM: FG: 11/23 (47.8%), 3PT: 1/9 (11.1%), REB: 12 (2 off, 10 def), AST: 4, TO: 2
TEAM FOULS: 3


Team_084
--------------------------------------------------------------------------------
Player                MIN  PTS  REB  AST  TO      FG   FG%      3P   3P%
--------------------------------------------------------------------------------
Giannis Quickley       18   11    2    0   0   5/6    83.3     0/0   0.0
Chris Parker            6    7    0    0   0   3/3   100.0     0/0   0.0
Dejounte Ginobili      18    3    3    0   0   1/2    50.0     0/0   0.0
Magic Bryant            6    3    0    0   0   1/1   100.0     0/0   0.0
Klay Thompson          18    2    1    0   0   1/4    25.0     0/0   0.0
Jarrett Booker         18    0    0    0   0   0/1     0.0     0/0   0.0
Luka Sexton            18    0    0    3   0   0/0     0.0     0/0   0.0
Evan Quickley           6    0    2    2   0   0/1     0.0     0/0   0.0
Dejounte Porzingis      6    0    2    1   0   0/2     0.0     0/0   0.0
Pascal Jackson          6    0    1    0   0   0/1     0.0     0/0   0.0

TEAM: FG: 11/21 (52.4%), 3PT: 3/9 (33.3%), REB: 11 (0 off, 11 def), AST: 6, TO: 3
TEAM FOULS: 4

================================================================================

================================================================================
                       3RD QUARTER - Team_064 vs Team_084                       
================================================================================

[12:00] Team_064 possession (Score: 48-45)
Kawhi Irving attempts a 3Pt. Contested by Klay Thompson (4.7 feet, MAN). Kawhi Irving misses. Rebound secured by Klay Thompson.

[11:47] Team_084 possession (Score: 48-45)
Dejounte Ginobili attempts a Layup. BLOCKED BY JORDAN MITCHELL! Ball deflects out of bounds off Dejounte Ginobili.

[11:33] Team_064 possession (Score: 48-45)
Russell Simons drives to the basket... Russell Simons loses the ball! Stripped by Jarrett Booker! TURNOVER! (live ball)

[11:22] Team_084 possession (Score: 48-45)
Klay Thompson drives, Russell Simons stays with him. Klay Thompson attempts a Dunk. Contested by Russell Simons (3.7 feet, ZONE). Klay Thompson misses. Rebound secured by Russell Simons.

[11:07] Team_064 possession (Score: 48-45)
Russell Simons drives, Jarrett Booker stays with him. Russell Simons attempts a Layup. Contested by Jarrett Booker (4.7 feet, ZONE). Russell Simons misses. Rebound secured by Giannis Quickley.

[10:54] Team_084 possession (Score: 48-45)
Jarrett Booker attempts a Layup. Contested by Russell Simons (3.5 feet, MAN). Jarrett Booker misses. Rebound secured by Shai Hyland.

[10:35] Team_064 possession (Score: 48-45)
Shai Hyland drives, picks up Giannis Quickley. Help arrives from Dejounte Ginobili! Shai Hyland attempts a Layup. Contested by Dejounte Ginobili (4.7 feet, MAN). SHAI HYLAND MAKES IT! Assist: Ja Mitchell
Score: 50-45

[10:20] Team_084 possession (Score: 50-45)
Klay Thompson attempts a 3Pt. Contested by Kawhi Irving (4.8 feet, MAN). Klay Thompson misses. Rebound secured by Russell Simons.

[10:04] Team_064 possession (Score: 50-45)
Russell Simons drives, Jarrett Booker stays with him. Russell Simons attempts a Dunk. Contested by Jarrett Booker (4.7 feet, MAN). RUSSELL SIMONS MAKES IT! Assist: Jordan Mitchell
Score: 52-45

[09:50] Team_084 possession (Score: 52-45)
Jarrett Booker attempts a 3Pt. Contested by Ja Mitchell (5.4 feet, ZONE). Jarrett Booker misses. Rebound secured by Shai Hyland.

[09:40] Team_064 possession (Score: 52-45)
Jordan Mitchell attempts a 3Pt. Contested by Luka Sexton (3.2 feet, ZONE). Jordan Mitchell misses. Rebound secured by Giannis Quickley.

[09:24] Team_084 possession (Score: 52-45)
FOUL! Reach-in foul on Ja Mitchell during the drive. [Team fouls: 1] No free throws, side out. (Ja Mitchell: 1 personal fouls)

[09:09] Team_084 possession (Score: 52-45)
Jarrett Booker attempts a Midrange. Contested by Kawhi Irving (4.6 feet, ZONE). Jarrett Booker misses. Rebound secured by Russell Simons.

[08:59] Team_064 possession (Score: 52-45)
Shai Hyland drives and kicks out. Ja Mitchell attempts a 3Pt. Contested by Luka Sexton (3.6 feet, MAN). Ja Mitchell misses. Offensive rebound by Kawhi Irving! Kawhi Irving kicks it out.

[08:44] Team_064 possession (Score: 52-45)
FOUL! Offensive foul on Jordan Mitchell! Dejounte Ginobili drew the charge! [Team fouls: 2] (Jordan Mitchell: 1 personal fouls) TURNOVER! (dead ball)

[08:31] Team_084 possession (Score: 52-45)
Jarrett Booker attempts a Midrange. Contested by Russell Simons (3.5 feet, MAN). Jarrett Booker misses. Rebound secured by Shai Hyland.

[08:21] Team_064 possession (Score: 52-45)
Jordan Mitchell drives to the basket... Jordan Mitchell commits a violation (traveling/carry)! TURNOVER! (dead ball)

[08:07] Team_084 possession (Score: 52-45)
Luka Sexton attempts a 3Pt. Contested by Ja Mitchell (5.5 feet, MAN). LUKA SEXTON MAKES IT! Assist: Giannis Quickley
Score: 52-48

[07:52] Team_064 possession (Score: 52-48)
Jordan Mitchell attempts a 3Pt. Contested by Dejounte Ginobili (4.1 feet, MAN). JORDAN MITCHELL MAKES IT! Assist: Kawhi Irving
Score: 55-48

[07:33] Team_084 possession (Score: 55-48)
Jarrett Booker attempts a Layup. BLOCKED BY JORDAN MITCHELL! Ball is loose! Rebound secured by Russell Simons.

[07:18] Team_064 possession (Score: 55-48)
Shai Hyland attempts a 3Pt. Contested by Giannis Quickley (4.7 feet, MAN). SHAI HYLAND MAKES IT!
Score: 58-48

[07:02] Team_084 possession (Score: 58-48)
Giannis Quickley attempts a 3Pt. Contested by Russell Simons (3.5 feet, ZONE). Giannis Quickley misses. Rebound secured by Shai Hyland.

[06:45] Team_064 possession (Score: 58-48)
Kawhi Irving attempts a Layup. Contested by Giannis Quickley (4.3 feet, ZONE). KAWHI IRVING MAKES IT! Assist: Ja Mitchell
Score: 60-48

[06:31] Team_084 possession (Score: 60-48)
Dejounte Ginobili drives to the basket... Dejounte Ginobili loses the ball! Stripped by Russell Simons! TURNOVER! (live ball)

[06:19] Team_064 possession (Score: 60-48)
Kawhi Irving drives to the basket... Kawhi Irving loses the ball! Stripped by Giannis Quickley! TURNOVER! (live ball)

[06:04] Team_084 possession (Score: 60-48)
Giannis Quickley attempts a Layup. Contested by Shai Hyland (5.3 feet, ZONE). GIANNIS QUICKLEY MAKES IT! Assist: Dejounte Ginobili
Score: 60-50

[05:51] Team_064 possession (Score: 60-50)
Kawhi Irving drives to the basket... Kawhi Irving throws a bad pass out of bounds! TURNOVER! (dead ball)

[05:37] Team_084 possession (Score: 60-50)
Giannis Quickley drives and kicks out. Jarrett Booker attempts a Midrange. Contested by Jordan Mitchell (3.8 feet, ZONE). JARRETT BOOKER MAKES IT!
Score: 60-52

[05:21] Team_064 possession (Score: 60-52)
FOUL! Reach-in foul on Giannis Quickley during the drive. [Team fouls: 1] No free throws, side out. (Giannis Quickley: 1 personal fouls)

[05:07] Team_064 possession (Score: 60-52)
Ja Mitchell throws a bad pass! Stolen by Luka Sexton! TURNOVER! (live ball)

[04:55] Team_084 possession (Score: 60-52)
Luka Sexton drives and kicks out. Jarrett Booker attempts a 3Pt. Contested by Russell Simons (3.3 feet, MAN). Jarrett Booker misses. Rebound secured by Shai Hyland.

[04:37] Team_064 possession (Score: 60-52)
Russell Simons drives and kicks out. Kawhi Irving attempts a 3Pt. Contested by Klay Thompson (4.9 feet, MAN). Kawhi Irving misses. Offensive rebound by Kawhi Irving! Kawhi Irving kicks it out.

[04:23] Team_064 possession (Score: 60-52)
Ja Mitchell drives, picks up Giannis Quickley. Help arrives from Dejounte Ginobili! Ja Mitchell attempts a Dunk. Contested by Dejounte Ginobili (4.8 feet, ZONE). Ja Mitchell misses. Rebound secured by Dejounte Ginobili.

[04:09] Team_084 possession (Score: 60-52)
Jarrett Booker attempts a 3Pt. Contested by Kawhi Irving (4.6 feet, ZONE). Jarrett Booker misses. Rebound secured by Russell Simons.

[03:55] Team_064 possession (Score: 60-52)
Ja Mitchell attempts a 3Pt. Contested by Luka Sexton (4.0 feet, MAN). Ja Mitchell misses. Rebound secured by Giannis Quickley.

[03:38] Team_084 possession (Score: 60-52)
Klay Thompson attempts a Layup. BLOCKED BY KAWHI IRVING! Ball is loose! Rebound secured by Russell Simons.

[03:27] Team_064 possession (Score: 60-52)
Ja Mitchell attempts a 3Pt. Contested by Luka Sexton (4.0 feet, ZONE). Ja Mitchell misses. Rebound secured by Dejounte Ginobili.

[03:08] Team_084 possession (Score: 60-52)
Jarrett Booker attempts a Midrange. Contested by Kawhi Irving (4.7 feet, ZONE). Jarrett Booker misses. Rebound secured by Kawhi Irving.

[02:54] Team_064 possession (Score: 60-52)
Russell Simons attempts a Layup. Contested by Jarrett Booker (4.9 feet, MAN). RUSSELL SIMONS MAKES IT!
Score: 62-52

[02:42] Team_084 possession (Score: 62-52)
Dejounte Ginobili attempts a 3Pt. Contested by Ja Mitchell (5.6 feet, ZONE). Dejounte Ginobili misses. Offensive rebound by Dejounte Ginobili! Dejounte Ginobili kicks it out.

[02:25] Team_084 possession (Score: 62-52)
Dejounte Ginobili attempts a Midrange. Contested by Shai Hyland (5.5 feet, ZONE). Dejounte Ginobili misses. Offensive rebound by Giannis Quickley! Giannis Quickley puts it back in!
Score: 62-54

[02:11] Team_064 possession (Score: 62-54)
Jordan Mitchell drives, Dejounte Ginobili stays with him. Jordan Mitchell attempts a Layup. Contested by Dejounte Ginobili (4.4 feet, MAN). Jordan Mitchell misses. Rebound secured by Dejounte Ginobili.

[01:56] Team_084 possession (Score: 62-54)
Luka Sexton throws a bad pass! Stolen by Ja Mitchell! TURNOVER! (live ball)

[01:38] Team_064 possession (Score: 62-54)
Jordan Mitchell attempts a 3Pt. Contested by Luka Sexton (3.5 feet, ZONE). Jordan Mitchell misses. Rebound secured by Dejounte Ginobili.

[01:19] Team_084 possession (Score: 62-54)
FOUL! Shooting foul on Russell Simons. Luka Sexton to the line for 2 free throws. [Team fouls: 3] (Russell Simons: 1 personal fouls)   FT 1/2: GOOD   FT 2/2: MISS Luka Sexton makes 1/2 from the line. Rebound secured by Kawhi Irving.
Score: 62-55

[01:06] Team_064 possession (Score: 62-55)
Ja Mitchell drives and kicks out. Russell Simons attempts a Midrange. Contested by Jarrett Booker (5.0 feet, MAN). Russell Simons misses. Rebound secured by Dejounte Ginobili.

[00:52] Team_084 possession (Score: 62-55)
Jarrett Booker makes the Layup and draws the foul on Russell Simons! And-1! Jarrett Booker to the line for 1. [Team fouls: 4] (Russell Simons: 2 personal fouls)   FT 1/1: GOOD Jarrett Booker makes 1/1 from the line.
Score: 62-58

[00:34] Team_064 possession (Score: 62-58)
Russell Simons attempts a Midrange. Contested by Giannis Quickley (5.0 feet, ZONE). Russell Simons misses. Rebound secured by Giannis Quickley.

[00:19] Team_084 possession (Score: 62-58)
Klay Thompson attempts a 3Pt. Wide open! Ja Mitchell is 6.0 feet away. [ZONE] Klay Thompson misses. Rebound secured by Kawhi Irving.

[00:08] Team_064 possession (Score: 62-58)
Shai Hyland drives and kicks out. Jordan Mitchell attempts a 3Pt. Contested by Dejounte Ginobili (5.1 feet, MAN). Jordan Mitchell misses. Offensive rebound by Russell Simons! Russell Simons kicks it out.

================================================================================
                              3RD QUARTER COMPLETE                              
================================================================================

3RD QUARTER SCORE: Team_064 14, Team_084 13

BOX SCORE:
================================================================================

Team_064
--------------------------------------------------------------------------------
Player                MIN  PTS  REB  AST  TO      FG   FG%      3P   3P%
--------------------------------------------------------------------------------
Shai Hyland            31    5    5    0   0   2/2   100.0     0/0   0.0
Russell Simons         31    4    7    0   0   2/4    50.0     0/0   0.0
Jordan Mitchell        31    3    0    1   0   1/4    25.0     0/0   0.0
Kawhi Irving           31    2    5    1   0   1/2    50.0     0/0   0.0
Ja Mitchell            31    0    0    2   0   0/4     0.0     0/0   0.0

TEAM: FG: 6/16 (37.5%), 3PT: 2/7 (28.6%), REB: 17 (3 off, 14 def), AST: 4, TO: 6
TEAM FOULS: 4


Team_084
--------------------------------------------------------------------------------
Player                MIN  PTS  REB  AST  TO      FG   FG%      3P   3P%
--------------------------------------------------------------------------------
Jarrett Booker         31    5    0    0   0   2/9    22.2     0/0   0.0
Giannis Quickley       31    4    5    1   0   2/3    66.7     0/0   0.0
Luka Sexton            31    3    0    0   0   1/3    33.3     0/0   0.0
Klay Thompson          31    0    1    0   0   0/4     0.0     0/0   0.0
Dejounte Ginobili      31    0    6    1   0   0/1     0.0     0/0   0.0

TEAM: FG: 5/20 (25.0%), 3PT: 1/6 (16.7%), REB: 12 (2 off, 10 def), AST: 2, TO: 2
TEAM FOULS: 1

================================================================================

================================================================================
                       4TH QUARTER - Team_064 vs Team_084                       
================================================================================

[12:00] Team_064 possession (Score: 62-58)
Kawhi Irving attempts a Midrange. Contested by Klay Thompson (5.0 feet, MAN). Kawhi Irving misses. FOUL! Loose ball foul on Dejounte Ginobili during the rebound battle. [Team fouls: 1] No free throws, side out. (Dejounte Ginobili: 1 personal fouls)

[11:49] Team_064 possession (Score: 62-58)
Ja Mitchell attempts a Layup. Contested by Giannis Quickley (5.0 feet, ZONE). JA MITCHELL MAKES IT! Assist: Kawhi Irving
Score: 64-58

[11:33] Team_084 possession (Score: 64-58)
Luka Sexton attempts a 3Pt. Contested by Ja Mitchell (5.8 feet, MAN). Luka Sexton misses. Rebound secured by Russell Simons.

[11:22] Team_064 possession (Score: 64-58)
Russell Simons attempts a 3Pt. Contested by Jarrett Booker (5.0 feet, MAN). Russell Simons misses. Rebound secured by Giannis Quickley.

[11:07] Team_084 possession (Score: 64-58)
Dejounte Ginobili attempts a 3Pt. Contested by Jordan Mitchell (4.5 feet, MAN). Dejounte Ginobili misses. Rebound secured by Russell Simons.

[10:48] Team_064 possession (Score: 64-58)
Kawhi Irving attempts a 3Pt. Contested by Dejounte Ginobili (4.8 feet, ZONE). KAWHI IRVING MAKES IT! Assist: Jordan Mitchell
Score: 67-58

[10:34] Team_084 possession (Score: 67-58)
Luka Sexton attempts a 3Pt. Contested by Ja Mitchell (5.9 feet, ZONE). LUKA SEXTON MAKES IT! Assist: Jarrett Booker
Score: 67-61

[10:21] Team_064 possession (Score: 67-61)
Shai Hyland attempts a 3Pt. Contested by Giannis Quickley (5.2 feet, MAN). Shai Hyland misses. Rebound secured by Dejounte Ginobili.

[10:12] Team_084 possession (Score: 67-61)
Luka Sexton attempts a 3Pt. Contested by Ja Mitchell (5.9 feet, ZONE). Luka Sexton misses. Rebound secured by Kawhi Irving.

[09:57] Team_064 possession (Score: 67-61)
Kawhi Irving attempts a 3Pt. Contested by Klay Thompson (5.3 feet, MAN). Kawhi Irving misses. Rebound secured by Klay Thompson.

[09:42] Team_084 possession (Score: 67-61)
Dejounte Ginobili loses the ball! Stripped by Jordan Mitchell! TURNOVER! (live ball)

[09:30] Team_064 possession (Score: 67-61)
Russell Simons drives and kicks out. Russell Simons attempts a 3Pt. Contested by Luka Sexton (4.3 feet, ZONE). Russell Simons misses. Offensive rebound by Kawhi Irving! Kawhi Irving kicks it out.

[09:17] Team_064 possession (Score: 67-61)
Russell Simons throws a bad pass out of bounds! TURNOVER! (dead ball)

[09:17] Substitution (Team_064): Ja Mitchell OUT → CJ Haliburton IN (stamina_rule2)

[09:17] Substitution (Team_064): Jordan Mitchell OUT → Ja Simmons IN (stamina_rule2)

[09:17] Substitution (Team_064): Kawhi Irving OUT → Tobias Herro IN (stamina_rule2)

[09:17] Substitution (Team_064): Russell Simons OUT → Austin Smith IN (stamina_rule2)

[09:17] Substitution (Team_064): Shai Hyland OUT → Devin Cunningham IN (stamina_rule2)

[09:17] Substitution (Team_084): Luka Sexton OUT → Magic Bryant IN (stamina_rule2)

[09:17] Substitution (Team_084): Dejounte Ginobili OUT → Chris Parker IN (stamina_rule2)

[09:17] Substitution (Team_084): Klay Thompson OUT → Evan Quickley IN (stamina_rule2)

[09:17] Substitution (Team_084): Jarrett Booker OUT → Pascal Jackson IN (stamina_rule2)

[09:17] Substitution (Team_084): Giannis Quickley OUT → Dejounte Porzingis IN (stamina_rule2)

[09:04] Team_084 possession (Score: 67-61)
FOUL! Reach-in foul on Ja Simmons during the drive. [Team fouls: 1] No free throws, side out. (Ja Simmons: 1 personal fouls)

[08:48] Team_084 possession (Score: 67-61)
FOUL! Shooting foul on Ja Simmons. Chris Parker to the line for 2 free throws. [Team fouls: 2] (Ja Simmons: 2 personal fouls)   FT 1/2: GOOD   FT 2/2: GOOD Chris Parker makes 2/2 from the line.
Score: 67-63

[08:30] Team_064 possession (Score: 67-63)
Ja Simmons attempts a Midrange. Contested by Chris Parker (4.4 feet, MAN). Ja Simmons misses. Rebound secured by Evan Quickley.

[08:17] Team_084 possession (Score: 67-63)
FOUL! Shooting foul on Austin Smith. Pascal Jackson to the line for 2 free throws. [Team fouls: 3] (Austin Smith: 1 personal fouls)   FT 1/2: GOOD   FT 2/2: GOOD Pascal Jackson makes 2/2 from the line.
Score: 67-65

[08:00] Team_064 possession (Score: 67-65)
Austin Smith drives and kicks out. Devin Cunningham attempts a 3Pt. Contested by Dejounte Porzingis (5.0 feet, MAN). Devin Cunningham misses. Offensive rebound by Ja Simmons! Ja Simmons kicks it out.

[07:46] Team_064 possession (Score: 67-65)
Devin Cunningham attempts a 3Pt. Contested by Magic Bryant (3.5 feet, ZONE). DEVIN CUNNINGHAM MAKES IT! Assist: Tobias Herro
Score: 70-65

[07:28] Team_084 possession (Score: 70-65)
Chris Parker attempts a Midrange. Contested by Ja Simmons (5.7 feet, MAN). Chris Parker misses. Rebound secured by Ja Simmons.

[07:14] Team_064 possession (Score: 70-65)
Ja Simmons attempts a 3Pt. Contested by Chris Parker (4.4 feet, MAN). Ja Simmons misses. Rebound secured by Pascal Jackson.

[06:58] Team_084 possession (Score: 70-65)
FOUL! Reach-in foul on Devin Cunningham during the drive. [Team fouls: 4] No free throws, side out. (Devin Cunningham: 1 personal fouls)

[06:43] Team_084 possession (Score: 70-65)
Dejounte Porzingis drives, Devin Cunningham stays with him. Dejounte Porzingis attempts a Dunk. Contested by Devin Cunningham (5.3 feet, MAN). Dejounte Porzingis misses. Rebound secured by Ja Simmons.

[06:29] Team_064 possession (Score: 70-65)
Ja Simmons attempts a Layup. Contested by Dejounte Porzingis (4.8 feet, ZONE). Ja Simmons misses. Rebound secured by Pascal Jackson.

[06:18] Team_084 possession (Score: 70-65)
Evan Quickley attempts a 3Pt. Contested by Tobias Herro (5.9 feet, MAN). Evan Quickley misses. Rebound secured by Devin Cunningham.

[06:07] Team_064 possession (Score: 70-65)
Tobias Herro attempts a 3Pt. Contested by Magic Bryant (3.2 feet, ZONE). TOBIAS HERRO MAKES IT! Assist: Austin Smith
Score: 73-65

[05:50] Team_084 possession (Score: 73-65)
Chris Parker loses the ball! Stripped by Ja Simmons! TURNOVER! (live ball)

[05:32] Team_064 possession (Score: 73-65)
Devin Cunningham drives, Dejounte Porzingis stays with him. Devin Cunningham attempts a Dunk. Contested by Dejounte Porzingis (4.8 feet, MAN). DEVIN CUNNINGHAM MAKES IT!
Score: 75-65

[05:17] Team_084 possession (Score: 75-65)
FOUL! Offensive foul on Dejounte Porzingis! Devin Cunningham drew the charge! [Team fouls: 2] (Dejounte Porzingis: 1 personal fouls) TURNOVER! (dead ball)

[04:59] Team_064 possession (Score: 75-65)
Devin Cunningham attempts a Midrange. Contested by Dejounte Porzingis (4.8 feet, MAN). DEVIN CUNNINGHAM MAKES IT!
Score: 77-65

[04:42] Team_084 possession (Score: 77-65)
Pascal Jackson attempts a Midrange. Contested by Austin Smith (4.7 feet, MAN). Pascal Jackson misses. Rebound secured by Austin Smith.

[04:25] Team_064 possession (Score: 77-65)
Ja Simmons makes the Layup and draws the foul on Pascal Jackson! And-1! Ja Simmons to the line for 1. [Team fouls: 3] (Pascal Jackson: 1 personal fouls)   FT 1/1: GOOD Ja Simmons makes 1/1 from the line.
Score: 80-65

[04:12] Team_084 possession (Score: 80-65)
Dejounte Porzingis makes the Dunk and draws the foul on Devin Cunningham! And-1! Dejounte Porzingis to the line for 1. [BONUS: 5 team fouls] (Devin Cunningham: 2 personal fouls)   FT 1/1: GOOD Dejounte Porzingis makes 1/1 from the line.
Score: 80-68

[04:00] Team_064 possession (Score: 80-68)
Devin Cunningham attempts a Layup. Contested by Dejounte Porzingis (4.8 feet, MAN). Devin Cunningham misses. Rebound secured by Pascal Jackson.

[03:42] Team_084 possession (Score: 80-68)
Evan Quickley attempts a Midrange. Contested by Tobias Herro (5.9 feet, MAN). Evan Quickley misses. Rebound secured by Devin Cunningham.

[03:28] Team_064 possession (Score: 80-68)
FOUL! Offensive foul on CJ Haliburton! Magic Bryant drew the charge! [Team fouls: 6] (CJ Haliburton: 1 personal fouls) TURNOVER! (dead ball)

[03:15] Team_084 possession (Score: 80-68)
Chris Parker attempts a 3Pt. Contested by Austin Smith (4.7 feet, ZONE). CHRIS PARKER MAKES IT! Assist: Pascal Jackson
Score: 80-71

[03:03] Team_064 possession (Score: 80-71)
FOUL! Shooting foul on Chris Parker. Devin Cunningham to the line for 2 free throws. [Team fouls: 4] (Chris Parker: 1 personal fouls)   FT 1/2: MISS   FT 2/2: GOOD Devin Cunningham makes 1/2 from the line.
Score: 81-71

[02:51] Team_084 possession (Score: 81-71)
FOUL! Shooting foul on Ja Simmons. Chris Parker to the line for 2 free throws. [BONUS: 7 team fouls] (Ja Simmons: 3 personal fouls)   FT 1/2: GOOD   FT 2/2: MISS Chris Parker makes 1/2 from the line. Rebound secured by Austin Smith.
Score: 81-72

[02:35] Team_064 possession (Score: 81-72)
Tobias Herro drives to the basket... Tobias Herro loses control! Ball rolls out of bounds! TURNOVER! (dead ball)

[02:23] Team_084 possession (Score: 81-72)
Evan Quickley makes the Layup and draws the foul on Ja Simmons! And-1! Evan Quickley to the line for 1. [BONUS: 8 team fouls] (Ja Simmons: 4 personal fouls)   FT 1/1: MISS Evan Quickley makes 0/1 from the line. Offensive rebound by Dejounte Porzingis! Dejounte Porzingis kicks it out.
Score: 81-74

[02:09] Team_084 possession (Score: 81-74)
Magic Bryant attempts a 3Pt. Contested by Austin Smith (4.6 feet, ZONE). MAGIC BRYANT MAKES IT! Assist: Evan Quickley
Score: 81-77

[01:51] Team_064 possession (Score: 81-77)
FOUL! Holding foul on Magic Bryant. [IN THE BONUS! 5 team fouls] CJ Haliburton to the line for 2 free throws. (Magic Bryant: 1 personal fouls)   FT 1/2: MISS   FT 2/2: GOOD CJ Haliburton makes 1/2 from the line.
Score: 82-77

[01:34] Team_084 possession (Score: 82-77)
Evan Quickley attempts a 3Pt. Contested by Ja Simmons (5.6 feet, ZONE). Evan Quickley misses. Rebound secured by Austin Smith.

[01:19] Team_064 possession (Score: 82-77)
Ja Simmons drives and kicks out. Tobias Herro attempts a 3Pt. Contested by Magic Bryant (3.8 feet, ZONE). Tobias Herro misses. Rebound secured by Evan Quickley.

[01:03] Team_084 possession (Score: 82-77)
Dejounte Porzingis drives and kicks out. Chris Parker attempts a Midrange. Contested by Ja Simmons (5.7 feet, MAN). Chris Parker misses. Offensive rebound by Pascal Jackson! Pascal Jackson kicks it out.

[00:44] Team_084 possession (Score: 82-77)
Dejounte Porzingis attempts a Midrange. Contested by Devin Cunningham (5.4 feet, MAN). DEJOUNTE PORZINGIS MAKES IT! Assist: Magic Bryant
Score: 82-79

[00:31] Team_064 possession (Score: 82-79)
Tobias Herro attempts a Midrange. Contested by Chris Parker (4.2 feet, ZONE). Tobias Herro misses. Offensive rebound by Ja Simmons! Ja Simmons kicks it out.

[00:13] Team_064 possession (Score: 82-79)
Tobias Herro attempts a Layup. Contested by Dejounte Porzingis (4.7 feet, ZONE). TOBIAS HERRO MAKES IT!
Score: 84-79

[00:01] Team_084 possession (Score: 84-79)
FOUL! Holding foul on Ja Simmons. [IN THE BONUS! 9 team fouls] Chris Parker to the line for 2 free throws. (Ja Simmons: 5 personal fouls)   FT 1/2: GOOD   FT 2/2: GOOD Chris Parker makes 2/2 from the line.
Score: 84-81

================================================================================
                              4TH QUARTER COMPLETE                              
================================================================================

4TH QUARTER SCORE: Team_064 22, Team_084 23

BOX SCORE:
================================================================================

Team_064
--------------------------------------------------------------------------------
Player                MIN  PTS  REB  AST  TO      FG   FG%      3P   3P%
--------------------------------------------------------------------------------
Devin Cunningham       15    8    2    0   0   4/5    80.0     0/0   0.0
Tobias Herro           15    5    0    1   0   2/2   100.0     0/0   0.0
Kawhi Irving           34    3    2    1   0   1/2    50.0     0/0   0.0
Ja Simmons             15    3    4    0   0   1/5    20.0     0/0   0.0
Ja Mitchell            34    2    0    0   0   1/1   100.0     0/0   0.0
CJ Haliburton          15    1    0    0   0   1/1   100.0     0/0   0.0
Russell Simons         34    0    3    0   0   0/1     0.0     0/0   0.0
Jordan Mitchell        34    0    0    1   0   0/0     0.0     0/0   0.0
Shai Hyland            34    0    0    0   0   0/1     0.0     0/0   0.0
Austin Smith           15    0    3    1   0   0/0     0.0     0/0   0.0

TEAM: FG: 10/18 (55.6%), 3PT: 3/7 (42.9%), REB: 14 (4 off, 10 def), AST: 4, TO: 3
TEAM FOULS: 9 [Team_084 in BONUS]


Team_084
--------------------------------------------------------------------------------
Player                MIN  PTS  REB  AST  TO      FG   FG%      3P   3P%
--------------------------------------------------------------------------------
Chris Parker           15    7    0    0   0   3/5    60.0     0/0   0.0
Dejounte Porzingis     15    5    1    0   0   2/3    66.7     0/0   0.0
Luka Sexton            34    3    0    0   0   1/3    33.3     0/0   0.0
Magic Bryant           15    3    0    1   0   1/1   100.0     0/0   0.0
Pascal Jackson         15    2    4    1   0   1/2    50.0     0/0   0.0
Giannis Quickley       34    0    1    0   0   0/0     0.0     0/0   0.0
Dejounte Ginobili      34    0    1    0   0   0/1     0.0     0/0   0.0
Jarrett Booker         34    0    0    1   0   0/0     0.0     0/0   0.0
Klay Thompson          34    0    1    0   0   0/0     0.0     0/0   0.0
Evan Quickley          15    0    2    1   0   0/3     0.0     0/0   0.0

TEAM: FG: 8/18 (44.4%), 3PT: 3/8 (37.5%), REB: 10 (2 off, 8 def), AST: 4, TO: 3
TEAM FOULS: 5 [Team_064 in BONUS]

================================================================================

================================================================================
                               FULL GAME COMPLETE                               
================================================================================

FINAL SCORE: Team_064 84, Team_084 81

SCORING BY QUARTER:
--------------------------------------------------------------------------------
Team                     Q1     Q2     Q3     Q4    FINAL
--------------------------------------------------------------------------------
Team_064                 21     27     14     22       84
Team_084                 19     26     13     23       81
--------------------------------------------------------------------------------

FULL GAME BOX SCORE:
================================================================================

Team_064
--------------------------------------------------------------------------------
Player                MIN  PTS  REB  AST  TO      FG   FG%      3P   3P%      FT STL BLK
--------------------------------------------------------------------------------
Ja Mitchell            34   12    0    5   2   5/13   38.5   2/7    28.6   0/0     2   0
Jordan Mitchell        34    5    0    3   1   2/6    33.3   1/3    33.3   0/0     2   2
Kawhi Irving           34   13   18    3   1   6/11   54.5   3/7    42.9   4/5     0   1
Russell Simons         34   12   15    0   4   5/9    55.6   1/2    50.0   1/1     3   0
Shai Hyland            34   15    7    3   3   6/11   54.5   1/3    33.3   2/3     0   0
CJ Haliburton          15    1    0    1   1   0/2     0.0   0/2     0.0   1/2     0   0
Ja Simmons             15    3    7    0   1   1/6    16.7   0/2     0.0   1/1     1   0
Tobias Herro           15    7    0    1   2   3/5    60.0   1/3    33.3   0/0     0   0
Austin Smith           15    4    4    1   0   2/3    66.7   0/1     0.0   0/0     0   0
Devin Cunningham       15   10    5    0   1   5/7    71.4   1/1   100.0   1/2     0   0

TEAM: FG: 36/74 (48.6%), 3PT: 10/31 (32.3%), REB: 56 (12 off, 44 def), AST: 17, TO: 16


Team_084
--------------------------------------------------------------------------------
Player                MIN  PTS  REB  AST  TO      FG   FG%      3P   3P%      FT STL BLK
--------------------------------------------------------------------------------
Luka Sexton            34    6    0    4   3   3/9    33.3   3/7    42.9   1/2     1   0
Dejounte Ginobili      34    9   16    1   4   4/9    44.4   2/5    40.0   1/2     0   1
Klay Thompson          34    2    5    0   0   1/10   10.0   0/6     0.0   2/2     1   0
Jarrett Booker         34    8    0    1   1   3/12   25.0   1/4    25.0   1/1     3   0
Giannis Quickley       34   23   10    2   1   9/11   81.8   0/1     0.0   3/3     1   1
Magic Bryant           15    6    0    2   0   2/2   100.0   2/2   100.0   0/0     0   0
Chris Parker           15   14    0    0   1   5/8    62.5   2/3    66.7   5/6     0   0
Evan Quickley          15    0    5    3   0   0/4     0.0   0/3     0.0   0/1     1   0
Pascal Jackson         15    2    6    1   0   1/4    25.0   0/2     0.0   2/2     0   0
Dejounte Porzingis     15    7    3    1   1   3/7    42.9   0/2     0.0   1/1     0   0

TEAM: FG: 32/77 (41.6%), 3PT: 10/35 (28.6%), REB: 45 (8 off, 37 def), AST: 15, TO: 11

================================================================================
