================================================================================
                        FULL GAME - Team_051 vs Team_052                        
================================================================================

================================================================================
                       1ST QUARTER - Team_051 vs Team_052                       
================================================================================

[12:00] Team_051 possession (Score: 0-0)
Shaquille Harden drives, James Paul stays with him. Shaquille Harden attempts a Dunk. Contested by James Paul (3.4 feet, ZONE). Shaquille Harden misses. Offensive rebound by Shaquille Harden! Shaquille Harden's putback is no good. Rebound secured by Carmelo Middleton.

[11:40] Team_052 possession (Score: 0-0)
Carmelo Middleton drives and kicks out. Bones Morant attempts a 3Pt. Contested by OG Siakam (3.8 feet, MAN). Bones Morant misses. Rebound secured by OG Siakam.

[11:22] Team_051 possession (Score: 0-0)
FOUL! Reach-in foul on Gary Gasol during the drive. [Team fouls: 1] No free throws, side out. (Gary Gasol: 1 personal fouls)

[11:10] Team_051 possession (Score: 0-0)
OG Siakam attempts a 3Pt. Contested by Bones Morant (3.9 feet, MAN). OG SIAKAM MAKES IT! Assist: Shaquille Harden
Score: 3-0

[10:57] Team_052 possession (Score: 3-0)
Bones Morant attempts a 3Pt. Contested by Austin Sexton (4.8 feet, ZONE). Bones Morant misses. Offensive rebound by James Paul! James Paul puts it back in!
Score: 3-2

[10:45] Team_051 possession (Score: 3-2)
FOUL! Reach-in foul on Gary Gasol during the drive. [Team fouls: 2] No free throws, side out. (Gary Gasol: 2 personal fouls)

[10:30] Team_051 possession (Score: 3-2)
Franz Simmons attempts a Midrange. Contested by James Paul (3.9 feet, MAN). Franz Simmons misses. Rebound secured by James Paul.

[10:12] Team_052 possession (Score: 3-2)
James Paul makes the Midrange and draws the foul on Franz Simmons! And-1! James Paul to the line for 1. [Team fouls: 1] (Franz Simmons: 1 personal fouls)   FT 1/1: MISS James Paul makes 0/1 from the line. Rebound secured by OG Siakam.
Score: 3-4

[09:58] Team_051 possession (Score: 3-4)
OG Siakam loses control! Ball rolls out of bounds! TURNOVER! (dead ball)

[09:45] Team_052 possession (Score: 3-4)
Bones Morant attempts a Midrange. Contested by OG Siakam (4.3 feet, ZONE). BONES MORANT MAKES IT!
Score: 3-6

[09:27] Team_051 possession (Score: 3-6)
Larry McGrady attempts a 3Pt. Contested by Josh Durant (3.6 feet, MAN). Larry McGrady misses. Rebound secured by Carmelo Middleton.

[09:15] Team_052 possession (Score: 3-6)
Carmelo Middleton drives, Shaquille Harden stays with him. Carmelo Middleton attempts a Dunk. Contested by Shaquille Harden (4.6 feet, MAN). CARMELO MIDDLETON MAKES IT! Assist: Bones Morant
Score: 3-8

[09:06] Team_051 possession (Score: 3-8)
Shaquille Harden loses control! Ball rolls out of bounds! TURNOVER! (dead ball)

[08:54] Team_052 possession (Score: 3-8)
Bones Morant attempts a 3Pt. Contested by Austin Sexton (4.8 feet, ZONE). BONES MORANT MAKES IT! Assist: Josh Durant
Score: 3-11

[08:35] Team_051 possession (Score: 3-11)
Larry McGrady attempts a 3Pt. Contested by Bones Morant (3.9 feet, ZONE). Larry McGrady misses. Rebound secured by Bones Morant.

[08:20] Team_052 possession (Score: 3-11)
Carmelo Middleton attempts a Midrange. Contested by Larry McGrady (4.8 feet, ZONE). CARMELO MIDDLETON MAKES IT! Assist: Gary Gasol
Score: 3-13

[08:06] Team_051 possession (Score: 3-13)
Shaquille Harden attempts a 3Pt. Contested by Bones Morant (3.6 feet, ZONE). Shaquille Harden misses. Rebound secured by Carmelo Middleton.

[07:56] Team_052 possession (Score: 3-13)
James Paul attempts a Midrange. Contested by Franz Simmons (4.6 feet, MAN). James Paul misses. Rebound secured by Shaquille Harden.

[07:44] Team_051 possession (Score: 3-13)
Larry McGrady drives, picks up Josh Durant. Help arrives from Bones Morant! Larry McGrady attempts a Layup. Contested by Bones Morant (3.6 feet, MAN). Larry McGrady misses. Rebound secured by James Paul.

[07:30] Team_052 possession (Score: 3-13)
Gary Gasol attempts a Midrange. Contested by Austin Sexton (4.8 feet, MAN). Gary Gasol misses. Offensive rebound by Bones Morant! Bones Morant kicks it out.

[07:17] Team_052 possession (Score: 3-13)
Josh Durant attempts a 3Pt. Contested by Austin Sexton (4.2 feet, ZONE). Josh Durant misses. Rebound secured by OG Siakam.

[07:01] Team_051 possession (Score: 3-13)
Larry McGrady attempts a Layup. Contested by Josh Durant (3.6 feet, MAN). Larry McGrady misses. Offensive rebound by Shaquille Harden! Shaquille Harden puts it back in!
Score: 5-13

[06:49] Team_052 possession (Score: 5-13)
James Paul drives, Franz Simmons stays with him. James Paul attempts a Layup. Contested by Franz Simmons (4.6 feet, ZONE). James Paul misses. Rebound secured by OG Siakam.

[06:33] Team_051 possession (Score: 5-13)
Austin Sexton attempts a 3Pt. Contested by Bones Morant (3.6 feet, ZONE). AUSTIN SEXTON MAKES IT! Assist: Franz Simmons
Score: 8-13

[06:19] Team_052 possession (Score: 8-13)
James Paul makes the Layup and draws the foul on Franz Simmons! And-1! James Paul to the line for 1. [Team fouls: 2] (Franz Simmons: 2 personal fouls)   FT 1/1: GOOD James Paul makes 1/1 from the line.
Score: 8-16

[06:06] Team_051 possession (Score: 8-16)
Shaquille Harden drives to the basket... Shaquille Harden loses the ball! Stripped by Carmelo Middleton! TURNOVER! (live ball)

[05:47] Team_052 possession (Score: 8-16)
FOUL! Shooting foul on Larry McGrady. Carmelo Middleton to the line for 2 free throws. [Team fouls: 3] (Larry McGrady: 1 personal fouls)   FT 1/2: GOOD   FT 2/2: MISS Carmelo Middleton makes 1/2 from the line. Rebound secured by Franz Simmons.
Score: 8-17

[05:32] Team_051 possession (Score: 8-17)
Larry McGrady attempts a Layup. Contested by James Paul (3.7 feet, ZONE). LARRY MCGRADY MAKES IT!
Score: 10-17

[05:17] Team_052 possession (Score: 10-17)
Gary Gasol makes the Layup and draws the foul on Austin Sexton! And-1! Gary Gasol to the line for 1. [Team fouls: 4] (Austin Sexton: 1 personal fouls)   FT 1/1: MISS Gary Gasol makes 0/1 from the line. Rebound secured by Franz Simmons.
Score: 10-19

[05:04] Team_051 possession (Score: 10-19)
Shaquille Harden attempts a 3Pt. Contested by Bones Morant (3.6 feet, ZONE). Shaquille Harden misses. Rebound secured by James Paul.

[04:49] Team_052 possession (Score: 10-19)
Josh Durant attempts a Midrange. Contested by Larry McGrady (4.3 feet, MAN). JOSH DURANT MAKES IT! Assist: Gary Gasol
Score: 10-21

[04:32] Team_051 possession (Score: 10-21)
Franz Simmons attempts a 3Pt. Contested by Gary Gasol (4.3 feet, ZONE). Franz Simmons misses. Rebound secured by Carmelo Middleton.

[04:14] Team_052 possession (Score: 10-21)
Josh Durant attempts a 3Pt. Contested by Larry McGrady (4.4 feet, MAN). JOSH DURANT MAKES IT! Assist: Carmelo Middleton
Score: 10-24

[04:03] Team_051 possession (Score: 10-24)
Larry McGrady drives and kicks out. Franz Simmons attempts a Midrange. Contested by James Paul (3.5 feet, MAN). Franz Simmons misses. Rebound secured by Carmelo Middleton.

[03:47] Team_052 possession (Score: 10-24)
FOUL! Shooting foul on Austin Sexton. Bones Morant to the line for 2 free throws. [BONUS: 5 team fouls] (Austin Sexton: 2 personal fouls)   FT 1/2: MISS   FT 2/2: GOOD Bones Morant makes 1/2 from the line.
Score: 10-25

[03:37] Team_051 possession (Score: 10-25)
Shaquille Harden attempts a Midrange. Contested by Carmelo Middleton (4.4 feet, MAN). SHAQUILLE HARDEN MAKES IT!
Score: 12-25

[03:22] Team_052 possession (Score: 12-25)
Carmelo Middleton drives, picks up Franz Simmons. Help arrives from Austin Sexton! Carmelo Middleton attempts a Layup. Contested by Austin Sexton (4.7 feet, ZONE). CARMELO MIDDLETON MAKES IT! Assist: James Paul
Score: 12-27

[03:05] Team_051 possession (Score: 12-27)
Larry McGrady attempts a 3Pt. Contested by Bones Morant (4.1 feet, ZONE). Larry McGrady misses. Rebound secured by Carmelo Middleton.

[02:54] Team_052 possession (Score: 12-27)
FOUL! Reach-in foul on Larry McGrady during the drive. [IN THE BONUS! 6 team fouls] Josh Durant to the line for 2 free throws. (Larry McGrady: 2 personal fouls)   FT 1/2: GOOD   FT 2/2: GOOD Josh Durant makes 2/2 from the line.
Score: 12-29

[02:40] Team_051 possession (Score: 12-29)
Austin Sexton drives, picks up James Paul. Help arrives from Josh Durant! Austin Sexton attempts a Layup. Contested by Josh Durant (3.7 feet, ZONE). Austin Sexton misses. FOUL! Loose ball foul on Carmelo Middleton during the rebound battle. [Team fouls: 3] No free throws, side out. (Carmelo Middleton: 1 personal fouls)

[02:25] Team_051 possession (Score: 12-29)
FOUL! Holding foul on Bones Morant. [Team fouls: 4] No free throws, side out. (Bones Morant: 1 personal fouls)

[02:13] Team_051 possession (Score: 12-29)
FOUL! Reach-in foul on James Paul during the drive. [IN THE BONUS! 5 team fouls] Austin Sexton to the line for 2 free throws. (James Paul: 1 personal fouls)   FT 1/2: GOOD   FT 2/2: GOOD Austin Sexton makes 2/2 from the line.
Score: 14-29

[02:00] Team_052 possession (Score: 14-29)
Josh Durant attempts a 3Pt. Contested by Austin Sexton (4.4 feet, ZONE). JOSH DURANT MAKES IT! Assist: Gary Gasol
Score: 14-32

[01:49] Team_051 possession (Score: 14-32)
Austin Sexton drives to the basket... Austin Sexton throws a bad pass! Stolen by Gary Gasol! TURNOVER! (live ball)

[01:40] Team_052 possession (Score: 14-32)
Carmelo Middleton makes the Layup and draws the foul on Shaquille Harden! And-1! Carmelo Middleton to the line for 1. [BONUS: 7 team fouls] (Shaquille Harden: 1 personal fouls)   FT 1/1: GOOD Carmelo Middleton makes 1/1 from the line.
Score: 14-35

[01:28] Team_051 possession (Score: 14-35)
OG Siakam attempts a 3Pt. Contested by Bones Morant (4.2 feet, ZONE). OG Siakam misses. Rebound secured by James Paul.

[01:14] Team_052 possession (Score: 14-35)
Carmelo Middleton drives to the basket... Carmelo Middleton throws a bad pass! Stolen by Franz Simmons! TURNOVER! (live ball)

[01:03] Team_051 possession (Score: 14-35)
Franz Simmons drives to the basket... Franz Simmons throws a bad pass! Stolen by James Paul! TURNOVER! (live ball)

[00:48] Team_052 possession (Score: 14-35)
Josh Durant attempts a Layup. BLOCKED BY LARRY MCGRADY! Ball is loose! Offensive rebound by James Paul! James Paul kicks it out.

[00:32] Team_052 possession (Score: 14-35)
Josh Durant drives and kicks out. Carmelo Middleton attempts a Midrange. Contested by Shaquille Harden (4.7 feet, MAN). Carmelo Middleton misses. Rebound secured by Shaquille Harden.

[00:15] Team_051 possession (Score: 14-35)
Larry McGrady attempts a 3Pt. Contested by Josh Durant (4.1 feet, MAN). LARRY MCGRADY MAKES IT! Assist: OG Siakam
Score: 17-35

================================================================================
                              1ST QUARTER COMPLETE                              
================================================================================

1ST QUARTER SCORE: Team_051 17, Team_052 35

BOX SCORE:
================================================================================

Team_051
--------------------------------------------------------------------------------
Player                MIN  PTS  REB  AST  TO      FG   FG%      3P   3P%
--------------------------------------------------------------------------------
Larry McGrady          12    5    0    0   0   2/7    28.6     0/0   0.0
Austin Sexton          12    5    0    0   0   2/2   100.0     0/0   0.0
Shaquille Harden       12    4    3    1   0   2/5    40.0     0/0   0.0
OG Siakam              12    3    4    1   0   1/2    50.0     0/0   0.0
Franz Simmons          12    0    3    1   0   0/2     0.0     0/0   0.0

TEAM: FG: 7/18 (38.9%), 3PT: 3/10 (30.0%), REB: 11 (3 off, 8 def), AST: 3, TO: 5
TEAM FOULS: 7 [Team_052 in BONUS]


Team_052
--------------------------------------------------------------------------------
Player                MIN  PTS  REB  AST  TO      FG   FG%      3P   3P%
--------------------------------------------------------------------------------
Josh Durant            12   10    0    1   0   4/6    66.7     0/0   0.0
Carmelo Middleton      12    9    6    1   0   4/6    66.7     0/0   0.0
Bones Morant           12    6    2    1   0   3/3   100.0     0/0   0.0
James Paul             12    5    6    1   0   2/5    40.0     0/0   0.0
Gary Gasol             12    0    0    3   0   0/1     0.0     0/0   0.0

TEAM: FG: 13/21 (61.9%), 3PT: 4/5 (80.0%), REB: 13 (3 off, 10 def), AST: 7, TO: 1
TEAM FOULS: 5 [Team_051 in BONUS]

================================================================================

================================================================================
                       2ND QUARTER - Team_051 vs Team_052                       
================================================================================

[12:00] Team_051 possession (Score: 17-35)
FOUL! Shooting foul on James Paul. OG Siakam to the line for 2 free throws. [Team fouls: 1] (James Paul: 1 personal fouls)   FT 1/2: MISS   FT 2/2: MISS OG Siakam makes 0/2 from the line. Rebound secured by Carmelo Middleton.

[11:48] Team_052 possession (Score: 17-35)
Carmelo Middleton drives to the basket... Carmelo Middleton throws a bad pass out of bounds! TURNOVER! (dead ball)

[11:48] Substitution (Team_051): Austin Sexton OUT → Myles Harden IN (stamina_rule2)

[11:48] Substitution (Team_051): Larry McGrady OUT → Zion Morant IN (stamina_rule2)

[11:48] Substitution (Team_051): OG Siakam OUT → Jrue Carter IN (stamina_rule2)

[11:48] Substitution (Team_051): Franz Simmons OUT → Tobias Jokic IN (stamina_rule2)

[11:48] Substitution (Team_051): Shaquille Harden OUT → Pau Tatum IN (stamina_rule2)

[11:48] Substitution (Team_052): Gary Gasol OUT → Jimmy Doncic IN (stamina_rule2)

[11:48] Substitution (Team_052): Josh Durant OUT → Carmelo Giddey IN (stamina_rule2)

[11:48] Substitution (Team_052): Bones Morant OUT → Donovan Stewart IN (stamina_rule2)

[11:48] Substitution (Team_052): James Paul OUT → Jalen Haliburton IN (stamina_rule2)

[11:48] Substitution (Team_052): Carmelo Middleton OUT → Carmelo Beal IN (stamina_rule2)

[11:33] Team_051 possession (Score: 17-35)
Pau Tatum attempts a Midrange. Contested by Carmelo Beal (3.4 feet, MAN). Pau Tatum misses. Offensive rebound by Pau Tatum! Pau Tatum puts it back in!
Score: 19-35

[11:14] Team_052 possession (Score: 19-35)
Jalen Haliburton drives and kicks out. Carmelo Giddey attempts a 3Pt. Contested by Myles Harden (4.6 feet, ZONE). Carmelo Giddey misses. Rebound secured by Tobias Jokic.

[10:59] Team_051 possession (Score: 19-35)
Pau Tatum attempts a Layup. Contested by Carmelo Beal (3.4 feet, ZONE). PAU TATUM MAKES IT!
Score: 21-35

[10:46] Team_052 possession (Score: 21-35)
Carmelo Beal attempts a Layup. Contested by Pau Tatum (4.1 feet, ZONE). CARMELO BEAL MAKES IT! Assist: Donovan Stewart
Score: 21-37

[10:32] Team_051 possession (Score: 21-37)
Pau Tatum drives, Carmelo Beal stays with him. Pau Tatum attempts a Layup. Contested by Carmelo Beal (3.4 feet, ZONE). PAU TATUM MAKES IT! Assist: Tobias Jokic
Score: 23-37

[10:17] Team_052 possession (Score: 23-37)
FOUL! Holding foul on Jrue Carter. [Team fouls: 1] No free throws, side out. (Jrue Carter: 1 personal fouls)

[10:01] Team_052 possession (Score: 23-37)
Donovan Stewart attempts a 3Pt. Contested by Jrue Carter (4.8 feet, MAN). DONOVAN STEWART MAKES IT! Assist: Carmelo Giddey
Score: 23-40

[09:48] Team_051 possession (Score: 23-40)
Zion Morant attempts a 3Pt. Contested by Jalen Haliburton (4.8 feet, ZONE). Zion Morant misses. Rebound secured by Donovan Stewart.

[09:34] Team_052 possession (Score: 23-40)
Carmelo Beal drives to the basket... Carmelo Beal throws a bad pass! Stolen by Pau Tatum! TURNOVER! (live ball)

[09:24] Team_051 possession (Score: 23-40)
Jrue Carter attempts a Midrange. Contested by Donovan Stewart (5.1 feet, ZONE). Jrue Carter misses. Rebound secured by Jalen Haliburton.

[09:08] Team_052 possession (Score: 23-40)
Carmelo Beal attempts a Layup. BLOCKED BY PAU TATUM! Ball deflects out of bounds off Carmelo Beal.

[08:55] Team_051 possession (Score: 23-40)
Pau Tatum makes the Dunk and draws the foul on Carmelo Beal! And-1! Pau Tatum to the line for 1. [Team fouls: 2] (Carmelo Beal: 1 personal fouls)   FT 1/1: MISS Pau Tatum makes 0/1 from the line. Rebound secured by Jalen Haliburton.
Score: 25-40

[08:41] Team_052 possession (Score: 25-40)
Jalen Haliburton drives, Pau Tatum stays with him. Jalen Haliburton attempts a Layup. Contested by Pau Tatum (4.5 feet, ZONE). Jalen Haliburton misses. Rebound secured by Tobias Jokic.

[08:28] Team_051 possession (Score: 25-40)
Myles Harden attempts a 3Pt. Contested by Jalen Haliburton (4.3 feet, ZONE). Myles Harden misses. Rebound secured by Donovan Stewart.

[08:16] Team_052 possession (Score: 25-40)
Donovan Stewart drives, Jrue Carter stays with him. Donovan Stewart attempts a Layup. Contested by Jrue Carter (4.8 feet, MAN). DONOVAN STEWART MAKES IT! Assist: Carmelo Giddey
Score: 25-42

[07:58] Team_051 possession (Score: 25-42)
Jrue Carter attempts a 3Pt. Contested by Donovan Stewart (5.1 feet, MAN). JRUE CARTER MAKES IT! Assist: Tobias Jokic
Score: 28-42

[07:41] Team_052 possession (Score: 28-42)
Carmelo Beal drives to the basket... Carmelo Beal loses the ball! Stripped by Pau Tatum! TURNOVER! (live ball)

[07:30] Team_051 possession (Score: 28-42)
Tobias Jokic attempts a Layup. Contested by Jalen Haliburton (4.7 feet, MAN). Tobias Jokic misses. Offensive rebound by Tobias Jokic! Tobias Jokic kicks it out.

[07:18] Team_051 possession (Score: 28-42)
Pau Tatum attempts a Midrange. Contested by Carmelo Beal (3.4 feet, MAN). PAU TATUM MAKES IT! Assist: Zion Morant
Score: 30-42

[07:01] Team_052 possession (Score: 30-42)
FOUL! Reach-in foul on Myles Harden during the drive. [Team fouls: 2] No free throws, side out. (Myles Harden: 1 personal fouls)

[06:46] Team_052 possession (Score: 30-42)
Jimmy Doncic attempts a 3Pt. Contested by Myles Harden (4.5 feet, MAN). JIMMY DONCIC MAKES IT! Assist: Donovan Stewart
Score: 30-45

[06:33] Team_051 possession (Score: 30-45)
Tobias Jokic attempts a 3Pt. Contested by Jalen Haliburton (4.7 feet, ZONE). TOBIAS JOKIC MAKES IT! Assist: Pau Tatum
Score: 33-45

[06:15] Team_052 possession (Score: 33-45)
Jalen Haliburton drives and kicks out. FOUL! Shooting foul on Tobias Jokic. Jalen Haliburton to the line for 2 free throws. [Team fouls: 3] (Tobias Jokic: 1 personal fouls)   FT 1/2: GOOD   FT 2/2: GOOD Jalen Haliburton makes 2/2 from the line.
Score: 33-47

[05:59] Team_051 possession (Score: 33-47)
Jrue Carter attempts a 3Pt. Contested by Donovan Stewart (5.1 feet, MAN). Jrue Carter misses. Rebound secured by Jalen Haliburton.

[05:48] Team_052 possession (Score: 33-47)
Jimmy Doncic attempts a Layup. BLOCKED BY JRUE CARTER! Ball is loose! Rebound secured by Pau Tatum.

[05:34] Team_051 possession (Score: 33-47)
Jrue Carter attempts a 3Pt. Contested by Jalen Haliburton (4.8 feet, ZONE). Jrue Carter misses. Offensive rebound by Tobias Jokic! Tobias Jokic kicks it out.

[05:20] Team_051 possession (Score: 33-47)
Pau Tatum attempts a Midrange. Contested by Jalen Haliburton (4.4 feet, ZONE). PAU TATUM MAKES IT!
Score: 35-47

[05:02] Team_052 possession (Score: 35-47)
Carmelo Beal attempts a 3Pt. Contested by Pau Tatum (4.1 feet, MAN). Carmelo Beal misses. Rebound secured by Pau Tatum.

[04:47] Team_051 possession (Score: 35-47)
Tobias Jokic drives, Jalen Haliburton stays with him. Tobias Jokic attempts a Dunk. Contested by Jalen Haliburton (4.7 feet, MAN). Tobias Jokic misses. Offensive rebound by Pau Tatum! Pau Tatum puts it back in!
Score: 37-47

[04:28] Team_052 possession (Score: 37-47)
Jimmy Doncic attempts a 3Pt. Contested by Myles Harden (4.5 feet, ZONE). JIMMY DONCIC MAKES IT! Assist: Donovan Stewart
Score: 37-50

[04:16] Team_051 possession (Score: 37-50)
Myles Harden drives, picks up Carmelo Beal. Help arrives from Carmelo Giddey! Myles Harden attempts a Dunk. Contested by Carmelo Giddey (3.3 feet, ZONE). MYLES HARDEN MAKES IT!
Score: 39-50

[04:03] Team_052 possession (Score: 39-50)
Carmelo Giddey drives, Zion Morant stays with him. Carmelo Giddey attempts a Layup. Wide open! Zion Morant is 6.2 feet away. [MAN] CARMELO GIDDEY MAKES IT!
Score: 39-52

[03:49] Team_051 possession (Score: 39-52)
FOUL! Reach-in foul on Jalen Haliburton during the drive. [Team fouls: 3] No free throws, side out. (Jalen Haliburton: 1 personal fouls)

[03:36] Team_051 possession (Score: 39-52)
Myles Harden throws a bad pass! Stolen by Jimmy Doncic! TURNOVER! (live ball)

[03:20] Team_052 possession (Score: 39-52)
Carmelo Beal drives, picks up Pau Tatum. Help arrives from Myles Harden! Carmelo Beal attempts a Dunk. Contested by Myles Harden (4.2 feet, MAN). Carmelo Beal misses. Rebound secured by Myles Harden.

[03:03] Team_051 possession (Score: 39-52)
FOUL! Reach-in foul on Donovan Stewart during the drive. [Team fouls: 4] No free throws, side out. (Donovan Stewart: 1 personal fouls)

[02:48] Team_051 possession (Score: 39-52)
Myles Harden drives and kicks out. Myles Harden attempts a 3Pt. Contested by Jimmy Doncic (4.9 feet, MAN). Myles Harden misses. Rebound secured by Carmelo Beal.

[02:34] Team_052 possession (Score: 39-52)
Carmelo Giddey attempts a 3Pt. Contested by Myles Harden (5.4 feet, ZONE). Carmelo Giddey misses. Rebound secured by Tobias Jokic.

[02:19] Team_051 possession (Score: 39-52)
Jrue Carter attempts a Midrange. Contested by Jimmy Doncic (5.2 feet, ZONE). Jrue Carter misses. Offensive rebound by Pau Tatum! Pau Tatum puts it back in!
Score: 41-52

[02:04] Team_052 possession (Score: 41-52)
Carmelo Beal attempts a Midrange. Contested by Pau Tatum (4.3 feet, MAN). Carmelo Beal misses. Rebound secured by Tobias Jokic.

[01:45] Team_051 possession (Score: 41-52)
Zion Morant attempts a 3Pt. Contested by Jalen Haliburton (5.0 feet, ZONE). Zion Morant misses. Rebound secured by Carmelo Beal.

[01:34] Team_052 possession (Score: 41-52)
Carmelo Beal attempts a Midrange. Contested by Myles Harden (4.7 feet, ZONE). Carmelo Beal misses. Offensive rebound by Donovan Stewart! Donovan Stewart kicks it out.

[01:25] Team_052 possession (Score: 41-52)
Carmelo Beal makes the Layup and draws the foul on Myles Harden! And-1! Carmelo Beal to the line for 1. [Team fouls: 4] (Myles Harden: 2 personal fouls)   FT 1/1: GOOD Carmelo Beal makes 1/1 from the line.
Score: 41-55

[01:12] Team_051 possession (Score: 41-55)
Zion Morant attempts a Layup. Contested by Carmelo Giddey (5.1 feet, MAN). ZION MORANT MAKES IT!
Score: 43-55

[00:58] Team_052 possession (Score: 43-55)
Carmelo Beal drives and kicks out. FOUL! Shooting foul on Jrue Carter. Jalen Haliburton to the line for 2 free throws. [BONUS: 5 team fouls] (Jrue Carter: 2 personal fouls)   FT 1/2: GOOD   FT 2/2: GOOD Jalen Haliburton makes 2/2 from the line.
Score: 43-57

[00:41] Team_051 possession (Score: 43-57)
FOUL! Shooting foul on Donovan Stewart. Jrue Carter to the line for 2 free throws. [BONUS: 5 team fouls] (Donovan Stewart: 2 personal fouls)   FT 1/2: GOOD   FT 2/2: GOOD Jrue Carter makes 2/2 from the line.
Score: 45-57

[00:22] Team_052 possession (Score: 45-57)
Carmelo Giddey attempts a Midrange. Contested by Myles Harden (5.6 feet, ZONE). CARMELO GIDDEY MAKES IT! Assist: Carmelo Beal
Score: 45-59

[00:06] Team_051 possession (Score: 45-59)
Myles Harden attempts a Layup. BLOCKED BY JIMMY DONCIC! Ball is loose! Rebound secured by Donovan Stewart.

================================================================================
                              2ND QUARTER COMPLETE                              
================================================================================

2ND QUARTER SCORE: Team_051 28, Team_052 24

BOX SCORE:
================================================================================

Team_051
--------------------------------------------------------------------------------
Player                MIN  PTS  REB  AST  TO      FG   FG%      3P   3P%
--------------------------------------------------------------------------------
Pau Tatum              12   14    5    1   0   7/8    87.5     0/0   0.0
Jrue Carter            12    5    0    0   0   2/4    50.0     0/0   0.0
Tobias Jokic           12    3    6    2   0   1/1   100.0     0/0   0.0
Zion Morant            12    2    0    1   0   1/3    33.3     0/0   0.0
Myles Harden           12    2    1    0   0   1/4    25.0     0/0   0.0
OG Siakam              12    0    0    0   0   0/1     0.0     0/0   0.0

TEAM: FG: 12/21 (57.1%), 3PT: 2/6 (33.3%), REB: 12 (5 off, 7 def), AST: 4, TO: 1
TEAM FOULS: 5 [Team_052 in BONUS]


Team_052
--------------------------------------------------------------------------------
Player                MIN  PTS  REB  AST  TO      FG   FG%      3P   3P%
--------------------------------------------------------------------------------
Jimmy Doncic           12    6    0    0   0   2/3    66.7     0/0   0.0
Carmelo Beal           12    5    2    1   0   2/6    33.3     0/0   0.0
Donovan Stewart        12    5    4    3   0   2/2   100.0     0/0   0.0
Jalen Haliburton       12    4    3    0   0   2/4    50.0     0/0   0.0
Carmelo Giddey         12    4    0    2   0   2/3    66.7     0/0   0.0
Carmelo Middleton      12    0    1    0   0   0/0     0.0     0/0   0.0

TEAM: FG: 10/18 (55.6%), 3PT: 3/5 (60.0%), REB: 10 (1 off, 9 def), AST: 6, TO: 3
TEAM FOULS: 5 [Team_051 in BONUS]

================================================================================

================================================================================
                       3RD QUARTER - Team_051 vs Team_052                       
================================================================================

[12:00] Team_051 possession (Score: 45-59)
Larry McGrady attempts a 3Pt. Contested by Bones Morant (3.9 feet, ZONE). Larry McGrady misses. Rebound secured by James Paul.

[11:40] Team_052 possession (Score: 45-59)
Bones Morant attempts a 3Pt. Contested by OG Siakam (4.3 feet, MAN). Bones Morant misses. Rebound secured by Franz Simmons.

[11:29] Team_051 possession (Score: 45-59)
Austin Sexton attempts a Midrange. Contested by Bones Morant (3.6 feet, ZONE). Austin Sexton misses. Offensive rebound by Shaquille Harden! Shaquille Harden's putback is no good. Rebound secured by Carmelo Middleton.

[11:18] Team_052 possession (Score: 45-59)
Gary Gasol attempts a Midrange. Contested by Austin Sexton (4.8 feet, MAN). GARY GASOL MAKES IT! Assist: Bones Morant
Score: 45-61

[11:04] Team_051 possession (Score: 45-61)
Austin Sexton drives, James Paul stays with him. Austin Sexton attempts a Layup. Contested by James Paul (3.4 feet, ZONE). Austin Sexton misses. Rebound secured by James Paul.

[10:50] Team_052 possession (Score: 45-61)
Josh Durant attempts a Midrange. Contested by Larry McGrady (4.3 feet, MAN). Josh Durant misses. Rebound secured by Franz Simmons.

[10:37] Team_051 possession (Score: 45-61)
Shaquille Harden drives and kicks out. Shaquille Harden attempts a 3Pt. Contested by Carmelo Middleton (4.3 feet, MAN). Shaquille Harden misses. Rebound secured by Carmelo Middleton.

[10:23] Team_052 possession (Score: 45-61)
Gary Gasol attempts a 3Pt. Contested by Austin Sexton (4.8 feet, MAN). GARY GASOL MAKES IT! Assist: Bones Morant
Score: 45-64

[10:06] Team_051 possession (Score: 45-64)
OG Siakam attempts a Layup. Contested by Bones Morant (3.9 feet, MAN). OG SIAKAM MAKES IT! Assist: Austin Sexton
Score: 47-64

[09:52] Team_052 possession (Score: 47-64)
Bones Morant drives to the basket... Bones Morant loses control! Ball rolls out of bounds! TURNOVER! (dead ball)

[09:36] Team_051 possession (Score: 47-64)
Larry McGrady attempts a Midrange. Contested by Josh Durant (3.6 feet, MAN). LARRY MCGRADY MAKES IT! Assist: Shaquille Harden
Score: 49-64

[09:18] Team_052 possession (Score: 49-64)
Josh Durant drives and kicks out. James Paul attempts a Midrange. Contested by Franz Simmons (4.2 feet, MAN). JAMES PAUL MAKES IT!
Score: 49-66

[09:04] Team_051 possession (Score: 49-66)
Larry McGrady attempts a Layup. Contested by James Paul (3.7 feet, ZONE). LARRY MCGRADY MAKES IT!
Score: 51-66

[08:45] Team_052 possession (Score: 51-66)
Carmelo Middleton drives to the basket... Carmelo Middleton loses control! Ball rolls out of bounds! TURNOVER! (dead ball)

[08:29] Team_051 possession (Score: 51-66)
Shaquille Harden attempts a Layup. Contested by Carmelo Middleton (4.3 feet, MAN). Shaquille Harden misses. Rebound secured by Carmelo Middleton.

[08:12] Team_052 possession (Score: 51-66)
Josh Durant attempts a Midrange. Contested by Larry McGrady (4.3 feet, MAN). Josh Durant misses. Rebound secured by Franz Simmons.

[07:58] Team_051 possession (Score: 51-66)
OG Siakam attempts a 3Pt. Contested by Bones Morant (3.9 feet, ZONE). OG Siakam misses. Rebound secured by Carmelo Middleton.

[07:42] Team_052 possession (Score: 51-66)
FOUL! Shooting foul on Larry McGrady. Gary Gasol to the line for 2 free throws. [Team fouls: 1] (Larry McGrady: 1 personal fouls)   FT 1/2: GOOD   FT 2/2: GOOD Gary Gasol makes 2/2 from the line.
Score: 51-68

[07:25] Team_051 possession (Score: 51-68)
FOUL! Shooting foul on James Paul. Shaquille Harden to the line for 2 free throws. [Team fouls: 1] (James Paul: 1 personal fouls)   FT 1/2: GOOD   FT 2/2: GOOD Shaquille Harden makes 2/2 from the line.
Score: 53-68

[07:14] Team_052 possession (Score: 53-68)
Josh Durant drives to the basket... Josh Durant throws a bad pass out of bounds! TURNOVER! (dead ball)

[07:03] Team_051 possession (Score: 53-68)
Shaquille Harden makes the Layup and draws the foul on Carmelo Middleton! And-1! Shaquille Harden to the line for 1. [Team fouls: 2] (Carmelo Middleton: 1 personal fouls)   FT 1/1: GOOD Shaquille Harden makes 1/1 from the line.
Score: 56-68

[06:51] Team_052 possession (Score: 56-68)
Carmelo Middleton drives, Shaquille Harden stays with him. Carmelo Middleton attempts a Dunk. Contested by Shaquille Harden (4.6 feet, MAN). Carmelo Middleton misses. Rebound secured by Franz Simmons.

[06:35] Team_051 possession (Score: 56-68)
Austin Sexton attempts a 3Pt. Contested by Bones Morant (3.6 feet, ZONE). Austin Sexton misses. Rebound secured by Bones Morant.

[06:19] Team_052 possession (Score: 56-68)
FOUL! Shooting foul on Shaquille Harden. Carmelo Middleton to the line for 2 free throws. [Team fouls: 2] (Shaquille Harden: 1 personal fouls)   FT 1/2: GOOD   FT 2/2: GOOD Carmelo Middleton makes 2/2 from the line.
Score: 56-70

[06:05] Team_051 possession (Score: 56-70)
Larry McGrady throws a bad pass out of bounds! TURNOVER! (dead ball)

[05:49] Team_052 possession (Score: 56-70)
James Paul attempts a 3Pt. Contested by Franz Simmons (4.6 feet, MAN). James Paul misses. Offensive rebound by Bones Morant! Bones Morant kicks it out.

[05:35] Team_052 possession (Score: 56-70)
James Paul attempts a Midrange. Contested by Larry McGrady (4.8 feet, ZONE). JAMES PAUL MAKES IT!
Score: 56-72

[05:22] Team_051 possession (Score: 56-72)
Shaquille Harden drives, James Paul stays with him. Shaquille Harden attempts a Dunk. Contested by James Paul (3.4 feet, ZONE). Shaquille Harden misses. Rebound secured by James Paul.

[05:04] Team_052 possession (Score: 56-72)
Josh Durant commits a violation (traveling/carry)! TURNOVER! (dead ball)

[04:48] Team_051 possession (Score: 56-72)
FOUL! Reach-in foul on Carmelo Middleton during the drive. [Team fouls: 3] No free throws, side out. (Carmelo Middleton: 2 personal fouls)

[04:31] Team_051 possession (Score: 56-72)
FOUL! Shooting foul on James Paul. Austin Sexton to the line for 2 free throws. [Team fouls: 4] (James Paul: 2 personal fouls)   FT 1/2: GOOD   FT 2/2: GOOD Austin Sexton makes 2/2 from the line.
Score: 58-72

[04:14] Team_052 possession (Score: 58-72)
Gary Gasol drives, picks up Austin Sexton. Help arrives from OG Siakam! Gary Gasol attempts a Dunk. Contested by OG Siakam (4.9 feet, MAN). GARY GASOL MAKES IT!
Score: 58-74

[04:04] Team_051 possession (Score: 58-74)
Franz Simmons makes the Layup and draws the foul on James Paul! And-1! Franz Simmons to the line for 1. [BONUS: 5 team fouls] (James Paul: 3 personal fouls)   FT 1/1: GOOD Franz Simmons makes 1/1 from the line.
Score: 61-74

[03:49] Team_052 possession (Score: 61-74)
Bones Morant attempts a Midrange. Contested by OG Siakam (4.4 feet, MAN). Bones Morant misses. Rebound secured by Shaquille Harden.

[03:36] Team_051 possession (Score: 61-74)
Larry McGrady makes the Layup and draws the foul on James Paul! And-1! Larry McGrady to the line for 1. [BONUS: 6 team fouls] (James Paul: 4 personal fouls)   FT 1/1: GOOD Larry McGrady makes 1/1 from the line.
Score: 64-74

[03:22] Team_052 possession (Score: 64-74)
Josh Durant attempts a 3Pt. Contested by Larry McGrady (4.4 feet, MAN). Josh Durant misses. FOUL! Loose ball foul on Franz Simmons during the rebound battle. [Team fouls: 3] No free throws, side out. (Franz Simmons: 1 personal fouls)

[03:10] Team_052 possession (Score: 64-74)
Bones Morant throws a bad pass out of bounds! TURNOVER! (dead ball)

[02:52] Team_051 possession (Score: 64-74)
OG Siakam drives to the basket... OG Siakam throws a bad pass! Stolen by James Paul! TURNOVER! (live ball)

[02:37] Team_052 possession (Score: 64-74)
James Paul drives, Franz Simmons stays with him. James Paul attempts a Dunk. Contested by Franz Simmons (4.7 feet, MAN). JAMES PAUL MAKES IT! Assist: Carmelo Middleton
Score: 64-76

[02:22] Team_051 possession (Score: 64-76)
Larry McGrady attempts a 3Pt. Contested by Josh Durant (3.8 feet, MAN). LARRY MCGRADY MAKES IT! Assist: OG Siakam
Score: 67-76

[02:06] Team_052 possession (Score: 67-76)
FOUL! Shooting foul on Franz Simmons. Gary Gasol to the line for 2 free throws. [Team fouls: 4] (Franz Simmons: 2 personal fouls)   FT 1/2: GOOD   FT 2/2: GOOD Gary Gasol makes 2/2 from the line.
Score: 67-78

[01:47] Team_051 possession (Score: 67-78)
Franz Simmons attempts a Midrange. Contested by James Paul (4.2 feet, ZONE). FRANZ SIMMONS MAKES IT! Assist: Shaquille Harden
Score: 69-78

[01:34] Team_052 possession (Score: 69-78)
FOUL! Shooting foul on Shaquille Harden. Carmelo Middleton to the line for 2 free throws. [BONUS: 5 team fouls] (Shaquille Harden: 2 personal fouls)   FT 1/2: GOOD   FT 2/2: GOOD Carmelo Middleton makes 2/2 from the line.
Score: 69-80

[01:21] Team_051 possession (Score: 69-80)
Larry McGrady attempts a Layup. BLOCKED BY JAMES PAUL! Ball is loose! Rebound secured by James Paul.

[01:09] Team_052 possession (Score: 69-80)
Carmelo Middleton attempts a 3Pt. Contested by Austin Sexton (5.0 feet, ZONE). Carmelo Middleton misses. Rebound secured by OG Siakam.

[00:51] Team_051 possession (Score: 69-80)
Shaquille Harden drives to the basket... Shaquille Harden loses the ball! Stripped by Carmelo Middleton! TURNOVER! (live ball)

[00:34] Team_052 possession (Score: 69-80)
Josh Durant drives to the basket... FOUL! Offensive foul on Josh Durant! Larry McGrady drew the charge! [Team fouls: 7] (Josh Durant: 1 personal fouls) TURNOVER! (dead ball)

[00:19] Team_051 possession (Score: 69-80)
Shaquille Harden drives and kicks out. FOUL! Shooting foul on Carmelo Middleton. Shaquille Harden to the line for 2 free throws. [BONUS: 8 team fouls] (Carmelo Middleton: 3 personal fouls)   FT 1/2: MISS   FT 2/2: GOOD Shaquille Harden makes 1/2 from the line.
Score: 70-80

[00:08] Team_052 possession (Score: 70-80)
FOUL! Holding foul on Austin Sexton. [IN THE BONUS! 6 team fouls] Gary Gasol to the line for 2 free throws. (Austin Sexton: 1 personal fouls)   FT 1/2: GOOD   FT 2/2: MISS Gary Gasol makes 1/2 from the line. Rebound secured by OG Siakam.
Score: 70-81

================================================================================
                              3RD QUARTER COMPLETE                              
================================================================================

3RD QUARTER SCORE: Team_051 25, Team_052 22

BOX SCORE:
================================================================================

Team_051
--------------------------------------------------------------------------------
Player                MIN  PTS  REB  AST  TO      FG   FG%      3P   3P%
--------------------------------------------------------------------------------
Larry McGrady          25   10    0    0   0   4/6    66.7     0/0   0.0
Shaquille Harden       25    6    1    2   0   3/6    50.0     0/0   0.0
Franz Simmons          25    5    4    0   0   2/2   100.0     0/0   0.0
Austin Sexton          25    2    0    1   0   1/4    25.0     0/0   0.0
OG Siakam              25    2    2    1   0   1/2    50.0     0/0   0.0

TEAM: FG: 11/20 (55.0%), 3PT: 1/4 (25.0%), REB: 8 (1 off, 7 def), AST: 4, TO: 3
TEAM FOULS: 6 [Team_052 in BONUS]


Team_052
--------------------------------------------------------------------------------
Player                MIN  PTS  REB  AST  TO      FG   FG%      3P   3P%
--------------------------------------------------------------------------------
Gary Gasol             25   11    0    0   0   5/5   100.0     0/0   0.0
James Paul             25    6    4    0   0   3/3   100.0     0/0   0.0
Carmelo Middleton      25    4    4    1   0   2/4    50.0     0/0   0.0
Bones Morant           25    0    3    2   0   0/2     0.0     0/0   0.0
Josh Durant            25    0    0    0   0   0/2     0.0     0/0   0.0

TEAM: FG: 10/17 (58.8%), 3PT: 1/3 (33.3%), REB: 10 (2 off, 8 def), AST: 3, TO: 6
TEAM FOULS: 8 [Team_051 in BONUS]

================================================================================

================================================================================
                       4TH QUARTER - Team_051 vs Team_052                       
================================================================================

[12:00] Substitution (Team_051): Austin Sexton OUT (stamina: 72) → Myles Harden IN (comeback_detected)

[12:00] Substitution (Team_052): Gary Gasol OUT (stamina: 70) → Jimmy Doncic IN (comeback_detected)

[12:00] Team_051 possession (Score: 70-81)
Shaquille Harden drives to the basket... Shaquille Harden loses the ball! Stripped by James Paul! TURNOVER! (live ball)

[11:43] Team_052 possession (Score: 70-81)
Carmelo Middleton attempts a Layup. Contested by Franz Simmons (4.8 feet, ZONE). CARMELO MIDDLETON MAKES IT! Assist: Bones Morant
Score: 70-83

[11:28] Team_051 possession (Score: 70-83)
FOUL! Reach-in foul on James Paul during the drive. [Team fouls: 1] No free throws, side out. (James Paul: 1 personal fouls)

[11:11] Team_051 possession (Score: 70-83)
FOUL! Reach-in foul on Bones Morant during the drive. [Team fouls: 2] No free throws, side out. (Bones Morant: 1 personal fouls)

[10:58] Team_051 possession (Score: 70-83)
Myles Harden attempts a 3Pt. Contested by Bones Morant (3.8 feet, ZONE). MYLES HARDEN MAKES IT! Assist: Shaquille Harden
Score: 73-83

[10:40] Team_052 possession (Score: 73-83)
Bones Morant attempts a Midrange. BLOCKED BY OG SIAKAM! Ball is loose! Offensive rebound by James Paul! James Paul kicks it out.

[10:23] Team_052 possession (Score: 73-83)
James Paul attempts a 3Pt. Contested by Myles Harden (4.9 feet, ZONE). James Paul misses. Rebound secured by OG Siakam.

[10:11] Team_051 possession (Score: 73-83)
OG Siakam makes the Dunk and draws the foul on Bones Morant! And-1! OG Siakam to the line for 1. [Team fouls: 3] (Bones Morant: 2 personal fouls)   FT 1/1: GOOD OG Siakam makes 1/1 from the line.
Score: 76-83

[10:01] Team_052 possession (Score: 76-83)
James Paul attempts a 3Pt. Contested by Myles Harden (4.9 feet, ZONE). James Paul misses. Rebound secured by Shaquille Harden.

[09:48] Team_051 possession (Score: 76-83)
Franz Simmons attempts a Midrange. Contested by Bones Morant (4.5 feet, ZONE). Franz Simmons misses. Rebound secured by James Paul.

[09:33] Team_052 possession (Score: 76-83)
James Paul attempts a 3Pt. Contested by Franz Simmons (5.0 feet, MAN). JAMES PAUL MAKES IT! Assist: Jimmy Doncic
Score: 76-86

[09:16] Team_051 possession (Score: 76-86)
Myles Harden attempts a 3Pt. Contested by Jimmy Doncic (4.5 feet, MAN). Myles Harden misses. Rebound secured by Carmelo Middleton.

[08:58] Team_052 possession (Score: 76-86)
Jimmy Doncic attempts a 3Pt. Contested by Myles Harden (4.5 feet, ZONE). Jimmy Doncic misses. Offensive rebound by Bones Morant! Bones Morant kicks it out.

[08:46] Team_052 possession (Score: 76-86)
Carmelo Middleton attempts a 3Pt. Contested by Shaquille Harden (5.1 feet, MAN). Carmelo Middleton misses. Offensive rebound by Bones Morant! Bones Morant kicks it out.

[08:32] Team_052 possession (Score: 76-86)
James Paul attempts a Layup. Contested by Franz Simmons (5.1 feet, MAN). JAMES PAUL MAKES IT!
Score: 76-88

[08:18] Team_051 possession (Score: 76-88)
Franz Simmons throws a bad pass! Stolen by James Paul! TURNOVER! (live ball)

[08:02] Team_052 possession (Score: 76-88)
Josh Durant drives, picks up Larry McGrady. Help arrives from OG Siakam! Josh Durant attempts a Layup. Contested by OG Siakam (5.0 feet, MAN). Josh Durant misses. Rebound secured by Franz Simmons.

[07:47] Team_051 possession (Score: 76-88)
FOUL! Holding foul on Bones Morant. [Team fouls: 4] No free throws, side out. (Bones Morant: 3 personal fouls)

[07:36] Team_051 possession (Score: 76-88)
Shaquille Harden attempts a Layup. Contested by Carmelo Middleton (5.1 feet, MAN). SHAQUILLE HARDEN MAKES IT!
Score: 78-88

[07:19] Team_052 possession (Score: 78-88)
Josh Durant attempts a 3Pt. Contested by Larry McGrady (5.1 feet, MAN). Josh Durant misses. Offensive rebound by James Paul! James Paul's putback is no good. Rebound secured by Myles Harden.

[07:04] Team_051 possession (Score: 78-88)
Franz Simmons attempts a 3Pt. Contested by James Paul (4.7 feet, MAN). FRANZ SIMMONS MAKES IT! Assist: OG Siakam
Score: 81-88

[06:47] Team_052 possession (Score: 81-88)
FOUL! Shooting foul on Franz Simmons. Jimmy Doncic to the line for 2 free throws. [Team fouls: 1] (Franz Simmons: 1 personal fouls)   FT 1/2: GOOD   FT 2/2: MISS Jimmy Doncic makes 1/2 from the line. Rebound secured by Franz Simmons.
Score: 81-89

[06:35] Team_051 possession (Score: 81-89)
Myles Harden drives and kicks out. Larry McGrady makes the Midrange and draws the foul on Josh Durant! And-1! Larry McGrady to the line for 1. [BONUS: 5 team fouls] (Josh Durant: 1 personal fouls)   FT 1/1: GOOD Larry McGrady makes 1/1 from the line.
Score: 84-89

[06:19] Team_052 possession (Score: 84-89)
Bones Morant attempts a 3Pt. Contested by OG Siakam (5.3 feet, MAN). Bones Morant misses. Rebound secured by Franz Simmons.

[06:04] Team_051 possession (Score: 84-89)
Franz Simmons drives and kicks out. OG Siakam attempts a 3Pt. Contested by Bones Morant (4.7 feet, ZONE). OG Siakam misses. Rebound secured by James Paul.

[05:50] Team_052 possession (Score: 84-89)
Bones Morant drives to the basket... Bones Morant loses the ball! Stripped by Franz Simmons! TURNOVER! (live ball)

[05:35] Team_051 possession (Score: 84-89)
Larry McGrady attempts a Midrange. Contested by Josh Durant (4.6 feet, MAN). Larry McGrady misses. Rebound secured by James Paul.

[05:21] Team_052 possession (Score: 84-89)
Carmelo Middleton attempts a Layup. BLOCKED BY FRANZ SIMMONS! Ball goes out off Franz Simmons. Carmelo Middleton's ball!

[05:10] Team_052 possession (Score: 84-89)
Josh Durant attempts a 3Pt. Contested by Myles Harden (4.3 feet, ZONE). JOSH DURANT MAKES IT! Assist: Carmelo Middleton
Score: 84-92

[04:58] Team_051 possession (Score: 84-92)
Shaquille Harden attempts a 3Pt. Contested by Bones Morant (4.7 feet, ZONE). Shaquille Harden misses. Rebound secured by James Paul.

[04:44] Team_052 possession (Score: 84-92)
Carmelo Middleton attempts a Layup. BLOCKED BY FRANZ SIMMONS! Ball is loose! Rebound secured by Shaquille Harden.

[04:29] Team_051 possession (Score: 84-92)
Myles Harden attempts a Layup. Contested by Jimmy Doncic (4.5 feet, MAN). MYLES HARDEN MAKES IT! Assist: Franz Simmons
Score: 86-92

[04:16] Team_052 possession (Score: 86-92)
FOUL! Shooting foul on Myles Harden. Jimmy Doncic to the line for 2 free throws. [Team fouls: 2] (Myles Harden: 1 personal fouls)   FT 1/2: GOOD   FT 2/2: GOOD Jimmy Doncic makes 2/2 from the line.
Score: 86-94

[03:59] Team_051 possession (Score: 86-94)
Shaquille Harden attempts a Layup. BLOCKED BY JIMMY DONCIC! Ball is loose! Rebound secured by Bones Morant.

[03:45] Team_052 possession (Score: 86-94)
FOUL! Holding foul on Shaquille Harden. [Team fouls: 3] No free throws, side out. (Shaquille Harden: 1 personal fouls)

[03:30] Team_052 possession (Score: 86-94)
Josh Durant drives to the basket... Josh Durant loses control! Ball rolls out of bounds! TURNOVER! (dead ball)

[03:30] Substitution (Team_051): Larry McGrady OUT → Zion Morant IN (stamina_rule2)

[03:30] Substitution (Team_051): OG Siakam OUT → Jrue Carter IN (stamina_rule2)

[03:30] Substitution (Team_051): Franz Simmons OUT → Tobias Jokic IN (stamina_rule2)

[03:30] Substitution (Team_051): Shaquille Harden OUT → Pau Tatum IN (stamina_rule2)

[03:30] Substitution (Team_052): Josh Durant OUT → Carmelo Giddey IN (stamina_rule2)

[03:30] Substitution (Team_052): Bones Morant OUT → Donovan Stewart IN (stamina_rule2)

[03:30] Substitution (Team_052): James Paul OUT → Jalen Haliburton IN (stamina_rule2)

[03:30] Substitution (Team_052): Carmelo Middleton OUT → Carmelo Beal IN (stamina_rule2)

[03:15] Team_051 possession (Score: 86-94)
Myles Harden attempts a Layup. Contested by Jimmy Doncic (4.6 feet, MAN). Myles Harden misses. Rebound secured by Donovan Stewart.

[02:58] Team_052 possession (Score: 86-94)
Jalen Haliburton attempts a Layup. BLOCKED BY TOBIAS JOKIC! Ball is loose! Rebound secured by Tobias Jokic.

[02:46] Team_051 possession (Score: 86-94)
Myles Harden attempts a 3Pt. Contested by Jalen Haliburton (4.3 feet, ZONE). MYLES HARDEN MAKES IT! Assist: Jrue Carter
Score: 89-94

[02:31] Team_052 possession (Score: 89-94)
Jalen Haliburton drives and kicks out. Carmelo Giddey attempts a 3Pt. Contested by Zion Morant (5.6 feet, MAN). Carmelo Giddey misses. Rebound secured by Jrue Carter.

[02:15] Team_051 possession (Score: 89-94)
Zion Morant attempts a 3Pt. Contested by Jalen Haliburton (4.8 feet, ZONE). Zion Morant misses. FOUL! Loose ball foul on Donovan Stewart during the rebound battle. [IN THE BONUS! 6 team fouls] Tobias Jokic to the line for 2 free throws. (Donovan Stewart: 1 personal fouls)   FT 1/2: MISS   FT 2/2: GOOD Tobias Jokic makes 1/2 from the line.
Score: 90-94

[02:00] Team_052 possession (Score: 90-94)
Jimmy Doncic drives to the basket... Jimmy Doncic loses the ball! Stripped by Pau Tatum! TURNOVER! (live ball)

[01:41] Team_051 possession (Score: 90-94)
Pau Tatum makes the Layup and draws the foul on Carmelo Beal! And-1! Pau Tatum to the line for 1. [BONUS: 7 team fouls] (Carmelo Beal: 1 personal fouls)   FT 1/1: GOOD Pau Tatum makes 1/1 from the line.
Score: 93-94

[01:25] Team_052 possession (Score: 93-94)
Donovan Stewart attempts a Midrange. Contested by Jrue Carter (4.8 feet, ZONE). Donovan Stewart misses. Rebound secured by Pau Tatum.

[01:06] Team_051 possession (Score: 93-94)
Pau Tatum drives, Carmelo Beal stays with him. Pau Tatum attempts a Dunk. Contested by Carmelo Beal (3.4 feet, MAN). Pau Tatum misses. Rebound secured by Donovan Stewart.

[00:50] Team_052 possession (Score: 93-94)
Donovan Stewart attempts a 3Pt. Contested by Tobias Jokic (5.3 feet, ZONE). Donovan Stewart misses. Offensive rebound by Jalen Haliburton! Jalen Haliburton kicks it out.

[00:39] Team_052 possession (Score: 93-94)
Jalen Haliburton drives, Tobias Jokic stays with him. Jalen Haliburton attempts a Dunk. Contested by Tobias Jokic (5.4 feet, MAN). JALEN HALIBURTON MAKES IT! Assist: Carmelo Beal
Score: 93-96

[00:22] Team_051 possession (Score: 93-96)
Jrue Carter drives to the basket... Jrue Carter throws a bad pass! Stolen by Carmelo Beal! TURNOVER! (live ball)

[00:10] Team_052 possession (Score: 93-96)
Jimmy Doncic drives to the basket... FOUL! Offensive foul on Jimmy Doncic! Myles Harden drew the charge! [Team fouls: 8] (Jimmy Doncic: 1 personal fouls) TURNOVER! (dead ball)

================================================================================
                              4TH QUARTER COMPLETE                              
================================================================================

4TH QUARTER SCORE: Team_051 23, Team_052 15

BOX SCORE:
================================================================================

Team_051
--------------------------------------------------------------------------------
Player                MIN  PTS  REB  AST  TO      FG   FG%      3P   3P%
--------------------------------------------------------------------------------
Myles Harden           24    8    1    0   0   3/5    60.0     0/0   0.0
OG Siakam              33    3    1    1   0   1/1   100.0     0/0   0.0
Franz Simmons          33    3    3    1   0   1/3    33.3     0/0   0.0
Larry McGrady          33    3    0    0   0   1/2    50.0     0/0   0.0
Pau Tatum              15    3    1    0   0   1/2    50.0     0/0   0.0
Shaquille Harden       33    2    2    1   0   1/3    33.3     0/0   0.0
Tobias Jokic           15    1    1    0   0   1/1   100.0     0/0   0.0
Jrue Carter            15    0    1    1   0   0/0     0.0     0/0   0.0

TEAM: FG: 9/17 (52.9%), 3PT: 4/6 (66.7%), REB: 9 (0 off, 9 def), AST: 4, TO: 3
TEAM FOULS: 3


Team_052
--------------------------------------------------------------------------------
Player                MIN  PTS  REB  AST  TO      FG   FG%      3P   3P%
--------------------------------------------------------------------------------
James Paul             33    5    5    0   0   2/4    50.0     0/0   0.0
Josh Durant            33    3    0    0   0   1/3    33.3     0/0   0.0
Carmelo Middleton      33    2    1    1   0   1/2    50.0     0/0   0.0
Jimmy Doncic           24    2    0    1   0   1/2    50.0     0/0   0.0
Jalen Haliburton       15    2    1    0   0   1/3    33.3     0/0   0.0
Bones Morant           33    0    3    1   0   0/1     0.0     0/0   0.0
Donovan Stewart        15    0    2    0   0   0/1     0.0     0/0   0.0
Carmelo Beal           15    0    0    1   0   0/0     0.0     0/0   0.0

TEAM: FG: 6/16 (37.5%), 3PT: 2/6 (33.3%), REB: 13 (5 off, 8 def), AST: 4, TO: 4
TEAM FOULS: 8 [Team_051 in BONUS]

================================================================================

================================================================================
                               FULL GAME COMPLETE                               
================================================================================

FINAL SCORE: Team_051 93, Team_052 96

SCORING BY QUARTER:
--------------------------------------------------------------------------------
Team                     Q1     Q2     Q3     Q4    FINAL
--------------------------------------------------------------------------------
Team_051                 17     28     25     23       93
Team_052                 35     24     22     15       96
--------------------------------------------------------------------------------

FULL GAME BOX SCORE:
================================================================================

Team_051
--------------------------------------------------------------------------------
Player                MIN  PTS  REB  AST  TO      FG   FG%      3P   3P%      FT STL BLK
--------------------------------------------------------------------------------
Larry McGrady          33   18    0    0   2   7/15   46.7   2/6    33.3   2/2     0   1
OG Siakam              33    8    7    3   4   3/6    50.0   1/3    33.3   1/3     0   1
Franz Simmons          33    8   10    2   2   3/7    42.9   1/2    50.0   1/1     2   2
Shaquille Harden       33   12    6    4   1   5/13   38.5   0/3     0.0   4/5     0   0
Austin Sexton          25    7    0    1   0   3/6    50.0   1/2    50.0   4/4     0   0
Myles Harden           24   10    2    0   2   5/10   50.0   2/4    50.0   0/0     0   0
Zion Morant            15    2    0    1   0   2/4    50.0   1/3    33.3   0/0     0   0
Jrue Carter            15    5    1    1   0   3/5    60.0   1/2    50.0   2/2     0   1
Tobias Jokic           15    4    7    2   1   2/2   100.0   1/1   100.0   1/2     0   1
Pau Tatum              15   17    6    1   0   6/8    75.0   0/0     0.0   1/2     3   1

TEAM: FG: 39/76 (51.3%), 3PT: 10/26 (38.5%), REB: 40 (9 off, 31 def), AST: 15, TO: 12


Team_052
--------------------------------------------------------------------------------
Player                MIN  PTS  REB  AST  TO      FG   FG%      3P   3P%      FT STL BLK
--------------------------------------------------------------------------------
Josh Durant            33   13    0    1   1   6/12   50.0   3/5    60.0   2/2     0   0
Bones Morant           33    6    8    4   3   4/7    57.1   2/4    50.0   1/2     0   0
James Paul             33   16   15    1   2   5/10   50.0   1/3    33.3   1/2     4   1
Carmelo Middleton      33   15   12    3   2   7/12   58.3   0/1     0.0   6/7     2   0
Gary Gasol             25   11    0    3   2   5/6    83.3   1/1   100.0   5/7     1   0
Jimmy Doncic           24    8    0    1   1   3/5    60.0   2/2   100.0   3/4     1   2
Carmelo Giddey         15    4    0    2   1   2/3    66.7   0/1     0.0   0/0     0   0
Donovan Stewart        15    5    6    3   0   2/3    66.7   1/1   100.0   0/0     0   0
Jalen Haliburton       15    6    4    0   1   2/6    33.3   0/0     0.0   4/4     0   0
Carmelo Beal           15    5    2    2   1   3/7    42.9   0/1     0.0   1/1     1   0

TEAM: FG: 39/72 (54.2%), 3PT: 10/19 (52.6%), REB: 46 (11 off, 35 def), AST: 20, TO: 14

================================================================================
