================================================================================
                        FULL GAME - Team_078 vs Team_060                        
================================================================================

================================================================================
                       1ST QUARTER - Team_078 vs Team_060                       
================================================================================

[12:00] Team_078 possession (Score: 0-0)
Ben Ginobili attempts a Midrange. Contested by Joel Morant (5.6 feet, ZONE). Ben Ginobili misses. Rebound secured by Immanuel Ming.

[11:48] Team_060 possession (Score: 0-0)
Joel Morant attempts a Midrange. Contested by Kyrie Carter (3.5 feet, ZONE). Joel Morant misses. Rebound secured by Ben Ginobili.

[11:31] Team_078 possession (Score: 0-0)
Ben Ginobili drives and kicks out. Isaiah Simmons attempts a Midrange. Contested by Immanuel Ming (3.7 feet, MAN). Isaiah Simmons misses. Rebound secured by Jaren George.

[11:13] Team_060 possession (Score: 0-0)
Julius Green makes the Layup and draws the foul on Jabari Barrett! And-1! Julius Green to the line for 1. [Team fouls: 1] (Jabari Barrett: 1 personal fouls)   FT 1/1: GOOD Julius Green makes 1/1 from the line.
Score: 0-3

[10:55] Team_078 possession (Score: 0-3)
Jabari Barrett attempts a Layup. Contested by Jaren George (5.2 feet, ZONE). JABARI BARRETT MAKES IT!
Score: 2-3

[10:39] Team_060 possession (Score: 2-3)
Jaren George attempts a Midrange. Contested by Isaiah Simmons (3.2 feet, ZONE). Jaren George misses. Rebound secured by Jabari Barrett.

[10:24] Team_078 possession (Score: 2-3)
FOUL! Shooting foul on Jaren George. Jabari Barrett to the line for 2 free throws. [Team fouls: 1] (Jaren George: 1 personal fouls)   FT 1/2: MISS   FT 2/2: GOOD Jabari Barrett makes 1/2 from the line.
Score: 3-3

[10:08] Team_060 possession (Score: 3-3)
FOUL! Holding foul on Kyrie Carter. [Team fouls: 2] No free throws, side out. (Kyrie Carter: 1 personal fouls)

[09:55] Team_060 possession (Score: 3-3)
Julius Green attempts a 3Pt. Contested by Isaiah Simmons (2.9 feet, ZONE). Julius Green misses. Rebound secured by Isaiah Simmons.

[09:39] Team_078 possession (Score: 3-3)
Kyrie Carter drives, picks up Julius Green. Help arrives from Immanuel Ming! Kyrie Carter attempts a Dunk. Contested by Immanuel Ming (3.7 feet, MAN). KYRIE CARTER MAKES IT! Assist: Ben Ginobili
Score: 5-3

[09:24] Team_060 possession (Score: 5-3)
Immanuel Ming attempts a Midrange. Contested by Isaiah Simmons (3.0 feet, MAN). Immanuel Ming misses. Rebound secured by Jabari Barrett.

[09:13] Team_078 possession (Score: 5-3)
Isaiah Simmons drives to the basket... Isaiah Simmons loses the ball! Stripped by Immanuel Ming! TURNOVER! (live ball)

[08:58] Team_060 possession (Score: 5-3)
Larry Westbrook attempts a 3Pt. Contested by Isaiah Simmons (3.5 feet, ZONE). Larry Westbrook misses. Rebound secured by Ben Ginobili.

[08:42] Team_078 possession (Score: 5-3)
Jabari Barnes loses control! Ball rolls out of bounds! TURNOVER! (dead ball)

[08:29] Team_060 possession (Score: 5-3)
FOUL! Holding foul on Kyrie Carter. [Team fouls: 3] No free throws, side out. (Kyrie Carter: 2 personal fouls)

[08:14] Team_060 possession (Score: 5-3)
Julius Green attempts a 3Pt. Contested by Kyrie Carter (3.6 feet, MAN). JULIUS GREEN MAKES IT! Assist: Joel Morant
Score: 5-6

[07:57] Team_078 possession (Score: 5-6)
Kyrie Carter attempts a 3Pt. Contested by Julius Green (3.7 feet, ZONE). Kyrie Carter misses. Rebound secured by Jaren George.

[07:41] Team_060 possession (Score: 5-6)
FOUL! Shooting foul on Ben Ginobili. Julius Green to the line for 2 free throws. [Team fouls: 4] (Ben Ginobili: 1 personal fouls)   FT 1/2: GOOD   FT 2/2: GOOD Julius Green makes 2/2 from the line.
Score: 5-8

[07:31] Team_078 possession (Score: 5-8)
FOUL! Reach-in foul on Jaren George during the drive. [Team fouls: 2] No free throws, side out. (Jaren George: 2 personal fouls)

[07:16] Team_078 possession (Score: 5-8)
Jabari Barrett drives, picks up Jaren George. Help arrives from Julius Green! Jabari Barrett attempts a Layup. Contested by Julius Green (5.2 feet, MAN). JABARI BARRETT MAKES IT!
Score: 7-8

[07:02] Team_060 possession (Score: 7-8)
Immanuel Ming drives and kicks out. Immanuel Ming attempts a 3Pt. Contested by Isaiah Simmons (3.0 feet, ZONE). Immanuel Ming misses. Rebound secured by Isaiah Simmons.

[06:47] Team_078 possession (Score: 7-8)
Jabari Barrett drives and kicks out. Ben Ginobili attempts a 3Pt. Contested by Julius Green (3.8 feet, ZONE). Ben Ginobili misses. Offensive rebound by Jabari Barrett! Jabari Barrett kicks it out.

[06:32] Team_078 possession (Score: 7-8)
Jabari Barnes attempts a 3Pt. Contested by Joel Morant (5.7 feet, MAN). Jabari Barnes misses. Rebound secured by Immanuel Ming.

[06:16] Team_060 possession (Score: 7-8)
Larry Westbrook attempts a 3Pt. Contested by Ben Ginobili (5.1 feet, MAN). LARRY WESTBROOK MAKES IT! Assist: Joel Morant
Score: 7-11

[05:59] Team_078 possession (Score: 7-11)
Ben Ginobili drives to the basket... Ben Ginobili throws a bad pass out of bounds! TURNOVER! (dead ball)

[05:46] Team_060 possession (Score: 7-11)
Julius Green attempts a Midrange. Contested by Kyrie Carter (3.6 feet, MAN). Julius Green misses. Rebound secured by Jabari Barrett.

[05:31] Team_078 possession (Score: 7-11)
Ben Ginobili drives, Jaren George stays with him. Ben Ginobili attempts a Dunk. Contested by Jaren George (5.5 feet, ZONE). Ben Ginobili misses. Rebound secured by Larry Westbrook.

[05:17] Team_060 possession (Score: 7-11)
Larry Westbrook attempts a Layup. Contested by Ben Ginobili (5.1 feet, MAN). Larry Westbrook misses. Rebound secured by Ben Ginobili.

[05:01] Team_078 possession (Score: 7-11)
Ben Ginobili attempts a 3Pt. Contested by Larry Westbrook (5.0 feet, MAN). Ben Ginobili misses. Offensive rebound by Jabari Barrett! Jabari Barrett kicks it out.

[04:45] Team_078 possession (Score: 7-11)
Kyrie Carter makes the Dunk and draws the foul on Immanuel Ming! And-1! Kyrie Carter to the line for 1. [Team fouls: 3] (Immanuel Ming: 1 personal fouls)   FT 1/1: GOOD Kyrie Carter makes 1/1 from the line.
Score: 10-11

[04:33] Team_060 possession (Score: 10-11)
Julius Green attempts a Layup. Contested by Jabari Barrett (4.5 feet, ZONE). JULIUS GREEN MAKES IT!
Score: 10-13

[04:21] Team_078 possession (Score: 10-13)
Jabari Barnes attempts a 3Pt. Contested by Julius Green (4.2 feet, ZONE). Jabari Barnes misses. Rebound secured by Larry Westbrook.

[04:07] Team_060 possession (Score: 10-13)
Larry Westbrook attempts a Midrange. Contested by Ben Ginobili (5.2 feet, MAN). Larry Westbrook misses. Rebound secured by Isaiah Simmons.

[03:51] Team_078 possession (Score: 10-13)
Jabari Barnes attempts a 3Pt. Contested by Joel Morant (5.8 feet, ZONE). JABARI BARNES MAKES IT!
Score: 13-13

[03:36] Team_060 possession (Score: 13-13)
Julius Green attempts a 3Pt. Contested by Isaiah Simmons (3.0 feet, ZONE). Julius Green misses. Offensive rebound by Immanuel Ming! Immanuel Ming kicks it out.

[03:21] Team_060 possession (Score: 13-13)
Immanuel Ming attempts a 3Pt. Contested by Isaiah Simmons (3.2 feet, MAN). Immanuel Ming misses. Rebound secured by Isaiah Simmons.

[03:09] Team_078 possession (Score: 13-13)
Jabari Barrett attempts a 3Pt. Contested by Jaren George (5.4 feet, MAN). Jabari Barrett misses. Rebound secured by Immanuel Ming.

[02:57] Team_060 possession (Score: 13-13)
Immanuel Ming attempts a 3Pt. Contested by Isaiah Simmons (3.2 feet, MAN). Immanuel Ming misses. Rebound secured by Ben Ginobili.

[02:44] Team_078 possession (Score: 13-13)
Jabari Barrett attempts a Midrange. Contested by Jaren George (5.4 feet, MAN). JABARI BARRETT MAKES IT! Assist: Isaiah Simmons
Score: 15-13

[02:32] Team_060 possession (Score: 15-13)
FOUL! Reach-in foul on Jabari Barrett during the drive. [IN THE BONUS! 5 team fouls] Joel Morant to the line for 2 free throws. (Jabari Barrett: 2 personal fouls)   FT 1/2: GOOD   FT 2/2: GOOD Joel Morant makes 2/2 from the line.
Score: 15-15

[02:20] Team_078 possession (Score: 15-15)
Jabari Barnes attempts a Midrange. Contested by Joel Morant (5.9 feet, MAN). JABARI BARNES MAKES IT! Assist: Isaiah Simmons
Score: 17-15

[02:04] Team_060 possession (Score: 17-15)
FOUL! Shooting foul on Isaiah Simmons. Immanuel Ming to the line for 2 free throws. [BONUS: 6 team fouls] (Isaiah Simmons: 1 personal fouls)   FT 1/2: GOOD   FT 2/2: MISS Immanuel Ming makes 1/2 from the line. FOUL! Loose ball foul on Isaiah Simmons during the free throw rebound! [IN THE BONUS! 7 team fouls] Jaren George to the line for 2 free throws. (Isaiah Simmons: 2 personal fouls)   FT 1/2: GOOD   FT 2/2: MISS Jaren George makes 1/2 from the line. Rebound secured by Isaiah Simmons.
Score: 17-17

[01:50] Team_078 possession (Score: 17-17)
Kyrie Carter attempts a 3Pt. Contested by Julius Green (4.0 feet, MAN). Kyrie Carter misses. Rebound secured by Larry Westbrook.

[01:41] Team_060 possession (Score: 17-17)
Larry Westbrook drives to the basket... Larry Westbrook loses control! Ball rolls out of bounds! TURNOVER! (dead ball)

[01:41] Substitution (Team_078): Jabari Barnes OUT → Magic Barrett IN (stamina_rule2)

[01:41] Substitution (Team_078): Kyrie Carter OUT → Damian Allen IN (stamina_rule2)

[01:41] Substitution (Team_078): Isaiah Simmons OUT → Malcolm Randle IN (stamina_rule2)

[01:41] Substitution (Team_078): Ben Ginobili OUT → Paul Ming IN (stamina_rule2)

[01:41] Substitution (Team_078): Jabari Barrett OUT → Draymond Irving IN (stamina_rule2)

[01:41] Substitution (Team_060): Joel Morant OUT → Domantas Barnes IN (stamina_rule2)

[01:41] Substitution (Team_060): Julius Green OUT → Rudy Ginobili IN (stamina_rule2)

[01:41] Substitution (Team_060): Immanuel Ming OUT → Jarrett Wagner IN (stamina_rule2)

[01:41] Substitution (Team_060): Larry Westbrook OUT → Yao Tatum IN (stamina_rule2)

[01:41] Substitution (Team_060): Jaren George OUT → Klay Haliburton IN (stamina_rule2)

[01:26] Team_078 possession (Score: 17-17)
Damian Allen drives and kicks out. Paul Ming attempts a Midrange. Contested by Yao Tatum (5.2 feet, MAN). PAUL MING MAKES IT! Assist: Malcolm Randle
Score: 19-17

[01:12] Team_060 possession (Score: 19-17)
Klay Haliburton attempts a Midrange. Contested by Damian Allen (5.2 feet, ZONE). KLAY HALIBURTON MAKES IT!
Score: 19-19

[01:01] Team_078 possession (Score: 19-19)
FOUL! Holding foul on Yao Tatum. [Team fouls: 4] No free throws, side out. (Yao Tatum: 1 personal fouls)

[00:47] Team_078 possession (Score: 19-19)
Magic Barrett attempts a 3Pt. Contested by Domantas Barnes (5.1 feet, ZONE). Magic Barrett misses. Rebound secured by Rudy Ginobili.

[00:33] Team_060 possession (Score: 19-19)
Klay Haliburton drives, picks up Draymond Irving. Help arrives from Damian Allen! Klay Haliburton attempts a Dunk. Contested by Damian Allen (5.6 feet, MAN). Klay Haliburton misses. Rebound secured by Draymond Irving.

[00:19] Team_078 possession (Score: 19-19)
Damian Allen attempts a 3Pt. Contested by Rudy Ginobili (4.5 feet, MAN). Damian Allen misses. Rebound secured by Rudy Ginobili.

[00:05] Team_060 possession (Score: 19-19)
Yao Tatum attempts a Midrange. Contested by Paul Ming (4.3 feet, MAN). YAO TATUM MAKES IT!
Score: 19-21

================================================================================
                              1ST QUARTER COMPLETE                              
================================================================================

1ST QUARTER SCORE: Team_078 19, Team_060 21

BOX SCORE:
================================================================================

Team_078
--------------------------------------------------------------------------------
Player                MIN  PTS  REB  AST  TO      FG   FG%      3P   3P%
--------------------------------------------------------------------------------
Jabari Barrett         11    7    5    0   0   4/5    80.0     0/0   0.0
Kyrie Carter           11    5    0    0   0   2/4    50.0     0/0   0.0
Jabari Barnes          11    5    0    0   0   2/4    50.0     0/0   0.0
Paul Ming               2    2    0    0   0   1/1   100.0     0/0   0.0
Ben Ginobili           11    0    4    1   0   0/3     0.0     0/0   0.0
Isaiah Simmons         11    0    5    2   0   0/0     0.0     0/0   0.0
Malcolm Randle          2    0    0    1   0   0/0     0.0     0/0   0.0
Magic Barrett           2    0    0    0   0   0/1     0.0     0/0   0.0
Draymond Irving         2    0    1    0   0   0/0     0.0     0/0   0.0
Damian Allen            2    0    0    0   0   0/1     0.0     0/0   0.0

TEAM: FG: 9/19 (47.4%), 3PT: 1/8 (12.5%), REB: 15 (2 off, 13 def), AST: 4, TO: 3
TEAM FOULS: 7 [Team_060 in BONUS]


Team_060
--------------------------------------------------------------------------------
Player                MIN  PTS  REB  AST  TO      FG   FG%      3P   3P%
--------------------------------------------------------------------------------
Julius Green           11   10    0    0   0   4/6    66.7     0/0   0.0
Larry Westbrook        11    3    3    0   0   1/4    25.0     0/0   0.0
Joel Morant            11    2    0    2   0   1/2    50.0     0/0   0.0
Klay Haliburton         2    2    0    0   0   1/2    50.0     0/0   0.0
Yao Tatum               2    2    0    0   0   1/1   100.0     0/0   0.0
Immanuel Ming          11    0    4    0   0   0/5     0.0     0/0   0.0
Jaren George           11    0    2    0   0   0/1     0.0     0/0   0.0
Rudy Ginobili           2    0    2    0   0   0/0     0.0     0/0   0.0

TEAM: FG: 8/21 (38.1%), 3PT: 2/6 (33.3%), REB: 11 (1 off, 10 def), AST: 2, TO: 1
TEAM FOULS: 4

================================================================================

================================================================================
                       2ND QUARTER - Team_078 vs Team_060                       
================================================================================

[12:00] Team_078 possession (Score: 19-21)
Kyrie Carter drives to the basket... Kyrie Carter loses the ball! Stripped by Jaren George! TURNOVER! (live ball)

[11:43] Team_060 possession (Score: 19-21)
Immanuel Ming attempts a Layup. Contested by Isaiah Simmons (3.1 feet, MAN). Immanuel Ming misses. Rebound secured by Jabari Barrett.

[11:34] Team_078 possession (Score: 19-21)
Jabari Barrett drives to the basket... Jabari Barrett loses control! Ball rolls out of bounds! TURNOVER! (dead ball)

[11:22] Team_060 possession (Score: 19-21)
Joel Morant attempts a Layup. Contested by Jabari Barnes (3.8 feet, MAN). Joel Morant misses. FOUL! Loose ball foul on Jabari Barrett during the rebound battle. [Team fouls: 1] No free throws, side out. (Jabari Barrett: 1 personal fouls)

[11:10] Team_060 possession (Score: 19-21)
Immanuel Ming attempts a 3Pt. Contested by Isaiah Simmons (3.2 feet, ZONE). Immanuel Ming misses. Rebound secured by Ben Ginobili.

[10:56] Team_078 possession (Score: 19-21)
Ben Ginobili drives, Jaren George stays with him. Ben Ginobili attempts a Layup. Contested by Jaren George (5.7 feet, ZONE). Ben Ginobili misses. Rebound secured by Larry Westbrook.

[10:41] Team_060 possession (Score: 19-21)
Jaren George drives and kicks out. FOUL! Shooting foul on Isaiah Simmons. Joel Morant to the line for 3 free throws. [Team fouls: 2] (Isaiah Simmons: 1 personal fouls)   FT 1/3: GOOD   FT 2/3: GOOD   FT 3/3: GOOD Joel Morant makes 3/3 from the line.
Score: 19-24

[10:28] Team_078 possession (Score: 19-24)
Jabari Barnes attempts a 3Pt. Contested by Julius Green (4.4 feet, ZONE). JABARI BARNES MAKES IT! Assist: Ben Ginobili
Score: 22-24

[10:17] Team_060 possession (Score: 22-24)
FOUL! Reach-in foul on Kyrie Carter during the drive. [Team fouls: 3] No free throws, side out. (Kyrie Carter: 1 personal fouls)

[09:59] Team_060 possession (Score: 22-24)
Larry Westbrook drives, Jabari Barrett stays with him. Larry Westbrook attempts a Layup. Contested by Jabari Barrett (5.4 feet, ZONE). Larry Westbrook misses. Offensive rebound by Immanuel Ming! Immanuel Ming kicks it out.

[09:44] Team_060 possession (Score: 22-24)
Julius Green drives, picks up Jabari Barrett. Help arrives from Kyrie Carter! Julius Green attempts a Layup. Contested by Kyrie Carter (4.8 feet, ZONE). JULIUS GREEN MAKES IT!
Score: 22-26

[09:25] Team_078 possession (Score: 22-26)
FOUL! Shooting foul on Immanuel Ming. Ben Ginobili to the line for 2 free throws. [Team fouls: 1] (Immanuel Ming: 1 personal fouls)   FT 1/2: GOOD   FT 2/2: MISS Ben Ginobili makes 1/2 from the line. Rebound secured by Immanuel Ming.
Score: 23-26

[09:12] Team_060 possession (Score: 23-26)
Joel Morant attempts a 3Pt. Contested by Isaiah Simmons (3.1 feet, ZONE). JOEL MORANT MAKES IT! Assist: Jaren George
Score: 23-29

[08:55] Team_078 possession (Score: 23-29)
Jabari Barnes makes the Layup and draws the foul on Jaren George! And-1! Jabari Barnes to the line for 1. [Team fouls: 2] (Jaren George: 1 personal fouls)   FT 1/1: GOOD Jabari Barnes makes 1/1 from the line.
Score: 26-29

[08:39] Team_060 possession (Score: 26-29)
Julius Green drives, Kyrie Carter stays with him. Julius Green attempts a Dunk. Contested by Kyrie Carter (4.1 feet, MAN). Julius Green misses. Rebound secured by Isaiah Simmons.

[08:26] Team_078 possession (Score: 26-29)
FOUL! Holding foul on Julius Green. [Team fouls: 3] No free throws, side out. (Julius Green: 1 personal fouls)

[08:13] Team_078 possession (Score: 26-29)
Jabari Barrett attempts a 3Pt. Contested by Joel Morant (5.7 feet, ZONE). JABARI BARRETT MAKES IT! Assist: Jabari Barnes
Score: 29-29

[07:55] Team_060 possession (Score: 29-29)
Larry Westbrook attempts a 3Pt. Contested by Ben Ginobili (5.6 feet, MAN). Larry Westbrook misses. Rebound secured by Isaiah Simmons.

[07:43] Team_078 possession (Score: 29-29)
FOUL! Holding foul on Jaren George. [Team fouls: 4] No free throws, side out. (Jaren George: 2 personal fouls)

[07:25] Team_078 possession (Score: 29-29)
Jabari Barnes drives and kicks out. Jabari Barnes attempts a 3Pt. Contested by Joel Morant (5.9 feet, MAN). Jabari Barnes misses. Rebound secured by Jaren George.

[07:09] Team_060 possession (Score: 29-29)
Immanuel Ming drives, picks up Jabari Barrett. Help arrives from Kyrie Carter! Immanuel Ming attempts a Layup. Contested by Kyrie Carter (5.3 feet, ZONE). IMMANUEL MING MAKES IT! Assist: Larry Westbrook
Score: 29-31

[06:57] Team_078 possession (Score: 29-31)
Jabari Barnes attempts a Midrange. Contested by Julius Green (4.7 feet, ZONE). JABARI BARNES MAKES IT! Assist: Jabari Barrett
Score: 31-31

[06:40] Team_060 possession (Score: 31-31)
Joel Morant drives to the basket... Joel Morant loses control! Ball rolls out of bounds! TURNOVER! (dead ball)

[06:40] Substitution (Team_078): Jabari Barnes OUT → Magic Barrett IN (stamina_rule2)

[06:40] Substitution (Team_078): Kyrie Carter OUT → Damian Allen IN (stamina_rule2)

[06:40] Substitution (Team_078): Isaiah Simmons OUT → Malcolm Randle IN (stamina_rule2)

[06:40] Substitution (Team_078): Ben Ginobili OUT → Paul Ming IN (stamina_rule2)

[06:40] Substitution (Team_078): Jabari Barrett OUT → Draymond Irving IN (stamina_rule2)

[06:40] Substitution (Team_060): Joel Morant OUT → Domantas Barnes IN (stamina_rule2)

[06:40] Substitution (Team_060): Julius Green OUT → Rudy Ginobili IN (stamina_rule2)

[06:40] Substitution (Team_060): Immanuel Ming OUT → Jarrett Wagner IN (stamina_rule2)

[06:40] Substitution (Team_060): Larry Westbrook OUT → Yao Tatum IN (stamina_rule2)

[06:40] Substitution (Team_060): Jaren George OUT → Klay Haliburton IN (stamina_rule2)

[06:29] Team_078 possession (Score: 31-31)
Paul Ming attempts a 3Pt. Contested by Domantas Barnes (4.6 feet, ZONE). Paul Ming misses. Rebound secured by Rudy Ginobili.

[06:14] Team_060 possession (Score: 31-31)
Jarrett Wagner attempts a Midrange. Contested by Malcolm Randle (4.4 feet, MAN). Jarrett Wagner misses. Offensive rebound by Klay Haliburton! Klay Haliburton's putback is no good. Rebound secured by Draymond Irving.

[06:02] Team_078 possession (Score: 31-31)
Magic Barrett attempts a 3Pt. Contested by Domantas Barnes (5.1 feet, MAN). Magic Barrett misses. Rebound secured by Rudy Ginobili.

[05:47] Team_060 possession (Score: 31-31)
Rudy Ginobili attempts a 3Pt. Contested by Damian Allen (5.2 feet, ZONE). Rudy Ginobili misses. Rebound secured by Draymond Irving.

[05:32] Team_078 possession (Score: 31-31)
Draymond Irving attempts a Midrange. Contested by Yao Tatum (5.5 feet, ZONE). DRAYMOND IRVING MAKES IT! Assist: Damian Allen
Score: 33-31

[05:17] Team_060 possession (Score: 33-31)
Rudy Ginobili attempts a 3Pt. Contested by Malcolm Randle (4.5 feet, ZONE). Rudy Ginobili misses. Rebound secured by Paul Ming.

[05:03] Team_078 possession (Score: 33-31)
Malcolm Randle attempts a 3Pt. Contested by Jarrett Wagner (5.0 feet, MAN). MALCOLM RANDLE MAKES IT!
Score: 36-31

[04:50] Team_060 possession (Score: 36-31)
Jarrett Wagner attempts a 3Pt. Contested by Damian Allen (5.1 feet, ZONE). Jarrett Wagner misses. Rebound secured by Malcolm Randle.

[04:40] Team_078 possession (Score: 36-31)
Paul Ming attempts a Midrange. Contested by Domantas Barnes (4.6 feet, ZONE). Paul Ming misses. Rebound secured by Rudy Ginobili.

[04:29] Team_060 possession (Score: 36-31)
Domantas Barnes drives and kicks out. FOUL! Shooting foul on Magic Barrett. Yao Tatum to the line for 2 free throws. [Team fouls: 4] (Magic Barrett: 1 personal fouls)   FT 1/2: MISS   FT 2/2: GOOD Yao Tatum makes 1/2 from the line.
Score: 36-32

[04:16] Team_078 possession (Score: 36-32)
Draymond Irving attempts a Midrange. Contested by Klay Haliburton (4.6 feet, MAN). Draymond Irving misses. Rebound secured by Rudy Ginobili.

[04:06] Team_060 possession (Score: 36-32)
Jarrett Wagner attempts a Layup. BLOCKED BY PAUL MING! Ball is loose! Offensive rebound by Domantas Barnes! Domantas Barnes kicks it out.

[03:55] Team_060 possession (Score: 36-32)
Domantas Barnes drives to the basket... Domantas Barnes loses the ball! Stripped by Magic Barrett! TURNOVER! (live ball)

[03:44] Team_078 possession (Score: 36-32)
Magic Barrett attempts a 3Pt. Contested by Domantas Barnes (5.1 feet, MAN). Magic Barrett misses. Offensive rebound by Draymond Irving! Draymond Irving kicks it out.

[03:32] Team_078 possession (Score: 36-32)
FOUL! Shooting foul on Domantas Barnes. Magic Barrett to the line for 3 free throws. [BONUS: 5 team fouls] (Domantas Barnes: 1 personal fouls)   FT 1/3: GOOD   FT 2/3: GOOD   FT 3/3: GOOD Magic Barrett makes 3/3 from the line.
Score: 39-32

[03:20] Team_060 possession (Score: 39-32)
Yao Tatum attempts a 3Pt. Contested by Paul Ming (4.3 feet, MAN). Yao Tatum misses. FOUL! Loose ball foul on Malcolm Randle during the rebound battle. [IN THE BONUS! 5 team fouls] Domantas Barnes to the line for 2 free throws. (Malcolm Randle: 1 personal fouls)   FT 1/2: GOOD   FT 2/2: MISS Domantas Barnes makes 1/2 from the line. Rebound secured by Draymond Irving.
Score: 39-33

[03:09] Team_078 possession (Score: 39-33)
Draymond Irving attempts a Layup. BLOCKED BY KLAY HALIBURTON! Ball deflects out of bounds off Draymond Irving.

[02:55] Team_060 possession (Score: 39-33)
Rudy Ginobili attempts a Midrange. Contested by Damian Allen (5.2 feet, MAN). Rudy Ginobili misses. Rebound secured by Paul Ming.

[02:38] Team_078 possession (Score: 39-33)
Damian Allen attempts a 3Pt. Contested by Rudy Ginobili (4.5 feet, MAN). Damian Allen misses. Offensive rebound by Paul Ming! Paul Ming kicks it out.

[02:27] Team_078 possession (Score: 39-33)
Paul Ming attempts a Layup. BLOCKED BY YAO TATUM! Ball is loose! Rebound secured by Rudy Ginobili.

[02:12] Team_060 possession (Score: 39-33)
Klay Haliburton drives and kicks out. Jarrett Wagner attempts a 3Pt. Contested by Malcolm Randle (4.2 feet, MAN). Jarrett Wagner misses. Rebound secured by Paul Ming.

[02:02] Team_078 possession (Score: 39-33)
Paul Ming drives, Yao Tatum stays with him. Paul Ming attempts a Layup. Contested by Yao Tatum (5.2 feet, MAN). PAUL MING MAKES IT! Assist: Magic Barrett
Score: 41-33

[01:53] Team_060 possession (Score: 41-33)
Rudy Ginobili makes the 3Pt and draws the foul on Damian Allen! And-1! Rudy Ginobili to the line for 1. [BONUS: 6 team fouls] (Damian Allen: 1 personal fouls)   FT 1/1: MISS Rudy Ginobili makes 0/1 from the line. Rebound secured by Paul Ming.
Score: 41-36

[01:39] Team_078 possession (Score: 41-36)
Damian Allen drives and kicks out. Magic Barrett attempts a Midrange. Contested by Domantas Barnes (4.6 feet, MAN). Magic Barrett misses. Rebound secured by Klay Haliburton.

[01:25] Team_060 possession (Score: 41-36)
Yao Tatum makes the Layup and draws the foul on Paul Ming! And-1! Yao Tatum to the line for 1. [BONUS: 7 team fouls] (Paul Ming: 1 personal fouls)   FT 1/1: GOOD Yao Tatum makes 1/1 from the line.
Score: 41-39

[01:07] Team_078 possession (Score: 41-39)
FOUL! Offensive foul on Magic Barrett! Domantas Barnes drew the charge! [Team fouls: 8] (Magic Barrett: 2 personal fouls) TURNOVER! (dead ball)

[00:50] Team_060 possession (Score: 41-39)
Klay Haliburton drives, picks up Draymond Irving. Help arrives from Damian Allen! Klay Haliburton attempts a Dunk. Contested by Damian Allen (5.7 feet, MAN). KLAY HALIBURTON MAKES IT! Assist: Domantas Barnes
Score: 41-41

[00:37] Team_078 possession (Score: 41-41)
Paul Ming drives, Klay Haliburton stays with him. Paul Ming attempts a Dunk. Contested by Klay Haliburton (4.3 feet, ZONE). Paul Ming misses. Rebound secured by Klay Haliburton.

[00:18] Team_060 possession (Score: 41-41)
Klay Haliburton attempts a Midrange. Contested by Damian Allen (5.2 feet, ZONE). Klay Haliburton misses. Rebound secured by Draymond Irving.

[00:04] Team_078 possession (Score: 41-41)
Paul Ming attempts a Midrange. Contested by Yao Tatum (5.3 feet, MAN). Paul Ming misses. Offensive rebound by Draymond Irving! Draymond Irving kicks it out.

================================================================================
                              2ND QUARTER COMPLETE                              
================================================================================

2ND QUARTER SCORE: Team_078 22, Team_060 20

BOX SCORE:
================================================================================

Team_078
--------------------------------------------------------------------------------
Player                MIN  PTS  REB  AST  TO      FG   FG%      3P   3P%
--------------------------------------------------------------------------------
Jabari Barnes          16    8    0    1   0   3/4    75.0     0/0   0.0
Jabari Barrett         16    3    1    1   0   1/1   100.0     0/0   0.0
Magic Barrett           8    3    0    1   0   1/2    50.0     0/0   0.0
Malcolm Randle          8    3    1    0   0   1/1   100.0     0/0   0.0
Paul Ming               8    2    5    0   0   1/5    20.0     0/0   0.0
Draymond Irving         8    2    6    0   0   1/3    33.3     0/0   0.0
Ben Ginobili           16    0    1    1   0   0/2     0.0     0/0   0.0
Isaiah Simmons         16    0    2    0   0   0/0     0.0     0/0   0.0
Damian Allen            8    0    0    1   0   0/1     0.0     0/0   0.0

TEAM: FG: 8/19 (42.1%), 3PT: 4/6 (66.7%), REB: 14 (3 off, 11 def), AST: 5, TO: 3
TEAM FOULS: 8 [Team_060 in BONUS]


Team_060
--------------------------------------------------------------------------------
Player                MIN  PTS  REB  AST  TO      FG   FG%      3P   3P%
--------------------------------------------------------------------------------
Joel Morant            16    6    0    0   0   2/2   100.0     0/0   0.0
Yao Tatum               8    4    0    0   0   2/3    66.7     0/0   0.0
Immanuel Ming          16    2    3    0   0   1/3    33.3     0/0   0.0
Julius Green           16    2    0    0   0   1/2    50.0     0/0   0.0
Klay Haliburton         8    2    2    0   0   1/3    33.3     0/0   0.0
Larry Westbrook        16    0    1    1   0   0/1     0.0     0/0   0.0
Jaren George           16    0    1    1   0   0/0     0.0     0/0   0.0
Rudy Ginobili           8    0    5    0   0   0/4     0.0     0/0   0.0
Jarrett Wagner          8    0    0    0   0   0/2     0.0     0/0   0.0
Domantas Barnes         8    0    1    1   0   0/0     0.0     0/0   0.0

TEAM: FG: 7/20 (35.0%), 3PT: 1/8 (12.5%), REB: 15 (5 off, 10 def), AST: 3, TO: 2
TEAM FOULS: 5 [Team_078 in BONUS]

================================================================================

================================================================================
                       3RD QUARTER - Team_078 vs Team_060                       
================================================================================

[12:00] Team_078 possession (Score: 41-41)
FOUL! Shooting foul on Joel Morant. Jabari Barnes to the line for 3 free throws. [Team fouls: 1] (Joel Morant: 1 personal fouls)   FT 1/3: MISS   FT 2/3: GOOD   FT 3/3: GOOD Jabari Barnes makes 2/3 from the line.
Score: 43-41

[11:50] Team_060 possession (Score: 43-41)
Jaren George attempts a Layup. Contested by Jabari Barrett (4.8 feet, MAN). JAREN GEORGE MAKES IT!
Score: 43-43

[11:32] Team_078 possession (Score: 43-43)
Kyrie Carter attempts a 3Pt. Contested by Julius Green (3.7 feet, ZONE). Kyrie Carter misses. Rebound secured by Immanuel Ming.

[11:19] Team_060 possession (Score: 43-43)
Jaren George attempts a Layup. BLOCKED BY JABARI BARRETT! Ball deflects out of bounds off Jaren George.

[11:03] Team_078 possession (Score: 43-43)
Ben Ginobili attempts a Midrange. Contested by Larry Westbrook (4.9 feet, ZONE). Ben Ginobili misses. Offensive rebound by Jabari Barrett! Jabari Barrett kicks it out.

[10:47] Team_078 possession (Score: 43-43)
FOUL! Shooting foul on Joel Morant. Jabari Barnes to the line for 2 free throws. [Team fouls: 2] (Joel Morant: 2 personal fouls)   FT 1/2: MISS   FT 2/2: GOOD Jabari Barnes makes 1/2 from the line.
Score: 44-43

[10:36] Team_060 possession (Score: 44-43)
FOUL! Reach-in foul on Jabari Barrett during the drive. [Team fouls: 1] No free throws, side out. (Jabari Barrett: 1 personal fouls)

[10:26] Team_060 possession (Score: 44-43)
Jaren George attempts a Midrange. Contested by Isaiah Simmons (3.2 feet, ZONE). Jaren George misses. Offensive rebound by Immanuel Ming! Immanuel Ming kicks it out.

[10:16] Team_060 possession (Score: 44-43)
Jaren George makes the Layup and draws the foul on Jabari Barrett! And-1! Jaren George to the line for 1. [Team fouls: 2] (Jabari Barrett: 2 personal fouls)   FT 1/1: GOOD Jaren George makes 1/1 from the line.
Score: 44-46

[10:01] Team_078 possession (Score: 44-46)
Jabari Barnes attempts a Midrange. Contested by Julius Green (4.2 feet, ZONE). JABARI BARNES MAKES IT! Assist: Kyrie Carter
Score: 46-46

[09:44] Team_060 possession (Score: 46-46)
Joel Morant drives and kicks out. FOUL! Shooting foul on Ben Ginobili. Immanuel Ming to the line for 2 free throws. [Team fouls: 3] (Ben Ginobili: 1 personal fouls)   FT 1/2: MISS   FT 2/2: GOOD Immanuel Ming makes 1/2 from the line.
Score: 46-47

[09:30] Team_078 possession (Score: 46-47)
Jabari Barrett drives and kicks out. Jabari Barrett attempts a 3Pt. Contested by Jaren George (5.2 feet, MAN). Jabari Barrett misses. Rebound secured by Larry Westbrook.

[09:15] Team_060 possession (Score: 46-47)
Jaren George attempts a Layup. Contested by Jabari Barrett (4.8 feet, ZONE). JAREN GEORGE MAKES IT! Assist: Larry Westbrook
Score: 46-49

[09:00] Team_078 possession (Score: 46-49)
Isaiah Simmons attempts a 3Pt. Contested by Immanuel Ming (3.9 feet, MAN). Isaiah Simmons misses. Rebound secured by Jaren George.

[08:46] Team_060 possession (Score: 46-49)
FOUL! Holding foul on Jabari Barrett. [Team fouls: 4] No free throws, side out. (Jabari Barrett: 3 personal fouls)

[08:31] Team_060 possession (Score: 46-49)
Immanuel Ming attempts a 3Pt. Contested by Isaiah Simmons (3.0 feet, ZONE). Immanuel Ming misses. Rebound secured by Isaiah Simmons.

[08:17] Team_078 possession (Score: 46-49)
Jabari Barnes drives and kicks out. Isaiah Simmons attempts a 3Pt. Contested by Julius Green (3.8 feet, ZONE). Isaiah Simmons misses. Rebound secured by Larry Westbrook.

[07:59] Team_060 possession (Score: 46-49)
FOUL! Reach-in foul on Jabari Barrett during the drive. [IN THE BONUS! 5 team fouls] Jaren George to the line for 2 free throws. (Jabari Barrett: 4 personal fouls)   FT 1/2: GOOD   FT 2/2: GOOD Jaren George makes 2/2 from the line.
Score: 46-51

[07:47] Team_078 possession (Score: 46-51)
Jabari Barnes makes the Layup and draws the foul on Immanuel Ming! And-1! Jabari Barnes to the line for 1. [Team fouls: 3] (Immanuel Ming: 1 personal fouls)   FT 1/1: MISS Jabari Barnes makes 0/1 from the line. FOUL! Loose ball foul on Larry Westbrook during the free throw rebound! [Team fouls: 4] No free throws, side out. (Larry Westbrook: 1 personal fouls)
Score: 48-51

[07:32] Team_078 possession (Score: 48-51)
Jabari Barnes attempts a Midrange. Contested by Jaren George (5.6 feet, ZONE). Jabari Barnes misses. Rebound secured by Jaren George.

[07:22] Team_060 possession (Score: 48-51)
Joel Morant attempts a 3Pt. Contested by Jabari Barnes (3.6 feet, MAN). Joel Morant misses. Rebound secured by Ben Ginobili.

[07:08] Team_078 possession (Score: 48-51)
Jabari Barnes drives and kicks out. Ben Ginobili attempts a 3Pt. Contested by Larry Westbrook (4.6 feet, MAN). Ben Ginobili misses. Rebound secured by Immanuel Ming.

[06:53] Team_060 possession (Score: 48-51)
Immanuel Ming drives to the basket... Immanuel Ming throws a bad pass out of bounds! TURNOVER! (dead ball)

[06:35] Team_078 possession (Score: 48-51)
FOUL! Holding foul on Julius Green. [IN THE BONUS! 5 team fouls] Kyrie Carter to the line for 2 free throws. (Julius Green: 1 personal fouls)   FT 1/2: GOOD   FT 2/2: GOOD Kyrie Carter makes 2/2 from the line.
Score: 50-51

[06:20] Team_060 possession (Score: 50-51)
Julius Green attempts a Midrange. Contested by Kyrie Carter (3.6 feet, MAN). JULIUS GREEN MAKES IT! Assist: Jaren George
Score: 50-53

[06:09] Team_078 possession (Score: 50-53)
Kyrie Carter drives to the basket... Kyrie Carter loses control! Ball rolls out of bounds! TURNOVER! (dead ball)

[05:53] Team_060 possession (Score: 50-53)
Jaren George drives to the basket... Jaren George loses the ball! Stripped by Jabari Barrett! TURNOVER! (live ball)

[05:43] Team_078 possession (Score: 50-53)
Ben Ginobili drives, picks up Larry Westbrook. Help arrives from Julius Green! Ben Ginobili attempts a Dunk. Contested by Julius Green (5.0 feet, MAN). BEN GINOBILI MAKES IT! Assist: Kyrie Carter
Score: 52-53

[05:26] Team_060 possession (Score: 52-53)
Joel Morant throws a bad pass out of bounds! TURNOVER! (dead ball)

[05:15] Team_078 possession (Score: 52-53)
Isaiah Simmons attempts a 3Pt. Contested by Julius Green (4.0 feet, ZONE). Isaiah Simmons misses. Rebound secured by Immanuel Ming.

[05:02] Team_060 possession (Score: 52-53)
Julius Green drives, Jabari Barrett stays with him. Julius Green attempts a Layup. Contested by Jabari Barrett (4.5 feet, ZONE). Julius Green misses. Rebound secured by Jabari Barrett.

[04:48] Team_078 possession (Score: 52-53)
FOUL! Shooting foul on Larry Westbrook. Ben Ginobili to the line for 2 free throws. [BONUS: 6 team fouls] (Larry Westbrook: 2 personal fouls)   FT 1/2: GOOD   FT 2/2: MISS Ben Ginobili makes 1/2 from the line. Rebound secured by Immanuel Ming.
Score: 53-53

[04:29] Team_060 possession (Score: 53-53)
FOUL! Reach-in foul on Jabari Barrett during the drive. [IN THE BONUS! 6 team fouls] Jaren George to the line for 2 free throws. (Jabari Barrett: 5 personal fouls)   FT 1/2: GOOD   FT 2/2: GOOD Jaren George makes 2/2 from the line.
Score: 53-55

[04:13] Team_078 possession (Score: 53-55)
Jabari Barrett attempts a Layup. Contested by Jaren George (5.3 feet, MAN). Jabari Barrett misses. Rebound secured by Immanuel Ming.

[04:04] Team_060 possession (Score: 53-55)
Larry Westbrook drives, Ben Ginobili stays with him. Larry Westbrook attempts a Dunk. Contested by Ben Ginobili (5.2 feet, MAN). Larry Westbrook misses. FOUL! Loose ball foul on Ben Ginobili during the rebound battle. [IN THE BONUS! 7 team fouls] Jaren George to the line for 2 free throws. (Ben Ginobili: 2 personal fouls)   FT 1/2: MISS   FT 2/2: GOOD Jaren George makes 1/2 from the line.
Score: 53-56

[03:51] Team_078 possession (Score: 53-56)
Ben Ginobili attempts a 3Pt. Contested by Immanuel Ming (4.0 feet, ZONE). BEN GINOBILI MAKES IT! Assist: Jabari Barrett
Score: 56-56

[03:39] Team_060 possession (Score: 56-56)
Immanuel Ming attempts a 3Pt. BLOCKED BY ISAIAH SIMMONS! Ball is loose! Rebound secured by Ben Ginobili.

[03:25] Team_078 possession (Score: 56-56)
Isaiah Simmons drives and kicks out. Kyrie Carter attempts a 3Pt. Contested by Julius Green (4.0 feet, MAN). Kyrie Carter misses. Rebound secured by Immanuel Ming.

[03:07] Team_060 possession (Score: 56-56)
FOUL! Reach-in foul on Kyrie Carter during the drive. [IN THE BONUS! 8 team fouls] Julius Green to the line for 2 free throws. (Kyrie Carter: 1 personal fouls)   FT 1/2: GOOD   FT 2/2: GOOD Julius Green makes 2/2 from the line.
Score: 56-58

[02:53] Team_078 possession (Score: 56-58)
Ben Ginobili attempts a Midrange. Contested by Larry Westbrook (5.2 feet, MAN). BEN GINOBILI MAKES IT!
Score: 58-58

[02:42] Team_060 possession (Score: 58-58)
Julius Green attempts a 3Pt. Contested by Kyrie Carter (3.9 feet, MAN). Julius Green misses. Rebound secured by Ben Ginobili.

[02:30] Team_078 possession (Score: 58-58)
Kyrie Carter drives, Larry Westbrook stays with him. Kyrie Carter attempts a Dunk. Contested by Larry Westbrook (4.9 feet, ZONE). Kyrie Carter misses. Offensive rebound by Jabari Barrett! Jabari Barrett kicks it out.

[02:14] Team_078 possession (Score: 58-58)
Kyrie Carter drives and kicks out. Kyrie Carter attempts a 3Pt. Contested by Julius Green (4.1 feet, MAN). Kyrie Carter misses. Rebound secured by Jaren George.

[01:59] Team_060 possession (Score: 58-58)
Joel Morant attempts a 3Pt. Contested by Isaiah Simmons (3.1 feet, ZONE). Joel Morant misses. Rebound secured by Isaiah Simmons.

[01:45] Team_078 possession (Score: 58-58)
Jabari Barrett attempts a Midrange. BLOCKED BY JAREN GEORGE! Ball is loose! Rebound secured by Jaren George.

[01:28] Team_060 possession (Score: 58-58)
FOUL! Shooting foul on Kyrie Carter. Julius Green to the line for 3 free throws. [BONUS: 9 team fouls] (Kyrie Carter: 2 personal fouls)   FT 1/3: GOOD   FT 2/3: GOOD   FT 3/3: GOOD Julius Green makes 3/3 from the line.
Score: 58-61

[01:14] Team_078 possession (Score: 58-61)
Ben Ginobili makes the Layup and draws the foul on Jaren George! And-1! Ben Ginobili to the line for 1. [BONUS: 7 team fouls] (Jaren George: 1 personal fouls)   FT 1/1: MISS Ben Ginobili makes 0/1 from the line. Offensive rebound by Jabari Barrett! Jabari Barrett kicks it out.
Score: 60-61

[00:59] Team_078 possession (Score: 60-61)
Ben Ginobili loses control! Ball rolls out of bounds! TURNOVER! (dead ball)

[00:59] Substitution (Team_078): Jabari Barnes OUT → Magic Barrett IN (stamina_rule2)

[00:59] Substitution (Team_078): Kyrie Carter OUT → Damian Allen IN (stamina_rule2)

[00:59] Substitution (Team_078): Isaiah Simmons OUT → Malcolm Randle IN (stamina_rule2)

[00:59] Substitution (Team_078): Ben Ginobili OUT → Paul Ming IN (stamina_rule2)

[00:59] Substitution (Team_078): Jabari Barrett OUT → Draymond Irving IN (stamina_rule2)

[00:59] Substitution (Team_060): Joel Morant OUT → Domantas Barnes IN (stamina_rule2)

[00:59] Substitution (Team_060): Julius Green OUT → Rudy Ginobili IN (stamina_rule2)

[00:59] Substitution (Team_060): Immanuel Ming OUT → Jarrett Wagner IN (stamina_rule2)

[00:59] Substitution (Team_060): Larry Westbrook OUT → Yao Tatum IN (stamina_rule2)

[00:59] Substitution (Team_060): Jaren George OUT → Klay Haliburton IN (stamina_rule2)

[00:49] Team_060 possession (Score: 60-61)
Klay Haliburton makes the Layup and draws the foul on Damian Allen! And-1! Klay Haliburton to the line for 1. [BONUS: 10 team fouls] (Damian Allen: 1 personal fouls)   FT 1/1: GOOD Klay Haliburton makes 1/1 from the line.
Score: 60-64

[00:32] Team_078 possession (Score: 60-64)
Paul Ming attempts a Midrange. Contested by Rudy Ginobili (4.4 feet, ZONE). PAUL MING MAKES IT! Assist: Damian Allen
Score: 62-64

[00:17] Team_060 possession (Score: 62-64)
Klay Haliburton attempts a Midrange. Contested by Draymond Irving (5.6 feet, MAN). KLAY HALIBURTON MAKES IT! Assist: Domantas Barnes
Score: 62-66

================================================================================
                              3RD QUARTER COMPLETE                              
================================================================================

3RD QUARTER SCORE: Team_078 21, Team_060 25

BOX SCORE:
================================================================================

Team_078
--------------------------------------------------------------------------------
Player                MIN  PTS  REB  AST  TO      FG   FG%      3P   3P%
--------------------------------------------------------------------------------
Ben Ginobili           27    7    3    0   0   3/4    75.0     0/0   0.0
Jabari Barnes          27    5    0    0   0   3/6    50.0     0/0   0.0
Kyrie Carter           27    2    0    2   0   1/3    33.3     0/0   0.0
Paul Ming               9    2    0    0   0   1/1   100.0     0/0   0.0
Jabari Barrett         27    0    5    1   0   0/3     0.0     0/0   0.0
Isaiah Simmons         27    0    2    0   0   0/3     0.0     0/0   0.0
Damian Allen            9    0    0    1   0   0/0     0.0     0/0   0.0

TEAM: FG: 8/20 (40.0%), 3PT: 2/5 (40.0%), REB: 10 (4 off, 6 def), AST: 4, TO: 2
TEAM FOULS: 10 [Team_060 in BONUS]


Team_060
--------------------------------------------------------------------------------
Player                MIN  PTS  REB  AST  TO      FG   FG%      3P   3P%
--------------------------------------------------------------------------------
Jaren George           27   12    4    1   0   6/7    85.7     0/0   0.0
Julius Green           27    7    0    0   0   3/5    60.0     0/0   0.0
Klay Haliburton         9    5    0    0   0   2/2   100.0     0/0   0.0
Immanuel Ming          27    1    7    0   0   1/3    33.3     0/0   0.0
Larry Westbrook        27    0    2    1   0   0/0     0.0     0/0   0.0
Joel Morant            27    0    0    0   0   0/2     0.0     0/0   0.0
Domantas Barnes         9    0    0    1   0   0/0     0.0     0/0   0.0

TEAM: FG: 12/19 (63.2%), 3PT: 1/6 (16.7%), REB: 13 (1 off, 12 def), AST: 3, TO: 3
TEAM FOULS: 7 [Team_078 in BONUS]

================================================================================

================================================================================
                       4TH QUARTER - Team_078 vs Team_060                       
================================================================================

[12:00] Team_078 possession (Score: 62-66)
FOUL! Shooting foul on Julius Green. Jabari Barrett to the line for 3 free throws. [Team fouls: 1] (Julius Green: 1 personal fouls)   FT 1/3: GOOD   FT 2/3: GOOD   FT 3/3: GOOD Jabari Barrett makes 3/3 from the line.
Score: 65-66

[11:49] Team_060 possession (Score: 65-66)
Jaren George attempts a 3Pt. Contested by Isaiah Simmons (3.4 feet, ZONE). Jaren George misses. FOUL! Loose ball foul on Ben Ginobili during the rebound battle. [Team fouls: 1] No free throws, side out. (Ben Ginobili: 1 personal fouls)

[11:33] Team_060 possession (Score: 65-66)
Immanuel Ming attempts a 3Pt. Contested by Isaiah Simmons (3.3 feet, MAN). Immanuel Ming misses. Offensive rebound by Jaren George! Jaren George puts it back in!
Score: 65-68

[11:20] Team_078 possession (Score: 65-68)
Jabari Barnes attempts a 3Pt. Contested by Julius Green (4.4 feet, ZONE). Jabari Barnes misses. Rebound secured by Immanuel Ming.

[11:04] Team_060 possession (Score: 65-68)
Jaren George makes the Layup and draws the foul on Jabari Barrett! And-1! Jaren George to the line for 1. [Team fouls: 2] (Jabari Barrett: 1 personal fouls)   FT 1/1: MISS Jaren George makes 0/1 from the line. Offensive rebound by Immanuel Ming! Immanuel Ming kicks it out.
Score: 65-70

[10:52] Team_060 possession (Score: 65-70)
Jaren George attempts a Midrange. Contested by Jabari Barrett (5.1 feet, MAN). JAREN GEORGE MAKES IT!
Score: 65-72

[10:38] Team_078 possession (Score: 65-72)
Ben Ginobili drives to the basket... Ben Ginobili loses control! Ball rolls out of bounds! TURNOVER! (dead ball)

[10:38] Substitution (Team_078): Jabari Barnes OUT → Magic Barrett IN (stamina_rule2)

[10:38] Substitution (Team_078): Kyrie Carter OUT → Damian Allen IN (stamina_rule2)

[10:38] Substitution (Team_078): Isaiah Simmons OUT → Malcolm Randle IN (stamina_rule2)

[10:38] Substitution (Team_078): Ben Ginobili OUT → Paul Ming IN (stamina_rule2)

[10:38] Substitution (Team_078): Jabari Barrett OUT → Draymond Irving IN (stamina_rule2)

[10:38] Substitution (Team_060): Joel Morant OUT → Domantas Barnes IN (stamina_rule2)

[10:38] Substitution (Team_060): Julius Green OUT → Rudy Ginobili IN (stamina_rule2)

[10:38] Substitution (Team_060): Larry Westbrook OUT → Yao Tatum IN (stamina_rule2)

[10:38] Substitution (Team_060): Jaren George OUT → Klay Haliburton IN (stamina_rule2)

[10:25] Team_060 possession (Score: 65-72)
Immanuel Ming makes the 3Pt and draws the foul on Malcolm Randle! And-1! Immanuel Ming to the line for 1. [Team fouls: 3] (Malcolm Randle: 1 personal fouls)   FT 1/1: GOOD Immanuel Ming makes 1/1 from the line.
Score: 65-76

[10:11] Team_078 possession (Score: 65-76)
Malcolm Randle attempts a Midrange. Contested by Immanuel Ming (4.2 feet, MAN). Malcolm Randle misses. Rebound secured by Klay Haliburton.

[09:51] Team_060 possession (Score: 65-76)
Immanuel Ming attempts a 3Pt. Contested by Malcolm Randle (4.2 feet, MAN). Immanuel Ming misses. Rebound secured by Malcolm Randle.

[09:32] Team_078 possession (Score: 65-76)
Draymond Irving attempts a Layup. Contested by Klay Haliburton (4.6 feet, ZONE). Draymond Irving misses. Rebound secured by Klay Haliburton.

[09:17] Team_060 possession (Score: 65-76)
Rudy Ginobili attempts a 3Pt. BLOCKED BY DAMIAN ALLEN! Ball is loose! Rebound secured by Malcolm Randle.

[09:05] Team_078 possession (Score: 65-76)
FOUL! Shooting foul on Klay Haliburton. Draymond Irving to the line for 2 free throws. [Team fouls: 2] (Klay Haliburton: 1 personal fouls)   FT 1/2: GOOD   FT 2/2: GOOD Draymond Irving makes 2/2 from the line.
Score: 67-76

[08:51] Team_060 possession (Score: 67-76)
Immanuel Ming attempts a 3Pt. Contested by Malcolm Randle (4.1 feet, MAN). Immanuel Ming misses. Rebound secured by Paul Ming.

[08:32] Team_078 possession (Score: 67-76)
Damian Allen attempts a 3Pt. Contested by Domantas Barnes (4.7 feet, ZONE). DAMIAN ALLEN MAKES IT! Assist: Magic Barrett
Score: 70-76

[08:13] Team_060 possession (Score: 70-76)
Immanuel Ming attempts a 3Pt. BLOCKED BY DAMIAN ALLEN! Ball is loose! Rebound secured by Paul Ming.

[08:01] Team_078 possession (Score: 70-76)
Paul Ming attempts a 3Pt. Contested by Yao Tatum (5.2 feet, MAN). Paul Ming misses. Offensive rebound by Draymond Irving! Draymond Irving kicks it out.

[07:45] Team_078 possession (Score: 70-76)
Draymond Irving attempts a Layup. Contested by Klay Haliburton (4.6 feet, MAN). Draymond Irving misses. Rebound secured by Domantas Barnes.

[07:30] Team_060 possession (Score: 70-76)
Immanuel Ming attempts a 3Pt. Contested by Damian Allen (4.8 feet, ZONE). IMMANUEL MING MAKES IT! Assist: Domantas Barnes
Score: 70-79

[07:16] Team_078 possession (Score: 70-79)
Magic Barrett attempts a 3Pt. Contested by Domantas Barnes (5.1 feet, MAN). Magic Barrett misses. Rebound secured by Klay Haliburton.

[07:02] Team_060 possession (Score: 70-79)
Klay Haliburton attempts a Midrange. Contested by Draymond Irving (5.6 feet, MAN). KLAY HALIBURTON MAKES IT! Assist: Immanuel Ming
Score: 70-81

[06:46] Team_078 possession (Score: 70-81)
Paul Ming drives and kicks out. Draymond Irving attempts a Midrange. Contested by Yao Tatum (5.2 feet, ZONE). Draymond Irving misses. Rebound secured by Klay Haliburton.

[06:32] Team_060 possession (Score: 70-81)
Klay Haliburton attempts a 3Pt. Contested by Malcolm Randle (4.5 feet, ZONE). Klay Haliburton misses. Rebound secured by Draymond Irving.

[06:12] Team_078 possession (Score: 70-81)
Paul Ming attempts a Midrange. Contested by Yao Tatum (5.2 feet, MAN). Paul Ming misses. Rebound secured by Klay Haliburton.

[06:00] Team_060 possession (Score: 70-81)
FOUL! Shooting foul on Damian Allen. Rudy Ginobili to the line for 2 free throws. [Team fouls: 4] (Damian Allen: 1 personal fouls)   FT 1/2: GOOD   FT 2/2: GOOD Rudy Ginobili makes 2/2 from the line.
Score: 70-83

[05:45] Team_078 possession (Score: 70-83)
FOUL! Shooting foul on Yao Tatum. Paul Ming to the line for 2 free throws. [Team fouls: 3] (Yao Tatum: 1 personal fouls)   FT 1/2: GOOD   FT 2/2: GOOD Paul Ming makes 2/2 from the line.
Score: 72-83

[05:30] Team_060 possession (Score: 72-83)
FOUL! Offensive foul on Domantas Barnes! Magic Barrett drew the charge! [Team fouls: 4] (Domantas Barnes: 1 personal fouls) TURNOVER! (dead ball)

[05:16] Team_078 possession (Score: 72-83)
Damian Allen attempts a 3Pt. Contested by Domantas Barnes (4.7 feet, ZONE). DAMIAN ALLEN MAKES IT! Assist: Draymond Irving
Score: 75-83

[04:57] Team_060 possession (Score: 75-83)
Domantas Barnes attempts a 3Pt. Contested by Magic Barrett (4.9 feet, MAN). Domantas Barnes misses. FOUL! Loose ball foul on Malcolm Randle during the rebound battle. [IN THE BONUS! 5 team fouls] Klay Haliburton to the line for 2 free throws. (Malcolm Randle: 2 personal fouls)   FT 1/2: GOOD   FT 2/2: MISS Klay Haliburton makes 1/2 from the line. Rebound secured by Draymond Irving.
Score: 75-84

[04:40] Team_078 possession (Score: 75-84)
FOUL! Holding foul on Rudy Ginobili. [IN THE BONUS! 5 team fouls] Damian Allen to the line for 2 free throws. (Rudy Ginobili: 1 personal fouls)   FT 1/2: GOOD   FT 2/2: GOOD Damian Allen makes 2/2 from the line.
Score: 77-84

[04:26] Team_060 possession (Score: 77-84)
Klay Haliburton attempts a Midrange. Contested by Malcolm Randle (4.5 feet, ZONE). Klay Haliburton misses. Rebound secured by Malcolm Randle.

[04:16] Team_078 possession (Score: 77-84)
Damian Allen attempts a 3Pt. Contested by Rudy Ginobili (4.5 feet, MAN). Damian Allen misses. Rebound secured by Klay Haliburton.

[04:03] Team_060 possession (Score: 77-84)
Klay Haliburton attempts a Layup. Contested by Draymond Irving (5.7 feet, MAN). KLAY HALIBURTON MAKES IT! Assist: Domantas Barnes
Score: 77-86

[03:50] Team_078 possession (Score: 77-86)
Magic Barrett attempts a Layup. Contested by Domantas Barnes (5.1 feet, MAN). MAGIC BARRETT MAKES IT!
Score: 79-86

[03:35] Team_060 possession (Score: 79-86)
Rudy Ginobili makes the Dunk and draws the foul on Paul Ming! And-1! Rudy Ginobili to the line for 1. [BONUS: 6 team fouls] (Paul Ming: 1 personal fouls)   FT 1/1: GOOD Rudy Ginobili makes 1/1 from the line.
Score: 79-89

[03:20] Team_078 possession (Score: 79-89)
Damian Allen makes the Dunk and draws the foul on Yao Tatum! And-1! Damian Allen to the line for 1. [BONUS: 6 team fouls] (Yao Tatum: 2 personal fouls)   FT 1/1: GOOD Damian Allen makes 1/1 from the line.
Score: 82-89

[03:04] Team_060 possession (Score: 82-89)
Immanuel Ming attempts a 3Pt. Contested by Damian Allen (4.8 feet, ZONE). Immanuel Ming misses. Rebound secured by Draymond Irving.

[02:54] Team_078 possession (Score: 82-89)
Malcolm Randle attempts a Layup. Contested by Immanuel Ming (5.2 feet, MAN). MALCOLM RANDLE MAKES IT! Assist: Damian Allen
Score: 84-89

[02:36] Team_060 possession (Score: 84-89)
Immanuel Ming drives to the basket... Immanuel Ming loses the ball! Stripped by Malcolm Randle! TURNOVER! (live ball)

[02:21] Team_078 possession (Score: 84-89)
Paul Ming attempts a Midrange. Contested by Yao Tatum (5.3 feet, MAN). Paul Ming misses. FOUL! Loose ball foul on Klay Haliburton during the rebound battle. [IN THE BONUS! 7 team fouls] Draymond Irving to the line for 2 free throws. (Klay Haliburton: 2 personal fouls)   FT 1/2: GOOD   FT 2/2: GOOD Draymond Irving makes 2/2 from the line.
Score: 86-89

[02:08] Team_060 possession (Score: 86-89)
Domantas Barnes attempts a 3Pt. Contested by Damian Allen (5.0 feet, ZONE). Domantas Barnes misses. Offensive rebound by Klay Haliburton! Klay Haliburton puts it back in!
Score: 86-91

[01:58] Team_078 possession (Score: 86-91)
Magic Barrett drives, picks up Domantas Barnes. Help arrives from Immanuel Ming! Magic Barrett attempts a Dunk. Contested by Immanuel Ming (5.2 feet, MAN). MAGIC BARRETT MAKES IT! Assist: Damian Allen
Score: 88-91

[01:43] Team_060 possession (Score: 88-91)
FOUL! Holding foul on Magic Barrett. [IN THE BONUS! 7 team fouls] Domantas Barnes to the line for 2 free throws. (Magic Barrett: 1 personal fouls)   FT 1/2: MISS   FT 2/2: GOOD Domantas Barnes makes 1/2 from the line.
Score: 88-92

[01:28] Team_078 possession (Score: 88-92)
FOUL! Holding foul on Klay Haliburton. [IN THE BONUS! 8 team fouls] Draymond Irving to the line for 2 free throws. (Klay Haliburton: 3 personal fouls)   FT 1/2: GOOD   FT 2/2: GOOD Draymond Irving makes 2/2 from the line.
Score: 90-92

[01:09] Team_060 possession (Score: 90-92)
Yao Tatum attempts a 3Pt. Contested by Paul Ming (4.6 feet, MAN). Yao Tatum misses. Rebound secured by Malcolm Randle.

[00:53] Team_078 possession (Score: 90-92)
Draymond Irving makes the Dunk and draws the foul on Klay Haliburton! And-1! Draymond Irving to the line for 1. [BONUS: 9 team fouls] (Klay Haliburton: 4 personal fouls)   FT 1/1: MISS Draymond Irving makes 0/1 from the line. Offensive rebound by Draymond Irving! Draymond Irving kicks it out.
Score: 92-92

[00:37] Team_078 possession (Score: 92-92)
Malcolm Randle attempts a 3Pt. Contested by Immanuel Ming (5.5 feet, ZONE). Malcolm Randle misses. Rebound secured by Rudy Ginobili.

[00:20] Team_060 possession (Score: 92-92)
FOUL! Holding foul on Magic Barrett. [IN THE BONUS! 8 team fouls] Domantas Barnes to the line for 2 free throws. (Magic Barrett: 2 personal fouls)   FT 1/2: GOOD   FT 2/2: GOOD Domantas Barnes makes 2/2 from the line.
Score: 92-94

[00:08] Team_078 possession (Score: 92-94)
Magic Barrett makes the Midrange and draws the foul on Domantas Barnes! And-1! Magic Barrett to the line for 1. [BONUS: 10 team fouls] (Domantas Barnes: 2 personal fouls)   FT 1/1: MISS Magic Barrett makes 0/1 from the line. Rebound secured by Klay Haliburton.
Score: 94-94

================================================================================
                              4TH QUARTER COMPLETE                              
================================================================================

4TH QUARTER SCORE: Team_078 32, Team_060 28

BOX SCORE:
================================================================================

Team_078
--------------------------------------------------------------------------------
Player                MIN  PTS  REB  AST  TO      FG   FG%      3P   3P%
--------------------------------------------------------------------------------
Damian Allen           20   11    0    2   0   4/5    80.0     0/0   0.0
Draymond Irving        20    6    5    1   0   3/5    60.0     0/0   0.0
Magic Barrett          20    4    0    1   0   2/4    50.0     0/0   0.0
Jabari Barrett         29    3    0    0   0   1/1   100.0     0/0   0.0
Malcolm Randle         20    2    4    0   0   1/3    33.3     0/0   0.0
Paul Ming              20    2    2    0   0   1/3    33.3     0/0   0.0
Jabari Barnes          29    0    0    0   0   0/1     0.0     0/0   0.0

TEAM: FG: 12/22 (54.5%), 3PT: 3/7 (42.9%), REB: 10 (2 off, 8 def), AST: 4, TO: 1
TEAM FOULS: 8 [Team_060 in BONUS]


Team_060
--------------------------------------------------------------------------------
Player                MIN  PTS  REB  AST  TO      FG   FG%      3P   3P%
--------------------------------------------------------------------------------
Immanuel Ming          39    7    2    1   0   2/6    33.3     0/0   0.0
Klay Haliburton        20    6    8    0   0   3/5    60.0     0/0   0.0
Rudy Ginobili          20    5    1    0   0   2/3    66.7     0/0   0.0
Jaren George           29    4    2    0   0   2/2   100.0     0/0   0.0
Domantas Barnes        20    3    1    2   0   2/3    66.7     0/0   0.0
Yao Tatum              20    0    0    0   0   0/1     0.0     0/0   0.0

TEAM: FG: 11/20 (55.0%), 3PT: 4/12 (33.3%), REB: 15 (5 off, 10 def), AST: 3, TO: 2
TEAM FOULS: 10 [Team_078 in BONUS]

================================================================================

================================================================================
                               FULL GAME COMPLETE                               
================================================================================

FINAL SCORE: Team_078 94, Team_060 94

SCORING BY QUARTER:
--------------------------------------------------------------------------------
Team                     Q1     Q2     Q3     Q4    FINAL
--------------------------------------------------------------------------------
Team_078                 19     22     21     32       94
Team_060                 21     20     25     28       94
--------------------------------------------------------------------------------

FULL GAME BOX SCORE:
================================================================================

Team_078
--------------------------------------------------------------------------------
Player                MIN  PTS  REB  AST  TO      FG   FG%      3P   3P%      FT STL BLK
--------------------------------------------------------------------------------
Jabari Barnes          29   18    0    1   2   8/15   53.3   3/6    50.0   4/7     0   0
Kyrie Carter           29    7    0    2   0   2/6    33.3   0/3     0.0   3/3     0   0
Isaiah Simmons         29    0    9    2   1   0/3     0.0   0/2     0.0   0/0     0   1
Ben Ginobili           29    7    8    2   2   3/9    33.3   1/1   100.0   2/5     0   0
Jabari Barrett         29   13   11    2   3   6/10   60.0   2/3    66.7   4/5     1   1
Magic Barrett          20    7    0    2   1   3/7    42.9   1/4    25.0   3/4     1   0
Damian Allen           20   11    0    4   0   4/7    57.1   2/4    50.0   3/3     0   2
Malcolm Randle         20    5    5    1   0   2/4    50.0   1/2    50.0   0/0     1   0
Paul Ming              20    8    7    0   0   4/10   40.0   0/1     0.0   2/2     0   1
Draymond Irving        20    8   12    1   0   2/6    33.3   0/0     0.0   6/7     0   0

TEAM: FG: 37/80 (46.2%), 3PT: 10/26 (38.5%), REB: 49 (11 off, 38 def), AST: 17, TO: 9


Team_060
--------------------------------------------------------------------------------
Player                MIN  PTS  REB  AST  TO      FG   FG%      3P   3P%      FT STL BLK
--------------------------------------------------------------------------------
Immanuel Ming          39   10   16    1   1   4/17   23.5   3/12   25.0   3/5     1   0
Joel Morant            29    8    0    2   1   3/6    50.0   1/3    33.3   5/5     0   0
Julius Green           29   19    0    0   0   8/13   61.5   2/4    50.0   8/8     0   0
Larry Westbrook        29    3    6    2   1   2/6    33.3   1/3    33.3   0/0     0   0
Jaren George           29   16    9    2   2   7/9    77.8   0/0     0.0   6/8     1   1
Domantas Barnes        20    3    2    4   1   2/3    66.7   1/2    50.0   4/6     0   0
Rudy Ginobili          20    5    8    0   0   2/7    28.6   0/4     0.0   3/4     0   0
Yao Tatum              20    6    0    0   0   2/4    50.0   0/2     0.0   2/3     0   1
Klay Haliburton        20   15   10    0   1   6/11   54.5   0/1     0.0   2/3     0   1
Jarrett Wagner          9    0    0    0   1   0/2     0.0   0/1     0.0   0/0     0   0

TEAM: FG: 38/80 (47.5%), 3PT: 8/32 (25.0%), REB: 54 (12 off, 42 def), AST: 11, TO: 8

================================================================================
