================================================================================
                        FULL GAME - Team_054 vs Team_052                        
================================================================================

================================================================================
                       1ST QUARTER - Team_054 vs Team_052                       
================================================================================

[12:00] Team_054 possession (Score: 0-0)
Vince Ball drives and kicks out. Blake Russell makes the 3Pt and draws the foul on Bones Morant! And-1! Blake Russell to the line for 1. [Team fouls: 1] (Bones Morant: 1 personal fouls)   FT 1/1: GOOD Blake Russell makes 1/1 from the line.
Score: 4-0

[11:46] Team_052 possession (Score: 4-0)
Carmelo Middleton drives and kicks out. Bones Morant attempts a 3Pt. Contested by Vince Ball (4.1 feet, MAN). Bones Morant misses. Rebound secured by Luka Brogdon.

[11:30] Team_054 possession (Score: 4-0)
Malcolm Harden attempts a Layup. Contested by James Paul (3.7 feet, ZONE). MALCOLM HARDEN MAKES IT! Assist: Blake Russell
Score: 6-0

[11:15] Team_052 possession (Score: 6-0)
Josh Durant attempts a Midrange. Contested by Lauri Irving (3.2 feet, MAN). Josh Durant misses. Rebound secured by Blake Russell.

[10:59] Team_054 possession (Score: 6-0)
Vince Ball makes the Layup and draws the foul on Bones Morant! And-1! Vince Ball to the line for 1. [Team fouls: 2] (Bones Morant: 2 personal fouls)   FT 1/1: MISS Vince Ball makes 0/1 from the line. Offensive rebound by Blake Russell! Blake Russell puts it back in!
Score: 10-0

[10:44] Team_052 possession (Score: 10-0)
FOUL! Offensive foul on Gary Gasol! Malcolm Harden drew the charge! [Team fouls: 3] (Gary Gasol: 1 personal fouls) TURNOVER! (dead ball)

[10:28] Team_054 possession (Score: 10-0)
Malcolm Harden attempts a 3Pt. Contested by Josh Durant (3.6 feet, ZONE). MALCOLM HARDEN MAKES IT! Assist: Vince Ball
Score: 13-0

[10:16] Team_052 possession (Score: 13-0)
FOUL! Shooting foul on Luka Brogdon. Carmelo Middleton to the line for 2 free throws. [Team fouls: 1] (Luka Brogdon: 1 personal fouls)   FT 1/2: GOOD   FT 2/2: MISS Carmelo Middleton makes 1/2 from the line. Rebound secured by Lauri Irving.
Score: 13-1

[10:04] Team_054 possession (Score: 13-1)
FOUL! Reach-in foul on Josh Durant during the drive. [Team fouls: 4] No free throws, side out. (Josh Durant: 1 personal fouls)

[09:45] Team_054 possession (Score: 13-1)
Luka Brogdon attempts a 3Pt. Contested by Bones Morant (4.0 feet, ZONE). Luka Brogdon misses. Rebound secured by Bones Morant.

[09:35] Team_052 possession (Score: 13-1)
Carmelo Middleton drives to the basket... Carmelo Middleton loses control! Ball rolls out of bounds! TURNOVER! (dead ball)

[09:24] Team_054 possession (Score: 13-1)
Blake Russell attempts a Midrange. Contested by Carmelo Middleton (4.8 feet, MAN). Blake Russell misses. Rebound secured by Carmelo Middleton.

[09:09] Team_052 possession (Score: 13-1)
Gary Gasol attempts a 3Pt. Contested by Lauri Irving (3.9 feet, ZONE). Gary Gasol misses. Rebound secured by Blake Russell.

[08:54] Team_054 possession (Score: 13-1)
Luka Brogdon drives, James Paul stays with him. Luka Brogdon attempts a Dunk. Contested by James Paul (3.8 feet, MAN). LUKA BROGDON MAKES IT!
Score: 15-1

[08:37] Team_052 possession (Score: 15-1)
James Paul drives, picks up Luka Brogdon. Help arrives from Lauri Irving! James Paul attempts a Layup. Contested by Lauri Irving (4.4 feet, MAN). JAMES PAUL MAKES IT! Assist: Gary Gasol
Score: 15-3

[08:23] Team_054 possession (Score: 15-3)
Malcolm Harden attempts a 3Pt. Contested by Gary Gasol (4.1 feet, MAN). MALCOLM HARDEN MAKES IT! Assist: Luka Brogdon
Score: 18-3

[08:13] Team_052 possession (Score: 18-3)
FOUL! Shooting foul on Vince Ball. Bones Morant to the line for 3 free throws. [Team fouls: 2] (Vince Ball: 1 personal fouls)   FT 1/3: MISS   FT 2/3: GOOD   FT 3/3: GOOD Bones Morant makes 2/3 from the line.
Score: 18-5

[07:58] Team_054 possession (Score: 18-5)
Blake Russell attempts a Midrange. Contested by Carmelo Middleton (4.8 feet, MAN). BLAKE RUSSELL MAKES IT!
Score: 20-5

[07:43] Team_052 possession (Score: 20-5)
Josh Durant attempts a 3Pt. Contested by Lauri Irving (3.2 feet, MAN). Josh Durant misses. Rebound secured by Blake Russell.

[07:30] Team_054 possession (Score: 20-5)
Malcolm Harden attempts a Midrange. Contested by Bones Morant (3.9 feet, ZONE). Malcolm Harden misses. Rebound secured by Bones Morant.

[07:15] Team_052 possession (Score: 20-5)
Carmelo Middleton makes the Dunk and draws the foul on Lauri Irving! And-1! Carmelo Middleton to the line for 1. [Team fouls: 3] (Lauri Irving: 1 personal fouls)   FT 1/1: GOOD Carmelo Middleton makes 1/1 from the line.
Score: 20-8

[07:05] Team_054 possession (Score: 20-8)
Luka Brogdon attempts a 3Pt. Contested by Bones Morant (4.0 feet, ZONE). Luka Brogdon misses. Offensive rebound by Luka Brogdon! Luka Brogdon kicks it out.

[06:51] Team_054 possession (Score: 20-8)
Luka Brogdon attempts a 3Pt. Contested by James Paul (3.8 feet, MAN). Luka Brogdon misses. Rebound secured by Carmelo Middleton.

[06:37] Team_052 possession (Score: 20-8)
Carmelo Middleton drives, Blake Russell stays with him. Carmelo Middleton attempts a Layup. Contested by Blake Russell (3.4 feet, ZONE). Carmelo Middleton misses. Offensive rebound by James Paul! James Paul puts it back in!
Score: 20-10

[06:25] Team_054 possession (Score: 20-10)
Luka Brogdon makes the Dunk and draws the foul on James Paul! And-1! Luka Brogdon to the line for 1. [BONUS: 5 team fouls] (James Paul: 1 personal fouls)   FT 1/1: MISS Luka Brogdon makes 0/1 from the line. Rebound secured by James Paul.
Score: 22-10

[06:14] Team_052 possession (Score: 22-10)
James Paul attempts a 3Pt. Contested by Lauri Irving (3.8 feet, ZONE). James Paul misses. Offensive rebound by James Paul! James Paul's putback is no good. Rebound secured by Lauri Irving.

[06:00] Team_054 possession (Score: 22-10)
Luka Brogdon throws a bad pass! Stolen by James Paul! TURNOVER! (live ball)

[05:43] Team_052 possession (Score: 22-10)
Bones Morant attempts a 3Pt. Contested by Vince Ball (4.5 feet, MAN). BONES MORANT MAKES IT! Assist: James Paul
Score: 22-13

[05:31] Team_054 possession (Score: 22-13)
FOUL! Offensive foul on Vince Ball! Bones Morant drew the charge! [Team fouls: 4] (Vince Ball: 2 personal fouls) TURNOVER! (dead ball)

[05:16] Team_052 possession (Score: 22-13)
Carmelo Middleton drives, Blake Russell stays with him. Carmelo Middleton attempts a Dunk. Contested by Blake Russell (3.4 feet, ZONE). CARMELO MIDDLETON MAKES IT! Assist: Bones Morant
Score: 22-15

[04:59] Team_054 possession (Score: 22-15)
FOUL! Reach-in foul on Gary Gasol during the drive. [IN THE BONUS! 6 team fouls] Malcolm Harden to the line for 2 free throws. (Gary Gasol: 2 personal fouls)   FT 1/2: GOOD   FT 2/2: GOOD Malcolm Harden makes 2/2 from the line.
Score: 24-15

[04:44] Team_052 possession (Score: 24-15)
Gary Gasol drives, picks up Malcolm Harden. Help arrives from Lauri Irving! Gary Gasol attempts a Dunk. Contested by Lauri Irving (4.7 feet, MAN). GARY GASOL MAKES IT! Assist: Bones Morant
Score: 24-17

[04:27] Team_054 possession (Score: 24-17)
Malcolm Harden makes the Layup and draws the foul on Carmelo Middleton! And-1! Malcolm Harden to the line for 1. [BONUS: 7 team fouls] (Carmelo Middleton: 1 personal fouls)   FT 1/1: GOOD Malcolm Harden makes 1/1 from the line.
Score: 27-17

[04:10] Team_052 possession (Score: 27-17)
Gary Gasol attempts a Midrange. Contested by Malcolm Harden (4.7 feet, MAN). GARY GASOL MAKES IT! Assist: James Paul
Score: 27-19

[03:58] Team_054 possession (Score: 27-19)
FOUL! Shooting foul on Bones Morant. Malcolm Harden to the line for 3 free throws. [BONUS: 8 team fouls] (Bones Morant: 3 personal fouls)   FT 1/3: MISS   FT 2/3: MISS   FT 3/3: GOOD Malcolm Harden makes 1/3 from the line.
Score: 28-19

[03:43] Team_052 possession (Score: 28-19)
Carmelo Middleton drives to the basket... FOUL! Offensive foul on Carmelo Middleton! Blake Russell drew the charge! [Team fouls: 9] (Carmelo Middleton: 2 personal fouls) TURNOVER! (dead ball)

[03:24] Team_054 possession (Score: 28-19)
Vince Ball throws a bad pass! Stolen by Bones Morant! TURNOVER! (live ball)

[03:11] Team_052 possession (Score: 28-19)
James Paul attempts a Midrange. Contested by Luka Brogdon (4.5 feet, MAN). James Paul misses. Rebound secured by Vince Ball.

[02:59] Team_054 possession (Score: 28-19)
FOUL! Holding foul on Gary Gasol. [IN THE BONUS! 10 team fouls] Malcolm Harden to the line for 2 free throws. (Gary Gasol: 3 personal fouls)   FT 1/2: GOOD   FT 2/2: GOOD Malcolm Harden makes 2/2 from the line.
Score: 30-19

[02:45] Team_052 possession (Score: 30-19)
James Paul attempts a Midrange. Contested by Luka Brogdon (4.5 feet, MAN). JAMES PAUL MAKES IT! Assist: Carmelo Middleton
Score: 30-21

[02:29] Team_054 possession (Score: 30-21)
Vince Ball makes the 3Pt and draws the foul on Bones Morant! And-1! Vince Ball to the line for 1. [BONUS: 11 team fouls] (Bones Morant: 4 personal fouls)   FT 1/1: GOOD Vince Ball makes 1/1 from the line.
Score: 34-21

[02:12] Team_052 possession (Score: 34-21)
Gary Gasol attempts a Midrange. Contested by Malcolm Harden (4.9 feet, MAN). GARY GASOL MAKES IT!
Score: 34-23

[02:01] Team_054 possession (Score: 34-23)
FOUL! Shooting foul on Josh Durant. Malcolm Harden to the line for 2 free throws. [BONUS: 12 team fouls] (Josh Durant: 2 personal fouls)   FT 1/2: GOOD   FT 2/2: MISS Malcolm Harden makes 1/2 from the line. Rebound secured by Bones Morant.
Score: 35-23

[01:48] Team_052 possession (Score: 35-23)
Josh Durant drives, Blake Russell stays with him. Josh Durant attempts a Layup. Contested by Blake Russell (3.3 feet, ZONE). JOSH DURANT MAKES IT! Assist: James Paul
Score: 35-25

[01:31] Team_054 possession (Score: 35-25)
Lauri Irving attempts a 3Pt. Contested by Bones Morant (4.4 feet, ZONE). LAURI IRVING MAKES IT! Assist: Blake Russell
Score: 38-25

[01:18] Team_052 possession (Score: 38-25)
FOUL! Shooting foul on Blake Russell. James Paul to the line for 2 free throws. [BONUS: 5 team fouls] (Blake Russell: 1 personal fouls)   FT 1/2: GOOD   FT 2/2: GOOD James Paul makes 2/2 from the line.
Score: 38-27

[01:06] Team_054 possession (Score: 38-27)
Blake Russell attempts a Midrange. Contested by Josh Durant (4.1 feet, ZONE). Blake Russell misses. Rebound secured by James Paul.

[00:55] Team_052 possession (Score: 38-27)
Gary Gasol makes the Dunk and draws the foul on Lauri Irving! And-1! Gary Gasol to the line for 1. [BONUS: 6 team fouls] (Lauri Irving: 2 personal fouls)   FT 1/1: GOOD Gary Gasol makes 1/1 from the line.
Score: 38-30

[00:41] Team_054 possession (Score: 38-30)
FOUL! Reach-in foul on Bones Morant during the drive. [IN THE BONUS! 13 team fouls] Vince Ball to the line for 2 free throws. (Bones Morant: 5 personal fouls)   FT 1/2: GOOD   FT 2/2: GOOD Vince Ball makes 2/2 from the line.
Score: 40-30

[00:25] Team_052 possession (Score: 40-30)
James Paul attempts a 3Pt. Contested by Luka Brogdon (4.7 feet, MAN). James Paul misses. FOUL! Loose ball foul on Blake Russell during the rebound battle. [IN THE BONUS! 7 team fouls] James Paul to the line for 2 free throws. (Blake Russell: 2 personal fouls)   FT 1/2: MISS   FT 2/2: GOOD James Paul makes 1/2 from the line.
Score: 40-31

[00:11] Team_054 possession (Score: 40-31)
FOUL! Shooting foul on James Paul. Vince Ball to the line for 2 free throws. [BONUS: 14 team fouls] (James Paul: 2 personal fouls)   FT 1/2: GOOD   FT 2/2: GOOD Vince Ball makes 2/2 from the line.
Score: 42-31

================================================================================
                              1ST QUARTER COMPLETE                              
================================================================================

1ST QUARTER SCORE: Team_054 42, Team_052 31

BOX SCORE:
================================================================================

Team_054
--------------------------------------------------------------------------------
Player                MIN  PTS  REB  AST  TO      FG   FG%      3P   3P%
--------------------------------------------------------------------------------
Malcolm Harden         12   16    0    0   0   7/9    77.8     0/0   0.0
Blake Russell          12   10    3    2   0   3/5    60.0     0/0   0.0
Vince Ball             12    8    1    1   0   3/3   100.0     0/0   0.0
Lauri Irving           12    3    2    0   0   1/1   100.0     0/0   0.0
Luka Brogdon           12    2    2    1   0   1/4    25.0     0/0   0.0

TEAM: FG: 15/22 (68.2%), 3PT: 5/7 (71.4%), REB: 7 (1 off, 6 def), AST: 4, TO: 3
TEAM FOULS: 7 [Team_052 in BONUS]


Team_052
--------------------------------------------------------------------------------
Player                MIN  PTS  REB  AST  TO      FG   FG%      3P   3P%
--------------------------------------------------------------------------------
Gary Gasol             12    9    0    1   0   4/5    80.0     0/0   0.0
James Paul             12    9    3    3   0   5/7    71.4     0/0   0.0
Carmelo Middleton      12    5    2    1   0   2/4    50.0     0/0   0.0
Bones Morant           12    5    3    2   0   2/2   100.0     0/0   0.0
Josh Durant            12    2    0    0   0   1/3    33.3     0/0   0.0

TEAM: FG: 14/21 (66.7%), 3PT: 3/6 (50.0%), REB: 9 (2 off, 7 def), AST: 7, TO: 3
TEAM FOULS: 14 [Team_054 in BONUS]

================================================================================

================================================================================
                       2ND QUARTER - Team_054 vs Team_052                       
================================================================================

[12:00] Team_054 possession (Score: 42-31)
Blake Russell drives and kicks out. Lauri Irving attempts a 3Pt. Contested by Bones Morant (3.9 feet, ZONE). Lauri Irving misses. Rebound secured by James Paul.

[11:47] Team_052 possession (Score: 42-31)
Carmelo Middleton attempts a Layup. Contested by Blake Russell (3.8 feet, ZONE). Carmelo Middleton misses. Rebound secured by Blake Russell.

[11:33] Team_054 possession (Score: 42-31)
Blake Russell attempts a Midrange. Contested by James Paul (4.2 feet, ZONE). Blake Russell misses. Rebound secured by Bones Morant.

[11:22] Team_052 possession (Score: 42-31)
Carmelo Middleton drives to the basket... Carmelo Middleton throws a bad pass! Stolen by Blake Russell! TURNOVER! (live ball)

[11:04] Team_054 possession (Score: 42-31)
Luka Brogdon attempts a Layup. Contested by James Paul (4.2 feet, ZONE). LUKA BROGDON MAKES IT!
Score: 44-31

[10:49] Team_052 possession (Score: 44-31)
Bones Morant loses the ball! Stripped by Vince Ball! TURNOVER! (live ball)

[10:36] Team_054 possession (Score: 44-31)
Vince Ball attempts a Midrange. Contested by Bones Morant (4.2 feet, MAN). Vince Ball misses. Rebound secured by James Paul.

[10:18] Team_052 possession (Score: 44-31)
James Paul drives, picks up Luka Brogdon. Help arrives from Lauri Irving! James Paul attempts a Layup. Contested by Lauri Irving (4.7 feet, MAN). James Paul misses. Rebound secured by Blake Russell.

[09:59] Team_054 possession (Score: 44-31)
Vince Ball attempts a 3Pt. Contested by Bones Morant (4.2 feet, MAN). Vince Ball misses. Rebound secured by Bones Morant.

[09:42] Team_052 possession (Score: 44-31)
James Paul attempts a Layup. Contested by Luka Brogdon (4.8 feet, MAN). JAMES PAUL MAKES IT! Assist: Bones Morant
Score: 44-33

[09:28] Team_054 possession (Score: 44-33)
Vince Ball drives to the basket... Vince Ball loses the ball! Stripped by James Paul! TURNOVER! (live ball)

[09:10] Team_052 possession (Score: 44-33)
FOUL! Shooting foul on Malcolm Harden. James Paul to the line for 2 free throws. [Team fouls: 1] (Malcolm Harden: 1 personal fouls)   FT 1/2: GOOD   FT 2/2: GOOD James Paul makes 2/2 from the line.
Score: 44-35

[08:56] Team_054 possession (Score: 44-35)
Vince Ball drives, James Paul stays with him. Vince Ball attempts a Layup. Contested by James Paul (4.2 feet, ZONE). VINCE BALL MAKES IT! Assist: Malcolm Harden
Score: 46-35

[08:41] Team_052 possession (Score: 46-35)
Bones Morant drives and kicks out. Gary Gasol attempts a 3Pt. Contested by Malcolm Harden (4.9 feet, MAN). Gary Gasol misses. Rebound secured by Luka Brogdon.

[08:26] Team_054 possession (Score: 46-35)
Blake Russell makes the Layup and draws the foul on Carmelo Middleton! And-1! Blake Russell to the line for 1. [Team fouls: 1] (Carmelo Middleton: 1 personal fouls)   FT 1/1: GOOD Blake Russell makes 1/1 from the line.
Score: 49-35

[08:10] Team_052 possession (Score: 49-35)
Josh Durant drives, Lauri Irving stays with him. Josh Durant attempts a Dunk. Contested by Lauri Irving (4.0 feet, MAN). JOSH DURANT MAKES IT! Assist: Carmelo Middleton
Score: 49-37

[07:55] Team_054 possession (Score: 49-37)
Blake Russell attempts a Layup. Contested by Carmelo Middleton (5.5 feet, MAN). BLAKE RUSSELL MAKES IT! Assist: Vince Ball
Score: 51-37

[07:41] Team_052 possession (Score: 51-37)
FOUL! Shooting foul on Lauri Irving. Josh Durant to the line for 2 free throws. [Team fouls: 2] (Lauri Irving: 1 personal fouls)   FT 1/2: GOOD   FT 2/2: GOOD Josh Durant makes 2/2 from the line.
Score: 51-39

[07:26] Team_054 possession (Score: 51-39)
Lauri Irving makes the Dunk and draws the foul on Bones Morant! And-1! Lauri Irving to the line for 1. [Team fouls: 2] (Bones Morant: 1 personal fouls)   FT 1/1: MISS Lauri Irving makes 0/1 from the line. Rebound secured by Bones Morant.
Score: 53-39

[07:12] Team_052 possession (Score: 53-39)
Josh Durant drives and kicks out. Josh Durant attempts a 3Pt. Contested by Lauri Irving (4.5 feet, ZONE). JOSH DURANT MAKES IT! Assist: Gary Gasol
Score: 53-42

[07:00] Team_054 possession (Score: 53-42)
Malcolm Harden attempts a Midrange. Contested by Josh Durant (4.4 feet, ZONE). Malcolm Harden misses. Rebound secured by Carmelo Middleton.

[06:48] Team_052 possession (Score: 53-42)
Carmelo Middleton drives, picks up Blake Russell. Help arrives from Lauri Irving! Carmelo Middleton attempts a Dunk. Contested by Lauri Irving (4.6 feet, ZONE). Carmelo Middleton misses. Rebound secured by Luka Brogdon.

[06:35] Team_054 possession (Score: 53-42)
Lauri Irving drives and kicks out. FOUL! Shooting foul on James Paul. Luka Brogdon to the line for 2 free throws. [Team fouls: 3] (James Paul: 1 personal fouls)   FT 1/2: GOOD   FT 2/2: GOOD Luka Brogdon makes 2/2 from the line.
Score: 55-42

[06:24] Team_052 possession (Score: 55-42)
FOUL! Shooting foul on Blake Russell. Carmelo Middleton to the line for 2 free throws. [Team fouls: 3] (Blake Russell: 1 personal fouls)   FT 1/2: GOOD   FT 2/2: MISS Carmelo Middleton makes 1/2 from the line. Rebound secured by Luka Brogdon.
Score: 55-43

[06:07] Team_054 possession (Score: 55-43)
FOUL! Shooting foul on James Paul. Lauri Irving to the line for 2 free throws. [Team fouls: 4] (James Paul: 2 personal fouls)   FT 1/2: MISS   FT 2/2: GOOD Lauri Irving makes 1/2 from the line.
Score: 56-43

[05:50] Team_052 possession (Score: 56-43)
Bones Morant attempts a 3Pt. Contested by Lauri Irving (4.9 feet, ZONE). Bones Morant misses. Offensive rebound by Bones Morant! Bones Morant kicks it out.

[05:35] Team_052 possession (Score: 56-43)
Gary Gasol attempts a 3Pt. BLOCKED BY LAURI IRVING! Ball is loose! Offensive rebound by Bones Morant! Bones Morant kicks it out.

[05:22] Team_052 possession (Score: 56-43)
Bones Morant attempts a 3Pt. Contested by Lauri Irving (5.0 feet, ZONE). Bones Morant misses. FOUL! Loose ball foul on Vince Ball during the rebound battle. [Team fouls: 4] No free throws, side out. (Vince Ball: 1 personal fouls)

[05:05] Team_052 possession (Score: 56-43)
FOUL! Reach-in foul on Malcolm Harden during the drive. [IN THE BONUS! 5 team fouls] Gary Gasol to the line for 2 free throws. (Malcolm Harden: 2 personal fouls)   FT 1/2: GOOD   FT 2/2: MISS Gary Gasol makes 1/2 from the line. Rebound secured by Luka Brogdon.
Score: 56-44

[04:45] Team_054 possession (Score: 56-44)
Lauri Irving attempts a 3Pt. Contested by Gary Gasol (5.4 feet, ZONE). LAURI IRVING MAKES IT! Assist: Blake Russell
Score: 59-44

[04:28] Team_052 possession (Score: 59-44)
Bones Morant attempts a 3Pt. Contested by Vince Ball (5.4 feet, ZONE). Bones Morant misses. Rebound secured by Blake Russell.

[04:10] Team_054 possession (Score: 59-44)
FOUL! Shooting foul on Bones Morant. Luka Brogdon to the line for 3 free throws. [BONUS: 5 team fouls] (Bones Morant: 2 personal fouls)   FT 1/3: MISS   FT 2/3: MISS   FT 3/3: GOOD Luka Brogdon makes 1/3 from the line.
Score: 60-44

[03:55] Team_052 possession (Score: 60-44)
James Paul attempts a 3Pt. Contested by Lauri Irving (5.1 feet, ZONE). JAMES PAUL MAKES IT! Assist: Carmelo Middleton
Score: 60-47

[03:36] Team_054 possession (Score: 60-47)
Lauri Irving attempts a 3Pt. Contested by Bones Morant (5.4 feet, ZONE). Lauri Irving misses. Rebound secured by James Paul.

[03:19] Team_052 possession (Score: 60-47)
Gary Gasol attempts a 3Pt. Contested by Lauri Irving (5.3 feet, ZONE). GARY GASOL MAKES IT! Assist: James Paul
Score: 60-50

[03:04] Team_054 possession (Score: 60-50)
Luka Brogdon attempts a Midrange. Contested by James Paul (5.2 feet, ZONE). Luka Brogdon misses. FOUL! Loose ball foul on Carmelo Middleton during the rebound battle. [IN THE BONUS! 6 team fouls] Blake Russell to the line for 2 free throws. (Carmelo Middleton: 2 personal fouls)   FT 1/2: GOOD   FT 2/2: GOOD Blake Russell makes 2/2 from the line.
Score: 62-50

[02:47] Team_052 possession (Score: 62-50)
Carmelo Middleton commits a violation (traveling/carry)! TURNOVER! (dead ball)

[02:47] Substitution (Team_054): Malcolm Harden OUT → Shaquille Irving IN (stamina_rule2)

[02:47] Substitution (Team_054): Lauri Irving OUT → Bradley Quickley IN (stamina_rule2)

[02:47] Substitution (Team_054): Vince Ball OUT → Vince James IN (stamina_rule2)

[02:47] Substitution (Team_054): Luka Brogdon OUT → Tobias Nowitzki IN (stamina_rule2)

[02:47] Substitution (Team_054): Blake Russell OUT → Devin Jackson IN (stamina_rule2)

[02:47] Substitution (Team_052): Gary Gasol OUT → Jimmy Doncic IN (stamina_rule2)

[02:47] Substitution (Team_052): Josh Durant OUT → Carmelo Giddey IN (stamina_rule2)

[02:47] Substitution (Team_052): Bones Morant OUT → Donovan Stewart IN (stamina_rule2)

[02:47] Substitution (Team_052): James Paul OUT → Jalen Haliburton IN (stamina_rule2)

[02:47] Substitution (Team_052): Carmelo Middleton OUT → Carmelo Beal IN (stamina_rule2)

[02:34] Team_054 possession (Score: 62-50)
FOUL! Shooting foul on Carmelo Beal. Devin Jackson to the line for 2 free throws. [BONUS: 7 team fouls] (Carmelo Beal: 1 personal fouls)   FT 1/2: GOOD   FT 2/2: GOOD Devin Jackson makes 2/2 from the line.
Score: 64-50

[02:19] Team_052 possession (Score: 64-50)
Carmelo Beal attempts a Layup. Contested by Devin Jackson (5.1 feet, ZONE). CARMELO BEAL MAKES IT! Assist: Carmelo Giddey
Score: 64-52

[02:02] Team_054 possession (Score: 64-52)
Tobias Nowitzki attempts a Layup. Contested by Jalen Haliburton (4.5 feet, ZONE). TOBIAS NOWITZKI MAKES IT! Assist: Bradley Quickley
Score: 66-52

[01:47] Team_052 possession (Score: 66-52)
Jimmy Doncic attempts a 3Pt. Contested by Shaquille Irving (4.5 feet, ZONE). Jimmy Doncic misses. Rebound secured by Devin Jackson.

[01:30] Team_054 possession (Score: 66-52)
Vince James drives, Carmelo Beal stays with him. Vince James attempts a Dunk. Contested by Carmelo Beal (4.3 feet, ZONE). VINCE JAMES MAKES IT! Assist: Shaquille Irving
Score: 68-52

[01:18] Team_052 possession (Score: 68-52)
Jimmy Doncic attempts a Midrange. Contested by Shaquille Irving (4.5 feet, MAN). Jimmy Doncic misses. Rebound secured by Vince James.

[01:06] Team_054 possession (Score: 68-52)
Tobias Nowitzki loses control! Ball rolls out of bounds! TURNOVER! (dead ball)

[00:50] Team_052 possession (Score: 68-52)
Carmelo Giddey attempts a Midrange. Contested by Bradley Quickley (4.8 feet, MAN). Carmelo Giddey misses. Offensive rebound by Carmelo Beal! Carmelo Beal kicks it out.

[00:36] Team_052 possession (Score: 68-52)
Jalen Haliburton throws a bad pass! Stolen by Tobias Nowitzki! TURNOVER! (live ball)

[00:23] Team_054 possession (Score: 68-52)
FOUL! Shooting foul on Carmelo Giddey. Bradley Quickley to the line for 2 free throws. [BONUS: 8 team fouls] (Carmelo Giddey: 1 personal fouls)   FT 1/2: GOOD   FT 2/2: GOOD Bradley Quickley makes 2/2 from the line.
Score: 70-52

[00:08] Team_052 possession (Score: 70-52)
Carmelo Beal loses control! Ball rolls out of bounds! TURNOVER! (dead ball)

================================================================================
                              2ND QUARTER COMPLETE                              
================================================================================

2ND QUARTER SCORE: Team_054 28, Team_052 21

BOX SCORE:
================================================================================

Team_054
--------------------------------------------------------------------------------
Player                MIN  PTS  REB  AST  TO      FG   FG%      3P   3P%
--------------------------------------------------------------------------------
Blake Russell          22    7    3    1   0   3/5    60.0     0/0   0.0
Luka Brogdon           22    5    4    0   0   3/3   100.0     0/0   0.0
Lauri Irving           22    4    0    0   0   2/4    50.0     0/0   0.0
Vince Ball             22    2    0    1   0   1/3    33.3     0/0   0.0
Devin Jackson           3    2    1    0   0   1/1   100.0     0/0   0.0
Tobias Nowitzki         3    2    0    0   0   1/1   100.0     0/0   0.0
Bradley Quickley        3    2    0    1   0   1/1   100.0     0/0   0.0
Vince James             3    2    1    0   0   1/1   100.0     0/0   0.0
Malcolm Harden         22    0    0    1   0   0/1     0.0     0/0   0.0
Shaquille Irving        3    0    0    1   0   0/0     0.0     0/0   0.0

TEAM: FG: 13/20 (65.0%), 3PT: 2/4 (50.0%), REB: 9 (0 off, 9 def), AST: 5, TO: 2
TEAM FOULS: 5 [Team_052 in BONUS]


Team_052
--------------------------------------------------------------------------------
Player                MIN  PTS  REB  AST  TO      FG   FG%      3P   3P%
--------------------------------------------------------------------------------
James Paul             22    7    3    1   0   3/4    75.0     0/0   0.0
Josh Durant            22    7    0    0   0   3/3   100.0     0/0   0.0
Gary Gasol             22    3    0    1   0   1/2    50.0     0/0   0.0
Carmelo Beal            3    2    1    0   0   1/1   100.0     0/0   0.0
Carmelo Middleton      22    0    1    2   0   0/3     0.0     0/0   0.0
Bones Morant           22    0    6    1   0   0/2     0.0     0/0   0.0
Carmelo Giddey          3    0    0    1   0   0/0     0.0     0/0   0.0
Jimmy Doncic            3    0    0    0   0   0/2     0.0     0/0   0.0

TEAM: FG: 8/17 (47.1%), 3PT: 2/4 (50.0%), REB: 11 (4 off, 7 def), AST: 6, TO: 5
TEAM FOULS: 8 [Team_054 in BONUS]

================================================================================

================================================================================
                       3RD QUARTER - Team_054 vs Team_052                       
================================================================================

[12:00] Team_054 possession (Score: 70-52)
Vince Ball attempts a Layup. Contested by Bones Morant (3.7 feet, MAN). VINCE BALL MAKES IT! Assist: Malcolm Harden
Score: 72-52

[11:45] Team_052 possession (Score: 72-52)
Josh Durant drives and kicks out. Josh Durant attempts a 3Pt. Contested by Lauri Irving (3.4 feet, MAN). Josh Durant misses. Rebound secured by Luka Brogdon.

[11:30] Team_054 possession (Score: 72-52)
Blake Russell attempts a Midrange. Contested by Carmelo Middleton (4.8 feet, MAN). Blake Russell misses. Rebound secured by Carmelo Middleton.

[11:12] Team_052 possession (Score: 72-52)
Bones Morant drives and kicks out. Bones Morant attempts a Midrange. Contested by Luka Brogdon (4.0 feet, ZONE). BONES MORANT MAKES IT! Assist: James Paul
Score: 72-54

[10:55] Team_054 possession (Score: 72-54)
Blake Russell drives, picks up Carmelo Middleton. Help arrives from Josh Durant! Blake Russell attempts a Layup. Contested by Josh Durant (4.8 feet, MAN). BLAKE RUSSELL MAKES IT!
Score: 74-54

[10:38] Team_052 possession (Score: 74-54)
James Paul attempts a Midrange. Contested by Luka Brogdon (4.4 feet, MAN). JAMES PAUL MAKES IT! Assist: Gary Gasol
Score: 74-56

[10:26] Team_054 possession (Score: 74-56)
Vince Ball attempts a Layup. BLOCKED BY BONES MORANT! Ball is loose! Rebound secured by James Paul.

[10:13] Team_052 possession (Score: 74-56)
Josh Durant attempts a 3Pt. Contested by Lauri Irving (3.2 feet, MAN). JOSH DURANT MAKES IT!
Score: 74-59

[09:56] Team_054 possession (Score: 74-59)
Vince Ball attempts a 3Pt. Contested by Bones Morant (3.7 feet, MAN). Vince Ball misses. Rebound secured by Bones Morant.

[09:37] Team_052 possession (Score: 74-59)
FOUL! Reach-in foul on Vince Ball during the drive. [Team fouls: 1] No free throws, side out. (Vince Ball: 1 personal fouls)

[09:24] Team_052 possession (Score: 74-59)
Bones Morant attempts a 3Pt. Contested by Vince Ball (4.5 feet, MAN). Bones Morant misses. Rebound secured by Blake Russell.

[09:06] Team_054 possession (Score: 74-59)
Blake Russell attempts a Midrange. Contested by Carmelo Middleton (4.8 feet, MAN). Blake Russell misses. Rebound secured by Carmelo Middleton.

[08:49] Team_052 possession (Score: 74-59)
FOUL! Shooting foul on Malcolm Harden. Gary Gasol to the line for 2 free throws. [Team fouls: 2] (Malcolm Harden: 1 personal fouls)   FT 1/2: GOOD   FT 2/2: GOOD Gary Gasol makes 2/2 from the line.
Score: 74-61

[08:30] Team_054 possession (Score: 74-61)
Blake Russell makes the Layup and draws the foul on Carmelo Middleton! And-1! Blake Russell to the line for 1. [Team fouls: 1] (Carmelo Middleton: 1 personal fouls)   FT 1/1: GOOD Blake Russell makes 1/1 from the line.
Score: 77-61

[08:16] Team_052 possession (Score: 77-61)
Carmelo Middleton drives and kicks out. Josh Durant attempts a 3Pt. Contested by Lauri Irving (3.4 feet, ZONE). Josh Durant misses. Offensive rebound by James Paul! James Paul's putback is no good. Offensive rebound by James Paul! James Paul kicks it out.

[07:57] Team_052 possession (Score: 77-61)
Gary Gasol attempts a 3Pt. Contested by Lauri Irving (3.9 feet, ZONE). Gary Gasol misses. Offensive rebound by James Paul! James Paul puts it back in!
Score: 77-63

[07:45] Team_054 possession (Score: 77-63)
Lauri Irving makes the Layup and draws the foul on Josh Durant! And-1! Lauri Irving to the line for 1. [Team fouls: 2] (Josh Durant: 1 personal fouls)   FT 1/1: GOOD Lauri Irving makes 1/1 from the line.
Score: 80-63

[07:30] Team_052 possession (Score: 80-63)
Gary Gasol attempts a 3Pt. Contested by Lauri Irving (3.9 feet, ZONE). Gary Gasol misses. Rebound secured by Lauri Irving.

[07:20] Team_054 possession (Score: 80-63)
Blake Russell drives to the basket... Blake Russell loses the ball! Stripped by James Paul! TURNOVER! (live ball)

[07:10] Team_052 possession (Score: 80-63)
FOUL! Reach-in foul on Blake Russell during the drive. [Team fouls: 3] No free throws, side out. (Blake Russell: 1 personal fouls)

[06:54] Team_052 possession (Score: 80-63)
Gary Gasol attempts a 3Pt. Contested by Lauri Irving (3.9 feet, ZONE). Gary Gasol misses. Offensive rebound by Bones Morant! Bones Morant kicks it out.

[06:37] Team_052 possession (Score: 80-63)
Gary Gasol drives and kicks out. Josh Durant attempts a 3Pt. Contested by Lauri Irving (3.4 feet, ZONE). Josh Durant misses. Rebound secured by Lauri Irving.

[06:20] Team_054 possession (Score: 80-63)
Blake Russell attempts a Midrange. Contested by Carmelo Middleton (4.8 feet, MAN). Blake Russell misses. Rebound secured by Bones Morant.

[06:03] Team_052 possession (Score: 80-63)
Bones Morant drives to the basket... Bones Morant loses the ball! Stripped by Vince Ball! TURNOVER! (live ball)

[05:49] Team_054 possession (Score: 80-63)
Vince Ball throws a bad pass out of bounds! TURNOVER! (dead ball)

[05:37] Team_052 possession (Score: 80-63)
FOUL! Reach-in foul on Luka Brogdon during the drive. [Team fouls: 4] No free throws, side out. (Luka Brogdon: 1 personal fouls)

[05:21] Team_052 possession (Score: 80-63)
Gary Gasol attempts a Midrange. Contested by Lauri Irving (3.9 feet, ZONE). Gary Gasol misses. Rebound secured by Luka Brogdon.

[05:04] Team_054 possession (Score: 80-63)
Luka Brogdon drives, James Paul stays with him. Luka Brogdon attempts a Layup. Contested by James Paul (3.8 feet, ZONE). LUKA BROGDON MAKES IT! Assist: Lauri Irving
Score: 82-63

[04:52] Team_052 possession (Score: 82-63)
Carmelo Middleton drives, picks up Blake Russell. Help arrives from Lauri Irving! Carmelo Middleton attempts a Dunk. Contested by Lauri Irving (3.4 feet, MAN). Carmelo Middleton misses. Rebound secured by Blake Russell.

[04:39] Team_054 possession (Score: 82-63)
Malcolm Harden attempts a Midrange. Contested by Gary Gasol (4.1 feet, MAN). MALCOLM HARDEN MAKES IT! Assist: Blake Russell
Score: 84-63

[04:26] Team_052 possession (Score: 84-63)
Gary Gasol drives, Blake Russell stays with him. Gary Gasol attempts a Layup. Contested by Blake Russell (3.6 feet, ZONE). GARY GASOL MAKES IT! Assist: James Paul
Score: 84-65

[04:12] Team_054 possession (Score: 84-65)
Vince Ball attempts a 3Pt. Contested by Bones Morant (3.8 feet, ZONE). VINCE BALL MAKES IT! Assist: Malcolm Harden
Score: 87-65

[03:58] Team_052 possession (Score: 87-65)
James Paul attempts a 3Pt. Contested by Luka Brogdon (4.4 feet, MAN). James Paul misses. Offensive rebound by Bones Morant! Bones Morant kicks it out.

[03:43] Team_052 possession (Score: 87-65)
Gary Gasol drives to the basket... Gary Gasol throws a bad pass! Stolen by Malcolm Harden! TURNOVER! (live ball)

[03:28] Team_054 possession (Score: 87-65)
FOUL! Shooting foul on Bones Morant. Vince Ball to the line for 3 free throws. [Team fouls: 3] (Bones Morant: 1 personal fouls)   FT 1/3: GOOD   FT 2/3: GOOD   FT 3/3: GOOD Vince Ball makes 3/3 from the line.
Score: 90-65

[03:13] Team_052 possession (Score: 90-65)
Bones Morant attempts a 3Pt. Contested by Lauri Irving (4.0 feet, ZONE). Bones Morant misses. Rebound secured by Luka Brogdon.

[03:01] Team_054 possession (Score: 90-65)
Blake Russell attempts a 3Pt. Contested by Bones Morant (4.2 feet, ZONE). Blake Russell misses. Rebound secured by Bones Morant.

[02:45] Team_052 possession (Score: 90-65)
Carmelo Middleton drives to the basket... FOUL! Offensive foul on Carmelo Middleton! Blake Russell drew the charge! [Team fouls: 4] (Carmelo Middleton: 2 personal fouls) TURNOVER! (dead ball)

[02:27] Team_054 possession (Score: 90-65)
FOUL! Reach-in foul on James Paul during the drive. [IN THE BONUS! 5 team fouls] Luka Brogdon to the line for 2 free throws. (James Paul: 1 personal fouls)   FT 1/2: GOOD   FT 2/2: GOOD Luka Brogdon makes 2/2 from the line.
Score: 92-65

[02:15] Team_052 possession (Score: 92-65)
Carmelo Middleton makes the Layup and draws the foul on Blake Russell! And-1! Carmelo Middleton to the line for 1. [BONUS: 5 team fouls] (Blake Russell: 2 personal fouls)   FT 1/1: GOOD Carmelo Middleton makes 1/1 from the line.
Score: 92-68

[02:01] Team_054 possession (Score: 92-68)
Lauri Irving attempts a 3Pt. Contested by Josh Durant (4.0 feet, MAN). LAURI IRVING MAKES IT! Assist: Vince Ball
Score: 95-68

[01:47] Team_052 possession (Score: 95-68)
Carmelo Middleton attempts a 3Pt. Contested by Blake Russell (3.8 feet, MAN). Carmelo Middleton misses. Rebound secured by Blake Russell.

[01:32] Team_054 possession (Score: 95-68)
Blake Russell attempts a 3Pt. Contested by Carmelo Middleton (5.1 feet, MAN). Blake Russell misses. Rebound secured by Bones Morant.

[01:14] Team_052 possession (Score: 95-68)
Carmelo Middleton drives and kicks out. Bones Morant attempts a 3Pt. Contested by Vince Ball (4.4 feet, MAN). Bones Morant misses. Rebound secured by Blake Russell.

[01:04] Team_054 possession (Score: 95-68)
Vince Ball drives, picks up Bones Morant. Help arrives from Josh Durant! Vince Ball attempts a Layup. Contested by Josh Durant (4.1 feet, MAN). Vince Ball misses. Offensive rebound by Blake Russell! Blake Russell puts it back in!
Score: 97-68

[00:52] Team_052 possession (Score: 97-68)
Carmelo Middleton drives and kicks out. Carmelo Middleton attempts a 3Pt. Contested by Lauri Irving (3.9 feet, ZONE). Carmelo Middleton misses. Offensive rebound by James Paul! James Paul's putback is no good. Rebound secured by Luka Brogdon.

[00:37] Team_054 possession (Score: 97-68)
Luka Brogdon attempts a Layup. Contested by James Paul (4.2 feet, ZONE). LUKA BROGDON MAKES IT! Assist: Blake Russell
Score: 99-68

[00:21] Team_052 possession (Score: 99-68)
James Paul drives, Luka Brogdon stays with him. James Paul attempts a Layup. Contested by Luka Brogdon (4.7 feet, MAN). JAMES PAUL MAKES IT!
Score: 99-70

[00:11] Team_054 possession (Score: 99-70)
Blake Russell attempts a Midrange. Contested by Josh Durant (4.1 feet, ZONE). Blake Russell misses. Rebound secured by Bones Morant.

================================================================================
                              3RD QUARTER COMPLETE                              
================================================================================

3RD QUARTER SCORE: Team_054 29, Team_052 18

BOX SCORE:
================================================================================

Team_054
--------------------------------------------------------------------------------
Player                MIN  PTS  REB  AST  TO      FG   FG%      3P   3P%
--------------------------------------------------------------------------------
Vince Ball             34    8    0    1   0   3/5    60.0     0/0   0.0
Blake Russell          34    7    5    2   0   3/9    33.3     0/0   0.0
Luka Brogdon           34    6    4    0   0   3/3   100.0     0/0   0.0
Lauri Irving           34    6    2    1   0   2/2   100.0     0/0   0.0
Malcolm Harden         34    2    0    2   0   1/1   100.0     0/0   0.0

TEAM: FG: 12/20 (60.0%), 3PT: 3/6 (50.0%), REB: 10 (1 off, 9 def), AST: 6, TO: 2
TEAM FOULS: 5 [Team_052 in BONUS]


Team_052
--------------------------------------------------------------------------------
Player                MIN  PTS  REB  AST  TO      FG   FG%      3P   3P%
--------------------------------------------------------------------------------
James Paul             34    6    3    2   0   3/3   100.0     0/0   0.0
Gary Gasol             34    4    0    1   0   2/5    40.0     0/0   0.0
Josh Durant            34    3    0    0   0   1/2    50.0     0/0   0.0
Carmelo Middleton      34    3    2    0   0   1/5    20.0     0/0   0.0
Bones Morant           34    2    7    0   0   1/3    33.3     0/0   0.0

TEAM: FG: 8/18 (44.4%), 3PT: 2/6 (33.3%), REB: 13 (5 off, 8 def), AST: 3, TO: 3
TEAM FOULS: 5 [Team_054 in BONUS]

================================================================================

================================================================================
                       4TH QUARTER - Team_054 vs Team_052                       
================================================================================

[12:00] Team_054 possession (Score: 99-70)
FOUL! Shooting foul on Josh Durant. Lauri Irving to the line for 2 free throws. [Team fouls: 1] (Josh Durant: 1 personal fouls)   FT 1/2: GOOD   FT 2/2: GOOD Lauri Irving makes 2/2 from the line.
Score: 101-70

[11:44] Team_052 possession (Score: 101-70)
James Paul attempts a 3Pt. Contested by Lauri Irving (4.1 feet, ZONE). James Paul misses. Rebound secured by Luka Brogdon.

[11:28] Team_054 possession (Score: 101-70)
Lauri Irving throws a bad pass! Stolen by Josh Durant! TURNOVER! (live ball)

[11:13] Team_052 possession (Score: 101-70)
Josh Durant attempts a Layup. Contested by Lauri Irving (3.6 feet, MAN). Josh Durant misses. Rebound secured by Vince Ball.

[10:56] Team_054 possession (Score: 101-70)
Blake Russell attempts a Midrange. Contested by Carmelo Middleton (5.1 feet, MAN). Blake Russell misses. Rebound secured by Carmelo Middleton.

[10:43] Team_052 possession (Score: 101-70)
James Paul drives and kicks out. James Paul attempts a 3Pt. Contested by Lauri Irving (3.9 feet, ZONE). James Paul misses. Rebound secured by Luka Brogdon.

[10:32] Team_054 possession (Score: 101-70)
Blake Russell attempts a Layup. Contested by James Paul (4.2 feet, ZONE). BLAKE RUSSELL MAKES IT! Assist: Lauri Irving
Score: 103-70

[10:14] Team_052 possession (Score: 103-70)
Josh Durant attempts a 3Pt. Contested by Lauri Irving (3.7 feet, MAN). Josh Durant misses. Rebound secured by Blake Russell.

[10:02] Team_054 possession (Score: 103-70)
Luka Brogdon attempts a 3Pt. Contested by James Paul (4.2 feet, MAN). Luka Brogdon misses. Rebound secured by Bones Morant.

[09:48] Team_052 possession (Score: 103-70)
Josh Durant attempts a 3Pt. Contested by Lauri Irving (3.8 feet, MAN). Josh Durant misses. Rebound secured by Vince Ball.

[09:33] Team_054 possession (Score: 103-70)
FOUL! Shooting foul on Bones Morant. Vince Ball to the line for 2 free throws. [Team fouls: 2] (Bones Morant: 1 personal fouls)   FT 1/2: MISS   FT 2/2: GOOD Vince Ball makes 1/2 from the line.
Score: 104-70

[09:17] Team_052 possession (Score: 104-70)
Bones Morant attempts a 3Pt. Contested by Vince Ball (4.9 feet, MAN). Bones Morant misses. Offensive rebound by James Paul! James Paul's putback is no good. Rebound secured by Vince Ball.

[09:06] Team_054 possession (Score: 104-70)
Vince Ball throws a bad pass! Stolen by Bones Morant! TURNOVER! (live ball)

[08:54] Team_052 possession (Score: 104-70)
Bones Morant attempts a 3Pt. Contested by Vince Ball (4.9 feet, MAN). Bones Morant misses. Offensive rebound by James Paul! James Paul's putback is no good. Offensive rebound by Bones Morant! Bones Morant kicks it out.

[08:44] Team_052 possession (Score: 104-70)
Gary Gasol makes the Layup and draws the foul on Lauri Irving! And-1! Gary Gasol to the line for 1. [Team fouls: 1] (Lauri Irving: 1 personal fouls)   FT 1/1: GOOD Gary Gasol makes 1/1 from the line.
Score: 104-73

[08:31] Team_054 possession (Score: 104-73)
Luka Brogdon attempts a Midrange. Contested by James Paul (4.5 feet, MAN). Luka Brogdon misses. Rebound secured by Bones Morant.

[08:17] Team_052 possession (Score: 104-73)
Bones Morant attempts a 3Pt. Contested by Lauri Irving (4.6 feet, ZONE). BONES MORANT MAKES IT! Assist: Carmelo Middleton
Score: 104-76

[08:06] Team_054 possession (Score: 104-76)
Blake Russell attempts a Midrange. Contested by Carmelo Middleton (5.5 feet, MAN). Blake Russell misses. FOUL! Loose ball foul on Carmelo Middleton during the rebound battle. [Team fouls: 3] No free throws, side out. (Carmelo Middleton: 1 personal fouls)

[07:55] Team_054 possession (Score: 104-76)
Lauri Irving attempts a Midrange. Contested by Josh Durant (4.5 feet, ZONE). Lauri Irving misses. Rebound secured by James Paul.

[07:39] Team_052 possession (Score: 104-76)
James Paul attempts a Midrange. Contested by Luka Brogdon (5.0 feet, MAN). James Paul misses. Rebound secured by Luka Brogdon.

[07:25] Team_054 possession (Score: 104-76)
Vince Ball drives and kicks out. Vince Ball attempts a Midrange. Contested by Bones Morant (4.5 feet, MAN). VINCE BALL MAKES IT!
Score: 106-76

[07:12] Team_052 possession (Score: 106-76)
Gary Gasol drives, Blake Russell stays with him. Gary Gasol attempts a Dunk. Contested by Blake Russell (4.6 feet, ZONE). GARY GASOL MAKES IT!
Score: 106-78

[06:55] Team_054 possession (Score: 106-78)
Lauri Irving attempts a 3Pt. Contested by Josh Durant (4.7 feet, MAN). Lauri Irving misses. Rebound secured by Bones Morant.

[06:38] Team_052 possession (Score: 106-78)
Carmelo Middleton attempts a Layup. Contested by Blake Russell (4.6 feet, MAN). Carmelo Middleton misses. Rebound secured by Luka Brogdon.

[06:28] Team_054 possession (Score: 106-78)
Luka Brogdon drives, picks up James Paul. Help arrives from Josh Durant! Luka Brogdon attempts a Dunk. Contested by Josh Durant (4.8 feet, MAN). LUKA BROGDON MAKES IT!
Score: 108-78

[06:12] Team_052 possession (Score: 108-78)
Carmelo Middleton attempts a Layup. Contested by Blake Russell (4.7 feet, MAN). CARMELO MIDDLETON MAKES IT! Assist: Gary Gasol
Score: 108-80

[05:53] Team_054 possession (Score: 108-80)
Luka Brogdon drives and kicks out. Luka Brogdon attempts a 3Pt. Contested by James Paul (4.6 feet, MAN). Luka Brogdon misses. Rebound secured by James Paul.

[05:35] Team_052 possession (Score: 108-80)
James Paul attempts a 3Pt. Contested by Luka Brogdon (5.2 feet, MAN). James Paul misses. FOUL! Loose ball foul on Blake Russell during the rebound battle. [Team fouls: 2] No free throws, side out. (Blake Russell: 1 personal fouls)

[05:21] Team_052 possession (Score: 108-80)
James Paul attempts a 3Pt. Contested by Lauri Irving (4.9 feet, ZONE). JAMES PAUL MAKES IT! Assist: Gary Gasol
Score: 108-83

[05:07] Team_054 possession (Score: 108-83)
Malcolm Harden drives to the basket... Malcolm Harden commits a violation (traveling/carry)! TURNOVER! (dead ball)

[05:07] Substitution (Team_054): Malcolm Harden OUT → Shaquille Irving IN (stamina_rule2)

[05:07] Substitution (Team_054): Lauri Irving OUT → Bradley Quickley IN (stamina_rule2)

[05:07] Substitution (Team_054): Vince Ball OUT → Vince James IN (stamina_rule2)

[05:07] Substitution (Team_054): Luka Brogdon OUT → Tobias Nowitzki IN (stamina_rule2)

[05:07] Substitution (Team_054): Blake Russell OUT → Devin Jackson IN (stamina_rule2)

[05:07] Substitution (Team_052): Gary Gasol OUT → Jimmy Doncic IN (stamina_rule2)

[05:07] Substitution (Team_052): Josh Durant OUT → Carmelo Giddey IN (stamina_rule2)

[05:07] Substitution (Team_052): Bones Morant OUT → Donovan Stewart IN (stamina_rule2)

[05:07] Substitution (Team_052): James Paul OUT → Jalen Haliburton IN (stamina_rule2)

[05:07] Substitution (Team_052): Carmelo Middleton OUT → Carmelo Beal IN (stamina_rule2)

[04:50] Team_052 possession (Score: 108-83)
Carmelo Beal drives and kicks out. Donovan Stewart attempts a 3Pt. Contested by Shaquille Irving (4.6 feet, ZONE). Donovan Stewart misses. Rebound secured by Vince James.

[04:34] Team_054 possession (Score: 108-83)
Devin Jackson drives, Carmelo Beal stays with him. Devin Jackson attempts a Dunk. Contested by Carmelo Beal (3.6 feet, MAN). DEVIN JACKSON MAKES IT!
Score: 110-83

[04:15] Team_052 possession (Score: 110-83)
Jimmy Doncic attempts a 3Pt. Contested by Shaquille Irving (4.5 feet, MAN). Jimmy Doncic misses. Offensive rebound by Jalen Haliburton! Jalen Haliburton kicks it out.

[04:02] Team_052 possession (Score: 110-83)
Carmelo Giddey drives, Bradley Quickley stays with him. Carmelo Giddey attempts a Layup. Contested by Bradley Quickley (4.8 feet, MAN). Carmelo Giddey misses. Rebound secured by Devin Jackson.

[03:48] Team_054 possession (Score: 110-83)
Devin Jackson attempts a Midrange. Contested by Carmelo Giddey (4.7 feet, ZONE). Devin Jackson misses. Rebound secured by Carmelo Beal.

[03:35] Team_052 possession (Score: 110-83)
Donovan Stewart loses control! Ball rolls out of bounds! TURNOVER! (dead ball)

[03:23] Team_054 possession (Score: 110-83)
FOUL! Holding foul on Donovan Stewart. [Team fouls: 4] No free throws, side out. (Donovan Stewart: 1 personal fouls)

[03:06] Team_054 possession (Score: 110-83)
Shaquille Irving drives, Jimmy Doncic stays with him. Shaquille Irving attempts a Dunk. Contested by Jimmy Doncic (5.2 feet, MAN). SHAQUILLE IRVING MAKES IT! Assist: Devin Jackson
Score: 112-83

[02:47] Team_052 possession (Score: 112-83)
Carmelo Beal makes the Layup and draws the foul on Devin Jackson! And-1! Carmelo Beal to the line for 1. [Team fouls: 3] (Devin Jackson: 1 personal fouls)   FT 1/1: GOOD Carmelo Beal makes 1/1 from the line.
Score: 112-86

[02:33] Team_054 possession (Score: 112-86)
Devin Jackson attempts a Layup. Contested by Carmelo Beal (3.6 feet, ZONE). DEVIN JACKSON MAKES IT! Assist: Tobias Nowitzki
Score: 114-86

[02:19] Team_052 possession (Score: 114-86)
Donovan Stewart attempts a Midrange. Contested by Tobias Nowitzki (5.8 feet, ZONE). Donovan Stewart misses. Rebound secured by Tobias Nowitzki.

[02:04] Team_054 possession (Score: 114-86)
Bradley Quickley attempts a 3Pt. Contested by Jimmy Doncic (4.4 feet, ZONE). Bradley Quickley misses. Rebound secured by Carmelo Beal.

[01:53] Team_052 possession (Score: 114-86)
Jimmy Doncic drives and kicks out. Carmelo Giddey attempts a 3Pt. Contested by Shaquille Irving (4.6 feet, ZONE). Carmelo Giddey misses. Rebound secured by Devin Jackson.

[01:36] Team_054 possession (Score: 114-86)
Tobias Nowitzki attempts a 3Pt. Contested by Jalen Haliburton (4.5 feet, ZONE). TOBIAS NOWITZKI MAKES IT! Assist: Shaquille Irving
Score: 117-86

[01:24] Team_052 possession (Score: 117-86)
Carmelo Giddey attempts a 3Pt. Contested by Bradley Quickley (4.8 feet, MAN). CARMELO GIDDEY MAKES IT! Assist: Donovan Stewart
Score: 117-89

[01:09] Team_054 possession (Score: 117-89)
FOUL! Shooting foul on Carmelo Beal. Devin Jackson to the line for 2 free throws. [BONUS: 5 team fouls] (Carmelo Beal: 1 personal fouls)   FT 1/2: GOOD   FT 2/2: GOOD Devin Jackson makes 2/2 from the line.
Score: 119-89

[00:53] Team_052 possession (Score: 119-89)
FOUL! Offensive foul on Jalen Haliburton! Tobias Nowitzki drew the charge! [Team fouls: 6] (Jalen Haliburton: 1 personal fouls) TURNOVER! (dead ball)

[00:41] Team_054 possession (Score: 119-89)
Shaquille Irving makes the Dunk and draws the foul on Jimmy Doncic! And-1! Shaquille Irving to the line for 1. [BONUS: 7 team fouls] (Jimmy Doncic: 1 personal fouls)   FT 1/1: GOOD Shaquille Irving makes 1/1 from the line.
Score: 122-89

[00:25] Team_052 possession (Score: 122-89)
Carmelo Beal attempts a Layup. Contested by Devin Jackson (5.1 feet, ZONE). Carmelo Beal misses. Rebound secured by Devin Jackson.

[00:10] Team_054 possession (Score: 122-89)
Tobias Nowitzki attempts a Midrange. Contested by Donovan Stewart (4.8 feet, ZONE). TOBIAS NOWITZKI MAKES IT! Assist: Devin Jackson
Score: 124-89

================================================================================
                              4TH QUARTER COMPLETE                              
================================================================================

4TH QUARTER SCORE: Team_054 25, Team_052 19

BOX SCORE:
================================================================================

Team_054
--------------------------------------------------------------------------------
Player                MIN  PTS  REB  AST  TO      FG   FG%      3P   3P%
--------------------------------------------------------------------------------
Devin Jackson           8    6    3    2   0   3/4    75.0     0/0   0.0
Shaquille Irving        8    5    0    1   0   2/2   100.0     0/0   0.0
Tobias Nowitzki         8    5    1    1   0   2/2   100.0     0/0   0.0
Vince Ball             41    3    3    0   0   2/2   100.0     0/0   0.0
Lauri Irving           41    2    0    1   0   1/3    33.3     0/0   0.0
Luka Brogdon           41    2    4    0   0   1/4    25.0     0/0   0.0
Blake Russell          41    2    2    0   0   1/2    50.0     0/0   0.0
Vince James             8    0    1    0   0   0/0     0.0     0/0   0.0
Bradley Quickley        8    0    0    0   0   0/1     0.0     0/0   0.0

TEAM: FG: 12/20 (60.0%), 3PT: 1/4 (25.0%), REB: 13 (1 off, 12 def), AST: 5, TO: 3
TEAM FOULS: 3


Team_052
--------------------------------------------------------------------------------
Player                MIN  PTS  REB  AST  TO      FG   FG%      3P   3P%
--------------------------------------------------------------------------------
Gary Gasol             41    5    0    2   0   2/2   100.0     0/0   0.0
James Paul             41    3    3    0   0   1/4    25.0     0/0   0.0
Bones Morant           41    3    4    0   0   1/2    50.0     0/0   0.0
Carmelo Beal            8    3    2    0   0   1/3    33.3     0/0   0.0
Carmelo Giddey          8    3    0    0   0   1/2    50.0     0/0   0.0
Carmelo Middleton      41    2    1    1   0   1/2    50.0     0/0   0.0
Josh Durant            41    0    0    0   0   0/3     0.0     0/0   0.0
Jalen Haliburton        8    0    1    0   0   0/0     0.0     0/0   0.0
Donovan Stewart         8    0    0    1   0   0/1     0.0     0/0   0.0
Jimmy Doncic            8    0    0    0   0   0/1     0.0     0/0   0.0

TEAM: FG: 7/20 (35.0%), 3PT: 3/7 (42.9%), REB: 12 (4 off, 8 def), AST: 4, TO: 2
TEAM FOULS: 7 [Team_054 in BONUS]

================================================================================

================================================================================
                               FULL GAME COMPLETE                               
================================================================================

FINAL SCORE: Team_054 124, Team_052 89

SCORING BY QUARTER:
--------------------------------------------------------------------------------
Team                     Q1     Q2     Q3     Q4    FINAL
--------------------------------------------------------------------------------
Team_054                 42     28     29     25      124
Team_052                 31     21     18     19       89
--------------------------------------------------------------------------------

FULL GAME BOX SCORE:
================================================================================

Team_054
--------------------------------------------------------------------------------
Player                MIN  PTS  REB  AST  TO      FG   FG%      3P   3P%      FT STL BLK
--------------------------------------------------------------------------------
Malcolm Harden         41   18    0    3   1   7/10   70.0   3/3   100.0   7/10    1   0
Lauri Irving           41   15    4    2   2   7/11   63.6   3/5    60.0   4/6     0   1
Vince Ball             41   21    4    3   5  12/16   75.0   3/5    60.0   9/11    2   0
Luka Brogdon           41   15   14    1   1   8/14   57.1   1/4    25.0   5/8     0   0
Blake Russell          41   26   14    5   0   6/17   35.3   0/2     0.0   5/5     1   0
Shaquille Irving        8    5    0    2   0   2/2   100.0   0/0     0.0   1/1     0   0
Bradley Quickley        8    2    0    1   0   1/2    50.0   0/1     0.0   2/2     0   0
Vince James             8    2    2    0   0   1/1   100.0   0/0     0.0   0/0     0   0
Tobias Nowitzki         8    7    1    1   1   3/3   100.0   1/1   100.0   0/0     1   0
Devin Jackson           8    8    4    2   0   4/5    80.0   0/0     0.0   4/4     0   0

TEAM: FG: 52/82 (63.4%), 3PT: 11/21 (52.4%), REB: 39 (3 off, 36 def), AST: 20, TO: 10


Team_052
--------------------------------------------------------------------------------
Player                MIN  PTS  REB  AST  TO      FG   FG%      3P   3P%      FT STL BLK
--------------------------------------------------------------------------------
Gary Gasol             41   21    0    5   3  10/15   66.7   2/4    50.0   5/6     0   0
Josh Durant            41   12    0    0   1   5/11   45.5   1/4    25.0   2/2     1   0
Bones Morant           41   10   20    3   3   4/9    44.4   3/7    42.9   2/3     2   1
James Paul             41   25   12    6   1  10/16   62.5   3/5    60.0   5/6     3   0
Carmelo Middleton      41   10    6    4   1   5/15   33.3   0/1     0.0   4/6     0   0
Jimmy Doncic            8    0    0    0   0   0/3     0.0   0/1     0.0   0/0     0   0
Carmelo Giddey          8    3    0    1   0   1/2    50.0   1/1   100.0   0/0     0   0
Donovan Stewart         8    0    0    1   1   0/1     0.0   0/0     0.0   0/0     0   0
Jalen Haliburton        8    0    1    0   2   0/0     0.0   0/0     0.0   0/0     0   0
Carmelo Beal            8    5    3    0   1   2/4    50.0   0/0     0.0   1/1     0   0

TEAM: FG: 37/76 (48.7%), 3PT: 10/23 (43.5%), REB: 45 (15 off, 30 def), AST: 20, TO: 13

================================================================================
