================================================================================
                        FULL GAME - Team_084 vs Team_015                        
================================================================================

================================================================================
                       1ST QUARTER - Team_084 vs Team_015                       
================================================================================

[12:00] Team_084 possession (Score: 0-0)
Giannis Quickley drives, picks up Scottie Gasol. Help arrives from Michael Simmons! Giannis Quickley attempts a Dunk. Contested by Michael Simmons (3.7 feet, ZONE). GIANNIS QUICKLEY MAKES IT! Assist: Luka Sexton
Score: 2-0

[11:45] Team_015 possession (Score: 2-0)
CJ Banchero drives, picks up Giannis Quickley. Help arrives from Dejounte Ginobili! CJ Banchero attempts a Layup. Contested by Dejounte Ginobili (4.2 feet, ZONE). CJ Banchero misses. Rebound secured by Dejounte Ginobili.

[11:35] Team_084 possession (Score: 2-0)
Luka Sexton attempts a 3Pt. Contested by Manu Anthony (4.0 feet, ZONE). Luka Sexton misses. Offensive rebound by Giannis Quickley! Giannis Quickley's putback is no good. Rebound secured by Michael Simmons.

[11:20] Team_015 possession (Score: 2-0)
Manu Anthony attempts a 3Pt. Contested by Luka Sexton (3.9 feet, ZONE). MANU ANTHONY MAKES IT! Assist: Michael Simmons
Score: 2-3

[11:06] Team_084 possession (Score: 2-3)
Giannis Quickley drives and kicks out. FOUL! Shooting foul on Manu Anthony. Dejounte Ginobili to the line for 3 free throws. [Team fouls: 1] (Manu Anthony: 1 personal fouls)   FT 1/3: MISS   FT 2/3: GOOD   FT 3/3: MISS Dejounte Ginobili makes 1/3 from the line. Rebound secured by Michael Simmons.
Score: 3-3

[10:50] Team_015 possession (Score: 3-3)
Trae Turner attempts a Midrange. Contested by Jarrett Booker (4.7 feet, ZONE). TRAE TURNER MAKES IT!
Score: 3-5

[10:33] Team_084 possession (Score: 3-5)
Luka Sexton attempts a Midrange. Contested by Manu Anthony (4.0 feet, MAN). Luka Sexton misses. Rebound secured by Michael Simmons.

[10:19] Team_015 possession (Score: 3-5)
FOUL! Shooting foul on Giannis Quickley. Trae Turner to the line for 2 free throws. [Team fouls: 1] (Giannis Quickley: 1 personal fouls)   FT 1/2: MISS   FT 2/2: GOOD Trae Turner makes 1/2 from the line.
Score: 3-6

[10:10] Team_084 possession (Score: 3-6)
Giannis Quickley makes the Layup and draws the foul on Trae Turner! And-1! Giannis Quickley to the line for 1. [Team fouls: 2] (Trae Turner: 1 personal fouls)   FT 1/1: GOOD Giannis Quickley makes 1/1 from the line.
Score: 6-6

[09:50] Team_015 possession (Score: 6-6)
Manu Anthony throws a bad pass out of bounds! TURNOVER! (dead ball)

[09:35] Team_084 possession (Score: 6-6)
Luka Sexton attempts a 3Pt. Contested by Manu Anthony (4.0 feet, ZONE). Luka Sexton misses. Rebound secured by Michael Simmons.

[09:24] Team_015 possession (Score: 6-6)
Trae Turner makes the Dunk and draws the foul on Giannis Quickley! And-1! Trae Turner to the line for 1. [Team fouls: 2] (Giannis Quickley: 2 personal fouls)   FT 1/1: MISS Trae Turner makes 0/1 from the line. Rebound secured by Dejounte Ginobili.
Score: 6-8

[09:08] Team_084 possession (Score: 6-8)
Dejounte Ginobili attempts a Layup. Contested by Scottie Gasol (3.7 feet, ZONE). Dejounte Ginobili misses. Offensive rebound by Dejounte Ginobili! Dejounte Ginobili kicks it out.

[08:55] Team_084 possession (Score: 6-8)
FOUL! Offensive foul on Luka Sexton! Manu Anthony drew the charge! [Team fouls: 3] (Luka Sexton: 1 personal fouls) TURNOVER! (dead ball)

[08:44] Team_015 possession (Score: 6-8)
Scottie Gasol makes the Layup and draws the foul on Jarrett Booker! And-1! Scottie Gasol to the line for 1. [Team fouls: 4] (Jarrett Booker: 1 personal fouls)   FT 1/1: GOOD Scottie Gasol makes 1/1 from the line.
Score: 6-11

[08:27] Team_084 possession (Score: 6-11)
Giannis Quickley throws a bad pass out of bounds! TURNOVER! (dead ball)

[08:11] Team_015 possession (Score: 6-11)
Michael Simmons attempts a 3Pt. Contested by Luka Sexton (3.7 feet, ZONE). Michael Simmons misses. Rebound secured by Klay Thompson.

[08:00] Team_084 possession (Score: 6-11)
Jarrett Booker drives, picks up Scottie Gasol. Help arrives from Michael Simmons! Jarrett Booker attempts a Layup. Contested by Michael Simmons (3.7 feet, MAN). Jarrett Booker misses. Rebound secured by Trae Turner.

[07:45] Team_015 possession (Score: 6-11)
Manu Anthony drives to the basket... Manu Anthony loses control! Ball rolls out of bounds! TURNOVER! (dead ball)

[07:32] Team_084 possession (Score: 6-11)
Dejounte Ginobili loses the ball! Stripped by Michael Simmons! TURNOVER! (live ball)

[07:13] Team_015 possession (Score: 6-11)
CJ Banchero drives, picks up Giannis Quickley. Help arrives from Dejounte Ginobili! CJ Banchero attempts a Layup. Contested by Dejounte Ginobili (4.2 feet, ZONE). CJ BANCHERO MAKES IT! Assist: Trae Turner
Score: 6-13

[07:00] Team_084 possession (Score: 6-13)
Luka Sexton attempts a Midrange. Contested by CJ Banchero (4.5 feet, ZONE). LUKA SEXTON MAKES IT!
Score: 8-13

[06:43] Team_015 possession (Score: 8-13)
Michael Simmons attempts a Midrange. Contested by Klay Thompson (4.8 feet, ZONE). Michael Simmons misses. Rebound secured by Giannis Quickley.

[06:31] Team_084 possession (Score: 8-13)
Jarrett Booker attempts a Midrange. Contested by Scottie Gasol (3.7 feet, MAN). JARRETT BOOKER MAKES IT! Assist: Luka Sexton
Score: 10-13

[06:16] Team_015 possession (Score: 10-13)
CJ Banchero attempts a 3Pt. Contested by Luka Sexton (3.5 feet, ZONE). CJ BANCHERO MAKES IT! Assist: Manu Anthony
Score: 10-16

[06:03] Team_084 possession (Score: 10-16)
Klay Thompson attempts a 3Pt. Contested by CJ Banchero (4.7 feet, ZONE). KLAY THOMPSON MAKES IT! Assist: Giannis Quickley
Score: 13-16

[05:48] Team_015 possession (Score: 13-16)
Scottie Gasol attempts a 3Pt. Contested by Luka Sexton (3.7 feet, ZONE). Scottie Gasol misses. Offensive rebound by Trae Turner! Trae Turner puts it back in!
Score: 13-18

[05:34] Team_084 possession (Score: 13-18)
Luka Sexton attempts a 3Pt. Contested by Manu Anthony (4.0 feet, MAN). Luka Sexton misses. Rebound secured by Trae Turner.

[05:18] Team_015 possession (Score: 13-18)
CJ Banchero attempts a Midrange. Contested by Giannis Quickley (4.3 feet, ZONE). CJ BANCHERO MAKES IT! Assist: Manu Anthony
Score: 13-20

[05:03] Team_084 possession (Score: 13-20)
Luka Sexton drives, Manu Anthony stays with him. Luka Sexton attempts a Layup. Contested by Manu Anthony (4.0 feet, MAN). Luka Sexton misses. Rebound secured by Michael Simmons.

[04:50] Team_015 possession (Score: 13-20)
FOUL! Offensive foul on CJ Banchero! Klay Thompson drew the charge! [Team fouls: 3] (CJ Banchero: 1 personal fouls) TURNOVER! (dead ball)

[04:37] Team_084 possession (Score: 13-20)
Dejounte Ginobili attempts a 3Pt. Contested by Michael Simmons (3.6 feet, MAN). Dejounte Ginobili misses. Rebound secured by Trae Turner.

[04:24] Team_015 possession (Score: 13-20)
Scottie Gasol attempts a 3Pt. Contested by Luka Sexton (3.7 feet, ZONE). Scottie Gasol misses. Rebound secured by Giannis Quickley.

[04:10] Team_084 possession (Score: 13-20)
Klay Thompson attempts a Midrange. Contested by CJ Banchero (4.8 feet, ZONE). KLAY THOMPSON MAKES IT!
Score: 15-20

[03:52] Team_015 possession (Score: 15-20)
Scottie Gasol attempts a 3Pt. Contested by Luka Sexton (3.8 feet, ZONE). SCOTTIE GASOL MAKES IT! Assist: Michael Simmons
Score: 15-23

[03:38] Team_084 possession (Score: 15-23)
Jarrett Booker throws a bad pass! Stolen by Scottie Gasol! TURNOVER! (live ball)

[03:20] Team_015 possession (Score: 15-23)
Scottie Gasol attempts a Layup. Contested by Jarrett Booker (4.8 feet, MAN). SCOTTIE GASOL MAKES IT!
Score: 15-25

[03:05] Team_084 possession (Score: 15-25)
Dejounte Ginobili attempts a 3Pt. Contested by Michael Simmons (3.8 feet, MAN). Dejounte Ginobili misses. Offensive rebound by Giannis Quickley! Giannis Quickley puts it back in!
Score: 17-25

[02:46] Team_015 possession (Score: 17-25)
Trae Turner drives to the basket... Trae Turner loses the ball! Stripped by Giannis Quickley! TURNOVER! (live ball)

[02:29] Team_084 possession (Score: 17-25)
Giannis Quickley attempts a Midrange. Contested by CJ Banchero (4.7 feet, ZONE). Giannis Quickley misses. Rebound secured by Trae Turner.

[02:14] Team_015 possession (Score: 17-25)
FOUL! Holding foul on Luka Sexton. [IN THE BONUS! 5 team fouls] Manu Anthony to the line for 2 free throws. (Luka Sexton: 2 personal fouls)   FT 1/2: GOOD   FT 2/2: MISS Manu Anthony makes 1/2 from the line. Rebound secured by Klay Thompson.
Score: 17-26

[02:00] Team_084 possession (Score: 17-26)
Giannis Quickley drives and kicks out. Giannis Quickley attempts a 3Pt. Contested by Trae Turner (4.0 feet, MAN). Giannis Quickley misses. Rebound secured by CJ Banchero.

[01:47] Team_015 possession (Score: 17-26)
CJ Banchero attempts a 3Pt. Contested by Luka Sexton (3.8 feet, ZONE). CJ BANCHERO MAKES IT! Assist: Scottie Gasol
Score: 17-29

[01:32] Team_084 possession (Score: 17-29)
Luka Sexton attempts a Midrange. Contested by Michael Simmons (4.0 feet, ZONE). LUKA SEXTON MAKES IT!
Score: 19-29

[01:17] Team_015 possession (Score: 19-29)
Scottie Gasol attempts a 3Pt. Contested by Jarrett Booker (5.0 feet, MAN). Scottie Gasol misses. Rebound secured by Klay Thompson.

[01:08] Team_084 possession (Score: 19-29)
Luka Sexton attempts a 3Pt. Contested by Manu Anthony (4.3 feet, ZONE). Luka Sexton misses. Rebound secured by Trae Turner.

[00:56] Team_015 possession (Score: 19-29)
Manu Anthony attempts a Layup. Contested by Luka Sexton (4.3 feet, MAN). Manu Anthony misses. Offensive rebound by Trae Turner! Trae Turner kicks it out.

[00:37] Team_015 possession (Score: 19-29)
CJ Banchero attempts a 3Pt. Contested by Luka Sexton (3.9 feet, ZONE). CJ BANCHERO MAKES IT!
Score: 19-32

[00:26] Team_084 possession (Score: 19-32)
Giannis Quickley drives and kicks out. FOUL! Shooting foul on Michael Simmons. Dejounte Ginobili to the line for 2 free throws. [Team fouls: 4] (Michael Simmons: 1 personal fouls)   FT 1/2: GOOD   FT 2/2: MISS Dejounte Ginobili makes 1/2 from the line. Offensive rebound by Giannis Quickley! Giannis Quickley's putback is no good.
Score: 20-32

[00:09] Team_015 possession (Score: 20-32)
Scottie Gasol attempts a 3Pt. Contested by Jarrett Booker (5.1 feet, MAN). Scottie Gasol misses. Rebound secured by Dejounte Ginobili.

================================================================================
                              1ST QUARTER COMPLETE                              
================================================================================

1ST QUARTER SCORE: Team_084 20, Team_015 32

BOX SCORE:
================================================================================

Team_084
--------------------------------------------------------------------------------
Player                MIN  PTS  REB  AST  TO      FG   FG%      3P   3P%
--------------------------------------------------------------------------------
Klay Thompson          12    5    3    0   0   2/2   100.0     0/0   0.0
Luka Sexton            12    4    0    2   0   2/8    25.0     0/0   0.0
Jarrett Booker         12    2    0    0   0   1/2    50.0     0/0   0.0
Dejounte Ginobili      12    0    4    0   0   0/1     0.0     0/0   0.0

TEAM: FG: 8/20 (40.0%), 3PT: 2/7 (28.6%), REB: 11 (3 off, 8 def), AST: 3, TO: 4
TEAM FOULS: 5 [Team_015 in BONUS]


Team_015
--------------------------------------------------------------------------------
Player                MIN  PTS  REB  AST  TO      FG   FG%      3P   3P%
--------------------------------------------------------------------------------
CJ Banchero            12   13    1    0   0   5/6    83.3     0/0   0.0
Scottie Gasol          12    8    0    1   0   3/6    50.0     0/0   0.0
Giannis Quickley       12    7    4    1   0   3/7    42.9     0/0   0.0
Trae Turner            12    5    7    1   0   3/4    75.0     0/0   0.0
Manu Anthony           12    3    0    2   0   1/1   100.0     0/0   0.0
Michael Simmons        12    0    5    2   0   0/2     0.0     0/0   0.0

TEAM: FG: 12/20 (60.0%), 3PT: 6/10 (60.0%), REB: 13 (2 off, 11 def), AST: 6, TO: 4
TEAM FOULS: 4

================================================================================

================================================================================
                       2ND QUARTER - Team_084 vs Team_015                       
================================================================================

[12:00] Team_084 possession (Score: 20-32)
Klay Thompson attempts a 3Pt. Contested by Manu Anthony (4.4 feet, ZONE). Klay Thompson misses. Rebound secured by Trae Turner.

[11:43] Team_015 possession (Score: 20-32)
CJ Banchero attempts a Layup. BLOCKED BY KLAY THOMPSON! Ball is loose! Rebound secured by Giannis Quickley.

[11:26] Team_084 possession (Score: 20-32)
Dejounte Ginobili attempts a 3Pt. Contested by Michael Simmons (3.9 feet, MAN). Dejounte Ginobili misses. Rebound secured by Michael Simmons.

[11:15] Team_015 possession (Score: 20-32)
Manu Anthony attempts a 3Pt. Contested by Luka Sexton (4.2 feet, ZONE). Manu Anthony misses. Rebound secured by Dejounte Ginobili.

[11:02] Team_084 possession (Score: 20-32)
Dejounte Ginobili drives, picks up Michael Simmons. Help arrives from CJ Banchero! Dejounte Ginobili attempts a Layup. Contested by CJ Banchero (4.0 feet, MAN). DEJOUNTE GINOBILI MAKES IT! Assist: Jarrett Booker
Score: 22-32

[10:48] Team_015 possession (Score: 22-32)
Manu Anthony throws a bad pass! Stolen by Luka Sexton! TURNOVER! (live ball)

[10:35] Team_084 possession (Score: 22-32)
Giannis Quickley attempts a 3Pt. Contested by Manu Anthony (4.3 feet, ZONE). Giannis Quickley misses. Rebound secured by Trae Turner.

[10:23] Team_015 possession (Score: 22-32)
Trae Turner drives to the basket... Trae Turner throws a bad pass! Stolen by Giannis Quickley! TURNOVER! (live ball)

[10:10] Team_084 possession (Score: 22-32)
Dejounte Ginobili attempts a 3Pt. Contested by Manu Anthony (4.3 feet, ZONE). Dejounte Ginobili misses. Rebound secured by Michael Simmons.

[09:55] Team_015 possession (Score: 22-32)
Manu Anthony attempts a 3Pt. Contested by Luka Sexton (4.4 feet, MAN). Manu Anthony misses. Rebound secured by Giannis Quickley.

[09:39] Team_084 possession (Score: 22-32)
Giannis Quickley makes the Layup and draws the foul on Trae Turner! And-1! Giannis Quickley to the line for 1. [Team fouls: 1] (Trae Turner: 1 personal fouls)   FT 1/1: GOOD Giannis Quickley makes 1/1 from the line.
Score: 25-32

[09:26] Team_015 possession (Score: 25-32)
Manu Anthony attempts a 3Pt. Contested by Luka Sexton (4.5 feet, ZONE). Manu Anthony misses. Rebound secured by Dejounte Ginobili.

[09:10] Team_084 possession (Score: 25-32)
Dejounte Ginobili attempts a 3Pt. Contested by Michael Simmons (4.2 feet, MAN). Dejounte Ginobili misses. Rebound secured by Trae Turner.

[08:57] Team_015 possession (Score: 25-32)
Manu Anthony attempts a 3Pt. Contested by Luka Sexton (4.5 feet, MAN). Manu Anthony misses. Rebound secured by Klay Thompson.

[08:39] Team_084 possession (Score: 25-32)
Jarrett Booker attempts a Layup. Contested by Scottie Gasol (4.4 feet, MAN). Jarrett Booker misses. Rebound secured by Trae Turner.

[08:24] Team_015 possession (Score: 25-32)
Trae Turner attempts a Layup. BLOCKED BY GIANNIS QUICKLEY! Ball deflects out of bounds off Trae Turner.

[08:10] Team_084 possession (Score: 25-32)
Jarrett Booker makes the Layup and draws the foul on Scottie Gasol! And-1! Jarrett Booker to the line for 1. [Team fouls: 2] (Scottie Gasol: 1 personal fouls)   FT 1/1: GOOD Jarrett Booker makes 1/1 from the line.
Score: 28-32

[07:59] Team_015 possession (Score: 28-32)
Michael Simmons makes the 3Pt and draws the foul on Luka Sexton! And-1! Michael Simmons to the line for 1. [Team fouls: 1] (Luka Sexton: 1 personal fouls)   FT 1/1: GOOD Michael Simmons makes 1/1 from the line.
Score: 28-36

[07:42] Team_084 possession (Score: 28-36)
FOUL! Reach-in foul on Michael Simmons during the drive. [Team fouls: 3] No free throws, side out. (Michael Simmons: 1 personal fouls)

[07:28] Team_084 possession (Score: 28-36)
Klay Thompson attempts a 3Pt. Contested by CJ Banchero (5.4 feet, MAN). Klay Thompson misses. Rebound secured by Michael Simmons.

[07:13] Team_015 possession (Score: 28-36)
Trae Turner makes the Midrange and draws the foul on Luka Sexton! And-1! Trae Turner to the line for 1. [Team fouls: 2] (Luka Sexton: 2 personal fouls)   FT 1/1: GOOD Trae Turner makes 1/1 from the line.
Score: 28-39

[06:57] Team_084 possession (Score: 28-39)
Luka Sexton drives and kicks out. Giannis Quickley attempts a Midrange. Contested by Trae Turner (4.9 feet, MAN). GIANNIS QUICKLEY MAKES IT!
Score: 30-39

[06:40] Team_015 possession (Score: 30-39)
Michael Simmons attempts a 3Pt. Contested by Luka Sexton (4.6 feet, ZONE). Michael Simmons misses. Rebound secured by Giannis Quickley.

[06:30] Team_084 possession (Score: 30-39)
Giannis Quickley makes the Layup and draws the foul on Trae Turner! And-1! Giannis Quickley to the line for 1. [Team fouls: 4] (Trae Turner: 2 personal fouls)   FT 1/1: MISS Giannis Quickley makes 0/1 from the line. Rebound secured by Michael Simmons.
Score: 32-39

[06:16] Team_015 possession (Score: 32-39)
Manu Anthony makes the Layup and draws the foul on Dejounte Ginobili! And-1! Manu Anthony to the line for 1. [Team fouls: 3] (Dejounte Ginobili: 1 personal fouls)   FT 1/1: MISS Manu Anthony makes 0/1 from the line. Offensive rebound by CJ Banchero! CJ Banchero kicks it out.
Score: 32-41

[05:59] Team_015 possession (Score: 32-41)
Trae Turner drives, picks up Giannis Quickley. Help arrives from Dejounte Ginobili! Trae Turner attempts a Dunk. Contested by Dejounte Ginobili (5.6 feet, MAN). TRAE TURNER MAKES IT! Assist: Michael Simmons
Score: 32-43

[05:48] Team_084 possession (Score: 32-43)
Dejounte Ginobili attempts a 3Pt. Contested by Manu Anthony (4.9 feet, ZONE). Dejounte Ginobili misses. Rebound secured by CJ Banchero.

[05:37] Team_015 possession (Score: 32-43)
Scottie Gasol throws a bad pass out of bounds! TURNOVER! (dead ball)

[05:37] Substitution (Team_084): Luka Sexton OUT → Magic Bryant IN (stamina_rule2)

[05:37] Substitution (Team_084): Dejounte Ginobili OUT → Chris Parker IN (stamina_rule2)

[05:37] Substitution (Team_084): Klay Thompson OUT → Evan Quickley IN (stamina_rule2)

[05:37] Substitution (Team_084): Jarrett Booker OUT → Pascal Jackson IN (stamina_rule2)

[05:37] Substitution (Team_084): Giannis Quickley OUT → Dejounte Porzingis IN (stamina_rule2)

[05:37] Substitution (Team_015): Manu Anthony OUT → Dwyane Sabonis IN (stamina_rule2)

[05:37] Substitution (Team_015): Michael Simmons OUT → Paolo Jokic IN (stamina_rule2)

[05:37] Substitution (Team_015): CJ Banchero OUT → Magic Wagner IN (stamina_rule2)

[05:37] Substitution (Team_015): Scottie Gasol OUT → Rudy Paul IN (stamina_rule2)

[05:37] Substitution (Team_015): Trae Turner OUT → Allen Curry IN (stamina_rule2)

[05:25] Team_084 possession (Score: 32-43)
Pascal Jackson drives to the basket... Pascal Jackson loses the ball! Stripped by Rudy Paul! TURNOVER! (live ball)

[05:06] Team_015 possession (Score: 32-43)
Magic Wagner attempts a Midrange. Contested by Evan Quickley (4.9 feet, MAN). MAGIC WAGNER MAKES IT! Assist: Dwyane Sabonis
Score: 32-45

[04:49] Team_084 possession (Score: 32-45)
Chris Parker loses control! Ball rolls out of bounds! TURNOVER! (dead ball)

[04:32] Team_015 possession (Score: 32-45)
Rudy Paul drives to the basket... Rudy Paul loses the ball! Stripped by Dejounte Porzingis! TURNOVER! (live ball)

[04:22] Team_084 possession (Score: 32-45)
Magic Bryant drives and kicks out. Pascal Jackson attempts a 3Pt. Contested by Rudy Paul (3.2 feet, MAN). Pascal Jackson misses. FOUL! Loose ball foul on Rudy Paul during the rebound battle. [IN THE BONUS! 5 team fouls] Pascal Jackson to the line for 2 free throws. (Rudy Paul: 1 personal fouls)   FT 1/2: MISS   FT 2/2: GOOD Pascal Jackson makes 1/2 from the line.
Score: 33-45

[04:07] Team_015 possession (Score: 33-45)
Paolo Jokic drives, Chris Parker stays with him. Paolo Jokic attempts a Dunk. Contested by Chris Parker (5.1 feet, MAN). PAOLO JOKIC MAKES IT! Assist: Magic Wagner
Score: 33-47

[03:57] Team_084 possession (Score: 33-47)
Evan Quickley loses the ball! Stripped by Magic Wagner! TURNOVER! (live ball)

[03:44] Team_015 possession (Score: 33-47)
Rudy Paul drives and kicks out. Allen Curry attempts a 3Pt. Contested by Dejounte Porzingis (5.0 feet, MAN). Allen Curry misses. Offensive rebound by Allen Curry! Allen Curry's putback is no good. Offensive rebound by Rudy Paul! Rudy Paul kicks it out.

[03:29] Team_015 possession (Score: 33-47)
Allen Curry attempts a 3Pt. Contested by Pascal Jackson (5.1 feet, ZONE). Allen Curry misses. Rebound secured by Pascal Jackson.

[03:14] Team_084 possession (Score: 33-47)
Chris Parker attempts a 3Pt. Contested by Paolo Jokic (5.7 feet, ZONE). Chris Parker misses. Rebound secured by Rudy Paul.

[03:00] Team_015 possession (Score: 33-47)
Dwyane Sabonis attempts a 3Pt. Contested by Magic Bryant (3.9 feet, ZONE). Dwyane Sabonis misses. Offensive rebound by Rudy Paul! Rudy Paul's putback is no good. Offensive rebound by Allen Curry! Allen Curry kicks it out.

[02:47] Team_015 possession (Score: 33-47)
Allen Curry drives and kicks out. Allen Curry attempts a 3Pt. Contested by Magic Bryant (3.7 feet, ZONE). ALLEN CURRY MAKES IT! Assist: Paolo Jokic
Score: 33-50

[02:31] Team_084 possession (Score: 33-50)
Chris Parker attempts a 3Pt. Contested by Paolo Jokic (5.7 feet, MAN). CHRIS PARKER MAKES IT! Assist: Pascal Jackson
Score: 36-50

[02:21] Team_015 possession (Score: 36-50)
Dwyane Sabonis attempts a 3Pt. Contested by Magic Bryant (3.9 feet, ZONE). Dwyane Sabonis misses. Offensive rebound by Allen Curry! Allen Curry's putback is no good. Offensive rebound by Allen Curry! Allen Curry kicks it out.

[02:05] Team_015 possession (Score: 36-50)
Dwyane Sabonis drives to the basket... Dwyane Sabonis loses the ball! Stripped by Dejounte Porzingis! TURNOVER! (live ball)

[01:49] Team_084 possession (Score: 36-50)
Magic Bryant attempts a 3Pt. Contested by Rudy Paul (3.3 feet, ZONE). Magic Bryant misses. Rebound secured by Magic Wagner.

[01:37] Team_015 possession (Score: 36-50)
Rudy Paul drives, picks up Pascal Jackson. Help arrives from Magic Bryant! Rudy Paul attempts a Dunk. Contested by Magic Bryant (5.2 feet, MAN). RUDY PAUL MAKES IT! Assist: Dwyane Sabonis
Score: 36-52

[01:21] Team_084 possession (Score: 36-52)
Chris Parker attempts a 3Pt. Contested by Rudy Paul (3.4 feet, ZONE). Chris Parker misses. Rebound secured by Rudy Paul.

[01:02] Team_015 possession (Score: 36-52)
FOUL! Reach-in foul on Dejounte Porzingis during the drive. [IN THE BONUS! 5 team fouls] Allen Curry to the line for 2 free throws. (Dejounte Porzingis: 1 personal fouls)   FT 1/2: GOOD   FT 2/2: GOOD Allen Curry makes 2/2 from the line.
Score: 36-54

[00:46] Team_084 possession (Score: 36-54)
Magic Bryant attempts a 3Pt. Contested by Dwyane Sabonis (4.9 feet, MAN). Magic Bryant misses. Rebound secured by Allen Curry.

[00:28] Team_015 possession (Score: 36-54)
Dwyane Sabonis drives, Dejounte Porzingis stays with him. Dwyane Sabonis attempts a Dunk. Contested by Dejounte Porzingis (5.2 feet, ZONE). DWYANE SABONIS MAKES IT!
Score: 36-56

[00:13] Team_084 possession (Score: 36-56)
Pascal Jackson attempts a 3Pt. Contested by Rudy Paul (3.4 feet, MAN). Pascal Jackson misses. Rebound secured by Magic Wagner.

================================================================================
                              2ND QUARTER COMPLETE                              
================================================================================

2ND QUARTER SCORE: Team_084 16, Team_015 24

BOX SCORE:
================================================================================

Team_084
--------------------------------------------------------------------------------
Player                MIN  PTS  REB  AST  TO      FG   FG%      3P   3P%
--------------------------------------------------------------------------------
Giannis Quickley       19    5    3    0   0   2/4    50.0     0/0   0.0
Jarrett Booker         19    3    0    1   0   1/2    50.0     0/0   0.0
Chris Parker            5    3    0    0   0   1/3    33.3     0/0   0.0
Dejounte Ginobili      19    2    2    0   0   1/5    20.0     0/0   0.0
Pascal Jackson          5    1    1    1   0   1/2    50.0     0/0   0.0
Klay Thompson          19    0    1    0   0   0/2     0.0     0/0   0.0
Magic Bryant            5    0    0    0   0   0/2     0.0     0/0   0.0

TEAM: FG: 6/20 (30.0%), 3PT: 1/13 (7.7%), REB: 7 (0 off, 7 def), AST: 2, TO: 3
TEAM FOULS: 5 [Team_015 in BONUS]


Team_015
--------------------------------------------------------------------------------
Player                MIN  PTS  REB  AST  TO      FG   FG%      3P   3P%
--------------------------------------------------------------------------------
Trae Turner            19    5    4    0   0   2/3    66.7     0/0   0.0
Allen Curry             5    5    3    0   0   2/3    66.7     0/0   0.0
Michael Simmons        19    4    4    1   0   1/2    50.0     0/0   0.0
Magic Wagner            5    2    2    1   0   1/1   100.0     0/0   0.0
Dwyane Sabonis          5    2    0    2   0   1/1   100.0     0/0   0.0
Paolo Jokic             5    2    0    1   0   1/1   100.0     0/0   0.0
Rudy Paul               5    2    3    0   0   1/1   100.0     0/0   0.0
CJ Banchero            19    0    2    0   0   0/1     0.0     0/0   0.0
Manu Anthony           19    0    0    0   0   0/4     0.0     0/0   0.0

TEAM: FG: 9/17 (52.9%), 3PT: 1/7 (14.3%), REB: 18 (4 off, 14 def), AST: 5, TO: 5
TEAM FOULS: 5 [Team_084 in BONUS]

================================================================================

================================================================================
                       3RD QUARTER - Team_084 vs Team_015                       
================================================================================

[12:00] Team_084 possession (Score: 36-56)
Dejounte Ginobili drives, Scottie Gasol stays with him. Dejounte Ginobili attempts a Dunk. Contested by Scottie Gasol (3.7 feet, ZONE). Dejounte Ginobili misses. Rebound secured by CJ Banchero.

[11:48] Team_015 possession (Score: 36-56)
CJ Banchero attempts a Midrange. Contested by Klay Thompson (4.6 feet, MAN). CJ BANCHERO MAKES IT! Assist: Scottie Gasol
Score: 36-58

[11:38] Team_084 possession (Score: 36-58)
Dejounte Ginobili attempts a Midrange. Contested by Michael Simmons (3.6 feet, MAN). DEJOUNTE GINOBILI MAKES IT! Assist: Giannis Quickley
Score: 38-58

[11:25] Team_015 possession (Score: 38-58)
Michael Simmons attempts a Midrange. Contested by Dejounte Ginobili (4.6 feet, MAN). Michael Simmons misses. Rebound secured by Dejounte Ginobili.

[11:08] Team_084 possession (Score: 38-58)
Giannis Quickley attempts a Layup. Contested by Trae Turner (3.9 feet, MAN). Giannis Quickley misses. Rebound secured by Trae Turner.

[10:56] Team_015 possession (Score: 38-58)
Manu Anthony drives and kicks out. FOUL! Shooting foul on Jarrett Booker. Scottie Gasol to the line for 2 free throws. [Team fouls: 1] (Jarrett Booker: 1 personal fouls)   FT 1/2: MISS   FT 2/2: MISS Scottie Gasol makes 0/2 from the line. Rebound secured by Giannis Quickley.

[10:40] Team_084 possession (Score: 38-58)
Dejounte Ginobili drives and kicks out. Klay Thompson attempts a Midrange. Contested by CJ Banchero (4.2 feet, MAN). Klay Thompson misses. Rebound secured by CJ Banchero.

[10:25] Team_015 possession (Score: 38-58)
FOUL! Reach-in foul on Giannis Quickley during the drive. [Team fouls: 2] No free throws, side out. (Giannis Quickley: 1 personal fouls)

[10:14] Team_015 possession (Score: 38-58)
FOUL! Reach-in foul on Giannis Quickley during the drive. [Team fouls: 3] No free throws, side out. (Giannis Quickley: 2 personal fouls)

[09:59] Team_015 possession (Score: 38-58)
Manu Anthony attempts a 3Pt. Contested by Luka Sexton (3.9 feet, MAN). MANU ANTHONY MAKES IT! Assist: Trae Turner
Score: 38-61

[09:49] Team_084 possession (Score: 38-61)
Klay Thompson makes the Layup and draws the foul on Michael Simmons! And-1! Klay Thompson to the line for 1. [Team fouls: 1] (Michael Simmons: 1 personal fouls)   FT 1/1: GOOD Klay Thompson makes 1/1 from the line.
Score: 41-61

[09:34] Team_015 possession (Score: 41-61)
Manu Anthony attempts a 3Pt. Contested by Luka Sexton (3.9 feet, MAN). MANU ANTHONY MAKES IT! Assist: Scottie Gasol
Score: 41-64

[09:19] Team_084 possession (Score: 41-64)
Giannis Quickley attempts a Midrange. Contested by Scottie Gasol (3.7 feet, ZONE). Giannis Quickley misses. Rebound secured by Trae Turner.

[09:04] Team_015 possession (Score: 41-64)
Scottie Gasol attempts a 3Pt. Contested by Luka Sexton (3.7 feet, ZONE). Scottie Gasol misses. Offensive rebound by Trae Turner! Trae Turner puts it back in!
Score: 41-66

[08:52] Team_084 possession (Score: 41-66)
Dejounte Ginobili throws a bad pass out of bounds! TURNOVER! (dead ball)

[08:39] Team_015 possession (Score: 41-66)
FOUL! Shooting foul on Klay Thompson. Scottie Gasol to the line for 3 free throws. [Team fouls: 4] (Klay Thompson: 1 personal fouls)   FT 1/3: GOOD   FT 2/3: GOOD   FT 3/3: GOOD Scottie Gasol makes 3/3 from the line.
Score: 41-69

[08:23] Team_084 possession (Score: 41-69)
Klay Thompson drives and kicks out. Klay Thompson attempts a Midrange. Contested by CJ Banchero (4.2 feet, MAN). Klay Thompson misses. Rebound secured by Michael Simmons.

[08:08] Team_015 possession (Score: 41-69)
Manu Anthony attempts a 3Pt. Contested by Luka Sexton (3.9 feet, ZONE). MANU ANTHONY MAKES IT! Assist: Scottie Gasol
Score: 41-72

[07:50] Team_084 possession (Score: 41-72)
Jarrett Booker attempts a 3Pt. Contested by Manu Anthony (3.9 feet, ZONE). Jarrett Booker misses. Rebound secured by CJ Banchero.

[07:37] Team_015 possession (Score: 41-72)
Michael Simmons drives and kicks out. Manu Anthony attempts a Midrange. Contested by Klay Thompson (4.8 feet, ZONE). Manu Anthony misses. Offensive rebound by Trae Turner! Trae Turner puts it back in!
Score: 41-74

[07:25] Team_084 possession (Score: 41-74)
Klay Thompson drives and kicks out. Luka Sexton attempts a 3Pt. Contested by Manu Anthony (3.6 feet, ZONE). Luka Sexton misses. Rebound secured by Michael Simmons.

[07:07] Team_015 possession (Score: 41-74)
Manu Anthony attempts a 3Pt. Contested by Luka Sexton (3.9 feet, MAN). Manu Anthony misses. Rebound secured by Klay Thompson.

[06:49] Team_084 possession (Score: 41-74)
Klay Thompson attempts a Layup. BLOCKED BY SCOTTIE GASOL! Ball is loose! Offensive rebound by Dejounte Ginobili! Dejounte Ginobili kicks it out.

[06:34] Team_084 possession (Score: 41-74)
Jarrett Booker attempts a 3Pt. Contested by Scottie Gasol (3.7 feet, MAN). JARRETT BOOKER MAKES IT! Assist: Klay Thompson
Score: 44-74

[06:19] Team_015 possession (Score: 44-74)
Trae Turner attempts a Layup. Contested by Giannis Quickley (4.6 feet, MAN). Trae Turner misses. Rebound secured by Klay Thompson.

[06:04] Team_084 possession (Score: 44-74)
Dejounte Ginobili attempts a Layup. Contested by Trae Turner (3.8 feet, ZONE). DEJOUNTE GINOBILI MAKES IT!
Score: 46-74

[05:51] Team_015 possession (Score: 46-74)
CJ Banchero attempts a 3Pt. Contested by Klay Thompson (4.6 feet, MAN). CJ Banchero misses. Rebound secured by Dejounte Ginobili.

[05:36] Team_084 possession (Score: 46-74)
FOUL! Reach-in foul on Scottie Gasol during the drive. [Team fouls: 3] No free throws, side out. (Scottie Gasol: 1 personal fouls)

[05:21] Team_084 possession (Score: 46-74)
FOUL! Shooting foul on Manu Anthony. Luka Sexton to the line for 3 free throws. [Team fouls: 4] (Manu Anthony: 1 personal fouls)   FT 1/3: GOOD   FT 2/3: GOOD   FT 3/3: GOOD Luka Sexton makes 3/3 from the line.
Score: 49-74

[05:07] Team_015 possession (Score: 49-74)
Manu Anthony attempts a 3Pt. Contested by Luka Sexton (4.0 feet, ZONE). Manu Anthony misses. Rebound secured by Giannis Quickley.

[04:50] Team_084 possession (Score: 49-74)
Jarrett Booker drives and kicks out. Jarrett Booker attempts a Midrange. Contested by Scottie Gasol (3.5 feet, MAN). Jarrett Booker misses. Rebound secured by CJ Banchero.

[04:33] Team_015 possession (Score: 49-74)
CJ Banchero attempts a 3Pt. Contested by Klay Thompson (4.7 feet, MAN). CJ Banchero misses. Rebound secured by Dejounte Ginobili.

[04:16] Team_084 possession (Score: 49-74)
FOUL! Offensive foul on Luka Sexton! Manu Anthony drew the charge! [Team fouls: 5] (Luka Sexton: 1 personal fouls) TURNOVER! (dead ball)

[04:01] Team_015 possession (Score: 49-74)
FOUL! Shooting foul on Giannis Quickley. Trae Turner to the line for 2 free throws. [BONUS: 6 team fouls] (Giannis Quickley: 3 personal fouls)   FT 1/2: GOOD   FT 2/2: MISS Trae Turner makes 1/2 from the line. Offensive rebound by Trae Turner! Trae Turner kicks it out.
Score: 49-75

[03:47] Team_015 possession (Score: 49-75)
CJ Banchero attempts a 3Pt. Contested by Klay Thompson (4.8 feet, ZONE). CJ BANCHERO MAKES IT! Assist: Manu Anthony
Score: 49-78

[03:34] Team_084 possession (Score: 49-78)
Klay Thompson attempts a Layup. BLOCKED BY MICHAEL SIMMONS! Ball goes out off Michael Simmons. Klay Thompson's ball!

[03:20] Team_084 possession (Score: 49-78)
FOUL! Shooting foul on Scottie Gasol. Luka Sexton to the line for 2 free throws. [BONUS: 5 team fouls] (Scottie Gasol: 2 personal fouls)   FT 1/2: GOOD   FT 2/2: GOOD Luka Sexton makes 2/2 from the line.
Score: 51-78

[03:05] Team_015 possession (Score: 51-78)
Trae Turner drives and kicks out. Manu Anthony attempts a Midrange. Contested by Jarrett Booker (4.8 feet, ZONE). Manu Anthony misses. Rebound secured by Giannis Quickley.

[02:50] Team_084 possession (Score: 51-78)
FOUL! Reach-in foul on Michael Simmons during the drive. [IN THE BONUS! 6 team fouls] Dejounte Ginobili to the line for 2 free throws. (Michael Simmons: 2 personal fouls)   FT 1/2: GOOD   FT 2/2: GOOD Dejounte Ginobili makes 2/2 from the line.
Score: 53-78

[02:35] Team_015 possession (Score: 53-78)
CJ Banchero attempts a 3Pt. Contested by Luka Sexton (3.7 feet, ZONE). CJ BANCHERO MAKES IT! Assist: Trae Turner
Score: 53-81

[02:21] Team_084 possession (Score: 53-81)
Jarrett Booker drives, Scottie Gasol stays with him. Jarrett Booker attempts a Layup. Contested by Scottie Gasol (4.0 feet, ZONE). JARRETT BOOKER MAKES IT!
Score: 55-81

[02:06] Team_015 possession (Score: 55-81)
Trae Turner makes the Dunk and draws the foul on Dejounte Ginobili! And-1! Trae Turner to the line for 1. [BONUS: 7 team fouls] (Dejounte Ginobili: 1 personal fouls)   FT 1/1: MISS Trae Turner makes 0/1 from the line. Offensive rebound by CJ Banchero! CJ Banchero kicks it out.
Score: 55-83

[01:53] Team_015 possession (Score: 55-83)
CJ Banchero attempts a Midrange. BLOCKED BY KLAY THOMPSON! Ball is loose! Rebound secured by Dejounte Ginobili.

[01:40] Team_084 possession (Score: 55-83)
Luka Sexton attempts a 3Pt. Contested by Manu Anthony (4.3 feet, MAN). LUKA SEXTON MAKES IT! Assist: Klay Thompson
Score: 58-83

[01:28] Team_015 possession (Score: 58-83)
CJ Banchero attempts a Layup. BLOCKED BY GIANNIS QUICKLEY! Ball is loose! Offensive rebound by CJ Banchero! CJ Banchero kicks it out.

[01:14] Team_015 possession (Score: 58-83)
Manu Anthony attempts a 3Pt. Contested by Luka Sexton (4.3 feet, MAN). Manu Anthony misses. Rebound secured by Klay Thompson.

[00:55] Team_084 possession (Score: 58-83)
Luka Sexton makes the Dunk and draws the foul on Scottie Gasol! And-1! Luka Sexton to the line for 1. [BONUS: 7 team fouls] (Scottie Gasol: 3 personal fouls)   FT 1/1: GOOD Luka Sexton makes 1/1 from the line.
Score: 61-83

[00:41] Team_015 possession (Score: 61-83)
Trae Turner attempts a Layup. BLOCKED BY DEJOUNTE GINOBILI! Ball goes out off Dejounte Ginobili. Trae Turner's ball!

[00:25] Team_015 possession (Score: 61-83)
Scottie Gasol attempts a 3Pt. Contested by Jarrett Booker (5.1 feet, MAN). Scottie Gasol misses. Rebound secured by Giannis Quickley.

[00:11] Team_084 possession (Score: 61-83)
Luka Sexton attempts a Midrange. Contested by Manu Anthony (4.4 feet, ZONE). Luka Sexton misses. Rebound secured by Trae Turner.

================================================================================
                              3RD QUARTER COMPLETE                              
================================================================================

3RD QUARTER SCORE: Team_084 25, Team_015 27

BOX SCORE:
================================================================================

Team_084
--------------------------------------------------------------------------------
Player                MIN  PTS  REB  AST  TO      FG   FG%      3P   3P%
--------------------------------------------------------------------------------
Luka Sexton            31   11    0    0   0   4/5    80.0     0/0   0.0
Dejounte Ginobili      31    6    5    0   0   3/5    60.0     0/0   0.0
Jarrett Booker         31    5    0    0   0   2/4    50.0     0/0   0.0
Klay Thompson          31    3    3    2   0   1/3    33.3     0/0   0.0
Giannis Quickley       31    0    4    1   0   0/2     0.0     0/0   0.0

TEAM: FG: 10/19 (52.6%), 3PT: 3/4 (75.0%), REB: 12 (1 off, 11 def), AST: 3, TO: 2
TEAM FOULS: 7 [Team_015 in BONUS]


Team_015
--------------------------------------------------------------------------------
Player                MIN  PTS  REB  AST  TO      FG   FG%      3P   3P%
--------------------------------------------------------------------------------
Manu Anthony           31    9    0    1   0   3/7    42.9     0/0   0.0
CJ Banchero            31    8    6    0   0   3/6    50.0     0/0   0.0
Trae Turner            31    4    6    2   0   2/4    50.0     0/0   0.0
Scottie Gasol          31    3    0    3   0   1/2    50.0     0/0   0.0
Michael Simmons        31    0    2    0   0   0/1     0.0     0/0   0.0

TEAM: FG: 9/20 (45.0%), 3PT: 7/13 (53.8%), REB: 14 (5 off, 9 def), AST: 6, TO: 0
TEAM FOULS: 7 [Team_084 in BONUS]

================================================================================

================================================================================
                       4TH QUARTER - Team_084 vs Team_015                       
================================================================================

[12:00] Substitution (Team_084): Luka Sexton OUT (stamina: 71) → Magic Bryant IN (comeback_detected)

[12:00] Substitution (Team_015): Manu Anthony OUT (stamina: 70) → Dwyane Sabonis IN (comeback_detected)

[12:00] Team_084 possession (Score: 61-83)
FOUL! Holding foul on Michael Simmons. [Team fouls: 1] No free throws, side out. (Michael Simmons: 1 personal fouls)

[11:45] Team_084 possession (Score: 61-83)
Giannis Quickley attempts a 3Pt. Contested by Michael Simmons (3.9 feet, ZONE). GIANNIS QUICKLEY MAKES IT! Assist: Klay Thompson
Score: 64-83

[11:30] Team_015 possession (Score: 64-83)
Trae Turner drives, picks up Giannis Quickley. Help arrives from Dejounte Ginobili! Trae Turner attempts a Dunk. Contested by Dejounte Ginobili (4.9 feet, MAN). TRAE TURNER MAKES IT! Assist: Michael Simmons
Score: 64-85

[11:10] Team_084 possession (Score: 64-85)
Jarrett Booker attempts a Midrange. Contested by Michael Simmons (3.9 feet, ZONE). Jarrett Booker misses. Rebound secured by Trae Turner.

[10:53] Team_015 possession (Score: 64-85)
Dwyane Sabonis attempts a 3Pt. Contested by Dejounte Ginobili (5.2 feet, ZONE). Dwyane Sabonis misses. Rebound secured by Dejounte Ginobili.

[10:34] Team_084 possession (Score: 64-85)
Giannis Quickley drives, Trae Turner stays with him. Giannis Quickley attempts a Dunk. Contested by Trae Turner (4.4 feet, MAN). GIANNIS QUICKLEY MAKES IT! Assist: Klay Thompson
Score: 66-85

[10:21] Team_015 possession (Score: 66-85)
FOUL! Reach-in foul on Jarrett Booker during the drive. [Team fouls: 1] No free throws, side out. (Jarrett Booker: 1 personal fouls)

[10:07] Team_015 possession (Score: 66-85)
CJ Banchero attempts a 3Pt. Contested by Magic Bryant (3.4 feet, ZONE). CJ Banchero misses. Offensive rebound by CJ Banchero! CJ Banchero kicks it out.

[09:52] Team_015 possession (Score: 66-85)
Scottie Gasol attempts a 3Pt. Contested by Jarrett Booker (5.1 feet, MAN). SCOTTIE GASOL MAKES IT! Assist: Michael Simmons
Score: 66-88

[09:35] Team_084 possession (Score: 66-88)
Jarrett Booker attempts a 3Pt. Contested by CJ Banchero (5.0 feet, ZONE). Jarrett Booker misses. Rebound secured by Trae Turner.

[09:23] Team_015 possession (Score: 66-88)
Trae Turner drives and kicks out. Dwyane Sabonis attempts a 3Pt. Contested by Magic Bryant (3.7 feet, ZONE). Dwyane Sabonis misses. Rebound secured by Klay Thompson.

[09:09] Team_084 possession (Score: 66-88)
Magic Bryant attempts a 3Pt. Contested by CJ Banchero (4.9 feet, ZONE). Magic Bryant misses. Rebound secured by CJ Banchero.

[08:56] Team_015 possession (Score: 66-88)
Michael Simmons drives and kicks out. CJ Banchero attempts a Midrange. Contested by Klay Thompson (5.5 feet, MAN). CJ Banchero misses. Rebound secured by Klay Thompson.

[08:39] Team_084 possession (Score: 66-88)
Klay Thompson attempts a 3Pt. Contested by CJ Banchero (5.3 feet, ZONE). Klay Thompson misses. Offensive rebound by Giannis Quickley! Giannis Quickley's putback is no good. Rebound secured by Trae Turner.

[08:24] Team_015 possession (Score: 66-88)
CJ Banchero makes the 3Pt and draws the foul on Magic Bryant! And-1! CJ Banchero to the line for 1. [Team fouls: 2] (Magic Bryant: 1 personal fouls)   FT 1/1: GOOD CJ Banchero makes 1/1 from the line.
Score: 66-92

[08:10] Team_084 possession (Score: 66-92)
Klay Thompson attempts a Layup. BLOCKED BY CJ BANCHERO! Ball is loose! Rebound secured by Michael Simmons.

[07:56] Team_015 possession (Score: 66-92)
Scottie Gasol drives, Jarrett Booker stays with him. Scottie Gasol attempts a Dunk. Contested by Jarrett Booker (5.3 feet, MAN). SCOTTIE GASOL MAKES IT!
Score: 66-94

[07:41] Team_084 possession (Score: 66-94)
Jarrett Booker drives, picks up Scottie Gasol. Help arrives from Michael Simmons! Jarrett Booker attempts a Layup. Contested by Michael Simmons (4.5 feet, ZONE). JARRETT BOOKER MAKES IT! Assist: Giannis Quickley
Score: 68-94

[07:27] Team_015 possession (Score: 68-94)
CJ Banchero attempts a Midrange. Contested by Magic Bryant (3.4 feet, ZONE). CJ BANCHERO MAKES IT! Assist: Scottie Gasol
Score: 68-96

[07:15] Team_084 possession (Score: 68-96)
Klay Thompson attempts a 3Pt. Contested by CJ Banchero (5.4 feet, MAN). Klay Thompson misses. Rebound secured by Dwyane Sabonis.

[06:57] Team_015 possession (Score: 68-96)
CJ Banchero attempts a Midrange. Contested by Klay Thompson (5.6 feet, MAN). CJ Banchero misses. Rebound secured by Klay Thompson.

[06:41] Team_084 possession (Score: 68-96)
Dejounte Ginobili drives, picks up Michael Simmons. Help arrives from CJ Banchero! Dejounte Ginobili attempts a Layup. Contested by CJ Banchero (4.5 feet, MAN). DEJOUNTE GINOBILI MAKES IT! Assist: Magic Bryant
Score: 70-96

[06:31] Team_015 possession (Score: 70-96)
Michael Simmons attempts a Midrange. Contested by Dejounte Ginobili (5.4 feet, MAN). MICHAEL SIMMONS MAKES IT! Assist: Scottie Gasol
Score: 70-98

[06:16] Team_084 possession (Score: 70-98)
Jarrett Booker attempts a 3Pt. Contested by Dwyane Sabonis (4.9 feet, ZONE). Jarrett Booker misses. FOUL! Loose ball foul on Michael Simmons during the rebound battle. [Team fouls: 2] No free throws, side out. (Michael Simmons: 2 personal fouls)

[06:01] Team_084 possession (Score: 70-98)
Dejounte Ginobili commits a violation (traveling/carry)! TURNOVER! (dead ball)

[06:01] Substitution (Team_084): Dejounte Ginobili OUT → Chris Parker IN (stamina_rule2)

[06:01] Substitution (Team_084): Klay Thompson OUT → Evan Quickley IN (stamina_rule2)

[06:01] Substitution (Team_084): Jarrett Booker OUT → Pascal Jackson IN (stamina_rule2)

[06:01] Substitution (Team_084): Giannis Quickley OUT → Dejounte Porzingis IN (stamina_rule2)

[06:01] Substitution (Team_015): Michael Simmons OUT → Paolo Jokic IN (stamina_rule2)

[06:01] Substitution (Team_015): CJ Banchero OUT → Magic Wagner IN (stamina_rule2)

[06:01] Substitution (Team_015): Scottie Gasol OUT → Rudy Paul IN (stamina_rule2)

[06:01] Substitution (Team_015): Trae Turner OUT → Allen Curry IN (stamina_rule2)

[05:45] Team_015 possession (Score: 70-98)
Dwyane Sabonis drives and kicks out. Dwyane Sabonis attempts a Midrange. Contested by Magic Bryant (3.7 feet, MAN). Dwyane Sabonis misses. Rebound secured by Pascal Jackson.

[05:30] Team_084 possession (Score: 70-98)
Chris Parker drives, Rudy Paul stays with him. Chris Parker attempts a Dunk. Contested by Rudy Paul (3.4 feet, ZONE). Chris Parker misses. Offensive rebound by Dejounte Porzingis! Dejounte Porzingis kicks it out.

[05:14] Team_084 possession (Score: 70-98)
FOUL! Shooting foul on Rudy Paul. Dejounte Porzingis to the line for 3 free throws. [Team fouls: 3] (Rudy Paul: 1 personal fouls)   FT 1/3: MISS   FT 2/3: MISS   FT 3/3: GOOD Dejounte Porzingis makes 1/3 from the line.
Score: 71-98

[05:03] Team_015 possession (Score: 71-98)
Paolo Jokic attempts a Midrange. Contested by Chris Parker (5.1 feet, MAN). PAOLO JOKIC MAKES IT!
Score: 71-100

[04:50] Team_084 possession (Score: 71-100)
Evan Quickley loses the ball! Stripped by Magic Wagner! TURNOVER! (live ball)

[04:37] Team_015 possession (Score: 71-100)
Dwyane Sabonis attempts a 3Pt. Contested by Magic Bryant (4.0 feet, ZONE). Dwyane Sabonis misses. Rebound secured by Pascal Jackson.

[04:24] Team_084 possession (Score: 71-100)
FOUL! Shooting foul on Rudy Paul. Dejounte Porzingis to the line for 3 free throws. [Team fouls: 4] (Rudy Paul: 2 personal fouls)   FT 1/3: GOOD   FT 2/3: GOOD   FT 3/3: GOOD Dejounte Porzingis makes 3/3 from the line.
Score: 74-100

[04:09] Team_015 possession (Score: 74-100)
Rudy Paul makes the Midrange and draws the foul on Pascal Jackson! And-1! Rudy Paul to the line for 1. [Team fouls: 3] (Pascal Jackson: 1 personal fouls)   FT 1/1: GOOD Rudy Paul makes 1/1 from the line.
Score: 74-103

[03:59] Team_084 possession (Score: 74-103)
Chris Parker attempts a 3Pt. Contested by Paolo Jokic (5.7 feet, MAN). Chris Parker misses. Offensive rebound by Pascal Jackson! Pascal Jackson kicks it out.

[03:47] Team_084 possession (Score: 74-103)
Chris Parker makes the Midrange and draws the foul on Paolo Jokic! And-1! Chris Parker to the line for 1. [BONUS: 5 team fouls] (Paolo Jokic: 1 personal fouls)   FT 1/1: GOOD Chris Parker makes 1/1 from the line.
Score: 77-103

[03:37] Team_015 possession (Score: 77-103)
FOUL! Reach-in foul on Dejounte Porzingis during the drive. [Team fouls: 4] No free throws, side out. (Dejounte Porzingis: 1 personal fouls)

[03:20] Team_015 possession (Score: 77-103)
Rudy Paul attempts a 3Pt. Contested by Magic Bryant (4.5 feet, ZONE). Rudy Paul misses. Offensive rebound by Rudy Paul! Rudy Paul's putback is no good. Rebound secured by Pascal Jackson.

[03:06] Team_084 possession (Score: 77-103)
Dejounte Porzingis drives to the basket... Dejounte Porzingis throws a bad pass! Stolen by Rudy Paul! TURNOVER! (live ball)

[02:54] Team_015 possession (Score: 77-103)
Magic Wagner makes the Midrange and draws the foul on Evan Quickley! And-1! Magic Wagner to the line for 1. [BONUS: 5 team fouls] (Evan Quickley: 1 personal fouls)   FT 1/1: GOOD Magic Wagner makes 1/1 from the line.
Score: 77-106

[02:42] Team_084 possession (Score: 77-106)
Pascal Jackson drives to the basket... FOUL! Offensive foul on Pascal Jackson! Rudy Paul drew the charge! [Team fouls: 6] (Pascal Jackson: 2 personal fouls) TURNOVER! (dead ball)

[02:26] Team_015 possession (Score: 77-106)
Paolo Jokic makes the Layup and draws the foul on Pascal Jackson! And-1! Paolo Jokic to the line for 1. [BONUS: 7 team fouls] (Pascal Jackson: 3 personal fouls)   FT 1/1: GOOD Paolo Jokic makes 1/1 from the line.
Score: 77-109

[02:07] Team_084 possession (Score: 77-109)
Magic Bryant drives and kicks out. Chris Parker attempts a 3Pt. Contested by Rudy Paul (3.2 feet, ZONE). Chris Parker misses. Rebound secured by Allen Curry.

[01:57] Team_015 possession (Score: 77-109)
Allen Curry attempts a Layup. Contested by Dejounte Porzingis (5.4 feet, MAN). ALLEN CURRY MAKES IT! Assist: Paolo Jokic
Score: 77-111

[01:43] Team_084 possession (Score: 77-111)
Chris Parker attempts a 3Pt. Contested by Rudy Paul (3.4 feet, ZONE). Chris Parker misses. Rebound secured by Magic Wagner.

[01:27] Team_015 possession (Score: 77-111)
Magic Wagner makes the Midrange and draws the foul on Evan Quickley! And-1! Magic Wagner to the line for 1. [BONUS: 8 team fouls] (Evan Quickley: 2 personal fouls)   FT 1/1: GOOD Magic Wagner makes 1/1 from the line.
Score: 77-114

[01:12] Team_084 possession (Score: 77-114)
Chris Parker attempts a 3Pt. Contested by Paolo Jokic (5.7 feet, MAN). Chris Parker misses. Offensive rebound by Pascal Jackson! Pascal Jackson kicks it out.

[01:00] Team_084 possession (Score: 77-114)
Dejounte Porzingis attempts a 3Pt. Contested by Rudy Paul (3.3 feet, MAN). Dejounte Porzingis misses. Rebound secured by Rudy Paul.

[00:48] Team_015 possession (Score: 77-114)
Magic Wagner attempts a Layup. Contested by Dejounte Porzingis (5.0 feet, ZONE). MAGIC WAGNER MAKES IT! Assist: Rudy Paul
Score: 77-116

[00:36] Team_084 possession (Score: 77-116)
Evan Quickley attempts a 3Pt. Contested by Magic Wagner (5.3 feet, MAN). Evan Quickley misses. Rebound secured by Rudy Paul.

[00:24] Team_015 possession (Score: 77-116)
FOUL! Holding foul on Dejounte Porzingis. [IN THE BONUS! 9 team fouls] Allen Curry to the line for 2 free throws. (Dejounte Porzingis: 2 personal fouls)   FT 1/2: GOOD   FT 2/2: GOOD Allen Curry makes 2/2 from the line.
Score: 77-118

[00:12] Team_084 possession (Score: 77-118)
Evan Quickley attempts a 3Pt. Contested by Magic Wagner (5.3 feet, MAN). Evan Quickley misses. Offensive rebound by Dejounte Porzingis! Dejounte Porzingis kicks it out.

[00:02] Team_084 possession (Score: 77-118)
Dejounte Porzingis drives and kicks out. Magic Bryant attempts a 3Pt. Contested by Rudy Paul (3.2 feet, ZONE). Magic Bryant misses. Rebound secured by Allen Curry.

================================================================================
                              4TH QUARTER COMPLETE                              
================================================================================

4TH QUARTER SCORE: Team_084 16, Team_015 35

BOX SCORE:
================================================================================

Team_084
--------------------------------------------------------------------------------
Player                MIN  PTS  REB  AST  TO      FG   FG%      3P   3P%
--------------------------------------------------------------------------------
Giannis Quickley       37    5    1    1   0   2/2   100.0     0/0   0.0
Dejounte Porzingis     11    4    2    0   0   2/4    50.0     0/0   0.0
Chris Parker           11    3    0    0   0   1/2    50.0     0/0   0.0
Trae Turner            37    2    3    0   0   1/2    50.0     0/0   0.0
Jarrett Booker         37    2    0    0   0   1/3    33.3     0/0   0.0
Dejounte Ginobili      37    2    1    0   0   1/1   100.0     0/0   0.0
Klay Thompson          37    0    3    2   0   0/3     0.0     0/0   0.0
Magic Bryant           18    0    0    1   0   0/2     0.0     0/0   0.0
Pascal Jackson         11    0    5    0   0   0/0     0.0     0/0   0.0
Evan Quickley          11    0    0    0   0   0/1     0.0     0/0   0.0

TEAM: FG: 7/18 (38.9%), 3PT: 3/10 (30.0%), REB: 12 (6 off, 6 def), AST: 4, TO: 4
TEAM FOULS: 9 [Team_015 in BONUS]


Team_015
--------------------------------------------------------------------------------
Player                MIN  PTS  REB  AST  TO      FG   FG%      3P   3P%
--------------------------------------------------------------------------------
Magic Wagner           11    8    1    0   0   3/3   100.0     0/0   0.0
CJ Banchero            37    6    2    0   0   2/3    66.7     0/0   0.0
Scottie Gasol          37    5    0    2   0   2/2   100.0     0/0   0.0
Paolo Jokic            11    5    0    1   0   2/2   100.0     0/0   0.0
Allen Curry            11    4    2    0   0   2/2   100.0     0/0   0.0
Rudy Paul              11    3    2    1   0   1/2    50.0     0/0   0.0
Michael Simmons        37    2    1    2   0   1/2    50.0     0/0   0.0
Dwyane Sabonis         18    0    1    0   0   0/3     0.0     0/0   0.0

TEAM: FG: 14/21 (66.7%), 3PT: 2/5 (40.0%), REB: 12 (2 off, 10 def), AST: 6, TO: 0
TEAM FOULS: 5 [Team_084 in BONUS]

================================================================================

================================================================================
                               FULL GAME COMPLETE                               
================================================================================

FINAL SCORE: Team_084 77, Team_015 118

SCORING BY QUARTER:
--------------------------------------------------------------------------------
Team                     Q1     Q2     Q3     Q4    FINAL
--------------------------------------------------------------------------------
Team_084                 20     16     25     16       77
Team_015                 32     24     27     35      118
--------------------------------------------------------------------------------

FULL GAME BOX SCORE:
================================================================================

Team_084
--------------------------------------------------------------------------------
Player                MIN  PTS  REB  AST  TO      FG   FG%      3P   3P%      FT STL BLK
--------------------------------------------------------------------------------
Dejounte Ginobili      37   10   12    0   3   6/13   46.2   1/6    16.7   4/7     0   1
Klay Thompson          37    8   10    4   0   3/10   30.0   1/5    20.0   1/1     0   2
Jarrett Booker         37   12    0    1   1   5/11   45.5   1/3    33.3   1/1     0   0
Giannis Quickley       37   17   12    3   1   5/13   38.5   1/2    50.0   2/3     2   2
Luka Sexton            31   15    0    2   2   7/14   50.0   2/6    33.3   6/6     1   0
Magic Bryant           18    0    0    1   1   1/5    20.0   0/3     0.0   0/0     0   0
Chris Parker           11    6    0    0   1   2/5    40.0   1/4    25.0   1/1     0   0
Evan Quickley          11    0    0    0   2   0/1     0.0   0/1     0.0   0/0     0   0
Pascal Jackson         11    1    6    1   1   0/1     0.0   0/1     0.0   1/2     0   0
Dejounte Porzingis     11    4    2    0   1   2/4    50.0   2/3    66.7   4/6     2   0

TEAM: FG: 31/77 (40.3%), 3PT: 9/34 (26.5%), REB: 42 (10 off, 32 def), AST: 12, TO: 13


Team_015
--------------------------------------------------------------------------------
Player                MIN  PTS  REB  AST  TO      FG   FG%      3P   3P%      FT STL BLK
--------------------------------------------------------------------------------
Michael Simmons        37    6   12    5   0   3/8    37.5   1/3    33.3   1/1     1   1
CJ Banchero            37   27   11    0   2  10/16   62.5   6/8    75.0   1/1     0   1
Scottie Gasol          37   16    0    6   3   8/12   66.7   5/9    55.6   4/6     1   1
Trae Turner            37   16   20    3   0   5/10   50.0   0/0     0.0   3/7     0   0
Manu Anthony           31   12    0    3   2   4/12   33.3   4/11   36.4   1/3     0   0
Dwyane Sabonis         18    2    1    2   0   1/4    25.0   0/2     0.0   0/0     0   0
Paolo Jokic            11    7    0    2   0   3/3   100.0   0/0     0.0   1/1     0   0
Magic Wagner           11   10    3    1   1   4/4   100.0   0/0     0.0   2/2     2   0
Rudy Paul              11    5    5    1   0   2/3    66.7   0/1     0.0   1/1     2   0
Allen Curry            11    9    5    0   1   3/4    75.0   0/1     0.0   4/4     0   0

TEAM: FG: 44/78 (56.4%), 3PT: 16/35 (45.7%), REB: 57 (13 off, 44 def), AST: 23, TO: 9

================================================================================
