================================================================================
                        FULL GAME - Team_003 vs Team_051                        
================================================================================

================================================================================
                       1ST QUARTER - Team_003 vs Team_051                       
================================================================================

[12:00] Team_003 possession (Score: 0-0)
Rudy Haliburton attempts a 3Pt. Contested by OG Siakam (3.9 feet, MAN). Rudy Haliburton misses. Offensive rebound by Victor O'Neal! Victor O'Neal kicks it out.

[11:45] Team_003 possession (Score: 0-0)
Nikola Bryant makes the Layup and draws the foul on OG Siakam! And-1! Nikola Bryant to the line for 1. [Team fouls: 1] (OG Siakam: 1 personal fouls)   FT 1/1: GOOD Nikola Bryant makes 1/1 from the line.
Score: 3-0

[11:34] Team_051 possession (Score: 3-0)
Austin Sexton attempts a Layup. Contested by Ayo Jackson (5.3 feet, MAN). AUSTIN SEXTON MAKES IT! Assist: Franz Simmons
Score: 3-2

[11:17] Team_003 possession (Score: 3-2)
FOUL! Shooting foul on Franz Simmons. Nikola Bryant to the line for 2 free throws. [Team fouls: 2] (Franz Simmons: 1 personal fouls)   FT 1/2: GOOD   FT 2/2: GOOD Nikola Bryant makes 2/2 from the line.
Score: 5-2

[11:06] Team_051 possession (Score: 5-2)
OG Siakam attempts a 3Pt. Contested by Ayo Jackson (5.5 feet, ZONE). OG SIAKAM MAKES IT! Assist: Shaquille Harden
Score: 5-5

[10:53] Team_003 possession (Score: 5-5)
Nikola Bryant attempts a 3Pt. Contested by Larry McGrady (4.7 feet, MAN). Nikola Bryant misses. Rebound secured by Shaquille Harden.

[10:39] Team_051 possession (Score: 5-5)
Austin Sexton commits a violation (traveling/carry)! TURNOVER! (dead ball)

[10:25] Team_003 possession (Score: 5-5)
Ayo Jackson attempts a 3Pt. Contested by Austin Sexton (4.7 feet, MAN). Ayo Jackson misses. Rebound secured by Franz Simmons.

[10:12] Team_051 possession (Score: 5-5)
OG Siakam attempts a 3Pt. Contested by Rudy Haliburton (3.5 feet, MAN). OG Siakam misses. Rebound secured by Giannis Turner.

[09:57] Team_003 possession (Score: 5-5)
Giannis Turner makes the Midrange and draws the foul on Larry McGrady! And-1! Giannis Turner to the line for 1. [Team fouls: 3] (Larry McGrady: 1 personal fouls)   FT 1/1: MISS Giannis Turner makes 0/1 from the line. Rebound secured by Franz Simmons.
Score: 7-5

[09:38] Team_051 possession (Score: 7-5)
OG Siakam attempts a 3Pt. Contested by Rudy Haliburton (3.5 feet, MAN). OG Siakam misses. Rebound secured by Giannis Turner.

[09:21] Team_003 possession (Score: 7-5)
Nikola Bryant attempts a 3Pt. Contested by Austin Sexton (4.6 feet, ZONE). Nikola Bryant misses. Rebound secured by OG Siakam.

[09:09] Team_051 possession (Score: 7-5)
OG Siakam attempts a 3Pt. Contested by Giannis Turner (3.1 feet, ZONE). OG SIAKAM MAKES IT! Assist: Franz Simmons
Score: 7-8

[08:53] Team_003 possession (Score: 7-8)
Giannis Turner attempts a Midrange. Contested by Shaquille Harden (4.5 feet, ZONE). GIANNIS TURNER MAKES IT! Assist: Nikola Bryant
Score: 9-8

[08:40] Team_051 possession (Score: 9-8)
OG Siakam attempts a 3Pt. Contested by Giannis Turner (3.1 feet, ZONE). OG Siakam misses. Offensive rebound by Shaquille Harden! Shaquille Harden puts it back in!
Score: 9-10

[08:27] Team_003 possession (Score: 9-10)
Giannis Turner drives and kicks out. Giannis Turner attempts a 3Pt. Contested by Austin Sexton (4.4 feet, ZONE). Giannis Turner misses. Rebound secured by Shaquille Harden.

[08:16] Team_051 possession (Score: 9-10)
Larry McGrady attempts a Layup. Contested by Giannis Turner (3.1 feet, ZONE). LARRY MCGRADY MAKES IT!
Score: 9-12

[08:02] Team_003 possession (Score: 9-12)
Nikola Bryant throws a bad pass out of bounds! TURNOVER! (dead ball)

[07:46] Team_051 possession (Score: 9-12)
FOUL! Reach-in foul on Giannis Turner during the drive. [Team fouls: 1] No free throws, side out. (Giannis Turner: 1 personal fouls)

[07:34] Team_051 possession (Score: 9-12)
Austin Sexton attempts a 3Pt. Contested by Ayo Jackson (5.3 feet, MAN). AUSTIN SEXTON MAKES IT! Assist: OG Siakam
Score: 9-15

[07:22] Team_003 possession (Score: 9-15)
Ayo Jackson attempts a 3Pt. Contested by Austin Sexton (4.7 feet, MAN). Ayo Jackson misses. Offensive rebound by Rudy Haliburton! Rudy Haliburton puts it back in!
Score: 11-15

[07:07] Team_051 possession (Score: 11-15)
Shaquille Harden attempts a 3Pt. Contested by Giannis Turner (2.7 feet, ZONE). Shaquille Harden misses. Rebound secured by Victor O'Neal.

[06:52] Team_003 possession (Score: 11-15)
Giannis Turner attempts a Midrange. BLOCKED BY FRANZ SIMMONS! Ball goes out off Franz Simmons. Giannis Turner's ball!

[06:35] Team_003 possession (Score: 11-15)
Nikola Bryant attempts a 3Pt. Contested by Larry McGrady (4.7 feet, MAN). Nikola Bryant misses. Offensive rebound by Rudy Haliburton! Rudy Haliburton puts it back in!
Score: 13-15

[06:23] Team_051 possession (Score: 13-15)
OG Siakam attempts a 3Pt. Contested by Giannis Turner (3.1 feet, ZONE). OG SIAKAM MAKES IT!
Score: 13-18

[06:12] Team_003 possession (Score: 13-18)
Victor O'Neal drives and kicks out. Nikola Bryant attempts a Midrange. Contested by Larry McGrady (4.4 feet, MAN). NIKOLA BRYANT MAKES IT! Assist: Rudy Haliburton
Score: 15-18

[05:55] Team_051 possession (Score: 15-18)
OG Siakam attempts a 3Pt. Contested by Rudy Haliburton (3.5 feet, MAN). OG Siakam misses. FOUL! Loose ball foul on Giannis Turner during the rebound battle. [Team fouls: 2] No free throws, side out. (Giannis Turner: 2 personal fouls)

[05:42] Team_051 possession (Score: 15-18)
Franz Simmons attempts a Layup. Contested by Giannis Turner (3.3 feet, MAN). FRANZ SIMMONS MAKES IT!
Score: 15-20

[05:30] Team_003 possession (Score: 15-20)
Victor O'Neal attempts a Midrange. Contested by Shaquille Harden (4.1 feet, MAN). VICTOR O'NEAL MAKES IT!
Score: 17-20

[05:16] Team_051 possession (Score: 17-20)
Larry McGrady attempts a Midrange. Contested by Nikola Bryant (4.3 feet, MAN). LARRY MCGRADY MAKES IT! Assist: Austin Sexton
Score: 17-22

[05:02] Team_003 possession (Score: 17-22)
Victor O'Neal drives, Franz Simmons stays with him. Victor O'Neal attempts a Layup. Contested by Franz Simmons (4.2 feet, ZONE). VICTOR O'NEAL MAKES IT! Assist: Nikola Bryant
Score: 19-22

[04:51] Team_051 possession (Score: 19-22)
OG Siakam attempts a 3Pt. Contested by Rudy Haliburton (3.6 feet, MAN). OG Siakam misses. Offensive rebound by Shaquille Harden! Shaquille Harden puts it back in!
Score: 19-24

[04:40] Team_003 possession (Score: 19-24)
Giannis Turner attempts a 3Pt. Contested by Austin Sexton (4.7 feet, ZONE). GIANNIS TURNER MAKES IT! Assist: Rudy Haliburton
Score: 22-24

[04:23] Team_051 possession (Score: 22-24)
Franz Simmons attempts a 3Pt. Contested by Giannis Turner (3.4 feet, MAN). Franz Simmons misses. Rebound secured by Victor O'Neal.

[04:12] Team_003 possession (Score: 22-24)
FOUL! Shooting foul on OG Siakam. Rudy Haliburton to the line for 2 free throws. [Team fouls: 4] (OG Siakam: 2 personal fouls)   FT 1/2: GOOD   FT 2/2: MISS Rudy Haliburton makes 1/2 from the line. Rebound secured by Shaquille Harden.
Score: 23-24

[03:58] Team_051 possession (Score: 23-24)
Larry McGrady attempts a Layup. Contested by Nikola Bryant (4.4 feet, MAN). LARRY MCGRADY MAKES IT! Assist: OG Siakam
Score: 23-26

[03:40] Team_003 possession (Score: 23-26)
Ayo Jackson attempts a 3Pt. Contested by Austin Sexton (4.8 feet, MAN). Ayo Jackson misses. Offensive rebound by Rudy Haliburton! Rudy Haliburton kicks it out.

[03:28] Team_003 possession (Score: 23-26)
Ayo Jackson attempts a Midrange. Contested by Larry McGrady (4.9 feet, ZONE). Ayo Jackson misses. Offensive rebound by Victor O'Neal! Victor O'Neal kicks it out.

[03:17] Team_003 possession (Score: 23-26)
Ayo Jackson attempts a 3Pt. Contested by Austin Sexton (4.8 feet, MAN). Ayo Jackson misses. Rebound secured by OG Siakam.

[03:01] Team_051 possession (Score: 23-26)
OG Siakam attempts a 3Pt. Contested by Giannis Turner (3.3 feet, ZONE). OG SIAKAM MAKES IT!
Score: 23-29

[02:46] Team_003 possession (Score: 23-29)
FOUL! Holding foul on OG Siakam. [IN THE BONUS! 5 team fouls] Rudy Haliburton to the line for 2 free throws. (OG Siakam: 3 personal fouls)   FT 1/2: GOOD   FT 2/2: GOOD Rudy Haliburton makes 2/2 from the line.
Score: 25-29

[02:33] Team_051 possession (Score: 25-29)
Larry McGrady attempts a 3Pt. Contested by Giannis Turner (3.4 feet, ZONE). LARRY MCGRADY MAKES IT! Assist: OG Siakam
Score: 25-32

[02:14] Team_003 possession (Score: 25-32)
FOUL! Shooting foul on Franz Simmons. Victor O'Neal to the line for 2 free throws. [BONUS: 6 team fouls] (Franz Simmons: 2 personal fouls)   FT 1/2: GOOD   FT 2/2: GOOD Victor O'Neal makes 2/2 from the line.
Score: 27-32

[02:01] Team_051 possession (Score: 27-32)
Austin Sexton attempts a 3Pt. Contested by Ayo Jackson (5.6 feet, MAN). Austin Sexton misses. Rebound secured by Rudy Haliburton.

[01:45] Team_003 possession (Score: 27-32)
Rudy Haliburton drives to the basket... Rudy Haliburton throws a bad pass out of bounds! TURNOVER! (dead ball)

[01:45] Substitution (Team_003): Ayo Jackson OUT → Miles Towns IN (stamina_rule2)

[01:45] Substitution (Team_003): Nikola Bryant OUT → Pau Williamson IN (stamina_rule2)

[01:45] Substitution (Team_003): Rudy Haliburton OUT → Collin Mitchell IN (stamina_rule2)

[01:45] Substitution (Team_003): Giannis Turner OUT → Anfernee Jordan IN (stamina_rule2)

[01:45] Substitution (Team_003): Victor O'Neal OUT → Bam Gilgeous-Alexander IN (stamina_rule2)

[01:45] Substitution (Team_051): Austin Sexton OUT → Myles Harden IN (stamina_rule2)

[01:45] Substitution (Team_051): Larry McGrady OUT → Zion Morant IN (stamina_rule2)

[01:45] Substitution (Team_051): OG Siakam OUT → Jrue Carter IN (stamina_rule2)

[01:45] Substitution (Team_051): Franz Simmons OUT → Tobias Jokic IN (stamina_rule2)

[01:45] Substitution (Team_051): Shaquille Harden OUT → Pau Tatum IN (stamina_rule2)

[01:32] Team_051 possession (Score: 27-32)
Pau Tatum makes the Midrange and draws the foul on Anfernee Jordan! And-1! Pau Tatum to the line for 1. [Team fouls: 3] (Anfernee Jordan: 1 personal fouls)   FT 1/1: MISS Pau Tatum makes 0/1 from the line. Rebound secured by Bam Gilgeous-Alexander.
Score: 27-34

[01:17] Team_003 possession (Score: 27-34)
Collin Mitchell loses the ball! Stripped by Jrue Carter! TURNOVER! (live ball)

[00:57] Team_051 possession (Score: 27-34)
Myles Harden drives, Miles Towns stays with him. Myles Harden attempts a Dunk. Contested by Miles Towns (5.0 feet, MAN). MYLES HARDEN MAKES IT!
Score: 27-36

[00:44] Team_003 possession (Score: 27-36)
FOUL! Holding foul on Zion Morant. [IN THE BONUS! 7 team fouls] Pau Williamson to the line for 2 free throws. (Zion Morant: 1 personal fouls)   FT 1/2: GOOD   FT 2/2: GOOD Pau Williamson makes 2/2 from the line.
Score: 29-36

[00:30] Team_051 possession (Score: 29-36)
Tobias Jokic attempts a 3Pt. Contested by Bam Gilgeous-Alexander (3.2 feet, MAN). Tobias Jokic misses. Rebound secured by Anfernee Jordan.

[00:12] Team_003 possession (Score: 29-36)
Pau Williamson attempts a Midrange. Contested by Zion Morant (5.5 feet, MAN). PAU WILLIAMSON MAKES IT! Assist: Collin Mitchell
Score: 31-36

================================================================================
                              1ST QUARTER COMPLETE                              
================================================================================

1ST QUARTER SCORE: Team_003 31, Team_051 36

BOX SCORE:
================================================================================

Team_003
--------------------------------------------------------------------------------
Player                MIN  PTS  REB  AST  TO      FG   FG%      3P   3P%
--------------------------------------------------------------------------------
Nikola Bryant          10    7    0    2   0   3/5    60.0     0/0   0.0
Victor O'Neal          10    6    4    0   0   3/3   100.0     0/0   0.0
Rudy Haliburton        10    6    4    2   0   3/4    75.0     0/0   0.0
Giannis Turner         10    5    2    0   0   2/4    50.0     0/0   0.0
Pau Williamson          2    4    0    0   0   2/2   100.0     0/0   0.0
Ayo Jackson            10    0    0    0   0   0/2     0.0     0/0   0.0
Bam Gilgeous-Alexander    2    0    1    0   0   0/0     0.0     0/0   0.0
Anfernee Jordan         2    0    1    0   0   0/0     0.0     0/0   0.0
Collin Mitchell         2    0    0    1   0   0/0     0.0     0/0   0.0

TEAM: FG: 13/20 (65.0%), 3PT: 3/7 (42.9%), REB: 12 (5 off, 7 def), AST: 5, TO: 3
TEAM FOULS: 3


Team_051
--------------------------------------------------------------------------------
Player                MIN  PTS  REB  AST  TO      FG   FG%      3P   3P%
--------------------------------------------------------------------------------
OG Siakam              10   12    2    3   0   4/6    66.7     0/0   0.0
Larry McGrady          10    9    0    0   0   4/4   100.0     0/0   0.0
Austin Sexton          10    5    0    1   0   2/3    66.7     0/0   0.0
Shaquille Harden       10    4    6    1   0   2/3    66.7     0/0   0.0
Franz Simmons          10    2    2    2   0   1/2    50.0     0/0   0.0
Myles Harden            2    2    0    0   0   1/1   100.0     0/0   0.0
Pau Tatum               2    0    0    0   0   0/1     0.0     0/0   0.0
Tobias Jokic            2    0    0    0   0   0/1     0.0     0/0   0.0

TEAM: FG: 14/21 (66.7%), 3PT: 8/14 (57.1%), REB: 10 (3 off, 7 def), AST: 7, TO: 1
TEAM FOULS: 7 [Team_003 in BONUS]

================================================================================

================================================================================
                       2ND QUARTER - Team_003 vs Team_051                       
================================================================================

[12:00] Team_003 possession (Score: 31-36)
Nikola Bryant attempts a 3Pt. Contested by Austin Sexton (4.7 feet, ZONE). NIKOLA BRYANT MAKES IT! Assist: Giannis Turner
Score: 34-36

[11:50] Team_051 possession (Score: 34-36)
FOUL! Holding foul on Ayo Jackson. [Team fouls: 1] No free throws, side out. (Ayo Jackson: 1 personal fouls)

[11:40] Team_051 possession (Score: 34-36)
Austin Sexton attempts a Layup. Contested by Giannis Turner (2.9 feet, ZONE). Austin Sexton misses. Rebound secured by Victor O'Neal.

[11:23] Team_003 possession (Score: 34-36)
Victor O'Neal makes the Layup and draws the foul on Shaquille Harden! And-1! Victor O'Neal to the line for 1. [Team fouls: 1] (Shaquille Harden: 1 personal fouls)   FT 1/1: GOOD Victor O'Neal makes 1/1 from the line.
Score: 37-36

[11:12] Team_051 possession (Score: 37-36)
Austin Sexton attempts a Midrange. Contested by Nikola Bryant (4.2 feet, ZONE). AUSTIN SEXTON MAKES IT!
Score: 37-38

[10:56] Team_003 possession (Score: 37-38)
FOUL! Shooting foul on Shaquille Harden. Rudy Haliburton to the line for 2 free throws. [Team fouls: 2] (Shaquille Harden: 2 personal fouls)   FT 1/2: GOOD   FT 2/2: GOOD Rudy Haliburton makes 2/2 from the line.
Score: 39-38

[10:45] Team_051 possession (Score: 39-38)
Shaquille Harden attempts a Midrange. Contested by Giannis Turner (3.0 feet, MAN). Shaquille Harden misses. FOUL! Loose ball foul on Rudy Haliburton during the rebound battle. [Team fouls: 2] No free throws, side out. (Rudy Haliburton: 1 personal fouls)

[10:32] Team_051 possession (Score: 39-38)
Shaquille Harden attempts a Layup. Contested by Giannis Turner (3.0 feet, MAN). SHAQUILLE HARDEN MAKES IT! Assist: Franz Simmons
Score: 39-40

[10:20] Team_003 possession (Score: 39-40)
Victor O'Neal attempts a 3Pt. Contested by Austin Sexton (4.5 feet, ZONE). Victor O'Neal misses. Rebound secured by Shaquille Harden.

[10:06] Team_051 possession (Score: 39-40)
Austin Sexton drives, Giannis Turner stays with him. Austin Sexton attempts a Layup. Contested by Giannis Turner (3.1 feet, ZONE). AUSTIN SEXTON MAKES IT! Assist: Franz Simmons
Score: 39-42

[09:51] Team_003 possession (Score: 39-42)
Ayo Jackson makes the Midrange and draws the foul on Austin Sexton! And-1! Ayo Jackson to the line for 1. [Team fouls: 3] (Austin Sexton: 1 personal fouls)   FT 1/1: GOOD Ayo Jackson makes 1/1 from the line.
Score: 42-42

[09:39] Team_051 possession (Score: 42-42)
Austin Sexton attempts a Layup. Contested by Ayo Jackson (5.6 feet, MAN). AUSTIN SEXTON MAKES IT!
Score: 42-44

[09:24] Team_003 possession (Score: 42-44)
Nikola Bryant attempts a 3Pt. Contested by Austin Sexton (4.9 feet, ZONE). Nikola Bryant misses. Rebound secured by Franz Simmons.

[09:13] Team_051 possession (Score: 42-44)
FOUL! Shooting foul on Rudy Haliburton. OG Siakam to the line for 2 free throws. [Team fouls: 3] (Rudy Haliburton: 2 personal fouls)   FT 1/2: GOOD   FT 2/2: GOOD OG Siakam makes 2/2 from the line.
Score: 42-46

[08:57] Team_003 possession (Score: 42-46)
Rudy Haliburton drives, Franz Simmons stays with him. Rudy Haliburton attempts a Dunk. Contested by Franz Simmons (4.6 feet, ZONE). RUDY HALIBURTON MAKES IT!
Score: 44-46

[08:44] Team_051 possession (Score: 44-46)
Franz Simmons attempts a Midrange. Contested by Giannis Turner (3.8 feet, MAN). Franz Simmons misses. Offensive rebound by Franz Simmons! Franz Simmons kicks it out.

[08:33] Team_051 possession (Score: 44-46)
OG Siakam attempts a 3Pt. Contested by Giannis Turner (3.6 feet, ZONE). OG Siakam misses. Rebound secured by Giannis Turner.

[08:20] Team_003 possession (Score: 44-46)
Ayo Jackson attempts a Layup. Contested by Austin Sexton (5.0 feet, MAN). AYO JACKSON MAKES IT! Assist: Giannis Turner
Score: 46-46

[08:06] Team_051 possession (Score: 46-46)
Franz Simmons attempts a 3Pt. Contested by Giannis Turner (3.8 feet, ZONE). FRANZ SIMMONS MAKES IT! Assist: Larry McGrady
Score: 46-49

[07:54] Team_003 possession (Score: 46-49)
Giannis Turner attempts a Midrange. Contested by Franz Simmons (4.9 feet, MAN). Giannis Turner misses. Rebound secured by Franz Simmons.

[07:39] Team_051 possession (Score: 46-49)
FOUL! Shooting foul on Giannis Turner. Franz Simmons to the line for 2 free throws. [Team fouls: 4] (Giannis Turner: 1 personal fouls)   FT 1/2: GOOD   FT 2/2: GOOD Franz Simmons makes 2/2 from the line.
Score: 46-51

[07:23] Team_003 possession (Score: 46-51)
Rudy Haliburton attempts a 3Pt. Contested by Austin Sexton (4.9 feet, ZONE). Rudy Haliburton misses. Rebound secured by Shaquille Harden.

[07:06] Team_051 possession (Score: 46-51)
Franz Simmons attempts a 3Pt. Contested by Giannis Turner (4.0 feet, ZONE). FRANZ SIMMONS MAKES IT! Assist: Austin Sexton
Score: 46-54

[06:49] Team_003 possession (Score: 46-54)
Nikola Bryant loses control! Ball rolls out of bounds! TURNOVER! (dead ball)

[06:49] Substitution (Team_003): Ayo Jackson OUT → Miles Towns IN (stamina_rule2)

[06:49] Substitution (Team_003): Nikola Bryant OUT → Pau Williamson IN (stamina_rule2)

[06:49] Substitution (Team_003): Rudy Haliburton OUT → Collin Mitchell IN (stamina_rule2)

[06:49] Substitution (Team_003): Giannis Turner OUT → Anfernee Jordan IN (stamina_rule2)

[06:49] Substitution (Team_003): Victor O'Neal OUT → Bam Gilgeous-Alexander IN (stamina_rule2)

[06:49] Substitution (Team_051): Austin Sexton OUT → Myles Harden IN (stamina_rule2)

[06:49] Substitution (Team_051): Larry McGrady OUT → Zion Morant IN (stamina_rule2)

[06:49] Substitution (Team_051): OG Siakam OUT → Jrue Carter IN (stamina_rule2)

[06:49] Substitution (Team_051): Franz Simmons OUT → Tobias Jokic IN (stamina_rule2)

[06:49] Substitution (Team_051): Shaquille Harden OUT → Pau Tatum IN (stamina_rule2)

[06:31] Team_051 possession (Score: 46-54)
Tobias Jokic makes the Midrange and draws the foul on Collin Mitchell! And-1! Tobias Jokic to the line for 1. [BONUS: 5 team fouls] (Collin Mitchell: 1 personal fouls)   FT 1/1: GOOD Tobias Jokic makes 1/1 from the line.
Score: 46-57

[06:22] Team_003 possession (Score: 46-57)
Miles Towns drives and kicks out. Bam Gilgeous-Alexander attempts a 3Pt. Contested by Pau Tatum (4.3 feet, MAN). Bam Gilgeous-Alexander misses. Rebound secured by Tobias Jokic.

[06:07] Team_051 possession (Score: 46-57)
Jrue Carter loses control! Ball rolls out of bounds! TURNOVER! (dead ball)

[05:52] Team_003 possession (Score: 46-57)
Miles Towns attempts a Layup. Contested by Pau Tatum (4.2 feet, ZONE). Miles Towns misses. Rebound secured by Pau Tatum.

[05:38] Team_051 possession (Score: 46-57)
Jrue Carter attempts a 3Pt. Contested by Collin Mitchell (4.3 feet, MAN). Jrue Carter misses. Rebound secured by Collin Mitchell.

[05:22] Team_003 possession (Score: 46-57)
Pau Williamson drives and kicks out. Pau Williamson attempts a Midrange. Contested by Zion Morant (5.6 feet, MAN). Pau Williamson misses. Rebound secured by Myles Harden.

[05:09] Team_051 possession (Score: 46-57)
Myles Harden throws a bad pass! Stolen by Miles Towns! TURNOVER! (live ball)

[04:50] Team_003 possession (Score: 46-57)
Collin Mitchell attempts a 3Pt. Contested by Myles Harden (4.8 feet, ZONE). Collin Mitchell misses. Rebound secured by Pau Tatum.

[04:39] Team_051 possession (Score: 46-57)
Myles Harden drives, picks up Miles Towns. Help arrives from Collin Mitchell! Myles Harden attempts a Layup. Contested by Collin Mitchell (5.0 feet, MAN). Myles Harden misses. Rebound secured by Anfernee Jordan.

[04:30] Team_003 possession (Score: 46-57)
Anfernee Jordan attempts a 3Pt. Contested by Tobias Jokic (5.1 feet, MAN). Anfernee Jordan misses. Rebound secured by Tobias Jokic.

[04:15] Team_051 possession (Score: 46-57)
Jrue Carter attempts a Midrange. Contested by Collin Mitchell (4.3 feet, MAN). JRUE CARTER MAKES IT!
Score: 46-59

[03:56] Team_003 possession (Score: 46-59)
Pau Williamson attempts a 3Pt. Contested by Myles Harden (4.5 feet, ZONE). Pau Williamson misses. Rebound secured by Myles Harden.

[03:46] Team_051 possession (Score: 46-59)
Pau Tatum drives, Bam Gilgeous-Alexander stays with him. Pau Tatum attempts a Layup. Contested by Bam Gilgeous-Alexander (2.8 feet, ZONE). PAU TATUM MAKES IT! Assist: Jrue Carter
Score: 46-61

[03:36] Team_003 possession (Score: 46-61)
Miles Towns attempts a Midrange. Contested by Myles Harden (4.5 feet, MAN). MILES TOWNS MAKES IT! Assist: Anfernee Jordan
Score: 48-61

[03:23] Team_051 possession (Score: 48-61)
Jrue Carter attempts a Layup. Contested by Bam Gilgeous-Alexander (3.2 feet, ZONE). JRUE CARTER MAKES IT!
Score: 48-63

[03:09] Team_003 possession (Score: 48-63)
Collin Mitchell attempts a 3Pt. Contested by Myles Harden (4.8 feet, ZONE). Collin Mitchell misses. Rebound secured by Myles Harden.

[02:54] Team_051 possession (Score: 48-63)
Pau Tatum drives, picks up Bam Gilgeous-Alexander. Help arrives from Pau Williamson! Pau Tatum attempts a Dunk. Contested by Pau Williamson (2.8 feet, ZONE). PAU TATUM MAKES IT! Assist: Tobias Jokic
Score: 48-65

[02:41] Team_003 possession (Score: 48-65)
Collin Mitchell drives and kicks out. Miles Towns attempts a 3Pt. Contested by Myles Harden (4.6 feet, MAN). MILES TOWNS MAKES IT! Assist: Bam Gilgeous-Alexander
Score: 51-65

[02:27] Team_051 possession (Score: 51-65)
Myles Harden attempts a Midrange. Contested by Miles Towns (5.0 feet, MAN). Myles Harden misses. Rebound secured by Collin Mitchell.

[02:12] Team_003 possession (Score: 51-65)
Miles Towns makes the Layup and draws the foul on Myles Harden! And-1! Miles Towns to the line for 1. [Team fouls: 4] (Myles Harden: 1 personal fouls)   FT 1/1: GOOD Miles Towns makes 1/1 from the line.
Score: 54-65

[01:53] Team_051 possession (Score: 54-65)
Zion Morant drives, picks up Pau Williamson. Help arrives from Collin Mitchell! Zion Morant attempts a Dunk. Contested by Collin Mitchell (5.4 feet, MAN). ZION MORANT MAKES IT! Assist: Pau Tatum
Score: 54-67

[01:37] Team_003 possession (Score: 54-67)
Anfernee Jordan attempts a Layup. Contested by Pau Tatum (4.1 feet, ZONE). Anfernee Jordan misses. Rebound secured by Pau Tatum.

[01:20] Team_051 possession (Score: 54-67)
FOUL! Shooting foul on Bam Gilgeous-Alexander. Tobias Jokic to the line for 2 free throws. [BONUS: 6 team fouls] (Bam Gilgeous-Alexander: 1 personal fouls)   FT 1/2: GOOD   FT 2/2: GOOD Tobias Jokic makes 2/2 from the line.
Score: 54-69

[01:08] Team_003 possession (Score: 54-69)
Anfernee Jordan attempts a Midrange. Contested by Tobias Jokic (5.1 feet, MAN). Anfernee Jordan misses. Offensive rebound by Bam Gilgeous-Alexander! Bam Gilgeous-Alexander's putback is no good. Rebound secured by Pau Tatum.

[00:54] Team_051 possession (Score: 54-69)
Pau Tatum attempts a Midrange. Contested by Bam Gilgeous-Alexander (2.8 feet, MAN). PAU TATUM MAKES IT!
Score: 54-71

[00:35] Team_003 possession (Score: 54-71)
Miles Towns drives to the basket... FOUL! Offensive foul on Miles Towns! Pau Tatum drew the charge! [Team fouls: 7] (Miles Towns: 1 personal fouls) TURNOVER! (dead ball)

[00:22] Team_051 possession (Score: 54-71)
Jrue Carter loses control! Ball rolls out of bounds! TURNOVER! (dead ball)

[00:09] Team_003 possession (Score: 54-71)
Miles Towns loses control! Ball rolls out of bounds! TURNOVER! (dead ball)

================================================================================
                              2ND QUARTER COMPLETE                              
================================================================================

2ND QUARTER SCORE: Team_003 23, Team_051 35

BOX SCORE:
================================================================================

Team_003
--------------------------------------------------------------------------------
Player                MIN  PTS  REB  AST  TO      FG   FG%      3P   3P%
--------------------------------------------------------------------------------
Miles Towns             8    8    0    0   0   3/5    60.0     0/0   0.0
Ayo Jackson            16    5    0    0   0   2/2   100.0     0/0   0.0
Rudy Haliburton        16    4    0    0   0   2/3    66.7     0/0   0.0
Nikola Bryant          16    3    0    0   0   1/2    50.0     0/0   0.0
Victor O'Neal          16    3    1    0   0   1/2    50.0     0/0   0.0
Giannis Turner         16    0    1    2   0   0/1     0.0     0/0   0.0
Collin Mitchell         8    0    2    0   0   0/2     0.0     0/0   0.0
Pau Williamson          8    0    0    0   0   0/2     0.0     0/0   0.0
Anfernee Jordan         8    0    1    1   0   0/3     0.0     0/0   0.0
Bam Gilgeous-Alexander    8    0    0    1   0   0/0     0.0     0/0   0.0

TEAM: FG: 9/22 (40.9%), 3PT: 1/8 (12.5%), REB: 6 (1 off, 5 def), AST: 4, TO: 3
TEAM FOULS: 7 [Team_051 in BONUS]


Team_051
--------------------------------------------------------------------------------
Player                MIN  PTS  REB  AST  TO      FG   FG%      3P   3P%
--------------------------------------------------------------------------------
Franz Simmons          16    8    4    2   0   3/3   100.0     0/0   0.0
Austin Sexton          16    6    0    1   0   3/4    75.0     0/0   0.0
Pau Tatum               8    6    4    1   0   3/3   100.0     0/0   0.0
Tobias Jokic            8    5    2    1   0   2/2   100.0     0/0   0.0
Jrue Carter             8    4    0    1   0   2/3    66.7     0/0   0.0
Shaquille Harden       16    2    2    0   0   1/1   100.0     0/0   0.0
OG Siakam              16    2    0    0   0   1/2    50.0     0/0   0.0
Zion Morant             8    2    0    0   0   1/1   100.0     0/0   0.0
Larry McGrady          16    0    0    1   0   0/0     0.0     0/0   0.0
Myles Harden            8    0    3    0   0   0/2     0.0     0/0   0.0

TEAM: FG: 16/21 (76.2%), 3PT: 2/4 (50.0%), REB: 14 (2 off, 12 def), AST: 7, TO: 3
TEAM FOULS: 4

================================================================================

================================================================================
                       3RD QUARTER - Team_003 vs Team_051                       
================================================================================

[12:00] Team_003 possession (Score: 54-71)
Victor O'Neal drives to the basket... Victor O'Neal throws a bad pass! Stolen by Shaquille Harden! TURNOVER! (live ball)

[11:47] Team_051 possession (Score: 54-71)
Austin Sexton attempts a 3Pt. Contested by Giannis Turner (2.8 feet, ZONE). Austin Sexton misses. Rebound secured by Giannis Turner.

[11:30] Team_003 possession (Score: 54-71)
Ayo Jackson attempts a Midrange. Contested by Austin Sexton (4.7 feet, MAN). AYO JACKSON MAKES IT! Assist: Rudy Haliburton
Score: 56-71

[11:18] Team_051 possession (Score: 56-71)
Franz Simmons attempts a Layup. Contested by Giannis Turner (3.3 feet, MAN). FRANZ SIMMONS MAKES IT! Assist: Shaquille Harden
Score: 56-73

[11:01] Team_003 possession (Score: 56-73)
Ayo Jackson attempts a 3Pt. Contested by Austin Sexton (4.7 feet, MAN). Ayo Jackson misses. Rebound secured by Shaquille Harden.

[10:45] Team_051 possession (Score: 56-73)
OG Siakam attempts a Midrange. Contested by Giannis Turner (3.1 feet, ZONE). OG Siakam misses. FOUL! Loose ball foul on Victor O'Neal during the rebound battle. [Team fouls: 1] No free throws, side out. (Victor O'Neal: 1 personal fouls)

[10:34] Team_051 possession (Score: 56-73)
Franz Simmons makes the Layup and draws the foul on Giannis Turner! And-1! Franz Simmons to the line for 1. [Team fouls: 2] (Giannis Turner: 1 personal fouls)   FT 1/1: GOOD Franz Simmons makes 1/1 from the line.
Score: 56-76

[10:17] Team_003 possession (Score: 56-76)
Nikola Bryant attempts a Midrange. Contested by Larry McGrady (4.7 feet, MAN). NIKOLA BRYANT MAKES IT!
Score: 58-76

[10:07] Team_051 possession (Score: 58-76)
OG Siakam attempts a 3Pt. Contested by Giannis Turner (3.1 feet, ZONE). OG Siakam misses. FOUL! Loose ball foul on Victor O'Neal during the rebound battle. [Team fouls: 3] No free throws, side out. (Victor O'Neal: 2 personal fouls)

[09:52] Team_051 possession (Score: 58-76)
OG Siakam attempts a 3Pt. Contested by Giannis Turner (3.1 feet, ZONE). OG SIAKAM MAKES IT! Assist: Shaquille Harden
Score: 58-79

[09:38] Team_003 possession (Score: 58-79)
Nikola Bryant attempts a 3Pt. Contested by OG Siakam (4.1 feet, ZONE). Nikola Bryant misses. Rebound secured by OG Siakam.

[09:26] Team_051 possession (Score: 58-79)
OG Siakam drives and kicks out. Austin Sexton attempts a 3Pt. Contested by Ayo Jackson (5.2 feet, MAN). AUSTIN SEXTON MAKES IT! Assist: Franz Simmons
Score: 58-82

[09:13] Team_003 possession (Score: 58-82)
Giannis Turner makes the Layup and draws the foul on Larry McGrady! And-1! Giannis Turner to the line for 1. [Team fouls: 1] (Larry McGrady: 1 personal fouls)   FT 1/1: GOOD Giannis Turner makes 1/1 from the line.
Score: 61-82

[08:58] Team_051 possession (Score: 61-82)
Franz Simmons throws a bad pass out of bounds! TURNOVER! (dead ball)

[08:46] Team_003 possession (Score: 61-82)
Rudy Haliburton attempts a 3Pt. Contested by OG Siakam (3.9 feet, MAN). Rudy Haliburton misses. Rebound secured by Shaquille Harden.

[08:29] Team_051 possession (Score: 61-82)
Franz Simmons makes the Layup and draws the foul on Giannis Turner! And-1! Franz Simmons to the line for 1. [Team fouls: 4] (Giannis Turner: 2 personal fouls)   FT 1/1: GOOD Franz Simmons makes 1/1 from the line.
Score: 61-85

[08:18] Team_003 possession (Score: 61-85)
Victor O'Neal makes the Layup and draws the foul on Franz Simmons! And-1! Victor O'Neal to the line for 1. [Team fouls: 2] (Franz Simmons: 1 personal fouls)   FT 1/1: MISS Victor O'Neal makes 0/1 from the line. Rebound secured by Franz Simmons.
Score: 63-85

[08:08] Team_051 possession (Score: 63-85)
OG Siakam commits a violation (traveling/carry)! TURNOVER! (dead ball)

[07:53] Team_003 possession (Score: 63-85)
Rudy Haliburton attempts a 3Pt. Contested by Austin Sexton (4.4 feet, ZONE). RUDY HALIBURTON MAKES IT! Assist: Ayo Jackson
Score: 66-85

[07:35] Team_051 possession (Score: 66-85)
Austin Sexton attempts a 3Pt. Contested by Giannis Turner (2.8 feet, ZONE). Austin Sexton misses. Rebound secured by Victor O'Neal.

[07:25] Team_003 possession (Score: 66-85)
Rudy Haliburton attempts a 3Pt. Contested by OG Siakam (3.9 feet, MAN). RUDY HALIBURTON MAKES IT! Assist: Nikola Bryant
Score: 69-85

[07:11] Team_051 possession (Score: 69-85)
Franz Simmons attempts a Midrange. Contested by Giannis Turner (3.3 feet, MAN). Franz Simmons misses. Rebound secured by Giannis Turner.

[06:57] Team_003 possession (Score: 69-85)
Giannis Turner attempts a Layup. Contested by Franz Simmons (4.5 feet, MAN). GIANNIS TURNER MAKES IT!
Score: 71-85

[06:46] Team_051 possession (Score: 71-85)
OG Siakam attempts a 3Pt. Contested by Giannis Turner (3.1 feet, ZONE). OG Siakam misses. Rebound secured by Rudy Haliburton.

[06:35] Team_003 possession (Score: 71-85)
Ayo Jackson attempts a 3Pt. Contested by Austin Sexton (4.7 feet, MAN). AYO JACKSON MAKES IT! Assist: Giannis Turner
Score: 74-85

[06:21] Team_051 possession (Score: 74-85)
OG Siakam attempts a 3Pt. Contested by Giannis Turner (3.1 feet, ZONE). OG Siakam misses. Offensive rebound by Shaquille Harden! Shaquille Harden's putback is no good. Rebound secured by Giannis Turner.

[06:05] Team_003 possession (Score: 74-85)
FOUL! Holding foul on OG Siakam. [Team fouls: 3] No free throws, side out. (OG Siakam: 1 personal fouls)

[05:54] Team_003 possession (Score: 74-85)
Rudy Haliburton drives, Franz Simmons stays with him. Rudy Haliburton attempts a Layup. Contested by Franz Simmons (4.2 feet, ZONE). RUDY HALIBURTON MAKES IT! Assist: Giannis Turner
Score: 76-85

[05:40] Team_051 possession (Score: 76-85)
FOUL! Holding foul on Giannis Turner. [IN THE BONUS! 5 team fouls] Franz Simmons to the line for 2 free throws. (Giannis Turner: 3 personal fouls)   FT 1/2: GOOD   FT 2/2: MISS Franz Simmons makes 1/2 from the line. Rebound secured by Victor O'Neal.
Score: 76-86

[05:28] Team_003 possession (Score: 76-86)
FOUL! Shooting foul on Larry McGrady. Giannis Turner to the line for 2 free throws. [Team fouls: 4] (Larry McGrady: 2 personal fouls)   FT 1/2: MISS   FT 2/2: GOOD Giannis Turner makes 1/2 from the line.
Score: 77-86

[05:18] Team_051 possession (Score: 77-86)
Shaquille Harden drives to the basket... Shaquille Harden loses the ball! Stripped by Giannis Turner! TURNOVER! (live ball)

[04:58] Team_003 possession (Score: 77-86)
Nikola Bryant attempts a Midrange. Contested by Larry McGrady (4.8 feet, MAN). NIKOLA BRYANT MAKES IT!
Score: 79-86

[04:43] Team_051 possession (Score: 79-86)
Austin Sexton attempts a 3Pt. Contested by Giannis Turner (2.9 feet, ZONE). Austin Sexton misses. Rebound secured by Rudy Haliburton.

[04:28] Team_003 possession (Score: 79-86)
Ayo Jackson attempts a 3Pt. Contested by Austin Sexton (4.7 feet, MAN). Ayo Jackson misses. Rebound secured by Franz Simmons.

[04:09] Team_051 possession (Score: 79-86)
Shaquille Harden drives and kicks out. Shaquille Harden attempts a Midrange. Contested by Giannis Turner (2.9 feet, MAN). Shaquille Harden misses. Rebound secured by Rudy Haliburton.

[03:56] Team_003 possession (Score: 79-86)
Nikola Bryant attempts a Layup. BLOCKED BY FRANZ SIMMONS! Ball is loose! Offensive rebound by Rudy Haliburton! Rudy Haliburton kicks it out.

[03:39] Team_003 possession (Score: 79-86)
Giannis Turner attempts a Layup. Contested by Franz Simmons (4.6 feet, MAN). Giannis Turner misses. Rebound secured by Franz Simmons.

[03:20] Team_051 possession (Score: 79-86)
Larry McGrady drives, picks up Giannis Turner. Help arrives from Nikola Bryant! Larry McGrady attempts a Layup. Contested by Nikola Bryant (3.3 feet, ZONE). Larry McGrady misses. Rebound secured by Giannis Turner.

[03:02] Team_003 possession (Score: 79-86)
Rudy Haliburton attempts a 3Pt. Contested by Austin Sexton (4.6 feet, ZONE). RUDY HALIBURTON MAKES IT! Assist: Victor O'Neal
Score: 82-86

[02:45] Team_051 possession (Score: 82-86)
Austin Sexton loses the ball! Stripped by Ayo Jackson! TURNOVER! (live ball)

[02:26] Team_003 possession (Score: 82-86)
Ayo Jackson attempts a 3Pt. Contested by Austin Sexton (4.8 feet, MAN). Ayo Jackson misses. Rebound secured by OG Siakam.

[02:15] Team_051 possession (Score: 82-86)
Austin Sexton makes the Layup and draws the foul on Giannis Turner! And-1! Austin Sexton to the line for 1. [BONUS: 6 team fouls] (Giannis Turner: 4 personal fouls)   FT 1/1: GOOD Austin Sexton makes 1/1 from the line.
Score: 82-89

[01:58] Team_003 possession (Score: 82-89)
Victor O'Neal makes the Dunk and draws the foul on Austin Sexton! And-1! Victor O'Neal to the line for 1. [BONUS: 5 team fouls] (Austin Sexton: 1 personal fouls)   FT 1/1: MISS Victor O'Neal makes 0/1 from the line. Offensive rebound by Victor O'Neal! Victor O'Neal kicks it out.
Score: 84-89

[01:44] Team_003 possession (Score: 84-89)
Ayo Jackson attempts a Midrange. Contested by Larry McGrady (5.1 feet, ZONE). Ayo Jackson misses. Rebound secured by Shaquille Harden.

[01:25] Team_051 possession (Score: 84-89)
Franz Simmons drives to the basket... Franz Simmons loses control! Ball rolls out of bounds! TURNOVER! (dead ball)

[01:25] Substitution (Team_003): Ayo Jackson OUT → Miles Towns IN (stamina_rule2)

[01:25] Substitution (Team_003): Nikola Bryant OUT → Pau Williamson IN (stamina_rule2)

[01:25] Substitution (Team_003): Rudy Haliburton OUT → Collin Mitchell IN (stamina_rule2)

[01:25] Substitution (Team_003): Giannis Turner OUT → Anfernee Jordan IN (stamina_rule2)

[01:25] Substitution (Team_003): Victor O'Neal OUT → Bam Gilgeous-Alexander IN (stamina_rule2)

[01:25] Substitution (Team_051): Austin Sexton OUT → Myles Harden IN (stamina_rule2)

[01:25] Substitution (Team_051): Larry McGrady OUT → Zion Morant IN (stamina_rule2)

[01:25] Substitution (Team_051): OG Siakam OUT → Jrue Carter IN (stamina_rule2)

[01:25] Substitution (Team_051): Franz Simmons OUT → Tobias Jokic IN (stamina_rule2)

[01:25] Substitution (Team_051): Shaquille Harden OUT → Pau Tatum IN (stamina_rule2)

[01:12] Team_003 possession (Score: 84-89)
Pau Williamson attempts a 3Pt. Contested by Myles Harden (4.5 feet, ZONE). PAU WILLIAMSON MAKES IT!
Score: 87-89

[00:59] Team_051 possession (Score: 87-89)
FOUL! Holding foul on Pau Williamson. [IN THE BONUS! 7 team fouls] Zion Morant to the line for 2 free throws. (Pau Williamson: 1 personal fouls)   FT 1/2: GOOD   FT 2/2: MISS Zion Morant makes 1/2 from the line. Offensive rebound by Tobias Jokic! Tobias Jokic kicks it out.
Score: 87-90

[00:42] Team_051 possession (Score: 87-90)
Tobias Jokic drives and kicks out. Zion Morant attempts a 3Pt. Contested by Pau Williamson (5.1 feet, ZONE). ZION MORANT MAKES IT! Assist: Myles Harden
Score: 87-93

[00:24] Team_003 possession (Score: 87-93)
Anfernee Jordan drives, Tobias Jokic stays with him. Anfernee Jordan attempts a Layup. Contested by Tobias Jokic (5.1 feet, MAN). ANFERNEE JORDAN MAKES IT! Assist: Miles Towns
Score: 89-93

[00:08] Team_051 possession (Score: 89-93)
Tobias Jokic drives and kicks out. Jrue Carter attempts a 3Pt. Contested by Collin Mitchell (4.1 feet, MAN). Jrue Carter misses. FOUL! Loose ball foul on Bam Gilgeous-Alexander during the rebound battle. [IN THE BONUS! 8 team fouls] Pau Tatum to the line for 2 free throws. (Bam Gilgeous-Alexander: 1 personal fouls)   FT 1/2: GOOD   FT 2/2: GOOD Pau Tatum makes 2/2 from the line.
Score: 89-95

================================================================================
                              3RD QUARTER COMPLETE                              
================================================================================

3RD QUARTER SCORE: Team_003 35, Team_051 24

BOX SCORE:
================================================================================

Team_003
--------------------------------------------------------------------------------
Player                MIN  PTS  REB  AST  TO      FG   FG%      3P   3P%
--------------------------------------------------------------------------------
Rudy Haliburton        27   11    4    1   0   4/5    80.0     0/0   0.0
Giannis Turner         27    6    4    2   0   3/4    75.0     0/0   0.0
Ayo Jackson            27    5    0    1   0   2/6    33.3     0/0   0.0
Nikola Bryant          27    4    0    1   0   2/3    66.7     0/0   0.0
Pau Williamson         10    3    0    0   0   1/1   100.0     0/0   0.0
Anfernee Jordan        10    2    0    0   0   1/1   100.0     0/0   0.0
Victor O'Neal          27    0    3    1   0   0/1     0.0     0/0   0.0
Miles Towns            10    0    0    1   0   0/0     0.0     0/0   0.0

TEAM: FG: 13/21 (61.9%), 3PT: 5/10 (50.0%), REB: 10 (2 off, 8 def), AST: 7, TO: 1
TEAM FOULS: 8 [Team_051 in BONUS]


Team_051
--------------------------------------------------------------------------------
Player                MIN  PTS  REB  AST  TO      FG   FG%      3P   3P%
--------------------------------------------------------------------------------
Franz Simmons          27    8    5    1   0   3/4    75.0     0/0   0.0
Austin Sexton          27    6    0    0   0   2/5    40.0     0/0   0.0
OG Siakam              27    3    2    0   0   1/3    33.3     0/0   0.0
Zion Morant            10    3    0    0   0   1/1   100.0     0/0   0.0
Pau Tatum              10    2    0    0   0   1/1   100.0     0/0   0.0
Shaquille Harden       27    0    3    2   0   0/1     0.0     0/0   0.0
Larry McGrady          27    0    0    0   0   0/1     0.0     0/0   0.0
Tobias Jokic           10    0    1    0   0   0/0     0.0     0/0   0.0
Myles Harden           10    0    0    1   0   0/0     0.0     0/0   0.0

TEAM: FG: 8/17 (47.1%), 3PT: 1/6 (16.7%), REB: 12 (4 off, 8 def), AST: 4, TO: 5
TEAM FOULS: 5 [Team_003 in BONUS]

================================================================================

================================================================================
                       4TH QUARTER - Team_003 vs Team_051                       
================================================================================

[12:00] Team_003 possession (Score: 89-95)
Ayo Jackson makes the 3Pt and draws the foul on Austin Sexton! And-1! Ayo Jackson to the line for 1. [Team fouls: 1] (Austin Sexton: 1 personal fouls)   FT 1/1: GOOD Ayo Jackson makes 1/1 from the line.
Score: 93-95

[11:43] Team_051 possession (Score: 93-95)
FOUL! Holding foul on Giannis Turner. [Team fouls: 1] No free throws, side out. (Giannis Turner: 1 personal fouls)

[11:33] Team_051 possession (Score: 93-95)
OG Siakam commits a violation (traveling/carry)! TURNOVER! (dead ball)

[11:16] Team_003 possession (Score: 93-95)
Rudy Haliburton drives, Franz Simmons stays with him. Rudy Haliburton attempts a Layup. Contested by Franz Simmons (4.4 feet, ZONE). RUDY HALIBURTON MAKES IT!
Score: 95-95

[10:59] Team_051 possession (Score: 95-95)
Franz Simmons attempts a Midrange. Contested by Victor O'Neal (4.8 feet, ZONE). FRANZ SIMMONS MAKES IT! Assist: Shaquille Harden
Score: 95-97

[10:41] Team_003 possession (Score: 95-97)
Rudy Haliburton attempts a Midrange. Contested by Franz Simmons (4.4 feet, ZONE). Rudy Haliburton misses. Rebound secured by Franz Simmons.

[10:30] Team_051 possession (Score: 95-97)
Shaquille Harden attempts a 3Pt. Contested by Giannis Turner (3.0 feet, MAN). Shaquille Harden misses. Offensive rebound by Franz Simmons! Franz Simmons kicks it out.

[10:14] Team_051 possession (Score: 95-97)
Franz Simmons throws a bad pass out of bounds! TURNOVER! (dead ball)

[10:14] Substitution (Team_003): Ayo Jackson OUT → Miles Towns IN (stamina_rule2)

[10:14] Substitution (Team_003): Nikola Bryant OUT → Pau Williamson IN (stamina_rule2)

[10:14] Substitution (Team_003): Giannis Turner OUT → Anfernee Jordan IN (stamina_rule2)

[10:14] Substitution (Team_003): Victor O'Neal OUT → Bam Gilgeous-Alexander IN (stamina_rule2)

[10:14] Substitution (Team_051): Larry McGrady OUT → Zion Morant IN (stamina_rule2)

[10:14] Substitution (Team_051): OG Siakam OUT → Jrue Carter IN (stamina_rule2)

[10:14] Substitution (Team_051): Shaquille Harden OUT → Pau Tatum IN (stamina_rule2)

[09:59] Team_003 possession (Score: 95-97)
Miles Towns attempts a 3Pt. Contested by Austin Sexton (4.5 feet, ZONE). Miles Towns misses. Rebound secured by Pau Tatum.

[09:47] Team_051 possession (Score: 95-97)
Pau Tatum attempts a Dunk. BLOCKED BY BAM GILGEOUS-ALEXANDER! Ball is loose! Rebound secured by Anfernee Jordan.

[09:30] Team_003 possession (Score: 95-97)
Rudy Haliburton attempts a 3Pt. Contested by Jrue Carter (4.7 feet, MAN). Rudy Haliburton misses. Offensive rebound by Rudy Haliburton! Rudy Haliburton kicks it out.

[09:15] Team_003 possession (Score: 95-97)
Rudy Haliburton attempts a Midrange. Contested by Jrue Carter (4.7 feet, ZONE). RUDY HALIBURTON MAKES IT! Assist: Anfernee Jordan
Score: 97-97

[09:02] Team_051 possession (Score: 97-97)
Franz Simmons attempts a Layup. Contested by Bam Gilgeous-Alexander (3.4 feet, MAN). FRANZ SIMMONS MAKES IT! Assist: Austin Sexton
Score: 97-99

[08:44] Team_003 possession (Score: 97-99)
Bam Gilgeous-Alexander attempts a Layup. Contested by Franz Simmons (5.3 feet, ZONE). BAM GILGEOUS-ALEXANDER MAKES IT!
Score: 99-99

[08:32] Team_051 possession (Score: 99-99)
Pau Tatum attempts a Layup. Contested by Bam Gilgeous-Alexander (2.8 feet, MAN). Pau Tatum misses. Rebound secured by Bam Gilgeous-Alexander.

[08:12] Team_003 possession (Score: 99-99)
Pau Williamson attempts a Layup. BLOCKED BY ZION MORANT! Ball deflects out of bounds off Pau Williamson.

[08:01] Team_051 possession (Score: 99-99)
Pau Tatum attempts a 3Pt. Contested by Miles Towns (5.1 feet, ZONE). Pau Tatum misses. Rebound secured by Rudy Haliburton.

[07:47] Team_003 possession (Score: 99-99)
Pau Williamson attempts a 3Pt. Contested by Franz Simmons (4.6 feet, ZONE). PAU WILLIAMSON MAKES IT!
Score: 102-99

[07:31] Team_051 possession (Score: 102-99)
Pau Tatum drives, Bam Gilgeous-Alexander stays with him. Pau Tatum attempts a Layup. Contested by Bam Gilgeous-Alexander (2.8 feet, MAN). PAU TATUM MAKES IT!
Score: 102-101

[07:13] Team_003 possession (Score: 102-101)
Bam Gilgeous-Alexander drives, Franz Simmons stays with him. Bam Gilgeous-Alexander attempts a Dunk. Contested by Franz Simmons (5.5 feet, ZONE). BAM GILGEOUS-ALEXANDER MAKES IT! Assist: Anfernee Jordan
Score: 104-101

[07:02] Team_051 possession (Score: 104-101)
Zion Morant attempts a 3Pt. Contested by Anfernee Jordan (4.7 feet, ZONE). Zion Morant misses. Rebound secured by Rudy Haliburton.

[06:46] Team_003 possession (Score: 104-101)
Anfernee Jordan attempts a Midrange. Contested by Franz Simmons (4.7 feet, MAN). Anfernee Jordan misses. Rebound secured by Jrue Carter.

[06:34] Team_051 possession (Score: 104-101)
Austin Sexton attempts a 3Pt. Contested by Miles Towns (5.2 feet, MAN). Austin Sexton misses. Rebound secured by Bam Gilgeous-Alexander.

[06:24] Team_003 possession (Score: 104-101)
Bam Gilgeous-Alexander drives and kicks out. Rudy Haliburton attempts a Midrange. Contested by Franz Simmons (4.9 feet, ZONE). RUDY HALIBURTON MAKES IT!
Score: 106-101

[06:10] Team_051 possession (Score: 106-101)
Pau Tatum attempts a 3Pt. Contested by Miles Towns (5.1 feet, ZONE). Pau Tatum misses. Rebound secured by Bam Gilgeous-Alexander.

[05:52] Team_003 possession (Score: 106-101)
Pau Williamson attempts a Midrange. Contested by Zion Morant (5.5 feet, ZONE). Pau Williamson misses. Rebound secured by Pau Tatum.

[05:37] Team_051 possession (Score: 106-101)
FOUL! Reach-in foul on Bam Gilgeous-Alexander during the drive. [Team fouls: 2] No free throws, side out. (Bam Gilgeous-Alexander: 1 personal fouls)

[05:25] Team_051 possession (Score: 106-101)
Jrue Carter attempts a 3Pt. Contested by Miles Towns (5.5 feet, ZONE). Jrue Carter misses. Rebound secured by Bam Gilgeous-Alexander.

[05:07] Team_003 possession (Score: 106-101)
Rudy Haliburton attempts a 3Pt. Contested by Jrue Carter (4.6 feet, MAN). Rudy Haliburton misses. FOUL! Loose ball foul on Jrue Carter during the rebound battle. [Team fouls: 2] No free throws, side out. (Jrue Carter: 1 personal fouls)

[04:52] Team_003 possession (Score: 106-101)
Bam Gilgeous-Alexander makes the Layup and draws the foul on Pau Tatum! And-1! Bam Gilgeous-Alexander to the line for 1. [Team fouls: 3] (Pau Tatum: 1 personal fouls)   FT 1/1: MISS Bam Gilgeous-Alexander makes 0/1 from the line. Offensive rebound by Bam Gilgeous-Alexander! Bam Gilgeous-Alexander puts it back in!
Score: 110-101

[04:35] Team_051 possession (Score: 110-101)
FOUL! Shooting foul on Miles Towns. Austin Sexton to the line for 2 free throws. [Team fouls: 3] (Miles Towns: 1 personal fouls)   FT 1/2: GOOD   FT 2/2: MISS Austin Sexton makes 1/2 from the line. Rebound secured by Anfernee Jordan.
Score: 110-102

[04:20] Team_003 possession (Score: 110-102)
Miles Towns attempts a 3Pt. BLOCKED BY AUSTIN SEXTON! Ball is loose! Rebound secured by Pau Tatum.

[04:08] Team_051 possession (Score: 110-102)
Pau Tatum drives and kicks out. Pau Tatum attempts a Midrange. Contested by Anfernee Jordan (4.4 feet, ZONE). Pau Tatum misses. Rebound secured by Rudy Haliburton.

[03:53] Team_003 possession (Score: 110-102)
FOUL! Shooting foul on Franz Simmons. Anfernee Jordan to the line for 2 free throws. [Team fouls: 4] (Franz Simmons: 1 personal fouls)   FT 1/2: MISS   FT 2/2: GOOD Anfernee Jordan makes 1/2 from the line.
Score: 111-102

[03:41] Team_051 possession (Score: 111-102)
FOUL! Reach-in foul on Miles Towns during the drive. [Team fouls: 4] No free throws, side out. (Miles Towns: 2 personal fouls)

[03:29] Team_051 possession (Score: 111-102)
Zion Morant drives, Bam Gilgeous-Alexander stays with him. Zion Morant attempts a Layup. Contested by Bam Gilgeous-Alexander (3.3 feet, ZONE). ZION MORANT MAKES IT! Assist: Austin Sexton
Score: 111-104

[03:16] Team_003 possession (Score: 111-104)
Rudy Haliburton makes the Layup and draws the foul on Jrue Carter! And-1! Rudy Haliburton to the line for 1. [BONUS: 5 team fouls] (Jrue Carter: 2 personal fouls)   FT 1/1: GOOD Rudy Haliburton makes 1/1 from the line.
Score: 114-104

[03:01] Team_051 possession (Score: 114-104)
Franz Simmons throws a bad pass out of bounds! TURNOVER! (dead ball)

[03:01] Substitution (Team_003): Rudy Haliburton OUT → Collin Mitchell IN (stamina_rule2)

[03:01] Substitution (Team_051): Austin Sexton OUT → Myles Harden IN (stamina_rule2)

[03:01] Substitution (Team_051): Franz Simmons OUT → Tobias Jokic IN (stamina_rule2)

[02:45] Team_003 possession (Score: 114-104)
Bam Gilgeous-Alexander makes the Layup and draws the foul on Pau Tatum! And-1! Bam Gilgeous-Alexander to the line for 1. [BONUS: 6 team fouls] (Pau Tatum: 2 personal fouls)   FT 1/1: GOOD Bam Gilgeous-Alexander makes 1/1 from the line.
Score: 117-104

[02:32] Team_051 possession (Score: 117-104)
Myles Harden attempts a 3Pt. Contested by Miles Towns (5.1 feet, ZONE). Myles Harden misses. Rebound secured by Collin Mitchell.

[02:17] Team_003 possession (Score: 117-104)
Anfernee Jordan makes the Midrange and draws the foul on Tobias Jokic! And-1! Anfernee Jordan to the line for 1. [BONUS: 7 team fouls] (Tobias Jokic: 1 personal fouls)   FT 1/1: MISS Anfernee Jordan makes 0/1 from the line. Rebound secured by Myles Harden.
Score: 119-104

[02:02] Team_051 possession (Score: 119-104)
FOUL! Shooting foul on Bam Gilgeous-Alexander. Pau Tatum to the line for 2 free throws. [BONUS: 5 team fouls] (Bam Gilgeous-Alexander: 2 personal fouls)   FT 1/2: MISS   FT 2/2: GOOD Pau Tatum makes 1/2 from the line.
Score: 119-105

[01:47] Team_003 possession (Score: 119-105)
Collin Mitchell attempts a Layup. Contested by Pau Tatum (4.7 feet, ZONE). Collin Mitchell misses. Rebound secured by Myles Harden.

[01:36] Team_051 possession (Score: 119-105)
Pau Tatum drives to the basket... Pau Tatum loses control! Ball rolls out of bounds! TURNOVER! (dead ball)

[01:24] Team_003 possession (Score: 119-105)
Pau Williamson attempts a 3Pt. Contested by Myles Harden (4.4 feet, ZONE). Pau Williamson misses. Rebound secured by Pau Tatum.

[01:14] Team_051 possession (Score: 119-105)
Tobias Jokic attempts a Midrange. Contested by Pau Williamson (5.6 feet, ZONE). Tobias Jokic misses. Offensive rebound by Tobias Jokic! Tobias Jokic kicks it out.

[01:01] Team_051 possession (Score: 119-105)
Pau Tatum makes the Dunk and draws the foul on Pau Williamson! And-1! Pau Tatum to the line for 1. [BONUS: 6 team fouls] (Pau Williamson: 1 personal fouls)   FT 1/1: GOOD Pau Tatum makes 1/1 from the line.
Score: 119-108

[00:48] Team_003 possession (Score: 119-108)
Anfernee Jordan attempts a 3Pt. Contested by Tobias Jokic (5.0 feet, MAN). Anfernee Jordan misses. Rebound secured by Pau Tatum.

[00:36] Team_051 possession (Score: 119-108)
Tobias Jokic drives and kicks out. Tobias Jokic attempts a 3Pt. Contested by Miles Towns (5.6 feet, ZONE). Tobias Jokic misses. Rebound secured by Anfernee Jordan.

[00:20] Team_003 possession (Score: 119-108)
Pau Williamson attempts a 3Pt. Contested by Zion Morant (5.8 feet, MAN). Pau Williamson misses. Offensive rebound by Bam Gilgeous-Alexander! Bam Gilgeous-Alexander's putback is no good. Offensive rebound by Bam Gilgeous-Alexander! Bam Gilgeous-Alexander kicks it out.

[00:09] Team_003 possession (Score: 119-108)
Collin Mitchell attempts a 3Pt. Contested by Myles Harden (4.8 feet, ZONE). Collin Mitchell misses. Offensive rebound by Bam Gilgeous-Alexander! Bam Gilgeous-Alexander puts it back in!
Score: 121-108

================================================================================
                              4TH QUARTER COMPLETE                              
================================================================================

4TH QUARTER SCORE: Team_003 32, Team_051 13

BOX SCORE:
================================================================================

Team_003
--------------------------------------------------------------------------------
Player                MIN  PTS  REB  AST  TO      FG   FG%      3P   3P%
--------------------------------------------------------------------------------
Bam Gilgeous-Alexander   20   13    7    0   0   5/5   100.0     0/0   0.0
Rudy Haliburton        36    9    4    0   0   4/5    80.0     0/0   0.0
Ayo Jackson            29    4    0    0   0   1/1   100.0     0/0   0.0
Pau Williamson         20    3    0    0   0   1/4    25.0     0/0   0.0
Anfernee Jordan        20    1    3    2   0   1/4    25.0     0/0   0.0
Miles Towns            20    0    0    0   0   0/2     0.0     0/0   0.0
Collin Mitchell        12    0    1    0   0   0/1     0.0     0/0   0.0

TEAM: FG: 12/22 (54.5%), 3PT: 3/7 (42.9%), REB: 15 (4 off, 11 def), AST: 2, TO: 0
TEAM FOULS: 6 [Team_051 in BONUS]


Team_051
--------------------------------------------------------------------------------
Player                MIN  PTS  REB  AST  TO      FG   FG%      3P   3P%
--------------------------------------------------------------------------------
Pau Tatum              20    6    5    0   0   3/8    37.5     0/0   0.0
Franz Simmons          36    4    2    0   0   2/2   100.0     0/0   0.0
Zion Morant            20    2    0    0   0   1/2    50.0     0/0   0.0
Shaquille Harden       29    0    0    1   0   0/0     0.0     0/0   0.0
Austin Sexton          36    0    0    2   0   0/2     0.0     0/0   0.0
Jrue Carter            20    0    1    0   0   0/1     0.0     0/0   0.0
Myles Harden           12    0    2    0   0   0/1     0.0     0/0   0.0
Tobias Jokic           12    0    1    0   0   0/1     0.0     0/0   0.0

TEAM: FG: 6/17 (35.3%), 3PT: 0/6 (0.0%), REB: 11 (2 off, 9 def), AST: 3, TO: 4
TEAM FOULS: 7 [Team_003 in BONUS]

================================================================================

================================================================================
                               FULL GAME COMPLETE                               
================================================================================

FINAL SCORE: Team_003 121, Team_051 108

SCORING BY QUARTER:
--------------------------------------------------------------------------------
Team                     Q1     Q2     Q3     Q4    FINAL
--------------------------------------------------------------------------------
Team_003                 31     23     35     32      121
Team_051                 36     35     24     13      108
--------------------------------------------------------------------------------

FULL GAME BOX SCORE:
================================================================================

Team_003
--------------------------------------------------------------------------------
Player                MIN  PTS  REB  AST  TO      FG   FG%      3P   3P%      FT STL BLK
--------------------------------------------------------------------------------
Rudy Haliburton        36   30   12    3   0   9/13   69.2   3/5    60.0   6/7     0   0
Ayo Jackson            29   14    0    1   0   6/12   50.0   3/8    37.5   2/2     1   0
Nikola Bryant          29   14    0    3   3   6/10   60.0   2/6    33.3   3/3     0   0
Giannis Turner         29   11    7    4   0   5/9    55.6   1/1   100.0   2/4     1   0
Victor O'Neal          29    9    8    1   1   5/7    71.4   0/1     0.0   3/5     0   0
Miles Towns            20    8    0    1   2   2/6    33.3   0/2     0.0   1/1     1   0
Pau Williamson         20   10    0    0   0   3/8    37.5   2/4    50.0   2/2     0   0
Anfernee Jordan        20    3    5    3   0   2/8    25.0   0/2     0.0   1/3     0   0
Bam Gilgeous-Alexander   20   13    9    1   0   5/5   100.0   0/0     0.0   1/2     0   1
Collin Mitchell        12    0    3    1   1   2/5    40.0   1/3    33.3   0/0     0   0

TEAM: FG: 47/85 (55.3%), 3PT: 12/32 (37.5%), REB: 43 (12 off, 31 def), AST: 18, TO: 7


Team_051
--------------------------------------------------------------------------------
Player                MIN  PTS  REB  AST  TO      FG   FG%      3P   3P%      FT STL BLK
--------------------------------------------------------------------------------
Austin Sexton          36   17    0    4   4   6/13   46.2   1/6    16.7   2/3     0   1
Franz Simmons          36   22   13    5   3   9/11   81.8   2/3    66.7   5/6     0   2
Larry McGrady          29    9    0    1   0   4/5    80.0   1/1   100.0   0/0     0   0
OG Siakam              29   17    4    3   2   9/14   64.3   7/12   58.3   2/2     0   0
Shaquille Harden       29    6   11    4   0   1/3    33.3   0/1     0.0   0/0     1   0
Zion Morant            20    7    0    0   0   2/3    66.7   0/1     0.0   1/2     0   1
Jrue Carter            20    4    1    1   2   2/4    50.0   0/2     0.0   0/0     1   0
Pau Tatum              20   14    9    1   0   6/12   50.0   0/2     0.0   4/6     0   0
Myles Harden           12    2    5    1   1   1/4    25.0   0/1     0.0   0/0     0   0
Tobias Jokic           12    5    4    1   1   4/6    66.7   0/1     0.0   3/3     0   0

TEAM: FG: 44/76 (57.9%), 3PT: 11/30 (36.7%), REB: 47 (11 off, 36 def), AST: 21, TO: 13

================================================================================
