================================================================================
                        FULL GAME - Team_058 vs Team_093                        
================================================================================

================================================================================
                       1ST QUARTER - Team_058 vs Team_093                       
================================================================================

[12:00] Team_058 possession (Score: 0-0)
Vince Hyland attempts a 3Pt. Contested by Carmelo Wagner (3.7 feet, MAN). VINCE HYLAND MAKES IT! Assist: Tyrese Doncic
Score: 3-0

[11:45] Team_093 possession (Score: 3-0)
Trae Westbrook attempts a Layup. Contested by Stephen Haliburton (3.2 feet, ZONE). TRAE WESTBROOK MAKES IT! Assist: Damian Williamson
Score: 3-2

[11:33] Team_058 possession (Score: 3-2)
Bradley Sexton attempts a 3Pt. Contested by Carmelo Wagner (3.7 feet, ZONE). Bradley Sexton misses. Rebound secured by Vince Barnes.

[11:17] Team_093 possession (Score: 3-2)
Trae Westbrook drives, Kyle Westbrook stays with him. Trae Westbrook attempts a Dunk. Contested by Kyle Westbrook (3.8 feet, MAN). Trae Westbrook misses. Offensive rebound by Carmelo Wagner! Carmelo Wagner kicks it out.

[10:57] Team_093 possession (Score: 3-2)
Damian Williamson attempts a Midrange. Contested by Vince Hyland (4.4 feet, ZONE). Damian Williamson misses. Rebound secured by Stephen Haliburton.

[10:45] Team_058 possession (Score: 3-2)
FOUL! Shooting foul on Damian Williamson. Kyle Westbrook to the line for 2 free throws. [Team fouls: 1] (Damian Williamson: 1 personal fouls)   FT 1/2: GOOD   FT 2/2: GOOD Kyle Westbrook makes 2/2 from the line.
Score: 5-2

[10:31] Team_093 possession (Score: 5-2)
Trae Westbrook attempts a Layup. Contested by Stephen Haliburton (3.2 feet, ZONE). Trae Westbrook misses. Rebound secured by Bradley Sexton.

[10:21] Team_058 possession (Score: 5-2)
Tyrese Doncic makes the Midrange and draws the foul on Vince Barnes! And-1! Tyrese Doncic to the line for 1. [Team fouls: 2] (Vince Barnes: 1 personal fouls)   FT 1/1: GOOD Tyrese Doncic makes 1/1 from the line.
Score: 8-2

[10:05] Team_093 possession (Score: 8-2)
FOUL! Offensive foul on Damian Williamson! Bradley Sexton drew the charge! [Team fouls: 3] (Damian Williamson: 2 personal fouls) TURNOVER! (dead ball)

[09:51] Team_058 possession (Score: 8-2)
Stephen Haliburton attempts a Midrange. Contested by Vince Barnes (4.2 feet, MAN). STEPHEN HALIBURTON MAKES IT!
Score: 10-2

[09:35] Team_093 possession (Score: 10-2)
FOUL! Reach-in foul on Bradley Sexton during the drive. [Team fouls: 1] No free throws, side out. (Bradley Sexton: 1 personal fouls)

[09:21] Team_093 possession (Score: 10-2)
FOUL! Reach-in foul on Vince Hyland during the drive. [Team fouls: 2] No free throws, side out. (Vince Hyland: 1 personal fouls)

[09:04] Team_093 possession (Score: 10-2)
Carmelo Wagner attempts a 3Pt. Contested by Bradley Sexton (2.7 feet, ZONE). Carmelo Wagner misses. Offensive rebound by Carmelo Wagner! Carmelo Wagner kicks it out.

[08:50] Team_093 possession (Score: 10-2)
Vince Barnes attempts a Layup. Contested by Stephen Haliburton (3.6 feet, ZONE). VINCE BARNES MAKES IT!
Score: 10-4

[08:36] Team_058 possession (Score: 10-4)
Bradley Sexton drives to the basket... Bradley Sexton throws a bad pass! Stolen by Ben Cunningham! TURNOVER! (live ball)

[08:21] Team_093 possession (Score: 10-4)
FOUL! Holding foul on Kyle Westbrook. [Team fouls: 3] No free throws, side out. (Kyle Westbrook: 1 personal fouls)

[08:04] Team_093 possession (Score: 10-4)
Damian Williamson attempts a 3Pt. Contested by Bradley Sexton (2.9 feet, ZONE). DAMIAN WILLIAMSON MAKES IT! Assist: Carmelo Wagner
Score: 10-7

[07:55] Team_058 possession (Score: 10-7)
Vince Hyland attempts a 3Pt. Contested by Carmelo Wagner (3.7 feet, MAN). VINCE HYLAND MAKES IT! Assist: Bradley Sexton
Score: 13-7

[07:39] Team_093 possession (Score: 13-7)
Damian Williamson attempts a Layup. Contested by Stephen Haliburton (3.4 feet, ZONE). Damian Williamson misses. Offensive rebound by Ben Cunningham! Ben Cunningham kicks it out.

[07:25] Team_093 possession (Score: 13-7)
Carmelo Wagner commits a violation (traveling/carry)! TURNOVER! (dead ball)

[07:08] Team_058 possession (Score: 13-7)
Kyle Westbrook loses the ball! Stripped by Trae Westbrook! TURNOVER! (live ball)

[06:55] Team_093 possession (Score: 13-7)
Trae Westbrook drives, Kyle Westbrook stays with him. Trae Westbrook attempts a Dunk. Contested by Kyle Westbrook (3.8 feet, MAN). TRAE WESTBROOK MAKES IT! Assist: Damian Williamson
Score: 13-9

[06:44] Team_058 possession (Score: 13-9)
Bradley Sexton attempts a Midrange. Contested by Damian Williamson (5.1 feet, MAN). Bradley Sexton misses. Offensive rebound by Tyrese Doncic! Tyrese Doncic kicks it out.

[06:25] Team_058 possession (Score: 13-9)
Bradley Sexton attempts a Midrange. Contested by Damian Williamson (5.1 feet, MAN). Bradley Sexton misses. Offensive rebound by Tyrese Doncic! Tyrese Doncic kicks it out.

[06:13] Team_058 possession (Score: 13-9)
Kyle Westbrook attempts a Layup. Contested by Trae Westbrook (5.6 feet, MAN). KYLE WESTBROOK MAKES IT!
Score: 15-9

[06:01] Team_093 possession (Score: 15-9)
Damian Williamson attempts a Midrange. Contested by Bradley Sexton (2.9 feet, MAN). Damian Williamson misses. Rebound secured by Tyrese Doncic.

[05:44] Team_058 possession (Score: 15-9)
Stephen Haliburton attempts a 3Pt. Contested by Carmelo Wagner (3.5 feet, ZONE). STEPHEN HALIBURTON MAKES IT! Assist: Bradley Sexton
Score: 18-9

[05:28] Team_093 possession (Score: 18-9)
Trae Westbrook attempts a Midrange. Contested by Vince Hyland (4.3 feet, ZONE). TRAE WESTBROOK MAKES IT! Assist: Vince Barnes
Score: 18-11

[05:11] Team_058 possession (Score: 18-11)
Kyle Westbrook attempts a 3Pt. Contested by Carmelo Wagner (3.6 feet, ZONE). KYLE WESTBROOK MAKES IT! Assist: Bradley Sexton
Score: 21-11

[04:57] Team_093 possession (Score: 21-11)
Ben Cunningham attempts a Midrange. Contested by Tyrese Doncic (4.9 feet, MAN). BEN CUNNINGHAM MAKES IT!
Score: 21-13

[04:40] Team_058 possession (Score: 21-13)
Bradley Sexton drives, Ben Cunningham stays with him. Bradley Sexton attempts a Layup. Contested by Ben Cunningham (5.3 feet, ZONE). Bradley Sexton misses. Offensive rebound by Stephen Haliburton! Stephen Haliburton's putback is no good. Offensive rebound by Stephen Haliburton! Stephen Haliburton kicks it out.

[04:24] Team_058 possession (Score: 21-13)
Kyle Westbrook drives, Trae Westbrook stays with him. Kyle Westbrook attempts a Dunk. Contested by Trae Westbrook (5.6 feet, MAN). KYLE WESTBROOK MAKES IT!
Score: 23-13

[04:08] Team_093 possession (Score: 23-13)
FOUL! Reach-in foul on Kyle Westbrook during the drive. [Team fouls: 4] No free throws, side out. (Kyle Westbrook: 2 personal fouls)

[03:53] Team_093 possession (Score: 23-13)
FOUL! Shooting foul on Stephen Haliburton. Vince Barnes to the line for 2 free throws. [BONUS: 5 team fouls] (Stephen Haliburton: 1 personal fouls)   FT 1/2: GOOD   FT 2/2: GOOD Vince Barnes makes 2/2 from the line.
Score: 23-15

[03:37] Team_058 possession (Score: 23-15)
Tyrese Doncic attempts a Layup. Contested by Ben Cunningham (5.1 feet, MAN). Tyrese Doncic misses. Rebound secured by Ben Cunningham.

[03:21] Team_093 possession (Score: 23-15)
Vince Barnes drives, picks up Stephen Haliburton. Help arrives from Bradley Sexton! Vince Barnes attempts a Layup. Contested by Bradley Sexton (3.8 feet, MAN). VINCE BARNES MAKES IT! Assist: Carmelo Wagner
Score: 23-17

[03:06] Team_058 possession (Score: 23-17)
Tyrese Doncic drives and kicks out. Vince Hyland attempts a 3Pt. Contested by Carmelo Wagner (3.6 feet, ZONE). Vince Hyland misses. Offensive rebound by Stephen Haliburton! Stephen Haliburton puts it back in!
Score: 25-17

[02:52] Team_093 possession (Score: 25-17)
Ben Cunningham attempts a Layup. Contested by Tyrese Doncic (5.1 feet, MAN). BEN CUNNINGHAM MAKES IT!
Score: 25-19

[02:38] Team_058 possession (Score: 25-19)
Stephen Haliburton attempts a Layup. Contested by Vince Barnes (4.4 feet, MAN). STEPHEN HALIBURTON MAKES IT!
Score: 27-19

[02:23] Team_093 possession (Score: 27-19)
FOUL! Shooting foul on Vince Hyland. Damian Williamson to the line for 2 free throws. [BONUS: 6 team fouls] (Vince Hyland: 2 personal fouls)   FT 1/2: GOOD   FT 2/2: GOOD Damian Williamson makes 2/2 from the line.
Score: 27-21

[02:08] Team_058 possession (Score: 27-21)
Bradley Sexton drives and kicks out. Tyrese Doncic attempts a Midrange. Contested by Ben Cunningham (5.3 feet, MAN). TYRESE DONCIC MAKES IT!
Score: 29-21

[01:53] Team_093 possession (Score: 29-21)
Damian Williamson attempts a Midrange. Contested by Bradley Sexton (3.2 feet, MAN). Damian Williamson misses. Rebound secured by Tyrese Doncic.

[01:38] Team_058 possession (Score: 29-21)
FOUL! Offensive foul on Vince Hyland! Carmelo Wagner drew the charge! [Team fouls: 7] (Vince Hyland: 3 personal fouls) TURNOVER! (dead ball)

[01:26] Team_093 possession (Score: 29-21)
Trae Westbrook attempts a Midrange. Contested by Kyle Westbrook (4.2 feet, ZONE). Trae Westbrook misses. Offensive rebound by Ben Cunningham! Ben Cunningham kicks it out.

[01:11] Team_093 possession (Score: 29-21)
Damian Williamson attempts a 3Pt. Contested by Kyle Westbrook (4.4 feet, ZONE). DAMIAN WILLIAMSON MAKES IT! Assist: Carmelo Wagner
Score: 29-24

[00:54] Team_058 possession (Score: 29-24)
Stephen Haliburton commits a violation (traveling/carry)! TURNOVER! (dead ball)

[00:54] Substitution (Team_058): Bradley Sexton OUT → Draymond Williamson IN (stamina_rule2)

[00:54] Substitution (Team_058): Kyle Westbrook OUT → Jordan Ingram IN (stamina_rule2)

[00:54] Substitution (Team_058): Vince Hyland OUT → Pascal Holiday IN (stamina_rule2)

[00:54] Substitution (Team_058): Stephen Haliburton OUT → Shai Lowry IN (stamina_rule2)

[00:54] Substitution (Team_058): Tyrese Doncic OUT → Jarrett Gilgeous-Alexander IN (stamina_rule2)

[00:54] Substitution (Team_093): Damian Williamson OUT → Shaquille George IN (stamina_rule2)

[00:54] Substitution (Team_093): Trae Westbrook OUT → Immanuel Cunningham IN (stamina_rule2)

[00:54] Substitution (Team_093): Carmelo Wagner OUT → Lauri Parker IN (stamina_rule2)

[00:54] Substitution (Team_093): Vince Barnes OUT → Kobe Murray IN (stamina_rule2)

[00:54] Substitution (Team_093): Ben Cunningham OUT → Cade O'Neal IN (stamina_rule2)

[00:41] Team_093 possession (Score: 29-24)
Immanuel Cunningham throws a bad pass! Stolen by Jordan Ingram! TURNOVER! (live ball)

[00:27] Team_058 possession (Score: 29-24)
Shai Lowry attempts a Layup. Contested by Kobe Murray (4.0 feet, MAN). Shai Lowry misses. Offensive rebound by Pascal Holiday! Pascal Holiday puts it back in!
Score: 31-24

[00:09] Team_093 possession (Score: 31-24)
Immanuel Cunningham drives, picks up Shai Lowry. Help arrives from Jordan Ingram! Immanuel Cunningham attempts a Layup. Contested by Jordan Ingram (4.2 feet, ZONE). Immanuel Cunningham misses. Rebound secured by Jarrett Gilgeous-Alexander.

================================================================================
                              1ST QUARTER COMPLETE                              
================================================================================

1ST QUARTER SCORE: Team_058 31, Team_093 24

BOX SCORE:
================================================================================

Team_058
--------------------------------------------------------------------------------
Player                MIN  PTS  REB  AST  TO      FG   FG%      3P   3P%
--------------------------------------------------------------------------------
Stephen Haliburton     11    9    3    0   0   4/4   100.0     0/0   0.0
Kyle Westbrook         11    9    0    0   0   4/4   100.0     0/0   0.0
Vince Hyland           11    6    0    0   0   2/2   100.0     0/0   0.0
Tyrese Doncic          11    5    4    1   0   2/3    66.7     0/0   0.0
Pascal Holiday          1    2    1    0   0   1/1   100.0     0/0   0.0
Bradley Sexton         11    0    1    3   0   0/1     0.0     0/0   0.0
Jarrett Gilgeous-Alexander    1    0    1    0   0   0/0     0.0     0/0   0.0

TEAM: FG: 13/15 (86.7%), 3PT: 4/5 (80.0%), REB: 10 (5 off, 5 def), AST: 4, TO: 4
TEAM FOULS: 7 [Team_093 in BONUS]


Team_093
--------------------------------------------------------------------------------
Player                MIN  PTS  REB  AST  TO      FG   FG%      3P   3P%
--------------------------------------------------------------------------------
Damian Williamson      11    8    0    2   0   3/6    50.0     0/0   0.0
Trae Westbrook         11    6    0    0   0   3/4    75.0     0/0   0.0
Vince Barnes           11    6    1    1   0   3/3   100.0     0/0   0.0
Ben Cunningham         11    4    3    0   0   2/2   100.0     0/0   0.0
Carmelo Wagner         11    0    2    3   0   0/0     0.0     0/0   0.0
Immanuel Cunningham     1    0    0    0   0   0/1     0.0     0/0   0.0

TEAM: FG: 11/16 (68.8%), 3PT: 2/2 (100.0%), REB: 6 (4 off, 2 def), AST: 6, TO: 3
TEAM FOULS: 3

================================================================================

================================================================================
                       2ND QUARTER - Team_058 vs Team_093                       
================================================================================

[12:00] Team_058 possession (Score: 31-24)
Kyle Westbrook attempts a 3Pt. Contested by Vince Barnes (4.4 feet, ZONE). Kyle Westbrook misses. Rebound secured by Carmelo Wagner.

[11:42] Team_093 possession (Score: 31-24)
Trae Westbrook makes the Midrange and draws the foul on Stephen Haliburton! And-1! Trae Westbrook to the line for 1. [Team fouls: 1] (Stephen Haliburton: 1 personal fouls)   FT 1/1: GOOD Trae Westbrook makes 1/1 from the line.
Score: 31-27

[11:27] Team_058 possession (Score: 31-27)
Stephen Haliburton attempts a Layup. BLOCKED BY TRAE WESTBROOK! Ball is loose! Rebound secured by Carmelo Wagner.

[11:11] Team_093 possession (Score: 31-27)
Ben Cunningham drives, picks up Tyrese Doncic. Help arrives from Bradley Sexton! Ben Cunningham attempts a Dunk. Contested by Bradley Sexton (5.1 feet, MAN). BEN CUNNINGHAM MAKES IT! Assist: Damian Williamson
Score: 31-29

[10:56] Team_058 possession (Score: 31-29)
Stephen Haliburton drives, Vince Barnes stays with him. Stephen Haliburton attempts a Layup. Contested by Vince Barnes (4.4 feet, MAN). STEPHEN HALIBURTON MAKES IT! Assist: Vince Hyland
Score: 33-29

[10:42] Team_093 possession (Score: 33-29)
Ben Cunningham attempts a Layup. Contested by Tyrese Doncic (5.1 feet, MAN). Ben Cunningham misses. Rebound secured by Stephen Haliburton.

[10:27] Team_058 possession (Score: 33-29)
Vince Hyland attempts a 3Pt. Contested by Carmelo Wagner (4.1 feet, ZONE). Vince Hyland misses. Rebound secured by Vince Barnes.

[10:14] Team_093 possession (Score: 33-29)
Carmelo Wagner makes the Layup and draws the foul on Vince Hyland! And-1! Carmelo Wagner to the line for 1. [Team fouls: 2] (Vince Hyland: 1 personal fouls)   FT 1/1: GOOD Carmelo Wagner makes 1/1 from the line.
Score: 33-32

[09:55] Team_058 possession (Score: 33-32)
Bradley Sexton drives and kicks out. Vince Hyland attempts a 3Pt. Contested by Carmelo Wagner (3.9 feet, ZONE). Vince Hyland misses. Rebound secured by Ben Cunningham.

[09:40] Team_093 possession (Score: 33-32)
FOUL! Holding foul on Stephen Haliburton. [Team fouls: 3] No free throws, side out. (Stephen Haliburton: 2 personal fouls)

[09:24] Team_093 possession (Score: 33-32)
Ben Cunningham attempts a 3Pt. Contested by Tyrese Doncic (5.2 feet, MAN). BEN CUNNINGHAM MAKES IT! Assist: Trae Westbrook
Score: 33-35

[09:14] Team_058 possession (Score: 33-35)
Kyle Westbrook makes the Layup and draws the foul on Trae Westbrook! And-1! Kyle Westbrook to the line for 1. [Team fouls: 1] (Trae Westbrook: 1 personal fouls)   FT 1/1: GOOD Kyle Westbrook makes 1/1 from the line.
Score: 36-35

[09:03] Team_093 possession (Score: 36-35)
Vince Barnes attempts a 3Pt. Contested by Stephen Haliburton (4.2 feet, MAN). Vince Barnes misses. Rebound secured by Tyrese Doncic.

[08:49] Team_058 possession (Score: 36-35)
FOUL! Holding foul on Vince Barnes. [Team fouls: 2] No free throws, side out. (Vince Barnes: 1 personal fouls)

[08:36] Team_058 possession (Score: 36-35)
Kyle Westbrook attempts a Midrange. Contested by Trae Westbrook (6.0 feet, MAN). Kyle Westbrook misses. FOUL! Loose ball foul on Vince Barnes during the rebound battle. [Team fouls: 3] No free throws, side out. (Vince Barnes: 2 personal fouls)

[08:24] Team_058 possession (Score: 36-35)
Kyle Westbrook loses control! Ball rolls out of bounds! TURNOVER! (dead ball)

[08:24] Substitution (Team_058): Bradley Sexton OUT → Draymond Williamson IN (stamina_rule2)

[08:24] Substitution (Team_058): Kyle Westbrook OUT → Jordan Ingram IN (stamina_rule2)

[08:24] Substitution (Team_058): Vince Hyland OUT → Pascal Holiday IN (stamina_rule2)

[08:24] Substitution (Team_058): Stephen Haliburton OUT → Shai Lowry IN (stamina_rule2)

[08:24] Substitution (Team_058): Tyrese Doncic OUT → Jarrett Gilgeous-Alexander IN (stamina_rule2)

[08:24] Substitution (Team_093): Damian Williamson OUT → Shaquille George IN (stamina_rule2)

[08:24] Substitution (Team_093): Trae Westbrook OUT → Immanuel Cunningham IN (stamina_rule2)

[08:24] Substitution (Team_093): Carmelo Wagner OUT → Lauri Parker IN (stamina_rule2)

[08:24] Substitution (Team_093): Vince Barnes OUT → Kobe Murray IN (stamina_rule2)

[08:24] Substitution (Team_093): Ben Cunningham OUT → Cade O'Neal IN (stamina_rule2)

[08:10] Team_093 possession (Score: 36-35)
Lauri Parker attempts a 3Pt. Contested by Pascal Holiday (4.6 feet, MAN). Lauri Parker misses. Rebound secured by Jarrett Gilgeous-Alexander.

[07:54] Team_058 possession (Score: 36-35)
Pascal Holiday attempts a 3Pt. Contested by Shaquille George (4.4 feet, ZONE). Pascal Holiday misses. Rebound secured by Kobe Murray.

[07:38] Team_093 possession (Score: 36-35)
FOUL! Shooting foul on Shai Lowry. Kobe Murray to the line for 2 free throws. [Team fouls: 4] (Shai Lowry: 1 personal fouls)   FT 1/2: GOOD   FT 2/2: GOOD Kobe Murray makes 2/2 from the line.
Score: 36-37

[07:25] Team_058 possession (Score: 36-37)
Pascal Holiday attempts a 3Pt. Contested by Shaquille George (4.4 feet, ZONE). Pascal Holiday misses. FOUL! Loose ball foul on Lauri Parker during the rebound battle. [Team fouls: 4] No free throws, side out. (Lauri Parker: 1 personal fouls)

[07:11] Team_058 possession (Score: 36-37)
FOUL! Shooting foul on Shaquille George. Draymond Williamson to the line for 2 free throws. [BONUS: 5 team fouls] (Shaquille George: 1 personal fouls)   FT 1/2: GOOD   FT 2/2: MISS Draymond Williamson makes 1/2 from the line. Rebound secured by Lauri Parker.
Score: 37-37

[06:57] Team_093 possession (Score: 37-37)
Kobe Murray attempts a Midrange. Contested by Jordan Ingram (6.0 feet, ZONE). Kobe Murray misses. Offensive rebound by Kobe Murray! Kobe Murray puts it back in!
Score: 37-39

[06:47] Team_058 possession (Score: 37-39)
Jarrett Gilgeous-Alexander drives and kicks out. Pascal Holiday attempts a Midrange. Contested by Kobe Murray (4.1 feet, ZONE). Pascal Holiday misses. FOUL! Loose ball foul on Lauri Parker during the rebound battle. [IN THE BONUS! 6 team fouls] Shai Lowry to the line for 2 free throws. (Lauri Parker: 2 personal fouls)   FT 1/2: GOOD   FT 2/2: GOOD Shai Lowry makes 2/2 from the line.
Score: 39-39

[06:35] Team_093 possession (Score: 39-39)
Cade O'Neal attempts a Layup. Contested by Jarrett Gilgeous-Alexander (5.3 feet, MAN). Cade O'Neal misses. Offensive rebound by Cade O'Neal! Cade O'Neal kicks it out.

[06:17] Team_093 possession (Score: 39-39)
Shaquille George attempts a 3Pt. Contested by Draymond Williamson (5.5 feet, ZONE). Shaquille George misses. Offensive rebound by Cade O'Neal! Cade O'Neal kicks it out.

[06:02] Team_093 possession (Score: 39-39)
Kobe Murray attempts a Midrange. Contested by Jordan Ingram (6.0 feet, ZONE). Kobe Murray misses. FOUL! Loose ball foul on Pascal Holiday during the rebound battle. [IN THE BONUS! 5 team fouls] Cade O'Neal to the line for 2 free throws. (Pascal Holiday: 1 personal fouls)   FT 1/2: GOOD   FT 2/2: MISS Cade O'Neal makes 1/2 from the line. Rebound secured by Shai Lowry.
Score: 39-40

[05:45] Team_058 possession (Score: 39-40)
Shai Lowry makes the 3Pt and draws the foul on Shaquille George! And-1! Shai Lowry to the line for 1. [BONUS: 7 team fouls] (Shaquille George: 2 personal fouls)   FT 1/1: GOOD Shai Lowry makes 1/1 from the line.
Score: 43-40

[05:30] Team_093 possession (Score: 43-40)
Lauri Parker attempts a 3Pt. Contested by Draymond Williamson (5.3 feet, ZONE). LAURI PARKER MAKES IT! Assist: Immanuel Cunningham
Score: 43-43

[05:14] Team_058 possession (Score: 43-43)
FOUL! Reach-in foul on Kobe Murray during the drive. [IN THE BONUS! 8 team fouls] Shai Lowry to the line for 2 free throws. (Kobe Murray: 1 personal fouls)   FT 1/2: GOOD   FT 2/2: GOOD Shai Lowry makes 2/2 from the line.
Score: 45-43

[04:59] Team_093 possession (Score: 45-43)
Cade O'Neal drives to the basket... Cade O'Neal loses the ball! Stripped by Jarrett Gilgeous-Alexander! TURNOVER! (live ball)

[04:44] Team_058 possession (Score: 45-43)
Jordan Ingram loses the ball! Stripped by Immanuel Cunningham! TURNOVER! (live ball)

[04:31] Team_093 possession (Score: 45-43)
Immanuel Cunningham attempts a 3Pt. Contested by Draymond Williamson (5.5 feet, ZONE). Immanuel Cunningham misses. Rebound secured by Pascal Holiday.

[04:17] Team_058 possession (Score: 45-43)
Draymond Williamson drives, Cade O'Neal stays with him. Draymond Williamson attempts a Layup. Contested by Cade O'Neal (5.7 feet, ZONE). Draymond Williamson misses. Rebound secured by Cade O'Neal.

[04:01] Team_093 possession (Score: 45-43)
Kobe Murray attempts a 3Pt. Contested by Shai Lowry (4.1 feet, MAN). KOBE MURRAY MAKES IT! Assist: Lauri Parker
Score: 45-46

[03:49] Team_058 possession (Score: 45-46)
Pascal Holiday attempts a 3Pt. Contested by Shaquille George (4.4 feet, ZONE). Pascal Holiday misses. Rebound secured by Lauri Parker.

[03:38] Team_093 possession (Score: 45-46)
Lauri Parker attempts a 3Pt. Contested by Draymond Williamson (5.3 feet, ZONE). LAURI PARKER MAKES IT! Assist: Shaquille George
Score: 45-49

[03:22] Team_058 possession (Score: 45-49)
Pascal Holiday attempts a 3Pt. Contested by Lauri Parker (4.6 feet, MAN). Pascal Holiday misses. Rebound secured by Kobe Murray.

[03:05] Team_093 possession (Score: 45-49)
Shaquille George loses control! Ball rolls out of bounds! TURNOVER! (dead ball)

[02:52] Team_058 possession (Score: 45-49)
Jordan Ingram attempts a 3Pt. Contested by Lauri Parker (4.6 feet, ZONE). Jordan Ingram misses. Rebound secured by Kobe Murray.

[02:37] Team_093 possession (Score: 45-49)
FOUL! Offensive foul on Shaquille George! Draymond Williamson drew the charge! [Team fouls: 9] (Shaquille George: 3 personal fouls) TURNOVER! (dead ball)

[02:25] Team_058 possession (Score: 45-49)
Jarrett Gilgeous-Alexander attempts a Layup. Contested by Kobe Murray (4.0 feet, MAN). JARRETT GILGEOUS-ALEXANDER MAKES IT! Assist: Pascal Holiday
Score: 47-49

[02:14] Team_093 possession (Score: 47-49)
Lauri Parker attempts a Midrange. Contested by Pascal Holiday (4.6 feet, MAN). LAURI PARKER MAKES IT!
Score: 47-51

[02:04] Team_058 possession (Score: 47-51)
Shai Lowry drives to the basket... Shai Lowry throws a bad pass out of bounds! TURNOVER! (dead ball)

[01:45] Team_093 possession (Score: 47-51)
Kobe Murray makes the Dunk and draws the foul on Shai Lowry! And-1! Kobe Murray to the line for 1. [BONUS: 6 team fouls] (Shai Lowry: 2 personal fouls)   FT 1/1: GOOD Kobe Murray makes 1/1 from the line.
Score: 47-54

[01:31] Team_058 possession (Score: 47-54)
Jarrett Gilgeous-Alexander drives, Kobe Murray stays with him. Jarrett Gilgeous-Alexander attempts a Dunk. Contested by Kobe Murray (4.1 feet, MAN). Jarrett Gilgeous-Alexander misses. Rebound secured by Cade O'Neal.

[01:13] Team_093 possession (Score: 47-54)
Shaquille George loses the ball! Stripped by Draymond Williamson! TURNOVER! (live ball)

[00:59] Team_058 possession (Score: 47-54)
Pascal Holiday attempts a 3Pt. Contested by Lauri Parker (4.8 feet, MAN). Pascal Holiday misses. FOUL! Loose ball foul on Cade O'Neal during the rebound battle. [IN THE BONUS! 10 team fouls] Pascal Holiday to the line for 2 free throws. (Cade O'Neal: 1 personal fouls)   FT 1/2: GOOD   FT 2/2: GOOD Pascal Holiday makes 2/2 from the line.
Score: 49-54

[00:44] Team_093 possession (Score: 49-54)
Kobe Murray loses the ball! Stripped by Shai Lowry! TURNOVER! (live ball)

[00:30] Team_058 possession (Score: 49-54)
Jordan Ingram attempts a 3Pt. Contested by Immanuel Cunningham (5.8 feet, MAN). Jordan Ingram misses. Rebound secured by Cade O'Neal.

[00:15] Team_093 possession (Score: 49-54)
Cade O'Neal attempts a Midrange. BLOCKED BY PASCAL HOLIDAY! Ball is loose! Rebound secured by Pascal Holiday.

================================================================================
                              2ND QUARTER COMPLETE                              
================================================================================

2ND QUARTER SCORE: Team_058 18, Team_093 30

BOX SCORE:
================================================================================

Team_058
--------------------------------------------------------------------------------
Player                MIN  PTS  REB  AST  TO      FG   FG%      3P   3P%
--------------------------------------------------------------------------------
Shai Lowry              9    8    1    0   0   3/3   100.0     0/0   0.0
Kyle Westbrook         15    3    0    0   0   1/2    50.0     0/0   0.0
Stephen Haliburton     15    2    1    0   0   1/2    50.0     0/0   0.0
Jarrett Gilgeous-Alexander    9    2    1    0   0   1/2    50.0     0/0   0.0
Pascal Holiday          9    2    3    1   0   1/4    25.0     0/0   0.0
Vince Hyland           15    0    0    1   0   0/1     0.0     0/0   0.0
Bradley Sexton         15    0    0    0   0   0/1     0.0     0/0   0.0
Tyrese Doncic          15    0    2    0   0   0/0     0.0     0/0   0.0
Draymond Williamson     9    0    0    0   0   0/2     0.0     0/0   0.0
Jordan Ingram           9    0    0    0   0   0/2     0.0     0/0   0.0

TEAM: FG: 7/19 (36.8%), 3PT: 2/9 (22.2%), REB: 7 (2 off, 5 def), AST: 2, TO: 3
TEAM FOULS: 6 [Team_093 in BONUS]


Team_093
--------------------------------------------------------------------------------
Player                MIN  PTS  REB  AST  TO      FG   FG%      3P   3P%
--------------------------------------------------------------------------------
Kobe Murray             9   10    4    0   0   4/5    80.0     0/0   0.0
Lauri Parker            9    8    2    1   0   3/4    75.0     0/0   0.0
Ben Cunningham         15    5    1    0   0   2/3    66.7     0/0   0.0
Carmelo Wagner         15    3    2    0   0   1/1   100.0     0/0   0.0
Trae Westbrook         15    3    0    1   0   1/1   100.0     0/0   0.0
Damian Williamson      15    0    0    1   0   0/0     0.0     0/0   0.0
Vince Barnes           15    0    1    0   0   0/1     0.0     0/0   0.0
Cade O'Neal             9    0    5    0   0   0/1     0.0     0/0   0.0
Immanuel Cunningham     9    0    0    1   0   0/1     0.0     0/0   0.0
Shaquille George        9    0    0    1   0   0/0     0.0     0/0   0.0

TEAM: FG: 11/17 (64.7%), 3PT: 4/7 (57.1%), REB: 16 (4 off, 12 def), AST: 5, TO: 5
TEAM FOULS: 10 [Team_058 in BONUS]

================================================================================

================================================================================
                       3RD QUARTER - Team_058 vs Team_093                       
================================================================================

[12:00] Team_058 possession (Score: 49-54)
Kyle Westbrook attempts a 3Pt. Contested by Trae Westbrook (5.6 feet, MAN). KYLE WESTBROOK MAKES IT! Assist: Vince Hyland
Score: 52-54

[11:47] Team_093 possession (Score: 52-54)
Ben Cunningham attempts a 3Pt. Contested by Tyrese Doncic (4.9 feet, MAN). Ben Cunningham misses. Rebound secured by Stephen Haliburton.

[11:37] Team_058 possession (Score: 52-54)
Vince Hyland attempts a 3Pt. Contested by Carmelo Wagner (3.7 feet, MAN). VINCE HYLAND MAKES IT! Assist: Bradley Sexton
Score: 55-54

[11:22] Team_093 possession (Score: 55-54)
FOUL! Offensive foul on Ben Cunningham! Tyrese Doncic drew the charge! [Team fouls: 1] (Ben Cunningham: 1 personal fouls) TURNOVER! (dead ball)

[11:07] Team_058 possession (Score: 55-54)
Vince Hyland attempts a Midrange. Contested by Carmelo Wagner (3.7 feet, ZONE). Vince Hyland misses. Rebound secured by Carmelo Wagner.

[10:54] Team_093 possession (Score: 55-54)
Damian Williamson attempts a 3Pt. Contested by Bradley Sexton (2.9 feet, MAN). Damian Williamson misses. Rebound secured by Stephen Haliburton.

[10:42] Team_058 possession (Score: 55-54)
Stephen Haliburton throws a bad pass out of bounds! TURNOVER! (dead ball)

[10:27] Team_093 possession (Score: 55-54)
Vince Barnes throws a bad pass! Stolen by Stephen Haliburton! TURNOVER! (live ball)

[10:16] Team_058 possession (Score: 55-54)
Stephen Haliburton makes the Layup and draws the foul on Vince Barnes! And-1! Stephen Haliburton to the line for 1. [Team fouls: 2] (Vince Barnes: 1 personal fouls)   FT 1/1: GOOD Stephen Haliburton makes 1/1 from the line.
Score: 58-54

[10:00] Team_093 possession (Score: 58-54)
FOUL! Shooting foul on Kyle Westbrook. Ben Cunningham to the line for 2 free throws. [Team fouls: 1] (Kyle Westbrook: 1 personal fouls)   FT 1/2: GOOD   FT 2/2: GOOD Ben Cunningham makes 2/2 from the line.
Score: 58-56

[09:47] Team_058 possession (Score: 58-56)
Tyrese Doncic attempts a Midrange. BLOCKED BY BEN CUNNINGHAM! Ball is loose! Rebound secured by Vince Barnes.

[09:36] Team_093 possession (Score: 58-56)
Carmelo Wagner attempts a 3Pt. Contested by Vince Hyland (4.2 feet, MAN). Carmelo Wagner misses. Rebound secured by Bradley Sexton.

[09:18] Team_058 possession (Score: 58-56)
Bradley Sexton attempts a Layup. Contested by Vince Barnes (4.4 feet, ZONE). Bradley Sexton misses. Offensive rebound by Stephen Haliburton! Stephen Haliburton's putback is no good. Rebound secured by Carmelo Wagner.

[09:02] Team_093 possession (Score: 58-56)
Carmelo Wagner attempts a Layup. Contested by Vince Hyland (4.2 feet, MAN). CARMELO WAGNER MAKES IT! Assist: Trae Westbrook
Score: 58-58

[08:49] Team_058 possession (Score: 58-58)
Tyrese Doncic drives, picks up Ben Cunningham. Help arrives from Trae Westbrook! Tyrese Doncic attempts a Dunk. Contested by Trae Westbrook (5.0 feet, ZONE). TYRESE DONCIC MAKES IT!
Score: 60-58

[08:33] Team_093 possession (Score: 60-58)
Ben Cunningham drives, Stephen Haliburton stays with him. Ben Cunningham attempts a Dunk. Contested by Stephen Haliburton (3.9 feet, ZONE). Ben Cunningham misses. Rebound secured by Tyrese Doncic.

[08:17] Team_058 possession (Score: 60-58)
Stephen Haliburton attempts a Layup. BLOCKED BY BEN CUNNINGHAM! Ball is loose! Offensive rebound by Tyrese Doncic! Tyrese Doncic kicks it out.

[08:02] Team_058 possession (Score: 60-58)
Stephen Haliburton drives, Ben Cunningham stays with him. Stephen Haliburton attempts a Dunk. Contested by Ben Cunningham (5.1 feet, ZONE). Stephen Haliburton misses. Rebound secured by Carmelo Wagner.

[07:45] Team_093 possession (Score: 60-58)
Ben Cunningham attempts a 3Pt. Contested by Tyrese Doncic (4.9 feet, MAN). Ben Cunningham misses. Rebound secured by Tyrese Doncic.

[07:31] Team_058 possession (Score: 60-58)
Kyle Westbrook attempts a 3Pt. Contested by Trae Westbrook (5.6 feet, MAN). KYLE WESTBROOK MAKES IT! Assist: Tyrese Doncic
Score: 63-58

[07:13] Team_093 possession (Score: 63-58)
Vince Barnes drives, picks up Stephen Haliburton. Help arrives from Bradley Sexton! Vince Barnes attempts a Layup. Contested by Bradley Sexton (3.6 feet, MAN). Vince Barnes misses. Rebound secured by Stephen Haliburton.

[06:56] Team_058 possession (Score: 63-58)
FOUL! Shooting foul on Carmelo Wagner. Vince Hyland to the line for 3 free throws. [Team fouls: 3] (Carmelo Wagner: 1 personal fouls)   FT 1/3: GOOD   FT 2/3: GOOD   FT 3/3: GOOD Vince Hyland makes 3/3 from the line.
Score: 66-58

[06:46] Team_093 possession (Score: 66-58)
Carmelo Wagner attempts a 3Pt. Contested by Vince Hyland (4.2 feet, MAN). Carmelo Wagner misses. Rebound secured by Tyrese Doncic.

[06:32] Team_058 possession (Score: 66-58)
Kyle Westbrook attempts a 3Pt. Contested by Trae Westbrook (5.6 feet, MAN). KYLE WESTBROOK MAKES IT! Assist: Vince Hyland
Score: 69-58

[06:18] Team_093 possession (Score: 69-58)
Trae Westbrook attempts a Midrange. Contested by Vince Hyland (4.3 feet, ZONE). Trae Westbrook misses. Rebound secured by Stephen Haliburton.

[06:03] Team_058 possession (Score: 69-58)
FOUL! Shooting foul on Vince Barnes. Stephen Haliburton to the line for 2 free throws. [Team fouls: 4] (Vince Barnes: 2 personal fouls)   FT 1/2: GOOD   FT 2/2: GOOD Stephen Haliburton makes 2/2 from the line.
Score: 71-58

[05:45] Team_093 possession (Score: 71-58)
Carmelo Wagner drives, Stephen Haliburton stays with him. Carmelo Wagner attempts a Dunk. Contested by Stephen Haliburton (3.1 feet, ZONE). Carmelo Wagner misses. Rebound secured by Stephen Haliburton.

[05:25] Team_058 possession (Score: 71-58)
Stephen Haliburton attempts a Layup. Contested by Vince Barnes (4.2 feet, MAN). STEPHEN HALIBURTON MAKES IT! Assist: Tyrese Doncic
Score: 73-58

[05:11] Team_093 possession (Score: 73-58)
Ben Cunningham attempts a 3Pt. Contested by Stephen Haliburton (4.0 feet, ZONE). Ben Cunningham misses. Offensive rebound by Carmelo Wagner! Carmelo Wagner kicks it out.

[04:58] Team_093 possession (Score: 73-58)
Carmelo Wagner attempts a 3Pt. Contested by Bradley Sexton (2.7 feet, ZONE). CARMELO WAGNER MAKES IT! Assist: Trae Westbrook
Score: 73-61

[04:43] Team_058 possession (Score: 73-61)
FOUL! Shooting foul on Ben Cunningham. Kyle Westbrook to the line for 2 free throws. [BONUS: 5 team fouls] (Ben Cunningham: 2 personal fouls)   FT 1/2: GOOD   FT 2/2: GOOD Kyle Westbrook makes 2/2 from the line.
Score: 75-61

[04:28] Team_093 possession (Score: 75-61)
Trae Westbrook makes the Midrange and draws the foul on Kyle Westbrook! And-1! Trae Westbrook to the line for 1. [Team fouls: 2] (Kyle Westbrook: 2 personal fouls)   FT 1/1: GOOD Trae Westbrook makes 1/1 from the line.
Score: 75-64

[04:10] Team_058 possession (Score: 75-64)
FOUL! Shooting foul on Ben Cunningham. Tyrese Doncic to the line for 2 free throws. [BONUS: 6 team fouls] (Ben Cunningham: 3 personal fouls)   FT 1/2: GOOD   FT 2/2: GOOD Tyrese Doncic makes 2/2 from the line.
Score: 77-64

[03:58] Team_093 possession (Score: 77-64)
Ben Cunningham attempts a 3Pt. Contested by Tyrese Doncic (5.0 feet, MAN). Ben Cunningham misses. Rebound secured by Tyrese Doncic.

[03:44] Team_058 possession (Score: 77-64)
Tyrese Doncic attempts a Midrange. Contested by Ben Cunningham (5.1 feet, MAN). Tyrese Doncic misses. Rebound secured by Ben Cunningham.

[03:28] Team_093 possession (Score: 77-64)
Ben Cunningham attempts a 3Pt. Contested by Tyrese Doncic (5.0 feet, MAN). BEN CUNNINGHAM MAKES IT! Assist: Trae Westbrook
Score: 77-67

[03:14] Team_058 possession (Score: 77-67)
FOUL! Holding foul on Vince Barnes. [IN THE BONUS! 7 team fouls] Stephen Haliburton to the line for 2 free throws. (Vince Barnes: 3 personal fouls)   FT 1/2: GOOD   FT 2/2: GOOD Stephen Haliburton makes 2/2 from the line.
Score: 79-67

[02:59] Team_093 possession (Score: 79-67)
Damian Williamson drives to the basket... Damian Williamson loses control! Ball rolls out of bounds! TURNOVER! (dead ball)

[02:59] Substitution (Team_058): Kyle Westbrook OUT → Jordan Ingram IN (stamina_rule2)

[02:59] Substitution (Team_093): Damian Williamson OUT → Shaquille George IN (stamina_rule2)

[02:59] Substitution (Team_093): Carmelo Wagner OUT → Lauri Parker IN (stamina_rule2)

[02:59] Substitution (Team_093): Ben Cunningham OUT → Cade O'Neal IN (stamina_rule2)

[02:48] Team_058 possession (Score: 79-67)
Tyrese Doncic throws a bad pass out of bounds! TURNOVER! (dead ball)

[02:48] Substitution (Team_058): Stephen Haliburton OUT → Shai Lowry IN (stamina_rule2)

[02:34] Team_093 possession (Score: 79-67)
Trae Westbrook throws a bad pass! Stolen by Bradley Sexton! TURNOVER! (live ball)

[02:18] Team_058 possession (Score: 79-67)
Bradley Sexton throws a bad pass out of bounds! TURNOVER! (dead ball)

[02:18] Substitution (Team_058): Bradley Sexton OUT → Draymond Williamson IN (stamina_rule2)

[02:18] Substitution (Team_058): Tyrese Doncic OUT → Jarrett Gilgeous-Alexander IN (stamina_rule2)

[02:18] Substitution (Team_093): Trae Westbrook OUT → Immanuel Cunningham IN (stamina_rule2)

[02:18] Substitution (Team_093): Vince Barnes OUT → Kobe Murray IN (stamina_rule2)

[02:03] Team_093 possession (Score: 79-67)
Kobe Murray attempts a 3Pt. Contested by Shai Lowry (4.1 feet, MAN). KOBE MURRAY MAKES IT! Assist: Cade O'Neal
Score: 79-70

[01:51] Team_058 possession (Score: 79-70)
Shai Lowry makes the Dunk and draws the foul on Shaquille George! And-1! Shai Lowry to the line for 1. [BONUS: 8 team fouls] (Shaquille George: 1 personal fouls)   FT 1/1: GOOD Shai Lowry makes 1/1 from the line.
Score: 82-70

[01:32] Team_093 possession (Score: 82-70)
Lauri Parker attempts a 3Pt. Contested by Draymond Williamson (5.3 feet, ZONE). LAURI PARKER MAKES IT! Assist: Immanuel Cunningham
Score: 82-73

[01:23] Team_058 possession (Score: 82-73)
Shai Lowry drives, Kobe Murray stays with him. Shai Lowry attempts a Layup. Contested by Kobe Murray (4.0 feet, MAN). SHAI LOWRY MAKES IT! Assist: Vince Hyland
Score: 84-73

[01:11] Team_093 possession (Score: 84-73)
Shaquille George attempts a 3Pt. Contested by Vince Hyland (5.1 feet, ZONE). SHAQUILLE GEORGE MAKES IT! Assist: Cade O'Neal
Score: 84-76

[00:57] Team_058 possession (Score: 84-76)
Draymond Williamson attempts a Midrange. Contested by Shaquille George (4.8 feet, MAN). Draymond Williamson misses. Rebound secured by Cade O'Neal.

[00:41] Team_093 possession (Score: 84-76)
FOUL! Shooting foul on Jarrett Gilgeous-Alexander. Lauri Parker to the line for 2 free throws. [Team fouls: 3] (Jarrett Gilgeous-Alexander: 1 personal fouls)   FT 1/2: GOOD   FT 2/2: GOOD Lauri Parker makes 2/2 from the line.
Score: 84-78

[00:26] Team_058 possession (Score: 84-78)
Jordan Ingram drives, picks up Immanuel Cunningham. Help arrives from Shaquille George! Jordan Ingram attempts a Layup. Contested by Shaquille George (5.7 feet, MAN). Jordan Ingram misses. Rebound secured by Cade O'Neal.

[00:11] Team_093 possession (Score: 84-78)
Cade O'Neal drives to the basket... Cade O'Neal loses the ball! Stripped by Jarrett Gilgeous-Alexander! TURNOVER! (live ball)

[00:01] Team_058 possession (Score: 84-78)
FOUL! Reach-in foul on Shaquille George during the drive. [IN THE BONUS! 9 team fouls] Draymond Williamson to the line for 2 free throws. (Shaquille George: 2 personal fouls)   FT 1/2: GOOD   FT 2/2: GOOD Draymond Williamson makes 2/2 from the line.
Score: 86-78

================================================================================
                              3RD QUARTER COMPLETE                              
================================================================================

3RD QUARTER SCORE: Team_058 37, Team_093 24

BOX SCORE:
================================================================================

Team_058
--------------------------------------------------------------------------------
Player                MIN  PTS  REB  AST  TO      FG   FG%      3P   3P%
--------------------------------------------------------------------------------
Kyle Westbrook         24   11    0    0   0   4/4   100.0     0/0   0.0
Stephen Haliburton     25    9    5    0   0   4/5    80.0     0/0   0.0
Vince Hyland           27    6    0    3   0   2/3    66.7     0/0   0.0
Shai Lowry             12    5    0    0   0   2/2   100.0     0/0   0.0
Tyrese Doncic          25    4    5    2   0   2/4    50.0     0/0   0.0
Draymond Williamson    11    2    0    0   0   1/2    50.0     0/0   0.0
Bradley Sexton         25    0    1    1   0   0/1     0.0     0/0   0.0
Jordan Ingram          12    0    0    0   0   0/1     0.0     0/0   0.0

TEAM: FG: 15/22 (68.2%), 3PT: 5/5 (100.0%), REB: 12 (2 off, 10 def), AST: 6, TO: 3
TEAM FOULS: 3


Team_093
--------------------------------------------------------------------------------
Player                MIN  PTS  REB  AST  TO      FG   FG%      3P   3P%
--------------------------------------------------------------------------------
Ben Cunningham         24    5    1    0   0   2/6    33.3     0/0   0.0
Carmelo Wagner         24    5    4    0   0   2/5    40.0     0/0   0.0
Lauri Parker           12    5    0    0   0   2/2   100.0     0/0   0.0
Trae Westbrook         25    3    0    3   0   1/2    50.0     0/0   0.0
Kobe Murray            11    3    0    0   0   1/1   100.0     0/0   0.0
Shaquille George       12    3    0    0   0   1/1   100.0     0/0   0.0
Damian Williamson      24    0    0    0   0   0/1     0.0     0/0   0.0
Vince Barnes           25    0    1    0   0   0/1     0.0     0/0   0.0
Cade O'Neal            12    0    2    2   0   0/0     0.0     0/0   0.0
Immanuel Cunningham    11    0    0    1   0   0/0     0.0     0/0   0.0

TEAM: FG: 9/19 (47.4%), 3PT: 5/11 (45.5%), REB: 7 (1 off, 6 def), AST: 6, TO: 5
TEAM FOULS: 9 [Team_058 in BONUS]

================================================================================

================================================================================
                       4TH QUARTER - Team_058 vs Team_093                       
================================================================================

[12:00] Team_058 possession (Score: 86-78)
Tyrese Doncic drives and kicks out. Vince Hyland attempts a 3Pt. Contested by Carmelo Wagner (3.3 feet, ZONE). Vince Hyland misses. Rebound secured by Ben Cunningham.

[11:43] Team_093 possession (Score: 86-78)
Vince Barnes attempts a Midrange. Contested by Stephen Haliburton (3.6 feet, ZONE). Vince Barnes misses. Rebound secured by Stephen Haliburton.

[11:28] Team_058 possession (Score: 86-78)
Kyle Westbrook drives, picks up Trae Westbrook. Help arrives from Carmelo Wagner! Kyle Westbrook attempts a Dunk. Contested by Carmelo Wagner (5.6 feet, MAN). KYLE WESTBROOK MAKES IT! Assist: Bradley Sexton
Score: 88-78

[11:13] Team_093 possession (Score: 88-78)
Carmelo Wagner drives and kicks out. Carmelo Wagner attempts a 3Pt. Contested by Bradley Sexton (3.0 feet, ZONE). Carmelo Wagner misses. Rebound secured by Tyrese Doncic.

[10:53] Team_058 possession (Score: 88-78)
Stephen Haliburton drives and kicks out. Tyrese Doncic attempts a Midrange. Contested by Vince Barnes (4.1 feet, ZONE). Tyrese Doncic misses. Rebound secured by Vince Barnes.

[10:38] Team_093 possession (Score: 88-78)
Ben Cunningham attempts a Layup. BLOCKED BY BRADLEY SEXTON! Ball is loose! Rebound secured by Bradley Sexton.

[10:27] Team_058 possession (Score: 88-78)
Stephen Haliburton attempts a 3Pt. Contested by Carmelo Wagner (3.6 feet, ZONE). Stephen Haliburton misses. Rebound secured by Carmelo Wagner.

[10:10] Team_093 possession (Score: 88-78)
FOUL! Shooting foul on Bradley Sexton. Damian Williamson to the line for 2 free throws. [Team fouls: 1] (Bradley Sexton: 1 personal fouls)   FT 1/2: MISS   FT 2/2: GOOD Damian Williamson makes 1/2 from the line.
Score: 88-79

[09:53] Team_058 possession (Score: 88-79)
Bradley Sexton loses control! Ball rolls out of bounds! TURNOVER! (dead ball)

[09:53] Substitution (Team_058): Vince Hyland OUT → Pascal Holiday IN (stamina_rule2)

[09:38] Team_093 possession (Score: 88-79)
Damian Williamson attempts a 3Pt. Contested by Bradley Sexton (3.1 feet, MAN). DAMIAN WILLIAMSON MAKES IT! Assist: Carmelo Wagner
Score: 88-82

[09:23] Team_058 possession (Score: 88-82)
Kyle Westbrook drives to the basket... Kyle Westbrook throws a bad pass! Stolen by Ben Cunningham! TURNOVER! (live ball)

[09:07] Team_093 possession (Score: 88-82)
Carmelo Wagner drives, Pascal Holiday stays with him. Carmelo Wagner attempts a Layup. Contested by Pascal Holiday (4.2 feet, MAN). CARMELO WAGNER MAKES IT! Assist: Vince Barnes
Score: 88-84

[08:51] Team_058 possession (Score: 88-84)
Stephen Haliburton attempts a Midrange. Contested by Trae Westbrook (5.8 feet, ZONE). Stephen Haliburton misses. FOUL! Loose ball foul on Carmelo Wagner during the rebound battle. [Team fouls: 1] No free throws, side out. (Carmelo Wagner: 1 personal fouls)

[08:37] Team_058 possession (Score: 88-84)
Tyrese Doncic attempts a 3Pt. Contested by Carmelo Wagner (3.7 feet, ZONE). Tyrese Doncic misses. Rebound secured by Carmelo Wagner.

[08:21] Team_093 possession (Score: 88-84)
Carmelo Wagner attempts a 3Pt. Contested by Bradley Sexton (3.0 feet, ZONE). Carmelo Wagner misses. Offensive rebound by Carmelo Wagner! Carmelo Wagner kicks it out.

[08:10] Team_093 possession (Score: 88-84)
Damian Williamson attempts a 3Pt. Contested by Bradley Sexton (3.3 feet, MAN). Damian Williamson misses. FOUL! Loose ball foul on Tyrese Doncic during the rebound battle. [Team fouls: 2] No free throws, side out. (Tyrese Doncic: 1 personal fouls)

[07:59] Team_093 possession (Score: 88-84)
Ben Cunningham attempts a 3Pt. Contested by Tyrese Doncic (5.2 feet, MAN). Ben Cunningham misses. Rebound secured by Pascal Holiday.

[07:45] Team_058 possession (Score: 88-84)
Stephen Haliburton attempts a Midrange. Contested by Vince Barnes (4.6 feet, MAN). Stephen Haliburton misses. Offensive rebound by Tyrese Doncic! Tyrese Doncic kicks it out.

[07:30] Team_058 possession (Score: 88-84)
Stephen Haliburton attempts a Midrange. Contested by Vince Barnes (4.6 feet, ZONE). Stephen Haliburton misses. Rebound secured by Carmelo Wagner.

[07:16] Team_093 possession (Score: 88-84)
Vince Barnes drives and kicks out. Carmelo Wagner attempts a Midrange. Contested by Pascal Holiday (4.6 feet, MAN). CARMELO WAGNER MAKES IT!
Score: 88-86

[07:01] Team_058 possession (Score: 88-86)
Tyrese Doncic attempts a Layup. Contested by Ben Cunningham (5.4 feet, MAN). TYRESE DONCIC MAKES IT! Assist: Kyle Westbrook
Score: 90-86

[06:47] Team_093 possession (Score: 90-86)
Damian Williamson drives to the basket... Damian Williamson loses the ball! Stripped by Bradley Sexton! TURNOVER! (live ball)

[06:29] Team_058 possession (Score: 90-86)
Kyle Westbrook makes the Midrange and draws the foul on Trae Westbrook! And-1! Kyle Westbrook to the line for 1. [Team fouls: 2] (Trae Westbrook: 1 personal fouls)   FT 1/1: GOOD Kyle Westbrook makes 1/1 from the line.
Score: 93-86

[06:15] Team_093 possession (Score: 93-86)
Damian Williamson attempts a 3Pt. Contested by Bradley Sexton (3.6 feet, ZONE). Damian Williamson misses. Offensive rebound by Ben Cunningham! Ben Cunningham kicks it out.

[05:58] Team_093 possession (Score: 93-86)
Vince Barnes attempts a 3Pt. Contested by Bradley Sexton (3.8 feet, ZONE). Vince Barnes misses. Rebound secured by Tyrese Doncic.

[05:45] Team_058 possession (Score: 93-86)
FOUL! Reach-in foul on Carmelo Wagner during the drive. [Team fouls: 3] No free throws, side out. (Carmelo Wagner: 2 personal fouls)

[05:33] Team_058 possession (Score: 93-86)
FOUL! Holding foul on Carmelo Wagner. [Team fouls: 4] No free throws, side out. (Carmelo Wagner: 3 personal fouls)

[05:20] Team_058 possession (Score: 93-86)
Stephen Haliburton attempts a Midrange. Contested by Carmelo Wagner (4.2 feet, ZONE). Stephen Haliburton misses. FOUL! Loose ball foul on Ben Cunningham during the rebound battle. [IN THE BONUS! 5 team fouls] Stephen Haliburton to the line for 2 free throws. (Ben Cunningham: 1 personal fouls)   FT 1/2: MISS   FT 2/2: GOOD Stephen Haliburton makes 1/2 from the line.
Score: 94-86

[05:02] Team_093 possession (Score: 94-86)
Damian Williamson attempts a 3Pt. Contested by Bradley Sexton (3.7 feet, MAN). Damian Williamson misses. Rebound secured by Pascal Holiday.

[04:44] Team_058 possession (Score: 94-86)
Tyrese Doncic makes the Layup and draws the foul on Ben Cunningham! And-1! Tyrese Doncic to the line for 1. [BONUS: 6 team fouls] (Ben Cunningham: 2 personal fouls)   FT 1/1: MISS Tyrese Doncic makes 0/1 from the line. FOUL! Loose ball foul on Carmelo Wagner during the free throw rebound! [IN THE BONUS! 7 team fouls] Tyrese Doncic to the line for 2 free throws. (Carmelo Wagner: 4 personal fouls)   FT 1/2: GOOD   FT 2/2: GOOD Tyrese Doncic makes 2/2 from the line.
Score: 98-86

[04:31] Team_093 possession (Score: 98-86)
Damian Williamson attempts a 3Pt. Contested by Bradley Sexton (3.8 feet, ZONE). Damian Williamson misses. Rebound secured by Pascal Holiday.

[04:17] Team_058 possession (Score: 98-86)
Tyrese Doncic attempts a Midrange. Contested by Carmelo Wagner (4.3 feet, ZONE). TYRESE DONCIC MAKES IT!
Score: 100-86

[04:03] Team_093 possession (Score: 100-86)
Vince Barnes drives, picks up Stephen Haliburton. Help arrives from Bradley Sexton! Vince Barnes attempts a Dunk. Contested by Bradley Sexton (4.5 feet, MAN). Vince Barnes misses. Rebound secured by Pascal Holiday.

[03:49] Team_058 possession (Score: 100-86)
Bradley Sexton drives, Ben Cunningham stays with him. Bradley Sexton attempts a Layup. Wide open! Ben Cunningham is 6.0 feet away. [ZONE] BRADLEY SEXTON MAKES IT! Assist: Kyle Westbrook
Score: 102-86

[03:38] Team_093 possession (Score: 102-86)
Damian Williamson loses the ball! Stripped by Bradley Sexton! TURNOVER! (live ball)

[03:25] Team_058 possession (Score: 102-86)
Bradley Sexton attempts a 3Pt. Contested by Carmelo Wagner (4.7 feet, ZONE). BRADLEY SEXTON MAKES IT! Assist: Tyrese Doncic
Score: 105-86

[03:10] Team_093 possession (Score: 105-86)
Vince Barnes attempts a 3Pt. Contested by Bradley Sexton (4.2 feet, ZONE). Vince Barnes misses. Offensive rebound by Ben Cunningham! Ben Cunningham kicks it out.

[02:55] Team_093 possession (Score: 105-86)
Carmelo Wagner attempts a 3Pt. Contested by Bradley Sexton (3.9 feet, ZONE). Carmelo Wagner misses. Offensive rebound by Carmelo Wagner! Carmelo Wagner kicks it out.

[02:44] Team_093 possession (Score: 105-86)
Vince Barnes attempts a Midrange. Contested by Stephen Haliburton (4.7 feet, MAN). VINCE BARNES MAKES IT! Assist: Damian Williamson
Score: 105-88

[02:32] Team_058 possession (Score: 105-88)
Tyrese Doncic drives, Ben Cunningham stays with him. Tyrese Doncic attempts a Layup. Contested by Ben Cunningham (6.0 feet, MAN). TYRESE DONCIC MAKES IT! Assist: Kyle Westbrook
Score: 107-88

[02:15] Team_093 possession (Score: 107-88)
Trae Westbrook attempts a Layup. Contested by Stephen Haliburton (4.5 feet, ZONE). Trae Westbrook misses. Offensive rebound by Ben Cunningham! Ben Cunningham kicks it out.

[01:58] Team_093 possession (Score: 107-88)
Vince Barnes drives, picks up Stephen Haliburton. Help arrives from Bradley Sexton! Vince Barnes attempts a Dunk. Contested by Bradley Sexton (4.8 feet, ZONE). Vince Barnes misses. Offensive rebound by Carmelo Wagner! Carmelo Wagner kicks it out.

[01:43] Team_093 possession (Score: 107-88)
Ben Cunningham commits a violation (traveling/carry)! TURNOVER! (dead ball)

[01:43] Substitution (Team_058): Bradley Sexton OUT → Draymond Williamson IN (stamina_rule2)

[01:43] Substitution (Team_058): Kyle Westbrook OUT → Jordan Ingram IN (stamina_rule2)

[01:43] Substitution (Team_058): Stephen Haliburton OUT → Shai Lowry IN (stamina_rule2)

[01:43] Substitution (Team_058): Tyrese Doncic OUT → Jarrett Gilgeous-Alexander IN (stamina_rule2)

[01:43] Substitution (Team_093): Damian Williamson OUT → Shaquille George IN (stamina_rule2)

[01:43] Substitution (Team_093): Trae Westbrook OUT → Immanuel Cunningham IN (stamina_rule2)

[01:43] Substitution (Team_093): Carmelo Wagner OUT → Lauri Parker IN (stamina_rule2)

[01:43] Substitution (Team_093): Vince Barnes OUT → Kobe Murray IN (stamina_rule2)

[01:43] Substitution (Team_093): Ben Cunningham OUT → Cade O'Neal IN (stamina_rule2)

[01:24] Team_058 possession (Score: 107-88)
Jordan Ingram drives and kicks out. Draymond Williamson attempts a 3Pt. Contested by Shaquille George (4.3 feet, ZONE). DRAYMOND WILLIAMSON MAKES IT! Assist: Shai Lowry
Score: 110-88

[01:12] Team_093 possession (Score: 110-88)
Immanuel Cunningham attempts a Midrange. Wide open! Jordan Ingram is 6.2 feet away. [MAN] IMMANUEL CUNNINGHAM MAKES IT!
Score: 110-90

[00:55] Team_058 possession (Score: 110-90)
Draymond Williamson drives to the basket... FOUL! Offensive foul on Draymond Williamson! Shaquille George drew the charge! [Team fouls: 3] (Draymond Williamson: 1 personal fouls) TURNOVER! (dead ball)

[00:39] Team_093 possession (Score: 110-90)
FOUL! Shooting foul on Jarrett Gilgeous-Alexander. Cade O'Neal to the line for 2 free throws. [Team fouls: 4] (Jarrett Gilgeous-Alexander: 1 personal fouls)   FT 1/2: GOOD   FT 2/2: GOOD Cade O'Neal makes 2/2 from the line.
Score: 110-92

[00:24] Team_058 possession (Score: 110-92)
Jarrett Gilgeous-Alexander drives to the basket... Jarrett Gilgeous-Alexander throws a bad pass! Stolen by Kobe Murray! TURNOVER! (live ball)

[00:07] Team_093 possession (Score: 110-92)
FOUL! Shooting foul on Jordan Ingram. Immanuel Cunningham to the line for 3 free throws. [BONUS: 5 team fouls] (Jordan Ingram: 1 personal fouls)   FT 1/3: GOOD   FT 2/3: GOOD   FT 3/3: GOOD Immanuel Cunningham makes 3/3 from the line.
Score: 110-95

================================================================================
                              4TH QUARTER COMPLETE                              
================================================================================

4TH QUARTER SCORE: Team_058 24, Team_093 17

BOX SCORE:
================================================================================

Team_058
--------------------------------------------------------------------------------
Player                MIN  PTS  REB  AST  TO      FG   FG%      3P   3P%
--------------------------------------------------------------------------------
Tyrese Doncic          36   10    3    1   0   4/6    66.7     0/0   0.0
Kyle Westbrook         35    5    0    3   0   2/2   100.0     0/0   0.0
Bradley Sexton         36    5    1    1   0   2/2   100.0     0/0   0.0
Draymond Williamson    13    3    0    0   0   1/1   100.0     0/0   0.0
Stephen Haliburton     35    1    2    0   0   1/4    25.0     0/0   0.0
Pascal Holiday         19    0    4    0   0   0/0     0.0     0/0   0.0
Shai Lowry             13    0    0    1   0   0/0     0.0     0/0   0.0

TEAM: FG: 10/15 (66.7%), 3PT: 1/3 (33.3%), REB: 10 (2 off, 8 def), AST: 6, TO: 4
TEAM FOULS: 5 [Team_093 in BONUS]


Team_093
--------------------------------------------------------------------------------
Player                MIN  PTS  REB  AST  TO      FG   FG%      3P   3P%
--------------------------------------------------------------------------------
Immanuel Cunningham    13    5    0    0   0   2/2   100.0     0/0   0.0
Carmelo Wagner         35    4    7    1   0   2/3    66.7     0/0   0.0
Damian Williamson      35    4    0    1   0   2/4    50.0     0/0   0.0
Vince Barnes           36    2    1    1   0   1/4    25.0     0/0   0.0
Cade O'Neal            14    2    0    0   0   1/1   100.0     0/0   0.0
Ben Cunningham         35    0    4    0   0   0/2     0.0     0/0   0.0

TEAM: FG: 8/16 (50.0%), 3PT: 2/6 (33.3%), REB: 12 (7 off, 5 def), AST: 3, TO: 3
TEAM FOULS: 7 [Team_058 in BONUS]

================================================================================

================================================================================
                               FULL GAME COMPLETE                               
================================================================================

FINAL SCORE: Team_058 110, Team_093 95

SCORING BY QUARTER:
--------------------------------------------------------------------------------
Team                     Q1     Q2     Q3     Q4    FINAL
--------------------------------------------------------------------------------
Team_058                 31     18     37     24      110
Team_093                 24     30     24     17       95
--------------------------------------------------------------------------------

FULL GAME BOX SCORE:
================================================================================

Team_058
--------------------------------------------------------------------------------
Player                MIN  PTS  REB  AST  TO      FG   FG%      3P   3P%      FT STL BLK
--------------------------------------------------------------------------------
Bradley Sexton         36    5    3    5   2   3/6    50.0   1/2    50.0   0/0     3   1
Tyrese Doncic          36   19   14    4   2   8/13   61.5   0/1     0.0   3/4     0   0
Stephen Haliburton     35   21   11    0   2   8/13   61.5   1/2    50.0   6/7     1   0
Kyle Westbrook         35   28    0    3   2  11/12   91.7   4/5    80.0   6/6     0   0
Vince Hyland           30   12    0    4   2   4/6    66.7   4/5    80.0   3/3     0   0
Pascal Holiday         19    4    8    1   0   1/4    25.0   1/4    25.0   2/2     0   1
Jordan Ingram          14    0    0    0   1   1/4    25.0   0/2     0.0   0/0     1   0
Shai Lowry             13   13    1    1   3   5/5   100.0   1/1   100.0   6/6     1   0
Draymond Williamson    13    5    0    0   0   1/4    25.0   0/0     0.0   3/4     1   0
Jarrett Gilgeous-Alexander   13    2    2    0   0   2/3    66.7   0/0     0.0   0/0     2   0

TEAM: FG: 45/71 (63.4%), 3PT: 12/22 (54.5%), REB: 39 (11 off, 28 def), AST: 18, TO: 14


Team_093
--------------------------------------------------------------------------------
Player                MIN  PTS  REB  AST  TO      FG   FG%      3P   3P%      FT STL BLK
--------------------------------------------------------------------------------
Trae Westbrook         36   12    0    4   2   5/7    71.4   0/0     0.0   2/2     1   1
Vince Barnes           36    8    4    2   2   5/10   50.0   0/2     0.0   2/2     0   0
Damian Williamson      35   12    0    4   2   5/11   45.5   3/6    50.0   3/4     0   0
Carmelo Wagner         35   12   15    4   1   4/8    50.0   1/3    33.3   1/1     0   0
Ben Cunningham         35   14    9    0   2   6/13   46.2   2/6    33.3   2/2     2   2
Shaquille George       14    3    0    1   3   1/1   100.0   1/1   100.0   0/0     0   0
Lauri Parker           14   13    2    1   1   5/6    83.3   3/4    75.0   2/2     0   0
Cade O'Neal            14    2    7    2   0   1/2    50.0   0/0     0.0   3/4     0   0
Immanuel Cunningham    13    5    0    2   1   2/4    50.0   1/2    50.0   3/3     1   0
Kobe Murray            13   13    4    0   2   5/6    83.3   2/2   100.0   3/3     1   0

TEAM: FG: 39/68 (57.4%), 3PT: 13/26 (50.0%), REB: 41 (16 off, 25 def), AST: 20, TO: 16

================================================================================
