================================================================================
                        FULL GAME - Team_034 vs Team_007                        
================================================================================

================================================================================
                       1ST QUARTER - Team_034 vs Team_007                       
================================================================================

[12:00] Team_034 possession (Score: 0-0)
Terry Doncic attempts a 3Pt. Contested by John Quickley (3.1 feet, ZONE). TERRY DONCIC MAKES IT! Assist: Ben Hyland
Score: 3-0

[11:50] Team_007 possession (Score: 3-0)
Bones Siakam attempts a Midrange. Contested by Cole Antetokounmpo (4.6 feet, MAN). Bones Siakam misses. Rebound secured by Anthony Bane.

[11:35] Team_034 possession (Score: 3-0)
Ben Hyland attempts a Midrange. Contested by Carmelo Siakam (4.2 feet, ZONE). Ben Hyland misses. Offensive rebound by Terry Doncic! Terry Doncic puts it back in!
Score: 5-0

[11:20] Team_007 possession (Score: 5-0)
Jaren Dosunmu attempts a 3Pt. Contested by Ben Hyland (3.6 feet, MAN). Jaren Dosunmu misses. Rebound secured by Terry Doncic.

[11:02] Team_034 possession (Score: 5-0)
FOUL! Shooting foul on Jaren Dosunmu. Terry Doncic to the line for 3 free throws. [Team fouls: 1] (Jaren Dosunmu: 1 personal fouls)   FT 1/3: MISS   FT 2/3: GOOD   FT 3/3: GOOD Terry Doncic makes 2/3 from the line.
Score: 7-0

[10:50] Team_007 possession (Score: 7-0)
Jaren Dosunmu attempts a 3Pt. Contested by Devin Poole (3.9 feet, ZONE). Jaren Dosunmu misses. Rebound secured by Anthony Bane.

[10:38] Team_034 possession (Score: 7-0)
Ben Hyland makes the Midrange and draws the foul on Jaren Dosunmu! And-1! Ben Hyland to the line for 1. [Team fouls: 2] (Jaren Dosunmu: 2 personal fouls)   FT 1/1: GOOD Ben Hyland makes 1/1 from the line.
Score: 10-0

[10:24] Team_007 possession (Score: 10-0)
FOUL! Shooting foul on Devin Poole. Tobias Johnson to the line for 2 free throws. [Team fouls: 1] (Devin Poole: 1 personal fouls)   FT 1/2: MISS   FT 2/2: GOOD Tobias Johnson makes 1/2 from the line.
Score: 10-1

[10:09] Team_034 possession (Score: 10-1)
Devin Poole drives to the basket... Devin Poole loses control! Ball rolls out of bounds! TURNOVER! (dead ball)

[09:55] Team_007 possession (Score: 10-1)
Jaren Dosunmu attempts a 3Pt. Contested by Ben Hyland (3.6 feet, MAN). Jaren Dosunmu misses. Rebound secured by Terry Doncic.

[09:39] Team_034 possession (Score: 10-1)
Anthony Bane attempts a Midrange. Contested by Bones Siakam (3.7 feet, ZONE). Anthony Bane misses. FOUL! Loose ball foul on John Quickley during the rebound battle. [Team fouls: 3] No free throws, side out. (John Quickley: 1 personal fouls)

[09:24] Team_034 possession (Score: 10-1)
Terry Doncic attempts a Midrange. Contested by John Quickley (3.1 feet, MAN). Terry Doncic misses. Rebound secured by Bones Siakam.

[09:08] Team_007 possession (Score: 10-1)
Jaren Dosunmu drives, Ben Hyland stays with him. Jaren Dosunmu attempts a Dunk. Contested by Ben Hyland (3.6 feet, MAN). Jaren Dosunmu misses. Rebound secured by Cole Antetokounmpo.

[08:56] Team_034 possession (Score: 10-1)
Ben Hyland drives to the basket... Ben Hyland throws a bad pass out of bounds! TURNOVER! (dead ball)

[08:37] Team_007 possession (Score: 10-1)
Tobias Johnson attempts a 3Pt. Contested by Devin Poole (4.2 feet, MAN). Tobias Johnson misses. Rebound secured by Anthony Bane.

[08:21] Team_034 possession (Score: 10-1)
Devin Poole attempts a 3Pt. Contested by Tobias Johnson (4.7 feet, MAN). Devin Poole misses. Rebound secured by Carmelo Siakam.

[08:04] Team_007 possession (Score: 10-1)
Jaren Dosunmu drives and kicks out. Bones Siakam attempts a Midrange. Contested by Cole Antetokounmpo (4.5 feet, MAN). BONES SIAKAM MAKES IT!
Score: 10-3

[07:51] Team_034 possession (Score: 10-3)
Ben Hyland attempts a 3Pt. Contested by John Quickley (3.1 feet, ZONE). Ben Hyland misses. Rebound secured by John Quickley.

[07:37] Team_007 possession (Score: 10-3)
Carmelo Siakam drives, Anthony Bane stays with him. Carmelo Siakam attempts a Dunk. Contested by Anthony Bane (5.6 feet, ZONE). CARMELO SIAKAM MAKES IT! Assist: Tobias Johnson
Score: 10-5

[07:23] Team_034 possession (Score: 10-5)
Anthony Bane attempts a Midrange. Contested by John Quickley (3.1 feet, MAN). ANTHONY BANE MAKES IT!
Score: 12-5

[07:09] Team_007 possession (Score: 12-5)
John Quickley attempts a Layup. Contested by Terry Doncic (4.7 feet, MAN). John Quickley misses. Rebound secured by Anthony Bane.

[06:58] Team_034 possession (Score: 12-5)
Cole Antetokounmpo attempts a 3Pt. Contested by Bones Siakam (4.1 feet, MAN). Cole Antetokounmpo misses. Rebound secured by John Quickley.

[06:43] Team_007 possession (Score: 12-5)
Carmelo Siakam attempts a Layup. Contested by Terry Doncic (4.5 feet, ZONE). CARMELO SIAKAM MAKES IT! Assist: Tobias Johnson
Score: 12-7

[06:26] Team_034 possession (Score: 12-7)
Terry Doncic drives and kicks out. FOUL! Shooting foul on John Quickley. Devin Poole to the line for 2 free throws. [Team fouls: 4] (John Quickley: 2 personal fouls)   FT 1/2: GOOD   FT 2/2: GOOD Devin Poole makes 2/2 from the line.
Score: 14-7

[06:11] Team_007 possession (Score: 14-7)
Carmelo Siakam drives, Anthony Bane stays with him. Carmelo Siakam attempts a Layup. Contested by Anthony Bane (5.6 feet, MAN). CARMELO SIAKAM MAKES IT!
Score: 14-9

[05:53] Team_034 possession (Score: 14-9)
Devin Poole attempts a 3Pt. Contested by John Quickley (2.9 feet, ZONE). Devin Poole misses. Rebound secured by Carmelo Siakam.

[05:41] Team_007 possession (Score: 14-9)
Jaren Dosunmu attempts a 3Pt. Contested by Ben Hyland (3.6 feet, MAN). Jaren Dosunmu misses. Rebound secured by Anthony Bane.

[05:27] Team_034 possession (Score: 14-9)
Ben Hyland attempts a 3Pt. Contested by Jaren Dosunmu (4.5 feet, MAN). Ben Hyland misses. Rebound secured by John Quickley.

[05:11] Team_007 possession (Score: 14-9)
Jaren Dosunmu drives and kicks out. Tobias Johnson attempts a Midrange. Contested by Devin Poole (3.9 feet, MAN). Tobias Johnson misses. Rebound secured by Cole Antetokounmpo.

[04:57] Team_034 possession (Score: 14-9)
Anthony Bane drives, Carmelo Siakam stays with him. Anthony Bane attempts a Layup. Contested by Carmelo Siakam (4.3 feet, ZONE). ANTHONY BANE MAKES IT! Assist: Cole Antetokounmpo
Score: 16-9

[04:39] Team_007 possession (Score: 16-9)
Bones Siakam attempts a 3Pt. Contested by Devin Poole (4.1 feet, ZONE). Bones Siakam misses. Offensive rebound by Carmelo Siakam! Carmelo Siakam's putback is no good. Rebound secured by Anthony Bane.

[04:22] Team_034 possession (Score: 16-9)
Devin Poole attempts a 3Pt. Contested by John Quickley (3.1 feet, ZONE). Devin Poole misses. Rebound secured by John Quickley.

[04:07] Team_007 possession (Score: 16-9)
John Quickley makes the Layup and draws the foul on Anthony Bane! And-1! John Quickley to the line for 1. [Team fouls: 2] (Anthony Bane: 1 personal fouls)   FT 1/1: GOOD John Quickley makes 1/1 from the line.
Score: 16-12

[03:51] Team_034 possession (Score: 16-12)
Cole Antetokounmpo attempts a Midrange. Contested by Jaren Dosunmu (4.9 feet, ZONE). Cole Antetokounmpo misses. Rebound secured by John Quickley.

[03:36] Team_007 possession (Score: 16-12)
Bones Siakam attempts a 3Pt. Contested by Cole Antetokounmpo (4.7 feet, MAN). Bones Siakam misses. Rebound secured by Cole Antetokounmpo.

[03:21] Team_034 possession (Score: 16-12)
Anthony Bane drives to the basket... Anthony Bane loses control! Ball rolls out of bounds! TURNOVER! (dead ball)

[03:06] Team_007 possession (Score: 16-12)
Tobias Johnson throws a bad pass! Stolen by Devin Poole! TURNOVER! (live ball)

[02:46] Team_034 possession (Score: 16-12)
Ben Hyland loses control! Ball rolls out of bounds! TURNOVER! (dead ball)

[02:46] Substitution (Team_034): Devin Poole OUT → Manu Jokic IN (stamina_rule2)

[02:46] Substitution (Team_007): Bones Siakam OUT → Gary LaVine IN (stamina_rule2)

[02:46] Substitution (Team_007): John Quickley OUT → Austin Simons IN (stamina_rule2)

[02:46] Substitution (Team_007): Carmelo Siakam OUT → Draymond Harris IN (stamina_rule2)

[02:34] Team_007 possession (Score: 16-12)
Draymond Harris drives to the basket... Draymond Harris loses control! Ball rolls out of bounds! TURNOVER! (dead ball)

[02:25] Team_034 possession (Score: 16-12)
Anthony Bane drives to the basket... Anthony Bane loses the ball! Stripped by Draymond Harris! TURNOVER! (live ball)

[02:10] Team_007 possession (Score: 16-12)
Tobias Johnson makes the 3Pt and draws the foul on Ben Hyland! And-1! Tobias Johnson to the line for 1. [Team fouls: 3] (Ben Hyland: 1 personal fouls)   FT 1/1: GOOD Tobias Johnson makes 1/1 from the line.
Score: 16-16

[01:59] Team_034 possession (Score: 16-16)
Manu Jokic attempts a 3Pt. Contested by Jaren Dosunmu (4.7 feet, ZONE). MANU JOKIC MAKES IT! Assist: Terry Doncic
Score: 19-16

[01:42] Team_007 possession (Score: 19-16)
FOUL! Shooting foul on Ben Hyland. Gary LaVine to the line for 2 free throws. [Team fouls: 4] (Ben Hyland: 2 personal fouls)   FT 1/2: GOOD   FT 2/2: MISS Gary LaVine makes 1/2 from the line. Rebound secured by Cole Antetokounmpo.
Score: 19-17

[01:26] Team_034 possession (Score: 19-17)
Anthony Bane attempts a Layup. Contested by Austin Simons (3.8 feet, ZONE). ANTHONY BANE MAKES IT! Assist: Cole Antetokounmpo
Score: 21-17

[01:12] Team_007 possession (Score: 21-17)
FOUL! Holding foul on Manu Jokic. [IN THE BONUS! 5 team fouls] Tobias Johnson to the line for 2 free throws. (Manu Jokic: 1 personal fouls)   FT 1/2: GOOD   FT 2/2: GOOD Tobias Johnson makes 2/2 from the line.
Score: 21-19

[00:59] Team_034 possession (Score: 21-19)
Ben Hyland drives, picks up Jaren Dosunmu. Help arrives from Gary LaVine! Ben Hyland attempts a Layup. Contested by Gary LaVine (4.8 feet, MAN). BEN HYLAND MAKES IT!
Score: 23-19

[00:45] Team_007 possession (Score: 23-19)
Draymond Harris throws a bad pass! Stolen by Anthony Bane! TURNOVER! (live ball)

[00:34] Team_034 possession (Score: 23-19)
Cole Antetokounmpo drives and kicks out. Terry Doncic attempts a 3Pt. Contested by Jaren Dosunmu (4.8 feet, ZONE). TERRY DONCIC MAKES IT! Assist: Anthony Bane
Score: 26-19

[00:20] Team_007 possession (Score: 26-19)
Tobias Johnson drives and kicks out. Gary LaVine attempts a 3Pt. Contested by Ben Hyland (4.1 feet, ZONE). Gary LaVine misses. Offensive rebound by Austin Simons! Austin Simons's putback is no good. Rebound secured by Cole Antetokounmpo.

[00:08] Team_034 possession (Score: 26-19)
Manu Jokic drives, picks up Tobias Johnson. Help arrives from Gary LaVine! Manu Jokic attempts a Dunk. Contested by Gary LaVine (5.3 feet, MAN). MANU JOKIC MAKES IT! Assist: Anthony Bane
Score: 28-19

================================================================================
                              1ST QUARTER COMPLETE                              
================================================================================

1ST QUARTER SCORE: Team_034 28, Team_007 19

BOX SCORE:
================================================================================

Team_034
--------------------------------------------------------------------------------
Player                MIN  PTS  REB  AST  TO      FG   FG%      3P   3P%
--------------------------------------------------------------------------------
Terry Doncic           12   10    4    1   0   4/5    80.0     0/0   0.0
Anthony Bane           12    6    6    2   0   3/3   100.0     0/0   0.0
Ben Hyland             12    5    0    1   0   2/4    50.0     0/0   0.0
Manu Jokic              3    5    0    0   0   2/2   100.0     0/0   0.0
Devin Poole             9    2    0    0   0   1/4    25.0     0/0   0.0

TEAM: FG: 12/20 (60.0%), 3PT: 3/9 (33.3%), REB: 13 (2 off, 11 def), AST: 6, TO: 5
TEAM FOULS: 5 [Team_007 in BONUS]


Team_007
--------------------------------------------------------------------------------
Player                MIN  PTS  REB  AST  TO      FG   FG%      3P   3P%
--------------------------------------------------------------------------------
Tobias Johnson         12    7    0    2   0   3/5    60.0     0/0   0.0
Carmelo Siakam          9    6    2    0   0   3/3   100.0     0/0   0.0
John Quickley           9    3    5    0   0   1/2    50.0     0/0   0.0
Bones Siakam            9    2    1    0   0   1/4    25.0     0/0   0.0
Jaren Dosunmu          12    0    0    0   0   0/6     0.0     0/0   0.0
Cole Antetokounmpo     12    0    5    2   0   0/2     0.0     0/0   0.0
Gary LaVine             3    0    0    0   0   0/1     0.0     0/0   0.0

TEAM: FG: 8/21 (38.1%), 3PT: 1/8 (12.5%), REB: 10 (2 off, 8 def), AST: 2, TO: 3
TEAM FOULS: 4

================================================================================

================================================================================
                       2ND QUARTER - Team_034 vs Team_007                       
================================================================================

[12:00] Team_034 possession (Score: 28-19)
Ben Hyland attempts a 3Pt. Contested by John Quickley (3.1 feet, ZONE). Ben Hyland misses. Rebound secured by John Quickley.

[11:47] Team_007 possession (Score: 28-19)
Bones Siakam attempts a Midrange. Contested by Cole Antetokounmpo (5.0 feet, MAN). BONES SIAKAM MAKES IT! Assist: Tobias Johnson
Score: 28-21

[11:34] Team_034 possession (Score: 28-21)
Devin Poole attempts a 3Pt. Contested by John Quickley (3.0 feet, ZONE). Devin Poole misses. Rebound secured by Carmelo Siakam.

[11:24] Team_007 possession (Score: 28-21)
Bones Siakam attempts a Midrange. Contested by Ben Hyland (4.1 feet, ZONE). Bones Siakam misses. Rebound secured by Terry Doncic.

[11:11] Team_034 possession (Score: 28-21)
Devin Poole attempts a 3Pt. Contested by John Quickley (3.0 feet, ZONE). DEVIN POOLE MAKES IT! Assist: Cole Antetokounmpo
Score: 31-21

[10:57] Team_007 possession (Score: 31-21)
Carmelo Siakam attempts a Layup. Contested by Anthony Bane (6.0 feet, MAN). Carmelo Siakam misses. Rebound secured by Terry Doncic.

[10:43] Team_034 possession (Score: 31-21)
Devin Poole attempts a 3Pt. Contested by John Quickley (3.1 feet, ZONE). DEVIN POOLE MAKES IT! Assist: Anthony Bane
Score: 34-21

[10:27] Team_007 possession (Score: 34-21)
Jaren Dosunmu drives, picks up Ben Hyland. Help arrives from Cole Antetokounmpo! Jaren Dosunmu attempts a Layup. Contested by Cole Antetokounmpo (4.1 feet, MAN). JAREN DOSUNMU MAKES IT!
Score: 34-23

[10:16] Team_034 possession (Score: 34-23)
Terry Doncic attempts a Layup. Contested by John Quickley (3.2 feet, MAN). TERRY DONCIC MAKES IT! Assist: Cole Antetokounmpo
Score: 36-23

[10:04] Team_007 possession (Score: 36-23)
Tobias Johnson attempts a 3Pt. Contested by Devin Poole (4.4 feet, MAN). Tobias Johnson misses. Offensive rebound by Bones Siakam! Bones Siakam kicks it out.

[09:49] Team_007 possession (Score: 36-23)
Bones Siakam attempts a 3Pt. Contested by Devin Poole (4.2 feet, ZONE). Bones Siakam misses. Rebound secured by Anthony Bane.

[09:35] Team_034 possession (Score: 36-23)
Ben Hyland drives, picks up John Quickley. Help arrives from Jaren Dosunmu! Ben Hyland attempts a Layup. Contested by Jaren Dosunmu (3.3 feet, ZONE). BEN HYLAND MAKES IT! Assist: Devin Poole
Score: 38-23

[09:19] Team_007 possession (Score: 38-23)
Tobias Johnson attempts a 3Pt. Contested by Devin Poole (4.4 feet, MAN). Tobias Johnson misses. Offensive rebound by Carmelo Siakam! Carmelo Siakam puts it back in!
Score: 38-25

[09:04] Team_034 possession (Score: 38-25)
Anthony Bane drives and kicks out. FOUL! Shooting foul on John Quickley. Terry Doncic to the line for 3 free throws. [Team fouls: 1] (John Quickley: 1 personal fouls)   FT 1/3: GOOD   FT 2/3: GOOD   FT 3/3: GOOD Terry Doncic makes 3/3 from the line.
Score: 41-25

[08:47] Team_007 possession (Score: 41-25)
Carmelo Siakam attempts a Midrange. Contested by Cole Antetokounmpo (5.6 feet, ZONE). Carmelo Siakam misses. Rebound secured by Anthony Bane.

[08:32] Team_034 possession (Score: 41-25)
Terry Doncic attempts a Layup. BLOCKED BY JOHN QUICKLEY! Ball is loose! Rebound secured by Bones Siakam.

[08:13] Team_007 possession (Score: 41-25)
John Quickley attempts a 3Pt. Contested by Devin Poole (4.9 feet, ZONE). John Quickley misses. Rebound secured by Anthony Bane.

[07:57] Team_034 possession (Score: 41-25)
Ben Hyland attempts a Layup. BLOCKED BY JOHN QUICKLEY! Ball is loose! Rebound secured by Carmelo Siakam.

[07:45] Team_007 possession (Score: 41-25)
Bones Siakam attempts a 3Pt. Contested by Devin Poole (4.5 feet, ZONE). Bones Siakam misses. Rebound secured by Cole Antetokounmpo.

[07:34] Team_034 possession (Score: 41-25)
Devin Poole attempts a 3Pt. Contested by John Quickley (3.5 feet, ZONE). Devin Poole misses. Rebound secured by John Quickley.

[07:23] Team_007 possession (Score: 41-25)
Bones Siakam attempts a Layup. Wide open! Anthony Bane is 6.0 feet away. [ZONE] Bones Siakam misses. Offensive rebound by Bones Siakam! Bones Siakam kicks it out.

[07:10] Team_007 possession (Score: 41-25)
John Quickley attempts a Layup. Wide open! Anthony Bane is 6.6 feet away. [ZONE] JOHN QUICKLEY MAKES IT! Assist: Bones Siakam
Score: 41-27

[06:56] Team_034 possession (Score: 41-27)
Ben Hyland attempts a Midrange. Contested by Jaren Dosunmu (5.2 feet, MAN). BEN HYLAND MAKES IT! Assist: Devin Poole
Score: 43-27

[06:43] Team_007 possession (Score: 43-27)
Carmelo Siakam commits a violation (traveling/carry)! TURNOVER! (dead ball)

[06:43] Substitution (Team_034): Devin Poole OUT → Manu Jokic IN (stamina_rule2)

[06:43] Substitution (Team_034): Ben Hyland OUT → Damian Turner IN (stamina_rule2)

[06:43] Substitution (Team_034): Cole Antetokounmpo OUT → Vince Paul IN (stamina_rule2)

[06:43] Substitution (Team_034): Terry Doncic OUT → Nikola Wagner IN (stamina_rule2)

[06:43] Substitution (Team_034): Anthony Bane OUT → Carmelo Anunoby IN (stamina_rule2)

[06:43] Substitution (Team_007): Tobias Johnson OUT → Wendell Poole IN (stamina_rule2)

[06:43] Substitution (Team_007): Jaren Dosunmu OUT → OG Porzingis IN (stamina_rule2)

[06:43] Substitution (Team_007): Bones Siakam OUT → Gary LaVine IN (stamina_rule2)

[06:43] Substitution (Team_007): John Quickley OUT → Austin Simons IN (stamina_rule2)

[06:43] Substitution (Team_007): Carmelo Siakam OUT → Draymond Harris IN (stamina_rule2)

[06:26] Team_034 possession (Score: 43-27)
Vince Paul drives and kicks out. Manu Jokic attempts a Midrange. Contested by Austin Simons (3.8 feet, ZONE). Manu Jokic misses. Rebound secured by Gary LaVine.

[06:09] Team_007 possession (Score: 43-27)
Draymond Harris attempts a Layup. BLOCKED BY DAMIAN TURNER! Ball is loose! Rebound secured by Nikola Wagner.

[05:51] Team_034 possession (Score: 43-27)
Damian Turner drives, picks up OG Porzingis. Help arrives from Gary LaVine! Damian Turner attempts a Layup. Contested by Gary LaVine (4.7 feet, MAN). Damian Turner misses. Rebound secured by Austin Simons.

[05:38] Team_007 possession (Score: 43-27)
Austin Simons drives and kicks out. Draymond Harris attempts a 3Pt. Contested by Vince Paul (4.2 feet, ZONE). Draymond Harris misses. Offensive rebound by Austin Simons! Austin Simons puts it back in!
Score: 43-29

[05:19] Team_034 possession (Score: 43-29)
Damian Turner attempts a Midrange. Contested by Wendell Poole (5.6 feet, ZONE). Damian Turner misses. Offensive rebound by Carmelo Anunoby! Carmelo Anunoby kicks it out.

[05:01] Team_034 possession (Score: 43-29)
Manu Jokic drives, picks up Austin Simons. Help arrives from OG Porzingis! Manu Jokic attempts a Layup. Contested by OG Porzingis (3.9 feet, ZONE). MANU JOKIC MAKES IT!
Score: 45-29

[04:48] Team_007 possession (Score: 45-29)
Draymond Harris drives, picks up Carmelo Anunoby. Help arrives from Damian Turner! Draymond Harris attempts a Layup. Contested by Damian Turner (5.4 feet, ZONE). DRAYMOND HARRIS MAKES IT!
Score: 45-31

[04:35] Team_034 possession (Score: 45-31)
Nikola Wagner attempts a 3Pt. Contested by Austin Simons (3.9 feet, MAN). Nikola Wagner misses. FOUL! Loose ball foul on Austin Simons during the rebound battle. [Team fouls: 2] No free throws, side out. (Austin Simons: 1 personal fouls)

[04:19] Team_034 possession (Score: 45-31)
Manu Jokic attempts a Midrange. Contested by OG Porzingis (4.3 feet, ZONE). Manu Jokic misses. Rebound secured by Austin Simons.

[04:08] Team_007 possession (Score: 45-31)
Austin Simons attempts a Midrange. Contested by Vince Paul (4.6 feet, ZONE). AUSTIN SIMONS MAKES IT! Assist: Wendell Poole
Score: 45-33

[03:52] Team_034 possession (Score: 45-33)
FOUL! Reach-in foul on Wendell Poole during the drive. [Team fouls: 3] No free throws, side out. (Wendell Poole: 1 personal fouls)

[03:39] Team_034 possession (Score: 45-33)
Vince Paul attempts a 3Pt. Contested by OG Porzingis (4.7 feet, ZONE). VINCE PAUL MAKES IT! Assist: Manu Jokic
Score: 48-33

[03:25] Team_007 possession (Score: 48-33)
Wendell Poole attempts a 3Pt. Contested by Vince Paul (4.5 feet, ZONE). Wendell Poole misses. Offensive rebound by Austin Simons! Austin Simons's putback is no good. Rebound secured by Vince Paul.

[03:09] Team_034 possession (Score: 48-33)
Manu Jokic attempts a 3Pt. Contested by Wendell Poole (5.3 feet, MAN). Manu Jokic misses. Rebound secured by Austin Simons.

[02:50] Team_007 possession (Score: 48-33)
Gary LaVine drives, Vince Paul stays with him. Gary LaVine attempts a Layup. Contested by Vince Paul (4.3 feet, MAN). Gary LaVine misses. FOUL! Loose ball foul on Vince Paul during the rebound battle. [Team fouls: 1] No free throws, side out. (Vince Paul: 1 personal fouls)

[02:36] Team_007 possession (Score: 48-33)
OG Porzingis attempts a Layup. BLOCKED BY DAMIAN TURNER! Ball is loose! Rebound secured by Carmelo Anunoby.

[02:25] Team_034 possession (Score: 48-33)
Nikola Wagner attempts a 3Pt. Contested by OG Porzingis (4.4 feet, ZONE). Nikola Wagner misses. Rebound secured by Draymond Harris.

[02:11] Team_007 possession (Score: 48-33)
Austin Simons drives, picks up Carmelo Anunoby. Help arrives from Damian Turner! Austin Simons attempts a Layup. Contested by Damian Turner (5.8 feet, ZONE). Austin Simons misses. Rebound secured by Carmelo Anunoby.

[01:58] Team_034 possession (Score: 48-33)
Vince Paul attempts a 3Pt. Contested by OG Porzingis (4.7 feet, ZONE). Vince Paul misses. Rebound secured by Gary LaVine.

[01:40] Team_007 possession (Score: 48-33)
Gary LaVine makes the Layup and draws the foul on Carmelo Anunoby! And-1! Gary LaVine to the line for 1. [Team fouls: 2] (Carmelo Anunoby: 1 personal fouls)   FT 1/1: GOOD Gary LaVine makes 1/1 from the line.
Score: 48-36

[01:29] Team_034 possession (Score: 48-36)
FOUL! Shooting foul on Austin Simons. Carmelo Anunoby to the line for 2 free throws. [Team fouls: 4] (Austin Simons: 2 personal fouls)   FT 1/2: MISS   FT 2/2: GOOD Carmelo Anunoby makes 1/2 from the line.
Score: 49-36

[01:16] Team_007 possession (Score: 49-36)
Gary LaVine attempts a 3Pt. Contested by Vince Paul (4.3 feet, ZONE). Gary LaVine misses. Rebound secured by Vince Paul.

[01:04] Team_034 possession (Score: 49-36)
Damian Turner drives to the basket... Damian Turner commits a violation (traveling/carry)! TURNOVER! (dead ball)

[00:51] Team_007 possession (Score: 49-36)
Gary LaVine drives, Carmelo Anunoby stays with him. Gary LaVine attempts a Layup. Contested by Carmelo Anunoby (5.6 feet, ZONE). GARY LAVINE MAKES IT! Assist: Wendell Poole
Score: 49-38

[00:39] Team_034 possession (Score: 49-38)
Manu Jokic attempts a Midrange. BLOCKED BY WENDELL POOLE! Ball goes out off Wendell Poole. Manu Jokic's ball!

[00:26] Team_034 possession (Score: 49-38)
Damian Turner attempts a 3Pt. Contested by OG Porzingis (4.7 feet, MAN). DAMIAN TURNER MAKES IT! Assist: Manu Jokic
Score: 52-38

[00:09] Team_007 possession (Score: 52-38)
Draymond Harris drives to the basket... FOUL! Offensive foul on Draymond Harris! Carmelo Anunoby drew the charge! [Team fouls: 5] (Draymond Harris: 1 personal fouls) TURNOVER! (dead ball)

================================================================================
                              2ND QUARTER COMPLETE                              
================================================================================

2ND QUARTER SCORE: Team_034 24, Team_007 19

BOX SCORE:
================================================================================

Team_034
--------------------------------------------------------------------------------
Player                MIN  PTS  REB  AST  TO      FG   FG%      3P   3P%
--------------------------------------------------------------------------------
Devin Poole            15    6    0    2   0   2/4    50.0     0/0   0.0
Terry Doncic           18    5    2    0   0   2/3    66.7     0/0   0.0
Ben Hyland             18    4    0    0   0   2/4    50.0     0/0   0.0
Vince Paul              7    3    3    0   0   1/3    33.3     0/0   0.0
Damian Turner           7    3    0    0   0   1/2    50.0     0/0   0.0
Manu Jokic              9    2    0    2   0   1/3    33.3     0/0   0.0
Carmelo Anunoby         7    1    3    0   0   1/1   100.0     0/0   0.0
Cole Antetokounmpo     18    0    1    2   0   0/0     0.0     0/0   0.0
Anthony Bane           18    0    3    1   0   0/0     0.0     0/0   0.0
Nikola Wagner           7    0    1    0   0   0/1     0.0     0/0   0.0

TEAM: FG: 10/21 (47.6%), 3PT: 4/10 (40.0%), REB: 12 (2 off, 10 def), AST: 7, TO: 1
TEAM FOULS: 2


Team_007
--------------------------------------------------------------------------------
Player                MIN  PTS  REB  AST  TO      FG   FG%      3P   3P%
--------------------------------------------------------------------------------
Gary LaVine             9    5    2    0   0   2/3    66.7     0/0   0.0
Austin Simons           9    4    4    0   0   2/3    66.7     0/0   0.0
John Quickley          15    2    2    0   0   1/2    50.0     0/0   0.0
Bones Siakam           15    2    3    1   0   1/4    25.0     0/0   0.0
Carmelo Siakam         15    2    3    0   0   1/3    33.3     0/0   0.0
Jaren Dosunmu          18    2    0    0   0   1/1   100.0     0/0   0.0
Draymond Harris         9    2    2    0   0   1/2    50.0     0/0   0.0
Tobias Johnson         18    0    0    1   0   0/0     0.0     0/0   0.0
Wendell Poole           7    0    0    2   0   0/1     0.0     0/0   0.0
OG Porzingis            7    0    0    0   0   0/1     0.0     0/0   0.0

TEAM: FG: 9/20 (45.0%), 3PT: 1/6 (16.7%), REB: 17 (6 off, 11 def), AST: 4, TO: 2
TEAM FOULS: 5 [Team_034 in BONUS]

================================================================================

================================================================================
                       3RD QUARTER - Team_034 vs Team_007                       
================================================================================

[12:00] Team_034 possession (Score: 52-38)
Ben Hyland drives, John Quickley stays with him. Ben Hyland attempts a Layup. Contested by John Quickley (3.1 feet, ZONE). BEN HYLAND MAKES IT! Assist: Devin Poole
Score: 54-38

[11:48] Team_007 possession (Score: 54-38)
FOUL! Shooting foul on Anthony Bane. Carmelo Siakam to the line for 2 free throws. [Team fouls: 1] (Anthony Bane: 1 personal fouls)   FT 1/2: GOOD   FT 2/2: GOOD Carmelo Siakam makes 2/2 from the line.
Score: 54-40

[11:36] Team_034 possession (Score: 54-40)
Ben Hyland attempts a Midrange. Contested by Carmelo Siakam (4.2 feet, ZONE). Ben Hyland misses. Rebound secured by Bones Siakam.

[11:17] Team_007 possession (Score: 54-40)
FOUL! Reach-in foul on Terry Doncic during the drive. [Team fouls: 2] No free throws, side out. (Terry Doncic: 1 personal fouls)

[11:04] Team_007 possession (Score: 54-40)
Carmelo Siakam drives, picks up Terry Doncic. Help arrives from Ben Hyland! Carmelo Siakam attempts a Layup. Contested by Ben Hyland (4.5 feet, ZONE). CARMELO SIAKAM MAKES IT! Assist: Bones Siakam
Score: 54-42

[10:50] Team_034 possession (Score: 54-42)
Anthony Bane attempts a Layup. BLOCKED BY JOHN QUICKLEY! Ball is loose! Rebound secured by Carmelo Siakam.

[10:35] Team_007 possession (Score: 54-42)
FOUL! Shooting foul on Anthony Bane. Carmelo Siakam to the line for 2 free throws. [Team fouls: 3] (Anthony Bane: 2 personal fouls)   FT 1/2: GOOD   FT 2/2: GOOD Carmelo Siakam makes 2/2 from the line.
Score: 54-44

[10:17] Team_034 possession (Score: 54-44)
Terry Doncic attempts a Midrange. Contested by John Quickley (3.1 feet, MAN). Terry Doncic misses. Rebound secured by Bones Siakam.

[10:02] Team_007 possession (Score: 54-44)
Carmelo Siakam drives, Anthony Bane stays with him. Carmelo Siakam attempts a Dunk. Contested by Anthony Bane (5.6 feet, MAN). CARMELO SIAKAM MAKES IT! Assist: Tobias Johnson
Score: 54-46

[09:50] Team_034 possession (Score: 54-46)
Anthony Bane attempts a Layup. Contested by John Quickley (3.1 feet, ZONE). ANTHONY BANE MAKES IT! Assist: Ben Hyland
Score: 56-46

[09:38] Team_007 possession (Score: 56-46)
Tobias Johnson drives, Devin Poole stays with him. Tobias Johnson attempts a Dunk. Contested by Devin Poole (4.2 feet, MAN). TOBIAS JOHNSON MAKES IT! Assist: Bones Siakam
Score: 56-48

[09:24] Team_034 possession (Score: 56-48)
Ben Hyland attempts a 3Pt. Contested by Jaren Dosunmu (4.5 feet, MAN). Ben Hyland misses. Rebound secured by Bones Siakam.

[09:05] Team_007 possession (Score: 56-48)
Carmelo Siakam drives and kicks out. Carmelo Siakam attempts a 3Pt. Contested by Devin Poole (3.9 feet, ZONE). CARMELO SIAKAM MAKES IT! Assist: John Quickley
Score: 56-51

[08:48] Team_034 possession (Score: 56-51)
Devin Poole makes the Dunk and draws the foul on Tobias Johnson! And-1! Devin Poole to the line for 1. [Team fouls: 1] (Tobias Johnson: 1 personal fouls)   FT 1/1: GOOD Devin Poole makes 1/1 from the line.
Score: 59-51

[08:35] Team_007 possession (Score: 59-51)
Carmelo Siakam drives and kicks out. Bones Siakam attempts a 3Pt. Contested by Devin Poole (3.9 feet, ZONE). Bones Siakam misses. Rebound secured by Cole Antetokounmpo.

[08:21] Team_034 possession (Score: 59-51)
Anthony Bane drives and kicks out. Anthony Bane attempts a 3Pt. Contested by John Quickley (3.0 feet, ZONE). ANTHONY BANE MAKES IT! Assist: Cole Antetokounmpo
Score: 62-51

[08:07] Team_007 possession (Score: 62-51)
John Quickley attempts a Midrange. Contested by Terry Doncic (4.7 feet, MAN). JOHN QUICKLEY MAKES IT! Assist: Carmelo Siakam
Score: 62-53

[07:55] Team_034 possession (Score: 62-53)
Anthony Bane drives and kicks out. Anthony Bane attempts a 3Pt. Contested by John Quickley (3.0 feet, MAN). Anthony Bane misses. Rebound secured by John Quickley.

[07:38] Team_007 possession (Score: 62-53)
John Quickley attempts a 3Pt. Contested by Terry Doncic (4.7 feet, MAN). John Quickley misses. Rebound secured by Terry Doncic.

[07:23] Team_034 possession (Score: 62-53)
Cole Antetokounmpo attempts a Midrange. Contested by Bones Siakam (4.1 feet, MAN). COLE ANTETOKOUNMPO MAKES IT! Assist: Anthony Bane
Score: 64-53

[07:05] Team_007 possession (Score: 64-53)
Tobias Johnson drives and kicks out. John Quickley attempts a 3Pt. Contested by Devin Poole (3.9 feet, ZONE). John Quickley misses. Rebound secured by Anthony Bane.

[06:46] Team_034 possession (Score: 64-53)
Cole Antetokounmpo attempts a Midrange. Contested by Bones Siakam (4.1 feet, MAN). Cole Antetokounmpo misses. Offensive rebound by Terry Doncic! Terry Doncic's putback is no good. Offensive rebound by Anthony Bane! Anthony Bane kicks it out.

[06:31] Team_034 possession (Score: 64-53)
Cole Antetokounmpo attempts a 3Pt. Contested by Bones Siakam (4.1 feet, MAN). Cole Antetokounmpo misses. Rebound secured by John Quickley.

[06:19] Team_007 possession (Score: 64-53)
John Quickley drives to the basket... FOUL! Offensive foul on John Quickley! Terry Doncic drew the charge! [Team fouls: 3] (John Quickley: 2 personal fouls) TURNOVER! (dead ball)

[06:04] Team_034 possession (Score: 64-53)
Ben Hyland attempts a Midrange. Contested by John Quickley (3.1 feet, ZONE). Ben Hyland misses. Rebound secured by Carmelo Siakam.

[05:51] Team_007 possession (Score: 64-53)
John Quickley attempts a 3Pt. Contested by Devin Poole (4.6 feet, ZONE). John Quickley misses. Rebound secured by Cole Antetokounmpo.

[05:35] Team_034 possession (Score: 64-53)
Terry Doncic drives, picks up John Quickley. Help arrives from Jaren Dosunmu! Terry Doncic attempts a Layup. Contested by Jaren Dosunmu (3.1 feet, MAN). TERRY DONCIC MAKES IT! Assist: Anthony Bane
Score: 66-53

[05:21] Team_007 possession (Score: 66-53)
Bones Siakam attempts a 3Pt. Contested by Cole Antetokounmpo (4.6 feet, MAN). Bones Siakam misses. Rebound secured by Terry Doncic.

[05:04] Team_034 possession (Score: 66-53)
Terry Doncic throws a bad pass! Stolen by John Quickley! TURNOVER! (live ball)

[04:55] Team_007 possession (Score: 66-53)
Tobias Johnson attempts a Midrange. Contested by Devin Poole (4.3 feet, MAN). Tobias Johnson misses. Offensive rebound by Bones Siakam! Bones Siakam's putback is no good. Rebound secured by Cole Antetokounmpo.

[04:41] Team_034 possession (Score: 66-53)
Cole Antetokounmpo attempts a 3Pt. Contested by John Quickley (3.6 feet, ZONE). COLE ANTETOKOUNMPO MAKES IT! Assist: Terry Doncic
Score: 69-53

[04:25] Team_007 possession (Score: 69-53)
Carmelo Siakam drives, picks up Terry Doncic. Help arrives from Ben Hyland! Carmelo Siakam attempts a Dunk. Contested by Ben Hyland (4.5 feet, ZONE). CARMELO SIAKAM MAKES IT! Assist: Bones Siakam
Score: 69-55

[04:10] Team_034 possession (Score: 69-55)
Ben Hyland makes the Layup and draws the foul on John Quickley! And-1! Ben Hyland to the line for 1. [Team fouls: 4] (John Quickley: 3 personal fouls)   FT 1/1: GOOD Ben Hyland makes 1/1 from the line.
Score: 72-55

[03:55] Team_007 possession (Score: 72-55)
Jaren Dosunmu attempts a 3Pt. Contested by Devin Poole (4.1 feet, ZONE). Jaren Dosunmu misses. Rebound secured by Terry Doncic.

[03:38] Team_034 possession (Score: 72-55)
Terry Doncic drives and kicks out. Anthony Bane attempts a 3Pt. Contested by John Quickley (3.2 feet, MAN). Anthony Bane misses. Rebound secured by John Quickley.

[03:25] Team_007 possession (Score: 72-55)
FOUL! Reach-in foul on Ben Hyland during the drive. [Team fouls: 4] No free throws, side out. (Ben Hyland: 1 personal fouls)

[03:06] Team_007 possession (Score: 72-55)
FOUL! Holding foul on Terry Doncic. [IN THE BONUS! 5 team fouls] John Quickley to the line for 2 free throws. (Terry Doncic: 2 personal fouls)   FT 1/2: GOOD   FT 2/2: GOOD John Quickley makes 2/2 from the line.
Score: 72-57

[02:49] Team_034 possession (Score: 72-57)
Ben Hyland attempts a 3Pt. Contested by John Quickley (3.4 feet, ZONE). Ben Hyland misses. Offensive rebound by Anthony Bane! Anthony Bane kicks it out.

[02:29] Team_034 possession (Score: 72-57)
Devin Poole attempts a Layup. BLOCKED BY JOHN QUICKLEY! Ball is loose! Rebound secured by John Quickley.

[02:16] Team_007 possession (Score: 72-57)
Jaren Dosunmu attempts a Midrange. Contested by Cole Antetokounmpo (4.7 feet, ZONE). JAREN DOSUNMU MAKES IT!
Score: 72-59

[02:03] Team_034 possession (Score: 72-59)
Cole Antetokounmpo attempts a Layup. BLOCKED BY JOHN QUICKLEY! Ball deflects out of bounds off Cole Antetokounmpo.

[01:49] Team_007 possession (Score: 72-59)
Bones Siakam drives, picks up Terry Doncic. Help arrives from Ben Hyland! Bones Siakam attempts a Layup. Contested by Ben Hyland (4.4 feet, ZONE). BONES SIAKAM MAKES IT! Assist: Jaren Dosunmu
Score: 72-61

[01:34] Team_034 possession (Score: 72-61)
Anthony Bane drives to the basket... FOUL! Offensive foul on Anthony Bane! John Quickley drew the charge! [Team fouls: 6] (Anthony Bane: 3 personal fouls) TURNOVER! (dead ball)

[01:17] Team_007 possession (Score: 72-61)
Tobias Johnson drives, picks up Terry Doncic. Help arrives from Ben Hyland! Tobias Johnson attempts a Dunk. Contested by Ben Hyland (4.7 feet, ZONE). Tobias Johnson misses. Rebound secured by Anthony Bane.

[00:59] Team_034 possession (Score: 72-61)
Ben Hyland attempts a 3Pt. Contested by John Quickley (3.6 feet, ZONE). Ben Hyland misses. Offensive rebound by Terry Doncic! Terry Doncic's putback is no good. Offensive rebound by Terry Doncic! Terry Doncic kicks it out.

[00:43] Team_034 possession (Score: 72-61)
Ben Hyland attempts a Layup. BLOCKED BY JAREN DOSUNMU! Ball goes out off Jaren Dosunmu. Ben Hyland's ball!

[00:30] Team_034 possession (Score: 72-61)
Terry Doncic drives, John Quickley stays with him. Terry Doncic attempts a Layup. Contested by John Quickley (3.7 feet, MAN). Terry Doncic misses. Offensive rebound by Anthony Bane! Anthony Bane kicks it out.

[00:12] Team_034 possession (Score: 72-61)
Cole Antetokounmpo drives to the basket... Cole Antetokounmpo loses control! Ball rolls out of bounds! TURNOVER! (dead ball)

[00:12] Substitution (Team_034): Devin Poole OUT → Manu Jokic IN (stamina_rule2)

[00:12] Substitution (Team_034): Ben Hyland OUT → Damian Turner IN (stamina_rule2)

[00:12] Substitution (Team_034): Cole Antetokounmpo OUT → Vince Paul IN (stamina_rule2)

[00:12] Substitution (Team_034): Terry Doncic OUT → Nikola Wagner IN (stamina_rule2)

[00:12] Substitution (Team_034): Anthony Bane OUT → Carmelo Anunoby IN (stamina_rule2)

[00:12] Substitution (Team_007): Tobias Johnson OUT → Wendell Poole IN (stamina_rule2)

[00:12] Substitution (Team_007): Jaren Dosunmu OUT → OG Porzingis IN (stamina_rule2)

[00:12] Substitution (Team_007): Bones Siakam OUT → Gary LaVine IN (stamina_rule2)

[00:12] Substitution (Team_007): John Quickley OUT → Austin Simons IN (stamina_rule2)

[00:12] Substitution (Team_007): Carmelo Siakam OUT → Draymond Harris IN (stamina_rule2)

================================================================================
                              3RD QUARTER COMPLETE                              
================================================================================

3RD QUARTER SCORE: Team_034 20, Team_007 23

BOX SCORE:
================================================================================

Team_034
--------------------------------------------------------------------------------
Player                MIN  PTS  REB  AST  TO      FG   FG%      3P   3P%
--------------------------------------------------------------------------------
Ben Hyland             30    5    0    1   0   2/5    40.0     0/0   0.0
Anthony Bane           30    5    5    2   0   2/4    50.0     0/0   0.0
Cole Antetokounmpo     30    5    3    1   0   2/4    50.0     0/0   0.0
Devin Poole            27    3    0    1   0   1/2    50.0     0/0   0.0
Terry Doncic           30    2    4    1   0   1/3    33.3     0/0   0.0

TEAM: FG: 8/18 (44.4%), 3PT: 1/3 (33.3%), REB: 11 (4 off, 7 def), AST: 6, TO: 3
TEAM FOULS: 6 [Team_007 in BONUS]


Team_007
--------------------------------------------------------------------------------
Player                MIN  PTS  REB  AST  TO      FG   FG%      3P   3P%
--------------------------------------------------------------------------------
Carmelo Siakam         27   13    2    1   0   6/7    85.7     0/0   0.0
John Quickley          27    4    4    1   0   2/4    50.0     0/0   0.0
Bones Siakam           27    2    3    3   0   1/2    50.0     0/0   0.0
Tobias Johnson         30    2    0    1   0   1/4    25.0     0/0   0.0
Jaren Dosunmu          30    2    0    1   0   1/2    50.0     0/0   0.0

TEAM: FG: 11/19 (57.9%), 3PT: 0/4 (0.0%), REB: 10 (1 off, 9 def), AST: 7, TO: 1
TEAM FOULS: 4

================================================================================

================================================================================
                       4TH QUARTER - Team_034 vs Team_007                       
================================================================================

[12:00] Team_034 possession (Score: 72-61)
Anthony Bane drives, John Quickley stays with him. Anthony Bane attempts a Layup. Contested by John Quickley (3.5 feet, MAN). Anthony Bane misses. Rebound secured by Bones Siakam.

[11:48] Team_007 possession (Score: 72-61)
Jaren Dosunmu drives and kicks out. FOUL! Shooting foul on Ben Hyland. Jaren Dosunmu to the line for 2 free throws. [Team fouls: 1] (Ben Hyland: 1 personal fouls)   FT 1/2: GOOD   FT 2/2: GOOD Jaren Dosunmu makes 2/2 from the line.
Score: 72-63

[11:35] Team_034 possession (Score: 72-63)
Cole Antetokounmpo drives to the basket... Cole Antetokounmpo throws a bad pass out of bounds! TURNOVER! (dead ball)

[11:35] Substitution (Team_034): Devin Poole OUT → Manu Jokic IN (stamina_rule2)

[11:35] Substitution (Team_034): Ben Hyland OUT → Damian Turner IN (stamina_rule2)

[11:35] Substitution (Team_034): Cole Antetokounmpo OUT → Vince Paul IN (stamina_rule2)

[11:35] Substitution (Team_034): Terry Doncic OUT → Nikola Wagner IN (stamina_rule2)

[11:35] Substitution (Team_034): Anthony Bane OUT → Carmelo Anunoby IN (stamina_rule2)

[11:35] Substitution (Team_007): Tobias Johnson OUT → Wendell Poole IN (stamina_rule2)

[11:35] Substitution (Team_007): Bones Siakam OUT → Gary LaVine IN (stamina_rule2)

[11:35] Substitution (Team_007): John Quickley OUT → Austin Simons IN (stamina_rule2)

[11:35] Substitution (Team_007): Carmelo Siakam OUT → Draymond Harris IN (stamina_rule2)

[11:25] Team_007 possession (Score: 72-63)
Draymond Harris attempts a Layup. BLOCKED BY DAMIAN TURNER! Ball is loose! Rebound secured by Carmelo Anunoby.

[11:10] Team_034 possession (Score: 72-63)
FOUL! Shooting foul on Austin Simons. Nikola Wagner to the line for 2 free throws. [Team fouls: 1] (Austin Simons: 1 personal fouls)   FT 1/2: GOOD   FT 2/2: MISS Nikola Wagner makes 1/2 from the line. Rebound secured by Draymond Harris.
Score: 73-63

[11:00] Team_007 possession (Score: 73-63)
FOUL! Shooting foul on Damian Turner. Jaren Dosunmu to the line for 2 free throws. [Team fouls: 2] (Damian Turner: 1 personal fouls)   FT 1/2: GOOD   FT 2/2: GOOD Jaren Dosunmu makes 2/2 from the line.
Score: 73-65

[10:42] Team_034 possession (Score: 73-65)
Damian Turner commits a violation (traveling/carry)! TURNOVER! (dead ball)

[10:42] Substitution (Team_007): Jaren Dosunmu OUT → OG Porzingis IN (stamina_rule2)

[10:29] Team_007 possession (Score: 73-65)
Gary LaVine drives and kicks out. OG Porzingis attempts a 3Pt. Contested by Damian Turner (5.4 feet, MAN). OG PORZINGIS MAKES IT! Assist: Draymond Harris
Score: 73-68

[10:17] Team_034 possession (Score: 73-68)
Vince Paul attempts a 3Pt. Contested by OG Porzingis (4.7 feet, ZONE). Vince Paul misses. Rebound secured by Draymond Harris.

[10:03] Team_007 possession (Score: 73-68)
Wendell Poole attempts a 3Pt. Contested by Damian Turner (5.7 feet, ZONE). WENDELL POOLE MAKES IT!
Score: 73-71

[09:49] Team_034 possession (Score: 73-71)
FOUL! Reach-in foul on Austin Simons during the drive. [Team fouls: 2] No free throws, side out. (Austin Simons: 2 personal fouls)

[09:32] Team_034 possession (Score: 73-71)
Damian Turner attempts a Layup. Contested by Draymond Harris (5.4 feet, ZONE). DAMIAN TURNER MAKES IT! Assist: Vince Paul
Score: 75-71

[09:16] Team_007 possession (Score: 75-71)
Gary LaVine drives to the basket... Gary LaVine loses the ball! Stripped by Carmelo Anunoby! TURNOVER! (live ball)

[09:02] Team_034 possession (Score: 75-71)
Manu Jokic attempts a Midrange. Contested by OG Porzingis (4.3 feet, ZONE). MANU JOKIC MAKES IT! Assist: Vince Paul
Score: 77-71

[08:49] Team_007 possession (Score: 77-71)
Draymond Harris drives and kicks out. Austin Simons attempts a Midrange. Wide open! Nikola Wagner is 6.0 feet away. [MAN] Austin Simons misses. Rebound secured by Carmelo Anunoby.

[08:32] Team_034 possession (Score: 77-71)
Carmelo Anunoby attempts a Layup. Contested by Austin Simons (3.9 feet, ZONE). Carmelo Anunoby misses. Rebound secured by Draymond Harris.

[08:15] Team_007 possession (Score: 77-71)
OG Porzingis attempts a Midrange. Contested by Nikola Wagner (5.6 feet, ZONE). OG Porzingis misses. Offensive rebound by Austin Simons! Austin Simons puts it back in!
Score: 77-73

[08:04] Team_034 possession (Score: 77-73)
Nikola Wagner loses control! Ball rolls out of bounds! TURNOVER! (dead ball)

[07:49] Team_007 possession (Score: 77-73)
Wendell Poole attempts a 3Pt. Contested by Manu Jokic (5.0 feet, MAN). Wendell Poole misses. Rebound secured by Vince Paul.

[07:31] Team_034 possession (Score: 77-73)
Manu Jokic attempts a 3Pt. Contested by Wendell Poole (5.3 feet, MAN). Manu Jokic misses. Rebound secured by Draymond Harris.

[07:15] Team_007 possession (Score: 77-73)
Wendell Poole drives, Manu Jokic stays with him. Wendell Poole attempts a Dunk. Contested by Manu Jokic (5.0 feet, MAN). WENDELL POOLE MAKES IT! Assist: Gary LaVine
Score: 77-75

[06:59] Team_034 possession (Score: 77-75)
Vince Paul attempts a 3Pt. Contested by Gary LaVine (4.7 feet, MAN). VINCE PAUL MAKES IT! Assist: Nikola Wagner
Score: 80-75

[06:42] Team_007 possession (Score: 80-75)
Austin Simons attempts a Midrange. Wide open! Nikola Wagner is 6.4 feet away. [MAN] AUSTIN SIMONS MAKES IT!
Score: 80-77

[06:28] Team_034 possession (Score: 80-77)
Carmelo Anunoby drives and kicks out. Damian Turner attempts a 3Pt. Contested by OG Porzingis (4.3 feet, MAN). Damian Turner misses. Rebound secured by Austin Simons.

[06:13] Team_007 possession (Score: 80-77)
OG Porzingis makes the Layup and draws the foul on Damian Turner! And-1! OG Porzingis to the line for 1. [Team fouls: 3] (Damian Turner: 2 personal fouls)   FT 1/1: GOOD OG Porzingis makes 1/1 from the line.
Score: 80-80

[06:01] Team_034 possession (Score: 80-80)
Carmelo Anunoby attempts a 3Pt. Contested by OG Porzingis (4.4 feet, ZONE). Carmelo Anunoby misses. Rebound secured by Draymond Harris.

[05:42] Team_007 possession (Score: 80-80)
OG Porzingis attempts a 3Pt. Contested by Vince Paul (3.8 feet, ZONE). OG PORZINGIS MAKES IT! Assist: Wendell Poole
Score: 80-83

[05:28] Team_034 possession (Score: 80-83)
Carmelo Anunoby drives, Draymond Harris stays with him. Carmelo Anunoby attempts a Layup. Contested by Draymond Harris (5.1 feet, ZONE). CARMELO ANUNOBY MAKES IT! Assist: Vince Paul
Score: 82-83

[05:17] Team_007 possession (Score: 82-83)
Draymond Harris attempts a Midrange. Contested by Carmelo Anunoby (5.4 feet, ZONE). Draymond Harris misses. Offensive rebound by Draymond Harris! Draymond Harris kicks it out.

[05:03] Team_007 possession (Score: 82-83)
Austin Simons attempts a Midrange. Wide open! Nikola Wagner is 6.4 feet away. [MAN] AUSTIN SIMONS MAKES IT!
Score: 82-85

[04:48] Team_034 possession (Score: 82-85)
Manu Jokic attempts a 3Pt. Contested by OG Porzingis (4.3 feet, ZONE). Manu Jokic misses. Rebound secured by Gary LaVine.

[04:32] Team_007 possession (Score: 82-85)
Wendell Poole attempts a 3Pt. Contested by Vince Paul (4.5 feet, ZONE). Wendell Poole misses. Rebound secured by Carmelo Anunoby.

[04:19] Team_034 possession (Score: 82-85)
Carmelo Anunoby attempts a Layup. BLOCKED BY OG PORZINGIS! Ball is loose! Rebound secured by Draymond Harris.

[04:03] Team_007 possession (Score: 82-85)
Wendell Poole attempts a Midrange. Contested by Damian Turner (5.8 feet, ZONE). WENDELL POOLE MAKES IT! Assist: OG Porzingis
Score: 82-87

[03:48] Team_034 possession (Score: 82-87)
Vince Paul attempts a Midrange. Contested by Gary LaVine (4.8 feet, ZONE). VINCE PAUL MAKES IT!
Score: 84-87

[03:36] Team_007 possession (Score: 84-87)
FOUL! Holding foul on Manu Jokic. [Team fouls: 4] No free throws, side out. (Manu Jokic: 1 personal fouls)

[03:25] Team_007 possession (Score: 84-87)
OG Porzingis throws a bad pass out of bounds! TURNOVER! (dead ball)

[03:10] Team_034 possession (Score: 84-87)
Nikola Wagner loses the ball! Stripped by Austin Simons! TURNOVER! (live ball)

[02:51] Team_007 possession (Score: 84-87)
OG Porzingis attempts a Layup. Contested by Damian Turner (5.3 feet, MAN). OG Porzingis misses. FOUL! Loose ball foul on Vince Paul during the rebound battle. [IN THE BONUS! 5 team fouls] Draymond Harris to the line for 2 free throws. (Vince Paul: 1 personal fouls)   FT 1/2: GOOD   FT 2/2: MISS Draymond Harris makes 1/2 from the line. Rebound secured by Carmelo Anunoby.
Score: 84-88

[02:34] Team_034 possession (Score: 84-88)
FOUL! Shooting foul on OG Porzingis. Carmelo Anunoby to the line for 2 free throws. [Team fouls: 3] (OG Porzingis: 1 personal fouls)   FT 1/2: GOOD   FT 2/2: MISS Carmelo Anunoby makes 1/2 from the line. Rebound secured by Austin Simons.
Score: 85-88

[02:21] Team_007 possession (Score: 85-88)
Wendell Poole attempts a Layup. Contested by Carmelo Anunoby (6.0 feet, ZONE). WENDELL POOLE MAKES IT!
Score: 85-90

[02:06] Team_034 possession (Score: 85-90)
Carmelo Anunoby attempts a 3Pt. Contested by Draymond Harris (5.3 feet, MAN). Carmelo Anunoby misses. Rebound secured by Draymond Harris.

[01:51] Team_007 possession (Score: 85-90)
Gary LaVine drives, picks up Carmelo Anunoby. Help arrives from Damian Turner! Gary LaVine attempts a Dunk. Contested by Damian Turner (5.9 feet, ZONE). GARY LAVINE MAKES IT! Assist: OG Porzingis
Score: 85-92

[01:33] Team_034 possession (Score: 85-92)
Carmelo Anunoby attempts a 3Pt. Contested by Draymond Harris (5.3 feet, MAN). Carmelo Anunoby misses. Rebound secured by Draymond Harris.

[01:18] Team_007 possession (Score: 85-92)
Wendell Poole drives, Carmelo Anunoby stays with him. Wendell Poole attempts a Dunk. Wide open! Carmelo Anunoby is 6.1 feet away. [ZONE] WENDELL POOLE MAKES IT!
Score: 85-94

[01:03] Team_034 possession (Score: 85-94)
Vince Paul drives, picks up Gary LaVine. Help arrives from OG Porzingis! Vince Paul attempts a Layup. Contested by OG Porzingis (5.0 feet, MAN). VINCE PAUL MAKES IT! Assist: Manu Jokic
Score: 87-94

[00:49] Team_007 possession (Score: 87-94)
Wendell Poole throws a bad pass! Stolen by Manu Jokic! TURNOVER! (live ball)

[00:38] Team_034 possession (Score: 87-94)
FOUL! Offensive foul on Carmelo Anunoby! Draymond Harris drew the charge! [Team fouls: 6] (Carmelo Anunoby: 1 personal fouls) TURNOVER! (dead ball)

[00:24] Team_007 possession (Score: 87-94)
Draymond Harris drives to the basket... FOUL! Offensive foul on Draymond Harris! Carmelo Anunoby drew the charge! [Team fouls: 4] (Draymond Harris: 1 personal fouls) TURNOVER! (dead ball)

[00:08] Team_034 possession (Score: 87-94)
Damian Turner attempts a 3Pt. Contested by Gary LaVine (5.1 feet, ZONE). Damian Turner misses. Rebound secured by Austin Simons.

================================================================================
                              4TH QUARTER COMPLETE                              
================================================================================

4TH QUARTER SCORE: Team_034 15, Team_007 33

BOX SCORE:
================================================================================

Team_034
--------------------------------------------------------------------------------
Player                MIN  PTS  REB  AST  TO      FG   FG%      3P   3P%
--------------------------------------------------------------------------------
Vince Paul             18    7    1    3   0   3/4    75.0     0/0   0.0
Carmelo Anunoby        18    2    4    0   0   1/8    12.5     0/0   0.0
Damian Turner          18    2    0    0   0   1/2    50.0     0/0   0.0
Manu Jokic             21    2    0    1   0   1/3    33.3     0/0   0.0
Anthony Bane           30    0    0    0   0   0/1     0.0     0/0   0.0
Nikola Wagner          18    0    0    1   0   0/1     0.0     0/0   0.0

TEAM: FG: 6/19 (31.6%), 3PT: 1/8 (12.5%), REB: 4 (0 off, 4 def), AST: 5, TO: 5
TEAM FOULS: 6 [Team_007 in BONUS]


Team_007
--------------------------------------------------------------------------------
Player                MIN  PTS  REB  AST  TO      FG   FG%      3P   3P%
--------------------------------------------------------------------------------
Wendell Poole          18   11    0    1   0   5/7    71.4     0/0   0.0
OG Porzingis           17    9    0    2   0   3/4    75.0     0/0   0.0
Austin Simons          21    6    4    0   0   3/3   100.0     0/0   0.0
Jaren Dosunmu          31    4    0    0   0   2/2   100.0     0/0   0.0
Gary LaVine            21    2    1    1   0   1/1   100.0     0/0   0.0
Bones Siakam           28    0    1    0   0   0/0     0.0     0/0   0.0
Draymond Harris        21    0    9    1   0   0/2     0.0     0/0   0.0

TEAM: FG: 14/19 (73.7%), 3PT: 2/4 (50.0%), REB: 16 (3 off, 13 def), AST: 5, TO: 4
TEAM FOULS: 4

================================================================================

================================================================================
                               FULL GAME COMPLETE                               
================================================================================

FINAL SCORE: Team_034 87, Team_007 94

SCORING BY QUARTER:
--------------------------------------------------------------------------------
Team                     Q1     Q2     Q3     Q4    FINAL
--------------------------------------------------------------------------------
Team_034                 28     24     20     15       87
Team_007                 19     19     23     33       94
--------------------------------------------------------------------------------

FULL GAME BOX SCORE:
================================================================================

Team_034
--------------------------------------------------------------------------------
Player                MIN  PTS  REB  AST  TO      FG   FG%      3P   3P%      FT STL BLK
--------------------------------------------------------------------------------
Ben Hyland             30   14    0    2   3   7/14   50.0   0/4     0.0   2/2     0   0
Cole Antetokounmpo     30    5    9    5   3   3/7    42.9   1/3    33.3   0/0     0   0
Terry Doncic           30   17   10    2   2   5/9    55.6   2/2   100.0   5/6     0   0
Anthony Bane           30   11   14    5   1   6/9    66.7   0/0     0.0   0/0     1   0
Devin Poole            28   11    0    3   0   3/9    33.3   2/7    28.6   3/3     1   0
Manu Jokic             21    9    0    3   0   4/8    50.0   1/4    25.0   0/0     1   0
Damian Turner          18    5    0    0   2   2/4    50.0   1/2    50.0   0/0     0   3
Vince Paul             18   10    4    3   0   4/7    57.1   2/4    50.0   0/0     0   0
Nikola Wagner          18    0    1    1   2   0/2     0.0   0/1     0.0   1/2     0   0
Carmelo Anunoby        18    3    7    0   1   2/9    22.2   0/3     0.0   2/4     1   0

TEAM: FG: 36/78 (46.2%), 3PT: 9/30 (30.0%), REB: 40 (8 off, 32 def), AST: 24, TO: 14


Team_007
--------------------------------------------------------------------------------
Player                MIN  PTS  REB  AST  TO      FG   FG%      3P   3P%      FT STL BLK
--------------------------------------------------------------------------------
Jaren Dosunmu          31    8    0    1   0   5/12   41.7   0/5     0.0   4/4     0   1
Tobias Johnson         30    9    0    4   1   4/9    44.4   2/3    66.7   4/5     0   0
Bones Siakam           28    6    8    4   0   2/9    22.2   0/5     0.0   0/0     0   0
John Quickley          28    9   11    1   0   3/7    42.9   0/3     0.0   3/3     1   5
Carmelo Siakam         28   21    7    1   2   9/12   75.0   0/0     0.0   4/4     0   0
Gary LaVine            21    7    3    1   0   4/6    66.7   0/1     0.0   2/3     0   0
Austin Simons          21   10    8    0   4   4/5    80.0   0/0     0.0   0/0     1   0
Draymond Harris        21    2   11    1   1   1/4    25.0   0/0     0.0   1/2     1   0
Wendell Poole          18   11    0    3   1   5/8    62.5   1/4    25.0   0/0     0   1
OG Porzingis           17    9    0    2   1   3/5    60.0   1/1   100.0   1/1     0   1

TEAM: FG: 42/79 (53.2%), 3PT: 4/22 (18.2%), REB: 53 (12 off, 41 def), AST: 18, TO: 10

================================================================================
