================================================================================
                        FULL GAME - Team_084 vs Team_092                        
================================================================================

================================================================================
                       1ST QUARTER - Team_084 vs Team_092                       
================================================================================

[12:00] Team_084 possession (Score: 0-0)
Luka Sexton attempts a Midrange. Contested by Austin Bridges (4.7 feet, MAN). Luka Sexton misses. Rebound secured by John Giddey.

[11:46] Team_092 possession (Score: 0-0)
Karl Gobert attempts a 3Pt. Contested by Luka Sexton (3.5 feet, ZONE). Karl Gobert misses. Offensive rebound by Paul James! Paul James kicks it out.

[11:31] Team_092 possession (Score: 0-0)
John Giddey drives to the basket... John Giddey loses control! Ball rolls out of bounds! TURNOVER! (dead ball)

[11:16] Team_084 possession (Score: 0-0)
Giannis Quickley makes the Layup and draws the foul on Immanuel Ingram! And-1! Giannis Quickley to the line for 1. [Team fouls: 1] (Immanuel Ingram: 1 personal fouls)   FT 1/1: GOOD Giannis Quickley makes 1/1 from the line.
Score: 3-0

[11:02] Team_092 possession (Score: 3-0)
Paul James drives, picks up Klay Thompson. Help arrives from Dejounte Ginobili! Paul James attempts a Dunk. Contested by Dejounte Ginobili (5.5 feet, MAN). PAUL JAMES MAKES IT! Assist: John Giddey
Score: 3-2

[10:51] Team_084 possession (Score: 3-2)
Jarrett Booker attempts a Layup. Contested by John Giddey (4.3 feet, MAN). JARRETT BOOKER MAKES IT!
Score: 5-2

[10:34] Team_092 possession (Score: 5-2)
FOUL! Shooting foul on Luka Sexton. Karl Gobert to the line for 3 free throws. [Team fouls: 1] (Luka Sexton: 1 personal fouls)   FT 1/3: MISS   FT 2/3: MISS   FT 3/3: GOOD Karl Gobert makes 1/3 from the line.
Score: 5-3

[10:20] Team_084 possession (Score: 5-3)
Klay Thompson attempts a Midrange. Contested by John Giddey (4.5 feet, ZONE). Klay Thompson misses. Rebound secured by John Giddey.

[10:08] Team_092 possession (Score: 5-3)
Paul James attempts a 3Pt. Contested by Klay Thompson (5.5 feet, MAN). PAUL JAMES MAKES IT! Assist: John Giddey
Score: 5-6

[09:52] Team_084 possession (Score: 5-6)
Luka Sexton attempts a 3Pt. Contested by Austin Bridges (4.7 feet, MAN). Luka Sexton misses. Rebound secured by Immanuel Ingram.

[09:40] Team_092 possession (Score: 5-6)
John Giddey drives, picks up Jarrett Booker. Help arrives from Dejounte Ginobili! John Giddey attempts a Layup. Contested by Dejounte Ginobili (4.8 feet, MAN). JOHN GIDDEY MAKES IT! Assist: Paul James
Score: 5-8

[09:24] Team_084 possession (Score: 5-8)
Dejounte Ginobili attempts a 3Pt. Contested by John Giddey (4.3 feet, ZONE). Dejounte Ginobili misses. Offensive rebound by Dejounte Ginobili! Dejounte Ginobili kicks it out.

[09:10] Team_084 possession (Score: 5-8)
Jarrett Booker drives, John Giddey stays with him. Jarrett Booker attempts a Layup. Contested by John Giddey (4.3 feet, ZONE). Jarrett Booker misses. Rebound secured by Immanuel Ingram.

[08:57] Team_092 possession (Score: 5-8)
FOUL! Reach-in foul on Giannis Quickley during the drive. [Team fouls: 2] No free throws, side out. (Giannis Quickley: 1 personal fouls)

[08:42] Team_092 possession (Score: 5-8)
Immanuel Ingram drives, picks up Giannis Quickley. Help arrives from Dejounte Ginobili! Immanuel Ingram attempts a Layup. Contested by Dejounte Ginobili (4.3 feet, ZONE). IMMANUEL INGRAM MAKES IT!
Score: 5-10

[08:24] Team_084 possession (Score: 5-10)
Jarrett Booker attempts a 3Pt. Contested by John Giddey (4.3 feet, MAN). Jarrett Booker misses. Rebound secured by John Giddey.

[08:11] Team_092 possession (Score: 5-10)
John Giddey attempts a 3Pt. Contested by Jarrett Booker (4.8 feet, MAN). John Giddey misses. Offensive rebound by John Giddey! John Giddey kicks it out.

[07:59] Team_092 possession (Score: 5-10)
FOUL! Shooting foul on Klay Thompson. Paul James to the line for 3 free throws. [Team fouls: 3] (Klay Thompson: 1 personal fouls)   FT 1/3: GOOD   FT 2/3: MISS   FT 3/3: GOOD Paul James makes 2/3 from the line.
Score: 5-12

[07:47] Team_084 possession (Score: 5-12)
Dejounte Ginobili drives and kicks out. Klay Thompson attempts a 3Pt. Contested by John Giddey (4.0 feet, ZONE). Klay Thompson misses. Rebound secured by Paul James.

[07:34] Team_092 possession (Score: 5-12)
Paul James attempts a 3Pt. Contested by Klay Thompson (5.5 feet, MAN). PAUL JAMES MAKES IT! Assist: John Giddey
Score: 5-15

[07:25] Team_084 possession (Score: 5-15)
Jarrett Booker attempts a Layup. Contested by John Giddey (4.3 feet, MAN). Jarrett Booker misses. Rebound secured by John Giddey.

[07:11] Team_092 possession (Score: 5-15)
Karl Gobert attempts a 3Pt. Contested by Dejounte Ginobili (4.4 feet, MAN). Karl Gobert misses. Rebound secured by Giannis Quickley.

[06:59] Team_084 possession (Score: 5-15)
Dejounte Ginobili makes the Layup and draws the foul on John Giddey! And-1! Dejounte Ginobili to the line for 1. [Team fouls: 2] (John Giddey: 1 personal fouls)   FT 1/1: GOOD Dejounte Ginobili makes 1/1 from the line.
Score: 8-15

[06:46] Team_092 possession (Score: 8-15)
Paul James attempts a Layup. BLOCKED BY KLAY THOMPSON! Ball is loose! Offensive rebound by Paul James! Paul James kicks it out.

[06:29] Team_092 possession (Score: 8-15)
Karl Gobert attempts a 3Pt. Contested by Luka Sexton (3.5 feet, ZONE). Karl Gobert misses. Offensive rebound by John Giddey! John Giddey kicks it out.

[06:18] Team_092 possession (Score: 8-15)
John Giddey attempts a Layup. BLOCKED BY JARRETT BOOKER! Ball goes out off Jarrett Booker. John Giddey's ball!

[06:00] Team_092 possession (Score: 8-15)
Karl Gobert attempts a 3Pt. Contested by Dejounte Ginobili (4.4 feet, MAN). KARL GOBERT MAKES IT! Assist: Immanuel Ingram
Score: 8-18

[05:45] Team_084 possession (Score: 8-18)
Jarrett Booker attempts a 3Pt. Contested by John Giddey (4.3 feet, MAN). JARRETT BOOKER MAKES IT! Assist: Dejounte Ginobili
Score: 11-18

[05:26] Team_092 possession (Score: 11-18)
John Giddey attempts a 3Pt. Contested by Jarrett Booker (4.9 feet, MAN). John Giddey misses. Rebound secured by Giannis Quickley.

[05:14] Team_084 possession (Score: 11-18)
Jarrett Booker attempts a Midrange. Contested by Karl Gobert (5.3 feet, ZONE). JARRETT BOOKER MAKES IT! Assist: Luka Sexton
Score: 13-18

[04:58] Team_092 possession (Score: 13-18)
Karl Gobert drives, Dejounte Ginobili stays with him. Karl Gobert attempts a Layup. Contested by Dejounte Ginobili (4.5 feet, MAN). KARL GOBERT MAKES IT! Assist: Austin Bridges
Score: 13-20

[04:44] Team_084 possession (Score: 13-20)
Dejounte Ginobili makes the Midrange and draws the foul on Karl Gobert! And-1! Dejounte Ginobili to the line for 1. [Team fouls: 3] (Karl Gobert: 1 personal fouls)   FT 1/1: GOOD Dejounte Ginobili makes 1/1 from the line.
Score: 16-20

[04:30] Team_092 possession (Score: 16-20)
Paul James attempts a 3Pt. Contested by Luka Sexton (4.4 feet, ZONE). Paul James misses. Rebound secured by Dejounte Ginobili.

[04:11] Team_084 possession (Score: 16-20)
Giannis Quickley makes the Dunk and draws the foul on John Giddey! And-1! Giannis Quickley to the line for 1. [Team fouls: 4] (John Giddey: 2 personal fouls)   FT 1/1: MISS Giannis Quickley makes 0/1 from the line. Rebound secured by Paul James.
Score: 18-20

[03:56] Team_092 possession (Score: 18-20)
John Giddey makes the Dunk and draws the foul on Dejounte Ginobili! And-1! John Giddey to the line for 1. [Team fouls: 4] (Dejounte Ginobili: 1 personal fouls)   FT 1/1: MISS John Giddey makes 0/1 from the line. Offensive rebound by John Giddey! John Giddey kicks it out.
Score: 18-22

[03:47] Team_092 possession (Score: 18-22)
John Giddey attempts a Layup. Contested by Jarrett Booker (5.0 feet, ZONE). John Giddey misses. Rebound secured by Giannis Quickley.

[03:35] Team_084 possession (Score: 18-22)
Dejounte Ginobili attempts a Layup. Contested by John Giddey (4.5 feet, ZONE). DEJOUNTE GINOBILI MAKES IT!
Score: 20-22

[03:19] Team_092 possession (Score: 20-22)
Immanuel Ingram attempts a Midrange. Contested by Klay Thompson (4.9 feet, ZONE). IMMANUEL INGRAM MAKES IT!
Score: 20-24

[03:09] Team_084 possession (Score: 20-24)
Giannis Quickley attempts a 3Pt. Contested by Immanuel Ingram (4.4 feet, MAN). GIANNIS QUICKLEY MAKES IT! Assist: Luka Sexton
Score: 23-24

[02:55] Team_092 possession (Score: 23-24)
John Giddey makes the Midrange and draws the foul on Jarrett Booker! And-1! John Giddey to the line for 1. [BONUS: 5 team fouls] (Jarrett Booker: 1 personal fouls)   FT 1/1: GOOD John Giddey makes 1/1 from the line.
Score: 23-27

[02:39] Team_084 possession (Score: 23-27)
Giannis Quickley attempts a Midrange. Contested by Immanuel Ingram (4.5 feet, MAN). GIANNIS QUICKLEY MAKES IT!
Score: 25-27

[02:27] Team_092 possession (Score: 25-27)
Austin Bridges attempts a Midrange. Contested by Luka Sexton (3.7 feet, ZONE). Austin Bridges misses. Rebound secured by Klay Thompson.

[02:11] Team_084 possession (Score: 25-27)
Luka Sexton makes the Layup and draws the foul on John Giddey! And-1! Luka Sexton to the line for 1. [BONUS: 5 team fouls] (John Giddey: 3 personal fouls)   FT 1/1: GOOD Luka Sexton makes 1/1 from the line.
Score: 28-27

[01:57] Team_092 possession (Score: 28-27)
Karl Gobert drives and kicks out. Austin Bridges attempts a 3Pt. Contested by Luka Sexton (4.0 feet, MAN). Austin Bridges misses. Rebound secured by Giannis Quickley.

[01:43] Team_084 possession (Score: 28-27)
Klay Thompson drives to the basket... FOUL! Offensive foul on Klay Thompson! John Giddey drew the charge! [Team fouls: 6] (Klay Thompson: 2 personal fouls) TURNOVER! (dead ball)

[01:31] Team_092 possession (Score: 28-27)
Austin Bridges attempts a Midrange. Contested by Dejounte Ginobili (4.7 feet, ZONE). Austin Bridges misses. Rebound secured by Giannis Quickley.

[01:18] Team_084 possession (Score: 28-27)
Dejounte Ginobili drives, John Giddey stays with him. Dejounte Ginobili attempts a Layup. Contested by John Giddey (4.7 feet, ZONE). DEJOUNTE GINOBILI MAKES IT!
Score: 30-27

[01:03] Team_092 possession (Score: 30-27)
Immanuel Ingram drives to the basket... Immanuel Ingram throws a bad pass! Stolen by Giannis Quickley! TURNOVER! (live ball)

[00:51] Team_084 possession (Score: 30-27)
Jarrett Booker attempts a 3Pt. BLOCKED BY JOHN GIDDEY! Ball is loose! Offensive rebound by Giannis Quickley! Giannis Quickley kicks it out.

[00:38] Team_084 possession (Score: 30-27)
Giannis Quickley attempts a 3Pt. Contested by John Giddey (4.8 feet, ZONE). Giannis Quickley misses. Rebound secured by John Giddey.

[00:22] Team_092 possession (Score: 30-27)
John Giddey drives, picks up Jarrett Booker. Help arrives from Dejounte Ginobili! John Giddey attempts a Dunk. Contested by Dejounte Ginobili (5.3 feet, MAN). John Giddey misses. Rebound secured by Giannis Quickley.

[00:09] Team_084 possession (Score: 30-27)
FOUL! Offensive foul on Giannis Quickley! Immanuel Ingram drew the charge! [Team fouls: 7] (Giannis Quickley: 2 personal fouls) TURNOVER! (dead ball)

================================================================================
                              1ST QUARTER COMPLETE                              
================================================================================

1ST QUARTER SCORE: Team_084 30, Team_092 27

BOX SCORE:
================================================================================

Team_084
--------------------------------------------------------------------------------
Player                MIN  PTS  REB  AST  TO      FG   FG%      3P   3P%
--------------------------------------------------------------------------------
Dejounte Ginobili      12   10    2    1   0   4/5    80.0     0/0   0.0
Giannis Quickley       12    8    7    0   0   3/5    60.0     0/0   0.0
Jarrett Booker         12    7    0    0   0   3/6    50.0     0/0   0.0
Luka Sexton            12    3    0    2   0   1/3    33.3     0/0   0.0
Klay Thompson          12    0    1    0   0   0/1     0.0     0/0   0.0

TEAM: FG: 11/20 (55.0%), 3PT: 2/5 (40.0%), REB: 10 (2 off, 8 def), AST: 3, TO: 2
TEAM FOULS: 7 [Team_092 in BONUS]


Team_092
--------------------------------------------------------------------------------
Player                MIN  PTS  REB  AST  TO      FG   FG%      3P   3P%
--------------------------------------------------------------------------------
Paul James             12   10    4    1   0   4/5    80.0     0/0   0.0
Karl Gobert            12    6    0    0   0   3/5    60.0     0/0   0.0
John Giddey            12    5    8    3   0   2/5    40.0     0/0   0.0
Immanuel Ingram        12    4    2    1   0   2/2   100.0     0/0   0.0
Austin Bridges         12    0    0    1   0   0/2     0.0     0/0   0.0

TEAM: FG: 11/19 (57.9%), 3PT: 5/8 (62.5%), REB: 14 (5 off, 9 def), AST: 6, TO: 2
TEAM FOULS: 5 [Team_084 in BONUS]

================================================================================

================================================================================
                       2ND QUARTER - Team_084 vs Team_092                       
================================================================================

[12:00] Team_084 possession (Score: 30-27)
Dejounte Ginobili attempts a 3Pt. Contested by Karl Gobert (5.6 feet, MAN). Dejounte Ginobili misses. Offensive rebound by Dejounte Ginobili! Dejounte Ginobili kicks it out.

[11:45] Team_084 possession (Score: 30-27)
Jarrett Booker attempts a 3Pt. Contested by John Giddey (4.7 feet, ZONE). JARRETT BOOKER MAKES IT! Assist: Luka Sexton
Score: 33-27

[11:30] Team_092 possession (Score: 33-27)
John Giddey attempts a 3Pt. Contested by Jarrett Booker (5.2 feet, MAN). John Giddey misses. FOUL! Loose ball foul on Giannis Quickley during the rebound battle. [Team fouls: 1] No free throws, side out. (Giannis Quickley: 1 personal fouls)

[11:18] Team_092 possession (Score: 33-27)
Paul James attempts a 3Pt. Contested by Klay Thompson (5.9 feet, ZONE). Paul James misses. Rebound secured by Giannis Quickley.

[11:03] Team_084 possession (Score: 33-27)
Giannis Quickley attempts a Layup. Contested by Immanuel Ingram (4.6 feet, ZONE). GIANNIS QUICKLEY MAKES IT! Assist: Luka Sexton
Score: 35-27

[10:44] Team_092 possession (Score: 35-27)
FOUL! Shooting foul on Jarrett Booker. Paul James to the line for 2 free throws. [Team fouls: 2] (Jarrett Booker: 1 personal fouls)   FT 1/2: GOOD   FT 2/2: GOOD Paul James makes 2/2 from the line.
Score: 35-29

[10:28] Team_084 possession (Score: 35-29)
Klay Thompson attempts a 3Pt. Contested by Karl Gobert (5.9 feet, ZONE). KLAY THOMPSON MAKES IT! Assist: Jarrett Booker
Score: 38-29

[10:13] Team_092 possession (Score: 38-29)
Immanuel Ingram drives, picks up Giannis Quickley. Help arrives from Dejounte Ginobili! Immanuel Ingram attempts a Dunk. Contested by Dejounte Ginobili (4.8 feet, MAN). IMMANUEL INGRAM MAKES IT! Assist: John Giddey
Score: 38-31

[09:56] Team_084 possession (Score: 38-31)
Dejounte Ginobili attempts a 3Pt. Contested by Karl Gobert (5.7 feet, MAN). Dejounte Ginobili misses. Rebound secured by Immanuel Ingram.

[09:45] Team_092 possession (Score: 38-31)
Karl Gobert attempts a Midrange. Contested by Dejounte Ginobili (5.0 feet, MAN). Karl Gobert misses. Rebound secured by Dejounte Ginobili.

[09:31] Team_084 possession (Score: 38-31)
Jarrett Booker attempts a 3Pt. Contested by John Giddey (4.9 feet, ZONE). Jarrett Booker misses. Rebound secured by Immanuel Ingram.

[09:20] Team_092 possession (Score: 38-31)
Karl Gobert drives and kicks out. Karl Gobert attempts a Midrange. Contested by Dejounte Ginobili (5.2 feet, MAN). Karl Gobert misses. Offensive rebound by John Giddey! John Giddey kicks it out.

[09:06] Team_092 possession (Score: 38-31)
FOUL! Shooting foul on Jarrett Booker. John Giddey to the line for 2 free throws. [Team fouls: 3] (Jarrett Booker: 2 personal fouls)   FT 1/2: GOOD   FT 2/2: GOOD John Giddey makes 2/2 from the line.
Score: 38-33

[08:48] Team_084 possession (Score: 38-33)
Luka Sexton drives and kicks out. Jarrett Booker attempts a Midrange. Contested by John Giddey (4.9 feet, ZONE). Jarrett Booker misses. Rebound secured by Paul James.

[08:38] Team_092 possession (Score: 38-33)
John Giddey attempts a Midrange. Contested by Jarrett Booker (5.5 feet, MAN). JOHN GIDDEY MAKES IT!
Score: 38-35

[08:23] Team_084 possession (Score: 38-35)
Klay Thompson drives, picks up Paul James. Help arrives from Austin Bridges! Klay Thompson attempts a Layup. Contested by Austin Bridges (5.8 feet, MAN). Klay Thompson misses. Offensive rebound by Dejounte Ginobili! Dejounte Ginobili kicks it out.

[08:13] Team_084 possession (Score: 38-35)
FOUL! Shooting foul on Austin Bridges. Klay Thompson to the line for 2 free throws. [Team fouls: 1] (Austin Bridges: 1 personal fouls)   FT 1/2: GOOD   FT 2/2: MISS Klay Thompson makes 1/2 from the line. Rebound secured by Immanuel Ingram.
Score: 39-35

[07:57] Team_092 possession (Score: 39-35)
John Giddey attempts a 3Pt. Contested by Luka Sexton (4.6 feet, ZONE). John Giddey misses. Rebound secured by Dejounte Ginobili.

[07:43] Team_084 possession (Score: 39-35)
FOUL! Shooting foul on John Giddey. Luka Sexton to the line for 2 free throws. [Team fouls: 2] (John Giddey: 1 personal fouls)   FT 1/2: GOOD   FT 2/2: MISS Luka Sexton makes 1/2 from the line. Rebound secured by Immanuel Ingram.
Score: 40-35

[07:32] Team_092 possession (Score: 40-35)
Karl Gobert attempts a 3Pt. Contested by Luka Sexton (4.4 feet, ZONE). KARL GOBERT MAKES IT! Assist: John Giddey
Score: 40-38

[07:22] Team_084 possession (Score: 40-38)
Giannis Quickley throws a bad pass! Stolen by Immanuel Ingram! TURNOVER! (live ball)

[07:10] Team_092 possession (Score: 40-38)
Austin Bridges attempts a Layup. Contested by Luka Sexton (4.3 feet, MAN). AUSTIN BRIDGES MAKES IT! Assist: John Giddey
Score: 40-40

[06:54] Team_084 possession (Score: 40-40)
Klay Thompson attempts a 3Pt. Contested by Paul James (5.9 feet, MAN). KLAY THOMPSON MAKES IT! Assist: Giannis Quickley
Score: 43-40

[06:35] Team_092 possession (Score: 43-40)
FOUL! Offensive foul on John Giddey! Jarrett Booker drew the charge! [Team fouls: 3] (John Giddey: 2 personal fouls) TURNOVER! (dead ball)

[06:23] Team_084 possession (Score: 43-40)
Dejounte Ginobili attempts a 3Pt. Wide open! Karl Gobert is 6.2 feet away. [MAN] DEJOUNTE GINOBILI MAKES IT! Assist: Jarrett Booker
Score: 46-40

[06:06] Team_092 possession (Score: 46-40)
John Giddey commits a violation (traveling/carry)! TURNOVER! (dead ball)

[06:06] Substitution (Team_084): Luka Sexton OUT → Magic Bryant IN (stamina_rule2)

[06:06] Substitution (Team_084): Dejounte Ginobili OUT → Chris Parker IN (stamina_rule2)

[06:06] Substitution (Team_084): Klay Thompson OUT → Evan Quickley IN (stamina_rule2)

[06:06] Substitution (Team_084): Jarrett Booker OUT → Pascal Jackson IN (stamina_rule2)

[06:06] Substitution (Team_084): Giannis Quickley OUT → Dejounte Porzingis IN (stamina_rule2)

[06:06] Substitution (Team_092): Austin Bridges OUT → Bones Giddey IN (stamina_rule2)

[06:06] Substitution (Team_092): Karl Gobert OUT → Shaquille Russell IN (stamina_rule2)

[06:06] Substitution (Team_092): Paul James OUT → Vince Harris IN (stamina_rule2)

[06:06] Substitution (Team_092): John Giddey OUT → Shaquille Paul IN (stamina_rule2)

[06:06] Substitution (Team_092): Immanuel Ingram OUT → Pau Reaves IN (stamina_rule2)

[05:47] Team_084 possession (Score: 46-40)
Chris Parker attempts a 3Pt. Contested by Shaquille Russell (4.3 feet, MAN). CHRIS PARKER MAKES IT! Assist: Magic Bryant
Score: 49-40

[05:29] Team_092 possession (Score: 49-40)
FOUL! Offensive foul on Pau Reaves! Dejounte Porzingis drew the charge! [Team fouls: 4] (Pau Reaves: 1 personal fouls) TURNOVER! (dead ball)

[05:13] Team_084 possession (Score: 49-40)
Chris Parker attempts a 3Pt. Contested by Vince Harris (4.2 feet, ZONE). Chris Parker misses. Rebound secured by Shaquille Paul.

[04:59] Team_092 possession (Score: 49-40)
Vince Harris attempts a 3Pt. Contested by Evan Quickley (4.9 feet, MAN). Vince Harris misses. Rebound secured by Evan Quickley.

[04:47] Team_084 possession (Score: 49-40)
Evan Quickley attempts a 3Pt. Contested by Vince Harris (4.0 feet, ZONE). EVAN QUICKLEY MAKES IT! Assist: Dejounte Porzingis
Score: 52-40

[04:31] Team_092 possession (Score: 52-40)
FOUL! Reach-in foul on Dejounte Porzingis during the drive. [Team fouls: 4] No free throws, side out. (Dejounte Porzingis: 1 personal fouls)

[04:21] Team_092 possession (Score: 52-40)
Vince Harris makes the Dunk and draws the foul on Evan Quickley! And-1! Vince Harris to the line for 1. [BONUS: 5 team fouls] (Evan Quickley: 1 personal fouls)   FT 1/1: GOOD Vince Harris makes 1/1 from the line.
Score: 52-43

[04:09] Team_084 possession (Score: 52-43)
Magic Bryant makes the Midrange and draws the foul on Bones Giddey! And-1! Magic Bryant to the line for 1. [BONUS: 5 team fouls] (Bones Giddey: 1 personal fouls)   FT 1/1: GOOD Magic Bryant makes 1/1 from the line.
Score: 55-43

[03:54] Team_092 possession (Score: 55-43)
Pau Reaves attempts a Midrange. Contested by Dejounte Porzingis (5.3 feet, MAN). PAU REAVES MAKES IT! Assist: Bones Giddey
Score: 55-45

[03:41] Team_084 possession (Score: 55-45)
Chris Parker drives to the basket... FOUL! Offensive foul on Chris Parker! Pau Reaves drew the charge! [Team fouls: 6] (Chris Parker: 1 personal fouls) TURNOVER! (dead ball)

[03:27] Team_092 possession (Score: 55-45)
Shaquille Paul attempts a Midrange. Contested by Pascal Jackson (5.3 feet, MAN). SHAQUILLE PAUL MAKES IT!
Score: 55-47

[03:15] Team_084 possession (Score: 55-47)
Dejounte Porzingis drives and kicks out. Pascal Jackson attempts a 3Pt. Contested by Vince Harris (4.1 feet, ZONE). Pascal Jackson misses. Rebound secured by Shaquille Paul.

[03:01] Team_092 possession (Score: 55-47)
Bones Giddey loses control! Ball rolls out of bounds! TURNOVER! (dead ball)

[02:47] Team_084 possession (Score: 55-47)
Evan Quickley attempts a 3Pt. Contested by Vince Harris (4.0 feet, MAN). Evan Quickley misses. Rebound secured by Shaquille Russell.

[02:34] Team_092 possession (Score: 55-47)
Bones Giddey attempts a Midrange. Contested by Magic Bryant (3.3 feet, MAN). BONES GIDDEY MAKES IT! Assist: Shaquille Russell
Score: 55-49

[02:15] Team_084 possession (Score: 55-49)
Chris Parker attempts a Midrange. Contested by Shaquille Paul (5.7 feet, ZONE). CHRIS PARKER MAKES IT! Assist: Dejounte Porzingis
Score: 57-49

[02:00] Team_092 possession (Score: 57-49)
Shaquille Paul drives to the basket... Shaquille Paul loses the ball! Stripped by Pascal Jackson! TURNOVER! (live ball)

[01:44] Team_084 possession (Score: 57-49)
Dejounte Porzingis attempts a 3Pt. Contested by Pau Reaves (4.9 feet, MAN). Dejounte Porzingis misses. Rebound secured by Shaquille Russell.

[01:27] Team_092 possession (Score: 57-49)
Pau Reaves drives, Dejounte Porzingis stays with him. Pau Reaves attempts a Layup. Contested by Dejounte Porzingis (5.3 feet, ZONE). PAU REAVES MAKES IT!
Score: 57-51

[01:11] Team_084 possession (Score: 57-51)
Pascal Jackson attempts a Midrange. Contested by Shaquille Paul (5.8 feet, MAN). PASCAL JACKSON MAKES IT! Assist: Evan Quickley
Score: 59-51

[00:53] Team_092 possession (Score: 59-51)
FOUL! Reach-in foul on Dejounte Porzingis during the drive. [IN THE BONUS! 7 team fouls] Shaquille Russell to the line for 2 free throws. (Dejounte Porzingis: 2 personal fouls)   FT 1/2: GOOD   FT 2/2: GOOD Shaquille Russell makes 2/2 from the line.
Score: 59-53

[00:38] Team_084 possession (Score: 59-53)
Dejounte Porzingis drives and kicks out. Dejounte Porzingis attempts a Midrange. Contested by Vince Harris (4.1 feet, ZONE). DEJOUNTE PORZINGIS MAKES IT! Assist: Pascal Jackson
Score: 61-53

[00:23] Team_092 possession (Score: 61-53)
Pau Reaves attempts a 3Pt. Contested by Magic Bryant (3.9 feet, ZONE). Pau Reaves misses. Rebound secured by Evan Quickley.

[00:08] Team_084 possession (Score: 61-53)
Chris Parker attempts a 3Pt. Contested by Vince Harris (4.2 feet, ZONE). Chris Parker misses. Offensive rebound by Pascal Jackson! Pascal Jackson kicks it out.

================================================================================
                              2ND QUARTER COMPLETE                              
================================================================================

2ND QUARTER SCORE: Team_084 31, Team_092 26

BOX SCORE:
================================================================================

Team_084
--------------------------------------------------------------------------------
Player                MIN  PTS  REB  AST  TO      FG   FG%      3P   3P%
--------------------------------------------------------------------------------
Klay Thompson          18    6    0    0   0   2/3    66.7     0/0   0.0
Chris Parker            6    5    0    0   0   2/3    66.7     0/0   0.0
Dejounte Ginobili      18    3    4    0   0   1/2    50.0     0/0   0.0
Jarrett Booker         18    3    0    2   0   1/2    50.0     0/0   0.0
Magic Bryant            6    3    0    1   0   1/1   100.0     0/0   0.0
Evan Quickley           6    3    2    1   0   1/2    50.0     0/0   0.0
Giannis Quickley       18    2    1    1   0   1/1   100.0     0/0   0.0
Dejounte Porzingis      6    2    0    2   0   1/3    33.3     0/0   0.0
Pascal Jackson          6    2    1    1   0   1/1   100.0     0/0   0.0
Luka Sexton            18    0    0    2   0   0/2     0.0     0/0   0.0

TEAM: FG: 11/20 (55.0%), 3PT: 6/11 (54.5%), REB: 8 (3 off, 5 def), AST: 10, TO: 2
TEAM FOULS: 7 [Team_092 in BONUS]


Team_092
--------------------------------------------------------------------------------
Player                MIN  PTS  REB  AST  TO      FG   FG%      3P   3P%
--------------------------------------------------------------------------------
John Giddey            18    4    1    3   0   2/3    66.7     0/0   0.0
Pau Reaves              6    4    0    0   0   2/3    66.7     0/0   0.0
Karl Gobert            18    3    0    0   0   1/2    50.0     0/0   0.0
Vince Harris            6    3    0    0   0   1/2    50.0     0/0   0.0
Paul James             18    2    2    0   0   1/2    50.0     0/0   0.0
Immanuel Ingram        18    2    4    0   0   1/1   100.0     0/0   0.0
Austin Bridges         18    2    0    0   0   1/1   100.0     0/0   0.0
Shaquille Paul          6    2    2    0   0   1/1   100.0     0/0   0.0
Bones Giddey            6    2    0    1   0   1/1   100.0     0/0   0.0
Shaquille Russell       6    2    2    1   0   1/1   100.0     0/0   0.0

TEAM: FG: 12/17 (70.6%), 3PT: 1/5 (20.0%), REB: 11 (2 off, 9 def), AST: 5, TO: 5
TEAM FOULS: 5 [Team_084 in BONUS]

================================================================================

================================================================================
                       3RD QUARTER - Team_084 vs Team_092                       
================================================================================

[12:00] Team_084 possession (Score: 61-53)
Jarrett Booker attempts a Midrange. Contested by John Giddey (4.3 feet, MAN). Jarrett Booker misses. Rebound secured by Paul James.

[11:42] Team_092 possession (Score: 61-53)
Paul James attempts a 3Pt. Contested by Luka Sexton (4.3 feet, ZONE). PAUL JAMES MAKES IT! Assist: Immanuel Ingram
Score: 61-56

[11:25] Team_084 possession (Score: 61-56)
Giannis Quickley makes the Dunk and draws the foul on John Giddey! And-1! Giannis Quickley to the line for 1. [Team fouls: 1] (John Giddey: 1 personal fouls)   FT 1/1: GOOD Giannis Quickley makes 1/1 from the line.
Score: 64-56

[11:06] Team_092 possession (Score: 64-56)
Immanuel Ingram drives to the basket... Immanuel Ingram throws a bad pass out of bounds! TURNOVER! (dead ball)

[10:54] Team_084 possession (Score: 64-56)
Giannis Quickley drives and kicks out. Jarrett Booker attempts a 3Pt. Contested by John Giddey (4.0 feet, MAN). Jarrett Booker misses. Rebound secured by Immanuel Ingram.

[10:39] Team_092 possession (Score: 64-56)
Paul James attempts a 3Pt. Contested by Klay Thompson (5.5 feet, MAN). PAUL JAMES MAKES IT! Assist: Austin Bridges
Score: 64-59

[10:21] Team_084 possession (Score: 64-59)
Dejounte Ginobili drives, picks up John Giddey. Help arrives from Austin Bridges! Dejounte Ginobili attempts a Layup. Contested by Austin Bridges (4.3 feet, ZONE). DEJOUNTE GINOBILI MAKES IT!
Score: 66-59

[10:01] Team_092 possession (Score: 66-59)
John Giddey attempts a 3Pt. Contested by Luka Sexton (3.9 feet, ZONE). John Giddey misses. Rebound secured by Giannis Quickley.

[09:47] Team_084 possession (Score: 66-59)
Dejounte Ginobili attempts a 3Pt. Contested by John Giddey (4.3 feet, ZONE). DEJOUNTE GINOBILI MAKES IT! Assist: Klay Thompson
Score: 69-59

[09:31] Team_092 possession (Score: 69-59)
Karl Gobert attempts a 3Pt. Contested by Dejounte Ginobili (4.4 feet, MAN). KARL GOBERT MAKES IT! Assist: Austin Bridges
Score: 69-62

[09:17] Team_084 possession (Score: 69-62)
Klay Thompson attempts a Midrange. Contested by Paul James (5.2 feet, MAN). Klay Thompson misses. Rebound secured by Immanuel Ingram.

[09:02] Team_092 possession (Score: 69-62)
FOUL! Reach-in foul on Giannis Quickley during the drive. [Team fouls: 1] No free throws, side out. (Giannis Quickley: 1 personal fouls)

[08:46] Team_092 possession (Score: 69-62)
Paul James attempts a 3Pt. Contested by Luka Sexton (4.3 feet, ZONE). Paul James misses. Offensive rebound by Paul James! Paul James kicks it out.

[08:29] Team_092 possession (Score: 69-62)
Immanuel Ingram attempts a Midrange. Contested by Klay Thompson (4.7 feet, ZONE). Immanuel Ingram misses. Rebound secured by Klay Thompson.

[08:19] Team_084 possession (Score: 69-62)
Dejounte Ginobili attempts a 3Pt. Contested by John Giddey (4.3 feet, ZONE). Dejounte Ginobili misses. Rebound secured by Paul James.

[08:05] Team_092 possession (Score: 69-62)
John Giddey attempts a 3Pt. Contested by Jarrett Booker (4.8 feet, MAN). John Giddey misses. Offensive rebound by Paul James! Paul James kicks it out.

[07:51] Team_092 possession (Score: 69-62)
John Giddey drives to the basket... John Giddey commits a violation (traveling/carry)! TURNOVER! (dead ball)

[07:38] Team_084 possession (Score: 69-62)
Giannis Quickley drives, Immanuel Ingram stays with him. Giannis Quickley attempts a Dunk. Contested by Immanuel Ingram (4.3 feet, MAN). GIANNIS QUICKLEY MAKES IT! Assist: Klay Thompson
Score: 71-62

[07:23] Team_092 possession (Score: 71-62)
Karl Gobert attempts a Layup. BLOCKED BY DEJOUNTE GINOBILI! Ball is loose! Rebound secured by Dejounte Ginobili.

[07:09] Team_084 possession (Score: 71-62)
Luka Sexton drives, Austin Bridges stays with him. Luka Sexton attempts a Layup. Contested by Austin Bridges (4.7 feet, MAN). LUKA SEXTON MAKES IT! Assist: Giannis Quickley
Score: 73-62

[06:53] Team_092 possession (Score: 73-62)
Austin Bridges attempts a Layup. Contested by Giannis Quickley (4.2 feet, ZONE). AUSTIN BRIDGES MAKES IT!
Score: 73-64

[06:38] Team_084 possession (Score: 73-64)
Jarrett Booker drives, John Giddey stays with him. Jarrett Booker attempts a Dunk. Contested by John Giddey (4.3 feet, MAN). Jarrett Booker misses. Rebound secured by John Giddey.

[06:20] Team_092 possession (Score: 73-64)
Karl Gobert drives and kicks out. Immanuel Ingram attempts a 3Pt. Contested by Jarrett Booker (4.6 feet, ZONE). IMMANUEL INGRAM MAKES IT! Assist: John Giddey
Score: 73-67

[06:10] Team_084 possession (Score: 73-67)
Giannis Quickley drives, Immanuel Ingram stays with him. Giannis Quickley attempts a Layup. Contested by Immanuel Ingram (4.3 feet, MAN). GIANNIS QUICKLEY MAKES IT! Assist: Klay Thompson
Score: 75-67

[05:53] Team_092 possession (Score: 75-67)
FOUL! Shooting foul on Dejounte Ginobili. Karl Gobert to the line for 2 free throws. [Team fouls: 2] (Dejounte Ginobili: 1 personal fouls)   FT 1/2: GOOD   FT 2/2: GOOD Karl Gobert makes 2/2 from the line.
Score: 75-69

[05:37] Team_084 possession (Score: 75-69)
Jarrett Booker drives, John Giddey stays with him. Jarrett Booker attempts a Dunk. Contested by John Giddey (4.3 feet, MAN). JARRETT BOOKER MAKES IT! Assist: Dejounte Ginobili
Score: 77-69

[05:20] Team_092 possession (Score: 77-69)
Paul James attempts a Layup. BLOCKED BY KLAY THOMPSON! Ball is loose! Offensive rebound by Paul James! Paul James kicks it out.

[05:04] Team_092 possession (Score: 77-69)
Karl Gobert drives, Giannis Quickley stays with him. Karl Gobert attempts a Layup. Contested by Giannis Quickley (4.3 feet, ZONE). Karl Gobert misses. Rebound secured by Klay Thompson.

[04:53] Team_084 possession (Score: 77-69)
Luka Sexton attempts a 3Pt. Contested by John Giddey (4.4 feet, ZONE). Luka Sexton misses. Offensive rebound by Giannis Quickley! Giannis Quickley puts it back in!
Score: 79-69

[04:37] Team_092 possession (Score: 79-69)
Immanuel Ingram drives and kicks out. FOUL! Shooting foul on Luka Sexton. Austin Bridges to the line for 2 free throws. [Team fouls: 3] (Luka Sexton: 1 personal fouls)   FT 1/2: MISS   FT 2/2: MISS Austin Bridges makes 0/2 from the line. Offensive rebound by John Giddey! John Giddey kicks it out.

[04:22] Team_092 possession (Score: 79-69)
Immanuel Ingram drives to the basket... FOUL! Offensive foul on Immanuel Ingram! Giannis Quickley drew the charge! [Team fouls: 2] (Immanuel Ingram: 1 personal fouls) TURNOVER! (dead ball)

[04:06] Team_084 possession (Score: 79-69)
Giannis Quickley attempts a Layup. Contested by John Giddey (4.4 feet, ZONE). GIANNIS QUICKLEY MAKES IT!
Score: 81-69

[03:50] Team_092 possession (Score: 81-69)
FOUL! Shooting foul on Giannis Quickley. Immanuel Ingram to the line for 2 free throws. [Team fouls: 4] (Giannis Quickley: 2 personal fouls)   FT 1/2: GOOD   FT 2/2: GOOD Immanuel Ingram makes 2/2 from the line.
Score: 81-71

[03:36] Team_084 possession (Score: 81-71)
Klay Thompson drives and kicks out. Dejounte Ginobili attempts a 3Pt. Contested by Karl Gobert (5.1 feet, MAN). Dejounte Ginobili misses. FOUL! Loose ball foul on Paul James during the rebound battle. [Team fouls: 3] No free throws, side out. (Paul James: 1 personal fouls)

[03:25] Team_084 possession (Score: 81-71)
Giannis Quickley attempts a Dunk. BLOCKED BY AUSTIN BRIDGES! Ball is loose! Offensive rebound by Giannis Quickley! Giannis Quickley kicks it out.

[03:08] Team_084 possession (Score: 81-71)
FOUL! Holding foul on Immanuel Ingram. [Team fouls: 4] No free throws, side out. (Immanuel Ingram: 2 personal fouls)

[02:57] Team_084 possession (Score: 81-71)
Klay Thompson attempts a Layup. Contested by Paul James (5.3 feet, MAN). Klay Thompson misses. Rebound secured by John Giddey.

[02:44] Team_092 possession (Score: 81-71)
Paul James loses the ball! Stripped by Klay Thompson! TURNOVER! (live ball)

[02:29] Team_084 possession (Score: 81-71)
Luka Sexton attempts a 3Pt. Contested by John Giddey (4.6 feet, ZONE). Luka Sexton misses. Rebound secured by John Giddey.

[02:14] Team_092 possession (Score: 81-71)
Karl Gobert makes the Layup and draws the foul on Dejounte Ginobili! And-1! Karl Gobert to the line for 1. [BONUS: 5 team fouls] (Dejounte Ginobili: 2 personal fouls)   FT 1/1: GOOD Karl Gobert makes 1/1 from the line.
Score: 81-74

[01:57] Team_084 possession (Score: 81-74)
Dejounte Ginobili attempts a Layup. Contested by Immanuel Ingram (4.5 feet, ZONE). DEJOUNTE GINOBILI MAKES IT!
Score: 83-74

[01:40] Team_092 possession (Score: 83-74)
Karl Gobert attempts a Midrange. Contested by Jarrett Booker (4.7 feet, ZONE). KARL GOBERT MAKES IT!
Score: 83-76

[01:26] Team_084 possession (Score: 83-76)
Giannis Quickley attempts a Midrange. Contested by Karl Gobert (5.6 feet, ZONE). GIANNIS QUICKLEY MAKES IT!
Score: 85-76

[01:09] Team_092 possession (Score: 85-76)
John Giddey drives, Jarrett Booker stays with him. John Giddey attempts a Layup. Contested by Jarrett Booker (5.1 feet, MAN). John Giddey misses. Rebound secured by Klay Thompson.

[00:55] Team_084 possession (Score: 85-76)
Luka Sexton drives, Austin Bridges stays with him. Luka Sexton attempts a Dunk. Contested by Austin Bridges (5.2 feet, MAN). Luka Sexton misses. Rebound secured by Immanuel Ingram.

[00:43] Team_092 possession (Score: 85-76)
John Giddey makes the Layup and draws the foul on Jarrett Booker! And-1! John Giddey to the line for 1. [BONUS: 6 team fouls] (Jarrett Booker: 1 personal fouls)   FT 1/1: GOOD John Giddey makes 1/1 from the line.
Score: 85-79

[00:27] Team_084 possession (Score: 85-79)
FOUL! Shooting foul on John Giddey. Giannis Quickley to the line for 2 free throws. [BONUS: 5 team fouls] (John Giddey: 2 personal fouls)   FT 1/2: GOOD   FT 2/2: GOOD Giannis Quickley makes 2/2 from the line.
Score: 87-79

[00:13] Team_092 possession (Score: 87-79)
FOUL! Offensive foul on Karl Gobert! Dejounte Ginobili drew the charge! [Team fouls: 6] (Karl Gobert: 1 personal fouls) TURNOVER! (dead ball)

================================================================================
                              3RD QUARTER COMPLETE                              
================================================================================

3RD QUARTER SCORE: Team_084 26, Team_092 26

BOX SCORE:
================================================================================

Team_084
--------------------------------------------------------------------------------
Player                MIN  PTS  REB  AST  TO      FG   FG%      3P   3P%
--------------------------------------------------------------------------------
Giannis Quickley       30   15    4    1   0   7/8    87.5     0/0   0.0
Dejounte Ginobili      30    7    1    1   0   3/4    75.0     0/0   0.0
Jarrett Booker         30    2    0    0   0   1/3    33.3     0/0   0.0
Luka Sexton            30    2    0    0   0   1/3    33.3     0/0   0.0
Klay Thompson          30    0    3    3   0   0/2     0.0     0/0   0.0

TEAM: FG: 12/20 (60.0%), 3PT: 2/4 (50.0%), REB: 8 (3 off, 5 def), AST: 5, TO: 0
TEAM FOULS: 6 [Team_092 in BONUS]


Team_092
--------------------------------------------------------------------------------
Player                MIN  PTS  REB  AST  TO      FG   FG%      3P   3P%
--------------------------------------------------------------------------------
Karl Gobert            30   10    0    0   0   4/6    66.7     0/0   0.0
Paul James             30    6    5    0   0   2/2   100.0     0/0   0.0
Immanuel Ingram        30    5    3    1   0   2/3    66.7     0/0   0.0
John Giddey            30    3    4    1   0   1/3    33.3     0/0   0.0
Austin Bridges         30    2    0    2   0   1/1   100.0     0/0   0.0

TEAM: FG: 10/15 (66.7%), 3PT: 3/4 (75.0%), REB: 12 (4 off, 8 def), AST: 4, TO: 5
TEAM FOULS: 6 [Team_084 in BONUS]

================================================================================

================================================================================
                       4TH QUARTER - Team_084 vs Team_092                       
================================================================================

[12:00] Team_084 possession (Score: 87-79)
Dejounte Ginobili attempts a Midrange. Contested by Karl Gobert (5.5 feet, ZONE). Dejounte Ginobili misses. Rebound secured by John Giddey.

[11:45] Team_092 possession (Score: 87-79)
Austin Bridges attempts a Layup. Contested by Luka Sexton (3.6 feet, MAN). AUSTIN BRIDGES MAKES IT!
Score: 87-81

[11:30] Team_084 possession (Score: 87-81)
Dejounte Ginobili attempts a 3Pt. Contested by John Giddey (4.6 feet, ZONE). Dejounte Ginobili misses. Rebound secured by Immanuel Ingram.

[11:19] Team_092 possession (Score: 87-81)
John Giddey attempts a Midrange. Contested by Jarrett Booker (5.1 feet, MAN). John Giddey misses. Rebound secured by Dejounte Ginobili.

[11:03] Team_084 possession (Score: 87-81)
Luka Sexton attempts a 3Pt. Contested by Austin Bridges (5.2 feet, MAN). Luka Sexton misses. Rebound secured by Paul James.

[10:50] Team_092 possession (Score: 87-81)
Karl Gobert drives to the basket... Karl Gobert throws a bad pass out of bounds! TURNOVER! (dead ball)

[10:50] Substitution (Team_084): Luka Sexton OUT → Magic Bryant IN (stamina_rule2)

[10:50] Substitution (Team_084): Dejounte Ginobili OUT → Chris Parker IN (stamina_rule2)

[10:50] Substitution (Team_084): Klay Thompson OUT → Evan Quickley IN (stamina_rule2)

[10:50] Substitution (Team_084): Jarrett Booker OUT → Pascal Jackson IN (stamina_rule2)

[10:50] Substitution (Team_084): Giannis Quickley OUT → Dejounte Porzingis IN (stamina_rule2)

[10:50] Substitution (Team_092): Austin Bridges OUT → Bones Giddey IN (stamina_rule2)

[10:50] Substitution (Team_092): Karl Gobert OUT → Shaquille Russell IN (stamina_rule2)

[10:50] Substitution (Team_092): Paul James OUT → Vince Harris IN (stamina_rule2)

[10:50] Substitution (Team_092): John Giddey OUT → Shaquille Paul IN (stamina_rule2)

[10:50] Substitution (Team_092): Immanuel Ingram OUT → Pau Reaves IN (stamina_rule2)

[10:34] Team_084 possession (Score: 87-81)
Dejounte Porzingis drives to the basket... Dejounte Porzingis loses the ball! Stripped by Pau Reaves! TURNOVER! (live ball)

[10:18] Team_092 possession (Score: 87-81)
FOUL! Offensive foul on Bones Giddey! Magic Bryant drew the charge! [Team fouls: 1] (Bones Giddey: 1 personal fouls) TURNOVER! (dead ball)

[10:07] Team_084 possession (Score: 87-81)
Chris Parker attempts a 3Pt. Contested by Vince Harris (4.2 feet, ZONE). Chris Parker misses. FOUL! Loose ball foul on Shaquille Russell during the rebound battle. [Team fouls: 2] No free throws, side out. (Shaquille Russell: 1 personal fouls)

[09:50] Team_084 possession (Score: 87-81)
Magic Bryant attempts a 3Pt. Contested by Vince Harris (4.1 feet, ZONE). MAGIC BRYANT MAKES IT! Assist: Dejounte Porzingis
Score: 90-81

[09:31] Team_092 possession (Score: 90-81)
Shaquille Russell attempts a 3Pt. Contested by Chris Parker (5.0 feet, MAN). SHAQUILLE RUSSELL MAKES IT! Assist: Vince Harris
Score: 90-84

[09:15] Team_084 possession (Score: 90-84)
Dejounte Porzingis attempts a Layup. Contested by Pau Reaves (4.9 feet, MAN). DEJOUNTE PORZINGIS MAKES IT! Assist: Pascal Jackson
Score: 92-84

[09:02] Team_092 possession (Score: 92-84)
Shaquille Russell drives, Chris Parker stays with him. Shaquille Russell attempts a Layup. Contested by Chris Parker (5.0 feet, MAN). Shaquille Russell misses. Rebound secured by Pascal Jackson.

[08:47] Team_084 possession (Score: 92-84)
Chris Parker attempts a 3Pt. Contested by Vince Harris (4.2 feet, ZONE). Chris Parker misses. Offensive rebound by Pascal Jackson! Pascal Jackson kicks it out.

[08:30] Team_084 possession (Score: 92-84)
FOUL! Shooting foul on Shaquille Paul. Pascal Jackson to the line for 3 free throws. [Team fouls: 3] (Shaquille Paul: 1 personal fouls)   FT 1/3: MISS   FT 2/3: GOOD   FT 3/3: GOOD Pascal Jackson makes 2/3 from the line.
Score: 94-84

[08:16] Team_092 possession (Score: 94-84)
Shaquille Russell attempts a 3Pt. Contested by Magic Bryant (4.1 feet, ZONE). Shaquille Russell misses. FOUL! Loose ball foul on Evan Quickley during the rebound battle. [Team fouls: 1] No free throws, side out. (Evan Quickley: 1 personal fouls)

[08:02] Team_092 possession (Score: 94-84)
Bones Giddey attempts a 3Pt. Contested by Magic Bryant (3.3 feet, MAN). Bones Giddey misses. Rebound secured by Pascal Jackson.

[07:45] Team_084 possession (Score: 94-84)
Evan Quickley attempts a 3Pt. Contested by Vince Harris (4.0 feet, MAN). EVAN QUICKLEY MAKES IT!
Score: 97-84

[07:26] Team_092 possession (Score: 97-84)
Pau Reaves drives to the basket... Pau Reaves throws a bad pass out of bounds! TURNOVER! (dead ball)

[07:12] Team_084 possession (Score: 97-84)
Magic Bryant drives to the basket... Magic Bryant throws a bad pass! Stolen by Bones Giddey! TURNOVER! (live ball)

[06:57] Team_092 possession (Score: 97-84)
Pau Reaves drives to the basket... Pau Reaves loses control! Ball rolls out of bounds! TURNOVER! (dead ball)

[06:39] Team_084 possession (Score: 97-84)
FOUL! Reach-in foul on Pau Reaves during the drive. [Team fouls: 4] No free throws, side out. (Pau Reaves: 1 personal fouls)

[06:21] Team_084 possession (Score: 97-84)
Pascal Jackson attempts a Layup. Contested by Pau Reaves (5.0 feet, ZONE). PASCAL JACKSON MAKES IT! Assist: Magic Bryant
Score: 99-84

[06:04] Team_092 possession (Score: 99-84)
FOUL! Reach-in foul on Magic Bryant during the drive. [Team fouls: 2] No free throws, side out. (Magic Bryant: 1 personal fouls)

[05:50] Team_092 possession (Score: 99-84)
Shaquille Russell attempts a Midrange. Contested by Evan Quickley (5.3 feet, ZONE). Shaquille Russell misses. Offensive rebound by Shaquille Paul! Shaquille Paul kicks it out.

[05:32] Team_092 possession (Score: 99-84)
FOUL! Holding foul on Pascal Jackson. [Team fouls: 3] No free throws, side out. (Pascal Jackson: 1 personal fouls)

[05:19] Team_092 possession (Score: 99-84)
Vince Harris attempts a 3Pt. Contested by Magic Bryant (3.7 feet, ZONE). Vince Harris misses. Offensive rebound by Shaquille Paul! Shaquille Paul kicks it out.

[05:06] Team_092 possession (Score: 99-84)
Shaquille Russell attempts a 3Pt. Contested by Magic Bryant (4.1 feet, ZONE). Shaquille Russell misses. Rebound secured by Dejounte Porzingis.

[04:48] Team_084 possession (Score: 99-84)
Pascal Jackson attempts a Midrange. Contested by Pau Reaves (5.0 feet, ZONE). Pascal Jackson misses. Rebound secured by Shaquille Paul.

[04:30] Team_092 possession (Score: 99-84)
Bones Giddey attempts a 3Pt. Contested by Magic Bryant (3.3 feet, MAN). Bones Giddey misses. Rebound secured by Evan Quickley.

[04:18] Team_084 possession (Score: 99-84)
Dejounte Porzingis drives, Pau Reaves stays with him. Dejounte Porzingis attempts a Layup. Contested by Pau Reaves (4.9 feet, ZONE). Dejounte Porzingis misses. Rebound secured by Shaquille Paul.

[04:06] Team_092 possession (Score: 99-84)
Vince Harris drives to the basket... Vince Harris throws a bad pass out of bounds! TURNOVER! (dead ball)

[03:55] Team_084 possession (Score: 99-84)
FOUL! Reach-in foul on Pau Reaves during the drive. [IN THE BONUS! 5 team fouls] Chris Parker to the line for 2 free throws. (Pau Reaves: 2 personal fouls)   FT 1/2: GOOD   FT 2/2: GOOD Chris Parker makes 2/2 from the line.
Score: 101-84

[03:43] Team_092 possession (Score: 101-84)
Shaquille Paul makes the Dunk and draws the foul on Magic Bryant! And-1! Shaquille Paul to the line for 1. [Team fouls: 4] (Magic Bryant: 2 personal fouls)   FT 1/1: MISS Shaquille Paul makes 0/1 from the line. Rebound secured by Dejounte Porzingis.
Score: 101-86

[03:27] Team_084 possession (Score: 101-86)
Pascal Jackson loses control! Ball rolls out of bounds! TURNOVER! (dead ball)

[03:15] Team_092 possession (Score: 101-86)
Bones Giddey attempts a Layup. Contested by Dejounte Porzingis (4.7 feet, ZONE). Bones Giddey misses. Rebound secured by Pascal Jackson.

[03:03] Team_084 possession (Score: 101-86)
Pascal Jackson makes the Dunk and draws the foul on Shaquille Russell! And-1! Pascal Jackson to the line for 1. [BONUS: 6 team fouls] (Shaquille Russell: 2 personal fouls)   FT 1/1: GOOD Pascal Jackson makes 1/1 from the line.
Score: 104-86

[02:44] Team_092 possession (Score: 104-86)
Pau Reaves drives to the basket... Pau Reaves loses the ball! Stripped by Dejounte Porzingis! TURNOVER! (live ball)

[02:32] Team_084 possession (Score: 104-86)
FOUL! Holding foul on Bones Giddey. [IN THE BONUS! 7 team fouls] Magic Bryant to the line for 2 free throws. (Bones Giddey: 2 personal fouls)   FT 1/2: GOOD   FT 2/2: GOOD Magic Bryant makes 2/2 from the line.
Score: 106-86

[02:16] Team_092 possession (Score: 106-86)
Shaquille Paul drives and kicks out. Shaquille Russell attempts a Midrange. Contested by Chris Parker (4.7 feet, MAN). SHAQUILLE RUSSELL MAKES IT! Assist: Bones Giddey
Score: 106-88

[02:01] Team_084 possession (Score: 106-88)
Magic Bryant attempts a 3Pt. Contested by Vince Harris (4.3 feet, ZONE). MAGIC BRYANT MAKES IT! Assist: Evan Quickley
Score: 109-88

[01:48] Team_092 possession (Score: 109-88)
FOUL! Reach-in foul on Dejounte Porzingis during the drive. [IN THE BONUS! 5 team fouls] Pau Reaves to the line for 2 free throws. (Dejounte Porzingis: 1 personal fouls)   FT 1/2: GOOD   FT 2/2: GOOD Pau Reaves makes 2/2 from the line.
Score: 109-90

[01:32] Team_084 possession (Score: 109-90)
Dejounte Porzingis attempts a Midrange. Contested by Shaquille Russell (4.5 feet, ZONE). Dejounte Porzingis misses. Offensive rebound by Pascal Jackson! Pascal Jackson kicks it out.

[01:15] Team_084 possession (Score: 109-90)
Pascal Jackson attempts a Layup. Contested by Pau Reaves (5.2 feet, ZONE). Pascal Jackson misses. Rebound secured by Pau Reaves.

[01:02] Team_092 possession (Score: 109-90)
FOUL! Holding foul on Pascal Jackson. [IN THE BONUS! 6 team fouls] Shaquille Paul to the line for 2 free throws. (Pascal Jackson: 2 personal fouls)   FT 1/2: GOOD   FT 2/2: GOOD Shaquille Paul makes 2/2 from the line.
Score: 109-92

[00:45] Team_084 possession (Score: 109-92)
Magic Bryant attempts a Midrange. Contested by Vince Harris (4.4 feet, ZONE). Magic Bryant misses. Rebound secured by Shaquille Paul.

[00:34] Team_092 possession (Score: 109-92)
Bones Giddey drives to the basket... Bones Giddey throws a bad pass! Stolen by Dejounte Porzingis! TURNOVER! (live ball)

[00:23] Team_084 possession (Score: 109-92)
Evan Quickley attempts a 3Pt. Contested by Vince Harris (4.3 feet, ZONE). Evan Quickley misses. Rebound secured by Pau Reaves.

[00:08] Team_092 possession (Score: 109-92)
Bones Giddey attempts a Midrange. Contested by Chris Parker (4.5 feet, ZONE). BONES GIDDEY MAKES IT!
Score: 109-94

================================================================================
                              4TH QUARTER COMPLETE                              
================================================================================

4TH QUARTER SCORE: Team_084 22, Team_092 15

BOX SCORE:
================================================================================

Team_084
--------------------------------------------------------------------------------
Player                MIN  PTS  REB  AST  TO      FG   FG%      3P   3P%
--------------------------------------------------------------------------------
Magic Bryant           16    8    0    1   0   3/4    75.0     0/0   0.0
Pascal Jackson         16    7    5    1   0   3/5    60.0     0/0   0.0
Evan Quickley          16    3    1    1   0   1/2    50.0     0/0   0.0
Dejounte Porzingis     16    2    3    1   0   1/2    50.0     0/0   0.0
Chris Parker           16    2    0    0   0   1/1   100.0     0/0   0.0
Dejounte Ginobili      32    0    1    0   0   0/2     0.0     0/0   0.0
Luka Sexton            32    0    0    0   0   0/1     0.0     0/0   0.0

TEAM: FG: 9/17 (52.9%), 3PT: 4/7 (57.1%), REB: 10 (3 off, 7 def), AST: 4, TO: 3
TEAM FOULS: 6 [Team_092 in BONUS]


Team_092
--------------------------------------------------------------------------------
Player                MIN  PTS  REB  AST  TO      FG   FG%      3P   3P%
--------------------------------------------------------------------------------
Shaquille Russell      16    5    0    0   0   2/4    50.0     0/0   0.0
Austin Bridges         32    2    0    0   0   1/1   100.0     0/0   0.0
Pau Reaves             16    2    3    0   0   1/1   100.0     0/0   0.0
Bones Giddey           16    2    0    1   0   1/4    25.0     0/0   0.0
Shaquille Paul         16    2    5    0   0   1/2    50.0     0/0   0.0
John Giddey            32    0    1    0   0   0/1     0.0     0/0   0.0
Immanuel Ingram        32    0    1    0   0   0/0     0.0     0/0   0.0
Paul James             32    0    1    0   0   0/0     0.0     0/0   0.0
Vince Harris           16    0    0    1   0   0/0     0.0     0/0   0.0

TEAM: FG: 6/13 (46.2%), 3PT: 1/4 (25.0%), REB: 11 (3 off, 8 def), AST: 2, TO: 7
TEAM FOULS: 7 [Team_084 in BONUS]

================================================================================

================================================================================
                               FULL GAME COMPLETE                               
================================================================================

FINAL SCORE: Team_084 109, Team_092 94

SCORING BY QUARTER:
--------------------------------------------------------------------------------
Team                     Q1     Q2     Q3     Q4    FINAL
--------------------------------------------------------------------------------
Team_084                 30     31     26     22      109
Team_092                 27     26     26     15       94
--------------------------------------------------------------------------------

FULL GAME BOX SCORE:
================================================================================

Team_084
--------------------------------------------------------------------------------
Player                MIN  PTS  REB  AST  TO      FG   FG%      3P   3P%      FT STL BLK
--------------------------------------------------------------------------------
Luka Sexton            32    5    0    4   0   3/10   30.0   1/4    25.0   2/3     0   0
Dejounte Ginobili      32   20    8    2   0   8/13   61.5   2/5    40.0   2/2     0   1
Klay Thompson          32    6    4    3   0   2/6    33.3   2/2   100.0   1/2     1   2
Jarrett Booker         32   12    0    2   1   5/11   45.5   2/4    50.0   0/0     0   1
Giannis Quickley       32   25   12    2   2  10/13   76.9   1/2    50.0   4/5     1   0
Magic Bryant           16   11    0    2   0   3/4    75.0   2/2   100.0   3/3     0   0
Chris Parker           16    7    0    0   2   3/4    75.0   1/2    50.0   2/2     0   0
Evan Quickley          16    6    3    2   0   2/4    50.0   2/4    50.0   0/0     0   0
Pascal Jackson         16    9    6    2   1   4/6    66.7   1/1   100.0   3/4     1   0
Dejounte Porzingis     16    4    3    3   1   2/5    40.0   0/1     0.0   0/0     2   0

TEAM: FG: 43/77 (55.8%), 3PT: 14/27 (51.9%), REB: 36 (11 off, 25 def), AST: 22, TO: 7


Team_092
--------------------------------------------------------------------------------
Player                MIN  PTS  REB  AST  TO      FG   FG%      3P   3P%      FT STL BLK
--------------------------------------------------------------------------------
Austin Bridges         32    6    0    3   2   3/5    60.0   0/0     0.0   0/2     0   1
Karl Gobert            32   19    0    0   2   9/14   64.3   4/5    80.0   4/6     0   0
Paul James             32   18   12    1   2   7/9    77.8   5/7    71.4   4/5     0   0
John Giddey            32   12   14    7   3   5/12   41.7   0/3     0.0   4/5     0   1
Immanuel Ingram        32   11   10    2   1   4/5    80.0   0/0     0.0   2/2     1   0
Bones Giddey           16    4    0    2   4   2/5    40.0   0/2     0.0   0/0     1   0
Shaquille Russell      16    7    2    1   0   2/4    50.0   1/2    50.0   2/2     0   0
Vince Harris           16    3    0    1   1   1/2    50.0   0/1     0.0   1/1     0   0
Shaquille Paul         16    4    7    0   3   2/3    66.7   0/0     0.0   2/3     0   0
Pau Reaves             16    6    3    0   1   3/4    75.0   0/1     0.0   2/2     1   0

TEAM: FG: 39/64 (60.9%), 3PT: 10/21 (47.6%), REB: 48 (14 off, 34 def), AST: 17, TO: 19

================================================================================
