================================================================================
                        FULL GAME - Team_071 vs Team_005                        
================================================================================

================================================================================
                       1ST QUARTER - Team_071 vs Team_005                       
================================================================================

[12:00] Team_071 possession (Score: 0-0)
Victor Anunoby loses the ball! Stripped by Anthony Rozier! TURNOVER! (live ball)

[11:45] Team_005 possession (Score: 0-0)
Anthony Rozier attempts a 3Pt. Contested by Victor Anunoby (4.2 feet, MAN). Anthony Rozier misses. Rebound secured by Jimmy Simons.

[11:32] Team_071 possession (Score: 0-0)
Bam Iverson attempts a 3Pt. Contested by Brandon George (5.3 feet, ZONE). BAM IVERSON MAKES IT! Assist: Victor Anunoby
Score: 3-0

[11:13] Team_005 possession (Score: 3-0)
Brandon George attempts a 3Pt. Contested by Victor Anunoby (4.4 feet, ZONE). BRANDON GEORGE MAKES IT! Assist: Anthony Rozier
Score: 3-3

[10:55] Team_071 possession (Score: 3-3)
Bam Iverson drives, Derrick Allen stays with him. Bam Iverson attempts a Dunk. Contested by Derrick Allen (4.3 feet, MAN). BAM IVERSON MAKES IT!
Score: 5-3

[10:40] Team_005 possession (Score: 5-3)
Anthony Rozier drives to the basket... FOUL! Offensive foul on Anthony Rozier! Dejounte Paul drew the charge! [Team fouls: 1] (Anthony Rozier: 1 personal fouls) TURNOVER! (dead ball)

[10:25] Team_071 possession (Score: 5-3)
FOUL! Shooting foul on Anthony Rozier. Jimmy Simons to the line for 2 free throws. [Team fouls: 2] (Anthony Rozier: 2 personal fouls)   FT 1/2: GOOD   FT 2/2: GOOD Jimmy Simons makes 2/2 from the line.
Score: 7-3

[10:15] Team_005 possession (Score: 7-3)
Jalen Rozier attempts a 3Pt. Contested by Jimmy Simons (4.4 feet, MAN). JALEN ROZIER MAKES IT! Assist: Derrick Allen
Score: 7-6

[09:58] Team_071 possession (Score: 7-6)
Bam Iverson attempts a Midrange. Contested by Derrick Allen (4.3 feet, MAN). Bam Iverson misses. Rebound secured by Jalen Rozier.

[09:39] Team_005 possession (Score: 7-6)
Derrick Allen attempts a Midrange. Contested by Bam Iverson (3.9 feet, MAN). Derrick Allen misses. Offensive rebound by Cade Markkanen! Cade Markkanen's putback is no good. Rebound secured by Bam Iverson.

[09:25] Team_071 possession (Score: 7-6)
Allen Williamson drives, Brandon George stays with him. Allen Williamson attempts a Dunk. Contested by Brandon George (5.6 feet, MAN). ALLEN WILLIAMSON MAKES IT!
Score: 9-6

[09:07] Team_005 possession (Score: 9-6)
Anthony Rozier attempts a 3Pt. Contested by Victor Anunoby (4.2 feet, MAN). ANTHONY ROZIER MAKES IT! Assist: Cade Markkanen
Score: 9-9

[08:56] Team_071 possession (Score: 9-9)
Dejounte Paul attempts a Layup. Contested by Cade Markkanen (3.6 feet, ZONE). DEJOUNTE PAUL MAKES IT! Assist: Victor Anunoby
Score: 11-9

[08:44] Team_005 possession (Score: 11-9)
Derrick Allen attempts a 3Pt. Contested by Bam Iverson (3.9 feet, MAN). Derrick Allen misses. Offensive rebound by Cade Markkanen! Cade Markkanen's putback is no good. Offensive rebound by Cade Markkanen! Cade Markkanen kicks it out.

[08:31] Team_005 possession (Score: 11-9)
Cade Markkanen attempts a 3Pt. Contested by Jimmy Simons (3.9 feet, ZONE). Cade Markkanen misses. Rebound secured by Dejounte Paul.

[08:13] Team_071 possession (Score: 11-9)
Victor Anunoby attempts a Midrange. Contested by Anthony Rozier (4.6 feet, MAN). VICTOR ANUNOBY MAKES IT!
Score: 13-9

[07:57] Team_005 possession (Score: 13-9)
Jalen Rozier attempts a 3Pt. Contested by Victor Anunoby (4.5 feet, ZONE). Jalen Rozier misses. Offensive rebound by Cade Markkanen! Cade Markkanen puts it back in!
Score: 13-11

[07:41] Team_071 possession (Score: 13-11)
Victor Anunoby attempts a 3Pt. Contested by Anthony Rozier (4.6 feet, MAN). VICTOR ANUNOBY MAKES IT! Assist: Allen Williamson
Score: 16-11

[07:27] Team_005 possession (Score: 16-11)
Jalen Rozier makes the Layup and draws the foul on Jimmy Simons! And-1! Jalen Rozier to the line for 1. [Team fouls: 1] (Jimmy Simons: 1 personal fouls)   FT 1/1: GOOD Jalen Rozier makes 1/1 from the line.
Score: 16-14

[07:10] Team_071 possession (Score: 16-14)
Dejounte Paul drives and kicks out. Bam Iverson attempts a Midrange. Contested by Derrick Allen (4.2 feet, MAN). BAM IVERSON MAKES IT!
Score: 18-14

[06:59] Team_005 possession (Score: 18-14)
Anthony Rozier throws a bad pass out of bounds! TURNOVER! (dead ball)

[06:43] Team_071 possession (Score: 18-14)
Allen Williamson attempts a 3Pt. Contested by Brandon George (5.6 feet, MAN). Allen Williamson misses. Rebound secured by Cade Markkanen.

[06:23] Team_005 possession (Score: 18-14)
Jalen Rozier attempts a Midrange. Contested by Jimmy Simons (4.4 feet, MAN). JALEN ROZIER MAKES IT!
Score: 18-16

[06:09] Team_071 possession (Score: 18-16)
Victor Anunoby makes the Layup and draws the foul on Cade Markkanen! And-1! Victor Anunoby to the line for 1. [Team fouls: 3] (Cade Markkanen: 1 personal fouls)   FT 1/1: GOOD Victor Anunoby makes 1/1 from the line.
Score: 21-16

[05:57] Team_005 possession (Score: 21-16)
Cade Markkanen drives, Dejounte Paul stays with him. Cade Markkanen attempts a Layup. Contested by Dejounte Paul (3.9 feet, ZONE). Cade Markkanen misses. Rebound secured by Dejounte Paul.

[05:40] Team_071 possession (Score: 21-16)
Victor Anunoby attempts a 3Pt. Contested by Anthony Rozier (4.6 feet, MAN). Victor Anunoby misses. Rebound secured by Jalen Rozier.

[05:24] Team_005 possession (Score: 21-16)
Jalen Rozier attempts a 3Pt. Contested by Jimmy Simons (4.4 feet, MAN). JALEN ROZIER MAKES IT! Assist: Derrick Allen
Score: 21-19

[05:08] Team_071 possession (Score: 21-19)
Bam Iverson attempts a 3Pt. Contested by Derrick Allen (4.3 feet, MAN). BAM IVERSON MAKES IT! Assist: Victor Anunoby
Score: 24-19

[04:55] Team_005 possession (Score: 24-19)
Cade Markkanen makes the Midrange and draws the foul on Dejounte Paul! And-1! Cade Markkanen to the line for 1. [Team fouls: 2] (Dejounte Paul: 1 personal fouls)   FT 1/1: MISS Cade Markkanen makes 0/1 from the line. Rebound secured by Bam Iverson.
Score: 24-21

[04:39] Team_071 possession (Score: 24-21)
Jimmy Simons drives, picks up Cade Markkanen. Help arrives from Anthony Rozier! Jimmy Simons attempts a Dunk. Contested by Anthony Rozier (3.4 feet, MAN). JIMMY SIMONS MAKES IT!
Score: 26-21

[04:23] Team_005 possession (Score: 26-21)
Brandon George attempts a 3Pt. Contested by Victor Anunoby (4.4 feet, ZONE). Brandon George misses. Offensive rebound by Jalen Rozier! Jalen Rozier kicks it out.

[04:04] Team_005 possession (Score: 26-21)
Cade Markkanen attempts a Midrange. Contested by Dejounte Paul (4.0 feet, MAN). Cade Markkanen misses. Offensive rebound by Cade Markkanen! Cade Markkanen puts it back in!
Score: 26-23

[03:50] Team_071 possession (Score: 26-23)
Victor Anunoby attempts a 3Pt. Contested by Derrick Allen (4.3 feet, ZONE). Victor Anunoby misses. Offensive rebound by Jimmy Simons! Jimmy Simons kicks it out.

[03:37] Team_071 possession (Score: 26-23)
Bam Iverson drives and kicks out. Bam Iverson attempts a 3Pt. Contested by Derrick Allen (4.3 feet, MAN). Bam Iverson misses. Rebound secured by Cade Markkanen.

[03:18] Team_005 possession (Score: 26-23)
FOUL! Reach-in foul on Dejounte Paul during the drive. [Team fouls: 3] No free throws, side out. (Dejounte Paul: 2 personal fouls)

[03:05] Team_005 possession (Score: 26-23)
Anthony Rozier attempts a 3Pt. Contested by Victor Anunoby (4.4 feet, ZONE). ANTHONY ROZIER MAKES IT! Assist: Brandon George
Score: 26-26

[02:47] Team_071 possession (Score: 26-26)
Bam Iverson attempts a Layup. Contested by Cade Markkanen (3.6 feet, ZONE). BAM IVERSON MAKES IT!
Score: 28-26

[02:35] Team_005 possession (Score: 28-26)
Anthony Rozier attempts a 3Pt. Contested by Victor Anunoby (4.4 feet, ZONE). Anthony Rozier misses. Rebound secured by Bam Iverson.

[02:20] Team_071 possession (Score: 28-26)
Dejounte Paul attempts a Midrange. BLOCKED BY CADE MARKKANEN! Ball is loose! Rebound secured by Cade Markkanen.

[02:06] Team_005 possession (Score: 28-26)
Derrick Allen attempts a Layup. Contested by Dejounte Paul (4.7 feet, ZONE). Derrick Allen misses. Rebound secured by Bam Iverson.

[01:52] Team_071 possession (Score: 28-26)
Allen Williamson attempts a Layup. Contested by Cade Markkanen (4.1 feet, ZONE). Allen Williamson misses. Rebound secured by Derrick Allen.

[01:38] Team_005 possession (Score: 28-26)
Brandon George attempts a Midrange. Contested by Allen Williamson (4.3 feet, MAN). Brandon George misses. Rebound secured by Dejounte Paul.

[01:26] Team_071 possession (Score: 28-26)
Bam Iverson attempts a 3Pt. Contested by Derrick Allen (4.6 feet, ZONE). Bam Iverson misses. Offensive rebound by Jimmy Simons! Jimmy Simons kicks it out.

[01:09] Team_071 possession (Score: 28-26)
Jimmy Simons attempts a 3Pt. Contested by Jalen Rozier (5.3 feet, MAN). Jimmy Simons misses. Offensive rebound by Jimmy Simons! Jimmy Simons kicks it out.

[00:59] Team_071 possession (Score: 28-26)
FOUL! Reach-in foul on Cade Markkanen during the drive. [Team fouls: 4] No free throws, side out. (Cade Markkanen: 2 personal fouls)

[00:39] Team_071 possession (Score: 28-26)
Jimmy Simons attempts a Midrange. Contested by Jalen Rozier (5.3 feet, ZONE). Jimmy Simons misses. Offensive rebound by Jimmy Simons! Jimmy Simons kicks it out.

[00:29] Team_071 possession (Score: 28-26)
Jimmy Simons attempts a Layup. Contested by Jalen Rozier (5.3 feet, MAN). Jimmy Simons misses. Rebound secured by Derrick Allen.

[00:19] Team_005 possession (Score: 28-26)
FOUL! Holding foul on Allen Williamson. [Team fouls: 4] No free throws, side out. (Allen Williamson: 1 personal fouls)

[00:04] Team_005 possession (Score: 28-26)
Cade Markkanen attempts a Layup. Contested by Dejounte Paul (4.4 feet, MAN). CADE MARKKANEN MAKES IT!
Score: 28-28

================================================================================
                              1ST QUARTER COMPLETE                              
================================================================================

1ST QUARTER SCORE: Team_071 28, Team_005 28

BOX SCORE:
================================================================================

Team_071
--------------------------------------------------------------------------------
Player                MIN  PTS  REB  AST  TO      FG   FG%      3P   3P%
--------------------------------------------------------------------------------
Bam Iverson            12   12    4    0   0   5/7    71.4     0/0   0.0
Victor Anunoby         12    8    0    3   0   3/4    75.0     0/0   0.0
Jimmy Simons           12    4    5    0   0   2/3    66.7     0/0   0.0
Allen Williamson       12    2    0    1   0   1/3    33.3     0/0   0.0
Dejounte Paul          12    2    3    0   0   1/2    50.0     0/0   0.0

TEAM: FG: 12/19 (63.2%), 3PT: 3/5 (60.0%), REB: 11 (4 off, 7 def), AST: 4, TO: 1
TEAM FOULS: 4


Team_005
--------------------------------------------------------------------------------
Player                MIN  PTS  REB  AST  TO      FG   FG%      3P   3P%
--------------------------------------------------------------------------------
Jalen Rozier           12   11    3    0   0   4/4   100.0     0/0   0.0
Anthony Rozier         12    6    0    1   0   2/4    50.0     0/0   0.0
Cade Markkanen         12    6    6    1   0   3/6    50.0     0/0   0.0
Brandon George         12    3    0    1   0   1/2    50.0     0/0   0.0
Derrick Allen          12    0    2    2   0   0/2     0.0     0/0   0.0

TEAM: FG: 10/18 (55.6%), 3PT: 6/9 (66.7%), REB: 12 (5 off, 7 def), AST: 5, TO: 2
TEAM FOULS: 4

================================================================================

================================================================================
                       2ND QUARTER - Team_071 vs Team_005                       
================================================================================

[12:00] Team_071 possession (Score: 28-28)
Victor Anunoby attempts a Midrange. Contested by Brandon George (5.5 feet, ZONE). VICTOR ANUNOBY MAKES IT! Assist: Jimmy Simons
Score: 30-28

[11:44] Team_005 possession (Score: 30-28)
Cade Markkanen drives to the basket... Cade Markkanen throws a bad pass! Stolen by Dejounte Paul! TURNOVER! (live ball)

[11:33] Team_071 possession (Score: 30-28)
Allen Williamson attempts a Midrange. Contested by Jalen Rozier (5.6 feet, ZONE). ALLEN WILLIAMSON MAKES IT! Assist: Dejounte Paul
Score: 32-28

[11:15] Team_005 possession (Score: 32-28)
Jalen Rozier attempts a 3Pt. Contested by Jimmy Simons (4.8 feet, MAN). Jalen Rozier misses. FOUL! Loose ball foul on Dejounte Paul during the rebound battle. [Team fouls: 1] No free throws, side out. (Dejounte Paul: 1 personal fouls)

[10:59] Team_005 possession (Score: 32-28)
Anthony Rozier attempts a 3Pt. Contested by Victor Anunoby (4.6 feet, MAN). Anthony Rozier misses. Offensive rebound by Cade Markkanen! Cade Markkanen kicks it out.

[10:43] Team_005 possession (Score: 32-28)
Jalen Rozier drives to the basket... Jalen Rozier loses control! Ball rolls out of bounds! TURNOVER! (dead ball)

[10:43] Substitution (Team_071): Allen Williamson OUT → Evan Sexton IN (stamina_rule2)

[10:43] Substitution (Team_071): Victor Anunoby OUT → Paul Ball IN (stamina_rule2)

[10:43] Substitution (Team_071): Bam Iverson OUT → Immanuel Ginobili IN (stamina_rule2)

[10:43] Substitution (Team_071): Jimmy Simons OUT → Jordan Durant IN (stamina_rule2)

[10:43] Substitution (Team_071): Dejounte Paul OUT → Tyrese Brogdon IN (stamina_rule2)

[10:43] Substitution (Team_005): Brandon George OUT → Blake O'Neal IN (stamina_rule2)

[10:43] Substitution (Team_005): Anthony Rozier OUT → Draymond Smith IN (stamina_rule2)

[10:43] Substitution (Team_005): Derrick Allen OUT → Lauri Wade IN (stamina_rule2)

[10:43] Substitution (Team_005): Jalen Rozier OUT → Isaiah Durant IN (stamina_rule2)

[10:43] Substitution (Team_005): Cade Markkanen OUT → Zion Parker IN (stamina_rule2)

[10:29] Team_071 possession (Score: 32-28)
Jordan Durant drives and kicks out. Tyrese Brogdon attempts a 3Pt. Contested by Lauri Wade (5.0 feet, ZONE). TYRESE BROGDON MAKES IT! Assist: Immanuel Ginobili
Score: 35-28

[10:15] Team_005 possession (Score: 35-28)
Draymond Smith attempts a 3Pt. Contested by Paul Ball (4.1 feet, ZONE). Draymond Smith misses. Rebound secured by Evan Sexton.

[09:56] Team_071 possession (Score: 35-28)
Jordan Durant attempts a 3Pt. Contested by Isaiah Durant (4.3 feet, MAN). JORDAN DURANT MAKES IT! Assist: Tyrese Brogdon
Score: 38-28

[09:40] Team_005 possession (Score: 38-28)
Isaiah Durant attempts a 3Pt. Contested by Jordan Durant (5.0 feet, MAN). Isaiah Durant misses. Offensive rebound by Zion Parker! Zion Parker puts it back in!
Score: 38-30

[09:27] Team_071 possession (Score: 38-30)
Jordan Durant attempts a Layup. BLOCKED BY ISAIAH DURANT! Ball is loose! Rebound secured by Zion Parker.

[09:13] Team_005 possession (Score: 38-30)
Lauri Wade drives and kicks out. Lauri Wade attempts a 3Pt. Contested by Immanuel Ginobili (4.2 feet, MAN). Lauri Wade misses. Rebound secured by Evan Sexton.

[08:56] Team_071 possession (Score: 38-30)
Evan Sexton attempts a Layup. Contested by Blake O'Neal (4.6 feet, MAN). EVAN SEXTON MAKES IT! Assist: Paul Ball
Score: 40-30

[08:39] Team_005 possession (Score: 40-30)
FOUL! Shooting foul on Tyrese Brogdon. Draymond Smith to the line for 2 free throws. [Team fouls: 2] (Tyrese Brogdon: 1 personal fouls)   FT 1/2: GOOD   FT 2/2: MISS Draymond Smith makes 1/2 from the line. Offensive rebound by Draymond Smith! Draymond Smith kicks it out.
Score: 40-31

[08:25] Team_005 possession (Score: 40-31)
Draymond Smith attempts a 3Pt. Contested by Paul Ball (4.1 feet, ZONE). Draymond Smith misses. Offensive rebound by Draymond Smith! Draymond Smith kicks it out.

[08:09] Team_005 possession (Score: 40-31)
FOUL! Holding foul on Paul Ball. [Team fouls: 3] No free throws, side out. (Paul Ball: 1 personal fouls)

[07:54] Team_005 possession (Score: 40-31)
Blake O'Neal attempts a 3Pt. Contested by Evan Sexton (5.6 feet, MAN). BLAKE O'NEAL MAKES IT! Assist: Zion Parker
Score: 40-34

[07:37] Team_071 possession (Score: 40-34)
FOUL! Reach-in foul on Zion Parker during the drive. [Team fouls: 1] No free throws, side out. (Zion Parker: 1 personal fouls)

[07:23] Team_071 possession (Score: 40-34)
Paul Ball attempts a Midrange. Contested by Draymond Smith (4.3 feet, MAN). Paul Ball misses. FOUL! Loose ball foul on Zion Parker during the rebound battle. [Team fouls: 2] No free throws, side out. (Zion Parker: 2 personal fouls)

[07:11] Team_071 possession (Score: 40-34)
Jordan Durant attempts a 3Pt. Contested by Blake O'Neal (4.0 feet, ZONE). Jordan Durant misses. Rebound secured by Zion Parker.

[06:56] Team_005 possession (Score: 40-34)
Lauri Wade attempts a 3Pt. Contested by Immanuel Ginobili (4.3 feet, MAN). Lauri Wade misses. Rebound secured by Evan Sexton.

[06:42] Team_071 possession (Score: 40-34)
Immanuel Ginobili attempts a 3Pt. Contested by Blake O'Neal (4.0 feet, ZONE). Immanuel Ginobili misses. Rebound secured by Draymond Smith.

[06:26] Team_005 possession (Score: 40-34)
Isaiah Durant drives, picks up Tyrese Brogdon. Help arrives from Evan Sexton! Isaiah Durant attempts a Layup. Contested by Evan Sexton (5.9 feet, ZONE). ISAIAH DURANT MAKES IT!
Score: 40-36

[06:09] Team_071 possession (Score: 40-36)
FOUL! Shooting foul on Blake O'Neal. Tyrese Brogdon to the line for 2 free throws. [Team fouls: 3] (Blake O'Neal: 1 personal fouls)   FT 1/2: GOOD   FT 2/2: GOOD Tyrese Brogdon makes 2/2 from the line.
Score: 42-36

[05:52] Team_005 possession (Score: 42-36)
Lauri Wade drives, picks up Immanuel Ginobili. Help arrives from Evan Sexton! Lauri Wade attempts a Dunk. Contested by Evan Sexton (4.3 feet, MAN). Lauri Wade misses. Rebound secured by Immanuel Ginobili.

[05:36] Team_071 possession (Score: 42-36)
Jordan Durant drives and kicks out. Paul Ball attempts a 3Pt. Contested by Draymond Smith (4.3 feet, MAN). PAUL BALL MAKES IT! Assist: Jordan Durant
Score: 45-36

[05:22] Team_005 possession (Score: 45-36)
Isaiah Durant attempts a Layup. Contested by Jordan Durant (5.0 feet, MAN). Isaiah Durant misses. Rebound secured by Jordan Durant.

[05:08] Team_071 possession (Score: 45-36)
FOUL! Shooting foul on Zion Parker. Paul Ball to the line for 2 free throws. [Team fouls: 4] (Zion Parker: 3 personal fouls)   FT 1/2: GOOD   FT 2/2: GOOD Paul Ball makes 2/2 from the line.
Score: 47-36

[04:56] Team_005 possession (Score: 47-36)
FOUL! Shooting foul on Jordan Durant. Isaiah Durant to the line for 2 free throws. [Team fouls: 4] (Jordan Durant: 1 personal fouls)   FT 1/2: GOOD   FT 2/2: GOOD Isaiah Durant makes 2/2 from the line.
Score: 47-38

[04:44] Team_071 possession (Score: 47-38)
Immanuel Ginobili attempts a Layup. Contested by Lauri Wade (5.0 feet, MAN). Immanuel Ginobili misses. Rebound secured by Draymond Smith.

[04:32] Team_005 possession (Score: 47-38)
Blake O'Neal attempts a Midrange. Contested by Paul Ball (4.7 feet, ZONE). Blake O'Neal misses. Rebound secured by Immanuel Ginobili.

[04:20] Team_071 possession (Score: 47-38)
FOUL! Shooting foul on Blake O'Neal. Tyrese Brogdon to the line for 2 free throws. [BONUS: 5 team fouls] (Blake O'Neal: 2 personal fouls)   FT 1/2: GOOD   FT 2/2: GOOD Tyrese Brogdon makes 2/2 from the line.
Score: 49-38

[04:02] Team_005 possession (Score: 49-38)
Zion Parker makes the Layup and draws the foul on Tyrese Brogdon! And-1! Zion Parker to the line for 1. [BONUS: 5 team fouls] (Tyrese Brogdon: 2 personal fouls)   FT 1/1: MISS Zion Parker makes 0/1 from the line. Rebound secured by Jordan Durant.
Score: 49-40

[03:49] Team_071 possession (Score: 49-40)
Paul Ball makes the Midrange and draws the foul on Isaiah Durant! And-1! Paul Ball to the line for 1. [BONUS: 6 team fouls] (Isaiah Durant: 1 personal fouls)   FT 1/1: GOOD Paul Ball makes 1/1 from the line.
Score: 52-40

[03:33] Team_005 possession (Score: 52-40)
FOUL! Shooting foul on Immanuel Ginobili. Lauri Wade to the line for 2 free throws. [BONUS: 6 team fouls] (Immanuel Ginobili: 1 personal fouls)   FT 1/2: GOOD   FT 2/2: MISS Lauri Wade makes 1/2 from the line. Rebound secured by Evan Sexton.
Score: 52-41

[03:17] Team_071 possession (Score: 52-41)
Evan Sexton makes the Dunk and draws the foul on Blake O'Neal! And-1! Evan Sexton to the line for 1. [BONUS: 7 team fouls] (Blake O'Neal: 3 personal fouls)   FT 1/1: GOOD Evan Sexton makes 1/1 from the line.
Score: 55-41

[03:00] Team_005 possession (Score: 55-41)
Zion Parker attempts a Midrange. Contested by Evan Sexton (5.3 feet, ZONE). Zion Parker misses. Rebound secured by Jordan Durant.

[02:47] Team_071 possession (Score: 55-41)
Evan Sexton attempts a 3Pt. Contested by Blake O'Neal (4.6 feet, ZONE). Evan Sexton misses. Rebound secured by Draymond Smith.

[02:32] Team_005 possession (Score: 55-41)
Blake O'Neal drives, Tyrese Brogdon stays with him. Blake O'Neal attempts a Layup. Wide open! Tyrese Brogdon is 6.1 feet away. [ZONE] BLAKE O'NEAL MAKES IT! Assist: Lauri Wade
Score: 55-43

[02:16] Team_071 possession (Score: 55-43)
Immanuel Ginobili attempts a Midrange. Contested by Lauri Wade (5.1 feet, MAN). IMMANUEL GINOBILI MAKES IT! Assist: Tyrese Brogdon
Score: 57-43

[02:01] Team_005 possession (Score: 57-43)
Isaiah Durant attempts a 3Pt. Contested by Evan Sexton (5.6 feet, ZONE). Isaiah Durant misses. Rebound secured by Immanuel Ginobili.

[01:49] Team_071 possession (Score: 57-43)
Jordan Durant drives and kicks out. Jordan Durant attempts a Midrange. Contested by Isaiah Durant (4.6 feet, MAN). Jordan Durant misses. Rebound secured by Lauri Wade.

[01:33] Team_005 possession (Score: 57-43)
Zion Parker drives, Tyrese Brogdon stays with him. Zion Parker attempts a Dunk. Contested by Tyrese Brogdon (5.9 feet, MAN). ZION PARKER MAKES IT!
Score: 57-45

[01:18] Team_071 possession (Score: 57-45)
Immanuel Ginobili attempts a 3Pt. Contested by Lauri Wade (5.2 feet, MAN). Immanuel Ginobili misses. FOUL! Loose ball foul on Draymond Smith during the rebound battle. [IN THE BONUS! 8 team fouls] Jordan Durant to the line for 2 free throws. (Draymond Smith: 1 personal fouls)   FT 1/2: GOOD   FT 2/2: GOOD Jordan Durant makes 2/2 from the line.
Score: 59-45

[01:04] Team_005 possession (Score: 59-45)
Zion Parker makes the Midrange and draws the foul on Tyrese Brogdon! And-1! Zion Parker to the line for 1. [BONUS: 7 team fouls] (Tyrese Brogdon: 3 personal fouls)   FT 1/1: GOOD Zion Parker makes 1/1 from the line.
Score: 59-48

[00:53] Team_071 possession (Score: 59-48)
Paul Ball drives, picks up Draymond Smith. Help arrives from Blake O'Neal! Paul Ball attempts a Layup. Contested by Blake O'Neal (4.5 feet, MAN). Paul Ball misses. Rebound secured by Zion Parker.

[00:41] Team_005 possession (Score: 59-48)
Isaiah Durant attempts a Midrange. Contested by Jordan Durant (5.3 feet, MAN). Isaiah Durant misses. Rebound secured by Evan Sexton.

[00:24] Team_071 possession (Score: 59-48)
Paul Ball attempts a 3Pt. Contested by Blake O'Neal (4.4 feet, ZONE). Paul Ball misses. Offensive rebound by Jordan Durant! Jordan Durant kicks it out.

[00:07] Team_071 possession (Score: 59-48)
Tyrese Brogdon drives to the basket... Tyrese Brogdon loses the ball! Stripped by Zion Parker! TURNOVER! (live ball)

================================================================================
                              2ND QUARTER COMPLETE                              
================================================================================

2ND QUARTER SCORE: Team_071 31, Team_005 20

BOX SCORE:
================================================================================

Team_071
--------------------------------------------------------------------------------
Player                MIN  PTS  REB  AST  TO      FG   FG%      3P   3P%
--------------------------------------------------------------------------------
Paul Ball              11    8    0    1   0   3/4    75.0     0/0   0.0
Tyrese Brogdon         11    7    0    2   0   3/3   100.0     0/0   0.0
Evan Sexton            11    5    5    0   0   2/3    66.7     0/0   0.0
Jordan Durant          11    5    5    1   0   2/5    40.0     0/0   0.0
Victor Anunoby         14    2    0    0   0   1/1   100.0     0/0   0.0
Allen Williamson       14    2    0    0   0   1/1   100.0     0/0   0.0
Immanuel Ginobili      11    2    3    1   0   1/3    33.3     0/0   0.0
Jimmy Simons           14    0    0    1   0   0/0     0.0     0/0   0.0
Dejounte Paul          14    0    0    1   0   0/0     0.0     0/0   0.0

TEAM: FG: 13/20 (65.0%), 3PT: 2/5 (40.0%), REB: 13 (2 off, 11 def), AST: 7, TO: 1
TEAM FOULS: 7 [Team_005 in BONUS]


Team_005
--------------------------------------------------------------------------------
Player                MIN  PTS  REB  AST  TO      FG   FG%      3P   3P%
--------------------------------------------------------------------------------
Zion Parker            11    7    4    1   0   3/5    60.0     0/0   0.0
Blake O'Neal           11    5    0    0   0   2/3    66.7     0/0   0.0
Isaiah Durant          11    4    0    0   0   2/5    40.0     0/0   0.0
Cade Markkanen         14    0    2    0   0   0/0     0.0     0/0   0.0
Draymond Smith         11    0    5    0   0   0/1     0.0     0/0   0.0
Lauri Wade             11    0    1    1   0   0/4     0.0     0/0   0.0

TEAM: FG: 7/18 (38.9%), 3PT: 2/5 (40.0%), REB: 12 (5 off, 7 def), AST: 2, TO: 2
TEAM FOULS: 8 [Team_071 in BONUS]

================================================================================

================================================================================
                       3RD QUARTER - Team_071 vs Team_005                       
================================================================================

[12:00] Team_071 possession (Score: 59-48)
Jimmy Simons drives, Cade Markkanen stays with him. Jimmy Simons attempts a Layup. Contested by Cade Markkanen (3.3 feet, MAN). JIMMY SIMONS MAKES IT! Assist: Victor Anunoby
Score: 61-48

[11:45] Team_005 possession (Score: 61-48)
Cade Markkanen drives, Dejounte Paul stays with him. Cade Markkanen attempts a Layup. Contested by Dejounte Paul (3.9 feet, MAN). CADE MARKKANEN MAKES IT! Assist: Jalen Rozier
Score: 61-50

[11:32] Team_071 possession (Score: 61-50)
Bam Iverson loses control! Ball rolls out of bounds! TURNOVER! (dead ball)

[11:20] Team_005 possession (Score: 61-50)
Brandon George attempts a Layup. BLOCKED BY ALLEN WILLIAMSON! Ball is loose! Rebound secured by Bam Iverson.

[11:08] Team_071 possession (Score: 61-50)
Bam Iverson commits a violation (traveling/carry)! TURNOVER! (dead ball)

[10:50] Team_005 possession (Score: 61-50)
FOUL! Offensive foul on Brandon George! Allen Williamson drew the charge! [Team fouls: 1] (Brandon George: 1 personal fouls) TURNOVER! (dead ball)

[10:35] Team_071 possession (Score: 61-50)
FOUL! Shooting foul on Derrick Allen. Bam Iverson to the line for 2 free throws. [Team fouls: 2] (Derrick Allen: 1 personal fouls)   FT 1/2: GOOD   FT 2/2: GOOD Bam Iverson makes 2/2 from the line.
Score: 63-50

[10:18] Team_005 possession (Score: 63-50)
Cade Markkanen makes the Layup and draws the foul on Jimmy Simons! And-1! Cade Markkanen to the line for 1. [Team fouls: 1] (Jimmy Simons: 1 personal fouls)   FT 1/1: GOOD Cade Markkanen makes 1/1 from the line.
Score: 63-53

[10:07] Team_071 possession (Score: 63-53)
Victor Anunoby attempts a Midrange. Contested by Anthony Rozier (4.6 feet, MAN). Victor Anunoby misses. Rebound secured by Jalen Rozier.

[09:51] Team_005 possession (Score: 63-53)
Cade Markkanen attempts a Midrange. Contested by Jimmy Simons (3.9 feet, ZONE). Cade Markkanen misses. Rebound secured by Dejounte Paul.

[09:39] Team_071 possession (Score: 63-53)
Victor Anunoby attempts a 3Pt. Contested by Anthony Rozier (4.6 feet, MAN). VICTOR ANUNOBY MAKES IT! Assist: Dejounte Paul
Score: 66-53

[09:28] Team_005 possession (Score: 66-53)
FOUL! Holding foul on Bam Iverson. [Team fouls: 2] No free throws, side out. (Bam Iverson: 1 personal fouls)

[09:17] Team_005 possession (Score: 66-53)
Cade Markkanen makes the Layup and draws the foul on Allen Williamson! And-1! Cade Markkanen to the line for 1. [Team fouls: 3] (Allen Williamson: 1 personal fouls)   FT 1/1: GOOD Cade Markkanen makes 1/1 from the line.
Score: 66-56

[09:05] Team_071 possession (Score: 66-56)
Victor Anunoby attempts a 3Pt. Contested by Anthony Rozier (4.6 feet, MAN). Victor Anunoby misses. Rebound secured by Derrick Allen.

[08:49] Team_005 possession (Score: 66-56)
FOUL! Holding foul on Allen Williamson. [Team fouls: 4] No free throws, side out. (Allen Williamson: 2 personal fouls)

[08:31] Team_005 possession (Score: 66-56)
Cade Markkanen drives to the basket... Cade Markkanen loses the ball! Stripped by Dejounte Paul! TURNOVER! (live ball)

[08:15] Team_071 possession (Score: 66-56)
Bam Iverson attempts a Layup. Contested by Derrick Allen (4.3 feet, MAN). BAM IVERSON MAKES IT! Assist: Dejounte Paul
Score: 68-56

[08:02] Team_005 possession (Score: 68-56)
Brandon George attempts a Midrange. Contested by Victor Anunoby (4.4 feet, ZONE). Brandon George misses. Rebound secured by Dejounte Paul.

[07:46] Team_071 possession (Score: 68-56)
Jimmy Simons attempts a 3Pt. Contested by Cade Markkanen (3.3 feet, MAN). Jimmy Simons misses. Offensive rebound by Jimmy Simons! Jimmy Simons kicks it out.

[07:32] Team_071 possession (Score: 68-56)
Victor Anunoby attempts a 3Pt. Contested by Derrick Allen (4.3 feet, ZONE). VICTOR ANUNOBY MAKES IT! Assist: Dejounte Paul
Score: 71-56

[07:14] Team_005 possession (Score: 71-56)
FOUL! Reach-in foul on Victor Anunoby during the drive. [IN THE BONUS! 5 team fouls] Anthony Rozier to the line for 2 free throws. (Victor Anunoby: 1 personal fouls)   FT 1/2: GOOD   FT 2/2: GOOD Anthony Rozier makes 2/2 from the line.
Score: 71-58

[06:58] Team_071 possession (Score: 71-58)
Dejounte Paul attempts a 3Pt. Contested by Derrick Allen (4.6 feet, ZONE). Dejounte Paul misses. Rebound secured by Derrick Allen.

[06:42] Team_005 possession (Score: 71-58)
FOUL! Shooting foul on Jimmy Simons. Jalen Rozier to the line for 2 free throws. [BONUS: 6 team fouls] (Jimmy Simons: 2 personal fouls)   FT 1/2: GOOD   FT 2/2: GOOD Jalen Rozier makes 2/2 from the line.
Score: 71-60

[06:25] Team_071 possession (Score: 71-60)
Victor Anunoby attempts a Midrange. Contested by Anthony Rozier (4.6 feet, MAN). Victor Anunoby misses. Rebound secured by Derrick Allen.

[06:08] Team_005 possession (Score: 71-60)
Jalen Rozier attempts a 3Pt. Contested by Jimmy Simons (4.4 feet, MAN). Jalen Rozier misses. Rebound secured by Jimmy Simons.

[05:52] Team_071 possession (Score: 71-60)
Dejounte Paul drives, Cade Markkanen stays with him. Dejounte Paul attempts a Layup. Contested by Cade Markkanen (3.7 feet, ZONE). DEJOUNTE PAUL MAKES IT! Assist: Victor Anunoby
Score: 73-60

[05:35] Team_005 possession (Score: 73-60)
FOUL! Shooting foul on Allen Williamson. Brandon George to the line for 3 free throws. [BONUS: 7 team fouls] (Allen Williamson: 3 personal fouls)   FT 1/3: GOOD   FT 2/3: GOOD   FT 3/3: GOOD Brandon George makes 3/3 from the line.
Score: 73-63

[05:21] Team_071 possession (Score: 73-63)
Allen Williamson attempts a Midrange. Contested by Brandon George (5.6 feet, MAN). Allen Williamson misses. Rebound secured by Derrick Allen.

[05:05] Team_005 possession (Score: 73-63)
Jalen Rozier attempts a Midrange. Contested by Jimmy Simons (4.4 feet, MAN). Jalen Rozier misses. Rebound secured by Jimmy Simons.

[04:50] Team_071 possession (Score: 73-63)
Allen Williamson attempts a 3Pt. Contested by Brandon George (5.6 feet, MAN). ALLEN WILLIAMSON MAKES IT! Assist: Bam Iverson
Score: 76-63

[04:39] Team_005 possession (Score: 76-63)
Brandon George attempts a Layup. BLOCKED BY ALLEN WILLIAMSON! Ball deflects out of bounds off Brandon George.

[04:22] Team_071 possession (Score: 76-63)
Bam Iverson attempts a Midrange. Contested by Derrick Allen (4.4 feet, MAN). BAM IVERSON MAKES IT! Assist: Victor Anunoby
Score: 78-63

[04:04] Team_005 possession (Score: 78-63)
Anthony Rozier throws a bad pass! Stolen by Victor Anunoby! TURNOVER! (live ball)

[03:55] Team_071 possession (Score: 78-63)
Allen Williamson attempts a 3Pt. Contested by Derrick Allen (4.7 feet, ZONE). Allen Williamson misses. FOUL! Loose ball foul on Jalen Rozier during the rebound battle. [Team fouls: 3] No free throws, side out. (Jalen Rozier: 1 personal fouls)

[03:44] Team_071 possession (Score: 78-63)
Allen Williamson attempts a 3Pt. Contested by Brandon George (5.7 feet, MAN). Allen Williamson misses. Rebound secured by Derrick Allen.

[03:33] Team_005 possession (Score: 78-63)
Cade Markkanen drives, Dejounte Paul stays with him. Cade Markkanen attempts a Dunk. Contested by Dejounte Paul (4.1 feet, MAN). Cade Markkanen misses. Offensive rebound by Jalen Rozier! Jalen Rozier kicks it out.

[03:19] Team_005 possession (Score: 78-63)
Brandon George drives, Dejounte Paul stays with him. Brandon George attempts a Dunk. Contested by Dejounte Paul (4.5 feet, ZONE). Brandon George misses. Rebound secured by Bam Iverson.

[03:07] Team_071 possession (Score: 78-63)
Jimmy Simons drives, Jalen Rozier stays with him. Jimmy Simons attempts a Layup. Contested by Jalen Rozier (5.1 feet, MAN). JIMMY SIMONS MAKES IT!
Score: 80-63

[02:51] Team_005 possession (Score: 80-63)
Cade Markkanen drives, picks up Dejounte Paul. Help arrives from Allen Williamson! Cade Markkanen attempts a Dunk. Contested by Allen Williamson (4.1 feet, ZONE). CADE MARKKANEN MAKES IT!
Score: 80-65

[02:37] Team_071 possession (Score: 80-65)
FOUL! Reach-in foul on Cade Markkanen during the drive. [Team fouls: 4] No free throws, side out. (Cade Markkanen: 1 personal fouls)

[02:21] Team_071 possession (Score: 80-65)
Jimmy Simons attempts a 3Pt. Contested by Derrick Allen (4.5 feet, ZONE). Jimmy Simons misses. Rebound secured by Jalen Rozier.

[02:06] Team_005 possession (Score: 80-65)
Derrick Allen loses the ball! Stripped by Bam Iverson! TURNOVER! (live ball)

[01:50] Team_071 possession (Score: 80-65)
Dejounte Paul throws a bad pass! Stolen by Cade Markkanen! TURNOVER! (live ball)

[01:41] Team_005 possession (Score: 80-65)
Derrick Allen attempts a 3Pt. Contested by Victor Anunoby (4.9 feet, ZONE). DERRICK ALLEN MAKES IT! Assist: Cade Markkanen
Score: 80-68

[01:27] Team_071 possession (Score: 80-68)
Dejounte Paul attempts a Midrange. Contested by Cade Markkanen (4.2 feet, MAN). DEJOUNTE PAUL MAKES IT! Assist: Bam Iverson
Score: 82-68

[01:15] Team_005 possession (Score: 82-68)
Derrick Allen attempts a Midrange. Contested by Bam Iverson (4.3 feet, MAN). Derrick Allen misses. Rebound secured by Bam Iverson.

[00:59] Team_071 possession (Score: 82-68)
Allen Williamson attempts a 3Pt. Contested by Derrick Allen (5.0 feet, ZONE). Allen Williamson misses. Rebound secured by Cade Markkanen.

[00:41] Team_005 possession (Score: 82-68)
FOUL! Reach-in foul on Dejounte Paul during the drive. [IN THE BONUS! 8 team fouls] Anthony Rozier to the line for 2 free throws. (Dejounte Paul: 1 personal fouls)   FT 1/2: MISS   FT 2/2: GOOD Anthony Rozier makes 1/2 from the line.
Score: 82-69

[00:24] Team_071 possession (Score: 82-69)
Allen Williamson attempts a 3Pt. Contested by Derrick Allen (5.0 feet, ZONE). Allen Williamson misses. Rebound secured by Cade Markkanen.

[00:06] Team_005 possession (Score: 82-69)
Jalen Rozier drives to the basket... Jalen Rozier throws a bad pass! Stolen by Jimmy Simons! TURNOVER! (live ball)

================================================================================
                              3RD QUARTER COMPLETE                              
================================================================================

3RD QUARTER SCORE: Team_071 23, Team_005 21

BOX SCORE:
================================================================================

Team_071
--------------------------------------------------------------------------------
Player                MIN  PTS  REB  AST  TO      FG   FG%      3P   3P%
--------------------------------------------------------------------------------
Victor Anunoby         26    6    0    3   0   2/5    40.0     0/0   0.0
Bam Iverson            26    6    3    2   0   3/3   100.0     0/0   0.0
Jimmy Simons           26    4    4    0   0   2/3    66.7     0/0   0.0
Dejounte Paul          26    4    2    3   0   2/3    66.7     0/0   0.0
Allen Williamson       26    3    0    0   0   1/5    20.0     0/0   0.0

TEAM: FG: 10/19 (52.6%), 3PT: 3/9 (33.3%), REB: 9 (2 off, 7 def), AST: 8, TO: 3
TEAM FOULS: 8 [Team_005 in BONUS]


Team_005
--------------------------------------------------------------------------------
Player                MIN  PTS  REB  AST  TO      FG   FG%      3P   3P%
--------------------------------------------------------------------------------
Cade Markkanen         26   10    2    1   0   4/5    80.0     0/0   0.0
Brandon George         26    3    0    0   0   1/5    20.0     0/0   0.0
Derrick Allen          26    3    5    0   0   1/2    50.0     0/0   0.0
Anthony Rozier         26    3    0    0   0   2/2   100.0     0/0   0.0
Jalen Rozier           26    2    3    1   0   1/3    33.3     0/0   0.0

TEAM: FG: 9/17 (52.9%), 3PT: 2/3 (66.7%), REB: 10 (1 off, 9 def), AST: 2, TO: 5
TEAM FOULS: 4

================================================================================

================================================================================
                       4TH QUARTER - Team_071 vs Team_005                       
================================================================================

[12:00] Team_071 possession (Score: 82-69)
Victor Anunoby attempts a Layup. Contested by Anthony Rozier (5.0 feet, MAN). VICTOR ANUNOBY MAKES IT!
Score: 84-69

[11:50] Team_005 possession (Score: 84-69)
Brandon George attempts a Layup. BLOCKED BY BAM IVERSON! Ball goes out off Bam Iverson. Brandon George's ball!

[11:31] Team_005 possession (Score: 84-69)
Cade Markkanen drives and kicks out. Anthony Rozier attempts a 3Pt. Contested by Victor Anunoby (4.6 feet, ZONE). Anthony Rozier misses. Rebound secured by Jimmy Simons.

[11:13] Team_071 possession (Score: 84-69)
Dejounte Paul makes the Dunk and draws the foul on Anthony Rozier! And-1! Dejounte Paul to the line for 1. [Team fouls: 1] (Anthony Rozier: 1 personal fouls)   FT 1/1: GOOD Dejounte Paul makes 1/1 from the line.
Score: 87-69

[10:57] Team_005 possession (Score: 87-69)
Brandon George drives to the basket... Brandon George loses control! Ball rolls out of bounds! TURNOVER! (dead ball)

[10:57] Substitution (Team_071): Allen Williamson OUT → Evan Sexton IN (stamina_rule2)

[10:57] Substitution (Team_071): Victor Anunoby OUT → Paul Ball IN (stamina_rule2)

[10:57] Substitution (Team_071): Bam Iverson OUT → Immanuel Ginobili IN (stamina_rule2)

[10:57] Substitution (Team_071): Jimmy Simons OUT → Jordan Durant IN (stamina_rule2)

[10:57] Substitution (Team_071): Dejounte Paul OUT → Tyrese Brogdon IN (stamina_rule2)

[10:57] Substitution (Team_005): Brandon George OUT → Blake O'Neal IN (stamina_rule2)

[10:57] Substitution (Team_005): Anthony Rozier OUT → Draymond Smith IN (stamina_rule2)

[10:57] Substitution (Team_005): Derrick Allen OUT → Lauri Wade IN (stamina_rule2)

[10:57] Substitution (Team_005): Jalen Rozier OUT → Isaiah Durant IN (stamina_rule2)

[10:57] Substitution (Team_005): Cade Markkanen OUT → Zion Parker IN (stamina_rule2)

[10:45] Team_071 possession (Score: 87-69)
Immanuel Ginobili attempts a Layup. BLOCKED BY LAURI WADE! Ball deflects out of bounds off Immanuel Ginobili.

[10:32] Team_005 possession (Score: 87-69)
Isaiah Durant attempts a Midrange. Contested by Paul Ball (4.5 feet, ZONE). Isaiah Durant misses. Rebound secured by Evan Sexton.

[10:17] Team_071 possession (Score: 87-69)
FOUL! Shooting foul on Blake O'Neal. Tyrese Brogdon to the line for 2 free throws. [Team fouls: 2] (Blake O'Neal: 1 personal fouls)   FT 1/2: GOOD   FT 2/2: MISS Tyrese Brogdon makes 1/2 from the line. Rebound secured by Lauri Wade.
Score: 88-69

[10:02] Team_005 possession (Score: 88-69)
FOUL! Reach-in foul on Tyrese Brogdon during the drive. [Team fouls: 1] No free throws, side out. (Tyrese Brogdon: 1 personal fouls)

[09:52] Team_005 possession (Score: 88-69)
Draymond Smith loses the ball! Stripped by Paul Ball! TURNOVER! (live ball)

[09:38] Team_071 possession (Score: 88-69)
Jordan Durant attempts a 3Pt. Contested by Isaiah Durant (4.3 feet, MAN). Jordan Durant misses. Offensive rebound by Jordan Durant! Jordan Durant kicks it out.

[09:27] Team_071 possession (Score: 88-69)
Jordan Durant attempts a 3Pt. Contested by Isaiah Durant (4.3 feet, ZONE). Jordan Durant misses. Rebound secured by Lauri Wade.

[09:11] Team_005 possession (Score: 88-69)
Draymond Smith attempts a Midrange. Contested by Paul Ball (4.1 feet, ZONE). DRAYMOND SMITH MAKES IT!
Score: 88-71

[08:56] Team_071 possession (Score: 88-71)
Jordan Durant attempts a Midrange. Contested by Isaiah Durant (4.3 feet, ZONE). Jordan Durant misses. Rebound secured by Zion Parker.

[08:43] Team_005 possession (Score: 88-71)
Lauri Wade attempts a Midrange. Contested by Paul Ball (4.4 feet, ZONE). Lauri Wade misses. Rebound secured by Immanuel Ginobili.

[08:26] Team_071 possession (Score: 88-71)
Tyrese Brogdon attempts a Midrange. Contested by Zion Parker (4.4 feet, MAN). Tyrese Brogdon misses. Offensive rebound by Jordan Durant! Jordan Durant kicks it out.

[08:17] Team_071 possession (Score: 88-71)
Evan Sexton attempts a 3Pt. Contested by Blake O'Neal (4.6 feet, ZONE). Evan Sexton misses. Rebound secured by Draymond Smith.

[08:04] Team_005 possession (Score: 88-71)
Blake O'Neal attempts a Midrange. Contested by Immanuel Ginobili (4.6 feet, ZONE). Blake O'Neal misses. Rebound secured by Immanuel Ginobili.

[07:53] Team_071 possession (Score: 88-71)
FOUL! Shooting foul on Zion Parker. Jordan Durant to the line for 2 free throws. [Team fouls: 3] (Zion Parker: 1 personal fouls)   FT 1/2: GOOD   FT 2/2: GOOD Jordan Durant makes 2/2 from the line.
Score: 90-71

[07:40] Team_005 possession (Score: 90-71)
Isaiah Durant makes the Dunk and draws the foul on Jordan Durant! And-1! Isaiah Durant to the line for 1. [Team fouls: 2] (Jordan Durant: 1 personal fouls)   FT 1/1: GOOD Isaiah Durant makes 1/1 from the line.
Score: 90-74

[07:26] Team_071 possession (Score: 90-74)
Jordan Durant attempts a Layup. Contested by Zion Parker (4.0 feet, ZONE). Jordan Durant misses. Offensive rebound by Immanuel Ginobili! Immanuel Ginobili kicks it out.

[07:09] Team_071 possession (Score: 90-74)
Evan Sexton attempts a Layup. BLOCKED BY BLAKE O'NEAL! Ball is loose! Rebound secured by Zion Parker.

[06:55] Team_005 possession (Score: 90-74)
Draymond Smith drives and kicks out. Lauri Wade attempts a Midrange. Contested by Immanuel Ginobili (4.2 feet, MAN). LAURI WADE MAKES IT!
Score: 90-76

[06:42] Team_071 possession (Score: 90-76)
Evan Sexton attempts a 3Pt. Contested by Blake O'Neal (4.6 feet, ZONE). Evan Sexton misses. Rebound secured by Lauri Wade.

[06:27] Team_005 possession (Score: 90-76)
Isaiah Durant makes the Layup and draws the foul on Tyrese Brogdon! And-1! Isaiah Durant to the line for 1. [Team fouls: 3] (Tyrese Brogdon: 2 personal fouls)   FT 1/1: GOOD Isaiah Durant makes 1/1 from the line.
Score: 90-79

[06:08] Team_071 possession (Score: 90-79)
Evan Sexton attempts a Midrange. Contested by Blake O'Neal (4.6 feet, MAN). EVAN SEXTON MAKES IT! Assist: Jordan Durant
Score: 92-79

[05:53] Team_005 possession (Score: 92-79)
Zion Parker attempts a 3Pt. Contested by Paul Ball (4.3 feet, ZONE). Zion Parker misses. Rebound secured by Immanuel Ginobili.

[05:35] Team_071 possession (Score: 92-79)
Immanuel Ginobili attempts a 3Pt. Contested by Blake O'Neal (4.0 feet, ZONE). Immanuel Ginobili misses. Offensive rebound by Jordan Durant! Jordan Durant kicks it out.

[05:20] Team_071 possession (Score: 92-79)
Immanuel Ginobili attempts a 3Pt. Contested by Lauri Wade (5.0 feet, MAN). IMMANUEL GINOBILI MAKES IT! Assist: Jordan Durant
Score: 95-79

[05:01] Team_005 possession (Score: 95-79)
Blake O'Neal attempts a 3Pt. Contested by Paul Ball (4.7 feet, ZONE). Blake O'Neal misses. Offensive rebound by Zion Parker! Zion Parker's putback is no good. Offensive rebound by Draymond Smith! Draymond Smith kicks it out.

[04:47] Team_005 possession (Score: 95-79)
FOUL! Shooting foul on Tyrese Brogdon. Zion Parker to the line for 2 free throws. [Team fouls: 4] (Tyrese Brogdon: 3 personal fouls)   FT 1/2: GOOD   FT 2/2: GOOD Zion Parker makes 2/2 from the line.
Score: 95-81

[04:34] Team_071 possession (Score: 95-81)
FOUL! Holding foul on Blake O'Neal. [Team fouls: 4] No free throws, side out. (Blake O'Neal: 2 personal fouls)

[04:22] Team_071 possession (Score: 95-81)
Tyrese Brogdon drives and kicks out. Evan Sexton attempts a 3Pt. Contested by Blake O'Neal (4.1 feet, ZONE). EVAN SEXTON MAKES IT! Assist: Immanuel Ginobili
Score: 98-81

[04:09] Team_005 possession (Score: 98-81)
Blake O'Neal attempts a Layup. Wide open! Tyrese Brogdon is 6.1 feet away. [ZONE] BLAKE O'NEAL MAKES IT! Assist: Draymond Smith
Score: 98-83

[03:53] Team_071 possession (Score: 98-83)
FOUL! Reach-in foul on Zion Parker during the drive. [IN THE BONUS! 5 team fouls] Jordan Durant to the line for 2 free throws. (Zion Parker: 2 personal fouls)   FT 1/2: MISS   FT 2/2: GOOD Jordan Durant makes 1/2 from the line.
Score: 99-83

[03:40] Team_005 possession (Score: 99-83)
Blake O'Neal attempts a 3Pt. Contested by Immanuel Ginobili (4.6 feet, ZONE). Blake O'Neal misses. Offensive rebound by Draymond Smith! Draymond Smith kicks it out.

[03:25] Team_005 possession (Score: 99-83)
Draymond Smith attempts a 3Pt. Contested by Paul Ball (4.1 feet, ZONE). Draymond Smith misses. Offensive rebound by Zion Parker! Zion Parker puts it back in!
Score: 99-85

[03:06] Team_071 possession (Score: 99-85)
Tyrese Brogdon drives and kicks out. Tyrese Brogdon attempts a 3Pt. Contested by Blake O'Neal (4.2 feet, ZONE). Tyrese Brogdon misses. Offensive rebound by Jordan Durant! Jordan Durant kicks it out.

[02:50] Team_071 possession (Score: 99-85)
Immanuel Ginobili attempts a 3Pt. Contested by Blake O'Neal (4.2 feet, ZONE). IMMANUEL GINOBILI MAKES IT! Assist: Jordan Durant
Score: 102-85

[02:36] Team_005 possession (Score: 102-85)
Isaiah Durant attempts a 3Pt. Contested by Jordan Durant (5.1 feet, MAN). Isaiah Durant misses. Rebound secured by Evan Sexton.

[02:26] Team_071 possession (Score: 102-85)
Immanuel Ginobili attempts a Midrange. Contested by Lauri Wade (5.1 feet, MAN). Immanuel Ginobili misses. Rebound secured by Draymond Smith.

[02:15] Team_005 possession (Score: 102-85)
Draymond Smith attempts a 3Pt. Contested by Paul Ball (4.2 feet, ZONE). Draymond Smith misses. Rebound secured by Jordan Durant.

[02:01] Team_071 possession (Score: 102-85)
Evan Sexton attempts a 3Pt. Contested by Blake O'Neal (4.8 feet, ZONE). Evan Sexton misses. Rebound secured by Draymond Smith.

[01:46] Team_005 possession (Score: 102-85)
FOUL! Shooting foul on Immanuel Ginobili. Lauri Wade to the line for 2 free throws. [BONUS: 5 team fouls] (Immanuel Ginobili: 1 personal fouls)   FT 1/2: MISS   FT 2/2: MISS Lauri Wade makes 0/2 from the line. FOUL! Loose ball foul on Evan Sexton during the free throw rebound! [IN THE BONUS! 6 team fouls] Draymond Smith to the line for 2 free throws. (Evan Sexton: 1 personal fouls)   FT 1/2: MISS   FT 2/2: GOOD Draymond Smith makes 1/2 from the line.
Score: 102-86

[01:35] Team_071 possession (Score: 102-86)
Jordan Durant drives, Isaiah Durant stays with him. Jordan Durant attempts a Dunk. Contested by Isaiah Durant (4.6 feet, MAN). Jordan Durant misses. Rebound secured by Lauri Wade.

[01:24] Team_005 possession (Score: 102-86)
Isaiah Durant attempts a 3Pt. Contested by Jordan Durant (5.3 feet, MAN). Isaiah Durant misses. Rebound secured by Immanuel Ginobili.

[01:12] Team_071 possession (Score: 102-86)
Jordan Durant attempts a 3Pt. Contested by Blake O'Neal (4.4 feet, ZONE). Jordan Durant misses. Offensive rebound by Immanuel Ginobili! Immanuel Ginobili kicks it out.

[00:59] Team_071 possession (Score: 102-86)
Paul Ball attempts a Layup. Contested by Zion Parker (4.3 feet, ZONE). PAUL BALL MAKES IT!
Score: 104-86

[00:47] Team_005 possession (Score: 104-86)
Isaiah Durant drives, Jordan Durant stays with him. Isaiah Durant attempts a Dunk. Contested by Jordan Durant (5.4 feet, MAN). Isaiah Durant misses. Offensive rebound by Zion Parker! Zion Parker puts it back in!
Score: 104-88

[00:31] Team_071 possession (Score: 104-88)
Tyrese Brogdon drives and kicks out. Jordan Durant attempts a Midrange. Contested by Isaiah Durant (4.8 feet, ZONE). JORDAN DURANT MAKES IT!
Score: 106-88

[00:15] Team_005 possession (Score: 106-88)
Blake O'Neal attempts a Midrange. Contested by Evan Sexton (5.9 feet, MAN). Blake O'Neal misses. Rebound secured by Jordan Durant.

[00:03] Team_071 possession (Score: 106-88)
FOUL! Offensive foul on Paul Ball! Draymond Smith drew the charge! [Team fouls: 7] (Paul Ball: 1 personal fouls) TURNOVER! (dead ball)

================================================================================
                              4TH QUARTER COMPLETE                              
================================================================================

4TH QUARTER SCORE: Team_071 24, Team_005 19

BOX SCORE:
================================================================================

Team_071
--------------------------------------------------------------------------------
Player                MIN  PTS  REB  AST  TO      FG   FG%      3P   3P%
--------------------------------------------------------------------------------
Immanuel Ginobili      22    6    6    1   0   2/4    50.0     0/0   0.0
Evan Sexton            22    5    2    0   0   2/6    33.3     0/0   0.0
Jordan Durant          22    5    6    3   0   3/6    50.0     0/0   0.0
Dejounte Paul          27    3    0    0   0   1/1   100.0     0/0   0.0
Victor Anunoby         27    2    0    0   0   1/1   100.0     0/0   0.0
Paul Ball              22    2    0    0   0   1/1   100.0     0/0   0.0
Jimmy Simons           27    0    1    0   0   0/0     0.0     0/0   0.0
Tyrese Brogdon         22    0    0    0   0   0/1     0.0     0/0   0.0

TEAM: FG: 10/20 (50.0%), 3PT: 2/6 (33.3%), REB: 15 (6 off, 9 def), AST: 4, TO: 1
TEAM FOULS: 7 [Team_005 in BONUS]


Team_005
--------------------------------------------------------------------------------
Player                MIN  PTS  REB  AST  TO      FG   FG%      3P   3P%
--------------------------------------------------------------------------------
Isaiah Durant          22    6    0    0   0   2/5    40.0     0/0   0.0
Zion Parker            22    6    4    0   0   3/4    75.0     0/0   0.0
Draymond Smith         22    3    5    1   0   2/3    66.7     0/0   0.0
Lauri Wade             22    2    4    0   0   1/2    50.0     0/0   0.0
Blake O'Neal           22    2    0    0   0   1/3    33.3     0/0   0.0
Cade Markkanen         27    0    0    0   0   0/1     0.0     0/0   0.0

TEAM: FG: 9/18 (50.0%), 3PT: 1/5 (20.0%), REB: 13 (4 off, 9 def), AST: 1, TO: 2
TEAM FOULS: 5 [Team_071 in BONUS]

================================================================================

================================================================================
                               FULL GAME COMPLETE                               
================================================================================

FINAL SCORE: Team_071 106, Team_005 88

SCORING BY QUARTER:
--------------------------------------------------------------------------------
Team                     Q1     Q2     Q3     Q4    FINAL
--------------------------------------------------------------------------------
Team_071                 28     31     23     24      106
Team_005                 28     20     21     19       88
--------------------------------------------------------------------------------

FULL GAME BOX SCORE:
================================================================================

Team_071
--------------------------------------------------------------------------------
Player                MIN  PTS  REB  AST  TO      FG   FG%      3P   3P%      FT STL BLK
--------------------------------------------------------------------------------
Allen Williamson       27    7    0    1   0   3/9    33.3   1/5    20.0   0/0     0   2
Victor Anunoby         27   18    0    6   1   7/11   63.6   3/5    60.0   1/1     1   0
Bam Iverson            27   18    7    2   2   7/9    77.8   2/2   100.0   2/2     1   1
Jimmy Simons           27    8   10    1   0   4/6    66.7   0/1     0.0   2/2     1   0
Dejounte Paul          27    9    5    4   1   5/7    71.4   0/1     0.0   1/1     2   0
Evan Sexton            22   10    7    0   0   3/8    37.5   0/4     0.0   1/1     0   0
Paul Ball              22   10    0    1   1   3/4    75.0   0/0     0.0   3/3     1   0
Immanuel Ginobili      22    8    9    2   0   4/8    50.0   3/4    75.0   0/0     0   0
Jordan Durant          22   10   11    4   0   5/11   45.5   1/3    33.3   5/6     0   0
Tyrese Brogdon         22    7    0    2   1   4/5    80.0   0/0     0.0   5/6     0   0

TEAM: FG: 45/78 (57.7%), 3PT: 10/25 (40.0%), REB: 48 (14 off, 34 def), AST: 23, TO: 6


Team_005
--------------------------------------------------------------------------------
Player                MIN  PTS  REB  AST  TO      FG   FG%      3P   3P%      FT STL BLK
--------------------------------------------------------------------------------
Brandon George         27    6    0    1   1   2/7    28.6   2/2   100.0   3/3     0   0
Anthony Rozier         27    9    0    1   3   4/6    66.7   2/4    50.0   3/4     1   0
Derrick Allen          27    3    7    2   3   1/4    25.0   1/1   100.0   0/0     0   0
Jalen Rozier           27   13    6    1   2   6/8    75.0   3/4    75.0   3/3     0   0
Cade Markkanen         27   16   10    2   1   6/11   54.5   0/1     0.0   2/3     1   1
Blake O'Neal           22    7    0    0   0   3/6    50.0   1/1   100.0   0/0     0   1
Draymond Smith         22    3   10    1   1   3/5    60.0   1/3    33.3   1/2     0   0
Lauri Wade             22    2    5    1   0   1/6    16.7   0/1     0.0   1/4     0   1
Isaiah Durant          22   10    0    0   0   6/12   50.0   1/4    25.0   4/4     0   1
Zion Parker            22   13    8    1   0   3/6    50.0   0/1     0.0   3/4     1   0

TEAM: FG: 35/71 (49.3%), 3PT: 11/22 (50.0%), REB: 47 (15 off, 32 def), AST: 10, TO: 11

================================================================================
