================================================================================
                        FULL GAME - Team_060 vs Team_010                        
================================================================================

================================================================================
                       1ST QUARTER - Team_060 vs Team_010                       
================================================================================

[12:00] Team_060 possession (Score: 0-0)
Julius Green attempts a Midrange. Contested by Michael Turner (3.8 feet, ZONE). Julius Green misses. Offensive rebound by Jaren George! Jaren George puts it back in!
Score: 2-0

[11:45] Team_010 possession (Score: 2-0)
RJ Young drives and kicks out. Michael Turner attempts a 3Pt. Contested by Julius Green (3.8 feet, ZONE). MICHAEL TURNER MAKES IT! Assist: RJ Young
Score: 2-3

[11:27] Team_060 possession (Score: 2-3)
Larry Westbrook drives to the basket... Larry Westbrook throws a bad pass! Stolen by Desmond Antetokounmpo! TURNOVER! (live ball)

[11:17] Team_010 possession (Score: 2-3)
Anthony Durant drives to the basket... Anthony Durant throws a bad pass! Stolen by Jaren George! TURNOVER! (live ball)

[11:02] Team_060 possession (Score: 2-3)
Joel Morant attempts a 3Pt. Contested by Cade Morant (3.6 feet, ZONE). Joel Morant misses. Rebound secured by Desmond Antetokounmpo.

[10:47] Team_010 possession (Score: 2-3)
Michael Turner loses control! Ball rolls out of bounds! TURNOVER! (dead ball)

[10:32] Team_060 possession (Score: 2-3)
Joel Morant attempts a Midrange. Contested by Cade Morant (3.6 feet, MAN). JOEL MORANT MAKES IT!
Score: 4-3

[10:18] Team_010 possession (Score: 4-3)
Desmond Antetokounmpo attempts a 3Pt. Contested by Larry Westbrook (4.8 feet, MAN). Desmond Antetokounmpo misses. Rebound secured by Immanuel Ming.

[10:06] Team_060 possession (Score: 4-3)
Julius Green attempts a 3Pt. Contested by Michael Turner (3.8 feet, MAN). Julius Green misses. Offensive rebound by Jaren George! Jaren George's putback is no good. Offensive rebound by Jaren George! Jaren George kicks it out.

[09:50] Team_060 possession (Score: 4-3)
Jaren George attempts a Layup. Contested by Anthony Durant (3.6 feet, MAN). Jaren George misses. Rebound secured by Desmond Antetokounmpo.

[09:37] Team_010 possession (Score: 4-3)
Cade Morant attempts a 3Pt. Contested by Joel Morant (5.8 feet, MAN). CADE MORANT MAKES IT! Assist: Anthony Durant
Score: 4-6

[09:22] Team_060 possession (Score: 4-6)
Larry Westbrook attempts a 3Pt. Contested by Cade Morant (4.4 feet, ZONE). Larry Westbrook misses. Rebound secured by Desmond Antetokounmpo.

[09:09] Team_010 possession (Score: 4-6)
FOUL! Shooting foul on Jaren George. Anthony Durant to the line for 2 free throws. [Team fouls: 1] (Jaren George: 1 personal fouls)   FT 1/2: GOOD   FT 2/2: GOOD Anthony Durant makes 2/2 from the line.
Score: 4-8

[08:55] Team_060 possession (Score: 4-8)
Larry Westbrook attempts a 3Pt. Contested by Cade Morant (4.4 feet, ZONE). Larry Westbrook misses. Rebound secured by Anthony Durant.

[08:39] Team_010 possession (Score: 4-8)
Cade Morant drives, Joel Morant stays with him. Cade Morant attempts a Layup. Contested by Joel Morant (5.8 feet, MAN). CADE MORANT MAKES IT! Assist: Anthony Durant
Score: 4-10

[08:25] Team_060 possession (Score: 4-10)
FOUL! Holding foul on RJ Young. [Team fouls: 2] No free throws, side out. (RJ Young: 1 personal fouls)

[08:07] Team_060 possession (Score: 4-10)
Julius Green throws a bad pass! Stolen by Michael Turner! TURNOVER! (live ball)

[07:52] Team_010 possession (Score: 4-10)
Desmond Antetokounmpo attempts a Midrange. Contested by Larry Westbrook (4.8 feet, MAN). Desmond Antetokounmpo misses. Offensive rebound by Anthony Durant! Anthony Durant kicks it out.

[07:37] Team_010 possession (Score: 4-10)
RJ Young attempts a Midrange. Contested by Immanuel Ming (3.5 feet, ZONE). RJ Young misses. FOUL! Loose ball foul on Larry Westbrook during the rebound battle. [Team fouls: 2] No free throws, side out. (Larry Westbrook: 1 personal fouls)

[07:23] Team_010 possession (Score: 4-10)
Cade Morant attempts a 3Pt. Contested by Julius Green (4.3 feet, ZONE). Cade Morant misses. Rebound secured by Immanuel Ming.

[07:05] Team_060 possession (Score: 4-10)
Joel Morant attempts a Layup. BLOCKED BY CADE MORANT! Ball is loose! Offensive rebound by Immanuel Ming! Immanuel Ming kicks it out.

[06:54] Team_060 possession (Score: 4-10)
Julius Green attempts a Midrange. Contested by Desmond Antetokounmpo (4.1 feet, ZONE). Julius Green misses. FOUL! Loose ball foul on Desmond Antetokounmpo during the rebound battle. [Team fouls: 3] No free throws, side out. (Desmond Antetokounmpo: 1 personal fouls)

[06:41] Team_060 possession (Score: 4-10)
Larry Westbrook drives, Anthony Durant stays with him. Larry Westbrook attempts a Dunk. Contested by Anthony Durant (4.0 feet, ZONE). Larry Westbrook misses. Offensive rebound by Jaren George! Jaren George's putback is no good. Offensive rebound by Immanuel Ming! Immanuel Ming kicks it out.

[06:25] Team_060 possession (Score: 4-10)
Larry Westbrook drives, Anthony Durant stays with him. Larry Westbrook attempts a Layup. Contested by Anthony Durant (4.0 feet, ZONE). LARRY WESTBROOK MAKES IT! Assist: Julius Green
Score: 6-10

[06:08] Team_010 possession (Score: 6-10)
RJ Young throws a bad pass out of bounds! TURNOVER! (dead ball)

[05:55] Team_060 possession (Score: 6-10)
Larry Westbrook drives and kicks out. Immanuel Ming attempts a Midrange. Contested by Michael Turner (4.0 feet, ZONE). Immanuel Ming misses. Rebound secured by Desmond Antetokounmpo.

[05:41] Team_010 possession (Score: 6-10)
Cade Morant attempts a 3Pt. Contested by Julius Green (4.3 feet, ZONE). Cade Morant misses. Rebound secured by Jaren George.

[05:28] Team_060 possession (Score: 6-10)
Larry Westbrook attempts a Midrange. Contested by Desmond Antetokounmpo (4.7 feet, ZONE). Larry Westbrook misses. FOUL! Loose ball foul on Michael Turner during the rebound battle. [IN THE BONUS! 5 team fouls] Immanuel Ming to the line for 2 free throws. (Michael Turner: 1 personal fouls)   FT 1/2: GOOD   FT 2/2: MISS Immanuel Ming makes 1/2 from the line. Offensive rebound by Jaren George! Jaren George's putback is no good.
Score: 7-10

[05:09] Team_010 possession (Score: 7-10)
Cade Morant attempts a 3Pt. Contested by Julius Green (4.3 feet, ZONE). Cade Morant misses. Rebound secured by Larry Westbrook.

[04:55] Team_060 possession (Score: 7-10)
Immanuel Ming drives to the basket... Immanuel Ming loses the ball! Stripped by Desmond Antetokounmpo! TURNOVER! (live ball)

[04:38] Team_010 possession (Score: 7-10)
Desmond Antetokounmpo attempts a Midrange. Contested by Immanuel Ming (3.8 feet, ZONE). DESMOND ANTETOKOUNMPO MAKES IT! Assist: Anthony Durant
Score: 7-12

[04:25] Team_060 possession (Score: 7-12)
Larry Westbrook drives and kicks out. Julius Green attempts a 3Pt. Contested by Cade Morant (4.0 feet, ZONE). Julius Green misses. Offensive rebound by Jaren George! Jaren George's putback is no good. Rebound secured by Michael Turner.

[04:07] Team_010 possession (Score: 7-12)
RJ Young attempts a 3Pt. Contested by Julius Green (3.7 feet, ZONE). RJ Young misses. Rebound secured by Immanuel Ming.

[03:53] Team_060 possession (Score: 7-12)
Larry Westbrook attempts a 3Pt. Contested by Desmond Antetokounmpo (4.8 feet, MAN). Larry Westbrook misses. Rebound secured by Anthony Durant.

[03:40] Team_010 possession (Score: 7-12)
Cade Morant attempts a 3Pt. Contested by Julius Green (4.4 feet, ZONE). Cade Morant misses. Offensive rebound by Anthony Durant! Anthony Durant kicks it out.

[03:26] Team_010 possession (Score: 7-12)
RJ Young attempts a Midrange. Contested by Immanuel Ming (3.6 feet, ZONE). RJ YOUNG MAKES IT!
Score: 7-14

[03:16] Team_060 possession (Score: 7-14)
FOUL! Shooting foul on Cade Morant. Joel Morant to the line for 2 free throws. [BONUS: 6 team fouls] (Cade Morant: 2 personal fouls)   FT 1/2: GOOD   FT 2/2: GOOD Joel Morant makes 2/2 from the line.
Score: 9-14

[02:58] Team_010 possession (Score: 9-14)
FOUL! Offensive foul on RJ Young! Immanuel Ming drew the charge! [Team fouls: 7] (RJ Young: 2 personal fouls) TURNOVER! (dead ball)

[02:39] Team_060 possession (Score: 9-14)
Jaren George attempts a Midrange. Contested by Anthony Durant (3.9 feet, MAN). JAREN GEORGE MAKES IT! Assist: Joel Morant
Score: 11-14

[02:20] Team_010 possession (Score: 11-14)
FOUL! Shooting foul on Julius Green. Michael Turner to the line for 2 free throws. [Team fouls: 3] (Julius Green: 1 personal fouls)   FT 1/2: MISS   FT 2/2: GOOD Michael Turner makes 1/2 from the line.
Score: 11-15

[02:01] Team_060 possession (Score: 11-15)
Immanuel Ming drives, RJ Young stays with him. Immanuel Ming attempts a Layup. Contested by RJ Young (4.9 feet, MAN). Immanuel Ming misses. Rebound secured by Anthony Durant.

[01:47] Team_010 possession (Score: 11-15)
Desmond Antetokounmpo attempts a 3Pt. Contested by Julius Green (4.2 feet, ZONE). DESMOND ANTETOKOUNMPO MAKES IT!
Score: 11-18

[01:31] Team_060 possession (Score: 11-18)
Larry Westbrook attempts a Midrange. Contested by Desmond Antetokounmpo (5.0 feet, MAN). LARRY WESTBROOK MAKES IT! Assist: Immanuel Ming
Score: 13-18

[01:18] Team_010 possession (Score: 13-18)
FOUL! Reach-in foul on Larry Westbrook during the drive. [Team fouls: 4] No free throws, side out. (Larry Westbrook: 2 personal fouls)

[01:07] Team_010 possession (Score: 13-18)
RJ Young attempts a 3Pt. Contested by Immanuel Ming (3.8 feet, MAN). RJ Young misses. Rebound secured by Immanuel Ming.

[00:52] Team_060 possession (Score: 13-18)
Immanuel Ming commits a violation (traveling/carry)! TURNOVER! (dead ball)

[00:52] Substitution (Team_060): Joel Morant OUT → Domantas Barnes IN (stamina_rule2)

[00:52] Substitution (Team_060): Julius Green OUT → Rudy Ginobili IN (stamina_rule2)

[00:52] Substitution (Team_060): Immanuel Ming OUT → Jarrett Wagner IN (stamina_rule2)

[00:52] Substitution (Team_060): Larry Westbrook OUT → Yao Tatum IN (stamina_rule2)

[00:52] Substitution (Team_060): Jaren George OUT → Klay Haliburton IN (stamina_rule2)

[00:52] Substitution (Team_010): Cade Morant OUT → Draymond Leonard IN (stamina_rule2)

[00:52] Substitution (Team_010): Michael Turner OUT → Blake Harden IN (stamina_rule2)

[00:52] Substitution (Team_010): RJ Young OUT → Ben Gilgeous-Alexander IN (stamina_rule2)

[00:52] Substitution (Team_010): Desmond Antetokounmpo OUT → Vince Ingram IN (stamina_rule2)

[00:52] Substitution (Team_010): Anthony Durant OUT → Paolo Wade IN (stamina_rule2)

[00:39] Team_010 possession (Score: 13-18)
Paolo Wade drives, picks up Klay Haliburton. Help arrives from Domantas Barnes! Paolo Wade attempts a Layup. Contested by Domantas Barnes (4.5 feet, ZONE). PAOLO WADE MAKES IT! Assist: Ben Gilgeous-Alexander
Score: 13-20

[00:27] Team_060 possession (Score: 13-20)
Yao Tatum attempts a 3Pt. Contested by Draymond Leonard (4.4 feet, ZONE). YAO TATUM MAKES IT! Assist: Klay Haliburton
Score: 16-20

[00:11] Team_010 possession (Score: 16-20)
Paolo Wade attempts a Midrange. Contested by Klay Haliburton (4.5 feet, MAN). Paolo Wade misses. Rebound secured by Klay Haliburton.

================================================================================
                              1ST QUARTER COMPLETE                              
================================================================================

1ST QUARTER SCORE: Team_060 16, Team_010 20

BOX SCORE:
================================================================================

Team_060
--------------------------------------------------------------------------------
Player                MIN  PTS  REB  AST  TO      FG   FG%      3P   3P%
--------------------------------------------------------------------------------
Jaren George           11    4    4    0   0   2/3    66.7     0/0   0.0
Joel Morant            11    4    0    1   0   2/3    66.7     0/0   0.0
Larry Westbrook        11    4    1    0   0   2/8    25.0     0/0   0.0
Yao Tatum               1    3    0    0   0   1/1   100.0     0/0   0.0
Immanuel Ming          11    0    7    1   0   0/1     0.0     0/0   0.0
Julius Green           11    0    0    1   0   0/0     0.0     0/0   0.0
Klay Haliburton         1    0    1    1   0   0/0     0.0     0/0   0.0

TEAM: FG: 7/16 (43.8%), 3PT: 1/5 (20.0%), REB: 14 (7 off, 7 def), AST: 4, TO: 4
TEAM FOULS: 4


Team_010
--------------------------------------------------------------------------------
Player                MIN  PTS  REB  AST  TO      FG   FG%      3P   3P%
--------------------------------------------------------------------------------
Desmond Antetokounmpo   11    5    4    0   0   2/3    66.7     0/0   0.0
Cade Morant            11    5    0    0   0   2/5    40.0     0/0   0.0
Michael Turner         11    4    1    0   0   2/2   100.0     0/0   0.0
RJ Young               11    2    0    1   0   1/3    33.3     0/0   0.0
Anthony Durant         11    2    6    3   0   1/1   100.0     0/0   0.0
Paolo Wade              1    2    0    0   0   1/2    50.0     0/0   0.0
Ben Gilgeous-Alexander    1    0    0    1   0   0/0     0.0     0/0   0.0

TEAM: FG: 9/16 (56.2%), 3PT: 2/8 (25.0%), REB: 10 (3 off, 7 def), AST: 5, TO: 4
TEAM FOULS: 7 [Team_060 in BONUS]

================================================================================

================================================================================
                       2ND QUARTER - Team_060 vs Team_010                       
================================================================================

[12:00] Team_060 possession (Score: 16-20)
Joel Morant attempts a 3Pt. Contested by Cade Morant (3.8 feet, MAN). Joel Morant misses. Rebound secured by Cade Morant.

[11:50] Team_010 possession (Score: 16-20)
RJ Young attempts a 3Pt. Contested by Immanuel Ming (3.6 feet, MAN). RJ Young misses. Rebound secured by Larry Westbrook.

[11:32] Team_060 possession (Score: 16-20)
Joel Morant drives and kicks out. Joel Morant attempts a 3Pt. Contested by Cade Morant (4.1 feet, MAN). Joel Morant misses. Rebound secured by Michael Turner.

[11:23] Team_010 possession (Score: 16-20)
RJ Young drives and kicks out. Cade Morant attempts a Midrange. Contested by Julius Green (4.0 feet, ZONE). CADE MORANT MAKES IT! Assist: Michael Turner
Score: 16-22

[11:08] Team_060 possession (Score: 16-22)
Immanuel Ming makes the Layup and draws the foul on Cade Morant! And-1! Immanuel Ming to the line for 1. [Team fouls: 1] (Cade Morant: 1 personal fouls)   FT 1/1: MISS Immanuel Ming makes 0/1 from the line. Offensive rebound by Immanuel Ming! Immanuel Ming kicks it out.
Score: 18-22

[10:57] Team_060 possession (Score: 18-22)
Larry Westbrook drives, Anthony Durant stays with him. Larry Westbrook attempts a Layup. Contested by Anthony Durant (4.3 feet, ZONE). LARRY WESTBROOK MAKES IT!
Score: 20-22

[10:48] Team_010 possession (Score: 20-22)
Anthony Durant makes the Layup and draws the foul on Jaren George! And-1! Anthony Durant to the line for 1. [Team fouls: 1] (Jaren George: 1 personal fouls)   FT 1/1: GOOD Anthony Durant makes 1/1 from the line.
Score: 20-25

[10:34] Team_060 possession (Score: 20-25)
Immanuel Ming attempts a 3Pt. Contested by Cade Morant (4.3 feet, ZONE). Immanuel Ming misses. Rebound secured by Michael Turner.

[10:21] Team_010 possession (Score: 20-25)
Anthony Durant throws a bad pass out of bounds! TURNOVER! (dead ball)

[10:21] Substitution (Team_060): Joel Morant OUT → Domantas Barnes IN (stamina_rule2)

[10:21] Substitution (Team_060): Julius Green OUT → Rudy Ginobili IN (stamina_rule2)

[10:21] Substitution (Team_060): Immanuel Ming OUT → Jarrett Wagner IN (stamina_rule2)

[10:21] Substitution (Team_060): Larry Westbrook OUT → Yao Tatum IN (stamina_rule2)

[10:21] Substitution (Team_060): Jaren George OUT → Klay Haliburton IN (stamina_rule2)

[10:21] Substitution (Team_010): Cade Morant OUT → Draymond Leonard IN (stamina_rule2)

[10:21] Substitution (Team_010): Michael Turner OUT → Blake Harden IN (stamina_rule2)

[10:21] Substitution (Team_010): RJ Young OUT → Ben Gilgeous-Alexander IN (stamina_rule2)

[10:21] Substitution (Team_010): Desmond Antetokounmpo OUT → Vince Ingram IN (stamina_rule2)

[10:21] Substitution (Team_010): Anthony Durant OUT → Paolo Wade IN (stamina_rule2)

[10:04] Team_060 possession (Score: 20-25)
Domantas Barnes drives, Draymond Leonard stays with him. Domantas Barnes attempts a Layup. Contested by Draymond Leonard (4.4 feet, MAN). Domantas Barnes misses. Rebound secured by Blake Harden.

[09:45] Team_010 possession (Score: 20-25)
Draymond Leonard drives, picks up Domantas Barnes. Help arrives from Jarrett Wagner! Draymond Leonard attempts a Layup. Contested by Jarrett Wagner (5.0 feet, MAN). DRAYMOND LEONARD MAKES IT! Assist: Paolo Wade
Score: 20-27

[09:31] Team_060 possession (Score: 20-27)
Jarrett Wagner attempts a Midrange. Contested by Paolo Wade (5.3 feet, ZONE). Jarrett Wagner misses. Rebound secured by Ben Gilgeous-Alexander.

[09:15] Team_010 possession (Score: 20-27)
Vince Ingram makes the Dunk and draws the foul on Domantas Barnes! And-1! Vince Ingram to the line for 1. [Team fouls: 2] (Domantas Barnes: 1 personal fouls)   FT 1/1: GOOD Vince Ingram makes 1/1 from the line.
Score: 20-30

[09:04] Team_060 possession (Score: 20-30)
Klay Haliburton makes the Layup and draws the foul on Paolo Wade! And-1! Klay Haliburton to the line for 1. [Team fouls: 2] (Paolo Wade: 1 personal fouls)   FT 1/1: GOOD Klay Haliburton makes 1/1 from the line.
Score: 23-30

[08:45] Team_010 possession (Score: 23-30)
FOUL! Offensive foul on Draymond Leonard! Domantas Barnes drew the charge! [Team fouls: 3] (Draymond Leonard: 1 personal fouls) TURNOVER! (dead ball)

[08:28] Team_060 possession (Score: 23-30)
Klay Haliburton attempts a 3Pt. Contested by Paolo Wade (5.4 feet, MAN). Klay Haliburton misses. Rebound secured by Ben Gilgeous-Alexander.

[08:14] Team_010 possession (Score: 23-30)
Paolo Wade drives, Klay Haliburton stays with him. Paolo Wade attempts a Dunk. Contested by Klay Haliburton (4.5 feet, MAN). PAOLO WADE MAKES IT! Assist: Blake Harden
Score: 23-32

[07:58] Team_060 possession (Score: 23-32)
Rudy Ginobili makes the Layup and draws the foul on Paolo Wade! And-1! Rudy Ginobili to the line for 1. [Team fouls: 4] (Paolo Wade: 2 personal fouls)   FT 1/1: GOOD Rudy Ginobili makes 1/1 from the line.
Score: 26-32

[07:42] Team_010 possession (Score: 26-32)
Draymond Leonard attempts a 3Pt. Contested by Domantas Barnes (5.0 feet, ZONE). DRAYMOND LEONARD MAKES IT! Assist: Paolo Wade
Score: 26-35

[07:25] Team_060 possession (Score: 26-35)
Jarrett Wagner drives to the basket... Jarrett Wagner commits a violation (traveling/carry)! TURNOVER! (dead ball)

[07:10] Team_010 possession (Score: 26-35)
Paolo Wade attempts a Midrange. Contested by Yao Tatum (5.4 feet, ZONE). PAOLO WADE MAKES IT!
Score: 26-37

[06:55] Team_060 possession (Score: 26-37)
Rudy Ginobili attempts a Midrange. BLOCKED BY BLAKE HARDEN! Ball is loose! Rebound secured by Paolo Wade.

[06:42] Team_010 possession (Score: 26-37)
Paolo Wade drives to the basket... Paolo Wade loses the ball! Stripped by Klay Haliburton! TURNOVER! (live ball)

[06:28] Team_060 possession (Score: 26-37)
Yao Tatum attempts a Midrange. Contested by Vince Ingram (5.4 feet, MAN). Yao Tatum misses. Offensive rebound by Domantas Barnes! Domantas Barnes kicks it out.

[06:12] Team_060 possession (Score: 26-37)
Jarrett Wagner drives to the basket... Jarrett Wagner throws a bad pass! Stolen by Paolo Wade! TURNOVER! (live ball)

[05:57] Team_010 possession (Score: 26-37)
Ben Gilgeous-Alexander attempts a Midrange. Contested by Yao Tatum (5.5 feet, ZONE). BEN GILGEOUS-ALEXANDER MAKES IT! Assist: Draymond Leonard
Score: 26-39

[05:44] Team_060 possession (Score: 26-39)
Yao Tatum makes the Midrange and draws the foul on Vince Ingram! And-1! Yao Tatum to the line for 1. [BONUS: 5 team fouls] (Vince Ingram: 1 personal fouls)   FT 1/1: GOOD Yao Tatum makes 1/1 from the line.
Score: 29-39

[05:27] Team_010 possession (Score: 29-39)
Ben Gilgeous-Alexander attempts a 3Pt. Contested by Domantas Barnes (4.8 feet, ZONE). BEN GILGEOUS-ALEXANDER MAKES IT! Assist: Blake Harden
Score: 29-42

[05:17] Team_060 possession (Score: 29-42)
Klay Haliburton attempts a Layup. Contested by Paolo Wade (5.4 feet, MAN). Klay Haliburton misses. Rebound secured by Blake Harden.

[05:03] Team_010 possession (Score: 29-42)
Blake Harden attempts a 3Pt. Contested by Domantas Barnes (4.3 feet, ZONE). Blake Harden misses. Rebound secured by Klay Haliburton.

[04:48] Team_060 possession (Score: 29-42)
Yao Tatum attempts a 3Pt. Contested by Draymond Leonard (4.4 feet, ZONE). Yao Tatum misses. Rebound secured by Blake Harden.

[04:33] Team_010 possession (Score: 29-42)
Vince Ingram drives to the basket... Vince Ingram throws a bad pass! Stolen by Klay Haliburton! TURNOVER! (live ball)

[04:23] Team_060 possession (Score: 29-42)
FOUL! Reach-in foul on Draymond Leonard during the drive. [IN THE BONUS! 6 team fouls] Domantas Barnes to the line for 2 free throws. (Draymond Leonard: 2 personal fouls)   FT 1/2: GOOD   FT 2/2: GOOD Domantas Barnes makes 2/2 from the line.
Score: 31-42

[04:07] Team_010 possession (Score: 31-42)
Blake Harden attempts a Midrange. Contested by Yao Tatum (4.9 feet, ZONE). BLAKE HARDEN MAKES IT!
Score: 31-44

[03:56] Team_060 possession (Score: 31-44)
Rudy Ginobili throws a bad pass out of bounds! TURNOVER! (dead ball)

[03:41] Team_010 possession (Score: 31-44)
Draymond Leonard attempts a 3Pt. Contested by Domantas Barnes (5.0 feet, ZONE). DRAYMOND LEONARD MAKES IT!
Score: 31-47

[03:26] Team_060 possession (Score: 31-47)
Yao Tatum attempts a Layup. Contested by Paolo Wade (5.2 feet, ZONE). Yao Tatum misses. Offensive rebound by Klay Haliburton! Klay Haliburton's putback is no good. Offensive rebound by Domantas Barnes! Domantas Barnes kicks it out.

[03:16] Team_060 possession (Score: 31-47)
FOUL! Holding foul on Draymond Leonard. [IN THE BONUS! 7 team fouls] Domantas Barnes to the line for 2 free throws. (Draymond Leonard: 3 personal fouls)   FT 1/2: GOOD   FT 2/2: MISS Domantas Barnes makes 1/2 from the line. Rebound secured by Blake Harden.
Score: 32-47

[02:58] Team_010 possession (Score: 32-47)
Ben Gilgeous-Alexander attempts a Midrange. Contested by Jarrett Wagner (5.2 feet, MAN). Ben Gilgeous-Alexander misses. Rebound secured by Rudy Ginobili.

[02:46] Team_060 possession (Score: 32-47)
Jarrett Wagner attempts a 3Pt. Contested by Draymond Leonard (4.6 feet, ZONE). JARRETT WAGNER MAKES IT! Assist: Domantas Barnes
Score: 35-47

[02:36] Team_010 possession (Score: 35-47)
Ben Gilgeous-Alexander attempts a Layup. Contested by Klay Haliburton (4.6 feet, ZONE). Ben Gilgeous-Alexander misses. Rebound secured by Domantas Barnes.

[02:22] Team_060 possession (Score: 35-47)
Yao Tatum attempts a Layup. BLOCKED BY BLAKE HARDEN! Ball goes out off Blake Harden. Yao Tatum's ball!

[02:10] Team_060 possession (Score: 35-47)
Klay Haliburton attempts a Layup. Contested by Paolo Wade (5.5 feet, MAN). KLAY HALIBURTON MAKES IT!
Score: 37-47

[01:51] Team_010 possession (Score: 37-47)
Paolo Wade attempts a Midrange. Contested by Jarrett Wagner (5.2 feet, ZONE). Paolo Wade misses. Rebound secured by Domantas Barnes.

[01:36] Team_060 possession (Score: 37-47)
Domantas Barnes attempts a 3Pt. Contested by Draymond Leonard (4.6 feet, MAN). DOMANTAS BARNES MAKES IT! Assist: Rudy Ginobili
Score: 40-47

[01:24] Team_010 possession (Score: 40-47)
Ben Gilgeous-Alexander attempts a Midrange. Contested by Jarrett Wagner (5.3 feet, MAN). Ben Gilgeous-Alexander misses. Rebound secured by Domantas Barnes.

[01:11] Team_060 possession (Score: 40-47)
Yao Tatum drives and kicks out. FOUL! Shooting foul on Ben Gilgeous-Alexander. Jarrett Wagner to the line for 2 free throws. [BONUS: 8 team fouls] (Ben Gilgeous-Alexander: 1 personal fouls)   FT 1/2: MISS   FT 2/2: MISS Jarrett Wagner makes 0/2 from the line. Rebound secured by Blake Harden.

[00:51] Team_010 possession (Score: 40-47)
Paolo Wade attempts a Layup. Contested by Klay Haliburton (4.7 feet, ZONE). PAOLO WADE MAKES IT! Assist: Ben Gilgeous-Alexander
Score: 40-49

[00:33] Team_060 possession (Score: 40-49)
Jarrett Wagner attempts a Midrange. Contested by Ben Gilgeous-Alexander (5.0 feet, ZONE). JARRETT WAGNER MAKES IT! Assist: Rudy Ginobili
Score: 42-49

[00:17] Team_010 possession (Score: 42-49)
Vince Ingram drives to the basket... Vince Ingram throws a bad pass out of bounds! TURNOVER! (dead ball)

[00:03] Team_060 possession (Score: 42-49)
Yao Tatum makes the Layup and draws the foul on Paolo Wade! And-1! Yao Tatum to the line for 1. [BONUS: 9 team fouls] (Paolo Wade: 3 personal fouls)   FT 1/1: GOOD Yao Tatum makes 1/1 from the line.
Score: 45-49

================================================================================
                              2ND QUARTER COMPLETE                              
================================================================================

2ND QUARTER SCORE: Team_060 29, Team_010 29

BOX SCORE:
================================================================================

Team_060
--------------------------------------------------------------------------------
Player                MIN  PTS  REB  AST  TO      FG   FG%      3P   3P%
--------------------------------------------------------------------------------
Yao Tatum              11    6    0    0   0   2/4    50.0     0/0   0.0
Domantas Barnes        11    5    5    1   0   2/3    66.7     0/0   0.0
Jarrett Wagner         11    5    0    0   0   2/3    66.7     0/0   0.0
Klay Haliburton        11    5    1    0   0   2/4    50.0     0/0   0.0
Rudy Ginobili          11    3    1    2   0   1/2    50.0     0/0   0.0
Larry Westbrook        13    2    1    0   0   1/1   100.0     0/0   0.0
Joel Morant            13    0    0    0   0   0/2     0.0     0/0   0.0
Immanuel Ming          13    0    1    0   0   0/1     0.0     0/0   0.0

TEAM: FG: 10/21 (47.6%), 3PT: 2/6 (33.3%), REB: 9 (3 off, 6 def), AST: 3, TO: 3
TEAM FOULS: 2


Team_010
--------------------------------------------------------------------------------
Player                MIN  PTS  REB  AST  TO      FG   FG%      3P   3P%
--------------------------------------------------------------------------------
Draymond Leonard       11    8    0    1   0   3/3   100.0     0/0   0.0
Paolo Wade             11    6    1    2   0   3/4    75.0     0/0   0.0
Ben Gilgeous-Alexander   11    5    2    1   0   2/5    40.0     0/0   0.0
Anthony Durant         13    3    0    0   0   1/1   100.0     0/0   0.0
Vince Ingram           11    3    0    0   0   1/1   100.0     0/0   0.0
Cade Morant            13    2    1    0   0   1/1   100.0     0/0   0.0
Blake Harden           11    2    5    2   0   1/2    50.0     0/0   0.0
RJ Young               13    0    0    0   0   0/1     0.0     0/0   0.0
Michael Turner         13    0    2    1   0   0/0     0.0     0/0   0.0

TEAM: FG: 12/18 (66.7%), 3PT: 3/5 (60.0%), REB: 11 (0 off, 11 def), AST: 7, TO: 5
TEAM FOULS: 9 [Team_060 in BONUS]

================================================================================

================================================================================
                       3RD QUARTER - Team_060 vs Team_010                       
================================================================================

[12:00] Team_060 possession (Score: 45-49)
Joel Morant attempts a 3Pt. Contested by Cade Morant (3.6 feet, ZONE). Joel Morant misses. Rebound secured by Anthony Durant.

[11:50] Team_010 possession (Score: 45-49)
FOUL! Shooting foul on Joel Morant. Cade Morant to the line for 3 free throws. [Team fouls: 1] (Joel Morant: 1 personal fouls)   FT 1/3: MISS   FT 2/3: GOOD   FT 3/3: GOOD Cade Morant makes 2/3 from the line.
Score: 45-51

[11:35] Team_060 possession (Score: 45-51)
Jaren George attempts a Midrange. Contested by Desmond Antetokounmpo (4.4 feet, ZONE). Jaren George misses. Rebound secured by Anthony Durant.

[11:23] Team_010 possession (Score: 45-51)
FOUL! Reach-in foul on Jaren George during the drive. [Team fouls: 2] No free throws, side out. (Jaren George: 1 personal fouls)

[11:08] Team_010 possession (Score: 45-51)
FOUL! Shooting foul on Larry Westbrook. Desmond Antetokounmpo to the line for 2 free throws. [Team fouls: 3] (Larry Westbrook: 1 personal fouls)   FT 1/2: MISS   FT 2/2: GOOD Desmond Antetokounmpo makes 1/2 from the line.
Score: 45-52

[10:55] Team_060 possession (Score: 45-52)
Jaren George attempts a Midrange. Contested by Anthony Durant (3.6 feet, MAN). JAREN GEORGE MAKES IT!
Score: 47-52

[10:45] Team_010 possession (Score: 47-52)
FOUL! Shooting foul on Jaren George. RJ Young to the line for 2 free throws. [Team fouls: 4] (Jaren George: 2 personal fouls)   FT 1/2: GOOD   FT 2/2: GOOD RJ Young makes 2/2 from the line.
Score: 47-54

[10:28] Team_060 possession (Score: 47-54)
Jaren George drives to the basket... Jaren George throws a bad pass! Stolen by Anthony Durant! TURNOVER! (live ball)

[10:16] Team_010 possession (Score: 47-54)
Michael Turner makes the Layup and draws the foul on Julius Green! And-1! Michael Turner to the line for 1. [BONUS: 5 team fouls] (Julius Green: 1 personal fouls)   FT 1/1: GOOD Michael Turner makes 1/1 from the line.
Score: 47-57

[10:05] Team_060 possession (Score: 47-57)
Joel Morant attempts a 3Pt. Contested by Cade Morant (3.6 feet, ZONE). JOEL MORANT MAKES IT! Assist: Jaren George
Score: 50-57

[09:49] Team_010 possession (Score: 50-57)
Desmond Antetokounmpo attempts a Midrange. Contested by Larry Westbrook (4.8 feet, MAN). Desmond Antetokounmpo misses. Rebound secured by Jaren George.

[09:33] Team_060 possession (Score: 50-57)
Immanuel Ming drives to the basket... FOUL! Offensive foul on Immanuel Ming! Desmond Antetokounmpo drew the charge! [Team fouls: 6] (Immanuel Ming: 1 personal fouls) TURNOVER! (dead ball)

[09:14] Team_010 possession (Score: 50-57)
Cade Morant attempts a Midrange. Contested by Immanuel Ming (4.2 feet, ZONE). Cade Morant misses. Rebound secured by Larry Westbrook.

[09:01] Team_060 possession (Score: 50-57)
Larry Westbrook throws a bad pass! Stolen by Desmond Antetokounmpo! TURNOVER! (live ball)

[08:46] Team_010 possession (Score: 50-57)
Anthony Durant attempts a Midrange. Contested by Immanuel Ming (4.0 feet, ZONE). Anthony Durant misses. Rebound secured by Immanuel Ming.

[08:31] Team_060 possession (Score: 50-57)
FOUL! Holding foul on Anthony Durant. [Team fouls: 1] No free throws, side out. (Anthony Durant: 1 personal fouls)

[08:16] Team_060 possession (Score: 50-57)
Jaren George drives, Anthony Durant stays with him. Jaren George attempts a Layup. Contested by Anthony Durant (3.6 feet, ZONE). JAREN GEORGE MAKES IT! Assist: Immanuel Ming
Score: 52-57

[08:01] Team_010 possession (Score: 52-57)
RJ Young attempts a 3Pt. Contested by Immanuel Ming (3.5 feet, MAN). RJ Young misses. Rebound secured by Immanuel Ming.

[07:46] Team_060 possession (Score: 52-57)
Immanuel Ming makes the Layup and draws the foul on Anthony Durant! And-1! Immanuel Ming to the line for 1. [Team fouls: 2] (Anthony Durant: 2 personal fouls)   FT 1/1: GOOD Immanuel Ming makes 1/1 from the line.
Score: 55-57

[07:30] Team_010 possession (Score: 55-57)
Michael Turner drives, Larry Westbrook stays with him. Michael Turner attempts a Layup. Contested by Larry Westbrook (4.9 feet, ZONE). Michael Turner misses. Rebound secured by Jaren George.

[07:11] Team_060 possession (Score: 55-57)
Julius Green attempts a 3Pt. Contested by Michael Turner (3.8 feet, MAN). JULIUS GREEN MAKES IT! Assist: Immanuel Ming
Score: 58-57

[06:56] Team_010 possession (Score: 58-57)
RJ Young attempts a Layup. BLOCKED BY JULIUS GREEN! Ball goes out off Julius Green. RJ Young's ball!

[06:43] Team_010 possession (Score: 58-57)
Michael Turner attempts a Midrange. Contested by Julius Green (4.0 feet, ZONE). Michael Turner misses. Rebound secured by Jaren George.

[06:27] Team_060 possession (Score: 58-57)
Julius Green drives, Michael Turner stays with him. Julius Green attempts a Layup. Contested by Michael Turner (3.8 feet, MAN). Julius Green misses. Rebound secured by Anthony Durant.

[06:14] Team_010 possession (Score: 58-57)
Anthony Durant attempts a Layup. BLOCKED BY JULIUS GREEN! Ball is loose! Offensive rebound by Anthony Durant! Anthony Durant kicks it out.

[05:59] Team_010 possession (Score: 58-57)
Michael Turner drives, picks up Jaren George. Help arrives from Julius Green! Michael Turner attempts a Dunk. Contested by Julius Green (5.5 feet, ZONE). MICHAEL TURNER MAKES IT! Assist: Desmond Antetokounmpo
Score: 58-59

[05:45] Team_060 possession (Score: 58-59)
Jaren George drives, picks up Anthony Durant. Help arrives from Cade Morant! Jaren George attempts a Dunk. Contested by Cade Morant (3.6 feet, MAN). JAREN GEORGE MAKES IT! Assist: Immanuel Ming
Score: 60-59

[05:33] Team_010 possession (Score: 60-59)
FOUL! Shooting foul on Immanuel Ming. RJ Young to the line for 2 free throws. [BONUS: 7 team fouls] (Immanuel Ming: 2 personal fouls)   FT 1/2: MISS   FT 2/2: GOOD RJ Young makes 1/2 from the line.
Score: 60-60

[05:22] Team_060 possession (Score: 60-60)
Jaren George loses the ball! Stripped by Anthony Durant! TURNOVER! (live ball)

[05:11] Team_010 possession (Score: 60-60)
Michael Turner attempts a Midrange. Contested by Julius Green (4.1 feet, MAN). Michael Turner misses. Offensive rebound by Anthony Durant! Anthony Durant kicks it out.

[04:57] Team_010 possession (Score: 60-60)
FOUL! Holding foul on Immanuel Ming. [IN THE BONUS! 8 team fouls] RJ Young to the line for 2 free throws. (Immanuel Ming: 3 personal fouls)   FT 1/2: GOOD   FT 2/2: MISS RJ Young makes 1/2 from the line. Rebound secured by Jaren George.
Score: 60-61

[04:43] Team_060 possession (Score: 60-61)
Immanuel Ming attempts a 3Pt. Contested by Cade Morant (4.0 feet, ZONE). IMMANUEL MING MAKES IT! Assist: Larry Westbrook
Score: 63-61

[04:26] Team_010 possession (Score: 63-61)
Michael Turner loses the ball! Stripped by Julius Green! TURNOVER! (live ball)

[04:10] Team_060 possession (Score: 63-61)
Immanuel Ming drives to the basket... Immanuel Ming throws a bad pass! Stolen by RJ Young! TURNOVER! (live ball)

[04:00] Team_010 possession (Score: 63-61)
Michael Turner attempts a Layup. Contested by Julius Green (4.1 feet, MAN). Michael Turner misses. Rebound secured by Larry Westbrook.

[03:47] Team_060 possession (Score: 63-61)
Immanuel Ming attempts a Midrange. Contested by RJ Young (4.8 feet, MAN). IMMANUEL MING MAKES IT!
Score: 65-61

[03:38] Team_010 possession (Score: 65-61)
FOUL! Offensive foul on Desmond Antetokounmpo! Larry Westbrook drew the charge! [Team fouls: 3] (Desmond Antetokounmpo: 1 personal fouls) TURNOVER! (dead ball)

[03:20] Team_060 possession (Score: 65-61)
Larry Westbrook attempts a Midrange. Contested by Desmond Antetokounmpo (4.9 feet, ZONE). Larry Westbrook misses. Rebound secured by Cade Morant.

[03:03] Team_010 possession (Score: 65-61)
FOUL! Offensive foul on Michael Turner! Julius Green drew the charge! [Team fouls: 4] (Michael Turner: 1 personal fouls) TURNOVER! (dead ball)

[02:48] Team_060 possession (Score: 65-61)
Immanuel Ming attempts a 3Pt. Contested by Cade Morant (4.1 feet, ZONE). IMMANUEL MING MAKES IT! Assist: Joel Morant
Score: 68-61

[02:31] Team_010 possession (Score: 68-61)
Desmond Antetokounmpo attempts a Layup. Contested by Jaren George (5.7 feet, ZONE). Desmond Antetokounmpo misses. Rebound secured by Larry Westbrook.

[02:16] Team_060 possession (Score: 68-61)
Julius Green makes the Layup and draws the foul on Michael Turner! And-1! Julius Green to the line for 1. [BONUS: 5 team fouls] (Michael Turner: 2 personal fouls)   FT 1/1: GOOD Julius Green makes 1/1 from the line.
Score: 71-61

[02:01] Team_010 possession (Score: 71-61)
Desmond Antetokounmpo attempts a 3Pt. Contested by Julius Green (4.2 feet, ZONE). Desmond Antetokounmpo misses. Rebound secured by Larry Westbrook.

[01:45] Team_060 possession (Score: 71-61)
Julius Green loses the ball! Stripped by Michael Turner! TURNOVER! (live ball)

[01:32] Team_010 possession (Score: 71-61)
Desmond Antetokounmpo drives, Larry Westbrook stays with him. Desmond Antetokounmpo attempts a Dunk. Contested by Larry Westbrook (5.2 feet, MAN). DESMOND ANTETOKOUNMPO MAKES IT! Assist: RJ Young
Score: 71-63

[01:18] Team_060 possession (Score: 71-63)
Immanuel Ming attempts a 3Pt. Contested by Michael Turner (4.3 feet, ZONE). Immanuel Ming misses. Offensive rebound by Immanuel Ming! Immanuel Ming kicks it out.

[01:04] Team_060 possession (Score: 71-63)
Julius Green attempts a 3Pt. Contested by Michael Turner (4.2 feet, MAN). Julius Green misses. Rebound secured by Cade Morant.

[00:51] Team_010 possession (Score: 71-63)
Michael Turner attempts a Midrange. Contested by Immanuel Ming (4.3 feet, ZONE). MICHAEL TURNER MAKES IT! Assist: Cade Morant
Score: 71-65

[00:40] Team_060 possession (Score: 71-65)
Julius Green attempts a Layup. Contested by Anthony Durant (3.9 feet, ZONE). JULIUS GREEN MAKES IT! Assist: Immanuel Ming
Score: 73-65

[00:22] Team_010 possession (Score: 73-65)
Cade Morant drives and kicks out. Anthony Durant attempts a 3Pt. Contested by Julius Green (4.3 feet, ZONE). Anthony Durant misses. Rebound secured by Jaren George.

[00:09] Team_060 possession (Score: 73-65)
FOUL! Holding foul on Desmond Antetokounmpo. [IN THE BONUS! 6 team fouls] Larry Westbrook to the line for 2 free throws. (Desmond Antetokounmpo: 2 personal fouls)   FT 1/2: GOOD   FT 2/2: GOOD Larry Westbrook makes 2/2 from the line.
Score: 75-65

================================================================================
                              3RD QUARTER COMPLETE                              
================================================================================

3RD QUARTER SCORE: Team_060 30, Team_010 16

BOX SCORE:
================================================================================

Team_060
--------------------------------------------------------------------------------
Player                MIN  PTS  REB  AST  TO      FG   FG%      3P   3P%
--------------------------------------------------------------------------------
Immanuel Ming          25   11    3    4   0   4/4   100.0     0/0   0.0
Julius Green           25    8    0    0   0   3/5    60.0     0/0   0.0
Jaren George           25    6    5    1   0   3/4    75.0     0/0   0.0
Joel Morant            25    3    0    1   0   1/2    50.0     0/0   0.0
Larry Westbrook        25    2    4    1   0   1/2    50.0     0/0   0.0

TEAM: FG: 12/17 (70.6%), 3PT: 4/6 (66.7%), REB: 12 (1 off, 11 def), AST: 7, TO: 6
TEAM FOULS: 8 [Team_010 in BONUS]


Team_010
--------------------------------------------------------------------------------
Player                MIN  PTS  REB  AST  TO      FG   FG%      3P   3P%
--------------------------------------------------------------------------------
Michael Turner         25    7    0    0   0   3/6    50.0     0/0   0.0
Desmond Antetokounmpo   25    3    0    1   0   2/5    40.0     0/0   0.0
RJ Young               25    3    0    1   0   2/3    66.7     0/0   0.0
Cade Morant            25    2    2    1   0   1/3    33.3     0/0   0.0
Anthony Durant         25    0    5    0   0   0/1     0.0     0/0   0.0

TEAM: FG: 8/19 (42.1%), 3PT: 1/3 (33.3%), REB: 7 (2 off, 5 def), AST: 3, TO: 3
TEAM FOULS: 6 [Team_060 in BONUS]

================================================================================

================================================================================
                       4TH QUARTER - Team_060 vs Team_010                       
================================================================================

[12:00] Team_060 possession (Score: 75-65)
Larry Westbrook drives to the basket... Larry Westbrook throws a bad pass! Stolen by Anthony Durant! TURNOVER! (live ball)

[11:42] Team_010 possession (Score: 75-65)
Michael Turner drives, Julius Green stays with him. Michael Turner attempts a Dunk. Contested by Julius Green (4.3 feet, MAN). MICHAEL TURNER MAKES IT! Assist: Anthony Durant
Score: 75-67

[11:29] Team_060 possession (Score: 75-67)
Immanuel Ming attempts a Layup. Contested by RJ Young (5.0 feet, MAN). Immanuel Ming misses. Offensive rebound by Jaren George! Jaren George puts it back in!
Score: 77-67

[11:16] Team_010 possession (Score: 77-67)
Anthony Durant drives to the basket... Anthony Durant throws a bad pass! Stolen by Jaren George! TURNOVER! (live ball)

[11:00] Team_060 possession (Score: 77-67)
Jaren George drives, picks up Anthony Durant. Help arrives from Cade Morant! Jaren George attempts a Layup. Contested by Cade Morant (4.1 feet, MAN). JAREN GEORGE MAKES IT!
Score: 79-67

[10:46] Team_010 possession (Score: 79-67)
Michael Turner drives, Jaren George stays with him. Michael Turner attempts a Layup. Contested by Jaren George (6.0 feet, ZONE). MICHAEL TURNER MAKES IT! Assist: RJ Young
Score: 79-69

[10:32] Team_060 possession (Score: 79-69)
Immanuel Ming makes the Midrange and draws the foul on RJ Young! And-1! Immanuel Ming to the line for 1. [Team fouls: 1] (RJ Young: 1 personal fouls)   FT 1/1: GOOD Immanuel Ming makes 1/1 from the line.
Score: 82-69

[10:21] Team_010 possession (Score: 82-69)
Anthony Durant attempts a Layup. Wide open! Jaren George is 6.1 feet away. [ZONE] ANTHONY DURANT MAKES IT!
Score: 82-71

[10:05] Team_060 possession (Score: 82-71)
Immanuel Ming drives to the basket... FOUL! Offensive foul on Immanuel Ming! RJ Young drew the charge! [Team fouls: 1] (Immanuel Ming: 1 personal fouls) TURNOVER! (dead ball)

[09:53] Team_010 possession (Score: 82-71)
Cade Morant attempts a 3Pt. Contested by Julius Green (4.8 feet, ZONE). Cade Morant misses. Offensive rebound by Cade Morant! Cade Morant kicks it out.

[09:38] Team_010 possession (Score: 82-71)
Anthony Durant attempts a Midrange. Wide open! Jaren George is 6.1 feet away. [MAN] Anthony Durant misses. Rebound secured by Immanuel Ming.

[09:21] Team_060 possession (Score: 82-71)
Joel Morant throws a bad pass out of bounds! TURNOVER! (dead ball)

[09:21] Substitution (Team_060): Joel Morant OUT → Domantas Barnes IN (stamina_rule2)

[09:21] Substitution (Team_060): Julius Green OUT → Rudy Ginobili IN (stamina_rule2)

[09:21] Substitution (Team_060): Immanuel Ming OUT → Jarrett Wagner IN (stamina_rule2)

[09:21] Substitution (Team_060): Larry Westbrook OUT → Yao Tatum IN (stamina_rule2)

[09:21] Substitution (Team_060): Jaren George OUT → Klay Haliburton IN (stamina_rule2)

[09:21] Substitution (Team_010): Cade Morant OUT → Draymond Leonard IN (stamina_rule2)

[09:21] Substitution (Team_010): Michael Turner OUT → Blake Harden IN (stamina_rule2)

[09:21] Substitution (Team_010): RJ Young OUT → Ben Gilgeous-Alexander IN (stamina_rule2)

[09:21] Substitution (Team_010): Desmond Antetokounmpo OUT → Vince Ingram IN (stamina_rule2)

[09:21] Substitution (Team_010): Anthony Durant OUT → Paolo Wade IN (stamina_rule2)

[09:05] Team_010 possession (Score: 82-71)
Ben Gilgeous-Alexander drives and kicks out. Ben Gilgeous-Alexander attempts a 3Pt. Contested by Jarrett Wagner (4.8 feet, MAN). Ben Gilgeous-Alexander misses. Rebound secured by Rudy Ginobili.

[08:52] Team_060 possession (Score: 82-71)
Klay Haliburton attempts a Layup. Contested by Paolo Wade (5.4 feet, MAN). KLAY HALIBURTON MAKES IT! Assist: Jarrett Wagner
Score: 84-71

[08:34] Team_010 possession (Score: 84-71)
Blake Harden drives, picks up Rudy Ginobili. Help arrives from Domantas Barnes! Blake Harden attempts a Layup. Contested by Domantas Barnes (4.1 feet, MAN). Blake Harden misses. Offensive rebound by Paolo Wade! Paolo Wade kicks it out.

[08:21] Team_010 possession (Score: 84-71)
Draymond Leonard attempts a Midrange. Contested by Rudy Ginobili (4.8 feet, ZONE). DRAYMOND LEONARD MAKES IT! Assist: Ben Gilgeous-Alexander
Score: 84-73

[08:04] Team_060 possession (Score: 84-73)
Jarrett Wagner drives, picks up Paolo Wade. Help arrives from Blake Harden! Jarrett Wagner attempts a Dunk. Contested by Blake Harden (5.3 feet, ZONE). Jarrett Wagner misses. FOUL! Loose ball foul on Blake Harden during the rebound battle. [Team fouls: 2] No free throws, side out. (Blake Harden: 1 personal fouls)

[07:50] Team_060 possession (Score: 84-73)
FOUL! Reach-in foul on Vince Ingram during the drive. [Team fouls: 3] No free throws, side out. (Vince Ingram: 1 personal fouls)

[07:36] Team_060 possession (Score: 84-73)
Rudy Ginobili drives, Paolo Wade stays with him. Rudy Ginobili attempts a Layup. Contested by Paolo Wade (5.4 feet, ZONE). RUDY GINOBILI MAKES IT!
Score: 86-73

[07:20] Team_010 possession (Score: 86-73)
FOUL! Reach-in foul on Klay Haliburton during the drive. [Team fouls: 2] No free throws, side out. (Klay Haliburton: 1 personal fouls)

[07:01] Team_010 possession (Score: 86-73)
Blake Harden attempts a 3Pt. Contested by Domantas Barnes (4.3 feet, ZONE). BLAKE HARDEN MAKES IT! Assist: Ben Gilgeous-Alexander
Score: 86-76

[06:47] Team_060 possession (Score: 86-76)
Rudy Ginobili attempts a Midrange. Contested by Blake Harden (4.9 feet, ZONE). RUDY GINOBILI MAKES IT! Assist: Yao Tatum
Score: 88-76

[06:33] Team_010 possession (Score: 88-76)
Ben Gilgeous-Alexander attempts a 3Pt. Contested by Jarrett Wagner (5.1 feet, MAN). Ben Gilgeous-Alexander misses. Rebound secured by Rudy Ginobili.

[06:23] Team_060 possession (Score: 88-76)
Domantas Barnes attempts a 3Pt. Contested by Draymond Leonard (4.4 feet, ZONE). DOMANTAS BARNES MAKES IT! Assist: Rudy Ginobili
Score: 91-76

[06:12] Team_010 possession (Score: 91-76)
Vince Ingram attempts a 3Pt. Contested by Yao Tatum (6.0 feet, MAN). Vince Ingram misses. Offensive rebound by Blake Harden! Blake Harden kicks it out.

[05:58] Team_010 possession (Score: 91-76)
Paolo Wade attempts a Layup. BLOCKED BY DOMANTAS BARNES! Ball goes out off Domantas Barnes. Paolo Wade's ball!

[05:44] Team_010 possession (Score: 91-76)
Draymond Leonard attempts a Midrange. BLOCKED BY DOMANTAS BARNES! Ball is loose! Rebound secured by Rudy Ginobili.

[05:32] Team_060 possession (Score: 91-76)
Domantas Barnes attempts a 3Pt. Contested by Draymond Leonard (4.4 feet, ZONE). DOMANTAS BARNES MAKES IT!
Score: 94-76

[05:16] Team_010 possession (Score: 94-76)
Blake Harden attempts a Midrange. Contested by Rudy Ginobili (4.1 feet, ZONE). BLAKE HARDEN MAKES IT! Assist: Ben Gilgeous-Alexander
Score: 94-78

[05:00] Team_060 possession (Score: 94-78)
FOUL! Shooting foul on Ben Gilgeous-Alexander. Rudy Ginobili to the line for 2 free throws. [Team fouls: 4] (Ben Gilgeous-Alexander: 1 personal fouls)   FT 1/2: GOOD   FT 2/2: GOOD Rudy Ginobili makes 2/2 from the line.
Score: 96-78

[04:43] Team_010 possession (Score: 96-78)
FOUL! Reach-in foul on Rudy Ginobili during the drive. [Team fouls: 3] No free throws, side out. (Rudy Ginobili: 1 personal fouls)

[04:28] Team_010 possession (Score: 96-78)
Vince Ingram attempts a 3Pt. Contested by Yao Tatum (6.0 feet, MAN). Vince Ingram misses. Rebound secured by Rudy Ginobili.

[04:16] Team_060 possession (Score: 96-78)
Yao Tatum attempts a Midrange. Contested by Vince Ingram (5.4 feet, MAN). YAO TATUM MAKES IT!
Score: 98-78

[04:04] Team_010 possession (Score: 98-78)
Paolo Wade drives, picks up Klay Haliburton. Help arrives from Domantas Barnes! Paolo Wade attempts a Dunk. Contested by Domantas Barnes (4.5 feet, ZONE). Paolo Wade misses. Rebound secured by Domantas Barnes.

[03:49] Team_060 possession (Score: 98-78)
FOUL! Holding foul on Paolo Wade. [IN THE BONUS! 5 team fouls] Klay Haliburton to the line for 2 free throws. (Paolo Wade: 1 personal fouls)   FT 1/2: GOOD   FT 2/2: GOOD Klay Haliburton makes 2/2 from the line.
Score: 100-78

[03:34] Team_010 possession (Score: 100-78)
Draymond Leonard attempts a Midrange. Contested by Domantas Barnes (5.0 feet, MAN). DRAYMOND LEONARD MAKES IT! Assist: Vince Ingram
Score: 100-80

[03:15] Team_060 possession (Score: 100-80)
Jarrett Wagner attempts a 3Pt. Contested by Ben Gilgeous-Alexander (4.7 feet, MAN). Jarrett Wagner misses. Offensive rebound by Klay Haliburton! Klay Haliburton puts it back in!
Score: 102-80

[02:58] Team_010 possession (Score: 102-80)
Draymond Leonard attempts a 3Pt. Contested by Domantas Barnes (5.0 feet, ZONE). Draymond Leonard misses. Rebound secured by Klay Haliburton.

[02:47] Team_060 possession (Score: 102-80)
Yao Tatum drives and kicks out. FOUL! Shooting foul on Vince Ingram. Yao Tatum to the line for 2 free throws. [BONUS: 6 team fouls] (Vince Ingram: 2 personal fouls)   FT 1/2: GOOD   FT 2/2: GOOD Yao Tatum makes 2/2 from the line.
Score: 104-80

[02:36] Team_010 possession (Score: 104-80)
Blake Harden attempts a Midrange. Contested by Rudy Ginobili (4.1 feet, MAN). Blake Harden misses. Rebound secured by Rudy Ginobili.

[02:22] Team_060 possession (Score: 104-80)
Rudy Ginobili attempts a Midrange. Contested by Blake Harden (4.9 feet, ZONE). Rudy Ginobili misses. Offensive rebound by Domantas Barnes! Domantas Barnes kicks it out.

[02:11] Team_060 possession (Score: 104-80)
Domantas Barnes attempts a 3Pt. Contested by Draymond Leonard (4.4 feet, MAN). Domantas Barnes misses. Rebound secured by Blake Harden.

[02:01] Team_010 possession (Score: 104-80)
Draymond Leonard drives, Domantas Barnes stays with him. Draymond Leonard attempts a Dunk. Contested by Domantas Barnes (5.0 feet, MAN). DRAYMOND LEONARD MAKES IT!
Score: 104-82

[01:42] Team_060 possession (Score: 104-82)
Rudy Ginobili drives, Paolo Wade stays with him. Rudy Ginobili attempts a Dunk. Contested by Paolo Wade (5.5 feet, ZONE). Rudy Ginobili misses. Rebound secured by Ben Gilgeous-Alexander.

[01:29] Team_010 possession (Score: 104-82)
Ben Gilgeous-Alexander drives and kicks out. Blake Harden attempts a 3Pt. Contested by Domantas Barnes (4.6 feet, ZONE). Blake Harden misses. Rebound secured by Domantas Barnes.

[01:13] Team_060 possession (Score: 104-82)
Jarrett Wagner drives, picks up Paolo Wade. Help arrives from Blake Harden! Jarrett Wagner attempts a Layup. Contested by Blake Harden (5.4 feet, ZONE). JARRETT WAGNER MAKES IT! Assist: Domantas Barnes
Score: 106-82

[00:54] Team_010 possession (Score: 106-82)
FOUL! Shooting foul on Domantas Barnes. Vince Ingram to the line for 2 free throws. [Team fouls: 4] (Domantas Barnes: 1 personal fouls)   FT 1/2: GOOD   FT 2/2: GOOD Vince Ingram makes 2/2 from the line.
Score: 106-84

[00:38] Team_060 possession (Score: 106-84)
Domantas Barnes attempts a 3Pt. Contested by Draymond Leonard (4.5 feet, ZONE). Domantas Barnes misses. Rebound secured by Ben Gilgeous-Alexander.

[00:25] Team_010 possession (Score: 106-84)
Blake Harden drives and kicks out. Paolo Wade attempts a 3Pt. Contested by Domantas Barnes (4.7 feet, ZONE). PAOLO WADE MAKES IT! Assist: Ben Gilgeous-Alexander
Score: 106-87

[00:08] Team_060 possession (Score: 106-87)
Yao Tatum attempts a 3Pt. Contested by Vince Ingram (5.6 feet, MAN). YAO TATUM MAKES IT! Assist: Klay Haliburton
Score: 109-87

================================================================================
                              4TH QUARTER COMPLETE                              
================================================================================

4TH QUARTER SCORE: Team_060 34, Team_010 22

BOX SCORE:
================================================================================

Team_060
--------------------------------------------------------------------------------
Player                MIN  PTS  REB  AST  TO      FG   FG%      3P   3P%
--------------------------------------------------------------------------------
Yao Tatum              20    7    0    1   0   3/3   100.0     0/0   0.0
Rudy Ginobili          20    6    5    1   0   3/4    75.0     0/0   0.0
Klay Haliburton        20    6    3    1   0   3/3   100.0     0/0   0.0
Domantas Barnes        20    6    3    1   0   2/4    50.0     0/0   0.0
Jaren George           28    4    1    0   0   2/2   100.0     0/0   0.0
Immanuel Ming          28    3    1    0   0   1/1   100.0     0/0   0.0
Jarrett Wagner         20    2    0    1   0   1/1   100.0     0/0   0.0

TEAM: FG: 15/18 (83.3%), 3PT: 4/6 (66.7%), REB: 13 (4 off, 9 def), AST: 5, TO: 3
TEAM FOULS: 4


Team_010
--------------------------------------------------------------------------------
Player                MIN  PTS  REB  AST  TO      FG   FG%      3P   3P%
--------------------------------------------------------------------------------
Draymond Leonard       20    6    0    0   0   3/5    60.0     0/0   0.0
Blake Harden           20    5    2    0   0   2/3    66.7     0/0   0.0
Michael Turner         28    4    0    0   0   2/2   100.0     0/0   0.0
Paolo Wade             20    3    1    0   0   1/2    50.0     0/0   0.0
Anthony Durant         28    2    0    1   0   1/2    50.0     0/0   0.0
Vince Ingram           20    2    0    1   0   1/2    50.0     0/0   0.0
RJ Young               28    0    0    1   0   0/0     0.0     0/0   0.0
Cade Morant            28    0    1    0   0   0/0     0.0     0/0   0.0
Ben Gilgeous-Alexander   20    0    2    4   0   0/3     0.0     0/0   0.0

TEAM: FG: 10/19 (52.6%), 3PT: 1/4 (25.0%), REB: 6 (3 off, 3 def), AST: 7, TO: 1
TEAM FOULS: 6 [Team_060 in BONUS]

================================================================================

================================================================================
                               FULL GAME COMPLETE                               
================================================================================

FINAL SCORE: Team_060 109, Team_010 87

SCORING BY QUARTER:
--------------------------------------------------------------------------------
Team                     Q1     Q2     Q3     Q4    FINAL
--------------------------------------------------------------------------------
Team_060                 16     29     30     34      109
Team_010                 20     29     16     22       87
--------------------------------------------------------------------------------

FULL GAME BOX SCORE:
================================================================================

Team_060
--------------------------------------------------------------------------------
Player                MIN  PTS  REB  AST  TO      FG   FG%      3P   3P%      FT STL BLK
--------------------------------------------------------------------------------
Joel Morant            28    7    0    2   4   3/7    42.9   1/4    25.0   2/2     0   0
Julius Green           28    8    0    1   2   4/6    66.7   1/2    50.0   1/1     1   2
Immanuel Ming          28   14   12    5   3   6/8    75.0   2/3    66.7   3/5     0   0
Larry Westbrook        28    8    6    1   2   3/10   30.0   0/3     0.0   2/2     0   0
Jaren George           28   14   10    1   2   5/7    71.4   0/0     0.0   0/0     2   0
Domantas Barnes        20   11    8    2   0   4/7    57.1   3/5    60.0   3/4     0   2
Rudy Ginobili          20    9    6    3   1   4/6    66.7   0/0     0.0   3/3     0   0
Jarrett Wagner         20    7    0    1   0   4/5    80.0   2/2   100.0   0/2     0   0
Yao Tatum              20   16    0    1   1   6/8    75.0   2/3    66.7   4/4     0   0
Klay Haliburton        20   11    5    2   1   3/5    60.0   0/1     0.0   3/3     2   0

TEAM: FG: 44/72 (61.1%), 3PT: 11/23 (47.8%), REB: 48 (15 off, 33 def), AST: 19, TO: 16


Team_010
--------------------------------------------------------------------------------
Player                MIN  PTS  REB  AST  TO      FG   FG%      3P   3P%      FT STL BLK
--------------------------------------------------------------------------------
Cade Morant            28    9    4    1   0   3/8    37.5   2/5    40.0   2/3     0   1
Michael Turner         28   15    3    1   3   6/9    66.7   0/0     0.0   2/3     2   0
RJ Young               28    5    0    3   3   5/9    55.6   0/4     0.0   4/6     1   0
Desmond Antetokounmpo   28    8    4    1   2   4/8    50.0   1/3    33.3   1/2     3   0
Anthony Durant         28    7   11    4   1   3/5    60.0   0/0     0.0   3/3     3   0
Draymond Leonard       20   14    0    1   2   6/8    75.0   2/3    66.7   0/0     0   0
Blake Harden           20    7    7    2   0   4/6    66.7   1/2    50.0   0/0     0   2
Ben Gilgeous-Alexander   20    5    4    6   1   2/8    25.0   1/2    50.0   0/0     0   0
Vince Ingram           20    5    0    1   1   2/3    66.7   0/1     0.0   3/3     0   0
Paolo Wade             20   11    2    2   0   4/7    57.1   0/0     0.0   0/0     1   0

TEAM: FG: 39/72 (54.2%), 3PT: 7/20 (35.0%), REB: 34 (8 off, 26 def), AST: 22, TO: 13

================================================================================
