================================================================================
                        FULL GAME - Team_007 vs Team_032                        
================================================================================

================================================================================
                       1ST QUARTER - Team_007 vs Team_032                       
================================================================================

[12:00] Team_007 possession (Score: 0-0)
Tobias Johnson attempts a 3Pt. Contested by Tobias Bane (4.7 feet, ZONE). Tobias Johnson misses. Rebound secured by Malcolm Lillard.

[11:50] Team_032 possession (Score: 0-0)
Tobias Bane attempts a 3Pt. Contested by Tobias Johnson (5.0 feet, MAN). TOBIAS BANE MAKES IT! Assist: Jalen Westbrook
Score: 0-3

[11:36] Team_007 possession (Score: 0-3)
John Quickley attempts a Midrange. Contested by Anfernee Butler (4.5 feet, MAN). John Quickley misses. FOUL! Loose ball foul on Anfernee Butler during the rebound battle. [Team fouls: 1] No free throws, side out. (Anfernee Butler: 1 personal fouls)

[11:21] Team_007 possession (Score: 0-3)
Bones Siakam attempts a Midrange. Contested by DeMar Giddey (4.0 feet, ZONE). BONES SIAKAM MAKES IT! Assist: Tobias Johnson
Score: 2-3

[11:06] Team_032 possession (Score: 2-3)
DeMar Giddey attempts a Layup. Contested by John Quickley (3.3 feet, ZONE). DeMar Giddey misses. Rebound secured by John Quickley.

[10:48] Team_007 possession (Score: 2-3)
Bones Siakam attempts a Midrange. Contested by DeMar Giddey (4.0 feet, ZONE). Bones Siakam misses. Rebound secured by Malcolm Lillard.

[10:30] Team_032 possession (Score: 2-3)
Tobias Bane drives and kicks out. Jalen Westbrook attempts a Midrange. Contested by John Quickley (3.0 feet, ZONE). Jalen Westbrook misses. Rebound secured by Carmelo Siakam.

[10:13] Team_007 possession (Score: 2-3)
Jaren Dosunmu attempts a 3Pt. Contested by DeMar Giddey (3.9 feet, MAN). JAREN DOSUNMU MAKES IT! Assist: Tobias Johnson
Score: 5-3

[09:57] Team_032 possession (Score: 5-3)
DeMar Giddey attempts a 3Pt. Contested by Bones Siakam (3.9 feet, ZONE). DeMar Giddey misses. Rebound secured by Carmelo Siakam.

[09:40] Team_007 possession (Score: 5-3)
Bones Siakam drives and kicks out. Jaren Dosunmu attempts a 3Pt. Contested by DeMar Giddey (3.9 feet, MAN). Jaren Dosunmu misses. Rebound secured by Anfernee Butler.

[09:24] Team_032 possession (Score: 5-3)
FOUL! Reach-in foul on John Quickley during the drive. [Team fouls: 1] No free throws, side out. (John Quickley: 1 personal fouls)

[09:13] Team_032 possession (Score: 5-3)
Jalen Westbrook attempts a Layup. Contested by Bones Siakam (3.9 feet, MAN). Jalen Westbrook misses. Offensive rebound by Malcolm Lillard! Malcolm Lillard kicks it out.

[08:58] Team_032 possession (Score: 5-3)
Malcolm Lillard drives, John Quickley stays with him. Malcolm Lillard attempts a Dunk. Contested by John Quickley (3.4 feet, ZONE). MALCOLM LILLARD MAKES IT!
Score: 5-5

[08:44] Team_007 possession (Score: 5-5)
Jaren Dosunmu attempts a Midrange. Contested by Jalen Westbrook (4.8 feet, ZONE). Jaren Dosunmu misses. Rebound secured by Malcolm Lillard.

[08:31] Team_032 possession (Score: 5-5)
Tobias Bane attempts a Midrange. Contested by Bones Siakam (3.8 feet, ZONE). Tobias Bane misses. Rebound secured by Carmelo Siakam.

[08:11] Team_007 possession (Score: 5-5)
FOUL! Offensive foul on John Quickley! Anfernee Butler drew the charge! [Team fouls: 2] (John Quickley: 2 personal fouls) TURNOVER! (dead ball)

[08:01] Team_032 possession (Score: 5-5)
FOUL! Shooting foul on John Quickley. DeMar Giddey to the line for 2 free throws. [Team fouls: 3] (John Quickley: 3 personal fouls)   FT 1/2: GOOD   FT 2/2: MISS DeMar Giddey makes 1/2 from the line. Rebound secured by John Quickley.
Score: 5-6

[07:45] Team_007 possession (Score: 5-6)
Carmelo Siakam attempts a 3Pt. Contested by Tobias Bane (4.8 feet, ZONE). Carmelo Siakam misses. Rebound secured by Anfernee Butler.

[07:31] Team_032 possession (Score: 5-6)
Anfernee Butler attempts a 3Pt. Contested by John Quickley (2.7 feet, MAN). Anfernee Butler misses. Offensive rebound by Anfernee Butler! Anfernee Butler kicks it out.

[07:15] Team_032 possession (Score: 5-6)
Tobias Bane attempts a Midrange. Contested by Tobias Johnson (5.0 feet, MAN). TOBIAS BANE MAKES IT! Assist: Malcolm Lillard
Score: 5-8

[07:01] Team_007 possession (Score: 5-8)
Bones Siakam attempts a 3Pt. Contested by Jalen Westbrook (4.9 feet, MAN). Bones Siakam misses. Rebound secured by Anfernee Butler.

[06:47] Team_032 possession (Score: 5-8)
Tobias Bane throws a bad pass out of bounds! TURNOVER! (dead ball)

[06:34] Team_007 possession (Score: 5-8)
FOUL! Shooting foul on Malcolm Lillard. Carmelo Siakam to the line for 2 free throws. [Team fouls: 2] (Malcolm Lillard: 1 personal fouls)   FT 1/2: GOOD   FT 2/2: GOOD Carmelo Siakam makes 2/2 from the line.
Score: 7-8

[06:20] Team_032 possession (Score: 7-8)
DeMar Giddey attempts a 3Pt. Contested by John Quickley (3.3 feet, ZONE). DeMar Giddey misses. Rebound secured by John Quickley.

[06:04] Team_007 possession (Score: 7-8)
Jaren Dosunmu attempts a 3Pt. Contested by Tobias Bane (4.4 feet, ZONE). Jaren Dosunmu misses. Rebound secured by Anfernee Butler.

[05:55] Team_032 possession (Score: 7-8)
DeMar Giddey attempts a 3Pt. Contested by Jaren Dosunmu (4.7 feet, ZONE). DEMAR GIDDEY MAKES IT! Assist: Anfernee Butler
Score: 7-11

[05:44] Team_007 possession (Score: 7-11)
Tobias Johnson drives and kicks out. Bones Siakam attempts a 3Pt. Contested by Tobias Bane (4.3 feet, ZONE). BONES SIAKAM MAKES IT! Assist: Tobias Johnson
Score: 10-11

[05:29] Team_032 possession (Score: 10-11)
FOUL! Shooting foul on John Quickley. Anfernee Butler to the line for 2 free throws. [Team fouls: 4] (John Quickley: 4 personal fouls)   FT 1/2: GOOD   FT 2/2: GOOD Anfernee Butler makes 2/2 from the line.
Score: 10-13

[05:13] Team_007 possession (Score: 10-13)
Tobias Johnson commits a violation (traveling/carry)! TURNOVER! (dead ball)

[04:57] Team_032 possession (Score: 10-13)
FOUL! Reach-in foul on John Quickley during the drive. [IN THE BONUS! 5 team fouls] Malcolm Lillard to the line for 2 free throws. (John Quickley: 5 personal fouls)   FT 1/2: MISS   FT 2/2: GOOD Malcolm Lillard makes 1/2 from the line.
Score: 10-14

[04:45] Team_007 possession (Score: 10-14)
Bones Siakam attempts a Midrange. Contested by Anfernee Butler (4.0 feet, ZONE). Bones Siakam misses. Rebound secured by Malcolm Lillard.

[04:32] Team_032 possession (Score: 10-14)
Tobias Bane attempts a 3Pt. Contested by John Quickley (3.3 feet, ZONE). Tobias Bane misses. Rebound secured by Carmelo Siakam.

[04:20] Team_007 possession (Score: 10-14)
Tobias Johnson makes the Dunk and draws the foul on Tobias Bane! And-1! Tobias Johnson to the line for 1. [Team fouls: 3] (Tobias Bane: 1 personal fouls)   FT 1/1: GOOD Tobias Johnson makes 1/1 from the line.
Score: 13-14

[04:04] Team_032 possession (Score: 13-14)
Malcolm Lillard drives, John Quickley stays with him. Malcolm Lillard attempts a Dunk. Contested by John Quickley (3.6 feet, MAN). Malcolm Lillard misses. Rebound secured by Carmelo Siakam.

[03:50] Team_007 possession (Score: 13-14)
Jaren Dosunmu attempts a Layup. BLOCKED BY JALEN WESTBROOK! Ball is loose! Rebound secured by Anfernee Butler.

[03:35] Team_032 possession (Score: 13-14)
Tobias Bane attempts a Midrange. Contested by Tobias Johnson (5.1 feet, MAN). Tobias Bane misses. Rebound secured by Carmelo Siakam.

[03:20] Team_007 possession (Score: 13-14)
Bones Siakam attempts a 3Pt. Contested by Tobias Bane (4.6 feet, ZONE). BONES SIAKAM MAKES IT! Assist: Carmelo Siakam
Score: 16-14

[03:08] Team_032 possession (Score: 16-14)
Tobias Bane attempts a 3Pt. Contested by John Quickley (3.5 feet, ZONE). Tobias Bane misses. Rebound secured by John Quickley.

[02:54] Team_007 possession (Score: 16-14)
FOUL! Shooting foul on DeMar Giddey. Carmelo Siakam to the line for 2 free throws. [Team fouls: 4] (DeMar Giddey: 1 personal fouls)   FT 1/2: GOOD   FT 2/2: GOOD Carmelo Siakam makes 2/2 from the line.
Score: 18-14

[02:40] Team_032 possession (Score: 18-14)
DeMar Giddey drives and kicks out. Jalen Westbrook attempts a 3Pt. Contested by John Quickley (3.4 feet, ZONE). Jalen Westbrook misses. Offensive rebound by Anfernee Butler! Anfernee Butler kicks it out.

[02:25] Team_032 possession (Score: 18-14)
Anfernee Butler makes the Layup and draws the foul on John Quickley! And-1! Anfernee Butler to the line for 1. [BONUS: 6 team fouls] (John Quickley: 6 personal fouls) John Quickley FOULS OUT!   FT 1/1: GOOD Anfernee Butler makes 1/1 from the line.
Score: 18-17

[02:25] Substitution (Team_007): John Quickley OUT (stamina: 68) → Wendell Poole IN (foul_out)

[02:14] Team_007 possession (Score: 18-17)
Jaren Dosunmu attempts a Layup. Contested by DeMar Giddey (4.3 feet, MAN). JAREN DOSUNMU MAKES IT! Assist: Wendell Poole
Score: 20-17

[02:01] Team_032 possession (Score: 20-17)
Tobias Bane throws a bad pass out of bounds! TURNOVER! (dead ball)

[02:01] Substitution (Team_007): Tobias Johnson OUT → OG Porzingis IN (stamina_rule2)

[02:01] Substitution (Team_007): Jaren Dosunmu OUT → Tobias Johnson IN (stamina_rule2)

[02:01] Substitution (Team_007): Bones Siakam OUT → Gary LaVine IN (stamina_rule2)

[02:01] Substitution (Team_007): Carmelo Siakam OUT → Draymond Harris IN (stamina_rule2)

[02:01] Substitution (Team_032): Tobias Bane OUT → Anfernee Griffin IN (stamina_rule2)

[02:01] Substitution (Team_032): DeMar Giddey OUT → Myles Herro IN (stamina_rule2)

[02:01] Substitution (Team_032): Jalen Westbrook OUT → Jrue Simmons IN (stamina_rule2)

[02:01] Substitution (Team_032): Anfernee Butler OUT → Jayson O'Neal IN (stamina_rule2)

[02:01] Substitution (Team_032): Malcolm Lillard OUT → Lauri Towns IN (stamina_rule2)

[01:52] Team_007 possession (Score: 20-17)
Wendell Poole attempts a Midrange. Wide open! Myles Herro is 6.3 feet away. [ZONE] WENDELL POOLE MAKES IT!
Score: 22-17

[01:38] Team_032 possession (Score: 22-17)
Anfernee Griffin attempts a Layup. Contested by Draymond Harris (4.7 feet, ZONE). ANFERNEE GRIFFIN MAKES IT! Assist: Jayson O'Neal
Score: 22-19

[01:26] Team_007 possession (Score: 22-19)
Draymond Harris attempts a Midrange. Contested by Jrue Simmons (4.8 feet, ZONE). Draymond Harris misses. Rebound secured by Myles Herro.

[01:12] Team_032 possession (Score: 22-19)
Myles Herro drives and kicks out. Myles Herro attempts a Midrange. Contested by OG Porzingis (4.3 feet, MAN). Myles Herro misses. Offensive rebound by Jayson O'Neal! Jayson O'Neal puts it back in!
Score: 22-21

[00:59] Team_007 possession (Score: 22-21)
Tobias Johnson attempts a Midrange. Contested by Jayson O'Neal (5.0 feet, ZONE). Tobias Johnson misses. Rebound secured by Lauri Towns.

[00:50] Team_032 possession (Score: 22-21)
Jrue Simmons attempts a 3Pt. Contested by OG Porzingis (4.5 feet, ZONE). JRUE SIMMONS MAKES IT! Assist: Myles Herro
Score: 22-24

[00:36] Team_007 possession (Score: 22-24)
Draymond Harris makes the Dunk and draws the foul on Jayson O'Neal! And-1! Draymond Harris to the line for 1. [BONUS: 5 team fouls] (Jayson O'Neal: 1 personal fouls)   FT 1/1: GOOD Draymond Harris makes 1/1 from the line.
Score: 25-24

[00:23] Team_032 possession (Score: 25-24)
Lauri Towns attempts a Midrange. Contested by Draymond Harris (5.2 feet, MAN). Lauri Towns misses. Rebound secured by Draymond Harris.

[00:08] Team_007 possession (Score: 25-24)
FOUL! Shooting foul on Myles Herro. Gary LaVine to the line for 2 free throws. [BONUS: 6 team fouls] (Myles Herro: 1 personal fouls)   FT 1/2: GOOD   FT 2/2: GOOD Gary LaVine makes 2/2 from the line.
Score: 27-24

================================================================================
                              1ST QUARTER COMPLETE                              
================================================================================

1ST QUARTER SCORE: Team_007 27, Team_032 24

BOX SCORE:
================================================================================

Team_007
--------------------------------------------------------------------------------
Player                MIN  PTS  REB  AST  TO      FG   FG%      3P   3P%
--------------------------------------------------------------------------------
Bones Siakam           10    8    1    0   0   3/7    42.9     0/0   0.0
Jaren Dosunmu          10    5    0    0   0   2/5    40.0     0/0   0.0
Carmelo Siakam         10    4    6    1   0   2/3    66.7     0/0   0.0
Tobias Johnson         12    3    0    3   0   1/3    33.3     0/0   0.0
Draymond Harris         2    3    1    0   0   1/2    50.0     0/0   0.0
Wendell Poole           2    2    0    1   0   1/1   100.0     0/0   0.0
Gary LaVine             2    2    0    0   0   1/1   100.0     0/0   0.0
John Quickley          10    0    4    0   0   0/0     0.0     0/0   0.0

TEAM: FG: 11/22 (50.0%), 3PT: 2/6 (33.3%), REB: 12 (1 off, 11 def), AST: 5, TO: 2
TEAM FOULS: 6 [Team_032 in BONUS]


Team_032
--------------------------------------------------------------------------------
Player                MIN  PTS  REB  AST  TO      FG   FG%      3P   3P%
--------------------------------------------------------------------------------
Tobias Bane            10    5    0    0   0   2/7    28.6     0/0   0.0
Anfernee Butler        10    5    7    1   0   2/2   100.0     0/0   0.0
Malcolm Lillard        10    3    5    1   0   2/3    66.7     0/0   0.0
DeMar Giddey           10    3    0    0   0   1/5    20.0     0/0   0.0
Jrue Simmons            2    3    0    0   0   1/1   100.0     0/0   0.0
Anfernee Griffin        2    2    0    0   0   1/1   100.0     0/0   0.0
Jayson O'Neal           2    2    1    1   0   1/1   100.0     0/0   0.0
Jalen Westbrook        10    0    0    1   0   0/0     0.0     0/0   0.0
Myles Herro             2    0    1    1   0   0/0     0.0     0/0   0.0
Lauri Towns             2    0    1    0   0   0/1     0.0     0/0   0.0

TEAM: FG: 10/21 (47.6%), 3PT: 3/7 (42.9%), REB: 15 (4 off, 11 def), AST: 5, TO: 2
TEAM FOULS: 6 [Team_007 in BONUS]

================================================================================

================================================================================
                       2ND QUARTER - Team_007 vs Team_032                       
================================================================================

[12:00] Team_007 possession (Score: 27-24)
Bones Siakam drives, Malcolm Lillard stays with him. Bones Siakam attempts a Dunk. Contested by Malcolm Lillard (4.7 feet, ZONE). BONES SIAKAM MAKES IT! Assist: Tobias Johnson
Score: 29-24

[11:46] Team_032 possession (Score: 29-24)
FOUL! Shooting foul on John Quickley. Malcolm Lillard to the line for 2 free throws. [Team fouls: 1] (John Quickley: 1 personal fouls)   FT 1/2: GOOD   FT 2/2: GOOD Malcolm Lillard makes 2/2 from the line.
Score: 29-26

[11:33] Team_007 possession (Score: 29-26)
FOUL! Holding foul on Malcolm Lillard. [Team fouls: 1] No free throws, side out. (Malcolm Lillard: 1 personal fouls)

[11:20] Team_007 possession (Score: 29-26)
Jaren Dosunmu attempts a Midrange. Contested by Jalen Westbrook (5.0 feet, ZONE). Jaren Dosunmu misses. Rebound secured by Tobias Bane.

[11:07] Team_032 possession (Score: 29-26)
Tobias Bane drives to the basket... Tobias Bane throws a bad pass! Stolen by Tobias Johnson! TURNOVER! (live ball)

[10:50] Team_007 possession (Score: 29-26)
Tobias Johnson attempts a Midrange. Contested by Tobias Bane (4.7 feet, MAN). Tobias Johnson misses. Rebound secured by Malcolm Lillard.

[10:37] Team_032 possession (Score: 29-26)
Jalen Westbrook commits a violation (traveling/carry)! TURNOVER! (dead ball)

[10:37] Substitution (Team_007): Tobias Johnson OUT → Wendell Poole IN (stamina_rule2)

[10:24] Team_007 possession (Score: 29-26)
Bones Siakam attempts a Layup. BLOCKED BY MALCOLM LILLARD! Ball is loose! Offensive rebound by Carmelo Siakam! Carmelo Siakam kicks it out.

[10:09] Team_007 possession (Score: 29-26)
Bones Siakam commits a violation (traveling/carry)! TURNOVER! (dead ball)

[10:09] Substitution (Team_007): Bones Siakam OUT → Gary LaVine IN (stamina_rule2)

[10:09] Substitution (Team_007): Carmelo Siakam OUT → Draymond Harris IN (stamina_rule2)

[10:09] Substitution (Team_032): DeMar Giddey OUT → Myles Herro IN (stamina_rule2)

[10:09] Substitution (Team_032): Jalen Westbrook OUT → Jrue Simmons IN (stamina_rule2)

[10:09] Substitution (Team_032): Anfernee Butler OUT → Jayson O'Neal IN (stamina_rule2)

[09:59] Team_032 possession (Score: 29-26)
Malcolm Lillard attempts a Midrange. Contested by John Quickley (3.7 feet, ZONE). Malcolm Lillard misses. Rebound secured by Draymond Harris.

[09:48] Team_007 possession (Score: 29-26)
Draymond Harris drives, Jayson O'Neal stays with him. Draymond Harris attempts a Dunk. Contested by Jayson O'Neal (4.7 feet, ZONE). Draymond Harris misses. Rebound secured by Malcolm Lillard.

[09:32] Team_032 possession (Score: 29-26)
Myles Herro attempts a 3Pt. Contested by John Quickley (3.3 feet, ZONE). Myles Herro misses. Rebound secured by Gary LaVine.

[09:16] Team_007 possession (Score: 29-26)
John Quickley attempts a 3Pt. Contested by Tobias Bane (5.3 feet, ZONE). John Quickley misses. Offensive rebound by Draymond Harris! Draymond Harris kicks it out.

[09:05] Team_007 possession (Score: 29-26)
Draymond Harris drives and kicks out. Wendell Poole attempts a 3Pt. Contested by Tobias Bane (4.7 feet, ZONE). Wendell Poole misses. Rebound secured by Myles Herro.

[08:54] Team_032 possession (Score: 29-26)
Malcolm Lillard attempts a 3Pt. Contested by John Quickley (3.8 feet, MAN). Malcolm Lillard misses. Rebound secured by John Quickley.

[08:36] Team_007 possession (Score: 29-26)
Wendell Poole attempts a Layup. BLOCKED BY JAYSON O'NEAL! Ball is loose! Rebound secured by Jayson O'Neal.

[08:17] Team_032 possession (Score: 29-26)
Jayson O'Neal drives to the basket... Jayson O'Neal loses the ball! Stripped by John Quickley! TURNOVER! (live ball)

[08:01] Team_007 possession (Score: 29-26)
Jaren Dosunmu attempts a 3Pt. Contested by Myles Herro (6.0 feet, MAN). Jaren Dosunmu misses. Rebound secured by Jayson O'Neal.

[07:47] Team_032 possession (Score: 29-26)
FOUL! Shooting foul on John Quickley. Jayson O'Neal to the line for 3 free throws. [Team fouls: 2] (John Quickley: 2 personal fouls)   FT 1/3: GOOD   FT 2/3: MISS   FT 3/3: GOOD Jayson O'Neal makes 2/3 from the line.
Score: 29-28

[07:28] Team_007 possession (Score: 29-28)
Gary LaVine attempts a 3Pt. Contested by Jrue Simmons (4.9 feet, MAN). Gary LaVine misses. Rebound secured by Myles Herro.

[07:13] Team_032 possession (Score: 29-28)
Jayson O'Neal attempts a Layup. BLOCKED BY JOHN QUICKLEY! Ball is loose! Offensive rebound by Jayson O'Neal! Jayson O'Neal kicks it out.

[06:59] Team_032 possession (Score: 29-28)
Jrue Simmons attempts a Layup. Contested by John Quickley (4.1 feet, ZONE). Jrue Simmons misses. Offensive rebound by Jayson O'Neal! Jayson O'Neal puts it back in!
Score: 29-30

[06:43] Team_007 possession (Score: 29-30)
Wendell Poole attempts a Midrange. Contested by Tobias Bane (5.2 feet, MAN). Wendell Poole misses. Offensive rebound by Draymond Harris! Draymond Harris kicks it out.

[06:27] Team_007 possession (Score: 29-30)
Gary LaVine drives and kicks out. Wendell Poole attempts a 3Pt. Contested by Tobias Bane (5.0 feet, MAN). Wendell Poole misses. Rebound secured by Jayson O'Neal.

[06:09] Team_032 possession (Score: 29-30)
Malcolm Lillard drives and kicks out. Myles Herro attempts a Midrange. BLOCKED BY JAREN DOSUNMU! Ball is loose! Rebound secured by Gary LaVine.

[05:52] Team_007 possession (Score: 29-30)
Jaren Dosunmu attempts a Layup. BLOCKED BY MYLES HERRO! Ball goes out off Myles Herro. Jaren Dosunmu's ball!

[05:33] Team_007 possession (Score: 29-30)
John Quickley attempts a Layup. Contested by Jayson O'Neal (5.2 feet, ZONE). JOHN QUICKLEY MAKES IT! Assist: Gary LaVine
Score: 31-30

[05:23] Team_032 possession (Score: 31-30)
Jayson O'Neal drives and kicks out. Jrue Simmons attempts a Midrange. Contested by Jaren Dosunmu (5.1 feet, ZONE). JRUE SIMMONS MAKES IT! Assist: Jayson O'Neal
Score: 31-32

[05:06] Team_007 possession (Score: 31-32)
FOUL! Shooting foul on Myles Herro. Wendell Poole to the line for 2 free throws. [Team fouls: 2] (Myles Herro: 1 personal fouls)   FT 1/2: GOOD   FT 2/2: GOOD Wendell Poole makes 2/2 from the line.
Score: 33-32

[04:53] Team_032 possession (Score: 33-32)
Myles Herro attempts a Midrange. Contested by Jaren Dosunmu (5.1 feet, MAN). MYLES HERRO MAKES IT! Assist: Jrue Simmons
Score: 33-34

[04:39] Team_007 possession (Score: 33-34)
Jaren Dosunmu drives and kicks out. Draymond Harris attempts a Midrange. Wide open! Myles Herro is 6.0 feet away. [ZONE] Draymond Harris misses. Rebound secured by Malcolm Lillard.

[04:26] Team_032 possession (Score: 33-34)
Myles Herro attempts a Layup. BLOCKED BY JOHN QUICKLEY! Ball is loose! Rebound secured by Gary LaVine.

[04:14] Team_007 possession (Score: 33-34)
Jaren Dosunmu attempts a 3Pt. Contested by Myles Herro (6.0 feet, MAN). Jaren Dosunmu misses. Rebound secured by Jayson O'Neal.

[04:02] Team_032 possession (Score: 33-34)
FOUL! Reach-in foul on Gary LaVine during the drive. [Team fouls: 4] No free throws, side out. (Gary LaVine: 2 personal fouls)

[03:47] Team_032 possession (Score: 33-34)
FOUL! Reach-in foul on John Quickley during the drive. [IN THE BONUS! 5 team fouls] Myles Herro to the line for 2 free throws. (John Quickley: 3 personal fouls)   FT 1/2: MISS   FT 2/2: GOOD Myles Herro makes 1/2 from the line.
Score: 33-35

[03:29] Team_007 possession (Score: 33-35)
Wendell Poole attempts a Layup. Contested by Tobias Bane (5.7 feet, MAN). WENDELL POOLE MAKES IT!
Score: 35-35

[03:13] Team_032 possession (Score: 35-35)
Tobias Bane drives and kicks out. Jayson O'Neal attempts a Midrange. Contested by John Quickley (4.5 feet, ZONE). Jayson O'Neal misses. Rebound secured by Draymond Harris.

[03:01] Team_007 possession (Score: 35-35)
Gary LaVine attempts a 3Pt. Contested by Jrue Simmons (5.1 feet, MAN). GARY LAVINE MAKES IT! Assist: Wendell Poole
Score: 38-35

[02:46] Team_032 possession (Score: 38-35)
FOUL! Holding foul on Jaren Dosunmu. [IN THE BONUS! 6 team fouls] Myles Herro to the line for 2 free throws. (Jaren Dosunmu: 1 personal fouls)   FT 1/2: GOOD   FT 2/2: GOOD Myles Herro makes 2/2 from the line.
Score: 38-37

[02:31] Team_007 possession (Score: 38-37)
FOUL! Holding foul on Myles Herro. [Team fouls: 3] No free throws, side out. (Myles Herro: 2 personal fouls)

[02:16] Team_007 possession (Score: 38-37)
John Quickley drives, Jayson O'Neal stays with him. John Quickley attempts a Dunk. Contested by Jayson O'Neal (5.4 feet, ZONE). JOHN QUICKLEY MAKES IT! Assist: Jaren Dosunmu
Score: 40-37

[02:03] Team_032 possession (Score: 40-37)
Jrue Simmons drives to the basket... FOUL! Offensive foul on Jrue Simmons! Gary LaVine drew the charge! [Team fouls: 4] (Jrue Simmons: 1 personal fouls) TURNOVER! (dead ball)

[01:50] Team_007 possession (Score: 40-37)
Gary LaVine drives, Jrue Simmons stays with him. Gary LaVine attempts a Dunk. Contested by Jrue Simmons (5.2 feet, MAN). GARY LAVINE MAKES IT!
Score: 42-37

[01:32] Team_032 possession (Score: 42-37)
Jrue Simmons attempts a 3Pt. Contested by John Quickley (5.1 feet, ZONE). Jrue Simmons misses. Rebound secured by Draymond Harris.

[01:17] Team_007 possession (Score: 42-37)
Jaren Dosunmu drives, Myles Herro stays with him. Jaren Dosunmu attempts a Dunk. Wide open! Myles Herro is 6.2 feet away. [MAN] Jaren Dosunmu misses. FOUL! Loose ball foul on Myles Herro during the rebound battle. [IN THE BONUS! 5 team fouls] Draymond Harris to the line for 2 free throws. (Myles Herro: 3 personal fouls)   FT 1/2: MISS   FT 2/2: GOOD Draymond Harris makes 1/2 from the line.
Score: 43-37

[01:06] Team_032 possession (Score: 43-37)
Malcolm Lillard attempts a Layup. Contested by John Quickley (5.1 feet, ZONE). Malcolm Lillard misses. Rebound secured by Draymond Harris.

[00:50] Team_007 possession (Score: 43-37)
Jaren Dosunmu attempts a Midrange. Wide open! Myles Herro is 6.2 feet away. [MAN] Jaren Dosunmu misses. Offensive rebound by Draymond Harris! Draymond Harris kicks it out.

[00:33] Team_007 possession (Score: 43-37)
FOUL! Shooting foul on Jayson O'Neal. Wendell Poole to the line for 2 free throws. [BONUS: 6 team fouls] (Jayson O'Neal: 1 personal fouls)   FT 1/2: GOOD   FT 2/2: GOOD Wendell Poole makes 2/2 from the line.
Score: 45-37

[00:16] Team_032 possession (Score: 45-37)
Tobias Bane attempts a 3Pt. Contested by Wendell Poole (5.6 feet, MAN). Tobias Bane misses. Rebound secured by Gary LaVine.

================================================================================
                              2ND QUARTER COMPLETE                              
================================================================================

2ND QUARTER SCORE: Team_007 18, Team_032 13

BOX SCORE:
================================================================================

Team_007
--------------------------------------------------------------------------------
Player                MIN  PTS  REB  AST  TO      FG   FG%      3P   3P%
--------------------------------------------------------------------------------
Wendell Poole          13    6    0    1   0   3/4    75.0     0/0   0.0
Gary LaVine            12    5    4    1   0   2/4    50.0     0/0   0.0
John Quickley          22    4    1    0   0   2/2   100.0     0/0   0.0
Bones Siakam           12    2    0    0   0   1/1   100.0     0/0   0.0
Draymond Harris        12    1    7    0   0   1/3    33.3     0/0   0.0
Tobias Johnson         14    0    0    1   0   0/1     0.0     0/0   0.0
Jaren Dosunmu          22    0    0    1   0   0/4     0.0     0/0   0.0
Carmelo Siakam         12    0    1    0   0   0/0     0.0     0/0   0.0

TEAM: FG: 9/19 (47.4%), 3PT: 1/4 (25.0%), REB: 13 (4 off, 9 def), AST: 4, TO: 1
TEAM FOULS: 6 [Team_032 in BONUS]


Team_032
--------------------------------------------------------------------------------
Player                MIN  PTS  REB  AST  TO      FG   FG%      3P   3P%
--------------------------------------------------------------------------------
Myles Herro            12    5    2    0   0   3/5    60.0     0/0   0.0
Jayson O'Neal          12    4    6    1   0   2/2   100.0     0/0   0.0
Malcolm Lillard        22    2    3    0   0   1/5    20.0     0/0   0.0
Jrue Simmons           12    2    0    1   0   1/2    50.0     0/0   0.0
Tobias Bane            22    0    1    0   0   0/2     0.0     0/0   0.0

TEAM: FG: 7/16 (43.8%), 3PT: 1/5 (20.0%), REB: 12 (2 off, 10 def), AST: 2, TO: 4
TEAM FOULS: 6 [Team_007 in BONUS]

================================================================================

================================================================================
                       3RD QUARTER - Team_007 vs Team_032                       
================================================================================

[12:00] Team_007 possession (Score: 45-37)
Jaren Dosunmu drives and kicks out. Tobias Johnson attempts a Midrange. Contested by Anfernee Butler (3.8 feet, ZONE). Tobias Johnson misses. Rebound secured by Malcolm Lillard.

[11:42] Team_032 possession (Score: 45-37)
Jalen Westbrook attempts a 3Pt. Contested by John Quickley (3.3 feet, ZONE). Jalen Westbrook misses. Rebound secured by John Quickley.

[11:23] Team_007 possession (Score: 45-37)
John Quickley attempts a Midrange. Contested by Malcolm Lillard (5.3 feet, ZONE). JOHN QUICKLEY MAKES IT! Assist: Jaren Dosunmu
Score: 47-37

[11:12] Team_032 possession (Score: 47-37)
Jalen Westbrook throws a bad pass! Stolen by Bones Siakam! TURNOVER! (live ball)

[10:53] Team_007 possession (Score: 47-37)
Jaren Dosunmu attempts a 3Pt. Contested by Tobias Bane (4.4 feet, ZONE). Jaren Dosunmu misses. Rebound secured by Tobias Bane.

[10:43] Team_032 possession (Score: 47-37)
FOUL! Reach-in foul on John Quickley during the drive. [Team fouls: 1] No free throws, side out. (John Quickley: 1 personal fouls)

[10:27] Team_032 possession (Score: 47-37)
DeMar Giddey attempts a 3Pt. Contested by John Quickley (3.3 feet, ZONE). DeMar Giddey misses. Rebound secured by Bones Siakam.

[10:14] Team_007 possession (Score: 47-37)
FOUL! Shooting foul on Jalen Westbrook. Carmelo Siakam to the line for 2 free throws. [Team fouls: 1] (Jalen Westbrook: 1 personal fouls)   FT 1/2: GOOD   FT 2/2: GOOD Carmelo Siakam makes 2/2 from the line.
Score: 49-37

[09:54] Team_032 possession (Score: 49-37)
Tobias Bane attempts a Layup. Contested by Tobias Johnson (5.0 feet, MAN). TOBIAS BANE MAKES IT! Assist: Jalen Westbrook
Score: 49-39

[09:42] Team_007 possession (Score: 49-39)
Carmelo Siakam drives, picks up Malcolm Lillard. Help arrives from DeMar Giddey! Carmelo Siakam attempts a Dunk. Contested by DeMar Giddey (5.1 feet, MAN). Carmelo Siakam misses. Rebound secured by Malcolm Lillard.

[09:23] Team_032 possession (Score: 49-39)
Jalen Westbrook throws a bad pass out of bounds! TURNOVER! (dead ball)

[09:05] Team_007 possession (Score: 49-39)
Carmelo Siakam loses control! Ball rolls out of bounds! TURNOVER! (dead ball)

[08:51] Team_032 possession (Score: 49-39)
Malcolm Lillard attempts a Midrange. Contested by John Quickley (3.4 feet, MAN). Malcolm Lillard misses. Rebound secured by Carmelo Siakam.

[08:38] Team_007 possession (Score: 49-39)
Bones Siakam attempts a 3Pt. Contested by Tobias Bane (4.5 feet, ZONE). Bones Siakam misses. Rebound secured by Tobias Bane.

[08:23] Team_032 possession (Score: 49-39)
FOUL! Reach-in foul on John Quickley during the drive. [Team fouls: 2] No free throws, side out. (John Quickley: 2 personal fouls)

[08:05] Team_032 possession (Score: 49-39)
DeMar Giddey drives to the basket... DeMar Giddey throws a bad pass out of bounds! TURNOVER! (dead ball)

[07:50] Team_007 possession (Score: 49-39)
Tobias Johnson attempts a 3Pt. Contested by Tobias Bane (4.7 feet, ZONE). Tobias Johnson misses. Rebound secured by Malcolm Lillard.

[07:36] Team_032 possession (Score: 49-39)
Malcolm Lillard attempts a 3Pt. Contested by John Quickley (3.4 feet, ZONE). Malcolm Lillard misses. Rebound secured by Bones Siakam.

[07:25] Team_007 possession (Score: 49-39)
Bones Siakam attempts a 3Pt. Contested by Jalen Westbrook (4.9 feet, MAN). BONES SIAKAM MAKES IT! Assist: Jaren Dosunmu
Score: 52-39

[07:10] Team_032 possession (Score: 52-39)
Malcolm Lillard makes the Layup and draws the foul on Jaren Dosunmu! And-1! Malcolm Lillard to the line for 1. [Team fouls: 3] (Jaren Dosunmu: 1 personal fouls)   FT 1/1: MISS Malcolm Lillard makes 0/1 from the line. Rebound secured by John Quickley.
Score: 52-41

[06:55] Team_007 possession (Score: 52-41)
Jaren Dosunmu attempts a Midrange. Contested by DeMar Giddey (3.9 feet, MAN). Jaren Dosunmu misses. Rebound secured by Anfernee Butler.

[06:41] Team_032 possession (Score: 52-41)
Anfernee Butler attempts a Layup. BLOCKED BY JOHN QUICKLEY! Ball is loose! Rebound secured by John Quickley.

[06:30] Team_007 possession (Score: 52-41)
Carmelo Siakam drives, Malcolm Lillard stays with him. Carmelo Siakam attempts a Layup. Contested by Malcolm Lillard (5.1 feet, ZONE). Carmelo Siakam misses. Offensive rebound by Bones Siakam! Bones Siakam puts it back in!
Score: 54-41

[06:17] Team_032 possession (Score: 54-41)
DeMar Giddey attempts a 3Pt. Contested by Jaren Dosunmu (4.7 feet, MAN). DeMar Giddey misses. Rebound secured by Bones Siakam.

[06:03] Team_007 possession (Score: 54-41)
Carmelo Siakam attempts a 3Pt. Contested by Malcolm Lillard (5.1 feet, MAN). Carmelo Siakam misses. Rebound secured by Anfernee Butler.

[05:48] Team_032 possession (Score: 54-41)
Tobias Bane attempts a 3Pt. Contested by Tobias Johnson (5.0 feet, MAN). Tobias Bane misses. Rebound secured by John Quickley.

[05:35] Team_007 possession (Score: 54-41)
John Quickley attempts a Layup. Contested by Anfernee Butler (4.6 feet, MAN). JOHN QUICKLEY MAKES IT! Assist: Bones Siakam
Score: 56-41

[05:20] Team_032 possession (Score: 56-41)
Malcolm Lillard attempts a Midrange. Contested by Tobias Johnson (5.2 feet, ZONE). Malcolm Lillard misses. Rebound secured by John Quickley.

[05:07] Team_007 possession (Score: 56-41)
John Quickley drives to the basket... John Quickley loses the ball! Stripped by Anfernee Butler! TURNOVER! (live ball)

[04:52] Team_032 possession (Score: 56-41)
Jalen Westbrook attempts a Layup. BLOCKED BY JOHN QUICKLEY! Ball is loose! Rebound secured by Carmelo Siakam.

[04:40] Team_007 possession (Score: 56-41)
Carmelo Siakam attempts a Layup. Contested by Malcolm Lillard (5.0 feet, ZONE). Carmelo Siakam misses. Rebound secured by Tobias Bane.

[04:26] Team_032 possession (Score: 56-41)
Tobias Bane attempts a Layup. Contested by Tobias Johnson (5.1 feet, MAN). TOBIAS BANE MAKES IT!
Score: 56-43

[04:10] Team_007 possession (Score: 56-43)
John Quickley loses control! Ball rolls out of bounds! TURNOVER! (dead ball)

[03:52] Team_032 possession (Score: 56-43)
DeMar Giddey makes the Layup and draws the foul on Jaren Dosunmu! And-1! DeMar Giddey to the line for 1. [Team fouls: 4] (Jaren Dosunmu: 2 personal fouls)   FT 1/1: GOOD DeMar Giddey makes 1/1 from the line.
Score: 56-46

[03:38] Team_007 possession (Score: 56-46)
John Quickley attempts a Layup. BLOCKED BY MALCOLM LILLARD! Ball is loose! Rebound secured by Tobias Bane.

[03:22] Team_032 possession (Score: 56-46)
DeMar Giddey drives to the basket... DeMar Giddey throws a bad pass out of bounds! TURNOVER! (dead ball)

[03:08] Team_007 possession (Score: 56-46)
Carmelo Siakam attempts a Layup. Contested by Malcolm Lillard (5.1 feet, ZONE). CARMELO SIAKAM MAKES IT! Assist: Jaren Dosunmu
Score: 58-46

[02:50] Team_032 possession (Score: 58-46)
Tobias Bane drives and kicks out. Jalen Westbrook attempts a Midrange. Contested by Bones Siakam (3.9 feet, MAN). JALEN WESTBROOK MAKES IT!
Score: 58-48

[02:33] Team_007 possession (Score: 58-48)
Bones Siakam drives to the basket... Bones Siakam loses control! Ball rolls out of bounds! TURNOVER! (dead ball)

[02:33] Substitution (Team_007): Bones Siakam OUT → Gary LaVine IN (stamina_rule2)

[02:33] Substitution (Team_007): John Quickley OUT → Austin Simons IN (stamina_rule2)

[02:33] Substitution (Team_007): Carmelo Siakam OUT → Draymond Harris IN (stamina_rule2)

[02:33] Substitution (Team_032): DeMar Giddey OUT → Myles Herro IN (stamina_rule2)

[02:33] Substitution (Team_032): Jalen Westbrook OUT → Jrue Simmons IN (stamina_rule2)

[02:33] Substitution (Team_032): Anfernee Butler OUT → Jayson O'Neal IN (stamina_rule2)

[02:15] Team_032 possession (Score: 58-48)
Tobias Bane attempts a 3Pt. Contested by Jaren Dosunmu (4.7 feet, ZONE). Tobias Bane misses. Rebound secured by Austin Simons.

[01:59] Team_007 possession (Score: 58-48)
Austin Simons drives and kicks out. Austin Simons attempts a Midrange. Contested by Jayson O'Neal (4.7 feet, MAN). Austin Simons misses. Rebound secured by Jayson O'Neal.

[01:47] Team_032 possession (Score: 58-48)
Tobias Bane drives and kicks out. Malcolm Lillard attempts a 3Pt. Contested by Jaren Dosunmu (4.6 feet, ZONE). Malcolm Lillard misses. Rebound secured by Austin Simons.

[01:32] Team_007 possession (Score: 58-48)
Draymond Harris drives, picks up Jayson O'Neal. Help arrives from Myles Herro! Draymond Harris attempts a Layup. Contested by Myles Herro (4.7 feet, ZONE). Draymond Harris misses. Rebound secured by Malcolm Lillard.

[01:18] Team_032 possession (Score: 58-48)
Jrue Simmons drives to the basket... Jrue Simmons throws a bad pass out of bounds! TURNOVER! (dead ball)

[01:18] Substitution (Team_007): Tobias Johnson OUT → Wendell Poole IN (stamina_rule2)

[01:18] Substitution (Team_007): Jaren Dosunmu OUT → OG Porzingis IN (stamina_rule2)

[01:18] Substitution (Team_032): Tobias Bane OUT → Anfernee Griffin IN (stamina_rule2)

[01:18] Substitution (Team_032): Malcolm Lillard OUT → Lauri Towns IN (stamina_rule2)

[01:00] Team_007 possession (Score: 58-48)
OG Porzingis attempts a 3Pt. Contested by Myles Herro (5.6 feet, MAN). OG PORZINGIS MAKES IT! Assist: Gary LaVine
Score: 61-48

[00:47] Team_032 possession (Score: 61-48)
Jayson O'Neal attempts a 3Pt. Contested by OG Porzingis (4.5 feet, ZONE). Jayson O'Neal misses. Offensive rebound by Jayson O'Neal! Jayson O'Neal puts it back in!
Score: 61-50

[00:35] Team_007 possession (Score: 61-50)
OG Porzingis drives and kicks out. OG Porzingis attempts a 3Pt. Wide open! Myles Herro is 6.0 feet away. [MAN] OG Porzingis misses. Rebound secured by Myles Herro.

[00:25] Team_032 possession (Score: 61-50)
Myles Herro attempts a 3Pt. Contested by OG Porzingis (4.2 feet, ZONE). Myles Herro misses. Rebound secured by Draymond Harris.

[00:13] Team_007 possession (Score: 61-50)
Austin Simons attempts a 3Pt. Contested by Jayson O'Neal (5.1 feet, MAN). AUSTIN SIMONS MAKES IT! Assist: Wendell Poole
Score: 64-50

[00:02] Team_032 possession (Score: 64-50)
Myles Herro attempts a 3Pt. Contested by OG Porzingis (4.2 feet, MAN). Myles Herro misses. Offensive rebound by Lauri Towns! Lauri Towns kicks it out.

================================================================================
                              3RD QUARTER COMPLETE                              
================================================================================

3RD QUARTER SCORE: Team_007 19, Team_032 13

BOX SCORE:
================================================================================

Team_007
--------------------------------------------------------------------------------
Player                MIN  PTS  REB  AST  TO      FG   FG%      3P   3P%
--------------------------------------------------------------------------------
Bones Siakam           22    5    4    1   0   2/3    66.7     0/0   0.0
John Quickley          32    4    5    0   0   2/3    66.7     0/0   0.0
Carmelo Siakam         22    4    2    0   0   2/5    40.0     0/0   0.0
Austin Simons           2    3    2    0   0   1/2    50.0     0/0   0.0
OG Porzingis            3    3    0    0   0   1/2    50.0     0/0   0.0
Jaren Dosunmu          33    0    0    3   0   0/3     0.0     0/0   0.0
Tobias Johnson         25    0    0    0   0   0/1     0.0     0/0   0.0
Draymond Harris        14    0    1    0   0   0/1     0.0     0/0   0.0
Gary LaVine            14    0    0    1   0   0/0     0.0     0/0   0.0
Wendell Poole          14    0    0    1   0   0/0     0.0     0/0   0.0

TEAM: FG: 8/20 (40.0%), 3PT: 3/7 (42.9%), REB: 14 (1 off, 13 def), AST: 6, TO: 4
TEAM FOULS: 4


Team_032
--------------------------------------------------------------------------------
Player                MIN  PTS  REB  AST  TO      FG   FG%      3P   3P%
--------------------------------------------------------------------------------
Tobias Bane            33    4    4    0   0   2/5    40.0     0/0   0.0
DeMar Giddey           22    3    0    0   0   1/3    33.3     0/0   0.0
Jalen Westbrook        22    2    0    1   0   1/3    33.3     0/0   0.0
Jayson O'Neal          14    2    2    0   0   1/1   100.0     0/0   0.0
Malcolm Lillard        33    0    4    0   0   0/4     0.0     0/0   0.0
Anfernee Butler        22    0    2    0   0   0/1     0.0     0/0   0.0
Myles Herro            14    0    1    0   0   0/1     0.0     0/0   0.0
Lauri Towns             3    0    1    0   0   0/0     0.0     0/0   0.0

TEAM: FG: 5/18 (27.8%), 3PT: 1/8 (12.5%), REB: 14 (2 off, 12 def), AST: 1, TO: 5
TEAM FOULS: 1

================================================================================

================================================================================
                       4TH QUARTER - Team_007 vs Team_032                       
================================================================================

[12:00] Team_007 possession (Score: 64-50)
John Quickley makes the Layup and draws the foul on DeMar Giddey! And-1! John Quickley to the line for 1. [Team fouls: 1] (DeMar Giddey: 1 personal fouls)   FT 1/1: GOOD John Quickley makes 1/1 from the line.
Score: 67-50

[11:46] Team_032 possession (Score: 67-50)
Tobias Bane attempts a 3Pt. Contested by Tobias Johnson (5.1 feet, MAN). TOBIAS BANE MAKES IT! Assist: Malcolm Lillard
Score: 67-53

[11:31] Team_007 possession (Score: 67-53)
Bones Siakam attempts a 3Pt. Contested by Jalen Westbrook (5.0 feet, MAN). Bones Siakam misses. Rebound secured by DeMar Giddey.

[11:18] Team_032 possession (Score: 67-53)
Anfernee Butler attempts a Midrange. Contested by John Quickley (2.8 feet, ZONE). Anfernee Butler misses. Rebound secured by Bones Siakam.

[11:06] Team_007 possession (Score: 67-53)
Bones Siakam makes the Layup and draws the foul on Jalen Westbrook! And-1! Bones Siakam to the line for 1. [Team fouls: 2] (Jalen Westbrook: 1 personal fouls)   FT 1/1: GOOD Bones Siakam makes 1/1 from the line.
Score: 70-53

[10:51] Team_032 possession (Score: 70-53)
FOUL! Reach-in foul on Tobias Johnson during the drive. [Team fouls: 1] No free throws, side out. (Tobias Johnson: 1 personal fouls)

[10:36] Team_032 possession (Score: 70-53)
FOUL! Shooting foul on John Quickley. Anfernee Butler to the line for 2 free throws. [Team fouls: 2] (John Quickley: 1 personal fouls)   FT 1/2: GOOD   FT 2/2: GOOD Anfernee Butler makes 2/2 from the line.
Score: 70-55

[10:25] Team_007 possession (Score: 70-55)
FOUL! Offensive foul on Tobias Johnson! Tobias Bane drew the charge! [Team fouls: 3] (Tobias Johnson: 2 personal fouls) TURNOVER! (dead ball)

[10:11] Team_032 possession (Score: 70-55)
Anfernee Butler drives and kicks out. Anfernee Butler attempts a 3Pt. Contested by John Quickley (3.3 feet, ZONE). Anfernee Butler misses. FOUL! Loose ball foul on Bones Siakam during the rebound battle. [Team fouls: 4] No free throws, side out. (Bones Siakam: 1 personal fouls)

[09:57] Team_032 possession (Score: 70-55)
Tobias Bane makes the Midrange and draws the foul on Tobias Johnson! And-1! Tobias Bane to the line for 1. [BONUS: 5 team fouls] (Tobias Johnson: 3 personal fouls)   FT 1/1: GOOD Tobias Bane makes 1/1 from the line.
Score: 70-58

[09:46] Team_007 possession (Score: 70-58)
Tobias Johnson attempts a 3Pt. Contested by Tobias Bane (5.0 feet, MAN). TOBIAS JOHNSON MAKES IT! Assist: Carmelo Siakam
Score: 73-58

[09:31] Team_032 possession (Score: 73-58)
DeMar Giddey attempts a 3Pt. Contested by Jaren Dosunmu (5.0 feet, MAN). DEMAR GIDDEY MAKES IT! Assist: Jalen Westbrook
Score: 73-61

[09:12] Team_007 possession (Score: 73-61)
Jaren Dosunmu attempts a 3Pt. Contested by Tobias Bane (4.7 feet, ZONE). Jaren Dosunmu misses. Offensive rebound by Carmelo Siakam! Carmelo Siakam puts it back in!
Score: 75-61

[08:56] Team_032 possession (Score: 75-61)
Jalen Westbrook throws a bad pass out of bounds! TURNOVER! (dead ball)

[08:56] Substitution (Team_007): Tobias Johnson OUT → Wendell Poole IN (stamina_rule2)

[08:56] Substitution (Team_007): Jaren Dosunmu OUT → OG Porzingis IN (stamina_rule2)

[08:56] Substitution (Team_007): Bones Siakam OUT → Gary LaVine IN (stamina_rule2)

[08:56] Substitution (Team_007): John Quickley OUT → Austin Simons IN (stamina_rule2)

[08:56] Substitution (Team_007): Carmelo Siakam OUT → Draymond Harris IN (stamina_rule2)

[08:56] Substitution (Team_032): Tobias Bane OUT → Anfernee Griffin IN (stamina_rule2)

[08:56] Substitution (Team_032): DeMar Giddey OUT → Myles Herro IN (stamina_rule2)

[08:56] Substitution (Team_032): Jalen Westbrook OUT → Jrue Simmons IN (stamina_rule2)

[08:56] Substitution (Team_032): Anfernee Butler OUT → Jayson O'Neal IN (stamina_rule2)

[08:56] Substitution (Team_032): Malcolm Lillard OUT → Lauri Towns IN (stamina_rule2)

[08:40] Team_007 possession (Score: 75-61)
Wendell Poole drives, Anfernee Griffin stays with him. Wendell Poole attempts a Dunk. Contested by Anfernee Griffin (5.4 feet, MAN). Wendell Poole misses. Rebound secured by Myles Herro.

[08:22] Team_032 possession (Score: 75-61)
Myles Herro loses the ball! Stripped by OG Porzingis! TURNOVER! (live ball)

[08:08] Team_007 possession (Score: 75-61)
Wendell Poole attempts a 3Pt. Contested by Anfernee Griffin (5.4 feet, ZONE). Wendell Poole misses. Rebound secured by Lauri Towns.

[07:55] Team_032 possession (Score: 75-61)
Jayson O'Neal attempts a 3Pt. Contested by Austin Simons (4.0 feet, MAN). Jayson O'Neal misses. Offensive rebound by Lauri Towns! Lauri Towns kicks it out.

[07:42] Team_032 possession (Score: 75-61)
Myles Herro attempts a 3Pt. Contested by OG Porzingis (4.2 feet, ZONE). Myles Herro misses. Rebound secured by Draymond Harris.

[07:31] Team_007 possession (Score: 75-61)
Austin Simons attempts a Midrange. BLOCKED BY JAYSON O'NEAL! Ball is loose! Offensive rebound by Austin Simons! Austin Simons kicks it out.

[07:19] Team_007 possession (Score: 75-61)
OG Porzingis attempts a Midrange. Contested by Myles Herro (5.6 feet, MAN). OG PORZINGIS MAKES IT!
Score: 77-61

[07:05] Team_032 possession (Score: 77-61)
Myles Herro attempts a 3Pt. Contested by OG Porzingis (4.2 feet, ZONE). MYLES HERRO MAKES IT! Assist: Lauri Towns
Score: 77-64

[06:53] Team_007 possession (Score: 77-64)
Wendell Poole attempts a 3Pt. Contested by Anfernee Griffin (5.4 feet, MAN). Wendell Poole misses. Rebound secured by Jayson O'Neal.

[06:37] Team_032 possession (Score: 77-64)
Lauri Towns drives, Austin Simons stays with him. Lauri Towns attempts a Layup. Contested by Austin Simons (4.0 feet, ZONE). LAURI TOWNS MAKES IT!
Score: 77-66

[06:19] Team_007 possession (Score: 77-66)
Austin Simons attempts a 3Pt. Contested by Jayson O'Neal (5.1 feet, MAN). Austin Simons misses. Rebound secured by Jayson O'Neal.

[06:00] Team_032 possession (Score: 77-66)
Lauri Towns attempts a Midrange. Contested by OG Porzingis (4.5 feet, ZONE). Lauri Towns misses. Offensive rebound by Lauri Towns! Lauri Towns kicks it out.

[05:48] Team_032 possession (Score: 77-66)
Myles Herro attempts a 3Pt. Contested by OG Porzingis (4.2 feet, ZONE). Myles Herro misses. Rebound secured by Gary LaVine.

[05:34] Team_007 possession (Score: 77-66)
OG Porzingis attempts a 3Pt. Contested by Anfernee Griffin (4.7 feet, ZONE). OG PORZINGIS MAKES IT!
Score: 80-66

[05:19] Team_032 possession (Score: 80-66)
Myles Herro drives, picks up Austin Simons. Help arrives from OG Porzingis! Myles Herro attempts a Dunk. Contested by OG Porzingis (3.7 feet, ZONE). MYLES HERRO MAKES IT!
Score: 80-68

[05:04] Team_007 possession (Score: 80-68)
Gary LaVine attempts a Midrange. Contested by Jayson O'Neal (4.9 feet, ZONE). Gary LaVine misses. Rebound secured by Lauri Towns.

[04:50] Team_032 possession (Score: 80-68)
Jrue Simmons attempts a Midrange. Contested by Gary LaVine (4.6 feet, MAN). Jrue Simmons misses. Rebound secured by Gary LaVine.

[04:40] Team_007 possession (Score: 80-68)
Gary LaVine attempts a 3Pt. Contested by Anfernee Griffin (5.2 feet, ZONE). GARY LAVINE MAKES IT! Assist: Draymond Harris
Score: 83-68

[04:22] Team_032 possession (Score: 83-68)
Lauri Towns attempts a Layup. Contested by Austin Simons (4.0 feet, ZONE). Lauri Towns misses. Rebound secured by Gary LaVine.

[04:07] Team_007 possession (Score: 83-68)
Wendell Poole attempts a Layup. Contested by Anfernee Griffin (5.4 feet, MAN). WENDELL POOLE MAKES IT!
Score: 85-68

[03:51] Team_032 possession (Score: 85-68)
Jrue Simmons drives, picks up Gary LaVine. Help arrives from OG Porzingis! Jrue Simmons attempts a Layup. Contested by OG Porzingis (4.6 feet, MAN). Jrue Simmons misses. Offensive rebound by Jayson O'Neal! Jayson O'Neal's putback is no good. Rebound secured by Draymond Harris.

[03:37] Team_007 possession (Score: 85-68)
Draymond Harris drives, picks up Lauri Towns. Help arrives from Myles Herro! Draymond Harris attempts a Dunk. Contested by Myles Herro (5.4 feet, MAN). DRAYMOND HARRIS MAKES IT! Assist: OG Porzingis
Score: 87-68

[03:26] Team_032 possession (Score: 87-68)
Jrue Simmons attempts a 3Pt. Contested by OG Porzingis (4.5 feet, ZONE). Jrue Simmons misses. Offensive rebound by Lauri Towns! Lauri Towns kicks it out.

[03:16] Team_032 possession (Score: 87-68)
Anfernee Griffin drives to the basket... Anfernee Griffin throws a bad pass out of bounds! TURNOVER! (dead ball)

[03:00] Team_007 possession (Score: 87-68)
Wendell Poole drives, Anfernee Griffin stays with him. Wendell Poole attempts a Layup. Contested by Anfernee Griffin (5.4 feet, MAN). WENDELL POOLE MAKES IT!
Score: 89-68

[02:43] Team_032 possession (Score: 89-68)
Anfernee Griffin drives to the basket... Anfernee Griffin loses control! Ball rolls out of bounds! TURNOVER! (dead ball)

[02:27] Team_007 possession (Score: 89-68)
Austin Simons drives to the basket... Austin Simons loses control! Ball rolls out of bounds! TURNOVER! (dead ball)

[02:11] Team_032 possession (Score: 89-68)
Anfernee Griffin drives to the basket... Anfernee Griffin throws a bad pass out of bounds! TURNOVER! (dead ball)

[01:56] Team_007 possession (Score: 89-68)
Draymond Harris drives and kicks out. Draymond Harris attempts a 3Pt. Contested by Anfernee Griffin (5.2 feet, ZONE). Draymond Harris misses. Rebound secured by Myles Herro.

[01:43] Team_032 possession (Score: 89-68)
Jrue Simmons loses control! Ball rolls out of bounds! TURNOVER! (dead ball)

[01:26] Team_007 possession (Score: 89-68)
FOUL! Shooting foul on Myles Herro. Draymond Harris to the line for 2 free throws. [Team fouls: 4] (Myles Herro: 1 personal fouls)   FT 1/2: MISS   FT 2/2: GOOD Draymond Harris makes 1/2 from the line.
Score: 90-68

[01:10] Team_032 possession (Score: 90-68)
Anfernee Griffin attempts a Layup. BLOCKED BY WENDELL POOLE! Ball deflects out of bounds off Anfernee Griffin.

[00:56] Team_007 possession (Score: 90-68)
Draymond Harris attempts a 3Pt. Wide open! Myles Herro is 6.2 feet away. [ZONE] Draymond Harris misses. Rebound secured by Jayson O'Neal.

[00:40] Team_032 possession (Score: 90-68)
FOUL! Shooting foul on Austin Simons. Jayson O'Neal to the line for 2 free throws. [BONUS: 6 team fouls] (Austin Simons: 1 personal fouls)   FT 1/2: GOOD   FT 2/2: GOOD Jayson O'Neal makes 2/2 from the line.
Score: 90-70

[00:25] Team_007 possession (Score: 90-70)
FOUL! Holding foul on Jayson O'Neal. [IN THE BONUS! 5 team fouls] Austin Simons to the line for 2 free throws. (Jayson O'Neal: 2 personal fouls)   FT 1/2: GOOD   FT 2/2: MISS Austin Simons makes 1/2 from the line. Offensive rebound by Austin Simons! Austin Simons kicks it out.
Score: 91-70

[00:11] Team_007 possession (Score: 91-70)
Austin Simons attempts a 3Pt. Contested by Anfernee Griffin (5.6 feet, ZONE). Austin Simons misses. Rebound secured by Lauri Towns.

================================================================================
                              4TH QUARTER COMPLETE                              
================================================================================

4TH QUARTER SCORE: Team_007 27, Team_032 20

BOX SCORE:
================================================================================

Team_007
--------------------------------------------------------------------------------
Player                MIN  PTS  REB  AST  TO      FG   FG%      3P   3P%
--------------------------------------------------------------------------------
OG Porzingis           12    5    0    1   0   2/2   100.0     0/0   0.0
Wendell Poole          23    4    0    0   0   2/5    40.0     0/0   0.0
John Quickley          35    3    0    0   0   1/1   100.0     0/0   0.0
Bones Siakam           25    3    1    0   0   1/2    50.0     0/0   0.0
Tobias Johnson         28    3    0    0   0   1/1   100.0     0/0   0.0
Draymond Harris        23    3    2    1   0   2/4    50.0     0/0   0.0
Gary LaVine            23    3    3    0   0   1/2    50.0     0/0   0.0
Carmelo Siakam         25    2    1    1   0   1/1   100.0     0/0   0.0
Austin Simons          11    0    2    0   0   0/2     0.0     0/0   0.0

TEAM: FG: 11/20 (55.0%), 3PT: 4/10 (40.0%), REB: 8 (3 off, 5 def), AST: 3, TO: 2
TEAM FOULS: 6 [Team_032 in BONUS]


Team_032
--------------------------------------------------------------------------------
Player                MIN  PTS  REB  AST  TO      FG   FG%      3P   3P%
--------------------------------------------------------------------------------
Tobias Bane            37    6    0    0   0   2/2   100.0     0/0   0.0
Myles Herro            23    5    2    0   0   2/4    50.0     0/0   0.0
DeMar Giddey           25    3    1    0   0   1/1   100.0     0/0   0.0
Anfernee Butler        25    2    0    0   0   1/2    50.0     0/0   0.0
Lauri Towns            12    2    6    1   0   1/2    50.0     0/0   0.0
Jayson O'Neal          23    2    3    0   0   1/1   100.0     0/0   0.0
Malcolm Lillard        37    0    1    1   0   0/0     0.0     0/0   0.0
Jalen Westbrook        25    0    0    1   0   0/0     0.0     0/0   0.0
Jrue Simmons           23    0    0    0   0   0/2     0.0     0/0   0.0
Anfernee Griffin       12    0    0    0   0   0/1     0.0     0/0   0.0

TEAM: FG: 8/15 (53.3%), 3PT: 3/5 (60.0%), REB: 14 (5 off, 9 def), AST: 3, TO: 6
TEAM FOULS: 5 [Team_007 in BONUS]

================================================================================

================================================================================
                               FULL GAME COMPLETE                               
================================================================================

FINAL SCORE: Team_007 91, Team_032 70

SCORING BY QUARTER:
--------------------------------------------------------------------------------
Team                     Q1     Q2     Q3     Q4    FINAL
--------------------------------------------------------------------------------
Team_007                 27     18     19     27       91
Team_032                 24     13     13     20       70
--------------------------------------------------------------------------------

FULL GAME BOX SCORE:
================================================================================

Team_007
--------------------------------------------------------------------------------
Player                MIN  PTS  REB  AST  TO      FG   FG%      3P   3P%      FT STL BLK
--------------------------------------------------------------------------------
Jaren Dosunmu          37    5    0    4   0   4/14   28.6   2/6    33.3   0/0     0   1
John Quickley          35   11   10    0   3   5/6    83.3   0/0     0.0   1/1     1   4
Tobias Johnson         28    6    0    4   2   3/7    42.9   1/3    33.3   1/1     1   0
Bones Siakam           25   18    6    1   1   5/11   45.5   2/5    40.0   1/1     1   0
Carmelo Siakam         25   10   10    2   2   5/9    55.6   0/2     0.0   6/6     0   0
Gary LaVine            23   10    7    2   0   4/7    57.1   2/3    66.7   2/2     0   0
Draymond Harris        23    7   11    1   0   3/9    33.3   0/1     0.0   3/5     0   0
Wendell Poole          23   12    0    3   0   6/10   60.0   0/2     0.0   4/4     0   1
OG Porzingis           12    8    0    1   0   3/4    75.0   2/2   100.0   0/0     1   0
Austin Simons          11    3    4    0   1   1/4    25.0   1/3    33.3   1/2     0   0

TEAM: FG: 39/81 (48.1%), 3PT: 10/27 (37.0%), REB: 47 (9 off, 38 def), AST: 18, TO: 9


Team_032
--------------------------------------------------------------------------------
Player                MIN  PTS  REB  AST  TO      FG   FG%      3P   3P%      FT STL BLK
--------------------------------------------------------------------------------
Tobias Bane            37   15    5    0   3   7/17   41.2   2/7    28.6   1/1     0   0
Malcolm Lillard        37    5   13    2   1   3/12   25.0   0/2     0.0   3/5     0   2
DeMar Giddey           25    9    1    0   0   3/9    33.3   2/6    33.3   2/3     0   0
Jalen Westbrook        25    2    0    3   4   0/2     0.0   0/1     0.0   0/0     0   1
Anfernee Butler        25    7    9    1   2   3/5    60.0   0/0     0.0   5/5     1   0
Myles Herro            23   10    6    1   2   5/10   50.0   1/5    20.0   3/4     0   1
Jrue Simmons           23    5    0    1   2   2/5    40.0   1/2    50.0   0/0     0   0
Jayson O'Neal          23   10   12    2   1   4/4   100.0   2/2   100.0   4/5     0   2
Anfernee Griffin       12    2    0    0   1   1/2    50.0   0/0     0.0   0/0     0   0
Lauri Towns            12    2    8    1   1   1/3    33.3   0/0     0.0   0/0     0   0

TEAM: FG: 30/70 (42.9%), 3PT: 8/25 (32.0%), REB: 55 (13 off, 42 def), AST: 11, TO: 17

================================================================================
