================================================================================
                        FULL GAME - Team_057 vs Team_027                        
================================================================================

================================================================================
                       1ST QUARTER - Team_057 vs Team_027                       
================================================================================

[12:00] Team_057 possession (Score: 0-0)
Anfernee Adebayo attempts a 3Pt. Wide open! Scottie Harden is 7.4 feet away. [MAN] Anfernee Adebayo misses. Offensive rebound by Miles Middleton! Miles Middleton kicks it out.

[11:43] Team_057 possession (Score: 0-0)
Klay Rozier throws a bad pass out of bounds! TURNOVER! (dead ball)

[11:29] Team_027 possession (Score: 0-0)
FOUL! Holding foul on Klay Rozier. [Team fouls: 1] No free throws, side out. (Klay Rozier: 1 personal fouls)

[11:13] Team_027 possession (Score: 0-0)
Bradley Dosunmu drives and kicks out. Scottie Harden attempts a 3Pt. Contested by Anfernee Adebayo (3.5 feet, MAN). Scottie Harden misses. Offensive rebound by Bradley Dosunmu! Bradley Dosunmu kicks it out.

[10:59] Team_027 possession (Score: 0-0)
Bradley Dosunmu makes the Layup and draws the foul on Ben Adebayo! And-1! Bradley Dosunmu to the line for 1. [Team fouls: 2] (Ben Adebayo: 1 personal fouls)   FT 1/1: MISS Bradley Dosunmu makes 0/1 from the line. Offensive rebound by John Russell! John Russell puts it back in!
Score: 0-4

[10:43] Team_057 possession (Score: 0-4)
Miles Middleton drives to the basket... Miles Middleton throws a bad pass! Stolen by John Russell! TURNOVER! (live ball)

[10:27] Team_027 possession (Score: 0-4)
Tim Johnson loses control! Ball rolls out of bounds! TURNOVER! (dead ball)

[10:13] Team_057 possession (Score: 0-4)
FOUL! Holding foul on Scottie Harden. [Team fouls: 1] No free throws, side out. (Scottie Harden: 1 personal fouls)

[09:56] Team_057 possession (Score: 0-4)
Klay Rozier attempts a Midrange. Contested by Tony Doncic (3.2 feet, MAN). KLAY ROZIER MAKES IT! Assist: Anfernee Adebayo
Score: 2-4

[09:41] Team_027 possession (Score: 2-4)
FOUL! Shooting foul on Anfernee Adebayo. Scottie Harden to the line for 2 free throws. [Team fouls: 3] (Anfernee Adebayo: 1 personal fouls)   FT 1/2: MISS   FT 2/2: GOOD Scottie Harden makes 1/2 from the line.
Score: 2-5

[09:28] Team_057 possession (Score: 2-5)
Miles Middleton attempts a Layup. Heavily contested by John Russell (1.7 feet, ZONE)! Miles Middleton misses. Rebound secured by John Russell.

[09:14] Team_027 possession (Score: 2-5)
Tim Johnson drives, Kobe Ming stays with him. Tim Johnson attempts a Layup. Contested by Kobe Ming (2.9 feet, MAN). Tim Johnson misses. Rebound secured by Ben Adebayo.

[08:55] Team_057 possession (Score: 2-5)
Ben Adebayo makes the Midrange and draws the foul on Bradley Dosunmu! And-1! Ben Adebayo to the line for 1. [Team fouls: 2] (Bradley Dosunmu: 1 personal fouls)   FT 1/1: GOOD Ben Adebayo makes 1/1 from the line.
Score: 5-5

[08:42] Team_027 possession (Score: 5-5)
FOUL! Reach-in foul on Ben Adebayo during the drive. [Team fouls: 4] No free throws, side out. (Ben Adebayo: 2 personal fouls)

[08:32] Team_027 possession (Score: 5-5)
Tim Johnson attempts a 3Pt. Contested by Kobe Ming (4.7 feet, ZONE). TIM JOHNSON MAKES IT!
Score: 5-8

[08:16] Team_057 possession (Score: 5-8)
Ben Adebayo attempts a 3Pt. Contested by Tony Doncic (5.1 feet, ZONE). Ben Adebayo misses. Rebound secured by Bradley Dosunmu.

[07:58] Team_027 possession (Score: 5-8)
Tony Doncic attempts a 3Pt. Wide open! Kobe Ming is 6.4 feet away. [ZONE] Tony Doncic misses. Rebound secured by Anfernee Adebayo.

[07:43] Team_057 possession (Score: 5-8)
Ben Adebayo drives, picks up John Russell. Help arrives from Tony Doncic! Ben Adebayo attempts a Layup. Contested by Tony Doncic (2.3 feet, ZONE). Ben Adebayo misses. Rebound secured by Tony Doncic.

[07:30] Team_027 possession (Score: 5-8)
John Russell loses control! Ball rolls out of bounds! TURNOVER! (dead ball)

[07:19] Team_057 possession (Score: 5-8)
Ben Adebayo attempts a Layup. Contested by Bradley Dosunmu (3.1 feet, MAN). Ben Adebayo misses. Rebound secured by Tony Doncic.

[07:06] Team_027 possession (Score: 5-8)
Bradley Dosunmu attempts a Midrange. Contested by Ben Adebayo (4.2 feet, MAN). BRADLEY DOSUNMU MAKES IT!
Score: 5-10

[06:50] Team_057 possession (Score: 5-10)
Anfernee Adebayo attempts a 3Pt. Wide open! Tim Johnson is 6.5 feet away. [ZONE] Anfernee Adebayo misses. FOUL! Loose ball foul on John Russell during the rebound battle. [Team fouls: 3] No free throws, side out. (John Russell: 1 personal fouls)

[06:33] Team_057 possession (Score: 5-10)
FOUL! Reach-in foul on John Russell during the drive. [Team fouls: 4] No free throws, side out. (John Russell: 2 personal fouls)

[06:20] Team_057 possession (Score: 5-10)
Kobe Ming attempts a Midrange. Contested by Tim Johnson (3.6 feet, ZONE). KOBE MING MAKES IT! Assist: Ben Adebayo
Score: 7-10

[06:03] Team_027 possession (Score: 7-10)
John Russell makes the Dunk and draws the foul on Klay Rozier! And-1! John Russell to the line for 1. [BONUS: 5 team fouls] (Klay Rozier: 2 personal fouls)   FT 1/1: MISS John Russell makes 0/1 from the line. Rebound secured by Anfernee Adebayo.
Score: 7-12

[05:53] Team_057 possession (Score: 7-12)
Kobe Ming drives, picks up Tim Johnson. Help arrives from Tony Doncic! Kobe Ming attempts a Dunk. Wide open! Tony Doncic is 6.2 feet away. [MAN] Kobe Ming misses. Rebound secured by Bradley Dosunmu.

[05:36] Team_027 possession (Score: 7-12)
FOUL! Reach-in foul on Kobe Ming during the drive. [IN THE BONUS! 6 team fouls] Tim Johnson to the line for 2 free throws. (Kobe Ming: 1 personal fouls)   FT 1/2: GOOD   FT 2/2: GOOD Tim Johnson makes 2/2 from the line.
Score: 7-14

[05:25] Team_057 possession (Score: 7-14)
Kobe Ming commits a violation (traveling/carry)! TURNOVER! (dead ball)

[05:15] Team_027 possession (Score: 7-14)
Tim Johnson attempts a Midrange. Contested by Kobe Ming (4.2 feet, MAN). TIM JOHNSON MAKES IT! Assist: Tony Doncic
Score: 7-16

[04:58] Team_057 possession (Score: 7-16)
Ben Adebayo attempts a Layup. Contested by Bradley Dosunmu (5.9 feet, MAN). Ben Adebayo misses. Rebound secured by Bradley Dosunmu.

[04:43] Team_027 possession (Score: 7-16)
John Russell attempts a Midrange. Contested by Miles Middleton (2.9 feet, MAN). John Russell misses. Rebound secured by Ben Adebayo.

[04:30] Team_057 possession (Score: 7-16)
FOUL! Offensive foul on Klay Rozier! Tony Doncic drew the charge! [Team fouls: 7] (Klay Rozier: 3 personal fouls) TURNOVER! (dead ball)

[04:19] Team_027 possession (Score: 7-16)
Tony Doncic drives to the basket... Tony Doncic loses the ball! Stripped by Miles Middleton! TURNOVER! (live ball)

[04:06] Team_057 possession (Score: 7-16)
Anfernee Adebayo attempts a 3Pt. Wide open! Tim Johnson is 7.9 feet away. [ZONE] Anfernee Adebayo misses. Rebound secured by Bradley Dosunmu.

[03:52] Team_027 possession (Score: 7-16)
Tim Johnson attempts a Midrange. Heavily contested by Kobe Ming (1.7 feet, MAN)! Tim Johnson misses. Rebound secured by Miles Middleton.

[03:38] Team_057 possession (Score: 7-16)
Anfernee Adebayo attempts a 3Pt. Contested by Tim Johnson (6.0 feet, ZONE). Anfernee Adebayo misses. Rebound secured by John Russell.

[03:23] Team_027 possession (Score: 7-16)
John Russell attempts a Dunk. BLOCKED BY BEN ADEBAYO! Ball deflects out of bounds off John Russell.

[03:12] Team_057 possession (Score: 7-16)
Kobe Ming attempts a Midrange. Contested by Tim Johnson (4.1 feet, MAN). Kobe Ming misses. Rebound secured by Bradley Dosunmu.

[03:00] Team_027 possession (Score: 7-16)
Bradley Dosunmu attempts a Layup. BLOCKED BY BEN ADEBAYO! Ball is loose! Rebound secured by Miles Middleton.

[02:46] Team_057 possession (Score: 7-16)
Anfernee Adebayo attempts a Midrange. Contested by Scottie Harden (5.9 feet, ZONE). Anfernee Adebayo misses. Offensive rebound by Ben Adebayo! Ben Adebayo kicks it out.

[02:32] Team_057 possession (Score: 7-16)
Anfernee Adebayo drives and kicks out. Miles Middleton attempts a 3Pt. Contested by Tim Johnson (4.5 feet, ZONE). Miles Middleton misses. Rebound secured by John Russell.

[02:19] Team_027 possession (Score: 7-16)
John Russell drives and kicks out. Tony Doncic attempts a Midrange. Wide open! Ben Adebayo is 6.9 feet away. [ZONE] Tony Doncic misses. Rebound secured by Ben Adebayo.

[02:07] Team_057 possession (Score: 7-16)
Klay Rozier attempts a 3Pt. Contested by Tony Doncic (5.1 feet, MAN). Klay Rozier misses. Offensive rebound by Ben Adebayo! Ben Adebayo kicks it out.

[01:50] Team_057 possession (Score: 7-16)
Kobe Ming makes the Midrange and draws the foul on Bradley Dosunmu! And-1! Kobe Ming to the line for 1. [BONUS: 5 team fouls] (Bradley Dosunmu: 2 personal fouls)   FT 1/1: MISS Kobe Ming makes 0/1 from the line. Rebound secured by Bradley Dosunmu.
Score: 9-16

[01:34] Team_027 possession (Score: 9-16)
Tony Doncic attempts a Midrange. Contested by Klay Rozier (3.5 feet, MAN). Tony Doncic misses. Rebound secured by Ben Adebayo.

[01:21] Team_057 possession (Score: 9-16)
Anfernee Adebayo loses control! Ball rolls out of bounds! TURNOVER! (dead ball)

[01:21] Substitution (Team_057): Kobe Ming OUT → Scottie Johnson IN (stamina_rule2)

[01:21] Substitution (Team_057): Klay Rozier OUT → Bradley Ginobili IN (stamina_rule2)

[01:21] Substitution (Team_057): Anfernee Adebayo OUT → Joel Wade IN (stamina_rule2)

[01:21] Substitution (Team_057): Ben Adebayo OUT → Lamelo Irving IN (stamina_rule2)

[01:21] Substitution (Team_057): Miles Middleton OUT → Zion Lillard IN (stamina_rule2)

[01:21] Substitution (Team_027): Tim Johnson OUT → CJ Green IN (stamina_rule2)

[01:21] Substitution (Team_027): Tony Doncic OUT → Dirk Lillard IN (stamina_rule2)

[01:21] Substitution (Team_027): Scottie Harden OUT → Rudy Quickley IN (stamina_rule2)

[01:21] Substitution (Team_027): Bradley Dosunmu OUT → LeBron Russell IN (stamina_rule2)

[01:21] Substitution (Team_027): John Russell OUT → Ben Stewart IN (stamina_rule2)

[01:09] Team_027 possession (Score: 9-16)
Rudy Quickley attempts a 3Pt. Contested by Scottie Johnson (3.3 feet, ZONE). Rudy Quickley misses. Offensive rebound by Ben Stewart! Ben Stewart's putback is no good. Rebound secured by Lamelo Irving.

[00:52] Team_057 possession (Score: 9-16)
Scottie Johnson drives to the basket... Scottie Johnson loses the ball! Stripped by CJ Green! TURNOVER! (live ball)

[00:35] Team_027 possession (Score: 9-16)
Dirk Lillard attempts a Layup. Contested by Lamelo Irving (4.5 feet, ZONE). Dirk Lillard misses. Rebound secured by Joel Wade.

[00:21] Team_057 possession (Score: 9-16)
Scottie Johnson attempts a 3Pt. Contested by CJ Green (5.0 feet, MAN). Scottie Johnson misses. Rebound secured by Ben Stewart.

[00:06] Team_027 possession (Score: 9-16)
FOUL! Offensive foul on Ben Stewart! Zion Lillard drew the charge! [Team fouls: 6] (Ben Stewart: 1 personal fouls) TURNOVER! (dead ball)

================================================================================
                              1ST QUARTER COMPLETE                              
================================================================================

1ST QUARTER SCORE: Team_057 9, Team_027 16

BOX SCORE:
================================================================================

Team_057
--------------------------------------------------------------------------------
Player                MIN  PTS  REB  AST  TO      FG   FG%      3P   3P%
--------------------------------------------------------------------------------
Ben Adebayo            11    3    7    1   0   1/5    20.0     0/0   0.0
Klay Rozier            11    2    0    0   0   1/1   100.0     0/0   0.0
Kobe Ming              11    2    0    0   0   1/4    25.0     0/0   0.0
Miles Middleton        11    0    3    0   0   0/1     0.0     0/0   0.0
Anfernee Adebayo       11    0    2    1   0   0/3     0.0     0/0   0.0
Joel Wade               1    0    1    0   0   0/0     0.0     0/0   0.0
Scottie Johnson         1    0    0    0   0   0/1     0.0     0/0   0.0

TEAM: FG: 3/15 (20.0%), 3PT: 0/4 (0.0%), REB: 13 (4 off, 9 def), AST: 2, TO: 6
TEAM FOULS: 7 [Team_027 in BONUS]


Team_027
--------------------------------------------------------------------------------
Player                MIN  PTS  REB  AST  TO      FG   FG%      3P   3P%
--------------------------------------------------------------------------------
Tim Johnson            11    7    0    0   0   3/5    60.0     0/0   0.0
John Russell           11    4    3    0   0   1/5    20.0     0/0   0.0
Bradley Dosunmu        11    2    7    0   0   1/2    50.0     0/0   0.0
Scottie Harden         11    1    0    0   0   1/1   100.0     0/0   0.0
Tony Doncic            11    0    2    1   0   0/2     0.0     0/0   0.0
Rudy Quickley           1    0    0    0   0   0/1     0.0     0/0   0.0
Lamelo Irving           1    0    1    0   0   0/0     0.0     0/0   0.0
Dirk Lillard            1    0    0    0   0   0/1     0.0     0/0   0.0
Ben Stewart             1    0    1    0   0   0/0     0.0     0/0   0.0

TEAM: FG: 6/17 (35.3%), 3PT: 1/3 (33.3%), REB: 14 (2 off, 12 def), AST: 1, TO: 4
TEAM FOULS: 6 [Team_057 in BONUS]

================================================================================

================================================================================
                       2ND QUARTER - Team_057 vs Team_027                       
================================================================================

[12:00] Team_057 possession (Score: 9-16)
Klay Rozier attempts a 3Pt. Contested by Tony Doncic (3.3 feet, MAN). Klay Rozier misses. Rebound secured by John Russell.

[11:47] Team_027 possession (Score: 9-16)
Tony Doncic attempts a Midrange. Contested by Klay Rozier (2.9 feet, MAN). Tony Doncic misses. Offensive rebound by John Russell! John Russell puts it back in!
Score: 9-18

[11:30] Team_057 possession (Score: 9-18)
Miles Middleton attempts a 3Pt. Contested by John Russell (2.7 feet, MAN). Miles Middleton misses. FOUL! Loose ball foul on Tony Doncic during the rebound battle. [Team fouls: 1] No free throws, side out. (Tony Doncic: 1 personal fouls)

[11:18] Team_057 possession (Score: 9-18)
Kobe Ming attempts a 3Pt. Wide open! Tony Doncic is 7.8 feet away. [ZONE] Kobe Ming misses. FOUL! Loose ball foul on Tony Doncic during the rebound battle. [Team fouls: 2] No free throws, side out. (Tony Doncic: 2 personal fouls)

[11:03] Team_057 possession (Score: 9-18)
FOUL! Holding foul on Bradley Dosunmu. [Team fouls: 3] No free throws, side out. (Bradley Dosunmu: 1 personal fouls)

[10:52] Team_057 possession (Score: 9-18)
Ben Adebayo attempts a 3Pt. Contested by Bradley Dosunmu (5.4 feet, MAN). BEN ADEBAYO MAKES IT! Assist: Anfernee Adebayo
Score: 12-18

[10:32] Team_027 possession (Score: 12-18)
Tony Doncic loses control! Ball rolls out of bounds! TURNOVER! (dead ball)

[10:32] Substitution (Team_057): Kobe Ming OUT → Scottie Johnson IN (stamina_rule2)

[10:32] Substitution (Team_057): Klay Rozier OUT → Bradley Ginobili IN (stamina_rule2)

[10:32] Substitution (Team_057): Anfernee Adebayo OUT → Joel Wade IN (stamina_rule2)

[10:32] Substitution (Team_057): Ben Adebayo OUT → Lamelo Irving IN (stamina_rule2)

[10:32] Substitution (Team_057): Miles Middleton OUT → Zion Lillard IN (stamina_rule2)

[10:32] Substitution (Team_027): Tim Johnson OUT → CJ Green IN (stamina_rule2)

[10:32] Substitution (Team_027): Scottie Harden OUT → Rudy Quickley IN (stamina_rule2)

[10:32] Substitution (Team_027): Bradley Dosunmu OUT → LeBron Russell IN (stamina_rule2)

[10:32] Substitution (Team_027): John Russell OUT → Ben Stewart IN (stamina_rule2)

[10:21] Team_057 possession (Score: 12-18)
Zion Lillard makes the Layup and draws the foul on Tony Doncic! And-1! Zion Lillard to the line for 1. [Team fouls: 4] (Tony Doncic: 3 personal fouls)   FT 1/1: GOOD Zion Lillard makes 1/1 from the line.
Score: 15-18

[10:10] Team_027 possession (Score: 15-18)
Ben Stewart attempts a 3Pt. Contested by Zion Lillard (2.7 feet, MAN). BEN STEWART MAKES IT! Assist: Tony Doncic
Score: 15-21

[09:53] Team_057 possession (Score: 15-21)
Zion Lillard drives, Ben Stewart stays with him. Zion Lillard attempts a Layup. Heavily contested by Ben Stewart (1.7 feet, MAN)! Zion Lillard misses. Rebound secured by Tony Doncic.

[09:40] Team_027 possession (Score: 15-21)
Ben Stewart drives, picks up Lamelo Irving. Help arrives from Bradley Ginobili! Ben Stewart attempts a Dunk. Contested by Bradley Ginobili (3.4 feet, ZONE). Ben Stewart misses. FOUL! Loose ball foul on Zion Lillard during the rebound battle. [Team fouls: 1] No free throws, side out. (Zion Lillard: 1 personal fouls)

[09:23] Team_027 possession (Score: 15-21)
Rudy Quickley attempts a Layup. Wide open! Joel Wade is 7.8 feet away. [MAN] RUDY QUICKLEY MAKES IT! Assist: CJ Green
Score: 15-23

[09:05] Team_057 possession (Score: 15-23)
Bradley Ginobili attempts a 3Pt. Contested by Tony Doncic (4.1 feet, MAN). Bradley Ginobili misses. Offensive rebound by Lamelo Irving! Lamelo Irving kicks it out.

[08:52] Team_057 possession (Score: 15-23)
Joel Wade attempts a Layup. BLOCKED BY RUDY QUICKLEY! Ball deflects out of bounds off Joel Wade.

[08:40] Team_027 possession (Score: 15-23)
Rudy Quickley attempts a Midrange. Wide open! Bradley Ginobili is 8.8 feet away. [ZONE] RUDY QUICKLEY MAKES IT! Assist: LeBron Russell
Score: 15-25

[08:26] Team_057 possession (Score: 15-25)
Joel Wade attempts a Layup. Contested by Rudy Quickley (3.1 feet, MAN). JOEL WADE MAKES IT!
Score: 17-25

[08:15] Team_027 possession (Score: 17-25)
Tony Doncic attempts a Layup. Contested by Bradley Ginobili (5.3 feet, MAN). Tony Doncic misses. Offensive rebound by LeBron Russell! LeBron Russell kicks it out.

[08:00] Team_027 possession (Score: 17-25)
Ben Stewart drives, picks up Zion Lillard. Help arrives from Bradley Ginobili! Ben Stewart attempts a Layup. Contested by Bradley Ginobili (3.9 feet, MAN). BEN STEWART MAKES IT!
Score: 17-27

[07:47] Team_057 possession (Score: 17-27)
Zion Lillard attempts a Layup. Contested by Ben Stewart (2.7 feet, ZONE). Zion Lillard misses. Offensive rebound by Lamelo Irving! Lamelo Irving kicks it out.

[07:30] Team_057 possession (Score: 17-27)
Joel Wade attempts a 3Pt. Contested by Rudy Quickley (2.2 feet, ZONE). Joel Wade misses. Offensive rebound by Zion Lillard! Zion Lillard puts it back in!
Score: 19-27

[07:15] Team_027 possession (Score: 19-27)
Tony Doncic attempts a 3Pt. Contested by Scottie Johnson (3.6 feet, ZONE). Tony Doncic misses. Rebound secured by Lamelo Irving.

[07:00] Team_057 possession (Score: 19-27)
Scottie Johnson attempts a 3Pt. Contested by Rudy Quickley (5.5 feet, ZONE). SCOTTIE JOHNSON MAKES IT! Assist: Bradley Ginobili
Score: 22-27

[06:44] Team_027 possession (Score: 22-27)
FOUL! Reach-in foul on Lamelo Irving during the drive. [Team fouls: 2] No free throws, side out. (Lamelo Irving: 1 personal fouls)

[06:28] Team_027 possession (Score: 22-27)
Rudy Quickley attempts a Midrange. Wide open! Joel Wade is 8.2 feet away. [MAN] Rudy Quickley misses. Rebound secured by Zion Lillard.

[06:10] Team_057 possession (Score: 22-27)
Lamelo Irving attempts a Layup. BLOCKED BY LEBRON RUSSELL! Ball goes out off LeBron Russell. Lamelo Irving's ball!

[05:54] Team_057 possession (Score: 22-27)
Bradley Ginobili attempts a 3Pt. Contested by Tony Doncic (4.6 feet, MAN). BRADLEY GINOBILI MAKES IT! Assist: Lamelo Irving
Score: 25-27

[05:40] Team_027 possession (Score: 25-27)
Ben Stewart attempts a 3Pt. Wide open! Joel Wade is 6.8 feet away. [ZONE] BEN STEWART MAKES IT! Assist: LeBron Russell
Score: 25-30

[05:23] Team_057 possession (Score: 25-30)
Joel Wade attempts a Layup. Wide open! Ben Stewart is 6.6 feet away. [ZONE] Joel Wade misses. Rebound secured by Ben Stewart.

[05:07] Team_027 possession (Score: 25-30)
Tony Doncic makes the Midrange and draws the foul on Joel Wade! And-1! Tony Doncic to the line for 1. [Team fouls: 3] (Joel Wade: 1 personal fouls)   FT 1/1: GOOD Tony Doncic makes 1/1 from the line.
Score: 25-33

[04:50] Team_057 possession (Score: 25-33)
FOUL! Holding foul on LeBron Russell. [IN THE BONUS! 5 team fouls] Lamelo Irving to the line for 2 free throws. (LeBron Russell: 1 personal fouls)   FT 1/2: MISS   FT 2/2: GOOD Lamelo Irving makes 1/2 from the line.
Score: 26-33

[04:36] Team_027 possession (Score: 26-33)
Rudy Quickley attempts a 3Pt. Contested by Scottie Johnson (3.8 feet, ZONE). Rudy Quickley misses. Rebound secured by Joel Wade.

[04:20] Team_057 possession (Score: 26-33)
Bradley Ginobili drives, Ben Stewart stays with him. Bradley Ginobili attempts a Dunk. Contested by Ben Stewart (3.9 feet, ZONE). BRADLEY GINOBILI MAKES IT!
Score: 28-33

[04:08] Team_027 possession (Score: 28-33)
CJ Green attempts a 3Pt. Wide open! Lamelo Irving is 7.7 feet away. [ZONE] CJ Green misses. Rebound secured by Lamelo Irving.

[03:53] Team_057 possession (Score: 28-33)
FOUL! Shooting foul on Ben Stewart. Zion Lillard to the line for 2 free throws. [BONUS: 6 team fouls] (Ben Stewart: 1 personal fouls)   FT 1/2: GOOD   FT 2/2: GOOD Zion Lillard makes 2/2 from the line.
Score: 30-33

[03:40] Team_027 possession (Score: 30-33)
Rudy Quickley attempts a 3Pt. Contested by Scottie Johnson (3.5 feet, ZONE). RUDY QUICKLEY MAKES IT! Assist: CJ Green
Score: 30-36

[03:24] Team_057 possession (Score: 30-36)
Lamelo Irving drives to the basket... Lamelo Irving loses the ball! Stripped by Ben Stewart! TURNOVER! (live ball)

[03:08] Team_027 possession (Score: 30-36)
Tony Doncic attempts a Midrange. Wide open! Joel Wade is 7.7 feet away. [ZONE] Tony Doncic misses. Offensive rebound by LeBron Russell! LeBron Russell kicks it out.

[02:56] Team_027 possession (Score: 30-36)
Rudy Quickley attempts a 3Pt. Contested by Bradley Ginobili (5.2 feet, ZONE). RUDY QUICKLEY MAKES IT!
Score: 30-39

[02:47] Team_057 possession (Score: 30-39)
Zion Lillard drives to the basket... Zion Lillard loses the ball! Stripped by Ben Stewart! TURNOVER! (live ball)

[02:32] Team_027 possession (Score: 30-39)
CJ Green attempts a 3Pt. Contested by Scottie Johnson (3.6 feet, ZONE). CJ Green misses. Rebound secured by Zion Lillard.

[02:17] Team_057 possession (Score: 30-39)
Joel Wade attempts a 3Pt. Contested by Rudy Quickley (4.8 feet, ZONE). Joel Wade misses. Rebound secured by Ben Stewart.

[02:06] Team_027 possession (Score: 30-39)
CJ Green attempts a Midrange. Wide open! Joel Wade is 6.4 feet away. [ZONE] CJ GREEN MAKES IT!
Score: 30-41

[01:50] Team_057 possession (Score: 30-41)
Scottie Johnson drives, picks up Ben Stewart. Help arrives from Tony Doncic! Scottie Johnson attempts a Layup. Contested by Tony Doncic (3.4 feet, ZONE). SCOTTIE JOHNSON MAKES IT! Assist: Lamelo Irving
Score: 32-41

[01:39] Team_027 possession (Score: 32-41)
Ben Stewart attempts a Layup. BLOCKED BY ZION LILLARD! Ball is loose! Rebound secured by Lamelo Irving.

[01:27] Team_057 possession (Score: 32-41)
Bradley Ginobili attempts a 3Pt. Contested by Tony Doncic (4.7 feet, MAN). BRADLEY GINOBILI MAKES IT! Assist: Lamelo Irving
Score: 35-41

[01:11] Team_027 possession (Score: 35-41)
LeBron Russell drives, picks up Lamelo Irving. Help arrives from Bradley Ginobili! LeBron Russell attempts a Layup. Contested by Bradley Ginobili (2.6 feet, ZONE). LEBRON RUSSELL MAKES IT! Assist: CJ Green
Score: 35-43

[01:01] Team_057 possession (Score: 35-43)
Scottie Johnson drives, Ben Stewart stays with him. Scottie Johnson attempts a Layup. Contested by Ben Stewart (4.7 feet, ZONE). SCOTTIE JOHNSON MAKES IT! Assist: Lamelo Irving
Score: 37-43

[00:44] Team_027 possession (Score: 37-43)
Tony Doncic attempts a 3Pt. Wide open! Scottie Johnson is 7.5 feet away. [ZONE] TONY DONCIC MAKES IT! Assist: CJ Green
Score: 37-46

[00:27] Team_057 possession (Score: 37-46)
Scottie Johnson loses control! Ball rolls out of bounds! TURNOVER! (dead ball)

[00:27] Substitution (Team_027): Tony Doncic OUT → Dirk Lillard IN (stamina_rule2)

[00:15] Team_027 possession (Score: 37-46)
FOUL! Shooting foul on Zion Lillard. LeBron Russell to the line for 2 free throws. [Team fouls: 4] (Zion Lillard: 2 personal fouls)   FT 1/2: GOOD   FT 2/2: GOOD LeBron Russell makes 2/2 from the line.
Score: 37-48

================================================================================
                              2ND QUARTER COMPLETE                              
================================================================================

2ND QUARTER SCORE: Team_057 28, Team_027 32

BOX SCORE:
================================================================================

Team_057
--------------------------------------------------------------------------------
Player                MIN  PTS  REB  AST  TO      FG   FG%      3P   3P%
--------------------------------------------------------------------------------
Bradley Ginobili       12    8    0    1   0   3/3   100.0     0/0   0.0
Zion Lillard           12    7    3    0   0   3/4    75.0     0/0   0.0
Scottie Johnson        12    7    0    0   0   3/3   100.0     0/0   0.0
Ben Adebayo            12    3    1    0   0   1/1   100.0     0/0   0.0
Joel Wade              12    2    1    0   0   1/4    25.0     0/0   0.0
Lamelo Irving          12    1    5    4   0   1/1   100.0     0/0   0.0
Klay Rozier            12    0    0    0   0   0/1     0.0     0/0   0.0
Miles Middleton        12    0    1    0   0   0/0     0.0     0/0   0.0
Anfernee Adebayo       12    0    0    1   0   0/0     0.0     0/0   0.0

TEAM: FG: 12/17 (70.6%), 3PT: 5/7 (71.4%), REB: 11 (5 off, 6 def), AST: 6, TO: 3
TEAM FOULS: 4


Team_027
--------------------------------------------------------------------------------
Player                MIN  PTS  REB  AST  TO      FG   FG%      3P   3P%
--------------------------------------------------------------------------------
Rudy Quickley          12   10    0    0   0   4/6    66.7     0/0   0.0
Ben Stewart            12    8    3    0   0   3/4    75.0     0/0   0.0
Tony Doncic            23    6    1    1   0   2/3    66.7     0/0   0.0
LeBron Russell         12    4    2    2   0   2/2   100.0     0/0   0.0
John Russell           12    2    2    0   0   1/1   100.0     0/0   0.0
CJ Green               12    2    0    4   0   1/3    33.3     0/0   0.0

TEAM: FG: 13/19 (68.4%), 3PT: 5/9 (55.6%), REB: 8 (4 off, 4 def), AST: 7, TO: 1
TEAM FOULS: 6 [Team_057 in BONUS]

================================================================================

================================================================================
                       3RD QUARTER - Team_057 vs Team_027                       
================================================================================

[12:00] Team_057 possession (Score: 37-48)
Miles Middleton drives to the basket... Miles Middleton throws a bad pass! Stolen by John Russell! TURNOVER! (live ball)

[11:43] Team_027 possession (Score: 37-48)
Scottie Harden attempts a 3Pt. Contested by Anfernee Adebayo (4.1 feet, MAN). Scottie Harden misses. Rebound secured by Miles Middleton.

[11:26] Team_057 possession (Score: 37-48)
Anfernee Adebayo drives, picks up John Russell. Help arrives from Tony Doncic! Anfernee Adebayo attempts a Dunk. Heavily contested by Tony Doncic (1.9 feet, ZONE)! ANFERNEE ADEBAYO MAKES IT! Assist: Ben Adebayo
Score: 39-48

[11:11] Team_027 possession (Score: 39-48)
Scottie Harden attempts a 3Pt. Contested by Anfernee Adebayo (4.1 feet, MAN). Scottie Harden misses. Rebound secured by Miles Middleton.

[10:57] Team_057 possession (Score: 39-48)
FOUL! Holding foul on Scottie Harden. [Team fouls: 1] No free throws, side out. (Scottie Harden: 1 personal fouls)

[10:43] Team_057 possession (Score: 39-48)
Klay Rozier attempts a Midrange. Contested by Scottie Harden (6.0 feet, ZONE). Klay Rozier misses. Rebound secured by Tony Doncic.

[10:32] Team_027 possession (Score: 39-48)
Tony Doncic drives, picks up Ben Adebayo. Help arrives from Klay Rozier! Tony Doncic attempts a Dunk. Contested by Klay Rozier (2.7 feet, ZONE). TONY DONCIC MAKES IT!
Score: 39-50

[10:20] Team_057 possession (Score: 39-50)
Kobe Ming attempts a 3Pt. Contested by Tim Johnson (3.1 feet, MAN). Kobe Ming misses. Rebound secured by John Russell.

[10:06] Team_027 possession (Score: 39-50)
Tim Johnson drives to the basket... Tim Johnson throws a bad pass out of bounds! TURNOVER! (dead ball)

[09:53] Team_057 possession (Score: 39-50)
FOUL! Reach-in foul on John Russell during the drive. [Team fouls: 2] No free throws, side out. (John Russell: 1 personal fouls)

[09:39] Team_057 possession (Score: 39-50)
Miles Middleton attempts a Layup. Wide open! John Russell is 7.4 feet away. [MAN] MILES MIDDLETON MAKES IT! Assist: Kobe Ming
Score: 41-50

[09:28] Team_027 possession (Score: 41-50)
Tim Johnson attempts a 3Pt. Contested by Kobe Ming (5.8 feet, ZONE). Tim Johnson misses. Rebound secured by Miles Middleton.

[09:12] Team_057 possession (Score: 41-50)
Ben Adebayo attempts a Midrange. Contested by Bradley Dosunmu (5.2 feet, MAN). Ben Adebayo misses. Rebound secured by Tony Doncic.

[08:59] Team_027 possession (Score: 41-50)
Scottie Harden attempts a 3Pt. Contested by Anfernee Adebayo (4.1 feet, MAN). SCOTTIE HARDEN MAKES IT! Assist: Tim Johnson
Score: 41-53

[08:43] Team_057 possession (Score: 41-53)
Ben Adebayo drives and kicks out. Anfernee Adebayo attempts a Midrange. Contested by Scottie Harden (4.6 feet, ZONE). Anfernee Adebayo misses. Rebound secured by Tony Doncic.

[08:29] Team_027 possession (Score: 41-53)
FOUL! Offensive foul on Tim Johnson! Kobe Ming drew the charge! [Team fouls: 3] (Tim Johnson: 1 personal fouls) TURNOVER! (dead ball)

[08:19] Team_057 possession (Score: 41-53)
Klay Rozier attempts a 3Pt. Wide open! Tim Johnson is 6.6 feet away. [ZONE] Klay Rozier misses. FOUL! Loose ball foul on Tony Doncic during the rebound battle. [Team fouls: 4] No free throws, side out. (Tony Doncic: 1 personal fouls)

[08:05] Team_057 possession (Score: 41-53)
Miles Middleton attempts a Layup. BLOCKED BY JOHN RUSSELL! Ball is loose! Rebound secured by John Russell.

[07:51] Team_027 possession (Score: 41-53)
John Russell attempts a Layup. Contested by Miles Middleton (4.1 feet, MAN). JOHN RUSSELL MAKES IT! Assist: Tim Johnson
Score: 41-55

[07:38] Team_057 possession (Score: 41-55)
Ben Adebayo drives and kicks out. Ben Adebayo attempts a Midrange. Contested by Tim Johnson (4.9 feet, ZONE). BEN ADEBAYO MAKES IT!
Score: 43-55

[07:25] Team_027 possession (Score: 43-55)
FOUL! Shooting foul on Anfernee Adebayo. Scottie Harden to the line for 3 free throws. [Team fouls: 1] (Anfernee Adebayo: 1 personal fouls)   FT 1/3: MISS   FT 2/3: GOOD   FT 3/3: MISS Scottie Harden makes 1/3 from the line. Rebound secured by Anfernee Adebayo.
Score: 43-56

[07:11] Team_057 possession (Score: 43-56)
Ben Adebayo attempts a 3Pt. Contested by Bradley Dosunmu (5.3 feet, MAN). Ben Adebayo misses. Offensive rebound by Miles Middleton! Miles Middleton kicks it out.

[07:01] Team_057 possession (Score: 43-56)
FOUL! Shooting foul on Tony Doncic. Klay Rozier to the line for 2 free throws. [BONUS: 5 team fouls] (Tony Doncic: 2 personal fouls)   FT 1/2: GOOD   FT 2/2: GOOD Klay Rozier makes 2/2 from the line.
Score: 45-56

[06:46] Team_027 possession (Score: 45-56)
John Russell drives and kicks out. Tony Doncic attempts a 3Pt. Contested by Klay Rozier (2.0 feet, MAN). Tony Doncic misses. Offensive rebound by Bradley Dosunmu! Bradley Dosunmu kicks it out.

[06:31] Team_027 possession (Score: 45-56)
Scottie Harden attempts a 3Pt. Wide open! Ben Adebayo is 7.0 feet away. [ZONE] SCOTTIE HARDEN MAKES IT! Assist: John Russell
Score: 45-59

[06:13] Team_057 possession (Score: 45-59)
Klay Rozier drives to the basket... Klay Rozier loses control! Ball rolls out of bounds! TURNOVER! (dead ball)

[05:54] Team_027 possession (Score: 45-59)
Tony Doncic attempts a 3Pt. Contested by Kobe Ming (4.8 feet, ZONE). Tony Doncic misses. Rebound secured by Miles Middleton.

[05:38] Team_057 possession (Score: 45-59)
Kobe Ming attempts a 3Pt. Wide open! Tim Johnson is 6.6 feet away. [ZONE] KOBE MING MAKES IT! Assist: Klay Rozier
Score: 48-59

[05:27] Team_027 possession (Score: 48-59)
Bradley Dosunmu attempts a 3Pt. Wide open! Kobe Ming is 6.2 feet away. [ZONE] Bradley Dosunmu misses. Rebound secured by Ben Adebayo.

[05:16] Team_057 possession (Score: 48-59)
Klay Rozier throws a bad pass! Stolen by Tony Doncic! TURNOVER! (live ball)

[05:04] Team_027 possession (Score: 48-59)
John Russell attempts a Layup. Wide open! Ben Adebayo is 6.8 feet away. [ZONE] JOHN RUSSELL MAKES IT! Assist: Tony Doncic
Score: 48-61

[04:46] Team_057 possession (Score: 48-61)
Ben Adebayo makes the Layup and draws the foul on John Russell! And-1! Ben Adebayo to the line for 1. [BONUS: 6 team fouls] (John Russell: 2 personal fouls)   FT 1/1: GOOD Ben Adebayo makes 1/1 from the line.
Score: 51-61

[04:34] Team_027 possession (Score: 51-61)
John Russell drives, Ben Adebayo stays with him. John Russell attempts a Layup. Contested by Ben Adebayo (4.9 feet, ZONE). JOHN RUSSELL MAKES IT! Assist: Scottie Harden
Score: 51-63

[04:23] Team_057 possession (Score: 51-63)
Ben Adebayo drives, Bradley Dosunmu stays with him. Ben Adebayo attempts a Dunk. Contested by Bradley Dosunmu (4.3 feet, MAN). Ben Adebayo misses. Rebound secured by Tony Doncic.

[04:12] Team_027 possession (Score: 51-63)
Bradley Dosunmu attempts a Layup. BLOCKED BY BEN ADEBAYO! Ball is loose! Offensive rebound by John Russell! John Russell kicks it out.

[04:00] Team_027 possession (Score: 51-63)
Scottie Harden drives to the basket... Scottie Harden commits a violation (traveling/carry)! TURNOVER! (dead ball)

[03:47] Team_057 possession (Score: 51-63)
Anfernee Adebayo drives and kicks out. Miles Middleton attempts a 3Pt. Wide open! John Russell is 6.6 feet away. [MAN] Miles Middleton misses. Offensive rebound by Ben Adebayo! Ben Adebayo kicks it out.

[03:34] Team_057 possession (Score: 51-63)
FOUL! Shooting foul on John Russell. Klay Rozier to the line for 2 free throws. [BONUS: 7 team fouls] (John Russell: 3 personal fouls)   FT 1/2: GOOD   FT 2/2: GOOD Klay Rozier makes 2/2 from the line.
Score: 53-63

[03:16] Team_027 possession (Score: 53-63)
John Russell attempts a Layup. Wide open! Ben Adebayo is 6.2 feet away. [ZONE] JOHN RUSSELL MAKES IT!
Score: 53-65

[02:59] Team_057 possession (Score: 53-65)
Ben Adebayo attempts a Layup. Contested by John Russell (2.3 feet, ZONE). BEN ADEBAYO MAKES IT! Assist: Anfernee Adebayo
Score: 55-65

[02:47] Team_027 possession (Score: 55-65)
FOUL! Holding foul on Klay Rozier. [Team fouls: 2] No free throws, side out. (Klay Rozier: 1 personal fouls)

[02:33] Team_027 possession (Score: 55-65)
Bradley Dosunmu drives and kicks out. John Russell attempts a Midrange. Wide open! Anfernee Adebayo is 7.0 feet away. [ZONE] JOHN RUSSELL MAKES IT! Assist: Scottie Harden
Score: 55-67

[02:21] Team_057 possession (Score: 55-67)
Anfernee Adebayo makes the Layup and draws the foul on Scottie Harden! And-1! Anfernee Adebayo to the line for 1. [BONUS: 8 team fouls] (Scottie Harden: 2 personal fouls)   FT 1/1: GOOD Anfernee Adebayo makes 1/1 from the line.
Score: 58-67

[02:09] Team_027 possession (Score: 58-67)
Tim Johnson attempts a 3Pt. Contested by Kobe Ming (4.7 feet, ZONE). Tim Johnson misses. Rebound secured by Anfernee Adebayo.

[01:53] Team_057 possession (Score: 58-67)
Ben Adebayo drives, picks up Bradley Dosunmu. Help arrives from Tony Doncic! Ben Adebayo attempts a Dunk. Contested by Tony Doncic (4.5 feet, MAN). BEN ADEBAYO MAKES IT! Assist: Klay Rozier
Score: 60-67

[01:40] Team_027 possession (Score: 60-67)
FOUL! Shooting foul on Kobe Ming. Tim Johnson to the line for 3 free throws. [Team fouls: 3] (Kobe Ming: 1 personal fouls)   FT 1/3: GOOD   FT 2/3: MISS   FT 3/3: GOOD Tim Johnson makes 2/3 from the line.
Score: 60-69

[01:25] Team_057 possession (Score: 60-69)
Klay Rozier drives, Tony Doncic stays with him. Klay Rozier attempts a Layup. Contested by Tony Doncic (4.3 feet, MAN). KLAY ROZIER MAKES IT! Assist: Miles Middleton
Score: 62-69

[01:12] Team_027 possession (Score: 62-69)
Scottie Harden attempts a Midrange. Contested by Anfernee Adebayo (5.5 feet, MAN). Scottie Harden misses. Offensive rebound by Bradley Dosunmu! Bradley Dosunmu kicks it out.

[00:57] Team_027 possession (Score: 62-69)
Tony Doncic attempts a 3Pt. Contested by Klay Rozier (5.3 feet, MAN). Tony Doncic misses. Rebound secured by Anfernee Adebayo.

[00:44] Team_057 possession (Score: 62-69)
Miles Middleton commits a violation (traveling/carry)! TURNOVER! (dead ball)

[00:44] Substitution (Team_057): Kobe Ming OUT → Scottie Johnson IN (stamina_rule2)

[00:44] Substitution (Team_057): Klay Rozier OUT → Bradley Ginobili IN (stamina_rule2)

[00:44] Substitution (Team_057): Anfernee Adebayo OUT → Joel Wade IN (stamina_rule2)

[00:44] Substitution (Team_057): Ben Adebayo OUT → Lamelo Irving IN (stamina_rule2)

[00:44] Substitution (Team_057): Miles Middleton OUT → Zion Lillard IN (stamina_rule2)

[00:44] Substitution (Team_027): Tim Johnson OUT → CJ Green IN (stamina_rule2)

[00:44] Substitution (Team_027): Tony Doncic OUT → Dirk Lillard IN (stamina_rule2)

[00:44] Substitution (Team_027): Scottie Harden OUT → Rudy Quickley IN (stamina_rule2)

[00:44] Substitution (Team_027): Bradley Dosunmu OUT → LeBron Russell IN (stamina_rule2)

[00:44] Substitution (Team_027): John Russell OUT → Ben Stewart IN (stamina_rule2)

[00:29] Team_027 possession (Score: 62-69)
Ben Stewart attempts a 3Pt. Contested by Zion Lillard (3.7 feet, MAN). Ben Stewart misses. Rebound secured by Lamelo Irving.

[00:11] Team_057 possession (Score: 62-69)
Lamelo Irving attempts a 3Pt. Wide open! LeBron Russell is 7.7 feet away. [MAN] Lamelo Irving misses. Rebound secured by LeBron Russell.

================================================================================
                              3RD QUARTER COMPLETE                              
================================================================================

3RD QUARTER SCORE: Team_057 25, Team_027 21

BOX SCORE:
================================================================================

Team_057
--------------------------------------------------------------------------------
Player                MIN  PTS  REB  AST  TO      FG   FG%      3P   3P%
--------------------------------------------------------------------------------
Ben Adebayo            24    9    2    1   0   4/7    57.1     0/0   0.0
Klay Rozier            24    6    0    2   0   3/4    75.0     0/0   0.0
Anfernee Adebayo       24    5    3    1   0   2/2   100.0     0/0   0.0
Kobe Ming              24    3    0    1   0   1/2    50.0     0/0   0.0
Miles Middleton        24    2    6    1   0   1/2    50.0     0/0   0.0
Lamelo Irving          12    0    1    0   0   0/1     0.0     0/0   0.0

TEAM: FG: 11/18 (61.1%), 3PT: 1/3 (33.3%), REB: 12 (3 off, 9 def), AST: 6, TO: 4
TEAM FOULS: 3


Team_027
--------------------------------------------------------------------------------
Player                MIN  PTS  REB  AST  TO      FG   FG%      3P   3P%
--------------------------------------------------------------------------------
John Russell           24   10    3    1   0   5/5   100.0     0/0   0.0
Scottie Harden         24    6    0    2   0   2/5    40.0     0/0   0.0
Tony Doncic            34    2    4    1   0   1/3    33.3     0/0   0.0
Tim Johnson            24    2    0    2   0   1/3    33.3     0/0   0.0
Bradley Dosunmu        24    0    2    0   0   0/1     0.0     0/0   0.0
Ben Stewart            12    0    0    0   0   0/1     0.0     0/0   0.0
LeBron Russell         12    0    1    0   0   0/0     0.0     0/0   0.0

TEAM: FG: 9/18 (50.0%), 3PT: 3/12 (25.0%), REB: 10 (3 off, 7 def), AST: 6, TO: 3
TEAM FOULS: 8 [Team_057 in BONUS]

================================================================================

================================================================================
                       4TH QUARTER - Team_057 vs Team_027                       
================================================================================

[12:00] Team_057 possession (Score: 62-69)
Ben Adebayo attempts a 3Pt. Contested by Tim Johnson (3.3 feet, ZONE). Ben Adebayo misses. Rebound secured by Tony Doncic.

[11:46] Team_027 possession (Score: 62-69)
Tony Doncic attempts a Layup. Heavily contested by Ben Adebayo (0.9 feet, ZONE)! TONY DONCIC MAKES IT!
Score: 62-71

[11:30] Team_057 possession (Score: 62-71)
Ben Adebayo attempts a Midrange. Contested by Scottie Harden (4.3 feet, ZONE). Ben Adebayo misses. Offensive rebound by Miles Middleton! Miles Middleton kicks it out.

[11:15] Team_057 possession (Score: 62-71)
FOUL! Holding foul on Bradley Dosunmu. [Team fouls: 1] No free throws, side out. (Bradley Dosunmu: 1 personal fouls)

[10:58] Team_057 possession (Score: 62-71)
Anfernee Adebayo attempts a Layup. Heavily contested by John Russell (0.5 feet, ZONE)! ANFERNEE ADEBAYO MAKES IT!
Score: 64-71

[10:43] Team_027 possession (Score: 64-71)
Bradley Dosunmu attempts a Midrange. Contested by Ben Adebayo (2.1 feet, MAN). BRADLEY DOSUNMU MAKES IT! Assist: Tim Johnson
Score: 64-73

[10:31] Team_057 possession (Score: 64-73)
Anfernee Adebayo drives, picks up Scottie Harden. Help arrives from Tony Doncic! Anfernee Adebayo attempts a Layup. Wide open! Tony Doncic is 6.9 feet away. [MAN] ANFERNEE ADEBAYO MAKES IT!
Score: 66-73

[10:18] Team_027 possession (Score: 66-73)
Tim Johnson drives and kicks out. Bradley Dosunmu attempts a Midrange. Wide open! Klay Rozier is 7.1 feet away. [ZONE] BRADLEY DOSUNMU MAKES IT! Assist: John Russell
Score: 66-75

[10:08] Team_057 possession (Score: 66-75)
Miles Middleton drives and kicks out. Anfernee Adebayo attempts a Midrange. Contested by Tim Johnson (4.4 feet, ZONE). Anfernee Adebayo misses. Offensive rebound by Miles Middleton! Miles Middleton kicks it out.

[09:53] Team_057 possession (Score: 66-75)
Klay Rozier attempts a 3Pt. Wide open! Tony Doncic is 6.6 feet away. [MAN] KLAY ROZIER MAKES IT! Assist: Miles Middleton
Score: 69-75

[09:39] Team_027 possession (Score: 69-75)
Bradley Dosunmu attempts a 3Pt. Contested by Ben Adebayo (2.6 feet, MAN). BRADLEY DOSUNMU MAKES IT! Assist: Tony Doncic
Score: 69-78

[09:25] Team_057 possession (Score: 69-78)
Klay Rozier attempts a 3Pt. Heavily contested by Bradley Dosunmu (1.4 feet, ZONE)! Klay Rozier misses. Rebound secured by Tony Doncic.

[09:07] Team_027 possession (Score: 69-78)
Tim Johnson drives, picks up Ben Adebayo. Help arrives from Klay Rozier! Tim Johnson attempts a Dunk. Wide open! Klay Rozier is 6.4 feet away. [ZONE] TIM JOHNSON MAKES IT! Assist: Bradley Dosunmu
Score: 69-80

[08:52] Team_057 possession (Score: 69-80)
FOUL! Holding foul on Bradley Dosunmu. [Team fouls: 2] No free throws, side out. (Bradley Dosunmu: 2 personal fouls)

[08:37] Team_057 possession (Score: 69-80)
Klay Rozier attempts a Midrange. Wide open! Scottie Harden is 6.8 feet away. [ZONE] Klay Rozier misses. Offensive rebound by Miles Middleton! Miles Middleton kicks it out.

[08:27] Team_057 possession (Score: 69-80)
Klay Rozier attempts a 3Pt. Contested by Bradley Dosunmu (4.4 feet, ZONE). Klay Rozier misses. Offensive rebound by Ben Adebayo! Ben Adebayo kicks it out.

[08:08] Team_057 possession (Score: 69-80)
Miles Middleton attempts a Layup. Contested by John Russell (3.5 feet, MAN). MILES MIDDLETON MAKES IT! Assist: Ben Adebayo
Score: 71-80

[07:54] Team_027 possession (Score: 71-80)
FOUL! Offensive foul on Scottie Harden! Anfernee Adebayo drew the charge! [Team fouls: 3] (Scottie Harden: 1 personal fouls) TURNOVER! (dead ball)

[07:38] Team_057 possession (Score: 71-80)
Miles Middleton attempts a 3Pt. Contested by John Russell (3.4 feet, MAN). Miles Middleton misses. Offensive rebound by Ben Adebayo! Ben Adebayo kicks it out.

[07:19] Team_057 possession (Score: 71-80)
Klay Rozier attempts a Layup. Contested by John Russell (3.5 feet, ZONE). KLAY ROZIER MAKES IT! Assist: Anfernee Adebayo
Score: 73-80

[07:08] Team_027 possession (Score: 73-80)
Tony Doncic attempts a 3Pt. Contested by Klay Rozier (5.2 feet, MAN). TONY DONCIC MAKES IT! Assist: Tim Johnson
Score: 73-83

[06:51] Team_057 possession (Score: 73-83)
Kobe Ming throws a bad pass out of bounds! TURNOVER! (dead ball)

[06:51] Substitution (Team_057): Kobe Ming OUT → Scottie Johnson IN (stamina_rule2)

[06:51] Substitution (Team_057): Klay Rozier OUT → Bradley Ginobili IN (stamina_rule2)

[06:51] Substitution (Team_057): Anfernee Adebayo OUT → Joel Wade IN (stamina_rule2)

[06:51] Substitution (Team_057): Ben Adebayo OUT → Lamelo Irving IN (stamina_rule2)

[06:51] Substitution (Team_057): Miles Middleton OUT → Zion Lillard IN (stamina_rule2)

[06:51] Substitution (Team_027): Tim Johnson OUT → CJ Green IN (stamina_rule2)

[06:51] Substitution (Team_027): Tony Doncic OUT → Dirk Lillard IN (stamina_rule2)

[06:51] Substitution (Team_027): Scottie Harden OUT → Rudy Quickley IN (stamina_rule2)

[06:51] Substitution (Team_027): Bradley Dosunmu OUT → LeBron Russell IN (stamina_rule2)

[06:51] Substitution (Team_027): John Russell OUT → Ben Stewart IN (stamina_rule2)

[06:35] Team_027 possession (Score: 73-83)
Rudy Quickley throws a bad pass! Stolen by Joel Wade! TURNOVER! (live ball)

[06:24] Team_057 possession (Score: 73-83)
Zion Lillard drives to the basket... Zion Lillard throws a bad pass out of bounds! TURNOVER! (dead ball)

[06:06] Team_027 possession (Score: 73-83)
CJ Green attempts a 3Pt. Contested by Scottie Johnson (3.0 feet, ZONE). CJ Green misses. Rebound secured by Zion Lillard.

[05:53] Team_057 possession (Score: 73-83)
Zion Lillard attempts a Midrange. Contested by Ben Stewart (3.7 feet, MAN). ZION LILLARD MAKES IT!
Score: 75-83

[05:39] Team_027 possession (Score: 75-83)
Dirk Lillard attempts a Layup. Wide open! Lamelo Irving is 6.9 feet away. [ZONE] DIRK LILLARD MAKES IT! Assist: Rudy Quickley
Score: 75-85

[05:25] Team_057 possession (Score: 75-85)
Lamelo Irving makes the Layup and draws the foul on LeBron Russell! And-1! Lamelo Irving to the line for 1. [Team fouls: 4] (LeBron Russell: 1 personal fouls)   FT 1/1: GOOD Lamelo Irving makes 1/1 from the line.
Score: 78-85

[05:08] Team_027 possession (Score: 78-85)
Dirk Lillard attempts a 3Pt. Contested by Bradley Ginobili (5.8 feet, MAN). Dirk Lillard misses. Rebound secured by Lamelo Irving.

[04:50] Team_057 possession (Score: 78-85)
Scottie Johnson drives, picks up CJ Green. Help arrives from Dirk Lillard! Scottie Johnson attempts a Layup. Heavily contested by Dirk Lillard (1.8 feet, MAN)! SCOTTIE JOHNSON MAKES IT!
Score: 80-85

[04:38] Team_027 possession (Score: 80-85)
Dirk Lillard attempts a 3Pt. Heavily contested by Bradley Ginobili (1.7 feet, MAN)! Dirk Lillard misses. Rebound secured by Joel Wade.

[04:22] Team_057 possession (Score: 80-85)
FOUL! Shooting foul on Rudy Quickley. Joel Wade to the line for 2 free throws. [BONUS: 5 team fouls] (Rudy Quickley: 1 personal fouls)   FT 1/2: GOOD   FT 2/2: GOOD Joel Wade makes 2/2 from the line.
Score: 82-85

[04:09] Team_027 possession (Score: 82-85)
CJ Green attempts a 3Pt. Wide open! Scottie Johnson is 10.0 feet away. [ZONE] CJ Green misses. Offensive rebound by Dirk Lillard! Dirk Lillard kicks it out.

[03:53] Team_027 possession (Score: 82-85)
CJ Green attempts a Midrange. Contested by Scottie Johnson (5.9 feet, MAN). CJ GREEN MAKES IT! Assist: Rudy Quickley
Score: 82-87

[03:37] Team_057 possession (Score: 82-87)
Zion Lillard attempts a Midrange. Contested by Ben Stewart (5.4 feet, MAN). Zion Lillard misses. Rebound secured by Ben Stewart.

[03:25] Team_027 possession (Score: 82-87)
CJ Green attempts a Layup. BLOCKED BY LAMELO IRVING! Ball deflects out of bounds off CJ Green.

[03:15] Team_057 possession (Score: 82-87)
FOUL! Shooting foul on LeBron Russell. Bradley Ginobili to the line for 2 free throws. [BONUS: 6 team fouls] (LeBron Russell: 2 personal fouls)   FT 1/2: GOOD   FT 2/2: GOOD Bradley Ginobili makes 2/2 from the line.
Score: 84-87

[03:00] Team_027 possession (Score: 84-87)
Rudy Quickley drives to the basket... Rudy Quickley throws a bad pass! Stolen by Joel Wade! TURNOVER! (live ball)

[02:46] Team_057 possession (Score: 84-87)
Bradley Ginobili attempts a 3Pt. Contested by Dirk Lillard (3.5 feet, MAN). BRADLEY GINOBILI MAKES IT! Assist: Zion Lillard
Score: 87-87

[02:29] Team_027 possession (Score: 87-87)
LeBron Russell attempts a Midrange. Contested by Joel Wade (4.1 feet, ZONE). LeBron Russell misses. Rebound secured by Zion Lillard.

[02:17] Team_057 possession (Score: 87-87)
FOUL! Reach-in foul on CJ Green during the drive. [IN THE BONUS! 7 team fouls] Scottie Johnson to the line for 2 free throws. (CJ Green: 1 personal fouls)   FT 1/2: MISS   FT 2/2: GOOD Scottie Johnson makes 1/2 from the line.
Score: 88-87

[02:04] Team_027 possession (Score: 88-87)
LeBron Russell drives and kicks out. Rudy Quickley attempts a 3Pt. Wide open! Joel Wade is 6.7 feet away. [MAN] Rudy Quickley misses. Rebound secured by Zion Lillard.

[01:48] Team_057 possession (Score: 88-87)
Lamelo Irving attempts a 3Pt. Heavily contested by Rudy Quickley (1.3 feet, ZONE)! Lamelo Irving misses. Rebound secured by Dirk Lillard.

[01:30] Team_027 possession (Score: 88-87)
Rudy Quickley attempts a Midrange. Wide open! Joel Wade is 7.0 feet away. [MAN] Rudy Quickley misses. Rebound secured by Lamelo Irving.

[01:13] Team_057 possession (Score: 88-87)
Joel Wade attempts a 3Pt. Wide open! Rudy Quickley is 7.5 feet away. [MAN] JOEL WADE MAKES IT! Assist: Bradley Ginobili
Score: 91-87

[01:01] Team_027 possession (Score: 91-87)
Rudy Quickley drives and kicks out. Dirk Lillard attempts a 3Pt. Wide open! Scottie Johnson is 6.8 feet away. [ZONE] DIRK LILLARD MAKES IT! Assist: CJ Green
Score: 91-90

[00:48] Team_057 possession (Score: 91-90)
FOUL! Holding foul on Ben Stewart. [IN THE BONUS! 8 team fouls] Zion Lillard to the line for 2 free throws. (Ben Stewart: 1 personal fouls)   FT 1/2: MISS   FT 2/2: MISS Zion Lillard makes 0/2 from the line. Rebound secured by Ben Stewart.

[00:33] Team_027 possession (Score: 91-90)
Rudy Quickley attempts a Layup. Wide open! Lamelo Irving is 8.1 feet away. [ZONE] Rudy Quickley misses. Rebound secured by Lamelo Irving.

[00:21] Team_057 possession (Score: 91-90)
Bradley Ginobili attempts a 3Pt. Heavily contested by Rudy Quickley (0.5 feet, ZONE)! Bradley Ginobili misses. Rebound secured by Dirk Lillard.

[00:06] Team_027 possession (Score: 91-90)
LeBron Russell makes the Layup and draws the foul on Lamelo Irving! And-1! LeBron Russell to the line for 1. [Team fouls: 1] (Lamelo Irving: 1 personal fouls)   FT 1/1: GOOD LeBron Russell makes 1/1 from the line.
Score: 91-93

================================================================================
                              4TH QUARTER COMPLETE                              
================================================================================

4TH QUARTER SCORE: Team_057 29, Team_027 24

BOX SCORE:
================================================================================

Team_057
--------------------------------------------------------------------------------
Player                MIN  PTS  REB  AST  TO      FG   FG%      3P   3P%
--------------------------------------------------------------------------------
Klay Rozier            29    5    0    0   0   2/3    66.7     0/0   0.0
Joel Wade              19    5    1    0   0   2/2   100.0     0/0   0.0
Bradley Ginobili       19    5    0    1   0   2/3    66.7     0/0   0.0
Anfernee Adebayo       29    4    0    1   0   2/2   100.0     0/0   0.0
Lamelo Irving          19    3    3    0   0   1/2    50.0     0/0   0.0
Scottie Johnson        19    3    0    0   0   2/2   100.0     0/0   0.0
Miles Middleton        29    2    3    1   0   1/1   100.0     0/0   0.0
Zion Lillard           19    2    3    1   0   1/2    50.0     0/0   0.0
Ben Adebayo            29    0    2    1   0   0/1     0.0     0/0   0.0

TEAM: FG: 13/19 (68.4%), 3PT: 3/7 (42.9%), REB: 12 (5 off, 7 def), AST: 5, TO: 2
TEAM FOULS: 1


Team_027
--------------------------------------------------------------------------------
Player                MIN  PTS  REB  AST  TO      FG   FG%      3P   3P%
--------------------------------------------------------------------------------
Bradley Dosunmu        29    7    0    1   0   3/3   100.0     0/0   0.0
Tony Doncic            40    5    2    1   0   2/2   100.0     0/0   0.0
Dirk Lillard            9    5    3    0   0   2/4    50.0     0/0   0.0
LeBron Russell         19    3    0    0   0   1/3    33.3     0/0   0.0
Tim Johnson            29    2    0    2   0   1/1   100.0     0/0   0.0
CJ Green               19    2    0    1   0   1/3    33.3     0/0   0.0
John Russell           29    0    0    1   0   0/0     0.0     0/0   0.0
Rudy Quickley          19    0    0    2   0   0/2     0.0     0/0   0.0
Ben Stewart            19    0    2    0   0   0/0     0.0     0/0   0.0

TEAM: FG: 10/18 (55.6%), 3PT: 2/5 (40.0%), REB: 7 (1 off, 6 def), AST: 8, TO: 3
TEAM FOULS: 8 [Team_057 in BONUS]

================================================================================

================================================================================
                               FULL GAME COMPLETE                               
================================================================================

FINAL SCORE: Team_057 91, Team_027 93

SCORING BY QUARTER:
--------------------------------------------------------------------------------
Team                     Q1     Q2     Q3     Q4    FINAL
--------------------------------------------------------------------------------
Team_057                  9     28     25     29       91
Team_027                 16     32     21     24       93
--------------------------------------------------------------------------------

FULL GAME BOX SCORE:
================================================================================

Team_057
--------------------------------------------------------------------------------
Player                MIN  PTS  REB  AST  TO      FG   FG%      3P   3P%      FT STL BLK
--------------------------------------------------------------------------------
Kobe Ming              29    5    0    1   2   2/6    33.3   1/2    50.0   0/1     0   0
Klay Rozier            29   13    0    2   4   6/9    66.7   1/3    33.3   4/4     0   0
Anfernee Adebayo       29    9    5    4   1   4/7    57.1   0/2     0.0   1/1     0   0
Ben Adebayo            29   15   12    3   2   6/14   42.9   1/3    33.3   2/2     0   3
Miles Middleton        29    4   13    2   1   2/4    50.0   0/0     0.0   0/0     1   0
Scottie Johnson        19   10    0    0   1   5/6    83.3   1/2    50.0   1/2     0   0
Bradley Ginobili       19   13    0    2   2   5/6    83.3   3/4    75.0   2/2     0   0
Joel Wade              19    7    3    0   0   4/7    57.1   2/3    66.7   2/2     2   0
Lamelo Irving          19    4   10    4   1   1/3    33.3   0/2     0.0   2/3     0   1
Zion Lillard           19    9    6    1   1   3/5    60.0   0/0     0.0   3/5     0   1

TEAM: FG: 39/69 (56.5%), 3PT: 9/21 (42.9%), REB: 48 (17 off, 31 def), AST: 19, TO: 15


Team_027
--------------------------------------------------------------------------------
Player                MIN  PTS  REB  AST  TO      FG   FG%      3P   3P%      FT STL BLK
--------------------------------------------------------------------------------
Tony Doncic            40   13    9    4   1   6/11   54.5   2/6    33.3   1/1     1   0
Tim Johnson            29   11    0    4   3   6/10   60.0   2/4    50.0   4/5     0   0
Scottie Harden         29    7    0    2   2   3/6    50.0   2/5    40.0   2/5     0   0
Bradley Dosunmu        29    9    9    1   0   5/7    71.4   1/2    50.0   0/1     0   0
John Russell           29   16    9    2   2   4/8    50.0   0/0     0.0   0/1     2   1
CJ Green               19    4    0    5   0   2/6    33.3   0/3     0.0   0/0     1   0
Rudy Quickley          19   10    0    2   1   5/10   50.0   2/4    50.0   0/0     0   1
LeBron Russell         19    7    3    2   0   3/5    60.0   0/0     0.0   3/3     0   1
Ben Stewart            19    8    6    0   2   3/5    60.0   2/3    66.7   0/0     2   0
Dirk Lillard            9    5    3    0   0   1/4    25.0   0/2     0.0   0/0     0   0

TEAM: FG: 38/72 (52.8%), 3PT: 11/29 (37.9%), REB: 39 (10 off, 29 def), AST: 22, TO: 11

================================================================================
