================================================================================
                        FULL GAME - Team_033 vs Team_042                        
================================================================================

================================================================================
                       1ST QUARTER - Team_033 vs Team_042                       
================================================================================

[12:00] Team_033 possession (Score: 0-0)
Bradley Simmons attempts a Midrange. BLOCKED BY DEJOUNTE BUTLER! Ball goes out off Dejounte Butler. Bradley Simmons's ball!

[11:48] Team_033 possession (Score: 0-0)
Joel Green drives, picks up Tyler Barrett. Help arrives from Jarrett Sabonis! Joel Green attempts a Dunk. Contested by Jarrett Sabonis (2.5 feet, MAN). JOEL GREEN MAKES IT! Assist: Bradley Simmons
Score: 2-0

[11:29] Team_042 possession (Score: 2-0)
Tyler Barrett drives, picks up Joel Green. Help arrives from Cade Randle! Tyler Barrett attempts a Layup. Contested by Cade Randle (2.6 feet, MAN). Tyler Barrett misses. Rebound secured by Desmond DeRozan.

[11:17] Team_033 possession (Score: 2-0)
Desmond DeRozan drives and kicks out. Cade Randle attempts a Midrange. Contested by Tyler Barrett (5.0 feet, ZONE). Cade Randle misses. Offensive rebound by Desmond DeRozan! Desmond DeRozan kicks it out.

[11:07] Team_033 possession (Score: 2-0)
Cade Randle attempts a Layup. BLOCKED BY TYLER BARRETT! Ball goes out off Tyler Barrett. Cade Randle's ball!

[10:54] Team_033 possession (Score: 2-0)
FOUL! Shooting foul on Tyler Barrett. Cade Randle to the line for 3 free throws. [Team fouls: 1] (Tyler Barrett: 1 personal fouls)   FT 1/3: GOOD   FT 2/3: GOOD   FT 3/3: GOOD Cade Randle makes 3/3 from the line.
Score: 5-0

[10:42] Team_042 possession (Score: 5-0)
Cade Dosunmu drives and kicks out. Cade Dosunmu attempts a 3Pt. Contested by Joel Green (5.6 feet, ZONE). Cade Dosunmu misses. Rebound secured by Desmond DeRozan.

[10:28] Team_033 possession (Score: 5-0)
Bradley Simmons attempts a Layup. Heavily contested by Cade Dosunmu (1.3 feet, MAN)! BRADLEY SIMMONS MAKES IT!
Score: 7-0

[10:16] Team_042 possession (Score: 7-0)
Cade Dosunmu drives and kicks out. Kristaps Parker attempts a Midrange. Wide open! Chris Anunoby is 6.1 feet away. [MAN] KRISTAPS PARKER MAKES IT! Assist: Jarrett Sabonis
Score: 7-2

[10:01] Team_033 possession (Score: 7-2)
Desmond DeRozan drives to the basket... Desmond DeRozan loses control! Ball rolls out of bounds! TURNOVER! (dead ball)

[09:48] Team_042 possession (Score: 7-2)
Cade Dosunmu commits a violation (traveling/carry)! TURNOVER! (dead ball)

[09:32] Team_033 possession (Score: 7-2)
Desmond DeRozan attempts a Midrange. Contested by Jarrett Sabonis (4.5 feet, ZONE). Desmond DeRozan misses. Offensive rebound by Desmond DeRozan! Desmond DeRozan kicks it out.

[09:17] Team_033 possession (Score: 7-2)
FOUL! Shooting foul on Cade Dosunmu. Chris Anunoby to the line for 2 free throws. [Team fouls: 2] (Cade Dosunmu: 1 personal fouls)   FT 1/2: GOOD   FT 2/2: MISS Chris Anunoby makes 1/2 from the line. Rebound secured by Dejounte Butler.
Score: 8-2

[09:01] Team_042 possession (Score: 8-2)
Jarrett Sabonis attempts a Layup. Heavily contested by Cade Randle (0.5 feet, MAN)! JARRETT SABONIS MAKES IT! Assist: Dejounte Butler
Score: 8-4

[08:43] Team_033 possession (Score: 8-4)
Chris Anunoby attempts a Layup. Contested by Kristaps Parker (2.3 feet, MAN). CHRIS ANUNOBY MAKES IT! Assist: Cade Randle
Score: 10-4

[08:30] Team_042 possession (Score: 10-4)
Tyler Barrett attempts a Midrange. Contested by Desmond DeRozan (3.4 feet, ZONE). Tyler Barrett misses. Rebound secured by Desmond DeRozan.

[08:20] Team_033 possession (Score: 10-4)
Bradley Simmons attempts a Dunk. BLOCKED BY CADE DOSUNMU! Ball is loose! Rebound secured by Tyler Barrett.

[08:07] Team_042 possession (Score: 10-4)
Dejounte Butler makes the Layup and draws the foul on Bradley Simmons! And-1! Dejounte Butler to the line for 1. [Team fouls: 1] (Bradley Simmons: 1 personal fouls)   FT 1/1: GOOD Dejounte Butler makes 1/1 from the line.
Score: 10-7

[07:51] Team_033 possession (Score: 10-7)
Chris Anunoby drives and kicks out. Bradley Simmons attempts a 3Pt. Contested by Cade Dosunmu (5.5 feet, MAN). Bradley Simmons misses. Rebound secured by Cade Dosunmu.

[07:38] Team_042 possession (Score: 10-7)
FOUL! Reach-in foul on Bradley Simmons during the drive. [Team fouls: 2] No free throws, side out. (Bradley Simmons: 2 personal fouls)

[07:24] Team_042 possession (Score: 10-7)
Cade Dosunmu attempts a Layup. Contested by Bradley Simmons (5.3 feet, ZONE). CADE DOSUNMU MAKES IT! Assist: Jarrett Sabonis
Score: 10-9

[07:06] Team_033 possession (Score: 10-9)
Bradley Simmons drives and kicks out. Joel Green attempts a 3Pt. Contested by Tyler Barrett (3.8 feet, MAN). Joel Green misses. FOUL! Loose ball foul on Tyler Barrett during the rebound battle. [Team fouls: 3] No free throws, side out. (Tyler Barrett: 2 personal fouls)

[06:50] Team_033 possession (Score: 10-9)
Bradley Simmons makes the Layup and draws the foul on Tyler Barrett! And-1! Bradley Simmons to the line for 1. [Team fouls: 4] (Tyler Barrett: 3 personal fouls)   FT 1/1: GOOD Bradley Simmons makes 1/1 from the line.
Score: 13-9

[06:35] Team_042 possession (Score: 13-9)
Kristaps Parker makes the Layup and draws the foul on Chris Anunoby! And-1! Kristaps Parker to the line for 1. [Team fouls: 3] (Chris Anunoby: 1 personal fouls)   FT 1/1: GOOD Kristaps Parker makes 1/1 from the line.
Score: 13-12

[06:20] Team_033 possession (Score: 13-12)
Cade Randle drives and kicks out. Joel Green attempts a 3Pt. Contested by Tyler Barrett (5.0 feet, MAN). Joel Green misses. Rebound secured by Dejounte Butler.

[06:06] Team_042 possession (Score: 13-12)
Kristaps Parker attempts a Midrange. Contested by Chris Anunoby (5.5 feet, MAN). KRISTAPS PARKER MAKES IT! Assist: Tyler Barrett
Score: 13-14

[05:52] Team_033 possession (Score: 13-14)
Joel Green attempts a 3Pt. Heavily contested by Tyler Barrett (0.5 feet, ZONE)! Joel Green misses. Rebound secured by Tyler Barrett.

[05:35] Team_042 possession (Score: 13-14)
Kristaps Parker attempts a Layup. Wide open! Chris Anunoby is 7.3 feet away. [MAN] KRISTAPS PARKER MAKES IT! Assist: Tyler Barrett
Score: 13-16

[05:19] Team_033 possession (Score: 13-16)
Cade Randle drives, Jarrett Sabonis stays with him. Cade Randle attempts a Layup. Contested by Jarrett Sabonis (4.2 feet, MAN). Cade Randle misses. FOUL! Loose ball foul on Cade Dosunmu during the rebound battle. [IN THE BONUS! 5 team fouls] Cade Randle to the line for 2 free throws. (Cade Dosunmu: 2 personal fouls)   FT 1/2: GOOD   FT 2/2: GOOD Cade Randle makes 2/2 from the line.
Score: 15-16

[05:06] Team_042 possession (Score: 15-16)
FOUL! Shooting foul on Chris Anunoby. Tyler Barrett to the line for 2 free throws. [Team fouls: 4] (Chris Anunoby: 2 personal fouls)   FT 1/2: MISS   FT 2/2: GOOD Tyler Barrett makes 1/2 from the line.
Score: 15-17

[04:50] Team_033 possession (Score: 15-17)
Joel Green attempts a 3Pt. Contested by Tyler Barrett (4.9 feet, MAN). Joel Green misses. Offensive rebound by Cade Randle! Cade Randle puts it back in!
Score: 17-17

[04:36] Team_042 possession (Score: 17-17)
FOUL! Offensive foul on Tyler Barrett! Joel Green drew the charge! [Team fouls: 6] (Tyler Barrett: 4 personal fouls) TURNOVER! (dead ball)

[04:19] Team_033 possession (Score: 17-17)
Bradley Simmons drives, Cade Dosunmu stays with him. Bradley Simmons attempts a Dunk. Contested by Cade Dosunmu (2.8 feet, MAN). BRADLEY SIMMONS MAKES IT!
Score: 19-17

[03:59] Team_042 possession (Score: 19-17)
Cade Dosunmu throws a bad pass! Stolen by Bradley Simmons! TURNOVER! (live ball)

[03:46] Team_033 possession (Score: 19-17)
FOUL! Shooting foul on Cade Dosunmu. Bradley Simmons to the line for 2 free throws. [BONUS: 7 team fouls] (Cade Dosunmu: 3 personal fouls)   FT 1/2: GOOD   FT 2/2: GOOD Bradley Simmons makes 2/2 from the line.
Score: 21-17

[03:32] Team_042 possession (Score: 21-17)
Dejounte Butler attempts a Layup. BLOCKED BY BRADLEY SIMMONS! Ball is loose! Rebound secured by Bradley Simmons.

[03:20] Team_033 possession (Score: 21-17)
Chris Anunoby drives, Cade Dosunmu stays with him. Chris Anunoby attempts a Layup. Contested by Cade Dosunmu (3.3 feet, ZONE). Chris Anunoby misses. Rebound secured by Cade Dosunmu.

[03:08] Team_042 possession (Score: 21-17)
Kristaps Parker attempts a 3Pt. Contested by Chris Anunoby (2.2 feet, MAN). Kristaps Parker misses. Rebound secured by Bradley Simmons.

[02:52] Team_033 possession (Score: 21-17)
Cade Randle attempts a 3Pt. Contested by Tyler Barrett (5.2 feet, ZONE). CADE RANDLE MAKES IT! Assist: Bradley Simmons
Score: 24-17

[02:37] Team_042 possession (Score: 24-17)
Tyler Barrett attempts a Layup. Contested by Bradley Simmons (2.8 feet, ZONE). TYLER BARRETT MAKES IT! Assist: Dejounte Butler
Score: 24-19

[02:20] Team_033 possession (Score: 24-19)
Desmond DeRozan makes the Layup and draws the foul on Dejounte Butler! And-1! Desmond DeRozan to the line for 1. [BONUS: 8 team fouls] (Dejounte Butler: 1 personal fouls)   FT 1/1: GOOD Desmond DeRozan makes 1/1 from the line.
Score: 27-19

[02:09] Team_042 possession (Score: 27-19)
Jarrett Sabonis attempts a 3Pt. Wide open! Joel Green is 6.7 feet away. [ZONE] JARRETT SABONIS MAKES IT! Assist: Dejounte Butler
Score: 27-22

[01:51] Team_033 possession (Score: 27-22)
Chris Anunoby attempts a Midrange. Contested by Jarrett Sabonis (4.8 feet, ZONE). Chris Anunoby misses. Offensive rebound by Cade Randle! Cade Randle puts it back in!
Score: 29-22

[01:36] Team_042 possession (Score: 29-22)
Jarrett Sabonis attempts a 3Pt. Wide open! Cade Randle is 6.6 feet away. [MAN] Jarrett Sabonis misses. Rebound secured by Bradley Simmons.

[01:19] Team_033 possession (Score: 29-22)
Joel Green drives to the basket... Joel Green commits a violation (traveling/carry)! TURNOVER! (dead ball)

[01:19] Substitution (Team_033): Joel Green OUT → Ben Anthony IN (stamina_rule2)

[01:19] Substitution (Team_033): Chris Anunoby OUT → Manu Irving IN (stamina_rule2)

[01:19] Substitution (Team_033): Cade Randle OUT → Terry Jokic IN (stamina_rule2)

[01:19] Substitution (Team_033): Desmond DeRozan OUT → Zion Adebayo IN (stamina_rule2)

[01:19] Substitution (Team_033): Bradley Simmons OUT → Tim Griffin IN (stamina_rule2)

[01:19] Substitution (Team_042): Tyler Barrett OUT → Khris George IN (stamina_rule2)

[01:19] Substitution (Team_042): Kristaps Parker OUT → Isaiah Randle IN (stamina_rule2)

[01:19] Substitution (Team_042): Jarrett Sabonis OUT → Gary Jackson IN (stamina_rule2)

[01:19] Substitution (Team_042): Dejounte Butler OUT → Allen Towns IN (stamina_rule2)

[01:19] Substitution (Team_042): Cade Dosunmu OUT → Lamelo Stewart IN (stamina_rule2)

[01:07] Team_042 possession (Score: 29-22)
Khris George attempts a 3Pt. Contested by Ben Anthony (3.6 feet, MAN). Khris George misses. Rebound secured by Tim Griffin.

[00:58] Team_033 possession (Score: 29-22)
Ben Anthony attempts a 3Pt. Contested by Khris George (2.9 feet, ZONE). Ben Anthony misses. Rebound secured by Allen Towns.

[00:47] Team_042 possession (Score: 29-22)
Gary Jackson drives and kicks out. Allen Towns attempts a 3Pt. Contested by Ben Anthony (2.0 feet, ZONE). ALLEN TOWNS MAKES IT! Assist: Khris George
Score: 29-25

[00:32] Team_033 possession (Score: 29-25)
Zion Adebayo attempts a Layup. BLOCKED BY ALLEN TOWNS! Ball is loose! Offensive rebound by Tim Griffin! Tim Griffin kicks it out.

[00:19] Team_033 possession (Score: 29-25)
FOUL! Reach-in foul on Allen Towns during the drive. [IN THE BONUS! 9 team fouls] Terry Jokic to the line for 2 free throws. (Allen Towns: 1 personal fouls)   FT 1/2: GOOD   FT 2/2: GOOD Terry Jokic makes 2/2 from the line.
Score: 31-25

[00:01] Team_042 possession (Score: 31-25)
Lamelo Stewart drives, Tim Griffin stays with him. Lamelo Stewart attempts a Dunk. Contested by Tim Griffin (2.9 feet, ZONE). LAMELO STEWART MAKES IT!
Score: 31-27

================================================================================
                              1ST QUARTER COMPLETE                              
================================================================================

1ST QUARTER SCORE: Team_033 31, Team_042 27

BOX SCORE:
================================================================================

Team_033
--------------------------------------------------------------------------------
Player                MIN  PTS  REB  AST  TO      FG   FG%      3P   3P%
--------------------------------------------------------------------------------
Cade Randle            11   12    2    1   0   5/6    83.3     0/0   0.0
Bradley Simmons        11    9    4    2   0   4/5    80.0     0/0   0.0
Desmond DeRozan        11    3    5    0   0   1/1   100.0     0/0   0.0
Joel Green             11    2    0    0   0   1/2    50.0     0/0   0.0
Chris Anunoby          11    2    0    0   0   1/4    25.0     0/0   0.0
Terry Jokic             1    2    0    0   0   1/1   100.0     0/0   0.0
Tim Griffin             1    0    2    0   0   0/0     0.0     0/0   0.0
Ben Anthony             1    0    0    0   0   0/1     0.0     0/0   0.0

TEAM: FG: 13/20 (65.0%), 3PT: 3/5 (60.0%), REB: 13 (6 off, 7 def), AST: 3, TO: 2
TEAM FOULS: 4


Team_042
--------------------------------------------------------------------------------
Player                MIN  PTS  REB  AST  TO      FG   FG%      3P   3P%
--------------------------------------------------------------------------------
Kristaps Parker        11    9    0    0   0   4/5    80.0     0/0   0.0
Jarrett Sabonis        11    5    0    2   0   2/3    66.7     0/0   0.0
Tyler Barrett          11    3    2    2   0   2/4    50.0     0/0   0.0
Dejounte Butler        11    3    2    3   0   1/2    50.0     0/0   0.0
Allen Towns             1    3    1    0   0   1/1   100.0     0/0   0.0
Cade Dosunmu           11    2    2    0   0   1/2    50.0     0/0   0.0
Lamelo Stewart          1    2    0    0   0   1/1   100.0     0/0   0.0
Khris George            1    0    0    1   0   0/1     0.0     0/0   0.0

TEAM: FG: 12/19 (63.2%), 3PT: 1/4 (25.0%), REB: 7 (0 off, 7 def), AST: 8, TO: 3
TEAM FOULS: 9 [Team_033 in BONUS]

================================================================================

================================================================================
                       2ND QUARTER - Team_033 vs Team_042                       
================================================================================

[12:00] Team_033 possession (Score: 31-27)
Desmond DeRozan attempts a 3Pt. Heavily contested by Dejounte Butler (1.5 feet, MAN)! DESMOND DEROZAN MAKES IT! Assist: Chris Anunoby
Score: 34-27

[11:45] Team_042 possession (Score: 34-27)
Kristaps Parker drives and kicks out. Jarrett Sabonis attempts a Midrange. BLOCKED BY CADE RANDLE! Ball is loose! Offensive rebound by Cade Dosunmu! Cade Dosunmu kicks it out.

[11:31] Team_042 possession (Score: 34-27)
Cade Dosunmu loses control! Ball rolls out of bounds! TURNOVER! (dead ball)

[11:17] Team_033 possession (Score: 34-27)
Joel Green drives to the basket... FOUL! Offensive foul on Joel Green! Tyler Barrett drew the charge! [Team fouls: 1] (Joel Green: 1 personal fouls) TURNOVER! (dead ball)

[11:02] Team_042 possession (Score: 34-27)
Jarrett Sabonis loses control! Ball rolls out of bounds! TURNOVER! (dead ball)

[11:02] Substitution (Team_033): Desmond DeRozan OUT → Zion Adebayo IN (stamina_rule2)

[11:02] Substitution (Team_042): Cade Dosunmu OUT → Lamelo Stewart IN (stamina_rule2)

[10:46] Team_033 possession (Score: 34-27)
Joel Green attempts a Midrange. Wide open! Dejounte Butler is 6.2 feet away. [ZONE] JOEL GREEN MAKES IT! Assist: Chris Anunoby
Score: 36-27

[10:30] Team_042 possession (Score: 36-27)
Tyler Barrett attempts a 3Pt. Contested by Joel Green (4.5 feet, ZONE). TYLER BARRETT MAKES IT! Assist: Lamelo Stewart
Score: 36-30

[10:19] Team_033 possession (Score: 36-30)
Zion Adebayo drives, picks up Dejounte Butler. Help arrives from Tyler Barrett! Zion Adebayo attempts a Layup. Contested by Tyler Barrett (4.7 feet, MAN). ZION ADEBAYO MAKES IT!
Score: 38-30

[10:01] Team_042 possession (Score: 38-30)
Jarrett Sabonis attempts a 3Pt. Wide open! Cade Randle is 8.0 feet away. [MAN] JARRETT SABONIS MAKES IT! Assist: Tyler Barrett
Score: 38-33

[09:50] Team_033 possession (Score: 38-33)
Cade Randle attempts a Midrange. Contested by Dejounte Butler (4.9 feet, ZONE). Cade Randle misses. Rebound secured by Lamelo Stewart.

[09:34] Team_042 possession (Score: 38-33)
Dejounte Butler attempts a Layup. BLOCKED BY ZION ADEBAYO! Ball is loose! Offensive rebound by Lamelo Stewart! Lamelo Stewart kicks it out.

[09:21] Team_042 possession (Score: 38-33)
Kristaps Parker attempts a 3Pt. Heavily contested by Chris Anunoby (1.0 feet, MAN)! Kristaps Parker misses. Rebound secured by Chris Anunoby.

[09:05] Team_033 possession (Score: 38-33)
Joel Green attempts a Midrange. Wide open! Kristaps Parker is 7.4 feet away. [ZONE] Joel Green misses. Rebound secured by Tyler Barrett.

[08:50] Team_042 possession (Score: 38-33)
Tyler Barrett attempts a Layup. Wide open! Bradley Simmons is 7.5 feet away. [ZONE] TYLER BARRETT MAKES IT! Assist: Jarrett Sabonis
Score: 38-35

[08:34] Team_033 possession (Score: 38-35)
Chris Anunoby drives and kicks out. FOUL! Shooting foul on Lamelo Stewart. Bradley Simmons to the line for 3 free throws. [Team fouls: 1] (Lamelo Stewart: 1 personal fouls)   FT 1/3: GOOD   FT 2/3: GOOD   FT 3/3: GOOD Bradley Simmons makes 3/3 from the line.
Score: 41-35

[08:20] Team_042 possession (Score: 41-35)
Lamelo Stewart attempts a Layup. BLOCKED BY BRADLEY SIMMONS! Ball goes out off Bradley Simmons. Lamelo Stewart's ball!

[08:04] Team_042 possession (Score: 41-35)
Jarrett Sabonis drives, Bradley Simmons stays with him. Jarrett Sabonis attempts a Layup. Heavily contested by Bradley Simmons (0.5 feet, ZONE)! Jarrett Sabonis misses. Rebound secured by Cade Randle.

[07:45] Team_033 possession (Score: 41-35)
Cade Randle attempts a Layup. Contested by Jarrett Sabonis (3.5 feet, MAN). Cade Randle misses. Rebound secured by Dejounte Butler.

[07:30] Team_042 possession (Score: 41-35)
FOUL! Shooting foul on Chris Anunoby. Kristaps Parker to the line for 2 free throws. [Team fouls: 2] (Chris Anunoby: 1 personal fouls)   FT 1/2: GOOD   FT 2/2: GOOD Kristaps Parker makes 2/2 from the line.
Score: 41-37

[07:17] Team_033 possession (Score: 41-37)
Joel Green drives to the basket... Joel Green loses the ball! Stripped by Tyler Barrett! TURNOVER! (live ball)

[07:04] Team_042 possession (Score: 41-37)
Lamelo Stewart attempts a Layup. BLOCKED BY BRADLEY SIMMONS! Ball is loose! Rebound secured by Zion Adebayo.

[06:50] Team_033 possession (Score: 41-37)
FOUL! Reach-in foul on Dejounte Butler during the drive. [Team fouls: 2] No free throws, side out. (Dejounte Butler: 1 personal fouls)

[06:34] Team_033 possession (Score: 41-37)
Joel Green attempts a Midrange. Contested by Kristaps Parker (5.4 feet, ZONE). JOEL GREEN MAKES IT! Assist: Bradley Simmons
Score: 43-37

[06:19] Team_042 possession (Score: 43-37)
Tyler Barrett attempts a 3Pt. Wide open! Cade Randle is 6.2 feet away. [ZONE] Tyler Barrett misses. Rebound secured by Bradley Simmons.

[06:03] Team_033 possession (Score: 43-37)
Cade Randle attempts a Midrange. Contested by Jarrett Sabonis (4.3 feet, ZONE). Cade Randle misses. FOUL! Loose ball foul on Lamelo Stewart during the rebound battle. [Team fouls: 3] No free throws, side out. (Lamelo Stewart: 2 personal fouls)

[05:48] Team_033 possession (Score: 43-37)
Cade Randle drives and kicks out. Cade Randle attempts a 3Pt. Contested by Jarrett Sabonis (4.4 feet, MAN). Cade Randle misses. Rebound secured by Dejounte Butler.

[05:35] Team_042 possession (Score: 43-37)
Kristaps Parker attempts a Layup. Contested by Bradley Simmons (4.7 feet, ZONE). KRISTAPS PARKER MAKES IT! Assist: Tyler Barrett
Score: 43-39

[05:20] Team_033 possession (Score: 43-39)
Joel Green attempts a Layup. BLOCKED BY TYLER BARRETT! Ball is loose! Rebound secured by Lamelo Stewart.

[05:01] Team_042 possession (Score: 43-39)
Kristaps Parker attempts a 3Pt. Wide open! Cade Randle is 7.4 feet away. [ZONE] Kristaps Parker misses. Offensive rebound by Dejounte Butler! Dejounte Butler kicks it out.

[04:44] Team_042 possession (Score: 43-39)
Dejounte Butler drives to the basket... Dejounte Butler throws a bad pass out of bounds! TURNOVER! (dead ball)

[04:44] Substitution (Team_033): Joel Green OUT → Ben Anthony IN (stamina_rule2)

[04:44] Substitution (Team_033): Chris Anunoby OUT → Manu Irving IN (stamina_rule2)

[04:44] Substitution (Team_033): Cade Randle OUT → Terry Jokic IN (stamina_rule2)

[04:44] Substitution (Team_033): Bradley Simmons OUT → Tim Griffin IN (stamina_rule2)

[04:44] Substitution (Team_042): Tyler Barrett OUT → Khris George IN (stamina_rule2)

[04:44] Substitution (Team_042): Kristaps Parker OUT → Isaiah Randle IN (stamina_rule2)

[04:44] Substitution (Team_042): Jarrett Sabonis OUT → Gary Jackson IN (stamina_rule2)

[04:44] Substitution (Team_042): Dejounte Butler OUT → Allen Towns IN (stamina_rule2)

[04:28] Team_033 possession (Score: 43-39)
Terry Jokic attempts a 3Pt. Contested by Khris George (2.1 feet, ZONE). TERRY JOKIC MAKES IT! Assist: Manu Irving
Score: 46-39

[04:14] Team_042 possession (Score: 46-39)
Isaiah Randle attempts a 3Pt. Wide open! Ben Anthony is 8.0 feet away. [ZONE] Isaiah Randle misses. Rebound secured by Tim Griffin.

[03:59] Team_033 possession (Score: 46-39)
Tim Griffin makes the Layup and draws the foul on Lamelo Stewart! And-1! Tim Griffin to the line for 1. [Team fouls: 4] (Lamelo Stewart: 3 personal fouls)   FT 1/1: GOOD Tim Griffin makes 1/1 from the line.
Score: 49-39

[03:43] Team_042 possession (Score: 49-39)
Gary Jackson drives, picks up Tim Griffin. Help arrives from Manu Irving! Gary Jackson attempts a Layup. Wide open! Manu Irving is 6.4 feet away. [ZONE] GARY JACKSON MAKES IT! Assist: Isaiah Randle
Score: 49-41

[03:31] Team_033 possession (Score: 49-41)
Zion Adebayo attempts a 3Pt. Contested by Allen Towns (5.4 feet, MAN). Zion Adebayo misses. Rebound secured by Allen Towns.

[03:15] Team_042 possession (Score: 49-41)
Lamelo Stewart drives and kicks out. Khris George attempts a 3Pt. Contested by Ben Anthony (5.3 feet, MAN). KHRIS GEORGE MAKES IT! Assist: Gary Jackson
Score: 49-44

[03:03] Team_033 possession (Score: 49-44)
Manu Irving makes the Midrange and draws the foul on Gary Jackson! And-1! Manu Irving to the line for 1. [BONUS: 5 team fouls] (Gary Jackson: 1 personal fouls)   FT 1/1: GOOD Manu Irving makes 1/1 from the line.
Score: 52-44

[02:49] Team_042 possession (Score: 52-44)
Allen Towns drives and kicks out. Isaiah Randle attempts a Midrange. Contested by Terry Jokic (5.1 feet, ZONE). ISAIAH RANDLE MAKES IT! Assist: Khris George
Score: 52-46

[02:34] Team_033 possession (Score: 52-46)
Terry Jokic drives and kicks out. Terry Jokic attempts a 3Pt. Contested by Gary Jackson (5.3 feet, MAN). TERRY JOKIC MAKES IT! Assist: Zion Adebayo
Score: 55-46

[02:17] Team_042 possession (Score: 55-46)
Lamelo Stewart drives, Tim Griffin stays with him. Lamelo Stewart attempts a Layup. Contested by Tim Griffin (5.8 feet, ZONE). LAMELO STEWART MAKES IT! Assist: Isaiah Randle
Score: 55-48

[01:59] Team_033 possession (Score: 55-48)
Terry Jokic throws a bad pass out of bounds! TURNOVER! (dead ball)

[01:48] Team_042 possession (Score: 55-48)
Allen Towns attempts a Layup. Contested by Tim Griffin (4.6 feet, ZONE). ALLEN TOWNS MAKES IT! Assist: Isaiah Randle
Score: 55-50

[01:31] Team_033 possession (Score: 55-50)
Tim Griffin drives, Allen Towns stays with him. Tim Griffin attempts a Dunk. Contested by Allen Towns (2.5 feet, ZONE). TIM GRIFFIN MAKES IT! Assist: Ben Anthony
Score: 57-50

[01:20] Team_042 possession (Score: 57-50)
Isaiah Randle attempts a Layup. Contested by Manu Irving (4.2 feet, MAN). ISAIAH RANDLE MAKES IT! Assist: Gary Jackson
Score: 57-52

[01:09] Team_033 possession (Score: 57-52)
FOUL! Offensive foul on Ben Anthony! Khris George drew the charge! [Team fouls: 3] (Ben Anthony: 1 personal fouls) TURNOVER! (dead ball)

[00:54] Team_042 possession (Score: 57-52)
Allen Towns drives and kicks out. Allen Towns attempts a Midrange. Contested by Zion Adebayo (5.5 feet, MAN). ALLEN TOWNS MAKES IT!
Score: 57-54

[00:39] Team_033 possession (Score: 57-54)
Ben Anthony attempts a 3Pt. Contested by Khris George (3.5 feet, MAN). BEN ANTHONY MAKES IT! Assist: Tim Griffin
Score: 60-54

[00:26] Team_042 possession (Score: 60-54)
Allen Towns attempts a 3Pt. Wide open! Zion Adebayo is 7.2 feet away. [MAN] Allen Towns misses. Rebound secured by Tim Griffin.

[00:09] Team_033 possession (Score: 60-54)
FOUL! Shooting foul on Gary Jackson. Tim Griffin to the line for 2 free throws. [BONUS: 6 team fouls] (Gary Jackson: 2 personal fouls)   FT 1/2: MISS   FT 2/2: GOOD Tim Griffin makes 1/2 from the line.
Score: 61-54

================================================================================
                              2ND QUARTER COMPLETE                              
================================================================================

2ND QUARTER SCORE: Team_033 30, Team_042 27

BOX SCORE:
================================================================================

Team_033
--------------------------------------------------------------------------------
Player                MIN  PTS  REB  AST  TO      FG   FG%      3P   3P%
--------------------------------------------------------------------------------
Terry Jokic             6    6    0    0   0   2/2   100.0     0/0   0.0
Tim Griffin             6    6    2    1   0   3/3   100.0     0/0   0.0
Joel Green             18    4    0    0   0   2/4    50.0     0/0   0.0
Desmond DeRozan        12    3    0    0   0   1/1   100.0     0/0   0.0
Bradley Simmons        18    3    2    1   0   1/1   100.0     0/0   0.0
Manu Irving             6    3    0    1   0   1/1   100.0     0/0   0.0
Ben Anthony             6    3    0    1   0   1/1   100.0     0/0   0.0
Zion Adebayo           12    2    1    1   0   1/2    50.0     0/0   0.0
Chris Anunoby          18    0    1    2   0   0/0     0.0     0/0   0.0
Cade Randle            18    0    1    0   0   0/3     0.0     0/0   0.0

TEAM: FG: 12/18 (66.7%), 3PT: 3/4 (75.0%), REB: 7 (1 off, 6 def), AST: 7, TO: 4
TEAM FOULS: 3


Team_042
--------------------------------------------------------------------------------
Player                MIN  PTS  REB  AST  TO      FG   FG%      3P   3P%
--------------------------------------------------------------------------------
Tyler Barrett          18    5    1    2   0   2/3    66.7     0/0   0.0
Kristaps Parker        18    4    0    0   0   2/3    66.7     0/0   0.0
Isaiah Randle           6    4    0    3   0   2/3    66.7     0/0   0.0
Allen Towns             6    4    1    0   0   2/3    66.7     0/0   0.0
Jarrett Sabonis        18    3    0    1   0   1/2    50.0     0/0   0.0
Khris George            6    3    0    1   0   1/1   100.0     0/0   0.0
Lamelo Stewart         12    2    3    1   0   1/2    50.0     0/0   0.0
Gary Jackson            6    2    0    2   0   1/1   100.0     0/0   0.0
Cade Dosunmu           12    0    1    0   0   0/0     0.0     0/0   0.0
Dejounte Butler        18    0    3    0   0   0/0     0.0     0/0   0.0

TEAM: FG: 12/18 (66.7%), 3PT: 2/6 (33.3%), REB: 9 (3 off, 6 def), AST: 10, TO: 3
TEAM FOULS: 6 [Team_033 in BONUS]

================================================================================

================================================================================
                       3RD QUARTER - Team_033 vs Team_042                       
================================================================================

[12:00] Team_033 possession (Score: 61-54)
Joel Green makes the Layup and draws the foul on Cade Dosunmu! And-1! Joel Green to the line for 1. [Team fouls: 1] (Cade Dosunmu: 1 personal fouls)   FT 1/1: GOOD Joel Green makes 1/1 from the line.
Score: 64-54

[11:42] Team_042 possession (Score: 64-54)
Tyler Barrett throws a bad pass out of bounds! TURNOVER! (dead ball)

[11:30] Team_033 possession (Score: 64-54)
Desmond DeRozan drives and kicks out. Desmond DeRozan attempts a Midrange. Contested by Dejounte Butler (3.5 feet, MAN). Desmond DeRozan misses. Offensive rebound by Desmond DeRozan! Desmond DeRozan kicks it out.

[11:16] Team_033 possession (Score: 64-54)
Bradley Simmons makes the Layup and draws the foul on Tyler Barrett! And-1! Bradley Simmons to the line for 1. [Team fouls: 2] (Tyler Barrett: 1 personal fouls)   FT 1/1: MISS Bradley Simmons makes 0/1 from the line. Offensive rebound by Bradley Simmons! Bradley Simmons puts it back in!
Score: 68-54

[11:02] Team_042 possession (Score: 68-54)
Dejounte Butler attempts a 3Pt. Wide open! Desmond DeRozan is 6.2 feet away. [MAN] Dejounte Butler misses. Rebound secured by Bradley Simmons.

[10:50] Team_033 possession (Score: 68-54)
Desmond DeRozan attempts a 3Pt. Contested by Dejounte Butler (4.1 feet, MAN). Desmond DeRozan misses. Rebound secured by Cade Dosunmu.

[10:38] Team_042 possession (Score: 68-54)
Kristaps Parker attempts a Midrange. Contested by Chris Anunoby (5.4 feet, ZONE). KRISTAPS PARKER MAKES IT!
Score: 68-56

[10:23] Team_033 possession (Score: 68-56)
Chris Anunoby drives to the basket... Chris Anunoby commits a violation (traveling/carry)! TURNOVER! (dead ball)

[10:10] Team_042 possession (Score: 68-56)
Jarrett Sabonis attempts a 3Pt. Contested by Cade Randle (3.0 feet, MAN). JARRETT SABONIS MAKES IT! Assist: Dejounte Butler
Score: 68-59

[09:58] Team_033 possession (Score: 68-59)
Bradley Simmons attempts a Layup. Heavily contested by Cade Dosunmu (0.5 feet, ZONE)! BRADLEY SIMMONS MAKES IT! Assist: Cade Randle
Score: 70-59

[09:46] Team_042 possession (Score: 70-59)
Jarrett Sabonis attempts a 3Pt. Wide open! Joel Green is 6.1 feet away. [ZONE] Jarrett Sabonis misses. Offensive rebound by Dejounte Butler! Dejounte Butler puts it back in!
Score: 70-61

[09:32] Team_033 possession (Score: 70-61)
Cade Randle attempts a 3Pt. Contested by Jarrett Sabonis (4.6 feet, MAN). Cade Randle misses. Rebound secured by Tyler Barrett.

[09:17] Team_042 possession (Score: 70-61)
Jarrett Sabonis attempts a 3Pt. Wide open! Joel Green is 7.2 feet away. [ZONE] Jarrett Sabonis misses. Rebound secured by Cade Randle.

[09:05] Team_033 possession (Score: 70-61)
Chris Anunoby drives to the basket... FOUL! Offensive foul on Chris Anunoby! Kristaps Parker drew the charge! [Team fouls: 1] (Chris Anunoby: 1 personal fouls) TURNOVER! (dead ball)

[08:50] Team_042 possession (Score: 70-61)
Cade Dosunmu drives, Bradley Simmons stays with him. Cade Dosunmu attempts a Dunk. Heavily contested by Bradley Simmons (0.5 feet, ZONE)! CADE DOSUNMU MAKES IT! Assist: Kristaps Parker
Score: 70-63

[08:38] Team_033 possession (Score: 70-63)
Bradley Simmons attempts a Layup. Heavily contested by Dejounte Butler (0.5 feet, ZONE)! BRADLEY SIMMONS MAKES IT!
Score: 72-63

[08:25] Team_042 possession (Score: 72-63)
Cade Dosunmu makes the Layup and draws the foul on Bradley Simmons! And-1! Cade Dosunmu to the line for 1. [Team fouls: 2] (Bradley Simmons: 1 personal fouls)   FT 1/1: GOOD Cade Dosunmu makes 1/1 from the line.
Score: 72-66

[08:12] Team_033 possession (Score: 72-66)
Chris Anunoby drives, Kristaps Parker stays with him. Chris Anunoby attempts a Layup. Contested by Kristaps Parker (3.7 feet, MAN). Chris Anunoby misses. Offensive rebound by Desmond DeRozan! Desmond DeRozan kicks it out.

[07:59] Team_033 possession (Score: 72-66)
Cade Randle attempts a 3Pt. Contested by Jarrett Sabonis (5.3 feet, MAN). Cade Randle misses. Offensive rebound by Bradley Simmons! Bradley Simmons puts it back in!
Score: 74-66

[07:46] Team_042 possession (Score: 74-66)
Cade Dosunmu attempts a Midrange. Contested by Chris Anunoby (3.9 feet, ZONE). Cade Dosunmu misses. Offensive rebound by Cade Dosunmu! Cade Dosunmu's putback is no good. Rebound secured by Cade Randle.

[07:33] Team_033 possession (Score: 74-66)
Joel Green drives and kicks out. Joel Green attempts a Midrange. Heavily contested by Kristaps Parker (1.6 feet, ZONE)! JOEL GREEN MAKES IT! Assist: Cade Randle
Score: 76-66

[07:19] Team_042 possession (Score: 76-66)
Kristaps Parker attempts a Layup. Contested by Bradley Simmons (3.4 feet, ZONE). KRISTAPS PARKER MAKES IT!
Score: 76-68

[07:04] Team_033 possession (Score: 76-68)
Desmond DeRozan attempts a Layup. Heavily contested by Cade Dosunmu (1.7 feet, ZONE)! Desmond DeRozan misses. Rebound secured by Cade Dosunmu.

[06:48] Team_042 possession (Score: 76-68)
Jarrett Sabonis drives and kicks out. Dejounte Butler attempts a 3Pt. Wide open! Joel Green is 6.0 feet away. [ZONE] Dejounte Butler misses. Offensive rebound by Dejounte Butler! Dejounte Butler's putback is no good. Offensive rebound by Cade Dosunmu! Cade Dosunmu kicks it out.

[06:33] Team_042 possession (Score: 76-68)
Cade Dosunmu makes the Layup and draws the foul on Desmond DeRozan! And-1! Cade Dosunmu to the line for 1. [Team fouls: 3] (Desmond DeRozan: 1 personal fouls)   FT 1/1: GOOD Cade Dosunmu makes 1/1 from the line.
Score: 76-71

[06:20] Team_033 possession (Score: 76-71)
Joel Green attempts a Midrange. Contested by Tyler Barrett (2.2 feet, MAN). JOEL GREEN MAKES IT!
Score: 78-71

[06:05] Team_042 possession (Score: 78-71)
Dejounte Butler commits a violation (traveling/carry)! TURNOVER! (dead ball)

[05:51] Team_033 possession (Score: 78-71)
FOUL! Shooting foul on Tyler Barrett. Desmond DeRozan to the line for 3 free throws. [Team fouls: 3] (Tyler Barrett: 2 personal fouls)   FT 1/3: MISS   FT 2/3: GOOD   FT 3/3: GOOD Desmond DeRozan makes 2/3 from the line.
Score: 80-71

[05:35] Team_042 possession (Score: 80-71)
FOUL! Offensive foul on Kristaps Parker! Chris Anunoby drew the charge! [Team fouls: 4] (Kristaps Parker: 1 personal fouls) TURNOVER! (dead ball)

[05:22] Team_033 possession (Score: 80-71)
Cade Randle attempts a 3Pt. Contested by Jarrett Sabonis (3.5 feet, MAN). Cade Randle misses. Offensive rebound by Cade Randle! Cade Randle puts it back in!
Score: 82-71

[05:06] Team_042 possession (Score: 82-71)
Dejounte Butler drives and kicks out. Jarrett Sabonis attempts a 3Pt. Heavily contested by Joel Green (0.8 feet, ZONE)! Jarrett Sabonis misses. Rebound secured by Cade Randle.

[04:47] Team_033 possession (Score: 82-71)
Bradley Simmons attempts a Dunk. BLOCKED BY TYLER BARRETT! Ball is loose! Rebound secured by Dejounte Butler.

[04:38] Team_042 possession (Score: 82-71)
FOUL! Offensive foul on Cade Dosunmu! Bradley Simmons drew the charge! [Team fouls: 5] (Cade Dosunmu: 2 personal fouls) TURNOVER! (dead ball)

[04:21] Team_033 possession (Score: 82-71)
Joel Green attempts a Midrange. Heavily contested by Kristaps Parker (0.8 feet, ZONE)! Joel Green misses. Rebound secured by Dejounte Butler.

[04:07] Team_042 possession (Score: 82-71)
Tyler Barrett attempts a 3Pt. Contested by Joel Green (4.0 feet, ZONE). Tyler Barrett misses. Offensive rebound by Cade Dosunmu! Cade Dosunmu's putback is no good. Rebound secured by Bradley Simmons.

[03:55] Team_033 possession (Score: 82-71)
Joel Green attempts a 3Pt. Wide open! Tyler Barrett is 7.3 feet away. [MAN] JOEL GREEN MAKES IT!
Score: 85-71

[03:39] Team_042 possession (Score: 85-71)
Jarrett Sabonis attempts a 3Pt. Contested by Cade Randle (3.5 feet, MAN). Jarrett Sabonis misses. Rebound secured by Desmond DeRozan.

[03:21] Team_033 possession (Score: 85-71)
FOUL! Shooting foul on Tyler Barrett. Joel Green to the line for 2 free throws. [BONUS: 6 team fouls] (Tyler Barrett: 3 personal fouls)   FT 1/2: GOOD   FT 2/2: GOOD Joel Green makes 2/2 from the line.
Score: 87-71

[03:08] Team_042 possession (Score: 87-71)
Dejounte Butler attempts a 3Pt. Contested by Desmond DeRozan (4.3 feet, MAN). Dejounte Butler misses. Rebound secured by Desmond DeRozan.

[02:56] Team_033 possession (Score: 87-71)
FOUL! Holding foul on Tyler Barrett. [IN THE BONUS! 7 team fouls] Joel Green to the line for 2 free throws. (Tyler Barrett: 4 personal fouls)   FT 1/2: GOOD   FT 2/2: GOOD Joel Green makes 2/2 from the line.
Score: 89-71

[02:42] Team_042 possession (Score: 89-71)
Jarrett Sabonis drives, picks up Cade Randle. Help arrives from Chris Anunoby! Jarrett Sabonis attempts a Layup. Contested by Chris Anunoby (3.6 feet, MAN). JARRETT SABONIS MAKES IT! Assist: Cade Dosunmu
Score: 89-73

[02:29] Team_033 possession (Score: 89-73)
Chris Anunoby attempts a 3Pt. Contested by Kristaps Parker (5.5 feet, MAN). Chris Anunoby misses. Rebound secured by Cade Dosunmu.

[02:14] Team_042 possession (Score: 89-73)
Kristaps Parker attempts a Layup. Contested by Bradley Simmons (3.6 feet, ZONE). KRISTAPS PARKER MAKES IT!
Score: 89-75

[02:01] Team_033 possession (Score: 89-75)
Joel Green drives and kicks out. Chris Anunoby attempts a 3Pt. Contested by Tyler Barrett (2.7 feet, ZONE). Chris Anunoby misses. Rebound secured by Tyler Barrett.

[01:47] Team_042 possession (Score: 89-75)
Cade Dosunmu throws a bad pass out of bounds! TURNOVER! (dead ball)

[01:47] Substitution (Team_033): Joel Green OUT → Ben Anthony IN (stamina_rule2)

[01:47] Substitution (Team_033): Chris Anunoby OUT → Manu Irving IN (stamina_rule2)

[01:47] Substitution (Team_033): Cade Randle OUT → Terry Jokic IN (stamina_rule2)

[01:47] Substitution (Team_033): Desmond DeRozan OUT → Zion Adebayo IN (stamina_rule2)

[01:47] Substitution (Team_033): Bradley Simmons OUT → Tim Griffin IN (stamina_rule2)

[01:47] Substitution (Team_042): Tyler Barrett OUT → Khris George IN (stamina_rule2)

[01:47] Substitution (Team_042): Kristaps Parker OUT → Isaiah Randle IN (stamina_rule2)

[01:47] Substitution (Team_042): Jarrett Sabonis OUT → Gary Jackson IN (stamina_rule2)

[01:47] Substitution (Team_042): Dejounte Butler OUT → Allen Towns IN (stamina_rule2)

[01:47] Substitution (Team_042): Cade Dosunmu OUT → Lamelo Stewart IN (stamina_rule2)

[01:30] Team_033 possession (Score: 89-75)
Manu Irving attempts a Midrange. Wide open! Isaiah Randle is 7.0 feet away. [MAN] Manu Irving misses. Rebound secured by Lamelo Stewart.

[01:16] Team_042 possession (Score: 89-75)
Isaiah Randle makes the Layup and draws the foul on Manu Irving! And-1! Isaiah Randle to the line for 1. [Team fouls: 4] (Manu Irving: 1 personal fouls)   FT 1/1: GOOD Isaiah Randle makes 1/1 from the line.
Score: 89-78

[01:05] Team_033 possession (Score: 89-78)
Zion Adebayo attempts a Layup. Contested by Allen Towns (4.5 feet, ZONE). ZION ADEBAYO MAKES IT!
Score: 91-78

[00:55] Team_042 possession (Score: 91-78)
Lamelo Stewart attempts a 3Pt. Contested by Ben Anthony (2.5 feet, ZONE). Lamelo Stewart misses. Offensive rebound by Lamelo Stewart! Lamelo Stewart kicks it out.

[00:39] Team_042 possession (Score: 91-78)
Khris George attempts a 3Pt. Contested by Ben Anthony (3.6 feet, ZONE). Khris George misses. Rebound secured by Zion Adebayo.

[00:27] Team_033 possession (Score: 91-78)
Tim Griffin drives and kicks out. Terry Jokic attempts a 3Pt. Contested by Khris George (3.3 feet, ZONE). Terry Jokic misses. Offensive rebound by Terry Jokic! Terry Jokic kicks it out.

[00:14] Team_033 possession (Score: 91-78)
FOUL! Offensive foul on Zion Adebayo! Allen Towns drew the charge! [Team fouls: 5] (Zion Adebayo: 1 personal fouls) TURNOVER! (dead ball)

================================================================================
                              3RD QUARTER COMPLETE                              
================================================================================

3RD QUARTER SCORE: Team_033 30, Team_042 24

BOX SCORE:
================================================================================

Team_033
--------------------------------------------------------------------------------
Player                MIN  PTS  REB  AST  TO      FG   FG%      3P   3P%
--------------------------------------------------------------------------------
Joel Green             29   14    0    0   0   6/8    75.0     0/0   0.0
Desmond DeRozan        23    2    4    0   0   1/3    33.3     0/0   0.0
Cade Randle            29    2    4    2   0   1/2    50.0     0/0   0.0
Zion Adebayo           14    2    1    0   0   1/1   100.0     0/0   0.0
Chris Anunoby          29    0    0    0   0   0/1     0.0     0/0   0.0
Manu Irving             7    0    0    0   0   0/1     0.0     0/0   0.0
Terry Jokic             7    0    1    0   0   0/0     0.0     0/0   0.0

TEAM: FG: 13/21 (61.9%), 3PT: 4/7 (57.1%), REB: 11 (5 off, 6 def), AST: 2, TO: 3
TEAM FOULS: 5 [Team_042 in BONUS]


Team_042
--------------------------------------------------------------------------------
Player                MIN  PTS  REB  AST  TO      FG   FG%      3P   3P%
--------------------------------------------------------------------------------
Bradley Simmons        29   10    3    0   0   4/5    80.0     0/0   0.0
Cade Dosunmu           23    8    4    1   0   3/4    75.0     0/0   0.0
Kristaps Parker        29    6    0    1   0   3/3   100.0     0/0   0.0
Jarrett Sabonis        29    5    0    0   0   2/4    50.0     0/0   0.0
Isaiah Randle           7    3    0    0   0   1/1   100.0     0/0   0.0
Dejounte Butler        29    2    3    1   0   1/4    25.0     0/0   0.0
Tyler Barrett          29    0    2    0   0   0/1     0.0     0/0   0.0
Lamelo Stewart         14    0    2    0   0   0/0     0.0     0/0   0.0
Khris George            7    0    0    0   0   0/1     0.0     0/0   0.0

TEAM: FG: 10/18 (55.6%), 3PT: 2/8 (25.0%), REB: 13 (5 off, 8 def), AST: 3, TO: 5
TEAM FOULS: 7 [Team_033 in BONUS]

================================================================================

================================================================================
                       4TH QUARTER - Team_033 vs Team_042                       
================================================================================

[12:00] Team_033 possession (Score: 91-78)
Chris Anunoby attempts a 3Pt. Contested by Tyler Barrett (3.4 feet, ZONE). Chris Anunoby misses. Rebound secured by Cade Dosunmu.

[11:43] Team_042 possession (Score: 91-78)
Dejounte Butler drives and kicks out. Jarrett Sabonis attempts a Midrange. Contested by Cade Randle (5.0 feet, ZONE). Jarrett Sabonis misses. Rebound secured by Desmond DeRozan.

[11:29] Team_033 possession (Score: 91-78)
Chris Anunoby attempts a 3Pt. Heavily contested by Tyler Barrett (1.2 feet, ZONE)! CHRIS ANUNOBY MAKES IT! Assist: Bradley Simmons
Score: 94-78

[11:17] Team_042 possession (Score: 94-78)
Jarrett Sabonis attempts a 3Pt. Wide open! Desmond DeRozan is 6.5 feet away. [ZONE] JARRETT SABONIS MAKES IT! Assist: Dejounte Butler
Score: 94-81

[11:02] Team_033 possession (Score: 94-81)
Joel Green attempts a Midrange. Contested by Kristaps Parker (6.0 feet, ZONE). Joel Green misses. Rebound secured by Dejounte Butler.

[10:45] Team_042 possession (Score: 94-81)
FOUL! Shooting foul on Bradley Simmons. Cade Dosunmu to the line for 2 free throws. [Team fouls: 1] (Bradley Simmons: 1 personal fouls)   FT 1/2: MISS   FT 2/2: GOOD Cade Dosunmu makes 1/2 from the line.
Score: 94-82

[10:33] Team_033 possession (Score: 94-82)
Chris Anunoby attempts a Midrange. Contested by Dejounte Butler (3.9 feet, ZONE). CHRIS ANUNOBY MAKES IT!
Score: 96-82

[10:24] Team_042 possession (Score: 96-82)
Jarrett Sabonis attempts a 3Pt. Contested by Joel Green (5.1 feet, ZONE). Jarrett Sabonis misses. Rebound secured by Bradley Simmons.

[10:13] Team_033 possession (Score: 96-82)
FOUL! Shooting foul on Cade Dosunmu. Bradley Simmons to the line for 2 free throws. [Team fouls: 1] (Cade Dosunmu: 1 personal fouls)   FT 1/2: MISS   FT 2/2: GOOD Bradley Simmons makes 1/2 from the line.
Score: 97-82

[09:59] Team_042 possession (Score: 97-82)
Kristaps Parker attempts a Layup. Heavily contested by Chris Anunoby (1.7 feet, MAN)! KRISTAPS PARKER MAKES IT! Assist: Jarrett Sabonis
Score: 97-84

[09:42] Team_033 possession (Score: 97-84)
Bradley Simmons attempts a Midrange. Contested by Kristaps Parker (5.5 feet, ZONE). Bradley Simmons misses. Rebound secured by Cade Dosunmu.

[09:29] Team_042 possession (Score: 97-84)
Jarrett Sabonis makes the 3Pt and draws the foul on Cade Randle! And-1! Jarrett Sabonis to the line for 1. [Team fouls: 2] (Cade Randle: 1 personal fouls)   FT 1/1: GOOD Jarrett Sabonis makes 1/1 from the line.
Score: 97-88

[09:14] Team_033 possession (Score: 97-88)
Joel Green throws a bad pass out of bounds! TURNOVER! (dead ball)

[09:14] Substitution (Team_033): Joel Green OUT → Ben Anthony IN (stamina_rule2)

[09:14] Substitution (Team_033): Chris Anunoby OUT → Manu Irving IN (stamina_rule2)

[09:14] Substitution (Team_033): Cade Randle OUT → Terry Jokic IN (stamina_rule2)

[09:14] Substitution (Team_033): Desmond DeRozan OUT → Zion Adebayo IN (stamina_rule2)

[09:14] Substitution (Team_033): Bradley Simmons OUT → Tim Griffin IN (stamina_rule2)

[09:14] Substitution (Team_042): Tyler Barrett OUT → Khris George IN (stamina_rule2)

[09:14] Substitution (Team_042): Kristaps Parker OUT → Isaiah Randle IN (stamina_rule2)

[09:14] Substitution (Team_042): Jarrett Sabonis OUT → Gary Jackson IN (stamina_rule2)

[09:14] Substitution (Team_042): Dejounte Butler OUT → Allen Towns IN (stamina_rule2)

[09:14] Substitution (Team_042): Cade Dosunmu OUT → Lamelo Stewart IN (stamina_rule2)

[08:58] Team_042 possession (Score: 97-88)
Lamelo Stewart attempts a 3Pt. Contested by Ben Anthony (2.8 feet, ZONE). LAMELO STEWART MAKES IT! Assist: Allen Towns
Score: 97-91

[08:42] Team_033 possession (Score: 97-91)
Tim Griffin drives to the basket... Tim Griffin loses control! Ball rolls out of bounds! TURNOVER! (dead ball)

[08:33] Team_042 possession (Score: 97-91)
Lamelo Stewart attempts a Layup. BLOCKED BY TIM GRIFFIN! Ball deflects out of bounds off Lamelo Stewart.

[08:19] Team_033 possession (Score: 97-91)
Ben Anthony makes the Dunk and draws the foul on Allen Towns! And-1! Ben Anthony to the line for 1. [Team fouls: 2] (Allen Towns: 1 personal fouls)   FT 1/1: MISS Ben Anthony makes 0/1 from the line. Offensive rebound by Terry Jokic! Terry Jokic kicks it out.
Score: 99-91

[08:06] Team_033 possession (Score: 99-91)
Manu Irving attempts a Midrange. Contested by Isaiah Randle (5.4 feet, ZONE). MANU IRVING MAKES IT! Assist: Tim Griffin
Score: 101-91

[07:50] Team_042 possession (Score: 101-91)
Isaiah Randle attempts a 3Pt. Contested by Manu Irving (2.8 feet, MAN). Isaiah Randle misses. Rebound secured by Zion Adebayo.

[07:38] Team_033 possession (Score: 101-91)
Tim Griffin drives, Lamelo Stewart stays with him. Tim Griffin attempts a Dunk. Contested by Lamelo Stewart (2.7 feet, MAN). TIM GRIFFIN MAKES IT! Assist: Terry Jokic
Score: 103-91

[07:21] Team_042 possession (Score: 103-91)
Lamelo Stewart throws a bad pass! Stolen by Tim Griffin! TURNOVER! (live ball)

[07:07] Team_033 possession (Score: 103-91)
Manu Irving attempts a Layup. Wide open! Isaiah Randle is 7.3 feet away. [MAN] MANU IRVING MAKES IT! Assist: Terry Jokic
Score: 105-91

[06:52] Team_042 possession (Score: 105-91)
Gary Jackson attempts a 3Pt. Contested by Ben Anthony (3.5 feet, ZONE). GARY JACKSON MAKES IT! Assist: Allen Towns
Score: 105-94

[06:35] Team_033 possession (Score: 105-94)
Manu Irving attempts a 3Pt. Contested by Isaiah Randle (4.6 feet, MAN). Manu Irving misses. FOUL! Loose ball foul on Lamelo Stewart during the rebound battle. [Team fouls: 3] No free throws, side out. (Lamelo Stewart: 1 personal fouls)

[06:23] Team_033 possession (Score: 105-94)
Tim Griffin attempts a Layup. Contested by Allen Towns (2.1 feet, ZONE). Tim Griffin misses. FOUL! Loose ball foul on Lamelo Stewart during the rebound battle. [Team fouls: 4] No free throws, side out. (Lamelo Stewart: 2 personal fouls)

[06:05] Team_033 possession (Score: 105-94)
Manu Irving attempts a 3Pt. Contested by Isaiah Randle (4.5 feet, MAN). MANU IRVING MAKES IT! Assist: Terry Jokic
Score: 108-94

[05:50] Team_042 possession (Score: 108-94)
Khris George drives and kicks out. Lamelo Stewart attempts a 3Pt. Wide open! Ben Anthony is 10.0 feet away. [ZONE] Lamelo Stewart misses. Rebound secured by Zion Adebayo.

[05:36] Team_033 possession (Score: 108-94)
Ben Anthony drives to the basket... Ben Anthony loses the ball! Stripped by Allen Towns! TURNOVER! (live ball)

[05:22] Team_042 possession (Score: 108-94)
Lamelo Stewart drives, Tim Griffin stays with him. Lamelo Stewart attempts a Dunk. Contested by Tim Griffin (2.9 feet, ZONE). LAMELO STEWART MAKES IT!
Score: 108-96

[05:07] Team_033 possession (Score: 108-96)
Terry Jokic attempts a 3Pt. Contested by Gary Jackson (5.1 feet, MAN). TERRY JOKIC MAKES IT! Assist: Manu Irving
Score: 111-96

[04:54] Team_042 possession (Score: 111-96)
Isaiah Randle attempts a 3Pt. Wide open! Manu Irving is 6.2 feet away. [MAN] Isaiah Randle misses. Rebound secured by Terry Jokic.

[04:39] Team_033 possession (Score: 111-96)
Ben Anthony attempts a 3Pt. Wide open! Khris George is 7.8 feet away. [ZONE] BEN ANTHONY MAKES IT! Assist: Tim Griffin
Score: 114-96

[04:23] Team_042 possession (Score: 114-96)
Lamelo Stewart attempts a 3Pt. Contested by Ben Anthony (3.7 feet, ZONE). Lamelo Stewart misses. Rebound secured by Terry Jokic.

[04:08] Team_033 possession (Score: 114-96)
Manu Irving drives, picks up Isaiah Randle. Help arrives from Khris George! Manu Irving attempts a Dunk. Contested by Khris George (3.2 feet, MAN). MANU IRVING MAKES IT! Assist: Ben Anthony
Score: 116-96

[03:50] Team_042 possession (Score: 116-96)
Gary Jackson attempts a 3Pt. Contested by Ben Anthony (5.5 feet, ZONE). Gary Jackson misses. Offensive rebound by Allen Towns! Allen Towns kicks it out.

[03:36] Team_042 possession (Score: 116-96)
Khris George attempts a 3Pt. Wide open! Ben Anthony is 8.3 feet away. [MAN] KHRIS GEORGE MAKES IT! Assist: Allen Towns
Score: 116-99

[03:18] Team_033 possession (Score: 116-99)
Manu Irving drives, Allen Towns stays with him. Manu Irving attempts a Dunk. Contested by Allen Towns (4.8 feet, ZONE). Manu Irving misses. FOUL! Loose ball foul on Lamelo Stewart during the rebound battle. [IN THE BONUS! 5 team fouls] Terry Jokic to the line for 2 free throws. (Lamelo Stewart: 3 personal fouls)   FT 1/2: GOOD   FT 2/2: GOOD Terry Jokic makes 2/2 from the line.
Score: 118-99

[03:07] Team_042 possession (Score: 118-99)
FOUL! Shooting foul on Manu Irving. Lamelo Stewart to the line for 2 free throws. [Team fouls: 3] (Manu Irving: 1 personal fouls)   FT 1/2: GOOD   FT 2/2: MISS Lamelo Stewart makes 1/2 from the line. FOUL! Loose ball foul on Terry Jokic during the free throw rebound! [Team fouls: 4] No free throws, side out. (Terry Jokic: 1 personal fouls)
Score: 118-100

[02:50] Team_042 possession (Score: 118-100)
Gary Jackson attempts a 3Pt. Contested by Ben Anthony (5.4 feet, ZONE). Gary Jackson misses. Rebound secured by Tim Griffin.

[02:37] Team_033 possession (Score: 118-100)
Ben Anthony drives to the basket... Ben Anthony loses the ball! Stripped by Khris George! TURNOVER! (live ball)

[02:24] Team_042 possession (Score: 118-100)
Allen Towns attempts a Dunk. BLOCKED BY ZION ADEBAYO! Ball is loose! Rebound secured by Tim Griffin.

[02:11] Team_033 possession (Score: 118-100)
Tim Griffin attempts a Layup. Heavily contested by Allen Towns (0.5 feet, ZONE)! Tim Griffin misses. Rebound secured by Gary Jackson.

[01:56] Team_042 possession (Score: 118-100)
FOUL! Shooting foul on Ben Anthony. Khris George to the line for 3 free throws. [BONUS: 5 team fouls] (Ben Anthony: 1 personal fouls)   FT 1/3: GOOD   FT 2/3: GOOD   FT 3/3: MISS Khris George makes 2/3 from the line. Rebound secured by Zion Adebayo.
Score: 118-102

[01:39] Team_033 possession (Score: 118-102)
Terry Jokic drives, picks up Allen Towns. Help arrives from Khris George! Terry Jokic attempts a Layup. Heavily contested by Khris George (1.6 feet, ZONE)! TERRY JOKIC MAKES IT! Assist: Manu Irving
Score: 120-102

[01:22] Team_042 possession (Score: 120-102)
Lamelo Stewart makes the Layup and draws the foul on Manu Irving! And-1! Lamelo Stewart to the line for 1. [BONUS: 6 team fouls] (Manu Irving: 2 personal fouls)   FT 1/1: GOOD Lamelo Stewart makes 1/1 from the line.
Score: 120-105

[01:11] Team_033 possession (Score: 120-105)
Zion Adebayo attempts a Midrange. Contested by Allen Towns (5.7 feet, MAN). Zion Adebayo misses. Offensive rebound by Tim Griffin! Tim Griffin puts it back in!
Score: 122-105

[00:57] Team_042 possession (Score: 122-105)
Allen Towns drives, Tim Griffin stays with him. Allen Towns attempts a Dunk. Contested by Tim Griffin (5.5 feet, ZONE). ALLEN TOWNS MAKES IT! Assist: Khris George
Score: 122-107

[00:43] Team_033 possession (Score: 122-107)
Manu Irving loses control! Ball rolls out of bounds! TURNOVER! (dead ball)

[00:27] Team_042 possession (Score: 122-107)
Isaiah Randle drives and kicks out. Allen Towns attempts a Midrange. Wide open! Zion Adebayo is 8.3 feet away. [MAN] Allen Towns misses. Offensive rebound by Allen Towns! Allen Towns kicks it out.

[00:16] Team_042 possession (Score: 122-107)
Allen Towns drives and kicks out. Allen Towns attempts a Midrange. Wide open! Zion Adebayo is 7.8 feet away. [MAN] ALLEN TOWNS MAKES IT! Assist: Khris George
Score: 122-109

[00:01] Team_033 possession (Score: 122-109)
Manu Irving attempts a Midrange. Contested by Isaiah Randle (5.7 feet, MAN). Manu Irving misses. Rebound secured by Gary Jackson.

================================================================================
                              4TH QUARTER COMPLETE                              
================================================================================

4TH QUARTER SCORE: Team_033 31, Team_042 31

BOX SCORE:
================================================================================

Team_033
--------------------------------------------------------------------------------
Player                MIN  PTS  REB  AST  TO      FG   FG%      3P   3P%
--------------------------------------------------------------------------------
Manu Irving            17    9    0    2   0   4/5    80.0     0/0   0.0
Terry Jokic            17    7    4    3   0   3/3   100.0     0/0   0.0
Chris Anunoby          32    5    0    0   0   2/3    66.7     0/0   0.0
Tim Griffin            17    4    4    2   0   2/3    66.7     0/0   0.0
Ben Anthony            17    3    0    1   0   1/1   100.0     0/0   0.0
Bradley Simmons        32    1    1    1   0   1/2    50.0     0/0   0.0
Desmond DeRozan        26    0    1    0   0   0/0     0.0     0/0   0.0
Joel Green             32    0    0    0   0   0/1     0.0     0/0   0.0
Zion Adebayo           23    0    3    0   0   0/0     0.0     0/0   0.0

TEAM: FG: 13/18 (72.2%), 3PT: 4/5 (80.0%), REB: 13 (4 off, 9 def), AST: 9, TO: 5
TEAM FOULS: 6 [Team_042 in BONUS]


Team_042
--------------------------------------------------------------------------------
Player                MIN  PTS  REB  AST  TO      FG   FG%      3P   3P%
--------------------------------------------------------------------------------
Lamelo Stewart         23    8    0    0   0   3/5    60.0     0/0   0.0
Jarrett Sabonis        32    7    0    1   0   2/3    66.7     0/0   0.0
Allen Towns            17    4    3    3   0   2/3    66.7     0/0   0.0
Gary Jackson           17    3    2    0   0   1/2    50.0     0/0   0.0
Khris George           17    3    0    2   0   1/3    33.3     0/0   0.0
Kristaps Parker        32    2    0    0   0   1/1   100.0     0/0   0.0
Cade Dosunmu           26    1    2    0   0   1/1   100.0     0/0   0.0
Dejounte Butler        32    0    1    1   0   0/1     0.0     0/0   0.0
Isaiah Randle          17    0    0    0   0   0/2     0.0     0/0   0.0

TEAM: FG: 11/21 (52.4%), 3PT: 5/11 (45.5%), REB: 8 (3 off, 5 def), AST: 7, TO: 1
TEAM FOULS: 5 [Team_033 in BONUS]

================================================================================

================================================================================
                               FULL GAME COMPLETE                               
================================================================================

FINAL SCORE: Team_033 122, Team_042 109

SCORING BY QUARTER:
--------------------------------------------------------------------------------
Team                     Q1     Q2     Q3     Q4    FINAL
--------------------------------------------------------------------------------
Team_033                 31     30     30     31      122
Team_042                 27     27     24     31      109
--------------------------------------------------------------------------------

FULL GAME BOX SCORE:
================================================================================

Team_033
--------------------------------------------------------------------------------
Player                MIN  PTS  REB  AST  TO      FG   FG%      3P   3P%      FT STL BLK
--------------------------------------------------------------------------------
Joel Green             32   20    0    0   2   9/15   60.0   2/3    66.7   5/5     0   0
Chris Anunoby          32    7    1    2   2   5/10   50.0   1/3    33.3   1/2     0   0
Cade Randle            32   14    7    3   1   5/10   50.0   4/5    80.0   5/5     0   1
Bradley Simmons        32   23   11    4   0   8/11   72.7   0/0     0.0   7/9     1   3
Desmond DeRozan        26    8   10    0   2   3/5    60.0   2/3    66.7   3/4     0   0
Zion Adebayo           23    4    5    1   1   3/4    75.0   0/1     0.0   0/0     0   2
Ben Anthony            17    6    0    2   1   2/3    66.7   2/3    66.7   0/1     0   0
Manu Irving            17   12    0    3   1   6/8    75.0   1/1   100.0   1/1     0   0
Terry Jokic            17   15    5    3   2   5/5   100.0   2/2   100.0   4/4     0   0
Tim Griffin            17   10    8    3   2   4/5    80.0   0/0     0.0   2/3     1   1

TEAM: FG: 51/77 (66.2%), 3PT: 14/21 (66.7%), REB: 44 (16 off, 28 def), AST: 21, TO: 14


Team_042
--------------------------------------------------------------------------------
Player                MIN  PTS  REB  AST  TO      FG   FG%      3P   3P%      FT STL BLK
--------------------------------------------------------------------------------
Tyler Barrett          32    8    5    4   2   4/8    50.0   1/3    33.3   1/2     1   3
Kristaps Parker        32   21    0    1   1   9/11   81.8   0/2     0.0   3/3     0   0
Jarrett Sabonis        32   20    0    4   1   8/13   61.5   6/10   60.0   1/1     0   0
Dejounte Butler        32    5    9    5   1   1/6    16.7   0/2     0.0   1/1     0   1
Cade Dosunmu           26   11    9    1   5   6/8    75.0   0/0     0.0   3/4     0   1
Lamelo Stewart         23   12    5    1   2   6/9    66.7   1/2    50.0   2/3     0   0
Khris George           17    6    0    4   0   1/5    20.0   1/4    25.0   2/3     1   0
Isaiah Randle          17    7    0    3   0   2/5    40.0   0/3     0.0   1/1     0   0
Gary Jackson           17    5    2    2   0   3/4    75.0   1/2    50.0   0/0     0   0
Allen Towns            17   11    5    3   0   5/7    71.4   0/1     0.0   0/0     1   1

TEAM: FG: 45/76 (59.2%), 3PT: 10/29 (34.5%), REB: 37 (11 off, 26 def), AST: 28, TO: 12

================================================================================
