================================================================================
                        FULL GAME - Team_050 vs Team_025                        
================================================================================

================================================================================
                       1ST QUARTER - Team_050 vs Team_025                       
================================================================================

[12:00] Team_050 possession (Score: 0-0)
LeBron Bridges attempts a Layup. Heavily contested by Cade Anthony (0.5 feet, MAN)! LEBRON BRIDGES MAKES IT! Assist: Joel Banchero
Score: 2-0

[11:48] Team_025 possession (Score: 2-0)
Allen Embiid attempts a Midrange. Wide open! LeBron Bridges is 6.8 feet away. [ZONE] ALLEN EMBIID MAKES IT! Assist: Ben Giddey
Score: 2-2

[11:34] Team_050 possession (Score: 2-2)
FOUL! Reach-in foul on Allen Embiid during the drive. [Team fouls: 1] No free throws, side out. (Allen Embiid: 1 personal fouls)

[11:19] Team_050 possession (Score: 2-2)
Donovan Trent makes the Dunk and draws the foul on Allen Embiid! And-1! Donovan Trent to the line for 1. [Team fouls: 2] (Allen Embiid: 2 personal fouls)   FT 1/1: MISS Donovan Trent makes 0/1 from the line. Offensive rebound by Collin Bane! Collin Bane kicks it out.
Score: 4-2

[11:03] Team_050 possession (Score: 4-2)
Joel Banchero attempts a Midrange. Wide open! Desmond Jordan is 6.5 feet away. [ZONE] Joel Banchero misses. Rebound secured by Desmond Jordan.

[10:46] Team_025 possession (Score: 4-2)
Desmond Jordan attempts a Midrange. Contested by Collin Bane (3.1 feet, MAN). Desmond Jordan misses. Rebound secured by Collin Bane.

[10:32] Team_050 possession (Score: 4-2)
Collin Bane drives, picks up Allen Embiid. Help arrives from Ben Giddey! Collin Bane attempts a Dunk. Heavily contested by Ben Giddey (0.5 feet, ZONE)! COLLIN BANE MAKES IT! Assist: Giannis LaVine
Score: 6-2

[10:17] Team_025 possession (Score: 6-2)
Desmond Jordan attempts a 3Pt. Contested by Giannis LaVine (2.6 feet, ZONE). Desmond Jordan misses. Rebound secured by Collin Bane.

[10:00] Team_050 possession (Score: 6-2)
Donovan Trent drives and kicks out. Joel Banchero attempts a 3Pt. Contested by Ben Giddey (2.8 feet, ZONE). JOEL BANCHERO MAKES IT! Assist: LeBron Bridges
Score: 9-2

[09:46] Team_025 possession (Score: 9-2)
Allen Embiid attempts a 3Pt. Contested by Giannis LaVine (5.2 feet, ZONE). Allen Embiid misses. Rebound secured by Collin Bane.

[09:29] Team_050 possession (Score: 9-2)
Giannis LaVine attempts a Layup. Heavily contested by Allen Embiid (1.0 feet, ZONE)! GIANNIS LAVINE MAKES IT! Assist: LeBron Bridges
Score: 11-2

[09:19] Team_025 possession (Score: 11-2)
Allen Embiid drives, Donovan Trent stays with him. Allen Embiid attempts a Dunk. Wide open! Donovan Trent is 7.8 feet away. [MAN] ALLEN EMBIID MAKES IT! Assist: Desmond Jordan
Score: 11-4

[09:01] Team_050 possession (Score: 11-4)
Collin Bane loses control! Ball rolls out of bounds! TURNOVER! (dead ball)

[08:46] Team_025 possession (Score: 11-4)
FOUL! Offensive foul on Cade Anthony! LeBron Bridges drew the charge! [Team fouls: 3] (Cade Anthony: 1 personal fouls) TURNOVER! (dead ball)

[08:31] Team_050 possession (Score: 11-4)
LeBron Bridges drives, picks up Cade Anthony. Help arrives from Ben Giddey! LeBron Bridges attempts a Layup. Contested by Ben Giddey (3.9 feet, MAN). LEBRON BRIDGES MAKES IT!
Score: 13-4

[08:21] Team_025 possession (Score: 13-4)
Desmond Jordan drives and kicks out. FOUL! Shooting foul on Collin Bane. Desmond Jordan to the line for 3 free throws. [Team fouls: 1] (Collin Bane: 1 personal fouls)   FT 1/3: GOOD   FT 2/3: GOOD   FT 3/3: MISS Desmond Jordan makes 2/3 from the line. Rebound secured by LeBron Bridges.
Score: 13-6

[08:09] Team_050 possession (Score: 13-6)
Joel Banchero attempts a 3Pt. Heavily contested by Ben Giddey (0.5 feet, ZONE)! Joel Banchero misses. Rebound secured by Desmond Jordan.

[07:55] Team_025 possession (Score: 13-6)
FOUL! Shooting foul on Collin Bane. Desmond Jordan to the line for 2 free throws. [Team fouls: 2] (Collin Bane: 2 personal fouls)   FT 1/2: GOOD   FT 2/2: GOOD Desmond Jordan makes 2/2 from the line.
Score: 13-8

[07:42] Team_050 possession (Score: 13-8)
Joel Banchero throws a bad pass out of bounds! TURNOVER! (dead ball)

[07:30] Team_025 possession (Score: 13-8)
Desmond Jordan attempts a 3Pt. Contested by Collin Bane (4.0 feet, MAN). DESMOND JORDAN MAKES IT! Assist: Ben Giddey
Score: 13-11

[07:15] Team_050 possession (Score: 13-11)
FOUL! Offensive foul on Donovan Trent! Allen Embiid drew the charge! [Team fouls: 3] (Donovan Trent: 1 personal fouls) TURNOVER! (dead ball)

[07:02] Team_025 possession (Score: 13-11)
Desmond Jordan attempts a 3Pt. Contested by Collin Bane (4.6 feet, MAN). Desmond Jordan misses. Rebound secured by Joel Banchero.

[06:45] Team_050 possession (Score: 13-11)
Joel Banchero attempts a 3Pt. Heavily contested by Ben Giddey (1.1 feet, ZONE)! Joel Banchero misses. Offensive rebound by LeBron Bridges! LeBron Bridges kicks it out.

[06:30] Team_050 possession (Score: 13-11)
Donovan Trent attempts a Midrange. Wide open! Allen Embiid is 6.9 feet away. [ZONE] Donovan Trent misses. Rebound secured by Cade Anthony.

[06:16] Team_025 possession (Score: 13-11)
Allen Embiid drives and kicks out. Ben Giddey attempts a Midrange. Contested by Joel Banchero (5.2 feet, ZONE). Ben Giddey misses. Rebound secured by LeBron Bridges.

[06:03] Team_050 possession (Score: 13-11)
Donovan Trent loses control! Ball rolls out of bounds! TURNOVER! (dead ball)

[05:50] Team_025 possession (Score: 13-11)
Allen Embiid drives, Donovan Trent stays with him. Allen Embiid attempts a Layup. Wide open! Donovan Trent is 6.1 feet away. [MAN] ALLEN EMBIID MAKES IT! Assist: Paolo Lowry
Score: 13-13

[05:34] Team_050 possession (Score: 13-13)
Giannis LaVine attempts a Midrange. Wide open! Paolo Lowry is 7.7 feet away. [MAN] Giannis LaVine misses. Rebound secured by Desmond Jordan.

[05:21] Team_025 possession (Score: 13-13)
Cade Anthony drives and kicks out. Ben Giddey attempts a Midrange. Contested by Joel Banchero (4.5 feet, MAN). BEN GIDDEY MAKES IT!
Score: 13-15

[05:08] Team_050 possession (Score: 13-15)
FOUL! Shooting foul on Ben Giddey. Collin Bane to the line for 3 free throws. [Team fouls: 4] (Ben Giddey: 1 personal fouls)   FT 1/3: GOOD   FT 2/3: GOOD   FT 3/3: GOOD Collin Bane makes 3/3 from the line.
Score: 16-15

[04:54] Team_025 possession (Score: 16-15)
Cade Anthony attempts a 3Pt. Contested by LeBron Bridges (4.7 feet, MAN). Cade Anthony misses. Rebound secured by Collin Bane.

[04:40] Team_050 possession (Score: 16-15)
Collin Bane attempts a 3Pt. Contested by Desmond Jordan (3.8 feet, MAN). Collin Bane misses. Rebound secured by Desmond Jordan.

[04:25] Team_025 possession (Score: 16-15)
Ben Giddey attempts a Midrange. Wide open! Joel Banchero is 6.5 feet away. [MAN] BEN GIDDEY MAKES IT!
Score: 16-17

[04:07] Team_050 possession (Score: 16-17)
Collin Bane attempts a Midrange. Contested by Ben Giddey (4.6 feet, ZONE). Collin Bane misses. Rebound secured by Allen Embiid.

[03:48] Team_025 possession (Score: 16-17)
Cade Anthony drives, picks up Donovan Trent. Help arrives from Joel Banchero! Cade Anthony attempts a Dunk. Wide open! Joel Banchero is 6.3 feet away. [ZONE] Cade Anthony misses. Offensive rebound by Allen Embiid! Allen Embiid puts it back in!
Score: 16-19

[03:36] Team_050 possession (Score: 16-19)
Giannis LaVine throws a bad pass out of bounds! TURNOVER! (dead ball)

[03:22] Team_025 possession (Score: 16-19)
Desmond Jordan attempts a 3Pt. Wide open! Collin Bane is 6.0 feet away. [MAN] DESMOND JORDAN MAKES IT! Assist: Paolo Lowry
Score: 16-22

[03:10] Team_050 possession (Score: 16-22)
Collin Bane throws a bad pass out of bounds! TURNOVER! (dead ball)

[03:10] Substitution (Team_050): LeBron Bridges OUT → Luka Gasol IN (stamina_rule2)

[03:10] Substitution (Team_050): Donovan Trent OUT → Tyler Smith IN (stamina_rule2)

[02:53] Team_025 possession (Score: 16-22)
Desmond Jordan drives and kicks out. Cade Anthony attempts a Midrange. Contested by Luka Gasol (5.9 feet, MAN). CADE ANTHONY MAKES IT! Assist: Allen Embiid
Score: 16-24

[02:36] Team_050 possession (Score: 16-24)
Luka Gasol attempts a 3Pt. Contested by Cade Anthony (4.2 feet, MAN). Luka Gasol misses. Rebound secured by Cade Anthony.

[02:20] Team_025 possession (Score: 16-24)
Cade Anthony attempts a 3Pt. Wide open! Luka Gasol is 7.8 feet away. [MAN] CADE ANTHONY MAKES IT! Assist: Desmond Jordan
Score: 16-27

[02:05] Team_050 possession (Score: 16-27)
FOUL! Offensive foul on Joel Banchero! Ben Giddey drew the charge! [Team fouls: 4] (Joel Banchero: 1 personal fouls) TURNOVER! (dead ball)

[01:49] Team_025 possession (Score: 16-27)
Allen Embiid drives and kicks out. Ben Giddey attempts a Midrange. Contested by Joel Banchero (5.2 feet, MAN). BEN GIDDEY MAKES IT! Assist: Cade Anthony
Score: 16-29

[01:38] Team_050 possession (Score: 16-29)
Giannis LaVine attempts a 3Pt. Contested by Ben Giddey (4.6 feet, ZONE). Giannis LaVine misses. Rebound secured by Cade Anthony.

[01:25] Team_025 possession (Score: 16-29)
FOUL! Reach-in foul on Tyler Smith during the drive. [IN THE BONUS! 5 team fouls] Allen Embiid to the line for 2 free throws. (Tyler Smith: 1 personal fouls)   FT 1/2: GOOD   FT 2/2: GOOD Allen Embiid makes 2/2 from the line.
Score: 16-31

[01:14] Team_050 possession (Score: 16-31)
Tyler Smith attempts a Layup. Contested by Allen Embiid (3.8 feet, ZONE). TYLER SMITH MAKES IT! Assist: Joel Banchero
Score: 18-31

[00:57] Team_025 possession (Score: 18-31)
Allen Embiid drives, Tyler Smith stays with him. Allen Embiid attempts a Dunk. Contested by Tyler Smith (5.4 feet, ZONE). ALLEN EMBIID MAKES IT! Assist: Ben Giddey
Score: 18-33

[00:39] Team_050 possession (Score: 18-33)
FOUL! Offensive foul on Tyler Smith! Allen Embiid drew the charge! [Team fouls: 6] (Tyler Smith: 2 personal fouls) TURNOVER! (dead ball)

[00:21] Team_025 possession (Score: 18-33)
Desmond Jordan attempts a 3Pt. Contested by Collin Bane (4.1 feet, MAN). Desmond Jordan misses. Rebound secured by Tyler Smith.

[00:06] Team_050 possession (Score: 18-33)
Tyler Smith attempts a Layup. Heavily contested by Allen Embiid (1.9 feet, MAN)! Tyler Smith misses. Rebound secured by Cade Anthony.

================================================================================
                              1ST QUARTER COMPLETE                              
================================================================================

1ST QUARTER SCORE: Team_050 18, Team_025 33

BOX SCORE:
================================================================================

Team_050
--------------------------------------------------------------------------------
Player                MIN  PTS  REB  AST  TO      FG   FG%      3P   3P%
--------------------------------------------------------------------------------
Collin Bane            12    5    5    0   0   2/4    50.0     0/0   0.0
LeBron Bridges          9    4    3    2   0   2/2   100.0     0/0   0.0
Joel Banchero          12    3    1    2   0   1/3    33.3     0/0   0.0
Giannis LaVine         12    2    0    1   0   1/3    33.3     0/0   0.0
Tyler Smith             3    2    1    0   0   1/2    50.0     0/0   0.0
Donovan Trent           9    0    0    0   0   0/1     0.0     0/0   0.0
Luka Gasol              3    0    0    0   0   0/1     0.0     0/0   0.0

TEAM: FG: 7/16 (43.8%), 3PT: 1/5 (20.0%), REB: 10 (2 off, 8 def), AST: 5, TO: 8
TEAM FOULS: 6 [Team_025 in BONUS]


Team_025
--------------------------------------------------------------------------------
Player                MIN  PTS  REB  AST  TO      FG   FG%      3P   3P%
--------------------------------------------------------------------------------
Allen Embiid           12   12    2    1   0   6/8    75.0     0/0   0.0
Desmond Jordan         12    8    4    2   0   3/8    37.5     0/0   0.0
Ben Giddey             12    6    0    3   0   3/3   100.0     0/0   0.0
Cade Anthony           12    5    4    1   0   2/3    66.7     0/0   0.0
Paolo Lowry            12    0    0    2   0   0/0     0.0     0/0   0.0

TEAM: FG: 14/22 (63.6%), 3PT: 3/8 (37.5%), REB: 10 (1 off, 9 def), AST: 9, TO: 1
TEAM FOULS: 4

================================================================================

================================================================================
                       2ND QUARTER - Team_050 vs Team_025                       
================================================================================

[12:00] Team_050 possession (Score: 18-33)
Joel Banchero drives, picks up Ben Giddey. Help arrives from Desmond Jordan! Joel Banchero attempts a Layup. Heavily contested by Desmond Jordan (0.5 feet, MAN)! JOEL BANCHERO MAKES IT! Assist: Giannis LaVine
Score: 20-33

[11:50] Team_025 possession (Score: 20-33)
FOUL! Shooting foul on Donovan Trent. Cade Anthony to the line for 2 free throws. [Team fouls: 1] (Donovan Trent: 1 personal fouls)   FT 1/2: GOOD   FT 2/2: GOOD Cade Anthony makes 2/2 from the line.
Score: 20-35

[11:37] Team_050 possession (Score: 20-35)
Joel Banchero attempts a Midrange. Wide open! Ben Giddey is 9.4 feet away. [MAN] Joel Banchero misses. Rebound secured by Cade Anthony.

[11:22] Team_025 possession (Score: 20-35)
Ben Giddey drives and kicks out. Ben Giddey attempts a Midrange. Contested by LeBron Bridges (5.0 feet, ZONE). BEN GIDDEY MAKES IT!
Score: 20-37

[11:09] Team_050 possession (Score: 20-37)
Joel Banchero attempts a Layup. BLOCKED BY DESMOND JORDAN! Ball is loose! Offensive rebound by Donovan Trent! Donovan Trent kicks it out.

[10:57] Team_050 possession (Score: 20-37)
LeBron Bridges attempts a Layup. Contested by Cade Anthony (4.4 feet, MAN). LEBRON BRIDGES MAKES IT!
Score: 22-37

[10:41] Team_025 possession (Score: 22-37)
Desmond Jordan attempts a 3Pt. BLOCKED BY GIANNIS LAVINE! Ball is loose! Rebound secured by Donovan Trent.

[10:25] Team_050 possession (Score: 22-37)
Joel Banchero drives, picks up Allen Embiid. Help arrives from Ben Giddey! Joel Banchero attempts a Dunk. Contested by Ben Giddey (4.7 feet, ZONE). JOEL BANCHERO MAKES IT! Assist: Giannis LaVine
Score: 24-37

[10:08] Team_025 possession (Score: 24-37)
FOUL! Reach-in foul on Donovan Trent during the drive. [Team fouls: 2] No free throws, side out. (Donovan Trent: 2 personal fouls)

[09:50] Team_025 possession (Score: 24-37)
Desmond Jordan attempts a 3Pt. Wide open! Collin Bane is 6.0 feet away. [MAN] Desmond Jordan misses. Rebound secured by LeBron Bridges.

[09:34] Team_050 possession (Score: 24-37)
Giannis LaVine attempts a Midrange. Wide open! Paolo Lowry is 9.0 feet away. [MAN] Giannis LaVine misses. Rebound secured by Allen Embiid.

[09:23] Team_025 possession (Score: 24-37)
Allen Embiid drives and kicks out. Ben Giddey attempts a 3Pt. Contested by Joel Banchero (4.0 feet, MAN). BEN GIDDEY MAKES IT! Assist: Desmond Jordan
Score: 24-40

[09:09] Team_050 possession (Score: 24-40)
Collin Bane attempts a 3Pt. Contested by Desmond Jordan (3.4 feet, MAN). COLLIN BANE MAKES IT! Assist: LeBron Bridges
Score: 27-40

[08:52] Team_025 possession (Score: 27-40)
Allen Embiid drives, Donovan Trent stays with him. Allen Embiid attempts a Layup. Wide open! Donovan Trent is 6.7 feet away. [ZONE] ALLEN EMBIID MAKES IT!
Score: 27-42

[08:39] Team_050 possession (Score: 27-42)
LeBron Bridges makes the Layup and draws the foul on Cade Anthony! And-1! LeBron Bridges to the line for 1. [Team fouls: 1] (Cade Anthony: 1 personal fouls)   FT 1/1: GOOD LeBron Bridges makes 1/1 from the line.
Score: 30-42

[08:25] Team_025 possession (Score: 30-42)
Allen Embiid makes the Layup and draws the foul on Donovan Trent! And-1! Allen Embiid to the line for 1. [Team fouls: 3] (Donovan Trent: 3 personal fouls)   FT 1/1: GOOD Allen Embiid makes 1/1 from the line.
Score: 30-45

[08:12] Team_050 possession (Score: 30-45)
LeBron Bridges attempts a 3Pt. Wide open! Cade Anthony is 6.4 feet away. [MAN] LeBron Bridges misses. Offensive rebound by LeBron Bridges! LeBron Bridges kicks it out.

[08:02] Team_050 possession (Score: 30-45)
Giannis LaVine attempts a Midrange. Wide open! Paolo Lowry is 7.1 feet away. [MAN] Giannis LaVine misses. Rebound secured by Allen Embiid.

[07:47] Team_025 possession (Score: 30-45)
FOUL! Reach-in foul on Donovan Trent during the drive. [Team fouls: 4] No free throws, side out. (Donovan Trent: 4 personal fouls)

[07:37] Team_025 possession (Score: 30-45)
Allen Embiid makes the Layup and draws the foul on Donovan Trent! And-1! Allen Embiid to the line for 1. [BONUS: 5 team fouls] (Donovan Trent: 5 personal fouls)   FT 1/1: GOOD Allen Embiid makes 1/1 from the line.
Score: 30-48

[07:19] Team_050 possession (Score: 30-48)
Collin Bane attempts a 3Pt. Contested by Desmond Jordan (4.6 feet, MAN). Collin Bane misses. Rebound secured by Allen Embiid.

[07:05] Team_025 possession (Score: 30-48)
Desmond Jordan attempts a 3Pt. Contested by Collin Bane (2.9 feet, MAN). Desmond Jordan misses. Offensive rebound by Allen Embiid! Allen Embiid's putback is no good. Rebound secured by Collin Bane.

[06:53] Team_050 possession (Score: 30-48)
Collin Bane attempts a 3Pt. Wide open! Cade Anthony is 6.9 feet away. [ZONE] Collin Bane misses. Rebound secured by Cade Anthony.

[06:37] Team_025 possession (Score: 30-48)
Paolo Lowry attempts a 3Pt. Heavily contested by Giannis LaVine (1.3 feet, MAN)! Paolo Lowry misses. Offensive rebound by Allen Embiid! Allen Embiid puts it back in!
Score: 30-50

[06:22] Team_050 possession (Score: 30-50)
Collin Bane attempts a 3Pt. Contested by Desmond Jordan (2.5 feet, MAN). Collin Bane misses. Rebound secured by Desmond Jordan.

[06:05] Team_025 possession (Score: 30-50)
Ben Giddey attempts a 3Pt. Contested by Joel Banchero (3.5 feet, MAN). Ben Giddey misses. Rebound secured by Donovan Trent.

[05:49] Team_050 possession (Score: 30-50)
Donovan Trent drives, Allen Embiid stays with him. Donovan Trent attempts a Layup. Contested by Allen Embiid (3.9 feet, ZONE). DONOVAN TRENT MAKES IT! Assist: Giannis LaVine
Score: 32-50

[05:36] Team_025 possession (Score: 32-50)
Paolo Lowry attempts a Midrange. Contested by LeBron Bridges (3.2 feet, ZONE). PAOLO LOWRY MAKES IT!
Score: 32-52

[05:17] Team_050 possession (Score: 32-52)
LeBron Bridges attempts a 3Pt. Wide open! Cade Anthony is 8.3 feet away. [MAN] LeBron Bridges misses. Rebound secured by Cade Anthony.

[05:05] Team_025 possession (Score: 32-52)
Cade Anthony attempts a 3Pt. Wide open! Giannis LaVine is 6.5 feet away. [ZONE] Cade Anthony misses. Rebound secured by Collin Bane.

[04:55] Team_050 possession (Score: 32-52)
Joel Banchero attempts a Midrange. Wide open! Ben Giddey is 6.9 feet away. [MAN] JOEL BANCHERO MAKES IT!
Score: 34-52

[04:40] Team_025 possession (Score: 34-52)
Desmond Jordan drives and kicks out. Desmond Jordan attempts a 3Pt. Wide open! Giannis LaVine is 7.9 feet away. [ZONE] Desmond Jordan misses. Rebound secured by Collin Bane.

[04:23] Team_050 possession (Score: 34-52)
FOUL! Reach-in foul on Allen Embiid during the drive. [Team fouls: 2] No free throws, side out. (Allen Embiid: 1 personal fouls)

[04:05] Team_050 possession (Score: 34-52)
Collin Bane drives, Desmond Jordan stays with him. Collin Bane attempts a Layup. Wide open! Desmond Jordan is 7.4 feet away. [MAN] COLLIN BANE MAKES IT!
Score: 36-52

[03:49] Team_025 possession (Score: 36-52)
Paolo Lowry attempts a 3Pt. Wide open! Giannis LaVine is 7.2 feet away. [ZONE] Paolo Lowry misses. Rebound secured by Donovan Trent.

[03:30] Team_050 possession (Score: 36-52)
LeBron Bridges attempts a Midrange. Contested by Ben Giddey (3.0 feet, ZONE). LeBron Bridges misses. Rebound secured by Allen Embiid.

[03:12] Team_025 possession (Score: 36-52)
Desmond Jordan attempts a Midrange. Contested by Collin Bane (5.7 feet, MAN). Desmond Jordan misses. Rebound secured by LeBron Bridges.

[02:56] Team_050 possession (Score: 36-52)
Donovan Trent attempts a Midrange. Wide open! Allen Embiid is 6.4 feet away. [MAN] Donovan Trent misses. Rebound secured by Allen Embiid.

[02:43] Team_025 possession (Score: 36-52)
Desmond Jordan attempts a 3Pt. Contested by Giannis LaVine (4.7 feet, ZONE). DESMOND JORDAN MAKES IT! Assist: Paolo Lowry
Score: 36-55

[02:25] Team_050 possession (Score: 36-55)
Joel Banchero attempts a 3Pt. Contested by Ben Giddey (3.7 feet, MAN). JOEL BANCHERO MAKES IT! Assist: Collin Bane
Score: 39-55

[02:10] Team_025 possession (Score: 39-55)
Paolo Lowry attempts a 3Pt. Wide open! Giannis LaVine is 7.6 feet away. [MAN] Paolo Lowry misses. Rebound secured by LeBron Bridges.

[01:59] Team_050 possession (Score: 39-55)
Collin Bane attempts a 3Pt. Contested by Desmond Jordan (5.6 feet, MAN). Collin Bane misses. Rebound secured by Cade Anthony.

[01:44] Team_025 possession (Score: 39-55)
Paolo Lowry drives and kicks out. Cade Anthony attempts a 3Pt. Wide open! LeBron Bridges is 8.9 feet away. [MAN] CADE ANTHONY MAKES IT! Assist: Paolo Lowry
Score: 39-58

[01:27] Team_050 possession (Score: 39-58)
FOUL! Offensive foul on Donovan Trent! Allen Embiid drew the charge! [Team fouls: 6] (Donovan Trent: 6 personal fouls) TURNOVER! (dead ball)

[01:27] Substitution (Team_050): Donovan Trent OUT (stamina: 46) → Damian O'Neal IN (foul_out)

[01:13] Team_025 possession (Score: 39-58)
Paolo Lowry drives to the basket... Paolo Lowry throws a bad pass out of bounds! TURNOVER! (dead ball)

[01:13] Substitution (Team_050): Giannis LaVine OUT → Dwyane Towns IN (stamina_rule2)

[01:13] Substitution (Team_050): Joel Banchero OUT → Giannis LaVine IN (stamina_rule2)

[01:13] Substitution (Team_050): Collin Bane OUT → Larry Curry IN (stamina_rule2)

[01:13] Substitution (Team_050): LeBron Bridges OUT → Luka Gasol IN (stamina_rule2)

[01:13] Substitution (Team_025): Paolo Lowry OUT → LeBron Griffin IN (stamina_rule2)

[01:13] Substitution (Team_025): Ben Giddey OUT → Dirk Gilgeous-Alexander IN (stamina_rule2)

[01:13] Substitution (Team_025): Desmond Jordan OUT → Immanuel LaVine IN (stamina_rule2)

[01:13] Substitution (Team_025): Cade Anthony OUT → Damian Adebayo IN (stamina_rule2)

[01:13] Substitution (Team_025): Allen Embiid OUT → Nikola Lillard IN (stamina_rule2)

[01:00] Team_050 possession (Score: 39-58)
Dwyane Towns attempts a 3Pt. BLOCKED BY DIRK GILGEOUS-ALEXANDER! Ball is loose! Rebound secured by Nikola Lillard.

[00:43] Team_025 possession (Score: 39-58)
Immanuel LaVine attempts a Midrange. Contested by Larry Curry (2.2 feet, ZONE). Immanuel LaVine misses. Rebound secured by Larry Curry.

[00:26] Team_050 possession (Score: 39-58)
Luka Gasol attempts a Midrange. Wide open! Immanuel LaVine is 7.1 feet away. [ZONE] LUKA GASOL MAKES IT!
Score: 41-58

[00:13] Team_025 possession (Score: 41-58)
Dirk Gilgeous-Alexander drives and kicks out. Dirk Gilgeous-Alexander attempts a Midrange. Contested by Dwyane Towns (4.0 feet, MAN). Dirk Gilgeous-Alexander misses. Rebound secured by Larry Curry.

================================================================================
                              2ND QUARTER COMPLETE                              
================================================================================

2ND QUARTER SCORE: Team_050 23, Team_025 25

BOX SCORE:
================================================================================

Team_050
--------------------------------------------------------------------------------
Player                MIN  PTS  REB  AST  TO      FG   FG%      3P   3P%
--------------------------------------------------------------------------------
Joel Banchero          23    9    0    0   0   4/5    80.0     0/0   0.0
LeBron Bridges         20    5    4    1   0   2/4    50.0     0/0   0.0
Collin Bane            23    5    3    1   0   2/6    33.3     0/0   0.0
Donovan Trent          20    2    4    0   0   1/2    50.0     0/0   0.0
Luka Gasol              4    2    0    0   0   1/1   100.0     0/0   0.0
Giannis LaVine         24    0    0    3   0   0/2     0.0     0/0   0.0
Dwyane Towns            1    0    0    0   0   0/1     0.0     0/0   0.0
Larry Curry             1    0    2    0   0   0/0     0.0     0/0   0.0

TEAM: FG: 10/21 (47.6%), 3PT: 2/8 (25.0%), REB: 12 (2 off, 10 def), AST: 5, TO: 1
TEAM FOULS: 6 [Team_025 in BONUS]


Team_025
--------------------------------------------------------------------------------
Player                MIN  PTS  REB  AST  TO      FG   FG%      3P   3P%
--------------------------------------------------------------------------------
Allen Embiid           23   10    6    0   0   4/4   100.0     0/0   0.0
Cade Anthony           23    5    4    0   0   2/3    66.7     0/0   0.0
Ben Giddey             23    5    0    0   0   2/3    66.7     0/0   0.0
Desmond Jordan         23    3    1    1   0   1/6    16.7     0/0   0.0
Paolo Lowry            23    2    0    2   0   1/3    33.3     0/0   0.0
Nikola Lillard          1    0    1    0   0   0/0     0.0     0/0   0.0
Immanuel LaVine         1    0    0    0   0   0/1     0.0     0/0   0.0
Dirk Gilgeous-Alexander    1    0    0    0   0   0/1     0.0     0/0   0.0

TEAM: FG: 10/21 (47.6%), 3PT: 2/9 (22.2%), REB: 13 (2 off, 11 def), AST: 3, TO: 1
TEAM FOULS: 2

================================================================================

================================================================================
                       3RD QUARTER - Team_050 vs Team_025                       
================================================================================

[12:00] Team_050 possession (Score: 41-58)
Collin Bane attempts a Midrange. Heavily contested by Desmond Jordan (1.2 feet, MAN)! COLLIN BANE MAKES IT!
Score: 43-58

[11:42] Team_025 possession (Score: 43-58)
FOUL! Offensive foul on Desmond Jordan! Collin Bane drew the charge! [Team fouls: 1] (Desmond Jordan: 1 personal fouls) TURNOVER! (dead ball)

[11:26] Team_050 possession (Score: 43-58)
LeBron Bridges drives to the basket... LeBron Bridges throws a bad pass! Stolen by Allen Embiid! TURNOVER! (live ball)

[11:09] Team_025 possession (Score: 43-58)
Allen Embiid drives and kicks out. Allen Embiid attempts a 3Pt. Heavily contested by Donovan Trent (1.2 feet, MAN)! Allen Embiid misses. Rebound secured by Collin Bane.

[10:51] Team_050 possession (Score: 43-58)
Joel Banchero attempts a 3Pt. Contested by Ben Giddey (2.9 feet, MAN). Joel Banchero misses. FOUL! Loose ball foul on Cade Anthony during the rebound battle. [Team fouls: 2] No free throws, side out. (Cade Anthony: 1 personal fouls)

[10:35] Team_050 possession (Score: 43-58)
Giannis LaVine attempts a Midrange. Contested by Ben Giddey (4.1 feet, ZONE). Giannis LaVine misses. Rebound secured by Allen Embiid.

[10:16] Team_025 possession (Score: 43-58)
FOUL! Reach-in foul on Donovan Trent during the drive. [Team fouls: 1] No free throws, side out. (Donovan Trent: 1 personal fouls)

[10:00] Team_025 possession (Score: 43-58)
FOUL! Shooting foul on Donovan Trent. Cade Anthony to the line for 2 free throws. [Team fouls: 2] (Donovan Trent: 2 personal fouls)   FT 1/2: GOOD   FT 2/2: GOOD Cade Anthony makes 2/2 from the line.
Score: 43-60

[09:47] Team_050 possession (Score: 43-60)
Giannis LaVine attempts a 3Pt. Contested by Ben Giddey (2.8 feet, ZONE). Giannis LaVine misses. Rebound secured by Desmond Jordan.

[09:31] Team_025 possession (Score: 43-60)
Paolo Lowry attempts a Layup. BLOCKED BY DONOVAN TRENT! Ball is loose! Offensive rebound by Desmond Jordan! Desmond Jordan kicks it out.

[09:16] Team_025 possession (Score: 43-60)
Paolo Lowry attempts a Midrange. Heavily contested by LeBron Bridges (1.9 feet, ZONE)! PAOLO LOWRY MAKES IT!
Score: 43-62

[09:05] Team_050 possession (Score: 43-62)
Donovan Trent drives, Allen Embiid stays with him. Donovan Trent attempts a Layup. Contested by Allen Embiid (2.7 feet, MAN). DONOVAN TRENT MAKES IT! Assist: LeBron Bridges
Score: 45-62

[08:50] Team_025 possession (Score: 45-62)
Cade Anthony attempts a Layup. BLOCKED BY JOEL BANCHERO! Ball deflects out of bounds off Cade Anthony.

[08:32] Team_050 possession (Score: 45-62)
Donovan Trent attempts a Midrange. Heavily contested by Allen Embiid (1.1 feet, MAN)! Donovan Trent misses. Rebound secured by Cade Anthony.

[08:18] Team_025 possession (Score: 45-62)
Paolo Lowry attempts a 3Pt. Wide open! Giannis LaVine is 9.5 feet away. [ZONE] PAOLO LOWRY MAKES IT! Assist: Desmond Jordan
Score: 45-65

[08:08] Team_050 possession (Score: 45-65)
LeBron Bridges drives, Allen Embiid stays with him. LeBron Bridges attempts a Dunk. Contested by Allen Embiid (3.0 feet, ZONE). LeBron Bridges misses. Rebound secured by Allen Embiid.

[07:52] Team_025 possession (Score: 45-65)
Desmond Jordan drives, picks up Collin Bane. Help arrives from Joel Banchero! Desmond Jordan attempts a Layup. Heavily contested by Joel Banchero (1.2 feet, MAN)! DESMOND JORDAN MAKES IT! Assist: Paolo Lowry
Score: 45-67

[07:34] Team_050 possession (Score: 45-67)
Collin Bane attempts a 3Pt. Contested by Desmond Jordan (2.8 feet, MAN). Collin Bane misses. Rebound secured by Allen Embiid.

[07:15] Team_025 possession (Score: 45-67)
Allen Embiid makes the Layup and draws the foul on Joel Banchero! And-1! Allen Embiid to the line for 1. [Team fouls: 3] (Joel Banchero: 1 personal fouls)   FT 1/1: GOOD Allen Embiid makes 1/1 from the line.
Score: 45-70

[07:01] Team_050 possession (Score: 45-70)
Collin Bane attempts a 3Pt. Heavily contested by Ben Giddey (0.5 feet, ZONE)! Collin Bane misses. Rebound secured by Desmond Jordan.

[06:45] Team_025 possession (Score: 45-70)
Desmond Jordan attempts a 3Pt. Contested by Giannis LaVine (3.7 feet, ZONE). Desmond Jordan misses. Rebound secured by Collin Bane.

[06:29] Team_050 possession (Score: 45-70)
Collin Bane attempts a Layup. Heavily contested by Desmond Jordan (0.5 feet, MAN)! COLLIN BANE MAKES IT! Assist: Joel Banchero
Score: 47-70

[06:14] Team_025 possession (Score: 47-70)
Ben Giddey attempts a Layup. Contested by Joel Banchero (4.8 feet, MAN). BEN GIDDEY MAKES IT! Assist: Allen Embiid
Score: 47-72

[06:02] Team_050 possession (Score: 47-72)
Giannis LaVine attempts a 3Pt. Contested by Cade Anthony (5.1 feet, ZONE). Giannis LaVine misses. Rebound secured by Allen Embiid.

[05:47] Team_025 possession (Score: 47-72)
Ben Giddey drives, Donovan Trent stays with him. Ben Giddey attempts a Dunk. Contested by Donovan Trent (4.9 feet, ZONE). BEN GIDDEY MAKES IT! Assist: Allen Embiid
Score: 47-74

[05:37] Team_050 possession (Score: 47-74)
LeBron Bridges attempts a 3Pt. Contested by Paolo Lowry (3.8 feet, ZONE). LeBron Bridges misses. Rebound secured by Desmond Jordan.

[05:22] Team_025 possession (Score: 47-74)
Allen Embiid attempts a Layup. Wide open! Donovan Trent is 6.9 feet away. [ZONE] ALLEN EMBIID MAKES IT!
Score: 47-76

[05:07] Team_050 possession (Score: 47-76)
Joel Banchero attempts a 3Pt. Heavily contested by Ben Giddey (1.9 feet, MAN)! JOEL BANCHERO MAKES IT! Assist: LeBron Bridges
Score: 50-76

[04:54] Team_025 possession (Score: 50-76)
Cade Anthony attempts a Layup. BLOCKED BY JOEL BANCHERO! Ball is loose! Rebound secured by LeBron Bridges.

[04:37] Team_050 possession (Score: 50-76)
LeBron Bridges attempts a 3Pt. Contested by Ben Giddey (5.1 feet, ZONE). LEBRON BRIDGES MAKES IT! Assist: Giannis LaVine
Score: 53-76

[04:22] Team_025 possession (Score: 53-76)
Ben Giddey attempts a 3Pt. Contested by Giannis LaVine (5.1 feet, ZONE). BEN GIDDEY MAKES IT! Assist: Cade Anthony
Score: 53-79

[04:04] Team_050 possession (Score: 53-79)
FOUL! Shooting foul on Allen Embiid. Joel Banchero to the line for 2 free throws. [Team fouls: 3] (Allen Embiid: 1 personal fouls)   FT 1/2: GOOD   FT 2/2: GOOD Joel Banchero makes 2/2 from the line.
Score: 55-79

[03:50] Team_025 possession (Score: 55-79)
Desmond Jordan attempts a Layup. Contested by Donovan Trent (3.1 feet, ZONE). DESMOND JORDAN MAKES IT!
Score: 55-81

[03:40] Team_050 possession (Score: 55-81)
Collin Bane drives and kicks out. Donovan Trent attempts a Midrange. Wide open! Paolo Lowry is 6.5 feet away. [ZONE] Donovan Trent misses. Rebound secured by Cade Anthony.

[03:27] Team_025 possession (Score: 55-81)
Ben Giddey attempts a 3Pt. Wide open! Giannis LaVine is 6.7 feet away. [ZONE] Ben Giddey misses. Rebound secured by Collin Bane.

[03:13] Team_050 possession (Score: 55-81)
Giannis LaVine drives, picks up Paolo Lowry. Help arrives from Desmond Jordan! Giannis LaVine attempts a Dunk. Contested by Desmond Jordan (4.4 feet, MAN). GIANNIS LAVINE MAKES IT!
Score: 57-81

[02:58] Team_025 possession (Score: 57-81)
Allen Embiid drives and kicks out. Paolo Lowry attempts a 3Pt. Contested by Giannis LaVine (5.9 feet, ZONE). Paolo Lowry misses. Rebound secured by Joel Banchero.

[02:45] Team_050 possession (Score: 57-81)
Giannis LaVine attempts a 3Pt. Contested by Ben Giddey (4.2 feet, ZONE). Giannis LaVine misses. FOUL! Loose ball foul on Cade Anthony during the rebound battle. [Team fouls: 4] No free throws, side out. (Cade Anthony: 2 personal fouls)

[02:30] Team_050 possession (Score: 57-81)
Joel Banchero loses the ball! Stripped by Ben Giddey! TURNOVER! (live ball)

[02:14] Team_025 possession (Score: 57-81)
Cade Anthony attempts a 3Pt. Wide open! LeBron Bridges is 8.2 feet away. [MAN] Cade Anthony misses. Rebound secured by LeBron Bridges.

[01:59] Team_050 possession (Score: 57-81)
Donovan Trent attempts a Layup. Heavily contested by Allen Embiid (0.7 feet, MAN)! DONOVAN TRENT MAKES IT!
Score: 59-81

[01:46] Team_025 possession (Score: 59-81)
Cade Anthony drives and kicks out. Cade Anthony attempts a 3Pt. Contested by Giannis LaVine (2.7 feet, ZONE). Cade Anthony misses. Rebound secured by LeBron Bridges.

[01:33] Team_050 possession (Score: 59-81)
Donovan Trent attempts a Layup. Contested by Allen Embiid (3.6 feet, ZONE). Donovan Trent misses. Offensive rebound by LeBron Bridges! LeBron Bridges kicks it out.

[01:20] Team_050 possession (Score: 59-81)
Collin Bane drives to the basket... Collin Bane loses the ball! Stripped by Desmond Jordan! TURNOVER! (live ball)

[01:04] Team_025 possession (Score: 59-81)
Desmond Jordan drives and kicks out. Allen Embiid attempts a 3Pt. Contested by Donovan Trent (5.2 feet, MAN). Allen Embiid misses. Rebound secured by Joel Banchero.

[00:47] Team_050 possession (Score: 59-81)
Giannis LaVine attempts a 3Pt. Contested by Paolo Lowry (4.9 feet, MAN). GIANNIS LAVINE MAKES IT! Assist: Donovan Trent
Score: 62-81

[00:36] Team_025 possession (Score: 62-81)
Desmond Jordan drives, Collin Bane stays with him. Desmond Jordan attempts a Dunk. Contested by Collin Bane (4.2 feet, MAN). Desmond Jordan misses. Offensive rebound by Desmond Jordan! Desmond Jordan's putback is no good. Rebound secured by Joel Banchero.

[00:22] Team_050 possession (Score: 62-81)
Giannis LaVine drives to the basket... FOUL! Offensive foul on Giannis LaVine! Paolo Lowry drew the charge! [Team fouls: 4] (Giannis LaVine: 1 personal fouls) TURNOVER! (dead ball)

[00:06] Team_025 possession (Score: 62-81)
Allen Embiid makes the Dunk and draws the foul on Donovan Trent! And-1! Allen Embiid to the line for 1. [BONUS: 5 team fouls] (Donovan Trent: 3 personal fouls)   FT 1/1: GOOD Allen Embiid makes 1/1 from the line.
Score: 62-84

================================================================================
                              3RD QUARTER COMPLETE                              
================================================================================

3RD QUARTER SCORE: Team_050 21, Team_025 26

BOX SCORE:
================================================================================

Team_050
--------------------------------------------------------------------------------
Player                MIN  PTS  REB  AST  TO      FG   FG%      3P   3P%
--------------------------------------------------------------------------------
Giannis LaVine         36    5    0    1   0   2/5    40.0     0/0   0.0
Collin Bane            35    4    4    0   0   2/5    40.0     0/0   0.0
Donovan Trent          32    4    0    1   0   2/3    66.7     0/0   0.0
LeBron Bridges         32    3    5    2   0   1/3    33.3     0/0   0.0

TEAM: FG: 9/18 (50.0%), 3PT: 3/8 (37.5%), REB: 11 (3 off, 8 def), AST: 5, TO: 4
TEAM FOULS: 5 [Team_025 in BONUS]


Team_025
--------------------------------------------------------------------------------
Player                MIN  PTS  REB  AST  TO      FG   FG%      3P   3P%
--------------------------------------------------------------------------------
Allen Embiid           35    8    4    2   0   3/5    60.0     0/0   0.0
Ben Giddey             35    7    0    0   0   3/4    75.0     0/0   0.0
Paolo Lowry            35    5    0    1   0   2/2   100.0     0/0   0.0
Joel Banchero          35    5    3    1   0   2/2   100.0     0/0   0.0
Desmond Jordan         35    4    4    1   0   2/5    40.0     0/0   0.0
Cade Anthony           35    2    2    1   0   1/5    20.0     0/0   0.0

TEAM: FG: 11/21 (52.4%), 3PT: 2/5 (40.0%), REB: 11 (2 off, 9 def), AST: 5, TO: 1
TEAM FOULS: 4

================================================================================

================================================================================
                       4TH QUARTER - Team_050 vs Team_025                       
================================================================================

[12:00] Substitution (Team_050): Giannis LaVine OUT (stamina: 70) → Damian O'Neal IN (comeback_detected)

[12:00] Substitution (Team_025): Paolo Lowry OUT (stamina: 70) → LeBron Griffin IN (comeback_detected)

[12:00] Team_050 possession (Score: 62-84)
Donovan Trent attempts a Layup. Contested by Allen Embiid (3.8 feet, ZONE). DONOVAN TRENT MAKES IT!
Score: 64-84

[11:45] Team_025 possession (Score: 64-84)
Cade Anthony drives, LeBron Bridges stays with him. Cade Anthony attempts a Layup. Contested by LeBron Bridges (3.4 feet, MAN). CADE ANTHONY MAKES IT! Assist: Desmond Jordan
Score: 64-86

[11:32] Team_050 possession (Score: 64-86)
LeBron Bridges attempts a Layup. Contested by Cade Anthony (5.4 feet, MAN). LEBRON BRIDGES MAKES IT! Assist: Damian O'Neal
Score: 66-86

[11:17] Team_025 possession (Score: 66-86)
LeBron Griffin drives and kicks out. Ben Giddey makes the Midrange and draws the foul on Joel Banchero! And-1! Ben Giddey to the line for 1. [Team fouls: 1] (Joel Banchero: 1 personal fouls)   FT 1/1: GOOD Ben Giddey makes 1/1 from the line.
Score: 66-89

[11:05] Team_050 possession (Score: 66-89)
FOUL! Reach-in foul on Allen Embiid during the drive. [Team fouls: 1] No free throws, side out. (Allen Embiid: 1 personal fouls)

[10:55] Team_050 possession (Score: 66-89)
Donovan Trent drives, Allen Embiid stays with him. Donovan Trent attempts a Layup. Contested by Allen Embiid (2.1 feet, ZONE). DONOVAN TRENT MAKES IT! Assist: Collin Bane
Score: 68-89

[10:44] Team_025 possession (Score: 68-89)
Desmond Jordan attempts a 3Pt. Contested by Joel Banchero (4.0 feet, ZONE). DESMOND JORDAN MAKES IT! Assist: LeBron Griffin
Score: 68-92

[10:31] Team_050 possession (Score: 68-92)
Joel Banchero attempts a Layup. Heavily contested by Allen Embiid (1.3 feet, ZONE)! Joel Banchero misses. Rebound secured by Cade Anthony.

[10:11] Team_025 possession (Score: 68-92)
Cade Anthony attempts a 3Pt. Contested by LeBron Bridges (5.3 feet, MAN). Cade Anthony misses. Offensive rebound by Desmond Jordan! Desmond Jordan's putback is no good. Offensive rebound by Allen Embiid! Allen Embiid kicks it out.

[09:54] Team_025 possession (Score: 68-92)
LeBron Griffin loses control! Ball rolls out of bounds! TURNOVER! (dead ball)

[09:54] Substitution (Team_050): Joel Banchero OUT → Dwyane Towns IN (stamina_rule2)

[09:54] Substitution (Team_050): Collin Bane OUT → Larry Curry IN (stamina_rule2)

[09:54] Substitution (Team_050): LeBron Bridges OUT → Luka Gasol IN (stamina_rule2)

[09:54] Substitution (Team_050): Donovan Trent OUT → Tyler Smith IN (stamina_rule2)

[09:54] Substitution (Team_025): Ben Giddey OUT → Dirk Gilgeous-Alexander IN (stamina_rule2)

[09:54] Substitution (Team_025): Desmond Jordan OUT → Immanuel LaVine IN (stamina_rule2)

[09:54] Substitution (Team_025): Cade Anthony OUT → Damian Adebayo IN (stamina_rule2)

[09:54] Substitution (Team_025): Allen Embiid OUT → Nikola Lillard IN (stamina_rule2)

[09:43] Team_050 possession (Score: 68-92)
FOUL! Holding foul on Damian Adebayo. [Team fouls: 2] No free throws, side out. (Damian Adebayo: 1 personal fouls)

[09:27] Team_050 possession (Score: 68-92)
Damian O'Neal attempts a Midrange. Heavily contested by LeBron Griffin (1.9 feet, MAN)! DAMIAN O'NEAL MAKES IT!
Score: 70-92

[09:15] Team_025 possession (Score: 70-92)
Damian Adebayo makes the Midrange and draws the foul on Larry Curry! And-1! Damian Adebayo to the line for 1. [Team fouls: 2] (Larry Curry: 1 personal fouls)   FT 1/1: GOOD Damian Adebayo makes 1/1 from the line.
Score: 70-95

[08:58] Team_050 possession (Score: 70-95)
Larry Curry attempts a 3Pt. Wide open! Immanuel LaVine is 6.8 feet away. [MAN] Larry Curry misses. Rebound secured by Nikola Lillard.

[08:43] Team_025 possession (Score: 70-95)
Nikola Lillard drives to the basket... Nikola Lillard throws a bad pass! Stolen by Tyler Smith! TURNOVER! (live ball)

[08:31] Team_050 possession (Score: 70-95)
Tyler Smith attempts a Layup. BLOCKED BY NIKOLA LILLARD! Ball is loose! Rebound secured by Dirk Gilgeous-Alexander.

[08:19] Team_025 possession (Score: 70-95)
Dirk Gilgeous-Alexander attempts a Midrange. Wide open! Dwyane Towns is 6.8 feet away. [MAN] Dirk Gilgeous-Alexander misses. Offensive rebound by Immanuel LaVine! Immanuel LaVine kicks it out.

[08:03] Team_025 possession (Score: 70-95)
Damian Adebayo attempts a 3Pt. Contested by Luka Gasol (5.0 feet, ZONE). Damian Adebayo misses. Offensive rebound by Immanuel LaVine! Immanuel LaVine kicks it out.

[07:44] Team_025 possession (Score: 70-95)
Immanuel LaVine attempts a Midrange. Contested by Dwyane Towns (4.3 feet, ZONE). IMMANUEL LAVINE MAKES IT! Assist: Damian Adebayo
Score: 70-97

[07:28] Team_050 possession (Score: 70-97)
Larry Curry attempts a 3Pt. Contested by Immanuel LaVine (3.8 feet, MAN). LARRY CURRY MAKES IT! Assist: Luka Gasol
Score: 73-97

[07:09] Team_025 possession (Score: 73-97)
LeBron Griffin attempts a Midrange. Contested by Damian O'Neal (4.7 feet, MAN). LeBron Griffin misses. Rebound secured by Larry Curry.

[07:00] Team_050 possession (Score: 73-97)
FOUL! Shooting foul on LeBron Griffin. Tyler Smith to the line for 2 free throws. [Team fouls: 3] (LeBron Griffin: 1 personal fouls)   FT 1/2: MISS   FT 2/2: GOOD Tyler Smith makes 1/2 from the line.
Score: 74-97

[06:44] Team_025 possession (Score: 74-97)
LeBron Griffin attempts a Layup. BLOCKED BY TYLER SMITH! Ball is loose! Rebound secured by Tyler Smith.

[06:30] Team_050 possession (Score: 74-97)
Larry Curry attempts a 3Pt. Heavily contested by Damian Adebayo (1.7 feet, ZONE)! LARRY CURRY MAKES IT! Assist: Dwyane Towns
Score: 77-97

[06:16] Team_025 possession (Score: 77-97)
Dirk Gilgeous-Alexander attempts a 3Pt. Contested by Dwyane Towns (3.6 feet, MAN). DIRK GILGEOUS-ALEXANDER MAKES IT! Assist: Damian Adebayo
Score: 77-100

[06:05] Team_050 possession (Score: 77-100)
Tyler Smith attempts a Midrange. Contested by Nikola Lillard (3.0 feet, MAN). TYLER SMITH MAKES IT!
Score: 79-100

[05:51] Team_025 possession (Score: 79-100)
LeBron Griffin attempts a 3Pt. Heavily contested by Luka Gasol (1.7 feet, ZONE)! LEBRON GRIFFIN MAKES IT! Assist: Damian Adebayo
Score: 79-103

[05:37] Team_050 possession (Score: 79-103)
Dwyane Towns commits a violation (traveling/carry)! TURNOVER! (dead ball)

[05:19] Team_025 possession (Score: 79-103)
Dirk Gilgeous-Alexander drives and kicks out. Dirk Gilgeous-Alexander attempts a Midrange. Contested by Dwyane Towns (4.8 feet, MAN). DIRK GILGEOUS-ALEXANDER MAKES IT!
Score: 79-105

[05:05] Team_050 possession (Score: 79-105)
Dwyane Towns attempts a 3Pt. Wide open! LeBron Griffin is 7.4 feet away. [ZONE] Dwyane Towns misses. Offensive rebound by Larry Curry! Larry Curry kicks it out.

[04:54] Team_050 possession (Score: 79-105)
Luka Gasol drives to the basket... FOUL! Offensive foul on Luka Gasol! Nikola Lillard drew the charge! [Team fouls: 3] (Luka Gasol: 1 personal fouls) TURNOVER! (dead ball)

[04:37] Team_025 possession (Score: 79-105)
Dirk Gilgeous-Alexander attempts a 3Pt. Contested by Dwyane Towns (4.9 feet, MAN). Dirk Gilgeous-Alexander misses. Rebound secured by Dwyane Towns.

[04:22] Team_050 possession (Score: 79-105)
Damian O'Neal attempts a 3Pt. Contested by LeBron Griffin (3.9 feet, ZONE). Damian O'Neal misses. Rebound secured by Dirk Gilgeous-Alexander.

[04:08] Team_025 possession (Score: 79-105)
LeBron Griffin drives, Tyler Smith stays with him. LeBron Griffin attempts a Dunk. Heavily contested by Tyler Smith (1.9 feet, ZONE)! LeBron Griffin misses. Rebound secured by Dwyane Towns.

[03:54] Team_050 possession (Score: 79-105)
Damian O'Neal attempts a 3Pt. Contested by LeBron Griffin (2.8 feet, MAN). DAMIAN O'NEAL MAKES IT! Assist: Larry Curry
Score: 82-105

[03:39] Team_025 possession (Score: 82-105)
Dirk Gilgeous-Alexander attempts a Layup. Contested by Dwyane Towns (5.2 feet, MAN). DIRK GILGEOUS-ALEXANDER MAKES IT! Assist: Damian Adebayo
Score: 82-107

[03:24] Team_050 possession (Score: 82-107)
Luka Gasol drives to the basket... Luka Gasol loses control! Ball rolls out of bounds! TURNOVER! (dead ball)

[03:09] Team_025 possession (Score: 82-107)
Damian Adebayo attempts a Midrange. Contested by Luka Gasol (5.3 feet, MAN). DAMIAN ADEBAYO MAKES IT! Assist: Immanuel LaVine
Score: 82-109

[02:55] Team_050 possession (Score: 82-109)
Damian O'Neal drives and kicks out. Larry Curry attempts a 3Pt. Contested by LeBron Griffin (3.2 feet, ZONE). Larry Curry misses. Rebound secured by Immanuel LaVine.

[02:43] Team_025 possession (Score: 82-109)
Dirk Gilgeous-Alexander attempts a 3Pt. Contested by Larry Curry (3.7 feet, ZONE). Dirk Gilgeous-Alexander misses. Offensive rebound by Nikola Lillard! Nikola Lillard kicks it out.

[02:29] Team_025 possession (Score: 82-109)
Nikola Lillard attempts a 3Pt. Contested by Luka Gasol (2.7 feet, ZONE). NIKOLA LILLARD MAKES IT! Assist: Dirk Gilgeous-Alexander
Score: 82-112

[02:16] Team_050 possession (Score: 82-112)
Luka Gasol drives, Damian Adebayo stays with him. Luka Gasol attempts a Layup. Contested by Damian Adebayo (4.8 feet, MAN). Luka Gasol misses. Rebound secured by Dirk Gilgeous-Alexander.

[02:03] Team_025 possession (Score: 82-112)
FOUL! Reach-in foul on Tyler Smith during the drive. [Team fouls: 4] No free throws, side out. (Tyler Smith: 1 personal fouls)

[01:49] Team_025 possession (Score: 82-112)
Dirk Gilgeous-Alexander attempts a 3Pt. Contested by Luka Gasol (3.5 feet, ZONE). Dirk Gilgeous-Alexander misses. Rebound secured by Tyler Smith.

[01:34] Team_050 possession (Score: 82-112)
Luka Gasol attempts a 3Pt. Contested by LeBron Griffin (4.4 feet, ZONE). Luka Gasol misses. Rebound secured by Nikola Lillard.

[01:20] Team_025 possession (Score: 82-112)
Damian Adebayo attempts a Midrange. Contested by Luka Gasol (2.3 feet, MAN). DAMIAN ADEBAYO MAKES IT!
Score: 82-114

[01:07] Team_050 possession (Score: 82-114)
Dwyane Towns makes the Layup and draws the foul on Nikola Lillard! And-1! Dwyane Towns to the line for 1. [Team fouls: 4] (Nikola Lillard: 1 personal fouls)   FT 1/1: GOOD Dwyane Towns makes 1/1 from the line.
Score: 85-114

[00:52] Team_025 possession (Score: 85-114)
Nikola Lillard attempts a Midrange. Wide open! Tyler Smith is 9.0 feet away. [MAN] Nikola Lillard misses. Rebound secured by Larry Curry.

[00:39] Team_050 possession (Score: 85-114)
FOUL! Shooting foul on Immanuel LaVine. Larry Curry to the line for 2 free throws. [BONUS: 5 team fouls] (Immanuel LaVine: 1 personal fouls)   FT 1/2: GOOD   FT 2/2: MISS Larry Curry makes 1/2 from the line. Rebound secured by Nikola Lillard.
Score: 86-114

[00:24] Team_025 possession (Score: 86-114)
LeBron Griffin drives, picks up Tyler Smith. Help arrives from Dwyane Towns! LeBron Griffin attempts a Dunk. Contested by Dwyane Towns (5.6 feet, ZONE). LEBRON GRIFFIN MAKES IT! Assist: Immanuel LaVine
Score: 86-116

[00:10] Team_050 possession (Score: 86-116)
Tyler Smith loses control! Ball rolls out of bounds! TURNOVER! (dead ball)

================================================================================
                              4TH QUARTER COMPLETE                              
================================================================================

4TH QUARTER SCORE: Team_050 24, Team_025 32

BOX SCORE:
================================================================================

Team_050
--------------------------------------------------------------------------------
Player                MIN  PTS  REB  AST  TO      FG   FG%      3P   3P%
--------------------------------------------------------------------------------
Larry Curry            11    6    3    1   0   2/4    50.0     0/0   0.0
Damian O'Neal          13    5    0    1   0   2/4    50.0     0/0   0.0
Donovan Trent          34    4    0    0   0   2/2   100.0     0/0   0.0
Tyler Smith            13    3    2    0   0   2/3    66.7     0/0   0.0
Dwyane Towns           11    3    2    1   0   1/1   100.0     0/0   0.0
LeBron Bridges         34    2    0    0   0   1/1   100.0     0/0   0.0
Collin Bane            38    0    0    1   0   0/0     0.0     0/0   0.0
Joel Banchero          38    0    0    0   0   0/1     0.0     0/0   0.0
Luka Gasol             14    0    0    1   0   0/2     0.0     0/0   0.0

TEAM: FG: 10/18 (55.6%), 3PT: 3/6 (50.0%), REB: 7 (1 off, 6 def), AST: 5, TO: 4
TEAM FOULS: 4


Team_025
--------------------------------------------------------------------------------
Player                MIN  PTS  REB  AST  TO      FG   FG%      3P   3P%
--------------------------------------------------------------------------------
Damian Adebayo         11    7    0    4   0   3/3   100.0     0/0   0.0
Dirk Gilgeous-Alexander   11    7    3    1   0   3/5    60.0     0/0   0.0
LeBron Griffin         13    5    0    1   0   2/5    40.0     0/0   0.0
Desmond Jordan         38    3    0    1   0   1/1   100.0     0/0   0.0
Ben Giddey             38    3    0    0   0   1/1   100.0     0/0   0.0
Nikola Lillard         11    3    4    0   0   1/2    50.0     0/0   0.0
Cade Anthony           38    2    1    0   0   1/1   100.0     0/0   0.0
Immanuel LaVine        11    2    3    2   0   1/1   100.0     0/0   0.0
Allen Embiid           38    0    1    0   0   0/0     0.0     0/0   0.0

TEAM: FG: 13/19 (68.4%), 3PT: 4/6 (66.7%), REB: 12 (4 off, 8 def), AST: 9, TO: 2
TEAM FOULS: 5 [Team_050 in BONUS]

================================================================================

================================================================================
                               FULL GAME COMPLETE                               
================================================================================

FINAL SCORE: Team_050 86, Team_025 116

SCORING BY QUARTER:
--------------------------------------------------------------------------------
Team                     Q1     Q2     Q3     Q4    FINAL
--------------------------------------------------------------------------------
Team_050                 18     23     21     24       86
Team_025                 33     25     26     32      116
--------------------------------------------------------------------------------

FULL GAME BOX SCORE:
================================================================================

Team_050
--------------------------------------------------------------------------------
Player                MIN  PTS  REB  AST  TO      FG   FG%      3P   3P%      FT STL BLK
--------------------------------------------------------------------------------
Joel Banchero          38   17    4    3   5   6/10   60.0   2/3    66.7   2/2     0   2
Collin Bane            38   14   12    2   3   6/15   40.0   2/9    22.2   3/3     0   0
Giannis LaVine         36    7    0    5   1   3/10   30.0   1/4    25.0   0/0     0   1
LeBron Bridges         34   14   12    5   0   6/10   60.0   1/3    33.3   1/1     0   0
Donovan Trent          34   10    4    1   3   6/9    66.7   0/0     0.0   0/1     0   1
Luka Gasol             14    2    0    1   1   1/4    25.0   0/2     0.0   0/0     0   0
Damian O'Neal          13    5    0    1   0   2/4    50.0   1/2    50.0   0/0     0   0
Tyler Smith            13    5    3    0   3   3/5    60.0   0/0     0.0   1/2     1   1
Dwyane Towns           11    3    2    1   1   1/2    50.0   0/1     0.0   1/1     0   0
Larry Curry            11    6    5    1   0   2/4    50.0   2/3    66.7   1/2     0   0

TEAM: FG: 36/73 (49.3%), 3PT: 9/27 (33.3%), REB: 40 (8 off, 32 def), AST: 20, TO: 17


Team_025
--------------------------------------------------------------------------------
Player                MIN  PTS  REB  AST  TO      FG   FG%      3P   3P%      FT STL BLK
--------------------------------------------------------------------------------
Ben Giddey             38   21    0    3   1   5/7    71.4   1/3    33.3   1/1     1   0
Desmond Jordan         38   18    9    5   1   8/21   38.1   4/11   36.4   4/5     1   1
Cade Anthony           38   14   11    2   1   6/12   50.0   1/4    25.0   4/4     0   0
Allen Embiid           38   30   13    3   0  13/17   76.5   0/1     0.0   6/6     1   0
Paolo Lowry            35    7    0    5   0   5/7    71.4   2/4    50.0   0/0     0   0
LeBron Griffin         13    5    0    1   1   3/6    50.0   1/1   100.0   0/0     0   0
Dirk Gilgeous-Alexander   11    7    3    1   0   3/6    50.0   1/3    33.3   0/0     0   1
Immanuel LaVine        11    2    3    2   0   1/2    50.0   0/0     0.0   0/0     0   0
Damian Adebayo         11    7    0    4   0   3/3   100.0   0/0     0.0   1/1     0   0
Nikola Lillard         11    3    5    0   1   1/2    50.0   1/1   100.0   0/0     0   1

TEAM: FG: 48/83 (57.8%), 3PT: 11/28 (39.3%), REB: 46 (9 off, 37 def), AST: 26, TO: 5

================================================================================
